player [EvanPlayer] gets hole card ['C3', 'S4'], current stack 1000
player [ZifengFoldMan] gets hole card ['S7', 'H2'], current stack 995
player [JoyoPlayer] gets hole card ['CK', 'SK'], current stack 990
player [YueShi] gets hole card ['C7', 'SQ'], current stack 1000
player [Finneas] gets hole card ['SA', 'HK'], current stack 1000
player [Yuchun] gets hole card ['DQ', 'D8'], current stack 1000
player [Zheng] gets hole card ['CQ', 'D6'], current stack 1000
player [RaphaelPlayer] gets hole card ['DT', 'C4'], current stack 1000
Started the round 1
Street "preflop" started. (community card = [])
"YueShi" declared "fold:0"
"Finneas" declared "raise:507"
"Yuchun" declared "fold:0"
"Zheng" declared "fold:0"
"RaphaelPlayer" declared "fold:0"
"EvanPlayer" declared "fold:507"
"ZifengFoldMan" declared "fold:0"
"JoyoPlayer" declared "raise:-2"
"['Finneas']" won the round 1 (stack = {'EvanPlayer': 1000, 'ZifengFoldMan': 995, 'JoyoPlayer': 990, 'YueShi': 1000, 'Finneas': 1015, 'Yuchun': 1000, 'Zheng': 1000, 'RaphaelPlayer': 1000})
player [EvanPlayer] gets hole card ['H4', 'DQ'], current stack 1000
player [ZifengFoldMan] gets hole card ['H3', 'C4'], current stack 995
player [JoyoPlayer] gets hole card ['D4', 'CT'], current stack 985
player [YueShi] gets hole card ['S4', 'S5'], current stack 990
player [Finneas] gets hole card ['H2', 'DT'], current stack 1015
player [Yuchun] gets hole card ['C7', 'C8'], current stack 1000
player [Zheng] gets hole card ['D7', 'CK'], current stack 1000
player [RaphaelPlayer] gets hole card ['H8', 'C3'], current stack 1000
Started the round 2
Street "preflop" started. (community card = [])
"Finneas" declared "call:10"
"Yuchun" declared "fold:0"
"Zheng" declared "call:10"
"RaphaelPlayer" declared "fold:0"
"EvanPlayer" declared "call:10"
"ZifengFoldMan" declared "fold:0"
"JoyoPlayer" declared "fold:0"
"YueShi" declared "fold:0"
Street "flop" started. (community card = ['HK', 'S6', 'S2'])
"Finneas" declared "call:0"
"Zheng" declared "call:0"
"EvanPlayer" declared "fold:0"
Street "turn" started. (community card = ['HK', 'S6', 'S2', 'ST'])
"Finneas" declared "call:0"
"Zheng" declared "call:0"
Street "river" started. (community card = ['HK', 'S6', 'S2', 'ST', 'C6'])
"Finneas" declared "call:0"
"Zheng" declared "raise:500"
"Finneas" declared "fold:0"
"['Zheng']" won the round 2 (stack = {'EvanPlayer': 990, 'ZifengFoldMan': 995, 'JoyoPlayer': 985, 'YueShi': 990, 'Finneas': 1005, 'Yuchun': 1000, 'Zheng': 1035, 'RaphaelPlayer': 1000})
player [EvanPlayer] gets hole card ['H2', 'S6'], current stack 990
player [ZifengFoldMan] gets hole card ['HT', 'CT'], current stack 995
player [JoyoPlayer] gets hole card ['CK', 'C8'], current stack 985
player [YueShi] gets hole card ['D4', 'HK'], current stack 985
player [Finneas] gets hole card ['C9', 'H8'], current stack 995
player [Yuchun] gets hole card ['D8', 'D6'], current stack 1000
player [Zheng] gets hole card ['C4', 'D9'], current stack 1035
player [RaphaelPlayer] gets hole card ['D5', 'HA'], current stack 1000
Started the round 3
Street "preflop" started. (community card = [])
"Yuchun" declared "fold:0"
"Zheng" declared "call:10"
"RaphaelPlayer" declared "call:10"
"EvanPlayer" declared "raise:990"
"ZifengFoldMan" declared "fold:0"
"JoyoPlayer" declared "fold:0"
"YueShi" declared "fold:0"
"Finneas" declared "fold:0"
"Zheng" declared "fold:0"
"RaphaelPlayer" declared "fold:0"
"['EvanPlayer']" won the round 3 (stack = {'EvanPlayer': 1025, 'ZifengFoldMan': 995, 'JoyoPlayer': 985, 'YueShi': 985, 'Finneas': 995, 'Yuchun': 1000, 'Zheng': 1025, 'RaphaelPlayer': 990})
player [EvanPlayer] gets hole card ['H9', 'CT'], current stack 1025
player [ZifengFoldMan] gets hole card ['ST', 'DT'], current stack 995
player [JoyoPlayer] gets hole card ['D9', 'S9'], current stack 985
player [YueShi] gets hole card ['DJ', 'SQ'], current stack 985
player [Finneas] gets hole card ['C7', 'D4'], current stack 990
player [Yuchun] gets hole card ['S7', 'S2'], current stack 990
player [Zheng] gets hole card ['SA', 'H4'], current stack 1025
player [RaphaelPlayer] gets hole card ['C9', 'S4'], current stack 990
Started the round 4
Street "preflop" started. (community card = [])
"Zheng" declared "call:10"
"RaphaelPlayer" declared "fold:0"
"EvanPlayer" declared "raise:1025"
"ZifengFoldMan" declared "fold:0"
"JoyoPlayer" declared "fold:0"
"YueShi" declared "fold:0"
"Finneas" declared "fold:0"
"Yuchun" declared "fold:0"
"Zheng" declared "fold:0"
"['EvanPlayer']" won the round 4 (stack = {'EvanPlayer': 1050, 'ZifengFoldMan': 995, 'JoyoPlayer': 985, 'YueShi': 985, 'Finneas': 990, 'Yuchun': 990, 'Zheng': 1015, 'RaphaelPlayer': 990})
player [EvanPlayer] gets hole card ['D3', 'S5'], current stack 1050
player [ZifengFoldMan] gets hole card ['S9', 'HJ'], current stack 995
player [JoyoPlayer] gets hole card ['C4', 'C7'], current stack 985
player [YueShi] gets hole card ['H3', 'ST'], current stack 985
player [Finneas] gets hole card ['HQ', 'SQ'], current stack 990
player [Yuchun] gets hole card ['H8', 'S4'], current stack 985
player [Zheng] gets hole card ['CJ', 'H9'], current stack 1005
player [RaphaelPlayer] gets hole card ['C2', 'H4'], current stack 990
Started the round 5
Street "preflop" started. (community card = [])
"RaphaelPlayer" declared "fold:0"
"EvanPlayer" declared "call:10"
"ZifengFoldMan" declared "fold:0"
"JoyoPlayer" declared "fold:0"
"YueShi" declared "fold:0"
"Finneas" declared "raise:502"
"Yuchun" declared "fold:0"
"Zheng" declared "fold:0"
"EvanPlayer" declared "fold:502"
"['Finneas']" won the round 5 (stack = {'EvanPlayer': 1040, 'ZifengFoldMan': 995, 'JoyoPlayer': 985, 'YueShi': 985, 'Finneas': 1015, 'Yuchun': 985, 'Zheng': 1005, 'RaphaelPlayer': 990})
player [EvanPlayer] gets hole card ['D7', 'S8'], current stack 1040
player [ZifengFoldMan] gets hole card ['SK', 'HJ'], current stack 995
player [JoyoPlayer] gets hole card ['H2', 'S6'], current stack 985
player [YueShi] gets hole card ['D2', 'S9'], current stack 985
player [Finneas] gets hole card ['DJ', 'HA'], current stack 1015
player [Yuchun] gets hole card ['S3', 'H4'], current stack 985
player [Zheng] gets hole card ['C2', 'H5'], current stack 1000
player [RaphaelPlayer] gets hole card ['S4', 'SA'], current stack 980
Started the round 6
Street "preflop" started. (community card = [])
"EvanPlayer" declared "raise:1040"
"ZifengFoldMan" declared "fold:0"
"JoyoPlayer" declared "call:1040"
"YueShi" declared "fold:0"
"Finneas" declared "fold:0"
"Yuchun" declared "fold:0"
"Zheng" declared "fold:0"
"RaphaelPlayer" declared "call:1040"
Street "flop" started. (community card = ['C4', 'DK', 'HK'])
Street "turn" started. (community card = ['C4', 'DK', 'HK', 'C5'])
Street "river" started. (community card = ['C4', 'DK', 'HK', 'C5', 'SQ'])
"['RaphaelPlayer']" won the round 6 (stack = {'EvanPlayer': 50, 'ZifengFoldMan': 995, 'JoyoPlayer': 0, 'YueShi': 985, 'Finneas': 1015, 'Yuchun': 985, 'Zheng': 1000, 'RaphaelPlayer': 2970})
player [EvanPlayer] gets hole card ['H3', 'S2'], current stack 40
player [ZifengFoldMan] gets hole card ['SJ', 'H2'], current stack 995
player [YueShi] gets hole card ['C3', 'H8'], current stack 985
player [Finneas] gets hole card ['SQ', 'H5'], current stack 1015
player [Yuchun] gets hole card ['S9', 'CK'], current stack 985
player [Zheng] gets hole card ['D9', 'HQ'], current stack 1000
player [RaphaelPlayer] gets hole card ['C2', 'H4'], current stack 2965
Started the round 7
Street "preflop" started. (community card = [])
"ZifengFoldMan" declared "fold:0"
"YueShi" declared "fold:0"
"Finneas" declared "call:10"
"Yuchun" declared "fold:0"
"Zheng" declared "call:10"
"RaphaelPlayer" declared "fold:0"
"EvanPlayer" declared "fold:10"
Street "flop" started. (community card = ['D4', 'CQ', 'D3'])
"Finneas" declared "call:0"
"Zheng" declared "call:0"
Street "turn" started. (community card = ['D4', 'CQ', 'D3', 'C7'])
"Finneas" declared "call:0"
"Zheng" declared "call:0"
Street "river" started. (community card = ['D4', 'CQ', 'D3', 'C7', 'H7'])
"Finneas" declared "call:0"
"Zheng" declared "call:0"
"['Zheng']" won the round 7 (stack = {'EvanPlayer': 40, 'ZifengFoldMan': 995, 'JoyoPlayer': 0, 'YueShi': 985, 'Finneas': 1005, 'Yuchun': 985, 'Zheng': 1025, 'RaphaelPlayer': 2965})
player [EvanPlayer] gets hole card ['D2', 'SJ'], current stack 35
player [ZifengFoldMan] gets hole card ['C6', 'SQ'], current stack 985
player [YueShi] gets hole card ['DJ', 'C8'], current stack 985
player [Finneas] gets hole card ['D7', 'HT'], current stack 1005
player [Yuchun] gets hole card ['C5', 'SK'], current stack 985
player [Zheng] gets hole card ['D3', 'D6'], current stack 1025
player [RaphaelPlayer] gets hole card ['S9', 'C7'], current stack 2965
Started the round 8
Street "preflop" started. (community card = [])
"YueShi" declared "fold:0"
"Finneas" declared "call:10"
"Yuchun" declared "fold:0"
"Zheng" declared "call:10"
"RaphaelPlayer" declared "fold:0"
"EvanPlayer" declared "call:10"
"ZifengFoldMan" declared "fold:0"
Street "flop" started. (community card = ['S8', 'CJ', 'HA'])
"EvanPlayer" declared "raise:30"
"Finneas" declared "fold:0"
"Zheng" declared "fold:0"
"['EvanPlayer']" won the round 8 (stack = {'EvanPlayer': 70, 'ZifengFoldMan': 985, 'JoyoPlayer': 0, 'YueShi': 985, 'Finneas': 995, 'Yuchun': 985, 'Zheng': 1015, 'RaphaelPlayer': 2965})
player [EvanPlayer] gets hole card ['C2', 'S2'], current stack 70
player [ZifengFoldMan] gets hole card ['C6', 'H5'], current stack 980
player [YueShi] gets hole card ['C4', 'SK'], current stack 975
player [Finneas] gets hole card ['H9', 'D6'], current stack 995
player [Yuchun] gets hole card ['C3', 'HA'], current stack 985
player [Zheng] gets hole card ['D3', 'CJ'], current stack 1015
player [RaphaelPlayer] gets hole card ['SA', 'D2'], current stack 2965
Started the round 9
Street "preflop" started. (community card = [])
"Finneas" declared "call:10"
"Yuchun" declared "fold:0"
"Zheng" declared "call:10"
"RaphaelPlayer" declared "call:10"
"EvanPlayer" declared "raise:70"
"ZifengFoldMan" declared "fold:0"
"YueShi" declared "fold:0"
"Finneas" declared "fold:0"
"Zheng" declared "fold:0"
"RaphaelPlayer" declared "fold:0"
"['EvanPlayer']" won the round 9 (stack = {'EvanPlayer': 115, 'ZifengFoldMan': 980, 'JoyoPlayer': 0, 'YueShi': 975, 'Finneas': 985, 'Yuchun': 985, 'Zheng': 1005, 'RaphaelPlayer': 2955})
player [EvanPlayer] gets hole card ['S7', 'D8'], current stack 115
player [ZifengFoldMan] gets hole card ['H2', 'C4'], current stack 980
player [YueShi] gets hole card ['CT', 'H4'], current stack 970
player [Finneas] gets hole card ['CJ', 'D5'], current stack 975
player [Yuchun] gets hole card ['S3', 'C9'], current stack 985
player [Zheng] gets hole card ['H5', 'HA'], current stack 1005
player [RaphaelPlayer] gets hole card ['D4', 'HK'], current stack 2955
Started the round 10
Street "preflop" started. (community card = [])
"Yuchun" declared "call:10"
"Zheng" declared "call:10"
"RaphaelPlayer" declared "fold:0"
"EvanPlayer" declared "call:10"
"ZifengFoldMan" declared "fold:0"
"YueShi" declared "fold:0"
"Finneas" declared "call:10"
Street "flop" started. (community card = ['SA', 'H7', 'D3'])
"Finneas" declared "call:0"
"Yuchun" declared "call:0"
"Zheng" declared "call:0"
"EvanPlayer" declared "call:0"
Street "turn" started. (community card = ['SA', 'H7', 'D3', 'C6'])
"Finneas" declared "call:0"
"Yuchun" declared "call:0"
"Zheng" declared "call:0"
"EvanPlayer" declared "raise:105"
"Finneas" declared "fold:0"
"Yuchun" declared "fold:0"
"Zheng" declared "fold:0"
"['EvanPlayer']" won the round 10 (stack = {'EvanPlayer': 150, 'ZifengFoldMan': 980, 'JoyoPlayer': 0, 'YueShi': 970, 'Finneas': 975, 'Yuchun': 975, 'Zheng': 995, 'RaphaelPlayer': 2955})
player [EvanPlayer] gets hole card ['H9', 'C7'], current stack 150
player [ZifengFoldMan] gets hole card ['D9', 'D3'], current stack 980
player [YueShi] gets hole card ['H2', 'CJ'], current stack 970
player [Finneas] gets hole card ['HT', 'HK'], current stack 970
player [Yuchun] gets hole card ['H8', 'D7'], current stack 965
player [Zheng] gets hole card ['S5', 'S9'], current stack 995
player [RaphaelPlayer] gets hole card ['D5', 'CQ'], current stack 2955
Started the round 11
Street "preflop" started. (community card = [])
"Zheng" declared "call:10"
"RaphaelPlayer" declared "fold:0"
"EvanPlayer" declared "raise:150"
"ZifengFoldMan" declared "fold:0"
"YueShi" declared "fold:0"
"Finneas" declared "fold:0"
"Yuchun" declared "call:150"
"Zheng" declared "fold:0"
Street "flop" started. (community card = ['HQ', 'S3', 'DJ'])
Street "turn" started. (community card = ['HQ', 'S3', 'DJ', 'H4'])
Street "river" started. (community card = ['HQ', 'S3', 'DJ', 'H4', 'H7'])
"['EvanPlayer']" won the round 11 (stack = {'EvanPlayer': 315, 'ZifengFoldMan': 980, 'JoyoPlayer': 0, 'YueShi': 970, 'Finneas': 970, 'Yuchun': 825, 'Zheng': 985, 'RaphaelPlayer': 2955})
player [EvanPlayer] gets hole card ['DJ', 'DA'], current stack 315
player [ZifengFoldMan] gets hole card ['SK', 'HK'], current stack 980
player [YueShi] gets hole card ['C6', 'H7'], current stack 970
player [Finneas] gets hole card ['S2', 'CK'], current stack 970
player [Yuchun] gets hole card ['CJ', 'HQ'], current stack 820
player [Zheng] gets hole card ['C9', 'S7'], current stack 975
player [RaphaelPlayer] gets hole card ['S3', 'C4'], current stack 2955
Started the round 12
Street "preflop" started. (community card = [])
"RaphaelPlayer" declared "fold:0"
"EvanPlayer" declared "raise:315"
"ZifengFoldMan" declared "fold:0"
"YueShi" declared "fold:0"
"Finneas" declared "fold:0"
"Yuchun" declared "fold:0"
"Zheng" declared "fold:0"
"['EvanPlayer']" won the round 12 (stack = {'EvanPlayer': 330, 'ZifengFoldMan': 980, 'JoyoPlayer': 0, 'YueShi': 970, 'Finneas': 970, 'Yuchun': 820, 'Zheng': 975, 'RaphaelPlayer': 2955})
player [EvanPlayer] gets hole card ['HT', 'HK'], current stack 330
player [ZifengFoldMan] gets hole card ['DT', 'DK'], current stack 980
player [YueShi] gets hole card ['C4', 'HA'], current stack 970
player [Finneas] gets hole card ['S7', 'HQ'], current stack 970
player [Yuchun] gets hole card ['S8', 'H6'], current stack 820
player [Zheng] gets hole card ['DA', 'S9'], current stack 970
player [RaphaelPlayer] gets hole card ['D8', 'D3'], current stack 2945
Started the round 13
Street "preflop" started. (community card = [])
"EvanPlayer" declared "raise:330"
"ZifengFoldMan" declared "fold:0"
"YueShi" declared "fold:0"
"Finneas" declared "fold:0"
"Yuchun" declared "fold:0"
"Zheng" declared "fold:0"
"RaphaelPlayer" declared "fold:0"
"['EvanPlayer']" won the round 13 (stack = {'EvanPlayer': 345, 'ZifengFoldMan': 980, 'JoyoPlayer': 0, 'YueShi': 970, 'Finneas': 970, 'Yuchun': 820, 'Zheng': 970, 'RaphaelPlayer': 2945})
player [EvanPlayer] gets hole card ['D7', 'S6'], current stack 335
player [ZifengFoldMan] gets hole card ['H2', 'DT'], current stack 980
player [YueShi] gets hole card ['C4', 'D5'], current stack 970
player [Finneas] gets hole card ['HA', 'H3'], current stack 970
player [Yuchun] gets hole card ['C6', 'C7'], current stack 820
player [Zheng] gets hole card ['C2', 'DQ'], current stack 970
player [RaphaelPlayer] gets hole card ['H8', 'D6'], current stack 2940
Started the round 14
Street "preflop" started. (community card = [])
"ZifengFoldMan" declared "fold:0"
"YueShi" declared "fold:0"
"Finneas" declared "call:10"
"Yuchun" declared "call:10"
"Zheng" declared "call:10"
"RaphaelPlayer" declared "fold:0"
"EvanPlayer" declared "fold:10"
Street "flop" started. (community card = ['SQ', 'S5', 'H7'])
"Finneas" declared "call:0"
"Yuchun" declared "call:0"
"Zheng" declared "call:0"
Street "turn" started. (community card = ['SQ', 'S5', 'H7', 'HK'])
"Finneas" declared "call:0"
"Yuchun" declared "call:0"
"Zheng" declared "call:0"
Street "river" started. (community card = ['SQ', 'S5', 'H7', 'HK', 'C3'])
"Finneas" declared "call:0"
"Yuchun" declared "call:0"
"Zheng" declared "call:0"
"['Zheng']" won the round 14 (stack = {'EvanPlayer': 335, 'ZifengFoldMan': 980, 'JoyoPlayer': 0, 'YueShi': 970, 'Finneas': 960, 'Yuchun': 810, 'Zheng': 1005, 'RaphaelPlayer': 2940})
player [EvanPlayer] gets hole card ['HJ', 'D5'], current stack 330
player [ZifengFoldMan] gets hole card ['H6', 'H5'], current stack 970
player [YueShi] gets hole card ['DT', 'C3'], current stack 970
player [Finneas] gets hole card ['HQ', 'HK'], current stack 960
player [Yuchun] gets hole card ['CQ', 'D3'], current stack 810
player [Zheng] gets hole card ['DQ', 'D6'], current stack 1005
player [RaphaelPlayer] gets hole card ['S5', 'S7'], current stack 2940
Started the round 15
Street "preflop" started. (community card = [])
"YueShi" declared "fold:0"
"Finneas" declared "call:10"
"Yuchun" declared "call:10"
"Zheng" declared "call:10"
"RaphaelPlayer" declared "fold:0"
"EvanPlayer" declared "call:10"
"ZifengFoldMan" declared "fold:0"
Street "flop" started. (community card = ['D7', 'S8', 'H3'])
"EvanPlayer" declared "fold:0"
"Finneas" declared "call:0"
"Yuchun" declared "call:0"
"Zheng" declared "call:0"
Street "turn" started. (community card = ['D7', 'S8', 'H3', 'SK'])
"Finneas" declared "call:0"
"Yuchun" declared "call:0"
"Zheng" declared "call:0"
Street "river" started. (community card = ['D7', 'S8', 'H3', 'SK', 'S2'])
"Finneas" declared "call:0"
"Yuchun" declared "call:0"
"Zheng" declared "call:0"
"['Finneas']" won the round 15 (stack = {'EvanPlayer': 325, 'ZifengFoldMan': 970, 'JoyoPlayer': 0, 'YueShi': 970, 'Finneas': 1000, 'Yuchun': 800, 'Zheng': 995, 'RaphaelPlayer': 2940})
player [EvanPlayer] gets hole card ['H5', 'D7'], current stack 325
player [ZifengFoldMan] gets hole card ['D2', 'H3'], current stack 965
player [YueShi] gets hole card ['D8', 'S3'], current stack 960
player [Finneas] gets hole card ['H4', 'CQ'], current stack 1000
player [Yuchun] gets hole card ['S5', 'HQ'], current stack 800
player [Zheng] gets hole card ['DQ', 'D9'], current stack 995
player [RaphaelPlayer] gets hole card ['S7', 'DT'], current stack 2940
Started the round 16
Street "preflop" started. (community card = [])
"Finneas" declared "call:10"
"Yuchun" declared "call:10"
"Zheng" declared "call:10"
"RaphaelPlayer" declared "fold:0"
"EvanPlayer" declared "call:10"
"ZifengFoldMan" declared "fold:0"
"YueShi" declared "fold:0"
Street "flop" started. (community card = ['CT', 'C5', 'C8'])
"Finneas" declared "call:0"
"Yuchun" declared "call:0"
"Zheng" declared "call:0"
"EvanPlayer" declared "fold:0"
Street "turn" started. (community card = ['CT', 'C5', 'C8', 'C2'])
"Finneas" declared "raise:500"
"Yuchun" declared "fold:0"
"Zheng" declared "fold:0"
"['Finneas']" won the round 16 (stack = {'EvanPlayer': 315, 'ZifengFoldMan': 965, 'JoyoPlayer': 0, 'YueShi': 960, 'Finneas': 1045, 'Yuchun': 790, 'Zheng': 985, 'RaphaelPlayer': 2940})
player [EvanPlayer] gets hole card ['CA', 'HA'], current stack 315
player [ZifengFoldMan] gets hole card ['HQ', 'S7'], current stack 965
player [YueShi] gets hole card ['D8', 'DA'], current stack 955
player [Finneas] gets hole card ['D5', 'H6'], current stack 1035
player [Yuchun] gets hole card ['CK', 'HJ'], current stack 790
player [Zheng] gets hole card ['H3', 'SQ'], current stack 985
player [RaphaelPlayer] gets hole card ['DK', 'H9'], current stack 2940
Started the round 17
Street "preflop" started. (community card = [])
"Yuchun" declared "call:10"
"Zheng" declared "call:10"
"RaphaelPlayer" declared "call:10"
"EvanPlayer" declared "raise:315"
"ZifengFoldMan" declared "fold:0"
"YueShi" declared "fold:0"
"Finneas" declared "fold:0"
"Yuchun" declared "fold:0"
"Zheng" declared "fold:0"
"RaphaelPlayer" declared "fold:0"
"['EvanPlayer']" won the round 17 (stack = {'EvanPlayer': 360, 'ZifengFoldMan': 965, 'JoyoPlayer': 0, 'YueShi': 955, 'Finneas': 1035, 'Yuchun': 780, 'Zheng': 975, 'RaphaelPlayer': 2930})
player [EvanPlayer] gets hole card ['D9', 'C9'], current stack 360
player [ZifengFoldMan] gets hole card ['H6', 'HQ'], current stack 965
player [YueShi] gets hole card ['DA', 'S6'], current stack 955
player [Finneas] gets hole card ['DT', 'D4'], current stack 1030
player [Yuchun] gets hole card ['S7', 'CK'], current stack 770
player [Zheng] gets hole card ['S8', 'H4'], current stack 975
player [RaphaelPlayer] gets hole card ['C3', 'DJ'], current stack 2930
Started the round 18
Street "preflop" started. (community card = [])
"Zheng" declared "call:10"
"RaphaelPlayer" declared "fold:0"
"EvanPlayer" declared "raise:360"
"ZifengFoldMan" declared "fold:0"
"YueShi" declared "fold:0"
"Finneas" declared "fold:0"
"Yuchun" declared "fold:0"
"Zheng" declared "fold:0"
"['EvanPlayer']" won the round 18 (stack = {'EvanPlayer': 385, 'ZifengFoldMan': 965, 'JoyoPlayer': 0, 'YueShi': 955, 'Finneas': 1030, 'Yuchun': 770, 'Zheng': 965, 'RaphaelPlayer': 2930})
player [EvanPlayer] gets hole card ['H5', 'SQ'], current stack 385
player [ZifengFoldMan] gets hole card ['SK', 'H4'], current stack 965
player [YueShi] gets hole card ['C5', 'S8'], current stack 955
player [Finneas] gets hole card ['S4', 'C4'], current stack 1030
player [Yuchun] gets hole card ['C6', 'D5'], current stack 765
player [Zheng] gets hole card ['SA', 'H8'], current stack 955
player [RaphaelPlayer] gets hole card ['C9', 'DJ'], current stack 2930
Started the round 19
Street "preflop" started. (community card = [])
"RaphaelPlayer" declared "call:10"
"EvanPlayer" declared "raise:385"
"ZifengFoldMan" declared "fold:0"
"YueShi" declared "fold:0"
"Finneas" declared "fold:0"
"Yuchun" declared "fold:0"
"Zheng" declared "fold:0"
"RaphaelPlayer" declared "fold:0"
"['EvanPlayer']" won the round 19 (stack = {'EvanPlayer': 410, 'ZifengFoldMan': 965, 'JoyoPlayer': 0, 'YueShi': 955, 'Finneas': 1030, 'Yuchun': 765, 'Zheng': 955, 'RaphaelPlayer': 2920})
player [EvanPlayer] gets hole card ['C7', 'H2'], current stack 410
player [ZifengFoldMan] gets hole card ['DJ', 'H9'], current stack 965
player [YueShi] gets hole card ['S8', 'SQ'], current stack 955
player [Finneas] gets hole card ['CT', 'HJ'], current stack 1030
player [Yuchun] gets hole card ['S4', 'C9'], current stack 765
player [Zheng] gets hole card ['DQ', 'S3'], current stack 950
player [RaphaelPlayer] gets hole card ['C6', 'CK'], current stack 2910
Started the round 20
Street "preflop" started. (community card = [])
"EvanPlayer" declared "fold:10"
"ZifengFoldMan" declared "fold:0"
"YueShi" declared "fold:0"
"Finneas" declared "call:10"
"Yuchun" declared "call:10"
"Zheng" declared "call:10"
"RaphaelPlayer" declared "call:10"
Street "flop" started. (community card = ['H6', 'D3', 'D8'])
"Zheng" declared "call:0"
"RaphaelPlayer" declared "call:0"
"Finneas" declared "call:0"
"Yuchun" declared "call:0"
Street "turn" started. (community card = ['H6', 'D3', 'D8', 'H4'])
"Zheng" declared "call:0"
"RaphaelPlayer" declared "call:0"
"Finneas" declared "call:0"
"Yuchun" declared "call:0"
Street "river" started. (community card = ['H6', 'D3', 'D8', 'H4', 'SA'])
"Zheng" declared "call:0"
"RaphaelPlayer" declared "call:0"
"Finneas" declared "call:0"
"Yuchun" declared "call:0"
"['RaphaelPlayer']" won the round 20 (stack = {'EvanPlayer': 410, 'ZifengFoldMan': 965, 'JoyoPlayer': 0, 'YueShi': 955, 'Finneas': 1020, 'Yuchun': 755, 'Zheng': 945, 'RaphaelPlayer': 2950})
player [EvanPlayer] gets hole card ['H6', 'HA'], current stack 400
player [ZifengFoldMan] gets hole card ['C5', 'C3'], current stack 965
player [YueShi] gets hole card ['D2', 'SK'], current stack 955
player [Finneas] gets hole card ['H7', 'D4'], current stack 1020
player [Yuchun] gets hole card ['DK', 'C8'], current stack 755
player [Zheng] gets hole card ['HT', 'S6'], current stack 945
player [RaphaelPlayer] gets hole card ['S7', 'H2'], current stack 2945
Started the round 21
Street "preflop" started. (community card = [])
"ZifengFoldMan" declared "fold:0"
"YueShi" declared "fold:0"
"Finneas" declared "call:10"
"Yuchun" declared "call:10"
"Zheng" declared "call:10"
"RaphaelPlayer" declared "fold:0"
"EvanPlayer" declared "call:10"
Street "flop" started. (community card = ['HQ', 'D8', 'H3'])
"EvanPlayer" declared "raise:400"
"Finneas" declared "fold:0"
"Yuchun" declared "fold:0"
"Zheng" declared "fold:0"
"['EvanPlayer']" won the round 21 (stack = {'EvanPlayer': 445, 'ZifengFoldMan': 965, 'JoyoPlayer': 0, 'YueShi': 955, 'Finneas': 1010, 'Yuchun': 745, 'Zheng': 935, 'RaphaelPlayer': 2945})
player [EvanPlayer] gets hole card ['D5', 'S6'], current stack 440
player [ZifengFoldMan] gets hole card ['D7', 'C6'], current stack 955
player [YueShi] gets hole card ['SQ', 'D4'], current stack 955
player [Finneas] gets hole card ['S3', 'S4'], current stack 1010
player [Yuchun] gets hole card ['CJ', 'D9'], current stack 745
player [Zheng] gets hole card ['H6', 'H3'], current stack 935
player [RaphaelPlayer] gets hole card ['CT', 'S9'], current stack 2945
Started the round 22
Street "preflop" started. (community card = [])
"YueShi" declared "fold:0"
"Finneas" declared "call:10"
"Yuchun" declared "call:10"
"Zheng" declared "call:10"
"RaphaelPlayer" declared "call:10"
"EvanPlayer" declared "call:10"
"ZifengFoldMan" declared "fold:0"
Street "flop" started. (community card = ['HK', 'DK', 'CA'])
"EvanPlayer" declared "fold:0"
"Finneas" declared "call:0"
"Yuchun" declared "call:0"
"Zheng" declared "call:0"
"RaphaelPlayer" declared "call:0"
Street "turn" started. (community card = ['HK', 'DK', 'CA', 'D2'])
"Finneas" declared "call:0"
"Yuchun" declared "call:0"
"Zheng" declared "call:0"
"RaphaelPlayer" declared "call:0"
Street "river" started. (community card = ['HK', 'DK', 'CA', 'D2', 'HJ'])
"Finneas" declared "call:0"
"Yuchun" declared "call:0"
"Zheng" declared "call:0"
"RaphaelPlayer" declared "call:0"
"['Yuchun']" won the round 22 (stack = {'EvanPlayer': 435, 'ZifengFoldMan': 955, 'JoyoPlayer': 0, 'YueShi': 955, 'Finneas': 1000, 'Yuchun': 795, 'Zheng': 925, 'RaphaelPlayer': 2935})
player [EvanPlayer] gets hole card ['ST', 'H7'], current stack 435
player [ZifengFoldMan] gets hole card ['CK', 'C5'], current stack 950
player [YueShi] gets hole card ['D9', 'CT'], current stack 945
player [Finneas] gets hole card ['H3', 'S9'], current stack 1000
player [Yuchun] gets hole card ['DA', 'HA'], current stack 795
player [Zheng] gets hole card ['SJ', 'S5'], current stack 925
player [RaphaelPlayer] gets hole card ['SQ', 'H5'], current stack 2935
Started the round 23
Street "preflop" started. (community card = [])
"Finneas" declared "call:10"
"Yuchun" declared "call:10"
"Zheng" declared "call:10"
"RaphaelPlayer" declared "fold:0"
"EvanPlayer" declared "raise:435"
"ZifengFoldMan" declared "fold:0"
"YueShi" declared "fold:0"
"Finneas" declared "fold:0"
"Yuchun" declared "call:435"
"Zheng" declared "fold:0"
Street "flop" started. (community card = ['DJ', 'H8', 'HT'])
Street "turn" started. (community card = ['DJ', 'H8', 'HT', 'C7'])
Street "river" started. (community card = ['DJ', 'H8', 'HT', 'C7', 'CQ'])
"['EvanPlayer']" won the round 23 (stack = {'EvanPlayer': 905, 'ZifengFoldMan': 950, 'JoyoPlayer': 0, 'YueShi': 945, 'Finneas': 990, 'Yuchun': 360, 'Zheng': 915, 'RaphaelPlayer': 2935})
player [EvanPlayer] gets hole card ['SA', 'H5'], current stack 905
player [ZifengFoldMan] gets hole card ['C4', 'C6'], current stack 950
player [YueShi] gets hole card ['S3', 'ST'], current stack 940
player [Finneas] gets hole card ['S7', 'C8'], current stack 980
player [Yuchun] gets hole card ['DQ', 'S4'], current stack 360
player [Zheng] gets hole card ['H9', 'CT'], current stack 915
player [RaphaelPlayer] gets hole card ['H2', 'DK'], current stack 2935
Started the round 24
Street "preflop" started. (community card = [])
"Yuchun" declared "call:10"
"Zheng" declared "call:10"
"RaphaelPlayer" declared "call:10"
"EvanPlayer" declared "call:10"
"ZifengFoldMan" declared "fold:0"
"YueShi" declared "fold:0"
"Finneas" declared "call:10"
Street "flop" started. (community card = ['C3', 'DA', 'C7'])
"Finneas" declared "call:0"
"Yuchun" declared "call:0"
"Zheng" declared "call:0"
"RaphaelPlayer" declared "call:0"
"EvanPlayer" declared "call:0"
Street "turn" started. (community card = ['C3', 'DA', 'C7', 'HQ'])
"Finneas" declared "call:0"
"Yuchun" declared "call:0"
"Zheng" declared "call:0"
"RaphaelPlayer" declared "call:0"
"EvanPlayer" declared "call:0"
Street "river" started. (community card = ['C3', 'DA', 'C7', 'HQ', 'S8'])
"Finneas" declared "call:0"
"Yuchun" declared "call:0"
"Zheng" declared "call:0"
"RaphaelPlayer" declared "call:0"
"EvanPlayer" declared "call:0"
"['Finneas']" won the round 24 (stack = {'EvanPlayer': 895, 'ZifengFoldMan': 950, 'JoyoPlayer': 0, 'YueShi': 940, 'Finneas': 1035, 'Yuchun': 350, 'Zheng': 905, 'RaphaelPlayer': 2925})
player [EvanPlayer] gets hole card ['CK', 'H4'], current stack 895
player [ZifengFoldMan] gets hole card ['HQ', 'D8'], current stack 950
player [YueShi] gets hole card ['CJ', 'S8'], current stack 940
player [Finneas] gets hole card ['D2', 'SA'], current stack 1030
player [Yuchun] gets hole card ['HT', 'D4'], current stack 340
player [Zheng] gets hole card ['DA', 'SQ'], current stack 905
player [RaphaelPlayer] gets hole card ['H6', 'SJ'], current stack 2925
Started the round 25
Street "preflop" started. (community card = [])
"Zheng" declared "call:10"
"RaphaelPlayer" declared "fold:0"
"EvanPlayer" declared "call:10"
"ZifengFoldMan" declared "fold:0"
"YueShi" declared "fold:0"
"Finneas" declared "call:10"
"Yuchun" declared "call:10"
Street "flop" started. (community card = ['H3', 'DT', 'S6'])
"Finneas" declared "call:0"
"Yuchun" declared "call:0"
"Zheng" declared "call:0"
"EvanPlayer" declared "fold:0"
Street "turn" started. (community card = ['H3', 'DT', 'S6', 'C5'])
"Finneas" declared "call:0"
"Yuchun" declared "call:0"
"Zheng" declared "call:0"
Street "river" started. (community card = ['H3', 'DT', 'S6', 'C5', 'H7'])
"Finneas" declared "call:0"
"Yuchun" declared "raise:340"
"Zheng" declared "fold:0"
"Finneas" declared "fold:0"
"['Yuchun']" won the round 25 (stack = {'EvanPlayer': 885, 'ZifengFoldMan': 950, 'JoyoPlayer': 0, 'YueShi': 940, 'Finneas': 1025, 'Yuchun': 380, 'Zheng': 895, 'RaphaelPlayer': 2925})
player [EvanPlayer] gets hole card ['HT', 'DQ'], current stack 885
player [ZifengFoldMan] gets hole card ['S9', 'H5'], current stack 950
player [YueShi] gets hole card ['C8', 'HA'], current stack 940
player [Finneas] gets hole card ['D8', 'S4'], current stack 1025
player [Yuchun] gets hole card ['C3', 'DJ'], current stack 375
player [Zheng] gets hole card ['S2', 'C5'], current stack 885
player [RaphaelPlayer] gets hole card ['H2', 'H7'], current stack 2925
Started the round 26
Street "preflop" started. (community card = [])
"RaphaelPlayer" declared "fold:0"
"EvanPlayer" declared "raise:885"
"ZifengFoldMan" declared "fold:0"
"YueShi" declared "fold:0"
"Finneas" declared "fold:0"
"Yuchun" declared "fold:0"
"Zheng" declared "fold:0"
"['EvanPlayer']" won the round 26 (stack = {'EvanPlayer': 900, 'ZifengFoldMan': 950, 'JoyoPlayer': 0, 'YueShi': 940, 'Finneas': 1025, 'Yuchun': 375, 'Zheng': 885, 'RaphaelPlayer': 2925})
player [EvanPlayer] gets hole card ['C7', 'C9'], current stack 900
player [ZifengFoldMan] gets hole card ['S9', 'D6'], current stack 950
player [YueShi] gets hole card ['H2', 'S7'], current stack 940
player [Finneas] gets hole card ['H6', 'CA'], current stack 1025
player [Yuchun] gets hole card ['SK', 'C4'], current stack 375
player [Zheng] gets hole card ['DK', 'HQ'], current stack 880
player [RaphaelPlayer] gets hole card ['C6', 'H5'], current stack 2915
Started the round 27
Street "preflop" started. (community card = [])
"EvanPlayer" declared "call:10"
"ZifengFoldMan" declared "fold:0"
"YueShi" declared "fold:0"
"Finneas" declared "call:10"
"Yuchun" declared "call:10"
"Zheng" declared "call:10"
"RaphaelPlayer" declared "fold:0"
Street "flop" started. (community card = ['H9', 'C2', 'S8'])
"Zheng" declared "call:0"
"EvanPlayer" declared "call:0"
"Finneas" declared "call:0"
"Yuchun" declared "call:0"
Street "turn" started. (community card = ['H9', 'C2', 'S8', 'HJ'])
"Zheng" declared "call:0"
"EvanPlayer" declared "fold:0"
"Finneas" declared "call:0"
"Yuchun" declared "call:0"
Street "river" started. (community card = ['H9', 'C2', 'S8', 'HJ', 'DT'])
"Zheng" declared "raise:875"
"Finneas" declared "fold:0"
"Yuchun" declared "fold:0"
"['Zheng']" won the round 27 (stack = {'EvanPlayer': 890, 'ZifengFoldMan': 950, 'JoyoPlayer': 0, 'YueShi': 940, 'Finneas': 1015, 'Yuchun': 365, 'Zheng': 925, 'RaphaelPlayer': 2915})
player [EvanPlayer] gets hole card ['DA', 'D3'], current stack 880
player [ZifengFoldMan] gets hole card ['HQ', 'DQ'], current stack 950
player [YueShi] gets hole card ['D9', 'DK'], current stack 940
player [Finneas] gets hole card ['HJ', 'DT'], current stack 1015
player [Yuchun] gets hole card ['C9', 'S5'], current stack 365
player [Zheng] gets hole card ['S6', 'S4'], current stack 925
player [RaphaelPlayer] gets hole card ['S8', 'H9'], current stack 2910
Started the round 28
Street "preflop" started. (community card = [])
"ZifengFoldMan" declared "fold:0"
"YueShi" declared "fold:0"
"Finneas" declared "call:10"
"Yuchun" declared "call:10"
"Zheng" declared "call:10"
"RaphaelPlayer" declared "call:10"
"EvanPlayer" declared "call:10"
Street "flop" started. (community card = ['H7', 'D8', 'S3'])
"RaphaelPlayer" declared "call:0"
"EvanPlayer" declared "call:0"
"Finneas" declared "call:0"
"Yuchun" declared "call:0"
"Zheng" declared "call:0"
Street "turn" started. (community card = ['H7', 'D8', 'S3', 'H5'])
"RaphaelPlayer" declared "call:0"
"EvanPlayer" declared "fold:0"
"Finneas" declared "call:0"
"Yuchun" declared "call:0"
"Zheng" declared "raise:462"
"RaphaelPlayer" declared "fold:0"
"Finneas" declared "fold:0"
"Yuchun" declared "fold:0"
"['Zheng']" won the round 28 (stack = {'EvanPlayer': 880, 'ZifengFoldMan': 950, 'JoyoPlayer': 0, 'YueShi': 940, 'Finneas': 1005, 'Yuchun': 355, 'Zheng': 965, 'RaphaelPlayer': 2905})
player [EvanPlayer] gets hole card ['H5', 'HQ'], current stack 875
player [ZifengFoldMan] gets hole card ['H8', 'S5'], current stack 940
player [YueShi] gets hole card ['S2', 'S6'], current stack 940
player [Finneas] gets hole card ['D7', 'DQ'], current stack 1005
player [Yuchun] gets hole card ['ST', 'C7'], current stack 355
player [Zheng] gets hole card ['DT', 'D5'], current stack 965
player [RaphaelPlayer] gets hole card ['DJ', 'C2'], current stack 2905
Started the round 29
Street "preflop" started. (community card = [])
"YueShi" declared "fold:0"
"Finneas" declared "call:10"
"Yuchun" declared "call:10"
"Zheng" declared "call:10"
"RaphaelPlayer" declared "fold:0"
"EvanPlayer" declared "call:10"
"ZifengFoldMan" declared "fold:0"
Street "flop" started. (community card = ['H7', 'CQ', 'DA'])
"EvanPlayer" declared "raise:870"
"Finneas" declared "fold:0"
"Yuchun" declared "fold:0"
"Zheng" declared "fold:0"
"['EvanPlayer']" won the round 29 (stack = {'EvanPlayer': 920, 'ZifengFoldMan': 940, 'JoyoPlayer': 0, 'YueShi': 940, 'Finneas': 995, 'Yuchun': 345, 'Zheng': 955, 'RaphaelPlayer': 2905})
player [EvanPlayer] gets hole card ['S5', 'CQ'], current stack 920
player [ZifengFoldMan] gets hole card ['HT', 'D9'], current stack 935
player [YueShi] gets hole card ['HA', 'D7'], current stack 930
player [Finneas] gets hole card ['C6', 'DT'], current stack 995
player [Yuchun] gets hole card ['H5', 'C3'], current stack 345
player [Zheng] gets hole card ['S7', 'H8'], current stack 955
player [RaphaelPlayer] gets hole card ['D3', 'S6'], current stack 2905
Started the round 30
Street "preflop" started. (community card = [])
"Finneas" declared "call:10"
"Yuchun" declared "call:10"
"Zheng" declared "call:10"
"RaphaelPlayer" declared "fold:0"
"EvanPlayer" declared "raise:920"
"ZifengFoldMan" declared "fold:0"
"YueShi" declared "fold:0"
"Finneas" declared "fold:0"
"Yuchun" declared "fold:0"
"Zheng" declared "fold:0"
"['EvanPlayer']" won the round 30 (stack = {'EvanPlayer': 965, 'ZifengFoldMan': 935, 'JoyoPlayer': 0, 'YueShi': 930, 'Finneas': 985, 'Yuchun': 335, 'Zheng': 945, 'RaphaelPlayer': 2905})
player [EvanPlayer] gets hole card ['ST', 'C4'], current stack 965
player [ZifengFoldMan] gets hole card ['H9', 'C6'], current stack 935
player [YueShi] gets hole card ['H5', 'DK'], current stack 925
player [Finneas] gets hole card ['S9', 'DT'], current stack 975
player [Yuchun] gets hole card ['HQ', 'D7'], current stack 335
player [Zheng] gets hole card ['SA', 'D6'], current stack 945
player [RaphaelPlayer] gets hole card ['S5', 'D2'], current stack 2905
Started the round 31
Street "preflop" started. (community card = [])
"Yuchun" declared "call:10"
"Zheng" declared "call:10"
"RaphaelPlayer" declared "fold:0"
"EvanPlayer" declared "raise:965"
"ZifengFoldMan" declared "fold:0"
"YueShi" declared "fold:0"
"Finneas" declared "fold:0"
"Yuchun" declared "fold:0"
"Zheng" declared "fold:0"
"['EvanPlayer']" won the round 31 (stack = {'EvanPlayer': 1000, 'ZifengFoldMan': 935, 'JoyoPlayer': 0, 'YueShi': 925, 'Finneas': 975, 'Yuchun': 325, 'Zheng': 935, 'RaphaelPlayer': 2905})
player [EvanPlayer] gets hole card ['D4', 'C8'], current stack 1000
player [ZifengFoldMan] gets hole card ['C7', 'H5'], current stack 935
player [YueShi] gets hole card ['S3', 'D3'], current stack 925
player [Finneas] gets hole card ['S7', 'CK'], current stack 970
player [Yuchun] gets hole card ['DJ', 'SQ'], current stack 315
player [Zheng] gets hole card ['S6', 'D2'], current stack 935
player [RaphaelPlayer] gets hole card ['SJ', 'ST'], current stack 2905
Started the round 32
Street "preflop" started. (community card = [])
"Zheng" declared "call:10"
"RaphaelPlayer" declared "call:10"
"EvanPlayer" declared "fold:10"
"ZifengFoldMan" declared "fold:0"
"YueShi" declared "fold:0"
"Finneas" declared "call:10"
"Yuchun" declared "call:10"
Street "flop" started. (community card = ['D8', 'D5', 'CJ'])
"Finneas" declared "call:0"
"Yuchun" declared "call:0"
"Zheng" declared "call:0"
"RaphaelPlayer" declared "raise:50"
"Finneas" declared "fold:0"
"Yuchun" declared "call:50"
"Zheng" declared "call:50"
Street "turn" started. (community card = ['D8', 'D5', 'CJ', 'SA'])
"Yuchun" declared "call:0"
"Zheng" declared "call:0"
"RaphaelPlayer" declared "raise:200"
"Yuchun" declared "call:200"
"Zheng" declared "fold:0"
Street "river" started. (community card = ['D8', 'D5', 'CJ', 'SA', 'HK'])
"Yuchun" declared "call:0"
"RaphaelPlayer" declared "raise:600"
"Yuchun" declared "call:600"
"['Yuchun']" won the round 32 (stack = {'EvanPlayer': 1000, 'ZifengFoldMan': 935, 'JoyoPlayer': 0, 'YueShi': 925, 'Finneas': 965, 'Yuchun': 720, 'Zheng': 875, 'RaphaelPlayer': 2580})
player [EvanPlayer] gets hole card ['S7', 'H3'], current stack 1000
player [ZifengFoldMan] gets hole card ['D8', 'H8'], current stack 935
player [YueShi] gets hole card ['DQ', 'H4'], current stack 925
player [Finneas] gets hole card ['H2', 'HA'], current stack 965
player [Yuchun] gets hole card ['SQ', 'H9'], current stack 715
player [Zheng] gets hole card ['H6', 'C4'], current stack 865
player [RaphaelPlayer] gets hole card ['CK', 'DJ'], current stack 2580
Started the round 33
Street "preflop" started. (community card = [])
"RaphaelPlayer" declared "call:10"
"EvanPlayer" declared "call:10"
"ZifengFoldMan" declared "fold:0"
"YueShi" declared "fold:0"
"Finneas" declared "call:10"
"Yuchun" declared "call:10"
"Zheng" declared "call:10"
Street "flop" started. (community card = ['HQ', 'SA', 'D3'])
"Yuchun" declared "call:0"
"Zheng" declared "call:0"
"RaphaelPlayer" declared "call:0"
"EvanPlayer" declared "fold:0"
"Finneas" declared "call:0"
Street "turn" started. (community card = ['HQ', 'SA', 'D3', 'H5'])
"Yuchun" declared "call:0"
"Zheng" declared "call:0"
"RaphaelPlayer" declared "call:0"
"Finneas" declared "call:0"
Street "river" started. (community card = ['HQ', 'SA', 'D3', 'H5', 'S6'])
"Yuchun" declared "call:0"
"Zheng" declared "call:0"
"RaphaelPlayer" declared "call:0"
"Finneas" declared "call:0"
"['Finneas']" won the round 33 (stack = {'EvanPlayer': 990, 'ZifengFoldMan': 935, 'JoyoPlayer': 0, 'YueShi': 925, 'Finneas': 1005, 'Yuchun': 710, 'Zheng': 865, 'RaphaelPlayer': 2570})
player [EvanPlayer] gets hole card ['H2', 'S2'], current stack 990
player [ZifengFoldMan] gets hole card ['D6', 'D2'], current stack 935
player [YueShi] gets hole card ['HQ', 'H7'], current stack 925
player [Finneas] gets hole card ['SK', 'D3'], current stack 1005
player [Yuchun] gets hole card ['S3', 'D5'], current stack 710
player [Zheng] gets hole card ['DA', 'C5'], current stack 860
player [RaphaelPlayer] gets hole card ['CJ', 'CA'], current stack 2560
Started the round 34
Street "preflop" started. (community card = [])
"EvanPlayer" declared "raise:990"
"ZifengFoldMan" declared "fold:0"
"YueShi" declared "fold:0"
"Finneas" declared "fold:0"
"Yuchun" declared "fold:0"
"Zheng" declared "fold:0"
"RaphaelPlayer" declared "fold:0"
"['EvanPlayer']" won the round 34 (stack = {'EvanPlayer': 1005, 'ZifengFoldMan': 935, 'JoyoPlayer': 0, 'YueShi': 925, 'Finneas': 1005, 'Yuchun': 710, 'Zheng': 860, 'RaphaelPlayer': 2560})
player [EvanPlayer] gets hole card ['HA', 'H6'], current stack 995
player [ZifengFoldMan] gets hole card ['C6', 'H9'], current stack 935
player [YueShi] gets hole card ['H8', 'CQ'], current stack 925
player [Finneas] gets hole card ['S3', 'D5'], current stack 1005
player [Yuchun] gets hole card ['H2', 'D8'], current stack 710
player [Zheng] gets hole card ['DA', 'DK'], current stack 860
player [RaphaelPlayer] gets hole card ['S2', 'CA'], current stack 2555
Started the round 35
Street "preflop" started. (community card = [])
"ZifengFoldMan" declared "fold:0"
"YueShi" declared "fold:0"
"Finneas" declared "call:10"
"Yuchun" declared "call:10"
"Zheng" declared "call:10"
"RaphaelPlayer" declared "call:10"
"EvanPlayer" declared "call:10"
Street "flop" started. (community card = ['SQ', 'S5', 'C5'])
"RaphaelPlayer" declared "call:0"
"EvanPlayer" declared "raise:995"
"Finneas" declared "fold:0"
"Yuchun" declared "fold:0"
"Zheng" declared "fold:0"
"RaphaelPlayer" declared "fold:0"
"['EvanPlayer']" won the round 35 (stack = {'EvanPlayer': 1045, 'ZifengFoldMan': 935, 'JoyoPlayer': 0, 'YueShi': 925, 'Finneas': 995, 'Yuchun': 700, 'Zheng': 850, 'RaphaelPlayer': 2550})
player [EvanPlayer] gets hole card ['C7', 'D5'], current stack 1040
player [ZifengFoldMan] gets hole card ['CK', 'S7'], current stack 925
player [YueShi] gets hole card ['H9', 'H5'], current stack 925
player [Finneas] gets hole card ['D9', 'CT'], current stack 995
player [Yuchun] gets hole card ['ST', 'D7'], current stack 700
player [Zheng] gets hole card ['D4', 'H7'], current stack 850
player [RaphaelPlayer] gets hole card ['DQ', 'C9'], current stack 2550
Started the round 36
Street "preflop" started. (community card = [])
"YueShi" declared "fold:0"
"Finneas" declared "call:10"
"Yuchun" declared "call:10"
"Zheng" declared "call:10"
"RaphaelPlayer" declared "call:10"
"EvanPlayer" declared "fold:10"
"ZifengFoldMan" declared "fold:0"
Street "flop" started. (community card = ['C6', 'C3', 'D6'])
"Finneas" declared "call:0"
"Yuchun" declared "call:0"
"Zheng" declared "call:0"
"RaphaelPlayer" declared "call:0"
Street "turn" started. (community card = ['C6', 'C3', 'D6', 'CJ'])
"Finneas" declared "call:0"
"Yuchun" declared "call:0"
"Zheng" declared "call:0"
"RaphaelPlayer" declared "call:0"
Street "river" started. (community card = ['C6', 'C3', 'D6', 'CJ', 'D3'])
"Finneas" declared "call:0"
"Yuchun" declared "call:0"
"Zheng" declared "call:0"
"RaphaelPlayer" declared "call:0"
"['RaphaelPlayer']" won the round 36 (stack = {'EvanPlayer': 1040, 'ZifengFoldMan': 925, 'JoyoPlayer': 0, 'YueShi': 925, 'Finneas': 985, 'Yuchun': 690, 'Zheng': 840, 'RaphaelPlayer': 2595})
player [EvanPlayer] gets hole card ['H2', 'CK'], current stack 1040
player [ZifengFoldMan] gets hole card ['C7', 'D8'], current stack 920
player [YueShi] gets hole card ['S6', 'CA'], current stack 915
player [Finneas] gets hole card ['S5', 'C3'], current stack 985
player [Yuchun] gets hole card ['D9', 'C4'], current stack 690
player [Zheng] gets hole card ['C6', 'S2'], current stack 840
player [RaphaelPlayer] gets hole card ['SK', 'SQ'], current stack 2595
Started the round 37
Street "preflop" started. (community card = [])
"Finneas" declared "call:10"
"Yuchun" declared "call:10"
"Zheng" declared "call:10"
"RaphaelPlayer" declared "raise:30"
"EvanPlayer" declared "call:30"
"ZifengFoldMan" declared "fold:0"
"YueShi" declared "fold:0"
"Finneas" declared "fold:0"
"Yuchun" declared "call:30"
"Zheng" declared "call:30"
Street "flop" started. (community card = ['S7', 'D5', 'HQ'])
"Yuchun" declared "call:0"
"Zheng" declared "call:0"
"RaphaelPlayer" declared "raise:155"
"EvanPlayer" declared "fold:155"
"Yuchun" declared "fold:0"
"Zheng" declared "fold:0"
"['RaphaelPlayer']" won the round 37 (stack = {'EvanPlayer': 1010, 'ZifengFoldMan': 920, 'JoyoPlayer': 0, 'YueShi': 915, 'Finneas': 975, 'Yuchun': 660, 'Zheng': 810, 'RaphaelPlayer': 2710})
player [EvanPlayer] gets hole card ['C3', 'CJ'], current stack 1010
player [ZifengFoldMan] gets hole card ['H8', 'D5'], current stack 920
player [YueShi] gets hole card ['DT', 'S5'], current stack 910
player [Finneas] gets hole card ['H2', 'C5'], current stack 965
player [Yuchun] gets hole card ['DJ', 'HT'], current stack 660
player [Zheng] gets hole card ['CT', 'C2'], current stack 810
player [RaphaelPlayer] gets hole card ['S9', 'DA'], current stack 2710
Started the round 38
Street "preflop" started. (community card = [])
"Yuchun" declared "call:10"
"Zheng" declared "call:10"
"RaphaelPlayer" declared "raise:30"
"EvanPlayer" declared "call:30"
"ZifengFoldMan" declared "fold:0"
"YueShi" declared "fold:0"
"Finneas" declared "fold:0"
"Yuchun" declared "call:30"
"Zheng" declared "call:30"
Street "flop" started. (community card = ['SA', 'C9', 'SQ'])
"Yuchun" declared "call:0"
"Zheng" declared "call:0"
"RaphaelPlayer" declared "raise:145"
"EvanPlayer" declared "fold:145"
"Yuchun" declared "call:145"
"Zheng" declared "call:145"
Street "turn" started. (community card = ['SA', 'C9', 'SQ', 'H9'])
"Yuchun" declared "call:0"
"Zheng" declared "call:0"
"RaphaelPlayer" declared "raise:580"
"Yuchun" declared "fold:0"
"Zheng" declared "fold:0"
"['RaphaelPlayer']" won the round 38 (stack = {'EvanPlayer': 980, 'ZifengFoldMan': 920, 'JoyoPlayer': 0, 'YueShi': 910, 'Finneas': 965, 'Yuchun': 485, 'Zheng': 635, 'RaphaelPlayer': 3105})
player [EvanPlayer] gets hole card ['H2', 'SQ'], current stack 980
player [ZifengFoldMan] gets hole card ['SK', 'H4'], current stack 920
player [YueShi] gets hole card ['H5', 'S8'], current stack 910
player [Finneas] gets hole card ['HT', 'C4'], current stack 960
player [Yuchun] gets hole card ['HJ', 'ST'], current stack 475
player [Zheng] gets hole card ['H8', 'S2'], current stack 635
player [RaphaelPlayer] gets hole card ['DK', 'C5'], current stack 3105
Started the round 39
Street "preflop" started. (community card = [])
"Zheng" declared "call:10"
"RaphaelPlayer" declared "fold:0"
"EvanPlayer" declared "call:10"
"ZifengFoldMan" declared "fold:0"
"YueShi" declared "fold:0"
"Finneas" declared "call:10"
"Yuchun" declared "call:10"
Street "flop" started. (community card = ['S9', 'S7', 'S3'])
"Finneas" declared "call:0"
"Yuchun" declared "call:0"
"Zheng" declared "call:0"
"EvanPlayer" declared "call:0"
Street "turn" started. (community card = ['S9', 'S7', 'S3', 'C6'])
"Finneas" declared "call:0"
"Yuchun" declared "call:0"
"Zheng" declared "call:0"
"EvanPlayer" declared "fold:0"
Street "river" started. (community card = ['S9', 'S7', 'S3', 'C6', 'S6'])
"Finneas" declared "call:0"
"Yuchun" declared "call:0"
"Zheng" declared "call:0"
"['Yuchun']" won the round 39 (stack = {'EvanPlayer': 970, 'ZifengFoldMan': 920, 'JoyoPlayer': 0, 'YueShi': 910, 'Finneas': 955, 'Yuchun': 515, 'Zheng': 625, 'RaphaelPlayer': 3105})
player [EvanPlayer] gets hole card ['DK', 'S9'], current stack 970
player [ZifengFoldMan] gets hole card ['HK', 'C7'], current stack 920
player [YueShi] gets hole card ['SK', 'S5'], current stack 910
player [Finneas] gets hole card ['C9', 'S3'], current stack 955
player [Yuchun] gets hole card ['SA', 'D3'], current stack 510
player [Zheng] gets hole card ['S4', 'H5'], current stack 615
player [RaphaelPlayer] gets hole card ['CT', 'HT'], current stack 3105
Started the round 40
Street "preflop" started. (community card = [])
"RaphaelPlayer" declared "raise:30"
"EvanPlayer" declared "call:30"
"ZifengFoldMan" declared "fold:0"
"YueShi" declared "fold:0"
"Finneas" declared "fold:0"
"Yuchun" declared "call:30"
"Zheng" declared "call:30"
Street "flop" started. (community card = ['D8', 'H8', 'C2'])
"Yuchun" declared "call:0"
"Zheng" declared "call:0"
"RaphaelPlayer" declared "call:0"
"EvanPlayer" declared "fold:0"
Street "turn" started. (community card = ['D8', 'H8', 'C2', 'DJ'])
"Yuchun" declared "call:0"
"Zheng" declared "call:0"
"RaphaelPlayer" declared "raise:130"
"Yuchun" declared "fold:0"
"Zheng" declared "call:130"
Street "river" started. (community card = ['D8', 'H8', 'C2', 'DJ', 'D7'])
"Zheng" declared "call:0"
"RaphaelPlayer" declared "raise:390"
"Zheng" declared "fold:0"
"['RaphaelPlayer']" won the round 40 (stack = {'EvanPlayer': 940, 'ZifengFoldMan': 920, 'JoyoPlayer': 0, 'YueShi': 910, 'Finneas': 955, 'Yuchun': 485, 'Zheng': 465, 'RaphaelPlayer': 3325})
player [EvanPlayer] gets hole card ['CT', 'CJ'], current stack 940
player [ZifengFoldMan] gets hole card ['C6', 'S9'], current stack 920
player [YueShi] gets hole card ['CQ', 'H6'], current stack 910
player [Finneas] gets hole card ['S6', 'D7'], current stack 955
player [Yuchun] gets hole card ['H7', 'S7'], current stack 485
player [Zheng] gets hole card ['H3', 'H4'], current stack 460
player [RaphaelPlayer] gets hole card ['C8', 'SA'], current stack 3315
Started the round 41
Street "preflop" started. (community card = [])
"EvanPlayer" declared "raise:940"
"ZifengFoldMan" declared "fold:0"
"YueShi" declared "fold:0"
"Finneas" declared "fold:0"
"Yuchun" declared "fold:0"
"Zheng" declared "fold:0"
"RaphaelPlayer" declared "fold:0"
"['EvanPlayer']" won the round 41 (stack = {'EvanPlayer': 955, 'ZifengFoldMan': 920, 'JoyoPlayer': 0, 'YueShi': 910, 'Finneas': 955, 'Yuchun': 485, 'Zheng': 460, 'RaphaelPlayer': 3315})
player [EvanPlayer] gets hole card ['DQ', 'H3'], current stack 945
player [ZifengFoldMan] gets hole card ['C6', 'C2'], current stack 920
player [YueShi] gets hole card ['HT', 'C8'], current stack 910
player [Finneas] gets hole card ['S2', 'CA'], current stack 955
player [Yuchun] gets hole card ['HJ', 'C5'], current stack 485
player [Zheng] gets hole card ['S7', 'CQ'], current stack 460
player [RaphaelPlayer] gets hole card ['H9', 'C3'], current stack 3310
Started the round 42
Street "preflop" started. (community card = [])
"ZifengFoldMan" declared "fold:0"
"YueShi" declared "fold:0"
"Finneas" declared "call:10"
"Yuchun" declared "fold:0"
"Zheng" declared "call:10"
"RaphaelPlayer" declared "fold:0"
"EvanPlayer" declared "fold:10"
Street "flop" started. (community card = ['D2', 'S3', 'D9'])
"Finneas" declared "call:0"
"Zheng" declared "call:0"
Street "turn" started. (community card = ['D2', 'S3', 'D9', 'HA'])
"Finneas" declared "call:0"
"Zheng" declared "call:0"
Street "river" started. (community card = ['D2', 'S3', 'D9', 'HA', 'H5'])
"Finneas" declared "call:0"
"Zheng" declared "call:0"
"['Finneas']" won the round 42 (stack = {'EvanPlayer': 945, 'ZifengFoldMan': 920, 'JoyoPlayer': 0, 'YueShi': 910, 'Finneas': 980, 'Yuchun': 485, 'Zheng': 450, 'RaphaelPlayer': 3310})
player [EvanPlayer] gets hole card ['SK', 'H3'], current stack 940
player [ZifengFoldMan] gets hole card ['SA', 'D9'], current stack 910
player [YueShi] gets hole card ['C7', 'C9'], current stack 910
player [Finneas] gets hole card ['HQ', 'S4'], current stack 980
player [Yuchun] gets hole card ['S8', 'S2'], current stack 485
player [Zheng] gets hole card ['HT', 'CQ'], current stack 450
player [RaphaelPlayer] gets hole card ['DA', 'C5'], current stack 3310
Started the round 43
Street "preflop" started. (community card = [])
"YueShi" declared "fold:0"
"Finneas" declared "call:10"
"Yuchun" declared "fold:0"
"Zheng" declared "call:10"
"RaphaelPlayer" declared "call:10"
"EvanPlayer" declared "fold:10"
"ZifengFoldMan" declared "fold:0"
Street "flop" started. (community card = ['S7', 'DK', 'CA'])
"Finneas" declared "call:0"
"Zheng" declared "call:0"
"RaphaelPlayer" declared "raise:55"
"Finneas" declared "fold:0"
"Zheng" declared "call:55"
Street "turn" started. (community card = ['S7', 'DK', 'CA', 'DT'])
"Zheng" declared "call:0"
"RaphaelPlayer" declared "raise:165"
"Zheng" declared "fold:0"
"['RaphaelPlayer']" won the round 43 (stack = {'EvanPlayer': 940, 'ZifengFoldMan': 910, 'JoyoPlayer': 0, 'YueShi': 910, 'Finneas': 970, 'Yuchun': 485, 'Zheng': 385, 'RaphaelPlayer': 3400})
player [EvanPlayer] gets hole card ['ST', 'HJ'], current stack 940
player [ZifengFoldMan] gets hole card ['HT', 'HQ'], current stack 905
player [YueShi] gets hole card ['DT', 'H8'], current stack 900
player [Finneas] gets hole card ['D6', 'C2'], current stack 970
player [Yuchun] gets hole card ['D7', 'CQ'], current stack 485
player [Zheng] gets hole card ['SJ', 'DK'], current stack 385
player [RaphaelPlayer] gets hole card ['C6', 'DQ'], current stack 3400
Started the round 44
Street "preflop" started. (community card = [])
"Finneas" declared "call:10"
"Yuchun" declared "fold:0"
"Zheng" declared "call:10"
"RaphaelPlayer" declared "fold:0"
"EvanPlayer" declared "raise:940"
"ZifengFoldMan" declared "fold:0"
"YueShi" declared "fold:0"
"Finneas" declared "fold:0"
"Zheng" declared "fold:0"
"['EvanPlayer']" won the round 44 (stack = {'EvanPlayer': 975, 'ZifengFoldMan': 905, 'JoyoPlayer': 0, 'YueShi': 900, 'Finneas': 960, 'Yuchun': 485, 'Zheng': 375, 'RaphaelPlayer': 3400})
player [EvanPlayer] gets hole card ['D3', 'S2'], current stack 975
player [ZifengFoldMan] gets hole card ['H4', 'H7'], current stack 905
player [YueShi] gets hole card ['C3', 'HQ'], current stack 895
player [Finneas] gets hole card ['SQ', 'HK'], current stack 950
player [Yuchun] gets hole card ['DJ', 'CQ'], current stack 485
player [Zheng] gets hole card ['C8', 'SJ'], current stack 375
player [RaphaelPlayer] gets hole card ['DT', 'H5'], current stack 3400
Started the round 45
Street "preflop" started. (community card = [])
"Yuchun" declared "fold:0"
"Zheng" declared "call:10"
"RaphaelPlayer" declared "fold:0"
"EvanPlayer" declared "fold:10"
"ZifengFoldMan" declared "fold:0"
"YueShi" declared "fold:0"
"Finneas" declared "call:10"
Street "flop" started. (community card = ['H2', 'D9', 'S7'])
"Finneas" declared "call:0"
"Zheng" declared "call:0"
Street "turn" started. (community card = ['H2', 'D9', 'S7', 'C9'])
"Finneas" declared "call:0"
"Zheng" declared "call:0"
Street "river" started. (community card = ['H2', 'D9', 'S7', 'C9', 'H8'])
"Finneas" declared "call:0"
"Zheng" declared "call:0"
"['Zheng']" won the round 45 (stack = {'EvanPlayer': 975, 'ZifengFoldMan': 905, 'JoyoPlayer': 0, 'YueShi': 895, 'Finneas': 950, 'Yuchun': 485, 'Zheng': 390, 'RaphaelPlayer': 3400})
player [EvanPlayer] gets hole card ['D5', 'C3'], current stack 975
player [ZifengFoldMan] gets hole card ['S9', 'H3'], current stack 905
player [YueShi] gets hole card ['H6', 'D2'], current stack 895
player [Finneas] gets hole card ['H4', 'D9'], current stack 945
player [Yuchun] gets hole card ['SJ', 'CJ'], current stack 475
player [Zheng] gets hole card ['S4', 'DT'], current stack 390
player [RaphaelPlayer] gets hole card ['DQ', 'CA'], current stack 3400
Started the round 46
Street "preflop" started. (community card = [])
"Zheng" declared "call:10"
"RaphaelPlayer" declared "raise:30"
"EvanPlayer" declared "raise:975"
"ZifengFoldMan" declared "fold:0"
"YueShi" declared "fold:0"
"Finneas" declared "fold:0"
"Yuchun" declared "fold:0"
"Zheng" declared "fold:0"
"RaphaelPlayer" declared "fold:0"
"['EvanPlayer']" won the round 46 (stack = {'EvanPlayer': 1030, 'ZifengFoldMan': 905, 'JoyoPlayer': 0, 'YueShi': 895, 'Finneas': 945, 'Yuchun': 475, 'Zheng': 380, 'RaphaelPlayer': 3370})
player [EvanPlayer] gets hole card ['C9', 'D5'], current stack 1030
player [ZifengFoldMan] gets hole card ['C7', 'H5'], current stack 905
player [YueShi] gets hole card ['S7', 'DK'], current stack 895
player [Finneas] gets hole card ['S9', 'S8'], current stack 945
player [Yuchun] gets hole card ['S4', 'HQ'], current stack 470
player [Zheng] gets hole card ['D8', 'CK'], current stack 370
player [RaphaelPlayer] gets hole card ['D7', 'H8'], current stack 3370
Started the round 47
Street "preflop" started. (community card = [])
"RaphaelPlayer" declared "fold:0"
"EvanPlayer" declared "call:10"
"ZifengFoldMan" declared "fold:0"
"YueShi" declared "fold:0"
"Finneas" declared "call:10"
"Yuchun" declared "fold:0"
"Zheng" declared "call:10"
Street "flop" started. (community card = ['DT', 'D6', 'S2'])
"Zheng" declared "call:0"
"EvanPlayer" declared "raise:1020"
"Finneas" declared "fold:0"
"Zheng" declared "fold:0"
"['EvanPlayer']" won the round 47 (stack = {'EvanPlayer': 1055, 'ZifengFoldMan': 905, 'JoyoPlayer': 0, 'YueShi': 895, 'Finneas': 935, 'Yuchun': 470, 'Zheng': 370, 'RaphaelPlayer': 3370})
player [EvanPlayer] gets hole card ['S6', 'D6'], current stack 1055
player [ZifengFoldMan] gets hole card ['D7', 'SJ'], current stack 905
player [YueShi] gets hole card ['HT', 'C2'], current stack 895
player [Finneas] gets hole card ['SA', 'H3'], current stack 935
player [Yuchun] gets hole card ['SQ', 'C4'], current stack 470
player [Zheng] gets hole card ['CQ', 'D9'], current stack 365
player [RaphaelPlayer] gets hole card ['CJ', 'D4'], current stack 3360
Started the round 48
Street "preflop" started. (community card = [])
"EvanPlayer" declared "raise:1055"
"ZifengFoldMan" declared "fold:0"
"YueShi" declared "fold:0"
"Finneas" declared "fold:0"
"Yuchun" declared "fold:0"
"Zheng" declared "fold:0"
"RaphaelPlayer" declared "fold:0"
"['EvanPlayer']" won the round 48 (stack = {'EvanPlayer': 1070, 'ZifengFoldMan': 905, 'JoyoPlayer': 0, 'YueShi': 895, 'Finneas': 935, 'Yuchun': 470, 'Zheng': 365, 'RaphaelPlayer': 3360})
player [EvanPlayer] gets hole card ['CQ', 'C3'], current stack 1060
player [ZifengFoldMan] gets hole card ['DA', 'C5'], current stack 905
player [YueShi] gets hole card ['DQ', 'D2'], current stack 895
player [Finneas] gets hole card ['CJ', 'H3'], current stack 935
player [Yuchun] gets hole card ['CK', 'H8'], current stack 470
player [Zheng] gets hole card ['H9', 'SK'], current stack 365
player [RaphaelPlayer] gets hole card ['SJ', 'C8'], current stack 3355
Started the round 49
Street "preflop" started. (community card = [])
"ZifengFoldMan" declared "fold:0"
"YueShi" declared "fold:0"
"Finneas" declared "call:10"
"Yuchun" declared "fold:0"
"Zheng" declared "call:10"
"RaphaelPlayer" declared "call:10"
"EvanPlayer" declared "call:10"
Street "flop" started. (community card = ['D9', 'D4', 'C9'])
"RaphaelPlayer" declared "call:0"
"EvanPlayer" declared "raise:1060"
"Finneas" declared "fold:0"
"Zheng" declared "call:1060"
"RaphaelPlayer" declared "fold:0"
Street "turn" started. (community card = ['D9', 'D4', 'C9', 'D6'])
Street "river" started. (community card = ['D9', 'D4', 'C9', 'D6', 'DJ'])
"['Zheng']" won the round 49 (stack = {'EvanPlayer': 705, 'ZifengFoldMan': 905, 'JoyoPlayer': 0, 'YueShi': 895, 'Finneas': 925, 'Yuchun': 470, 'Zheng': 750, 'RaphaelPlayer': 3350})
player [EvanPlayer] gets hole card ['H7', 'S4'], current stack 700
player [ZifengFoldMan] gets hole card ['CQ', 'H6'], current stack 895
player [YueShi] gets hole card ['S2', 'S9'], current stack 895
player [Finneas] gets hole card ['C7', 'C9'], current stack 925
player [Yuchun] gets hole card ['C6', 'CJ'], current stack 470
player [Zheng] gets hole card ['H8', 'HT'], current stack 750
player [RaphaelPlayer] gets hole card ['S8', 'H2'], current stack 3350
Started the round 50
Street "preflop" started. (community card = [])
"YueShi" declared "fold:0"
"Finneas" declared "call:10"
"Yuchun" declared "fold:0"
"Zheng" declared "call:10"
"RaphaelPlayer" declared "fold:0"
"EvanPlayer" declared "fold:10"
"ZifengFoldMan" declared "fold:0"
Street "flop" started. (community card = ['D4', 'D3', 'S3'])
"Finneas" declared "call:0"
"Zheng" declared "call:0"
Street "turn" started. (community card = ['D4', 'D3', 'S3', 'D8'])
"Finneas" declared "call:0"
"Zheng" declared "call:0"
Street "river" started. (community card = ['D4', 'D3', 'S3', 'D8', 'DQ'])
"Finneas" declared "call:0"
"Zheng" declared "call:0"
"['Zheng']" won the round 50 (stack = {'EvanPlayer': 700, 'ZifengFoldMan': 895, 'JoyoPlayer': 0, 'YueShi': 895, 'Finneas': 915, 'Yuchun': 470, 'Zheng': 775, 'RaphaelPlayer': 3350})

Game Results:
------------------------------------------------------------
Game 1:
Winner: RaphaelPlayer (stack: 3350)
All players' stacks:
  EvanPlayer: 700
  ZifengFoldMan: 895
  JoyoPlayer: 0
  YueShi: 895
  Finneas: 915
  Yuchun: 470
  Zheng: 775
  RaphaelPlayer: 3350
------------------------------------------------------------
