player [EvanPlayer] gets hole card ['H5', 'S2'], current stack 1000
player [ZifengFoldMan] gets hole card ['C4', 'S4'], current stack 995
player [JoyoPlayer] gets hole card ['DQ', 'H8'], current stack 990
player [YueShi] gets hole card ['H6', 'S3'], current stack 1000
player [Finneas] gets hole card ['C8', 'H7'], current stack 1000
player [Yuchun] gets hole card ['S6', 'H3'], current stack 1000
player [Zheng] gets hole card ['D4', 'SJ'], current stack 1000
player [RaphaelPlayer] gets hole card ['C3', 'D5'], current stack 1000
Started the round 1
Street "preflop" started. (community card = [])
"YueShi" declared "fold:0"
"Finneas" declared "call:10"
"Yuchun" declared "fold:0"
"Zheng" declared "call:10"
"RaphaelPlayer" declared "fold:0"
"EvanPlayer" declared "raise:1000"
"ZifengFoldMan" declared "fold:0"
"JoyoPlayer" declared "call:1000"
"Finneas" declared "fold:0"
"Zheng" declared "fold:0"
Street "flop" started. (community card = ['C7', 'S8', 'SQ'])
Street "turn" started. (community card = ['C7', 'S8', 'SQ', 'H2'])
Street "river" started. (community card = ['C7', 'S8', 'SQ', 'H2', 'D9'])
"['JoyoPlayer']" won the round 1 (stack = {'EvanPlayer': 0, 'ZifengFoldMan': 995, 'JoyoPlayer': 2025, 'YueShi': 1000, 'Finneas': 990, 'Yuchun': 1000, 'Zheng': 990, 'RaphaelPlayer': 1000})
player [ZifengFoldMan] gets hole card ['C8', 'HJ'], current stack 995
player [JoyoPlayer] gets hole card ['S4', 'CJ'], current stack 2020
player [YueShi] gets hole card ['ST', 'HK'], current stack 990
player [Finneas] gets hole card ['S2', 'H4'], current stack 990
player [Yuchun] gets hole card ['D8', 'S8'], current stack 1000
player [Zheng] gets hole card ['C5', 'C2'], current stack 990
player [RaphaelPlayer] gets hole card ['SA', 'CK'], current stack 1000
Started the round 2
Street "preflop" started. (community card = [])
"Finneas" declared "call:10"
"Yuchun" declared "fold:0"
"Zheng" declared "call:10"
"RaphaelPlayer" declared "raise:30"
"ZifengFoldMan" declared "fold:0"
"JoyoPlayer" declared "raise:50"
"YueShi" declared "fold:0"
"Finneas" declared "fold:0"
"Zheng" declared "fold:0"
"RaphaelPlayer" declared "call:50"
Street "flop" started. (community card = ['H6', 'D7', 'H8'])
"JoyoPlayer" declared "fold:0"
"['RaphaelPlayer']" won the round 2 (stack = {'EvanPlayer': 0, 'ZifengFoldMan': 995, 'JoyoPlayer': 1975, 'YueShi': 990, 'Finneas': 980, 'Yuchun': 1000, 'Zheng': 980, 'RaphaelPlayer': 1080})
player [ZifengFoldMan] gets hole card ['ST', 'C3'], current stack 995
player [JoyoPlayer] gets hole card ['DQ', 'HK'], current stack 1975
player [YueShi] gets hole card ['CA', 'C4'], current stack 985
player [Finneas] gets hole card ['CT', 'H3'], current stack 970
player [Yuchun] gets hole card ['D3', 'CQ'], current stack 1000
player [Zheng] gets hole card ['S7', 'HJ'], current stack 980
player [RaphaelPlayer] gets hole card ['SK', 'H2'], current stack 1080
Started the round 3
Street "preflop" started. (community card = [])
"Yuchun" declared "fold:0"
"Zheng" declared "call:10"
"RaphaelPlayer" declared "fold:0"
"ZifengFoldMan" declared "fold:0"
"JoyoPlayer" declared "raise:15"
"YueShi" declared "fold:0"
"Finneas" declared "call:15"
"Zheng" declared "call:15"
Street "flop" started. (community card = ['H8', 'S9', 'D4'])
"Finneas" declared "call:0"
"Zheng" declared "call:0"
"JoyoPlayer" declared "raise:10"
"Finneas" declared "call:10"
"Zheng" declared "call:10"
Street "turn" started. (community card = ['H8', 'S9', 'D4', 'DJ'])
"Finneas" declared "call:0"
"Zheng" declared "call:0"
"JoyoPlayer" declared "fold:0"
Street "river" started. (community card = ['H8', 'S9', 'D4', 'DJ', 'C2'])
"Finneas" declared "call:0"
"Zheng" declared "call:0"
"['Zheng']" won the round 3 (stack = {'EvanPlayer': 0, 'ZifengFoldMan': 995, 'JoyoPlayer': 1950, 'YueShi': 985, 'Finneas': 955, 'Yuchun': 1000, 'Zheng': 1035, 'RaphaelPlayer': 1080})
player [ZifengFoldMan] gets hole card ['HA', 'D7'], current stack 995
player [JoyoPlayer] gets hole card ['S6', 'DA'], current stack 1950
player [YueShi] gets hole card ['C3', 'S8'], current stack 985
player [Finneas] gets hole card ['C8', 'C2'], current stack 950
player [Yuchun] gets hole card ['S9', 'H9'], current stack 990
player [Zheng] gets hole card ['HQ', 'D3'], current stack 1035
player [RaphaelPlayer] gets hole card ['C5', 'C9'], current stack 1080
Started the round 4
Street "preflop" started. (community card = [])
"Zheng" declared "call:10"
"RaphaelPlayer" declared "call:10"
"ZifengFoldMan" declared "fold:0"
"JoyoPlayer" declared "fold:0"
"YueShi" declared "fold:0"
"Finneas" declared "call:10"
"Yuchun" declared "fold:0"
Street "flop" started. (community card = ['S2', 'CQ', 'D8'])
"Finneas" declared "call:0"
"Zheng" declared "call:0"
"RaphaelPlayer" declared "call:0"
Street "turn" started. (community card = ['S2', 'CQ', 'D8', 'D2'])
"Finneas" declared "raise:477"
"Zheng" declared "fold:0"
"RaphaelPlayer" declared "fold:0"
"['Finneas']" won the round 4 (stack = {'EvanPlayer': 0, 'ZifengFoldMan': 995, 'JoyoPlayer': 1950, 'YueShi': 985, 'Finneas': 985, 'Yuchun': 990, 'Zheng': 1025, 'RaphaelPlayer': 1070})
player [ZifengFoldMan] gets hole card ['HA', 'D4'], current stack 995
player [JoyoPlayer] gets hole card ['CK', 'D2'], current stack 1950
player [YueShi] gets hole card ['D5', 'C3'], current stack 985
player [Finneas] gets hole card ['CQ', 'C8'], current stack 985
player [Yuchun] gets hole card ['C7', 'H8'], current stack 985
player [Zheng] gets hole card ['SQ', 'H3'], current stack 1015
player [RaphaelPlayer] gets hole card ['CA', 'DJ'], current stack 1070
Started the round 5
Street "preflop" started. (community card = [])
"RaphaelPlayer" declared "raise:30"
"ZifengFoldMan" declared "fold:0"
"JoyoPlayer" declared "fold:0"
"YueShi" declared "fold:0"
"Finneas" declared "fold:0"
"Yuchun" declared "fold:0"
"Zheng" declared "fold:0"
"['RaphaelPlayer']" won the round 5 (stack = {'EvanPlayer': 0, 'ZifengFoldMan': 995, 'JoyoPlayer': 1950, 'YueShi': 985, 'Finneas': 985, 'Yuchun': 985, 'Zheng': 1015, 'RaphaelPlayer': 1085})
player [ZifengFoldMan] gets hole card ['C3', 'CQ'], current stack 995
player [JoyoPlayer] gets hole card ['HQ', 'C7'], current stack 1950
player [YueShi] gets hole card ['S7', 'D8'], current stack 985
player [Finneas] gets hole card ['HA', 'H8'], current stack 985
player [Yuchun] gets hole card ['SQ', 'CJ'], current stack 985
player [Zheng] gets hole card ['S5', 'DJ'], current stack 1010
player [RaphaelPlayer] gets hole card ['D9', 'C9'], current stack 1075
Started the round 6
Street "preflop" started. (community card = [])
"ZifengFoldMan" declared "fold:0"
"JoyoPlayer" declared "raise:15"
"YueShi" declared "fold:0"
"Finneas" declared "call:15"
"Yuchun" declared "fold:0"
"Zheng" declared "call:15"
"RaphaelPlayer" declared "raise:45"
"JoyoPlayer" declared "fold:0"
"Finneas" declared "fold:0"
"Zheng" declared "fold:0"
"['RaphaelPlayer']" won the round 6 (stack = {'EvanPlayer': 0, 'ZifengFoldMan': 995, 'JoyoPlayer': 1935, 'YueShi': 985, 'Finneas': 970, 'Yuchun': 985, 'Zheng': 1000, 'RaphaelPlayer': 1130})
player [ZifengFoldMan] gets hole card ['CT', 'H7'], current stack 985
player [JoyoPlayer] gets hole card ['D2', 'D4'], current stack 1935
player [YueShi] gets hole card ['CA', 'H4'], current stack 985
player [Finneas] gets hole card ['SA', 'S9'], current stack 970
player [Yuchun] gets hole card ['CJ', 'DJ'], current stack 985
player [Zheng] gets hole card ['S2', 'SJ'], current stack 1000
player [RaphaelPlayer] gets hole card ['ST', 'C2'], current stack 1125
Started the round 7
Street "preflop" started. (community card = [])
"JoyoPlayer" declared "fold:0"
"YueShi" declared "fold:0"
"Finneas" declared "call:10"
"Yuchun" declared "fold:0"
"Zheng" declared "call:10"
"RaphaelPlayer" declared "fold:0"
"ZifengFoldMan" declared "fold:0"
Street "flop" started. (community card = ['D9', 'HA', 'DK'])
"Finneas" declared "call:0"
"Zheng" declared "call:0"
Street "turn" started. (community card = ['D9', 'HA', 'DK', 'H3'])
"Finneas" declared "call:0"
"Zheng" declared "call:0"
Street "river" started. (community card = ['D9', 'HA', 'DK', 'H3', 'C9'])
"Finneas" declared "raise:485"
"Zheng" declared "fold:0"
"['Finneas']" won the round 7 (stack = {'EvanPlayer': 0, 'ZifengFoldMan': 985, 'JoyoPlayer': 1935, 'YueShi': 985, 'Finneas': 995, 'Yuchun': 985, 'Zheng': 990, 'RaphaelPlayer': 1125})
player [ZifengFoldMan] gets hole card ['S3', 'C3'], current stack 980
player [JoyoPlayer] gets hole card ['D2', 'D9'], current stack 1925
player [YueShi] gets hole card ['S6', 'C6'], current stack 985
player [Finneas] gets hole card ['CA', 'DA'], current stack 995
player [Yuchun] gets hole card ['D6', 'CJ'], current stack 985
player [Zheng] gets hole card ['SA', 'D5'], current stack 990
player [RaphaelPlayer] gets hole card ['S4', 'CT'], current stack 1125
Started the round 8
Street "preflop" started. (community card = [])
"YueShi" declared "fold:0"
"Finneas" declared "raise:505"
"Yuchun" declared "fold:0"
"Zheng" declared "fold:0"
"RaphaelPlayer" declared "fold:0"
"ZifengFoldMan" declared "fold:0"
"JoyoPlayer" declared "fold:0"
"['Finneas']" won the round 8 (stack = {'EvanPlayer': 0, 'ZifengFoldMan': 980, 'JoyoPlayer': 1925, 'YueShi': 985, 'Finneas': 1010, 'Yuchun': 985, 'Zheng': 990, 'RaphaelPlayer': 1125})
player [ZifengFoldMan] gets hole card ['C3', 'C8'], current stack 980
player [JoyoPlayer] gets hole card ['C5', 'DK'], current stack 1920
player [YueShi] gets hole card ['DQ', 'CA'], current stack 975
player [Finneas] gets hole card ['D9', 'C2'], current stack 1010
player [Yuchun] gets hole card ['H2', 'DA'], current stack 985
player [Zheng] gets hole card ['D3', 'D7'], current stack 990
player [RaphaelPlayer] gets hole card ['CJ', 'S4'], current stack 1125
Started the round 9
Street "preflop" started. (community card = [])
"Finneas" declared "call:10"
"Yuchun" declared "fold:0"
"Zheng" declared "call:10"
"RaphaelPlayer" declared "fold:0"
"ZifengFoldMan" declared "fold:0"
"JoyoPlayer" declared "fold:0"
"YueShi" declared "fold:0"
Street "flop" started. (community card = ['HA', 'SJ', 'SK'])
"Finneas" declared "call:0"
"Zheng" declared "call:0"
Street "turn" started. (community card = ['HA', 'SJ', 'SK', 'H5'])
"Finneas" declared "call:0"
"Zheng" declared "call:0"
Street "river" started. (community card = ['HA', 'SJ', 'SK', 'H5', 'H9'])
"Finneas" declared "call:0"
"Zheng" declared "call:0"
"['Finneas']" won the round 9 (stack = {'EvanPlayer': 0, 'ZifengFoldMan': 980, 'JoyoPlayer': 1920, 'YueShi': 975, 'Finneas': 1035, 'Yuchun': 985, 'Zheng': 980, 'RaphaelPlayer': 1125})
player [ZifengFoldMan] gets hole card ['C9', 'H6'], current stack 980
player [JoyoPlayer] gets hole card ['S5', 'HA'], current stack 1920
player [YueShi] gets hole card ['CA', 'D8'], current stack 970
player [Finneas] gets hole card ['D9', 'S4'], current stack 1025
player [Yuchun] gets hole card ['C3', 'S8'], current stack 985
player [Zheng] gets hole card ['H5', 'C2'], current stack 980
player [RaphaelPlayer] gets hole card ['HJ', 'DK'], current stack 1125
Started the round 10
Street "preflop" started. (community card = [])
"Yuchun" declared "call:10"
"Zheng" declared "call:10"
"RaphaelPlayer" declared "call:10"
"ZifengFoldMan" declared "fold:0"
"JoyoPlayer" declared "fold:0"
"YueShi" declared "fold:0"
"Finneas" declared "call:10"
Street "flop" started. (community card = ['CT', 'H7', 'S2'])
"Finneas" declared "call:0"
"Yuchun" declared "call:0"
"Zheng" declared "call:0"
"RaphaelPlayer" declared "call:0"
Street "turn" started. (community card = ['CT', 'H7', 'S2', 'H8'])
"Finneas" declared "call:0"
"Yuchun" declared "call:0"
"Zheng" declared "call:0"
"RaphaelPlayer" declared "call:0"
Street "river" started. (community card = ['CT', 'H7', 'S2', 'H8', 'SQ'])
"Finneas" declared "call:0"
"Yuchun" declared "call:0"
"Zheng" declared "call:0"
"RaphaelPlayer" declared "call:0"
"['Yuchun']" won the round 10 (stack = {'EvanPlayer': 0, 'ZifengFoldMan': 980, 'JoyoPlayer': 1920, 'YueShi': 970, 'Finneas': 1025, 'Yuchun': 1020, 'Zheng': 970, 'RaphaelPlayer': 1115})
player [ZifengFoldMan] gets hole card ['D6', 'S7'], current stack 980
player [JoyoPlayer] gets hole card ['HT', 'D7'], current stack 1920
player [YueShi] gets hole card ['C5', 'S5'], current stack 970
player [Finneas] gets hole card ['S4', 'ST'], current stack 1020
player [Yuchun] gets hole card ['H7', 'C7'], current stack 1010
player [Zheng] gets hole card ['S6', 'C4'], current stack 970
player [RaphaelPlayer] gets hole card ['SA', 'C9'], current stack 1115
Started the round 11
Street "preflop" started. (community card = [])
"Zheng" declared "call:10"
"RaphaelPlayer" declared "raise:30"
"ZifengFoldMan" declared "fold:0"
"JoyoPlayer" declared "fold:0"
"YueShi" declared "fold:0"
"Finneas" declared "fold:0"
"Yuchun" declared "call:30"
"Zheng" declared "fold:0"
Street "flop" started. (community card = ['H4', 'CJ', 'HK'])
"Yuchun" declared "call:0"
"RaphaelPlayer" declared "call:0"
Street "turn" started. (community card = ['H4', 'CJ', 'HK', 'HJ'])
"Yuchun" declared "call:0"
"RaphaelPlayer" declared "call:0"
Street "river" started. (community card = ['H4', 'CJ', 'HK', 'HJ', 'S3'])
"Yuchun" declared "raise:40"
"RaphaelPlayer" declared "call:40"
"['Yuchun']" won the round 11 (stack = {'EvanPlayer': 0, 'ZifengFoldMan': 980, 'JoyoPlayer': 1920, 'YueShi': 970, 'Finneas': 1020, 'Yuchun': 1105, 'Zheng': 960, 'RaphaelPlayer': 1045})
player [ZifengFoldMan] gets hole card ['DQ', 'CJ'], current stack 980
player [JoyoPlayer] gets hole card ['DJ', 'CQ'], current stack 1920
player [YueShi] gets hole card ['C9', 'C2'], current stack 970
player [Finneas] gets hole card ['C6', 'C5'], current stack 1020
player [Yuchun] gets hole card ['C7', 'D5'], current stack 1100
player [Zheng] gets hole card ['C8', 'H3'], current stack 950
player [RaphaelPlayer] gets hole card ['D8', 'C4'], current stack 1045
Started the round 12
Street "preflop" started. (community card = [])
"RaphaelPlayer" declared "fold:0"
"ZifengFoldMan" declared "fold:0"
"JoyoPlayer" declared "fold:0"
"YueShi" declared "fold:0"
"Finneas" declared "call:10"
"Yuchun" declared "call:10"
"Zheng" declared "call:10"
Street "flop" started. (community card = ['S5', 'D7', 'CA'])
"Yuchun" declared "raise:40"
"Zheng" declared "fold:0"
"Finneas" declared "fold:0"
"['Yuchun']" won the round 12 (stack = {'EvanPlayer': 0, 'ZifengFoldMan': 980, 'JoyoPlayer': 1920, 'YueShi': 970, 'Finneas': 1010, 'Yuchun': 1125, 'Zheng': 950, 'RaphaelPlayer': 1045})
player [ZifengFoldMan] gets hole card ['CJ', 'DK'], current stack 980
player [JoyoPlayer] gets hole card ['ST', 'S5'], current stack 1920
player [YueShi] gets hole card ['H3', 'D7'], current stack 970
player [Finneas] gets hole card ['HJ', 'HK'], current stack 1010
player [Yuchun] gets hole card ['CA', 'H8'], current stack 1125
player [Zheng] gets hole card ['SQ', 'HT'], current stack 945
player [RaphaelPlayer] gets hole card ['H2', 'HQ'], current stack 1035
Started the round 13
Street "preflop" started. (community card = [])
"ZifengFoldMan" declared "fold:0"
"JoyoPlayer" declared "fold:0"
"YueShi" declared "fold:0"
"Finneas" declared "call:10"
"Yuchun" declared "call:10"
"Zheng" declared "call:10"
"RaphaelPlayer" declared "fold:0"
Street "flop" started. (community card = ['C3', 'C2', 'H4'])
"Zheng" declared "call:0"
"Finneas" declared "call:0"
"Yuchun" declared "call:0"
Street "turn" started. (community card = ['C3', 'C2', 'H4', 'C7'])
"Zheng" declared "call:0"
"Finneas" declared "call:0"
"Yuchun" declared "call:0"
Street "river" started. (community card = ['C3', 'C2', 'H4', 'C7', 'S3'])
"Zheng" declared "call:0"
"Finneas" declared "call:0"
"Yuchun" declared "call:0"
"['Yuchun']" won the round 13 (stack = {'EvanPlayer': 0, 'ZifengFoldMan': 980, 'JoyoPlayer': 1920, 'YueShi': 970, 'Finneas': 1000, 'Yuchun': 1155, 'Zheng': 940, 'RaphaelPlayer': 1035})
player [ZifengFoldMan] gets hole card ['HT', 'S8'], current stack 970
player [JoyoPlayer] gets hole card ['HQ', 'C9'], current stack 1920
player [YueShi] gets hole card ['H6', 'C7'], current stack 970
player [Finneas] gets hole card ['CA', 'C3'], current stack 1000
player [Yuchun] gets hole card ['D9', 'DQ'], current stack 1155
player [Zheng] gets hole card ['ST', 'HJ'], current stack 940
player [RaphaelPlayer] gets hole card ['C6', 'DJ'], current stack 1030
Started the round 14
Street "preflop" started. (community card = [])
"JoyoPlayer" declared "raise:15"
"YueShi" declared "fold:0"
"Finneas" declared "call:15"
"Yuchun" declared "call:15"
"Zheng" declared "call:15"
"RaphaelPlayer" declared "fold:0"
"ZifengFoldMan" declared "fold:0"
Street "flop" started. (community card = ['C5', 'CT', 'H8'])
"JoyoPlayer" declared "raise:10"
"Finneas" declared "call:10"
"Yuchun" declared "call:10"
"Zheng" declared "call:10"
Street "turn" started. (community card = ['C5', 'CT', 'H8', 'DA'])
"JoyoPlayer" declared "fold:0"
"Finneas" declared "call:0"
"Yuchun" declared "call:0"
"Zheng" declared "call:0"
Street "river" started. (community card = ['C5', 'CT', 'H8', 'DA', 'D2'])
"Finneas" declared "call:0"
"Yuchun" declared "call:0"
"Zheng" declared "call:0"
"['Finneas']" won the round 14 (stack = {'EvanPlayer': 0, 'ZifengFoldMan': 970, 'JoyoPlayer': 1895, 'YueShi': 970, 'Finneas': 1090, 'Yuchun': 1130, 'Zheng': 915, 'RaphaelPlayer': 1030})
player [ZifengFoldMan] gets hole card ['CA', 'C5'], current stack 965
player [JoyoPlayer] gets hole card ['HA', 'SA'], current stack 1885
player [YueShi] gets hole card ['H7', 'HK'], current stack 970
player [Finneas] gets hole card ['C2', 'C6'], current stack 1090
player [Yuchun] gets hole card ['S7', 'S2'], current stack 1130
player [Zheng] gets hole card ['D2', 'SQ'], current stack 915
player [RaphaelPlayer] gets hole card ['CJ', 'S4'], current stack 1030
Started the round 15
Street "preflop" started. (community card = [])
"YueShi" declared "fold:0"
"Finneas" declared "call:10"
"Yuchun" declared "call:10"
"Zheng" declared "call:10"
"RaphaelPlayer" declared "fold:0"
"ZifengFoldMan" declared "fold:0"
"JoyoPlayer" declared "call:10"
Street "flop" started. (community card = ['H8', 'D7', 'H2'])
"JoyoPlayer" declared "call:0"
"Finneas" declared "call:0"
"Yuchun" declared "call:0"
"Zheng" declared "call:0"
Street "turn" started. (community card = ['H8', 'D7', 'H2', 'CQ'])
"JoyoPlayer" declared "raise:10"
"Finneas" declared "call:10"
"Yuchun" declared "call:10"
"Zheng" declared "call:10"
Street "river" started. (community card = ['H8', 'D7', 'H2', 'CQ', 'S3'])
"JoyoPlayer" declared "call:0"
"Finneas" declared "call:0"
"Yuchun" declared "raise:40"
"Zheng" declared "raise:895"
"JoyoPlayer" declared "fold:0"
"Finneas" declared "fold:0"
"Yuchun" declared "call:895"
"['Zheng']" won the round 15 (stack = {'EvanPlayer': 0, 'ZifengFoldMan': 965, 'JoyoPlayer': 1875, 'YueShi': 970, 'Finneas': 1070, 'Yuchun': 215, 'Zheng': 1875, 'RaphaelPlayer': 1030})
player [ZifengFoldMan] gets hole card ['HT', 'DT'], current stack 965
player [JoyoPlayer] gets hole card ['DK', 'H7'], current stack 1870
player [YueShi] gets hole card ['SQ', 'DA'], current stack 960
player [Finneas] gets hole card ['SK', 'D5'], current stack 1070
player [Yuchun] gets hole card ['CT', 'D6'], current stack 215
player [Zheng] gets hole card ['D4', 'H9'], current stack 1875
player [RaphaelPlayer] gets hole card ['C8', 'SA'], current stack 1030
Started the round 16
Street "preflop" started. (community card = [])
"Finneas" declared "call:10"
"Yuchun" declared "call:10"
"Zheng" declared "call:10"
"RaphaelPlayer" declared "call:10"
"ZifengFoldMan" declared "fold:0"
"JoyoPlayer" declared "fold:0"
"YueShi" declared "fold:0"
Street "flop" started. (community card = ['CK', 'C4', 'H4'])
"Finneas" declared "call:0"
"Yuchun" declared "call:0"
"Zheng" declared "raise:937"
"RaphaelPlayer" declared "fold:0"
"Finneas" declared "fold:0"
"Yuchun" declared "fold:0"
"['Zheng']" won the round 16 (stack = {'EvanPlayer': 0, 'ZifengFoldMan': 965, 'JoyoPlayer': 1870, 'YueShi': 960, 'Finneas': 1060, 'Yuchun': 205, 'Zheng': 1920, 'RaphaelPlayer': 1020})
player [ZifengFoldMan] gets hole card ['SA', 'DT'], current stack 965
player [JoyoPlayer] gets hole card ['H3', 'DQ'], current stack 1870
player [YueShi] gets hole card ['C9', 'D8'], current stack 955
player [Finneas] gets hole card ['ST', 'H9'], current stack 1050
player [Yuchun] gets hole card ['CA', 'C8'], current stack 205
player [Zheng] gets hole card ['C4', 'CT'], current stack 1920
player [RaphaelPlayer] gets hole card ['S5', 'H6'], current stack 1020
Started the round 17
Street "preflop" started. (community card = [])
"Yuchun" declared "call:10"
"Zheng" declared "call:10"
"RaphaelPlayer" declared "fold:0"
"ZifengFoldMan" declared "fold:0"
"JoyoPlayer" declared "raise:15"
"YueShi" declared "fold:0"
"Finneas" declared "call:15"
"Yuchun" declared "call:15"
"Zheng" declared "call:15"
Street "flop" started. (community card = ['C3', 'H4', 'S6'])
"Finneas" declared "call:0"
"Yuchun" declared "call:0"
"Zheng" declared "call:0"
"JoyoPlayer" declared "fold:0"
Street "turn" started. (community card = ['C3', 'H4', 'S6', 'C5'])
"Finneas" declared "call:0"
"Yuchun" declared "call:0"
"Zheng" declared "call:0"
Street "river" started. (community card = ['C3', 'H4', 'S6', 'C5', 'D3'])
"Finneas" declared "call:0"
"Yuchun" declared "call:0"
"Zheng" declared "call:0"
"['Zheng']" won the round 17 (stack = {'EvanPlayer': 0, 'ZifengFoldMan': 965, 'JoyoPlayer': 1855, 'YueShi': 955, 'Finneas': 1045, 'Yuchun': 190, 'Zheng': 1970, 'RaphaelPlayer': 1020})
player [ZifengFoldMan] gets hole card ['D2', 'D9'], current stack 965
player [JoyoPlayer] gets hole card ['SQ', 'D5'], current stack 1855
player [YueShi] gets hole card ['HA', 'H2'], current stack 955
player [Finneas] gets hole card ['SA', 'S7'], current stack 1040
player [Yuchun] gets hole card ['C3', 'D3'], current stack 180
player [Zheng] gets hole card ['C4', 'ST'], current stack 1970
player [RaphaelPlayer] gets hole card ['C9', 'HJ'], current stack 1020
Started the round 18
Street "preflop" started. (community card = [])
"Zheng" declared "call:10"
"RaphaelPlayer" declared "call:10"
"ZifengFoldMan" declared "fold:0"
"JoyoPlayer" declared "fold:0"
"YueShi" declared "fold:0"
"Finneas" declared "call:10"
"Yuchun" declared "call:10"
Street "flop" started. (community card = ['S8', 'H5', 'C2'])
"Finneas" declared "call:0"
"Yuchun" declared "call:0"
"Zheng" declared "call:0"
"RaphaelPlayer" declared "call:0"
Street "turn" started. (community card = ['S8', 'H5', 'C2', 'HT'])
"Finneas" declared "call:0"
"Yuchun" declared "call:0"
"Zheng" declared "call:0"
"RaphaelPlayer" declared "call:0"
Street "river" started. (community card = ['S8', 'H5', 'C2', 'HT', 'D7'])
"Finneas" declared "call:0"
"Yuchun" declared "call:0"
"Zheng" declared "call:0"
"RaphaelPlayer" declared "raise:50"
"Finneas" declared "fold:0"
"Yuchun" declared "call:50"
"Zheng" declared "fold:0"
"['RaphaelPlayer']" won the round 18 (stack = {'EvanPlayer': 0, 'ZifengFoldMan': 965, 'JoyoPlayer': 1855, 'YueShi': 955, 'Finneas': 1035, 'Yuchun': 130, 'Zheng': 1960, 'RaphaelPlayer': 1100})
player [ZifengFoldMan] gets hole card ['SQ', 'DA'], current stack 965
player [JoyoPlayer] gets hole card ['H3', 'C6'], current stack 1855
player [YueShi] gets hole card ['S8', 'ST'], current stack 955
player [Finneas] gets hole card ['S3', 'C8'], current stack 1035
player [Yuchun] gets hole card ['DJ', 'CK'], current stack 125
player [Zheng] gets hole card ['C9', 'HT'], current stack 1950
player [RaphaelPlayer] gets hole card ['CA', 'H4'], current stack 1100
Started the round 19
Street "preflop" started. (community card = [])
"RaphaelPlayer" declared "call:10"
"ZifengFoldMan" declared "fold:0"
"JoyoPlayer" declared "raise:15"
"YueShi" declared "fold:0"
"Finneas" declared "call:15"
"Yuchun" declared "call:15"
"Zheng" declared "call:15"
"RaphaelPlayer" declared "call:15"
Street "flop" started. (community card = ['DQ', 'SA', 'HJ'])
"Yuchun" declared "call:0"
"Zheng" declared "call:0"
"RaphaelPlayer" declared "call:0"
"JoyoPlayer" declared "raise:10"
"Finneas" declared "call:10"
"Yuchun" declared "call:10"
"Zheng" declared "call:10"
"RaphaelPlayer" declared "call:10"
Street "turn" started. (community card = ['DQ', 'SA', 'HJ', 'H8'])
"Yuchun" declared "call:0"
"Zheng" declared "raise:972"
"RaphaelPlayer" declared "fold:0"
"JoyoPlayer" declared "call:972"
"Finneas" declared "fold:0"
"Yuchun" declared "fold:0"
Street "river" started. (community card = ['DQ', 'SA', 'HJ', 'H8', 'S9'])
"Zheng" declared "raise:963"
"JoyoPlayer" declared "fold:0"
"['Zheng']" won the round 19 (stack = {'EvanPlayer': 0, 'ZifengFoldMan': 965, 'JoyoPlayer': 858, 'YueShi': 955, 'Finneas': 1010, 'Yuchun': 105, 'Zheng': 3032, 'RaphaelPlayer': 1075})
player [ZifengFoldMan] gets hole card ['C3', 'SK'], current stack 965
player [JoyoPlayer] gets hole card ['H7', 'S8'], current stack 858
player [YueShi] gets hole card ['S5', 'DJ'], current stack 955
player [Finneas] gets hole card ['C8', 'H9'], current stack 1010
player [Yuchun] gets hole card ['CT', 'H3'], current stack 105
player [Zheng] gets hole card ['S6', 'S9'], current stack 3027
player [RaphaelPlayer] gets hole card ['H5', 'C2'], current stack 1065
Started the round 20
Street "preflop" started. (community card = [])
"ZifengFoldMan" declared "fold:0"
"JoyoPlayer" declared "fold:0"
"YueShi" declared "fold:0"
"Finneas" declared "call:10"
"Yuchun" declared "call:10"
"Zheng" declared "call:10"
"RaphaelPlayer" declared "fold:0"
Street "flop" started. (community card = ['HA', 'D4', 'CA'])
"Zheng" declared "call:0"
"Finneas" declared "call:0"
"Yuchun" declared "call:0"
Street "turn" started. (community card = ['HA', 'D4', 'CA', 'C7'])
"Zheng" declared "call:0"
"Finneas" declared "call:0"
"Yuchun" declared "call:0"
Street "river" started. (community card = ['HA', 'D4', 'CA', 'C7', 'DA'])
"Zheng" declared "call:0"
"Finneas" declared "raise:505"
"Yuchun" declared "fold:0"
"Zheng" declared "fold:0"
"['Finneas']" won the round 20 (stack = {'EvanPlayer': 0, 'ZifengFoldMan': 965, 'JoyoPlayer': 858, 'YueShi': 955, 'Finneas': 1040, 'Yuchun': 95, 'Zheng': 3022, 'RaphaelPlayer': 1065})
player [ZifengFoldMan] gets hole card ['HT', 'D3'], current stack 955
player [JoyoPlayer] gets hole card ['S2', 'H4'], current stack 858
player [YueShi] gets hole card ['S4', 'SQ'], current stack 955
player [Finneas] gets hole card ['S7', 'D5'], current stack 1040
player [Yuchun] gets hole card ['CQ', 'CJ'], current stack 95
player [Zheng] gets hole card ['C8', 'D9'], current stack 3022
player [RaphaelPlayer] gets hole card ['H3', 'DK'], current stack 1060
Started the round 21
Street "preflop" started. (community card = [])
"JoyoPlayer" declared "raise:15"
"YueShi" declared "fold:0"
"Finneas" declared "call:15"
"Yuchun" declared "call:15"
"Zheng" declared "call:15"
"RaphaelPlayer" declared "fold:0"
"ZifengFoldMan" declared "fold:0"
Street "flop" started. (community card = ['CK', 'C5', 'SK'])
"JoyoPlayer" declared "raise:10"
"Finneas" declared "call:10"
"Yuchun" declared "call:10"
"Zheng" declared "call:10"
Street "turn" started. (community card = ['CK', 'C5', 'SK', 'D7'])
"JoyoPlayer" declared "fold:0"
"Finneas" declared "call:0"
"Yuchun" declared "call:0"
"Zheng" declared "call:0"
Street "river" started. (community card = ['CK', 'C5', 'SK', 'D7', 'H5'])
"Finneas" declared "raise:512"
"Yuchun" declared "fold:0"
"Zheng" declared "fold:0"
"['Finneas']" won the round 21 (stack = {'EvanPlayer': 0, 'ZifengFoldMan': 955, 'JoyoPlayer': 833, 'YueShi': 955, 'Finneas': 1130, 'Yuchun': 70, 'Zheng': 2997, 'RaphaelPlayer': 1060})
player [ZifengFoldMan] gets hole card ['H4', 'D5'], current stack 950
player [JoyoPlayer] gets hole card ['DQ', 'H3'], current stack 823
player [YueShi] gets hole card ['D4', 'H9'], current stack 955
player [Finneas] gets hole card ['H7', 'D9'], current stack 1130
player [Yuchun] gets hole card ['S3', 'S5'], current stack 70
player [Zheng] gets hole card ['S9', 'CJ'], current stack 2997
player [RaphaelPlayer] gets hole card ['C9', 'S4'], current stack 1060
Started the round 22
Street "preflop" started. (community card = [])
"YueShi" declared "fold:0"
"Finneas" declared "call:10"
"Yuchun" declared "call:10"
"Zheng" declared "call:10"
"RaphaelPlayer" declared "fold:0"
"ZifengFoldMan" declared "fold:0"
"JoyoPlayer" declared "fold:0"
Street "flop" started. (community card = ['H5', 'S7', 'HT'])
"Finneas" declared "call:0"
"Yuchun" declared "call:0"
"Zheng" declared "call:0"
Street "turn" started. (community card = ['H5', 'S7', 'HT', 'CA'])
"Finneas" declared "call:0"
"Yuchun" declared "call:0"
"Zheng" declared "call:0"
Street "river" started. (community card = ['H5', 'S7', 'HT', 'CA', 'HQ'])
"Finneas" declared "call:0"
"Yuchun" declared "call:0"
"Zheng" declared "call:0"
"['Finneas']" won the round 22 (stack = {'EvanPlayer': 0, 'ZifengFoldMan': 950, 'JoyoPlayer': 823, 'YueShi': 955, 'Finneas': 1165, 'Yuchun': 60, 'Zheng': 2987, 'RaphaelPlayer': 1060})
player [ZifengFoldMan] gets hole card ['HQ', 'D2'], current stack 950
player [JoyoPlayer] gets hole card ['SJ', 'S7'], current stack 818
player [YueShi] gets hole card ['C7', 'D5'], current stack 945
player [Finneas] gets hole card ['SK', 'C6'], current stack 1165
player [Yuchun] gets hole card ['C3', 'DJ'], current stack 60
player [Zheng] gets hole card ['H8', 'S9'], current stack 2987
player [RaphaelPlayer] gets hole card ['H5', 'CJ'], current stack 1060
Started the round 23
Street "preflop" started. (community card = [])
"Finneas" declared "call:10"
"Yuchun" declared "call:10"
"Zheng" declared "call:10"
"RaphaelPlayer" declared "fold:0"
"ZifengFoldMan" declared "fold:0"
"JoyoPlayer" declared "fold:0"
"YueShi" declared "fold:0"
Street "flop" started. (community card = ['S5', 'CQ', 'D8'])
"Finneas" declared "call:0"
"Yuchun" declared "call:0"
"Zheng" declared "call:0"
Street "turn" started. (community card = ['S5', 'CQ', 'D8', 'C8'])
"Finneas" declared "call:0"
"Yuchun" declared "call:0"
"Zheng" declared "raise:2977"
"Finneas" declared "fold:0"
"Yuchun" declared "fold:0"
"['Zheng']" won the round 23 (stack = {'EvanPlayer': 0, 'ZifengFoldMan': 950, 'JoyoPlayer': 818, 'YueShi': 945, 'Finneas': 1155, 'Yuchun': 50, 'Zheng': 3022, 'RaphaelPlayer': 1060})
player [ZifengFoldMan] gets hole card ['CK', 'S5'], current stack 950
player [JoyoPlayer] gets hole card ['H3', 'S6'], current stack 818
player [YueShi] gets hole card ['S7', 'HK'], current stack 940
player [Finneas] gets hole card ['DQ', 'C4'], current stack 1145
player [Yuchun] gets hole card ['SK', 'HA'], current stack 50
player [Zheng] gets hole card ['S9', 'D4'], current stack 3022
player [RaphaelPlayer] gets hole card ['CA', 'C7'], current stack 1060
Started the round 24
Street "preflop" started. (community card = [])
"Yuchun" declared "call:10"
"Zheng" declared "call:10"
"RaphaelPlayer" declared "call:10"
"ZifengFoldMan" declared "fold:0"
"JoyoPlayer" declared "fold:0"
"YueShi" declared "fold:0"
"Finneas" declared "call:10"
Street "flop" started. (community card = ['DA', 'H5', 'S4'])
"Finneas" declared "call:0"
"Yuchun" declared "call:0"
"Zheng" declared "call:0"
"RaphaelPlayer" declared "call:0"
Street "turn" started. (community card = ['DA', 'H5', 'S4', 'C2'])
"Finneas" declared "call:0"
"Yuchun" declared "call:0"
"Zheng" declared "call:0"
"RaphaelPlayer" declared "call:0"
Street "river" started. (community card = ['DA', 'H5', 'S4', 'C2', 'D6'])
"Finneas" declared "call:0"
"Yuchun" declared "call:0"
"Zheng" declared "call:0"
"RaphaelPlayer" declared "call:0"
"['Yuchun']" won the round 24 (stack = {'EvanPlayer': 0, 'ZifengFoldMan': 950, 'JoyoPlayer': 818, 'YueShi': 940, 'Finneas': 1145, 'Yuchun': 85, 'Zheng': 3012, 'RaphaelPlayer': 1050})
player [ZifengFoldMan] gets hole card ['C8', 'D4'], current stack 950
player [JoyoPlayer] gets hole card ['DT', 'HK'], current stack 818
player [YueShi] gets hole card ['H5', 'SQ'], current stack 940
player [Finneas] gets hole card ['H2', 'C2'], current stack 1140
player [Yuchun] gets hole card ['DJ', 'D7'], current stack 75
player [Zheng] gets hole card ['DQ', 'DK'], current stack 3012
player [RaphaelPlayer] gets hole card ['D5', 'S3'], current stack 1050
Started the round 25
Street "preflop" started. (community card = [])
"Zheng" declared "call:10"
"RaphaelPlayer" declared "fold:0"
"ZifengFoldMan" declared "fold:0"
"JoyoPlayer" declared "fold:0"
"YueShi" declared "fold:0"
"Finneas" declared "call:10"
"Yuchun" declared "call:10"
Street "flop" started. (community card = ['S5', 'C3', 'H3'])
"Finneas" declared "call:0"
"Yuchun" declared "call:0"
"Zheng" declared "call:0"
Street "turn" started. (community card = ['S5', 'C3', 'H3', 'D3'])
"Finneas" declared "raise:572"
"Yuchun" declared "fold:0"
"Zheng" declared "fold:0"
"['Finneas']" won the round 25 (stack = {'EvanPlayer': 0, 'ZifengFoldMan': 950, 'JoyoPlayer': 818, 'YueShi': 940, 'Finneas': 1165, 'Yuchun': 75, 'Zheng': 3002, 'RaphaelPlayer': 1050})
player [ZifengFoldMan] gets hole card ['C5', 'H5'], current stack 950
player [JoyoPlayer] gets hole card ['SK', 'C4'], current stack 818
player [YueShi] gets hole card ['DT', 'H4'], current stack 940
player [Finneas] gets hole card ['S4', 'CJ'], current stack 1165
player [Yuchun] gets hole card ['S6', 'D5'], current stack 70
player [Zheng] gets hole card ['CK', 'H3'], current stack 2992
player [RaphaelPlayer] gets hole card ['CT', 'HQ'], current stack 1050
Started the round 26
Street "preflop" started. (community card = [])
"RaphaelPlayer" declared "call:10"
"ZifengFoldMan" declared "fold:0"
"JoyoPlayer" declared "fold:0"
"YueShi" declared "fold:0"
"Finneas" declared "call:10"
"Yuchun" declared "call:10"
"Zheng" declared "call:10"
Street "flop" started. (community card = ['D6', 'S7', 'S8'])
"Yuchun" declared "call:0"
"Zheng" declared "call:0"
"RaphaelPlayer" declared "call:0"
"Finneas" declared "call:0"
Street "turn" started. (community card = ['D6', 'S7', 'S8', 'H2'])
"Yuchun" declared "call:0"
"Zheng" declared "call:0"
"RaphaelPlayer" declared "call:0"
"Finneas" declared "call:0"
Street "river" started. (community card = ['D6', 'S7', 'S8', 'H2', 'D9'])
"Yuchun" declared "call:0"
"Zheng" declared "call:0"
"RaphaelPlayer" declared "raise:50"
"Finneas" declared "fold:0"
"Yuchun" declared "call:50"
"Zheng" declared "call:50"
"['RaphaelPlayer']" won the round 26 (stack = {'EvanPlayer': 0, 'ZifengFoldMan': 950, 'JoyoPlayer': 818, 'YueShi': 940, 'Finneas': 1155, 'Yuchun': 15, 'Zheng': 2942, 'RaphaelPlayer': 1180})
player [ZifengFoldMan] gets hole card ['SQ', 'HA'], current stack 950
player [JoyoPlayer] gets hole card ['H6', 'C3'], current stack 818
player [YueShi] gets hole card ['H8', 'HK'], current stack 940
player [Finneas] gets hole card ['C2', 'S7'], current stack 1155
player [Yuchun] gets hole card ['H5', 'D5'], current stack 15
player [Zheng] gets hole card ['D3', 'D8'], current stack 2937
player [RaphaelPlayer] gets hole card ['DK', 'SJ'], current stack 1170
Started the round 27
Street "preflop" started. (community card = [])
"ZifengFoldMan" declared "fold:0"
"JoyoPlayer" declared "fold:0"
"YueShi" declared "fold:0"
"Finneas" declared "call:10"
"Yuchun" declared "call:10"
"Zheng" declared "call:10"
"RaphaelPlayer" declared "raise:30"
"Finneas" declared "fold:0"
"Yuchun" declared "call:30"
"Zheng" declared "call:30"
Street "flop" started. (community card = ['H3', 'D4', 'CT'])
"Zheng" declared "call:0"
"RaphaelPlayer" declared "call:0"
Street "turn" started. (community card = ['H3', 'D4', 'CT', 'HT'])
"Zheng" declared "call:0"
"RaphaelPlayer" declared "call:0"
Street "river" started. (community card = ['H3', 'D4', 'CT', 'HT', 'H9'])
"Zheng" declared "call:0"
"RaphaelPlayer" declared "call:0"
"['Yuchun']" won the round 27 (stack = {'EvanPlayer': 0, 'ZifengFoldMan': 950, 'JoyoPlayer': 818, 'YueShi': 940, 'Finneas': 1145, 'Yuchun': 55, 'Zheng': 2942, 'RaphaelPlayer': 1150})
player [ZifengFoldMan] gets hole card ['S2', 'D4'], current stack 940
player [JoyoPlayer] gets hole card ['C6', 'D5'], current stack 818
player [YueShi] gets hole card ['H9', 'H4'], current stack 940
player [Finneas] gets hole card ['CJ', 'SA'], current stack 1145
player [Yuchun] gets hole card ['HT', 'CK'], current stack 55
player [Zheng] gets hole card ['D7', 'S7'], current stack 2942
player [RaphaelPlayer] gets hole card ['S3', 'DT'], current stack 1145
Started the round 28
Street "preflop" started. (community card = [])
"JoyoPlayer" declared "raise:15"
"YueShi" declared "fold:0"
"Finneas" declared "call:15"
"Yuchun" declared "call:15"
"Zheng" declared "call:15"
"RaphaelPlayer" declared "fold:0"
"ZifengFoldMan" declared "fold:0"
Street "flop" started. (community card = ['D9', 'CQ', 'D2'])
"JoyoPlayer" declared "fold:0"
"Finneas" declared "call:0"
"Yuchun" declared "call:0"
"Zheng" declared "call:0"
Street "turn" started. (community card = ['D9', 'CQ', 'D2', 'S8'])
"Finneas" declared "call:0"
"Yuchun" declared "call:0"
"Zheng" declared "call:0"
Street "river" started. (community card = ['D9', 'CQ', 'D2', 'S8', 'H2'])
"Finneas" declared "call:0"
"Yuchun" declared "call:0"
"Zheng" declared "call:0"
"['Zheng']" won the round 28 (stack = {'EvanPlayer': 0, 'ZifengFoldMan': 940, 'JoyoPlayer': 803, 'YueShi': 940, 'Finneas': 1130, 'Yuchun': 40, 'Zheng': 3002, 'RaphaelPlayer': 1145})
player [ZifengFoldMan] gets hole card ['D3', 'C8'], current stack 935
player [JoyoPlayer] gets hole card ['C6', 'S8'], current stack 793
player [YueShi] gets hole card ['H2', 'S3'], current stack 940
player [Finneas] gets hole card ['CQ', 'H6'], current stack 1130
player [Yuchun] gets hole card ['HK', 'C4'], current stack 40
player [Zheng] gets hole card ['ST', 'S7'], current stack 3002
player [RaphaelPlayer] gets hole card ['D2', 'CJ'], current stack 1145
Started the round 29
Street "preflop" started. (community card = [])
"YueShi" declared "fold:0"
"Finneas" declared "call:10"
"Yuchun" declared "call:10"
"Zheng" declared "call:10"
"RaphaelPlayer" declared "fold:0"
"ZifengFoldMan" declared "fold:0"
"JoyoPlayer" declared "fold:0"
Street "flop" started. (community card = ['C7', 'SK', 'D7'])
"Finneas" declared "call:0"
"Yuchun" declared "raise:40"
"Zheng" declared "raise:2992"
"Finneas" declared "fold:0"
"['Zheng']" won the round 29 (stack = {'EvanPlayer': 0, 'ZifengFoldMan': 935, 'JoyoPlayer': 793, 'YueShi': 940, 'Finneas': 1120, 'Yuchun': 30, 'Zheng': 3037, 'RaphaelPlayer': 1145})
player [ZifengFoldMan] gets hole card ['H2', 'C6'], current stack 935
player [JoyoPlayer] gets hole card ['HJ', 'H9'], current stack 788
player [YueShi] gets hole card ['H4', 'HQ'], current stack 930
player [Finneas] gets hole card ['H6', 'H3'], current stack 1120
player [Yuchun] gets hole card ['DJ', 'DA'], current stack 30
player [Zheng] gets hole card ['S9', 'S7'], current stack 3037
player [RaphaelPlayer] gets hole card ['SK', 'CJ'], current stack 1145
Started the round 30
Street "preflop" started. (community card = [])
"Finneas" declared "call:10"
"Yuchun" declared "call:10"
"Zheng" declared "call:10"
"RaphaelPlayer" declared "raise:30"
"ZifengFoldMan" declared "fold:0"
"JoyoPlayer" declared "fold:0"
"YueShi" declared "fold:0"
"Finneas" declared "fold:0"
"Yuchun" declared "call:30"
"Zheng" declared "call:30"
Street "flop" started. (community card = ['D3', 'S3', 'HK'])
"Zheng" declared "call:0"
"RaphaelPlayer" declared "raise:125"
"Zheng" declared "call:125"
Street "turn" started. (community card = ['D3', 'S3', 'HK', 'D8'])
"Zheng" declared "call:0"
"RaphaelPlayer" declared "raise:125"
"Zheng" declared "call:125"
Street "river" started. (community card = ['D3', 'S3', 'HK', 'D8', 'DT'])
"Zheng" declared "call:0"
"RaphaelPlayer" declared "raise:125"
"Zheng" declared "call:125"
"['Yuchun']" won the round 30 (stack = {'EvanPlayer': 0, 'ZifengFoldMan': 935, 'JoyoPlayer': 788, 'YueShi': 930, 'Finneas': 1110, 'Yuchun': 115, 'Zheng': 2632, 'RaphaelPlayer': 1490})
player [ZifengFoldMan] gets hole card ['S3', 'D3'], current stack 935
player [JoyoPlayer] gets hole card ['S6', 'C7'], current stack 788
player [YueShi] gets hole card ['SK', 'D7'], current stack 925
player [Finneas] gets hole card ['DQ', 'DT'], current stack 1100
player [Yuchun] gets hole card ['CK', 'DA'], current stack 115
player [Zheng] gets hole card ['D5', 'SJ'], current stack 2632
player [RaphaelPlayer] gets hole card ['C2', 'HA'], current stack 1490
Started the round 31
Street "preflop" started. (community card = [])
"Yuchun" declared "call:10"
"Zheng" declared "call:10"
"RaphaelPlayer" declared "call:10"
"ZifengFoldMan" declared "fold:0"
"JoyoPlayer" declared "fold:0"
"YueShi" declared "fold:0"
"Finneas" declared "call:10"
Street "flop" started. (community card = ['S4', 'S5', 'C9'])
"Finneas" declared "call:0"
"Yuchun" declared "call:0"
"Zheng" declared "call:0"
"RaphaelPlayer" declared "call:0"
Street "turn" started. (community card = ['S4', 'S5', 'C9', 'S8'])
"Finneas" declared "call:0"
"Yuchun" declared "call:0"
"Zheng" declared "call:0"
"RaphaelPlayer" declared "call:0"
Street "river" started. (community card = ['S4', 'S5', 'C9', 'S8', 'CA'])
"Finneas" declared "call:0"
"Yuchun" declared "call:0"
"Zheng" declared "call:0"
"RaphaelPlayer" declared "call:0"
"['Yuchun']" won the round 31 (stack = {'EvanPlayer': 0, 'ZifengFoldMan': 935, 'JoyoPlayer': 788, 'YueShi': 925, 'Finneas': 1100, 'Yuchun': 150, 'Zheng': 2622, 'RaphaelPlayer': 1480})
player [ZifengFoldMan] gets hole card ['HT', 'S7'], current stack 935
player [JoyoPlayer] gets hole card ['S2', 'CT'], current stack 788
player [YueShi] gets hole card ['D2', 'H8'], current stack 925
player [Finneas] gets hole card ['CJ', 'C8'], current stack 1095
player [Yuchun] gets hole card ['D8', 'HK'], current stack 140
player [Zheng] gets hole card ['H6', 'D9'], current stack 2622
player [RaphaelPlayer] gets hole card ['H4', 'D4'], current stack 1480
Started the round 32
Street "preflop" started. (community card = [])
"Zheng" declared "call:10"
"RaphaelPlayer" declared "call:10"
"ZifengFoldMan" declared "fold:0"
"JoyoPlayer" declared "fold:0"
"YueShi" declared "fold:0"
"Finneas" declared "call:10"
"Yuchun" declared "call:10"
Street "flop" started. (community card = ['CQ', 'C2', 'SK'])
"Finneas" declared "call:0"
"Yuchun" declared "call:0"
"Zheng" declared "call:0"
"RaphaelPlayer" declared "call:0"
Street "turn" started. (community card = ['CQ', 'C2', 'SK', 'HQ'])
"Finneas" declared "call:0"
"Yuchun" declared "call:0"
"Zheng" declared "call:0"
"RaphaelPlayer" declared "call:0"
Street "river" started. (community card = ['CQ', 'C2', 'SK', 'HQ', 'S4'])
"Finneas" declared "call:0"
"Yuchun" declared "call:0"
"Zheng" declared "call:0"
"RaphaelPlayer" declared "raise:50"
"Finneas" declared "fold:0"
"Yuchun" declared "call:50"
"Zheng" declared "call:50"
"['RaphaelPlayer']" won the round 32 (stack = {'EvanPlayer': 0, 'ZifengFoldMan': 935, 'JoyoPlayer': 788, 'YueShi': 925, 'Finneas': 1090, 'Yuchun': 90, 'Zheng': 2562, 'RaphaelPlayer': 1610})
player [ZifengFoldMan] gets hole card ['D2', 'ST'], current stack 935
player [JoyoPlayer] gets hole card ['S7', 'HJ'], current stack 788
player [YueShi] gets hole card ['S2', 'H6'], current stack 925
player [Finneas] gets hole card ['S8', 'H5'], current stack 1090
player [Yuchun] gets hole card ['S5', 'CT'], current stack 85
player [Zheng] gets hole card ['C2', 'DJ'], current stack 2552
player [RaphaelPlayer] gets hole card ['H8', 'S3'], current stack 1610
Started the round 33
Street "preflop" started. (community card = [])
"RaphaelPlayer" declared "fold:0"
"ZifengFoldMan" declared "fold:0"
"JoyoPlayer" declared "fold:0"
"YueShi" declared "fold:0"
"Finneas" declared "call:10"
"Yuchun" declared "call:10"
"Zheng" declared "call:10"
Street "flop" started. (community card = ['C7', 'CQ', 'CK'])
"Yuchun" declared "call:0"
"Zheng" declared "call:0"
"Finneas" declared "call:0"
Street "turn" started. (community card = ['C7', 'CQ', 'CK', 'D6'])
"Yuchun" declared "call:0"
"Zheng" declared "call:0"
"Finneas" declared "call:0"
Street "river" started. (community card = ['C7', 'CQ', 'CK', 'D6', 'CJ'])
"Yuchun" declared "raise:80"
"Zheng" declared "call:80"
"Finneas" declared "fold:0"
"['Yuchun']" won the round 33 (stack = {'EvanPlayer': 0, 'ZifengFoldMan': 935, 'JoyoPlayer': 788, 'YueShi': 925, 'Finneas': 1080, 'Yuchun': 190, 'Zheng': 2472, 'RaphaelPlayer': 1610})
player [ZifengFoldMan] gets hole card ['CA', 'S8'], current stack 935
player [JoyoPlayer] gets hole card ['H4', 'DT'], current stack 788
player [YueShi] gets hole card ['S2', 'D5'], current stack 925
player [Finneas] gets hole card ['CQ', 'D7'], current stack 1080
player [Yuchun] gets hole card ['ST', 'D3'], current stack 190
player [Zheng] gets hole card ['C7', 'H5'], current stack 2467
player [RaphaelPlayer] gets hole card ['C9', 'C4'], current stack 1600
Started the round 34
Street "preflop" started. (community card = [])
"ZifengFoldMan" declared "fold:0"
"JoyoPlayer" declared "fold:0"
"YueShi" declared "fold:0"
"Finneas" declared "call:10"
"Yuchun" declared "call:10"
"Zheng" declared "call:10"
"RaphaelPlayer" declared "fold:0"
Street "flop" started. (community card = ['SA', 'CK', 'S3'])
"Zheng" declared "call:0"
"Finneas" declared "call:0"
"Yuchun" declared "call:0"
Street "turn" started. (community card = ['SA', 'CK', 'S3', 'HT'])
"Zheng" declared "call:0"
"Finneas" declared "call:0"
"Yuchun" declared "raise:40"
"Zheng" declared "call:40"
"Finneas" declared "fold:0"
Street "river" started. (community card = ['SA', 'CK', 'S3', 'HT', 'S4'])
"Zheng" declared "call:0"
"Yuchun" declared "raise:40"
"Zheng" declared "call:40"
"['Yuchun']" won the round 34 (stack = {'EvanPlayer': 0, 'ZifengFoldMan': 935, 'JoyoPlayer': 788, 'YueShi': 925, 'Finneas': 1070, 'Yuchun': 300, 'Zheng': 2382, 'RaphaelPlayer': 1600})
player [ZifengFoldMan] gets hole card ['S7', 'C4'], current stack 925
player [JoyoPlayer] gets hole card ['D8', 'DA'], current stack 788
player [YueShi] gets hole card ['H2', 'D3'], current stack 925
player [Finneas] gets hole card ['S3', 'SJ'], current stack 1070
player [Yuchun] gets hole card ['ST', 'CT'], current stack 300
player [Zheng] gets hole card ['CQ', 'H4'], current stack 2382
player [RaphaelPlayer] gets hole card ['HK', 'DQ'], current stack 1595
Started the round 35
Street "preflop" started. (community card = [])
"JoyoPlayer" declared "fold:0"
"YueShi" declared "fold:0"
"Finneas" declared "call:10"
"Yuchun" declared "call:10"
"Zheng" declared "call:10"
"RaphaelPlayer" declared "call:10"
"ZifengFoldMan" declared "fold:0"
Street "flop" started. (community card = ['D2', 'CJ', 'C8'])
"RaphaelPlayer" declared "call:0"
"Finneas" declared "call:0"
"Yuchun" declared "call:0"
"Zheng" declared "call:0"
Street "turn" started. (community card = ['D2', 'CJ', 'C8', 'H8'])
"RaphaelPlayer" declared "call:0"
"Finneas" declared "call:0"
"Yuchun" declared "call:0"
"Zheng" declared "call:0"
Street "river" started. (community card = ['D2', 'CJ', 'C8', 'H8', 'C7'])
"RaphaelPlayer" declared "call:0"
"Finneas" declared "call:0"
"Yuchun" declared "call:0"
"Zheng" declared "call:0"
"['Finneas']" won the round 35 (stack = {'EvanPlayer': 0, 'ZifengFoldMan': 925, 'JoyoPlayer': 788, 'YueShi': 925, 'Finneas': 1110, 'Yuchun': 290, 'Zheng': 2372, 'RaphaelPlayer': 1590})
player [ZifengFoldMan] gets hole card ['SJ', 'D6'], current stack 920
player [JoyoPlayer] gets hole card ['S6', 'H2'], current stack 778
player [YueShi] gets hole card ['H9', 'CQ'], current stack 925
player [Finneas] gets hole card ['S3', 'DJ'], current stack 1110
player [Yuchun] gets hole card ['H4', 'C8'], current stack 290
player [Zheng] gets hole card ['H6', 'CK'], current stack 2372
player [RaphaelPlayer] gets hole card ['S9', 'C4'], current stack 1590
Started the round 36
Street "preflop" started. (community card = [])
"YueShi" declared "fold:0"
"Finneas" declared "call:10"
"Yuchun" declared "call:10"
"Zheng" declared "call:10"
"RaphaelPlayer" declared "fold:0"
"ZifengFoldMan" declared "fold:0"
"JoyoPlayer" declared "raise:15"
"Finneas" declared "call:15"
"Yuchun" declared "call:15"
"Zheng" declared "call:15"
Street "flop" started. (community card = ['H7', 'S8', 'CA'])
"JoyoPlayer" declared "fold:0"
"Finneas" declared "call:0"
"Yuchun" declared "call:0"
"Zheng" declared "call:0"
Street "turn" started. (community card = ['H7', 'S8', 'CA', 'SA'])
"Finneas" declared "call:0"
"Yuchun" declared "call:0"
"Zheng" declared "call:0"
Street "river" started. (community card = ['H7', 'S8', 'CA', 'SA', 'S4'])
"Finneas" declared "call:0"
"Yuchun" declared "call:0"
"Zheng" declared "call:0"
"['Yuchun']" won the round 36 (stack = {'EvanPlayer': 0, 'ZifengFoldMan': 920, 'JoyoPlayer': 773, 'YueShi': 925, 'Finneas': 1095, 'Yuchun': 340, 'Zheng': 2357, 'RaphaelPlayer': 1590})
player [ZifengFoldMan] gets hole card ['DQ', 'ST'], current stack 920
player [JoyoPlayer] gets hole card ['CK', 'CA'], current stack 768
player [YueShi] gets hole card ['SK', 'DK'], current stack 915
player [Finneas] gets hole card ['C6', 'S4'], current stack 1095
player [Yuchun] gets hole card ['S3', 'HK'], current stack 340
player [Zheng] gets hole card ['D9', 'SQ'], current stack 2357
player [RaphaelPlayer] gets hole card ['H2', 'D6'], current stack 1590
Started the round 37
Street "preflop" started. (community card = [])
"Finneas" declared "call:10"
"Yuchun" declared "call:10"
"Zheng" declared "call:10"
"RaphaelPlayer" declared "fold:0"
"ZifengFoldMan" declared "fold:0"
"JoyoPlayer" declared "fold:0"
"YueShi" declared "fold:0"
Street "flop" started. (community card = ['H7', 'HJ', 'H8'])
"Finneas" declared "call:0"
"Yuchun" declared "call:0"
"Zheng" declared "call:0"
Street "turn" started. (community card = ['H7', 'HJ', 'H8', 'H9'])
"Finneas" declared "call:0"
"Yuchun" declared "raise:40"
"Zheng" declared "call:40"
"Finneas" declared "fold:0"
Street "river" started. (community card = ['H7', 'HJ', 'H8', 'H9', 'S9'])
"Yuchun" declared "raise:290"
"Zheng" declared "fold:0"
"['Yuchun']" won the round 37 (stack = {'EvanPlayer': 0, 'ZifengFoldMan': 920, 'JoyoPlayer': 768, 'YueShi': 915, 'Finneas': 1085, 'Yuchun': 415, 'Zheng': 2307, 'RaphaelPlayer': 1590})
player [ZifengFoldMan] gets hole card ['S3', 'CQ'], current stack 920
player [JoyoPlayer] gets hole card ['HQ', 'SJ'], current stack 768
player [YueShi] gets hole card ['DQ', 'H5'], current stack 910
player [Finneas] gets hole card ['H2', 'CA'], current stack 1075
player [Yuchun] gets hole card ['S4', 'D6'], current stack 415
player [Zheng] gets hole card ['DA', 'S2'], current stack 2307
player [RaphaelPlayer] gets hole card ['DT', 'S9'], current stack 1590
Started the round 38
Street "preflop" started. (community card = [])
"Yuchun" declared "call:10"
"Zheng" declared "call:10"
"RaphaelPlayer" declared "call:10"
"ZifengFoldMan" declared "fold:0"
"JoyoPlayer" declared "fold:0"
"YueShi" declared "fold:0"
"Finneas" declared "call:10"
Street "flop" started. (community card = ['HK', 'C5', 'S8'])
"Finneas" declared "call:0"
"Yuchun" declared "call:0"
"Zheng" declared "call:0"
"RaphaelPlayer" declared "call:0"
Street "turn" started. (community card = ['HK', 'C5', 'S8', 'SA'])
"Finneas" declared "call:0"
"Yuchun" declared "call:0"
"Zheng" declared "call:0"
"RaphaelPlayer" declared "call:0"
Street "river" started. (community card = ['HK', 'C5', 'S8', 'SA', 'D3'])
"Finneas" declared "call:0"
"Yuchun" declared "call:0"
"Zheng" declared "call:0"
"RaphaelPlayer" declared "call:0"
"['Finneas', 'Zheng']" won the round 38 (stack = {'EvanPlayer': 0, 'ZifengFoldMan': 920, 'JoyoPlayer': 768, 'YueShi': 910, 'Finneas': 1097, 'Yuchun': 405, 'Zheng': 2319, 'RaphaelPlayer': 1580})
player [ZifengFoldMan] gets hole card ['HK', 'HT'], current stack 920
player [JoyoPlayer] gets hole card ['S2', 'SA'], current stack 768
player [YueShi] gets hole card ['D5', 'C6'], current stack 910
player [Finneas] gets hole card ['H3', 'HQ'], current stack 1092
player [Yuchun] gets hole card ['C5', 'DT'], current stack 395
player [Zheng] gets hole card ['H5', 'H2'], current stack 2319
player [RaphaelPlayer] gets hole card ['H8', 'HJ'], current stack 1580
Started the round 39
Street "preflop" started. (community card = [])
"Zheng" declared "call:10"
"RaphaelPlayer" declared "call:10"
"ZifengFoldMan" declared "fold:0"
"JoyoPlayer" declared "fold:0"
"YueShi" declared "fold:0"
"Finneas" declared "call:10"
"Yuchun" declared "call:10"
Street "flop" started. (community card = ['CT', 'D9', 'S9'])
"Finneas" declared "call:0"
"Yuchun" declared "call:0"
"Zheng" declared "call:0"
"RaphaelPlayer" declared "call:0"
Street "turn" started. (community card = ['CT', 'D9', 'S9', 'ST'])
"Finneas" declared "call:0"
"Yuchun" declared "raise:395"
"Zheng" declared "fold:0"
"RaphaelPlayer" declared "fold:0"
"Finneas" declared "fold:0"
"['Yuchun']" won the round 39 (stack = {'EvanPlayer': 0, 'ZifengFoldMan': 920, 'JoyoPlayer': 768, 'YueShi': 910, 'Finneas': 1087, 'Yuchun': 435, 'Zheng': 2309, 'RaphaelPlayer': 1570})
player [ZifengFoldMan] gets hole card ['C4', 'SA'], current stack 920
player [JoyoPlayer] gets hole card ['ST', 'C5'], current stack 768
player [YueShi] gets hole card ['CT', 'DK'], current stack 910
player [Finneas] gets hole card ['CJ', 'H5'], current stack 1087
player [Yuchun] gets hole card ['CQ', 'D6'], current stack 430
player [Zheng] gets hole card ['S5', 'D8'], current stack 2299
player [RaphaelPlayer] gets hole card ['C6', 'D2'], current stack 1570
Started the round 40
Street "preflop" started. (community card = [])
"RaphaelPlayer" declared "fold:0"
"ZifengFoldMan" declared "fold:0"
"JoyoPlayer" declared "raise:15"
"YueShi" declared "fold:0"
"Finneas" declared "call:15"
"Yuchun" declared "call:15"
"Zheng" declared "call:15"
Street "flop" started. (community card = ['S7', 'H6', 'H7'])
"Yuchun" declared "call:0"
"Zheng" declared "call:0"
"JoyoPlayer" declared "raise:10"
"Finneas" declared "call:10"
"Yuchun" declared "call:10"
"Zheng" declared "call:10"
Street "turn" started. (community card = ['S7', 'H6', 'H7', 'CA'])
"Yuchun" declared "call:0"
"Zheng" declared "call:0"
"JoyoPlayer" declared "fold:0"
"Finneas" declared "call:0"
Street "river" started. (community card = ['S7', 'H6', 'H7', 'CA', 'S9'])
"Yuchun" declared "call:0"
"Zheng" declared "raise:2284"
"Finneas" declared "fold:0"
"Yuchun" declared "fold:0"
"['Zheng']" won the round 40 (stack = {'EvanPlayer': 0, 'ZifengFoldMan': 920, 'JoyoPlayer': 743, 'YueShi': 910, 'Finneas': 1062, 'Yuchun': 410, 'Zheng': 2384, 'RaphaelPlayer': 1570})
player [ZifengFoldMan] gets hole card ['C5', 'S9'], current stack 920
player [JoyoPlayer] gets hole card ['HJ', 'DA'], current stack 743
player [YueShi] gets hole card ['C6', 'DJ'], current stack 910
player [Finneas] gets hole card ['D7', 'SK'], current stack 1062
player [Yuchun] gets hole card ['D9', 'H9'], current stack 410
player [Zheng] gets hole card ['D4', 'CQ'], current stack 2379
player [RaphaelPlayer] gets hole card ['SA', 'CJ'], current stack 1560
Started the round 41
Street "preflop" started. (community card = [])
"ZifengFoldMan" declared "fold:0"
"JoyoPlayer" declared "fold:0"
"YueShi" declared "fold:0"
"Finneas" declared "call:10"
"Yuchun" declared "fold:0"
"Zheng" declared "call:10"
"RaphaelPlayer" declared "raise:30"
"Finneas" declared "fold:0"
"Zheng" declared "call:30"
Street "flop" started. (community card = ['DQ', 'HK', 'S7'])
"Zheng" declared "call:0"
"RaphaelPlayer" declared "raise:80"
"Zheng" declared "call:80"
Street "turn" started. (community card = ['DQ', 'HK', 'S7', 'H7'])
"Zheng" declared "call:0"
"RaphaelPlayer" declared "raise:240"
"Zheng" declared "fold:0"
"['RaphaelPlayer']" won the round 41 (stack = {'EvanPlayer': 0, 'ZifengFoldMan': 920, 'JoyoPlayer': 743, 'YueShi': 910, 'Finneas': 1052, 'Yuchun': 410, 'Zheng': 2274, 'RaphaelPlayer': 1690})
player [ZifengFoldMan] gets hole card ['SQ', 'ST'], current stack 910
player [JoyoPlayer] gets hole card ['H4', 'DQ'], current stack 743
player [YueShi] gets hole card ['DA', 'D4'], current stack 910
player [Finneas] gets hole card ['C6', 'SK'], current stack 1052
player [Yuchun] gets hole card ['S3', 'HT'], current stack 410
player [Zheng] gets hole card ['S7', 'D7'], current stack 2274
player [RaphaelPlayer] gets hole card ['S2', 'C9'], current stack 1685
Started the round 42
Street "preflop" started. (community card = [])
"JoyoPlayer" declared "raise:15"
"YueShi" declared "fold:0"
"Finneas" declared "call:15"
"Yuchun" declared "fold:0"
"Zheng" declared "call:15"
"RaphaelPlayer" declared "fold:0"
"ZifengFoldMan" declared "fold:0"
Street "flop" started. (community card = ['C4', 'CT', 'D2'])
"JoyoPlayer" declared "raise:10"
"Finneas" declared "call:10"
"Zheng" declared "call:10"
Street "turn" started. (community card = ['C4', 'CT', 'D2', 'DT'])
"JoyoPlayer" declared "raise:10"
"Finneas" declared "call:10"
"Zheng" declared "call:10"
Street "river" started. (community card = ['C4', 'CT', 'D2', 'DT', 'D8'])
"JoyoPlayer" declared "fold:0"
"Finneas" declared "call:0"
"Zheng" declared "call:0"
"['Zheng']" won the round 42 (stack = {'EvanPlayer': 0, 'ZifengFoldMan': 910, 'JoyoPlayer': 708, 'YueShi': 910, 'Finneas': 1017, 'Yuchun': 410, 'Zheng': 2359, 'RaphaelPlayer': 1685})
player [ZifengFoldMan] gets hole card ['CJ', 'C3'], current stack 905
player [JoyoPlayer] gets hole card ['S5', 'D7'], current stack 698
player [YueShi] gets hole card ['H3', 'D6'], current stack 910
player [Finneas] gets hole card ['S4', 'H9'], current stack 1017
player [Yuchun] gets hole card ['HQ', 'C7'], current stack 410
player [Zheng] gets hole card ['DQ', 'S7'], current stack 2359
player [RaphaelPlayer] gets hole card ['D2', 'S6'], current stack 1685
Started the round 43
Street "preflop" started. (community card = [])
"YueShi" declared "fold:0"
"Finneas" declared "call:10"
"Yuchun" declared "fold:0"
"Zheng" declared "call:10"
"RaphaelPlayer" declared "fold:0"
"ZifengFoldMan" declared "fold:0"
"JoyoPlayer" declared "fold:0"
Street "flop" started. (community card = ['C4', 'CA', 'DJ'])
"Finneas" declared "call:0"
"Zheng" declared "call:0"
Street "turn" started. (community card = ['C4', 'CA', 'DJ', 'S8'])
"Finneas" declared "call:0"
"Zheng" declared "call:0"
Street "river" started. (community card = ['C4', 'CA', 'DJ', 'S8', 'CT'])
"Finneas" declared "call:0"
"Zheng" declared "call:0"
"['Finneas']" won the round 43 (stack = {'EvanPlayer': 0, 'ZifengFoldMan': 905, 'JoyoPlayer': 698, 'YueShi': 910, 'Finneas': 1042, 'Yuchun': 410, 'Zheng': 2349, 'RaphaelPlayer': 1685})
player [ZifengFoldMan] gets hole card ['SK', 'CK'], current stack 905
player [JoyoPlayer] gets hole card ['C5', 'S7'], current stack 693
player [YueShi] gets hole card ['D7', 'DT'], current stack 900
player [Finneas] gets hole card ['D8', 'CA'], current stack 1042
player [Yuchun] gets hole card ['D3', 'ST'], current stack 410
player [Zheng] gets hole card ['HK', 'C9'], current stack 2349
player [RaphaelPlayer] gets hole card ['DA', 'DQ'], current stack 1685
Started the round 44
Street "preflop" started. (community card = [])
"Finneas" declared "call:10"
"Yuchun" declared "fold:0"
"Zheng" declared "call:10"
"RaphaelPlayer" declared "raise:30"
"ZifengFoldMan" declared "fold:0"
"JoyoPlayer" declared "raise:50"
"YueShi" declared "fold:0"
"Finneas" declared "fold:0"
"Zheng" declared "call:50"
"RaphaelPlayer" declared "call:50"
Street "flop" started. (community card = ['S6', 'SQ', 'S5'])
"JoyoPlayer" declared "raise:10"
"Zheng" declared "call:10"
"RaphaelPlayer" declared "call:10"
Street "turn" started. (community card = ['S6', 'SQ', 'S5', 'CJ'])
"JoyoPlayer" declared "fold:0"
"Zheng" declared "call:0"
"RaphaelPlayer" declared "raise:210"
"Zheng" declared "fold:0"
"['RaphaelPlayer']" won the round 44 (stack = {'EvanPlayer': 0, 'ZifengFoldMan': 905, 'JoyoPlayer': 638, 'YueShi': 900, 'Finneas': 1032, 'Yuchun': 410, 'Zheng': 2289, 'RaphaelPlayer': 1825})
player [ZifengFoldMan] gets hole card ['HJ', 'D3'], current stack 905
player [JoyoPlayer] gets hole card ['S2', 'CT'], current stack 638
player [YueShi] gets hole card ['CK', 'DJ'], current stack 895
player [Finneas] gets hole card ['C8', 'CJ'], current stack 1022
player [Yuchun] gets hole card ['C2', 'S3'], current stack 410
player [Zheng] gets hole card ['D5', 'H3'], current stack 2289
player [RaphaelPlayer] gets hole card ['C5', 'HA'], current stack 1825
Started the round 45
Street "preflop" started. (community card = [])
"Yuchun" declared "fold:0"
"Zheng" declared "call:10"
"RaphaelPlayer" declared "call:10"
"ZifengFoldMan" declared "fold:0"
"JoyoPlayer" declared "raise:15"
"YueShi" declared "fold:0"
"Finneas" declared "call:15"
"Zheng" declared "call:15"
"RaphaelPlayer" declared "call:15"
Street "flop" started. (community card = ['HQ', 'HK', 'S4'])
"Finneas" declared "call:0"
"Zheng" declared "call:0"
"RaphaelPlayer" declared "call:0"
"JoyoPlayer" declared "fold:0"
Street "turn" started. (community card = ['HQ', 'HK', 'S4', 'H8'])
"Finneas" declared "call:0"
"Zheng" declared "call:0"
"RaphaelPlayer" declared "call:0"
Street "river" started. (community card = ['HQ', 'HK', 'S4', 'H8', 'SK'])
"Finneas" declared "call:0"
"Zheng" declared "call:0"
"RaphaelPlayer" declared "call:0"
"['Finneas']" won the round 45 (stack = {'EvanPlayer': 0, 'ZifengFoldMan': 905, 'JoyoPlayer': 623, 'YueShi': 895, 'Finneas': 1082, 'Yuchun': 410, 'Zheng': 2274, 'RaphaelPlayer': 1810})
player [ZifengFoldMan] gets hole card ['D4', 'H7'], current stack 905
player [JoyoPlayer] gets hole card ['C8', 'DK'], current stack 623
player [YueShi] gets hole card ['H3', 'C5'], current stack 895
player [Finneas] gets hole card ['S5', 'C7'], current stack 1077
player [Yuchun] gets hole card ['CJ', 'HQ'], current stack 400
player [Zheng] gets hole card ['CK', 'C9'], current stack 2274
player [RaphaelPlayer] gets hole card ['HJ', 'S8'], current stack 1810
Started the round 46
Street "preflop" started. (community card = [])
"Zheng" declared "call:10"
"RaphaelPlayer" declared "call:10"
"ZifengFoldMan" declared "fold:0"
"JoyoPlayer" declared "raise:15"
"YueShi" declared "fold:0"
"Finneas" declared "call:15"
"Yuchun" declared "fold:0"
"Zheng" declared "call:15"
"RaphaelPlayer" declared "call:15"
Street "flop" started. (community card = ['D7', 'CQ', 'DA'])
"Finneas" declared "call:0"
"Zheng" declared "call:0"
"RaphaelPlayer" declared "call:0"
"JoyoPlayer" declared "fold:0"
Street "turn" started. (community card = ['D7', 'CQ', 'DA', 'C4'])
"Finneas" declared "call:0"
"Zheng" declared "call:0"
"RaphaelPlayer" declared "call:0"
Street "river" started. (community card = ['D7', 'CQ', 'DA', 'C4', 'SQ'])
"Finneas" declared "call:0"
"Zheng" declared "call:0"
"RaphaelPlayer" declared "call:0"
"['Finneas']" won the round 46 (stack = {'EvanPlayer': 0, 'ZifengFoldMan': 905, 'JoyoPlayer': 608, 'YueShi': 895, 'Finneas': 1137, 'Yuchun': 400, 'Zheng': 2259, 'RaphaelPlayer': 1795})
player [ZifengFoldMan] gets hole card ['DQ', 'CJ'], current stack 905
player [JoyoPlayer] gets hole card ['H8', 'H7'], current stack 608
player [YueShi] gets hole card ['C5', 'DA'], current stack 895
player [Finneas] gets hole card ['DT', 'C4'], current stack 1137
player [Yuchun] gets hole card ['D3', 'C8'], current stack 395
player [Zheng] gets hole card ['S6', 'C9'], current stack 2249
player [RaphaelPlayer] gets hole card ['DK', 'DJ'], current stack 1795
Started the round 47
Street "preflop" started. (community card = [])
"RaphaelPlayer" declared "raise:30"
"ZifengFoldMan" declared "fold:0"
"JoyoPlayer" declared "fold:0"
"YueShi" declared "fold:0"
"Finneas" declared "fold:0"
"Yuchun" declared "fold:0"
"Zheng" declared "call:30"
Street "flop" started. (community card = ['H3', 'CT', 'S5'])
"Zheng" declared "call:0"
"RaphaelPlayer" declared "call:0"
Street "turn" started. (community card = ['H3', 'CT', 'S5', 'S4'])
"Zheng" declared "call:0"
"RaphaelPlayer" declared "call:0"
Street "river" started. (community card = ['H3', 'CT', 'S5', 'S4', 'HK'])
"Zheng" declared "call:0"
"RaphaelPlayer" declared "raise:75"
"Zheng" declared "call:75"
"['RaphaelPlayer']" won the round 47 (stack = {'EvanPlayer': 0, 'ZifengFoldMan': 905, 'JoyoPlayer': 608, 'YueShi': 895, 'Finneas': 1137, 'Yuchun': 395, 'Zheng': 2154, 'RaphaelPlayer': 1905})
player [ZifengFoldMan] gets hole card ['S6', 'SQ'], current stack 905
player [JoyoPlayer] gets hole card ['D4', 'S3'], current stack 608
player [YueShi] gets hole card ['S2', 'SA'], current stack 895
player [Finneas] gets hole card ['S5', 'S7'], current stack 1137
player [Yuchun] gets hole card ['S9', 'C9'], current stack 395
player [Zheng] gets hole card ['H7', 'H3'], current stack 2149
player [RaphaelPlayer] gets hole card ['H5', 'D3'], current stack 1895
Started the round 48
Street "preflop" started. (community card = [])
"ZifengFoldMan" declared "fold:0"
"JoyoPlayer" declared "fold:0"
"YueShi" declared "fold:0"
"Finneas" declared "call:10"
"Yuchun" declared "fold:0"
"Zheng" declared "call:10"
"RaphaelPlayer" declared "fold:0"
Street "flop" started. (community card = ['C5', 'C6', 'H6'])
"Zheng" declared "call:0"
"Finneas" declared "call:0"
Street "turn" started. (community card = ['C5', 'C6', 'H6', 'C3'])
"Zheng" declared "call:0"
"Finneas" declared "call:0"
Street "river" started. (community card = ['C5', 'C6', 'H6', 'C3', 'CQ'])
"Zheng" declared "call:0"
"Finneas" declared "call:0"
"['Finneas']" won the round 48 (stack = {'EvanPlayer': 0, 'ZifengFoldMan': 905, 'JoyoPlayer': 608, 'YueShi': 895, 'Finneas': 1157, 'Yuchun': 395, 'Zheng': 2144, 'RaphaelPlayer': 1895})
player [ZifengFoldMan] gets hole card ['HK', 'C6'], current stack 895
player [JoyoPlayer] gets hole card ['HA', 'DJ'], current stack 608
player [YueShi] gets hole card ['D5', 'S9'], current stack 895
player [Finneas] gets hole card ['H2', 'S6'], current stack 1157
player [Yuchun] gets hole card ['CK', 'D4'], current stack 395
player [Zheng] gets hole card ['SJ', 'SA'], current stack 2144
player [RaphaelPlayer] gets hole card ['H3', 'DK'], current stack 1890
Started the round 49
Street "preflop" started. (community card = [])
"JoyoPlayer" declared "fold:0"
"YueShi" declared "fold:0"
"Finneas" declared "call:10"
"Yuchun" declared "fold:0"
"Zheng" declared "call:10"
"RaphaelPlayer" declared "fold:0"
"ZifengFoldMan" declared "fold:0"
Street "flop" started. (community card = ['S2', 'H8', 'H6'])
"Finneas" declared "call:0"
"Zheng" declared "call:0"
Street "turn" started. (community card = ['S2', 'H8', 'H6', 'CJ'])
"Finneas" declared "call:0"
"Zheng" declared "raise:1072"
"Finneas" declared "fold:0"
"['Zheng']" won the round 49 (stack = {'EvanPlayer': 0, 'ZifengFoldMan': 895, 'JoyoPlayer': 608, 'YueShi': 895, 'Finneas': 1147, 'Yuchun': 395, 'Zheng': 2169, 'RaphaelPlayer': 1890})
player [ZifengFoldMan] gets hole card ['D2', 'S5'], current stack 890
player [JoyoPlayer] gets hole card ['S2', 'SQ'], current stack 598
player [YueShi] gets hole card ['HA', 'D3'], current stack 895
player [Finneas] gets hole card ['CT', 'H3'], current stack 1147
player [Yuchun] gets hole card ['S8', 'S6'], current stack 395
player [Zheng] gets hole card ['C4', 'C8'], current stack 2169
player [RaphaelPlayer] gets hole card ['HQ', 'DK'], current stack 1890
Started the round 50
Street "preflop" started. (community card = [])
"YueShi" declared "fold:0"
"Finneas" declared "call:10"
"Yuchun" declared "fold:0"
"Zheng" declared "call:10"
"RaphaelPlayer" declared "raise:30"
"ZifengFoldMan" declared "fold:0"
"JoyoPlayer" declared "fold:0"
"Finneas" declared "fold:0"
"Zheng" declared "call:30"
Street "flop" started. (community card = ['D4', 'C9', 'S3'])
"Zheng" declared "call:0"
"RaphaelPlayer" declared "call:0"
Street "turn" started. (community card = ['D4', 'C9', 'S3', 'H5'])
"Zheng" declared "call:0"
"RaphaelPlayer" declared "call:0"
Street "river" started. (community card = ['D4', 'C9', 'S3', 'H5', 'CQ'])
"Zheng" declared "call:0"
"RaphaelPlayer" declared "raise:95"
"Zheng" declared "call:95"
"['RaphaelPlayer']" won the round 50 (stack = {'EvanPlayer': 0, 'ZifengFoldMan': 890, 'JoyoPlayer': 598, 'YueShi': 895, 'Finneas': 1137, 'Yuchun': 395, 'Zheng': 2044, 'RaphaelPlayer': 2040})

Game Results:
------------------------------------------------------------
Game 1:
Winner: Zheng (stack: 2044)
All players' stacks:
  EvanPlayer: 0
  ZifengFoldMan: 890
  JoyoPlayer: 598
  YueShi: 895
  Finneas: 1137
  Yuchun: 395
  Zheng: 2044
  RaphaelPlayer: 2040
------------------------------------------------------------
