player [EvanPlayer] gets hole card ['HQ', 'D9'], current stack 1000
player [ZifengFoldMan] gets hole card ['ST', 'D8'], current stack 995
player [JoyoPlayer] gets hole card ['CQ', 'HJ'], current stack 990
player [YueShi] gets hole card ['H7', 'S2'], current stack 1000
player [Finneas] gets hole card ['C5', 'S4'], current stack 1000
player [Yuchun] gets hole card ['C2', 'SK'], current stack 1000
player [Zheng] gets hole card ['D2', 'H5'], current stack 1000
player [RaphaelPlayer] gets hole card ['DT', 'D4'], current stack 1000
Started the round 1
Street "preflop" started. (community card = [])
"YueShi" declared "fold:0"
"Finneas" declared "call:10"
"Yuchun" declared "fold:0"
"Zheng" declared "call:10"
"RaphaelPlayer" declared "fold:0"
"EvanPlayer" declared "raise:1000"
"ZifengFoldMan" declared "fold:0"
"JoyoPlayer" declared "fold:0"
"Finneas" declared "fold:0"
"Zheng" declared "fold:0"
"['EvanPlayer']" won the round 1 (stack = {'EvanPlayer': 1035, 'ZifengFoldMan': 995, 'JoyoPlayer': 990, 'YueShi': 1000, 'Finneas': 990, 'Yuchun': 1000, 'Zheng': 990, 'RaphaelPlayer': 1000})
player [EvanPlayer] gets hole card ['C7', 'DK'], current stack 1035
player [ZifengFoldMan] gets hole card ['D9', 'CK'], current stack 995
player [JoyoPlayer] gets hole card ['H5', 'H2'], current stack 985
player [YueShi] gets hole card ['S6', 'D5'], current stack 990
player [Finneas] gets hole card ['S7', 'S3'], current stack 990
player [Yuchun] gets hole card ['C3', 'S8'], current stack 1000
player [Zheng] gets hole card ['D3', 'C4'], current stack 990
player [RaphaelPlayer] gets hole card ['DT', 'D6'], current stack 1000
Started the round 2
Street "preflop" started. (community card = [])
"Finneas" declared "call:10"
"Yuchun" declared "fold:0"
"Zheng" declared "call:10"
"RaphaelPlayer" declared "call:10"
"EvanPlayer" declared "raise:1035"
"ZifengFoldMan" declared "fold:0"
"JoyoPlayer" declared "call:1035"
"YueShi" declared "fold:0"
"Finneas" declared "fold:0"
"Zheng" declared "fold:0"
"RaphaelPlayer" declared "call:1035"
Street "flop" started. (community card = ['C8', 'DA', 'H9'])
Street "turn" started. (community card = ['C8', 'DA', 'H9', 'H6'])
Street "river" started. (community card = ['C8', 'DA', 'H9', 'H6', 'SA'])
"['RaphaelPlayer']" won the round 2 (stack = {'EvanPlayer': 35, 'ZifengFoldMan': 995, 'JoyoPlayer': 0, 'YueShi': 990, 'Finneas': 980, 'Yuchun': 1000, 'Zheng': 980, 'RaphaelPlayer': 3020})
player [EvanPlayer] gets hole card ['DJ', 'H8'], current stack 35
player [ZifengFoldMan] gets hole card ['HJ', 'D3'], current stack 995
player [YueShi] gets hole card ['CQ', 'D2'], current stack 990
player [Finneas] gets hole card ['D4', 'C7'], current stack 975
player [Yuchun] gets hole card ['SJ', 'D6'], current stack 990
player [Zheng] gets hole card ['DQ', 'SK'], current stack 980
player [RaphaelPlayer] gets hole card ['D7', 'D9'], current stack 3020
Started the round 3
Street "preflop" started. (community card = [])
"Zheng" declared "call:10"
"RaphaelPlayer" declared "call:10"
"EvanPlayer" declared "raise:35"
"ZifengFoldMan" declared "fold:0"
"YueShi" declared "fold:0"
"Finneas" declared "fold:0"
"Yuchun" declared "fold:0"
"Zheng" declared "fold:0"
"RaphaelPlayer" declared "call:35"
Street "flop" started. (community card = ['S2', 'H4', 'DA'])
Street "turn" started. (community card = ['S2', 'H4', 'DA', 'CT'])
Street "river" started. (community card = ['S2', 'H4', 'DA', 'CT', 'DK'])
"['EvanPlayer']" won the round 3 (stack = {'EvanPlayer': 95, 'ZifengFoldMan': 995, 'JoyoPlayer': 0, 'YueShi': 990, 'Finneas': 975, 'Yuchun': 990, 'Zheng': 970, 'RaphaelPlayer': 2985})
player [EvanPlayer] gets hole card ['ST', 'S2'], current stack 95
player [ZifengFoldMan] gets hole card ['D7', 'H9'], current stack 995
player [YueShi] gets hole card ['DJ', 'H6'], current stack 990
player [Finneas] gets hole card ['S4', 'S8'], current stack 975
player [Yuchun] gets hole card ['SQ', 'H2'], current stack 985
player [Zheng] gets hole card ['D8', 'SA'], current stack 960
player [RaphaelPlayer] gets hole card ['H8', 'C2'], current stack 2985
Started the round 4
Street "preflop" started. (community card = [])
"RaphaelPlayer" declared "fold:0"
"EvanPlayer" declared "call:10"
"ZifengFoldMan" declared "fold:0"
"YueShi" declared "fold:0"
"Finneas" declared "call:10"
"Yuchun" declared "fold:0"
"Zheng" declared "call:10"
Street "flop" started. (community card = ['DQ', 'C8', 'S3'])
"Zheng" declared "call:0"
"EvanPlayer" declared "fold:0"
"Finneas" declared "call:0"
Street "turn" started. (community card = ['DQ', 'C8', 'S3', 'H5'])
"Zheng" declared "call:0"
"Finneas" declared "call:0"
Street "river" started. (community card = ['DQ', 'C8', 'S3', 'H5', 'S5'])
"Zheng" declared "call:0"
"Finneas" declared "call:0"
"['Zheng']" won the round 4 (stack = {'EvanPlayer': 85, 'ZifengFoldMan': 995, 'JoyoPlayer': 0, 'YueShi': 990, 'Finneas': 965, 'Yuchun': 985, 'Zheng': 995, 'RaphaelPlayer': 2985})
player [EvanPlayer] gets hole card ['D7', 'H4'], current stack 85
player [ZifengFoldMan] gets hole card ['C8', 'CT'], current stack 995
player [YueShi] gets hole card ['H6', 'D9'], current stack 990
player [Finneas] gets hole card ['CK', 'S8'], current stack 965
player [Yuchun] gets hole card ['D4', 'DJ'], current stack 985
player [Zheng] gets hole card ['H8', 'DK'], current stack 990
player [RaphaelPlayer] gets hole card ['D8', 'DQ'], current stack 2975
Started the round 5
Street "preflop" started. (community card = [])
"EvanPlayer" declared "call:10"
"ZifengFoldMan" declared "fold:0"
"YueShi" declared "fold:0"
"Finneas" declared "call:10"
"Yuchun" declared "fold:0"
"Zheng" declared "call:10"
"RaphaelPlayer" declared "call:10"
Street "flop" started. (community card = ['SQ', 'SK', 'H9'])
"Zheng" declared "call:0"
"RaphaelPlayer" declared "call:0"
"EvanPlayer" declared "fold:0"
"Finneas" declared "call:0"
Street "turn" started. (community card = ['SQ', 'SK', 'H9', 'S9'])
"Zheng" declared "call:0"
"RaphaelPlayer" declared "call:0"
"Finneas" declared "call:0"
Street "river" started. (community card = ['SQ', 'SK', 'H9', 'S9', 'ST'])
"Zheng" declared "call:0"
"RaphaelPlayer" declared "call:0"
"Finneas" declared "raise:482"
"Zheng" declared "fold:0"
"RaphaelPlayer" declared "fold:0"
"['Finneas']" won the round 5 (stack = {'EvanPlayer': 75, 'ZifengFoldMan': 995, 'JoyoPlayer': 0, 'YueShi': 990, 'Finneas': 995, 'Yuchun': 985, 'Zheng': 985, 'RaphaelPlayer': 2975})
player [EvanPlayer] gets hole card ['D9', 'S8'], current stack 65
player [ZifengFoldMan] gets hole card ['S9', 'DK'], current stack 995
player [YueShi] gets hole card ['C8', 'SA'], current stack 990
player [Finneas] gets hole card ['S3', 'C4'], current stack 995
player [Yuchun] gets hole card ['D5', 'DQ'], current stack 985
player [Zheng] gets hole card ['SJ', 'CT'], current stack 985
player [RaphaelPlayer] gets hole card ['H2', 'H5'], current stack 2970
Started the round 6
Street "preflop" started. (community card = [])
"ZifengFoldMan" declared "fold:0"
"YueShi" declared "fold:0"
"Finneas" declared "call:10"
"Yuchun" declared "fold:0"
"Zheng" declared "call:10"
"RaphaelPlayer" declared "fold:0"
"EvanPlayer" declared "fold:10"
Street "flop" started. (community card = ['D6', 'HA', 'SQ'])
"Finneas" declared "call:0"
"Zheng" declared "call:0"
Street "turn" started. (community card = ['D6', 'HA', 'SQ', 'S5'])
"Finneas" declared "call:0"
"Zheng" declared "call:0"
Street "river" started. (community card = ['D6', 'HA', 'SQ', 'S5', 'C6'])
"Finneas" declared "call:0"
"Zheng" declared "call:0"
"['Zheng']" won the round 6 (stack = {'EvanPlayer': 65, 'ZifengFoldMan': 995, 'JoyoPlayer': 0, 'YueShi': 990, 'Finneas': 985, 'Yuchun': 985, 'Zheng': 1010, 'RaphaelPlayer': 2970})
player [EvanPlayer] gets hole card ['C2', 'D5'], current stack 60
player [ZifengFoldMan] gets hole card ['S8', 'H9'], current stack 985
player [YueShi] gets hole card ['CJ', 'CT'], current stack 990
player [Finneas] gets hole card ['ST', 'C3'], current stack 985
player [Yuchun] gets hole card ['D9', 'D4'], current stack 985
player [Zheng] gets hole card ['D7', 'DQ'], current stack 1010
player [RaphaelPlayer] gets hole card ['HK', 'DK'], current stack 2970
Started the round 7
Street "preflop" started. (community card = [])
"YueShi" declared "fold:0"
"Finneas" declared "call:10"
"Yuchun" declared "fold:0"
"Zheng" declared "call:10"
"RaphaelPlayer" declared "raise:40"
"EvanPlayer" declared "fold:40"
"ZifengFoldMan" declared "fold:0"
"Finneas" declared "fold:0"
"Zheng" declared "fold:0"
"['RaphaelPlayer']" won the round 7 (stack = {'EvanPlayer': 60, 'ZifengFoldMan': 985, 'JoyoPlayer': 0, 'YueShi': 990, 'Finneas': 975, 'Yuchun': 985, 'Zheng': 1000, 'RaphaelPlayer': 3005})
player [EvanPlayer] gets hole card ['D3', 'D8'], current stack 60
player [ZifengFoldMan] gets hole card ['C6', 'S7'], current stack 980
player [YueShi] gets hole card ['DA', 'HT'], current stack 980
player [Finneas] gets hole card ['D6', 'DJ'], current stack 975
player [Yuchun] gets hole card ['S6', 'C5'], current stack 985
player [Zheng] gets hole card ['C2', 'CT'], current stack 1000
player [RaphaelPlayer] gets hole card ['DQ', 'D2'], current stack 3005
Started the round 8
Street "preflop" started. (community card = [])
"Finneas" declared "call:10"
"Yuchun" declared "fold:0"
"Zheng" declared "call:10"
"RaphaelPlayer" declared "fold:0"
"EvanPlayer" declared "raise:60"
"ZifengFoldMan" declared "fold:0"
"YueShi" declared "fold:0"
"Finneas" declared "fold:0"
"Zheng" declared "fold:0"
"['EvanPlayer']" won the round 8 (stack = {'EvanPlayer': 95, 'ZifengFoldMan': 980, 'JoyoPlayer': 0, 'YueShi': 980, 'Finneas': 965, 'Yuchun': 985, 'Zheng': 990, 'RaphaelPlayer': 3005})
player [EvanPlayer] gets hole card ['S3', 'D6'], current stack 95
player [ZifengFoldMan] gets hole card ['D3', 'S4'], current stack 980
player [YueShi] gets hole card ['H2', 'DT'], current stack 975
player [Finneas] gets hole card ['D5', 'HA'], current stack 955
player [Yuchun] gets hole card ['D4', 'SA'], current stack 985
player [Zheng] gets hole card ['CQ', 'HK'], current stack 990
player [RaphaelPlayer] gets hole card ['H3', 'DQ'], current stack 3005
Started the round 9
Street "preflop" started. (community card = [])
"Yuchun" declared "fold:0"
"Zheng" declared "call:10"
"RaphaelPlayer" declared "fold:0"
"EvanPlayer" declared "call:10"
"ZifengFoldMan" declared "fold:0"
"YueShi" declared "fold:0"
"Finneas" declared "call:10"
Street "flop" started. (community card = ['SK', 'C8', 'S9'])
"Finneas" declared "call:0"
"Zheng" declared "call:0"
"EvanPlayer" declared "fold:0"
Street "turn" started. (community card = ['SK', 'C8', 'S9', 'H6'])
"Finneas" declared "call:0"
"Zheng" declared "call:0"
Street "river" started. (community card = ['SK', 'C8', 'S9', 'H6', 'D7'])
"Finneas" declared "call:0"
"Zheng" declared "call:0"
"['Finneas']" won the round 9 (stack = {'EvanPlayer': 85, 'ZifengFoldMan': 980, 'JoyoPlayer': 0, 'YueShi': 975, 'Finneas': 990, 'Yuchun': 985, 'Zheng': 980, 'RaphaelPlayer': 3005})
player [EvanPlayer] gets hole card ['S2', 'C2'], current stack 85
player [ZifengFoldMan] gets hole card ['CA', 'H2'], current stack 980
player [YueShi] gets hole card ['S5', 'S4'], current stack 975
player [Finneas] gets hole card ['H5', 'DQ'], current stack 985
player [Yuchun] gets hole card ['D7', 'S3'], current stack 975
player [Zheng] gets hole card ['H8', 'ST'], current stack 980
player [RaphaelPlayer] gets hole card ['S6', 'HQ'], current stack 3005
Started the round 10
Street "preflop" started. (community card = [])
"Zheng" declared "call:10"
"RaphaelPlayer" declared "call:10"
"EvanPlayer" declared "raise:85"
"ZifengFoldMan" declared "fold:0"
"YueShi" declared "fold:0"
"Finneas" declared "fold:0"
"Yuchun" declared "fold:0"
"Zheng" declared "fold:0"
"RaphaelPlayer" declared "fold:0"
"['EvanPlayer']" won the round 10 (stack = {'EvanPlayer': 120, 'ZifengFoldMan': 980, 'JoyoPlayer': 0, 'YueShi': 975, 'Finneas': 985, 'Yuchun': 975, 'Zheng': 970, 'RaphaelPlayer': 2995})
player [EvanPlayer] gets hole card ['D5', 'H6'], current stack 120
player [ZifengFoldMan] gets hole card ['C2', 'C6'], current stack 980
player [YueShi] gets hole card ['ST', 'C8'], current stack 975
player [Finneas] gets hole card ['S6', 'D7'], current stack 985
player [Yuchun] gets hole card ['HT', 'S2'], current stack 970
player [Zheng] gets hole card ['D4', 'H8'], current stack 960
player [RaphaelPlayer] gets hole card ['S9', 'CQ'], current stack 2995
Started the round 11
Street "preflop" started. (community card = [])
"RaphaelPlayer" declared "call:10"
"EvanPlayer" declared "raise:120"
"ZifengFoldMan" declared "fold:0"
"YueShi" declared "fold:0"
"Finneas" declared "fold:0"
"Yuchun" declared "call:120"
"Zheng" declared "fold:0"
"RaphaelPlayer" declared "call:120"
Street "flop" started. (community card = ['HQ', 'C7', 'D2'])
"Yuchun" declared "call:0"
"RaphaelPlayer" declared "raise:380"
"Yuchun" declared "fold:0"
Street "turn" started. (community card = ['HQ', 'C7', 'D2', 'C4'])
Street "river" started. (community card = ['HQ', 'C7', 'D2', 'C4', 'D6'])
"['RaphaelPlayer']" won the round 11 (stack = {'EvanPlayer': 0, 'ZifengFoldMan': 980, 'JoyoPlayer': 0, 'YueShi': 975, 'Finneas': 985, 'Yuchun': 855, 'Zheng': 960, 'RaphaelPlayer': 3245})
player [ZifengFoldMan] gets hole card ['C5', 'C7'], current stack 980
player [YueShi] gets hole card ['HJ', 'D3'], current stack 975
player [Finneas] gets hole card ['SA', 'D7'], current stack 985
player [Yuchun] gets hole card ['C3', 'S2'], current stack 855
player [Zheng] gets hole card ['D5', 'C6'], current stack 955
player [RaphaelPlayer] gets hole card ['S6', 'D6'], current stack 3235
Started the round 12
Street "preflop" started. (community card = [])
"ZifengFoldMan" declared "fold:0"
"YueShi" declared "fold:0"
"Finneas" declared "call:10"
"Yuchun" declared "call:10"
"Zheng" declared "call:10"
"RaphaelPlayer" declared "call:10"
Street "flop" started. (community card = ['ST', 'S9', 'CK'])
"Zheng" declared "call:0"
"RaphaelPlayer" declared "call:0"
"Finneas" declared "call:0"
"Yuchun" declared "call:0"
Street "turn" started. (community card = ['ST', 'S9', 'CK', 'SJ'])
"Zheng" declared "call:0"
"RaphaelPlayer" declared "call:0"
"Finneas" declared "call:0"
"Yuchun" declared "call:0"
Street "river" started. (community card = ['ST', 'S9', 'CK', 'SJ', 'S3'])
"Zheng" declared "call:0"
"RaphaelPlayer" declared "raise:50"
"Finneas" declared "raise:537"
"Yuchun" declared "fold:0"
"Zheng" declared "fold:0"
"RaphaelPlayer" declared "call:537"
"['Finneas']" won the round 12 (stack = {'EvanPlayer': 0, 'ZifengFoldMan': 980, 'JoyoPlayer': 0, 'YueShi': 975, 'Finneas': 1552, 'Yuchun': 845, 'Zheng': 950, 'RaphaelPlayer': 2698})
player [ZifengFoldMan] gets hole card ['H3', 'HQ'], current stack 970
player [YueShi] gets hole card ['SJ', 'H4'], current stack 975
player [Finneas] gets hole card ['DA', 'H8'], current stack 1552
player [Yuchun] gets hole card ['CQ', 'S4'], current stack 845
player [Zheng] gets hole card ['CA', 'HA'], current stack 950
player [RaphaelPlayer] gets hole card ['S2', 'H6'], current stack 2693
Started the round 13
Street "preflop" started. (community card = [])
"YueShi" declared "fold:0"
"Finneas" declared "call:10"
"Yuchun" declared "call:10"
"Zheng" declared "call:10"
"RaphaelPlayer" declared "fold:0"
"ZifengFoldMan" declared "fold:0"
Street "flop" started. (community card = ['CJ', 'C4', 'S8'])
"Finneas" declared "call:0"
"Yuchun" declared "call:0"
"Zheng" declared "call:0"
Street "turn" started. (community card = ['CJ', 'C4', 'S8', 'C5'])
"Finneas" declared "call:0"
"Yuchun" declared "call:0"
"Zheng" declared "call:0"
Street "river" started. (community card = ['CJ', 'C4', 'S8', 'C5', 'S9'])
"Finneas" declared "call:0"
"Yuchun" declared "call:0"
"Zheng" declared "call:0"
"['Zheng']" won the round 13 (stack = {'EvanPlayer': 0, 'ZifengFoldMan': 970, 'JoyoPlayer': 0, 'YueShi': 975, 'Finneas': 1542, 'Yuchun': 835, 'Zheng': 985, 'RaphaelPlayer': 2693})
player [ZifengFoldMan] gets hole card ['DT', 'SQ'], current stack 965
player [YueShi] gets hole card ['C4', 'D6'], current stack 965
player [Finneas] gets hole card ['ST', 'H9'], current stack 1542
player [Yuchun] gets hole card ['H8', 'S2'], current stack 835
player [Zheng] gets hole card ['C6', 'DA'], current stack 985
player [RaphaelPlayer] gets hole card ['D8', 'HJ'], current stack 2693
Started the round 14
Street "preflop" started. (community card = [])
"Finneas" declared "call:10"
"Yuchun" declared "call:10"
"Zheng" declared "call:10"
"RaphaelPlayer" declared "call:10"
"ZifengFoldMan" declared "fold:0"
"YueShi" declared "fold:0"
Street "flop" started. (community card = ['C3', 'CQ', 'C5'])
"Finneas" declared "call:0"
"Yuchun" declared "call:0"
"Zheng" declared "call:0"
"RaphaelPlayer" declared "call:0"
Street "turn" started. (community card = ['C3', 'CQ', 'C5', 'DK'])
"Finneas" declared "call:0"
"Yuchun" declared "call:0"
"Zheng" declared "call:0"
"RaphaelPlayer" declared "call:0"
Street "river" started. (community card = ['C3', 'CQ', 'C5', 'DK', 'S6'])
"Finneas" declared "call:0"
"Yuchun" declared "call:0"
"Zheng" declared "call:0"
"RaphaelPlayer" declared "call:0"
"['Zheng']" won the round 14 (stack = {'EvanPlayer': 0, 'ZifengFoldMan': 965, 'JoyoPlayer': 0, 'YueShi': 965, 'Finneas': 1532, 'Yuchun': 825, 'Zheng': 1030, 'RaphaelPlayer': 2683})
player [ZifengFoldMan] gets hole card ['HJ', 'CJ'], current stack 965
player [YueShi] gets hole card ['C4', 'H2'], current stack 960
player [Finneas] gets hole card ['D4', 'D2'], current stack 1522
player [Yuchun] gets hole card ['C5', 'C3'], current stack 825
player [Zheng] gets hole card ['DJ', 'S9'], current stack 1030
player [RaphaelPlayer] gets hole card ['S2', 'S5'], current stack 2683
Started the round 15
Street "preflop" started. (community card = [])
"Yuchun" declared "call:10"
"Zheng" declared "call:10"
"RaphaelPlayer" declared "fold:0"
"ZifengFoldMan" declared "fold:0"
"YueShi" declared "fold:0"
"Finneas" declared "call:10"
Street "flop" started. (community card = ['D8', 'C9', 'D7'])
"Finneas" declared "call:0"
"Yuchun" declared "call:0"
"Zheng" declared "call:0"
Street "turn" started. (community card = ['D8', 'C9', 'D7', 'SQ'])
"Finneas" declared "call:0"
"Yuchun" declared "call:0"
"Zheng" declared "call:0"
Street "river" started. (community card = ['D8', 'C9', 'D7', 'SQ', 'H4'])
"Finneas" declared "call:0"
"Yuchun" declared "call:0"
"Zheng" declared "call:0"
"['Zheng']" won the round 15 (stack = {'EvanPlayer': 0, 'ZifengFoldMan': 965, 'JoyoPlayer': 0, 'YueShi': 960, 'Finneas': 1522, 'Yuchun': 815, 'Zheng': 1055, 'RaphaelPlayer': 2683})
player [ZifengFoldMan] gets hole card ['H2', 'H9'], current stack 965
player [YueShi] gets hole card ['D4', 'S2'], current stack 960
player [Finneas] gets hole card ['C5', 'CA'], current stack 1517
player [Yuchun] gets hole card ['D7', 'S3'], current stack 805
player [Zheng] gets hole card ['C7', 'DT'], current stack 1055
player [RaphaelPlayer] gets hole card ['S8', 'S7'], current stack 2683
Started the round 16
Street "preflop" started. (community card = [])
"Zheng" declared "call:10"
"RaphaelPlayer" declared "call:10"
"ZifengFoldMan" declared "fold:0"
"YueShi" declared "fold:0"
"Finneas" declared "call:10"
"Yuchun" declared "call:10"
Street "flop" started. (community card = ['CQ', 'C3', 'HJ'])
"Finneas" declared "call:0"
"Yuchun" declared "call:0"
"Zheng" declared "call:0"
"RaphaelPlayer" declared "call:0"
Street "turn" started. (community card = ['CQ', 'C3', 'HJ', 'D3'])
"Finneas" declared "call:0"
"Yuchun" declared "raise:805"
"Zheng" declared "fold:0"
"RaphaelPlayer" declared "fold:0"
"Finneas" declared "fold:0"
"['Yuchun']" won the round 16 (stack = {'EvanPlayer': 0, 'ZifengFoldMan': 965, 'JoyoPlayer': 0, 'YueShi': 960, 'Finneas': 1512, 'Yuchun': 845, 'Zheng': 1045, 'RaphaelPlayer': 2673})
player [ZifengFoldMan] gets hole card ['C4', 'CT'], current stack 965
player [YueShi] gets hole card ['D9', 'DJ'], current stack 960
player [Finneas] gets hole card ['H3', 'C2'], current stack 1512
player [Yuchun] gets hole card ['S3', 'HQ'], current stack 840
player [Zheng] gets hole card ['H9', 'C8'], current stack 1035
player [RaphaelPlayer] gets hole card ['C6', 'CJ'], current stack 2673
Started the round 17
Street "preflop" started. (community card = [])
"RaphaelPlayer" declared "call:10"
"ZifengFoldMan" declared "fold:0"
"YueShi" declared "fold:0"
"Finneas" declared "call:10"
"Yuchun" declared "call:10"
"Zheng" declared "call:10"
Street "flop" started. (community card = ['CK', 'ST', 'CQ'])
"Yuchun" declared "call:0"
"Zheng" declared "call:0"
"RaphaelPlayer" declared "call:0"
"Finneas" declared "call:0"
Street "turn" started. (community card = ['CK', 'ST', 'CQ', 'HA'])
"Yuchun" declared "call:0"
"Zheng" declared "call:0"
"RaphaelPlayer" declared "raise:50"
"Finneas" declared "fold:0"
"Yuchun" declared "call:50"
"Zheng" declared "fold:0"
Street "river" started. (community card = ['CK', 'ST', 'CQ', 'HA', 'CA'])
"Yuchun" declared "call:0"
"RaphaelPlayer" declared "raise:150"
"Yuchun" declared "call:150"
"['RaphaelPlayer']" won the round 17 (stack = {'EvanPlayer': 0, 'ZifengFoldMan': 965, 'JoyoPlayer': 0, 'YueShi': 960, 'Finneas': 1502, 'Yuchun': 635, 'Zheng': 1035, 'RaphaelPlayer': 2903})
player [ZifengFoldMan] gets hole card ['H4', 'D4'], current stack 965
player [YueShi] gets hole card ['CQ', 'D7'], current stack 960
player [Finneas] gets hole card ['S4', 'ST'], current stack 1502
player [Yuchun] gets hole card ['S9', 'HA'], current stack 635
player [Zheng] gets hole card ['DT', 'C3'], current stack 1030
player [RaphaelPlayer] gets hole card ['SA', 'S5'], current stack 2893
Started the round 18
Street "preflop" started. (community card = [])
"ZifengFoldMan" declared "fold:0"
"YueShi" declared "fold:0"
"Finneas" declared "call:10"
"Yuchun" declared "call:10"
"Zheng" declared "call:10"
"RaphaelPlayer" declared "call:10"
Street "flop" started. (community card = ['CT', 'DQ', 'H9'])
"Zheng" declared "call:0"
"RaphaelPlayer" declared "call:0"
"Finneas" declared "call:0"
"Yuchun" declared "call:0"
Street "turn" started. (community card = ['CT', 'DQ', 'H9', 'H7'])
"Zheng" declared "call:0"
"RaphaelPlayer" declared "call:0"
"Finneas" declared "call:0"
"Yuchun" declared "call:0"
Street "river" started. (community card = ['CT', 'DQ', 'H9', 'H7', 'C5'])
"Zheng" declared "call:0"
"RaphaelPlayer" declared "call:0"
"Finneas" declared "call:0"
"Yuchun" declared "call:0"
"['Finneas', 'Zheng']" won the round 18 (stack = {'EvanPlayer': 0, 'ZifengFoldMan': 965, 'JoyoPlayer': 0, 'YueShi': 960, 'Finneas': 1512, 'Yuchun': 625, 'Zheng': 1045, 'RaphaelPlayer': 2893})
player [ZifengFoldMan] gets hole card ['C9', 'S4'], current stack 955
player [YueShi] gets hole card ['SJ', 'SQ'], current stack 960
player [Finneas] gets hole card ['H2', 'D9'], current stack 1512
player [Yuchun] gets hole card ['D4', 'H9'], current stack 625
player [Zheng] gets hole card ['DA', 'D6'], current stack 1045
player [RaphaelPlayer] gets hole card ['S7', 'H6'], current stack 2888
Started the round 19
Street "preflop" started. (community card = [])
"YueShi" declared "fold:0"
"Finneas" declared "call:10"
"Yuchun" declared "call:10"
"Zheng" declared "call:10"
"RaphaelPlayer" declared "fold:0"
"ZifengFoldMan" declared "fold:0"
Street "flop" started. (community card = ['HJ', 'H3', 'S8'])
"Finneas" declared "call:0"
"Yuchun" declared "call:0"
"Zheng" declared "call:0"
Street "turn" started. (community card = ['HJ', 'H3', 'S8', 'HK'])
"Finneas" declared "call:0"
"Yuchun" declared "call:0"
"Zheng" declared "call:0"
Street "river" started. (community card = ['HJ', 'H3', 'S8', 'HK', 'SA'])
"Finneas" declared "call:0"
"Yuchun" declared "call:0"
"Zheng" declared "call:0"
"['Zheng']" won the round 19 (stack = {'EvanPlayer': 0, 'ZifengFoldMan': 955, 'JoyoPlayer': 0, 'YueShi': 960, 'Finneas': 1502, 'Yuchun': 615, 'Zheng': 1080, 'RaphaelPlayer': 2888})
player [ZifengFoldMan] gets hole card ['CQ', 'ST'], current stack 950
player [YueShi] gets hole card ['DQ', 'C9'], current stack 950
player [Finneas] gets hole card ['C7', 'H5'], current stack 1502
player [Yuchun] gets hole card ['S8', 'H3'], current stack 615
player [Zheng] gets hole card ['H7', 'C2'], current stack 1080
player [RaphaelPlayer] gets hole card ['SJ', 'D5'], current stack 2888
Started the round 20
Street "preflop" started. (community card = [])
"Finneas" declared "call:10"
"Yuchun" declared "call:10"
"Zheng" declared "call:10"
"RaphaelPlayer" declared "fold:0"
"ZifengFoldMan" declared "fold:0"
"YueShi" declared "fold:0"
Street "flop" started. (community card = ['CA', 'D4', 'HQ'])
"Finneas" declared "call:0"
"Yuchun" declared "call:0"
"Zheng" declared "call:0"
Street "turn" started. (community card = ['CA', 'D4', 'HQ', 'HJ'])
"Finneas" declared "call:0"
"Yuchun" declared "call:0"
"Zheng" declared "call:0"
Street "river" started. (community card = ['CA', 'D4', 'HQ', 'HJ', 'S5'])
"Finneas" declared "call:0"
"Yuchun" declared "call:0"
"Zheng" declared "call:0"
"['Finneas']" won the round 20 (stack = {'EvanPlayer': 0, 'ZifengFoldMan': 950, 'JoyoPlayer': 0, 'YueShi': 950, 'Finneas': 1537, 'Yuchun': 605, 'Zheng': 1070, 'RaphaelPlayer': 2888})
player [ZifengFoldMan] gets hole card ['HQ', 'S7'], current stack 950
player [YueShi] gets hole card ['D6', 'C6'], current stack 945
player [Finneas] gets hole card ['DQ', 'D7'], current stack 1527
player [Yuchun] gets hole card ['HJ', 'S6'], current stack 605
player [Zheng] gets hole card ['DT', 'H2'], current stack 1070
player [RaphaelPlayer] gets hole card ['DJ', 'SK'], current stack 2888
Started the round 21
Street "preflop" started. (community card = [])
"Yuchun" declared "call:10"
"Zheng" declared "call:10"
"RaphaelPlayer" declared "raise:30"
"ZifengFoldMan" declared "fold:0"
"YueShi" declared "fold:0"
"Finneas" declared "fold:0"
"Yuchun" declared "call:30"
"Zheng" declared "call:30"
Street "flop" started. (community card = ['CJ', 'HA', 'C4'])
"Yuchun" declared "call:0"
"Zheng" declared "call:0"
"RaphaelPlayer" declared "raise:115"
"Yuchun" declared "call:115"
"Zheng" declared "call:115"
Street "turn" started. (community card = ['CJ', 'HA', 'C4', 'CQ'])
"Yuchun" declared "call:0"
"Zheng" declared "call:0"
"RaphaelPlayer" declared "call:0"
Street "river" started. (community card = ['CJ', 'HA', 'C4', 'CQ', 'S5'])
"Yuchun" declared "call:0"
"Zheng" declared "call:0"
"RaphaelPlayer" declared "call:0"
"['RaphaelPlayer']" won the round 21 (stack = {'EvanPlayer': 0, 'ZifengFoldMan': 950, 'JoyoPlayer': 0, 'YueShi': 945, 'Finneas': 1527, 'Yuchun': 460, 'Zheng': 925, 'RaphaelPlayer': 3193})
player [ZifengFoldMan] gets hole card ['C2', 'CJ'], current stack 950
player [YueShi] gets hole card ['C4', 'H4'], current stack 945
player [Finneas] gets hole card ['H2', 'S2'], current stack 1522
player [Yuchun] gets hole card ['H5', 'D7'], current stack 450
player [Zheng] gets hole card ['HQ', 'HT'], current stack 925
player [RaphaelPlayer] gets hole card ['S7', 'SJ'], current stack 3193
Started the round 22
Street "preflop" started. (community card = [])
"Zheng" declared "call:10"
"RaphaelPlayer" declared "call:10"
"ZifengFoldMan" declared "fold:0"
"YueShi" declared "fold:0"
"Finneas" declared "call:10"
"Yuchun" declared "call:10"
Street "flop" started. (community card = ['DJ', 'H7', 'CQ'])
"Finneas" declared "call:0"
"Yuchun" declared "call:0"
"Zheng" declared "call:0"
"RaphaelPlayer" declared "raise:50"
"Finneas" declared "fold:0"
"Yuchun" declared "call:50"
"Zheng" declared "call:50"
Street "turn" started. (community card = ['DJ', 'H7', 'CQ', 'D3'])
"Yuchun" declared "call:0"
"Zheng" declared "call:0"
"RaphaelPlayer" declared "raise:200"
"Yuchun" declared "call:200"
"Zheng" declared "fold:0"
Street "river" started. (community card = ['DJ', 'H7', 'CQ', 'D3', 'D2'])
"Yuchun" declared "call:0"
"RaphaelPlayer" declared "raise:600"
"Yuchun" declared "fold:0"
"['RaphaelPlayer']" won the round 22 (stack = {'EvanPlayer': 0, 'ZifengFoldMan': 950, 'JoyoPlayer': 0, 'YueShi': 945, 'Finneas': 1517, 'Yuchun': 200, 'Zheng': 865, 'RaphaelPlayer': 3523})
player [ZifengFoldMan] gets hole card ['H6', 'S8'], current stack 950
player [YueShi] gets hole card ['C6', 'SK'], current stack 945
player [Finneas] gets hole card ['CQ', 'ST'], current stack 1517
player [Yuchun] gets hole card ['DT', 'C3'], current stack 195
player [Zheng] gets hole card ['H8', 'SQ'], current stack 855
player [RaphaelPlayer] gets hole card ['HQ', 'H2'], current stack 3523
Started the round 23
Street "preflop" started. (community card = [])
"RaphaelPlayer" declared "call:10"
"ZifengFoldMan" declared "fold:0"
"YueShi" declared "fold:0"
"Finneas" declared "call:10"
"Yuchun" declared "call:10"
"Zheng" declared "call:10"
Street "flop" started. (community card = ['H7', 'S3', 'H9'])
"Yuchun" declared "call:0"
"Zheng" declared "call:0"
"RaphaelPlayer" declared "call:0"
"Finneas" declared "call:0"
Street "turn" started. (community card = ['H7', 'S3', 'H9', 'DK'])
"Yuchun" declared "call:0"
"Zheng" declared "call:0"
"RaphaelPlayer" declared "call:0"
"Finneas" declared "call:0"
Street "river" started. (community card = ['H7', 'S3', 'H9', 'DK', 'S2'])
"Yuchun" declared "call:0"
"Zheng" declared "call:0"
"RaphaelPlayer" declared "call:0"
"Finneas" declared "call:0"
"['Yuchun']" won the round 23 (stack = {'EvanPlayer': 0, 'ZifengFoldMan': 950, 'JoyoPlayer': 0, 'YueShi': 945, 'Finneas': 1507, 'Yuchun': 230, 'Zheng': 855, 'RaphaelPlayer': 3513})
player [ZifengFoldMan] gets hole card ['HQ', 'HA'], current stack 950
player [YueShi] gets hole card ['D6', 'S4'], current stack 945
player [Finneas] gets hole card ['H6', 'H9'], current stack 1507
player [Yuchun] gets hole card ['S3', 'SK'], current stack 230
player [Zheng] gets hole card ['C6', 'S2'], current stack 850
player [RaphaelPlayer] gets hole card ['C7', 'S7'], current stack 3503
Started the round 24
Street "preflop" started. (community card = [])
"ZifengFoldMan" declared "fold:0"
"YueShi" declared "fold:0"
"Finneas" declared "call:10"
"Yuchun" declared "call:10"
"Zheng" declared "call:10"
"RaphaelPlayer" declared "raise:30"
"Finneas" declared "fold:0"
"Yuchun" declared "call:30"
"Zheng" declared "call:30"
Street "flop" started. (community card = ['D5', 'CA', 'H8'])
"Zheng" declared "call:0"
"RaphaelPlayer" declared "call:0"
"Yuchun" declared "call:0"
Street "turn" started. (community card = ['D5', 'CA', 'H8', 'CK'])
"Zheng" declared "call:0"
"RaphaelPlayer" declared "call:0"
"Yuchun" declared "call:0"
Street "river" started. (community card = ['D5', 'CA', 'H8', 'CK', 'C2'])
"Zheng" declared "call:0"
"RaphaelPlayer" declared "call:0"
"Yuchun" declared "call:0"
"['Yuchun']" won the round 24 (stack = {'EvanPlayer': 0, 'ZifengFoldMan': 950, 'JoyoPlayer': 0, 'YueShi': 945, 'Finneas': 1497, 'Yuchun': 300, 'Zheng': 825, 'RaphaelPlayer': 3483})
player [ZifengFoldMan] gets hole card ['DJ', 'H6'], current stack 940
player [YueShi] gets hole card ['S3', 'DQ'], current stack 945
player [Finneas] gets hole card ['C3', 'H4'], current stack 1497
player [Yuchun] gets hole card ['HT', 'C5'], current stack 300
player [Zheng] gets hole card ['D2', 'H5'], current stack 825
player [RaphaelPlayer] gets hole card ['S7', 'DK'], current stack 3478
Started the round 25
Street "preflop" started. (community card = [])
"YueShi" declared "fold:0"
"Finneas" declared "call:10"
"Yuchun" declared "call:10"
"Zheng" declared "call:10"
"RaphaelPlayer" declared "call:10"
"ZifengFoldMan" declared "fold:0"
Street "flop" started. (community card = ['HK', 'S9', 'D4'])
"RaphaelPlayer" declared "raise:60"
"Finneas" declared "fold:0"
"Yuchun" declared "fold:0"
"Zheng" declared "call:60"
Street "turn" started. (community card = ['HK', 'S9', 'D4', 'C8'])
"RaphaelPlayer" declared "raise:180"
"Zheng" declared "fold:0"
"['RaphaelPlayer']" won the round 25 (stack = {'EvanPlayer': 0, 'ZifengFoldMan': 940, 'JoyoPlayer': 0, 'YueShi': 945, 'Finneas': 1487, 'Yuchun': 290, 'Zheng': 755, 'RaphaelPlayer': 3583})
player [ZifengFoldMan] gets hole card ['C5', 'H4'], current stack 935
player [YueShi] gets hole card ['HK', 'H7'], current stack 935
player [Finneas] gets hole card ['SK', 'D8'], current stack 1487
player [Yuchun] gets hole card ['H2', 'C6'], current stack 290
player [Zheng] gets hole card ['SJ', 'S8'], current stack 755
player [RaphaelPlayer] gets hole card ['SQ', 'S9'], current stack 3583
Started the round 26
Street "preflop" started. (community card = [])
"Finneas" declared "call:10"
"Yuchun" declared "call:10"
"Zheng" declared "call:10"
"RaphaelPlayer" declared "call:10"
"ZifengFoldMan" declared "fold:0"
"YueShi" declared "fold:0"
Street "flop" started. (community card = ['H5', 'C4', 'H3'])
"Finneas" declared "call:0"
"Yuchun" declared "raise:40"
"Zheng" declared "call:40"
"RaphaelPlayer" declared "fold:0"
"Finneas" declared "fold:0"
Street "turn" started. (community card = ['H5', 'C4', 'H3', 'D5'])
"Yuchun" declared "raise:240"
"Zheng" declared "fold:0"
"['Yuchun']" won the round 26 (stack = {'EvanPlayer': 0, 'ZifengFoldMan': 935, 'JoyoPlayer': 0, 'YueShi': 935, 'Finneas': 1477, 'Yuchun': 375, 'Zheng': 705, 'RaphaelPlayer': 3573})
player [ZifengFoldMan] gets hole card ['H2', 'D2'], current stack 935
player [YueShi] gets hole card ['CQ', 'C6'], current stack 930
player [Finneas] gets hole card ['S5', 'S8'], current stack 1467
player [Yuchun] gets hole card ['DJ', 'C2'], current stack 375
player [Zheng] gets hole card ['S2', 'D3'], current stack 705
player [RaphaelPlayer] gets hole card ['S3', 'D7'], current stack 3573
Started the round 27
Street "preflop" started. (community card = [])
"Yuchun" declared "call:10"
"Zheng" declared "call:10"
"RaphaelPlayer" declared "fold:0"
"ZifengFoldMan" declared "fold:0"
"YueShi" declared "fold:0"
"Finneas" declared "call:10"
Street "flop" started. (community card = ['HT', 'H8', 'DT'])
"Finneas" declared "call:0"
"Yuchun" declared "call:0"
"Zheng" declared "call:0"
Street "turn" started. (community card = ['HT', 'H8', 'DT', 'D6'])
"Finneas" declared "call:0"
"Yuchun" declared "call:0"
"Zheng" declared "call:0"
Street "river" started. (community card = ['HT', 'H8', 'DT', 'D6', 'H3'])
"Finneas" declared "call:0"
"Yuchun" declared "call:0"
"Zheng" declared "call:0"
"['Finneas']" won the round 27 (stack = {'EvanPlayer': 0, 'ZifengFoldMan': 935, 'JoyoPlayer': 0, 'YueShi': 930, 'Finneas': 1502, 'Yuchun': 365, 'Zheng': 695, 'RaphaelPlayer': 3573})
player [ZifengFoldMan] gets hole card ['SA', 'CK'], current stack 935
player [YueShi] gets hole card ['SQ', 'H5'], current stack 930
player [Finneas] gets hole card ['C4', 'HQ'], current stack 1497
player [Yuchun] gets hole card ['D4', 'C7'], current stack 355
player [Zheng] gets hole card ['SK', 'DQ'], current stack 695
player [RaphaelPlayer] gets hole card ['H9', 'D6'], current stack 3573
Started the round 28
Street "preflop" started. (community card = [])
"Zheng" declared "call:10"
"RaphaelPlayer" declared "fold:0"
"ZifengFoldMan" declared "fold:0"
"YueShi" declared "fold:0"
"Finneas" declared "call:10"
"Yuchun" declared "call:10"
Street "flop" started. (community card = ['HK', 'C9', 'HJ'])
"Finneas" declared "call:0"
"Yuchun" declared "call:0"
"Zheng" declared "call:0"
Street "turn" started. (community card = ['HK', 'C9', 'HJ', 'D9'])
"Finneas" declared "call:0"
"Yuchun" declared "call:0"
"Zheng" declared "call:0"
Street "river" started. (community card = ['HK', 'C9', 'HJ', 'D9', 'D3'])
"Finneas" declared "call:0"
"Yuchun" declared "call:0"
"Zheng" declared "call:0"
"['Zheng']" won the round 28 (stack = {'EvanPlayer': 0, 'ZifengFoldMan': 935, 'JoyoPlayer': 0, 'YueShi': 930, 'Finneas': 1492, 'Yuchun': 355, 'Zheng': 715, 'RaphaelPlayer': 3573})
player [ZifengFoldMan] gets hole card ['CJ', 'S3'], current stack 935
player [YueShi] gets hole card ['D4', 'H9'], current stack 930
player [Finneas] gets hole card ['CK', 'S6'], current stack 1492
player [Yuchun] gets hole card ['H5', 'D5'], current stack 350
player [Zheng] gets hole card ['DK', 'SQ'], current stack 705
player [RaphaelPlayer] gets hole card ['D2', 'S4'], current stack 3573
Started the round 29
Street "preflop" started. (community card = [])
"RaphaelPlayer" declared "fold:0"
"ZifengFoldMan" declared "fold:0"
"YueShi" declared "fold:0"
"Finneas" declared "call:10"
"Yuchun" declared "call:10"
"Zheng" declared "call:10"
Street "flop" started. (community card = ['D8', 'H6', 'SA'])
"Yuchun" declared "call:0"
"Zheng" declared "call:0"
"Finneas" declared "call:0"
Street "turn" started. (community card = ['D8', 'H6', 'SA', 'HQ'])
"Yuchun" declared "call:0"
"Zheng" declared "call:0"
"Finneas" declared "call:0"
Street "river" started. (community card = ['D8', 'H6', 'SA', 'HQ', 'C7'])
"Yuchun" declared "call:0"
"Zheng" declared "call:0"
"Finneas" declared "call:0"
"['Zheng']" won the round 29 (stack = {'EvanPlayer': 0, 'ZifengFoldMan': 935, 'JoyoPlayer': 0, 'YueShi': 930, 'Finneas': 1482, 'Yuchun': 345, 'Zheng': 735, 'RaphaelPlayer': 3573})
player [ZifengFoldMan] gets hole card ['S7', 'D4'], current stack 935
player [YueShi] gets hole card ['C6', 'C5'], current stack 930
player [Finneas] gets hole card ['H4', 'H5'], current stack 1482
player [Yuchun] gets hole card ['SJ', 'C7'], current stack 345
player [Zheng] gets hole card ['ST', 'D6'], current stack 730
player [RaphaelPlayer] gets hole card ['S2', 'SQ'], current stack 3563
Started the round 30
Street "preflop" started. (community card = [])
"ZifengFoldMan" declared "fold:0"
"YueShi" declared "fold:0"
"Finneas" declared "call:10"
"Yuchun" declared "call:10"
"Zheng" declared "call:10"
"RaphaelPlayer" declared "call:10"
Street "flop" started. (community card = ['H7', 'DK', 'H2'])
"Zheng" declared "call:0"
"RaphaelPlayer" declared "call:0"
"Finneas" declared "call:0"
"Yuchun" declared "call:0"
Street "turn" started. (community card = ['H7', 'DK', 'H2', 'D8'])
"Zheng" declared "call:0"
"RaphaelPlayer" declared "call:0"
"Finneas" declared "call:0"
"Yuchun" declared "call:0"
Street "river" started. (community card = ['H7', 'DK', 'H2', 'D8', 'C4'])
"Zheng" declared "call:0"
"RaphaelPlayer" declared "call:0"
"Finneas" declared "call:0"
"Yuchun" declared "call:0"
"['Yuchun']" won the round 30 (stack = {'EvanPlayer': 0, 'ZifengFoldMan': 935, 'JoyoPlayer': 0, 'YueShi': 930, 'Finneas': 1472, 'Yuchun': 375, 'Zheng': 725, 'RaphaelPlayer': 3563})
player [ZifengFoldMan] gets hole card ['H2', 'SQ'], current stack 925
player [YueShi] gets hole card ['C6', 'S4'], current stack 930
player [Finneas] gets hole card ['H7', 'H8'], current stack 1472
player [Yuchun] gets hole card ['DJ', 'C3'], current stack 375
player [Zheng] gets hole card ['S3', 'H9'], current stack 725
player [RaphaelPlayer] gets hole card ['D3', 'SJ'], current stack 3558
Started the round 31
Street "preflop" started. (community card = [])
"YueShi" declared "fold:0"
"Finneas" declared "call:10"
"Yuchun" declared "call:10"
"Zheng" declared "call:10"
"RaphaelPlayer" declared "fold:0"
"ZifengFoldMan" declared "fold:0"
Street "flop" started. (community card = ['CA', 'HA', 'CT'])
"Finneas" declared "call:0"
"Yuchun" declared "call:0"
"Zheng" declared "call:0"
Street "turn" started. (community card = ['CA', 'HA', 'CT', 'HQ'])
"Finneas" declared "call:0"
"Yuchun" declared "call:0"
"Zheng" declared "call:0"
Street "river" started. (community card = ['CA', 'HA', 'CT', 'HQ', 'D4'])
"Finneas" declared "call:0"
"Yuchun" declared "call:0"
"Zheng" declared "call:0"
"['Yuchun']" won the round 31 (stack = {'EvanPlayer': 0, 'ZifengFoldMan': 925, 'JoyoPlayer': 0, 'YueShi': 930, 'Finneas': 1462, 'Yuchun': 410, 'Zheng': 715, 'RaphaelPlayer': 3558})
player [ZifengFoldMan] gets hole card ['S4', 'D8'], current stack 920
player [YueShi] gets hole card ['DA', 'H6'], current stack 920
player [Finneas] gets hole card ['SK', 'S9'], current stack 1462
player [Yuchun] gets hole card ['C7', 'S7'], current stack 410
player [Zheng] gets hole card ['SJ', 'DJ'], current stack 715
player [RaphaelPlayer] gets hole card ['H5', 'D7'], current stack 3558
Started the round 32
Street "preflop" started. (community card = [])
"Finneas" declared "call:10"
"Yuchun" declared "call:10"
"Zheng" declared "call:10"
"RaphaelPlayer" declared "fold:0"
"ZifengFoldMan" declared "fold:0"
"YueShi" declared "fold:0"
Street "flop" started. (community card = ['D4', 'S3', 'CQ'])
"Finneas" declared "call:0"
"Yuchun" declared "call:0"
"Zheng" declared "call:0"
Street "turn" started. (community card = ['D4', 'S3', 'CQ', 'SQ'])
"Finneas" declared "call:0"
"Yuchun" declared "call:0"
"Zheng" declared "call:0"
Street "river" started. (community card = ['D4', 'S3', 'CQ', 'SQ', 'S8'])
"Finneas" declared "raise:731"
"Yuchun" declared "fold:0"
"Zheng" declared "fold:0"
"['Finneas']" won the round 32 (stack = {'EvanPlayer': 0, 'ZifengFoldMan': 920, 'JoyoPlayer': 0, 'YueShi': 920, 'Finneas': 1497, 'Yuchun': 400, 'Zheng': 705, 'RaphaelPlayer': 3558})
player [ZifengFoldMan] gets hole card ['D2', 'H7'], current stack 920
player [YueShi] gets hole card ['DT', 'H9'], current stack 915
player [Finneas] gets hole card ['C5', 'H8'], current stack 1487
player [Yuchun] gets hole card ['SQ', 'D6'], current stack 400
player [Zheng] gets hole card ['C9', 'CA'], current stack 705
player [RaphaelPlayer] gets hole card ['HJ', 'S9'], current stack 3558
Started the round 33
Street "preflop" started. (community card = [])
"Yuchun" declared "call:10"
"Zheng" declared "call:10"
"RaphaelPlayer" declared "call:10"
"ZifengFoldMan" declared "fold:0"
"YueShi" declared "fold:0"
"Finneas" declared "call:10"
Street "flop" started. (community card = ['CJ', 'CK', 'SJ'])
"Finneas" declared "call:0"
"Yuchun" declared "call:0"
"Zheng" declared "call:0"
"RaphaelPlayer" declared "raise:55"
"Finneas" declared "fold:0"
"Yuchun" declared "call:55"
"Zheng" declared "call:55"
Street "turn" started. (community card = ['CJ', 'CK', 'SJ', 'DA'])
"Yuchun" declared "call:0"
"Zheng" declared "call:0"
"RaphaelPlayer" declared "raise:220"
"Yuchun" declared "fold:0"
"Zheng" declared "raise:540"
"RaphaelPlayer" declared "call:540"
Street "river" started. (community card = ['CJ', 'CK', 'SJ', 'DA', 'D4'])
"Zheng" declared "call:0"
"RaphaelPlayer" declared "raise:1300"
"Zheng" declared "fold:0"
"['RaphaelPlayer']" won the round 33 (stack = {'EvanPlayer': 0, 'ZifengFoldMan': 920, 'JoyoPlayer': 0, 'YueShi': 915, 'Finneas': 1487, 'Yuchun': 335, 'Zheng': 100, 'RaphaelPlayer': 4243})
player [ZifengFoldMan] gets hole card ['SJ', 'HJ'], current stack 920
player [YueShi] gets hole card ['H5', 'CK'], current stack 915
player [Finneas] gets hole card ['CT', 'C5'], current stack 1482
player [Yuchun] gets hole card ['SQ', 'DQ'], current stack 325
player [Zheng] gets hole card ['D3', 'C4'], current stack 100
player [RaphaelPlayer] gets hole card ['H6', 'H2'], current stack 4243
Started the round 34
Street "preflop" started. (community card = [])
"Zheng" declared "call:10"
"RaphaelPlayer" declared "fold:0"
"ZifengFoldMan" declared "fold:0"
"YueShi" declared "fold:0"
"Finneas" declared "call:10"
"Yuchun" declared "call:10"
Street "flop" started. (community card = ['S3', 'H7', 'D2'])
"Finneas" declared "call:0"
"Yuchun" declared "raise:40"
"Zheng" declared "call:40"
"Finneas" declared "fold:0"
Street "turn" started. (community card = ['S3', 'H7', 'D2', 'S2'])
"Yuchun" declared "raise:285"
"Zheng" declared "fold:0"
"['Yuchun']" won the round 34 (stack = {'EvanPlayer': 0, 'ZifengFoldMan': 920, 'JoyoPlayer': 0, 'YueShi': 915, 'Finneas': 1477, 'Yuchun': 395, 'Zheng': 50, 'RaphaelPlayer': 4243})
player [ZifengFoldMan] gets hole card ['DQ', 'CK'], current stack 920
player [YueShi] gets hole card ['HJ', 'D5'], current stack 915
player [Finneas] gets hole card ['S9', 'D3'], current stack 1477
player [Yuchun] gets hole card ['C9', 'D9'], current stack 390
player [Zheng] gets hole card ['SA', 'S2'], current stack 40
player [RaphaelPlayer] gets hole card ['SQ', 'D8'], current stack 4243
Started the round 35
Street "preflop" started. (community card = [])
"RaphaelPlayer" declared "call:10"
"ZifengFoldMan" declared "fold:0"
"YueShi" declared "fold:0"
"Finneas" declared "call:10"
"Yuchun" declared "call:10"
"Zheng" declared "call:10"
Street "flop" started. (community card = ['H9', 'DJ', 'S7'])
"Yuchun" declared "raise:40"
"Zheng" declared "call:40"
"RaphaelPlayer" declared "fold:0"
"Finneas" declared "fold:0"
Street "turn" started. (community card = ['H9', 'DJ', 'S7', 'SJ'])
Street "river" started. (community card = ['H9', 'DJ', 'S7', 'SJ', 'S4'])
"['Yuchun']" won the round 35 (stack = {'EvanPlayer': 0, 'ZifengFoldMan': 920, 'JoyoPlayer': 0, 'YueShi': 915, 'Finneas': 1467, 'Yuchun': 465, 'Zheng': 0, 'RaphaelPlayer': 4233})
player [ZifengFoldMan] gets hole card ['S8', 'D4'], current stack 910
player [YueShi] gets hole card ['D5', 'SJ'], current stack 915
player [Finneas] gets hole card ['H8', 'HA'], current stack 1467
player [Yuchun] gets hole card ['CQ', 'S5'], current stack 465
player [RaphaelPlayer] gets hole card ['C5', 'D8'], current stack 4228
Started the round 36
Street "preflop" started. (community card = [])
"YueShi" declared "fold:0"
"Finneas" declared "call:10"
"Yuchun" declared "call:10"
"RaphaelPlayer" declared "fold:0"
"ZifengFoldMan" declared "fold:0"
Street "flop" started. (community card = ['CA', 'DK', 'H3'])
"Finneas" declared "call:0"
"Yuchun" declared "call:0"
Street "turn" started. (community card = ['CA', 'DK', 'H3', 'H7'])
"Finneas" declared "call:0"
"Yuchun" declared "call:0"
Street "river" started. (community card = ['CA', 'DK', 'H3', 'H7', 'DJ'])
"Finneas" declared "call:0"
"Yuchun" declared "call:0"
"['Finneas']" won the round 36 (stack = {'EvanPlayer': 0, 'ZifengFoldMan': 910, 'JoyoPlayer': 0, 'YueShi': 915, 'Finneas': 1492, 'Yuchun': 455, 'Zheng': 0, 'RaphaelPlayer': 4228})
player [ZifengFoldMan] gets hole card ['CQ', 'H9'], current stack 905
player [YueShi] gets hole card ['D6', 'S9'], current stack 905
player [Finneas] gets hole card ['SJ', 'CT'], current stack 1492
player [Yuchun] gets hole card ['C3', 'HA'], current stack 455
player [RaphaelPlayer] gets hole card ['H4', 'C8'], current stack 4228
Started the round 37
Street "preflop" started. (community card = [])
"Finneas" declared "call:10"
"Yuchun" declared "call:10"
"RaphaelPlayer" declared "fold:0"
"ZifengFoldMan" declared "fold:0"
"YueShi" declared "fold:0"
Street "flop" started. (community card = ['HT', 'H8', 'CK'])
"Finneas" declared "call:0"
"Yuchun" declared "call:0"
Street "turn" started. (community card = ['HT', 'H8', 'CK', 'SQ'])
"Finneas" declared "call:0"
"Yuchun" declared "call:0"
Street "river" started. (community card = ['HT', 'H8', 'CK', 'SQ', 'SK'])
"Finneas" declared "call:0"
"Yuchun" declared "call:0"
"['Finneas']" won the round 37 (stack = {'EvanPlayer': 0, 'ZifengFoldMan': 905, 'JoyoPlayer': 0, 'YueShi': 905, 'Finneas': 1517, 'Yuchun': 445, 'Zheng': 0, 'RaphaelPlayer': 4228})
player [ZifengFoldMan] gets hole card ['H5', 'D5'], current stack 905
player [YueShi] gets hole card ['CJ', 'HQ'], current stack 900
player [Finneas] gets hole card ['SJ', 'ST'], current stack 1507
player [Yuchun] gets hole card ['C2', 'H4'], current stack 445
player [RaphaelPlayer] gets hole card ['SA', 'S3'], current stack 4228
Started the round 38
Street "preflop" started. (community card = [])
"Yuchun" declared "call:10"
"RaphaelPlayer" declared "call:10"
"ZifengFoldMan" declared "fold:0"
"YueShi" declared "fold:0"
"Finneas" declared "call:10"
Street "flop" started. (community card = ['S5', 'C6', 'SQ'])
"Finneas" declared "call:0"
"Yuchun" declared "call:0"
"RaphaelPlayer" declared "call:0"
Street "turn" started. (community card = ['S5', 'C6', 'SQ', 'D7'])
"Finneas" declared "call:0"
"Yuchun" declared "call:0"
"RaphaelPlayer" declared "call:0"
Street "river" started. (community card = ['S5', 'C6', 'SQ', 'D7', 'H6'])
"Finneas" declared "call:0"
"Yuchun" declared "call:0"
"RaphaelPlayer" declared "call:0"
"['RaphaelPlayer']" won the round 38 (stack = {'EvanPlayer': 0, 'ZifengFoldMan': 905, 'JoyoPlayer': 0, 'YueShi': 900, 'Finneas': 1507, 'Yuchun': 435, 'Zheng': 0, 'RaphaelPlayer': 4253})
player [ZifengFoldMan] gets hole card ['C2', 'C5'], current stack 905
player [YueShi] gets hole card ['CT', 'S7'], current stack 900
player [Finneas] gets hole card ['S8', 'D9'], current stack 1502
player [Yuchun] gets hole card ['D5', 'HA'], current stack 425
player [RaphaelPlayer] gets hole card ['S6', 'C7'], current stack 4253
Started the round 39
Street "preflop" started. (community card = [])
"RaphaelPlayer" declared "fold:0"
"ZifengFoldMan" declared "fold:0"
"YueShi" declared "fold:0"
"Finneas" declared "call:10"
"Yuchun" declared "call:10"
Street "flop" started. (community card = ['CA', 'ST', 'S9'])
"Finneas" declared "call:0"
"Yuchun" declared "raise:40"
"Finneas" declared "fold:0"
"['Yuchun']" won the round 39 (stack = {'EvanPlayer': 0, 'ZifengFoldMan': 905, 'JoyoPlayer': 0, 'YueShi': 900, 'Finneas': 1497, 'Yuchun': 445, 'Zheng': 0, 'RaphaelPlayer': 4253})
player [ZifengFoldMan] gets hole card ['HA', 'D5'], current stack 905
player [YueShi] gets hole card ['D2', 'DK'], current stack 900
player [Finneas] gets hole card ['H4', 'H8'], current stack 1497
player [Yuchun] gets hole card ['H3', 'C4'], current stack 440
player [RaphaelPlayer] gets hole card ['C7', 'SQ'], current stack 4243
Started the round 40
Street "preflop" started. (community card = [])
"ZifengFoldMan" declared "fold:0"
"YueShi" declared "fold:0"
"Finneas" declared "call:10"
"Yuchun" declared "call:10"
"RaphaelPlayer" declared "call:10"
Street "flop" started. (community card = ['HK', 'SA', 'C6'])
"Yuchun" declared "call:0"
"RaphaelPlayer" declared "call:0"
"Finneas" declared "call:0"
Street "turn" started. (community card = ['HK', 'SA', 'C6', 'H9'])
"Yuchun" declared "call:0"
"RaphaelPlayer" declared "call:0"
"Finneas" declared "call:0"
Street "river" started. (community card = ['HK', 'SA', 'C6', 'H9', 'DJ'])
"Yuchun" declared "call:0"
"RaphaelPlayer" declared "call:0"
"Finneas" declared "call:0"
"['RaphaelPlayer']" won the round 40 (stack = {'EvanPlayer': 0, 'ZifengFoldMan': 905, 'JoyoPlayer': 0, 'YueShi': 900, 'Finneas': 1487, 'Yuchun': 435, 'Zheng': 0, 'RaphaelPlayer': 4273})
player [ZifengFoldMan] gets hole card ['DK', 'DQ'], current stack 895
player [YueShi] gets hole card ['C9', 'H9'], current stack 900
player [Finneas] gets hole card ['SA', 'S3'], current stack 1487
player [Yuchun] gets hole card ['C2', 'C5'], current stack 435
player [RaphaelPlayer] gets hole card ['HK', 'SK'], current stack 4268
Started the round 41
Street "preflop" started. (community card = [])
"YueShi" declared "fold:0"
"Finneas" declared "call:10"
"Yuchun" declared "fold:0"
"RaphaelPlayer" declared "raise:40"
"ZifengFoldMan" declared "fold:0"
"Finneas" declared "fold:0"
"['RaphaelPlayer']" won the round 41 (stack = {'EvanPlayer': 0, 'ZifengFoldMan': 895, 'JoyoPlayer': 0, 'YueShi': 900, 'Finneas': 1477, 'Yuchun': 435, 'Zheng': 0, 'RaphaelPlayer': 4293})
player [ZifengFoldMan] gets hole card ['CK', 'ST'], current stack 890
player [YueShi] gets hole card ['C2', 'HJ'], current stack 890
player [Finneas] gets hole card ['DQ', 'HA'], current stack 1477
player [Yuchun] gets hole card ['C4', 'H7'], current stack 435
player [RaphaelPlayer] gets hole card ['D3', 'C6'], current stack 4293
Started the round 42
Street "preflop" started. (community card = [])
"Finneas" declared "raise:746"
"Yuchun" declared "fold:0"
"RaphaelPlayer" declared "fold:0"
"ZifengFoldMan" declared "fold:0"
"YueShi" declared "fold:0"
"['Finneas']" won the round 42 (stack = {'EvanPlayer': 0, 'ZifengFoldMan': 890, 'JoyoPlayer': 0, 'YueShi': 890, 'Finneas': 1492, 'Yuchun': 435, 'Zheng': 0, 'RaphaelPlayer': 4293})
player [ZifengFoldMan] gets hole card ['S8', 'H4'], current stack 890
player [YueShi] gets hole card ['C3', 'CT'], current stack 885
player [Finneas] gets hole card ['HK', 'C9'], current stack 1482
player [Yuchun] gets hole card ['D7', 'C6'], current stack 435
player [RaphaelPlayer] gets hole card ['C7', 'H3'], current stack 4293
Started the round 43
Street "preflop" started. (community card = [])
"Yuchun" declared "fold:0"
"RaphaelPlayer" declared "fold:0"
"ZifengFoldMan" declared "fold:0"
"YueShi" declared "fold:0"
"['Finneas']" won the round 43 (stack = {'EvanPlayer': 0, 'ZifengFoldMan': 890, 'JoyoPlayer': 0, 'YueShi': 885, 'Finneas': 1497, 'Yuchun': 435, 'Zheng': 0, 'RaphaelPlayer': 4293})
player [ZifengFoldMan] gets hole card ['HK', 'H8'], current stack 890
player [YueShi] gets hole card ['H2', 'H7'], current stack 885
player [Finneas] gets hole card ['DT', 'D8'], current stack 1492
player [Yuchun] gets hole card ['H5', 'D7'], current stack 425
player [RaphaelPlayer] gets hole card ['HQ', 'S2'], current stack 4293
Started the round 44
Street "preflop" started. (community card = [])
"RaphaelPlayer" declared "fold:0"
"ZifengFoldMan" declared "fold:0"
"YueShi" declared "fold:0"
"Finneas" declared "call:10"
"Yuchun" declared "fold:0"
"['Finneas']" won the round 44 (stack = {'EvanPlayer': 0, 'ZifengFoldMan': 890, 'JoyoPlayer': 0, 'YueShi': 885, 'Finneas': 1507, 'Yuchun': 425, 'Zheng': 0, 'RaphaelPlayer': 4293})
player [ZifengFoldMan] gets hole card ['C5', 'H4'], current stack 890
player [YueShi] gets hole card ['H7', 'HK'], current stack 885
player [Finneas] gets hole card ['CJ', 'HA'], current stack 1507
player [Yuchun] gets hole card ['C8', 'ST'], current stack 420
player [RaphaelPlayer] gets hole card ['CK', 'H8'], current stack 4283
Started the round 45
Street "preflop" started. (community card = [])
"ZifengFoldMan" declared "fold:0"
"YueShi" declared "fold:0"
"Finneas" declared "call:10"
"Yuchun" declared "fold:0"
"RaphaelPlayer" declared "call:10"
Street "flop" started. (community card = ['SA', 'S2', 'SJ'])
"RaphaelPlayer" declared "call:0"
"Finneas" declared "call:0"
Street "turn" started. (community card = ['SA', 'S2', 'SJ', 'D3'])
"RaphaelPlayer" declared "call:0"
"Finneas" declared "call:0"
Street "river" started. (community card = ['SA', 'S2', 'SJ', 'D3', 'C9'])
"RaphaelPlayer" declared "call:0"
"Finneas" declared "call:0"
"['Finneas']" won the round 45 (stack = {'EvanPlayer': 0, 'ZifengFoldMan': 890, 'JoyoPlayer': 0, 'YueShi': 885, 'Finneas': 1522, 'Yuchun': 420, 'Zheng': 0, 'RaphaelPlayer': 4283})
player [ZifengFoldMan] gets hole card ['DK', 'HT'], current stack 880
player [YueShi] gets hole card ['SJ', 'HA'], current stack 885
player [Finneas] gets hole card ['DT', 'CT'], current stack 1522
player [Yuchun] gets hole card ['HQ', 'CQ'], current stack 420
player [RaphaelPlayer] gets hole card ['H9', 'SQ'], current stack 4278
Started the round 46
Street "preflop" started. (community card = [])
"YueShi" declared "fold:0"
"Finneas" declared "call:10"
"Yuchun" declared "call:10"
"RaphaelPlayer" declared "call:10"
"ZifengFoldMan" declared "fold:0"
Street "flop" started. (community card = ['C4', 'C7', 'H8'])
"RaphaelPlayer" declared "call:0"
"Finneas" declared "call:0"
"Yuchun" declared "call:0"
Street "turn" started. (community card = ['C4', 'C7', 'H8', 'C3'])
"RaphaelPlayer" declared "call:0"
"Finneas" declared "call:0"
"Yuchun" declared "call:0"
Street "river" started. (community card = ['C4', 'C7', 'H8', 'C3', 'CA'])
"RaphaelPlayer" declared "call:0"
"Finneas" declared "raise:761"
"Yuchun" declared "call:761"
"RaphaelPlayer" declared "fold:0"
"['Yuchun']" won the round 46 (stack = {'EvanPlayer': 0, 'ZifengFoldMan': 880, 'JoyoPlayer': 0, 'YueShi': 885, 'Finneas': 1102, 'Yuchun': 860, 'Zheng': 0, 'RaphaelPlayer': 4273})
player [ZifengFoldMan] gets hole card ['CQ', 'S8'], current stack 875
player [YueShi] gets hole card ['H6', 'C8'], current stack 875
player [Finneas] gets hole card ['D9', 'D7'], current stack 1102
player [Yuchun] gets hole card ['S5', 'SA'], current stack 860
player [RaphaelPlayer] gets hole card ['S7', 'C2'], current stack 4273
Started the round 47
Street "preflop" started. (community card = [])
"Finneas" declared "call:10"
"Yuchun" declared "fold:0"
"RaphaelPlayer" declared "fold:0"
"ZifengFoldMan" declared "fold:0"
"YueShi" declared "fold:0"
"['Finneas']" won the round 47 (stack = {'EvanPlayer': 0, 'ZifengFoldMan': 875, 'JoyoPlayer': 0, 'YueShi': 875, 'Finneas': 1117, 'Yuchun': 860, 'Zheng': 0, 'RaphaelPlayer': 4273})
player [ZifengFoldMan] gets hole card ['HT', 'DQ'], current stack 875
player [YueShi] gets hole card ['HK', 'SK'], current stack 870
player [Finneas] gets hole card ['D7', 'S9'], current stack 1107
player [Yuchun] gets hole card ['HA', 'H8'], current stack 860
player [RaphaelPlayer] gets hole card ['D3', 'H4'], current stack 4273
Started the round 48
Street "preflop" started. (community card = [])
"Yuchun" declared "fold:0"
"RaphaelPlayer" declared "fold:0"
"ZifengFoldMan" declared "fold:0"
"YueShi" declared "fold:0"
"['Finneas']" won the round 48 (stack = {'EvanPlayer': 0, 'ZifengFoldMan': 875, 'JoyoPlayer': 0, 'YueShi': 870, 'Finneas': 1122, 'Yuchun': 860, 'Zheng': 0, 'RaphaelPlayer': 4273})
player [ZifengFoldMan] gets hole card ['SK', 'CT'], current stack 875
player [YueShi] gets hole card ['C4', 'HQ'], current stack 870
player [Finneas] gets hole card ['H8', 'SQ'], current stack 1117
player [Yuchun] gets hole card ['C9', 'HA'], current stack 850
player [RaphaelPlayer] gets hole card ['S9', 'H3'], current stack 4273
Started the round 49
Street "preflop" started. (community card = [])
"RaphaelPlayer" declared "fold:0"
"ZifengFoldMan" declared "fold:0"
"YueShi" declared "fold:0"
"Finneas" declared "call:10"
"Yuchun" declared "call:10"
Street "flop" started. (community card = ['DA', 'C7', 'ST'])
"Finneas" declared "call:0"
"Yuchun" declared "call:0"
Street "turn" started. (community card = ['DA', 'C7', 'ST', 'HK'])
"Finneas" declared "call:0"
"Yuchun" declared "call:0"
Street "river" started. (community card = ['DA', 'C7', 'ST', 'HK', 'S5'])
"Finneas" declared "call:0"
"Yuchun" declared "call:0"
"['Yuchun']" won the round 49 (stack = {'EvanPlayer': 0, 'ZifengFoldMan': 875, 'JoyoPlayer': 0, 'YueShi': 870, 'Finneas': 1112, 'Yuchun': 870, 'Zheng': 0, 'RaphaelPlayer': 4273})
player [ZifengFoldMan] gets hole card ['SK', 'H6'], current stack 875
player [YueShi] gets hole card ['H3', 'H2'], current stack 870
player [Finneas] gets hole card ['C5', 'S3'], current stack 1112
player [Yuchun] gets hole card ['D5', 'CJ'], current stack 865
player [RaphaelPlayer] gets hole card ['H4', 'S2'], current stack 4263
Started the round 50
Street "preflop" started. (community card = [])
"ZifengFoldMan" declared "fold:0"
"YueShi" declared "fold:0"
"Finneas" declared "call:10"
"Yuchun" declared "fold:0"
"RaphaelPlayer" declared "fold:0"
"['Finneas']" won the round 50 (stack = {'EvanPlayer': 0, 'ZifengFoldMan': 875, 'JoyoPlayer': 0, 'YueShi': 870, 'Finneas': 1127, 'Yuchun': 865, 'Zheng': 0, 'RaphaelPlayer': 4263})

Game Results:
------------------------------------------------------------
Game 1:
Winner: RaphaelPlayer (stack: 4263)
All players' stacks:
  EvanPlayer: 0
  ZifengFoldMan: 875
  JoyoPlayer: 0
  YueShi: 870
  Finneas: 1127
  Yuchun: 865
  Zheng: 0
  RaphaelPlayer: 4263
------------------------------------------------------------
