player [EvanPlayer] gets hole card ['SQ', 'H5'], current stack 1000
player [ZifengFoldMan] gets hole card ['HT', 'HJ'], current stack 995
player [JoyoPlayer] gets hole card ['DK', 'HK'], current stack 990
player [YueShi] gets hole card ['C2', 'CT'], current stack 1000
player [Finneas] gets hole card ['SJ', 'S2'], current stack 1000
player [Yuchun] gets hole card ['C7', 'C8'], current stack 1000
player [Zheng] gets hole card ['S8', 'D9'], current stack 1000
player [RaphaelPlayer] gets hole card ['HA', 'C6'], current stack 1000
Started the round 1
Street "preflop" started. (community card = [])
"YueShi" declared "fold:0"
"Finneas" declared "call:10"
"Yuchun" declared "fold:0"
"Zheng" declared "call:10"
"RaphaelPlayer" declared "call:10"
"EvanPlayer" declared "call:10"
"ZifengFoldMan" declared "fold:0"
"JoyoPlayer" declared "fold:0"
Street "flop" started. (community card = ['CA', 'H3', 'SA'])
"Finneas" declared "call:0"
"Zheng" declared "call:0"
"RaphaelPlayer" declared "raise:65"
"EvanPlayer" declared "fold:65"
"Finneas" declared "fold:0"
"Zheng" declared "fold:0"
"['RaphaelPlayer']" won the round 1 (stack = {'EvanPlayer': 990, 'ZifengFoldMan': 995, 'JoyoPlayer': 990, 'YueShi': 1000, 'Finneas': 990, 'Yuchun': 1000, 'Zheng': 990, 'RaphaelPlayer': 1045})
player [EvanPlayer] gets hole card ['SQ', 'DA'], current stack 990
player [ZifengFoldMan] gets hole card ['D4', 'S8'], current stack 995
player [JoyoPlayer] gets hole card ['D9', 'CJ'], current stack 985
player [YueShi] gets hole card ['S6', 'C6'], current stack 990
player [Finneas] gets hole card ['CT', 'H7'], current stack 990
player [Yuchun] gets hole card ['DJ', 'CK'], current stack 1000
player [Zheng] gets hole card ['DK', 'SA'], current stack 990
player [RaphaelPlayer] gets hole card ['C2', 'D2'], current stack 1045
Started the round 2
Street "preflop" started. (community card = [])
"Finneas" declared "call:10"
"Yuchun" declared "fold:0"
"Zheng" declared "call:10"
"RaphaelPlayer" declared "fold:0"
"EvanPlayer" declared "raise:990"
"ZifengFoldMan" declared "fold:0"
"JoyoPlayer" declared "fold:0"
"YueShi" declared "fold:0"
"Finneas" declared "fold:0"
"Zheng" declared "fold:0"
"['EvanPlayer']" won the round 2 (stack = {'EvanPlayer': 1025, 'ZifengFoldMan': 995, 'JoyoPlayer': 985, 'YueShi': 990, 'Finneas': 980, 'Yuchun': 1000, 'Zheng': 980, 'RaphaelPlayer': 1045})
player [EvanPlayer] gets hole card ['C2', 'S2'], current stack 1025
player [ZifengFoldMan] gets hole card ['DK', 'D9'], current stack 995
player [JoyoPlayer] gets hole card ['S5', 'C7'], current stack 985
player [YueShi] gets hole card ['H5', 'HQ'], current stack 985
player [Finneas] gets hole card ['SA', 'S6'], current stack 970
player [Yuchun] gets hole card ['S7', 'DJ'], current stack 1000
player [Zheng] gets hole card ['CK', 'D3'], current stack 980
player [RaphaelPlayer] gets hole card ['CJ', 'HT'], current stack 1045
Started the round 3
Street "preflop" started. (community card = [])
"Yuchun" declared "fold:0"
"Zheng" declared "call:10"
"RaphaelPlayer" declared "call:10"
"EvanPlayer" declared "raise:1025"
"ZifengFoldMan" declared "fold:0"
"JoyoPlayer" declared "fold:0"
"YueShi" declared "fold:0"
"Finneas" declared "fold:0"
"Zheng" declared "fold:0"
"RaphaelPlayer" declared "fold:0"
"['EvanPlayer']" won the round 3 (stack = {'EvanPlayer': 1060, 'ZifengFoldMan': 995, 'JoyoPlayer': 985, 'YueShi': 985, 'Finneas': 970, 'Yuchun': 1000, 'Zheng': 970, 'RaphaelPlayer': 1035})
player [EvanPlayer] gets hole card ['C9', 'S5'], current stack 1060
player [ZifengFoldMan] gets hole card ['C6', 'H8'], current stack 995
player [JoyoPlayer] gets hole card ['ST', 'D4'], current stack 985
player [YueShi] gets hole card ['DT', 'D8'], current stack 985
player [Finneas] gets hole card ['H5', 'CT'], current stack 965
player [Yuchun] gets hole card ['H3', 'HJ'], current stack 990
player [Zheng] gets hole card ['CQ', 'HT'], current stack 970
player [RaphaelPlayer] gets hole card ['SK', 'H2'], current stack 1035
Started the round 4
Street "preflop" started. (community card = [])
"Zheng" declared "call:10"
"RaphaelPlayer" declared "fold:0"
"EvanPlayer" declared "raise:1060"
"ZifengFoldMan" declared "fold:0"
"JoyoPlayer" declared "fold:0"
"YueShi" declared "fold:0"
"Finneas" declared "fold:0"
"Yuchun" declared "fold:0"
"Zheng" declared "fold:0"
"['EvanPlayer']" won the round 4 (stack = {'EvanPlayer': 1085, 'ZifengFoldMan': 995, 'JoyoPlayer': 985, 'YueShi': 985, 'Finneas': 965, 'Yuchun': 990, 'Zheng': 960, 'RaphaelPlayer': 1035})
player [EvanPlayer] gets hole card ['HJ', 'C9'], current stack 1085
player [ZifengFoldMan] gets hole card ['S5', 'SJ'], current stack 995
player [JoyoPlayer] gets hole card ['DJ', 'S6'], current stack 985
player [YueShi] gets hole card ['SA', 'S9'], current stack 985
player [Finneas] gets hole card ['ST', 'S4'], current stack 965
player [Yuchun] gets hole card ['D9', 'C6'], current stack 985
player [Zheng] gets hole card ['HK', 'CA'], current stack 950
player [RaphaelPlayer] gets hole card ['C3', 'DT'], current stack 1035
Started the round 5
Street "preflop" started. (community card = [])
"RaphaelPlayer" declared "fold:0"
"EvanPlayer" declared "raise:1085"
"ZifengFoldMan" declared "fold:0"
"JoyoPlayer" declared "fold:0"
"YueShi" declared "fold:0"
"Finneas" declared "fold:0"
"Yuchun" declared "fold:0"
"Zheng" declared "fold:0"
"['EvanPlayer']" won the round 5 (stack = {'EvanPlayer': 1100, 'ZifengFoldMan': 995, 'JoyoPlayer': 985, 'YueShi': 985, 'Finneas': 965, 'Yuchun': 985, 'Zheng': 950, 'RaphaelPlayer': 1035})
player [EvanPlayer] gets hole card ['D8', 'H7'], current stack 1100
player [ZifengFoldMan] gets hole card ['SK', 'S9'], current stack 995
player [JoyoPlayer] gets hole card ['CJ', 'HT'], current stack 985
player [YueShi] gets hole card ['H6', 'S8'], current stack 985
player [Finneas] gets hole card ['DJ', 'C7'], current stack 965
player [Yuchun] gets hole card ['D3', 'DT'], current stack 985
player [Zheng] gets hole card ['S7', 'D6'], current stack 945
player [RaphaelPlayer] gets hole card ['C6', 'S3'], current stack 1025
Started the round 6
Street "preflop" started. (community card = [])
"EvanPlayer" declared "raise:1100"
"ZifengFoldMan" declared "fold:0"
"JoyoPlayer" declared "fold:0"
"YueShi" declared "fold:0"
"Finneas" declared "fold:0"
"Yuchun" declared "fold:0"
"Zheng" declared "fold:0"
"RaphaelPlayer" declared "fold:0"
"['EvanPlayer']" won the round 6 (stack = {'EvanPlayer': 1115, 'ZifengFoldMan': 995, 'JoyoPlayer': 985, 'YueShi': 985, 'Finneas': 965, 'Yuchun': 985, 'Zheng': 945, 'RaphaelPlayer': 1025})
player [EvanPlayer] gets hole card ['DQ', 'D8'], current stack 1105
player [ZifengFoldMan] gets hole card ['D2', 'S2'], current stack 995
player [JoyoPlayer] gets hole card ['H9', 'CQ'], current stack 985
player [YueShi] gets hole card ['H3', 'S6'], current stack 985
player [Finneas] gets hole card ['S3', 'S7'], current stack 965
player [Yuchun] gets hole card ['C3', 'C4'], current stack 985
player [Zheng] gets hole card ['CJ', 'HJ'], current stack 945
player [RaphaelPlayer] gets hole card ['HT', 'HK'], current stack 1020
Started the round 7
Street "preflop" started. (community card = [])
"ZifengFoldMan" declared "fold:0"
"JoyoPlayer" declared "raise:15"
"YueShi" declared "fold:0"
"Finneas" declared "call:15"
"Yuchun" declared "fold:0"
"Zheng" declared "call:15"
"RaphaelPlayer" declared "call:15"
"EvanPlayer" declared "raise:1115"
"JoyoPlayer" declared "fold:0"
"Finneas" declared "fold:0"
"Zheng" declared "fold:0"
"RaphaelPlayer" declared "fold:0"
"['EvanPlayer']" won the round 7 (stack = {'EvanPlayer': 1175, 'ZifengFoldMan': 995, 'JoyoPlayer': 970, 'YueShi': 985, 'Finneas': 950, 'Yuchun': 985, 'Zheng': 930, 'RaphaelPlayer': 1010})
player [EvanPlayer] gets hole card ['S4', 'CA'], current stack 1170
player [ZifengFoldMan] gets hole card ['H5', 'H7'], current stack 985
player [JoyoPlayer] gets hole card ['D4', 'DQ'], current stack 970
player [YueShi] gets hole card ['D8', 'D6'], current stack 985
player [Finneas] gets hole card ['C2', 'H9'], current stack 950
player [Yuchun] gets hole card ['C5', 'S6'], current stack 985
player [Zheng] gets hole card ['CJ', 'S8'], current stack 930
player [RaphaelPlayer] gets hole card ['C4', 'S2'], current stack 1010
Started the round 8
Street "preflop" started. (community card = [])
"JoyoPlayer" declared "raise:15"
"YueShi" declared "fold:0"
"Finneas" declared "call:15"
"Yuchun" declared "fold:0"
"Zheng" declared "call:15"
"RaphaelPlayer" declared "fold:0"
"EvanPlayer" declared "raise:1175"
"ZifengFoldMan" declared "fold:0"
"JoyoPlayer" declared "fold:0"
"Finneas" declared "fold:0"
"Zheng" declared "fold:0"
"['EvanPlayer']" won the round 8 (stack = {'EvanPlayer': 1230, 'ZifengFoldMan': 985, 'JoyoPlayer': 955, 'YueShi': 985, 'Finneas': 935, 'Yuchun': 985, 'Zheng': 915, 'RaphaelPlayer': 1010})
player [EvanPlayer] gets hole card ['DK', 'S9'], current stack 1230
player [ZifengFoldMan] gets hole card ['S2', 'S6'], current stack 980
player [JoyoPlayer] gets hole card ['S3', 'D4'], current stack 945
player [YueShi] gets hole card ['H4', 'D7'], current stack 985
player [Finneas] gets hole card ['D6', 'H3'], current stack 935
player [Yuchun] gets hole card ['ST', 'D5'], current stack 985
player [Zheng] gets hole card ['S7', 'HT'], current stack 915
player [RaphaelPlayer] gets hole card ['HJ', 'CJ'], current stack 1010
Started the round 9
Street "preflop" started. (community card = [])
"YueShi" declared "fold:0"
"Finneas" declared "call:10"
"Yuchun" declared "fold:0"
"Zheng" declared "call:10"
"RaphaelPlayer" declared "raise:40"
"EvanPlayer" declared "call:40"
"ZifengFoldMan" declared "fold:0"
"JoyoPlayer" declared "raise:70"
"Finneas" declared "fold:0"
"Zheng" declared "fold:0"
"RaphaelPlayer" declared "call:70"
"EvanPlayer" declared "fold:70"
Street "flop" started. (community card = ['S8', 'SK', 'H2'])
"JoyoPlayer" declared "fold:0"
"['RaphaelPlayer']" won the round 9 (stack = {'EvanPlayer': 1190, 'ZifengFoldMan': 980, 'JoyoPlayer': 885, 'YueShi': 985, 'Finneas': 925, 'Yuchun': 985, 'Zheng': 905, 'RaphaelPlayer': 1145})
player [EvanPlayer] gets hole card ['D2', 'D9'], current stack 1190
player [ZifengFoldMan] gets hole card ['C5', 'CT'], current stack 980
player [JoyoPlayer] gets hole card ['S5', 'H9'], current stack 880
player [YueShi] gets hole card ['S3', 'ST'], current stack 975
player [Finneas] gets hole card ['HK', 'H8'], current stack 925
player [Yuchun] gets hole card ['DK', 'SQ'], current stack 985
player [Zheng] gets hole card ['D4', 'C3'], current stack 905
player [RaphaelPlayer] gets hole card ['DA', 'SA'], current stack 1145
Started the round 10
Street "preflop" started. (community card = [])
"Finneas" declared "call:10"
"Yuchun" declared "call:10"
"Zheng" declared "call:10"
"RaphaelPlayer" declared "raise:40"
"EvanPlayer" declared "raise:1190"
"ZifengFoldMan" declared "fold:0"
"JoyoPlayer" declared "fold:0"
"YueShi" declared "fold:0"
"Finneas" declared "fold:0"
"Yuchun" declared "fold:0"
"Zheng" declared "fold:0"
"RaphaelPlayer" declared "fold:0"
"['EvanPlayer']" won the round 10 (stack = {'EvanPlayer': 1275, 'ZifengFoldMan': 980, 'JoyoPlayer': 880, 'YueShi': 975, 'Finneas': 915, 'Yuchun': 975, 'Zheng': 895, 'RaphaelPlayer': 1105})
player [EvanPlayer] gets hole card ['SJ', 'D9'], current stack 1275
player [ZifengFoldMan] gets hole card ['H6', 'CJ'], current stack 980
player [JoyoPlayer] gets hole card ['C7', 'C9'], current stack 880
player [YueShi] gets hole card ['HK', 'H9'], current stack 970
player [Finneas] gets hole card ['HJ', 'C4'], current stack 905
player [Yuchun] gets hole card ['S9', 'C5'], current stack 975
player [Zheng] gets hole card ['CQ', 'S5'], current stack 895
player [RaphaelPlayer] gets hole card ['H2', 'C3'], current stack 1105
Started the round 11
Street "preflop" started. (community card = [])
"Yuchun" declared "call:10"
"Zheng" declared "call:10"
"RaphaelPlayer" declared "fold:0"
"EvanPlayer" declared "raise:1275"
"ZifengFoldMan" declared "fold:0"
"JoyoPlayer" declared "fold:0"
"YueShi" declared "fold:0"
"Finneas" declared "fold:0"
"Yuchun" declared "fold:0"
"Zheng" declared "fold:0"
"['EvanPlayer']" won the round 11 (stack = {'EvanPlayer': 1310, 'ZifengFoldMan': 980, 'JoyoPlayer': 880, 'YueShi': 970, 'Finneas': 905, 'Yuchun': 965, 'Zheng': 885, 'RaphaelPlayer': 1105})
player [EvanPlayer] gets hole card ['S2', 'H7'], current stack 1310
player [ZifengFoldMan] gets hole card ['SQ', 'D4'], current stack 980
player [JoyoPlayer] gets hole card ['D5', 'C2'], current stack 880
player [YueShi] gets hole card ['D2', 'CA'], current stack 970
player [Finneas] gets hole card ['C3', 'D3'], current stack 900
player [Yuchun] gets hole card ['HA', 'H4'], current stack 955
player [Zheng] gets hole card ['S4', 'D8'], current stack 885
player [RaphaelPlayer] gets hole card ['SK', 'C4'], current stack 1105
Started the round 12
Street "preflop" started. (community card = [])
"Zheng" declared "call:10"
"RaphaelPlayer" declared "fold:0"
"EvanPlayer" declared "call:10"
"ZifengFoldMan" declared "fold:0"
"JoyoPlayer" declared "fold:0"
"YueShi" declared "fold:0"
"Finneas" declared "call:10"
"Yuchun" declared "call:10"
Street "flop" started. (community card = ['C6', 'H2', 'HJ'])
"Finneas" declared "call:0"
"Yuchun" declared "call:0"
"Zheng" declared "call:0"
"EvanPlayer" declared "fold:0"
Street "turn" started. (community card = ['C6', 'H2', 'HJ', 'C5'])
"Finneas" declared "call:0"
"Yuchun" declared "call:0"
"Zheng" declared "call:0"
Street "river" started. (community card = ['C6', 'H2', 'HJ', 'C5', 'SA'])
"Finneas" declared "call:0"
"Yuchun" declared "call:0"
"Zheng" declared "call:0"
"['Yuchun']" won the round 12 (stack = {'EvanPlayer': 1300, 'ZifengFoldMan': 980, 'JoyoPlayer': 880, 'YueShi': 970, 'Finneas': 895, 'Yuchun': 995, 'Zheng': 875, 'RaphaelPlayer': 1105})
player [EvanPlayer] gets hole card ['S8', 'D7'], current stack 1300
player [ZifengFoldMan] gets hole card ['C3', 'DQ'], current stack 980
player [JoyoPlayer] gets hole card ['SJ', 'C6'], current stack 880
player [YueShi] gets hole card ['HT', 'DA'], current stack 970
player [Finneas] gets hole card ['HJ', 'C7'], current stack 895
player [Yuchun] gets hole card ['DT', 'CQ'], current stack 990
player [Zheng] gets hole card ['SQ', 'HK'], current stack 865
player [RaphaelPlayer] gets hole card ['S2', 'S3'], current stack 1105
Started the round 13
Street "preflop" started. (community card = [])
"RaphaelPlayer" declared "fold:0"
"EvanPlayer" declared "raise:1300"
"ZifengFoldMan" declared "fold:0"
"JoyoPlayer" declared "fold:0"
"YueShi" declared "fold:0"
"Finneas" declared "fold:0"
"Yuchun" declared "fold:0"
"Zheng" declared "fold:0"
"['EvanPlayer']" won the round 13 (stack = {'EvanPlayer': 1315, 'ZifengFoldMan': 980, 'JoyoPlayer': 880, 'YueShi': 970, 'Finneas': 895, 'Yuchun': 990, 'Zheng': 865, 'RaphaelPlayer': 1105})
player [EvanPlayer] gets hole card ['C9', 'HT'], current stack 1315
player [ZifengFoldMan] gets hole card ['C8', 'HJ'], current stack 980
player [JoyoPlayer] gets hole card ['S6', 'DJ'], current stack 880
player [YueShi] gets hole card ['S9', 'DT'], current stack 970
player [Finneas] gets hole card ['D3', 'HA'], current stack 895
player [Yuchun] gets hole card ['S5', 'DA'], current stack 990
player [Zheng] gets hole card ['H7', 'CT'], current stack 860
player [RaphaelPlayer] gets hole card ['DK', 'D2'], current stack 1095
Started the round 14
Street "preflop" started. (community card = [])
"EvanPlayer" declared "raise:1315"
"ZifengFoldMan" declared "fold:0"
"JoyoPlayer" declared "fold:0"
"YueShi" declared "fold:0"
"Finneas" declared "fold:0"
"Yuchun" declared "fold:0"
"Zheng" declared "fold:0"
"RaphaelPlayer" declared "fold:0"
"['EvanPlayer']" won the round 14 (stack = {'EvanPlayer': 1330, 'ZifengFoldMan': 980, 'JoyoPlayer': 880, 'YueShi': 970, 'Finneas': 895, 'Yuchun': 990, 'Zheng': 860, 'RaphaelPlayer': 1095})
player [EvanPlayer] gets hole card ['CQ', 'ST'], current stack 1320
player [ZifengFoldMan] gets hole card ['CJ', 'HK'], current stack 980
player [JoyoPlayer] gets hole card ['SA', 'H9'], current stack 880
player [YueShi] gets hole card ['S6', 'SJ'], current stack 970
player [Finneas] gets hole card ['C5', 'C7'], current stack 895
player [Yuchun] gets hole card ['DT', 'C3'], current stack 990
player [Zheng] gets hole card ['D4', 'HJ'], current stack 860
player [RaphaelPlayer] gets hole card ['D9', 'H4'], current stack 1090
Started the round 15
Street "preflop" started. (community card = [])
"ZifengFoldMan" declared "fold:0"
"JoyoPlayer" declared "raise:15"
"YueShi" declared "fold:0"
"Finneas" declared "call:15"
"Yuchun" declared "call:15"
"Zheng" declared "call:15"
"RaphaelPlayer" declared "fold:0"
"EvanPlayer" declared "call:15"
Street "flop" started. (community card = ['CT', 'C8', 'SQ'])
"EvanPlayer" declared "raise:1315"
"JoyoPlayer" declared "fold:0"
"Finneas" declared "fold:0"
"Yuchun" declared "fold:0"
"Zheng" declared "fold:0"
"['EvanPlayer']" won the round 15 (stack = {'EvanPlayer': 1395, 'ZifengFoldMan': 980, 'JoyoPlayer': 865, 'YueShi': 970, 'Finneas': 880, 'Yuchun': 975, 'Zheng': 845, 'RaphaelPlayer': 1090})
player [EvanPlayer] gets hole card ['H6', 'D3'], current stack 1390
player [ZifengFoldMan] gets hole card ['S5', 'D8'], current stack 970
player [JoyoPlayer] gets hole card ['D4', 'ST'], current stack 865
player [YueShi] gets hole card ['C9', 'H5'], current stack 970
player [Finneas] gets hole card ['S4', 'HQ'], current stack 880
player [Yuchun] gets hole card ['HT', 'S3'], current stack 975
player [Zheng] gets hole card ['H3', 'S6'], current stack 845
player [RaphaelPlayer] gets hole card ['H2', 'D9'], current stack 1090
Started the round 16
Street "preflop" started. (community card = [])
"JoyoPlayer" declared "fold:0"
"YueShi" declared "fold:0"
"Finneas" declared "call:10"
"Yuchun" declared "call:10"
"Zheng" declared "call:10"
"RaphaelPlayer" declared "fold:0"
"EvanPlayer" declared "fold:10"
"ZifengFoldMan" declared "fold:0"
Street "flop" started. (community card = ['D6', 'CT', 'SK'])
"Finneas" declared "call:0"
"Yuchun" declared "call:0"
"Zheng" declared "call:0"
Street "turn" started. (community card = ['D6', 'CT', 'SK', 'C7'])
"Finneas" declared "call:0"
"Yuchun" declared "call:0"
"Zheng" declared "call:0"
Street "river" started. (community card = ['D6', 'CT', 'SK', 'C7', 'S8'])
"Finneas" declared "call:0"
"Yuchun" declared "call:0"
"Zheng" declared "call:0"
"['Yuchun']" won the round 16 (stack = {'EvanPlayer': 1390, 'ZifengFoldMan': 970, 'JoyoPlayer': 865, 'YueShi': 970, 'Finneas': 870, 'Yuchun': 1010, 'Zheng': 835, 'RaphaelPlayer': 1090})
player [EvanPlayer] gets hole card ['DK', 'D7'], current stack 1390
player [ZifengFoldMan] gets hole card ['DQ', 'C3'], current stack 965
player [JoyoPlayer] gets hole card ['H8', 'DJ'], current stack 855
player [YueShi] gets hole card ['C6', 'HA'], current stack 970
player [Finneas] gets hole card ['HK', 'S3'], current stack 870
player [Yuchun] gets hole card ['CK', 'S4'], current stack 1010
player [Zheng] gets hole card ['H9', 'H3'], current stack 835
player [RaphaelPlayer] gets hole card ['S5', 'SQ'], current stack 1090
Started the round 17
Street "preflop" started. (community card = [])
"YueShi" declared "fold:0"
"Finneas" declared "call:10"
"Yuchun" declared "call:10"
"Zheng" declared "call:10"
"RaphaelPlayer" declared "call:10"
"EvanPlayer" declared "call:10"
"ZifengFoldMan" declared "fold:0"
"JoyoPlayer" declared "fold:0"
Street "flop" started. (community card = ['D4', 'C5', 'CT'])
"Finneas" declared "call:0"
"Yuchun" declared "call:0"
"Zheng" declared "call:0"
"RaphaelPlayer" declared "call:0"
"EvanPlayer" declared "fold:0"
Street "turn" started. (community card = ['D4', 'C5', 'CT', 'S7'])
"Finneas" declared "call:0"
"Yuchun" declared "call:0"
"Zheng" declared "call:0"
"RaphaelPlayer" declared "call:0"
Street "river" started. (community card = ['D4', 'C5', 'CT', 'S7', 'D5'])
"Finneas" declared "call:0"
"Yuchun" declared "call:0"
"Zheng" declared "call:0"
"RaphaelPlayer" declared "raise:75"
"Finneas" declared "fold:0"
"Yuchun" declared "call:75"
"Zheng" declared "fold:0"
"['RaphaelPlayer']" won the round 17 (stack = {'EvanPlayer': 1380, 'ZifengFoldMan': 965, 'JoyoPlayer': 855, 'YueShi': 970, 'Finneas': 860, 'Yuchun': 925, 'Zheng': 825, 'RaphaelPlayer': 1220})
player [EvanPlayer] gets hole card ['D9', 'HK'], current stack 1380
player [ZifengFoldMan] gets hole card ['DJ', 'C9'], current stack 965
player [JoyoPlayer] gets hole card ['H6', 'S3'], current stack 850
player [YueShi] gets hole card ['CQ', 'S2'], current stack 960
player [Finneas] gets hole card ['CT', 'C7'], current stack 860
player [Yuchun] gets hole card ['S6', 'CK'], current stack 925
player [Zheng] gets hole card ['SA', 'HA'], current stack 825
player [RaphaelPlayer] gets hole card ['SQ', 'H8'], current stack 1220
Started the round 18
Street "preflop" started. (community card = [])
"Finneas" declared "call:10"
"Yuchun" declared "call:10"
"Zheng" declared "call:10"
"RaphaelPlayer" declared "call:10"
"EvanPlayer" declared "raise:1380"
"ZifengFoldMan" declared "fold:0"
"JoyoPlayer" declared "fold:0"
"YueShi" declared "fold:0"
"Finneas" declared "fold:0"
"Yuchun" declared "fold:0"
"Zheng" declared "fold:0"
"RaphaelPlayer" declared "fold:0"
"['EvanPlayer']" won the round 18 (stack = {'EvanPlayer': 1435, 'ZifengFoldMan': 965, 'JoyoPlayer': 850, 'YueShi': 960, 'Finneas': 850, 'Yuchun': 915, 'Zheng': 815, 'RaphaelPlayer': 1210})
player [EvanPlayer] gets hole card ['D9', 'S2'], current stack 1435
player [ZifengFoldMan] gets hole card ['DT', 'C6'], current stack 965
player [JoyoPlayer] gets hole card ['SK', 'H9'], current stack 850
player [YueShi] gets hole card ['D6', 'CK'], current stack 955
player [Finneas] gets hole card ['S6', 'H7'], current stack 840
player [Yuchun] gets hole card ['D3', 'SJ'], current stack 915
player [Zheng] gets hole card ['H3', 'H6'], current stack 815
player [RaphaelPlayer] gets hole card ['H8', 'CA'], current stack 1210
Started the round 19
Street "preflop" started. (community card = [])
"Yuchun" declared "call:10"
"Zheng" declared "call:10"
"RaphaelPlayer" declared "call:10"
"EvanPlayer" declared "call:10"
"ZifengFoldMan" declared "fold:0"
"JoyoPlayer" declared "raise:15"
"YueShi" declared "fold:0"
"Finneas" declared "call:15"
"Yuchun" declared "call:15"
"Zheng" declared "call:15"
"RaphaelPlayer" declared "raise:45"
"EvanPlayer" declared "raise:1435"
"JoyoPlayer" declared "fold:0"
"Finneas" declared "fold:0"
"Yuchun" declared "fold:0"
"Zheng" declared "fold:0"
"RaphaelPlayer" declared "fold:0"
"['EvanPlayer']" won the round 19 (stack = {'EvanPlayer': 1545, 'ZifengFoldMan': 965, 'JoyoPlayer': 835, 'YueShi': 955, 'Finneas': 835, 'Yuchun': 900, 'Zheng': 800, 'RaphaelPlayer': 1165})
player [EvanPlayer] gets hole card ['D9', 'DT'], current stack 1545
player [ZifengFoldMan] gets hole card ['CK', 'CQ'], current stack 965
player [JoyoPlayer] gets hole card ['SA', 'HT'], current stack 835
player [YueShi] gets hole card ['H3', 'S2'], current stack 955
player [Finneas] gets hole card ['S8', 'S6'], current stack 830
player [Yuchun] gets hole card ['D3', 'C9'], current stack 890
player [Zheng] gets hole card ['S9', 'HQ'], current stack 800
player [RaphaelPlayer] gets hole card ['HK', 'H5'], current stack 1165
Started the round 20
Street "preflop" started. (community card = [])
"Zheng" declared "call:10"
"RaphaelPlayer" declared "call:10"
"EvanPlayer" declared "raise:1545"
"ZifengFoldMan" declared "fold:0"
"JoyoPlayer" declared "call:1545"
"YueShi" declared "fold:0"
"Finneas" declared "fold:0"
"Yuchun" declared "fold:0"
"Zheng" declared "fold:0"
"RaphaelPlayer" declared "fold:0"
Street "flop" started. (community card = ['D4', 'SQ', 'S5'])
Street "turn" started. (community card = ['D4', 'SQ', 'S5', 'D2'])
Street "river" started. (community card = ['D4', 'SQ', 'S5', 'D2', 'CJ'])
"['JoyoPlayer']" won the round 20 (stack = {'EvanPlayer': 710, 'ZifengFoldMan': 965, 'JoyoPlayer': 1705, 'YueShi': 955, 'Finneas': 830, 'Yuchun': 890, 'Zheng': 790, 'RaphaelPlayer': 1155})
player [EvanPlayer] gets hole card ['C6', 'D7'], current stack 710
player [ZifengFoldMan] gets hole card ['S6', 'S5'], current stack 965
player [JoyoPlayer] gets hole card ['H2', 'HT'], current stack 1705
player [YueShi] gets hole card ['SQ', 'H4'], current stack 955
player [Finneas] gets hole card ['HJ', 'S3'], current stack 830
player [Yuchun] gets hole card ['DT', 'S7'], current stack 885
player [Zheng] gets hole card ['D5', 'D6'], current stack 780
player [RaphaelPlayer] gets hole card ['H9', 'CK'], current stack 1155
Started the round 21
Street "preflop" started. (community card = [])
"RaphaelPlayer" declared "call:10"
"EvanPlayer" declared "raise:710"
"ZifengFoldMan" declared "fold:0"
"JoyoPlayer" declared "raise:1410"
"YueShi" declared "fold:0"
"Finneas" declared "fold:0"
"Yuchun" declared "fold:0"
"Zheng" declared "fold:0"
"RaphaelPlayer" declared "fold:0"
Street "flop" started. (community card = ['C7', 'CJ', 'H7'])
Street "turn" started. (community card = ['C7', 'CJ', 'H7', 'SK'])
Street "river" started. (community card = ['C7', 'CJ', 'H7', 'SK', 'D2'])
"['EvanPlayer']" won the round 21 (stack = {'EvanPlayer': 1445, 'ZifengFoldMan': 965, 'JoyoPlayer': 995, 'YueShi': 955, 'Finneas': 830, 'Yuchun': 885, 'Zheng': 780, 'RaphaelPlayer': 1145})
player [EvanPlayer] gets hole card ['H2', 'DQ'], current stack 1445
player [ZifengFoldMan] gets hole card ['CJ', 'H4'], current stack 965
player [JoyoPlayer] gets hole card ['D6', 'C3'], current stack 995
player [YueShi] gets hole card ['CA', 'D8'], current stack 955
player [Finneas] gets hole card ['S4', 'C6'], current stack 830
player [Yuchun] gets hole card ['H8', 'H6'], current stack 885
player [Zheng] gets hole card ['SK', 'CT'], current stack 775
player [RaphaelPlayer] gets hole card ['S3', 'C7'], current stack 1135
Started the round 22
Street "preflop" started. (community card = [])
"EvanPlayer" declared "call:10"
"ZifengFoldMan" declared "fold:0"
"JoyoPlayer" declared "raise:15"
"YueShi" declared "fold:0"
"Finneas" declared "call:15"
"Yuchun" declared "call:15"
"Zheng" declared "call:15"
"RaphaelPlayer" declared "fold:0"
"EvanPlayer" declared "fold:15"
Street "flop" started. (community card = ['HT', 'S8', 'C9'])
"Zheng" declared "call:0"
"JoyoPlayer" declared "raise:10"
"Finneas" declared "call:10"
"Yuchun" declared "call:10"
"Zheng" declared "call:10"
Street "turn" started. (community card = ['HT', 'S8', 'C9', 'C2'])
"Zheng" declared "call:0"
"JoyoPlayer" declared "fold:0"
"Finneas" declared "call:0"
"Yuchun" declared "call:0"
Street "river" started. (community card = ['HT', 'S8', 'C9', 'C2', 'DK'])
"Zheng" declared "raise:755"
"Finneas" declared "fold:0"
"Yuchun" declared "fold:0"
"['Zheng']" won the round 22 (stack = {'EvanPlayer': 1435, 'ZifengFoldMan': 965, 'JoyoPlayer': 970, 'YueShi': 955, 'Finneas': 805, 'Yuchun': 860, 'Zheng': 875, 'RaphaelPlayer': 1135})
player [EvanPlayer] gets hole card ['DQ', 'D4'], current stack 1425
player [ZifengFoldMan] gets hole card ['S9', 'HT'], current stack 965
player [JoyoPlayer] gets hole card ['D3', 'HJ'], current stack 970
player [YueShi] gets hole card ['CQ', 'SQ'], current stack 955
player [Finneas] gets hole card ['DK', 'HA'], current stack 805
player [Yuchun] gets hole card ['H4', 'S4'], current stack 860
player [Zheng] gets hole card ['D8', 'S3'], current stack 875
player [RaphaelPlayer] gets hole card ['S8', 'C5'], current stack 1130
Started the round 23
Street "preflop" started. (community card = [])
"ZifengFoldMan" declared "fold:0"
"JoyoPlayer" declared "raise:15"
"YueShi" declared "fold:0"
"Finneas" declared "raise:412"
"Yuchun" declared "fold:0"
"Zheng" declared "fold:0"
"RaphaelPlayer" declared "fold:0"
"EvanPlayer" declared "fold:412"
"JoyoPlayer" declared "fold:0"
"['Finneas']" won the round 23 (stack = {'EvanPlayer': 1425, 'ZifengFoldMan': 965, 'JoyoPlayer': 955, 'YueShi': 955, 'Finneas': 835, 'Yuchun': 860, 'Zheng': 875, 'RaphaelPlayer': 1130})
player [EvanPlayer] gets hole card ['D4', 'CJ'], current stack 1420
player [ZifengFoldMan] gets hole card ['D3', 'S4'], current stack 955
player [JoyoPlayer] gets hole card ['D2', 'S5'], current stack 955
player [YueShi] gets hole card ['DK', 'H4'], current stack 955
player [Finneas] gets hole card ['CA', 'H6'], current stack 835
player [Yuchun] gets hole card ['C9', 'H8'], current stack 860
player [Zheng] gets hole card ['C7', 'S7'], current stack 875
player [RaphaelPlayer] gets hole card ['S9', 'H9'], current stack 1130
Started the round 24
Street "preflop" started. (community card = [])
"JoyoPlayer" declared "fold:0"
"YueShi" declared "fold:0"
"Finneas" declared "call:10"
"Yuchun" declared "call:10"
"Zheng" declared "call:10"
"RaphaelPlayer" declared "raise:30"
"EvanPlayer" declared "fold:30"
"ZifengFoldMan" declared "fold:0"
"Finneas" declared "fold:0"
"Yuchun" declared "call:30"
"Zheng" declared "call:30"
Street "flop" started. (community card = ['D5', 'SQ', 'CQ'])
"Yuchun" declared "call:0"
"Zheng" declared "call:0"
"RaphaelPlayer" declared "raise:125"
"Yuchun" declared "fold:0"
"Zheng" declared "raise:547"
"RaphaelPlayer" declared "call:547"
Street "turn" started. (community card = ['D5', 'SQ', 'CQ', 'H2'])
"Zheng" declared "raise:154"
"RaphaelPlayer" declared "raise:553"
"Zheng" declared "call:553"
Street "river" started. (community card = ['D5', 'SQ', 'CQ', 'H2', 'CT'])
"['RaphaelPlayer']" won the round 24 (stack = {'EvanPlayer': 1420, 'ZifengFoldMan': 955, 'JoyoPlayer': 955, 'YueShi': 955, 'Finneas': 825, 'Yuchun': 830, 'Zheng': 0, 'RaphaelPlayer': 2060})
player [EvanPlayer] gets hole card ['C4', 'S5'], current stack 1420
player [ZifengFoldMan] gets hole card ['D7', 'D3'], current stack 950
player [JoyoPlayer] gets hole card ['DA', 'HK'], current stack 945
player [YueShi] gets hole card ['CK', 'H2'], current stack 955
player [Finneas] gets hole card ['H3', 'CT'], current stack 825
player [Yuchun] gets hole card ['SK', 'CA'], current stack 830
player [RaphaelPlayer] gets hole card ['CQ', 'SJ'], current stack 2060
Started the round 25
Street "preflop" started. (community card = [])
"YueShi" declared "fold:0"
"Finneas" declared "call:10"
"Yuchun" declared "call:10"
"RaphaelPlayer" declared "call:10"
"EvanPlayer" declared "raise:1420"
"ZifengFoldMan" declared "fold:0"
"JoyoPlayer" declared "call:1420"
"Finneas" declared "fold:0"
"Yuchun" declared "fold:0"
"RaphaelPlayer" declared "fold:0"
Street "flop" started. (community card = ['DK', 'HQ', 'SQ'])
Street "turn" started. (community card = ['DK', 'HQ', 'SQ', 'ST'])
Street "river" started. (community card = ['DK', 'HQ', 'SQ', 'ST', 'C3'])
"['JoyoPlayer']" won the round 25 (stack = {'EvanPlayer': 465, 'ZifengFoldMan': 950, 'JoyoPlayer': 1945, 'YueShi': 955, 'Finneas': 815, 'Yuchun': 820, 'Zheng': 0, 'RaphaelPlayer': 2050})
player [EvanPlayer] gets hole card ['D6', 'S8'], current stack 465
player [ZifengFoldMan] gets hole card ['C9', 'D9'], current stack 950
player [JoyoPlayer] gets hole card ['HQ', 'C2'], current stack 1940
player [YueShi] gets hole card ['SK', 'D8'], current stack 945
player [Finneas] gets hole card ['CA', 'SQ'], current stack 815
player [Yuchun] gets hole card ['HK', 'HT'], current stack 820
player [RaphaelPlayer] gets hole card ['S2', 'HA'], current stack 2050
Started the round 26
Street "preflop" started. (community card = [])
"Finneas" declared "raise:415"
"Yuchun" declared "fold:0"
"RaphaelPlayer" declared "fold:0"
"EvanPlayer" declared "fold:415"
"ZifengFoldMan" declared "fold:0"
"JoyoPlayer" declared "fold:0"
"YueShi" declared "fold:0"
"['Finneas']" won the round 26 (stack = {'EvanPlayer': 465, 'ZifengFoldMan': 950, 'JoyoPlayer': 1940, 'YueShi': 945, 'Finneas': 830, 'Yuchun': 820, 'Zheng': 0, 'RaphaelPlayer': 2050})
player [EvanPlayer] gets hole card ['S3', 'D9'], current stack 465
player [ZifengFoldMan] gets hole card ['S7', 'D3'], current stack 950
player [JoyoPlayer] gets hole card ['DQ', 'S8'], current stack 1940
player [YueShi] gets hole card ['C9', 'SA'], current stack 940
player [Finneas] gets hole card ['ST', 'S2'], current stack 820
player [Yuchun] gets hole card ['C2', 'C5'], current stack 820
player [RaphaelPlayer] gets hole card ['DK', 'D6'], current stack 2050
Started the round 27
Street "preflop" started. (community card = [])
"Yuchun" declared "call:10"
"RaphaelPlayer" declared "call:10"
"EvanPlayer" declared "call:10"
"ZifengFoldMan" declared "fold:0"
"JoyoPlayer" declared "fold:0"
"YueShi" declared "fold:0"
"Finneas" declared "call:10"
Street "flop" started. (community card = ['D4', 'H8', 'D8'])
"Finneas" declared "call:0"
"Yuchun" declared "call:0"
"RaphaelPlayer" declared "call:0"
"EvanPlayer" declared "raise:455"
"Finneas" declared "fold:0"
"Yuchun" declared "fold:0"
"RaphaelPlayer" declared "call:455"
Street "turn" started. (community card = ['D4', 'H8', 'D8', 'CQ'])
Street "river" started. (community card = ['D4', 'H8', 'D8', 'CQ', 'D5'])
"['RaphaelPlayer']" won the round 27 (stack = {'EvanPlayer': 0, 'ZifengFoldMan': 950, 'JoyoPlayer': 1940, 'YueShi': 940, 'Finneas': 820, 'Yuchun': 810, 'Zheng': 0, 'RaphaelPlayer': 2540})
player [ZifengFoldMan] gets hole card ['CA', 'D4'], current stack 950
player [JoyoPlayer] gets hole card ['H6', 'S4'], current stack 1940
player [YueShi] gets hole card ['C5', 'CT'], current stack 940
player [Finneas] gets hole card ['S9', 'C4'], current stack 815
player [Yuchun] gets hole card ['D3', 'H8'], current stack 800
player [RaphaelPlayer] gets hole card ['HQ', 'C9'], current stack 2540
Started the round 28
Street "preflop" started. (community card = [])
"RaphaelPlayer" declared "call:10"
"ZifengFoldMan" declared "fold:0"
"JoyoPlayer" declared "raise:15"
"YueShi" declared "fold:0"
"Finneas" declared "call:15"
"Yuchun" declared "call:15"
"RaphaelPlayer" declared "call:15"
Street "flop" started. (community card = ['H7', 'SQ', 'S2'])
"Finneas" declared "call:0"
"Yuchun" declared "call:0"
"RaphaelPlayer" declared "raise:70"
"JoyoPlayer" declared "fold:0"
"Finneas" declared "fold:0"
"Yuchun" declared "call:70"
Street "turn" started. (community card = ['H7', 'SQ', 'S2', 'HA'])
"Yuchun" declared "call:0"
"RaphaelPlayer" declared "raise:210"
"Yuchun" declared "fold:0"
"['RaphaelPlayer']" won the round 28 (stack = {'EvanPlayer': 0, 'ZifengFoldMan': 950, 'JoyoPlayer': 1925, 'YueShi': 940, 'Finneas': 805, 'Yuchun': 725, 'Zheng': 0, 'RaphaelPlayer': 2655})
player [ZifengFoldMan] gets hole card ['C7', 'C8'], current stack 950
player [JoyoPlayer] gets hole card ['SK', 'CA'], current stack 1925
player [YueShi] gets hole card ['CQ', 'DQ'], current stack 940
player [Finneas] gets hole card ['H7', 'S3'], current stack 805
player [Yuchun] gets hole card ['H4', 'C4'], current stack 720
player [RaphaelPlayer] gets hole card ['D2', 'SQ'], current stack 2645
Started the round 29
Street "preflop" started. (community card = [])
"ZifengFoldMan" declared "fold:0"
"JoyoPlayer" declared "fold:0"
"YueShi" declared "fold:0"
"Finneas" declared "call:10"
"Yuchun" declared "call:10"
"RaphaelPlayer" declared "fold:0"
Street "flop" started. (community card = ['C9', 'HT', 'C2'])
"Yuchun" declared "call:0"
"Finneas" declared "call:0"
Street "turn" started. (community card = ['C9', 'HT', 'C2', 'HK'])
"Yuchun" declared "call:0"
"Finneas" declared "call:0"
Street "river" started. (community card = ['C9', 'HT', 'C2', 'HK', 'DT'])
"Yuchun" declared "call:0"
"Finneas" declared "call:0"
"['Yuchun']" won the round 29 (stack = {'EvanPlayer': 0, 'ZifengFoldMan': 950, 'JoyoPlayer': 1925, 'YueShi': 940, 'Finneas': 795, 'Yuchun': 745, 'Zheng': 0, 'RaphaelPlayer': 2645})
player [ZifengFoldMan] gets hole card ['CA', 'S7'], current stack 940
player [JoyoPlayer] gets hole card ['DJ', 'DA'], current stack 1925
player [YueShi] gets hole card ['S3', 'C8'], current stack 940
player [Finneas] gets hole card ['HT', 'CK'], current stack 795
player [Yuchun] gets hole card ['DQ', 'H4'], current stack 745
player [RaphaelPlayer] gets hole card ['CT', 'S2'], current stack 2640
Started the round 30
Street "preflop" started. (community card = [])
"JoyoPlayer" declared "raise:15"
"YueShi" declared "fold:0"
"Finneas" declared "call:15"
"Yuchun" declared "call:15"
"RaphaelPlayer" declared "fold:0"
"ZifengFoldMan" declared "fold:0"
Street "flop" started. (community card = ['SA', 'S8', 'HA'])
"JoyoPlayer" declared "raise:1151"
"Finneas" declared "fold:0"
"Yuchun" declared "fold:0"
"['JoyoPlayer']" won the round 30 (stack = {'EvanPlayer': 0, 'ZifengFoldMan': 940, 'JoyoPlayer': 1970, 'YueShi': 940, 'Finneas': 780, 'Yuchun': 730, 'Zheng': 0, 'RaphaelPlayer': 2640})
player [ZifengFoldMan] gets hole card ['S5', 'S2'], current stack 935
player [JoyoPlayer] gets hole card ['DJ', 'S7'], current stack 1960
player [YueShi] gets hole card ['D7', 'C4'], current stack 940
player [Finneas] gets hole card ['H5', 'D4'], current stack 780
player [Yuchun] gets hole card ['HK', 'H8'], current stack 730
player [RaphaelPlayer] gets hole card ['DK', 'H4'], current stack 2640
Started the round 31
Street "preflop" started. (community card = [])
"YueShi" declared "fold:0"
"Finneas" declared "call:10"
"Yuchun" declared "call:10"
"RaphaelPlayer" declared "fold:0"
"ZifengFoldMan" declared "fold:0"
"JoyoPlayer" declared "fold:0"
Street "flop" started. (community card = ['C6', 'C9', 'C7'])
"Finneas" declared "call:0"
"Yuchun" declared "call:0"
Street "turn" started. (community card = ['C6', 'C9', 'C7', 'SA'])
"Finneas" declared "call:0"
"Yuchun" declared "call:0"
Street "river" started. (community card = ['C6', 'C9', 'C7', 'SA', 'SQ'])
"Finneas" declared "call:0"
"Yuchun" declared "call:0"
"['Yuchun']" won the round 31 (stack = {'EvanPlayer': 0, 'ZifengFoldMan': 935, 'JoyoPlayer': 1960, 'YueShi': 940, 'Finneas': 770, 'Yuchun': 755, 'Zheng': 0, 'RaphaelPlayer': 2640})
player [ZifengFoldMan] gets hole card ['H9', 'H3'], current stack 935
player [JoyoPlayer] gets hole card ['C3', 'DQ'], current stack 1955
player [YueShi] gets hole card ['C6', 'D4'], current stack 930
player [Finneas] gets hole card ['H8', 'SK'], current stack 770
player [Yuchun] gets hole card ['D3', 'SA'], current stack 755
player [RaphaelPlayer] gets hole card ['S7', 'DJ'], current stack 2640
Started the round 32
Street "preflop" started. (community card = [])
"Finneas" declared "call:10"
"Yuchun" declared "call:10"
"RaphaelPlayer" declared "fold:0"
"ZifengFoldMan" declared "fold:0"
"JoyoPlayer" declared "fold:0"
"YueShi" declared "fold:0"
Street "flop" started. (community card = ['H7', 'SJ', 'HQ'])
"Finneas" declared "call:0"
"Yuchun" declared "call:0"
Street "turn" started. (community card = ['H7', 'SJ', 'HQ', 'SQ'])
"Finneas" declared "call:0"
"Yuchun" declared "call:0"
Street "river" started. (community card = ['H7', 'SJ', 'HQ', 'SQ', 'H4'])
"Finneas" declared "call:0"
"Yuchun" declared "call:0"
"['Yuchun']" won the round 32 (stack = {'EvanPlayer': 0, 'ZifengFoldMan': 935, 'JoyoPlayer': 1955, 'YueShi': 930, 'Finneas': 760, 'Yuchun': 780, 'Zheng': 0, 'RaphaelPlayer': 2640})
player [ZifengFoldMan] gets hole card ['S8', 'D8'], current stack 935
player [JoyoPlayer] gets hole card ['S9', 'D7'], current stack 1955
player [YueShi] gets hole card ['HA', 'D5'], current stack 925
player [Finneas] gets hole card ['HJ', 'DA'], current stack 750
player [Yuchun] gets hole card ['C2', 'H8'], current stack 780
player [RaphaelPlayer] gets hole card ['C6', 'HK'], current stack 2640
Started the round 33
Street "preflop" started. (community card = [])
"Yuchun" declared "call:10"
"RaphaelPlayer" declared "call:10"
"ZifengFoldMan" declared "fold:0"
"JoyoPlayer" declared "fold:0"
"YueShi" declared "fold:0"
"Finneas" declared "call:10"
Street "flop" started. (community card = ['H7', 'SK', 'CJ'])
"Finneas" declared "call:0"
"Yuchun" declared "call:0"
"RaphaelPlayer" declared "raise:45"
"Finneas" declared "fold:0"
"Yuchun" declared "call:45"
Street "turn" started. (community card = ['H7', 'SK', 'CJ', 'HQ'])
"Yuchun" declared "call:0"
"RaphaelPlayer" declared "raise:135"
"Yuchun" declared "fold:0"
"['RaphaelPlayer']" won the round 33 (stack = {'EvanPlayer': 0, 'ZifengFoldMan': 935, 'JoyoPlayer': 1955, 'YueShi': 925, 'Finneas': 750, 'Yuchun': 725, 'Zheng': 0, 'RaphaelPlayer': 2710})
player [ZifengFoldMan] gets hole card ['DQ', 'HQ'], current stack 935
player [JoyoPlayer] gets hole card ['S9', 'H5'], current stack 1955
player [YueShi] gets hole card ['D8', 'S2'], current stack 925
player [Finneas] gets hole card ['H8', 'C4'], current stack 745
player [Yuchun] gets hole card ['DK', 'D3'], current stack 715
player [RaphaelPlayer] gets hole card ['S7', 'H2'], current stack 2710
Started the round 34
Street "preflop" started. (community card = [])
"RaphaelPlayer" declared "fold:0"
"ZifengFoldMan" declared "fold:0"
"JoyoPlayer" declared "fold:0"
"YueShi" declared "fold:0"
"Finneas" declared "call:10"
"Yuchun" declared "call:10"
Street "flop" started. (community card = ['CA', 'ST', 'C9'])
"Finneas" declared "call:0"
"Yuchun" declared "call:0"
Street "turn" started. (community card = ['CA', 'ST', 'C9', 'DT'])
"Finneas" declared "call:0"
"Yuchun" declared "call:0"
Street "river" started. (community card = ['CA', 'ST', 'C9', 'DT', 'D6'])
"Finneas" declared "call:0"
"Yuchun" declared "call:0"
"['Yuchun']" won the round 34 (stack = {'EvanPlayer': 0, 'ZifengFoldMan': 935, 'JoyoPlayer': 1955, 'YueShi': 925, 'Finneas': 740, 'Yuchun': 735, 'Zheng': 0, 'RaphaelPlayer': 2710})
player [ZifengFoldMan] gets hole card ['D6', 'HJ'], current stack 935
player [JoyoPlayer] gets hole card ['HA', 'H7'], current stack 1955
player [YueShi] gets hole card ['C6', 'S5'], current stack 925
player [Finneas] gets hole card ['C2', 'C5'], current stack 740
player [Yuchun] gets hole card ['HQ', 'CQ'], current stack 730
player [RaphaelPlayer] gets hole card ['D8', 'S6'], current stack 2700
Started the round 35
Street "preflop" started. (community card = [])
"ZifengFoldMan" declared "fold:0"
"JoyoPlayer" declared "fold:0"
"YueShi" declared "fold:0"
"Finneas" declared "call:10"
"Yuchun" declared "call:10"
"RaphaelPlayer" declared "fold:0"
Street "flop" started. (community card = ['CT', 'H3', 'DK'])
"Yuchun" declared "raise:40"
"Finneas" declared "fold:0"
"['Yuchun']" won the round 35 (stack = {'EvanPlayer': 0, 'ZifengFoldMan': 935, 'JoyoPlayer': 1955, 'YueShi': 925, 'Finneas': 730, 'Yuchun': 755, 'Zheng': 0, 'RaphaelPlayer': 2700})
player [ZifengFoldMan] gets hole card ['CQ', 'S3'], current stack 925
player [JoyoPlayer] gets hole card ['H7', 'HA'], current stack 1955
player [YueShi] gets hole card ['S8', 'ST'], current stack 925
player [Finneas] gets hole card ['DT', 'DA'], current stack 730
player [Yuchun] gets hole card ['H4', 'HJ'], current stack 755
player [RaphaelPlayer] gets hole card ['C7', 'C2'], current stack 2695
Started the round 36
Street "preflop" started. (community card = [])
"JoyoPlayer" declared "fold:0"
"YueShi" declared "fold:0"
"Finneas" declared "call:10"
"Yuchun" declared "call:10"
"RaphaelPlayer" declared "fold:0"
"ZifengFoldMan" declared "fold:0"
Street "flop" started. (community card = ['S9', 'S5', 'SA'])
"Finneas" declared "call:0"
"Yuchun" declared "call:0"
Street "turn" started. (community card = ['S9', 'S5', 'SA', 'D4'])
"Finneas" declared "call:0"
"Yuchun" declared "call:0"
Street "river" started. (community card = ['S9', 'S5', 'SA', 'D4', 'S6'])
"Finneas" declared "call:0"
"Yuchun" declared "call:0"
"['Finneas']" won the round 36 (stack = {'EvanPlayer': 0, 'ZifengFoldMan': 925, 'JoyoPlayer': 1955, 'YueShi': 925, 'Finneas': 755, 'Yuchun': 745, 'Zheng': 0, 'RaphaelPlayer': 2695})
player [ZifengFoldMan] gets hole card ['HJ', 'S2'], current stack 920
player [JoyoPlayer] gets hole card ['H3', 'SK'], current stack 1945
player [YueShi] gets hole card ['H2', 'ST'], current stack 925
player [Finneas] gets hole card ['DQ', 'C9'], current stack 755
player [Yuchun] gets hole card ['S3', 'D8'], current stack 745
player [RaphaelPlayer] gets hole card ['HT', 'S9'], current stack 2695
Started the round 37
Street "preflop" started. (community card = [])
"YueShi" declared "fold:0"
"Finneas" declared "call:10"
"Yuchun" declared "call:10"
"RaphaelPlayer" declared "call:10"
"ZifengFoldMan" declared "fold:0"
"JoyoPlayer" declared "fold:0"
Street "flop" started. (community card = ['S5', 'H6', 'CJ'])
"Finneas" declared "call:0"
"Yuchun" declared "call:0"
"RaphaelPlayer" declared "call:0"
Street "turn" started. (community card = ['S5', 'H6', 'CJ', 'DJ'])
"Finneas" declared "call:0"
"Yuchun" declared "call:0"
"RaphaelPlayer" declared "call:0"
Street "river" started. (community card = ['S5', 'H6', 'CJ', 'DJ', 'H9'])
"Finneas" declared "call:0"
"Yuchun" declared "call:0"
"RaphaelPlayer" declared "raise:55"
"Finneas" declared "fold:0"
"Yuchun" declared "fold:0"
"['RaphaelPlayer']" won the round 37 (stack = {'EvanPlayer': 0, 'ZifengFoldMan': 920, 'JoyoPlayer': 1945, 'YueShi': 925, 'Finneas': 745, 'Yuchun': 735, 'Zheng': 0, 'RaphaelPlayer': 2730})
player [ZifengFoldMan] gets hole card ['HA', 'SQ'], current stack 920
player [JoyoPlayer] gets hole card ['HK', 'S6'], current stack 1940
player [YueShi] gets hole card ['D6', 'ST'], current stack 915
player [Finneas] gets hole card ['DJ', 'C7'], current stack 745
player [Yuchun] gets hole card ['H6', 'D8'], current stack 735
player [RaphaelPlayer] gets hole card ['D2', 'CA'], current stack 2730
Started the round 38
Street "preflop" started. (community card = [])
"Finneas" declared "call:10"
"Yuchun" declared "call:10"
"RaphaelPlayer" declared "call:10"
"ZifengFoldMan" declared "fold:0"
"JoyoPlayer" declared "fold:0"
"YueShi" declared "fold:0"
Street "flop" started. (community card = ['SA', 'DQ', 'CJ'])
"Finneas" declared "call:0"
"Yuchun" declared "call:0"
"RaphaelPlayer" declared "raise:55"
"Finneas" declared "fold:0"
"Yuchun" declared "call:55"
Street "turn" started. (community card = ['SA', 'DQ', 'CJ', 'C5'])
"Yuchun" declared "call:0"
"RaphaelPlayer" declared "raise:165"
"Yuchun" declared "fold:0"
"['RaphaelPlayer']" won the round 38 (stack = {'EvanPlayer': 0, 'ZifengFoldMan': 920, 'JoyoPlayer': 1940, 'YueShi': 915, 'Finneas': 735, 'Yuchun': 670, 'Zheng': 0, 'RaphaelPlayer': 2820})
player [ZifengFoldMan] gets hole card ['D9', 'CJ'], current stack 920
player [JoyoPlayer] gets hole card ['D4', 'C5'], current stack 1940
player [YueShi] gets hole card ['D5', 'H9'], current stack 910
player [Finneas] gets hole card ['C4', 'C6'], current stack 725
player [Yuchun] gets hole card ['DJ', 'H6'], current stack 670
player [RaphaelPlayer] gets hole card ['SA', 'ST'], current stack 2820
Started the round 39
Street "preflop" started. (community card = [])
"Yuchun" declared "call:10"
"RaphaelPlayer" declared "raise:30"
"ZifengFoldMan" declared "fold:0"
"JoyoPlayer" declared "fold:0"
"YueShi" declared "fold:0"
"Finneas" declared "fold:0"
"Yuchun" declared "call:30"
Street "flop" started. (community card = ['S7', 'C7', 'D2'])
"Yuchun" declared "call:0"
"RaphaelPlayer" declared "raise:85"
"Yuchun" declared "call:85"
Street "turn" started. (community card = ['S7', 'C7', 'D2', 'SQ'])
"Yuchun" declared "call:0"
"RaphaelPlayer" declared "raise:255"
"Yuchun" declared "fold:0"
"['RaphaelPlayer']" won the round 39 (stack = {'EvanPlayer': 0, 'ZifengFoldMan': 920, 'JoyoPlayer': 1940, 'YueShi': 910, 'Finneas': 725, 'Yuchun': 555, 'Zheng': 0, 'RaphaelPlayer': 2950})
player [ZifengFoldMan] gets hole card ['D8', 'H6'], current stack 920
player [JoyoPlayer] gets hole card ['SA', 'SQ'], current stack 1940
player [YueShi] gets hole card ['H7', 'D3'], current stack 910
player [Finneas] gets hole card ['HQ', 'HK'], current stack 720
player [Yuchun] gets hole card ['D6', 'S6'], current stack 545
player [RaphaelPlayer] gets hole card ['C7', 'DQ'], current stack 2950
Started the round 40
Street "preflop" started. (community card = [])
"RaphaelPlayer" declared "fold:0"
"ZifengFoldMan" declared "fold:0"
"JoyoPlayer" declared "fold:0"
"YueShi" declared "fold:0"
"Finneas" declared "call:10"
"Yuchun" declared "call:10"
Street "flop" started. (community card = ['D2', 'D7', 'S4'])
"Finneas" declared "call:0"
"Yuchun" declared "call:0"
Street "turn" started. (community card = ['D2', 'D7', 'S4', 'H4'])
"Finneas" declared "call:0"
"Yuchun" declared "raise:40"
"Finneas" declared "fold:0"
"['Yuchun']" won the round 40 (stack = {'EvanPlayer': 0, 'ZifengFoldMan': 920, 'JoyoPlayer': 1940, 'YueShi': 910, 'Finneas': 715, 'Yuchun': 565, 'Zheng': 0, 'RaphaelPlayer': 2950})
player [ZifengFoldMan] gets hole card ['DQ', 'C4'], current stack 920
player [JoyoPlayer] gets hole card ['CJ', 'HK'], current stack 1940
player [YueShi] gets hole card ['H2', 'SQ'], current stack 910
player [Finneas] gets hole card ['S9', 'S4'], current stack 715
player [Yuchun] gets hole card ['C5', 'DK'], current stack 560
player [RaphaelPlayer] gets hole card ['D2', 'D3'], current stack 2940
Started the round 41
Street "preflop" started. (community card = [])
"ZifengFoldMan" declared "fold:0"
"JoyoPlayer" declared "fold:0"
"YueShi" declared "fold:0"
"Finneas" declared "call:10"
"Yuchun" declared "fold:0"
"RaphaelPlayer" declared "fold:0"
"['Finneas']" won the round 41 (stack = {'EvanPlayer': 0, 'ZifengFoldMan': 920, 'JoyoPlayer': 1940, 'YueShi': 910, 'Finneas': 730, 'Yuchun': 560, 'Zheng': 0, 'RaphaelPlayer': 2940})
player [ZifengFoldMan] gets hole card ['H8', 'D5'], current stack 910
player [JoyoPlayer] gets hole card ['DT', 'D6'], current stack 1940
player [YueShi] gets hole card ['H6', 'DK'], current stack 910
player [Finneas] gets hole card ['C5', 'H2'], current stack 730
player [Yuchun] gets hole card ['HK', 'HQ'], current stack 560
player [RaphaelPlayer] gets hole card ['H3', 'C8'], current stack 2935
Started the round 42
Street "preflop" started. (community card = [])
"JoyoPlayer" declared "raise:15"
"YueShi" declared "fold:0"
"Finneas" declared "call:15"
"Yuchun" declared "fold:0"
"RaphaelPlayer" declared "fold:0"
"ZifengFoldMan" declared "fold:0"
Street "flop" started. (community card = ['C9', 'HA', 'D2'])
"JoyoPlayer" declared "raise:10"
"Finneas" declared "call:10"
Street "turn" started. (community card = ['C9', 'HA', 'D2', 'S3'])
"JoyoPlayer" declared "fold:0"
"['Finneas']" won the round 42 (stack = {'EvanPlayer': 0, 'ZifengFoldMan': 910, 'JoyoPlayer': 1915, 'YueShi': 910, 'Finneas': 770, 'Yuchun': 560, 'Zheng': 0, 'RaphaelPlayer': 2935})
player [ZifengFoldMan] gets hole card ['H5', 'DQ'], current stack 905
player [JoyoPlayer] gets hole card ['S7', 'C7'], current stack 1905
player [YueShi] gets hole card ['H7', 'D9'], current stack 910
player [Finneas] gets hole card ['HK', 'D2'], current stack 770
player [Yuchun] gets hole card ['HT', 'DT'], current stack 560
player [RaphaelPlayer] gets hole card ['S3', 'H3'], current stack 2935
Started the round 43
Street "preflop" started. (community card = [])
"YueShi" declared "fold:0"
"Finneas" declared "call:10"
"Yuchun" declared "fold:0"
"RaphaelPlayer" declared "fold:0"
"ZifengFoldMan" declared "fold:0"
"JoyoPlayer" declared "call:10"
Street "flop" started. (community card = ['D6', 'C6', 'C5'])
"JoyoPlayer" declared "raise:20"
"Finneas" declared "fold:0"
"['JoyoPlayer']" won the round 43 (stack = {'EvanPlayer': 0, 'ZifengFoldMan': 905, 'JoyoPlayer': 1930, 'YueShi': 910, 'Finneas': 760, 'Yuchun': 560, 'Zheng': 0, 'RaphaelPlayer': 2935})
player [ZifengFoldMan] gets hole card ['DT', 'CQ'], current stack 905
player [JoyoPlayer] gets hole card ['CK', 'S5'], current stack 1925
player [YueShi] gets hole card ['S2', 'HQ'], current stack 900
player [Finneas] gets hole card ['H6', 'S9'], current stack 760
player [Yuchun] gets hole card ['S6', 'H8'], current stack 560
player [RaphaelPlayer] gets hole card ['C5', 'S8'], current stack 2935
Started the round 44
Street "preflop" started. (community card = [])
"Finneas" declared "call:10"
"Yuchun" declared "fold:0"
"RaphaelPlayer" declared "fold:0"
"ZifengFoldMan" declared "fold:0"
"JoyoPlayer" declared "raise:15"
"YueShi" declared "fold:0"
"Finneas" declared "call:15"
Street "flop" started. (community card = ['H9', 'D8', 'C4'])
"JoyoPlayer" declared "fold:0"
"['Finneas']" won the round 44 (stack = {'EvanPlayer': 0, 'ZifengFoldMan': 905, 'JoyoPlayer': 1915, 'YueShi': 900, 'Finneas': 785, 'Yuchun': 560, 'Zheng': 0, 'RaphaelPlayer': 2935})
player [ZifengFoldMan] gets hole card ['H8', 'D3'], current stack 905
player [JoyoPlayer] gets hole card ['S3', 'SQ'], current stack 1915
player [YueShi] gets hole card ['D6', 'S2'], current stack 895
player [Finneas] gets hole card ['HQ', 'D2'], current stack 775
player [Yuchun] gets hole card ['D7', 'S5'], current stack 560
player [RaphaelPlayer] gets hole card ['C6', 'C2'], current stack 2935
Started the round 45
Street "preflop" started. (community card = [])
"Yuchun" declared "fold:0"
"RaphaelPlayer" declared "fold:0"
"ZifengFoldMan" declared "fold:0"
"JoyoPlayer" declared "fold:0"
"YueShi" declared "fold:0"
"['Finneas']" won the round 45 (stack = {'EvanPlayer': 0, 'ZifengFoldMan': 905, 'JoyoPlayer': 1915, 'YueShi': 895, 'Finneas': 790, 'Yuchun': 560, 'Zheng': 0, 'RaphaelPlayer': 2935})
player [ZifengFoldMan] gets hole card ['D2', 'HK'], current stack 905
player [JoyoPlayer] gets hole card ['C6', 'CJ'], current stack 1915
player [YueShi] gets hole card ['S7', 'H7'], current stack 895
player [Finneas] gets hole card ['D9', 'DA'], current stack 785
player [Yuchun] gets hole card ['D5', 'C8'], current stack 550
player [RaphaelPlayer] gets hole card ['C3', 'S4'], current stack 2935
Started the round 46
Street "preflop" started. (community card = [])
"RaphaelPlayer" declared "fold:0"
"ZifengFoldMan" declared "fold:0"
"JoyoPlayer" declared "fold:0"
"YueShi" declared "fold:0"
"Finneas" declared "call:10"
"Yuchun" declared "fold:0"
"['Finneas']" won the round 46 (stack = {'EvanPlayer': 0, 'ZifengFoldMan': 905, 'JoyoPlayer': 1915, 'YueShi': 895, 'Finneas': 800, 'Yuchun': 550, 'Zheng': 0, 'RaphaelPlayer': 2935})
player [ZifengFoldMan] gets hole card ['D7', 'S6'], current stack 905
player [JoyoPlayer] gets hole card ['CK', 'S5'], current stack 1915
player [YueShi] gets hole card ['C2', 'H6'], current stack 895
player [Finneas] gets hole card ['C3', 'C5'], current stack 800
player [Yuchun] gets hole card ['SK', 'H7'], current stack 545
player [RaphaelPlayer] gets hole card ['DT', 'H5'], current stack 2925
Started the round 47
Street "preflop" started. (community card = [])
"ZifengFoldMan" declared "fold:0"
"JoyoPlayer" declared "raise:15"
"YueShi" declared "fold:0"
"Finneas" declared "call:15"
"Yuchun" declared "fold:0"
"RaphaelPlayer" declared "fold:0"
Street "flop" started. (community card = ['S8', 'S2', 'S4'])
"JoyoPlayer" declared "fold:0"
"['Finneas']" won the round 47 (stack = {'EvanPlayer': 0, 'ZifengFoldMan': 905, 'JoyoPlayer': 1900, 'YueShi': 895, 'Finneas': 830, 'Yuchun': 545, 'Zheng': 0, 'RaphaelPlayer': 2925})
player [ZifengFoldMan] gets hole card ['D6', 'C4'], current stack 895
player [JoyoPlayer] gets hole card ['D5', 'CJ'], current stack 1900
player [YueShi] gets hole card ['HQ', 'HJ'], current stack 895
player [Finneas] gets hole card ['H5', 'HT'], current stack 830
player [Yuchun] gets hole card ['S6', 'HK'], current stack 545
player [RaphaelPlayer] gets hole card ['C2', 'CA'], current stack 2920
Started the round 48
Street "preflop" started. (community card = [])
"JoyoPlayer" declared "fold:0"
"YueShi" declared "fold:0"
"Finneas" declared "call:10"
"Yuchun" declared "fold:0"
"RaphaelPlayer" declared "call:10"
"ZifengFoldMan" declared "fold:0"
Street "flop" started. (community card = ['DK', 'CK', 'H7'])
"RaphaelPlayer" declared "raise:40"
"Finneas" declared "fold:0"
"['RaphaelPlayer']" won the round 48 (stack = {'EvanPlayer': 0, 'ZifengFoldMan': 895, 'JoyoPlayer': 1900, 'YueShi': 895, 'Finneas': 820, 'Yuchun': 545, 'Zheng': 0, 'RaphaelPlayer': 2945})
player [ZifengFoldMan] gets hole card ['S4', 'D7'], current stack 890
player [JoyoPlayer] gets hole card ['ST', 'C9'], current stack 1890
player [YueShi] gets hole card ['HQ', 'H4'], current stack 895
player [Finneas] gets hole card ['CA', 'S6'], current stack 820
player [Yuchun] gets hole card ['SJ', 'DK'], current stack 545
player [RaphaelPlayer] gets hole card ['S5', 'CQ'], current stack 2945
Started the round 49
Street "preflop" started. (community card = [])
"YueShi" declared "fold:0"
"Finneas" declared "call:10"
"Yuchun" declared "fold:0"
"RaphaelPlayer" declared "fold:0"
"ZifengFoldMan" declared "fold:0"
"JoyoPlayer" declared "fold:0"
"['Finneas']" won the round 49 (stack = {'EvanPlayer': 0, 'ZifengFoldMan': 890, 'JoyoPlayer': 1890, 'YueShi': 895, 'Finneas': 835, 'Yuchun': 545, 'Zheng': 0, 'RaphaelPlayer': 2945})
player [ZifengFoldMan] gets hole card ['DK', 'H7'], current stack 890
player [JoyoPlayer] gets hole card ['H4', 'ST'], current stack 1885
player [YueShi] gets hole card ['HK', 'HQ'], current stack 885
player [Finneas] gets hole card ['C7', 'HA'], current stack 835
player [Yuchun] gets hole card ['H6', 'D9'], current stack 545
player [RaphaelPlayer] gets hole card ['D3', 'D2'], current stack 2945
Started the round 50
Street "preflop" started. (community card = [])
"Finneas" declared "call:10"
"Yuchun" declared "fold:0"
"RaphaelPlayer" declared "fold:0"
"ZifengFoldMan" declared "fold:0"
"JoyoPlayer" declared "fold:0"
"YueShi" declared "fold:0"
"['Finneas']" won the round 50 (stack = {'EvanPlayer': 0, 'ZifengFoldMan': 890, 'JoyoPlayer': 1885, 'YueShi': 885, 'Finneas': 850, 'Yuchun': 545, 'Zheng': 0, 'RaphaelPlayer': 2945})

Game Results:
------------------------------------------------------------
Game 1:
Winner: RaphaelPlayer (stack: 2945)
All players' stacks:
  EvanPlayer: 0
  ZifengFoldMan: 890
  JoyoPlayer: 1885
  YueShi: 885
  Finneas: 850
  Yuchun: 545
  Zheng: 0
  RaphaelPlayer: 2945
------------------------------------------------------------
