player [EvanPlayer] gets hole card ['DK', 'H6'], current stack 1000
player [ZifengFoldMan] gets hole card ['S2', 'D4'], current stack 995
player [JoyoPlayer] gets hole card ['SQ', 'H5'], current stack 990
player [YueShi] gets hole card ['S9', 'D6'], current stack 1000
player [Finneas] gets hole card ['C6', 'H2'], current stack 1000
player [Yuchun] gets hole card ['HK', 'C3'], current stack 1000
player [Zheng] gets hole card ['HJ', 'D2'], current stack 1000
player [RaphaelPlayer] gets hole card ['CK', 'CT'], current stack 1000
Started the round 1
Street "preflop" started. (community card = [])
"YueShi" declared "fold:0"
"Finneas" declared "call:10"
"Yuchun" declared "fold:0"
"Zheng" declared "call:10"
"RaphaelPlayer" declared "raise:30"
"EvanPlayer" declared "call:30"
"ZifengFoldMan" declared "fold:0"
"JoyoPlayer" declared "raise:50"
"Finneas" declared "fold:0"
"Zheng" declared "fold:0"
"RaphaelPlayer" declared "call:50"
"EvanPlayer" declared "fold:50"
Street "flop" started. (community card = ['S8', 'D5', 'HT'])
"JoyoPlayer" declared "call:0"
"RaphaelPlayer" declared "raise:165"
"JoyoPlayer" declared "call:165"
Street "turn" started. (community card = ['S8', 'D5', 'HT', 'DT'])
"JoyoPlayer" declared "call:0"
"RaphaelPlayer" declared "raise:495"
"JoyoPlayer" declared "call:495"
Street "river" started. (community card = ['S8', 'D5', 'HT', 'DT', 'H9'])
"JoyoPlayer" declared "call:0"
"RaphaelPlayer" declared "raise:290"
"JoyoPlayer" declared "call:290"
"['RaphaelPlayer']" won the round 1 (stack = {'EvanPlayer': 970, 'ZifengFoldMan': 995, 'JoyoPlayer': 0, 'YueShi': 1000, 'Finneas': 990, 'Yuchun': 1000, 'Zheng': 990, 'RaphaelPlayer': 2055})
player [EvanPlayer] gets hole card ['H3', 'D6'], current stack 970
player [ZifengFoldMan] gets hole card ['C3', 'H4'], current stack 995
player [YueShi] gets hole card ['DT', 'S5'], current stack 995
player [Finneas] gets hole card ['HA', 'C2'], current stack 980
player [Yuchun] gets hole card ['DJ', 'D7'], current stack 1000
player [Zheng] gets hole card ['CA', 'SA'], current stack 990
player [RaphaelPlayer] gets hole card ['H6', 'H8'], current stack 2055
Started the round 2
Street "preflop" started. (community card = [])
"Yuchun" declared "fold:0"
"Zheng" declared "call:10"
"RaphaelPlayer" declared "fold:0"
"EvanPlayer" declared "call:10"
"ZifengFoldMan" declared "fold:0"
"YueShi" declared "fold:0"
"Finneas" declared "call:10"
Street "flop" started. (community card = ['DA', 'S3', 'CJ'])
"Finneas" declared "call:0"
"Zheng" declared "raise:980"
"EvanPlayer" declared "fold:980"
"Finneas" declared "fold:0"
"['Zheng']" won the round 2 (stack = {'EvanPlayer': 960, 'ZifengFoldMan': 995, 'JoyoPlayer': 0, 'YueShi': 995, 'Finneas': 980, 'Yuchun': 1000, 'Zheng': 1015, 'RaphaelPlayer': 2055})
player [EvanPlayer] gets hole card ['C7', 'C9'], current stack 960
player [ZifengFoldMan] gets hole card ['D2', 'S4'], current stack 995
player [YueShi] gets hole card ['C3', 'S6'], current stack 995
player [Finneas] gets hole card ['S2', 'H6'], current stack 975
player [Yuchun] gets hole card ['HT', 'D9'], current stack 990
player [Zheng] gets hole card ['HJ', 'DT'], current stack 1015
player [RaphaelPlayer] gets hole card ['S3', 'DQ'], current stack 2055
Started the round 3
Street "preflop" started. (community card = [])
"Zheng" declared "call:10"
"RaphaelPlayer" declared "fold:0"
"EvanPlayer" declared "raise:960"
"ZifengFoldMan" declared "fold:0"
"YueShi" declared "fold:0"
"Finneas" declared "fold:0"
"Yuchun" declared "fold:0"
"Zheng" declared "fold:0"
"['EvanPlayer']" won the round 3 (stack = {'EvanPlayer': 985, 'ZifengFoldMan': 995, 'JoyoPlayer': 0, 'YueShi': 995, 'Finneas': 975, 'Yuchun': 990, 'Zheng': 1005, 'RaphaelPlayer': 2055})
player [EvanPlayer] gets hole card ['D7', 'CT'], current stack 985
player [ZifengFoldMan] gets hole card ['H7', 'SQ'], current stack 995
player [YueShi] gets hole card ['S6', 'S3'], current stack 995
player [Finneas] gets hole card ['C9', 'D9'], current stack 975
player [Yuchun] gets hole card ['CQ', 'H8'], current stack 985
player [Zheng] gets hole card ['CA', 'HJ'], current stack 995
player [RaphaelPlayer] gets hole card ['DJ', 'SA'], current stack 2055
Started the round 4
Street "preflop" started. (community card = [])
"RaphaelPlayer" declared "raise:30"
"EvanPlayer" declared "call:30"
"ZifengFoldMan" declared "fold:0"
"YueShi" declared "fold:0"
"Finneas" declared "fold:0"
"Yuchun" declared "fold:0"
"Zheng" declared "fold:0"
Street "flop" started. (community card = ['H2', 'S2', 'S5'])
"RaphaelPlayer" declared "call:0"
"EvanPlayer" declared "fold:0"
"['RaphaelPlayer']" won the round 4 (stack = {'EvanPlayer': 955, 'ZifengFoldMan': 995, 'JoyoPlayer': 0, 'YueShi': 995, 'Finneas': 975, 'Yuchun': 985, 'Zheng': 995, 'RaphaelPlayer': 2100})
player [EvanPlayer] gets hole card ['S4', 'H6'], current stack 955
player [ZifengFoldMan] gets hole card ['C5', 'HJ'], current stack 995
player [YueShi] gets hole card ['S9', 'C8'], current stack 995
player [Finneas] gets hole card ['CA', 'S7'], current stack 975
player [Yuchun] gets hole card ['HK', 'D7'], current stack 985
player [Zheng] gets hole card ['D2', 'D9'], current stack 990
player [RaphaelPlayer] gets hole card ['D5', 'ST'], current stack 2090
Started the round 5
Street "preflop" started. (community card = [])
"EvanPlayer" declared "call:10"
"ZifengFoldMan" declared "fold:0"
"YueShi" declared "fold:0"
"Finneas" declared "call:10"
"Yuchun" declared "fold:0"
"Zheng" declared "call:10"
"RaphaelPlayer" declared "fold:0"
Street "flop" started. (community card = ['S8', 'DK', 'HA'])
"Zheng" declared "call:0"
"EvanPlayer" declared "fold:0"
"Finneas" declared "call:0"
Street "turn" started. (community card = ['S8', 'DK', 'HA', 'CQ'])
"Zheng" declared "call:0"
"Finneas" declared "call:0"
Street "river" started. (community card = ['S8', 'DK', 'HA', 'CQ', 'C7'])
"Zheng" declared "call:0"
"Finneas" declared "call:0"
"['Finneas']" won the round 5 (stack = {'EvanPlayer': 945, 'ZifengFoldMan': 995, 'JoyoPlayer': 0, 'YueShi': 995, 'Finneas': 1005, 'Yuchun': 985, 'Zheng': 985, 'RaphaelPlayer': 2090})
player [EvanPlayer] gets hole card ['CA', 'C6'], current stack 935
player [ZifengFoldMan] gets hole card ['H2', 'D7'], current stack 995
player [YueShi] gets hole card ['C3', 'ST'], current stack 995
player [Finneas] gets hole card ['D6', 'HJ'], current stack 1005
player [Yuchun] gets hole card ['CQ', 'S3'], current stack 985
player [Zheng] gets hole card ['DQ', 'D5'], current stack 985
player [RaphaelPlayer] gets hole card ['S7', 'HT'], current stack 2085
Started the round 6
Street "preflop" started. (community card = [])
"ZifengFoldMan" declared "fold:0"
"YueShi" declared "fold:0"
"Finneas" declared "call:10"
"Yuchun" declared "fold:0"
"Zheng" declared "call:10"
"RaphaelPlayer" declared "fold:0"
"EvanPlayer" declared "call:10"
Street "flop" started. (community card = ['SK', 'DT', 'H6'])
"EvanPlayer" declared "fold:0"
"Finneas" declared "call:0"
"Zheng" declared "call:0"
Street "turn" started. (community card = ['SK', 'DT', 'H6', 'H9'])
"Finneas" declared "call:0"
"Zheng" declared "call:0"
Street "river" started. (community card = ['SK', 'DT', 'H6', 'H9', 'SJ'])
"Finneas" declared "call:0"
"Zheng" declared "raise:975"
"Finneas" declared "fold:0"
"['Zheng']" won the round 6 (stack = {'EvanPlayer': 935, 'ZifengFoldMan': 995, 'JoyoPlayer': 0, 'YueShi': 995, 'Finneas': 995, 'Yuchun': 985, 'Zheng': 1010, 'RaphaelPlayer': 2085})
player [EvanPlayer] gets hole card ['DA', 'DQ'], current stack 930
player [ZifengFoldMan] gets hole card ['D6', 'C5'], current stack 985
player [YueShi] gets hole card ['S9', 'H3'], current stack 995
player [Finneas] gets hole card ['DJ', 'HT'], current stack 995
player [Yuchun] gets hole card ['D5', 'S8'], current stack 985
player [Zheng] gets hole card ['D2', 'HK'], current stack 1010
player [RaphaelPlayer] gets hole card ['H4', 'SK'], current stack 2085
Started the round 7
Street "preflop" started. (community card = [])
"YueShi" declared "fold:0"
"Finneas" declared "call:10"
"Yuchun" declared "fold:0"
"Zheng" declared "call:10"
"RaphaelPlayer" declared "fold:0"
"EvanPlayer" declared "raise:935"
"ZifengFoldMan" declared "fold:0"
"Finneas" declared "fold:0"
"Zheng" declared "fold:0"
"['EvanPlayer']" won the round 7 (stack = {'EvanPlayer': 965, 'ZifengFoldMan': 985, 'JoyoPlayer': 0, 'YueShi': 995, 'Finneas': 985, 'Yuchun': 985, 'Zheng': 1000, 'RaphaelPlayer': 2085})
player [EvanPlayer] gets hole card ['H2', 'DQ'], current stack 965
player [ZifengFoldMan] gets hole card ['C7', 'D5'], current stack 980
player [YueShi] gets hole card ['DJ', 'SK'], current stack 985
player [Finneas] gets hole card ['C3', 'C9'], current stack 985
player [Yuchun] gets hole card ['C4', 'H6'], current stack 985
player [Zheng] gets hole card ['HA', 'H3'], current stack 1000
player [RaphaelPlayer] gets hole card ['D3', 'H4'], current stack 2085
Started the round 8
Street "preflop" started. (community card = [])
"Finneas" declared "call:10"
"Yuchun" declared "fold:0"
"Zheng" declared "call:10"
"RaphaelPlayer" declared "fold:0"
"EvanPlayer" declared "call:10"
"ZifengFoldMan" declared "fold:0"
"YueShi" declared "fold:0"
Street "flop" started. (community card = ['H9', 'S6', 'D8'])
"Finneas" declared "call:0"
"Zheng" declared "call:0"
"EvanPlayer" declared "fold:0"
Street "turn" started. (community card = ['H9', 'S6', 'D8', 'CJ'])
"Finneas" declared "call:0"
"Zheng" declared "call:0"
Street "river" started. (community card = ['H9', 'S6', 'D8', 'CJ', 'H8'])
"Finneas" declared "call:0"
"Zheng" declared "call:0"
"['Finneas']" won the round 8 (stack = {'EvanPlayer': 955, 'ZifengFoldMan': 980, 'JoyoPlayer': 0, 'YueShi': 985, 'Finneas': 1020, 'Yuchun': 985, 'Zheng': 990, 'RaphaelPlayer': 2085})
player [EvanPlayer] gets hole card ['DA', 'D4'], current stack 955
player [ZifengFoldMan] gets hole card ['CJ', 'D2'], current stack 980
player [YueShi] gets hole card ['S3', 'H5'], current stack 980
player [Finneas] gets hole card ['HA', 'S5'], current stack 1010
player [Yuchun] gets hole card ['ST', 'DJ'], current stack 985
player [Zheng] gets hole card ['D5', 'C8'], current stack 990
player [RaphaelPlayer] gets hole card ['HJ', 'C9'], current stack 2085
Started the round 9
Street "preflop" started. (community card = [])
"Yuchun" declared "fold:0"
"Zheng" declared "call:10"
"RaphaelPlayer" declared "call:10"
"EvanPlayer" declared "raise:955"
"ZifengFoldMan" declared "fold:0"
"YueShi" declared "fold:0"
"Finneas" declared "fold:0"
"Zheng" declared "fold:0"
"RaphaelPlayer" declared "fold:0"
"['EvanPlayer']" won the round 9 (stack = {'EvanPlayer': 990, 'ZifengFoldMan': 980, 'JoyoPlayer': 0, 'YueShi': 980, 'Finneas': 1010, 'Yuchun': 985, 'Zheng': 980, 'RaphaelPlayer': 2075})
player [EvanPlayer] gets hole card ['S8', 'D3'], current stack 990
player [ZifengFoldMan] gets hole card ['S9', 'CK'], current stack 980
player [YueShi] gets hole card ['D2', 'H6'], current stack 980
player [Finneas] gets hole card ['S3', 'DK'], current stack 1005
player [Yuchun] gets hole card ['HT', 'S6'], current stack 975
player [Zheng] gets hole card ['H9', 'S5'], current stack 980
player [RaphaelPlayer] gets hole card ['CJ', 'D8'], current stack 2075
Started the round 10
Street "preflop" started. (community card = [])
"Zheng" declared "call:10"
"RaphaelPlayer" declared "call:10"
"EvanPlayer" declared "fold:10"
"ZifengFoldMan" declared "fold:0"
"YueShi" declared "fold:0"
"Finneas" declared "call:10"
"Yuchun" declared "call:10"
Street "flop" started. (community card = ['CA', 'DT', 'D6'])
"Finneas" declared "call:0"
"Yuchun" declared "call:0"
"Zheng" declared "call:0"
"RaphaelPlayer" declared "call:0"
Street "turn" started. (community card = ['CA', 'DT', 'D6', 'HA'])
"Finneas" declared "call:0"
"Yuchun" declared "call:0"
"Zheng" declared "call:0"
"RaphaelPlayer" declared "call:0"
Street "river" started. (community card = ['CA', 'DT', 'D6', 'HA', 'CT'])
"Finneas" declared "call:0"
"Yuchun" declared "raise:40"
"Zheng" declared "fold:0"
"RaphaelPlayer" declared "fold:0"
"Finneas" declared "fold:0"
"['Yuchun']" won the round 10 (stack = {'EvanPlayer': 990, 'ZifengFoldMan': 980, 'JoyoPlayer': 0, 'YueShi': 980, 'Finneas': 1000, 'Yuchun': 1015, 'Zheng': 970, 'RaphaelPlayer': 2065})
player [EvanPlayer] gets hole card ['D4', 'C8'], current stack 990
player [ZifengFoldMan] gets hole card ['HQ', 'DT'], current stack 980
player [YueShi] gets hole card ['C4', 'H6'], current stack 980
player [Finneas] gets hole card ['H8', 'CQ'], current stack 1000
player [Yuchun] gets hole card ['DJ', 'DA'], current stack 1010
player [Zheng] gets hole card ['HK', 'SQ'], current stack 960
player [RaphaelPlayer] gets hole card ['HA', 'D9'], current stack 2065
Started the round 11
Street "preflop" started. (community card = [])
"RaphaelPlayer" declared "raise:30"
"EvanPlayer" declared "fold:30"
"ZifengFoldMan" declared "fold:0"
"YueShi" declared "fold:0"
"Finneas" declared "fold:0"
"Yuchun" declared "call:30"
"Zheng" declared "fold:0"
Street "flop" started. (community card = ['D6', 'D5', 'H9'])
"Yuchun" declared "call:0"
"RaphaelPlayer" declared "raise:80"
"Yuchun" declared "call:80"
Street "turn" started. (community card = ['D6', 'D5', 'H9', 'S6'])
"Yuchun" declared "call:0"
"RaphaelPlayer" declared "raise:240"
"Yuchun" declared "call:240"
Street "river" started. (community card = ['D6', 'D5', 'H9', 'S6', 'S4'])
"Yuchun" declared "call:0"
"RaphaelPlayer" declared "raise:720"
"Yuchun" declared "fold:0"
"['RaphaelPlayer']" won the round 11 (stack = {'EvanPlayer': 990, 'ZifengFoldMan': 980, 'JoyoPlayer': 0, 'YueShi': 980, 'Finneas': 1000, 'Yuchun': 665, 'Zheng': 960, 'RaphaelPlayer': 2425})
player [EvanPlayer] gets hole card ['D7', 'HJ'], current stack 990
player [ZifengFoldMan] gets hole card ['DT', 'SA'], current stack 980
player [YueShi] gets hole card ['C2', 'SQ'], current stack 980
player [Finneas] gets hole card ['S2', 'S9'], current stack 1000
player [Yuchun] gets hole card ['S6', 'DJ'], current stack 665
player [Zheng] gets hole card ['C3', 'H7'], current stack 955
player [RaphaelPlayer] gets hole card ['H6', 'S5'], current stack 2415
Started the round 12
Street "preflop" started. (community card = [])
"EvanPlayer" declared "call:10"
"ZifengFoldMan" declared "fold:0"
"YueShi" declared "fold:0"
"Finneas" declared "call:10"
"Yuchun" declared "call:10"
"Zheng" declared "call:10"
"RaphaelPlayer" declared "fold:0"
Street "flop" started. (community card = ['S3', 'H3', 'D6'])
"Zheng" declared "raise:480"
"EvanPlayer" declared "fold:480"
"Finneas" declared "fold:0"
"Yuchun" declared "call:480"
Street "turn" started. (community card = ['S3', 'H3', 'D6', 'HK'])
"Zheng" declared "raise:470"
"Yuchun" declared "fold:0"
"['Zheng']" won the round 12 (stack = {'EvanPlayer': 980, 'ZifengFoldMan': 980, 'JoyoPlayer': 0, 'YueShi': 980, 'Finneas': 990, 'Yuchun': 175, 'Zheng': 1480, 'RaphaelPlayer': 2415})
player [EvanPlayer] gets hole card ['H6', 'H4'], current stack 970
player [ZifengFoldMan] gets hole card ['C9', 'S7'], current stack 980
player [YueShi] gets hole card ['S2', 'SK'], current stack 980
player [Finneas] gets hole card ['HJ', 'C5'], current stack 990
player [Yuchun] gets hole card ['H2', 'HK'], current stack 175
player [Zheng] gets hole card ['D7', 'S5'], current stack 1480
player [RaphaelPlayer] gets hole card ['S4', 'HA'], current stack 2410
Started the round 13
Street "preflop" started. (community card = [])
"ZifengFoldMan" declared "fold:0"
"YueShi" declared "fold:0"
"Finneas" declared "call:10"
"Yuchun" declared "call:10"
"Zheng" declared "call:10"
"RaphaelPlayer" declared "call:10"
"EvanPlayer" declared "call:10"
Street "flop" started. (community card = ['H3', 'DK', 'ST'])
"RaphaelPlayer" declared "call:0"
"EvanPlayer" declared "fold:0"
"Finneas" declared "call:0"
"Yuchun" declared "call:0"
"Zheng" declared "call:0"
Street "turn" started. (community card = ['H3', 'DK', 'ST', 'C7'])
"RaphaelPlayer" declared "call:0"
"Finneas" declared "call:0"
"Yuchun" declared "call:0"
"Zheng" declared "call:0"
Street "river" started. (community card = ['H3', 'DK', 'ST', 'C7', 'CK'])
"RaphaelPlayer" declared "call:0"
"Finneas" declared "call:0"
"Yuchun" declared "raise:165"
"Zheng" declared "fold:0"
"RaphaelPlayer" declared "fold:0"
"Finneas" declared "fold:0"
"['Yuchun']" won the round 13 (stack = {'EvanPlayer': 970, 'ZifengFoldMan': 980, 'JoyoPlayer': 0, 'YueShi': 980, 'Finneas': 980, 'Yuchun': 215, 'Zheng': 1470, 'RaphaelPlayer': 2405})
player [EvanPlayer] gets hole card ['CK', 'CA'], current stack 965
player [ZifengFoldMan] gets hole card ['SA', 'C7'], current stack 970
player [YueShi] gets hole card ['S2', 'D2'], current stack 980
player [Finneas] gets hole card ['C6', 'S7'], current stack 980
player [Yuchun] gets hole card ['S6', 'H2'], current stack 215
player [Zheng] gets hole card ['C9', 'D3'], current stack 1470
player [RaphaelPlayer] gets hole card ['DT', 'H7'], current stack 2405
Started the round 14
Street "preflop" started. (community card = [])
"YueShi" declared "fold:0"
"Finneas" declared "call:10"
"Yuchun" declared "call:10"
"Zheng" declared "call:10"
"RaphaelPlayer" declared "fold:0"
"EvanPlayer" declared "raise:970"
"ZifengFoldMan" declared "fold:0"
"Finneas" declared "fold:0"
"Yuchun" declared "fold:0"
"Zheng" declared "fold:0"
"['EvanPlayer']" won the round 14 (stack = {'EvanPlayer': 1010, 'ZifengFoldMan': 970, 'JoyoPlayer': 0, 'YueShi': 980, 'Finneas': 970, 'Yuchun': 205, 'Zheng': 1460, 'RaphaelPlayer': 2405})
player [EvanPlayer] gets hole card ['HJ', 'CK'], current stack 1010
player [ZifengFoldMan] gets hole card ['DJ', 'SA'], current stack 965
player [YueShi] gets hole card ['H2', 'C9'], current stack 970
player [Finneas] gets hole card ['H7', 'D8'], current stack 970
player [Yuchun] gets hole card ['CA', 'C5'], current stack 205
player [Zheng] gets hole card ['CT', 'D9'], current stack 1460
player [RaphaelPlayer] gets hole card ['CQ', 'ST'], current stack 2405
Started the round 15
Street "preflop" started. (community card = [])
"Finneas" declared "call:10"
"Yuchun" declared "call:10"
"Zheng" declared "call:10"
"RaphaelPlayer" declared "call:10"
"EvanPlayer" declared "raise:1010"
"ZifengFoldMan" declared "fold:0"
"YueShi" declared "fold:0"
"Finneas" declared "fold:0"
"Yuchun" declared "fold:0"
"Zheng" declared "fold:0"
"RaphaelPlayer" declared "fold:0"
"['EvanPlayer']" won the round 15 (stack = {'EvanPlayer': 1065, 'ZifengFoldMan': 965, 'JoyoPlayer': 0, 'YueShi': 970, 'Finneas': 960, 'Yuchun': 195, 'Zheng': 1450, 'RaphaelPlayer': 2395})
player [EvanPlayer] gets hole card ['D7', 'C3'], current stack 1065
player [ZifengFoldMan] gets hole card ['SQ', 'HA'], current stack 965
player [YueShi] gets hole card ['C2', 'H7'], current stack 965
player [Finneas] gets hole card ['D2', 'D3'], current stack 950
player [Yuchun] gets hole card ['DJ', 'H5'], current stack 195
player [Zheng] gets hole card ['C7', 'S9'], current stack 1450
player [RaphaelPlayer] gets hole card ['SK', 'C5'], current stack 2395
Started the round 16
Street "preflop" started. (community card = [])
"Yuchun" declared "call:10"
"Zheng" declared "call:10"
"RaphaelPlayer" declared "call:10"
"EvanPlayer" declared "fold:10"
"ZifengFoldMan" declared "fold:0"
"YueShi" declared "fold:0"
"Finneas" declared "call:10"
Street "flop" started. (community card = ['H3', 'C8', 'DA'])
"Finneas" declared "call:0"
"Yuchun" declared "call:0"
"Zheng" declared "call:0"
"RaphaelPlayer" declared "call:0"
Street "turn" started. (community card = ['H3', 'C8', 'DA', 'HJ'])
"Finneas" declared "call:0"
"Yuchun" declared "call:0"
"Zheng" declared "call:0"
"RaphaelPlayer" declared "call:0"
Street "river" started. (community card = ['H3', 'C8', 'DA', 'HJ', 'S4'])
"Finneas" declared "call:0"
"Yuchun" declared "call:0"
"Zheng" declared "call:0"
"RaphaelPlayer" declared "call:0"
"['Yuchun']" won the round 16 (stack = {'EvanPlayer': 1065, 'ZifengFoldMan': 965, 'JoyoPlayer': 0, 'YueShi': 965, 'Finneas': 950, 'Yuchun': 230, 'Zheng': 1440, 'RaphaelPlayer': 2385})
player [EvanPlayer] gets hole card ['C9', 'H7'], current stack 1065
player [ZifengFoldMan] gets hole card ['HA', 'HT'], current stack 965
player [YueShi] gets hole card ['SQ', 'SK'], current stack 965
player [Finneas] gets hole card ['D3', 'CJ'], current stack 945
player [Yuchun] gets hole card ['H2', 'C2'], current stack 220
player [Zheng] gets hole card ['D2', 'C4'], current stack 1440
player [RaphaelPlayer] gets hole card ['DQ', 'SJ'], current stack 2385
Started the round 17
Street "preflop" started. (community card = [])
"Zheng" declared "call:10"
"RaphaelPlayer" declared "call:10"
"EvanPlayer" declared "raise:1065"
"ZifengFoldMan" declared "fold:0"
"YueShi" declared "fold:0"
"Finneas" declared "fold:0"
"Yuchun" declared "fold:0"
"Zheng" declared "fold:0"
"RaphaelPlayer" declared "fold:0"
"['EvanPlayer']" won the round 17 (stack = {'EvanPlayer': 1100, 'ZifengFoldMan': 965, 'JoyoPlayer': 0, 'YueShi': 965, 'Finneas': 945, 'Yuchun': 220, 'Zheng': 1430, 'RaphaelPlayer': 2375})
player [EvanPlayer] gets hole card ['D7', 'HK'], current stack 1100
player [ZifengFoldMan] gets hole card ['S5', 'DK'], current stack 965
player [YueShi] gets hole card ['D6', 'H9'], current stack 965
player [Finneas] gets hole card ['CQ', 'CT'], current stack 945
player [Yuchun] gets hole card ['CA', 'C3'], current stack 215
player [Zheng] gets hole card ['H5', 'C5'], current stack 1420
player [RaphaelPlayer] gets hole card ['S3', 'S4'], current stack 2375
Started the round 18
Street "preflop" started. (community card = [])
"RaphaelPlayer" declared "fold:0"
"EvanPlayer" declared "raise:1100"
"ZifengFoldMan" declared "fold:0"
"YueShi" declared "fold:0"
"Finneas" declared "fold:0"
"Yuchun" declared "fold:0"
"Zheng" declared "fold:0"
"['EvanPlayer']" won the round 18 (stack = {'EvanPlayer': 1115, 'ZifengFoldMan': 965, 'JoyoPlayer': 0, 'YueShi': 965, 'Finneas': 945, 'Yuchun': 215, 'Zheng': 1420, 'RaphaelPlayer': 2375})
player [EvanPlayer] gets hole card ['C8', 'H4'], current stack 1115
player [ZifengFoldMan] gets hole card ['C7', 'SQ'], current stack 965
player [YueShi] gets hole card ['H8', 'C9'], current stack 965
player [Finneas] gets hole card ['D7', 'DJ'], current stack 945
player [Yuchun] gets hole card ['D8', 'D2'], current stack 215
player [Zheng] gets hole card ['C6', 'S3'], current stack 1415
player [RaphaelPlayer] gets hole card ['H7', 'S8'], current stack 2365
Started the round 19
Street "preflop" started. (community card = [])
"EvanPlayer" declared "call:10"
"ZifengFoldMan" declared "fold:0"
"YueShi" declared "fold:0"
"Finneas" declared "call:10"
"Yuchun" declared "call:10"
"Zheng" declared "call:10"
"RaphaelPlayer" declared "fold:0"
Street "flop" started. (community card = ['HJ', 'C3', 'H6'])
"Zheng" declared "call:0"
"EvanPlayer" declared "fold:0"
"Finneas" declared "call:0"
"Yuchun" declared "call:0"
Street "turn" started. (community card = ['HJ', 'C3', 'H6', 'CT'])
"Zheng" declared "call:0"
"Finneas" declared "call:0"
"Yuchun" declared "call:0"
Street "river" started. (community card = ['HJ', 'C3', 'H6', 'CT', 'SK'])
"Zheng" declared "call:0"
"Finneas" declared "call:0"
"Yuchun" declared "call:0"
"['Zheng']" won the round 19 (stack = {'EvanPlayer': 1105, 'ZifengFoldMan': 965, 'JoyoPlayer': 0, 'YueShi': 965, 'Finneas': 935, 'Yuchun': 205, 'Zheng': 1460, 'RaphaelPlayer': 2365})
player [EvanPlayer] gets hole card ['H7', 'S2'], current stack 1095
player [ZifengFoldMan] gets hole card ['DA', 'HT'], current stack 965
player [YueShi] gets hole card ['H3', 'H6'], current stack 965
player [Finneas] gets hole card ['S8', 'DK'], current stack 935
player [Yuchun] gets hole card ['CK', 'SA'], current stack 205
player [Zheng] gets hole card ['C8', 'H4'], current stack 1460
player [RaphaelPlayer] gets hole card ['C4', 'DQ'], current stack 2360
Started the round 20
Street "preflop" started. (community card = [])
"ZifengFoldMan" declared "fold:0"
"YueShi" declared "fold:0"
"Finneas" declared "call:10"
"Yuchun" declared "call:10"
"Zheng" declared "call:10"
"RaphaelPlayer" declared "fold:0"
"EvanPlayer" declared "fold:10"
Street "flop" started. (community card = ['C9', 'S3', 'S7'])
"Finneas" declared "call:0"
"Yuchun" declared "call:0"
"Zheng" declared "call:0"
Street "turn" started. (community card = ['C9', 'S3', 'S7', 'DJ'])
"Finneas" declared "call:0"
"Yuchun" declared "call:0"
"Zheng" declared "call:0"
Street "river" started. (community card = ['C9', 'S3', 'S7', 'DJ', 'C6'])
"Finneas" declared "call:0"
"Yuchun" declared "call:0"
"Zheng" declared "call:0"
"['Yuchun']" won the round 20 (stack = {'EvanPlayer': 1095, 'ZifengFoldMan': 965, 'JoyoPlayer': 0, 'YueShi': 965, 'Finneas': 925, 'Yuchun': 240, 'Zheng': 1450, 'RaphaelPlayer': 2360})
player [EvanPlayer] gets hole card ['D3', 'S2'], current stack 1090
player [ZifengFoldMan] gets hole card ['C7', 'CA'], current stack 955
player [YueShi] gets hole card ['HT', 'H7'], current stack 965
player [Finneas] gets hole card ['C2', 'SJ'], current stack 925
player [Yuchun] gets hole card ['H8', 'CQ'], current stack 240
player [Zheng] gets hole card ['D2', 'C5'], current stack 1450
player [RaphaelPlayer] gets hole card ['CT', 'HK'], current stack 2360
Started the round 21
Street "preflop" started. (community card = [])
"YueShi" declared "fold:0"
"Finneas" declared "call:10"
"Yuchun" declared "call:10"
"Zheng" declared "call:10"
"RaphaelPlayer" declared "raise:30"
"EvanPlayer" declared "raise:1095"
"ZifengFoldMan" declared "fold:0"
"Finneas" declared "fold:0"
"Yuchun" declared "fold:0"
"Zheng" declared "fold:0"
"RaphaelPlayer" declared "fold:0"
"['EvanPlayer']" won the round 21 (stack = {'EvanPlayer': 1165, 'ZifengFoldMan': 955, 'JoyoPlayer': 0, 'YueShi': 965, 'Finneas': 915, 'Yuchun': 230, 'Zheng': 1440, 'RaphaelPlayer': 2330})
player [EvanPlayer] gets hole card ['HJ', 'C9'], current stack 1165
player [ZifengFoldMan] gets hole card ['D4', 'CT'], current stack 950
player [YueShi] gets hole card ['DK', 'CK'], current stack 955
player [Finneas] gets hole card ['HK', 'S2'], current stack 915
player [Yuchun] gets hole card ['H3', 'CA'], current stack 230
player [Zheng] gets hole card ['SJ', 'S8'], current stack 1440
player [RaphaelPlayer] gets hole card ['C2', 'D9'], current stack 2330
Started the round 22
Street "preflop" started. (community card = [])
"Finneas" declared "call:10"
"Yuchun" declared "call:10"
"Zheng" declared "call:10"
"RaphaelPlayer" declared "fold:0"
"EvanPlayer" declared "raise:1165"
"ZifengFoldMan" declared "fold:0"
"YueShi" declared "fold:0"
"Finneas" declared "fold:0"
"Yuchun" declared "fold:0"
"Zheng" declared "fold:0"
"['EvanPlayer']" won the round 22 (stack = {'EvanPlayer': 1210, 'ZifengFoldMan': 950, 'JoyoPlayer': 0, 'YueShi': 955, 'Finneas': 905, 'Yuchun': 220, 'Zheng': 1430, 'RaphaelPlayer': 2330})
player [EvanPlayer] gets hole card ['HT', 'C4'], current stack 1210
player [ZifengFoldMan] gets hole card ['C9', 'S9'], current stack 950
player [YueShi] gets hole card ['S3', 'D7'], current stack 950
player [Finneas] gets hole card ['CQ', 'HK'], current stack 895
player [Yuchun] gets hole card ['C7', 'H7'], current stack 220
player [Zheng] gets hole card ['HA', 'S2'], current stack 1430
player [RaphaelPlayer] gets hole card ['DT', 'SJ'], current stack 2330
Started the round 23
Street "preflop" started. (community card = [])
"Yuchun" declared "call:10"
"Zheng" declared "call:10"
"RaphaelPlayer" declared "call:10"
"EvanPlayer" declared "fold:10"
"ZifengFoldMan" declared "fold:0"
"YueShi" declared "fold:0"
"Finneas" declared "call:10"
Street "flop" started. (community card = ['HJ', 'S5', 'DQ'])
"Finneas" declared "call:0"
"Yuchun" declared "call:0"
"Zheng" declared "call:0"
"RaphaelPlayer" declared "call:0"
Street "turn" started. (community card = ['HJ', 'S5', 'DQ', 'CK'])
"Finneas" declared "call:0"
"Yuchun" declared "call:0"
"Zheng" declared "call:0"
"RaphaelPlayer" declared "call:0"
Street "river" started. (community card = ['HJ', 'S5', 'DQ', 'CK', 'C6'])
"Finneas" declared "call:0"
"Yuchun" declared "call:0"
"Zheng" declared "call:0"
"RaphaelPlayer" declared "call:0"
"['Finneas']" won the round 23 (stack = {'EvanPlayer': 1210, 'ZifengFoldMan': 950, 'JoyoPlayer': 0, 'YueShi': 950, 'Finneas': 940, 'Yuchun': 210, 'Zheng': 1420, 'RaphaelPlayer': 2320})
player [EvanPlayer] gets hole card ['HJ', 'SK'], current stack 1210
player [ZifengFoldMan] gets hole card ['S7', 'CT'], current stack 950
player [YueShi] gets hole card ['H9', 'HK'], current stack 950
player [Finneas] gets hole card ['HT', 'C8'], current stack 935
player [Yuchun] gets hole card ['D2', 'C2'], current stack 200
player [Zheng] gets hole card ['D3', 'S5'], current stack 1420
player [RaphaelPlayer] gets hole card ['H7', 'H5'], current stack 2320
Started the round 24
Street "preflop" started. (community card = [])
"Zheng" declared "call:10"
"RaphaelPlayer" declared "fold:0"
"EvanPlayer" declared "call:10"
"ZifengFoldMan" declared "fold:0"
"YueShi" declared "fold:0"
"Finneas" declared "call:10"
"Yuchun" declared "call:10"
Street "flop" started. (community card = ['D9', 'H3', 'H4'])
"Finneas" declared "call:0"
"Yuchun" declared "call:0"
"Zheng" declared "call:0"
"EvanPlayer" declared "fold:0"
Street "turn" started. (community card = ['D9', 'H3', 'H4', 'D4'])
"Finneas" declared "call:0"
"Yuchun" declared "call:0"
"Zheng" declared "call:0"
Street "river" started. (community card = ['D9', 'H3', 'H4', 'D4', 'D5'])
"Finneas" declared "call:0"
"Yuchun" declared "call:0"
"Zheng" declared "call:0"
"['Zheng']" won the round 24 (stack = {'EvanPlayer': 1200, 'ZifengFoldMan': 950, 'JoyoPlayer': 0, 'YueShi': 950, 'Finneas': 930, 'Yuchun': 200, 'Zheng': 1450, 'RaphaelPlayer': 2320})
player [EvanPlayer] gets hole card ['CT', 'D3'], current stack 1200
player [ZifengFoldMan] gets hole card ['C5', 'HQ'], current stack 950
player [YueShi] gets hole card ['SA', 'H7'], current stack 950
player [Finneas] gets hole card ['D8', 'DA'], current stack 930
player [Yuchun] gets hole card ['D7', 'C3'], current stack 195
player [Zheng] gets hole card ['C8', 'S6'], current stack 1440
player [RaphaelPlayer] gets hole card ['CQ', 'C9'], current stack 2320
Started the round 25
Street "preflop" started. (community card = [])
"RaphaelPlayer" declared "call:10"
"EvanPlayer" declared "fold:10"
"ZifengFoldMan" declared "fold:0"
"YueShi" declared "fold:0"
"Finneas" declared "call:10"
"Yuchun" declared "call:10"
"Zheng" declared "call:10"
Street "flop" started. (community card = ['H8', 'SQ', 'C6'])
"Yuchun" declared "call:0"
"Zheng" declared "call:0"
"RaphaelPlayer" declared "raise:50"
"Finneas" declared "fold:0"
"Yuchun" declared "fold:0"
"Zheng" declared "raise:770"
"RaphaelPlayer" declared "call:770"
Street "turn" started. (community card = ['H8', 'SQ', 'C6', 'C7'])
"Zheng" declared "call:0"
"RaphaelPlayer" declared "raise:1540"
"Zheng" declared "fold:0"
"['RaphaelPlayer']" won the round 25 (stack = {'EvanPlayer': 1200, 'ZifengFoldMan': 950, 'JoyoPlayer': 0, 'YueShi': 950, 'Finneas': 920, 'Yuchun': 190, 'Zheng': 670, 'RaphaelPlayer': 3120})
player [EvanPlayer] gets hole card ['HQ', 'HJ'], current stack 1200
player [ZifengFoldMan] gets hole card ['S9', 'S5'], current stack 950
player [YueShi] gets hole card ['H8', 'D9'], current stack 950
player [Finneas] gets hole card ['HK', 'HA'], current stack 920
player [Yuchun] gets hole card ['DQ', 'D3'], current stack 190
player [Zheng] gets hole card ['DK', 'H3'], current stack 665
player [RaphaelPlayer] gets hole card ['S2', 'CK'], current stack 3110
Started the round 26
Street "preflop" started. (community card = [])
"EvanPlayer" declared "raise:1200"
"ZifengFoldMan" declared "fold:0"
"YueShi" declared "fold:0"
"Finneas" declared "fold:0"
"Yuchun" declared "fold:0"
"Zheng" declared "fold:0"
"RaphaelPlayer" declared "fold:0"
"['EvanPlayer']" won the round 26 (stack = {'EvanPlayer': 1215, 'ZifengFoldMan': 950, 'JoyoPlayer': 0, 'YueShi': 950, 'Finneas': 920, 'Yuchun': 190, 'Zheng': 665, 'RaphaelPlayer': 3110})
player [EvanPlayer] gets hole card ['C7', 'H9'], current stack 1205
player [ZifengFoldMan] gets hole card ['C2', 'C8'], current stack 950
player [YueShi] gets hole card ['C5', 'H6'], current stack 950
player [Finneas] gets hole card ['CT', 'CQ'], current stack 920
player [Yuchun] gets hole card ['HJ', 'D9'], current stack 190
player [Zheng] gets hole card ['HQ', 'H2'], current stack 665
player [RaphaelPlayer] gets hole card ['SA', 'HA'], current stack 3105
Started the round 27
Street "preflop" started. (community card = [])
"ZifengFoldMan" declared "fold:0"
"YueShi" declared "fold:0"
"Finneas" declared "call:10"
"Yuchun" declared "call:10"
"Zheng" declared "call:10"
"RaphaelPlayer" declared "raise:40"
"EvanPlayer" declared "fold:40"
"Finneas" declared "fold:0"
"Yuchun" declared "call:40"
"Zheng" declared "call:40"
Street "flop" started. (community card = ['S6', 'DJ', 'D3'])
"RaphaelPlayer" declared "raise:150"
"Yuchun" declared "call:150"
"Zheng" declared "call:150"
Street "turn" started. (community card = ['S6', 'DJ', 'D3', 'SJ'])
"RaphaelPlayer" declared "raise:600"
"Zheng" declared "fold:0"
Street "river" started. (community card = ['S6', 'DJ', 'D3', 'SJ', 'CK'])
"['Yuchun']" won the round 27 (stack = {'EvanPlayer': 1205, 'ZifengFoldMan': 950, 'JoyoPlayer': 0, 'YueShi': 950, 'Finneas': 910, 'Yuchun': 590, 'Zheng': 475, 'RaphaelPlayer': 2920})
player [EvanPlayer] gets hole card ['CJ', 'S7'], current stack 1200
player [ZifengFoldMan] gets hole card ['SA', 'H2'], current stack 940
player [YueShi] gets hole card ['D7', 'D3'], current stack 950
player [Finneas] gets hole card ['C4', 'H4'], current stack 910
player [Yuchun] gets hole card ['S9', 'CK'], current stack 590
player [Zheng] gets hole card ['CT', 'H3'], current stack 475
player [RaphaelPlayer] gets hole card ['SK', 'CQ'], current stack 2920
Started the round 28
Street "preflop" started. (community card = [])
"YueShi" declared "fold:0"
"Finneas" declared "call:10"
"Yuchun" declared "call:10"
"Zheng" declared "call:10"
"RaphaelPlayer" declared "raise:30"
"EvanPlayer" declared "call:30"
"ZifengFoldMan" declared "fold:0"
"Finneas" declared "fold:0"
"Yuchun" declared "call:30"
"Zheng" declared "call:30"
Street "flop" started. (community card = ['D2', 'S2', 'H6'])
"EvanPlayer" declared "fold:0"
"Yuchun" declared "call:0"
"Zheng" declared "call:0"
"RaphaelPlayer" declared "call:0"
Street "turn" started. (community card = ['D2', 'S2', 'H6', 'HA'])
"Yuchun" declared "call:0"
"Zheng" declared "call:0"
"RaphaelPlayer" declared "call:0"
Street "river" started. (community card = ['D2', 'S2', 'H6', 'HA', 'ST'])
"Yuchun" declared "call:0"
"Zheng" declared "call:0"
"RaphaelPlayer" declared "call:0"
"['Zheng']" won the round 28 (stack = {'EvanPlayer': 1175, 'ZifengFoldMan': 940, 'JoyoPlayer': 0, 'YueShi': 950, 'Finneas': 900, 'Yuchun': 560, 'Zheng': 585, 'RaphaelPlayer': 2890})
player [EvanPlayer] gets hole card ['SQ', 'C6'], current stack 1175
player [ZifengFoldMan] gets hole card ['S5', 'DT'], current stack 935
player [YueShi] gets hole card ['HK', 'D9'], current stack 940
player [Finneas] gets hole card ['DQ', 'HT'], current stack 900
player [Yuchun] gets hole card ['C5', 'S8'], current stack 560
player [Zheng] gets hole card ['HA', 'H2'], current stack 585
player [RaphaelPlayer] gets hole card ['D7', 'C8'], current stack 2890
Started the round 29
Street "preflop" started. (community card = [])
"Finneas" declared "call:10"
"Yuchun" declared "call:10"
"Zheng" declared "call:10"
"RaphaelPlayer" declared "fold:0"
"EvanPlayer" declared "call:10"
"ZifengFoldMan" declared "fold:0"
"YueShi" declared "fold:0"
Street "flop" started. (community card = ['D5', 'S7', 'C4'])
"Finneas" declared "call:0"
"Yuchun" declared "call:0"
"Zheng" declared "call:0"
"EvanPlayer" declared "call:0"
Street "turn" started. (community card = ['D5', 'S7', 'C4', 'S4'])
"Finneas" declared "call:0"
"Yuchun" declared "call:0"
"Zheng" declared "call:0"
"EvanPlayer" declared "fold:0"
Street "river" started. (community card = ['D5', 'S7', 'C4', 'S4', 'C2'])
"Finneas" declared "call:0"
"Yuchun" declared "call:0"
"Zheng" declared "call:0"
"['Yuchun']" won the round 29 (stack = {'EvanPlayer': 1165, 'ZifengFoldMan': 935, 'JoyoPlayer': 0, 'YueShi': 940, 'Finneas': 890, 'Yuchun': 605, 'Zheng': 575, 'RaphaelPlayer': 2890})
player [EvanPlayer] gets hole card ['C8', 'C5'], current stack 1165
player [ZifengFoldMan] gets hole card ['S2', 'S4'], current stack 935
player [YueShi] gets hole card ['S7', 'H7'], current stack 935
player [Finneas] gets hole card ['H2', 'CK'], current stack 880
player [Yuchun] gets hole card ['D9', 'DQ'], current stack 605
player [Zheng] gets hole card ['D5', 'C4'], current stack 575
player [RaphaelPlayer] gets hole card ['S9', 'HJ'], current stack 2890
Started the round 30
Street "preflop" started. (community card = [])
"Yuchun" declared "call:10"
"Zheng" declared "call:10"
"RaphaelPlayer" declared "call:10"
"EvanPlayer" declared "call:10"
"ZifengFoldMan" declared "fold:0"
"YueShi" declared "fold:0"
"Finneas" declared "call:10"
Street "flop" started. (community card = ['CA', 'HQ', 'D4'])
"Finneas" declared "call:0"
"Yuchun" declared "call:0"
"Zheng" declared "call:0"
"RaphaelPlayer" declared "call:0"
"EvanPlayer" declared "fold:0"
Street "turn" started. (community card = ['CA', 'HQ', 'D4', 'S6'])
"Finneas" declared "call:0"
"Yuchun" declared "call:0"
"Zheng" declared "call:0"
"RaphaelPlayer" declared "call:0"
Street "river" started. (community card = ['CA', 'HQ', 'D4', 'S6', 'D7'])
"Finneas" declared "call:0"
"Yuchun" declared "call:0"
"Zheng" declared "call:0"
"RaphaelPlayer" declared "call:0"
"['Yuchun']" won the round 30 (stack = {'EvanPlayer': 1155, 'ZifengFoldMan': 935, 'JoyoPlayer': 0, 'YueShi': 935, 'Finneas': 880, 'Yuchun': 650, 'Zheng': 565, 'RaphaelPlayer': 2880})
player [EvanPlayer] gets hole card ['H6', 'C3'], current stack 1155
player [ZifengFoldMan] gets hole card ['HT', 'SQ'], current stack 935
player [YueShi] gets hole card ['DQ', 'CJ'], current stack 935
player [Finneas] gets hole card ['H7', 'SJ'], current stack 875
player [Yuchun] gets hole card ['DK', 'D9'], current stack 640
player [Zheng] gets hole card ['CK', 'H8'], current stack 565
player [RaphaelPlayer] gets hole card ['S8', 'S5'], current stack 2880
Started the round 31
Street "preflop" started. (community card = [])
"Zheng" declared "call:10"
"RaphaelPlayer" declared "fold:0"
"EvanPlayer" declared "raise:1155"
"ZifengFoldMan" declared "fold:0"
"YueShi" declared "fold:0"
"Finneas" declared "fold:0"
"Yuchun" declared "fold:0"
"Zheng" declared "fold:0"
"['EvanPlayer']" won the round 31 (stack = {'EvanPlayer': 1180, 'ZifengFoldMan': 935, 'JoyoPlayer': 0, 'YueShi': 935, 'Finneas': 875, 'Yuchun': 640, 'Zheng': 555, 'RaphaelPlayer': 2880})
player [EvanPlayer] gets hole card ['C8', 'C2'], current stack 1180
player [ZifengFoldMan] gets hole card ['DQ', 'SJ'], current stack 935
player [YueShi] gets hole card ['D7', 'H5'], current stack 935
player [Finneas] gets hole card ['CT', 'H4'], current stack 875
player [Yuchun] gets hole card ['ST', 'SA'], current stack 635
player [Zheng] gets hole card ['S9', 'S5'], current stack 545
player [RaphaelPlayer] gets hole card ['S7', 'D2'], current stack 2880
Started the round 32
Street "preflop" started. (community card = [])
"RaphaelPlayer" declared "fold:0"
"EvanPlayer" declared "fold:10"
"ZifengFoldMan" declared "fold:0"
"YueShi" declared "fold:0"
"Finneas" declared "call:10"
"Yuchun" declared "call:10"
"Zheng" declared "call:10"
Street "flop" started. (community card = ['D9', 'SQ', 'HQ'])
"Yuchun" declared "call:0"
"Zheng" declared "call:0"
"Finneas" declared "call:0"
Street "turn" started. (community card = ['D9', 'SQ', 'HQ', 'C7'])
"Yuchun" declared "call:0"
"Zheng" declared "call:0"
"Finneas" declared "call:0"
Street "river" started. (community card = ['D9', 'SQ', 'HQ', 'C7', 'DT'])
"Yuchun" declared "raise:40"
"Zheng" declared "call:40"
"Finneas" declared "fold:0"
"['Yuchun']" won the round 32 (stack = {'EvanPlayer': 1180, 'ZifengFoldMan': 935, 'JoyoPlayer': 0, 'YueShi': 935, 'Finneas': 865, 'Yuchun': 700, 'Zheng': 505, 'RaphaelPlayer': 2880})
player [EvanPlayer] gets hole card ['H8', 'HJ'], current stack 1180
player [ZifengFoldMan] gets hole card ['DK', 'DQ'], current stack 935
player [YueShi] gets hole card ['S9', 'SA'], current stack 935
player [Finneas] gets hole card ['C6', 'HT'], current stack 865
player [Yuchun] gets hole card ['D9', 'D5'], current stack 700
player [Zheng] gets hole card ['D6', 'SK'], current stack 500
player [RaphaelPlayer] gets hole card ['S5', 'CT'], current stack 2870
Started the round 33
Street "preflop" started. (community card = [])
"EvanPlayer" declared "call:10"
"ZifengFoldMan" declared "fold:0"
"YueShi" declared "fold:0"
"Finneas" declared "call:10"
"Yuchun" declared "call:10"
"Zheng" declared "call:10"
"RaphaelPlayer" declared "fold:0"
Street "flop" started. (community card = ['C7', 'S6', 'CQ'])
"Zheng" declared "call:0"
"EvanPlayer" declared "raise:1170"
"Finneas" declared "fold:0"
"Yuchun" declared "fold:0"
"Zheng" declared "fold:0"
"['EvanPlayer']" won the round 33 (stack = {'EvanPlayer': 1220, 'ZifengFoldMan': 935, 'JoyoPlayer': 0, 'YueShi': 935, 'Finneas': 855, 'Yuchun': 690, 'Zheng': 495, 'RaphaelPlayer': 2870})
player [EvanPlayer] gets hole card ['DT', 'D8'], current stack 1210
player [ZifengFoldMan] gets hole card ['C7', 'CK'], current stack 935
player [YueShi] gets hole card ['H4', 'DJ'], current stack 935
player [Finneas] gets hole card ['D7', 'D6'], current stack 855
player [Yuchun] gets hole card ['S5', 'D2'], current stack 690
player [Zheng] gets hole card ['H5', 'S9'], current stack 495
player [RaphaelPlayer] gets hole card ['S3', 'CA'], current stack 2865
Started the round 34
Street "preflop" started. (community card = [])
"ZifengFoldMan" declared "fold:0"
"YueShi" declared "fold:0"
"Finneas" declared "call:10"
"Yuchun" declared "call:10"
"Zheng" declared "call:10"
"RaphaelPlayer" declared "call:10"
"EvanPlayer" declared "call:10"
Street "flop" started. (community card = ['DQ', 'C3', 'HK'])
"RaphaelPlayer" declared "call:0"
"EvanPlayer" declared "fold:0"
"Finneas" declared "call:0"
"Yuchun" declared "call:0"
"Zheng" declared "call:0"
Street "turn" started. (community card = ['DQ', 'C3', 'HK', 'CT'])
"RaphaelPlayer" declared "call:0"
"Finneas" declared "call:0"
"Yuchun" declared "call:0"
"Zheng" declared "call:0"
Street "river" started. (community card = ['DQ', 'C3', 'HK', 'CT', 'SJ'])
"RaphaelPlayer" declared "raise:60"
"Finneas" declared "fold:0"
"Yuchun" declared "fold:0"
"Zheng" declared "call:60"
"['RaphaelPlayer']" won the round 34 (stack = {'EvanPlayer': 1210, 'ZifengFoldMan': 935, 'JoyoPlayer': 0, 'YueShi': 935, 'Finneas': 845, 'Yuchun': 680, 'Zheng': 425, 'RaphaelPlayer': 2970})
player [EvanPlayer] gets hole card ['D2', 'C3'], current stack 1205
player [ZifengFoldMan] gets hole card ['CQ', 'D7'], current stack 925
player [YueShi] gets hole card ['DQ', 'S5'], current stack 935
player [Finneas] gets hole card ['S4', 'CT'], current stack 845
player [Yuchun] gets hole card ['D5', 'S6'], current stack 680
player [Zheng] gets hole card ['HJ', 'HA'], current stack 425
player [RaphaelPlayer] gets hole card ['H3', 'H8'], current stack 2970
Started the round 35
Street "preflop" started. (community card = [])
"YueShi" declared "fold:0"
"Finneas" declared "call:10"
"Yuchun" declared "call:10"
"Zheng" declared "call:10"
"RaphaelPlayer" declared "fold:0"
"EvanPlayer" declared "fold:10"
"ZifengFoldMan" declared "fold:0"
Street "flop" started. (community card = ['S7', 'D9', 'H2'])
"Finneas" declared "call:0"
"Yuchun" declared "call:0"
"Zheng" declared "call:0"
Street "turn" started. (community card = ['S7', 'D9', 'H2', 'D8'])
"Finneas" declared "call:0"
"Yuchun" declared "raise:670"
"Zheng" declared "fold:0"
"Finneas" declared "fold:0"
"['Yuchun']" won the round 35 (stack = {'EvanPlayer': 1205, 'ZifengFoldMan': 925, 'JoyoPlayer': 0, 'YueShi': 935, 'Finneas': 835, 'Yuchun': 715, 'Zheng': 415, 'RaphaelPlayer': 2970})
player [EvanPlayer] gets hole card ['DJ', 'HA'], current stack 1205
player [ZifengFoldMan] gets hole card ['HK', 'S7'], current stack 920
player [YueShi] gets hole card ['D7', 'SQ'], current stack 925
player [Finneas] gets hole card ['D6', 'D2'], current stack 835
player [Yuchun] gets hole card ['CQ', 'HQ'], current stack 715
player [Zheng] gets hole card ['CA', 'C6'], current stack 415
player [RaphaelPlayer] gets hole card ['S6', 'DA'], current stack 2970
Started the round 36
Street "preflop" started. (community card = [])
"Finneas" declared "call:10"
"Yuchun" declared "call:10"
"Zheng" declared "call:10"
"RaphaelPlayer" declared "call:10"
"EvanPlayer" declared "raise:1205"
"ZifengFoldMan" declared "fold:0"
"YueShi" declared "fold:0"
"Finneas" declared "fold:0"
"Yuchun" declared "fold:0"
"Zheng" declared "fold:0"
"RaphaelPlayer" declared "fold:0"
"['EvanPlayer']" won the round 36 (stack = {'EvanPlayer': 1260, 'ZifengFoldMan': 920, 'JoyoPlayer': 0, 'YueShi': 925, 'Finneas': 825, 'Yuchun': 705, 'Zheng': 405, 'RaphaelPlayer': 2960})
player [EvanPlayer] gets hole card ['HJ', 'H8'], current stack 1260
player [ZifengFoldMan] gets hole card ['D7', 'HT'], current stack 920
player [YueShi] gets hole card ['SA', 'CQ'], current stack 920
player [Finneas] gets hole card ['D6', 'CA'], current stack 815
player [Yuchun] gets hole card ['SQ', 'HQ'], current stack 705
player [Zheng] gets hole card ['D2', 'H4'], current stack 405
player [RaphaelPlayer] gets hole card ['SK', 'H6'], current stack 2960
Started the round 37
Street "preflop" started. (community card = [])
"Yuchun" declared "call:10"
"Zheng" declared "call:10"
"RaphaelPlayer" declared "fold:0"
"EvanPlayer" declared "call:10"
"ZifengFoldMan" declared "fold:0"
"YueShi" declared "fold:0"
"Finneas" declared "call:10"
Street "flop" started. (community card = ['D3', 'C6', 'S9'])
"Finneas" declared "call:0"
"Yuchun" declared "call:0"
"Zheng" declared "call:0"
"EvanPlayer" declared "fold:0"
Street "turn" started. (community card = ['D3', 'C6', 'S9', 'C8'])
"Finneas" declared "call:0"
"Yuchun" declared "call:0"
"Zheng" declared "call:0"
Street "river" started. (community card = ['D3', 'C6', 'S9', 'C8', 'D5'])
"Finneas" declared "call:0"
"Yuchun" declared "call:0"
"Zheng" declared "call:0"
"['Zheng']" won the round 37 (stack = {'EvanPlayer': 1250, 'ZifengFoldMan': 920, 'JoyoPlayer': 0, 'YueShi': 920, 'Finneas': 815, 'Yuchun': 695, 'Zheng': 440, 'RaphaelPlayer': 2960})
player [EvanPlayer] gets hole card ['D4', 'CK'], current stack 1250
player [ZifengFoldMan] gets hole card ['H6', 'SK'], current stack 920
player [YueShi] gets hole card ['S3', 'S5'], current stack 920
player [Finneas] gets hole card ['S7', 'D7'], current stack 810
player [Yuchun] gets hole card ['H3', 'D3'], current stack 685
player [Zheng] gets hole card ['DJ', 'S2'], current stack 440
player [RaphaelPlayer] gets hole card ['C6', 'HQ'], current stack 2960
Started the round 38
Street "preflop" started. (community card = [])
"Zheng" declared "call:10"
"RaphaelPlayer" declared "call:10"
"EvanPlayer" declared "call:10"
"ZifengFoldMan" declared "fold:0"
"YueShi" declared "fold:0"
"Finneas" declared "call:10"
"Yuchun" declared "call:10"
Street "flop" started. (community card = ['DA', 'H7', 'H4'])
"Finneas" declared "raise:407"
"Yuchun" declared "fold:0"
"Zheng" declared "fold:0"
"RaphaelPlayer" declared "fold:0"
"EvanPlayer" declared "fold:407"
"['Finneas']" won the round 38 (stack = {'EvanPlayer': 1240, 'ZifengFoldMan': 920, 'JoyoPlayer': 0, 'YueShi': 920, 'Finneas': 855, 'Yuchun': 685, 'Zheng': 430, 'RaphaelPlayer': 2950})
player [EvanPlayer] gets hole card ['ST', 'DT'], current stack 1240
player [ZifengFoldMan] gets hole card ['S6', 'C9'], current stack 920
player [YueShi] gets hole card ['D7', 'H8'], current stack 920
player [Finneas] gets hole card ['C2', 'H9'], current stack 855
player [Yuchun] gets hole card ['H5', 'S9'], current stack 680
player [Zheng] gets hole card ['DA', 'C8'], current stack 420
player [RaphaelPlayer] gets hole card ['C6', 'H7'], current stack 2950
Started the round 39
Street "preflop" started. (community card = [])
"RaphaelPlayer" declared "fold:0"
"EvanPlayer" declared "raise:1240"
"ZifengFoldMan" declared "fold:0"
"YueShi" declared "fold:0"
"Finneas" declared "fold:0"
"Yuchun" declared "fold:0"
"Zheng" declared "fold:0"
"['EvanPlayer']" won the round 39 (stack = {'EvanPlayer': 1255, 'ZifengFoldMan': 920, 'JoyoPlayer': 0, 'YueShi': 920, 'Finneas': 855, 'Yuchun': 680, 'Zheng': 420, 'RaphaelPlayer': 2950})
player [EvanPlayer] gets hole card ['DQ', 'D6'], current stack 1255
player [ZifengFoldMan] gets hole card ['C5', 'CA'], current stack 920
player [YueShi] gets hole card ['DA', 'HQ'], current stack 920
player [Finneas] gets hole card ['C7', 'S2'], current stack 855
player [Yuchun] gets hole card ['DT', 'CK'], current stack 680
player [Zheng] gets hole card ['D7', 'SQ'], current stack 415
player [RaphaelPlayer] gets hole card ['CJ', 'S4'], current stack 2940
Started the round 40
Street "preflop" started. (community card = [])
"EvanPlayer" declared "call:10"
"ZifengFoldMan" declared "fold:0"
"YueShi" declared "fold:0"
"Finneas" declared "call:10"
"Yuchun" declared "call:10"
"Zheng" declared "call:10"
"RaphaelPlayer" declared "fold:0"
Street "flop" started. (community card = ['D4', 'H8', 'H6'])
"Zheng" declared "call:0"
"EvanPlayer" declared "fold:0"
"Finneas" declared "call:0"
"Yuchun" declared "call:0"
Street "turn" started. (community card = ['D4', 'H8', 'H6', 'H2'])
"Zheng" declared "call:0"
"Finneas" declared "call:0"
"Yuchun" declared "call:0"
Street "river" started. (community card = ['D4', 'H8', 'H6', 'H2', 'DJ'])
"Zheng" declared "call:0"
"Finneas" declared "call:0"
"Yuchun" declared "call:0"
"['Finneas']" won the round 40 (stack = {'EvanPlayer': 1245, 'ZifengFoldMan': 920, 'JoyoPlayer': 0, 'YueShi': 920, 'Finneas': 895, 'Yuchun': 670, 'Zheng': 410, 'RaphaelPlayer': 2940})
player [EvanPlayer] gets hole card ['DT', 'CA'], current stack 1235
player [ZifengFoldMan] gets hole card ['C9', 'S4'], current stack 920
player [YueShi] gets hole card ['DK', 'DQ'], current stack 920
player [Finneas] gets hole card ['S2', 'CQ'], current stack 895
player [Yuchun] gets hole card ['SQ', 'SK'], current stack 670
player [Zheng] gets hole card ['S8', 'D9'], current stack 410
player [RaphaelPlayer] gets hole card ['H5', 'D7'], current stack 2935
Started the round 41
Street "preflop" started. (community card = [])
"ZifengFoldMan" declared "fold:0"
"YueShi" declared "fold:0"
"Finneas" declared "call:10"
"Yuchun" declared "fold:0"
"Zheng" declared "call:10"
"RaphaelPlayer" declared "fold:0"
"EvanPlayer" declared "raise:1245"
"Finneas" declared "fold:0"
"Zheng" declared "fold:0"
"['EvanPlayer']" won the round 41 (stack = {'EvanPlayer': 1270, 'ZifengFoldMan': 920, 'JoyoPlayer': 0, 'YueShi': 920, 'Finneas': 885, 'Yuchun': 670, 'Zheng': 400, 'RaphaelPlayer': 2935})
player [EvanPlayer] gets hole card ['ST', 'S8'], current stack 1265
player [ZifengFoldMan] gets hole card ['D4', 'HA'], current stack 910
player [YueShi] gets hole card ['H9', 'H7'], current stack 920
player [Finneas] gets hole card ['HT', 'CT'], current stack 885
player [Yuchun] gets hole card ['S6', 'HK'], current stack 670
player [Zheng] gets hole card ['D5', 'DK'], current stack 400
player [RaphaelPlayer] gets hole card ['C6', 'S2'], current stack 2935
Started the round 42
Street "preflop" started. (community card = [])
"YueShi" declared "fold:0"
"Finneas" declared "call:10"
"Yuchun" declared "fold:0"
"Zheng" declared "call:10"
"RaphaelPlayer" declared "fold:0"
"EvanPlayer" declared "call:10"
"ZifengFoldMan" declared "fold:0"
Street "flop" started. (community card = ['DA', 'SA', 'HJ'])
"EvanPlayer" declared "fold:0"
"Finneas" declared "call:0"
"Zheng" declared "call:0"
Street "turn" started. (community card = ['DA', 'SA', 'HJ', 'C3'])
"Finneas" declared "call:0"
"Zheng" declared "call:0"
Street "river" started. (community card = ['DA', 'SA', 'HJ', 'C3', 'CJ'])
"Finneas" declared "call:0"
"Zheng" declared "call:0"
"['Zheng']" won the round 42 (stack = {'EvanPlayer': 1260, 'ZifengFoldMan': 910, 'JoyoPlayer': 0, 'YueShi': 920, 'Finneas': 875, 'Yuchun': 670, 'Zheng': 430, 'RaphaelPlayer': 2935})
player [EvanPlayer] gets hole card ['S2', 'S9'], current stack 1260
player [ZifengFoldMan] gets hole card ['SJ', 'HQ'], current stack 905
player [YueShi] gets hole card ['C6', 'C5'], current stack 910
player [Finneas] gets hole card ['C2', 'D4'], current stack 875
player [Yuchun] gets hole card ['D8', 'H2'], current stack 670
player [Zheng] gets hole card ['CK', 'ST'], current stack 430
player [RaphaelPlayer] gets hole card ['S7', 'H4'], current stack 2935
Started the round 43
Street "preflop" started. (community card = [])
"Finneas" declared "call:10"
"Yuchun" declared "fold:0"
"Zheng" declared "call:10"
"RaphaelPlayer" declared "fold:0"
"EvanPlayer" declared "call:10"
"ZifengFoldMan" declared "fold:0"
"YueShi" declared "fold:0"
Street "flop" started. (community card = ['S3', 'SA', 'CA'])
"Finneas" declared "call:0"
"Zheng" declared "call:0"
"EvanPlayer" declared "call:0"
Street "turn" started. (community card = ['S3', 'SA', 'CA', 'CT'])
"Finneas" declared "call:0"
"Zheng" declared "call:0"
"EvanPlayer" declared "fold:0"
Street "river" started. (community card = ['S3', 'SA', 'CA', 'CT', 'SQ'])
"Finneas" declared "call:0"
"Zheng" declared "call:0"
"['Zheng']" won the round 43 (stack = {'EvanPlayer': 1250, 'ZifengFoldMan': 905, 'JoyoPlayer': 0, 'YueShi': 910, 'Finneas': 865, 'Yuchun': 670, 'Zheng': 465, 'RaphaelPlayer': 2935})
player [EvanPlayer] gets hole card ['CK', 'S4'], current stack 1250
player [ZifengFoldMan] gets hole card ['H8', 'S3'], current stack 905
player [YueShi] gets hole card ['ST', 'HK'], current stack 905
player [Finneas] gets hole card ['HA', 'S5'], current stack 855
player [Yuchun] gets hole card ['D6', 'SA'], current stack 670
player [Zheng] gets hole card ['H5', 'C8'], current stack 465
player [RaphaelPlayer] gets hole card ['DK', 'C4'], current stack 2935
Started the round 44
Street "preflop" started. (community card = [])
"Yuchun" declared "fold:0"
"Zheng" declared "call:10"
"RaphaelPlayer" declared "fold:0"
"EvanPlayer" declared "call:10"
"ZifengFoldMan" declared "fold:0"
"YueShi" declared "fold:0"
"Finneas" declared "call:10"
Street "flop" started. (community card = ['S7', 'H3', 'CJ'])
"Finneas" declared "call:0"
"Zheng" declared "call:0"
"EvanPlayer" declared "fold:0"
Street "turn" started. (community card = ['S7', 'H3', 'CJ', 'DA'])
"Finneas" declared "call:0"
"Zheng" declared "call:0"
Street "river" started. (community card = ['S7', 'H3', 'CJ', 'DA', 'C5'])
"Finneas" declared "call:0"
"Zheng" declared "call:0"
"['Finneas']" won the round 44 (stack = {'EvanPlayer': 1240, 'ZifengFoldMan': 905, 'JoyoPlayer': 0, 'YueShi': 905, 'Finneas': 890, 'Yuchun': 670, 'Zheng': 455, 'RaphaelPlayer': 2935})
player [EvanPlayer] gets hole card ['D4', 'C2'], current stack 1240
player [ZifengFoldMan] gets hole card ['D6', 'H7'], current stack 905
player [YueShi] gets hole card ['CA', 'SA'], current stack 905
player [Finneas] gets hole card ['S4', 'H5'], current stack 885
player [Yuchun] gets hole card ['HQ', 'S9'], current stack 660
player [Zheng] gets hole card ['C7', 'C9'], current stack 455
player [RaphaelPlayer] gets hole card ['D3', 'SJ'], current stack 2935
Started the round 45
Street "preflop" started. (community card = [])
"Zheng" declared "call:10"
"RaphaelPlayer" declared "fold:0"
"EvanPlayer" declared "fold:10"
"ZifengFoldMan" declared "fold:0"
"YueShi" declared "fold:0"
"Finneas" declared "call:10"
"Yuchun" declared "fold:0"
Street "flop" started. (community card = ['H9', 'CK', 'D7'])
"Finneas" declared "call:0"
"Zheng" declared "raise:227"
"Finneas" declared "fold:0"
"['Zheng']" won the round 45 (stack = {'EvanPlayer': 1240, 'ZifengFoldMan': 905, 'JoyoPlayer': 0, 'YueShi': 905, 'Finneas': 880, 'Yuchun': 660, 'Zheng': 475, 'RaphaelPlayer': 2935})
player [EvanPlayer] gets hole card ['C9', 'CT'], current stack 1240
player [ZifengFoldMan] gets hole card ['SK', 'HJ'], current stack 905
player [YueShi] gets hole card ['D6', 'S7'], current stack 905
player [Finneas] gets hole card ['C2', 'DQ'], current stack 880
player [Yuchun] gets hole card ['C8', 'D5'], current stack 655
player [Zheng] gets hole card ['D3', 'H4'], current stack 465
player [RaphaelPlayer] gets hole card ['C7', 'H8'], current stack 2935
Started the round 46
Street "preflop" started. (community card = [])
"RaphaelPlayer" declared "fold:0"
"EvanPlayer" declared "raise:1240"
"ZifengFoldMan" declared "fold:0"
"YueShi" declared "fold:0"
"Finneas" declared "fold:0"
"Yuchun" declared "fold:0"
"Zheng" declared "fold:0"
"['EvanPlayer']" won the round 46 (stack = {'EvanPlayer': 1255, 'ZifengFoldMan': 905, 'JoyoPlayer': 0, 'YueShi': 905, 'Finneas': 880, 'Yuchun': 655, 'Zheng': 465, 'RaphaelPlayer': 2935})
player [EvanPlayer] gets hole card ['D8', 'C4'], current stack 1255
player [ZifengFoldMan] gets hole card ['S5', 'CA'], current stack 905
player [YueShi] gets hole card ['C5', 'D3'], current stack 905
player [Finneas] gets hole card ['S4', 'SQ'], current stack 880
player [Yuchun] gets hole card ['H9', 'D6'], current stack 655
player [Zheng] gets hole card ['H7', 'SA'], current stack 460
player [RaphaelPlayer] gets hole card ['HK', 'DT'], current stack 2925
Started the round 47
Street "preflop" started. (community card = [])
"EvanPlayer" declared "fold:10"
"ZifengFoldMan" declared "fold:0"
"YueShi" declared "fold:0"
"Finneas" declared "call:10"
"Yuchun" declared "fold:0"
"Zheng" declared "call:10"
"RaphaelPlayer" declared "call:10"
Street "flop" started. (community card = ['D2', 'H6', 'D7'])
"Zheng" declared "call:0"
"RaphaelPlayer" declared "call:0"
"Finneas" declared "call:0"
Street "turn" started. (community card = ['D2', 'H6', 'D7', 'S6'])
"Zheng" declared "call:0"
"RaphaelPlayer" declared "call:0"
"Finneas" declared "call:0"
Street "river" started. (community card = ['D2', 'H6', 'D7', 'S6', 'SJ'])
"Zheng" declared "call:0"
"RaphaelPlayer" declared "call:0"
"Finneas" declared "call:0"
"['Zheng']" won the round 47 (stack = {'EvanPlayer': 1255, 'ZifengFoldMan': 905, 'JoyoPlayer': 0, 'YueShi': 905, 'Finneas': 870, 'Yuchun': 655, 'Zheng': 485, 'RaphaelPlayer': 2925})
player [EvanPlayer] gets hole card ['H7', 'HJ'], current stack 1245
player [ZifengFoldMan] gets hole card ['C6', 'C7'], current stack 905
player [YueShi] gets hole card ['HA', 'H8'], current stack 905
player [Finneas] gets hole card ['H5', 'HK'], current stack 870
player [Yuchun] gets hole card ['DQ', 'CA'], current stack 655
player [Zheng] gets hole card ['S6', 'H4'], current stack 485
player [RaphaelPlayer] gets hole card ['H6', 'CK'], current stack 2920
Started the round 48
Street "preflop" started. (community card = [])
"ZifengFoldMan" declared "fold:0"
"YueShi" declared "fold:0"
"Finneas" declared "call:10"
"Yuchun" declared "fold:0"
"Zheng" declared "call:10"
"RaphaelPlayer" declared "call:10"
"EvanPlayer" declared "fold:10"
Street "flop" started. (community card = ['C8', 'H2', 'H3'])
"RaphaelPlayer" declared "call:0"
"Finneas" declared "call:0"
"Zheng" declared "call:0"
Street "turn" started. (community card = ['C8', 'H2', 'H3', 'SJ'])
"RaphaelPlayer" declared "call:0"
"Finneas" declared "call:0"
"Zheng" declared "call:0"
Street "river" started. (community card = ['C8', 'H2', 'H3', 'SJ', 'C3'])
"RaphaelPlayer" declared "call:0"
"Finneas" declared "call:0"
"Zheng" declared "call:0"
"['Finneas', 'RaphaelPlayer']" won the round 48 (stack = {'EvanPlayer': 1245, 'ZifengFoldMan': 905, 'JoyoPlayer': 0, 'YueShi': 905, 'Finneas': 880, 'Yuchun': 655, 'Zheng': 475, 'RaphaelPlayer': 2935})
player [EvanPlayer] gets hole card ['ST', 'C6'], current stack 1240
player [ZifengFoldMan] gets hole card ['D2', 'SA'], current stack 895
player [YueShi] gets hole card ['HK', 'S4'], current stack 905
player [Finneas] gets hole card ['SQ', 'D8'], current stack 880
player [Yuchun] gets hole card ['D7', 'DJ'], current stack 655
player [Zheng] gets hole card ['S2', 'H4'], current stack 475
player [RaphaelPlayer] gets hole card ['H6', 'H3'], current stack 2935
Started the round 49
Street "preflop" started. (community card = [])
"YueShi" declared "fold:0"
"Finneas" declared "call:10"
"Yuchun" declared "fold:0"
"Zheng" declared "call:10"
"RaphaelPlayer" declared "fold:0"
"EvanPlayer" declared "fold:10"
"ZifengFoldMan" declared "fold:0"
Street "flop" started. (community card = ['S5', 'H2', 'C9'])
"Finneas" declared "call:0"
"Zheng" declared "call:0"
Street "turn" started. (community card = ['S5', 'H2', 'C9', 'HJ'])
"Finneas" declared "call:0"
"Zheng" declared "call:0"
Street "river" started. (community card = ['S5', 'H2', 'C9', 'HJ', 'SJ'])
"Finneas" declared "call:0"
"Zheng" declared "call:0"
"['Zheng']" won the round 49 (stack = {'EvanPlayer': 1240, 'ZifengFoldMan': 895, 'JoyoPlayer': 0, 'YueShi': 905, 'Finneas': 870, 'Yuchun': 655, 'Zheng': 500, 'RaphaelPlayer': 2935})
player [EvanPlayer] gets hole card ['S3', 'D2'], current stack 1240
player [ZifengFoldMan] gets hole card ['H6', 'SA'], current stack 890
player [YueShi] gets hole card ['HA', 'HQ'], current stack 895
player [Finneas] gets hole card ['CA', 'SQ'], current stack 870
player [Yuchun] gets hole card ['H3', 'D4'], current stack 655
player [Zheng] gets hole card ['H4', 'C2'], current stack 500
player [RaphaelPlayer] gets hole card ['C3', 'H9'], current stack 2935
Started the round 50
Street "preflop" started. (community card = [])
"Finneas" declared "raise:442"
"Yuchun" declared "fold:0"
"Zheng" declared "fold:0"
"RaphaelPlayer" declared "fold:0"
"EvanPlayer" declared "fold:442"
"ZifengFoldMan" declared "fold:0"
"YueShi" declared "fold:0"
"['Finneas']" won the round 50 (stack = {'EvanPlayer': 1240, 'ZifengFoldMan': 890, 'JoyoPlayer': 0, 'YueShi': 895, 'Finneas': 885, 'Yuchun': 655, 'Zheng': 500, 'RaphaelPlayer': 2935})

Game Results:
------------------------------------------------------------
Game 1:
Winner: RaphaelPlayer (stack: 2935)
All players' stacks:
  EvanPlayer: 1240
  ZifengFoldMan: 890
  JoyoPlayer: 0
  YueShi: 895
  Finneas: 885
  Yuchun: 655
  Zheng: 500
  RaphaelPlayer: 2935
------------------------------------------------------------
