player [EvanPlayer] gets hole card ['C8', 'C2'], current stack 1000
player [ZifengFoldMan] gets hole card ['CQ', 'HT'], current stack 995
player [JoyoPlayer] gets hole card ['SQ', 'C6'], current stack 990
player [YueShi] gets hole card ['C9', 'D5'], current stack 1000
player [Finneas] gets hole card ['D3', 'DT'], current stack 1000
player [Yuchun] gets hole card ['CT', 'C4'], current stack 1000
player [Zheng] gets hole card ['C7', 'D8'], current stack 1000
player [RaphaelPlayer] gets hole card ['SK', 'H8'], current stack 1000
Started the round 1
Street "preflop" started. (community card = [])
"YueShi" declared "fold:0"
"Finneas" declared "call:10"
"Yuchun" declared "fold:0"
"Zheng" declared "call:10"
"RaphaelPlayer" declared "call:10"
"EvanPlayer" declared "raise:1000"
"ZifengFoldMan" declared "fold:0"
"JoyoPlayer" declared "fold:0"
"Finneas" declared "fold:0"
"Zheng" declared "fold:0"
"RaphaelPlayer" declared "fold:0"
"['EvanPlayer']" won the round 1 (stack = {'EvanPlayer': 1045, 'ZifengFoldMan': 995, 'JoyoPlayer': 990, 'YueShi': 1000, 'Finneas': 990, 'Yuchun': 1000, 'Zheng': 990, 'RaphaelPlayer': 990})
player [EvanPlayer] gets hole card ['C8', 'C4'], current stack 1045
player [ZifengFoldMan] gets hole card ['CQ', 'SA'], current stack 995
player [JoyoPlayer] gets hole card ['D3', 'S2'], current stack 985
player [YueShi] gets hole card ['D2', 'SJ'], current stack 990
player [Finneas] gets hole card ['SK', 'S8'], current stack 990
player [Yuchun] gets hole card ['S3', 'H4'], current stack 1000
player [Zheng] gets hole card ['D5', 'DJ'], current stack 990
player [RaphaelPlayer] gets hole card ['S7', 'D7'], current stack 990
Started the round 2
Street "preflop" started. (community card = [])
"Finneas" declared "call:10"
"Yuchun" declared "fold:0"
"Zheng" declared "call:10"
"RaphaelPlayer" declared "raise:30"
"EvanPlayer" declared "call:30"
"ZifengFoldMan" declared "fold:0"
"JoyoPlayer" declared "raise:50"
"YueShi" declared "fold:0"
"Finneas" declared "fold:0"
"Zheng" declared "fold:0"
"RaphaelPlayer" declared "call:50"
"EvanPlayer" declared "fold:50"
Street "flop" started. (community card = ['DK', 'HK', 'H9'])
"JoyoPlayer" declared "fold:0"
"['RaphaelPlayer']" won the round 2 (stack = {'EvanPlayer': 1015, 'ZifengFoldMan': 995, 'JoyoPlayer': 940, 'YueShi': 990, 'Finneas': 980, 'Yuchun': 1000, 'Zheng': 980, 'RaphaelPlayer': 1100})
player [EvanPlayer] gets hole card ['HA', 'D9'], current stack 1015
player [ZifengFoldMan] gets hole card ['D3', 'DK'], current stack 995
player [JoyoPlayer] gets hole card ['D8', 'DQ'], current stack 940
player [YueShi] gets hole card ['C2', 'DA'], current stack 985
player [Finneas] gets hole card ['C3', 'SK'], current stack 970
player [Yuchun] gets hole card ['CT', 'C5'], current stack 1000
player [Zheng] gets hole card ['S3', 'D2'], current stack 980
player [RaphaelPlayer] gets hole card ['H4', 'HQ'], current stack 1100
Started the round 3
Street "preflop" started. (community card = [])
"Yuchun" declared "fold:0"
"Zheng" declared "call:10"
"RaphaelPlayer" declared "call:10"
"EvanPlayer" declared "raise:1015"
"ZifengFoldMan" declared "fold:0"
"JoyoPlayer" declared "call:1015"
"YueShi" declared "fold:0"
"Finneas" declared "fold:0"
"Zheng" declared "fold:0"
"RaphaelPlayer" declared "call:1015"
Street "flop" started. (community card = ['S7', 'H2', 'CQ'])
Street "turn" started. (community card = ['S7', 'H2', 'CQ', 'D4'])
Street "river" started. (community card = ['S7', 'H2', 'CQ', 'D4', 'H8'])
"['JoyoPlayer']" won the round 3 (stack = {'EvanPlayer': 0, 'ZifengFoldMan': 995, 'JoyoPlayer': 2845, 'YueShi': 985, 'Finneas': 970, 'Yuchun': 1000, 'Zheng': 970, 'RaphaelPlayer': 235})
player [ZifengFoldMan] gets hole card ['D8', 'S3'], current stack 995
player [JoyoPlayer] gets hole card ['C2', 'CA'], current stack 2845
player [YueShi] gets hole card ['D7', 'C4'], current stack 985
player [Finneas] gets hole card ['C7', 'H8'], current stack 965
player [Yuchun] gets hole card ['HJ', 'H4'], current stack 990
player [Zheng] gets hole card ['S9', 'H6'], current stack 970
player [RaphaelPlayer] gets hole card ['H3', 'S4'], current stack 235
Started the round 4
Street "preflop" started. (community card = [])
"Zheng" declared "call:10"
"RaphaelPlayer" declared "fold:0"
"ZifengFoldMan" declared "fold:0"
"JoyoPlayer" declared "fold:0"
"YueShi" declared "fold:0"
"Finneas" declared "call:10"
"Yuchun" declared "fold:0"
Street "flop" started. (community card = ['CK', 'C9', 'SJ'])
"Finneas" declared "call:0"
"Zheng" declared "call:0"
Street "turn" started. (community card = ['CK', 'C9', 'SJ', 'SA'])
"Finneas" declared "call:0"
"Zheng" declared "call:0"
Street "river" started. (community card = ['CK', 'C9', 'SJ', 'SA', 'C6'])
"Finneas" declared "call:0"
"Zheng" declared "call:0"
"['Zheng']" won the round 4 (stack = {'EvanPlayer': 0, 'ZifengFoldMan': 995, 'JoyoPlayer': 2845, 'YueShi': 985, 'Finneas': 960, 'Yuchun': 990, 'Zheng': 990, 'RaphaelPlayer': 235})
player [ZifengFoldMan] gets hole card ['S8', 'D6'], current stack 995
player [JoyoPlayer] gets hole card ['S9', 'DK'], current stack 2845
player [YueShi] gets hole card ['SA', 'H7'], current stack 985
player [Finneas] gets hole card ['HQ', 'S6'], current stack 960
player [Yuchun] gets hole card ['SK', 'CQ'], current stack 985
player [Zheng] gets hole card ['H3', 'HK'], current stack 980
player [RaphaelPlayer] gets hole card ['H6', 'S5'], current stack 235
Started the round 5
Street "preflop" started. (community card = [])
"RaphaelPlayer" declared "fold:0"
"ZifengFoldMan" declared "fold:0"
"JoyoPlayer" declared "fold:0"
"YueShi" declared "fold:0"
"Finneas" declared "call:10"
"Yuchun" declared "fold:0"
"Zheng" declared "call:10"
Street "flop" started. (community card = ['HT', 'HJ', 'C5'])
"Zheng" declared "call:0"
"Finneas" declared "call:0"
Street "turn" started. (community card = ['HT', 'HJ', 'C5', 'C4'])
"Zheng" declared "call:0"
"Finneas" declared "call:0"
Street "river" started. (community card = ['HT', 'HJ', 'C5', 'C4', 'D9'])
"Zheng" declared "call:0"
"Finneas" declared "call:0"
"['Zheng']" won the round 5 (stack = {'EvanPlayer': 0, 'ZifengFoldMan': 995, 'JoyoPlayer': 2845, 'YueShi': 985, 'Finneas': 950, 'Yuchun': 985, 'Zheng': 1005, 'RaphaelPlayer': 235})
player [ZifengFoldMan] gets hole card ['C2', 'S9'], current stack 995
player [JoyoPlayer] gets hole card ['S3', 'CJ'], current stack 2845
player [YueShi] gets hole card ['DK', 'HJ'], current stack 985
player [Finneas] gets hole card ['SJ', 'S4'], current stack 950
player [Yuchun] gets hole card ['SQ', 'D3'], current stack 985
player [Zheng] gets hole card ['H4', 'DT'], current stack 1000
player [RaphaelPlayer] gets hole card ['H2', 'S8'], current stack 225
Started the round 6
Street "preflop" started. (community card = [])
"ZifengFoldMan" declared "fold:0"
"JoyoPlayer" declared "fold:0"
"YueShi" declared "fold:0"
"Finneas" declared "call:10"
"Yuchun" declared "fold:0"
"Zheng" declared "call:10"
"RaphaelPlayer" declared "fold:0"
Street "flop" started. (community card = ['DJ', 'D6', 'H8'])
"Zheng" declared "call:0"
"Finneas" declared "call:0"
Street "turn" started. (community card = ['DJ', 'D6', 'H8', 'D5'])
"Zheng" declared "call:0"
"Finneas" declared "call:0"
Street "river" started. (community card = ['DJ', 'D6', 'H8', 'D5', 'HT'])
"Zheng" declared "call:0"
"Finneas" declared "call:0"
"['Finneas']" won the round 6 (stack = {'EvanPlayer': 0, 'ZifengFoldMan': 995, 'JoyoPlayer': 2845, 'YueShi': 985, 'Finneas': 970, 'Yuchun': 985, 'Zheng': 995, 'RaphaelPlayer': 225})
player [ZifengFoldMan] gets hole card ['HT', 'DQ'], current stack 985
player [JoyoPlayer] gets hole card ['C9', 'S6'], current stack 2845
player [YueShi] gets hole card ['CA', 'ST'], current stack 985
player [Finneas] gets hole card ['H7', 'SQ'], current stack 970
player [Yuchun] gets hole card ['SJ', 'H2'], current stack 985
player [Zheng] gets hole card ['D2', 'HJ'], current stack 995
player [RaphaelPlayer] gets hole card ['S2', 'SK'], current stack 220
Started the round 7
Street "preflop" started. (community card = [])
"JoyoPlayer" declared "fold:0"
"YueShi" declared "fold:0"
"Finneas" declared "call:10"
"Yuchun" declared "fold:0"
"Zheng" declared "call:10"
"RaphaelPlayer" declared "call:10"
"ZifengFoldMan" declared "fold:0"
Street "flop" started. (community card = ['C4', 'DT', 'C7'])
"RaphaelPlayer" declared "call:0"
"Finneas" declared "call:0"
"Zheng" declared "call:0"
Street "turn" started. (community card = ['C4', 'DT', 'C7', 'H3'])
"RaphaelPlayer" declared "call:0"
"Finneas" declared "call:0"
"Zheng" declared "call:0"
Street "river" started. (community card = ['C4', 'DT', 'C7', 'H3', 'HK'])
"RaphaelPlayer" declared "raise:50"
"Finneas" declared "fold:0"
"Zheng" declared "fold:0"
"['RaphaelPlayer']" won the round 7 (stack = {'EvanPlayer': 0, 'ZifengFoldMan': 985, 'JoyoPlayer': 2845, 'YueShi': 985, 'Finneas': 960, 'Yuchun': 985, 'Zheng': 985, 'RaphaelPlayer': 255})
player [ZifengFoldMan] gets hole card ['C7', 'C8'], current stack 980
player [JoyoPlayer] gets hole card ['ST', 'S3'], current stack 2835
player [YueShi] gets hole card ['CA', 'S7'], current stack 985
player [Finneas] gets hole card ['C5', 'D3'], current stack 960
player [Yuchun] gets hole card ['CT', 'C9'], current stack 985
player [Zheng] gets hole card ['S8', 'DJ'], current stack 985
player [RaphaelPlayer] gets hole card ['D8', 'H9'], current stack 255
Started the round 8
Street "preflop" started. (community card = [])
"YueShi" declared "fold:0"
"Finneas" declared "call:10"
"Yuchun" declared "fold:0"
"Zheng" declared "call:10"
"RaphaelPlayer" declared "fold:0"
"ZifengFoldMan" declared "fold:0"
"JoyoPlayer" declared "fold:0"
Street "flop" started. (community card = ['D9', 'H8', 'H7'])
"Finneas" declared "call:0"
"Zheng" declared "call:0"
Street "turn" started. (community card = ['D9', 'H8', 'H7', 'SJ'])
"Finneas" declared "call:0"
"Zheng" declared "call:0"
Street "river" started. (community card = ['D9', 'H8', 'H7', 'SJ', 'CJ'])
"Finneas" declared "call:0"
"Zheng" declared "raise:975"
"Finneas" declared "fold:0"
"['Zheng']" won the round 8 (stack = {'EvanPlayer': 0, 'ZifengFoldMan': 980, 'JoyoPlayer': 2835, 'YueShi': 985, 'Finneas': 950, 'Yuchun': 985, 'Zheng': 1010, 'RaphaelPlayer': 255})
player [ZifengFoldMan] gets hole card ['D3', 'D8'], current stack 980
player [JoyoPlayer] gets hole card ['D7', 'SQ'], current stack 2830
player [YueShi] gets hole card ['SJ', 'DQ'], current stack 975
player [Finneas] gets hole card ['ST', 'H3'], current stack 950
player [Yuchun] gets hole card ['D4', 'H4'], current stack 985
player [Zheng] gets hole card ['C3', 'CT'], current stack 1010
player [RaphaelPlayer] gets hole card ['HQ', 'D6'], current stack 255
Started the round 9
Street "preflop" started. (community card = [])
"Finneas" declared "call:10"
"Yuchun" declared "fold:0"
"Zheng" declared "call:10"
"RaphaelPlayer" declared "fold:0"
"ZifengFoldMan" declared "fold:0"
"JoyoPlayer" declared "fold:0"
"YueShi" declared "fold:0"
Street "flop" started. (community card = ['S2', 'D2', 'HK'])
"Finneas" declared "call:0"
"Zheng" declared "call:0"
Street "turn" started. (community card = ['S2', 'D2', 'HK', 'H8'])
"Finneas" declared "call:0"
"Zheng" declared "call:0"
Street "river" started. (community card = ['S2', 'D2', 'HK', 'H8', 'C5'])
"Finneas" declared "call:0"
"Zheng" declared "call:0"
"['Finneas', 'Zheng']" won the round 9 (stack = {'EvanPlayer': 0, 'ZifengFoldMan': 980, 'JoyoPlayer': 2830, 'YueShi': 975, 'Finneas': 957, 'Yuchun': 985, 'Zheng': 1017, 'RaphaelPlayer': 255})
player [ZifengFoldMan] gets hole card ['D7', 'C2'], current stack 980
player [JoyoPlayer] gets hole card ['SA', 'D9'], current stack 2830
player [YueShi] gets hole card ['D5', 'C4'], current stack 970
player [Finneas] gets hole card ['C5', 'D3'], current stack 947
player [Yuchun] gets hole card ['S7', 'ST'], current stack 985
player [Zheng] gets hole card ['SJ', 'H2'], current stack 1017
player [RaphaelPlayer] gets hole card ['DK', 'S5'], current stack 255
Started the round 10
Street "preflop" started. (community card = [])
"Yuchun" declared "call:10"
"Zheng" declared "call:10"
"RaphaelPlayer" declared "fold:0"
"ZifengFoldMan" declared "fold:0"
"JoyoPlayer" declared "raise:15"
"YueShi" declared "fold:0"
"Finneas" declared "call:15"
"Yuchun" declared "call:15"
"Zheng" declared "call:15"
Street "flop" started. (community card = ['D4', 'CT', 'HK'])
"Finneas" declared "call:0"
"Yuchun" declared "call:0"
"Zheng" declared "call:0"
"JoyoPlayer" declared "fold:0"
Street "turn" started. (community card = ['D4', 'CT', 'HK', 'DJ'])
"Finneas" declared "call:0"
"Yuchun" declared "call:0"
"Zheng" declared "call:0"
Street "river" started. (community card = ['D4', 'CT', 'HK', 'DJ', 'C3'])
"Finneas" declared "call:0"
"Yuchun" declared "call:0"
"Zheng" declared "call:0"
"['Zheng']" won the round 10 (stack = {'EvanPlayer': 0, 'ZifengFoldMan': 980, 'JoyoPlayer': 2815, 'YueShi': 970, 'Finneas': 942, 'Yuchun': 970, 'Zheng': 1067, 'RaphaelPlayer': 255})
player [ZifengFoldMan] gets hole card ['CA', 'SK'], current stack 980
player [JoyoPlayer] gets hole card ['H7', 'H6'], current stack 2815
player [YueShi] gets hole card ['DA', 'CJ'], current stack 970
player [Finneas] gets hole card ['D2', 'C8'], current stack 937
player [Yuchun] gets hole card ['C9', 'S6'], current stack 960
player [Zheng] gets hole card ['HQ', 'SQ'], current stack 1067
player [RaphaelPlayer] gets hole card ['D9', 'H9'], current stack 255
Started the round 11
Street "preflop" started. (community card = [])
"Zheng" declared "call:10"
"RaphaelPlayer" declared "raise:30"
"ZifengFoldMan" declared "fold:0"
"JoyoPlayer" declared "fold:0"
"YueShi" declared "fold:0"
"Finneas" declared "fold:0"
"Yuchun" declared "call:30"
"Zheng" declared "fold:0"
Street "flop" started. (community card = ['DT', 'HT', 'D6'])
"Yuchun" declared "call:0"
"RaphaelPlayer" declared "raise:85"
"Yuchun" declared "call:85"
Street "turn" started. (community card = ['DT', 'HT', 'D6', 'SJ'])
"Yuchun" declared "call:0"
"RaphaelPlayer" declared "raise:140"
"Yuchun" declared "call:140"
Street "river" started. (community card = ['DT', 'HT', 'D6', 'SJ', 'H8'])
"['RaphaelPlayer']" won the round 11 (stack = {'EvanPlayer': 0, 'ZifengFoldMan': 980, 'JoyoPlayer': 2815, 'YueShi': 970, 'Finneas': 937, 'Yuchun': 715, 'Zheng': 1057, 'RaphaelPlayer': 525})
player [ZifengFoldMan] gets hole card ['H8', 'D2'], current stack 980
player [JoyoPlayer] gets hole card ['S7', 'DK'], current stack 2815
player [YueShi] gets hole card ['S5', 'H3'], current stack 970
player [Finneas] gets hole card ['SQ', 'H5'], current stack 937
player [Yuchun] gets hole card ['S4', 'SK'], current stack 710
player [Zheng] gets hole card ['HA', 'SJ'], current stack 1047
player [RaphaelPlayer] gets hole card ['D6', 'H4'], current stack 525
Started the round 12
Street "preflop" started. (community card = [])
"RaphaelPlayer" declared "fold:0"
"ZifengFoldMan" declared "fold:0"
"JoyoPlayer" declared "raise:15"
"YueShi" declared "fold:0"
"Finneas" declared "call:15"
"Yuchun" declared "call:15"
"Zheng" declared "call:15"
Street "flop" started. (community card = ['H7', 'D4', 'S6'])
"Yuchun" declared "call:0"
"Zheng" declared "call:0"
"JoyoPlayer" declared "fold:0"
"Finneas" declared "call:0"
Street "turn" started. (community card = ['H7', 'D4', 'S6', 'D8'])
"Yuchun" declared "call:0"
"Zheng" declared "call:0"
"Finneas" declared "call:0"
Street "river" started. (community card = ['H7', 'D4', 'S6', 'D8', 'HK'])
"Yuchun" declared "call:0"
"Zheng" declared "call:0"
"Finneas" declared "call:0"
"['Finneas']" won the round 12 (stack = {'EvanPlayer': 0, 'ZifengFoldMan': 980, 'JoyoPlayer': 2800, 'YueShi': 970, 'Finneas': 982, 'Yuchun': 700, 'Zheng': 1042, 'RaphaelPlayer': 525})
player [ZifengFoldMan] gets hole card ['H6', 'H7'], current stack 980
player [JoyoPlayer] gets hole card ['H4', 'H2'], current stack 2800
player [YueShi] gets hole card ['C3', 'SA'], current stack 970
player [Finneas] gets hole card ['S7', 'H5'], current stack 982
player [Yuchun] gets hole card ['S5', 'DJ'], current stack 700
player [Zheng] gets hole card ['HJ', 'C9'], current stack 1037
player [RaphaelPlayer] gets hole card ['ST', 'D9'], current stack 515
Started the round 13
Street "preflop" started. (community card = [])
"ZifengFoldMan" declared "fold:0"
"JoyoPlayer" declared "fold:0"
"YueShi" declared "fold:0"
"Finneas" declared "call:10"
"Yuchun" declared "call:10"
"Zheng" declared "call:10"
"RaphaelPlayer" declared "call:10"
Street "flop" started. (community card = ['H9', 'C6', 'C4'])
"Zheng" declared "call:0"
"RaphaelPlayer" declared "call:0"
"Finneas" declared "call:0"
"Yuchun" declared "call:0"
Street "turn" started. (community card = ['H9', 'C6', 'C4', 'D8'])
"Zheng" declared "call:0"
"RaphaelPlayer" declared "call:0"
"Finneas" declared "call:0"
"Yuchun" declared "call:0"
Street "river" started. (community card = ['H9', 'C6', 'C4', 'D8', 'SQ'])
"Zheng" declared "call:0"
"RaphaelPlayer" declared "call:0"
"Finneas" declared "call:0"
"Yuchun" declared "call:0"
"['Finneas']" won the round 13 (stack = {'EvanPlayer': 0, 'ZifengFoldMan': 980, 'JoyoPlayer': 2800, 'YueShi': 970, 'Finneas': 1012, 'Yuchun': 690, 'Zheng': 1032, 'RaphaelPlayer': 515})
player [ZifengFoldMan] gets hole card ['SQ', 'HA'], current stack 970
player [JoyoPlayer] gets hole card ['H6', 'CT'], current stack 2800
player [YueShi] gets hole card ['C6', 'C4'], current stack 970
player [Finneas] gets hole card ['SK', 'H4'], current stack 1012
player [Yuchun] gets hole card ['S8', 'SA'], current stack 690
player [Zheng] gets hole card ['S6', 'HJ'], current stack 1032
player [RaphaelPlayer] gets hole card ['C9', 'S5'], current stack 510
Started the round 14
Street "preflop" started. (community card = [])
"JoyoPlayer" declared "fold:0"
"YueShi" declared "fold:0"
"Finneas" declared "call:10"
"Yuchun" declared "call:10"
"Zheng" declared "call:10"
"RaphaelPlayer" declared "fold:0"
"ZifengFoldMan" declared "fold:0"
Street "flop" started. (community card = ['S3', 'D4', 'DT'])
"Finneas" declared "call:0"
"Yuchun" declared "call:0"
"Zheng" declared "call:0"
Street "turn" started. (community card = ['S3', 'D4', 'DT', 'D6'])
"Finneas" declared "call:0"
"Yuchun" declared "call:0"
"Zheng" declared "call:0"
Street "river" started. (community card = ['S3', 'D4', 'DT', 'D6', 'H5'])
"Finneas" declared "call:0"
"Yuchun" declared "call:0"
"Zheng" declared "call:0"
"['Zheng']" won the round 14 (stack = {'EvanPlayer': 0, 'ZifengFoldMan': 970, 'JoyoPlayer': 2800, 'YueShi': 970, 'Finneas': 1002, 'Yuchun': 680, 'Zheng': 1067, 'RaphaelPlayer': 510})
player [ZifengFoldMan] gets hole card ['D3', 'SQ'], current stack 965
player [JoyoPlayer] gets hole card ['CJ', 'S5'], current stack 2790
player [YueShi] gets hole card ['CQ', 'H6'], current stack 970
player [Finneas] gets hole card ['H2', 'D6'], current stack 1002
player [Yuchun] gets hole card ['SA', 'ST'], current stack 680
player [Zheng] gets hole card ['HJ', 'HT'], current stack 1067
player [RaphaelPlayer] gets hole card ['S7', 'D5'], current stack 510
Started the round 15
Street "preflop" started. (community card = [])
"YueShi" declared "fold:0"
"Finneas" declared "call:10"
"Yuchun" declared "call:10"
"Zheng" declared "call:10"
"RaphaelPlayer" declared "fold:0"
"ZifengFoldMan" declared "fold:0"
"JoyoPlayer" declared "fold:0"
Street "flop" started. (community card = ['SJ', 'HQ', 'C8'])
"Finneas" declared "call:0"
"Yuchun" declared "call:0"
"Zheng" declared "call:0"
Street "turn" started. (community card = ['SJ', 'HQ', 'C8', 'C2'])
"Finneas" declared "call:0"
"Yuchun" declared "call:0"
"Zheng" declared "call:0"
Street "river" started. (community card = ['SJ', 'HQ', 'C8', 'C2', 'C5'])
"Finneas" declared "call:0"
"Yuchun" declared "call:0"
"Zheng" declared "call:0"
"['Zheng']" won the round 15 (stack = {'EvanPlayer': 0, 'ZifengFoldMan': 965, 'JoyoPlayer': 2790, 'YueShi': 970, 'Finneas': 992, 'Yuchun': 670, 'Zheng': 1102, 'RaphaelPlayer': 510})
player [ZifengFoldMan] gets hole card ['H4', 'C8'], current stack 965
player [JoyoPlayer] gets hole card ['CQ', 'H3'], current stack 2785
player [YueShi] gets hole card ['S3', 'C3'], current stack 960
player [Finneas] gets hole card ['S8', 'HK'], current stack 992
player [Yuchun] gets hole card ['SA', 'C2'], current stack 670
player [Zheng] gets hole card ['DJ', 'CA'], current stack 1102
player [RaphaelPlayer] gets hole card ['S6', 'SQ'], current stack 510
Started the round 16
Street "preflop" started. (community card = [])
"Finneas" declared "call:10"
"Yuchun" declared "call:10"
"Zheng" declared "call:10"
"RaphaelPlayer" declared "call:10"
"ZifengFoldMan" declared "fold:0"
"JoyoPlayer" declared "raise:15"
"YueShi" declared "fold:0"
"Finneas" declared "call:15"
"Yuchun" declared "call:15"
"Zheng" declared "call:15"
"RaphaelPlayer" declared "call:15"
Street "flop" started. (community card = ['H7', 'SK', 'H9'])
"JoyoPlayer" declared "fold:0"
"Finneas" declared "call:0"
"Yuchun" declared "call:0"
"Zheng" declared "call:0"
"RaphaelPlayer" declared "call:0"
Street "turn" started. (community card = ['H7', 'SK', 'H9', 'HQ'])
"Finneas" declared "call:0"
"Yuchun" declared "call:0"
"Zheng" declared "call:0"
"RaphaelPlayer" declared "call:0"
Street "river" started. (community card = ['H7', 'SK', 'H9', 'HQ', 'S2'])
"Finneas" declared "call:0"
"Yuchun" declared "call:0"
"Zheng" declared "call:0"
"RaphaelPlayer" declared "call:0"
"['Finneas']" won the round 16 (stack = {'EvanPlayer': 0, 'ZifengFoldMan': 965, 'JoyoPlayer': 2775, 'YueShi': 960, 'Finneas': 1062, 'Yuchun': 655, 'Zheng': 1087, 'RaphaelPlayer': 495})
player [ZifengFoldMan] gets hole card ['D3', 'H5'], current stack 965
player [JoyoPlayer] gets hole card ['CK', 'HK'], current stack 2775
player [YueShi] gets hole card ['D6', 'H8'], current stack 955
player [Finneas] gets hole card ['CT', 'C5'], current stack 1052
player [Yuchun] gets hole card ['C3', 'DK'], current stack 655
player [Zheng] gets hole card ['C9', 'DA'], current stack 1087
player [RaphaelPlayer] gets hole card ['HA', 'C4'], current stack 495
Started the round 17
Street "preflop" started. (community card = [])
"Yuchun" declared "call:10"
"Zheng" declared "call:10"
"RaphaelPlayer" declared "call:10"
"ZifengFoldMan" declared "fold:0"
"JoyoPlayer" declared "raise:15"
"YueShi" declared "fold:0"
"Finneas" declared "call:15"
"Yuchun" declared "call:15"
"Zheng" declared "call:15"
"RaphaelPlayer" declared "call:15"
Street "flop" started. (community card = ['SJ', 'H9', 'H7'])
"Finneas" declared "call:0"
"Yuchun" declared "call:0"
"Zheng" declared "call:0"
"RaphaelPlayer" declared "call:0"
"JoyoPlayer" declared "fold:0"
Street "turn" started. (community card = ['SJ', 'H9', 'H7', 'S8'])
"Finneas" declared "call:0"
"Yuchun" declared "call:0"
"Zheng" declared "call:0"
"RaphaelPlayer" declared "call:0"
Street "river" started. (community card = ['SJ', 'H9', 'H7', 'S8', 'D7'])
"Finneas" declared "call:0"
"Yuchun" declared "call:0"
"Zheng" declared "call:0"
"RaphaelPlayer" declared "call:0"
"['Finneas']" won the round 17 (stack = {'EvanPlayer': 0, 'ZifengFoldMan': 965, 'JoyoPlayer': 2760, 'YueShi': 955, 'Finneas': 1127, 'Yuchun': 640, 'Zheng': 1072, 'RaphaelPlayer': 480})
player [ZifengFoldMan] gets hole card ['S4', 'DA'], current stack 965
player [JoyoPlayer] gets hole card ['DJ', 'D9'], current stack 2760
player [YueShi] gets hole card ['H4', 'H9'], current stack 955
player [Finneas] gets hole card ['S3', 'C4'], current stack 1122
player [Yuchun] gets hole card ['D2', 'HJ'], current stack 630
player [Zheng] gets hole card ['S5', 'D3'], current stack 1072
player [RaphaelPlayer] gets hole card ['HA', 'H7'], current stack 480
Started the round 18
Street "preflop" started. (community card = [])
"Zheng" declared "call:10"
"RaphaelPlayer" declared "raise:30"
"ZifengFoldMan" declared "fold:0"
"JoyoPlayer" declared "fold:0"
"YueShi" declared "fold:0"
"Finneas" declared "fold:0"
"Yuchun" declared "call:30"
"Zheng" declared "fold:0"
Street "flop" started. (community card = ['HT', 'H3', 'CK'])
"Yuchun" declared "call:0"
"RaphaelPlayer" declared "raise:85"
"Yuchun" declared "call:85"
Street "turn" started. (community card = ['HT', 'H3', 'CK', 'HK'])
"Yuchun" declared "call:0"
"RaphaelPlayer" declared "raise:255"
"Yuchun" declared "fold:0"
"['RaphaelPlayer']" won the round 18 (stack = {'EvanPlayer': 0, 'ZifengFoldMan': 965, 'JoyoPlayer': 2760, 'YueShi': 955, 'Finneas': 1122, 'Yuchun': 525, 'Zheng': 1062, 'RaphaelPlayer': 610})
player [ZifengFoldMan] gets hole card ['HA', 'DT'], current stack 965
player [JoyoPlayer] gets hole card ['D9', 'S3'], current stack 2760
player [YueShi] gets hole card ['D5', 'C8'], current stack 955
player [Finneas] gets hole card ['SQ', 'D8'], current stack 1122
player [Yuchun] gets hole card ['D7', 'DK'], current stack 520
player [Zheng] gets hole card ['CA', 'H4'], current stack 1052
player [RaphaelPlayer] gets hole card ['HK', 'D2'], current stack 610
Started the round 19
Street "preflop" started. (community card = [])
"RaphaelPlayer" declared "fold:0"
"ZifengFoldMan" declared "fold:0"
"JoyoPlayer" declared "fold:0"
"YueShi" declared "fold:0"
"Finneas" declared "call:10"
"Yuchun" declared "call:10"
"Zheng" declared "call:10"
Street "flop" started. (community card = ['SA', 'CT', 'H5'])
"Yuchun" declared "call:0"
"Zheng" declared "call:0"
"Finneas" declared "call:0"
Street "turn" started. (community card = ['SA', 'CT', 'H5', 'S7'])
"Yuchun" declared "call:0"
"Zheng" declared "call:0"
"Finneas" declared "call:0"
Street "river" started. (community card = ['SA', 'CT', 'H5', 'S7', 'S2'])
"Yuchun" declared "call:0"
"Zheng" declared "call:0"
"Finneas" declared "call:0"
"['Zheng']" won the round 19 (stack = {'EvanPlayer': 0, 'ZifengFoldMan': 965, 'JoyoPlayer': 2760, 'YueShi': 955, 'Finneas': 1112, 'Yuchun': 515, 'Zheng': 1082, 'RaphaelPlayer': 610})
player [ZifengFoldMan] gets hole card ['C7', 'C4'], current stack 965
player [JoyoPlayer] gets hole card ['HA', 'C9'], current stack 2760
player [YueShi] gets hole card ['ST', 'C2'], current stack 955
player [Finneas] gets hole card ['D6', 'S6'], current stack 1112
player [Yuchun] gets hole card ['HT', 'CT'], current stack 515
player [Zheng] gets hole card ['D7', 'C8'], current stack 1077
player [RaphaelPlayer] gets hole card ['DJ', 'S5'], current stack 600
Started the round 20
Street "preflop" started. (community card = [])
"ZifengFoldMan" declared "fold:0"
"JoyoPlayer" declared "fold:0"
"YueShi" declared "fold:0"
"Finneas" declared "call:10"
"Yuchun" declared "call:10"
"Zheng" declared "call:10"
"RaphaelPlayer" declared "fold:0"
Street "flop" started. (community card = ['HK', 'H2', 'SJ'])
"Zheng" declared "call:0"
"Finneas" declared "call:0"
"Yuchun" declared "call:0"
Street "turn" started. (community card = ['HK', 'H2', 'SJ', 'S4'])
"Zheng" declared "call:0"
"Finneas" declared "call:0"
"Yuchun" declared "call:0"
Street "river" started. (community card = ['HK', 'H2', 'SJ', 'S4', 'D4'])
"Zheng" declared "call:0"
"Finneas" declared "call:0"
"Yuchun" declared "call:0"
"['Yuchun']" won the round 20 (stack = {'EvanPlayer': 0, 'ZifengFoldMan': 965, 'JoyoPlayer': 2760, 'YueShi': 955, 'Finneas': 1102, 'Yuchun': 545, 'Zheng': 1072, 'RaphaelPlayer': 600})
player [ZifengFoldMan] gets hole card ['D3', 'CA'], current stack 955
player [JoyoPlayer] gets hole card ['C3', 'DJ'], current stack 2760
player [YueShi] gets hole card ['H4', 'C9'], current stack 955
player [Finneas] gets hole card ['DK', 'D9'], current stack 1102
player [Yuchun] gets hole card ['CQ', 'S7'], current stack 545
player [Zheng] gets hole card ['SJ', 'S5'], current stack 1072
player [RaphaelPlayer] gets hole card ['H7', 'S6'], current stack 595
Started the round 21
Street "preflop" started. (community card = [])
"JoyoPlayer" declared "fold:0"
"YueShi" declared "fold:0"
"Finneas" declared "call:10"
"Yuchun" declared "call:10"
"Zheng" declared "call:10"
"RaphaelPlayer" declared "fold:0"
"ZifengFoldMan" declared "fold:0"
Street "flop" started. (community card = ['S9', 'H6', 'CJ'])
"Finneas" declared "call:0"
"Yuchun" declared "call:0"
"Zheng" declared "call:0"
Street "turn" started. (community card = ['S9', 'H6', 'CJ', 'C7'])
"Finneas" declared "call:0"
"Yuchun" declared "call:0"
"Zheng" declared "call:0"
Street "river" started. (community card = ['S9', 'H6', 'CJ', 'C7', 'S8'])
"Finneas" declared "call:0"
"Yuchun" declared "call:0"
"Zheng" declared "call:0"
"['Zheng']" won the round 21 (stack = {'EvanPlayer': 0, 'ZifengFoldMan': 955, 'JoyoPlayer': 2760, 'YueShi': 955, 'Finneas': 1092, 'Yuchun': 535, 'Zheng': 1107, 'RaphaelPlayer': 595})
player [ZifengFoldMan] gets hole card ['DA', 'H7'], current stack 950
player [JoyoPlayer] gets hole card ['C6', 'C5'], current stack 2750
player [YueShi] gets hole card ['S2', 'H6'], current stack 955
player [Finneas] gets hole card ['C2', 'S5'], current stack 1092
player [Yuchun] gets hole card ['D2', 'S9'], current stack 535
player [Zheng] gets hole card ['S3', 'S7'], current stack 1107
player [RaphaelPlayer] gets hole card ['H5', 'H2'], current stack 595
Started the round 22
Street "preflop" started. (community card = [])
"YueShi" declared "fold:0"
"Finneas" declared "call:10"
"Yuchun" declared "call:10"
"Zheng" declared "call:10"
"RaphaelPlayer" declared "fold:0"
"ZifengFoldMan" declared "fold:0"
"JoyoPlayer" declared "fold:0"
Street "flop" started. (community card = ['D5', 'HT', 'ST'])
"Finneas" declared "call:0"
"Yuchun" declared "call:0"
"Zheng" declared "call:0"
Street "turn" started. (community card = ['D5', 'HT', 'ST', 'S4'])
"Finneas" declared "call:0"
"Yuchun" declared "call:0"
"Zheng" declared "call:0"
Street "river" started. (community card = ['D5', 'HT', 'ST', 'S4', 'DJ'])
"Finneas" declared "call:0"
"Yuchun" declared "call:0"
"Zheng" declared "call:0"
"['Finneas']" won the round 22 (stack = {'EvanPlayer': 0, 'ZifengFoldMan': 950, 'JoyoPlayer': 2750, 'YueShi': 955, 'Finneas': 1127, 'Yuchun': 525, 'Zheng': 1097, 'RaphaelPlayer': 595})
player [ZifengFoldMan] gets hole card ['H2', 'C3'], current stack 950
player [JoyoPlayer] gets hole card ['D2', 'ST'], current stack 2745
player [YueShi] gets hole card ['D6', 'D5'], current stack 945
player [Finneas] gets hole card ['H9', 'DJ'], current stack 1127
player [Yuchun] gets hole card ['H7', 'HQ'], current stack 525
player [Zheng] gets hole card ['C6', 'C7'], current stack 1097
player [RaphaelPlayer] gets hole card ['S3', 'S6'], current stack 595
Started the round 23
Street "preflop" started. (community card = [])
"Finneas" declared "call:10"
"Yuchun" declared "call:10"
"Zheng" declared "call:10"
"RaphaelPlayer" declared "fold:0"
"ZifengFoldMan" declared "fold:0"
"JoyoPlayer" declared "raise:15"
"YueShi" declared "fold:0"
"Finneas" declared "call:15"
"Yuchun" declared "call:15"
"Zheng" declared "call:15"
Street "flop" started. (community card = ['CT', 'H8', 'D8'])
"JoyoPlayer" declared "fold:0"
"Finneas" declared "call:0"
"Yuchun" declared "call:0"
"Zheng" declared "call:0"
Street "turn" started. (community card = ['CT', 'H8', 'D8', 'CK'])
"Finneas" declared "call:0"
"Yuchun" declared "call:0"
"Zheng" declared "call:0"
Street "river" started. (community card = ['CT', 'H8', 'D8', 'CK', 'D3'])
"Finneas" declared "call:0"
"Yuchun" declared "call:0"
"Zheng" declared "call:0"
"['Yuchun']" won the round 23 (stack = {'EvanPlayer': 0, 'ZifengFoldMan': 950, 'JoyoPlayer': 2735, 'YueShi': 945, 'Finneas': 1112, 'Yuchun': 580, 'Zheng': 1082, 'RaphaelPlayer': 595})
player [ZifengFoldMan] gets hole card ['CK', 'ST'], current stack 950
player [JoyoPlayer] gets hole card ['D5', 'H4'], current stack 2735
player [YueShi] gets hole card ['SA', 'H8'], current stack 940
player [Finneas] gets hole card ['C6', 'D8'], current stack 1102
player [Yuchun] gets hole card ['C7', 'C3'], current stack 580
player [Zheng] gets hole card ['C4', 'HA'], current stack 1082
player [RaphaelPlayer] gets hole card ['C5', 'DQ'], current stack 595
Started the round 24
Street "preflop" started. (community card = [])
"Yuchun" declared "call:10"
"Zheng" declared "call:10"
"RaphaelPlayer" declared "call:10"
"ZifengFoldMan" declared "fold:0"
"JoyoPlayer" declared "raise:15"
"YueShi" declared "fold:0"
"Finneas" declared "call:15"
"Yuchun" declared "call:15"
"Zheng" declared "call:15"
"RaphaelPlayer" declared "fold:0"
Street "flop" started. (community card = ['DT', 'S7', 'H9'])
"Finneas" declared "call:0"
"Yuchun" declared "call:0"
"Zheng" declared "call:0"
"JoyoPlayer" declared "fold:0"
Street "turn" started. (community card = ['DT', 'S7', 'H9', 'H2'])
"Finneas" declared "call:0"
"Yuchun" declared "call:0"
"Zheng" declared "call:0"
Street "river" started. (community card = ['DT', 'S7', 'H9', 'H2', 'DA'])
"Finneas" declared "call:0"
"Yuchun" declared "call:0"
"Zheng" declared "call:0"
"['Finneas']" won the round 24 (stack = {'EvanPlayer': 0, 'ZifengFoldMan': 950, 'JoyoPlayer': 2720, 'YueShi': 940, 'Finneas': 1172, 'Yuchun': 565, 'Zheng': 1067, 'RaphaelPlayer': 585})
player [ZifengFoldMan] gets hole card ['C5', 'CA'], current stack 950
player [JoyoPlayer] gets hole card ['H4', 'DT'], current stack 2720
player [YueShi] gets hole card ['CT', 'D6'], current stack 940
player [Finneas] gets hole card ['C2', 'S9'], current stack 1167
player [Yuchun] gets hole card ['DJ', 'H6'], current stack 555
player [Zheng] gets hole card ['CQ', 'HK'], current stack 1067
player [RaphaelPlayer] gets hole card ['H8', 'HJ'], current stack 585
Started the round 25
Street "preflop" started. (community card = [])
"Zheng" declared "call:10"
"RaphaelPlayer" declared "call:10"
"ZifengFoldMan" declared "fold:0"
"JoyoPlayer" declared "fold:0"
"YueShi" declared "fold:0"
"Finneas" declared "call:10"
"Yuchun" declared "call:10"
Street "flop" started. (community card = ['S8', 'D3', 'DQ'])
"Finneas" declared "call:0"
"Yuchun" declared "call:0"
"Zheng" declared "call:0"
"RaphaelPlayer" declared "call:0"
Street "turn" started. (community card = ['S8', 'D3', 'DQ', 'D5'])
"Finneas" declared "call:0"
"Yuchun" declared "call:0"
"Zheng" declared "call:0"
"RaphaelPlayer" declared "call:0"
Street "river" started. (community card = ['S8', 'D3', 'DQ', 'D5', 'C6'])
"Finneas" declared "call:0"
"Yuchun" declared "call:0"
"Zheng" declared "call:0"
"RaphaelPlayer" declared "call:0"
"['Zheng']" won the round 25 (stack = {'EvanPlayer': 0, 'ZifengFoldMan': 950, 'JoyoPlayer': 2720, 'YueShi': 940, 'Finneas': 1162, 'Yuchun': 555, 'Zheng': 1097, 'RaphaelPlayer': 575})
player [ZifengFoldMan] gets hole card ['C8', 'SQ'], current stack 950
player [JoyoPlayer] gets hole card ['H6', 'HK'], current stack 2720
player [YueShi] gets hole card ['C4', 'H3'], current stack 940
player [Finneas] gets hole card ['D4', 'S3'], current stack 1162
player [Yuchun] gets hole card ['D6', 'H7'], current stack 550
player [Zheng] gets hole card ['C2', 'H2'], current stack 1087
player [RaphaelPlayer] gets hole card ['S4', 'D2'], current stack 575
Started the round 26
Street "preflop" started. (community card = [])
"RaphaelPlayer" declared "fold:0"
"ZifengFoldMan" declared "fold:0"
"JoyoPlayer" declared "fold:0"
"YueShi" declared "fold:0"
"Finneas" declared "call:10"
"Yuchun" declared "call:10"
"Zheng" declared "call:10"
Street "flop" started. (community card = ['SK', 'SA', 'C6'])
"Yuchun" declared "call:0"
"Zheng" declared "call:0"
"Finneas" declared "call:0"
Street "turn" started. (community card = ['SK', 'SA', 'C6', 'H4'])
"Yuchun" declared "call:0"
"Zheng" declared "call:0"
"Finneas" declared "call:0"
Street "river" started. (community card = ['SK', 'SA', 'C6', 'H4', 'CT'])
"Yuchun" declared "call:0"
"Zheng" declared "call:0"
"Finneas" declared "call:0"
"['Yuchun']" won the round 26 (stack = {'EvanPlayer': 0, 'ZifengFoldMan': 950, 'JoyoPlayer': 2720, 'YueShi': 940, 'Finneas': 1152, 'Yuchun': 575, 'Zheng': 1087, 'RaphaelPlayer': 575})
player [ZifengFoldMan] gets hole card ['C4', 'D6'], current stack 950
player [JoyoPlayer] gets hole card ['HJ', 'C5'], current stack 2720
player [YueShi] gets hole card ['DA', 'D5'], current stack 940
player [Finneas] gets hole card ['DQ', 'H8'], current stack 1152
player [Yuchun] gets hole card ['SJ', 'CJ'], current stack 575
player [Zheng] gets hole card ['D4', 'D9'], current stack 1082
player [RaphaelPlayer] gets hole card ['SA', 'SK'], current stack 565
Started the round 27
Street "preflop" started. (community card = [])
"ZifengFoldMan" declared "fold:0"
"JoyoPlayer" declared "fold:0"
"YueShi" declared "fold:0"
"Finneas" declared "call:10"
"Yuchun" declared "call:10"
"Zheng" declared "call:10"
"RaphaelPlayer" declared "raise:30"
"Finneas" declared "fold:0"
"Yuchun" declared "call:30"
"Zheng" declared "call:30"
Street "flop" started. (community card = ['H2', 'DJ', 'D8'])
"Zheng" declared "call:0"
"RaphaelPlayer" declared "call:0"
"Yuchun" declared "raise:545"
"Zheng" declared "fold:0"
"RaphaelPlayer" declared "call:545"
Street "turn" started. (community card = ['H2', 'DJ', 'D8', 'H9'])
Street "river" started. (community card = ['H2', 'DJ', 'D8', 'H9', 'HT'])
"['Yuchun']" won the round 27 (stack = {'EvanPlayer': 0, 'ZifengFoldMan': 950, 'JoyoPlayer': 2720, 'YueShi': 940, 'Finneas': 1142, 'Yuchun': 1190, 'Zheng': 1057, 'RaphaelPlayer': 0})
player [ZifengFoldMan] gets hole card ['S6', 'H6'], current stack 945
player [JoyoPlayer] gets hole card ['DT', 'DQ'], current stack 2710
player [YueShi] gets hole card ['S4', 'CT'], current stack 940
player [Finneas] gets hole card ['H2', 'C8'], current stack 1142
player [Yuchun] gets hole card ['CJ', 'SQ'], current stack 1190
player [Zheng] gets hole card ['DK', 'H3'], current stack 1057
Started the round 28
Street "preflop" started. (community card = [])
"YueShi" declared "fold:0"
"Finneas" declared "call:10"
"Yuchun" declared "call:10"
"Zheng" declared "call:10"
"ZifengFoldMan" declared "fold:0"
"JoyoPlayer" declared "fold:0"
Street "flop" started. (community card = ['H8', 'D9', 'C3'])
"Finneas" declared "call:0"
"Yuchun" declared "call:0"
"Zheng" declared "call:0"
Street "turn" started. (community card = ['H8', 'D9', 'C3', 'S7'])
"Finneas" declared "call:0"
"Yuchun" declared "call:0"
"Zheng" declared "call:0"
Street "river" started. (community card = ['H8', 'D9', 'C3', 'S7', 'C7'])
"Finneas" declared "call:0"
"Yuchun" declared "call:0"
"Zheng" declared "call:0"
"['Finneas']" won the round 28 (stack = {'EvanPlayer': 0, 'ZifengFoldMan': 945, 'JoyoPlayer': 2710, 'YueShi': 940, 'Finneas': 1177, 'Yuchun': 1180, 'Zheng': 1047, 'RaphaelPlayer': 0})
player [ZifengFoldMan] gets hole card ['S4', 'CA'], current stack 945
player [JoyoPlayer] gets hole card ['D4', 'CQ'], current stack 2705
player [YueShi] gets hole card ['CJ', 'DQ'], current stack 930
player [Finneas] gets hole card ['C3', 'S6'], current stack 1177
player [Yuchun] gets hole card ['S9', 'HT'], current stack 1180
player [Zheng] gets hole card ['C9', 'H3'], current stack 1047
Started the round 29
Street "preflop" started. (community card = [])
"Finneas" declared "call:10"
"Yuchun" declared "call:10"
"Zheng" declared "call:10"
"ZifengFoldMan" declared "fold:0"
"JoyoPlayer" declared "fold:0"
"YueShi" declared "fold:0"
Street "flop" started. (community card = ['DT', 'CT', 'S3'])
"Finneas" declared "call:0"
"Yuchun" declared "raise:1170"
"Zheng" declared "fold:0"
"Finneas" declared "fold:0"
"['Yuchun']" won the round 29 (stack = {'EvanPlayer': 0, 'ZifengFoldMan': 945, 'JoyoPlayer': 2705, 'YueShi': 930, 'Finneas': 1167, 'Yuchun': 1215, 'Zheng': 1037, 'RaphaelPlayer': 0})
player [ZifengFoldMan] gets hole card ['D6', 'S4'], current stack 945
player [JoyoPlayer] gets hole card ['CT', 'S8'], current stack 2705
player [YueShi] gets hole card ['SK', 'DQ'], current stack 925
player [Finneas] gets hole card ['HA', 'HQ'], current stack 1157
player [Yuchun] gets hole card ['C7', 'ST'], current stack 1215
player [Zheng] gets hole card ['H2', 'H8'], current stack 1037
Started the round 30
Street "preflop" started. (community card = [])
"Yuchun" declared "call:10"
"Zheng" declared "call:10"
"ZifengFoldMan" declared "fold:0"
"JoyoPlayer" declared "fold:0"
"YueShi" declared "fold:0"
"Finneas" declared "raise:591"
"Yuchun" declared "fold:0"
"Zheng" declared "fold:0"
"['Finneas']" won the round 30 (stack = {'EvanPlayer': 0, 'ZifengFoldMan': 945, 'JoyoPlayer': 2705, 'YueShi': 925, 'Finneas': 1192, 'Yuchun': 1205, 'Zheng': 1027, 'RaphaelPlayer': 0})
player [ZifengFoldMan] gets hole card ['S6', 'SK'], current stack 945
player [JoyoPlayer] gets hole card ['D7', 'H2'], current stack 2705
player [YueShi] gets hole card ['C7', 'DA'], current stack 925
player [Finneas] gets hole card ['HK', 'C5'], current stack 1187
player [Yuchun] gets hole card ['C4', 'H6'], current stack 1195
player [Zheng] gets hole card ['H8', 'C6'], current stack 1027
Started the round 31
Street "preflop" started. (community card = [])
"Zheng" declared "call:10"
"ZifengFoldMan" declared "fold:0"
"JoyoPlayer" declared "fold:0"
"YueShi" declared "fold:0"
"Finneas" declared "call:10"
"Yuchun" declared "call:10"
Street "flop" started. (community card = ['ST', 'CT', 'CA'])
"Finneas" declared "call:0"
"Yuchun" declared "call:0"
"Zheng" declared "call:0"
Street "turn" started. (community card = ['ST', 'CT', 'CA', 'CQ'])
"Finneas" declared "call:0"
"Yuchun" declared "call:0"
"Zheng" declared "call:0"
Street "river" started. (community card = ['ST', 'CT', 'CA', 'CQ', 'D3'])
"Finneas" declared "call:0"
"Yuchun" declared "call:0"
"Zheng" declared "call:0"
"['Finneas']" won the round 31 (stack = {'EvanPlayer': 0, 'ZifengFoldMan': 945, 'JoyoPlayer': 2705, 'YueShi': 925, 'Finneas': 1212, 'Yuchun': 1195, 'Zheng': 1017, 'RaphaelPlayer': 0})
player [ZifengFoldMan] gets hole card ['DK', 'D2'], current stack 945
player [JoyoPlayer] gets hole card ['S9', 'H7'], current stack 2705
player [YueShi] gets hole card ['S6', 'SK'], current stack 925
player [Finneas] gets hole card ['HQ', 'HT'], current stack 1212
player [Yuchun] gets hole card ['H9', 'C2'], current stack 1190
player [Zheng] gets hole card ['S4', 'S8'], current stack 1007
Started the round 32
Street "preflop" started. (community card = [])
"ZifengFoldMan" declared "fold:0"
"JoyoPlayer" declared "raise:15"
"YueShi" declared "fold:0"
"Finneas" declared "call:15"
"Yuchun" declared "call:15"
"Zheng" declared "call:15"
Street "flop" started. (community card = ['D8', 'H5', 'D3'])
"Yuchun" declared "call:0"
"Zheng" declared "call:0"
"JoyoPlayer" declared "fold:0"
"Finneas" declared "call:0"
Street "turn" started. (community card = ['D8', 'H5', 'D3', 'D5'])
"Yuchun" declared "call:0"
"Zheng" declared "call:0"
"Finneas" declared "call:0"
Street "river" started. (community card = ['D8', 'H5', 'D3', 'D5', 'C6'])
"Yuchun" declared "call:0"
"Zheng" declared "call:0"
"Finneas" declared "call:0"
"['Zheng']" won the round 32 (stack = {'EvanPlayer': 0, 'ZifengFoldMan': 945, 'JoyoPlayer': 2690, 'YueShi': 925, 'Finneas': 1197, 'Yuchun': 1180, 'Zheng': 1062, 'RaphaelPlayer': 0})
player [ZifengFoldMan] gets hole card ['C8', 'CA'], current stack 935
player [JoyoPlayer] gets hole card ['SK', 'HJ'], current stack 2690
player [YueShi] gets hole card ['C6', 'S9'], current stack 925
player [Finneas] gets hole card ['D6', 'H5'], current stack 1197
player [Yuchun] gets hole card ['DJ', 'D4'], current stack 1180
player [Zheng] gets hole card ['S3', 'CQ'], current stack 1057
Started the round 33
Street "preflop" started. (community card = [])
"JoyoPlayer" declared "fold:0"
"YueShi" declared "fold:0"
"Finneas" declared "call:10"
"Yuchun" declared "call:10"
"Zheng" declared "call:10"
"ZifengFoldMan" declared "fold:0"
Street "flop" started. (community card = ['S7', 'HK', 'SQ'])
"Zheng" declared "call:0"
"Finneas" declared "call:0"
"Yuchun" declared "call:0"
Street "turn" started. (community card = ['S7', 'HK', 'SQ', 'H2'])
"Zheng" declared "call:0"
"Finneas" declared "call:0"
"Yuchun" declared "call:0"
Street "river" started. (community card = ['S7', 'HK', 'SQ', 'H2', 'DT'])
"Zheng" declared "call:0"
"Finneas" declared "call:0"
"Yuchun" declared "call:0"
"['Zheng']" won the round 33 (stack = {'EvanPlayer': 0, 'ZifengFoldMan': 935, 'JoyoPlayer': 2690, 'YueShi': 925, 'Finneas': 1187, 'Yuchun': 1170, 'Zheng': 1092, 'RaphaelPlayer': 0})
player [ZifengFoldMan] gets hole card ['S7', 'S8'], current stack 930
player [JoyoPlayer] gets hole card ['H3', 'D8'], current stack 2680
player [YueShi] gets hole card ['SK', 'C5'], current stack 925
player [Finneas] gets hole card ['C3', 'SJ'], current stack 1187
player [Yuchun] gets hole card ['HA', 'DK'], current stack 1170
player [Zheng] gets hole card ['SQ', 'DJ'], current stack 1092
Started the round 34
Street "preflop" started. (community card = [])
"YueShi" declared "fold:0"
"Finneas" declared "call:10"
"Yuchun" declared "call:10"
"Zheng" declared "call:10"
"ZifengFoldMan" declared "fold:0"
"JoyoPlayer" declared "raise:15"
"Finneas" declared "call:15"
"Yuchun" declared "call:15"
"Zheng" declared "call:15"
Street "flop" started. (community card = ['C8', 'S3', 'C2'])
"JoyoPlayer" declared "call:0"
"Finneas" declared "call:0"
"Yuchun" declared "call:0"
"Zheng" declared "call:0"
Street "turn" started. (community card = ['C8', 'S3', 'C2', 'D6'])
"JoyoPlayer" declared "call:0"
"Finneas" declared "call:0"
"Yuchun" declared "call:0"
"Zheng" declared "call:0"
Street "river" started. (community card = ['C8', 'S3', 'C2', 'D6', 'S6'])
"JoyoPlayer" declared "fold:0"
"Finneas" declared "call:0"
"Yuchun" declared "call:0"
"Zheng" declared "call:0"
"['Finneas']" won the round 34 (stack = {'EvanPlayer': 0, 'ZifengFoldMan': 930, 'JoyoPlayer': 2675, 'YueShi': 925, 'Finneas': 1237, 'Yuchun': 1155, 'Zheng': 1077, 'RaphaelPlayer': 0})
player [ZifengFoldMan] gets hole card ['D6', 'CQ'], current stack 930
player [JoyoPlayer] gets hole card ['C6', 'DJ'], current stack 2670
player [YueShi] gets hole card ['S7', 'SK'], current stack 915
player [Finneas] gets hole card ['D5', 'D2'], current stack 1237
player [Yuchun] gets hole card ['H9', 'H7'], current stack 1155
player [Zheng] gets hole card ['S8', 'H5'], current stack 1077
Started the round 35
Street "preflop" started. (community card = [])
"Finneas" declared "call:10"
"Yuchun" declared "call:10"
"Zheng" declared "call:10"
"ZifengFoldMan" declared "fold:0"
"JoyoPlayer" declared "fold:0"
"YueShi" declared "fold:0"
Street "flop" started. (community card = ['CT', 'D3', 'C7'])
"Finneas" declared "call:0"
"Yuchun" declared "call:0"
"Zheng" declared "call:0"
Street "turn" started. (community card = ['CT', 'D3', 'C7', 'CJ'])
"Finneas" declared "call:0"
"Yuchun" declared "call:0"
"Zheng" declared "call:0"
Street "river" started. (community card = ['CT', 'D3', 'C7', 'CJ', 'D9'])
"Finneas" declared "call:0"
"Yuchun" declared "call:0"
"Zheng" declared "raise:538"
"Finneas" declared "fold:0"
"Yuchun" declared "fold:0"
"['Zheng']" won the round 35 (stack = {'EvanPlayer': 0, 'ZifengFoldMan': 930, 'JoyoPlayer': 2670, 'YueShi': 915, 'Finneas': 1227, 'Yuchun': 1145, 'Zheng': 1112, 'RaphaelPlayer': 0})
player [ZifengFoldMan] gets hole card ['S9', 'S2'], current stack 930
player [JoyoPlayer] gets hole card ['CQ', 'C9'], current stack 2670
player [YueShi] gets hole card ['D2', 'SQ'], current stack 910
player [Finneas] gets hole card ['S3', 'CK'], current stack 1217
player [Yuchun] gets hole card ['C8', 'DK'], current stack 1145
player [Zheng] gets hole card ['D4', 'H3'], current stack 1112
Started the round 36
Street "preflop" started. (community card = [])
"Yuchun" declared "call:10"
"Zheng" declared "call:10"
"ZifengFoldMan" declared "fold:0"
"JoyoPlayer" declared "fold:0"
"YueShi" declared "fold:0"
"Finneas" declared "call:10"
Street "flop" started. (community card = ['D6', 'DA', 'H6'])
"Finneas" declared "call:0"
"Yuchun" declared "call:0"
"Zheng" declared "call:0"
Street "turn" started. (community card = ['D6', 'DA', 'H6', 'SK'])
"Finneas" declared "call:0"
"Yuchun" declared "call:0"
"Zheng" declared "call:0"
Street "river" started. (community card = ['D6', 'DA', 'H6', 'SK', 'HT'])
"Finneas" declared "call:0"
"Yuchun" declared "call:0"
"Zheng" declared "call:0"
"['Finneas', 'Yuchun']" won the round 36 (stack = {'EvanPlayer': 0, 'ZifengFoldMan': 930, 'JoyoPlayer': 2670, 'YueShi': 910, 'Finneas': 1234, 'Yuchun': 1152, 'Zheng': 1102, 'RaphaelPlayer': 0})
player [ZifengFoldMan] gets hole card ['D5', 'H8'], current stack 930
player [JoyoPlayer] gets hole card ['D4', 'C9'], current stack 2670
player [YueShi] gets hole card ['D6', 'CT'], current stack 910
player [Finneas] gets hole card ['H3', 'SK'], current stack 1229
player [Yuchun] gets hole card ['HK', 'D2'], current stack 1142
player [Zheng] gets hole card ['DQ', 'DK'], current stack 1102
Started the round 37
Street "preflop" started. (community card = [])
"Zheng" declared "call:10"
"ZifengFoldMan" declared "fold:0"
"JoyoPlayer" declared "fold:0"
"YueShi" declared "fold:0"
"Finneas" declared "call:10"
"Yuchun" declared "call:10"
Street "flop" started. (community card = ['SJ', 'SQ', 'C7'])
"Finneas" declared "call:0"
"Yuchun" declared "call:0"
"Zheng" declared "call:0"
Street "turn" started. (community card = ['SJ', 'SQ', 'C7', 'C5'])
"Finneas" declared "call:0"
"Yuchun" declared "call:0"
"Zheng" declared "call:0"
Street "river" started. (community card = ['SJ', 'SQ', 'C7', 'C5', 'SA'])
"Finneas" declared "call:0"
"Yuchun" declared "call:0"
"Zheng" declared "call:0"
"['Zheng']" won the round 37 (stack = {'EvanPlayer': 0, 'ZifengFoldMan': 930, 'JoyoPlayer': 2670, 'YueShi': 910, 'Finneas': 1224, 'Yuchun': 1142, 'Zheng': 1122, 'RaphaelPlayer': 0})
player [ZifengFoldMan] gets hole card ['S2', 'SK'], current stack 930
player [JoyoPlayer] gets hole card ['S8', 'C3'], current stack 2670
player [YueShi] gets hole card ['HT', 'S9'], current stack 910
player [Finneas] gets hole card ['SQ', 'C8'], current stack 1224
player [Yuchun] gets hole card ['S7', 'DJ'], current stack 1137
player [Zheng] gets hole card ['DQ', 'C7'], current stack 1112
Started the round 38
Street "preflop" started. (community card = [])
"ZifengFoldMan" declared "fold:0"
"JoyoPlayer" declared "fold:0"
"YueShi" declared "fold:0"
"Finneas" declared "call:10"
"Yuchun" declared "call:10"
"Zheng" declared "call:10"
Street "flop" started. (community card = ['D7', 'C2', 'CJ'])
"Yuchun" declared "raise:40"
"Zheng" declared "call:40"
"Finneas" declared "fold:0"
Street "turn" started. (community card = ['D7', 'C2', 'CJ', 'S4'])
"Yuchun" declared "raise:1092"
"Zheng" declared "fold:0"
"['Yuchun']" won the round 38 (stack = {'EvanPlayer': 0, 'ZifengFoldMan': 930, 'JoyoPlayer': 2670, 'YueShi': 910, 'Finneas': 1214, 'Yuchun': 1202, 'Zheng': 1072, 'RaphaelPlayer': 0})
player [ZifengFoldMan] gets hole card ['C9', 'C4'], current stack 920
player [JoyoPlayer] gets hole card ['C7', 'DK'], current stack 2670
player [YueShi] gets hole card ['HT', 'S9'], current stack 910
player [Finneas] gets hole card ['H7', 'CQ'], current stack 1214
player [Yuchun] gets hole card ['H5', 'SA'], current stack 1202
player [Zheng] gets hole card ['SQ', 'SJ'], current stack 1067
Started the round 39
Street "preflop" started. (community card = [])
"JoyoPlayer" declared "fold:0"
"YueShi" declared "fold:0"
"Finneas" declared "call:10"
"Yuchun" declared "call:10"
"Zheng" declared "call:10"
"ZifengFoldMan" declared "fold:0"
Street "flop" started. (community card = ['HQ', 'C8', 'C3'])
"Zheng" declared "call:0"
"Finneas" declared "call:0"
"Yuchun" declared "call:0"
Street "turn" started. (community card = ['HQ', 'C8', 'C3', 'D4'])
"Zheng" declared "call:0"
"Finneas" declared "call:0"
"Yuchun" declared "call:0"
Street "river" started. (community card = ['HQ', 'C8', 'C3', 'D4', 'C2'])
"Zheng" declared "call:0"
"Finneas" declared "call:0"
"Yuchun" declared "raise:1192"
"Zheng" declared "fold:0"
"Finneas" declared "fold:0"
"['Yuchun']" won the round 39 (stack = {'EvanPlayer': 0, 'ZifengFoldMan': 920, 'JoyoPlayer': 2670, 'YueShi': 910, 'Finneas': 1204, 'Yuchun': 1232, 'Zheng': 1062, 'RaphaelPlayer': 0})
player [ZifengFoldMan] gets hole card ['S4', 'CA'], current stack 915
player [JoyoPlayer] gets hole card ['HT', 'H9'], current stack 2660
player [YueShi] gets hole card ['D5', 'H2'], current stack 910
player [Finneas] gets hole card ['DT', 'DQ'], current stack 1204
player [Yuchun] gets hole card ['S7', 'D3'], current stack 1232
player [Zheng] gets hole card ['D9', 'SA'], current stack 1062
Started the round 40
Street "preflop" started. (community card = [])
"YueShi" declared "fold:0"
"Finneas" declared "call:10"
"Yuchun" declared "call:10"
"Zheng" declared "call:10"
"ZifengFoldMan" declared "fold:0"
"JoyoPlayer" declared "fold:0"
Street "flop" started. (community card = ['HJ', 'D4', 'C4'])
"Finneas" declared "call:0"
"Yuchun" declared "call:0"
"Zheng" declared "call:0"
Street "turn" started. (community card = ['HJ', 'D4', 'C4', 'S6'])
"Finneas" declared "call:0"
"Yuchun" declared "call:0"
"Zheng" declared "call:0"
Street "river" started. (community card = ['HJ', 'D4', 'C4', 'S6', 'SJ'])
"Finneas" declared "call:0"
"Yuchun" declared "call:0"
"Zheng" declared "call:0"
"['Zheng']" won the round 40 (stack = {'EvanPlayer': 0, 'ZifengFoldMan': 915, 'JoyoPlayer': 2660, 'YueShi': 910, 'Finneas': 1194, 'Yuchun': 1222, 'Zheng': 1097, 'RaphaelPlayer': 0})
player [ZifengFoldMan] gets hole card ['DQ', 'DK'], current stack 915
player [JoyoPlayer] gets hole card ['SJ', 'CQ'], current stack 2655
player [YueShi] gets hole card ['SA', 'S3'], current stack 900
player [Finneas] gets hole card ['D5', 'CK'], current stack 1194
player [Yuchun] gets hole card ['HA', 'HQ'], current stack 1222
player [Zheng] gets hole card ['C9', 'SQ'], current stack 1097
Started the round 41
Street "preflop" started. (community card = [])
"Finneas" declared "call:10"
"Yuchun" declared "fold:0"
"Zheng" declared "call:10"
"ZifengFoldMan" declared "fold:0"
"JoyoPlayer" declared "raise:15"
"YueShi" declared "fold:0"
"Finneas" declared "call:15"
"Zheng" declared "call:15"
Street "flop" started. (community card = ['C2', 'C8', 'DJ'])
"JoyoPlayer" declared "raise:10"
"Finneas" declared "call:10"
"Zheng" declared "call:10"
Street "turn" started. (community card = ['C2', 'C8', 'DJ', 'CA'])
"JoyoPlayer" declared "call:0"
"Finneas" declared "call:0"
"Zheng" declared "call:0"
Street "river" started. (community card = ['C2', 'C8', 'DJ', 'CA', 'C4'])
"JoyoPlayer" declared "raise:2433"
"Finneas" declared "fold:0"
"Zheng" declared "fold:0"
"['JoyoPlayer']" won the round 41 (stack = {'EvanPlayer': 0, 'ZifengFoldMan': 915, 'JoyoPlayer': 2720, 'YueShi': 900, 'Finneas': 1169, 'Yuchun': 1222, 'Zheng': 1072, 'RaphaelPlayer': 0})
player [ZifengFoldMan] gets hole card ['D7', 'D2'], current stack 915
player [JoyoPlayer] gets hole card ['D8', 'H3'], current stack 2720
player [YueShi] gets hole card ['C8', 'C6'], current stack 895
player [Finneas] gets hole card ['C7', 'HJ'], current stack 1159
player [Yuchun] gets hole card ['HA', 'HQ'], current stack 1222
player [Zheng] gets hole card ['DJ', 'H6'], current stack 1072
Started the round 42
Street "preflop" started. (community card = [])
"Yuchun" declared "fold:0"
"Zheng" declared "call:10"
"ZifengFoldMan" declared "fold:0"
"JoyoPlayer" declared "fold:0"
"YueShi" declared "fold:0"
"Finneas" declared "call:10"
Street "flop" started. (community card = ['H5', 'S8', 'DA'])
"Finneas" declared "call:0"
"Zheng" declared "call:0"
Street "turn" started. (community card = ['H5', 'S8', 'DA', 'S5'])
"Finneas" declared "call:0"
"Zheng" declared "call:0"
Street "river" started. (community card = ['H5', 'S8', 'DA', 'S5', 'CT'])
"Finneas" declared "call:0"
"Zheng" declared "call:0"
"['Finneas', 'Zheng']" won the round 42 (stack = {'EvanPlayer': 0, 'ZifengFoldMan': 915, 'JoyoPlayer': 2720, 'YueShi': 895, 'Finneas': 1171, 'Yuchun': 1222, 'Zheng': 1074, 'RaphaelPlayer': 0})
player [ZifengFoldMan] gets hole card ['H4', 'HJ'], current stack 915
player [JoyoPlayer] gets hole card ['D4', 'H2'], current stack 2720
player [YueShi] gets hole card ['HQ', 'HT'], current stack 895
player [Finneas] gets hole card ['S7', 'H6'], current stack 1166
player [Yuchun] gets hole card ['H7', 'C8'], current stack 1212
player [Zheng] gets hole card ['SA', 'DJ'], current stack 1074
Started the round 43
Street "preflop" started. (community card = [])
"Zheng" declared "call:10"
"ZifengFoldMan" declared "fold:0"
"JoyoPlayer" declared "raise:15"
"YueShi" declared "fold:0"
"Finneas" declared "call:15"
"Yuchun" declared "fold:0"
"Zheng" declared "call:15"
Street "flop" started. (community card = ['H3', 'DQ', 'DK'])
"Finneas" declared "call:0"
"Zheng" declared "call:0"
"JoyoPlayer" declared "raise:10"
"Finneas" declared "call:10"
"Zheng" declared "call:10"
Street "turn" started. (community card = ['H3', 'DQ', 'DK', 'C9'])
"Finneas" declared "call:0"
"Zheng" declared "call:0"
"JoyoPlayer" declared "fold:0"
Street "river" started. (community card = ['H3', 'DQ', 'DK', 'C9', 'CJ'])
"Finneas" declared "call:0"
"Zheng" declared "call:0"
"['Zheng']" won the round 43 (stack = {'EvanPlayer': 0, 'ZifengFoldMan': 915, 'JoyoPlayer': 2695, 'YueShi': 895, 'Finneas': 1146, 'Yuchun': 1212, 'Zheng': 1134, 'RaphaelPlayer': 0})
player [ZifengFoldMan] gets hole card ['HK', 'H3'], current stack 915
player [JoyoPlayer] gets hole card ['C4', 'DT'], current stack 2695
player [YueShi] gets hole card ['D7', 'HT'], current stack 895
player [Finneas] gets hole card ['C7', 'S8'], current stack 1146
player [Yuchun] gets hole card ['H9', 'S9'], current stack 1207
player [Zheng] gets hole card ['CK', 'HQ'], current stack 1124
Started the round 44
Street "preflop" started. (community card = [])
"ZifengFoldMan" declared "fold:0"
"JoyoPlayer" declared "fold:0"
"YueShi" declared "fold:0"
"Finneas" declared "call:10"
"Yuchun" declared "call:10"
"Zheng" declared "call:10"
Street "flop" started. (community card = ['S3', 'S7', 'C6'])
"Yuchun" declared "call:0"
"Zheng" declared "call:0"
"Finneas" declared "call:0"
Street "turn" started. (community card = ['S3', 'S7', 'C6', 'CJ'])
"Yuchun" declared "fold:0"
"Zheng" declared "call:0"
"Finneas" declared "call:0"
Street "river" started. (community card = ['S3', 'S7', 'C6', 'CJ', 'D2'])
"Zheng" declared "call:0"
"Finneas" declared "call:0"
"['Finneas']" won the round 44 (stack = {'EvanPlayer': 0, 'ZifengFoldMan': 915, 'JoyoPlayer': 2695, 'YueShi': 895, 'Finneas': 1166, 'Yuchun': 1202, 'Zheng': 1124, 'RaphaelPlayer': 0})
player [ZifengFoldMan] gets hole card ['D6', 'H5'], current stack 905
player [JoyoPlayer] gets hole card ['H9', 'C6'], current stack 2695
player [YueShi] gets hole card ['H3', 'H7'], current stack 895
player [Finneas] gets hole card ['D2', 'D4'], current stack 1166
player [Yuchun] gets hole card ['D3', 'S5'], current stack 1202
player [Zheng] gets hole card ['S4', 'S9'], current stack 1119
Started the round 45
Street "preflop" started. (community card = [])
"JoyoPlayer" declared "fold:0"
"YueShi" declared "fold:0"
"Finneas" declared "call:10"
"Yuchun" declared "fold:0"
"Zheng" declared "call:10"
"ZifengFoldMan" declared "fold:0"
Street "flop" started. (community card = ['C2', 'CA', 'CK'])
"Zheng" declared "call:0"
"Finneas" declared "call:0"
Street "turn" started. (community card = ['C2', 'CA', 'CK', 'C9'])
"Zheng" declared "call:0"
"Finneas" declared "call:0"
Street "river" started. (community card = ['C2', 'CA', 'CK', 'C9', 'S8'])
"Zheng" declared "call:0"
"Finneas" declared "call:0"
"['Zheng']" won the round 45 (stack = {'EvanPlayer': 0, 'ZifengFoldMan': 905, 'JoyoPlayer': 2695, 'YueShi': 895, 'Finneas': 1156, 'Yuchun': 1202, 'Zheng': 1144, 'RaphaelPlayer': 0})
player [ZifengFoldMan] gets hole card ['DA', 'S4'], current stack 900
player [JoyoPlayer] gets hole card ['D4', 'D6'], current stack 2685
player [YueShi] gets hole card ['ST', 'S7'], current stack 895
player [Finneas] gets hole card ['S3', 'CK'], current stack 1156
player [Yuchun] gets hole card ['DT', 'D9'], current stack 1202
player [Zheng] gets hole card ['CT', 'H3'], current stack 1144
Started the round 46
Street "preflop" started. (community card = [])
"YueShi" declared "fold:0"
"Finneas" declared "call:10"
"Yuchun" declared "fold:0"
"Zheng" declared "call:10"
"ZifengFoldMan" declared "fold:0"
"JoyoPlayer" declared "fold:0"
Street "flop" started. (community card = ['C9', 'HQ', 'DJ'])
"Finneas" declared "call:0"
"Zheng" declared "call:0"
Street "turn" started. (community card = ['C9', 'HQ', 'DJ', 'HA'])
"Finneas" declared "call:0"
"Zheng" declared "call:0"
Street "river" started. (community card = ['C9', 'HQ', 'DJ', 'HA', 'SJ'])
"Finneas" declared "call:0"
"Zheng" declared "call:0"
"['Finneas']" won the round 46 (stack = {'EvanPlayer': 0, 'ZifengFoldMan': 900, 'JoyoPlayer': 2685, 'YueShi': 895, 'Finneas': 1181, 'Yuchun': 1202, 'Zheng': 1134, 'RaphaelPlayer': 0})
player [ZifengFoldMan] gets hole card ['S8', 'H4'], current stack 900
player [JoyoPlayer] gets hole card ['C3', 'SJ'], current stack 2680
player [YueShi] gets hole card ['HA', 'DK'], current stack 885
player [Finneas] gets hole card ['DT', 'C7'], current stack 1181
player [Yuchun] gets hole card ['D9', 'S5'], current stack 1202
player [Zheng] gets hole card ['CT', 'CA'], current stack 1134
Started the round 47
Street "preflop" started. (community card = [])
"Finneas" declared "call:10"
"Yuchun" declared "fold:0"
"Zheng" declared "call:10"
"ZifengFoldMan" declared "fold:0"
"JoyoPlayer" declared "fold:0"
"YueShi" declared "fold:0"
Street "flop" started. (community card = ['H9', 'C4', 'HJ'])
"Finneas" declared "call:0"
"Zheng" declared "call:0"
Street "turn" started. (community card = ['H9', 'C4', 'HJ', 'H8'])
"Finneas" declared "call:0"
"Zheng" declared "call:0"
Street "river" started. (community card = ['H9', 'C4', 'HJ', 'H8', 'SK'])
"Finneas" declared "call:0"
"Zheng" declared "call:0"
"['Finneas']" won the round 47 (stack = {'EvanPlayer': 0, 'ZifengFoldMan': 900, 'JoyoPlayer': 2680, 'YueShi': 885, 'Finneas': 1206, 'Yuchun': 1202, 'Zheng': 1124, 'RaphaelPlayer': 0})
player [ZifengFoldMan] gets hole card ['H4', 'DT'], current stack 900
player [JoyoPlayer] gets hole card ['D2', 'DA'], current stack 2680
player [YueShi] gets hole card ['HK', 'HT'], current stack 880
player [Finneas] gets hole card ['DK', 'S2'], current stack 1196
player [Yuchun] gets hole card ['H8', 'C5'], current stack 1202
player [Zheng] gets hole card ['D7', 'D6'], current stack 1124
Started the round 48
Street "preflop" started. (community card = [])
"Yuchun" declared "fold:0"
"Zheng" declared "call:10"
"ZifengFoldMan" declared "fold:0"
"JoyoPlayer" declared "fold:0"
"YueShi" declared "fold:0"
"Finneas" declared "call:10"
Street "flop" started. (community card = ['H7', 'D5', 'SK'])
"Finneas" declared "call:0"
"Zheng" declared "call:0"
Street "turn" started. (community card = ['H7', 'D5', 'SK', 'H5'])
"Finneas" declared "call:0"
"Zheng" declared "call:0"
Street "river" started. (community card = ['H7', 'D5', 'SK', 'H5', 'DJ'])
"Finneas" declared "call:0"
"Zheng" declared "call:0"
"['Finneas']" won the round 48 (stack = {'EvanPlayer': 0, 'ZifengFoldMan': 900, 'JoyoPlayer': 2680, 'YueShi': 880, 'Finneas': 1221, 'Yuchun': 1202, 'Zheng': 1114, 'RaphaelPlayer': 0})
player [ZifengFoldMan] gets hole card ['HJ', 'D6'], current stack 900
player [JoyoPlayer] gets hole card ['HT', 'H3'], current stack 2680
player [YueShi] gets hole card ['CT', 'DK'], current stack 880
player [Finneas] gets hole card ['D8', 'HK'], current stack 1216
player [Yuchun] gets hole card ['C3', 'SK'], current stack 1192
player [Zheng] gets hole card ['HA', 'C6'], current stack 1114
Started the round 49
Street "preflop" started. (community card = [])
"Zheng" declared "call:10"
"ZifengFoldMan" declared "fold:0"
"JoyoPlayer" declared "fold:0"
"YueShi" declared "fold:0"
"Finneas" declared "call:10"
"Yuchun" declared "fold:0"
Street "flop" started. (community card = ['H5', 'H4', 'DJ'])
"Finneas" declared "call:0"
"Zheng" declared "call:0"
Street "turn" started. (community card = ['H5', 'H4', 'DJ', 'C9'])
"Finneas" declared "call:0"
"Zheng" declared "call:0"
Street "river" started. (community card = ['H5', 'H4', 'DJ', 'C9', 'H2'])
"Finneas" declared "call:0"
"Zheng" declared "call:0"
"['Zheng']" won the round 49 (stack = {'EvanPlayer': 0, 'ZifengFoldMan': 900, 'JoyoPlayer': 2680, 'YueShi': 880, 'Finneas': 1211, 'Yuchun': 1192, 'Zheng': 1134, 'RaphaelPlayer': 0})
player [ZifengFoldMan] gets hole card ['S3', 'C7'], current stack 900
player [JoyoPlayer] gets hole card ['S6', 'D6'], current stack 2680
player [YueShi] gets hole card ['C9', 'S9'], current stack 880
player [Finneas] gets hole card ['D4', 'C5'], current stack 1211
player [Yuchun] gets hole card ['S7', 'DK'], current stack 1187
player [Zheng] gets hole card ['ST', 'S2'], current stack 1124
Started the round 50
Street "preflop" started. (community card = [])
"ZifengFoldMan" declared "fold:0"
"JoyoPlayer" declared "fold:0"
"YueShi" declared "fold:0"
"Finneas" declared "call:10"
"Yuchun" declared "fold:0"
"Zheng" declared "call:10"
Street "flop" started. (community card = ['DA', 'H7', 'H6'])
"Zheng" declared "call:0"
"Finneas" declared "call:0"
Street "turn" started. (community card = ['DA', 'H7', 'H6', 'SQ'])
"Zheng" declared "call:0"
"Finneas" declared "call:0"
Street "river" started. (community card = ['DA', 'H7', 'H6', 'SQ', 'H8'])
"Zheng" declared "call:0"
"Finneas" declared "call:0"
"['Finneas']" won the round 50 (stack = {'EvanPlayer': 0, 'ZifengFoldMan': 900, 'JoyoPlayer': 2680, 'YueShi': 880, 'Finneas': 1226, 'Yuchun': 1187, 'Zheng': 1124, 'RaphaelPlayer': 0})

Game Results:
------------------------------------------------------------
Game 1:
Winner: JoyoPlayer (stack: 2680)
All players' stacks:
  EvanPlayer: 0
  ZifengFoldMan: 900
  JoyoPlayer: 2680
  YueShi: 880
  Finneas: 1226
  Yuchun: 1187
  Zheng: 1124
  RaphaelPlayer: 0
------------------------------------------------------------
