player [EvanPlayer] gets hole card ['DQ', 'D2'], current stack 1000
player [ZifengFoldMan] gets hole card ['SQ', 'SA'], current stack 995
player [JoyoPlayer] gets hole card ['C8', 'S5'], current stack 990
player [YueShi] gets hole card ['C2', 'H9'], current stack 1000
player [Finneas] gets hole card ['DK', 'CK'], current stack 1000
player [Yuchun] gets hole card ['C5', 'D9'], current stack 1000
player [Zheng] gets hole card ['H4', 'D3'], current stack 1000
player [RaphaelPlayer] gets hole card ['D8', 'CA'], current stack 1000
Started the round 1
Street "preflop" started. (community card = [])
"YueShi" declared "fold:0"
"Finneas" declared "raise:507"
"Yuchun" declared "fold:0"
"Zheng" declared "fold:0"
"RaphaelPlayer" declared "fold:0"
"EvanPlayer" declared "call:507"
"ZifengFoldMan" declared "fold:0"
"JoyoPlayer" declared "call:507"
Street "flop" started. (community card = ['SK', 'C7', 'D4'])
"JoyoPlayer" declared "fold:0"
"Finneas" declared "raise:251"
"EvanPlayer" declared "call:251"
Street "turn" started. (community card = ['SK', 'C7', 'D4', 'HK'])
"Finneas" declared "raise:126"
"EvanPlayer" declared "fold:126"
"['Finneas']" won the round 1 (stack = {'EvanPlayer': 242, 'ZifengFoldMan': 995, 'JoyoPlayer': 493, 'YueShi': 1000, 'Finneas': 2270, 'Yuchun': 1000, 'Zheng': 1000, 'RaphaelPlayer': 1000})
player [EvanPlayer] gets hole card ['C3', 'D2'], current stack 242
player [ZifengFoldMan] gets hole card ['HK', 'HJ'], current stack 995
player [JoyoPlayer] gets hole card ['S7', 'S3'], current stack 488
player [YueShi] gets hole card ['D7', 'ST'], current stack 990
player [Finneas] gets hole card ['D6', 'H8'], current stack 2270
player [Yuchun] gets hole card ['DT', 'C7'], current stack 1000
player [Zheng] gets hole card ['DJ', 'HQ'], current stack 1000
player [RaphaelPlayer] gets hole card ['HT', 'CK'], current stack 1000
Started the round 2
Street "preflop" started. (community card = [])
"Finneas" declared "call:10"
"Yuchun" declared "fold:0"
"Zheng" declared "call:10"
"RaphaelPlayer" declared "call:10"
"EvanPlayer" declared "call:10"
"ZifengFoldMan" declared "fold:0"
"JoyoPlayer" declared "fold:0"
"YueShi" declared "fold:0"
Street "flop" started. (community card = ['SA', 'S8', 'D9'])
"Finneas" declared "call:0"
"Zheng" declared "call:0"
"RaphaelPlayer" declared "call:0"
"EvanPlayer" declared "fold:0"
Street "turn" started. (community card = ['SA', 'S8', 'D9', 'HA'])
"Finneas" declared "call:0"
"Zheng" declared "call:0"
"RaphaelPlayer" declared "call:0"
Street "river" started. (community card = ['SA', 'S8', 'D9', 'HA', 'SK'])
"Finneas" declared "call:0"
"Zheng" declared "call:0"
"RaphaelPlayer" declared "raise:65"
"Finneas" declared "fold:0"
"Zheng" declared "fold:0"
"['RaphaelPlayer']" won the round 2 (stack = {'EvanPlayer': 232, 'ZifengFoldMan': 995, 'JoyoPlayer': 488, 'YueShi': 990, 'Finneas': 2260, 'Yuchun': 1000, 'Zheng': 990, 'RaphaelPlayer': 1045})
player [EvanPlayer] gets hole card ['H3', 'D9'], current stack 232
player [ZifengFoldMan] gets hole card ['D2', 'H9'], current stack 995
player [JoyoPlayer] gets hole card ['DK', 'D3'], current stack 488
player [YueShi] gets hole card ['HT', 'C6'], current stack 985
player [Finneas] gets hole card ['D5', 'SK'], current stack 2250
player [Yuchun] gets hole card ['C4', 'H4'], current stack 1000
player [Zheng] gets hole card ['H8', 'ST'], current stack 990
player [RaphaelPlayer] gets hole card ['S6', 'H5'], current stack 1045
Started the round 3
Street "preflop" started. (community card = [])
"Yuchun" declared "fold:0"
"Zheng" declared "call:10"
"RaphaelPlayer" declared "fold:0"
"EvanPlayer" declared "raise:232"
"ZifengFoldMan" declared "fold:0"
"JoyoPlayer" declared "raise:454"
"YueShi" declared "fold:0"
"Finneas" declared "fold:0"
"Zheng" declared "fold:0"
Street "flop" started. (community card = ['C9', 'HQ', 'S5'])
Street "turn" started. (community card = ['C9', 'HQ', 'S5', 'C5'])
Street "river" started. (community card = ['C9', 'HQ', 'S5', 'C5', 'CJ'])
"['EvanPlayer']" won the round 3 (stack = {'EvanPlayer': 489, 'ZifengFoldMan': 995, 'JoyoPlayer': 256, 'YueShi': 985, 'Finneas': 2250, 'Yuchun': 1000, 'Zheng': 980, 'RaphaelPlayer': 1045})
player [EvanPlayer] gets hole card ['SJ', 'DK'], current stack 489
player [ZifengFoldMan] gets hole card ['S4', 'D2'], current stack 995
player [JoyoPlayer] gets hole card ['HA', 'D4'], current stack 256
player [YueShi] gets hole card ['D7', 'CK'], current stack 985
player [Finneas] gets hole card ['HQ', 'H5'], current stack 2245
player [Yuchun] gets hole card ['H8', 'DA'], current stack 990
player [Zheng] gets hole card ['S7', 'C2'], current stack 980
player [RaphaelPlayer] gets hole card ['SA', 'HJ'], current stack 1045
Started the round 4
Street "preflop" started. (community card = [])
"Zheng" declared "call:10"
"RaphaelPlayer" declared "call:10"
"EvanPlayer" declared "raise:489"
"ZifengFoldMan" declared "fold:0"
"JoyoPlayer" declared "call:489"
"YueShi" declared "fold:0"
"Finneas" declared "fold:0"
"Yuchun" declared "fold:0"
"Zheng" declared "fold:0"
"RaphaelPlayer" declared "fold:0"
Street "flop" started. (community card = ['C6', 'S9', 'H6'])
Street "turn" started. (community card = ['C6', 'S9', 'H6', 'C9'])
Street "river" started. (community card = ['C6', 'S9', 'H6', 'C9', 'S6'])
"['EvanPlayer', 'JoyoPlayer']" won the round 4 (stack = {'EvanPlayer': 506, 'ZifengFoldMan': 995, 'JoyoPlayer': 273, 'YueShi': 985, 'Finneas': 2245, 'Yuchun': 990, 'Zheng': 970, 'RaphaelPlayer': 1035})
player [EvanPlayer] gets hole card ['DJ', 'D2'], current stack 506
player [ZifengFoldMan] gets hole card ['S7', 'CJ'], current stack 995
player [JoyoPlayer] gets hole card ['C6', 'C9'], current stack 273
player [YueShi] gets hole card ['D4', 'S5'], current stack 985
player [Finneas] gets hole card ['D3', 'D6'], current stack 2245
player [Yuchun] gets hole card ['HJ', 'CA'], current stack 985
player [Zheng] gets hole card ['C7', 'SA'], current stack 960
player [RaphaelPlayer] gets hole card ['CK', 'S9'], current stack 1035
Started the round 5
Street "preflop" started. (community card = [])
"RaphaelPlayer" declared "call:10"
"EvanPlayer" declared "raise:506"
"ZifengFoldMan" declared "fold:0"
"JoyoPlayer" declared "call:506"
"YueShi" declared "fold:0"
"Finneas" declared "fold:0"
"Yuchun" declared "fold:0"
"Zheng" declared "fold:0"
"RaphaelPlayer" declared "fold:0"
Street "flop" started. (community card = ['SJ', 'DQ', 'H5'])
Street "turn" started. (community card = ['SJ', 'DQ', 'H5', 'D5'])
Street "river" started. (community card = ['SJ', 'DQ', 'H5', 'D5', 'H3'])
"['EvanPlayer']" won the round 5 (stack = {'EvanPlayer': 804, 'ZifengFoldMan': 995, 'JoyoPlayer': 0, 'YueShi': 985, 'Finneas': 2245, 'Yuchun': 985, 'Zheng': 960, 'RaphaelPlayer': 1025})
player [EvanPlayer] gets hole card ['CK', 'C9'], current stack 804
player [ZifengFoldMan] gets hole card ['S3', 'C5'], current stack 995
player [YueShi] gets hole card ['S8', 'CJ'], current stack 985
player [Finneas] gets hole card ['H9', 'SJ'], current stack 2245
player [Yuchun] gets hole card ['D7', 'HQ'], current stack 985
player [Zheng] gets hole card ['ST', 'S7'], current stack 955
player [RaphaelPlayer] gets hole card ['DA', 'S4'], current stack 1015
Started the round 6
Street "preflop" started. (community card = [])
"EvanPlayer" declared "raise:804"
"ZifengFoldMan" declared "fold:0"
"YueShi" declared "fold:0"
"Finneas" declared "fold:0"
"Yuchun" declared "fold:0"
"Zheng" declared "fold:0"
"RaphaelPlayer" declared "fold:0"
"['EvanPlayer']" won the round 6 (stack = {'EvanPlayer': 819, 'ZifengFoldMan': 995, 'JoyoPlayer': 0, 'YueShi': 985, 'Finneas': 2245, 'Yuchun': 985, 'Zheng': 955, 'RaphaelPlayer': 1015})
player [EvanPlayer] gets hole card ['C9', 'H6'], current stack 809
player [ZifengFoldMan] gets hole card ['DT', 'C5'], current stack 995
player [YueShi] gets hole card ['SA', 'C3'], current stack 985
player [Finneas] gets hole card ['CQ', 'S2'], current stack 2245
player [Yuchun] gets hole card ['CA', 'SQ'], current stack 985
player [Zheng] gets hole card ['S8', 'CK'], current stack 955
player [RaphaelPlayer] gets hole card ['H9', 'D4'], current stack 1010
Started the round 7
Street "preflop" started. (community card = [])
"ZifengFoldMan" declared "fold:0"
"YueShi" declared "fold:0"
"Finneas" declared "call:10"
"Yuchun" declared "fold:0"
"Zheng" declared "call:10"
"RaphaelPlayer" declared "fold:0"
"EvanPlayer" declared "fold:10"
Street "flop" started. (community card = ['S5', 'D5', 'DQ'])
"Finneas" declared "call:0"
"Zheng" declared "call:0"
Street "turn" started. (community card = ['S5', 'D5', 'DQ', 'HJ'])
"Finneas" declared "call:0"
"Zheng" declared "call:0"
Street "river" started. (community card = ['S5', 'D5', 'DQ', 'HJ', 'SJ'])
"Finneas" declared "call:0"
"Zheng" declared "call:0"
"['Finneas']" won the round 7 (stack = {'EvanPlayer': 809, 'ZifengFoldMan': 995, 'JoyoPlayer': 0, 'YueShi': 985, 'Finneas': 2270, 'Yuchun': 985, 'Zheng': 945, 'RaphaelPlayer': 1010})
player [EvanPlayer] gets hole card ['ST', 'DJ'], current stack 804
player [ZifengFoldMan] gets hole card ['DT', 'C8'], current stack 985
player [YueShi] gets hole card ['DA', 'CA'], current stack 985
player [Finneas] gets hole card ['CT', 'S8'], current stack 2270
player [Yuchun] gets hole card ['C4', 'SA'], current stack 985
player [Zheng] gets hole card ['S2', 'S5'], current stack 945
player [RaphaelPlayer] gets hole card ['D7', 'DQ'], current stack 1010
Started the round 8
Street "preflop" started. (community card = [])
"YueShi" declared "fold:0"
"Finneas" declared "call:10"
"Yuchun" declared "fold:0"
"Zheng" declared "call:10"
"RaphaelPlayer" declared "call:10"
"EvanPlayer" declared "raise:809"
"ZifengFoldMan" declared "fold:0"
"Finneas" declared "fold:0"
"Zheng" declared "fold:0"
"RaphaelPlayer" declared "fold:0"
"['EvanPlayer']" won the round 8 (stack = {'EvanPlayer': 849, 'ZifengFoldMan': 985, 'JoyoPlayer': 0, 'YueShi': 985, 'Finneas': 2260, 'Yuchun': 985, 'Zheng': 935, 'RaphaelPlayer': 1000})
player [EvanPlayer] gets hole card ['DT', 'C5'], current stack 849
player [ZifengFoldMan] gets hole card ['DA', 'D8'], current stack 980
player [YueShi] gets hole card ['H2', 'H7'], current stack 975
player [Finneas] gets hole card ['HK', 'H4'], current stack 2260
player [Yuchun] gets hole card ['C9', 'D3'], current stack 985
player [Zheng] gets hole card ['SA', 'C3'], current stack 935
player [RaphaelPlayer] gets hole card ['HT', 'CA'], current stack 1000
Started the round 9
Street "preflop" started. (community card = [])
"Finneas" declared "call:10"
"Yuchun" declared "fold:0"
"Zheng" declared "call:10"
"RaphaelPlayer" declared "raise:30"
"EvanPlayer" declared "raise:849"
"ZifengFoldMan" declared "fold:0"
"YueShi" declared "fold:0"
"Finneas" declared "fold:0"
"Zheng" declared "fold:0"
"RaphaelPlayer" declared "fold:0"
"['EvanPlayer']" won the round 9 (stack = {'EvanPlayer': 914, 'ZifengFoldMan': 980, 'JoyoPlayer': 0, 'YueShi': 975, 'Finneas': 2250, 'Yuchun': 985, 'Zheng': 925, 'RaphaelPlayer': 970})
player [EvanPlayer] gets hole card ['CK', 'S9'], current stack 914
player [ZifengFoldMan] gets hole card ['D6', 'SK'], current stack 980
player [YueShi] gets hole card ['DJ', 'DQ'], current stack 970
player [Finneas] gets hole card ['S7', 'S6'], current stack 2240
player [Yuchun] gets hole card ['C6', 'CA'], current stack 985
player [Zheng] gets hole card ['HQ', 'HJ'], current stack 925
player [RaphaelPlayer] gets hole card ['SA', 'H4'], current stack 970
Started the round 10
Street "preflop" started. (community card = [])
"Yuchun" declared "call:10"
"Zheng" declared "call:10"
"RaphaelPlayer" declared "call:10"
"EvanPlayer" declared "call:10"
"ZifengFoldMan" declared "fold:0"
"YueShi" declared "fold:0"
"Finneas" declared "call:10"
Street "flop" started. (community card = ['CQ', 'C9', 'C8'])
"Finneas" declared "call:0"
"Yuchun" declared "raise:975"
"Zheng" declared "fold:0"
"RaphaelPlayer" declared "fold:0"
"EvanPlayer" declared "call:975"
"Finneas" declared "fold:0"
Street "turn" started. (community card = ['CQ', 'C9', 'C8', 'D3'])
Street "river" started. (community card = ['CQ', 'C9', 'C8', 'D3', 'HT'])
"['Yuchun']" won the round 10 (stack = {'EvanPlayer': 0, 'ZifengFoldMan': 980, 'JoyoPlayer': 0, 'YueShi': 970, 'Finneas': 2240, 'Yuchun': 1934, 'Zheng': 915, 'RaphaelPlayer': 960})
player [ZifengFoldMan] gets hole card ['H3', 'S7'], current stack 980
player [YueShi] gets hole card ['DT', 'C5'], current stack 970
player [Finneas] gets hole card ['C4', 'D9'], current stack 2235
player [Yuchun] gets hole card ['SK', 'C3'], current stack 1924
player [Zheng] gets hole card ['D8', 'HJ'], current stack 915
player [RaphaelPlayer] gets hole card ['H7', 'HA'], current stack 960
Started the round 11
Street "preflop" started. (community card = [])
"Zheng" declared "call:10"
"RaphaelPlayer" declared "call:10"
"ZifengFoldMan" declared "fold:0"
"YueShi" declared "fold:0"
"Finneas" declared "call:10"
"Yuchun" declared "call:10"
Street "flop" started. (community card = ['D7', 'S4', 'S8'])
"Finneas" declared "call:0"
"Yuchun" declared "call:0"
"Zheng" declared "call:0"
"RaphaelPlayer" declared "call:0"
Street "turn" started. (community card = ['D7', 'S4', 'S8', 'D6'])
"Finneas" declared "call:0"
"Yuchun" declared "call:0"
"Zheng" declared "call:0"
"RaphaelPlayer" declared "call:0"
Street "river" started. (community card = ['D7', 'S4', 'S8', 'D6', 'CA'])
"Finneas" declared "call:0"
"Yuchun" declared "call:0"
"Zheng" declared "call:0"
"RaphaelPlayer" declared "raise:50"
"Finneas" declared "fold:0"
"Yuchun" declared "fold:0"
"Zheng" declared "fold:0"
"['RaphaelPlayer']" won the round 11 (stack = {'EvanPlayer': 0, 'ZifengFoldMan': 980, 'JoyoPlayer': 0, 'YueShi': 970, 'Finneas': 2230, 'Yuchun': 1924, 'Zheng': 905, 'RaphaelPlayer': 990})
player [ZifengFoldMan] gets hole card ['D4', 'D7'], current stack 980
player [YueShi] gets hole card ['HQ', 'H8'], current stack 970
player [Finneas] gets hole card ['H9', 'H7'], current stack 2230
player [Yuchun] gets hole card ['DA', 'H3'], current stack 1919
player [Zheng] gets hole card ['HJ', 'S4'], current stack 895
player [RaphaelPlayer] gets hole card ['D5', 'H6'], current stack 990
Started the round 12
Street "preflop" started. (community card = [])
"RaphaelPlayer" declared "fold:0"
"ZifengFoldMan" declared "fold:0"
"YueShi" declared "fold:0"
"Finneas" declared "call:10"
"Yuchun" declared "call:10"
"Zheng" declared "call:10"
Street "flop" started. (community card = ['C5', 'S8', 'SA'])
"Yuchun" declared "raise:40"
"Zheng" declared "fold:0"
"Finneas" declared "fold:0"
"['Yuchun']" won the round 12 (stack = {'EvanPlayer': 0, 'ZifengFoldMan': 980, 'JoyoPlayer': 0, 'YueShi': 970, 'Finneas': 2220, 'Yuchun': 1944, 'Zheng': 895, 'RaphaelPlayer': 990})
player [ZifengFoldMan] gets hole card ['S2', 'H2'], current stack 980
player [YueShi] gets hole card ['D3', 'D2'], current stack 970
player [Finneas] gets hole card ['C2', 'H7'], current stack 2220
player [Yuchun] gets hole card ['S5', 'DQ'], current stack 1944
player [Zheng] gets hole card ['SA', 'DA'], current stack 890
player [RaphaelPlayer] gets hole card ['S4', 'CQ'], current stack 980
Started the round 13
Street "preflop" started. (community card = [])
"ZifengFoldMan" declared "fold:0"
"YueShi" declared "fold:0"
"Finneas" declared "call:10"
"Yuchun" declared "call:10"
"Zheng" declared "call:10"
"RaphaelPlayer" declared "fold:0"
Street "flop" started. (community card = ['S3', 'D7', 'DT'])
"Zheng" declared "call:0"
"Finneas" declared "call:0"
"Yuchun" declared "call:0"
Street "turn" started. (community card = ['S3', 'D7', 'DT', 'D4'])
"Zheng" declared "call:0"
"Finneas" declared "call:0"
"Yuchun" declared "call:0"
Street "river" started. (community card = ['S3', 'D7', 'DT', 'D4', 'C9'])
"Zheng" declared "call:0"
"Finneas" declared "call:0"
"Yuchun" declared "call:0"
"['Zheng']" won the round 13 (stack = {'EvanPlayer': 0, 'ZifengFoldMan': 980, 'JoyoPlayer': 0, 'YueShi': 970, 'Finneas': 2210, 'Yuchun': 1934, 'Zheng': 925, 'RaphaelPlayer': 980})
player [ZifengFoldMan] gets hole card ['ST', 'S8'], current stack 970
player [YueShi] gets hole card ['D3', 'H6'], current stack 970
player [Finneas] gets hole card ['CQ', 'DA'], current stack 2210
player [Yuchun] gets hole card ['S3', 'H4'], current stack 1934
player [Zheng] gets hole card ['CJ', 'S9'], current stack 925
player [RaphaelPlayer] gets hole card ['S6', 'H3'], current stack 975
Started the round 14
Street "preflop" started. (community card = [])
"YueShi" declared "fold:0"
"Finneas" declared "raise:1112"
"Yuchun" declared "fold:0"
"Zheng" declared "fold:0"
"RaphaelPlayer" declared "fold:0"
"ZifengFoldMan" declared "fold:0"
"['Finneas']" won the round 14 (stack = {'EvanPlayer': 0, 'ZifengFoldMan': 970, 'JoyoPlayer': 0, 'YueShi': 970, 'Finneas': 2225, 'Yuchun': 1934, 'Zheng': 925, 'RaphaelPlayer': 975})
player [ZifengFoldMan] gets hole card ['DQ', 'DA'], current stack 965
player [YueShi] gets hole card ['C5', 'SA'], current stack 960
player [Finneas] gets hole card ['H9', 'D4'], current stack 2225
player [Yuchun] gets hole card ['DK', 'H8'], current stack 1934
player [Zheng] gets hole card ['CA', 'C4'], current stack 925
player [RaphaelPlayer] gets hole card ['C8', 'C7'], current stack 975
Started the round 15
Street "preflop" started. (community card = [])
"Finneas" declared "call:10"
"Yuchun" declared "call:10"
"Zheng" declared "call:10"
"RaphaelPlayer" declared "fold:0"
"ZifengFoldMan" declared "fold:0"
"YueShi" declared "fold:0"
Street "flop" started. (community card = ['CK', 'D5', 'C2'])
"Finneas" declared "call:0"
"Yuchun" declared "call:0"
"Zheng" declared "call:0"
Street "turn" started. (community card = ['CK', 'D5', 'C2', 'ST'])
"Finneas" declared "call:0"
"Yuchun" declared "raise:40"
"Zheng" declared "fold:0"
"Finneas" declared "fold:0"
"['Yuchun']" won the round 15 (stack = {'EvanPlayer': 0, 'ZifengFoldMan': 965, 'JoyoPlayer': 0, 'YueShi': 960, 'Finneas': 2215, 'Yuchun': 1969, 'Zheng': 915, 'RaphaelPlayer': 975})
player [ZifengFoldMan] gets hole card ['H7', 'DQ'], current stack 965
player [YueShi] gets hole card ['CJ', 'S9'], current stack 955
player [Finneas] gets hole card ['DT', 'HJ'], current stack 2205
player [Yuchun] gets hole card ['SA', 'HQ'], current stack 1969
player [Zheng] gets hole card ['DK', 'D5'], current stack 915
player [RaphaelPlayer] gets hole card ['HK', 'S4'], current stack 975
Started the round 16
Street "preflop" started. (community card = [])
"Yuchun" declared "call:10"
"Zheng" declared "call:10"
"RaphaelPlayer" declared "fold:0"
"ZifengFoldMan" declared "fold:0"
"YueShi" declared "fold:0"
"Finneas" declared "call:10"
Street "flop" started. (community card = ['S7', 'D4', 'C7'])
"Finneas" declared "call:0"
"Yuchun" declared "call:0"
"Zheng" declared "call:0"
Street "turn" started. (community card = ['S7', 'D4', 'C7', 'H3'])
"Finneas" declared "call:0"
"Yuchun" declared "call:0"
"Zheng" declared "call:0"
Street "river" started. (community card = ['S7', 'D4', 'C7', 'H3', 'C4'])
"Finneas" declared "call:0"
"Yuchun" declared "call:0"
"Zheng" declared "call:0"
"['Yuchun']" won the round 16 (stack = {'EvanPlayer': 0, 'ZifengFoldMan': 965, 'JoyoPlayer': 0, 'YueShi': 955, 'Finneas': 2205, 'Yuchun': 1994, 'Zheng': 905, 'RaphaelPlayer': 975})
player [ZifengFoldMan] gets hole card ['H2', 'CT'], current stack 965
player [YueShi] gets hole card ['SA', 'H8'], current stack 955
player [Finneas] gets hole card ['H7', 'H4'], current stack 2200
player [Yuchun] gets hole card ['S8', 'C2'], current stack 1984
player [Zheng] gets hole card ['HQ', 'D7'], current stack 905
player [RaphaelPlayer] gets hole card ['C9', 'S7'], current stack 975
Started the round 17
Street "preflop" started. (community card = [])
"Zheng" declared "call:10"
"RaphaelPlayer" declared "fold:0"
"ZifengFoldMan" declared "fold:0"
"YueShi" declared "fold:0"
"Finneas" declared "call:10"
"Yuchun" declared "call:10"
Street "flop" started. (community card = ['H9', 'C4', 'DK'])
"Finneas" declared "call:0"
"Yuchun" declared "call:0"
"Zheng" declared "call:0"
Street "turn" started. (community card = ['H9', 'C4', 'DK', 'DQ'])
"Finneas" declared "call:0"
"Yuchun" declared "call:0"
"Zheng" declared "call:0"
Street "river" started. (community card = ['H9', 'C4', 'DK', 'DQ', 'C8'])
"Finneas" declared "call:0"
"Yuchun" declared "call:0"
"Zheng" declared "call:0"
"['Zheng']" won the round 17 (stack = {'EvanPlayer': 0, 'ZifengFoldMan': 965, 'JoyoPlayer': 0, 'YueShi': 955, 'Finneas': 2195, 'Yuchun': 1984, 'Zheng': 925, 'RaphaelPlayer': 975})
player [ZifengFoldMan] gets hole card ['C8', 'H3'], current stack 965
player [YueShi] gets hole card ['HJ', 'S2'], current stack 955
player [Finneas] gets hole card ['CK', 'H9'], current stack 2195
player [Yuchun] gets hole card ['D4', 'D9'], current stack 1979
player [Zheng] gets hole card ['H7', 'DT'], current stack 915
player [RaphaelPlayer] gets hole card ['C6', 'H5'], current stack 975
Started the round 18
Street "preflop" started. (community card = [])
"RaphaelPlayer" declared "fold:0"
"ZifengFoldMan" declared "fold:0"
"YueShi" declared "fold:0"
"Finneas" declared "call:10"
"Yuchun" declared "call:10"
"Zheng" declared "call:10"
Street "flop" started. (community card = ['H6', 'S9', 'DJ'])
"Yuchun" declared "call:0"
"Zheng" declared "call:0"
"Finneas" declared "call:0"
Street "turn" started. (community card = ['H6', 'S9', 'DJ', 'C2'])
"Yuchun" declared "call:0"
"Zheng" declared "call:0"
"Finneas" declared "call:0"
Street "river" started. (community card = ['H6', 'S9', 'DJ', 'C2', 'D7'])
"Yuchun" declared "call:0"
"Zheng" declared "call:0"
"Finneas" declared "call:0"
"['Finneas']" won the round 18 (stack = {'EvanPlayer': 0, 'ZifengFoldMan': 965, 'JoyoPlayer': 0, 'YueShi': 955, 'Finneas': 2215, 'Yuchun': 1974, 'Zheng': 915, 'RaphaelPlayer': 975})
player [ZifengFoldMan] gets hole card ['S7', 'CT'], current stack 965
player [YueShi] gets hole card ['C6', 'HQ'], current stack 955
player [Finneas] gets hole card ['C2', 'C7'], current stack 2215
player [Yuchun] gets hole card ['H3', 'S5'], current stack 1974
player [Zheng] gets hole card ['S6', 'C5'], current stack 910
player [RaphaelPlayer] gets hole card ['C4', 'D9'], current stack 965
Started the round 19
Street "preflop" started. (community card = [])
"ZifengFoldMan" declared "fold:0"
"YueShi" declared "fold:0"
"Finneas" declared "call:10"
"Yuchun" declared "call:10"
"Zheng" declared "call:10"
"RaphaelPlayer" declared "fold:0"
Street "flop" started. (community card = ['CA', 'S2', 'H7'])
"Zheng" declared "call:0"
"Finneas" declared "call:0"
"Yuchun" declared "call:0"
Street "turn" started. (community card = ['CA', 'S2', 'H7', 'D8'])
"Zheng" declared "call:0"
"Finneas" declared "call:0"
"Yuchun" declared "call:0"
Street "river" started. (community card = ['CA', 'S2', 'H7', 'D8', 'C8'])
"Zheng" declared "call:0"
"Finneas" declared "call:0"
"Yuchun" declared "call:0"
"['Finneas']" won the round 19 (stack = {'EvanPlayer': 0, 'ZifengFoldMan': 965, 'JoyoPlayer': 0, 'YueShi': 955, 'Finneas': 2245, 'Yuchun': 1964, 'Zheng': 905, 'RaphaelPlayer': 965})
player [ZifengFoldMan] gets hole card ['S8', 'H4'], current stack 955
player [YueShi] gets hole card ['S5', 'D5'], current stack 955
player [Finneas] gets hole card ['SJ', 'C3'], current stack 2245
player [Yuchun] gets hole card ['D7', 'HA'], current stack 1964
player [Zheng] gets hole card ['CJ', 'HQ'], current stack 905
player [RaphaelPlayer] gets hole card ['H2', 'D2'], current stack 960
Started the round 20
Street "preflop" started. (community card = [])
"YueShi" declared "fold:0"
"Finneas" declared "call:10"
"Yuchun" declared "call:10"
"Zheng" declared "call:10"
"RaphaelPlayer" declared "fold:0"
"ZifengFoldMan" declared "fold:0"
Street "flop" started. (community card = ['DA', 'H6', 'HJ'])
"Finneas" declared "call:0"
"Yuchun" declared "raise:40"
"Zheng" declared "call:40"
"Finneas" declared "fold:0"
Street "turn" started. (community card = ['DA', 'H6', 'HJ', 'S2'])
"Yuchun" declared "raise:1914"
"Zheng" declared "fold:0"
"['Yuchun']" won the round 20 (stack = {'EvanPlayer': 0, 'ZifengFoldMan': 955, 'JoyoPlayer': 0, 'YueShi': 955, 'Finneas': 2235, 'Yuchun': 2039, 'Zheng': 855, 'RaphaelPlayer': 960})
player [ZifengFoldMan] gets hole card ['C7', 'H4'], current stack 950
player [YueShi] gets hole card ['S5', 'C3'], current stack 945
player [Finneas] gets hole card ['D9', 'H2'], current stack 2235
player [Yuchun] gets hole card ['C2', 'SJ'], current stack 2039
player [Zheng] gets hole card ['D5', 'H3'], current stack 855
player [RaphaelPlayer] gets hole card ['CT', 'H8'], current stack 960
Started the round 21
Street "preflop" started. (community card = [])
"Finneas" declared "call:10"
"Yuchun" declared "call:10"
"Zheng" declared "call:10"
"RaphaelPlayer" declared "call:10"
"ZifengFoldMan" declared "fold:0"
"YueShi" declared "fold:0"
Street "flop" started. (community card = ['D8', 'S8', 'DK'])
"Finneas" declared "call:0"
"Yuchun" declared "call:0"
"Zheng" declared "call:0"
"RaphaelPlayer" declared "raise:65"
"Finneas" declared "fold:0"
"Yuchun" declared "call:65"
"Zheng" declared "call:65"
Street "turn" started. (community card = ['D8', 'S8', 'DK', 'D2'])
"Yuchun" declared "call:0"
"Zheng" declared "call:0"
"RaphaelPlayer" declared "raise:260"
"Yuchun" declared "fold:0"
"Zheng" declared "fold:0"
"['RaphaelPlayer']" won the round 21 (stack = {'EvanPlayer': 0, 'ZifengFoldMan': 950, 'JoyoPlayer': 0, 'YueShi': 945, 'Finneas': 2225, 'Yuchun': 1964, 'Zheng': 780, 'RaphaelPlayer': 1135})
player [ZifengFoldMan] gets hole card ['D8', 'HJ'], current stack 950
player [YueShi] gets hole card ['S8', 'S6'], current stack 940
player [Finneas] gets hole card ['H8', 'SK'], current stack 2215
player [Yuchun] gets hole card ['CK', 'HT'], current stack 1964
player [Zheng] gets hole card ['S2', 'H3'], current stack 780
player [RaphaelPlayer] gets hole card ['C5', 'S7'], current stack 1135
Started the round 22
Street "preflop" started. (community card = [])
"Yuchun" declared "call:10"
"Zheng" declared "call:10"
"RaphaelPlayer" declared "fold:0"
"ZifengFoldMan" declared "fold:0"
"YueShi" declared "fold:0"
"Finneas" declared "call:10"
Street "flop" started. (community card = ['SQ', 'HK', 'DJ'])
"Finneas" declared "call:0"
"Yuchun" declared "raise:40"
"Zheng" declared "call:40"
"Finneas" declared "fold:0"
Street "turn" started. (community card = ['SQ', 'HK', 'DJ', 'D4'])
"Yuchun" declared "raise:1914"
"Zheng" declared "fold:0"
"['Yuchun']" won the round 22 (stack = {'EvanPlayer': 0, 'ZifengFoldMan': 950, 'JoyoPlayer': 0, 'YueShi': 940, 'Finneas': 2215, 'Yuchun': 2029, 'Zheng': 730, 'RaphaelPlayer': 1135})
player [ZifengFoldMan] gets hole card ['H9', 'C4'], current stack 950
player [YueShi] gets hole card ['H2', 'H5'], current stack 940
player [Finneas] gets hole card ['DA', 'S6'], current stack 2210
player [Yuchun] gets hole card ['HK', 'H4'], current stack 2019
player [Zheng] gets hole card ['C2', 'HJ'], current stack 730
player [RaphaelPlayer] gets hole card ['D5', 'SK'], current stack 1135
Started the round 23
Street "preflop" started. (community card = [])
"Zheng" declared "call:10"
"RaphaelPlayer" declared "call:10"
"ZifengFoldMan" declared "fold:0"
"YueShi" declared "fold:0"
"Finneas" declared "call:10"
"Yuchun" declared "call:10"
Street "flop" started. (community card = ['C5', 'S2', 'S8'])
"Finneas" declared "call:0"
"Yuchun" declared "call:0"
"Zheng" declared "call:0"
"RaphaelPlayer" declared "call:0"
Street "turn" started. (community card = ['C5', 'S2', 'S8', 'D2'])
"Finneas" declared "call:0"
"Yuchun" declared "call:0"
"Zheng" declared "raise:365"
"RaphaelPlayer" declared "fold:0"
"Finneas" declared "fold:0"
"Yuchun" declared "fold:0"
"['Zheng']" won the round 23 (stack = {'EvanPlayer': 0, 'ZifengFoldMan': 950, 'JoyoPlayer': 0, 'YueShi': 940, 'Finneas': 2205, 'Yuchun': 2019, 'Zheng': 760, 'RaphaelPlayer': 1125})
player [ZifengFoldMan] gets hole card ['C7', 'S5'], current stack 950
player [YueShi] gets hole card ['SK', 'C4'], current stack 940
player [Finneas] gets hole card ['HQ', 'HA'], current stack 2205
player [Yuchun] gets hole card ['CK', 'DQ'], current stack 2014
player [Zheng] gets hole card ['C2', 'D6'], current stack 750
player [RaphaelPlayer] gets hole card ['SJ', 'S2'], current stack 1125
Started the round 24
Street "preflop" started. (community card = [])
"RaphaelPlayer" declared "call:10"
"ZifengFoldMan" declared "fold:0"
"YueShi" declared "fold:0"
"Finneas" declared "raise:1110"
"Yuchun" declared "fold:0"
"Zheng" declared "fold:0"
"RaphaelPlayer" declared "fold:0"
"['Finneas']" won the round 24 (stack = {'EvanPlayer': 0, 'ZifengFoldMan': 950, 'JoyoPlayer': 0, 'YueShi': 940, 'Finneas': 2230, 'Yuchun': 2014, 'Zheng': 750, 'RaphaelPlayer': 1115})
player [ZifengFoldMan] gets hole card ['CK', 'S3'], current stack 950
player [YueShi] gets hole card ['DK', 'C9'], current stack 940
player [Finneas] gets hole card ['HQ', 'CA'], current stack 2230
player [Yuchun] gets hole card ['C7', 'C5'], current stack 2014
player [Zheng] gets hole card ['DA', 'ST'], current stack 745
player [RaphaelPlayer] gets hole card ['HK', 'C4'], current stack 1105
Started the round 25
Street "preflop" started. (community card = [])
"ZifengFoldMan" declared "fold:0"
"YueShi" declared "fold:0"
"Finneas" declared "raise:1122"
"Yuchun" declared "fold:0"
"Zheng" declared "fold:0"
"RaphaelPlayer" declared "fold:0"
"['Finneas']" won the round 25 (stack = {'EvanPlayer': 0, 'ZifengFoldMan': 950, 'JoyoPlayer': 0, 'YueShi': 940, 'Finneas': 2245, 'Yuchun': 2014, 'Zheng': 745, 'RaphaelPlayer': 1105})
player [ZifengFoldMan] gets hole card ['SK', 'HT'], current stack 940
player [YueShi] gets hole card ['S9', 'D3'], current stack 940
player [Finneas] gets hole card ['D7', 'HK'], current stack 2245
player [Yuchun] gets hole card ['HJ', 'DK'], current stack 2014
player [Zheng] gets hole card ['D9', 'CJ'], current stack 745
player [RaphaelPlayer] gets hole card ['D5', 'S3'], current stack 1100
Started the round 26
Street "preflop" started. (community card = [])
"YueShi" declared "fold:0"
"Finneas" declared "call:10"
"Yuchun" declared "call:10"
"Zheng" declared "call:10"
"RaphaelPlayer" declared "fold:0"
"ZifengFoldMan" declared "fold:0"
Street "flop" started. (community card = ['DJ', 'C8', 'HQ'])
"Finneas" declared "call:0"
"Yuchun" declared "call:0"
"Zheng" declared "call:0"
Street "turn" started. (community card = ['DJ', 'C8', 'HQ', 'H2'])
"Finneas" declared "call:0"
"Yuchun" declared "call:0"
"Zheng" declared "call:0"
Street "river" started. (community card = ['DJ', 'C8', 'HQ', 'H2', 'C7'])
"Finneas" declared "call:0"
"Yuchun" declared "call:0"
"Zheng" declared "call:0"
"['Yuchun']" won the round 26 (stack = {'EvanPlayer': 0, 'ZifengFoldMan': 940, 'JoyoPlayer': 0, 'YueShi': 940, 'Finneas': 2235, 'Yuchun': 2049, 'Zheng': 735, 'RaphaelPlayer': 1100})
player [ZifengFoldMan] gets hole card ['S5', 'C2'], current stack 935
player [YueShi] gets hole card ['C4', 'D9'], current stack 930
player [Finneas] gets hole card ['C6', 'SA'], current stack 2235
player [Yuchun] gets hole card ['C9', 'DJ'], current stack 2049
player [Zheng] gets hole card ['S3', 'CK'], current stack 735
player [RaphaelPlayer] gets hole card ['D8', 'H3'], current stack 1100
Started the round 27
Street "preflop" started. (community card = [])
"Finneas" declared "call:10"
"Yuchun" declared "call:10"
"Zheng" declared "call:10"
"RaphaelPlayer" declared "fold:0"
"ZifengFoldMan" declared "fold:0"
"YueShi" declared "fold:0"
Street "flop" started. (community card = ['S7', 'CT', 'D5'])
"Finneas" declared "call:0"
"Yuchun" declared "call:0"
"Zheng" declared "call:0"
Street "turn" started. (community card = ['S7', 'CT', 'D5', 'ST'])
"Finneas" declared "call:0"
"Yuchun" declared "call:0"
"Zheng" declared "call:0"
Street "river" started. (community card = ['S7', 'CT', 'D5', 'ST', 'H9'])
"Finneas" declared "call:0"
"Yuchun" declared "call:0"
"Zheng" declared "call:0"
"['Yuchun']" won the round 27 (stack = {'EvanPlayer': 0, 'ZifengFoldMan': 935, 'JoyoPlayer': 0, 'YueShi': 930, 'Finneas': 2225, 'Yuchun': 2084, 'Zheng': 725, 'RaphaelPlayer': 1100})
player [ZifengFoldMan] gets hole card ['H2', 'S4'], current stack 935
player [YueShi] gets hole card ['D2', 'S2'], current stack 925
player [Finneas] gets hole card ['HT', 'CK'], current stack 2215
player [Yuchun] gets hole card ['CA', 'S6'], current stack 2084
player [Zheng] gets hole card ['CJ', 'S5'], current stack 725
player [RaphaelPlayer] gets hole card ['C5', 'HJ'], current stack 1100
Started the round 28
Street "preflop" started. (community card = [])
"Yuchun" declared "call:10"
"Zheng" declared "call:10"
"RaphaelPlayer" declared "fold:0"
"ZifengFoldMan" declared "fold:0"
"YueShi" declared "fold:0"
"Finneas" declared "call:10"
Street "flop" started. (community card = ['H3', 'SA', 'CT'])
"Finneas" declared "call:0"
"Yuchun" declared "call:0"
"Zheng" declared "call:0"
Street "turn" started. (community card = ['H3', 'SA', 'CT', 'SJ'])
"Finneas" declared "call:0"
"Yuchun" declared "raise:40"
"Zheng" declared "call:40"
"Finneas" declared "fold:0"
Street "river" started. (community card = ['H3', 'SA', 'CT', 'SJ', 'H8'])
"Yuchun" declared "raise:40"
"Zheng" declared "call:40"
"['Yuchun']" won the round 28 (stack = {'EvanPlayer': 0, 'ZifengFoldMan': 935, 'JoyoPlayer': 0, 'YueShi': 925, 'Finneas': 2215, 'Yuchun': 2189, 'Zheng': 635, 'RaphaelPlayer': 1100})
player [ZifengFoldMan] gets hole card ['S5', 'H3'], current stack 935
player [YueShi] gets hole card ['HQ', 'H4'], current stack 925
player [Finneas] gets hole card ['D4', 'ST'], current stack 2210
player [Yuchun] gets hole card ['DK', 'S3'], current stack 2179
player [Zheng] gets hole card ['S2', 'HT'], current stack 635
player [RaphaelPlayer] gets hole card ['H2', 'D5'], current stack 1100
Started the round 29
Street "preflop" started. (community card = [])
"Zheng" declared "call:10"
"RaphaelPlayer" declared "fold:0"
"ZifengFoldMan" declared "fold:0"
"YueShi" declared "fold:0"
"Finneas" declared "call:10"
"Yuchun" declared "call:10"
Street "flop" started. (community card = ['H9', 'H7', 'S6'])
"Finneas" declared "call:0"
"Yuchun" declared "call:0"
"Zheng" declared "call:0"
Street "turn" started. (community card = ['H9', 'H7', 'S6', 'D2'])
"Finneas" declared "call:0"
"Yuchun" declared "call:0"
"Zheng" declared "call:0"
Street "river" started. (community card = ['H9', 'H7', 'S6', 'D2', 'SQ'])
"Finneas" declared "call:0"
"Yuchun" declared "call:0"
"Zheng" declared "call:0"
"['Zheng']" won the round 29 (stack = {'EvanPlayer': 0, 'ZifengFoldMan': 935, 'JoyoPlayer': 0, 'YueShi': 925, 'Finneas': 2205, 'Yuchun': 2179, 'Zheng': 655, 'RaphaelPlayer': 1100})
player [ZifengFoldMan] gets hole card ['HT', 'C9'], current stack 935
player [YueShi] gets hole card ['H7', 'D8'], current stack 925
player [Finneas] gets hole card ['CJ', 'S8'], current stack 2205
player [Yuchun] gets hole card ['C8', 'S6'], current stack 2174
player [Zheng] gets hole card ['DJ', 'D4'], current stack 645
player [RaphaelPlayer] gets hole card ['S5', 'C5'], current stack 1100
Started the round 30
Street "preflop" started. (community card = [])
"RaphaelPlayer" declared "raise:30"
"ZifengFoldMan" declared "fold:0"
"YueShi" declared "fold:0"
"Finneas" declared "fold:0"
"Yuchun" declared "call:30"
"Zheng" declared "call:30"
Street "flop" started. (community card = ['S3', 'D3', 'H2'])
"Yuchun" declared "call:0"
"Zheng" declared "call:0"
"RaphaelPlayer" declared "call:0"
Street "turn" started. (community card = ['S3', 'D3', 'H2', 'S4'])
"Yuchun" declared "call:0"
"Zheng" declared "call:0"
"RaphaelPlayer" declared "raise:100"
"Yuchun" declared "fold:0"
"Zheng" declared "call:100"
Street "river" started. (community card = ['S3', 'D3', 'H2', 'S4', 'D5'])
"Zheng" declared "call:0"
"RaphaelPlayer" declared "raise:300"
"Zheng" declared "fold:0"
"['RaphaelPlayer']" won the round 30 (stack = {'EvanPlayer': 0, 'ZifengFoldMan': 935, 'JoyoPlayer': 0, 'YueShi': 925, 'Finneas': 2205, 'Yuchun': 2149, 'Zheng': 525, 'RaphaelPlayer': 1260})
player [ZifengFoldMan] gets hole card ['C4', 'H9'], current stack 935
player [YueShi] gets hole card ['S4', 'C8'], current stack 925
player [Finneas] gets hole card ['CJ', 'CA'], current stack 2205
player [Yuchun] gets hole card ['DJ', 'DA'], current stack 2149
player [Zheng] gets hole card ['DT', 'D5'], current stack 520
player [RaphaelPlayer] gets hole card ['C2', 'SA'], current stack 1250
Started the round 31
Street "preflop" started. (community card = [])
"ZifengFoldMan" declared "fold:0"
"YueShi" declared "fold:0"
"Finneas" declared "call:10"
"Yuchun" declared "call:10"
"Zheng" declared "call:10"
"RaphaelPlayer" declared "call:10"
Street "flop" started. (community card = ['ST', 'H8', 'D6'])
"Zheng" declared "call:0"
"RaphaelPlayer" declared "call:0"
"Finneas" declared "call:0"
"Yuchun" declared "call:0"
Street "turn" started. (community card = ['ST', 'H8', 'D6', 'H6'])
"Zheng" declared "call:0"
"RaphaelPlayer" declared "call:0"
"Finneas" declared "call:0"
"Yuchun" declared "call:0"
Street "river" started. (community card = ['ST', 'H8', 'D6', 'H6', 'D7'])
"Zheng" declared "call:0"
"RaphaelPlayer" declared "call:0"
"Finneas" declared "call:0"
"Yuchun" declared "call:0"
"['Zheng']" won the round 31 (stack = {'EvanPlayer': 0, 'ZifengFoldMan': 935, 'JoyoPlayer': 0, 'YueShi': 925, 'Finneas': 2195, 'Yuchun': 2139, 'Zheng': 555, 'RaphaelPlayer': 1250})
player [ZifengFoldMan] gets hole card ['D7', 'S6'], current stack 925
player [YueShi] gets hole card ['ST', 'S9'], current stack 925
player [Finneas] gets hole card ['S3', 'H2'], current stack 2195
player [Yuchun] gets hole card ['CT', 'HQ'], current stack 2139
player [Zheng] gets hole card ['H4', 'C6'], current stack 555
player [RaphaelPlayer] gets hole card ['D9', 'DK'], current stack 1245
Started the round 32
Street "preflop" started. (community card = [])
"YueShi" declared "fold:0"
"Finneas" declared "call:10"
"Yuchun" declared "call:10"
"Zheng" declared "call:10"
"RaphaelPlayer" declared "call:10"
"ZifengFoldMan" declared "fold:0"
Street "flop" started. (community card = ['HK', 'HA', 'S4'])
"RaphaelPlayer" declared "call:0"
"Finneas" declared "call:0"
"Yuchun" declared "call:0"
"Zheng" declared "call:0"
Street "turn" started. (community card = ['HK', 'HA', 'S4', 'D2'])
"RaphaelPlayer" declared "call:0"
"Finneas" declared "call:0"
"Yuchun" declared "call:0"
"Zheng" declared "call:0"
Street "river" started. (community card = ['HK', 'HA', 'S4', 'D2', 'D5'])
"RaphaelPlayer" declared "call:0"
"Finneas" declared "call:0"
"Yuchun" declared "call:0"
"Zheng" declared "call:0"
"['Finneas']" won the round 32 (stack = {'EvanPlayer': 0, 'ZifengFoldMan': 925, 'JoyoPlayer': 0, 'YueShi': 925, 'Finneas': 2235, 'Yuchun': 2129, 'Zheng': 545, 'RaphaelPlayer': 1240})
player [ZifengFoldMan] gets hole card ['H3', 'S2'], current stack 920
player [YueShi] gets hole card ['S5', 'SA'], current stack 915
player [Finneas] gets hole card ['SK', 'H9'], current stack 2235
player [Yuchun] gets hole card ['D5', 'C6'], current stack 2129
player [Zheng] gets hole card ['H5', 'H8'], current stack 545
player [RaphaelPlayer] gets hole card ['S6', 'H6'], current stack 1240
Started the round 33
Street "preflop" started. (community card = [])
"Finneas" declared "call:10"
"Yuchun" declared "call:10"
"Zheng" declared "call:10"
"RaphaelPlayer" declared "raise:30"
"ZifengFoldMan" declared "fold:0"
"YueShi" declared "fold:0"
"Finneas" declared "fold:0"
"Yuchun" declared "call:30"
"Zheng" declared "call:30"
Street "flop" started. (community card = ['D4', 'CA', 'DA'])
"Yuchun" declared "call:0"
"Zheng" declared "call:0"
"RaphaelPlayer" declared "call:0"
Street "turn" started. (community card = ['D4', 'CA', 'DA', 'HJ'])
"Yuchun" declared "call:0"
"Zheng" declared "call:0"
"RaphaelPlayer" declared "call:0"
Street "river" started. (community card = ['D4', 'CA', 'DA', 'HJ', 'HA'])
"Yuchun" declared "call:0"
"Zheng" declared "call:0"
"RaphaelPlayer" declared "raise:125"
"Yuchun" declared "fold:0"
"Zheng" declared "call:125"
"['RaphaelPlayer']" won the round 33 (stack = {'EvanPlayer': 0, 'ZifengFoldMan': 920, 'JoyoPlayer': 0, 'YueShi': 915, 'Finneas': 2225, 'Yuchun': 2099, 'Zheng': 390, 'RaphaelPlayer': 1450})
player [ZifengFoldMan] gets hole card ['HK', 'H8'], current stack 920
player [YueShi] gets hole card ['D5', 'H4'], current stack 910
player [Finneas] gets hole card ['H3', 'HA'], current stack 2215
player [Yuchun] gets hole card ['CK', 'C3'], current stack 2099
player [Zheng] gets hole card ['H2', 'C5'], current stack 390
player [RaphaelPlayer] gets hole card ['DK', 'DT'], current stack 1450
Started the round 34
Street "preflop" started. (community card = [])
"Yuchun" declared "call:10"
"Zheng" declared "call:10"
"RaphaelPlayer" declared "raise:30"
"ZifengFoldMan" declared "fold:0"
"YueShi" declared "fold:0"
"Finneas" declared "fold:0"
"Yuchun" declared "call:30"
"Zheng" declared "call:30"
Street "flop" started. (community card = ['C7', 'C8', 'H5'])
"Yuchun" declared "call:0"
"Zheng" declared "call:0"
"RaphaelPlayer" declared "call:0"
Street "turn" started. (community card = ['C7', 'C8', 'H5', 'CA'])
"Yuchun" declared "raise:2069"
"Zheng" declared "fold:0"
"RaphaelPlayer" declared "fold:0"
"['Yuchun']" won the round 34 (stack = {'EvanPlayer': 0, 'ZifengFoldMan': 920, 'JoyoPlayer': 0, 'YueShi': 910, 'Finneas': 2215, 'Yuchun': 2174, 'Zheng': 360, 'RaphaelPlayer': 1420})
player [ZifengFoldMan] gets hole card ['DK', 'C8'], current stack 920
player [YueShi] gets hole card ['H7', 'SQ'], current stack 910
player [Finneas] gets hole card ['C9', 'CK'], current stack 2210
player [Yuchun] gets hole card ['HA', 'CT'], current stack 2164
player [Zheng] gets hole card ['D5', 'DQ'], current stack 360
player [RaphaelPlayer] gets hole card ['H8', 'HT'], current stack 1420
Started the round 35
Street "preflop" started. (community card = [])
"Zheng" declared "call:10"
"RaphaelPlayer" declared "call:10"
"ZifengFoldMan" declared "fold:0"
"YueShi" declared "fold:0"
"Finneas" declared "call:10"
"Yuchun" declared "call:10"
Street "flop" started. (community card = ['H2', 'D3', 'CJ'])
"Finneas" declared "call:0"
"Yuchun" declared "call:0"
"Zheng" declared "call:0"
"RaphaelPlayer" declared "call:0"
Street "turn" started. (community card = ['H2', 'D3', 'CJ', 'C4'])
"Finneas" declared "call:0"
"Yuchun" declared "call:0"
"Zheng" declared "call:0"
"RaphaelPlayer" declared "call:0"
Street "river" started. (community card = ['H2', 'D3', 'CJ', 'C4', 'SJ'])
"Finneas" declared "call:0"
"Yuchun" declared "call:0"
"Zheng" declared "call:0"
"RaphaelPlayer" declared "call:0"
"['Yuchun']" won the round 35 (stack = {'EvanPlayer': 0, 'ZifengFoldMan': 920, 'JoyoPlayer': 0, 'YueShi': 910, 'Finneas': 2205, 'Yuchun': 2204, 'Zheng': 350, 'RaphaelPlayer': 1410})
player [ZifengFoldMan] gets hole card ['CQ', 'S2'], current stack 920
player [YueShi] gets hole card ['DA', 'SQ'], current stack 910
player [Finneas] gets hole card ['S5', 'SK'], current stack 2205
player [Yuchun] gets hole card ['H6', 'S9'], current stack 2199
player [Zheng] gets hole card ['H9', 'HT'], current stack 340
player [RaphaelPlayer] gets hole card ['H4', 'C5'], current stack 1410
Started the round 36
Street "preflop" started. (community card = [])
"RaphaelPlayer" declared "fold:0"
"ZifengFoldMan" declared "fold:0"
"YueShi" declared "fold:0"
"Finneas" declared "call:10"
"Yuchun" declared "call:10"
"Zheng" declared "call:10"
Street "flop" started. (community card = ['S6', 'C9', 'HQ'])
"Yuchun" declared "raise:40"
"Zheng" declared "call:40"
"Finneas" declared "fold:0"
Street "turn" started. (community card = ['S6', 'C9', 'HQ', 'HK'])
"Yuchun" declared "raise:2154"
"Zheng" declared "fold:0"
"['Yuchun']" won the round 36 (stack = {'EvanPlayer': 0, 'ZifengFoldMan': 920, 'JoyoPlayer': 0, 'YueShi': 910, 'Finneas': 2195, 'Yuchun': 2264, 'Zheng': 300, 'RaphaelPlayer': 1410})
player [ZifengFoldMan] gets hole card ['H9', 'DQ'], current stack 920
player [YueShi] gets hole card ['D8', 'CJ'], current stack 910
player [Finneas] gets hole card ['CQ', 'C7'], current stack 2195
player [Yuchun] gets hole card ['S4', 'H5'], current stack 2264
player [Zheng] gets hole card ['D6', 'H4'], current stack 295
player [RaphaelPlayer] gets hole card ['S2', 'S7'], current stack 1400
Started the round 37
Street "preflop" started. (community card = [])
"ZifengFoldMan" declared "fold:0"
"YueShi" declared "fold:0"
"Finneas" declared "call:10"
"Yuchun" declared "call:10"
"Zheng" declared "call:10"
"RaphaelPlayer" declared "fold:0"
Street "flop" started. (community card = ['D9', 'SK', 'C5'])
"Zheng" declared "call:0"
"Finneas" declared "call:0"
"Yuchun" declared "call:0"
Street "turn" started. (community card = ['D9', 'SK', 'C5', 'C4'])
"Zheng" declared "call:0"
"Finneas" declared "call:0"
"Yuchun" declared "raise:40"
"Zheng" declared "call:40"
"Finneas" declared "fold:0"
Street "river" started. (community card = ['D9', 'SK', 'C5', 'C4', 'ST'])
"Zheng" declared "call:0"
"Yuchun" declared "raise:2214"
"Zheng" declared "fold:0"
"['Yuchun']" won the round 37 (stack = {'EvanPlayer': 0, 'ZifengFoldMan': 920, 'JoyoPlayer': 0, 'YueShi': 910, 'Finneas': 2185, 'Yuchun': 2334, 'Zheng': 250, 'RaphaelPlayer': 1400})
player [ZifengFoldMan] gets hole card ['C8', 'D3'], current stack 910
player [YueShi] gets hole card ['S3', 'D8'], current stack 910
player [Finneas] gets hole card ['DJ', 'S6'], current stack 2185
player [Yuchun] gets hole card ['D5', 'HQ'], current stack 2334
player [Zheng] gets hole card ['HK', 'HT'], current stack 250
player [RaphaelPlayer] gets hole card ['S5', 'H8'], current stack 1395
Started the round 38
Street "preflop" started. (community card = [])
"YueShi" declared "fold:0"
"Finneas" declared "call:10"
"Yuchun" declared "call:10"
"Zheng" declared "call:10"
"RaphaelPlayer" declared "fold:0"
"ZifengFoldMan" declared "fold:0"
Street "flop" started. (community card = ['SQ', 'C7', 'H7'])
"Finneas" declared "call:0"
"Yuchun" declared "call:0"
"Zheng" declared "call:0"
Street "turn" started. (community card = ['SQ', 'C7', 'H7', 'CA'])
"Finneas" declared "call:0"
"Yuchun" declared "call:0"
"Zheng" declared "call:0"
Street "river" started. (community card = ['SQ', 'C7', 'H7', 'CA', 'CQ'])
"Finneas" declared "call:0"
"Yuchun" declared "raise:2324"
"Zheng" declared "fold:0"
"Finneas" declared "fold:0"
"['Yuchun']" won the round 38 (stack = {'EvanPlayer': 0, 'ZifengFoldMan': 910, 'JoyoPlayer': 0, 'YueShi': 910, 'Finneas': 2175, 'Yuchun': 2369, 'Zheng': 240, 'RaphaelPlayer': 1395})
player [ZifengFoldMan] gets hole card ['HQ', 'D3'], current stack 905
player [YueShi] gets hole card ['D8', 'ST'], current stack 900
player [Finneas] gets hole card ['D9', 'SJ'], current stack 2175
player [Yuchun] gets hole card ['HA', 'D2'], current stack 2369
player [Zheng] gets hole card ['CK', 'C9'], current stack 240
player [RaphaelPlayer] gets hole card ['C5', 'HK'], current stack 1395
Started the round 39
Street "preflop" started. (community card = [])
"Finneas" declared "call:10"
"Yuchun" declared "call:10"
"Zheng" declared "call:10"
"RaphaelPlayer" declared "call:10"
"ZifengFoldMan" declared "fold:0"
"YueShi" declared "fold:0"
Street "flop" started. (community card = ['H6', 'DK', 'S6'])
"Finneas" declared "call:0"
"Yuchun" declared "call:0"
"Zheng" declared "call:0"
"RaphaelPlayer" declared "raise:65"
"Finneas" declared "fold:0"
"Yuchun" declared "call:65"
"Zheng" declared "call:65"
Street "turn" started. (community card = ['H6', 'DK', 'S6', 'H4'])
"Yuchun" declared "call:0"
"Zheng" declared "call:0"
"RaphaelPlayer" declared "raise:260"
"Yuchun" declared "fold:0"
"Zheng" declared "fold:0"
"['RaphaelPlayer']" won the round 39 (stack = {'EvanPlayer': 0, 'ZifengFoldMan': 905, 'JoyoPlayer': 0, 'YueShi': 900, 'Finneas': 2165, 'Yuchun': 2294, 'Zheng': 165, 'RaphaelPlayer': 1570})
player [ZifengFoldMan] gets hole card ['H3', 'S7'], current stack 905
player [YueShi] gets hole card ['C8', 'DK'], current stack 895
player [Finneas] gets hole card ['H8', 'SK'], current stack 2155
player [Yuchun] gets hole card ['H5', 'CA'], current stack 2294
player [Zheng] gets hole card ['C3', 'DA'], current stack 165
player [RaphaelPlayer] gets hole card ['HK', 'CQ'], current stack 1570
Started the round 40
Street "preflop" started. (community card = [])
"Yuchun" declared "call:10"
"Zheng" declared "call:10"
"RaphaelPlayer" declared "call:10"
"ZifengFoldMan" declared "fold:0"
"YueShi" declared "fold:0"
"Finneas" declared "call:10"
Street "flop" started. (community card = ['DQ', 'D7', 'H2'])
"Finneas" declared "call:0"
"Yuchun" declared "call:0"
"Zheng" declared "call:0"
"RaphaelPlayer" declared "raise:55"
"Finneas" declared "fold:0"
"Yuchun" declared "call:55"
"Zheng" declared "call:55"
Street "turn" started. (community card = ['DQ', 'D7', 'H2', 'D3'])
"Yuchun" declared "call:0"
"Zheng" declared "call:0"
"RaphaelPlayer" declared "raise:220"
"Yuchun" declared "fold:0"
"Zheng" declared "fold:0"
"['RaphaelPlayer']" won the round 40 (stack = {'EvanPlayer': 0, 'ZifengFoldMan': 905, 'JoyoPlayer': 0, 'YueShi': 895, 'Finneas': 2155, 'Yuchun': 2229, 'Zheng': 100, 'RaphaelPlayer': 1715})
player [ZifengFoldMan] gets hole card ['H6', 'HJ'], current stack 905
player [YueShi] gets hole card ['S9', 'H9'], current stack 895
player [Finneas] gets hole card ['H4', 'HT'], current stack 2150
player [Yuchun] gets hole card ['C7', 'S7'], current stack 2219
player [Zheng] gets hole card ['D3', 'CJ'], current stack 100
player [RaphaelPlayer] gets hole card ['DT', 'S2'], current stack 1715
Started the round 41
Street "preflop" started. (community card = [])
"Zheng" declared "call:10"
"RaphaelPlayer" declared "fold:0"
"ZifengFoldMan" declared "fold:0"
"YueShi" declared "fold:0"
"Finneas" declared "call:10"
"Yuchun" declared "call:10"
Street "flop" started. (community card = ['ST', 'H2', 'S8'])
"Finneas" declared "call:0"
"Yuchun" declared "fold:0"
"Zheng" declared "call:0"
Street "turn" started. (community card = ['ST', 'H2', 'S8', 'D7'])
"Finneas" declared "call:0"
"Zheng" declared "call:0"
Street "river" started. (community card = ['ST', 'H2', 'S8', 'D7', 'C2'])
"Finneas" declared "call:0"
"Zheng" declared "call:0"
"['Finneas']" won the round 41 (stack = {'EvanPlayer': 0, 'ZifengFoldMan': 905, 'JoyoPlayer': 0, 'YueShi': 895, 'Finneas': 2175, 'Yuchun': 2219, 'Zheng': 90, 'RaphaelPlayer': 1715})
player [ZifengFoldMan] gets hole card ['HT', 'C3'], current stack 905
player [YueShi] gets hole card ['DT', 'D6'], current stack 895
player [Finneas] gets hole card ['C5', 'S3'], current stack 2175
player [Yuchun] gets hole card ['S9', 'DQ'], current stack 2214
player [Zheng] gets hole card ['D8', 'H8'], current stack 80
player [RaphaelPlayer] gets hole card ['H7', 'HK'], current stack 1715
Started the round 42
Street "preflop" started. (community card = [])
"RaphaelPlayer" declared "call:10"
"ZifengFoldMan" declared "fold:0"
"YueShi" declared "fold:0"
"Finneas" declared "call:10"
"Yuchun" declared "fold:0"
"Zheng" declared "call:10"
Street "flop" started. (community card = ['CJ', 'SQ', 'D3'])
"Zheng" declared "call:0"
"RaphaelPlayer" declared "call:0"
"Finneas" declared "call:0"
Street "turn" started. (community card = ['CJ', 'SQ', 'D3', 'DJ'])
"Zheng" declared "call:0"
"RaphaelPlayer" declared "call:0"
"Finneas" declared "call:0"
Street "river" started. (community card = ['CJ', 'SQ', 'D3', 'DJ', 'H5'])
"Zheng" declared "call:0"
"RaphaelPlayer" declared "call:0"
"Finneas" declared "call:0"
"['Zheng']" won the round 42 (stack = {'EvanPlayer': 0, 'ZifengFoldMan': 905, 'JoyoPlayer': 0, 'YueShi': 895, 'Finneas': 2165, 'Yuchun': 2214, 'Zheng': 115, 'RaphaelPlayer': 1705})
player [ZifengFoldMan] gets hole card ['SQ', 'D7'], current stack 905
player [YueShi] gets hole card ['S8', 'H2'], current stack 895
player [Finneas] gets hole card ['CQ', 'H9'], current stack 2165
player [Yuchun] gets hole card ['C9', 'HK'], current stack 2214
player [Zheng] gets hole card ['SK', 'HT'], current stack 110
player [RaphaelPlayer] gets hole card ['DT', 'DK'], current stack 1695
Started the round 43
Street "preflop" started. (community card = [])
"ZifengFoldMan" declared "fold:0"
"YueShi" declared "fold:0"
"Finneas" declared "call:10"
"Yuchun" declared "fold:0"
"Zheng" declared "call:10"
"RaphaelPlayer" declared "call:10"
Street "flop" started. (community card = ['D8', 'H6', 'D9'])
"Zheng" declared "call:0"
"RaphaelPlayer" declared "call:0"
"Finneas" declared "call:0"
Street "turn" started. (community card = ['D8', 'H6', 'D9', 'H8'])
"Zheng" declared "call:0"
"RaphaelPlayer" declared "call:0"
"Finneas" declared "call:0"
Street "river" started. (community card = ['D8', 'H6', 'D9', 'H8', 'CA'])
"Zheng" declared "call:0"
"RaphaelPlayer" declared "call:0"
"Finneas" declared "call:0"
"['Finneas']" won the round 43 (stack = {'EvanPlayer': 0, 'ZifengFoldMan': 905, 'JoyoPlayer': 0, 'YueShi': 895, 'Finneas': 2185, 'Yuchun': 2214, 'Zheng': 105, 'RaphaelPlayer': 1695})
player [ZifengFoldMan] gets hole card ['CT', 'DT'], current stack 895
player [YueShi] gets hole card ['H3', 'H9'], current stack 895
player [Finneas] gets hole card ['S2', 'D5'], current stack 2185
player [Yuchun] gets hole card ['DQ', 'H6'], current stack 2214
player [Zheng] gets hole card ['H2', 'DK'], current stack 105
player [RaphaelPlayer] gets hole card ['SA', 'D4'], current stack 1690
Started the round 44
Street "preflop" started. (community card = [])
"YueShi" declared "fold:0"
"Finneas" declared "call:10"
"Yuchun" declared "fold:0"
"Zheng" declared "call:10"
"RaphaelPlayer" declared "call:10"
"ZifengFoldMan" declared "fold:0"
Street "flop" started. (community card = ['H5', 'CK', 'CJ'])
"RaphaelPlayer" declared "call:0"
"Finneas" declared "call:0"
"Zheng" declared "call:0"
Street "turn" started. (community card = ['H5', 'CK', 'CJ', 'C8'])
"RaphaelPlayer" declared "call:0"
"Finneas" declared "call:0"
"Zheng" declared "call:0"
Street "river" started. (community card = ['H5', 'CK', 'CJ', 'C8', 'C9'])
"RaphaelPlayer" declared "call:0"
"Finneas" declared "call:0"
"Zheng" declared "call:0"
"['Zheng']" won the round 44 (stack = {'EvanPlayer': 0, 'ZifengFoldMan': 895, 'JoyoPlayer': 0, 'YueShi': 895, 'Finneas': 2175, 'Yuchun': 2214, 'Zheng': 135, 'RaphaelPlayer': 1685})
player [ZifengFoldMan] gets hole card ['S7', 'H2'], current stack 890
player [YueShi] gets hole card ['S5', 'SA'], current stack 885
player [Finneas] gets hole card ['H6', 'CA'], current stack 2175
player [Yuchun] gets hole card ['DK', 'D7'], current stack 2214
player [Zheng] gets hole card ['HA', 'CK'], current stack 135
player [RaphaelPlayer] gets hole card ['DA', 'H7'], current stack 1685
Started the round 45
Street "preflop" started. (community card = [])
"Finneas" declared "call:10"
"Yuchun" declared "fold:0"
"Zheng" declared "call:10"
"RaphaelPlayer" declared "call:10"
"ZifengFoldMan" declared "fold:0"
"YueShi" declared "fold:0"
Street "flop" started. (community card = ['D8', 'C4', 'C5'])
"Finneas" declared "call:0"
"Zheng" declared "call:0"
"RaphaelPlayer" declared "call:0"
Street "turn" started. (community card = ['D8', 'C4', 'C5', 'S2'])
"Finneas" declared "call:0"
"Zheng" declared "call:0"
"RaphaelPlayer" declared "call:0"
Street "river" started. (community card = ['D8', 'C4', 'C5', 'S2', 'C6'])
"Finneas" declared "call:0"
"Zheng" declared "call:0"
"RaphaelPlayer" declared "raise:55"
"Finneas" declared "fold:0"
"Zheng" declared "call:55"
"['RaphaelPlayer']" won the round 45 (stack = {'EvanPlayer': 0, 'ZifengFoldMan': 890, 'JoyoPlayer': 0, 'YueShi': 885, 'Finneas': 2165, 'Yuchun': 2214, 'Zheng': 70, 'RaphaelPlayer': 1775})
player [ZifengFoldMan] gets hole card ['H2', 'D6'], current stack 890
player [YueShi] gets hole card ['D7', 'SQ'], current stack 880
player [Finneas] gets hole card ['SA', 'DT'], current stack 2155
player [Yuchun] gets hole card ['C5', 'H3'], current stack 2214
player [Zheng] gets hole card ['H7', 'C3'], current stack 70
player [RaphaelPlayer] gets hole card ['HK', 'HA'], current stack 1775
Started the round 46
Street "preflop" started. (community card = [])
"Yuchun" declared "fold:0"
"Zheng" declared "call:10"
"RaphaelPlayer" declared "raise:30"
"ZifengFoldMan" declared "fold:0"
"YueShi" declared "fold:0"
"Finneas" declared "fold:0"
"Zheng" declared "call:30"
Street "flop" started. (community card = ['C4', 'H8', 'DA'])
"Zheng" declared "call:0"
"RaphaelPlayer" declared "raise:85"
"Zheng" declared "call:85"
Street "turn" started. (community card = ['C4', 'H8', 'DA', 'D9'])
Street "river" started. (community card = ['C4', 'H8', 'DA', 'D9', 'HQ'])
"['RaphaelPlayer']" won the round 46 (stack = {'EvanPlayer': 0, 'ZifengFoldMan': 890, 'JoyoPlayer': 0, 'YueShi': 880, 'Finneas': 2155, 'Yuchun': 2214, 'Zheng': 0, 'RaphaelPlayer': 1860})
player [ZifengFoldMan] gets hole card ['C3', 'HA'], current stack 890
player [YueShi] gets hole card ['S2', 'C8'], current stack 880
player [Finneas] gets hole card ['DA', 'D4'], current stack 2150
player [Yuchun] gets hole card ['S7', 'CQ'], current stack 2204
player [RaphaelPlayer] gets hole card ['SK', 'D6'], current stack 1860
Started the round 47
Street "preflop" started. (community card = [])
"RaphaelPlayer" declared "call:10"
"ZifengFoldMan" declared "fold:0"
"YueShi" declared "fold:0"
"Finneas" declared "call:10"
"Yuchun" declared "fold:0"
Street "flop" started. (community card = ['D7', 'HT', 'SJ'])
"Finneas" declared "call:0"
"RaphaelPlayer" declared "call:0"
Street "turn" started. (community card = ['D7', 'HT', 'SJ', 'H6'])
"Finneas" declared "call:0"
"RaphaelPlayer" declared "raise:40"
"Finneas" declared "fold:0"
"['RaphaelPlayer']" won the round 47 (stack = {'EvanPlayer': 0, 'ZifengFoldMan': 890, 'JoyoPlayer': 0, 'YueShi': 880, 'Finneas': 2145, 'Yuchun': 2204, 'Zheng': 0, 'RaphaelPlayer': 1880})
player [ZifengFoldMan] gets hole card ['S2', 'H6'], current stack 890
player [YueShi] gets hole card ['CQ', 'CT'], current stack 880
player [Finneas] gets hole card ['DT', 'SA'], current stack 2145
player [Yuchun] gets hole card ['HT', 'HA'], current stack 2199
player [RaphaelPlayer] gets hole card ['D6', 'H9'], current stack 1870
Started the round 48
Street "preflop" started. (community card = [])
"ZifengFoldMan" declared "fold:0"
"YueShi" declared "fold:0"
"Finneas" declared "call:10"
"Yuchun" declared "fold:0"
"RaphaelPlayer" declared "fold:0"
"['Finneas']" won the round 48 (stack = {'EvanPlayer': 0, 'ZifengFoldMan': 890, 'JoyoPlayer': 0, 'YueShi': 880, 'Finneas': 2160, 'Yuchun': 2199, 'Zheng': 0, 'RaphaelPlayer': 1870})
player [ZifengFoldMan] gets hole card ['S2', 'C9'], current stack 880
player [YueShi] gets hole card ['S6', 'C4'], current stack 880
player [Finneas] gets hole card ['HJ', 'S4'], current stack 2160
player [Yuchun] gets hole card ['CJ', 'HA'], current stack 2199
player [RaphaelPlayer] gets hole card ['C3', 'DT'], current stack 1865
Started the round 49
Street "preflop" started. (community card = [])
"YueShi" declared "fold:0"
"Finneas" declared "call:10"
"Yuchun" declared "fold:0"
"RaphaelPlayer" declared "fold:0"
"ZifengFoldMan" declared "fold:0"
"['Finneas']" won the round 49 (stack = {'EvanPlayer': 0, 'ZifengFoldMan': 880, 'JoyoPlayer': 0, 'YueShi': 880, 'Finneas': 2175, 'Yuchun': 2199, 'Zheng': 0, 'RaphaelPlayer': 1865})
player [ZifengFoldMan] gets hole card ['DK', 'SQ'], current stack 875
player [YueShi] gets hole card ['S7', 'C9'], current stack 870
player [Finneas] gets hole card ['H8', 'D6'], current stack 2175
player [Yuchun] gets hole card ['C3', 'CK'], current stack 2199
player [RaphaelPlayer] gets hole card ['D8', 'C8'], current stack 1865
Started the round 50
Street "preflop" started. (community card = [])
"Finneas" declared "call:10"
"Yuchun" declared "fold:0"
"RaphaelPlayer" declared "raise:30"
"ZifengFoldMan" declared "fold:0"
"YueShi" declared "fold:0"
"Finneas" declared "fold:0"
"['RaphaelPlayer']" won the round 50 (stack = {'EvanPlayer': 0, 'ZifengFoldMan': 875, 'JoyoPlayer': 0, 'YueShi': 870, 'Finneas': 2165, 'Yuchun': 2199, 'Zheng': 0, 'RaphaelPlayer': 1890})

Game Results:
------------------------------------------------------------
Game 1:
Winner: Yuchun (stack: 2199)
All players' stacks:
  EvanPlayer: 0
  ZifengFoldMan: 875
  JoyoPlayer: 0
  YueShi: 870
  Finneas: 2165
  Yuchun: 2199
  Zheng: 0
  RaphaelPlayer: 1890
------------------------------------------------------------
