player [EvanPlayer] gets hole card ['DK', 'D5'], current stack 1000
player [ZifengFoldMan] gets hole card ['D2', 'C8'], current stack 995
player [JoyoPlayer] gets hole card ['D3', 'C5'], current stack 990
player [YueShi] gets hole card ['CT', 'C7'], current stack 1000
player [Finneas] gets hole card ['HK', 'H5'], current stack 1000
player [Yuchun] gets hole card ['ST', 'CQ'], current stack 1000
player [Zheng] gets hole card ['HA', 'DJ'], current stack 1000
player [RaphaelPlayer] gets hole card ['HJ', 'H9'], current stack 1000
Started the round 1
Street "preflop" started. (community card = [])
"YueShi" declared "fold:0"
"Finneas" declared "call:10"
"Yuchun" declared "fold:0"
"Zheng" declared "call:10"
"RaphaelPlayer" declared "call:10"
"EvanPlayer" declared "raise:1000"
"ZifengFoldMan" declared "fold:0"
"JoyoPlayer" declared "fold:0"
"Finneas" declared "fold:0"
"Zheng" declared "fold:0"
"RaphaelPlayer" declared "fold:0"
"['EvanPlayer']" won the round 1 (stack = {'EvanPlayer': 1045, 'ZifengFoldMan': 995, 'JoyoPlayer': 990, 'YueShi': 1000, 'Finneas': 990, 'Yuchun': 1000, 'Zheng': 990, 'RaphaelPlayer': 990})
player [EvanPlayer] gets hole card ['HJ', 'H6'], current stack 1045
player [ZifengFoldMan] gets hole card ['D9', 'HT'], current stack 995
player [JoyoPlayer] gets hole card ['H4', 'DT'], current stack 985
player [YueShi] gets hole card ['S5', 'S6'], current stack 990
player [Finneas] gets hole card ['CT', 'DA'], current stack 990
player [Yuchun] gets hole card ['S7', 'CQ'], current stack 1000
player [Zheng] gets hole card ['C2', 'D7'], current stack 990
player [RaphaelPlayer] gets hole card ['CA', 'H5'], current stack 990
Started the round 2
Street "preflop" started. (community card = [])
"Finneas" declared "call:10"
"Yuchun" declared "fold:0"
"Zheng" declared "call:10"
"RaphaelPlayer" declared "call:10"
"EvanPlayer" declared "raise:1045"
"ZifengFoldMan" declared "fold:0"
"JoyoPlayer" declared "fold:0"
"YueShi" declared "fold:0"
"Finneas" declared "fold:0"
"Zheng" declared "fold:0"
"RaphaelPlayer" declared "fold:0"
"['EvanPlayer']" won the round 2 (stack = {'EvanPlayer': 1090, 'ZifengFoldMan': 995, 'JoyoPlayer': 985, 'YueShi': 990, 'Finneas': 980, 'Yuchun': 1000, 'Zheng': 980, 'RaphaelPlayer': 980})
player [EvanPlayer] gets hole card ['S5', 'D3'], current stack 1090
player [ZifengFoldMan] gets hole card ['D4', 'H6'], current stack 995
player [JoyoPlayer] gets hole card ['S9', 'CT'], current stack 985
player [YueShi] gets hole card ['S2', 'H7'], current stack 985
player [Finneas] gets hole card ['H9', 'DA'], current stack 970
player [Yuchun] gets hole card ['S8', 'CA'], current stack 1000
player [Zheng] gets hole card ['DJ', 'S6'], current stack 980
player [RaphaelPlayer] gets hole card ['SK', 'H3'], current stack 980
Started the round 3
Street "preflop" started. (community card = [])
"Yuchun" declared "fold:0"
"Zheng" declared "call:10"
"RaphaelPlayer" declared "fold:0"
"EvanPlayer" declared "call:10"
"ZifengFoldMan" declared "fold:0"
"JoyoPlayer" declared "fold:0"
"YueShi" declared "fold:0"
"Finneas" declared "call:10"
Street "flop" started. (community card = ['D5', 'S7', 'HT'])
"Finneas" declared "call:0"
"Zheng" declared "call:0"
"EvanPlayer" declared "fold:0"
Street "turn" started. (community card = ['D5', 'S7', 'HT', 'S4'])
"Finneas" declared "call:0"
"Zheng" declared "call:0"
Street "river" started. (community card = ['D5', 'S7', 'HT', 'S4', 'DT'])
"Finneas" declared "call:0"
"Zheng" declared "call:0"
"['Finneas']" won the round 3 (stack = {'EvanPlayer': 1080, 'ZifengFoldMan': 995, 'JoyoPlayer': 985, 'YueShi': 985, 'Finneas': 1005, 'Yuchun': 1000, 'Zheng': 970, 'RaphaelPlayer': 980})
player [EvanPlayer] gets hole card ['S5', 'HA'], current stack 1080
player [ZifengFoldMan] gets hole card ['C9', 'H4'], current stack 995
player [JoyoPlayer] gets hole card ['D8', 'H7'], current stack 985
player [YueShi] gets hole card ['CA', 'HK'], current stack 985
player [Finneas] gets hole card ['C3', 'S9'], current stack 1000
player [Yuchun] gets hole card ['S8', 'C5'], current stack 990
player [Zheng] gets hole card ['HT', 'C4'], current stack 970
player [RaphaelPlayer] gets hole card ['S4', 'D5'], current stack 980
Started the round 4
Street "preflop" started. (community card = [])
"Zheng" declared "call:10"
"RaphaelPlayer" declared "fold:0"
"EvanPlayer" declared "call:10"
"ZifengFoldMan" declared "fold:0"
"JoyoPlayer" declared "raise:15"
"YueShi" declared "fold:0"
"Finneas" declared "call:15"
"Yuchun" declared "fold:0"
"Zheng" declared "call:15"
"EvanPlayer" declared "call:15"
Street "flop" started. (community card = ['CT', 'S6', 'HQ'])
"Finneas" declared "call:0"
"Zheng" declared "call:0"
"EvanPlayer" declared "raise:1065"
"JoyoPlayer" declared "fold:0"
"Finneas" declared "fold:0"
"Zheng" declared "fold:0"
"['EvanPlayer']" won the round 4 (stack = {'EvanPlayer': 1135, 'ZifengFoldMan': 995, 'JoyoPlayer': 970, 'YueShi': 985, 'Finneas': 990, 'Yuchun': 990, 'Zheng': 955, 'RaphaelPlayer': 980})
player [EvanPlayer] gets hole card ['S7', 'C2'], current stack 1135
player [ZifengFoldMan] gets hole card ['H6', 'C9'], current stack 995
player [JoyoPlayer] gets hole card ['S6', 'SK'], current stack 970
player [YueShi] gets hole card ['C5', 'DJ'], current stack 985
player [Finneas] gets hole card ['D6', 'H8'], current stack 990
player [Yuchun] gets hole card ['DK', 'CJ'], current stack 985
player [Zheng] gets hole card ['S5', 'H5'], current stack 945
player [RaphaelPlayer] gets hole card ['SQ', 'D7'], current stack 980
Started the round 5
Street "preflop" started. (community card = [])
"RaphaelPlayer" declared "call:10"
"EvanPlayer" declared "call:10"
"ZifengFoldMan" declared "fold:0"
"JoyoPlayer" declared "raise:15"
"YueShi" declared "fold:0"
"Finneas" declared "call:15"
"Yuchun" declared "fold:0"
"Zheng" declared "call:15"
"RaphaelPlayer" declared "call:15"
"EvanPlayer" declared "fold:15"
Street "flop" started. (community card = ['C7', 'HQ', 'S4'])
"Zheng" declared "call:0"
"RaphaelPlayer" declared "raise:85"
"JoyoPlayer" declared "raise:170"
"Finneas" declared "fold:0"
"Zheng" declared "fold:0"
"RaphaelPlayer" declared "call:170"
Street "turn" started. (community card = ['C7', 'HQ', 'S4', 'CK'])
"RaphaelPlayer" declared "raise:425"
"JoyoPlayer" declared "raise:-2"
"['RaphaelPlayer']" won the round 5 (stack = {'EvanPlayer': 1125, 'ZifengFoldMan': 995, 'JoyoPlayer': 785, 'YueShi': 985, 'Finneas': 975, 'Yuchun': 985, 'Zheng': 940, 'RaphaelPlayer': 1210})
player [EvanPlayer] gets hole card ['DT', 'H5'], current stack 1125
player [ZifengFoldMan] gets hole card ['SA', 'ST'], current stack 995
player [JoyoPlayer] gets hole card ['HK', 'CJ'], current stack 785
player [YueShi] gets hole card ['HT', 'SQ'], current stack 985
player [Finneas] gets hole card ['S5', 'SJ'], current stack 975
player [Yuchun] gets hole card ['D4', 'CA'], current stack 985
player [Zheng] gets hole card ['D9', 'S6'], current stack 935
player [RaphaelPlayer] gets hole card ['DJ', 'DK'], current stack 1200
Started the round 6
Street "preflop" started. (community card = [])
"EvanPlayer" declared "raise:1125"
"ZifengFoldMan" declared "fold:0"
"JoyoPlayer" declared "fold:0"
"YueShi" declared "fold:0"
"Finneas" declared "fold:0"
"Yuchun" declared "fold:0"
"Zheng" declared "fold:0"
"RaphaelPlayer" declared "fold:0"
"['EvanPlayer']" won the round 6 (stack = {'EvanPlayer': 1140, 'ZifengFoldMan': 995, 'JoyoPlayer': 785, 'YueShi': 985, 'Finneas': 975, 'Yuchun': 985, 'Zheng': 935, 'RaphaelPlayer': 1200})
player [EvanPlayer] gets hole card ['ST', 'D7'], current stack 1130
player [ZifengFoldMan] gets hole card ['C8', 'D8'], current stack 995
player [JoyoPlayer] gets hole card ['S5', 'HA'], current stack 785
player [YueShi] gets hole card ['D3', 'H7'], current stack 985
player [Finneas] gets hole card ['DA', 'D9'], current stack 975
player [Yuchun] gets hole card ['CT', 'C5'], current stack 985
player [Zheng] gets hole card ['C3', 'S9'], current stack 935
player [RaphaelPlayer] gets hole card ['S4', 'S2'], current stack 1195
Started the round 7
Street "preflop" started. (community card = [])
"ZifengFoldMan" declared "fold:0"
"JoyoPlayer" declared "fold:0"
"YueShi" declared "fold:0"
"Finneas" declared "call:10"
"Yuchun" declared "fold:0"
"Zheng" declared "call:10"
"RaphaelPlayer" declared "fold:0"
"EvanPlayer" declared "raise:1140"
"Finneas" declared "fold:0"
"Zheng" declared "fold:0"
"['EvanPlayer']" won the round 7 (stack = {'EvanPlayer': 1165, 'ZifengFoldMan': 995, 'JoyoPlayer': 785, 'YueShi': 985, 'Finneas': 965, 'Yuchun': 985, 'Zheng': 925, 'RaphaelPlayer': 1195})
player [EvanPlayer] gets hole card ['HQ', 'C6'], current stack 1160
player [ZifengFoldMan] gets hole card ['DJ', 'S7'], current stack 985
player [JoyoPlayer] gets hole card ['SJ', 'H3'], current stack 785
player [YueShi] gets hole card ['D8', 'H4'], current stack 985
player [Finneas] gets hole card ['D6', 'CJ'], current stack 965
player [Yuchun] gets hole card ['D9', 'DK'], current stack 985
player [Zheng] gets hole card ['S4', 'DQ'], current stack 925
player [RaphaelPlayer] gets hole card ['C7', 'H8'], current stack 1195
Started the round 8
Street "preflop" started. (community card = [])
"JoyoPlayer" declared "fold:0"
"YueShi" declared "fold:0"
"Finneas" declared "call:10"
"Yuchun" declared "fold:0"
"Zheng" declared "call:10"
"RaphaelPlayer" declared "fold:0"
"EvanPlayer" declared "call:10"
"ZifengFoldMan" declared "fold:0"
Street "flop" started. (community card = ['C5', 'CT', 'C3'])
"EvanPlayer" declared "fold:0"
"Finneas" declared "call:0"
"Zheng" declared "call:0"
Street "turn" started. (community card = ['C5', 'CT', 'C3', 'C8'])
"Finneas" declared "raise:482"
"Zheng" declared "fold:0"
"['Finneas']" won the round 8 (stack = {'EvanPlayer': 1155, 'ZifengFoldMan': 985, 'JoyoPlayer': 785, 'YueShi': 985, 'Finneas': 995, 'Yuchun': 985, 'Zheng': 915, 'RaphaelPlayer': 1195})
player [EvanPlayer] gets hole card ['S2', 'DT'], current stack 1155
player [ZifengFoldMan] gets hole card ['S3', 'D7'], current stack 980
player [JoyoPlayer] gets hole card ['HK', 'DA'], current stack 775
player [YueShi] gets hole card ['H4', 'S7'], current stack 985
player [Finneas] gets hole card ['C8', 'D8'], current stack 995
player [Yuchun] gets hole card ['H5', 'SK'], current stack 985
player [Zheng] gets hole card ['H7', 'H3'], current stack 915
player [RaphaelPlayer] gets hole card ['DQ', 'D4'], current stack 1195
Started the round 9
Street "preflop" started. (community card = [])
"YueShi" declared "fold:0"
"Finneas" declared "call:10"
"Yuchun" declared "fold:0"
"Zheng" declared "call:10"
"RaphaelPlayer" declared "call:10"
"EvanPlayer" declared "fold:10"
"ZifengFoldMan" declared "fold:0"
"JoyoPlayer" declared "fold:0"
Street "flop" started. (community card = ['SA', 'C9', 'HT'])
"Finneas" declared "call:0"
"Zheng" declared "call:0"
"RaphaelPlayer" declared "call:0"
Street "turn" started. (community card = ['SA', 'C9', 'HT', 'D3'])
"Finneas" declared "call:0"
"Zheng" declared "call:0"
"RaphaelPlayer" declared "call:0"
Street "river" started. (community card = ['SA', 'C9', 'HT', 'D3', 'D5'])
"Finneas" declared "call:0"
"Zheng" declared "call:0"
"RaphaelPlayer" declared "call:0"
"['Finneas']" won the round 9 (stack = {'EvanPlayer': 1155, 'ZifengFoldMan': 980, 'JoyoPlayer': 775, 'YueShi': 985, 'Finneas': 1030, 'Yuchun': 985, 'Zheng': 905, 'RaphaelPlayer': 1185})
player [EvanPlayer] gets hole card ['SA', 'SQ'], current stack 1155
player [ZifengFoldMan] gets hole card ['S7', 'DT'], current stack 980
player [JoyoPlayer] gets hole card ['D8', 'SJ'], current stack 770
player [YueShi] gets hole card ['D5', 'D9'], current stack 975
player [Finneas] gets hole card ['S2', 'C2'], current stack 1030
player [Yuchun] gets hole card ['C6', 'D6'], current stack 985
player [Zheng] gets hole card ['S4', 'H8'], current stack 905
player [RaphaelPlayer] gets hole card ['DA', 'C9'], current stack 1185
Started the round 10
Street "preflop" started. (community card = [])
"Finneas" declared "call:10"
"Yuchun" declared "call:10"
"Zheng" declared "call:10"
"RaphaelPlayer" declared "call:10"
"EvanPlayer" declared "raise:1155"
"ZifengFoldMan" declared "fold:0"
"JoyoPlayer" declared "call:1155"
"YueShi" declared "fold:0"
"Finneas" declared "fold:0"
"Yuchun" declared "fold:0"
"Zheng" declared "fold:0"
"RaphaelPlayer" declared "fold:0"
Street "flop" started. (community card = ['HK', 'C5', 'H9'])
Street "turn" started. (community card = ['HK', 'C5', 'H9', 'HQ'])
Street "river" started. (community card = ['HK', 'C5', 'H9', 'HQ', 'CQ'])
"['EvanPlayer']" won the round 10 (stack = {'EvanPlayer': 1980, 'ZifengFoldMan': 980, 'JoyoPlayer': 0, 'YueShi': 975, 'Finneas': 1020, 'Yuchun': 975, 'Zheng': 895, 'RaphaelPlayer': 1175})
player [EvanPlayer] gets hole card ['H3', 'H6'], current stack 1980
player [ZifengFoldMan] gets hole card ['C7', 'D7'], current stack 980
player [YueShi] gets hole card ['HQ', 'D2'], current stack 975
player [Finneas] gets hole card ['C2', 'CT'], current stack 1015
player [Yuchun] gets hole card ['S8', 'DJ'], current stack 965
player [Zheng] gets hole card ['S5', 'D8'], current stack 895
player [RaphaelPlayer] gets hole card ['SK', 'H5'], current stack 1175
Started the round 11
Street "preflop" started. (community card = [])
"Zheng" declared "call:10"
"RaphaelPlayer" declared "fold:0"
"EvanPlayer" declared "call:10"
"ZifengFoldMan" declared "fold:0"
"YueShi" declared "fold:0"
"Finneas" declared "call:10"
"Yuchun" declared "call:10"
Street "flop" started. (community card = ['DK', 'H7', 'C3'])
"Finneas" declared "call:0"
"Yuchun" declared "call:0"
"Zheng" declared "call:0"
"EvanPlayer" declared "fold:0"
Street "turn" started. (community card = ['DK', 'H7', 'C3', 'D9'])
"Finneas" declared "call:0"
"Yuchun" declared "call:0"
"Zheng" declared "call:0"
Street "river" started. (community card = ['DK', 'H7', 'C3', 'D9', 'S4'])
"Finneas" declared "call:0"
"Yuchun" declared "call:0"
"Zheng" declared "call:0"
"['Yuchun']" won the round 11 (stack = {'EvanPlayer': 1970, 'ZifengFoldMan': 980, 'JoyoPlayer': 0, 'YueShi': 975, 'Finneas': 1010, 'Yuchun': 1005, 'Zheng': 885, 'RaphaelPlayer': 1175})
player [EvanPlayer] gets hole card ['C9', 'C7'], current stack 1970
player [ZifengFoldMan] gets hole card ['DQ', 'D5'], current stack 980
player [YueShi] gets hole card ['C8', 'SJ'], current stack 975
player [Finneas] gets hole card ['CJ', 'C6'], current stack 1010
player [Yuchun] gets hole card ['HA', 'S6'], current stack 1000
player [Zheng] gets hole card ['S2', 'D3'], current stack 875
player [RaphaelPlayer] gets hole card ['D8', 'H8'], current stack 1175
Started the round 12
Street "preflop" started. (community card = [])
"RaphaelPlayer" declared "raise:30"
"EvanPlayer" declared "call:30"
"ZifengFoldMan" declared "fold:0"
"YueShi" declared "fold:0"
"Finneas" declared "fold:0"
"Yuchun" declared "call:30"
"Zheng" declared "fold:0"
Street "flop" started. (community card = ['S5', 'H4', 'HQ'])
"Yuchun" declared "call:0"
"RaphaelPlayer" declared "call:0"
"EvanPlayer" declared "fold:0"
Street "turn" started. (community card = ['S5', 'H4', 'HQ', 'H6'])
"Yuchun" declared "raise:40"
"RaphaelPlayer" declared "raise:220"
"Yuchun" declared "call:220"
Street "river" started. (community card = ['S5', 'H4', 'HQ', 'H6', 'DT'])
"Yuchun" declared "call:0"
"RaphaelPlayer" declared "raise:550"
"Yuchun" declared "fold:0"
"['RaphaelPlayer']" won the round 12 (stack = {'EvanPlayer': 1940, 'ZifengFoldMan': 980, 'JoyoPlayer': 0, 'YueShi': 975, 'Finneas': 1010, 'Yuchun': 755, 'Zheng': 875, 'RaphaelPlayer': 1465})
player [EvanPlayer] gets hole card ['D6', 'C6'], current stack 1940
player [ZifengFoldMan] gets hole card ['S2', 'S3'], current stack 980
player [YueShi] gets hole card ['DQ', 'H6'], current stack 975
player [Finneas] gets hole card ['C5', 'S6'], current stack 1010
player [Yuchun] gets hole card ['D8', 'DJ'], current stack 755
player [Zheng] gets hole card ['ST', 'C7'], current stack 870
player [RaphaelPlayer] gets hole card ['D9', 'H9'], current stack 1455
Started the round 13
Street "preflop" started. (community card = [])
"EvanPlayer" declared "call:10"
"ZifengFoldMan" declared "fold:0"
"YueShi" declared "fold:0"
"Finneas" declared "call:10"
"Yuchun" declared "call:10"
"Zheng" declared "call:10"
"RaphaelPlayer" declared "raise:30"
"EvanPlayer" declared "fold:30"
"Finneas" declared "fold:0"
"Yuchun" declared "call:30"
"Zheng" declared "fold:0"
Street "flop" started. (community card = ['CT', 'H7', 'H3'])
"RaphaelPlayer" declared "raise:100"
"Yuchun" declared "call:100"
Street "turn" started. (community card = ['CT', 'H7', 'H3', 'D7'])
"RaphaelPlayer" declared "raise:300"
"Yuchun" declared "fold:0"
"['RaphaelPlayer']" won the round 13 (stack = {'EvanPlayer': 1930, 'ZifengFoldMan': 980, 'JoyoPlayer': 0, 'YueShi': 975, 'Finneas': 1000, 'Yuchun': 625, 'Zheng': 865, 'RaphaelPlayer': 1625})
player [EvanPlayer] gets hole card ['CA', 'HJ'], current stack 1920
player [ZifengFoldMan] gets hole card ['C9', 'CK'], current stack 980
player [YueShi] gets hole card ['C6', 'D4'], current stack 975
player [Finneas] gets hole card ['H7', 'S6'], current stack 1000
player [Yuchun] gets hole card ['CT', 'DA'], current stack 625
player [Zheng] gets hole card ['S4', 'HQ'], current stack 865
player [RaphaelPlayer] gets hole card ['D9', 'SQ'], current stack 1620
Started the round 14
Street "preflop" started. (community card = [])
"ZifengFoldMan" declared "fold:0"
"YueShi" declared "fold:0"
"Finneas" declared "call:10"
"Yuchun" declared "call:10"
"Zheng" declared "call:10"
"RaphaelPlayer" declared "call:10"
"EvanPlayer" declared "call:10"
Street "flop" started. (community card = ['C3', 'H6', 'DQ'])
"RaphaelPlayer" declared "call:0"
"EvanPlayer" declared "raise:1920"
"Finneas" declared "fold:0"
"Yuchun" declared "fold:0"
"Zheng" declared "fold:0"
"RaphaelPlayer" declared "call:1920"
Street "turn" started. (community card = ['C3', 'H6', 'DQ', 'D3'])
Street "river" started. (community card = ['C3', 'H6', 'DQ', 'D3', 'HT'])
"['RaphaelPlayer']" won the round 14 (stack = {'EvanPlayer': 305, 'ZifengFoldMan': 980, 'JoyoPlayer': 0, 'YueShi': 975, 'Finneas': 990, 'Yuchun': 615, 'Zheng': 855, 'RaphaelPlayer': 3280})
player [EvanPlayer] gets hole card ['HT', 'S6'], current stack 300
player [ZifengFoldMan] gets hole card ['SJ', 'ST'], current stack 970
player [YueShi] gets hole card ['SA', 'C3'], current stack 975
player [Finneas] gets hole card ['H6', 'S9'], current stack 990
player [Yuchun] gets hole card ['CK', 'H7'], current stack 615
player [Zheng] gets hole card ['CJ', 'C8'], current stack 855
player [RaphaelPlayer] gets hole card ['DQ', 'H5'], current stack 3280
Started the round 15
Street "preflop" started. (community card = [])
"YueShi" declared "fold:0"
"Finneas" declared "call:10"
"Yuchun" declared "call:10"
"Zheng" declared "call:10"
"RaphaelPlayer" declared "fold:0"
"EvanPlayer" declared "call:10"
"ZifengFoldMan" declared "fold:0"
Street "flop" started. (community card = ['C4', 'DT', 'C6'])
"EvanPlayer" declared "raise:295"
"Finneas" declared "fold:0"
"Yuchun" declared "fold:0"
"Zheng" declared "fold:0"
"['EvanPlayer']" won the round 15 (stack = {'EvanPlayer': 345, 'ZifengFoldMan': 970, 'JoyoPlayer': 0, 'YueShi': 975, 'Finneas': 980, 'Yuchun': 605, 'Zheng': 845, 'RaphaelPlayer': 3280})
player [EvanPlayer] gets hole card ['DQ', 'CJ'], current stack 345
player [ZifengFoldMan] gets hole card ['DA', 'C5'], current stack 965
player [YueShi] gets hole card ['D3', 'HK'], current stack 965
player [Finneas] gets hole card ['C4', 'D2'], current stack 980
player [Yuchun] gets hole card ['DT', 'S2'], current stack 605
player [Zheng] gets hole card ['S5', 'H7'], current stack 845
player [RaphaelPlayer] gets hole card ['S6', 'D4'], current stack 3280
Started the round 16
Street "preflop" started. (community card = [])
"Finneas" declared "call:10"
"Yuchun" declared "call:10"
"Zheng" declared "call:10"
"RaphaelPlayer" declared "fold:0"
"EvanPlayer" declared "raise:345"
"ZifengFoldMan" declared "fold:0"
"YueShi" declared "fold:0"
"Finneas" declared "fold:0"
"Yuchun" declared "fold:0"
"Zheng" declared "fold:0"
"['EvanPlayer']" won the round 16 (stack = {'EvanPlayer': 390, 'ZifengFoldMan': 965, 'JoyoPlayer': 0, 'YueShi': 965, 'Finneas': 970, 'Yuchun': 595, 'Zheng': 835, 'RaphaelPlayer': 3280})
player [EvanPlayer] gets hole card ['D8', 'SJ'], current stack 390
player [ZifengFoldMan] gets hole card ['H4', 'D5'], current stack 965
player [YueShi] gets hole card ['HK', 'CA'], current stack 960
player [Finneas] gets hole card ['C9', 'S2'], current stack 960
player [Yuchun] gets hole card ['DA', 'C5'], current stack 595
player [Zheng] gets hole card ['CJ', 'S4'], current stack 835
player [RaphaelPlayer] gets hole card ['H7', 'SA'], current stack 3280
Started the round 17
Street "preflop" started. (community card = [])
"Yuchun" declared "call:10"
"Zheng" declared "call:10"
"RaphaelPlayer" declared "call:10"
"EvanPlayer" declared "raise:390"
"ZifengFoldMan" declared "fold:0"
"YueShi" declared "fold:0"
"Finneas" declared "fold:0"
"Yuchun" declared "fold:0"
"Zheng" declared "fold:0"
"RaphaelPlayer" declared "fold:0"
"['EvanPlayer']" won the round 17 (stack = {'EvanPlayer': 435, 'ZifengFoldMan': 965, 'JoyoPlayer': 0, 'YueShi': 960, 'Finneas': 960, 'Yuchun': 585, 'Zheng': 825, 'RaphaelPlayer': 3270})
player [EvanPlayer] gets hole card ['C5', 'H6'], current stack 435
player [ZifengFoldMan] gets hole card ['D5', 'D7'], current stack 965
player [YueShi] gets hole card ['C8', 'SQ'], current stack 960
player [Finneas] gets hole card ['H2', 'DA'], current stack 955
player [Yuchun] gets hole card ['H5', 'H3'], current stack 575
player [Zheng] gets hole card ['SJ', 'SK'], current stack 825
player [RaphaelPlayer] gets hole card ['H8', 'C2'], current stack 3270
Started the round 18
Street "preflop" started. (community card = [])
"Zheng" declared "call:10"
"RaphaelPlayer" declared "fold:0"
"EvanPlayer" declared "call:10"
"ZifengFoldMan" declared "fold:0"
"YueShi" declared "fold:0"
"Finneas" declared "call:10"
"Yuchun" declared "call:10"
Street "flop" started. (community card = ['CK', 'D4', 'S2'])
"Finneas" declared "call:0"
"Yuchun" declared "call:0"
"Zheng" declared "call:0"
"EvanPlayer" declared "raise:425"
"Finneas" declared "fold:0"
"Yuchun" declared "fold:0"
"Zheng" declared "call:425"
Street "turn" started. (community card = ['CK', 'D4', 'S2', 'H9'])
Street "river" started. (community card = ['CK', 'D4', 'S2', 'H9', 'H7'])
"['Zheng']" won the round 18 (stack = {'EvanPlayer': 0, 'ZifengFoldMan': 965, 'JoyoPlayer': 0, 'YueShi': 960, 'Finneas': 950, 'Yuchun': 575, 'Zheng': 1280, 'RaphaelPlayer': 3270})
player [ZifengFoldMan] gets hole card ['C3', 'DA'], current stack 965
player [YueShi] gets hole card ['D2', 'DT'], current stack 960
player [Finneas] gets hole card ['S3', 'SK'], current stack 950
player [Yuchun] gets hole card ['D5', 'H2'], current stack 570
player [Zheng] gets hole card ['C9', 'D6'], current stack 1270
player [RaphaelPlayer] gets hole card ['S8', 'C4'], current stack 3270
Started the round 19
Street "preflop" started. (community card = [])
"RaphaelPlayer" declared "fold:0"
"ZifengFoldMan" declared "fold:0"
"YueShi" declared "fold:0"
"Finneas" declared "call:10"
"Yuchun" declared "call:10"
"Zheng" declared "call:10"
Street "flop" started. (community card = ['C6', 'H8', 'CA'])
"Yuchun" declared "call:0"
"Zheng" declared "call:0"
"Finneas" declared "call:0"
Street "turn" started. (community card = ['C6', 'H8', 'CA', 'H3'])
"Yuchun" declared "call:0"
"Zheng" declared "call:0"
"Finneas" declared "call:0"
Street "river" started. (community card = ['C6', 'H8', 'CA', 'H3', 'HJ'])
"Yuchun" declared "call:0"
"Zheng" declared "call:0"
"Finneas" declared "call:0"
"['Zheng']" won the round 19 (stack = {'EvanPlayer': 0, 'ZifengFoldMan': 965, 'JoyoPlayer': 0, 'YueShi': 960, 'Finneas': 940, 'Yuchun': 565, 'Zheng': 1300, 'RaphaelPlayer': 3270})
player [ZifengFoldMan] gets hole card ['D7', 'D3'], current stack 965
player [YueShi] gets hole card ['C4', 'C9'], current stack 960
player [Finneas] gets hole card ['H7', 'D6'], current stack 940
player [Yuchun] gets hole card ['HA', 'DT'], current stack 565
player [Zheng] gets hole card ['D9', 'D4'], current stack 1295
player [RaphaelPlayer] gets hole card ['H3', 'C3'], current stack 3260
Started the round 20
Street "preflop" started. (community card = [])
"ZifengFoldMan" declared "fold:0"
"YueShi" declared "fold:0"
"Finneas" declared "call:10"
"Yuchun" declared "call:10"
"Zheng" declared "call:10"
"RaphaelPlayer" declared "call:10"
Street "flop" started. (community card = ['H9', 'CK', 'HT'])
"Zheng" declared "call:0"
"RaphaelPlayer" declared "call:0"
"Finneas" declared "call:0"
"Yuchun" declared "call:0"
Street "turn" started. (community card = ['H9', 'CK', 'HT', 'S4'])
"Zheng" declared "call:0"
"RaphaelPlayer" declared "call:0"
"Finneas" declared "call:0"
"Yuchun" declared "call:0"
Street "river" started. (community card = ['H9', 'CK', 'HT', 'S4', 'C7'])
"Zheng" declared "call:0"
"RaphaelPlayer" declared "call:0"
"Finneas" declared "call:0"
"Yuchun" declared "call:0"
"['Zheng']" won the round 20 (stack = {'EvanPlayer': 0, 'ZifengFoldMan': 965, 'JoyoPlayer': 0, 'YueShi': 960, 'Finneas': 930, 'Yuchun': 555, 'Zheng': 1330, 'RaphaelPlayer': 3260})
player [ZifengFoldMan] gets hole card ['S5', 'C7'], current stack 955
player [YueShi] gets hole card ['H4', 'C4'], current stack 960
player [Finneas] gets hole card ['D3', 'H9'], current stack 930
player [Yuchun] gets hole card ['SK', 'S3'], current stack 555
player [Zheng] gets hole card ['D7', 'C3'], current stack 1330
player [RaphaelPlayer] gets hole card ['D4', 'H7'], current stack 3255
Started the round 21
Street "preflop" started. (community card = [])
"YueShi" declared "fold:0"
"Finneas" declared "call:10"
"Yuchun" declared "call:10"
"Zheng" declared "call:10"
"RaphaelPlayer" declared "fold:0"
"ZifengFoldMan" declared "fold:0"
Street "flop" started. (community card = ['CT', 'SA', 'D8'])
"Finneas" declared "call:0"
"Yuchun" declared "call:0"
"Zheng" declared "call:0"
Street "turn" started. (community card = ['CT', 'SA', 'D8', 'SQ'])
"Finneas" declared "call:0"
"Yuchun" declared "call:0"
"Zheng" declared "call:0"
Street "river" started. (community card = ['CT', 'SA', 'D8', 'SQ', 'C5'])
"Finneas" declared "call:0"
"Yuchun" declared "call:0"
"Zheng" declared "call:0"
"['Yuchun']" won the round 21 (stack = {'EvanPlayer': 0, 'ZifengFoldMan': 955, 'JoyoPlayer': 0, 'YueShi': 960, 'Finneas': 920, 'Yuchun': 590, 'Zheng': 1320, 'RaphaelPlayer': 3255})
player [ZifengFoldMan] gets hole card ['C7', 'C4'], current stack 950
player [YueShi] gets hole card ['H4', 'D8'], current stack 950
player [Finneas] gets hole card ['CJ', 'S3'], current stack 920
player [Yuchun] gets hole card ['HK', 'D2'], current stack 590
player [Zheng] gets hole card ['C8', 'SA'], current stack 1320
player [RaphaelPlayer] gets hole card ['DQ', 'D4'], current stack 3255
Started the round 22
Street "preflop" started. (community card = [])
"Finneas" declared "call:10"
"Yuchun" declared "call:10"
"Zheng" declared "call:10"
"RaphaelPlayer" declared "call:10"
"ZifengFoldMan" declared "fold:0"
"YueShi" declared "fold:0"
Street "flop" started. (community card = ['H7', 'S4', 'H9'])
"Finneas" declared "call:0"
"Yuchun" declared "call:0"
"Zheng" declared "call:0"
"RaphaelPlayer" declared "call:0"
Street "turn" started. (community card = ['H7', 'S4', 'H9', 'H5'])
"Finneas" declared "call:0"
"Yuchun" declared "call:0"
"Zheng" declared "call:0"
"RaphaelPlayer" declared "call:0"
Street "river" started. (community card = ['H7', 'S4', 'H9', 'H5', 'C6'])
"Finneas" declared "call:0"
"Yuchun" declared "call:0"
"Zheng" declared "raise:660"
"RaphaelPlayer" declared "fold:0"
"Finneas" declared "fold:0"
"Yuchun" declared "fold:0"
"['Zheng']" won the round 22 (stack = {'EvanPlayer': 0, 'ZifengFoldMan': 950, 'JoyoPlayer': 0, 'YueShi': 950, 'Finneas': 910, 'Yuchun': 580, 'Zheng': 1365, 'RaphaelPlayer': 3245})
player [ZifengFoldMan] gets hole card ['C5', 'S9'], current stack 950
player [YueShi] gets hole card ['ST', 'C9'], current stack 945
player [Finneas] gets hole card ['DQ', 'HJ'], current stack 900
player [Yuchun] gets hole card ['CJ', 'H8'], current stack 580
player [Zheng] gets hole card ['H6', 'SA'], current stack 1365
player [RaphaelPlayer] gets hole card ['DA', 'D4'], current stack 3245
Started the round 23
Street "preflop" started. (community card = [])
"Yuchun" declared "call:10"
"Zheng" declared "call:10"
"RaphaelPlayer" declared "call:10"
"ZifengFoldMan" declared "fold:0"
"YueShi" declared "fold:0"
"Finneas" declared "call:10"
Street "flop" started. (community card = ['C4', 'D8', 'S8'])
"Finneas" declared "call:0"
"Yuchun" declared "raise:40"
"Zheng" declared "call:40"
"RaphaelPlayer" declared "call:40"
"Finneas" declared "fold:0"
Street "turn" started. (community card = ['C4', 'D8', 'S8', 'D2'])
"Yuchun" declared "raise:530"
"Zheng" declared "fold:0"
"RaphaelPlayer" declared "raise:1755"
Street "river" started. (community card = ['C4', 'D8', 'S8', 'D2', 'CT'])
"['Yuchun']" won the round 23 (stack = {'EvanPlayer': 0, 'ZifengFoldMan': 950, 'JoyoPlayer': 0, 'YueShi': 945, 'Finneas': 900, 'Yuchun': 1225, 'Zheng': 1315, 'RaphaelPlayer': 2665})
player [ZifengFoldMan] gets hole card ['DT', 'S4'], current stack 950
player [YueShi] gets hole card ['C3', 'H6'], current stack 945
player [Finneas] gets hole card ['C9', 'D4'], current stack 895
player [Yuchun] gets hole card ['HA', 'HT'], current stack 1215
player [Zheng] gets hole card ['SQ', 'C4'], current stack 1315
player [RaphaelPlayer] gets hole card ['DJ', 'H7'], current stack 2665
Started the round 24
Street "preflop" started. (community card = [])
"Zheng" declared "call:10"
"RaphaelPlayer" declared "fold:0"
"ZifengFoldMan" declared "fold:0"
"YueShi" declared "fold:0"
"Finneas" declared "call:10"
"Yuchun" declared "call:10"
Street "flop" started. (community card = ['D3', 'SK', 'C7'])
"Finneas" declared "call:0"
"Yuchun" declared "call:0"
"Zheng" declared "call:0"
Street "turn" started. (community card = ['D3', 'SK', 'C7', 'S2'])
"Finneas" declared "call:0"
"Yuchun" declared "call:0"
"Zheng" declared "call:0"
Street "river" started. (community card = ['D3', 'SK', 'C7', 'S2', 'SA'])
"Finneas" declared "call:0"
"Yuchun" declared "call:0"
"Zheng" declared "call:0"
"['Yuchun']" won the round 24 (stack = {'EvanPlayer': 0, 'ZifengFoldMan': 950, 'JoyoPlayer': 0, 'YueShi': 945, 'Finneas': 890, 'Yuchun': 1245, 'Zheng': 1305, 'RaphaelPlayer': 2665})
player [ZifengFoldMan] gets hole card ['CK', 'HJ'], current stack 950
player [YueShi] gets hole card ['H5', 'C9'], current stack 945
player [Finneas] gets hole card ['H3', 'CJ'], current stack 890
player [Yuchun] gets hole card ['SA', 'CA'], current stack 1240
player [Zheng] gets hole card ['DA', 'S8'], current stack 1295
player [RaphaelPlayer] gets hole card ['D6', 'HT'], current stack 2665
Started the round 25
Street "preflop" started. (community card = [])
"RaphaelPlayer" declared "fold:0"
"ZifengFoldMan" declared "fold:0"
"YueShi" declared "fold:0"
"Finneas" declared "call:10"
"Yuchun" declared "call:10"
"Zheng" declared "call:10"
Street "flop" started. (community card = ['CQ', 'DT', 'D8'])
"Yuchun" declared "call:0"
"Zheng" declared "call:0"
"Finneas" declared "call:0"
Street "turn" started. (community card = ['CQ', 'DT', 'D8', 'HA'])
"Yuchun" declared "raise:40"
"Zheng" declared "call:40"
"Finneas" declared "fold:0"
Street "river" started. (community card = ['CQ', 'DT', 'D8', 'HA', 'SQ'])
"Yuchun" declared "raise:1195"
"Zheng" declared "fold:0"
"['Yuchun']" won the round 25 (stack = {'EvanPlayer': 0, 'ZifengFoldMan': 950, 'JoyoPlayer': 0, 'YueShi': 945, 'Finneas': 880, 'Yuchun': 1305, 'Zheng': 1255, 'RaphaelPlayer': 2665})
player [ZifengFoldMan] gets hole card ['CK', 'H9'], current stack 950
player [YueShi] gets hole card ['D5', 'C7'], current stack 945
player [Finneas] gets hole card ['H4', 'C3'], current stack 880
player [Yuchun] gets hole card ['D3', 'S4'], current stack 1305
player [Zheng] gets hole card ['CQ', 'HQ'], current stack 1250
player [RaphaelPlayer] gets hole card ['D8', 'SA'], current stack 2655
Started the round 26
Street "preflop" started. (community card = [])
"ZifengFoldMan" declared "fold:0"
"YueShi" declared "fold:0"
"Finneas" declared "call:10"
"Yuchun" declared "call:10"
"Zheng" declared "call:10"
"RaphaelPlayer" declared "call:10"
Street "flop" started. (community card = ['H5', 'HA', 'C9'])
"Zheng" declared "call:0"
"RaphaelPlayer" declared "raise:50"
"Finneas" declared "fold:0"
"Yuchun" declared "call:50"
"Zheng" declared "call:50"
Street "turn" started. (community card = ['H5', 'HA', 'C9', 'S5'])
"Zheng" declared "call:0"
"RaphaelPlayer" declared "raise:200"
"Yuchun" declared "fold:0"
"Zheng" declared "fold:0"
"['RaphaelPlayer']" won the round 26 (stack = {'EvanPlayer': 0, 'ZifengFoldMan': 950, 'JoyoPlayer': 0, 'YueShi': 945, 'Finneas': 870, 'Yuchun': 1245, 'Zheng': 1195, 'RaphaelPlayer': 2795})
player [ZifengFoldMan] gets hole card ['D6', 'S4'], current stack 940
player [YueShi] gets hole card ['D9', 'D3'], current stack 945
player [Finneas] gets hole card ['C3', 'H3'], current stack 870
player [Yuchun] gets hole card ['CQ', 'ST'], current stack 1245
player [Zheng] gets hole card ['CJ', 'HT'], current stack 1195
player [RaphaelPlayer] gets hole card ['DQ', 'S9'], current stack 2790
Started the round 27
Street "preflop" started. (community card = [])
"YueShi" declared "fold:0"
"Finneas" declared "call:10"
"Yuchun" declared "call:10"
"Zheng" declared "call:10"
"RaphaelPlayer" declared "call:10"
"ZifengFoldMan" declared "fold:0"
Street "flop" started. (community card = ['S3', 'H9', 'S8'])
"RaphaelPlayer" declared "call:0"
"Finneas" declared "raise:435"
"Yuchun" declared "fold:0"
"Zheng" declared "fold:0"
"RaphaelPlayer" declared "raise:1355"
"Finneas" declared "fold:0"
"['RaphaelPlayer']" won the round 27 (stack = {'EvanPlayer': 0, 'ZifengFoldMan': 940, 'JoyoPlayer': 0, 'YueShi': 945, 'Finneas': 425, 'Yuchun': 1235, 'Zheng': 1185, 'RaphaelPlayer': 3270})
player [ZifengFoldMan] gets hole card ['CQ', 'S4'], current stack 935
player [YueShi] gets hole card ['HJ', 'H9'], current stack 935
player [Finneas] gets hole card ['HA', 'S9'], current stack 425
player [Yuchun] gets hole card ['SK', 'SQ'], current stack 1235
player [Zheng] gets hole card ['DQ', 'H3'], current stack 1185
player [RaphaelPlayer] gets hole card ['C9', 'S8'], current stack 3270
Started the round 28
Street "preflop" started. (community card = [])
"Finneas" declared "call:10"
"Yuchun" declared "call:10"
"Zheng" declared "call:10"
"RaphaelPlayer" declared "call:10"
"ZifengFoldMan" declared "fold:0"
"YueShi" declared "fold:0"
Street "flop" started. (community card = ['HT', 'CJ', 'SA'])
"Finneas" declared "call:0"
"Yuchun" declared "raise:1225"
"Zheng" declared "fold:0"
"RaphaelPlayer" declared "fold:0"
"Finneas" declared "fold:0"
"['Yuchun']" won the round 28 (stack = {'EvanPlayer': 0, 'ZifengFoldMan': 935, 'JoyoPlayer': 0, 'YueShi': 935, 'Finneas': 415, 'Yuchun': 1280, 'Zheng': 1175, 'RaphaelPlayer': 3260})
player [ZifengFoldMan] gets hole card ['D9', 'D3'], current stack 935
player [YueShi] gets hole card ['HA', 'CJ'], current stack 930
player [Finneas] gets hole card ['CT', 'C8'], current stack 405
player [Yuchun] gets hole card ['H4', 'C7'], current stack 1280
player [Zheng] gets hole card ['SA', 'SJ'], current stack 1175
player [RaphaelPlayer] gets hole card ['S6', 'H8'], current stack 3260
Started the round 29
Street "preflop" started. (community card = [])
"Yuchun" declared "call:10"
"Zheng" declared "call:10"
"RaphaelPlayer" declared "fold:0"
"ZifengFoldMan" declared "fold:0"
"YueShi" declared "fold:0"
"Finneas" declared "call:10"
Street "flop" started. (community card = ['CQ', 'D7', 'CK'])
"Finneas" declared "call:0"
"Yuchun" declared "call:0"
"Zheng" declared "call:0"
Street "turn" started. (community card = ['CQ', 'D7', 'CK', 'HK'])
"Finneas" declared "call:0"
"Yuchun" declared "call:0"
"Zheng" declared "call:0"
Street "river" started. (community card = ['CQ', 'D7', 'CK', 'HK', 'C3'])
"Finneas" declared "raise:207"
"Yuchun" declared "fold:0"
"Zheng" declared "fold:0"
"['Finneas']" won the round 29 (stack = {'EvanPlayer': 0, 'ZifengFoldMan': 935, 'JoyoPlayer': 0, 'YueShi': 930, 'Finneas': 440, 'Yuchun': 1270, 'Zheng': 1165, 'RaphaelPlayer': 3260})
player [ZifengFoldMan] gets hole card ['CQ', 'D5'], current stack 935
player [YueShi] gets hole card ['D7', 'DT'], current stack 930
player [Finneas] gets hole card ['H8', 'HA'], current stack 435
player [Yuchun] gets hole card ['S7', 'SA'], current stack 1260
player [Zheng] gets hole card ['HT', 'D8'], current stack 1165
player [RaphaelPlayer] gets hole card ['CK', 'SK'], current stack 3260
Started the round 30
Street "preflop" started. (community card = [])
"Zheng" declared "call:10"
"RaphaelPlayer" declared "raise:40"
"ZifengFoldMan" declared "fold:0"
"YueShi" declared "fold:0"
"Finneas" declared "fold:0"
"Yuchun" declared "call:40"
"Zheng" declared "call:40"
Street "flop" started. (community card = ['S3', 'D3', 'H6'])
"Yuchun" declared "call:0"
"Zheng" declared "call:0"
"RaphaelPlayer" declared "raise:135"
"Yuchun" declared "call:135"
"Zheng" declared "call:135"
Street "turn" started. (community card = ['S3', 'D3', 'H6', 'C9'])
"Yuchun" declared "call:0"
"Zheng" declared "call:0"
"RaphaelPlayer" declared "raise:540"
"Yuchun" declared "fold:0"
"Zheng" declared "fold:0"
"['RaphaelPlayer']" won the round 30 (stack = {'EvanPlayer': 0, 'ZifengFoldMan': 935, 'JoyoPlayer': 0, 'YueShi': 930, 'Finneas': 435, 'Yuchun': 1095, 'Zheng': 990, 'RaphaelPlayer': 3615})
player [ZifengFoldMan] gets hole card ['S7', 'CK'], current stack 935
player [YueShi] gets hole card ['S9', 'C3'], current stack 930
player [Finneas] gets hole card ['H7', 'D5'], current stack 435
player [Yuchun] gets hole card ['S5', 'SJ'], current stack 1090
player [Zheng] gets hole card ['HJ', 'H8'], current stack 980
player [RaphaelPlayer] gets hole card ['C5', 'H6'], current stack 3615
Started the round 31
Street "preflop" started. (community card = [])
"RaphaelPlayer" declared "fold:0"
"ZifengFoldMan" declared "fold:0"
"YueShi" declared "fold:0"
"Finneas" declared "call:10"
"Yuchun" declared "call:10"
"Zheng" declared "call:10"
Street "flop" started. (community card = ['D4', 'ST', 'S6'])
"Yuchun" declared "call:0"
"Zheng" declared "call:0"
"Finneas" declared "call:0"
Street "turn" started. (community card = ['D4', 'ST', 'S6', 'SQ'])
"Yuchun" declared "raise:1085"
"Zheng" declared "fold:0"
"Finneas" declared "fold:0"
"['Yuchun']" won the round 31 (stack = {'EvanPlayer': 0, 'ZifengFoldMan': 935, 'JoyoPlayer': 0, 'YueShi': 930, 'Finneas': 425, 'Yuchun': 1115, 'Zheng': 980, 'RaphaelPlayer': 3615})
player [ZifengFoldMan] gets hole card ['H9', 'D4'], current stack 935
player [YueShi] gets hole card ['HT', 'D3'], current stack 930
player [Finneas] gets hole card ['SK', 'SJ'], current stack 425
player [Yuchun] gets hole card ['ST', 'H3'], current stack 1115
player [Zheng] gets hole card ['CA', 'C9'], current stack 975
player [RaphaelPlayer] gets hole card ['H7', 'DT'], current stack 3605
Started the round 32
Street "preflop" started. (community card = [])
"ZifengFoldMan" declared "fold:0"
"YueShi" declared "fold:0"
"Finneas" declared "call:10"
"Yuchun" declared "call:10"
"Zheng" declared "call:10"
"RaphaelPlayer" declared "fold:0"
Street "flop" started. (community card = ['D2', 'H5', 'S4'])
"Zheng" declared "call:0"
"Finneas" declared "call:0"
"Yuchun" declared "call:0"
Street "turn" started. (community card = ['D2', 'H5', 'S4', 'SQ'])
"Zheng" declared "call:0"
"Finneas" declared "call:0"
"Yuchun" declared "call:0"
Street "river" started. (community card = ['D2', 'H5', 'S4', 'SQ', 'HJ'])
"Zheng" declared "call:0"
"Finneas" declared "call:0"
"Yuchun" declared "call:0"
"['Finneas']" won the round 32 (stack = {'EvanPlayer': 0, 'ZifengFoldMan': 935, 'JoyoPlayer': 0, 'YueShi': 930, 'Finneas': 455, 'Yuchun': 1105, 'Zheng': 970, 'RaphaelPlayer': 3605})
player [ZifengFoldMan] gets hole card ['HK', 'DT'], current stack 925
player [YueShi] gets hole card ['DK', 'CK'], current stack 930
player [Finneas] gets hole card ['DA', 'C7'], current stack 455
player [Yuchun] gets hole card ['CQ', 'S5'], current stack 1105
player [Zheng] gets hole card ['ST', 'H5'], current stack 970
player [RaphaelPlayer] gets hole card ['H9', 'S9'], current stack 3600
Started the round 33
Street "preflop" started. (community card = [])
"YueShi" declared "fold:0"
"Finneas" declared "call:10"
"Yuchun" declared "call:10"
"Zheng" declared "call:10"
"RaphaelPlayer" declared "raise:30"
"ZifengFoldMan" declared "fold:0"
"Finneas" declared "fold:0"
"Yuchun" declared "call:30"
"Zheng" declared "call:30"
Street "flop" started. (community card = ['D7', 'SA', 'H4'])
"RaphaelPlayer" declared "call:0"
"Yuchun" declared "call:0"
"Zheng" declared "call:0"
Street "turn" started. (community card = ['D7', 'SA', 'H4', 'HT'])
"RaphaelPlayer" declared "call:0"
"Yuchun" declared "call:0"
"Zheng" declared "call:0"
Street "river" started. (community card = ['D7', 'SA', 'H4', 'HT', 'C4'])
"RaphaelPlayer" declared "call:0"
"Yuchun" declared "call:0"
"Zheng" declared "call:0"
"['Zheng']" won the round 33 (stack = {'EvanPlayer': 0, 'ZifengFoldMan': 925, 'JoyoPlayer': 0, 'YueShi': 930, 'Finneas': 445, 'Yuchun': 1075, 'Zheng': 1050, 'RaphaelPlayer': 3575})
player [ZifengFoldMan] gets hole card ['H5', 'H7'], current stack 920
player [YueShi] gets hole card ['DK', 'HK'], current stack 920
player [Finneas] gets hole card ['C5', 'ST'], current stack 445
player [Yuchun] gets hole card ['S8', 'H3'], current stack 1075
player [Zheng] gets hole card ['S2', 'CQ'], current stack 1050
player [RaphaelPlayer] gets hole card ['H6', 'CA'], current stack 3575
Started the round 34
Street "preflop" started. (community card = [])
"Finneas" declared "call:10"
"Yuchun" declared "call:10"
"Zheng" declared "call:10"
"RaphaelPlayer" declared "call:10"
"ZifengFoldMan" declared "fold:0"
"YueShi" declared "fold:0"
Street "flop" started. (community card = ['CT', 'D5', 'SA'])
"Finneas" declared "call:0"
"Yuchun" declared "call:0"
"Zheng" declared "call:0"
"RaphaelPlayer" declared "raise:65"
"Finneas" declared "fold:0"
"Yuchun" declared "fold:0"
"Zheng" declared "call:65"
Street "turn" started. (community card = ['CT', 'D5', 'SA', 'SQ'])
"Zheng" declared "call:0"
"RaphaelPlayer" declared "raise:195"
"Zheng" declared "fold:0"
"['RaphaelPlayer']" won the round 34 (stack = {'EvanPlayer': 0, 'ZifengFoldMan': 920, 'JoyoPlayer': 0, 'YueShi': 920, 'Finneas': 435, 'Yuchun': 1065, 'Zheng': 975, 'RaphaelPlayer': 3685})
player [ZifengFoldMan] gets hole card ['DT', 'HA'], current stack 920
player [YueShi] gets hole card ['DK', 'CK'], current stack 915
player [Finneas] gets hole card ['H7', 'D2'], current stack 425
player [Yuchun] gets hole card ['D5', 'H4'], current stack 1065
player [Zheng] gets hole card ['H2', 'DJ'], current stack 975
player [RaphaelPlayer] gets hole card ['HQ', 'D6'], current stack 3685
Started the round 35
Street "preflop" started. (community card = [])
"Yuchun" declared "call:10"
"Zheng" declared "call:10"
"RaphaelPlayer" declared "fold:0"
"ZifengFoldMan" declared "fold:0"
"YueShi" declared "fold:0"
"Finneas" declared "call:10"
Street "flop" started. (community card = ['S4', 'CA', 'C8'])
"Finneas" declared "call:0"
"Yuchun" declared "call:0"
"Zheng" declared "call:0"
Street "turn" started. (community card = ['S4', 'CA', 'C8', 'S2'])
"Finneas" declared "call:0"
"Yuchun" declared "call:0"
"Zheng" declared "call:0"
Street "river" started. (community card = ['S4', 'CA', 'C8', 'S2', 'D3'])
"Finneas" declared "call:0"
"Yuchun" declared "raise:1055"
"Zheng" declared "fold:0"
"Finneas" declared "fold:0"
"['Yuchun']" won the round 35 (stack = {'EvanPlayer': 0, 'ZifengFoldMan': 920, 'JoyoPlayer': 0, 'YueShi': 915, 'Finneas': 425, 'Yuchun': 1090, 'Zheng': 965, 'RaphaelPlayer': 3685})
player [ZifengFoldMan] gets hole card ['D7', 'C3'], current stack 920
player [YueShi] gets hole card ['C5', 'C6'], current stack 915
player [Finneas] gets hole card ['HK', 'CA'], current stack 420
player [Yuchun] gets hole card ['H8', 'S7'], current stack 1080
player [Zheng] gets hole card ['D9', 'D4'], current stack 965
player [RaphaelPlayer] gets hole card ['DQ', 'C4'], current stack 3685
Started the round 36
Street "preflop" started. (community card = [])
"Zheng" declared "call:10"
"RaphaelPlayer" declared "fold:0"
"ZifengFoldMan" declared "fold:0"
"YueShi" declared "fold:0"
"Finneas" declared "raise:220"
"Yuchun" declared "fold:0"
"Zheng" declared "fold:0"
"['Finneas']" won the round 36 (stack = {'EvanPlayer': 0, 'ZifengFoldMan': 920, 'JoyoPlayer': 0, 'YueShi': 915, 'Finneas': 445, 'Yuchun': 1080, 'Zheng': 955, 'RaphaelPlayer': 3685})
player [ZifengFoldMan] gets hole card ['D7', 'S4'], current stack 920
player [YueShi] gets hole card ['S6', 'S5'], current stack 915
player [Finneas] gets hole card ['H3', 'H9'], current stack 445
player [Yuchun] gets hole card ['SQ', 'C8'], current stack 1075
player [Zheng] gets hole card ['D3', 'C5'], current stack 945
player [RaphaelPlayer] gets hole card ['S8', 'CT'], current stack 3685
Started the round 37
Street "preflop" started. (community card = [])
"RaphaelPlayer" declared "fold:0"
"ZifengFoldMan" declared "fold:0"
"YueShi" declared "fold:0"
"Finneas" declared "call:10"
"Yuchun" declared "call:10"
"Zheng" declared "call:10"
Street "flop" started. (community card = ['C6', 'H5', 'HA'])
"Yuchun" declared "call:0"
"Zheng" declared "call:0"
"Finneas" declared "call:0"
Street "turn" started. (community card = ['C6', 'H5', 'HA', 'DK'])
"Yuchun" declared "call:0"
"Zheng" declared "call:0"
"Finneas" declared "call:0"
Street "river" started. (community card = ['C6', 'H5', 'HA', 'DK', 'H4'])
"Yuchun" declared "call:0"
"Zheng" declared "call:0"
"Finneas" declared "raise:222"
"Yuchun" declared "fold:0"
"Zheng" declared "fold:0"
"['Finneas']" won the round 37 (stack = {'EvanPlayer': 0, 'ZifengFoldMan': 920, 'JoyoPlayer': 0, 'YueShi': 915, 'Finneas': 465, 'Yuchun': 1070, 'Zheng': 945, 'RaphaelPlayer': 3685})
player [ZifengFoldMan] gets hole card ['SQ', 'H5'], current stack 920
player [YueShi] gets hole card ['D6', 'ST'], current stack 915
player [Finneas] gets hole card ['CA', 'C9'], current stack 465
player [Yuchun] gets hole card ['CK', 'S8'], current stack 1070
player [Zheng] gets hole card ['S5', 'S3'], current stack 940
player [RaphaelPlayer] gets hole card ['SK', 'HK'], current stack 3675
Started the round 38
Street "preflop" started. (community card = [])
"ZifengFoldMan" declared "fold:0"
"YueShi" declared "fold:0"
"Finneas" declared "call:10"
"Yuchun" declared "call:10"
"Zheng" declared "call:10"
"RaphaelPlayer" declared "raise:40"
"Finneas" declared "fold:0"
"Yuchun" declared "call:40"
"Zheng" declared "call:40"
Street "flop" started. (community card = ['HA', 'DJ', 'CT'])
"Zheng" declared "call:0"
"RaphaelPlayer" declared "raise:140"
"Yuchun" declared "fold:0"
"Zheng" declared "call:140"
Street "turn" started. (community card = ['HA', 'DJ', 'CT', 'D7'])
"Zheng" declared "call:0"
"RaphaelPlayer" declared "raise:420"
"Zheng" declared "fold:0"
"['RaphaelPlayer']" won the round 38 (stack = {'EvanPlayer': 0, 'ZifengFoldMan': 920, 'JoyoPlayer': 0, 'YueShi': 915, 'Finneas': 455, 'Yuchun': 1030, 'Zheng': 765, 'RaphaelPlayer': 3915})
player [ZifengFoldMan] gets hole card ['D5', 'CA'], current stack 910
player [YueShi] gets hole card ['DK', 'H3'], current stack 915
player [Finneas] gets hole card ['H6', 'D2'], current stack 455
player [Yuchun] gets hole card ['H9', 'D3'], current stack 1030
player [Zheng] gets hole card ['S6', 'D8'], current stack 765
player [RaphaelPlayer] gets hole card ['S9', 'ST'], current stack 3910
Started the round 39
Street "preflop" started. (community card = [])
"YueShi" declared "fold:0"
"Finneas" declared "call:10"
"Yuchun" declared "call:10"
"Zheng" declared "call:10"
"RaphaelPlayer" declared "call:10"
"ZifengFoldMan" declared "fold:0"
Street "flop" started. (community card = ['SQ', 'HK', 'C4'])
"RaphaelPlayer" declared "call:0"
"Finneas" declared "call:0"
"Yuchun" declared "call:0"
"Zheng" declared "call:0"
Street "turn" started. (community card = ['SQ', 'HK', 'C4', 'C5'])
"RaphaelPlayer" declared "call:0"
"Finneas" declared "call:0"
"Yuchun" declared "call:0"
"Zheng" declared "call:0"
Street "river" started. (community card = ['SQ', 'HK', 'C4', 'C5', 'C9'])
"RaphaelPlayer" declared "call:0"
"Finneas" declared "call:0"
"Yuchun" declared "call:0"
"Zheng" declared "call:0"
"['RaphaelPlayer']" won the round 39 (stack = {'EvanPlayer': 0, 'ZifengFoldMan': 910, 'JoyoPlayer': 0, 'YueShi': 915, 'Finneas': 445, 'Yuchun': 1020, 'Zheng': 755, 'RaphaelPlayer': 3955})
player [ZifengFoldMan] gets hole card ['HA', 'DA'], current stack 905
player [YueShi] gets hole card ['D9', 'H6'], current stack 905
player [Finneas] gets hole card ['H8', 'S4'], current stack 445
player [Yuchun] gets hole card ['H5', 'CA'], current stack 1020
player [Zheng] gets hole card ['SA', 'HT'], current stack 755
player [RaphaelPlayer] gets hole card ['S7', 'C8'], current stack 3955
Started the round 40
Street "preflop" started. (community card = [])
"Finneas" declared "call:10"
"Yuchun" declared "call:10"
"Zheng" declared "call:10"
"RaphaelPlayer" declared "fold:0"
"ZifengFoldMan" declared "fold:0"
"YueShi" declared "fold:0"
Street "flop" started. (community card = ['DT', 'S5', 'S6'])
"Finneas" declared "call:0"
"Yuchun" declared "call:0"
"Zheng" declared "call:0"
Street "turn" started. (community card = ['DT', 'S5', 'S6', 'C6'])
"Finneas" declared "call:0"
"Yuchun" declared "call:0"
"Zheng" declared "call:0"
Street "river" started. (community card = ['DT', 'S5', 'S6', 'C6', 'DJ'])
"Finneas" declared "call:0"
"Yuchun" declared "call:0"
"Zheng" declared "call:0"
"['Zheng']" won the round 40 (stack = {'EvanPlayer': 0, 'ZifengFoldMan': 905, 'JoyoPlayer': 0, 'YueShi': 905, 'Finneas': 435, 'Yuchun': 1010, 'Zheng': 790, 'RaphaelPlayer': 3955})
player [ZifengFoldMan] gets hole card ['C8', 'H4'], current stack 905
player [YueShi] gets hole card ['H7', 'D8'], current stack 900
player [Finneas] gets hole card ['CK', 'ST'], current stack 425
player [Yuchun] gets hole card ['DA', 'D7'], current stack 1010
player [Zheng] gets hole card ['C6', 'H6'], current stack 790
player [RaphaelPlayer] gets hole card ['CA', 'C3'], current stack 3955
Started the round 41
Street "preflop" started. (community card = [])
"Yuchun" declared "fold:0"
"Zheng" declared "call:10"
"RaphaelPlayer" declared "call:10"
"ZifengFoldMan" declared "fold:0"
"YueShi" declared "fold:0"
"Finneas" declared "call:10"
Street "flop" started. (community card = ['D5', 'CJ', 'S8'])
"Finneas" declared "call:0"
"Zheng" declared "call:0"
"RaphaelPlayer" declared "call:0"
Street "turn" started. (community card = ['D5', 'CJ', 'S8', 'CT'])
"Finneas" declared "call:0"
"Zheng" declared "call:0"
"RaphaelPlayer" declared "call:0"
Street "river" started. (community card = ['D5', 'CJ', 'S8', 'CT', 'H8'])
"Finneas" declared "call:0"
"Zheng" declared "call:0"
"RaphaelPlayer" declared "call:0"
"['Finneas']" won the round 41 (stack = {'EvanPlayer': 0, 'ZifengFoldMan': 905, 'JoyoPlayer': 0, 'YueShi': 900, 'Finneas': 460, 'Yuchun': 1010, 'Zheng': 780, 'RaphaelPlayer': 3945})
player [ZifengFoldMan] gets hole card ['D4', 'C3'], current stack 905
player [YueShi] gets hole card ['SK', 'D3'], current stack 900
player [Finneas] gets hole card ['H8', 'S2'], current stack 455
player [Yuchun] gets hole card ['D8', 'DA'], current stack 1000
player [Zheng] gets hole card ['H3', 'D5'], current stack 780
player [RaphaelPlayer] gets hole card ['S3', 'HT'], current stack 3945
Started the round 42
Street "preflop" started. (community card = [])
"Zheng" declared "call:10"
"RaphaelPlayer" declared "fold:0"
"ZifengFoldMan" declared "fold:0"
"YueShi" declared "fold:0"
"Finneas" declared "call:10"
"Yuchun" declared "fold:0"
Street "flop" started. (community card = ['C5', 'HA', 'CJ'])
"Finneas" declared "call:0"
"Zheng" declared "call:0"
Street "turn" started. (community card = ['C5', 'HA', 'CJ', 'S5'])
"Finneas" declared "call:0"
"Zheng" declared "raise:770"
"Finneas" declared "fold:0"
"['Zheng']" won the round 42 (stack = {'EvanPlayer': 0, 'ZifengFoldMan': 905, 'JoyoPlayer': 0, 'YueShi': 900, 'Finneas': 450, 'Yuchun': 1000, 'Zheng': 800, 'RaphaelPlayer': 3945})
player [ZifengFoldMan] gets hole card ['CT', 'CA'], current stack 905
player [YueShi] gets hole card ['DK', 'H5'], current stack 900
player [Finneas] gets hole card ['H4', 'H9'], current stack 450
player [Yuchun] gets hole card ['S8', 'H7'], current stack 995
player [Zheng] gets hole card ['SK', 'S3'], current stack 790
player [RaphaelPlayer] gets hole card ['S2', 'DJ'], current stack 3945
Started the round 43
Street "preflop" started. (community card = [])
"RaphaelPlayer" declared "fold:0"
"ZifengFoldMan" declared "fold:0"
"YueShi" declared "fold:0"
"Finneas" declared "call:10"
"Yuchun" declared "fold:0"
"Zheng" declared "call:10"
Street "flop" started. (community card = ['S9', 'ST', 'C8'])
"Zheng" declared "call:0"
"Finneas" declared "call:0"
Street "turn" started. (community card = ['S9', 'ST', 'C8', 'C9'])
"Zheng" declared "call:0"
"Finneas" declared "raise:225"
"Zheng" declared "fold:0"
"['Finneas']" won the round 43 (stack = {'EvanPlayer': 0, 'ZifengFoldMan': 905, 'JoyoPlayer': 0, 'YueShi': 900, 'Finneas': 465, 'Yuchun': 995, 'Zheng': 790, 'RaphaelPlayer': 3945})
player [ZifengFoldMan] gets hole card ['S5', 'H8'], current stack 905
player [YueShi] gets hole card ['CT', 'S3'], current stack 900
player [Finneas] gets hole card ['HK', 'C9'], current stack 465
player [Yuchun] gets hole card ['HT', 'ST'], current stack 995
player [Zheng] gets hole card ['C6', 'H9'], current stack 785
player [RaphaelPlayer] gets hole card ['S8', 'CA'], current stack 3935
Started the round 44
Street "preflop" started. (community card = [])
"ZifengFoldMan" declared "fold:0"
"YueShi" declared "fold:0"
"Finneas" declared "call:10"
"Yuchun" declared "fold:0"
"Zheng" declared "call:10"
"RaphaelPlayer" declared "call:10"
Street "flop" started. (community card = ['S4', 'D8', 'D6'])
"Zheng" declared "call:0"
"RaphaelPlayer" declared "call:0"
"Finneas" declared "call:0"
Street "turn" started. (community card = ['S4', 'D8', 'D6', 'CQ'])
"Zheng" declared "call:0"
"RaphaelPlayer" declared "raise:40"
"Finneas" declared "fold:0"
"Zheng" declared "call:40"
Street "river" started. (community card = ['S4', 'D8', 'D6', 'CQ', 'HA'])
"Zheng" declared "call:0"
"RaphaelPlayer" declared "raise:120"
"Zheng" declared "call:120"
"['RaphaelPlayer']" won the round 44 (stack = {'EvanPlayer': 0, 'ZifengFoldMan': 905, 'JoyoPlayer': 0, 'YueShi': 900, 'Finneas': 455, 'Yuchun': 995, 'Zheng': 620, 'RaphaelPlayer': 4125})
player [ZifengFoldMan] gets hole card ['DK', 'H3'], current stack 895
player [YueShi] gets hole card ['H4', 'H7'], current stack 900
player [Finneas] gets hole card ['C6', 'C3'], current stack 455
player [Yuchun] gets hole card ['SJ', 'DJ'], current stack 995
player [Zheng] gets hole card ['C9', 'CK'], current stack 620
player [RaphaelPlayer] gets hole card ['S4', 'D9'], current stack 4120
Started the round 45
Street "preflop" started. (community card = [])
"YueShi" declared "fold:0"
"Finneas" declared "call:10"
"Yuchun" declared "fold:0"
"Zheng" declared "call:10"
"RaphaelPlayer" declared "fold:0"
"ZifengFoldMan" declared "fold:0"
Street "flop" started. (community card = ['H2', 'S2', 'SA'])
"Finneas" declared "call:0"
"Zheng" declared "call:0"
Street "turn" started. (community card = ['H2', 'S2', 'SA', 'HA'])
"Finneas" declared "call:0"
"Zheng" declared "call:0"
Street "river" started. (community card = ['H2', 'S2', 'SA', 'HA', 'D4'])
"Finneas" declared "call:0"
"Zheng" declared "call:0"
"['Zheng']" won the round 45 (stack = {'EvanPlayer': 0, 'ZifengFoldMan': 895, 'JoyoPlayer': 0, 'YueShi': 900, 'Finneas': 445, 'Yuchun': 995, 'Zheng': 645, 'RaphaelPlayer': 4120})
player [ZifengFoldMan] gets hole card ['D3', 'D2'], current stack 890
player [YueShi] gets hole card ['C7', 'DK'], current stack 890
player [Finneas] gets hole card ['CA', 'DJ'], current stack 445
player [Yuchun] gets hole card ['D5', 'D7'], current stack 995
player [Zheng] gets hole card ['HT', 'SQ'], current stack 645
player [RaphaelPlayer] gets hole card ['CK', 'D9'], current stack 4120
Started the round 46
Street "preflop" started. (community card = [])
"Finneas" declared "call:10"
"Yuchun" declared "fold:0"
"Zheng" declared "call:10"
"RaphaelPlayer" declared "call:10"
"ZifengFoldMan" declared "fold:0"
"YueShi" declared "fold:0"
Street "flop" started. (community card = ['DQ', 'HQ', 'H2'])
"Finneas" declared "call:0"
"Zheng" declared "raise:635"
"RaphaelPlayer" declared "fold:0"
"Finneas" declared "fold:0"
"['Zheng']" won the round 46 (stack = {'EvanPlayer': 0, 'ZifengFoldMan': 890, 'JoyoPlayer': 0, 'YueShi': 890, 'Finneas': 435, 'Yuchun': 995, 'Zheng': 680, 'RaphaelPlayer': 4110})
player [ZifengFoldMan] gets hole card ['S3', 'SJ'], current stack 890
player [YueShi] gets hole card ['CT', 'SA'], current stack 885
player [Finneas] gets hole card ['S4', 'SQ'], current stack 425
player [Yuchun] gets hole card ['C5', 'H6'], current stack 995
player [Zheng] gets hole card ['C2', 'ST'], current stack 680
player [RaphaelPlayer] gets hole card ['DA', 'D4'], current stack 4110
Started the round 47
Street "preflop" started. (community card = [])
"Yuchun" declared "fold:0"
"Zheng" declared "call:10"
"RaphaelPlayer" declared "call:10"
"ZifengFoldMan" declared "fold:0"
"YueShi" declared "fold:0"
"Finneas" declared "call:10"
Street "flop" started. (community card = ['D6', 'CA', 'HA'])
"Finneas" declared "call:0"
"Zheng" declared "call:0"
"RaphaelPlayer" declared "raise:45"
"Finneas" declared "fold:0"
"Zheng" declared "call:45"
Street "turn" started. (community card = ['D6', 'CA', 'HA', 'H4'])
"Zheng" declared "call:0"
"RaphaelPlayer" declared "raise:135"
"Zheng" declared "call:135"
Street "river" started. (community card = ['D6', 'CA', 'HA', 'H4', 'S9'])
"Zheng" declared "call:0"
"RaphaelPlayer" declared "raise:405"
"Zheng" declared "fold:0"
"['RaphaelPlayer']" won the round 47 (stack = {'EvanPlayer': 0, 'ZifengFoldMan': 890, 'JoyoPlayer': 0, 'YueShi': 885, 'Finneas': 425, 'Yuchun': 995, 'Zheng': 490, 'RaphaelPlayer': 4315})
player [ZifengFoldMan] gets hole card ['HA', 'D3'], current stack 890
player [YueShi] gets hole card ['HQ', 'S4'], current stack 885
player [Finneas] gets hole card ['D6', 'S5'], current stack 420
player [Yuchun] gets hole card ['D9', 'H3'], current stack 985
player [Zheng] gets hole card ['C5', 'CK'], current stack 490
player [RaphaelPlayer] gets hole card ['CQ', 'H6'], current stack 4315
Started the round 48
Street "preflop" started. (community card = [])
"Zheng" declared "call:10"
"RaphaelPlayer" declared "fold:0"
"ZifengFoldMan" declared "fold:0"
"YueShi" declared "fold:0"
"Finneas" declared "call:10"
"Yuchun" declared "fold:0"
Street "flop" started. (community card = ['C8', 'C4', 'HK'])
"Finneas" declared "call:0"
"Zheng" declared "raise:245"
"Finneas" declared "fold:0"
"['Zheng']" won the round 48 (stack = {'EvanPlayer': 0, 'ZifengFoldMan': 890, 'JoyoPlayer': 0, 'YueShi': 885, 'Finneas': 415, 'Yuchun': 985, 'Zheng': 510, 'RaphaelPlayer': 4315})
player [ZifengFoldMan] gets hole card ['S8', 'HT'], current stack 890
player [YueShi] gets hole card ['C3', 'S7'], current stack 885
player [Finneas] gets hole card ['SK', 'DJ'], current stack 415
player [Yuchun] gets hole card ['D3', 'D6'], current stack 980
player [Zheng] gets hole card ['D8', 'CT'], current stack 500
player [RaphaelPlayer] gets hole card ['HK', 'CK'], current stack 4315
Started the round 49
Street "preflop" started. (community card = [])
"RaphaelPlayer" declared "raise:40"
"ZifengFoldMan" declared "fold:0"
"YueShi" declared "fold:0"
"Finneas" declared "fold:0"
"Yuchun" declared "fold:0"
"Zheng" declared "call:40"
Street "flop" started. (community card = ['D4', 'H7', 'H8'])
"Zheng" declared "call:0"
"RaphaelPlayer" declared "raise:95"
"Zheng" declared "call:95"
Street "turn" started. (community card = ['D4', 'H7', 'H8', 'C7'])
"Zheng" declared "call:0"
"RaphaelPlayer" declared "raise:285"
"Zheng" declared "fold:0"
"['RaphaelPlayer']" won the round 49 (stack = {'EvanPlayer': 0, 'ZifengFoldMan': 890, 'JoyoPlayer': 0, 'YueShi': 885, 'Finneas': 415, 'Yuchun': 980, 'Zheng': 375, 'RaphaelPlayer': 4455})
player [ZifengFoldMan] gets hole card ['HT', 'DK'], current stack 890
player [YueShi] gets hole card ['C2', 'D3'], current stack 885
player [Finneas] gets hole card ['H3', 'H4'], current stack 415
player [Yuchun] gets hole card ['C8', 'CT'], current stack 980
player [Zheng] gets hole card ['C9', 'S4'], current stack 370
player [RaphaelPlayer] gets hole card ['S8', 'CQ'], current stack 4445
Started the round 50
Street "preflop" started. (community card = [])
"ZifengFoldMan" declared "fold:0"
"YueShi" declared "fold:0"
"Finneas" declared "call:10"
"Yuchun" declared "fold:0"
"Zheng" declared "call:10"
"RaphaelPlayer" declared "call:10"
Street "flop" started. (community card = ['H8', 'DQ', 'D7'])
"Zheng" declared "call:0"
"RaphaelPlayer" declared "raise:40"
"Finneas" declared "fold:0"
"Zheng" declared "call:40"
Street "turn" started. (community card = ['H8', 'DQ', 'D7', 'SA'])
"Zheng" declared "call:0"
"RaphaelPlayer" declared "raise:120"
"Zheng" declared "call:120"
Street "river" started. (community card = ['H8', 'DQ', 'D7', 'SA', 'D8'])
"Zheng" declared "call:0"
"RaphaelPlayer" declared "raise:360"
"Zheng" declared "fold:0"
"['RaphaelPlayer']" won the round 50 (stack = {'EvanPlayer': 0, 'ZifengFoldMan': 890, 'JoyoPlayer': 0, 'YueShi': 885, 'Finneas': 405, 'Yuchun': 980, 'Zheng': 205, 'RaphaelPlayer': 4635})

Game Results:
------------------------------------------------------------
Game 1:
Winner: RaphaelPlayer (stack: 4635)
All players' stacks:
  EvanPlayer: 0
  ZifengFoldMan: 890
  JoyoPlayer: 0
  YueShi: 885
  Finneas: 405
  Yuchun: 980
  Zheng: 205
  RaphaelPlayer: 4635
------------------------------------------------------------
