player [EvanPlayer] gets hole card ['H5', 'SQ'], current stack 1000
player [ZifengFoldMan] gets hole card ['S9', 'H3'], current stack 995
player [JoyoPlayer] gets hole card ['D7', 'D5'], current stack 990
player [YueShi] gets hole card ['C8', 'D9'], current stack 1000
player [Finneas] gets hole card ['D2', 'C7'], current stack 1000
player [Yuchun] gets hole card ['SA', 'HJ'], current stack 1000
player [Zheng] gets hole card ['H7', 'DQ'], current stack 1000
player [RaphaelPlayer] gets hole card ['S8', 'HK'], current stack 1000
Started the round 1
Street "preflop" started. (community card = [])
"YueShi" declared "fold:0"
"Finneas" declared "call:10"
"Yuchun" declared "fold:0"
"Zheng" declared "call:10"
"RaphaelPlayer" declared "call:10"
"EvanPlayer" declared "call:10"
"ZifengFoldMan" declared "fold:0"
"JoyoPlayer" declared "fold:0"
Street "flop" started. (community card = ['HA', 'H6', 'S5'])
"Finneas" declared "call:0"
"Zheng" declared "call:0"
"RaphaelPlayer" declared "call:0"
"EvanPlayer" declared "fold:0"
Street "turn" started. (community card = ['HA', 'H6', 'S5', 'DA'])
"Finneas" declared "call:0"
"Zheng" declared "call:0"
"RaphaelPlayer" declared "call:0"
Street "river" started. (community card = ['HA', 'H6', 'S5', 'DA', 'H2'])
"Finneas" declared "call:0"
"Zheng" declared "call:0"
"RaphaelPlayer" declared "call:0"
"['Finneas']" won the round 1 (stack = {'EvanPlayer': 990, 'ZifengFoldMan': 995, 'JoyoPlayer': 990, 'YueShi': 1000, 'Finneas': 1045, 'Yuchun': 1000, 'Zheng': 990, 'RaphaelPlayer': 990})
player [EvanPlayer] gets hole card ['S4', 'CK'], current stack 990
player [ZifengFoldMan] gets hole card ['SK', 'S6'], current stack 995
player [JoyoPlayer] gets hole card ['S7', 'H7'], current stack 985
player [YueShi] gets hole card ['C5', 'D2'], current stack 990
player [Finneas] gets hole card ['HA', 'H8'], current stack 1045
player [Yuchun] gets hole card ['DK', 'S8'], current stack 1000
player [Zheng] gets hole card ['D8', 'DQ'], current stack 990
player [RaphaelPlayer] gets hole card ['DT', 'C2'], current stack 990
Started the round 2
Street "preflop" started. (community card = [])
"Finneas" declared "call:10"
"Yuchun" declared "fold:0"
"Zheng" declared "call:10"
"RaphaelPlayer" declared "fold:0"
"EvanPlayer" declared "call:10"
"ZifengFoldMan" declared "fold:0"
"JoyoPlayer" declared "raise:15"
"YueShi" declared "fold:0"
"Finneas" declared "call:15"
"Zheng" declared "call:15"
"EvanPlayer" declared "call:15"
Street "flop" started. (community card = ['C6', 'S5', 'S2'])
"JoyoPlayer" declared "fold:0"
"Finneas" declared "call:0"
"Zheng" declared "call:0"
"EvanPlayer" declared "fold:0"
Street "turn" started. (community card = ['C6', 'S5', 'S2', 'C7'])
"Finneas" declared "call:0"
"Zheng" declared "call:0"
Street "river" started. (community card = ['C6', 'S5', 'S2', 'C7', 'D7'])
"Finneas" declared "call:0"
"Zheng" declared "call:0"
"['Finneas']" won the round 2 (stack = {'EvanPlayer': 975, 'ZifengFoldMan': 995, 'JoyoPlayer': 975, 'YueShi': 990, 'Finneas': 1100, 'Yuchun': 1000, 'Zheng': 975, 'RaphaelPlayer': 990})
player [EvanPlayer] gets hole card ['S4', 'CK'], current stack 975
player [ZifengFoldMan] gets hole card ['S3', 'C8'], current stack 995
player [JoyoPlayer] gets hole card ['CA', 'HK'], current stack 975
player [YueShi] gets hole card ['D4', 'D3'], current stack 985
player [Finneas] gets hole card ['D8', 'HA'], current stack 1090
player [Yuchun] gets hole card ['C3', 'D9'], current stack 1000
player [Zheng] gets hole card ['H7', 'DQ'], current stack 975
player [RaphaelPlayer] gets hole card ['C2', 'DJ'], current stack 990
Started the round 3
Street "preflop" started. (community card = [])
"Yuchun" declared "fold:0"
"Zheng" declared "call:10"
"RaphaelPlayer" declared "fold:0"
"EvanPlayer" declared "raise:975"
"ZifengFoldMan" declared "fold:0"
"JoyoPlayer" declared "fold:0"
"YueShi" declared "fold:0"
"Finneas" declared "fold:0"
"Zheng" declared "fold:0"
"['EvanPlayer']" won the round 3 (stack = {'EvanPlayer': 1000, 'ZifengFoldMan': 995, 'JoyoPlayer': 975, 'YueShi': 985, 'Finneas': 1090, 'Yuchun': 1000, 'Zheng': 965, 'RaphaelPlayer': 990})
player [EvanPlayer] gets hole card ['SK', 'D8'], current stack 1000
player [ZifengFoldMan] gets hole card ['H5', 'SQ'], current stack 995
player [JoyoPlayer] gets hole card ['D2', 'CT'], current stack 975
player [YueShi] gets hole card ['H2', 'C4'], current stack 985
player [Finneas] gets hole card ['H8', 'D4'], current stack 1085
player [Yuchun] gets hole card ['C5', 'SJ'], current stack 990
player [Zheng] gets hole card ['D3', 'HT'], current stack 965
player [RaphaelPlayer] gets hole card ['HJ', 'S6'], current stack 990
Started the round 4
Street "preflop" started. (community card = [])
"Zheng" declared "call:10"
"RaphaelPlayer" declared "fold:0"
"EvanPlayer" declared "call:10"
"ZifengFoldMan" declared "fold:0"
"JoyoPlayer" declared "fold:0"
"YueShi" declared "fold:0"
"Finneas" declared "call:10"
"Yuchun" declared "fold:0"
Street "flop" started. (community card = ['S8', 'D5', 'S9'])
"Finneas" declared "call:0"
"Zheng" declared "call:0"
"EvanPlayer" declared "raise:990"
"Finneas" declared "fold:0"
"Zheng" declared "fold:0"
"['EvanPlayer']" won the round 4 (stack = {'EvanPlayer': 1030, 'ZifengFoldMan': 995, 'JoyoPlayer': 975, 'YueShi': 985, 'Finneas': 1080, 'Yuchun': 990, 'Zheng': 955, 'RaphaelPlayer': 990})
player [EvanPlayer] gets hole card ['S9', 'S4'], current stack 1030
player [ZifengFoldMan] gets hole card ['H3', 'D6'], current stack 995
player [JoyoPlayer] gets hole card ['S8', 'CK'], current stack 975
player [YueShi] gets hole card ['SQ', 'S7'], current stack 985
player [Finneas] gets hole card ['S3', 'D3'], current stack 1080
player [Yuchun] gets hole card ['SK', 'DJ'], current stack 985
player [Zheng] gets hole card ['C2', 'C6'], current stack 945
player [RaphaelPlayer] gets hole card ['D8', 'H4'], current stack 990
Started the round 5
Street "preflop" started. (community card = [])
"RaphaelPlayer" declared "fold:0"
"EvanPlayer" declared "raise:1030"
"ZifengFoldMan" declared "fold:0"
"JoyoPlayer" declared "fold:0"
"YueShi" declared "fold:0"
"Finneas" declared "fold:0"
"Yuchun" declared "fold:0"
"Zheng" declared "fold:0"
"['EvanPlayer']" won the round 5 (stack = {'EvanPlayer': 1045, 'ZifengFoldMan': 995, 'JoyoPlayer': 975, 'YueShi': 985, 'Finneas': 1080, 'Yuchun': 985, 'Zheng': 945, 'RaphaelPlayer': 990})
player [EvanPlayer] gets hole card ['ST', 'H2'], current stack 1045
player [ZifengFoldMan] gets hole card ['HJ', 'C8'], current stack 995
player [JoyoPlayer] gets hole card ['H4', 'SJ'], current stack 975
player [YueShi] gets hole card ['HQ', 'S8'], current stack 985
player [Finneas] gets hole card ['CT', 'D6'], current stack 1080
player [Yuchun] gets hole card ['D7', 'CQ'], current stack 985
player [Zheng] gets hole card ['S6', 'DT'], current stack 940
player [RaphaelPlayer] gets hole card ['D2', 'HT'], current stack 980
Started the round 6
Street "preflop" started. (community card = [])
"EvanPlayer" declared "raise:1045"
"ZifengFoldMan" declared "fold:0"
"JoyoPlayer" declared "fold:0"
"YueShi" declared "fold:0"
"Finneas" declared "fold:0"
"Yuchun" declared "fold:0"
"Zheng" declared "fold:0"
"RaphaelPlayer" declared "fold:0"
"['EvanPlayer']" won the round 6 (stack = {'EvanPlayer': 1060, 'ZifengFoldMan': 995, 'JoyoPlayer': 975, 'YueShi': 985, 'Finneas': 1080, 'Yuchun': 985, 'Zheng': 940, 'RaphaelPlayer': 980})
player [EvanPlayer] gets hole card ['ST', 'C5'], current stack 1050
player [ZifengFoldMan] gets hole card ['DA', 'D9'], current stack 995
player [JoyoPlayer] gets hole card ['S3', 'S9'], current stack 975
player [YueShi] gets hole card ['DQ', 'S2'], current stack 985
player [Finneas] gets hole card ['SK', 'SQ'], current stack 1080
player [Yuchun] gets hole card ['S5', 'D6'], current stack 985
player [Zheng] gets hole card ['CJ', 'CQ'], current stack 940
player [RaphaelPlayer] gets hole card ['S8', 'HT'], current stack 975
Started the round 7
Street "preflop" started. (community card = [])
"ZifengFoldMan" declared "fold:0"
"JoyoPlayer" declared "fold:0"
"YueShi" declared "fold:0"
"Finneas" declared "call:10"
"Yuchun" declared "fold:0"
"Zheng" declared "call:10"
"RaphaelPlayer" declared "call:10"
"EvanPlayer" declared "fold:10"
Street "flop" started. (community card = ['C8', 'HA', 'H9'])
"RaphaelPlayer" declared "call:0"
"Finneas" declared "call:0"
"Zheng" declared "call:0"
Street "turn" started. (community card = ['C8', 'HA', 'H9', 'D7'])
"RaphaelPlayer" declared "call:0"
"Finneas" declared "call:0"
"Zheng" declared "call:0"
Street "river" started. (community card = ['C8', 'HA', 'H9', 'D7', 'HJ'])
"RaphaelPlayer" declared "raise:50"
"Finneas" declared "fold:0"
"Zheng" declared "fold:0"
"['RaphaelPlayer']" won the round 7 (stack = {'EvanPlayer': 1050, 'ZifengFoldMan': 995, 'JoyoPlayer': 975, 'YueShi': 985, 'Finneas': 1070, 'Yuchun': 985, 'Zheng': 930, 'RaphaelPlayer': 1010})
player [EvanPlayer] gets hole card ['SQ', 'D8'], current stack 1045
player [ZifengFoldMan] gets hole card ['S7', 'DT'], current stack 985
player [JoyoPlayer] gets hole card ['S2', 'C8'], current stack 975
player [YueShi] gets hole card ['H4', 'C6'], current stack 985
player [Finneas] gets hole card ['D4', 'D2'], current stack 1070
player [Yuchun] gets hole card ['HJ', 'S4'], current stack 985
player [Zheng] gets hole card ['DJ', 'CQ'], current stack 930
player [RaphaelPlayer] gets hole card ['C3', 'CA'], current stack 1010
Started the round 8
Street "preflop" started. (community card = [])
"JoyoPlayer" declared "fold:0"
"YueShi" declared "fold:0"
"Finneas" declared "call:10"
"Yuchun" declared "fold:0"
"Zheng" declared "call:10"
"RaphaelPlayer" declared "call:10"
"EvanPlayer" declared "call:10"
"ZifengFoldMan" declared "fold:0"
Street "flop" started. (community card = ['SK', 'DK', 'HT'])
"EvanPlayer" declared "fold:0"
"Finneas" declared "call:0"
"Zheng" declared "call:0"
"RaphaelPlayer" declared "call:0"
Street "turn" started. (community card = ['SK', 'DK', 'HT', 'D3'])
"Finneas" declared "call:0"
"Zheng" declared "call:0"
"RaphaelPlayer" declared "call:0"
Street "river" started. (community card = ['SK', 'DK', 'HT', 'D3', 'S9'])
"Finneas" declared "call:0"
"Zheng" declared "raise:920"
"RaphaelPlayer" declared "fold:0"
"Finneas" declared "fold:0"
"['Zheng']" won the round 8 (stack = {'EvanPlayer': 1040, 'ZifengFoldMan': 985, 'JoyoPlayer': 975, 'YueShi': 985, 'Finneas': 1060, 'Yuchun': 985, 'Zheng': 970, 'RaphaelPlayer': 1000})
player [EvanPlayer] gets hole card ['H4', 'H8'], current stack 1040
player [ZifengFoldMan] gets hole card ['S4', 'H7'], current stack 980
player [JoyoPlayer] gets hole card ['D3', 'ST'], current stack 965
player [YueShi] gets hole card ['D9', 'S7'], current stack 985
player [Finneas] gets hole card ['CQ', 'DA'], current stack 1060
player [Yuchun] gets hole card ['DQ', 'C3'], current stack 985
player [Zheng] gets hole card ['H6', 'HQ'], current stack 970
player [RaphaelPlayer] gets hole card ['S9', 'H3'], current stack 1000
Started the round 9
Street "preflop" started. (community card = [])
"YueShi" declared "fold:0"
"Finneas" declared "raise:537"
"Yuchun" declared "fold:0"
"Zheng" declared "fold:0"
"RaphaelPlayer" declared "fold:0"
"EvanPlayer" declared "fold:537"
"ZifengFoldMan" declared "fold:0"
"JoyoPlayer" declared "fold:0"
"['Finneas']" won the round 9 (stack = {'EvanPlayer': 1040, 'ZifengFoldMan': 980, 'JoyoPlayer': 965, 'YueShi': 985, 'Finneas': 1075, 'Yuchun': 985, 'Zheng': 970, 'RaphaelPlayer': 1000})
player [EvanPlayer] gets hole card ['D8', 'C4'], current stack 1040
player [ZifengFoldMan] gets hole card ['DK', 'D2'], current stack 980
player [JoyoPlayer] gets hole card ['H6', 'HK'], current stack 960
player [YueShi] gets hole card ['H7', 'HA'], current stack 975
player [Finneas] gets hole card ['D5', 'S7'], current stack 1075
player [Yuchun] gets hole card ['H4', 'C7'], current stack 985
player [Zheng] gets hole card ['H2', 'CK'], current stack 970
player [RaphaelPlayer] gets hole card ['D3', 'H8'], current stack 1000
Started the round 10
Street "preflop" started. (community card = [])
"Finneas" declared "call:10"
"Yuchun" declared "call:10"
"Zheng" declared "call:10"
"RaphaelPlayer" declared "fold:0"
"EvanPlayer" declared "call:10"
"ZifengFoldMan" declared "fold:0"
"JoyoPlayer" declared "fold:0"
"YueShi" declared "fold:0"
Street "flop" started. (community card = ['S4', 'S6', 'SA'])
"Finneas" declared "call:0"
"Yuchun" declared "call:0"
"Zheng" declared "call:0"
"EvanPlayer" declared "fold:0"
Street "turn" started. (community card = ['S4', 'S6', 'SA', 'C8'])
"Finneas" declared "call:0"
"Yuchun" declared "call:0"
"Zheng" declared "call:0"
Street "river" started. (community card = ['S4', 'S6', 'SA', 'C8', 'CQ'])
"Finneas" declared "call:0"
"Yuchun" declared "call:0"
"Zheng" declared "call:0"
"['Finneas']" won the round 10 (stack = {'EvanPlayer': 1030, 'ZifengFoldMan': 980, 'JoyoPlayer': 960, 'YueShi': 975, 'Finneas': 1120, 'Yuchun': 975, 'Zheng': 960, 'RaphaelPlayer': 1000})
player [EvanPlayer] gets hole card ['HQ', 'CA'], current stack 1030
player [ZifengFoldMan] gets hole card ['D2', 'C4'], current stack 980
player [JoyoPlayer] gets hole card ['H2', 'H9'], current stack 960
player [YueShi] gets hole card ['HT', 'D3'], current stack 970
player [Finneas] gets hole card ['C9', 'CQ'], current stack 1110
player [Yuchun] gets hole card ['HJ', 'DK'], current stack 975
player [Zheng] gets hole card ['S5', 'D4'], current stack 960
player [RaphaelPlayer] gets hole card ['DJ', 'H8'], current stack 1000
Started the round 11
Street "preflop" started. (community card = [])
"Yuchun" declared "call:10"
"Zheng" declared "call:10"
"RaphaelPlayer" declared "call:10"
"EvanPlayer" declared "raise:1030"
"ZifengFoldMan" declared "fold:0"
"JoyoPlayer" declared "fold:0"
"YueShi" declared "fold:0"
"Finneas" declared "fold:0"
"Yuchun" declared "fold:0"
"Zheng" declared "fold:0"
"RaphaelPlayer" declared "fold:0"
"['EvanPlayer']" won the round 11 (stack = {'EvanPlayer': 1075, 'ZifengFoldMan': 980, 'JoyoPlayer': 960, 'YueShi': 970, 'Finneas': 1110, 'Yuchun': 965, 'Zheng': 950, 'RaphaelPlayer': 990})
player [EvanPlayer] gets hole card ['S7', 'SA'], current stack 1075
player [ZifengFoldMan] gets hole card ['D2', 'S2'], current stack 980
player [JoyoPlayer] gets hole card ['CT', 'HQ'], current stack 960
player [YueShi] gets hole card ['S6', 'ST'], current stack 970
player [Finneas] gets hole card ['D5', 'DT'], current stack 1105
player [Yuchun] gets hole card ['D7', 'H7'], current stack 955
player [Zheng] gets hole card ['D8', 'C4'], current stack 950
player [RaphaelPlayer] gets hole card ['S9', 'CA'], current stack 990
Started the round 12
Street "preflop" started. (community card = [])
"Zheng" declared "call:10"
"RaphaelPlayer" declared "call:10"
"EvanPlayer" declared "raise:1075"
"ZifengFoldMan" declared "fold:0"
"JoyoPlayer" declared "fold:0"
"YueShi" declared "fold:0"
"Finneas" declared "fold:0"
"Yuchun" declared "fold:0"
"Zheng" declared "fold:0"
"RaphaelPlayer" declared "fold:0"
"['EvanPlayer']" won the round 12 (stack = {'EvanPlayer': 1110, 'ZifengFoldMan': 980, 'JoyoPlayer': 960, 'YueShi': 970, 'Finneas': 1105, 'Yuchun': 955, 'Zheng': 940, 'RaphaelPlayer': 980})
player [EvanPlayer] gets hole card ['C3', 'D6'], current stack 1110
player [ZifengFoldMan] gets hole card ['D5', 'S4'], current stack 980
player [JoyoPlayer] gets hole card ['S3', 'C4'], current stack 960
player [YueShi] gets hole card ['CK', 'CT'], current stack 970
player [Finneas] gets hole card ['C6', 'C5'], current stack 1105
player [Yuchun] gets hole card ['HQ', 'SQ'], current stack 950
player [Zheng] gets hole card ['C2', 'D4'], current stack 930
player [RaphaelPlayer] gets hole card ['H5', 'S6'], current stack 980
Started the round 13
Street "preflop" started. (community card = [])
"RaphaelPlayer" declared "fold:0"
"EvanPlayer" declared "call:10"
"ZifengFoldMan" declared "fold:0"
"JoyoPlayer" declared "fold:0"
"YueShi" declared "fold:0"
"Finneas" declared "call:10"
"Yuchun" declared "call:10"
"Zheng" declared "call:10"
Street "flop" started. (community card = ['DJ', 'CA', 'SK'])
"Yuchun" declared "call:0"
"Zheng" declared "call:0"
"EvanPlayer" declared "fold:0"
"Finneas" declared "call:0"
Street "turn" started. (community card = ['DJ', 'CA', 'SK', 'CJ'])
"Yuchun" declared "call:0"
"Zheng" declared "call:0"
"Finneas" declared "call:0"
Street "river" started. (community card = ['DJ', 'CA', 'SK', 'CJ', 'DT'])
"Yuchun" declared "raise:945"
"Zheng" declared "fold:0"
"Finneas" declared "fold:0"
"['Yuchun']" won the round 13 (stack = {'EvanPlayer': 1100, 'ZifengFoldMan': 980, 'JoyoPlayer': 960, 'YueShi': 970, 'Finneas': 1095, 'Yuchun': 985, 'Zheng': 930, 'RaphaelPlayer': 980})
player [EvanPlayer] gets hole card ['C6', 'D3'], current stack 1100
player [ZifengFoldMan] gets hole card ['S4', 'C2'], current stack 980
player [JoyoPlayer] gets hole card ['D5', 'H8'], current stack 960
player [YueShi] gets hole card ['SA', 'C3'], current stack 970
player [Finneas] gets hole card ['D8', 'S8'], current stack 1095
player [Yuchun] gets hole card ['S5', 'HK'], current stack 985
player [Zheng] gets hole card ['S9', 'C7'], current stack 925
player [RaphaelPlayer] gets hole card ['DQ', 'DT'], current stack 970
Started the round 14
Street "preflop" started. (community card = [])
"EvanPlayer" declared "call:10"
"ZifengFoldMan" declared "fold:0"
"JoyoPlayer" declared "raise:15"
"YueShi" declared "fold:0"
"Finneas" declared "call:15"
"Yuchun" declared "call:15"
"Zheng" declared "call:15"
"RaphaelPlayer" declared "call:15"
"EvanPlayer" declared "fold:15"
Street "flop" started. (community card = ['DJ', 'HJ', 'D2'])
"Zheng" declared "call:0"
"RaphaelPlayer" declared "call:0"
"JoyoPlayer" declared "fold:0"
"Finneas" declared "call:0"
"Yuchun" declared "call:0"
Street "turn" started. (community card = ['DJ', 'HJ', 'D2', 'H9'])
"Zheng" declared "call:0"
"RaphaelPlayer" declared "call:0"
"Finneas" declared "call:0"
"Yuchun" declared "call:0"
Street "river" started. (community card = ['DJ', 'HJ', 'D2', 'H9', 'D4'])
"Zheng" declared "call:0"
"RaphaelPlayer" declared "raise:95"
"Finneas" declared "fold:0"
"Yuchun" declared "fold:0"
"Zheng" declared "raise:552"
"RaphaelPlayer" declared "call:552"
"['RaphaelPlayer']" won the round 14 (stack = {'EvanPlayer': 1090, 'ZifengFoldMan': 980, 'JoyoPlayer': 945, 'YueShi': 970, 'Finneas': 1080, 'Yuchun': 970, 'Zheng': 363, 'RaphaelPlayer': 1602})
player [EvanPlayer] gets hole card ['SJ', 'HT'], current stack 1080
player [ZifengFoldMan] gets hole card ['D6', 'C7'], current stack 980
player [JoyoPlayer] gets hole card ['DA', 'HQ'], current stack 945
player [YueShi] gets hole card ['S7', 'SK'], current stack 970
player [Finneas] gets hole card ['D8', 'HJ'], current stack 1080
player [Yuchun] gets hole card ['D5', 'C2'], current stack 970
player [Zheng] gets hole card ['H8', 'C8'], current stack 363
player [RaphaelPlayer] gets hole card ['H9', 'C9'], current stack 1597
Started the round 15
Street "preflop" started. (community card = [])
"ZifengFoldMan" declared "fold:0"
"JoyoPlayer" declared "fold:0"
"YueShi" declared "fold:0"
"Finneas" declared "call:10"
"Yuchun" declared "call:10"
"Zheng" declared "call:10"
"RaphaelPlayer" declared "raise:30"
"EvanPlayer" declared "call:30"
"Finneas" declared "fold:0"
"Yuchun" declared "call:30"
"Zheng" declared "fold:0"
Street "flop" started. (community card = ['S4', 'S6', 'C3'])
"RaphaelPlayer" declared "call:0"
"EvanPlayer" declared "fold:0"
"Yuchun" declared "raise:940"
"RaphaelPlayer" declared "fold:0"
"['Yuchun']" won the round 15 (stack = {'EvanPlayer': 1060, 'ZifengFoldMan': 980, 'JoyoPlayer': 945, 'YueShi': 970, 'Finneas': 1070, 'Yuchun': 1050, 'Zheng': 353, 'RaphaelPlayer': 1572})
player [EvanPlayer] gets hole card ['CT', 'D2'], current stack 1055
player [ZifengFoldMan] gets hole card ['HQ', 'S6'], current stack 970
player [JoyoPlayer] gets hole card ['CJ', 'S2'], current stack 945
player [YueShi] gets hole card ['C9', 'H6'], current stack 970
player [Finneas] gets hole card ['SQ', 'D8'], current stack 1070
player [Yuchun] gets hole card ['CK', 'D7'], current stack 1050
player [Zheng] gets hole card ['H7', 'C3'], current stack 353
player [RaphaelPlayer] gets hole card ['HJ', 'DT'], current stack 1572
Started the round 16
Street "preflop" started. (community card = [])
"JoyoPlayer" declared "fold:0"
"YueShi" declared "fold:0"
"Finneas" declared "call:10"
"Yuchun" declared "call:10"
"Zheng" declared "call:10"
"RaphaelPlayer" declared "call:10"
"EvanPlayer" declared "fold:10"
"ZifengFoldMan" declared "fold:0"
Street "flop" started. (community card = ['SK', 'ST', 'H2'])
"Finneas" declared "call:0"
"Yuchun" declared "call:0"
"Zheng" declared "call:0"
"RaphaelPlayer" declared "call:0"
Street "turn" started. (community card = ['SK', 'ST', 'H2', 'DJ'])
"Finneas" declared "call:0"
"Yuchun" declared "call:0"
"Zheng" declared "call:0"
"RaphaelPlayer" declared "raise:65"
"Finneas" declared "fold:0"
"Yuchun" declared "call:65"
"Zheng" declared "fold:0"
Street "river" started. (community card = ['SK', 'ST', 'H2', 'DJ', 'S4'])
"Yuchun" declared "raise:40"
"RaphaelPlayer" declared "raise:305"
"Yuchun" declared "call:305"
"['RaphaelPlayer']" won the round 16 (stack = {'EvanPlayer': 1055, 'ZifengFoldMan': 970, 'JoyoPlayer': 945, 'YueShi': 970, 'Finneas': 1060, 'Yuchun': 670, 'Zheng': 343, 'RaphaelPlayer': 1987})
player [EvanPlayer] gets hole card ['SA', 'H2'], current stack 1055
player [ZifengFoldMan] gets hole card ['H3', 'D2'], current stack 965
player [JoyoPlayer] gets hole card ['D6', 'H8'], current stack 935
player [YueShi] gets hole card ['HT', 'H4'], current stack 970
player [Finneas] gets hole card ['HJ', 'H9'], current stack 1060
player [Yuchun] gets hole card ['D8', 'S2'], current stack 670
player [Zheng] gets hole card ['D7', 'SJ'], current stack 343
player [RaphaelPlayer] gets hole card ['D3', 'DA'], current stack 1987
Started the round 17
Street "preflop" started. (community card = [])
"YueShi" declared "fold:0"
"Finneas" declared "call:10"
"Yuchun" declared "call:10"
"Zheng" declared "call:10"
"RaphaelPlayer" declared "call:10"
"EvanPlayer" declared "call:10"
"ZifengFoldMan" declared "fold:0"
"JoyoPlayer" declared "fold:0"
Street "flop" started. (community card = ['C2', 'S9', 'C8'])
"Finneas" declared "call:0"
"Yuchun" declared "call:0"
"Zheng" declared "call:0"
"RaphaelPlayer" declared "call:0"
"EvanPlayer" declared "fold:0"
Street "turn" started. (community card = ['C2', 'S9', 'C8', 'D9'])
"Finneas" declared "raise:530"
"Yuchun" declared "fold:0"
"Zheng" declared "fold:0"
"RaphaelPlayer" declared "fold:0"
"['Finneas']" won the round 17 (stack = {'EvanPlayer': 1045, 'ZifengFoldMan': 965, 'JoyoPlayer': 935, 'YueShi': 970, 'Finneas': 1115, 'Yuchun': 660, 'Zheng': 333, 'RaphaelPlayer': 1977})
player [EvanPlayer] gets hole card ['C2', 'H7'], current stack 1045
player [ZifengFoldMan] gets hole card ['DA', 'S2'], current stack 965
player [JoyoPlayer] gets hole card ['HJ', 'D5'], current stack 930
player [YueShi] gets hole card ['HA', 'CK'], current stack 960
player [Finneas] gets hole card ['CT', 'S9'], current stack 1115
player [Yuchun] gets hole card ['SJ', 'DT'], current stack 660
player [Zheng] gets hole card ['C5', 'D4'], current stack 333
player [RaphaelPlayer] gets hole card ['DQ', 'C4'], current stack 1977
Started the round 18
Street "preflop" started. (community card = [])
"Finneas" declared "call:10"
"Yuchun" declared "call:10"
"Zheng" declared "call:10"
"RaphaelPlayer" declared "fold:0"
"EvanPlayer" declared "fold:10"
"ZifengFoldMan" declared "fold:0"
"JoyoPlayer" declared "fold:0"
"YueShi" declared "fold:0"
Street "flop" started. (community card = ['ST', 'H5', 'H9'])
"Finneas" declared "call:0"
"Yuchun" declared "call:0"
"Zheng" declared "call:0"
Street "turn" started. (community card = ['ST', 'H5', 'H9', 'SQ'])
"Finneas" declared "call:0"
"Yuchun" declared "call:0"
"Zheng" declared "call:0"
Street "river" started. (community card = ['ST', 'H5', 'H9', 'SQ', 'D3'])
"Finneas" declared "call:0"
"Yuchun" declared "call:0"
"Zheng" declared "call:0"
"['Finneas']" won the round 18 (stack = {'EvanPlayer': 1045, 'ZifengFoldMan': 965, 'JoyoPlayer': 930, 'YueShi': 960, 'Finneas': 1150, 'Yuchun': 650, 'Zheng': 323, 'RaphaelPlayer': 1977})
player [EvanPlayer] gets hole card ['DT', 'C7'], current stack 1045
player [ZifengFoldMan] gets hole card ['DA', 'S4'], current stack 965
player [JoyoPlayer] gets hole card ['S3', 'H4'], current stack 930
player [YueShi] gets hole card ['DQ', 'S9'], current stack 955
player [Finneas] gets hole card ['D9', 'C5'], current stack 1140
player [Yuchun] gets hole card ['HQ', 'D6'], current stack 650
player [Zheng] gets hole card ['D4', 'H2'], current stack 323
player [RaphaelPlayer] gets hole card ['HJ', 'H7'], current stack 1977
Started the round 19
Street "preflop" started. (community card = [])
"Yuchun" declared "call:10"
"Zheng" declared "call:10"
"RaphaelPlayer" declared "call:10"
"EvanPlayer" declared "raise:1045"
"ZifengFoldMan" declared "fold:0"
"JoyoPlayer" declared "call:1045"
"YueShi" declared "fold:0"
"Finneas" declared "fold:0"
"Yuchun" declared "fold:0"
"Zheng" declared "fold:0"
"RaphaelPlayer" declared "call:1045"
Street "flop" started. (community card = ['DJ', 'C4', 'SJ'])
Street "turn" started. (community card = ['DJ', 'C4', 'SJ', 'HA'])
Street "river" started. (community card = ['DJ', 'C4', 'SJ', 'HA', 'C2'])
"['RaphaelPlayer']" won the round 19 (stack = {'EvanPlayer': 0, 'ZifengFoldMan': 965, 'JoyoPlayer': 0, 'YueShi': 955, 'Finneas': 1140, 'Yuchun': 640, 'Zheng': 313, 'RaphaelPlayer': 3987})
player [ZifengFoldMan] gets hole card ['C4', 'S2'], current stack 965
player [YueShi] gets hole card ['HA', 'C7'], current stack 955
player [Finneas] gets hole card ['D7', 'H3'], current stack 1135
player [Yuchun] gets hole card ['DA', 'H6'], current stack 630
player [Zheng] gets hole card ['CT', 'HJ'], current stack 313
player [RaphaelPlayer] gets hole card ['D4', 'D2'], current stack 3987
Started the round 20
Street "preflop" started. (community card = [])
"Zheng" declared "call:10"
"RaphaelPlayer" declared "fold:0"
"ZifengFoldMan" declared "fold:0"
"YueShi" declared "fold:0"
"Finneas" declared "call:10"
"Yuchun" declared "call:10"
Street "flop" started. (community card = ['H4', 'H5', 'H9'])
"Finneas" declared "call:0"
"Yuchun" declared "call:0"
"Zheng" declared "call:0"
Street "turn" started. (community card = ['H4', 'H5', 'H9', 'SJ'])
"Finneas" declared "call:0"
"Yuchun" declared "call:0"
"Zheng" declared "call:0"
Street "river" started. (community card = ['H4', 'H5', 'H9', 'SJ', 'D3'])
"Finneas" declared "call:0"
"Yuchun" declared "call:0"
"Zheng" declared "call:0"
"['Zheng']" won the round 20 (stack = {'EvanPlayer': 0, 'ZifengFoldMan': 965, 'JoyoPlayer': 0, 'YueShi': 955, 'Finneas': 1130, 'Yuchun': 630, 'Zheng': 333, 'RaphaelPlayer': 3987})
player [ZifengFoldMan] gets hole card ['DK', 'DT'], current stack 965
player [YueShi] gets hole card ['HA', 'H7'], current stack 955
player [Finneas] gets hole card ['D8', 'DA'], current stack 1130
player [Yuchun] gets hole card ['H3', 'S4'], current stack 625
player [Zheng] gets hole card ['CJ', 'H8'], current stack 323
player [RaphaelPlayer] gets hole card ['D6', 'CA'], current stack 3987
Started the round 21
Street "preflop" started. (community card = [])
"RaphaelPlayer" declared "call:10"
"ZifengFoldMan" declared "fold:0"
"YueShi" declared "fold:0"
"Finneas" declared "call:10"
"Yuchun" declared "call:10"
"Zheng" declared "call:10"
Street "flop" started. (community card = ['C6', 'D9', 'S7'])
"Yuchun" declared "call:0"
"Zheng" declared "call:0"
"RaphaelPlayer" declared "call:0"
"Finneas" declared "call:0"
Street "turn" started. (community card = ['C6', 'D9', 'S7', 'SQ'])
"Yuchun" declared "call:0"
"Zheng" declared "call:0"
"RaphaelPlayer" declared "call:0"
"Finneas" declared "call:0"
Street "river" started. (community card = ['C6', 'D9', 'S7', 'SQ', 'S6'])
"Yuchun" declared "call:0"
"Zheng" declared "call:0"
"RaphaelPlayer" declared "raise:50"
"Finneas" declared "fold:0"
"Yuchun" declared "fold:0"
"Zheng" declared "call:50"
"['RaphaelPlayer']" won the round 21 (stack = {'EvanPlayer': 0, 'ZifengFoldMan': 965, 'JoyoPlayer': 0, 'YueShi': 955, 'Finneas': 1120, 'Yuchun': 620, 'Zheng': 273, 'RaphaelPlayer': 4067})
player [ZifengFoldMan] gets hole card ['CT', 'S6'], current stack 965
player [YueShi] gets hole card ['SQ', 'C6'], current stack 955
player [Finneas] gets hole card ['C7', 'S9'], current stack 1120
player [Yuchun] gets hole card ['CQ', 'D2'], current stack 620
player [Zheng] gets hole card ['S8', 'S4'], current stack 268
player [RaphaelPlayer] gets hole card ['DK', 'ST'], current stack 4057
Started the round 22
Street "preflop" started. (community card = [])
"ZifengFoldMan" declared "fold:0"
"YueShi" declared "fold:0"
"Finneas" declared "call:10"
"Yuchun" declared "call:10"
"Zheng" declared "call:10"
"RaphaelPlayer" declared "call:10"
Street "flop" started. (community card = ['HT', 'SK', 'D8'])
"Zheng" declared "call:0"
"RaphaelPlayer" declared "raise:50"
"Finneas" declared "fold:0"
"Yuchun" declared "fold:0"
"Zheng" declared "call:50"
Street "turn" started. (community card = ['HT', 'SK', 'D8', 'S2'])
"Zheng" declared "call:0"
"RaphaelPlayer" declared "raise:150"
"Zheng" declared "call:150"
Street "river" started. (community card = ['HT', 'SK', 'D8', 'S2', 'S5'])
"Zheng" declared "raise:63"
"RaphaelPlayer" declared "raise:629"
"['Zheng']" won the round 22 (stack = {'EvanPlayer': 0, 'ZifengFoldMan': 965, 'JoyoPlayer': 0, 'YueShi': 955, 'Finneas': 1110, 'Yuchun': 610, 'Zheng': 566, 'RaphaelPlayer': 3794})
player [ZifengFoldMan] gets hole card ['S9', 'D2'], current stack 955
player [YueShi] gets hole card ['H7', 'CK'], current stack 955
player [Finneas] gets hole card ['DQ', 'C5'], current stack 1110
player [Yuchun] gets hole card ['HJ', 'D3'], current stack 610
player [Zheng] gets hole card ['C2', 'S3'], current stack 566
player [RaphaelPlayer] gets hole card ['DK', 'HT'], current stack 3789
Started the round 23
Street "preflop" started. (community card = [])
"YueShi" declared "fold:0"
"Finneas" declared "call:10"
"Yuchun" declared "call:10"
"Zheng" declared "call:10"
"RaphaelPlayer" declared "raise:30"
"ZifengFoldMan" declared "fold:0"
"Finneas" declared "fold:0"
"Yuchun" declared "call:30"
"Zheng" declared "call:30"
Street "flop" started. (community card = ['D9', 'HA', 'D6'])
"RaphaelPlayer" declared "call:0"
"Yuchun" declared "call:0"
"Zheng" declared "call:0"
Street "turn" started. (community card = ['D9', 'HA', 'D6', 'C9'])
"RaphaelPlayer" declared "call:0"
"Yuchun" declared "call:0"
"Zheng" declared "call:0"
Street "river" started. (community card = ['D9', 'HA', 'D6', 'C9', 'C7'])
"RaphaelPlayer" declared "call:0"
"Yuchun" declared "call:0"
"Zheng" declared "call:0"
"['RaphaelPlayer']" won the round 23 (stack = {'EvanPlayer': 0, 'ZifengFoldMan': 955, 'JoyoPlayer': 0, 'YueShi': 955, 'Finneas': 1100, 'Yuchun': 580, 'Zheng': 536, 'RaphaelPlayer': 3874})
player [ZifengFoldMan] gets hole card ['D4', 'HT'], current stack 950
player [YueShi] gets hole card ['S8', 'SJ'], current stack 945
player [Finneas] gets hole card ['DJ', 'C8'], current stack 1100
player [Yuchun] gets hole card ['D7', 'C5'], current stack 580
player [Zheng] gets hole card ['H5', 'HQ'], current stack 536
player [RaphaelPlayer] gets hole card ['C9', 'CQ'], current stack 3874
Started the round 24
Street "preflop" started. (community card = [])
"Finneas" declared "call:10"
"Yuchun" declared "call:10"
"Zheng" declared "call:10"
"RaphaelPlayer" declared "call:10"
"ZifengFoldMan" declared "fold:0"
"YueShi" declared "fold:0"
Street "flop" started. (community card = ['SK', 'SQ', 'CJ'])
"Finneas" declared "call:0"
"Yuchun" declared "call:0"
"Zheng" declared "call:0"
"RaphaelPlayer" declared "call:0"
Street "turn" started. (community card = ['SK', 'SQ', 'CJ', 'C4'])
"Finneas" declared "call:0"
"Yuchun" declared "call:0"
"Zheng" declared "call:0"
"RaphaelPlayer" declared "raise:65"
"Finneas" declared "fold:0"
"Yuchun" declared "fold:0"
"Zheng" declared "call:65"
Street "river" started. (community card = ['SK', 'SQ', 'CJ', 'C4', 'HK'])
"Zheng" declared "call:0"
"RaphaelPlayer" declared "raise:195"
"Zheng" declared "fold:0"
"['RaphaelPlayer']" won the round 24 (stack = {'EvanPlayer': 0, 'ZifengFoldMan': 950, 'JoyoPlayer': 0, 'YueShi': 945, 'Finneas': 1090, 'Yuchun': 570, 'Zheng': 461, 'RaphaelPlayer': 3984})
player [ZifengFoldMan] gets hole card ['SQ', 'H8'], current stack 950
player [YueShi] gets hole card ['D4', 'S7'], current stack 940
player [Finneas] gets hole card ['S5', 'D2'], current stack 1080
player [Yuchun] gets hole card ['S4', 'H7'], current stack 570
player [Zheng] gets hole card ['DT', 'CK'], current stack 461
player [RaphaelPlayer] gets hole card ['H6', 'CJ'], current stack 3984
Started the round 25
Street "preflop" started. (community card = [])
"Yuchun" declared "call:10"
"Zheng" declared "call:10"
"RaphaelPlayer" declared "fold:0"
"ZifengFoldMan" declared "fold:0"
"YueShi" declared "fold:0"
"Finneas" declared "call:10"
Street "flop" started. (community card = ['HQ', 'HT', 'S8'])
"Finneas" declared "call:0"
"Yuchun" declared "call:0"
"Zheng" declared "call:0"
Street "turn" started. (community card = ['HQ', 'HT', 'S8', 'D7'])
"Finneas" declared "call:0"
"Yuchun" declared "call:0"
"Zheng" declared "call:0"
Street "river" started. (community card = ['HQ', 'HT', 'S8', 'D7', 'S2'])
"Finneas" declared "call:0"
"Yuchun" declared "call:0"
"Zheng" declared "call:0"
"['Zheng']" won the round 25 (stack = {'EvanPlayer': 0, 'ZifengFoldMan': 950, 'JoyoPlayer': 0, 'YueShi': 940, 'Finneas': 1080, 'Yuchun': 560, 'Zheng': 486, 'RaphaelPlayer': 3984})
player [ZifengFoldMan] gets hole card ['D7', 'S6'], current stack 950
player [YueShi] gets hole card ['C2', 'SJ'], current stack 940
player [Finneas] gets hole card ['H7', 'CQ'], current stack 1075
player [Yuchun] gets hole card ['SQ', 'H8'], current stack 550
player [Zheng] gets hole card ['HQ', 'H6'], current stack 486
player [RaphaelPlayer] gets hole card ['ST', 'D8'], current stack 3984
Started the round 26
Street "preflop" started. (community card = [])
"Zheng" declared "call:10"
"RaphaelPlayer" declared "fold:0"
"ZifengFoldMan" declared "fold:0"
"YueShi" declared "fold:0"
"Finneas" declared "call:10"
"Yuchun" declared "call:10"
Street "flop" started. (community card = ['S5', 'S3', 'DQ'])
"Finneas" declared "call:0"
"Yuchun" declared "raise:40"
"Zheng" declared "call:40"
"Finneas" declared "fold:0"
Street "turn" started. (community card = ['S5', 'S3', 'DQ', 'CA'])
"Yuchun" declared "raise:40"
"Zheng" declared "call:40"
Street "river" started. (community card = ['S5', 'S3', 'DQ', 'CA', 'DJ'])
"Yuchun" declared "raise:40"
"Zheng" declared "call:40"
"['Yuchun']" won the round 26 (stack = {'EvanPlayer': 0, 'ZifengFoldMan': 950, 'JoyoPlayer': 0, 'YueShi': 940, 'Finneas': 1070, 'Yuchun': 700, 'Zheng': 356, 'RaphaelPlayer': 3984})
player [ZifengFoldMan] gets hole card ['H7', 'CQ'], current stack 950
player [YueShi] gets hole card ['DK', 'DQ'], current stack 940
player [Finneas] gets hole card ['S2', 'DT'], current stack 1070
player [Yuchun] gets hole card ['S3', 'D4'], current stack 695
player [Zheng] gets hole card ['DJ', 'H3'], current stack 346
player [RaphaelPlayer] gets hole card ['C5', 'HJ'], current stack 3984
Started the round 27
Street "preflop" started. (community card = [])
"RaphaelPlayer" declared "fold:0"
"ZifengFoldMan" declared "fold:0"
"YueShi" declared "fold:0"
"Finneas" declared "call:10"
"Yuchun" declared "call:10"
"Zheng" declared "call:10"
Street "flop" started. (community card = ['HA', 'HT', 'C3'])
"Yuchun" declared "call:0"
"Zheng" declared "call:0"
"Finneas" declared "call:0"
Street "turn" started. (community card = ['HA', 'HT', 'C3', 'HQ'])
"Yuchun" declared "call:0"
"Zheng" declared "call:0"
"Finneas" declared "call:0"
Street "river" started. (community card = ['HA', 'HT', 'C3', 'HQ', 'SQ'])
"Yuchun" declared "call:0"
"Zheng" declared "call:0"
"Finneas" declared "call:0"
"['Finneas']" won the round 27 (stack = {'EvanPlayer': 0, 'ZifengFoldMan': 950, 'JoyoPlayer': 0, 'YueShi': 940, 'Finneas': 1090, 'Yuchun': 690, 'Zheng': 346, 'RaphaelPlayer': 3984})
player [ZifengFoldMan] gets hole card ['H4', 'C5'], current stack 950
player [YueShi] gets hole card ['D5', 'ST'], current stack 940
player [Finneas] gets hole card ['D9', 'DQ'], current stack 1090
player [Yuchun] gets hole card ['H2', 'CK'], current stack 690
player [Zheng] gets hole card ['HT', 'S7'], current stack 341
player [RaphaelPlayer] gets hole card ['HQ', 'S4'], current stack 3974
Started the round 28
Street "preflop" started. (community card = [])
"ZifengFoldMan" declared "fold:0"
"YueShi" declared "fold:0"
"Finneas" declared "call:10"
"Yuchun" declared "call:10"
"Zheng" declared "call:10"
"RaphaelPlayer" declared "fold:0"
Street "flop" started. (community card = ['HK', 'D3', 'DA'])
"Zheng" declared "call:0"
"Finneas" declared "call:0"
"Yuchun" declared "call:0"
Street "turn" started. (community card = ['HK', 'D3', 'DA', 'H3'])
"Zheng" declared "call:0"
"Finneas" declared "call:0"
"Yuchun" declared "call:0"
Street "river" started. (community card = ['HK', 'D3', 'DA', 'H3', 'CT'])
"Zheng" declared "call:0"
"Finneas" declared "call:0"
"Yuchun" declared "call:0"
"['Yuchun']" won the round 28 (stack = {'EvanPlayer': 0, 'ZifengFoldMan': 950, 'JoyoPlayer': 0, 'YueShi': 940, 'Finneas': 1080, 'Yuchun': 720, 'Zheng': 336, 'RaphaelPlayer': 3974})
player [ZifengFoldMan] gets hole card ['ST', 'DK'], current stack 940
player [YueShi] gets hole card ['D9', 'S3'], current stack 940
player [Finneas] gets hole card ['C7', 'D2'], current stack 1080
player [Yuchun] gets hole card ['SQ', 'CT'], current stack 720
player [Zheng] gets hole card ['S9', 'C5'], current stack 336
player [RaphaelPlayer] gets hole card ['HA', 'H4'], current stack 3969
Started the round 29
Street "preflop" started. (community card = [])
"YueShi" declared "fold:0"
"Finneas" declared "call:10"
"Yuchun" declared "call:10"
"Zheng" declared "call:10"
"RaphaelPlayer" declared "call:10"
"ZifengFoldMan" declared "fold:0"
Street "flop" started. (community card = ['S5', 'CK', 'S8'])
"RaphaelPlayer" declared "call:0"
"Finneas" declared "call:0"
"Yuchun" declared "call:0"
"Zheng" declared "call:0"
Street "turn" started. (community card = ['S5', 'CK', 'S8', 'H3'])
"RaphaelPlayer" declared "call:0"
"Finneas" declared "call:0"
"Yuchun" declared "call:0"
"Zheng" declared "call:0"
Street "river" started. (community card = ['S5', 'CK', 'S8', 'H3', 'SA'])
"RaphaelPlayer" declared "raise:60"
"Finneas" declared "fold:0"
"Yuchun" declared "fold:0"
"Zheng" declared "call:60"
"['RaphaelPlayer']" won the round 29 (stack = {'EvanPlayer': 0, 'ZifengFoldMan': 940, 'JoyoPlayer': 0, 'YueShi': 940, 'Finneas': 1070, 'Yuchun': 710, 'Zheng': 266, 'RaphaelPlayer': 4074})
player [ZifengFoldMan] gets hole card ['D7', 'D3'], current stack 935
player [YueShi] gets hole card ['H8', 'ST'], current stack 930
player [Finneas] gets hole card ['C7', 'DJ'], current stack 1070
player [Yuchun] gets hole card ['D8', 'CA'], current stack 710
player [Zheng] gets hole card ['D5', 'SQ'], current stack 266
player [RaphaelPlayer] gets hole card ['HA', 'D2'], current stack 4074
Started the round 30
Street "preflop" started. (community card = [])
"Finneas" declared "call:10"
"Yuchun" declared "call:10"
"Zheng" declared "call:10"
"RaphaelPlayer" declared "call:10"
"ZifengFoldMan" declared "fold:0"
"YueShi" declared "fold:0"
Street "flop" started. (community card = ['DT', 'H7', 'D6'])
"Finneas" declared "call:0"
"Yuchun" declared "call:0"
"Zheng" declared "call:0"
"RaphaelPlayer" declared "call:0"
Street "turn" started. (community card = ['DT', 'H7', 'D6', 'S3'])
"Finneas" declared "call:0"
"Yuchun" declared "call:0"
"Zheng" declared "call:0"
"RaphaelPlayer" declared "call:0"
Street "river" started. (community card = ['DT', 'H7', 'D6', 'S3', 'H6'])
"Finneas" declared "call:0"
"Yuchun" declared "call:0"
"Zheng" declared "call:0"
"RaphaelPlayer" declared "call:0"
"['Finneas']" won the round 30 (stack = {'EvanPlayer': 0, 'ZifengFoldMan': 935, 'JoyoPlayer': 0, 'YueShi': 930, 'Finneas': 1115, 'Yuchun': 700, 'Zheng': 256, 'RaphaelPlayer': 4064})
player [ZifengFoldMan] gets hole card ['H6', 'C8'], current stack 935
player [YueShi] gets hole card ['DQ', 'D7'], current stack 925
player [Finneas] gets hole card ['HA', 'DJ'], current stack 1105
player [Yuchun] gets hole card ['SA', 'SK'], current stack 700
player [Zheng] gets hole card ['CA', 'D3'], current stack 256
player [RaphaelPlayer] gets hole card ['D8', 'C4'], current stack 4064
Started the round 31
Street "preflop" started. (community card = [])
"Yuchun" declared "call:10"
"Zheng" declared "call:10"
"RaphaelPlayer" declared "fold:0"
"ZifengFoldMan" declared "fold:0"
"YueShi" declared "fold:0"
"Finneas" declared "call:10"
Street "flop" started. (community card = ['CJ', 'D5', 'D4'])
"Finneas" declared "call:0"
"Yuchun" declared "call:0"
"Zheng" declared "call:0"
Street "turn" started. (community card = ['CJ', 'D5', 'D4', 'CK'])
"Finneas" declared "call:0"
"Yuchun" declared "raise:40"
"Zheng" declared "call:40"
"Finneas" declared "fold:0"
Street "river" started. (community card = ['CJ', 'D5', 'D4', 'CK', 'H2'])
"Yuchun" declared "raise:650"
"Zheng" declared "call:650"
"['Zheng']" won the round 31 (stack = {'EvanPlayer': 0, 'ZifengFoldMan': 935, 'JoyoPlayer': 0, 'YueShi': 925, 'Finneas': 1105, 'Yuchun': 444, 'Zheng': 527, 'RaphaelPlayer': 4064})
player [ZifengFoldMan] gets hole card ['S2', 'ST'], current stack 935
player [YueShi] gets hole card ['D8', 'DK'], current stack 925
player [Finneas] gets hole card ['H5', 'CJ'], current stack 1100
player [Yuchun] gets hole card ['S4', 'CA'], current stack 434
player [Zheng] gets hole card ['H8', 'H4'], current stack 527
player [RaphaelPlayer] gets hole card ['DT', 'C8'], current stack 4064
Started the round 32
Street "preflop" started. (community card = [])
"Zheng" declared "call:10"
"RaphaelPlayer" declared "call:10"
"ZifengFoldMan" declared "fold:0"
"YueShi" declared "fold:0"
"Finneas" declared "call:10"
"Yuchun" declared "call:10"
Street "flop" started. (community card = ['S3', 'D3', 'SQ'])
"Finneas" declared "call:0"
"Yuchun" declared "call:0"
"Zheng" declared "call:0"
"RaphaelPlayer" declared "call:0"
Street "turn" started. (community card = ['S3', 'D3', 'SQ', 'D5'])
"Finneas" declared "call:0"
"Yuchun" declared "call:0"
"Zheng" declared "call:0"
"RaphaelPlayer" declared "call:0"
Street "river" started. (community card = ['S3', 'D3', 'SQ', 'D5', 'D2'])
"Finneas" declared "call:0"
"Yuchun" declared "raise:40"
"Zheng" declared "call:40"
"RaphaelPlayer" declared "fold:0"
"Finneas" declared "fold:0"
"['Yuchun']" won the round 32 (stack = {'EvanPlayer': 0, 'ZifengFoldMan': 935, 'JoyoPlayer': 0, 'YueShi': 925, 'Finneas': 1095, 'Yuchun': 514, 'Zheng': 477, 'RaphaelPlayer': 4054})
player [ZifengFoldMan] gets hole card ['H6', 'H9'], current stack 935
player [YueShi] gets hole card ['C9', 'C8'], current stack 925
player [Finneas] gets hole card ['DQ', 'DT'], current stack 1095
player [Yuchun] gets hole card ['HQ', 'D4'], current stack 509
player [Zheng] gets hole card ['S9', 'ST'], current stack 467
player [RaphaelPlayer] gets hole card ['SA', 'D6'], current stack 4054
Started the round 33
Street "preflop" started. (community card = [])
"RaphaelPlayer" declared "call:10"
"ZifengFoldMan" declared "fold:0"
"YueShi" declared "fold:0"
"Finneas" declared "call:10"
"Yuchun" declared "call:10"
"Zheng" declared "call:10"
Street "flop" started. (community card = ['S6', 'DA', 'C4'])
"Yuchun" declared "call:0"
"Zheng" declared "call:0"
"RaphaelPlayer" declared "raise:50"
"Finneas" declared "fold:0"
"Yuchun" declared "call:50"
"Zheng" declared "call:50"
Street "turn" started. (community card = ['S6', 'DA', 'C4', 'H7'])
"Yuchun" declared "call:0"
"Zheng" declared "call:0"
"RaphaelPlayer" declared "raise:200"
"Yuchun" declared "fold:0"
"Zheng" declared "fold:0"
"['RaphaelPlayer']" won the round 33 (stack = {'EvanPlayer': 0, 'ZifengFoldMan': 935, 'JoyoPlayer': 0, 'YueShi': 925, 'Finneas': 1085, 'Yuchun': 454, 'Zheng': 417, 'RaphaelPlayer': 4184})
player [ZifengFoldMan] gets hole card ['SA', 'D5'], current stack 935
player [YueShi] gets hole card ['CT', 'HJ'], current stack 925
player [Finneas] gets hole card ['S5', 'S2'], current stack 1085
player [Yuchun] gets hole card ['C7', 'H8'], current stack 454
player [Zheng] gets hole card ['C5', 'D6'], current stack 412
player [RaphaelPlayer] gets hole card ['H7', 'SQ'], current stack 4174
Started the round 34
Street "preflop" started. (community card = [])
"ZifengFoldMan" declared "fold:0"
"YueShi" declared "fold:0"
"Finneas" declared "call:10"
"Yuchun" declared "call:10"
"Zheng" declared "call:10"
"RaphaelPlayer" declared "fold:0"
Street "flop" started. (community card = ['D9', 'S7', 'SK'])
"Zheng" declared "call:0"
"Finneas" declared "call:0"
"Yuchun" declared "call:0"
Street "turn" started. (community card = ['D9', 'S7', 'SK', 'CQ'])
"Zheng" declared "call:0"
"Finneas" declared "call:0"
"Yuchun" declared "call:0"
Street "river" started. (community card = ['D9', 'S7', 'SK', 'CQ', 'CA'])
"Zheng" declared "call:0"
"Finneas" declared "call:0"
"Yuchun" declared "call:0"
"['Yuchun']" won the round 34 (stack = {'EvanPlayer': 0, 'ZifengFoldMan': 935, 'JoyoPlayer': 0, 'YueShi': 925, 'Finneas': 1075, 'Yuchun': 484, 'Zheng': 407, 'RaphaelPlayer': 4174})
player [ZifengFoldMan] gets hole card ['C8', 'D3'], current stack 925
player [YueShi] gets hole card ['S9', 'SQ'], current stack 925
player [Finneas] gets hole card ['D6', 'C7'], current stack 1075
player [Yuchun] gets hole card ['H8', 'HT'], current stack 484
player [Zheng] gets hole card ['D4', 'HQ'], current stack 407
player [RaphaelPlayer] gets hole card ['H2', 'DA'], current stack 4169
Started the round 35
Street "preflop" started. (community card = [])
"YueShi" declared "fold:0"
"Finneas" declared "call:10"
"Yuchun" declared "call:10"
"Zheng" declared "call:10"
"RaphaelPlayer" declared "call:10"
"ZifengFoldMan" declared "fold:0"
Street "flop" started. (community card = ['D8', 'CK', 'H7'])
"RaphaelPlayer" declared "call:0"
"Finneas" declared "call:0"
"Yuchun" declared "call:0"
"Zheng" declared "call:0"
Street "turn" started. (community card = ['D8', 'CK', 'H7', 'CQ'])
"RaphaelPlayer" declared "call:0"
"Finneas" declared "call:0"
"Yuchun" declared "call:0"
"Zheng" declared "call:0"
Street "river" started. (community card = ['D8', 'CK', 'H7', 'CQ', 'C5'])
"RaphaelPlayer" declared "call:0"
"Finneas" declared "call:0"
"Yuchun" declared "call:0"
"Zheng" declared "call:0"
"['Zheng']" won the round 35 (stack = {'EvanPlayer': 0, 'ZifengFoldMan': 925, 'JoyoPlayer': 0, 'YueShi': 925, 'Finneas': 1065, 'Yuchun': 474, 'Zheng': 447, 'RaphaelPlayer': 4164})
player [ZifengFoldMan] gets hole card ['CQ', 'CK'], current stack 920
player [YueShi] gets hole card ['SK', 'H3'], current stack 915
player [Finneas] gets hole card ['D2', 'C4'], current stack 1065
player [Yuchun] gets hole card ['CA', 'C9'], current stack 474
player [Zheng] gets hole card ['D9', 'DQ'], current stack 447
player [RaphaelPlayer] gets hole card ['S6', 'DK'], current stack 4164
Started the round 36
Street "preflop" started. (community card = [])
"Finneas" declared "call:10"
"Yuchun" declared "call:10"
"Zheng" declared "call:10"
"RaphaelPlayer" declared "call:10"
"ZifengFoldMan" declared "fold:0"
"YueShi" declared "fold:0"
Street "flop" started. (community card = ['H2', 'S3', 'S8'])
"Finneas" declared "call:0"
"Yuchun" declared "call:0"
"Zheng" declared "call:0"
"RaphaelPlayer" declared "call:0"
Street "turn" started. (community card = ['H2', 'S3', 'S8', 'DA'])
"Finneas" declared "call:0"
"Yuchun" declared "call:0"
"Zheng" declared "call:0"
"RaphaelPlayer" declared "call:0"
Street "river" started. (community card = ['H2', 'S3', 'S8', 'DA', 'S7'])
"Finneas" declared "call:0"
"Yuchun" declared "call:0"
"Zheng" declared "call:0"
"RaphaelPlayer" declared "call:0"
"['Yuchun']" won the round 36 (stack = {'EvanPlayer': 0, 'ZifengFoldMan': 920, 'JoyoPlayer': 0, 'YueShi': 915, 'Finneas': 1055, 'Yuchun': 519, 'Zheng': 437, 'RaphaelPlayer': 4154})
player [ZifengFoldMan] gets hole card ['C2', 'HT'], current stack 920
player [YueShi] gets hole card ['SK', 'S7'], current stack 910
player [Finneas] gets hole card ['HA', 'H9'], current stack 1045
player [Yuchun] gets hole card ['SJ', 'C7'], current stack 519
player [Zheng] gets hole card ['CK', 'C9'], current stack 437
player [RaphaelPlayer] gets hole card ['S8', 'CQ'], current stack 4154
Started the round 37
Street "preflop" started. (community card = [])
"Yuchun" declared "call:10"
"Zheng" declared "call:10"
"RaphaelPlayer" declared "call:10"
"ZifengFoldMan" declared "fold:0"
"YueShi" declared "fold:0"
"Finneas" declared "call:10"
Street "flop" started. (community card = ['H4', 'DA', 'C8'])
"Finneas" declared "call:0"
"Yuchun" declared "call:0"
"Zheng" declared "call:0"
"RaphaelPlayer" declared "call:0"
Street "turn" started. (community card = ['H4', 'DA', 'C8', 'D8'])
"Finneas" declared "call:0"
"Yuchun" declared "call:0"
"Zheng" declared "call:0"
"RaphaelPlayer" declared "raise:55"
"Finneas" declared "fold:0"
"Yuchun" declared "call:55"
"Zheng" declared "call:55"
Street "river" started. (community card = ['H4', 'DA', 'C8', 'D8', 'D7'])
"Yuchun" declared "call:0"
"Zheng" declared "call:0"
"RaphaelPlayer" declared "raise:220"
"Yuchun" declared "fold:0"
"Zheng" declared "fold:0"
"['RaphaelPlayer']" won the round 37 (stack = {'EvanPlayer': 0, 'ZifengFoldMan': 920, 'JoyoPlayer': 0, 'YueShi': 910, 'Finneas': 1045, 'Yuchun': 454, 'Zheng': 372, 'RaphaelPlayer': 4299})
player [ZifengFoldMan] gets hole card ['D6', 'CQ'], current stack 920
player [YueShi] gets hole card ['SA', 'S5'], current stack 910
player [Finneas] gets hole card ['HK', 'C4'], current stack 1040
player [Yuchun] gets hole card ['H6', 'DA'], current stack 444
player [Zheng] gets hole card ['D8', 'H2'], current stack 372
player [RaphaelPlayer] gets hole card ['C5', 'C3'], current stack 4299
Started the round 38
Street "preflop" started. (community card = [])
"Zheng" declared "call:10"
"RaphaelPlayer" declared "fold:0"
"ZifengFoldMan" declared "fold:0"
"YueShi" declared "fold:0"
"Finneas" declared "call:10"
"Yuchun" declared "call:10"
Street "flop" started. (community card = ['C7', 'C9', 'D2'])
"Finneas" declared "call:0"
"Yuchun" declared "call:0"
"Zheng" declared "call:0"
Street "turn" started. (community card = ['C7', 'C9', 'D2', 'S9'])
"Finneas" declared "call:0"
"Yuchun" declared "call:0"
"Zheng" declared "call:0"
Street "river" started. (community card = ['C7', 'C9', 'D2', 'S9', 'H3'])
"Finneas" declared "call:0"
"Yuchun" declared "call:0"
"Zheng" declared "call:0"
"['Zheng']" won the round 38 (stack = {'EvanPlayer': 0, 'ZifengFoldMan': 920, 'JoyoPlayer': 0, 'YueShi': 910, 'Finneas': 1035, 'Yuchun': 444, 'Zheng': 392, 'RaphaelPlayer': 4299})
player [ZifengFoldMan] gets hole card ['H9', 'SA'], current stack 920
player [YueShi] gets hole card ['S9', 'C9'], current stack 910
player [Finneas] gets hole card ['D3', 'C4'], current stack 1035
player [Yuchun] gets hole card ['S6', 'D4'], current stack 439
player [Zheng] gets hole card ['ST', 'H6'], current stack 382
player [RaphaelPlayer] gets hole card ['HK', 'D5'], current stack 4299
Started the round 39
Street "preflop" started. (community card = [])
"RaphaelPlayer" declared "call:10"
"ZifengFoldMan" declared "fold:0"
"YueShi" declared "fold:0"
"Finneas" declared "call:10"
"Yuchun" declared "call:10"
"Zheng" declared "call:10"
Street "flop" started. (community card = ['CJ', 'D2', 'SJ'])
"Yuchun" declared "call:0"
"Zheng" declared "call:0"
"RaphaelPlayer" declared "call:0"
"Finneas" declared "call:0"
Street "turn" started. (community card = ['CJ', 'D2', 'SJ', 'SQ'])
"Yuchun" declared "call:0"
"Zheng" declared "call:0"
"RaphaelPlayer" declared "call:0"
"Finneas" declared "call:0"
Street "river" started. (community card = ['CJ', 'D2', 'SJ', 'SQ', 'HQ'])
"Yuchun" declared "call:0"
"Zheng" declared "call:0"
"RaphaelPlayer" declared "call:0"
"Finneas" declared "call:0"
"['RaphaelPlayer']" won the round 39 (stack = {'EvanPlayer': 0, 'ZifengFoldMan': 920, 'JoyoPlayer': 0, 'YueShi': 910, 'Finneas': 1025, 'Yuchun': 434, 'Zheng': 382, 'RaphaelPlayer': 4329})
player [ZifengFoldMan] gets hole card ['H4', 'SK'], current stack 920
player [YueShi] gets hole card ['SJ', 'H8'], current stack 910
player [Finneas] gets hole card ['S7', 'CJ'], current stack 1025
player [Yuchun] gets hole card ['CA', 'D4'], current stack 434
player [Zheng] gets hole card ['HJ', 'S9'], current stack 377
player [RaphaelPlayer] gets hole card ['DT', 'S5'], current stack 4319
Started the round 40
Street "preflop" started. (community card = [])
"ZifengFoldMan" declared "fold:0"
"YueShi" declared "fold:0"
"Finneas" declared "call:10"
"Yuchun" declared "call:10"
"Zheng" declared "call:10"
"RaphaelPlayer" declared "fold:0"
Street "flop" started. (community card = ['H7', 'S3', 'H3'])
"Zheng" declared "call:0"
"Finneas" declared "call:0"
"Yuchun" declared "call:0"
Street "turn" started. (community card = ['H7', 'S3', 'H3', 'D6'])
"Zheng" declared "call:0"
"Finneas" declared "call:0"
"Yuchun" declared "call:0"
Street "river" started. (community card = ['H7', 'S3', 'H3', 'D6', 'D7'])
"Zheng" declared "call:0"
"Finneas" declared "raise:512"
"Yuchun" declared "fold:0"
"Zheng" declared "fold:0"
"['Finneas']" won the round 40 (stack = {'EvanPlayer': 0, 'ZifengFoldMan': 920, 'JoyoPlayer': 0, 'YueShi': 910, 'Finneas': 1055, 'Yuchun': 424, 'Zheng': 372, 'RaphaelPlayer': 4319})
player [ZifengFoldMan] gets hole card ['S5', 'H2'], current stack 910
player [YueShi] gets hole card ['S8', 'D6'], current stack 910
player [Finneas] gets hole card ['DQ', 'H9'], current stack 1055
player [Yuchun] gets hole card ['DT', 'D9'], current stack 424
player [Zheng] gets hole card ['S4', 'D5'], current stack 372
player [RaphaelPlayer] gets hole card ['D4', 'C8'], current stack 4314
Started the round 41
Street "preflop" started. (community card = [])
"YueShi" declared "fold:0"
"Finneas" declared "call:10"
"Yuchun" declared "fold:0"
"Zheng" declared "call:10"
"RaphaelPlayer" declared "fold:0"
"ZifengFoldMan" declared "fold:0"
Street "flop" started. (community card = ['HA', 'SK', 'C7'])
"Finneas" declared "call:0"
"Zheng" declared "call:0"
Street "turn" started. (community card = ['HA', 'SK', 'C7', 'CA'])
"Finneas" declared "call:0"
"Zheng" declared "call:0"
Street "river" started. (community card = ['HA', 'SK', 'C7', 'CA', 'CT'])
"Finneas" declared "call:0"
"Zheng" declared "call:0"
"['Finneas']" won the round 41 (stack = {'EvanPlayer': 0, 'ZifengFoldMan': 910, 'JoyoPlayer': 0, 'YueShi': 910, 'Finneas': 1080, 'Yuchun': 424, 'Zheng': 362, 'RaphaelPlayer': 4314})
player [ZifengFoldMan] gets hole card ['S5', 'SA'], current stack 905
player [YueShi] gets hole card ['HK', 'ST'], current stack 900
player [Finneas] gets hole card ['H4', 'C2'], current stack 1080
player [Yuchun] gets hole card ['HT', 'D2'], current stack 424
player [Zheng] gets hole card ['C9', 'CQ'], current stack 362
player [RaphaelPlayer] gets hole card ['D5', 'S6'], current stack 4314
Started the round 42
Street "preflop" started. (community card = [])
"Finneas" declared "call:10"
"Yuchun" declared "fold:0"
"Zheng" declared "call:10"
"RaphaelPlayer" declared "fold:0"
"ZifengFoldMan" declared "fold:0"
"YueShi" declared "fold:0"
Street "flop" started. (community card = ['H6', 'C4', 'C7'])
"Finneas" declared "call:0"
"Zheng" declared "call:0"
Street "turn" started. (community card = ['H6', 'C4', 'C7', 'C6'])
"Finneas" declared "call:0"
"Zheng" declared "raise:181"
"Finneas" declared "fold:0"
"['Zheng']" won the round 42 (stack = {'EvanPlayer': 0, 'ZifengFoldMan': 905, 'JoyoPlayer': 0, 'YueShi': 900, 'Finneas': 1070, 'Yuchun': 424, 'Zheng': 387, 'RaphaelPlayer': 4314})
player [ZifengFoldMan] gets hole card ['HJ', 'CJ'], current stack 905
player [YueShi] gets hole card ['DJ', 'D3'], current stack 895
player [Finneas] gets hole card ['H7', 'SA'], current stack 1060
player [Yuchun] gets hole card ['SQ', 'S9'], current stack 424
player [Zheng] gets hole card ['H9', 'C9'], current stack 387
player [RaphaelPlayer] gets hole card ['D8', 'CA'], current stack 4314
Started the round 43
Street "preflop" started. (community card = [])
"Yuchun" declared "fold:0"
"Zheng" declared "call:10"
"RaphaelPlayer" declared "raise:30"
"ZifengFoldMan" declared "fold:0"
"YueShi" declared "fold:0"
"Finneas" declared "fold:0"
"Zheng" declared "call:30"
Street "flop" started. (community card = ['HQ', 'DT', 'S8'])
"Zheng" declared "call:0"
"RaphaelPlayer" declared "raise:85"
"Zheng" declared "call:85"
Street "turn" started. (community card = ['HQ', 'DT', 'S8', 'C3'])
"Zheng" declared "call:0"
"RaphaelPlayer" declared "raise:255"
"Zheng" declared "fold:0"
"['RaphaelPlayer']" won the round 43 (stack = {'EvanPlayer': 0, 'ZifengFoldMan': 905, 'JoyoPlayer': 0, 'YueShi': 895, 'Finneas': 1060, 'Yuchun': 424, 'Zheng': 272, 'RaphaelPlayer': 4444})
player [ZifengFoldMan] gets hole card ['SA', 'SQ'], current stack 905
player [YueShi] gets hole card ['DT', 'S8'], current stack 895
player [Finneas] gets hole card ['C7', 'H9'], current stack 1055
player [Yuchun] gets hole card ['DK', 'S7'], current stack 414
player [Zheng] gets hole card ['D5', 'S6'], current stack 272
player [RaphaelPlayer] gets hole card ['CQ', 'D4'], current stack 4444
Started the round 44
Street "preflop" started. (community card = [])
"Zheng" declared "call:10"
"RaphaelPlayer" declared "fold:0"
"ZifengFoldMan" declared "fold:0"
"YueShi" declared "fold:0"
"Finneas" declared "call:10"
"Yuchun" declared "fold:0"
Street "flop" started. (community card = ['S3', 'CJ', 'C9'])
"Finneas" declared "call:0"
"Zheng" declared "call:0"
Street "turn" started. (community card = ['S3', 'CJ', 'C9', 'HK'])
"Finneas" declared "call:0"
"Zheng" declared "call:0"
Street "river" started. (community card = ['S3', 'CJ', 'C9', 'HK', 'D7'])
"Finneas" declared "call:0"
"Zheng" declared "call:0"
"['Finneas']" won the round 44 (stack = {'EvanPlayer': 0, 'ZifengFoldMan': 905, 'JoyoPlayer': 0, 'YueShi': 895, 'Finneas': 1080, 'Yuchun': 414, 'Zheng': 262, 'RaphaelPlayer': 4444})
player [ZifengFoldMan] gets hole card ['S4', 'C6'], current stack 905
player [YueShi] gets hole card ['D8', 'CA'], current stack 895
player [Finneas] gets hole card ['S6', 'H9'], current stack 1080
player [Yuchun] gets hole card ['D7', 'SK'], current stack 409
player [Zheng] gets hole card ['CQ', 'HT'], current stack 252
player [RaphaelPlayer] gets hole card ['HJ', 'D6'], current stack 4444
Started the round 45
Street "preflop" started. (community card = [])
"RaphaelPlayer" declared "fold:0"
"ZifengFoldMan" declared "fold:0"
"YueShi" declared "fold:0"
"Finneas" declared "call:10"
"Yuchun" declared "fold:0"
"Zheng" declared "call:10"
Street "flop" started. (community card = ['H2', 'C9', 'H6'])
"Zheng" declared "call:0"
"Finneas" declared "call:0"
Street "turn" started. (community card = ['H2', 'C9', 'H6', 'DJ'])
"Zheng" declared "call:0"
"Finneas" declared "call:0"
Street "river" started. (community card = ['H2', 'C9', 'H6', 'DJ', 'H5'])
"Zheng" declared "call:0"
"Finneas" declared "call:0"
"['Finneas']" won the round 45 (stack = {'EvanPlayer': 0, 'ZifengFoldMan': 905, 'JoyoPlayer': 0, 'YueShi': 895, 'Finneas': 1095, 'Yuchun': 409, 'Zheng': 252, 'RaphaelPlayer': 4444})
player [ZifengFoldMan] gets hole card ['D6', 'SK'], current stack 905
player [YueShi] gets hole card ['C7', 'S9'], current stack 895
player [Finneas] gets hole card ['HA', 'CA'], current stack 1095
player [Yuchun] gets hole card ['H2', 'ST'], current stack 409
player [Zheng] gets hole card ['H9', 'C9'], current stack 247
player [RaphaelPlayer] gets hole card ['HK', 'H5'], current stack 4434
Started the round 46
Street "preflop" started. (community card = [])
"ZifengFoldMan" declared "fold:0"
"YueShi" declared "fold:0"
"Finneas" declared "raise:555"
"Yuchun" declared "fold:0"
"Zheng" declared "fold:0"
"RaphaelPlayer" declared "fold:0"
"['Finneas']" won the round 46 (stack = {'EvanPlayer': 0, 'ZifengFoldMan': 905, 'JoyoPlayer': 0, 'YueShi': 895, 'Finneas': 1110, 'Yuchun': 409, 'Zheng': 247, 'RaphaelPlayer': 4434})
player [ZifengFoldMan] gets hole card ['HA', 'S6'], current stack 895
player [YueShi] gets hole card ['S4', 'H7'], current stack 895
player [Finneas] gets hole card ['DK', 'HJ'], current stack 1110
player [Yuchun] gets hole card ['H3', 'S7'], current stack 409
player [Zheng] gets hole card ['C3', 'CA'], current stack 247
player [RaphaelPlayer] gets hole card ['SK', 'S9'], current stack 4429
Started the round 47
Street "preflop" started. (community card = [])
"YueShi" declared "fold:0"
"Finneas" declared "call:10"
"Yuchun" declared "fold:0"
"Zheng" declared "call:10"
"RaphaelPlayer" declared "call:10"
"ZifengFoldMan" declared "fold:0"
Street "flop" started. (community card = ['D6', 'H5', 'HT'])
"RaphaelPlayer" declared "call:0"
"Finneas" declared "call:0"
"Zheng" declared "call:0"
Street "turn" started. (community card = ['D6', 'H5', 'HT', 'C2'])
"RaphaelPlayer" declared "call:0"
"Finneas" declared "call:0"
"Zheng" declared "call:0"
Street "river" started. (community card = ['D6', 'H5', 'HT', 'C2', 'C8'])
"RaphaelPlayer" declared "call:0"
"Finneas" declared "call:0"
"Zheng" declared "call:0"
"['Zheng']" won the round 47 (stack = {'EvanPlayer': 0, 'ZifengFoldMan': 895, 'JoyoPlayer': 0, 'YueShi': 895, 'Finneas': 1100, 'Yuchun': 409, 'Zheng': 277, 'RaphaelPlayer': 4424})
player [ZifengFoldMan] gets hole card ['C3', 'H9'], current stack 890
player [YueShi] gets hole card ['CQ', 'CJ'], current stack 885
player [Finneas] gets hole card ['S9', 'S3'], current stack 1100
player [Yuchun] gets hole card ['HA', 'DJ'], current stack 409
player [Zheng] gets hole card ['D4', 'CA'], current stack 277
player [RaphaelPlayer] gets hole card ['DQ', 'D9'], current stack 4424
Started the round 48
Street "preflop" started. (community card = [])
"Finneas" declared "call:10"
"Yuchun" declared "fold:0"
"Zheng" declared "call:10"
"RaphaelPlayer" declared "call:10"
"ZifengFoldMan" declared "fold:0"
"YueShi" declared "fold:0"
Street "flop" started. (community card = ['CK', 'SJ', 'ST'])
"Finneas" declared "call:0"
"Zheng" declared "call:0"
"RaphaelPlayer" declared "raise:55"
"Finneas" declared "fold:0"
"Zheng" declared "call:55"
Street "turn" started. (community card = ['CK', 'SJ', 'ST', 'H3'])
"Zheng" declared "call:0"
"RaphaelPlayer" declared "raise:165"
"Zheng" declared "fold:0"
"['RaphaelPlayer']" won the round 48 (stack = {'EvanPlayer': 0, 'ZifengFoldMan': 890, 'JoyoPlayer': 0, 'YueShi': 885, 'Finneas': 1090, 'Yuchun': 409, 'Zheng': 212, 'RaphaelPlayer': 4514})
player [ZifengFoldMan] gets hole card ['DQ', 'H4'], current stack 890
player [YueShi] gets hole card ['SK', 'HQ'], current stack 880
player [Finneas] gets hole card ['D4', 'CA'], current stack 1080
player [Yuchun] gets hole card ['DK', 'CQ'], current stack 409
player [Zheng] gets hole card ['C8', 'C3'], current stack 212
player [RaphaelPlayer] gets hole card ['C5', 'S5'], current stack 4514
Started the round 49
Street "preflop" started. (community card = [])
"Yuchun" declared "fold:0"
"Zheng" declared "call:10"
"RaphaelPlayer" declared "call:10"
"ZifengFoldMan" declared "fold:0"
"YueShi" declared "fold:0"
"Finneas" declared "call:10"
Street "flop" started. (community card = ['DA', 'S7', 'D6'])
"Finneas" declared "call:0"
"Zheng" declared "call:0"
"RaphaelPlayer" declared "call:0"
Street "turn" started. (community card = ['DA', 'S7', 'D6', 'H6'])
"Finneas" declared "call:0"
"Zheng" declared "call:0"
"RaphaelPlayer" declared "call:0"
Street "river" started. (community card = ['DA', 'S7', 'D6', 'H6', 'D3'])
"Finneas" declared "call:0"
"Zheng" declared "call:0"
"RaphaelPlayer" declared "call:0"
"['Finneas']" won the round 49 (stack = {'EvanPlayer': 0, 'ZifengFoldMan': 890, 'JoyoPlayer': 0, 'YueShi': 880, 'Finneas': 1115, 'Yuchun': 409, 'Zheng': 202, 'RaphaelPlayer': 4504})
player [ZifengFoldMan] gets hole card ['HA', 'D5'], current stack 890
player [YueShi] gets hole card ['H7', 'CK'], current stack 880
player [Finneas] gets hole card ['S9', 'DT'], current stack 1110
player [Yuchun] gets hole card ['ST', 'D8'], current stack 399
player [Zheng] gets hole card ['CJ', 'SA'], current stack 202
player [RaphaelPlayer] gets hole card ['HJ', 'H6'], current stack 4504
Started the round 50
Street "preflop" started. (community card = [])
"Zheng" declared "call:10"
"RaphaelPlayer" declared "call:10"
"ZifengFoldMan" declared "fold:0"
"YueShi" declared "fold:0"
"Finneas" declared "call:10"
"Yuchun" declared "fold:0"
Street "flop" started. (community card = ['C9', 'C7', 'S5'])
"Finneas" declared "call:0"
"Zheng" declared "call:0"
"RaphaelPlayer" declared "call:0"
Street "turn" started. (community card = ['C9', 'C7', 'S5', 'CQ'])
"Finneas" declared "call:0"
"Zheng" declared "call:0"
"RaphaelPlayer" declared "call:0"
Street "river" started. (community card = ['C9', 'C7', 'S5', 'CQ', 'SK'])
"Finneas" declared "call:0"
"Zheng" declared "call:0"
"RaphaelPlayer" declared "call:0"
"['Finneas']" won the round 50 (stack = {'EvanPlayer': 0, 'ZifengFoldMan': 890, 'JoyoPlayer': 0, 'YueShi': 880, 'Finneas': 1145, 'Yuchun': 399, 'Zheng': 192, 'RaphaelPlayer': 4494})

Game Results:
------------------------------------------------------------
Game 1:
Winner: RaphaelPlayer (stack: 4494)
All players' stacks:
  EvanPlayer: 0
  ZifengFoldMan: 890
  JoyoPlayer: 0
  YueShi: 880
  Finneas: 1145
  Yuchun: 399
  Zheng: 192
  RaphaelPlayer: 4494
------------------------------------------------------------
