player [EvanPlayer] gets hole card ['C7', 'HK'], current stack 1000
player [ZifengFoldMan] gets hole card ['D5', 'S4'], current stack 995
player [JoyoPlayer] gets hole card ['H5', 'C2'], current stack 990
player [YueShi] gets hole card ['H6', 'S8'], current stack 1000
player [Finneas] gets hole card ['S9', 'ST'], current stack 1000
player [Yuchun] gets hole card ['C9', 'DJ'], current stack 1000
player [Zheng] gets hole card ['CK', 'DK'], current stack 1000
player [RaphaelPlayer] gets hole card ['H7', 'S3'], current stack 1000
Started the round 1
Street "preflop" started. (community card = [])
"YueShi" declared "fold:0"
"Finneas" declared "call:10"
"Yuchun" declared "fold:0"
"Zheng" declared "call:10"
"RaphaelPlayer" declared "fold:0"
"EvanPlayer" declared "call:10"
"ZifengFoldMan" declared "fold:0"
"JoyoPlayer" declared "fold:0"
Street "flop" started. (community card = ['C6', 'HQ', 'DA'])
"Finneas" declared "call:0"
"Zheng" declared "call:0"
"EvanPlayer" declared "fold:0"
Street "turn" started. (community card = ['C6', 'HQ', 'DA', 'S6'])
"Finneas" declared "call:0"
"Zheng" declared "raise:500"
"Finneas" declared "fold:0"
"['Zheng']" won the round 1 (stack = {'EvanPlayer': 990, 'ZifengFoldMan': 995, 'JoyoPlayer': 990, 'YueShi': 1000, 'Finneas': 990, 'Yuchun': 1000, 'Zheng': 1035, 'RaphaelPlayer': 1000})
player [EvanPlayer] gets hole card ['D8', 'HJ'], current stack 990
player [ZifengFoldMan] gets hole card ['HK', 'C6'], current stack 995
player [JoyoPlayer] gets hole card ['H2', 'S2'], current stack 985
player [YueShi] gets hole card ['S3', 'D9'], current stack 990
player [Finneas] gets hole card ['H5', 'H3'], current stack 990
player [Yuchun] gets hole card ['H7', 'C8'], current stack 1000
player [Zheng] gets hole card ['DK', 'C4'], current stack 1035
player [RaphaelPlayer] gets hole card ['C7', 'D5'], current stack 1000
Started the round 2
Street "preflop" started. (community card = [])
"Finneas" declared "call:10"
"Yuchun" declared "fold:0"
"Zheng" declared "call:10"
"RaphaelPlayer" declared "fold:0"
"EvanPlayer" declared "raise:990"
"ZifengFoldMan" declared "fold:0"
"JoyoPlayer" declared "call:990"
"YueShi" declared "fold:0"
"Finneas" declared "fold:0"
"Zheng" declared "fold:0"
Street "flop" started. (community card = ['H4', 'DA', 'D3'])
Street "turn" started. (community card = ['H4', 'DA', 'D3', 'D7'])
Street "river" started. (community card = ['H4', 'DA', 'D3', 'D7', 'S8'])
"['EvanPlayer']" won the round 2 (stack = {'EvanPlayer': 2010, 'ZifengFoldMan': 995, 'JoyoPlayer': 0, 'YueShi': 990, 'Finneas': 980, 'Yuchun': 1000, 'Zheng': 1025, 'RaphaelPlayer': 1000})
player [EvanPlayer] gets hole card ['C6', 'D4'], current stack 2010
player [ZifengFoldMan] gets hole card ['S5', 'S6'], current stack 995
player [YueShi] gets hole card ['HK', 'CK'], current stack 990
player [Finneas] gets hole card ['H5', 'C5'], current stack 975
player [Yuchun] gets hole card ['D2', 'SA'], current stack 990
player [Zheng] gets hole card ['D9', 'H8'], current stack 1025
player [RaphaelPlayer] gets hole card ['HQ', 'H6'], current stack 1000
Started the round 3
Street "preflop" started. (community card = [])
"Zheng" declared "call:10"
"RaphaelPlayer" declared "call:10"
"EvanPlayer" declared "fold:10"
"ZifengFoldMan" declared "fold:0"
"YueShi" declared "fold:0"
"Finneas" declared "call:10"
"Yuchun" declared "fold:0"
Street "flop" started. (community card = ['DQ', 'C7', 'SK'])
"Finneas" declared "call:0"
"Zheng" declared "call:0"
"RaphaelPlayer" declared "raise:50"
"Finneas" declared "fold:0"
"Zheng" declared "fold:0"
"['RaphaelPlayer']" won the round 3 (stack = {'EvanPlayer': 2010, 'ZifengFoldMan': 995, 'JoyoPlayer': 0, 'YueShi': 990, 'Finneas': 970, 'Yuchun': 990, 'Zheng': 1015, 'RaphaelPlayer': 1030})
player [EvanPlayer] gets hole card ['H4', 'C9'], current stack 2010
player [ZifengFoldMan] gets hole card ['DA', 'D4'], current stack 995
player [YueShi] gets hole card ['C5', 'D9'], current stack 990
player [Finneas] gets hole card ['D3', 'HQ'], current stack 970
player [Yuchun] gets hole card ['CT', 'D5'], current stack 985
player [Zheng] gets hole card ['C3', 'CQ'], current stack 1005
player [RaphaelPlayer] gets hole card ['D2', 'S3'], current stack 1030
Started the round 4
Street "preflop" started. (community card = [])
"RaphaelPlayer" declared "fold:0"
"EvanPlayer" declared "fold:10"
"ZifengFoldMan" declared "fold:0"
"YueShi" declared "fold:0"
"Finneas" declared "call:10"
"Yuchun" declared "fold:0"
"Zheng" declared "call:10"
Street "flop" started. (community card = ['C2', 'S5', 'H3'])
"Zheng" declared "call:0"
"Finneas" declared "call:0"
Street "turn" started. (community card = ['C2', 'S5', 'H3', 'CK'])
"Zheng" declared "call:0"
"Finneas" declared "call:0"
Street "river" started. (community card = ['C2', 'S5', 'H3', 'CK', 'HJ'])
"Zheng" declared "call:0"
"Finneas" declared "call:0"
"['Finneas', 'Zheng']" won the round 4 (stack = {'EvanPlayer': 2010, 'ZifengFoldMan': 995, 'JoyoPlayer': 0, 'YueShi': 990, 'Finneas': 972, 'Yuchun': 985, 'Zheng': 1017, 'RaphaelPlayer': 1030})
player [EvanPlayer] gets hole card ['CK', 'HK'], current stack 2010
player [ZifengFoldMan] gets hole card ['S5', 'HQ'], current stack 995
player [YueShi] gets hole card ['S2', 'D4'], current stack 990
player [Finneas] gets hole card ['D9', 'D6'], current stack 972
player [Yuchun] gets hole card ['S7', 'H5'], current stack 985
player [Zheng] gets hole card ['HA', 'C8'], current stack 1012
player [RaphaelPlayer] gets hole card ['C6', 'SQ'], current stack 1020
Started the round 5
Street "preflop" started. (community card = [])
"EvanPlayer" declared "raise:2010"
"ZifengFoldMan" declared "fold:0"
"YueShi" declared "fold:0"
"Finneas" declared "fold:0"
"Yuchun" declared "fold:0"
"Zheng" declared "fold:0"
"RaphaelPlayer" declared "fold:0"
"['EvanPlayer']" won the round 5 (stack = {'EvanPlayer': 2025, 'ZifengFoldMan': 995, 'JoyoPlayer': 0, 'YueShi': 990, 'Finneas': 972, 'Yuchun': 985, 'Zheng': 1012, 'RaphaelPlayer': 1020})
player [EvanPlayer] gets hole card ['D6', 'S5'], current stack 2015
player [ZifengFoldMan] gets hole card ['H4', 'C6'], current stack 995
player [YueShi] gets hole card ['D8', 'HQ'], current stack 990
player [Finneas] gets hole card ['C4', 'D3'], current stack 972
player [Yuchun] gets hole card ['H3', 'S3'], current stack 985
player [Zheng] gets hole card ['SK', 'S4'], current stack 1012
player [RaphaelPlayer] gets hole card ['C7', 'S8'], current stack 1015
Started the round 6
Street "preflop" started. (community card = [])
"ZifengFoldMan" declared "fold:0"
"YueShi" declared "fold:0"
"Finneas" declared "call:10"
"Yuchun" declared "fold:0"
"Zheng" declared "call:10"
"RaphaelPlayer" declared "fold:0"
"EvanPlayer" declared "fold:10"
Street "flop" started. (community card = ['DJ', 'DQ', 'DK'])
"Finneas" declared "call:0"
"Zheng" declared "call:0"
Street "turn" started. (community card = ['DJ', 'DQ', 'DK', 'CJ'])
"Finneas" declared "call:0"
"Zheng" declared "call:0"
Street "river" started. (community card = ['DJ', 'DQ', 'DK', 'CJ', 'S9'])
"Finneas" declared "call:0"
"Zheng" declared "call:0"
"['Zheng']" won the round 6 (stack = {'EvanPlayer': 2015, 'ZifengFoldMan': 995, 'JoyoPlayer': 0, 'YueShi': 990, 'Finneas': 962, 'Yuchun': 985, 'Zheng': 1037, 'RaphaelPlayer': 1015})
player [EvanPlayer] gets hole card ['HJ', 'CT'], current stack 2010
player [ZifengFoldMan] gets hole card ['S6', 'S9'], current stack 985
player [YueShi] gets hole card ['H9', 'DA'], current stack 990
player [Finneas] gets hole card ['D9', 'S2'], current stack 962
player [Yuchun] gets hole card ['D8', 'DQ'], current stack 985
player [Zheng] gets hole card ['S8', 'SA'], current stack 1037
player [RaphaelPlayer] gets hole card ['S3', 'D5'], current stack 1015
Started the round 7
Street "preflop" started. (community card = [])
"YueShi" declared "fold:0"
"Finneas" declared "call:10"
"Yuchun" declared "fold:0"
"Zheng" declared "call:10"
"RaphaelPlayer" declared "fold:0"
"EvanPlayer" declared "call:10"
"ZifengFoldMan" declared "fold:0"
Street "flop" started. (community card = ['C9', 'H4', 'HA'])
"EvanPlayer" declared "fold:0"
"Finneas" declared "call:0"
"Zheng" declared "call:0"
Street "turn" started. (community card = ['C9', 'H4', 'HA', 'D3'])
"Finneas" declared "call:0"
"Zheng" declared "call:0"
Street "river" started. (community card = ['C9', 'H4', 'HA', 'D3', 'CK'])
"Finneas" declared "call:0"
"Zheng" declared "raise:518"
"Finneas" declared "fold:0"
"['Zheng']" won the round 7 (stack = {'EvanPlayer': 2005, 'ZifengFoldMan': 985, 'JoyoPlayer': 0, 'YueShi': 990, 'Finneas': 952, 'Yuchun': 985, 'Zheng': 1067, 'RaphaelPlayer': 1015})
player [EvanPlayer] gets hole card ['CT', 'D3'], current stack 2005
player [ZifengFoldMan] gets hole card ['DQ', 'H5'], current stack 980
player [YueShi] gets hole card ['CA', 'HJ'], current stack 980
player [Finneas] gets hole card ['SK', 'HQ'], current stack 952
player [Yuchun] gets hole card ['CQ', 'S2'], current stack 985
player [Zheng] gets hole card ['HK', 'D9'], current stack 1067
player [RaphaelPlayer] gets hole card ['H7', 'C5'], current stack 1015
Started the round 8
Street "preflop" started. (community card = [])
"Finneas" declared "call:10"
"Yuchun" declared "fold:0"
"Zheng" declared "call:10"
"RaphaelPlayer" declared "fold:0"
"EvanPlayer" declared "raise:2005"
"ZifengFoldMan" declared "fold:0"
"YueShi" declared "fold:0"
"Finneas" declared "fold:0"
"Zheng" declared "fold:0"
"['EvanPlayer']" won the round 8 (stack = {'EvanPlayer': 2040, 'ZifengFoldMan': 980, 'JoyoPlayer': 0, 'YueShi': 980, 'Finneas': 942, 'Yuchun': 985, 'Zheng': 1057, 'RaphaelPlayer': 1015})
player [EvanPlayer] gets hole card ['H2', 'C5'], current stack 2040
player [ZifengFoldMan] gets hole card ['S7', 'S6'], current stack 980
player [YueShi] gets hole card ['D6', 'C2'], current stack 975
player [Finneas] gets hole card ['S8', 'HK'], current stack 932
player [Yuchun] gets hole card ['SJ', 'DA'], current stack 985
player [Zheng] gets hole card ['C8', 'SK'], current stack 1057
player [RaphaelPlayer] gets hole card ['CJ', 'D5'], current stack 1015
Started the round 9
Street "preflop" started. (community card = [])
"Yuchun" declared "fold:0"
"Zheng" declared "call:10"
"RaphaelPlayer" declared "fold:0"
"EvanPlayer" declared "fold:10"
"ZifengFoldMan" declared "fold:0"
"YueShi" declared "fold:0"
"Finneas" declared "call:10"
Street "flop" started. (community card = ['D8', 'DK', 'D3'])
"Finneas" declared "call:0"
"Zheng" declared "call:0"
Street "turn" started. (community card = ['D8', 'DK', 'D3', 'S5'])
"Finneas" declared "call:0"
"Zheng" declared "call:0"
Street "river" started. (community card = ['D8', 'DK', 'D3', 'S5', 'H3'])
"Finneas" declared "call:0"
"Zheng" declared "call:0"
"['Finneas', 'Zheng']" won the round 9 (stack = {'EvanPlayer': 2040, 'ZifengFoldMan': 980, 'JoyoPlayer': 0, 'YueShi': 975, 'Finneas': 944, 'Yuchun': 985, 'Zheng': 1059, 'RaphaelPlayer': 1015})
player [EvanPlayer] gets hole card ['HQ', 'H4'], current stack 2040
player [ZifengFoldMan] gets hole card ['H8', 'S5'], current stack 980
player [YueShi] gets hole card ['D4', 'CQ'], current stack 975
player [Finneas] gets hole card ['H2', 'DT'], current stack 939
player [Yuchun] gets hole card ['C4', 'D2'], current stack 975
player [Zheng] gets hole card ['D9', 'SJ'], current stack 1059
player [RaphaelPlayer] gets hole card ['SQ', 'C3'], current stack 1015
Started the round 10
Street "preflop" started. (community card = [])
"Zheng" declared "call:10"
"RaphaelPlayer" declared "fold:0"
"EvanPlayer" declared "call:10"
"ZifengFoldMan" declared "fold:0"
"YueShi" declared "fold:0"
"Finneas" declared "call:10"
"Yuchun" declared "call:10"
Street "flop" started. (community card = ['HT', 'SA', 'H7'])
"Finneas" declared "call:0"
"Yuchun" declared "call:0"
"Zheng" declared "call:0"
"EvanPlayer" declared "call:0"
Street "turn" started. (community card = ['HT', 'SA', 'H7', 'HJ'])
"Finneas" declared "call:0"
"Yuchun" declared "call:0"
"Zheng" declared "call:0"
"EvanPlayer" declared "raise:2030"
"Finneas" declared "fold:0"
"Yuchun" declared "fold:0"
"Zheng" declared "fold:0"
"['EvanPlayer']" won the round 10 (stack = {'EvanPlayer': 2070, 'ZifengFoldMan': 980, 'JoyoPlayer': 0, 'YueShi': 975, 'Finneas': 934, 'Yuchun': 975, 'Zheng': 1049, 'RaphaelPlayer': 1015})
player [EvanPlayer] gets hole card ['C5', 'C9'], current stack 2070
player [ZifengFoldMan] gets hole card ['D6', 'DQ'], current stack 980
player [YueShi] gets hole card ['DK', 'C4'], current stack 975
player [Finneas] gets hole card ['H2', 'S9'], current stack 934
player [Yuchun] gets hole card ['C7', 'HJ'], current stack 970
player [Zheng] gets hole card ['D3', 'S7'], current stack 1039
player [RaphaelPlayer] gets hole card ['DA', 'SJ'], current stack 1015
Started the round 11
Street "preflop" started. (community card = [])
"RaphaelPlayer" declared "raise:30"
"EvanPlayer" declared "call:30"
"ZifengFoldMan" declared "fold:0"
"YueShi" declared "fold:0"
"Finneas" declared "fold:0"
"Yuchun" declared "call:30"
"Zheng" declared "fold:0"
Street "flop" started. (community card = ['C6', 'D8', 'D9'])
"Yuchun" declared "call:0"
"RaphaelPlayer" declared "call:0"
"EvanPlayer" declared "fold:0"
Street "turn" started. (community card = ['C6', 'D8', 'D9', 'CT'])
"Yuchun" declared "raise:945"
"RaphaelPlayer" declared "fold:0"
"['Yuchun']" won the round 11 (stack = {'EvanPlayer': 2040, 'ZifengFoldMan': 980, 'JoyoPlayer': 0, 'YueShi': 975, 'Finneas': 934, 'Yuchun': 1045, 'Zheng': 1039, 'RaphaelPlayer': 985})
player [EvanPlayer] gets hole card ['S4', 'S3'], current stack 2040
player [ZifengFoldMan] gets hole card ['SJ', 'S2'], current stack 980
player [YueShi] gets hole card ['H8', 'HJ'], current stack 975
player [Finneas] gets hole card ['HQ', 'C2'], current stack 934
player [Yuchun] gets hole card ['D9', 'H7'], current stack 1045
player [Zheng] gets hole card ['D7', 'C9'], current stack 1034
player [RaphaelPlayer] gets hole card ['D5', 'C8'], current stack 975
Started the round 12
Street "preflop" started. (community card = [])
"EvanPlayer" declared "call:10"
"ZifengFoldMan" declared "fold:0"
"YueShi" declared "fold:0"
"Finneas" declared "call:10"
"Yuchun" declared "call:10"
"Zheng" declared "call:10"
"RaphaelPlayer" declared "fold:0"
Street "flop" started. (community card = ['SA', 'DJ', 'C3'])
"Zheng" declared "call:0"
"EvanPlayer" declared "fold:0"
"Finneas" declared "call:0"
"Yuchun" declared "call:0"
Street "turn" started. (community card = ['SA', 'DJ', 'C3', 'D4'])
"Zheng" declared "call:0"
"Finneas" declared "call:0"
"Yuchun" declared "call:0"
Street "river" started. (community card = ['SA', 'DJ', 'C3', 'D4', 'H3'])
"Zheng" declared "call:0"
"Finneas" declared "call:0"
"Yuchun" declared "call:0"
"['Finneas']" won the round 12 (stack = {'EvanPlayer': 2030, 'ZifengFoldMan': 980, 'JoyoPlayer': 0, 'YueShi': 975, 'Finneas': 974, 'Yuchun': 1035, 'Zheng': 1029, 'RaphaelPlayer': 975})
player [EvanPlayer] gets hole card ['HT', 'CA'], current stack 2020
player [ZifengFoldMan] gets hole card ['C4', 'S3'], current stack 980
player [YueShi] gets hole card ['C6', 'D6'], current stack 975
player [Finneas] gets hole card ['HJ', 'H8'], current stack 974
player [Yuchun] gets hole card ['CJ', 'SQ'], current stack 1035
player [Zheng] gets hole card ['S9', 'DJ'], current stack 1029
player [RaphaelPlayer] gets hole card ['S7', 'H9'], current stack 970
Started the round 13
Street "preflop" started. (community card = [])
"ZifengFoldMan" declared "fold:0"
"YueShi" declared "fold:0"
"Finneas" declared "call:10"
"Yuchun" declared "call:10"
"Zheng" declared "call:10"
"RaphaelPlayer" declared "fold:0"
"EvanPlayer" declared "fold:10"
Street "flop" started. (community card = ['H3', 'C8', 'SA'])
"Finneas" declared "call:0"
"Yuchun" declared "call:0"
"Zheng" declared "call:0"
Street "turn" started. (community card = ['H3', 'C8', 'SA', 'C2'])
"Finneas" declared "call:0"
"Yuchun" declared "call:0"
"Zheng" declared "call:0"
Street "river" started. (community card = ['H3', 'C8', 'SA', 'C2', 'DT'])
"Finneas" declared "call:0"
"Yuchun" declared "call:0"
"Zheng" declared "call:0"
"['Finneas']" won the round 13 (stack = {'EvanPlayer': 2020, 'ZifengFoldMan': 980, 'JoyoPlayer': 0, 'YueShi': 975, 'Finneas': 1009, 'Yuchun': 1025, 'Zheng': 1019, 'RaphaelPlayer': 970})
player [EvanPlayer] gets hole card ['D7', 'D8'], current stack 2015
player [ZifengFoldMan] gets hole card ['S9', 'S7'], current stack 970
player [YueShi] gets hole card ['H8', 'C5'], current stack 975
player [Finneas] gets hole card ['H3', 'H7'], current stack 1009
player [Yuchun] gets hole card ['S4', 'C9'], current stack 1025
player [Zheng] gets hole card ['CJ', 'CK'], current stack 1019
player [RaphaelPlayer] gets hole card ['HQ', 'H2'], current stack 970
Started the round 14
Street "preflop" started. (community card = [])
"YueShi" declared "fold:0"
"Finneas" declared "call:10"
"Yuchun" declared "call:10"
"Zheng" declared "call:10"
"RaphaelPlayer" declared "call:10"
"EvanPlayer" declared "fold:10"
"ZifengFoldMan" declared "fold:0"
Street "flop" started. (community card = ['D9', 'D3', 'H9'])
"Finneas" declared "call:0"
"Yuchun" declared "raise:40"
"Zheng" declared "fold:0"
"RaphaelPlayer" declared "fold:0"
"Finneas" declared "fold:0"
"['Yuchun']" won the round 14 (stack = {'EvanPlayer': 2015, 'ZifengFoldMan': 970, 'JoyoPlayer': 0, 'YueShi': 975, 'Finneas': 999, 'Yuchun': 1070, 'Zheng': 1009, 'RaphaelPlayer': 960})
player [EvanPlayer] gets hole card ['HQ', 'C3'], current stack 2015
player [ZifengFoldMan] gets hole card ['D8', 'SJ'], current stack 965
player [YueShi] gets hole card ['C5', 'H7'], current stack 965
player [Finneas] gets hole card ['C6', 'SQ'], current stack 999
player [Yuchun] gets hole card ['DT', 'C2'], current stack 1070
player [Zheng] gets hole card ['CQ', 'CK'], current stack 1009
player [RaphaelPlayer] gets hole card ['HA', 'CJ'], current stack 960
Started the round 15
Street "preflop" started. (community card = [])
"Finneas" declared "call:10"
"Yuchun" declared "call:10"
"Zheng" declared "call:10"
"RaphaelPlayer" declared "raise:30"
"EvanPlayer" declared "call:30"
"ZifengFoldMan" declared "fold:0"
"YueShi" declared "fold:0"
"Finneas" declared "fold:0"
"Yuchun" declared "call:30"
"Zheng" declared "fold:0"
Street "flop" started. (community card = ['ST', 'CA', 'HJ'])
"Yuchun" declared "call:0"
"RaphaelPlayer" declared "raise:135"
"EvanPlayer" declared "fold:135"
"Yuchun" declared "call:135"
Street "turn" started. (community card = ['ST', 'CA', 'HJ', 'H3'])
"Yuchun" declared "call:0"
"RaphaelPlayer" declared "raise:405"
"Yuchun" declared "fold:0"
"['RaphaelPlayer']" won the round 15 (stack = {'EvanPlayer': 1985, 'ZifengFoldMan': 965, 'JoyoPlayer': 0, 'YueShi': 965, 'Finneas': 989, 'Yuchun': 905, 'Zheng': 999, 'RaphaelPlayer': 1190})
player [EvanPlayer] gets hole card ['DJ', 'D2'], current stack 1985
player [ZifengFoldMan] gets hole card ['S3', 'SQ'], current stack 965
player [YueShi] gets hole card ['D5', 'C5'], current stack 960
player [Finneas] gets hole card ['DA', 'DQ'], current stack 979
player [Yuchun] gets hole card ['CJ', 'H6'], current stack 905
player [Zheng] gets hole card ['C9', 'SJ'], current stack 999
player [RaphaelPlayer] gets hole card ['C3', 'D7'], current stack 1190
Started the round 16
Street "preflop" started. (community card = [])
"Yuchun" declared "call:10"
"Zheng" declared "call:10"
"RaphaelPlayer" declared "fold:0"
"EvanPlayer" declared "fold:10"
"ZifengFoldMan" declared "fold:0"
"YueShi" declared "fold:0"
"Finneas" declared "raise:502"
"Yuchun" declared "fold:0"
"Zheng" declared "fold:0"
"['Finneas']" won the round 16 (stack = {'EvanPlayer': 1985, 'ZifengFoldMan': 965, 'JoyoPlayer': 0, 'YueShi': 960, 'Finneas': 1014, 'Yuchun': 895, 'Zheng': 989, 'RaphaelPlayer': 1190})
player [EvanPlayer] gets hole card ['H4', 'CQ'], current stack 1985
player [ZifengFoldMan] gets hole card ['C4', 'D3'], current stack 965
player [YueShi] gets hole card ['D9', 'D5'], current stack 960
player [Finneas] gets hole card ['H8', 'S4'], current stack 1009
player [Yuchun] gets hole card ['C2', 'D6'], current stack 885
player [Zheng] gets hole card ['S3', 'SJ'], current stack 989
player [RaphaelPlayer] gets hole card ['HT', 'C6'], current stack 1190
Started the round 17
Street "preflop" started. (community card = [])
"Zheng" declared "call:10"
"RaphaelPlayer" declared "fold:0"
"EvanPlayer" declared "raise:1985"
"ZifengFoldMan" declared "fold:0"
"YueShi" declared "fold:0"
"Finneas" declared "fold:0"
"Yuchun" declared "fold:0"
"Zheng" declared "fold:0"
"['EvanPlayer']" won the round 17 (stack = {'EvanPlayer': 2010, 'ZifengFoldMan': 965, 'JoyoPlayer': 0, 'YueShi': 960, 'Finneas': 1009, 'Yuchun': 885, 'Zheng': 979, 'RaphaelPlayer': 1190})
player [EvanPlayer] gets hole card ['C5', 'SA'], current stack 2010
player [ZifengFoldMan] gets hole card ['CK', 'DK'], current stack 965
player [YueShi] gets hole card ['HA', 'H7'], current stack 960
player [Finneas] gets hole card ['H2', 'S2'], current stack 1009
player [Yuchun] gets hole card ['SJ', 'C6'], current stack 880
player [Zheng] gets hole card ['HT', 'ST'], current stack 969
player [RaphaelPlayer] gets hole card ['D6', 'D3'], current stack 1190
Started the round 18
Street "preflop" started. (community card = [])
"RaphaelPlayer" declared "fold:0"
"EvanPlayer" declared "raise:2010"
"ZifengFoldMan" declared "fold:0"
"YueShi" declared "fold:0"
"Finneas" declared "fold:0"
"Yuchun" declared "fold:0"
"Zheng" declared "fold:0"
"['EvanPlayer']" won the round 18 (stack = {'EvanPlayer': 2025, 'ZifengFoldMan': 965, 'JoyoPlayer': 0, 'YueShi': 960, 'Finneas': 1009, 'Yuchun': 880, 'Zheng': 969, 'RaphaelPlayer': 1190})
player [EvanPlayer] gets hole card ['H4', 'S8'], current stack 2025
player [ZifengFoldMan] gets hole card ['H8', 'D5'], current stack 965
player [YueShi] gets hole card ['CJ', 'H9'], current stack 960
player [Finneas] gets hole card ['S2', 'DT'], current stack 1009
player [Yuchun] gets hole card ['SQ', 'ST'], current stack 880
player [Zheng] gets hole card ['C9', 'S4'], current stack 964
player [RaphaelPlayer] gets hole card ['D9', 'CK'], current stack 1180
Started the round 19
Street "preflop" started. (community card = [])
"EvanPlayer" declared "fold:10"
"ZifengFoldMan" declared "fold:0"
"YueShi" declared "fold:0"
"Finneas" declared "call:10"
"Yuchun" declared "call:10"
"Zheng" declared "call:10"
"RaphaelPlayer" declared "call:10"
Street "flop" started. (community card = ['DK', 'DA', 'CQ'])
"Zheng" declared "call:0"
"RaphaelPlayer" declared "call:0"
"Finneas" declared "call:0"
"Yuchun" declared "call:0"
Street "turn" started. (community card = ['DK', 'DA', 'CQ', 'H5'])
"Zheng" declared "call:0"
"RaphaelPlayer" declared "call:0"
"Finneas" declared "call:0"
"Yuchun" declared "call:0"
Street "river" started. (community card = ['DK', 'DA', 'CQ', 'H5', 'D7'])
"Zheng" declared "call:0"
"RaphaelPlayer" declared "call:0"
"Finneas" declared "call:0"
"Yuchun" declared "call:0"
"['RaphaelPlayer']" won the round 19 (stack = {'EvanPlayer': 2025, 'ZifengFoldMan': 965, 'JoyoPlayer': 0, 'YueShi': 960, 'Finneas': 999, 'Yuchun': 870, 'Zheng': 959, 'RaphaelPlayer': 1220})
player [EvanPlayer] gets hole card ['SA', 'D5'], current stack 2015
player [ZifengFoldMan] gets hole card ['H3', 'C5'], current stack 965
player [YueShi] gets hole card ['ST', 'DJ'], current stack 960
player [Finneas] gets hole card ['SJ', 'C7'], current stack 999
player [Yuchun] gets hole card ['S6', 'DQ'], current stack 870
player [Zheng] gets hole card ['D8', 'D6'], current stack 959
player [RaphaelPlayer] gets hole card ['S2', 'H4'], current stack 1215
Started the round 20
Street "preflop" started. (community card = [])
"ZifengFoldMan" declared "fold:0"
"YueShi" declared "fold:0"
"Finneas" declared "call:10"
"Yuchun" declared "call:10"
"Zheng" declared "call:10"
"RaphaelPlayer" declared "fold:0"
"EvanPlayer" declared "fold:10"
Street "flop" started. (community card = ['CT', 'H7', 'CA'])
"Finneas" declared "call:0"
"Yuchun" declared "call:0"
"Zheng" declared "call:0"
Street "turn" started. (community card = ['CT', 'H7', 'CA', 'DA'])
"Finneas" declared "call:0"
"Yuchun" declared "call:0"
"Zheng" declared "call:0"
Street "river" started. (community card = ['CT', 'H7', 'CA', 'DA', 'S5'])
"Finneas" declared "call:0"
"Yuchun" declared "call:0"
"Zheng" declared "call:0"
"['Finneas']" won the round 20 (stack = {'EvanPlayer': 2015, 'ZifengFoldMan': 965, 'JoyoPlayer': 0, 'YueShi': 960, 'Finneas': 1034, 'Yuchun': 860, 'Zheng': 949, 'RaphaelPlayer': 1215})
player [EvanPlayer] gets hole card ['C3', 'HJ'], current stack 2010
player [ZifengFoldMan] gets hole card ['H3', 'D5'], current stack 955
player [YueShi] gets hole card ['H8', 'D6'], current stack 960
player [Finneas] gets hole card ['D7', 'CK'], current stack 1034
player [Yuchun] gets hole card ['SK', 'DA'], current stack 860
player [Zheng] gets hole card ['SJ', 'S6'], current stack 949
player [RaphaelPlayer] gets hole card ['CJ', 'H2'], current stack 1215
Started the round 21
Street "preflop" started. (community card = [])
"YueShi" declared "fold:0"
"Finneas" declared "call:10"
"Yuchun" declared "call:10"
"Zheng" declared "call:10"
"RaphaelPlayer" declared "fold:0"
"EvanPlayer" declared "fold:10"
"ZifengFoldMan" declared "fold:0"
Street "flop" started. (community card = ['SQ', 'C8', 'S3'])
"Finneas" declared "call:0"
"Yuchun" declared "call:0"
"Zheng" declared "call:0"
Street "turn" started. (community card = ['SQ', 'C8', 'S3', 'HQ'])
"Finneas" declared "call:0"
"Yuchun" declared "call:0"
"Zheng" declared "call:0"
Street "river" started. (community card = ['SQ', 'C8', 'S3', 'HQ', 'DT'])
"Finneas" declared "call:0"
"Yuchun" declared "call:0"
"Zheng" declared "call:0"
"['Yuchun']" won the round 21 (stack = {'EvanPlayer': 2010, 'ZifengFoldMan': 955, 'JoyoPlayer': 0, 'YueShi': 960, 'Finneas': 1024, 'Yuchun': 895, 'Zheng': 939, 'RaphaelPlayer': 1215})
player [EvanPlayer] gets hole card ['DA', 'S7'], current stack 2010
player [ZifengFoldMan] gets hole card ['D3', 'CK'], current stack 950
player [YueShi] gets hole card ['HT', 'SJ'], current stack 950
player [Finneas] gets hole card ['H7', 'C6'], current stack 1024
player [Yuchun] gets hole card ['C8', 'S2'], current stack 895
player [Zheng] gets hole card ['HQ', 'H5'], current stack 939
player [RaphaelPlayer] gets hole card ['C4', 'S5'], current stack 1215
Started the round 22
Street "preflop" started. (community card = [])
"Finneas" declared "call:10"
"Yuchun" declared "call:10"
"Zheng" declared "call:10"
"RaphaelPlayer" declared "fold:0"
"EvanPlayer" declared "call:10"
"ZifengFoldMan" declared "fold:0"
"YueShi" declared "fold:0"
Street "flop" started. (community card = ['D5', 'C5', 'CJ'])
"Finneas" declared "call:0"
"Yuchun" declared "call:0"
"Zheng" declared "raise:469"
"EvanPlayer" declared "fold:469"
"Finneas" declared "fold:0"
"Yuchun" declared "fold:0"
"['Zheng']" won the round 22 (stack = {'EvanPlayer': 2000, 'ZifengFoldMan': 950, 'JoyoPlayer': 0, 'YueShi': 950, 'Finneas': 1014, 'Yuchun': 885, 'Zheng': 984, 'RaphaelPlayer': 1215})
player [EvanPlayer] gets hole card ['C2', 'S6'], current stack 2000
player [ZifengFoldMan] gets hole card ['C7', 'DA'], current stack 950
player [YueShi] gets hole card ['C8', 'DJ'], current stack 945
player [Finneas] gets hole card ['S3', 'D4'], current stack 1004
player [Yuchun] gets hole card ['S5', 'D2'], current stack 885
player [Zheng] gets hole card ['HJ', 'H5'], current stack 984
player [RaphaelPlayer] gets hole card ['H7', 'SQ'], current stack 1215
Started the round 23
Street "preflop" started. (community card = [])
"Yuchun" declared "call:10"
"Zheng" declared "call:10"
"RaphaelPlayer" declared "call:10"
"EvanPlayer" declared "fold:10"
"ZifengFoldMan" declared "fold:0"
"YueShi" declared "fold:0"
"Finneas" declared "call:10"
Street "flop" started. (community card = ['C4', 'HA', 'SJ'])
"Finneas" declared "call:0"
"Yuchun" declared "call:0"
"Zheng" declared "call:0"
"RaphaelPlayer" declared "call:0"
Street "turn" started. (community card = ['C4', 'HA', 'SJ', 'CJ'])
"Finneas" declared "call:0"
"Yuchun" declared "call:0"
"Zheng" declared "raise:492"
"RaphaelPlayer" declared "fold:0"
"Finneas" declared "fold:0"
"Yuchun" declared "fold:0"
"['Zheng']" won the round 23 (stack = {'EvanPlayer': 2000, 'ZifengFoldMan': 950, 'JoyoPlayer': 0, 'YueShi': 945, 'Finneas': 1004, 'Yuchun': 875, 'Zheng': 1019, 'RaphaelPlayer': 1205})
player [EvanPlayer] gets hole card ['C8', 'HA'], current stack 2000
player [ZifengFoldMan] gets hole card ['D7', 'C5'], current stack 950
player [YueShi] gets hole card ['C4', 'D6'], current stack 945
player [Finneas] gets hole card ['HT', 'D3'], current stack 999
player [Yuchun] gets hole card ['CT', 'DJ'], current stack 865
player [Zheng] gets hole card ['HJ', 'SK'], current stack 1019
player [RaphaelPlayer] gets hole card ['H2', 'H6'], current stack 1205
Started the round 24
Street "preflop" started. (community card = [])
"Zheng" declared "call:10"
"RaphaelPlayer" declared "fold:0"
"EvanPlayer" declared "call:10"
"ZifengFoldMan" declared "fold:0"
"YueShi" declared "fold:0"
"Finneas" declared "call:10"
"Yuchun" declared "call:10"
Street "flop" started. (community card = ['HQ', 'C9', 'C6'])
"Finneas" declared "call:0"
"Yuchun" declared "call:0"
"Zheng" declared "call:0"
"EvanPlayer" declared "fold:0"
Street "turn" started. (community card = ['HQ', 'C9', 'C6', 'DT'])
"Finneas" declared "call:0"
"Yuchun" declared "call:0"
"Zheng" declared "raise:1009"
"Finneas" declared "fold:0"
"Yuchun" declared "call:1009"
Street "river" started. (community card = ['HQ', 'C9', 'C6', 'DT', 'SQ'])
"['Zheng']" won the round 24 (stack = {'EvanPlayer': 1990, 'ZifengFoldMan': 950, 'JoyoPlayer': 0, 'YueShi': 945, 'Finneas': 994, 'Yuchun': 0, 'Zheng': 1914, 'RaphaelPlayer': 1205})
player [EvanPlayer] gets hole card ['H8', 'ST'], current stack 1990
player [ZifengFoldMan] gets hole card ['C8', 'DJ'], current stack 950
player [YueShi] gets hole card ['S7', 'C7'], current stack 945
player [Finneas] gets hole card ['H2', 'DQ'], current stack 994
player [Zheng] gets hole card ['DT', 'S3'], current stack 1909
player [RaphaelPlayer] gets hole card ['D5', 'C2'], current stack 1195
Started the round 25
Street "preflop" started. (community card = [])
"EvanPlayer" declared "call:10"
"ZifengFoldMan" declared "fold:0"
"YueShi" declared "fold:0"
"Finneas" declared "call:10"
"Zheng" declared "call:10"
"RaphaelPlayer" declared "fold:0"
Street "flop" started. (community card = ['S9', 'C4', 'DK'])
"Zheng" declared "call:0"
"EvanPlayer" declared "fold:0"
"Finneas" declared "call:0"
Street "turn" started. (community card = ['S9', 'C4', 'DK', 'DA'])
"Zheng" declared "call:0"
"Finneas" declared "call:0"
Street "river" started. (community card = ['S9', 'C4', 'DK', 'DA', 'C5'])
"Zheng" declared "call:0"
"Finneas" declared "call:0"
"['Finneas']" won the round 25 (stack = {'EvanPlayer': 1980, 'ZifengFoldMan': 950, 'JoyoPlayer': 0, 'YueShi': 945, 'Finneas': 1024, 'Yuchun': 0, 'Zheng': 1904, 'RaphaelPlayer': 1195})
player [EvanPlayer] gets hole card ['SQ', 'HQ'], current stack 1970
player [ZifengFoldMan] gets hole card ['C8', 'HA'], current stack 950
player [YueShi] gets hole card ['C7', 'D9'], current stack 945
player [Finneas] gets hole card ['D5', 'H8'], current stack 1024
player [Zheng] gets hole card ['ST', 'C2'], current stack 1904
player [RaphaelPlayer] gets hole card ['D8', 'CQ'], current stack 1190
Started the round 26
Street "preflop" started. (community card = [])
"ZifengFoldMan" declared "fold:0"
"YueShi" declared "fold:0"
"Finneas" declared "call:10"
"Zheng" declared "call:10"
"RaphaelPlayer" declared "call:10"
"EvanPlayer" declared "raise:1980"
"Finneas" declared "fold:0"
"Zheng" declared "fold:0"
"RaphaelPlayer" declared "fold:0"
"['EvanPlayer']" won the round 26 (stack = {'EvanPlayer': 2010, 'ZifengFoldMan': 950, 'JoyoPlayer': 0, 'YueShi': 945, 'Finneas': 1014, 'Yuchun': 0, 'Zheng': 1894, 'RaphaelPlayer': 1185})
player [EvanPlayer] gets hole card ['CQ', 'C9'], current stack 2005
player [ZifengFoldMan] gets hole card ['S5', 'HQ'], current stack 940
player [YueShi] gets hole card ['C4', 'HJ'], current stack 945
player [Finneas] gets hole card ['SA', 'S2'], current stack 1014
player [Zheng] gets hole card ['DT', 'C2'], current stack 1894
player [RaphaelPlayer] gets hole card ['HA', 'D4'], current stack 1185
Started the round 27
Street "preflop" started. (community card = [])
"YueShi" declared "fold:0"
"Finneas" declared "call:10"
"Zheng" declared "call:10"
"RaphaelPlayer" declared "call:10"
"EvanPlayer" declared "call:10"
"ZifengFoldMan" declared "fold:0"
Street "flop" started. (community card = ['CK', 'CT', 'D8'])
"EvanPlayer" declared "raise:2000"
"Finneas" declared "fold:0"
"Zheng" declared "fold:0"
"RaphaelPlayer" declared "fold:0"
"['EvanPlayer']" won the round 27 (stack = {'EvanPlayer': 2050, 'ZifengFoldMan': 940, 'JoyoPlayer': 0, 'YueShi': 945, 'Finneas': 1004, 'Yuchun': 0, 'Zheng': 1884, 'RaphaelPlayer': 1175})
player [EvanPlayer] gets hole card ['HJ', 'D9'], current stack 2050
player [ZifengFoldMan] gets hole card ['C8', 'S7'], current stack 935
player [YueShi] gets hole card ['HK', 'ST'], current stack 935
player [Finneas] gets hole card ['HT', 'DJ'], current stack 1004
player [Zheng] gets hole card ['DQ', 'D2'], current stack 1884
player [RaphaelPlayer] gets hole card ['S4', 'CA'], current stack 1175
Started the round 28
Street "preflop" started. (community card = [])
"Finneas" declared "call:10"
"Zheng" declared "call:10"
"RaphaelPlayer" declared "call:10"
"EvanPlayer" declared "raise:2050"
"ZifengFoldMan" declared "fold:0"
"YueShi" declared "fold:0"
"Finneas" declared "fold:0"
"Zheng" declared "fold:0"
"RaphaelPlayer" declared "fold:0"
"['EvanPlayer']" won the round 28 (stack = {'EvanPlayer': 2095, 'ZifengFoldMan': 935, 'JoyoPlayer': 0, 'YueShi': 935, 'Finneas': 994, 'Yuchun': 0, 'Zheng': 1874, 'RaphaelPlayer': 1165})
player [EvanPlayer] gets hole card ['C7', 'DJ'], current stack 2095
player [ZifengFoldMan] gets hole card ['HK', 'CK'], current stack 935
player [YueShi] gets hole card ['HA', 'S6'], current stack 930
player [Finneas] gets hole card ['D9', 'CQ'], current stack 984
player [Zheng] gets hole card ['D3', 'D2'], current stack 1874
player [RaphaelPlayer] gets hole card ['D8', 'CT'], current stack 1165
Started the round 29
Street "preflop" started. (community card = [])
"Zheng" declared "call:10"
"RaphaelPlayer" declared "call:10"
"EvanPlayer" declared "call:10"
"ZifengFoldMan" declared "fold:0"
"YueShi" declared "fold:0"
"Finneas" declared "call:10"
Street "flop" started. (community card = ['D4', 'ST', 'S4'])
"Finneas" declared "call:0"
"Zheng" declared "call:0"
"RaphaelPlayer" declared "call:0"
"EvanPlayer" declared "fold:0"
Street "turn" started. (community card = ['D4', 'ST', 'S4', 'H7'])
"Finneas" declared "call:0"
"Zheng" declared "call:0"
"RaphaelPlayer" declared "raise:55"
"Finneas" declared "fold:0"
"Zheng" declared "call:55"
Street "river" started. (community card = ['D4', 'ST', 'S4', 'H7', 'S5'])
"Zheng" declared "call:0"
"RaphaelPlayer" declared "raise:165"
"Zheng" declared "fold:0"
"['RaphaelPlayer']" won the round 29 (stack = {'EvanPlayer': 2085, 'ZifengFoldMan': 935, 'JoyoPlayer': 0, 'YueShi': 930, 'Finneas': 984, 'Yuchun': 0, 'Zheng': 1809, 'RaphaelPlayer': 1255})
player [EvanPlayer] gets hole card ['D3', 'C4'], current stack 2085
player [ZifengFoldMan] gets hole card ['H5', 'HA'], current stack 935
player [YueShi] gets hole card ['HK', 'HQ'], current stack 930
player [Finneas] gets hole card ['CK', 'H7'], current stack 979
player [Zheng] gets hole card ['ST', 'CA'], current stack 1799
player [RaphaelPlayer] gets hole card ['S6', 'HT'], current stack 1255
Started the round 30
Street "preflop" started. (community card = [])
"RaphaelPlayer" declared "fold:0"
"EvanPlayer" declared "fold:10"
"ZifengFoldMan" declared "fold:0"
"YueShi" declared "fold:0"
"Finneas" declared "call:10"
"Zheng" declared "call:10"
Street "flop" started. (community card = ['S5', 'C7', 'SQ'])
"Finneas" declared "call:0"
"Zheng" declared "call:0"
Street "turn" started. (community card = ['S5', 'C7', 'SQ', 'S9'])
"Finneas" declared "call:0"
"Zheng" declared "call:0"
Street "river" started. (community card = ['S5', 'C7', 'SQ', 'S9', 'C5'])
"Finneas" declared "call:0"
"Zheng" declared "call:0"
"['Finneas']" won the round 30 (stack = {'EvanPlayer': 2085, 'ZifengFoldMan': 935, 'JoyoPlayer': 0, 'YueShi': 930, 'Finneas': 994, 'Yuchun': 0, 'Zheng': 1799, 'RaphaelPlayer': 1255})
player [EvanPlayer] gets hole card ['C3', 'C8'], current stack 2085
player [ZifengFoldMan] gets hole card ['HJ', 'CA'], current stack 935
player [YueShi] gets hole card ['S9', 'C4'], current stack 930
player [Finneas] gets hole card ['SA', 'H9'], current stack 994
player [Zheng] gets hole card ['DJ', 'CJ'], current stack 1794
player [RaphaelPlayer] gets hole card ['D5', 'HQ'], current stack 1245
Started the round 31
Street "preflop" started. (community card = [])
"EvanPlayer" declared "call:10"
"ZifengFoldMan" declared "fold:0"
"YueShi" declared "fold:0"
"Finneas" declared "call:10"
"Zheng" declared "call:10"
"RaphaelPlayer" declared "fold:0"
Street "flop" started. (community card = ['D9', 'DQ', 'C5'])
"Zheng" declared "call:0"
"EvanPlayer" declared "raise:2075"
"Finneas" declared "fold:0"
"Zheng" declared "fold:0"
"['EvanPlayer']" won the round 31 (stack = {'EvanPlayer': 2115, 'ZifengFoldMan': 935, 'JoyoPlayer': 0, 'YueShi': 930, 'Finneas': 984, 'Yuchun': 0, 'Zheng': 1789, 'RaphaelPlayer': 1245})
player [EvanPlayer] gets hole card ['S5', 'CT'], current stack 2105
player [ZifengFoldMan] gets hole card ['C9', 'D7'], current stack 935
player [YueShi] gets hole card ['S3', 'HK'], current stack 930
player [Finneas] gets hole card ['C8', 'SK'], current stack 984
player [Zheng] gets hole card ['DK', 'C7'], current stack 1789
player [RaphaelPlayer] gets hole card ['CJ', 'HA'], current stack 1240
Started the round 32
Street "preflop" started. (community card = [])
"ZifengFoldMan" declared "fold:0"
"YueShi" declared "fold:0"
"Finneas" declared "call:10"
"Zheng" declared "call:10"
"RaphaelPlayer" declared "raise:30"
"EvanPlayer" declared "fold:30"
"Finneas" declared "fold:0"
"Zheng" declared "call:30"
Street "flop" started. (community card = ['D4', 'S6', 'HT'])
"RaphaelPlayer" declared "call:0"
"Zheng" declared "call:0"
Street "turn" started. (community card = ['D4', 'S6', 'HT', 'S8'])
"RaphaelPlayer" declared "call:0"
"Zheng" declared "call:0"
Street "river" started. (community card = ['D4', 'S6', 'HT', 'S8', 'HJ'])
"RaphaelPlayer" declared "raise:90"
"Zheng" declared "call:90"
"['RaphaelPlayer']" won the round 32 (stack = {'EvanPlayer': 2105, 'ZifengFoldMan': 935, 'JoyoPlayer': 0, 'YueShi': 930, 'Finneas': 974, 'Yuchun': 0, 'Zheng': 1669, 'RaphaelPlayer': 1385})
player [EvanPlayer] gets hole card ['D4', 'ST'], current stack 2100
player [ZifengFoldMan] gets hole card ['S9', 'H9'], current stack 925
player [YueShi] gets hole card ['D5', 'DQ'], current stack 930
player [Finneas] gets hole card ['S8', 'S4'], current stack 974
player [Zheng] gets hole card ['CJ', 'H2'], current stack 1669
player [RaphaelPlayer] gets hole card ['HJ', 'D7'], current stack 1385
Started the round 33
Street "preflop" started. (community card = [])
"YueShi" declared "fold:0"
"Finneas" declared "call:10"
"Zheng" declared "call:10"
"RaphaelPlayer" declared "fold:0"
"EvanPlayer" declared "fold:10"
"ZifengFoldMan" declared "fold:0"
Street "flop" started. (community card = ['H4', 'DA', 'C2'])
"Finneas" declared "call:0"
"Zheng" declared "call:0"
Street "turn" started. (community card = ['H4', 'DA', 'C2', 'CT'])
"Finneas" declared "call:0"
"Zheng" declared "call:0"
Street "river" started. (community card = ['H4', 'DA', 'C2', 'CT', 'HT'])
"Finneas" declared "call:0"
"Zheng" declared "call:0"
"['Finneas']" won the round 33 (stack = {'EvanPlayer': 2100, 'ZifengFoldMan': 925, 'JoyoPlayer': 0, 'YueShi': 930, 'Finneas': 999, 'Yuchun': 0, 'Zheng': 1659, 'RaphaelPlayer': 1385})
player [EvanPlayer] gets hole card ['H7', 'S8'], current stack 2100
player [ZifengFoldMan] gets hole card ['CQ', 'DJ'], current stack 920
player [YueShi] gets hole card ['CK', 'H6'], current stack 920
player [Finneas] gets hole card ['S7', 'H2'], current stack 999
player [Zheng] gets hole card ['D4', 'CT'], current stack 1659
player [RaphaelPlayer] gets hole card ['C6', 'D6'], current stack 1385
Started the round 34
Street "preflop" started. (community card = [])
"Finneas" declared "call:10"
"Zheng" declared "call:10"
"RaphaelPlayer" declared "raise:30"
"EvanPlayer" declared "raise:2100"
"ZifengFoldMan" declared "fold:0"
"YueShi" declared "fold:0"
"Finneas" declared "fold:0"
"Zheng" declared "fold:0"
"RaphaelPlayer" declared "fold:0"
"['EvanPlayer']" won the round 34 (stack = {'EvanPlayer': 2165, 'ZifengFoldMan': 920, 'JoyoPlayer': 0, 'YueShi': 920, 'Finneas': 989, 'Yuchun': 0, 'Zheng': 1649, 'RaphaelPlayer': 1355})
player [EvanPlayer] gets hole card ['HT', 'H8'], current stack 2165
player [ZifengFoldMan] gets hole card ['C8', 'CT'], current stack 920
player [YueShi] gets hole card ['C6', 'S2'], current stack 915
player [Finneas] gets hole card ['S4', 'H7'], current stack 979
player [Zheng] gets hole card ['C9', 'HK'], current stack 1649
player [RaphaelPlayer] gets hole card ['S3', 'S9'], current stack 1355
Started the round 35
Street "preflop" started. (community card = [])
"Zheng" declared "call:10"
"RaphaelPlayer" declared "fold:0"
"EvanPlayer" declared "raise:2165"
"ZifengFoldMan" declared "fold:0"
"YueShi" declared "fold:0"
"Finneas" declared "fold:0"
"Zheng" declared "fold:0"
"['EvanPlayer']" won the round 35 (stack = {'EvanPlayer': 2190, 'ZifengFoldMan': 920, 'JoyoPlayer': 0, 'YueShi': 915, 'Finneas': 979, 'Yuchun': 0, 'Zheng': 1639, 'RaphaelPlayer': 1355})
player [EvanPlayer] gets hole card ['SJ', 'H7'], current stack 2190
player [ZifengFoldMan] gets hole card ['C8', 'SK'], current stack 920
player [YueShi] gets hole card ['D3', 'H8'], current stack 915
player [Finneas] gets hole card ['C3', 'S5'], current stack 974
player [Zheng] gets hole card ['S4', 'HT'], current stack 1629
player [RaphaelPlayer] gets hole card ['H3', 'DJ'], current stack 1355
Started the round 36
Street "preflop" started. (community card = [])
"RaphaelPlayer" declared "fold:0"
"EvanPlayer" declared "fold:10"
"ZifengFoldMan" declared "fold:0"
"YueShi" declared "fold:0"
"Finneas" declared "call:10"
"Zheng" declared "call:10"
Street "flop" started. (community card = ['D8', 'CQ', 'HJ'])
"Finneas" declared "call:0"
"Zheng" declared "call:0"
Street "turn" started. (community card = ['D8', 'CQ', 'HJ', 'CA'])
"Finneas" declared "call:0"
"Zheng" declared "call:0"
Street "river" started. (community card = ['D8', 'CQ', 'HJ', 'CA', 'H6'])
"Finneas" declared "call:0"
"Zheng" declared "call:0"
"['Zheng']" won the round 36 (stack = {'EvanPlayer': 2190, 'ZifengFoldMan': 920, 'JoyoPlayer': 0, 'YueShi': 915, 'Finneas': 969, 'Yuchun': 0, 'Zheng': 1649, 'RaphaelPlayer': 1355})
player [EvanPlayer] gets hole card ['H2', 'S2'], current stack 2190
player [ZifengFoldMan] gets hole card ['SQ', 'S5'], current stack 920
player [YueShi] gets hole card ['CA', 'C3'], current stack 915
player [Finneas] gets hole card ['D9', 'C2'], current stack 969
player [Zheng] gets hole card ['C5', 'DQ'], current stack 1644
player [RaphaelPlayer] gets hole card ['H9', 'H5'], current stack 1345
Started the round 37
Street "preflop" started. (community card = [])
"EvanPlayer" declared "call:10"
"ZifengFoldMan" declared "fold:0"
"YueShi" declared "fold:0"
"Finneas" declared "call:10"
"Zheng" declared "call:10"
"RaphaelPlayer" declared "fold:0"
Street "flop" started. (community card = ['S7', 'CK', 'SA'])
"Zheng" declared "call:0"
"EvanPlayer" declared "fold:0"
"Finneas" declared "call:0"
Street "turn" started. (community card = ['S7', 'CK', 'SA', 'C7'])
"Zheng" declared "call:0"
"Finneas" declared "call:0"
Street "river" started. (community card = ['S7', 'CK', 'SA', 'C7', 'H3'])
"Zheng" declared "call:0"
"Finneas" declared "call:0"
"['Zheng']" won the round 37 (stack = {'EvanPlayer': 2180, 'ZifengFoldMan': 920, 'JoyoPlayer': 0, 'YueShi': 915, 'Finneas': 959, 'Yuchun': 0, 'Zheng': 1679, 'RaphaelPlayer': 1345})
player [EvanPlayer] gets hole card ['SJ', 'HA'], current stack 2170
player [ZifengFoldMan] gets hole card ['H6', 'C3'], current stack 920
player [YueShi] gets hole card ['H8', 'H2'], current stack 915
player [Finneas] gets hole card ['CK', 'D9'], current stack 959
player [Zheng] gets hole card ['D8', 'D3'], current stack 1679
player [RaphaelPlayer] gets hole card ['ST', 'D2'], current stack 1340
Started the round 38
Street "preflop" started. (community card = [])
"ZifengFoldMan" declared "fold:0"
"YueShi" declared "fold:0"
"Finneas" declared "call:10"
"Zheng" declared "call:10"
"RaphaelPlayer" declared "fold:0"
"EvanPlayer" declared "fold:10"
Street "flop" started. (community card = ['C4', 'SA', 'SK'])
"Finneas" declared "call:0"
"Zheng" declared "call:0"
Street "turn" started. (community card = ['C4', 'SA', 'SK', 'CT'])
"Finneas" declared "call:0"
"Zheng" declared "call:0"
Street "river" started. (community card = ['C4', 'SA', 'SK', 'CT', 'S7'])
"Finneas" declared "call:0"
"Zheng" declared "call:0"
"['Finneas']" won the round 38 (stack = {'EvanPlayer': 2170, 'ZifengFoldMan': 920, 'JoyoPlayer': 0, 'YueShi': 915, 'Finneas': 984, 'Yuchun': 0, 'Zheng': 1669, 'RaphaelPlayer': 1340})
player [EvanPlayer] gets hole card ['SQ', 'DA'], current stack 2165
player [ZifengFoldMan] gets hole card ['HK', 'S7'], current stack 910
player [YueShi] gets hole card ['C9', 'H7'], current stack 915
player [Finneas] gets hole card ['H6', 'D9'], current stack 984
player [Zheng] gets hole card ['H2', 'S2'], current stack 1669
player [RaphaelPlayer] gets hole card ['D2', 'H9'], current stack 1340
Started the round 39
Street "preflop" started. (community card = [])
"YueShi" declared "fold:0"
"Finneas" declared "call:10"
"Zheng" declared "call:10"
"RaphaelPlayer" declared "fold:0"
"EvanPlayer" declared "call:10"
"ZifengFoldMan" declared "fold:0"
Street "flop" started. (community card = ['CT', 'CA', 'HQ'])
"EvanPlayer" declared "raise:2160"
"Finneas" declared "fold:0"
"Zheng" declared "fold:0"
"['EvanPlayer']" won the round 39 (stack = {'EvanPlayer': 2200, 'ZifengFoldMan': 910, 'JoyoPlayer': 0, 'YueShi': 915, 'Finneas': 974, 'Yuchun': 0, 'Zheng': 1659, 'RaphaelPlayer': 1340})
player [EvanPlayer] gets hole card ['C5', 'DJ'], current stack 2200
player [ZifengFoldMan] gets hole card ['C2', 'SK'], current stack 905
player [YueShi] gets hole card ['CK', 'D4'], current stack 905
player [Finneas] gets hole card ['DK', 'DQ'], current stack 974
player [Zheng] gets hole card ['C9', 'CJ'], current stack 1659
player [RaphaelPlayer] gets hole card ['H3', 'S8'], current stack 1340
Started the round 40
Street "preflop" started. (community card = [])
"Finneas" declared "call:10"
"Zheng" declared "call:10"
"RaphaelPlayer" declared "fold:0"
"EvanPlayer" declared "call:10"
"ZifengFoldMan" declared "fold:0"
"YueShi" declared "fold:0"
Street "flop" started. (community card = ['S3', 'H6', 'HJ'])
"Finneas" declared "call:0"
"Zheng" declared "call:0"
"EvanPlayer" declared "call:0"
Street "turn" started. (community card = ['S3', 'H6', 'HJ', 'H4'])
"Finneas" declared "call:0"
"Zheng" declared "call:0"
"EvanPlayer" declared "call:0"
Street "river" started. (community card = ['S3', 'H6', 'HJ', 'H4', 'SJ'])
"Finneas" declared "call:0"
"Zheng" declared "call:0"
"EvanPlayer" declared "call:0"
"['Zheng']" won the round 40 (stack = {'EvanPlayer': 2190, 'ZifengFoldMan': 905, 'JoyoPlayer': 0, 'YueShi': 905, 'Finneas': 964, 'Yuchun': 0, 'Zheng': 1694, 'RaphaelPlayer': 1340})
player [EvanPlayer] gets hole card ['C2', 'C7'], current stack 2190
player [ZifengFoldMan] gets hole card ['HA', 'C5'], current stack 905
player [YueShi] gets hole card ['HT', 'SK'], current stack 900
player [Finneas] gets hole card ['DJ', 'CJ'], current stack 954
player [Zheng] gets hole card ['S3', 'D8'], current stack 1694
player [RaphaelPlayer] gets hole card ['DA', 'HJ'], current stack 1340
Started the round 41
Street "preflop" started. (community card = [])
"Zheng" declared "call:10"
"RaphaelPlayer" declared "raise:30"
"EvanPlayer" declared "fold:30"
"ZifengFoldMan" declared "fold:0"
"YueShi" declared "fold:0"
"Finneas" declared "fold:0"
"Zheng" declared "call:30"
Street "flop" started. (community card = ['DK', 'D6', 'CK'])
"Zheng" declared "call:0"
"RaphaelPlayer" declared "raise:85"
"Zheng" declared "call:85"
Street "turn" started. (community card = ['DK', 'D6', 'CK', 'CQ'])
"Zheng" declared "call:0"
"RaphaelPlayer" declared "raise:255"
"Zheng" declared "fold:0"
"['RaphaelPlayer']" won the round 41 (stack = {'EvanPlayer': 2190, 'ZifengFoldMan': 905, 'JoyoPlayer': 0, 'YueShi': 900, 'Finneas': 954, 'Yuchun': 0, 'Zheng': 1579, 'RaphaelPlayer': 1470})
player [EvanPlayer] gets hole card ['SQ', 'CT'], current stack 2190
player [ZifengFoldMan] gets hole card ['C7', 'HJ'], current stack 905
player [YueShi] gets hole card ['S9', 'D6'], current stack 900
player [Finneas] gets hole card ['CA', 'S6'], current stack 949
player [Zheng] gets hole card ['DK', 'DQ'], current stack 1569
player [RaphaelPlayer] gets hole card ['H3', 'HQ'], current stack 1470
Started the round 42
Street "preflop" started. (community card = [])
"RaphaelPlayer" declared "call:10"
"EvanPlayer" declared "raise:2190"
"ZifengFoldMan" declared "fold:0"
"YueShi" declared "fold:0"
"Finneas" declared "fold:0"
"Zheng" declared "fold:0"
"RaphaelPlayer" declared "fold:0"
"['EvanPlayer']" won the round 42 (stack = {'EvanPlayer': 2215, 'ZifengFoldMan': 905, 'JoyoPlayer': 0, 'YueShi': 900, 'Finneas': 949, 'Yuchun': 0, 'Zheng': 1569, 'RaphaelPlayer': 1460})
player [EvanPlayer] gets hole card ['C9', 'H2'], current stack 2215
player [ZifengFoldMan] gets hole card ['D3', 'D5'], current stack 905
player [YueShi] gets hole card ['CT', 'H6'], current stack 900
player [Finneas] gets hole card ['C5', 'H5'], current stack 949
player [Zheng] gets hole card ['C8', 'CK'], current stack 1564
player [RaphaelPlayer] gets hole card ['DA', 'H8'], current stack 1450
Started the round 43
Street "preflop" started. (community card = [])
"EvanPlayer" declared "raise:2215"
"ZifengFoldMan" declared "fold:0"
"YueShi" declared "fold:0"
"Finneas" declared "fold:0"
"Zheng" declared "fold:0"
"RaphaelPlayer" declared "fold:0"
"['EvanPlayer']" won the round 43 (stack = {'EvanPlayer': 2230, 'ZifengFoldMan': 905, 'JoyoPlayer': 0, 'YueShi': 900, 'Finneas': 949, 'Yuchun': 0, 'Zheng': 1564, 'RaphaelPlayer': 1450})
player [EvanPlayer] gets hole card ['D3', 'SQ'], current stack 2220
player [ZifengFoldMan] gets hole card ['CK', 'DT'], current stack 905
player [YueShi] gets hole card ['H5', 'S9'], current stack 900
player [Finneas] gets hole card ['SK', 'H3'], current stack 949
player [Zheng] gets hole card ['S3', 'HT'], current stack 1564
player [RaphaelPlayer] gets hole card ['CA', 'SJ'], current stack 1445
Started the round 44
Street "preflop" started. (community card = [])
"ZifengFoldMan" declared "fold:0"
"YueShi" declared "fold:0"
"Finneas" declared "call:10"
"Zheng" declared "call:10"
"RaphaelPlayer" declared "raise:30"
"EvanPlayer" declared "fold:30"
"Finneas" declared "fold:0"
"Zheng" declared "call:30"
Street "flop" started. (community card = ['H2', 'S5', 'S4'])
"RaphaelPlayer" declared "raise:90"
"Zheng" declared "call:90"
Street "turn" started. (community card = ['H2', 'S5', 'S4', 'C4'])
"RaphaelPlayer" declared "raise:270"
"Zheng" declared "fold:0"
"['RaphaelPlayer']" won the round 44 (stack = {'EvanPlayer': 2220, 'ZifengFoldMan': 905, 'JoyoPlayer': 0, 'YueShi': 900, 'Finneas': 939, 'Yuchun': 0, 'Zheng': 1444, 'RaphaelPlayer': 1590})
player [EvanPlayer] gets hole card ['D8', 'CT'], current stack 2215
player [ZifengFoldMan] gets hole card ['H3', 'HA'], current stack 895
player [YueShi] gets hole card ['CJ', 'H7'], current stack 900
player [Finneas] gets hole card ['H5', 'D4'], current stack 939
player [Zheng] gets hole card ['S3', 'D7'], current stack 1444
player [RaphaelPlayer] gets hole card ['SK', 'H2'], current stack 1590
Started the round 45
Street "preflop" started. (community card = [])
"YueShi" declared "fold:0"
"Finneas" declared "call:10"
"Zheng" declared "call:10"
"RaphaelPlayer" declared "fold:0"
"EvanPlayer" declared "call:10"
"ZifengFoldMan" declared "fold:0"
Street "flop" started. (community card = ['C7', 'CA', 'C9'])
"EvanPlayer" declared "raise:2210"
"Finneas" declared "fold:0"
"Zheng" declared "fold:0"
"['EvanPlayer']" won the round 45 (stack = {'EvanPlayer': 2250, 'ZifengFoldMan': 895, 'JoyoPlayer': 0, 'YueShi': 900, 'Finneas': 929, 'Yuchun': 0, 'Zheng': 1434, 'RaphaelPlayer': 1590})
player [EvanPlayer] gets hole card ['CK', 'H8'], current stack 2250
player [ZifengFoldMan] gets hole card ['C2', 'HK'], current stack 890
player [YueShi] gets hole card ['HJ', 'HQ'], current stack 890
player [Finneas] gets hole card ['D9', 'DQ'], current stack 929
player [Zheng] gets hole card ['CJ', 'S9'], current stack 1434
player [RaphaelPlayer] gets hole card ['C4', 'CQ'], current stack 1590
Started the round 46
Street "preflop" started. (community card = [])
"Finneas" declared "call:10"
"Zheng" declared "call:10"
"RaphaelPlayer" declared "call:10"
"EvanPlayer" declared "call:10"
"ZifengFoldMan" declared "fold:0"
"YueShi" declared "fold:0"
Street "flop" started. (community card = ['SJ', 'D5', 'S2'])
"Finneas" declared "call:0"
"Zheng" declared "call:0"
"RaphaelPlayer" declared "call:0"
"EvanPlayer" declared "fold:0"
Street "turn" started. (community card = ['SJ', 'D5', 'S2', 'S4'])
"Finneas" declared "call:0"
"Zheng" declared "call:0"
"RaphaelPlayer" declared "call:0"
Street "river" started. (community card = ['SJ', 'D5', 'S2', 'S4', 'S8'])
"Finneas" declared "call:0"
"Zheng" declared "call:0"
"RaphaelPlayer" declared "call:0"
"['Zheng']" won the round 46 (stack = {'EvanPlayer': 2240, 'ZifengFoldMan': 890, 'JoyoPlayer': 0, 'YueShi': 890, 'Finneas': 919, 'Yuchun': 0, 'Zheng': 1479, 'RaphaelPlayer': 1580})
player [EvanPlayer] gets hole card ['HK', 'C2'], current stack 2240
player [ZifengFoldMan] gets hole card ['C5', 'ST'], current stack 890
player [YueShi] gets hole card ['D7', 'S3'], current stack 885
player [Finneas] gets hole card ['HQ', 'CQ'], current stack 909
player [Zheng] gets hole card ['C4', 'CJ'], current stack 1479
player [RaphaelPlayer] gets hole card ['SK', 'H3'], current stack 1580
Started the round 47
Street "preflop" started. (community card = [])
"Zheng" declared "call:10"
"RaphaelPlayer" declared "fold:0"
"EvanPlayer" declared "fold:10"
"ZifengFoldMan" declared "fold:0"
"YueShi" declared "fold:0"
"Finneas" declared "raise:467"
"Zheng" declared "fold:0"
"['Finneas']" won the round 47 (stack = {'EvanPlayer': 2240, 'ZifengFoldMan': 890, 'JoyoPlayer': 0, 'YueShi': 885, 'Finneas': 934, 'Yuchun': 0, 'Zheng': 1469, 'RaphaelPlayer': 1580})
player [EvanPlayer] gets hole card ['CQ', 'HA'], current stack 2240
player [ZifengFoldMan] gets hole card ['ST', 'C9'], current stack 890
player [YueShi] gets hole card ['DQ', 'C7'], current stack 885
player [Finneas] gets hole card ['H3', 'C3'], current stack 929
player [Zheng] gets hole card ['D2', 'HT'], current stack 1459
player [RaphaelPlayer] gets hole card ['CJ', 'DT'], current stack 1580
Started the round 48
Street "preflop" started. (community card = [])
"RaphaelPlayer" declared "call:10"
"EvanPlayer" declared "raise:2240"
"ZifengFoldMan" declared "fold:0"
"YueShi" declared "fold:0"
"Finneas" declared "fold:0"
"Zheng" declared "fold:0"
"RaphaelPlayer" declared "fold:0"
"['EvanPlayer']" won the round 48 (stack = {'EvanPlayer': 2265, 'ZifengFoldMan': 890, 'JoyoPlayer': 0, 'YueShi': 885, 'Finneas': 929, 'Yuchun': 0, 'Zheng': 1459, 'RaphaelPlayer': 1570})
player [EvanPlayer] gets hole card ['HA', 'D2'], current stack 2265
player [ZifengFoldMan] gets hole card ['HT', 'C9'], current stack 890
player [YueShi] gets hole card ['C3', 'D3'], current stack 885
player [Finneas] gets hole card ['SQ', 'SJ'], current stack 929
player [Zheng] gets hole card ['DA', 'C5'], current stack 1454
player [RaphaelPlayer] gets hole card ['H4', 'H7'], current stack 1560
Started the round 49
Street "preflop" started. (community card = [])
"EvanPlayer" declared "call:10"
"ZifengFoldMan" declared "fold:0"
"YueShi" declared "fold:0"
"Finneas" declared "call:10"
"Zheng" declared "call:10"
"RaphaelPlayer" declared "fold:0"
Street "flop" started. (community card = ['H9', 'HJ', 'H2'])
"Zheng" declared "call:0"
"EvanPlayer" declared "call:0"
"Finneas" declared "call:0"
Street "turn" started. (community card = ['H9', 'HJ', 'H2', 'CQ'])
"Zheng" declared "call:0"
"EvanPlayer" declared "call:0"
"Finneas" declared "call:0"
Street "river" started. (community card = ['H9', 'HJ', 'H2', 'CQ', 'S7'])
"Zheng" declared "call:0"
"EvanPlayer" declared "raise:2255"
"Finneas" declared "fold:0"
"Zheng" declared "fold:0"
"['EvanPlayer']" won the round 49 (stack = {'EvanPlayer': 2295, 'ZifengFoldMan': 890, 'JoyoPlayer': 0, 'YueShi': 885, 'Finneas': 919, 'Yuchun': 0, 'Zheng': 1449, 'RaphaelPlayer': 1560})
player [EvanPlayer] gets hole card ['C2', 'H3'], current stack 2285
player [ZifengFoldMan] gets hole card ['S5', 'HQ'], current stack 890
player [YueShi] gets hole card ['H8', 'S7'], current stack 885
player [Finneas] gets hole card ['D8', 'HT'], current stack 919
player [Zheng] gets hole card ['C7', 'D4'], current stack 1449
player [RaphaelPlayer] gets hole card ['HA', 'H7'], current stack 1555
Started the round 50
Street "preflop" started. (community card = [])
"ZifengFoldMan" declared "fold:0"
"YueShi" declared "fold:0"
"Finneas" declared "call:10"
"Zheng" declared "call:10"
"RaphaelPlayer" declared "call:10"
"EvanPlayer" declared "fold:10"
Street "flop" started. (community card = ['SQ', 'H4', 'CK'])
"RaphaelPlayer" declared "call:0"
"Finneas" declared "call:0"
"Zheng" declared "call:0"
Street "turn" started. (community card = ['SQ', 'H4', 'CK', 'S2'])
"RaphaelPlayer" declared "call:0"
"Finneas" declared "call:0"
"Zheng" declared "call:0"
Street "river" started. (community card = ['SQ', 'H4', 'CK', 'S2', 'H5'])
"RaphaelPlayer" declared "call:0"
"Finneas" declared "call:0"
"Zheng" declared "call:0"
"['Zheng']" won the round 50 (stack = {'EvanPlayer': 2285, 'ZifengFoldMan': 890, 'JoyoPlayer': 0, 'YueShi': 885, 'Finneas': 909, 'Yuchun': 0, 'Zheng': 1479, 'RaphaelPlayer': 1550})

Game Results:
------------------------------------------------------------
Game 1:
Winner: EvanPlayer (stack: 2285)
All players' stacks:
  EvanPlayer: 2285
  ZifengFoldMan: 890
  JoyoPlayer: 0
  YueShi: 885
  Finneas: 909
  Yuchun: 0
  Zheng: 1479
  RaphaelPlayer: 1550
------------------------------------------------------------
