player [Zheng] gets hole card ['S9', 'D7'], current stack 1000
player [RaphaelPlayer] gets hole card ['C5', 'D9'], current stack 995
player [SichengZuo] gets hole card ['C7', 'C3'], current stack 990
player [Yuchun] gets hole card ['S3', 'CJ'], current stack 1000
player [HakulaPlayer] gets hole card ['HT', 'D6'], current stack 1000
player [Ethan] gets hole card ['HA', 'HK'], current stack 1000
player [YangZ] gets hole card ['DT', 'S6'], current stack 1000
player [Finneas] gets hole card ['H5', 'D2'], current stack 1000
Started the round 1
Street "preflop" started. (community card = [])
"Yuchun" declared "fold:0"
"HakulaPlayer" declared "fold:0"
"Ethan" declared "raise:300"
"YangZ" declared "fold:0"
"Finneas" declared "fold:0"
"Zheng" declared "fold:0"
"RaphaelPlayer" declared "fold:0"
"SichengZuo" declared "fold:0"
"['Ethan']" won the round 1 (stack = {'Zheng': 1000, 'RaphaelPlayer': 995, 'SichengZuo': 990, 'Yuchun': 1000, 'HakulaPlayer': 1000, 'Ethan': 1015, 'YangZ': 1000, 'Finneas': 1000})
player [Zheng] gets hole card ['C7', 'H2'], current stack 1000
player [RaphaelPlayer] gets hole card ['C4', 'SK'], current stack 995
player [SichengZuo] gets hole card ['DA', 'CT'], current stack 985
player [Yuchun] gets hole card ['HT', 'S7'], current stack 990
player [HakulaPlayer] gets hole card ['HQ', 'C2'], current stack 1000
player [Ethan] gets hole card ['S2', 'S6'], current stack 1015
player [YangZ] gets hole card ['SA', 'S8'], current stack 1000
player [Finneas] gets hole card ['C8', 'HJ'], current stack 1000
Started the round 2
Street "preflop" started. (community card = [])
"HakulaPlayer" declared "fold:0"
"Ethan" declared "fold:0"
"YangZ" declared "fold:0"
"Finneas" declared "call:10"
"Zheng" declared "call:10"
"RaphaelPlayer" declared "fold:0"
"SichengZuo" declared "fold:0"
"Yuchun" declared "fold:0"
Street "flop" started. (community card = ['S3', 'C5', 'C9'])
"Finneas" declared "call:0"
"Zheng" declared "call:0"
Street "turn" started. (community card = ['S3', 'C5', 'C9', 'CJ'])
"Finneas" declared "call:0"
"Zheng" declared "call:0"
Street "river" started. (community card = ['S3', 'C5', 'C9', 'CJ', 'HA'])
"Finneas" declared "call:0"
"Zheng" declared "call:0"
"['Finneas']" won the round 2 (stack = {'Zheng': 990, 'RaphaelPlayer': 995, 'SichengZuo': 985, 'Yuchun': 990, 'HakulaPlayer': 1000, 'Ethan': 1015, 'YangZ': 1000, 'Finneas': 1025})
player [Zheng] gets hole card ['D3', 'C4'], current stack 990
player [RaphaelPlayer] gets hole card ['DQ', 'DK'], current stack 995
player [SichengZuo] gets hole card ['S4', 'CA'], current stack 985
player [Yuchun] gets hole card ['D2', 'S3'], current stack 985
player [HakulaPlayer] gets hole card ['C6', 'D6'], current stack 990
player [Ethan] gets hole card ['DT', 'CJ'], current stack 1015
player [YangZ] gets hole card ['D7', 'C9'], current stack 1000
player [Finneas] gets hole card ['CK', 'S9'], current stack 1025
Started the round 3
Street "preflop" started. (community card = [])
"Ethan" declared "call:10"
"YangZ" declared "fold:0"
"Finneas" declared "call:10"
"Zheng" declared "call:10"
"RaphaelPlayer" declared "raise:30"
"SichengZuo" declared "fold:0"
"Yuchun" declared "fold:0"
"HakulaPlayer" declared "call:30"
"Ethan" declared "call:30"
"Finneas" declared "fold:0"
"Zheng" declared "fold:0"
Street "flop" started. (community card = ['DJ', 'H8', 'ST'])
"HakulaPlayer" declared "call:0"
"Ethan" declared "call:0"
"RaphaelPlayer" declared "call:0"
Street "turn" started. (community card = ['DJ', 'H8', 'ST', 'H3'])
"HakulaPlayer" declared "call:0"
"Ethan" declared "call:0"
"RaphaelPlayer" declared "call:0"
Street "river" started. (community card = ['DJ', 'H8', 'ST', 'H3', 'HJ'])
"HakulaPlayer" declared "call:0"
"Ethan" declared "call:0"
"RaphaelPlayer" declared "call:0"
"['Ethan']" won the round 3 (stack = {'Zheng': 980, 'RaphaelPlayer': 965, 'SichengZuo': 985, 'Yuchun': 985, 'HakulaPlayer': 970, 'Ethan': 1100, 'YangZ': 1000, 'Finneas': 1015})
player [Zheng] gets hole card ['H4', 'H5'], current stack 980
player [RaphaelPlayer] gets hole card ['CT', 'CQ'], current stack 965
player [SichengZuo] gets hole card ['S7', 'S5'], current stack 985
player [Yuchun] gets hole card ['C7', 'C3'], current stack 985
player [HakulaPlayer] gets hole card ['HJ', 'S6'], current stack 965
player [Ethan] gets hole card ['SQ', 'H3'], current stack 1090
player [YangZ] gets hole card ['S8', 'CK'], current stack 1000
player [Finneas] gets hole card ['C9', 'DK'], current stack 1015
Started the round 4
Street "preflop" started. (community card = [])
"YangZ" declared "fold:0"
"Finneas" declared "call:10"
"Zheng" declared "call:10"
"RaphaelPlayer" declared "raise:30"
"SichengZuo" declared "fold:0"
"Yuchun" declared "fold:0"
"HakulaPlayer" declared "fold:0"
"Ethan" declared "fold:0"
"Finneas" declared "fold:0"
"Zheng" declared "fold:0"
"['RaphaelPlayer']" won the round 4 (stack = {'Zheng': 970, 'RaphaelPlayer': 1000, 'SichengZuo': 985, 'Yuchun': 985, 'HakulaPlayer': 965, 'Ethan': 1090, 'YangZ': 1000, 'Finneas': 1005})
player [Zheng] gets hole card ['DA', 'S5'], current stack 970
player [RaphaelPlayer] gets hole card ['DJ', 'S3'], current stack 1000
player [SichengZuo] gets hole card ['C8', 'DT'], current stack 985
player [Yuchun] gets hole card ['CA', 'H3'], current stack 985
player [HakulaPlayer] gets hole card ['D3', 'HK'], current stack 965
player [Ethan] gets hole card ['D9', 'C4'], current stack 1085
player [YangZ] gets hole card ['CJ', 'H7'], current stack 990
player [Finneas] gets hole card ['D4', 'S4'], current stack 1005
Started the round 5
Street "preflop" started. (community card = [])
"Finneas" declared "call:10"
"Zheng" declared "call:10"
"RaphaelPlayer" declared "fold:0"
"SichengZuo" declared "fold:0"
"Yuchun" declared "fold:0"
"HakulaPlayer" declared "call:10"
"Ethan" declared "fold:0"
"YangZ" declared "fold:0"
Street "flop" started. (community card = ['SJ', 'DK', 'SA'])
"Finneas" declared "call:0"
"Zheng" declared "call:0"
"HakulaPlayer" declared "call:0"
Street "turn" started. (community card = ['SJ', 'DK', 'SA', 'C3'])
"Finneas" declared "call:0"
"Zheng" declared "call:0"
"HakulaPlayer" declared "raise:58"
"Finneas" declared "fold:0"
"Zheng" declared "raise:538"
"HakulaPlayer" declared "call:538"
Street "river" started. (community card = ['SJ', 'DK', 'SA', 'C3', 'C2'])
"Zheng" declared "raise:216"
"HakulaPlayer" declared "call:216"
"['HakulaPlayer']" won the round 5 (stack = {'Zheng': 206, 'RaphaelPlayer': 1000, 'SichengZuo': 985, 'Yuchun': 985, 'HakulaPlayer': 1754, 'Ethan': 1085, 'YangZ': 990, 'Finneas': 995})
player [Zheng] gets hole card ['H2', 'ST'], current stack 206
player [RaphaelPlayer] gets hole card ['S6', 'S8'], current stack 1000
player [SichengZuo] gets hole card ['D5', 'S4'], current stack 985
player [Yuchun] gets hole card ['S7', 'S3'], current stack 985
player [HakulaPlayer] gets hole card ['CQ', 'HA'], current stack 1754
player [Ethan] gets hole card ['H5', 'CK'], current stack 1085
player [YangZ] gets hole card ['D3', 'D9'], current stack 985
player [Finneas] gets hole card ['C6', 'H6'], current stack 985
Started the round 6
Street "preflop" started. (community card = [])
"Zheng" declared "call:10"
"RaphaelPlayer" declared "fold:0"
"SichengZuo" declared "fold:0"
"Yuchun" declared "fold:0"
"HakulaPlayer" declared "raise:32"
"Ethan" declared "fold:0"
"YangZ" declared "fold:0"
"Finneas" declared "fold:0"
"Zheng" declared "fold:0"
"['HakulaPlayer']" won the round 6 (stack = {'Zheng': 196, 'RaphaelPlayer': 1000, 'SichengZuo': 985, 'Yuchun': 985, 'HakulaPlayer': 1779, 'Ethan': 1085, 'YangZ': 985, 'Finneas': 985})
player [Zheng] gets hole card ['HQ', 'SQ'], current stack 186
player [RaphaelPlayer] gets hole card ['C5', 'CQ'], current stack 1000
player [SichengZuo] gets hole card ['DJ', 'S3'], current stack 985
player [Yuchun] gets hole card ['S4', 'H2'], current stack 985
player [HakulaPlayer] gets hole card ['CT', 'C2'], current stack 1779
player [Ethan] gets hole card ['D7', 'D8'], current stack 1085
player [YangZ] gets hole card ['H6', 'D4'], current stack 985
player [Finneas] gets hole card ['SJ', 'CA'], current stack 980
Started the round 7
Street "preflop" started. (community card = [])
"RaphaelPlayer" declared "call:10"
"SichengZuo" declared "fold:0"
"Yuchun" declared "fold:0"
"HakulaPlayer" declared "call:10"
"Ethan" declared "fold:0"
"YangZ" declared "fold:0"
"Finneas" declared "call:10"
"Zheng" declared "call:10"
Street "flop" started. (community card = ['DQ', 'S6', 'D9'])
"Finneas" declared "call:0"
"Zheng" declared "raise:98"
"RaphaelPlayer" declared "fold:0"
"HakulaPlayer" declared "fold:0"
"Finneas" declared "fold:0"
"['Zheng']" won the round 7 (stack = {'Zheng': 226, 'RaphaelPlayer': 990, 'SichengZuo': 985, 'Yuchun': 985, 'HakulaPlayer': 1769, 'Ethan': 1085, 'YangZ': 985, 'Finneas': 975})
player [Zheng] gets hole card ['H5', 'HJ'], current stack 221
player [RaphaelPlayer] gets hole card ['D2', 'D8'], current stack 980
player [SichengZuo] gets hole card ['D9', 'S8'], current stack 985
player [Yuchun] gets hole card ['HA', 'D6'], current stack 985
player [HakulaPlayer] gets hole card ['SJ', 'SQ'], current stack 1769
player [Ethan] gets hole card ['SA', 'H3'], current stack 1085
player [YangZ] gets hole card ['C9', 'C6'], current stack 985
player [Finneas] gets hole card ['S5', 'S3'], current stack 975
Started the round 8
Street "preflop" started. (community card = [])
"SichengZuo" declared "fold:0"
"Yuchun" declared "fold:0"
"HakulaPlayer" declared "call:10"
"Ethan" declared "fold:0"
"YangZ" declared "fold:0"
"Finneas" declared "call:10"
"Zheng" declared "call:10"
"RaphaelPlayer" declared "fold:0"
Street "flop" started. (community card = ['S9', 'C2', 'HQ'])
"Zheng" declared "call:0"
"HakulaPlayer" declared "raise:36"
"Finneas" declared "fold:0"
"Zheng" declared "fold:0"
"['HakulaPlayer']" won the round 8 (stack = {'Zheng': 216, 'RaphaelPlayer': 980, 'SichengZuo': 985, 'Yuchun': 985, 'HakulaPlayer': 1799, 'Ethan': 1085, 'YangZ': 985, 'Finneas': 965})
player [Zheng] gets hole card ['C7', 'SQ'], current stack 216
player [RaphaelPlayer] gets hole card ['CT', 'D3'], current stack 975
player [SichengZuo] gets hole card ['D6', 'HJ'], current stack 975
player [Yuchun] gets hole card ['C9', 'S3'], current stack 985
player [HakulaPlayer] gets hole card ['DJ', 'H6'], current stack 1799
player [Ethan] gets hole card ['S5', 'H8'], current stack 1085
player [YangZ] gets hole card ['SA', 'CQ'], current stack 985
player [Finneas] gets hole card ['SK', 'S4'], current stack 965
Started the round 9
Street "preflop" started. (community card = [])
"Yuchun" declared "fold:0"
"HakulaPlayer" declared "fold:0"
"Ethan" declared "fold:0"
"YangZ" declared "fold:0"
"Finneas" declared "call:10"
"Zheng" declared "call:10"
"RaphaelPlayer" declared "fold:0"
"SichengZuo" declared "fold:0"
Street "flop" started. (community card = ['S9', 'S8', 'C3'])
"Finneas" declared "call:0"
"Zheng" declared "call:0"
Street "turn" started. (community card = ['S9', 'S8', 'C3', 'C4'])
"Finneas" declared "call:0"
"Zheng" declared "call:0"
Street "river" started. (community card = ['S9', 'S8', 'C3', 'C4', 'H3'])
"Finneas" declared "call:0"
"Zheng" declared "call:0"
"['Finneas']" won the round 9 (stack = {'Zheng': 206, 'RaphaelPlayer': 975, 'SichengZuo': 975, 'Yuchun': 985, 'HakulaPlayer': 1799, 'Ethan': 1085, 'YangZ': 985, 'Finneas': 990})
player [Zheng] gets hole card ['DQ', 'S8'], current stack 206
player [RaphaelPlayer] gets hole card ['CA', 'DT'], current stack 975
player [SichengZuo] gets hole card ['D5', 'C9'], current stack 970
player [Yuchun] gets hole card ['C5', 'D2'], current stack 975
player [HakulaPlayer] gets hole card ['D6', 'HQ'], current stack 1799
player [Ethan] gets hole card ['H8', 'SQ'], current stack 1085
player [YangZ] gets hole card ['S4', 'C7'], current stack 985
player [Finneas] gets hole card ['S3', 'SJ'], current stack 990
Started the round 10
Street "preflop" started. (community card = [])
"HakulaPlayer" declared "fold:0"
"Ethan" declared "fold:0"
"YangZ" declared "fold:0"
"Finneas" declared "call:10"
"Zheng" declared "call:10"
"RaphaelPlayer" declared "raise:30"
"SichengZuo" declared "fold:0"
"Yuchun" declared "call:30"
"Finneas" declared "fold:0"
"Zheng" declared "fold:0"
Street "flop" started. (community card = ['S7', 'D8', 'D4'])
"Yuchun" declared "call:0"
"RaphaelPlayer" declared "raise:95"
"Yuchun" declared "call:95"
Street "turn" started. (community card = ['S7', 'D8', 'D4', 'CK'])
"Yuchun" declared "call:0"
"RaphaelPlayer" declared "call:0"
Street "river" started. (community card = ['S7', 'D8', 'D4', 'CK', 'C2'])
"Yuchun" declared "call:0"
"RaphaelPlayer" declared "call:0"
"['Yuchun']" won the round 10 (stack = {'Zheng': 196, 'RaphaelPlayer': 850, 'SichengZuo': 970, 'Yuchun': 1135, 'HakulaPlayer': 1799, 'Ethan': 1085, 'YangZ': 985, 'Finneas': 980})
player [Zheng] gets hole card ['C4', 'HJ'], current stack 196
player [RaphaelPlayer] gets hole card ['H6', 'SA'], current stack 850
player [SichengZuo] gets hole card ['HA', 'S5'], current stack 970
player [Yuchun] gets hole card ['SJ', 'C8'], current stack 1130
player [HakulaPlayer] gets hole card ['H3', 'H9'], current stack 1789
player [Ethan] gets hole card ['S2', 'C9'], current stack 1085
player [YangZ] gets hole card ['S9', 'ST'], current stack 985
player [Finneas] gets hole card ['CK', 'C6'], current stack 980
Started the round 11
Street "preflop" started. (community card = [])
"Ethan" declared "fold:0"
"YangZ" declared "fold:0"
"Finneas" declared "call:10"
"Zheng" declared "call:10"
"RaphaelPlayer" declared "call:10"
"SichengZuo" declared "fold:0"
"Yuchun" declared "call:10"
"HakulaPlayer" declared "call:10"
Street "flop" started. (community card = ['C2', 'D3', 'H4'])
"Yuchun" declared "call:0"
"HakulaPlayer" declared "call:0"
"Finneas" declared "call:0"
"Zheng" declared "call:0"
"RaphaelPlayer" declared "call:0"
Street "turn" started. (community card = ['C2', 'D3', 'H4', 'S8'])
"Yuchun" declared "call:0"
"HakulaPlayer" declared "call:0"
"Finneas" declared "call:0"
"Zheng" declared "call:0"
"RaphaelPlayer" declared "call:0"
Street "river" started. (community card = ['C2', 'D3', 'H4', 'S8', 'D2'])
"Yuchun" declared "call:0"
"HakulaPlayer" declared "call:0"
"Finneas" declared "call:0"
"Zheng" declared "call:0"
"RaphaelPlayer" declared "call:0"
"['Yuchun']" won the round 11 (stack = {'Zheng': 186, 'RaphaelPlayer': 840, 'SichengZuo': 970, 'Yuchun': 1175, 'HakulaPlayer': 1789, 'Ethan': 1085, 'YangZ': 985, 'Finneas': 970})
player [Zheng] gets hole card ['H4', 'C5'], current stack 186
player [RaphaelPlayer] gets hole card ['H3', 'H5'], current stack 840
player [SichengZuo] gets hole card ['D3', 'HT'], current stack 970
player [Yuchun] gets hole card ['CQ', 'D9'], current stack 1175
player [HakulaPlayer] gets hole card ['D2', 'S5'], current stack 1784
player [Ethan] gets hole card ['C3', 'DQ'], current stack 1075
player [YangZ] gets hole card ['C4', 'S7'], current stack 985
player [Finneas] gets hole card ['DT', 'HJ'], current stack 970
Started the round 12
Street "preflop" started. (community card = [])
"YangZ" declared "fold:0"
"Finneas" declared "call:10"
"Zheng" declared "call:10"
"RaphaelPlayer" declared "fold:0"
"SichengZuo" declared "fold:0"
"Yuchun" declared "call:10"
"HakulaPlayer" declared "call:10"
"Ethan" declared "fold:0"
Street "flop" started. (community card = ['C6', 'CT', 'H7'])
"HakulaPlayer" declared "call:0"
"Finneas" declared "call:0"
"Zheng" declared "call:0"
"Yuchun" declared "call:0"
Street "turn" started. (community card = ['C6', 'CT', 'H7', 'DJ'])
"HakulaPlayer" declared "call:0"
"Finneas" declared "call:0"
"Zheng" declared "call:0"
"Yuchun" declared "call:0"
Street "river" started. (community card = ['C6', 'CT', 'H7', 'DJ', 'HQ'])
"HakulaPlayer" declared "call:0"
"Finneas" declared "call:0"
"Zheng" declared "call:0"
"Yuchun" declared "call:0"
"['Finneas']" won the round 12 (stack = {'Zheng': 176, 'RaphaelPlayer': 840, 'SichengZuo': 970, 'Yuchun': 1165, 'HakulaPlayer': 1779, 'Ethan': 1075, 'YangZ': 985, 'Finneas': 1010})
player [Zheng] gets hole card ['C2', 'D3'], current stack 176
player [RaphaelPlayer] gets hole card ['C6', 'S3'], current stack 840
player [SichengZuo] gets hole card ['H7', 'H5'], current stack 970
player [Yuchun] gets hole card ['HQ', 'HJ'], current stack 1165
player [HakulaPlayer] gets hole card ['DK', 'D2'], current stack 1779
player [Ethan] gets hole card ['DJ', 'D6'], current stack 1070
player [YangZ] gets hole card ['C7', 'DA'], current stack 975
player [Finneas] gets hole card ['CA', 'C5'], current stack 1010
Started the round 13
Street "preflop" started. (community card = [])
"Finneas" declared "call:10"
"Zheng" declared "call:10"
"RaphaelPlayer" declared "fold:0"
"SichengZuo" declared "fold:0"
"Yuchun" declared "call:10"
"HakulaPlayer" declared "raise:36"
"Ethan" declared "fold:0"
"YangZ" declared "fold:0"
"Finneas" declared "fold:0"
"Zheng" declared "fold:0"
"Yuchun" declared "call:36"
Street "flop" started. (community card = ['SQ', 'C9', 'S8'])
"Yuchun" declared "raise:40"
"HakulaPlayer" declared "fold:0"
"['Yuchun']" won the round 13 (stack = {'Zheng': 166, 'RaphaelPlayer': 840, 'SichengZuo': 970, 'Yuchun': 1236, 'HakulaPlayer': 1743, 'Ethan': 1070, 'YangZ': 975, 'Finneas': 1000})
player [Zheng] gets hole card ['HT', 'C3'], current stack 166
player [RaphaelPlayer] gets hole card ['C5', 'D6'], current stack 840
player [SichengZuo] gets hole card ['D3', 'H8'], current stack 970
player [Yuchun] gets hole card ['H9', 'H2'], current stack 1236
player [HakulaPlayer] gets hole card ['CQ', 'HQ'], current stack 1743
player [Ethan] gets hole card ['DA', 'ST'], current stack 1070
player [YangZ] gets hole card ['S2', 'S3'], current stack 970
player [Finneas] gets hole card ['CJ', 'DJ'], current stack 990
Started the round 14
Street "preflop" started. (community card = [])
"Zheng" declared "call:10"
"RaphaelPlayer" declared "fold:0"
"SichengZuo" declared "fold:0"
"Yuchun" declared "call:10"
"HakulaPlayer" declared "raise:41"
"Ethan" declared "call:41"
"YangZ" declared "fold:0"
"Finneas" declared "fold:0"
"Zheng" declared "fold:0"
"Yuchun" declared "call:41"
Street "flop" started. (community card = ['C2', 'D7', 'H5'])
"Yuchun" declared "call:0"
"HakulaPlayer" declared "raise:134"
"Ethan" declared "fold:0"
"Yuchun" declared "call:134"
Street "turn" started. (community card = ['C2', 'D7', 'H5', 'D4'])
"Yuchun" declared "call:0"
"HakulaPlayer" declared "raise:525"
"Yuchun" declared "fold:0"
"['HakulaPlayer']" won the round 14 (stack = {'Zheng': 156, 'RaphaelPlayer': 840, 'SichengZuo': 970, 'Yuchun': 1061, 'HakulaPlayer': 1984, 'Ethan': 1029, 'YangZ': 970, 'Finneas': 990})
player [Zheng] gets hole card ['H6', 'D5'], current stack 146
player [RaphaelPlayer] gets hole card ['HJ', 'CQ'], current stack 840
player [SichengZuo] gets hole card ['C9', 'C5'], current stack 970
player [Yuchun] gets hole card ['D9', 'SJ'], current stack 1061
player [HakulaPlayer] gets hole card ['H2', 'H9'], current stack 1984
player [Ethan] gets hole card ['SQ', 'D6'], current stack 1029
player [YangZ] gets hole card ['DJ', 'HT'], current stack 970
player [Finneas] gets hole card ['D4', 'D7'], current stack 985
Started the round 15
Street "preflop" started. (community card = [])
"RaphaelPlayer" declared "call:10"
"SichengZuo" declared "fold:0"
"Yuchun" declared "call:10"
"HakulaPlayer" declared "call:10"
"Ethan" declared "fold:0"
"YangZ" declared "fold:0"
"Finneas" declared "call:10"
"Zheng" declared "call:10"
Street "flop" started. (community card = ['DQ', 'S7', 'H8'])
"Finneas" declared "call:0"
"Zheng" declared "call:0"
"RaphaelPlayer" declared "call:0"
"Yuchun" declared "call:0"
"HakulaPlayer" declared "call:0"
Street "turn" started. (community card = ['DQ', 'S7', 'H8', 'SK'])
"Finneas" declared "call:0"
"Zheng" declared "call:0"
"RaphaelPlayer" declared "call:0"
"Yuchun" declared "call:0"
"HakulaPlayer" declared "call:0"
Street "river" started. (community card = ['DQ', 'S7', 'H8', 'SK', 'H4'])
"Finneas" declared "call:0"
"Zheng" declared "raise:146"
"RaphaelPlayer" declared "fold:0"
"Yuchun" declared "fold:0"
"HakulaPlayer" declared "fold:0"
"Finneas" declared "fold:0"
"['Zheng']" won the round 15 (stack = {'Zheng': 196, 'RaphaelPlayer': 830, 'SichengZuo': 970, 'Yuchun': 1051, 'HakulaPlayer': 1974, 'Ethan': 1029, 'YangZ': 970, 'Finneas': 980})
player [Zheng] gets hole card ['H5', 'D3'], current stack 191
player [RaphaelPlayer] gets hole card ['H7', 'S4'], current stack 820
player [SichengZuo] gets hole card ['C9', 'D9'], current stack 970
player [Yuchun] gets hole card ['C5', 'S6'], current stack 1051
player [HakulaPlayer] gets hole card ['C4', 'D4'], current stack 1974
player [Ethan] gets hole card ['S5', 'H3'], current stack 1029
player [YangZ] gets hole card ['SQ', 'C7'], current stack 970
player [Finneas] gets hole card ['ST', 'CK'], current stack 980
Started the round 16
Street "preflop" started. (community card = [])
"SichengZuo" declared "fold:0"
"Yuchun" declared "call:10"
"HakulaPlayer" declared "call:10"
"Ethan" declared "fold:0"
"YangZ" declared "fold:0"
"Finneas" declared "call:10"
"Zheng" declared "call:10"
"RaphaelPlayer" declared "fold:0"
Street "flop" started. (community card = ['S8', 'SK', 'CQ'])
"Zheng" declared "call:0"
"Yuchun" declared "call:0"
"HakulaPlayer" declared "call:0"
"Finneas" declared "call:0"
Street "turn" started. (community card = ['S8', 'SK', 'CQ', 'HQ'])
"Zheng" declared "call:0"
"Yuchun" declared "call:0"
"HakulaPlayer" declared "call:0"
"Finneas" declared "call:0"
Street "river" started. (community card = ['S8', 'SK', 'CQ', 'HQ', 'H9'])
"Zheng" declared "call:0"
"Yuchun" declared "call:0"
"HakulaPlayer" declared "call:0"
"Finneas" declared "call:0"
"['Finneas']" won the round 16 (stack = {'Zheng': 186, 'RaphaelPlayer': 820, 'SichengZuo': 970, 'Yuchun': 1041, 'HakulaPlayer': 1964, 'Ethan': 1029, 'YangZ': 970, 'Finneas': 1020})
player [Zheng] gets hole card ['S2', 'CT'], current stack 186
player [RaphaelPlayer] gets hole card ['DJ', 'CJ'], current stack 815
player [SichengZuo] gets hole card ['H5', 'ST'], current stack 960
player [Yuchun] gets hole card ['D7', 'H6'], current stack 1041
player [HakulaPlayer] gets hole card ['S5', 'HK'], current stack 1964
player [Ethan] gets hole card ['D6', 'C6'], current stack 1029
player [YangZ] gets hole card ['HT', 'HQ'], current stack 970
player [Finneas] gets hole card ['S9', 'DQ'], current stack 1020
Started the round 17
Street "preflop" started. (community card = [])
"Yuchun" declared "call:10"
"HakulaPlayer" declared "call:10"
"Ethan" declared "fold:0"
"YangZ" declared "fold:0"
"Finneas" declared "call:10"
"Zheng" declared "call:10"
"RaphaelPlayer" declared "raise:40"
"SichengZuo" declared "fold:0"
"Yuchun" declared "call:40"
"HakulaPlayer" declared "call:40"
"Finneas" declared "fold:0"
"Zheng" declared "fold:0"
Street "flop" started. (community card = ['S4', 'H8', 'CA'])
"RaphaelPlayer" declared "call:0"
"Yuchun" declared "call:0"
"HakulaPlayer" declared "call:0"
Street "turn" started. (community card = ['S4', 'H8', 'CA', 'C4'])
"RaphaelPlayer" declared "raise:160"
"Yuchun" declared "fold:0"
"HakulaPlayer" declared "fold:0"
"['RaphaelPlayer']" won the round 17 (stack = {'Zheng': 176, 'RaphaelPlayer': 930, 'SichengZuo': 960, 'Yuchun': 1001, 'HakulaPlayer': 1924, 'Ethan': 1029, 'YangZ': 970, 'Finneas': 1010})
player [Zheng] gets hole card ['S9', 'SJ'], current stack 176
player [RaphaelPlayer] gets hole card ['H9', 'S2'], current stack 930
player [SichengZuo] gets hole card ['D6', 'C2'], current stack 955
player [Yuchun] gets hole card ['H4', 'S4'], current stack 991
player [HakulaPlayer] gets hole card ['S7', 'HK'], current stack 1924
player [Ethan] gets hole card ['H2', 'DQ'], current stack 1029
player [YangZ] gets hole card ['D5', 'CT'], current stack 970
player [Finneas] gets hole card ['CK', 'CJ'], current stack 1010
Started the round 18
Street "preflop" started. (community card = [])
"HakulaPlayer" declared "call:10"
"Ethan" declared "fold:0"
"YangZ" declared "fold:0"
"Finneas" declared "call:10"
"Zheng" declared "call:10"
"RaphaelPlayer" declared "fold:0"
"SichengZuo" declared "fold:0"
"Yuchun" declared "call:10"
Street "flop" started. (community card = ['DK', 'D9', 'H6'])
"Yuchun" declared "call:0"
"HakulaPlayer" declared "call:0"
"Finneas" declared "call:0"
"Zheng" declared "call:0"
Street "turn" started. (community card = ['DK', 'D9', 'H6', 'SQ'])
"Yuchun" declared "call:0"
"HakulaPlayer" declared "call:0"
"Finneas" declared "call:0"
"Zheng" declared "call:0"
Street "river" started. (community card = ['DK', 'D9', 'H6', 'SQ', 'H7'])
"Yuchun" declared "call:0"
"HakulaPlayer" declared "raise:74"
"Finneas" declared "fold:0"
"Zheng" declared "fold:0"
"Yuchun" declared "call:74"
"['HakulaPlayer']" won the round 18 (stack = {'Zheng': 166, 'RaphaelPlayer': 930, 'SichengZuo': 955, 'Yuchun': 917, 'HakulaPlayer': 2033, 'Ethan': 1029, 'YangZ': 970, 'Finneas': 1000})
player [Zheng] gets hole card ['CT', 'S8'], current stack 166
player [RaphaelPlayer] gets hole card ['C7', 'SQ'], current stack 930
player [SichengZuo] gets hole card ['CQ', 'HA'], current stack 955
player [Yuchun] gets hole card ['CK', 'D3'], current stack 912
player [HakulaPlayer] gets hole card ['S9', 'H8'], current stack 2023
player [Ethan] gets hole card ['H7', 'D5'], current stack 1029
player [YangZ] gets hole card ['DA', 'D9'], current stack 970
player [Finneas] gets hole card ['C3', 'C8'], current stack 1000
Started the round 19
Street "preflop" started. (community card = [])
"Ethan" declared "fold:0"
"YangZ" declared "fold:0"
"Finneas" declared "call:10"
"Zheng" declared "call:10"
"RaphaelPlayer" declared "fold:0"
"SichengZuo" declared "fold:0"
"Yuchun" declared "call:10"
"HakulaPlayer" declared "call:10"
Street "flop" started. (community card = ['HQ', 'SJ', 'HT'])
"Yuchun" declared "call:0"
"HakulaPlayer" declared "raise:56"
"Finneas" declared "fold:0"
"Zheng" declared "fold:0"
"Yuchun" declared "call:56"
Street "turn" started. (community card = ['HQ', 'SJ', 'HT', 'HJ'])
"Yuchun" declared "call:0"
"HakulaPlayer" declared "raise:302"
"Yuchun" declared "fold:0"
"['HakulaPlayer']" won the round 19 (stack = {'Zheng': 156, 'RaphaelPlayer': 930, 'SichengZuo': 955, 'Yuchun': 851, 'HakulaPlayer': 2119, 'Ethan': 1029, 'YangZ': 970, 'Finneas': 990})
player [Zheng] gets hole card ['D2', 'D3'], current stack 156
player [RaphaelPlayer] gets hole card ['CT', 'C2'], current stack 930
player [SichengZuo] gets hole card ['S6', 'H5'], current stack 955
player [Yuchun] gets hole card ['H3', 'DT'], current stack 851
player [HakulaPlayer] gets hole card ['C5', 'SQ'], current stack 2114
player [Ethan] gets hole card ['C6', 'HT'], current stack 1019
player [YangZ] gets hole card ['DQ', 'S3'], current stack 970
player [Finneas] gets hole card ['S2', 'D8'], current stack 990
Started the round 20
Street "preflop" started. (community card = [])
"YangZ" declared "fold:0"
"Finneas" declared "call:10"
"Zheng" declared "call:10"
"RaphaelPlayer" declared "fold:0"
"SichengZuo" declared "fold:0"
"Yuchun" declared "call:10"
"HakulaPlayer" declared "call:10"
"Ethan" declared "fold:0"
Street "flop" started. (community card = ['SA', 'H7', 'CJ'])
"HakulaPlayer" declared "call:0"
"Finneas" declared "call:0"
"Zheng" declared "call:0"
"Yuchun" declared "call:0"
Street "turn" started. (community card = ['SA', 'H7', 'CJ', 'D5'])
"HakulaPlayer" declared "call:0"
"Finneas" declared "call:0"
"Zheng" declared "call:0"
"Yuchun" declared "call:0"
Street "river" started. (community card = ['SA', 'H7', 'CJ', 'D5', 'HA'])
"HakulaPlayer" declared "call:0"
"Finneas" declared "call:0"
"Zheng" declared "call:0"
"Yuchun" declared "call:0"
"['HakulaPlayer']" won the round 20 (stack = {'Zheng': 146, 'RaphaelPlayer': 930, 'SichengZuo': 955, 'Yuchun': 841, 'HakulaPlayer': 2159, 'Ethan': 1019, 'YangZ': 970, 'Finneas': 980})
player [Zheng] gets hole card ['CT', 'DQ'], current stack 146
player [RaphaelPlayer] gets hole card ['SA', 'DA'], current stack 930
player [SichengZuo] gets hole card ['S9', 'H5'], current stack 955
player [Yuchun] gets hole card ['C6', 'S5'], current stack 841
player [HakulaPlayer] gets hole card ['C7', 'C5'], current stack 2159
player [Ethan] gets hole card ['C2', 'D9'], current stack 1014
player [YangZ] gets hole card ['H7', 'C3'], current stack 960
player [Finneas] gets hole card ['HJ', 'H2'], current stack 980
Started the round 21
Street "preflop" started. (community card = [])
"Finneas" declared "call:10"
"Zheng" declared "call:10"
"RaphaelPlayer" declared "raise:40"
"SichengZuo" declared "fold:0"
"Yuchun" declared "call:40"
"HakulaPlayer" declared "fold:0"
"Ethan" declared "fold:0"
"YangZ" declared "fold:0"
"Finneas" declared "fold:0"
"Zheng" declared "call:40"
Street "flop" started. (community card = ['D5', 'C8', 'D4'])
"Zheng" declared "call:0"
"RaphaelPlayer" declared "raise:155"
"Yuchun" declared "call:155"
"Zheng" declared "fold:0"
Street "turn" started. (community card = ['D5', 'C8', 'D4', 'H3'])
"RaphaelPlayer" declared "raise:465"
"Yuchun" declared "fold:0"
"['RaphaelPlayer']" won the round 21 (stack = {'Zheng': 106, 'RaphaelPlayer': 1190, 'SichengZuo': 955, 'Yuchun': 646, 'HakulaPlayer': 2159, 'Ethan': 1014, 'YangZ': 960, 'Finneas': 970})
player [Zheng] gets hole card ['DA', 'S5'], current stack 106
player [RaphaelPlayer] gets hole card ['SA', 'HK'], current stack 1190
player [SichengZuo] gets hole card ['SK', 'D9'], current stack 955
player [Yuchun] gets hole card ['H2', 'H9'], current stack 646
player [HakulaPlayer] gets hole card ['H4', 'CK'], current stack 2159
player [Ethan] gets hole card ['D4', 'SJ'], current stack 1014
player [YangZ] gets hole card ['C3', 'S4'], current stack 955
player [Finneas] gets hole card ['ST', 'CQ'], current stack 960
Started the round 22
Street "preflop" started. (community card = [])
"Zheng" declared "call:10"
"RaphaelPlayer" declared "call:10"
"SichengZuo" declared "fold:0"
"Yuchun" declared "call:10"
"HakulaPlayer" declared "call:10"
"Ethan" declared "fold:0"
"YangZ" declared "fold:0"
"Finneas" declared "call:10"
Street "flop" started. (community card = ['S7', 'S2', 'CJ'])
"Finneas" declared "call:0"
"Zheng" declared "call:0"
"RaphaelPlayer" declared "call:0"
"Yuchun" declared "call:0"
"HakulaPlayer" declared "call:0"
Street "turn" started. (community card = ['S7', 'S2', 'CJ', 'C9'])
"Finneas" declared "call:0"
"Zheng" declared "call:0"
"RaphaelPlayer" declared "call:0"
"Yuchun" declared "call:0"
"HakulaPlayer" declared "call:0"
Street "river" started. (community card = ['S7', 'S2', 'CJ', 'C9', 'D6'])
"Finneas" declared "call:0"
"Zheng" declared "call:0"
"RaphaelPlayer" declared "call:0"
"Yuchun" declared "call:0"
"HakulaPlayer" declared "call:0"
"['Yuchun']" won the round 22 (stack = {'Zheng': 96, 'RaphaelPlayer': 1180, 'SichengZuo': 955, 'Yuchun': 691, 'HakulaPlayer': 2149, 'Ethan': 1014, 'YangZ': 955, 'Finneas': 960})
player [Zheng] gets hole card ['C2', 'SK'], current stack 86
player [RaphaelPlayer] gets hole card ['DJ', 'CQ'], current stack 1180
player [SichengZuo] gets hole card ['C6', 'H3'], current stack 955
player [Yuchun] gets hole card ['H9', 'HT'], current stack 691
player [HakulaPlayer] gets hole card ['C8', 'S2'], current stack 2149
player [Ethan] gets hole card ['HQ', 'H4'], current stack 1014
player [YangZ] gets hole card ['D6', 'S6'], current stack 955
player [Finneas] gets hole card ['C3', 'CJ'], current stack 955
Started the round 23
Street "preflop" started. (community card = [])
"RaphaelPlayer" declared "call:10"
"SichengZuo" declared "fold:0"
"Yuchun" declared "call:10"
"HakulaPlayer" declared "call:10"
"Ethan" declared "fold:0"
"YangZ" declared "fold:0"
"Finneas" declared "call:10"
"Zheng" declared "call:10"
Street "flop" started. (community card = ['CA', 'DQ', 'C9'])
"Finneas" declared "call:0"
"Zheng" declared "call:0"
"RaphaelPlayer" declared "call:0"
"Yuchun" declared "call:0"
"HakulaPlayer" declared "call:0"
Street "turn" started. (community card = ['CA', 'DQ', 'C9', 'H2'])
"Finneas" declared "call:0"
"Zheng" declared "call:0"
"RaphaelPlayer" declared "call:0"
"Yuchun" declared "call:0"
"HakulaPlayer" declared "call:0"
Street "river" started. (community card = ['CA', 'DQ', 'C9', 'H2', 'D3'])
"Finneas" declared "call:0"
"Zheng" declared "call:0"
"RaphaelPlayer" declared "call:0"
"Yuchun" declared "call:0"
"HakulaPlayer" declared "call:0"
"['RaphaelPlayer']" won the round 23 (stack = {'Zheng': 86, 'RaphaelPlayer': 1220, 'SichengZuo': 955, 'Yuchun': 681, 'HakulaPlayer': 2139, 'Ethan': 1014, 'YangZ': 955, 'Finneas': 950})
player [Zheng] gets hole card ['C8', 'SK'], current stack 81
player [RaphaelPlayer] gets hole card ['SJ', 'C2'], current stack 1210
player [SichengZuo] gets hole card ['DQ', 'H5'], current stack 955
player [Yuchun] gets hole card ['D8', 'CT'], current stack 681
player [HakulaPlayer] gets hole card ['D5', 'CA'], current stack 2139
player [Ethan] gets hole card ['DJ', 'C5'], current stack 1014
player [YangZ] gets hole card ['HK', 'S8'], current stack 955
player [Finneas] gets hole card ['DT', 'D2'], current stack 950
Started the round 24
Street "preflop" started. (community card = [])
"SichengZuo" declared "fold:0"
"Yuchun" declared "call:10"
"HakulaPlayer" declared "call:10"
"Ethan" declared "fold:0"
"YangZ" declared "fold:0"
"Finneas" declared "call:10"
"Zheng" declared "call:10"
"RaphaelPlayer" declared "fold:0"
Street "flop" started. (community card = ['S9', 'S3', 'DA'])
"Zheng" declared "call:0"
"Yuchun" declared "call:0"
"HakulaPlayer" declared "call:0"
"Finneas" declared "call:0"
Street "turn" started. (community card = ['S9', 'S3', 'DA', 'HQ'])
"Zheng" declared "call:0"
"Yuchun" declared "call:0"
"HakulaPlayer" declared "raise:63"
"Finneas" declared "fold:0"
"Zheng" declared "call:63"
"Yuchun" declared "fold:0"
Street "river" started. (community card = ['S9', 'S3', 'DA', 'HQ', 'SQ'])
"Zheng" declared "call:0"
"HakulaPlayer" declared "raise:360"
"Zheng" declared "fold:0"
"['HakulaPlayer']" won the round 24 (stack = {'Zheng': 13, 'RaphaelPlayer': 1210, 'SichengZuo': 955, 'Yuchun': 671, 'HakulaPlayer': 2242, 'Ethan': 1014, 'YangZ': 955, 'Finneas': 940})
player [Zheng] gets hole card ['C2', 'H3'], current stack 13
player [RaphaelPlayer] gets hole card ['H6', 'C9'], current stack 1205
player [SichengZuo] gets hole card ['D9', 'HK'], current stack 945
player [Yuchun] gets hole card ['H4', 'DA'], current stack 671
player [HakulaPlayer] gets hole card ['S2', 'D6'], current stack 2242
player [Ethan] gets hole card ['CJ', 'S3'], current stack 1014
player [YangZ] gets hole card ['SK', 'CA'], current stack 955
player [Finneas] gets hole card ['HA', 'S8'], current stack 940
Started the round 25
Street "preflop" started. (community card = [])
"Yuchun" declared "call:10"
"HakulaPlayer" declared "fold:0"
"Ethan" declared "fold:0"
"YangZ" declared "fold:0"
"Finneas" declared "call:10"
"Zheng" declared "call:10"
"RaphaelPlayer" declared "fold:0"
"SichengZuo" declared "fold:0"
Street "flop" started. (community card = ['ST', 'D5', 'H7'])
"Yuchun" declared "call:0"
"Finneas" declared "call:0"
"Zheng" declared "call:0"
Street "turn" started. (community card = ['ST', 'D5', 'H7', 'H9'])
"Yuchun" declared "call:0"
"Finneas" declared "call:0"
"Zheng" declared "call:0"
Street "river" started. (community card = ['ST', 'D5', 'H7', 'H9', 'D2'])
"Yuchun" declared "call:0"
"Finneas" declared "call:0"
"Zheng" declared "call:0"
"['Zheng']" won the round 25 (stack = {'Zheng': 48, 'RaphaelPlayer': 1205, 'SichengZuo': 945, 'Yuchun': 661, 'HakulaPlayer': 2242, 'Ethan': 1014, 'YangZ': 955, 'Finneas': 930})
player [Zheng] gets hole card ['CJ', 'H2'], current stack 48
player [RaphaelPlayer] gets hole card ['D9', 'SK'], current stack 1205
player [SichengZuo] gets hole card ['SJ', 'H9'], current stack 940
player [Yuchun] gets hole card ['DK', 'C3'], current stack 651
player [HakulaPlayer] gets hole card ['C5', 'D5'], current stack 2242
player [Ethan] gets hole card ['S2', 'H7'], current stack 1014
player [YangZ] gets hole card ['CQ', 'D6'], current stack 955
player [Finneas] gets hole card ['C6', 'HQ'], current stack 930
Started the round 26
Street "preflop" started. (community card = [])
"HakulaPlayer" declared "call:10"
"Ethan" declared "fold:0"
"YangZ" declared "fold:0"
"Finneas" declared "call:10"
"Zheng" declared "call:10"
"RaphaelPlayer" declared "call:10"
"SichengZuo" declared "fold:0"
"Yuchun" declared "call:10"
Street "flop" started. (community card = ['CT', 'S9', 'DT'])
"Yuchun" declared "call:0"
"HakulaPlayer" declared "call:0"
"Finneas" declared "call:0"
"Zheng" declared "call:0"
"RaphaelPlayer" declared "call:0"
Street "turn" started. (community card = ['CT', 'S9', 'DT', 'S8'])
"Yuchun" declared "call:0"
"HakulaPlayer" declared "call:0"
"Finneas" declared "call:0"
"Zheng" declared "call:0"
"RaphaelPlayer" declared "call:0"
Street "river" started. (community card = ['CT', 'S9', 'DT', 'S8', 'D4'])
"Yuchun" declared "call:0"
"HakulaPlayer" declared "call:0"
"Finneas" declared "call:0"
"Zheng" declared "call:0"
"RaphaelPlayer" declared "call:0"
"['RaphaelPlayer']" won the round 26 (stack = {'Zheng': 38, 'RaphaelPlayer': 1250, 'SichengZuo': 940, 'Yuchun': 651, 'HakulaPlayer': 2232, 'Ethan': 1014, 'YangZ': 955, 'Finneas': 920})
player [Zheng] gets hole card ['D5', 'CT'], current stack 38
player [RaphaelPlayer] gets hole card ['S5', 'ST'], current stack 1250
player [SichengZuo] gets hole card ['D6', 'CK'], current stack 940
player [Yuchun] gets hole card ['HQ', 'C4'], current stack 646
player [HakulaPlayer] gets hole card ['H4', 'SK'], current stack 2222
player [Ethan] gets hole card ['DA', 'S7'], current stack 1014
player [YangZ] gets hole card ['S8', 'HT'], current stack 955
player [Finneas] gets hole card ['S2', 'H3'], current stack 920
Started the round 27
Street "preflop" started. (community card = [])
"Ethan" declared "fold:0"
"YangZ" declared "fold:0"
"Finneas" declared "call:10"
"Zheng" declared "call:10"
"RaphaelPlayer" declared "fold:0"
"SichengZuo" declared "fold:0"
"Yuchun" declared "call:10"
"HakulaPlayer" declared "call:10"
Street "flop" started. (community card = ['H8', 'DQ', 'H7'])
"Yuchun" declared "call:0"
"HakulaPlayer" declared "call:0"
"Finneas" declared "call:0"
"Zheng" declared "call:0"
Street "turn" started. (community card = ['H8', 'DQ', 'H7', 'SQ'])
"Yuchun" declared "raise:641"
"HakulaPlayer" declared "fold:0"
"Finneas" declared "fold:0"
"Zheng" declared "fold:0"
"['Yuchun']" won the round 27 (stack = {'Zheng': 28, 'RaphaelPlayer': 1250, 'SichengZuo': 940, 'Yuchun': 681, 'HakulaPlayer': 2222, 'Ethan': 1014, 'YangZ': 955, 'Finneas': 910})
player [Zheng] gets hole card ['H6', 'H3'], current stack 28
player [RaphaelPlayer] gets hole card ['H8', 'D4'], current stack 1250
player [SichengZuo] gets hole card ['S2', 'DT'], current stack 940
player [Yuchun] gets hole card ['C8', 'C6'], current stack 681
player [HakulaPlayer] gets hole card ['S5', 'S8'], current stack 2217
player [Ethan] gets hole card ['C5', 'D6'], current stack 1004
player [YangZ] gets hole card ['CT', 'HT'], current stack 955
player [Finneas] gets hole card ['S9', 'D2'], current stack 910
Started the round 28
Street "preflop" started. (community card = [])
"YangZ" declared "fold:0"
"Finneas" declared "call:10"
"Zheng" declared "call:10"
"RaphaelPlayer" declared "fold:0"
"SichengZuo" declared "fold:0"
"Yuchun" declared "call:10"
"HakulaPlayer" declared "call:10"
"Ethan" declared "fold:0"
Street "flop" started. (community card = ['S4', 'SA', 'SQ'])
"HakulaPlayer" declared "raise:80"
"Finneas" declared "fold:0"
"Zheng" declared "call:80"
"Yuchun" declared "fold:0"
Street "turn" started. (community card = ['S4', 'SA', 'SQ', 'HA'])
Street "river" started. (community card = ['S4', 'SA', 'SQ', 'HA', 'C2'])
"['HakulaPlayer']" won the round 28 (stack = {'Zheng': 0, 'RaphaelPlayer': 1250, 'SichengZuo': 940, 'Yuchun': 671, 'HakulaPlayer': 2280, 'Ethan': 1004, 'YangZ': 955, 'Finneas': 900})
player [RaphaelPlayer] gets hole card ['HT', 'S5'], current stack 1250
player [SichengZuo] gets hole card ['H5', 'C4'], current stack 940
player [Yuchun] gets hole card ['H8', 'H4'], current stack 671
player [HakulaPlayer] gets hole card ['H3', 'S7'], current stack 2280
player [Ethan] gets hole card ['H7', 'D2'], current stack 999
player [YangZ] gets hole card ['HA', 'DK'], current stack 945
player [Finneas] gets hole card ['CT', 'S6'], current stack 900
Started the round 29
Street "preflop" started. (community card = [])
"Finneas" declared "call:10"
"RaphaelPlayer" declared "fold:0"
"SichengZuo" declared "fold:0"
"Yuchun" declared "call:10"
"HakulaPlayer" declared "call:10"
"Ethan" declared "fold:0"
"YangZ" declared "fold:0"
Street "flop" started. (community card = ['H9', 'S4', 'S3'])
"Finneas" declared "call:0"
"Yuchun" declared "call:0"
"HakulaPlayer" declared "call:0"
Street "turn" started. (community card = ['H9', 'S4', 'S3', 'D9'])
"Finneas" declared "call:0"
"Yuchun" declared "call:0"
"HakulaPlayer" declared "call:0"
Street "river" started. (community card = ['H9', 'S4', 'S3', 'D9', 'H2'])
"Finneas" declared "call:0"
"Yuchun" declared "call:0"
"HakulaPlayer" declared "call:0"
"['Yuchun']" won the round 29 (stack = {'Zheng': 0, 'RaphaelPlayer': 1250, 'SichengZuo': 940, 'Yuchun': 706, 'HakulaPlayer': 2270, 'Ethan': 999, 'YangZ': 945, 'Finneas': 890})
player [RaphaelPlayer] gets hole card ['CK', 'D2'], current stack 1250
player [SichengZuo] gets hole card ['H4', 'HK'], current stack 940
player [Yuchun] gets hole card ['HT', 'S5'], current stack 706
player [HakulaPlayer] gets hole card ['ST', 'C5'], current stack 2270
player [Ethan] gets hole card ['HQ', 'CA'], current stack 999
player [YangZ] gets hole card ['CJ', 'C4'], current stack 940
player [Finneas] gets hole card ['DA', 'D3'], current stack 880
Started the round 30
Street "preflop" started. (community card = [])
"RaphaelPlayer" declared "fold:0"
"SichengZuo" declared "fold:0"
"Yuchun" declared "call:10"
"HakulaPlayer" declared "call:10"
"Ethan" declared "raise:149"
"YangZ" declared "fold:0"
"Finneas" declared "fold:0"
"Yuchun" declared "call:149"
"HakulaPlayer" declared "fold:0"
Street "flop" started. (community card = ['C6', 'S4', 'H2'])
"Yuchun" declared "call:0"
"Ethan" declared "call:0"
Street "turn" started. (community card = ['C6', 'S4', 'H2', 'SA'])
"Yuchun" declared "call:0"
"Ethan" declared "call:0"
Street "river" started. (community card = ['C6', 'S4', 'H2', 'SA', 'HA'])
"Yuchun" declared "call:0"
"Ethan" declared "raise:323"
"Yuchun" declared "fold:0"
"['Ethan']" won the round 30 (stack = {'Zheng': 0, 'RaphaelPlayer': 1250, 'SichengZuo': 940, 'Yuchun': 557, 'HakulaPlayer': 2260, 'Ethan': 1173, 'YangZ': 940, 'Finneas': 880})
player [RaphaelPlayer] gets hole card ['D9', 'DQ'], current stack 1240
player [SichengZuo] gets hole card ['DT', 'S2'], current stack 940
player [Yuchun] gets hole card ['D3', 'CA'], current stack 557
player [HakulaPlayer] gets hole card ['H9', 'CQ'], current stack 2260
player [Ethan] gets hole card ['SQ', 'S4'], current stack 1173
player [YangZ] gets hole card ['S6', 'SJ'], current stack 940
player [Finneas] gets hole card ['SA', 'CJ'], current stack 875
Started the round 31
Street "preflop" started. (community card = [])
"SichengZuo" declared "fold:0"
"Yuchun" declared "call:10"
"HakulaPlayer" declared "call:10"
"Ethan" declared "fold:0"
"YangZ" declared "fold:0"
"Finneas" declared "call:10"
"RaphaelPlayer" declared "call:10"
Street "flop" started. (community card = ['H4', 'C5', 'HK'])
"Finneas" declared "call:0"
"RaphaelPlayer" declared "call:0"
"Yuchun" declared "call:0"
"HakulaPlayer" declared "call:0"
Street "turn" started. (community card = ['H4', 'C5', 'HK', 'H3'])
"Finneas" declared "call:0"
"RaphaelPlayer" declared "call:0"
"Yuchun" declared "call:0"
"HakulaPlayer" declared "raise:22"
"Finneas" declared "fold:0"
"RaphaelPlayer" declared "fold:0"
"Yuchun" declared "call:22"
Street "river" started. (community card = ['H4', 'C5', 'HK', 'H3', 'H2'])
"Yuchun" declared "call:0"
"HakulaPlayer" declared "raise:173"
"Yuchun" declared "call:173"
"['HakulaPlayer']" won the round 31 (stack = {'Zheng': 0, 'RaphaelPlayer': 1240, 'SichengZuo': 940, 'Yuchun': 352, 'HakulaPlayer': 2485, 'Ethan': 1173, 'YangZ': 940, 'Finneas': 870})
player [RaphaelPlayer] gets hole card ['S6', 'SA'], current stack 1235
player [SichengZuo] gets hole card ['C2', 'D2'], current stack 930
player [Yuchun] gets hole card ['D5', 'HT'], current stack 352
player [HakulaPlayer] gets hole card ['H6', 'D3'], current stack 2485
player [Ethan] gets hole card ['HK', 'DK'], current stack 1173
player [YangZ] gets hole card ['DA', 'DJ'], current stack 940
player [Finneas] gets hole card ['CA', 'C3'], current stack 870
Started the round 32
Street "preflop" started. (community card = [])
"Yuchun" declared "call:10"
"HakulaPlayer" declared "fold:0"
"Ethan" declared "raise:351"
"YangZ" declared "fold:0"
"Finneas" declared "fold:0"
"RaphaelPlayer" declared "fold:0"
"SichengZuo" declared "fold:0"
"Yuchun" declared "fold:0"
"['Ethan']" won the round 32 (stack = {'Zheng': 0, 'RaphaelPlayer': 1235, 'SichengZuo': 930, 'Yuchun': 342, 'HakulaPlayer': 2485, 'Ethan': 1198, 'YangZ': 940, 'Finneas': 870})
player [RaphaelPlayer] gets hole card ['H8', 'HA'], current stack 1235
player [SichengZuo] gets hole card ['C5', 'S3'], current stack 925
player [Yuchun] gets hole card ['C3', 'DA'], current stack 332
player [HakulaPlayer] gets hole card ['D7', 'D9'], current stack 2485
player [Ethan] gets hole card ['H7', 'HK'], current stack 1198
player [YangZ] gets hole card ['D6', 'S4'], current stack 940
player [Finneas] gets hole card ['HT', 'S8'], current stack 870
Started the round 33
Street "preflop" started. (community card = [])
"HakulaPlayer" declared "fold:0"
"Ethan" declared "fold:0"
"YangZ" declared "fold:0"
"Finneas" declared "call:10"
"RaphaelPlayer" declared "raise:30"
"SichengZuo" declared "fold:0"
"Yuchun" declared "call:30"
"Finneas" declared "fold:0"
Street "flop" started. (community card = ['SA', 'CJ', 'C6'])
"Yuchun" declared "raise:312"
"RaphaelPlayer" declared "raise:1011"
Street "turn" started. (community card = ['SA', 'CJ', 'C6', 'C7'])
Street "river" started. (community card = ['SA', 'CJ', 'C6', 'C7', 'DT'])
"['RaphaelPlayer']" won the round 33 (stack = {'Zheng': 0, 'RaphaelPlayer': 1592, 'SichengZuo': 925, 'Yuchun': 0, 'HakulaPlayer': 2485, 'Ethan': 1198, 'YangZ': 940, 'Finneas': 860})
player [RaphaelPlayer] gets hole card ['ST', 'DT'], current stack 1592
player [SichengZuo] gets hole card ['HJ', 'D2'], current stack 925
player [HakulaPlayer] gets hole card ['H7', 'SJ'], current stack 2480
player [Ethan] gets hole card ['C9', 'H3'], current stack 1188
player [YangZ] gets hole card ['SQ', 'H5'], current stack 940
player [Finneas] gets hole card ['SK', 'H2'], current stack 860
Started the round 34
Street "preflop" started. (community card = [])
"YangZ" declared "fold:0"
"Finneas" declared "call:10"
"RaphaelPlayer" declared "raise:40"
"SichengZuo" declared "fold:0"
"HakulaPlayer" declared "fold:0"
"Ethan" declared "fold:0"
"Finneas" declared "fold:0"
"['RaphaelPlayer']" won the round 34 (stack = {'Zheng': 0, 'RaphaelPlayer': 1617, 'SichengZuo': 925, 'Yuchun': 0, 'HakulaPlayer': 2480, 'Ethan': 1188, 'YangZ': 940, 'Finneas': 850})
player [RaphaelPlayer] gets hole card ['S3', 'D7'], current stack 1617
player [SichengZuo] gets hole card ['C3', 'SQ'], current stack 925
player [HakulaPlayer] gets hole card ['H4', 'H5'], current stack 2480
player [Ethan] gets hole card ['HQ', 'S9'], current stack 1183
player [YangZ] gets hole card ['H8', 'CJ'], current stack 930
player [Finneas] gets hole card ['C5', 'DT'], current stack 850
Started the round 35
Street "preflop" started. (community card = [])
"Finneas" declared "call:10"
"RaphaelPlayer" declared "fold:0"
"SichengZuo" declared "fold:0"
"HakulaPlayer" declared "call:10"
"Ethan" declared "fold:0"
"YangZ" declared "fold:0"
Street "flop" started. (community card = ['H7', 'C7', 'DQ'])
"Finneas" declared "call:0"
"HakulaPlayer" declared "call:0"
Street "turn" started. (community card = ['H7', 'C7', 'DQ', 'S4'])
"Finneas" declared "call:0"
"HakulaPlayer" declared "raise:59"
"Finneas" declared "fold:0"
"['HakulaPlayer']" won the round 35 (stack = {'Zheng': 0, 'RaphaelPlayer': 1617, 'SichengZuo': 925, 'Yuchun': 0, 'HakulaPlayer': 2505, 'Ethan': 1183, 'YangZ': 930, 'Finneas': 840})
player [RaphaelPlayer] gets hole card ['H5', 'H7'], current stack 1617
player [SichengZuo] gets hole card ['S9', 'C5'], current stack 925
player [HakulaPlayer] gets hole card ['C7', 'H8'], current stack 2505
player [Ethan] gets hole card ['D8', 'H4'], current stack 1183
player [YangZ] gets hole card ['SK', 'D5'], current stack 925
player [Finneas] gets hole card ['HT', 'H9'], current stack 830
Started the round 36
Street "preflop" started. (community card = [])
"RaphaelPlayer" declared "fold:0"
"SichengZuo" declared "fold:0"
"HakulaPlayer" declared "fold:0"
"Ethan" declared "fold:0"
"YangZ" declared "fold:0"
"['Finneas']" won the round 36 (stack = {'Zheng': 0, 'RaphaelPlayer': 1617, 'SichengZuo': 925, 'Yuchun': 0, 'HakulaPlayer': 2505, 'Ethan': 1183, 'YangZ': 925, 'Finneas': 845})
player [RaphaelPlayer] gets hole card ['CT', 'C7'], current stack 1607
player [SichengZuo] gets hole card ['CK', 'S9'], current stack 925
player [HakulaPlayer] gets hole card ['H7', 'H5'], current stack 2505
player [Ethan] gets hole card ['H2', 'HJ'], current stack 1183
player [YangZ] gets hole card ['S7', 'S4'], current stack 925
player [Finneas] gets hole card ['CQ', 'D8'], current stack 840
Started the round 37
Street "preflop" started. (community card = [])
"SichengZuo" declared "fold:0"
"HakulaPlayer" declared "fold:0"
"Ethan" declared "fold:0"
"YangZ" declared "fold:0"
"Finneas" declared "call:10"
"RaphaelPlayer" declared "call:10"
Street "flop" started. (community card = ['D5', 'D6', 'H6'])
"Finneas" declared "call:0"
"RaphaelPlayer" declared "call:0"
Street "turn" started. (community card = ['D5', 'D6', 'H6', 'H9'])
"Finneas" declared "call:0"
"RaphaelPlayer" declared "call:0"
Street "river" started. (community card = ['D5', 'D6', 'H6', 'H9', 'SJ'])
"Finneas" declared "call:0"
"RaphaelPlayer" declared "call:0"
"['Finneas']" won the round 37 (stack = {'Zheng': 0, 'RaphaelPlayer': 1607, 'SichengZuo': 925, 'Yuchun': 0, 'HakulaPlayer': 2505, 'Ethan': 1183, 'YangZ': 925, 'Finneas': 855})
player [RaphaelPlayer] gets hole card ['D7', 'DJ'], current stack 1602
player [SichengZuo] gets hole card ['DK', 'CK'], current stack 915
player [HakulaPlayer] gets hole card ['D5', 'HA'], current stack 2505
player [Ethan] gets hole card ['S6', 'H3'], current stack 1183
player [YangZ] gets hole card ['S9', 'CA'], current stack 925
player [Finneas] gets hole card ['D8', 'DQ'], current stack 855
Started the round 38
Street "preflop" started. (community card = [])
"HakulaPlayer" declared "call:10"
"Ethan" declared "fold:0"
"YangZ" declared "fold:0"
"Finneas" declared "call:10"
"RaphaelPlayer" declared "call:10"
"SichengZuo" declared "raise:925"
"HakulaPlayer" declared "fold:0"
"Finneas" declared "fold:0"
"RaphaelPlayer" declared "fold:0"
"['SichengZuo']" won the round 38 (stack = {'Zheng': 0, 'RaphaelPlayer': 1597, 'SichengZuo': 955, 'Yuchun': 0, 'HakulaPlayer': 2495, 'Ethan': 1183, 'YangZ': 925, 'Finneas': 845})
player [RaphaelPlayer] gets hole card ['C4', 'H8'], current stack 1597
player [SichengZuo] gets hole card ['ST', 'DK'], current stack 950
player [HakulaPlayer] gets hole card ['S9', 'C5'], current stack 2485
player [Ethan] gets hole card ['S7', 'CA'], current stack 1183
player [YangZ] gets hole card ['D6', 'HT'], current stack 925
player [Finneas] gets hole card ['C8', 'DJ'], current stack 845
Started the round 39
Street "preflop" started. (community card = [])
"Ethan" declared "fold:0"
"YangZ" declared "fold:0"
"Finneas" declared "call:10"
"RaphaelPlayer" declared "fold:0"
"SichengZuo" declared "fold:0"
"HakulaPlayer" declared "call:10"
Street "flop" started. (community card = ['CK', 'S3', 'H3'])
"HakulaPlayer" declared "call:0"
"Finneas" declared "call:0"
Street "turn" started. (community card = ['CK', 'S3', 'H3', 'C9'])
"HakulaPlayer" declared "raise:43"
"Finneas" declared "fold:0"
"['HakulaPlayer']" won the round 39 (stack = {'Zheng': 0, 'RaphaelPlayer': 1597, 'SichengZuo': 950, 'Yuchun': 0, 'HakulaPlayer': 2510, 'Ethan': 1183, 'YangZ': 925, 'Finneas': 835})
player [RaphaelPlayer] gets hole card ['DT', 'D3'], current stack 1597
player [SichengZuo] gets hole card ['S2', 'ST'], current stack 950
player [HakulaPlayer] gets hole card ['CA', 'D4'], current stack 2505
player [Ethan] gets hole card ['D2', 'H9'], current stack 1173
player [YangZ] gets hole card ['D6', 'D7'], current stack 925
player [Finneas] gets hole card ['H2', 'C6'], current stack 835
Started the round 40
Street "preflop" started. (community card = [])
"YangZ" declared "fold:0"
"Finneas" declared "call:10"
"RaphaelPlayer" declared "fold:0"
"SichengZuo" declared "fold:0"
"HakulaPlayer" declared "call:10"
"Ethan" declared "fold:0"
Street "flop" started. (community card = ['C7', 'C5', 'C9'])
"HakulaPlayer" declared "call:0"
"Finneas" declared "call:0"
Street "turn" started. (community card = ['C7', 'C5', 'C9', 'S9'])
"HakulaPlayer" declared "call:0"
"Finneas" declared "call:0"
Street "river" started. (community card = ['C7', 'C5', 'C9', 'S9', 'H7'])
"HakulaPlayer" declared "raise:56"
"Finneas" declared "fold:0"
"['HakulaPlayer']" won the round 40 (stack = {'Zheng': 0, 'RaphaelPlayer': 1597, 'SichengZuo': 950, 'Yuchun': 0, 'HakulaPlayer': 2530, 'Ethan': 1173, 'YangZ': 925, 'Finneas': 825})
player [RaphaelPlayer] gets hole card ['SA', 'D7'], current stack 1597
player [SichengZuo] gets hole card ['HK', 'SQ'], current stack 950
player [HakulaPlayer] gets hole card ['HA', 'C8'], current stack 2530
player [Ethan] gets hole card ['CK', 'DT'], current stack 1168
player [YangZ] gets hole card ['H6', 'C2'], current stack 915
player [Finneas] gets hole card ['S6', 'D3'], current stack 825
Started the round 41
Street "preflop" started. (community card = [])
"Finneas" declared "call:10"
"RaphaelPlayer" declared "call:10"
"SichengZuo" declared "fold:0"
"HakulaPlayer" declared "raise:42"
"Ethan" declared "fold:0"
"YangZ" declared "fold:0"
"Finneas" declared "fold:0"
"RaphaelPlayer" declared "call:42"
Street "flop" started. (community card = ['S7', 'D5', 'S4'])
"RaphaelPlayer" declared "raise:119"
"HakulaPlayer" declared "fold:0"
"['RaphaelPlayer']" won the round 41 (stack = {'Zheng': 0, 'RaphaelPlayer': 1664, 'SichengZuo': 950, 'Yuchun': 0, 'HakulaPlayer': 2488, 'Ethan': 1168, 'YangZ': 915, 'Finneas': 815})
player [RaphaelPlayer] gets hole card ['S3', 'H2'], current stack 1664
player [SichengZuo] gets hole card ['CK', 'D3'], current stack 950
player [HakulaPlayer] gets hole card ['D4', 'HJ'], current stack 2488
player [Ethan] gets hole card ['HQ', 'C6'], current stack 1168
player [YangZ] gets hole card ['HK', 'DT'], current stack 910
player [Finneas] gets hole card ['CT', 'DA'], current stack 805
Started the round 42
Street "preflop" started. (community card = [])
"RaphaelPlayer" declared "fold:0"
"SichengZuo" declared "fold:0"
"HakulaPlayer" declared "fold:0"
"Ethan" declared "fold:0"
"YangZ" declared "fold:0"
"['Finneas']" won the round 42 (stack = {'Zheng': 0, 'RaphaelPlayer': 1664, 'SichengZuo': 950, 'Yuchun': 0, 'HakulaPlayer': 2488, 'Ethan': 1168, 'YangZ': 910, 'Finneas': 820})
player [RaphaelPlayer] gets hole card ['H2', 'D6'], current stack 1654
player [SichengZuo] gets hole card ['HA', 'DA'], current stack 950
player [HakulaPlayer] gets hole card ['C7', 'C9'], current stack 2488
player [Ethan] gets hole card ['H7', 'DJ'], current stack 1168
player [YangZ] gets hole card ['D8', 'S2'], current stack 910
player [Finneas] gets hole card ['SA', 'H4'], current stack 815
Started the round 43
Street "preflop" started. (community card = [])
"SichengZuo" declared "raise:950"
"HakulaPlayer" declared "fold:0"
"Ethan" declared "fold:0"
"YangZ" declared "fold:0"
"Finneas" declared "fold:0"
"RaphaelPlayer" declared "fold:0"
"['SichengZuo']" won the round 43 (stack = {'Zheng': 0, 'RaphaelPlayer': 1654, 'SichengZuo': 965, 'Yuchun': 0, 'HakulaPlayer': 2488, 'Ethan': 1168, 'YangZ': 910, 'Finneas': 815})
player [RaphaelPlayer] gets hole card ['S7', 'C2'], current stack 1649
player [SichengZuo] gets hole card ['DA', 'CJ'], current stack 955
player [HakulaPlayer] gets hole card ['C3', 'D2'], current stack 2488
player [Ethan] gets hole card ['HK', 'D8'], current stack 1168
player [YangZ] gets hole card ['SA', 'D5'], current stack 910
player [Finneas] gets hole card ['CT', 'H3'], current stack 815
Started the round 44
Street "preflop" started. (community card = [])
"HakulaPlayer" declared "fold:0"
"Ethan" declared "fold:0"
"YangZ" declared "fold:0"
"Finneas" declared "call:10"
"RaphaelPlayer" declared "fold:0"
"SichengZuo" declared "fold:0"
"['Finneas']" won the round 44 (stack = {'Zheng': 0, 'RaphaelPlayer': 1649, 'SichengZuo': 955, 'Yuchun': 0, 'HakulaPlayer': 2488, 'Ethan': 1168, 'YangZ': 910, 'Finneas': 830})
player [RaphaelPlayer] gets hole card ['CT', 'DA'], current stack 1649
player [SichengZuo] gets hole card ['H5', 'C2'], current stack 950
player [HakulaPlayer] gets hole card ['C9', 'H8'], current stack 2478
player [Ethan] gets hole card ['HT', 'CK'], current stack 1168
player [YangZ] gets hole card ['S7', 'D2'], current stack 910
player [Finneas] gets hole card ['D3', 'CA'], current stack 830
Started the round 45
Street "preflop" started. (community card = [])
"Ethan" declared "fold:0"
"YangZ" declared "fold:0"
"Finneas" declared "call:10"
"RaphaelPlayer" declared "raise:30"
"SichengZuo" declared "fold:0"
"HakulaPlayer" declared "fold:0"
"Finneas" declared "fold:0"
"['RaphaelPlayer']" won the round 45 (stack = {'Zheng': 0, 'RaphaelPlayer': 1674, 'SichengZuo': 950, 'Yuchun': 0, 'HakulaPlayer': 2478, 'Ethan': 1168, 'YangZ': 910, 'Finneas': 820})
player [RaphaelPlayer] gets hole card ['H3', 'D8'], current stack 1674
player [SichengZuo] gets hole card ['HQ', 'HA'], current stack 950
player [HakulaPlayer] gets hole card ['CT', 'C7'], current stack 2473
player [Ethan] gets hole card ['S9', 'H2'], current stack 1158
player [YangZ] gets hole card ['H8', 'SQ'], current stack 910
player [Finneas] gets hole card ['C8', 'D4'], current stack 820
Started the round 46
Street "preflop" started. (community card = [])
"YangZ" declared "fold:0"
"Finneas" declared "call:10"
"RaphaelPlayer" declared "fold:0"
"SichengZuo" declared "fold:0"
"HakulaPlayer" declared "call:10"
"Ethan" declared "fold:0"
Street "flop" started. (community card = ['HT', 'DK', 'SA'])
"HakulaPlayer" declared "call:0"
"Finneas" declared "call:0"
Street "turn" started. (community card = ['HT', 'DK', 'SA', 'D2'])
"HakulaPlayer" declared "call:0"
"Finneas" declared "call:0"
Street "river" started. (community card = ['HT', 'DK', 'SA', 'D2', 'DT'])
"HakulaPlayer" declared "raise:69"
"Finneas" declared "fold:0"
"['HakulaPlayer']" won the round 46 (stack = {'Zheng': 0, 'RaphaelPlayer': 1674, 'SichengZuo': 950, 'Yuchun': 0, 'HakulaPlayer': 2498, 'Ethan': 1158, 'YangZ': 910, 'Finneas': 810})
player [RaphaelPlayer] gets hole card ['SJ', 'S5'], current stack 1674
player [SichengZuo] gets hole card ['C7', 'S6'], current stack 950
player [HakulaPlayer] gets hole card ['S3', 'S4'], current stack 2498
player [Ethan] gets hole card ['D7', 'DJ'], current stack 1153
player [YangZ] gets hole card ['CT', 'H7'], current stack 900
player [Finneas] gets hole card ['ST', 'D3'], current stack 810
Started the round 47
Street "preflop" started. (community card = [])
"Finneas" declared "call:10"
"RaphaelPlayer" declared "fold:0"
"SichengZuo" declared "fold:0"
"HakulaPlayer" declared "call:10"
"Ethan" declared "fold:0"
"YangZ" declared "fold:0"
Street "flop" started. (community card = ['DA', 'D5', 'D2'])
"Finneas" declared "call:0"
"HakulaPlayer" declared "raise:80"
"Finneas" declared "fold:0"
"['HakulaPlayer']" won the round 47 (stack = {'Zheng': 0, 'RaphaelPlayer': 1674, 'SichengZuo': 950, 'Yuchun': 0, 'HakulaPlayer': 2523, 'Ethan': 1153, 'YangZ': 900, 'Finneas': 800})
player [RaphaelPlayer] gets hole card ['CK', 'C7'], current stack 1674
player [SichengZuo] gets hole card ['DK', 'HJ'], current stack 950
player [HakulaPlayer] gets hole card ['S3', 'H5'], current stack 2523
player [Ethan] gets hole card ['H4', 'CJ'], current stack 1153
player [YangZ] gets hole card ['C8', 'CA'], current stack 895
player [Finneas] gets hole card ['H7', 'D6'], current stack 790
Started the round 48
Street "preflop" started. (community card = [])
"RaphaelPlayer" declared "call:10"
"SichengZuo" declared "fold:0"
"HakulaPlayer" declared "call:10"
"Ethan" declared "fold:0"
"YangZ" declared "fold:0"
"Finneas" declared "call:10"
Street "flop" started. (community card = ['SA', 'D5', 'DQ'])
"Finneas" declared "call:0"
"RaphaelPlayer" declared "call:0"
"HakulaPlayer" declared "call:0"
Street "turn" started. (community card = ['SA', 'D5', 'DQ', 'S7'])
"Finneas" declared "call:0"
"RaphaelPlayer" declared "call:0"
"HakulaPlayer" declared "call:0"
Street "river" started. (community card = ['SA', 'D5', 'DQ', 'S7', 'DA'])
"Finneas" declared "call:0"
"RaphaelPlayer" declared "call:0"
"HakulaPlayer" declared "call:0"
"['RaphaelPlayer']" won the round 48 (stack = {'Zheng': 0, 'RaphaelPlayer': 1699, 'SichengZuo': 950, 'Yuchun': 0, 'HakulaPlayer': 2513, 'Ethan': 1153, 'YangZ': 895, 'Finneas': 790})
player [RaphaelPlayer] gets hole card ['C3', 'S9'], current stack 1689
player [SichengZuo] gets hole card ['ST', 'S6'], current stack 950
player [HakulaPlayer] gets hole card ['S8', 'S7'], current stack 2513
player [Ethan] gets hole card ['D9', 'S3'], current stack 1153
player [YangZ] gets hole card ['S2', 'C7'], current stack 895
player [Finneas] gets hole card ['HK', 'CQ'], current stack 785
Started the round 49
Street "preflop" started. (community card = [])
"SichengZuo" declared "fold:0"
"HakulaPlayer" declared "fold:0"
"Ethan" declared "fold:0"
"YangZ" declared "fold:0"
"Finneas" declared "call:10"
"RaphaelPlayer" declared "fold:0"
"['Finneas']" won the round 49 (stack = {'Zheng': 0, 'RaphaelPlayer': 1689, 'SichengZuo': 950, 'Yuchun': 0, 'HakulaPlayer': 2513, 'Ethan': 1153, 'YangZ': 895, 'Finneas': 800})
player [RaphaelPlayer] gets hole card ['C7', 'C2'], current stack 1684
player [SichengZuo] gets hole card ['C9', 'DJ'], current stack 940
player [HakulaPlayer] gets hole card ['DT', 'C6'], current stack 2513
player [Ethan] gets hole card ['CT', 'HK'], current stack 1153
player [YangZ] gets hole card ['H7', 'HT'], current stack 895
player [Finneas] gets hole card ['D4', 'S5'], current stack 800
Started the round 50
Street "preflop" started. (community card = [])
"HakulaPlayer" declared "fold:0"
"Ethan" declared "fold:0"
"YangZ" declared "fold:0"
"Finneas" declared "call:10"
"RaphaelPlayer" declared "fold:0"
"SichengZuo" declared "fold:0"
"['Finneas']" won the round 50 (stack = {'Zheng': 0, 'RaphaelPlayer': 1684, 'SichengZuo': 940, 'Yuchun': 0, 'HakulaPlayer': 2513, 'Ethan': 1153, 'YangZ': 895, 'Finneas': 815})

Game Results:
------------------------------------------------------------
Game 1:
Winner: HakulaPlayer (stack: 2513)
All players' stacks:
  Zheng: 0
  RaphaelPlayer: 1684
  SichengZuo: 940
  Yuchun: 0
  HakulaPlayer: 2513
  Ethan: 1153
  YangZ: 895
  Finneas: 815
------------------------------------------------------------
