player [Zheng] gets hole card ['DA', 'SK'], current stack 1000
player [RaphaelPlayer] gets hole card ['S6', 'SA'], current stack 995
player [SichengZuo] gets hole card ['CK', 'S4'], current stack 990
player [Yuchun] gets hole card ['CJ', 'S9'], current stack 1000
player [HakulaPlayer] gets hole card ['HK', 'D2'], current stack 1000
player [Ethan] gets hole card ['SQ', 'D4'], current stack 1000
player [YangZ] gets hole card ['C8', 'DK'], current stack 1000
player [Finneas] gets hole card ['H5', 'SJ'], current stack 1000
Started the round 1
Street "preflop" started. (community card = [])
"Yuchun" declared "fold:0"
"HakulaPlayer" declared "fold:0"
"Ethan" declared "fold:0"
"YangZ" declared "fold:0"
"Finneas" declared "call:10"
"Zheng" declared "call:10"
"RaphaelPlayer" declared "call:10"
"SichengZuo" declared "fold:0"
Street "flop" started. (community card = ['CQ', 'C7', 'C4'])
"RaphaelPlayer" declared "call:0"
"Finneas" declared "call:0"
"Zheng" declared "call:0"
Street "turn" started. (community card = ['CQ', 'C7', 'C4', 'DJ'])
"RaphaelPlayer" declared "call:0"
"Finneas" declared "call:0"
"Zheng" declared "call:0"
Street "river" started. (community card = ['CQ', 'C7', 'C4', 'DJ', 'DT'])
"RaphaelPlayer" declared "call:0"
"Finneas" declared "call:0"
"Zheng" declared "raise:990"
"RaphaelPlayer" declared "fold:0"
"Finneas" declared "fold:0"
"['Zheng']" won the round 1 (stack = {'Zheng': 1030, 'RaphaelPlayer': 990, 'SichengZuo': 990, 'Yuchun': 1000, 'HakulaPlayer': 1000, 'Ethan': 1000, 'YangZ': 1000, 'Finneas': 990})
player [Zheng] gets hole card ['D8', 'SQ'], current stack 1030
player [RaphaelPlayer] gets hole card ['CA', 'C7'], current stack 990
player [SichengZuo] gets hole card ['D5', 'H2'], current stack 985
player [Yuchun] gets hole card ['C5', 'D6'], current stack 990
player [HakulaPlayer] gets hole card ['C2', 'H3'], current stack 1000
player [Ethan] gets hole card ['DA', 'HT'], current stack 1000
player [YangZ] gets hole card ['S8', 'HK'], current stack 1000
player [Finneas] gets hole card ['H9', 'H5'], current stack 990
Started the round 2
Street "preflop" started. (community card = [])
"HakulaPlayer" declared "fold:0"
"Ethan" declared "call:10"
"YangZ" declared "fold:0"
"Finneas" declared "call:10"
"Zheng" declared "call:10"
"RaphaelPlayer" declared "call:10"
"SichengZuo" declared "fold:0"
"Yuchun" declared "fold:0"
Street "flop" started. (community card = ['CT', 'C4', 'H8'])
"Ethan" declared "call:0"
"Finneas" declared "call:0"
"Zheng" declared "call:0"
"RaphaelPlayer" declared "call:0"
Street "turn" started. (community card = ['CT', 'C4', 'H8', 'D9'])
"Ethan" declared "call:0"
"Finneas" declared "call:0"
"Zheng" declared "call:0"
"RaphaelPlayer" declared "call:0"
Street "river" started. (community card = ['CT', 'C4', 'H8', 'D9', 'C8'])
"Ethan" declared "call:0"
"Finneas" declared "call:0"
"Zheng" declared "call:0"
"RaphaelPlayer" declared "raise:65"
"Ethan" declared "call:65"
"Finneas" declared "fold:0"
"Zheng" declared "raise:575"
"RaphaelPlayer" declared "call:575"
"Ethan" declared "call:575"
"['RaphaelPlayer']" won the round 2 (stack = {'Zheng': 445, 'RaphaelPlayer': 2185, 'SichengZuo': 985, 'Yuchun': 990, 'HakulaPlayer': 1000, 'Ethan': 415, 'YangZ': 1000, 'Finneas': 980})
player [Zheng] gets hole card ['HQ', 'H8'], current stack 445
player [RaphaelPlayer] gets hole card ['D3', 'HJ'], current stack 2185
player [SichengZuo] gets hole card ['H9', 'CQ'], current stack 985
player [Yuchun] gets hole card ['DQ', 'C3'], current stack 985
player [HakulaPlayer] gets hole card ['D6', 'H3'], current stack 990
player [Ethan] gets hole card ['ST', 'H5'], current stack 415
player [YangZ] gets hole card ['HT', 'S6'], current stack 1000
player [Finneas] gets hole card ['SK', 'C2'], current stack 980
Started the round 3
Street "preflop" started. (community card = [])
"Ethan" declared "fold:0"
"YangZ" declared "fold:0"
"Finneas" declared "call:10"
"Zheng" declared "call:10"
"RaphaelPlayer" declared "fold:0"
"SichengZuo" declared "fold:0"
"Yuchun" declared "fold:0"
"HakulaPlayer" declared "call:10"
Street "flop" started. (community card = ['H6', 'S2', 'C6'])
"HakulaPlayer" declared "raise:39"
"Finneas" declared "fold:0"
"Zheng" declared "fold:0"
"['HakulaPlayer']" won the round 3 (stack = {'Zheng': 435, 'RaphaelPlayer': 2185, 'SichengZuo': 985, 'Yuchun': 985, 'HakulaPlayer': 1025, 'Ethan': 415, 'YangZ': 1000, 'Finneas': 970})
player [Zheng] gets hole card ['SQ', 'S6'], current stack 435
player [RaphaelPlayer] gets hole card ['C8', 'C7'], current stack 2185
player [SichengZuo] gets hole card ['H9', 'S7'], current stack 985
player [Yuchun] gets hole card ['DJ', 'ST'], current stack 985
player [HakulaPlayer] gets hole card ['DA', 'CK'], current stack 1020
player [Ethan] gets hole card ['H6', 'H2'], current stack 405
player [YangZ] gets hole card ['C9', 'HA'], current stack 1000
player [Finneas] gets hole card ['S3', 'HQ'], current stack 970
Started the round 4
Street "preflop" started. (community card = [])
"YangZ" declared "fold:0"
"Finneas" declared "call:10"
"Zheng" declared "call:10"
"RaphaelPlayer" declared "call:10"
"SichengZuo" declared "fold:0"
"Yuchun" declared "fold:0"
"HakulaPlayer" declared "call:10"
"Ethan" declared "fold:0"
Street "flop" started. (community card = ['SK', 'D4', 'HT'])
"HakulaPlayer" declared "call:0"
"Finneas" declared "call:0"
"Zheng" declared "call:0"
"RaphaelPlayer" declared "call:0"
Street "turn" started. (community card = ['SK', 'D4', 'HT', 'C3'])
"HakulaPlayer" declared "raise:42"
"Finneas" declared "fold:0"
"Zheng" declared "fold:0"
"RaphaelPlayer" declared "fold:0"
"['HakulaPlayer']" won the round 4 (stack = {'Zheng': 425, 'RaphaelPlayer': 2175, 'SichengZuo': 985, 'Yuchun': 985, 'HakulaPlayer': 1065, 'Ethan': 405, 'YangZ': 1000, 'Finneas': 960})
player [Zheng] gets hole card ['HJ', 'S4'], current stack 425
player [RaphaelPlayer] gets hole card ['C6', 'CJ'], current stack 2175
player [SichengZuo] gets hole card ['D6', 'D9'], current stack 985
player [Yuchun] gets hole card ['CK', 'D3'], current stack 985
player [HakulaPlayer] gets hole card ['H4', 'H3'], current stack 1065
player [Ethan] gets hole card ['S2', 'C2'], current stack 400
player [YangZ] gets hole card ['HQ', 'C4'], current stack 990
player [Finneas] gets hole card ['SQ', 'SK'], current stack 960
Started the round 5
Street "preflop" started. (community card = [])
"Finneas" declared "call:10"
"Zheng" declared "call:10"
"RaphaelPlayer" declared "call:10"
"SichengZuo" declared "fold:0"
"Yuchun" declared "fold:0"
"HakulaPlayer" declared "call:10"
"Ethan" declared "fold:0"
"YangZ" declared "fold:0"
Street "flop" started. (community card = ['H8', 'D7', 'H2'])
"Finneas" declared "call:0"
"Zheng" declared "call:0"
"RaphaelPlayer" declared "call:0"
"HakulaPlayer" declared "call:0"
Street "turn" started. (community card = ['H8', 'D7', 'H2', 'C3'])
"Finneas" declared "call:0"
"Zheng" declared "call:0"
"RaphaelPlayer" declared "call:0"
"HakulaPlayer" declared "call:0"
Street "river" started. (community card = ['H8', 'D7', 'H2', 'C3', 'CQ'])
"Finneas" declared "call:0"
"Zheng" declared "call:0"
"RaphaelPlayer" declared "call:0"
"HakulaPlayer" declared "call:0"
"['Finneas']" won the round 5 (stack = {'Zheng': 415, 'RaphaelPlayer': 2165, 'SichengZuo': 985, 'Yuchun': 985, 'HakulaPlayer': 1055, 'Ethan': 400, 'YangZ': 990, 'Finneas': 1005})
player [Zheng] gets hole card ['S3', 'D8'], current stack 415
player [RaphaelPlayer] gets hole card ['H7', 'HJ'], current stack 2165
player [SichengZuo] gets hole card ['H8', 'DA'], current stack 985
player [Yuchun] gets hole card ['SJ', 'C6'], current stack 985
player [HakulaPlayer] gets hole card ['CA', 'DK'], current stack 1055
player [Ethan] gets hole card ['D3', 'C8'], current stack 400
player [YangZ] gets hole card ['D9', 'HK'], current stack 985
player [Finneas] gets hole card ['C4', 'C2'], current stack 995
Started the round 6
Street "preflop" started. (community card = [])
"Zheng" declared "call:10"
"RaphaelPlayer" declared "fold:0"
"SichengZuo" declared "fold:0"
"Yuchun" declared "fold:0"
"HakulaPlayer" declared "raise:33"
"Ethan" declared "fold:0"
"YangZ" declared "fold:0"
"Finneas" declared "fold:0"
"Zheng" declared "fold:0"
"['HakulaPlayer']" won the round 6 (stack = {'Zheng': 405, 'RaphaelPlayer': 2165, 'SichengZuo': 985, 'Yuchun': 985, 'HakulaPlayer': 1080, 'Ethan': 400, 'YangZ': 985, 'Finneas': 995})
player [Zheng] gets hole card ['DA', 'HJ'], current stack 395
player [RaphaelPlayer] gets hole card ['SK', 'H6'], current stack 2165
player [SichengZuo] gets hole card ['S6', 'CA'], current stack 985
player [Yuchun] gets hole card ['D4', 'D6'], current stack 985
player [HakulaPlayer] gets hole card ['S3', 'CT'], current stack 1080
player [Ethan] gets hole card ['ST', 'C2'], current stack 400
player [YangZ] gets hole card ['DJ', 'CQ'], current stack 985
player [Finneas] gets hole card ['HQ', 'S7'], current stack 990
Started the round 7
Street "preflop" started. (community card = [])
"RaphaelPlayer" declared "call:10"
"SichengZuo" declared "fold:0"
"Yuchun" declared "fold:0"
"HakulaPlayer" declared "call:10"
"Ethan" declared "fold:0"
"YangZ" declared "fold:0"
"Finneas" declared "call:10"
"Zheng" declared "call:10"
Street "flop" started. (community card = ['DK', 'C9', 'H3'])
"Finneas" declared "call:0"
"Zheng" declared "call:0"
"RaphaelPlayer" declared "raise:50"
"HakulaPlayer" declared "fold:0"
"Finneas" declared "fold:0"
"Zheng" declared "fold:0"
"['RaphaelPlayer']" won the round 7 (stack = {'Zheng': 395, 'RaphaelPlayer': 2195, 'SichengZuo': 985, 'Yuchun': 985, 'HakulaPlayer': 1070, 'Ethan': 400, 'YangZ': 985, 'Finneas': 985})
player [Zheng] gets hole card ['DA', 'HQ'], current stack 390
player [RaphaelPlayer] gets hole card ['C8', 'C6'], current stack 2185
player [SichengZuo] gets hole card ['H9', 'SA'], current stack 985
player [Yuchun] gets hole card ['H5', 'CQ'], current stack 985
player [HakulaPlayer] gets hole card ['CK', 'CA'], current stack 1070
player [Ethan] gets hole card ['HT', 'D8'], current stack 400
player [YangZ] gets hole card ['S5', 'D5'], current stack 985
player [Finneas] gets hole card ['S9', 'C2'], current stack 985
Started the round 8
Street "preflop" started. (community card = [])
"SichengZuo" declared "fold:0"
"Yuchun" declared "fold:0"
"HakulaPlayer" declared "call:10"
"Ethan" declared "fold:0"
"YangZ" declared "fold:0"
"Finneas" declared "call:10"
"Zheng" declared "call:10"
"RaphaelPlayer" declared "fold:0"
Street "flop" started. (community card = ['D9', 'HJ', 'H4'])
"Zheng" declared "call:0"
"HakulaPlayer" declared "call:0"
"Finneas" declared "call:0"
Street "turn" started. (community card = ['D9', 'HJ', 'H4', 'H3'])
"Zheng" declared "call:0"
"HakulaPlayer" declared "call:0"
"Finneas" declared "call:0"
Street "river" started. (community card = ['D9', 'HJ', 'H4', 'H3', 'CJ'])
"Zheng" declared "call:0"
"HakulaPlayer" declared "call:0"
"Finneas" declared "call:0"
"['Finneas']" won the round 8 (stack = {'Zheng': 385, 'RaphaelPlayer': 2185, 'SichengZuo': 985, 'Yuchun': 985, 'HakulaPlayer': 1060, 'Ethan': 400, 'YangZ': 985, 'Finneas': 1015})
player [Zheng] gets hole card ['D7', 'HQ'], current stack 385
player [RaphaelPlayer] gets hole card ['ST', 'CT'], current stack 2180
player [SichengZuo] gets hole card ['CQ', 'CK'], current stack 975
player [Yuchun] gets hole card ['D9', 'C9'], current stack 985
player [HakulaPlayer] gets hole card ['DK', 'D4'], current stack 1060
player [Ethan] gets hole card ['S8', 'D3'], current stack 400
player [YangZ] gets hole card ['C3', 'H7'], current stack 985
player [Finneas] gets hole card ['S2', 'C7'], current stack 1015
Started the round 9
Street "preflop" started. (community card = [])
"Yuchun" declared "fold:0"
"HakulaPlayer" declared "fold:0"
"Ethan" declared "fold:0"
"YangZ" declared "fold:0"
"Finneas" declared "call:10"
"Zheng" declared "call:10"
"RaphaelPlayer" declared "raise:40"
"SichengZuo" declared "fold:0"
"Finneas" declared "fold:0"
"Zheng" declared "fold:0"
"['RaphaelPlayer']" won the round 9 (stack = {'Zheng': 375, 'RaphaelPlayer': 2215, 'SichengZuo': 975, 'Yuchun': 985, 'HakulaPlayer': 1060, 'Ethan': 400, 'YangZ': 985, 'Finneas': 1005})
player [Zheng] gets hole card ['C8', 'H4'], current stack 375
player [RaphaelPlayer] gets hole card ['CK', 'DT'], current stack 2215
player [SichengZuo] gets hole card ['HJ', 'C5'], current stack 970
player [Yuchun] gets hole card ['C4', 'SJ'], current stack 975
player [HakulaPlayer] gets hole card ['C7', 'CQ'], current stack 1060
player [Ethan] gets hole card ['CJ', 'H7'], current stack 400
player [YangZ] gets hole card ['S6', 'S5'], current stack 985
player [Finneas] gets hole card ['D5', 'H2'], current stack 1005
Started the round 10
Street "preflop" started. (community card = [])
"HakulaPlayer" declared "fold:0"
"Ethan" declared "fold:0"
"YangZ" declared "fold:0"
"Finneas" declared "call:10"
"Zheng" declared "call:10"
"RaphaelPlayer" declared "call:10"
"SichengZuo" declared "fold:0"
"Yuchun" declared "call:10"
Street "flop" started. (community card = ['D2', 'DJ', 'C2'])
"Yuchun" declared "call:0"
"Finneas" declared "raise:502"
"Zheng" declared "fold:0"
"RaphaelPlayer" declared "fold:0"
"Yuchun" declared "call:502"
Street "turn" started. (community card = ['D2', 'DJ', 'C2', 'HQ'])
"Yuchun" declared "call:0"
"Finneas" declared "raise:251"
"Yuchun" declared "call:251"
Street "river" started. (community card = ['D2', 'DJ', 'C2', 'HQ', 'H3'])
"Yuchun" declared "call:0"
"Finneas" declared "raise:126"
"Yuchun" declared "call:126"
"['Finneas']" won the round 10 (stack = {'Zheng': 365, 'RaphaelPlayer': 2205, 'SichengZuo': 970, 'Yuchun': 96, 'HakulaPlayer': 1060, 'Ethan': 400, 'YangZ': 985, 'Finneas': 1919})
player [Zheng] gets hole card ['H8', 'H4'], current stack 365
player [RaphaelPlayer] gets hole card ['CQ', 'D3'], current stack 2205
player [SichengZuo] gets hole card ['D6', 'S3'], current stack 970
player [Yuchun] gets hole card ['DJ', 'SK'], current stack 91
player [HakulaPlayer] gets hole card ['SQ', 'S8'], current stack 1050
player [Ethan] gets hole card ['S7', 'C8'], current stack 400
player [YangZ] gets hole card ['SA', 'HK'], current stack 985
player [Finneas] gets hole card ['CJ', 'DT'], current stack 1919
Started the round 11
Street "preflop" started. (community card = [])
"Ethan" declared "fold:0"
"YangZ" declared "fold:0"
"Finneas" declared "call:10"
"Zheng" declared "call:10"
"RaphaelPlayer" declared "call:10"
"SichengZuo" declared "fold:0"
"Yuchun" declared "call:10"
"HakulaPlayer" declared "call:10"
Street "flop" started. (community card = ['DK', 'ST', 'S4'])
"Yuchun" declared "call:0"
"HakulaPlayer" declared "call:0"
"Finneas" declared "call:0"
"Zheng" declared "call:0"
"RaphaelPlayer" declared "call:0"
Street "turn" started. (community card = ['DK', 'ST', 'S4', 'C6'])
"Yuchun" declared "call:0"
"HakulaPlayer" declared "call:0"
"Finneas" declared "call:0"
"Zheng" declared "call:0"
"RaphaelPlayer" declared "call:0"
Street "river" started. (community card = ['DK', 'ST', 'S4', 'C6', 'C3'])
"Yuchun" declared "call:0"
"HakulaPlayer" declared "call:0"
"Finneas" declared "call:0"
"Zheng" declared "call:0"
"RaphaelPlayer" declared "call:0"
"['Yuchun']" won the round 11 (stack = {'Zheng': 355, 'RaphaelPlayer': 2195, 'SichengZuo': 970, 'Yuchun': 136, 'HakulaPlayer': 1050, 'Ethan': 400, 'YangZ': 985, 'Finneas': 1909})
player [Zheng] gets hole card ['H5', 'H2'], current stack 355
player [RaphaelPlayer] gets hole card ['C2', 'C9'], current stack 2195
player [SichengZuo] gets hole card ['S7', 'CQ'], current stack 970
player [Yuchun] gets hole card ['S9', 'CK'], current stack 136
player [HakulaPlayer] gets hole card ['SJ', 'H9'], current stack 1045
player [Ethan] gets hole card ['C8', 'S6'], current stack 390
player [YangZ] gets hole card ['D7', 'C7'], current stack 985
player [Finneas] gets hole card ['HK', 'C4'], current stack 1909
Started the round 12
Street "preflop" started. (community card = [])
"YangZ" declared "fold:0"
"Finneas" declared "call:10"
"Zheng" declared "call:10"
"RaphaelPlayer" declared "fold:0"
"SichengZuo" declared "fold:0"
"Yuchun" declared "call:10"
"HakulaPlayer" declared "call:10"
"Ethan" declared "fold:0"
Street "flop" started. (community card = ['CJ', 'S2', 'DA'])
"HakulaPlayer" declared "call:0"
"Finneas" declared "call:0"
"Zheng" declared "call:0"
"Yuchun" declared "call:0"
Street "turn" started. (community card = ['CJ', 'S2', 'DA', 'H3'])
"HakulaPlayer" declared "call:0"
"Finneas" declared "call:0"
"Zheng" declared "call:0"
"Yuchun" declared "call:0"
Street "river" started. (community card = ['CJ', 'S2', 'DA', 'H3', 'C3'])
"HakulaPlayer" declared "call:0"
"Finneas" declared "call:0"
"Zheng" declared "call:0"
"Yuchun" declared "call:0"
"['HakulaPlayer']" won the round 12 (stack = {'Zheng': 345, 'RaphaelPlayer': 2195, 'SichengZuo': 970, 'Yuchun': 126, 'HakulaPlayer': 1090, 'Ethan': 390, 'YangZ': 985, 'Finneas': 1899})
player [Zheng] gets hole card ['S4', 'C2'], current stack 345
player [RaphaelPlayer] gets hole card ['SJ', 'D4'], current stack 2195
player [SichengZuo] gets hole card ['DA', 'C8'], current stack 970
player [Yuchun] gets hole card ['D7', 'HQ'], current stack 126
player [HakulaPlayer] gets hole card ['SQ', 'CJ'], current stack 1090
player [Ethan] gets hole card ['D2', 'H4'], current stack 385
player [YangZ] gets hole card ['CT', 'D5'], current stack 975
player [Finneas] gets hole card ['HA', 'CQ'], current stack 1899
Started the round 13
Street "preflop" started. (community card = [])
"Finneas" declared "raise:957"
"Zheng" declared "fold:0"
"RaphaelPlayer" declared "fold:0"
"SichengZuo" declared "fold:0"
"Yuchun" declared "fold:0"
"HakulaPlayer" declared "fold:0"
"Ethan" declared "fold:0"
"YangZ" declared "fold:0"
"['Finneas']" won the round 13 (stack = {'Zheng': 345, 'RaphaelPlayer': 2195, 'SichengZuo': 970, 'Yuchun': 126, 'HakulaPlayer': 1090, 'Ethan': 385, 'YangZ': 975, 'Finneas': 1914})
player [Zheng] gets hole card ['S4', 'C8'], current stack 345
player [RaphaelPlayer] gets hole card ['SJ', 'S2'], current stack 2195
player [SichengZuo] gets hole card ['DT', 'D3'], current stack 970
player [Yuchun] gets hole card ['C3', 'C9'], current stack 126
player [HakulaPlayer] gets hole card ['ST', 'D5'], current stack 1090
player [Ethan] gets hole card ['C6', 'H3'], current stack 385
player [YangZ] gets hole card ['H6', 'SA'], current stack 970
player [Finneas] gets hole card ['HT', 'CK'], current stack 1904
Started the round 14
Street "preflop" started. (community card = [])
"Zheng" declared "call:10"
"RaphaelPlayer" declared "call:10"
"SichengZuo" declared "fold:0"
"Yuchun" declared "call:10"
"HakulaPlayer" declared "call:10"
"Ethan" declared "fold:0"
"YangZ" declared "fold:0"
"Finneas" declared "call:10"
Street "flop" started. (community card = ['S5', 'C5', 'D9'])
"Finneas" declared "call:0"
"Zheng" declared "call:0"
"RaphaelPlayer" declared "call:0"
"Yuchun" declared "call:0"
"HakulaPlayer" declared "raise:86"
"Finneas" declared "fold:0"
"Zheng" declared "fold:0"
"RaphaelPlayer" declared "fold:0"
"Yuchun" declared "call:86"
Street "turn" started. (community card = ['S5', 'C5', 'D9', 'D7'])
"Yuchun" declared "raise:40"
"['HakulaPlayer']" won the round 14 (stack = {'Zheng': 335, 'RaphaelPlayer': 2185, 'SichengZuo': 970, 'Yuchun': 30, 'HakulaPlayer': 1221, 'Ethan': 385, 'YangZ': 970, 'Finneas': 1904})
player [Zheng] gets hole card ['D2', 'H5'], current stack 325
player [RaphaelPlayer] gets hole card ['C5', 'HQ'], current stack 2185
player [SichengZuo] gets hole card ['HK', 'S8'], current stack 970
player [Yuchun] gets hole card ['C3', 'C4'], current stack 30
player [HakulaPlayer] gets hole card ['H8', 'HA'], current stack 1221
player [Ethan] gets hole card ['SA', 'S7'], current stack 385
player [YangZ] gets hole card ['ST', 'H3'], current stack 970
player [Finneas] gets hole card ['C7', 'CJ'], current stack 1899
Started the round 15
Street "preflop" started. (community card = [])
"RaphaelPlayer" declared "fold:0"
"SichengZuo" declared "fold:0"
"Yuchun" declared "call:10"
"HakulaPlayer" declared "raise:36"
"Ethan" declared "fold:0"
"YangZ" declared "fold:0"
"Finneas" declared "fold:0"
"Zheng" declared "fold:0"
"Yuchun" declared "call:36"
Street "flop" started. (community card = ['H9', 'SJ', 'H7'])
Street "turn" started. (community card = ['H9', 'SJ', 'H7', 'S4'])
Street "river" started. (community card = ['H9', 'SJ', 'H7', 'S4', 'C2'])
"['Yuchun']" won the round 15 (stack = {'Zheng': 325, 'RaphaelPlayer': 2185, 'SichengZuo': 970, 'Yuchun': 75, 'HakulaPlayer': 1191, 'Ethan': 385, 'YangZ': 970, 'Finneas': 1899})
player [Zheng] gets hole card ['H6', 'D3'], current stack 320
player [RaphaelPlayer] gets hole card ['D9', 'S4'], current stack 2175
player [SichengZuo] gets hole card ['H7', 'H9'], current stack 970
player [Yuchun] gets hole card ['D7', 'CA'], current stack 75
player [HakulaPlayer] gets hole card ['C9', 'S2'], current stack 1191
player [Ethan] gets hole card ['S8', 'DQ'], current stack 385
player [YangZ] gets hole card ['C3', 'ST'], current stack 970
player [Finneas] gets hole card ['S5', 'H3'], current stack 1899
Started the round 16
Street "preflop" started. (community card = [])
"SichengZuo" declared "fold:0"
"Yuchun" declared "call:10"
"HakulaPlayer" declared "call:10"
"Ethan" declared "fold:0"
"YangZ" declared "fold:0"
"Finneas" declared "call:10"
"Zheng" declared "call:10"
"RaphaelPlayer" declared "fold:0"
Street "flop" started. (community card = ['H2', 'S6', 'S9'])
"Zheng" declared "call:0"
"Yuchun" declared "call:0"
"HakulaPlayer" declared "raise:59"
"Finneas" declared "fold:0"
"Zheng" declared "fold:0"
"Yuchun" declared "call:59"
Street "turn" started. (community card = ['H2', 'S6', 'S9', 'SK'])
"Yuchun" declared "call:0"
"HakulaPlayer" declared "raise:229"
"Yuchun" declared "fold:0"
"['HakulaPlayer']" won the round 16 (stack = {'Zheng': 315, 'RaphaelPlayer': 2175, 'SichengZuo': 970, 'Yuchun': 6, 'HakulaPlayer': 1290, 'Ethan': 385, 'YangZ': 970, 'Finneas': 1889})
player [Zheng] gets hole card ['CA', 'S2'], current stack 315
player [RaphaelPlayer] gets hole card ['S6', 'C5'], current stack 2170
player [SichengZuo] gets hole card ['D8', 'S9'], current stack 960
player [Yuchun] gets hole card ['C2', 'HA'], current stack 6
player [HakulaPlayer] gets hole card ['D5', 'CT'], current stack 1290
player [Ethan] gets hole card ['C6', 'H4'], current stack 385
player [YangZ] gets hole card ['D9', 'H6'], current stack 970
player [Finneas] gets hole card ['CJ', 'DQ'], current stack 1889
Started the round 17
Street "preflop" started. (community card = [])
"Yuchun" declared "call:10"
"HakulaPlayer" declared "call:10"
"Ethan" declared "fold:0"
"YangZ" declared "fold:0"
"Finneas" declared "call:10"
"Zheng" declared "call:10"
"RaphaelPlayer" declared "fold:0"
"SichengZuo" declared "fold:0"
Street "flop" started. (community card = ['DJ', 'C9', 'HJ'])
"HakulaPlayer" declared "call:0"
"Finneas" declared "raise:944"
"Zheng" declared "fold:0"
"HakulaPlayer" declared "fold:0"
Street "turn" started. (community card = ['DJ', 'C9', 'HJ', 'H9'])
Street "river" started. (community card = ['DJ', 'C9', 'HJ', 'H9', 'H3'])
"['Finneas']" won the round 17 (stack = {'Zheng': 305, 'RaphaelPlayer': 2170, 'SichengZuo': 960, 'Yuchun': 0, 'HakulaPlayer': 1280, 'Ethan': 385, 'YangZ': 970, 'Finneas': 1930})
player [Zheng] gets hole card ['C4', 'S8'], current stack 305
player [RaphaelPlayer] gets hole card ['DK', 'HK'], current stack 2170
player [SichengZuo] gets hole card ['H3', 'HA'], current stack 955
player [HakulaPlayer] gets hole card ['D4', 'DT'], current stack 1270
player [Ethan] gets hole card ['S7', 'H5'], current stack 385
player [YangZ] gets hole card ['D7', 'DA'], current stack 970
player [Finneas] gets hole card ['H4', 'D8'], current stack 1930
Started the round 18
Street "preflop" started. (community card = [])
"Ethan" declared "fold:0"
"YangZ" declared "fold:0"
"Finneas" declared "call:10"
"Zheng" declared "call:10"
"RaphaelPlayer" declared "raise:40"
"SichengZuo" declared "fold:0"
"HakulaPlayer" declared "fold:0"
"Finneas" declared "fold:0"
"Zheng" declared "fold:0"
"['RaphaelPlayer']" won the round 18 (stack = {'Zheng': 295, 'RaphaelPlayer': 2205, 'SichengZuo': 955, 'Yuchun': 0, 'HakulaPlayer': 1270, 'Ethan': 385, 'YangZ': 970, 'Finneas': 1920})
player [Zheng] gets hole card ['H2', 'H4'], current stack 295
player [RaphaelPlayer] gets hole card ['H9', 'CJ'], current stack 2205
player [SichengZuo] gets hole card ['H6', 'S5'], current stack 955
player [HakulaPlayer] gets hole card ['C8', 'C6'], current stack 1265
player [Ethan] gets hole card ['D9', 'HJ'], current stack 375
player [YangZ] gets hole card ['S9', 'C9'], current stack 970
player [Finneas] gets hole card ['D4', 'H7'], current stack 1920
Started the round 19
Street "preflop" started. (community card = [])
"YangZ" declared "fold:0"
"Finneas" declared "call:10"
"Zheng" declared "call:10"
"RaphaelPlayer" declared "call:10"
"SichengZuo" declared "fold:0"
"HakulaPlayer" declared "call:10"
"Ethan" declared "fold:0"
Street "flop" started. (community card = ['HQ', 'S7', 'S3'])
"HakulaPlayer" declared "call:0"
"Finneas" declared "call:0"
"Zheng" declared "call:0"
"RaphaelPlayer" declared "call:0"
Street "turn" started. (community card = ['HQ', 'S7', 'S3', 'DA'])
"HakulaPlayer" declared "call:0"
"Finneas" declared "call:0"
"Zheng" declared "call:0"
"RaphaelPlayer" declared "call:0"
Street "river" started. (community card = ['HQ', 'S7', 'S3', 'DA', 'HA'])
"HakulaPlayer" declared "call:0"
"Finneas" declared "call:0"
"Zheng" declared "call:0"
"RaphaelPlayer" declared "call:0"
"['Finneas']" won the round 19 (stack = {'Zheng': 285, 'RaphaelPlayer': 2195, 'SichengZuo': 955, 'Yuchun': 0, 'HakulaPlayer': 1260, 'Ethan': 375, 'YangZ': 970, 'Finneas': 1960})
player [Zheng] gets hole card ['ST', 'SJ'], current stack 285
player [RaphaelPlayer] gets hole card ['S5', 'CA'], current stack 2195
player [SichengZuo] gets hole card ['H2', 'DQ'], current stack 955
player [HakulaPlayer] gets hole card ['C4', 'C2'], current stack 1260
player [Ethan] gets hole card ['H7', 'D4'], current stack 370
player [YangZ] gets hole card ['CK', 'D9'], current stack 960
player [Finneas] gets hole card ['H8', 'S3'], current stack 1960
Started the round 20
Street "preflop" started. (community card = [])
"Finneas" declared "call:10"
"Zheng" declared "call:10"
"RaphaelPlayer" declared "call:10"
"SichengZuo" declared "fold:0"
"HakulaPlayer" declared "call:10"
"Ethan" declared "fold:0"
"YangZ" declared "fold:0"
Street "flop" started. (community card = ['DJ', 'D7', 'C5'])
"Finneas" declared "call:0"
"Zheng" declared "call:0"
"RaphaelPlayer" declared "call:0"
"HakulaPlayer" declared "call:0"
Street "turn" started. (community card = ['DJ', 'D7', 'C5', 'D2'])
"Finneas" declared "call:0"
"Zheng" declared "call:0"
"RaphaelPlayer" declared "call:0"
"HakulaPlayer" declared "call:0"
Street "river" started. (community card = ['DJ', 'D7', 'C5', 'D2', 'H6'])
"Finneas" declared "call:0"
"Zheng" declared "call:0"
"RaphaelPlayer" declared "call:0"
"HakulaPlayer" declared "call:0"
"['Zheng']" won the round 20 (stack = {'Zheng': 330, 'RaphaelPlayer': 2185, 'SichengZuo': 955, 'Yuchun': 0, 'HakulaPlayer': 1250, 'Ethan': 370, 'YangZ': 960, 'Finneas': 1950})
player [Zheng] gets hole card ['CJ', 'C2'], current stack 330
player [RaphaelPlayer] gets hole card ['C3', 'SA'], current stack 2185
player [SichengZuo] gets hole card ['C5', 'H3'], current stack 955
player [HakulaPlayer] gets hole card ['D2', 'DT'], current stack 1250
player [Ethan] gets hole card ['D9', 'SJ'], current stack 370
player [YangZ] gets hole card ['H7', 'S5'], current stack 955
player [Finneas] gets hole card ['ST', 'HT'], current stack 1940
Started the round 21
Street "preflop" started. (community card = [])
"Zheng" declared "call:10"
"RaphaelPlayer" declared "call:10"
"SichengZuo" declared "fold:0"
"HakulaPlayer" declared "call:10"
"Ethan" declared "fold:0"
"YangZ" declared "fold:0"
"Finneas" declared "call:10"
Street "flop" started. (community card = ['HQ', 'DK', 'H9'])
"Finneas" declared "call:0"
"Zheng" declared "call:0"
"RaphaelPlayer" declared "call:0"
"HakulaPlayer" declared "call:0"
Street "turn" started. (community card = ['HQ', 'DK', 'H9', 'S6'])
"Finneas" declared "call:0"
"Zheng" declared "call:0"
"RaphaelPlayer" declared "call:0"
"HakulaPlayer" declared "call:0"
Street "river" started. (community card = ['HQ', 'DK', 'H9', 'S6', 'S8'])
"Finneas" declared "call:0"
"Zheng" declared "call:0"
"RaphaelPlayer" declared "call:0"
"HakulaPlayer" declared "call:0"
"['Finneas']" won the round 21 (stack = {'Zheng': 320, 'RaphaelPlayer': 2175, 'SichengZuo': 955, 'Yuchun': 0, 'HakulaPlayer': 1240, 'Ethan': 370, 'YangZ': 955, 'Finneas': 1985})
player [Zheng] gets hole card ['CJ', 'H6'], current stack 310
player [RaphaelPlayer] gets hole card ['D7', 'D9'], current stack 2175
player [SichengZuo] gets hole card ['HQ', 'CQ'], current stack 955
player [HakulaPlayer] gets hole card ['S9', 'H7'], current stack 1240
player [Ethan] gets hole card ['CA', 'SJ'], current stack 370
player [YangZ] gets hole card ['H2', 'ST'], current stack 955
player [Finneas] gets hole card ['D6', 'C9'], current stack 1980
Started the round 22
Street "preflop" started. (community card = [])
"RaphaelPlayer" declared "call:10"
"SichengZuo" declared "fold:0"
"HakulaPlayer" declared "call:10"
"Ethan" declared "raise:55"
"YangZ" declared "fold:0"
"Finneas" declared "fold:0"
"Zheng" declared "call:55"
"RaphaelPlayer" declared "call:55"
"HakulaPlayer" declared "call:55"
Street "flop" started. (community card = ['HJ', 'S2', 'H3'])
"Zheng" declared "call:0"
"RaphaelPlayer" declared "call:0"
"HakulaPlayer" declared "call:0"
"Ethan" declared "call:0"
Street "turn" started. (community card = ['HJ', 'S2', 'H3', 'SQ'])
"Zheng" declared "call:0"
"RaphaelPlayer" declared "call:0"
"HakulaPlayer" declared "call:0"
"Ethan" declared "call:0"
Street "river" started. (community card = ['HJ', 'S2', 'H3', 'SQ', 'S5'])
"Zheng" declared "call:0"
"RaphaelPlayer" declared "call:0"
"HakulaPlayer" declared "call:0"
"Ethan" declared "call:0"
"['Ethan']" won the round 22 (stack = {'Zheng': 265, 'RaphaelPlayer': 2120, 'SichengZuo': 955, 'Yuchun': 0, 'HakulaPlayer': 1185, 'Ethan': 540, 'YangZ': 955, 'Finneas': 1980})
player [Zheng] gets hole card ['DA', 'S3'], current stack 260
player [RaphaelPlayer] gets hole card ['D9', 'C3'], current stack 2110
player [SichengZuo] gets hole card ['CQ', 'H5'], current stack 955
player [HakulaPlayer] gets hole card ['D2', 'HK'], current stack 1185
player [Ethan] gets hole card ['S5', 'SQ'], current stack 540
player [YangZ] gets hole card ['C8', 'H9'], current stack 955
player [Finneas] gets hole card ['C5', 'D6'], current stack 1980
Started the round 23
Street "preflop" started. (community card = [])
"SichengZuo" declared "fold:0"
"HakulaPlayer" declared "fold:0"
"Ethan" declared "fold:0"
"YangZ" declared "fold:0"
"Finneas" declared "call:10"
"Zheng" declared "call:10"
"RaphaelPlayer" declared "fold:0"
Street "flop" started. (community card = ['H7', 'HQ', 'DJ'])
"Zheng" declared "call:0"
"Finneas" declared "call:0"
Street "turn" started. (community card = ['H7', 'HQ', 'DJ', 'HT'])
"Zheng" declared "call:0"
"Finneas" declared "call:0"
Street "river" started. (community card = ['H7', 'HQ', 'DJ', 'HT', 'S2'])
"Zheng" declared "call:0"
"Finneas" declared "call:0"
"['Zheng']" won the round 23 (stack = {'Zheng': 285, 'RaphaelPlayer': 2110, 'SichengZuo': 955, 'Yuchun': 0, 'HakulaPlayer': 1185, 'Ethan': 540, 'YangZ': 955, 'Finneas': 1970})
player [Zheng] gets hole card ['DQ', 'S7'], current stack 285
player [RaphaelPlayer] gets hole card ['ST', 'S8'], current stack 2105
player [SichengZuo] gets hole card ['HK', 'C3'], current stack 945
player [HakulaPlayer] gets hole card ['D4', 'S5'], current stack 1185
player [Ethan] gets hole card ['CQ', 'D2'], current stack 540
player [YangZ] gets hole card ['D5', 'S4'], current stack 955
player [Finneas] gets hole card ['HA', 'HJ'], current stack 1970
Started the round 24
Street "preflop" started. (community card = [])
"HakulaPlayer" declared "fold:0"
"Ethan" declared "fold:0"
"YangZ" declared "fold:0"
"Finneas" declared "call:10"
"Zheng" declared "call:10"
"RaphaelPlayer" declared "call:10"
"SichengZuo" declared "fold:0"
Street "flop" started. (community card = ['SQ', 'H2', 'HQ'])
"RaphaelPlayer" declared "call:0"
"Finneas" declared "call:0"
"Zheng" declared "raise:142"
"RaphaelPlayer" declared "fold:0"
"Finneas" declared "fold:0"
"['Zheng']" won the round 24 (stack = {'Zheng': 315, 'RaphaelPlayer': 2100, 'SichengZuo': 945, 'Yuchun': 0, 'HakulaPlayer': 1185, 'Ethan': 540, 'YangZ': 955, 'Finneas': 1960})
player [Zheng] gets hole card ['D4', 'SA'], current stack 315
player [RaphaelPlayer] gets hole card ['CA', 'S2'], current stack 2100
player [SichengZuo] gets hole card ['S6', 'D9'], current stack 940
player [HakulaPlayer] gets hole card ['C4', 'C9'], current stack 1175
player [Ethan] gets hole card ['HJ', 'S4'], current stack 540
player [YangZ] gets hole card ['S9', 'C5'], current stack 955
player [Finneas] gets hole card ['C2', 'CK'], current stack 1960
Started the round 25
Street "preflop" started. (community card = [])
"Ethan" declared "fold:0"
"YangZ" declared "fold:0"
"Finneas" declared "call:10"
"Zheng" declared "call:10"
"RaphaelPlayer" declared "call:10"
"SichengZuo" declared "fold:0"
"HakulaPlayer" declared "call:10"
Street "flop" started. (community card = ['D3', 'H6', 'S5'])
"HakulaPlayer" declared "call:0"
"Finneas" declared "call:0"
"Zheng" declared "call:0"
"RaphaelPlayer" declared "call:0"
Street "turn" started. (community card = ['D3', 'H6', 'S5', 'SK'])
"HakulaPlayer" declared "call:0"
"Finneas" declared "call:0"
"Zheng" declared "call:0"
"RaphaelPlayer" declared "call:0"
Street "river" started. (community card = ['D3', 'H6', 'S5', 'SK', 'H3'])
"HakulaPlayer" declared "call:0"
"Finneas" declared "call:0"
"Zheng" declared "call:0"
"RaphaelPlayer" declared "call:0"
"['Finneas']" won the round 25 (stack = {'Zheng': 305, 'RaphaelPlayer': 2090, 'SichengZuo': 940, 'Yuchun': 0, 'HakulaPlayer': 1175, 'Ethan': 540, 'YangZ': 955, 'Finneas': 1995})
player [Zheng] gets hole card ['H7', 'H4'], current stack 305
player [RaphaelPlayer] gets hole card ['S9', 'D6'], current stack 2090
player [SichengZuo] gets hole card ['CQ', 'HJ'], current stack 940
player [HakulaPlayer] gets hole card ['H3', 'S2'], current stack 1170
player [Ethan] gets hole card ['S5', 'HT'], current stack 530
player [YangZ] gets hole card ['S4', 'CT'], current stack 955
player [Finneas] gets hole card ['D9', 'C8'], current stack 1995
Started the round 26
Street "preflop" started. (community card = [])
"YangZ" declared "fold:0"
"Finneas" declared "call:10"
"Zheng" declared "call:10"
"RaphaelPlayer" declared "fold:0"
"SichengZuo" declared "fold:0"
"HakulaPlayer" declared "call:10"
"Ethan" declared "fold:0"
Street "flop" started. (community card = ['S8', 'D2', 'C2'])
"HakulaPlayer" declared "raise:62"
"Finneas" declared "fold:0"
"Zheng" declared "call:62"
Street "turn" started. (community card = ['S8', 'D2', 'C2', 'HQ'])
"HakulaPlayer" declared "raise:324"
"Zheng" declared "fold:0"
"['HakulaPlayer']" won the round 26 (stack = {'Zheng': 233, 'RaphaelPlayer': 2090, 'SichengZuo': 940, 'Yuchun': 0, 'HakulaPlayer': 1267, 'Ethan': 530, 'YangZ': 955, 'Finneas': 1985})
player [Zheng] gets hole card ['C9', 'H3'], current stack 233
player [RaphaelPlayer] gets hole card ['S4', 'SQ'], current stack 2090
player [SichengZuo] gets hole card ['D7', 'SA'], current stack 940
player [HakulaPlayer] gets hole card ['H7', 'S6'], current stack 1267
player [Ethan] gets hole card ['C4', 'SK'], current stack 525
player [YangZ] gets hole card ['D5', 'S2'], current stack 945
player [Finneas] gets hole card ['SJ', 'S5'], current stack 1985
Started the round 27
Street "preflop" started. (community card = [])
"Finneas" declared "call:10"
"Zheng" declared "call:10"
"RaphaelPlayer" declared "call:10"
"SichengZuo" declared "fold:0"
"HakulaPlayer" declared "call:10"
"Ethan" declared "fold:0"
"YangZ" declared "fold:0"
Street "flop" started. (community card = ['C5', 'DK', 'C2'])
"Finneas" declared "call:0"
"Zheng" declared "call:0"
"RaphaelPlayer" declared "call:0"
"HakulaPlayer" declared "call:0"
Street "turn" started. (community card = ['C5', 'DK', 'C2', 'DT'])
"Finneas" declared "call:0"
"Zheng" declared "call:0"
"RaphaelPlayer" declared "call:0"
"HakulaPlayer" declared "call:0"
Street "river" started. (community card = ['C5', 'DK', 'C2', 'DT', 'CT'])
"Finneas" declared "call:0"
"Zheng" declared "call:0"
"RaphaelPlayer" declared "call:0"
"HakulaPlayer" declared "call:0"
"['Finneas']" won the round 27 (stack = {'Zheng': 223, 'RaphaelPlayer': 2080, 'SichengZuo': 940, 'Yuchun': 0, 'HakulaPlayer': 1257, 'Ethan': 525, 'YangZ': 945, 'Finneas': 2030})
player [Zheng] gets hole card ['S5', 'CJ'], current stack 223
player [RaphaelPlayer] gets hole card ['SA', 'D7'], current stack 2080
player [SichengZuo] gets hole card ['HK', 'C3'], current stack 940
player [HakulaPlayer] gets hole card ['SJ', 'D8'], current stack 1257
player [Ethan] gets hole card ['C2', 'S7'], current stack 525
player [YangZ] gets hole card ['C5', 'C6'], current stack 940
player [Finneas] gets hole card ['D5', 'H8'], current stack 2020
Started the round 28
Street "preflop" started. (community card = [])
"Zheng" declared "call:10"
"RaphaelPlayer" declared "call:10"
"SichengZuo" declared "fold:0"
"HakulaPlayer" declared "call:10"
"Ethan" declared "fold:0"
"YangZ" declared "fold:0"
"Finneas" declared "call:10"
Street "flop" started. (community card = ['DJ', 'D9', 'HJ'])
"Finneas" declared "call:0"
"Zheng" declared "raise:111"
"RaphaelPlayer" declared "fold:0"
"HakulaPlayer" declared "raise:390"
"Finneas" declared "fold:0"
"Zheng" declared "call:390"
Street "turn" started. (community card = ['DJ', 'D9', 'HJ', 'S4'])
Street "river" started. (community card = ['DJ', 'D9', 'HJ', 'S4', 'H2'])
"['HakulaPlayer']" won the round 28 (stack = {'Zheng': 0, 'RaphaelPlayer': 2070, 'SichengZuo': 940, 'Yuchun': 0, 'HakulaPlayer': 1505, 'Ethan': 525, 'YangZ': 940, 'Finneas': 2020})
player [RaphaelPlayer] gets hole card ['D2', 'S5'], current stack 2060
player [SichengZuo] gets hole card ['HJ', 'S4'], current stack 940
player [HakulaPlayer] gets hole card ['H6', 'ST'], current stack 1505
player [Ethan] gets hole card ['C2', 'H3'], current stack 525
player [YangZ] gets hole card ['S9', 'HA'], current stack 940
player [Finneas] gets hole card ['D6', 'SJ'], current stack 2015
Started the round 29
Street "preflop" started. (community card = [])
"SichengZuo" declared "fold:0"
"HakulaPlayer" declared "fold:0"
"Ethan" declared "fold:0"
"YangZ" declared "fold:0"
"Finneas" declared "call:10"
"RaphaelPlayer" declared "fold:0"
"['Finneas']" won the round 29 (stack = {'Zheng': 0, 'RaphaelPlayer': 2060, 'SichengZuo': 940, 'Yuchun': 0, 'HakulaPlayer': 1505, 'Ethan': 525, 'YangZ': 940, 'Finneas': 2030})
player [RaphaelPlayer] gets hole card ['H5', 'CK'], current stack 2055
player [SichengZuo] gets hole card ['D7', 'D3'], current stack 930
player [HakulaPlayer] gets hole card ['C8', 'S5'], current stack 1505
player [Ethan] gets hole card ['H6', 'S8'], current stack 525
player [YangZ] gets hole card ['D2', 'HQ'], current stack 940
player [Finneas] gets hole card ['CJ', 'HT'], current stack 2030
Started the round 30
Street "preflop" started. (community card = [])
"HakulaPlayer" declared "fold:0"
"Ethan" declared "fold:0"
"YangZ" declared "fold:0"
"Finneas" declared "call:10"
"RaphaelPlayer" declared "call:10"
"SichengZuo" declared "fold:0"
Street "flop" started. (community card = ['H8', 'HK', 'SK'])
"RaphaelPlayer" declared "raise:40"
"Finneas" declared "fold:0"
"['RaphaelPlayer']" won the round 30 (stack = {'Zheng': 0, 'RaphaelPlayer': 2080, 'SichengZuo': 930, 'Yuchun': 0, 'HakulaPlayer': 1505, 'Ethan': 525, 'YangZ': 940, 'Finneas': 2020})
player [RaphaelPlayer] gets hole card ['H5', 'S6'], current stack 2080
player [SichengZuo] gets hole card ['H4', 'D4'], current stack 925
player [HakulaPlayer] gets hole card ['D3', 'HJ'], current stack 1495
player [Ethan] gets hole card ['H8', 'SQ'], current stack 525
player [YangZ] gets hole card ['HT', 'DA'], current stack 940
player [Finneas] gets hole card ['H9', 'D7'], current stack 2020
Started the round 31
Street "preflop" started. (community card = [])
"Ethan" declared "fold:0"
"YangZ" declared "fold:0"
"Finneas" declared "call:10"
"RaphaelPlayer" declared "fold:0"
"SichengZuo" declared "fold:0"
"HakulaPlayer" declared "call:10"
Street "flop" started. (community card = ['C6', 'SA', 'SK'])
"HakulaPlayer" declared "call:0"
"Finneas" declared "call:0"
Street "turn" started. (community card = ['C6', 'SA', 'SK', 'S4'])
"HakulaPlayer" declared "call:0"
"Finneas" declared "call:0"
Street "river" started. (community card = ['C6', 'SA', 'SK', 'S4', 'C5'])
"HakulaPlayer" declared "call:0"
"Finneas" declared "call:0"
"['HakulaPlayer']" won the round 31 (stack = {'Zheng': 0, 'RaphaelPlayer': 2080, 'SichengZuo': 925, 'Yuchun': 0, 'HakulaPlayer': 1520, 'Ethan': 525, 'YangZ': 940, 'Finneas': 2010})
player [RaphaelPlayer] gets hole card ['SJ', 'DK'], current stack 2080
player [SichengZuo] gets hole card ['HT', 'DT'], current stack 925
player [HakulaPlayer] gets hole card ['CT', 'C5'], current stack 1515
player [Ethan] gets hole card ['S2', 'HA'], current stack 515
player [YangZ] gets hole card ['DA', 'H7'], current stack 940
player [Finneas] gets hole card ['H4', 'D4'], current stack 2010
Started the round 32
Street "preflop" started. (community card = [])
"YangZ" declared "fold:0"
"Finneas" declared "call:10"
"RaphaelPlayer" declared "call:10"
"SichengZuo" declared "fold:0"
"HakulaPlayer" declared "call:10"
"Ethan" declared "fold:0"
Street "flop" started. (community card = ['H6', 'S6', 'C8'])
"HakulaPlayer" declared "call:0"
"Finneas" declared "call:0"
"RaphaelPlayer" declared "call:0"
Street "turn" started. (community card = ['H6', 'S6', 'C8', 'C6'])
"HakulaPlayer" declared "call:0"
"Finneas" declared "raise:1005"
"RaphaelPlayer" declared "fold:0"
"HakulaPlayer" declared "fold:0"
"['Finneas']" won the round 32 (stack = {'Zheng': 0, 'RaphaelPlayer': 2070, 'SichengZuo': 925, 'Yuchun': 0, 'HakulaPlayer': 1510, 'Ethan': 515, 'YangZ': 940, 'Finneas': 2040})
player [RaphaelPlayer] gets hole card ['S9', 'H5'], current stack 2070
player [SichengZuo] gets hole card ['H6', 'D2'], current stack 925
player [HakulaPlayer] gets hole card ['C4', 'H8'], current stack 1510
player [Ethan] gets hole card ['HT', 'SJ'], current stack 510
player [YangZ] gets hole card ['DA', 'S6'], current stack 930
player [Finneas] gets hole card ['D9', 'H4'], current stack 2040
Started the round 33
Street "preflop" started. (community card = [])
"Finneas" declared "call:10"
"RaphaelPlayer" declared "fold:0"
"SichengZuo" declared "fold:0"
"HakulaPlayer" declared "call:10"
"Ethan" declared "call:10"
"YangZ" declared "fold:0"
Street "flop" started. (community card = ['S3', 'D6', 'S4'])
"Ethan" declared "call:0"
"Finneas" declared "call:0"
"HakulaPlayer" declared "call:0"
Street "turn" started. (community card = ['S3', 'D6', 'S4', 'SQ'])
"Ethan" declared "call:0"
"Finneas" declared "call:0"
"HakulaPlayer" declared "call:0"
Street "river" started. (community card = ['S3', 'D6', 'S4', 'SQ', 'HJ'])
"Ethan" declared "call:0"
"Finneas" declared "call:0"
"HakulaPlayer" declared "call:0"
"['Ethan']" won the round 33 (stack = {'Zheng': 0, 'RaphaelPlayer': 2070, 'SichengZuo': 925, 'Yuchun': 0, 'HakulaPlayer': 1500, 'Ethan': 545, 'YangZ': 930, 'Finneas': 2030})
player [RaphaelPlayer] gets hole card ['S9', 'ST'], current stack 2070
player [SichengZuo] gets hole card ['C9', 'SA'], current stack 925
player [HakulaPlayer] gets hole card ['S5', 'HJ'], current stack 1500
player [Ethan] gets hole card ['H2', 'DT'], current stack 545
player [YangZ] gets hole card ['D2', 'CA'], current stack 925
player [Finneas] gets hole card ['CK', 'CJ'], current stack 2020
Started the round 34
Street "preflop" started. (community card = [])
"RaphaelPlayer" declared "call:10"
"SichengZuo" declared "fold:0"
"HakulaPlayer" declared "call:10"
"Ethan" declared "fold:0"
"YangZ" declared "fold:0"
"Finneas" declared "call:10"
Street "flop" started. (community card = ['S8', 'D9', 'D8'])
"Finneas" declared "call:0"
"RaphaelPlayer" declared "raise:45"
"HakulaPlayer" declared "fold:0"
"Finneas" declared "fold:0"
"['RaphaelPlayer']" won the round 34 (stack = {'Zheng': 0, 'RaphaelPlayer': 2095, 'SichengZuo': 925, 'Yuchun': 0, 'HakulaPlayer': 1490, 'Ethan': 545, 'YangZ': 925, 'Finneas': 2020})
player [RaphaelPlayer] gets hole card ['S7', 'S5'], current stack 2085
player [SichengZuo] gets hole card ['D7', 'C2'], current stack 925
player [HakulaPlayer] gets hole card ['CJ', 'H8'], current stack 1490
player [Ethan] gets hole card ['S6', 'ST'], current stack 545
player [YangZ] gets hole card ['HA', 'S8'], current stack 925
player [Finneas] gets hole card ['DT', 'DQ'], current stack 2015
Started the round 35
Street "preflop" started. (community card = [])
"SichengZuo" declared "fold:0"
"HakulaPlayer" declared "call:10"
"Ethan" declared "fold:0"
"YangZ" declared "fold:0"
"Finneas" declared "call:10"
"RaphaelPlayer" declared "fold:0"
Street "flop" started. (community card = ['C7', 'D8', 'H5'])
"Finneas" declared "call:0"
"HakulaPlayer" declared "raise:54"
"Finneas" declared "fold:0"
"['HakulaPlayer']" won the round 35 (stack = {'Zheng': 0, 'RaphaelPlayer': 2085, 'SichengZuo': 925, 'Yuchun': 0, 'HakulaPlayer': 1510, 'Ethan': 545, 'YangZ': 925, 'Finneas': 2010})
player [RaphaelPlayer] gets hole card ['DT', 'SJ'], current stack 2080
player [SichengZuo] gets hole card ['ST', 'C3'], current stack 915
player [HakulaPlayer] gets hole card ['DJ', 'SK'], current stack 1510
player [Ethan] gets hole card ['CA', 'H3'], current stack 545
player [YangZ] gets hole card ['DQ', 'D2'], current stack 925
player [Finneas] gets hole card ['S8', 'D9'], current stack 2010
Started the round 36
Street "preflop" started. (community card = [])
"HakulaPlayer" declared "call:10"
"Ethan" declared "fold:0"
"YangZ" declared "fold:0"
"Finneas" declared "call:10"
"RaphaelPlayer" declared "call:10"
"SichengZuo" declared "fold:0"
Street "flop" started. (community card = ['CQ', 'C2', 'C4'])
"RaphaelPlayer" declared "call:0"
"HakulaPlayer" declared "call:0"
"Finneas" declared "call:0"
Street "turn" started. (community card = ['CQ', 'C2', 'C4', 'HK'])
"RaphaelPlayer" declared "call:0"
"HakulaPlayer" declared "call:0"
"Finneas" declared "call:0"
Street "river" started. (community card = ['CQ', 'C2', 'C4', 'HK', 'CJ'])
"RaphaelPlayer" declared "call:0"
"HakulaPlayer" declared "call:0"
"Finneas" declared "call:0"
"['HakulaPlayer']" won the round 36 (stack = {'Zheng': 0, 'RaphaelPlayer': 2075, 'SichengZuo': 915, 'Yuchun': 0, 'HakulaPlayer': 1540, 'Ethan': 545, 'YangZ': 925, 'Finneas': 2000})
player [RaphaelPlayer] gets hole card ['HQ', 'C5'], current stack 2075
player [SichengZuo] gets hole card ['H2', 'D9'], current stack 910
player [HakulaPlayer] gets hole card ['SA', 'C6'], current stack 1530
player [Ethan] gets hole card ['S8', 'C7'], current stack 545
player [YangZ] gets hole card ['H6', 'S4'], current stack 925
player [Finneas] gets hole card ['D6', 'H5'], current stack 2000
Started the round 37
Street "preflop" started. (community card = [])
"Ethan" declared "fold:0"
"YangZ" declared "fold:0"
"Finneas" declared "call:10"
"RaphaelPlayer" declared "fold:0"
"SichengZuo" declared "fold:0"
"HakulaPlayer" declared "raise:52"
"Finneas" declared "fold:0"
"['HakulaPlayer']" won the round 37 (stack = {'Zheng': 0, 'RaphaelPlayer': 2075, 'SichengZuo': 910, 'Yuchun': 0, 'HakulaPlayer': 1555, 'Ethan': 545, 'YangZ': 925, 'Finneas': 1990})
player [RaphaelPlayer] gets hole card ['H3', 'CQ'], current stack 2075
player [SichengZuo] gets hole card ['S9', 'H5'], current stack 910
player [HakulaPlayer] gets hole card ['C4', 'C7'], current stack 1550
player [Ethan] gets hole card ['S3', 'D5'], current stack 535
player [YangZ] gets hole card ['H9', 'D9'], current stack 925
player [Finneas] gets hole card ['C2', 'S5'], current stack 1990
Started the round 38
Street "preflop" started. (community card = [])
"YangZ" declared "fold:0"
"Finneas" declared "call:10"
"RaphaelPlayer" declared "fold:0"
"SichengZuo" declared "fold:0"
"HakulaPlayer" declared "call:10"
"Ethan" declared "fold:0"
Street "flop" started. (community card = ['D6', 'CJ', 'SK'])
"HakulaPlayer" declared "call:0"
"Finneas" declared "call:0"
Street "turn" started. (community card = ['D6', 'CJ', 'SK', 'S6'])
"HakulaPlayer" declared "call:0"
"Finneas" declared "call:0"
Street "river" started. (community card = ['D6', 'CJ', 'SK', 'S6', 'CK'])
"HakulaPlayer" declared "call:0"
"Finneas" declared "call:0"
"['HakulaPlayer', 'Finneas']" won the round 38 (stack = {'Zheng': 0, 'RaphaelPlayer': 2075, 'SichengZuo': 910, 'Yuchun': 0, 'HakulaPlayer': 1560, 'Ethan': 535, 'YangZ': 925, 'Finneas': 1995})
player [RaphaelPlayer] gets hole card ['DA', 'S6'], current stack 2075
player [SichengZuo] gets hole card ['CQ', 'S7'], current stack 910
player [HakulaPlayer] gets hole card ['CA', 'D5'], current stack 1560
player [Ethan] gets hole card ['DQ', 'C3'], current stack 530
player [YangZ] gets hole card ['S8', 'D3'], current stack 915
player [Finneas] gets hole card ['SQ', 'C4'], current stack 1995
Started the round 39
Street "preflop" started. (community card = [])
"Finneas" declared "call:10"
"RaphaelPlayer" declared "call:10"
"SichengZuo" declared "fold:0"
"HakulaPlayer" declared "raise:45"
"Ethan" declared "fold:0"
"YangZ" declared "fold:0"
"Finneas" declared "fold:0"
"RaphaelPlayer" declared "call:45"
Street "flop" started. (community card = ['D4', 'C7', 'C9'])
"RaphaelPlayer" declared "call:0"
"HakulaPlayer" declared "call:0"
Street "turn" started. (community card = ['D4', 'C7', 'C9', 'H8'])
"RaphaelPlayer" declared "call:0"
"HakulaPlayer" declared "call:0"
Street "river" started. (community card = ['D4', 'C7', 'C9', 'H8', 'DK'])
"RaphaelPlayer" declared "call:0"
"HakulaPlayer" declared "call:0"
"['RaphaelPlayer', 'HakulaPlayer']" won the round 39 (stack = {'Zheng': 0, 'RaphaelPlayer': 2087, 'SichengZuo': 910, 'Yuchun': 0, 'HakulaPlayer': 1572, 'Ethan': 530, 'YangZ': 915, 'Finneas': 1985})
player [RaphaelPlayer] gets hole card ['CA', 'H8'], current stack 2087
player [SichengZuo] gets hole card ['D5', 'D2'], current stack 910
player [HakulaPlayer] gets hole card ['S5', 'DJ'], current stack 1572
player [Ethan] gets hole card ['DQ', 'C6'], current stack 530
player [YangZ] gets hole card ['SK', 'C7'], current stack 910
player [Finneas] gets hole card ['D8', 'S9'], current stack 1975
Started the round 40
Street "preflop" started. (community card = [])
"RaphaelPlayer" declared "call:10"
"SichengZuo" declared "fold:0"
"HakulaPlayer" declared "call:10"
"Ethan" declared "fold:0"
"YangZ" declared "fold:0"
"Finneas" declared "call:10"
Street "flop" started. (community card = ['DK', 'S7', 'S4'])
"Finneas" declared "call:0"
"RaphaelPlayer" declared "call:0"
"HakulaPlayer" declared "call:0"
Street "turn" started. (community card = ['DK', 'S7', 'S4', 'C3'])
"Finneas" declared "call:0"
"RaphaelPlayer" declared "call:0"
"HakulaPlayer" declared "call:0"
Street "river" started. (community card = ['DK', 'S7', 'S4', 'C3', 'D9'])
"Finneas" declared "call:0"
"RaphaelPlayer" declared "call:0"
"HakulaPlayer" declared "call:0"
"['Finneas']" won the round 40 (stack = {'Zheng': 0, 'RaphaelPlayer': 2077, 'SichengZuo': 910, 'Yuchun': 0, 'HakulaPlayer': 1562, 'Ethan': 530, 'YangZ': 910, 'Finneas': 2010})
player [RaphaelPlayer] gets hole card ['DK', 'DJ'], current stack 2067
player [SichengZuo] gets hole card ['HJ', 'CA'], current stack 910
player [HakulaPlayer] gets hole card ['C9', 'S4'], current stack 1562
player [Ethan] gets hole card ['D6', 'DQ'], current stack 530
player [YangZ] gets hole card ['HT', 'C3'], current stack 910
player [Finneas] gets hole card ['D4', 'HA'], current stack 2005
Started the round 41
Street "preflop" started. (community card = [])
"SichengZuo" declared "fold:0"
"HakulaPlayer" declared "fold:0"
"Ethan" declared "fold:0"
"YangZ" declared "fold:0"
"Finneas" declared "call:10"
"RaphaelPlayer" declared "raise:30"
"Finneas" declared "fold:0"
"['RaphaelPlayer']" won the round 41 (stack = {'Zheng': 0, 'RaphaelPlayer': 2087, 'SichengZuo': 910, 'Yuchun': 0, 'HakulaPlayer': 1562, 'Ethan': 530, 'YangZ': 910, 'Finneas': 2000})
player [RaphaelPlayer] gets hole card ['C7', 'C5'], current stack 2082
player [SichengZuo] gets hole card ['CK', 'D6'], current stack 900
player [HakulaPlayer] gets hole card ['C3', 'C9'], current stack 1562
player [Ethan] gets hole card ['C6', 'SA'], current stack 530
player [YangZ] gets hole card ['H5', 'HJ'], current stack 910
player [Finneas] gets hole card ['DA', 'SJ'], current stack 2000
Started the round 42
Street "preflop" started. (community card = [])
"HakulaPlayer" declared "fold:0"
"Ethan" declared "fold:0"
"YangZ" declared "fold:0"
"Finneas" declared "call:10"
"RaphaelPlayer" declared "call:10"
"SichengZuo" declared "fold:0"
Street "flop" started. (community card = ['DJ', 'H7', 'DT'])
"RaphaelPlayer" declared "raise:40"
"Finneas" declared "fold:0"
"['RaphaelPlayer']" won the round 42 (stack = {'Zheng': 0, 'RaphaelPlayer': 2107, 'SichengZuo': 900, 'Yuchun': 0, 'HakulaPlayer': 1562, 'Ethan': 530, 'YangZ': 910, 'Finneas': 1990})
player [RaphaelPlayer] gets hole card ['S5', 'DK'], current stack 2107
player [SichengZuo] gets hole card ['S7', 'S4'], current stack 895
player [HakulaPlayer] gets hole card ['CJ', 'HJ'], current stack 1552
player [Ethan] gets hole card ['HQ', 'DA'], current stack 530
player [YangZ] gets hole card ['ST', 'C2'], current stack 910
player [Finneas] gets hole card ['S9', 'SJ'], current stack 1990
Started the round 43
Street "preflop" started. (community card = [])
"Ethan" declared "raise:79"
"YangZ" declared "fold:0"
"Finneas" declared "fold:0"
"RaphaelPlayer" declared "fold:0"
"SichengZuo" declared "fold:0"
"HakulaPlayer" declared "call:79"
Street "flop" started. (community card = ['D2', 'S8', 'S2'])
"HakulaPlayer" declared "raise:202"
"Ethan" declared "fold:0"
"['HakulaPlayer']" won the round 43 (stack = {'Zheng': 0, 'RaphaelPlayer': 2107, 'SichengZuo': 895, 'Yuchun': 0, 'HakulaPlayer': 1646, 'Ethan': 451, 'YangZ': 910, 'Finneas': 1990})
player [RaphaelPlayer] gets hole card ['DA', 'D7'], current stack 2107
player [SichengZuo] gets hole card ['S2', 'CA'], current stack 895
player [HakulaPlayer] gets hole card ['H5', 'D4'], current stack 1641
player [Ethan] gets hole card ['D6', 'H7'], current stack 441
player [YangZ] gets hole card ['H2', 'CQ'], current stack 910
player [Finneas] gets hole card ['H9', 'D9'], current stack 1990
Started the round 44
Street "preflop" started. (community card = [])
"YangZ" declared "fold:0"
"Finneas" declared "call:10"
"RaphaelPlayer" declared "call:10"
"SichengZuo" declared "fold:0"
"HakulaPlayer" declared "call:10"
"Ethan" declared "fold:0"
Street "flop" started. (community card = ['CJ', 'CT', 'C8'])
"HakulaPlayer" declared "call:0"
"Finneas" declared "call:0"
"RaphaelPlayer" declared "call:0"
Street "turn" started. (community card = ['CJ', 'CT', 'C8', 'S8'])
"HakulaPlayer" declared "call:0"
"Finneas" declared "call:0"
"RaphaelPlayer" declared "call:0"
Street "river" started. (community card = ['CJ', 'CT', 'C8', 'S8', 'DT'])
"HakulaPlayer" declared "call:0"
"Finneas" declared "call:0"
"RaphaelPlayer" declared "call:0"
"['Finneas']" won the round 44 (stack = {'Zheng': 0, 'RaphaelPlayer': 2097, 'SichengZuo': 895, 'Yuchun': 0, 'HakulaPlayer': 1636, 'Ethan': 441, 'YangZ': 910, 'Finneas': 2020})
player [RaphaelPlayer] gets hole card ['HJ', 'SA'], current stack 2097
player [SichengZuo] gets hole card ['CA', 'CK'], current stack 895
player [HakulaPlayer] gets hole card ['D7', 'DK'], current stack 1636
player [Ethan] gets hole card ['CJ', 'HA'], current stack 436
player [YangZ] gets hole card ['SJ', 'D9'], current stack 900
player [Finneas] gets hole card ['DT', 'C3'], current stack 2020
Started the round 45
Street "preflop" started. (community card = [])
"Finneas" declared "call:10"
"RaphaelPlayer" declared "call:10"
"SichengZuo" declared "fold:0"
"HakulaPlayer" declared "raise:46"
"Ethan" declared "call:46"
"YangZ" declared "fold:0"
"Finneas" declared "fold:0"
"RaphaelPlayer" declared "call:46"
Street "flop" started. (community card = ['C9', 'CT', 'H2'])
"Ethan" declared "call:0"
"RaphaelPlayer" declared "call:0"
"HakulaPlayer" declared "raise:107"
"Ethan" declared "call:107"
"RaphaelPlayer" declared "call:107"
Street "turn" started. (community card = ['C9', 'CT', 'H2', 'HT'])
"Ethan" declared "call:0"
"RaphaelPlayer" declared "call:0"
"HakulaPlayer" declared "call:0"
Street "river" started. (community card = ['C9', 'CT', 'H2', 'HT', 'C5'])
"Ethan" declared "call:0"
"RaphaelPlayer" declared "call:0"
"HakulaPlayer" declared "call:0"
"['RaphaelPlayer', 'Ethan']" won the round 45 (stack = {'Zheng': 0, 'RaphaelPlayer': 2183, 'SichengZuo': 895, 'Yuchun': 0, 'HakulaPlayer': 1483, 'Ethan': 527, 'YangZ': 900, 'Finneas': 2010})
player [RaphaelPlayer] gets hole card ['C8', 'D5'], current stack 2183
player [SichengZuo] gets hole card ['DA', 'H4'], current stack 895
player [HakulaPlayer] gets hole card ['C3', 'SJ'], current stack 1483
player [Ethan] gets hole card ['SK', 'SQ'], current stack 527
player [YangZ] gets hole card ['CT', 'SA'], current stack 895
player [Finneas] gets hole card ['D6', 'S6'], current stack 2000
Started the round 46
Street "preflop" started. (community card = [])
"RaphaelPlayer" declared "fold:0"
"SichengZuo" declared "fold:0"
"HakulaPlayer" declared "fold:0"
"Ethan" declared "raise:158"
"YangZ" declared "fold:0"
"Finneas" declared "fold:0"
"['Ethan']" won the round 46 (stack = {'Zheng': 0, 'RaphaelPlayer': 2183, 'SichengZuo': 895, 'Yuchun': 0, 'HakulaPlayer': 1483, 'Ethan': 542, 'YangZ': 895, 'Finneas': 2000})
player [RaphaelPlayer] gets hole card ['D3', 'H9'], current stack 2173
player [SichengZuo] gets hole card ['S9', 'HJ'], current stack 895
player [HakulaPlayer] gets hole card ['DK', 'D7'], current stack 1483
player [Ethan] gets hole card ['D9', 'H6'], current stack 542
player [YangZ] gets hole card ['HK', 'S6'], current stack 895
player [Finneas] gets hole card ['S8', 'CK'], current stack 1995
Started the round 47
Street "preflop" started. (community card = [])
"SichengZuo" declared "fold:0"
"HakulaPlayer" declared "call:10"
"Ethan" declared "fold:0"
"YangZ" declared "fold:0"
"Finneas" declared "call:10"
"RaphaelPlayer" declared "fold:0"
Street "flop" started. (community card = ['H3', 'S3', 'D2'])
"Finneas" declared "call:0"
"HakulaPlayer" declared "call:0"
Street "turn" started. (community card = ['H3', 'S3', 'D2', 'DQ'])
"Finneas" declared "call:0"
"HakulaPlayer" declared "call:0"
Street "river" started. (community card = ['H3', 'S3', 'D2', 'DQ', 'C7'])
"Finneas" declared "call:0"
"HakulaPlayer" declared "raise:65"
"Finneas" declared "fold:0"
"['HakulaPlayer']" won the round 47 (stack = {'Zheng': 0, 'RaphaelPlayer': 2173, 'SichengZuo': 895, 'Yuchun': 0, 'HakulaPlayer': 1503, 'Ethan': 542, 'YangZ': 895, 'Finneas': 1990})
player [RaphaelPlayer] gets hole card ['HQ', 'DK'], current stack 2168
player [SichengZuo] gets hole card ['CQ', 'S8'], current stack 885
player [HakulaPlayer] gets hole card ['SA', 'DJ'], current stack 1503
player [Ethan] gets hole card ['S5', 'CT'], current stack 542
player [YangZ] gets hole card ['H8', 'H6'], current stack 895
player [Finneas] gets hole card ['S9', 'SJ'], current stack 1990
Started the round 48
Street "preflop" started. (community card = [])
"HakulaPlayer" declared "call:10"
"Ethan" declared "fold:0"
"YangZ" declared "fold:0"
"Finneas" declared "call:10"
"RaphaelPlayer" declared "call:10"
"SichengZuo" declared "fold:0"
Street "flop" started. (community card = ['H7', 'S6', 'H4'])
"RaphaelPlayer" declared "call:0"
"HakulaPlayer" declared "call:0"
"Finneas" declared "call:0"
Street "turn" started. (community card = ['H7', 'S6', 'H4', 'D4'])
"RaphaelPlayer" declared "call:0"
"HakulaPlayer" declared "call:0"
"Finneas" declared "call:0"
Street "river" started. (community card = ['H7', 'S6', 'H4', 'D4', 'C9'])
"RaphaelPlayer" declared "call:0"
"HakulaPlayer" declared "call:0"
"Finneas" declared "call:0"
"['Finneas']" won the round 48 (stack = {'Zheng': 0, 'RaphaelPlayer': 2163, 'SichengZuo': 885, 'Yuchun': 0, 'HakulaPlayer': 1493, 'Ethan': 542, 'YangZ': 895, 'Finneas': 2020})
player [RaphaelPlayer] gets hole card ['D2', 'SJ'], current stack 2163
player [SichengZuo] gets hole card ['D8', 'H2'], current stack 880
player [HakulaPlayer] gets hole card ['H5', 'S2'], current stack 1483
player [Ethan] gets hole card ['DJ', 'C8'], current stack 542
player [YangZ] gets hole card ['S6', 'HK'], current stack 895
player [Finneas] gets hole card ['S7', 'H3'], current stack 2020
Started the round 49
Street "preflop" started. (community card = [])
"Ethan" declared "fold:0"
"YangZ" declared "fold:0"
"Finneas" declared "call:10"
"RaphaelPlayer" declared "fold:0"
"SichengZuo" declared "fold:0"
"HakulaPlayer" declared "call:10"
Street "flop" started. (community card = ['CK', 'H8', 'HJ'])
"HakulaPlayer" declared "call:0"
"Finneas" declared "call:0"
Street "turn" started. (community card = ['CK', 'H8', 'HJ', 'HA'])
"HakulaPlayer" declared "call:0"
"Finneas" declared "call:0"
Street "river" started. (community card = ['CK', 'H8', 'HJ', 'HA', 'HQ'])
"HakulaPlayer" declared "raise:49"
"Finneas" declared "raise:1054"
"HakulaPlayer" declared "fold:0"
"['Finneas']" won the round 49 (stack = {'Zheng': 0, 'RaphaelPlayer': 2163, 'SichengZuo': 880, 'Yuchun': 0, 'HakulaPlayer': 1434, 'Ethan': 542, 'YangZ': 895, 'Finneas': 2084})
player [RaphaelPlayer] gets hole card ['H7', 'D7'], current stack 2163
player [SichengZuo] gets hole card ['DA', 'DJ'], current stack 880
player [HakulaPlayer] gets hole card ['DT', 'SK'], current stack 1429
player [Ethan] gets hole card ['HJ', 'S6'], current stack 532
player [YangZ] gets hole card ['D8', 'C4'], current stack 895
player [Finneas] gets hole card ['C3', 'D6'], current stack 2084
Started the round 50
Street "preflop" started. (community card = [])
"YangZ" declared "fold:0"
"Finneas" declared "call:10"
"RaphaelPlayer" declared "raise:30"
"SichengZuo" declared "fold:0"
"HakulaPlayer" declared "call:30"
"Ethan" declared "fold:0"
"Finneas" declared "fold:0"
Street "flop" started. (community card = ['H8', 'CQ', 'D2'])
"HakulaPlayer" declared "call:0"
"RaphaelPlayer" declared "raise:90"
"HakulaPlayer" declared "fold:0"
"['RaphaelPlayer']" won the round 50 (stack = {'Zheng': 0, 'RaphaelPlayer': 2213, 'SichengZuo': 880, 'Yuchun': 0, 'HakulaPlayer': 1404, 'Ethan': 532, 'YangZ': 895, 'Finneas': 2074})

Game Results:
------------------------------------------------------------
Game 1:
Winner: RaphaelPlayer (stack: 2213)
All players' stacks:
  Zheng: 0
  RaphaelPlayer: 2213
  SichengZuo: 880
  Yuchun: 0
  HakulaPlayer: 1404
  Ethan: 532
  YangZ: 895
  Finneas: 2074
------------------------------------------------------------
