player [Zheng] gets hole card ['H9', 'C4'], current stack 1000
player [RaphaelPlayer] gets hole card ['S3', 'H2'], current stack 995
player [SichengZuo] gets hole card ['D8', 'HK'], current stack 990
player [Yuchun] gets hole card ['DJ', 'SK'], current stack 1000
player [HakulaPlayer] gets hole card ['CA', 'S7'], current stack 1000
player [Ethan] gets hole card ['DA', 'S6'], current stack 1000
player [YangZ] gets hole card ['C6', 'H6'], current stack 1000
player [Finneas] gets hole card ['D9', 'C2'], current stack 1000
Started the round 1
Street "preflop" started. (community card = [])
"Yuchun" declared "fold:0"
"HakulaPlayer" declared "fold:0"
"Ethan" declared "fold:0"
"YangZ" declared "fold:0"
"Finneas" declared "call:10"
"Zheng" declared "call:10"
"RaphaelPlayer" declared "fold:0"
"SichengZuo" declared "fold:0"
Street "flop" started. (community card = ['H5', 'D4', 'CK'])
"Finneas" declared "call:0"
"Zheng" declared "call:0"
Street "turn" started. (community card = ['H5', 'D4', 'CK', 'S9'])
"Finneas" declared "call:0"
"Zheng" declared "raise:990"
"Finneas" declared "fold:0"
"['Zheng']" won the round 1 (stack = {'Zheng': 1025, 'RaphaelPlayer': 995, 'SichengZuo': 990, 'Yuchun': 1000, 'HakulaPlayer': 1000, 'Ethan': 1000, 'YangZ': 1000, 'Finneas': 990})
player [Zheng] gets hole card ['S4', 'CK'], current stack 1025
player [RaphaelPlayer] gets hole card ['D8', 'SJ'], current stack 995
player [SichengZuo] gets hole card ['S6', 'HT'], current stack 985
player [Yuchun] gets hole card ['S2', 'S7'], current stack 990
player [HakulaPlayer] gets hole card ['C4', 'HQ'], current stack 1000
player [Ethan] gets hole card ['D9', 'D6'], current stack 1000
player [YangZ] gets hole card ['SA', 'DJ'], current stack 1000
player [Finneas] gets hole card ['D5', 'S8'], current stack 990
Started the round 2
Street "preflop" started. (community card = [])
"HakulaPlayer" declared "fold:0"
"Ethan" declared "fold:0"
"YangZ" declared "fold:0"
"Finneas" declared "call:10"
"Zheng" declared "call:10"
"RaphaelPlayer" declared "call:10"
"SichengZuo" declared "fold:0"
"Yuchun" declared "fold:0"
Street "flop" started. (community card = ['SQ', 'C7', 'D3'])
"Finneas" declared "call:0"
"Zheng" declared "call:0"
"RaphaelPlayer" declared "call:0"
Street "turn" started. (community card = ['SQ', 'C7', 'D3', 'DK'])
"Finneas" declared "call:0"
"Zheng" declared "call:0"
"RaphaelPlayer" declared "call:0"
Street "river" started. (community card = ['SQ', 'C7', 'D3', 'DK', 'H8'])
"Finneas" declared "call:0"
"Zheng" declared "raise:512"
"RaphaelPlayer" declared "fold:0"
"Finneas" declared "fold:0"
"['Zheng']" won the round 2 (stack = {'Zheng': 1060, 'RaphaelPlayer': 985, 'SichengZuo': 985, 'Yuchun': 990, 'HakulaPlayer': 1000, 'Ethan': 1000, 'YangZ': 1000, 'Finneas': 980})
player [Zheng] gets hole card ['H3', 'C4'], current stack 1060
player [RaphaelPlayer] gets hole card ['H2', 'DK'], current stack 985
player [SichengZuo] gets hole card ['HA', 'D2'], current stack 985
player [Yuchun] gets hole card ['SK', 'C8'], current stack 985
player [HakulaPlayer] gets hole card ['D5', 'C5'], current stack 990
player [Ethan] gets hole card ['CA', 'DQ'], current stack 1000
player [YangZ] gets hole card ['DJ', 'HT'], current stack 1000
player [Finneas] gets hole card ['D9', 'SQ'], current stack 980
Started the round 3
Street "preflop" started. (community card = [])
"Ethan" declared "raise:150"
"YangZ" declared "fold:0"
"Finneas" declared "fold:0"
"Zheng" declared "fold:0"
"RaphaelPlayer" declared "fold:0"
"SichengZuo" declared "fold:0"
"Yuchun" declared "fold:0"
"HakulaPlayer" declared "fold:0"
"['Ethan']" won the round 3 (stack = {'Zheng': 1060, 'RaphaelPlayer': 985, 'SichengZuo': 985, 'Yuchun': 985, 'HakulaPlayer': 990, 'Ethan': 1015, 'YangZ': 1000, 'Finneas': 980})
player [Zheng] gets hole card ['D6', 'C9'], current stack 1060
player [RaphaelPlayer] gets hole card ['CA', 'SA'], current stack 985
player [SichengZuo] gets hole card ['D9', 'CQ'], current stack 985
player [Yuchun] gets hole card ['S3', 'H2'], current stack 985
player [HakulaPlayer] gets hole card ['CK', 'H8'], current stack 985
player [Ethan] gets hole card ['S4', 'C2'], current stack 1005
player [YangZ] gets hole card ['C7', 'C8'], current stack 1000
player [Finneas] gets hole card ['H4', 'CJ'], current stack 980
Started the round 4
Street "preflop" started. (community card = [])
"YangZ" declared "fold:0"
"Finneas" declared "call:10"
"Zheng" declared "call:10"
"RaphaelPlayer" declared "raise:40"
"SichengZuo" declared "fold:0"
"Yuchun" declared "fold:0"
"HakulaPlayer" declared "fold:0"
"Ethan" declared "fold:0"
"Finneas" declared "fold:0"
"Zheng" declared "fold:0"
"['RaphaelPlayer']" won the round 4 (stack = {'Zheng': 1050, 'RaphaelPlayer': 1020, 'SichengZuo': 985, 'Yuchun': 985, 'HakulaPlayer': 985, 'Ethan': 1005, 'YangZ': 1000, 'Finneas': 970})
player [Zheng] gets hole card ['DQ', 'H2'], current stack 1050
player [RaphaelPlayer] gets hole card ['D3', 'HQ'], current stack 1020
player [SichengZuo] gets hole card ['D8', 'C7'], current stack 985
player [Yuchun] gets hole card ['S5', 'S6'], current stack 985
player [HakulaPlayer] gets hole card ['DA', 'CQ'], current stack 985
player [Ethan] gets hole card ['C4', 'D7'], current stack 1000
player [YangZ] gets hole card ['S7', 'HA'], current stack 990
player [Finneas] gets hole card ['H8', 'S2'], current stack 970
Started the round 5
Street "preflop" started. (community card = [])
"Finneas" declared "call:10"
"Zheng" declared "call:10"
"RaphaelPlayer" declared "fold:0"
"SichengZuo" declared "fold:0"
"Yuchun" declared "fold:0"
"HakulaPlayer" declared "raise:33"
"Ethan" declared "fold:0"
"YangZ" declared "fold:0"
"Finneas" declared "fold:0"
"Zheng" declared "fold:0"
"['HakulaPlayer']" won the round 5 (stack = {'Zheng': 1040, 'RaphaelPlayer': 1020, 'SichengZuo': 985, 'Yuchun': 985, 'HakulaPlayer': 1020, 'Ethan': 1000, 'YangZ': 990, 'Finneas': 960})
player [Zheng] gets hole card ['DQ', 'HK'], current stack 1040
player [RaphaelPlayer] gets hole card ['ST', 'SQ'], current stack 1020
player [SichengZuo] gets hole card ['DK', 'C7'], current stack 985
player [Yuchun] gets hole card ['SJ', 'S4'], current stack 985
player [HakulaPlayer] gets hole card ['S2', 'H3'], current stack 1020
player [Ethan] gets hole card ['D6', 'C5'], current stack 1000
player [YangZ] gets hole card ['D8', 'S7'], current stack 985
player [Finneas] gets hole card ['D3', 'C2'], current stack 950
Started the round 6
Street "preflop" started. (community card = [])
"Zheng" declared "call:10"
"RaphaelPlayer" declared "call:10"
"SichengZuo" declared "fold:0"
"Yuchun" declared "fold:0"
"HakulaPlayer" declared "fold:0"
"Ethan" declared "fold:0"
"YangZ" declared "fold:0"
"Finneas" declared "call:10"
Street "flop" started. (community card = ['H2', 'D7', 'S9'])
"Finneas" declared "call:0"
"Zheng" declared "call:0"
"RaphaelPlayer" declared "call:0"
Street "turn" started. (community card = ['H2', 'D7', 'S9', 'CT'])
"Finneas" declared "call:0"
"Zheng" declared "call:0"
"RaphaelPlayer" declared "raise:45"
"Finneas" declared "fold:0"
"Zheng" declared "fold:0"
"['RaphaelPlayer']" won the round 6 (stack = {'Zheng': 1030, 'RaphaelPlayer': 1045, 'SichengZuo': 985, 'Yuchun': 985, 'HakulaPlayer': 1020, 'Ethan': 1000, 'YangZ': 985, 'Finneas': 950})
player [Zheng] gets hole card ['HQ', 'DT'], current stack 1020
player [RaphaelPlayer] gets hole card ['ST', 'SJ'], current stack 1045
player [SichengZuo] gets hole card ['S5', 'SA'], current stack 985
player [Yuchun] gets hole card ['DK', 'S9'], current stack 985
player [HakulaPlayer] gets hole card ['SQ', 'CK'], current stack 1020
player [Ethan] gets hole card ['C4', 'D8'], current stack 1000
player [YangZ] gets hole card ['H3', 'C8'], current stack 985
player [Finneas] gets hole card ['DJ', 'DA'], current stack 945
Started the round 7
Street "preflop" started. (community card = [])
"RaphaelPlayer" declared "call:10"
"SichengZuo" declared "fold:0"
"Yuchun" declared "fold:0"
"HakulaPlayer" declared "call:10"
"Ethan" declared "fold:0"
"YangZ" declared "fold:0"
"Finneas" declared "call:10"
"Zheng" declared "call:10"
Street "flop" started. (community card = ['D2', 'S7', 'S3'])
"Finneas" declared "call:0"
"Zheng" declared "call:0"
"RaphaelPlayer" declared "call:0"
"HakulaPlayer" declared "raise:22"
"Finneas" declared "fold:0"
"Zheng" declared "fold:0"
"RaphaelPlayer" declared "call:22"
Street "turn" started. (community card = ['D2', 'S7', 'S3', 'D6'])
"RaphaelPlayer" declared "call:0"
"HakulaPlayer" declared "raise:66"
"RaphaelPlayer" declared "fold:0"
"['HakulaPlayer']" won the round 7 (stack = {'Zheng': 1020, 'RaphaelPlayer': 1013, 'SichengZuo': 985, 'Yuchun': 985, 'HakulaPlayer': 1072, 'Ethan': 1000, 'YangZ': 985, 'Finneas': 940})
player [Zheng] gets hole card ['CQ', 'DT'], current stack 1015
player [RaphaelPlayer] gets hole card ['C7', 'D8'], current stack 1003
player [SichengZuo] gets hole card ['H6', 'C6'], current stack 985
player [Yuchun] gets hole card ['HQ', 'CJ'], current stack 985
player [HakulaPlayer] gets hole card ['D7', 'DK'], current stack 1072
player [Ethan] gets hole card ['ST', 'D4'], current stack 1000
player [YangZ] gets hole card ['DA', 'C2'], current stack 985
player [Finneas] gets hole card ['S6', 'D5'], current stack 940
Started the round 8
Street "preflop" started. (community card = [])
"SichengZuo" declared "fold:0"
"Yuchun" declared "fold:0"
"HakulaPlayer" declared "fold:0"
"Ethan" declared "fold:0"
"YangZ" declared "fold:0"
"Finneas" declared "call:10"
"Zheng" declared "call:10"
"RaphaelPlayer" declared "fold:0"
Street "flop" started. (community card = ['H8', 'D2', 'SJ'])
"Zheng" declared "call:0"
"Finneas" declared "call:0"
Street "turn" started. (community card = ['H8', 'D2', 'SJ', 'S3'])
"Zheng" declared "call:0"
"Finneas" declared "call:0"
Street "river" started. (community card = ['H8', 'D2', 'SJ', 'S3', 'SK'])
"Zheng" declared "call:0"
"Finneas" declared "call:0"
"['Zheng']" won the round 8 (stack = {'Zheng': 1040, 'RaphaelPlayer': 1003, 'SichengZuo': 985, 'Yuchun': 985, 'HakulaPlayer': 1072, 'Ethan': 1000, 'YangZ': 985, 'Finneas': 930})
player [Zheng] gets hole card ['CQ', 'DJ'], current stack 1040
player [RaphaelPlayer] gets hole card ['DA', 'SA'], current stack 998
player [SichengZuo] gets hole card ['D3', 'S3'], current stack 975
player [Yuchun] gets hole card ['H3', 'H2'], current stack 985
player [HakulaPlayer] gets hole card ['HA', 'C8'], current stack 1072
player [Ethan] gets hole card ['C6', 'S2'], current stack 1000
player [YangZ] gets hole card ['S5', 'H5'], current stack 985
player [Finneas] gets hole card ['D2', 'CA'], current stack 930
Started the round 9
Street "preflop" started. (community card = [])
"Yuchun" declared "fold:0"
"HakulaPlayer" declared "fold:0"
"Ethan" declared "fold:0"
"YangZ" declared "fold:0"
"Finneas" declared "call:10"
"Zheng" declared "call:10"
"RaphaelPlayer" declared "raise:40"
"SichengZuo" declared "fold:0"
"Finneas" declared "fold:0"
"Zheng" declared "fold:0"
"['RaphaelPlayer']" won the round 9 (stack = {'Zheng': 1030, 'RaphaelPlayer': 1033, 'SichengZuo': 975, 'Yuchun': 985, 'HakulaPlayer': 1072, 'Ethan': 1000, 'YangZ': 985, 'Finneas': 920})
player [Zheng] gets hole card ['H7', 'C7'], current stack 1030
player [RaphaelPlayer] gets hole card ['S2', 'DJ'], current stack 1033
player [SichengZuo] gets hole card ['H8', 'CA'], current stack 970
player [Yuchun] gets hole card ['DT', 'S3'], current stack 975
player [HakulaPlayer] gets hole card ['DQ', 'D2'], current stack 1072
player [Ethan] gets hole card ['C4', 'H4'], current stack 1000
player [YangZ] gets hole card ['S5', 'HK'], current stack 985
player [Finneas] gets hole card ['C2', 'HA'], current stack 920
Started the round 10
Street "preflop" started. (community card = [])
"HakulaPlayer" declared "fold:0"
"Ethan" declared "fold:0"
"YangZ" declared "fold:0"
"Finneas" declared "call:10"
"Zheng" declared "call:10"
"RaphaelPlayer" declared "fold:0"
"SichengZuo" declared "fold:0"
"Yuchun" declared "call:10"
Street "flop" started. (community card = ['H3', 'HT', 'D4'])
"Yuchun" declared "raise:40"
"Finneas" declared "fold:0"
"Zheng" declared "fold:0"
"['Yuchun']" won the round 10 (stack = {'Zheng': 1020, 'RaphaelPlayer': 1033, 'SichengZuo': 970, 'Yuchun': 1010, 'HakulaPlayer': 1072, 'Ethan': 1000, 'YangZ': 985, 'Finneas': 910})
player [Zheng] gets hole card ['C2', 'CT'], current stack 1020
player [RaphaelPlayer] gets hole card ['C4', 'CA'], current stack 1033
player [SichengZuo] gets hole card ['S5', 'SK'], current stack 970
player [Yuchun] gets hole card ['SA', 'S2'], current stack 1005
player [HakulaPlayer] gets hole card ['HK', 'D3'], current stack 1062
player [Ethan] gets hole card ['C6', 'S6'], current stack 1000
player [YangZ] gets hole card ['S4', 'SQ'], current stack 985
player [Finneas] gets hole card ['H8', 'H5'], current stack 910
Started the round 11
Street "preflop" started. (community card = [])
"Ethan" declared "fold:0"
"YangZ" declared "fold:0"
"Finneas" declared "call:10"
"Zheng" declared "call:10"
"RaphaelPlayer" declared "call:10"
"SichengZuo" declared "fold:0"
"Yuchun" declared "call:10"
"HakulaPlayer" declared "call:10"
Street "flop" started. (community card = ['C9', 'DJ', 'HT'])
"Yuchun" declared "call:0"
"HakulaPlayer" declared "call:0"
"Finneas" declared "call:0"
"Zheng" declared "call:0"
"RaphaelPlayer" declared "call:0"
Street "turn" started. (community card = ['C9', 'DJ', 'HT', 'DA'])
"Yuchun" declared "call:0"
"HakulaPlayer" declared "call:0"
"Finneas" declared "call:0"
"Zheng" declared "call:0"
"RaphaelPlayer" declared "call:0"
Street "river" started. (community card = ['C9', 'DJ', 'HT', 'DA', 'D7'])
"Yuchun" declared "call:0"
"HakulaPlayer" declared "call:0"
"Finneas" declared "call:0"
"Zheng" declared "call:0"
"RaphaelPlayer" declared "call:0"
"['Finneas']" won the round 11 (stack = {'Zheng': 1010, 'RaphaelPlayer': 1023, 'SichengZuo': 970, 'Yuchun': 1000, 'HakulaPlayer': 1062, 'Ethan': 1000, 'YangZ': 985, 'Finneas': 950})
player [Zheng] gets hole card ['D6', 'H7'], current stack 1010
player [RaphaelPlayer] gets hole card ['CT', 'D5'], current stack 1023
player [SichengZuo] gets hole card ['DA', 'CQ'], current stack 970
player [Yuchun] gets hole card ['H8', 'C3'], current stack 1000
player [HakulaPlayer] gets hole card ['HT', 'HQ'], current stack 1057
player [Ethan] gets hole card ['C6', 'CJ'], current stack 990
player [YangZ] gets hole card ['D9', 'CA'], current stack 985
player [Finneas] gets hole card ['SK', 'S9'], current stack 950
Started the round 12
Street "preflop" started. (community card = [])
"YangZ" declared "fold:0"
"Finneas" declared "call:10"
"Zheng" declared "call:10"
"RaphaelPlayer" declared "fold:0"
"SichengZuo" declared "fold:0"
"Yuchun" declared "call:10"
"HakulaPlayer" declared "call:10"
"Ethan" declared "fold:0"
Street "flop" started. (community card = ['D8', 'SJ', 'HK'])
"HakulaPlayer" declared "call:0"
"Finneas" declared "call:0"
"Zheng" declared "call:0"
"Yuchun" declared "call:0"
Street "turn" started. (community card = ['D8', 'SJ', 'HK', 'D3'])
"HakulaPlayer" declared "call:0"
"Finneas" declared "call:0"
"Zheng" declared "call:0"
"Yuchun" declared "raise:40"
"HakulaPlayer" declared "fold:0"
"Finneas" declared "fold:0"
"Zheng" declared "fold:0"
"['Yuchun']" won the round 12 (stack = {'Zheng': 1000, 'RaphaelPlayer': 1023, 'SichengZuo': 970, 'Yuchun': 1040, 'HakulaPlayer': 1052, 'Ethan': 990, 'YangZ': 985, 'Finneas': 940})
player [Zheng] gets hole card ['HT', 'S2'], current stack 1000
player [RaphaelPlayer] gets hole card ['CK', 'H5'], current stack 1023
player [SichengZuo] gets hole card ['C3', 'C9'], current stack 970
player [Yuchun] gets hole card ['D4', 'C7'], current stack 1040
player [HakulaPlayer] gets hole card ['H8', 'H9'], current stack 1052
player [Ethan] gets hole card ['SJ', 'D7'], current stack 985
player [YangZ] gets hole card ['DJ', 'C2'], current stack 975
player [Finneas] gets hole card ['CJ', 'D2'], current stack 940
Started the round 13
Street "preflop" started. (community card = [])
"Finneas" declared "call:10"
"Zheng" declared "call:10"
"RaphaelPlayer" declared "call:10"
"SichengZuo" declared "fold:0"
"Yuchun" declared "call:10"
"HakulaPlayer" declared "call:10"
"Ethan" declared "fold:0"
"YangZ" declared "fold:0"
Street "flop" started. (community card = ['H7', 'S3', 'S8'])
"Finneas" declared "call:0"
"Zheng" declared "call:0"
"RaphaelPlayer" declared "call:0"
"Yuchun" declared "call:0"
"HakulaPlayer" declared "call:0"
Street "turn" started. (community card = ['H7', 'S3', 'S8', 'S9'])
"Finneas" declared "call:0"
"Zheng" declared "call:0"
"RaphaelPlayer" declared "call:0"
"Yuchun" declared "call:0"
"HakulaPlayer" declared "call:0"
Street "river" started. (community card = ['H7', 'S3', 'S8', 'S9', 'HK'])
"Finneas" declared "call:0"
"Zheng" declared "call:0"
"RaphaelPlayer" declared "call:0"
"Yuchun" declared "call:0"
"HakulaPlayer" declared "call:0"
"['HakulaPlayer']" won the round 13 (stack = {'Zheng': 990, 'RaphaelPlayer': 1013, 'SichengZuo': 970, 'Yuchun': 1030, 'HakulaPlayer': 1107, 'Ethan': 985, 'YangZ': 975, 'Finneas': 930})
player [Zheng] gets hole card ['D8', 'C7'], current stack 990
player [RaphaelPlayer] gets hole card ['HJ', 'H2'], current stack 1013
player [SichengZuo] gets hole card ['SJ', 'CK'], current stack 970
player [Yuchun] gets hole card ['C8', 'H3'], current stack 1030
player [HakulaPlayer] gets hole card ['HA', 'DK'], current stack 1107
player [Ethan] gets hole card ['H6', 'CJ'], current stack 985
player [YangZ] gets hole card ['D6', 'CT'], current stack 970
player [Finneas] gets hole card ['H7', 'S9'], current stack 920
Started the round 14
Street "preflop" started. (community card = [])
"Zheng" declared "call:10"
"RaphaelPlayer" declared "call:10"
"SichengZuo" declared "fold:0"
"Yuchun" declared "call:10"
"HakulaPlayer" declared "raise:39"
"Ethan" declared "fold:0"
"YangZ" declared "fold:0"
"Finneas" declared "fold:0"
"Zheng" declared "fold:0"
"RaphaelPlayer" declared "call:39"
"Yuchun" declared "call:39"
Street "flop" started. (community card = ['H5', 'S3', 'S7'])
"RaphaelPlayer" declared "call:0"
"Yuchun" declared "call:0"
"HakulaPlayer" declared "call:0"
Street "turn" started. (community card = ['H5', 'S3', 'S7', 'C4'])
"RaphaelPlayer" declared "call:0"
"Yuchun" declared "call:0"
"HakulaPlayer" declared "call:0"
Street "river" started. (community card = ['H5', 'S3', 'S7', 'C4', 'C2'])
"RaphaelPlayer" declared "call:0"
"Yuchun" declared "call:0"
"HakulaPlayer" declared "raise:182"
"RaphaelPlayer" declared "fold:0"
"Yuchun" declared "fold:0"
"['HakulaPlayer']" won the round 14 (stack = {'Zheng': 980, 'RaphaelPlayer': 974, 'SichengZuo': 970, 'Yuchun': 991, 'HakulaPlayer': 1210, 'Ethan': 985, 'YangZ': 970, 'Finneas': 920})
player [Zheng] gets hole card ['D9', 'S8'], current stack 970
player [RaphaelPlayer] gets hole card ['H4', 'S7'], current stack 974
player [SichengZuo] gets hole card ['H9', 'S2'], current stack 970
player [Yuchun] gets hole card ['C5', 'HK'], current stack 991
player [HakulaPlayer] gets hole card ['D3', 'CJ'], current stack 1210
player [Ethan] gets hole card ['S5', 'C4'], current stack 985
player [YangZ] gets hole card ['H8', 'CT'], current stack 970
player [Finneas] gets hole card ['ST', 'HA'], current stack 915
Started the round 15
Street "preflop" started. (community card = [])
"RaphaelPlayer" declared "fold:0"
"SichengZuo" declared "fold:0"
"Yuchun" declared "call:10"
"HakulaPlayer" declared "call:10"
"Ethan" declared "fold:0"
"YangZ" declared "fold:0"
"Finneas" declared "call:10"
"Zheng" declared "call:10"
Street "flop" started. (community card = ['S4', 'S3', 'C7'])
"Finneas" declared "call:0"
"Zheng" declared "call:0"
"Yuchun" declared "call:0"
"HakulaPlayer" declared "call:0"
Street "turn" started. (community card = ['S4', 'S3', 'C7', 'CQ'])
"Finneas" declared "call:0"
"Zheng" declared "call:0"
"Yuchun" declared "call:0"
"HakulaPlayer" declared "call:0"
Street "river" started. (community card = ['S4', 'S3', 'C7', 'CQ', 'H3'])
"Finneas" declared "call:0"
"Zheng" declared "call:0"
"Yuchun" declared "call:0"
"HakulaPlayer" declared "raise:73"
"Finneas" declared "fold:0"
"Zheng" declared "fold:0"
"Yuchun" declared "call:73"
"['HakulaPlayer']" won the round 15 (stack = {'Zheng': 970, 'RaphaelPlayer': 974, 'SichengZuo': 970, 'Yuchun': 908, 'HakulaPlayer': 1313, 'Ethan': 985, 'YangZ': 970, 'Finneas': 910})
player [Zheng] gets hole card ['H4', 'CA'], current stack 965
player [RaphaelPlayer] gets hole card ['H2', 'D5'], current stack 964
player [SichengZuo] gets hole card ['C6', 'HT'], current stack 970
player [Yuchun] gets hole card ['ST', 'DK'], current stack 908
player [HakulaPlayer] gets hole card ['DJ', 'DT'], current stack 1313
player [Ethan] gets hole card ['DQ', 'C2'], current stack 985
player [YangZ] gets hole card ['H5', 'S3'], current stack 970
player [Finneas] gets hole card ['H8', 'HA'], current stack 910
Started the round 16
Street "preflop" started. (community card = [])
"SichengZuo" declared "fold:0"
"Yuchun" declared "call:10"
"HakulaPlayer" declared "call:10"
"Ethan" declared "fold:0"
"YangZ" declared "fold:0"
"Finneas" declared "call:10"
"Zheng" declared "call:10"
"RaphaelPlayer" declared "fold:0"
Street "flop" started. (community card = ['SA', 'H7', 'H9'])
"Zheng" declared "call:0"
"Yuchun" declared "call:0"
"HakulaPlayer" declared "call:0"
"Finneas" declared "call:0"
Street "turn" started. (community card = ['SA', 'H7', 'H9', 'CK'])
"Zheng" declared "call:0"
"Yuchun" declared "call:0"
"HakulaPlayer" declared "call:0"
"Finneas" declared "call:0"
Street "river" started. (community card = ['SA', 'H7', 'H9', 'CK', 'HJ'])
"Zheng" declared "call:0"
"Yuchun" declared "call:0"
"HakulaPlayer" declared "call:0"
"Finneas" declared "raise:455"
"Zheng" declared "fold:0"
"Yuchun" declared "fold:0"
"HakulaPlayer" declared "fold:0"
"['Finneas']" won the round 16 (stack = {'Zheng': 960, 'RaphaelPlayer': 964, 'SichengZuo': 970, 'Yuchun': 898, 'HakulaPlayer': 1303, 'Ethan': 985, 'YangZ': 970, 'Finneas': 950})
player [Zheng] gets hole card ['S4', 'HT'], current stack 960
player [RaphaelPlayer] gets hole card ['HK', 'DQ'], current stack 959
player [SichengZuo] gets hole card ['D8', 'D9'], current stack 960
player [Yuchun] gets hole card ['CQ', 'D5'], current stack 898
player [HakulaPlayer] gets hole card ['C6', 'H2'], current stack 1303
player [Ethan] gets hole card ['CA', 'S3'], current stack 985
player [YangZ] gets hole card ['D7', 'SK'], current stack 970
player [Finneas] gets hole card ['SA', 'H7'], current stack 950
Started the round 17
Street "preflop" started. (community card = [])
"Yuchun" declared "call:10"
"HakulaPlayer" declared "fold:0"
"Ethan" declared "fold:0"
"YangZ" declared "fold:0"
"Finneas" declared "call:10"
"Zheng" declared "call:10"
"RaphaelPlayer" declared "raise:30"
"SichengZuo" declared "fold:0"
"Yuchun" declared "call:30"
"Finneas" declared "fold:0"
"Zheng" declared "fold:0"
Street "flop" started. (community card = ['CJ', 'DT', 'C8'])
"RaphaelPlayer" declared "call:0"
"Yuchun" declared "call:0"
Street "turn" started. (community card = ['CJ', 'DT', 'C8', 'CT'])
"RaphaelPlayer" declared "call:0"
"Yuchun" declared "call:0"
Street "river" started. (community card = ['CJ', 'DT', 'C8', 'CT', 'D2'])
"RaphaelPlayer" declared "call:0"
"Yuchun" declared "call:0"
"['RaphaelPlayer']" won the round 17 (stack = {'Zheng': 950, 'RaphaelPlayer': 1024, 'SichengZuo': 960, 'Yuchun': 868, 'HakulaPlayer': 1303, 'Ethan': 985, 'YangZ': 970, 'Finneas': 940})
player [Zheng] gets hole card ['S8', 'SK'], current stack 950
player [RaphaelPlayer] gets hole card ['HK', 'DA'], current stack 1024
player [SichengZuo] gets hole card ['HQ', 'C8'], current stack 955
player [Yuchun] gets hole card ['CA', 'D2'], current stack 858
player [HakulaPlayer] gets hole card ['H7', 'S3'], current stack 1303
player [Ethan] gets hole card ['D5', 'HJ'], current stack 985
player [YangZ] gets hole card ['DJ', 'CJ'], current stack 970
player [Finneas] gets hole card ['C9', 'HT'], current stack 940
Started the round 18
Street "preflop" started. (community card = [])
"HakulaPlayer" declared "fold:0"
"Ethan" declared "fold:0"
"YangZ" declared "fold:0"
"Finneas" declared "call:10"
"Zheng" declared "call:10"
"RaphaelPlayer" declared "raise:30"
"SichengZuo" declared "fold:0"
"Yuchun" declared "call:30"
"Finneas" declared "fold:0"
"Zheng" declared "fold:0"
Street "flop" started. (community card = ['H8', 'C2', 'D7'])
"Yuchun" declared "call:0"
"RaphaelPlayer" declared "raise:95"
"Yuchun" declared "call:95"
Street "turn" started. (community card = ['H8', 'C2', 'D7', 'ST'])
"Yuchun" declared "call:0"
"RaphaelPlayer" declared "call:0"
Street "river" started. (community card = ['H8', 'C2', 'D7', 'ST', 'H6'])
"Yuchun" declared "call:0"
"RaphaelPlayer" declared "call:0"
"['Yuchun']" won the round 18 (stack = {'Zheng': 940, 'RaphaelPlayer': 899, 'SichengZuo': 955, 'Yuchun': 1018, 'HakulaPlayer': 1303, 'Ethan': 985, 'YangZ': 970, 'Finneas': 930})
player [Zheng] gets hole card ['SA', 'HK'], current stack 940
player [RaphaelPlayer] gets hole card ['S8', 'D2'], current stack 899
player [SichengZuo] gets hole card ['D9', 'S2'], current stack 955
player [Yuchun] gets hole card ['CK', 'SQ'], current stack 1013
player [HakulaPlayer] gets hole card ['C8', 'H9'], current stack 1293
player [Ethan] gets hole card ['C2', 'HQ'], current stack 985
player [YangZ] gets hole card ['DT', 'DK'], current stack 970
player [Finneas] gets hole card ['S5', 'S3'], current stack 930
Started the round 19
Street "preflop" started. (community card = [])
"Ethan" declared "fold:0"
"YangZ" declared "fold:0"
"Finneas" declared "call:10"
"Zheng" declared "call:10"
"RaphaelPlayer" declared "fold:0"
"SichengZuo" declared "fold:0"
"Yuchun" declared "call:10"
"HakulaPlayer" declared "call:10"
Street "flop" started. (community card = ['SK', 'C4', 'H8'])
"Yuchun" declared "call:0"
"HakulaPlayer" declared "call:0"
"Finneas" declared "call:0"
"Zheng" declared "call:0"
Street "turn" started. (community card = ['SK', 'C4', 'H8', 'HA'])
"Yuchun" declared "call:0"
"HakulaPlayer" declared "call:0"
"Finneas" declared "call:0"
"Zheng" declared "raise:930"
"Yuchun" declared "fold:0"
"HakulaPlayer" declared "fold:0"
"Finneas" declared "fold:0"
"['Zheng']" won the round 19 (stack = {'Zheng': 970, 'RaphaelPlayer': 899, 'SichengZuo': 955, 'Yuchun': 1008, 'HakulaPlayer': 1293, 'Ethan': 985, 'YangZ': 970, 'Finneas': 920})
player [Zheng] gets hole card ['C2', 'D4'], current stack 970
player [RaphaelPlayer] gets hole card ['SA', 'S2'], current stack 899
player [SichengZuo] gets hole card ['H6', 'HJ'], current stack 955
player [Yuchun] gets hole card ['CJ', 'H4'], current stack 1008
player [HakulaPlayer] gets hole card ['D6', 'H2'], current stack 1288
player [Ethan] gets hole card ['CK', 'S7'], current stack 975
player [YangZ] gets hole card ['CQ', 'H3'], current stack 970
player [Finneas] gets hole card ['C5', 'HT'], current stack 920
Started the round 20
Street "preflop" started. (community card = [])
"YangZ" declared "fold:0"
"Finneas" declared "call:10"
"Zheng" declared "call:10"
"RaphaelPlayer" declared "call:10"
"SichengZuo" declared "fold:0"
"Yuchun" declared "call:10"
"HakulaPlayer" declared "call:10"
"Ethan" declared "fold:0"
Street "flop" started. (community card = ['D8', 'C4', 'DK'])
"HakulaPlayer" declared "call:0"
"Finneas" declared "call:0"
"Zheng" declared "call:0"
"RaphaelPlayer" declared "call:0"
"Yuchun" declared "call:0"
Street "turn" started. (community card = ['D8', 'C4', 'DK', 'D7'])
"HakulaPlayer" declared "call:0"
"Finneas" declared "call:0"
"Zheng" declared "call:0"
"RaphaelPlayer" declared "call:0"
"Yuchun" declared "call:0"
Street "river" started. (community card = ['D8', 'C4', 'DK', 'D7', 'DT'])
"HakulaPlayer" declared "call:0"
"Finneas" declared "call:0"
"Zheng" declared "call:0"
"RaphaelPlayer" declared "call:0"
"Yuchun" declared "call:0"
"['HakulaPlayer']" won the round 20 (stack = {'Zheng': 960, 'RaphaelPlayer': 889, 'SichengZuo': 955, 'Yuchun': 998, 'HakulaPlayer': 1343, 'Ethan': 975, 'YangZ': 970, 'Finneas': 910})
player [Zheng] gets hole card ['C5', 'H4'], current stack 960
player [RaphaelPlayer] gets hole card ['DT', 'SK'], current stack 889
player [SichengZuo] gets hole card ['HA', 'D6'], current stack 955
player [Yuchun] gets hole card ['H7', 'S4'], current stack 998
player [HakulaPlayer] gets hole card ['DK', 'C3'], current stack 1343
player [Ethan] gets hole card ['H5', 'C7'], current stack 970
player [YangZ] gets hole card ['S8', 'H3'], current stack 960
player [Finneas] gets hole card ['HK', 'ST'], current stack 910
Started the round 21
Street "preflop" started. (community card = [])
"Finneas" declared "call:10"
"Zheng" declared "call:10"
"RaphaelPlayer" declared "raise:30"
"SichengZuo" declared "fold:0"
"Yuchun" declared "call:30"
"HakulaPlayer" declared "call:30"
"Ethan" declared "fold:0"
"YangZ" declared "fold:0"
"Finneas" declared "fold:0"
"Zheng" declared "call:30"
Street "flop" started. (community card = ['H8', 'D8', 'SQ'])
"Zheng" declared "call:0"
"RaphaelPlayer" declared "call:0"
"Yuchun" declared "call:0"
"HakulaPlayer" declared "raise:80"
"Zheng" declared "call:80"
"RaphaelPlayer" declared "fold:0"
"Yuchun" declared "fold:0"
Street "turn" started. (community card = ['H8', 'D8', 'SQ', 'H6'])
"Zheng" declared "call:0"
"HakulaPlayer" declared "call:0"
Street "river" started. (community card = ['H8', 'D8', 'SQ', 'H6', 'S7'])
"Zheng" declared "raise:850"
"HakulaPlayer" declared "fold:0"
"['Zheng']" won the round 21 (stack = {'Zheng': 1155, 'RaphaelPlayer': 859, 'SichengZuo': 955, 'Yuchun': 968, 'HakulaPlayer': 1233, 'Ethan': 970, 'YangZ': 960, 'Finneas': 900})
player [Zheng] gets hole card ['C7', 'H7'], current stack 1155
player [RaphaelPlayer] gets hole card ['C9', 'C8'], current stack 859
player [SichengZuo] gets hole card ['SK', 'DJ'], current stack 955
player [Yuchun] gets hole card ['DT', 'HJ'], current stack 968
player [HakulaPlayer] gets hole card ['H6', 'D4'], current stack 1233
player [Ethan] gets hole card ['HQ', 'DA'], current stack 970
player [YangZ] gets hole card ['H3', 'S6'], current stack 955
player [Finneas] gets hole card ['HT', 'S8'], current stack 890
Started the round 22
Street "preflop" started. (community card = [])
"Zheng" declared "call:10"
"RaphaelPlayer" declared "call:10"
"SichengZuo" declared "fold:0"
"Yuchun" declared "call:10"
"HakulaPlayer" declared "call:10"
"Ethan" declared "raise:145"
"YangZ" declared "fold:0"
"Finneas" declared "fold:0"
"Zheng" declared "call:145"
"RaphaelPlayer" declared "call:145"
"Yuchun" declared "call:145"
"HakulaPlayer" declared "fold:0"
Street "flop" started. (community card = ['C6', 'D5', 'D8'])
"Zheng" declared "call:0"
"RaphaelPlayer" declared "call:0"
"Yuchun" declared "call:0"
"Ethan" declared "call:0"
Street "turn" started. (community card = ['C6', 'D5', 'D8', 'ST'])
"Zheng" declared "call:0"
"RaphaelPlayer" declared "call:0"
"Yuchun" declared "call:0"
"Ethan" declared "call:0"
Street "river" started. (community card = ['C6', 'D5', 'D8', 'ST', 'DQ'])
"Zheng" declared "call:0"
"RaphaelPlayer" declared "call:0"
"Yuchun" declared "call:0"
"Ethan" declared "call:0"
"['Ethan']" won the round 22 (stack = {'Zheng': 1010, 'RaphaelPlayer': 714, 'SichengZuo': 955, 'Yuchun': 823, 'HakulaPlayer': 1223, 'Ethan': 1430, 'YangZ': 955, 'Finneas': 890})
player [Zheng] gets hole card ['C9', 'CA'], current stack 1000
player [RaphaelPlayer] gets hole card ['D7', 'S6'], current stack 714
player [SichengZuo] gets hole card ['DK', 'C8'], current stack 955
player [Yuchun] gets hole card ['H6', 'S9'], current stack 823
player [HakulaPlayer] gets hole card ['C5', 'CK'], current stack 1223
player [Ethan] gets hole card ['D8', 'D4'], current stack 1430
player [YangZ] gets hole card ['H4', 'HK'], current stack 955
player [Finneas] gets hole card ['H2', 'C4'], current stack 885
Started the round 23
Street "preflop" started. (community card = [])
"RaphaelPlayer" declared "fold:0"
"SichengZuo" declared "fold:0"
"Yuchun" declared "call:10"
"HakulaPlayer" declared "call:10"
"Ethan" declared "fold:0"
"YangZ" declared "fold:0"
"Finneas" declared "call:10"
"Zheng" declared "call:10"
Street "flop" started. (community card = ['S2', 'S5', 'H8'])
"Finneas" declared "call:0"
"Zheng" declared "call:0"
"Yuchun" declared "call:0"
"HakulaPlayer" declared "call:0"
Street "turn" started. (community card = ['S2', 'S5', 'H8', 'HT'])
"Finneas" declared "call:0"
"Zheng" declared "call:0"
"Yuchun" declared "call:0"
"HakulaPlayer" declared "call:0"
Street "river" started. (community card = ['S2', 'S5', 'H8', 'HT', 'S4'])
"Finneas" declared "call:0"
"Zheng" declared "call:0"
"Yuchun" declared "call:0"
"HakulaPlayer" declared "call:0"
"['Finneas']" won the round 23 (stack = {'Zheng': 1000, 'RaphaelPlayer': 714, 'SichengZuo': 955, 'Yuchun': 813, 'HakulaPlayer': 1213, 'Ethan': 1430, 'YangZ': 955, 'Finneas': 920})
player [Zheng] gets hole card ['H4', 'H6'], current stack 995
player [RaphaelPlayer] gets hole card ['DJ', 'C5'], current stack 704
player [SichengZuo] gets hole card ['C9', 'D3'], current stack 955
player [Yuchun] gets hole card ['DT', 'H3'], current stack 813
player [HakulaPlayer] gets hole card ['HT', 'S9'], current stack 1213
player [Ethan] gets hole card ['H7', 'H8'], current stack 1430
player [YangZ] gets hole card ['D8', 'SJ'], current stack 955
player [Finneas] gets hole card ['S7', 'D7'], current stack 920
Started the round 24
Street "preflop" started. (community card = [])
"SichengZuo" declared "fold:0"
"Yuchun" declared "call:10"
"HakulaPlayer" declared "call:10"
"Ethan" declared "fold:0"
"YangZ" declared "fold:0"
"Finneas" declared "call:10"
"Zheng" declared "call:10"
"RaphaelPlayer" declared "fold:0"
Street "flop" started. (community card = ['HJ', 'SA', 'SQ'])
"Zheng" declared "call:0"
"Yuchun" declared "call:0"
"HakulaPlayer" declared "call:0"
"Finneas" declared "call:0"
Street "turn" started. (community card = ['HJ', 'SA', 'SQ', 'DK'])
"Zheng" declared "call:0"
"Yuchun" declared "raise:803"
"HakulaPlayer" declared "call:803"
"Finneas" declared "fold:0"
"Zheng" declared "fold:0"
Street "river" started. (community card = ['HJ', 'SA', 'SQ', 'DK', 'H9'])
"['Yuchun', 'HakulaPlayer']" won the round 24 (stack = {'Zheng': 990, 'RaphaelPlayer': 704, 'SichengZuo': 955, 'Yuchun': 828, 'HakulaPlayer': 1228, 'Ethan': 1430, 'YangZ': 955, 'Finneas': 910})
player [Zheng] gets hole card ['SK', 'CA'], current stack 990
player [RaphaelPlayer] gets hole card ['C4', 'ST'], current stack 699
player [SichengZuo] gets hole card ['HK', 'CQ'], current stack 945
player [Yuchun] gets hole card ['H2', 'H4'], current stack 828
player [HakulaPlayer] gets hole card ['D8', 'S7'], current stack 1228
player [Ethan] gets hole card ['D9', 'H3'], current stack 1430
player [YangZ] gets hole card ['DT', 'S8'], current stack 955
player [Finneas] gets hole card ['S9', 'C9'], current stack 910
Started the round 25
Street "preflop" started. (community card = [])
"Yuchun" declared "call:10"
"HakulaPlayer" declared "call:10"
"Ethan" declared "fold:0"
"YangZ" declared "fold:0"
"Finneas" declared "call:10"
"Zheng" declared "call:10"
"RaphaelPlayer" declared "fold:0"
"SichengZuo" declared "fold:0"
Street "flop" started. (community card = ['DQ', 'D4', 'S3'])
"Yuchun" declared "call:0"
"HakulaPlayer" declared "call:0"
"Finneas" declared "call:0"
"Zheng" declared "call:0"
Street "turn" started. (community card = ['DQ', 'D4', 'S3', 'CJ'])
"Yuchun" declared "call:0"
"HakulaPlayer" declared "call:0"
"Finneas" declared "call:0"
"Zheng" declared "call:0"
Street "river" started. (community card = ['DQ', 'D4', 'S3', 'CJ', 'DK'])
"Yuchun" declared "call:0"
"HakulaPlayer" declared "call:0"
"Finneas" declared "call:0"
"Zheng" declared "call:0"
"['Zheng']" won the round 25 (stack = {'Zheng': 1035, 'RaphaelPlayer': 699, 'SichengZuo': 945, 'Yuchun': 818, 'HakulaPlayer': 1218, 'Ethan': 1430, 'YangZ': 955, 'Finneas': 900})
player [Zheng] gets hole card ['DQ', 'S3'], current stack 1035
player [RaphaelPlayer] gets hole card ['H3', 'HK'], current stack 699
player [SichengZuo] gets hole card ['SQ', 'HA'], current stack 940
player [Yuchun] gets hole card ['D6', 'S6'], current stack 808
player [HakulaPlayer] gets hole card ['H2', 'S4'], current stack 1218
player [Ethan] gets hole card ['HQ', 'SA'], current stack 1430
player [YangZ] gets hole card ['C7', 'DA'], current stack 955
player [Finneas] gets hole card ['CQ', 'C3'], current stack 900
Started the round 26
Street "preflop" started. (community card = [])
"HakulaPlayer" declared "fold:0"
"Ethan" declared "raise:214"
"YangZ" declared "fold:0"
"Finneas" declared "fold:0"
"Zheng" declared "fold:0"
"RaphaelPlayer" declared "fold:0"
"SichengZuo" declared "fold:0"
"Yuchun" declared "call:214"
Street "flop" started. (community card = ['DT', 'D9', 'S2'])
"Yuchun" declared "call:0"
"Ethan" declared "call:0"
Street "turn" started. (community card = ['DT', 'D9', 'S2', 'H7'])
"Yuchun" declared "call:0"
"Ethan" declared "call:0"
Street "river" started. (community card = ['DT', 'D9', 'S2', 'H7', 'HT'])
"Yuchun" declared "call:0"
"Ethan" declared "call:0"
"['Yuchun']" won the round 26 (stack = {'Zheng': 1035, 'RaphaelPlayer': 699, 'SichengZuo': 940, 'Yuchun': 1037, 'HakulaPlayer': 1218, 'Ethan': 1216, 'YangZ': 955, 'Finneas': 900})
player [Zheng] gets hole card ['D5', 'DQ'], current stack 1035
player [RaphaelPlayer] gets hole card ['C4', 'SJ'], current stack 699
player [SichengZuo] gets hole card ['D3', 'S5'], current stack 940
player [Yuchun] gets hole card ['SK', 'H6'], current stack 1032
player [HakulaPlayer] gets hole card ['C2', 'DT'], current stack 1208
player [Ethan] gets hole card ['C5', 'S4'], current stack 1216
player [YangZ] gets hole card ['S7', 'ST'], current stack 955
player [Finneas] gets hole card ['HT', 'C9'], current stack 900
Started the round 27
Street "preflop" started. (community card = [])
"Ethan" declared "fold:0"
"YangZ" declared "fold:0"
"Finneas" declared "call:10"
"Zheng" declared "call:10"
"RaphaelPlayer" declared "fold:0"
"SichengZuo" declared "fold:0"
"Yuchun" declared "call:10"
"HakulaPlayer" declared "call:10"
Street "flop" started. (community card = ['HA', 'CQ', 'HK'])
"Yuchun" declared "call:0"
"HakulaPlayer" declared "call:0"
"Finneas" declared "call:0"
"Zheng" declared "call:0"
Street "turn" started. (community card = ['HA', 'CQ', 'HK', 'HQ'])
"Yuchun" declared "call:0"
"HakulaPlayer" declared "call:0"
"Finneas" declared "call:0"
"Zheng" declared "call:0"
Street "river" started. (community card = ['HA', 'CQ', 'HK', 'HQ', 'D6'])
"Yuchun" declared "call:0"
"HakulaPlayer" declared "call:0"
"Finneas" declared "call:0"
"Zheng" declared "raise:517"
"Yuchun" declared "fold:0"
"HakulaPlayer" declared "fold:0"
"Finneas" declared "fold:0"
"['Zheng']" won the round 27 (stack = {'Zheng': 1065, 'RaphaelPlayer': 699, 'SichengZuo': 940, 'Yuchun': 1027, 'HakulaPlayer': 1208, 'Ethan': 1216, 'YangZ': 955, 'Finneas': 890})
player [Zheng] gets hole card ['SJ', 'S3'], current stack 1065
player [RaphaelPlayer] gets hole card ['DQ', 'HK'], current stack 699
player [SichengZuo] gets hole card ['DK', 'H8'], current stack 940
player [Yuchun] gets hole card ['C8', 'S4'], current stack 1027
player [HakulaPlayer] gets hole card ['CA', 'S9'], current stack 1203
player [Ethan] gets hole card ['S5', 'SQ'], current stack 1206
player [YangZ] gets hole card ['C9', 'H5'], current stack 955
player [Finneas] gets hole card ['C4', 'S7'], current stack 890
Started the round 28
Street "preflop" started. (community card = [])
"YangZ" declared "fold:0"
"Finneas" declared "call:10"
"Zheng" declared "call:10"
"RaphaelPlayer" declared "call:10"
"SichengZuo" declared "fold:0"
"Yuchun" declared "call:10"
"HakulaPlayer" declared "call:10"
"Ethan" declared "fold:0"
Street "flop" started. (community card = ['H3', 'C5', 'S2'])
"HakulaPlayer" declared "call:0"
"Finneas" declared "call:0"
"Zheng" declared "call:0"
"RaphaelPlayer" declared "call:0"
"Yuchun" declared "call:0"
Street "turn" started. (community card = ['H3', 'C5', 'S2', 'SK'])
"HakulaPlayer" declared "call:0"
"Finneas" declared "call:0"
"Zheng" declared "call:0"
"RaphaelPlayer" declared "call:0"
"Yuchun" declared "call:0"
Street "river" started. (community card = ['H3', 'C5', 'S2', 'SK', 'H7'])
"HakulaPlayer" declared "call:0"
"Finneas" declared "call:0"
"Zheng" declared "call:0"
"RaphaelPlayer" declared "raise:70"
"Yuchun" declared "fold:0"
"HakulaPlayer" declared "fold:0"
"Finneas" declared "fold:0"
"Zheng" declared "call:70"
"['RaphaelPlayer']" won the round 28 (stack = {'Zheng': 985, 'RaphaelPlayer': 819, 'SichengZuo': 940, 'Yuchun': 1017, 'HakulaPlayer': 1198, 'Ethan': 1206, 'YangZ': 955, 'Finneas': 880})
player [Zheng] gets hole card ['SA', 'H6'], current stack 985
player [RaphaelPlayer] gets hole card ['D9', 'H4'], current stack 819
player [SichengZuo] gets hole card ['C6', 'DT'], current stack 940
player [Yuchun] gets hole card ['HQ', 'CJ'], current stack 1017
player [HakulaPlayer] gets hole card ['CA', 'HK'], current stack 1198
player [Ethan] gets hole card ['HT', 'SQ'], current stack 1201
player [YangZ] gets hole card ['CT', 'C3'], current stack 945
player [Finneas] gets hole card ['C2', 'C8'], current stack 880
Started the round 29
Street "preflop" started. (community card = [])
"Finneas" declared "call:10"
"Zheng" declared "call:10"
"RaphaelPlayer" declared "fold:0"
"SichengZuo" declared "fold:0"
"Yuchun" declared "call:10"
"HakulaPlayer" declared "raise:40"
"Ethan" declared "fold:0"
"YangZ" declared "fold:0"
"Finneas" declared "fold:0"
"Zheng" declared "call:40"
"Yuchun" declared "call:40"
Street "flop" started. (community card = ['S2', 'D7', 'ST'])
"Zheng" declared "call:0"
"Yuchun" declared "call:0"
"HakulaPlayer" declared "call:0"
Street "turn" started. (community card = ['S2', 'D7', 'ST', 'D3'])
"Zheng" declared "call:0"
"Yuchun" declared "call:0"
"HakulaPlayer" declared "call:0"
Street "river" started. (community card = ['S2', 'D7', 'ST', 'D3', 'H7'])
"Zheng" declared "call:0"
"Yuchun" declared "call:0"
"HakulaPlayer" declared "call:0"
"['HakulaPlayer']" won the round 29 (stack = {'Zheng': 945, 'RaphaelPlayer': 819, 'SichengZuo': 940, 'Yuchun': 977, 'HakulaPlayer': 1303, 'Ethan': 1201, 'YangZ': 945, 'Finneas': 870})
player [Zheng] gets hole card ['S4', 'SK'], current stack 945
player [RaphaelPlayer] gets hole card ['D6', 'C4'], current stack 819
player [SichengZuo] gets hole card ['C7', 'D7'], current stack 940
player [Yuchun] gets hole card ['S3', 'D5'], current stack 977
player [HakulaPlayer] gets hole card ['D3', 'SA'], current stack 1303
player [Ethan] gets hole card ['D4', 'C2'], current stack 1201
player [YangZ] gets hole card ['SJ', 'S5'], current stack 940
player [Finneas] gets hole card ['H8', 'HQ'], current stack 860
Started the round 30
Street "preflop" started. (community card = [])
"Zheng" declared "call:10"
"RaphaelPlayer" declared "fold:0"
"SichengZuo" declared "fold:0"
"Yuchun" declared "call:10"
"HakulaPlayer" declared "call:10"
"Ethan" declared "fold:0"
"YangZ" declared "fold:0"
"Finneas" declared "call:10"
Street "flop" started. (community card = ['HA', 'HT', 'CA'])
"Finneas" declared "call:0"
"Zheng" declared "call:0"
"Yuchun" declared "call:0"
"HakulaPlayer" declared "raise:87"
"Finneas" declared "fold:0"
"Zheng" declared "call:87"
"Yuchun" declared "fold:0"
Street "turn" started. (community card = ['HA', 'HT', 'CA', 'D9'])
"Zheng" declared "call:0"
"HakulaPlayer" declared "raise:450"
"Zheng" declared "fold:0"
"['HakulaPlayer']" won the round 30 (stack = {'Zheng': 848, 'RaphaelPlayer': 819, 'SichengZuo': 940, 'Yuchun': 967, 'HakulaPlayer': 1425, 'Ethan': 1201, 'YangZ': 940, 'Finneas': 860})
player [Zheng] gets hole card ['D7', 'D2'], current stack 838
player [RaphaelPlayer] gets hole card ['H8', 'H3'], current stack 819
player [SichengZuo] gets hole card ['H5', 'SK'], current stack 940
player [Yuchun] gets hole card ['SA', 'CJ'], current stack 967
player [HakulaPlayer] gets hole card ['CT', 'S8'], current stack 1425
player [Ethan] gets hole card ['HT', 'HQ'], current stack 1201
player [YangZ] gets hole card ['S7', 'S9'], current stack 940
player [Finneas] gets hole card ['C8', 'C7'], current stack 855
Started the round 31
Street "preflop" started. (community card = [])
"RaphaelPlayer" declared "fold:0"
"SichengZuo" declared "fold:0"
"Yuchun" declared "call:10"
"HakulaPlayer" declared "call:10"
"Ethan" declared "fold:0"
"YangZ" declared "fold:0"
"Finneas" declared "call:10"
"Zheng" declared "call:10"
Street "flop" started. (community card = ['H7', 'D5', 'D6'])
"Finneas" declared "call:0"
"Zheng" declared "call:0"
"Yuchun" declared "call:0"
"HakulaPlayer" declared "call:0"
Street "turn" started. (community card = ['H7', 'D5', 'D6', 'CK'])
"Finneas" declared "call:0"
"Zheng" declared "call:0"
"Yuchun" declared "call:0"
"HakulaPlayer" declared "call:0"
Street "river" started. (community card = ['H7', 'D5', 'D6', 'CK', 'S5'])
"Finneas" declared "call:0"
"Zheng" declared "call:0"
"Yuchun" declared "call:0"
"HakulaPlayer" declared "call:0"
"['Zheng', 'Finneas']" won the round 31 (stack = {'Zheng': 858, 'RaphaelPlayer': 819, 'SichengZuo': 940, 'Yuchun': 957, 'HakulaPlayer': 1415, 'Ethan': 1201, 'YangZ': 940, 'Finneas': 870})
player [Zheng] gets hole card ['H2', 'C2'], current stack 853
player [RaphaelPlayer] gets hole card ['DJ', 'HK'], current stack 809
player [SichengZuo] gets hole card ['H6', 'S8'], current stack 940
player [Yuchun] gets hole card ['S7', 'CQ'], current stack 957
player [HakulaPlayer] gets hole card ['H9', 'D4'], current stack 1415
player [Ethan] gets hole card ['CK', 'ST'], current stack 1201
player [YangZ] gets hole card ['S4', 'S2'], current stack 940
player [Finneas] gets hole card ['H7', 'SA'], current stack 870
Started the round 32
Street "preflop" started. (community card = [])
"SichengZuo" declared "fold:0"
"Yuchun" declared "call:10"
"HakulaPlayer" declared "call:10"
"Ethan" declared "fold:0"
"YangZ" declared "fold:0"
"Finneas" declared "call:10"
"Zheng" declared "call:10"
"RaphaelPlayer" declared "call:10"
Street "flop" started. (community card = ['C6', 'HJ', 'HT'])
"Zheng" declared "call:0"
"RaphaelPlayer" declared "raise:60"
"Yuchun" declared "fold:0"
"HakulaPlayer" declared "fold:0"
"Finneas" declared "fold:0"
"Zheng" declared "call:60"
Street "turn" started. (community card = ['C6', 'HJ', 'HT', 'DT'])
"Zheng" declared "call:0"
"RaphaelPlayer" declared "raise:180"
"Zheng" declared "fold:0"
"['RaphaelPlayer']" won the round 32 (stack = {'Zheng': 788, 'RaphaelPlayer': 919, 'SichengZuo': 940, 'Yuchun': 947, 'HakulaPlayer': 1405, 'Ethan': 1201, 'YangZ': 940, 'Finneas': 860})
player [Zheng] gets hole card ['C6', 'C5'], current stack 788
player [RaphaelPlayer] gets hole card ['DT', 'CK'], current stack 914
player [SichengZuo] gets hole card ['DJ', 'S5'], current stack 930
player [Yuchun] gets hole card ['H6', 'C9'], current stack 947
player [HakulaPlayer] gets hole card ['C8', 'S8'], current stack 1405
player [Ethan] gets hole card ['S6', 'HJ'], current stack 1201
player [YangZ] gets hole card ['H8', 'SK'], current stack 940
player [Finneas] gets hole card ['HT', 'S4'], current stack 860
Started the round 33
Street "preflop" started. (community card = [])
"Yuchun" declared "call:10"
"HakulaPlayer" declared "raise:38"
"Ethan" declared "fold:0"
"YangZ" declared "fold:0"
"Finneas" declared "fold:0"
"Zheng" declared "call:38"
"RaphaelPlayer" declared "call:38"
"SichengZuo" declared "fold:0"
"Yuchun" declared "call:38"
Street "flop" started. (community card = ['D5', 'H7', 'DK'])
"RaphaelPlayer" declared "raise:172"
"Yuchun" declared "fold:0"
"HakulaPlayer" declared "fold:0"
"Zheng" declared "fold:0"
"['RaphaelPlayer']" won the round 33 (stack = {'Zheng': 750, 'RaphaelPlayer': 1043, 'SichengZuo': 930, 'Yuchun': 909, 'HakulaPlayer': 1367, 'Ethan': 1201, 'YangZ': 940, 'Finneas': 860})
player [Zheng] gets hole card ['C6', 'S7'], current stack 750
player [RaphaelPlayer] gets hole card ['D5', 'CJ'], current stack 1043
player [SichengZuo] gets hole card ['D4', 'H3'], current stack 925
player [Yuchun] gets hole card ['D3', 'HT'], current stack 899
player [HakulaPlayer] gets hole card ['C8', 'DK'], current stack 1367
player [Ethan] gets hole card ['H6', 'C4'], current stack 1201
player [YangZ] gets hole card ['D8', 'DJ'], current stack 940
player [Finneas] gets hole card ['S5', 'D7'], current stack 860
Started the round 34
Street "preflop" started. (community card = [])
"HakulaPlayer" declared "call:10"
"Ethan" declared "fold:0"
"YangZ" declared "fold:0"
"Finneas" declared "call:10"
"Zheng" declared "call:10"
"RaphaelPlayer" declared "fold:0"
"SichengZuo" declared "fold:0"
"Yuchun" declared "call:10"
Street "flop" started. (community card = ['SJ', 'CQ', 'H9'])
"Yuchun" declared "call:0"
"HakulaPlayer" declared "call:0"
"Finneas" declared "call:0"
"Zheng" declared "call:0"
Street "turn" started. (community card = ['SJ', 'CQ', 'H9', 'CK'])
"Yuchun" declared "raise:899"
"HakulaPlayer" declared "fold:0"
"Finneas" declared "fold:0"
"Zheng" declared "fold:0"
"['Yuchun']" won the round 34 (stack = {'Zheng': 740, 'RaphaelPlayer': 1043, 'SichengZuo': 925, 'Yuchun': 944, 'HakulaPlayer': 1357, 'Ethan': 1201, 'YangZ': 940, 'Finneas': 850})
player [Zheng] gets hole card ['C7', 'C6'], current stack 740
player [RaphaelPlayer] gets hole card ['D5', 'SK'], current stack 1043
player [SichengZuo] gets hole card ['CA', 'DQ'], current stack 925
player [Yuchun] gets hole card ['DA', 'S5'], current stack 939
player [HakulaPlayer] gets hole card ['C3', 'DK'], current stack 1347
player [Ethan] gets hole card ['D3', 'D7'], current stack 1201
player [YangZ] gets hole card ['S2', 'HQ'], current stack 940
player [Finneas] gets hole card ['DT', 'HJ'], current stack 850
Started the round 35
Street "preflop" started. (community card = [])
"Ethan" declared "fold:0"
"YangZ" declared "fold:0"
"Finneas" declared "call:10"
"Zheng" declared "call:10"
"RaphaelPlayer" declared "call:10"
"SichengZuo" declared "fold:0"
"Yuchun" declared "call:10"
"HakulaPlayer" declared "call:10"
Street "flop" started. (community card = ['H2', 'S6', 'CQ'])
"Yuchun" declared "call:0"
"HakulaPlayer" declared "call:0"
"Finneas" declared "call:0"
"Zheng" declared "call:0"
"RaphaelPlayer" declared "call:0"
Street "turn" started. (community card = ['H2', 'S6', 'CQ', 'D9'])
"Yuchun" declared "call:0"
"HakulaPlayer" declared "call:0"
"Finneas" declared "call:0"
"Zheng" declared "call:0"
"RaphaelPlayer" declared "call:0"
Street "river" started. (community card = ['H2', 'S6', 'CQ', 'D9', 'C8'])
"Yuchun" declared "call:0"
"HakulaPlayer" declared "call:0"
"Finneas" declared "call:0"
"Zheng" declared "call:0"
"RaphaelPlayer" declared "call:0"
"['Finneas']" won the round 35 (stack = {'Zheng': 730, 'RaphaelPlayer': 1033, 'SichengZuo': 925, 'Yuchun': 934, 'HakulaPlayer': 1347, 'Ethan': 1201, 'YangZ': 940, 'Finneas': 890})
player [Zheng] gets hole card ['C6', 'ST'], current stack 730
player [RaphaelPlayer] gets hole card ['CT', 'CQ'], current stack 1033
player [SichengZuo] gets hole card ['D3', 'H3'], current stack 925
player [Yuchun] gets hole card ['H2', 'HA'], current stack 934
player [HakulaPlayer] gets hole card ['D6', 'S2'], current stack 1342
player [Ethan] gets hole card ['CK', 'DA'], current stack 1191
player [YangZ] gets hole card ['DT', 'DK'], current stack 940
player [Finneas] gets hole card ['S6', 'S9'], current stack 890
Started the round 36
Street "preflop" started. (community card = [])
"YangZ" declared "fold:0"
"Finneas" declared "call:10"
"Zheng" declared "call:10"
"RaphaelPlayer" declared "call:10"
"SichengZuo" declared "fold:0"
"Yuchun" declared "call:10"
"HakulaPlayer" declared "call:10"
"Ethan" declared "raise:360"
"Finneas" declared "fold:0"
"Zheng" declared "fold:0"
"RaphaelPlayer" declared "fold:0"
"Yuchun" declared "fold:0"
"HakulaPlayer" declared "fold:0"
"['Ethan']" won the round 36 (stack = {'Zheng': 720, 'RaphaelPlayer': 1023, 'SichengZuo': 925, 'Yuchun': 924, 'HakulaPlayer': 1337, 'Ethan': 1251, 'YangZ': 940, 'Finneas': 880})
player [Zheng] gets hole card ['C8', 'CK'], current stack 720
player [RaphaelPlayer] gets hole card ['S8', 'H3'], current stack 1023
player [SichengZuo] gets hole card ['D4', 'C4'], current stack 925
player [Yuchun] gets hole card ['C9', 'H7'], current stack 924
player [HakulaPlayer] gets hole card ['H8', 'C5'], current stack 1337
player [Ethan] gets hole card ['H5', 'H6'], current stack 1246
player [YangZ] gets hole card ['SQ', 'SJ'], current stack 930
player [Finneas] gets hole card ['SA', 'HQ'], current stack 880
Started the round 37
Street "preflop" started. (community card = [])
"Finneas" declared "raise:447"
"Zheng" declared "fold:0"
"RaphaelPlayer" declared "fold:0"
"SichengZuo" declared "fold:0"
"Yuchun" declared "fold:0"
"HakulaPlayer" declared "fold:0"
"Ethan" declared "fold:0"
"YangZ" declared "fold:0"
"['Finneas']" won the round 37 (stack = {'Zheng': 720, 'RaphaelPlayer': 1023, 'SichengZuo': 925, 'Yuchun': 924, 'HakulaPlayer': 1337, 'Ethan': 1246, 'YangZ': 930, 'Finneas': 895})
player [Zheng] gets hole card ['S6', 'S9'], current stack 720
player [RaphaelPlayer] gets hole card ['C6', 'C7'], current stack 1023
player [SichengZuo] gets hole card ['HJ', 'H3'], current stack 925
player [Yuchun] gets hole card ['DJ', 'CK'], current stack 924
player [HakulaPlayer] gets hole card ['SA', 'S4'], current stack 1337
player [Ethan] gets hole card ['H8', 'D5'], current stack 1246
player [YangZ] gets hole card ['S8', 'D7'], current stack 925
player [Finneas] gets hole card ['S5', 'DA'], current stack 885
Started the round 38
Street "preflop" started. (community card = [])
"Zheng" declared "call:10"
"RaphaelPlayer" declared "fold:0"
"SichengZuo" declared "fold:0"
"Yuchun" declared "call:10"
"HakulaPlayer" declared "call:10"
"Ethan" declared "fold:0"
"YangZ" declared "fold:0"
"Finneas" declared "call:10"
Street "flop" started. (community card = ['H5', 'C4', 'H6'])
"Finneas" declared "call:0"
"Zheng" declared "call:0"
"Yuchun" declared "call:0"
"HakulaPlayer" declared "call:0"
Street "turn" started. (community card = ['H5', 'C4', 'H6', 'HA'])
"Finneas" declared "call:0"
"Zheng" declared "call:0"
"Yuchun" declared "call:0"
"HakulaPlayer" declared "call:0"
Street "river" started. (community card = ['H5', 'C4', 'H6', 'HA', 'CQ'])
"Finneas" declared "call:0"
"Zheng" declared "call:0"
"Yuchun" declared "call:0"
"HakulaPlayer" declared "raise:97"
"Finneas" declared "fold:0"
"Zheng" declared "call:97"
"Yuchun" declared "fold:0"
"['HakulaPlayer']" won the round 38 (stack = {'Zheng': 613, 'RaphaelPlayer': 1023, 'SichengZuo': 925, 'Yuchun': 914, 'HakulaPlayer': 1469, 'Ethan': 1246, 'YangZ': 925, 'Finneas': 885})
player [Zheng] gets hole card ['CQ', 'C9'], current stack 603
player [RaphaelPlayer] gets hole card ['H7', 'HT'], current stack 1023
player [SichengZuo] gets hole card ['D4', 'D6'], current stack 925
player [Yuchun] gets hole card ['H9', 'HK'], current stack 914
player [HakulaPlayer] gets hole card ['S9', 'DK'], current stack 1469
player [Ethan] gets hole card ['D8', 'D3'], current stack 1246
player [YangZ] gets hole card ['HJ', 'SA'], current stack 925
player [Finneas] gets hole card ['C5', 'SK'], current stack 880
Started the round 39
Street "preflop" started. (community card = [])
"RaphaelPlayer" declared "call:10"
"SichengZuo" declared "fold:0"
"Yuchun" declared "call:10"
"HakulaPlayer" declared "call:10"
"Ethan" declared "fold:0"
"YangZ" declared "fold:0"
"Finneas" declared "call:10"
"Zheng" declared "call:10"
Street "flop" started. (community card = ['D9', 'S4', 'C6'])
"Finneas" declared "call:0"
"Zheng" declared "call:0"
"RaphaelPlayer" declared "call:0"
"Yuchun" declared "call:0"
"HakulaPlayer" declared "call:0"
Street "turn" started. (community card = ['D9', 'S4', 'C6', 'S6'])
"Finneas" declared "call:0"
"Zheng" declared "call:0"
"RaphaelPlayer" declared "call:0"
"Yuchun" declared "call:0"
"HakulaPlayer" declared "raise:48"
"Finneas" declared "fold:0"
"Zheng" declared "call:48"
"RaphaelPlayer" declared "fold:0"
"Yuchun" declared "call:48"
Street "river" started. (community card = ['D9', 'S4', 'C6', 'S6', 'C7'])
"Zheng" declared "call:0"
"Yuchun" declared "raise:40"
"HakulaPlayer" declared "call:40"
"Zheng" declared "call:40"
"['Yuchun', 'HakulaPlayer']" won the round 39 (stack = {'Zheng': 515, 'RaphaelPlayer': 1013, 'SichengZuo': 925, 'Yuchun': 973, 'HakulaPlayer': 1528, 'Ethan': 1246, 'YangZ': 925, 'Finneas': 875})
player [Zheng] gets hole card ['CQ', 'D8'], current stack 510
player [RaphaelPlayer] gets hole card ['C8', 'HJ'], current stack 1003
player [SichengZuo] gets hole card ['S2', 'S3'], current stack 925
player [Yuchun] gets hole card ['CA', 'S4'], current stack 973
player [HakulaPlayer] gets hole card ['ST', 'DQ'], current stack 1528
player [Ethan] gets hole card ['D6', 'C2'], current stack 1246
player [YangZ] gets hole card ['H2', 'C9'], current stack 925
player [Finneas] gets hole card ['H8', 'D9'], current stack 875
Started the round 40
Street "preflop" started. (community card = [])
"SichengZuo" declared "fold:0"
"Yuchun" declared "call:10"
"HakulaPlayer" declared "call:10"
"Ethan" declared "fold:0"
"YangZ" declared "fold:0"
"Finneas" declared "call:10"
"Zheng" declared "call:10"
"RaphaelPlayer" declared "call:10"
Street "flop" started. (community card = ['D2', 'H9', 'SJ'])
"Zheng" declared "call:0"
"RaphaelPlayer" declared "call:0"
"Yuchun" declared "call:0"
"HakulaPlayer" declared "call:0"
"Finneas" declared "call:0"
Street "turn" started. (community card = ['D2', 'H9', 'SJ', 'DA'])
"Zheng" declared "call:0"
"RaphaelPlayer" declared "call:0"
"Yuchun" declared "call:0"
"HakulaPlayer" declared "call:0"
"Finneas" declared "call:0"
Street "river" started. (community card = ['D2', 'H9', 'SJ', 'DA', 'DT'])
"Zheng" declared "raise:257"
"RaphaelPlayer" declared "fold:0"
"Yuchun" declared "fold:0"
"HakulaPlayer" declared "fold:0"
"Finneas" declared "fold:0"
"['Zheng']" won the round 40 (stack = {'Zheng': 555, 'RaphaelPlayer': 1003, 'SichengZuo': 925, 'Yuchun': 963, 'HakulaPlayer': 1518, 'Ethan': 1246, 'YangZ': 925, 'Finneas': 865})
player [Zheng] gets hole card ['SK', 'H6'], current stack 555
player [RaphaelPlayer] gets hole card ['D2', 'CA'], current stack 998
player [SichengZuo] gets hole card ['H3', 'HJ'], current stack 915
player [Yuchun] gets hole card ['H7', 'HA'], current stack 963
player [HakulaPlayer] gets hole card ['C8', 'H8'], current stack 1518
player [Ethan] gets hole card ['S9', 'HK'], current stack 1246
player [YangZ] gets hole card ['CQ', 'S6'], current stack 925
player [Finneas] gets hole card ['S7', 'SJ'], current stack 865
Started the round 41
Street "preflop" started. (community card = [])
"Yuchun" declared "fold:0"
"HakulaPlayer" declared "call:10"
"Ethan" declared "fold:0"
"YangZ" declared "fold:0"
"Finneas" declared "call:10"
"Zheng" declared "call:10"
"RaphaelPlayer" declared "call:10"
"SichengZuo" declared "fold:0"
Street "flop" started. (community card = ['S4', 'S2', 'C9'])
"RaphaelPlayer" declared "call:0"
"HakulaPlayer" declared "call:0"
"Finneas" declared "call:0"
"Zheng" declared "call:0"
Street "turn" started. (community card = ['S4', 'S2', 'C9', 'CJ'])
"RaphaelPlayer" declared "call:0"
"HakulaPlayer" declared "call:0"
"Finneas" declared "call:0"
"Zheng" declared "call:0"
Street "river" started. (community card = ['S4', 'S2', 'C9', 'CJ', 'D3'])
"RaphaelPlayer" declared "call:0"
"HakulaPlayer" declared "call:0"
"Finneas" declared "call:0"
"Zheng" declared "call:0"
"['Finneas']" won the round 41 (stack = {'Zheng': 545, 'RaphaelPlayer': 993, 'SichengZuo': 915, 'Yuchun': 963, 'HakulaPlayer': 1508, 'Ethan': 1246, 'YangZ': 925, 'Finneas': 905})
player [Zheng] gets hole card ['CJ', 'SJ'], current stack 545
player [RaphaelPlayer] gets hole card ['CT', 'CA'], current stack 993
player [SichengZuo] gets hole card ['HT', 'S2'], current stack 910
player [Yuchun] gets hole card ['D7', 'H2'], current stack 953
player [HakulaPlayer] gets hole card ['S6', 'H7'], current stack 1508
player [Ethan] gets hole card ['C5', 'H6'], current stack 1246
player [YangZ] gets hole card ['HQ', 'CK'], current stack 925
player [Finneas] gets hole card ['S5', 'C4'], current stack 905
Started the round 42
Street "preflop" started. (community card = [])
"HakulaPlayer" declared "fold:0"
"Ethan" declared "fold:0"
"YangZ" declared "fold:0"
"Finneas" declared "call:10"
"Zheng" declared "call:10"
"RaphaelPlayer" declared "raise:30"
"SichengZuo" declared "fold:0"
"Yuchun" declared "fold:0"
"Finneas" declared "fold:0"
"Zheng" declared "raise:297"
"RaphaelPlayer" declared "fold:0"
"['Zheng']" won the round 42 (stack = {'Zheng': 600, 'RaphaelPlayer': 963, 'SichengZuo': 910, 'Yuchun': 953, 'HakulaPlayer': 1508, 'Ethan': 1246, 'YangZ': 925, 'Finneas': 895})
player [Zheng] gets hole card ['DT', 'H2'], current stack 600
player [RaphaelPlayer] gets hole card ['D6', 'S5'], current stack 963
player [SichengZuo] gets hole card ['CA', 'S3'], current stack 910
player [Yuchun] gets hole card ['SA', 'C5'], current stack 948
player [HakulaPlayer] gets hole card ['H6', 'D7'], current stack 1498
player [Ethan] gets hole card ['H8', 'HA'], current stack 1246
player [YangZ] gets hole card ['DA', 'HQ'], current stack 925
player [Finneas] gets hole card ['DK', 'H3'], current stack 895
Started the round 43
Street "preflop" started. (community card = [])
"Ethan" declared "fold:0"
"YangZ" declared "fold:0"
"Finneas" declared "call:10"
"Zheng" declared "call:10"
"RaphaelPlayer" declared "fold:0"
"SichengZuo" declared "fold:0"
"Yuchun" declared "fold:0"
"HakulaPlayer" declared "call:10"
Street "flop" started. (community card = ['D4', 'D8', 'CK'])
"HakulaPlayer" declared "call:0"
"Finneas" declared "call:0"
"Zheng" declared "call:0"
Street "turn" started. (community card = ['D4', 'D8', 'CK', 'CQ'])
"HakulaPlayer" declared "call:0"
"Finneas" declared "call:0"
"Zheng" declared "call:0"
Street "river" started. (community card = ['D4', 'D8', 'CK', 'CQ', 'CJ'])
"HakulaPlayer" declared "call:0"
"Finneas" declared "call:0"
"Zheng" declared "call:0"
"['Finneas']" won the round 43 (stack = {'Zheng': 590, 'RaphaelPlayer': 963, 'SichengZuo': 910, 'Yuchun': 948, 'HakulaPlayer': 1498, 'Ethan': 1246, 'YangZ': 925, 'Finneas': 920})
player [Zheng] gets hole card ['HK', 'DT'], current stack 590
player [RaphaelPlayer] gets hole card ['S9', 'SK'], current stack 963
player [SichengZuo] gets hole card ['D2', 'C6'], current stack 910
player [Yuchun] gets hole card ['S8', 'D9'], current stack 948
player [HakulaPlayer] gets hole card ['S4', 'CT'], current stack 1493
player [Ethan] gets hole card ['H3', 'D4'], current stack 1236
player [YangZ] gets hole card ['DA', 'D8'], current stack 925
player [Finneas] gets hole card ['SQ', 'DJ'], current stack 920
Started the round 44
Street "preflop" started. (community card = [])
"YangZ" declared "fold:0"
"Finneas" declared "call:10"
"Zheng" declared "call:10"
"RaphaelPlayer" declared "call:10"
"SichengZuo" declared "fold:0"
"Yuchun" declared "fold:0"
"HakulaPlayer" declared "call:10"
"Ethan" declared "fold:0"
Street "flop" started. (community card = ['S7', 'HQ', 'DK'])
"HakulaPlayer" declared "call:0"
"Finneas" declared "call:0"
"Zheng" declared "call:0"
"RaphaelPlayer" declared "raise:60"
"HakulaPlayer" declared "fold:0"
"Finneas" declared "fold:0"
"Zheng" declared "raise:580"
"RaphaelPlayer" declared "call:580"
Street "turn" started. (community card = ['S7', 'HQ', 'DK', 'H9'])
Street "river" started. (community card = ['S7', 'HQ', 'DK', 'H9', 'CA'])
"['RaphaelPlayer']" won the round 44 (stack = {'Zheng': 0, 'RaphaelPlayer': 1583, 'SichengZuo': 910, 'Yuchun': 948, 'HakulaPlayer': 1488, 'Ethan': 1236, 'YangZ': 925, 'Finneas': 910})
player [RaphaelPlayer] gets hole card ['C7', 'D8'], current stack 1583
player [SichengZuo] gets hole card ['H7', 'C6'], current stack 910
player [Yuchun] gets hole card ['D4', 'H8'], current stack 948
player [HakulaPlayer] gets hole card ['S5', 'D5'], current stack 1488
player [Ethan] gets hole card ['S2', 'HA'], current stack 1231
player [YangZ] gets hole card ['D2', 'S6'], current stack 915
player [Finneas] gets hole card ['D3', 'C9'], current stack 910
Started the round 45
Street "preflop" started. (community card = [])
"Finneas" declared "call:10"
"RaphaelPlayer" declared "fold:0"
"SichengZuo" declared "fold:0"
"Yuchun" declared "fold:0"
"HakulaPlayer" declared "raise:43"
"Ethan" declared "fold:0"
"YangZ" declared "fold:0"
"Finneas" declared "fold:0"
"['HakulaPlayer']" won the round 45 (stack = {'Zheng': 0, 'RaphaelPlayer': 1583, 'SichengZuo': 910, 'Yuchun': 948, 'HakulaPlayer': 1513, 'Ethan': 1231, 'YangZ': 915, 'Finneas': 900})
player [RaphaelPlayer] gets hole card ['C4', 'D9'], current stack 1583
player [SichengZuo] gets hole card ['CA', 'S3'], current stack 910
player [Yuchun] gets hole card ['ST', 'H6'], current stack 948
player [HakulaPlayer] gets hole card ['C7', 'HQ'], current stack 1513
player [Ethan] gets hole card ['DA', 'S5'], current stack 1231
player [YangZ] gets hole card ['CT', 'C6'], current stack 910
player [Finneas] gets hole card ['SJ', 'D8'], current stack 890
Started the round 46
Street "preflop" started. (community card = [])
"RaphaelPlayer" declared "fold:0"
"SichengZuo" declared "fold:0"
"Yuchun" declared "fold:0"
"HakulaPlayer" declared "fold:0"
"Ethan" declared "call:10"
"YangZ" declared "fold:0"
"Finneas" declared "call:10"
Street "flop" started. (community card = ['S4', 'C2', 'HJ'])
"Finneas" declared "call:0"
"Ethan" declared "call:0"
Street "turn" started. (community card = ['S4', 'C2', 'HJ', 'H2'])
"Finneas" declared "call:0"
"Ethan" declared "call:0"
Street "river" started. (community card = ['S4', 'C2', 'HJ', 'H2', 'S8'])
"Finneas" declared "call:0"
"Ethan" declared "call:0"
"['Finneas']" won the round 46 (stack = {'Zheng': 0, 'RaphaelPlayer': 1583, 'SichengZuo': 910, 'Yuchun': 948, 'HakulaPlayer': 1513, 'Ethan': 1221, 'YangZ': 910, 'Finneas': 915})
player [RaphaelPlayer] gets hole card ['CQ', 'H4'], current stack 1573
player [SichengZuo] gets hole card ['S2', 'CT'], current stack 910
player [Yuchun] gets hole card ['C8', 'DK'], current stack 948
player [HakulaPlayer] gets hole card ['HK', 'H6'], current stack 1513
player [Ethan] gets hole card ['DT', 'S3'], current stack 1221
player [YangZ] gets hole card ['HJ', 'D8'], current stack 910
player [Finneas] gets hole card ['ST', 'HA'], current stack 910
Started the round 47
Street "preflop" started. (community card = [])
"SichengZuo" declared "fold:0"
"Yuchun" declared "fold:0"
"HakulaPlayer" declared "call:10"
"Ethan" declared "fold:0"
"YangZ" declared "fold:0"
"Finneas" declared "call:10"
"RaphaelPlayer" declared "fold:0"
Street "flop" started. (community card = ['S5', 'C2', 'CJ'])
"Finneas" declared "call:0"
"HakulaPlayer" declared "call:0"
Street "turn" started. (community card = ['S5', 'C2', 'CJ', 'HT'])
"Finneas" declared "call:0"
"HakulaPlayer" declared "call:0"
Street "river" started. (community card = ['S5', 'C2', 'CJ', 'HT', 'SJ'])
"Finneas" declared "call:0"
"HakulaPlayer" declared "call:0"
"['Finneas']" won the round 47 (stack = {'Zheng': 0, 'RaphaelPlayer': 1573, 'SichengZuo': 910, 'Yuchun': 948, 'HakulaPlayer': 1503, 'Ethan': 1221, 'YangZ': 910, 'Finneas': 935})
player [RaphaelPlayer] gets hole card ['H3', 'D9'], current stack 1568
player [SichengZuo] gets hole card ['DT', 'D3'], current stack 900
player [Yuchun] gets hole card ['S2', 'H2'], current stack 948
player [HakulaPlayer] gets hole card ['SK', 'C4'], current stack 1503
player [Ethan] gets hole card ['C7', 'S9'], current stack 1221
player [YangZ] gets hole card ['HT', 'CQ'], current stack 910
player [Finneas] gets hole card ['S6', 'CT'], current stack 935
Started the round 48
Street "preflop" started. (community card = [])
"Yuchun" declared "fold:0"
"HakulaPlayer" declared "fold:0"
"Ethan" declared "fold:0"
"YangZ" declared "fold:0"
"Finneas" declared "call:10"
"RaphaelPlayer" declared "fold:0"
"SichengZuo" declared "fold:0"
"['Finneas']" won the round 48 (stack = {'Zheng': 0, 'RaphaelPlayer': 1568, 'SichengZuo': 900, 'Yuchun': 948, 'HakulaPlayer': 1503, 'Ethan': 1221, 'YangZ': 910, 'Finneas': 950})
player [RaphaelPlayer] gets hole card ['DK', 'D4'], current stack 1568
player [SichengZuo] gets hole card ['D5', 'SQ'], current stack 895
player [Yuchun] gets hole card ['ST', 'C6'], current stack 938
player [HakulaPlayer] gets hole card ['CK', 'D8'], current stack 1503
player [Ethan] gets hole card ['D3', 'H2'], current stack 1221
player [YangZ] gets hole card ['SJ', 'HT'], current stack 910
player [Finneas] gets hole card ['DT', 'SA'], current stack 950
Started the round 49
Street "preflop" started. (community card = [])
"HakulaPlayer" declared "fold:0"
"Ethan" declared "fold:0"
"YangZ" declared "fold:0"
"Finneas" declared "call:10"
"RaphaelPlayer" declared "call:10"
"SichengZuo" declared "fold:0"
"Yuchun" declared "fold:0"
Street "flop" started. (community card = ['S3', 'H4', 'HQ'])
"Finneas" declared "call:0"
"RaphaelPlayer" declared "raise:45"
"Finneas" declared "fold:0"
"['RaphaelPlayer']" won the round 49 (stack = {'Zheng': 0, 'RaphaelPlayer': 1593, 'SichengZuo': 895, 'Yuchun': 938, 'HakulaPlayer': 1503, 'Ethan': 1221, 'YangZ': 910, 'Finneas': 940})
player [RaphaelPlayer] gets hole card ['DA', 'D4'], current stack 1593
player [SichengZuo] gets hole card ['DT', 'D3'], current stack 895
player [Yuchun] gets hole card ['ST', 'DK'], current stack 933
player [HakulaPlayer] gets hole card ['DJ', 'D7'], current stack 1493
player [Ethan] gets hole card ['SJ', 'S5'], current stack 1221
player [YangZ] gets hole card ['C5', 'SA'], current stack 910
player [Finneas] gets hole card ['H3', 'H7'], current stack 940
Started the round 50
Street "preflop" started. (community card = [])
"Ethan" declared "fold:0"
"YangZ" declared "fold:0"
"Finneas" declared "call:10"
"RaphaelPlayer" declared "call:10"
"SichengZuo" declared "fold:0"
"Yuchun" declared "fold:0"
"HakulaPlayer" declared "call:10"
Street "flop" started. (community card = ['C2', 'D8', 'S3'])
"HakulaPlayer" declared "call:0"
"Finneas" declared "call:0"
"RaphaelPlayer" declared "call:0"
Street "turn" started. (community card = ['C2', 'D8', 'S3', 'S7'])
"HakulaPlayer" declared "call:0"
"Finneas" declared "call:0"
"RaphaelPlayer" declared "call:0"
Street "river" started. (community card = ['C2', 'D8', 'S3', 'S7', 'HK'])
"HakulaPlayer" declared "call:0"
"Finneas" declared "call:0"
"RaphaelPlayer" declared "call:0"
"['Finneas']" won the round 50 (stack = {'Zheng': 0, 'RaphaelPlayer': 1583, 'SichengZuo': 895, 'Yuchun': 933, 'HakulaPlayer': 1493, 'Ethan': 1221, 'YangZ': 910, 'Finneas': 965})

Game Results:
------------------------------------------------------------
Game 1:
Winner: RaphaelPlayer (stack: 1583)
All players' stacks:
  Zheng: 0
  RaphaelPlayer: 1583
  SichengZuo: 895
  Yuchun: 933
  HakulaPlayer: 1493
  Ethan: 1221
  YangZ: 910
  Finneas: 965
------------------------------------------------------------
