player [Zheng] gets hole card ['ST', 'D9'], current stack 1000
player [RaphaelPlayer] gets hole card ['D3', 'S3'], current stack 995
player [SichengZuo] gets hole card ['H8', 'HK'], current stack 990
player [Yuchun] gets hole card ['D8', 'D6'], current stack 1000
player [HakulaPlayer] gets hole card ['D7', 'S9'], current stack 1000
player [Ethan] gets hole card ['DA', 'C6'], current stack 1000
player [YangZ] gets hole card ['S8', 'C4'], current stack 1000
player [Finneas] gets hole card ['DQ', 'HJ'], current stack 1000
Started the round 1
Street "preflop" started. (community card = [])
"Yuchun" declared "fold:0"
"HakulaPlayer" declared "fold:0"
"Ethan" declared "fold:0"
"YangZ" declared "fold:0"
"Finneas" declared "call:10"
"Zheng" declared "call:10"
"RaphaelPlayer" declared "fold:0"
"SichengZuo" declared "fold:0"
Street "flop" started. (community card = ['HA', 'SK', 'DT'])
"Finneas" declared "call:0"
"Zheng" declared "call:0"
Street "turn" started. (community card = ['HA', 'SK', 'DT', 'CK'])
"Finneas" declared "call:0"
"Zheng" declared "call:0"
Street "river" started. (community card = ['HA', 'SK', 'DT', 'CK', 'S5'])
"Finneas" declared "call:0"
"Zheng" declared "raise:500"
"Finneas" declared "fold:0"
"['Zheng']" won the round 1 (stack = {'Zheng': 1025, 'RaphaelPlayer': 995, 'SichengZuo': 990, 'Yuchun': 1000, 'HakulaPlayer': 1000, 'Ethan': 1000, 'YangZ': 1000, 'Finneas': 990})
player [Zheng] gets hole card ['H2', 'D2'], current stack 1025
player [RaphaelPlayer] gets hole card ['D4', 'CT'], current stack 995
player [SichengZuo] gets hole card ['SA', 'C6'], current stack 985
player [Yuchun] gets hole card ['C2', 'H4'], current stack 990
player [HakulaPlayer] gets hole card ['HT', 'ST'], current stack 1000
player [Ethan] gets hole card ['D5', 'DT'], current stack 1000
player [YangZ] gets hole card ['SK', 'DA'], current stack 1000
player [Finneas] gets hole card ['H7', 'HJ'], current stack 990
Started the round 2
Street "preflop" started. (community card = [])
"HakulaPlayer" declared "call:10"
"Ethan" declared "fold:0"
"YangZ" declared "fold:0"
"Finneas" declared "call:10"
"Zheng" declared "call:10"
"RaphaelPlayer" declared "fold:0"
"SichengZuo" declared "fold:0"
"Yuchun" declared "fold:0"
Street "flop" started. (community card = ['HQ', 'H5', 'DQ'])
"HakulaPlayer" declared "call:0"
"Finneas" declared "call:0"
"Zheng" declared "call:0"
Street "turn" started. (community card = ['HQ', 'H5', 'DQ', 'C4'])
"HakulaPlayer" declared "call:0"
"Finneas" declared "call:0"
"Zheng" declared "call:0"
Street "river" started. (community card = ['HQ', 'H5', 'DQ', 'C4', 'CJ'])
"HakulaPlayer" declared "call:0"
"Finneas" declared "call:0"
"Zheng" declared "call:0"
"['Finneas']" won the round 2 (stack = {'Zheng': 1015, 'RaphaelPlayer': 995, 'SichengZuo': 985, 'Yuchun': 990, 'HakulaPlayer': 990, 'Ethan': 1000, 'YangZ': 1000, 'Finneas': 1025})
player [Zheng] gets hole card ['ST', 'DA'], current stack 1015
player [RaphaelPlayer] gets hole card ['HK', 'S6'], current stack 995
player [SichengZuo] gets hole card ['D4', 'C8'], current stack 985
player [Yuchun] gets hole card ['S7', 'CJ'], current stack 985
player [HakulaPlayer] gets hole card ['SQ', 'CK'], current stack 980
player [Ethan] gets hole card ['S9', 'D9'], current stack 1000
player [YangZ] gets hole card ['SK', 'C4'], current stack 1000
player [Finneas] gets hole card ['H6', 'D8'], current stack 1025
Started the round 3
Street "preflop" started. (community card = [])
"Ethan" declared "call:10"
"YangZ" declared "fold:0"
"Finneas" declared "call:10"
"Zheng" declared "call:10"
"RaphaelPlayer" declared "call:10"
"SichengZuo" declared "fold:0"
"Yuchun" declared "fold:0"
"HakulaPlayer" declared "call:10"
Street "flop" started. (community card = ['DQ', 'HT', 'H4'])
"HakulaPlayer" declared "call:0"
"Ethan" declared "call:0"
"Finneas" declared "call:0"
"Zheng" declared "call:0"
"RaphaelPlayer" declared "call:0"
Street "turn" started. (community card = ['DQ', 'HT', 'H4', 'C3'])
"HakulaPlayer" declared "call:0"
"Ethan" declared "call:0"
"Finneas" declared "call:0"
"Zheng" declared "call:0"
"RaphaelPlayer" declared "call:0"
Street "river" started. (community card = ['DQ', 'HT', 'H4', 'C3', 'SJ'])
"HakulaPlayer" declared "call:0"
"Ethan" declared "call:0"
"Finneas" declared "call:0"
"Zheng" declared "call:0"
"RaphaelPlayer" declared "call:0"
"['HakulaPlayer']" won the round 3 (stack = {'Zheng': 1005, 'RaphaelPlayer': 985, 'SichengZuo': 985, 'Yuchun': 985, 'HakulaPlayer': 1035, 'Ethan': 990, 'YangZ': 1000, 'Finneas': 1015})
player [Zheng] gets hole card ['DQ', 'CJ'], current stack 1005
player [RaphaelPlayer] gets hole card ['CT', 'S8'], current stack 985
player [SichengZuo] gets hole card ['D8', 'S9'], current stack 985
player [Yuchun] gets hole card ['SJ', 'D5'], current stack 985
player [HakulaPlayer] gets hole card ['H9', 'HK'], current stack 1030
player [Ethan] gets hole card ['SQ', 'D7'], current stack 980
player [YangZ] gets hole card ['CQ', 'C8'], current stack 1000
player [Finneas] gets hole card ['H5', 'C7'], current stack 1015
Started the round 4
Street "preflop" started. (community card = [])
"YangZ" declared "fold:0"
"Finneas" declared "call:10"
"Zheng" declared "call:10"
"RaphaelPlayer" declared "fold:0"
"SichengZuo" declared "fold:0"
"Yuchun" declared "fold:0"
"HakulaPlayer" declared "call:10"
"Ethan" declared "fold:0"
Street "flop" started. (community card = ['CA', 'S6', 'H3'])
"HakulaPlayer" declared "call:0"
"Finneas" declared "call:0"
"Zheng" declared "call:0"
Street "turn" started. (community card = ['CA', 'S6', 'H3', 'D2'])
"HakulaPlayer" declared "call:0"
"Finneas" declared "call:0"
"Zheng" declared "call:0"
Street "river" started. (community card = ['CA', 'S6', 'H3', 'D2', 'C9'])
"HakulaPlayer" declared "call:0"
"Finneas" declared "call:0"
"Zheng" declared "call:0"
"['HakulaPlayer']" won the round 4 (stack = {'Zheng': 995, 'RaphaelPlayer': 985, 'SichengZuo': 985, 'Yuchun': 985, 'HakulaPlayer': 1065, 'Ethan': 980, 'YangZ': 1000, 'Finneas': 1005})
player [Zheng] gets hole card ['D8', 'HQ'], current stack 995
player [RaphaelPlayer] gets hole card ['ST', 'H7'], current stack 985
player [SichengZuo] gets hole card ['C8', 'SK'], current stack 985
player [Yuchun] gets hole card ['H5', 'HA'], current stack 985
player [HakulaPlayer] gets hole card ['C4', 'SQ'], current stack 1065
player [Ethan] gets hole card ['C7', 'H2'], current stack 975
player [YangZ] gets hole card ['HT', 'C5'], current stack 990
player [Finneas] gets hole card ['S4', 'C2'], current stack 1005
Started the round 5
Street "preflop" started. (community card = [])
"Finneas" declared "call:10"
"Zheng" declared "call:10"
"RaphaelPlayer" declared "fold:0"
"SichengZuo" declared "fold:0"
"Yuchun" declared "fold:0"
"HakulaPlayer" declared "call:10"
"Ethan" declared "fold:0"
"YangZ" declared "fold:0"
Street "flop" started. (community card = ['H4', 'H8', 'D4'])
"Finneas" declared "raise:502"
"Zheng" declared "fold:0"
"HakulaPlayer" declared "raise:1049"
"Finneas" declared "fold:0"
"['HakulaPlayer']" won the round 5 (stack = {'Zheng': 985, 'RaphaelPlayer': 985, 'SichengZuo': 985, 'Yuchun': 985, 'HakulaPlayer': 1602, 'Ethan': 975, 'YangZ': 990, 'Finneas': 493})
player [Zheng] gets hole card ['SJ', 'S3'], current stack 985
player [RaphaelPlayer] gets hole card ['DK', 'C7'], current stack 985
player [SichengZuo] gets hole card ['DQ', 'C9'], current stack 985
player [Yuchun] gets hole card ['HK', 'H4'], current stack 985
player [HakulaPlayer] gets hole card ['C5', 'S6'], current stack 1602
player [Ethan] gets hole card ['C4', 'C2'], current stack 975
player [YangZ] gets hole card ['S5', 'HT'], current stack 985
player [Finneas] gets hole card ['H6', 'CQ'], current stack 483
Started the round 6
Street "preflop" started. (community card = [])
"Zheng" declared "call:10"
"RaphaelPlayer" declared "call:10"
"SichengZuo" declared "fold:0"
"Yuchun" declared "fold:0"
"HakulaPlayer" declared "call:10"
"Ethan" declared "fold:0"
"YangZ" declared "fold:0"
"Finneas" declared "call:10"
Street "flop" started. (community card = ['C8', 'D4', 'C3'])
"Finneas" declared "call:0"
"Zheng" declared "call:0"
"RaphaelPlayer" declared "call:0"
"HakulaPlayer" declared "call:0"
Street "turn" started. (community card = ['C8', 'D4', 'C3', 'DJ'])
"Finneas" declared "call:0"
"Zheng" declared "raise:492"
"RaphaelPlayer" declared "fold:0"
"HakulaPlayer" declared "fold:0"
"Finneas" declared "fold:0"
"['Zheng']" won the round 6 (stack = {'Zheng': 1020, 'RaphaelPlayer': 975, 'SichengZuo': 985, 'Yuchun': 985, 'HakulaPlayer': 1592, 'Ethan': 975, 'YangZ': 985, 'Finneas': 483})
player [Zheng] gets hole card ['D3', 'H5'], current stack 1010
player [RaphaelPlayer] gets hole card ['SQ', 'D6'], current stack 975
player [SichengZuo] gets hole card ['C6', 'SK'], current stack 985
player [Yuchun] gets hole card ['HT', 'S8'], current stack 985
player [HakulaPlayer] gets hole card ['H6', 'C4'], current stack 1592
player [Ethan] gets hole card ['DJ', 'H2'], current stack 975
player [YangZ] gets hole card ['DA', 'CQ'], current stack 985
player [Finneas] gets hole card ['C8', 'S4'], current stack 478
Started the round 7
Street "preflop" started. (community card = [])
"RaphaelPlayer" declared "fold:0"
"SichengZuo" declared "fold:0"
"Yuchun" declared "fold:0"
"HakulaPlayer" declared "fold:0"
"Ethan" declared "fold:0"
"YangZ" declared "fold:0"
"Finneas" declared "call:10"
"Zheng" declared "call:10"
Street "flop" started. (community card = ['D7', 'S2', 'C9'])
"Finneas" declared "call:0"
"Zheng" declared "call:0"
Street "turn" started. (community card = ['D7', 'S2', 'C9', 'C3'])
"Finneas" declared "call:0"
"Zheng" declared "call:0"
Street "river" started. (community card = ['D7', 'S2', 'C9', 'C3', 'CA'])
"Finneas" declared "call:0"
"Zheng" declared "call:0"
"['Zheng']" won the round 7 (stack = {'Zheng': 1030, 'RaphaelPlayer': 975, 'SichengZuo': 985, 'Yuchun': 985, 'HakulaPlayer': 1592, 'Ethan': 975, 'YangZ': 985, 'Finneas': 473})
player [Zheng] gets hole card ['DJ', 'H8'], current stack 1025
player [RaphaelPlayer] gets hole card ['SA', 'D6'], current stack 965
player [SichengZuo] gets hole card ['HK', 'C8'], current stack 985
player [Yuchun] gets hole card ['D5', 'SK'], current stack 985
player [HakulaPlayer] gets hole card ['DK', 'DA'], current stack 1592
player [Ethan] gets hole card ['C6', 'DQ'], current stack 975
player [YangZ] gets hole card ['H5', 'HT'], current stack 985
player [Finneas] gets hole card ['C7', 'C5'], current stack 473
Started the round 8
Street "preflop" started. (community card = [])
"SichengZuo" declared "fold:0"
"Yuchun" declared "fold:0"
"HakulaPlayer" declared "call:10"
"Ethan" declared "fold:0"
"YangZ" declared "fold:0"
"Finneas" declared "call:10"
"Zheng" declared "call:10"
"RaphaelPlayer" declared "call:10"
Street "flop" started. (community card = ['CA', 'D2', 'H2'])
"Zheng" declared "call:0"
"RaphaelPlayer" declared "raise:50"
"HakulaPlayer" declared "call:50"
"Finneas" declared "fold:0"
"Zheng" declared "fold:0"
Street "turn" started. (community card = ['CA', 'D2', 'H2', 'S9'])
"RaphaelPlayer" declared "raise:150"
"HakulaPlayer" declared "raise:479"
"RaphaelPlayer" declared "call:479"
Street "river" started. (community card = ['CA', 'D2', 'H2', 'S9', 'D4'])
"RaphaelPlayer" declared "raise:436"
"HakulaPlayer" declared "raise:1053"
"['HakulaPlayer']" won the round 8 (stack = {'Zheng': 1020, 'RaphaelPlayer': 0, 'SichengZuo': 985, 'Yuchun': 985, 'HakulaPlayer': 2587, 'Ethan': 975, 'YangZ': 985, 'Finneas': 463})
player [Zheng] gets hole card ['C4', 'DA'], current stack 1020
player [SichengZuo] gets hole card ['CQ', 'S5'], current stack 980
player [Yuchun] gets hole card ['HA', 'HQ'], current stack 975
player [HakulaPlayer] gets hole card ['S9', 'C7'], current stack 2587
player [Ethan] gets hole card ['CT', 'D3'], current stack 975
player [YangZ] gets hole card ['S7', 'CA'], current stack 985
player [Finneas] gets hole card ['H2', 'ST'], current stack 463
Started the round 9
Street "preflop" started. (community card = [])
"HakulaPlayer" declared "fold:0"
"Ethan" declared "fold:0"
"YangZ" declared "fold:0"
"Finneas" declared "call:10"
"Zheng" declared "call:10"
"SichengZuo" declared "fold:0"
"Yuchun" declared "fold:0"
Street "flop" started. (community card = ['C3', 'H8', 'HT'])
"Finneas" declared "call:0"
"Zheng" declared "call:0"
Street "turn" started. (community card = ['C3', 'H8', 'HT', 'D6'])
"Finneas" declared "call:0"
"Zheng" declared "call:0"
Street "river" started. (community card = ['C3', 'H8', 'HT', 'D6', 'D9'])
"Finneas" declared "call:0"
"Zheng" declared "call:0"
"['Finneas']" won the round 9 (stack = {'Zheng': 1010, 'RaphaelPlayer': 0, 'SichengZuo': 980, 'Yuchun': 975, 'HakulaPlayer': 2587, 'Ethan': 975, 'YangZ': 985, 'Finneas': 488})
player [Zheng] gets hole card ['ST', 'HT'], current stack 1010
player [SichengZuo] gets hole card ['SA', 'C7'], current stack 980
player [Yuchun] gets hole card ['C6', 'SK'], current stack 970
player [HakulaPlayer] gets hole card ['D8', 'HA'], current stack 2577
player [Ethan] gets hole card ['CK', 'H5'], current stack 975
player [YangZ] gets hole card ['S9', 'CJ'], current stack 985
player [Finneas] gets hole card ['D9', 'H4'], current stack 488
Started the round 10
Street "preflop" started. (community card = [])
"Ethan" declared "fold:0"
"YangZ" declared "fold:0"
"Finneas" declared "call:10"
"Zheng" declared "call:10"
"SichengZuo" declared "fold:0"
"Yuchun" declared "call:10"
"HakulaPlayer" declared "call:10"
Street "flop" started. (community card = ['S4', 'D5', 'D3'])
"Yuchun" declared "call:0"
"HakulaPlayer" declared "call:0"
"Finneas" declared "call:0"
"Zheng" declared "call:0"
Street "turn" started. (community card = ['S4', 'D5', 'D3', 'CQ'])
"Yuchun" declared "call:0"
"HakulaPlayer" declared "call:0"
"Finneas" declared "call:0"
"Zheng" declared "call:0"
Street "river" started. (community card = ['S4', 'D5', 'D3', 'CQ', 'C4'])
"Yuchun" declared "call:0"
"HakulaPlayer" declared "call:0"
"Finneas" declared "raise:244"
"Zheng" declared "fold:0"
"Yuchun" declared "fold:0"
"HakulaPlayer" declared "fold:0"
"['Finneas']" won the round 10 (stack = {'Zheng': 1000, 'RaphaelPlayer': 0, 'SichengZuo': 980, 'Yuchun': 965, 'HakulaPlayer': 2577, 'Ethan': 975, 'YangZ': 985, 'Finneas': 518})
player [Zheng] gets hole card ['C4', 'H3'], current stack 1000
player [SichengZuo] gets hole card ['C8', 'D9'], current stack 980
player [Yuchun] gets hole card ['H6', 'C2'], current stack 965
player [HakulaPlayer] gets hole card ['H5', 'DT'], current stack 2572
player [Ethan] gets hole card ['SK', 'D2'], current stack 965
player [YangZ] gets hole card ['H4', 'CT'], current stack 985
player [Finneas] gets hole card ['D4', 'S6'], current stack 518
Started the round 11
Street "preflop" started. (community card = [])
"YangZ" declared "fold:0"
"Finneas" declared "call:10"
"Zheng" declared "call:10"
"SichengZuo" declared "fold:0"
"Yuchun" declared "call:10"
"HakulaPlayer" declared "call:10"
"Ethan" declared "fold:0"
Street "flop" started. (community card = ['SJ', 'D5', 'DQ'])
"HakulaPlayer" declared "call:0"
"Finneas" declared "call:0"
"Zheng" declared "call:0"
"Yuchun" declared "call:0"
Street "turn" started. (community card = ['SJ', 'D5', 'DQ', 'C7'])
"HakulaPlayer" declared "call:0"
"Finneas" declared "call:0"
"Zheng" declared "call:0"
"Yuchun" declared "call:0"
Street "river" started. (community card = ['SJ', 'D5', 'DQ', 'C7', 'S8'])
"HakulaPlayer" declared "call:0"
"Finneas" declared "call:0"
"Zheng" declared "call:0"
"Yuchun" declared "call:0"
"['Finneas']" won the round 11 (stack = {'Zheng': 990, 'RaphaelPlayer': 0, 'SichengZuo': 980, 'Yuchun': 955, 'HakulaPlayer': 2567, 'Ethan': 965, 'YangZ': 985, 'Finneas': 558})
player [Zheng] gets hole card ['S8', 'CT'], current stack 990
player [SichengZuo] gets hole card ['D4', 'C9'], current stack 980
player [Yuchun] gets hole card ['DA', 'S7'], current stack 955
player [HakulaPlayer] gets hole card ['S6', 'ST'], current stack 2567
player [Ethan] gets hole card ['DT', 'HT'], current stack 960
player [YangZ] gets hole card ['D2', 'C7'], current stack 975
player [Finneas] gets hole card ['S4', 'H4'], current stack 558
Started the round 12
Street "preflop" started. (community card = [])
"Finneas" declared "call:10"
"Zheng" declared "call:10"
"SichengZuo" declared "fold:0"
"Yuchun" declared "call:10"
"HakulaPlayer" declared "call:10"
"Ethan" declared "raise:144"
"YangZ" declared "fold:0"
"Finneas" declared "fold:0"
"Zheng" declared "fold:0"
"Yuchun" declared "call:144"
"HakulaPlayer" declared "fold:0"
Street "flop" started. (community card = ['H9', 'H5', 'S9'])
"Ethan" declared "raise:328"
"Yuchun" declared "fold:0"
"['Ethan']" won the round 12 (stack = {'Zheng': 980, 'RaphaelPlayer': 0, 'SichengZuo': 980, 'Yuchun': 811, 'HakulaPlayer': 2557, 'Ethan': 1149, 'YangZ': 975, 'Finneas': 548})
player [Zheng] gets hole card ['S8', 'S3'], current stack 980
player [SichengZuo] gets hole card ['C8', 'HT'], current stack 980
player [Yuchun] gets hole card ['HJ', 'SQ'], current stack 811
player [HakulaPlayer] gets hole card ['C4', 'HK'], current stack 2557
player [Ethan] gets hole card ['D8', 'D4'], current stack 1149
player [YangZ] gets hole card ['D3', 'ST'], current stack 970
player [Finneas] gets hole card ['H5', 'CK'], current stack 538
Started the round 13
Street "preflop" started. (community card = [])
"Zheng" declared "call:10"
"SichengZuo" declared "fold:0"
"Yuchun" declared "call:10"
"HakulaPlayer" declared "call:10"
"Ethan" declared "fold:0"
"YangZ" declared "fold:0"
"Finneas" declared "call:10"
Street "flop" started. (community card = ['D9', 'D6', 'SA'])
"Finneas" declared "call:0"
"Zheng" declared "call:0"
"Yuchun" declared "call:0"
"HakulaPlayer" declared "call:0"
Street "turn" started. (community card = ['D9', 'D6', 'SA', 'S2'])
"Finneas" declared "call:0"
"Zheng" declared "call:0"
"Yuchun" declared "call:0"
"HakulaPlayer" declared "call:0"
Street "river" started. (community card = ['D9', 'D6', 'SA', 'S2', 'H7'])
"Finneas" declared "call:0"
"Zheng" declared "call:0"
"Yuchun" declared "call:0"
"HakulaPlayer" declared "call:0"
"['HakulaPlayer', 'Finneas']" won the round 13 (stack = {'Zheng': 970, 'RaphaelPlayer': 0, 'SichengZuo': 980, 'Yuchun': 801, 'HakulaPlayer': 2569, 'Ethan': 1149, 'YangZ': 970, 'Finneas': 560})
player [Zheng] gets hole card ['H6', 'H2'], current stack 960
player [SichengZuo] gets hole card ['SA', 'DJ'], current stack 980
player [Yuchun] gets hole card ['CK', 'S7'], current stack 801
player [HakulaPlayer] gets hole card ['HQ', 'HT'], current stack 2569
player [Ethan] gets hole card ['CT', 'H7'], current stack 1149
player [YangZ] gets hole card ['S2', 'S4'], current stack 970
player [Finneas] gets hole card ['D3', 'SJ'], current stack 555
Started the round 14
Street "preflop" started. (community card = [])
"SichengZuo" declared "fold:0"
"Yuchun" declared "call:10"
"HakulaPlayer" declared "call:10"
"Ethan" declared "fold:0"
"YangZ" declared "fold:0"
"Finneas" declared "call:10"
"Zheng" declared "call:10"
Street "flop" started. (community card = ['S8', 'D7', 'C8'])
"Finneas" declared "call:0"
"Zheng" declared "call:0"
"Yuchun" declared "call:0"
"HakulaPlayer" declared "call:0"
Street "turn" started. (community card = ['S8', 'D7', 'C8', 'CA'])
"Finneas" declared "call:0"
"Zheng" declared "call:0"
"Yuchun" declared "call:0"
"HakulaPlayer" declared "call:0"
Street "river" started. (community card = ['S8', 'D7', 'C8', 'CA', 'H4'])
"Finneas" declared "call:0"
"Zheng" declared "call:0"
"Yuchun" declared "call:0"
"HakulaPlayer" declared "call:0"
"['Yuchun']" won the round 14 (stack = {'Zheng': 960, 'RaphaelPlayer': 0, 'SichengZuo': 980, 'Yuchun': 831, 'HakulaPlayer': 2559, 'Ethan': 1149, 'YangZ': 970, 'Finneas': 550})
player [Zheng] gets hole card ['H2', 'HA'], current stack 955
player [SichengZuo] gets hole card ['D9', 'C8'], current stack 970
player [Yuchun] gets hole card ['H4', 'HK'], current stack 831
player [HakulaPlayer] gets hole card ['SQ', 'C2'], current stack 2559
player [Ethan] gets hole card ['S3', 'H6'], current stack 1149
player [YangZ] gets hole card ['D6', 'DA'], current stack 970
player [Finneas] gets hole card ['S8', 'D8'], current stack 550
Started the round 15
Street "preflop" started. (community card = [])
"Yuchun" declared "call:10"
"HakulaPlayer" declared "call:10"
"Ethan" declared "fold:0"
"YangZ" declared "fold:0"
"Finneas" declared "call:10"
"Zheng" declared "call:10"
"SichengZuo" declared "fold:0"
Street "flop" started. (community card = ['D4', 'H8', 'ST'])
"Zheng" declared "call:0"
"Yuchun" declared "call:0"
"HakulaPlayer" declared "call:0"
"Finneas" declared "raise:275"
"Zheng" declared "fold:0"
"Yuchun" declared "fold:0"
"HakulaPlayer" declared "fold:0"
"['Finneas']" won the round 15 (stack = {'Zheng': 950, 'RaphaelPlayer': 0, 'SichengZuo': 970, 'Yuchun': 821, 'HakulaPlayer': 2549, 'Ethan': 1149, 'YangZ': 970, 'Finneas': 590})
player [Zheng] gets hole card ['H7', 'H2'], current stack 950
player [SichengZuo] gets hole card ['HK', 'CT'], current stack 965
player [Yuchun] gets hole card ['C6', 'CJ'], current stack 811
player [HakulaPlayer] gets hole card ['D4', 'CQ'], current stack 2549
player [Ethan] gets hole card ['C7', 'S3'], current stack 1149
player [YangZ] gets hole card ['S9', 'D9'], current stack 970
player [Finneas] gets hole card ['HA', 'D8'], current stack 590
Started the round 16
Street "preflop" started. (community card = [])
"HakulaPlayer" declared "fold:0"
"Ethan" declared "fold:0"
"YangZ" declared "fold:0"
"Finneas" declared "call:10"
"Zheng" declared "call:10"
"SichengZuo" declared "fold:0"
"Yuchun" declared "call:10"
Street "flop" started. (community card = ['CA', 'H4', 'SK'])
"Yuchun" declared "call:0"
"Finneas" declared "call:0"
"Zheng" declared "call:0"
Street "turn" started. (community card = ['CA', 'H4', 'SK', 'C4'])
"Yuchun" declared "call:0"
"Finneas" declared "call:0"
"Zheng" declared "call:0"
Street "river" started. (community card = ['CA', 'H4', 'SK', 'C4', 'HQ'])
"Yuchun" declared "call:0"
"Finneas" declared "call:0"
"Zheng" declared "call:0"
"['Finneas']" won the round 16 (stack = {'Zheng': 940, 'RaphaelPlayer': 0, 'SichengZuo': 965, 'Yuchun': 811, 'HakulaPlayer': 2549, 'Ethan': 1149, 'YangZ': 970, 'Finneas': 615})
player [Zheng] gets hole card ['D5', 'C8'], current stack 940
player [SichengZuo] gets hole card ['SK', 'HK'], current stack 965
player [Yuchun] gets hole card ['C2', 'HQ'], current stack 806
player [HakulaPlayer] gets hole card ['S8', 'H2'], current stack 2539
player [Ethan] gets hole card ['ST', 'S5'], current stack 1149
player [YangZ] gets hole card ['CJ', 'SA'], current stack 970
player [Finneas] gets hole card ['H9', 'S2'], current stack 615
Started the round 17
Street "preflop" started. (community card = [])
"Ethan" declared "fold:0"
"YangZ" declared "fold:0"
"Finneas" declared "call:10"
"Zheng" declared "call:10"
"SichengZuo" declared "raise:965"
"Yuchun" declared "fold:0"
"HakulaPlayer" declared "fold:0"
"Finneas" declared "fold:0"
"Zheng" declared "fold:0"
"['SichengZuo']" won the round 17 (stack = {'Zheng': 930, 'RaphaelPlayer': 0, 'SichengZuo': 1000, 'Yuchun': 806, 'HakulaPlayer': 2539, 'Ethan': 1149, 'YangZ': 970, 'Finneas': 605})
player [Zheng] gets hole card ['SA', 'S5'], current stack 930
player [SichengZuo] gets hole card ['H6', 'HA'], current stack 1000
player [Yuchun] gets hole card ['CA', 'H3'], current stack 806
player [HakulaPlayer] gets hole card ['S2', 'HQ'], current stack 2534
player [Ethan] gets hole card ['DA', 'S8'], current stack 1139
player [YangZ] gets hole card ['CJ', 'D8'], current stack 970
player [Finneas] gets hole card ['D2', 'C5'], current stack 605
Started the round 18
Street "preflop" started. (community card = [])
"YangZ" declared "fold:0"
"Finneas" declared "call:10"
"Zheng" declared "call:10"
"SichengZuo" declared "fold:0"
"Yuchun" declared "call:10"
"HakulaPlayer" declared "call:10"
"Ethan" declared "fold:0"
Street "flop" started. (community card = ['H9', 'S6', 'DQ'])
"HakulaPlayer" declared "call:0"
"Finneas" declared "call:0"
"Zheng" declared "call:0"
"Yuchun" declared "call:0"
Street "turn" started. (community card = ['H9', 'S6', 'DQ', 'C3'])
"HakulaPlayer" declared "call:0"
"Finneas" declared "call:0"
"Zheng" declared "call:0"
"Yuchun" declared "call:0"
Street "river" started. (community card = ['H9', 'S6', 'DQ', 'C3', 'H5'])
"HakulaPlayer" declared "call:0"
"Finneas" declared "call:0"
"Zheng" declared "call:0"
"Yuchun" declared "call:0"
"['HakulaPlayer']" won the round 18 (stack = {'Zheng': 920, 'RaphaelPlayer': 0, 'SichengZuo': 1000, 'Yuchun': 796, 'HakulaPlayer': 2579, 'Ethan': 1139, 'YangZ': 970, 'Finneas': 595})
player [Zheng] gets hole card ['HK', 'C6'], current stack 920
player [SichengZuo] gets hole card ['SK', 'DQ'], current stack 1000
player [Yuchun] gets hole card ['CQ', 'S5'], current stack 796
player [HakulaPlayer] gets hole card ['H4', 'SJ'], current stack 2579
player [Ethan] gets hole card ['CA', 'D6'], current stack 1134
player [YangZ] gets hole card ['H9', 'C7'], current stack 960
player [Finneas] gets hole card ['CK', 'S8'], current stack 595
Started the round 19
Street "preflop" started. (community card = [])
"Finneas" declared "call:10"
"Zheng" declared "call:10"
"SichengZuo" declared "fold:0"
"Yuchun" declared "call:10"
"HakulaPlayer" declared "call:10"
"Ethan" declared "fold:0"
"YangZ" declared "fold:0"
Street "flop" started. (community card = ['C9', 'C8', 'D9'])
"Finneas" declared "call:0"
"Zheng" declared "call:0"
"Yuchun" declared "call:0"
"HakulaPlayer" declared "call:0"
Street "turn" started. (community card = ['C9', 'C8', 'D9', 'H7'])
"Finneas" declared "call:0"
"Zheng" declared "call:0"
"Yuchun" declared "call:0"
"HakulaPlayer" declared "call:0"
Street "river" started. (community card = ['C9', 'C8', 'D9', 'H7', 'CT'])
"Finneas" declared "call:0"
"Zheng" declared "call:0"
"Yuchun" declared "call:0"
"HakulaPlayer" declared "raise:94"
"Finneas" declared "fold:0"
"Zheng" declared "fold:0"
"Yuchun" declared "fold:0"
"['HakulaPlayer']" won the round 19 (stack = {'Zheng': 910, 'RaphaelPlayer': 0, 'SichengZuo': 1000, 'Yuchun': 786, 'HakulaPlayer': 2624, 'Ethan': 1134, 'YangZ': 960, 'Finneas': 585})
player [Zheng] gets hole card ['HA', 'S7'], current stack 910
player [SichengZuo] gets hole card ['HJ', 'D3'], current stack 1000
player [Yuchun] gets hole card ['D5', 'S5'], current stack 786
player [HakulaPlayer] gets hole card ['S3', 'SQ'], current stack 2624
player [Ethan] gets hole card ['DT', 'D6'], current stack 1134
player [YangZ] gets hole card ['CQ', 'CT'], current stack 955
player [Finneas] gets hole card ['SJ', 'C5'], current stack 575
Started the round 20
Street "preflop" started. (community card = [])
"Zheng" declared "call:10"
"SichengZuo" declared "fold:0"
"Yuchun" declared "call:10"
"HakulaPlayer" declared "call:10"
"Ethan" declared "fold:0"
"YangZ" declared "fold:0"
"Finneas" declared "call:10"
Street "flop" started. (community card = ['S8', 'H6', 'DA'])
"Finneas" declared "call:0"
"Zheng" declared "call:0"
"Yuchun" declared "call:0"
"HakulaPlayer" declared "call:0"
Street "turn" started. (community card = ['S8', 'H6', 'DA', 'H2'])
"Finneas" declared "call:0"
"Zheng" declared "call:0"
"Yuchun" declared "call:0"
"HakulaPlayer" declared "call:0"
Street "river" started. (community card = ['S8', 'H6', 'DA', 'H2', 'H9'])
"Finneas" declared "call:0"
"Zheng" declared "call:0"
"Yuchun" declared "call:0"
"HakulaPlayer" declared "call:0"
"['Zheng']" won the round 20 (stack = {'Zheng': 945, 'RaphaelPlayer': 0, 'SichengZuo': 1000, 'Yuchun': 776, 'HakulaPlayer': 2614, 'Ethan': 1134, 'YangZ': 955, 'Finneas': 575})
player [Zheng] gets hole card ['H2', 'C3'], current stack 935
player [SichengZuo] gets hole card ['D8', 'HT'], current stack 1000
player [Yuchun] gets hole card ['C2', 'S7'], current stack 776
player [HakulaPlayer] gets hole card ['HK', 'S2'], current stack 2614
player [Ethan] gets hole card ['C6', 'SJ'], current stack 1134
player [YangZ] gets hole card ['S4', 'DJ'], current stack 955
player [Finneas] gets hole card ['CA', 'D2'], current stack 570
Started the round 21
Street "preflop" started. (community card = [])
"SichengZuo" declared "fold:0"
"Yuchun" declared "call:10"
"HakulaPlayer" declared "call:10"
"Ethan" declared "fold:0"
"YangZ" declared "fold:0"
"Finneas" declared "call:10"
"Zheng" declared "call:10"
Street "flop" started. (community card = ['S6', 'C9', 'D5'])
"Finneas" declared "call:0"
"Zheng" declared "call:0"
"Yuchun" declared "call:0"
"HakulaPlayer" declared "call:0"
Street "turn" started. (community card = ['S6', 'C9', 'D5', 'SQ'])
"Finneas" declared "call:0"
"Zheng" declared "call:0"
"Yuchun" declared "call:0"
"HakulaPlayer" declared "call:0"
Street "river" started. (community card = ['S6', 'C9', 'D5', 'SQ', 'C8'])
"Finneas" declared "call:0"
"Zheng" declared "call:0"
"Yuchun" declared "raise:766"
"HakulaPlayer" declared "fold:0"
"Finneas" declared "fold:0"
"Zheng" declared "fold:0"
"['Yuchun']" won the round 21 (stack = {'Zheng': 935, 'RaphaelPlayer': 0, 'SichengZuo': 1000, 'Yuchun': 806, 'HakulaPlayer': 2604, 'Ethan': 1134, 'YangZ': 955, 'Finneas': 565})
player [Zheng] gets hole card ['DJ', 'DA'], current stack 930
player [SichengZuo] gets hole card ['S3', 'HA'], current stack 990
player [Yuchun] gets hole card ['CJ', 'C6'], current stack 806
player [HakulaPlayer] gets hole card ['H4', 'C5'], current stack 2604
player [Ethan] gets hole card ['SK', 'SA'], current stack 1134
player [YangZ] gets hole card ['C9', 'H9'], current stack 955
player [Finneas] gets hole card ['SQ', 'HT'], current stack 565
Started the round 22
Street "preflop" started. (community card = [])
"Yuchun" declared "call:10"
"HakulaPlayer" declared "call:10"
"Ethan" declared "raise:340"
"YangZ" declared "fold:0"
"Finneas" declared "fold:0"
"Zheng" declared "fold:0"
"SichengZuo" declared "fold:0"
"Yuchun" declared "fold:0"
"HakulaPlayer" declared "fold:0"
"['Ethan']" won the round 22 (stack = {'Zheng': 930, 'RaphaelPlayer': 0, 'SichengZuo': 990, 'Yuchun': 796, 'HakulaPlayer': 2594, 'Ethan': 1169, 'YangZ': 955, 'Finneas': 565})
player [Zheng] gets hole card ['D2', 'S6'], current stack 930
player [SichengZuo] gets hole card ['CQ', 'DK'], current stack 985
player [Yuchun] gets hole card ['D4', 'SA'], current stack 786
player [HakulaPlayer] gets hole card ['CK', 'DJ'], current stack 2594
player [Ethan] gets hole card ['S8', 'D5'], current stack 1169
player [YangZ] gets hole card ['H2', 'D8'], current stack 955
player [Finneas] gets hole card ['S7', 'D3'], current stack 565
Started the round 23
Street "preflop" started. (community card = [])
"HakulaPlayer" declared "call:10"
"Ethan" declared "fold:0"
"YangZ" declared "fold:0"
"Finneas" declared "call:10"
"Zheng" declared "call:10"
"SichengZuo" declared "fold:0"
"Yuchun" declared "call:10"
Street "flop" started. (community card = ['C9', 'CT', 'C5'])
"Yuchun" declared "call:0"
"HakulaPlayer" declared "call:0"
"Finneas" declared "call:0"
"Zheng" declared "call:0"
Street "turn" started. (community card = ['C9', 'CT', 'C5', 'DA'])
"Yuchun" declared "call:0"
"HakulaPlayer" declared "call:0"
"Finneas" declared "call:0"
"Zheng" declared "call:0"
Street "river" started. (community card = ['C9', 'CT', 'C5', 'DA', 'S9'])
"Yuchun" declared "call:0"
"HakulaPlayer" declared "call:0"
"Finneas" declared "call:0"
"Zheng" declared "call:0"
"['Yuchun']" won the round 23 (stack = {'Zheng': 920, 'RaphaelPlayer': 0, 'SichengZuo': 985, 'Yuchun': 831, 'HakulaPlayer': 2584, 'Ethan': 1169, 'YangZ': 955, 'Finneas': 555})
player [Zheng] gets hole card ['DJ', 'C4'], current stack 920
player [SichengZuo] gets hole card ['SQ', 'CQ'], current stack 985
player [Yuchun] gets hole card ['C2', 'H7'], current stack 826
player [HakulaPlayer] gets hole card ['CT', 'C3'], current stack 2574
player [Ethan] gets hole card ['HA', 'D5'], current stack 1169
player [YangZ] gets hole card ['D2', 'HQ'], current stack 955
player [Finneas] gets hole card ['DT', 'CA'], current stack 555
Started the round 24
Street "preflop" started. (community card = [])
"Ethan" declared "fold:0"
"YangZ" declared "fold:0"
"Finneas" declared "call:10"
"Zheng" declared "call:10"
"SichengZuo" declared "fold:0"
"Yuchun" declared "call:10"
"HakulaPlayer" declared "call:10"
Street "flop" started. (community card = ['H5', 'S8', 'C5'])
"Yuchun" declared "call:0"
"HakulaPlayer" declared "call:0"
"Finneas" declared "call:0"
"Zheng" declared "call:0"
Street "turn" started. (community card = ['H5', 'S8', 'C5', 'D7'])
"Yuchun" declared "call:0"
"HakulaPlayer" declared "call:0"
"Finneas" declared "call:0"
"Zheng" declared "call:0"
Street "river" started. (community card = ['H5', 'S8', 'C5', 'D7', 'H2'])
"Yuchun" declared "call:0"
"HakulaPlayer" declared "call:0"
"Finneas" declared "call:0"
"Zheng" declared "call:0"
"['Yuchun']" won the round 24 (stack = {'Zheng': 910, 'RaphaelPlayer': 0, 'SichengZuo': 985, 'Yuchun': 861, 'HakulaPlayer': 2574, 'Ethan': 1169, 'YangZ': 955, 'Finneas': 545})
player [Zheng] gets hole card ['DJ', 'D9'], current stack 910
player [SichengZuo] gets hole card ['SA', 'D4'], current stack 985
player [Yuchun] gets hole card ['H7', 'H9'], current stack 861
player [HakulaPlayer] gets hole card ['C8', 'DK'], current stack 2569
player [Ethan] gets hole card ['S7', 'C4'], current stack 1159
player [YangZ] gets hole card ['H4', 'ST'], current stack 955
player [Finneas] gets hole card ['CK', 'S3'], current stack 545
Started the round 25
Street "preflop" started. (community card = [])
"YangZ" declared "fold:0"
"Finneas" declared "call:10"
"Zheng" declared "call:10"
"SichengZuo" declared "fold:0"
"Yuchun" declared "call:10"
"HakulaPlayer" declared "call:10"
"Ethan" declared "fold:0"
Street "flop" started. (community card = ['S4', 'HT', 'D3'])
"HakulaPlayer" declared "call:0"
"Finneas" declared "call:0"
"Zheng" declared "call:0"
"Yuchun" declared "call:0"
Street "turn" started. (community card = ['S4', 'HT', 'D3', 'CT'])
"HakulaPlayer" declared "call:0"
"Finneas" declared "call:0"
"Zheng" declared "call:0"
"Yuchun" declared "call:0"
Street "river" started. (community card = ['S4', 'HT', 'D3', 'CT', 'S6'])
"HakulaPlayer" declared "call:0"
"Finneas" declared "call:0"
"Zheng" declared "call:0"
"Yuchun" declared "call:0"
"['Finneas']" won the round 25 (stack = {'Zheng': 900, 'RaphaelPlayer': 0, 'SichengZuo': 985, 'Yuchun': 851, 'HakulaPlayer': 2564, 'Ethan': 1159, 'YangZ': 955, 'Finneas': 585})
player [Zheng] gets hole card ['CK', 'HQ'], current stack 900
player [SichengZuo] gets hole card ['S9', 'D5'], current stack 985
player [Yuchun] gets hole card ['HJ', 'S5'], current stack 851
player [HakulaPlayer] gets hole card ['CJ', 'C4'], current stack 2564
player [Ethan] gets hole card ['DT', 'CA'], current stack 1154
player [YangZ] gets hole card ['HA', 'C7'], current stack 945
player [Finneas] gets hole card ['SQ', 'D4'], current stack 585
Started the round 26
Street "preflop" started. (community card = [])
"Finneas" declared "call:10"
"Zheng" declared "call:10"
"SichengZuo" declared "fold:0"
"Yuchun" declared "call:10"
"HakulaPlayer" declared "call:10"
"Ethan" declared "call:10"
"YangZ" declared "fold:0"
Street "flop" started. (community card = ['D7', 'ST', 'SA'])
"Ethan" declared "call:0"
"Finneas" declared "call:0"
"Zheng" declared "call:0"
"Yuchun" declared "call:0"
"HakulaPlayer" declared "call:0"
Street "turn" started. (community card = ['D7', 'ST', 'SA', 'C2'])
"Ethan" declared "call:0"
"Finneas" declared "call:0"
"Zheng" declared "call:0"
"Yuchun" declared "call:0"
"HakulaPlayer" declared "call:0"
Street "river" started. (community card = ['D7', 'ST', 'SA', 'C2', 'CQ'])
"Ethan" declared "call:0"
"Finneas" declared "call:0"
"Zheng" declared "call:0"
"Yuchun" declared "call:0"
"HakulaPlayer" declared "call:0"
"['Ethan']" won the round 26 (stack = {'Zheng': 890, 'RaphaelPlayer': 0, 'SichengZuo': 985, 'Yuchun': 841, 'HakulaPlayer': 2554, 'Ethan': 1209, 'YangZ': 945, 'Finneas': 575})
player [Zheng] gets hole card ['S8', 'C7'], current stack 890
player [SichengZuo] gets hole card ['H7', 'H3'], current stack 985
player [Yuchun] gets hole card ['S3', 'DK'], current stack 841
player [HakulaPlayer] gets hole card ['CA', 'D4'], current stack 2554
player [Ethan] gets hole card ['D9', 'C5'], current stack 1209
player [YangZ] gets hole card ['H6', 'H5'], current stack 940
player [Finneas] gets hole card ['SJ', 'ST'], current stack 565
Started the round 27
Street "preflop" started. (community card = [])
"Zheng" declared "call:10"
"SichengZuo" declared "fold:0"
"Yuchun" declared "call:10"
"HakulaPlayer" declared "call:10"
"Ethan" declared "fold:0"
"YangZ" declared "fold:0"
"Finneas" declared "call:10"
Street "flop" started. (community card = ['D2', 'SK', 'SA'])
"Finneas" declared "call:0"
"Zheng" declared "call:0"
"Yuchun" declared "call:0"
"HakulaPlayer" declared "raise:56"
"Finneas" declared "fold:0"
"Zheng" declared "call:56"
"Yuchun" declared "call:56"
Street "turn" started. (community card = ['D2', 'SK', 'SA', 'S6'])
"Zheng" declared "call:0"
"Yuchun" declared "call:0"
"HakulaPlayer" declared "call:0"
Street "river" started. (community card = ['D2', 'SK', 'SA', 'S6', 'S4'])
"Zheng" declared "call:0"
"Yuchun" declared "call:0"
"HakulaPlayer" declared "call:0"
"['Zheng']" won the round 27 (stack = {'Zheng': 1037, 'RaphaelPlayer': 0, 'SichengZuo': 985, 'Yuchun': 775, 'HakulaPlayer': 2488, 'Ethan': 1209, 'YangZ': 940, 'Finneas': 565})
player [Zheng] gets hole card ['SK', 'H9'], current stack 1027
player [SichengZuo] gets hole card ['C7', 'C8'], current stack 985
player [Yuchun] gets hole card ['ST', 'HQ'], current stack 775
player [HakulaPlayer] gets hole card ['DK', 'SQ'], current stack 2488
player [Ethan] gets hole card ['S2', 'C6'], current stack 1209
player [YangZ] gets hole card ['DA', 'C5'], current stack 940
player [Finneas] gets hole card ['D2', 'H4'], current stack 560
Started the round 28
Street "preflop" started. (community card = [])
"SichengZuo" declared "fold:0"
"Yuchun" declared "call:10"
"HakulaPlayer" declared "raise:38"
"Ethan" declared "fold:0"
"YangZ" declared "fold:0"
"Finneas" declared "fold:0"
"Zheng" declared "call:38"
"Yuchun" declared "call:38"
Street "flop" started. (community card = ['C4', 'C9', 'S8'])
"Zheng" declared "call:0"
"Yuchun" declared "call:0"
"HakulaPlayer" declared "call:0"
Street "turn" started. (community card = ['C4', 'C9', 'S8', 'D8'])
"Zheng" declared "call:0"
"Yuchun" declared "call:0"
"HakulaPlayer" declared "call:0"
Street "river" started. (community card = ['C4', 'C9', 'S8', 'D8', 'DT'])
"Zheng" declared "call:0"
"Yuchun" declared "call:0"
"HakulaPlayer" declared "call:0"
"['Yuchun']" won the round 28 (stack = {'Zheng': 999, 'RaphaelPlayer': 0, 'SichengZuo': 985, 'Yuchun': 856, 'HakulaPlayer': 2450, 'Ethan': 1209, 'YangZ': 940, 'Finneas': 560})
player [Zheng] gets hole card ['C2', 'H4'], current stack 994
player [SichengZuo] gets hole card ['C3', 'H8'], current stack 975
player [Yuchun] gets hole card ['DQ', 'D9'], current stack 856
player [HakulaPlayer] gets hole card ['D8', 'S6'], current stack 2450
player [Ethan] gets hole card ['HA', 'DJ'], current stack 1209
player [YangZ] gets hole card ['H9', 'SK'], current stack 940
player [Finneas] gets hole card ['C9', 'HQ'], current stack 560
Started the round 29
Street "preflop" started. (community card = [])
"Yuchun" declared "call:10"
"HakulaPlayer" declared "call:10"
"Ethan" declared "raise:181"
"YangZ" declared "fold:0"
"Finneas" declared "fold:0"
"Zheng" declared "fold:0"
"SichengZuo" declared "fold:0"
"Yuchun" declared "call:181"
"HakulaPlayer" declared "fold:0"
Street "flop" started. (community card = ['S8', 'D6', 'SA'])
"Yuchun" declared "call:0"
"Ethan" declared "call:0"
Street "turn" started. (community card = ['S8', 'D6', 'SA', 'S7'])
"Yuchun" declared "call:0"
"Ethan" declared "call:0"
Street "river" started. (community card = ['S8', 'D6', 'SA', 'S7', 'C8'])
"Yuchun" declared "call:0"
"Ethan" declared "call:0"
"['Ethan']" won the round 29 (stack = {'Zheng': 994, 'RaphaelPlayer': 0, 'SichengZuo': 975, 'Yuchun': 675, 'HakulaPlayer': 2440, 'Ethan': 1415, 'YangZ': 940, 'Finneas': 560})
player [Zheng] gets hole card ['H8', 'H3'], current stack 994
player [SichengZuo] gets hole card ['S6', 'D3'], current stack 970
player [Yuchun] gets hole card ['C9', 'SK'], current stack 665
player [HakulaPlayer] gets hole card ['H9', 'ST'], current stack 2440
player [Ethan] gets hole card ['D9', 'S5'], current stack 1415
player [YangZ] gets hole card ['S2', 'HK'], current stack 940
player [Finneas] gets hole card ['DQ', 'DK'], current stack 560
Started the round 30
Street "preflop" started. (community card = [])
"HakulaPlayer" declared "fold:0"
"Ethan" declared "fold:0"
"YangZ" declared "fold:0"
"Finneas" declared "call:10"
"Zheng" declared "call:10"
"SichengZuo" declared "fold:0"
"Yuchun" declared "call:10"
Street "flop" started. (community card = ['SA', 'D7', 'CJ'])
"Yuchun" declared "call:0"
"Finneas" declared "call:0"
"Zheng" declared "call:0"
Street "turn" started. (community card = ['SA', 'D7', 'CJ', 'C5'])
"Yuchun" declared "call:0"
"Finneas" declared "call:0"
"Zheng" declared "call:0"
Street "river" started. (community card = ['SA', 'D7', 'CJ', 'C5', 'C6'])
"Yuchun" declared "call:0"
"Finneas" declared "call:0"
"Zheng" declared "call:0"
"['Finneas']" won the round 30 (stack = {'Zheng': 984, 'RaphaelPlayer': 0, 'SichengZuo': 970, 'Yuchun': 665, 'HakulaPlayer': 2440, 'Ethan': 1415, 'YangZ': 940, 'Finneas': 585})
player [Zheng] gets hole card ['ST', 'HJ'], current stack 984
player [SichengZuo] gets hole card ['H5', 'S8'], current stack 970
player [Yuchun] gets hole card ['S3', 'S9'], current stack 660
player [HakulaPlayer] gets hole card ['HA', 'CT'], current stack 2430
player [Ethan] gets hole card ['D5', 'C3'], current stack 1415
player [YangZ] gets hole card ['SK', 'C8'], current stack 940
player [Finneas] gets hole card ['S5', 'CK'], current stack 585
Started the round 31
Street "preflop" started. (community card = [])
"Ethan" declared "fold:0"
"YangZ" declared "fold:0"
"Finneas" declared "call:10"
"Zheng" declared "call:10"
"SichengZuo" declared "fold:0"
"Yuchun" declared "call:10"
"HakulaPlayer" declared "call:10"
Street "flop" started. (community card = ['SQ', 'C5', 'H8'])
"Yuchun" declared "call:0"
"HakulaPlayer" declared "call:0"
"Finneas" declared "call:0"
"Zheng" declared "call:0"
Street "turn" started. (community card = ['SQ', 'C5', 'H8', 'C2'])
"Yuchun" declared "call:0"
"HakulaPlayer" declared "call:0"
"Finneas" declared "call:0"
"Zheng" declared "call:0"
Street "river" started. (community card = ['SQ', 'C5', 'H8', 'C2', 'H9'])
"Yuchun" declared "call:0"
"HakulaPlayer" declared "call:0"
"Finneas" declared "call:0"
"Zheng" declared "raise:974"
"Yuchun" declared "fold:0"
"HakulaPlayer" declared "fold:0"
"Finneas" declared "fold:0"
"['Zheng']" won the round 31 (stack = {'Zheng': 1014, 'RaphaelPlayer': 0, 'SichengZuo': 970, 'Yuchun': 655, 'HakulaPlayer': 2430, 'Ethan': 1415, 'YangZ': 940, 'Finneas': 575})
player [Zheng] gets hole card ['CJ', 'DJ'], current stack 1014
player [SichengZuo] gets hole card ['DT', 'H7'], current stack 970
player [Yuchun] gets hole card ['HQ', 'HT'], current stack 655
player [HakulaPlayer] gets hole card ['CA', 'ST'], current stack 2425
player [Ethan] gets hole card ['D3', 'SJ'], current stack 1405
player [YangZ] gets hole card ['C6', 'C8'], current stack 940
player [Finneas] gets hole card ['D4', 'SK'], current stack 575
Started the round 32
Street "preflop" started. (community card = [])
"YangZ" declared "fold:0"
"Finneas" declared "call:10"
"Zheng" declared "call:10"
"SichengZuo" declared "fold:0"
"Yuchun" declared "call:10"
"HakulaPlayer" declared "call:10"
"Ethan" declared "fold:0"
Street "flop" started. (community card = ['CK', 'H5', 'S2'])
"HakulaPlayer" declared "call:0"
"Finneas" declared "call:0"
"Zheng" declared "call:0"
"Yuchun" declared "call:0"
Street "turn" started. (community card = ['CK', 'H5', 'S2', 'CT'])
"HakulaPlayer" declared "call:0"
"Finneas" declared "call:0"
"Zheng" declared "call:0"
"Yuchun" declared "call:0"
Street "river" started. (community card = ['CK', 'H5', 'S2', 'CT', 'H6'])
"HakulaPlayer" declared "call:0"
"Finneas" declared "call:0"
"Zheng" declared "call:0"
"Yuchun" declared "call:0"
"['Finneas']" won the round 32 (stack = {'Zheng': 1004, 'RaphaelPlayer': 0, 'SichengZuo': 970, 'Yuchun': 645, 'HakulaPlayer': 2420, 'Ethan': 1405, 'YangZ': 940, 'Finneas': 615})
player [Zheng] gets hole card ['HA', 'HK'], current stack 1004
player [SichengZuo] gets hole card ['C4', 'CQ'], current stack 970
player [Yuchun] gets hole card ['H9', 'S6'], current stack 645
player [HakulaPlayer] gets hole card ['CK', 'S2'], current stack 2420
player [Ethan] gets hole card ['S8', 'CT'], current stack 1400
player [YangZ] gets hole card ['SA', 'C9'], current stack 930
player [Finneas] gets hole card ['CJ', 'D4'], current stack 615
Started the round 33
Street "preflop" started. (community card = [])
"Finneas" declared "call:10"
"Zheng" declared "call:10"
"SichengZuo" declared "fold:0"
"Yuchun" declared "call:10"
"HakulaPlayer" declared "call:10"
"Ethan" declared "fold:0"
"YangZ" declared "fold:0"
Street "flop" started. (community card = ['SQ', 'H4', 'D8'])
"Finneas" declared "call:0"
"Zheng" declared "call:0"
"Yuchun" declared "call:0"
"HakulaPlayer" declared "call:0"
Street "turn" started. (community card = ['SQ', 'H4', 'D8', 'S7'])
"Finneas" declared "call:0"
"Zheng" declared "call:0"
"Yuchun" declared "call:0"
"HakulaPlayer" declared "call:0"
Street "river" started. (community card = ['SQ', 'H4', 'D8', 'S7', 'D6'])
"Finneas" declared "call:0"
"Zheng" declared "call:0"
"Yuchun" declared "call:0"
"HakulaPlayer" declared "call:0"
"['Yuchun']" won the round 33 (stack = {'Zheng': 994, 'RaphaelPlayer': 0, 'SichengZuo': 970, 'Yuchun': 690, 'HakulaPlayer': 2410, 'Ethan': 1400, 'YangZ': 930, 'Finneas': 605})
player [Zheng] gets hole card ['CT', 'D5'], current stack 994
player [SichengZuo] gets hole card ['HJ', 'C7'], current stack 970
player [Yuchun] gets hole card ['HK', 'SK'], current stack 690
player [HakulaPlayer] gets hole card ['S7', 'C2'], current stack 2410
player [Ethan] gets hole card ['DQ', 'C6'], current stack 1400
player [YangZ] gets hole card ['S8', 'C8'], current stack 925
player [Finneas] gets hole card ['H7', 'S2'], current stack 595
Started the round 34
Street "preflop" started. (community card = [])
"Zheng" declared "call:10"
"SichengZuo" declared "fold:0"
"Yuchun" declared "call:10"
"HakulaPlayer" declared "fold:0"
"Ethan" declared "fold:0"
"YangZ" declared "fold:0"
"Finneas" declared "call:10"
Street "flop" started. (community card = ['H4', 'HT', 'HA'])
"Finneas" declared "call:0"
"Zheng" declared "call:0"
"Yuchun" declared "call:0"
Street "turn" started. (community card = ['H4', 'HT', 'HA', 'S9'])
"Finneas" declared "call:0"
"Zheng" declared "call:0"
"Yuchun" declared "call:0"
Street "river" started. (community card = ['H4', 'HT', 'HA', 'S9', 'C4'])
"Finneas" declared "call:0"
"Zheng" declared "call:0"
"Yuchun" declared "call:0"
"['Yuchun']" won the round 34 (stack = {'Zheng': 984, 'RaphaelPlayer': 0, 'SichengZuo': 970, 'Yuchun': 715, 'HakulaPlayer': 2410, 'Ethan': 1400, 'YangZ': 925, 'Finneas': 595})
player [Zheng] gets hole card ['C5', 'C9'], current stack 974
player [SichengZuo] gets hole card ['D5', 'C4'], current stack 970
player [Yuchun] gets hole card ['D8', 'CK'], current stack 715
player [HakulaPlayer] gets hole card ['SK', 'C2'], current stack 2410
player [Ethan] gets hole card ['H6', 'H3'], current stack 1400
player [YangZ] gets hole card ['D9', 'D2'], current stack 925
player [Finneas] gets hole card ['HK', 'CJ'], current stack 590
Started the round 35
Street "preflop" started. (community card = [])
"SichengZuo" declared "fold:0"
"Yuchun" declared "call:10"
"HakulaPlayer" declared "call:10"
"Ethan" declared "fold:0"
"YangZ" declared "fold:0"
"Finneas" declared "call:10"
"Zheng" declared "call:10"
Street "flop" started. (community card = ['ST', 'C7', 'H4'])
"Finneas" declared "call:0"
"Zheng" declared "call:0"
"Yuchun" declared "call:0"
"HakulaPlayer" declared "call:0"
Street "turn" started. (community card = ['ST', 'C7', 'H4', 'D7'])
"Finneas" declared "call:0"
"Zheng" declared "call:0"
"Yuchun" declared "call:0"
"HakulaPlayer" declared "call:0"
Street "river" started. (community card = ['ST', 'C7', 'H4', 'D7', 'S2'])
"Finneas" declared "call:0"
"Zheng" declared "call:0"
"Yuchun" declared "call:0"
"HakulaPlayer" declared "call:0"
"['HakulaPlayer']" won the round 35 (stack = {'Zheng': 974, 'RaphaelPlayer': 0, 'SichengZuo': 970, 'Yuchun': 705, 'HakulaPlayer': 2440, 'Ethan': 1400, 'YangZ': 925, 'Finneas': 585})
player [Zheng] gets hole card ['DQ', 'H3'], current stack 969
player [SichengZuo] gets hole card ['CQ', 'ST'], current stack 960
player [Yuchun] gets hole card ['D7', 'CJ'], current stack 705
player [HakulaPlayer] gets hole card ['CA', 'H2'], current stack 2440
player [Ethan] gets hole card ['C5', 'D9'], current stack 1400
player [YangZ] gets hole card ['DJ', 'S5'], current stack 925
player [Finneas] gets hole card ['H8', 'C9'], current stack 585
Started the round 36
Street "preflop" started. (community card = [])
"Yuchun" declared "call:10"
"HakulaPlayer" declared "call:10"
"Ethan" declared "fold:0"
"YangZ" declared "fold:0"
"Finneas" declared "call:10"
"Zheng" declared "call:10"
"SichengZuo" declared "fold:0"
Street "flop" started. (community card = ['C4', 'S7', 'HJ'])
"Zheng" declared "call:0"
"Yuchun" declared "raise:40"
"HakulaPlayer" declared "fold:0"
"Finneas" declared "fold:0"
"Zheng" declared "call:40"
Street "turn" started. (community card = ['C4', 'S7', 'HJ', 'S9'])
"Zheng" declared "call:0"
"Yuchun" declared "raise:655"
"Zheng" declared "fold:0"
"['Yuchun']" won the round 36 (stack = {'Zheng': 924, 'RaphaelPlayer': 0, 'SichengZuo': 960, 'Yuchun': 785, 'HakulaPlayer': 2430, 'Ethan': 1400, 'YangZ': 925, 'Finneas': 575})
player [Zheng] gets hole card ['S3', 'CT'], current stack 924
player [SichengZuo] gets hole card ['C6', 'S4'], current stack 955
player [Yuchun] gets hole card ['HA', 'H8'], current stack 775
player [HakulaPlayer] gets hole card ['D3', 'D6'], current stack 2430
player [Ethan] gets hole card ['H6', 'D7'], current stack 1400
player [YangZ] gets hole card ['DT', 'H5'], current stack 925
player [Finneas] gets hole card ['H4', 'CK'], current stack 575
Started the round 37
Street "preflop" started. (community card = [])
"HakulaPlayer" declared "fold:0"
"Ethan" declared "fold:0"
"YangZ" declared "fold:0"
"Finneas" declared "call:10"
"Zheng" declared "call:10"
"SichengZuo" declared "fold:0"
"Yuchun" declared "call:10"
Street "flop" started. (community card = ['H3', 'D8', 'H7'])
"Yuchun" declared "raise:40"
"Finneas" declared "fold:0"
"Zheng" declared "call:40"
Street "turn" started. (community card = ['H3', 'D8', 'H7', 'D2'])
"Yuchun" declared "raise:735"
"Zheng" declared "fold:0"
"['Yuchun']" won the round 37 (stack = {'Zheng': 874, 'RaphaelPlayer': 0, 'SichengZuo': 955, 'Yuchun': 850, 'HakulaPlayer': 2430, 'Ethan': 1400, 'YangZ': 925, 'Finneas': 565})
player [Zheng] gets hole card ['SJ', 'CQ'], current stack 874
player [SichengZuo] gets hole card ['H8', 'DA'], current stack 955
player [Yuchun] gets hole card ['S9', 'D5'], current stack 845
player [HakulaPlayer] gets hole card ['S6', 'D8'], current stack 2420
player [Ethan] gets hole card ['DK', 'SK'], current stack 1400
player [YangZ] gets hole card ['S8', 'H3'], current stack 925
player [Finneas] gets hole card ['C9', 'CJ'], current stack 565
Started the round 38
Street "preflop" started. (community card = [])
"Ethan" declared "raise:420"
"YangZ" declared "fold:0"
"Finneas" declared "fold:0"
"Zheng" declared "fold:0"
"SichengZuo" declared "fold:0"
"Yuchun" declared "fold:0"
"HakulaPlayer" declared "fold:0"
"['Ethan']" won the round 38 (stack = {'Zheng': 874, 'RaphaelPlayer': 0, 'SichengZuo': 955, 'Yuchun': 845, 'HakulaPlayer': 2420, 'Ethan': 1415, 'YangZ': 925, 'Finneas': 565})
player [Zheng] gets hole card ['H2', 'C7'], current stack 874
player [SichengZuo] gets hole card ['HA', 'ST'], current stack 955
player [Yuchun] gets hole card ['HK', 'S8'], current stack 845
player [HakulaPlayer] gets hole card ['C2', 'S5'], current stack 2415
player [Ethan] gets hole card ['H6', 'D5'], current stack 1405
player [YangZ] gets hole card ['S7', 'H5'], current stack 925
player [Finneas] gets hole card ['C3', 'CQ'], current stack 565
Started the round 39
Street "preflop" started. (community card = [])
"YangZ" declared "fold:0"
"Finneas" declared "call:10"
"Zheng" declared "call:10"
"SichengZuo" declared "fold:0"
"Yuchun" declared "call:10"
"HakulaPlayer" declared "call:10"
"Ethan" declared "fold:0"
Street "flop" started. (community card = ['S3', 'H3', 'DQ'])
"HakulaPlayer" declared "call:0"
"Finneas" declared "raise:282"
"Zheng" declared "fold:0"
"Yuchun" declared "fold:0"
"HakulaPlayer" declared "fold:0"
"['Finneas']" won the round 39 (stack = {'Zheng': 864, 'RaphaelPlayer': 0, 'SichengZuo': 955, 'Yuchun': 835, 'HakulaPlayer': 2410, 'Ethan': 1405, 'YangZ': 925, 'Finneas': 605})
player [Zheng] gets hole card ['C3', 'DT'], current stack 864
player [SichengZuo] gets hole card ['H2', 'D9'], current stack 955
player [Yuchun] gets hole card ['D4', 'DJ'], current stack 835
player [HakulaPlayer] gets hole card ['D7', 'S4'], current stack 2410
player [Ethan] gets hole card ['HK', 'S3'], current stack 1400
player [YangZ] gets hole card ['SA', 'SJ'], current stack 915
player [Finneas] gets hole card ['H7', 'D3'], current stack 605
Started the round 40
Street "preflop" started. (community card = [])
"Finneas" declared "call:10"
"Zheng" declared "call:10"
"SichengZuo" declared "fold:0"
"Yuchun" declared "call:10"
"HakulaPlayer" declared "call:10"
"Ethan" declared "fold:0"
"YangZ" declared "fold:0"
Street "flop" started. (community card = ['CA', 'S2', 'HA'])
"Finneas" declared "call:0"
"Zheng" declared "call:0"
"Yuchun" declared "call:0"
"HakulaPlayer" declared "call:0"
Street "turn" started. (community card = ['CA', 'S2', 'HA', 'D8'])
"Finneas" declared "call:0"
"Zheng" declared "call:0"
"Yuchun" declared "call:0"
"HakulaPlayer" declared "call:0"
Street "river" started. (community card = ['CA', 'S2', 'HA', 'D8', 'DQ'])
"Finneas" declared "call:0"
"Zheng" declared "call:0"
"Yuchun" declared "call:0"
"HakulaPlayer" declared "call:0"
"['Yuchun']" won the round 40 (stack = {'Zheng': 854, 'RaphaelPlayer': 0, 'SichengZuo': 955, 'Yuchun': 880, 'HakulaPlayer': 2400, 'Ethan': 1400, 'YangZ': 915, 'Finneas': 595})
player [Zheng] gets hole card ['CT', 'HT'], current stack 854
player [SichengZuo] gets hole card ['S2', 'C7'], current stack 955
player [Yuchun] gets hole card ['SQ', 'D2'], current stack 880
player [HakulaPlayer] gets hole card ['H6', 'S3'], current stack 2400
player [Ethan] gets hole card ['H3', 'SK'], current stack 1400
player [YangZ] gets hole card ['H5', 'S5'], current stack 910
player [Finneas] gets hole card ['S8', 'HK'], current stack 585
Started the round 41
Street "preflop" started. (community card = [])
"Zheng" declared "call:10"
"SichengZuo" declared "fold:0"
"Yuchun" declared "fold:0"
"HakulaPlayer" declared "fold:0"
"Ethan" declared "fold:0"
"YangZ" declared "fold:0"
"Finneas" declared "call:10"
Street "flop" started. (community card = ['ST', 'D9', 'D3'])
"Finneas" declared "call:0"
"Zheng" declared "raise:844"
"Finneas" declared "fold:0"
"['Zheng']" won the round 41 (stack = {'Zheng': 869, 'RaphaelPlayer': 0, 'SichengZuo': 955, 'Yuchun': 880, 'HakulaPlayer': 2400, 'Ethan': 1400, 'YangZ': 910, 'Finneas': 585})
player [Zheng] gets hole card ['S9', 'DK'], current stack 859
player [SichengZuo] gets hole card ['HA', 'HK'], current stack 955
player [Yuchun] gets hole card ['CQ', 'SA'], current stack 880
player [HakulaPlayer] gets hole card ['D9', 'S2'], current stack 2400
player [Ethan] gets hole card ['DT', 'CA'], current stack 1400
player [YangZ] gets hole card ['H4', 'D6'], current stack 910
player [Finneas] gets hole card ['D4', 'S8'], current stack 580
Started the round 42
Street "preflop" started. (community card = [])
"SichengZuo" declared "fold:0"
"Yuchun" declared "fold:0"
"HakulaPlayer" declared "fold:0"
"Ethan" declared "call:10"
"YangZ" declared "fold:0"
"Finneas" declared "call:10"
"Zheng" declared "call:10"
Street "flop" started. (community card = ['C3', 'C4', 'S3'])
"Finneas" declared "call:0"
"Zheng" declared "call:0"
"Ethan" declared "call:0"
Street "turn" started. (community card = ['C3', 'C4', 'S3', 'D7'])
"Finneas" declared "call:0"
"Zheng" declared "call:0"
"Ethan" declared "call:0"
Street "river" started. (community card = ['C3', 'C4', 'S3', 'D7', 'C8'])
"Finneas" declared "call:0"
"Zheng" declared "call:0"
"Ethan" declared "call:0"
"['Finneas']" won the round 42 (stack = {'Zheng': 859, 'RaphaelPlayer': 0, 'SichengZuo': 955, 'Yuchun': 880, 'HakulaPlayer': 2400, 'Ethan': 1390, 'YangZ': 910, 'Finneas': 605})
player [Zheng] gets hole card ['D9', 'CT'], current stack 854
player [SichengZuo] gets hole card ['D7', 'H8'], current stack 945
player [Yuchun] gets hole card ['D4', 'HT'], current stack 880
player [HakulaPlayer] gets hole card ['DJ', 'DQ'], current stack 2400
player [Ethan] gets hole card ['DA', 'S8'], current stack 1390
player [YangZ] gets hole card ['S6', 'DT'], current stack 910
player [Finneas] gets hole card ['C9', 'S4'], current stack 605
Started the round 43
Street "preflop" started. (community card = [])
"Yuchun" declared "fold:0"
"HakulaPlayer" declared "call:10"
"Ethan" declared "fold:0"
"YangZ" declared "fold:0"
"Finneas" declared "call:10"
"Zheng" declared "call:10"
"SichengZuo" declared "fold:0"
Street "flop" started. (community card = ['H4', 'SQ', 'SA'])
"Zheng" declared "call:0"
"HakulaPlayer" declared "call:0"
"Finneas" declared "call:0"
Street "turn" started. (community card = ['H4', 'SQ', 'SA', 'H9'])
"Zheng" declared "call:0"
"HakulaPlayer" declared "call:0"
"Finneas" declared "call:0"
Street "river" started. (community card = ['H4', 'SQ', 'SA', 'H9', 'C3'])
"Zheng" declared "call:0"
"HakulaPlayer" declared "call:0"
"Finneas" declared "call:0"
"['Finneas']" won the round 43 (stack = {'Zheng': 849, 'RaphaelPlayer': 0, 'SichengZuo': 945, 'Yuchun': 880, 'HakulaPlayer': 2390, 'Ethan': 1390, 'YangZ': 910, 'Finneas': 635})
player [Zheng] gets hole card ['H3', 'D8'], current stack 849
player [SichengZuo] gets hole card ['SJ', 'C8'], current stack 940
player [Yuchun] gets hole card ['H2', 'ST'], current stack 870
player [HakulaPlayer] gets hole card ['S7', 'D6'], current stack 2390
player [Ethan] gets hole card ['H5', 'C6'], current stack 1390
player [YangZ] gets hole card ['D7', 'C4'], current stack 910
player [Finneas] gets hole card ['DA', 'SA'], current stack 635
Started the round 44
Street "preflop" started. (community card = [])
"HakulaPlayer" declared "fold:0"
"Ethan" declared "fold:0"
"YangZ" declared "fold:0"
"Finneas" declared "raise:325"
"Zheng" declared "fold:0"
"SichengZuo" declared "fold:0"
"Yuchun" declared "fold:0"
"['Finneas']" won the round 44 (stack = {'Zheng': 849, 'RaphaelPlayer': 0, 'SichengZuo': 940, 'Yuchun': 870, 'HakulaPlayer': 2390, 'Ethan': 1390, 'YangZ': 910, 'Finneas': 650})
player [Zheng] gets hole card ['ST', 'HA'], current stack 849
player [SichengZuo] gets hole card ['CK', 'CA'], current stack 940
player [Yuchun] gets hole card ['C3', 'H2'], current stack 865
player [HakulaPlayer] gets hole card ['CJ', 'CT'], current stack 2380
player [Ethan] gets hole card ['H5', 'C2'], current stack 1390
player [YangZ] gets hole card ['C6', 'H8'], current stack 910
player [Finneas] gets hole card ['SQ', 'H7'], current stack 650
Started the round 45
Street "preflop" started. (community card = [])
"Ethan" declared "fold:0"
"YangZ" declared "fold:0"
"Finneas" declared "call:10"
"Zheng" declared "call:10"
"SichengZuo" declared "fold:0"
"Yuchun" declared "fold:0"
"HakulaPlayer" declared "call:10"
Street "flop" started. (community card = ['S3', 'DA', 'HT'])
"HakulaPlayer" declared "call:0"
"Finneas" declared "call:0"
"Zheng" declared "raise:424"
"HakulaPlayer" declared "fold:0"
"Finneas" declared "fold:0"
"['Zheng']" won the round 45 (stack = {'Zheng': 874, 'RaphaelPlayer': 0, 'SichengZuo': 940, 'Yuchun': 865, 'HakulaPlayer': 2380, 'Ethan': 1390, 'YangZ': 910, 'Finneas': 640})
player [Zheng] gets hole card ['C9', 'S9'], current stack 874
player [SichengZuo] gets hole card ['DT', 'H8'], current stack 940
player [Yuchun] gets hole card ['H5', 'C5'], current stack 865
player [HakulaPlayer] gets hole card ['HQ', 'C7'], current stack 2375
player [Ethan] gets hole card ['C8', 'S4'], current stack 1380
player [YangZ] gets hole card ['H3', 'D8'], current stack 910
player [Finneas] gets hole card ['H4', 'DK'], current stack 640
Started the round 46
Street "preflop" started. (community card = [])
"YangZ" declared "fold:0"
"Finneas" declared "call:10"
"Zheng" declared "call:10"
"SichengZuo" declared "fold:0"
"Yuchun" declared "fold:0"
"HakulaPlayer" declared "call:10"
"Ethan" declared "fold:0"
Street "flop" started. (community card = ['HA', 'D4', 'C4'])
"HakulaPlayer" declared "call:0"
"Finneas" declared "raise:320"
"Zheng" declared "fold:0"
"HakulaPlayer" declared "fold:0"
"['Finneas']" won the round 46 (stack = {'Zheng': 864, 'RaphaelPlayer': 0, 'SichengZuo': 940, 'Yuchun': 865, 'HakulaPlayer': 2370, 'Ethan': 1380, 'YangZ': 910, 'Finneas': 670})
player [Zheng] gets hole card ['HA', 'CK'], current stack 864
player [SichengZuo] gets hole card ['SJ', 'S4'], current stack 940
player [Yuchun] gets hole card ['S7', 'D8'], current stack 865
player [HakulaPlayer] gets hole card ['C9', 'C4'], current stack 2370
player [Ethan] gets hole card ['C7', 'CT'], current stack 1375
player [YangZ] gets hole card ['S5', 'D9'], current stack 900
player [Finneas] gets hole card ['H8', 'DK'], current stack 670
Started the round 47
Street "preflop" started. (community card = [])
"Finneas" declared "call:10"
"Zheng" declared "call:10"
"SichengZuo" declared "fold:0"
"Yuchun" declared "fold:0"
"HakulaPlayer" declared "call:10"
"Ethan" declared "fold:0"
"YangZ" declared "fold:0"
Street "flop" started. (community card = ['H5', 'D6', 'H9'])
"Finneas" declared "call:0"
"Zheng" declared "call:0"
"HakulaPlayer" declared "call:0"
Street "turn" started. (community card = ['H5', 'D6', 'H9', 'DJ'])
"Finneas" declared "call:0"
"Zheng" declared "call:0"
"HakulaPlayer" declared "call:0"
Street "river" started. (community card = ['H5', 'D6', 'H9', 'DJ', 'DT'])
"Finneas" declared "call:0"
"Zheng" declared "call:0"
"HakulaPlayer" declared "call:0"
"['HakulaPlayer']" won the round 47 (stack = {'Zheng': 854, 'RaphaelPlayer': 0, 'SichengZuo': 940, 'Yuchun': 865, 'HakulaPlayer': 2405, 'Ethan': 1375, 'YangZ': 900, 'Finneas': 660})
player [Zheng] gets hole card ['ST', 'H7'], current stack 854
player [SichengZuo] gets hole card ['S8', 'HQ'], current stack 940
player [Yuchun] gets hole card ['S7', 'DK'], current stack 865
player [HakulaPlayer] gets hole card ['S6', 'CK'], current stack 2405
player [Ethan] gets hole card ['H2', 'SQ'], current stack 1375
player [YangZ] gets hole card ['SJ', 'C7'], current stack 895
player [Finneas] gets hole card ['H3', 'HJ'], current stack 650
Started the round 48
Street "preflop" started. (community card = [])
"Zheng" declared "call:10"
"SichengZuo" declared "fold:0"
"Yuchun" declared "fold:0"
"HakulaPlayer" declared "call:10"
"Ethan" declared "fold:0"
"YangZ" declared "fold:0"
"Finneas" declared "call:10"
Street "flop" started. (community card = ['S2', 'D9', 'D5'])
"Finneas" declared "call:0"
"Zheng" declared "call:0"
"HakulaPlayer" declared "call:0"
Street "turn" started. (community card = ['S2', 'D9', 'D5', 'D3'])
"Finneas" declared "call:0"
"Zheng" declared "call:0"
"HakulaPlayer" declared "call:0"
Street "river" started. (community card = ['S2', 'D9', 'D5', 'D3', 'S9'])
"Finneas" declared "call:0"
"Zheng" declared "call:0"
"HakulaPlayer" declared "call:0"
"['Finneas']" won the round 48 (stack = {'Zheng': 844, 'RaphaelPlayer': 0, 'SichengZuo': 940, 'Yuchun': 865, 'HakulaPlayer': 2395, 'Ethan': 1375, 'YangZ': 895, 'Finneas': 685})
player [Zheng] gets hole card ['H2', 'S3'], current stack 834
player [SichengZuo] gets hole card ['D3', 'C5'], current stack 940
player [Yuchun] gets hole card ['SQ', 'S2'], current stack 865
player [HakulaPlayer] gets hole card ['SA', 'HK'], current stack 2395
player [Ethan] gets hole card ['S9', 'S4'], current stack 1375
player [YangZ] gets hole card ['DK', 'H8'], current stack 895
player [Finneas] gets hole card ['CJ', 'HA'], current stack 680
Started the round 49
Street "preflop" started. (community card = [])
"SichengZuo" declared "fold:0"
"Yuchun" declared "fold:0"
"HakulaPlayer" declared "call:10"
"Ethan" declared "fold:0"
"YangZ" declared "fold:0"
"Finneas" declared "call:10"
"Zheng" declared "call:10"
Street "flop" started. (community card = ['D9', 'C7', 'D4'])
"Finneas" declared "call:0"
"Zheng" declared "call:0"
"HakulaPlayer" declared "call:0"
Street "turn" started. (community card = ['D9', 'C7', 'D4', 'D8'])
"Finneas" declared "call:0"
"Zheng" declared "call:0"
"HakulaPlayer" declared "call:0"
Street "river" started. (community card = ['D9', 'C7', 'D4', 'D8', 'H7'])
"Finneas" declared "call:0"
"Zheng" declared "call:0"
"HakulaPlayer" declared "call:0"
"['HakulaPlayer']" won the round 49 (stack = {'Zheng': 834, 'RaphaelPlayer': 0, 'SichengZuo': 940, 'Yuchun': 865, 'HakulaPlayer': 2415, 'Ethan': 1375, 'YangZ': 895, 'Finneas': 675})
player [Zheng] gets hole card ['C2', 'HJ'], current stack 829
player [SichengZuo] gets hole card ['C9', 'S3'], current stack 930
player [Yuchun] gets hole card ['CA', 'D4'], current stack 865
player [HakulaPlayer] gets hole card ['C5', 'S2'], current stack 2415
player [Ethan] gets hole card ['SQ', 'D8'], current stack 1375
player [YangZ] gets hole card ['CJ', 'HK'], current stack 895
player [Finneas] gets hole card ['CT', 'S8'], current stack 675
Started the round 50
Street "preflop" started. (community card = [])
"Yuchun" declared "fold:0"
"HakulaPlayer" declared "fold:0"
"Ethan" declared "fold:0"
"YangZ" declared "fold:0"
"Finneas" declared "call:10"
"Zheng" declared "call:10"
"SichengZuo" declared "fold:0"
Street "flop" started. (community card = ['CQ', 'H2', 'H6'])
"Zheng" declared "call:0"
"Finneas" declared "call:0"
Street "turn" started. (community card = ['CQ', 'H2', 'H6', 'H5'])
"Zheng" declared "call:0"
"Finneas" declared "call:0"
Street "river" started. (community card = ['CQ', 'H2', 'H6', 'H5', 'D2'])
"Zheng" declared "raise:824"
"Finneas" declared "fold:0"
"['Zheng']" won the round 50 (stack = {'Zheng': 854, 'RaphaelPlayer': 0, 'SichengZuo': 930, 'Yuchun': 865, 'HakulaPlayer': 2415, 'Ethan': 1375, 'YangZ': 895, 'Finneas': 665})

Game Results:
------------------------------------------------------------
Game 1:
Winner: HakulaPlayer (stack: 2415)
All players' stacks:
  Zheng: 854
  RaphaelPlayer: 0
  SichengZuo: 930
  Yuchun: 865
  HakulaPlayer: 2415
  Ethan: 1375
  YangZ: 895
  Finneas: 665
------------------------------------------------------------
