player [Zheng] gets hole card ['D4', 'CQ'], current stack 1000
player [RaphaelPlayer] gets hole card ['S4', 'SA'], current stack 995
player [SichengZuo] gets hole card ['HQ', 'D8'], current stack 990
player [Yuchun] gets hole card ['H8', 'C9'], current stack 1000
player [HakulaPlayer] gets hole card ['S5', 'ST'], current stack 1000
player [Ethan] gets hole card ['D7', 'SQ'], current stack 1000
player [YangZ] gets hole card ['S7', 'H5'], current stack 1000
player [Finneas] gets hole card ['S3', 'DT'], current stack 1000
Started the round 1
Street "preflop" started. (community card = [])
"Yuchun" declared "fold:0"
"HakulaPlayer" declared "fold:0"
"Ethan" declared "fold:0"
"YangZ" declared "fold:0"
"Finneas" declared "call:10"
"Zheng" declared "call:10"
"RaphaelPlayer" declared "call:10"
"SichengZuo" declared "fold:0"
Street "flop" started. (community card = ['SJ', 'H4', 'S8'])
"RaphaelPlayer" declared "call:0"
"Finneas" declared "call:0"
"Zheng" declared "call:0"
Street "turn" started. (community card = ['SJ', 'H4', 'S8', 'CA'])
"RaphaelPlayer" declared "raise:50"
"Finneas" declared "fold:0"
"Zheng" declared "fold:0"
"['RaphaelPlayer']" won the round 1 (stack = {'Zheng': 990, 'RaphaelPlayer': 1030, 'SichengZuo': 990, 'Yuchun': 1000, 'HakulaPlayer': 1000, 'Ethan': 1000, 'YangZ': 1000, 'Finneas': 990})
player [Zheng] gets hole card ['H3', 'H7'], current stack 990
player [RaphaelPlayer] gets hole card ['D4', 'DT'], current stack 1030
player [SichengZuo] gets hole card ['ST', 'DK'], current stack 985
player [Yuchun] gets hole card ['C5', 'D9'], current stack 990
player [HakulaPlayer] gets hole card ['S8', 'D2'], current stack 1000
player [Ethan] gets hole card ['DJ', 'CJ'], current stack 1000
player [YangZ] gets hole card ['C3', 'DA'], current stack 1000
player [Finneas] gets hole card ['C8', 'CT'], current stack 990
Started the round 2
Street "preflop" started. (community card = [])
"HakulaPlayer" declared "fold:0"
"Ethan" declared "raise:150"
"YangZ" declared "fold:0"
"Finneas" declared "fold:0"
"Zheng" declared "fold:0"
"RaphaelPlayer" declared "fold:0"
"SichengZuo" declared "fold:0"
"Yuchun" declared "fold:0"
"['Ethan']" won the round 2 (stack = {'Zheng': 990, 'RaphaelPlayer': 1030, 'SichengZuo': 985, 'Yuchun': 990, 'HakulaPlayer': 1000, 'Ethan': 1015, 'YangZ': 1000, 'Finneas': 990})
player [Zheng] gets hole card ['C2', 'SQ'], current stack 990
player [RaphaelPlayer] gets hole card ['H4', 'H8'], current stack 1030
player [SichengZuo] gets hole card ['D3', 'D6'], current stack 985
player [Yuchun] gets hole card ['C9', 'DA'], current stack 985
player [HakulaPlayer] gets hole card ['CJ', 'S4'], current stack 990
player [Ethan] gets hole card ['ST', 'DT'], current stack 1015
player [YangZ] gets hole card ['C6', 'D2'], current stack 1000
player [Finneas] gets hole card ['SJ', 'HK'], current stack 990
Started the round 3
Street "preflop" started. (community card = [])
"Ethan" declared "raise:152"
"YangZ" declared "fold:0"
"Finneas" declared "fold:0"
"Zheng" declared "fold:0"
"RaphaelPlayer" declared "fold:0"
"SichengZuo" declared "fold:0"
"Yuchun" declared "fold:0"
"HakulaPlayer" declared "fold:0"
"['Ethan']" won the round 3 (stack = {'Zheng': 990, 'RaphaelPlayer': 1030, 'SichengZuo': 985, 'Yuchun': 985, 'HakulaPlayer': 990, 'Ethan': 1030, 'YangZ': 1000, 'Finneas': 990})
player [Zheng] gets hole card ['SQ', 'H6'], current stack 990
player [RaphaelPlayer] gets hole card ['CJ', 'S6'], current stack 1030
player [SichengZuo] gets hole card ['DJ', 'C2'], current stack 985
player [Yuchun] gets hole card ['S9', 'ST'], current stack 985
player [HakulaPlayer] gets hole card ['D6', 'S5'], current stack 985
player [Ethan] gets hole card ['S7', 'D4'], current stack 1020
player [YangZ] gets hole card ['HQ', 'H5'], current stack 1000
player [Finneas] gets hole card ['DA', 'S2'], current stack 990
Started the round 4
Street "preflop" started. (community card = [])
"YangZ" declared "fold:0"
"Finneas" declared "call:10"
"Zheng" declared "call:10"
"RaphaelPlayer" declared "fold:0"
"SichengZuo" declared "fold:0"
"Yuchun" declared "fold:0"
"HakulaPlayer" declared "call:10"
"Ethan" declared "fold:0"
Street "flop" started. (community card = ['D2', 'SA', 'SK'])
"HakulaPlayer" declared "call:0"
"Finneas" declared "call:0"
"Zheng" declared "call:0"
Street "turn" started. (community card = ['D2', 'SA', 'SK', 'D5'])
"HakulaPlayer" declared "call:0"
"Finneas" declared "call:0"
"Zheng" declared "call:0"
Street "river" started. (community card = ['D2', 'SA', 'SK', 'D5', 'S3'])
"HakulaPlayer" declared "call:0"
"Finneas" declared "call:0"
"Zheng" declared "call:0"
"['Finneas']" won the round 4 (stack = {'Zheng': 980, 'RaphaelPlayer': 1030, 'SichengZuo': 985, 'Yuchun': 985, 'HakulaPlayer': 980, 'Ethan': 1020, 'YangZ': 1000, 'Finneas': 1020})
player [Zheng] gets hole card ['H6', 'DK'], current stack 980
player [RaphaelPlayer] gets hole card ['S2', 'SQ'], current stack 1030
player [SichengZuo] gets hole card ['C4', 'C8'], current stack 985
player [Yuchun] gets hole card ['C5', 'S3'], current stack 985
player [HakulaPlayer] gets hole card ['HT', 'DJ'], current stack 980
player [Ethan] gets hole card ['D5', 'DT'], current stack 1015
player [YangZ] gets hole card ['SK', 'DA'], current stack 990
player [Finneas] gets hole card ['H4', 'CJ'], current stack 1020
Started the round 5
Street "preflop" started. (community card = [])
"Finneas" declared "call:10"
"Zheng" declared "call:10"
"RaphaelPlayer" declared "fold:0"
"SichengZuo" declared "fold:0"
"Yuchun" declared "fold:0"
"HakulaPlayer" declared "raise:32"
"Ethan" declared "fold:0"
"YangZ" declared "fold:0"
"Finneas" declared "fold:0"
"Zheng" declared "fold:0"
"['HakulaPlayer']" won the round 5 (stack = {'Zheng': 970, 'RaphaelPlayer': 1030, 'SichengZuo': 985, 'Yuchun': 985, 'HakulaPlayer': 1015, 'Ethan': 1015, 'YangZ': 990, 'Finneas': 1010})
player [Zheng] gets hole card ['CT', 'C7'], current stack 970
player [RaphaelPlayer] gets hole card ['S7', 'SQ'], current stack 1030
player [SichengZuo] gets hole card ['HT', 'H7'], current stack 985
player [Yuchun] gets hole card ['DJ', 'S4'], current stack 985
player [HakulaPlayer] gets hole card ['S9', 'D8'], current stack 1015
player [Ethan] gets hole card ['H8', 'ST'], current stack 1015
player [YangZ] gets hole card ['SA', 'CK'], current stack 985
player [Finneas] gets hole card ['DQ', 'H2'], current stack 1000
Started the round 6
Street "preflop" started. (community card = [])
"Zheng" declared "call:10"
"RaphaelPlayer" declared "call:10"
"SichengZuo" declared "fold:0"
"Yuchun" declared "fold:0"
"HakulaPlayer" declared "call:10"
"Ethan" declared "fold:0"
"YangZ" declared "fold:0"
"Finneas" declared "call:10"
Street "flop" started. (community card = ['S8', 'HA', 'SJ'])
"Finneas" declared "call:0"
"Zheng" declared "call:0"
"RaphaelPlayer" declared "call:0"
"HakulaPlayer" declared "call:0"
Street "turn" started. (community card = ['S8', 'HA', 'SJ', 'CA'])
"Finneas" declared "call:0"
"Zheng" declared "call:0"
"RaphaelPlayer" declared "call:0"
"HakulaPlayer" declared "raise:31"
"Finneas" declared "fold:0"
"Zheng" declared "fold:0"
"RaphaelPlayer" declared "call:31"
Street "river" started. (community card = ['S8', 'HA', 'SJ', 'CA', 'CJ'])
"RaphaelPlayer" declared "raise:117"
"HakulaPlayer" declared "fold:0"
"['RaphaelPlayer']" won the round 6 (stack = {'Zheng': 960, 'RaphaelPlayer': 1096, 'SichengZuo': 985, 'Yuchun': 985, 'HakulaPlayer': 974, 'Ethan': 1015, 'YangZ': 985, 'Finneas': 1000})
player [Zheng] gets hole card ['S4', 'C2'], current stack 950
player [RaphaelPlayer] gets hole card ['H2', 'DK'], current stack 1096
player [SichengZuo] gets hole card ['S6', 'C8'], current stack 985
player [Yuchun] gets hole card ['SJ', 'CQ'], current stack 985
player [HakulaPlayer] gets hole card ['SA', 'S2'], current stack 974
player [Ethan] gets hole card ['DT', 'S3'], current stack 1015
player [YangZ] gets hole card ['H5', 'HT'], current stack 985
player [Finneas] gets hole card ['D7', 'H9'], current stack 995
Started the round 7
Street "preflop" started. (community card = [])
"RaphaelPlayer" declared "fold:0"
"SichengZuo" declared "fold:0"
"Yuchun" declared "fold:0"
"HakulaPlayer" declared "call:10"
"Ethan" declared "fold:0"
"YangZ" declared "fold:0"
"Finneas" declared "call:10"
"Zheng" declared "call:10"
Street "flop" started. (community card = ['ST', 'DQ', 'S9'])
"Finneas" declared "call:0"
"Zheng" declared "call:0"
"HakulaPlayer" declared "call:0"
Street "turn" started. (community card = ['ST', 'DQ', 'S9', 'D9'])
"Finneas" declared "raise:500"
"Zheng" declared "fold:0"
"HakulaPlayer" declared "fold:0"
"['Finneas']" won the round 7 (stack = {'Zheng': 950, 'RaphaelPlayer': 1096, 'SichengZuo': 985, 'Yuchun': 985, 'HakulaPlayer': 964, 'Ethan': 1015, 'YangZ': 985, 'Finneas': 1020})
player [Zheng] gets hole card ['C2', 'H9'], current stack 945
player [RaphaelPlayer] gets hole card ['CT', 'SJ'], current stack 1086
player [SichengZuo] gets hole card ['C4', 'C3'], current stack 985
player [Yuchun] gets hole card ['ST', 'D9'], current stack 985
player [HakulaPlayer] gets hole card ['CJ', 'C7'], current stack 964
player [Ethan] gets hole card ['C6', 'S7'], current stack 1015
player [YangZ] gets hole card ['HK', 'D7'], current stack 985
player [Finneas] gets hole card ['H8', 'S9'], current stack 1020
Started the round 8
Street "preflop" started. (community card = [])
"SichengZuo" declared "fold:0"
"Yuchun" declared "fold:0"
"HakulaPlayer" declared "fold:0"
"Ethan" declared "fold:0"
"YangZ" declared "fold:0"
"Finneas" declared "call:10"
"Zheng" declared "call:10"
"RaphaelPlayer" declared "call:10"
Street "flop" started. (community card = ['D8', 'S8', 'S5'])
"Zheng" declared "call:0"
"RaphaelPlayer" declared "call:0"
"Finneas" declared "raise:510"
"Zheng" declared "fold:0"
"RaphaelPlayer" declared "fold:0"
"['Finneas']" won the round 8 (stack = {'Zheng': 940, 'RaphaelPlayer': 1086, 'SichengZuo': 985, 'Yuchun': 985, 'HakulaPlayer': 964, 'Ethan': 1015, 'YangZ': 985, 'Finneas': 1040})
player [Zheng] gets hole card ['C3', 'D3'], current stack 940
player [RaphaelPlayer] gets hole card ['HJ', 'C2'], current stack 1081
player [SichengZuo] gets hole card ['D8', 'SJ'], current stack 975
player [Yuchun] gets hole card ['DT', 'S7'], current stack 985
player [HakulaPlayer] gets hole card ['SQ', 'DJ'], current stack 964
player [Ethan] gets hole card ['CQ', 'H5'], current stack 1015
player [YangZ] gets hole card ['HK', 'D6'], current stack 985
player [Finneas] gets hole card ['HT', 'S9'], current stack 1040
Started the round 9
Street "preflop" started. (community card = [])
"Yuchun" declared "fold:0"
"HakulaPlayer" declared "call:10"
"Ethan" declared "fold:0"
"YangZ" declared "fold:0"
"Finneas" declared "call:10"
"Zheng" declared "call:10"
"RaphaelPlayer" declared "fold:0"
"SichengZuo" declared "fold:0"
Street "flop" started. (community card = ['S5', 'SK', 'CT'])
"HakulaPlayer" declared "call:0"
"Finneas" declared "call:0"
"Zheng" declared "call:0"
Street "turn" started. (community card = ['S5', 'SK', 'CT', 'SA'])
"HakulaPlayer" declared "raise:57"
"Finneas" declared "fold:0"
"Zheng" declared "fold:0"
"['HakulaPlayer']" won the round 9 (stack = {'Zheng': 930, 'RaphaelPlayer': 1081, 'SichengZuo': 975, 'Yuchun': 985, 'HakulaPlayer': 999, 'Ethan': 1015, 'YangZ': 985, 'Finneas': 1030})
player [Zheng] gets hole card ['CT', 'H5'], current stack 930
player [RaphaelPlayer] gets hole card ['D4', 'C3'], current stack 1081
player [SichengZuo] gets hole card ['D7', 'CQ'], current stack 970
player [Yuchun] gets hole card ['S8', 'HT'], current stack 975
player [HakulaPlayer] gets hole card ['C2', 'S6'], current stack 999
player [Ethan] gets hole card ['CK', 'HJ'], current stack 1015
player [YangZ] gets hole card ['SK', 'H8'], current stack 985
player [Finneas] gets hole card ['DA', 'D6'], current stack 1030
Started the round 10
Street "preflop" started. (community card = [])
"HakulaPlayer" declared "raise:27"
"Ethan" declared "raise:152"
"YangZ" declared "fold:0"
"Finneas" declared "fold:0"
"Zheng" declared "fold:0"
"RaphaelPlayer" declared "fold:0"
"SichengZuo" declared "fold:0"
"Yuchun" declared "call:152"
"HakulaPlayer" declared "fold:0"
Street "flop" started. (community card = ['C8', 'S5', 'D3'])
"Yuchun" declared "call:0"
"Ethan" declared "call:0"
Street "turn" started. (community card = ['C8', 'S5', 'D3', 'HK'])
"Yuchun" declared "call:0"
"Ethan" declared "raise:86"
"Yuchun" declared "call:86"
Street "river" started. (community card = ['C8', 'S5', 'D3', 'HK', 'C7'])
"Yuchun" declared "call:0"
"Ethan" declared "call:0"
"['Ethan']" won the round 10 (stack = {'Zheng': 930, 'RaphaelPlayer': 1081, 'SichengZuo': 970, 'Yuchun': 747, 'HakulaPlayer': 972, 'Ethan': 1285, 'YangZ': 985, 'Finneas': 1030})
player [Zheng] gets hole card ['DK', 'C6'], current stack 930
player [RaphaelPlayer] gets hole card ['SJ', 'H6'], current stack 1081
player [SichengZuo] gets hole card ['HK', 'S4'], current stack 970
player [Yuchun] gets hole card ['S7', 'HA'], current stack 742
player [HakulaPlayer] gets hole card ['DQ', 'H4'], current stack 962
player [Ethan] gets hole card ['C9', 'SQ'], current stack 1285
player [YangZ] gets hole card ['HT', 'D9'], current stack 985
player [Finneas] gets hole card ['S6', 'S9'], current stack 1030
Started the round 11
Street "preflop" started. (community card = [])
"Ethan" declared "fold:0"
"YangZ" declared "fold:0"
"Finneas" declared "call:10"
"Zheng" declared "call:10"
"RaphaelPlayer" declared "fold:0"
"SichengZuo" declared "fold:0"
"Yuchun" declared "call:10"
"HakulaPlayer" declared "call:10"
Street "flop" started. (community card = ['D7', 'C3', 'S5'])
"Yuchun" declared "call:0"
"HakulaPlayer" declared "call:0"
"Finneas" declared "call:0"
"Zheng" declared "call:0"
Street "turn" started. (community card = ['D7', 'C3', 'S5', 'H5'])
"Yuchun" declared "call:0"
"HakulaPlayer" declared "call:0"
"Finneas" declared "call:0"
"Zheng" declared "call:0"
Street "river" started. (community card = ['D7', 'C3', 'S5', 'H5', 'H7'])
"Yuchun" declared "raise:737"
"HakulaPlayer" declared "fold:0"
"Finneas" declared "fold:0"
"Zheng" declared "fold:0"
"['Yuchun']" won the round 11 (stack = {'Zheng': 920, 'RaphaelPlayer': 1081, 'SichengZuo': 970, 'Yuchun': 777, 'HakulaPlayer': 962, 'Ethan': 1285, 'YangZ': 985, 'Finneas': 1020})
player [Zheng] gets hole card ['CT', 'D3'], current stack 920
player [RaphaelPlayer] gets hole card ['D4', 'D6'], current stack 1081
player [SichengZuo] gets hole card ['DA', 'D5'], current stack 970
player [Yuchun] gets hole card ['H9', 'H6'], current stack 777
player [HakulaPlayer] gets hole card ['C3', 'C5'], current stack 957
player [Ethan] gets hole card ['HQ', 'C8'], current stack 1275
player [YangZ] gets hole card ['HA', 'HJ'], current stack 985
player [Finneas] gets hole card ['H5', 'DQ'], current stack 1020
Started the round 12
Street "preflop" started. (community card = [])
"YangZ" declared "fold:0"
"Finneas" declared "call:10"
"Zheng" declared "call:10"
"RaphaelPlayer" declared "fold:0"
"SichengZuo" declared "fold:0"
"Yuchun" declared "call:10"
"HakulaPlayer" declared "call:10"
"Ethan" declared "fold:0"
Street "flop" started. (community card = ['D8', 'H4', 'SK'])
"HakulaPlayer" declared "call:0"
"Finneas" declared "call:0"
"Zheng" declared "call:0"
"Yuchun" declared "call:0"
Street "turn" started. (community card = ['D8', 'H4', 'SK', 'S6'])
"HakulaPlayer" declared "call:0"
"Finneas" declared "call:0"
"Zheng" declared "call:0"
"Yuchun" declared "call:0"
Street "river" started. (community card = ['D8', 'H4', 'SK', 'S6', 'SQ'])
"HakulaPlayer" declared "call:0"
"Finneas" declared "call:0"
"Zheng" declared "call:0"
"Yuchun" declared "call:0"
"['Finneas']" won the round 12 (stack = {'Zheng': 910, 'RaphaelPlayer': 1081, 'SichengZuo': 970, 'Yuchun': 767, 'HakulaPlayer': 952, 'Ethan': 1275, 'YangZ': 985, 'Finneas': 1060})
player [Zheng] gets hole card ['HK', 'H2'], current stack 910
player [RaphaelPlayer] gets hole card ['CT', 'HJ'], current stack 1081
player [SichengZuo] gets hole card ['D3', 'DJ'], current stack 970
player [Yuchun] gets hole card ['D4', 'H6'], current stack 767
player [HakulaPlayer] gets hole card ['H3', 'H5'], current stack 952
player [Ethan] gets hole card ['S6', 'H7'], current stack 1270
player [YangZ] gets hole card ['S2', 'D7'], current stack 975
player [Finneas] gets hole card ['D6', 'D5'], current stack 1060
Started the round 13
Street "preflop" started. (community card = [])
"Finneas" declared "call:10"
"Zheng" declared "call:10"
"RaphaelPlayer" declared "call:10"
"SichengZuo" declared "fold:0"
"Yuchun" declared "call:10"
"HakulaPlayer" declared "call:10"
"Ethan" declared "fold:0"
"YangZ" declared "fold:0"
Street "flop" started. (community card = ['S7', 'HA', 'SJ'])
"Finneas" declared "call:0"
"Zheng" declared "call:0"
"RaphaelPlayer" declared "call:0"
"Yuchun" declared "call:0"
"HakulaPlayer" declared "call:0"
Street "turn" started. (community card = ['S7', 'HA', 'SJ', 'DQ'])
"Finneas" declared "call:0"
"Zheng" declared "call:0"
"RaphaelPlayer" declared "call:0"
"Yuchun" declared "call:0"
"HakulaPlayer" declared "call:0"
Street "river" started. (community card = ['S7', 'HA', 'SJ', 'DQ', 'C7'])
"Finneas" declared "call:0"
"Zheng" declared "call:0"
"RaphaelPlayer" declared "call:0"
"Yuchun" declared "call:0"
"HakulaPlayer" declared "call:0"
"['RaphaelPlayer']" won the round 13 (stack = {'Zheng': 900, 'RaphaelPlayer': 1136, 'SichengZuo': 970, 'Yuchun': 757, 'HakulaPlayer': 942, 'Ethan': 1270, 'YangZ': 975, 'Finneas': 1050})
player [Zheng] gets hole card ['ST', 'CA'], current stack 900
player [RaphaelPlayer] gets hole card ['H7', 'S4'], current stack 1136
player [SichengZuo] gets hole card ['HJ', 'HA'], current stack 970
player [Yuchun] gets hole card ['CT', 'H3'], current stack 757
player [HakulaPlayer] gets hole card ['H5', 'D9'], current stack 942
player [Ethan] gets hole card ['DA', 'H6'], current stack 1270
player [YangZ] gets hole card ['S8', 'D8'], current stack 970
player [Finneas] gets hole card ['CQ', 'SA'], current stack 1040
Started the round 14
Street "preflop" started. (community card = [])
"Zheng" declared "call:10"
"RaphaelPlayer" declared "fold:0"
"SichengZuo" declared "fold:0"
"Yuchun" declared "call:10"
"HakulaPlayer" declared "call:10"
"Ethan" declared "fold:0"
"YangZ" declared "fold:0"
"Finneas" declared "raise:532"
"Zheng" declared "fold:0"
"Yuchun" declared "fold:0"
"HakulaPlayer" declared "fold:0"
"['Finneas']" won the round 14 (stack = {'Zheng': 890, 'RaphaelPlayer': 1136, 'SichengZuo': 970, 'Yuchun': 747, 'HakulaPlayer': 932, 'Ethan': 1270, 'YangZ': 970, 'Finneas': 1085})
player [Zheng] gets hole card ['D3', 'D4'], current stack 880
player [RaphaelPlayer] gets hole card ['C2', 'H3'], current stack 1136
player [SichengZuo] gets hole card ['ST', 'C4'], current stack 970
player [Yuchun] gets hole card ['DA', 'C6'], current stack 747
player [HakulaPlayer] gets hole card ['C3', 'S4'], current stack 932
player [Ethan] gets hole card ['CT', 'CJ'], current stack 1270
player [YangZ] gets hole card ['HT', 'H5'], current stack 970
player [Finneas] gets hole card ['S8', 'D6'], current stack 1080
Started the round 15
Street "preflop" started. (community card = [])
"RaphaelPlayer" declared "fold:0"
"SichengZuo" declared "fold:0"
"Yuchun" declared "call:10"
"HakulaPlayer" declared "fold:0"
"Ethan" declared "call:10"
"YangZ" declared "fold:0"
"Finneas" declared "call:10"
"Zheng" declared "call:10"
Street "flop" started. (community card = ['C7', 'SQ', 'DT'])
"Finneas" declared "call:0"
"Zheng" declared "call:0"
"Yuchun" declared "call:0"
"Ethan" declared "call:0"
Street "turn" started. (community card = ['C7', 'SQ', 'DT', 'D2'])
"Finneas" declared "call:0"
"Zheng" declared "call:0"
"Yuchun" declared "call:0"
"Ethan" declared "call:0"
Street "river" started. (community card = ['C7', 'SQ', 'DT', 'D2', 'HJ'])
"Finneas" declared "call:0"
"Zheng" declared "call:0"
"Yuchun" declared "call:0"
"Ethan" declared "call:0"
"['Ethan']" won the round 15 (stack = {'Zheng': 880, 'RaphaelPlayer': 1136, 'SichengZuo': 970, 'Yuchun': 737, 'HakulaPlayer': 932, 'Ethan': 1300, 'YangZ': 970, 'Finneas': 1075})
player [Zheng] gets hole card ['D5', 'C8'], current stack 875
player [RaphaelPlayer] gets hole card ['S4', 'D6'], current stack 1126
player [SichengZuo] gets hole card ['H5', 'S6'], current stack 970
player [Yuchun] gets hole card ['S7', 'SJ'], current stack 737
player [HakulaPlayer] gets hole card ['S5', 'ST'], current stack 932
player [Ethan] gets hole card ['S8', 'DA'], current stack 1300
player [YangZ] gets hole card ['C5', 'D2'], current stack 970
player [Finneas] gets hole card ['HT', 'SQ'], current stack 1075
Started the round 16
Street "preflop" started. (community card = [])
"SichengZuo" declared "fold:0"
"Yuchun" declared "call:10"
"HakulaPlayer" declared "call:10"
"Ethan" declared "fold:0"
"YangZ" declared "fold:0"
"Finneas" declared "call:10"
"Zheng" declared "call:10"
"RaphaelPlayer" declared "fold:0"
Street "flop" started. (community card = ['DT', 'HK', 'CJ'])
"Zheng" declared "call:0"
"Yuchun" declared "call:0"
"HakulaPlayer" declared "call:0"
"Finneas" declared "call:0"
Street "turn" started. (community card = ['DT', 'HK', 'CJ', 'HQ'])
"Zheng" declared "call:0"
"Yuchun" declared "call:0"
"HakulaPlayer" declared "call:0"
"Finneas" declared "call:0"
Street "river" started. (community card = ['DT', 'HK', 'CJ', 'HQ', 'H6'])
"Zheng" declared "call:0"
"Yuchun" declared "call:0"
"HakulaPlayer" declared "call:0"
"Finneas" declared "call:0"
"['Finneas']" won the round 16 (stack = {'Zheng': 870, 'RaphaelPlayer': 1126, 'SichengZuo': 970, 'Yuchun': 727, 'HakulaPlayer': 922, 'Ethan': 1300, 'YangZ': 970, 'Finneas': 1115})
player [Zheng] gets hole card ['S5', 'S9'], current stack 870
player [RaphaelPlayer] gets hole card ['H3', 'CA'], current stack 1121
player [SichengZuo] gets hole card ['DT', 'H7'], current stack 960
player [Yuchun] gets hole card ['C7', 'S8'], current stack 727
player [HakulaPlayer] gets hole card ['H6', 'C5'], current stack 922
player [Ethan] gets hole card ['S7', 'H4'], current stack 1300
player [YangZ] gets hole card ['CQ', 'D7'], current stack 970
player [Finneas] gets hole card ['H9', 'S6'], current stack 1115
Started the round 17
Street "preflop" started. (community card = [])
"Yuchun" declared "call:10"
"HakulaPlayer" declared "call:10"
"Ethan" declared "fold:0"
"YangZ" declared "fold:0"
"Finneas" declared "call:10"
"Zheng" declared "call:10"
"RaphaelPlayer" declared "call:10"
"SichengZuo" declared "fold:0"
Street "flop" started. (community card = ['D2', 'HQ', 'ST'])
"RaphaelPlayer" declared "call:0"
"Yuchun" declared "call:0"
"HakulaPlayer" declared "raise:18"
"Finneas" declared "call:18"
"Zheng" declared "fold:0"
"RaphaelPlayer" declared "fold:0"
"Yuchun" declared "fold:0"
Street "turn" started. (community card = ['D2', 'HQ', 'ST', 'HT'])
"HakulaPlayer" declared "call:0"
"Finneas" declared "call:0"
Street "river" started. (community card = ['D2', 'HQ', 'ST', 'HT', 'S2'])
"HakulaPlayer" declared "call:0"
"Finneas" declared "call:0"
"['HakulaPlayer', 'Finneas']" won the round 17 (stack = {'Zheng': 860, 'RaphaelPlayer': 1116, 'SichengZuo': 960, 'Yuchun': 717, 'HakulaPlayer': 942, 'Ethan': 1300, 'YangZ': 970, 'Finneas': 1135})
player [Zheng] gets hole card ['ST', 'HT'], current stack 860
player [RaphaelPlayer] gets hole card ['D4', 'HA'], current stack 1116
player [SichengZuo] gets hole card ['D6', 'DA'], current stack 955
player [Yuchun] gets hole card ['D9', 'D7'], current stack 707
player [HakulaPlayer] gets hole card ['DQ', 'C4'], current stack 942
player [Ethan] gets hole card ['C8', 'H6'], current stack 1300
player [YangZ] gets hole card ['H7', 'CJ'], current stack 970
player [Finneas] gets hole card ['D2', 'C6'], current stack 1135
Started the round 18
Street "preflop" started. (community card = [])
"HakulaPlayer" declared "fold:0"
"Ethan" declared "fold:0"
"YangZ" declared "fold:0"
"Finneas" declared "call:10"
"Zheng" declared "call:10"
"RaphaelPlayer" declared "call:10"
"SichengZuo" declared "fold:0"
"Yuchun" declared "call:10"
Street "flop" started. (community card = ['H4', 'DK', 'CT'])
"Yuchun" declared "call:0"
"Finneas" declared "call:0"
"Zheng" declared "raise:850"
"RaphaelPlayer" declared "fold:0"
"Yuchun" declared "fold:0"
"Finneas" declared "fold:0"
"['Zheng']" won the round 18 (stack = {'Zheng': 895, 'RaphaelPlayer': 1106, 'SichengZuo': 955, 'Yuchun': 707, 'HakulaPlayer': 942, 'Ethan': 1300, 'YangZ': 970, 'Finneas': 1125})
player [Zheng] gets hole card ['S5', 'C6'], current stack 895
player [RaphaelPlayer] gets hole card ['HJ', 'CT'], current stack 1106
player [SichengZuo] gets hole card ['S3', 'S4'], current stack 955
player [Yuchun] gets hole card ['D4', 'D9'], current stack 702
player [HakulaPlayer] gets hole card ['H6', 'CQ'], current stack 932
player [Ethan] gets hole card ['S7', 'C9'], current stack 1300
player [YangZ] gets hole card ['H8', 'H4'], current stack 970
player [Finneas] gets hole card ['H9', 'D5'], current stack 1125
Started the round 19
Street "preflop" started. (community card = [])
"Ethan" declared "fold:0"
"YangZ" declared "fold:0"
"Finneas" declared "call:10"
"Zheng" declared "call:10"
"RaphaelPlayer" declared "call:10"
"SichengZuo" declared "fold:0"
"Yuchun" declared "call:10"
"HakulaPlayer" declared "call:10"
Street "flop" started. (community card = ['SQ', 'HK', 'DT'])
"Yuchun" declared "call:0"
"HakulaPlayer" declared "call:0"
"Finneas" declared "call:0"
"Zheng" declared "call:0"
"RaphaelPlayer" declared "call:0"
Street "turn" started. (community card = ['SQ', 'HK', 'DT', 'H2'])
"Yuchun" declared "call:0"
"HakulaPlayer" declared "call:0"
"Finneas" declared "call:0"
"Zheng" declared "call:0"
"RaphaelPlayer" declared "call:0"
Street "river" started. (community card = ['SQ', 'HK', 'DT', 'H2', 'D6'])
"Yuchun" declared "call:0"
"HakulaPlayer" declared "raise:77"
"Finneas" declared "fold:0"
"Zheng" declared "fold:0"
"RaphaelPlayer" declared "call:77"
"Yuchun" declared "fold:0"
"['HakulaPlayer']" won the round 19 (stack = {'Zheng': 885, 'RaphaelPlayer': 1019, 'SichengZuo': 955, 'Yuchun': 697, 'HakulaPlayer': 1059, 'Ethan': 1300, 'YangZ': 970, 'Finneas': 1115})
player [Zheng] gets hole card ['C6', 'C3'], current stack 885
player [RaphaelPlayer] gets hole card ['S8', 'S5'], current stack 1019
player [SichengZuo] gets hole card ['HQ', 'SK'], current stack 955
player [Yuchun] gets hole card ['S9', 'ST'], current stack 697
player [HakulaPlayer] gets hole card ['S4', 'D6'], current stack 1054
player [Ethan] gets hole card ['C4', 'DT'], current stack 1290
player [YangZ] gets hole card ['H6', 'C7'], current stack 970
player [Finneas] gets hole card ['D8', 'H4'], current stack 1115
Started the round 20
Street "preflop" started. (community card = [])
"YangZ" declared "fold:0"
"Finneas" declared "call:10"
"Zheng" declared "call:10"
"RaphaelPlayer" declared "fold:0"
"SichengZuo" declared "fold:0"
"Yuchun" declared "call:10"
"HakulaPlayer" declared "call:10"
"Ethan" declared "fold:0"
Street "flop" started. (community card = ['DK', 'D5', 'SA'])
"HakulaPlayer" declared "call:0"
"Finneas" declared "call:0"
"Zheng" declared "call:0"
"Yuchun" declared "call:0"
Street "turn" started. (community card = ['DK', 'D5', 'SA', 'HK'])
"HakulaPlayer" declared "call:0"
"Finneas" declared "call:0"
"Zheng" declared "call:0"
"Yuchun" declared "call:0"
Street "river" started. (community card = ['DK', 'D5', 'SA', 'HK', 'S3'])
"HakulaPlayer" declared "call:0"
"Finneas" declared "call:0"
"Zheng" declared "call:0"
"Yuchun" declared "call:0"
"['Zheng']" won the round 20 (stack = {'Zheng': 925, 'RaphaelPlayer': 1019, 'SichengZuo': 955, 'Yuchun': 687, 'HakulaPlayer': 1049, 'Ethan': 1290, 'YangZ': 970, 'Finneas': 1105})
player [Zheng] gets hole card ['H4', 'S6'], current stack 925
player [RaphaelPlayer] gets hole card ['DJ', 'H7'], current stack 1019
player [SichengZuo] gets hole card ['CQ', 'C7'], current stack 955
player [Yuchun] gets hole card ['D5', 'C3'], current stack 687
player [HakulaPlayer] gets hole card ['DT', 'C2'], current stack 1049
player [Ethan] gets hole card ['H6', 'HJ'], current stack 1285
player [YangZ] gets hole card ['D9', 'HK'], current stack 960
player [Finneas] gets hole card ['D4', 'S9'], current stack 1105
Started the round 21
Street "preflop" started. (community card = [])
"Finneas" declared "call:10"
"Zheng" declared "call:10"
"RaphaelPlayer" declared "fold:0"
"SichengZuo" declared "fold:0"
"Yuchun" declared "call:10"
"HakulaPlayer" declared "call:10"
"Ethan" declared "fold:0"
"YangZ" declared "fold:0"
Street "flop" started. (community card = ['S5', 'SK', 'HA'])
"Finneas" declared "call:0"
"Zheng" declared "call:0"
"Yuchun" declared "call:0"
"HakulaPlayer" declared "call:0"
Street "turn" started. (community card = ['S5', 'SK', 'HA', 'D7'])
"Finneas" declared "call:0"
"Zheng" declared "call:0"
"Yuchun" declared "call:0"
"HakulaPlayer" declared "call:0"
Street "river" started. (community card = ['S5', 'SK', 'HA', 'D7', 'C6'])
"Finneas" declared "call:0"
"Zheng" declared "call:0"
"Yuchun" declared "call:0"
"HakulaPlayer" declared "call:0"
"['Zheng']" won the round 21 (stack = {'Zheng': 970, 'RaphaelPlayer': 1019, 'SichengZuo': 955, 'Yuchun': 677, 'HakulaPlayer': 1039, 'Ethan': 1285, 'YangZ': 960, 'Finneas': 1095})
player [Zheng] gets hole card ['DA', 'S5'], current stack 970
player [RaphaelPlayer] gets hole card ['S4', 'C8'], current stack 1019
player [SichengZuo] gets hole card ['C9', 'D7'], current stack 955
player [Yuchun] gets hole card ['C7', 'SK'], current stack 677
player [HakulaPlayer] gets hole card ['D6', 'D9'], current stack 1039
player [Ethan] gets hole card ['HA', 'H4'], current stack 1285
player [YangZ] gets hole card ['H3', 'C5'], current stack 955
player [Finneas] gets hole card ['D5', 'SJ'], current stack 1085
Started the round 22
Street "preflop" started. (community card = [])
"Zheng" declared "call:10"
"RaphaelPlayer" declared "fold:0"
"SichengZuo" declared "fold:0"
"Yuchun" declared "call:10"
"HakulaPlayer" declared "call:10"
"Ethan" declared "fold:0"
"YangZ" declared "fold:0"
"Finneas" declared "call:10"
Street "flop" started. (community card = ['SQ', 'ST', 'CK'])
"Finneas" declared "call:0"
"Zheng" declared "call:0"
"Yuchun" declared "call:0"
"HakulaPlayer" declared "call:0"
Street "turn" started. (community card = ['SQ', 'ST', 'CK', 'S8'])
"Finneas" declared "call:0"
"Zheng" declared "call:0"
"Yuchun" declared "call:0"
"HakulaPlayer" declared "call:0"
Street "river" started. (community card = ['SQ', 'ST', 'CK', 'S8', 'D3'])
"Finneas" declared "call:0"
"Zheng" declared "call:0"
"Yuchun" declared "call:0"
"HakulaPlayer" declared "call:0"
"['Yuchun']" won the round 22 (stack = {'Zheng': 960, 'RaphaelPlayer': 1019, 'SichengZuo': 955, 'Yuchun': 712, 'HakulaPlayer': 1029, 'Ethan': 1285, 'YangZ': 955, 'Finneas': 1085})
player [Zheng] gets hole card ['DQ', 'SA'], current stack 950
player [RaphaelPlayer] gets hole card ['DJ', 'S2'], current stack 1019
player [SichengZuo] gets hole card ['HQ', 'H9'], current stack 955
player [Yuchun] gets hole card ['DK', 'D6'], current stack 712
player [HakulaPlayer] gets hole card ['C8', 'D4'], current stack 1029
player [Ethan] gets hole card ['CQ', 'S8'], current stack 1285
player [YangZ] gets hole card ['H8', 'HT'], current stack 955
player [Finneas] gets hole card ['H4', 'HJ'], current stack 1080
Started the round 23
Street "preflop" started. (community card = [])
"RaphaelPlayer" declared "fold:0"
"SichengZuo" declared "fold:0"
"Yuchun" declared "call:10"
"HakulaPlayer" declared "call:10"
"Ethan" declared "fold:0"
"YangZ" declared "fold:0"
"Finneas" declared "call:10"
"Zheng" declared "call:10"
Street "flop" started. (community card = ['H5', 'S3', 'H7'])
"Finneas" declared "call:0"
"Zheng" declared "call:0"
"Yuchun" declared "call:0"
"HakulaPlayer" declared "call:0"
Street "turn" started. (community card = ['H5', 'S3', 'H7', 'SJ'])
"Finneas" declared "call:0"
"Zheng" declared "call:0"
"Yuchun" declared "call:0"
"HakulaPlayer" declared "call:0"
Street "river" started. (community card = ['H5', 'S3', 'H7', 'SJ', 'H2'])
"Finneas" declared "raise:542"
"Zheng" declared "fold:0"
"Yuchun" declared "fold:0"
"HakulaPlayer" declared "fold:0"
"['Finneas']" won the round 23 (stack = {'Zheng': 950, 'RaphaelPlayer': 1019, 'SichengZuo': 955, 'Yuchun': 702, 'HakulaPlayer': 1019, 'Ethan': 1285, 'YangZ': 955, 'Finneas': 1115})
player [Zheng] gets hole card ['C9', 'D7'], current stack 945
player [RaphaelPlayer] gets hole card ['H5', 'C6'], current stack 1009
player [SichengZuo] gets hole card ['HQ', 'ST'], current stack 955
player [Yuchun] gets hole card ['D8', 'H6'], current stack 702
player [HakulaPlayer] gets hole card ['CT', 'DA'], current stack 1019
player [Ethan] gets hole card ['D4', 'DT'], current stack 1285
player [YangZ] gets hole card ['C8', 'D3'], current stack 955
player [Finneas] gets hole card ['S5', 'C5'], current stack 1115
Started the round 24
Street "preflop" started. (community card = [])
"SichengZuo" declared "fold:0"
"Yuchun" declared "call:10"
"HakulaPlayer" declared "call:10"
"Ethan" declared "fold:0"
"YangZ" declared "fold:0"
"Finneas" declared "call:10"
"Zheng" declared "call:10"
"RaphaelPlayer" declared "fold:0"
Street "flop" started. (community card = ['C4', 'CK', 'DK'])
"Zheng" declared "call:0"
"Yuchun" declared "call:0"
"HakulaPlayer" declared "call:0"
"Finneas" declared "call:0"
Street "turn" started. (community card = ['C4', 'CK', 'DK', 'D5'])
"Zheng" declared "call:0"
"Yuchun" declared "call:0"
"HakulaPlayer" declared "call:0"
"Finneas" declared "raise:557"
"Zheng" declared "fold:0"
"Yuchun" declared "fold:0"
"HakulaPlayer" declared "fold:0"
"['Finneas']" won the round 24 (stack = {'Zheng': 940, 'RaphaelPlayer': 1009, 'SichengZuo': 955, 'Yuchun': 692, 'HakulaPlayer': 1009, 'Ethan': 1285, 'YangZ': 955, 'Finneas': 1155})
player [Zheng] gets hole card ['S7', 'S6'], current stack 940
player [RaphaelPlayer] gets hole card ['C6', 'S4'], current stack 1004
player [SichengZuo] gets hole card ['S9', 'D2'], current stack 945
player [Yuchun] gets hole card ['D7', 'H6'], current stack 692
player [HakulaPlayer] gets hole card ['C2', 'D5'], current stack 1009
player [Ethan] gets hole card ['DA', 'HA'], current stack 1285
player [YangZ] gets hole card ['ST', 'D9'], current stack 955
player [Finneas] gets hole card ['S5', 'DQ'], current stack 1155
Started the round 25
Street "preflop" started. (community card = [])
"Yuchun" declared "call:10"
"HakulaPlayer" declared "fold:0"
"Ethan" declared "raise:385"
"YangZ" declared "fold:0"
"Finneas" declared "fold:0"
"Zheng" declared "fold:0"
"RaphaelPlayer" declared "fold:0"
"SichengZuo" declared "fold:0"
"Yuchun" declared "fold:0"
"['Ethan']" won the round 25 (stack = {'Zheng': 940, 'RaphaelPlayer': 1004, 'SichengZuo': 945, 'Yuchun': 682, 'HakulaPlayer': 1009, 'Ethan': 1310, 'YangZ': 955, 'Finneas': 1155})
player [Zheng] gets hole card ['D7', 'DK'], current stack 940
player [RaphaelPlayer] gets hole card ['C5', 'D8'], current stack 1004
player [SichengZuo] gets hole card ['C6', 'H8'], current stack 940
player [Yuchun] gets hole card ['HJ', 'H9'], current stack 672
player [HakulaPlayer] gets hole card ['HA', 'DJ'], current stack 1009
player [Ethan] gets hole card ['S6', 'DQ'], current stack 1310
player [YangZ] gets hole card ['C4', 'CK'], current stack 955
player [Finneas] gets hole card ['D6', 'CJ'], current stack 1155
Started the round 26
Street "preflop" started. (community card = [])
"HakulaPlayer" declared "call:10"
"Ethan" declared "fold:0"
"YangZ" declared "fold:0"
"Finneas" declared "call:10"
"Zheng" declared "call:10"
"RaphaelPlayer" declared "fold:0"
"SichengZuo" declared "fold:0"
"Yuchun" declared "call:10"
Street "flop" started. (community card = ['HT', 'S4', 'S5'])
"Yuchun" declared "call:0"
"HakulaPlayer" declared "call:0"
"Finneas" declared "call:0"
"Zheng" declared "call:0"
Street "turn" started. (community card = ['HT', 'S4', 'S5', 'C9'])
"Yuchun" declared "call:0"
"HakulaPlayer" declared "call:0"
"Finneas" declared "call:0"
"Zheng" declared "call:0"
Street "river" started. (community card = ['HT', 'S4', 'S5', 'C9', 'HQ'])
"Yuchun" declared "call:0"
"HakulaPlayer" declared "call:0"
"Finneas" declared "call:0"
"Zheng" declared "call:0"
"['Yuchun']" won the round 26 (stack = {'Zheng': 930, 'RaphaelPlayer': 1004, 'SichengZuo': 940, 'Yuchun': 717, 'HakulaPlayer': 999, 'Ethan': 1310, 'YangZ': 955, 'Finneas': 1145})
player [Zheng] gets hole card ['SA', 'D9'], current stack 930
player [RaphaelPlayer] gets hole card ['H2', 'SQ'], current stack 1004
player [SichengZuo] gets hole card ['DK', 'DA'], current stack 940
player [Yuchun] gets hole card ['S9', 'H4'], current stack 712
player [HakulaPlayer] gets hole card ['H9', 'DQ'], current stack 989
player [Ethan] gets hole card ['C6', 'C2'], current stack 1310
player [YangZ] gets hole card ['SJ', 'DJ'], current stack 955
player [Finneas] gets hole card ['D3', 'C8'], current stack 1145
Started the round 27
Street "preflop" started. (community card = [])
"Ethan" declared "fold:0"
"YangZ" declared "fold:0"
"Finneas" declared "call:10"
"Zheng" declared "call:10"
"RaphaelPlayer" declared "fold:0"
"SichengZuo" declared "fold:0"
"Yuchun" declared "call:10"
"HakulaPlayer" declared "call:10"
Street "flop" started. (community card = ['HK', 'HQ', 'D8'])
"Yuchun" declared "call:0"
"HakulaPlayer" declared "call:0"
"Finneas" declared "call:0"
"Zheng" declared "call:0"
Street "turn" started. (community card = ['HK', 'HQ', 'D8', 'C3'])
"Yuchun" declared "call:0"
"HakulaPlayer" declared "call:0"
"Finneas" declared "call:0"
"Zheng" declared "call:0"
Street "river" started. (community card = ['HK', 'HQ', 'D8', 'C3', 'CJ'])
"Yuchun" declared "call:0"
"HakulaPlayer" declared "call:0"
"Finneas" declared "call:0"
"Zheng" declared "call:0"
"['Finneas']" won the round 27 (stack = {'Zheng': 920, 'RaphaelPlayer': 1004, 'SichengZuo': 940, 'Yuchun': 707, 'HakulaPlayer': 989, 'Ethan': 1310, 'YangZ': 955, 'Finneas': 1175})
player [Zheng] gets hole card ['DA', 'D9'], current stack 920
player [RaphaelPlayer] gets hole card ['D8', 'D6'], current stack 1004
player [SichengZuo] gets hole card ['S6', 'H4'], current stack 940
player [Yuchun] gets hole card ['CT', 'C3'], current stack 707
player [HakulaPlayer] gets hole card ['H8', 'HT'], current stack 984
player [Ethan] gets hole card ['S8', 'DQ'], current stack 1300
player [YangZ] gets hole card ['C2', 'H6'], current stack 955
player [Finneas] gets hole card ['D7', 'CQ'], current stack 1175
Started the round 28
Street "preflop" started. (community card = [])
"YangZ" declared "fold:0"
"Finneas" declared "call:10"
"Zheng" declared "call:10"
"RaphaelPlayer" declared "fold:0"
"SichengZuo" declared "fold:0"
"Yuchun" declared "call:10"
"HakulaPlayer" declared "call:10"
"Ethan" declared "fold:0"
Street "flop" started. (community card = ['D5', 'C8', 'C5'])
"HakulaPlayer" declared "call:0"
"Finneas" declared "call:0"
"Zheng" declared "call:0"
"Yuchun" declared "call:0"
Street "turn" started. (community card = ['D5', 'C8', 'C5', 'C4'])
"HakulaPlayer" declared "call:0"
"Finneas" declared "call:0"
"Zheng" declared "call:0"
"Yuchun" declared "raise:40"
"HakulaPlayer" declared "fold:0"
"Finneas" declared "fold:0"
"Zheng" declared "call:40"
Street "river" started. (community card = ['D5', 'C8', 'C5', 'C4', 'H2'])
"Zheng" declared "call:0"
"Yuchun" declared "raise:657"
"Zheng" declared "fold:0"
"['Yuchun']" won the round 28 (stack = {'Zheng': 870, 'RaphaelPlayer': 1004, 'SichengZuo': 940, 'Yuchun': 787, 'HakulaPlayer': 979, 'Ethan': 1300, 'YangZ': 955, 'Finneas': 1165})
player [Zheng] gets hole card ['CT', 'DK'], current stack 870
player [RaphaelPlayer] gets hole card ['C7', 'SQ'], current stack 1004
player [SichengZuo] gets hole card ['SA', 'HK'], current stack 940
player [Yuchun] gets hole card ['CQ', 'H2'], current stack 787
player [HakulaPlayer] gets hole card ['D9', 'D8'], current stack 979
player [Ethan] gets hole card ['C9', 'DA'], current stack 1295
player [YangZ] gets hole card ['DT', 'D2'], current stack 945
player [Finneas] gets hole card ['HT', 'DQ'], current stack 1165
Started the round 29
Street "preflop" started. (community card = [])
"Finneas" declared "call:10"
"Zheng" declared "call:10"
"RaphaelPlayer" declared "fold:0"
"SichengZuo" declared "fold:0"
"Yuchun" declared "call:10"
"HakulaPlayer" declared "call:10"
"Ethan" declared "fold:0"
"YangZ" declared "fold:0"
Street "flop" started. (community card = ['C6', 'SK', 'D7'])
"Finneas" declared "call:0"
"Zheng" declared "call:0"
"Yuchun" declared "call:0"
"HakulaPlayer" declared "call:0"
Street "turn" started. (community card = ['C6', 'SK', 'D7', 'DJ'])
"Finneas" declared "call:0"
"Zheng" declared "call:0"
"Yuchun" declared "call:0"
"HakulaPlayer" declared "call:0"
Street "river" started. (community card = ['C6', 'SK', 'D7', 'DJ', 'SJ'])
"Finneas" declared "call:0"
"Zheng" declared "call:0"
"Yuchun" declared "call:0"
"HakulaPlayer" declared "call:0"
"['Zheng']" won the round 29 (stack = {'Zheng': 915, 'RaphaelPlayer': 1004, 'SichengZuo': 940, 'Yuchun': 777, 'HakulaPlayer': 969, 'Ethan': 1295, 'YangZ': 945, 'Finneas': 1155})
player [Zheng] gets hole card ['C8', 'D9'], current stack 915
player [RaphaelPlayer] gets hole card ['SK', 'CA'], current stack 1004
player [SichengZuo] gets hole card ['S8', 'H5'], current stack 940
player [Yuchun] gets hole card ['H8', 'H3'], current stack 777
player [HakulaPlayer] gets hole card ['H7', 'SJ'], current stack 969
player [Ethan] gets hole card ['S9', 'DT'], current stack 1295
player [YangZ] gets hole card ['H4', 'S7'], current stack 940
player [Finneas] gets hole card ['C4', 'S5'], current stack 1145
Started the round 30
Street "preflop" started. (community card = [])
"Zheng" declared "call:10"
"RaphaelPlayer" declared "raise:30"
"SichengZuo" declared "fold:0"
"Yuchun" declared "call:30"
"HakulaPlayer" declared "call:30"
"Ethan" declared "fold:0"
"YangZ" declared "fold:0"
"Finneas" declared "fold:0"
"Zheng" declared "call:30"
Street "flop" started. (community card = ['CQ', 'HT', 'HJ'])
"Zheng" declared "call:0"
"RaphaelPlayer" declared "raise:145"
"Yuchun" declared "call:145"
"HakulaPlayer" declared "fold:0"
"Zheng" declared "raise:587"
"RaphaelPlayer" declared "call:587"
"Yuchun" declared "fold:0"
Street "turn" started. (community card = ['CQ', 'HT', 'HJ', 'H2'])
"Zheng" declared "raise:154"
"RaphaelPlayer" declared "raise:387"
"Zheng" declared "call:387"
Street "river" started. (community card = ['CQ', 'HT', 'HJ', 'H2', 'C6'])
"['RaphaelPlayer']" won the round 30 (stack = {'Zheng': 0, 'RaphaelPlayer': 2139, 'SichengZuo': 940, 'Yuchun': 602, 'HakulaPlayer': 939, 'Ethan': 1295, 'YangZ': 940, 'Finneas': 1145})
player [RaphaelPlayer] gets hole card ['CT', 'H3'], current stack 2129
player [SichengZuo] gets hole card ['C6', 'S2'], current stack 940
player [Yuchun] gets hole card ['D7', 'D5'], current stack 602
player [HakulaPlayer] gets hole card ['C9', 'D2'], current stack 939
player [Ethan] gets hole card ['CJ', 'H6'], current stack 1295
player [YangZ] gets hole card ['SA', 'CQ'], current stack 940
player [Finneas] gets hole card ['DT', 'S4'], current stack 1140
Started the round 31
Street "preflop" started. (community card = [])
"SichengZuo" declared "fold:0"
"Yuchun" declared "call:10"
"HakulaPlayer" declared "fold:0"
"Ethan" declared "fold:0"
"YangZ" declared "fold:0"
"Finneas" declared "call:10"
"RaphaelPlayer" declared "fold:0"
Street "flop" started. (community card = ['H4', 'S3', 'S5'])
"Finneas" declared "call:0"
"Yuchun" declared "call:0"
Street "turn" started. (community card = ['H4', 'S3', 'S5', 'SK'])
"Finneas" declared "call:0"
"Yuchun" declared "call:0"
Street "river" started. (community card = ['H4', 'S3', 'S5', 'SK', 'HT'])
"Finneas" declared "call:0"
"Yuchun" declared "call:0"
"['Finneas']" won the round 31 (stack = {'Zheng': 0, 'RaphaelPlayer': 2129, 'SichengZuo': 940, 'Yuchun': 592, 'HakulaPlayer': 939, 'Ethan': 1295, 'YangZ': 940, 'Finneas': 1165})
player [RaphaelPlayer] gets hole card ['CK', 'S2'], current stack 2124
player [SichengZuo] gets hole card ['D8', 'SK'], current stack 930
player [Yuchun] gets hole card ['SQ', 'H5'], current stack 592
player [HakulaPlayer] gets hole card ['HK', 'C9'], current stack 939
player [Ethan] gets hole card ['D2', 'H9'], current stack 1295
player [YangZ] gets hole card ['S5', 'ST'], current stack 940
player [Finneas] gets hole card ['H2', 'HQ'], current stack 1165
Started the round 32
Street "preflop" started. (community card = [])
"Yuchun" declared "call:10"
"HakulaPlayer" declared "call:10"
"Ethan" declared "fold:0"
"YangZ" declared "fold:0"
"Finneas" declared "call:10"
"RaphaelPlayer" declared "fold:0"
"SichengZuo" declared "fold:0"
Street "flop" started. (community card = ['C8', 'HT', 'H8'])
"Yuchun" declared "call:0"
"HakulaPlayer" declared "call:0"
"Finneas" declared "call:0"
Street "turn" started. (community card = ['C8', 'HT', 'H8', 'CJ'])
"Yuchun" declared "call:0"
"HakulaPlayer" declared "call:0"
"Finneas" declared "call:0"
Street "river" started. (community card = ['C8', 'HT', 'H8', 'CJ', 'H3'])
"Yuchun" declared "call:0"
"HakulaPlayer" declared "call:0"
"Finneas" declared "raise:582"
"Yuchun" declared "fold:0"
"HakulaPlayer" declared "fold:0"
"['Finneas']" won the round 32 (stack = {'Zheng': 0, 'RaphaelPlayer': 2124, 'SichengZuo': 930, 'Yuchun': 582, 'HakulaPlayer': 929, 'Ethan': 1295, 'YangZ': 940, 'Finneas': 1200})
player [RaphaelPlayer] gets hole card ['C8', 'D6'], current stack 2124
player [SichengZuo] gets hole card ['C2', 'S6'], current stack 925
player [Yuchun] gets hole card ['H8', 'SA'], current stack 572
player [HakulaPlayer] gets hole card ['D9', 'C3'], current stack 929
player [Ethan] gets hole card ['C5', 'C6'], current stack 1295
player [YangZ] gets hole card ['SJ', 'DT'], current stack 940
player [Finneas] gets hole card ['DK', 'CA'], current stack 1200
Started the round 33
Street "preflop" started. (community card = [])
"HakulaPlayer" declared "fold:0"
"Ethan" declared "fold:0"
"YangZ" declared "fold:0"
"Finneas" declared "raise:607"
"RaphaelPlayer" declared "fold:0"
"SichengZuo" declared "fold:0"
"Yuchun" declared "fold:0"
"['Finneas']" won the round 33 (stack = {'Zheng': 0, 'RaphaelPlayer': 2124, 'SichengZuo': 925, 'Yuchun': 572, 'HakulaPlayer': 929, 'Ethan': 1295, 'YangZ': 940, 'Finneas': 1215})
player [RaphaelPlayer] gets hole card ['D2', 'HT'], current stack 2124
player [SichengZuo] gets hole card ['H3', 'H8'], current stack 925
player [Yuchun] gets hole card ['HQ', 'C6'], current stack 567
player [HakulaPlayer] gets hole card ['D4', 'CJ'], current stack 919
player [Ethan] gets hole card ['D8', 'H6'], current stack 1295
player [YangZ] gets hole card ['SA', 'DK'], current stack 940
player [Finneas] gets hole card ['C2', 'DA'], current stack 1215
Started the round 34
Street "preflop" started. (community card = [])
"Ethan" declared "fold:0"
"YangZ" declared "fold:0"
"Finneas" declared "call:10"
"RaphaelPlayer" declared "fold:0"
"SichengZuo" declared "fold:0"
"Yuchun" declared "call:10"
"HakulaPlayer" declared "call:10"
Street "flop" started. (community card = ['C8', 'ST', 'DJ'])
"Yuchun" declared "call:0"
"HakulaPlayer" declared "call:0"
"Finneas" declared "call:0"
Street "turn" started. (community card = ['C8', 'ST', 'DJ', 'C4'])
"Yuchun" declared "call:0"
"HakulaPlayer" declared "raise:59"
"Finneas" declared "fold:0"
"Yuchun" declared "call:59"
Street "river" started. (community card = ['C8', 'ST', 'DJ', 'C4', 'H5'])
"Yuchun" declared "call:0"
"HakulaPlayer" declared "raise:366"
"Yuchun" declared "fold:0"
"['HakulaPlayer']" won the round 34 (stack = {'Zheng': 0, 'RaphaelPlayer': 2124, 'SichengZuo': 925, 'Yuchun': 503, 'HakulaPlayer': 1008, 'Ethan': 1295, 'YangZ': 940, 'Finneas': 1205})
player [RaphaelPlayer] gets hole card ['S8', 'D2'], current stack 2124
player [SichengZuo] gets hole card ['CJ', 'S5'], current stack 925
player [Yuchun] gets hole card ['C2', 'SJ'], current stack 503
player [HakulaPlayer] gets hole card ['HT', 'DA'], current stack 1003
player [Ethan] gets hole card ['S2', 'S3'], current stack 1285
player [YangZ] gets hole card ['D6', 'DJ'], current stack 940
player [Finneas] gets hole card ['CK', 'DK'], current stack 1205
Started the round 35
Street "preflop" started. (community card = [])
"YangZ" declared "fold:0"
"Finneas" declared "raise:610"
"RaphaelPlayer" declared "fold:0"
"SichengZuo" declared "fold:0"
"Yuchun" declared "fold:0"
"HakulaPlayer" declared "fold:0"
"Ethan" declared "fold:0"
"['Finneas']" won the round 35 (stack = {'Zheng': 0, 'RaphaelPlayer': 2124, 'SichengZuo': 925, 'Yuchun': 503, 'HakulaPlayer': 1003, 'Ethan': 1285, 'YangZ': 940, 'Finneas': 1220})
player [RaphaelPlayer] gets hole card ['ST', 'D9'], current stack 2124
player [SichengZuo] gets hole card ['SQ', 'S5'], current stack 925
player [Yuchun] gets hole card ['C2', 'CJ'], current stack 503
player [HakulaPlayer] gets hole card ['S8', 'D3'], current stack 1003
player [Ethan] gets hole card ['SA', 'DJ'], current stack 1280
player [YangZ] gets hole card ['HK', 'HA'], current stack 930
player [Finneas] gets hole card ['SJ', 'H6'], current stack 1220
Started the round 36
Street "preflop" started. (community card = [])
"Finneas" declared "call:10"
"RaphaelPlayer" declared "call:10"
"SichengZuo" declared "fold:0"
"Yuchun" declared "call:10"
"HakulaPlayer" declared "call:10"
"Ethan" declared "raise:192"
"YangZ" declared "fold:0"
"Finneas" declared "fold:0"
"RaphaelPlayer" declared "fold:0"
"Yuchun" declared "call:192"
"HakulaPlayer" declared "fold:0"
Street "flop" started. (community card = ['H2', 'D5', 'S2'])
"Ethan" declared "call:0"
"Yuchun" declared "raise:311"
"Ethan" declared "call:311"
Street "turn" started. (community card = ['H2', 'D5', 'S2', 'S9'])
Street "river" started. (community card = ['H2', 'D5', 'S2', 'S9', 'D8'])
"['Yuchun']" won the round 36 (stack = {'Zheng': 0, 'RaphaelPlayer': 2114, 'SichengZuo': 925, 'Yuchun': 1046, 'HakulaPlayer': 993, 'Ethan': 782, 'YangZ': 930, 'Finneas': 1210})
player [RaphaelPlayer] gets hole card ['SA', 'HT'], current stack 2114
player [SichengZuo] gets hole card ['C4', 'HK'], current stack 925
player [Yuchun] gets hole card ['H4', 'S4'], current stack 1046
player [HakulaPlayer] gets hole card ['SJ', 'DT'], current stack 993
player [Ethan] gets hole card ['DJ', 'DQ'], current stack 782
player [YangZ] gets hole card ['CQ', 'D4'], current stack 925
player [Finneas] gets hole card ['CJ', 'CK'], current stack 1200
Started the round 37
Street "preflop" started. (community card = [])
"RaphaelPlayer" declared "raise:30"
"SichengZuo" declared "fold:0"
"Yuchun" declared "call:30"
"HakulaPlayer" declared "call:30"
"Ethan" declared "raise:117"
"YangZ" declared "fold:0"
"Finneas" declared "fold:0"
"RaphaelPlayer" declared "call:117"
"Yuchun" declared "call:117"
"HakulaPlayer" declared "call:117"
Street "flop" started. (community card = ['ST', 'S7', 'H6'])
"RaphaelPlayer" declared "call:0"
"Yuchun" declared "call:0"
"HakulaPlayer" declared "raise:411"
"Ethan" declared "fold:0"
"RaphaelPlayer" declared "call:411"
"Yuchun" declared "fold:0"
Street "turn" started. (community card = ['ST', 'S7', 'H6', 'CA'])
"RaphaelPlayer" declared "raise:1315"
"HakulaPlayer" declared "call:1315"
Street "river" started. (community card = ['ST', 'S7', 'H6', 'CA', 'S8'])
"['RaphaelPlayer']" won the round 37 (stack = {'Zheng': 0, 'RaphaelPlayer': 3356, 'SichengZuo': 925, 'Yuchun': 929, 'HakulaPlayer': 0, 'Ethan': 665, 'YangZ': 925, 'Finneas': 1200})
player [RaphaelPlayer] gets hole card ['DJ', 'HA'], current stack 3346
player [SichengZuo] gets hole card ['C9', 'D4'], current stack 925
player [Yuchun] gets hole card ['SQ', 'HK'], current stack 929
player [Ethan] gets hole card ['SA', 'DK'], current stack 665
player [YangZ] gets hole card ['S9', 'D5'], current stack 925
player [Finneas] gets hole card ['C8', 'H6'], current stack 1195
Started the round 38
Street "preflop" started. (community card = [])
"SichengZuo" declared "fold:0"
"Yuchun" declared "call:10"
"Ethan" declared "raise:199"
"YangZ" declared "fold:0"
"Finneas" declared "fold:0"
"RaphaelPlayer" declared "fold:0"
"Yuchun" declared "call:199"
Street "flop" started. (community card = ['HQ', 'CT', 'CQ'])
"Yuchun" declared "raise:730"
"Ethan" declared "fold:0"
"['Yuchun']" won the round 38 (stack = {'Zheng': 0, 'RaphaelPlayer': 3346, 'SichengZuo': 925, 'Yuchun': 1143, 'HakulaPlayer': 0, 'Ethan': 466, 'YangZ': 925, 'Finneas': 1195})
player [RaphaelPlayer] gets hole card ['H5', 'ST'], current stack 3341
player [SichengZuo] gets hole card ['DA', 'HJ'], current stack 915
player [Yuchun] gets hole card ['CJ', 'C3'], current stack 1143
player [Ethan] gets hole card ['C9', 'D8'], current stack 466
player [YangZ] gets hole card ['C2', 'H7'], current stack 925
player [Finneas] gets hole card ['S3', 'S7'], current stack 1195
Started the round 39
Street "preflop" started. (community card = [])
"Yuchun" declared "call:10"
"Ethan" declared "fold:0"
"YangZ" declared "fold:0"
"Finneas" declared "call:10"
"RaphaelPlayer" declared "fold:0"
"SichengZuo" declared "fold:0"
Street "flop" started. (community card = ['HT', 'CA', 'S8'])
"Yuchun" declared "call:0"
"Finneas" declared "call:0"
Street "turn" started. (community card = ['HT', 'CA', 'S8', 'H9'])
"Yuchun" declared "call:0"
"Finneas" declared "call:0"
Street "river" started. (community card = ['HT', 'CA', 'S8', 'H9', 'D9'])
"Yuchun" declared "call:0"
"Finneas" declared "call:0"
"['Yuchun']" won the round 39 (stack = {'Zheng': 0, 'RaphaelPlayer': 3341, 'SichengZuo': 915, 'Yuchun': 1168, 'HakulaPlayer': 0, 'Ethan': 466, 'YangZ': 925, 'Finneas': 1185})
player [RaphaelPlayer] gets hole card ['ST', 'D9'], current stack 3341
player [SichengZuo] gets hole card ['CA', 'C9'], current stack 910
player [Yuchun] gets hole card ['D5', 'CT'], current stack 1158
player [Ethan] gets hole card ['DT', 'D2'], current stack 466
player [YangZ] gets hole card ['S8', 'H6'], current stack 925
player [Finneas] gets hole card ['D8', 'H9'], current stack 1185
Started the round 40
Street "preflop" started. (community card = [])
"Ethan" declared "fold:0"
"YangZ" declared "fold:0"
"Finneas" declared "call:10"
"RaphaelPlayer" declared "call:10"
"SichengZuo" declared "fold:0"
"Yuchun" declared "call:10"
Street "flop" started. (community card = ['HT', 'H2', 'C8'])
"Yuchun" declared "call:0"
"Finneas" declared "call:0"
"RaphaelPlayer" declared "raise:45"
"Yuchun" declared "call:45"
"Finneas" declared "fold:0"
Street "turn" started. (community card = ['HT', 'H2', 'C8', 'D6'])
"Yuchun" declared "raise:40"
"RaphaelPlayer" declared "raise:245"
"Yuchun" declared "call:245"
Street "river" started. (community card = ['HT', 'H2', 'C8', 'D6', 'C4'])
"Yuchun" declared "call:0"
"RaphaelPlayer" declared "raise:625"
"Yuchun" declared "call:625"
"['RaphaelPlayer']" won the round 40 (stack = {'Zheng': 0, 'RaphaelPlayer': 4281, 'SichengZuo': 910, 'Yuchun': 243, 'HakulaPlayer': 0, 'Ethan': 466, 'YangZ': 925, 'Finneas': 1175})
player [RaphaelPlayer] gets hole card ['HT', 'S3'], current stack 4281
player [SichengZuo] gets hole card ['D6', 'C7'], current stack 910
player [Yuchun] gets hole card ['H7', 'S2'], current stack 238
player [Ethan] gets hole card ['HA', 'HK'], current stack 456
player [YangZ] gets hole card ['S9', 'C4'], current stack 925
player [Finneas] gets hole card ['C3', 'S6'], current stack 1175
Started the round 41
Street "preflop" started. (community card = [])
"YangZ" declared "fold:0"
"Finneas" declared "call:10"
"RaphaelPlayer" declared "fold:0"
"SichengZuo" declared "fold:0"
"Yuchun" declared "fold:0"
"Ethan" declared "raise:139"
"Finneas" declared "fold:0"
"['Ethan']" won the round 41 (stack = {'Zheng': 0, 'RaphaelPlayer': 4281, 'SichengZuo': 910, 'Yuchun': 238, 'HakulaPlayer': 0, 'Ethan': 481, 'YangZ': 925, 'Finneas': 1165})
player [RaphaelPlayer] gets hole card ['D9', 'C5'], current stack 4281
player [SichengZuo] gets hole card ['HT', 'CT'], current stack 910
player [Yuchun] gets hole card ['C8', 'C9'], current stack 238
player [Ethan] gets hole card ['S3', 'S8'], current stack 476
player [YangZ] gets hole card ['DT', 'H7'], current stack 915
player [Finneas] gets hole card ['D4', 'D8'], current stack 1165
Started the round 42
Street "preflop" started. (community card = [])
"Finneas" declared "call:10"
"RaphaelPlayer" declared "fold:0"
"SichengZuo" declared "fold:0"
"Yuchun" declared "fold:0"
"Ethan" declared "fold:0"
"YangZ" declared "fold:0"
"['Finneas']" won the round 42 (stack = {'Zheng': 0, 'RaphaelPlayer': 4281, 'SichengZuo': 910, 'Yuchun': 238, 'HakulaPlayer': 0, 'Ethan': 476, 'YangZ': 915, 'Finneas': 1180})
player [RaphaelPlayer] gets hole card ['H9', 'C3'], current stack 4281
player [SichengZuo] gets hole card ['H5', 'CT'], current stack 910
player [Yuchun] gets hole card ['CJ', 'H3'], current stack 238
player [Ethan] gets hole card ['C2', 'CQ'], current stack 476
player [YangZ] gets hole card ['SA', 'D9'], current stack 910
player [Finneas] gets hole card ['S3', 'C6'], current stack 1170
Started the round 43
Street "preflop" started. (community card = [])
"RaphaelPlayer" declared "fold:0"
"SichengZuo" declared "fold:0"
"Yuchun" declared "fold:0"
"Ethan" declared "fold:0"
"YangZ" declared "fold:0"
"['Finneas']" won the round 43 (stack = {'Zheng': 0, 'RaphaelPlayer': 4281, 'SichengZuo': 910, 'Yuchun': 238, 'HakulaPlayer': 0, 'Ethan': 476, 'YangZ': 910, 'Finneas': 1185})
player [RaphaelPlayer] gets hole card ['CT', 'D5'], current stack 4271
player [SichengZuo] gets hole card ['S3', 'H6'], current stack 910
player [Yuchun] gets hole card ['C7', 'HQ'], current stack 238
player [Ethan] gets hole card ['HK', 'S9'], current stack 476
player [YangZ] gets hole card ['C4', 'D7'], current stack 910
player [Finneas] gets hole card ['SJ', 'CJ'], current stack 1180
Started the round 44
Street "preflop" started. (community card = [])
"SichengZuo" declared "fold:0"
"Yuchun" declared "fold:0"
"Ethan" declared "fold:0"
"YangZ" declared "fold:0"
"Finneas" declared "call:10"
"RaphaelPlayer" declared "fold:0"
"['Finneas']" won the round 44 (stack = {'Zheng': 0, 'RaphaelPlayer': 4271, 'SichengZuo': 910, 'Yuchun': 238, 'HakulaPlayer': 0, 'Ethan': 476, 'YangZ': 910, 'Finneas': 1195})
player [RaphaelPlayer] gets hole card ['D4', 'D8'], current stack 4266
player [SichengZuo] gets hole card ['H9', 'C4'], current stack 900
player [Yuchun] gets hole card ['DA', 'D3'], current stack 238
player [Ethan] gets hole card ['HA', 'H7'], current stack 476
player [YangZ] gets hole card ['D9', 'C8'], current stack 910
player [Finneas] gets hole card ['C6', 'D2'], current stack 1195
Started the round 45
Street "preflop" started. (community card = [])
"Yuchun" declared "fold:0"
"Ethan" declared "fold:0"
"YangZ" declared "fold:0"
"Finneas" declared "call:10"
"RaphaelPlayer" declared "fold:0"
"SichengZuo" declared "fold:0"
"['Finneas']" won the round 45 (stack = {'Zheng': 0, 'RaphaelPlayer': 4266, 'SichengZuo': 900, 'Yuchun': 238, 'HakulaPlayer': 0, 'Ethan': 476, 'YangZ': 910, 'Finneas': 1210})
player [RaphaelPlayer] gets hole card ['C3', 'CA'], current stack 4266
player [SichengZuo] gets hole card ['DQ', 'H8'], current stack 895
player [Yuchun] gets hole card ['CK', 'H2'], current stack 228
player [Ethan] gets hole card ['SJ', 'H7'], current stack 476
player [YangZ] gets hole card ['S8', 'CJ'], current stack 910
player [Finneas] gets hole card ['D5', 'CT'], current stack 1210
Started the round 46
Street "preflop" started. (community card = [])
"Ethan" declared "fold:0"
"YangZ" declared "fold:0"
"Finneas" declared "call:10"
"RaphaelPlayer" declared "call:10"
"SichengZuo" declared "fold:0"
"Yuchun" declared "fold:0"
Street "flop" started. (community card = ['D3', 'S6', 'HT'])
"Finneas" declared "call:0"
"RaphaelPlayer" declared "raise:45"
"Finneas" declared "fold:0"
"['RaphaelPlayer']" won the round 46 (stack = {'Zheng': 0, 'RaphaelPlayer': 4291, 'SichengZuo': 895, 'Yuchun': 228, 'HakulaPlayer': 0, 'Ethan': 476, 'YangZ': 910, 'Finneas': 1200})
player [RaphaelPlayer] gets hole card ['H9', 'HK'], current stack 4291
player [SichengZuo] gets hole card ['H2', 'DK'], current stack 895
player [Yuchun] gets hole card ['SK', 'D4'], current stack 223
player [Ethan] gets hole card ['D5', 'HQ'], current stack 466
player [YangZ] gets hole card ['S4', 'C3'], current stack 910
player [Finneas] gets hole card ['D3', 'SJ'], current stack 1200
Started the round 47
Street "preflop" started. (community card = [])
"YangZ" declared "fold:0"
"Finneas" declared "call:10"
"RaphaelPlayer" declared "raise:30"
"SichengZuo" declared "fold:0"
"Yuchun" declared "fold:0"
"Ethan" declared "fold:0"
"Finneas" declared "fold:0"
"['RaphaelPlayer']" won the round 47 (stack = {'Zheng': 0, 'RaphaelPlayer': 4316, 'SichengZuo': 895, 'Yuchun': 223, 'HakulaPlayer': 0, 'Ethan': 466, 'YangZ': 910, 'Finneas': 1190})
player [RaphaelPlayer] gets hole card ['D9', 'HA'], current stack 4316
player [SichengZuo] gets hole card ['CT', 'HT'], current stack 895
player [Yuchun] gets hole card ['D6', 'D2'], current stack 223
player [Ethan] gets hole card ['SJ', 'HK'], current stack 461
player [YangZ] gets hole card ['D3', 'DT'], current stack 900
player [Finneas] gets hole card ['C8', 'SA'], current stack 1190
Started the round 48
Street "preflop" started. (community card = [])
"Finneas" declared "call:10"
"RaphaelPlayer" declared "call:10"
"SichengZuo" declared "fold:0"
"Yuchun" declared "fold:0"
"Ethan" declared "raise:69"
"YangZ" declared "fold:0"
"Finneas" declared "fold:0"
"RaphaelPlayer" declared "fold:0"
"['Ethan']" won the round 48 (stack = {'Zheng': 0, 'RaphaelPlayer': 4306, 'SichengZuo': 895, 'Yuchun': 223, 'HakulaPlayer': 0, 'Ethan': 496, 'YangZ': 900, 'Finneas': 1180})
player [RaphaelPlayer] gets hole card ['C3', 'D2'], current stack 4306
player [SichengZuo] gets hole card ['HQ', 'H5'], current stack 895
player [Yuchun] gets hole card ['D8', 'S7'], current stack 223
player [Ethan] gets hole card ['D3', 'DT'], current stack 496
player [YangZ] gets hole card ['HK', 'C6'], current stack 895
player [Finneas] gets hole card ['CT', 'D6'], current stack 1170
Started the round 49
Street "preflop" started. (community card = [])
"RaphaelPlayer" declared "fold:0"
"SichengZuo" declared "fold:0"
"Yuchun" declared "fold:0"
"Ethan" declared "fold:0"
"YangZ" declared "fold:0"
"['Finneas']" won the round 49 (stack = {'Zheng': 0, 'RaphaelPlayer': 4306, 'SichengZuo': 895, 'Yuchun': 223, 'HakulaPlayer': 0, 'Ethan': 496, 'YangZ': 895, 'Finneas': 1185})
player [RaphaelPlayer] gets hole card ['C3', 'HT'], current stack 4296
player [SichengZuo] gets hole card ['SJ', 'D4'], current stack 895
player [Yuchun] gets hole card ['H2', 'H7'], current stack 223
player [Ethan] gets hole card ['CT', 'S3'], current stack 496
player [YangZ] gets hole card ['D2', 'H8'], current stack 895
player [Finneas] gets hole card ['C4', 'SK'], current stack 1180
Started the round 50
Street "preflop" started. (community card = [])
"SichengZuo" declared "fold:0"
"Yuchun" declared "fold:0"
"Ethan" declared "fold:0"
"YangZ" declared "fold:0"
"Finneas" declared "call:10"
"RaphaelPlayer" declared "fold:0"
"['Finneas']" won the round 50 (stack = {'Zheng': 0, 'RaphaelPlayer': 4296, 'SichengZuo': 895, 'Yuchun': 223, 'HakulaPlayer': 0, 'Ethan': 496, 'YangZ': 895, 'Finneas': 1195})

Game Results:
------------------------------------------------------------
Game 1:
Winner: RaphaelPlayer (stack: 4296)
All players' stacks:
  Zheng: 0
  RaphaelPlayer: 4296
  SichengZuo: 895
  Yuchun: 223
  HakulaPlayer: 0
  Ethan: 496
  YangZ: 895
  Finneas: 1195
------------------------------------------------------------
