player [Zheng] gets hole card ['D7', 'DQ'], current stack 1000
player [RaphaelPlayer] gets hole card ['S9', 'S6'], current stack 995
player [SichengZuo] gets hole card ['H4', 'H7'], current stack 990
player [Yuchun] gets hole card ['H8', 'DJ'], current stack 1000
player [HakulaPlayer] gets hole card ['D8', 'CT'], current stack 1000
player [Ethan] gets hole card ['HT', 'CA'], current stack 1000
player [YangZ] gets hole card ['D3', 'C5'], current stack 1000
player [Finneas] gets hole card ['DT', 'S4'], current stack 1000
Started the round 1
Street "preflop" started. (community card = [])
"Yuchun" declared "fold:0"
"HakulaPlayer" declared "fold:0"
"Ethan" declared "call:10"
"YangZ" declared "fold:0"
"Finneas" declared "call:10"
"Zheng" declared "call:10"
"RaphaelPlayer" declared "fold:0"
"SichengZuo" declared "fold:0"
Street "flop" started. (community card = ['C2', 'HQ', 'S3'])
"Ethan" declared "call:0"
"Finneas" declared "call:0"
"Zheng" declared "call:0"
Street "turn" started. (community card = ['C2', 'HQ', 'S3', 'CJ'])
"Ethan" declared "call:0"
"Finneas" declared "call:0"
"Zheng" declared "call:0"
Street "river" started. (community card = ['C2', 'HQ', 'S3', 'CJ', 'D9'])
"Ethan" declared "call:0"
"Finneas" declared "call:0"
"Zheng" declared "call:0"
"['Zheng']" won the round 1 (stack = {'Zheng': 1035, 'RaphaelPlayer': 995, 'SichengZuo': 990, 'Yuchun': 1000, 'HakulaPlayer': 1000, 'Ethan': 990, 'YangZ': 1000, 'Finneas': 990})
player [Zheng] gets hole card ['D8', 'SQ'], current stack 1035
player [RaphaelPlayer] gets hole card ['HT', 'C3'], current stack 995
player [SichengZuo] gets hole card ['S6', 'S5'], current stack 985
player [Yuchun] gets hole card ['H4', 'D4'], current stack 990
player [HakulaPlayer] gets hole card ['H6', 'H7'], current stack 1000
player [Ethan] gets hole card ['DJ', 'HJ'], current stack 990
player [YangZ] gets hole card ['S8', 'C9'], current stack 1000
player [Finneas] gets hole card ['D5', 'D9'], current stack 990
Started the round 2
Street "preflop" started. (community card = [])
"HakulaPlayer" declared "fold:0"
"Ethan" declared "raise:148"
"YangZ" declared "fold:0"
"Finneas" declared "fold:0"
"Zheng" declared "fold:0"
"RaphaelPlayer" declared "fold:0"
"SichengZuo" declared "fold:0"
"Yuchun" declared "fold:0"
"['Ethan']" won the round 2 (stack = {'Zheng': 1035, 'RaphaelPlayer': 995, 'SichengZuo': 985, 'Yuchun': 990, 'HakulaPlayer': 1000, 'Ethan': 1005, 'YangZ': 1000, 'Finneas': 990})
player [Zheng] gets hole card ['D4', 'SJ'], current stack 1035
player [RaphaelPlayer] gets hole card ['H4', 'SQ'], current stack 995
player [SichengZuo] gets hole card ['CQ', 'S7'], current stack 985
player [Yuchun] gets hole card ['HA', 'C4'], current stack 985
player [HakulaPlayer] gets hole card ['DA', 'D3'], current stack 990
player [Ethan] gets hole card ['C2', 'H8'], current stack 1005
player [YangZ] gets hole card ['S5', 'H5'], current stack 1000
player [Finneas] gets hole card ['C7', 'SK'], current stack 990
Started the round 3
Street "preflop" started. (community card = [])
"Ethan" declared "fold:0"
"YangZ" declared "fold:0"
"Finneas" declared "call:10"
"Zheng" declared "call:10"
"RaphaelPlayer" declared "fold:0"
"SichengZuo" declared "fold:0"
"Yuchun" declared "fold:0"
"HakulaPlayer" declared "call:10"
Street "flop" started. (community card = ['D5', 'S3', 'C9'])
"HakulaPlayer" declared "call:0"
"Finneas" declared "call:0"
"Zheng" declared "call:0"
Street "turn" started. (community card = ['D5', 'S3', 'C9', 'HQ'])
"HakulaPlayer" declared "call:0"
"Finneas" declared "call:0"
"Zheng" declared "call:0"
Street "river" started. (community card = ['D5', 'S3', 'C9', 'HQ', 'H2'])
"HakulaPlayer" declared "call:0"
"Finneas" declared "call:0"
"Zheng" declared "call:0"
"['HakulaPlayer']" won the round 3 (stack = {'Zheng': 1025, 'RaphaelPlayer': 995, 'SichengZuo': 985, 'Yuchun': 985, 'HakulaPlayer': 1025, 'Ethan': 1005, 'YangZ': 1000, 'Finneas': 980})
player [Zheng] gets hole card ['C5', 'D3'], current stack 1025
player [RaphaelPlayer] gets hole card ['H5', 'H8'], current stack 995
player [SichengZuo] gets hole card ['H2', 'S6'], current stack 985
player [Yuchun] gets hole card ['S3', 'SJ'], current stack 985
player [HakulaPlayer] gets hole card ['C2', 'C8'], current stack 1020
player [Ethan] gets hole card ['H9', 'CK'], current stack 995
player [YangZ] gets hole card ['CQ', 'C4'], current stack 1000
player [Finneas] gets hole card ['DA', 'D7'], current stack 980
Started the round 4
Street "preflop" started. (community card = [])
"YangZ" declared "fold:0"
"Finneas" declared "call:10"
"Zheng" declared "call:10"
"RaphaelPlayer" declared "fold:0"
"SichengZuo" declared "fold:0"
"Yuchun" declared "fold:0"
"HakulaPlayer" declared "call:10"
"Ethan" declared "fold:0"
Street "flop" started. (community card = ['SK', 'DQ', 'S2'])
"HakulaPlayer" declared "call:0"
"Finneas" declared "call:0"
"Zheng" declared "call:0"
Street "turn" started. (community card = ['SK', 'DQ', 'S2', 'SA'])
"HakulaPlayer" declared "call:0"
"Finneas" declared "call:0"
"Zheng" declared "call:0"
Street "river" started. (community card = ['SK', 'DQ', 'S2', 'SA', 'ST'])
"HakulaPlayer" declared "call:0"
"Finneas" declared "call:0"
"Zheng" declared "call:0"
"['Finneas']" won the round 4 (stack = {'Zheng': 1015, 'RaphaelPlayer': 995, 'SichengZuo': 985, 'Yuchun': 985, 'HakulaPlayer': 1015, 'Ethan': 995, 'YangZ': 1000, 'Finneas': 1010})
player [Zheng] gets hole card ['DT', 'H4'], current stack 1015
player [RaphaelPlayer] gets hole card ['C3', 'D7'], current stack 995
player [SichengZuo] gets hole card ['DK', 'H3'], current stack 985
player [Yuchun] gets hole card ['S3', 'HA'], current stack 985
player [HakulaPlayer] gets hole card ['S5', 'CQ'], current stack 1015
player [Ethan] gets hole card ['C9', 'DA'], current stack 990
player [YangZ] gets hole card ['HJ', 'C2'], current stack 990
player [Finneas] gets hole card ['C5', 'CJ'], current stack 1010
Started the round 5
Street "preflop" started. (community card = [])
"Finneas" declared "call:10"
"Zheng" declared "call:10"
"RaphaelPlayer" declared "fold:0"
"SichengZuo" declared "fold:0"
"Yuchun" declared "fold:0"
"HakulaPlayer" declared "call:10"
"Ethan" declared "fold:0"
"YangZ" declared "fold:0"
Street "flop" started. (community card = ['ST', 'CA', 'D9'])
"Finneas" declared "call:0"
"Zheng" declared "call:0"
"HakulaPlayer" declared "raise:22"
"Finneas" declared "fold:0"
"Zheng" declared "fold:0"
"['HakulaPlayer']" won the round 5 (stack = {'Zheng': 1005, 'RaphaelPlayer': 995, 'SichengZuo': 985, 'Yuchun': 985, 'HakulaPlayer': 1050, 'Ethan': 990, 'YangZ': 990, 'Finneas': 1000})
player [Zheng] gets hole card ['S4', 'C6'], current stack 1005
player [RaphaelPlayer] gets hole card ['H2', 'C9'], current stack 995
player [SichengZuo] gets hole card ['H4', 'D2'], current stack 985
player [Yuchun] gets hole card ['H7', 'C8'], current stack 985
player [HakulaPlayer] gets hole card ['CK', 'SQ'], current stack 1050
player [Ethan] gets hole card ['CJ', 'C2'], current stack 990
player [YangZ] gets hole card ['S7', 'CT'], current stack 985
player [Finneas] gets hole card ['D5', 'HT'], current stack 990
Started the round 6
Street "preflop" started. (community card = [])
"Zheng" declared "call:10"
"RaphaelPlayer" declared "fold:0"
"SichengZuo" declared "fold:0"
"Yuchun" declared "fold:0"
"HakulaPlayer" declared "raise:32"
"Ethan" declared "fold:0"
Error in respond_to_ask: 'YangZ' object has no attribute 'online_player'
"YangZ" declared "fold:0"
"Finneas" declared "fold:0"
"Zheng" declared "fold:0"
"['HakulaPlayer']" won the round 6 (stack = {'Zheng': 995, 'RaphaelPlayer': 995, 'SichengZuo': 985, 'Yuchun': 985, 'HakulaPlayer': 1075, 'Ethan': 990, 'YangZ': 985, 'Finneas': 990})
player [Zheng] gets hole card ['HT', 'C5'], current stack 985
player [RaphaelPlayer] gets hole card ['CJ', 'D3'], current stack 995
player [SichengZuo] gets hole card ['C4', 'S4'], current stack 985
player [Yuchun] gets hole card ['C6', 'S8'], current stack 985
player [HakulaPlayer] gets hole card ['C9', 'H5'], current stack 1075
player [Ethan] gets hole card ['DK', 'CQ'], current stack 990
player [YangZ] gets hole card ['D5', 'ST'], current stack 985
player [Finneas] gets hole card ['H3', 'CK'], current stack 985
Started the round 7
Street "preflop" started. (community card = [])
"RaphaelPlayer" declared "fold:0"
"SichengZuo" declared "fold:0"
"Yuchun" declared "fold:0"
"HakulaPlayer" declared "fold:0"
"Ethan" declared "raise:148"
"YangZ" declared "fold:0"
"Finneas" declared "fold:0"
"Zheng" declared "fold:0"
"['Ethan']" won the round 7 (stack = {'Zheng': 985, 'RaphaelPlayer': 995, 'SichengZuo': 985, 'Yuchun': 985, 'HakulaPlayer': 1075, 'Ethan': 1005, 'YangZ': 985, 'Finneas': 985})
player [Zheng] gets hole card ['S7', 'CQ'], current stack 980
player [RaphaelPlayer] gets hole card ['D4', 'H5'], current stack 985
player [SichengZuo] gets hole card ['H8', 'D9'], current stack 985
player [Yuchun] gets hole card ['C8', 'D3'], current stack 985
player [HakulaPlayer] gets hole card ['C6', 'D6'], current stack 1075
player [Ethan] gets hole card ['S9', 'S5'], current stack 1005
player [YangZ] gets hole card ['CT', 'SK'], current stack 985
player [Finneas] gets hole card ['C5', 'DK'], current stack 985
Started the round 8
Street "preflop" started. (community card = [])
"SichengZuo" declared "fold:0"
"Yuchun" declared "fold:0"
"HakulaPlayer" declared "call:10"
"Ethan" declared "fold:0"
"YangZ" declared "fold:0"
"Finneas" declared "call:10"
"Zheng" declared "call:10"
"RaphaelPlayer" declared "fold:0"
Street "flop" started. (community card = ['D8', 'HT', 'DJ'])
"Zheng" declared "call:0"
"HakulaPlayer" declared "call:0"
"Finneas" declared "call:0"
Street "turn" started. (community card = ['D8', 'HT', 'DJ', 'H7'])
"Zheng" declared "call:0"
"HakulaPlayer" declared "call:0"
"Finneas" declared "call:0"
Street "river" started. (community card = ['D8', 'HT', 'DJ', 'H7', 'C7'])
"Zheng" declared "call:0"
"HakulaPlayer" declared "call:0"
"Finneas" declared "call:0"
"['Zheng']" won the round 8 (stack = {'Zheng': 1015, 'RaphaelPlayer': 985, 'SichengZuo': 985, 'Yuchun': 985, 'HakulaPlayer': 1065, 'Ethan': 1005, 'YangZ': 985, 'Finneas': 975})
player [Zheng] gets hole card ['DJ', 'D9'], current stack 1015
player [RaphaelPlayer] gets hole card ['S6', 'D2'], current stack 980
player [SichengZuo] gets hole card ['D8', 'DA'], current stack 975
player [Yuchun] gets hole card ['S3', 'HJ'], current stack 985
player [HakulaPlayer] gets hole card ['D4', 'HA'], current stack 1065
player [Ethan] gets hole card ['DQ', 'S8'], current stack 1005
player [YangZ] gets hole card ['DT', 'SJ'], current stack 985
player [Finneas] gets hole card ['CQ', 'H9'], current stack 975
Started the round 9
Street "preflop" started. (community card = [])
"Yuchun" declared "fold:0"
"HakulaPlayer" declared "fold:0"
"Ethan" declared "fold:0"
"YangZ" declared "fold:0"
"Finneas" declared "call:10"
"Zheng" declared "call:10"
"RaphaelPlayer" declared "fold:0"
"SichengZuo" declared "fold:0"
Street "flop" started. (community card = ['C6', 'H5', 'C7'])
"Finneas" declared "call:0"
"Zheng" declared "call:0"
Street "turn" started. (community card = ['C6', 'H5', 'C7', 'CJ'])
"Finneas" declared "call:0"
"Zheng" declared "call:0"
Street "river" started. (community card = ['C6', 'H5', 'C7', 'CJ', 'S9'])
"Finneas" declared "call:0"
"Zheng" declared "raise:507"
"Finneas" declared "fold:0"
"['Zheng']" won the round 9 (stack = {'Zheng': 1040, 'RaphaelPlayer': 980, 'SichengZuo': 975, 'Yuchun': 985, 'HakulaPlayer': 1065, 'Ethan': 1005, 'YangZ': 985, 'Finneas': 965})
player [Zheng] gets hole card ['C4', 'SK'], current stack 1040
player [RaphaelPlayer] gets hole card ['C2', 'CJ'], current stack 980
player [SichengZuo] gets hole card ['DQ', 'C6'], current stack 970
player [Yuchun] gets hole card ['H3', 'D8'], current stack 975
player [HakulaPlayer] gets hole card ['H4', 'S2'], current stack 1065
player [Ethan] gets hole card ['D2', 'D7'], current stack 1005
player [YangZ] gets hole card ['C9', 'CK'], current stack 985
player [Finneas] gets hole card ['S4', 'CQ'], current stack 965
Started the round 10
Street "preflop" started. (community card = [])
"HakulaPlayer" declared "fold:0"
"Ethan" declared "fold:0"
"YangZ" declared "fold:0"
"Finneas" declared "call:10"
"Zheng" declared "call:10"
"RaphaelPlayer" declared "fold:0"
"SichengZuo" declared "fold:0"
"Yuchun" declared "call:10"
Street "flop" started. (community card = ['SA', 'C7', 'H9'])
"Yuchun" declared "call:0"
"Finneas" declared "call:0"
"Zheng" declared "call:0"
Street "turn" started. (community card = ['SA', 'C7', 'H9', 'S9'])
"Yuchun" declared "call:0"
"Finneas" declared "call:0"
"Zheng" declared "call:0"
Street "river" started. (community card = ['SA', 'C7', 'H9', 'S9', 'D3'])
"Yuchun" declared "call:0"
"Finneas" declared "call:0"
"Zheng" declared "call:0"
"['Yuchun']" won the round 10 (stack = {'Zheng': 1030, 'RaphaelPlayer': 980, 'SichengZuo': 970, 'Yuchun': 1010, 'HakulaPlayer': 1065, 'Ethan': 1005, 'YangZ': 985, 'Finneas': 955})
player [Zheng] gets hole card ['S3', 'S9'], current stack 1030
player [RaphaelPlayer] gets hole card ['H2', 'S8'], current stack 980
player [SichengZuo] gets hole card ['C5', 'DQ'], current stack 970
player [Yuchun] gets hole card ['S6', 'CT'], current stack 1005
player [HakulaPlayer] gets hole card ['CQ', 'HT'], current stack 1055
player [Ethan] gets hole card ['H8', 'H7'], current stack 1005
player [YangZ] gets hole card ['D9', 'H4'], current stack 985
player [Finneas] gets hole card ['S4', 'CJ'], current stack 955
Started the round 11
Street "preflop" started. (community card = [])
"Ethan" declared "fold:0"
"YangZ" declared "fold:0"
"Finneas" declared "call:10"
"Zheng" declared "call:10"
"RaphaelPlayer" declared "fold:0"
"SichengZuo" declared "fold:0"
"Yuchun" declared "call:10"
"HakulaPlayer" declared "call:10"
Street "flop" started. (community card = ['C7', 'DJ', 'S7'])
"Yuchun" declared "call:0"
"HakulaPlayer" declared "call:0"
"Finneas" declared "call:0"
"Zheng" declared "call:0"
Street "turn" started. (community card = ['C7', 'DJ', 'S7', 'DK'])
"Yuchun" declared "call:0"
"HakulaPlayer" declared "call:0"
"Finneas" declared "call:0"
"Zheng" declared "call:0"
Street "river" started. (community card = ['C7', 'DJ', 'S7', 'DK', 'C8'])
"Yuchun" declared "call:0"
"HakulaPlayer" declared "call:0"
"Finneas" declared "call:0"
"Zheng" declared "call:0"
"['Finneas']" won the round 11 (stack = {'Zheng': 1020, 'RaphaelPlayer': 980, 'SichengZuo': 970, 'Yuchun': 1000, 'HakulaPlayer': 1055, 'Ethan': 1005, 'YangZ': 985, 'Finneas': 985})
player [Zheng] gets hole card ['H3', 'C5'], current stack 1020
player [RaphaelPlayer] gets hole card ['H9', 'C8'], current stack 980
player [SichengZuo] gets hole card ['C7', 'C4'], current stack 970
player [Yuchun] gets hole card ['S7', 'DQ'], current stack 1000
player [HakulaPlayer] gets hole card ['DA', 'HJ'], current stack 1050
player [Ethan] gets hole card ['S9', 'H8'], current stack 995
player [YangZ] gets hole card ['D8', 'S3'], current stack 985
player [Finneas] gets hole card ['SA', 'S2'], current stack 985
Started the round 12
Street "preflop" started. (community card = [])
"YangZ" declared "fold:0"
"Finneas" declared "call:10"
"Zheng" declared "call:10"
"RaphaelPlayer" declared "fold:0"
"SichengZuo" declared "fold:0"
"Yuchun" declared "call:10"
"HakulaPlayer" declared "call:10"
"Ethan" declared "fold:0"
Street "flop" started. (community card = ['C3', 'ST', 'HT'])
"HakulaPlayer" declared "call:0"
"Finneas" declared "call:0"
"Zheng" declared "call:0"
"Yuchun" declared "call:0"
Street "turn" started. (community card = ['C3', 'ST', 'HT', 'SJ'])
"HakulaPlayer" declared "call:0"
"Finneas" declared "call:0"
"Zheng" declared "call:0"
"Yuchun" declared "call:0"
Street "river" started. (community card = ['C3', 'ST', 'HT', 'SJ', 'DJ'])
"HakulaPlayer" declared "raise:90"
"Finneas" declared "fold:0"
"Zheng" declared "fold:0"
"Yuchun" declared "call:90"
"['HakulaPlayer']" won the round 12 (stack = {'Zheng': 1010, 'RaphaelPlayer': 980, 'SichengZuo': 970, 'Yuchun': 900, 'HakulaPlayer': 1185, 'Ethan': 995, 'YangZ': 985, 'Finneas': 975})
player [Zheng] gets hole card ['S9', 'CT'], current stack 1010
player [RaphaelPlayer] gets hole card ['CQ', 'HK'], current stack 980
player [SichengZuo] gets hole card ['C5', 'S2'], current stack 970
player [Yuchun] gets hole card ['C7', 'H9'], current stack 900
player [HakulaPlayer] gets hole card ['H8', 'SQ'], current stack 1185
player [Ethan] gets hole card ['C8', 'S7'], current stack 990
player [YangZ] gets hole card ['CJ', 'D5'], current stack 975
player [Finneas] gets hole card ['SJ', 'CA'], current stack 975
Started the round 13
Street "preflop" started. (community card = [])
"Finneas" declared "call:10"
"Zheng" declared "call:10"
"RaphaelPlayer" declared "raise:30"
"SichengZuo" declared "fold:0"
"Yuchun" declared "call:30"
"HakulaPlayer" declared "call:30"
"Ethan" declared "fold:0"
"YangZ" declared "fold:0"
"Finneas" declared "fold:0"
"Zheng" declared "fold:0"
Street "flop" started. (community card = ['DT', 'HA', 'DA'])
"RaphaelPlayer" declared "call:0"
"Yuchun" declared "call:0"
"HakulaPlayer" declared "call:0"
Street "turn" started. (community card = ['DT', 'HA', 'DA', 'DQ'])
"RaphaelPlayer" declared "raise:135"
"Yuchun" declared "fold:0"
"HakulaPlayer" declared "call:135"
Street "river" started. (community card = ['DT', 'HA', 'DA', 'DQ', 'H5'])
"RaphaelPlayer" declared "raise:405"
"HakulaPlayer" declared "call:405"
"['RaphaelPlayer']" won the round 13 (stack = {'Zheng': 1000, 'RaphaelPlayer': 1615, 'SichengZuo': 970, 'Yuchun': 870, 'HakulaPlayer': 615, 'Ethan': 990, 'YangZ': 975, 'Finneas': 965})
player [Zheng] gets hole card ['HA', 'C2'], current stack 1000
player [RaphaelPlayer] gets hole card ['DT', 'DA'], current stack 1615
player [SichengZuo] gets hole card ['H4', 'CJ'], current stack 970
player [Yuchun] gets hole card ['HT', 'S4'], current stack 870
player [HakulaPlayer] gets hole card ['C7', 'S6'], current stack 615
player [Ethan] gets hole card ['S9', 'CA'], current stack 990
player [YangZ] gets hole card ['H9', 'H3'], current stack 970
player [Finneas] gets hole card ['C9', 'H6'], current stack 955
Started the round 14
Street "preflop" started. (community card = [])
"Zheng" declared "call:10"
"RaphaelPlayer" declared "raise:30"
"SichengZuo" declared "fold:0"
"Yuchun" declared "call:30"
"HakulaPlayer" declared "fold:0"
"Ethan" declared "fold:0"
"YangZ" declared "fold:0"
"Finneas" declared "fold:0"
"Zheng" declared "fold:0"
Street "flop" started. (community card = ['DQ', 'HK', 'C8'])
"RaphaelPlayer" declared "call:0"
"Yuchun" declared "call:0"
Street "turn" started. (community card = ['DQ', 'HK', 'C8', 'D9'])
"RaphaelPlayer" declared "raise:95"
"Yuchun" declared "call:95"
Street "river" started. (community card = ['DQ', 'HK', 'C8', 'D9', 'H2'])
"RaphaelPlayer" declared "call:0"
"Yuchun" declared "call:0"
"['RaphaelPlayer']" won the round 14 (stack = {'Zheng': 990, 'RaphaelPlayer': 1765, 'SichengZuo': 970, 'Yuchun': 745, 'HakulaPlayer': 615, 'Ethan': 990, 'YangZ': 970, 'Finneas': 955})
player [Zheng] gets hole card ['H3', 'D8'], current stack 980
player [RaphaelPlayer] gets hole card ['DQ', 'HJ'], current stack 1765
player [SichengZuo] gets hole card ['C4', 'S8'], current stack 970
player [Yuchun] gets hole card ['D9', 'D6'], current stack 745
player [HakulaPlayer] gets hole card ['CK', 'HA'], current stack 615
player [Ethan] gets hole card ['C8', 'C2'], current stack 990
player [YangZ] gets hole card ['D7', 'H7'], current stack 970
player [Finneas] gets hole card ['C7', 'C9'], current stack 950
Started the round 15
Street "preflop" started. (community card = [])
"RaphaelPlayer" declared "call:10"
"SichengZuo" declared "fold:0"
"Yuchun" declared "call:10"
"HakulaPlayer" declared "raise:35"
"Ethan" declared "fold:0"
"YangZ" declared "fold:0"
"Finneas" declared "fold:0"
"Zheng" declared "fold:0"
"RaphaelPlayer" declared "call:35"
"Yuchun" declared "call:35"
Street "flop" started. (community card = ['S2', 'H8', 'C3'])
"RaphaelPlayer" declared "call:0"
"Yuchun" declared "call:0"
"HakulaPlayer" declared "call:0"
Street "turn" started. (community card = ['S2', 'H8', 'C3', 'H4'])
"RaphaelPlayer" declared "call:0"
"Yuchun" declared "call:0"
"HakulaPlayer" declared "call:0"
Street "river" started. (community card = ['S2', 'H8', 'C3', 'H4', 'H9'])
"RaphaelPlayer" declared "call:0"
"Yuchun" declared "call:0"
"HakulaPlayer" declared "call:0"
"['Yuchun']" won the round 15 (stack = {'Zheng': 980, 'RaphaelPlayer': 1730, 'SichengZuo': 970, 'Yuchun': 830, 'HakulaPlayer': 580, 'Ethan': 990, 'YangZ': 970, 'Finneas': 950})
player [Zheng] gets hole card ['SK', 'C3'], current stack 975
player [RaphaelPlayer] gets hole card ['H3', 'CJ'], current stack 1720
player [SichengZuo] gets hole card ['S9', 'HQ'], current stack 970
player [Yuchun] gets hole card ['SA', 'D5'], current stack 830
player [HakulaPlayer] gets hole card ['DQ', 'S5'], current stack 580
player [Ethan] gets hole card ['CK', 'H2'], current stack 990
player [YangZ] gets hole card ['CQ', 'S4'], current stack 970
player [Finneas] gets hole card ['C4', 'H5'], current stack 950
Started the round 16
Street "preflop" started. (community card = [])
"SichengZuo" declared "fold:0"
"Yuchun" declared "call:10"
"HakulaPlayer" declared "call:10"
"Ethan" declared "fold:0"
"YangZ" declared "fold:0"
"Finneas" declared "call:10"
"Zheng" declared "call:10"
"RaphaelPlayer" declared "fold:0"
Street "flop" started. (community card = ['S6', 'HA', 'D6'])
"Zheng" declared "call:0"
"Yuchun" declared "call:0"
"HakulaPlayer" declared "call:0"
"Finneas" declared "call:0"
Street "turn" started. (community card = ['S6', 'HA', 'D6', 'D3'])
"Zheng" declared "call:0"
"Yuchun" declared "call:0"
"HakulaPlayer" declared "call:0"
"Finneas" declared "call:0"
Street "river" started. (community card = ['S6', 'HA', 'D6', 'D3', 'H4'])
"Zheng" declared "call:0"
"Yuchun" declared "call:0"
"HakulaPlayer" declared "call:0"
"Finneas" declared "call:0"
"['Yuchun']" won the round 16 (stack = {'Zheng': 970, 'RaphaelPlayer': 1720, 'SichengZuo': 970, 'Yuchun': 870, 'HakulaPlayer': 570, 'Ethan': 990, 'YangZ': 970, 'Finneas': 940})
player [Zheng] gets hole card ['H7', 'H8'], current stack 970
player [RaphaelPlayer] gets hole card ['D5', 'SQ'], current stack 1715
player [SichengZuo] gets hole card ['D9', 'C9'], current stack 960
player [Yuchun] gets hole card ['S3', 'D3'], current stack 870
player [HakulaPlayer] gets hole card ['H9', 'D2'], current stack 570
player [Ethan] gets hole card ['S4', 'CK'], current stack 990
player [YangZ] gets hole card ['DA', 'HJ'], current stack 970
player [Finneas] gets hole card ['H5', 'DT'], current stack 940
Started the round 17
Street "preflop" started. (community card = [])
"Yuchun" declared "call:10"
"HakulaPlayer" declared "call:10"
"Ethan" declared "fold:0"
"YangZ" declared "fold:0"
"Finneas" declared "call:10"
"Zheng" declared "call:10"
"RaphaelPlayer" declared "fold:0"
"SichengZuo" declared "fold:0"
Street "flop" started. (community card = ['S8', 'SA', 'CQ'])
"Yuchun" declared "call:0"
"HakulaPlayer" declared "call:0"
"Finneas" declared "call:0"
"Zheng" declared "call:0"
Street "turn" started. (community card = ['S8', 'SA', 'CQ', 'D6'])
"Yuchun" declared "call:0"
"HakulaPlayer" declared "call:0"
"Finneas" declared "call:0"
"Zheng" declared "call:0"
Street "river" started. (community card = ['S8', 'SA', 'CQ', 'D6', 'D4'])
"Yuchun" declared "call:0"
"HakulaPlayer" declared "call:0"
"Finneas" declared "call:0"
"Zheng" declared "call:0"
"['Zheng']" won the round 17 (stack = {'Zheng': 1015, 'RaphaelPlayer': 1715, 'SichengZuo': 960, 'Yuchun': 860, 'HakulaPlayer': 560, 'Ethan': 990, 'YangZ': 970, 'Finneas': 930})
player [Zheng] gets hole card ['DQ', 'D6'], current stack 1015
player [RaphaelPlayer] gets hole card ['SK', 'D7'], current stack 1715
player [SichengZuo] gets hole card ['H2', 'S5'], current stack 955
player [Yuchun] gets hole card ['C8', 'CQ'], current stack 850
player [HakulaPlayer] gets hole card ['S7', 'HT'], current stack 560
player [Ethan] gets hole card ['D4', 'C3'], current stack 990
player [YangZ] gets hole card ['H4', 'HJ'], current stack 970
player [Finneas] gets hole card ['H3', 'CA'], current stack 930
Started the round 18
Street "preflop" started. (community card = [])
"HakulaPlayer" declared "fold:0"
"Ethan" declared "fold:0"
"YangZ" declared "fold:0"
"Finneas" declared "call:10"
"Zheng" declared "call:10"
"RaphaelPlayer" declared "call:10"
"SichengZuo" declared "fold:0"
"Yuchun" declared "call:10"
Street "flop" started. (community card = ['D9', 'H6', 'D2'])
"Yuchun" declared "call:0"
"Finneas" declared "call:0"
"Zheng" declared "call:0"
"RaphaelPlayer" declared "call:0"
Street "turn" started. (community card = ['D9', 'H6', 'D2', 'S2'])
"Yuchun" declared "call:0"
"Finneas" declared "call:0"
"Zheng" declared "call:0"
"RaphaelPlayer" declared "call:0"
Street "river" started. (community card = ['D9', 'H6', 'D2', 'S2', 'ST'])
"Yuchun" declared "call:0"
"Finneas" declared "call:0"
"Zheng" declared "call:0"
"RaphaelPlayer" declared "call:0"
"['Zheng']" won the round 18 (stack = {'Zheng': 1050, 'RaphaelPlayer': 1705, 'SichengZuo': 955, 'Yuchun': 850, 'HakulaPlayer': 560, 'Ethan': 990, 'YangZ': 970, 'Finneas': 920})
player [Zheng] gets hole card ['DK', 'C5'], current stack 1050
player [RaphaelPlayer] gets hole card ['D5', 'DT'], current stack 1705
player [SichengZuo] gets hole card ['SQ', 'CT'], current stack 955
player [Yuchun] gets hole card ['HQ', 'S7'], current stack 845
player [HakulaPlayer] gets hole card ['CA', 'C4'], current stack 550
player [Ethan] gets hole card ['S2', 'S6'], current stack 990
player [YangZ] gets hole card ['H9', 'HA'], current stack 970
player [Finneas] gets hole card ['HJ', 'C2'], current stack 920
Started the round 19
Street "preflop" started. (community card = [])
"Ethan" declared "fold:0"
"YangZ" declared "fold:0"
"Finneas" declared "call:10"
"Zheng" declared "call:10"
"RaphaelPlayer" declared "fold:0"
"SichengZuo" declared "fold:0"
"Yuchun" declared "call:10"
"HakulaPlayer" declared "call:10"
Street "flop" started. (community card = ['D7', 'C3', 'H5'])
"Yuchun" declared "call:0"
"HakulaPlayer" declared "call:0"
"Finneas" declared "call:0"
"Zheng" declared "call:0"
Street "turn" started. (community card = ['D7', 'C3', 'H5', 'SA'])
"Yuchun" declared "call:0"
"HakulaPlayer" declared "call:0"
"Finneas" declared "call:0"
"Zheng" declared "call:0"
Street "river" started. (community card = ['D7', 'C3', 'H5', 'SA', 'HT'])
"Yuchun" declared "call:0"
"HakulaPlayer" declared "call:0"
"Finneas" declared "call:0"
"Zheng" declared "call:0"
"['HakulaPlayer']" won the round 19 (stack = {'Zheng': 1040, 'RaphaelPlayer': 1705, 'SichengZuo': 955, 'Yuchun': 840, 'HakulaPlayer': 590, 'Ethan': 990, 'YangZ': 970, 'Finneas': 910})
player [Zheng] gets hole card ['C2', 'CK'], current stack 1040
player [RaphaelPlayer] gets hole card ['D2', 'C8'], current stack 1705
player [SichengZuo] gets hole card ['S5', 'S4'], current stack 955
player [Yuchun] gets hole card ['DJ', 'H9'], current stack 840
player [HakulaPlayer] gets hole card ['DQ', 'H5'], current stack 585
player [Ethan] gets hole card ['S6', 'D8'], current stack 980
player [YangZ] gets hole card ['HT', 'H3'], current stack 970
player [Finneas] gets hole card ['SJ', 'C5'], current stack 910
Started the round 20
Street "preflop" started. (community card = [])
"YangZ" declared "fold:0"
"Finneas" declared "call:10"
"Zheng" declared "call:10"
"RaphaelPlayer" declared "fold:0"
"SichengZuo" declared "fold:0"
"Yuchun" declared "call:10"
"HakulaPlayer" declared "call:10"
"Ethan" declared "fold:0"
Street "flop" started. (community card = ['S2', 'HK', 'D6'])
"HakulaPlayer" declared "call:0"
"Finneas" declared "call:0"
"Zheng" declared "raise:520"
"Yuchun" declared "fold:0"
"HakulaPlayer" declared "fold:0"
"Finneas" declared "fold:0"
"['Zheng']" won the round 20 (stack = {'Zheng': 1080, 'RaphaelPlayer': 1705, 'SichengZuo': 955, 'Yuchun': 830, 'HakulaPlayer': 580, 'Ethan': 980, 'YangZ': 970, 'Finneas': 900})
player [Zheng] gets hole card ['CA', 'CQ'], current stack 1080
player [RaphaelPlayer] gets hole card ['D3', 'D6'], current stack 1705
player [SichengZuo] gets hole card ['DJ', 'S2'], current stack 955
player [Yuchun] gets hole card ['D7', 'D2'], current stack 830
player [HakulaPlayer] gets hole card ['H5', 'S5'], current stack 580
player [Ethan] gets hole card ['HA', 'S8'], current stack 975
player [YangZ] gets hole card ['C5', 'H3'], current stack 960
player [Finneas] gets hole card ['S3', 'D4'], current stack 900
Started the round 21
Street "preflop" started. (community card = [])
"Finneas" declared "call:10"
"Zheng" declared "call:10"
"RaphaelPlayer" declared "fold:0"
"SichengZuo" declared "fold:0"
"Yuchun" declared "call:10"
"HakulaPlayer" declared "raise:40"
"Ethan" declared "fold:0"
"YangZ" declared "fold:0"
"Finneas" declared "fold:0"
"Zheng" declared "call:40"
"Yuchun" declared "call:40"
Street "flop" started. (community card = ['C2', 'ST', 'C4'])
"Zheng" declared "call:0"
"Yuchun" declared "call:0"
"HakulaPlayer" declared "call:0"
Street "turn" started. (community card = ['C2', 'ST', 'C4', 'DQ'])
"Zheng" declared "raise:525"
"Yuchun" declared "fold:0"
"HakulaPlayer" declared "fold:0"
"['Zheng']" won the round 21 (stack = {'Zheng': 1185, 'RaphaelPlayer': 1705, 'SichengZuo': 955, 'Yuchun': 790, 'HakulaPlayer': 540, 'Ethan': 975, 'YangZ': 960, 'Finneas': 890})
player [Zheng] gets hole card ['D2', 'ST'], current stack 1185
player [RaphaelPlayer] gets hole card ['CQ', 'D8'], current stack 1705
player [SichengZuo] gets hole card ['CK', 'H4'], current stack 955
player [Yuchun] gets hole card ['S5', 'H8'], current stack 790
player [HakulaPlayer] gets hole card ['C2', 'DK'], current stack 540
player [Ethan] gets hole card ['SJ', 'SQ'], current stack 975
player [YangZ] gets hole card ['H9', 'DT'], current stack 955
player [Finneas] gets hole card ['D7', 'C6'], current stack 880
Started the round 22
Street "preflop" started. (community card = [])
"Zheng" declared "call:10"
"RaphaelPlayer" declared "call:10"
"SichengZuo" declared "fold:0"
"Yuchun" declared "call:10"
"HakulaPlayer" declared "call:10"
"Ethan" declared "raise:146"
"YangZ" declared "fold:0"
"Finneas" declared "fold:0"
"Zheng" declared "call:146"
"RaphaelPlayer" declared "call:146"
"Yuchun" declared "call:146"
"HakulaPlayer" declared "fold:0"
Street "flop" started. (community card = ['H6', 'D3', 'DQ'])
"Zheng" declared "call:0"
"RaphaelPlayer" declared "call:0"
"Yuchun" declared "call:0"
"Ethan" declared "call:0"
Street "turn" started. (community card = ['H6', 'D3', 'DQ', 'CT'])
"Zheng" declared "call:0"
"RaphaelPlayer" declared "raise:619"
"Yuchun" declared "fold:0"
"Ethan" declared "call:619"
"Zheng" declared "fold:0"
Street "river" started. (community card = ['H6', 'D3', 'DQ', 'CT', 'DJ'])
"RaphaelPlayer" declared "raise:940"
"Ethan" declared "call:940"
"['Ethan']" won the round 22 (stack = {'Zheng': 1039, 'RaphaelPlayer': 730, 'SichengZuo': 955, 'Yuchun': 644, 'HakulaPlayer': 530, 'Ethan': 2267, 'YangZ': 955, 'Finneas': 880})
player [Zheng] gets hole card ['D6', 'CA'], current stack 1029
player [RaphaelPlayer] gets hole card ['SA', 'D2'], current stack 730
player [SichengZuo] gets hole card ['HJ', 'H2'], current stack 955
player [Yuchun] gets hole card ['SQ', 'S5'], current stack 644
player [HakulaPlayer] gets hole card ['S6', 'DK'], current stack 530
player [Ethan] gets hole card ['C6', 'CK'], current stack 2267
player [YangZ] gets hole card ['S4', 'HT'], current stack 955
player [Finneas] gets hole card ['H8', 'H5'], current stack 875
Started the round 23
Street "preflop" started. (community card = [])
"RaphaelPlayer" declared "call:10"
"SichengZuo" declared "fold:0"
"Yuchun" declared "call:10"
"HakulaPlayer" declared "call:10"
"Ethan" declared "fold:0"
"YangZ" declared "fold:0"
"Finneas" declared "call:10"
"Zheng" declared "call:10"
Street "flop" started. (community card = ['D7', 'H7', 'D3'])
"Finneas" declared "call:0"
"Zheng" declared "call:0"
"RaphaelPlayer" declared "call:0"
"Yuchun" declared "call:0"
"HakulaPlayer" declared "call:0"
Street "turn" started. (community card = ['D7', 'H7', 'D3', 'S9'])
"Finneas" declared "call:0"
"Zheng" declared "call:0"
"RaphaelPlayer" declared "call:0"
"Yuchun" declared "call:0"
"HakulaPlayer" declared "raise:23"
"Finneas" declared "fold:0"
"Zheng" declared "call:23"
"RaphaelPlayer" declared "fold:0"
"Yuchun" declared "fold:0"
Street "river" started. (community card = ['D7', 'H7', 'D3', 'S9', 'DQ'])
"Zheng" declared "call:0"
"HakulaPlayer" declared "call:0"
"['Zheng']" won the round 23 (stack = {'Zheng': 1102, 'RaphaelPlayer': 720, 'SichengZuo': 955, 'Yuchun': 634, 'HakulaPlayer': 497, 'Ethan': 2267, 'YangZ': 955, 'Finneas': 870})
player [Zheng] gets hole card ['S4', 'C6'], current stack 1097
player [RaphaelPlayer] gets hole card ['C7', 'CQ'], current stack 710
player [SichengZuo] gets hole card ['S2', 'DQ'], current stack 955
player [Yuchun] gets hole card ['C8', 'H8'], current stack 634
player [HakulaPlayer] gets hole card ['CJ', 'C5'], current stack 497
player [Ethan] gets hole card ['D4', 'C2'], current stack 2267
player [YangZ] gets hole card ['ST', 'CT'], current stack 955
player [Finneas] gets hole card ['D3', 'H5'], current stack 870
Started the round 24
Street "preflop" started. (community card = [])
"SichengZuo" declared "fold:0"
"Yuchun" declared "call:10"
"HakulaPlayer" declared "call:10"
"Ethan" declared "fold:0"
"YangZ" declared "fold:0"
"Finneas" declared "call:10"
"Zheng" declared "call:10"
"RaphaelPlayer" declared "call:10"
Street "flop" started. (community card = ['H2', 'C3', 'HA'])
"Zheng" declared "call:0"
"RaphaelPlayer" declared "call:0"
"Yuchun" declared "call:0"
"HakulaPlayer" declared "call:0"
"Finneas" declared "call:0"
Street "turn" started. (community card = ['H2', 'C3', 'HA', 'S8'])
"Zheng" declared "call:0"
"RaphaelPlayer" declared "call:0"
"Yuchun" declared "raise:40"
"HakulaPlayer" declared "fold:0"
"Finneas" declared "fold:0"
"Zheng" declared "call:40"
"RaphaelPlayer" declared "fold:0"
Street "river" started. (community card = ['H2', 'C3', 'HA', 'S8', 'D2'])
"Zheng" declared "call:0"
"Yuchun" declared "raise:584"
"Zheng" declared "fold:0"
"['Yuchun']" won the round 24 (stack = {'Zheng': 1052, 'RaphaelPlayer': 710, 'SichengZuo': 955, 'Yuchun': 714, 'HakulaPlayer': 487, 'Ethan': 2267, 'YangZ': 955, 'Finneas': 860})
player [Zheng] gets hole card ['CJ', 'HJ'], current stack 1052
player [RaphaelPlayer] gets hole card ['DJ', 'D8'], current stack 705
player [SichengZuo] gets hole card ['H8', 'HK'], current stack 945
player [Yuchun] gets hole card ['H9', 'CA'], current stack 714
player [HakulaPlayer] gets hole card ['CQ', 'C6'], current stack 487
player [Ethan] gets hole card ['C8', 'SQ'], current stack 2267
player [YangZ] gets hole card ['S4', 'SJ'], current stack 955
player [Finneas] gets hole card ['C2', 'H3'], current stack 860
Started the round 25
Street "preflop" started. (community card = [])
"Yuchun" declared "call:10"
"HakulaPlayer" declared "call:10"
"Ethan" declared "fold:0"
"YangZ" declared "fold:0"
"Finneas" declared "call:10"
"Zheng" declared "call:10"
"RaphaelPlayer" declared "call:10"
"SichengZuo" declared "fold:0"
Street "flop" started. (community card = ['DK', 'D2', 'ST'])
"RaphaelPlayer" declared "call:0"
"Yuchun" declared "call:0"
"HakulaPlayer" declared "call:0"
"Finneas" declared "call:0"
"Zheng" declared "call:0"
Street "turn" started. (community card = ['DK', 'D2', 'ST', 'DQ'])
"RaphaelPlayer" declared "raise:70"
"Yuchun" declared "fold:0"
"HakulaPlayer" declared "fold:0"
"Finneas" declared "fold:0"
"Zheng" declared "call:70"
Street "river" started. (community card = ['DK', 'D2', 'ST', 'DQ', 'H4'])
"RaphaelPlayer" declared "raise:210"
"Zheng" declared "fold:0"
"['RaphaelPlayer']" won the round 25 (stack = {'Zheng': 972, 'RaphaelPlayer': 830, 'SichengZuo': 945, 'Yuchun': 704, 'HakulaPlayer': 477, 'Ethan': 2267, 'YangZ': 955, 'Finneas': 850})
player [Zheng] gets hole card ['H9', 'D7'], current stack 972
player [RaphaelPlayer] gets hole card ['H7', 'C2'], current stack 830
player [SichengZuo] gets hole card ['ST', 'D8'], current stack 940
player [Yuchun] gets hole card ['C3', 'H5'], current stack 694
player [HakulaPlayer] gets hole card ['C5', 'SQ'], current stack 477
player [Ethan] gets hole card ['HJ', 'D2'], current stack 2267
player [YangZ] gets hole card ['DQ', 'H3'], current stack 955
player [Finneas] gets hole card ['CQ', 'S4'], current stack 850
Started the round 26
Street "preflop" started. (community card = [])
"HakulaPlayer" declared "fold:0"
"Ethan" declared "fold:0"
"YangZ" declared "fold:0"
"Finneas" declared "call:10"
"Zheng" declared "call:10"
"RaphaelPlayer" declared "fold:0"
"SichengZuo" declared "fold:0"
"Yuchun" declared "call:10"
Street "flop" started. (community card = ['S8', 'D4', 'D6'])
"Yuchun" declared "call:0"
"Finneas" declared "call:0"
"Zheng" declared "call:0"
Street "turn" started. (community card = ['S8', 'D4', 'D6', 'CJ'])
"Yuchun" declared "call:0"
"Finneas" declared "call:0"
"Zheng" declared "call:0"
Street "river" started. (community card = ['S8', 'D4', 'D6', 'CJ', 'C8'])
"Yuchun" declared "call:0"
"Finneas" declared "call:0"
"Zheng" declared "call:0"
"['Finneas']" won the round 26 (stack = {'Zheng': 962, 'RaphaelPlayer': 830, 'SichengZuo': 940, 'Yuchun': 694, 'HakulaPlayer': 477, 'Ethan': 2267, 'YangZ': 955, 'Finneas': 875})
player [Zheng] gets hole card ['S4', 'SA'], current stack 962
player [RaphaelPlayer] gets hole card ['S9', 'DA'], current stack 830
player [SichengZuo] gets hole card ['SJ', 'D7'], current stack 940
player [Yuchun] gets hole card ['CT', 'ST'], current stack 689
player [HakulaPlayer] gets hole card ['H2', 'HJ'], current stack 467
player [Ethan] gets hole card ['DQ', 'CA'], current stack 2267
player [YangZ] gets hole card ['S2', 'H8'], current stack 955
player [Finneas] gets hole card ['HK', 'SK'], current stack 875
Started the round 27
Street "preflop" started. (community card = [])
"Ethan" declared "raise:340"
"YangZ" declared "fold:0"
"Finneas" declared "raise:772"
"Zheng" declared "fold:0"
"RaphaelPlayer" declared "fold:0"
"SichengZuo" declared "fold:0"
"Yuchun" declared "fold:0"
"HakulaPlayer" declared "fold:0"
"Ethan" declared "fold:0"
"['Finneas']" won the round 27 (stack = {'Zheng': 962, 'RaphaelPlayer': 830, 'SichengZuo': 940, 'Yuchun': 689, 'HakulaPlayer': 467, 'Ethan': 1927, 'YangZ': 955, 'Finneas': 1230})
player [Zheng] gets hole card ['H6', 'C9'], current stack 962
player [RaphaelPlayer] gets hole card ['CQ', 'D9'], current stack 830
player [SichengZuo] gets hole card ['HQ', 'CJ'], current stack 940
player [Yuchun] gets hole card ['C4', 'C2'], current stack 689
player [HakulaPlayer] gets hole card ['CA', 'HA'], current stack 462
player [Ethan] gets hole card ['D8', 'S5'], current stack 1917
player [YangZ] gets hole card ['C8', 'D2'], current stack 955
player [Finneas] gets hole card ['DK', 'SA'], current stack 1230
Started the round 28
Street "preflop" started. (community card = [])
"YangZ" declared "fold:0"
"Finneas" declared "raise:622"
"Zheng" declared "fold:0"
"RaphaelPlayer" declared "fold:0"
"SichengZuo" declared "fold:0"
"Yuchun" declared "fold:0"
"HakulaPlayer" declared "fold:0"
"Ethan" declared "fold:0"
"['Finneas']" won the round 28 (stack = {'Zheng': 962, 'RaphaelPlayer': 830, 'SichengZuo': 940, 'Yuchun': 689, 'HakulaPlayer': 462, 'Ethan': 1917, 'YangZ': 955, 'Finneas': 1245})
player [Zheng] gets hole card ['DA', 'D6'], current stack 962
player [RaphaelPlayer] gets hole card ['D9', 'D7'], current stack 830
player [SichengZuo] gets hole card ['CJ', 'D8'], current stack 940
player [Yuchun] gets hole card ['DQ', 'HQ'], current stack 689
player [HakulaPlayer] gets hole card ['ST', 'C8'], current stack 462
player [Ethan] gets hole card ['C4', 'S4'], current stack 1912
player [YangZ] gets hole card ['DK', 'S3'], current stack 945
player [Finneas] gets hole card ['DT', 'SA'], current stack 1245
Started the round 29
Street "preflop" started. (community card = [])
"Finneas" declared "call:10"
"Zheng" declared "call:10"
"RaphaelPlayer" declared "call:10"
"SichengZuo" declared "fold:0"
"Yuchun" declared "call:10"
"HakulaPlayer" declared "call:10"
"Ethan" declared "fold:0"
"YangZ" declared "fold:0"
Street "flop" started. (community card = ['SK', 'S8', 'CQ'])
"Finneas" declared "call:0"
"Zheng" declared "call:0"
"RaphaelPlayer" declared "call:0"
"Yuchun" declared "raise:40"
"HakulaPlayer" declared "fold:0"
"Finneas" declared "fold:0"
"Zheng" declared "call:40"
"RaphaelPlayer" declared "fold:0"
Street "turn" started. (community card = ['SK', 'S8', 'CQ', 'H4'])
"Zheng" declared "call:0"
"Yuchun" declared "raise:639"
"Zheng" declared "fold:0"
"['Yuchun']" won the round 29 (stack = {'Zheng': 912, 'RaphaelPlayer': 820, 'SichengZuo': 940, 'Yuchun': 784, 'HakulaPlayer': 452, 'Ethan': 1912, 'YangZ': 945, 'Finneas': 1235})
player [Zheng] gets hole card ['D6', 'H5'], current stack 912
player [RaphaelPlayer] gets hole card ['S3', 'C2'], current stack 820
player [SichengZuo] gets hole card ['D3', 'HQ'], current stack 940
player [Yuchun] gets hole card ['SA', 'CJ'], current stack 784
player [HakulaPlayer] gets hole card ['DA', 'S6'], current stack 452
player [Ethan] gets hole card ['SJ', 'C9'], current stack 1912
player [YangZ] gets hole card ['SQ', 'SK'], current stack 940
player [Finneas] gets hole card ['S8', 'H9'], current stack 1225
Started the round 30
Street "preflop" started. (community card = [])
"Zheng" declared "call:10"
"RaphaelPlayer" declared "fold:0"
"SichengZuo" declared "fold:0"
"Yuchun" declared "call:10"
"HakulaPlayer" declared "raise:38"
"Ethan" declared "fold:0"
"YangZ" declared "fold:0"
"Finneas" declared "fold:0"
"Zheng" declared "call:38"
"Yuchun" declared "call:38"
Street "flop" started. (community card = ['D7', 'C7', 'H3'])
"Zheng" declared "call:0"
"Yuchun" declared "call:0"
"HakulaPlayer" declared "call:0"
Street "turn" started. (community card = ['D7', 'C7', 'H3', 'DQ'])
"Zheng" declared "call:0"
"Yuchun" declared "call:0"
"HakulaPlayer" declared "call:0"
Street "river" started. (community card = ['D7', 'C7', 'H3', 'DQ', 'D8'])
"Zheng" declared "call:0"
"Yuchun" declared "call:0"
"HakulaPlayer" declared "call:0"
"['Yuchun']" won the round 30 (stack = {'Zheng': 874, 'RaphaelPlayer': 820, 'SichengZuo': 940, 'Yuchun': 875, 'HakulaPlayer': 414, 'Ethan': 1912, 'YangZ': 940, 'Finneas': 1225})
player [Zheng] gets hole card ['SJ', 'D6'], current stack 864
player [RaphaelPlayer] gets hole card ['DT', 'HJ'], current stack 820
player [SichengZuo] gets hole card ['S3', 'S5'], current stack 940
player [Yuchun] gets hole card ['DQ', 'SK'], current stack 875
player [HakulaPlayer] gets hole card ['S8', 'D8'], current stack 414
player [Ethan] gets hole card ['SQ', 'C4'], current stack 1912
player [YangZ] gets hole card ['HK', 'H8'], current stack 940
player [Finneas] gets hole card ['ST', 'C7'], current stack 1220
Started the round 31
Street "preflop" started. (community card = [])
"RaphaelPlayer" declared "call:10"
"SichengZuo" declared "fold:0"
"Yuchun" declared "call:10"
"HakulaPlayer" declared "raise:39"
"Ethan" declared "fold:0"
"YangZ" declared "fold:0"
"Finneas" declared "fold:0"
"Zheng" declared "call:39"
"RaphaelPlayer" declared "call:39"
"Yuchun" declared "call:39"
Street "flop" started. (community card = ['S4', 'S2', 'DJ'])
"Zheng" declared "call:0"
"RaphaelPlayer" declared "call:0"
"Yuchun" declared "call:0"
"HakulaPlayer" declared "raise:104"
"Zheng" declared "call:104"
"RaphaelPlayer" declared "call:104"
"Yuchun" declared "fold:0"
Street "turn" started. (community card = ['S4', 'S2', 'DJ', 'H7'])
"Zheng" declared "call:0"
"RaphaelPlayer" declared "raise:483"
"HakulaPlayer" declared "call:483"
"Zheng" declared "fold:0"
Street "river" started. (community card = ['S4', 'S2', 'DJ', 'H7', 'C9'])
"['RaphaelPlayer']" won the round 31 (stack = {'Zheng': 731, 'RaphaelPlayer': 1421, 'SichengZuo': 940, 'Yuchun': 836, 'HakulaPlayer': 0, 'Ethan': 1912, 'YangZ': 940, 'Finneas': 1220})
player [Zheng] gets hole card ['C9', 'S3'], current stack 726
player [RaphaelPlayer] gets hole card ['S5', 'CQ'], current stack 1411
player [SichengZuo] gets hole card ['H3', 'SJ'], current stack 940
player [Yuchun] gets hole card ['CK', 'C8'], current stack 836
player [Ethan] gets hole card ['D5', 'H8'], current stack 1912
player [YangZ] gets hole card ['SK', 'S4'], current stack 940
player [Finneas] gets hole card ['D3', 'C6'], current stack 1220
Started the round 32
Street "preflop" started. (community card = [])
"SichengZuo" declared "fold:0"
"Yuchun" declared "call:10"
"Ethan" declared "fold:0"
"YangZ" declared "fold:0"
"Finneas" declared "call:10"
"Zheng" declared "call:10"
"RaphaelPlayer" declared "call:10"
Street "flop" started. (community card = ['C7', 'D9', 'HJ'])
"Zheng" declared "call:0"
"RaphaelPlayer" declared "call:0"
"Yuchun" declared "call:0"
"Finneas" declared "call:0"
Street "turn" started. (community card = ['C7', 'D9', 'HJ', 'S2'])
"Zheng" declared "call:0"
"RaphaelPlayer" declared "call:0"
"Yuchun" declared "call:0"
"Finneas" declared "call:0"
Street "river" started. (community card = ['C7', 'D9', 'HJ', 'S2', 'S9'])
"Zheng" declared "raise:365"
"RaphaelPlayer" declared "fold:0"
"Yuchun" declared "fold:0"
"Finneas" declared "fold:0"
"['Zheng']" won the round 32 (stack = {'Zheng': 761, 'RaphaelPlayer': 1411, 'SichengZuo': 940, 'Yuchun': 826, 'HakulaPlayer': 0, 'Ethan': 1912, 'YangZ': 940, 'Finneas': 1210})
player [Zheng] gets hole card ['D4', 'C5'], current stack 761
player [RaphaelPlayer] gets hole card ['S8', 'SA'], current stack 1406
player [SichengZuo] gets hole card ['HJ', 'H8'], current stack 930
player [Yuchun] gets hole card ['D2', 'CT'], current stack 826
player [Ethan] gets hole card ['HQ', 'CK'], current stack 1912
player [YangZ] gets hole card ['H3', 'H4'], current stack 940
player [Finneas] gets hole card ['C7', 'D7'], current stack 1210
Started the round 33
Street "preflop" started. (community card = [])
"Yuchun" declared "call:10"
"Ethan" declared "raise:286"
"YangZ" declared "fold:0"
"Finneas" declared "fold:0"
"Zheng" declared "fold:0"
"RaphaelPlayer" declared "fold:0"
"SichengZuo" declared "fold:0"
"Yuchun" declared "fold:0"
"['Ethan']" won the round 33 (stack = {'Zheng': 761, 'RaphaelPlayer': 1406, 'SichengZuo': 930, 'Yuchun': 816, 'HakulaPlayer': 0, 'Ethan': 1937, 'YangZ': 940, 'Finneas': 1210})
player [Zheng] gets hole card ['DJ', 'C6'], current stack 761
player [RaphaelPlayer] gets hole card ['S6', 'DK'], current stack 1406
player [SichengZuo] gets hole card ['S5', 'D4'], current stack 925
player [Yuchun] gets hole card ['DQ', 'C3'], current stack 806
player [Ethan] gets hole card ['S9', 'HT'], current stack 1937
player [YangZ] gets hole card ['D2', 'DA'], current stack 940
player [Finneas] gets hole card ['H9', 'HK'], current stack 1210
Started the round 34
Street "preflop" started. (community card = [])
"Ethan" declared "fold:0"
"YangZ" declared "fold:0"
"Finneas" declared "call:10"
"Zheng" declared "call:10"
"RaphaelPlayer" declared "call:10"
"SichengZuo" declared "fold:0"
"Yuchun" declared "call:10"
Street "flop" started. (community card = ['SJ', 'H5', 'C8'])
"Yuchun" declared "call:0"
"Finneas" declared "call:0"
"Zheng" declared "call:0"
"RaphaelPlayer" declared "call:0"
Street "turn" started. (community card = ['SJ', 'H5', 'C8', 'C5'])
"Yuchun" declared "call:0"
"Finneas" declared "call:0"
"Zheng" declared "call:0"
"RaphaelPlayer" declared "call:0"
Street "river" started. (community card = ['SJ', 'H5', 'C8', 'C5', 'SA'])
"Yuchun" declared "call:0"
"Finneas" declared "call:0"
"Zheng" declared "call:0"
"RaphaelPlayer" declared "call:0"
"['Zheng']" won the round 34 (stack = {'Zheng': 796, 'RaphaelPlayer': 1396, 'SichengZuo': 925, 'Yuchun': 806, 'HakulaPlayer': 0, 'Ethan': 1937, 'YangZ': 940, 'Finneas': 1200})
player [Zheng] gets hole card ['S9', 'D6'], current stack 796
player [RaphaelPlayer] gets hole card ['C6', 'D3'], current stack 1396
player [SichengZuo] gets hole card ['D7', 'D4'], current stack 925
player [Yuchun] gets hole card ['S6', 'H4'], current stack 801
player [Ethan] gets hole card ['H8', 'S5'], current stack 1927
player [YangZ] gets hole card ['DJ', 'CK'], current stack 940
player [Finneas] gets hole card ['D8', 'S8'], current stack 1200
Started the round 35
Street "preflop" started. (community card = [])
"YangZ" declared "fold:0"
"Finneas" declared "call:10"
"Zheng" declared "call:10"
"RaphaelPlayer" declared "fold:0"
"SichengZuo" declared "fold:0"
"Yuchun" declared "call:10"
"Ethan" declared "fold:0"
Street "flop" started. (community card = ['H6', 'C8', 'S7'])
"Yuchun" declared "call:0"
"Finneas" declared "raise:600"
"Zheng" declared "fold:0"
"Yuchun" declared "fold:0"
"['Finneas']" won the round 35 (stack = {'Zheng': 786, 'RaphaelPlayer': 1396, 'SichengZuo': 925, 'Yuchun': 796, 'HakulaPlayer': 0, 'Ethan': 1927, 'YangZ': 940, 'Finneas': 1230})
player [Zheng] gets hole card ['H9', 'HJ'], current stack 786
player [RaphaelPlayer] gets hole card ['C9', 'S7'], current stack 1396
player [SichengZuo] gets hole card ['DK', 'C2'], current stack 925
player [Yuchun] gets hole card ['SQ', 'C8'], current stack 796
player [Ethan] gets hole card ['DT', 'H7'], current stack 1922
player [YangZ] gets hole card ['DJ', 'D9'], current stack 930
player [Finneas] gets hole card ['D7', 'SK'], current stack 1230
Started the round 36
Street "preflop" started. (community card = [])
"Finneas" declared "call:10"
"Zheng" declared "call:10"
"RaphaelPlayer" declared "fold:0"
"SichengZuo" declared "fold:0"
"Yuchun" declared "call:10"
"Ethan" declared "fold:0"
"YangZ" declared "fold:0"
Street "flop" started. (community card = ['D4', 'CA', 'SA'])
"Finneas" declared "call:0"
"Zheng" declared "call:0"
"Yuchun" declared "call:0"
Street "turn" started. (community card = ['D4', 'CA', 'SA', 'CT'])
"Finneas" declared "call:0"
"Zheng" declared "call:0"
"Yuchun" declared "call:0"
Street "river" started. (community card = ['D4', 'CA', 'SA', 'CT', 'CK'])
"Finneas" declared "call:0"
"Zheng" declared "call:0"
"Yuchun" declared "call:0"
"['Finneas']" won the round 36 (stack = {'Zheng': 776, 'RaphaelPlayer': 1396, 'SichengZuo': 925, 'Yuchun': 786, 'HakulaPlayer': 0, 'Ethan': 1922, 'YangZ': 930, 'Finneas': 1265})
player [Zheng] gets hole card ['D2', 'C7'], current stack 776
player [RaphaelPlayer] gets hole card ['S5', 'H7'], current stack 1396
player [SichengZuo] gets hole card ['DK', 'D7'], current stack 925
player [Yuchun] gets hole card ['C3', 'CJ'], current stack 786
player [Ethan] gets hole card ['C6', 'C4'], current stack 1922
player [YangZ] gets hole card ['S4', 'SA'], current stack 925
player [Finneas] gets hole card ['CK', 'S9'], current stack 1255
Started the round 37
Street "preflop" started. (community card = [])
"Zheng" declared "call:10"
"RaphaelPlayer" declared "fold:0"
"SichengZuo" declared "fold:0"
"Yuchun" declared "call:10"
"Ethan" declared "fold:0"
"YangZ" declared "fold:0"
"Finneas" declared "call:10"
Street "flop" started. (community card = ['D5', 'SJ', 'C8'])
"Finneas" declared "call:0"
"Zheng" declared "call:0"
"Yuchun" declared "call:0"
Street "turn" started. (community card = ['D5', 'SJ', 'C8', 'D8'])
"Finneas" declared "call:0"
"Zheng" declared "call:0"
"Yuchun" declared "call:0"
Street "river" started. (community card = ['D5', 'SJ', 'C8', 'D8', 'S2'])
"Finneas" declared "call:0"
"Zheng" declared "call:0"
"Yuchun" declared "call:0"
"['Yuchun']" won the round 37 (stack = {'Zheng': 766, 'RaphaelPlayer': 1396, 'SichengZuo': 925, 'Yuchun': 811, 'HakulaPlayer': 0, 'Ethan': 1922, 'YangZ': 925, 'Finneas': 1255})
player [Zheng] gets hole card ['D4', 'S4'], current stack 756
player [RaphaelPlayer] gets hole card ['C7', 'DK'], current stack 1396
player [SichengZuo] gets hole card ['H9', 'D6'], current stack 925
player [Yuchun] gets hole card ['D2', 'CT'], current stack 811
player [Ethan] gets hole card ['H2', 'S6'], current stack 1922
player [YangZ] gets hole card ['HQ', 'SQ'], current stack 925
player [Finneas] gets hole card ['D7', 'C4'], current stack 1250
Started the round 38
Street "preflop" started. (community card = [])
"RaphaelPlayer" declared "call:10"
"SichengZuo" declared "fold:0"
"Yuchun" declared "call:10"
"Ethan" declared "fold:0"
"YangZ" declared "fold:0"
"Finneas" declared "call:10"
"Zheng" declared "call:10"
Street "flop" started. (community card = ['C5', 'C6', 'C3'])
"Finneas" declared "call:0"
"Zheng" declared "call:0"
"RaphaelPlayer" declared "call:0"
"Yuchun" declared "call:0"
Street "turn" started. (community card = ['C5', 'C6', 'C3', 'D8'])
"Finneas" declared "call:0"
"Zheng" declared "call:0"
"RaphaelPlayer" declared "call:0"
"Yuchun" declared "call:0"
Street "river" started. (community card = ['C5', 'C6', 'C3', 'D8', 'H8'])
"Finneas" declared "call:0"
"Zheng" declared "call:0"
"RaphaelPlayer" declared "call:0"
"Yuchun" declared "call:0"
"['Finneas']" won the round 38 (stack = {'Zheng': 756, 'RaphaelPlayer': 1386, 'SichengZuo': 925, 'Yuchun': 801, 'HakulaPlayer': 0, 'Ethan': 1922, 'YangZ': 925, 'Finneas': 1285})
player [Zheng] gets hole card ['S6', 'H3'], current stack 751
player [RaphaelPlayer] gets hole card ['D9', 'H4'], current stack 1376
player [SichengZuo] gets hole card ['CJ', 'HJ'], current stack 925
player [Yuchun] gets hole card ['H2', 'HA'], current stack 801
player [Ethan] gets hole card ['DQ', 'S5'], current stack 1922
player [YangZ] gets hole card ['S2', 'C8'], current stack 925
player [Finneas] gets hole card ['C7', 'C9'], current stack 1285
Started the round 39
Street "preflop" started. (community card = [])
"SichengZuo" declared "fold:0"
"Yuchun" declared "call:10"
"Ethan" declared "fold:0"
"YangZ" declared "fold:0"
"Finneas" declared "call:10"
"Zheng" declared "call:10"
"RaphaelPlayer" declared "fold:0"
Street "flop" started. (community card = ['SQ', 'H7', 'C6'])
"Zheng" declared "call:0"
"Yuchun" declared "call:0"
"Finneas" declared "call:0"
Street "turn" started. (community card = ['SQ', 'H7', 'C6', 'D7'])
"Zheng" declared "call:0"
"Yuchun" declared "call:0"
"Finneas" declared "raise:642"
"Zheng" declared "fold:0"
"Yuchun" declared "fold:0"
"['Finneas']" won the round 39 (stack = {'Zheng': 746, 'RaphaelPlayer': 1376, 'SichengZuo': 925, 'Yuchun': 791, 'HakulaPlayer': 0, 'Ethan': 1922, 'YangZ': 925, 'Finneas': 1315})
player [Zheng] gets hole card ['CA', 'CT'], current stack 746
player [RaphaelPlayer] gets hole card ['C2', 'H4'], current stack 1371
player [SichengZuo] gets hole card ['HA', 'H5'], current stack 915
player [Yuchun] gets hole card ['S4', 'H3'], current stack 791
player [Ethan] gets hole card ['DT', 'S5'], current stack 1922
player [YangZ] gets hole card ['D7', 'D3'], current stack 925
player [Finneas] gets hole card ['ST', 'DA'], current stack 1315
Started the round 40
Street "preflop" started. (community card = [])
"Yuchun" declared "call:10"
"Ethan" declared "fold:0"
"YangZ" declared "fold:0"
"Finneas" declared "call:10"
"Zheng" declared "call:10"
"RaphaelPlayer" declared "fold:0"
"SichengZuo" declared "fold:0"
Street "flop" started. (community card = ['D2', 'DQ', 'S7'])
"Yuchun" declared "call:0"
"Finneas" declared "call:0"
"Zheng" declared "call:0"
Street "turn" started. (community card = ['D2', 'DQ', 'S7', 'D9'])
"Yuchun" declared "call:0"
"Finneas" declared "call:0"
"Zheng" declared "call:0"
Street "river" started. (community card = ['D2', 'DQ', 'S7', 'D9', 'C9'])
"Yuchun" declared "call:0"
"Finneas" declared "call:0"
"Zheng" declared "call:0"
"['Zheng', 'Finneas']" won the round 40 (stack = {'Zheng': 758, 'RaphaelPlayer': 1371, 'SichengZuo': 915, 'Yuchun': 781, 'HakulaPlayer': 0, 'Ethan': 1922, 'YangZ': 925, 'Finneas': 1327})
player [Zheng] gets hole card ['H4', 'S4'], current stack 758
player [RaphaelPlayer] gets hole card ['D9', 'D3'], current stack 1371
player [SichengZuo] gets hole card ['SA', 'C2'], current stack 910
player [Yuchun] gets hole card ['ST', 'C5'], current stack 771
player [Ethan] gets hole card ['H2', 'S7'], current stack 1922
player [YangZ] gets hole card ['D8', 'HT'], current stack 925
player [Finneas] gets hole card ['H5', 'HJ'], current stack 1327
Started the round 41
Street "preflop" started. (community card = [])
"Ethan" declared "fold:0"
"YangZ" declared "fold:0"
"Finneas" declared "call:10"
"Zheng" declared "call:10"
"RaphaelPlayer" declared "fold:0"
"SichengZuo" declared "fold:0"
"Yuchun" declared "fold:0"
Street "flop" started. (community card = ['SQ', 'C6', 'H6'])
"Finneas" declared "call:0"
"Zheng" declared "call:0"
Street "turn" started. (community card = ['SQ', 'C6', 'H6', 'D7'])
"Finneas" declared "call:0"
"Zheng" declared "call:0"
Street "river" started. (community card = ['SQ', 'C6', 'H6', 'D7', 'CA'])
"Finneas" declared "call:0"
"Zheng" declared "call:0"
"['Zheng']" won the round 41 (stack = {'Zheng': 783, 'RaphaelPlayer': 1371, 'SichengZuo': 910, 'Yuchun': 771, 'HakulaPlayer': 0, 'Ethan': 1922, 'YangZ': 925, 'Finneas': 1317})
player [Zheng] gets hole card ['ST', 'H2'], current stack 783
player [RaphaelPlayer] gets hole card ['HQ', 'C2'], current stack 1371
player [SichengZuo] gets hole card ['HJ', 'DJ'], current stack 910
player [Yuchun] gets hole card ['S2', 'S4'], current stack 766
player [Ethan] gets hole card ['C5', 'DK'], current stack 1912
player [YangZ] gets hole card ['D7', 'C7'], current stack 925
player [Finneas] gets hole card ['H9', 'CT'], current stack 1317
Started the round 42
Street "preflop" started. (community card = [])
"YangZ" declared "fold:0"
"Finneas" declared "call:10"
"Zheng" declared "call:10"
"RaphaelPlayer" declared "fold:0"
"SichengZuo" declared "fold:0"
"Yuchun" declared "fold:0"
"Ethan" declared "fold:0"
Street "flop" started. (community card = ['CK', 'S7', 'DA'])
"Finneas" declared "call:0"
"Zheng" declared "call:0"
Street "turn" started. (community card = ['CK', 'S7', 'DA', 'D6'])
"Finneas" declared "call:0"
"Zheng" declared "call:0"
Street "river" started. (community card = ['CK', 'S7', 'DA', 'D6', 'HA'])
"Finneas" declared "call:0"
"Zheng" declared "call:0"
"['Finneas']" won the round 42 (stack = {'Zheng': 773, 'RaphaelPlayer': 1371, 'SichengZuo': 910, 'Yuchun': 766, 'HakulaPlayer': 0, 'Ethan': 1912, 'YangZ': 925, 'Finneas': 1342})
player [Zheng] gets hole card ['SA', 'HJ'], current stack 773
player [RaphaelPlayer] gets hole card ['CQ', 'C7'], current stack 1371
player [SichengZuo] gets hole card ['D8', 'D4'], current stack 910
player [Yuchun] gets hole card ['ST', 'HT'], current stack 766
player [Ethan] gets hole card ['H8', 'CA'], current stack 1907
player [YangZ] gets hole card ['SJ', 'CT'], current stack 915
player [Finneas] gets hole card ['SK', 'D7'], current stack 1342
Started the round 43
Street "preflop" started. (community card = [])
"Finneas" declared "call:10"
"Zheng" declared "call:10"
"RaphaelPlayer" declared "call:10"
"SichengZuo" declared "fold:0"
"Yuchun" declared "fold:0"
"Ethan" declared "fold:0"
"YangZ" declared "fold:0"
Street "flop" started. (community card = ['H3', 'S6', 'H4'])
"Finneas" declared "call:0"
"Zheng" declared "call:0"
"RaphaelPlayer" declared "call:0"
Street "turn" started. (community card = ['H3', 'S6', 'H4', 'S2'])
"Finneas" declared "call:0"
"Zheng" declared "call:0"
"RaphaelPlayer" declared "call:0"
Street "river" started. (community card = ['H3', 'S6', 'H4', 'S2', 'S7'])
"Finneas" declared "call:0"
"Zheng" declared "call:0"
"RaphaelPlayer" declared "call:0"
"['Finneas']" won the round 43 (stack = {'Zheng': 763, 'RaphaelPlayer': 1361, 'SichengZuo': 910, 'Yuchun': 766, 'HakulaPlayer': 0, 'Ethan': 1907, 'YangZ': 915, 'Finneas': 1377})
player [Zheng] gets hole card ['DJ', 'DA'], current stack 763
player [RaphaelPlayer] gets hole card ['H8', 'S9'], current stack 1361
player [SichengZuo] gets hole card ['H7', 'CK'], current stack 910
player [Yuchun] gets hole card ['D6', 'HJ'], current stack 766
player [Ethan] gets hole card ['HK', 'H9'], current stack 1907
player [YangZ] gets hole card ['C9', 'DT'], current stack 910
player [Finneas] gets hole card ['S6', 'D3'], current stack 1367
Started the round 44
Street "preflop" started. (community card = [])
"Zheng" declared "call:10"
"RaphaelPlayer" declared "call:10"
"SichengZuo" declared "fold:0"
"Yuchun" declared "fold:0"
"Ethan" declared "fold:0"
"YangZ" declared "fold:0"
"Finneas" declared "call:10"
Street "flop" started. (community card = ['D9', 'S5', 'HA'])
"Finneas" declared "call:0"
"Zheng" declared "call:0"
"RaphaelPlayer" declared "raise:45"
"Finneas" declared "fold:0"
"Zheng" declared "raise:421"
"RaphaelPlayer" declared "call:421"
Street "turn" started. (community card = ['D9', 'S5', 'HA', 'CA'])
"Zheng" declared "raise:332"
"RaphaelPlayer" declared "raise:930"
Street "river" started. (community card = ['D9', 'S5', 'HA', 'CA', 'C4'])
"['Zheng']" won the round 44 (stack = {'Zheng': 1541, 'RaphaelPlayer': 598, 'SichengZuo': 910, 'Yuchun': 766, 'HakulaPlayer': 0, 'Ethan': 1907, 'YangZ': 910, 'Finneas': 1367})
player [Zheng] gets hole card ['D3', 'D5'], current stack 1531
player [RaphaelPlayer] gets hole card ['CA', 'HQ'], current stack 598
player [SichengZuo] gets hole card ['H3', 'HJ'], current stack 910
player [Yuchun] gets hole card ['H8', 'DK'], current stack 766
player [Ethan] gets hole card ['H2', 'DT'], current stack 1907
player [YangZ] gets hole card ['H7', 'C3'], current stack 910
player [Finneas] gets hole card ['H6', 'C8'], current stack 1362
Started the round 45
Street "preflop" started. (community card = [])
"RaphaelPlayer" declared "raise:30"
"SichengZuo" declared "fold:0"
"Yuchun" declared "fold:0"
"Ethan" declared "fold:0"
"YangZ" declared "fold:0"
"Finneas" declared "fold:0"
"Zheng" declared "call:30"
Street "flop" started. (community card = ['S2', 'S3', 'S4'])
"Zheng" declared "call:0"
"RaphaelPlayer" declared "call:0"
Street "turn" started. (community card = ['S2', 'S3', 'S4', 'CK'])
"Zheng" declared "call:0"
"RaphaelPlayer" declared "call:0"
Street "river" started. (community card = ['S2', 'S3', 'S4', 'CK', 'H5'])
"Zheng" declared "call:0"
"RaphaelPlayer" declared "raise:75"
"Zheng" declared "call:75"
"['RaphaelPlayer']" won the round 45 (stack = {'Zheng': 1436, 'RaphaelPlayer': 708, 'SichengZuo': 910, 'Yuchun': 766, 'HakulaPlayer': 0, 'Ethan': 1907, 'YangZ': 910, 'Finneas': 1362})
player [Zheng] gets hole card ['S9', 'D8'], current stack 1431
player [RaphaelPlayer] gets hole card ['CQ', 'H7'], current stack 698
player [SichengZuo] gets hole card ['SA', 'S5'], current stack 910
player [Yuchun] gets hole card ['DT', 'HJ'], current stack 766
player [Ethan] gets hole card ['HA', 'CT'], current stack 1907
player [YangZ] gets hole card ['ST', 'S4'], current stack 910
player [Finneas] gets hole card ['SJ', 'S3'], current stack 1362
Started the round 46
Street "preflop" started. (community card = [])
"SichengZuo" declared "fold:0"
"Yuchun" declared "fold:0"
"Ethan" declared "call:10"
"YangZ" declared "fold:0"
"Finneas" declared "call:10"
"Zheng" declared "call:10"
"RaphaelPlayer" declared "call:10"
Street "flop" started. (community card = ['H4', 'CK', 'DJ'])
"Zheng" declared "call:0"
"RaphaelPlayer" declared "call:0"
"Ethan" declared "call:0"
"Finneas" declared "call:0"
Street "turn" started. (community card = ['H4', 'CK', 'DJ', 'D3'])
"Zheng" declared "call:0"
"RaphaelPlayer" declared "call:0"
"Ethan" declared "call:0"
"Finneas" declared "call:0"
Street "river" started. (community card = ['H4', 'CK', 'DJ', 'D3', 'D6'])
"Zheng" declared "call:0"
"RaphaelPlayer" declared "call:0"
"Ethan" declared "call:0"
"Finneas" declared "call:0"
"['Finneas']" won the round 46 (stack = {'Zheng': 1426, 'RaphaelPlayer': 698, 'SichengZuo': 910, 'Yuchun': 766, 'HakulaPlayer': 0, 'Ethan': 1897, 'YangZ': 910, 'Finneas': 1392})
player [Zheng] gets hole card ['ST', 'DJ'], current stack 1426
player [RaphaelPlayer] gets hole card ['H7', 'S6'], current stack 693
player [SichengZuo] gets hole card ['S3', 'DK'], current stack 900
player [Yuchun] gets hole card ['H4', 'DQ'], current stack 766
player [Ethan] gets hole card ['H8', 'S9'], current stack 1897
player [YangZ] gets hole card ['C7', 'HK'], current stack 910
player [Finneas] gets hole card ['C2', 'D2'], current stack 1392
Started the round 47
Street "preflop" started. (community card = [])
"Yuchun" declared "fold:0"
"Ethan" declared "fold:0"
"YangZ" declared "fold:0"
"Finneas" declared "call:10"
"Zheng" declared "call:10"
"RaphaelPlayer" declared "fold:0"
"SichengZuo" declared "fold:0"
Street "flop" started. (community card = ['CT', 'H3', 'SJ'])
"Finneas" declared "call:0"
"Zheng" declared "raise:713"
"Finneas" declared "fold:0"
"['Zheng']" won the round 47 (stack = {'Zheng': 1451, 'RaphaelPlayer': 693, 'SichengZuo': 900, 'Yuchun': 766, 'HakulaPlayer': 0, 'Ethan': 1897, 'YangZ': 910, 'Finneas': 1382})
player [Zheng] gets hole card ['S7', 'C6'], current stack 1451
player [RaphaelPlayer] gets hole card ['D4', 'H7'], current stack 693
player [SichengZuo] gets hole card ['C8', 'S3'], current stack 895
player [Yuchun] gets hole card ['DT', 'S4'], current stack 756
player [Ethan] gets hole card ['CT', 'DQ'], current stack 1897
player [YangZ] gets hole card ['DA', 'C3'], current stack 910
player [Finneas] gets hole card ['S9', 'CJ'], current stack 1382
Started the round 48
Street "preflop" started. (community card = [])
"Ethan" declared "fold:0"
"YangZ" declared "fold:0"
"Finneas" declared "call:10"
"Zheng" declared "call:10"
"RaphaelPlayer" declared "fold:0"
"SichengZuo" declared "fold:0"
"Yuchun" declared "fold:0"
Street "flop" started. (community card = ['SA', 'DK', 'C2'])
"Finneas" declared "call:0"
"Zheng" declared "call:0"
Street "turn" started. (community card = ['SA', 'DK', 'C2', 'ST'])
"Finneas" declared "call:0"
"Zheng" declared "call:0"
Street "river" started. (community card = ['SA', 'DK', 'C2', 'ST', 'H3'])
"Finneas" declared "call:0"
"Zheng" declared "call:0"
"['Finneas']" won the round 48 (stack = {'Zheng': 1441, 'RaphaelPlayer': 693, 'SichengZuo': 895, 'Yuchun': 756, 'HakulaPlayer': 0, 'Ethan': 1897, 'YangZ': 910, 'Finneas': 1407})
player [Zheng] gets hole card ['H9', 'D9'], current stack 1441
player [RaphaelPlayer] gets hole card ['S6', 'SQ'], current stack 693
player [SichengZuo] gets hole card ['D5', 'SJ'], current stack 895
player [Yuchun] gets hole card ['H5', 'S8'], current stack 751
player [Ethan] gets hole card ['S7', 'H7'], current stack 1887
player [YangZ] gets hole card ['D4', 'CQ'], current stack 910
player [Finneas] gets hole card ['H2', 'HA'], current stack 1407
Started the round 49
Street "preflop" started. (community card = [])
"YangZ" declared "fold:0"
"Finneas" declared "call:10"
"Zheng" declared "call:10"
"RaphaelPlayer" declared "call:10"
"SichengZuo" declared "fold:0"
"Yuchun" declared "fold:0"
"Ethan" declared "fold:0"
Street "flop" started. (community card = ['C3', 'C2', 'D7'])
"Finneas" declared "call:0"
"Zheng" declared "call:0"
"RaphaelPlayer" declared "call:0"
Street "turn" started. (community card = ['C3', 'C2', 'D7', 'DT'])
"Finneas" declared "call:0"
"Zheng" declared "call:0"
"RaphaelPlayer" declared "call:0"
Street "river" started. (community card = ['C3', 'C2', 'D7', 'DT', 'H6'])
"Finneas" declared "call:0"
"Zheng" declared "call:0"
"RaphaelPlayer" declared "call:0"
"['Zheng']" won the round 49 (stack = {'Zheng': 1476, 'RaphaelPlayer': 683, 'SichengZuo': 895, 'Yuchun': 751, 'HakulaPlayer': 0, 'Ethan': 1887, 'YangZ': 910, 'Finneas': 1397})
player [Zheng] gets hole card ['HQ', 'CA'], current stack 1476
player [RaphaelPlayer] gets hole card ['CJ', 'C8'], current stack 683
player [SichengZuo] gets hole card ['D5', 'C6'], current stack 895
player [Yuchun] gets hole card ['H9', 'H2'], current stack 751
player [Ethan] gets hole card ['S7', 'HT'], current stack 1882
player [YangZ] gets hole card ['H6', 'H4'], current stack 900
player [Finneas] gets hole card ['CT', 'S4'], current stack 1397
Started the round 50
Street "preflop" started. (community card = [])
"Finneas" declared "call:10"
"Zheng" declared "call:10"
"RaphaelPlayer" declared "call:10"
"SichengZuo" declared "fold:0"
"Yuchun" declared "fold:0"
"Ethan" declared "fold:0"
"YangZ" declared "fold:0"
Street "flop" started. (community card = ['SQ', 'SA', 'S6'])
"Finneas" declared "call:0"
"Zheng" declared "call:0"
"RaphaelPlayer" declared "call:0"
Street "turn" started. (community card = ['SQ', 'SA', 'S6', 'DT'])
"Finneas" declared "call:0"
"Zheng" declared "call:0"
"RaphaelPlayer" declared "call:0"
Street "river" started. (community card = ['SQ', 'SA', 'S6', 'DT', 'ST'])
"Finneas" declared "raise:698"
"Zheng" declared "fold:0"
"RaphaelPlayer" declared "fold:0"
"['Finneas']" won the round 50 (stack = {'Zheng': 1466, 'RaphaelPlayer': 673, 'SichengZuo': 895, 'Yuchun': 751, 'HakulaPlayer': 0, 'Ethan': 1882, 'YangZ': 900, 'Finneas': 1432})

Game Results:
------------------------------------------------------------
Game 1:
Winner: Ethan (stack: 1882)
All players' stacks:
  Zheng: 1466
  RaphaelPlayer: 673
  SichengZuo: 895
  Yuchun: 751
  HakulaPlayer: 0
  Ethan: 1882
  YangZ: 900
  Finneas: 1432
------------------------------------------------------------
