player [Zheng] gets hole card ['D9', 'SK'], current stack 1000
player [RaphaelPlayer] gets hole card ['ST', 'H3'], current stack 995
player [SichengZuo] gets hole card ['C7', 'C2'], current stack 990
player [Yuchun] gets hole card ['D5', 'S6'], current stack 1000
player [HakulaPlayer] gets hole card ['HJ', 'HK'], current stack 1000
player [Ethan] gets hole card ['D2', 'S5'], current stack 1000
player [YangZ] gets hole card ['DQ', 'C9'], current stack 1000
player [Finneas] gets hole card ['H6', 'S4'], current stack 1000
Started the round 1
Street "preflop" started. (community card = [])
"Yuchun" declared "fold:0"
"HakulaPlayer" declared "call:10"
"Ethan" declared "fold:0"
"YangZ" declared "fold:0"
"Finneas" declared "call:10"
"Zheng" declared "call:10"
"RaphaelPlayer" declared "fold:0"
"SichengZuo" declared "fold:0"
Street "flop" started. (community card = ['DJ', 'HT', 'D7'])
"HakulaPlayer" declared "call:0"
"Finneas" declared "call:0"
"Zheng" declared "call:0"
Street "turn" started. (community card = ['DJ', 'HT', 'D7', 'S9'])
"HakulaPlayer" declared "call:0"
"Finneas" declared "call:0"
"Zheng" declared "call:0"
Street "river" started. (community card = ['DJ', 'HT', 'D7', 'S9', 'C6'])
"HakulaPlayer" declared "call:0"
"Finneas" declared "call:0"
"Zheng" declared "call:0"
"['HakulaPlayer']" won the round 1 (stack = {'Zheng': 990, 'RaphaelPlayer': 995, 'SichengZuo': 990, 'Yuchun': 1000, 'HakulaPlayer': 1035, 'Ethan': 1000, 'YangZ': 1000, 'Finneas': 990})
player [Zheng] gets hole card ['DQ', 'ST'], current stack 990
player [RaphaelPlayer] gets hole card ['DA', 'DT'], current stack 995
player [SichengZuo] gets hole card ['H2', 'S9'], current stack 985
player [Yuchun] gets hole card ['D8', 'C6'], current stack 990
player [HakulaPlayer] gets hole card ['S2', 'HT'], current stack 1035
player [Ethan] gets hole card ['HQ', 'H3'], current stack 1000
player [YangZ] gets hole card ['D6', 'D7'], current stack 1000
player [Finneas] gets hole card ['H9', 'S4'], current stack 990
Started the round 2
Street "preflop" started. (community card = [])
"HakulaPlayer" declared "fold:0"
"Ethan" declared "fold:0"
"YangZ" declared "fold:0"
"Finneas" declared "call:10"
"Zheng" declared "call:10"
"RaphaelPlayer" declared "raise:30"
"SichengZuo" declared "fold:0"
"Yuchun" declared "fold:0"
"Finneas" declared "fold:0"
"Zheng" declared "fold:0"
"['RaphaelPlayer']" won the round 2 (stack = {'Zheng': 980, 'RaphaelPlayer': 1030, 'SichengZuo': 985, 'Yuchun': 990, 'HakulaPlayer': 1035, 'Ethan': 1000, 'YangZ': 1000, 'Finneas': 980})
player [Zheng] gets hole card ['S8', 'SA'], current stack 980
player [RaphaelPlayer] gets hole card ['D8', 'H8'], current stack 1030
player [SichengZuo] gets hole card ['HT', 'H4'], current stack 985
player [Yuchun] gets hole card ['SQ', 'D4'], current stack 985
player [HakulaPlayer] gets hole card ['S3', 'CK'], current stack 1025
player [Ethan] gets hole card ['DJ', 'CJ'], current stack 1000
player [YangZ] gets hole card ['S4', 'D5'], current stack 1000
player [Finneas] gets hole card ['DT', 'D3'], current stack 980
Started the round 3
Street "preflop" started. (community card = [])
"Ethan" declared "raise:150"
"YangZ" declared "fold:0"
"Finneas" declared "fold:0"
"Zheng" declared "fold:0"
"RaphaelPlayer" declared "fold:0"
"SichengZuo" declared "fold:0"
"Yuchun" declared "fold:0"
"HakulaPlayer" declared "fold:0"
"['Ethan']" won the round 3 (stack = {'Zheng': 980, 'RaphaelPlayer': 1030, 'SichengZuo': 985, 'Yuchun': 985, 'HakulaPlayer': 1025, 'Ethan': 1015, 'YangZ': 1000, 'Finneas': 980})
player [Zheng] gets hole card ['CA', 'HA'], current stack 980
player [RaphaelPlayer] gets hole card ['D9', 'HQ'], current stack 1030
player [SichengZuo] gets hole card ['S9', 'H8'], current stack 985
player [Yuchun] gets hole card ['C5', 'DA'], current stack 985
player [HakulaPlayer] gets hole card ['D4', 'DT'], current stack 1020
player [Ethan] gets hole card ['D8', 'S8'], current stack 1005
player [YangZ] gets hole card ['ST', 'D3'], current stack 1000
player [Finneas] gets hole card ['CQ', 'SK'], current stack 980
Started the round 4
Street "preflop" started. (community card = [])
"YangZ" declared "fold:0"
"Finneas" declared "call:10"
"Zheng" declared "call:10"
"RaphaelPlayer" declared "call:10"
"SichengZuo" declared "fold:0"
"Yuchun" declared "fold:0"
"HakulaPlayer" declared "call:10"
"Ethan" declared "call:10"
Street "flop" started. (community card = ['H5', 'SQ', 'C2'])
"HakulaPlayer" declared "call:0"
"Ethan" declared "call:0"
"Finneas" declared "call:0"
"Zheng" declared "call:0"
"RaphaelPlayer" declared "call:0"
Street "turn" started. (community card = ['H5', 'SQ', 'C2', 'DK'])
"HakulaPlayer" declared "call:0"
"Ethan" declared "call:0"
"Finneas" declared "call:0"
"Zheng" declared "call:0"
"RaphaelPlayer" declared "call:0"
Street "river" started. (community card = ['H5', 'SQ', 'C2', 'DK', 'D5'])
"HakulaPlayer" declared "call:0"
"Ethan" declared "call:0"
"Finneas" declared "call:0"
"Zheng" declared "call:0"
"RaphaelPlayer" declared "call:0"
"['Zheng']" won the round 4 (stack = {'Zheng': 1020, 'RaphaelPlayer': 1020, 'SichengZuo': 985, 'Yuchun': 985, 'HakulaPlayer': 1015, 'Ethan': 1005, 'YangZ': 1000, 'Finneas': 970})
player [Zheng] gets hole card ['DQ', 'D5'], current stack 1020
player [RaphaelPlayer] gets hole card ['H4', 'H6'], current stack 1020
player [SichengZuo] gets hole card ['C3', 'CJ'], current stack 985
player [Yuchun] gets hole card ['S4', 'HK'], current stack 985
player [HakulaPlayer] gets hole card ['D4', 'D2'], current stack 1015
player [Ethan] gets hole card ['DA', 'S5'], current stack 1000
player [YangZ] gets hole card ['DK', 'SK'], current stack 990
player [Finneas] gets hole card ['D9', 'D8'], current stack 970
Started the round 5
Street "preflop" started. (community card = [])
"Finneas" declared "call:10"
"Zheng" declared "call:10"
"RaphaelPlayer" declared "fold:0"
"SichengZuo" declared "fold:0"
"Yuchun" declared "fold:0"
"HakulaPlayer" declared "call:10"
"Ethan" declared "fold:0"
"YangZ" declared "fold:0"
Street "flop" started. (community card = ['H2', 'C7', 'C6'])
"Finneas" declared "call:0"
"Zheng" declared "call:0"
"HakulaPlayer" declared "call:0"
Street "turn" started. (community card = ['H2', 'C7', 'C6', 'H8'])
"Finneas" declared "call:0"
"Zheng" declared "call:0"
"HakulaPlayer" declared "raise:29"
"Finneas" declared "fold:0"
"Zheng" declared "fold:0"
"['HakulaPlayer']" won the round 5 (stack = {'Zheng': 1010, 'RaphaelPlayer': 1020, 'SichengZuo': 985, 'Yuchun': 985, 'HakulaPlayer': 1050, 'Ethan': 1000, 'YangZ': 990, 'Finneas': 960})
player [Zheng] gets hole card ['SJ', 'C4'], current stack 1010
player [RaphaelPlayer] gets hole card ['D2', 'ST'], current stack 1020
player [SichengZuo] gets hole card ['H8', 'D3'], current stack 985
player [Yuchun] gets hole card ['C7', 'HQ'], current stack 985
player [HakulaPlayer] gets hole card ['DQ', 'S5'], current stack 1050
player [Ethan] gets hole card ['S9', 'H9'], current stack 1000
player [YangZ] gets hole card ['HJ', 'DK'], current stack 985
player [Finneas] gets hole card ['H3', 'H5'], current stack 950
Started the round 6
Street "preflop" started. (community card = [])
"Zheng" declared "call:10"
"RaphaelPlayer" declared "fold:0"
"SichengZuo" declared "fold:0"
"Yuchun" declared "fold:0"
"HakulaPlayer" declared "call:10"
"Ethan" declared "call:10"
"YangZ" declared "fold:0"
"Finneas" declared "call:10"
Street "flop" started. (community card = ['CJ', 'S3', 'CA'])
"Finneas" declared "call:0"
"Zheng" declared "call:0"
"HakulaPlayer" declared "call:0"
"Ethan" declared "call:0"
Street "turn" started. (community card = ['CJ', 'S3', 'CA', 'D7'])
"Finneas" declared "call:0"
"Zheng" declared "call:0"
"HakulaPlayer" declared "call:0"
"Ethan" declared "call:0"
Street "river" started. (community card = ['CJ', 'S3', 'CA', 'D7', 'H4'])
"Finneas" declared "call:0"
"Zheng" declared "raise:505"
"HakulaPlayer" declared "fold:0"
"Ethan" declared "fold:0"
"Finneas" declared "fold:0"
"['Zheng']" won the round 6 (stack = {'Zheng': 1045, 'RaphaelPlayer': 1020, 'SichengZuo': 985, 'Yuchun': 985, 'HakulaPlayer': 1040, 'Ethan': 990, 'YangZ': 985, 'Finneas': 950})
player [Zheng] gets hole card ['S3', 'S4'], current stack 1035
player [RaphaelPlayer] gets hole card ['H8', 'C6'], current stack 1020
player [SichengZuo] gets hole card ['DA', 'H9'], current stack 985
player [Yuchun] gets hole card ['S8', 'D7'], current stack 985
player [HakulaPlayer] gets hole card ['DK', 'C3'], current stack 1040
player [Ethan] gets hole card ['CQ', 'CT'], current stack 990
player [YangZ] gets hole card ['H4', 'HA'], current stack 985
player [Finneas] gets hole card ['CA', 'C4'], current stack 945
Started the round 7
Street "preflop" started. (community card = [])
"RaphaelPlayer" declared "fold:0"
"SichengZuo" declared "fold:0"
"Yuchun" declared "fold:0"
"HakulaPlayer" declared "fold:0"
"Ethan" declared "fold:0"
"YangZ" declared "fold:0"
"Finneas" declared "call:10"
"Zheng" declared "call:10"
Street "flop" started. (community card = ['S7', 'H2', 'H3'])
"Finneas" declared "call:0"
"Zheng" declared "call:0"
Street "turn" started. (community card = ['S7', 'H2', 'H3', 'D5'])
"Finneas" declared "call:0"
"Zheng" declared "call:0"
Street "river" started. (community card = ['S7', 'H2', 'H3', 'D5', 'C7'])
"Finneas" declared "call:0"
"Zheng" declared "call:0"
"['Finneas']" won the round 7 (stack = {'Zheng': 1035, 'RaphaelPlayer': 1020, 'SichengZuo': 985, 'Yuchun': 985, 'HakulaPlayer': 1040, 'Ethan': 990, 'YangZ': 985, 'Finneas': 960})
player [Zheng] gets hole card ['S8', 'S4'], current stack 1030
player [RaphaelPlayer] gets hole card ['C7', 'SQ'], current stack 1010
player [SichengZuo] gets hole card ['HJ', 'D3'], current stack 985
player [Yuchun] gets hole card ['C2', 'CA'], current stack 985
player [HakulaPlayer] gets hole card ['D6', 'DT'], current stack 1040
player [Ethan] gets hole card ['S5', 'S9'], current stack 990
player [YangZ] gets hole card ['D5', 'C9'], current stack 985
player [Finneas] gets hole card ['SJ', 'D2'], current stack 960
Started the round 8
Street "preflop" started. (community card = [])
"SichengZuo" declared "fold:0"
"Yuchun" declared "fold:0"
"HakulaPlayer" declared "fold:0"
"Ethan" declared "fold:0"
"YangZ" declared "fold:0"
"Finneas" declared "call:10"
"Zheng" declared "call:10"
"RaphaelPlayer" declared "call:10"
Street "flop" started. (community card = ['DK', 'ST', 'CK'])
"Zheng" declared "call:0"
"RaphaelPlayer" declared "call:0"
"Finneas" declared "call:0"
Street "turn" started. (community card = ['DK', 'ST', 'CK', 'C6'])
"Zheng" declared "call:0"
"RaphaelPlayer" declared "call:0"
"Finneas" declared "call:0"
Street "river" started. (community card = ['DK', 'ST', 'CK', 'C6', 'DA'])
"Zheng" declared "call:0"
"RaphaelPlayer" declared "call:0"
"Finneas" declared "call:0"
"['RaphaelPlayer']" won the round 8 (stack = {'Zheng': 1025, 'RaphaelPlayer': 1040, 'SichengZuo': 985, 'Yuchun': 985, 'HakulaPlayer': 1040, 'Ethan': 990, 'YangZ': 985, 'Finneas': 950})
player [Zheng] gets hole card ['CT', 'SK'], current stack 1025
player [RaphaelPlayer] gets hole card ['S4', 'DJ'], current stack 1035
player [SichengZuo] gets hole card ['D7', 'D9'], current stack 975
player [Yuchun] gets hole card ['H8', 'C6'], current stack 985
player [HakulaPlayer] gets hole card ['CA', 'DK'], current stack 1040
player [Ethan] gets hole card ['S9', 'C2'], current stack 990
player [YangZ] gets hole card ['H5', 'HA'], current stack 985
player [Finneas] gets hole card ['S8', 'D2'], current stack 950
Started the round 9
Street "preflop" started. (community card = [])
"Yuchun" declared "fold:0"
"HakulaPlayer" declared "call:10"
"Ethan" declared "fold:0"
"YangZ" declared "fold:0"
"Finneas" declared "call:10"
"Zheng" declared "call:10"
"RaphaelPlayer" declared "fold:0"
"SichengZuo" declared "fold:0"
Street "flop" started. (community card = ['H3', 'DQ', 'CJ'])
"HakulaPlayer" declared "call:0"
"Finneas" declared "call:0"
"Zheng" declared "call:0"
Street "turn" started. (community card = ['H3', 'DQ', 'CJ', 'C3'])
"HakulaPlayer" declared "call:0"
"Finneas" declared "call:0"
"Zheng" declared "call:0"
Street "river" started. (community card = ['H3', 'DQ', 'CJ', 'C3', 'SA'])
"HakulaPlayer" declared "raise:52"
"Finneas" declared "fold:0"
"Zheng" declared "raise:1015"
"HakulaPlayer" declared "call:1015"
"['Zheng']" won the round 9 (stack = {'Zheng': 2075, 'RaphaelPlayer': 1035, 'SichengZuo': 975, 'Yuchun': 985, 'HakulaPlayer': 15, 'Ethan': 990, 'YangZ': 985, 'Finneas': 940})
player [Zheng] gets hole card ['H8', 'HQ'], current stack 2075
player [RaphaelPlayer] gets hole card ['S4', 'H2'], current stack 1035
player [SichengZuo] gets hole card ['ST', 'C6'], current stack 970
player [Yuchun] gets hole card ['SK', 'D7'], current stack 975
player [HakulaPlayer] gets hole card ['CQ', 'H3'], current stack 15
player [Ethan] gets hole card ['S8', 'H6'], current stack 990
player [YangZ] gets hole card ['D5', 'H4'], current stack 985
player [Finneas] gets hole card ['CT', 'HK'], current stack 940
Started the round 10
Street "preflop" started. (community card = [])
"HakulaPlayer" declared "fold:0"
"Ethan" declared "fold:0"
"YangZ" declared "fold:0"
"Finneas" declared "call:10"
"Zheng" declared "call:10"
"RaphaelPlayer" declared "fold:0"
"SichengZuo" declared "fold:0"
"Yuchun" declared "call:10"
Street "flop" started. (community card = ['D3', 'S3', 'SJ'])
"Yuchun" declared "call:0"
"Finneas" declared "call:0"
"Zheng" declared "call:0"
Street "turn" started. (community card = ['D3', 'S3', 'SJ', 'S5'])
"Yuchun" declared "call:0"
"Finneas" declared "call:0"
"Zheng" declared "call:0"
Street "river" started. (community card = ['D3', 'S3', 'SJ', 'S5', 'DA'])
"Yuchun" declared "call:0"
"Finneas" declared "call:0"
"Zheng" declared "call:0"
"['Yuchun', 'Finneas']" won the round 10 (stack = {'Zheng': 2065, 'RaphaelPlayer': 1035, 'SichengZuo': 970, 'Yuchun': 992, 'HakulaPlayer': 15, 'Ethan': 990, 'YangZ': 985, 'Finneas': 947})
player [Zheng] gets hole card ['H6', 'D2'], current stack 2065
player [RaphaelPlayer] gets hole card ['CK', 'C6'], current stack 1035
player [SichengZuo] gets hole card ['SJ', 'S9'], current stack 970
player [Yuchun] gets hole card ['H3', 'DK'], current stack 987
player [HakulaPlayer] gets hole card ['H7', 'HJ'], current stack 5
player [Ethan] gets hole card ['S6', 'CJ'], current stack 990
player [YangZ] gets hole card ['H4', 'C9'], current stack 985
player [Finneas] gets hole card ['HQ', 'C8'], current stack 947
Started the round 11
Street "preflop" started. (community card = [])
"Ethan" declared "fold:0"
"YangZ" declared "fold:0"
"Finneas" declared "call:10"
"Zheng" declared "call:10"
"RaphaelPlayer" declared "call:10"
"SichengZuo" declared "fold:0"
"Yuchun" declared "call:10"
"HakulaPlayer" declared "call:10"
Street "flop" started. (community card = ['DQ', 'HK', 'DJ'])
"Yuchun" declared "call:0"
"HakulaPlayer" declared "call:0"
"Finneas" declared "call:0"
"Zheng" declared "call:0"
"RaphaelPlayer" declared "call:0"
Street "turn" started. (community card = ['DQ', 'HK', 'DJ', 'SQ'])
"Yuchun" declared "call:0"
"HakulaPlayer" declared "call:0"
"Finneas" declared "raise:473"
"Zheng" declared "fold:0"
"RaphaelPlayer" declared "fold:0"
"Yuchun" declared "fold:0"
"HakulaPlayer" declared "call:473"
Street "river" started. (community card = ['DQ', 'HK', 'DJ', 'SQ', 'S7'])
"['Finneas']" won the round 11 (stack = {'Zheng': 2055, 'RaphaelPlayer': 1025, 'SichengZuo': 970, 'Yuchun': 982, 'HakulaPlayer': 0, 'Ethan': 990, 'YangZ': 985, 'Finneas': 992})
player [Zheng] gets hole card ['CA', 'H5'], current stack 2055
player [RaphaelPlayer] gets hole card ['CK', 'HQ'], current stack 1025
player [SichengZuo] gets hole card ['SA', 'DJ'], current stack 970
player [Yuchun] gets hole card ['H2', 'SK'], current stack 982
player [Ethan] gets hole card ['C9', 'H3'], current stack 985
player [YangZ] gets hole card ['S8', 'CT'], current stack 975
player [Finneas] gets hole card ['H7', 'ST'], current stack 992
Started the round 12
Street "preflop" started. (community card = [])
"Finneas" declared "call:10"
"Zheng" declared "call:10"
"RaphaelPlayer" declared "call:10"
"SichengZuo" declared "fold:0"
"Yuchun" declared "call:10"
"Ethan" declared "fold:0"
"YangZ" declared "fold:0"
Street "flop" started. (community card = ['H4', 'H8', 'H6'])
"Finneas" declared "call:0"
"Zheng" declared "call:0"
"RaphaelPlayer" declared "call:0"
"Yuchun" declared "call:0"
Street "turn" started. (community card = ['H4', 'H8', 'H6', 'S2'])
"Finneas" declared "call:0"
"Zheng" declared "call:0"
"RaphaelPlayer" declared "call:0"
"Yuchun" declared "call:0"
Street "river" started. (community card = ['H4', 'H8', 'H6', 'S2', 'C7'])
"Finneas" declared "call:0"
"Zheng" declared "raise:1027"
"RaphaelPlayer" declared "fold:0"
"Yuchun" declared "fold:0"
"Finneas" declared "fold:0"
"['Zheng']" won the round 12 (stack = {'Zheng': 2100, 'RaphaelPlayer': 1015, 'SichengZuo': 970, 'Yuchun': 972, 'HakulaPlayer': 0, 'Ethan': 985, 'YangZ': 975, 'Finneas': 982})
player [Zheng] gets hole card ['C7', 'D2'], current stack 2100
player [RaphaelPlayer] gets hole card ['CT', 'H9'], current stack 1015
player [SichengZuo] gets hole card ['S3', 'C5'], current stack 970
player [Yuchun] gets hole card ['CA', 'DA'], current stack 972
player [Ethan] gets hole card ['D8', 'D7'], current stack 985
player [YangZ] gets hole card ['H8', 'D3'], current stack 970
player [Finneas] gets hole card ['D5', 'C6'], current stack 972
Started the round 13
Street "preflop" started. (community card = [])
"Zheng" declared "call:10"
"RaphaelPlayer" declared "call:10"
"SichengZuo" declared "fold:0"
"Yuchun" declared "call:10"
"Ethan" declared "fold:0"
"YangZ" declared "fold:0"
"Finneas" declared "call:10"
Street "flop" started. (community card = ['DK', 'H2', 'DT'])
"Finneas" declared "call:0"
"Zheng" declared "call:0"
"RaphaelPlayer" declared "call:0"
"Yuchun" declared "call:0"
Street "turn" started. (community card = ['DK', 'H2', 'DT', 'C3'])
"Finneas" declared "call:0"
"Zheng" declared "call:0"
"RaphaelPlayer" declared "call:0"
"Yuchun" declared "call:0"
Street "river" started. (community card = ['DK', 'H2', 'DT', 'C3', 'H6'])
"Finneas" declared "call:0"
"Zheng" declared "call:0"
"RaphaelPlayer" declared "call:0"
"Yuchun" declared "call:0"
"['Yuchun']" won the round 13 (stack = {'Zheng': 2090, 'RaphaelPlayer': 1005, 'SichengZuo': 970, 'Yuchun': 1007, 'HakulaPlayer': 0, 'Ethan': 985, 'YangZ': 970, 'Finneas': 972})
player [Zheng] gets hole card ['S9', 'H5'], current stack 2080
player [RaphaelPlayer] gets hole card ['D2', 'C2'], current stack 1005
player [SichengZuo] gets hole card ['HA', 'SQ'], current stack 970
player [Yuchun] gets hole card ['C9', 'S7'], current stack 1007
player [Ethan] gets hole card ['DT', 'D8'], current stack 985
player [YangZ] gets hole card ['H2', 'HJ'], current stack 970
player [Finneas] gets hole card ['D6', 'S8'], current stack 967
Started the round 14
Street "preflop" started. (community card = [])
"RaphaelPlayer" declared "fold:0"
"SichengZuo" declared "fold:0"
"Yuchun" declared "call:10"
"Ethan" declared "fold:0"
"YangZ" declared "fold:0"
"Finneas" declared "call:10"
"Zheng" declared "call:10"
Street "flop" started. (community card = ['D4', 'SJ', 'H6'])
"Finneas" declared "call:0"
"Zheng" declared "call:0"
"Yuchun" declared "call:0"
Street "turn" started. (community card = ['D4', 'SJ', 'H6', 'DQ'])
"Finneas" declared "call:0"
"Zheng" declared "call:0"
"Yuchun" declared "call:0"
Street "river" started. (community card = ['D4', 'SJ', 'H6', 'DQ', 'HK'])
"Finneas" declared "call:0"
"Zheng" declared "call:0"
"Yuchun" declared "call:0"
"['Finneas']" won the round 14 (stack = {'Zheng': 2080, 'RaphaelPlayer': 1005, 'SichengZuo': 970, 'Yuchun': 997, 'HakulaPlayer': 0, 'Ethan': 985, 'YangZ': 970, 'Finneas': 992})
player [Zheng] gets hole card ['C4', 'H6'], current stack 2075
player [RaphaelPlayer] gets hole card ['S5', 'H8'], current stack 995
player [SichengZuo] gets hole card ['D7', 'ST'], current stack 970
player [Yuchun] gets hole card ['C8', 'HK'], current stack 997
player [Ethan] gets hole card ['DJ', 'HQ'], current stack 985
player [YangZ] gets hole card ['S8', 'CK'], current stack 970
player [Finneas] gets hole card ['S7', 'H9'], current stack 992
Started the round 15
Street "preflop" started. (community card = [])
"SichengZuo" declared "fold:0"
"Yuchun" declared "call:10"
"Ethan" declared "raise:147"
"YangZ" declared "fold:0"
"Finneas" declared "fold:0"
"Zheng" declared "fold:0"
"RaphaelPlayer" declared "fold:0"
"Yuchun" declared "call:147"
Street "flop" started. (community card = ['CT', 'SK', 'SQ'])
"Yuchun" declared "call:0"
"Ethan" declared "call:0"
Street "turn" started. (community card = ['CT', 'SK', 'SQ', 'S4'])
"Yuchun" declared "call:0"
"Ethan" declared "call:0"
Street "river" started. (community card = ['CT', 'SK', 'SQ', 'S4', 'S9'])
"Yuchun" declared "call:0"
"Ethan" declared "raise:309"
"Yuchun" declared "fold:0"
"['Ethan']" won the round 15 (stack = {'Zheng': 2075, 'RaphaelPlayer': 995, 'SichengZuo': 970, 'Yuchun': 850, 'HakulaPlayer': 0, 'Ethan': 1147, 'YangZ': 970, 'Finneas': 992})
player [Zheng] gets hole card ['C9', 'S6'], current stack 2075
player [RaphaelPlayer] gets hole card ['HT', 'H9'], current stack 990
player [SichengZuo] gets hole card ['HJ', 'CT'], current stack 960
player [Yuchun] gets hole card ['D9', 'SJ'], current stack 850
player [Ethan] gets hole card ['D2', 'ST'], current stack 1147
player [YangZ] gets hole card ['S9', 'S5'], current stack 970
player [Finneas] gets hole card ['SQ', 'S8'], current stack 992
Started the round 16
Street "preflop" started. (community card = [])
"Yuchun" declared "call:10"
"Ethan" declared "fold:0"
"YangZ" declared "fold:0"
"Finneas" declared "call:10"
"Zheng" declared "call:10"
"RaphaelPlayer" declared "call:10"
"SichengZuo" declared "fold:0"
Street "flop" started. (community card = ['H5', 'SK', 'SA'])
"RaphaelPlayer" declared "call:0"
"Yuchun" declared "call:0"
"Finneas" declared "call:0"
"Zheng" declared "call:0"
Street "turn" started. (community card = ['H5', 'SK', 'SA', 'C5'])
"RaphaelPlayer" declared "call:0"
"Yuchun" declared "call:0"
"Finneas" declared "call:0"
"Zheng" declared "call:0"
Street "river" started. (community card = ['H5', 'SK', 'SA', 'C5', 'HA'])
"RaphaelPlayer" declared "call:0"
"Yuchun" declared "call:0"
"Finneas" declared "call:0"
"Zheng" declared "call:0"
"['Zheng', 'RaphaelPlayer', 'Yuchun', 'Finneas']" won the round 16 (stack = {'Zheng': 2077, 'RaphaelPlayer': 997, 'SichengZuo': 960, 'Yuchun': 852, 'HakulaPlayer': 0, 'Ethan': 1147, 'YangZ': 970, 'Finneas': 994})
player [Zheng] gets hole card ['H5', 'S3'], current stack 2077
player [RaphaelPlayer] gets hole card ['H2', 'D9'], current stack 997
player [SichengZuo] gets hole card ['S2', 'C2'], current stack 955
player [Yuchun] gets hole card ['D7', 'H6'], current stack 842
player [Ethan] gets hole card ['SK', 'C8'], current stack 1147
player [YangZ] gets hole card ['S7', 'CQ'], current stack 970
player [Finneas] gets hole card ['DT', 'S6'], current stack 994
Started the round 17
Street "preflop" started. (community card = [])
"Ethan" declared "fold:0"
"YangZ" declared "fold:0"
"Finneas" declared "call:10"
"Zheng" declared "call:10"
"RaphaelPlayer" declared "fold:0"
"SichengZuo" declared "fold:0"
"Yuchun" declared "call:10"
Street "flop" started. (community card = ['ST', 'HA', 'SA'])
"Yuchun" declared "call:0"
"Finneas" declared "call:0"
"Zheng" declared "call:0"
Street "turn" started. (community card = ['ST', 'HA', 'SA', 'D5'])
"Yuchun" declared "call:0"
"Finneas" declared "call:0"
"Zheng" declared "call:0"
Street "river" started. (community card = ['ST', 'HA', 'SA', 'D5', 'C3'])
"Yuchun" declared "call:0"
"Finneas" declared "call:0"
"Zheng" declared "call:0"
"['Finneas']" won the round 17 (stack = {'Zheng': 2067, 'RaphaelPlayer': 997, 'SichengZuo': 955, 'Yuchun': 842, 'HakulaPlayer': 0, 'Ethan': 1147, 'YangZ': 970, 'Finneas': 1019})
player [Zheng] gets hole card ['H9', 'ST'], current stack 2067
player [RaphaelPlayer] gets hole card ['H8', 'HK'], current stack 997
player [SichengZuo] gets hole card ['S9', 'DA'], current stack 955
player [Yuchun] gets hole card ['SA', 'D8'], current stack 837
player [Ethan] gets hole card ['D7', 'H5'], current stack 1137
player [YangZ] gets hole card ['S3', 'C6'], current stack 970
player [Finneas] gets hole card ['CK', 'D5'], current stack 1019
Started the round 18
Street "preflop" started. (community card = [])
"YangZ" declared "fold:0"
"Finneas" declared "call:10"
"Zheng" declared "call:10"
"RaphaelPlayer" declared "call:10"
"SichengZuo" declared "fold:0"
"Yuchun" declared "call:10"
"Ethan" declared "fold:0"
Street "flop" started. (community card = ['SK', 'S7', 'D2'])
"Yuchun" declared "call:0"
"Finneas" declared "call:0"
"Zheng" declared "call:0"
"RaphaelPlayer" declared "raise:60"
"Yuchun" declared "call:60"
"Finneas" declared "fold:0"
"Zheng" declared "fold:0"
Street "turn" started. (community card = ['SK', 'S7', 'D2', 'S2'])
"Yuchun" declared "call:0"
"RaphaelPlayer" declared "raise:180"
"Yuchun" declared "call:180"
Street "river" started. (community card = ['SK', 'S7', 'D2', 'S2', 'DT'])
"Yuchun" declared "call:0"
"RaphaelPlayer" declared "raise:540"
"Yuchun" declared "fold:0"
"['RaphaelPlayer']" won the round 18 (stack = {'Zheng': 2057, 'RaphaelPlayer': 1277, 'SichengZuo': 955, 'Yuchun': 592, 'HakulaPlayer': 0, 'Ethan': 1137, 'YangZ': 970, 'Finneas': 1009})
player [Zheng] gets hole card ['C8', 'D3'], current stack 2057
player [RaphaelPlayer] gets hole card ['CK', 'S7'], current stack 1277
player [SichengZuo] gets hole card ['H7', 'DJ'], current stack 955
player [Yuchun] gets hole card ['CA', 'S4'], current stack 592
player [Ethan] gets hole card ['C6', 'H8'], current stack 1132
player [YangZ] gets hole card ['S2', 'H2'], current stack 960
player [Finneas] gets hole card ['H3', 'C2'], current stack 1009
Started the round 19
Street "preflop" started. (community card = [])
"Finneas" declared "call:10"
"Zheng" declared "call:10"
"RaphaelPlayer" declared "call:10"
"SichengZuo" declared "fold:0"
"Yuchun" declared "call:10"
"Ethan" declared "fold:0"
"YangZ" declared "fold:0"
Street "flop" started. (community card = ['DK', 'S6', 'HA'])
"Finneas" declared "call:0"
"Zheng" declared "call:0"
"RaphaelPlayer" declared "call:0"
"Yuchun" declared "call:0"
Street "turn" started. (community card = ['DK', 'S6', 'HA', 'S9'])
"Finneas" declared "call:0"
"Zheng" declared "call:0"
"RaphaelPlayer" declared "call:0"
"Yuchun" declared "raise:40"
"Finneas" declared "fold:0"
"Zheng" declared "fold:0"
"RaphaelPlayer" declared "raise:175"
"Yuchun" declared "raise:582"
"RaphaelPlayer" declared "call:582"
Street "river" started. (community card = ['DK', 'S6', 'HA', 'S9', 'D2'])
"['Yuchun']" won the round 19 (stack = {'Zheng': 2047, 'RaphaelPlayer': 685, 'SichengZuo': 955, 'Yuchun': 1219, 'HakulaPlayer': 0, 'Ethan': 1132, 'YangZ': 960, 'Finneas': 999})
player [Zheng] gets hole card ['SQ', 'D3'], current stack 2047
player [RaphaelPlayer] gets hole card ['D4', 'H4'], current stack 685
player [SichengZuo] gets hole card ['H8', 'C7'], current stack 955
player [Yuchun] gets hole card ['C6', 'S4'], current stack 1219
player [Ethan] gets hole card ['H2', 'S5'], current stack 1132
player [YangZ] gets hole card ['D8', 'ST'], current stack 955
player [Finneas] gets hole card ['H7', 'D7'], current stack 989
Started the round 20
Street "preflop" started. (community card = [])
"Zheng" declared "call:10"
"RaphaelPlayer" declared "call:10"
"SichengZuo" declared "fold:0"
"Yuchun" declared "call:10"
"Ethan" declared "fold:0"
"YangZ" declared "fold:0"
"Finneas" declared "call:10"
Street "flop" started. (community card = ['HK', 'CK', 'H9'])
"Finneas" declared "call:0"
"Zheng" declared "call:0"
"RaphaelPlayer" declared "call:0"
"Yuchun" declared "call:0"
Street "turn" started. (community card = ['HK', 'CK', 'H9', 'CT'])
"Finneas" declared "call:0"
"Zheng" declared "call:0"
"RaphaelPlayer" declared "call:0"
"Yuchun" declared "call:0"
Street "river" started. (community card = ['HK', 'CK', 'H9', 'CT', 'HT'])
"Finneas" declared "call:0"
"Zheng" declared "call:0"
"RaphaelPlayer" declared "call:0"
"Yuchun" declared "call:0"
"['Zheng']" won the round 20 (stack = {'Zheng': 2082, 'RaphaelPlayer': 675, 'SichengZuo': 955, 'Yuchun': 1209, 'HakulaPlayer': 0, 'Ethan': 1132, 'YangZ': 955, 'Finneas': 989})
player [Zheng] gets hole card ['DT', 'C5'], current stack 2072
player [RaphaelPlayer] gets hole card ['DJ', 'C7'], current stack 675
player [SichengZuo] gets hole card ['DK', 'ST'], current stack 955
player [Yuchun] gets hole card ['S5', 'D5'], current stack 1209
player [Ethan] gets hole card ['D4', 'C6'], current stack 1132
player [YangZ] gets hole card ['H4', 'SA'], current stack 955
player [Finneas] gets hole card ['S6', 'CK'], current stack 984
Started the round 21
Street "preflop" started. (community card = [])
"RaphaelPlayer" declared "fold:0"
"SichengZuo" declared "fold:0"
"Yuchun" declared "call:10"
"Ethan" declared "fold:0"
"YangZ" declared "fold:0"
"Finneas" declared "call:10"
"Zheng" declared "call:10"
Street "flop" started. (community card = ['D3', 'HJ', 'H2'])
"Finneas" declared "call:0"
"Zheng" declared "call:0"
"Yuchun" declared "call:0"
Street "turn" started. (community card = ['D3', 'HJ', 'H2', 'S9'])
"Finneas" declared "call:0"
"Zheng" declared "call:0"
"Yuchun" declared "call:0"
Street "river" started. (community card = ['D3', 'HJ', 'H2', 'S9', 'D7'])
"Finneas" declared "call:0"
"Zheng" declared "call:0"
"Yuchun" declared "call:0"
"['Yuchun']" won the round 21 (stack = {'Zheng': 2072, 'RaphaelPlayer': 675, 'SichengZuo': 955, 'Yuchun': 1229, 'HakulaPlayer': 0, 'Ethan': 1132, 'YangZ': 955, 'Finneas': 979})
player [Zheng] gets hole card ['H5', 'HJ'], current stack 2067
player [RaphaelPlayer] gets hole card ['C7', 'SK'], current stack 665
player [SichengZuo] gets hole card ['D8', 'ST'], current stack 955
player [Yuchun] gets hole card ['CT', 'C3'], current stack 1229
player [Ethan] gets hole card ['D9', 'H4'], current stack 1132
player [YangZ] gets hole card ['D7', 'DA'], current stack 955
player [Finneas] gets hole card ['D2', 'H9'], current stack 979
Started the round 22
Street "preflop" started. (community card = [])
"SichengZuo" declared "fold:0"
"Yuchun" declared "call:10"
"Ethan" declared "fold:0"
"YangZ" declared "fold:0"
"Finneas" declared "call:10"
"Zheng" declared "call:10"
"RaphaelPlayer" declared "call:10"
Street "flop" started. (community card = ['D3', 'CK', 'SJ'])
"Zheng" declared "call:0"
"RaphaelPlayer" declared "raise:50"
"Yuchun" declared "call:50"
"Finneas" declared "fold:0"
"Zheng" declared "call:50"
Street "turn" started. (community card = ['D3', 'CK', 'SJ', 'H2'])
"Zheng" declared "call:0"
"RaphaelPlayer" declared "raise:200"
"Yuchun" declared "call:200"
"Zheng" declared "fold:0"
Street "river" started. (community card = ['D3', 'CK', 'SJ', 'H2', 'H3'])
"RaphaelPlayer" declared "raise:415"
"Yuchun" declared "raise:969"
"['Yuchun']" won the round 22 (stack = {'Zheng': 2012, 'RaphaelPlayer': 0, 'SichengZuo': 955, 'Yuchun': 1974, 'HakulaPlayer': 0, 'Ethan': 1132, 'YangZ': 955, 'Finneas': 969})
player [Zheng] gets hole card ['S9', 'HK'], current stack 2012
player [SichengZuo] gets hole card ['C3', 'C9'], current stack 950
player [Yuchun] gets hole card ['DK', 'H5'], current stack 1964
player [Ethan] gets hole card ['D4', 'H8'], current stack 1132
player [YangZ] gets hole card ['S2', 'CA'], current stack 955
player [Finneas] gets hole card ['S4', 'CQ'], current stack 969
Started the round 23
Street "preflop" started. (community card = [])
"Ethan" declared "fold:0"
"YangZ" declared "fold:0"
"Finneas" declared "call:10"
"Zheng" declared "call:10"
"SichengZuo" declared "fold:0"
"Yuchun" declared "call:10"
Street "flop" started. (community card = ['DJ', 'H3', 'C8'])
"Yuchun" declared "call:0"
"Finneas" declared "call:0"
"Zheng" declared "call:0"
Street "turn" started. (community card = ['DJ', 'H3', 'C8', 'H4'])
"Yuchun" declared "call:0"
"Finneas" declared "call:0"
"Zheng" declared "call:0"
Street "river" started. (community card = ['DJ', 'H3', 'C8', 'H4', 'D6'])
"Yuchun" declared "call:0"
"Finneas" declared "call:0"
"Zheng" declared "call:0"
"['Finneas']" won the round 23 (stack = {'Zheng': 2002, 'RaphaelPlayer': 0, 'SichengZuo': 950, 'Yuchun': 1964, 'HakulaPlayer': 0, 'Ethan': 1132, 'YangZ': 955, 'Finneas': 994})
player [Zheng] gets hole card ['CQ', 'ST'], current stack 2002
player [SichengZuo] gets hole card ['HT', 'DK'], current stack 950
player [Yuchun] gets hole card ['S5', 'S7'], current stack 1959
player [Ethan] gets hole card ['D5', 'HA'], current stack 1122
player [YangZ] gets hole card ['H3', 'D7'], current stack 955
player [Finneas] gets hole card ['HJ', 'HK'], current stack 994
Started the round 24
Street "preflop" started. (community card = [])
"YangZ" declared "fold:0"
"Finneas" declared "call:10"
"Zheng" declared "call:10"
"SichengZuo" declared "fold:0"
"Yuchun" declared "call:10"
"Ethan" declared "fold:0"
Street "flop" started. (community card = ['HQ', 'D3', 'C6'])
"Yuchun" declared "call:0"
"Finneas" declared "call:0"
"Zheng" declared "call:0"
Street "turn" started. (community card = ['HQ', 'D3', 'C6', 'S4'])
"Yuchun" declared "raise:1954"
"Finneas" declared "fold:0"
"Zheng" declared "fold:0"
"['Yuchun']" won the round 24 (stack = {'Zheng': 1992, 'RaphaelPlayer': 0, 'SichengZuo': 950, 'Yuchun': 1994, 'HakulaPlayer': 0, 'Ethan': 1122, 'YangZ': 955, 'Finneas': 984})
player [Zheng] gets hole card ['D5', 'CQ'], current stack 1992
player [SichengZuo] gets hole card ['S7', 'SK'], current stack 950
player [Yuchun] gets hole card ['DJ', 'H3'], current stack 1994
player [Ethan] gets hole card ['ST', 'H4'], current stack 1117
player [YangZ] gets hole card ['CT', 'S4'], current stack 945
player [Finneas] gets hole card ['DT', 'D9'], current stack 984
Started the round 25
Street "preflop" started. (community card = [])
"Finneas" declared "call:10"
"Zheng" declared "call:10"
"SichengZuo" declared "fold:0"
"Yuchun" declared "call:10"
"Ethan" declared "fold:0"
"YangZ" declared "fold:0"
Street "flop" started. (community card = ['CK', 'C6', 'C9'])
"Finneas" declared "call:0"
"Zheng" declared "call:0"
"Yuchun" declared "call:0"
Street "turn" started. (community card = ['CK', 'C6', 'C9', 'D4'])
"Finneas" declared "call:0"
"Zheng" declared "call:0"
"Yuchun" declared "call:0"
Street "river" started. (community card = ['CK', 'C6', 'C9', 'D4', 'DK'])
"Finneas" declared "call:0"
"Zheng" declared "call:0"
"Yuchun" declared "call:0"
"['Finneas']" won the round 25 (stack = {'Zheng': 1982, 'RaphaelPlayer': 0, 'SichengZuo': 950, 'Yuchun': 1984, 'HakulaPlayer': 0, 'Ethan': 1117, 'YangZ': 945, 'Finneas': 1019})
player [Zheng] gets hole card ['D2', 'H5'], current stack 1982
player [SichengZuo] gets hole card ['CT', 'C5'], current stack 950
player [Yuchun] gets hole card ['S5', 'C7'], current stack 1984
player [Ethan] gets hole card ['DA', 'D5'], current stack 1117
player [YangZ] gets hole card ['DJ', 'H9'], current stack 940
player [Finneas] gets hole card ['HK', 'C3'], current stack 1009
Started the round 26
Street "preflop" started. (community card = [])
"Zheng" declared "call:10"
"SichengZuo" declared "fold:0"
"Yuchun" declared "call:10"
"Ethan" declared "fold:0"
"YangZ" declared "fold:0"
"Finneas" declared "call:10"
Street "flop" started. (community card = ['SA', 'SK', 'CK'])
"Finneas" declared "raise:509"
"Zheng" declared "fold:0"
"Yuchun" declared "fold:0"
"['Finneas']" won the round 26 (stack = {'Zheng': 1972, 'RaphaelPlayer': 0, 'SichengZuo': 950, 'Yuchun': 1974, 'HakulaPlayer': 0, 'Ethan': 1117, 'YangZ': 940, 'Finneas': 1044})
player [Zheng] gets hole card ['D6', 'C7'], current stack 1962
player [SichengZuo] gets hole card ['D4', 'HT'], current stack 950
player [Yuchun] gets hole card ['HJ', 'D5'], current stack 1974
player [Ethan] gets hole card ['D7', 'H4'], current stack 1117
player [YangZ] gets hole card ['D9', 'S4'], current stack 940
player [Finneas] gets hole card ['SA', 'DQ'], current stack 1039
Started the round 27
Street "preflop" started. (community card = [])
"SichengZuo" declared "fold:0"
"Yuchun" declared "call:10"
"Ethan" declared "fold:0"
"YangZ" declared "fold:0"
"Finneas" declared "raise:529"
"Zheng" declared "fold:0"
"Yuchun" declared "fold:0"
"['Finneas']" won the round 27 (stack = {'Zheng': 1962, 'RaphaelPlayer': 0, 'SichengZuo': 950, 'Yuchun': 1964, 'HakulaPlayer': 0, 'Ethan': 1117, 'YangZ': 940, 'Finneas': 1064})
player [Zheng] gets hole card ['D8', 'H7'], current stack 1957
player [SichengZuo] gets hole card ['C5', 'C3'], current stack 940
player [Yuchun] gets hole card ['H3', 'SK'], current stack 1964
player [Ethan] gets hole card ['CT', 'S2'], current stack 1117
player [YangZ] gets hole card ['D3', 'SQ'], current stack 940
player [Finneas] gets hole card ['DA', 'D7'], current stack 1064
Started the round 28
Street "preflop" started. (community card = [])
"Yuchun" declared "call:10"
"Ethan" declared "fold:0"
"YangZ" declared "fold:0"
"Finneas" declared "call:10"
"Zheng" declared "call:10"
"SichengZuo" declared "fold:0"
Street "flop" started. (community card = ['ST', 'H8', 'D6'])
"Zheng" declared "call:0"
"Yuchun" declared "call:0"
"Finneas" declared "call:0"
Street "turn" started. (community card = ['ST', 'H8', 'D6', 'HJ'])
"Zheng" declared "call:0"
"Yuchun" declared "call:0"
"Finneas" declared "call:0"
Street "river" started. (community card = ['ST', 'H8', 'D6', 'HJ', 'H4'])
"Zheng" declared "call:0"
"Yuchun" declared "call:0"
"Finneas" declared "call:0"
"['Zheng']" won the round 28 (stack = {'Zheng': 1992, 'RaphaelPlayer': 0, 'SichengZuo': 940, 'Yuchun': 1954, 'HakulaPlayer': 0, 'Ethan': 1117, 'YangZ': 940, 'Finneas': 1054})
player [Zheng] gets hole card ['C5', 'S3'], current stack 1992
player [SichengZuo] gets hole card ['H6', 'S6'], current stack 935
player [Yuchun] gets hole card ['D3', 'H5'], current stack 1944
player [Ethan] gets hole card ['DQ', 'H7'], current stack 1117
player [YangZ] gets hole card ['SK', 'D7'], current stack 940
player [Finneas] gets hole card ['S2', 'H3'], current stack 1054
Started the round 29
Street "preflop" started. (community card = [])
"Ethan" declared "fold:0"
"YangZ" declared "fold:0"
"Finneas" declared "call:10"
"Zheng" declared "call:10"
"SichengZuo" declared "fold:0"
"Yuchun" declared "call:10"
Street "flop" started. (community card = ['HK', 'SA', 'CQ'])
"Yuchun" declared "call:0"
"Finneas" declared "call:0"
"Zheng" declared "call:0"
Street "turn" started. (community card = ['HK', 'SA', 'CQ', 'S4'])
"Yuchun" declared "call:0"
"Finneas" declared "call:0"
"Zheng" declared "call:0"
Street "river" started. (community card = ['HK', 'SA', 'CQ', 'S4', 'SJ'])
"Yuchun" declared "call:0"
"Finneas" declared "call:0"
"Zheng" declared "call:0"
"['Zheng', 'Yuchun']" won the round 29 (stack = {'Zheng': 1999, 'RaphaelPlayer': 0, 'SichengZuo': 935, 'Yuchun': 1961, 'HakulaPlayer': 0, 'Ethan': 1117, 'YangZ': 940, 'Finneas': 1044})
player [Zheng] gets hole card ['SQ', 'C3'], current stack 1999
player [SichengZuo] gets hole card ['S7', 'D2'], current stack 935
player [Yuchun] gets hole card ['C6', 'S4'], current stack 1956
player [Ethan] gets hole card ['S6', 'H9'], current stack 1107
player [YangZ] gets hole card ['DQ', 'HQ'], current stack 940
player [Finneas] gets hole card ['CQ', 'D7'], current stack 1044
Started the round 30
Street "preflop" started. (community card = [])
"YangZ" declared "fold:0"
"Finneas" declared "call:10"
"Zheng" declared "call:10"
"SichengZuo" declared "fold:0"
"Yuchun" declared "call:10"
"Ethan" declared "fold:0"
Street "flop" started. (community card = ['SA', 'S2', 'C7'])
"Yuchun" declared "call:0"
"Finneas" declared "call:0"
"Zheng" declared "call:0"
Street "turn" started. (community card = ['SA', 'S2', 'C7', 'HJ'])
"Yuchun" declared "call:0"
"Finneas" declared "call:0"
"Zheng" declared "call:0"
Street "river" started. (community card = ['SA', 'S2', 'C7', 'HJ', 'DK'])
"Yuchun" declared "call:0"
"Finneas" declared "call:0"
"Zheng" declared "call:0"
"['Finneas']" won the round 30 (stack = {'Zheng': 1989, 'RaphaelPlayer': 0, 'SichengZuo': 935, 'Yuchun': 1951, 'HakulaPlayer': 0, 'Ethan': 1107, 'YangZ': 940, 'Finneas': 1074})
player [Zheng] gets hole card ['S5', 'H5'], current stack 1989
player [SichengZuo] gets hole card ['C3', 'C4'], current stack 935
player [Yuchun] gets hole card ['S3', 'CJ'], current stack 1951
player [Ethan] gets hole card ['S4', 'H9'], current stack 1102
player [YangZ] gets hole card ['D4', 'S6'], current stack 930
player [Finneas] gets hole card ['DJ', 'H7'], current stack 1074
Started the round 31
Street "preflop" started. (community card = [])
"Finneas" declared "call:10"
"Zheng" declared "call:10"
"SichengZuo" declared "fold:0"
"Yuchun" declared "call:10"
"Ethan" declared "fold:0"
"YangZ" declared "fold:0"
Street "flop" started. (community card = ['S2', 'SK', 'CQ'])
"Finneas" declared "call:0"
"Zheng" declared "call:0"
"Yuchun" declared "call:0"
Street "turn" started. (community card = ['S2', 'SK', 'CQ', 'D3'])
"Finneas" declared "call:0"
"Zheng" declared "call:0"
"Yuchun" declared "call:0"
Street "river" started. (community card = ['S2', 'SK', 'CQ', 'D3', 'D5'])
"Finneas" declared "call:0"
"Zheng" declared "raise:1979"
"Yuchun" declared "fold:0"
"Finneas" declared "fold:0"
"['Zheng']" won the round 31 (stack = {'Zheng': 2024, 'RaphaelPlayer': 0, 'SichengZuo': 935, 'Yuchun': 1941, 'HakulaPlayer': 0, 'Ethan': 1102, 'YangZ': 930, 'Finneas': 1064})
player [Zheng] gets hole card ['CJ', 'DT'], current stack 2024
player [SichengZuo] gets hole card ['D4', 'H5'], current stack 935
player [Yuchun] gets hole card ['CT', 'ST'], current stack 1941
player [Ethan] gets hole card ['C6', 'D2'], current stack 1102
player [YangZ] gets hole card ['D3', 'SA'], current stack 925
player [Finneas] gets hole card ['C2', 'CK'], current stack 1054
Started the round 32
Street "preflop" started. (community card = [])
"Zheng" declared "call:10"
"SichengZuo" declared "fold:0"
"Yuchun" declared "call:10"
"Ethan" declared "fold:0"
"YangZ" declared "fold:0"
"Finneas" declared "call:10"
Street "flop" started. (community card = ['HA', 'C9', 'S4'])
"Finneas" declared "call:0"
"Zheng" declared "call:0"
"Yuchun" declared "call:0"
Street "turn" started. (community card = ['HA', 'C9', 'S4', 'S5'])
"Finneas" declared "call:0"
"Zheng" declared "call:0"
"Yuchun" declared "call:0"
Street "river" started. (community card = ['HA', 'C9', 'S4', 'S5', 'C8'])
"Finneas" declared "call:0"
"Zheng" declared "call:0"
"Yuchun" declared "call:0"
"['Yuchun']" won the round 32 (stack = {'Zheng': 2014, 'RaphaelPlayer': 0, 'SichengZuo': 935, 'Yuchun': 1966, 'HakulaPlayer': 0, 'Ethan': 1102, 'YangZ': 925, 'Finneas': 1054})
player [Zheng] gets hole card ['S7', 'C5'], current stack 2004
player [SichengZuo] gets hole card ['HK', 'H7'], current stack 935
player [Yuchun] gets hole card ['D4', 'CT'], current stack 1966
player [Ethan] gets hole card ['H8', 'C3'], current stack 1102
player [YangZ] gets hole card ['H2', 'D7'], current stack 925
player [Finneas] gets hole card ['C6', 'C7'], current stack 1049
Started the round 33
Street "preflop" started. (community card = [])
"SichengZuo" declared "fold:0"
"Yuchun" declared "call:10"
"Ethan" declared "fold:0"
"YangZ" declared "fold:0"
"Finneas" declared "call:10"
"Zheng" declared "call:10"
Street "flop" started. (community card = ['CK', 'H5', 'HT'])
"Finneas" declared "call:0"
"Zheng" declared "call:0"
"Yuchun" declared "call:0"
Street "turn" started. (community card = ['CK', 'H5', 'HT', 'D6'])
"Finneas" declared "call:0"
"Zheng" declared "call:0"
"Yuchun" declared "call:0"
Street "river" started. (community card = ['CK', 'H5', 'HT', 'D6', 'H9'])
"Finneas" declared "call:0"
"Zheng" declared "call:0"
"Yuchun" declared "call:0"
"['Yuchun']" won the round 33 (stack = {'Zheng': 2004, 'RaphaelPlayer': 0, 'SichengZuo': 935, 'Yuchun': 1986, 'HakulaPlayer': 0, 'Ethan': 1102, 'YangZ': 925, 'Finneas': 1044})
player [Zheng] gets hole card ['SJ', 'CQ'], current stack 1999
player [SichengZuo] gets hole card ['SQ', 'D7'], current stack 925
player [Yuchun] gets hole card ['HQ', 'D5'], current stack 1986
player [Ethan] gets hole card ['S8', 'CJ'], current stack 1102
player [YangZ] gets hole card ['DK', 'ST'], current stack 925
player [Finneas] gets hole card ['D2', 'DQ'], current stack 1044
Started the round 34
Street "preflop" started. (community card = [])
"Yuchun" declared "call:10"
"Ethan" declared "fold:0"
"YangZ" declared "fold:0"
"Finneas" declared "call:10"
"Zheng" declared "call:10"
"SichengZuo" declared "fold:0"
Street "flop" started. (community card = ['HT', 'HK', 'S3'])
"Zheng" declared "call:0"
"Yuchun" declared "call:0"
"Finneas" declared "call:0"
Street "turn" started. (community card = ['HT', 'HK', 'S3', 'HJ'])
"Zheng" declared "call:0"
"Yuchun" declared "call:0"
"Finneas" declared "call:0"
Street "river" started. (community card = ['HT', 'HK', 'S3', 'HJ', 'H3'])
"Zheng" declared "call:0"
"Yuchun" declared "raise:40"
"Finneas" declared "fold:0"
"Zheng" declared "call:40"
"['Yuchun']" won the round 34 (stack = {'Zheng': 1954, 'RaphaelPlayer': 0, 'SichengZuo': 925, 'Yuchun': 2056, 'HakulaPlayer': 0, 'Ethan': 1102, 'YangZ': 925, 'Finneas': 1034})
player [Zheng] gets hole card ['H5', 'H6'], current stack 1954
player [SichengZuo] gets hole card ['ST', 'HJ'], current stack 920
player [Yuchun] gets hole card ['HK', 'SJ'], current stack 2046
player [Ethan] gets hole card ['CT', 'CA'], current stack 1102
player [YangZ] gets hole card ['D3', 'S4'], current stack 925
player [Finneas] gets hole card ['HA', 'H3'], current stack 1034
Started the round 35
Street "preflop" started. (community card = [])
"Ethan" declared "call:10"
"YangZ" declared "fold:0"
"Finneas" declared "call:10"
"Zheng" declared "call:10"
"SichengZuo" declared "fold:0"
"Yuchun" declared "call:10"
Street "flop" started. (community card = ['DK', 'CJ', 'D4'])
"Yuchun" declared "raise:40"
"Ethan" declared "call:40"
"Finneas" declared "fold:0"
"Zheng" declared "call:40"
Street "turn" started. (community card = ['DK', 'CJ', 'D4', 'H2'])
"Yuchun" declared "raise:2006"
"Ethan" declared "fold:0"
"Zheng" declared "fold:0"
"['Yuchun']" won the round 35 (stack = {'Zheng': 1904, 'RaphaelPlayer': 0, 'SichengZuo': 920, 'Yuchun': 2171, 'HakulaPlayer': 0, 'Ethan': 1052, 'YangZ': 925, 'Finneas': 1024})
player [Zheng] gets hole card ['C4', 'D5'], current stack 1904
player [SichengZuo] gets hole card ['H7', 'H6'], current stack 920
player [Yuchun] gets hole card ['D9', 'HK'], current stack 2166
player [Ethan] gets hole card ['CJ', 'H9'], current stack 1042
player [YangZ] gets hole card ['C2', 'S6'], current stack 925
player [Finneas] gets hole card ['HA', 'D3'], current stack 1024
Started the round 36
Street "preflop" started. (community card = [])
"YangZ" declared "fold:0"
"Finneas" declared "call:10"
"Zheng" declared "call:10"
"SichengZuo" declared "fold:0"
"Yuchun" declared "call:10"
"Ethan" declared "fold:0"
Street "flop" started. (community card = ['S3', 'H5', 'HT'])
"Yuchun" declared "call:0"
"Finneas" declared "call:0"
"Zheng" declared "call:0"
Street "turn" started. (community card = ['S3', 'H5', 'HT', 'C9'])
"Yuchun" declared "call:0"
"Finneas" declared "call:0"
"Zheng" declared "call:0"
Street "river" started. (community card = ['S3', 'H5', 'HT', 'C9', 'D4'])
"Yuchun" declared "call:0"
"Finneas" declared "call:0"
"Zheng" declared "call:0"
"['Zheng']" won the round 36 (stack = {'Zheng': 1934, 'RaphaelPlayer': 0, 'SichengZuo': 920, 'Yuchun': 2161, 'HakulaPlayer': 0, 'Ethan': 1042, 'YangZ': 925, 'Finneas': 1014})
player [Zheng] gets hole card ['ST', 'D5'], current stack 1934
player [SichengZuo] gets hole card ['DQ', 'D9'], current stack 920
player [Yuchun] gets hole card ['S3', 'S8'], current stack 2161
player [Ethan] gets hole card ['S4', 'C7'], current stack 1037
player [YangZ] gets hole card ['H9', 'H4'], current stack 915
player [Finneas] gets hole card ['CA', 'DK'], current stack 1014
Started the round 37
Street "preflop" started. (community card = [])
"Finneas" declared "raise:514"
"Zheng" declared "fold:0"
"SichengZuo" declared "fold:0"
"Yuchun" declared "fold:0"
"Ethan" declared "fold:0"
"YangZ" declared "fold:0"
"['Finneas']" won the round 37 (stack = {'Zheng': 1934, 'RaphaelPlayer': 0, 'SichengZuo': 920, 'Yuchun': 2161, 'HakulaPlayer': 0, 'Ethan': 1037, 'YangZ': 915, 'Finneas': 1029})
player [Zheng] gets hole card ['C7', 'SJ'], current stack 1934
player [SichengZuo] gets hole card ['D7', 'DJ'], current stack 920
player [Yuchun] gets hole card ['CK', 'C4'], current stack 2161
player [Ethan] gets hole card ['C2', 'C5'], current stack 1037
player [YangZ] gets hole card ['CQ', 'D8'], current stack 910
player [Finneas] gets hole card ['H4', 'S2'], current stack 1019
Started the round 38
Street "preflop" started. (community card = [])
"Zheng" declared "call:10"
"SichengZuo" declared "fold:0"
"Yuchun" declared "call:10"
"Ethan" declared "fold:0"
"YangZ" declared "fold:0"
"Finneas" declared "call:10"
Street "flop" started. (community card = ['SK', 'H2', 'HK'])
"Finneas" declared "call:0"
"Zheng" declared "call:0"
"Yuchun" declared "raise:2151"
"Finneas" declared "fold:0"
"Zheng" declared "fold:0"
"['Yuchun']" won the round 38 (stack = {'Zheng': 1924, 'RaphaelPlayer': 0, 'SichengZuo': 920, 'Yuchun': 2186, 'HakulaPlayer': 0, 'Ethan': 1037, 'YangZ': 910, 'Finneas': 1019})
player [Zheng] gets hole card ['H2', 'D3'], current stack 1914
player [SichengZuo] gets hole card ['HK', 'D4'], current stack 920
player [Yuchun] gets hole card ['D9', 'DJ'], current stack 2186
player [Ethan] gets hole card ['C6', 'DK'], current stack 1037
player [YangZ] gets hole card ['C2', 'C8'], current stack 910
player [Finneas] gets hole card ['C5', 'SK'], current stack 1014
Started the round 39
Street "preflop" started. (community card = [])
"SichengZuo" declared "fold:0"
"Yuchun" declared "call:10"
"Ethan" declared "fold:0"
"YangZ" declared "fold:0"
"Finneas" declared "call:10"
"Zheng" declared "call:10"
Street "flop" started. (community card = ['H6', 'DA', 'D6'])
"Finneas" declared "call:0"
"Zheng" declared "call:0"
"Yuchun" declared "call:0"
Street "turn" started. (community card = ['H6', 'DA', 'D6', 'SQ'])
"Finneas" declared "call:0"
"Zheng" declared "call:0"
"Yuchun" declared "call:0"
Street "river" started. (community card = ['H6', 'DA', 'D6', 'SQ', 'H7'])
"Finneas" declared "call:0"
"Zheng" declared "call:0"
"Yuchun" declared "call:0"
"['Finneas']" won the round 39 (stack = {'Zheng': 1914, 'RaphaelPlayer': 0, 'SichengZuo': 920, 'Yuchun': 2176, 'HakulaPlayer': 0, 'Ethan': 1037, 'YangZ': 910, 'Finneas': 1039})
player [Zheng] gets hole card ['S4', 'D6'], current stack 1909
player [SichengZuo] gets hole card ['D4', 'H7'], current stack 910
player [Yuchun] gets hole card ['S5', 'C4'], current stack 2176
player [Ethan] gets hole card ['C6', 'SK'], current stack 1037
player [YangZ] gets hole card ['S2', 'HJ'], current stack 910
player [Finneas] gets hole card ['H3', 'SJ'], current stack 1039
Started the round 40
Street "preflop" started. (community card = [])
"Yuchun" declared "call:10"
"Ethan" declared "fold:0"
"YangZ" declared "fold:0"
"Finneas" declared "call:10"
"Zheng" declared "call:10"
"SichengZuo" declared "fold:0"
Street "flop" started. (community card = ['DK', 'C9', 'CT'])
"Zheng" declared "call:0"
"Yuchun" declared "call:0"
"Finneas" declared "call:0"
Street "turn" started. (community card = ['DK', 'C9', 'CT', 'HK'])
"Zheng" declared "call:0"
"Yuchun" declared "call:0"
"Finneas" declared "call:0"
Street "river" started. (community card = ['DK', 'C9', 'CT', 'HK', 'C5'])
"Zheng" declared "call:0"
"Yuchun" declared "call:0"
"Finneas" declared "call:0"
"['Yuchun']" won the round 40 (stack = {'Zheng': 1904, 'RaphaelPlayer': 0, 'SichengZuo': 910, 'Yuchun': 2206, 'HakulaPlayer': 0, 'Ethan': 1037, 'YangZ': 910, 'Finneas': 1029})
player [Zheng] gets hole card ['CA', 'HT'], current stack 1904
player [SichengZuo] gets hole card ['H2', 'DK'], current stack 905
player [Yuchun] gets hole card ['S4', 'H9'], current stack 2196
player [Ethan] gets hole card ['SA', 'C6'], current stack 1037
player [YangZ] gets hole card ['SK', 'CJ'], current stack 910
player [Finneas] gets hole card ['D9', 'CK'], current stack 1029
Started the round 41
Street "preflop" started. (community card = [])
"Ethan" declared "fold:0"
"YangZ" declared "fold:0"
"Finneas" declared "call:10"
"Zheng" declared "call:10"
"SichengZuo" declared "fold:0"
"Yuchun" declared "fold:0"
Street "flop" started. (community card = ['C8', 'D7', 'H5'])
"Finneas" declared "call:0"
"Zheng" declared "call:0"
Street "turn" started. (community card = ['C8', 'D7', 'H5', 'HJ'])
"Finneas" declared "call:0"
"Zheng" declared "call:0"
Street "river" started. (community card = ['C8', 'D7', 'H5', 'HJ', 'SQ'])
"Finneas" declared "call:0"
"Zheng" declared "call:0"
"['Zheng']" won the round 41 (stack = {'Zheng': 1929, 'RaphaelPlayer': 0, 'SichengZuo': 905, 'Yuchun': 2196, 'HakulaPlayer': 0, 'Ethan': 1037, 'YangZ': 910, 'Finneas': 1019})
player [Zheng] gets hole card ['D9', 'S9'], current stack 1929
player [SichengZuo] gets hole card ['HK', 'C8'], current stack 905
player [Yuchun] gets hole card ['C9', 'H2'], current stack 2191
player [Ethan] gets hole card ['D4', 'DK'], current stack 1027
player [YangZ] gets hole card ['SJ', 'DJ'], current stack 910
player [Finneas] gets hole card ['CA', 'H9'], current stack 1019
Started the round 42
Street "preflop" started. (community card = [])
"YangZ" declared "fold:0"
"Finneas" declared "call:10"
"Zheng" declared "call:10"
"SichengZuo" declared "fold:0"
"Yuchun" declared "fold:0"
"Ethan" declared "fold:0"
Street "flop" started. (community card = ['CQ', 'SQ', 'D2'])
"Finneas" declared "call:0"
"Zheng" declared "call:0"
Street "turn" started. (community card = ['CQ', 'SQ', 'D2', 'C4'])
"Finneas" declared "call:0"
"Zheng" declared "call:0"
Street "river" started. (community card = ['CQ', 'SQ', 'D2', 'C4', 'DQ'])
"Finneas" declared "raise:509"
"Zheng" declared "raise:1468"
"Finneas" declared "fold:0"
"['Zheng']" won the round 42 (stack = {'Zheng': 2463, 'RaphaelPlayer': 0, 'SichengZuo': 905, 'Yuchun': 2191, 'HakulaPlayer': 0, 'Ethan': 1027, 'YangZ': 910, 'Finneas': 500})
player [Zheng] gets hole card ['S8', 'S9'], current stack 2463
player [SichengZuo] gets hole card ['S3', 'C9'], current stack 905
player [Yuchun] gets hole card ['S6', 'HT'], current stack 2191
player [Ethan] gets hole card ['S5', 'DJ'], current stack 1022
player [YangZ] gets hole card ['H9', 'D4'], current stack 900
player [Finneas] gets hole card ['SQ', 'D8'], current stack 500
Started the round 43
Street "preflop" started. (community card = [])
"Finneas" declared "call:10"
"Zheng" declared "call:10"
"SichengZuo" declared "fold:0"
"Yuchun" declared "fold:0"
"Ethan" declared "fold:0"
"YangZ" declared "fold:0"
Street "flop" started. (community card = ['D6', 'D3', 'ST'])
"Finneas" declared "call:0"
"Zheng" declared "call:0"
Street "turn" started. (community card = ['D6', 'D3', 'ST', 'H8'])
"Finneas" declared "call:0"
"Zheng" declared "call:0"
Street "river" started. (community card = ['D6', 'D3', 'ST', 'H8', 'S2'])
"Finneas" declared "call:0"
"Zheng" declared "call:0"
"['Finneas']" won the round 43 (stack = {'Zheng': 2453, 'RaphaelPlayer': 0, 'SichengZuo': 905, 'Yuchun': 2191, 'HakulaPlayer': 0, 'Ethan': 1022, 'YangZ': 900, 'Finneas': 525})
player [Zheng] gets hole card ['C2', 'S2'], current stack 2453
player [SichengZuo] gets hole card ['CQ', 'HK'], current stack 905
player [Yuchun] gets hole card ['D4', 'C9'], current stack 2191
player [Ethan] gets hole card ['H9', 'HA'], current stack 1022
player [YangZ] gets hole card ['DJ', 'D2'], current stack 895
player [Finneas] gets hole card ['HJ', 'C3'], current stack 515
Started the round 44
Street "preflop" started. (community card = [])
"Zheng" declared "call:10"
"SichengZuo" declared "fold:0"
"Yuchun" declared "fold:0"
"Ethan" declared "fold:0"
"YangZ" declared "fold:0"
"Finneas" declared "call:10"
Street "flop" started. (community card = ['HT', 'DK', 'S6'])
"Finneas" declared "call:0"
"Zheng" declared "call:0"
Street "turn" started. (community card = ['HT', 'DK', 'S6', 'CK'])
"Finneas" declared "call:0"
"Zheng" declared "call:0"
Street "river" started. (community card = ['HT', 'DK', 'S6', 'CK', 'D5'])
"Finneas" declared "call:0"
"Zheng" declared "call:0"
"['Zheng']" won the round 44 (stack = {'Zheng': 2468, 'RaphaelPlayer': 0, 'SichengZuo': 905, 'Yuchun': 2191, 'HakulaPlayer': 0, 'Ethan': 1022, 'YangZ': 895, 'Finneas': 515})
player [Zheng] gets hole card ['CK', 'DA'], current stack 2458
player [SichengZuo] gets hole card ['H2', 'H3'], current stack 905
player [Yuchun] gets hole card ['C6', 'ST'], current stack 2191
player [Ethan] gets hole card ['H9', 'C8'], current stack 1022
player [YangZ] gets hole card ['C4', 'S6'], current stack 895
player [Finneas] gets hole card ['H6', 'DT'], current stack 510
Started the round 45
Street "preflop" started. (community card = [])
"SichengZuo" declared "fold:0"
"Yuchun" declared "fold:0"
"Ethan" declared "fold:0"
"YangZ" declared "fold:0"
"Finneas" declared "call:10"
"Zheng" declared "call:10"
Street "flop" started. (community card = ['SJ', 'C3', 'HQ'])
"Finneas" declared "call:0"
"Zheng" declared "call:0"
Street "turn" started. (community card = ['SJ', 'C3', 'HQ', 'D5'])
"Finneas" declared "call:0"
"Zheng" declared "call:0"
Street "river" started. (community card = ['SJ', 'C3', 'HQ', 'D5', 'H8'])
"Finneas" declared "call:0"
"Zheng" declared "call:0"
"['Zheng']" won the round 45 (stack = {'Zheng': 2478, 'RaphaelPlayer': 0, 'SichengZuo': 905, 'Yuchun': 2191, 'HakulaPlayer': 0, 'Ethan': 1022, 'YangZ': 895, 'Finneas': 505})
player [Zheng] gets hole card ['S6', 'SQ'], current stack 2473
player [SichengZuo] gets hole card ['H6', 'S9'], current stack 895
player [Yuchun] gets hole card ['CK', 'C6'], current stack 2191
player [Ethan] gets hole card ['S7', 'CA'], current stack 1022
player [YangZ] gets hole card ['ST', 'S4'], current stack 895
player [Finneas] gets hole card ['H8', 'H4'], current stack 505
Started the round 46
Street "preflop" started. (community card = [])
"Yuchun" declared "fold:0"
"Ethan" declared "fold:0"
"YangZ" declared "fold:0"
"Finneas" declared "call:10"
"Zheng" declared "call:10"
"SichengZuo" declared "fold:0"
Street "flop" started. (community card = ['SK', 'S5', 'C4'])
"Zheng" declared "call:0"
"Finneas" declared "call:0"
Street "turn" started. (community card = ['SK', 'S5', 'C4', 'D3'])
"Zheng" declared "call:0"
"Finneas" declared "call:0"
Street "river" started. (community card = ['SK', 'S5', 'C4', 'D3', 'HA'])
"Zheng" declared "call:0"
"Finneas" declared "call:0"
"['Finneas']" won the round 46 (stack = {'Zheng': 2468, 'RaphaelPlayer': 0, 'SichengZuo': 895, 'Yuchun': 2191, 'HakulaPlayer': 0, 'Ethan': 1022, 'YangZ': 895, 'Finneas': 525})
player [Zheng] gets hole card ['HK', 'C2'], current stack 2468
player [SichengZuo] gets hole card ['S3', 'C4'], current stack 890
player [Yuchun] gets hole card ['CK', 'H5'], current stack 2181
player [Ethan] gets hole card ['S8', 'D9'], current stack 1022
player [YangZ] gets hole card ['SA', 'CT'], current stack 895
player [Finneas] gets hole card ['H6', 'H2'], current stack 525
Started the round 47
Street "preflop" started. (community card = [])
"Ethan" declared "fold:0"
"YangZ" declared "fold:0"
"Finneas" declared "call:10"
"Zheng" declared "call:10"
"SichengZuo" declared "fold:0"
"Yuchun" declared "fold:0"
Street "flop" started. (community card = ['C6', 'S5', 'S2'])
"Finneas" declared "call:0"
"Zheng" declared "call:0"
Street "turn" started. (community card = ['C6', 'S5', 'S2', 'D2'])
"Finneas" declared "raise:262"
"Zheng" declared "raise:1491"
"Finneas" declared "fold:0"
"['Zheng']" won the round 47 (stack = {'Zheng': 2755, 'RaphaelPlayer': 0, 'SichengZuo': 890, 'Yuchun': 2181, 'HakulaPlayer': 0, 'Ethan': 1022, 'YangZ': 895, 'Finneas': 253})
player [Zheng] gets hole card ['D7', 'C3'], current stack 2755
player [SichengZuo] gets hole card ['H7', 'S2'], current stack 890
player [Yuchun] gets hole card ['H9', 'HJ'], current stack 2176
player [Ethan] gets hole card ['C5', 'DT'], current stack 1012
player [YangZ] gets hole card ['HT', 'DA'], current stack 895
player [Finneas] gets hole card ['S9', 'D8'], current stack 253
Started the round 48
Street "preflop" started. (community card = [])
"YangZ" declared "fold:0"
"Finneas" declared "call:10"
"Zheng" declared "call:10"
"SichengZuo" declared "fold:0"
"Yuchun" declared "fold:0"
"Ethan" declared "fold:0"
Street "flop" started. (community card = ['C8', 'HQ', 'DK'])
"Finneas" declared "call:0"
"Zheng" declared "call:0"
Street "turn" started. (community card = ['C8', 'HQ', 'DK', 'CQ'])
"Finneas" declared "call:0"
"Zheng" declared "call:0"
Street "river" started. (community card = ['C8', 'HQ', 'DK', 'CQ', 'S7'])
"Finneas" declared "call:0"
"Zheng" declared "call:0"
"['Finneas']" won the round 48 (stack = {'Zheng': 2745, 'RaphaelPlayer': 0, 'SichengZuo': 890, 'Yuchun': 2176, 'HakulaPlayer': 0, 'Ethan': 1012, 'YangZ': 895, 'Finneas': 278})
player [Zheng] gets hole card ['CA', 'S9'], current stack 2745
player [SichengZuo] gets hole card ['D8', 'C9'], current stack 890
player [Yuchun] gets hole card ['SJ', 'H9'], current stack 2176
player [Ethan] gets hole card ['C3', 'H8'], current stack 1007
player [YangZ] gets hole card ['S4', 'D5'], current stack 885
player [Finneas] gets hole card ['D7', 'S7'], current stack 278
Started the round 49
Street "preflop" started. (community card = [])
"Finneas" declared "call:10"
"Zheng" declared "call:10"
"SichengZuo" declared "fold:0"
"Yuchun" declared "fold:0"
"Ethan" declared "fold:0"
"YangZ" declared "fold:0"
Street "flop" started. (community card = ['D6', 'DT', 'DA'])
"Finneas" declared "call:0"
"Zheng" declared "call:0"
Street "turn" started. (community card = ['D6', 'DT', 'DA', 'C5'])
"Finneas" declared "call:0"
"Zheng" declared "call:0"
Street "river" started. (community card = ['D6', 'DT', 'DA', 'C5', 'SK'])
"Finneas" declared "call:0"
"Zheng" declared "call:0"
"['Zheng']" won the round 49 (stack = {'Zheng': 2770, 'RaphaelPlayer': 0, 'SichengZuo': 890, 'Yuchun': 2176, 'HakulaPlayer': 0, 'Ethan': 1007, 'YangZ': 885, 'Finneas': 268})
player [Zheng] gets hole card ['H3', 'CA'], current stack 2770
player [SichengZuo] gets hole card ['C6', 'S8'], current stack 890
player [Yuchun] gets hole card ['S6', 'C5'], current stack 2176
player [Ethan] gets hole card ['C3', 'D5'], current stack 1007
player [YangZ] gets hole card ['H9', 'S9'], current stack 880
player [Finneas] gets hole card ['D8', 'C9'], current stack 258
Started the round 50
Street "preflop" started. (community card = [])
"Zheng" declared "call:10"
"SichengZuo" declared "fold:0"
"Yuchun" declared "fold:0"
"Ethan" declared "fold:0"
"YangZ" declared "fold:0"
"Finneas" declared "call:10"
Street "flop" started. (community card = ['CJ', 'C7', 'SJ'])
"Finneas" declared "call:0"
"Zheng" declared "call:0"
Street "turn" started. (community card = ['CJ', 'C7', 'SJ', 'HK'])
"Finneas" declared "call:0"
"Zheng" declared "call:0"
Street "river" started. (community card = ['CJ', 'C7', 'SJ', 'HK', 'S7'])
"Finneas" declared "call:0"
"Zheng" declared "call:0"
"['Zheng']" won the round 50 (stack = {'Zheng': 2785, 'RaphaelPlayer': 0, 'SichengZuo': 890, 'Yuchun': 2176, 'HakulaPlayer': 0, 'Ethan': 1007, 'YangZ': 880, 'Finneas': 258})

Game Results:
------------------------------------------------------------
Game 1:
Winner: Zheng (stack: 2785)
All players' stacks:
  Zheng: 2785
  RaphaelPlayer: 0
  SichengZuo: 890
  Yuchun: 2176
  HakulaPlayer: 0
  Ethan: 1007
  YangZ: 880
  Finneas: 258
------------------------------------------------------------
