player [Zheng] gets hole card ['C8', 'C3'], current stack 1000
player [RaphaelPlayer] gets hole card ['HJ', 'ST'], current stack 995
player [SichengZuo] gets hole card ['H7', 'CK'], current stack 990
player [Yuchun] gets hole card ['SJ', 'HT'], current stack 1000
player [HakulaPlayer] gets hole card ['SA', 'HQ'], current stack 1000
player [Ethan] gets hole card ['H5', 'CA'], current stack 1000
player [YangZ] gets hole card ['S2', 'H9'], current stack 1000
player [Finneas] gets hole card ['C6', 'CJ'], current stack 1000
Started the round 1
Street "preflop" started. (community card = [])
"Yuchun" declared "fold:0"
"HakulaPlayer" declared "call:10"
"Ethan" declared "fold:0"
"YangZ" declared "fold:0"
"Finneas" declared "call:10"
"Zheng" declared "call:10"
"RaphaelPlayer" declared "call:10"
"SichengZuo" declared "fold:0"
Street "flop" started. (community card = ['D6', 'D8', 'S9'])
"RaphaelPlayer" declared "call:0"
"HakulaPlayer" declared "call:0"
"Finneas" declared "call:0"
"Zheng" declared "call:0"
Street "turn" started. (community card = ['D6', 'D8', 'S9', 'DA'])
"RaphaelPlayer" declared "call:0"
"HakulaPlayer" declared "call:0"
"Finneas" declared "call:0"
"Zheng" declared "call:0"
Street "river" started. (community card = ['D6', 'D8', 'S9', 'DA', 'D5'])
"RaphaelPlayer" declared "call:0"
"HakulaPlayer" declared "call:0"
"Finneas" declared "call:0"
"Zheng" declared "call:0"
"['HakulaPlayer']" won the round 1 (stack = {'Zheng': 990, 'RaphaelPlayer': 990, 'SichengZuo': 990, 'Yuchun': 1000, 'HakulaPlayer': 1040, 'Ethan': 1000, 'YangZ': 1000, 'Finneas': 990})
player [Zheng] gets hole card ['D6', 'D9'], current stack 990
player [RaphaelPlayer] gets hole card ['DT', 'HK'], current stack 990
player [SichengZuo] gets hole card ['HQ', 'CJ'], current stack 985
player [Yuchun] gets hole card ['CA', 'S8'], current stack 990
player [HakulaPlayer] gets hole card ['S9', 'C8'], current stack 1040
player [Ethan] gets hole card ['H8', 'D5'], current stack 1000
player [YangZ] gets hole card ['SK', 'CK'], current stack 1000
player [Finneas] gets hole card ['CT', 'SJ'], current stack 990
Started the round 2
Street "preflop" started. (community card = [])
"HakulaPlayer" declared "fold:0"
"Ethan" declared "fold:0"
"YangZ" declared "fold:0"
"Finneas" declared "call:10"
"Zheng" declared "call:10"
"RaphaelPlayer" declared "call:10"
"SichengZuo" declared "fold:0"
"Yuchun" declared "fold:0"
Street "flop" started. (community card = ['C7', 'D2', 'DA'])
"Finneas" declared "call:0"
"Zheng" declared "call:0"
"RaphaelPlayer" declared "call:0"
Street "turn" started. (community card = ['C7', 'D2', 'DA', 'H6'])
"Finneas" declared "call:0"
"Zheng" declared "call:0"
"RaphaelPlayer" declared "call:0"
Street "river" started. (community card = ['C7', 'D2', 'DA', 'H6', 'S2'])
"Finneas" declared "call:0"
"Zheng" declared "call:0"
"RaphaelPlayer" declared "call:0"
"['Zheng']" won the round 2 (stack = {'Zheng': 1025, 'RaphaelPlayer': 980, 'SichengZuo': 985, 'Yuchun': 990, 'HakulaPlayer': 1040, 'Ethan': 1000, 'YangZ': 1000, 'Finneas': 980})
player [Zheng] gets hole card ['CT', 'SJ'], current stack 1025
player [RaphaelPlayer] gets hole card ['HQ', 'SQ'], current stack 980
player [SichengZuo] gets hole card ['H7', 'HK'], current stack 985
player [Yuchun] gets hole card ['C3', 'S6'], current stack 985
player [HakulaPlayer] gets hole card ['D5', 'C8'], current stack 1030
player [Ethan] gets hole card ['H5', 'H3'], current stack 1000
player [YangZ] gets hole card ['SK', 'C4'], current stack 1000
player [Finneas] gets hole card ['D8', 'HA'], current stack 980
Started the round 3
Street "preflop" started. (community card = [])
"Ethan" declared "fold:0"
"YangZ" declared "fold:0"
"Finneas" declared "call:10"
"Zheng" declared "call:10"
"RaphaelPlayer" declared "raise:40"
"SichengZuo" declared "fold:0"
"Yuchun" declared "fold:0"
"HakulaPlayer" declared "fold:0"
"Finneas" declared "fold:0"
"Zheng" declared "fold:0"
"['RaphaelPlayer']" won the round 3 (stack = {'Zheng': 1015, 'RaphaelPlayer': 1015, 'SichengZuo': 985, 'Yuchun': 985, 'HakulaPlayer': 1030, 'Ethan': 1000, 'YangZ': 1000, 'Finneas': 970})
player [Zheng] gets hole card ['C9', 'SJ'], current stack 1015
player [RaphaelPlayer] gets hole card ['C7', 'HJ'], current stack 1015
player [SichengZuo] gets hole card ['SQ', 'ST'], current stack 985
player [Yuchun] gets hole card ['D3', 'C3'], current stack 985
player [HakulaPlayer] gets hole card ['S8', 'C4'], current stack 1025
player [Ethan] gets hole card ['H9', 'H6'], current stack 990
player [YangZ] gets hole card ['S2', 'S3'], current stack 1000
player [Finneas] gets hole card ['H2', 'CK'], current stack 970
Started the round 4
Street "preflop" started. (community card = [])
"YangZ" declared "fold:0"
"Finneas" declared "call:10"
"Zheng" declared "call:10"
"RaphaelPlayer" declared "call:10"
"SichengZuo" declared "fold:0"
"Yuchun" declared "fold:0"
"HakulaPlayer" declared "call:10"
"Ethan" declared "fold:0"
Street "flop" started. (community card = ['HQ', 'DK', 'DQ'])
"HakulaPlayer" declared "call:0"
"Finneas" declared "call:0"
"Zheng" declared "call:0"
"RaphaelPlayer" declared "call:0"
Street "turn" started. (community card = ['HQ', 'DK', 'DQ', 'H7'])
"HakulaPlayer" declared "call:0"
"Finneas" declared "call:0"
"Zheng" declared "call:0"
"RaphaelPlayer" declared "call:0"
Street "river" started. (community card = ['HQ', 'DK', 'DQ', 'H7', 'DA'])
"HakulaPlayer" declared "call:0"
"Finneas" declared "call:0"
"Zheng" declared "call:0"
"RaphaelPlayer" declared "call:0"
"['Finneas']" won the round 4 (stack = {'Zheng': 1005, 'RaphaelPlayer': 1005, 'SichengZuo': 985, 'Yuchun': 985, 'HakulaPlayer': 1020, 'Ethan': 990, 'YangZ': 1000, 'Finneas': 1010})
player [Zheng] gets hole card ['H4', 'HK'], current stack 1005
player [RaphaelPlayer] gets hole card ['CT', 'D8'], current stack 1005
player [SichengZuo] gets hole card ['CQ', 'HQ'], current stack 985
player [Yuchun] gets hole card ['C5', 'DJ'], current stack 985
player [HakulaPlayer] gets hole card ['D9', 'H5'], current stack 1020
player [Ethan] gets hole card ['DQ', 'DA'], current stack 985
player [YangZ] gets hole card ['H8', 'S8'], current stack 990
player [Finneas] gets hole card ['CJ', 'D3'], current stack 1010
Started the round 5
Street "preflop" started. (community card = [])
"Finneas" declared "call:10"
"Zheng" declared "call:10"
"RaphaelPlayer" declared "fold:0"
"SichengZuo" declared "fold:0"
"Yuchun" declared "fold:0"
"HakulaPlayer" declared "call:10"
"Ethan" declared "raise:148"
"YangZ" declared "fold:0"
"Finneas" declared "fold:0"
"Zheng" declared "fold:0"
"HakulaPlayer" declared "fold:0"
"['Ethan']" won the round 5 (stack = {'Zheng': 995, 'RaphaelPlayer': 1005, 'SichengZuo': 985, 'Yuchun': 985, 'HakulaPlayer': 1010, 'Ethan': 1030, 'YangZ': 990, 'Finneas': 1000})
player [Zheng] gets hole card ['CK', 'HA'], current stack 995
player [RaphaelPlayer] gets hole card ['DK', 'S8'], current stack 1005
player [SichengZuo] gets hole card ['ST', 'HJ'], current stack 985
player [Yuchun] gets hole card ['S2', 'S3'], current stack 985
player [HakulaPlayer] gets hole card ['D5', 'DT'], current stack 1010
player [Ethan] gets hole card ['S5', 'DQ'], current stack 1030
player [YangZ] gets hole card ['H7', 'HQ'], current stack 985
player [Finneas] gets hole card ['D8', 'DA'], current stack 990
Started the round 6
Street "preflop" started. (community card = [])
"Zheng" declared "call:10"
"RaphaelPlayer" declared "call:10"
"SichengZuo" declared "fold:0"
"Yuchun" declared "fold:0"
"HakulaPlayer" declared "call:10"
"Ethan" declared "fold:0"
"YangZ" declared "fold:0"
"Finneas" declared "call:10"
Street "flop" started. (community card = ['C4', 'C2', 'H6'])
"Finneas" declared "call:0"
"Zheng" declared "call:0"
"RaphaelPlayer" declared "call:0"
"HakulaPlayer" declared "raise:27"
"Finneas" declared "fold:0"
"Zheng" declared "fold:0"
"RaphaelPlayer" declared "fold:0"
"['HakulaPlayer']" won the round 6 (stack = {'Zheng': 985, 'RaphaelPlayer': 995, 'SichengZuo': 985, 'Yuchun': 985, 'HakulaPlayer': 1045, 'Ethan': 1030, 'YangZ': 985, 'Finneas': 990})
player [Zheng] gets hole card ['C3', 'DK'], current stack 975
player [RaphaelPlayer] gets hole card ['D8', 'CA'], current stack 995
player [SichengZuo] gets hole card ['SA', 'H6'], current stack 985
player [Yuchun] gets hole card ['CJ', 'CK'], current stack 985
player [HakulaPlayer] gets hole card ['S2', 'D2'], current stack 1045
player [Ethan] gets hole card ['D4', 'C9'], current stack 1030
player [YangZ] gets hole card ['S3', 'CQ'], current stack 985
player [Finneas] gets hole card ['H4', 'S9'], current stack 985
Started the round 7
Street "preflop" started. (community card = [])
"RaphaelPlayer" declared "call:10"
"SichengZuo" declared "fold:0"
"Yuchun" declared "fold:0"
"HakulaPlayer" declared "call:10"
"Ethan" declared "fold:0"
"YangZ" declared "fold:0"
"Finneas" declared "call:10"
"Zheng" declared "call:10"
Street "flop" started. (community card = ['C4', 'C6', 'D6'])
"Finneas" declared "call:0"
"Zheng" declared "call:0"
"RaphaelPlayer" declared "call:0"
"HakulaPlayer" declared "call:0"
Street "turn" started. (community card = ['C4', 'C6', 'D6', 'D9'])
"Finneas" declared "call:0"
"Zheng" declared "call:0"
"RaphaelPlayer" declared "call:0"
"HakulaPlayer" declared "call:0"
Street "river" started. (community card = ['C4', 'C6', 'D6', 'D9', 'DQ'])
"Finneas" declared "call:0"
"Zheng" declared "call:0"
"RaphaelPlayer" declared "call:0"
"HakulaPlayer" declared "call:0"
"['Finneas']" won the round 7 (stack = {'Zheng': 975, 'RaphaelPlayer': 985, 'SichengZuo': 985, 'Yuchun': 985, 'HakulaPlayer': 1035, 'Ethan': 1030, 'YangZ': 985, 'Finneas': 1020})
player [Zheng] gets hole card ['H6', 'HQ'], current stack 970
player [RaphaelPlayer] gets hole card ['DT', 'H9'], current stack 975
player [SichengZuo] gets hole card ['C8', 'SK'], current stack 985
player [Yuchun] gets hole card ['C3', 'H4'], current stack 985
player [HakulaPlayer] gets hole card ['D2', 'C2'], current stack 1035
player [Ethan] gets hole card ['H8', 'CT'], current stack 1030
player [YangZ] gets hole card ['CK', 'S6'], current stack 985
player [Finneas] gets hole card ['DQ', 'S9'], current stack 1020
Started the round 8
Street "preflop" started. (community card = [])
"SichengZuo" declared "fold:0"
"Yuchun" declared "fold:0"
"HakulaPlayer" declared "fold:0"
"Ethan" declared "fold:0"
"YangZ" declared "fold:0"
"Finneas" declared "call:10"
"Zheng" declared "call:10"
"RaphaelPlayer" declared "call:10"
Street "flop" started. (community card = ['S2', 'S3', 'D6'])
"Zheng" declared "call:0"
"RaphaelPlayer" declared "call:0"
"Finneas" declared "call:0"
Street "turn" started. (community card = ['S2', 'S3', 'D6', 'D4'])
"Zheng" declared "call:0"
"RaphaelPlayer" declared "call:0"
"Finneas" declared "call:0"
Street "river" started. (community card = ['S2', 'S3', 'D6', 'D4', 'SQ'])
"Zheng" declared "call:0"
"RaphaelPlayer" declared "call:0"
"Finneas" declared "call:0"
"['Zheng']" won the round 8 (stack = {'Zheng': 995, 'RaphaelPlayer': 975, 'SichengZuo': 985, 'Yuchun': 985, 'HakulaPlayer': 1035, 'Ethan': 1030, 'YangZ': 985, 'Finneas': 1010})
player [Zheng] gets hole card ['HT', 'CA'], current stack 995
player [RaphaelPlayer] gets hole card ['C4', 'D3'], current stack 970
player [SichengZuo] gets hole card ['HQ', 'C7'], current stack 975
player [Yuchun] gets hole card ['H7', 'D4'], current stack 985
player [HakulaPlayer] gets hole card ['SQ', 'H6'], current stack 1035
player [Ethan] gets hole card ['SA', 'C8'], current stack 1030
player [YangZ] gets hole card ['S8', 'S5'], current stack 985
player [Finneas] gets hole card ['H8', 'D5'], current stack 1010
Started the round 9
Street "preflop" started. (community card = [])
"Yuchun" declared "fold:0"
"HakulaPlayer" declared "fold:0"
"Ethan" declared "fold:0"
"YangZ" declared "fold:0"
"Finneas" declared "call:10"
"Zheng" declared "call:10"
"RaphaelPlayer" declared "fold:0"
"SichengZuo" declared "fold:0"
Street "flop" started. (community card = ['C3', 'DJ', 'D9'])
"Finneas" declared "call:0"
"Zheng" declared "call:0"
Street "turn" started. (community card = ['C3', 'DJ', 'D9', 'S6'])
"Finneas" declared "call:0"
"Zheng" declared "call:0"
Street "river" started. (community card = ['C3', 'DJ', 'D9', 'S6', 'DA'])
"Finneas" declared "call:0"
"Zheng" declared "raise:985"
"Finneas" declared "fold:0"
"['Zheng']" won the round 9 (stack = {'Zheng': 1020, 'RaphaelPlayer': 970, 'SichengZuo': 975, 'Yuchun': 985, 'HakulaPlayer': 1035, 'Ethan': 1030, 'YangZ': 985, 'Finneas': 1000})
player [Zheng] gets hole card ['C6', 'S4'], current stack 1020
player [RaphaelPlayer] gets hole card ['DT', 'S6'], current stack 970
player [SichengZuo] gets hole card ['DA', 'D8'], current stack 970
player [Yuchun] gets hole card ['C5', 'S3'], current stack 975
player [HakulaPlayer] gets hole card ['DK', 'C9'], current stack 1035
player [Ethan] gets hole card ['SJ', 'C7'], current stack 1030
player [YangZ] gets hole card ['HA', 'HQ'], current stack 985
player [Finneas] gets hole card ['CA', 'S8'], current stack 1000
Started the round 10
Street "preflop" started. (community card = [])
"HakulaPlayer" declared "fold:0"
"Ethan" declared "fold:0"
"YangZ" declared "fold:0"
"Finneas" declared "call:10"
"Zheng" declared "call:10"
"RaphaelPlayer" declared "fold:0"
"SichengZuo" declared "fold:0"
"Yuchun" declared "call:10"
Street "flop" started. (community card = ['S7', 'CJ', 'H8'])
"Yuchun" declared "call:0"
"Finneas" declared "call:0"
"Zheng" declared "call:0"
Street "turn" started. (community card = ['S7', 'CJ', 'H8', 'H9'])
"Yuchun" declared "call:0"
"Finneas" declared "call:0"
"Zheng" declared "call:0"
Street "river" started. (community card = ['S7', 'CJ', 'H8', 'H9', 'DQ'])
"Yuchun" declared "call:0"
"Finneas" declared "call:0"
"Zheng" declared "call:0"
"['Finneas']" won the round 10 (stack = {'Zheng': 1010, 'RaphaelPlayer': 970, 'SichengZuo': 970, 'Yuchun': 975, 'HakulaPlayer': 1035, 'Ethan': 1030, 'YangZ': 985, 'Finneas': 1025})
player [Zheng] gets hole card ['HK', 'D6'], current stack 1010
player [RaphaelPlayer] gets hole card ['CK', 'C5'], current stack 970
player [SichengZuo] gets hole card ['S9', 'S5'], current stack 970
player [Yuchun] gets hole card ['C4', 'H4'], current stack 970
player [HakulaPlayer] gets hole card ['S7', 'ST'], current stack 1025
player [Ethan] gets hole card ['S2', 'C7'], current stack 1030
player [YangZ] gets hole card ['SQ', 'DT'], current stack 985
player [Finneas] gets hole card ['DK', 'D7'], current stack 1025
Started the round 11
Street "preflop" started. (community card = [])
"Ethan" declared "fold:0"
"YangZ" declared "fold:0"
"Finneas" declared "call:10"
"Zheng" declared "call:10"
"RaphaelPlayer" declared "call:10"
"SichengZuo" declared "fold:0"
"Yuchun" declared "call:10"
"HakulaPlayer" declared "call:10"
Street "flop" started. (community card = ['C3', 'D4', 'H5'])
"Yuchun" declared "call:0"
"HakulaPlayer" declared "call:0"
"Finneas" declared "call:0"
"Zheng" declared "call:0"
"RaphaelPlayer" declared "call:0"
Street "turn" started. (community card = ['C3', 'D4', 'H5', 'D5'])
"Yuchun" declared "raise:965"
"HakulaPlayer" declared "fold:0"
"Finneas" declared "fold:0"
"Zheng" declared "fold:0"
"RaphaelPlayer" declared "call:965"
Street "river" started. (community card = ['C3', 'D4', 'H5', 'D5', 'H2'])
"['Yuchun']" won the round 11 (stack = {'Zheng': 1000, 'RaphaelPlayer': 0, 'SichengZuo': 970, 'Yuchun': 1975, 'HakulaPlayer': 1025, 'Ethan': 1030, 'YangZ': 985, 'Finneas': 1015})
player [Zheng] gets hole card ['D6', 'SA'], current stack 1000
player [SichengZuo] gets hole card ['S9', 'DJ'], current stack 970
player [Yuchun] gets hole card ['H7', 'H5'], current stack 1975
player [HakulaPlayer] gets hole card ['C2', 'DA'], current stack 1020
player [Ethan] gets hole card ['H4', 'HK'], current stack 1020
player [YangZ] gets hole card ['C5', 'H3'], current stack 985
player [Finneas] gets hole card ['SK', 'SQ'], current stack 1015
Started the round 12
Street "preflop" started. (community card = [])
"YangZ" declared "fold:0"
"Finneas" declared "call:10"
"Zheng" declared "call:10"
"SichengZuo" declared "fold:0"
"Yuchun" declared "call:10"
"HakulaPlayer" declared "call:10"
"Ethan" declared "fold:0"
Street "flop" started. (community card = ['S3', 'C9', 'DT'])
"HakulaPlayer" declared "call:0"
"Finneas" declared "call:0"
"Zheng" declared "call:0"
"Yuchun" declared "call:0"
Street "turn" started. (community card = ['S3', 'C9', 'DT', 'HQ'])
"HakulaPlayer" declared "call:0"
"Finneas" declared "call:0"
"Zheng" declared "call:0"
"Yuchun" declared "call:0"
Street "river" started. (community card = ['S3', 'C9', 'DT', 'HQ', 'H6'])
"HakulaPlayer" declared "call:0"
"Finneas" declared "call:0"
"Zheng" declared "call:0"
"Yuchun" declared "call:0"
"['Finneas']" won the round 12 (stack = {'Zheng': 990, 'RaphaelPlayer': 0, 'SichengZuo': 970, 'Yuchun': 1965, 'HakulaPlayer': 1015, 'Ethan': 1020, 'YangZ': 985, 'Finneas': 1055})
player [Zheng] gets hole card ['H9', 'D6'], current stack 990
player [SichengZuo] gets hole card ['C8', 'S2'], current stack 970
player [Yuchun] gets hole card ['S9', 'S5'], current stack 1965
player [HakulaPlayer] gets hole card ['SQ', 'C2'], current stack 1015
player [Ethan] gets hole card ['H8', 'DJ'], current stack 1015
player [YangZ] gets hole card ['D3', 'S4'], current stack 975
player [Finneas] gets hole card ['HQ', 'CJ'], current stack 1055
Started the round 13
Street "preflop" started. (community card = [])
"Finneas" declared "call:10"
"Zheng" declared "call:10"
"SichengZuo" declared "fold:0"
"Yuchun" declared "call:10"
"HakulaPlayer" declared "call:10"
"Ethan" declared "fold:0"
"YangZ" declared "fold:0"
Street "flop" started. (community card = ['ST', 'D8', 'C4'])
"Finneas" declared "call:0"
"Zheng" declared "call:0"
"Yuchun" declared "call:0"
"HakulaPlayer" declared "call:0"
Street "turn" started. (community card = ['ST', 'D8', 'C4', 'HJ'])
"Finneas" declared "call:0"
"Zheng" declared "call:0"
"Yuchun" declared "call:0"
"HakulaPlayer" declared "call:0"
Street "river" started. (community card = ['ST', 'D8', 'C4', 'HJ', 'HK'])
"Finneas" declared "call:0"
"Zheng" declared "call:0"
"Yuchun" declared "call:0"
"HakulaPlayer" declared "call:0"
"['Finneas']" won the round 13 (stack = {'Zheng': 980, 'RaphaelPlayer': 0, 'SichengZuo': 970, 'Yuchun': 1955, 'HakulaPlayer': 1005, 'Ethan': 1015, 'YangZ': 975, 'Finneas': 1100})
player [Zheng] gets hole card ['D9', 'DQ'], current stack 980
player [SichengZuo] gets hole card ['D7', 'CJ'], current stack 970
player [Yuchun] gets hole card ['CK', 'S8'], current stack 1955
player [HakulaPlayer] gets hole card ['SQ', 'D6'], current stack 1005
player [Ethan] gets hole card ['H2', 'DA'], current stack 1015
player [YangZ] gets hole card ['ST', 'CA'], current stack 970
player [Finneas] gets hole card ['HA', 'D2'], current stack 1090
Started the round 14
Street "preflop" started. (community card = [])
"Zheng" declared "call:10"
"SichengZuo" declared "fold:0"
"Yuchun" declared "call:10"
"HakulaPlayer" declared "call:10"
"Ethan" declared "fold:0"
"YangZ" declared "fold:0"
"Finneas" declared "call:10"
Street "flop" started. (community card = ['SA', 'D3', 'DJ'])
"Finneas" declared "call:0"
"Zheng" declared "call:0"
"Yuchun" declared "call:0"
"HakulaPlayer" declared "call:0"
Street "turn" started. (community card = ['SA', 'D3', 'DJ', 'HQ'])
"Finneas" declared "call:0"
"Zheng" declared "call:0"
"Yuchun" declared "call:0"
"HakulaPlayer" declared "call:0"
Street "river" started. (community card = ['SA', 'D3', 'DJ', 'HQ', 'C6'])
"Finneas" declared "call:0"
"Zheng" declared "call:0"
"Yuchun" declared "call:0"
"HakulaPlayer" declared "raise:80"
"Finneas" declared "fold:0"
"Zheng" declared "fold:0"
"Yuchun" declared "call:80"
"['HakulaPlayer']" won the round 14 (stack = {'Zheng': 970, 'RaphaelPlayer': 0, 'SichengZuo': 970, 'Yuchun': 1865, 'HakulaPlayer': 1120, 'Ethan': 1015, 'YangZ': 970, 'Finneas': 1090})
player [Zheng] gets hole card ['HK', 'S3'], current stack 960
player [SichengZuo] gets hole card ['S8', 'D9'], current stack 970
player [Yuchun] gets hole card ['D7', 'C8'], current stack 1865
player [HakulaPlayer] gets hole card ['DK', 'H6'], current stack 1120
player [Ethan] gets hole card ['H7', 'DJ'], current stack 1015
player [YangZ] gets hole card ['H9', 'DT'], current stack 970
player [Finneas] gets hole card ['CJ', 'HT'], current stack 1085
Started the round 15
Street "preflop" started. (community card = [])
"SichengZuo" declared "fold:0"
"Yuchun" declared "call:10"
"HakulaPlayer" declared "call:10"
"Ethan" declared "fold:0"
"YangZ" declared "fold:0"
"Finneas" declared "call:10"
"Zheng" declared "call:10"
Street "flop" started. (community card = ['D8', 'H2', 'S7'])
"Finneas" declared "call:0"
"Zheng" declared "call:0"
"Yuchun" declared "raise:40"
"HakulaPlayer" declared "raise:80"
"Finneas" declared "fold:0"
"Zheng" declared "fold:0"
"Yuchun" declared "raise:1855"
"HakulaPlayer" declared "fold:0"
"['Yuchun']" won the round 15 (stack = {'Zheng': 960, 'RaphaelPlayer': 0, 'SichengZuo': 970, 'Yuchun': 1975, 'HakulaPlayer': 1030, 'Ethan': 1015, 'YangZ': 970, 'Finneas': 1080})
player [Zheng] gets hole card ['S3', 'D3'], current stack 955
player [SichengZuo] gets hole card ['SA', 'SQ'], current stack 960
player [Yuchun] gets hole card ['S7', 'DT'], current stack 1975
player [HakulaPlayer] gets hole card ['DA', 'C8'], current stack 1030
player [Ethan] gets hole card ['H3', 'D5'], current stack 1015
player [YangZ] gets hole card ['H6', 'C6'], current stack 970
player [Finneas] gets hole card ['S8', 'H7'], current stack 1080
Started the round 16
Street "preflop" started. (community card = [])
"Yuchun" declared "call:10"
"HakulaPlayer" declared "call:10"
"Ethan" declared "fold:0"
"YangZ" declared "fold:0"
"Finneas" declared "call:10"
"Zheng" declared "call:10"
"SichengZuo" declared "fold:0"
Street "flop" started. (community card = ['S4', 'C9', 'SK'])
"Zheng" declared "call:0"
"Yuchun" declared "call:0"
"HakulaPlayer" declared "call:0"
"Finneas" declared "call:0"
Street "turn" started. (community card = ['S4', 'C9', 'SK', 'C3'])
"Zheng" declared "raise:480"
"Yuchun" declared "fold:0"
"HakulaPlayer" declared "fold:0"
"Finneas" declared "fold:0"
"['Zheng']" won the round 16 (stack = {'Zheng': 1000, 'RaphaelPlayer': 0, 'SichengZuo': 960, 'Yuchun': 1965, 'HakulaPlayer': 1020, 'Ethan': 1015, 'YangZ': 970, 'Finneas': 1070})
player [Zheng] gets hole card ['HQ', 'D9'], current stack 1000
player [SichengZuo] gets hole card ['H5', 'S9'], current stack 955
player [Yuchun] gets hole card ['D2', 'C3'], current stack 1955
player [HakulaPlayer] gets hole card ['HJ', 'C8'], current stack 1020
player [Ethan] gets hole card ['C7', 'D4'], current stack 1015
player [YangZ] gets hole card ['H6', 'SA'], current stack 970
player [Finneas] gets hole card ['S2', 'HT'], current stack 1070
Started the round 17
Street "preflop" started. (community card = [])
"HakulaPlayer" declared "fold:0"
"Ethan" declared "fold:0"
"YangZ" declared "fold:0"
"Finneas" declared "call:10"
"Zheng" declared "call:10"
"SichengZuo" declared "fold:0"
"Yuchun" declared "call:10"
Street "flop" started. (community card = ['CJ', 'H8', 'DJ'])
"Yuchun" declared "call:0"
"Finneas" declared "call:0"
"Zheng" declared "call:0"
Street "turn" started. (community card = ['CJ', 'H8', 'DJ', 'ST'])
"Yuchun" declared "call:0"
"Finneas" declared "call:0"
"Zheng" declared "raise:500"
"Yuchun" declared "fold:0"
"Finneas" declared "fold:0"
"['Zheng']" won the round 17 (stack = {'Zheng': 1025, 'RaphaelPlayer': 0, 'SichengZuo': 955, 'Yuchun': 1955, 'HakulaPlayer': 1020, 'Ethan': 1015, 'YangZ': 970, 'Finneas': 1060})
player [Zheng] gets hole card ['CT', 'HT'], current stack 1025
player [SichengZuo] gets hole card ['C7', 'S6'], current stack 955
player [Yuchun] gets hole card ['S3', 'DT'], current stack 1950
player [HakulaPlayer] gets hole card ['HA', 'HJ'], current stack 1010
player [Ethan] gets hole card ['SK', 'C3'], current stack 1015
player [YangZ] gets hole card ['S2', 'HK'], current stack 970
player [Finneas] gets hole card ['D8', 'D6'], current stack 1060
Started the round 18
Street "preflop" started. (community card = [])
"Ethan" declared "fold:0"
"YangZ" declared "fold:0"
"Finneas" declared "call:10"
"Zheng" declared "call:10"
"SichengZuo" declared "fold:0"
"Yuchun" declared "call:10"
"HakulaPlayer" declared "raise:39"
"Finneas" declared "fold:0"
"Zheng" declared "fold:0"
"Yuchun" declared "call:39"
Street "flop" started. (community card = ['C5', 'SJ', 'H8'])
"Yuchun" declared "call:0"
"HakulaPlayer" declared "raise:106"
"Yuchun" declared "fold:0"
"['HakulaPlayer']" won the round 18 (stack = {'Zheng': 1015, 'RaphaelPlayer': 0, 'SichengZuo': 955, 'Yuchun': 1916, 'HakulaPlayer': 1079, 'Ethan': 1015, 'YangZ': 970, 'Finneas': 1050})
player [Zheng] gets hole card ['CJ', 'C6'], current stack 1015
player [SichengZuo] gets hole card ['S3', 'D8'], current stack 955
player [Yuchun] gets hole card ['CT', 'D2'], current stack 1916
player [HakulaPlayer] gets hole card ['H2', 'H5'], current stack 1074
player [Ethan] gets hole card ['HT', 'H6'], current stack 1005
player [YangZ] gets hole card ['C4', 'SQ'], current stack 970
player [Finneas] gets hole card ['S5', 'S7'], current stack 1050
Started the round 19
Street "preflop" started. (community card = [])
"YangZ" declared "fold:0"
"Finneas" declared "call:10"
"Zheng" declared "call:10"
"SichengZuo" declared "fold:0"
"Yuchun" declared "call:10"
"HakulaPlayer" declared "call:10"
"Ethan" declared "fold:0"
Street "flop" started. (community card = ['H7', 'S2', 'D9'])
"HakulaPlayer" declared "call:0"
"Finneas" declared "call:0"
"Zheng" declared "call:0"
"Yuchun" declared "call:0"
Street "turn" started. (community card = ['H7', 'S2', 'D9', 'D5'])
"HakulaPlayer" declared "call:0"
"Finneas" declared "call:0"
"Zheng" declared "call:0"
"Yuchun" declared "call:0"
Street "river" started. (community card = ['H7', 'S2', 'D9', 'D5', 'S6'])
"HakulaPlayer" declared "call:0"
"Finneas" declared "call:0"
"Zheng" declared "call:0"
"Yuchun" declared "call:0"
"['Finneas']" won the round 19 (stack = {'Zheng': 1005, 'RaphaelPlayer': 0, 'SichengZuo': 955, 'Yuchun': 1906, 'HakulaPlayer': 1069, 'Ethan': 1005, 'YangZ': 970, 'Finneas': 1090})
player [Zheng] gets hole card ['S9', 'DK'], current stack 1005
player [SichengZuo] gets hole card ['HK', 'C8'], current stack 955
player [Yuchun] gets hole card ['C9', 'D5'], current stack 1906
player [HakulaPlayer] gets hole card ['H3', 'DA'], current stack 1069
player [Ethan] gets hole card ['C3', 'H7'], current stack 1000
player [YangZ] gets hole card ['S3', 'SK'], current stack 960
player [Finneas] gets hole card ['S7', 'S2'], current stack 1090
Started the round 20
Street "preflop" started. (community card = [])
"Finneas" declared "call:10"
"Zheng" declared "call:10"
"SichengZuo" declared "fold:0"
"Yuchun" declared "call:10"
"HakulaPlayer" declared "raise:38"
"Ethan" declared "fold:0"
"YangZ" declared "fold:0"
"Finneas" declared "fold:0"
"Zheng" declared "call:38"
"Yuchun" declared "call:38"
Street "flop" started. (community card = ['CQ', 'CJ', 'S6'])
"Zheng" declared "call:0"
"Yuchun" declared "call:0"
"HakulaPlayer" declared "call:0"
Street "turn" started. (community card = ['CQ', 'CJ', 'S6', 'D9'])
"Zheng" declared "call:0"
"Yuchun" declared "call:0"
"HakulaPlayer" declared "call:0"
Street "river" started. (community card = ['CQ', 'CJ', 'S6', 'D9', 'H9'])
"Zheng" declared "raise:967"
"Yuchun" declared "call:967"
"HakulaPlayer" declared "fold:0"
"['Zheng']" won the round 20 (stack = {'Zheng': 2073, 'RaphaelPlayer': 0, 'SichengZuo': 955, 'Yuchun': 901, 'HakulaPlayer': 1031, 'Ethan': 1000, 'YangZ': 960, 'Finneas': 1080})
player [Zheng] gets hole card ['CJ', 'DQ'], current stack 2073
player [SichengZuo] gets hole card ['CQ', 'H9'], current stack 955
player [Yuchun] gets hole card ['HA', 'SQ'], current stack 901
player [HakulaPlayer] gets hole card ['S5', 'DJ'], current stack 1031
player [Ethan] gets hole card ['S7', 'S9'], current stack 1000
player [YangZ] gets hole card ['HK', 'H6'], current stack 955
player [Finneas] gets hole card ['SK', 'D4'], current stack 1070
Started the round 21
Street "preflop" started. (community card = [])
"Zheng" declared "call:10"
"SichengZuo" declared "fold:0"
"Yuchun" declared "call:10"
"HakulaPlayer" declared "call:10"
"Ethan" declared "fold:0"
"YangZ" declared "fold:0"
"Finneas" declared "call:10"
Street "flop" started. (community card = ['C9', 'D7', 'DK'])
"Finneas" declared "call:0"
"Zheng" declared "call:0"
"Yuchun" declared "call:0"
"HakulaPlayer" declared "call:0"
Street "turn" started. (community card = ['C9', 'D7', 'DK', 'H2'])
"Finneas" declared "call:0"
"Zheng" declared "call:0"
"Yuchun" declared "call:0"
"HakulaPlayer" declared "call:0"
Street "river" started. (community card = ['C9', 'D7', 'DK', 'H2', 'CK'])
"Finneas" declared "raise:540"
"Zheng" declared "fold:0"
"Yuchun" declared "fold:0"
"HakulaPlayer" declared "fold:0"
"['Finneas']" won the round 21 (stack = {'Zheng': 2063, 'RaphaelPlayer': 0, 'SichengZuo': 955, 'Yuchun': 891, 'HakulaPlayer': 1021, 'Ethan': 1000, 'YangZ': 955, 'Finneas': 1115})
player [Zheng] gets hole card ['C7', 'H3'], current stack 2053
player [SichengZuo] gets hole card ['DT', 'S7'], current stack 955
player [Yuchun] gets hole card ['CK', 'C6'], current stack 891
player [HakulaPlayer] gets hole card ['CJ', 'HJ'], current stack 1021
player [Ethan] gets hole card ['SK', 'HQ'], current stack 1000
player [YangZ] gets hole card ['D2', 'D9'], current stack 955
player [Finneas] gets hole card ['D6', 'D3'], current stack 1110
Started the round 22
Street "preflop" started. (community card = [])
"SichengZuo" declared "fold:0"
"Yuchun" declared "call:10"
"HakulaPlayer" declared "raise:44"
"Ethan" declared "raise:150"
"YangZ" declared "fold:0"
"Finneas" declared "fold:0"
"Zheng" declared "call:150"
"Yuchun" declared "call:150"
"HakulaPlayer" declared "raise:800"
"Ethan" declared "fold:0"
"Zheng" declared "fold:0"
"Yuchun" declared "fold:0"
"['HakulaPlayer']" won the round 22 (stack = {'Zheng': 1913, 'RaphaelPlayer': 0, 'SichengZuo': 955, 'Yuchun': 741, 'HakulaPlayer': 1476, 'Ethan': 850, 'YangZ': 955, 'Finneas': 1110})
player [Zheng] gets hole card ['C3', 'H8'], current stack 1908
player [SichengZuo] gets hole card ['H3', 'S5'], current stack 945
player [Yuchun] gets hole card ['SQ', 'SA'], current stack 741
player [HakulaPlayer] gets hole card ['HJ', 'D3'], current stack 1476
player [Ethan] gets hole card ['S7', 'S6'], current stack 850
player [YangZ] gets hole card ['HT', 'H9'], current stack 955
player [Finneas] gets hole card ['SJ', 'H6'], current stack 1110
Started the round 23
Street "preflop" started. (community card = [])
"Yuchun" declared "call:10"
"HakulaPlayer" declared "call:10"
"Ethan" declared "fold:0"
"YangZ" declared "fold:0"
"Finneas" declared "call:10"
"Zheng" declared "call:10"
"SichengZuo" declared "fold:0"
Street "flop" started. (community card = ['DT', 'D5', 'D7'])
"Zheng" declared "call:0"
"Yuchun" declared "call:0"
"HakulaPlayer" declared "call:0"
"Finneas" declared "call:0"
Street "turn" started. (community card = ['DT', 'D5', 'D7', 'H5'])
"Zheng" declared "call:0"
"Yuchun" declared "call:0"
"HakulaPlayer" declared "call:0"
"Finneas" declared "call:0"
Street "river" started. (community card = ['DT', 'D5', 'D7', 'H5', 'D2'])
"Zheng" declared "call:0"
"Yuchun" declared "call:0"
"HakulaPlayer" declared "call:0"
"Finneas" declared "call:0"
"['HakulaPlayer']" won the round 23 (stack = {'Zheng': 1903, 'RaphaelPlayer': 0, 'SichengZuo': 945, 'Yuchun': 731, 'HakulaPlayer': 1516, 'Ethan': 850, 'YangZ': 955, 'Finneas': 1100})
player [Zheng] gets hole card ['D2', 'HA'], current stack 1903
player [SichengZuo] gets hole card ['S3', 'D3'], current stack 940
player [Yuchun] gets hole card ['SQ', 'C3'], current stack 721
player [HakulaPlayer] gets hole card ['C4', 'C8'], current stack 1516
player [Ethan] gets hole card ['ST', 'C7'], current stack 850
player [YangZ] gets hole card ['H7', 'DQ'], current stack 955
player [Finneas] gets hole card ['S2', 'D4'], current stack 1100
Started the round 24
Street "preflop" started. (community card = [])
"HakulaPlayer" declared "fold:0"
"Ethan" declared "fold:0"
"YangZ" declared "fold:0"
"Finneas" declared "call:10"
"Zheng" declared "call:10"
"SichengZuo" declared "fold:0"
"Yuchun" declared "call:10"
Street "flop" started. (community card = ['DA', 'D9', 'CQ'])
"Yuchun" declared "call:0"
"Finneas" declared "call:0"
"Zheng" declared "call:0"
Street "turn" started. (community card = ['DA', 'D9', 'CQ', 'S8'])
"Yuchun" declared "call:0"
"Finneas" declared "call:0"
"Zheng" declared "call:0"
Street "river" started. (community card = ['DA', 'D9', 'CQ', 'S8', 'H5'])
"Yuchun" declared "call:0"
"Finneas" declared "call:0"
"Zheng" declared "call:0"
"['Zheng']" won the round 24 (stack = {'Zheng': 1928, 'RaphaelPlayer': 0, 'SichengZuo': 940, 'Yuchun': 721, 'HakulaPlayer': 1516, 'Ethan': 850, 'YangZ': 955, 'Finneas': 1090})
player [Zheng] gets hole card ['C9', 'CA'], current stack 1928
player [SichengZuo] gets hole card ['H4', 'HA'], current stack 940
player [Yuchun] gets hole card ['DJ', 'H9'], current stack 716
player [HakulaPlayer] gets hole card ['S8', 'D4'], current stack 1506
player [Ethan] gets hole card ['H7', 'C3'], current stack 850
player [YangZ] gets hole card ['S7', 'D3'], current stack 955
player [Finneas] gets hole card ['CT', 'D7'], current stack 1090
Started the round 25
Street "preflop" started. (community card = [])
"Ethan" declared "fold:0"
"YangZ" declared "fold:0"
"Finneas" declared "call:10"
"Zheng" declared "call:10"
"SichengZuo" declared "fold:0"
"Yuchun" declared "call:10"
"HakulaPlayer" declared "call:10"
Street "flop" started. (community card = ['DA', 'SK', 'SQ'])
"Yuchun" declared "call:0"
"HakulaPlayer" declared "call:0"
"Finneas" declared "call:0"
"Zheng" declared "call:0"
Street "turn" started. (community card = ['DA', 'SK', 'SQ', 'D8'])
"Yuchun" declared "call:0"
"HakulaPlayer" declared "call:0"
"Finneas" declared "call:0"
"Zheng" declared "call:0"
Street "river" started. (community card = ['DA', 'SK', 'SQ', 'D8', 'S3'])
"Yuchun" declared "call:0"
"HakulaPlayer" declared "call:0"
"Finneas" declared "call:0"
"Zheng" declared "call:0"
"['Zheng']" won the round 25 (stack = {'Zheng': 1958, 'RaphaelPlayer': 0, 'SichengZuo': 940, 'Yuchun': 711, 'HakulaPlayer': 1506, 'Ethan': 850, 'YangZ': 955, 'Finneas': 1080})
player [Zheng] gets hole card ['D7', 'SJ'], current stack 1958
player [SichengZuo] gets hole card ['C3', 'S3'], current stack 940
player [Yuchun] gets hole card ['SK', 'S5'], current stack 711
player [HakulaPlayer] gets hole card ['S8', 'D6'], current stack 1501
player [Ethan] gets hole card ['CA', 'DT'], current stack 840
player [YangZ] gets hole card ['D2', 'CK'], current stack 955
player [Finneas] gets hole card ['S6', 'HQ'], current stack 1080
Started the round 26
Street "preflop" started. (community card = [])
"YangZ" declared "fold:0"
"Finneas" declared "call:10"
"Zheng" declared "call:10"
"SichengZuo" declared "fold:0"
"Yuchun" declared "call:10"
"HakulaPlayer" declared "call:10"
"Ethan" declared "call:10"
Street "flop" started. (community card = ['H8', 'H9', 'DA'])
"HakulaPlayer" declared "call:0"
"Ethan" declared "call:0"
"Finneas" declared "call:0"
"Zheng" declared "call:0"
"Yuchun" declared "call:0"
Street "turn" started. (community card = ['H8', 'H9', 'DA', 'C2'])
"HakulaPlayer" declared "call:0"
"Ethan" declared "call:0"
"Finneas" declared "call:0"
"Zheng" declared "call:0"
"Yuchun" declared "call:0"
Street "river" started. (community card = ['H8', 'H9', 'DA', 'C2', 'S9'])
"HakulaPlayer" declared "call:0"
"Ethan" declared "call:0"
"Finneas" declared "call:0"
"Zheng" declared "call:0"
"Yuchun" declared "call:0"
"['Ethan']" won the round 26 (stack = {'Zheng': 1948, 'RaphaelPlayer': 0, 'SichengZuo': 940, 'Yuchun': 701, 'HakulaPlayer': 1496, 'Ethan': 890, 'YangZ': 955, 'Finneas': 1070})
player [Zheng] gets hole card ['C3', 'D5'], current stack 1948
player [SichengZuo] gets hole card ['HK', 'C4'], current stack 940
player [Yuchun] gets hole card ['CA', 'HT'], current stack 701
player [HakulaPlayer] gets hole card ['CQ', 'S6'], current stack 1496
player [Ethan] gets hole card ['D2', 'DA'], current stack 885
player [YangZ] gets hole card ['HQ', 'C5'], current stack 945
player [Finneas] gets hole card ['CJ', 'H3'], current stack 1070
Started the round 27
Street "preflop" started. (community card = [])
"Finneas" declared "call:10"
"Zheng" declared "call:10"
"SichengZuo" declared "fold:0"
"Yuchun" declared "call:10"
"HakulaPlayer" declared "call:10"
"Ethan" declared "fold:0"
"YangZ" declared "fold:0"
Street "flop" started. (community card = ['D8', 'SK', 'C7'])
"Finneas" declared "call:0"
"Zheng" declared "call:0"
"Yuchun" declared "call:0"
"HakulaPlayer" declared "call:0"
Street "turn" started. (community card = ['D8', 'SK', 'C7', 'SQ'])
"Finneas" declared "call:0"
"Zheng" declared "call:0"
"Yuchun" declared "call:0"
"HakulaPlayer" declared "call:0"
Street "river" started. (community card = ['D8', 'SK', 'C7', 'SQ', 'S9'])
"Finneas" declared "call:0"
"Zheng" declared "call:0"
"Yuchun" declared "call:0"
"HakulaPlayer" declared "call:0"
"['HakulaPlayer']" won the round 27 (stack = {'Zheng': 1938, 'RaphaelPlayer': 0, 'SichengZuo': 940, 'Yuchun': 691, 'HakulaPlayer': 1541, 'Ethan': 885, 'YangZ': 945, 'Finneas': 1060})
player [Zheng] gets hole card ['C9', 'C6'], current stack 1938
player [SichengZuo] gets hole card ['CT', 'DA'], current stack 940
player [Yuchun] gets hole card ['HK', 'D6'], current stack 691
player [HakulaPlayer] gets hole card ['HA', 'DJ'], current stack 1541
player [Ethan] gets hole card ['SA', 'S7'], current stack 885
player [YangZ] gets hole card ['S9', 'CJ'], current stack 940
player [Finneas] gets hole card ['DK', 'D5'], current stack 1050
Started the round 28
Street "preflop" started. (community card = [])
"Zheng" declared "call:10"
"SichengZuo" declared "fold:0"
"Yuchun" declared "call:10"
"HakulaPlayer" declared "raise:40"
"Ethan" declared "fold:0"
"YangZ" declared "fold:0"
"Finneas" declared "fold:0"
"Zheng" declared "call:40"
"Yuchun" declared "call:40"
Street "flop" started. (community card = ['D2', 'S6', 'D7'])
"Zheng" declared "call:0"
"Yuchun" declared "call:0"
"HakulaPlayer" declared "call:0"
Street "turn" started. (community card = ['D2', 'S6', 'D7', 'C4'])
"Zheng" declared "call:0"
"Yuchun" declared "call:0"
"HakulaPlayer" declared "call:0"
Street "river" started. (community card = ['D2', 'S6', 'D7', 'C4', 'H7'])
"Zheng" declared "call:0"
"Yuchun" declared "call:0"
"HakulaPlayer" declared "call:0"
"['Yuchun']" won the round 28 (stack = {'Zheng': 1898, 'RaphaelPlayer': 0, 'SichengZuo': 940, 'Yuchun': 786, 'HakulaPlayer': 1501, 'Ethan': 885, 'YangZ': 940, 'Finneas': 1050})
player [Zheng] gets hole card ['S5', 'D7'], current stack 1888
player [SichengZuo] gets hole card ['CA', 'HK'], current stack 940
player [Yuchun] gets hole card ['H4', 'S6'], current stack 786
player [HakulaPlayer] gets hole card ['SA', 'C5'], current stack 1501
player [Ethan] gets hole card ['SJ', 'D2'], current stack 885
player [YangZ] gets hole card ['C2', 'CT'], current stack 940
player [Finneas] gets hole card ['SQ', 'D4'], current stack 1045
Started the round 29
Street "preflop" started. (community card = [])
"SichengZuo" declared "fold:0"
"Yuchun" declared "call:10"
"HakulaPlayer" declared "call:10"
"Ethan" declared "fold:0"
"YangZ" declared "fold:0"
"Finneas" declared "call:10"
"Zheng" declared "call:10"
Street "flop" started. (community card = ['D8', 'H5', 'DJ'])
"Finneas" declared "call:0"
"Zheng" declared "call:0"
"Yuchun" declared "call:0"
"HakulaPlayer" declared "call:0"
Street "turn" started. (community card = ['D8', 'H5', 'DJ', 'S8'])
"Finneas" declared "call:0"
"Zheng" declared "call:0"
"Yuchun" declared "call:0"
"HakulaPlayer" declared "call:0"
Street "river" started. (community card = ['D8', 'H5', 'DJ', 'S8', 'DT'])
"Finneas" declared "call:0"
"Zheng" declared "call:0"
"Yuchun" declared "call:0"
"HakulaPlayer" declared "call:0"
"['HakulaPlayer']" won the round 29 (stack = {'Zheng': 1888, 'RaphaelPlayer': 0, 'SichengZuo': 940, 'Yuchun': 776, 'HakulaPlayer': 1531, 'Ethan': 885, 'YangZ': 940, 'Finneas': 1040})
player [Zheng] gets hole card ['DK', 'H9'], current stack 1883
player [SichengZuo] gets hole card ['HQ', 'CJ'], current stack 930
player [Yuchun] gets hole card ['CQ', 'DQ'], current stack 776
player [HakulaPlayer] gets hole card ['C7', 'S5'], current stack 1531
player [Ethan] gets hole card ['DA', 'D2'], current stack 885
player [YangZ] gets hole card ['DT', 'H4'], current stack 940
player [Finneas] gets hole card ['S3', 'HJ'], current stack 1040
Started the round 30
Street "preflop" started. (community card = [])
"Yuchun" declared "call:10"
"HakulaPlayer" declared "call:10"
"Ethan" declared "fold:0"
"YangZ" declared "fold:0"
"Finneas" declared "call:10"
"Zheng" declared "call:10"
"SichengZuo" declared "fold:0"
Street "flop" started. (community card = ['S8', 'CA', 'SJ'])
"Zheng" declared "call:0"
"Yuchun" declared "call:0"
"HakulaPlayer" declared "call:0"
"Finneas" declared "call:0"
Street "turn" started. (community card = ['S8', 'CA', 'SJ', 'CT'])
"Zheng" declared "call:0"
"Yuchun" declared "call:0"
"HakulaPlayer" declared "call:0"
"Finneas" declared "call:0"
Street "river" started. (community card = ['S8', 'CA', 'SJ', 'CT', 'C8'])
"Zheng" declared "call:0"
"Yuchun" declared "call:0"
"HakulaPlayer" declared "call:0"
"Finneas" declared "call:0"
"['Yuchun']" won the round 30 (stack = {'Zheng': 1878, 'RaphaelPlayer': 0, 'SichengZuo': 930, 'Yuchun': 816, 'HakulaPlayer': 1521, 'Ethan': 885, 'YangZ': 940, 'Finneas': 1030})
player [Zheng] gets hole card ['C2', 'D5'], current stack 1878
player [SichengZuo] gets hole card ['DJ', 'C6'], current stack 925
player [Yuchun] gets hole card ['H2', 'D8'], current stack 806
player [HakulaPlayer] gets hole card ['CJ', 'D3'], current stack 1521
player [Ethan] gets hole card ['C9', 'S3'], current stack 885
player [YangZ] gets hole card ['CT', 'C4'], current stack 940
player [Finneas] gets hole card ['C5', 'S6'], current stack 1030
Started the round 31
Street "preflop" started. (community card = [])
"HakulaPlayer" declared "fold:0"
"Ethan" declared "fold:0"
"YangZ" declared "fold:0"
"Finneas" declared "call:10"
"Zheng" declared "call:10"
"SichengZuo" declared "fold:0"
"Yuchun" declared "call:10"
Street "flop" started. (community card = ['SJ', 'D7', 'DA'])
"Yuchun" declared "call:0"
"Finneas" declared "call:0"
"Zheng" declared "call:0"
Street "turn" started. (community card = ['SJ', 'D7', 'DA', 'H7'])
"Yuchun" declared "call:0"
"Finneas" declared "call:0"
"Zheng" declared "call:0"
Street "river" started. (community card = ['SJ', 'D7', 'DA', 'H7', 'S5'])
"Yuchun" declared "call:0"
"Finneas" declared "call:0"
"Zheng" declared "call:0"
"['Zheng', 'Finneas']" won the round 31 (stack = {'Zheng': 1885, 'RaphaelPlayer': 0, 'SichengZuo': 925, 'Yuchun': 806, 'HakulaPlayer': 1521, 'Ethan': 885, 'YangZ': 940, 'Finneas': 1037})
player [Zheng] gets hole card ['S3', 'D4'], current stack 1885
player [SichengZuo] gets hole card ['DA', 'CQ'], current stack 925
player [Yuchun] gets hole card ['C3', 'H2'], current stack 801
player [HakulaPlayer] gets hole card ['SJ', 'DK'], current stack 1511
player [Ethan] gets hole card ['HT', 'S9'], current stack 885
player [YangZ] gets hole card ['HQ', 'SQ'], current stack 940
player [Finneas] gets hole card ['S5', 'D8'], current stack 1037
Started the round 32
Street "preflop" started. (community card = [])
"Ethan" declared "fold:0"
"YangZ" declared "fold:0"
"Finneas" declared "call:10"
"Zheng" declared "call:10"
"SichengZuo" declared "fold:0"
"Yuchun" declared "call:10"
"HakulaPlayer" declared "call:10"
Street "flop" started. (community card = ['H7', 'D6', 'H8'])
"Yuchun" declared "call:0"
"HakulaPlayer" declared "call:0"
"Finneas" declared "call:0"
"Zheng" declared "call:0"
Street "turn" started. (community card = ['H7', 'D6', 'H8', 'D3'])
"Yuchun" declared "call:0"
"HakulaPlayer" declared "call:0"
"Finneas" declared "call:0"
"Zheng" declared "call:0"
Street "river" started. (community card = ['H7', 'D6', 'H8', 'D3', 'S6'])
"Yuchun" declared "call:0"
"HakulaPlayer" declared "call:0"
"Finneas" declared "call:0"
"Zheng" declared "call:0"
"['Finneas']" won the round 32 (stack = {'Zheng': 1875, 'RaphaelPlayer': 0, 'SichengZuo': 925, 'Yuchun': 796, 'HakulaPlayer': 1511, 'Ethan': 885, 'YangZ': 940, 'Finneas': 1067})
player [Zheng] gets hole card ['HT', 'DT'], current stack 1875
player [SichengZuo] gets hole card ['S4', 'C8'], current stack 925
player [Yuchun] gets hole card ['C2', 'HA'], current stack 796
player [HakulaPlayer] gets hole card ['DA', 'S3'], current stack 1506
player [Ethan] gets hole card ['DQ', 'H9'], current stack 875
player [YangZ] gets hole card ['D8', 'S5'], current stack 940
player [Finneas] gets hole card ['D6', 'H6'], current stack 1067
Started the round 33
Street "preflop" started. (community card = [])
"YangZ" declared "fold:0"
"Finneas" declared "call:10"
"Zheng" declared "call:10"
"SichengZuo" declared "fold:0"
"Yuchun" declared "call:10"
"HakulaPlayer" declared "call:10"
"Ethan" declared "fold:0"
Street "flop" started. (community card = ['H2', 'D7', 'HK'])
"HakulaPlayer" declared "call:0"
"Finneas" declared "call:0"
"Zheng" declared "call:0"
"Yuchun" declared "call:0"
Street "turn" started. (community card = ['H2', 'D7', 'HK', 'H7'])
"HakulaPlayer" declared "call:0"
"Finneas" declared "call:0"
"Zheng" declared "call:0"
"Yuchun" declared "call:0"
Street "river" started. (community card = ['H2', 'D7', 'HK', 'H7', 'SK'])
"HakulaPlayer" declared "call:0"
"Finneas" declared "call:0"
"Zheng" declared "call:0"
"Yuchun" declared "call:0"
"['Zheng']" won the round 33 (stack = {'Zheng': 1915, 'RaphaelPlayer': 0, 'SichengZuo': 925, 'Yuchun': 786, 'HakulaPlayer': 1501, 'Ethan': 875, 'YangZ': 940, 'Finneas': 1057})
player [Zheng] gets hole card ['C3', 'C2'], current stack 1915
player [SichengZuo] gets hole card ['CA', 'D9'], current stack 925
player [Yuchun] gets hole card ['D3', 'H3'], current stack 786
player [HakulaPlayer] gets hole card ['HT', 'HQ'], current stack 1501
player [Ethan] gets hole card ['D2', 'S8'], current stack 870
player [YangZ] gets hole card ['D4', 'CK'], current stack 930
player [Finneas] gets hole card ['DQ', 'S3'], current stack 1057
Started the round 34
Street "preflop" started. (community card = [])
"Finneas" declared "call:10"
"Zheng" declared "call:10"
"SichengZuo" declared "fold:0"
"Yuchun" declared "call:10"
"HakulaPlayer" declared "raise:47"
"Ethan" declared "fold:0"
"YangZ" declared "fold:0"
"Finneas" declared "fold:0"
"Zheng" declared "call:47"
"Yuchun" declared "call:47"
Street "flop" started. (community card = ['SQ', 'H7', 'C9'])
"Zheng" declared "call:0"
"Yuchun" declared "call:0"
"HakulaPlayer" declared "raise:282"
"Zheng" declared "fold:0"
"Yuchun" declared "fold:0"
"['HakulaPlayer']" won the round 34 (stack = {'Zheng': 1868, 'RaphaelPlayer': 0, 'SichengZuo': 925, 'Yuchun': 739, 'HakulaPlayer': 1620, 'Ethan': 870, 'YangZ': 930, 'Finneas': 1047})
player [Zheng] gets hole card ['S3', 'HQ'], current stack 1868
player [SichengZuo] gets hole card ['S6', 'C8'], current stack 925
player [Yuchun] gets hole card ['SJ', 'D3'], current stack 739
player [HakulaPlayer] gets hole card ['CA', 'H8'], current stack 1620
player [Ethan] gets hole card ['D7', 'CJ'], current stack 870
player [YangZ] gets hole card ['S4', 'SQ'], current stack 925
player [Finneas] gets hole card ['H4', 'C7'], current stack 1037
Started the round 35
Street "preflop" started. (community card = [])
"Zheng" declared "call:10"
"SichengZuo" declared "fold:0"
"Yuchun" declared "call:10"
"HakulaPlayer" declared "call:10"
"Ethan" declared "fold:0"
"YangZ" declared "fold:0"
"Finneas" declared "call:10"
Street "flop" started. (community card = ['HA', 'H3', 'C3'])
"Finneas" declared "call:0"
"Zheng" declared "raise:934"
"Yuchun" declared "call:934"
"HakulaPlayer" declared "fold:0"
"Finneas" declared "fold:0"
Street "turn" started. (community card = ['HA', 'H3', 'C3', 'HT'])
Street "river" started. (community card = ['HA', 'H3', 'C3', 'HT', 'H7'])
"['Zheng']" won the round 35 (stack = {'Zheng': 2632, 'RaphaelPlayer': 0, 'SichengZuo': 925, 'Yuchun': 0, 'HakulaPlayer': 1610, 'Ethan': 870, 'YangZ': 925, 'Finneas': 1037})
player [Zheng] gets hole card ['CJ', 'ST'], current stack 2622
player [SichengZuo] gets hole card ['S7', 'S6'], current stack 925
player [HakulaPlayer] gets hole card ['C7', 'SQ'], current stack 1610
player [Ethan] gets hole card ['D9', 'CQ'], current stack 870
player [YangZ] gets hole card ['C5', 'DA'], current stack 925
player [Finneas] gets hole card ['D8', 'H5'], current stack 1032
Started the round 36
Street "preflop" started. (community card = [])
"SichengZuo" declared "fold:0"
"HakulaPlayer" declared "fold:0"
"Ethan" declared "fold:0"
"YangZ" declared "fold:0"
"Finneas" declared "call:10"
"Zheng" declared "call:10"
Street "flop" started. (community card = ['DQ', 'DT', 'H9'])
"Finneas" declared "call:0"
"Zheng" declared "call:0"
Street "turn" started. (community card = ['DQ', 'DT', 'H9', 'DK'])
"Finneas" declared "call:0"
"Zheng" declared "call:0"
Street "river" started. (community card = ['DQ', 'DT', 'H9', 'DK', 'S9'])
"Finneas" declared "call:0"
"Zheng" declared "raise:1316"
"Finneas" declared "fold:0"
"['Zheng']" won the round 36 (stack = {'Zheng': 2642, 'RaphaelPlayer': 0, 'SichengZuo': 925, 'Yuchun': 0, 'HakulaPlayer': 1610, 'Ethan': 870, 'YangZ': 925, 'Finneas': 1027})
player [Zheng] gets hole card ['DQ', 'S6'], current stack 2637
player [SichengZuo] gets hole card ['H4', 'D9'], current stack 915
player [HakulaPlayer] gets hole card ['H6', 'D2'], current stack 1610
player [Ethan] gets hole card ['S7', 'H2'], current stack 870
player [YangZ] gets hole card ['H8', 'CJ'], current stack 925
player [Finneas] gets hole card ['S2', 'CA'], current stack 1027
Started the round 37
Street "preflop" started. (community card = [])
"HakulaPlayer" declared "fold:0"
"Ethan" declared "fold:0"
"YangZ" declared "fold:0"
"Finneas" declared "call:10"
"Zheng" declared "call:10"
"SichengZuo" declared "fold:0"
Street "flop" started. (community card = ['D6', 'ST', 'S4'])
"Zheng" declared "call:0"
"Finneas" declared "call:0"
Street "turn" started. (community card = ['D6', 'ST', 'S4', 'SQ'])
"Zheng" declared "call:0"
"Finneas" declared "call:0"
Street "river" started. (community card = ['D6', 'ST', 'S4', 'SQ', 'DA'])
"Zheng" declared "raise:1321"
"Finneas" declared "fold:0"
"['Zheng']" won the round 37 (stack = {'Zheng': 2662, 'RaphaelPlayer': 0, 'SichengZuo': 915, 'Yuchun': 0, 'HakulaPlayer': 1610, 'Ethan': 870, 'YangZ': 925, 'Finneas': 1017})
player [Zheng] gets hole card ['HQ', 'S6'], current stack 2662
player [SichengZuo] gets hole card ['C5', 'S4'], current stack 910
player [HakulaPlayer] gets hole card ['CT', 'ST'], current stack 1600
player [Ethan] gets hole card ['CK', 'S7'], current stack 870
player [YangZ] gets hole card ['C6', 'SK'], current stack 925
player [Finneas] gets hole card ['D7', 'HT'], current stack 1017
Started the round 38
Street "preflop" started. (community card = [])
"Ethan" declared "fold:0"
"YangZ" declared "fold:0"
"Finneas" declared "call:10"
"Zheng" declared "call:10"
"SichengZuo" declared "fold:0"
"HakulaPlayer" declared "raise:58"
"Finneas" declared "fold:0"
"Zheng" declared "call:58"
Street "flop" started. (community card = ['S2', 'C8', 'C2'])
"HakulaPlayer" declared "raise:225"
"Zheng" declared "fold:0"
"['HakulaPlayer']" won the round 38 (stack = {'Zheng': 2604, 'RaphaelPlayer': 0, 'SichengZuo': 910, 'Yuchun': 0, 'HakulaPlayer': 1683, 'Ethan': 870, 'YangZ': 925, 'Finneas': 1007})
player [Zheng] gets hole card ['C2', 'H2'], current stack 2604
player [SichengZuo] gets hole card ['D9', 'C6'], current stack 910
player [HakulaPlayer] gets hole card ['DA', 'S8'], current stack 1678
player [Ethan] gets hole card ['C4', 'S2'], current stack 860
player [YangZ] gets hole card ['H4', 'D3'], current stack 925
player [Finneas] gets hole card ['HJ', 'S4'], current stack 1007
Started the round 39
Street "preflop" started. (community card = [])
"YangZ" declared "fold:0"
"Finneas" declared "call:10"
"Zheng" declared "call:10"
"SichengZuo" declared "fold:0"
"HakulaPlayer" declared "call:10"
"Ethan" declared "fold:0"
Street "flop" started. (community card = ['ST', 'CQ', 'D7'])
"HakulaPlayer" declared "call:0"
"Finneas" declared "call:0"
"Zheng" declared "call:0"
Street "turn" started. (community card = ['ST', 'CQ', 'D7', 'HT'])
"HakulaPlayer" declared "call:0"
"Finneas" declared "call:0"
"Zheng" declared "call:0"
Street "river" started. (community card = ['ST', 'CQ', 'D7', 'HT', 'S5'])
"HakulaPlayer" declared "call:0"
"Finneas" declared "call:0"
"Zheng" declared "call:0"
"['Zheng']" won the round 39 (stack = {'Zheng': 2634, 'RaphaelPlayer': 0, 'SichengZuo': 910, 'Yuchun': 0, 'HakulaPlayer': 1673, 'Ethan': 860, 'YangZ': 925, 'Finneas': 997})
player [Zheng] gets hole card ['HK', 'H5'], current stack 2634
player [SichengZuo] gets hole card ['SQ', 'CT'], current stack 910
player [HakulaPlayer] gets hole card ['C7', 'C4'], current stack 1673
player [Ethan] gets hole card ['S5', 'D5'], current stack 855
player [YangZ] gets hole card ['H3', 'DJ'], current stack 915
player [Finneas] gets hole card ['D6', 'D8'], current stack 997
Started the round 40
Street "preflop" started. (community card = [])
"Finneas" declared "call:10"
"Zheng" declared "call:10"
"SichengZuo" declared "fold:0"
"HakulaPlayer" declared "call:10"
"Ethan" declared "fold:0"
"YangZ" declared "fold:0"
Street "flop" started. (community card = ['CJ', 'SK', 'DA'])
"Finneas" declared "call:0"
"Zheng" declared "call:0"
"HakulaPlayer" declared "call:0"
Street "turn" started. (community card = ['CJ', 'SK', 'DA', 'SJ'])
"Finneas" declared "call:0"
"Zheng" declared "call:0"
"HakulaPlayer" declared "call:0"
Street "river" started. (community card = ['CJ', 'SK', 'DA', 'SJ', 'H6'])
"Finneas" declared "call:0"
"Zheng" declared "call:0"
"HakulaPlayer" declared "call:0"
"['Zheng']" won the round 40 (stack = {'Zheng': 2669, 'RaphaelPlayer': 0, 'SichengZuo': 910, 'Yuchun': 0, 'HakulaPlayer': 1663, 'Ethan': 855, 'YangZ': 915, 'Finneas': 987})
player [Zheng] gets hole card ['D4', 'S3'], current stack 2669
player [SichengZuo] gets hole card ['CJ', 'H2'], current stack 910
player [HakulaPlayer] gets hole card ['D6', 'HQ'], current stack 1663
player [Ethan] gets hole card ['D2', 'HJ'], current stack 855
player [YangZ] gets hole card ['S8', 'C6'], current stack 910
player [Finneas] gets hole card ['H9', 'S4'], current stack 977
Started the round 41
Street "preflop" started. (community card = [])
"Zheng" declared "call:10"
"SichengZuo" declared "fold:0"
"HakulaPlayer" declared "call:10"
"Ethan" declared "fold:0"
"YangZ" declared "fold:0"
"Finneas" declared "call:10"
Street "flop" started. (community card = ['C9', 'H6', 'D8'])
"Finneas" declared "call:0"
"Zheng" declared "call:0"
"HakulaPlayer" declared "call:0"
Street "turn" started. (community card = ['C9', 'H6', 'D8', 'CQ'])
"Finneas" declared "call:0"
"Zheng" declared "call:0"
"HakulaPlayer" declared "raise:72"
"Finneas" declared "fold:0"
"Zheng" declared "call:72"
Street "river" started. (community card = ['C9', 'H6', 'D8', 'CQ', 'HK'])
"Zheng" declared "call:0"
"HakulaPlayer" declared "raise:442"
"Zheng" declared "fold:0"
"['HakulaPlayer']" won the round 41 (stack = {'Zheng': 2587, 'RaphaelPlayer': 0, 'SichengZuo': 910, 'Yuchun': 0, 'HakulaPlayer': 1760, 'Ethan': 855, 'YangZ': 910, 'Finneas': 977})
player [Zheng] gets hole card ['H7', 'C2'], current stack 2577
player [SichengZuo] gets hole card ['D7', 'H2'], current stack 910
player [HakulaPlayer] gets hole card ['DK', 'H4'], current stack 1760
player [Ethan] gets hole card ['H9', 'H3'], current stack 855
player [YangZ] gets hole card ['H8', 'S2'], current stack 910
player [Finneas] gets hole card ['CT', 'C8'], current stack 972
Started the round 42
Street "preflop" started. (community card = [])
"SichengZuo" declared "fold:0"
"HakulaPlayer" declared "call:10"
"Ethan" declared "fold:0"
"YangZ" declared "fold:0"
"Finneas" declared "call:10"
"Zheng" declared "call:10"
Street "flop" started. (community card = ['H6', 'C6', 'D8'])
"Finneas" declared "call:0"
"Zheng" declared "call:0"
"HakulaPlayer" declared "call:0"
Street "turn" started. (community card = ['H6', 'C6', 'D8', 'CK'])
"Finneas" declared "call:0"
"Zheng" declared "call:0"
"HakulaPlayer" declared "raise:54"
"Finneas" declared "fold:0"
"Zheng" declared "call:54"
Street "river" started. (community card = ['H6', 'C6', 'D8', 'CK', 'C5'])
"Zheng" declared "call:0"
"HakulaPlayer" declared "raise:334"
"Zheng" declared "fold:0"
"['HakulaPlayer']" won the round 42 (stack = {'Zheng': 2523, 'RaphaelPlayer': 0, 'SichengZuo': 910, 'Yuchun': 0, 'HakulaPlayer': 1834, 'Ethan': 855, 'YangZ': 910, 'Finneas': 967})
player [Zheng] gets hole card ['DQ', 'H4'], current stack 2518
player [SichengZuo] gets hole card ['S3', 'SA'], current stack 900
player [HakulaPlayer] gets hole card ['C4', 'H3'], current stack 1834
player [Ethan] gets hole card ['ST', 'C9'], current stack 855
player [YangZ] gets hole card ['S4', 'S7'], current stack 910
player [Finneas] gets hole card ['HJ', 'SJ'], current stack 967
Started the round 43
Street "preflop" started. (community card = [])
"HakulaPlayer" declared "fold:0"
"Ethan" declared "fold:0"
"YangZ" declared "fold:0"
"Finneas" declared "call:10"
"Zheng" declared "call:10"
"SichengZuo" declared "fold:0"
Street "flop" started. (community card = ['H5', 'C7', 'DT'])
"Zheng" declared "call:0"
"Finneas" declared "call:0"
Street "turn" started. (community card = ['H5', 'C7', 'DT', 'C8'])
"Zheng" declared "call:0"
"Finneas" declared "call:0"
Street "river" started. (community card = ['H5', 'C7', 'DT', 'C8', 'SQ'])
"Zheng" declared "call:0"
"Finneas" declared "call:0"
"['Zheng']" won the round 43 (stack = {'Zheng': 2543, 'RaphaelPlayer': 0, 'SichengZuo': 900, 'Yuchun': 0, 'HakulaPlayer': 1834, 'Ethan': 855, 'YangZ': 910, 'Finneas': 957})
player [Zheng] gets hole card ['DT', 'S5'], current stack 2543
player [SichengZuo] gets hole card ['HT', 'SQ'], current stack 895
player [HakulaPlayer] gets hole card ['C7', 'CJ'], current stack 1824
player [Ethan] gets hole card ['D4', 'SA'], current stack 855
player [YangZ] gets hole card ['CK', 'C9'], current stack 910
player [Finneas] gets hole card ['H3', 'S6'], current stack 957
Started the round 44
Street "preflop" started. (community card = [])
"Ethan" declared "fold:0"
"YangZ" declared "fold:0"
"Finneas" declared "call:10"
"Zheng" declared "call:10"
"SichengZuo" declared "fold:0"
"HakulaPlayer" declared "call:10"
Street "flop" started. (community card = ['CQ', 'SJ', 'HA'])
"HakulaPlayer" declared "call:0"
"Finneas" declared "call:0"
"Zheng" declared "call:0"
Street "turn" started. (community card = ['CQ', 'SJ', 'HA', 'H5'])
"HakulaPlayer" declared "call:0"
"Finneas" declared "call:0"
"Zheng" declared "call:0"
Street "river" started. (community card = ['CQ', 'SJ', 'HA', 'H5', 'D3'])
"HakulaPlayer" declared "call:0"
"Finneas" declared "call:0"
"Zheng" declared "call:0"
"['HakulaPlayer']" won the round 44 (stack = {'Zheng': 2533, 'RaphaelPlayer': 0, 'SichengZuo': 895, 'Yuchun': 0, 'HakulaPlayer': 1859, 'Ethan': 855, 'YangZ': 910, 'Finneas': 947})
player [Zheng] gets hole card ['H3', 'D8'], current stack 2533
player [SichengZuo] gets hole card ['D6', 'H5'], current stack 895
player [HakulaPlayer] gets hole card ['H6', 'H4'], current stack 1854
player [Ethan] gets hole card ['C3', 'HK'], current stack 845
player [YangZ] gets hole card ['S8', 'SK'], current stack 910
player [Finneas] gets hole card ['S2', 'C2'], current stack 947
Started the round 45
Street "preflop" started. (community card = [])
"YangZ" declared "fold:0"
"Finneas" declared "call:10"
"Zheng" declared "call:10"
"SichengZuo" declared "fold:0"
"HakulaPlayer" declared "call:10"
"Ethan" declared "fold:0"
Street "flop" started. (community card = ['S6', 'ST', 'D3'])
"HakulaPlayer" declared "call:0"
"Finneas" declared "call:0"
"Zheng" declared "call:0"
Street "turn" started. (community card = ['S6', 'ST', 'D3', 'S7'])
"HakulaPlayer" declared "call:0"
"Finneas" declared "call:0"
"Zheng" declared "call:0"
Street "river" started. (community card = ['S6', 'ST', 'D3', 'S7', 'D4'])
"HakulaPlayer" declared "call:0"
"Finneas" declared "call:0"
"Zheng" declared "call:0"
"['HakulaPlayer']" won the round 45 (stack = {'Zheng': 2523, 'RaphaelPlayer': 0, 'SichengZuo': 895, 'Yuchun': 0, 'HakulaPlayer': 1889, 'Ethan': 845, 'YangZ': 910, 'Finneas': 937})
player [Zheng] gets hole card ['D8', 'CQ'], current stack 2523
player [SichengZuo] gets hole card ['C9', 'C3'], current stack 895
player [HakulaPlayer] gets hole card ['SQ', 'H5'], current stack 1889
player [Ethan] gets hole card ['H2', 'CT'], current stack 840
player [YangZ] gets hole card ['D9', 'H4'], current stack 900
player [Finneas] gets hole card ['S2', 'S8'], current stack 937
Started the round 46
Street "preflop" started. (community card = [])
"Finneas" declared "call:10"
"Zheng" declared "call:10"
"SichengZuo" declared "fold:0"
"HakulaPlayer" declared "call:10"
"Ethan" declared "fold:0"
"YangZ" declared "fold:0"
Street "flop" started. (community card = ['HJ', 'DT', 'S9'])
"Finneas" declared "call:0"
"Zheng" declared "raise:1261"
"HakulaPlayer" declared "fold:0"
"Finneas" declared "fold:0"
"['Zheng']" won the round 46 (stack = {'Zheng': 2558, 'RaphaelPlayer': 0, 'SichengZuo': 895, 'Yuchun': 0, 'HakulaPlayer': 1879, 'Ethan': 840, 'YangZ': 900, 'Finneas': 927})
player [Zheng] gets hole card ['S5', 'S9'], current stack 2558
player [SichengZuo] gets hole card ['S6', 'H3'], current stack 895
player [HakulaPlayer] gets hole card ['DK', 'HT'], current stack 1879
player [Ethan] gets hole card ['D3', 'S7'], current stack 840
player [YangZ] gets hole card ['S2', 'SK'], current stack 895
player [Finneas] gets hole card ['DA', 'D9'], current stack 917
Started the round 47
Street "preflop" started. (community card = [])
"Zheng" declared "call:10"
"SichengZuo" declared "fold:0"
"HakulaPlayer" declared "call:10"
"Ethan" declared "fold:0"
"YangZ" declared "fold:0"
"Finneas" declared "call:10"
Street "flop" started. (community card = ['D4', 'C9', 'D7'])
"Finneas" declared "call:0"
"Zheng" declared "call:0"
"HakulaPlayer" declared "call:0"
Street "turn" started. (community card = ['D4', 'C9', 'D7', 'C7'])
"Finneas" declared "call:0"
"Zheng" declared "call:0"
"HakulaPlayer" declared "call:0"
Street "river" started. (community card = ['D4', 'C9', 'D7', 'C7', 'C4'])
"Finneas" declared "call:0"
"Zheng" declared "call:0"
"HakulaPlayer" declared "call:0"
"['Finneas']" won the round 47 (stack = {'Zheng': 2548, 'RaphaelPlayer': 0, 'SichengZuo': 895, 'Yuchun': 0, 'HakulaPlayer': 1869, 'Ethan': 840, 'YangZ': 895, 'Finneas': 952})
player [Zheng] gets hole card ['D8', 'S6'], current stack 2538
player [SichengZuo] gets hole card ['HQ', 'H3'], current stack 895
player [HakulaPlayer] gets hole card ['DK', 'C9'], current stack 1869
player [Ethan] gets hole card ['H2', 'C6'], current stack 840
player [YangZ] gets hole card ['H7', 'D4'], current stack 895
player [Finneas] gets hole card ['HK', 'HT'], current stack 947
Started the round 48
Street "preflop" started. (community card = [])
"SichengZuo" declared "fold:0"
"HakulaPlayer" declared "fold:0"
"Ethan" declared "fold:0"
"YangZ" declared "fold:0"
"Finneas" declared "call:10"
"Zheng" declared "call:10"
Street "flop" started. (community card = ['SJ', 'SK', 'CJ'])
"Finneas" declared "call:0"
"Zheng" declared "call:0"
Street "turn" started. (community card = ['SJ', 'SK', 'CJ', 'D2'])
"Finneas" declared "call:0"
"Zheng" declared "call:0"
Street "river" started. (community card = ['SJ', 'SK', 'CJ', 'D2', 'CQ'])
"Finneas" declared "call:0"
"Zheng" declared "call:0"
"['Finneas']" won the round 48 (stack = {'Zheng': 2538, 'RaphaelPlayer': 0, 'SichengZuo': 895, 'Yuchun': 0, 'HakulaPlayer': 1869, 'Ethan': 840, 'YangZ': 895, 'Finneas': 962})
player [Zheng] gets hole card ['CK', 'H2'], current stack 2533
player [SichengZuo] gets hole card ['D6', 'D9'], current stack 885
player [HakulaPlayer] gets hole card ['C4', 'CT'], current stack 1869
player [Ethan] gets hole card ['SJ', 'S3'], current stack 840
player [YangZ] gets hole card ['ST', 'C2'], current stack 895
player [Finneas] gets hole card ['H8', 'C5'], current stack 962
Started the round 49
Street "preflop" started. (community card = [])
"HakulaPlayer" declared "fold:0"
"Ethan" declared "fold:0"
"YangZ" declared "fold:0"
"Finneas" declared "call:10"
"Zheng" declared "call:10"
"SichengZuo" declared "fold:0"
Street "flop" started. (community card = ['DT', 'S7', 'HJ'])
"Zheng" declared "call:0"
"Finneas" declared "call:0"
Street "turn" started. (community card = ['DT', 'S7', 'HJ', 'S6'])
"Zheng" declared "call:0"
"Finneas" declared "call:0"
Street "river" started. (community card = ['DT', 'S7', 'HJ', 'S6', 'H3'])
"Zheng" declared "call:0"
"Finneas" declared "call:0"
"['Zheng']" won the round 49 (stack = {'Zheng': 2558, 'RaphaelPlayer': 0, 'SichengZuo': 885, 'Yuchun': 0, 'HakulaPlayer': 1869, 'Ethan': 840, 'YangZ': 895, 'Finneas': 952})
player [Zheng] gets hole card ['DT', 'CQ'], current stack 2558
player [SichengZuo] gets hole card ['H5', 'C3'], current stack 880
player [HakulaPlayer] gets hole card ['D5', 'H7'], current stack 1859
player [Ethan] gets hole card ['SQ', 'D6'], current stack 840
player [YangZ] gets hole card ['S9', 'S4'], current stack 895
player [Finneas] gets hole card ['H3', 'S8'], current stack 952
Started the round 50
Street "preflop" started. (community card = [])
"Ethan" declared "fold:0"
"YangZ" declared "fold:0"
"Finneas" declared "call:10"
"Zheng" declared "call:10"
"SichengZuo" declared "fold:0"
"HakulaPlayer" declared "call:10"
Street "flop" started. (community card = ['HJ', 'S3', 'D4'])
"HakulaPlayer" declared "call:0"
"Finneas" declared "call:0"
"Zheng" declared "call:0"
Street "turn" started. (community card = ['HJ', 'S3', 'D4', 'H4'])
"HakulaPlayer" declared "call:0"
"Finneas" declared "call:0"
"Zheng" declared "call:0"
Street "river" started. (community card = ['HJ', 'S3', 'D4', 'H4', 'D9'])
"HakulaPlayer" declared "call:0"
"Finneas" declared "call:0"
"Zheng" declared "call:0"
"['Finneas']" won the round 50 (stack = {'Zheng': 2548, 'RaphaelPlayer': 0, 'SichengZuo': 880, 'Yuchun': 0, 'HakulaPlayer': 1859, 'Ethan': 840, 'YangZ': 895, 'Finneas': 977})

Game Results:
------------------------------------------------------------
Game 1:
Winner: Zheng (stack: 2548)
All players' stacks:
  Zheng: 2548
  RaphaelPlayer: 0
  SichengZuo: 880
  Yuchun: 0
  HakulaPlayer: 1859
  Ethan: 840
  YangZ: 895
  Finneas: 977
------------------------------------------------------------
