player [Zheng] gets hole card ['S9', 'HK'], current stack 1000
player [RaphaelPlayer] gets hole card ['C2', 'H2'], current stack 995
player [SichengZuo] gets hole card ['DQ', 'D8'], current stack 990
player [Yuchun] gets hole card ['H4', 'HQ'], current stack 1000
player [HakulaPlayer] gets hole card ['D7', 'D5'], current stack 1000
player [Ethan] gets hole card ['C4', 'DJ'], current stack 1000
player [YangZ] gets hole card ['C3', 'H3'], current stack 1000
player [Finneas] gets hole card ['S3', 'HA'], current stack 1000
Started the round 1
Street "preflop" started. (community card = [])
"Yuchun" declared "fold:0"
"HakulaPlayer" declared "fold:0"
"Ethan" declared "fold:0"
"YangZ" declared "fold:0"
"Finneas" declared "call:10"
"Zheng" declared "call:10"
"RaphaelPlayer" declared "fold:0"
"SichengZuo" declared "fold:0"
Street "flop" started. (community card = ['C5', 'D9', 'S4'])
"Finneas" declared "call:0"
"Zheng" declared "raise:500"
"Finneas" declared "fold:0"
"['Zheng']" won the round 1 (stack = {'Zheng': 1025, 'RaphaelPlayer': 995, 'SichengZuo': 990, 'Yuchun': 1000, 'HakulaPlayer': 1000, 'Ethan': 1000, 'YangZ': 1000, 'Finneas': 990})
player [Zheng] gets hole card ['H7', 'CK'], current stack 1025
player [RaphaelPlayer] gets hole card ['DA', 'SJ'], current stack 995
player [SichengZuo] gets hole card ['C3', 'D5'], current stack 985
player [Yuchun] gets hole card ['CA', 'C2'], current stack 990
player [HakulaPlayer] gets hole card ['H2', 'H4'], current stack 1000
player [Ethan] gets hole card ['C7', 'DQ'], current stack 1000
player [YangZ] gets hole card ['S9', 'C8'], current stack 1000
player [Finneas] gets hole card ['S8', 'CJ'], current stack 990
Started the round 2
Street "preflop" started. (community card = [])
"HakulaPlayer" declared "fold:0"
"Ethan" declared "fold:0"
"YangZ" declared "fold:0"
"Finneas" declared "call:10"
"Zheng" declared "call:10"
"RaphaelPlayer" declared "raise:30"
"SichengZuo" declared "fold:0"
"Yuchun" declared "fold:0"
"Finneas" declared "fold:0"
"Zheng" declared "fold:0"
"['RaphaelPlayer']" won the round 2 (stack = {'Zheng': 1015, 'RaphaelPlayer': 1030, 'SichengZuo': 985, 'Yuchun': 990, 'HakulaPlayer': 1000, 'Ethan': 1000, 'YangZ': 1000, 'Finneas': 980})
player [Zheng] gets hole card ['C2', 'SJ'], current stack 1015
player [RaphaelPlayer] gets hole card ['SK', 'HA'], current stack 1030
player [SichengZuo] gets hole card ['DJ', 'C4'], current stack 985
player [Yuchun] gets hole card ['CA', 'S4'], current stack 985
player [HakulaPlayer] gets hole card ['H7', 'H8'], current stack 990
player [Ethan] gets hole card ['S3', 'S6'], current stack 1000
player [YangZ] gets hole card ['D4', 'D6'], current stack 1000
player [Finneas] gets hole card ['D9', 'C5'], current stack 980
Started the round 3
Street "preflop" started. (community card = [])
"Ethan" declared "fold:0"
"YangZ" declared "fold:0"
"Finneas" declared "call:10"
"Zheng" declared "call:10"
"RaphaelPlayer" declared "raise:30"
"SichengZuo" declared "fold:0"
"Yuchun" declared "fold:0"
"HakulaPlayer" declared "call:30"
"Finneas" declared "fold:0"
"Zheng" declared "fold:0"
Street "flop" started. (community card = ['H9', 'C7', 'C6'])
"HakulaPlayer" declared "raise:93"
"RaphaelPlayer" declared "fold:0"
"['HakulaPlayer']" won the round 3 (stack = {'Zheng': 1005, 'RaphaelPlayer': 1000, 'SichengZuo': 985, 'Yuchun': 985, 'HakulaPlayer': 1055, 'Ethan': 1000, 'YangZ': 1000, 'Finneas': 970})
player [Zheng] gets hole card ['S7', 'H8'], current stack 1005
player [RaphaelPlayer] gets hole card ['C8', 'H6'], current stack 1000
player [SichengZuo] gets hole card ['CQ', 'S4'], current stack 985
player [Yuchun] gets hole card ['D2', 'C3'], current stack 985
player [HakulaPlayer] gets hole card ['DQ', 'S3'], current stack 1050
player [Ethan] gets hole card ['SA', 'H2'], current stack 990
player [YangZ] gets hole card ['H7', 'CJ'], current stack 1000
player [Finneas] gets hole card ['C7', 'CT'], current stack 970
Started the round 4
Street "preflop" started. (community card = [])
"YangZ" declared "fold:0"
"Finneas" declared "call:10"
"Zheng" declared "call:10"
"RaphaelPlayer" declared "fold:0"
"SichengZuo" declared "fold:0"
"Yuchun" declared "fold:0"
"HakulaPlayer" declared "call:10"
"Ethan" declared "fold:0"
Street "flop" started. (community card = ['HJ', 'CA', 'C5'])
"HakulaPlayer" declared "call:0"
"Finneas" declared "call:0"
"Zheng" declared "call:0"
Street "turn" started. (community card = ['HJ', 'CA', 'C5', 'D6'])
"HakulaPlayer" declared "call:0"
"Finneas" declared "call:0"
"Zheng" declared "call:0"
Street "river" started. (community card = ['HJ', 'CA', 'C5', 'D6', 'H9'])
"HakulaPlayer" declared "call:0"
"Finneas" declared "call:0"
"Zheng" declared "raise:995"
"HakulaPlayer" declared "fold:0"
"Finneas" declared "fold:0"
"['Zheng']" won the round 4 (stack = {'Zheng': 1035, 'RaphaelPlayer': 1000, 'SichengZuo': 985, 'Yuchun': 985, 'HakulaPlayer': 1045, 'Ethan': 990, 'YangZ': 1000, 'Finneas': 960})
player [Zheng] gets hole card ['S5', 'CT'], current stack 1035
player [RaphaelPlayer] gets hole card ['C6', 'ST'], current stack 1000
player [SichengZuo] gets hole card ['C3', 'C2'], current stack 985
player [Yuchun] gets hole card ['H7', 'CK'], current stack 985
player [HakulaPlayer] gets hole card ['D7', 'S6'], current stack 1045
player [Ethan] gets hole card ['S4', 'SK'], current stack 985
player [YangZ] gets hole card ['D5', 'S3'], current stack 990
player [Finneas] gets hole card ['H4', 'D8'], current stack 960
Started the round 5
Street "preflop" started. (community card = [])
"Finneas" declared "call:10"
"Zheng" declared "call:10"
"RaphaelPlayer" declared "fold:0"
"SichengZuo" declared "fold:0"
"Yuchun" declared "fold:0"
"HakulaPlayer" declared "call:10"
"Ethan" declared "fold:0"
"YangZ" declared "fold:0"
Street "flop" started. (community card = ['HJ', 'DA', 'H5'])
"Finneas" declared "call:0"
"Zheng" declared "call:0"
"HakulaPlayer" declared "call:0"
Street "turn" started. (community card = ['HJ', 'DA', 'H5', 'D4'])
"Finneas" declared "call:0"
"Zheng" declared "call:0"
"HakulaPlayer" declared "call:0"
Street "river" started. (community card = ['HJ', 'DA', 'H5', 'D4', 'H6'])
"Finneas" declared "call:0"
"Zheng" declared "call:0"
"HakulaPlayer" declared "call:0"
"['HakulaPlayer']" won the round 5 (stack = {'Zheng': 1025, 'RaphaelPlayer': 1000, 'SichengZuo': 985, 'Yuchun': 985, 'HakulaPlayer': 1080, 'Ethan': 985, 'YangZ': 990, 'Finneas': 950})
player [Zheng] gets hole card ['SA', 'DQ'], current stack 1025
player [RaphaelPlayer] gets hole card ['H8', 'HT'], current stack 1000
player [SichengZuo] gets hole card ['SJ', 'C2'], current stack 985
player [Yuchun] gets hole card ['DJ', 'S7'], current stack 985
player [HakulaPlayer] gets hole card ['D4', 'S3'], current stack 1080
player [Ethan] gets hole card ['H2', 'DK'], current stack 985
player [YangZ] gets hole card ['S9', 'CA'], current stack 985
player [Finneas] gets hole card ['DA', 'CK'], current stack 940
Started the round 6
Street "preflop" started. (community card = [])
"Zheng" declared "call:10"
"RaphaelPlayer" declared "call:10"
"SichengZuo" declared "fold:0"
"Yuchun" declared "fold:0"
"HakulaPlayer" declared "fold:0"
"Ethan" declared "fold:0"
"YangZ" declared "fold:0"
"Finneas" declared "raise:482"
"Zheng" declared "fold:0"
"RaphaelPlayer" declared "fold:0"
"['Finneas']" won the round 6 (stack = {'Zheng': 1015, 'RaphaelPlayer': 990, 'SichengZuo': 985, 'Yuchun': 985, 'HakulaPlayer': 1080, 'Ethan': 985, 'YangZ': 985, 'Finneas': 975})
player [Zheng] gets hole card ['C4', 'CA'], current stack 1005
player [RaphaelPlayer] gets hole card ['S5', 'D3'], current stack 990
player [SichengZuo] gets hole card ['H9', 'D9'], current stack 985
player [Yuchun] gets hole card ['S7', 'CJ'], current stack 985
player [HakulaPlayer] gets hole card ['C7', 'C6'], current stack 1080
player [Ethan] gets hole card ['HA', 'SJ'], current stack 985
player [YangZ] gets hole card ['HT', 'DQ'], current stack 985
player [Finneas] gets hole card ['CT', 'D2'], current stack 970
Started the round 7
Street "preflop" started. (community card = [])
"RaphaelPlayer" declared "fold:0"
"SichengZuo" declared "fold:0"
"Yuchun" declared "fold:0"
"HakulaPlayer" declared "fold:0"
"Ethan" declared "raise:147"
"YangZ" declared "fold:0"
"Finneas" declared "fold:0"
"Zheng" declared "fold:0"
"['Ethan']" won the round 7 (stack = {'Zheng': 1005, 'RaphaelPlayer': 990, 'SichengZuo': 985, 'Yuchun': 985, 'HakulaPlayer': 1080, 'Ethan': 1000, 'YangZ': 985, 'Finneas': 970})
player [Zheng] gets hole card ['HK', 'S8'], current stack 1000
player [RaphaelPlayer] gets hole card ['C2', 'S5'], current stack 980
player [SichengZuo] gets hole card ['D6', 'HT'], current stack 985
player [Yuchun] gets hole card ['SQ', 'S2'], current stack 985
player [HakulaPlayer] gets hole card ['HJ', 'SA'], current stack 1080
player [Ethan] gets hole card ['DT', 'H4'], current stack 1000
player [YangZ] gets hole card ['C9', 'DK'], current stack 985
player [Finneas] gets hole card ['D8', 'CT'], current stack 970
Started the round 8
Street "preflop" started. (community card = [])
"SichengZuo" declared "fold:0"
"Yuchun" declared "fold:0"
"HakulaPlayer" declared "call:10"
"Ethan" declared "fold:0"
"YangZ" declared "fold:0"
"Finneas" declared "call:10"
"Zheng" declared "call:10"
"RaphaelPlayer" declared "fold:0"
Street "flop" started. (community card = ['C6', 'HA', 'S4'])
"Zheng" declared "call:0"
"HakulaPlayer" declared "call:0"
"Finneas" declared "call:0"
Street "turn" started. (community card = ['C6', 'HA', 'S4', 'HQ'])
"Zheng" declared "call:0"
"HakulaPlayer" declared "raise:44"
"Finneas" declared "fold:0"
"Zheng" declared "fold:0"
"['HakulaPlayer']" won the round 8 (stack = {'Zheng': 995, 'RaphaelPlayer': 980, 'SichengZuo': 985, 'Yuchun': 985, 'HakulaPlayer': 1110, 'Ethan': 1000, 'YangZ': 985, 'Finneas': 960})
player [Zheng] gets hole card ['C5', 'C8'], current stack 995
player [RaphaelPlayer] gets hole card ['DT', 'C2'], current stack 975
player [SichengZuo] gets hole card ['S6', 'CA'], current stack 975
player [Yuchun] gets hole card ['DK', 'H8'], current stack 985
player [HakulaPlayer] gets hole card ['S2', 'H4'], current stack 1110
player [Ethan] gets hole card ['CK', 'H6'], current stack 1000
player [YangZ] gets hole card ['HK', 'D4'], current stack 985
player [Finneas] gets hole card ['S5', 'S8'], current stack 960
Started the round 9
Street "preflop" started. (community card = [])
"Yuchun" declared "fold:0"
"HakulaPlayer" declared "fold:0"
"Ethan" declared "fold:0"
"YangZ" declared "fold:0"
"Finneas" declared "call:10"
"Zheng" declared "call:10"
"RaphaelPlayer" declared "fold:0"
"SichengZuo" declared "fold:0"
Street "flop" started. (community card = ['C6', 'D6', 'CT'])
"Finneas" declared "call:0"
"Zheng" declared "call:0"
Street "turn" started. (community card = ['C6', 'D6', 'CT', 'HQ'])
"Finneas" declared "call:0"
"Zheng" declared "call:0"
Street "river" started. (community card = ['C6', 'D6', 'CT', 'HQ', 'DQ'])
"Finneas" declared "call:0"
"Zheng" declared "call:0"
"['Zheng', 'Finneas']" won the round 9 (stack = {'Zheng': 1002, 'RaphaelPlayer': 975, 'SichengZuo': 975, 'Yuchun': 985, 'HakulaPlayer': 1110, 'Ethan': 1000, 'YangZ': 985, 'Finneas': 967})
player [Zheng] gets hole card ['SJ', 'SK'], current stack 1002
player [RaphaelPlayer] gets hole card ['C4', 'S8'], current stack 975
player [SichengZuo] gets hole card ['HQ', 'DT'], current stack 970
player [Yuchun] gets hole card ['S4', 'HT'], current stack 975
player [HakulaPlayer] gets hole card ['C9', 'C3'], current stack 1110
player [Ethan] gets hole card ['S7', 'DJ'], current stack 1000
player [YangZ] gets hole card ['SA', 'H7'], current stack 985
player [Finneas] gets hole card ['H3', 'D7'], current stack 967
Started the round 10
Street "preflop" started. (community card = [])
"HakulaPlayer" declared "fold:0"
"Ethan" declared "fold:0"
"YangZ" declared "fold:0"
"Finneas" declared "call:10"
"Zheng" declared "call:10"
"RaphaelPlayer" declared "fold:0"
"SichengZuo" declared "fold:0"
"Yuchun" declared "call:10"
Street "flop" started. (community card = ['D9', 'D2', 'S6'])
"Yuchun" declared "call:0"
"Finneas" declared "call:0"
"Zheng" declared "call:0"
Street "turn" started. (community card = ['D9', 'D2', 'S6', 'H4'])
"Yuchun" declared "call:0"
"Finneas" declared "call:0"
"Zheng" declared "call:0"
Street "river" started. (community card = ['D9', 'D2', 'S6', 'H4', 'H6'])
"Yuchun" declared "call:0"
"Finneas" declared "call:0"
"Zheng" declared "call:0"
"['Yuchun']" won the round 10 (stack = {'Zheng': 992, 'RaphaelPlayer': 975, 'SichengZuo': 970, 'Yuchun': 1010, 'HakulaPlayer': 1110, 'Ethan': 1000, 'YangZ': 985, 'Finneas': 957})
player [Zheng] gets hole card ['D9', 'D5'], current stack 992
player [RaphaelPlayer] gets hole card ['D3', 'HT'], current stack 975
player [SichengZuo] gets hole card ['H4', 'H9'], current stack 970
player [Yuchun] gets hole card ['S9', 'DT'], current stack 1005
player [HakulaPlayer] gets hole card ['H3', 'C7'], current stack 1100
player [Ethan] gets hole card ['D8', 'SJ'], current stack 1000
player [YangZ] gets hole card ['C6', 'C8'], current stack 985
player [Finneas] gets hole card ['D4', 'DA'], current stack 957
Started the round 11
Street "preflop" started. (community card = [])
"Ethan" declared "fold:0"
"YangZ" declared "fold:0"
"Finneas" declared "call:10"
"Zheng" declared "call:10"
"RaphaelPlayer" declared "fold:0"
"SichengZuo" declared "fold:0"
"Yuchun" declared "call:10"
"HakulaPlayer" declared "call:10"
Street "flop" started. (community card = ['S6', 'CQ', 'H2'])
"Yuchun" declared "call:0"
"HakulaPlayer" declared "call:0"
"Finneas" declared "call:0"
"Zheng" declared "call:0"
Street "turn" started. (community card = ['S6', 'CQ', 'H2', 'SQ'])
"Yuchun" declared "call:0"
"HakulaPlayer" declared "call:0"
"Finneas" declared "call:0"
"Zheng" declared "call:0"
Street "river" started. (community card = ['S6', 'CQ', 'H2', 'SQ', 'C5'])
"Yuchun" declared "call:0"
"HakulaPlayer" declared "call:0"
"Finneas" declared "call:0"
"Zheng" declared "call:0"
"['Zheng']" won the round 11 (stack = {'Zheng': 1022, 'RaphaelPlayer': 975, 'SichengZuo': 970, 'Yuchun': 1000, 'HakulaPlayer': 1100, 'Ethan': 1000, 'YangZ': 985, 'Finneas': 947})
player [Zheng] gets hole card ['SJ', 'S3'], current stack 1022
player [RaphaelPlayer] gets hole card ['D2', 'SA'], current stack 975
player [SichengZuo] gets hole card ['CQ', 'H6'], current stack 970
player [Yuchun] gets hole card ['HQ', 'C2'], current stack 1000
player [HakulaPlayer] gets hole card ['H7', 'HJ'], current stack 1095
player [Ethan] gets hole card ['HT', 'CA'], current stack 990
player [YangZ] gets hole card ['D8', 'DA'], current stack 985
player [Finneas] gets hole card ['S7', 'S9'], current stack 947
Started the round 12
Street "preflop" started. (community card = [])
"YangZ" declared "fold:0"
"Finneas" declared "call:10"
"Zheng" declared "call:10"
"RaphaelPlayer" declared "call:10"
"SichengZuo" declared "fold:0"
"Yuchun" declared "call:10"
"HakulaPlayer" declared "call:10"
"Ethan" declared "call:10"
Street "flop" started. (community card = ['D3', 'C3', 'CK'])
"HakulaPlayer" declared "call:0"
"Ethan" declared "call:0"
"Finneas" declared "call:0"
"Zheng" declared "call:0"
"RaphaelPlayer" declared "call:0"
"Yuchun" declared "call:0"
Street "turn" started. (community card = ['D3', 'C3', 'CK', 'H8'])
"HakulaPlayer" declared "call:0"
"Ethan" declared "call:0"
"Finneas" declared "call:0"
"Zheng" declared "raise:511"
"RaphaelPlayer" declared "fold:0"
"Yuchun" declared "fold:0"
"HakulaPlayer" declared "fold:0"
"Ethan" declared "fold:0"
"Finneas" declared "fold:0"
"['Zheng']" won the round 12 (stack = {'Zheng': 1072, 'RaphaelPlayer': 965, 'SichengZuo': 970, 'Yuchun': 990, 'HakulaPlayer': 1090, 'Ethan': 990, 'YangZ': 985, 'Finneas': 937})
player [Zheng] gets hole card ['C3', 'DK'], current stack 1072
player [RaphaelPlayer] gets hole card ['C2', 'SA'], current stack 965
player [SichengZuo] gets hole card ['SK', 'S9'], current stack 970
player [Yuchun] gets hole card ['C6', 'H7'], current stack 990
player [HakulaPlayer] gets hole card ['CT', 'CK'], current stack 1090
player [Ethan] gets hole card ['H8', 'D5'], current stack 985
player [YangZ] gets hole card ['H2', 'C9'], current stack 975
player [Finneas] gets hole card ['DQ', 'DT'], current stack 937
Started the round 13
Street "preflop" started. (community card = [])
"Finneas" declared "call:10"
"Zheng" declared "call:10"
"RaphaelPlayer" declared "call:10"
"SichengZuo" declared "fold:0"
"Yuchun" declared "call:10"
"HakulaPlayer" declared "raise:35"
"Ethan" declared "fold:0"
"YangZ" declared "fold:0"
"Finneas" declared "fold:0"
"Zheng" declared "fold:0"
"RaphaelPlayer" declared "call:35"
"Yuchun" declared "call:35"
Street "flop" started. (community card = ['C7', 'S3', 'S5'])
"RaphaelPlayer" declared "call:0"
"Yuchun" declared "call:0"
"HakulaPlayer" declared "raise:92"
"RaphaelPlayer" declared "fold:0"
"Yuchun" declared "call:92"
Street "turn" started. (community card = ['C7', 'S3', 'S5', 'HA'])
"Yuchun" declared "call:0"
"HakulaPlayer" declared "raise:244"
"Yuchun" declared "call:244"
Street "river" started. (community card = ['C7', 'S3', 'S5', 'HA', 'H6'])
"Yuchun" declared "call:0"
"HakulaPlayer" declared "call:0"
"['Yuchun']" won the round 13 (stack = {'Zheng': 1062, 'RaphaelPlayer': 930, 'SichengZuo': 970, 'Yuchun': 1431, 'HakulaPlayer': 719, 'Ethan': 985, 'YangZ': 975, 'Finneas': 927})
player [Zheng] gets hole card ['S9', 'D3'], current stack 1062
player [RaphaelPlayer] gets hole card ['D7', 'HK'], current stack 930
player [SichengZuo] gets hole card ['DA', 'H7'], current stack 970
player [Yuchun] gets hole card ['SK', 'SQ'], current stack 1431
player [HakulaPlayer] gets hole card ['DT', 'D4'], current stack 719
player [Ethan] gets hole card ['DQ', 'HT'], current stack 985
player [YangZ] gets hole card ['HA', 'S6'], current stack 970
player [Finneas] gets hole card ['DJ', 'C9'], current stack 917
Started the round 14
Street "preflop" started. (community card = [])
"Zheng" declared "call:10"
"RaphaelPlayer" declared "fold:0"
"SichengZuo" declared "fold:0"
"Yuchun" declared "call:10"
"HakulaPlayer" declared "call:10"
"Ethan" declared "fold:0"
"YangZ" declared "fold:0"
"Finneas" declared "call:10"
Street "flop" started. (community card = ['C3', 'H2', 'CA'])
"Finneas" declared "call:0"
"Zheng" declared "call:0"
"Yuchun" declared "call:0"
"HakulaPlayer" declared "call:0"
Street "turn" started. (community card = ['C3', 'H2', 'CA', 'SJ'])
"Finneas" declared "call:0"
"Zheng" declared "call:0"
"Yuchun" declared "call:0"
"HakulaPlayer" declared "call:0"
Street "river" started. (community card = ['C3', 'H2', 'CA', 'SJ', 'C7'])
"Finneas" declared "call:0"
"Zheng" declared "call:0"
"Yuchun" declared "call:0"
"HakulaPlayer" declared "call:0"
"['Finneas']" won the round 14 (stack = {'Zheng': 1052, 'RaphaelPlayer': 930, 'SichengZuo': 970, 'Yuchun': 1421, 'HakulaPlayer': 709, 'Ethan': 985, 'YangZ': 970, 'Finneas': 962})
player [Zheng] gets hole card ['H7', 'HT'], current stack 1042
player [RaphaelPlayer] gets hole card ['S7', 'D5'], current stack 930
player [SichengZuo] gets hole card ['CT', 'D4'], current stack 970
player [Yuchun] gets hole card ['S9', 'HA'], current stack 1421
player [HakulaPlayer] gets hole card ['S3', 'C5'], current stack 709
player [Ethan] gets hole card ['H6', 'DK'], current stack 985
player [YangZ] gets hole card ['D8', 'H8'], current stack 970
player [Finneas] gets hole card ['CQ', 'C9'], current stack 957
Started the round 15
Street "preflop" started. (community card = [])
"RaphaelPlayer" declared "fold:0"
"SichengZuo" declared "fold:0"
"Yuchun" declared "call:10"
"HakulaPlayer" declared "fold:0"
"Ethan" declared "fold:0"
"YangZ" declared "fold:0"
"Finneas" declared "call:10"
"Zheng" declared "call:10"
Street "flop" started. (community card = ['ST', 'C7', 'HK'])
"Finneas" declared "call:0"
"Zheng" declared "raise:526"
"Yuchun" declared "fold:0"
"Finneas" declared "fold:0"
"['Zheng']" won the round 15 (stack = {'Zheng': 1072, 'RaphaelPlayer': 930, 'SichengZuo': 970, 'Yuchun': 1411, 'HakulaPlayer': 709, 'Ethan': 985, 'YangZ': 970, 'Finneas': 952})
player [Zheng] gets hole card ['C6', 'DA'], current stack 1067
player [RaphaelPlayer] gets hole card ['D2', 'D7'], current stack 920
player [SichengZuo] gets hole card ['H8', 'HK'], current stack 970
player [Yuchun] gets hole card ['CA', 'CQ'], current stack 1411
player [HakulaPlayer] gets hole card ['DT', 'D8'], current stack 709
player [Ethan] gets hole card ['SK', 'S2'], current stack 985
player [YangZ] gets hole card ['H9', 'C7'], current stack 970
player [Finneas] gets hole card ['D5', 'CT'], current stack 952
Started the round 16
Street "preflop" started. (community card = [])
"SichengZuo" declared "fold:0"
"Yuchun" declared "call:10"
"HakulaPlayer" declared "call:10"
"Ethan" declared "fold:0"
"YangZ" declared "fold:0"
"Finneas" declared "call:10"
"Zheng" declared "call:10"
"RaphaelPlayer" declared "fold:0"
Street "flop" started. (community card = ['H6', 'SA', 'D3'])
"Zheng" declared "raise:536"
"Yuchun" declared "fold:0"
"HakulaPlayer" declared "fold:0"
"Finneas" declared "fold:0"
"['Zheng']" won the round 16 (stack = {'Zheng': 1112, 'RaphaelPlayer': 920, 'SichengZuo': 970, 'Yuchun': 1401, 'HakulaPlayer': 699, 'Ethan': 985, 'YangZ': 970, 'Finneas': 942})
player [Zheng] gets hole card ['C5', 'H5'], current stack 1112
player [RaphaelPlayer] gets hole card ['CJ', 'H6'], current stack 915
player [SichengZuo] gets hole card ['D4', 'S8'], current stack 960
player [Yuchun] gets hole card ['ST', 'H3'], current stack 1401
player [HakulaPlayer] gets hole card ['S5', 'CT'], current stack 699
player [Ethan] gets hole card ['S2', 'C8'], current stack 985
player [YangZ] gets hole card ['S3', 'C6'], current stack 970
player [Finneas] gets hole card ['HK', 'C2'], current stack 942
Started the round 17
Street "preflop" started. (community card = [])
"Yuchun" declared "call:10"
"HakulaPlayer" declared "call:10"
"Ethan" declared "fold:0"
"YangZ" declared "fold:0"
"Finneas" declared "call:10"
"Zheng" declared "call:10"
"RaphaelPlayer" declared "fold:0"
"SichengZuo" declared "fold:0"
Street "flop" started. (community card = ['D5', 'SK', 'H7'])
"Yuchun" declared "call:0"
"HakulaPlayer" declared "call:0"
"Finneas" declared "call:0"
"Zheng" declared "raise:1102"
"Yuchun" declared "fold:0"
"HakulaPlayer" declared "fold:0"
"Finneas" declared "fold:0"
"['Zheng']" won the round 17 (stack = {'Zheng': 1157, 'RaphaelPlayer': 915, 'SichengZuo': 960, 'Yuchun': 1391, 'HakulaPlayer': 689, 'Ethan': 985, 'YangZ': 970, 'Finneas': 932})
player [Zheng] gets hole card ['HQ', 'C4'], current stack 1157
player [RaphaelPlayer] gets hole card ['D2', 'S3'], current stack 915
player [SichengZuo] gets hole card ['DQ', 'H8'], current stack 955
player [Yuchun] gets hole card ['ST', 'CA'], current stack 1381
player [HakulaPlayer] gets hole card ['H5', 'CT'], current stack 689
player [Ethan] gets hole card ['CQ', 'D3'], current stack 985
player [YangZ] gets hole card ['S4', 'C8'], current stack 970
player [Finneas] gets hole card ['H2', 'C2'], current stack 932
Started the round 18
Street "preflop" started. (community card = [])
"HakulaPlayer" declared "fold:0"
"Ethan" declared "fold:0"
"YangZ" declared "fold:0"
"Finneas" declared "call:10"
"Zheng" declared "call:10"
"RaphaelPlayer" declared "fold:0"
"SichengZuo" declared "fold:0"
"Yuchun" declared "call:10"
Street "flop" started. (community card = ['DA', 'SQ', 'D4'])
"Yuchun" declared "raise:40"
"Finneas" declared "fold:0"
"Zheng" declared "raise:1147"
"Yuchun" declared "call:1147"
Street "turn" started. (community card = ['DA', 'SQ', 'D4', 'C9'])
Street "river" started. (community card = ['DA', 'SQ', 'D4', 'C9', 'S5'])
"['Zheng']" won the round 18 (stack = {'Zheng': 2329, 'RaphaelPlayer': 915, 'SichengZuo': 955, 'Yuchun': 234, 'HakulaPlayer': 689, 'Ethan': 985, 'YangZ': 970, 'Finneas': 922})
player [Zheng] gets hole card ['HA', 'DQ'], current stack 2329
player [RaphaelPlayer] gets hole card ['S4', 'S6'], current stack 915
player [SichengZuo] gets hole card ['D8', 'SQ'], current stack 955
player [Yuchun] gets hole card ['D6', 'D5'], current stack 229
player [HakulaPlayer] gets hole card ['C6', 'H3'], current stack 679
player [Ethan] gets hole card ['D4', 'S3'], current stack 985
player [YangZ] gets hole card ['S2', 'HK'], current stack 970
player [Finneas] gets hole card ['D2', 'C9'], current stack 922
Started the round 19
Street "preflop" started. (community card = [])
"Ethan" declared "fold:0"
"YangZ" declared "fold:0"
"Finneas" declared "call:10"
"Zheng" declared "call:10"
"RaphaelPlayer" declared "fold:0"
"SichengZuo" declared "fold:0"
"Yuchun" declared "call:10"
"HakulaPlayer" declared "call:10"
Street "flop" started. (community card = ['DT', 'C5', 'H5'])
"Yuchun" declared "raise:224"
"HakulaPlayer" declared "fold:0"
"Finneas" declared "fold:0"
"Zheng" declared "fold:0"
"['Yuchun']" won the round 19 (stack = {'Zheng': 2319, 'RaphaelPlayer': 915, 'SichengZuo': 955, 'Yuchun': 264, 'HakulaPlayer': 679, 'Ethan': 985, 'YangZ': 970, 'Finneas': 912})
player [Zheng] gets hole card ['H5', 'S4'], current stack 2319
player [RaphaelPlayer] gets hole card ['H3', 'SJ'], current stack 915
player [SichengZuo] gets hole card ['H2', 'C2'], current stack 955
player [Yuchun] gets hole card ['D9', 'C3'], current stack 264
player [HakulaPlayer] gets hole card ['S9', 'S5'], current stack 674
player [Ethan] gets hole card ['HK', 'C6'], current stack 975
player [YangZ] gets hole card ['CJ', 'D3'], current stack 970
player [Finneas] gets hole card ['SK', 'HQ'], current stack 912
Started the round 20
Street "preflop" started. (community card = [])
"YangZ" declared "fold:0"
"Finneas" declared "call:10"
"Zheng" declared "call:10"
"RaphaelPlayer" declared "fold:0"
"SichengZuo" declared "fold:0"
"Yuchun" declared "call:10"
"HakulaPlayer" declared "call:10"
"Ethan" declared "fold:0"
Street "flop" started. (community card = ['C8', 'D5', 'S7'])
"HakulaPlayer" declared "call:0"
"Finneas" declared "call:0"
"Zheng" declared "call:0"
"Yuchun" declared "call:0"
Street "turn" started. (community card = ['C8', 'D5', 'S7', 'C7'])
"HakulaPlayer" declared "call:0"
"Finneas" declared "call:0"
"Zheng" declared "call:0"
"Yuchun" declared "call:0"
Street "river" started. (community card = ['C8', 'D5', 'S7', 'C7', 'H9'])
"HakulaPlayer" declared "call:0"
"Finneas" declared "call:0"
"Zheng" declared "call:0"
"Yuchun" declared "call:0"
"['Yuchun', 'HakulaPlayer']" won the round 20 (stack = {'Zheng': 2309, 'RaphaelPlayer': 915, 'SichengZuo': 955, 'Yuchun': 279, 'HakulaPlayer': 694, 'Ethan': 975, 'YangZ': 970, 'Finneas': 902})
player [Zheng] gets hole card ['S5', 'DJ'], current stack 2309
player [RaphaelPlayer] gets hole card ['DT', 'D4'], current stack 915
player [SichengZuo] gets hole card ['HA', 'C8'], current stack 955
player [Yuchun] gets hole card ['H2', 'DK'], current stack 279
player [HakulaPlayer] gets hole card ['SA', 'C3'], current stack 694
player [Ethan] gets hole card ['C5', 'CJ'], current stack 970
player [YangZ] gets hole card ['ST', 'S3'], current stack 960
player [Finneas] gets hole card ['H7', 'C7'], current stack 902
Started the round 21
Street "preflop" started. (community card = [])
"Finneas" declared "call:10"
"Zheng" declared "call:10"
"RaphaelPlayer" declared "fold:0"
"SichengZuo" declared "fold:0"
"Yuchun" declared "call:10"
"HakulaPlayer" declared "raise:38"
"Ethan" declared "fold:0"
"YangZ" declared "fold:0"
"Finneas" declared "fold:0"
"Zheng" declared "call:38"
"Yuchun" declared "call:38"
Street "flop" started. (community card = ['D8', 'SK', 'D7'])
"Zheng" declared "call:0"
"Yuchun" declared "call:0"
"HakulaPlayer" declared "call:0"
Street "turn" started. (community card = ['D8', 'SK', 'D7', 'HJ'])
"Zheng" declared "call:0"
"Yuchun" declared "call:0"
"HakulaPlayer" declared "call:0"
Street "river" started. (community card = ['D8', 'SK', 'D7', 'HJ', 'S9'])
"Zheng" declared "call:0"
"Yuchun" declared "call:0"
"HakulaPlayer" declared "call:0"
"['Yuchun']" won the round 21 (stack = {'Zheng': 2271, 'RaphaelPlayer': 915, 'SichengZuo': 955, 'Yuchun': 380, 'HakulaPlayer': 656, 'Ethan': 970, 'YangZ': 960, 'Finneas': 892})
player [Zheng] gets hole card ['D4', 'C9'], current stack 2271
player [RaphaelPlayer] gets hole card ['DK', 'S6'], current stack 915
player [SichengZuo] gets hole card ['HT', 'D7'], current stack 955
player [Yuchun] gets hole card ['HQ', 'CA'], current stack 380
player [HakulaPlayer] gets hole card ['H2', 'S3'], current stack 656
player [Ethan] gets hole card ['DQ', 'H8'], current stack 970
player [YangZ] gets hole card ['S9', 'CJ'], current stack 955
player [Finneas] gets hole card ['HA', 'S5'], current stack 882
Started the round 22
Street "preflop" started. (community card = [])
"Zheng" declared "call:10"
"RaphaelPlayer" declared "call:10"
"SichengZuo" declared "fold:0"
"Yuchun" declared "call:10"
"HakulaPlayer" declared "call:10"
"Ethan" declared "fold:0"
"YangZ" declared "fold:0"
"Finneas" declared "call:10"
Street "flop" started. (community card = ['H7', 'CT', 'H6'])
"Finneas" declared "call:0"
"Zheng" declared "call:0"
"RaphaelPlayer" declared "call:0"
"Yuchun" declared "call:0"
"HakulaPlayer" declared "call:0"
Street "turn" started. (community card = ['H7', 'CT', 'H6', 'SQ'])
"Finneas" declared "call:0"
"Zheng" declared "call:0"
"RaphaelPlayer" declared "call:0"
"Yuchun" declared "call:0"
"HakulaPlayer" declared "call:0"
Street "river" started. (community card = ['H7', 'CT', 'H6', 'SQ', 'D3'])
"Finneas" declared "call:0"
"Zheng" declared "call:0"
"RaphaelPlayer" declared "call:0"
"Yuchun" declared "call:0"
"HakulaPlayer" declared "call:0"
"['Yuchun']" won the round 22 (stack = {'Zheng': 2261, 'RaphaelPlayer': 905, 'SichengZuo': 955, 'Yuchun': 425, 'HakulaPlayer': 646, 'Ethan': 970, 'YangZ': 955, 'Finneas': 882})
player [Zheng] gets hole card ['D2', 'SQ'], current stack 2251
player [RaphaelPlayer] gets hole card ['ST', 'HQ'], current stack 905
player [SichengZuo] gets hole card ['S4', 'D7'], current stack 955
player [Yuchun] gets hole card ['DQ', 'CK'], current stack 425
player [HakulaPlayer] gets hole card ['S2', 'SK'], current stack 646
player [Ethan] gets hole card ['D3', 'D5'], current stack 970
player [YangZ] gets hole card ['C9', 'C2'], current stack 955
player [Finneas] gets hole card ['CT', 'CJ'], current stack 877
Started the round 23
Street "preflop" started. (community card = [])
"RaphaelPlayer" declared "call:10"
"SichengZuo" declared "fold:0"
"Yuchun" declared "call:10"
"HakulaPlayer" declared "call:10"
"Ethan" declared "fold:0"
"YangZ" declared "fold:0"
"Finneas" declared "call:10"
"Zheng" declared "call:10"
Street "flop" started. (community card = ['HK', 'S6', 'C6'])
"Finneas" declared "call:0"
"Zheng" declared "call:0"
"RaphaelPlayer" declared "call:0"
"Yuchun" declared "call:0"
"HakulaPlayer" declared "call:0"
Street "turn" started. (community card = ['HK', 'S6', 'C6', 'H6'])
"Finneas" declared "raise:441"
"Zheng" declared "fold:0"
"RaphaelPlayer" declared "fold:0"
"Yuchun" declared "call:441"
"HakulaPlayer" declared "call:441"
Street "river" started. (community card = ['HK', 'S6', 'C6', 'H6', 'S9'])
"Finneas" declared "raise:220"
"HakulaPlayer" declared "call:220"
"['Yuchun', 'HakulaPlayer']" won the round 23 (stack = {'Zheng': 2251, 'RaphaelPlayer': 895, 'SichengZuo': 955, 'Yuchun': 647, 'HakulaPlayer': 1089, 'Ethan': 970, 'YangZ': 955, 'Finneas': 236})
player [Zheng] gets hole card ['C5', 'C6'], current stack 2246
player [RaphaelPlayer] gets hole card ['C8', 'HT'], current stack 885
player [SichengZuo] gets hole card ['S7', 'S5'], current stack 955
player [Yuchun] gets hole card ['SA', 'H5'], current stack 647
player [HakulaPlayer] gets hole card ['HJ', 'SJ'], current stack 1089
player [Ethan] gets hole card ['HK', 'CJ'], current stack 970
player [YangZ] gets hole card ['S8', 'D2'], current stack 955
player [Finneas] gets hole card ['H4', 'HQ'], current stack 236
Started the round 24
Street "preflop" started. (community card = [])
"SichengZuo" declared "fold:0"
"Yuchun" declared "call:10"
"HakulaPlayer" declared "raise:42"
"Ethan" declared "raise:145"
"YangZ" declared "fold:0"
"Finneas" declared "fold:0"
"Zheng" declared "call:145"
"RaphaelPlayer" declared "call:145"
"Yuchun" declared "call:145"
"HakulaPlayer" declared "call:145"
Street "flop" started. (community card = ['CA', 'D9', 'HA'])
"Zheng" declared "call:0"
"RaphaelPlayer" declared "call:0"
"Yuchun" declared "raise:502"
"HakulaPlayer" declared "call:502"
"Ethan" declared "fold:0"
"Zheng" declared "fold:0"
"RaphaelPlayer" declared "fold:0"
Street "turn" started. (community card = ['CA', 'D9', 'HA', 'DK'])
Street "river" started. (community card = ['CA', 'D9', 'HA', 'DK', 'DJ'])
"['HakulaPlayer']" won the round 24 (stack = {'Zheng': 2106, 'RaphaelPlayer': 750, 'SichengZuo': 955, 'Yuchun': 0, 'HakulaPlayer': 2171, 'Ethan': 825, 'YangZ': 955, 'Finneas': 236})
player [Zheng] gets hole card ['C4', 'DA'], current stack 2106
player [RaphaelPlayer] gets hole card ['H6', 'CQ'], current stack 745
player [SichengZuo] gets hole card ['ST', 'C2'], current stack 945
player [HakulaPlayer] gets hole card ['HT', 'DQ'], current stack 2171
player [Ethan] gets hole card ['CT', 'HJ'], current stack 825
player [YangZ] gets hole card ['S2', 'DJ'], current stack 955
player [Finneas] gets hole card ['SK', 'D2'], current stack 236
Started the round 25
Street "preflop" started. (community card = [])
"HakulaPlayer" declared "call:10"
"Ethan" declared "call:10"
"YangZ" declared "fold:0"
"Finneas" declared "call:10"
"Zheng" declared "call:10"
"RaphaelPlayer" declared "fold:0"
"SichengZuo" declared "fold:0"
Street "flop" started. (community card = ['CK', 'C7', 'S3'])
"HakulaPlayer" declared "call:0"
"Ethan" declared "call:0"
"Finneas" declared "call:0"
"Zheng" declared "call:0"
Street "turn" started. (community card = ['CK', 'C7', 'S3', 'D6'])
"HakulaPlayer" declared "call:0"
"Ethan" declared "call:0"
"Finneas" declared "call:0"
"Zheng" declared "call:0"
Street "river" started. (community card = ['CK', 'C7', 'S3', 'D6', 'C5'])
"HakulaPlayer" declared "call:0"
"Ethan" declared "call:0"
"Finneas" declared "call:0"
"Zheng" declared "raise:1053"
"HakulaPlayer" declared "fold:0"
"Ethan" declared "fold:0"
"Finneas" declared "fold:0"
"['Zheng']" won the round 25 (stack = {'Zheng': 2151, 'RaphaelPlayer': 745, 'SichengZuo': 945, 'Yuchun': 0, 'HakulaPlayer': 2161, 'Ethan': 815, 'YangZ': 955, 'Finneas': 226})
player [Zheng] gets hole card ['D4', 'D3'], current stack 2151
player [RaphaelPlayer] gets hole card ['C7', 'H8'], current stack 745
player [SichengZuo] gets hole card ['D5', 'SK'], current stack 940
player [HakulaPlayer] gets hole card ['CT', 'CK'], current stack 2151
player [Ethan] gets hole card ['DT', 'S8'], current stack 815
player [YangZ] gets hole card ['H3', 'DK'], current stack 955
player [Finneas] gets hole card ['SQ', 'C5'], current stack 226
Started the round 26
Street "preflop" started. (community card = [])
"Ethan" declared "fold:0"
"YangZ" declared "fold:0"
"Finneas" declared "call:10"
"Zheng" declared "call:10"
"RaphaelPlayer" declared "fold:0"
"SichengZuo" declared "fold:0"
"HakulaPlayer" declared "call:10"
Street "flop" started. (community card = ['S5', 'S7', 'ST'])
"HakulaPlayer" declared "call:0"
"Finneas" declared "call:0"
"Zheng" declared "call:0"
Street "turn" started. (community card = ['S5', 'S7', 'ST', 'S3'])
"HakulaPlayer" declared "call:0"
"Finneas" declared "raise:113"
"Zheng" declared "call:113"
"HakulaPlayer" declared "fold:0"
Street "river" started. (community card = ['S5', 'S7', 'ST', 'S3', 'H2'])
"Finneas" declared "raise:56"
"Zheng" declared "call:56"
"['Finneas']" won the round 26 (stack = {'Zheng': 1972, 'RaphaelPlayer': 745, 'SichengZuo': 940, 'Yuchun': 0, 'HakulaPlayer': 2151, 'Ethan': 815, 'YangZ': 955, 'Finneas': 420})
player [Zheng] gets hole card ['H6', 'C4'], current stack 1972
player [RaphaelPlayer] gets hole card ['SJ', 'S3'], current stack 745
player [SichengZuo] gets hole card ['D4', 'HQ'], current stack 940
player [HakulaPlayer] gets hole card ['C6', 'H2'], current stack 2146
player [Ethan] gets hole card ['S8', 'ST'], current stack 805
player [YangZ] gets hole card ['D7', 'S7'], current stack 955
player [Finneas] gets hole card ['D9', 'H8'], current stack 420
Started the round 27
Street "preflop" started. (community card = [])
"YangZ" declared "fold:0"
"Finneas" declared "call:10"
"Zheng" declared "call:10"
"RaphaelPlayer" declared "call:10"
"SichengZuo" declared "fold:0"
"HakulaPlayer" declared "call:10"
"Ethan" declared "fold:0"
Street "flop" started. (community card = ['DQ', 'C8', 'CQ'])
"HakulaPlayer" declared "call:0"
"Finneas" declared "call:0"
"Zheng" declared "call:0"
"RaphaelPlayer" declared "call:0"
Street "turn" started. (community card = ['DQ', 'C8', 'CQ', 'SQ'])
"HakulaPlayer" declared "call:0"
"Finneas" declared "raise:210"
"Zheng" declared "fold:0"
"RaphaelPlayer" declared "fold:0"
"HakulaPlayer" declared "fold:0"
"['Finneas']" won the round 27 (stack = {'Zheng': 1962, 'RaphaelPlayer': 735, 'SichengZuo': 940, 'Yuchun': 0, 'HakulaPlayer': 2141, 'Ethan': 805, 'YangZ': 955, 'Finneas': 460})
player [Zheng] gets hole card ['CT', 'S9'], current stack 1962
player [RaphaelPlayer] gets hole card ['HT', 'D4'], current stack 735
player [SichengZuo] gets hole card ['D3', 'DK'], current stack 940
player [HakulaPlayer] gets hole card ['S7', 'S6'], current stack 2141
player [Ethan] gets hole card ['C5', 'H3'], current stack 800
player [YangZ] gets hole card ['S4', 'D8'], current stack 945
player [Finneas] gets hole card ['C4', 'DA'], current stack 460
Started the round 28
Street "preflop" started. (community card = [])
"Finneas" declared "call:10"
"Zheng" declared "call:10"
"RaphaelPlayer" declared "fold:0"
"SichengZuo" declared "fold:0"
"HakulaPlayer" declared "call:10"
"Ethan" declared "fold:0"
"YangZ" declared "fold:0"
Street "flop" started. (community card = ['DT', 'H9', 'S2'])
"Finneas" declared "call:0"
"Zheng" declared "raise:981"
"HakulaPlayer" declared "fold:0"
"Finneas" declared "fold:0"
"['Zheng']" won the round 28 (stack = {'Zheng': 1997, 'RaphaelPlayer': 735, 'SichengZuo': 940, 'Yuchun': 0, 'HakulaPlayer': 2131, 'Ethan': 800, 'YangZ': 945, 'Finneas': 450})
player [Zheng] gets hole card ['ST', 'HK'], current stack 1997
player [RaphaelPlayer] gets hole card ['DA', 'H9'], current stack 735
player [SichengZuo] gets hole card ['S4', 'DT'], current stack 940
player [HakulaPlayer] gets hole card ['HA', 'DJ'], current stack 2131
player [Ethan] gets hole card ['C8', 'S3'], current stack 800
player [YangZ] gets hole card ['S9', 'D8'], current stack 940
player [Finneas] gets hole card ['HT', 'CJ'], current stack 440
Started the round 29
Street "preflop" started. (community card = [])
"Zheng" declared "call:10"
"RaphaelPlayer" declared "call:10"
"SichengZuo" declared "fold:0"
"HakulaPlayer" declared "raise:36"
"Ethan" declared "fold:0"
"YangZ" declared "fold:0"
"Finneas" declared "fold:0"
"Zheng" declared "call:36"
"RaphaelPlayer" declared "call:36"
Street "flop" started. (community card = ['SJ', 'C5', 'D4'])
"Zheng" declared "call:0"
"RaphaelPlayer" declared "call:0"
"HakulaPlayer" declared "raise:141"
"Zheng" declared "call:141"
"RaphaelPlayer" declared "fold:0"
Street "turn" started. (community card = ['SJ', 'C5', 'D4', 'D7'])
"Zheng" declared "call:0"
"HakulaPlayer" declared "raise:784"
"Zheng" declared "fold:0"
"['HakulaPlayer']" won the round 29 (stack = {'Zheng': 1820, 'RaphaelPlayer': 699, 'SichengZuo': 940, 'Yuchun': 0, 'HakulaPlayer': 2359, 'Ethan': 800, 'YangZ': 940, 'Finneas': 440})
player [Zheng] gets hole card ['CT', 'ST'], current stack 1810
player [RaphaelPlayer] gets hole card ['CQ', 'HT'], current stack 699
player [SichengZuo] gets hole card ['S9', 'CK'], current stack 940
player [HakulaPlayer] gets hole card ['D2', 'SA'], current stack 2359
player [Ethan] gets hole card ['H6', 'C5'], current stack 800
player [YangZ] gets hole card ['C2', 'D3'], current stack 940
player [Finneas] gets hole card ['S2', 'S3'], current stack 435
Started the round 30
Street "preflop" started. (community card = [])
"RaphaelPlayer" declared "call:10"
"SichengZuo" declared "fold:0"
"HakulaPlayer" declared "call:10"
"Ethan" declared "fold:0"
"YangZ" declared "fold:0"
"Finneas" declared "call:10"
"Zheng" declared "call:10"
Street "flop" started. (community card = ['H5', 'C9', 'H9'])
"Finneas" declared "call:0"
"Zheng" declared "call:0"
"RaphaelPlayer" declared "call:0"
"HakulaPlayer" declared "call:0"
Street "turn" started. (community card = ['H5', 'C9', 'H9', 'C6'])
"Finneas" declared "call:0"
"Zheng" declared "call:0"
"RaphaelPlayer" declared "call:0"
"HakulaPlayer" declared "call:0"
Street "river" started. (community card = ['H5', 'C9', 'H9', 'C6', 'D7'])
"Finneas" declared "call:0"
"Zheng" declared "call:0"
"RaphaelPlayer" declared "call:0"
"HakulaPlayer" declared "call:0"
"['Zheng']" won the round 30 (stack = {'Zheng': 1850, 'RaphaelPlayer': 689, 'SichengZuo': 940, 'Yuchun': 0, 'HakulaPlayer': 2349, 'Ethan': 800, 'YangZ': 940, 'Finneas': 430})
player [Zheng] gets hole card ['H3', 'D9'], current stack 1845
player [RaphaelPlayer] gets hole card ['D3', 'CT'], current stack 679
player [SichengZuo] gets hole card ['D2', 'DT'], current stack 940
player [HakulaPlayer] gets hole card ['H2', 'S9'], current stack 2349
player [Ethan] gets hole card ['CA', 'CJ'], current stack 800
player [YangZ] gets hole card ['DJ', 'HK'], current stack 940
player [Finneas] gets hole card ['D4', 'DA'], current stack 430
Started the round 31
Street "preflop" started. (community card = [])
"SichengZuo" declared "fold:0"
"HakulaPlayer" declared "fold:0"
"Ethan" declared "raise:120"
"YangZ" declared "fold:0"
"Finneas" declared "fold:0"
"Zheng" declared "call:120"
"RaphaelPlayer" declared "fold:0"
Street "flop" started. (community card = ['C2', 'S7', 'CQ'])
"Zheng" declared "call:0"
"Ethan" declared "call:0"
Street "turn" started. (community card = ['C2', 'S7', 'CQ', 'H7'])
"Zheng" declared "call:0"
"Ethan" declared "call:0"
Street "river" started. (community card = ['C2', 'S7', 'CQ', 'H7', 'S3'])
"Zheng" declared "call:0"
"Ethan" declared "call:0"
"['Zheng']" won the round 31 (stack = {'Zheng': 1980, 'RaphaelPlayer': 679, 'SichengZuo': 940, 'Yuchun': 0, 'HakulaPlayer': 2349, 'Ethan': 680, 'YangZ': 940, 'Finneas': 430})
player [Zheng] gets hole card ['CJ', 'C4'], current stack 1980
player [RaphaelPlayer] gets hole card ['S3', 'CT'], current stack 674
player [SichengZuo] gets hole card ['H4', 'H5'], current stack 930
player [HakulaPlayer] gets hole card ['S5', 'C8'], current stack 2349
player [Ethan] gets hole card ['D8', 'S9'], current stack 680
player [YangZ] gets hole card ['C9', 'DT'], current stack 940
player [Finneas] gets hole card ['DA', 'H8'], current stack 430
Started the round 32
Street "preflop" started. (community card = [])
"HakulaPlayer" declared "fold:0"
"Ethan" declared "fold:0"
"YangZ" declared "fold:0"
"Finneas" declared "call:10"
"Zheng" declared "call:10"
"RaphaelPlayer" declared "fold:0"
"SichengZuo" declared "fold:0"
Street "flop" started. (community card = ['D9', 'C5', 'CQ'])
"Finneas" declared "call:0"
"Zheng" declared "call:0"
Street "turn" started. (community card = ['D9', 'C5', 'CQ', 'ST'])
"Finneas" declared "call:0"
"Zheng" declared "call:0"
Street "river" started. (community card = ['D9', 'C5', 'CQ', 'ST', 'HQ'])
"Finneas" declared "call:0"
"Zheng" declared "call:0"
"['Finneas']" won the round 32 (stack = {'Zheng': 1970, 'RaphaelPlayer': 674, 'SichengZuo': 930, 'Yuchun': 0, 'HakulaPlayer': 2349, 'Ethan': 680, 'YangZ': 940, 'Finneas': 455})
player [Zheng] gets hole card ['SQ', 'CT'], current stack 1970
player [RaphaelPlayer] gets hole card ['C4', 'CK'], current stack 674
player [SichengZuo] gets hole card ['SJ', 'C6'], current stack 925
player [HakulaPlayer] gets hole card ['D2', 'D9'], current stack 2339
player [Ethan] gets hole card ['S5', 'S9'], current stack 680
player [YangZ] gets hole card ['D8', 'H2'], current stack 940
player [Finneas] gets hole card ['C5', 'D4'], current stack 455
Started the round 33
Street "preflop" started. (community card = [])
"Ethan" declared "fold:0"
"YangZ" declared "fold:0"
"Finneas" declared "call:10"
"Zheng" declared "call:10"
"RaphaelPlayer" declared "call:10"
"SichengZuo" declared "fold:0"
"HakulaPlayer" declared "call:10"
Street "flop" started. (community card = ['C2', 'H3', 'C8'])
"HakulaPlayer" declared "call:0"
"Finneas" declared "call:0"
"Zheng" declared "call:0"
"RaphaelPlayer" declared "call:0"
Street "turn" started. (community card = ['C2', 'H3', 'C8', 'S3'])
"HakulaPlayer" declared "call:0"
"Finneas" declared "call:0"
"Zheng" declared "call:0"
"RaphaelPlayer" declared "call:0"
Street "river" started. (community card = ['C2', 'H3', 'C8', 'S3', 'HQ'])
"HakulaPlayer" declared "call:0"
"Finneas" declared "call:0"
"Zheng" declared "call:0"
"RaphaelPlayer" declared "call:0"
"['Zheng']" won the round 33 (stack = {'Zheng': 2005, 'RaphaelPlayer': 664, 'SichengZuo': 925, 'Yuchun': 0, 'HakulaPlayer': 2339, 'Ethan': 680, 'YangZ': 940, 'Finneas': 445})
player [Zheng] gets hole card ['S5', 'S2'], current stack 2005
player [RaphaelPlayer] gets hole card ['D5', 'C5'], current stack 664
player [SichengZuo] gets hole card ['CQ', 'D8'], current stack 925
player [HakulaPlayer] gets hole card ['SQ', 'SA'], current stack 2334
player [Ethan] gets hole card ['HJ', 'D7'], current stack 670
player [YangZ] gets hole card ['CJ', 'DK'], current stack 940
player [Finneas] gets hole card ['S3', 'D2'], current stack 445
Started the round 34
Street "preflop" started. (community card = [])
"YangZ" declared "fold:0"
"Finneas" declared "call:10"
"Zheng" declared "call:10"
"RaphaelPlayer" declared "raise:30"
"SichengZuo" declared "fold:0"
"HakulaPlayer" declared "call:30"
"Ethan" declared "fold:0"
"Finneas" declared "fold:0"
"Zheng" declared "call:30"
Street "flop" started. (community card = ['S8', 'HK', 'CA'])
"HakulaPlayer" declared "raise:146"
"Zheng" declared "call:146"
"RaphaelPlayer" declared "fold:0"
Street "turn" started. (community card = ['S8', 'HK', 'CA', 'DJ'])
"HakulaPlayer" declared "raise:898"
"Zheng" declared "fold:0"
"['HakulaPlayer']" won the round 34 (stack = {'Zheng': 1829, 'RaphaelPlayer': 634, 'SichengZuo': 925, 'Yuchun': 0, 'HakulaPlayer': 2565, 'Ethan': 670, 'YangZ': 940, 'Finneas': 435})
player [Zheng] gets hole card ['ST', 'SQ'], current stack 1829
player [RaphaelPlayer] gets hole card ['S9', 'HK'], current stack 634
player [SichengZuo] gets hole card ['S8', 'SJ'], current stack 925
player [HakulaPlayer] gets hole card ['H9', 'C2'], current stack 2565
player [Ethan] gets hole card ['DQ', 'H2'], current stack 665
player [YangZ] gets hole card ['D9', 'CA'], current stack 930
player [Finneas] gets hole card ['C8', 'D4'], current stack 435
Started the round 35
Street "preflop" started. (community card = [])
"Finneas" declared "call:10"
"Zheng" declared "call:10"
"RaphaelPlayer" declared "call:10"
"SichengZuo" declared "fold:0"
"HakulaPlayer" declared "call:10"
"Ethan" declared "fold:0"
"YangZ" declared "fold:0"
Street "flop" started. (community card = ['DA', 'CT', 'C9'])
"Finneas" declared "call:0"
"Zheng" declared "call:0"
"RaphaelPlayer" declared "call:0"
"HakulaPlayer" declared "call:0"
Street "turn" started. (community card = ['DA', 'CT', 'C9', 'H5'])
"Finneas" declared "call:0"
"Zheng" declared "call:0"
"RaphaelPlayer" declared "call:0"
"HakulaPlayer" declared "call:0"
Street "river" started. (community card = ['DA', 'CT', 'C9', 'H5', 'C5'])
"Finneas" declared "call:0"
"Zheng" declared "call:0"
"RaphaelPlayer" declared "call:0"
"HakulaPlayer" declared "call:0"
"['Zheng']" won the round 35 (stack = {'Zheng': 1874, 'RaphaelPlayer': 624, 'SichengZuo': 925, 'Yuchun': 0, 'HakulaPlayer': 2555, 'Ethan': 665, 'YangZ': 930, 'Finneas': 425})
player [Zheng] gets hole card ['CK', 'S3'], current stack 1874
player [RaphaelPlayer] gets hole card ['C8', 'H9'], current stack 624
player [SichengZuo] gets hole card ['C9', 'H4'], current stack 925
player [HakulaPlayer] gets hole card ['S9', 'H5'], current stack 2555
player [Ethan] gets hole card ['S2', 'D6'], current stack 665
player [YangZ] gets hole card ['SQ', 'ST'], current stack 925
player [Finneas] gets hole card ['HQ', 'D7'], current stack 415
Started the round 36
Street "preflop" started. (community card = [])
"Zheng" declared "call:10"
"RaphaelPlayer" declared "fold:0"
"SichengZuo" declared "fold:0"
"HakulaPlayer" declared "call:10"
"Ethan" declared "fold:0"
"YangZ" declared "fold:0"
"Finneas" declared "call:10"
Street "flop" started. (community card = ['DA', 'C4', 'C2'])
"Finneas" declared "call:0"
"Zheng" declared "call:0"
"HakulaPlayer" declared "call:0"
Street "turn" started. (community card = ['DA', 'C4', 'C2', 'HT'])
"Finneas" declared "call:0"
"Zheng" declared "call:0"
"HakulaPlayer" declared "call:0"
Street "river" started. (community card = ['DA', 'C4', 'C2', 'HT', 'SA'])
"Finneas" declared "call:0"
"Zheng" declared "call:0"
"HakulaPlayer" declared "call:0"
"['Zheng']" won the round 36 (stack = {'Zheng': 1899, 'RaphaelPlayer': 624, 'SichengZuo': 925, 'Yuchun': 0, 'HakulaPlayer': 2545, 'Ethan': 665, 'YangZ': 925, 'Finneas': 415})
player [Zheng] gets hole card ['D5', 'H8'], current stack 1889
player [RaphaelPlayer] gets hole card ['S6', 'CK'], current stack 624
player [SichengZuo] gets hole card ['S4', 'H5'], current stack 925
player [HakulaPlayer] gets hole card ['H7', 'S5'], current stack 2545
player [Ethan] gets hole card ['DJ', 'D2'], current stack 665
player [YangZ] gets hole card ['D9', 'HK'], current stack 925
player [Finneas] gets hole card ['CA', 'C5'], current stack 410
Started the round 37
Street "preflop" started. (community card = [])
"RaphaelPlayer" declared "call:10"
"SichengZuo" declared "fold:0"
"HakulaPlayer" declared "call:10"
"Ethan" declared "fold:0"
"YangZ" declared "fold:0"
"Finneas" declared "call:10"
"Zheng" declared "call:10"
Street "flop" started. (community card = ['D8', 'C7', 'DT'])
"Finneas" declared "call:0"
"Zheng" declared "call:0"
"RaphaelPlayer" declared "call:0"
"HakulaPlayer" declared "call:0"
Street "turn" started. (community card = ['D8', 'C7', 'DT', 'H3'])
"Finneas" declared "call:0"
"Zheng" declared "call:0"
"RaphaelPlayer" declared "call:0"
"HakulaPlayer" declared "call:0"
Street "river" started. (community card = ['D8', 'C7', 'DT', 'H3', 'D4'])
"Finneas" declared "call:0"
"Zheng" declared "call:0"
"RaphaelPlayer" declared "call:0"
"HakulaPlayer" declared "call:0"
"['Zheng']" won the round 37 (stack = {'Zheng': 1929, 'RaphaelPlayer': 614, 'SichengZuo': 925, 'Yuchun': 0, 'HakulaPlayer': 2535, 'Ethan': 665, 'YangZ': 925, 'Finneas': 405})
player [Zheng] gets hole card ['HT', 'CQ'], current stack 1924
player [RaphaelPlayer] gets hole card ['D5', 'D4'], current stack 604
player [SichengZuo] gets hole card ['C8', 'CT'], current stack 925
player [HakulaPlayer] gets hole card ['H7', 'CA'], current stack 2535
player [Ethan] gets hole card ['D9', 'DT'], current stack 665
player [YangZ] gets hole card ['DJ', 'DQ'], current stack 925
player [Finneas] gets hole card ['D2', 'H8'], current stack 405
Started the round 38
Street "preflop" started. (community card = [])
"SichengZuo" declared "fold:0"
"HakulaPlayer" declared "call:10"
"Ethan" declared "fold:0"
"YangZ" declared "fold:0"
"Finneas" declared "call:10"
"Zheng" declared "call:10"
"RaphaelPlayer" declared "fold:0"
Street "flop" started. (community card = ['HQ', 'C5', 'SQ'])
"Zheng" declared "raise:1919"
"HakulaPlayer" declared "fold:0"
"Finneas" declared "fold:0"
"['Zheng']" won the round 38 (stack = {'Zheng': 1959, 'RaphaelPlayer': 604, 'SichengZuo': 925, 'Yuchun': 0, 'HakulaPlayer': 2525, 'Ethan': 665, 'YangZ': 925, 'Finneas': 395})
player [Zheng] gets hole card ['D4', 'C7'], current stack 1959
player [RaphaelPlayer] gets hole card ['DT', 'SJ'], current stack 599
player [SichengZuo] gets hole card ['C5', 'HK'], current stack 915
player [HakulaPlayer] gets hole card ['H6', 'HQ'], current stack 2525
player [Ethan] gets hole card ['H3', 'S4'], current stack 665
player [YangZ] gets hole card ['C2', 'D7'], current stack 925
player [Finneas] gets hole card ['DA', 'S9'], current stack 395
Started the round 39
Street "preflop" started. (community card = [])
"HakulaPlayer" declared "fold:0"
"Ethan" declared "fold:0"
"YangZ" declared "fold:0"
"Finneas" declared "call:10"
"Zheng" declared "call:10"
"RaphaelPlayer" declared "call:10"
"SichengZuo" declared "fold:0"
Street "flop" started. (community card = ['SK', 'D8', 'D3'])
"RaphaelPlayer" declared "call:0"
"Finneas" declared "call:0"
"Zheng" declared "call:0"
Street "turn" started. (community card = ['SK', 'D8', 'D3', 'S5'])
"RaphaelPlayer" declared "call:0"
"Finneas" declared "call:0"
"Zheng" declared "call:0"
Street "river" started. (community card = ['SK', 'D8', 'D3', 'S5', 'S3'])
"RaphaelPlayer" declared "call:0"
"Finneas" declared "call:0"
"Zheng" declared "call:0"
"['Finneas']" won the round 39 (stack = {'Zheng': 1949, 'RaphaelPlayer': 594, 'SichengZuo': 915, 'Yuchun': 0, 'HakulaPlayer': 2525, 'Ethan': 665, 'YangZ': 925, 'Finneas': 425})
player [Zheng] gets hole card ['C3', 'C5'], current stack 1949
player [RaphaelPlayer] gets hole card ['C9', 'HJ'], current stack 594
player [SichengZuo] gets hole card ['CQ', 'S8'], current stack 910
player [HakulaPlayer] gets hole card ['SA', 'D5'], current stack 2515
player [Ethan] gets hole card ['C6', 'DQ'], current stack 665
player [YangZ] gets hole card ['CA', 'C8'], current stack 925
player [Finneas] gets hole card ['SK', 'HQ'], current stack 425
Started the round 40
Street "preflop" started. (community card = [])
"Ethan" declared "fold:0"
"YangZ" declared "fold:0"
"Finneas" declared "call:10"
"Zheng" declared "call:10"
"RaphaelPlayer" declared "call:10"
"SichengZuo" declared "fold:0"
"HakulaPlayer" declared "call:10"
Street "flop" started. (community card = ['C2', 'CT', 'S7'])
"HakulaPlayer" declared "call:0"
"Finneas" declared "call:0"
"Zheng" declared "call:0"
"RaphaelPlayer" declared "call:0"
Street "turn" started. (community card = ['C2', 'CT', 'S7', 'D7'])
"HakulaPlayer" declared "call:0"
"Finneas" declared "call:0"
"Zheng" declared "call:0"
"RaphaelPlayer" declared "call:0"
Street "river" started. (community card = ['C2', 'CT', 'S7', 'D7', 'H7'])
"HakulaPlayer" declared "call:0"
"Finneas" declared "raise:212"
"Zheng" declared "fold:0"
"RaphaelPlayer" declared "fold:0"
"HakulaPlayer" declared "fold:0"
"['Finneas']" won the round 40 (stack = {'Zheng': 1939, 'RaphaelPlayer': 584, 'SichengZuo': 910, 'Yuchun': 0, 'HakulaPlayer': 2515, 'Ethan': 665, 'YangZ': 925, 'Finneas': 460})
player [Zheng] gets hole card ['HA', 'HJ'], current stack 1939
player [RaphaelPlayer] gets hole card ['D7', 'D3'], current stack 584
player [SichengZuo] gets hole card ['H7', 'D5'], current stack 910
player [HakulaPlayer] gets hole card ['H9', 'CQ'], current stack 2510
player [Ethan] gets hole card ['CJ', 'DQ'], current stack 655
player [YangZ] gets hole card ['H4', 'S5'], current stack 925
player [Finneas] gets hole card ['C7', 'SJ'], current stack 460
Started the round 41
Street "preflop" started. (community card = [])
"YangZ" declared "fold:0"
"Finneas" declared "call:10"
"Zheng" declared "call:10"
"RaphaelPlayer" declared "fold:0"
"SichengZuo" declared "fold:0"
"HakulaPlayer" declared "call:10"
"Ethan" declared "raise:99"
"Finneas" declared "fold:0"
"Zheng" declared "call:99"
"HakulaPlayer" declared "fold:0"
Street "flop" started. (community card = ['SA', 'H5', 'HT'])
"Ethan" declared "call:0"
"Zheng" declared "raise:925"
"Ethan" declared "fold:0"
"['Zheng']" won the round 41 (stack = {'Zheng': 2058, 'RaphaelPlayer': 584, 'SichengZuo': 910, 'Yuchun': 0, 'HakulaPlayer': 2505, 'Ethan': 566, 'YangZ': 925, 'Finneas': 450})
player [Zheng] gets hole card ['D5', 'S8'], current stack 2058
player [RaphaelPlayer] gets hole card ['HA', 'D4'], current stack 584
player [SichengZuo] gets hole card ['DJ', 'S5'], current stack 910
player [HakulaPlayer] gets hole card ['H3', 'D7'], current stack 2505
player [Ethan] gets hole card ['SQ', 'CA'], current stack 561
player [YangZ] gets hole card ['C6', 'H7'], current stack 915
player [Finneas] gets hole card ['HK', 'D2'], current stack 450
Started the round 42
Street "preflop" started. (community card = [])
"Finneas" declared "call:10"
"Zheng" declared "call:10"
"RaphaelPlayer" declared "call:10"
"SichengZuo" declared "fold:0"
"HakulaPlayer" declared "call:10"
"Ethan" declared "raise:84"
"YangZ" declared "fold:0"
"Finneas" declared "fold:0"
"Zheng" declared "call:84"
"RaphaelPlayer" declared "call:84"
"HakulaPlayer" declared "fold:0"
Street "flop" started. (community card = ['HJ', 'S2', 'S9'])
"Ethan" declared "call:0"
"Zheng" declared "call:0"
"RaphaelPlayer" declared "call:0"
Street "turn" started. (community card = ['HJ', 'S2', 'S9', 'C5'])
"Ethan" declared "call:0"
"Zheng" declared "call:0"
"RaphaelPlayer" declared "call:0"
Street "river" started. (community card = ['HJ', 'S2', 'S9', 'C5', 'C4'])
"Ethan" declared "call:0"
"Zheng" declared "call:0"
"RaphaelPlayer" declared "call:0"
"['Zheng']" won the round 42 (stack = {'Zheng': 2256, 'RaphaelPlayer': 500, 'SichengZuo': 910, 'Yuchun': 0, 'HakulaPlayer': 2495, 'Ethan': 482, 'YangZ': 915, 'Finneas': 440})
player [Zheng] gets hole card ['S9', 'CA'], current stack 2256
player [RaphaelPlayer] gets hole card ['S4', 'C9'], current stack 500
player [SichengZuo] gets hole card ['DJ', 'HJ'], current stack 910
player [HakulaPlayer] gets hole card ['DA', 'C2'], current stack 2495
player [Ethan] gets hole card ['HK', 'DQ'], current stack 482
player [YangZ] gets hole card ['S8', 'SJ'], current stack 910
player [Finneas] gets hole card ['H8', 'C6'], current stack 430
Started the round 43
Street "preflop" started. (community card = [])
"Zheng" declared "call:10"
"RaphaelPlayer" declared "fold:0"
"SichengZuo" declared "fold:0"
"HakulaPlayer" declared "call:10"
"Ethan" declared "raise:72"
"YangZ" declared "fold:0"
"Finneas" declared "fold:0"
"Zheng" declared "call:72"
"HakulaPlayer" declared "call:72"
Street "flop" started. (community card = ['D3', 'D5', 'C4'])
"Zheng" declared "call:0"
"HakulaPlayer" declared "raise:423"
"Ethan" declared "fold:0"
"Zheng" declared "fold:0"
"['HakulaPlayer']" won the round 43 (stack = {'Zheng': 2184, 'RaphaelPlayer': 500, 'SichengZuo': 910, 'Yuchun': 0, 'HakulaPlayer': 2654, 'Ethan': 410, 'YangZ': 910, 'Finneas': 430})
player [Zheng] gets hole card ['H8', 'DJ'], current stack 2174
player [RaphaelPlayer] gets hole card ['H6', 'DK'], current stack 500
player [SichengZuo] gets hole card ['H7', 'CQ'], current stack 910
player [HakulaPlayer] gets hole card ['H4', 'C4'], current stack 2654
player [Ethan] gets hole card ['H5', 'ST'], current stack 410
player [YangZ] gets hole card ['DA', 'C3'], current stack 910
player [Finneas] gets hole card ['HA', 'S2'], current stack 425
Started the round 44
Street "preflop" started. (community card = [])
"RaphaelPlayer" declared "fold:0"
"SichengZuo" declared "fold:0"
"HakulaPlayer" declared "call:10"
"Ethan" declared "fold:0"
"YangZ" declared "fold:0"
"Finneas" declared "call:10"
"Zheng" declared "call:10"
Street "flop" started. (community card = ['D8', 'C6', 'S8'])
"Finneas" declared "call:0"
"Zheng" declared "raise:1092"
"HakulaPlayer" declared "fold:0"
"Finneas" declared "fold:0"
"['Zheng']" won the round 44 (stack = {'Zheng': 2204, 'RaphaelPlayer': 500, 'SichengZuo': 910, 'Yuchun': 0, 'HakulaPlayer': 2644, 'Ethan': 410, 'YangZ': 910, 'Finneas': 420})
player [Zheng] gets hole card ['D4', 'S6'], current stack 2199
player [RaphaelPlayer] gets hole card ['C7', 'SA'], current stack 490
player [SichengZuo] gets hole card ['HA', 'DA'], current stack 910
player [HakulaPlayer] gets hole card ['S8', 'H5'], current stack 2644
player [Ethan] gets hole card ['H2', 'D9'], current stack 410
player [YangZ] gets hole card ['ST', 'D8'], current stack 910
player [Finneas] gets hole card ['CK', 'H9'], current stack 420
Started the round 45
Street "preflop" started. (community card = [])
"SichengZuo" declared "raise:910"
"HakulaPlayer" declared "fold:0"
"Ethan" declared "fold:0"
"YangZ" declared "fold:0"
"Finneas" declared "fold:0"
"Zheng" declared "fold:0"
"RaphaelPlayer" declared "fold:0"
"['SichengZuo']" won the round 45 (stack = {'Zheng': 2199, 'RaphaelPlayer': 490, 'SichengZuo': 925, 'Yuchun': 0, 'HakulaPlayer': 2644, 'Ethan': 410, 'YangZ': 910, 'Finneas': 420})
player [Zheng] gets hole card ['D9', 'CK'], current stack 2199
player [RaphaelPlayer] gets hole card ['C5', 'C4'], current stack 485
player [SichengZuo] gets hole card ['SJ', 'DA'], current stack 915
player [HakulaPlayer] gets hole card ['D3', 'CA'], current stack 2644
player [Ethan] gets hole card ['H3', 'H2'], current stack 410
player [YangZ] gets hole card ['DJ', 'S5'], current stack 910
player [Finneas] gets hole card ['H6', 'H4'], current stack 420
Started the round 46
Street "preflop" started. (community card = [])
"HakulaPlayer" declared "fold:0"
"Ethan" declared "fold:0"
"YangZ" declared "fold:0"
"Finneas" declared "call:10"
"Zheng" declared "call:10"
"RaphaelPlayer" declared "fold:0"
"SichengZuo" declared "fold:0"
Street "flop" started. (community card = ['D8', 'DT', 'SK'])
"Finneas" declared "call:0"
"Zheng" declared "raise:1099"
"Finneas" declared "fold:0"
"['Zheng']" won the round 46 (stack = {'Zheng': 2224, 'RaphaelPlayer': 485, 'SichengZuo': 915, 'Yuchun': 0, 'HakulaPlayer': 2644, 'Ethan': 410, 'YangZ': 910, 'Finneas': 410})
player [Zheng] gets hole card ['DJ', 'HJ'], current stack 2224
player [RaphaelPlayer] gets hole card ['C2', 'D4'], current stack 485
player [SichengZuo] gets hole card ['C5', 'H7'], current stack 910
player [HakulaPlayer] gets hole card ['D3', 'S3'], current stack 2634
player [Ethan] gets hole card ['SK', 'C9'], current stack 410
player [YangZ] gets hole card ['D6', 'CA'], current stack 910
player [Finneas] gets hole card ['DK', 'H3'], current stack 410
Started the round 47
Street "preflop" started. (community card = [])
"Ethan" declared "fold:0"
"YangZ" declared "fold:0"
"Finneas" declared "call:10"
"Zheng" declared "call:10"
"RaphaelPlayer" declared "fold:0"
"SichengZuo" declared "fold:0"
"HakulaPlayer" declared "call:10"
Street "flop" started. (community card = ['D7', 'D5', 'H9'])
"HakulaPlayer" declared "call:0"
"Finneas" declared "call:0"
"Zheng" declared "call:0"
Street "turn" started. (community card = ['D7', 'D5', 'H9', 'H5'])
"HakulaPlayer" declared "call:0"
"Finneas" declared "call:0"
"Zheng" declared "call:0"
Street "river" started. (community card = ['D7', 'D5', 'H9', 'H5', 'CT'])
"HakulaPlayer" declared "call:0"
"Finneas" declared "call:0"
"Zheng" declared "call:0"
"['Zheng']" won the round 47 (stack = {'Zheng': 2249, 'RaphaelPlayer': 485, 'SichengZuo': 910, 'Yuchun': 0, 'HakulaPlayer': 2634, 'Ethan': 410, 'YangZ': 910, 'Finneas': 400})
player [Zheng] gets hole card ['HK', 'CA'], current stack 2249
player [RaphaelPlayer] gets hole card ['CJ', 'C7'], current stack 485
player [SichengZuo] gets hole card ['HT', 'H2'], current stack 910
player [HakulaPlayer] gets hole card ['D5', 'DQ'], current stack 2629
player [Ethan] gets hole card ['DJ', 'SQ'], current stack 400
player [YangZ] gets hole card ['DK', 'D7'], current stack 910
player [Finneas] gets hole card ['CT', 'S2'], current stack 400
Started the round 48
Street "preflop" started. (community card = [])
"YangZ" declared "fold:0"
"Finneas" declared "call:10"
"Zheng" declared "call:10"
"RaphaelPlayer" declared "call:10"
"SichengZuo" declared "fold:0"
"HakulaPlayer" declared "call:10"
"Ethan" declared "raise:61"
"Finneas" declared "fold:0"
"Zheng" declared "call:61"
"RaphaelPlayer" declared "call:61"
"HakulaPlayer" declared "fold:0"
Street "flop" started. (community card = ['D3', 'S3', 'S6'])
"Ethan" declared "call:0"
"Zheng" declared "call:0"
"RaphaelPlayer" declared "call:0"
Street "turn" started. (community card = ['D3', 'S3', 'S6', 'DT'])
"Ethan" declared "call:0"
"Zheng" declared "call:0"
"RaphaelPlayer" declared "call:0"
Street "river" started. (community card = ['D3', 'S3', 'S6', 'DT', 'DA'])
"Ethan" declared "call:0"
"Zheng" declared "call:0"
"RaphaelPlayer" declared "call:0"
"['Zheng']" won the round 48 (stack = {'Zheng': 2391, 'RaphaelPlayer': 424, 'SichengZuo': 910, 'Yuchun': 0, 'HakulaPlayer': 2624, 'Ethan': 349, 'YangZ': 910, 'Finneas': 390})
player [Zheng] gets hole card ['CQ', 'CT'], current stack 2391
player [RaphaelPlayer] gets hole card ['D7', 'S7'], current stack 424
player [SichengZuo] gets hole card ['S3', 'S8'], current stack 910
player [HakulaPlayer] gets hole card ['H6', 'CK'], current stack 2624
player [Ethan] gets hole card ['HK', 'CA'], current stack 344
player [YangZ] gets hole card ['D4', 'D9'], current stack 900
player [Finneas] gets hole card ['H3', 'C2'], current stack 390
Started the round 49
Street "preflop" started. (community card = [])
"Finneas" declared "call:10"
"Zheng" declared "call:10"
"RaphaelPlayer" declared "raise:30"
"SichengZuo" declared "fold:0"
"HakulaPlayer" declared "call:30"
"Ethan" declared "raise:142"
"YangZ" declared "fold:0"
"Finneas" declared "fold:0"
"Zheng" declared "call:142"
"RaphaelPlayer" declared "call:142"
"HakulaPlayer" declared "fold:0"
Street "flop" started. (community card = ['DT', 'DQ', 'D6'])
"Ethan" declared "call:0"
"Zheng" declared "call:0"
"RaphaelPlayer" declared "raise:282"
"Ethan" declared "fold:0"
"Zheng" declared "fold:0"
"['RaphaelPlayer']" won the round 49 (stack = {'Zheng': 2249, 'RaphaelPlayer': 758, 'SichengZuo': 910, 'Yuchun': 0, 'HakulaPlayer': 2594, 'Ethan': 207, 'YangZ': 900, 'Finneas': 380})
player [Zheng] gets hole card ['D7', 'H9'], current stack 2249
player [RaphaelPlayer] gets hole card ['D3', 'CQ'], current stack 758
player [SichengZuo] gets hole card ['H7', 'C3'], current stack 910
player [HakulaPlayer] gets hole card ['SQ', 'H4'], current stack 2594
player [Ethan] gets hole card ['HT', 'H2'], current stack 207
player [YangZ] gets hole card ['CK', 'HA'], current stack 895
player [Finneas] gets hole card ['C6', 'D6'], current stack 370
Started the round 50
Street "preflop" started. (community card = [])
"Zheng" declared "call:10"
"RaphaelPlayer" declared "fold:0"
"SichengZuo" declared "fold:0"
"HakulaPlayer" declared "call:10"
"Ethan" declared "fold:0"
"YangZ" declared "fold:0"
"Finneas" declared "call:10"
Street "flop" started. (community card = ['HQ', 'DT', 'S8'])
"Finneas" declared "call:0"
"Zheng" declared "call:0"
"HakulaPlayer" declared "call:0"
Street "turn" started. (community card = ['HQ', 'DT', 'S8', 'S2'])
"Finneas" declared "call:0"
"Zheng" declared "call:0"
"HakulaPlayer" declared "raise:57"
"Finneas" declared "fold:0"
"Zheng" declared "call:57"
Street "river" started. (community card = ['HQ', 'DT', 'S8', 'S2', 'H5'])
"Zheng" declared "call:0"
"HakulaPlayer" declared "raise:367"
"Zheng" declared "fold:0"
"['HakulaPlayer']" won the round 50 (stack = {'Zheng': 2182, 'RaphaelPlayer': 758, 'SichengZuo': 910, 'Yuchun': 0, 'HakulaPlayer': 2676, 'Ethan': 207, 'YangZ': 895, 'Finneas': 370})

Game Results:
------------------------------------------------------------
Game 1:
Winner: HakulaPlayer (stack: 2676)
All players' stacks:
  Zheng: 2182
  RaphaelPlayer: 758
  SichengZuo: 910
  Yuchun: 0
  HakulaPlayer: 2676
  Ethan: 207
  YangZ: 895
  Finneas: 370
------------------------------------------------------------
