player [Zheng] gets hole card ['ST', 'HK'], current stack 1000
player [RaphaelPlayer] gets hole card ['H9', 'HQ'], current stack 995
player [SichengZuo] gets hole card ['H8', 'D3'], current stack 990
player [Yuchun] gets hole card ['H3', 'C6'], current stack 1000
player [HakulaPlayer] gets hole card ['DA', 'S6'], current stack 1000
player [Ethan] gets hole card ['S5', 'S3'], current stack 1000
player [YangZ] gets hole card ['HT', 'D2'], current stack 1000
player [Finneas] gets hole card ['CQ', 'D7'], current stack 1000
Started the round 1
Street "preflop" started. (community card = [])
"Yuchun" declared "fold:0"
"HakulaPlayer" declared "fold:0"
"Ethan" declared "fold:0"
"YangZ" declared "fold:0"
"Finneas" declared "call:10"
"Zheng" declared "call:10"
"RaphaelPlayer" declared "call:10"
"SichengZuo" declared "fold:0"
Street "flop" started. (community card = ['DT', 'CT', 'H2'])
"RaphaelPlayer" declared "call:0"
"Finneas" declared "call:0"
"Zheng" declared "raise:990"
"RaphaelPlayer" declared "fold:0"
"Finneas" declared "fold:0"
"['Zheng']" won the round 1 (stack = {'Zheng': 1030, 'RaphaelPlayer': 990, 'SichengZuo': 990, 'Yuchun': 1000, 'HakulaPlayer': 1000, 'Ethan': 1000, 'YangZ': 1000, 'Finneas': 990})
player [Zheng] gets hole card ['S4', 'D9'], current stack 1030
player [RaphaelPlayer] gets hole card ['CA', 'C6'], current stack 990
player [SichengZuo] gets hole card ['H5', 'SQ'], current stack 985
player [Yuchun] gets hole card ['HK', 'CK'], current stack 990
player [HakulaPlayer] gets hole card ['H2', 'CT'], current stack 1000
player [Ethan] gets hole card ['D6', 'D5'], current stack 1000
player [YangZ] gets hole card ['S3', 'C7'], current stack 1000
player [Finneas] gets hole card ['S6', 'H9'], current stack 990
Started the round 2
Street "preflop" started. (community card = [])
"HakulaPlayer" declared "fold:0"
"Ethan" declared "fold:0"
"YangZ" declared "fold:0"
"Finneas" declared "call:10"
"Zheng" declared "call:10"
"RaphaelPlayer" declared "call:10"
"SichengZuo" declared "fold:0"
"Yuchun" declared "call:10"
Street "flop" started. (community card = ['HQ', 'S7', 'DJ'])
"Yuchun" declared "call:0"
"Finneas" declared "call:0"
"Zheng" declared "call:0"
"RaphaelPlayer" declared "call:0"
Street "turn" started. (community card = ['HQ', 'S7', 'DJ', 'H6'])
"Yuchun" declared "call:0"
"Finneas" declared "call:0"
"Zheng" declared "call:0"
"RaphaelPlayer" declared "call:0"
Street "river" started. (community card = ['HQ', 'S7', 'DJ', 'H6', 'SA'])
"Yuchun" declared "call:0"
"Finneas" declared "call:0"
"Zheng" declared "call:0"
"RaphaelPlayer" declared "raise:55"
"Yuchun" declared "fold:0"
"Finneas" declared "fold:0"
"Zheng" declared "fold:0"
"['RaphaelPlayer']" won the round 2 (stack = {'Zheng': 1020, 'RaphaelPlayer': 1025, 'SichengZuo': 985, 'Yuchun': 990, 'HakulaPlayer': 1000, 'Ethan': 1000, 'YangZ': 1000, 'Finneas': 980})
player [Zheng] gets hole card ['H7', 'D8'], current stack 1020
player [RaphaelPlayer] gets hole card ['C4', 'HJ'], current stack 1025
player [SichengZuo] gets hole card ['C5', 'H2'], current stack 985
player [Yuchun] gets hole card ['S4', 'C8'], current stack 985
player [HakulaPlayer] gets hole card ['H9', 'H3'], current stack 990
player [Ethan] gets hole card ['CK', 'H5'], current stack 1000
player [YangZ] gets hole card ['S3', 'S2'], current stack 1000
player [Finneas] gets hole card ['H8', 'H4'], current stack 980
Started the round 3
Street "preflop" started. (community card = [])
"Ethan" declared "fold:0"
"YangZ" declared "fold:0"
"Finneas" declared "call:10"
"Zheng" declared "call:10"
"RaphaelPlayer" declared "fold:0"
"SichengZuo" declared "fold:0"
"Yuchun" declared "fold:0"
"HakulaPlayer" declared "call:10"
Street "flop" started. (community card = ['C9', 'ST', 'C3'])
"HakulaPlayer" declared "raise:34"
"Finneas" declared "fold:0"
"Zheng" declared "fold:0"
"['HakulaPlayer']" won the round 3 (stack = {'Zheng': 1010, 'RaphaelPlayer': 1025, 'SichengZuo': 985, 'Yuchun': 985, 'HakulaPlayer': 1025, 'Ethan': 1000, 'YangZ': 1000, 'Finneas': 970})
player [Zheng] gets hole card ['CK', 'SQ'], current stack 1010
player [RaphaelPlayer] gets hole card ['SK', 'HQ'], current stack 1025
player [SichengZuo] gets hole card ['DJ', 'C8'], current stack 985
player [Yuchun] gets hole card ['DA', 'D7'], current stack 985
player [HakulaPlayer] gets hole card ['HA', 'D6'], current stack 1020
player [Ethan] gets hole card ['DQ', 'H5'], current stack 990
player [YangZ] gets hole card ['SJ', 'H7'], current stack 1000
player [Finneas] gets hole card ['H6', 'D4'], current stack 970
Started the round 4
Street "preflop" started. (community card = [])
"YangZ" declared "fold:0"
"Finneas" declared "call:10"
"Zheng" declared "call:10"
"RaphaelPlayer" declared "call:10"
"SichengZuo" declared "fold:0"
"Yuchun" declared "fold:0"
"HakulaPlayer" declared "call:10"
"Ethan" declared "fold:0"
Street "flop" started. (community card = ['D5', 'HT', 'S9'])
"HakulaPlayer" declared "call:0"
"Finneas" declared "call:0"
"Zheng" declared "call:0"
"RaphaelPlayer" declared "call:0"
Street "turn" started. (community card = ['D5', 'HT', 'S9', 'CQ'])
"HakulaPlayer" declared "call:0"
"Finneas" declared "call:0"
"Zheng" declared "call:0"
"RaphaelPlayer" declared "raise:60"
"HakulaPlayer" declared "fold:0"
"Finneas" declared "fold:0"
"Zheng" declared "raise:560"
"RaphaelPlayer" declared "call:560"
Street "river" started. (community card = ['D5', 'HT', 'S9', 'CQ', 'D2'])
"Zheng" declared "raise:440"
"RaphaelPlayer" declared "call:440"
"['Zheng', 'RaphaelPlayer']" won the round 4 (stack = {'Zheng': 1025, 'RaphaelPlayer': 1040, 'SichengZuo': 985, 'Yuchun': 985, 'HakulaPlayer': 1015, 'Ethan': 990, 'YangZ': 1000, 'Finneas': 960})
player [Zheng] gets hole card ['HJ', 'HQ'], current stack 1025
player [RaphaelPlayer] gets hole card ['C9', 'DK'], current stack 1040
player [SichengZuo] gets hole card ['HT', 'C5'], current stack 985
player [Yuchun] gets hole card ['H7', 'ST'], current stack 985
player [HakulaPlayer] gets hole card ['SJ', 'D7'], current stack 1015
player [Ethan] gets hole card ['H5', 'H8'], current stack 985
player [YangZ] gets hole card ['CT', 'D4'], current stack 990
player [Finneas] gets hole card ['DA', 'H9'], current stack 960
Started the round 5
Street "preflop" started. (community card = [])
"Finneas" declared "call:10"
"Zheng" declared "call:10"
"RaphaelPlayer" declared "call:10"
"SichengZuo" declared "fold:0"
"Yuchun" declared "fold:0"
"HakulaPlayer" declared "call:10"
"Ethan" declared "fold:0"
"YangZ" declared "fold:0"
Street "flop" started. (community card = ['D3', 'HK', 'DJ'])
"Finneas" declared "call:0"
"Zheng" declared "call:0"
"RaphaelPlayer" declared "raise:65"
"HakulaPlayer" declared "fold:0"
"Finneas" declared "fold:0"
"Zheng" declared "raise:572"
"RaphaelPlayer" declared "call:572"
Street "turn" started. (community card = ['D3', 'HK', 'DJ', 'DT'])
"Zheng" declared "call:0"
"RaphaelPlayer" declared "raise:458"
"Zheng" declared "fold:0"
"['RaphaelPlayer']" won the round 5 (stack = {'Zheng': 443, 'RaphaelPlayer': 1657, 'SichengZuo': 985, 'Yuchun': 985, 'HakulaPlayer': 1005, 'Ethan': 985, 'YangZ': 990, 'Finneas': 950})
player [Zheng] gets hole card ['D4', 'C9'], current stack 443
player [RaphaelPlayer] gets hole card ['S6', 'ST'], current stack 1657
player [SichengZuo] gets hole card ['D7', 'H5'], current stack 985
player [Yuchun] gets hole card ['S4', 'H4'], current stack 985
player [HakulaPlayer] gets hole card ['CJ', 'D2'], current stack 1005
player [Ethan] gets hole card ['C4', 'C7'], current stack 985
player [YangZ] gets hole card ['H2', 'C5'], current stack 985
player [Finneas] gets hole card ['D6', 'CK'], current stack 940
Started the round 6
Street "preflop" started. (community card = [])
"Zheng" declared "call:10"
"RaphaelPlayer" declared "call:10"
"SichengZuo" declared "fold:0"
"Yuchun" declared "fold:0"
"HakulaPlayer" declared "call:10"
"Ethan" declared "fold:0"
"YangZ" declared "fold:0"
"Finneas" declared "call:10"
Street "flop" started. (community card = ['C6', 'D3', 'H9'])
"Finneas" declared "call:0"
"Zheng" declared "call:0"
"RaphaelPlayer" declared "call:0"
"HakulaPlayer" declared "raise:18"
"Finneas" declared "call:18"
"Zheng" declared "fold:0"
"RaphaelPlayer" declared "call:18"
Street "turn" started. (community card = ['C6', 'D3', 'H9', 'DT'])
"Finneas" declared "call:0"
"RaphaelPlayer" declared "raise:109"
"HakulaPlayer" declared "raise:218"
"Finneas" declared "fold:0"
"RaphaelPlayer" declared "call:218"
Street "river" started. (community card = ['C6', 'D3', 'H9', 'DT', 'HQ'])
"RaphaelPlayer" declared "raise:545"
"HakulaPlayer" declared "fold:0"
"['RaphaelPlayer']" won the round 6 (stack = {'Zheng': 433, 'RaphaelPlayer': 1946, 'SichengZuo': 985, 'Yuchun': 985, 'HakulaPlayer': 759, 'Ethan': 985, 'YangZ': 985, 'Finneas': 922})
player [Zheng] gets hole card ['SQ', 'C7'], current stack 423
player [RaphaelPlayer] gets hole card ['SA', 'H5'], current stack 1946
player [SichengZuo] gets hole card ['ST', 'HT'], current stack 985
player [Yuchun] gets hole card ['H4', 'D2'], current stack 985
player [HakulaPlayer] gets hole card ['C5', 'C3'], current stack 759
player [Ethan] gets hole card ['SJ', 'DT'], current stack 985
player [YangZ] gets hole card ['S2', 'S7'], current stack 985
player [Finneas] gets hole card ['SK', 'DA'], current stack 917
Started the round 7
Street "preflop" started. (community card = [])
"RaphaelPlayer" declared "call:10"
"SichengZuo" declared "fold:0"
"Yuchun" declared "fold:0"
"HakulaPlayer" declared "call:10"
"Ethan" declared "call:10"
"YangZ" declared "fold:0"
"Finneas" declared "raise:468"
"Zheng" declared "fold:0"
"RaphaelPlayer" declared "fold:0"
"HakulaPlayer" declared "fold:0"
"Ethan" declared "fold:0"
"['Finneas']" won the round 7 (stack = {'Zheng': 423, 'RaphaelPlayer': 1936, 'SichengZuo': 985, 'Yuchun': 985, 'HakulaPlayer': 749, 'Ethan': 975, 'YangZ': 985, 'Finneas': 962})
player [Zheng] gets hole card ['HK', 'H6'], current stack 418
player [RaphaelPlayer] gets hole card ['C5', 'C7'], current stack 1926
player [SichengZuo] gets hole card ['S9', 'CQ'], current stack 985
player [Yuchun] gets hole card ['S7', 'D4'], current stack 985
player [HakulaPlayer] gets hole card ['H9', 'ST'], current stack 749
player [Ethan] gets hole card ['D9', 'S5'], current stack 975
player [YangZ] gets hole card ['C6', 'HQ'], current stack 985
player [Finneas] gets hole card ['D7', 'C8'], current stack 962
Started the round 8
Street "preflop" started. (community card = [])
"SichengZuo" declared "fold:0"
"Yuchun" declared "fold:0"
"HakulaPlayer" declared "fold:0"
"Ethan" declared "fold:0"
"YangZ" declared "fold:0"
"Finneas" declared "call:10"
"Zheng" declared "call:10"
"RaphaelPlayer" declared "fold:0"
Street "flop" started. (community card = ['C2', 'H7', 'H8'])
"Zheng" declared "call:0"
"Finneas" declared "call:0"
Street "turn" started. (community card = ['C2', 'H7', 'H8', 'S4'])
"Zheng" declared "call:0"
"Finneas" declared "call:0"
Street "river" started. (community card = ['C2', 'H7', 'H8', 'S4', 'DK'])
"Zheng" declared "raise:413"
"Finneas" declared "fold:0"
"['Zheng']" won the round 8 (stack = {'Zheng': 443, 'RaphaelPlayer': 1926, 'SichengZuo': 985, 'Yuchun': 985, 'HakulaPlayer': 749, 'Ethan': 975, 'YangZ': 985, 'Finneas': 952})
player [Zheng] gets hole card ['D6', 'CT'], current stack 443
player [RaphaelPlayer] gets hole card ['D8', 'S3'], current stack 1921
player [SichengZuo] gets hole card ['H6', 'S2'], current stack 975
player [Yuchun] gets hole card ['H3', 'CJ'], current stack 985
player [HakulaPlayer] gets hole card ['S8', 'SJ'], current stack 749
player [Ethan] gets hole card ['HK', 'H7'], current stack 975
player [YangZ] gets hole card ['DQ', 'D9'], current stack 985
player [Finneas] gets hole card ['SQ', 'HQ'], current stack 952
Started the round 9
Street "preflop" started. (community card = [])
"Yuchun" declared "fold:0"
"HakulaPlayer" declared "fold:0"
"Ethan" declared "fold:0"
"YangZ" declared "fold:0"
"Finneas" declared "raise:483"
"Zheng" declared "fold:0"
"RaphaelPlayer" declared "fold:0"
"SichengZuo" declared "fold:0"
"['Finneas']" won the round 9 (stack = {'Zheng': 443, 'RaphaelPlayer': 1921, 'SichengZuo': 975, 'Yuchun': 985, 'HakulaPlayer': 749, 'Ethan': 975, 'YangZ': 985, 'Finneas': 967})
player [Zheng] gets hole card ['H3', 'S8'], current stack 443
player [RaphaelPlayer] gets hole card ['S9', 'CT'], current stack 1921
player [SichengZuo] gets hole card ['CK', 'H8'], current stack 970
player [Yuchun] gets hole card ['C5', 'CQ'], current stack 975
player [HakulaPlayer] gets hole card ['D4', 'HQ'], current stack 749
player [Ethan] gets hole card ['H4', 'S6'], current stack 975
player [YangZ] gets hole card ['D9', 'D5'], current stack 985
player [Finneas] gets hole card ['D8', 'CJ'], current stack 967
Started the round 10
Street "preflop" started. (community card = [])
"HakulaPlayer" declared "fold:0"
"Ethan" declared "fold:0"
"YangZ" declared "fold:0"
"Finneas" declared "call:10"
"Zheng" declared "call:10"
"RaphaelPlayer" declared "call:10"
"SichengZuo" declared "fold:0"
"Yuchun" declared "call:10"
Street "flop" started. (community card = ['D7', 'C3', 'HJ'])
"Yuchun" declared "call:0"
"Finneas" declared "call:0"
"Zheng" declared "call:0"
"RaphaelPlayer" declared "call:0"
Street "turn" started. (community card = ['D7', 'C3', 'HJ', 'DJ'])
"Yuchun" declared "call:0"
"Finneas" declared "raise:483"
"Zheng" declared "fold:0"
"RaphaelPlayer" declared "fold:0"
"Yuchun" declared "fold:0"
"['Finneas']" won the round 10 (stack = {'Zheng': 433, 'RaphaelPlayer': 1911, 'SichengZuo': 970, 'Yuchun': 975, 'HakulaPlayer': 749, 'Ethan': 975, 'YangZ': 985, 'Finneas': 1002})
player [Zheng] gets hole card ['DQ', 'S9'], current stack 433
player [RaphaelPlayer] gets hole card ['D8', 'H9'], current stack 1911
player [SichengZuo] gets hole card ['H5', 'H3'], current stack 970
player [Yuchun] gets hole card ['H8', 'H2'], current stack 970
player [HakulaPlayer] gets hole card ['HT', 'D4'], current stack 739
player [Ethan] gets hole card ['H6', 'CQ'], current stack 975
player [YangZ] gets hole card ['CA', 'S7'], current stack 985
player [Finneas] gets hole card ['S5', 'DT'], current stack 1002
Started the round 11
Street "preflop" started. (community card = [])
"Ethan" declared "fold:0"
"YangZ" declared "fold:0"
"Finneas" declared "call:10"
"Zheng" declared "call:10"
"RaphaelPlayer" declared "fold:0"
"SichengZuo" declared "fold:0"
"Yuchun" declared "call:10"
"HakulaPlayer" declared "call:10"
Street "flop" started. (community card = ['C6', 'CJ', 'S2'])
"Yuchun" declared "call:0"
"HakulaPlayer" declared "call:0"
"Finneas" declared "call:0"
"Zheng" declared "call:0"
Street "turn" started. (community card = ['C6', 'CJ', 'S2', 'D5'])
"Yuchun" declared "call:0"
"HakulaPlayer" declared "call:0"
"Finneas" declared "call:0"
"Zheng" declared "call:0"
Street "river" started. (community card = ['C6', 'CJ', 'S2', 'D5', 'C7'])
"Yuchun" declared "call:0"
"HakulaPlayer" declared "call:0"
"Finneas" declared "call:0"
"Zheng" declared "call:0"
"['Finneas']" won the round 11 (stack = {'Zheng': 423, 'RaphaelPlayer': 1911, 'SichengZuo': 970, 'Yuchun': 965, 'HakulaPlayer': 739, 'Ethan': 975, 'YangZ': 985, 'Finneas': 1032})
player [Zheng] gets hole card ['H2', 'CJ'], current stack 423
player [RaphaelPlayer] gets hole card ['H7', 'D4'], current stack 1911
player [SichengZuo] gets hole card ['S7', 'DA'], current stack 970
player [Yuchun] gets hole card ['H8', 'SQ'], current stack 965
player [HakulaPlayer] gets hole card ['S8', 'S3'], current stack 734
player [Ethan] gets hole card ['HQ', 'C9'], current stack 965
player [YangZ] gets hole card ['H3', 'C3'], current stack 985
player [Finneas] gets hole card ['CQ', 'C8'], current stack 1032
Started the round 12
Street "preflop" started. (community card = [])
"YangZ" declared "fold:0"
"Finneas" declared "call:10"
"Zheng" declared "call:10"
"RaphaelPlayer" declared "fold:0"
"SichengZuo" declared "fold:0"
"Yuchun" declared "call:10"
"HakulaPlayer" declared "call:10"
"Ethan" declared "fold:0"
Street "flop" started. (community card = ['DQ', 'S4', 'CA'])
"HakulaPlayer" declared "call:0"
"Finneas" declared "call:0"
"Zheng" declared "call:0"
"Yuchun" declared "call:0"
Street "turn" started. (community card = ['DQ', 'S4', 'CA', 'DK'])
"HakulaPlayer" declared "call:0"
"Finneas" declared "call:0"
"Zheng" declared "call:0"
"Yuchun" declared "call:0"
Street "river" started. (community card = ['DQ', 'S4', 'CA', 'DK', 'D8'])
"HakulaPlayer" declared "call:0"
"Finneas" declared "call:0"
"Zheng" declared "call:0"
"Yuchun" declared "call:0"
"['Yuchun', 'Finneas']" won the round 12 (stack = {'Zheng': 413, 'RaphaelPlayer': 1911, 'SichengZuo': 970, 'Yuchun': 980, 'HakulaPlayer': 729, 'Ethan': 965, 'YangZ': 985, 'Finneas': 1047})
player [Zheng] gets hole card ['H7', 'C8'], current stack 413
player [RaphaelPlayer] gets hole card ['H9', 'D3'], current stack 1911
player [SichengZuo] gets hole card ['CT', 'C9'], current stack 970
player [Yuchun] gets hole card ['SA', 'S7'], current stack 980
player [HakulaPlayer] gets hole card ['HJ', 'D2'], current stack 729
player [Ethan] gets hole card ['D9', 'H8'], current stack 960
player [YangZ] gets hole card ['C3', 'HQ'], current stack 975
player [Finneas] gets hole card ['SQ', 'CK'], current stack 1047
Started the round 13
Street "preflop" started. (community card = [])
"Finneas" declared "call:10"
"Zheng" declared "call:10"
"RaphaelPlayer" declared "fold:0"
"SichengZuo" declared "fold:0"
"Yuchun" declared "call:10"
"HakulaPlayer" declared "call:10"
"Ethan" declared "fold:0"
"YangZ" declared "fold:0"
Street "flop" started. (community card = ['S3', 'D7', 'SJ'])
"Finneas" declared "call:0"
"Zheng" declared "call:0"
"Yuchun" declared "call:0"
"HakulaPlayer" declared "call:0"
Street "turn" started. (community card = ['S3', 'D7', 'SJ', 'CA'])
"Finneas" declared "call:0"
"Zheng" declared "call:0"
"Yuchun" declared "raise:970"
"HakulaPlayer" declared "fold:0"
"Finneas" declared "fold:0"
"Zheng" declared "fold:0"
"['Yuchun']" won the round 13 (stack = {'Zheng': 403, 'RaphaelPlayer': 1911, 'SichengZuo': 970, 'Yuchun': 1025, 'HakulaPlayer': 719, 'Ethan': 960, 'YangZ': 975, 'Finneas': 1037})
player [Zheng] gets hole card ['CQ', 'D8'], current stack 403
player [RaphaelPlayer] gets hole card ['H3', 'H2'], current stack 1911
player [SichengZuo] gets hole card ['C7', 'SQ'], current stack 970
player [Yuchun] gets hole card ['C8', 'SA'], current stack 1025
player [HakulaPlayer] gets hole card ['H7', 'H9'], current stack 719
player [Ethan] gets hole card ['H4', 'H6'], current stack 960
player [YangZ] gets hole card ['S7', 'D2'], current stack 970
player [Finneas] gets hole card ['DJ', 'SK'], current stack 1027
Started the round 14
Street "preflop" started. (community card = [])
"Zheng" declared "call:10"
"RaphaelPlayer" declared "fold:0"
"SichengZuo" declared "fold:0"
"Yuchun" declared "call:10"
"HakulaPlayer" declared "call:10"
"Ethan" declared "fold:0"
"YangZ" declared "fold:0"
"Finneas" declared "call:10"
Street "flop" started. (community card = ['DQ', 'C3', 'S5'])
"Finneas" declared "call:0"
"Zheng" declared "call:0"
"Yuchun" declared "call:0"
"HakulaPlayer" declared "call:0"
Street "turn" started. (community card = ['DQ', 'C3', 'S5', 'C5'])
"Finneas" declared "call:0"
"Zheng" declared "call:0"
"Yuchun" declared "call:0"
"HakulaPlayer" declared "call:0"
Street "river" started. (community card = ['DQ', 'C3', 'S5', 'C5', 'D7'])
"Finneas" declared "call:0"
"Zheng" declared "call:0"
"Yuchun" declared "call:0"
"HakulaPlayer" declared "call:0"
"['Zheng']" won the round 14 (stack = {'Zheng': 438, 'RaphaelPlayer': 1911, 'SichengZuo': 970, 'Yuchun': 1015, 'HakulaPlayer': 709, 'Ethan': 960, 'YangZ': 970, 'Finneas': 1027})
player [Zheng] gets hole card ['HA', 'C2'], current stack 428
player [RaphaelPlayer] gets hole card ['HJ', 'SQ'], current stack 1911
player [SichengZuo] gets hole card ['HT', 'C6'], current stack 970
player [Yuchun] gets hole card ['S2', 'S6'], current stack 1015
player [HakulaPlayer] gets hole card ['CJ', 'D7'], current stack 709
player [Ethan] gets hole card ['H4', 'C3'], current stack 960
player [YangZ] gets hole card ['D5', 'C7'], current stack 970
player [Finneas] gets hole card ['SA', 'H9'], current stack 1022
Started the round 15
Street "preflop" started. (community card = [])
"RaphaelPlayer" declared "call:10"
"SichengZuo" declared "fold:0"
"Yuchun" declared "call:10"
"HakulaPlayer" declared "call:10"
"Ethan" declared "fold:0"
"YangZ" declared "fold:0"
"Finneas" declared "call:10"
"Zheng" declared "call:10"
Street "flop" started. (community card = ['SK', 'H3', 'S5'])
"Finneas" declared "call:0"
"Zheng" declared "call:0"
"RaphaelPlayer" declared "call:0"
"Yuchun" declared "call:0"
"HakulaPlayer" declared "call:0"
Street "turn" started. (community card = ['SK', 'H3', 'S5', 'S4'])
"Finneas" declared "call:0"
"Zheng" declared "call:0"
"RaphaelPlayer" declared "call:0"
"Yuchun" declared "raise:40"
"HakulaPlayer" declared "fold:0"
"Finneas" declared "fold:0"
"Zheng" declared "fold:0"
"RaphaelPlayer" declared "fold:0"
"['Yuchun']" won the round 15 (stack = {'Zheng': 428, 'RaphaelPlayer': 1901, 'SichengZuo': 970, 'Yuchun': 1055, 'HakulaPlayer': 699, 'Ethan': 960, 'YangZ': 970, 'Finneas': 1017})
player [Zheng] gets hole card ['S8', 'S7'], current stack 423
player [RaphaelPlayer] gets hole card ['HK', 'H8'], current stack 1891
player [SichengZuo] gets hole card ['H5', 'D2'], current stack 970
player [Yuchun] gets hole card ['C6', 'HA'], current stack 1055
player [HakulaPlayer] gets hole card ['CK', 'C2'], current stack 699
player [Ethan] gets hole card ['S9', 'S5'], current stack 960
player [YangZ] gets hole card ['SJ', 'D3'], current stack 970
player [Finneas] gets hole card ['H7', 'CQ'], current stack 1017
Started the round 16
Street "preflop" started. (community card = [])
"SichengZuo" declared "fold:0"
"Yuchun" declared "call:10"
"HakulaPlayer" declared "call:10"
"Ethan" declared "fold:0"
"YangZ" declared "fold:0"
"Finneas" declared "call:10"
"Zheng" declared "call:10"
"RaphaelPlayer" declared "call:10"
Street "flop" started. (community card = ['D6', 'S2', 'HT'])
"Zheng" declared "call:0"
"RaphaelPlayer" declared "call:0"
"Yuchun" declared "call:0"
"HakulaPlayer" declared "call:0"
"Finneas" declared "call:0"
Street "turn" started. (community card = ['D6', 'S2', 'HT', 'H3'])
"Zheng" declared "call:0"
"RaphaelPlayer" declared "call:0"
"Yuchun" declared "call:0"
"HakulaPlayer" declared "raise:25"
"Finneas" declared "fold:0"
"Zheng" declared "fold:0"
"RaphaelPlayer" declared "fold:0"
"Yuchun" declared "call:25"
Street "river" started. (community card = ['D6', 'S2', 'HT', 'H3', 'C8'])
"Yuchun" declared "call:0"
"HakulaPlayer" declared "call:0"
"['Yuchun']" won the round 16 (stack = {'Zheng': 418, 'RaphaelPlayer': 1891, 'SichengZuo': 970, 'Yuchun': 1120, 'HakulaPlayer': 664, 'Ethan': 960, 'YangZ': 970, 'Finneas': 1007})
player [Zheng] gets hole card ['SJ', 'C9'], current stack 418
player [RaphaelPlayer] gets hole card ['H9', 'C7'], current stack 1886
player [SichengZuo] gets hole card ['H5', 'CQ'], current stack 960
player [Yuchun] gets hole card ['HJ', 'DK'], current stack 1120
player [HakulaPlayer] gets hole card ['D8', 'SQ'], current stack 664
player [Ethan] gets hole card ['H2', 'S3'], current stack 960
player [YangZ] gets hole card ['H4', 'SA'], current stack 970
player [Finneas] gets hole card ['D7', 'H6'], current stack 1007
Started the round 17
Street "preflop" started. (community card = [])
"Yuchun" declared "call:10"
"HakulaPlayer" declared "call:10"
"Ethan" declared "fold:0"
"YangZ" declared "fold:0"
"Finneas" declared "call:10"
"Zheng" declared "call:10"
"RaphaelPlayer" declared "fold:0"
"SichengZuo" declared "fold:0"
Street "flop" started. (community card = ['H3', 'D2', 'HA'])
"Yuchun" declared "call:0"
"HakulaPlayer" declared "call:0"
"Finneas" declared "call:0"
"Zheng" declared "call:0"
Street "turn" started. (community card = ['H3', 'D2', 'HA', 'S8'])
"Yuchun" declared "call:0"
"HakulaPlayer" declared "call:0"
"Finneas" declared "call:0"
"Zheng" declared "call:0"
Street "river" started. (community card = ['H3', 'D2', 'HA', 'S8', 'S6'])
"Yuchun" declared "call:0"
"HakulaPlayer" declared "call:0"
"Finneas" declared "call:0"
"Zheng" declared "call:0"
"['HakulaPlayer']" won the round 17 (stack = {'Zheng': 408, 'RaphaelPlayer': 1886, 'SichengZuo': 960, 'Yuchun': 1110, 'HakulaPlayer': 709, 'Ethan': 960, 'YangZ': 970, 'Finneas': 997})
player [Zheng] gets hole card ['DT', 'D9'], current stack 408
player [RaphaelPlayer] gets hole card ['S8', 'HQ'], current stack 1886
player [SichengZuo] gets hole card ['C9', 'C2'], current stack 955
player [Yuchun] gets hole card ['C6', 'HT'], current stack 1100
player [HakulaPlayer] gets hole card ['H3', 'H7'], current stack 709
player [Ethan] gets hole card ['CT', 'S5'], current stack 960
player [YangZ] gets hole card ['S6', 'C7'], current stack 970
player [Finneas] gets hole card ['CK', 'S3'], current stack 997
Started the round 18
Street "preflop" started. (community card = [])
"HakulaPlayer" declared "fold:0"
"Ethan" declared "fold:0"
"YangZ" declared "fold:0"
"Finneas" declared "call:10"
"Zheng" declared "call:10"
"RaphaelPlayer" declared "call:10"
"SichengZuo" declared "fold:0"
"Yuchun" declared "call:10"
Street "flop" started. (community card = ['C8', 'DK', 'HJ'])
"Yuchun" declared "call:0"
"Finneas" declared "call:0"
"Zheng" declared "call:0"
"RaphaelPlayer" declared "call:0"
Street "turn" started. (community card = ['C8', 'DK', 'HJ', 'H9'])
"Yuchun" declared "call:0"
"Finneas" declared "call:0"
"Zheng" declared "call:0"
"RaphaelPlayer" declared "call:0"
Street "river" started. (community card = ['C8', 'DK', 'HJ', 'H9', 'S2'])
"Yuchun" declared "call:0"
"Finneas" declared "call:0"
"Zheng" declared "call:0"
"RaphaelPlayer" declared "call:0"
"['Finneas']" won the round 18 (stack = {'Zheng': 398, 'RaphaelPlayer': 1876, 'SichengZuo': 955, 'Yuchun': 1100, 'HakulaPlayer': 709, 'Ethan': 960, 'YangZ': 970, 'Finneas': 1032})
player [Zheng] gets hole card ['C8', 'DK'], current stack 398
player [RaphaelPlayer] gets hole card ['DJ', 'D8'], current stack 1876
player [SichengZuo] gets hole card ['S8', 'HT'], current stack 955
player [Yuchun] gets hole card ['C5', 'ST'], current stack 1095
player [HakulaPlayer] gets hole card ['S3', 'CQ'], current stack 699
player [Ethan] gets hole card ['CK', 'SQ'], current stack 960
player [YangZ] gets hole card ['C6', 'CT'], current stack 970
player [Finneas] gets hole card ['D7', 'D9'], current stack 1032
Started the round 19
Street "preflop" started. (community card = [])
"Ethan" declared "raise:144"
"YangZ" declared "fold:0"
"Finneas" declared "fold:0"
"Zheng" declared "fold:0"
"RaphaelPlayer" declared "fold:0"
"SichengZuo" declared "fold:0"
"Yuchun" declared "call:144"
"HakulaPlayer" declared "fold:0"
Street "flop" started. (community card = ['SJ', 'S5', 'H8'])
"Yuchun" declared "call:0"
"Ethan" declared "call:0"
Street "turn" started. (community card = ['SJ', 'S5', 'H8', 'D2'])
"Yuchun" declared "call:0"
"Ethan" declared "call:0"
Street "river" started. (community card = ['SJ', 'S5', 'H8', 'D2', 'H2'])
"Yuchun" declared "call:0"
"Ethan" declared "call:0"
"['Yuchun']" won the round 19 (stack = {'Zheng': 398, 'RaphaelPlayer': 1876, 'SichengZuo': 955, 'Yuchun': 1254, 'HakulaPlayer': 699, 'Ethan': 816, 'YangZ': 970, 'Finneas': 1032})
player [Zheng] gets hole card ['H3', 'SJ'], current stack 398
player [RaphaelPlayer] gets hole card ['C8', 'S8'], current stack 1876
player [SichengZuo] gets hole card ['C2', 'DT'], current stack 955
player [Yuchun] gets hole card ['DJ', 'HA'], current stack 1254
player [HakulaPlayer] gets hole card ['H9', 'S4'], current stack 694
player [Ethan] gets hole card ['S7', 'C4'], current stack 806
player [YangZ] gets hole card ['SK', 'CA'], current stack 970
player [Finneas] gets hole card ['D2', 'H5'], current stack 1032
Started the round 20
Street "preflop" started. (community card = [])
"YangZ" declared "fold:0"
"Finneas" declared "call:10"
"Zheng" declared "call:10"
"RaphaelPlayer" declared "raise:30"
"SichengZuo" declared "fold:0"
"Yuchun" declared "call:30"
"HakulaPlayer" declared "fold:0"
"Ethan" declared "fold:0"
"Finneas" declared "fold:0"
"Zheng" declared "call:30"
Street "flop" started. (community card = ['S5', 'H8', 'D3'])
"Zheng" declared "call:0"
"RaphaelPlayer" declared "raise:125"
"Yuchun" declared "fold:0"
"Zheng" declared "call:125"
Street "turn" started. (community card = ['S5', 'H8', 'D3', 'C9'])
"Zheng" declared "call:0"
"RaphaelPlayer" declared "raise:375"
"Zheng" declared "fold:0"
"['RaphaelPlayer']" won the round 20 (stack = {'Zheng': 243, 'RaphaelPlayer': 2086, 'SichengZuo': 955, 'Yuchun': 1224, 'HakulaPlayer': 694, 'Ethan': 806, 'YangZ': 970, 'Finneas': 1022})
player [Zheng] gets hole card ['S3', 'HT'], current stack 243
player [RaphaelPlayer] gets hole card ['C7', 'C8'], current stack 2086
player [SichengZuo] gets hole card ['C9', 'DK'], current stack 955
player [Yuchun] gets hole card ['CJ', 'SJ'], current stack 1224
player [HakulaPlayer] gets hole card ['ST', 'D8'], current stack 694
player [Ethan] gets hole card ['CT', 'C6'], current stack 801
player [YangZ] gets hole card ['C5', 'DJ'], current stack 960
player [Finneas] gets hole card ['D7', 'C2'], current stack 1022
Started the round 21
Street "preflop" started. (community card = [])
"Finneas" declared "call:10"
"Zheng" declared "call:10"
"RaphaelPlayer" declared "fold:0"
"SichengZuo" declared "fold:0"
"Yuchun" declared "call:10"
"HakulaPlayer" declared "call:10"
"Ethan" declared "fold:0"
"YangZ" declared "fold:0"
Street "flop" started. (community card = ['S8', 'DQ', 'S7'])
"Finneas" declared "call:0"
"Zheng" declared "call:0"
"Yuchun" declared "call:0"
"HakulaPlayer" declared "call:0"
Street "turn" started. (community card = ['S8', 'DQ', 'S7', 'D9'])
"Finneas" declared "call:0"
"Zheng" declared "call:0"
"Yuchun" declared "call:0"
"HakulaPlayer" declared "call:0"
Street "river" started. (community card = ['S8', 'DQ', 'S7', 'D9', 'HK'])
"Finneas" declared "call:0"
"Zheng" declared "call:0"
"Yuchun" declared "call:0"
"HakulaPlayer" declared "call:0"
"['Yuchun']" won the round 21 (stack = {'Zheng': 233, 'RaphaelPlayer': 2086, 'SichengZuo': 955, 'Yuchun': 1269, 'HakulaPlayer': 684, 'Ethan': 801, 'YangZ': 960, 'Finneas': 1012})
player [Zheng] gets hole card ['S6', 'S2'], current stack 233
player [RaphaelPlayer] gets hole card ['H9', 'HJ'], current stack 2086
player [SichengZuo] gets hole card ['C5', 'D2'], current stack 955
player [Yuchun] gets hole card ['C9', 'D4'], current stack 1269
player [HakulaPlayer] gets hole card ['H4', 'C7'], current stack 684
player [Ethan] gets hole card ['DJ', 'HK'], current stack 801
player [YangZ] gets hole card ['SQ', 'D7'], current stack 955
player [Finneas] gets hole card ['H5', 'C3'], current stack 1002
Started the round 22
Street "preflop" started. (community card = [])
"Zheng" declared "call:10"
"RaphaelPlayer" declared "call:10"
"SichengZuo" declared "fold:0"
"Yuchun" declared "call:10"
"HakulaPlayer" declared "call:10"
"Ethan" declared "raise:120"
"YangZ" declared "fold:0"
"Finneas" declared "fold:0"
"Zheng" declared "call:120"
"RaphaelPlayer" declared "call:120"
"Yuchun" declared "fold:0"
"HakulaPlayer" declared "fold:0"
Street "flop" started. (community card = ['H2', 'D3', 'S3'])
"Zheng" declared "call:0"
"RaphaelPlayer" declared "call:0"
"Ethan" declared "call:0"
Street "turn" started. (community card = ['H2', 'D3', 'S3', 'D8'])
"Zheng" declared "call:0"
"RaphaelPlayer" declared "call:0"
"Ethan" declared "call:0"
Street "river" started. (community card = ['H2', 'D3', 'S3', 'D8', 'D6'])
"Zheng" declared "call:0"
"RaphaelPlayer" declared "call:0"
"Ethan" declared "call:0"
"['Zheng']" won the round 22 (stack = {'Zheng': 508, 'RaphaelPlayer': 1966, 'SichengZuo': 955, 'Yuchun': 1259, 'HakulaPlayer': 674, 'Ethan': 681, 'YangZ': 955, 'Finneas': 1002})
player [Zheng] gets hole card ['S8', 'S5'], current stack 498
player [RaphaelPlayer] gets hole card ['D3', 'D6'], current stack 1966
player [SichengZuo] gets hole card ['C4', 'CT'], current stack 955
player [Yuchun] gets hole card ['H5', 'D8'], current stack 1259
player [HakulaPlayer] gets hole card ['S7', 'C5'], current stack 674
player [Ethan] gets hole card ['DA', 'SK'], current stack 681
player [YangZ] gets hole card ['D7', 'C9'], current stack 955
player [Finneas] gets hole card ['HJ', 'H9'], current stack 997
Started the round 23
Street "preflop" started. (community card = [])
"RaphaelPlayer" declared "fold:0"
"SichengZuo" declared "fold:0"
"Yuchun" declared "call:10"
"HakulaPlayer" declared "call:10"
"Ethan" declared "raise:204"
"YangZ" declared "fold:0"
"Finneas" declared "fold:0"
"Zheng" declared "fold:0"
"Yuchun" declared "fold:0"
"HakulaPlayer" declared "fold:0"
"['Ethan']" won the round 23 (stack = {'Zheng': 498, 'RaphaelPlayer': 1966, 'SichengZuo': 955, 'Yuchun': 1249, 'HakulaPlayer': 664, 'Ethan': 716, 'YangZ': 955, 'Finneas': 997})
player [Zheng] gets hole card ['S2', 'SQ'], current stack 493
player [RaphaelPlayer] gets hole card ['D7', 'SA'], current stack 1956
player [SichengZuo] gets hole card ['C5', 'SJ'], current stack 955
player [Yuchun] gets hole card ['H7', 'C6'], current stack 1249
player [HakulaPlayer] gets hole card ['H5', 'CA'], current stack 664
player [Ethan] gets hole card ['HQ', 'HK'], current stack 716
player [YangZ] gets hole card ['CJ', 'DT'], current stack 955
player [Finneas] gets hole card ['CT', 'DQ'], current stack 997
Started the round 24
Street "preflop" started. (community card = [])
"SichengZuo" declared "fold:0"
"Yuchun" declared "call:10"
"HakulaPlayer" declared "call:10"
"Ethan" declared "raise:107"
"YangZ" declared "fold:0"
"Finneas" declared "fold:0"
"Zheng" declared "call:107"
"RaphaelPlayer" declared "call:107"
"Yuchun" declared "fold:0"
"HakulaPlayer" declared "fold:0"
Street "flop" started. (community card = ['S8', 'S3', 'S6'])
"Zheng" declared "raise:391"
"RaphaelPlayer" declared "fold:0"
"Ethan" declared "fold:0"
"['Zheng']" won the round 24 (stack = {'Zheng': 732, 'RaphaelPlayer': 1859, 'SichengZuo': 955, 'Yuchun': 1239, 'HakulaPlayer': 654, 'Ethan': 609, 'YangZ': 955, 'Finneas': 997})
player [Zheng] gets hole card ['D3', 'S6'], current stack 732
player [RaphaelPlayer] gets hole card ['DK', 'D6'], current stack 1854
player [SichengZuo] gets hole card ['H7', 'ST'], current stack 945
player [Yuchun] gets hole card ['C3', 'C4'], current stack 1239
player [HakulaPlayer] gets hole card ['C5', 'D2'], current stack 654
player [Ethan] gets hole card ['SQ', 'H4'], current stack 609
player [YangZ] gets hole card ['DQ', 'HT'], current stack 955
player [Finneas] gets hole card ['CK', 'C8'], current stack 997
Started the round 25
Street "preflop" started. (community card = [])
"Yuchun" declared "call:10"
"HakulaPlayer" declared "fold:0"
"Ethan" declared "fold:0"
"YangZ" declared "fold:0"
"Finneas" declared "call:10"
"Zheng" declared "call:10"
"RaphaelPlayer" declared "call:10"
"SichengZuo" declared "fold:0"
Street "flop" started. (community card = ['SK', 'DT', 'DA'])
"RaphaelPlayer" declared "raise:60"
"Yuchun" declared "fold:0"
"Finneas" declared "fold:0"
"Zheng" declared "call:60"
Street "turn" started. (community card = ['SK', 'DT', 'DA', 'H5'])
"RaphaelPlayer" declared "raise:180"
"Zheng" declared "fold:0"
"['RaphaelPlayer']" won the round 25 (stack = {'Zheng': 662, 'RaphaelPlayer': 1959, 'SichengZuo': 945, 'Yuchun': 1229, 'HakulaPlayer': 654, 'Ethan': 609, 'YangZ': 955, 'Finneas': 987})
player [Zheng] gets hole card ['S4', 'S6'], current stack 662
player [RaphaelPlayer] gets hole card ['CJ', 'C3'], current stack 1959
player [SichengZuo] gets hole card ['C9', 'H2'], current stack 940
player [Yuchun] gets hole card ['C7', 'HK'], current stack 1219
player [HakulaPlayer] gets hole card ['C5', 'CA'], current stack 654
player [Ethan] gets hole card ['CT', 'HJ'], current stack 609
player [YangZ] gets hole card ['H6', 'SA'], current stack 955
player [Finneas] gets hole card ['S5', 'H9'], current stack 987
Started the round 26
Street "preflop" started. (community card = [])
"HakulaPlayer" declared "call:10"
"Ethan" declared "call:10"
"YangZ" declared "fold:0"
"Finneas" declared "call:10"
"Zheng" declared "call:10"
"RaphaelPlayer" declared "call:10"
"SichengZuo" declared "fold:0"
"Yuchun" declared "call:10"
Street "flop" started. (community card = ['C6', 'H5', 'DA'])
"Yuchun" declared "call:0"
"HakulaPlayer" declared "raise:71"
"Ethan" declared "fold:0"
"Finneas" declared "fold:0"
"Zheng" declared "call:71"
"RaphaelPlayer" declared "fold:0"
"Yuchun" declared "call:71"
Street "turn" started. (community card = ['C6', 'H5', 'DA', 'DQ'])
"Yuchun" declared "call:0"
"HakulaPlayer" declared "raise:520"
"Zheng" declared "fold:0"
"Yuchun" declared "fold:0"
"['HakulaPlayer']" won the round 26 (stack = {'Zheng': 581, 'RaphaelPlayer': 1949, 'SichengZuo': 940, 'Yuchun': 1148, 'HakulaPlayer': 851, 'Ethan': 599, 'YangZ': 955, 'Finneas': 977})
player [Zheng] gets hole card ['D4', 'HT'], current stack 581
player [RaphaelPlayer] gets hole card ['C2', 'H6'], current stack 1949
player [SichengZuo] gets hole card ['ST', 'HA'], current stack 940
player [Yuchun] gets hole card ['H3', 'C4'], current stack 1143
player [HakulaPlayer] gets hole card ['SJ', 'CT'], current stack 841
player [Ethan] gets hole card ['CJ', 'S8'], current stack 599
player [YangZ] gets hole card ['SQ', 'C6'], current stack 955
player [Finneas] gets hole card ['S6', 'HQ'], current stack 977
Started the round 27
Street "preflop" started. (community card = [])
"Ethan" declared "fold:0"
"YangZ" declared "fold:0"
"Finneas" declared "call:10"
"Zheng" declared "call:10"
"RaphaelPlayer" declared "fold:0"
"SichengZuo" declared "fold:0"
"Yuchun" declared "call:10"
"HakulaPlayer" declared "call:10"
Street "flop" started. (community card = ['DJ', 'H2', 'SK'])
"Yuchun" declared "call:0"
"HakulaPlayer" declared "call:0"
"Finneas" declared "call:0"
"Zheng" declared "call:0"
Street "turn" started. (community card = ['DJ', 'H2', 'SK', 'S2'])
"Yuchun" declared "call:0"
"HakulaPlayer" declared "call:0"
"Finneas" declared "call:0"
"Zheng" declared "call:0"
Street "river" started. (community card = ['DJ', 'H2', 'SK', 'S2', 'H4'])
"Yuchun" declared "call:0"
"HakulaPlayer" declared "call:0"
"Finneas" declared "call:0"
"Zheng" declared "call:0"
"['HakulaPlayer']" won the round 27 (stack = {'Zheng': 571, 'RaphaelPlayer': 1949, 'SichengZuo': 940, 'Yuchun': 1138, 'HakulaPlayer': 881, 'Ethan': 599, 'YangZ': 955, 'Finneas': 967})
player [Zheng] gets hole card ['C4', 'H2'], current stack 571
player [RaphaelPlayer] gets hole card ['C5', 'S7'], current stack 1949
player [SichengZuo] gets hole card ['CQ', 'C7'], current stack 940
player [Yuchun] gets hole card ['C8', 'D7'], current stack 1138
player [HakulaPlayer] gets hole card ['D4', 'D5'], current stack 876
player [Ethan] gets hole card ['D6', 'HT'], current stack 589
player [YangZ] gets hole card ['H4', 'DT'], current stack 955
player [Finneas] gets hole card ['HQ', 'C9'], current stack 967
Started the round 28
Street "preflop" started. (community card = [])
"YangZ" declared "fold:0"
"Finneas" declared "call:10"
"Zheng" declared "call:10"
"RaphaelPlayer" declared "fold:0"
"SichengZuo" declared "fold:0"
"Yuchun" declared "call:10"
"HakulaPlayer" declared "call:10"
"Ethan" declared "fold:0"
Street "flop" started. (community card = ['H8', 'H3', 'D9'])
"HakulaPlayer" declared "call:0"
"Finneas" declared "call:0"
"Zheng" declared "call:0"
"Yuchun" declared "call:0"
Street "turn" started. (community card = ['H8', 'H3', 'D9', 'H6'])
"HakulaPlayer" declared "call:0"
"Finneas" declared "call:0"
"Zheng" declared "call:0"
"Yuchun" declared "call:0"
Street "river" started. (community card = ['H8', 'H3', 'D9', 'H6', 'D2'])
"HakulaPlayer" declared "raise:84"
"Finneas" declared "fold:0"
"Zheng" declared "call:84"
"Yuchun" declared "call:84"
"['HakulaPlayer']" won the round 28 (stack = {'Zheng': 477, 'RaphaelPlayer': 1949, 'SichengZuo': 940, 'Yuchun': 1044, 'HakulaPlayer': 1089, 'Ethan': 589, 'YangZ': 955, 'Finneas': 957})
player [Zheng] gets hole card ['S6', 'CJ'], current stack 477
player [RaphaelPlayer] gets hole card ['DQ', 'H5'], current stack 1949
player [SichengZuo] gets hole card ['C6', 'DT'], current stack 940
player [Yuchun] gets hole card ['D4', 'S8'], current stack 1044
player [HakulaPlayer] gets hole card ['H3', 'C3'], current stack 1089
player [Ethan] gets hole card ['C2', 'DJ'], current stack 584
player [YangZ] gets hole card ['S9', 'D9'], current stack 945
player [Finneas] gets hole card ['S5', 'H7'], current stack 957
Started the round 29
Street "preflop" started. (community card = [])
"Finneas" declared "call:10"
"Zheng" declared "call:10"
"RaphaelPlayer" declared "fold:0"
"SichengZuo" declared "fold:0"
"Yuchun" declared "call:10"
"HakulaPlayer" declared "call:10"
"Ethan" declared "fold:0"
"YangZ" declared "fold:0"
Street "flop" started. (community card = ['H6', 'C7', 'SK'])
"Finneas" declared "call:0"
"Zheng" declared "call:0"
"Yuchun" declared "call:0"
"HakulaPlayer" declared "call:0"
Street "turn" started. (community card = ['H6', 'C7', 'SK', 'H8'])
"Finneas" declared "call:0"
"Zheng" declared "call:0"
"Yuchun" declared "call:0"
"HakulaPlayer" declared "call:0"
Street "river" started. (community card = ['H6', 'C7', 'SK', 'H8', 'DA'])
"Finneas" declared "call:0"
"Zheng" declared "call:0"
"Yuchun" declared "call:0"
"HakulaPlayer" declared "call:0"
"['Yuchun']" won the round 29 (stack = {'Zheng': 467, 'RaphaelPlayer': 1949, 'SichengZuo': 940, 'Yuchun': 1089, 'HakulaPlayer': 1079, 'Ethan': 584, 'YangZ': 945, 'Finneas': 947})
player [Zheng] gets hole card ['C8', 'HQ'], current stack 467
player [RaphaelPlayer] gets hole card ['SA', 'H5'], current stack 1949
player [SichengZuo] gets hole card ['D5', 'D6'], current stack 940
player [Yuchun] gets hole card ['HK', 'CK'], current stack 1089
player [HakulaPlayer] gets hole card ['S8', 'CA'], current stack 1079
player [Ethan] gets hole card ['D3', 'SJ'], current stack 584
player [YangZ] gets hole card ['CJ', 'D9'], current stack 940
player [Finneas] gets hole card ['D7', 'H8'], current stack 937
Started the round 30
Street "preflop" started. (community card = [])
"Zheng" declared "call:10"
"RaphaelPlayer" declared "call:10"
"SichengZuo" declared "fold:0"
"Yuchun" declared "call:10"
"HakulaPlayer" declared "raise:39"
"Ethan" declared "fold:0"
"YangZ" declared "fold:0"
"Finneas" declared "fold:0"
"Zheng" declared "call:39"
"RaphaelPlayer" declared "call:39"
"Yuchun" declared "call:39"
Street "flop" started. (community card = ['HA', 'H4', 'H9'])
"Zheng" declared "call:0"
"RaphaelPlayer" declared "raise:181"
"Yuchun" declared "call:181"
"HakulaPlayer" declared "fold:0"
"Zheng" declared "fold:0"
Street "turn" started. (community card = ['HA', 'H4', 'H9', 'DA'])
"RaphaelPlayer" declared "raise:543"
"Yuchun" declared "call:543"
Street "river" started. (community card = ['HA', 'H4', 'H9', 'DA', 'H6'])
"RaphaelPlayer" declared "raise:1186"
"Yuchun" declared "call:1186"
"['Yuchun']" won the round 30 (stack = {'Zheng': 428, 'RaphaelPlayer': 860, 'SichengZuo': 940, 'Yuchun': 2271, 'HakulaPlayer': 1040, 'Ethan': 584, 'YangZ': 940, 'Finneas': 937})
player [Zheng] gets hole card ['H8', 'H3'], current stack 418
player [RaphaelPlayer] gets hole card ['H9', 'DK'], current stack 860
player [SichengZuo] gets hole card ['D8', 'CQ'], current stack 940
player [Yuchun] gets hole card ['D4', 'H4'], current stack 2271
player [HakulaPlayer] gets hole card ['C2', 'CK'], current stack 1040
player [Ethan] gets hole card ['S9', 'H6'], current stack 584
player [YangZ] gets hole card ['D9', 'S6'], current stack 940
player [Finneas] gets hole card ['C3', 'CA'], current stack 932
Started the round 31
Street "preflop" started. (community card = [])
"RaphaelPlayer" declared "call:10"
"SichengZuo" declared "fold:0"
"Yuchun" declared "call:10"
"HakulaPlayer" declared "call:10"
"Ethan" declared "fold:0"
"YangZ" declared "fold:0"
"Finneas" declared "call:10"
"Zheng" declared "call:10"
Street "flop" started. (community card = ['HQ', 'S8', 'C5'])
"Finneas" declared "call:0"
"Zheng" declared "call:0"
"RaphaelPlayer" declared "call:0"
"Yuchun" declared "call:0"
"HakulaPlayer" declared "call:0"
Street "turn" started. (community card = ['HQ', 'S8', 'C5', 'C9'])
"Finneas" declared "call:0"
"Zheng" declared "call:0"
"RaphaelPlayer" declared "call:0"
"Yuchun" declared "call:0"
"HakulaPlayer" declared "call:0"
Street "river" started. (community card = ['HQ', 'S8', 'C5', 'C9', 'S7'])
"Finneas" declared "call:0"
"Zheng" declared "call:0"
"RaphaelPlayer" declared "call:0"
"Yuchun" declared "call:0"
"HakulaPlayer" declared "call:0"
"['RaphaelPlayer']" won the round 31 (stack = {'Zheng': 418, 'RaphaelPlayer': 900, 'SichengZuo': 940, 'Yuchun': 2261, 'HakulaPlayer': 1030, 'Ethan': 584, 'YangZ': 940, 'Finneas': 927})
player [Zheng] gets hole card ['D7', 'H7'], current stack 413
player [RaphaelPlayer] gets hole card ['CQ', 'D6'], current stack 890
player [SichengZuo] gets hole card ['CJ', 'SQ'], current stack 940
player [Yuchun] gets hole card ['S2', 'D3'], current stack 2261
player [HakulaPlayer] gets hole card ['C7', 'C8'], current stack 1030
player [Ethan] gets hole card ['H2', 'D5'], current stack 584
player [YangZ] gets hole card ['SJ', 'S8'], current stack 940
player [Finneas] gets hole card ['C6', 'C3'], current stack 927
Started the round 32
Street "preflop" started. (community card = [])
"SichengZuo" declared "fold:0"
"Yuchun" declared "call:10"
"HakulaPlayer" declared "call:10"
"Ethan" declared "fold:0"
"YangZ" declared "fold:0"
"Finneas" declared "call:10"
"Zheng" declared "call:10"
"RaphaelPlayer" declared "call:10"
Street "flop" started. (community card = ['SA', 'DQ', 'S3'])
"Zheng" declared "call:0"
"RaphaelPlayer" declared "call:0"
"Yuchun" declared "call:0"
"HakulaPlayer" declared "call:0"
"Finneas" declared "call:0"
Street "turn" started. (community card = ['SA', 'DQ', 'S3', 'H5'])
"Zheng" declared "call:0"
"RaphaelPlayer" declared "call:0"
"Yuchun" declared "call:0"
"HakulaPlayer" declared "call:0"
"Finneas" declared "call:0"
Street "river" started. (community card = ['SA', 'DQ', 'S3', 'H5', 'H8'])
"Zheng" declared "call:0"
"RaphaelPlayer" declared "call:0"
"Yuchun" declared "call:0"
"HakulaPlayer" declared "call:0"
"Finneas" declared "call:0"
"['RaphaelPlayer']" won the round 32 (stack = {'Zheng': 408, 'RaphaelPlayer': 940, 'SichengZuo': 940, 'Yuchun': 2251, 'HakulaPlayer': 1020, 'Ethan': 584, 'YangZ': 940, 'Finneas': 917})
player [Zheng] gets hole card ['DK', 'C5'], current stack 408
player [RaphaelPlayer] gets hole card ['D3', 'C6'], current stack 935
player [SichengZuo] gets hole card ['C4', 'HQ'], current stack 930
player [Yuchun] gets hole card ['HJ', 'D8'], current stack 2251
player [HakulaPlayer] gets hole card ['H7', 'C7'], current stack 1020
player [Ethan] gets hole card ['D4', 'S5'], current stack 584
player [YangZ] gets hole card ['C3', 'SJ'], current stack 940
player [Finneas] gets hole card ['SK', 'D6'], current stack 917
Started the round 33
Street "preflop" started. (community card = [])
"Yuchun" declared "call:10"
"HakulaPlayer" declared "raise:38"
"Ethan" declared "fold:0"
"YangZ" declared "fold:0"
"Finneas" declared "fold:0"
"Zheng" declared "call:38"
"RaphaelPlayer" declared "fold:0"
"SichengZuo" declared "fold:0"
"Yuchun" declared "call:38"
Street "flop" started. (community card = ['S4', 'HT', 'DQ'])
"Yuchun" declared "call:0"
"HakulaPlayer" declared "call:0"
"Zheng" declared "call:0"
Street "turn" started. (community card = ['S4', 'HT', 'DQ', 'DJ'])
"Yuchun" declared "call:0"
"HakulaPlayer" declared "call:0"
"Zheng" declared "call:0"
Street "river" started. (community card = ['S4', 'HT', 'DQ', 'DJ', 'S9'])
"Yuchun" declared "raise:40"
"HakulaPlayer" declared "fold:0"
"Zheng" declared "raise:370"
"Yuchun" declared "raise:2213"
"['Zheng']" won the round 33 (stack = {'Zheng': 869, 'RaphaelPlayer': 935, 'SichengZuo': 930, 'Yuchun': 1843, 'HakulaPlayer': 982, 'Ethan': 584, 'YangZ': 940, 'Finneas': 917})
player [Zheng] gets hole card ['H4', 'D4'], current stack 869
player [RaphaelPlayer] gets hole card ['D8', 'C7'], current stack 935
player [SichengZuo] gets hole card ['D6', 'H8'], current stack 925
player [Yuchun] gets hole card ['HK', 'SK'], current stack 1833
player [HakulaPlayer] gets hole card ['DT', 'ST'], current stack 982
player [Ethan] gets hole card ['C6', 'S8'], current stack 584
player [YangZ] gets hole card ['SA', 'S5'], current stack 940
player [Finneas] gets hole card ['D7', 'CJ'], current stack 917
Started the round 34
Street "preflop" started. (community card = [])
"HakulaPlayer" declared "raise:48"
"Ethan" declared "fold:0"
"YangZ" declared "fold:0"
"Finneas" declared "fold:0"
"Zheng" declared "call:48"
"RaphaelPlayer" declared "fold:0"
"SichengZuo" declared "fold:0"
"Yuchun" declared "call:48"
Street "flop" started. (community card = ['C3', 'DA', 'HA'])
"Yuchun" declared "raise:40"
"HakulaPlayer" declared "call:40"
"Zheng" declared "call:40"
Street "turn" started. (community card = ['C3', 'DA', 'HA', 'C2'])
"Yuchun" declared "raise:40"
"HakulaPlayer" declared "call:40"
"Zheng" declared "call:40"
Street "river" started. (community card = ['C3', 'DA', 'HA', 'C2', 'H7'])
"Yuchun" declared "call:0"
"HakulaPlayer" declared "raise:854"
"Zheng" declared "fold:0"
"Yuchun" declared "raise:1715"
"['Yuchun']" won the round 34 (stack = {'Zheng': 741, 'RaphaelPlayer': 935, 'SichengZuo': 925, 'Yuchun': 2958, 'HakulaPlayer': 0, 'Ethan': 584, 'YangZ': 940, 'Finneas': 917})
player [Zheng] gets hole card ['C8', 'H9'], current stack 741
player [RaphaelPlayer] gets hole card ['C6', 'S5'], current stack 935
player [SichengZuo] gets hole card ['S8', 'CK'], current stack 925
player [Yuchun] gets hole card ['SJ', 'S3'], current stack 2953
player [Ethan] gets hole card ['SK', 'S6'], current stack 574
player [YangZ] gets hole card ['C5', 'HJ'], current stack 940
player [Finneas] gets hole card ['H6', 'DK'], current stack 917
Started the round 35
Street "preflop" started. (community card = [])
"YangZ" declared "fold:0"
"Finneas" declared "call:10"
"Zheng" declared "call:10"
"RaphaelPlayer" declared "fold:0"
"SichengZuo" declared "fold:0"
"Yuchun" declared "call:10"
"Ethan" declared "fold:0"
Street "flop" started. (community card = ['CA', 'D2', 'H7'])
"Yuchun" declared "call:0"
"Finneas" declared "call:0"
"Zheng" declared "call:0"
Street "turn" started. (community card = ['CA', 'D2', 'H7', 'CJ'])
"Yuchun" declared "call:0"
"Finneas" declared "call:0"
"Zheng" declared "call:0"
Street "river" started. (community card = ['CA', 'D2', 'H7', 'CJ', 'HQ'])
"Yuchun" declared "call:0"
"Finneas" declared "call:0"
"Zheng" declared "call:0"
"['Yuchun']" won the round 35 (stack = {'Zheng': 731, 'RaphaelPlayer': 935, 'SichengZuo': 925, 'Yuchun': 2988, 'HakulaPlayer': 0, 'Ethan': 574, 'YangZ': 940, 'Finneas': 907})
player [Zheng] gets hole card ['DA', 'S4'], current stack 731
player [RaphaelPlayer] gets hole card ['HA', 'S3'], current stack 935
player [SichengZuo] gets hole card ['H5', 'DQ'], current stack 925
player [Yuchun] gets hole card ['HK', 'D6'], current stack 2988
player [Ethan] gets hole card ['DT', 'ST'], current stack 569
player [YangZ] gets hole card ['H9', 'C9'], current stack 930
player [Finneas] gets hole card ['D2', 'D7'], current stack 907
Started the round 36
Street "preflop" started. (community card = [])
"Finneas" declared "call:10"
"Zheng" declared "call:10"
"RaphaelPlayer" declared "call:10"
"SichengZuo" declared "fold:0"
"Yuchun" declared "call:10"
"Ethan" declared "raise:86"
"YangZ" declared "fold:0"
"Finneas" declared "fold:0"
"Zheng" declared "call:86"
"RaphaelPlayer" declared "call:86"
"Yuchun" declared "call:86"
Street "flop" started. (community card = ['S9', 'SA', 'CA'])
"Ethan" declared "call:0"
"Zheng" declared "raise:327"
"RaphaelPlayer" declared "raise:849"
"Yuchun" declared "fold:0"
"Ethan" declared "fold:0"
"Zheng" declared "call:849"
Street "turn" started. (community card = ['S9', 'SA', 'CA', 'S6'])
Street "river" started. (community card = ['S9', 'SA', 'CA', 'S6', 'HJ'])
"['Zheng', 'RaphaelPlayer']" won the round 36 (stack = {'Zheng': 827, 'RaphaelPlayer': 1031, 'SichengZuo': 925, 'Yuchun': 2902, 'HakulaPlayer': 0, 'Ethan': 488, 'YangZ': 930, 'Finneas': 897})
player [Zheng] gets hole card ['CQ', 'CJ'], current stack 827
player [RaphaelPlayer] gets hole card ['SJ', 'H7'], current stack 1031
player [SichengZuo] gets hole card ['S2', 'D3'], current stack 925
player [Yuchun] gets hole card ['S5', 'C8'], current stack 2902
player [Ethan] gets hole card ['DK', 'D6'], current stack 488
player [YangZ] gets hole card ['S3', 'DJ'], current stack 925
player [Finneas] gets hole card ['SA', 'HK'], current stack 887
Started the round 37
Street "preflop" started. (community card = [])
"Zheng" declared "call:10"
"RaphaelPlayer" declared "fold:0"
"SichengZuo" declared "fold:0"
"Yuchun" declared "call:10"
"Ethan" declared "fold:0"
"YangZ" declared "fold:0"
"Finneas" declared "raise:456"
"Zheng" declared "fold:0"
"Yuchun" declared "fold:0"
"['Finneas']" won the round 37 (stack = {'Zheng': 817, 'RaphaelPlayer': 1031, 'SichengZuo': 925, 'Yuchun': 2892, 'HakulaPlayer': 0, 'Ethan': 488, 'YangZ': 925, 'Finneas': 922})
player [Zheng] gets hole card ['CQ', 'D8'], current stack 807
player [RaphaelPlayer] gets hole card ['C8', 'D6'], current stack 1031
player [SichengZuo] gets hole card ['C3', 'S8'], current stack 925
player [Yuchun] gets hole card ['D7', 'H5'], current stack 2892
player [Ethan] gets hole card ['H4', 'SQ'], current stack 488
player [YangZ] gets hole card ['CT', 'D3'], current stack 925
player [Finneas] gets hole card ['H9', 'CJ'], current stack 917
Started the round 38
Street "preflop" started. (community card = [])
"RaphaelPlayer" declared "fold:0"
"SichengZuo" declared "fold:0"
"Yuchun" declared "call:10"
"Ethan" declared "fold:0"
"YangZ" declared "fold:0"
"Finneas" declared "call:10"
"Zheng" declared "call:10"
Street "flop" started. (community card = ['D5', 'D9', 'ST'])
"Finneas" declared "call:0"
"Zheng" declared "call:0"
"Yuchun" declared "call:0"
Street "turn" started. (community card = ['D5', 'D9', 'ST', 'HA'])
"Finneas" declared "call:0"
"Zheng" declared "call:0"
"Yuchun" declared "call:0"
Street "river" started. (community card = ['D5', 'D9', 'ST', 'HA', 'C9'])
"Finneas" declared "raise:461"
"Zheng" declared "fold:0"
"Yuchun" declared "fold:0"
"['Finneas']" won the round 38 (stack = {'Zheng': 807, 'RaphaelPlayer': 1031, 'SichengZuo': 925, 'Yuchun': 2882, 'HakulaPlayer': 0, 'Ethan': 488, 'YangZ': 925, 'Finneas': 942})
player [Zheng] gets hole card ['C8', 'S2'], current stack 802
player [RaphaelPlayer] gets hole card ['CA', 'CQ'], current stack 1021
player [SichengZuo] gets hole card ['SA', 'H6'], current stack 925
player [Yuchun] gets hole card ['H4', 'C7'], current stack 2882
player [Ethan] gets hole card ['H2', 'D3'], current stack 488
player [YangZ] gets hole card ['C9', 'DQ'], current stack 925
player [Finneas] gets hole card ['H5', 'DA'], current stack 942
Started the round 39
Street "preflop" started. (community card = [])
"SichengZuo" declared "fold:0"
"Yuchun" declared "call:10"
"Ethan" declared "fold:0"
"YangZ" declared "fold:0"
"Finneas" declared "call:10"
"Zheng" declared "call:10"
"RaphaelPlayer" declared "raise:30"
"Yuchun" declared "call:30"
"Finneas" declared "fold:0"
"Zheng" declared "call:30"
Street "flop" started. (community card = ['D2', 'SJ', 'D8'])
"Zheng" declared "call:0"
"RaphaelPlayer" declared "call:0"
"Yuchun" declared "call:0"
Street "turn" started. (community card = ['D2', 'SJ', 'D8', 'HJ'])
"Zheng" declared "call:0"
"RaphaelPlayer" declared "call:0"
"Yuchun" declared "call:0"
Street "river" started. (community card = ['D2', 'SJ', 'D8', 'HJ', 'S4'])
"Zheng" declared "call:0"
"RaphaelPlayer" declared "call:0"
"Yuchun" declared "call:0"
"['Zheng']" won the round 39 (stack = {'Zheng': 877, 'RaphaelPlayer': 1001, 'SichengZuo': 925, 'Yuchun': 2852, 'HakulaPlayer': 0, 'Ethan': 488, 'YangZ': 925, 'Finneas': 932})
player [Zheng] gets hole card ['DJ', 'S6'], current stack 877
player [RaphaelPlayer] gets hole card ['C7', 'HJ'], current stack 996
player [SichengZuo] gets hole card ['ST', 'D5'], current stack 915
player [Yuchun] gets hole card ['H8', 'D4'], current stack 2852
player [Ethan] gets hole card ['DT', 'DK'], current stack 488
player [YangZ] gets hole card ['SA', 'C4'], current stack 925
player [Finneas] gets hole card ['H3', 'D2'], current stack 932
Started the round 40
Street "preflop" started. (community card = [])
"Yuchun" declared "call:10"
"Ethan" declared "fold:0"
"YangZ" declared "fold:0"
"Finneas" declared "call:10"
"Zheng" declared "call:10"
"RaphaelPlayer" declared "call:10"
"SichengZuo" declared "fold:0"
Street "flop" started. (community card = ['H7', 'SJ', 'S4'])
"RaphaelPlayer" declared "raise:60"
"Yuchun" declared "call:60"
"Finneas" declared "fold:0"
"Zheng" declared "call:60"
Street "turn" started. (community card = ['H7', 'SJ', 'S4', 'C9'])
"RaphaelPlayer" declared "raise:240"
"Yuchun" declared "fold:0"
"Zheng" declared "fold:0"
"['RaphaelPlayer']" won the round 40 (stack = {'Zheng': 807, 'RaphaelPlayer': 1161, 'SichengZuo': 915, 'Yuchun': 2782, 'HakulaPlayer': 0, 'Ethan': 488, 'YangZ': 925, 'Finneas': 922})
player [Zheng] gets hole card ['H8', 'H9'], current stack 807
player [RaphaelPlayer] gets hole card ['CQ', 'C9'], current stack 1161
player [SichengZuo] gets hole card ['D4', 'D9'], current stack 910
player [Yuchun] gets hole card ['C7', 'S2'], current stack 2772
player [Ethan] gets hole card ['D5', 'S4'], current stack 488
player [YangZ] gets hole card ['D3', 'DK'], current stack 925
player [Finneas] gets hole card ['S9', 'ST'], current stack 922
Started the round 41
Street "preflop" started. (community card = [])
"Ethan" declared "fold:0"
"YangZ" declared "fold:0"
"Finneas" declared "call:10"
"Zheng" declared "call:10"
"RaphaelPlayer" declared "call:10"
"SichengZuo" declared "fold:0"
"Yuchun" declared "fold:0"
Street "flop" started. (community card = ['SJ', 'SQ', 'H5'])
"Finneas" declared "call:0"
"Zheng" declared "call:0"
"RaphaelPlayer" declared "raise:55"
"Finneas" declared "fold:0"
"Zheng" declared "call:55"
Street "turn" started. (community card = ['SJ', 'SQ', 'H5', 'CK'])
"Zheng" declared "call:0"
"RaphaelPlayer" declared "raise:165"
"Zheng" declared "fold:0"
"['RaphaelPlayer']" won the round 41 (stack = {'Zheng': 742, 'RaphaelPlayer': 1251, 'SichengZuo': 910, 'Yuchun': 2772, 'HakulaPlayer': 0, 'Ethan': 488, 'YangZ': 925, 'Finneas': 912})
player [Zheng] gets hole card ['SJ', 'CJ'], current stack 742
player [RaphaelPlayer] gets hole card ['D7', 'C9'], current stack 1251
player [SichengZuo] gets hole card ['HJ', 'DA'], current stack 910
player [Yuchun] gets hole card ['SA', 'CA'], current stack 2767
player [Ethan] gets hole card ['D5', 'ST'], current stack 478
player [YangZ] gets hole card ['SK', 'C5'], current stack 925
player [Finneas] gets hole card ['H5', 'HQ'], current stack 912
Started the round 42
Street "preflop" started. (community card = [])
"YangZ" declared "fold:0"
"Finneas" declared "call:10"
"Zheng" declared "call:10"
"RaphaelPlayer" declared "call:10"
"SichengZuo" declared "fold:0"
"Yuchun" declared "call:10"
"Ethan" declared "fold:0"
Street "flop" started. (community card = ['C8', 'CK', 'D6'])
"Yuchun" declared "call:0"
"Finneas" declared "call:0"
"Zheng" declared "call:0"
"RaphaelPlayer" declared "call:0"
Street "turn" started. (community card = ['C8', 'CK', 'D6', 'S4'])
"Yuchun" declared "call:0"
"Finneas" declared "call:0"
"Zheng" declared "call:0"
"RaphaelPlayer" declared "call:0"
Street "river" started. (community card = ['C8', 'CK', 'D6', 'S4', 'C3'])
"Yuchun" declared "call:0"
"Finneas" declared "call:0"
"Zheng" declared "call:0"
"RaphaelPlayer" declared "call:0"
"['Yuchun']" won the round 42 (stack = {'Zheng': 732, 'RaphaelPlayer': 1241, 'SichengZuo': 910, 'Yuchun': 2812, 'HakulaPlayer': 0, 'Ethan': 478, 'YangZ': 925, 'Finneas': 902})
player [Zheng] gets hole card ['D6', 'DT'], current stack 732
player [RaphaelPlayer] gets hole card ['CQ', 'C7'], current stack 1241
player [SichengZuo] gets hole card ['C4', 'S5'], current stack 910
player [Yuchun] gets hole card ['S3', 'HT'], current stack 2812
player [Ethan] gets hole card ['D9', 'C8'], current stack 473
player [YangZ] gets hole card ['S6', 'S4'], current stack 915
player [Finneas] gets hole card ['C9', 'SK'], current stack 902
Started the round 43
Street "preflop" started. (community card = [])
"Finneas" declared "call:10"
"Zheng" declared "call:10"
"RaphaelPlayer" declared "call:10"
"SichengZuo" declared "fold:0"
"Yuchun" declared "fold:0"
"Ethan" declared "fold:0"
"YangZ" declared "fold:0"
Street "flop" started. (community card = ['H9', 'SJ', 'CT'])
"Finneas" declared "call:0"
"Zheng" declared "call:0"
"RaphaelPlayer" declared "call:0"
Street "turn" started. (community card = ['H9', 'SJ', 'CT', 'HK'])
"Finneas" declared "call:0"
"Zheng" declared "call:0"
"RaphaelPlayer" declared "raise:55"
"Finneas" declared "fold:0"
"Zheng" declared "call:55"
Street "river" started. (community card = ['H9', 'SJ', 'CT', 'HK', 'H2'])
"Zheng" declared "call:0"
"RaphaelPlayer" declared "raise:165"
"Zheng" declared "fold:0"
"['RaphaelPlayer']" won the round 43 (stack = {'Zheng': 667, 'RaphaelPlayer': 1331, 'SichengZuo': 910, 'Yuchun': 2812, 'HakulaPlayer': 0, 'Ethan': 473, 'YangZ': 915, 'Finneas': 892})
player [Zheng] gets hole card ['DJ', 'S8'], current stack 667
player [RaphaelPlayer] gets hole card ['SQ', 'H6'], current stack 1331
player [SichengZuo] gets hole card ['H9', 'D5'], current stack 910
player [Yuchun] gets hole card ['S6', 'S2'], current stack 2812
player [Ethan] gets hole card ['H3', 'C8'], current stack 473
player [YangZ] gets hole card ['D4', 'S5'], current stack 910
player [Finneas] gets hole card ['C2', 'SJ'], current stack 882
Started the round 44
Street "preflop" started. (community card = [])
"Zheng" declared "call:10"
"RaphaelPlayer" declared "fold:0"
"SichengZuo" declared "fold:0"
"Yuchun" declared "fold:0"
"Ethan" declared "fold:0"
"YangZ" declared "fold:0"
"Finneas" declared "call:10"
Street "flop" started. (community card = ['SK', 'D2', 'D9'])
"Finneas" declared "call:0"
"Zheng" declared "call:0"
Street "turn" started. (community card = ['SK', 'D2', 'D9', 'CK'])
"Finneas" declared "call:0"
"Zheng" declared "call:0"
Street "river" started. (community card = ['SK', 'D2', 'D9', 'CK', 'DQ'])
"Finneas" declared "call:0"
"Zheng" declared "call:0"
"['Finneas']" won the round 44 (stack = {'Zheng': 657, 'RaphaelPlayer': 1331, 'SichengZuo': 910, 'Yuchun': 2812, 'HakulaPlayer': 0, 'Ethan': 473, 'YangZ': 910, 'Finneas': 907})
player [Zheng] gets hole card ['DA', 'H6'], current stack 647
player [RaphaelPlayer] gets hole card ['CQ', 'D6'], current stack 1331
player [SichengZuo] gets hole card ['HK', 'CK'], current stack 910
player [Yuchun] gets hole card ['HT', 'S9'], current stack 2812
player [Ethan] gets hole card ['H7', 'CJ'], current stack 473
player [YangZ] gets hole card ['C3', 'C6'], current stack 910
player [Finneas] gets hole card ['C9', 'SJ'], current stack 902
Started the round 45
Street "preflop" started. (community card = [])
"RaphaelPlayer" declared "fold:0"
"SichengZuo" declared "raise:910"
"Yuchun" declared "fold:0"
"Ethan" declared "fold:0"
"YangZ" declared "fold:0"
"Finneas" declared "fold:0"
"Zheng" declared "fold:0"
"['SichengZuo']" won the round 45 (stack = {'Zheng': 647, 'RaphaelPlayer': 1331, 'SichengZuo': 925, 'Yuchun': 2812, 'HakulaPlayer': 0, 'Ethan': 473, 'YangZ': 910, 'Finneas': 902})
player [Zheng] gets hole card ['CA', 'DQ'], current stack 642
player [RaphaelPlayer] gets hole card ['C6', 'CQ'], current stack 1321
player [SichengZuo] gets hole card ['D7', 'S5'], current stack 925
player [Yuchun] gets hole card ['S4', 'H9'], current stack 2812
player [Ethan] gets hole card ['S8', 'SQ'], current stack 473
player [YangZ] gets hole card ['DA', 'DT'], current stack 910
player [Finneas] gets hole card ['SK', 'H3'], current stack 902
Started the round 46
Street "preflop" started. (community card = [])
"SichengZuo" declared "fold:0"
"Yuchun" declared "fold:0"
"Ethan" declared "fold:0"
"YangZ" declared "fold:0"
"Finneas" declared "call:10"
"Zheng" declared "call:10"
"RaphaelPlayer" declared "call:10"
Street "flop" started. (community card = ['CT', 'C8', 'S9'])
"Zheng" declared "call:0"
"RaphaelPlayer" declared "call:0"
"Finneas" declared "call:0"
Street "turn" started. (community card = ['CT', 'C8', 'S9', 'CK'])
"Zheng" declared "call:0"
"RaphaelPlayer" declared "raise:40"
"Finneas" declared "fold:0"
"Zheng" declared "call:40"
Street "river" started. (community card = ['CT', 'C8', 'S9', 'CK', 'D4'])
"Zheng" declared "call:0"
"RaphaelPlayer" declared "raise:120"
"Zheng" declared "call:120"
"['RaphaelPlayer']" won the round 46 (stack = {'Zheng': 477, 'RaphaelPlayer': 1511, 'SichengZuo': 925, 'Yuchun': 2812, 'HakulaPlayer': 0, 'Ethan': 473, 'YangZ': 910, 'Finneas': 892})
player [Zheng] gets hole card ['D6', 'S8'], current stack 477
player [RaphaelPlayer] gets hole card ['C9', 'H7'], current stack 1506
player [SichengZuo] gets hole card ['C8', 'S2'], current stack 915
player [Yuchun] gets hole card ['S9', 'HJ'], current stack 2812
player [Ethan] gets hole card ['ST', 'H6'], current stack 473
player [YangZ] gets hole card ['H8', 'D3'], current stack 910
player [Finneas] gets hole card ['H4', 'CK'], current stack 892
Started the round 47
Street "preflop" started. (community card = [])
"Yuchun" declared "fold:0"
"Ethan" declared "fold:0"
"YangZ" declared "fold:0"
"Finneas" declared "call:10"
"Zheng" declared "call:10"
"RaphaelPlayer" declared "fold:0"
"SichengZuo" declared "fold:0"
Street "flop" started. (community card = ['C5', 'DT', 'H2'])
"Finneas" declared "call:0"
"Zheng" declared "call:0"
Street "turn" started. (community card = ['C5', 'DT', 'H2', 'H9'])
"Finneas" declared "call:0"
"Zheng" declared "call:0"
Street "river" started. (community card = ['C5', 'DT', 'H2', 'H9', 'C4'])
"Finneas" declared "call:0"
"Zheng" declared "call:0"
"['Finneas']" won the round 47 (stack = {'Zheng': 467, 'RaphaelPlayer': 1506, 'SichengZuo': 915, 'Yuchun': 2812, 'HakulaPlayer': 0, 'Ethan': 473, 'YangZ': 910, 'Finneas': 917})
player [Zheng] gets hole card ['D4', 'D7'], current stack 467
player [RaphaelPlayer] gets hole card ['C8', 'D2'], current stack 1506
player [SichengZuo] gets hole card ['C6', 'CQ'], current stack 910
player [Yuchun] gets hole card ['C9', 'H4'], current stack 2802
player [Ethan] gets hole card ['ST', 'C7'], current stack 473
player [YangZ] gets hole card ['S3', 'DJ'], current stack 910
player [Finneas] gets hole card ['S6', 'H5'], current stack 917
Started the round 48
Street "preflop" started. (community card = [])
"Ethan" declared "fold:0"
"YangZ" declared "fold:0"
"Finneas" declared "call:10"
"Zheng" declared "call:10"
"RaphaelPlayer" declared "fold:0"
"SichengZuo" declared "fold:0"
"Yuchun" declared "fold:0"
Street "flop" started. (community card = ['S4', 'S5', 'S9'])
"Finneas" declared "call:0"
"Zheng" declared "call:0"
Street "turn" started. (community card = ['S4', 'S5', 'S9', 'H6'])
"Finneas" declared "call:0"
"Zheng" declared "call:0"
Street "river" started. (community card = ['S4', 'S5', 'S9', 'H6', 'HT'])
"Finneas" declared "call:0"
"Zheng" declared "call:0"
"['Finneas']" won the round 48 (stack = {'Zheng': 457, 'RaphaelPlayer': 1506, 'SichengZuo': 910, 'Yuchun': 2802, 'HakulaPlayer': 0, 'Ethan': 473, 'YangZ': 910, 'Finneas': 942})
player [Zheng] gets hole card ['D2', 'HT'], current stack 457
player [RaphaelPlayer] gets hole card ['DK', 'H4'], current stack 1506
player [SichengZuo] gets hole card ['HQ', 'H9'], current stack 910
player [Yuchun] gets hole card ['DQ', 'ST'], current stack 2797
player [Ethan] gets hole card ['C3', 'H3'], current stack 463
player [YangZ] gets hole card ['SK', 'H6'], current stack 910
player [Finneas] gets hole card ['HA', 'DJ'], current stack 942
Started the round 49
Street "preflop" started. (community card = [])
"YangZ" declared "fold:0"
"Finneas" declared "call:10"
"Zheng" declared "call:10"
"RaphaelPlayer" declared "call:10"
"SichengZuo" declared "fold:0"
"Yuchun" declared "fold:0"
"Ethan" declared "fold:0"
Street "flop" started. (community card = ['S9', 'C2', 'C9'])
"Finneas" declared "call:0"
"Zheng" declared "call:0"
"RaphaelPlayer" declared "call:0"
Street "turn" started. (community card = ['S9', 'C2', 'C9', 'DA'])
"Finneas" declared "call:0"
"Zheng" declared "call:0"
"RaphaelPlayer" declared "call:0"
Street "river" started. (community card = ['S9', 'C2', 'C9', 'DA', 'HK'])
"Finneas" declared "call:0"
"Zheng" declared "call:0"
"RaphaelPlayer" declared "raise:55"
"Finneas" declared "fold:0"
"Zheng" declared "call:55"
"['RaphaelPlayer']" won the round 49 (stack = {'Zheng': 392, 'RaphaelPlayer': 1596, 'SichengZuo': 910, 'Yuchun': 2797, 'HakulaPlayer': 0, 'Ethan': 463, 'YangZ': 910, 'Finneas': 932})
player [Zheng] gets hole card ['CK', 'D5'], current stack 392
player [RaphaelPlayer] gets hole card ['HK', 'H4'], current stack 1596
player [SichengZuo] gets hole card ['CA', 'DA'], current stack 910
player [Yuchun] gets hole card ['CT', 'S5'], current stack 2797
player [Ethan] gets hole card ['D7', 'DQ'], current stack 458
player [YangZ] gets hole card ['H5', 'H6'], current stack 900
player [Finneas] gets hole card ['DK', 'HJ'], current stack 932
Started the round 50
Street "preflop" started. (community card = [])
"Finneas" declared "call:10"
"Zheng" declared "call:10"
"RaphaelPlayer" declared "call:10"
"SichengZuo" declared "raise:910"
"Yuchun" declared "fold:0"
"Ethan" declared "fold:0"
"YangZ" declared "fold:0"
"Finneas" declared "fold:0"
"Zheng" declared "fold:0"
"RaphaelPlayer" declared "fold:0"
"['SichengZuo']" won the round 50 (stack = {'Zheng': 382, 'RaphaelPlayer': 1586, 'SichengZuo': 955, 'Yuchun': 2797, 'HakulaPlayer': 0, 'Ethan': 458, 'YangZ': 900, 'Finneas': 922})

Game Results:
------------------------------------------------------------
Game 1:
Winner: Yuchun (stack: 2797)
All players' stacks:
  Zheng: 382
  RaphaelPlayer: 1586
  SichengZuo: 955
  Yuchun: 2797
  HakulaPlayer: 0
  Ethan: 458
  YangZ: 900
  Finneas: 922
------------------------------------------------------------
