player [YangZ] gets hole card ['S4', 'S7'], current stack 1000
player [Ethan] gets hole card ['CT', 'CQ'], current stack 995
player [HakulaPlayer] gets hole card ['SQ', 'D4'], current stack 990
player [SichengZuo] gets hole card ['ST', 'DA'], current stack 1000
player [KLChen2PokerPlayer] gets hole card ['HJ', 'HT'], current stack 1000
player [Jinkun] gets hole card ['H9', 'H6'], current stack 1000
player [NitWinWin] gets hole card ['S9', 'H3'], current stack 1000
player [ZPlayer] gets hole card ['S6', 'H8'], current stack 1000
Started the round 1
Street "preflop" started. (community card = [])
"SichengZuo" declared "fold:0"
"KLChen2PokerPlayer" declared "raise:17"
"Jinkun" declared "fold:17"
"NitWinWin" declared "fold:0"
"ZPlayer" declared "call:17"
"YangZ" declared "fold:0"
"Ethan" declared "fold:0"
"HakulaPlayer" declared "call:17"
Street "flop" started. (community card = ['DJ', 'C4', 'D3'])
"HakulaPlayer" declared "call:0"
"KLChen2PokerPlayer" declared "raise:35"
"ZPlayer" declared "fold:0"
"HakulaPlayer" declared "fold:0"
"['KLChen2PokerPlayer']" won the round 1 (stack = {'YangZ': 1000, 'Ethan': 995, 'HakulaPlayer': 983, 'SichengZuo': 1000, 'KLChen2PokerPlayer': 1039, 'Jinkun': 1000, 'NitWinWin': 1000, 'ZPlayer': 983})
player [YangZ] gets hole card ['S9', 'H5'], current stack 1000
player [Ethan] gets hole card ['SK', 'S2'], current stack 995
player [HakulaPlayer] gets hole card ['C5', 'HA'], current stack 978
player [SichengZuo] gets hole card ['ST', 'H8'], current stack 990
player [KLChen2PokerPlayer] gets hole card ['CK', 'C2'], current stack 1039
player [Jinkun] gets hole card ['DK', 'S6'], current stack 1000
player [NitWinWin] gets hole card ['S3', 'CQ'], current stack 1000
player [ZPlayer] gets hole card ['D8', 'DA'], current stack 983
Started the round 2
Street "preflop" started. (community card = [])
"KLChen2PokerPlayer" declared "raise:19"
"Jinkun" declared "fold:19"
"NitWinWin" declared "fold:0"
"ZPlayer" declared "call:19"
"YangZ" declared "fold:0"
"Ethan" declared "fold:0"
"HakulaPlayer" declared "call:19"
"SichengZuo" declared "fold:0"
Street "flop" started. (community card = ['H2', 'C8', 'D3'])
"HakulaPlayer" declared "call:0"
"KLChen2PokerPlayer" declared "call:0"
"ZPlayer" declared "raise:329"
"HakulaPlayer" declared "fold:0"
"KLChen2PokerPlayer" declared "fold:0"
"['ZPlayer']" won the round 2 (stack = {'YangZ': 1000, 'Ethan': 995, 'HakulaPlayer': 964, 'SichengZuo': 990, 'KLChen2PokerPlayer': 1020, 'Jinkun': 1000, 'NitWinWin': 1000, 'ZPlayer': 1031})
player [YangZ] gets hole card ['SQ', 'HA'], current stack 1000
player [Ethan] gets hole card ['CJ', 'H7'], current stack 995
player [HakulaPlayer] gets hole card ['D4', 'S7'], current stack 964
player [SichengZuo] gets hole card ['ST', 'CK'], current stack 985
player [KLChen2PokerPlayer] gets hole card ['C9', 'C3'], current stack 1010
player [Jinkun] gets hole card ['H2', 'H4'], current stack 1000
player [NitWinWin] gets hole card ['S3', 'H5'], current stack 1000
player [ZPlayer] gets hole card ['S6', 'CT'], current stack 1031
Started the round 3
Street "preflop" started. (community card = [])
"Jinkun" declared "fold:10"
"NitWinWin" declared "fold:0"
"ZPlayer" declared "call:10"
"YangZ" declared "fold:0"
"Ethan" declared "fold:0"
"HakulaPlayer" declared "call:10"
"SichengZuo" declared "fold:0"
"KLChen2PokerPlayer" declared "fold:0"
Street "flop" started. (community card = ['C8', 'HK', 'HT'])
"ZPlayer" declared "raise:10"
"HakulaPlayer" declared "fold:0"
"['ZPlayer']" won the round 3 (stack = {'YangZ': 1000, 'Ethan': 995, 'HakulaPlayer': 954, 'SichengZuo': 985, 'KLChen2PokerPlayer': 1010, 'Jinkun': 1000, 'NitWinWin': 1000, 'ZPlayer': 1056})
player [YangZ] gets hole card ['DT', 'C9'], current stack 1000
player [Ethan] gets hole card ['HA', 'H4'], current stack 995
player [HakulaPlayer] gets hole card ['D6', 'DA'], current stack 954
player [SichengZuo] gets hole card ['H5', 'D8'], current stack 985
player [KLChen2PokerPlayer] gets hole card ['S9', 'CQ'], current stack 1005
player [Jinkun] gets hole card ['HK', 'D9'], current stack 990
player [NitWinWin] gets hole card ['ST', 'C3'], current stack 1000
player [ZPlayer] gets hole card ['DK', 'S7'], current stack 1056
Started the round 4
Street "preflop" started. (community card = [])
"NitWinWin" declared "fold:0"
"ZPlayer" declared "call:10"
"YangZ" declared "fold:0"
"Ethan" declared "fold:0"
"HakulaPlayer" declared "call:10"
"SichengZuo" declared "fold:0"
"KLChen2PokerPlayer" declared "call:10"
"Jinkun" declared "call:10"
Street "flop" started. (community card = ['S2', 'C5', 'H7'])
"KLChen2PokerPlayer" declared "call:0"
"Jinkun" declared "call:0"
"ZPlayer" declared "raise:20"
"HakulaPlayer" declared "fold:0"
"KLChen2PokerPlayer" declared "fold:0"
"Jinkun" declared "call:20"
Street "turn" started. (community card = ['S2', 'C5', 'H7', 'S4'])
"Jinkun" declared "call:0"
"ZPlayer" declared "raise:10"
"Jinkun" declared "call:10"
Street "river" started. (community card = ['S2', 'C5', 'H7', 'S4', 'DQ'])
"Jinkun" declared "call:0"
"ZPlayer" declared "raise:10"
"Jinkun" declared "call:10"
"['ZPlayer']" won the round 4 (stack = {'YangZ': 1000, 'Ethan': 995, 'HakulaPlayer': 944, 'SichengZuo': 985, 'KLChen2PokerPlayer': 1000, 'Jinkun': 950, 'NitWinWin': 1000, 'ZPlayer': 1126})
player [YangZ] gets hole card ['H4', 'C5'], current stack 1000
player [Ethan] gets hole card ['SK', 'CT'], current stack 995
player [HakulaPlayer] gets hole card ['S2', 'S7'], current stack 944
player [SichengZuo] gets hole card ['S6', 'H8'], current stack 985
player [KLChen2PokerPlayer] gets hole card ['C4', 'D5'], current stack 1000
player [Jinkun] gets hole card ['S8', 'S3'], current stack 945
player [NitWinWin] gets hole card ['DQ', 'D8'], current stack 990
player [ZPlayer] gets hole card ['D2', 'DJ'], current stack 1126
Started the round 5
Street "preflop" started. (community card = [])
"ZPlayer" declared "call:10"
"YangZ" declared "fold:0"
"Ethan" declared "fold:0"
"HakulaPlayer" declared "call:10"
"SichengZuo" declared "fold:0"
"KLChen2PokerPlayer" declared "fold:0"
"Jinkun" declared "call:10"
"NitWinWin" declared "fold:0"
Street "flop" started. (community card = ['HT', 'SA', 'S5'])
"Jinkun" declared "call:0"
"ZPlayer" declared "call:0"
"HakulaPlayer" declared "call:0"
Street "turn" started. (community card = ['HT', 'SA', 'S5', 'H5'])
"Jinkun" declared "call:0"
"ZPlayer" declared "call:0"
"HakulaPlayer" declared "call:0"
Street "river" started. (community card = ['HT', 'SA', 'S5', 'H5', 'C7'])
"Jinkun" declared "call:0"
"ZPlayer" declared "call:0"
"HakulaPlayer" declared "call:0"
"['HakulaPlayer']" won the round 5 (stack = {'YangZ': 1000, 'Ethan': 995, 'HakulaPlayer': 974, 'SichengZuo': 985, 'KLChen2PokerPlayer': 1000, 'Jinkun': 940, 'NitWinWin': 990, 'ZPlayer': 1116})
player [YangZ] gets hole card ['C8', 'ST'], current stack 1000
player [Ethan] gets hole card ['CK', 'D5'], current stack 995
player [HakulaPlayer] gets hole card ['C4', 'H4'], current stack 974
player [SichengZuo] gets hole card ['HA', 'DK'], current stack 985
player [KLChen2PokerPlayer] gets hole card ['CJ', 'H6'], current stack 1000
player [Jinkun] gets hole card ['S6', 'S3'], current stack 940
player [NitWinWin] gets hole card ['HT', 'DJ'], current stack 985
player [ZPlayer] gets hole card ['SK', 'S7'], current stack 1106
Started the round 6
Street "preflop" started. (community card = [])
"YangZ" declared "fold:0"
"Ethan" declared "fold:0"
"HakulaPlayer" declared "fold:0"
"SichengZuo" declared "fold:0"
"KLChen2PokerPlayer" declared "call:10"
"Jinkun" declared "call:10"
"NitWinWin" declared "fold:0"
"ZPlayer" declared "raise:15"
"KLChen2PokerPlayer" declared "fold:0"
"Jinkun" declared "raise:30"
"ZPlayer" declared "call:30"
Street "flop" started. (community card = ['D4', 'CT', 'SQ'])
"ZPlayer" declared "call:0"
"Jinkun" declared "raise:225"
"ZPlayer" declared "fold:0"
"['Jinkun']" won the round 6 (stack = {'YangZ': 1000, 'Ethan': 995, 'HakulaPlayer': 974, 'SichengZuo': 985, 'KLChen2PokerPlayer': 990, 'Jinkun': 985, 'NitWinWin': 985, 'ZPlayer': 1086})
player [YangZ] gets hole card ['DA', 'DT'], current stack 990
player [Ethan] gets hole card ['DQ', 'C5'], current stack 995
player [HakulaPlayer] gets hole card ['SQ', 'SJ'], current stack 974
player [SichengZuo] gets hole card ['C9', 'CT'], current stack 985
player [KLChen2PokerPlayer] gets hole card ['CA', 'SK'], current stack 990
player [Jinkun] gets hole card ['C7', 'C2'], current stack 985
player [NitWinWin] gets hole card ['S8', 'C4'], current stack 985
player [ZPlayer] gets hole card ['H5', 'CJ'], current stack 1081
Started the round 7
Street "preflop" started. (community card = [])
"Ethan" declared "fold:0"
"HakulaPlayer" declared "call:10"
"SichengZuo" declared "fold:0"
"KLChen2PokerPlayer" declared "raise:25"
"Jinkun" declared "fold:25"
"NitWinWin" declared "fold:0"
"ZPlayer" declared "call:25"
"YangZ" declared "fold:0"
"HakulaPlayer" declared "call:25"
Street "flop" started. (community card = ['DK', 'D2', 'HQ'])
"ZPlayer" declared "call:0"
"HakulaPlayer" declared "call:0"
"KLChen2PokerPlayer" declared "raise:34"
"ZPlayer" declared "fold:0"
"HakulaPlayer" declared "call:34"
Street "turn" started. (community card = ['DK', 'D2', 'HQ', 'C3'])
"HakulaPlayer" declared "raise:151"
"KLChen2PokerPlayer" declared "call:151"
Street "river" started. (community card = ['DK', 'D2', 'HQ', 'C3', 'H9'])
"HakulaPlayer" declared "raise:554"
"KLChen2PokerPlayer" declared "call:554"
"['KLChen2PokerPlayer']" won the round 7 (stack = {'YangZ': 990, 'Ethan': 995, 'HakulaPlayer': 210, 'SichengZuo': 985, 'KLChen2PokerPlayer': 1789, 'Jinkun': 985, 'NitWinWin': 985, 'ZPlayer': 1061})
player [YangZ] gets hole card ['SA', 'C9'], current stack 985
player [Ethan] gets hole card ['H6', 'D6'], current stack 985
player [HakulaPlayer] gets hole card ['S6', 'D9'], current stack 210
player [SichengZuo] gets hole card ['S3', 'S7'], current stack 985
player [KLChen2PokerPlayer] gets hole card ['H4', 'S5'], current stack 1789
player [Jinkun] gets hole card ['H2', 'SJ'], current stack 985
player [NitWinWin] gets hole card ['CK', 'H7'], current stack 985
player [ZPlayer] gets hole card ['S9', 'H8'], current stack 1061
Started the round 8
Street "preflop" started. (community card = [])
"HakulaPlayer" declared "fold:0"
"SichengZuo" declared "fold:0"
"KLChen2PokerPlayer" declared "call:10"
"Jinkun" declared "fold:10"
"NitWinWin" declared "fold:0"
"ZPlayer" declared "raise:15"
"YangZ" declared "fold:0"
"Ethan" declared "call:15"
"KLChen2PokerPlayer" declared "fold:0"
Street "flop" started. (community card = ['H3', 'D8', 'S2'])
"Ethan" declared "call:0"
"ZPlayer" declared "raise:10"
"Ethan" declared "raise:55"
"ZPlayer" declared "fold:0"
"['Ethan']" won the round 8 (stack = {'YangZ': 985, 'Ethan': 1035, 'HakulaPlayer': 210, 'SichengZuo': 985, 'KLChen2PokerPlayer': 1779, 'Jinkun': 985, 'NitWinWin': 985, 'ZPlayer': 1036})
player [YangZ] gets hole card ['S3', 'D2'], current stack 985
player [Ethan] gets hole card ['HJ', 'SA'], current stack 1030
player [HakulaPlayer] gets hole card ['H5', 'DK'], current stack 200
player [SichengZuo] gets hole card ['HQ', 'S9'], current stack 985
player [KLChen2PokerPlayer] gets hole card ['CQ', 'HT'], current stack 1779
player [Jinkun] gets hole card ['SK', 'H4'], current stack 985
player [NitWinWin] gets hole card ['H9', 'D3'], current stack 985
player [ZPlayer] gets hole card ['C3', 'S7'], current stack 1036
Started the round 9
Street "preflop" started. (community card = [])
"SichengZuo" declared "fold:0"
"KLChen2PokerPlayer" declared "raise:29"
"Jinkun" declared "fold:29"
"NitWinWin" declared "fold:0"
"ZPlayer" declared "call:29"
"YangZ" declared "fold:0"
"Ethan" declared "raise:155"
"HakulaPlayer" declared "fold:0"
"KLChen2PokerPlayer" declared "fold:0"
"ZPlayer" declared "fold:0"
"['Ethan']" won the round 9 (stack = {'YangZ': 985, 'Ethan': 1103, 'HakulaPlayer': 200, 'SichengZuo': 985, 'KLChen2PokerPlayer': 1750, 'Jinkun': 985, 'NitWinWin': 985, 'ZPlayer': 1007})
player [YangZ] gets hole card ['C2', 'S4'], current stack 985
player [Ethan] gets hole card ['D9', 'S8'], current stack 1103
player [HakulaPlayer] gets hole card ['ST', 'SQ'], current stack 195
player [SichengZuo] gets hole card ['D5', 'HQ'], current stack 975
player [KLChen2PokerPlayer] gets hole card ['D7', 'DQ'], current stack 1750
player [Jinkun] gets hole card ['S7', 'H3'], current stack 985
player [NitWinWin] gets hole card ['SJ', 'DA'], current stack 985
player [ZPlayer] gets hole card ['C3', 'HJ'], current stack 1007
Started the round 10
Street "preflop" started. (community card = [])
"KLChen2PokerPlayer" declared "raise:15"
"Jinkun" declared "fold:15"
"NitWinWin" declared "fold:0"
"ZPlayer" declared "call:15"
"YangZ" declared "fold:0"
"Ethan" declared "fold:0"
"HakulaPlayer" declared "call:15"
"SichengZuo" declared "fold:0"
Street "flop" started. (community card = ['DK', 'D4', 'S6'])
"HakulaPlayer" declared "call:0"
"KLChen2PokerPlayer" declared "raise:28"
"ZPlayer" declared "fold:0"
"HakulaPlayer" declared "fold:0"
"['KLChen2PokerPlayer']" won the round 10 (stack = {'YangZ': 985, 'Ethan': 1103, 'HakulaPlayer': 185, 'SichengZuo': 975, 'KLChen2PokerPlayer': 1790, 'Jinkun': 985, 'NitWinWin': 985, 'ZPlayer': 992})
player [YangZ] gets hole card ['C4', 'S4'], current stack 985
player [Ethan] gets hole card ['H5', 'C5'], current stack 1103
player [HakulaPlayer] gets hole card ['D2', 'H2'], current stack 185
player [SichengZuo] gets hole card ['D3', 'D7'], current stack 970
player [KLChen2PokerPlayer] gets hole card ['H7', 'SJ'], current stack 1780
player [Jinkun] gets hole card ['C9', 'H8'], current stack 985
player [NitWinWin] gets hole card ['HJ', 'S6'], current stack 985
player [ZPlayer] gets hole card ['HA', 'S3'], current stack 992
Started the round 11
Street "preflop" started. (community card = [])
"Jinkun" declared "fold:10"
"NitWinWin" declared "fold:0"
"ZPlayer" declared "call:10"
"YangZ" declared "fold:0"
"Ethan" declared "fold:0"
"HakulaPlayer" declared "call:10"
"SichengZuo" declared "fold:0"
"KLChen2PokerPlayer" declared "call:10"
Street "flop" started. (community card = ['D5', 'SK', 'C3'])
"KLChen2PokerPlayer" declared "call:0"
"ZPlayer" declared "raise:17"
"HakulaPlayer" declared "fold:0"
"KLChen2PokerPlayer" declared "fold:0"
"['ZPlayer']" won the round 11 (stack = {'YangZ': 985, 'Ethan': 1103, 'HakulaPlayer': 175, 'SichengZuo': 970, 'KLChen2PokerPlayer': 1780, 'Jinkun': 985, 'NitWinWin': 985, 'ZPlayer': 1017})
player [YangZ] gets hole card ['C7', 'H7'], current stack 985
player [Ethan] gets hole card ['DA', 'C4'], current stack 1103
player [HakulaPlayer] gets hole card ['DK', 'H6'], current stack 175
player [SichengZuo] gets hole card ['ST', 'H8'], current stack 970
player [KLChen2PokerPlayer] gets hole card ['D3', 'D6'], current stack 1775
player [Jinkun] gets hole card ['SQ', 'CK'], current stack 975
player [NitWinWin] gets hole card ['S8', 'HQ'], current stack 985
player [ZPlayer] gets hole card ['H3', 'HJ'], current stack 1017
Started the round 12
Street "preflop" started. (community card = [])
"NitWinWin" declared "fold:0"
"ZPlayer" declared "call:10"
"YangZ" declared "fold:0"
"Ethan" declared "fold:0"
"HakulaPlayer" declared "call:10"
"SichengZuo" declared "fold:0"
"KLChen2PokerPlayer" declared "fold:0"
"Jinkun" declared "call:10"
Street "flop" started. (community card = ['S4', 'DJ', 'H9'])
"Jinkun" declared "call:0"
"ZPlayer" declared "raise:35"
"HakulaPlayer" declared "fold:0"
"Jinkun" declared "call:35"
Street "turn" started. (community card = ['S4', 'DJ', 'H9', 'DQ'])
"Jinkun" declared "raise:44"
"ZPlayer" declared "call:44"
Street "river" started. (community card = ['S4', 'DJ', 'H9', 'DQ', 'S5'])
"Jinkun" declared "raise:83"
"ZPlayer" declared "fold:0"
"['Jinkun']" won the round 12 (stack = {'YangZ': 985, 'Ethan': 1103, 'HakulaPlayer': 165, 'SichengZuo': 970, 'KLChen2PokerPlayer': 1775, 'Jinkun': 1089, 'NitWinWin': 985, 'ZPlayer': 928})
player [YangZ] gets hole card ['CA', 'D8'], current stack 985
player [Ethan] gets hole card ['H5', 'C5'], current stack 1103
player [HakulaPlayer] gets hole card ['DK', 'SQ'], current stack 165
player [SichengZuo] gets hole card ['S4', 'S5'], current stack 970
player [KLChen2PokerPlayer] gets hole card ['S7', 'S6'], current stack 1775
player [Jinkun] gets hole card ['DA', 'C8'], current stack 1084
player [NitWinWin] gets hole card ['SA', 'C4'], current stack 975
player [ZPlayer] gets hole card ['CQ', 'S9'], current stack 928
Started the round 13
Street "preflop" started. (community card = [])
"ZPlayer" declared "raise:15"
"YangZ" declared "fold:0"
"Ethan" declared "fold:0"
"HakulaPlayer" declared "call:15"
"SichengZuo" declared "fold:0"
"KLChen2PokerPlayer" declared "fold:0"
"Jinkun" declared "fold:15"
"NitWinWin" declared "fold:0"
Street "flop" started. (community card = ['CK', 'C3', 'S3'])
"ZPlayer" declared "call:0"
"HakulaPlayer" declared "raise:53"
"ZPlayer" declared "fold:0"
"['HakulaPlayer']" won the round 13 (stack = {'YangZ': 985, 'Ethan': 1103, 'HakulaPlayer': 195, 'SichengZuo': 970, 'KLChen2PokerPlayer': 1775, 'Jinkun': 1084, 'NitWinWin': 975, 'ZPlayer': 913})
player [YangZ] gets hole card ['C4', 'D2'], current stack 985
player [Ethan] gets hole card ['S7', 'S9'], current stack 1103
player [HakulaPlayer] gets hole card ['H8', 'DA'], current stack 195
player [SichengZuo] gets hole card ['DQ', 'SQ'], current stack 970
player [KLChen2PokerPlayer] gets hole card ['CK', 'H7'], current stack 1775
player [Jinkun] gets hole card ['DK', 'C7'], current stack 1084
player [NitWinWin] gets hole card ['S8', 'D7'], current stack 970
player [ZPlayer] gets hole card ['C2', 'S2'], current stack 903
Started the round 14
Street "preflop" started. (community card = [])
"YangZ" declared "fold:0"
"Ethan" declared "fold:0"
"HakulaPlayer" declared "fold:0"
"SichengZuo" declared "fold:0"
"KLChen2PokerPlayer" declared "raise:22"
"Jinkun" declared "fold:22"
"NitWinWin" declared "fold:0"
"ZPlayer" declared "fold:0"
"['KLChen2PokerPlayer']" won the round 14 (stack = {'YangZ': 985, 'Ethan': 1103, 'HakulaPlayer': 195, 'SichengZuo': 970, 'KLChen2PokerPlayer': 1790, 'Jinkun': 1084, 'NitWinWin': 970, 'ZPlayer': 903})
player [YangZ] gets hole card ['C9', 'C4'], current stack 975
player [Ethan] gets hole card ['S5', 'D3'], current stack 1103
player [HakulaPlayer] gets hole card ['ST', 'C5'], current stack 195
player [SichengZuo] gets hole card ['HA', 'H5'], current stack 970
player [KLChen2PokerPlayer] gets hole card ['CK', 'H9'], current stack 1790
player [Jinkun] gets hole card ['H3', 'HQ'], current stack 1084
player [NitWinWin] gets hole card ['SA', 'SQ'], current stack 970
player [ZPlayer] gets hole card ['HT', 'HJ'], current stack 898
Started the round 15
Street "preflop" started. (community card = [])
"Ethan" declared "fold:0"
"HakulaPlayer" declared "fold:0"
"SichengZuo" declared "fold:0"
"KLChen2PokerPlayer" declared "raise:19"
"Jinkun" declared "fold:19"
"NitWinWin" declared "fold:0"
"ZPlayer" declared "call:19"
"YangZ" declared "fold:0"
Street "flop" started. (community card = ['CT', 'H8', 'DQ'])
"ZPlayer" declared "raise:609"
"KLChen2PokerPlayer" declared "fold:0"
"['ZPlayer']" won the round 15 (stack = {'YangZ': 975, 'Ethan': 1103, 'HakulaPlayer': 195, 'SichengZuo': 970, 'KLChen2PokerPlayer': 1771, 'Jinkun': 1084, 'NitWinWin': 970, 'ZPlayer': 932})
player [YangZ] gets hole card ['D8', 'D9'], current stack 970
player [Ethan] gets hole card ['C6', 'S3'], current stack 1093
player [HakulaPlayer] gets hole card ['HT', 'D3'], current stack 195
player [SichengZuo] gets hole card ['CJ', 'ST'], current stack 970
player [KLChen2PokerPlayer] gets hole card ['S6', 'S9'], current stack 1771
player [Jinkun] gets hole card ['H9', 'CQ'], current stack 1084
player [NitWinWin] gets hole card ['D6', 'HK'], current stack 970
player [ZPlayer] gets hole card ['DJ', 'SA'], current stack 932
Started the round 16
Street "preflop" started. (community card = [])
"HakulaPlayer" declared "fold:0"
"SichengZuo" declared "fold:0"
"KLChen2PokerPlayer" declared "raise:23"
"Jinkun" declared "fold:23"
"NitWinWin" declared "fold:0"
"ZPlayer" declared "fold:0"
"YangZ" declared "fold:0"
"Ethan" declared "fold:0"
"['KLChen2PokerPlayer']" won the round 16 (stack = {'YangZ': 970, 'Ethan': 1093, 'HakulaPlayer': 195, 'SichengZuo': 970, 'KLChen2PokerPlayer': 1786, 'Jinkun': 1084, 'NitWinWin': 970, 'ZPlayer': 932})
player [YangZ] gets hole card ['S2', 'S8'], current stack 970
player [Ethan] gets hole card ['CJ', 'ST'], current stack 1088
player [HakulaPlayer] gets hole card ['DT', 'HJ'], current stack 185
player [SichengZuo] gets hole card ['SQ', 'CT'], current stack 970
player [KLChen2PokerPlayer] gets hole card ['CA', 'D5'], current stack 1786
player [Jinkun] gets hole card ['CK', 'DK'], current stack 1084
player [NitWinWin] gets hole card ['D6', 'D7'], current stack 970
player [ZPlayer] gets hole card ['H6', 'HK'], current stack 932
Started the round 17
Street "preflop" started. (community card = [])
"SichengZuo" declared "fold:0"
"KLChen2PokerPlayer" declared "call:10"
"Jinkun" declared "fold:10"
"NitWinWin" declared "fold:0"
"ZPlayer" declared "raise:15"
"YangZ" declared "fold:0"
"Ethan" declared "call:15"
"HakulaPlayer" declared "call:15"
"KLChen2PokerPlayer" declared "fold:0"
Street "flop" started. (community card = ['H4', 'H9', 'H5'])
"Ethan" declared "call:0"
"HakulaPlayer" declared "call:0"
"ZPlayer" declared "raise:144"
"Ethan" declared "fold:0"
"HakulaPlayer" declared "fold:0"
"['ZPlayer']" won the round 17 (stack = {'YangZ': 970, 'Ethan': 1078, 'HakulaPlayer': 180, 'SichengZuo': 970, 'KLChen2PokerPlayer': 1776, 'Jinkun': 1084, 'NitWinWin': 970, 'ZPlayer': 972})
player [YangZ] gets hole card ['C4', 'HK'], current stack 970
player [Ethan] gets hole card ['SK', 'C8'], current stack 1078
player [HakulaPlayer] gets hole card ['S9', 'C2'], current stack 175
player [SichengZuo] gets hole card ['CK', 'S2'], current stack 960
player [KLChen2PokerPlayer] gets hole card ['C7', 'SQ'], current stack 1776
player [Jinkun] gets hole card ['HQ', 'CQ'], current stack 1084
player [NitWinWin] gets hole card ['D2', 'DQ'], current stack 970
player [ZPlayer] gets hole card ['CA', 'H3'], current stack 972
Started the round 18
Street "preflop" started. (community card = [])
"KLChen2PokerPlayer" declared "fold:0"
"Jinkun" declared "fold:10"
"NitWinWin" declared "fold:0"
"ZPlayer" declared "raise:15"
"YangZ" declared "fold:0"
"Ethan" declared "fold:0"
"HakulaPlayer" declared "fold:0"
"SichengZuo" declared "fold:0"
"['ZPlayer']" won the round 18 (stack = {'YangZ': 970, 'Ethan': 1078, 'HakulaPlayer': 175, 'SichengZuo': 960, 'KLChen2PokerPlayer': 1776, 'Jinkun': 1084, 'NitWinWin': 970, 'ZPlayer': 987})
player [YangZ] gets hole card ['DQ', 'D4'], current stack 970
player [Ethan] gets hole card ['S5', 'D8'], current stack 1078
player [HakulaPlayer] gets hole card ['HT', 'D2'], current stack 175
player [SichengZuo] gets hole card ['CQ', 'DT'], current stack 955
player [KLChen2PokerPlayer] gets hole card ['S9', 'H4'], current stack 1766
player [Jinkun] gets hole card ['C5', 'H7'], current stack 1084
player [NitWinWin] gets hole card ['CK', 'SA'], current stack 970
player [ZPlayer] gets hole card ['ST', 'SQ'], current stack 987
Started the round 19
Street "preflop" started. (community card = [])
"Jinkun" declared "fold:10"
"NitWinWin" declared "fold:0"
"ZPlayer" declared "raise:15"
"YangZ" declared "fold:0"
"Ethan" declared "fold:0"
"HakulaPlayer" declared "fold:0"
"SichengZuo" declared "fold:0"
"KLChen2PokerPlayer" declared "fold:0"
"['ZPlayer']" won the round 19 (stack = {'YangZ': 970, 'Ethan': 1078, 'HakulaPlayer': 175, 'SichengZuo': 955, 'KLChen2PokerPlayer': 1766, 'Jinkun': 1084, 'NitWinWin': 970, 'ZPlayer': 1002})
player [YangZ] gets hole card ['C8', 'C4'], current stack 970
player [Ethan] gets hole card ['H7', 'C2'], current stack 1078
player [HakulaPlayer] gets hole card ['S2', 'DJ'], current stack 175
player [SichengZuo] gets hole card ['HQ', 'S7'], current stack 955
player [KLChen2PokerPlayer] gets hole card ['H3', 'SJ'], current stack 1761
player [Jinkun] gets hole card ['SK', 'S6'], current stack 1074
player [NitWinWin] gets hole card ['D6', 'HK'], current stack 970
player [ZPlayer] gets hole card ['S4', 'DT'], current stack 1002
Started the round 20
Street "preflop" started. (community card = [])
"NitWinWin" declared "fold:0"
"ZPlayer" declared "call:10"
"YangZ" declared "fold:0"
"Ethan" declared "fold:0"
"HakulaPlayer" declared "call:10"
"SichengZuo" declared "fold:0"
"KLChen2PokerPlayer" declared "fold:0"
"Jinkun" declared "call:10"
Street "flop" started. (community card = ['C5', 'C9', 'D5'])
"Jinkun" declared "raise:105"
"ZPlayer" declared "fold:0"
"HakulaPlayer" declared "fold:0"
"['Jinkun']" won the round 20 (stack = {'YangZ': 970, 'Ethan': 1078, 'HakulaPlayer': 165, 'SichengZuo': 955, 'KLChen2PokerPlayer': 1761, 'Jinkun': 1109, 'NitWinWin': 970, 'ZPlayer': 992})
player [YangZ] gets hole card ['DQ', 'S2'], current stack 970
player [Ethan] gets hole card ['C7', 'H8'], current stack 1078
player [HakulaPlayer] gets hole card ['C5', 'C2'], current stack 165
player [SichengZuo] gets hole card ['D4', 'S4'], current stack 955
player [KLChen2PokerPlayer] gets hole card ['D7', 'H6'], current stack 1761
player [Jinkun] gets hole card ['CQ', 'D2'], current stack 1104
player [NitWinWin] gets hole card ['S3', 'SQ'], current stack 960
player [ZPlayer] gets hole card ['DK', 'D6'], current stack 992
Started the round 21
Street "preflop" started. (community card = [])
"ZPlayer" declared "raise:15"
"YangZ" declared "fold:0"
"Ethan" declared "fold:0"
"HakulaPlayer" declared "fold:0"
"SichengZuo" declared "fold:0"
"KLChen2PokerPlayer" declared "fold:0"
"Jinkun" declared "fold:15"
"NitWinWin" declared "fold:0"
"['ZPlayer']" won the round 21 (stack = {'YangZ': 970, 'Ethan': 1078, 'HakulaPlayer': 165, 'SichengZuo': 955, 'KLChen2PokerPlayer': 1761, 'Jinkun': 1104, 'NitWinWin': 960, 'ZPlayer': 1007})
player [YangZ] gets hole card ['D7', 'H5'], current stack 970
player [Ethan] gets hole card ['CQ', 'S3'], current stack 1078
player [HakulaPlayer] gets hole card ['S4', 'SQ'], current stack 165
player [SichengZuo] gets hole card ['CT', 'S8'], current stack 955
player [KLChen2PokerPlayer] gets hole card ['DK', 'S7'], current stack 1761
player [Jinkun] gets hole card ['DQ', 'D8'], current stack 1104
player [NitWinWin] gets hole card ['H2', 'SA'], current stack 955
player [ZPlayer] gets hole card ['D6', 'CA'], current stack 997
Started the round 22
Street "preflop" started. (community card = [])
"YangZ" declared "fold:0"
"Ethan" declared "fold:0"
"HakulaPlayer" declared "fold:0"
"SichengZuo" declared "fold:0"
"KLChen2PokerPlayer" declared "call:10"
"Jinkun" declared "call:10"
"NitWinWin" declared "fold:0"
"ZPlayer" declared "raise:15"
"KLChen2PokerPlayer" declared "fold:0"
"Jinkun" declared "call:15"
Street "flop" started. (community card = ['H6', 'C7', 'D9'])
"ZPlayer" declared "call:0"
"Jinkun" declared "call:0"
Street "turn" started. (community card = ['H6', 'C7', 'D9', 'C5'])
"ZPlayer" declared "call:0"
"Jinkun" declared "raise:21"
"ZPlayer" declared "fold:0"
"['Jinkun']" won the round 22 (stack = {'YangZ': 970, 'Ethan': 1078, 'HakulaPlayer': 165, 'SichengZuo': 955, 'KLChen2PokerPlayer': 1751, 'Jinkun': 1134, 'NitWinWin': 955, 'ZPlayer': 992})
player [YangZ] gets hole card ['S3', 'S9'], current stack 960
player [Ethan] gets hole card ['HQ', 'H5'], current stack 1078
player [HakulaPlayer] gets hole card ['H6', 'SJ'], current stack 165
player [SichengZuo] gets hole card ['D2', 'S4'], current stack 955
player [KLChen2PokerPlayer] gets hole card ['S6', 'D9'], current stack 1751
player [Jinkun] gets hole card ['HK', 'CT'], current stack 1134
player [NitWinWin] gets hole card ['C8', 'H7'], current stack 955
player [ZPlayer] gets hole card ['C4', 'H3'], current stack 987
Started the round 23
Street "preflop" started. (community card = [])
"Ethan" declared "fold:0"
"HakulaPlayer" declared "fold:0"
"SichengZuo" declared "fold:0"
"KLChen2PokerPlayer" declared "fold:0"
"Jinkun" declared "call:10"
"NitWinWin" declared "fold:0"
"ZPlayer" declared "call:10"
"YangZ" declared "fold:0"
Street "flop" started. (community card = ['D8', 'D5', 'D4'])
"ZPlayer" declared "call:0"
"Jinkun" declared "call:0"
Street "turn" started. (community card = ['D8', 'D5', 'D4', 'H4'])
"ZPlayer" declared "raise:30"
"Jinkun" declared "fold:30"
"['ZPlayer']" won the round 23 (stack = {'YangZ': 960, 'Ethan': 1078, 'HakulaPlayer': 165, 'SichengZuo': 955, 'KLChen2PokerPlayer': 1751, 'Jinkun': 1124, 'NitWinWin': 955, 'ZPlayer': 1012})
player [YangZ] gets hole card ['S3', 'H5'], current stack 955
player [Ethan] gets hole card ['D3', 'HQ'], current stack 1068
player [HakulaPlayer] gets hole card ['D8', 'S6'], current stack 165
player [SichengZuo] gets hole card ['S9', 'H6'], current stack 955
player [KLChen2PokerPlayer] gets hole card ['DK', 'C5'], current stack 1751
player [Jinkun] gets hole card ['CA', 'S7'], current stack 1124
player [NitWinWin] gets hole card ['D6', 'CT'], current stack 955
player [ZPlayer] gets hole card ['H3', 'H4'], current stack 1012
Started the round 24
Street "preflop" started. (community card = [])
"HakulaPlayer" declared "fold:0"
"SichengZuo" declared "fold:0"
"KLChen2PokerPlayer" declared "call:10"
"Jinkun" declared "fold:10"
"NitWinWin" declared "fold:0"
"ZPlayer" declared "call:10"
"YangZ" declared "fold:0"
"Ethan" declared "fold:0"
Street "flop" started. (community card = ['DA', 'D7', 'D2'])
"KLChen2PokerPlayer" declared "raise:20"
"ZPlayer" declared "fold:0"
"['KLChen2PokerPlayer']" won the round 24 (stack = {'YangZ': 955, 'Ethan': 1068, 'HakulaPlayer': 165, 'SichengZuo': 955, 'KLChen2PokerPlayer': 1776, 'Jinkun': 1124, 'NitWinWin': 955, 'ZPlayer': 1002})
player [YangZ] gets hole card ['C3', 'S7'], current stack 955
player [Ethan] gets hole card ['DQ', 'H3'], current stack 1063
player [HakulaPlayer] gets hole card ['HA', 'D5'], current stack 155
player [SichengZuo] gets hole card ['CK', 'C7'], current stack 955
player [KLChen2PokerPlayer] gets hole card ['ST', 'DJ'], current stack 1776
player [Jinkun] gets hole card ['C4', 'HK'], current stack 1124
player [NitWinWin] gets hole card ['S4', 'SQ'], current stack 955
player [ZPlayer] gets hole card ['CQ', 'C2'], current stack 1002
Started the round 25
Street "preflop" started. (community card = [])
"SichengZuo" declared "fold:0"
"KLChen2PokerPlayer" declared "raise:15"
"Jinkun" declared "fold:15"
"NitWinWin" declared "fold:0"
"ZPlayer" declared "call:15"
"YangZ" declared "fold:0"
"Ethan" declared "fold:0"
"HakulaPlayer" declared "call:15"
Street "flop" started. (community card = ['D2', 'H6', 'SJ'])
"HakulaPlayer" declared "call:0"
"KLChen2PokerPlayer" declared "raise:23"
"ZPlayer" declared "fold:0"
"HakulaPlayer" declared "fold:0"
"['KLChen2PokerPlayer']" won the round 25 (stack = {'YangZ': 955, 'Ethan': 1063, 'HakulaPlayer': 150, 'SichengZuo': 955, 'KLChen2PokerPlayer': 1811, 'Jinkun': 1124, 'NitWinWin': 955, 'ZPlayer': 987})
player [YangZ] gets hole card ['H4', 'HT'], current stack 955
player [Ethan] gets hole card ['SA', 'HA'], current stack 1063
player [HakulaPlayer] gets hole card ['H6', 'H9'], current stack 145
player [SichengZuo] gets hole card ['DK', 'S5'], current stack 945
player [KLChen2PokerPlayer] gets hole card ['D6', 'HQ'], current stack 1811
player [Jinkun] gets hole card ['S6', 'D5'], current stack 1124
player [NitWinWin] gets hole card ['H7', 'CK'], current stack 955
player [ZPlayer] gets hole card ['DQ', 'C2'], current stack 987
Started the round 26
Street "preflop" started. (community card = [])
"KLChen2PokerPlayer" declared "fold:0"
"Jinkun" declared "fold:10"
"NitWinWin" declared "fold:0"
"ZPlayer" declared "call:10"
"YangZ" declared "fold:0"
"Ethan" declared "raise:318"
"HakulaPlayer" declared "fold:0"
"SichengZuo" declared "fold:0"
"ZPlayer" declared "fold:0"
"['Ethan']" won the round 26 (stack = {'YangZ': 955, 'Ethan': 1088, 'HakulaPlayer': 145, 'SichengZuo': 945, 'KLChen2PokerPlayer': 1811, 'Jinkun': 1124, 'NitWinWin': 955, 'ZPlayer': 977})
player [YangZ] gets hole card ['S5', 'D7'], current stack 955
player [Ethan] gets hole card ['H4', 'S7'], current stack 1088
player [HakulaPlayer] gets hole card ['D9', 'S8'], current stack 145
player [SichengZuo] gets hole card ['DQ', 'SQ'], current stack 940
player [KLChen2PokerPlayer] gets hole card ['H5', 'HK'], current stack 1801
player [Jinkun] gets hole card ['D6', 'C9'], current stack 1124
player [NitWinWin] gets hole card ['H2', 'DJ'], current stack 955
player [ZPlayer] gets hole card ['CT', 'D2'], current stack 977
Started the round 27
Street "preflop" started. (community card = [])
"Jinkun" declared "fold:10"
"NitWinWin" declared "fold:0"
"ZPlayer" declared "call:10"
"YangZ" declared "fold:0"
"Ethan" declared "fold:0"
"HakulaPlayer" declared "call:10"
"SichengZuo" declared "fold:0"
"KLChen2PokerPlayer" declared "raise:27"
"ZPlayer" declared "call:27"
"HakulaPlayer" declared "call:27"
Street "flop" started. (community card = ['SA', 'HA', 'D8'])
"KLChen2PokerPlayer" declared "raise:12"
"ZPlayer" declared "fold:0"
"HakulaPlayer" declared "call:12"
Street "turn" started. (community card = ['SA', 'HA', 'D8', 'H9'])
"KLChen2PokerPlayer" declared "raise:177"
"HakulaPlayer" declared "call:177"
Street "river" started. (community card = ['SA', 'HA', 'D8', 'H9', 'C4'])
"['HakulaPlayer']" won the round 27 (stack = {'YangZ': 955, 'Ethan': 1088, 'HakulaPlayer': 322, 'SichengZuo': 940, 'KLChen2PokerPlayer': 1666, 'Jinkun': 1124, 'NitWinWin': 955, 'ZPlayer': 950})
player [YangZ] gets hole card ['H7', 'CJ'], current stack 955
player [Ethan] gets hole card ['C8', 'D6'], current stack 1088
player [HakulaPlayer] gets hole card ['H4', 'C3'], current stack 322
player [SichengZuo] gets hole card ['SA', 'DT'], current stack 940
player [KLChen2PokerPlayer] gets hole card ['SK', 'S2'], current stack 1661
player [Jinkun] gets hole card ['HQ', 'D9'], current stack 1114
player [NitWinWin] gets hole card ['DQ', 'S7'], current stack 955
player [ZPlayer] gets hole card ['S9', 'SQ'], current stack 950
Started the round 28
Street "preflop" started. (community card = [])
"NitWinWin" declared "fold:0"
"ZPlayer" declared "raise:15"
"YangZ" declared "fold:0"
"Ethan" declared "fold:0"
"HakulaPlayer" declared "fold:0"
"SichengZuo" declared "fold:0"
"KLChen2PokerPlayer" declared "raise:20"
"Jinkun" declared "fold:20"
"ZPlayer" declared "call:20"
Street "flop" started. (community card = ['CA', 'S4', 'HA'])
"KLChen2PokerPlayer" declared "raise:14"
"ZPlayer" declared "fold:0"
"['KLChen2PokerPlayer']" won the round 28 (stack = {'YangZ': 955, 'Ethan': 1088, 'HakulaPlayer': 322, 'SichengZuo': 940, 'KLChen2PokerPlayer': 1696, 'Jinkun': 1114, 'NitWinWin': 955, 'ZPlayer': 930})
player [YangZ] gets hole card ['D7', 'D8'], current stack 955
player [Ethan] gets hole card ['HT', 'HA'], current stack 1088
player [HakulaPlayer] gets hole card ['CK', 'DK'], current stack 322
player [SichengZuo] gets hole card ['C6', 'CT'], current stack 940
player [KLChen2PokerPlayer] gets hole card ['SQ', 'S4'], current stack 1696
player [Jinkun] gets hole card ['D9', 'DA'], current stack 1109
player [NitWinWin] gets hole card ['C5', 'S8'], current stack 945
player [ZPlayer] gets hole card ['SK', 'CA'], current stack 930
Started the round 29
Street "preflop" started. (community card = [])
"ZPlayer" declared "raise:15"
"YangZ" declared "fold:0"
"Ethan" declared "call:15"
"HakulaPlayer" declared "raise:56"
"SichengZuo" declared "fold:0"
"KLChen2PokerPlayer" declared "fold:0"
"Jinkun" declared "fold:56"
"NitWinWin" declared "fold:0"
"ZPlayer" declared "call:56"
"Ethan" declared "call:56"
Street "flop" started. (community card = ['C4', 'DJ', 'CJ'])
"ZPlayer" declared "raise:10"
"Ethan" declared "call:10"
"HakulaPlayer" declared "raise:201"
"ZPlayer" declared "fold:0"
"Ethan" declared "call:201"
Street "turn" started. (community card = ['C4', 'DJ', 'CJ', 'S2'])
"Ethan" declared "call:0"
"HakulaPlayer" declared "raise:65"
"Ethan" declared "call:65"
Street "river" started. (community card = ['C4', 'DJ', 'CJ', 'S2', 'DT'])
"['HakulaPlayer']" won the round 29 (stack = {'YangZ': 955, 'Ethan': 766, 'HakulaPlayer': 725, 'SichengZuo': 940, 'KLChen2PokerPlayer': 1696, 'Jinkun': 1109, 'NitWinWin': 945, 'ZPlayer': 864})
player [YangZ] gets hole card ['C4', 'D9'], current stack 955
player [Ethan] gets hole card ['HK', 'DQ'], current stack 766
player [HakulaPlayer] gets hole card ['H9', 'CK'], current stack 725
player [SichengZuo] gets hole card ['H5', 'SJ'], current stack 940
player [KLChen2PokerPlayer] gets hole card ['DA', 'SK'], current stack 1696
player [Jinkun] gets hole card ['C2', 'SQ'], current stack 1109
player [NitWinWin] gets hole card ['HT', 'CT'], current stack 940
player [ZPlayer] gets hole card ['HA', 'S7'], current stack 854
Started the round 30
Street "preflop" started. (community card = [])
"YangZ" declared "fold:0"
"Ethan" declared "raise:114"
"HakulaPlayer" declared "fold:0"
"SichengZuo" declared "fold:0"
"KLChen2PokerPlayer" declared "call:114"
"Jinkun" declared "fold:114"
"NitWinWin" declared "fold:0"
"ZPlayer" declared "call:114"
Street "flop" started. (community card = ['C5', 'HJ', 'CA'])
"ZPlayer" declared "raise:347"
"Ethan" declared "fold:0"
"KLChen2PokerPlayer" declared "call:347"
Street "turn" started. (community card = ['C5', 'HJ', 'CA', 'DK'])
"ZPlayer" declared "raise:10"
"KLChen2PokerPlayer" declared "raise:599"
"ZPlayer" declared "call:599"
Street "river" started. (community card = ['C5', 'HJ', 'CA', 'DK', 'DT'])
"['KLChen2PokerPlayer']" won the round 30 (stack = {'YangZ': 955, 'Ethan': 652, 'HakulaPlayer': 725, 'SichengZuo': 940, 'KLChen2PokerPlayer': 2679, 'Jinkun': 1109, 'NitWinWin': 940, 'ZPlayer': 0})
player [YangZ] gets hole card ['C3', 'DJ'], current stack 950
player [Ethan] gets hole card ['D9', 'S2'], current stack 642
player [HakulaPlayer] gets hole card ['SA', 'D7'], current stack 725
player [SichengZuo] gets hole card ['D5', 'C2'], current stack 940
player [KLChen2PokerPlayer] gets hole card ['H2', 'H7'], current stack 2679
player [Jinkun] gets hole card ['D6', 'C6'], current stack 1109
player [NitWinWin] gets hole card ['SJ', 'HA'], current stack 940
Started the round 31
Street "preflop" started. (community card = [])
"HakulaPlayer" declared "call:10"
"SichengZuo" declared "fold:0"
"KLChen2PokerPlayer" declared "fold:0"
"Jinkun" declared "fold:10"
"NitWinWin" declared "fold:0"
"YangZ" declared "fold:0"
"Ethan" declared "fold:0"
"['HakulaPlayer']" won the round 31 (stack = {'YangZ': 950, 'Ethan': 642, 'HakulaPlayer': 740, 'SichengZuo': 940, 'KLChen2PokerPlayer': 2679, 'Jinkun': 1109, 'NitWinWin': 940, 'ZPlayer': 0})
player [YangZ] gets hole card ['C5', 'S5'], current stack 950
player [Ethan] gets hole card ['C4', 'HA'], current stack 637
player [HakulaPlayer] gets hole card ['C6', 'H3'], current stack 730
player [SichengZuo] gets hole card ['D8', 'S2'], current stack 940
player [KLChen2PokerPlayer] gets hole card ['H4', 'S8'], current stack 2679
player [Jinkun] gets hole card ['S3', 'H6'], current stack 1109
player [NitWinWin] gets hole card ['C7', 'D5'], current stack 940
Started the round 32
Street "preflop" started. (community card = [])
"SichengZuo" declared "fold:0"
"KLChen2PokerPlayer" declared "fold:0"
"Jinkun" declared "fold:10"
"NitWinWin" declared "fold:0"
"YangZ" declared "fold:0"
"Ethan" declared "call:10"
"HakulaPlayer" declared "call:10"
Street "flop" started. (community card = ['DQ', 'H5', 'H2'])
"Ethan" declared "call:0"
"HakulaPlayer" declared "call:0"
Street "turn" started. (community card = ['DQ', 'H5', 'H2', 'DJ'])
"Ethan" declared "call:0"
"HakulaPlayer" declared "raise:10"
"Ethan" declared "fold:0"
"['HakulaPlayer']" won the round 32 (stack = {'YangZ': 950, 'Ethan': 632, 'HakulaPlayer': 750, 'SichengZuo': 940, 'KLChen2PokerPlayer': 2679, 'Jinkun': 1109, 'NitWinWin': 940, 'ZPlayer': 0})
player [YangZ] gets hole card ['H4', 'C2'], current stack 950
player [Ethan] gets hole card ['C7', 'C9'], current stack 632
player [HakulaPlayer] gets hole card ['S2', 'CT'], current stack 745
player [SichengZuo] gets hole card ['SK', 'C3'], current stack 930
player [KLChen2PokerPlayer] gets hole card ['SQ', 'DT'], current stack 2679
player [Jinkun] gets hole card ['S4', 'HK'], current stack 1109
player [NitWinWin] gets hole card ['SA', 'S6'], current stack 940
Started the round 33
Street "preflop" started. (community card = [])
"KLChen2PokerPlayer" declared "raise:26"
"Jinkun" declared "fold:26"
"NitWinWin" declared "fold:0"
"YangZ" declared "fold:0"
"Ethan" declared "fold:0"
"HakulaPlayer" declared "fold:0"
"SichengZuo" declared "fold:0"
"['KLChen2PokerPlayer']" won the round 33 (stack = {'YangZ': 950, 'Ethan': 632, 'HakulaPlayer': 745, 'SichengZuo': 930, 'KLChen2PokerPlayer': 2694, 'Jinkun': 1109, 'NitWinWin': 940, 'ZPlayer': 0})
player [YangZ] gets hole card ['S3', 'CA'], current stack 950
player [Ethan] gets hole card ['DQ', 'HQ'], current stack 632
player [HakulaPlayer] gets hole card ['D9', 'HJ'], current stack 745
player [SichengZuo] gets hole card ['SA', 'H7'], current stack 925
player [KLChen2PokerPlayer] gets hole card ['S2', 'H8'], current stack 2684
player [Jinkun] gets hole card ['DK', 'H9'], current stack 1109
player [NitWinWin] gets hole card ['CQ', 'D4'], current stack 940
Started the round 34
Street "preflop" started. (community card = [])
"Jinkun" declared "fold:10"
"NitWinWin" declared "fold:0"
"YangZ" declared "fold:0"
"Ethan" declared "raise:189"
"HakulaPlayer" declared "fold:0"
"SichengZuo" declared "fold:0"
"KLChen2PokerPlayer" declared "fold:0"
"['Ethan']" won the round 34 (stack = {'YangZ': 950, 'Ethan': 647, 'HakulaPlayer': 745, 'SichengZuo': 925, 'KLChen2PokerPlayer': 2684, 'Jinkun': 1109, 'NitWinWin': 940, 'ZPlayer': 0})
player [YangZ] gets hole card ['SQ', 'CA'], current stack 950
player [Ethan] gets hole card ['D5', 'SJ'], current stack 647
player [HakulaPlayer] gets hole card ['H7', 'CQ'], current stack 745
player [SichengZuo] gets hole card ['S4', 'DQ'], current stack 925
player [KLChen2PokerPlayer] gets hole card ['S6', 'S9'], current stack 2679
player [Jinkun] gets hole card ['D2', 'HT'], current stack 1099
player [NitWinWin] gets hole card ['H8', 'C5'], current stack 940
Started the round 35
Street "preflop" started. (community card = [])
"NitWinWin" declared "fold:0"
"YangZ" declared "fold:0"
"Ethan" declared "fold:0"
"HakulaPlayer" declared "call:10"
"SichengZuo" declared "fold:0"
"KLChen2PokerPlayer" declared "call:10"
"Jinkun" declared "call:10"
Street "flop" started. (community card = ['DA', 'H2', 'DJ'])
"KLChen2PokerPlayer" declared "call:0"
"Jinkun" declared "call:0"
"HakulaPlayer" declared "call:0"
Street "turn" started. (community card = ['DA', 'H2', 'DJ', 'DT'])
"KLChen2PokerPlayer" declared "call:0"
"Jinkun" declared "call:0"
"HakulaPlayer" declared "call:0"
Street "river" started. (community card = ['DA', 'H2', 'DJ', 'DT', 'H3'])
"KLChen2PokerPlayer" declared "call:0"
"Jinkun" declared "call:0"
"HakulaPlayer" declared "call:0"
"['Jinkun']" won the round 35 (stack = {'YangZ': 950, 'Ethan': 647, 'HakulaPlayer': 735, 'SichengZuo': 925, 'KLChen2PokerPlayer': 2674, 'Jinkun': 1129, 'NitWinWin': 940, 'ZPlayer': 0})
player [YangZ] gets hole card ['D7', 'S3'], current stack 950
player [Ethan] gets hole card ['D4', 'C9'], current stack 647
player [HakulaPlayer] gets hole card ['S4', 'DA'], current stack 735
player [SichengZuo] gets hole card ['H9', 'HJ'], current stack 925
player [KLChen2PokerPlayer] gets hole card ['D3', 'C3'], current stack 2674
player [Jinkun] gets hole card ['SK', 'H5'], current stack 1124
player [NitWinWin] gets hole card ['H4', 'C6'], current stack 930
Started the round 36
Street "preflop" started. (community card = [])
"YangZ" declared "fold:0"
"Ethan" declared "fold:0"
"HakulaPlayer" declared "call:10"
"SichengZuo" declared "fold:0"
"KLChen2PokerPlayer" declared "call:10"
"Jinkun" declared "call:10"
"NitWinWin" declared "fold:0"
Street "flop" started. (community card = ['SA', 'DQ', 'H8'])
"Jinkun" declared "call:0"
"HakulaPlayer" declared "call:0"
"KLChen2PokerPlayer" declared "call:0"
Street "turn" started. (community card = ['SA', 'DQ', 'H8', 'D2'])
"Jinkun" declared "call:0"
"HakulaPlayer" declared "raise:48"
"KLChen2PokerPlayer" declared "fold:0"
"Jinkun" declared "fold:48"
"['HakulaPlayer']" won the round 36 (stack = {'YangZ': 950, 'Ethan': 647, 'HakulaPlayer': 765, 'SichengZuo': 925, 'KLChen2PokerPlayer': 2664, 'Jinkun': 1119, 'NitWinWin': 930, 'ZPlayer': 0})
player [YangZ] gets hole card ['DJ', 'DK'], current stack 940
player [Ethan] gets hole card ['HQ', 'HK'], current stack 647
player [HakulaPlayer] gets hole card ['C3', 'D7'], current stack 765
player [SichengZuo] gets hole card ['H8', 'DQ'], current stack 925
player [KLChen2PokerPlayer] gets hole card ['C4', 'CT'], current stack 2664
player [Jinkun] gets hole card ['H7', 'ST'], current stack 1119
player [NitWinWin] gets hole card ['CQ', 'H2'], current stack 925
Started the round 37
Street "preflop" started. (community card = [])
"Ethan" declared "raise:97"
"HakulaPlayer" declared "fold:0"
"SichengZuo" declared "fold:0"
"KLChen2PokerPlayer" declared "fold:0"
"Jinkun" declared "fold:97"
"NitWinWin" declared "fold:0"
"YangZ" declared "fold:0"
"['Ethan']" won the round 37 (stack = {'YangZ': 940, 'Ethan': 662, 'HakulaPlayer': 765, 'SichengZuo': 925, 'KLChen2PokerPlayer': 2664, 'Jinkun': 1119, 'NitWinWin': 925, 'ZPlayer': 0})
player [YangZ] gets hole card ['DK', 'H7'], current stack 935
player [Ethan] gets hole card ['C8', 'H8'], current stack 652
player [HakulaPlayer] gets hole card ['D9', 'H3'], current stack 765
player [SichengZuo] gets hole card ['DT', 'ST'], current stack 925
player [KLChen2PokerPlayer] gets hole card ['D6', 'SJ'], current stack 2664
player [Jinkun] gets hole card ['CK', 'S6'], current stack 1119
player [NitWinWin] gets hole card ['D7', 'H6'], current stack 925
Started the round 38
Street "preflop" started. (community card = [])
"HakulaPlayer" declared "fold:0"
"SichengZuo" declared "fold:0"
"KLChen2PokerPlayer" declared "fold:0"
"Jinkun" declared "call:10"
"NitWinWin" declared "fold:0"
"YangZ" declared "fold:0"
"Ethan" declared "raise:39"
"Jinkun" declared "fold:39"
"['Ethan']" won the round 38 (stack = {'YangZ': 935, 'Ethan': 677, 'HakulaPlayer': 765, 'SichengZuo': 925, 'KLChen2PokerPlayer': 2664, 'Jinkun': 1109, 'NitWinWin': 925, 'ZPlayer': 0})
player [YangZ] gets hole card ['CK', 'DJ'], current stack 935
player [Ethan] gets hole card ['HT', 'CJ'], current stack 672
player [HakulaPlayer] gets hole card ['DQ', 'D2'], current stack 755
player [SichengZuo] gets hole card ['C6', 'D4'], current stack 925
player [KLChen2PokerPlayer] gets hole card ['CA', 'H7'], current stack 2664
player [Jinkun] gets hole card ['S4', 'C7'], current stack 1109
player [NitWinWin] gets hole card ['S3', 'HQ'], current stack 925
Started the round 39
Street "preflop" started. (community card = [])
"SichengZuo" declared "fold:0"
"KLChen2PokerPlayer" declared "call:10"
"Jinkun" declared "fold:10"
"NitWinWin" declared "fold:0"
"YangZ" declared "fold:0"
"Ethan" declared "raise:40"
"HakulaPlayer" declared "call:40"
"KLChen2PokerPlayer" declared "fold:0"
Street "flop" started. (community card = ['D8', 'H8', 'S5'])
"Ethan" declared "call:0"
"HakulaPlayer" declared "raise:84"
"Ethan" declared "fold:0"
"['HakulaPlayer']" won the round 39 (stack = {'YangZ': 935, 'Ethan': 637, 'HakulaPlayer': 815, 'SichengZuo': 925, 'KLChen2PokerPlayer': 2654, 'Jinkun': 1109, 'NitWinWin': 925, 'ZPlayer': 0})
player [YangZ] gets hole card ['HA', 'SK'], current stack 935
player [Ethan] gets hole card ['C7', 'ST'], current stack 637
player [HakulaPlayer] gets hole card ['CT', 'DK'], current stack 810
player [SichengZuo] gets hole card ['CQ', 'D7'], current stack 915
player [KLChen2PokerPlayer] gets hole card ['CA', 'HJ'], current stack 2654
player [Jinkun] gets hole card ['H6', 'C3'], current stack 1109
player [NitWinWin] gets hole card ['C6', 'S4'], current stack 925
Started the round 40
Street "preflop" started. (community card = [])
"KLChen2PokerPlayer" declared "raise:22"
"Jinkun" declared "fold:22"
"NitWinWin" declared "fold:0"
"YangZ" declared "fold:0"
"Ethan" declared "fold:0"
"HakulaPlayer" declared "call:22"
"SichengZuo" declared "fold:0"
Street "flop" started. (community card = ['S8', 'S9', 'C2'])
"HakulaPlayer" declared "call:0"
"KLChen2PokerPlayer" declared "raise:18"
"HakulaPlayer" declared "fold:0"
"['KLChen2PokerPlayer']" won the round 40 (stack = {'YangZ': 935, 'Ethan': 637, 'HakulaPlayer': 793, 'SichengZuo': 915, 'KLChen2PokerPlayer': 2686, 'Jinkun': 1109, 'NitWinWin': 925, 'ZPlayer': 0})
player [YangZ] gets hole card ['D6', 'C8'], current stack 935
player [Ethan] gets hole card ['S6', 'C2'], current stack 637
player [HakulaPlayer] gets hole card ['DA', 'CJ'], current stack 793
player [SichengZuo] gets hole card ['CK', 'H9'], current stack 910
player [KLChen2PokerPlayer] gets hole card ['S4', 'D5'], current stack 2676
player [Jinkun] gets hole card ['HJ', 'SA'], current stack 1109
player [NitWinWin] gets hole card ['DT', 'H4'], current stack 925
Started the round 41
Street "preflop" started. (community card = [])
"Jinkun" declared "fold:10"
"NitWinWin" declared "fold:0"
"YangZ" declared "fold:0"
"Ethan" declared "fold:0"
"HakulaPlayer" declared "call:10"
"SichengZuo" declared "fold:0"
"KLChen2PokerPlayer" declared "fold:0"
"['HakulaPlayer']" won the round 41 (stack = {'YangZ': 935, 'Ethan': 637, 'HakulaPlayer': 808, 'SichengZuo': 910, 'KLChen2PokerPlayer': 2676, 'Jinkun': 1109, 'NitWinWin': 925, 'ZPlayer': 0})
player [YangZ] gets hole card ['C7', 'H4'], current stack 935
player [Ethan] gets hole card ['S2', 'HA'], current stack 637
player [HakulaPlayer] gets hole card ['D5', 'S8'], current stack 808
player [SichengZuo] gets hole card ['CJ', 'C5'], current stack 910
player [KLChen2PokerPlayer] gets hole card ['HT', 'D3'], current stack 2671
player [Jinkun] gets hole card ['DA', 'DK'], current stack 1099
player [NitWinWin] gets hole card ['D7', 'H3'], current stack 925
Started the round 42
Street "preflop" started. (community card = [])
"NitWinWin" declared "fold:0"
"YangZ" declared "fold:0"
"Ethan" declared "fold:0"
"HakulaPlayer" declared "fold:0"
"SichengZuo" declared "fold:0"
"KLChen2PokerPlayer" declared "fold:0"
"['Jinkun']" won the round 42 (stack = {'YangZ': 935, 'Ethan': 637, 'HakulaPlayer': 808, 'SichengZuo': 910, 'KLChen2PokerPlayer': 2671, 'Jinkun': 1114, 'NitWinWin': 925, 'ZPlayer': 0})
player [YangZ] gets hole card ['CT', 'SJ'], current stack 935
player [Ethan] gets hole card ['CK', 'ST'], current stack 637
player [HakulaPlayer] gets hole card ['S4', 'S7'], current stack 808
player [SichengZuo] gets hole card ['C3', 'SQ'], current stack 910
player [KLChen2PokerPlayer] gets hole card ['CJ', 'C8'], current stack 2671
player [Jinkun] gets hole card ['D2', 'DA'], current stack 1109
player [NitWinWin] gets hole card ['DJ', 'S8'], current stack 915
Started the round 43
Street "preflop" started. (community card = [])
"YangZ" declared "fold:0"
"Ethan" declared "fold:0"
"HakulaPlayer" declared "fold:0"
"SichengZuo" declared "fold:0"
"KLChen2PokerPlayer" declared "fold:0"
"Jinkun" declared "call:10"
"NitWinWin" declared "fold:0"
"['Jinkun']" won the round 43 (stack = {'YangZ': 935, 'Ethan': 637, 'HakulaPlayer': 808, 'SichengZuo': 910, 'KLChen2PokerPlayer': 2671, 'Jinkun': 1124, 'NitWinWin': 915, 'ZPlayer': 0})
player [YangZ] gets hole card ['D6', 'CT'], current stack 925
player [Ethan] gets hole card ['S2', 'ST'], current stack 637
player [HakulaPlayer] gets hole card ['CJ', 'D5'], current stack 808
player [SichengZuo] gets hole card ['D2', 'C2'], current stack 910
player [KLChen2PokerPlayer] gets hole card ['C8', 'S9'], current stack 2671
player [Jinkun] gets hole card ['DT', 'CQ'], current stack 1124
player [NitWinWin] gets hole card ['H5', 'S6'], current stack 910
Started the round 44
Street "preflop" started. (community card = [])
"Ethan" declared "fold:0"
"HakulaPlayer" declared "fold:0"
"SichengZuo" declared "fold:0"
"KLChen2PokerPlayer" declared "fold:0"
"Jinkun" declared "call:10"
"NitWinWin" declared "fold:0"
"YangZ" declared "fold:0"
"['Jinkun']" won the round 44 (stack = {'YangZ': 925, 'Ethan': 637, 'HakulaPlayer': 808, 'SichengZuo': 910, 'KLChen2PokerPlayer': 2671, 'Jinkun': 1139, 'NitWinWin': 910, 'ZPlayer': 0})
player [YangZ] gets hole card ['D2', 'DT'], current stack 920
player [Ethan] gets hole card ['HK', 'C9'], current stack 627
player [HakulaPlayer] gets hole card ['DK', 'DA'], current stack 808
player [SichengZuo] gets hole card ['HJ', 'H5'], current stack 910
player [KLChen2PokerPlayer] gets hole card ['C8', 'C7'], current stack 2671
player [Jinkun] gets hole card ['CT', 'H4'], current stack 1139
player [NitWinWin] gets hole card ['CJ', 'S6'], current stack 910
Started the round 45
Street "preflop" started. (community card = [])
"HakulaPlayer" declared "call:10"
"SichengZuo" declared "fold:0"
"KLChen2PokerPlayer" declared "fold:0"
"Jinkun" declared "fold:10"
"NitWinWin" declared "fold:0"
"YangZ" declared "fold:0"
"Ethan" declared "call:10"
Street "flop" started. (community card = ['D4', 'CA', 'S4'])
"Ethan" declared "call:0"
"HakulaPlayer" declared "raise:37"
"Ethan" declared "call:37"
Street "turn" started. (community card = ['D4', 'CA', 'S4', 'HQ'])
"Ethan" declared "call:0"
"HakulaPlayer" declared "raise:162"
"Ethan" declared "call:162"
Street "river" started. (community card = ['D4', 'CA', 'S4', 'HQ', 'H6'])
"Ethan" declared "call:0"
"HakulaPlayer" declared "raise:580"
"Ethan" declared "fold:0"
"['HakulaPlayer']" won the round 45 (stack = {'YangZ': 920, 'Ethan': 428, 'HakulaPlayer': 1022, 'SichengZuo': 910, 'KLChen2PokerPlayer': 2671, 'Jinkun': 1139, 'NitWinWin': 910, 'ZPlayer': 0})
player [YangZ] gets hole card ['S2', 'S6'], current stack 920
player [Ethan] gets hole card ['H6', 'C8'], current stack 423
player [HakulaPlayer] gets hole card ['SK', 'CA'], current stack 1012
player [SichengZuo] gets hole card ['C7', 'C4'], current stack 910
player [KLChen2PokerPlayer] gets hole card ['H5', 'C2'], current stack 2671
player [Jinkun] gets hole card ['D2', 'DT'], current stack 1139
player [NitWinWin] gets hole card ['DQ', 'S5'], current stack 910
Started the round 46
Street "preflop" started. (community card = [])
"SichengZuo" declared "fold:0"
"KLChen2PokerPlayer" declared "fold:0"
"Jinkun" declared "fold:10"
"NitWinWin" declared "fold:0"
"YangZ" declared "fold:0"
"Ethan" declared "fold:0"
"['HakulaPlayer']" won the round 46 (stack = {'YangZ': 920, 'Ethan': 423, 'HakulaPlayer': 1027, 'SichengZuo': 910, 'KLChen2PokerPlayer': 2671, 'Jinkun': 1139, 'NitWinWin': 910, 'ZPlayer': 0})
player [YangZ] gets hole card ['C4', 'CA'], current stack 920
player [Ethan] gets hole card ['DA', 'HA'], current stack 423
player [HakulaPlayer] gets hole card ['HQ', 'S5'], current stack 1022
player [SichengZuo] gets hole card ['C8', 'H8'], current stack 900
player [KLChen2PokerPlayer] gets hole card ['C6', 'D4'], current stack 2671
player [Jinkun] gets hole card ['D3', 'S8'], current stack 1139
player [NitWinWin] gets hole card ['SJ', 'CT'], current stack 910
Started the round 47
Street "preflop" started. (community card = [])
"KLChen2PokerPlayer" declared "fold:0"
"Jinkun" declared "fold:10"
"NitWinWin" declared "fold:0"
"YangZ" declared "fold:0"
"Ethan" declared "raise:126"
"HakulaPlayer" declared "fold:0"
"SichengZuo" declared "fold:0"
"['Ethan']" won the round 47 (stack = {'YangZ': 920, 'Ethan': 438, 'HakulaPlayer': 1022, 'SichengZuo': 900, 'KLChen2PokerPlayer': 2671, 'Jinkun': 1139, 'NitWinWin': 910, 'ZPlayer': 0})
player [YangZ] gets hole card ['D6', 'HA'], current stack 920
player [Ethan] gets hole card ['H3', 'C3'], current stack 438
player [HakulaPlayer] gets hole card ['HJ', 'H6'], current stack 1022
player [SichengZuo] gets hole card ['D5', 'DJ'], current stack 895
player [KLChen2PokerPlayer] gets hole card ['DT', 'C7'], current stack 2661
player [Jinkun] gets hole card ['SJ', 'S2'], current stack 1139
player [NitWinWin] gets hole card ['CT', 'HK'], current stack 910
Started the round 48
Street "preflop" started. (community card = [])
"Jinkun" declared "fold:10"
"NitWinWin" declared "fold:0"
"YangZ" declared "fold:0"
"Ethan" declared "fold:0"
"HakulaPlayer" declared "call:10"
"SichengZuo" declared "fold:0"
"KLChen2PokerPlayer" declared "fold:0"
"['HakulaPlayer']" won the round 48 (stack = {'YangZ': 920, 'Ethan': 438, 'HakulaPlayer': 1037, 'SichengZuo': 895, 'KLChen2PokerPlayer': 2661, 'Jinkun': 1139, 'NitWinWin': 910, 'ZPlayer': 0})
player [YangZ] gets hole card ['H8', 'D9'], current stack 920
player [Ethan] gets hole card ['DT', 'C4'], current stack 438
player [HakulaPlayer] gets hole card ['HT', 'C2'], current stack 1037
player [SichengZuo] gets hole card ['CT', 'S3'], current stack 895
player [KLChen2PokerPlayer] gets hole card ['C7', 'D2'], current stack 2656
player [Jinkun] gets hole card ['S2', 'H6'], current stack 1129
player [NitWinWin] gets hole card ['SQ', 'C9'], current stack 910
Started the round 49
Street "preflop" started. (community card = [])
"NitWinWin" declared "fold:0"
"YangZ" declared "fold:0"
"Ethan" declared "fold:0"
"HakulaPlayer" declared "fold:0"
"SichengZuo" declared "fold:0"
"KLChen2PokerPlayer" declared "fold:0"
"['Jinkun']" won the round 49 (stack = {'YangZ': 920, 'Ethan': 438, 'HakulaPlayer': 1037, 'SichengZuo': 895, 'KLChen2PokerPlayer': 2656, 'Jinkun': 1144, 'NitWinWin': 910, 'ZPlayer': 0})
player [YangZ] gets hole card ['SK', 'C8'], current stack 920
player [Ethan] gets hole card ['DQ', 'D4'], current stack 438
player [HakulaPlayer] gets hole card ['SA', 'DA'], current stack 1037
player [SichengZuo] gets hole card ['H4', 'DT'], current stack 895
player [KLChen2PokerPlayer] gets hole card ['D5', 'S8'], current stack 2656
player [Jinkun] gets hole card ['S7', 'S2'], current stack 1139
player [NitWinWin] gets hole card ['C9', 'CK'], current stack 900
Started the round 50
Street "preflop" started. (community card = [])
"YangZ" declared "fold:0"
"Ethan" declared "fold:0"
"HakulaPlayer" declared "raise:42"
"SichengZuo" declared "fold:0"
"KLChen2PokerPlayer" declared "fold:0"
"Jinkun" declared "fold:42"
"NitWinWin" declared "fold:0"
"['HakulaPlayer']" won the round 50 (stack = {'YangZ': 920, 'Ethan': 438, 'HakulaPlayer': 1052, 'SichengZuo': 895, 'KLChen2PokerPlayer': 2656, 'Jinkun': 1139, 'NitWinWin': 900, 'ZPlayer': 0})

Game Results:
------------------------------------------------------------
Game 1:
Winner: KLChen2PokerPlayer (stack: 2656)
All players' stacks:
  YangZ: 920
  Ethan: 438
  HakulaPlayer: 1052
  SichengZuo: 895
  KLChen2PokerPlayer: 2656
  Jinkun: 1139
  NitWinWin: 900
  ZPlayer: 0
------------------------------------------------------------
