player [YangZ] gets hole card ['DT', 'H7'], current stack 1000
player [Ethan] gets hole card ['S2', 'SA'], current stack 995
player [HakulaPlayer] gets hole card ['CK', 'SQ'], current stack 990
player [SichengZuo] gets hole card ['ST', 'DQ'], current stack 1000
player [KLChen2PokerPlayer] gets hole card ['S7', 'H2'], current stack 1000
player [Jinkun] gets hole card ['CJ', 'C2'], current stack 1000
player [NitWinWin] gets hole card ['D4', 'HJ'], current stack 1000
player [ZPlayer] gets hole card ['D8', 'SK'], current stack 1000
Started the round 1
Street "preflop" started. (community card = [])
"SichengZuo" declared "fold:0"
"KLChen2PokerPlayer" declared "fold:0"
"Jinkun" declared "fold:10"
"NitWinWin" declared "fold:0"
"ZPlayer" declared "raise:15"
"YangZ" declared "fold:0"
"Ethan" declared "call:15"
"HakulaPlayer" declared "call:15"
Street "flop" started. (community card = ['D5', 'S8', 'S3'])
"Ethan" declared "call:0"
"HakulaPlayer" declared "call:0"
"ZPlayer" declared "call:0"
Street "turn" started. (community card = ['D5', 'S8', 'S3', 'HT'])
"Ethan" declared "call:0"
"HakulaPlayer" declared "call:0"
"ZPlayer" declared "raise:10"
"Ethan" declared "call:10"
"HakulaPlayer" declared "fold:0"
Street "river" started. (community card = ['D5', 'S8', 'S3', 'HT', 'DA'])
"Ethan" declared "call:0"
"ZPlayer" declared "raise:10"
"Ethan" declared "raise:97"
"ZPlayer" declared "fold:0"
"['Ethan']" won the round 1 (stack = {'YangZ': 1000, 'Ethan': 1050, 'HakulaPlayer': 985, 'SichengZuo': 1000, 'KLChen2PokerPlayer': 1000, 'Jinkun': 1000, 'NitWinWin': 1000, 'ZPlayer': 965})
player [YangZ] gets hole card ['SQ', 'D2'], current stack 1000
player [Ethan] gets hole card ['H5', 'HA'], current stack 1050
player [HakulaPlayer] gets hole card ['H9', 'H4'], current stack 980
player [SichengZuo] gets hole card ['S8', 'D4'], current stack 990
player [KLChen2PokerPlayer] gets hole card ['CA', 'S2'], current stack 1000
player [Jinkun] gets hole card ['HK', 'H7'], current stack 1000
player [NitWinWin] gets hole card ['C9', 'D9'], current stack 1000
player [ZPlayer] gets hole card ['S3', 'CQ'], current stack 965
Started the round 2
Street "preflop" started. (community card = [])
"KLChen2PokerPlayer" declared "call:10"
"Jinkun" declared "fold:10"
"NitWinWin" declared "fold:0"
"ZPlayer" declared "call:10"
"YangZ" declared "fold:0"
"Ethan" declared "fold:0"
"HakulaPlayer" declared "call:10"
"SichengZuo" declared "fold:0"
Street "flop" started. (community card = ['H8', 'HT', 'S4'])
"HakulaPlayer" declared "call:0"
"KLChen2PokerPlayer" declared "call:0"
"ZPlayer" declared "call:0"
Street "turn" started. (community card = ['H8', 'HT', 'S4', 'CT'])
"HakulaPlayer" declared "call:0"
"KLChen2PokerPlayer" declared "call:0"
"ZPlayer" declared "call:0"
Street "river" started. (community card = ['H8', 'HT', 'S4', 'CT', 'C4'])
"HakulaPlayer" declared "raise:48"
"KLChen2PokerPlayer" declared "fold:0"
"ZPlayer" declared "fold:0"
"['HakulaPlayer']" won the round 2 (stack = {'YangZ': 1000, 'Ethan': 1050, 'HakulaPlayer': 1015, 'SichengZuo': 990, 'KLChen2PokerPlayer': 990, 'Jinkun': 1000, 'NitWinWin': 1000, 'ZPlayer': 955})
player [YangZ] gets hole card ['CJ', 'C9'], current stack 1000
player [Ethan] gets hole card ['SJ', 'D3'], current stack 1050
player [HakulaPlayer] gets hole card ['D6', 'DT'], current stack 1015
player [SichengZuo] gets hole card ['C8', 'CT'], current stack 985
player [KLChen2PokerPlayer] gets hole card ['S2', 'C2'], current stack 980
player [Jinkun] gets hole card ['CA', 'D9'], current stack 1000
player [NitWinWin] gets hole card ['H7', 'H2'], current stack 1000
player [ZPlayer] gets hole card ['S7', 'S6'], current stack 955
Started the round 3
Street "preflop" started. (community card = [])
"Jinkun" declared "fold:10"
"NitWinWin" declared "fold:0"
"ZPlayer" declared "raise:15"
"YangZ" declared "fold:0"
"Ethan" declared "fold:0"
"HakulaPlayer" declared "fold:0"
"SichengZuo" declared "fold:0"
"KLChen2PokerPlayer" declared "fold:0"
"['ZPlayer']" won the round 3 (stack = {'YangZ': 1000, 'Ethan': 1050, 'HakulaPlayer': 1015, 'SichengZuo': 985, 'KLChen2PokerPlayer': 980, 'Jinkun': 1000, 'NitWinWin': 1000, 'ZPlayer': 970})
player [YangZ] gets hole card ['C2', 'D4'], current stack 1000
player [Ethan] gets hole card ['SJ', 'CK'], current stack 1050
player [HakulaPlayer] gets hole card ['D3', 'CQ'], current stack 1015
player [SichengZuo] gets hole card ['CA', 'H5'], current stack 985
player [KLChen2PokerPlayer] gets hole card ['H4', 'D9'], current stack 975
player [Jinkun] gets hole card ['HK', 'C8'], current stack 990
player [NitWinWin] gets hole card ['C4', 'C5'], current stack 1000
player [ZPlayer] gets hole card ['H6', 'CJ'], current stack 970
Started the round 4
Street "preflop" started. (community card = [])
"NitWinWin" declared "fold:0"
"ZPlayer" declared "call:10"
"YangZ" declared "fold:0"
"Ethan" declared "raise:157"
"HakulaPlayer" declared "fold:0"
"SichengZuo" declared "fold:0"
"KLChen2PokerPlayer" declared "fold:0"
"Jinkun" declared "fold:157"
"ZPlayer" declared "fold:0"
"['Ethan']" won the round 4 (stack = {'YangZ': 1000, 'Ethan': 1075, 'HakulaPlayer': 1015, 'SichengZuo': 985, 'KLChen2PokerPlayer': 975, 'Jinkun': 990, 'NitWinWin': 1000, 'ZPlayer': 960})
player [YangZ] gets hole card ['S3', 'S6'], current stack 1000
player [Ethan] gets hole card ['DQ', 'C2'], current stack 1075
player [HakulaPlayer] gets hole card ['S9', 'H9'], current stack 1015
player [SichengZuo] gets hole card ['HA', 'D6'], current stack 985
player [KLChen2PokerPlayer] gets hole card ['CQ', 'HQ'], current stack 975
player [Jinkun] gets hole card ['HK', 'D5'], current stack 985
player [NitWinWin] gets hole card ['D8', 'DK'], current stack 990
player [ZPlayer] gets hole card ['H8', 'C9'], current stack 960
Started the round 5
Street "preflop" started. (community card = [])
"ZPlayer" declared "fold:0"
"YangZ" declared "fold:0"
"Ethan" declared "fold:0"
"HakulaPlayer" declared "call:10"
"SichengZuo" declared "fold:0"
"KLChen2PokerPlayer" declared "raise:19"
"Jinkun" declared "fold:19"
"NitWinWin" declared "fold:0"
"HakulaPlayer" declared "raise:50"
"KLChen2PokerPlayer" declared "call:50"
Street "flop" started. (community card = ['H2', 'CT', 'C6'])
"HakulaPlayer" declared "call:0"
"KLChen2PokerPlayer" declared "raise:29"
"HakulaPlayer" declared "call:29"
Street "turn" started. (community card = ['H2', 'CT', 'C6', 'S4'])
"HakulaPlayer" declared "raise:183"
"KLChen2PokerPlayer" declared "call:183"
Street "river" started. (community card = ['H2', 'CT', 'C6', 'S4', 'C4'])
"HakulaPlayer" declared "call:0"
"KLChen2PokerPlayer" declared "raise:93"
"HakulaPlayer" declared "call:93"
"['KLChen2PokerPlayer']" won the round 5 (stack = {'YangZ': 1000, 'Ethan': 1075, 'HakulaPlayer': 660, 'SichengZuo': 985, 'KLChen2PokerPlayer': 1345, 'Jinkun': 985, 'NitWinWin': 990, 'ZPlayer': 960})
player [YangZ] gets hole card ['D7', 'D6'], current stack 1000
player [Ethan] gets hole card ['D5', 'S8'], current stack 1075
player [HakulaPlayer] gets hole card ['C7', 'HJ'], current stack 660
player [SichengZuo] gets hole card ['H4', 'S6'], current stack 985
player [KLChen2PokerPlayer] gets hole card ['S5', 'S9'], current stack 1345
player [Jinkun] gets hole card ['S7', 'D8'], current stack 985
player [NitWinWin] gets hole card ['C8', 'DA'], current stack 985
player [ZPlayer] gets hole card ['CJ', 'D9'], current stack 950
Started the round 6
Street "preflop" started. (community card = [])
"YangZ" declared "fold:0"
"Ethan" declared "fold:0"
"HakulaPlayer" declared "fold:0"
"SichengZuo" declared "fold:0"
"KLChen2PokerPlayer" declared "call:10"
"Jinkun" declared "call:10"
"NitWinWin" declared "fold:0"
"ZPlayer" declared "call:10"
Street "flop" started. (community card = ['DQ', 'SK', 'CQ'])
"ZPlayer" declared "raise:17"
"KLChen2PokerPlayer" declared "fold:0"
"Jinkun" declared "call:17"
Street "turn" started. (community card = ['DQ', 'SK', 'CQ', 'SA'])
"ZPlayer" declared "call:0"
"Jinkun" declared "call:0"
Street "river" started. (community card = ['DQ', 'SK', 'CQ', 'SA', 'SQ'])
"ZPlayer" declared "call:0"
"Jinkun" declared "call:0"
"['Jinkun', 'ZPlayer']" won the round 6 (stack = {'YangZ': 1000, 'Ethan': 1075, 'HakulaPlayer': 660, 'SichengZuo': 985, 'KLChen2PokerPlayer': 1335, 'Jinkun': 992, 'NitWinWin': 985, 'ZPlayer': 967})
player [YangZ] gets hole card ['HT', 'C3'], current stack 990
player [Ethan] gets hole card ['CJ', 'H6'], current stack 1075
player [HakulaPlayer] gets hole card ['CT', 'DA'], current stack 660
player [SichengZuo] gets hole card ['S7', 'S2'], current stack 985
player [KLChen2PokerPlayer] gets hole card ['HQ', 'HK'], current stack 1335
player [Jinkun] gets hole card ['D3', 'S8'], current stack 992
player [NitWinWin] gets hole card ['C5', 'C7'], current stack 985
player [ZPlayer] gets hole card ['CQ', 'ST'], current stack 962
Started the round 7
Street "preflop" started. (community card = [])
"Ethan" declared "fold:0"
"HakulaPlayer" declared "call:10"
"SichengZuo" declared "fold:0"
"KLChen2PokerPlayer" declared "raise:21"
"Jinkun" declared "fold:21"
"NitWinWin" declared "fold:0"
"ZPlayer" declared "call:21"
"YangZ" declared "fold:0"
"HakulaPlayer" declared "call:21"
Street "flop" started. (community card = ['SJ', 'H5', 'SK'])
"ZPlayer" declared "raise:10"
"HakulaPlayer" declared "fold:0"
"KLChen2PokerPlayer" declared "raise:26"
"ZPlayer" declared "fold:0"
"['KLChen2PokerPlayer']" won the round 7 (stack = {'YangZ': 990, 'Ethan': 1075, 'HakulaPlayer': 639, 'SichengZuo': 985, 'KLChen2PokerPlayer': 1397, 'Jinkun': 992, 'NitWinWin': 985, 'ZPlayer': 936})
player [YangZ] gets hole card ['H2', 'HK'], current stack 985
player [Ethan] gets hole card ['HT', 'S5'], current stack 1065
player [HakulaPlayer] gets hole card ['SJ', 'S9'], current stack 639
player [SichengZuo] gets hole card ['D6', 'H5'], current stack 985
player [KLChen2PokerPlayer] gets hole card ['S8', 'S3'], current stack 1397
player [Jinkun] gets hole card ['CQ', 'C6'], current stack 992
player [NitWinWin] gets hole card ['D7', 'DA'], current stack 985
player [ZPlayer] gets hole card ['H3', 'CJ'], current stack 936
Started the round 8
Street "preflop" started. (community card = [])
"HakulaPlayer" declared "fold:0"
"SichengZuo" declared "fold:0"
"KLChen2PokerPlayer" declared "fold:0"
"Jinkun" declared "fold:10"
"NitWinWin" declared "fold:0"
"ZPlayer" declared "call:10"
"YangZ" declared "fold:0"
"Ethan" declared "fold:0"
"['ZPlayer']" won the round 8 (stack = {'YangZ': 985, 'Ethan': 1065, 'HakulaPlayer': 639, 'SichengZuo': 985, 'KLChen2PokerPlayer': 1397, 'Jinkun': 992, 'NitWinWin': 985, 'ZPlayer': 951})
player [YangZ] gets hole card ['H6', 'S5'], current stack 985
player [Ethan] gets hole card ['H2', 'DK'], current stack 1060
player [HakulaPlayer] gets hole card ['HQ', 'SK'], current stack 629
player [SichengZuo] gets hole card ['H4', 'D3'], current stack 985
player [KLChen2PokerPlayer] gets hole card ['D5', 'D6'], current stack 1397
player [Jinkun] gets hole card ['D2', 'D7'], current stack 992
player [NitWinWin] gets hole card ['HT', 'C7'], current stack 985
player [ZPlayer] gets hole card ['S8', 'C3'], current stack 951
Started the round 9
Street "preflop" started. (community card = [])
"SichengZuo" declared "fold:0"
"KLChen2PokerPlayer" declared "raise:15"
"Jinkun" declared "fold:15"
"NitWinWin" declared "fold:0"
"ZPlayer" declared "fold:0"
"YangZ" declared "fold:0"
"Ethan" declared "fold:0"
"HakulaPlayer" declared "call:15"
Street "flop" started. (community card = ['DQ', 'S3', 'S2'])
"HakulaPlayer" declared "raise:37"
"KLChen2PokerPlayer" declared "fold:0"
"['HakulaPlayer']" won the round 9 (stack = {'YangZ': 985, 'Ethan': 1060, 'HakulaPlayer': 659, 'SichengZuo': 985, 'KLChen2PokerPlayer': 1382, 'Jinkun': 992, 'NitWinWin': 985, 'ZPlayer': 951})
player [YangZ] gets hole card ['HT', 'C4'], current stack 985
player [Ethan] gets hole card ['C3', 'CT'], current stack 1060
player [HakulaPlayer] gets hole card ['C6', 'S5'], current stack 654
player [SichengZuo] gets hole card ['HQ', 'DA'], current stack 975
player [KLChen2PokerPlayer] gets hole card ['S6', 'H8'], current stack 1382
player [Jinkun] gets hole card ['H5', 'D5'], current stack 992
player [NitWinWin] gets hole card ['DK', 'DT'], current stack 985
player [ZPlayer] gets hole card ['DQ', 'C7'], current stack 951
Started the round 10
Street "preflop" started. (community card = [])
"KLChen2PokerPlayer" declared "fold:0"
"Jinkun" declared "fold:10"
"NitWinWin" declared "fold:0"
"ZPlayer" declared "call:10"
"YangZ" declared "fold:0"
"Ethan" declared "fold:0"
"HakulaPlayer" declared "call:10"
"SichengZuo" declared "fold:0"
Street "flop" started. (community card = ['SJ', 'SK', 'CK'])
"HakulaPlayer" declared "call:0"
"ZPlayer" declared "raise:10"
"HakulaPlayer" declared "fold:0"
"['ZPlayer']" won the round 10 (stack = {'YangZ': 985, 'Ethan': 1060, 'HakulaPlayer': 649, 'SichengZuo': 975, 'KLChen2PokerPlayer': 1382, 'Jinkun': 992, 'NitWinWin': 985, 'ZPlayer': 971})
player [YangZ] gets hole card ['ST', 'HK'], current stack 985
player [Ethan] gets hole card ['C5', 'D9'], current stack 1060
player [HakulaPlayer] gets hole card ['D7', 'S9'], current stack 649
player [SichengZuo] gets hole card ['D4', 'S7'], current stack 970
player [KLChen2PokerPlayer] gets hole card ['SA', 'DQ'], current stack 1372
player [Jinkun] gets hole card ['HT', 'C2'], current stack 992
player [NitWinWin] gets hole card ['C4', 'H4'], current stack 985
player [ZPlayer] gets hole card ['S3', 'D5'], current stack 971
Started the round 11
Street "preflop" started. (community card = [])
"Jinkun" declared "fold:10"
"NitWinWin" declared "fold:0"
"ZPlayer" declared "call:10"
"YangZ" declared "fold:0"
"Ethan" declared "fold:0"
"HakulaPlayer" declared "call:10"
"SichengZuo" declared "fold:0"
"KLChen2PokerPlayer" declared "raise:22"
"ZPlayer" declared "call:22"
"HakulaPlayer" declared "call:22"
Street "flop" started. (community card = ['SQ', 'H5', 'H8'])
"KLChen2PokerPlayer" declared "raise:38"
"ZPlayer" declared "fold:0"
"HakulaPlayer" declared "fold:0"
"['KLChen2PokerPlayer']" won the round 11 (stack = {'YangZ': 985, 'Ethan': 1060, 'HakulaPlayer': 627, 'SichengZuo': 970, 'KLChen2PokerPlayer': 1431, 'Jinkun': 992, 'NitWinWin': 985, 'ZPlayer': 949})
player [YangZ] gets hole card ['D6', 'CJ'], current stack 985
player [Ethan] gets hole card ['D9', 'SQ'], current stack 1060
player [HakulaPlayer] gets hole card ['DQ', 'S4'], current stack 627
player [SichengZuo] gets hole card ['C2', 'C9'], current stack 970
player [KLChen2PokerPlayer] gets hole card ['D8', 'D2'], current stack 1426
player [Jinkun] gets hole card ['H8', 'HQ'], current stack 982
player [NitWinWin] gets hole card ['CA', 'S9'], current stack 985
player [ZPlayer] gets hole card ['DJ', 'H7'], current stack 949
Started the round 12
Street "preflop" started. (community card = [])
"NitWinWin" declared "fold:0"
"ZPlayer" declared "call:10"
"YangZ" declared "fold:0"
"Ethan" declared "fold:0"
"HakulaPlayer" declared "call:10"
"SichengZuo" declared "fold:0"
"KLChen2PokerPlayer" declared "fold:0"
"Jinkun" declared "call:10"
Street "flop" started. (community card = ['H4', 'ST', 'H2'])
"Jinkun" declared "call:0"
"ZPlayer" declared "call:0"
"HakulaPlayer" declared "call:0"
Street "turn" started. (community card = ['H4', 'ST', 'H2', 'C8'])
"Jinkun" declared "call:0"
"ZPlayer" declared "call:0"
"HakulaPlayer" declared "call:0"
Street "river" started. (community card = ['H4', 'ST', 'H2', 'C8', 'C3'])
"Jinkun" declared "call:0"
"ZPlayer" declared "call:0"
"HakulaPlayer" declared "call:0"
"['Jinkun']" won the round 12 (stack = {'YangZ': 985, 'Ethan': 1060, 'HakulaPlayer': 617, 'SichengZuo': 970, 'KLChen2PokerPlayer': 1426, 'Jinkun': 1017, 'NitWinWin': 985, 'ZPlayer': 939})
player [YangZ] gets hole card ['DK', 'C3'], current stack 985
player [Ethan] gets hole card ['S8', 'D4'], current stack 1060
player [HakulaPlayer] gets hole card ['S4', 'SA'], current stack 617
player [SichengZuo] gets hole card ['C4', 'CQ'], current stack 970
player [KLChen2PokerPlayer] gets hole card ['H9', 'D8'], current stack 1426
player [Jinkun] gets hole card ['CA', 'D3'], current stack 1012
player [NitWinWin] gets hole card ['S3', 'D5'], current stack 975
player [ZPlayer] gets hole card ['CJ', 'HQ'], current stack 939
Started the round 13
Street "preflop" started. (community card = [])
"ZPlayer" declared "raise:15"
"YangZ" declared "fold:0"
"Ethan" declared "fold:0"
"HakulaPlayer" declared "call:15"
"SichengZuo" declared "fold:0"
"KLChen2PokerPlayer" declared "raise:20"
"Jinkun" declared "fold:20"
"NitWinWin" declared "fold:0"
"ZPlayer" declared "call:20"
"HakulaPlayer" declared "call:20"
Street "flop" started. (community card = ['D6', 'H4', 'S6'])
"ZPlayer" declared "call:0"
"HakulaPlayer" declared "call:0"
"KLChen2PokerPlayer" declared "call:0"
Street "turn" started. (community card = ['D6', 'H4', 'S6', 'C8'])
"ZPlayer" declared "call:0"
"HakulaPlayer" declared "call:0"
"KLChen2PokerPlayer" declared "call:0"
Street "river" started. (community card = ['D6', 'H4', 'S6', 'C8', 'CK'])
"ZPlayer" declared "call:0"
"HakulaPlayer" declared "call:0"
"KLChen2PokerPlayer" declared "call:0"
"['KLChen2PokerPlayer']" won the round 13 (stack = {'YangZ': 985, 'Ethan': 1060, 'HakulaPlayer': 597, 'SichengZuo': 970, 'KLChen2PokerPlayer': 1481, 'Jinkun': 1012, 'NitWinWin': 975, 'ZPlayer': 919})
player [YangZ] gets hole card ['CT', 'CJ'], current stack 985
player [Ethan] gets hole card ['HJ', 'D6'], current stack 1060
player [HakulaPlayer] gets hole card ['S6', 'DJ'], current stack 597
player [SichengZuo] gets hole card ['SA', 'HA'], current stack 970
player [KLChen2PokerPlayer] gets hole card ['S2', 'H2'], current stack 1481
player [Jinkun] gets hole card ['S4', 'H3'], current stack 1012
player [NitWinWin] gets hole card ['DK', 'ST'], current stack 970
player [ZPlayer] gets hole card ['H6', 'DA'], current stack 909
Started the round 14
Street "preflop" started. (community card = [])
"YangZ" declared "fold:0"
"Ethan" declared "fold:0"
"HakulaPlayer" declared "fold:0"
"SichengZuo" declared "raise:970"
"KLChen2PokerPlayer" declared "fold:0"
"Jinkun" declared "fold:970"
"NitWinWin" declared "fold:0"
"ZPlayer" declared "fold:0"
"['SichengZuo']" won the round 14 (stack = {'YangZ': 985, 'Ethan': 1060, 'HakulaPlayer': 597, 'SichengZuo': 985, 'KLChen2PokerPlayer': 1481, 'Jinkun': 1012, 'NitWinWin': 970, 'ZPlayer': 909})
player [YangZ] gets hole card ['H8', 'S3'], current stack 975
player [Ethan] gets hole card ['D4', 'CT'], current stack 1060
player [HakulaPlayer] gets hole card ['HT', 'CA'], current stack 597
player [SichengZuo] gets hole card ['C7', 'D8'], current stack 985
player [KLChen2PokerPlayer] gets hole card ['D6', 'CK'], current stack 1481
player [Jinkun] gets hole card ['DJ', 'HJ'], current stack 1012
player [NitWinWin] gets hole card ['SA', 'DQ'], current stack 970
player [ZPlayer] gets hole card ['SQ', 'H6'], current stack 904
Started the round 15
Street "preflop" started. (community card = [])
"Ethan" declared "fold:0"
"HakulaPlayer" declared "call:10"
"SichengZuo" declared "fold:0"
"KLChen2PokerPlayer" declared "call:10"
"Jinkun" declared "call:10"
"NitWinWin" declared "fold:0"
"ZPlayer" declared "call:10"
"YangZ" declared "fold:0"
Street "flop" started. (community card = ['HA', 'DA', 'ST'])
"ZPlayer" declared "call:0"
"HakulaPlayer" declared "raise:68"
"KLChen2PokerPlayer" declared "fold:0"
"Jinkun" declared "call:68"
"ZPlayer" declared "fold:0"
Street "turn" started. (community card = ['HA', 'DA', 'ST', 'CJ'])
"HakulaPlayer" declared "raise:255"
"Jinkun" declared "call:255"
Street "river" started. (community card = ['HA', 'DA', 'ST', 'CJ', 'H3'])
"HakulaPlayer" declared "raise:264"
"Jinkun" declared "call:264"
"['HakulaPlayer']" won the round 15 (stack = {'YangZ': 975, 'Ethan': 1060, 'HakulaPlayer': 1224, 'SichengZuo': 985, 'KLChen2PokerPlayer': 1471, 'Jinkun': 415, 'NitWinWin': 970, 'ZPlayer': 899})
player [YangZ] gets hole card ['CA', 'D4'], current stack 970
player [Ethan] gets hole card ['D2', 'H9'], current stack 1050
player [HakulaPlayer] gets hole card ['DT', 'HK'], current stack 1224
player [SichengZuo] gets hole card ['C6', 'DK'], current stack 985
player [KLChen2PokerPlayer] gets hole card ['D7', 'S3'], current stack 1471
player [Jinkun] gets hole card ['S4', 'HJ'], current stack 415
player [NitWinWin] gets hole card ['CQ', 'D8'], current stack 970
player [ZPlayer] gets hole card ['SJ', 'C2'], current stack 899
Started the round 16
Street "preflop" started. (community card = [])
"HakulaPlayer" declared "fold:0"
"SichengZuo" declared "fold:0"
"KLChen2PokerPlayer" declared "raise:15"
"Jinkun" declared "fold:15"
"NitWinWin" declared "fold:0"
"ZPlayer" declared "call:15"
"YangZ" declared "fold:0"
"Ethan" declared "fold:0"
Street "flop" started. (community card = ['C4', 'SK', 'DA'])
"KLChen2PokerPlayer" declared "call:0"
"ZPlayer" declared "call:0"
Street "turn" started. (community card = ['C4', 'SK', 'DA', 'C8'])
"KLChen2PokerPlayer" declared "call:0"
"ZPlayer" declared "call:0"
Street "river" started. (community card = ['C4', 'SK', 'DA', 'C8', 'H6'])
"KLChen2PokerPlayer" declared "call:0"
"ZPlayer" declared "call:0"
"['ZPlayer']" won the round 16 (stack = {'YangZ': 970, 'Ethan': 1050, 'HakulaPlayer': 1224, 'SichengZuo': 985, 'KLChen2PokerPlayer': 1456, 'Jinkun': 415, 'NitWinWin': 970, 'ZPlayer': 929})
player [YangZ] gets hole card ['C9', 'S9'], current stack 970
player [Ethan] gets hole card ['C2', 'CA'], current stack 1045
player [HakulaPlayer] gets hole card ['C6', 'C7'], current stack 1214
player [SichengZuo] gets hole card ['H4', 'H2'], current stack 985
player [KLChen2PokerPlayer] gets hole card ['HK', 'HJ'], current stack 1456
player [Jinkun] gets hole card ['S6', 'CJ'], current stack 415
player [NitWinWin] gets hole card ['SK', 'D2'], current stack 970
player [ZPlayer] gets hole card ['SQ', 'D3'], current stack 929
Started the round 17
Street "preflop" started. (community card = [])
"SichengZuo" declared "fold:0"
"KLChen2PokerPlayer" declared "raise:17"
"Jinkun" declared "fold:17"
"NitWinWin" declared "fold:0"
"ZPlayer" declared "call:17"
"YangZ" declared "fold:0"
"Ethan" declared "fold:0"
"HakulaPlayer" declared "call:17"
Street "flop" started. (community card = ['SA', 'H7', 'HA'])
"HakulaPlayer" declared "call:0"
"KLChen2PokerPlayer" declared "raise:27"
"ZPlayer" declared "fold:0"
"HakulaPlayer" declared "call:27"
Street "turn" started. (community card = ['SA', 'H7', 'HA', 'CQ'])
"HakulaPlayer" declared "call:0"
"KLChen2PokerPlayer" declared "raise:104"
"HakulaPlayer" declared "fold:0"
"['KLChen2PokerPlayer']" won the round 17 (stack = {'YangZ': 970, 'Ethan': 1045, 'HakulaPlayer': 1180, 'SichengZuo': 985, 'KLChen2PokerPlayer': 1522, 'Jinkun': 415, 'NitWinWin': 970, 'ZPlayer': 912})
player [YangZ] gets hole card ['CA', 'S2'], current stack 970
player [Ethan] gets hole card ['SQ', 'SJ'], current stack 1045
player [HakulaPlayer] gets hole card ['H4', 'HQ'], current stack 1175
player [SichengZuo] gets hole card ['S3', 'SA'], current stack 975
player [KLChen2PokerPlayer] gets hole card ['H6', 'C3'], current stack 1522
player [Jinkun] gets hole card ['S4', 'S8'], current stack 415
player [NitWinWin] gets hole card ['CJ', 'C5'], current stack 970
player [ZPlayer] gets hole card ['HT', 'ST'], current stack 912
Started the round 18
Street "preflop" started. (community card = [])
"KLChen2PokerPlayer" declared "fold:0"
"Jinkun" declared "fold:10"
"NitWinWin" declared "fold:0"
"ZPlayer" declared "raise:15"
"YangZ" declared "fold:0"
"Ethan" declared "raise:156"
"HakulaPlayer" declared "fold:0"
"SichengZuo" declared "fold:0"
"ZPlayer" declared "call:156"
Street "flop" started. (community card = ['D3', 'HK', 'H3'])
"ZPlayer" declared "raise:10"
"Ethan" declared "call:10"
Street "turn" started. (community card = ['D3', 'HK', 'H3', 'C6'])
"ZPlayer" declared "raise:173"
"Ethan" declared "fold:0"
"['ZPlayer']" won the round 18 (stack = {'YangZ': 970, 'Ethan': 879, 'HakulaPlayer': 1175, 'SichengZuo': 975, 'KLChen2PokerPlayer': 1522, 'Jinkun': 415, 'NitWinWin': 970, 'ZPlayer': 1093})
player [YangZ] gets hole card ['HJ', 'HA'], current stack 970
player [Ethan] gets hole card ['D7', 'SJ'], current stack 879
player [HakulaPlayer] gets hole card ['SA', 'C9'], current stack 1175
player [SichengZuo] gets hole card ['S2', 'DQ'], current stack 970
player [KLChen2PokerPlayer] gets hole card ['S3', 'S7'], current stack 1512
player [Jinkun] gets hole card ['ST', 'C8'], current stack 415
player [NitWinWin] gets hole card ['CQ', 'DT'], current stack 970
player [ZPlayer] gets hole card ['C7', 'H6'], current stack 1093
Started the round 19
Street "preflop" started. (community card = [])
"Jinkun" declared "fold:10"
"NitWinWin" declared "fold:0"
"ZPlayer" declared "call:10"
"YangZ" declared "fold:0"
"Ethan" declared "fold:0"
"HakulaPlayer" declared "call:10"
"SichengZuo" declared "fold:0"
"KLChen2PokerPlayer" declared "fold:0"
Street "flop" started. (community card = ['CA', 'S9', 'S4'])
"ZPlayer" declared "call:0"
"HakulaPlayer" declared "raise:43"
"ZPlayer" declared "fold:0"
"['HakulaPlayer']" won the round 19 (stack = {'YangZ': 970, 'Ethan': 879, 'HakulaPlayer': 1200, 'SichengZuo': 970, 'KLChen2PokerPlayer': 1512, 'Jinkun': 415, 'NitWinWin': 970, 'ZPlayer': 1083})
player [YangZ] gets hole card ['DJ', 'C2'], current stack 970
player [Ethan] gets hole card ['SJ', 'H8'], current stack 879
player [HakulaPlayer] gets hole card ['HJ', 'D4'], current stack 1200
player [SichengZuo] gets hole card ['D3', 'H5'], current stack 970
player [KLChen2PokerPlayer] gets hole card ['HQ', 'DK'], current stack 1507
player [Jinkun] gets hole card ['D5', 'SK'], current stack 405
player [NitWinWin] gets hole card ['S9', 'HT'], current stack 970
player [ZPlayer] gets hole card ['SA', 'S2'], current stack 1083
Started the round 20
Street "preflop" started. (community card = [])
"NitWinWin" declared "fold:0"
"ZPlayer" declared "raise:15"
"YangZ" declared "fold:0"
"Ethan" declared "fold:0"
"HakulaPlayer" declared "fold:0"
"SichengZuo" declared "fold:0"
"KLChen2PokerPlayer" declared "raise:20"
"Jinkun" declared "fold:20"
"ZPlayer" declared "call:20"
Street "flop" started. (community card = ['CK', 'SQ', 'H6'])
"KLChen2PokerPlayer" declared "raise:32"
"ZPlayer" declared "fold:0"
"['KLChen2PokerPlayer']" won the round 20 (stack = {'YangZ': 970, 'Ethan': 879, 'HakulaPlayer': 1200, 'SichengZuo': 970, 'KLChen2PokerPlayer': 1542, 'Jinkun': 405, 'NitWinWin': 970, 'ZPlayer': 1063})
player [YangZ] gets hole card ['H5', 'C5'], current stack 970
player [Ethan] gets hole card ['D3', 'S6'], current stack 879
player [HakulaPlayer] gets hole card ['C6', 'CT'], current stack 1200
player [SichengZuo] gets hole card ['D9', 'ST'], current stack 970
player [KLChen2PokerPlayer] gets hole card ['S4', 'C4'], current stack 1542
player [Jinkun] gets hole card ['C3', 'D8'], current stack 400
player [NitWinWin] gets hole card ['DA', 'HK'], current stack 960
player [ZPlayer] gets hole card ['H8', 'H2'], current stack 1063
Started the round 21
Street "preflop" started. (community card = [])
"ZPlayer" declared "call:10"
"YangZ" declared "fold:0"
"Ethan" declared "fold:0"
"HakulaPlayer" declared "call:10"
"SichengZuo" declared "fold:0"
"KLChen2PokerPlayer" declared "raise:19"
"Jinkun" declared "fold:19"
"NitWinWin" declared "fold:0"
"ZPlayer" declared "call:19"
"HakulaPlayer" declared "call:19"
Street "flop" started. (community card = ['SK', 'SA', 'C8'])
"ZPlayer" declared "raise:10"
"HakulaPlayer" declared "fold:0"
"KLChen2PokerPlayer" declared "fold:0"
"['ZPlayer']" won the round 21 (stack = {'YangZ': 970, 'Ethan': 879, 'HakulaPlayer': 1181, 'SichengZuo': 970, 'KLChen2PokerPlayer': 1523, 'Jinkun': 400, 'NitWinWin': 960, 'ZPlayer': 1116})
player [YangZ] gets hole card ['HK', 'D5'], current stack 970
player [Ethan] gets hole card ['CQ', 'HQ'], current stack 879
player [HakulaPlayer] gets hole card ['SA', 'H6'], current stack 1181
player [SichengZuo] gets hole card ['C5', 'DJ'], current stack 970
player [KLChen2PokerPlayer] gets hole card ['DA', 'S2'], current stack 1523
player [Jinkun] gets hole card ['DT', 'DQ'], current stack 400
player [NitWinWin] gets hole card ['C2', 'D2'], current stack 955
player [ZPlayer] gets hole card ['C6', 'H3'], current stack 1106
Started the round 22
Street "preflop" started. (community card = [])
"YangZ" declared "fold:0"
"Ethan" declared "raise:263"
"HakulaPlayer" declared "fold:0"
"SichengZuo" declared "fold:0"
"KLChen2PokerPlayer" declared "fold:0"
"Jinkun" declared "fold:263"
"NitWinWin" declared "fold:0"
"ZPlayer" declared "fold:0"
"['Ethan']" won the round 22 (stack = {'YangZ': 970, 'Ethan': 894, 'HakulaPlayer': 1181, 'SichengZuo': 970, 'KLChen2PokerPlayer': 1523, 'Jinkun': 400, 'NitWinWin': 955, 'ZPlayer': 1106})
player [YangZ] gets hole card ['ST', 'C8'], current stack 960
player [Ethan] gets hole card ['HQ', 'S3'], current stack 894
player [HakulaPlayer] gets hole card ['H4', 'HK'], current stack 1181
player [SichengZuo] gets hole card ['HJ', 'CA'], current stack 970
player [KLChen2PokerPlayer] gets hole card ['S6', 'DQ'], current stack 1523
player [Jinkun] gets hole card ['C6', 'H3'], current stack 400
player [NitWinWin] gets hole card ['S5', 'C2'], current stack 955
player [ZPlayer] gets hole card ['S4', 'H7'], current stack 1101
Started the round 23
Street "preflop" started. (community card = [])
"Ethan" declared "fold:0"
"HakulaPlayer" declared "fold:0"
"SichengZuo" declared "fold:0"
"KLChen2PokerPlayer" declared "fold:0"
"Jinkun" declared "call:10"
"NitWinWin" declared "fold:0"
"ZPlayer" declared "call:10"
"YangZ" declared "fold:0"
Street "flop" started. (community card = ['C4', 'C7', 'D5'])
"ZPlayer" declared "raise:30"
"Jinkun" declared "call:30"
Street "turn" started. (community card = ['C4', 'C7', 'D5', 'H5'])
"ZPlayer" declared "raise:10"
"Jinkun" declared "raise:45"
"ZPlayer" declared "call:45"
Street "river" started. (community card = ['C4', 'C7', 'D5', 'H5', 'H6'])
"ZPlayer" declared "call:0"
"Jinkun" declared "raise:72"
"ZPlayer" declared "fold:0"
"['Jinkun']" won the round 23 (stack = {'YangZ': 960, 'Ethan': 894, 'HakulaPlayer': 1181, 'SichengZuo': 970, 'KLChen2PokerPlayer': 1523, 'Jinkun': 495, 'NitWinWin': 955, 'ZPlayer': 1021})
player [YangZ] gets hole card ['CJ', 'HQ'], current stack 955
player [Ethan] gets hole card ['S6', 'SA'], current stack 884
player [HakulaPlayer] gets hole card ['S3', 'D6'], current stack 1181
player [SichengZuo] gets hole card ['CA', 'SK'], current stack 970
player [KLChen2PokerPlayer] gets hole card ['SJ', 'DT'], current stack 1523
player [Jinkun] gets hole card ['D2', 'C2'], current stack 495
player [NitWinWin] gets hole card ['H4', 'D7'], current stack 955
player [ZPlayer] gets hole card ['D9', 'ST'], current stack 1021
Started the round 24
Street "preflop" started. (community card = [])
"HakulaPlayer" declared "fold:0"
"SichengZuo" declared "fold:0"
"KLChen2PokerPlayer" declared "raise:22"
"Jinkun" declared "fold:22"
"NitWinWin" declared "fold:0"
"ZPlayer" declared "call:22"
"YangZ" declared "fold:0"
"Ethan" declared "call:22"
Street "flop" started. (community card = ['DQ', 'D8', 'S7'])
"Ethan" declared "call:0"
"KLChen2PokerPlayer" declared "raise:18"
"ZPlayer" declared "call:18"
"Ethan" declared "fold:0"
Street "turn" started. (community card = ['DQ', 'D8', 'S7', 'HA'])
"KLChen2PokerPlayer" declared "call:0"
"ZPlayer" declared "call:0"
Street "river" started. (community card = ['DQ', 'D8', 'S7', 'HA', 'HT'])
"KLChen2PokerPlayer" declared "call:0"
"ZPlayer" declared "raise:10"
"KLChen2PokerPlayer" declared "call:10"
"['KLChen2PokerPlayer']" won the round 24 (stack = {'YangZ': 955, 'Ethan': 872, 'HakulaPlayer': 1181, 'SichengZuo': 970, 'KLChen2PokerPlayer': 1600, 'Jinkun': 495, 'NitWinWin': 955, 'ZPlayer': 971})
player [YangZ] gets hole card ['CA', 'D9'], current stack 955
player [Ethan] gets hole card ['D7', 'H7'], current stack 867
player [HakulaPlayer] gets hole card ['C7', 'CK'], current stack 1171
player [SichengZuo] gets hole card ['DQ', 'H9'], current stack 970
player [KLChen2PokerPlayer] gets hole card ['C2', 'D5'], current stack 1600
player [Jinkun] gets hole card ['SA', 'D6'], current stack 495
player [NitWinWin] gets hole card ['C3', 'C8'], current stack 955
player [ZPlayer] gets hole card ['C5', 'HJ'], current stack 971
Started the round 25
Street "preflop" started. (community card = [])
"SichengZuo" declared "fold:0"
"KLChen2PokerPlayer" declared "fold:0"
"Jinkun" declared "fold:10"
"NitWinWin" declared "fold:0"
"ZPlayer" declared "call:10"
"YangZ" declared "fold:0"
"Ethan" declared "call:10"
"HakulaPlayer" declared "call:10"
Street "flop" started. (community card = ['S7', 'C4', 'DT'])
"Ethan" declared "call:0"
"HakulaPlayer" declared "call:0"
"ZPlayer" declared "call:0"
Street "turn" started. (community card = ['S7', 'C4', 'DT', 'H3'])
"Ethan" declared "raise:310"
"HakulaPlayer" declared "fold:0"
"ZPlayer" declared "fold:0"
"['Ethan']" won the round 25 (stack = {'YangZ': 955, 'Ethan': 892, 'HakulaPlayer': 1171, 'SichengZuo': 970, 'KLChen2PokerPlayer': 1600, 'Jinkun': 495, 'NitWinWin': 955, 'ZPlayer': 961})
player [YangZ] gets hole card ['SJ', 'S3'], current stack 955
player [Ethan] gets hole card ['DQ', 'H9'], current stack 892
player [HakulaPlayer] gets hole card ['H6', 'C2'], current stack 1166
player [SichengZuo] gets hole card ['S2', 'C3'], current stack 960
player [KLChen2PokerPlayer] gets hole card ['S9', 'S6'], current stack 1600
player [Jinkun] gets hole card ['C5', 'C7'], current stack 495
player [NitWinWin] gets hole card ['HA', 'CK'], current stack 955
player [ZPlayer] gets hole card ['S7', 'H8'], current stack 961
Started the round 26
Street "preflop" started. (community card = [])
"KLChen2PokerPlayer" declared "raise:27"
"Jinkun" declared "fold:27"
"NitWinWin" declared "fold:0"
"ZPlayer" declared "call:27"
"YangZ" declared "fold:0"
"Ethan" declared "fold:0"
"HakulaPlayer" declared "fold:0"
"SichengZuo" declared "fold:0"
Street "flop" started. (community card = ['D7', 'C9', 'CQ'])
"KLChen2PokerPlayer" declared "raise:31"
"ZPlayer" declared "fold:0"
"['KLChen2PokerPlayer']" won the round 26 (stack = {'YangZ': 955, 'Ethan': 892, 'HakulaPlayer': 1166, 'SichengZuo': 960, 'KLChen2PokerPlayer': 1642, 'Jinkun': 495, 'NitWinWin': 955, 'ZPlayer': 934})
player [YangZ] gets hole card ['SA', 'HQ'], current stack 955
player [Ethan] gets hole card ['D7', 'H8'], current stack 892
player [HakulaPlayer] gets hole card ['H5', 'C2'], current stack 1166
player [SichengZuo] gets hole card ['C4', 'CJ'], current stack 955
player [KLChen2PokerPlayer] gets hole card ['SK', 'H7'], current stack 1632
player [Jinkun] gets hole card ['D6', 'CA'], current stack 495
player [NitWinWin] gets hole card ['HT', 'S2'], current stack 955
player [ZPlayer] gets hole card ['HK', 'DT'], current stack 934
Started the round 27
Street "preflop" started. (community card = [])
"Jinkun" declared "fold:10"
"NitWinWin" declared "fold:0"
"ZPlayer" declared "raise:15"
"YangZ" declared "fold:0"
"Ethan" declared "fold:0"
"HakulaPlayer" declared "raise:26"
"SichengZuo" declared "fold:0"
"KLChen2PokerPlayer" declared "fold:0"
"ZPlayer" declared "call:26"
Street "flop" started. (community card = ['DJ', 'HJ', 'ST'])
"ZPlayer" declared "raise:10"
"HakulaPlayer" declared "call:10"
Street "turn" started. (community card = ['DJ', 'HJ', 'ST', 'S5'])
"ZPlayer" declared "raise:10"
"HakulaPlayer" declared "call:10"
Street "river" started. (community card = ['DJ', 'HJ', 'ST', 'S5', 'CT'])
"ZPlayer" declared "raise:322"
"HakulaPlayer" declared "fold:0"
"['ZPlayer']" won the round 27 (stack = {'YangZ': 955, 'Ethan': 892, 'HakulaPlayer': 1120, 'SichengZuo': 955, 'KLChen2PokerPlayer': 1632, 'Jinkun': 495, 'NitWinWin': 955, 'ZPlayer': 995})
player [YangZ] gets hole card ['CJ', 'CT'], current stack 955
player [Ethan] gets hole card ['CA', 'H6'], current stack 892
player [HakulaPlayer] gets hole card ['SK', 'DJ'], current stack 1120
player [SichengZuo] gets hole card ['S6', 'D9'], current stack 955
player [KLChen2PokerPlayer] gets hole card ['ST', 'CQ'], current stack 1627
player [Jinkun] gets hole card ['S5', 'SJ'], current stack 485
player [NitWinWin] gets hole card ['SA', 'H4'], current stack 955
player [ZPlayer] gets hole card ['D3', 'HA'], current stack 995
Started the round 28
Street "preflop" started. (community card = [])
"NitWinWin" declared "fold:0"
"ZPlayer" declared "raise:15"
"YangZ" declared "fold:0"
"Ethan" declared "fold:0"
"HakulaPlayer" declared "call:15"
"SichengZuo" declared "fold:0"
"KLChen2PokerPlayer" declared "raise:20"
"Jinkun" declared "fold:20"
"ZPlayer" declared "fold:0"
"HakulaPlayer" declared "call:20"
Street "flop" started. (community card = ['S2', 'D8', 'D6'])
"KLChen2PokerPlayer" declared "call:0"
"HakulaPlayer" declared "call:0"
Street "turn" started. (community card = ['S2', 'D8', 'D6', 'D2'])
"KLChen2PokerPlayer" declared "call:0"
"HakulaPlayer" declared "call:0"
Street "river" started. (community card = ['S2', 'D8', 'D6', 'D2', 'D7'])
"KLChen2PokerPlayer" declared "call:0"
"HakulaPlayer" declared "raise:88"
"KLChen2PokerPlayer" declared "fold:0"
"['HakulaPlayer']" won the round 28 (stack = {'YangZ': 955, 'Ethan': 892, 'HakulaPlayer': 1165, 'SichengZuo': 955, 'KLChen2PokerPlayer': 1612, 'Jinkun': 485, 'NitWinWin': 955, 'ZPlayer': 980})
player [YangZ] gets hole card ['ST', 'S7'], current stack 955
player [Ethan] gets hole card ['S9', 'D4'], current stack 892
player [HakulaPlayer] gets hole card ['D3', 'C2'], current stack 1165
player [SichengZuo] gets hole card ['C3', 'H9'], current stack 955
player [KLChen2PokerPlayer] gets hole card ['H2', 'SA'], current stack 1612
player [Jinkun] gets hole card ['H3', 'SQ'], current stack 480
player [NitWinWin] gets hole card ['HK', 'DK'], current stack 945
player [ZPlayer] gets hole card ['DA', 'SK'], current stack 980
Started the round 29
Street "preflop" started. (community card = [])
"ZPlayer" declared "raise:15"
"YangZ" declared "fold:0"
"Ethan" declared "fold:0"
"HakulaPlayer" declared "fold:0"
"SichengZuo" declared "fold:0"
"KLChen2PokerPlayer" declared "raise:22"
"Jinkun" declared "fold:22"
"NitWinWin" declared "raise:955"
"ZPlayer" declared "fold:0"
"KLChen2PokerPlayer" declared "fold:0"
"['NitWinWin']" won the round 29 (stack = {'YangZ': 955, 'Ethan': 892, 'HakulaPlayer': 1165, 'SichengZuo': 955, 'KLChen2PokerPlayer': 1590, 'Jinkun': 480, 'NitWinWin': 997, 'ZPlayer': 965})
player [YangZ] gets hole card ['SA', 'CQ'], current stack 955
player [Ethan] gets hole card ['C7', 'S9'], current stack 892
player [HakulaPlayer] gets hole card ['D2', 'HJ'], current stack 1165
player [SichengZuo] gets hole card ['C5', 'D4'], current stack 955
player [KLChen2PokerPlayer] gets hole card ['HQ', 'CT'], current stack 1590
player [Jinkun] gets hole card ['SJ', 'CJ'], current stack 480
player [NitWinWin] gets hole card ['CK', 'DJ'], current stack 992
player [ZPlayer] gets hole card ['C9', 'S5'], current stack 955
Started the round 30
Street "preflop" started. (community card = [])
"YangZ" declared "fold:0"
"Ethan" declared "fold:0"
"HakulaPlayer" declared "fold:0"
"SichengZuo" declared "fold:0"
"KLChen2PokerPlayer" declared "raise:16"
"Jinkun" declared "fold:16"
"NitWinWin" declared "fold:0"
"ZPlayer" declared "call:16"
Street "flop" started. (community card = ['SQ', 'H8', 'DT'])
"ZPlayer" declared "call:0"
"KLChen2PokerPlayer" declared "raise:34"
"ZPlayer" declared "fold:0"
"['KLChen2PokerPlayer']" won the round 30 (stack = {'YangZ': 955, 'Ethan': 892, 'HakulaPlayer': 1165, 'SichengZuo': 955, 'KLChen2PokerPlayer': 1611, 'Jinkun': 480, 'NitWinWin': 992, 'ZPlayer': 949})
player [YangZ] gets hole card ['S6', 'C6'], current stack 945
player [Ethan] gets hole card ['HJ', 'C9'], current stack 892
player [HakulaPlayer] gets hole card ['S2', 'D5'], current stack 1165
player [SichengZuo] gets hole card ['C3', 'C8'], current stack 955
player [KLChen2PokerPlayer] gets hole card ['CT', 'S5'], current stack 1611
player [Jinkun] gets hole card ['C4', 'DK'], current stack 480
player [NitWinWin] gets hole card ['H7', 'SQ'], current stack 992
player [ZPlayer] gets hole card ['CA', 'H4'], current stack 944
Started the round 31
Street "preflop" started. (community card = [])
"Ethan" declared "fold:0"
"HakulaPlayer" declared "fold:0"
"SichengZuo" declared "fold:0"
"KLChen2PokerPlayer" declared "fold:0"
"Jinkun" declared "call:10"
"NitWinWin" declared "fold:0"
"ZPlayer" declared "raise:15"
"YangZ" declared "fold:0"
"Jinkun" declared "call:15"
Street "flop" started. (community card = ['DT', 'S9', 'DJ'])
"ZPlayer" declared "call:0"
"Jinkun" declared "raise:120"
"ZPlayer" declared "fold:0"
"['Jinkun']" won the round 31 (stack = {'YangZ': 945, 'Ethan': 892, 'HakulaPlayer': 1165, 'SichengZuo': 955, 'KLChen2PokerPlayer': 1611, 'Jinkun': 505, 'NitWinWin': 992, 'ZPlayer': 934})
player [YangZ] gets hole card ['HT', 'H5'], current stack 940
player [Ethan] gets hole card ['C6', 'S7'], current stack 882
player [HakulaPlayer] gets hole card ['HQ', 'C9'], current stack 1165
player [SichengZuo] gets hole card ['S5', 'ST'], current stack 955
player [KLChen2PokerPlayer] gets hole card ['CA', 'S3'], current stack 1611
player [Jinkun] gets hole card ['D2', 'HK'], current stack 505
player [NitWinWin] gets hole card ['S2', 'D3'], current stack 992
player [ZPlayer] gets hole card ['S4', 'SA'], current stack 934
Started the round 32
Street "preflop" started. (community card = [])
"HakulaPlayer" declared "fold:0"
"SichengZuo" declared "fold:0"
"KLChen2PokerPlayer" declared "call:10"
"Jinkun" declared "fold:10"
"NitWinWin" declared "fold:0"
"ZPlayer" declared "raise:15"
"YangZ" declared "fold:0"
"Ethan" declared "call:15"
"KLChen2PokerPlayer" declared "fold:0"
Street "flop" started. (community card = ['C3', 'C2', 'SK'])
"Ethan" declared "call:0"
"ZPlayer" declared "call:0"
Street "turn" started. (community card = ['C3', 'C2', 'SK', 'SQ'])
"Ethan" declared "call:0"
"ZPlayer" declared "call:0"
Street "river" started. (community card = ['C3', 'C2', 'SK', 'SQ', 'S6'])
"Ethan" declared "call:0"
"ZPlayer" declared "raise:548"
"Ethan" declared "fold:0"
"['ZPlayer']" won the round 32 (stack = {'YangZ': 940, 'Ethan': 877, 'HakulaPlayer': 1165, 'SichengZuo': 955, 'KLChen2PokerPlayer': 1601, 'Jinkun': 505, 'NitWinWin': 992, 'ZPlayer': 964})
player [YangZ] gets hole card ['S5', 'HJ'], current stack 940
player [Ethan] gets hole card ['C9', 'D9'], current stack 872
player [HakulaPlayer] gets hole card ['SK', 'D8'], current stack 1155
player [SichengZuo] gets hole card ['H3', 'C5'], current stack 955
player [KLChen2PokerPlayer] gets hole card ['DQ', 'C4'], current stack 1601
player [Jinkun] gets hole card ['H9', 'C3'], current stack 505
player [NitWinWin] gets hole card ['DT', 'S2'], current stack 992
player [ZPlayer] gets hole card ['H5', 'DK'], current stack 964
Started the round 33
Street "preflop" started. (community card = [])
"SichengZuo" declared "fold:0"
"KLChen2PokerPlayer" declared "fold:0"
"Jinkun" declared "fold:10"
"NitWinWin" declared "fold:0"
"ZPlayer" declared "raise:15"
"YangZ" declared "fold:0"
"Ethan" declared "raise:52"
"HakulaPlayer" declared "fold:0"
"ZPlayer" declared "fold:0"
"['Ethan']" won the round 33 (stack = {'YangZ': 940, 'Ethan': 902, 'HakulaPlayer': 1155, 'SichengZuo': 955, 'KLChen2PokerPlayer': 1601, 'Jinkun': 505, 'NitWinWin': 992, 'ZPlayer': 949})
player [YangZ] gets hole card ['D8', 'D9'], current stack 940
player [Ethan] gets hole card ['CQ', 'HQ'], current stack 902
player [HakulaPlayer] gets hole card ['H9', 'H5'], current stack 1150
player [SichengZuo] gets hole card ['S7', 'H8'], current stack 945
player [KLChen2PokerPlayer] gets hole card ['HJ', 'SQ'], current stack 1601
player [Jinkun] gets hole card ['S4', 'D7'], current stack 505
player [NitWinWin] gets hole card ['DA', 'ST'], current stack 992
player [ZPlayer] gets hole card ['SK', 'S9'], current stack 949
Started the round 34
Street "preflop" started. (community card = [])
"KLChen2PokerPlayer" declared "raise:22"
"Jinkun" declared "fold:22"
"NitWinWin" declared "fold:0"
"ZPlayer" declared "call:22"
"YangZ" declared "fold:0"
"Ethan" declared "raise:270"
"HakulaPlayer" declared "fold:0"
"SichengZuo" declared "fold:0"
"KLChen2PokerPlayer" declared "fold:0"
"ZPlayer" declared "call:270"
Street "flop" started. (community card = ['SA', 'C3', 'H6'])
"ZPlayer" declared "call:0"
"Ethan" declared "call:0"
Street "turn" started. (community card = ['SA', 'C3', 'H6', 'CK'])
"ZPlayer" declared "raise:10"
"Ethan" declared "raise:587"
"ZPlayer" declared "call:587"
Street "river" started. (community card = ['SA', 'C3', 'H6', 'CK', 'H2'])
"ZPlayer" declared "call:0"
"Ethan" declared "raise:45"
"ZPlayer" declared "call:45"
"['ZPlayer']" won the round 34 (stack = {'YangZ': 940, 'Ethan': 0, 'HakulaPlayer': 1150, 'SichengZuo': 945, 'KLChen2PokerPlayer': 1579, 'Jinkun': 505, 'NitWinWin': 992, 'ZPlayer': 1888})
player [YangZ] gets hole card ['HT', 'H6'], current stack 940
player [HakulaPlayer] gets hole card ['DJ', 'D6'], current stack 1150
player [SichengZuo] gets hole card ['S6', 'DQ'], current stack 940
player [KLChen2PokerPlayer] gets hole card ['H2', 'D7'], current stack 1569
player [Jinkun] gets hole card ['H7', 'S5'], current stack 505
player [NitWinWin] gets hole card ['CA', 'S7'], current stack 992
player [ZPlayer] gets hole card ['C5', 'C3'], current stack 1888
Started the round 35
Street "preflop" started. (community card = [])
"Jinkun" declared "fold:10"
"NitWinWin" declared "fold:0"
"ZPlayer" declared "raise:15"
"YangZ" declared "fold:0"
"HakulaPlayer" declared "call:15"
"SichengZuo" declared "fold:0"
"KLChen2PokerPlayer" declared "fold:0"
Street "flop" started. (community card = ['DA', 'SK', 'SQ'])
"ZPlayer" declared "call:0"
"HakulaPlayer" declared "call:0"
Street "turn" started. (community card = ['DA', 'SK', 'SQ', 'DT'])
"ZPlayer" declared "call:0"
"HakulaPlayer" declared "raise:73"
"ZPlayer" declared "fold:0"
"['HakulaPlayer']" won the round 35 (stack = {'YangZ': 940, 'Ethan': 0, 'HakulaPlayer': 1180, 'SichengZuo': 940, 'KLChen2PokerPlayer': 1569, 'Jinkun': 505, 'NitWinWin': 992, 'ZPlayer': 1873})
player [YangZ] gets hole card ['D8', 'H3'], current stack 940
player [HakulaPlayer] gets hole card ['H2', 'DQ'], current stack 1180
player [SichengZuo] gets hole card ['CJ', 'C9'], current stack 940
player [KLChen2PokerPlayer] gets hole card ['C5', 'D7'], current stack 1564
player [Jinkun] gets hole card ['SJ', 'CT'], current stack 495
player [NitWinWin] gets hole card ['HA', 'HQ'], current stack 992
player [ZPlayer] gets hole card ['S8', 'C2'], current stack 1873
Started the round 36
Street "preflop" started. (community card = [])
"NitWinWin" declared "fold:0"
"ZPlayer" declared "raise:15"
"YangZ" declared "fold:0"
"HakulaPlayer" declared "fold:0"
"SichengZuo" declared "fold:0"
"KLChen2PokerPlayer" declared "fold:0"
"Jinkun" declared "call:15"
Street "flop" started. (community card = ['CK', 'H7', 'D5'])
"Jinkun" declared "call:0"
"ZPlayer" declared "call:0"
Street "turn" started. (community card = ['CK', 'H7', 'D5', 'H9'])
"Jinkun" declared "raise:70"
"ZPlayer" declared "fold:0"
"['Jinkun']" won the round 36 (stack = {'YangZ': 940, 'Ethan': 0, 'HakulaPlayer': 1180, 'SichengZuo': 940, 'KLChen2PokerPlayer': 1564, 'Jinkun': 525, 'NitWinWin': 992, 'ZPlayer': 1858})
player [YangZ] gets hole card ['C8', 'H5'], current stack 940
player [HakulaPlayer] gets hole card ['DA', 'D6'], current stack 1180
player [SichengZuo] gets hole card ['CT', 'D9'], current stack 940
player [KLChen2PokerPlayer] gets hole card ['ST', 'S8'], current stack 1564
player [Jinkun] gets hole card ['CA', 'H3'], current stack 520
player [NitWinWin] gets hole card ['CK', 'C9'], current stack 982
player [ZPlayer] gets hole card ['CJ', 'D2'], current stack 1858
Started the round 37
Street "preflop" started. (community card = [])
"ZPlayer" declared "raise:15"
"YangZ" declared "fold:0"
"HakulaPlayer" declared "call:15"
"SichengZuo" declared "fold:0"
"KLChen2PokerPlayer" declared "raise:23"
"Jinkun" declared "fold:23"
"NitWinWin" declared "fold:0"
"ZPlayer" declared "fold:0"
"HakulaPlayer" declared "raise:71"
"KLChen2PokerPlayer" declared "fold:0"
"['HakulaPlayer']" won the round 37 (stack = {'YangZ': 940, 'Ethan': 0, 'HakulaPlayer': 1233, 'SichengZuo': 940, 'KLChen2PokerPlayer': 1541, 'Jinkun': 520, 'NitWinWin': 982, 'ZPlayer': 1843})
player [YangZ] gets hole card ['HA', 'C4'], current stack 940
player [HakulaPlayer] gets hole card ['HT', 'SA'], current stack 1233
player [SichengZuo] gets hole card ['H7', 'H9'], current stack 940
player [KLChen2PokerPlayer] gets hole card ['C2', 'S9'], current stack 1541
player [Jinkun] gets hole card ['S2', 'S5'], current stack 520
player [NitWinWin] gets hole card ['C9', 'C3'], current stack 977
player [ZPlayer] gets hole card ['SJ', 'H4'], current stack 1833
Started the round 38
Street "preflop" started. (community card = [])
"YangZ" declared "fold:0"
"HakulaPlayer" declared "call:10"
"SichengZuo" declared "fold:0"
"KLChen2PokerPlayer" declared "fold:0"
"Jinkun" declared "call:10"
"NitWinWin" declared "fold:0"
"ZPlayer" declared "fold:0"
Street "flop" started. (community card = ['CK', 'SQ', 'S6'])
"HakulaPlayer" declared "call:0"
"Jinkun" declared "call:0"
Street "turn" started. (community card = ['CK', 'SQ', 'S6', 'S8'])
"HakulaPlayer" declared "call:0"
"Jinkun" declared "raise:16"
"HakulaPlayer" declared "call:16"
Street "river" started. (community card = ['CK', 'SQ', 'S6', 'S8', 'DJ'])
"HakulaPlayer" declared "raise:106"
"Jinkun" declared "call:106"
"['Jinkun']" won the round 38 (stack = {'YangZ': 940, 'Ethan': 0, 'HakulaPlayer': 1101, 'SichengZuo': 940, 'KLChen2PokerPlayer': 1541, 'Jinkun': 667, 'NitWinWin': 977, 'ZPlayer': 1833})
player [YangZ] gets hole card ['H7', 'C3'], current stack 930
player [HakulaPlayer] gets hole card ['DA', 'SK'], current stack 1101
player [SichengZuo] gets hole card ['C8', 'D8'], current stack 940
player [KLChen2PokerPlayer] gets hole card ['D6', 'S8'], current stack 1541
player [Jinkun] gets hole card ['C2', 'S5'], current stack 667
player [NitWinWin] gets hole card ['C5', 'ST'], current stack 977
player [ZPlayer] gets hole card ['HJ', 'CJ'], current stack 1828
Started the round 39
Street "preflop" started. (community card = [])
"HakulaPlayer" declared "call:10"
"SichengZuo" declared "fold:0"
"KLChen2PokerPlayer" declared "fold:0"
"Jinkun" declared "fold:10"
"NitWinWin" declared "fold:0"
"ZPlayer" declared "raise:15"
"YangZ" declared "fold:0"
"HakulaPlayer" declared "raise:36"
"ZPlayer" declared "call:36"
Street "flop" started. (community card = ['H6', 'H8', 'DQ'])
"ZPlayer" declared "raise:10"
"HakulaPlayer" declared "call:10"
Street "turn" started. (community card = ['H6', 'H8', 'DQ', 'DK'])
"ZPlayer" declared "raise:10"
"HakulaPlayer" declared "call:10"
Street "river" started. (community card = ['H6', 'H8', 'DQ', 'DK', 'CA'])
"ZPlayer" declared "call:0"
"HakulaPlayer" declared "raise:201"
"ZPlayer" declared "fold:0"
"['HakulaPlayer']" won the round 39 (stack = {'YangZ': 930, 'Ethan': 0, 'HakulaPlayer': 1167, 'SichengZuo': 940, 'KLChen2PokerPlayer': 1541, 'Jinkun': 667, 'NitWinWin': 977, 'ZPlayer': 1777})
player [YangZ] gets hole card ['H6', 'SA'], current stack 925
player [HakulaPlayer] gets hole card ['D9', 'DJ'], current stack 1157
player [SichengZuo] gets hole card ['D5', 'DA'], current stack 940
player [KLChen2PokerPlayer] gets hole card ['H8', 'S5'], current stack 1541
player [Jinkun] gets hole card ['C5', 'HK'], current stack 667
player [NitWinWin] gets hole card ['CT', 'H2'], current stack 977
player [ZPlayer] gets hole card ['C4', 'H3'], current stack 1777
Started the round 40
Street "preflop" started. (community card = [])
"SichengZuo" declared "fold:0"
"KLChen2PokerPlayer" declared "fold:0"
"Jinkun" declared "fold:10"
"NitWinWin" declared "fold:0"
"ZPlayer" declared "raise:15"
"YangZ" declared "fold:0"
"HakulaPlayer" declared "call:15"
Street "flop" started. (community card = ['HQ', 'H9', 'HA'])
"HakulaPlayer" declared "call:0"
"ZPlayer" declared "call:0"
Street "turn" started. (community card = ['HQ', 'H9', 'HA', 'HJ'])
"HakulaPlayer" declared "call:0"
"ZPlayer" declared "raise:10"
"HakulaPlayer" declared "call:10"
Street "river" started. (community card = ['HQ', 'H9', 'HA', 'HJ', 'D3'])
"HakulaPlayer" declared "call:0"
"ZPlayer" declared "raise:10"
"HakulaPlayer" declared "call:10"
"['ZPlayer']" won the round 40 (stack = {'YangZ': 925, 'Ethan': 0, 'HakulaPlayer': 1132, 'SichengZuo': 940, 'KLChen2PokerPlayer': 1541, 'Jinkun': 667, 'NitWinWin': 977, 'ZPlayer': 1817})
player [YangZ] gets hole card ['CJ', 'HT'], current stack 925
player [HakulaPlayer] gets hole card ['SJ', 'CQ'], current stack 1127
player [SichengZuo] gets hole card ['C4', 'C3'], current stack 930
player [KLChen2PokerPlayer] gets hole card ['C6', 'SQ'], current stack 1541
player [Jinkun] gets hole card ['C9', 'D6'], current stack 667
player [NitWinWin] gets hole card ['SA', 'C5'], current stack 977
player [ZPlayer] gets hole card ['S2', 'D5'], current stack 1817
Started the round 41
Street "preflop" started. (community card = [])
"KLChen2PokerPlayer" declared "fold:0"
"Jinkun" declared "fold:10"
"NitWinWin" declared "fold:0"
"ZPlayer" declared "raise:15"
"YangZ" declared "fold:0"
"HakulaPlayer" declared "call:15"
"SichengZuo" declared "fold:0"
Street "flop" started. (community card = ['C2', 'S7', 'DQ'])
"HakulaPlayer" declared "call:0"
"ZPlayer" declared "call:0"
Street "turn" started. (community card = ['C2', 'S7', 'DQ', 'H4'])
"HakulaPlayer" declared "raise:45"
"ZPlayer" declared "fold:0"
"['HakulaPlayer']" won the round 41 (stack = {'YangZ': 925, 'Ethan': 0, 'HakulaPlayer': 1157, 'SichengZuo': 930, 'KLChen2PokerPlayer': 1541, 'Jinkun': 667, 'NitWinWin': 977, 'ZPlayer': 1802})
player [YangZ] gets hole card ['D4', 'SK'], current stack 925
player [HakulaPlayer] gets hole card ['CQ', 'H7'], current stack 1157
player [SichengZuo] gets hole card ['H5', 'DT'], current stack 925
player [KLChen2PokerPlayer] gets hole card ['D7', 'SA'], current stack 1531
player [Jinkun] gets hole card ['D5', 'S3'], current stack 667
player [NitWinWin] gets hole card ['S7', 'HQ'], current stack 977
player [ZPlayer] gets hole card ['C3', 'CA'], current stack 1802
Started the round 42
Street "preflop" started. (community card = [])
"Jinkun" declared "fold:10"
"NitWinWin" declared "fold:0"
"ZPlayer" declared "raise:15"
"YangZ" declared "fold:0"
"HakulaPlayer" declared "call:15"
"SichengZuo" declared "fold:0"
"KLChen2PokerPlayer" declared "raise:24"
"ZPlayer" declared "call:24"
"HakulaPlayer" declared "call:24"
Street "flop" started. (community card = ['H4', 'H6', 'H3'])
"KLChen2PokerPlayer" declared "call:0"
"ZPlayer" declared "call:0"
"HakulaPlayer" declared "raise:74"
"KLChen2PokerPlayer" declared "fold:0"
"ZPlayer" declared "fold:0"
"['HakulaPlayer']" won the round 42 (stack = {'YangZ': 925, 'Ethan': 0, 'HakulaPlayer': 1210, 'SichengZuo': 925, 'KLChen2PokerPlayer': 1517, 'Jinkun': 667, 'NitWinWin': 977, 'ZPlayer': 1778})
player [YangZ] gets hole card ['H8', 'S6'], current stack 925
player [HakulaPlayer] gets hole card ['HQ', 'DA'], current stack 1210
player [SichengZuo] gets hole card ['D2', 'C3'], current stack 925
player [KLChen2PokerPlayer] gets hole card ['S4', 'DK'], current stack 1512
player [Jinkun] gets hole card ['S7', 'S3'], current stack 657
player [NitWinWin] gets hole card ['D8', 'HT'], current stack 977
player [ZPlayer] gets hole card ['C2', 'S5'], current stack 1778
Started the round 43
Street "preflop" started. (community card = [])
"NitWinWin" declared "fold:0"
"ZPlayer" declared "raise:15"
"YangZ" declared "fold:0"
"HakulaPlayer" declared "call:15"
"SichengZuo" declared "fold:0"
"KLChen2PokerPlayer" declared "raise:20"
"Jinkun" declared "fold:20"
"ZPlayer" declared "fold:0"
"HakulaPlayer" declared "call:20"
Street "flop" started. (community card = ['SQ', 'C6', 'ST'])
"KLChen2PokerPlayer" declared "call:0"
"HakulaPlayer" declared "call:0"
Street "turn" started. (community card = ['SQ', 'C6', 'ST', 'H4'])
"KLChen2PokerPlayer" declared "call:0"
"HakulaPlayer" declared "raise:93"
"KLChen2PokerPlayer" declared "fold:0"
"['HakulaPlayer']" won the round 43 (stack = {'YangZ': 925, 'Ethan': 0, 'HakulaPlayer': 1255, 'SichengZuo': 925, 'KLChen2PokerPlayer': 1497, 'Jinkun': 657, 'NitWinWin': 977, 'ZPlayer': 1763})
player [YangZ] gets hole card ['H6', 'C6'], current stack 925
player [HakulaPlayer] gets hole card ['SQ', 'H4'], current stack 1255
player [SichengZuo] gets hole card ['S4', 'D9'], current stack 925
player [KLChen2PokerPlayer] gets hole card ['CQ', 'HK'], current stack 1497
player [Jinkun] gets hole card ['H7', 'S9'], current stack 652
player [NitWinWin] gets hole card ['D4', 'DA'], current stack 967
player [ZPlayer] gets hole card ['C5', 'SA'], current stack 1763
Started the round 44
Street "preflop" started. (community card = [])
"ZPlayer" declared "raise:15"
"YangZ" declared "fold:0"
"HakulaPlayer" declared "fold:0"
"SichengZuo" declared "fold:0"
"KLChen2PokerPlayer" declared "raise:20"
"Jinkun" declared "fold:20"
"NitWinWin" declared "fold:0"
"ZPlayer" declared "call:20"
Street "flop" started. (community card = ['CT', 'DJ', 'D3'])
"ZPlayer" declared "call:0"
"KLChen2PokerPlayer" declared "raise:11"
"ZPlayer" declared "fold:0"
"['KLChen2PokerPlayer']" won the round 44 (stack = {'YangZ': 925, 'Ethan': 0, 'HakulaPlayer': 1255, 'SichengZuo': 925, 'KLChen2PokerPlayer': 1532, 'Jinkun': 652, 'NitWinWin': 967, 'ZPlayer': 1743})
player [YangZ] gets hole card ['ST', 'S4'], current stack 925
player [HakulaPlayer] gets hole card ['D4', 'S2'], current stack 1255
player [SichengZuo] gets hole card ['DQ', 'D5'], current stack 925
player [KLChen2PokerPlayer] gets hole card ['C2', 'D3'], current stack 1532
player [Jinkun] gets hole card ['H8', 'DK'], current stack 652
player [NitWinWin] gets hole card ['D7', 'C7'], current stack 962
player [ZPlayer] gets hole card ['CQ', 'S8'], current stack 1733
Started the round 45
Street "preflop" started. (community card = [])
"YangZ" declared "fold:0"
"HakulaPlayer" declared "fold:0"
"SichengZuo" declared "fold:0"
"KLChen2PokerPlayer" declared "call:10"
"Jinkun" declared "call:10"
"NitWinWin" declared "fold:0"
"ZPlayer" declared "call:10"
Street "flop" started. (community card = ['D6', 'DA', 'C9'])
"ZPlayer" declared "call:0"
"KLChen2PokerPlayer" declared "call:0"
"Jinkun" declared "call:0"
Street "turn" started. (community card = ['D6', 'DA', 'C9', 'H9'])
"ZPlayer" declared "call:0"
"KLChen2PokerPlayer" declared "call:0"
"Jinkun" declared "call:0"
Street "river" started. (community card = ['D6', 'DA', 'C9', 'H9', 'HQ'])
"ZPlayer" declared "raise:1047"
"KLChen2PokerPlayer" declared "fold:0"
"Jinkun" declared "fold:1047"
"['ZPlayer']" won the round 45 (stack = {'YangZ': 925, 'Ethan': 0, 'HakulaPlayer': 1255, 'SichengZuo': 925, 'KLChen2PokerPlayer': 1522, 'Jinkun': 642, 'NitWinWin': 962, 'ZPlayer': 1768})
player [YangZ] gets hole card ['CQ', 'D4'], current stack 915
player [HakulaPlayer] gets hole card ['D5', 'C3'], current stack 1255
player [SichengZuo] gets hole card ['SQ', 'DQ'], current stack 925
player [KLChen2PokerPlayer] gets hole card ['H3', 'S8'], current stack 1522
player [Jinkun] gets hole card ['C6', 'S9'], current stack 642
player [NitWinWin] gets hole card ['CA', 'H7'], current stack 962
player [ZPlayer] gets hole card ['DT', 'C9'], current stack 1763
Started the round 46
Street "preflop" started. (community card = [])
"HakulaPlayer" declared "fold:0"
"SichengZuo" declared "fold:0"
"KLChen2PokerPlayer" declared "fold:0"
"Jinkun" declared "call:10"
"NitWinWin" declared "fold:0"
"ZPlayer" declared "raise:15"
"YangZ" declared "fold:0"
"Jinkun" declared "call:15"
Street "flop" started. (community card = ['S6', 'H6', 'S7'])
"ZPlayer" declared "call:0"
"Jinkun" declared "raise:18"
"ZPlayer" declared "fold:0"
"['Jinkun']" won the round 46 (stack = {'YangZ': 915, 'Ethan': 0, 'HakulaPlayer': 1255, 'SichengZuo': 925, 'KLChen2PokerPlayer': 1522, 'Jinkun': 667, 'NitWinWin': 962, 'ZPlayer': 1753})
player [YangZ] gets hole card ['ST', 'DA'], current stack 910
player [HakulaPlayer] gets hole card ['S3', 'C2'], current stack 1245
player [SichengZuo] gets hole card ['C4', 'DJ'], current stack 925
player [KLChen2PokerPlayer] gets hole card ['SQ', 'SJ'], current stack 1522
player [Jinkun] gets hole card ['HT', 'HJ'], current stack 667
player [NitWinWin] gets hole card ['S5', 'D8'], current stack 962
player [ZPlayer] gets hole card ['SK', 'C9'], current stack 1753
Started the round 47
Street "preflop" started. (community card = [])
"SichengZuo" declared "fold:0"
"KLChen2PokerPlayer" declared "raise:16"
"Jinkun" declared "fold:16"
"NitWinWin" declared "fold:0"
"ZPlayer" declared "raise:22"
"YangZ" declared "fold:0"
"HakulaPlayer" declared "fold:0"
"KLChen2PokerPlayer" declared "fold:0"
"['ZPlayer']" won the round 47 (stack = {'YangZ': 910, 'Ethan': 0, 'HakulaPlayer': 1245, 'SichengZuo': 925, 'KLChen2PokerPlayer': 1506, 'Jinkun': 667, 'NitWinWin': 962, 'ZPlayer': 1784})
player [YangZ] gets hole card ['H6', 'D4'], current stack 910
player [HakulaPlayer] gets hole card ['CK', 'S6'], current stack 1240
player [SichengZuo] gets hole card ['D9', 'SQ'], current stack 915
player [KLChen2PokerPlayer] gets hole card ['HK', 'HJ'], current stack 1506
player [Jinkun] gets hole card ['S4', 'C4'], current stack 667
player [NitWinWin] gets hole card ['H4', 'S7'], current stack 962
player [ZPlayer] gets hole card ['S2', 'H7'], current stack 1784
Started the round 48
Street "preflop" started. (community card = [])
"KLChen2PokerPlayer" declared "raise:16"
"Jinkun" declared "fold:16"
"NitWinWin" declared "fold:0"
"ZPlayer" declared "fold:0"
"YangZ" declared "fold:0"
"HakulaPlayer" declared "call:16"
"SichengZuo" declared "fold:0"
Street "flop" started. (community card = ['C3', 'S5', 'SK'])
"HakulaPlayer" declared "raise:51"
"KLChen2PokerPlayer" declared "call:51"
Street "turn" started. (community card = ['C3', 'S5', 'SK', 'H8'])
"HakulaPlayer" declared "raise:185"
"KLChen2PokerPlayer" declared "call:185"
Street "river" started. (community card = ['C3', 'S5', 'SK', 'H8', 'D8'])
"HakulaPlayer" declared "raise:655"
"KLChen2PokerPlayer" declared "call:655"
"['KLChen2PokerPlayer']" won the round 48 (stack = {'YangZ': 910, 'Ethan': 0, 'HakulaPlayer': 338, 'SichengZuo': 915, 'KLChen2PokerPlayer': 2423, 'Jinkun': 667, 'NitWinWin': 962, 'ZPlayer': 1784})
player [YangZ] gets hole card ['D2', 'SJ'], current stack 910
player [HakulaPlayer] gets hole card ['CJ', 'C9'], current stack 338
player [SichengZuo] gets hole card ['C7', 'H2'], current stack 910
player [KLChen2PokerPlayer] gets hole card ['S3', 'C8'], current stack 2413
player [Jinkun] gets hole card ['DK', 'S6'], current stack 667
player [NitWinWin] gets hole card ['ST', 'DJ'], current stack 962
player [ZPlayer] gets hole card ['H9', 'CT'], current stack 1784
Started the round 49
Street "preflop" started. (community card = [])
"Jinkun" declared "fold:10"
"NitWinWin" declared "fold:0"
"ZPlayer" declared "raise:15"
"YangZ" declared "fold:0"
"HakulaPlayer" declared "call:15"
"SichengZuo" declared "fold:0"
"KLChen2PokerPlayer" declared "fold:0"
Street "flop" started. (community card = ['DT', 'DA', 'S8'])
"ZPlayer" declared "raise:10"
"HakulaPlayer" declared "call:10"
Street "turn" started. (community card = ['DT', 'DA', 'S8', 'S9'])
"ZPlayer" declared "raise:10"
"HakulaPlayer" declared "call:10"
Street "river" started. (community card = ['DT', 'DA', 'S8', 'S9', 'C4'])
"ZPlayer" declared "raise:876"
"HakulaPlayer" declared "fold:0"
"['ZPlayer']" won the round 49 (stack = {'YangZ': 910, 'Ethan': 0, 'HakulaPlayer': 303, 'SichengZuo': 910, 'KLChen2PokerPlayer': 2413, 'Jinkun': 667, 'NitWinWin': 962, 'ZPlayer': 1834})
player [YangZ] gets hole card ['D7', 'ST'], current stack 910
player [HakulaPlayer] gets hole card ['C2', 'HK'], current stack 303
player [SichengZuo] gets hole card ['HQ', 'H6'], current stack 910
player [KLChen2PokerPlayer] gets hole card ['D2', 'DT'], current stack 2408
player [Jinkun] gets hole card ['SK', 'S4'], current stack 657
player [NitWinWin] gets hole card ['H9', 'S2'], current stack 962
player [ZPlayer] gets hole card ['SA', 'CQ'], current stack 1834
Started the round 50
Street "preflop" started. (community card = [])
"NitWinWin" declared "fold:0"
"ZPlayer" declared "raise:15"
"YangZ" declared "fold:0"
"HakulaPlayer" declared "call:15"
"SichengZuo" declared "fold:0"
"KLChen2PokerPlayer" declared "fold:0"
"Jinkun" declared "call:15"
Street "flop" started. (community card = ['DQ', 'CT', 'S8'])
"Jinkun" declared "call:0"
"ZPlayer" declared "raise:171"
"HakulaPlayer" declared "fold:0"
"Jinkun" declared "fold:171"
"['ZPlayer']" won the round 50 (stack = {'YangZ': 910, 'Ethan': 0, 'HakulaPlayer': 288, 'SichengZuo': 910, 'KLChen2PokerPlayer': 2408, 'Jinkun': 652, 'NitWinWin': 962, 'ZPlayer': 1869})

Game Results:
------------------------------------------------------------
Game 1:
Winner: KLChen2PokerPlayer (stack: 2408)
All players' stacks:
  YangZ: 910
  Ethan: 0
  HakulaPlayer: 288
  SichengZuo: 910
  KLChen2PokerPlayer: 2408
  Jinkun: 652
  NitWinWin: 962
  ZPlayer: 1869
------------------------------------------------------------
