player [YangZ] gets hole card ['DK', 'H8'], current stack 1000
player [Ethan] gets hole card ['HQ', 'H4'], current stack 995
player [HakulaPlayer] gets hole card ['DJ', 'D3'], current stack 990
player [SichengZuo] gets hole card ['DA', 'S9'], current stack 1000
player [KLChen2PokerPlayer] gets hole card ['CT', 'D4'], current stack 1000
player [Jinkun] gets hole card ['C5', 'D7'], current stack 1000
player [NitWinWin] gets hole card ['D8', 'SA'], current stack 1000
player [ZPlayer] gets hole card ['D6', 'D5'], current stack 1000
Started the round 1
Street "preflop" started. (community card = [])
"SichengZuo" declared "fold:0"
"KLChen2PokerPlayer" declared "fold:0"
"Jinkun" declared "fold:10"
"NitWinWin" declared "fold:0"
"ZPlayer" declared "raise:15"
"YangZ" declared "fold:0"
"Ethan" declared "fold:0"
"HakulaPlayer" declared "call:15"
Street "flop" started. (community card = ['H9', 'C9', 'SQ'])
"HakulaPlayer" declared "call:0"
"ZPlayer" declared "call:0"
Street "turn" started. (community card = ['H9', 'C9', 'SQ', 'C2'])
"HakulaPlayer" declared "call:0"
"ZPlayer" declared "call:0"
Street "river" started. (community card = ['H9', 'C9', 'SQ', 'C2', 'H3'])
"HakulaPlayer" declared "raise:38"
"ZPlayer" declared "fold:0"
"['HakulaPlayer']" won the round 1 (stack = {'YangZ': 1000, 'Ethan': 995, 'HakulaPlayer': 1020, 'SichengZuo': 1000, 'KLChen2PokerPlayer': 1000, 'Jinkun': 1000, 'NitWinWin': 1000, 'ZPlayer': 985})
player [YangZ] gets hole card ['HJ', 'DT'], current stack 1000
player [Ethan] gets hole card ['H5', 'C5'], current stack 995
player [HakulaPlayer] gets hole card ['HK', 'SK'], current stack 1015
player [SichengZuo] gets hole card ['D5', 'HA'], current stack 990
player [KLChen2PokerPlayer] gets hole card ['S2', 'DK'], current stack 1000
player [Jinkun] gets hole card ['S7', 'DJ'], current stack 1000
player [NitWinWin] gets hole card ['CT', 'H9'], current stack 1000
player [ZPlayer] gets hole card ['C4', 'D2'], current stack 985
Started the round 2
Street "preflop" started. (community card = [])
"KLChen2PokerPlayer" declared "fold:0"
"Jinkun" declared "fold:10"
"NitWinWin" declared "fold:0"
"ZPlayer" declared "call:10"
"YangZ" declared "fold:0"
"Ethan" declared "fold:0"
"HakulaPlayer" declared "raise:34"
"SichengZuo" declared "fold:0"
"ZPlayer" declared "fold:0"
"['HakulaPlayer']" won the round 2 (stack = {'YangZ': 1000, 'Ethan': 995, 'HakulaPlayer': 1040, 'SichengZuo': 990, 'KLChen2PokerPlayer': 1000, 'Jinkun': 1000, 'NitWinWin': 1000, 'ZPlayer': 975})
player [YangZ] gets hole card ['C9', 'D5'], current stack 1000
player [Ethan] gets hole card ['S7', 'D7'], current stack 995
player [HakulaPlayer] gets hole card ['S4', 'HJ'], current stack 1040
player [SichengZuo] gets hole card ['CQ', 'D8'], current stack 985
player [KLChen2PokerPlayer] gets hole card ['ST', 'S9'], current stack 990
player [Jinkun] gets hole card ['D4', 'D6'], current stack 1000
player [NitWinWin] gets hole card ['SJ', 'D3'], current stack 1000
player [ZPlayer] gets hole card ['DQ', 'DT'], current stack 975
Started the round 3
Street "preflop" started. (community card = [])
"Jinkun" declared "fold:10"
"NitWinWin" declared "fold:0"
"ZPlayer" declared "raise:15"
"YangZ" declared "fold:0"
"Ethan" declared "fold:0"
"HakulaPlayer" declared "fold:0"
"SichengZuo" declared "fold:0"
"KLChen2PokerPlayer" declared "raise:20"
"ZPlayer" declared "fold:0"
"['KLChen2PokerPlayer']" won the round 3 (stack = {'YangZ': 1000, 'Ethan': 995, 'HakulaPlayer': 1040, 'SichengZuo': 985, 'KLChen2PokerPlayer': 1020, 'Jinkun': 1000, 'NitWinWin': 1000, 'ZPlayer': 960})
player [YangZ] gets hole card ['H4', 'C5'], current stack 1000
player [Ethan] gets hole card ['S8', 'C6'], current stack 995
player [HakulaPlayer] gets hole card ['C3', 'CK'], current stack 1040
player [SichengZuo] gets hole card ['C4', 'C7'], current stack 985
player [KLChen2PokerPlayer] gets hole card ['D8', 'H3'], current stack 1015
player [Jinkun] gets hole card ['D9', 'D4'], current stack 990
player [NitWinWin] gets hole card ['S5', 'H5'], current stack 1000
player [ZPlayer] gets hole card ['D6', 'C8'], current stack 960
Started the round 4
Street "preflop" started. (community card = [])
"NitWinWin" declared "fold:0"
"ZPlayer" declared "call:10"
"YangZ" declared "fold:0"
"Ethan" declared "fold:0"
"HakulaPlayer" declared "call:10"
"SichengZuo" declared "fold:0"
"KLChen2PokerPlayer" declared "fold:0"
"Jinkun" declared "call:10"
Street "flop" started. (community card = ['DT', 'S4', 'HK'])
"Jinkun" declared "call:0"
"ZPlayer" declared "call:0"
"HakulaPlayer" declared "raise:32"
"Jinkun" declared "fold:32"
"ZPlayer" declared "fold:0"
"['HakulaPlayer']" won the round 4 (stack = {'YangZ': 1000, 'Ethan': 995, 'HakulaPlayer': 1065, 'SichengZuo': 985, 'KLChen2PokerPlayer': 1015, 'Jinkun': 990, 'NitWinWin': 1000, 'ZPlayer': 950})
player [YangZ] gets hole card ['S2', 'SQ'], current stack 1000
player [Ethan] gets hole card ['CQ', 'C4'], current stack 995
player [HakulaPlayer] gets hole card ['C6', 'C5'], current stack 1065
player [SichengZuo] gets hole card ['HT', 'CJ'], current stack 985
player [KLChen2PokerPlayer] gets hole card ['S5', 'H5'], current stack 1015
player [Jinkun] gets hole card ['C3', 'H9'], current stack 985
player [NitWinWin] gets hole card ['C2', 'DQ'], current stack 990
player [ZPlayer] gets hole card ['DJ', 'H3'], current stack 950
Started the round 5
Street "preflop" started. (community card = [])
"ZPlayer" declared "call:10"
"YangZ" declared "fold:0"
"Ethan" declared "fold:0"
"HakulaPlayer" declared "call:10"
"SichengZuo" declared "fold:0"
"KLChen2PokerPlayer" declared "raise:18"
"Jinkun" declared "fold:18"
"NitWinWin" declared "fold:0"
"ZPlayer" declared "call:18"
"HakulaPlayer" declared "call:18"
Street "flop" started. (community card = ['D9', 'D8', 'CT'])
"ZPlayer" declared "call:0"
"HakulaPlayer" declared "call:0"
"KLChen2PokerPlayer" declared "call:0"
Street "turn" started. (community card = ['D9', 'D8', 'CT', 'D4'])
"ZPlayer" declared "call:0"
"HakulaPlayer" declared "call:0"
"KLChen2PokerPlayer" declared "call:0"
Street "river" started. (community card = ['D9', 'D8', 'CT', 'D4', 'H6'])
"ZPlayer" declared "call:0"
"HakulaPlayer" declared "call:0"
"KLChen2PokerPlayer" declared "call:0"
"['HakulaPlayer']" won the round 5 (stack = {'YangZ': 1000, 'Ethan': 995, 'HakulaPlayer': 1116, 'SichengZuo': 985, 'KLChen2PokerPlayer': 997, 'Jinkun': 985, 'NitWinWin': 990, 'ZPlayer': 932})
player [YangZ] gets hole card ['H6', 'H4'], current stack 1000
player [Ethan] gets hole card ['D9', 'D4'], current stack 995
player [HakulaPlayer] gets hole card ['D8', 'D5'], current stack 1116
player [SichengZuo] gets hole card ['CT', 'CA'], current stack 985
player [KLChen2PokerPlayer] gets hole card ['D7', 'DA'], current stack 997
player [Jinkun] gets hole card ['C5', 'S4'], current stack 985
player [NitWinWin] gets hole card ['S6', 'HJ'], current stack 985
player [ZPlayer] gets hole card ['C6', 'S7'], current stack 922
Started the round 6
Street "preflop" started. (community card = [])
"YangZ" declared "fold:0"
"Ethan" declared "fold:0"
"HakulaPlayer" declared "fold:0"
"SichengZuo" declared "fold:0"
"KLChen2PokerPlayer" declared "raise:15"
"Jinkun" declared "fold:15"
"NitWinWin" declared "fold:0"
"ZPlayer" declared "call:15"
Street "flop" started. (community card = ['ST', 'CQ', 'C3'])
"ZPlayer" declared "call:0"
"KLChen2PokerPlayer" declared "call:0"
Street "turn" started. (community card = ['ST', 'CQ', 'C3', 'H3'])
"ZPlayer" declared "call:0"
"KLChen2PokerPlayer" declared "call:0"
Street "river" started. (community card = ['ST', 'CQ', 'C3', 'H3', 'CJ'])
"ZPlayer" declared "call:0"
"KLChen2PokerPlayer" declared "call:0"
"['KLChen2PokerPlayer']" won the round 6 (stack = {'YangZ': 1000, 'Ethan': 995, 'HakulaPlayer': 1116, 'SichengZuo': 985, 'KLChen2PokerPlayer': 1017, 'Jinkun': 985, 'NitWinWin': 985, 'ZPlayer': 917})
player [YangZ] gets hole card ['C8', 'ST'], current stack 990
player [Ethan] gets hole card ['D8', 'HK'], current stack 995
player [HakulaPlayer] gets hole card ['DQ', 'S9'], current stack 1116
player [SichengZuo] gets hole card ['H6', 'C7'], current stack 985
player [KLChen2PokerPlayer] gets hole card ['DK', 'S5'], current stack 1017
player [Jinkun] gets hole card ['SA', 'C4'], current stack 985
player [NitWinWin] gets hole card ['SJ', 'C2'], current stack 985
player [ZPlayer] gets hole card ['SQ', 'C6'], current stack 912
Started the round 7
Street "preflop" started. (community card = [])
"Ethan" declared "fold:0"
"HakulaPlayer" declared "fold:0"
"SichengZuo" declared "fold:0"
"KLChen2PokerPlayer" declared "call:10"
"Jinkun" declared "fold:10"
"NitWinWin" declared "fold:0"
"ZPlayer" declared "raise:15"
"YangZ" declared "fold:0"
"KLChen2PokerPlayer" declared "fold:0"
"['ZPlayer']" won the round 7 (stack = {'YangZ': 990, 'Ethan': 995, 'HakulaPlayer': 1116, 'SichengZuo': 985, 'KLChen2PokerPlayer': 1007, 'Jinkun': 985, 'NitWinWin': 985, 'ZPlayer': 937})
player [YangZ] gets hole card ['C4', 'SQ'], current stack 985
player [Ethan] gets hole card ['S6', 'H2'], current stack 985
player [HakulaPlayer] gets hole card ['D9', 'CQ'], current stack 1116
player [SichengZuo] gets hole card ['S5', 'S2'], current stack 985
player [KLChen2PokerPlayer] gets hole card ['H5', 'S7'], current stack 1007
player [Jinkun] gets hole card ['H6', 'CJ'], current stack 985
player [NitWinWin] gets hole card ['D8', 'HA'], current stack 985
player [ZPlayer] gets hole card ['HT', 'C9'], current stack 937
Started the round 8
Street "preflop" started. (community card = [])
"HakulaPlayer" declared "fold:0"
"SichengZuo" declared "fold:0"
"KLChen2PokerPlayer" declared "fold:0"
"Jinkun" declared "fold:10"
"NitWinWin" declared "fold:0"
"ZPlayer" declared "raise:15"
"YangZ" declared "fold:0"
"Ethan" declared "fold:0"
"['ZPlayer']" won the round 8 (stack = {'YangZ': 985, 'Ethan': 985, 'HakulaPlayer': 1116, 'SichengZuo': 985, 'KLChen2PokerPlayer': 1007, 'Jinkun': 985, 'NitWinWin': 985, 'ZPlayer': 952})
player [YangZ] gets hole card ['ST', 'HQ'], current stack 985
player [Ethan] gets hole card ['DK', 'H4'], current stack 980
player [HakulaPlayer] gets hole card ['D9', 'C5'], current stack 1106
player [SichengZuo] gets hole card ['CJ', 'C4'], current stack 985
player [KLChen2PokerPlayer] gets hole card ['H5', 'DT'], current stack 1007
player [Jinkun] gets hole card ['H9', 'H6'], current stack 985
player [NitWinWin] gets hole card ['SK', 'D7'], current stack 985
player [ZPlayer] gets hole card ['DA', 'HT'], current stack 952
Started the round 9
Street "preflop" started. (community card = [])
"SichengZuo" declared "fold:0"
"KLChen2PokerPlayer" declared "call:10"
"Jinkun" declared "fold:10"
"NitWinWin" declared "fold:0"
"ZPlayer" declared "raise:15"
"YangZ" declared "fold:0"
"Ethan" declared "fold:0"
"HakulaPlayer" declared "call:15"
"KLChen2PokerPlayer" declared "raise:20"
"ZPlayer" declared "fold:0"
"HakulaPlayer" declared "call:20"
Street "flop" started. (community card = ['S9', 'S3', 'S7'])
"HakulaPlayer" declared "call:0"
"KLChen2PokerPlayer" declared "call:0"
Street "turn" started. (community card = ['S9', 'S3', 'S7', 'S5'])
"HakulaPlayer" declared "call:0"
"KLChen2PokerPlayer" declared "call:0"
Street "river" started. (community card = ['S9', 'S3', 'S7', 'S5', 'S8'])
"HakulaPlayer" declared "raise:67"
"KLChen2PokerPlayer" declared "fold:0"
"['HakulaPlayer']" won the round 9 (stack = {'YangZ': 985, 'Ethan': 980, 'HakulaPlayer': 1156, 'SichengZuo': 985, 'KLChen2PokerPlayer': 987, 'Jinkun': 985, 'NitWinWin': 985, 'ZPlayer': 937})
player [YangZ] gets hole card ['C6', 'H8'], current stack 985
player [Ethan] gets hole card ['HQ', 'D9'], current stack 980
player [HakulaPlayer] gets hole card ['C7', 'S4'], current stack 1151
player [SichengZuo] gets hole card ['D2', 'S2'], current stack 975
player [KLChen2PokerPlayer] gets hole card ['CT', 'S7'], current stack 987
player [Jinkun] gets hole card ['SK', 'S8'], current stack 985
player [NitWinWin] gets hole card ['H9', 'H2'], current stack 985
player [ZPlayer] gets hole card ['D7', 'D8'], current stack 937
Started the round 10
Street "preflop" started. (community card = [])
"KLChen2PokerPlayer" declared "raise:19"
"Jinkun" declared "fold:19"
"NitWinWin" declared "fold:0"
"ZPlayer" declared "call:19"
"YangZ" declared "fold:0"
"Ethan" declared "fold:0"
"HakulaPlayer" declared "fold:0"
"SichengZuo" declared "fold:0"
Street "flop" started. (community card = ['D5', 'C5', 'ST'])
"KLChen2PokerPlayer" declared "raise:37"
"ZPlayer" declared "fold:0"
"['KLChen2PokerPlayer']" won the round 10 (stack = {'YangZ': 985, 'Ethan': 980, 'HakulaPlayer': 1151, 'SichengZuo': 975, 'KLChen2PokerPlayer': 1021, 'Jinkun': 985, 'NitWinWin': 985, 'ZPlayer': 918})
player [YangZ] gets hole card ['SA', 'S4'], current stack 985
player [Ethan] gets hole card ['DA', 'SK'], current stack 980
player [HakulaPlayer] gets hole card ['HK', 'CJ'], current stack 1151
player [SichengZuo] gets hole card ['C5', 'D7'], current stack 970
player [KLChen2PokerPlayer] gets hole card ['S3', 'DQ'], current stack 1011
player [Jinkun] gets hole card ['HQ', 'CA'], current stack 985
player [NitWinWin] gets hole card ['D4', 'S8'], current stack 985
player [ZPlayer] gets hole card ['H3', 'H9'], current stack 918
Started the round 11
Street "preflop" started. (community card = [])
"Jinkun" declared "fold:10"
"NitWinWin" declared "fold:0"
"ZPlayer" declared "fold:0"
"YangZ" declared "fold:0"
"Ethan" declared "raise:294"
"HakulaPlayer" declared "fold:0"
"SichengZuo" declared "fold:0"
"KLChen2PokerPlayer" declared "fold:0"
"['Ethan']" won the round 11 (stack = {'YangZ': 985, 'Ethan': 995, 'HakulaPlayer': 1151, 'SichengZuo': 970, 'KLChen2PokerPlayer': 1011, 'Jinkun': 985, 'NitWinWin': 985, 'ZPlayer': 918})
player [YangZ] gets hole card ['C6', 'S5'], current stack 985
player [Ethan] gets hole card ['S6', 'S7'], current stack 995
player [HakulaPlayer] gets hole card ['H7', 'DQ'], current stack 1151
player [SichengZuo] gets hole card ['D6', 'C9'], current stack 970
player [KLChen2PokerPlayer] gets hole card ['H3', 'HK'], current stack 1006
player [Jinkun] gets hole card ['HJ', 'S4'], current stack 975
player [NitWinWin] gets hole card ['D4', 'S9'], current stack 985
player [ZPlayer] gets hole card ['H6', 'CK'], current stack 918
Started the round 12
Street "preflop" started. (community card = [])
"NitWinWin" declared "fold:0"
"ZPlayer" declared "call:10"
"YangZ" declared "fold:0"
"Ethan" declared "fold:0"
"HakulaPlayer" declared "call:10"
"SichengZuo" declared "fold:0"
"KLChen2PokerPlayer" declared "raise:15"
"Jinkun" declared "fold:15"
"ZPlayer" declared "call:15"
"HakulaPlayer" declared "call:15"
Street "flop" started. (community card = ['C4', 'S8', 'D5'])
"KLChen2PokerPlayer" declared "call:0"
"ZPlayer" declared "call:0"
"HakulaPlayer" declared "call:0"
Street "turn" started. (community card = ['C4', 'S8', 'D5', 'SJ'])
"KLChen2PokerPlayer" declared "call:0"
"ZPlayer" declared "call:0"
"HakulaPlayer" declared "call:0"
Street "river" started. (community card = ['C4', 'S8', 'D5', 'SJ', 'HQ'])
"KLChen2PokerPlayer" declared "call:0"
"ZPlayer" declared "call:0"
"HakulaPlayer" declared "raise:68"
"KLChen2PokerPlayer" declared "fold:0"
"ZPlayer" declared "fold:0"
"['HakulaPlayer']" won the round 12 (stack = {'YangZ': 985, 'Ethan': 995, 'HakulaPlayer': 1191, 'SichengZuo': 970, 'KLChen2PokerPlayer': 996, 'Jinkun': 975, 'NitWinWin': 985, 'ZPlayer': 903})
player [YangZ] gets hole card ['DQ', 'DK'], current stack 985
player [Ethan] gets hole card ['HK', 'S2'], current stack 995
player [HakulaPlayer] gets hole card ['S3', 'HA'], current stack 1191
player [SichengZuo] gets hole card ['D7', 'CK'], current stack 970
player [KLChen2PokerPlayer] gets hole card ['D8', 'C8'], current stack 996
player [Jinkun] gets hole card ['H9', 'SJ'], current stack 970
player [NitWinWin] gets hole card ['CQ', 'S6'], current stack 975
player [ZPlayer] gets hole card ['C4', 'SK'], current stack 903
Started the round 13
Street "preflop" started. (community card = [])
"ZPlayer" declared "call:10"
"YangZ" declared "fold:0"
"Ethan" declared "fold:0"
"HakulaPlayer" declared "call:10"
"SichengZuo" declared "fold:0"
"KLChen2PokerPlayer" declared "raise:24"
"Jinkun" declared "fold:24"
"NitWinWin" declared "fold:0"
"ZPlayer" declared "call:24"
"HakulaPlayer" declared "call:24"
Street "flop" started. (community card = ['HT', 'H3', 'C3'])
"ZPlayer" declared "call:0"
"HakulaPlayer" declared "raise:106"
"KLChen2PokerPlayer" declared "fold:0"
"ZPlayer" declared "fold:0"
"['HakulaPlayer']" won the round 13 (stack = {'YangZ': 985, 'Ethan': 995, 'HakulaPlayer': 1254, 'SichengZuo': 970, 'KLChen2PokerPlayer': 972, 'Jinkun': 970, 'NitWinWin': 975, 'ZPlayer': 879})
player [YangZ] gets hole card ['S7', 'S6'], current stack 985
player [Ethan] gets hole card ['S4', 'DA'], current stack 995
player [HakulaPlayer] gets hole card ['DK', 'C5'], current stack 1254
player [SichengZuo] gets hole card ['HT', 'HA'], current stack 970
player [KLChen2PokerPlayer] gets hole card ['CT', 'C7'], current stack 972
player [Jinkun] gets hole card ['H7', 'C4'], current stack 970
player [NitWinWin] gets hole card ['S5', 'C3'], current stack 970
player [ZPlayer] gets hole card ['S8', 'HK'], current stack 869
Started the round 14
Street "preflop" started. (community card = [])
"YangZ" declared "fold:0"
"Ethan" declared "fold:0"
"HakulaPlayer" declared "fold:0"
"SichengZuo" declared "fold:0"
"KLChen2PokerPlayer" declared "raise:20"
"Jinkun" declared "fold:20"
"NitWinWin" declared "fold:0"
"ZPlayer" declared "call:20"
Street "flop" started. (community card = ['CK', 'H9', 'C9'])
"ZPlayer" declared "raise:10"
"KLChen2PokerPlayer" declared "raise:20"
"ZPlayer" declared "fold:0"
"['KLChen2PokerPlayer']" won the round 14 (stack = {'YangZ': 985, 'Ethan': 995, 'HakulaPlayer': 1254, 'SichengZuo': 970, 'KLChen2PokerPlayer': 1007, 'Jinkun': 970, 'NitWinWin': 970, 'ZPlayer': 849})
player [YangZ] gets hole card ['DQ', 'H8'], current stack 975
player [Ethan] gets hole card ['DJ', 'DT'], current stack 995
player [HakulaPlayer] gets hole card ['HQ', 'HT'], current stack 1254
player [SichengZuo] gets hole card ['SA', 'H4'], current stack 970
player [KLChen2PokerPlayer] gets hole card ['D9', 'D3'], current stack 1007
player [Jinkun] gets hole card ['S4', 'CT'], current stack 970
player [NitWinWin] gets hole card ['H3', 'HK'], current stack 970
player [ZPlayer] gets hole card ['H2', 'S5'], current stack 844
Started the round 15
Street "preflop" started. (community card = [])
"Ethan" declared "call:10"
"HakulaPlayer" declared "call:10"
"SichengZuo" declared "fold:0"
"KLChen2PokerPlayer" declared "call:10"
"Jinkun" declared "fold:10"
"NitWinWin" declared "fold:0"
"ZPlayer" declared "call:10"
"YangZ" declared "fold:0"
Street "flop" started. (community card = ['SQ', 'HA', 'C3'])
"ZPlayer" declared "call:0"
"Ethan" declared "call:0"
"HakulaPlayer" declared "call:0"
"KLChen2PokerPlayer" declared "call:0"
Street "turn" started. (community card = ['SQ', 'HA', 'C3', 'C4'])
"ZPlayer" declared "raise:433"
"Ethan" declared "fold:0"
"HakulaPlayer" declared "fold:0"
"KLChen2PokerPlayer" declared "fold:0"
"['ZPlayer']" won the round 15 (stack = {'YangZ': 975, 'Ethan': 985, 'HakulaPlayer': 1244, 'SichengZuo': 970, 'KLChen2PokerPlayer': 997, 'Jinkun': 970, 'NitWinWin': 970, 'ZPlayer': 889})
player [YangZ] gets hole card ['S9', 'S8'], current stack 970
player [Ethan] gets hole card ['D2', 'DQ'], current stack 975
player [HakulaPlayer] gets hole card ['S7', 'DT'], current stack 1244
player [SichengZuo] gets hole card ['H8', 'CJ'], current stack 970
player [KLChen2PokerPlayer] gets hole card ['HA', 'D5'], current stack 997
player [Jinkun] gets hole card ['DK', 'S2'], current stack 970
player [NitWinWin] gets hole card ['S3', 'H6'], current stack 970
player [ZPlayer] gets hole card ['H2', 'SA'], current stack 889
Started the round 16
Street "preflop" started. (community card = [])
"HakulaPlayer" declared "fold:0"
"SichengZuo" declared "fold:0"
"KLChen2PokerPlayer" declared "raise:18"
"Jinkun" declared "fold:18"
"NitWinWin" declared "fold:0"
"ZPlayer" declared "call:18"
"YangZ" declared "fold:0"
"Ethan" declared "fold:0"
Street "flop" started. (community card = ['CQ', 'HQ', 'SK'])
"KLChen2PokerPlayer" declared "raise:15"
"ZPlayer" declared "fold:0"
"['KLChen2PokerPlayer']" won the round 16 (stack = {'YangZ': 970, 'Ethan': 975, 'HakulaPlayer': 1244, 'SichengZuo': 970, 'KLChen2PokerPlayer': 1030, 'Jinkun': 970, 'NitWinWin': 970, 'ZPlayer': 871})
player [YangZ] gets hole card ['SA', 'DA'], current stack 970
player [Ethan] gets hole card ['S8', 'H9'], current stack 970
player [HakulaPlayer] gets hole card ['S3', 'H5'], current stack 1234
player [SichengZuo] gets hole card ['S2', 'H3'], current stack 970
player [KLChen2PokerPlayer] gets hole card ['DJ', 'D3'], current stack 1030
player [Jinkun] gets hole card ['C8', 'HK'], current stack 970
player [NitWinWin] gets hole card ['H6', 'H7'], current stack 970
player [ZPlayer] gets hole card ['C2', 'D4'], current stack 871
Started the round 17
Street "preflop" started. (community card = [])
"SichengZuo" declared "fold:0"
"KLChen2PokerPlayer" declared "raise:18"
"Jinkun" declared "fold:18"
"NitWinWin" declared "fold:0"
"ZPlayer" declared "fold:0"
"YangZ" declared "fold:0"
"Ethan" declared "call:18"
"HakulaPlayer" declared "fold:0"
Street "flop" started. (community card = ['ST', 'SJ', 'SK'])
"Ethan" declared "call:0"
"KLChen2PokerPlayer" declared "raise:11"
"Ethan" declared "raise:57"
"KLChen2PokerPlayer" declared "fold:0"
"['Ethan']" won the round 17 (stack = {'YangZ': 970, 'Ethan': 1014, 'HakulaPlayer': 1234, 'SichengZuo': 970, 'KLChen2PokerPlayer': 1001, 'Jinkun': 970, 'NitWinWin': 970, 'ZPlayer': 871})
player [YangZ] gets hole card ['S3', 'C2'], current stack 970
player [Ethan] gets hole card ['C8', 'HK'], current stack 1014
player [HakulaPlayer] gets hole card ['SQ', 'D9'], current stack 1229
player [SichengZuo] gets hole card ['S2', 'H5'], current stack 960
player [KLChen2PokerPlayer] gets hole card ['CQ', 'D7'], current stack 1001
player [Jinkun] gets hole card ['D4', 'H2'], current stack 970
player [NitWinWin] gets hole card ['S4', 'DA'], current stack 970
player [ZPlayer] gets hole card ['DQ', 'DK'], current stack 871
Started the round 18
Street "preflop" started. (community card = [])
"KLChen2PokerPlayer" declared "fold:0"
"Jinkun" declared "fold:10"
"NitWinWin" declared "fold:0"
"ZPlayer" declared "raise:15"
"YangZ" declared "fold:0"
"Ethan" declared "fold:0"
"HakulaPlayer" declared "call:15"
"SichengZuo" declared "fold:0"
Street "flop" started. (community card = ['CJ', 'ST', 'D2'])
"HakulaPlayer" declared "call:0"
"ZPlayer" declared "raise:10"
"HakulaPlayer" declared "call:10"
Street "turn" started. (community card = ['CJ', 'ST', 'D2', 'S9'])
"HakulaPlayer" declared "call:0"
"ZPlayer" declared "raise:60"
"HakulaPlayer" declared "fold:0"
"['ZPlayer']" won the round 18 (stack = {'YangZ': 970, 'Ethan': 1014, 'HakulaPlayer': 1209, 'SichengZuo': 960, 'KLChen2PokerPlayer': 1001, 'Jinkun': 970, 'NitWinWin': 970, 'ZPlayer': 906})
player [YangZ] gets hole card ['S3', 'C2'], current stack 970
player [Ethan] gets hole card ['S4', 'CJ'], current stack 1014
player [HakulaPlayer] gets hole card ['D5', 'H7'], current stack 1209
player [SichengZuo] gets hole card ['C9', 'H5'], current stack 955
player [KLChen2PokerPlayer] gets hole card ['H9', 'CK'], current stack 991
player [Jinkun] gets hole card ['S8', 'D4'], current stack 970
player [NitWinWin] gets hole card ['D8', 'CT'], current stack 970
player [ZPlayer] gets hole card ['C4', 'H6'], current stack 906
Started the round 19
Street "preflop" started. (community card = [])
"Jinkun" declared "fold:10"
"NitWinWin" declared "fold:0"
"ZPlayer" declared "call:10"
"YangZ" declared "fold:0"
"Ethan" declared "fold:0"
"HakulaPlayer" declared "call:10"
"SichengZuo" declared "fold:0"
"KLChen2PokerPlayer" declared "raise:27"
"ZPlayer" declared "call:27"
"HakulaPlayer" declared "call:27"
Street "flop" started. (community card = ['DT', 'HT', 'D3'])
"KLChen2PokerPlayer" declared "raise:15"
"ZPlayer" declared "fold:0"
"HakulaPlayer" declared "call:15"
Street "turn" started. (community card = ['DT', 'HT', 'D3', 'D7'])
"KLChen2PokerPlayer" declared "call:0"
"HakulaPlayer" declared "raise:143"
"KLChen2PokerPlayer" declared "fold:0"
"['HakulaPlayer']" won the round 19 (stack = {'YangZ': 970, 'Ethan': 1014, 'HakulaPlayer': 1283, 'SichengZuo': 955, 'KLChen2PokerPlayer': 959, 'Jinkun': 970, 'NitWinWin': 970, 'ZPlayer': 879})
player [YangZ] gets hole card ['D3', 'H5'], current stack 970
player [Ethan] gets hole card ['DT', 'C2'], current stack 1014
player [HakulaPlayer] gets hole card ['C4', 'SQ'], current stack 1283
player [SichengZuo] gets hole card ['SJ', 'CJ'], current stack 955
player [KLChen2PokerPlayer] gets hole card ['H3', 'C8'], current stack 954
player [Jinkun] gets hole card ['H4', 'DA'], current stack 960
player [NitWinWin] gets hole card ['DJ', 'C7'], current stack 970
player [ZPlayer] gets hole card ['S3', 'D7'], current stack 879
Started the round 20
Street "preflop" started. (community card = [])
"NitWinWin" declared "fold:0"
"ZPlayer" declared "call:10"
"YangZ" declared "fold:0"
"Ethan" declared "fold:0"
"HakulaPlayer" declared "call:10"
"SichengZuo" declared "fold:0"
"KLChen2PokerPlayer" declared "fold:0"
"Jinkun" declared "call:10"
Street "flop" started. (community card = ['CK', 'SK', 'C3'])
"Jinkun" declared "call:0"
"ZPlayer" declared "raise:10"
"HakulaPlayer" declared "fold:0"
"Jinkun" declared "call:10"
Street "turn" started. (community card = ['CK', 'SK', 'C3', 'S5'])
"Jinkun" declared "call:0"
"ZPlayer" declared "call:0"
Street "river" started. (community card = ['CK', 'SK', 'C3', 'S5', 'H8'])
"Jinkun" declared "raise:950"
"ZPlayer" declared "fold:0"
"['Jinkun']" won the round 20 (stack = {'YangZ': 970, 'Ethan': 1014, 'HakulaPlayer': 1273, 'SichengZuo': 955, 'KLChen2PokerPlayer': 954, 'Jinkun': 1005, 'NitWinWin': 970, 'ZPlayer': 859})
player [YangZ] gets hole card ['H7', 'C6'], current stack 970
player [Ethan] gets hole card ['HA', 'ST'], current stack 1014
player [HakulaPlayer] gets hole card ['DJ', 'HJ'], current stack 1273
player [SichengZuo] gets hole card ['SK', 'D3'], current stack 955
player [KLChen2PokerPlayer] gets hole card ['C3', 'CK'], current stack 954
player [Jinkun] gets hole card ['HT', 'S6'], current stack 1000
player [NitWinWin] gets hole card ['HQ', 'SJ'], current stack 960
player [ZPlayer] gets hole card ['H9', 'DK'], current stack 859
Started the round 21
Street "preflop" started. (community card = [])
"ZPlayer" declared "call:10"
"YangZ" declared "fold:0"
"Ethan" declared "call:10"
"HakulaPlayer" declared "raise:35"
"SichengZuo" declared "fold:0"
"KLChen2PokerPlayer" declared "fold:0"
"Jinkun" declared "fold:35"
"NitWinWin" declared "fold:0"
"ZPlayer" declared "call:35"
"Ethan" declared "raise:60"
"HakulaPlayer" declared "raise:170"
"ZPlayer" declared "call:170"
"Ethan" declared "call:170"
Street "flop" started. (community card = ['C9', 'DT', 'CA'])
"ZPlayer" declared "raise:262"
"Ethan" declared "call:262"
"HakulaPlayer" declared "raise:877"
"ZPlayer" declared "fold:0"
"Ethan" declared "fold:0"
"['HakulaPlayer']" won the round 21 (stack = {'YangZ': 970, 'Ethan': 582, 'HakulaPlayer': 2152, 'SichengZuo': 955, 'KLChen2PokerPlayer': 954, 'Jinkun': 1000, 'NitWinWin': 960, 'ZPlayer': 427})
player [YangZ] gets hole card ['D6', 'H2'], current stack 970
player [Ethan] gets hole card ['H9', 'HT'], current stack 582
player [HakulaPlayer] gets hole card ['S5', 'S7'], current stack 2152
player [SichengZuo] gets hole card ['H4', 'CJ'], current stack 955
player [KLChen2PokerPlayer] gets hole card ['SA', 'D2'], current stack 954
player [Jinkun] gets hole card ['CT', 'DQ'], current stack 1000
player [NitWinWin] gets hole card ['SQ', 'D8'], current stack 955
player [ZPlayer] gets hole card ['HQ', 'SK'], current stack 417
Started the round 22
Street "preflop" started. (community card = [])
"YangZ" declared "fold:0"
"Ethan" declared "fold:0"
"HakulaPlayer" declared "fold:0"
"SichengZuo" declared "fold:0"
"KLChen2PokerPlayer" declared "raise:28"
"Jinkun" declared "fold:28"
"NitWinWin" declared "fold:0"
"ZPlayer" declared "call:28"
Street "flop" started. (community card = ['D7', 'CK', 'D9'])
"ZPlayer" declared "raise:30"
"KLChen2PokerPlayer" declared "fold:0"
"['ZPlayer']" won the round 22 (stack = {'YangZ': 970, 'Ethan': 582, 'HakulaPlayer': 2152, 'SichengZuo': 955, 'KLChen2PokerPlayer': 926, 'Jinkun': 1000, 'NitWinWin': 955, 'ZPlayer': 460})
player [YangZ] gets hole card ['S7', 'C4'], current stack 960
player [Ethan] gets hole card ['ST', 'DJ'], current stack 582
player [HakulaPlayer] gets hole card ['H2', 'D6'], current stack 2152
player [SichengZuo] gets hole card ['C9', 'D2'], current stack 955
player [KLChen2PokerPlayer] gets hole card ['C7', 'H4'], current stack 926
player [Jinkun] gets hole card ['S9', 'H6'], current stack 1000
player [NitWinWin] gets hole card ['H9', 'D5'], current stack 955
player [ZPlayer] gets hole card ['CQ', 'SA'], current stack 455
Started the round 23
Street "preflop" started. (community card = [])
"Ethan" declared "call:10"
"HakulaPlayer" declared "fold:0"
"SichengZuo" declared "fold:0"
"KLChen2PokerPlayer" declared "fold:0"
"Jinkun" declared "fold:10"
"NitWinWin" declared "fold:0"
"ZPlayer" declared "raise:15"
"YangZ" declared "fold:0"
"Ethan" declared "raise:34"
"ZPlayer" declared "call:34"
Street "flop" started. (community card = ['C5', 'D7', 'HJ'])
"ZPlayer" declared "call:0"
"Ethan" declared "call:0"
Street "turn" started. (community card = ['C5', 'D7', 'HJ', 'C2'])
"ZPlayer" declared "call:0"
"Ethan" declared "call:0"
Street "river" started. (community card = ['C5', 'D7', 'HJ', 'C2', 'HK'])
"ZPlayer" declared "call:0"
"Ethan" declared "raise:78"
"ZPlayer" declared "fold:0"
"['Ethan']" won the round 23 (stack = {'YangZ': 960, 'Ethan': 626, 'HakulaPlayer': 2152, 'SichengZuo': 955, 'KLChen2PokerPlayer': 926, 'Jinkun': 1000, 'NitWinWin': 955, 'ZPlayer': 426})
player [YangZ] gets hole card ['DT', 'CT'], current stack 955
player [Ethan] gets hole card ['DK', 'S9'], current stack 616
player [HakulaPlayer] gets hole card ['D3', 'C5'], current stack 2152
player [SichengZuo] gets hole card ['SQ', 'S4'], current stack 955
player [KLChen2PokerPlayer] gets hole card ['H9', 'S5'], current stack 926
player [Jinkun] gets hole card ['HK', 'D9'], current stack 1000
player [NitWinWin] gets hole card ['D7', 'CJ'], current stack 955
player [ZPlayer] gets hole card ['CQ', 'H4'], current stack 426
Started the round 24
Street "preflop" started. (community card = [])
"HakulaPlayer" declared "fold:0"
"SichengZuo" declared "fold:0"
"KLChen2PokerPlayer" declared "fold:0"
"Jinkun" declared "fold:10"
"NitWinWin" declared "fold:0"
"ZPlayer" declared "call:10"
"YangZ" declared "fold:0"
"Ethan" declared "call:10"
Street "flop" started. (community card = ['HT', 'HJ', 'C2'])
"Ethan" declared "call:0"
"ZPlayer" declared "call:0"
Street "turn" started. (community card = ['HT', 'HJ', 'C2', 'D2'])
"Ethan" declared "call:0"
"ZPlayer" declared "call:0"
Street "river" started. (community card = ['HT', 'HJ', 'C2', 'D2', 'H3'])
"Ethan" declared "call:0"
"ZPlayer" declared "call:0"
"['Ethan']" won the round 24 (stack = {'YangZ': 955, 'Ethan': 641, 'HakulaPlayer': 2152, 'SichengZuo': 955, 'KLChen2PokerPlayer': 926, 'Jinkun': 1000, 'NitWinWin': 955, 'ZPlayer': 416})
player [YangZ] gets hole card ['H5', 'CK'], current stack 955
player [Ethan] gets hole card ['C3', 'H6'], current stack 636
player [HakulaPlayer] gets hole card ['SQ', 'CQ'], current stack 2142
player [SichengZuo] gets hole card ['H4', 'DJ'], current stack 955
player [KLChen2PokerPlayer] gets hole card ['DA', 'HQ'], current stack 926
player [Jinkun] gets hole card ['SA', 'S3'], current stack 1000
player [NitWinWin] gets hole card ['HJ', 'C5'], current stack 955
player [ZPlayer] gets hole card ['H8', 'CJ'], current stack 416
Started the round 25
Street "preflop" started. (community card = [])
"SichengZuo" declared "fold:0"
"KLChen2PokerPlayer" declared "raise:29"
"Jinkun" declared "fold:29"
"NitWinWin" declared "fold:0"
"ZPlayer" declared "call:29"
"YangZ" declared "fold:0"
"Ethan" declared "fold:0"
"HakulaPlayer" declared "raise:85"
"KLChen2PokerPlayer" declared "fold:0"
"ZPlayer" declared "call:85"
Street "flop" started. (community card = ['HK', 'S8', 'CA'])
"HakulaPlayer" declared "raise:175"
"ZPlayer" declared "fold:0"
"['HakulaPlayer']" won the round 25 (stack = {'YangZ': 955, 'Ethan': 636, 'HakulaPlayer': 2271, 'SichengZuo': 955, 'KLChen2PokerPlayer': 897, 'Jinkun': 1000, 'NitWinWin': 955, 'ZPlayer': 331})
player [YangZ] gets hole card ['C2', 'D3'], current stack 955
player [Ethan] gets hole card ['S2', 'C5'], current stack 636
player [HakulaPlayer] gets hole card ['D7', 'D5'], current stack 2266
player [SichengZuo] gets hole card ['D8', 'DK'], current stack 945
player [KLChen2PokerPlayer] gets hole card ['C3', 'C7'], current stack 897
player [Jinkun] gets hole card ['S3', 'HQ'], current stack 1000
player [NitWinWin] gets hole card ['CA', 'C9'], current stack 955
player [ZPlayer] gets hole card ['CQ', 'HJ'], current stack 331
Started the round 26
Street "preflop" started. (community card = [])
"KLChen2PokerPlayer" declared "raise:15"
"Jinkun" declared "fold:15"
"NitWinWin" declared "fold:0"
"ZPlayer" declared "call:15"
"YangZ" declared "fold:0"
"Ethan" declared "fold:0"
"HakulaPlayer" declared "call:15"
"SichengZuo" declared "fold:0"
Street "flop" started. (community card = ['D6', 'H9', 'DQ'])
"HakulaPlayer" declared "call:0"
"KLChen2PokerPlayer" declared "call:0"
"ZPlayer" declared "raise:273"
"HakulaPlayer" declared "fold:0"
"KLChen2PokerPlayer" declared "fold:0"
"['ZPlayer']" won the round 26 (stack = {'YangZ': 955, 'Ethan': 636, 'HakulaPlayer': 2256, 'SichengZuo': 945, 'KLChen2PokerPlayer': 882, 'Jinkun': 1000, 'NitWinWin': 955, 'ZPlayer': 371})
player [YangZ] gets hole card ['D9', 'HT'], current stack 955
player [Ethan] gets hole card ['H9', 'HA'], current stack 636
player [HakulaPlayer] gets hole card ['SJ', 'HJ'], current stack 2256
player [SichengZuo] gets hole card ['S2', 'S6'], current stack 940
player [KLChen2PokerPlayer] gets hole card ['C3', 'HK'], current stack 872
player [Jinkun] gets hole card ['DA', 'H7'], current stack 1000
player [NitWinWin] gets hole card ['D8', 'H8'], current stack 955
player [ZPlayer] gets hole card ['ST', 'C6'], current stack 371
Started the round 27
Street "preflop" started. (community card = [])
"Jinkun" declared "fold:10"
"NitWinWin" declared "fold:0"
"ZPlayer" declared "call:10"
"YangZ" declared "fold:0"
"Ethan" declared "fold:0"
"HakulaPlayer" declared "raise:35"
"SichengZuo" declared "fold:0"
"KLChen2PokerPlayer" declared "fold:0"
"ZPlayer" declared "fold:0"
"['HakulaPlayer']" won the round 27 (stack = {'YangZ': 955, 'Ethan': 636, 'HakulaPlayer': 2281, 'SichengZuo': 940, 'KLChen2PokerPlayer': 872, 'Jinkun': 1000, 'NitWinWin': 955, 'ZPlayer': 361})
player [YangZ] gets hole card ['S5', 'H8'], current stack 955
player [Ethan] gets hole card ['CA', 'SA'], current stack 636
player [HakulaPlayer] gets hole card ['SK', 'HA'], current stack 2281
player [SichengZuo] gets hole card ['S2', 'C7'], current stack 940
player [KLChen2PokerPlayer] gets hole card ['H6', 'CQ'], current stack 867
player [Jinkun] gets hole card ['CJ', 'HJ'], current stack 990
player [NitWinWin] gets hole card ['C8', 'CK'], current stack 955
player [ZPlayer] gets hole card ['S7', 'S4'], current stack 361
Started the round 28
Street "preflop" started. (community card = [])
"NitWinWin" declared "fold:0"
"ZPlayer" declared "call:10"
"YangZ" declared "fold:0"
"Ethan" declared "raise:190"
"HakulaPlayer" declared "fold:0"
"SichengZuo" declared "fold:0"
"KLChen2PokerPlayer" declared "fold:0"
"Jinkun" declared "fold:190"
"ZPlayer" declared "fold:0"
"['Ethan']" won the round 28 (stack = {'YangZ': 955, 'Ethan': 661, 'HakulaPlayer': 2281, 'SichengZuo': 940, 'KLChen2PokerPlayer': 867, 'Jinkun': 990, 'NitWinWin': 955, 'ZPlayer': 351})
player [YangZ] gets hole card ['DT', 'C2'], current stack 955
player [Ethan] gets hole card ['DA', 'D9'], current stack 661
player [HakulaPlayer] gets hole card ['S8', 'C5'], current stack 2281
player [SichengZuo] gets hole card ['S9', 'H5'], current stack 940
player [KLChen2PokerPlayer] gets hole card ['HT', 'DQ'], current stack 867
player [Jinkun] gets hole card ['D6', 'CA'], current stack 985
player [NitWinWin] gets hole card ['DJ', 'SA'], current stack 945
player [ZPlayer] gets hole card ['HJ', 'CK'], current stack 351
Started the round 29
Street "preflop" started. (community card = [])
"ZPlayer" declared "raise:15"
"YangZ" declared "fold:0"
"Ethan" declared "fold:0"
"HakulaPlayer" declared "fold:0"
"SichengZuo" declared "fold:0"
"KLChen2PokerPlayer" declared "raise:20"
"Jinkun" declared "fold:20"
"NitWinWin" declared "fold:0"
"ZPlayer" declared "call:20"
Street "flop" started. (community card = ['HK', 'ST', 'S7'])
"ZPlayer" declared "raise:10"
"KLChen2PokerPlayer" declared "raise:20"
"ZPlayer" declared "call:20"
Street "turn" started. (community card = ['HK', 'ST', 'S7', 'S4'])
"ZPlayer" declared "raise:47"
"KLChen2PokerPlayer" declared "fold:0"
"['ZPlayer']" won the round 29 (stack = {'YangZ': 955, 'Ethan': 661, 'HakulaPlayer': 2281, 'SichengZuo': 940, 'KLChen2PokerPlayer': 827, 'Jinkun': 985, 'NitWinWin': 945, 'ZPlayer': 406})
player [YangZ] gets hole card ['D8', 'CJ'], current stack 955
player [Ethan] gets hole card ['H7', 'H9'], current stack 661
player [HakulaPlayer] gets hole card ['C8', 'CA'], current stack 2281
player [SichengZuo] gets hole card ['S8', 'CQ'], current stack 940
player [KLChen2PokerPlayer] gets hole card ['S6', 'HK'], current stack 827
player [Jinkun] gets hole card ['H5', 'ST'], current stack 985
player [NitWinWin] gets hole card ['S7', 'CK'], current stack 940
player [ZPlayer] gets hole card ['H3', 'DQ'], current stack 396
Started the round 30
Street "preflop" started. (community card = [])
"YangZ" declared "fold:0"
"Ethan" declared "fold:0"
"HakulaPlayer" declared "call:10"
"SichengZuo" declared "fold:0"
"KLChen2PokerPlayer" declared "raise:16"
"Jinkun" declared "fold:16"
"NitWinWin" declared "fold:0"
"ZPlayer" declared "call:16"
"HakulaPlayer" declared "call:16"
Street "flop" started. (community card = ['C6', 'DT', 'D7'])
"ZPlayer" declared "call:0"
"HakulaPlayer" declared "call:0"
"KLChen2PokerPlayer" declared "raise:16"
"ZPlayer" declared "fold:0"
"HakulaPlayer" declared "call:16"
Street "turn" started. (community card = ['C6', 'DT', 'D7', 'S9'])
"HakulaPlayer" declared "raise:110"
"KLChen2PokerPlayer" declared "fold:0"
"['HakulaPlayer']" won the round 30 (stack = {'YangZ': 955, 'Ethan': 661, 'HakulaPlayer': 2334, 'SichengZuo': 940, 'KLChen2PokerPlayer': 795, 'Jinkun': 985, 'NitWinWin': 940, 'ZPlayer': 390})
player [YangZ] gets hole card ['C3', 'ST'], current stack 945
player [Ethan] gets hole card ['DJ', 'H6'], current stack 661
player [HakulaPlayer] gets hole card ['C6', 'S2'], current stack 2334
player [SichengZuo] gets hole card ['C2', 'DA'], current stack 940
player [KLChen2PokerPlayer] gets hole card ['CQ', 'S5'], current stack 795
player [Jinkun] gets hole card ['SA', 'C5'], current stack 985
player [NitWinWin] gets hole card ['C7', 'DT'], current stack 940
player [ZPlayer] gets hole card ['HQ', 'DK'], current stack 385
Started the round 31
Street "preflop" started. (community card = [])
"Ethan" declared "fold:0"
"HakulaPlayer" declared "fold:0"
"SichengZuo" declared "fold:0"
"KLChen2PokerPlayer" declared "fold:0"
"Jinkun" declared "call:10"
"NitWinWin" declared "fold:0"
"ZPlayer" declared "raise:15"
"YangZ" declared "fold:0"
"Jinkun" declared "call:15"
Street "flop" started. (community card = ['HJ', 'D6', 'HT'])
"ZPlayer" declared "raise:10"
"Jinkun" declared "call:10"
Street "turn" started. (community card = ['HJ', 'D6', 'HT', 'D2'])
"ZPlayer" declared "call:0"
"Jinkun" declared "raise:120"
"ZPlayer" declared "fold:0"
"['Jinkun']" won the round 31 (stack = {'YangZ': 945, 'Ethan': 661, 'HakulaPlayer': 2334, 'SichengZuo': 940, 'KLChen2PokerPlayer': 795, 'Jinkun': 1020, 'NitWinWin': 940, 'ZPlayer': 365})
player [YangZ] gets hole card ['C6', 'S2'], current stack 940
player [Ethan] gets hole card ['D3', 'CK'], current stack 651
player [HakulaPlayer] gets hole card ['C5', 'ST'], current stack 2334
player [SichengZuo] gets hole card ['H4', 'DJ'], current stack 940
player [KLChen2PokerPlayer] gets hole card ['H6', 'H9'], current stack 795
player [Jinkun] gets hole card ['D5', 'C4'], current stack 1020
player [NitWinWin] gets hole card ['CJ', 'S4'], current stack 940
player [ZPlayer] gets hole card ['HA', 'SA'], current stack 365
Started the round 32
Street "preflop" started. (community card = [])
"HakulaPlayer" declared "fold:0"
"SichengZuo" declared "fold:0"
"KLChen2PokerPlayer" declared "raise:18"
"Jinkun" declared "fold:18"
"NitWinWin" declared "fold:0"
"ZPlayer" declared "raise:26"
"YangZ" declared "fold:0"
"Ethan" declared "fold:0"
"KLChen2PokerPlayer" declared "fold:0"
"['ZPlayer']" won the round 32 (stack = {'YangZ': 940, 'Ethan': 651, 'HakulaPlayer': 2334, 'SichengZuo': 940, 'KLChen2PokerPlayer': 777, 'Jinkun': 1020, 'NitWinWin': 940, 'ZPlayer': 398})
player [YangZ] gets hole card ['CA', 'C5'], current stack 940
player [Ethan] gets hole card ['DA', 'H2'], current stack 646
player [HakulaPlayer] gets hole card ['D2', 'H4'], current stack 2324
player [SichengZuo] gets hole card ['HJ', 'D3'], current stack 940
player [KLChen2PokerPlayer] gets hole card ['S8', 'S6'], current stack 777
player [Jinkun] gets hole card ['S2', 'C8'], current stack 1020
player [NitWinWin] gets hole card ['C6', 'D5'], current stack 940
player [ZPlayer] gets hole card ['H6', 'D9'], current stack 398
Started the round 33
Street "preflop" started. (community card = [])
"SichengZuo" declared "fold:0"
"KLChen2PokerPlayer" declared "raise:24"
"Jinkun" declared "fold:24"
"NitWinWin" declared "fold:0"
"ZPlayer" declared "fold:0"
"YangZ" declared "fold:0"
"Ethan" declared "call:24"
"HakulaPlayer" declared "fold:0"
Street "flop" started. (community card = ['H3', 'HT', 'D6'])
"Ethan" declared "call:0"
"KLChen2PokerPlayer" declared "raise:37"
"Ethan" declared "fold:0"
"['KLChen2PokerPlayer']" won the round 33 (stack = {'YangZ': 940, 'Ethan': 627, 'HakulaPlayer': 2324, 'SichengZuo': 940, 'KLChen2PokerPlayer': 811, 'Jinkun': 1020, 'NitWinWin': 940, 'ZPlayer': 398})
player [YangZ] gets hole card ['C6', 'HK'], current stack 940
player [Ethan] gets hole card ['HT', 'S8'], current stack 627
player [HakulaPlayer] gets hole card ['CK', 'HQ'], current stack 2319
player [SichengZuo] gets hole card ['C8', 'DK'], current stack 930
player [KLChen2PokerPlayer] gets hole card ['H9', 'S7'], current stack 811
player [Jinkun] gets hole card ['H2', 'D5'], current stack 1020
player [NitWinWin] gets hole card ['S5', 'D7'], current stack 940
player [ZPlayer] gets hole card ['H6', 'H5'], current stack 398
Started the round 34
Street "preflop" started. (community card = [])
"KLChen2PokerPlayer" declared "fold:0"
"Jinkun" declared "fold:10"
"NitWinWin" declared "fold:0"
"ZPlayer" declared "call:10"
"YangZ" declared "fold:0"
"Ethan" declared "fold:0"
"HakulaPlayer" declared "call:10"
"SichengZuo" declared "fold:0"
Street "flop" started. (community card = ['SQ', 'H4', 'S6'])
"HakulaPlayer" declared "raise:37"
"ZPlayer" declared "fold:0"
"['HakulaPlayer']" won the round 34 (stack = {'YangZ': 940, 'Ethan': 627, 'HakulaPlayer': 2344, 'SichengZuo': 930, 'KLChen2PokerPlayer': 811, 'Jinkun': 1020, 'NitWinWin': 940, 'ZPlayer': 388})
player [YangZ] gets hole card ['HQ', 'CK'], current stack 940
player [Ethan] gets hole card ['C2', 'C9'], current stack 627
player [HakulaPlayer] gets hole card ['D9', 'DK'], current stack 2344
player [SichengZuo] gets hole card ['C8', 'H2'], current stack 925
player [KLChen2PokerPlayer] gets hole card ['SQ', 'S8'], current stack 801
player [Jinkun] gets hole card ['CQ', 'SK'], current stack 1020
player [NitWinWin] gets hole card ['CT', 'D2'], current stack 940
player [ZPlayer] gets hole card ['DQ', 'D8'], current stack 388
Started the round 35
Street "preflop" started. (community card = [])
"Jinkun" declared "fold:10"
"NitWinWin" declared "fold:0"
"ZPlayer" declared "raise:15"
"YangZ" declared "fold:0"
"Ethan" declared "fold:0"
"HakulaPlayer" declared "call:15"
"SichengZuo" declared "fold:0"
"KLChen2PokerPlayer" declared "raise:24"
"ZPlayer" declared "call:24"
"HakulaPlayer" declared "call:24"
Street "flop" started. (community card = ['D7', 'H9', 'DT'])
"KLChen2PokerPlayer" declared "raise:18"
"ZPlayer" declared "call:18"
"HakulaPlayer" declared "call:18"
Street "turn" started. (community card = ['D7', 'H9', 'DT', 'SJ'])
"KLChen2PokerPlayer" declared "raise:222"
"ZPlayer" declared "call:222"
"HakulaPlayer" declared "call:222"
Street "river" started. (community card = ['D7', 'H9', 'DT', 'SJ', 'D5'])
"KLChen2PokerPlayer" declared "raise:188"
"ZPlayer" declared "call:188"
"HakulaPlayer" declared "call:188"
"['HakulaPlayer']" won the round 35 (stack = {'YangZ': 940, 'Ethan': 627, 'HakulaPlayer': 3189, 'SichengZuo': 925, 'KLChen2PokerPlayer': 359, 'Jinkun': 1020, 'NitWinWin': 940, 'ZPlayer': 0})
player [YangZ] gets hole card ['H2', 'S8'], current stack 940
player [Ethan] gets hole card ['CT', 'CQ'], current stack 627
player [HakulaPlayer] gets hole card ['DK', 'D8'], current stack 3189
player [SichengZuo] gets hole card ['D6', 'C7'], current stack 925
player [KLChen2PokerPlayer] gets hole card ['C8', 'H7'], current stack 354
player [Jinkun] gets hole card ['HT', 'C4'], current stack 1010
player [NitWinWin] gets hole card ['C9', 'H6'], current stack 940
Started the round 36
Street "preflop" started. (community card = [])
"NitWinWin" declared "fold:0"
"YangZ" declared "fold:0"
"Ethan" declared "fold:0"
"HakulaPlayer" declared "call:10"
"SichengZuo" declared "fold:0"
"KLChen2PokerPlayer" declared "raise:15"
"Jinkun" declared "fold:15"
"HakulaPlayer" declared "raise:31"
"KLChen2PokerPlayer" declared "fold:0"
"['HakulaPlayer']" won the round 36 (stack = {'YangZ': 940, 'Ethan': 627, 'HakulaPlayer': 3214, 'SichengZuo': 925, 'KLChen2PokerPlayer': 344, 'Jinkun': 1010, 'NitWinWin': 940, 'ZPlayer': 0})
player [YangZ] gets hole card ['SJ', 'S8'], current stack 940
player [Ethan] gets hole card ['H8', 'H5'], current stack 627
player [HakulaPlayer] gets hole card ['H3', 'S9'], current stack 3214
player [SichengZuo] gets hole card ['CK', 'HK'], current stack 925
player [KLChen2PokerPlayer] gets hole card ['H6', 'HT'], current stack 344
player [Jinkun] gets hole card ['D6', 'D8'], current stack 1005
player [NitWinWin] gets hole card ['C9', 'D2'], current stack 930
Started the round 37
Street "preflop" started. (community card = [])
"YangZ" declared "fold:0"
"Ethan" declared "fold:0"
"HakulaPlayer" declared "fold:0"
"SichengZuo" declared "raise:925"
"KLChen2PokerPlayer" declared "fold:0"
"Jinkun" declared "fold:925"
"NitWinWin" declared "fold:0"
"['SichengZuo']" won the round 37 (stack = {'YangZ': 940, 'Ethan': 627, 'HakulaPlayer': 3214, 'SichengZuo': 940, 'KLChen2PokerPlayer': 344, 'Jinkun': 1005, 'NitWinWin': 930, 'ZPlayer': 0})
player [YangZ] gets hole card ['CJ', 'D4'], current stack 930
player [Ethan] gets hole card ['C9', 'DQ'], current stack 627
player [HakulaPlayer] gets hole card ['S9', 'CA'], current stack 3214
player [SichengZuo] gets hole card ['CK', 'HQ'], current stack 940
player [KLChen2PokerPlayer] gets hole card ['HJ', 'C4'], current stack 344
player [Jinkun] gets hole card ['D5', 'H9'], current stack 1005
player [NitWinWin] gets hole card ['DT', 'S5'], current stack 925
Started the round 38
Street "preflop" started. (community card = [])
"Ethan" declared "fold:0"
"HakulaPlayer" declared "call:10"
"SichengZuo" declared "fold:0"
"KLChen2PokerPlayer" declared "raise:17"
"Jinkun" declared "fold:17"
"NitWinWin" declared "fold:0"
"YangZ" declared "fold:0"
"HakulaPlayer" declared "call:17"
Street "flop" started. (community card = ['C3', 'D7', 'S2'])
"HakulaPlayer" declared "call:0"
"KLChen2PokerPlayer" declared "call:0"
Street "turn" started. (community card = ['C3', 'D7', 'S2', 'C8'])
"HakulaPlayer" declared "call:0"
"KLChen2PokerPlayer" declared "call:0"
Street "river" started. (community card = ['C3', 'D7', 'S2', 'C8', 'C6'])
"HakulaPlayer" declared "call:0"
"KLChen2PokerPlayer" declared "call:0"
"['HakulaPlayer']" won the round 38 (stack = {'YangZ': 930, 'Ethan': 627, 'HakulaPlayer': 3246, 'SichengZuo': 940, 'KLChen2PokerPlayer': 327, 'Jinkun': 1005, 'NitWinWin': 925, 'ZPlayer': 0})
player [YangZ] gets hole card ['DQ', 'DK'], current stack 925
player [Ethan] gets hole card ['H8', 'S8'], current stack 617
player [HakulaPlayer] gets hole card ['C5', 'CA'], current stack 3246
player [SichengZuo] gets hole card ['HQ', 'HK'], current stack 940
player [KLChen2PokerPlayer] gets hole card ['S4', 'D6'], current stack 327
player [Jinkun] gets hole card ['C6', 'D3'], current stack 1005
player [NitWinWin] gets hole card ['S5', 'H9'], current stack 925
Started the round 39
Street "preflop" started. (community card = [])
"HakulaPlayer" declared "call:10"
"SichengZuo" declared "fold:0"
"KLChen2PokerPlayer" declared "raise:15"
"Jinkun" declared "fold:15"
"NitWinWin" declared "fold:0"
"YangZ" declared "fold:0"
"Ethan" declared "raise:37"
"HakulaPlayer" declared "call:37"
"KLChen2PokerPlayer" declared "fold:0"
Street "flop" started. (community card = ['H6', 'D7', 'H4'])
"Ethan" declared "raise:94"
"HakulaPlayer" declared "fold:0"
"['Ethan']" won the round 39 (stack = {'YangZ': 925, 'Ethan': 684, 'HakulaPlayer': 3209, 'SichengZuo': 940, 'KLChen2PokerPlayer': 312, 'Jinkun': 1005, 'NitWinWin': 925, 'ZPlayer': 0})
player [YangZ] gets hole card ['C5', 'D7'], current stack 925
player [Ethan] gets hole card ['ST', 'SQ'], current stack 679
player [HakulaPlayer] gets hole card ['D2', 'S9'], current stack 3199
player [SichengZuo] gets hole card ['H6', 'H9'], current stack 940
player [KLChen2PokerPlayer] gets hole card ['H3', 'D6'], current stack 312
player [Jinkun] gets hole card ['S3', 'C9'], current stack 1005
player [NitWinWin] gets hole card ['C4', 'DJ'], current stack 925
Started the round 40
Street "preflop" started. (community card = [])
"SichengZuo" declared "fold:0"
"KLChen2PokerPlayer" declared "fold:0"
"Jinkun" declared "fold:10"
"NitWinWin" declared "fold:0"
"YangZ" declared "fold:0"
"Ethan" declared "call:10"
"HakulaPlayer" declared "call:10"
Street "flop" started. (community card = ['HQ', 'HJ', 'HT'])
"Ethan" declared "call:0"
"HakulaPlayer" declared "call:0"
Street "turn" started. (community card = ['HQ', 'HJ', 'HT', 'D3'])
"Ethan" declared "call:0"
"HakulaPlayer" declared "call:0"
Street "river" started. (community card = ['HQ', 'HJ', 'HT', 'D3', 'S6'])
"Ethan" declared "raise:67"
"HakulaPlayer" declared "fold:0"
"['Ethan']" won the round 40 (stack = {'YangZ': 925, 'Ethan': 694, 'HakulaPlayer': 3199, 'SichengZuo': 940, 'KLChen2PokerPlayer': 312, 'Jinkun': 1005, 'NitWinWin': 925, 'ZPlayer': 0})
player [YangZ] gets hole card ['D6', 'S8'], current stack 925
player [Ethan] gets hole card ['H4', 'C7'], current stack 694
player [HakulaPlayer] gets hole card ['C2', 'SK'], current stack 3194
player [SichengZuo] gets hole card ['H5', 'CK'], current stack 930
player [KLChen2PokerPlayer] gets hole card ['ST', 'CT'], current stack 312
player [Jinkun] gets hole card ['HQ', 'C4'], current stack 1005
player [NitWinWin] gets hole card ['S9', 'CQ'], current stack 925
Started the round 41
Street "preflop" started. (community card = [])
"KLChen2PokerPlayer" declared "raise:15"
"Jinkun" declared "fold:15"
"NitWinWin" declared "fold:0"
"YangZ" declared "fold:0"
"Ethan" declared "fold:0"
"HakulaPlayer" declared "fold:0"
"SichengZuo" declared "fold:0"
"['KLChen2PokerPlayer']" won the round 41 (stack = {'YangZ': 925, 'Ethan': 694, 'HakulaPlayer': 3194, 'SichengZuo': 930, 'KLChen2PokerPlayer': 327, 'Jinkun': 1005, 'NitWinWin': 925, 'ZPlayer': 0})
player [YangZ] gets hole card ['DT', 'CA'], current stack 925
player [Ethan] gets hole card ['HT', 'S4'], current stack 694
player [HakulaPlayer] gets hole card ['S2', 'CT'], current stack 3194
player [SichengZuo] gets hole card ['H9', 'HQ'], current stack 925
player [KLChen2PokerPlayer] gets hole card ['H5', 'C7'], current stack 317
player [Jinkun] gets hole card ['SK', 'DJ'], current stack 1005
player [NitWinWin] gets hole card ['C2', 'H6'], current stack 925
Started the round 42
Street "preflop" started. (community card = [])
"Jinkun" declared "fold:10"
"NitWinWin" declared "fold:0"
"YangZ" declared "fold:0"
"Ethan" declared "fold:0"
"HakulaPlayer" declared "fold:0"
"SichengZuo" declared "fold:0"
"['KLChen2PokerPlayer']" won the round 42 (stack = {'YangZ': 925, 'Ethan': 694, 'HakulaPlayer': 3194, 'SichengZuo': 925, 'KLChen2PokerPlayer': 332, 'Jinkun': 1005, 'NitWinWin': 925, 'ZPlayer': 0})
player [YangZ] gets hole card ['HA', 'DJ'], current stack 925
player [Ethan] gets hole card ['C2', 'DQ'], current stack 694
player [HakulaPlayer] gets hole card ['CA', 'CQ'], current stack 3194
player [SichengZuo] gets hole card ['H9', 'C3'], current stack 925
player [KLChen2PokerPlayer] gets hole card ['S3', 'H7'], current stack 327
player [Jinkun] gets hole card ['H8', 'HQ'], current stack 995
player [NitWinWin] gets hole card ['C4', 'D9'], current stack 925
Started the round 43
Street "preflop" started. (community card = [])
"NitWinWin" declared "fold:0"
"YangZ" declared "fold:0"
"Ethan" declared "fold:0"
"HakulaPlayer" declared "call:10"
"SichengZuo" declared "fold:0"
"KLChen2PokerPlayer" declared "fold:0"
"Jinkun" declared "call:10"
Street "flop" started. (community card = ['S4', 'D7', 'S8'])
"Jinkun" declared "call:0"
"HakulaPlayer" declared "call:0"
Street "turn" started. (community card = ['S4', 'D7', 'S8', 'H5'])
"Jinkun" declared "call:0"
"HakulaPlayer" declared "raise:23"
"Jinkun" declared "call:23"
Street "river" started. (community card = ['S4', 'D7', 'S8', 'H5', 'SJ'])
"Jinkun" declared "call:0"
"HakulaPlayer" declared "call:0"
"['Jinkun']" won the round 43 (stack = {'YangZ': 925, 'Ethan': 694, 'HakulaPlayer': 3161, 'SichengZuo': 925, 'KLChen2PokerPlayer': 327, 'Jinkun': 1043, 'NitWinWin': 925, 'ZPlayer': 0})
player [YangZ] gets hole card ['SK', 'C3'], current stack 925
player [Ethan] gets hole card ['CJ', 'S6'], current stack 694
player [HakulaPlayer] gets hole card ['CK', 'H7'], current stack 3161
player [SichengZuo] gets hole card ['D8', 'HK'], current stack 925
player [KLChen2PokerPlayer] gets hole card ['H2', 'S4'], current stack 327
player [Jinkun] gets hole card ['DJ', 'HT'], current stack 1038
player [NitWinWin] gets hole card ['ST', 'CA'], current stack 915
Started the round 44
Street "preflop" started. (community card = [])
"YangZ" declared "fold:0"
"Ethan" declared "fold:0"
"HakulaPlayer" declared "fold:0"
"SichengZuo" declared "fold:0"
"KLChen2PokerPlayer" declared "raise:19"
"Jinkun" declared "fold:19"
"NitWinWin" declared "fold:0"
"['KLChen2PokerPlayer']" won the round 44 (stack = {'YangZ': 925, 'Ethan': 694, 'HakulaPlayer': 3161, 'SichengZuo': 925, 'KLChen2PokerPlayer': 342, 'Jinkun': 1038, 'NitWinWin': 915, 'ZPlayer': 0})
player [YangZ] gets hole card ['S3', 'D4'], current stack 915
player [Ethan] gets hole card ['C3', 'C7'], current stack 694
player [HakulaPlayer] gets hole card ['HT', 'DJ'], current stack 3161
player [SichengZuo] gets hole card ['H2', 'SQ'], current stack 925
player [KLChen2PokerPlayer] gets hole card ['CQ', 'D9'], current stack 342
player [Jinkun] gets hole card ['DQ', 'D3'], current stack 1038
player [NitWinWin] gets hole card ['DK', 'H4'], current stack 910
Started the round 45
Street "preflop" started. (community card = [])
"Ethan" declared "fold:0"
"HakulaPlayer" declared "call:10"
"SichengZuo" declared "fold:0"
"KLChen2PokerPlayer" declared "raise:16"
"Jinkun" declared "fold:16"
"NitWinWin" declared "fold:0"
"YangZ" declared "fold:0"
"HakulaPlayer" declared "call:16"
Street "flop" started. (community card = ['SA', 'DA', 'S4'])
"HakulaPlayer" declared "call:0"
"KLChen2PokerPlayer" declared "raise:14"
"HakulaPlayer" declared "fold:0"
"['KLChen2PokerPlayer']" won the round 45 (stack = {'YangZ': 915, 'Ethan': 694, 'HakulaPlayer': 3145, 'SichengZuo': 925, 'KLChen2PokerPlayer': 373, 'Jinkun': 1038, 'NitWinWin': 910, 'ZPlayer': 0})
player [YangZ] gets hole card ['C3', 'H6'], current stack 910
player [Ethan] gets hole card ['H4', 'S2'], current stack 684
player [HakulaPlayer] gets hole card ['CQ', 'DQ'], current stack 3145
player [SichengZuo] gets hole card ['D2', 'C8'], current stack 925
player [KLChen2PokerPlayer] gets hole card ['D4', 'D8'], current stack 373
player [Jinkun] gets hole card ['D9', 'S5'], current stack 1038
player [NitWinWin] gets hole card ['HK', 'C4'], current stack 910
Started the round 46
Street "preflop" started. (community card = [])
"HakulaPlayer" declared "raise:40"
"SichengZuo" declared "fold:0"
"KLChen2PokerPlayer" declared "fold:0"
"Jinkun" declared "fold:40"
"NitWinWin" declared "fold:0"
"YangZ" declared "fold:0"
"Ethan" declared "fold:0"
"['HakulaPlayer']" won the round 46 (stack = {'YangZ': 910, 'Ethan': 684, 'HakulaPlayer': 3160, 'SichengZuo': 925, 'KLChen2PokerPlayer': 373, 'Jinkun': 1038, 'NitWinWin': 910, 'ZPlayer': 0})
player [YangZ] gets hole card ['SA', 'H8'], current stack 910
player [Ethan] gets hole card ['C9', 'H9'], current stack 679
player [HakulaPlayer] gets hole card ['D2', 'CA'], current stack 3150
player [SichengZuo] gets hole card ['H4', 'CT'], current stack 925
player [KLChen2PokerPlayer] gets hole card ['S3', 'D3'], current stack 373
player [Jinkun] gets hole card ['S7', 'S5'], current stack 1038
player [NitWinWin] gets hole card ['SQ', 'HQ'], current stack 910
Started the round 47
Street "preflop" started. (community card = [])
"SichengZuo" declared "fold:0"
"KLChen2PokerPlayer" declared "call:10"
"Jinkun" declared "fold:10"
"NitWinWin" declared "raise:910"
"YangZ" declared "fold:0"
"Ethan" declared "fold:0"
"HakulaPlayer" declared "fold:0"
"KLChen2PokerPlayer" declared "fold:0"
"['NitWinWin']" won the round 47 (stack = {'YangZ': 910, 'Ethan': 679, 'HakulaPlayer': 3150, 'SichengZuo': 925, 'KLChen2PokerPlayer': 363, 'Jinkun': 1038, 'NitWinWin': 935, 'ZPlayer': 0})
player [YangZ] gets hole card ['ST', 'CT'], current stack 910
player [Ethan] gets hole card ['C3', 'D7'], current stack 679
player [HakulaPlayer] gets hole card ['DJ', 'H5'], current stack 3145
player [SichengZuo] gets hole card ['H9', 'SA'], current stack 915
player [KLChen2PokerPlayer] gets hole card ['SJ', 'C8'], current stack 363
player [Jinkun] gets hole card ['HJ', 'CJ'], current stack 1038
player [NitWinWin] gets hole card ['H6', 'D2'], current stack 935
Started the round 48
Street "preflop" started. (community card = [])
"KLChen2PokerPlayer" declared "call:10"
"Jinkun" declared "fold:10"
"NitWinWin" declared "fold:0"
"YangZ" declared "fold:0"
"Ethan" declared "fold:0"
"HakulaPlayer" declared "call:10"
"SichengZuo" declared "fold:0"
Street "flop" started. (community card = ['H3', 'DA', 'CQ'])
"HakulaPlayer" declared "call:0"
"KLChen2PokerPlayer" declared "call:0"
Street "turn" started. (community card = ['H3', 'DA', 'CQ', 'D4'])
"HakulaPlayer" declared "call:0"
"KLChen2PokerPlayer" declared "call:0"
Street "river" started. (community card = ['H3', 'DA', 'CQ', 'D4', 'S8'])
"HakulaPlayer" declared "call:0"
"KLChen2PokerPlayer" declared "call:0"
"['KLChen2PokerPlayer']" won the round 48 (stack = {'YangZ': 910, 'Ethan': 679, 'HakulaPlayer': 3140, 'SichengZuo': 915, 'KLChen2PokerPlayer': 383, 'Jinkun': 1038, 'NitWinWin': 935, 'ZPlayer': 0})
player [YangZ] gets hole card ['ST', 'DK'], current stack 910
player [Ethan] gets hole card ['C6', 'DA'], current stack 679
player [HakulaPlayer] gets hole card ['SA', 'HT'], current stack 3140
player [SichengZuo] gets hole card ['D6', 'S7'], current stack 910
player [KLChen2PokerPlayer] gets hole card ['H3', 'H6'], current stack 373
player [Jinkun] gets hole card ['DT', 'D4'], current stack 1038
player [NitWinWin] gets hole card ['C5', 'H7'], current stack 935
Started the round 49
Street "preflop" started. (community card = [])
"Jinkun" declared "fold:10"
"NitWinWin" declared "fold:0"
"YangZ" declared "fold:0"
"Ethan" declared "fold:0"
"HakulaPlayer" declared "call:10"
"SichengZuo" declared "fold:0"
"KLChen2PokerPlayer" declared "fold:0"
"['HakulaPlayer']" won the round 49 (stack = {'YangZ': 910, 'Ethan': 679, 'HakulaPlayer': 3155, 'SichengZuo': 910, 'KLChen2PokerPlayer': 373, 'Jinkun': 1038, 'NitWinWin': 935, 'ZPlayer': 0})
player [YangZ] gets hole card ['DA', 'C5'], current stack 910
player [Ethan] gets hole card ['C2', 'SQ'], current stack 679
player [HakulaPlayer] gets hole card ['H8', 'CK'], current stack 3155
player [SichengZuo] gets hole card ['H6', 'SA'], current stack 910
player [KLChen2PokerPlayer] gets hole card ['CT', 'S6'], current stack 368
player [Jinkun] gets hole card ['HQ', 'H2'], current stack 1028
player [NitWinWin] gets hole card ['SK', 'D9'], current stack 935
Started the round 50
Street "preflop" started. (community card = [])
"NitWinWin" declared "fold:0"
"YangZ" declared "fold:0"
"Ethan" declared "fold:0"
"HakulaPlayer" declared "fold:0"
"SichengZuo" declared "fold:0"
"KLChen2PokerPlayer" declared "call:10"
"Jinkun" declared "call:10"
Street "flop" started. (community card = ['D8', 'D7', 'DQ'])
"KLChen2PokerPlayer" declared "call:0"
"Jinkun" declared "call:0"
Street "turn" started. (community card = ['D8', 'D7', 'DQ', 'CA'])
"KLChen2PokerPlayer" declared "call:0"
"Jinkun" declared "call:0"
Street "river" started. (community card = ['D8', 'D7', 'DQ', 'CA', 'C4'])
"KLChen2PokerPlayer" declared "call:0"
"Jinkun" declared "call:0"
"['Jinkun']" won the round 50 (stack = {'YangZ': 910, 'Ethan': 679, 'HakulaPlayer': 3155, 'SichengZuo': 910, 'KLChen2PokerPlayer': 363, 'Jinkun': 1048, 'NitWinWin': 935, 'ZPlayer': 0})

Game Results:
------------------------------------------------------------
Game 1:
Winner: HakulaPlayer (stack: 3155)
All players' stacks:
  YangZ: 910
  Ethan: 679
  HakulaPlayer: 3155
  SichengZuo: 910
  KLChen2PokerPlayer: 363
  Jinkun: 1048
  NitWinWin: 935
  ZPlayer: 0
------------------------------------------------------------
