player [YangZ] gets hole card ['CJ', 'SK'], current stack 1000
player [Ethan] gets hole card ['S6', 'D9'], current stack 995
player [HakulaPlayer] gets hole card ['C3', 'S4'], current stack 990
player [SichengZuo] gets hole card ['S2', 'SJ'], current stack 1000
player [KLChen2PokerPlayer] gets hole card ['S5', 'H7'], current stack 1000
player [Jinkun] gets hole card ['D3', 'HK'], current stack 1000
player [NitWinWin] gets hole card ['S7', 'CK'], current stack 1000
player [ZPlayer] gets hole card ['D4', 'SA'], current stack 1000
Started the round 1
Street "preflop" started. (community card = [])
"SichengZuo" declared "fold:0"
"KLChen2PokerPlayer" declared "fold:0"
"Jinkun" declared "fold:10"
"NitWinWin" declared "fold:0"
"ZPlayer" declared "raise:15"
"YangZ" declared "fold:0"
"Ethan" declared "fold:0"
"HakulaPlayer" declared "call:15"
Street "flop" started. (community card = ['C4', 'H2', 'D5'])
"HakulaPlayer" declared "call:0"
"ZPlayer" declared "call:0"
Street "turn" started. (community card = ['C4', 'H2', 'D5', 'CA'])
"HakulaPlayer" declared "raise:45"
"ZPlayer" declared "call:45"
Street "river" started. (community card = ['C4', 'H2', 'D5', 'CA', 'H6'])
"HakulaPlayer" declared "raise:171"
"ZPlayer" declared "call:171"
"['HakulaPlayer']" won the round 1 (stack = {'YangZ': 1000, 'Ethan': 995, 'HakulaPlayer': 1236, 'SichengZuo': 1000, 'KLChen2PokerPlayer': 1000, 'Jinkun': 1000, 'NitWinWin': 1000, 'ZPlayer': 769})
player [YangZ] gets hole card ['C3', 'H2'], current stack 1000
player [Ethan] gets hole card ['HJ', 'C6'], current stack 995
player [HakulaPlayer] gets hole card ['CT', 'HQ'], current stack 1231
player [SichengZuo] gets hole card ['CJ', 'DA'], current stack 990
player [KLChen2PokerPlayer] gets hole card ['S2', 'H5'], current stack 1000
player [Jinkun] gets hole card ['HA', 'D5'], current stack 1000
player [NitWinWin] gets hole card ['D9', 'CA'], current stack 1000
player [ZPlayer] gets hole card ['H3', 'ST'], current stack 769
Started the round 2
Street "preflop" started. (community card = [])
"KLChen2PokerPlayer" declared "fold:0"
"Jinkun" declared "fold:10"
"NitWinWin" declared "fold:0"
"ZPlayer" declared "call:10"
"YangZ" declared "fold:0"
"Ethan" declared "fold:0"
"HakulaPlayer" declared "call:10"
"SichengZuo" declared "fold:0"
Street "flop" started. (community card = ['H8', 'DJ', 'DT'])
"HakulaPlayer" declared "raise:31"
"ZPlayer" declared "call:31"
Street "turn" started. (community card = ['H8', 'DJ', 'DT', 'S5'])
"HakulaPlayer" declared "raise:101"
"ZPlayer" declared "fold:0"
"['HakulaPlayer']" won the round 2 (stack = {'YangZ': 1000, 'Ethan': 995, 'HakulaPlayer': 1287, 'SichengZuo': 990, 'KLChen2PokerPlayer': 1000, 'Jinkun': 1000, 'NitWinWin': 1000, 'ZPlayer': 728})
player [YangZ] gets hole card ['C7', 'SJ'], current stack 1000
player [Ethan] gets hole card ['C3', 'H9'], current stack 995
player [HakulaPlayer] gets hole card ['S2', 'DA'], current stack 1287
player [SichengZuo] gets hole card ['S4', 'CQ'], current stack 985
player [KLChen2PokerPlayer] gets hole card ['S9', 'CA'], current stack 990
player [Jinkun] gets hole card ['D4', 'DQ'], current stack 1000
player [NitWinWin] gets hole card ['C8', 'S5'], current stack 1000
player [ZPlayer] gets hole card ['S3', 'D5'], current stack 728
Started the round 3
Street "preflop" started. (community card = [])
"Jinkun" declared "fold:10"
"NitWinWin" declared "fold:0"
"ZPlayer" declared "call:10"
"YangZ" declared "fold:0"
"Ethan" declared "fold:0"
"HakulaPlayer" declared "call:10"
"SichengZuo" declared "fold:0"
"KLChen2PokerPlayer" declared "raise:18"
"ZPlayer" declared "fold:0"
"HakulaPlayer" declared "call:18"
Street "flop" started. (community card = ['SQ', 'CJ', 'HQ'])
"KLChen2PokerPlayer" declared "raise:13"
"HakulaPlayer" declared "call:13"
Street "turn" started. (community card = ['SQ', 'CJ', 'HQ', 'D8'])
"KLChen2PokerPlayer" declared "raise:86"
"HakulaPlayer" declared "fold:0"
"['KLChen2PokerPlayer']" won the round 3 (stack = {'YangZ': 1000, 'Ethan': 995, 'HakulaPlayer': 1256, 'SichengZuo': 985, 'KLChen2PokerPlayer': 1046, 'Jinkun': 1000, 'NitWinWin': 1000, 'ZPlayer': 718})
player [YangZ] gets hole card ['D5', 'D4'], current stack 1000
player [Ethan] gets hole card ['D7', 'H6'], current stack 995
player [HakulaPlayer] gets hole card ['DQ', 'HT'], current stack 1256
player [SichengZuo] gets hole card ['CA', 'C5'], current stack 985
player [KLChen2PokerPlayer] gets hole card ['H7', 'HJ'], current stack 1041
player [Jinkun] gets hole card ['C4', 'SK'], current stack 990
player [NitWinWin] gets hole card ['D8', 'H5'], current stack 1000
player [ZPlayer] gets hole card ['H8', 'S7'], current stack 718
Started the round 4
Street "preflop" started. (community card = [])
"NitWinWin" declared "fold:0"
"ZPlayer" declared "call:10"
"YangZ" declared "fold:0"
"Ethan" declared "fold:0"
"HakulaPlayer" declared "call:10"
"SichengZuo" declared "fold:0"
"KLChen2PokerPlayer" declared "raise:16"
"Jinkun" declared "fold:16"
"ZPlayer" declared "call:16"
"HakulaPlayer" declared "raise:51"
"KLChen2PokerPlayer" declared "fold:0"
"ZPlayer" declared "fold:0"
"['HakulaPlayer']" won the round 4 (stack = {'YangZ': 1000, 'Ethan': 995, 'HakulaPlayer': 1298, 'SichengZuo': 985, 'KLChen2PokerPlayer': 1030, 'Jinkun': 990, 'NitWinWin': 1000, 'ZPlayer': 702})
player [YangZ] gets hole card ['H4', 'D9'], current stack 1000
player [Ethan] gets hole card ['D8', 'HT'], current stack 995
player [HakulaPlayer] gets hole card ['D2', 'SJ'], current stack 1298
player [SichengZuo] gets hole card ['DQ', 'HK'], current stack 985
player [KLChen2PokerPlayer] gets hole card ['DK', 'C5'], current stack 1030
player [Jinkun] gets hole card ['C8', 'DA'], current stack 985
player [NitWinWin] gets hole card ['D5', 'CJ'], current stack 990
player [ZPlayer] gets hole card ['D4', 'CK'], current stack 702
Started the round 5
Street "preflop" started. (community card = [])
"ZPlayer" declared "call:10"
"YangZ" declared "fold:0"
"Ethan" declared "fold:0"
"HakulaPlayer" declared "call:10"
"SichengZuo" declared "fold:0"
"KLChen2PokerPlayer" declared "call:10"
"Jinkun" declared "call:10"
"NitWinWin" declared "fold:0"
Street "flop" started. (community card = ['ST', 'D3', 'C4'])
"Jinkun" declared "call:0"
"ZPlayer" declared "raise:10"
"HakulaPlayer" declared "fold:0"
"KLChen2PokerPlayer" declared "fold:0"
"Jinkun" declared "call:10"
Street "turn" started. (community card = ['ST', 'D3', 'C4', 'S2'])
"Jinkun" declared "raise:140"
"ZPlayer" declared "fold:0"
"['Jinkun']" won the round 5 (stack = {'YangZ': 1000, 'Ethan': 995, 'HakulaPlayer': 1288, 'SichengZuo': 985, 'KLChen2PokerPlayer': 1020, 'Jinkun': 1040, 'NitWinWin': 990, 'ZPlayer': 682})
player [YangZ] gets hole card ['S8', 'S9'], current stack 1000
player [Ethan] gets hole card ['HA', 'H2'], current stack 995
player [HakulaPlayer] gets hole card ['C6', 'DT'], current stack 1288
player [SichengZuo] gets hole card ['D3', 'SK'], current stack 985
player [KLChen2PokerPlayer] gets hole card ['C7', 'ST'], current stack 1020
player [Jinkun] gets hole card ['DK', 'H5'], current stack 1040
player [NitWinWin] gets hole card ['HK', 'H4'], current stack 985
player [ZPlayer] gets hole card ['DJ', 'D8'], current stack 672
Started the round 6
Street "preflop" started. (community card = [])
"YangZ" declared "fold:0"
"Ethan" declared "fold:0"
"HakulaPlayer" declared "fold:0"
"SichengZuo" declared "fold:0"
"KLChen2PokerPlayer" declared "raise:16"
"Jinkun" declared "fold:16"
"NitWinWin" declared "fold:0"
"ZPlayer" declared "call:16"
Street "flop" started. (community card = ['S7', 'SA', 'C5'])
"ZPlayer" declared "call:0"
"KLChen2PokerPlayer" declared "raise:29"
"ZPlayer" declared "fold:0"
"['KLChen2PokerPlayer']" won the round 6 (stack = {'YangZ': 1000, 'Ethan': 995, 'HakulaPlayer': 1288, 'SichengZuo': 985, 'KLChen2PokerPlayer': 1041, 'Jinkun': 1040, 'NitWinWin': 985, 'ZPlayer': 666})
player [YangZ] gets hole card ['H9', 'HJ'], current stack 990
player [Ethan] gets hole card ['DT', 'D7'], current stack 995
player [HakulaPlayer] gets hole card ['SA', 'D9'], current stack 1288
player [SichengZuo] gets hole card ['H2', 'CQ'], current stack 985
player [KLChen2PokerPlayer] gets hole card ['DK', 'H6'], current stack 1041
player [Jinkun] gets hole card ['CJ', 'C8'], current stack 1040
player [NitWinWin] gets hole card ['S8', 'HK'], current stack 985
player [ZPlayer] gets hole card ['SQ', 'H5'], current stack 661
Started the round 7
Street "preflop" started. (community card = [])
"Ethan" declared "fold:0"
"HakulaPlayer" declared "fold:0"
"SichengZuo" declared "fold:0"
"KLChen2PokerPlayer" declared "call:10"
"Jinkun" declared "fold:10"
"NitWinWin" declared "fold:0"
"ZPlayer" declared "raise:15"
"YangZ" declared "fold:0"
"KLChen2PokerPlayer" declared "fold:0"
"['ZPlayer']" won the round 7 (stack = {'YangZ': 990, 'Ethan': 995, 'HakulaPlayer': 1288, 'SichengZuo': 985, 'KLChen2PokerPlayer': 1031, 'Jinkun': 1040, 'NitWinWin': 985, 'ZPlayer': 686})
player [YangZ] gets hole card ['H7', 'H5'], current stack 985
player [Ethan] gets hole card ['C3', 'H6'], current stack 985
player [HakulaPlayer] gets hole card ['CJ', 'SJ'], current stack 1288
player [SichengZuo] gets hole card ['S9', 'DJ'], current stack 985
player [KLChen2PokerPlayer] gets hole card ['CK', 'ST'], current stack 1031
player [Jinkun] gets hole card ['HT', 'DT'], current stack 1040
player [NitWinWin] gets hole card ['H8', 'C5'], current stack 985
player [ZPlayer] gets hole card ['D3', 'DK'], current stack 686
Started the round 8
Street "preflop" started. (community card = [])
"HakulaPlayer" declared "raise:34"
"SichengZuo" declared "fold:0"
"KLChen2PokerPlayer" declared "fold:0"
"Jinkun" declared "fold:34"
"NitWinWin" declared "fold:0"
"ZPlayer" declared "fold:0"
"YangZ" declared "fold:0"
"Ethan" declared "fold:0"
"['HakulaPlayer']" won the round 8 (stack = {'YangZ': 985, 'Ethan': 985, 'HakulaPlayer': 1303, 'SichengZuo': 985, 'KLChen2PokerPlayer': 1031, 'Jinkun': 1040, 'NitWinWin': 985, 'ZPlayer': 686})
player [YangZ] gets hole card ['S4', 'C5'], current stack 985
player [Ethan] gets hole card ['ST', 'H9'], current stack 980
player [HakulaPlayer] gets hole card ['D5', 'HJ'], current stack 1293
player [SichengZuo] gets hole card ['HA', 'D8'], current stack 985
player [KLChen2PokerPlayer] gets hole card ['C9', 'C3'], current stack 1031
player [Jinkun] gets hole card ['C8', 'D9'], current stack 1040
player [NitWinWin] gets hole card ['H2', 'D7'], current stack 985
player [ZPlayer] gets hole card ['CK', 'H5'], current stack 686
Started the round 9
Street "preflop" started. (community card = [])
"SichengZuo" declared "fold:0"
"KLChen2PokerPlayer" declared "fold:0"
"Jinkun" declared "fold:10"
"NitWinWin" declared "fold:0"
"ZPlayer" declared "raise:15"
"YangZ" declared "fold:0"
"Ethan" declared "call:15"
"HakulaPlayer" declared "call:15"
Street "flop" started. (community card = ['HQ', 'CT', 'C4'])
"Ethan" declared "call:0"
"HakulaPlayer" declared "call:0"
"ZPlayer" declared "call:0"
Street "turn" started. (community card = ['HQ', 'CT', 'C4', 'DA'])
"Ethan" declared "call:0"
"HakulaPlayer" declared "call:0"
"ZPlayer" declared "call:0"
Street "river" started. (community card = ['HQ', 'CT', 'C4', 'DA', 'DJ'])
"Ethan" declared "call:0"
"HakulaPlayer" declared "call:0"
"ZPlayer" declared "raise:302"
"Ethan" declared "fold:0"
"HakulaPlayer" declared "fold:0"
"['ZPlayer']" won the round 9 (stack = {'YangZ': 985, 'Ethan': 970, 'HakulaPlayer': 1288, 'SichengZuo': 985, 'KLChen2PokerPlayer': 1031, 'Jinkun': 1040, 'NitWinWin': 985, 'ZPlayer': 716})
player [YangZ] gets hole card ['SA', 'S7'], current stack 985
player [Ethan] gets hole card ['D5', 'C4'], current stack 970
player [HakulaPlayer] gets hole card ['HK', 'D3'], current stack 1283
player [SichengZuo] gets hole card ['S4', 'D6'], current stack 975
player [KLChen2PokerPlayer] gets hole card ['C7', 'DJ'], current stack 1031
player [Jinkun] gets hole card ['HJ', 'DK'], current stack 1040
player [NitWinWin] gets hole card ['C6', 'C2'], current stack 985
player [ZPlayer] gets hole card ['D9', 'CQ'], current stack 716
Started the round 10
Street "preflop" started. (community card = [])
"KLChen2PokerPlayer" declared "raise:17"
"Jinkun" declared "fold:17"
"NitWinWin" declared "fold:0"
"ZPlayer" declared "call:17"
"YangZ" declared "fold:0"
"Ethan" declared "fold:0"
"HakulaPlayer" declared "call:17"
"SichengZuo" declared "fold:0"
Street "flop" started. (community card = ['DA', 'H4', 'DQ'])
"HakulaPlayer" declared "call:0"
"KLChen2PokerPlayer" declared "call:0"
"ZPlayer" declared "raise:30"
"HakulaPlayer" declared "fold:0"
"KLChen2PokerPlayer" declared "fold:0"
"['ZPlayer']" won the round 10 (stack = {'YangZ': 985, 'Ethan': 970, 'HakulaPlayer': 1271, 'SichengZuo': 975, 'KLChen2PokerPlayer': 1014, 'Jinkun': 1040, 'NitWinWin': 985, 'ZPlayer': 760})
player [YangZ] gets hole card ['DT', 'H7'], current stack 985
player [Ethan] gets hole card ['S9', 'C7'], current stack 970
player [HakulaPlayer] gets hole card ['SK', 'S8'], current stack 1271
player [SichengZuo] gets hole card ['H4', 'HJ'], current stack 970
player [KLChen2PokerPlayer] gets hole card ['D4', 'D9'], current stack 1004
player [Jinkun] gets hole card ['ST', 'S6'], current stack 1040
player [NitWinWin] gets hole card ['S3', 'C5'], current stack 985
player [ZPlayer] gets hole card ['D6', 'S5'], current stack 760
Started the round 11
Street "preflop" started. (community card = [])
"Jinkun" declared "fold:10"
"NitWinWin" declared "fold:0"
"ZPlayer" declared "call:10"
"YangZ" declared "fold:0"
"Ethan" declared "fold:0"
"HakulaPlayer" declared "raise:30"
"SichengZuo" declared "fold:0"
"KLChen2PokerPlayer" declared "fold:0"
"ZPlayer" declared "call:30"
Street "flop" started. (community card = ['C8', 'CT', 'D8'])
"ZPlayer" declared "call:0"
"HakulaPlayer" declared "raise:93"
"ZPlayer" declared "fold:0"
"['HakulaPlayer']" won the round 11 (stack = {'YangZ': 985, 'Ethan': 970, 'HakulaPlayer': 1316, 'SichengZuo': 970, 'KLChen2PokerPlayer': 1004, 'Jinkun': 1040, 'NitWinWin': 985, 'ZPlayer': 730})
player [YangZ] gets hole card ['H2', 'S5'], current stack 985
player [Ethan] gets hole card ['D8', 'C7'], current stack 970
player [HakulaPlayer] gets hole card ['CQ', 'SK'], current stack 1316
player [SichengZuo] gets hole card ['S9', 'D2'], current stack 970
player [KLChen2PokerPlayer] gets hole card ['H7', 'C8'], current stack 999
player [Jinkun] gets hole card ['D3', 'D7'], current stack 1030
player [NitWinWin] gets hole card ['H3', 'DQ'], current stack 985
player [ZPlayer] gets hole card ['HK', 'HQ'], current stack 730
Started the round 12
Street "preflop" started. (community card = [])
"NitWinWin" declared "fold:0"
"ZPlayer" declared "raise:15"
"YangZ" declared "fold:0"
"Ethan" declared "fold:0"
"HakulaPlayer" declared "call:15"
"SichengZuo" declared "fold:0"
"KLChen2PokerPlayer" declared "fold:0"
"Jinkun" declared "fold:15"
Street "flop" started. (community card = ['D4', 'C9', 'C4'])
"ZPlayer" declared "call:0"
"HakulaPlayer" declared "call:0"
Street "turn" started. (community card = ['D4', 'C9', 'C4', 'HT'])
"ZPlayer" declared "call:0"
"HakulaPlayer" declared "call:0"
Street "river" started. (community card = ['D4', 'C9', 'C4', 'HT', 'DT'])
"ZPlayer" declared "call:0"
"HakulaPlayer" declared "call:0"
"['HakulaPlayer', 'ZPlayer']" won the round 12 (stack = {'YangZ': 985, 'Ethan': 970, 'HakulaPlayer': 1323, 'SichengZuo': 970, 'KLChen2PokerPlayer': 999, 'Jinkun': 1030, 'NitWinWin': 985, 'ZPlayer': 737})
player [YangZ] gets hole card ['CK', 'ST'], current stack 985
player [Ethan] gets hole card ['HA', 'HT'], current stack 970
player [HakulaPlayer] gets hole card ['C6', 'S7'], current stack 1323
player [SichengZuo] gets hole card ['D6', 'D9'], current stack 970
player [KLChen2PokerPlayer] gets hole card ['CQ', 'H6'], current stack 999
player [Jinkun] gets hole card ['C7', 'C4'], current stack 1025
player [NitWinWin] gets hole card ['DA', 'H7'], current stack 975
player [ZPlayer] gets hole card ['CT', 'C5'], current stack 737
Started the round 13
Street "preflop" started. (community card = [])
"ZPlayer" declared "call:10"
"YangZ" declared "fold:0"
"Ethan" declared "call:10"
"HakulaPlayer" declared "call:10"
"SichengZuo" declared "fold:0"
"KLChen2PokerPlayer" declared "call:10"
"Jinkun" declared "call:10"
"NitWinWin" declared "fold:0"
Street "flop" started. (community card = ['C2', 'S9', 'D3'])
"Jinkun" declared "call:0"
"ZPlayer" declared "call:0"
"Ethan" declared "call:0"
"HakulaPlayer" declared "call:0"
"KLChen2PokerPlayer" declared "call:0"
Street "turn" started. (community card = ['C2', 'S9', 'D3', 'H8'])
"Jinkun" declared "call:0"
"ZPlayer" declared "call:0"
"Ethan" declared "call:0"
"HakulaPlayer" declared "call:0"
"KLChen2PokerPlayer" declared "call:0"
Street "river" started. (community card = ['C2', 'S9', 'D3', 'H8', 'H5'])
"Jinkun" declared "call:0"
"ZPlayer" declared "call:0"
"Ethan" declared "call:0"
"HakulaPlayer" declared "raise:80"
"KLChen2PokerPlayer" declared "fold:0"
"Jinkun" declared "fold:80"
"ZPlayer" declared "fold:0"
"Ethan" declared "fold:0"
"['HakulaPlayer']" won the round 13 (stack = {'YangZ': 985, 'Ethan': 960, 'HakulaPlayer': 1373, 'SichengZuo': 970, 'KLChen2PokerPlayer': 989, 'Jinkun': 1020, 'NitWinWin': 975, 'ZPlayer': 727})
player [YangZ] gets hole card ['S8', 'DQ'], current stack 985
player [Ethan] gets hole card ['D7', 'D3'], current stack 960
player [HakulaPlayer] gets hole card ['C4', 'HJ'], current stack 1373
player [SichengZuo] gets hole card ['HQ', 'H8'], current stack 970
player [KLChen2PokerPlayer] gets hole card ['H6', 'C8'], current stack 989
player [Jinkun] gets hole card ['S4', 'SQ'], current stack 1020
player [NitWinWin] gets hole card ['HA', 'ST'], current stack 970
player [ZPlayer] gets hole card ['D6', 'D9'], current stack 717
Started the round 14
Street "preflop" started. (community card = [])
"YangZ" declared "fold:0"
"Ethan" declared "fold:0"
"HakulaPlayer" declared "fold:0"
"SichengZuo" declared "fold:0"
"KLChen2PokerPlayer" declared "fold:0"
"Jinkun" declared "call:10"
"NitWinWin" declared "fold:0"
"ZPlayer" declared "call:10"
Street "flop" started. (community card = ['HT', 'C6', 'S6'])
"ZPlayer" declared "raise:586"
"Jinkun" declared "fold:586"
"['ZPlayer']" won the round 14 (stack = {'YangZ': 985, 'Ethan': 960, 'HakulaPlayer': 1373, 'SichengZuo': 970, 'KLChen2PokerPlayer': 989, 'Jinkun': 1010, 'NitWinWin': 970, 'ZPlayer': 742})
player [YangZ] gets hole card ['H9', 'C9'], current stack 975
player [Ethan] gets hole card ['H3', 'HK'], current stack 960
player [HakulaPlayer] gets hole card ['C4', 'HJ'], current stack 1373
player [SichengZuo] gets hole card ['D3', 'C2'], current stack 970
player [KLChen2PokerPlayer] gets hole card ['D9', 'S3'], current stack 989
player [Jinkun] gets hole card ['SA', 'C3'], current stack 1010
player [NitWinWin] gets hole card ['S2', 'S8'], current stack 970
player [ZPlayer] gets hole card ['ST', 'HA'], current stack 737
Started the round 15
Street "preflop" started. (community card = [])
"Ethan" declared "fold:0"
"HakulaPlayer" declared "fold:0"
"SichengZuo" declared "fold:0"
"KLChen2PokerPlayer" declared "fold:0"
"Jinkun" declared "call:10"
"NitWinWin" declared "fold:0"
"ZPlayer" declared "raise:15"
"YangZ" declared "fold:0"
"Jinkun" declared "call:15"
Street "flop" started. (community card = ['H6', 'H8', 'D5'])
"ZPlayer" declared "call:0"
"Jinkun" declared "call:0"
Street "turn" started. (community card = ['H6', 'H8', 'D5', 'S4'])
"ZPlayer" declared "call:0"
"Jinkun" declared "call:0"
Street "river" started. (community card = ['H6', 'H8', 'D5', 'S4', 'H5'])
"ZPlayer" declared "call:0"
"Jinkun" declared "call:0"
"['ZPlayer']" won the round 15 (stack = {'YangZ': 975, 'Ethan': 960, 'HakulaPlayer': 1373, 'SichengZuo': 970, 'KLChen2PokerPlayer': 989, 'Jinkun': 995, 'NitWinWin': 970, 'ZPlayer': 767})
player [YangZ] gets hole card ['ST', 'D7'], current stack 970
player [Ethan] gets hole card ['HK', 'DK'], current stack 950
player [HakulaPlayer] gets hole card ['C8', 'DJ'], current stack 1373
player [SichengZuo] gets hole card ['C3', 'S4'], current stack 970
player [KLChen2PokerPlayer] gets hole card ['S9', 'H9'], current stack 989
player [Jinkun] gets hole card ['C5', 'D5'], current stack 995
player [NitWinWin] gets hole card ['C2', 'S6'], current stack 970
player [ZPlayer] gets hole card ['D2', 'SK'], current stack 767
Started the round 16
Street "preflop" started. (community card = [])
"HakulaPlayer" declared "fold:0"
"SichengZuo" declared "fold:0"
"KLChen2PokerPlayer" declared "raise:29"
"Jinkun" declared "fold:29"
"NitWinWin" declared "fold:0"
"ZPlayer" declared "call:29"
"YangZ" declared "fold:0"
"Ethan" declared "raise:288"
"KLChen2PokerPlayer" declared "fold:0"
"ZPlayer" declared "call:288"
Street "flop" started. (community card = ['H8', 'H2', 'C6'])
"Ethan" declared "call:0"
"ZPlayer" declared "call:0"
Street "turn" started. (community card = ['H8', 'H2', 'C6', 'C7'])
"Ethan" declared "call:0"
"ZPlayer" declared "call:0"
Street "river" started. (community card = ['H8', 'H2', 'C6', 'C7', 'SA'])
"Ethan" declared "raise:610"
"ZPlayer" declared "fold:0"
"['Ethan']" won the round 16 (stack = {'YangZ': 970, 'Ethan': 1282, 'HakulaPlayer': 1373, 'SichengZuo': 970, 'KLChen2PokerPlayer': 960, 'Jinkun': 995, 'NitWinWin': 970, 'ZPlayer': 479})
player [YangZ] gets hole card ['C6', 'SQ'], current stack 970
player [Ethan] gets hole card ['H6', 'CK'], current stack 1277
player [HakulaPlayer] gets hole card ['HA', 'C2'], current stack 1363
player [SichengZuo] gets hole card ['D4', 'D2'], current stack 970
player [KLChen2PokerPlayer] gets hole card ['H5', 'CQ'], current stack 960
player [Jinkun] gets hole card ['S7', 'SA'], current stack 995
player [NitWinWin] gets hole card ['CA', 'C3'], current stack 970
player [ZPlayer] gets hole card ['D5', 'SJ'], current stack 479
Started the round 17
Street "preflop" started. (community card = [])
"SichengZuo" declared "fold:0"
"KLChen2PokerPlayer" declared "fold:0"
"Jinkun" declared "fold:10"
"NitWinWin" declared "fold:0"
"ZPlayer" declared "call:10"
"YangZ" declared "fold:0"
"Ethan" declared "fold:0"
"HakulaPlayer" declared "raise:32"
"ZPlayer" declared "fold:0"
"['HakulaPlayer']" won the round 17 (stack = {'YangZ': 970, 'Ethan': 1277, 'HakulaPlayer': 1388, 'SichengZuo': 970, 'KLChen2PokerPlayer': 960, 'Jinkun': 995, 'NitWinWin': 970, 'ZPlayer': 469})
player [YangZ] gets hole card ['S5', 'D4'], current stack 970
player [Ethan] gets hole card ['D6', 'H8'], current stack 1277
player [HakulaPlayer] gets hole card ['D8', 'H6'], current stack 1383
player [SichengZuo] gets hole card ['S9', 'D2'], current stack 960
player [KLChen2PokerPlayer] gets hole card ['C5', 'D9'], current stack 960
player [Jinkun] gets hole card ['H4', 'S8'], current stack 995
player [NitWinWin] gets hole card ['CA', 'S6'], current stack 970
player [ZPlayer] gets hole card ['S7', 'DA'], current stack 469
Started the round 18
Street "preflop" started. (community card = [])
"KLChen2PokerPlayer" declared "fold:0"
"Jinkun" declared "fold:10"
"NitWinWin" declared "fold:0"
"ZPlayer" declared "raise:15"
"YangZ" declared "fold:0"
"Ethan" declared "fold:0"
"HakulaPlayer" declared "fold:0"
"SichengZuo" declared "fold:0"
"['ZPlayer']" won the round 18 (stack = {'YangZ': 970, 'Ethan': 1277, 'HakulaPlayer': 1383, 'SichengZuo': 960, 'KLChen2PokerPlayer': 960, 'Jinkun': 995, 'NitWinWin': 970, 'ZPlayer': 484})
player [YangZ] gets hole card ['C2', 'D6'], current stack 970
player [Ethan] gets hole card ['C9', 'HQ'], current stack 1277
player [HakulaPlayer] gets hole card ['C3', 'C8'], current stack 1383
player [SichengZuo] gets hole card ['C4', 'HJ'], current stack 955
player [KLChen2PokerPlayer] gets hole card ['DQ', 'ST'], current stack 950
player [Jinkun] gets hole card ['D7', 'D2'], current stack 995
player [NitWinWin] gets hole card ['CJ', 'SA'], current stack 970
player [ZPlayer] gets hole card ['D8', 'CA'], current stack 484
Started the round 19
Street "preflop" started. (community card = [])
"Jinkun" declared "fold:10"
"NitWinWin" declared "fold:0"
"ZPlayer" declared "raise:15"
"YangZ" declared "fold:0"
"Ethan" declared "fold:0"
"HakulaPlayer" declared "fold:0"
"SichengZuo" declared "fold:0"
"KLChen2PokerPlayer" declared "raise:20"
"ZPlayer" declared "call:20"
Street "flop" started. (community card = ['SQ', 'S6', 'S4'])
"KLChen2PokerPlayer" declared "raise:38"
"ZPlayer" declared "fold:0"
"['KLChen2PokerPlayer']" won the round 19 (stack = {'YangZ': 970, 'Ethan': 1277, 'HakulaPlayer': 1383, 'SichengZuo': 955, 'KLChen2PokerPlayer': 985, 'Jinkun': 995, 'NitWinWin': 970, 'ZPlayer': 464})
player [YangZ] gets hole card ['H3', 'H2'], current stack 970
player [Ethan] gets hole card ['D5', 'CQ'], current stack 1277
player [HakulaPlayer] gets hole card ['S7', 'S9'], current stack 1383
player [SichengZuo] gets hole card ['HQ', 'HK'], current stack 955
player [KLChen2PokerPlayer] gets hole card ['S2', 'C7'], current stack 980
player [Jinkun] gets hole card ['SA', 'D2'], current stack 985
player [NitWinWin] gets hole card ['HA', 'S6'], current stack 970
player [ZPlayer] gets hole card ['HJ', 'CK'], current stack 464
Started the round 20
Street "preflop" started. (community card = [])
"NitWinWin" declared "fold:0"
"ZPlayer" declared "raise:15"
"YangZ" declared "fold:0"
"Ethan" declared "fold:0"
"HakulaPlayer" declared "fold:0"
"SichengZuo" declared "fold:0"
"KLChen2PokerPlayer" declared "fold:0"
"Jinkun" declared "call:15"
Street "flop" started. (community card = ['CT', 'D6', 'CJ'])
"Jinkun" declared "call:0"
"ZPlayer" declared "raise:10"
"Jinkun" declared "call:10"
Street "turn" started. (community card = ['CT', 'D6', 'CJ', 'D4'])
"Jinkun" declared "call:0"
"ZPlayer" declared "raise:10"
"Jinkun" declared "call:10"
Street "river" started. (community card = ['CT', 'D6', 'CJ', 'D4', 'DQ'])
"Jinkun" declared "call:0"
"ZPlayer" declared "raise:10"
"Jinkun" declared "call:10"
"['ZPlayer']" won the round 20 (stack = {'YangZ': 970, 'Ethan': 1277, 'HakulaPlayer': 1383, 'SichengZuo': 955, 'KLChen2PokerPlayer': 980, 'Jinkun': 950, 'NitWinWin': 970, 'ZPlayer': 514})
player [YangZ] gets hole card ['C4', 'S3'], current stack 970
player [Ethan] gets hole card ['DQ', 'H7'], current stack 1277
player [HakulaPlayer] gets hole card ['S2', 'HQ'], current stack 1383
player [SichengZuo] gets hole card ['S8', 'C2'], current stack 955
player [KLChen2PokerPlayer] gets hole card ['S5', 'HK'], current stack 980
player [Jinkun] gets hole card ['C6', 'S7'], current stack 945
player [NitWinWin] gets hole card ['D9', 'CQ'], current stack 960
player [ZPlayer] gets hole card ['D6', 'SQ'], current stack 514
Started the round 21
Street "preflop" started. (community card = [])
"ZPlayer" declared "call:10"
"YangZ" declared "fold:0"
"Ethan" declared "fold:0"
"HakulaPlayer" declared "call:10"
"SichengZuo" declared "fold:0"
"KLChen2PokerPlayer" declared "raise:15"
"Jinkun" declared "fold:15"
"NitWinWin" declared "fold:0"
"ZPlayer" declared "call:15"
"HakulaPlayer" declared "call:15"
Street "flop" started. (community card = ['DJ', 'C3', 'C5'])
"ZPlayer" declared "call:0"
"HakulaPlayer" declared "raise:27"
"KLChen2PokerPlayer" declared "fold:0"
"ZPlayer" declared "fold:0"
"['HakulaPlayer']" won the round 21 (stack = {'YangZ': 970, 'Ethan': 1277, 'HakulaPlayer': 1428, 'SichengZuo': 955, 'KLChen2PokerPlayer': 965, 'Jinkun': 945, 'NitWinWin': 960, 'ZPlayer': 499})
player [YangZ] gets hole card ['D9', 'H6'], current stack 970
player [Ethan] gets hole card ['C9', 'DK'], current stack 1277
player [HakulaPlayer] gets hole card ['H4', 'S4'], current stack 1428
player [SichengZuo] gets hole card ['CQ', 'S5'], current stack 955
player [KLChen2PokerPlayer] gets hole card ['H8', 'SQ'], current stack 965
player [Jinkun] gets hole card ['S9', 'S8'], current stack 945
player [NitWinWin] gets hole card ['CK', 'HK'], current stack 955
player [ZPlayer] gets hole card ['H7', 'D4'], current stack 489
Started the round 22
Street "preflop" started. (community card = [])
"YangZ" declared "fold:0"
"Ethan" declared "fold:0"
"HakulaPlayer" declared "call:10"
"SichengZuo" declared "fold:0"
"KLChen2PokerPlayer" declared "raise:15"
"Jinkun" declared "fold:15"
"NitWinWin" declared "raise:960"
"ZPlayer" declared "fold:0"
"HakulaPlayer" declared "fold:0"
"KLChen2PokerPlayer" declared "fold:0"
"['NitWinWin']" won the round 22 (stack = {'YangZ': 970, 'Ethan': 1277, 'HakulaPlayer': 1418, 'SichengZuo': 955, 'KLChen2PokerPlayer': 950, 'Jinkun': 945, 'NitWinWin': 995, 'ZPlayer': 489})
player [YangZ] gets hole card ['CQ', 'C3'], current stack 960
player [Ethan] gets hole card ['ST', 'HQ'], current stack 1277
player [HakulaPlayer] gets hole card ['HK', 'S9'], current stack 1418
player [SichengZuo] gets hole card ['H7', 'C5'], current stack 955
player [KLChen2PokerPlayer] gets hole card ['SQ', 'HJ'], current stack 950
player [Jinkun] gets hole card ['C9', 'DJ'], current stack 945
player [NitWinWin] gets hole card ['D2', 'SA'], current stack 995
player [ZPlayer] gets hole card ['D5', 'H4'], current stack 484
Started the round 23
Street "preflop" started. (community card = [])
"Ethan" declared "fold:0"
"HakulaPlayer" declared "call:10"
"SichengZuo" declared "fold:0"
"KLChen2PokerPlayer" declared "raise:21"
"Jinkun" declared "fold:21"
"NitWinWin" declared "fold:0"
"ZPlayer" declared "call:21"
"YangZ" declared "fold:0"
"HakulaPlayer" declared "call:21"
Street "flop" started. (community card = ['S2', 'SK', 'CA'])
"ZPlayer" declared "call:0"
"HakulaPlayer" declared "call:0"
"KLChen2PokerPlayer" declared "raise:14"
"ZPlayer" declared "fold:0"
"HakulaPlayer" declared "raise:81"
"KLChen2PokerPlayer" declared "fold:0"
"['HakulaPlayer']" won the round 23 (stack = {'YangZ': 960, 'Ethan': 1277, 'HakulaPlayer': 1484, 'SichengZuo': 955, 'KLChen2PokerPlayer': 915, 'Jinkun': 945, 'NitWinWin': 995, 'ZPlayer': 468})
player [YangZ] gets hole card ['HA', 'S6'], current stack 955
player [Ethan] gets hole card ['D4', 'HK'], current stack 1267
player [HakulaPlayer] gets hole card ['H5', 'D7'], current stack 1484
player [SichengZuo] gets hole card ['C6', 'S8'], current stack 955
player [KLChen2PokerPlayer] gets hole card ['HJ', 'S5'], current stack 915
player [Jinkun] gets hole card ['S3', 'CQ'], current stack 945
player [NitWinWin] gets hole card ['C5', 'C8'], current stack 995
player [ZPlayer] gets hole card ['S7', 'CA'], current stack 468
Started the round 24
Street "preflop" started. (community card = [])
"HakulaPlayer" declared "fold:0"
"SichengZuo" declared "fold:0"
"KLChen2PokerPlayer" declared "fold:0"
"Jinkun" declared "fold:10"
"NitWinWin" declared "fold:0"
"ZPlayer" declared "raise:15"
"YangZ" declared "fold:0"
"Ethan" declared "fold:0"
"['ZPlayer']" won the round 24 (stack = {'YangZ': 955, 'Ethan': 1267, 'HakulaPlayer': 1484, 'SichengZuo': 955, 'KLChen2PokerPlayer': 915, 'Jinkun': 945, 'NitWinWin': 995, 'ZPlayer': 483})
player [YangZ] gets hole card ['D3', 'DK'], current stack 955
player [Ethan] gets hole card ['SA', 'ST'], current stack 1262
player [HakulaPlayer] gets hole card ['H8', 'S5'], current stack 1474
player [SichengZuo] gets hole card ['S2', 'C9'], current stack 955
player [KLChen2PokerPlayer] gets hole card ['S4', 'D4'], current stack 915
player [Jinkun] gets hole card ['DA', 'H7'], current stack 945
player [NitWinWin] gets hole card ['D5', 'DJ'], current stack 995
player [ZPlayer] gets hole card ['S8', 'DT'], current stack 483
Started the round 25
Street "preflop" started. (community card = [])
"SichengZuo" declared "fold:0"
"KLChen2PokerPlayer" declared "call:10"
"Jinkun" declared "fold:10"
"NitWinWin" declared "fold:0"
"ZPlayer" declared "call:10"
"YangZ" declared "fold:0"
"Ethan" declared "call:10"
"HakulaPlayer" declared "call:10"
Street "flop" started. (community card = ['C8', 'CA', 'SQ'])
"Ethan" declared "call:0"
"HakulaPlayer" declared "call:0"
"KLChen2PokerPlayer" declared "call:0"
"ZPlayer" declared "raise:20"
"Ethan" declared "call:20"
"HakulaPlayer" declared "fold:0"
"KLChen2PokerPlayer" declared "fold:0"
Street "turn" started. (community card = ['C8', 'CA', 'SQ', 'C3'])
"Ethan" declared "raise:123"
"ZPlayer" declared "fold:0"
"['Ethan']" won the round 25 (stack = {'YangZ': 955, 'Ethan': 1317, 'HakulaPlayer': 1474, 'SichengZuo': 955, 'KLChen2PokerPlayer': 905, 'Jinkun': 945, 'NitWinWin': 995, 'ZPlayer': 453})
player [YangZ] gets hole card ['SK', 'CA'], current stack 955
player [Ethan] gets hole card ['CJ', 'CK'], current stack 1317
player [HakulaPlayer] gets hole card ['CQ', 'C4'], current stack 1469
player [SichengZuo] gets hole card ['C5', 'S9'], current stack 945
player [KLChen2PokerPlayer] gets hole card ['H6', 'D6'], current stack 905
player [Jinkun] gets hole card ['DQ', 'S6'], current stack 945
player [NitWinWin] gets hole card ['D8', 'SA'], current stack 995
player [ZPlayer] gets hole card ['SJ', 'DT'], current stack 453
Started the round 26
Street "preflop" started. (community card = [])
"KLChen2PokerPlayer" declared "raise:27"
"Jinkun" declared "fold:27"
"NitWinWin" declared "fold:0"
"ZPlayer" declared "call:27"
"YangZ" declared "fold:0"
"Ethan" declared "raise:197"
"HakulaPlayer" declared "fold:0"
"SichengZuo" declared "fold:0"
"KLChen2PokerPlayer" declared "fold:0"
"ZPlayer" declared "call:197"
Street "flop" started. (community card = ['HQ', 'C9', 'D5'])
"ZPlayer" declared "raise:10"
"Ethan" declared "call:10"
Street "turn" started. (community card = ['HQ', 'C9', 'D5', 'HT'])
"ZPlayer" declared "raise:10"
"Ethan" declared "raise:466"
"ZPlayer" declared "call:466"
Street "river" started. (community card = ['HQ', 'C9', 'D5', 'HT', 'S7'])
"['Ethan']" won the round 26 (stack = {'YangZ': 955, 'Ethan': 1812, 'HakulaPlayer': 1469, 'SichengZuo': 945, 'KLChen2PokerPlayer': 878, 'Jinkun': 945, 'NitWinWin': 995, 'ZPlayer': 0})
player [YangZ] gets hole card ['HK', 'CK'], current stack 955
player [Ethan] gets hole card ['DK', 'CT'], current stack 1812
player [HakulaPlayer] gets hole card ['C8', 'C6'], current stack 1469
player [SichengZuo] gets hole card ['D5', 'H9'], current stack 940
player [KLChen2PokerPlayer] gets hole card ['D3', 'C4'], current stack 868
player [Jinkun] gets hole card ['S8', 'S5'], current stack 945
player [NitWinWin] gets hole card ['H5', 'C3'], current stack 995
Started the round 27
Street "preflop" started. (community card = [])
"Jinkun" declared "fold:10"
"NitWinWin" declared "fold:0"
"YangZ" declared "fold:0"
"Ethan" declared "fold:0"
"HakulaPlayer" declared "fold:0"
"SichengZuo" declared "fold:0"
"['KLChen2PokerPlayer']" won the round 27 (stack = {'YangZ': 955, 'Ethan': 1812, 'HakulaPlayer': 1469, 'SichengZuo': 940, 'KLChen2PokerPlayer': 883, 'Jinkun': 945, 'NitWinWin': 995, 'ZPlayer': 0})
player [YangZ] gets hole card ['ST', 'HA'], current stack 955
player [Ethan] gets hole card ['C3', 'S6'], current stack 1812
player [HakulaPlayer] gets hole card ['HJ', 'DJ'], current stack 1469
player [SichengZuo] gets hole card ['H3', 'D7'], current stack 940
player [KLChen2PokerPlayer] gets hole card ['DT', 'S7'], current stack 878
player [Jinkun] gets hole card ['S5', 'CQ'], current stack 935
player [NitWinWin] gets hole card ['HT', 'C6'], current stack 995
Started the round 28
Street "preflop" started. (community card = [])
"NitWinWin" declared "fold:0"
"YangZ" declared "fold:0"
"Ethan" declared "fold:0"
"HakulaPlayer" declared "raise:34"
"SichengZuo" declared "fold:0"
"KLChen2PokerPlayer" declared "fold:0"
"Jinkun" declared "fold:34"
"['HakulaPlayer']" won the round 28 (stack = {'YangZ': 955, 'Ethan': 1812, 'HakulaPlayer': 1484, 'SichengZuo': 940, 'KLChen2PokerPlayer': 878, 'Jinkun': 935, 'NitWinWin': 995, 'ZPlayer': 0})
player [YangZ] gets hole card ['SQ', 'D4'], current stack 955
player [Ethan] gets hole card ['C8', 'H3'], current stack 1812
player [HakulaPlayer] gets hole card ['H2', 'DA'], current stack 1484
player [SichengZuo] gets hole card ['H7', 'SA'], current stack 940
player [KLChen2PokerPlayer] gets hole card ['S3', 'H9'], current stack 878
player [Jinkun] gets hole card ['S5', 'SK'], current stack 930
player [NitWinWin] gets hole card ['SJ', 'H5'], current stack 985
Started the round 29
Street "preflop" started. (community card = [])
"YangZ" declared "fold:0"
"Ethan" declared "fold:0"
"HakulaPlayer" declared "call:10"
"SichengZuo" declared "fold:0"
"KLChen2PokerPlayer" declared "raise:19"
"Jinkun" declared "fold:19"
"NitWinWin" declared "fold:0"
"HakulaPlayer" declared "call:19"
Street "flop" started. (community card = ['C2', 'CK', 'CQ'])
"HakulaPlayer" declared "call:0"
"KLChen2PokerPlayer" declared "call:0"
Street "turn" started. (community card = ['C2', 'CK', 'CQ', 'CA'])
"HakulaPlayer" declared "call:0"
"KLChen2PokerPlayer" declared "call:0"
Street "river" started. (community card = ['C2', 'CK', 'CQ', 'CA', 'S8'])
"HakulaPlayer" declared "call:0"
"KLChen2PokerPlayer" declared "call:0"
"['HakulaPlayer']" won the round 29 (stack = {'YangZ': 955, 'Ethan': 1812, 'HakulaPlayer': 1518, 'SichengZuo': 940, 'KLChen2PokerPlayer': 859, 'Jinkun': 930, 'NitWinWin': 985, 'ZPlayer': 0})
player [YangZ] gets hole card ['SJ', 'H2'], current stack 945
player [Ethan] gets hole card ['HK', 'H9'], current stack 1812
player [HakulaPlayer] gets hole card ['C5', 'ST'], current stack 1518
player [SichengZuo] gets hole card ['H4', 'H5'], current stack 940
player [KLChen2PokerPlayer] gets hole card ['S9', 'D4'], current stack 859
player [Jinkun] gets hole card ['CT', 'CA'], current stack 930
player [NitWinWin] gets hole card ['DK', 'HT'], current stack 980
Started the round 30
Street "preflop" started. (community card = [])
"Ethan" declared "fold:0"
"HakulaPlayer" declared "fold:0"
"SichengZuo" declared "fold:0"
"KLChen2PokerPlayer" declared "call:10"
"Jinkun" declared "call:10"
"NitWinWin" declared "fold:0"
"YangZ" declared "fold:0"
Street "flop" started. (community card = ['C9', 'H3', 'C3'])
"KLChen2PokerPlayer" declared "raise:24"
"Jinkun" declared "call:24"
Street "turn" started. (community card = ['C9', 'H3', 'C3', 'D6'])
"KLChen2PokerPlayer" declared "raise:128"
"Jinkun" declared "call:128"
Street "river" started. (community card = ['C9', 'H3', 'C3', 'D6', 'SK'])
"KLChen2PokerPlayer" declared "raise:121"
"Jinkun" declared "call:121"
"['KLChen2PokerPlayer']" won the round 30 (stack = {'YangZ': 945, 'Ethan': 1812, 'HakulaPlayer': 1518, 'SichengZuo': 940, 'KLChen2PokerPlayer': 1157, 'Jinkun': 647, 'NitWinWin': 980, 'ZPlayer': 0})
player [YangZ] gets hole card ['C7', 'S9'], current stack 940
player [Ethan] gets hole card ['HJ', 'S6'], current stack 1802
player [HakulaPlayer] gets hole card ['DQ', 'C2'], current stack 1518
player [SichengZuo] gets hole card ['H6', 'SA'], current stack 940
player [KLChen2PokerPlayer] gets hole card ['CQ', 'C5'], current stack 1157
player [Jinkun] gets hole card ['D8', 'S7'], current stack 647
player [NitWinWin] gets hole card ['HA', 'CT'], current stack 980
Started the round 31
Street "preflop" started. (community card = [])
"HakulaPlayer" declared "fold:0"
"SichengZuo" declared "fold:0"
"KLChen2PokerPlayer" declared "raise:19"
"Jinkun" declared "fold:19"
"NitWinWin" declared "fold:0"
"YangZ" declared "fold:0"
"Ethan" declared "fold:0"
"['KLChen2PokerPlayer']" won the round 31 (stack = {'YangZ': 940, 'Ethan': 1802, 'HakulaPlayer': 1518, 'SichengZuo': 940, 'KLChen2PokerPlayer': 1172, 'Jinkun': 647, 'NitWinWin': 980, 'ZPlayer': 0})
player [YangZ] gets hole card ['HJ', 'H6'], current stack 940
player [Ethan] gets hole card ['H2', 'H9'], current stack 1797
player [HakulaPlayer] gets hole card ['DA', 'C6'], current stack 1508
player [SichengZuo] gets hole card ['CT', 'S4'], current stack 940
player [KLChen2PokerPlayer] gets hole card ['C9', 'S2'], current stack 1172
player [Jinkun] gets hole card ['DQ', 'D9'], current stack 647
player [NitWinWin] gets hole card ['D8', 'S5'], current stack 980
Started the round 32
Street "preflop" started. (community card = [])
"SichengZuo" declared "fold:0"
"KLChen2PokerPlayer" declared "call:10"
"Jinkun" declared "fold:10"
"NitWinWin" declared "fold:0"
"YangZ" declared "fold:0"
"Ethan" declared "fold:0"
"HakulaPlayer" declared "call:10"
Street "flop" started. (community card = ['DJ', 'C3', 'CK'])
"HakulaPlayer" declared "call:0"
"KLChen2PokerPlayer" declared "call:0"
Street "turn" started. (community card = ['DJ', 'C3', 'CK', 'SA'])
"HakulaPlayer" declared "raise:25"
"KLChen2PokerPlayer" declared "fold:0"
"['HakulaPlayer']" won the round 32 (stack = {'YangZ': 940, 'Ethan': 1797, 'HakulaPlayer': 1533, 'SichengZuo': 940, 'KLChen2PokerPlayer': 1162, 'Jinkun': 647, 'NitWinWin': 980, 'ZPlayer': 0})
player [YangZ] gets hole card ['H5', 'S6'], current stack 940
player [Ethan] gets hole card ['H4', 'D3'], current stack 1797
player [HakulaPlayer] gets hole card ['S8', 'S2'], current stack 1528
player [SichengZuo] gets hole card ['H2', 'H8'], current stack 930
player [KLChen2PokerPlayer] gets hole card ['HT', 'H9'], current stack 1162
player [Jinkun] gets hole card ['DJ', 'C9'], current stack 647
player [NitWinWin] gets hole card ['C2', 'D7'], current stack 980
Started the round 33
Street "preflop" started. (community card = [])
"KLChen2PokerPlayer" declared "raise:20"
"Jinkun" declared "fold:20"
"NitWinWin" declared "fold:0"
"YangZ" declared "fold:0"
"Ethan" declared "fold:0"
"HakulaPlayer" declared "raise:30"
"SichengZuo" declared "fold:0"
"KLChen2PokerPlayer" declared "fold:0"
"['HakulaPlayer']" won the round 33 (stack = {'YangZ': 940, 'Ethan': 1797, 'HakulaPlayer': 1563, 'SichengZuo': 930, 'KLChen2PokerPlayer': 1142, 'Jinkun': 647, 'NitWinWin': 980, 'ZPlayer': 0})
player [YangZ] gets hole card ['SQ', 'D6'], current stack 940
player [Ethan] gets hole card ['C4', 'S5'], current stack 1797
player [HakulaPlayer] gets hole card ['DT', 'H6'], current stack 1563
player [SichengZuo] gets hole card ['C8', 'S8'], current stack 925
player [KLChen2PokerPlayer] gets hole card ['HJ', 'HQ'], current stack 1132
player [Jinkun] gets hole card ['D7', 'D9'], current stack 647
player [NitWinWin] gets hole card ['CQ', 'H5'], current stack 980
Started the round 34
Street "preflop" started. (community card = [])
"Jinkun" declared "fold:10"
"NitWinWin" declared "fold:0"
"YangZ" declared "fold:0"
"Ethan" declared "fold:0"
"HakulaPlayer" declared "fold:0"
"SichengZuo" declared "fold:0"
"['KLChen2PokerPlayer']" won the round 34 (stack = {'YangZ': 940, 'Ethan': 1797, 'HakulaPlayer': 1563, 'SichengZuo': 925, 'KLChen2PokerPlayer': 1147, 'Jinkun': 647, 'NitWinWin': 980, 'ZPlayer': 0})
player [YangZ] gets hole card ['C8', 'D5'], current stack 940
player [Ethan] gets hole card ['S8', 'S3'], current stack 1797
player [HakulaPlayer] gets hole card ['CA', 'H7'], current stack 1563
player [SichengZuo] gets hole card ['SJ', 'D6'], current stack 925
player [KLChen2PokerPlayer] gets hole card ['DA', 'H6'], current stack 1142
player [Jinkun] gets hole card ['HK', 'H5'], current stack 637
player [NitWinWin] gets hole card ['S2', 'HA'], current stack 980
Started the round 35
Street "preflop" started. (community card = [])
"NitWinWin" declared "fold:0"
"YangZ" declared "fold:0"
"Ethan" declared "fold:0"
"HakulaPlayer" declared "call:10"
"SichengZuo" declared "fold:0"
"KLChen2PokerPlayer" declared "raise:15"
"Jinkun" declared "fold:15"
"HakulaPlayer" declared "call:15"
Street "flop" started. (community card = ['C5', 'C9', 'S5'])
"KLChen2PokerPlayer" declared "raise:16"
"HakulaPlayer" declared "call:16"
Street "turn" started. (community card = ['C5', 'C9', 'S5', 'H4'])
"KLChen2PokerPlayer" declared "call:0"
"HakulaPlayer" declared "raise:93"
"KLChen2PokerPlayer" declared "fold:0"
"['HakulaPlayer']" won the round 35 (stack = {'YangZ': 940, 'Ethan': 1797, 'HakulaPlayer': 1604, 'SichengZuo': 925, 'KLChen2PokerPlayer': 1116, 'Jinkun': 637, 'NitWinWin': 980, 'ZPlayer': 0})
player [YangZ] gets hole card ['SA', 'H7'], current stack 940
player [Ethan] gets hole card ['S7', 'C4'], current stack 1797
player [HakulaPlayer] gets hole card ['S9', 'C8'], current stack 1604
player [SichengZuo] gets hole card ['H8', 'HQ'], current stack 925
player [KLChen2PokerPlayer] gets hole card ['HT', 'H4'], current stack 1116
player [Jinkun] gets hole card ['D9', 'S6'], current stack 632
player [NitWinWin] gets hole card ['H5', 'CQ'], current stack 970
Started the round 36
Street "preflop" started. (community card = [])
"YangZ" declared "fold:0"
"Ethan" declared "fold:0"
"HakulaPlayer" declared "fold:0"
"SichengZuo" declared "fold:0"
"KLChen2PokerPlayer" declared "call:10"
"Jinkun" declared "call:10"
"NitWinWin" declared "fold:0"
Street "flop" started. (community card = ['S4', 'S8', 'CA'])
"Jinkun" declared "call:0"
"KLChen2PokerPlayer" declared "raise:11"
"Jinkun" declared "call:11"
Street "turn" started. (community card = ['S4', 'S8', 'CA', 'C9'])
"Jinkun" declared "call:0"
"KLChen2PokerPlayer" declared "call:0"
Street "river" started. (community card = ['S4', 'S8', 'CA', 'C9', 'D7'])
"Jinkun" declared "call:0"
"KLChen2PokerPlayer" declared "call:0"
"['Jinkun']" won the round 36 (stack = {'YangZ': 940, 'Ethan': 1797, 'HakulaPlayer': 1604, 'SichengZuo': 925, 'KLChen2PokerPlayer': 1095, 'Jinkun': 668, 'NitWinWin': 970, 'ZPlayer': 0})
player [YangZ] gets hole card ['C4', 'HQ'], current stack 930
player [Ethan] gets hole card ['S7', 'H2'], current stack 1797
player [HakulaPlayer] gets hole card ['D3', 'D7'], current stack 1604
player [SichengZuo] gets hole card ['CT', 'D4'], current stack 925
player [KLChen2PokerPlayer] gets hole card ['S4', 'D8'], current stack 1095
player [Jinkun] gets hole card ['DA', 'SK'], current stack 668
player [NitWinWin] gets hole card ['C2', 'S5'], current stack 965
Started the round 37
Street "preflop" started. (community card = [])
"Ethan" declared "fold:0"
"HakulaPlayer" declared "fold:0"
"SichengZuo" declared "fold:0"
"KLChen2PokerPlayer" declared "fold:0"
"Jinkun" declared "call:10"
"NitWinWin" declared "fold:0"
"YangZ" declared "fold:0"
"['Jinkun']" won the round 37 (stack = {'YangZ': 930, 'Ethan': 1797, 'HakulaPlayer': 1604, 'SichengZuo': 925, 'KLChen2PokerPlayer': 1095, 'Jinkun': 683, 'NitWinWin': 965, 'ZPlayer': 0})
player [YangZ] gets hole card ['SJ', 'DQ'], current stack 925
player [Ethan] gets hole card ['DT', 'H8'], current stack 1787
player [HakulaPlayer] gets hole card ['S6', 'CT'], current stack 1604
player [SichengZuo] gets hole card ['SQ', 'C2'], current stack 925
player [KLChen2PokerPlayer] gets hole card ['S8', 'CA'], current stack 1095
player [Jinkun] gets hole card ['SA', 'S9'], current stack 683
player [NitWinWin] gets hole card ['H7', 'H3'], current stack 965
Started the round 38
Street "preflop" started. (community card = [])
"HakulaPlayer" declared "fold:0"
"SichengZuo" declared "fold:0"
"KLChen2PokerPlayer" declared "raise:26"
"Jinkun" declared "fold:26"
"NitWinWin" declared "fold:0"
"YangZ" declared "fold:0"
"Ethan" declared "call:26"
Street "flop" started. (community card = ['C9', 'DK', 'D3'])
"Ethan" declared "call:0"
"KLChen2PokerPlayer" declared "call:0"
Street "turn" started. (community card = ['C9', 'DK', 'D3', 'CQ'])
"Ethan" declared "call:0"
"KLChen2PokerPlayer" declared "call:0"
Street "river" started. (community card = ['C9', 'DK', 'D3', 'CQ', 'H6'])
"Ethan" declared "call:0"
"KLChen2PokerPlayer" declared "call:0"
"['KLChen2PokerPlayer']" won the round 38 (stack = {'YangZ': 925, 'Ethan': 1771, 'HakulaPlayer': 1604, 'SichengZuo': 925, 'KLChen2PokerPlayer': 1126, 'Jinkun': 683, 'NitWinWin': 965, 'ZPlayer': 0})
player [YangZ] gets hole card ['C4', 'SJ'], current stack 925
player [Ethan] gets hole card ['CA', 'C3'], current stack 1766
player [HakulaPlayer] gets hole card ['D2', 'S6'], current stack 1594
player [SichengZuo] gets hole card ['H4', 'C8'], current stack 925
player [KLChen2PokerPlayer] gets hole card ['C7', 'D7'], current stack 1126
player [Jinkun] gets hole card ['DQ', 'SK'], current stack 683
player [NitWinWin] gets hole card ['DJ', 'H6'], current stack 965
Started the round 39
Street "preflop" started. (community card = [])
"SichengZuo" declared "fold:0"
"KLChen2PokerPlayer" declared "raise:17"
"Jinkun" declared "fold:17"
"NitWinWin" declared "fold:0"
"YangZ" declared "fold:0"
"Ethan" declared "call:17"
"HakulaPlayer" declared "fold:0"
Street "flop" started. (community card = ['HT', 'CJ', 'H3'])
"Ethan" declared "call:0"
"KLChen2PokerPlayer" declared "raise:12"
"Ethan" declared "call:12"
Street "turn" started. (community card = ['HT', 'CJ', 'H3', 'D4'])
"Ethan" declared "call:0"
"KLChen2PokerPlayer" declared "raise:112"
"Ethan" declared "call:112"
Street "river" started. (community card = ['HT', 'CJ', 'H3', 'D4', 'S2'])
"Ethan" declared "call:0"
"KLChen2PokerPlayer" declared "call:0"
"['KLChen2PokerPlayer']" won the round 39 (stack = {'YangZ': 925, 'Ethan': 1630, 'HakulaPlayer': 1594, 'SichengZuo': 925, 'KLChen2PokerPlayer': 1277, 'Jinkun': 683, 'NitWinWin': 965, 'ZPlayer': 0})
player [YangZ] gets hole card ['DK', 'CK'], current stack 925
player [Ethan] gets hole card ['C5', 'SJ'], current stack 1630
player [HakulaPlayer] gets hole card ['D4', 'S7'], current stack 1589
player [SichengZuo] gets hole card ['S3', 'D9'], current stack 915
player [KLChen2PokerPlayer] gets hole card ['S9', 'S2'], current stack 1277
player [Jinkun] gets hole card ['H5', 'SK'], current stack 683
player [NitWinWin] gets hole card ['H4', 'C2'], current stack 965
Started the round 40
Street "preflop" started. (community card = [])
"KLChen2PokerPlayer" declared "call:10"
"Jinkun" declared "fold:10"
"NitWinWin" declared "fold:0"
"YangZ" declared "fold:0"
"Ethan" declared "fold:0"
"HakulaPlayer" declared "call:10"
"SichengZuo" declared "fold:0"
Street "flop" started. (community card = ['DT', 'C8', 'D2'])
"HakulaPlayer" declared "call:0"
"KLChen2PokerPlayer" declared "raise:13"
"HakulaPlayer" declared "fold:0"
"['KLChen2PokerPlayer']" won the round 40 (stack = {'YangZ': 925, 'Ethan': 1630, 'HakulaPlayer': 1584, 'SichengZuo': 915, 'KLChen2PokerPlayer': 1297, 'Jinkun': 683, 'NitWinWin': 965, 'ZPlayer': 0})
player [YangZ] gets hole card ['C9', 'H4'], current stack 925
player [Ethan] gets hole card ['SA', 'D5'], current stack 1630
player [HakulaPlayer] gets hole card ['HT', 'S6'], current stack 1584
player [SichengZuo] gets hole card ['DJ', 'CA'], current stack 910
player [KLChen2PokerPlayer] gets hole card ['DA', 'SK'], current stack 1287
player [Jinkun] gets hole card ['HJ', 'DT'], current stack 683
player [NitWinWin] gets hole card ['DQ', 'ST'], current stack 965
Started the round 41
Street "preflop" started. (community card = [])
"Jinkun" declared "fold:10"
"NitWinWin" declared "fold:0"
"YangZ" declared "fold:0"
"Ethan" declared "fold:0"
"HakulaPlayer" declared "fold:0"
"SichengZuo" declared "fold:0"
"['KLChen2PokerPlayer']" won the round 41 (stack = {'YangZ': 925, 'Ethan': 1630, 'HakulaPlayer': 1584, 'SichengZuo': 910, 'KLChen2PokerPlayer': 1302, 'Jinkun': 683, 'NitWinWin': 965, 'ZPlayer': 0})
player [YangZ] gets hole card ['H2', 'CT'], current stack 925
player [Ethan] gets hole card ['D7', 'D9'], current stack 1630
player [HakulaPlayer] gets hole card ['D2', 'C7'], current stack 1584
player [SichengZuo] gets hole card ['DJ', 'ST'], current stack 910
player [KLChen2PokerPlayer] gets hole card ['D5', 'SJ'], current stack 1297
player [Jinkun] gets hole card ['D8', 'HT'], current stack 673
player [NitWinWin] gets hole card ['C8', 'CA'], current stack 965
Started the round 42
Street "preflop" started. (community card = [])
"NitWinWin" declared "fold:0"
"YangZ" declared "fold:0"
"Ethan" declared "fold:0"
"HakulaPlayer" declared "fold:0"
"SichengZuo" declared "fold:0"
"KLChen2PokerPlayer" declared "call:10"
"Jinkun" declared "call:10"
Street "flop" started. (community card = ['H7', 'SK', 'D6'])
"KLChen2PokerPlayer" declared "call:0"
"Jinkun" declared "call:0"
Street "turn" started. (community card = ['H7', 'SK', 'D6', 'CK'])
"KLChen2PokerPlayer" declared "call:0"
"Jinkun" declared "call:0"
Street "river" started. (community card = ['H7', 'SK', 'D6', 'CK', 'HA'])
"KLChen2PokerPlayer" declared "call:0"
"Jinkun" declared "call:0"
"['KLChen2PokerPlayer']" won the round 42 (stack = {'YangZ': 925, 'Ethan': 1630, 'HakulaPlayer': 1584, 'SichengZuo': 910, 'KLChen2PokerPlayer': 1312, 'Jinkun': 673, 'NitWinWin': 965, 'ZPlayer': 0})
player [YangZ] gets hole card ['C5', 'H2'], current stack 925
player [Ethan] gets hole card ['DJ', 'SK'], current stack 1630
player [HakulaPlayer] gets hole card ['S8', 'C2'], current stack 1584
player [SichengZuo] gets hole card ['H9', 'S6'], current stack 910
player [KLChen2PokerPlayer] gets hole card ['S7', 'D2'], current stack 1312
player [Jinkun] gets hole card ['C9', 'ST'], current stack 668
player [NitWinWin] gets hole card ['H6', 'CJ'], current stack 955
Started the round 43
Street "preflop" started. (community card = [])
"YangZ" declared "fold:0"
"Ethan" declared "raise:244"
"HakulaPlayer" declared "fold:0"
"SichengZuo" declared "fold:0"
"KLChen2PokerPlayer" declared "fold:0"
"Jinkun" declared "fold:244"
"NitWinWin" declared "fold:0"
"['Ethan']" won the round 43 (stack = {'YangZ': 925, 'Ethan': 1645, 'HakulaPlayer': 1584, 'SichengZuo': 910, 'KLChen2PokerPlayer': 1312, 'Jinkun': 668, 'NitWinWin': 955, 'ZPlayer': 0})
player [YangZ] gets hole card ['CT', 'D4'], current stack 915
player [Ethan] gets hole card ['ST', 'HQ'], current stack 1645
player [HakulaPlayer] gets hole card ['C6', 'C4'], current stack 1584
player [SichengZuo] gets hole card ['S3', 'C2'], current stack 910
player [KLChen2PokerPlayer] gets hole card ['S5', 'S2'], current stack 1312
player [Jinkun] gets hole card ['D7', 'S4'], current stack 668
player [NitWinWin] gets hole card ['CQ', 'C3'], current stack 950
Started the round 44
Street "preflop" started. (community card = [])
"Ethan" declared "fold:0"
"HakulaPlayer" declared "fold:0"
"SichengZuo" declared "fold:0"
"KLChen2PokerPlayer" declared "fold:0"
"Jinkun" declared "call:10"
"NitWinWin" declared "fold:0"
"YangZ" declared "fold:0"
"['Jinkun']" won the round 44 (stack = {'YangZ': 915, 'Ethan': 1645, 'HakulaPlayer': 1584, 'SichengZuo': 910, 'KLChen2PokerPlayer': 1312, 'Jinkun': 683, 'NitWinWin': 950, 'ZPlayer': 0})
player [YangZ] gets hole card ['S8', 'DT'], current stack 910
player [Ethan] gets hole card ['DJ', 'C7'], current stack 1635
player [HakulaPlayer] gets hole card ['S6', 'H3'], current stack 1584
player [SichengZuo] gets hole card ['D9', 'C8'], current stack 910
player [KLChen2PokerPlayer] gets hole card ['CT', 'H2'], current stack 1312
player [Jinkun] gets hole card ['CA', 'DQ'], current stack 683
player [NitWinWin] gets hole card ['S4', 'HJ'], current stack 950
Started the round 45
Street "preflop" started. (community card = [])
"HakulaPlayer" declared "fold:0"
"SichengZuo" declared "fold:0"
"KLChen2PokerPlayer" declared "raise:19"
"Jinkun" declared "fold:19"
"NitWinWin" declared "fold:0"
"YangZ" declared "fold:0"
"Ethan" declared "fold:0"
"['KLChen2PokerPlayer']" won the round 45 (stack = {'YangZ': 910, 'Ethan': 1635, 'HakulaPlayer': 1584, 'SichengZuo': 910, 'KLChen2PokerPlayer': 1327, 'Jinkun': 683, 'NitWinWin': 950, 'ZPlayer': 0})
player [YangZ] gets hole card ['D2', 'D4'], current stack 910
player [Ethan] gets hole card ['CA', 'S6'], current stack 1630
player [HakulaPlayer] gets hole card ['D5', 'SQ'], current stack 1574
player [SichengZuo] gets hole card ['C7', 'SJ'], current stack 910
player [KLChen2PokerPlayer] gets hole card ['H2', 'DJ'], current stack 1327
player [Jinkun] gets hole card ['S5', 'CQ'], current stack 683
player [NitWinWin] gets hole card ['S7', 'C5'], current stack 950
Started the round 46
Street "preflop" started. (community card = [])
"SichengZuo" declared "fold:0"
"KLChen2PokerPlayer" declared "raise:16"
"Jinkun" declared "fold:16"
"NitWinWin" declared "fold:0"
"YangZ" declared "fold:0"
"Ethan" declared "call:16"
"HakulaPlayer" declared "call:16"
Street "flop" started. (community card = ['D7', 'DA', 'S3'])
"Ethan" declared "call:0"
"HakulaPlayer" declared "call:0"
"KLChen2PokerPlayer" declared "call:0"
Street "turn" started. (community card = ['D7', 'DA', 'S3', 'HQ'])
"Ethan" declared "call:0"
"HakulaPlayer" declared "call:0"
"KLChen2PokerPlayer" declared "call:0"
Street "river" started. (community card = ['D7', 'DA', 'S3', 'HQ', 'DT'])
"Ethan" declared "call:0"
"HakulaPlayer" declared "call:0"
"KLChen2PokerPlayer" declared "call:0"
"['Ethan']" won the round 46 (stack = {'YangZ': 910, 'Ethan': 1667, 'HakulaPlayer': 1568, 'SichengZuo': 910, 'KLChen2PokerPlayer': 1311, 'Jinkun': 683, 'NitWinWin': 950, 'ZPlayer': 0})
player [YangZ] gets hole card ['S3', 'DQ'], current stack 910
player [Ethan] gets hole card ['D7', 'HK'], current stack 1667
player [HakulaPlayer] gets hole card ['D8', 'H9'], current stack 1563
player [SichengZuo] gets hole card ['HA', 'HT'], current stack 900
player [KLChen2PokerPlayer] gets hole card ['D5', 'D4'], current stack 1311
player [Jinkun] gets hole card ['CK', 'C5'], current stack 683
player [NitWinWin] gets hole card ['D6', 'HJ'], current stack 950
Started the round 47
Street "preflop" started. (community card = [])
"KLChen2PokerPlayer" declared "call:10"
"Jinkun" declared "fold:10"
"NitWinWin" declared "fold:0"
"YangZ" declared "fold:0"
"Ethan" declared "fold:0"
"HakulaPlayer" declared "call:10"
"SichengZuo" declared "fold:0"
Street "flop" started. (community card = ['C3', 'C6', 'HQ'])
"HakulaPlayer" declared "call:0"
"KLChen2PokerPlayer" declared "call:0"
Street "turn" started. (community card = ['C3', 'C6', 'HQ', 'S4'])
"HakulaPlayer" declared "call:0"
"KLChen2PokerPlayer" declared "raise:114"
"HakulaPlayer" declared "fold:0"
"['KLChen2PokerPlayer']" won the round 47 (stack = {'YangZ': 910, 'Ethan': 1667, 'HakulaPlayer': 1558, 'SichengZuo': 900, 'KLChen2PokerPlayer': 1331, 'Jinkun': 683, 'NitWinWin': 950, 'ZPlayer': 0})
player [YangZ] gets hole card ['D2', 'DT'], current stack 910
player [Ethan] gets hole card ['DJ', 'D9'], current stack 1667
player [HakulaPlayer] gets hole card ['S8', 'CJ'], current stack 1558
player [SichengZuo] gets hole card ['CT', 'H2'], current stack 895
player [KLChen2PokerPlayer] gets hole card ['H8', 'H9'], current stack 1321
player [Jinkun] gets hole card ['S7', 'CQ'], current stack 683
player [NitWinWin] gets hole card ['C4', 'S4'], current stack 950
Started the round 48
Street "preflop" started. (community card = [])
"Jinkun" declared "fold:10"
"NitWinWin" declared "fold:0"
"YangZ" declared "fold:0"
"Ethan" declared "fold:0"
"HakulaPlayer" declared "call:10"
"SichengZuo" declared "fold:0"
"KLChen2PokerPlayer" declared "call:10"
Street "flop" started. (community card = ['D8', 'DA', 'HT'])
"KLChen2PokerPlayer" declared "raise:28"
"HakulaPlayer" declared "call:28"
Street "turn" started. (community card = ['D8', 'DA', 'HT', 'S6'])
"KLChen2PokerPlayer" declared "raise:144"
"HakulaPlayer" declared "fold:0"
"['KLChen2PokerPlayer']" won the round 48 (stack = {'YangZ': 910, 'Ethan': 1667, 'HakulaPlayer': 1520, 'SichengZuo': 895, 'KLChen2PokerPlayer': 1374, 'Jinkun': 683, 'NitWinWin': 950, 'ZPlayer': 0})
player [YangZ] gets hole card ['SK', 'HA'], current stack 910
player [Ethan] gets hole card ['HK', 'H2'], current stack 1667
player [HakulaPlayer] gets hole card ['C7', 'DQ'], current stack 1520
player [SichengZuo] gets hole card ['C8', 'S3'], current stack 895
player [KLChen2PokerPlayer] gets hole card ['CK', 'D3'], current stack 1369
player [Jinkun] gets hole card ['C4', 'SA'], current stack 673
player [NitWinWin] gets hole card ['S7', 'H3'], current stack 950
Started the round 49
Street "preflop" started. (community card = [])
"NitWinWin" declared "fold:0"
"YangZ" declared "fold:0"
"Ethan" declared "fold:0"
"HakulaPlayer" declared "fold:0"
"SichengZuo" declared "fold:0"
"KLChen2PokerPlayer" declared "call:10"
"Jinkun" declared "call:10"
Street "flop" started. (community card = ['S5', 'C3', 'HQ'])
"KLChen2PokerPlayer" declared "raise:11"
"Jinkun" declared "call:11"
Street "turn" started. (community card = ['S5', 'C3', 'HQ', 'C6'])
"KLChen2PokerPlayer" declared "call:0"
"Jinkun" declared "call:0"
Street "river" started. (community card = ['S5', 'C3', 'HQ', 'C6', 'D6'])
"KLChen2PokerPlayer" declared "call:0"
"Jinkun" declared "call:0"
"['KLChen2PokerPlayer']" won the round 49 (stack = {'YangZ': 910, 'Ethan': 1667, 'HakulaPlayer': 1520, 'SichengZuo': 895, 'KLChen2PokerPlayer': 1395, 'Jinkun': 662, 'NitWinWin': 950, 'ZPlayer': 0})
player [YangZ] gets hole card ['C8', 'HQ'], current stack 910
player [Ethan] gets hole card ['CA', 'DQ'], current stack 1667
player [HakulaPlayer] gets hole card ['CJ', 'CT'], current stack 1520
player [SichengZuo] gets hole card ['S3', 'H5'], current stack 895
player [KLChen2PokerPlayer] gets hole card ['D3', 'SA'], current stack 1395
player [Jinkun] gets hole card ['HK', 'H4'], current stack 657
player [NitWinWin] gets hole card ['H8', 'C6'], current stack 940
Started the round 50
Street "preflop" started. (community card = [])
"YangZ" declared "fold:0"
"Ethan" declared "raise:250"
"HakulaPlayer" declared "fold:0"
"SichengZuo" declared "fold:0"
"KLChen2PokerPlayer" declared "fold:0"
"Jinkun" declared "fold:250"
"NitWinWin" declared "fold:0"
"['Ethan']" won the round 50 (stack = {'YangZ': 910, 'Ethan': 1682, 'HakulaPlayer': 1520, 'SichengZuo': 895, 'KLChen2PokerPlayer': 1395, 'Jinkun': 657, 'NitWinWin': 940, 'ZPlayer': 0})

Game Results:
------------------------------------------------------------
Game 1:
Winner: Ethan (stack: 1682)
All players' stacks:
  YangZ: 910
  Ethan: 1682
  HakulaPlayer: 1520
  SichengZuo: 895
  KLChen2PokerPlayer: 1395
  Jinkun: 657
  NitWinWin: 940
  ZPlayer: 0
------------------------------------------------------------
