player [YangZ] gets hole card ['S3', 'S8'], current stack 1000
player [Ethan] gets hole card ['C2', 'HA'], current stack 995
player [HakulaPlayer] gets hole card ['D5', 'D7'], current stack 990
player [SichengZuo] gets hole card ['H8', 'H3'], current stack 1000
player [KLChen2PokerPlayer] gets hole card ['S5', 'HQ'], current stack 1000
player [Jinkun] gets hole card ['CQ', 'H9'], current stack 1000
player [NitWinWin] gets hole card ['S2', 'SK'], current stack 1000
player [ZPlayer] gets hole card ['CT', 'C8'], current stack 1000
Started the round 1
Street "preflop" started. (community card = [])
"SichengZuo" declared "fold:0"
"KLChen2PokerPlayer" declared "call:10"
"Jinkun" declared "fold:10"
"NitWinWin" declared "fold:0"
"ZPlayer" declared "raise:15"
"YangZ" declared "fold:0"
"Ethan" declared "fold:0"
"HakulaPlayer" declared "call:15"
"KLChen2PokerPlayer" declared "fold:0"
Street "flop" started. (community card = ['ST', 'C6', 'D4'])
"HakulaPlayer" declared "call:0"
"ZPlayer" declared "raise:10"
"HakulaPlayer" declared "call:10"
Street "turn" started. (community card = ['ST', 'C6', 'D4', 'DQ'])
"HakulaPlayer" declared "call:0"
"ZPlayer" declared "raise:10"
"HakulaPlayer" declared "call:10"
Street "river" started. (community card = ['ST', 'C6', 'D4', 'DQ', 'S6'])
"HakulaPlayer" declared "call:0"
"ZPlayer" declared "call:0"
"['ZPlayer']" won the round 1 (stack = {'YangZ': 1000, 'Ethan': 995, 'HakulaPlayer': 965, 'SichengZuo': 1000, 'KLChen2PokerPlayer': 990, 'Jinkun': 1000, 'NitWinWin': 1000, 'ZPlayer': 1050})
player [YangZ] gets hole card ['S4', 'CJ'], current stack 1000
player [Ethan] gets hole card ['ST', 'DK'], current stack 995
player [HakulaPlayer] gets hole card ['SK', 'SJ'], current stack 960
player [SichengZuo] gets hole card ['D9', 'S2'], current stack 990
player [KLChen2PokerPlayer] gets hole card ['D3', 'DQ'], current stack 990
player [Jinkun] gets hole card ['D4', 'C8'], current stack 1000
player [NitWinWin] gets hole card ['HK', 'DA'], current stack 1000
player [ZPlayer] gets hole card ['CT', 'D5'], current stack 1050
Started the round 2
Street "preflop" started. (community card = [])
"KLChen2PokerPlayer" declared "raise:17"
"Jinkun" declared "fold:17"
"NitWinWin" declared "fold:0"
"ZPlayer" declared "call:17"
"YangZ" declared "fold:0"
"Ethan" declared "fold:0"
"HakulaPlayer" declared "call:17"
"SichengZuo" declared "fold:0"
Street "flop" started. (community card = ['C7', 'HQ', 'H6'])
"HakulaPlayer" declared "call:0"
"KLChen2PokerPlayer" declared "raise:39"
"ZPlayer" declared "fold:0"
"HakulaPlayer" declared "fold:0"
"['KLChen2PokerPlayer']" won the round 2 (stack = {'YangZ': 1000, 'Ethan': 995, 'HakulaPlayer': 948, 'SichengZuo': 990, 'KLChen2PokerPlayer': 1034, 'Jinkun': 1000, 'NitWinWin': 1000, 'ZPlayer': 1033})
player [YangZ] gets hole card ['S2', 'C7'], current stack 1000
player [Ethan] gets hole card ['H4', 'S7'], current stack 995
player [HakulaPlayer] gets hole card ['C6', 'SK'], current stack 948
player [SichengZuo] gets hole card ['HT', 'S5'], current stack 985
player [KLChen2PokerPlayer] gets hole card ['DQ', 'DJ'], current stack 1024
player [Jinkun] gets hole card ['S9', 'DK'], current stack 1000
player [NitWinWin] gets hole card ['S4', 'HQ'], current stack 1000
player [ZPlayer] gets hole card ['HK', 'SA'], current stack 1033
Started the round 3
Street "preflop" started. (community card = [])
"Jinkun" declared "fold:10"
"NitWinWin" declared "fold:0"
"ZPlayer" declared "raise:15"
"YangZ" declared "fold:0"
"Ethan" declared "fold:0"
"HakulaPlayer" declared "fold:0"
"SichengZuo" declared "fold:0"
"KLChen2PokerPlayer" declared "raise:20"
"ZPlayer" declared "call:20"
Street "flop" started. (community card = ['C3', 'ST', 'D6'])
"KLChen2PokerPlayer" declared "call:0"
"ZPlayer" declared "call:0"
Street "turn" started. (community card = ['C3', 'ST', 'D6', 'D2'])
"KLChen2PokerPlayer" declared "call:0"
"ZPlayer" declared "call:0"
Street "river" started. (community card = ['C3', 'ST', 'D6', 'D2', 'D3'])
"KLChen2PokerPlayer" declared "raise:294"
"ZPlayer" declared "fold:0"
"['KLChen2PokerPlayer']" won the round 3 (stack = {'YangZ': 1000, 'Ethan': 995, 'HakulaPlayer': 948, 'SichengZuo': 985, 'KLChen2PokerPlayer': 1059, 'Jinkun': 1000, 'NitWinWin': 1000, 'ZPlayer': 1013})
player [YangZ] gets hole card ['HA', 'H3'], current stack 1000
player [Ethan] gets hole card ['HJ', 'S9'], current stack 995
player [HakulaPlayer] gets hole card ['C2', 'C5'], current stack 948
player [SichengZuo] gets hole card ['CQ', 'H9'], current stack 985
player [KLChen2PokerPlayer] gets hole card ['D9', 'S2'], current stack 1054
player [Jinkun] gets hole card ['DA', 'D3'], current stack 990
player [NitWinWin] gets hole card ['CJ', 'C7'], current stack 1000
player [ZPlayer] gets hole card ['C4', 'HQ'], current stack 1013
Started the round 4
Street "preflop" started. (community card = [])
"NitWinWin" declared "fold:0"
"ZPlayer" declared "call:10"
"YangZ" declared "fold:0"
"Ethan" declared "fold:0"
"HakulaPlayer" declared "fold:0"
"SichengZuo" declared "fold:0"
"KLChen2PokerPlayer" declared "raise:15"
"Jinkun" declared "fold:15"
"ZPlayer" declared "call:15"
Street "flop" started. (community card = ['S7', 'HK', 'D2'])
"KLChen2PokerPlayer" declared "raise:19"
"ZPlayer" declared "fold:0"
"['KLChen2PokerPlayer']" won the round 4 (stack = {'YangZ': 1000, 'Ethan': 995, 'HakulaPlayer': 948, 'SichengZuo': 985, 'KLChen2PokerPlayer': 1084, 'Jinkun': 990, 'NitWinWin': 1000, 'ZPlayer': 998})
player [YangZ] gets hole card ['DT', 'H5'], current stack 1000
player [Ethan] gets hole card ['DJ', 'HJ'], current stack 995
player [HakulaPlayer] gets hole card ['DA', 'CQ'], current stack 948
player [SichengZuo] gets hole card ['HK', 'D8'], current stack 985
player [KLChen2PokerPlayer] gets hole card ['S8', 'CA'], current stack 1084
player [Jinkun] gets hole card ['H3', 'C9'], current stack 985
player [NitWinWin] gets hole card ['H6', 'S5'], current stack 990
player [ZPlayer] gets hole card ['D2', 'HA'], current stack 998
Started the round 5
Street "preflop" started. (community card = [])
"ZPlayer" declared "call:10"
"YangZ" declared "fold:0"
"Ethan" declared "raise:149"
"HakulaPlayer" declared "fold:0"
"SichengZuo" declared "fold:0"
"KLChen2PokerPlayer" declared "fold:0"
"Jinkun" declared "fold:149"
"NitWinWin" declared "fold:0"
"ZPlayer" declared "call:149"
Street "flop" started. (community card = ['C6', 'C7', 'SK'])
"ZPlayer" declared "call:0"
"Ethan" declared "call:0"
Street "turn" started. (community card = ['C6', 'C7', 'SK', 'C3'])
"ZPlayer" declared "call:0"
"Ethan" declared "call:0"
Street "river" started. (community card = ['C6', 'C7', 'SK', 'C3', 'D6'])
"ZPlayer" declared "call:0"
"Ethan" declared "raise:313"
"ZPlayer" declared "fold:0"
"['Ethan']" won the round 5 (stack = {'YangZ': 1000, 'Ethan': 1159, 'HakulaPlayer': 948, 'SichengZuo': 985, 'KLChen2PokerPlayer': 1084, 'Jinkun': 985, 'NitWinWin': 990, 'ZPlayer': 849})
player [YangZ] gets hole card ['DT', 'S2'], current stack 1000
player [Ethan] gets hole card ['C5', 'SA'], current stack 1159
player [HakulaPlayer] gets hole card ['CJ', 'DQ'], current stack 948
player [SichengZuo] gets hole card ['S4', 'D5'], current stack 985
player [KLChen2PokerPlayer] gets hole card ['SK', 'H3'], current stack 1084
player [Jinkun] gets hole card ['SJ', 'SQ'], current stack 985
player [NitWinWin] gets hole card ['HK', 'S9'], current stack 985
player [ZPlayer] gets hole card ['CT', 'C3'], current stack 839
Started the round 6
Street "preflop" started. (community card = [])
"YangZ" declared "fold:0"
"Ethan" declared "fold:0"
"HakulaPlayer" declared "call:10"
"SichengZuo" declared "fold:0"
"KLChen2PokerPlayer" declared "call:10"
"Jinkun" declared "call:10"
"NitWinWin" declared "fold:0"
"ZPlayer" declared "call:10"
Street "flop" started. (community card = ['H8', 'DJ', 'HA'])
"ZPlayer" declared "call:0"
"HakulaPlayer" declared "call:0"
"KLChen2PokerPlayer" declared "call:0"
"Jinkun" declared "call:0"
Street "turn" started. (community card = ['H8', 'DJ', 'HA', 'D9'])
"ZPlayer" declared "call:0"
"HakulaPlayer" declared "call:0"
"KLChen2PokerPlayer" declared "call:0"
"Jinkun" declared "call:0"
Street "river" started. (community card = ['H8', 'DJ', 'HA', 'D9', 'D4'])
"ZPlayer" declared "call:0"
"HakulaPlayer" declared "call:0"
"KLChen2PokerPlayer" declared "call:0"
"Jinkun" declared "call:0"
"['HakulaPlayer', 'Jinkun']" won the round 6 (stack = {'YangZ': 1000, 'Ethan': 1159, 'HakulaPlayer': 960, 'SichengZuo': 985, 'KLChen2PokerPlayer': 1074, 'Jinkun': 997, 'NitWinWin': 985, 'ZPlayer': 839})
player [YangZ] gets hole card ['S5', 'H6'], current stack 990
player [Ethan] gets hole card ['CK', 'H4'], current stack 1159
player [HakulaPlayer] gets hole card ['C8', 'C2'], current stack 960
player [SichengZuo] gets hole card ['D4', 'C9'], current stack 985
player [KLChen2PokerPlayer] gets hole card ['C3', 'D3'], current stack 1074
player [Jinkun] gets hole card ['H3', 'S6'], current stack 997
player [NitWinWin] gets hole card ['HT', 'D8'], current stack 985
player [ZPlayer] gets hole card ['SK', 'SA'], current stack 834
Started the round 7
Street "preflop" started. (community card = [])
"Ethan" declared "fold:0"
"HakulaPlayer" declared "fold:0"
"SichengZuo" declared "fold:0"
"KLChen2PokerPlayer" declared "fold:0"
"Jinkun" declared "call:10"
"NitWinWin" declared "fold:0"
"ZPlayer" declared "raise:15"
"YangZ" declared "fold:0"
"Jinkun" declared "fold:15"
"['ZPlayer']" won the round 7 (stack = {'YangZ': 990, 'Ethan': 1159, 'HakulaPlayer': 960, 'SichengZuo': 985, 'KLChen2PokerPlayer': 1074, 'Jinkun': 987, 'NitWinWin': 985, 'ZPlayer': 859})
player [YangZ] gets hole card ['D4', 'D6'], current stack 985
player [Ethan] gets hole card ['C4', 'D9'], current stack 1149
player [HakulaPlayer] gets hole card ['HQ', 'C6'], current stack 960
player [SichengZuo] gets hole card ['H9', 'H3'], current stack 985
player [KLChen2PokerPlayer] gets hole card ['D2', 'H8'], current stack 1074
player [Jinkun] gets hole card ['D8', 'ST'], current stack 987
player [NitWinWin] gets hole card ['S7', 'C3'], current stack 985
player [ZPlayer] gets hole card ['SK', 'HJ'], current stack 859
Started the round 8
Street "preflop" started. (community card = [])
"HakulaPlayer" declared "fold:0"
"SichengZuo" declared "fold:0"
"KLChen2PokerPlayer" declared "fold:0"
"Jinkun" declared "fold:10"
"NitWinWin" declared "fold:0"
"ZPlayer" declared "raise:15"
"YangZ" declared "fold:0"
"Ethan" declared "fold:0"
"['ZPlayer']" won the round 8 (stack = {'YangZ': 985, 'Ethan': 1149, 'HakulaPlayer': 960, 'SichengZuo': 985, 'KLChen2PokerPlayer': 1074, 'Jinkun': 987, 'NitWinWin': 985, 'ZPlayer': 874})
player [YangZ] gets hole card ['SA', 'H3'], current stack 985
player [Ethan] gets hole card ['H5', 'HQ'], current stack 1144
player [HakulaPlayer] gets hole card ['S4', 'C9'], current stack 950
player [SichengZuo] gets hole card ['HJ', 'SK'], current stack 985
player [KLChen2PokerPlayer] gets hole card ['ST', 'SQ'], current stack 1074
player [Jinkun] gets hole card ['S8', 'S6'], current stack 987
player [NitWinWin] gets hole card ['S3', 'H7'], current stack 985
player [ZPlayer] gets hole card ['CA', 'C7'], current stack 874
Started the round 9
Street "preflop" started. (community card = [])
"SichengZuo" declared "fold:0"
"KLChen2PokerPlayer" declared "raise:28"
"Jinkun" declared "fold:28"
"NitWinWin" declared "fold:0"
"ZPlayer" declared "fold:0"
"YangZ" declared "fold:0"
"Ethan" declared "fold:0"
"HakulaPlayer" declared "fold:0"
"['KLChen2PokerPlayer']" won the round 9 (stack = {'YangZ': 985, 'Ethan': 1144, 'HakulaPlayer': 950, 'SichengZuo': 985, 'KLChen2PokerPlayer': 1089, 'Jinkun': 987, 'NitWinWin': 985, 'ZPlayer': 874})
player [YangZ] gets hole card ['S9', 'D4'], current stack 985
player [Ethan] gets hole card ['S5', 'H5'], current stack 1144
player [HakulaPlayer] gets hole card ['H6', 'CQ'], current stack 945
player [SichengZuo] gets hole card ['DA', 'SJ'], current stack 975
player [KLChen2PokerPlayer] gets hole card ['D9', 'D6'], current stack 1089
player [Jinkun] gets hole card ['D5', 'D2'], current stack 987
player [NitWinWin] gets hole card ['C6', 'S7'], current stack 985
player [ZPlayer] gets hole card ['C3', 'H7'], current stack 874
Started the round 10
Street "preflop" started. (community card = [])
"KLChen2PokerPlayer" declared "raise:15"
"Jinkun" declared "fold:15"
"NitWinWin" declared "fold:0"
"ZPlayer" declared "call:15"
"YangZ" declared "fold:0"
"Ethan" declared "fold:0"
"HakulaPlayer" declared "call:15"
"SichengZuo" declared "fold:0"
Street "flop" started. (community card = ['SK', 'SQ', 'CA'])
"HakulaPlayer" declared "call:0"
"KLChen2PokerPlayer" declared "call:0"
"ZPlayer" declared "call:0"
Street "turn" started. (community card = ['SK', 'SQ', 'CA', 'HJ'])
"HakulaPlayer" declared "call:0"
"KLChen2PokerPlayer" declared "call:0"
"ZPlayer" declared "call:0"
Street "river" started. (community card = ['SK', 'SQ', 'CA', 'HJ', 'HA'])
"HakulaPlayer" declared "call:0"
"KLChen2PokerPlayer" declared "call:0"
"ZPlayer" declared "call:0"
"['HakulaPlayer']" won the round 10 (stack = {'YangZ': 985, 'Ethan': 1144, 'HakulaPlayer': 990, 'SichengZuo': 975, 'KLChen2PokerPlayer': 1074, 'Jinkun': 987, 'NitWinWin': 985, 'ZPlayer': 859})
player [YangZ] gets hole card ['H4', 'CJ'], current stack 985
player [Ethan] gets hole card ['HK', 'C4'], current stack 1144
player [HakulaPlayer] gets hole card ['HT', 'DT'], current stack 990
player [SichengZuo] gets hole card ['H3', 'D2'], current stack 970
player [KLChen2PokerPlayer] gets hole card ['CA', 'SJ'], current stack 1064
player [Jinkun] gets hole card ['D6', 'HA'], current stack 987
player [NitWinWin] gets hole card ['SK', 'HJ'], current stack 985
player [ZPlayer] gets hole card ['SA', 'S9'], current stack 859
Started the round 11
Street "preflop" started. (community card = [])
"Jinkun" declared "fold:10"
"NitWinWin" declared "fold:0"
"ZPlayer" declared "raise:15"
"YangZ" declared "fold:0"
"Ethan" declared "fold:0"
"HakulaPlayer" declared "raise:40"
"SichengZuo" declared "fold:0"
"KLChen2PokerPlayer" declared "fold:0"
"ZPlayer" declared "fold:0"
"['HakulaPlayer']" won the round 11 (stack = {'YangZ': 985, 'Ethan': 1144, 'HakulaPlayer': 1020, 'SichengZuo': 970, 'KLChen2PokerPlayer': 1064, 'Jinkun': 987, 'NitWinWin': 985, 'ZPlayer': 844})
player [YangZ] gets hole card ['S5', 'S7'], current stack 985
player [Ethan] gets hole card ['CT', 'S9'], current stack 1144
player [HakulaPlayer] gets hole card ['D6', 'H9'], current stack 1020
player [SichengZuo] gets hole card ['HT', 'C9'], current stack 970
player [KLChen2PokerPlayer] gets hole card ['S4', 'S3'], current stack 1059
player [Jinkun] gets hole card ['HJ', 'C2'], current stack 977
player [NitWinWin] gets hole card ['H3', 'SA'], current stack 985
player [ZPlayer] gets hole card ['CQ', 'CJ'], current stack 844
Started the round 12
Street "preflop" started. (community card = [])
"NitWinWin" declared "fold:0"
"ZPlayer" declared "raise:15"
"YangZ" declared "fold:0"
"Ethan" declared "fold:0"
"HakulaPlayer" declared "fold:0"
"SichengZuo" declared "fold:0"
"KLChen2PokerPlayer" declared "fold:0"
"Jinkun" declared "fold:15"
"['ZPlayer']" won the round 12 (stack = {'YangZ': 985, 'Ethan': 1144, 'HakulaPlayer': 1020, 'SichengZuo': 970, 'KLChen2PokerPlayer': 1059, 'Jinkun': 977, 'NitWinWin': 985, 'ZPlayer': 859})
player [YangZ] gets hole card ['CA', 'S7'], current stack 985
player [Ethan] gets hole card ['ST', 'C4'], current stack 1144
player [HakulaPlayer] gets hole card ['C5', 'CQ'], current stack 1020
player [SichengZuo] gets hole card ['H4', 'H3'], current stack 970
player [KLChen2PokerPlayer] gets hole card ['HT', 'SJ'], current stack 1059
player [Jinkun] gets hole card ['H8', 'H9'], current stack 972
player [NitWinWin] gets hole card ['S6', 'C8'], current stack 975
player [ZPlayer] gets hole card ['SQ', 'S8'], current stack 859
Started the round 13
Street "preflop" started. (community card = [])
"ZPlayer" declared "raise:15"
"YangZ" declared "fold:0"
"Ethan" declared "fold:0"
"HakulaPlayer" declared "fold:0"
"SichengZuo" declared "fold:0"
"KLChen2PokerPlayer" declared "raise:20"
"Jinkun" declared "fold:20"
"NitWinWin" declared "fold:0"
"ZPlayer" declared "call:20"
Street "flop" started. (community card = ['SK', 'S9', 'H7'])
"ZPlayer" declared "raise:10"
"KLChen2PokerPlayer" declared "call:10"
Street "turn" started. (community card = ['SK', 'S9', 'H7', 'C3'])
"ZPlayer" declared "call:0"
"KLChen2PokerPlayer" declared "call:0"
Street "river" started. (community card = ['SK', 'S9', 'H7', 'C3', 'CT'])
"ZPlayer" declared "call:0"
"KLChen2PokerPlayer" declared "call:0"
"['KLChen2PokerPlayer']" won the round 13 (stack = {'YangZ': 985, 'Ethan': 1144, 'HakulaPlayer': 1020, 'SichengZuo': 970, 'KLChen2PokerPlayer': 1104, 'Jinkun': 972, 'NitWinWin': 975, 'ZPlayer': 829})
player [YangZ] gets hole card ['S9', 'CK'], current stack 985
player [Ethan] gets hole card ['HA', 'HQ'], current stack 1144
player [HakulaPlayer] gets hole card ['D2', 'DJ'], current stack 1020
player [SichengZuo] gets hole card ['S2', 'CJ'], current stack 970
player [KLChen2PokerPlayer] gets hole card ['H3', 'S7'], current stack 1104
player [Jinkun] gets hole card ['S6', 'D6'], current stack 972
player [NitWinWin] gets hole card ['HJ', 'S8'], current stack 970
player [ZPlayer] gets hole card ['C9', 'CA'], current stack 819
Started the round 14
Street "preflop" started. (community card = [])
"YangZ" declared "fold:0"
"Ethan" declared "raise:171"
"HakulaPlayer" declared "fold:0"
"SichengZuo" declared "fold:0"
"KLChen2PokerPlayer" declared "fold:0"
"Jinkun" declared "fold:171"
"NitWinWin" declared "fold:0"
"ZPlayer" declared "fold:0"
"['Ethan']" won the round 14 (stack = {'YangZ': 985, 'Ethan': 1159, 'HakulaPlayer': 1020, 'SichengZuo': 970, 'KLChen2PokerPlayer': 1104, 'Jinkun': 972, 'NitWinWin': 970, 'ZPlayer': 819})
player [YangZ] gets hole card ['CQ', 'C6'], current stack 975
player [Ethan] gets hole card ['D2', 'CK'], current stack 1159
player [HakulaPlayer] gets hole card ['S9', 'C9'], current stack 1020
player [SichengZuo] gets hole card ['C7', 'SQ'], current stack 970
player [KLChen2PokerPlayer] gets hole card ['H7', 'C8'], current stack 1104
player [Jinkun] gets hole card ['H5', 'H8'], current stack 972
player [NitWinWin] gets hole card ['HA', 'C4'], current stack 970
player [ZPlayer] gets hole card ['H6', 'DT'], current stack 814
Started the round 15
Street "preflop" started. (community card = [])
"Ethan" declared "fold:0"
"HakulaPlayer" declared "call:10"
"SichengZuo" declared "fold:0"
"KLChen2PokerPlayer" declared "call:10"
"Jinkun" declared "fold:10"
"NitWinWin" declared "fold:0"
"ZPlayer" declared "fold:0"
"YangZ" declared "fold:0"
Street "flop" started. (community card = ['HQ', 'CJ', 'S3'])
"HakulaPlayer" declared "call:0"
"KLChen2PokerPlayer" declared "call:0"
Street "turn" started. (community card = ['HQ', 'CJ', 'S3', 'H9'])
"HakulaPlayer" declared "raise:42"
"KLChen2PokerPlayer" declared "fold:0"
"['HakulaPlayer']" won the round 15 (stack = {'YangZ': 975, 'Ethan': 1159, 'HakulaPlayer': 1045, 'SichengZuo': 970, 'KLChen2PokerPlayer': 1094, 'Jinkun': 972, 'NitWinWin': 970, 'ZPlayer': 814})
player [YangZ] gets hole card ['H9', 'CA'], current stack 970
player [Ethan] gets hole card ['S8', 'D9'], current stack 1149
player [HakulaPlayer] gets hole card ['DQ', 'H8'], current stack 1045
player [SichengZuo] gets hole card ['DJ', 'H5'], current stack 970
player [KLChen2PokerPlayer] gets hole card ['HQ', 'SJ'], current stack 1094
player [Jinkun] gets hole card ['C2', 'D3'], current stack 972
player [NitWinWin] gets hole card ['C9', 'CJ'], current stack 970
player [ZPlayer] gets hole card ['C8', 'HA'], current stack 814
Started the round 16
Street "preflop" started. (community card = [])
"HakulaPlayer" declared "fold:0"
"SichengZuo" declared "fold:0"
"KLChen2PokerPlayer" declared "raise:15"
"Jinkun" declared "fold:15"
"NitWinWin" declared "fold:0"
"ZPlayer" declared "call:15"
"YangZ" declared "fold:0"
"Ethan" declared "call:15"
Street "flop" started. (community card = ['DT', 'DK', 'C3'])
"Ethan" declared "call:0"
"KLChen2PokerPlayer" declared "raise:26"
"ZPlayer" declared "fold:0"
"Ethan" declared "fold:0"
"['KLChen2PokerPlayer']" won the round 16 (stack = {'YangZ': 970, 'Ethan': 1144, 'HakulaPlayer': 1045, 'SichengZuo': 970, 'KLChen2PokerPlayer': 1129, 'Jinkun': 972, 'NitWinWin': 970, 'ZPlayer': 799})
player [YangZ] gets hole card ['HJ', 'C2'], current stack 970
player [Ethan] gets hole card ['S8', 'C6'], current stack 1139
player [HakulaPlayer] gets hole card ['HT', 'D6'], current stack 1035
player [SichengZuo] gets hole card ['HA', 'CT'], current stack 970
player [KLChen2PokerPlayer] gets hole card ['C7', 'CJ'], current stack 1129
player [Jinkun] gets hole card ['C4', 'D8'], current stack 972
player [NitWinWin] gets hole card ['DT', 'D9'], current stack 970
player [ZPlayer] gets hole card ['S2', 'C3'], current stack 799
Started the round 17
Street "preflop" started. (community card = [])
"SichengZuo" declared "fold:0"
"KLChen2PokerPlayer" declared "raise:17"
"Jinkun" declared "fold:17"
"NitWinWin" declared "fold:0"
"ZPlayer" declared "fold:0"
"YangZ" declared "fold:0"
"Ethan" declared "fold:0"
"HakulaPlayer" declared "call:17"
Street "flop" started. (community card = ['D4', 'C5', 'S7'])
"HakulaPlayer" declared "call:0"
"KLChen2PokerPlayer" declared "raise:23"
"HakulaPlayer" declared "fold:0"
"['KLChen2PokerPlayer']" won the round 17 (stack = {'YangZ': 970, 'Ethan': 1139, 'HakulaPlayer': 1028, 'SichengZuo': 970, 'KLChen2PokerPlayer': 1151, 'Jinkun': 972, 'NitWinWin': 970, 'ZPlayer': 799})
player [YangZ] gets hole card ['SK', 'D9'], current stack 970
player [Ethan] gets hole card ['S7', 'H4'], current stack 1139
player [HakulaPlayer] gets hole card ['S9', 'D6'], current stack 1023
player [SichengZuo] gets hole card ['HJ', 'D2'], current stack 960
player [KLChen2PokerPlayer] gets hole card ['S8', 'C4'], current stack 1151
player [Jinkun] gets hole card ['H7', 'C6'], current stack 972
player [NitWinWin] gets hole card ['S6', 'HT'], current stack 970
player [ZPlayer] gets hole card ['HA', 'DA'], current stack 799
Started the round 18
Street "preflop" started. (community card = [])
"KLChen2PokerPlayer" declared "fold:0"
"Jinkun" declared "fold:10"
"NitWinWin" declared "fold:0"
"ZPlayer" declared "raise:15"
"YangZ" declared "fold:0"
"Ethan" declared "fold:0"
"HakulaPlayer" declared "fold:0"
"SichengZuo" declared "fold:0"
"['ZPlayer']" won the round 18 (stack = {'YangZ': 970, 'Ethan': 1139, 'HakulaPlayer': 1023, 'SichengZuo': 960, 'KLChen2PokerPlayer': 1151, 'Jinkun': 972, 'NitWinWin': 970, 'ZPlayer': 814})
player [YangZ] gets hole card ['D3', 'C3'], current stack 970
player [Ethan] gets hole card ['CK', 'C4'], current stack 1139
player [HakulaPlayer] gets hole card ['C7', 'H8'], current stack 1023
player [SichengZuo] gets hole card ['CQ', 'SJ'], current stack 955
player [KLChen2PokerPlayer] gets hole card ['HT', 'H6'], current stack 1141
player [Jinkun] gets hole card ['H9', 'SQ'], current stack 972
player [NitWinWin] gets hole card ['HJ', 'S9'], current stack 970
player [ZPlayer] gets hole card ['D6', 'D2'], current stack 814
Started the round 19
Street "preflop" started. (community card = [])
"Jinkun" declared "fold:10"
"NitWinWin" declared "fold:0"
"ZPlayer" declared "call:10"
"YangZ" declared "fold:0"
"Ethan" declared "fold:0"
"HakulaPlayer" declared "call:10"
"SichengZuo" declared "fold:0"
"KLChen2PokerPlayer" declared "call:10"
Street "flop" started. (community card = ['C5', 'H3', 'S6'])
"KLChen2PokerPlayer" declared "raise:31"
"ZPlayer" declared "fold:0"
"HakulaPlayer" declared "fold:0"
"['KLChen2PokerPlayer']" won the round 19 (stack = {'YangZ': 970, 'Ethan': 1139, 'HakulaPlayer': 1013, 'SichengZuo': 955, 'KLChen2PokerPlayer': 1176, 'Jinkun': 972, 'NitWinWin': 970, 'ZPlayer': 804})
player [YangZ] gets hole card ['H2', 'SQ'], current stack 970
player [Ethan] gets hole card ['CQ', 'H3'], current stack 1139
player [HakulaPlayer] gets hole card ['HK', 'H6'], current stack 1013
player [SichengZuo] gets hole card ['DT', 'C9'], current stack 955
player [KLChen2PokerPlayer] gets hole card ['D7', 'D4'], current stack 1171
player [Jinkun] gets hole card ['D8', 'DQ'], current stack 962
player [NitWinWin] gets hole card ['HQ', 'SJ'], current stack 970
player [ZPlayer] gets hole card ['HA', 'CK'], current stack 804
Started the round 20
Street "preflop" started. (community card = [])
"NitWinWin" declared "fold:0"
"ZPlayer" declared "raise:15"
"YangZ" declared "fold:0"
"Ethan" declared "fold:0"
"HakulaPlayer" declared "call:15"
"SichengZuo" declared "fold:0"
"KLChen2PokerPlayer" declared "raise:20"
"Jinkun" declared "fold:20"
"ZPlayer" declared "call:20"
"HakulaPlayer" declared "call:20"
Street "flop" started. (community card = ['DK', 'D3', 'C8'])
"KLChen2PokerPlayer" declared "raise:16"
"ZPlayer" declared "raise:43"
"HakulaPlayer" declared "call:43"
"KLChen2PokerPlayer" declared "fold:0"
Street "turn" started. (community card = ['DK', 'D3', 'C8', 'S3'])
"ZPlayer" declared "raise:172"
"HakulaPlayer" declared "raise:551"
"ZPlayer" declared "call:551"
Street "river" started. (community card = ['DK', 'D3', 'C8', 'S3', 'SA'])
"ZPlayer" declared "call:0"
"HakulaPlayer" declared "raise:399"
"ZPlayer" declared "call:399"
"['ZPlayer']" won the round 20 (stack = {'YangZ': 970, 'Ethan': 1139, 'HakulaPlayer': 209, 'SichengZuo': 955, 'KLChen2PokerPlayer': 1140, 'Jinkun': 962, 'NitWinWin': 970, 'ZPlayer': 1654})
player [YangZ] gets hole card ['HT', 'S4'], current stack 970
player [Ethan] gets hole card ['DK', 'D7'], current stack 1139
player [HakulaPlayer] gets hole card ['CJ', 'HQ'], current stack 209
player [SichengZuo] gets hole card ['C3', 'ST'], current stack 955
player [KLChen2PokerPlayer] gets hole card ['S5', 'H2'], current stack 1140
player [Jinkun] gets hole card ['C8', 'SA'], current stack 957
player [NitWinWin] gets hole card ['H4', 'C2'], current stack 960
player [ZPlayer] gets hole card ['D5', 'H7'], current stack 1654
Started the round 21
Street "preflop" started. (community card = [])
"ZPlayer" declared "raise:15"
"YangZ" declared "fold:0"
"Ethan" declared "fold:0"
"HakulaPlayer" declared "call:15"
"SichengZuo" declared "fold:0"
"KLChen2PokerPlayer" declared "fold:0"
"Jinkun" declared "fold:15"
"NitWinWin" declared "fold:0"
Street "flop" started. (community card = ['D2', 'H8', 'C9'])
"ZPlayer" declared "call:0"
"HakulaPlayer" declared "call:0"
Street "turn" started. (community card = ['D2', 'H8', 'C9', 'D8'])
"ZPlayer" declared "call:0"
"HakulaPlayer" declared "call:0"
Street "river" started. (community card = ['D2', 'H8', 'C9', 'D8', 'CK'])
"ZPlayer" declared "call:0"
"HakulaPlayer" declared "call:0"
"['HakulaPlayer']" won the round 21 (stack = {'YangZ': 970, 'Ethan': 1139, 'HakulaPlayer': 239, 'SichengZuo': 955, 'KLChen2PokerPlayer': 1140, 'Jinkun': 957, 'NitWinWin': 960, 'ZPlayer': 1639})
player [YangZ] gets hole card ['S5', 'C3'], current stack 970
player [Ethan] gets hole card ['S4', 'DA'], current stack 1139
player [HakulaPlayer] gets hole card ['ST', 'SA'], current stack 239
player [SichengZuo] gets hole card ['DK', 'C4'], current stack 955
player [KLChen2PokerPlayer] gets hole card ['D2', 'DJ'], current stack 1140
player [Jinkun] gets hole card ['CJ', 'C9'], current stack 957
player [NitWinWin] gets hole card ['D6', 'HQ'], current stack 955
player [ZPlayer] gets hole card ['D5', 'H2'], current stack 1629
Started the round 22
Street "preflop" started. (community card = [])
"YangZ" declared "fold:0"
"Ethan" declared "fold:0"
"HakulaPlayer" declared "call:10"
"SichengZuo" declared "fold:0"
"KLChen2PokerPlayer" declared "call:10"
"Jinkun" declared "fold:10"
"NitWinWin" declared "fold:0"
"ZPlayer" declared "call:10"
Street "flop" started. (community card = ['D7', 'S2', 'C8'])
"ZPlayer" declared "raise:10"
"HakulaPlayer" declared "fold:0"
"KLChen2PokerPlayer" declared "raise:20"
"ZPlayer" declared "fold:0"
"['KLChen2PokerPlayer']" won the round 22 (stack = {'YangZ': 970, 'Ethan': 1139, 'HakulaPlayer': 229, 'SichengZuo': 955, 'KLChen2PokerPlayer': 1175, 'Jinkun': 957, 'NitWinWin': 955, 'ZPlayer': 1619})
player [YangZ] gets hole card ['CT', 'DK'], current stack 960
player [Ethan] gets hole card ['HJ', 'D9'], current stack 1139
player [HakulaPlayer] gets hole card ['CA', 'D7'], current stack 229
player [SichengZuo] gets hole card ['D5', 'D4'], current stack 955
player [KLChen2PokerPlayer] gets hole card ['H3', 'HT'], current stack 1175
player [Jinkun] gets hole card ['CQ', 'DJ'], current stack 957
player [NitWinWin] gets hole card ['C2', 'S9'], current stack 955
player [ZPlayer] gets hole card ['C6', 'D2'], current stack 1614
Started the round 23
Street "preflop" started. (community card = [])
"Ethan" declared "fold:0"
"HakulaPlayer" declared "call:10"
"SichengZuo" declared "fold:0"
"KLChen2PokerPlayer" declared "raise:19"
"Jinkun" declared "fold:19"
"NitWinWin" declared "fold:0"
"ZPlayer" declared "fold:0"
"YangZ" declared "fold:0"
"HakulaPlayer" declared "raise:42"
"KLChen2PokerPlayer" declared "fold:0"
"['HakulaPlayer']" won the round 23 (stack = {'YangZ': 960, 'Ethan': 1139, 'HakulaPlayer': 263, 'SichengZuo': 955, 'KLChen2PokerPlayer': 1156, 'Jinkun': 957, 'NitWinWin': 955, 'ZPlayer': 1614})
player [YangZ] gets hole card ['D4', 'S7'], current stack 955
player [Ethan] gets hole card ['HJ', 'DA'], current stack 1129
player [HakulaPlayer] gets hole card ['S2', 'C9'], current stack 263
player [SichengZuo] gets hole card ['H5', 'C3'], current stack 955
player [KLChen2PokerPlayer] gets hole card ['ST', 'D2'], current stack 1156
player [Jinkun] gets hole card ['HK', 'D6'], current stack 957
player [NitWinWin] gets hole card ['S8', 'CK'], current stack 955
player [ZPlayer] gets hole card ['H8', 'H6'], current stack 1614
Started the round 24
Street "preflop" started. (community card = [])
"HakulaPlayer" declared "fold:0"
"SichengZuo" declared "fold:0"
"KLChen2PokerPlayer" declared "fold:0"
"Jinkun" declared "fold:10"
"NitWinWin" declared "fold:0"
"ZPlayer" declared "raise:15"
"YangZ" declared "fold:0"
"Ethan" declared "raise:170"
"ZPlayer" declared "fold:0"
"['Ethan']" won the round 24 (stack = {'YangZ': 955, 'Ethan': 1159, 'HakulaPlayer': 263, 'SichengZuo': 955, 'KLChen2PokerPlayer': 1156, 'Jinkun': 957, 'NitWinWin': 955, 'ZPlayer': 1599})
player [YangZ] gets hole card ['D6', 'D4'], current stack 955
player [Ethan] gets hole card ['CK', 'D2'], current stack 1154
player [HakulaPlayer] gets hole card ['D7', 'SA'], current stack 253
player [SichengZuo] gets hole card ['CJ', 'S7'], current stack 955
player [KLChen2PokerPlayer] gets hole card ['DK', 'SQ'], current stack 1156
player [Jinkun] gets hole card ['HK', 'SK'], current stack 957
player [NitWinWin] gets hole card ['DJ', 'H7'], current stack 955
player [ZPlayer] gets hole card ['D5', 'H2'], current stack 1599
Started the round 25
Street "preflop" started. (community card = [])
"SichengZuo" declared "fold:0"
"KLChen2PokerPlayer" declared "raise:25"
"Jinkun" declared "fold:25"
"NitWinWin" declared "fold:0"
"ZPlayer" declared "raise:40"
"YangZ" declared "fold:0"
"Ethan" declared "fold:0"
"HakulaPlayer" declared "fold:0"
"KLChen2PokerPlayer" declared "fold:0"
"['ZPlayer']" won the round 25 (stack = {'YangZ': 955, 'Ethan': 1154, 'HakulaPlayer': 253, 'SichengZuo': 955, 'KLChen2PokerPlayer': 1131, 'Jinkun': 957, 'NitWinWin': 955, 'ZPlayer': 1639})
player [YangZ] gets hole card ['HJ', 'HT'], current stack 955
player [Ethan] gets hole card ['SJ', 'H5'], current stack 1154
player [HakulaPlayer] gets hole card ['CT', 'S3'], current stack 248
player [SichengZuo] gets hole card ['H7', 'D8'], current stack 945
player [KLChen2PokerPlayer] gets hole card ['SQ', 'DA'], current stack 1131
player [Jinkun] gets hole card ['H6', 'CJ'], current stack 957
player [NitWinWin] gets hole card ['C7', 'HK'], current stack 955
player [ZPlayer] gets hole card ['H3', 'D9'], current stack 1639
Started the round 26
Street "preflop" started. (community card = [])
"KLChen2PokerPlayer" declared "raise:21"
"Jinkun" declared "fold:21"
"NitWinWin" declared "fold:0"
"ZPlayer" declared "raise:32"
"YangZ" declared "fold:0"
"Ethan" declared "fold:0"
"HakulaPlayer" declared "fold:0"
"SichengZuo" declared "fold:0"
"KLChen2PokerPlayer" declared "fold:0"
"['ZPlayer']" won the round 26 (stack = {'YangZ': 955, 'Ethan': 1154, 'HakulaPlayer': 248, 'SichengZuo': 945, 'KLChen2PokerPlayer': 1110, 'Jinkun': 957, 'NitWinWin': 955, 'ZPlayer': 1675})
player [YangZ] gets hole card ['D8', 'HA'], current stack 955
player [Ethan] gets hole card ['ST', 'D7'], current stack 1154
player [HakulaPlayer] gets hole card ['D3', 'DJ'], current stack 248
player [SichengZuo] gets hole card ['SJ', 'DK'], current stack 940
player [KLChen2PokerPlayer] gets hole card ['SA', 'C6'], current stack 1100
player [Jinkun] gets hole card ['S3', 'HQ'], current stack 957
player [NitWinWin] gets hole card ['S4', 'D9'], current stack 955
player [ZPlayer] gets hole card ['SK', 'CT'], current stack 1675
Started the round 27
Street "preflop" started. (community card = [])
"Jinkun" declared "fold:10"
"NitWinWin" declared "fold:0"
"ZPlayer" declared "raise:15"
"YangZ" declared "fold:0"
"Ethan" declared "fold:0"
"HakulaPlayer" declared "fold:0"
"SichengZuo" declared "fold:0"
"KLChen2PokerPlayer" declared "raise:23"
"ZPlayer" declared "call:23"
Street "flop" started. (community card = ['CQ', 'C9', 'C2'])
"KLChen2PokerPlayer" declared "raise:18"
"ZPlayer" declared "fold:0"
"['KLChen2PokerPlayer']" won the round 27 (stack = {'YangZ': 955, 'Ethan': 1154, 'HakulaPlayer': 248, 'SichengZuo': 940, 'KLChen2PokerPlayer': 1138, 'Jinkun': 957, 'NitWinWin': 955, 'ZPlayer': 1652})
player [YangZ] gets hole card ['C5', 'DA'], current stack 955
player [Ethan] gets hole card ['HJ', 'HK'], current stack 1154
player [HakulaPlayer] gets hole card ['H7', 'DQ'], current stack 248
player [SichengZuo] gets hole card ['C3', 'S9'], current stack 940
player [KLChen2PokerPlayer] gets hole card ['CQ', 'C7'], current stack 1133
player [Jinkun] gets hole card ['HT', 'CA'], current stack 947
player [NitWinWin] gets hole card ['DK', 'D2'], current stack 955
player [ZPlayer] gets hole card ['D5', 'SJ'], current stack 1652
Started the round 28
Street "preflop" started. (community card = [])
"NitWinWin" declared "fold:0"
"ZPlayer" declared "raise:15"
"YangZ" declared "fold:0"
"Ethan" declared "raise:173"
"HakulaPlayer" declared "fold:0"
"SichengZuo" declared "fold:0"
"KLChen2PokerPlayer" declared "fold:0"
"Jinkun" declared "fold:173"
"ZPlayer" declared "call:173"
Street "flop" started. (community card = ['C2', 'CJ', 'D6'])
"ZPlayer" declared "raise:10"
"Ethan" declared "call:10"
Street "turn" started. (community card = ['C2', 'CJ', 'D6', 'S3'])
"ZPlayer" declared "raise:10"
"Ethan" declared "call:10"
Street "river" started. (community card = ['C2', 'CJ', 'D6', 'S3', 'S5'])
"ZPlayer" declared "raise:10"
"Ethan" declared "raise:411"
"ZPlayer" declared "call:411"
"['ZPlayer']" won the round 28 (stack = {'YangZ': 955, 'Ethan': 550, 'HakulaPlayer': 248, 'SichengZuo': 940, 'KLChen2PokerPlayer': 1133, 'Jinkun': 947, 'NitWinWin': 955, 'ZPlayer': 2271})
player [YangZ] gets hole card ['CA', 'DA'], current stack 955
player [Ethan] gets hole card ['S8', 'ST'], current stack 550
player [HakulaPlayer] gets hole card ['C5', 'D4'], current stack 248
player [SichengZuo] gets hole card ['H2', 'H7'], current stack 940
player [KLChen2PokerPlayer] gets hole card ['C4', 'SJ'], current stack 1133
player [Jinkun] gets hole card ['HJ', 'S5'], current stack 942
player [NitWinWin] gets hole card ['S6', 'HQ'], current stack 945
player [ZPlayer] gets hole card ['DT', 'HK'], current stack 2271
Started the round 29
Street "preflop" started. (community card = [])
"ZPlayer" declared "raise:15"
"YangZ" declared "fold:0"
"Ethan" declared "fold:0"
"HakulaPlayer" declared "fold:0"
"SichengZuo" declared "fold:0"
"KLChen2PokerPlayer" declared "fold:0"
"Jinkun" declared "fold:15"
"NitWinWin" declared "fold:0"
"['ZPlayer']" won the round 29 (stack = {'YangZ': 955, 'Ethan': 550, 'HakulaPlayer': 248, 'SichengZuo': 940, 'KLChen2PokerPlayer': 1133, 'Jinkun': 942, 'NitWinWin': 945, 'ZPlayer': 2286})
player [YangZ] gets hole card ['H4', 'C9'], current stack 955
player [Ethan] gets hole card ['C7', 'C5'], current stack 550
player [HakulaPlayer] gets hole card ['S8', 'H8'], current stack 248
player [SichengZuo] gets hole card ['CT', 'C2'], current stack 940
player [KLChen2PokerPlayer] gets hole card ['HK', 'S2'], current stack 1133
player [Jinkun] gets hole card ['CJ', 'H5'], current stack 942
player [NitWinWin] gets hole card ['HQ', 'SQ'], current stack 940
player [ZPlayer] gets hole card ['D3', 'HA'], current stack 2276
Started the round 30
Street "preflop" started. (community card = [])
"YangZ" declared "fold:0"
"Ethan" declared "fold:0"
"HakulaPlayer" declared "call:10"
"SichengZuo" declared "fold:0"
"KLChen2PokerPlayer" declared "call:10"
"Jinkun" declared "fold:10"
"NitWinWin" declared "raise:945"
"ZPlayer" declared "fold:0"
"HakulaPlayer" declared "fold:0"
"KLChen2PokerPlayer" declared "fold:0"
"['NitWinWin']" won the round 30 (stack = {'YangZ': 955, 'Ethan': 550, 'HakulaPlayer': 238, 'SichengZuo': 940, 'KLChen2PokerPlayer': 1123, 'Jinkun': 942, 'NitWinWin': 975, 'ZPlayer': 2276})
player [YangZ] gets hole card ['CT', 'CJ'], current stack 945
player [Ethan] gets hole card ['CQ', 'S2'], current stack 550
player [HakulaPlayer] gets hole card ['HK', 'CK'], current stack 238
player [SichengZuo] gets hole card ['H8', 'S7'], current stack 940
player [KLChen2PokerPlayer] gets hole card ['HT', 'DA'], current stack 1123
player [Jinkun] gets hole card ['H9', 'D2'], current stack 942
player [NitWinWin] gets hole card ['SQ', 'C4'], current stack 975
player [ZPlayer] gets hole card ['DQ', 'S9'], current stack 2271
Started the round 31
Street "preflop" started. (community card = [])
"Ethan" declared "fold:0"
"HakulaPlayer" declared "raise:33"
"SichengZuo" declared "fold:0"
"KLChen2PokerPlayer" declared "fold:0"
"Jinkun" declared "fold:33"
"NitWinWin" declared "fold:0"
"ZPlayer" declared "call:33"
"YangZ" declared "fold:0"
Street "flop" started. (community card = ['CA', 'C6', 'HA'])
"ZPlayer" declared "call:0"
"HakulaPlayer" declared "raise:95"
"ZPlayer" declared "fold:0"
"['HakulaPlayer']" won the round 31 (stack = {'YangZ': 945, 'Ethan': 550, 'HakulaPlayer': 281, 'SichengZuo': 940, 'KLChen2PokerPlayer': 1123, 'Jinkun': 942, 'NitWinWin': 975, 'ZPlayer': 2243})
player [YangZ] gets hole card ['SA', 'S3'], current stack 940
player [Ethan] gets hole card ['S5', 'HK'], current stack 540
player [HakulaPlayer] gets hole card ['S4', 'HT'], current stack 281
player [SichengZuo] gets hole card ['D7', 'HA'], current stack 940
player [KLChen2PokerPlayer] gets hole card ['H7', 'H5'], current stack 1123
player [Jinkun] gets hole card ['H3', 'D2'], current stack 942
player [NitWinWin] gets hole card ['D8', 'H4'], current stack 975
player [ZPlayer] gets hole card ['CJ', 'H6'], current stack 2243
Started the round 32
Street "preflop" started. (community card = [])
"HakulaPlayer" declared "fold:0"
"SichengZuo" declared "fold:0"
"KLChen2PokerPlayer" declared "raise:15"
"Jinkun" declared "fold:15"
"NitWinWin" declared "fold:0"
"ZPlayer" declared "raise:20"
"YangZ" declared "fold:0"
"Ethan" declared "fold:0"
"KLChen2PokerPlayer" declared "fold:0"
"['ZPlayer']" won the round 32 (stack = {'YangZ': 940, 'Ethan': 540, 'HakulaPlayer': 281, 'SichengZuo': 940, 'KLChen2PokerPlayer': 1108, 'Jinkun': 942, 'NitWinWin': 975, 'ZPlayer': 2273})
player [YangZ] gets hole card ['S4', 'D2'], current stack 940
player [Ethan] gets hole card ['C9', 'ST'], current stack 535
player [HakulaPlayer] gets hole card ['SQ', 'H6'], current stack 271
player [SichengZuo] gets hole card ['H4', 'D4'], current stack 940
player [KLChen2PokerPlayer] gets hole card ['H9', 'C5'], current stack 1108
player [Jinkun] gets hole card ['CK', 'S8'], current stack 942
player [NitWinWin] gets hole card ['HA', 'HQ'], current stack 975
player [ZPlayer] gets hole card ['S7', 'SJ'], current stack 2273
Started the round 33
Street "preflop" started. (community card = [])
"SichengZuo" declared "fold:0"
"KLChen2PokerPlayer" declared "fold:0"
"Jinkun" declared "fold:10"
"NitWinWin" declared "fold:0"
"ZPlayer" declared "raise:15"
"YangZ" declared "fold:0"
"Ethan" declared "call:15"
"HakulaPlayer" declared "call:15"
Street "flop" started. (community card = ['C6', 'SA', 'DK'])
"Ethan" declared "call:0"
"HakulaPlayer" declared "call:0"
"ZPlayer" declared "call:0"
Street "turn" started. (community card = ['C6', 'SA', 'DK', 'D7'])
"Ethan" declared "call:0"
"HakulaPlayer" declared "call:0"
"ZPlayer" declared "raise:10"
"Ethan" declared "fold:0"
"HakulaPlayer" declared "call:10"
Street "river" started. (community card = ['C6', 'SA', 'DK', 'D7', 'HJ'])
"HakulaPlayer" declared "call:0"
"ZPlayer" declared "raise:1950"
"HakulaPlayer" declared "call:1950"
"['ZPlayer']" won the round 33 (stack = {'YangZ': 940, 'Ethan': 525, 'HakulaPlayer': 0, 'SichengZuo': 940, 'KLChen2PokerPlayer': 1108, 'Jinkun': 942, 'NitWinWin': 975, 'ZPlayer': 2569})
player [YangZ] gets hole card ['S8', 'CJ'], current stack 940
player [Ethan] gets hole card ['C4', 'H9'], current stack 525
player [SichengZuo] gets hole card ['C5', 'S2'], current stack 935
player [KLChen2PokerPlayer] gets hole card ['DJ', 'DK'], current stack 1098
player [Jinkun] gets hole card ['D3', 'S6'], current stack 942
player [NitWinWin] gets hole card ['CK', 'C9'], current stack 975
player [ZPlayer] gets hole card ['D8', 'H6'], current stack 2569
Started the round 34
Street "preflop" started. (community card = [])
"Jinkun" declared "fold:10"
"NitWinWin" declared "fold:0"
"ZPlayer" declared "raise:15"
"YangZ" declared "fold:0"
"Ethan" declared "fold:0"
"SichengZuo" declared "fold:0"
"KLChen2PokerPlayer" declared "raise:23"
"ZPlayer" declared "call:23"
Street "flop" started. (community card = ['HQ', 'HT', 'CT'])
"KLChen2PokerPlayer" declared "raise:22"
"ZPlayer" declared "fold:0"
"['KLChen2PokerPlayer']" won the round 34 (stack = {'YangZ': 940, 'Ethan': 525, 'HakulaPlayer': 0, 'SichengZuo': 935, 'KLChen2PokerPlayer': 1136, 'Jinkun': 942, 'NitWinWin': 975, 'ZPlayer': 2546})
player [YangZ] gets hole card ['H6', 'D5'], current stack 940
player [Ethan] gets hole card ['H9', 'H4'], current stack 525
player [SichengZuo] gets hole card ['C4', 'DK'], current stack 935
player [KLChen2PokerPlayer] gets hole card ['C9', 'HQ'], current stack 1131
player [Jinkun] gets hole card ['C5', 'CA'], current stack 932
player [NitWinWin] gets hole card ['H5', 'CT'], current stack 975
player [ZPlayer] gets hole card ['S5', 'S3'], current stack 2546
Started the round 35
Street "preflop" started. (community card = [])
"NitWinWin" declared "fold:0"
"ZPlayer" declared "raise:15"
"YangZ" declared "fold:0"
"Ethan" declared "fold:0"
"SichengZuo" declared "fold:0"
"KLChen2PokerPlayer" declared "fold:0"
"Jinkun" declared "call:15"
Street "flop" started. (community card = ['D4', 'D9', 'S2'])
"Jinkun" declared "call:0"
"ZPlayer" declared "call:0"
Street "turn" started. (community card = ['D4', 'D9', 'S2', 'C3'])
"Jinkun" declared "raise:16"
"ZPlayer" declared "fold:0"
"['Jinkun']" won the round 35 (stack = {'YangZ': 940, 'Ethan': 525, 'HakulaPlayer': 0, 'SichengZuo': 935, 'KLChen2PokerPlayer': 1131, 'Jinkun': 962, 'NitWinWin': 975, 'ZPlayer': 2531})
player [YangZ] gets hole card ['CQ', 'CT'], current stack 940
player [Ethan] gets hole card ['C7', 'HT'], current stack 525
player [SichengZuo] gets hole card ['H6', 'S5'], current stack 935
player [KLChen2PokerPlayer] gets hole card ['C5', 'D2'], current stack 1131
player [Jinkun] gets hole card ['H2', 'D9'], current stack 957
player [NitWinWin] gets hole card ['CK', 'C2'], current stack 965
player [ZPlayer] gets hole card ['SQ', 'D8'], current stack 2531
Started the round 36
Street "preflop" started. (community card = [])
"ZPlayer" declared "raise:15"
"YangZ" declared "fold:0"
"Ethan" declared "fold:0"
"SichengZuo" declared "fold:0"
"KLChen2PokerPlayer" declared "fold:0"
"Jinkun" declared "fold:15"
"NitWinWin" declared "fold:0"
"['ZPlayer']" won the round 36 (stack = {'YangZ': 940, 'Ethan': 525, 'HakulaPlayer': 0, 'SichengZuo': 935, 'KLChen2PokerPlayer': 1131, 'Jinkun': 957, 'NitWinWin': 965, 'ZPlayer': 2546})
player [YangZ] gets hole card ['H3', 'D5'], current stack 940
player [Ethan] gets hole card ['S4', 'DK'], current stack 525
player [SichengZuo] gets hole card ['H9', 'S6'], current stack 935
player [KLChen2PokerPlayer] gets hole card ['H4', 'D8'], current stack 1131
player [Jinkun] gets hole card ['H7', 'D7'], current stack 957
player [NitWinWin] gets hole card ['S7', 'S3'], current stack 960
player [ZPlayer] gets hole card ['C6', 'DQ'], current stack 2536
Started the round 37
Street "preflop" started. (community card = [])
"YangZ" declared "fold:0"
"Ethan" declared "fold:0"
"SichengZuo" declared "fold:0"
"KLChen2PokerPlayer" declared "fold:0"
"Jinkun" declared "call:10"
"NitWinWin" declared "fold:0"
"ZPlayer" declared "raise:15"
"Jinkun" declared "call:15"
Street "flop" started. (community card = ['C5', 'H8', 'D9'])
"ZPlayer" declared "call:0"
"Jinkun" declared "call:0"
Street "turn" started. (community card = ['C5', 'H8', 'D9', 'C4'])
"ZPlayer" declared "call:0"
"Jinkun" declared "call:0"
Street "river" started. (community card = ['C5', 'H8', 'D9', 'C4', 'SQ'])
"ZPlayer" declared "raise:10"
"Jinkun" declared "call:10"
"['ZPlayer']" won the round 37 (stack = {'YangZ': 940, 'Ethan': 525, 'HakulaPlayer': 0, 'SichengZuo': 935, 'KLChen2PokerPlayer': 1131, 'Jinkun': 932, 'NitWinWin': 960, 'ZPlayer': 2576})
player [YangZ] gets hole card ['S4', 'D8'], current stack 930
player [Ethan] gets hole card ['CT', 'D6'], current stack 525
player [SichengZuo] gets hole card ['CK', 'C9'], current stack 935
player [KLChen2PokerPlayer] gets hole card ['DT', 'DJ'], current stack 1131
player [Jinkun] gets hole card ['CJ', 'C8'], current stack 932
player [NitWinWin] gets hole card ['SA', 'C5'], current stack 960
player [ZPlayer] gets hole card ['D9', 'HQ'], current stack 2571
Started the round 38
Street "preflop" started. (community card = [])
"Ethan" declared "fold:0"
"SichengZuo" declared "fold:0"
"KLChen2PokerPlayer" declared "raise:23"
"Jinkun" declared "fold:23"
"NitWinWin" declared "fold:0"
"ZPlayer" declared "raise:36"
"YangZ" declared "fold:0"
"KLChen2PokerPlayer" declared "fold:0"
"['ZPlayer']" won the round 38 (stack = {'YangZ': 930, 'Ethan': 525, 'HakulaPlayer': 0, 'SichengZuo': 935, 'KLChen2PokerPlayer': 1108, 'Jinkun': 932, 'NitWinWin': 960, 'ZPlayer': 2609})
player [YangZ] gets hole card ['D4', 'S7'], current stack 925
player [Ethan] gets hole card ['D8', 'D3'], current stack 515
player [SichengZuo] gets hole card ['H3', 'DQ'], current stack 935
player [KLChen2PokerPlayer] gets hole card ['DJ', 'C8'], current stack 1108
player [Jinkun] gets hole card ['SJ', 'S2'], current stack 932
player [NitWinWin] gets hole card ['D7', 'S4'], current stack 960
player [ZPlayer] gets hole card ['SQ', 'D2'], current stack 2609
Started the round 39
Street "preflop" started. (community card = [])
"SichengZuo" declared "fold:0"
"KLChen2PokerPlayer" declared "call:10"
"Jinkun" declared "fold:10"
"NitWinWin" declared "fold:0"
"ZPlayer" declared "raise:15"
"YangZ" declared "fold:0"
"Ethan" declared "fold:0"
"KLChen2PokerPlayer" declared "fold:0"
"['ZPlayer']" won the round 39 (stack = {'YangZ': 925, 'Ethan': 515, 'HakulaPlayer': 0, 'SichengZuo': 935, 'KLChen2PokerPlayer': 1098, 'Jinkun': 932, 'NitWinWin': 960, 'ZPlayer': 2634})
player [YangZ] gets hole card ['CQ', 'S6'], current stack 925
player [Ethan] gets hole card ['HT', 'D3'], current stack 510
player [SichengZuo] gets hole card ['D5', 'H3'], current stack 925
player [KLChen2PokerPlayer] gets hole card ['H8', 'HJ'], current stack 1098
player [Jinkun] gets hole card ['S3', 'H2'], current stack 932
player [NitWinWin] gets hole card ['S4', 'D6'], current stack 960
player [ZPlayer] gets hole card ['HA', 'CK'], current stack 2634
Started the round 40
Street "preflop" started. (community card = [])
"KLChen2PokerPlayer" declared "raise:15"
"Jinkun" declared "fold:15"
"NitWinWin" declared "fold:0"
"ZPlayer" declared "raise:20"
"YangZ" declared "fold:0"
"Ethan" declared "fold:0"
"SichengZuo" declared "fold:0"
"KLChen2PokerPlayer" declared "call:20"
Street "flop" started. (community card = ['DJ', 'H9', 'HQ'])
"KLChen2PokerPlayer" declared "raise:22"
"ZPlayer" declared "fold:0"
"['KLChen2PokerPlayer']" won the round 40 (stack = {'YangZ': 925, 'Ethan': 510, 'HakulaPlayer': 0, 'SichengZuo': 925, 'KLChen2PokerPlayer': 1133, 'Jinkun': 932, 'NitWinWin': 960, 'ZPlayer': 2614})
player [YangZ] gets hole card ['SK', 'DJ'], current stack 925
player [Ethan] gets hole card ['D5', 'S4'], current stack 510
player [SichengZuo] gets hole card ['S6', 'D6'], current stack 920
player [KLChen2PokerPlayer] gets hole card ['H6', 'C7'], current stack 1123
player [Jinkun] gets hole card ['DQ', 'SJ'], current stack 932
player [NitWinWin] gets hole card ['CA', 'HA'], current stack 960
player [ZPlayer] gets hole card ['S8', 'H8'], current stack 2614
Started the round 41
Street "preflop" started. (community card = [])
"Jinkun" declared "fold:10"
"NitWinWin" declared "raise:960"
"ZPlayer" declared "fold:0"
"YangZ" declared "fold:0"
"Ethan" declared "fold:0"
"SichengZuo" declared "fold:0"
"KLChen2PokerPlayer" declared "fold:0"
"['NitWinWin']" won the round 41 (stack = {'YangZ': 925, 'Ethan': 510, 'HakulaPlayer': 0, 'SichengZuo': 920, 'KLChen2PokerPlayer': 1123, 'Jinkun': 932, 'NitWinWin': 975, 'ZPlayer': 2614})
player [YangZ] gets hole card ['H2', 'C5'], current stack 925
player [Ethan] gets hole card ['S5', 'H6'], current stack 510
player [SichengZuo] gets hole card ['C3', 'S8'], current stack 920
player [KLChen2PokerPlayer] gets hole card ['CQ', 'SA'], current stack 1118
player [Jinkun] gets hole card ['S6', 'DJ'], current stack 922
player [NitWinWin] gets hole card ['D3', 'C2'], current stack 975
player [ZPlayer] gets hole card ['S4', 'C8'], current stack 2614
Started the round 42
Street "preflop" started. (community card = [])
"NitWinWin" declared "fold:0"
"ZPlayer" declared "raise:15"
"YangZ" declared "fold:0"
"Ethan" declared "fold:0"
"SichengZuo" declared "fold:0"
"KLChen2PokerPlayer" declared "raise:20"
"Jinkun" declared "fold:20"
"ZPlayer" declared "call:20"
Street "flop" started. (community card = ['H5', 'C6', 'D8'])
"KLChen2PokerPlayer" declared "call:0"
"ZPlayer" declared "raise:10"
"KLChen2PokerPlayer" declared "fold:0"
"['ZPlayer']" won the round 42 (stack = {'YangZ': 925, 'Ethan': 510, 'HakulaPlayer': 0, 'SichengZuo': 920, 'KLChen2PokerPlayer': 1103, 'Jinkun': 922, 'NitWinWin': 975, 'ZPlayer': 2644})
player [YangZ] gets hole card ['S7', 'H2'], current stack 925
player [Ethan] gets hole card ['CJ', 'DQ'], current stack 510
player [SichengZuo] gets hole card ['HT', 'S4'], current stack 920
player [KLChen2PokerPlayer] gets hole card ['CQ', 'CK'], current stack 1103
player [Jinkun] gets hole card ['D4', 'H7'], current stack 917
player [NitWinWin] gets hole card ['D6', 'CT'], current stack 965
player [ZPlayer] gets hole card ['H8', 'H9'], current stack 2644
Started the round 43
Street "preflop" started. (community card = [])
"ZPlayer" declared "raise:15"
"YangZ" declared "fold:0"
"Ethan" declared "raise:76"
"SichengZuo" declared "fold:0"
"KLChen2PokerPlayer" declared "call:76"
"Jinkun" declared "fold:76"
"NitWinWin" declared "fold:0"
"ZPlayer" declared "call:76"
Street "flop" started. (community card = ['C6', 'D9', 'S2'])
"ZPlayer" declared "raise:121"
"Ethan" declared "fold:0"
"KLChen2PokerPlayer" declared "fold:0"
"['ZPlayer']" won the round 43 (stack = {'YangZ': 925, 'Ethan': 434, 'HakulaPlayer': 0, 'SichengZuo': 920, 'KLChen2PokerPlayer': 1027, 'Jinkun': 917, 'NitWinWin': 965, 'ZPlayer': 2811})
player [YangZ] gets hole card ['S9', 'H8'], current stack 925
player [Ethan] gets hole card ['C5', 'S5'], current stack 434
player [SichengZuo] gets hole card ['C9', 'CA'], current stack 920
player [KLChen2PokerPlayer] gets hole card ['CT', 'C6'], current stack 1027
player [Jinkun] gets hole card ['HQ', 'CK'], current stack 917
player [NitWinWin] gets hole card ['S3', 'HK'], current stack 960
player [ZPlayer] gets hole card ['ST', 'D9'], current stack 2801
Started the round 44
Street "preflop" started. (community card = [])
"YangZ" declared "fold:0"
"Ethan" declared "fold:0"
"SichengZuo" declared "fold:0"
"KLChen2PokerPlayer" declared "call:10"
"Jinkun" declared "call:10"
"NitWinWin" declared "fold:0"
"ZPlayer" declared "raise:15"
"KLChen2PokerPlayer" declared "fold:0"
"Jinkun" declared "call:15"
Street "flop" started. (community card = ['D2', 'D6', 'S8'])
"ZPlayer" declared "call:0"
"Jinkun" declared "call:0"
Street "turn" started. (community card = ['D2', 'D6', 'S8', 'DT'])
"ZPlayer" declared "raise:10"
"Jinkun" declared "call:10"
Street "river" started. (community card = ['D2', 'D6', 'S8', 'DT', 'DJ'])
"ZPlayer" declared "raise:32"
"Jinkun" declared "fold:32"
"['ZPlayer']" won the round 44 (stack = {'YangZ': 925, 'Ethan': 434, 'HakulaPlayer': 0, 'SichengZuo': 920, 'KLChen2PokerPlayer': 1017, 'Jinkun': 892, 'NitWinWin': 960, 'ZPlayer': 2851})
player [YangZ] gets hole card ['SA', 'C3'], current stack 915
player [Ethan] gets hole card ['SJ', 'S4'], current stack 434
player [SichengZuo] gets hole card ['S9', 'H5'], current stack 920
player [KLChen2PokerPlayer] gets hole card ['D8', 'CK'], current stack 1017
player [Jinkun] gets hole card ['C6', 'C7'], current stack 892
player [NitWinWin] gets hole card ['CJ', 'H7'], current stack 960
player [ZPlayer] gets hole card ['H4', 'HQ'], current stack 2846
Started the round 45
Street "preflop" started. (community card = [])
"Ethan" declared "fold:0"
"SichengZuo" declared "fold:0"
"KLChen2PokerPlayer" declared "raise:15"
"Jinkun" declared "fold:15"
"NitWinWin" declared "fold:0"
"ZPlayer" declared "raise:20"
"YangZ" declared "fold:0"
"KLChen2PokerPlayer" declared "fold:0"
"['ZPlayer']" won the round 45 (stack = {'YangZ': 915, 'Ethan': 434, 'HakulaPlayer': 0, 'SichengZuo': 920, 'KLChen2PokerPlayer': 1002, 'Jinkun': 892, 'NitWinWin': 960, 'ZPlayer': 2876})
player [YangZ] gets hole card ['SJ', 'HQ'], current stack 910
player [Ethan] gets hole card ['C7', 'D7'], current stack 424
player [SichengZuo] gets hole card ['DA', 'H7'], current stack 920
player [KLChen2PokerPlayer] gets hole card ['SQ', 'DK'], current stack 1002
player [Jinkun] gets hole card ['H2', 'S3'], current stack 892
player [NitWinWin] gets hole card ['D6', 'H9'], current stack 960
player [ZPlayer] gets hole card ['HJ', 'CT'], current stack 2876
Started the round 46
Street "preflop" started. (community card = [])
"SichengZuo" declared "fold:0"
"KLChen2PokerPlayer" declared "raise:15"
"Jinkun" declared "fold:15"
"NitWinWin" declared "fold:0"
"ZPlayer" declared "raise:20"
"YangZ" declared "fold:0"
"Ethan" declared "call:20"
"KLChen2PokerPlayer" declared "raise:25"
"ZPlayer" declared "call:25"
"Ethan" declared "call:25"
Street "flop" started. (community card = ['HK', 'C9', 'S9'])
"Ethan" declared "call:0"
"KLChen2PokerPlayer" declared "raise:34"
"ZPlayer" declared "fold:0"
"Ethan" declared "call:34"
Street "turn" started. (community card = ['HK', 'C9', 'S9', 'D8'])
"Ethan" declared "call:0"
"KLChen2PokerPlayer" declared "raise:443"
"Ethan" declared "fold:0"
"['KLChen2PokerPlayer']" won the round 46 (stack = {'YangZ': 910, 'Ethan': 375, 'HakulaPlayer': 0, 'SichengZuo': 920, 'KLChen2PokerPlayer': 1091, 'Jinkun': 892, 'NitWinWin': 960, 'ZPlayer': 2851})
player [YangZ] gets hole card ['DQ', 'DA'], current stack 910
player [Ethan] gets hole card ['SA', 'H2'], current stack 370
player [SichengZuo] gets hole card ['H8', 'D6'], current stack 910
player [KLChen2PokerPlayer] gets hole card ['D5', 'C8'], current stack 1091
player [Jinkun] gets hole card ['S6', 'C2'], current stack 892
player [NitWinWin] gets hole card ['SJ', 'C6'], current stack 960
player [ZPlayer] gets hole card ['H6', 'SQ'], current stack 2851
Started the round 47
Street "preflop" started. (community card = [])
"KLChen2PokerPlayer" declared "fold:0"
"Jinkun" declared "fold:10"
"NitWinWin" declared "fold:0"
"ZPlayer" declared "raise:15"
"YangZ" declared "fold:0"
"Ethan" declared "call:15"
"SichengZuo" declared "fold:0"
Street "flop" started. (community card = ['SK', 'H5', 'C4'])
"Ethan" declared "call:0"
"ZPlayer" declared "call:0"
Street "turn" started. (community card = ['SK', 'H5', 'C4', 'ST'])
"Ethan" declared "call:0"
"ZPlayer" declared "call:0"
Street "river" started. (community card = ['SK', 'H5', 'C4', 'ST', 'CA'])
"Ethan" declared "call:0"
"ZPlayer" declared "call:0"
"['Ethan']" won the round 47 (stack = {'YangZ': 910, 'Ethan': 400, 'HakulaPlayer': 0, 'SichengZuo': 910, 'KLChen2PokerPlayer': 1091, 'Jinkun': 892, 'NitWinWin': 960, 'ZPlayer': 2836})
player [YangZ] gets hole card ['D5', 'D8'], current stack 910
player [Ethan] gets hole card ['H7', 'H4'], current stack 400
player [SichengZuo] gets hole card ['H6', 'S4'], current stack 905
player [KLChen2PokerPlayer] gets hole card ['CQ', 'HT'], current stack 1081
player [Jinkun] gets hole card ['C5', 'SK'], current stack 892
player [NitWinWin] gets hole card ['SQ', 'D2'], current stack 960
player [ZPlayer] gets hole card ['DK', 'S2'], current stack 2836
Started the round 48
Street "preflop" started. (community card = [])
"Jinkun" declared "fold:10"
"NitWinWin" declared "fold:0"
"ZPlayer" declared "raise:15"
"YangZ" declared "fold:0"
"Ethan" declared "fold:0"
"SichengZuo" declared "fold:0"
"KLChen2PokerPlayer" declared "raise:20"
"ZPlayer" declared "raise:25"
"KLChen2PokerPlayer" declared "fold:0"
"['ZPlayer']" won the round 48 (stack = {'YangZ': 910, 'Ethan': 400, 'HakulaPlayer': 0, 'SichengZuo': 905, 'KLChen2PokerPlayer': 1071, 'Jinkun': 892, 'NitWinWin': 960, 'ZPlayer': 2861})
player [YangZ] gets hole card ['S7', 'DT'], current stack 910
player [Ethan] gets hole card ['DJ', 'HT'], current stack 400
player [SichengZuo] gets hole card ['CA', 'DA'], current stack 905
player [KLChen2PokerPlayer] gets hole card ['D7', 'H7'], current stack 1066
player [Jinkun] gets hole card ['H3', 'H5'], current stack 882
player [NitWinWin] gets hole card ['S3', 'C4'], current stack 960
player [ZPlayer] gets hole card ['S8', 'C6'], current stack 2861
Started the round 49
Street "preflop" started. (community card = [])
"NitWinWin" declared "fold:0"
"ZPlayer" declared "raise:15"
"YangZ" declared "fold:0"
"Ethan" declared "call:15"
"SichengZuo" declared "raise:905"
"KLChen2PokerPlayer" declared "fold:0"
"Jinkun" declared "fold:905"
"ZPlayer" declared "fold:0"
"Ethan" declared "fold:0"
"['SichengZuo']" won the round 49 (stack = {'YangZ': 910, 'Ethan': 385, 'HakulaPlayer': 0, 'SichengZuo': 950, 'KLChen2PokerPlayer': 1066, 'Jinkun': 882, 'NitWinWin': 960, 'ZPlayer': 2846})
player [YangZ] gets hole card ['HK', 'D5'], current stack 910
player [Ethan] gets hole card ['H2', 'H4'], current stack 385
player [SichengZuo] gets hole card ['HT', 'H5'], current stack 950
player [KLChen2PokerPlayer] gets hole card ['CJ', 'ST'], current stack 1066
player [Jinkun] gets hole card ['DT', 'SK'], current stack 877
player [NitWinWin] gets hole card ['H8', 'S3'], current stack 950
player [ZPlayer] gets hole card ['C2', 'CQ'], current stack 2846
Started the round 50
Street "preflop" started. (community card = [])
"ZPlayer" declared "raise:15"
"YangZ" declared "fold:0"
"Ethan" declared "fold:0"
"SichengZuo" declared "fold:0"
"KLChen2PokerPlayer" declared "raise:20"
"Jinkun" declared "fold:20"
"NitWinWin" declared "fold:0"
"ZPlayer" declared "call:20"
Street "flop" started. (community card = ['C9', 'S4', 'C3'])
"ZPlayer" declared "call:0"
"KLChen2PokerPlayer" declared "call:0"
Street "turn" started. (community card = ['C9', 'S4', 'C3', 'DJ'])
"ZPlayer" declared "call:0"
"KLChen2PokerPlayer" declared "raise:422"
"ZPlayer" declared "fold:0"
"['KLChen2PokerPlayer']" won the round 50 (stack = {'YangZ': 910, 'Ethan': 385, 'HakulaPlayer': 0, 'SichengZuo': 950, 'KLChen2PokerPlayer': 1101, 'Jinkun': 877, 'NitWinWin': 950, 'ZPlayer': 2826})

Game Results:
------------------------------------------------------------
Game 1:
Winner: ZPlayer (stack: 2826)
All players' stacks:
  YangZ: 910
  Ethan: 385
  HakulaPlayer: 0
  SichengZuo: 950
  KLChen2PokerPlayer: 1101
  Jinkun: 877
  NitWinWin: 950
  ZPlayer: 2826
------------------------------------------------------------
