player [YangZ] gets hole card ['C4', 'S4'], current stack 1000
player [Ethan] gets hole card ['CA', 'H7'], current stack 995
player [HakulaPlayer] gets hole card ['HJ', 'C6'], current stack 990
player [SichengZuo] gets hole card ['HA', 'D3'], current stack 1000
player [KLChen2PokerPlayer] gets hole card ['D6', 'HT'], current stack 1000
player [Jinkun] gets hole card ['D2', 'H6'], current stack 1000
player [NitWinWin] gets hole card ['C2', 'S2'], current stack 1000
player [ZPlayer] gets hole card ['SA', 'CK'], current stack 1000
Started the round 1
Street "preflop" started. (community card = [])
"SichengZuo" declared "fold:0"
"KLChen2PokerPlayer" declared "raise:18"
"Jinkun" declared "fold:18"
"NitWinWin" declared "fold:0"
"ZPlayer" declared "call:18"
"YangZ" declared "fold:0"
"Ethan" declared "fold:0"
"HakulaPlayer" declared "call:18"
Street "flop" started. (community card = ['DQ', 'SJ', 'C7'])
"HakulaPlayer" declared "call:0"
"KLChen2PokerPlayer" declared "call:0"
"ZPlayer" declared "raise:10"
"HakulaPlayer" declared "call:10"
"KLChen2PokerPlayer" declared "fold:0"
Street "turn" started. (community card = ['DQ', 'SJ', 'C7', 'H2'])
"HakulaPlayer" declared "raise:68"
"ZPlayer" declared "fold:0"
"['HakulaPlayer']" won the round 1 (stack = {'YangZ': 1000, 'Ethan': 995, 'HakulaPlayer': 1051, 'SichengZuo': 1000, 'KLChen2PokerPlayer': 982, 'Jinkun': 1000, 'NitWinWin': 1000, 'ZPlayer': 972})
player [YangZ] gets hole card ['C2', 'HK'], current stack 1000
player [Ethan] gets hole card ['C4', 'S8'], current stack 995
player [HakulaPlayer] gets hole card ['D9', 'D5'], current stack 1046
player [SichengZuo] gets hole card ['H5', 'H2'], current stack 990
player [KLChen2PokerPlayer] gets hole card ['DT', 'DQ'], current stack 982
player [Jinkun] gets hole card ['S7', 'CA'], current stack 1000
player [NitWinWin] gets hole card ['D7', 'C8'], current stack 1000
player [ZPlayer] gets hole card ['CK', 'DA'], current stack 972
Started the round 2
Street "preflop" started. (community card = [])
"KLChen2PokerPlayer" declared "raise:27"
"Jinkun" declared "fold:27"
"NitWinWin" declared "fold:0"
"ZPlayer" declared "call:27"
"YangZ" declared "fold:0"
"Ethan" declared "fold:0"
"HakulaPlayer" declared "fold:0"
"SichengZuo" declared "fold:0"
Street "flop" started. (community card = ['HQ', 'SA', 'S3'])
"KLChen2PokerPlayer" declared "raise:31"
"ZPlayer" declared "call:31"
Street "turn" started. (community card = ['HQ', 'SA', 'S3', 'H9'])
"KLChen2PokerPlayer" declared "raise:208"
"ZPlayer" declared "call:208"
Street "river" started. (community card = ['HQ', 'SA', 'S3', 'H9', 'C9'])
"KLChen2PokerPlayer" declared "raise:148"
"ZPlayer" declared "call:148"
"['ZPlayer']" won the round 2 (stack = {'YangZ': 1000, 'Ethan': 995, 'HakulaPlayer': 1046, 'SichengZuo': 990, 'KLChen2PokerPlayer': 568, 'Jinkun': 1000, 'NitWinWin': 1000, 'ZPlayer': 1401})
player [YangZ] gets hole card ['SA', 'HQ'], current stack 1000
player [Ethan] gets hole card ['C2', 'C6'], current stack 995
player [HakulaPlayer] gets hole card ['D5', 'H5'], current stack 1046
player [SichengZuo] gets hole card ['S9', 'S8'], current stack 985
player [KLChen2PokerPlayer] gets hole card ['S2', 'C7'], current stack 558
player [Jinkun] gets hole card ['C3', 'H9'], current stack 1000
player [NitWinWin] gets hole card ['CA', 'DT'], current stack 1000
player [ZPlayer] gets hole card ['S5', 'H4'], current stack 1401
Started the round 3
Street "preflop" started. (community card = [])
"Jinkun" declared "fold:10"
"NitWinWin" declared "fold:0"
"ZPlayer" declared "call:10"
"YangZ" declared "fold:0"
"Ethan" declared "fold:0"
"HakulaPlayer" declared "raise:32"
"SichengZuo" declared "fold:0"
"KLChen2PokerPlayer" declared "fold:0"
"ZPlayer" declared "call:32"
Street "flop" started. (community card = ['H3', 'SJ', 'SK'])
"ZPlayer" declared "call:0"
"HakulaPlayer" declared "call:0"
Street "turn" started. (community card = ['H3', 'SJ', 'SK', 'S7'])
"ZPlayer" declared "call:0"
"HakulaPlayer" declared "raise:69"
"ZPlayer" declared "fold:0"
"['HakulaPlayer']" won the round 3 (stack = {'YangZ': 1000, 'Ethan': 995, 'HakulaPlayer': 1093, 'SichengZuo': 985, 'KLChen2PokerPlayer': 558, 'Jinkun': 1000, 'NitWinWin': 1000, 'ZPlayer': 1369})
player [YangZ] gets hole card ['D3', 'SQ'], current stack 1000
player [Ethan] gets hole card ['H5', 'CQ'], current stack 995
player [HakulaPlayer] gets hole card ['S2', 'CJ'], current stack 1093
player [SichengZuo] gets hole card ['HT', 'D5'], current stack 985
player [KLChen2PokerPlayer] gets hole card ['D8', 'H3'], current stack 553
player [Jinkun] gets hole card ['DJ', 'C5'], current stack 990
player [NitWinWin] gets hole card ['SJ', 'S6'], current stack 1000
player [ZPlayer] gets hole card ['CT', 'SA'], current stack 1369
Started the round 4
Street "preflop" started. (community card = [])
"NitWinWin" declared "fold:0"
"ZPlayer" declared "raise:15"
"YangZ" declared "fold:0"
"Ethan" declared "fold:0"
"HakulaPlayer" declared "fold:0"
"SichengZuo" declared "fold:0"
"KLChen2PokerPlayer" declared "fold:0"
"Jinkun" declared "fold:15"
"['ZPlayer']" won the round 4 (stack = {'YangZ': 1000, 'Ethan': 995, 'HakulaPlayer': 1093, 'SichengZuo': 985, 'KLChen2PokerPlayer': 553, 'Jinkun': 990, 'NitWinWin': 1000, 'ZPlayer': 1384})
player [YangZ] gets hole card ['C8', 'HQ'], current stack 1000
player [Ethan] gets hole card ['D2', 'SQ'], current stack 995
player [HakulaPlayer] gets hole card ['C9', 'S2'], current stack 1093
player [SichengZuo] gets hole card ['HJ', 'S7'], current stack 985
player [KLChen2PokerPlayer] gets hole card ['SK', 'D8'], current stack 553
player [Jinkun] gets hole card ['SJ', 'S9'], current stack 985
player [NitWinWin] gets hole card ['HK', 'CK'], current stack 990
player [ZPlayer] gets hole card ['H9', 'H2'], current stack 1384
Started the round 5
Street "preflop" started. (community card = [])
"ZPlayer" declared "call:10"
"YangZ" declared "fold:0"
"Ethan" declared "fold:0"
"HakulaPlayer" declared "fold:0"
"SichengZuo" declared "fold:0"
"KLChen2PokerPlayer" declared "raise:24"
"Jinkun" declared "fold:24"
"NitWinWin" declared "raise:1000"
"ZPlayer" declared "fold:0"
"KLChen2PokerPlayer" declared "fold:0"
"['NitWinWin']" won the round 5 (stack = {'YangZ': 1000, 'Ethan': 995, 'HakulaPlayer': 1093, 'SichengZuo': 985, 'KLChen2PokerPlayer': 529, 'Jinkun': 985, 'NitWinWin': 1039, 'ZPlayer': 1374})
player [YangZ] gets hole card ['HK', 'S5'], current stack 1000
player [Ethan] gets hole card ['SK', 'C2'], current stack 995
player [HakulaPlayer] gets hole card ['C8', 'S9'], current stack 1093
player [SichengZuo] gets hole card ['H6', 'H8'], current stack 985
player [KLChen2PokerPlayer] gets hole card ['HQ', 'S4'], current stack 529
player [Jinkun] gets hole card ['D4', 'SA'], current stack 985
player [NitWinWin] gets hole card ['S7', 'S3'], current stack 1034
player [ZPlayer] gets hole card ['HT', 'CK'], current stack 1364
Started the round 6
Street "preflop" started. (community card = [])
"YangZ" declared "fold:0"
"Ethan" declared "fold:0"
"HakulaPlayer" declared "fold:0"
"SichengZuo" declared "fold:0"
"KLChen2PokerPlayer" declared "raise:15"
"Jinkun" declared "fold:15"
"NitWinWin" declared "fold:0"
"ZPlayer" declared "call:15"
Street "flop" started. (community card = ['H4', 'CQ', 'S2'])
"ZPlayer" declared "call:0"
"KLChen2PokerPlayer" declared "raise:26"
"ZPlayer" declared "fold:0"
"['KLChen2PokerPlayer']" won the round 6 (stack = {'YangZ': 1000, 'Ethan': 995, 'HakulaPlayer': 1093, 'SichengZuo': 985, 'KLChen2PokerPlayer': 549, 'Jinkun': 985, 'NitWinWin': 1034, 'ZPlayer': 1359})
player [YangZ] gets hole card ['C4', 'CA'], current stack 990
player [Ethan] gets hole card ['HK', 'D4'], current stack 995
player [HakulaPlayer] gets hole card ['S9', 'H2'], current stack 1093
player [SichengZuo] gets hole card ['S4', 'CK'], current stack 985
player [KLChen2PokerPlayer] gets hole card ['S2', 'HT'], current stack 549
player [Jinkun] gets hole card ['SQ', 'HA'], current stack 985
player [NitWinWin] gets hole card ['DK', 'H7'], current stack 1034
player [ZPlayer] gets hole card ['S8', 'D2'], current stack 1354
Started the round 7
Street "preflop" started. (community card = [])
"Ethan" declared "fold:0"
"HakulaPlayer" declared "fold:0"
"SichengZuo" declared "fold:0"
"KLChen2PokerPlayer" declared "fold:0"
"Jinkun" declared "call:10"
"NitWinWin" declared "fold:0"
"ZPlayer" declared "call:10"
"YangZ" declared "fold:0"
Street "flop" started. (community card = ['DQ', 'C3', 'D5'])
"ZPlayer" declared "call:0"
"Jinkun" declared "raise:12"
"ZPlayer" declared "fold:0"
"['Jinkun']" won the round 7 (stack = {'YangZ': 990, 'Ethan': 995, 'HakulaPlayer': 1093, 'SichengZuo': 985, 'KLChen2PokerPlayer': 549, 'Jinkun': 1005, 'NitWinWin': 1034, 'ZPlayer': 1349})
player [YangZ] gets hole card ['D3', 'S7'], current stack 985
player [Ethan] gets hole card ['HJ', 'H7'], current stack 985
player [HakulaPlayer] gets hole card ['HT', 'C6'], current stack 1093
player [SichengZuo] gets hole card ['CQ', 'CJ'], current stack 985
player [KLChen2PokerPlayer] gets hole card ['S3', 'H9'], current stack 549
player [Jinkun] gets hole card ['C5', 'D6'], current stack 1005
player [NitWinWin] gets hole card ['D4', 'DJ'], current stack 1034
player [ZPlayer] gets hole card ['SK', 'D8'], current stack 1349
Started the round 8
Street "preflop" started. (community card = [])
"HakulaPlayer" declared "fold:0"
"SichengZuo" declared "fold:0"
"KLChen2PokerPlayer" declared "fold:0"
"Jinkun" declared "fold:10"
"NitWinWin" declared "fold:0"
"ZPlayer" declared "raise:15"
"YangZ" declared "fold:0"
"Ethan" declared "fold:0"
"['ZPlayer']" won the round 8 (stack = {'YangZ': 985, 'Ethan': 985, 'HakulaPlayer': 1093, 'SichengZuo': 985, 'KLChen2PokerPlayer': 549, 'Jinkun': 1005, 'NitWinWin': 1034, 'ZPlayer': 1364})
player [YangZ] gets hole card ['S2', 'HQ'], current stack 985
player [Ethan] gets hole card ['DQ', 'C5'], current stack 980
player [HakulaPlayer] gets hole card ['D8', 'HK'], current stack 1083
player [SichengZuo] gets hole card ['C3', 'DA'], current stack 985
player [KLChen2PokerPlayer] gets hole card ['S7', 'H4'], current stack 549
player [Jinkun] gets hole card ['C8', 'HT'], current stack 1005
player [NitWinWin] gets hole card ['SQ', 'H2'], current stack 1034
player [ZPlayer] gets hole card ['C2', 'H9'], current stack 1364
Started the round 9
Street "preflop" started. (community card = [])
"SichengZuo" declared "fold:0"
"KLChen2PokerPlayer" declared "call:10"
"Jinkun" declared "fold:10"
"NitWinWin" declared "fold:0"
"ZPlayer" declared "fold:0"
"YangZ" declared "fold:0"
"Ethan" declared "fold:0"
"HakulaPlayer" declared "call:10"
Street "flop" started. (community card = ['SK', 'D3', 'S3'])
"HakulaPlayer" declared "raise:25"
"KLChen2PokerPlayer" declared "fold:0"
"['HakulaPlayer']" won the round 9 (stack = {'YangZ': 985, 'Ethan': 980, 'HakulaPlayer': 1108, 'SichengZuo': 985, 'KLChen2PokerPlayer': 539, 'Jinkun': 1005, 'NitWinWin': 1034, 'ZPlayer': 1364})
player [YangZ] gets hole card ['H5', 'CK'], current stack 985
player [Ethan] gets hole card ['SK', 'H2'], current stack 980
player [HakulaPlayer] gets hole card ['C2', 'HT'], current stack 1103
player [SichengZuo] gets hole card ['D5', 'H4'], current stack 975
player [KLChen2PokerPlayer] gets hole card ['C5', 'CT'], current stack 539
player [Jinkun] gets hole card ['DQ', 'DT'], current stack 1005
player [NitWinWin] gets hole card ['SA', 'C8'], current stack 1034
player [ZPlayer] gets hole card ['D6', 'CA'], current stack 1364
Started the round 10
Street "preflop" started. (community card = [])
"KLChen2PokerPlayer" declared "call:10"
"Jinkun" declared "fold:10"
"NitWinWin" declared "fold:0"
"ZPlayer" declared "raise:15"
"YangZ" declared "fold:0"
"Ethan" declared "fold:0"
"HakulaPlayer" declared "call:15"
"SichengZuo" declared "fold:0"
"KLChen2PokerPlayer" declared "fold:0"
Street "flop" started. (community card = ['D2', 'D4', 'D3'])
"HakulaPlayer" declared "call:0"
"ZPlayer" declared "call:0"
Street "turn" started. (community card = ['D2', 'D4', 'D3', 'HK'])
"HakulaPlayer" declared "call:0"
"ZPlayer" declared "call:0"
Street "river" started. (community card = ['D2', 'D4', 'D3', 'HK', 'S2'])
"HakulaPlayer" declared "raise:63"
"ZPlayer" declared "fold:0"
"['HakulaPlayer']" won the round 10 (stack = {'YangZ': 985, 'Ethan': 980, 'HakulaPlayer': 1143, 'SichengZuo': 975, 'KLChen2PokerPlayer': 529, 'Jinkun': 1005, 'NitWinWin': 1034, 'ZPlayer': 1349})
player [YangZ] gets hole card ['HA', 'CA'], current stack 985
player [Ethan] gets hole card ['H3', 'H7'], current stack 980
player [HakulaPlayer] gets hole card ['CQ', 'CK'], current stack 1143
player [SichengZuo] gets hole card ['HQ', 'HT'], current stack 970
player [KLChen2PokerPlayer] gets hole card ['D3', 'HJ'], current stack 519
player [Jinkun] gets hole card ['C4', 'S9'], current stack 1005
player [NitWinWin] gets hole card ['ST', 'H8'], current stack 1034
player [ZPlayer] gets hole card ['S4', 'S8'], current stack 1349
Started the round 11
Street "preflop" started. (community card = [])
"Jinkun" declared "fold:10"
"NitWinWin" declared "fold:0"
"ZPlayer" declared "fold:0"
"YangZ" declared "fold:0"
"Ethan" declared "fold:0"
"HakulaPlayer" declared "call:10"
"SichengZuo" declared "fold:0"
"KLChen2PokerPlayer" declared "call:10"
Street "flop" started. (community card = ['S5', 'DJ', 'CT'])
"KLChen2PokerPlayer" declared "raise:28"
"HakulaPlayer" declared "call:28"
Street "turn" started. (community card = ['S5', 'DJ', 'CT', 'CJ'])
"KLChen2PokerPlayer" declared "raise:156"
"HakulaPlayer" declared "fold:0"
"['KLChen2PokerPlayer']" won the round 11 (stack = {'YangZ': 985, 'Ethan': 980, 'HakulaPlayer': 1105, 'SichengZuo': 970, 'KLChen2PokerPlayer': 572, 'Jinkun': 1005, 'NitWinWin': 1034, 'ZPlayer': 1349})
player [YangZ] gets hole card ['D4', 'D6'], current stack 985
player [Ethan] gets hole card ['DJ', 'C7'], current stack 980
player [HakulaPlayer] gets hole card ['H2', 'C8'], current stack 1105
player [SichengZuo] gets hole card ['S8', 'SK'], current stack 970
player [KLChen2PokerPlayer] gets hole card ['SQ', 'H4'], current stack 567
player [Jinkun] gets hole card ['S5', 'HA'], current stack 995
player [NitWinWin] gets hole card ['C4', 'CQ'], current stack 1034
player [ZPlayer] gets hole card ['C9', 'D5'], current stack 1349
Started the round 12
Street "preflop" started. (community card = [])
"NitWinWin" declared "fold:0"
"ZPlayer" declared "call:10"
"YangZ" declared "fold:0"
"Ethan" declared "fold:0"
"HakulaPlayer" declared "fold:0"
"SichengZuo" declared "fold:0"
"KLChen2PokerPlayer" declared "fold:0"
"Jinkun" declared "call:10"
Street "flop" started. (community card = ['ST', 'DK', 'S3'])
"Jinkun" declared "call:0"
"ZPlayer" declared "call:0"
Street "turn" started. (community card = ['ST', 'DK', 'S3', 'S6'])
"Jinkun" declared "call:0"
"ZPlayer" declared "call:0"
Street "river" started. (community card = ['ST', 'DK', 'S3', 'S6', 'D7'])
"Jinkun" declared "call:0"
"ZPlayer" declared "call:0"
"['Jinkun']" won the round 12 (stack = {'YangZ': 985, 'Ethan': 980, 'HakulaPlayer': 1105, 'SichengZuo': 970, 'KLChen2PokerPlayer': 567, 'Jinkun': 1020, 'NitWinWin': 1034, 'ZPlayer': 1339})
player [YangZ] gets hole card ['HQ', 'S3'], current stack 985
player [Ethan] gets hole card ['S2', 'D3'], current stack 980
player [HakulaPlayer] gets hole card ['H6', 'C7'], current stack 1105
player [SichengZuo] gets hole card ['HA', 'S5'], current stack 970
player [KLChen2PokerPlayer] gets hole card ['C5', 'H9'], current stack 567
player [Jinkun] gets hole card ['S7', 'S8'], current stack 1015
player [NitWinWin] gets hole card ['C9', 'D6'], current stack 1024
player [ZPlayer] gets hole card ['SK', 'H4'], current stack 1339
Started the round 13
Street "preflop" started. (community card = [])
"ZPlayer" declared "call:10"
"YangZ" declared "fold:0"
"Ethan" declared "fold:0"
"HakulaPlayer" declared "call:10"
"SichengZuo" declared "fold:0"
"KLChen2PokerPlayer" declared "fold:0"
"Jinkun" declared "call:10"
"NitWinWin" declared "fold:0"
Street "flop" started. (community card = ['CJ', 'H3', 'HT'])
"Jinkun" declared "call:0"
"ZPlayer" declared "call:0"
"HakulaPlayer" declared "call:0"
Street "turn" started. (community card = ['CJ', 'H3', 'HT', 'CT'])
"Jinkun" declared "call:0"
"ZPlayer" declared "call:0"
"HakulaPlayer" declared "call:0"
Street "river" started. (community card = ['CJ', 'H3', 'HT', 'CT', 'H7'])
"Jinkun" declared "call:0"
"ZPlayer" declared "call:0"
"HakulaPlayer" declared "call:0"
"['HakulaPlayer', 'Jinkun']" won the round 13 (stack = {'YangZ': 985, 'Ethan': 980, 'HakulaPlayer': 1115, 'SichengZuo': 970, 'KLChen2PokerPlayer': 567, 'Jinkun': 1030, 'NitWinWin': 1024, 'ZPlayer': 1329})
player [YangZ] gets hole card ['SJ', 'C5'], current stack 985
player [Ethan] gets hole card ['C6', 'C7'], current stack 980
player [HakulaPlayer] gets hole card ['CT', 'DQ'], current stack 1115
player [SichengZuo] gets hole card ['H8', 'DA'], current stack 970
player [KLChen2PokerPlayer] gets hole card ['H6', 'SQ'], current stack 567
player [Jinkun] gets hole card ['DJ', 'HJ'], current stack 1030
player [NitWinWin] gets hole card ['SA', 'D4'], current stack 1019
player [ZPlayer] gets hole card ['ST', 'C4'], current stack 1319
Started the round 14
Street "preflop" started. (community card = [])
"YangZ" declared "fold:0"
"Ethan" declared "fold:0"
"HakulaPlayer" declared "fold:0"
"SichengZuo" declared "fold:0"
"KLChen2PokerPlayer" declared "raise:15"
"Jinkun" declared "fold:15"
"NitWinWin" declared "fold:0"
"ZPlayer" declared "call:15"
Street "flop" started. (community card = ['D8', 'C2', 'H7'])
"ZPlayer" declared "call:0"
"KLChen2PokerPlayer" declared "call:0"
Street "turn" started. (community card = ['D8', 'C2', 'H7', 'D7'])
"ZPlayer" declared "call:0"
"KLChen2PokerPlayer" declared "call:0"
Street "river" started. (community card = ['D8', 'C2', 'H7', 'D7', 'S2'])
"ZPlayer" declared "call:0"
"KLChen2PokerPlayer" declared "call:0"
"['KLChen2PokerPlayer']" won the round 14 (stack = {'YangZ': 985, 'Ethan': 980, 'HakulaPlayer': 1115, 'SichengZuo': 970, 'KLChen2PokerPlayer': 587, 'Jinkun': 1030, 'NitWinWin': 1019, 'ZPlayer': 1314})
player [YangZ] gets hole card ['H7', 'DK'], current stack 975
player [Ethan] gets hole card ['SA', 'DJ'], current stack 980
player [HakulaPlayer] gets hole card ['CA', 'CT'], current stack 1115
player [SichengZuo] gets hole card ['H9', 'SQ'], current stack 970
player [KLChen2PokerPlayer] gets hole card ['SK', 'C6'], current stack 587
player [Jinkun] gets hole card ['HJ', 'HT'], current stack 1030
player [NitWinWin] gets hole card ['H4', 'H6'], current stack 1019
player [ZPlayer] gets hole card ['C4', 'C2'], current stack 1309
Started the round 15
Street "preflop" started. (community card = [])
"Ethan" declared "raise:147"
"HakulaPlayer" declared "fold:0"
"SichengZuo" declared "fold:0"
"KLChen2PokerPlayer" declared "fold:0"
"Jinkun" declared "fold:147"
"NitWinWin" declared "fold:0"
"ZPlayer" declared "fold:0"
"YangZ" declared "fold:0"
"['Ethan']" won the round 15 (stack = {'YangZ': 975, 'Ethan': 995, 'HakulaPlayer': 1115, 'SichengZuo': 970, 'KLChen2PokerPlayer': 587, 'Jinkun': 1030, 'NitWinWin': 1019, 'ZPlayer': 1309})
player [YangZ] gets hole card ['H9', 'D8'], current stack 970
player [Ethan] gets hole card ['D5', 'H3'], current stack 985
player [HakulaPlayer] gets hole card ['HQ', 'SJ'], current stack 1115
player [SichengZuo] gets hole card ['S6', 'CA'], current stack 970
player [KLChen2PokerPlayer] gets hole card ['C3', 'CJ'], current stack 587
player [Jinkun] gets hole card ['HK', 'DJ'], current stack 1030
player [NitWinWin] gets hole card ['D2', 'C7'], current stack 1019
player [ZPlayer] gets hole card ['CT', 'H2'], current stack 1309
Started the round 16
Street "preflop" started. (community card = [])
"HakulaPlayer" declared "fold:0"
"SichengZuo" declared "fold:0"
"KLChen2PokerPlayer" declared "raise:16"
"Jinkun" declared "fold:16"
"NitWinWin" declared "fold:0"
"ZPlayer" declared "call:16"
"YangZ" declared "fold:0"
"Ethan" declared "fold:0"
Street "flop" started. (community card = ['D9', 'S3', 'S2'])
"KLChen2PokerPlayer" declared "raise:16"
"ZPlayer" declared "fold:0"
"['KLChen2PokerPlayer']" won the round 16 (stack = {'YangZ': 970, 'Ethan': 985, 'HakulaPlayer': 1115, 'SichengZuo': 970, 'KLChen2PokerPlayer': 618, 'Jinkun': 1030, 'NitWinWin': 1019, 'ZPlayer': 1293})
player [YangZ] gets hole card ['CA', 'DK'], current stack 970
player [Ethan] gets hole card ['ST', 'H7'], current stack 980
player [HakulaPlayer] gets hole card ['C5', 'CQ'], current stack 1105
player [SichengZuo] gets hole card ['S9', 'C2'], current stack 970
player [KLChen2PokerPlayer] gets hole card ['D3', 'C3'], current stack 618
player [Jinkun] gets hole card ['S4', 'SA'], current stack 1030
player [NitWinWin] gets hole card ['H5', 'CK'], current stack 1019
player [ZPlayer] gets hole card ['SJ', 'CT'], current stack 1293
Started the round 17
Street "preflop" started. (community card = [])
"SichengZuo" declared "fold:0"
"KLChen2PokerPlayer" declared "call:10"
"Jinkun" declared "fold:10"
"NitWinWin" declared "fold:0"
"ZPlayer" declared "raise:15"
"YangZ" declared "fold:0"
"Ethan" declared "fold:0"
"HakulaPlayer" declared "call:15"
"KLChen2PokerPlayer" declared "fold:0"
Street "flop" started. (community card = ['H2', 'C6', 'D2'])
"HakulaPlayer" declared "call:0"
"ZPlayer" declared "call:0"
Street "turn" started. (community card = ['H2', 'C6', 'D2', 'HQ'])
"HakulaPlayer" declared "raise:51"
"ZPlayer" declared "fold:0"
"['HakulaPlayer']" won the round 17 (stack = {'YangZ': 970, 'Ethan': 980, 'HakulaPlayer': 1145, 'SichengZuo': 970, 'KLChen2PokerPlayer': 608, 'Jinkun': 1030, 'NitWinWin': 1019, 'ZPlayer': 1278})
player [YangZ] gets hole card ['C7', 'H8'], current stack 970
player [Ethan] gets hole card ['SQ', 'DT'], current stack 980
player [HakulaPlayer] gets hole card ['ST', 'D8'], current stack 1140
player [SichengZuo] gets hole card ['SA', 'S5'], current stack 960
player [KLChen2PokerPlayer] gets hole card ['H7', 'C8'], current stack 608
player [Jinkun] gets hole card ['CA', 'C9'], current stack 1030
player [NitWinWin] gets hole card ['C6', 'HK'], current stack 1019
player [ZPlayer] gets hole card ['D6', 'SJ'], current stack 1278
Started the round 18
Street "preflop" started. (community card = [])
"KLChen2PokerPlayer" declared "call:10"
"Jinkun" declared "fold:10"
"NitWinWin" declared "fold:0"
"ZPlayer" declared "call:10"
"YangZ" declared "fold:0"
"Ethan" declared "fold:0"
"HakulaPlayer" declared "call:10"
"SichengZuo" declared "fold:0"
Street "flop" started. (community card = ['DQ', 'H5', 'HT'])
"HakulaPlayer" declared "call:0"
"KLChen2PokerPlayer" declared "call:0"
"ZPlayer" declared "call:0"
Street "turn" started. (community card = ['DQ', 'H5', 'HT', 'DA'])
"HakulaPlayer" declared "call:0"
"KLChen2PokerPlayer" declared "call:0"
"ZPlayer" declared "call:0"
Street "river" started. (community card = ['DQ', 'H5', 'HT', 'DA', 'S7'])
"HakulaPlayer" declared "call:0"
"KLChen2PokerPlayer" declared "call:0"
"ZPlayer" declared "call:0"
"['HakulaPlayer']" won the round 18 (stack = {'YangZ': 970, 'Ethan': 980, 'HakulaPlayer': 1175, 'SichengZuo': 960, 'KLChen2PokerPlayer': 598, 'Jinkun': 1030, 'NitWinWin': 1019, 'ZPlayer': 1268})
player [YangZ] gets hole card ['HK', 'ST'], current stack 970
player [Ethan] gets hole card ['SQ', 'SK'], current stack 980
player [HakulaPlayer] gets hole card ['C9', 'S5'], current stack 1175
player [SichengZuo] gets hole card ['C7', 'C3'], current stack 955
player [KLChen2PokerPlayer] gets hole card ['CK', 'D2'], current stack 588
player [Jinkun] gets hole card ['H3', 'S9'], current stack 1030
player [NitWinWin] gets hole card ['D4', 'SA'], current stack 1019
player [ZPlayer] gets hole card ['D9', 'C5'], current stack 1268
Started the round 19
Street "preflop" started. (community card = [])
"Jinkun" declared "fold:10"
"NitWinWin" declared "fold:0"
"ZPlayer" declared "call:10"
"YangZ" declared "fold:0"
"Ethan" declared "raise:147"
"HakulaPlayer" declared "fold:0"
"SichengZuo" declared "fold:0"
"KLChen2PokerPlayer" declared "fold:0"
"ZPlayer" declared "fold:0"
"['Ethan']" won the round 19 (stack = {'YangZ': 970, 'Ethan': 1005, 'HakulaPlayer': 1175, 'SichengZuo': 955, 'KLChen2PokerPlayer': 588, 'Jinkun': 1030, 'NitWinWin': 1019, 'ZPlayer': 1258})
player [YangZ] gets hole card ['H4', 'DA'], current stack 970
player [Ethan] gets hole card ['H3', 'DT'], current stack 1005
player [HakulaPlayer] gets hole card ['C9', 'D7'], current stack 1175
player [SichengZuo] gets hole card ['H6', 'CJ'], current stack 955
player [KLChen2PokerPlayer] gets hole card ['HJ', 'HK'], current stack 583
player [Jinkun] gets hole card ['C4', 'H8'], current stack 1020
player [NitWinWin] gets hole card ['CT', 'CA'], current stack 1019
player [ZPlayer] gets hole card ['D6', 'SA'], current stack 1258
Started the round 20
Street "preflop" started. (community card = [])
"NitWinWin" declared "fold:0"
"ZPlayer" declared "raise:15"
"YangZ" declared "fold:0"
"Ethan" declared "fold:0"
"HakulaPlayer" declared "fold:0"
"SichengZuo" declared "fold:0"
"KLChen2PokerPlayer" declared "raise:20"
"Jinkun" declared "fold:20"
"ZPlayer" declared "call:20"
Street "flop" started. (community card = ['D8', 'SK', 'D3'])
"KLChen2PokerPlayer" declared "raise:36"
"ZPlayer" declared "fold:0"
"['KLChen2PokerPlayer']" won the round 20 (stack = {'YangZ': 970, 'Ethan': 1005, 'HakulaPlayer': 1175, 'SichengZuo': 955, 'KLChen2PokerPlayer': 618, 'Jinkun': 1020, 'NitWinWin': 1019, 'ZPlayer': 1238})
player [YangZ] gets hole card ['HA', 'S9'], current stack 970
player [Ethan] gets hole card ['S6', 'SK'], current stack 1005
player [HakulaPlayer] gets hole card ['C2', 'D7'], current stack 1175
player [SichengZuo] gets hole card ['S8', 'H7'], current stack 955
player [KLChen2PokerPlayer] gets hole card ['D3', 'D5'], current stack 618
player [Jinkun] gets hole card ['H2', 'D4'], current stack 1015
player [NitWinWin] gets hole card ['S2', 'DK'], current stack 1009
player [ZPlayer] gets hole card ['C9', 'C3'], current stack 1238
Started the round 21
Street "preflop" started. (community card = [])
"ZPlayer" declared "call:10"
"YangZ" declared "fold:0"
"Ethan" declared "fold:0"
"HakulaPlayer" declared "fold:0"
"SichengZuo" declared "fold:0"
"KLChen2PokerPlayer" declared "call:10"
"Jinkun" declared "call:10"
"NitWinWin" declared "fold:0"
Street "flop" started. (community card = ['H6', 'CJ', 'D6'])
"Jinkun" declared "call:0"
"ZPlayer" declared "call:0"
"KLChen2PokerPlayer" declared "call:0"
Street "turn" started. (community card = ['H6', 'CJ', 'D6', 'S5'])
"Jinkun" declared "call:0"
"ZPlayer" declared "call:0"
"KLChen2PokerPlayer" declared "call:0"
Street "river" started. (community card = ['H6', 'CJ', 'D6', 'S5', 'CT'])
"Jinkun" declared "call:0"
"ZPlayer" declared "call:0"
"KLChen2PokerPlayer" declared "call:0"
"['KLChen2PokerPlayer']" won the round 21 (stack = {'YangZ': 970, 'Ethan': 1005, 'HakulaPlayer': 1175, 'SichengZuo': 955, 'KLChen2PokerPlayer': 648, 'Jinkun': 1010, 'NitWinWin': 1009, 'ZPlayer': 1228})
player [YangZ] gets hole card ['D4', 'D3'], current stack 970
player [Ethan] gets hole card ['SQ', 'S4'], current stack 1005
player [HakulaPlayer] gets hole card ['DQ', 'S9'], current stack 1175
player [SichengZuo] gets hole card ['ST', 'C2'], current stack 955
player [KLChen2PokerPlayer] gets hole card ['HK', 'S6'], current stack 648
player [Jinkun] gets hole card ['SK', 'D8'], current stack 1010
player [NitWinWin] gets hole card ['H5', 'D6'], current stack 1004
player [ZPlayer] gets hole card ['D7', 'H4'], current stack 1218
Started the round 22
Street "preflop" started. (community card = [])
"YangZ" declared "fold:0"
"Ethan" declared "fold:0"
"HakulaPlayer" declared "call:10"
"SichengZuo" declared "fold:0"
"KLChen2PokerPlayer" declared "call:10"
"Jinkun" declared "fold:10"
"NitWinWin" declared "fold:0"
"ZPlayer" declared "call:10"
Street "flop" started. (community card = ['H9', 'HJ', 'DA'])
"ZPlayer" declared "call:0"
"HakulaPlayer" declared "call:0"
"KLChen2PokerPlayer" declared "call:0"
Street "turn" started. (community card = ['H9', 'HJ', 'DA', 'S3'])
"ZPlayer" declared "call:0"
"HakulaPlayer" declared "call:0"
"KLChen2PokerPlayer" declared "call:0"
Street "river" started. (community card = ['H9', 'HJ', 'DA', 'S3', 'HQ'])
"ZPlayer" declared "call:0"
"HakulaPlayer" declared "raise:41"
"KLChen2PokerPlayer" declared "fold:0"
"ZPlayer" declared "fold:0"
"['HakulaPlayer']" won the round 22 (stack = {'YangZ': 970, 'Ethan': 1005, 'HakulaPlayer': 1200, 'SichengZuo': 955, 'KLChen2PokerPlayer': 638, 'Jinkun': 1010, 'NitWinWin': 1004, 'ZPlayer': 1218})
player [YangZ] gets hole card ['H7', 'D5'], current stack 960
player [Ethan] gets hole card ['DJ', 'S9'], current stack 1005
player [HakulaPlayer] gets hole card ['D9', 'C3'], current stack 1200
player [SichengZuo] gets hole card ['S5', 'CA'], current stack 955
player [KLChen2PokerPlayer] gets hole card ['S8', 'C6'], current stack 638
player [Jinkun] gets hole card ['C7', 'S4'], current stack 1010
player [NitWinWin] gets hole card ['H9', 'HJ'], current stack 1004
player [ZPlayer] gets hole card ['H6', 'CJ'], current stack 1213
Started the round 23
Street "preflop" started. (community card = [])
"Ethan" declared "fold:0"
"HakulaPlayer" declared "fold:0"
"SichengZuo" declared "fold:0"
"KLChen2PokerPlayer" declared "fold:0"
"Jinkun" declared "call:10"
"NitWinWin" declared "fold:0"
"ZPlayer" declared "call:10"
"YangZ" declared "fold:0"
Street "flop" started. (community card = ['CT', 'C4', 'SQ'])
"ZPlayer" declared "call:0"
"Jinkun" declared "call:0"
Street "turn" started. (community card = ['CT', 'C4', 'SQ', 'S2'])
"ZPlayer" declared "call:0"
"Jinkun" declared "call:0"
Street "river" started. (community card = ['CT', 'C4', 'SQ', 'S2', 'C2'])
"ZPlayer" declared "call:0"
"Jinkun" declared "call:0"
"['Jinkun']" won the round 23 (stack = {'YangZ': 960, 'Ethan': 1005, 'HakulaPlayer': 1200, 'SichengZuo': 955, 'KLChen2PokerPlayer': 638, 'Jinkun': 1030, 'NitWinWin': 1004, 'ZPlayer': 1208})
player [YangZ] gets hole card ['S9', 'C2'], current stack 955
player [Ethan] gets hole card ['D4', 'D2'], current stack 995
player [HakulaPlayer] gets hole card ['S4', 'H8'], current stack 1200
player [SichengZuo] gets hole card ['C4', 'CQ'], current stack 955
player [KLChen2PokerPlayer] gets hole card ['H6', 'H3'], current stack 638
player [Jinkun] gets hole card ['H5', 'DQ'], current stack 1030
player [NitWinWin] gets hole card ['SK', 'C5'], current stack 1004
player [ZPlayer] gets hole card ['HK', 'C9'], current stack 1208
Started the round 24
Street "preflop" started. (community card = [])
"HakulaPlayer" declared "fold:0"
"SichengZuo" declared "fold:0"
"KLChen2PokerPlayer" declared "fold:0"
"Jinkun" declared "fold:10"
"NitWinWin" declared "fold:0"
"ZPlayer" declared "raise:15"
"YangZ" declared "fold:0"
"Ethan" declared "fold:0"
"['ZPlayer']" won the round 24 (stack = {'YangZ': 955, 'Ethan': 995, 'HakulaPlayer': 1200, 'SichengZuo': 955, 'KLChen2PokerPlayer': 638, 'Jinkun': 1030, 'NitWinWin': 1004, 'ZPlayer': 1223})
player [YangZ] gets hole card ['H3', 'S9'], current stack 955
player [Ethan] gets hole card ['HK', 'CJ'], current stack 990
player [HakulaPlayer] gets hole card ['SQ', 'SJ'], current stack 1190
player [SichengZuo] gets hole card ['H9', 'H6'], current stack 955
player [KLChen2PokerPlayer] gets hole card ['D2', 'H4'], current stack 638
player [Jinkun] gets hole card ['CK', 'HJ'], current stack 1030
player [NitWinWin] gets hole card ['DA', 'S8'], current stack 1004
player [ZPlayer] gets hole card ['C7', 'SA'], current stack 1223
Started the round 25
Street "preflop" started. (community card = [])
"SichengZuo" declared "fold:0"
"KLChen2PokerPlayer" declared "fold:0"
"Jinkun" declared "fold:10"
"NitWinWin" declared "fold:0"
"ZPlayer" declared "raise:15"
"YangZ" declared "fold:0"
"Ethan" declared "raise:149"
"HakulaPlayer" declared "fold:0"
"ZPlayer" declared "fold:0"
"['Ethan']" won the round 25 (stack = {'YangZ': 955, 'Ethan': 1020, 'HakulaPlayer': 1190, 'SichengZuo': 955, 'KLChen2PokerPlayer': 638, 'Jinkun': 1030, 'NitWinWin': 1004, 'ZPlayer': 1208})
player [YangZ] gets hole card ['DQ', 'S2'], current stack 955
player [Ethan] gets hole card ['D6', 'D3'], current stack 1020
player [HakulaPlayer] gets hole card ['DA', 'C2'], current stack 1185
player [SichengZuo] gets hole card ['C9', 'D8'], current stack 945
player [KLChen2PokerPlayer] gets hole card ['D7', 'H5'], current stack 638
player [Jinkun] gets hole card ['CA', 'CQ'], current stack 1030
player [NitWinWin] gets hole card ['HA', 'SJ'], current stack 1004
player [ZPlayer] gets hole card ['S4', 'D5'], current stack 1208
Started the round 26
Street "preflop" started. (community card = [])
"KLChen2PokerPlayer" declared "fold:0"
"Jinkun" declared "fold:10"
"NitWinWin" declared "fold:0"
"ZPlayer" declared "call:10"
"YangZ" declared "fold:0"
"Ethan" declared "fold:0"
"HakulaPlayer" declared "call:10"
"SichengZuo" declared "fold:0"
Street "flop" started. (community card = ['HQ', 'SK', 'H9'])
"HakulaPlayer" declared "call:0"
"ZPlayer" declared "call:0"
Street "turn" started. (community card = ['HQ', 'SK', 'H9', 'S6'])
"HakulaPlayer" declared "call:0"
"ZPlayer" declared "call:0"
Street "river" started. (community card = ['HQ', 'SK', 'H9', 'S6', 'C6'])
"HakulaPlayer" declared "call:0"
"ZPlayer" declared "call:0"
"['HakulaPlayer']" won the round 26 (stack = {'YangZ': 955, 'Ethan': 1020, 'HakulaPlayer': 1210, 'SichengZuo': 945, 'KLChen2PokerPlayer': 638, 'Jinkun': 1030, 'NitWinWin': 1004, 'ZPlayer': 1198})
player [YangZ] gets hole card ['D2', 'C6'], current stack 955
player [Ethan] gets hole card ['SA', 'CT'], current stack 1020
player [HakulaPlayer] gets hole card ['H5', 'CA'], current stack 1210
player [SichengZuo] gets hole card ['DK', 'S5'], current stack 940
player [KLChen2PokerPlayer] gets hole card ['CJ', 'HQ'], current stack 628
player [Jinkun] gets hole card ['C8', 'SJ'], current stack 1030
player [NitWinWin] gets hole card ['DQ', 'ST'], current stack 1004
player [ZPlayer] gets hole card ['S8', 'S6'], current stack 1198
Started the round 27
Street "preflop" started. (community card = [])
"Jinkun" declared "fold:10"
"NitWinWin" declared "fold:0"
"ZPlayer" declared "raise:15"
"YangZ" declared "fold:0"
"Ethan" declared "call:15"
"HakulaPlayer" declared "call:15"
"SichengZuo" declared "fold:0"
"KLChen2PokerPlayer" declared "raise:20"
"ZPlayer" declared "call:20"
"Ethan" declared "call:20"
"HakulaPlayer" declared "call:20"
Street "flop" started. (community card = ['H3', 'D3', 'HA'])
"KLChen2PokerPlayer" declared "call:0"
"ZPlayer" declared "call:0"
"Ethan" declared "call:0"
"HakulaPlayer" declared "call:0"
Street "turn" started. (community card = ['H3', 'D3', 'HA', 'DA'])
"KLChen2PokerPlayer" declared "call:0"
"ZPlayer" declared "call:0"
"Ethan" declared "raise:85"
"HakulaPlayer" declared "raise:280"
"KLChen2PokerPlayer" declared "fold:0"
"ZPlayer" declared "fold:0"
"Ethan" declared "call:280"
Street "river" started. (community card = ['H3', 'D3', 'HA', 'DA', 'C9'])
"Ethan" declared "raise:720"
"HakulaPlayer" declared "call:720"
"['Ethan', 'HakulaPlayer']" won the round 27 (stack = {'YangZ': 955, 'Ethan': 1042, 'HakulaPlayer': 1232, 'SichengZuo': 940, 'KLChen2PokerPlayer': 618, 'Jinkun': 1030, 'NitWinWin': 1004, 'ZPlayer': 1178})
player [YangZ] gets hole card ['C3', 'S5'], current stack 955
player [Ethan] gets hole card ['H7', 'C5'], current stack 1042
player [HakulaPlayer] gets hole card ['D8', 'S6'], current stack 1232
player [SichengZuo] gets hole card ['C8', 'S4'], current stack 940
player [KLChen2PokerPlayer] gets hole card ['D6', 'H9'], current stack 613
player [Jinkun] gets hole card ['CK', 'DK'], current stack 1020
player [NitWinWin] gets hole card ['D5', 'H4'], current stack 1004
player [ZPlayer] gets hole card ['C9', 'ST'], current stack 1178
Started the round 28
Street "preflop" started. (community card = [])
"NitWinWin" declared "fold:0"
"ZPlayer" declared "raise:15"
"YangZ" declared "fold:0"
"Ethan" declared "fold:0"
"HakulaPlayer" declared "fold:0"
"SichengZuo" declared "fold:0"
"KLChen2PokerPlayer" declared "fold:0"
"Jinkun" declared "call:15"
Street "flop" started. (community card = ['S3', 'D4', 'C6'])
"Jinkun" declared "call:0"
"ZPlayer" declared "call:0"
Street "turn" started. (community card = ['S3', 'D4', 'C6', 'DA'])
"Jinkun" declared "call:0"
"ZPlayer" declared "call:0"
Street "river" started. (community card = ['S3', 'D4', 'C6', 'DA', 'DT'])
"Jinkun" declared "call:0"
"ZPlayer" declared "raise:10"
"Jinkun" declared "call:10"
"['Jinkun']" won the round 28 (stack = {'YangZ': 955, 'Ethan': 1042, 'HakulaPlayer': 1232, 'SichengZuo': 940, 'KLChen2PokerPlayer': 613, 'Jinkun': 1060, 'NitWinWin': 1004, 'ZPlayer': 1153})
player [YangZ] gets hole card ['SQ', 'H4'], current stack 955
player [Ethan] gets hole card ['S7', 'D5'], current stack 1042
player [HakulaPlayer] gets hole card ['D7', 'CA'], current stack 1232
player [SichengZuo] gets hole card ['H9', 'C8'], current stack 940
player [KLChen2PokerPlayer] gets hole card ['HJ', 'S5'], current stack 613
player [Jinkun] gets hole card ['SK', 'H7'], current stack 1055
player [NitWinWin] gets hole card ['C9', 'S2'], current stack 994
player [ZPlayer] gets hole card ['ST', 'HQ'], current stack 1153
Started the round 29
Street "preflop" started. (community card = [])
"ZPlayer" declared "raise:15"
"YangZ" declared "fold:0"
"Ethan" declared "fold:0"
"HakulaPlayer" declared "call:15"
"SichengZuo" declared "fold:0"
"KLChen2PokerPlayer" declared "fold:0"
"Jinkun" declared "fold:15"
"NitWinWin" declared "fold:0"
Street "flop" started. (community card = ['HK', 'HA', 'D6'])
"ZPlayer" declared "call:0"
"HakulaPlayer" declared "raise:54"
"ZPlayer" declared "fold:0"
"['HakulaPlayer']" won the round 29 (stack = {'YangZ': 955, 'Ethan': 1042, 'HakulaPlayer': 1262, 'SichengZuo': 940, 'KLChen2PokerPlayer': 613, 'Jinkun': 1055, 'NitWinWin': 994, 'ZPlayer': 1138})
player [YangZ] gets hole card ['ST', 'SQ'], current stack 955
player [Ethan] gets hole card ['C7', 'H5'], current stack 1042
player [HakulaPlayer] gets hole card ['D3', 'C2'], current stack 1262
player [SichengZuo] gets hole card ['D5', 'H7'], current stack 940
player [KLChen2PokerPlayer] gets hole card ['C3', 'C4'], current stack 613
player [Jinkun] gets hole card ['C8', 'H6'], current stack 1055
player [NitWinWin] gets hole card ['H8', 'HQ'], current stack 989
player [ZPlayer] gets hole card ['HA', 'HT'], current stack 1128
Started the round 30
Street "preflop" started. (community card = [])
"YangZ" declared "fold:0"
"Ethan" declared "fold:0"
"HakulaPlayer" declared "fold:0"
"SichengZuo" declared "fold:0"
"KLChen2PokerPlayer" declared "raise:19"
"Jinkun" declared "fold:19"
"NitWinWin" declared "fold:0"
"ZPlayer" declared "call:19"
Street "flop" started. (community card = ['CJ', 'CA', 'SJ'])
"ZPlayer" declared "raise:21"
"KLChen2PokerPlayer" declared "fold:0"
"['ZPlayer']" won the round 30 (stack = {'YangZ': 955, 'Ethan': 1042, 'HakulaPlayer': 1262, 'SichengZuo': 940, 'KLChen2PokerPlayer': 594, 'Jinkun': 1055, 'NitWinWin': 989, 'ZPlayer': 1162})
player [YangZ] gets hole card ['SK', 'D9'], current stack 945
player [Ethan] gets hole card ['HA', 'H8'], current stack 1042
player [HakulaPlayer] gets hole card ['HJ', 'S8'], current stack 1262
player [SichengZuo] gets hole card ['S5', 'C3'], current stack 940
player [KLChen2PokerPlayer] gets hole card ['H7', 'CJ'], current stack 594
player [Jinkun] gets hole card ['H4', 'CT'], current stack 1055
player [NitWinWin] gets hole card ['S9', 'S7'], current stack 989
player [ZPlayer] gets hole card ['D3', 'S2'], current stack 1157
Started the round 31
Street "preflop" started. (community card = [])
"Ethan" declared "fold:0"
"HakulaPlayer" declared "fold:0"
"SichengZuo" declared "fold:0"
"KLChen2PokerPlayer" declared "fold:0"
"Jinkun" declared "call:10"
"NitWinWin" declared "fold:0"
"ZPlayer" declared "call:10"
"YangZ" declared "fold:0"
Street "flop" started. (community card = ['H9', 'ST', 'D2'])
"ZPlayer" declared "raise:10"
"Jinkun" declared "call:10"
Street "turn" started. (community card = ['H9', 'ST', 'D2', 'H6'])
"ZPlayer" declared "call:0"
"Jinkun" declared "call:0"
Street "river" started. (community card = ['H9', 'ST', 'D2', 'H6', 'D6'])
"ZPlayer" declared "call:0"
"Jinkun" declared "raise:20"
"ZPlayer" declared "fold:0"
"['Jinkun']" won the round 31 (stack = {'YangZ': 945, 'Ethan': 1042, 'HakulaPlayer': 1262, 'SichengZuo': 940, 'KLChen2PokerPlayer': 594, 'Jinkun': 1085, 'NitWinWin': 989, 'ZPlayer': 1142})
player [YangZ] gets hole card ['H7', 'C6'], current stack 940
player [Ethan] gets hole card ['HA', 'S7'], current stack 1032
player [HakulaPlayer] gets hole card ['H2', 'DQ'], current stack 1262
player [SichengZuo] gets hole card ['H3', 'H8'], current stack 940
player [KLChen2PokerPlayer] gets hole card ['D6', 'C9'], current stack 594
player [Jinkun] gets hole card ['HJ', 'SJ'], current stack 1085
player [NitWinWin] gets hole card ['DJ', 'S3'], current stack 989
player [ZPlayer] gets hole card ['CJ', 'SA'], current stack 1142
Started the round 32
Street "preflop" started. (community card = [])
"HakulaPlayer" declared "fold:0"
"SichengZuo" declared "fold:0"
"KLChen2PokerPlayer" declared "fold:0"
"Jinkun" declared "fold:10"
"NitWinWin" declared "fold:0"
"ZPlayer" declared "raise:15"
"YangZ" declared "fold:0"
"Ethan" declared "call:15"
Street "flop" started. (community card = ['CT', 'C2', 'CQ'])
"Ethan" declared "call:0"
"ZPlayer" declared "raise:10"
"Ethan" declared "fold:0"
"['ZPlayer']" won the round 32 (stack = {'YangZ': 940, 'Ethan': 1027, 'HakulaPlayer': 1262, 'SichengZuo': 940, 'KLChen2PokerPlayer': 594, 'Jinkun': 1085, 'NitWinWin': 989, 'ZPlayer': 1162})
player [YangZ] gets hole card ['DA', 'H7'], current stack 940
player [Ethan] gets hole card ['S9', 'SQ'], current stack 1022
player [HakulaPlayer] gets hole card ['D2', 'H6'], current stack 1252
player [SichengZuo] gets hole card ['D8', 'D5'], current stack 940
player [KLChen2PokerPlayer] gets hole card ['CQ', 'H4'], current stack 594
player [Jinkun] gets hole card ['HT', 'D7'], current stack 1085
player [NitWinWin] gets hole card ['S8', 'SJ'], current stack 989
player [ZPlayer] gets hole card ['C6', 'H5'], current stack 1162
Started the round 33
Street "preflop" started. (community card = [])
"SichengZuo" declared "fold:0"
"KLChen2PokerPlayer" declared "fold:0"
"Jinkun" declared "fold:10"
"NitWinWin" declared "fold:0"
"ZPlayer" declared "call:10"
"YangZ" declared "fold:0"
"Ethan" declared "call:10"
"HakulaPlayer" declared "call:10"
Street "flop" started. (community card = ['ST', 'CJ', 'CA'])
"Ethan" declared "call:0"
"HakulaPlayer" declared "call:0"
"ZPlayer" declared "call:0"
Street "turn" started. (community card = ['ST', 'CJ', 'CA', 'HK'])
"Ethan" declared "raise:30"
"HakulaPlayer" declared "fold:0"
"ZPlayer" declared "fold:0"
"['Ethan']" won the round 33 (stack = {'YangZ': 940, 'Ethan': 1047, 'HakulaPlayer': 1252, 'SichengZuo': 940, 'KLChen2PokerPlayer': 594, 'Jinkun': 1085, 'NitWinWin': 989, 'ZPlayer': 1152})
player [YangZ] gets hole card ['H5', 'DA'], current stack 940
player [Ethan] gets hole card ['D5', 'C2'], current stack 1047
player [HakulaPlayer] gets hole card ['C5', 'CK'], current stack 1247
player [SichengZuo] gets hole card ['HK', 'S8'], current stack 930
player [KLChen2PokerPlayer] gets hole card ['CA', 'S4'], current stack 594
player [Jinkun] gets hole card ['CJ', 'DK'], current stack 1085
player [NitWinWin] gets hole card ['C3', 'SA'], current stack 989
player [ZPlayer] gets hole card ['D7', 'D3'], current stack 1152
Started the round 34
Street "preflop" started. (community card = [])
"KLChen2PokerPlayer" declared "raise:15"
"Jinkun" declared "fold:15"
"NitWinWin" declared "fold:0"
"ZPlayer" declared "call:15"
"YangZ" declared "fold:0"
"Ethan" declared "fold:0"
"HakulaPlayer" declared "call:15"
"SichengZuo" declared "fold:0"
Street "flop" started. (community card = ['H6', 'H9', 'S7'])
"HakulaPlayer" declared "call:0"
"KLChen2PokerPlayer" declared "call:0"
"ZPlayer" declared "call:0"
Street "turn" started. (community card = ['H6', 'H9', 'S7', 'S9'])
"HakulaPlayer" declared "call:0"
"KLChen2PokerPlayer" declared "call:0"
"ZPlayer" declared "raise:27"
"HakulaPlayer" declared "fold:0"
"KLChen2PokerPlayer" declared "fold:0"
"['ZPlayer']" won the round 34 (stack = {'YangZ': 940, 'Ethan': 1047, 'HakulaPlayer': 1237, 'SichengZuo': 930, 'KLChen2PokerPlayer': 579, 'Jinkun': 1085, 'NitWinWin': 989, 'ZPlayer': 1192})
player [YangZ] gets hole card ['D8', 'SK'], current stack 940
player [Ethan] gets hole card ['C8', 'H2'], current stack 1047
player [HakulaPlayer] gets hole card ['CA', 'DT'], current stack 1237
player [SichengZuo] gets hole card ['D2', 'S5'], current stack 925
player [KLChen2PokerPlayer] gets hole card ['ST', 'D5'], current stack 569
player [Jinkun] gets hole card ['DJ', 'D6'], current stack 1085
player [NitWinWin] gets hole card ['S6', 'S2'], current stack 989
player [ZPlayer] gets hole card ['S4', 'H7'], current stack 1192
Started the round 35
Street "preflop" started. (community card = [])
"Jinkun" declared "fold:10"
"NitWinWin" declared "fold:0"
"ZPlayer" declared "call:10"
"YangZ" declared "fold:0"
"Ethan" declared "fold:0"
"HakulaPlayer" declared "raise:39"
"SichengZuo" declared "fold:0"
"KLChen2PokerPlayer" declared "fold:0"
"ZPlayer" declared "fold:0"
"['HakulaPlayer']" won the round 35 (stack = {'YangZ': 940, 'Ethan': 1047, 'HakulaPlayer': 1262, 'SichengZuo': 925, 'KLChen2PokerPlayer': 569, 'Jinkun': 1085, 'NitWinWin': 989, 'ZPlayer': 1182})
player [YangZ] gets hole card ['H8', 'H2'], current stack 940
player [Ethan] gets hole card ['C9', 'S7'], current stack 1047
player [HakulaPlayer] gets hole card ['CK', 'D9'], current stack 1262
player [SichengZuo] gets hole card ['C3', 'HT'], current stack 925
player [KLChen2PokerPlayer] gets hole card ['H9', 'C5'], current stack 564
player [Jinkun] gets hole card ['C7', 'SK'], current stack 1075
player [NitWinWin] gets hole card ['D4', 'HQ'], current stack 989
player [ZPlayer] gets hole card ['CA', 'HA'], current stack 1182
Started the round 36
Street "preflop" started. (community card = [])
"NitWinWin" declared "fold:0"
"ZPlayer" declared "raise:15"
"YangZ" declared "fold:0"
"Ethan" declared "fold:0"
"HakulaPlayer" declared "call:15"
"SichengZuo" declared "fold:0"
"KLChen2PokerPlayer" declared "fold:0"
"Jinkun" declared "call:15"
Street "flop" started. (community card = ['C8', 'DQ', 'H3'])
"Jinkun" declared "call:0"
"ZPlayer" declared "raise:314"
"HakulaPlayer" declared "fold:0"
"Jinkun" declared "fold:314"
"['ZPlayer']" won the round 36 (stack = {'YangZ': 940, 'Ethan': 1047, 'HakulaPlayer': 1247, 'SichengZuo': 925, 'KLChen2PokerPlayer': 564, 'Jinkun': 1070, 'NitWinWin': 989, 'ZPlayer': 1217})
player [YangZ] gets hole card ['H6', 'CT'], current stack 940
player [Ethan] gets hole card ['D6', 'C2'], current stack 1047
player [HakulaPlayer] gets hole card ['DT', 'DQ'], current stack 1247
player [SichengZuo] gets hole card ['C8', 'SK'], current stack 925
player [KLChen2PokerPlayer] gets hole card ['C5', 'S2'], current stack 564
player [Jinkun] gets hole card ['D4', 'ST'], current stack 1065
player [NitWinWin] gets hole card ['D5', 'S8'], current stack 979
player [ZPlayer] gets hole card ['H5', 'S6'], current stack 1217
Started the round 37
Street "preflop" started. (community card = [])
"ZPlayer" declared "call:10"
"YangZ" declared "fold:0"
"Ethan" declared "fold:0"
"HakulaPlayer" declared "call:10"
"SichengZuo" declared "fold:0"
"KLChen2PokerPlayer" declared "call:10"
"Jinkun" declared "fold:10"
"NitWinWin" declared "fold:0"
Street "flop" started. (community card = ['H2', 'D2', 'DJ'])
"ZPlayer" declared "call:0"
"HakulaPlayer" declared "call:0"
"KLChen2PokerPlayer" declared "raise:28"
"ZPlayer" declared "fold:0"
"HakulaPlayer" declared "call:28"
Street "turn" started. (community card = ['H2', 'D2', 'DJ', 'H3'])
"HakulaPlayer" declared "call:0"
"KLChen2PokerPlayer" declared "raise:145"
"HakulaPlayer" declared "fold:0"
"['KLChen2PokerPlayer']" won the round 37 (stack = {'YangZ': 940, 'Ethan': 1047, 'HakulaPlayer': 1209, 'SichengZuo': 925, 'KLChen2PokerPlayer': 627, 'Jinkun': 1065, 'NitWinWin': 979, 'ZPlayer': 1207})
player [YangZ] gets hole card ['CQ', 'ST'], current stack 940
player [Ethan] gets hole card ['D5', 'HA'], current stack 1047
player [HakulaPlayer] gets hole card ['C2', 'C3'], current stack 1209
player [SichengZuo] gets hole card ['H8', 'S6'], current stack 925
player [KLChen2PokerPlayer] gets hole card ['S3', 'H2'], current stack 627
player [Jinkun] gets hole card ['DA', 'S5'], current stack 1065
player [NitWinWin] gets hole card ['CT', 'S4'], current stack 974
player [ZPlayer] gets hole card ['S9', 'H7'], current stack 1197
Started the round 38
Street "preflop" started. (community card = [])
"YangZ" declared "fold:0"
"Ethan" declared "fold:0"
"HakulaPlayer" declared "fold:0"
"SichengZuo" declared "fold:0"
"KLChen2PokerPlayer" declared "fold:0"
"Jinkun" declared "call:10"
"NitWinWin" declared "fold:0"
"ZPlayer" declared "call:10"
Street "flop" started. (community card = ['C4', 'D6', 'SK'])
"ZPlayer" declared "call:0"
"Jinkun" declared "call:0"
Street "turn" started. (community card = ['C4', 'D6', 'SK', 'CK'])
"ZPlayer" declared "call:0"
"Jinkun" declared "call:0"
Street "river" started. (community card = ['C4', 'D6', 'SK', 'CK', 'H5'])
"ZPlayer" declared "call:0"
"Jinkun" declared "call:0"
"['Jinkun']" won the round 38 (stack = {'YangZ': 940, 'Ethan': 1047, 'HakulaPlayer': 1209, 'SichengZuo': 925, 'KLChen2PokerPlayer': 627, 'Jinkun': 1080, 'NitWinWin': 974, 'ZPlayer': 1197})
player [YangZ] gets hole card ['D6', 'S4'], current stack 930
player [Ethan] gets hole card ['S9', 'S5'], current stack 1047
player [HakulaPlayer] gets hole card ['D3', 'H6'], current stack 1209
player [SichengZuo] gets hole card ['C7', 'D5'], current stack 925
player [KLChen2PokerPlayer] gets hole card ['D7', 'DJ'], current stack 627
player [Jinkun] gets hole card ['H9', 'CJ'], current stack 1080
player [NitWinWin] gets hole card ['S3', 'D4'], current stack 974
player [ZPlayer] gets hole card ['H4', 'SJ'], current stack 1192
Started the round 39
Street "preflop" started. (community card = [])
"Ethan" declared "fold:0"
"HakulaPlayer" declared "fold:0"
"SichengZuo" declared "fold:0"
"KLChen2PokerPlayer" declared "raise:19"
"Jinkun" declared "fold:19"
"NitWinWin" declared "fold:0"
"ZPlayer" declared "call:19"
"YangZ" declared "fold:0"
Street "flop" started. (community card = ['HJ', 'CA', 'SA'])
"ZPlayer" declared "raise:1144"
"KLChen2PokerPlayer" declared "call:1144"
Street "turn" started. (community card = ['HJ', 'CA', 'SA', 'CK'])
Street "river" started. (community card = ['HJ', 'CA', 'SA', 'CK', 'HT'])
"['KLChen2PokerPlayer', 'ZPlayer']" won the round 39 (stack = {'YangZ': 930, 'Ethan': 1047, 'HakulaPlayer': 1209, 'SichengZuo': 925, 'KLChen2PokerPlayer': 632, 'Jinkun': 1080, 'NitWinWin': 974, 'ZPlayer': 1202})
player [YangZ] gets hole card ['S6', 'C2'], current stack 925
player [Ethan] gets hole card ['CQ', 'C3'], current stack 1037
player [HakulaPlayer] gets hole card ['C7', 'HJ'], current stack 1209
player [SichengZuo] gets hole card ['S4', 'ST'], current stack 925
player [KLChen2PokerPlayer] gets hole card ['D8', 'HT'], current stack 632
player [Jinkun] gets hole card ['C4', 'S8'], current stack 1080
player [NitWinWin] gets hole card ['H8', 'SJ'], current stack 974
player [ZPlayer] gets hole card ['DQ', 'C6'], current stack 1202
Started the round 40
Street "preflop" started. (community card = [])
"HakulaPlayer" declared "fold:0"
"SichengZuo" declared "fold:0"
"KLChen2PokerPlayer" declared "raise:15"
"Jinkun" declared "fold:15"
"NitWinWin" declared "fold:0"
"ZPlayer" declared "call:15"
"YangZ" declared "fold:0"
"Ethan" declared "fold:0"
Street "flop" started. (community card = ['HA', 'H5', 'D3'])
"KLChen2PokerPlayer" declared "call:0"
"ZPlayer" declared "call:0"
Street "turn" started. (community card = ['HA', 'H5', 'D3', 'H4'])
"KLChen2PokerPlayer" declared "call:0"
"ZPlayer" declared "call:0"
Street "river" started. (community card = ['HA', 'H5', 'D3', 'H4', 'D6'])
"KLChen2PokerPlayer" declared "call:0"
"ZPlayer" declared "call:0"
"['ZPlayer']" won the round 40 (stack = {'YangZ': 925, 'Ethan': 1037, 'HakulaPlayer': 1209, 'SichengZuo': 925, 'KLChen2PokerPlayer': 617, 'Jinkun': 1080, 'NitWinWin': 974, 'ZPlayer': 1232})
player [YangZ] gets hole card ['S3', 'H8'], current stack 925
player [Ethan] gets hole card ['D5', 'DJ'], current stack 1032
player [HakulaPlayer] gets hole card ['D3', 'SJ'], current stack 1199
player [SichengZuo] gets hole card ['HJ', 'S6'], current stack 925
player [KLChen2PokerPlayer] gets hole card ['HT', 'CT'], current stack 617
player [Jinkun] gets hole card ['H3', 'DT'], current stack 1080
player [NitWinWin] gets hole card ['CQ', 'DQ'], current stack 974
player [ZPlayer] gets hole card ['S2', 'HK'], current stack 1232
Started the round 41
Street "preflop" started. (community card = [])
"SichengZuo" declared "fold:0"
"KLChen2PokerPlayer" declared "raise:19"
"Jinkun" declared "fold:19"
"NitWinWin" declared "raise:974"
"ZPlayer" declared "fold:0"
"YangZ" declared "fold:0"
"Ethan" declared "fold:0"
"HakulaPlayer" declared "fold:0"
"KLChen2PokerPlayer" declared "fold:0"
"['NitWinWin']" won the round 41 (stack = {'YangZ': 925, 'Ethan': 1032, 'HakulaPlayer': 1199, 'SichengZuo': 925, 'KLChen2PokerPlayer': 598, 'Jinkun': 1080, 'NitWinWin': 1008, 'ZPlayer': 1232})
player [YangZ] gets hole card ['HK', 'CK'], current stack 925
player [Ethan] gets hole card ['C7', 'DK'], current stack 1032
player [HakulaPlayer] gets hole card ['D5', 'HJ'], current stack 1194
player [SichengZuo] gets hole card ['C4', 'D4'], current stack 915
player [KLChen2PokerPlayer] gets hole card ['SJ', 'H9'], current stack 598
player [Jinkun] gets hole card ['C2', 'D6'], current stack 1080
player [NitWinWin] gets hole card ['S5', 'C3'], current stack 1008
player [ZPlayer] gets hole card ['S2', 'D2'], current stack 1232
Started the round 42
Street "preflop" started. (community card = [])
"KLChen2PokerPlayer" declared "raise:22"
"Jinkun" declared "fold:22"
"NitWinWin" declared "fold:0"
"ZPlayer" declared "call:22"
"YangZ" declared "fold:0"
"Ethan" declared "fold:0"
"HakulaPlayer" declared "call:22"
"SichengZuo" declared "fold:0"
Street "flop" started. (community card = ['H5', 'H3', 'D9'])
"HakulaPlayer" declared "call:0"
"KLChen2PokerPlayer" declared "raise:22"
"ZPlayer" declared "fold:0"
"HakulaPlayer" declared "call:22"
Street "turn" started. (community card = ['H5', 'H3', 'D9', 'D3'])
"HakulaPlayer" declared "call:0"
"KLChen2PokerPlayer" declared "raise:115"
"HakulaPlayer" declared "fold:0"
"['KLChen2PokerPlayer']" won the round 42 (stack = {'YangZ': 925, 'Ethan': 1032, 'HakulaPlayer': 1155, 'SichengZuo': 915, 'KLChen2PokerPlayer': 674, 'Jinkun': 1080, 'NitWinWin': 1008, 'ZPlayer': 1210})
player [YangZ] gets hole card ['C7', 'D2'], current stack 925
player [Ethan] gets hole card ['HJ', 'H5'], current stack 1032
player [HakulaPlayer] gets hole card ['SQ', 'H3'], current stack 1155
player [SichengZuo] gets hole card ['H2', 'H4'], current stack 910
player [KLChen2PokerPlayer] gets hole card ['S7', 'DQ'], current stack 664
player [Jinkun] gets hole card ['H8', 'S4'], current stack 1080
player [NitWinWin] gets hole card ['C4', 'H7'], current stack 1008
player [ZPlayer] gets hole card ['DT', 'S6'], current stack 1210
Started the round 43
Street "preflop" started. (community card = [])
"Jinkun" declared "fold:10"
"NitWinWin" declared "fold:0"
"ZPlayer" declared "call:10"
"YangZ" declared "fold:0"
"Ethan" declared "fold:0"
"HakulaPlayer" declared "call:10"
"SichengZuo" declared "fold:0"
"KLChen2PokerPlayer" declared "call:10"
Street "flop" started. (community card = ['DJ', 'S5', 'CT'])
"KLChen2PokerPlayer" declared "call:0"
"ZPlayer" declared "raise:17"
"HakulaPlayer" declared "fold:0"
"KLChen2PokerPlayer" declared "fold:0"
"['ZPlayer']" won the round 43 (stack = {'YangZ': 925, 'Ethan': 1032, 'HakulaPlayer': 1145, 'SichengZuo': 910, 'KLChen2PokerPlayer': 664, 'Jinkun': 1080, 'NitWinWin': 1008, 'ZPlayer': 1235})
player [YangZ] gets hole card ['H2', 'H6'], current stack 925
player [Ethan] gets hole card ['H8', 'S7'], current stack 1032
player [HakulaPlayer] gets hole card ['C7', 'C8'], current stack 1145
player [SichengZuo] gets hole card ['DQ', 'H5'], current stack 910
player [KLChen2PokerPlayer] gets hole card ['HT', 'D6'], current stack 659
player [Jinkun] gets hole card ['D9', 'CT'], current stack 1070
player [NitWinWin] gets hole card ['SJ', 'D4'], current stack 1008
player [ZPlayer] gets hole card ['S9', 'DK'], current stack 1235
Started the round 44
Street "preflop" started. (community card = [])
"NitWinWin" declared "fold:0"
"ZPlayer" declared "raise:15"
"YangZ" declared "fold:0"
"Ethan" declared "fold:0"
"HakulaPlayer" declared "fold:0"
"SichengZuo" declared "fold:0"
"KLChen2PokerPlayer" declared "fold:0"
"Jinkun" declared "call:15"
Street "flop" started. (community card = ['C5', 'S4', 'SQ'])
"Jinkun" declared "call:0"
"ZPlayer" declared "call:0"
Street "turn" started. (community card = ['C5', 'S4', 'SQ', 'HQ'])
"Jinkun" declared "call:0"
"ZPlayer" declared "call:0"
Street "river" started. (community card = ['C5', 'S4', 'SQ', 'HQ', 'C2'])
"Jinkun" declared "call:0"
"ZPlayer" declared "call:0"
"['ZPlayer']" won the round 44 (stack = {'YangZ': 925, 'Ethan': 1032, 'HakulaPlayer': 1145, 'SichengZuo': 910, 'KLChen2PokerPlayer': 659, 'Jinkun': 1065, 'NitWinWin': 1008, 'ZPlayer': 1255})
player [YangZ] gets hole card ['D5', 'C9'], current stack 925
player [Ethan] gets hole card ['S7', 'C5'], current stack 1032
player [HakulaPlayer] gets hole card ['HT', 'C7'], current stack 1145
player [SichengZuo] gets hole card ['SQ', 'S2'], current stack 910
player [KLChen2PokerPlayer] gets hole card ['H6', 'H5'], current stack 659
player [Jinkun] gets hole card ['C4', 'ST'], current stack 1060
player [NitWinWin] gets hole card ['SK', 'HJ'], current stack 998
player [ZPlayer] gets hole card ['H9', 'D4'], current stack 1255
Started the round 45
Street "preflop" started. (community card = [])
"ZPlayer" declared "call:10"
"YangZ" declared "fold:0"
"Ethan" declared "fold:0"
"HakulaPlayer" declared "call:10"
"SichengZuo" declared "fold:0"
"KLChen2PokerPlayer" declared "raise:28"
"Jinkun" declared "fold:28"
"NitWinWin" declared "fold:0"
"ZPlayer" declared "fold:0"
"HakulaPlayer" declared "raise:73"
"KLChen2PokerPlayer" declared "fold:0"
"['HakulaPlayer']" won the round 45 (stack = {'YangZ': 925, 'Ethan': 1032, 'HakulaPlayer': 1198, 'SichengZuo': 910, 'KLChen2PokerPlayer': 631, 'Jinkun': 1060, 'NitWinWin': 998, 'ZPlayer': 1245})
player [YangZ] gets hole card ['H8', 'D8'], current stack 925
player [Ethan] gets hole card ['C9', 'DT'], current stack 1032
player [HakulaPlayer] gets hole card ['C7', 'C5'], current stack 1198
player [SichengZuo] gets hole card ['D6', 'C6'], current stack 910
player [KLChen2PokerPlayer] gets hole card ['C3', 'DA'], current stack 631
player [Jinkun] gets hole card ['H7', 'HK'], current stack 1060
player [NitWinWin] gets hole card ['D2', 'H4'], current stack 993
player [ZPlayer] gets hole card ['D9', 'C8'], current stack 1235
Started the round 46
Street "preflop" started. (community card = [])
"YangZ" declared "fold:0"
"Ethan" declared "fold:0"
"HakulaPlayer" declared "fold:0"
"SichengZuo" declared "fold:0"
"KLChen2PokerPlayer" declared "raise:15"
"Jinkun" declared "fold:15"
"NitWinWin" declared "fold:0"
"ZPlayer" declared "call:15"
Street "flop" started. (community card = ['CA', 'HJ', 'S2'])
"ZPlayer" declared "call:0"
"KLChen2PokerPlayer" declared "raise:21"
"ZPlayer" declared "fold:0"
"['KLChen2PokerPlayer']" won the round 46 (stack = {'YangZ': 925, 'Ethan': 1032, 'HakulaPlayer': 1198, 'SichengZuo': 910, 'KLChen2PokerPlayer': 651, 'Jinkun': 1060, 'NitWinWin': 993, 'ZPlayer': 1230})
player [YangZ] gets hole card ['DT', 'C5'], current stack 915
player [Ethan] gets hole card ['D6', 'CA'], current stack 1032
player [HakulaPlayer] gets hole card ['CT', 'SA'], current stack 1198
player [SichengZuo] gets hole card ['C8', 'S2'], current stack 910
player [KLChen2PokerPlayer] gets hole card ['D8', 'CJ'], current stack 651
player [Jinkun] gets hole card ['C3', 'SK'], current stack 1060
player [NitWinWin] gets hole card ['S7', 'HT'], current stack 993
player [ZPlayer] gets hole card ['S3', 'HJ'], current stack 1225
Started the round 47
Street "preflop" started. (community card = [])
"Ethan" declared "fold:0"
"HakulaPlayer" declared "call:10"
"SichengZuo" declared "fold:0"
"KLChen2PokerPlayer" declared "raise:19"
"Jinkun" declared "fold:19"
"NitWinWin" declared "fold:0"
"ZPlayer" declared "call:19"
"YangZ" declared "fold:0"
"HakulaPlayer" declared "raise:59"
"KLChen2PokerPlayer" declared "fold:0"
"ZPlayer" declared "call:59"
Street "flop" started. (community card = ['H7', 'ST', 'DK'])
"ZPlayer" declared "call:0"
"HakulaPlayer" declared "raise:185"
"ZPlayer" declared "fold:0"
"['HakulaPlayer']" won the round 47 (stack = {'YangZ': 915, 'Ethan': 1032, 'HakulaPlayer': 1286, 'SichengZuo': 910, 'KLChen2PokerPlayer': 632, 'Jinkun': 1060, 'NitWinWin': 993, 'ZPlayer': 1171})
player [YangZ] gets hole card ['SQ', 'D7'], current stack 910
player [Ethan] gets hole card ['HJ', 'C7'], current stack 1022
player [HakulaPlayer] gets hole card ['C6', 'S7'], current stack 1286
player [SichengZuo] gets hole card ['H3', 'H6'], current stack 910
player [KLChen2PokerPlayer] gets hole card ['HT', 'D5'], current stack 632
player [Jinkun] gets hole card ['C8', 'S2'], current stack 1060
player [NitWinWin] gets hole card ['C9', 'DK'], current stack 993
player [ZPlayer] gets hole card ['D3', 'DA'], current stack 1171
Started the round 48
Street "preflop" started. (community card = [])
"HakulaPlayer" declared "fold:0"
"SichengZuo" declared "fold:0"
"KLChen2PokerPlayer" declared "fold:0"
"Jinkun" declared "fold:10"
"NitWinWin" declared "fold:0"
"ZPlayer" declared "raise:15"
"YangZ" declared "fold:0"
"Ethan" declared "fold:0"
"['ZPlayer']" won the round 48 (stack = {'YangZ': 910, 'Ethan': 1022, 'HakulaPlayer': 1286, 'SichengZuo': 910, 'KLChen2PokerPlayer': 632, 'Jinkun': 1060, 'NitWinWin': 993, 'ZPlayer': 1186})
player [YangZ] gets hole card ['S2', 'CK'], current stack 910
player [Ethan] gets hole card ['C9', 'H5'], current stack 1017
player [HakulaPlayer] gets hole card ['D2', 'HJ'], current stack 1276
player [SichengZuo] gets hole card ['HT', 'C8'], current stack 910
player [KLChen2PokerPlayer] gets hole card ['D5', 'DK'], current stack 632
player [Jinkun] gets hole card ['C4', 'DA'], current stack 1060
player [NitWinWin] gets hole card ['C2', 'D8'], current stack 993
player [ZPlayer] gets hole card ['S5', 'S8'], current stack 1186
Started the round 49
Street "preflop" started. (community card = [])
"SichengZuo" declared "fold:0"
"KLChen2PokerPlayer" declared "raise:19"
"Jinkun" declared "fold:19"
"NitWinWin" declared "fold:0"
"ZPlayer" declared "fold:0"
"YangZ" declared "fold:0"
"Ethan" declared "fold:0"
"HakulaPlayer" declared "call:19"
Street "flop" started. (community card = ['HA', 'S4', 'CJ'])
"HakulaPlayer" declared "raise:45"
"KLChen2PokerPlayer" declared "fold:0"
"['HakulaPlayer']" won the round 49 (stack = {'YangZ': 910, 'Ethan': 1017, 'HakulaPlayer': 1310, 'SichengZuo': 910, 'KLChen2PokerPlayer': 613, 'Jinkun': 1060, 'NitWinWin': 993, 'ZPlayer': 1186})
player [YangZ] gets hole card ['D6', 'H7'], current stack 910
player [Ethan] gets hole card ['CA', 'S2'], current stack 1017
player [HakulaPlayer] gets hole card ['D9', 'D7'], current stack 1305
player [SichengZuo] gets hole card ['H2', 'HK'], current stack 900
player [KLChen2PokerPlayer] gets hole card ['CK', 'DJ'], current stack 613
player [Jinkun] gets hole card ['C9', 'DK'], current stack 1060
player [NitWinWin] gets hole card ['H6', 'D2'], current stack 993
player [ZPlayer] gets hole card ['H9', 'C2'], current stack 1186
Started the round 50
Street "preflop" started. (community card = [])
"KLChen2PokerPlayer" declared "raise:21"
"Jinkun" declared "fold:21"
"NitWinWin" declared "fold:0"
"ZPlayer" declared "call:21"
"YangZ" declared "fold:0"
"Ethan" declared "fold:0"
"HakulaPlayer" declared "call:21"
"SichengZuo" declared "fold:0"
Street "flop" started. (community card = ['C8', 'H8', 'HT'])
"HakulaPlayer" declared "call:0"
"KLChen2PokerPlayer" declared "call:0"
"ZPlayer" declared "call:0"
Street "turn" started. (community card = ['C8', 'H8', 'HT', 'HQ'])
"HakulaPlayer" declared "call:0"
"KLChen2PokerPlayer" declared "call:0"
"ZPlayer" declared "call:0"
Street "river" started. (community card = ['C8', 'H8', 'HT', 'HQ', 'ST'])
"HakulaPlayer" declared "call:0"
"KLChen2PokerPlayer" declared "call:0"
"ZPlayer" declared "call:0"
"['KLChen2PokerPlayer']" won the round 50 (stack = {'YangZ': 910, 'Ethan': 1017, 'HakulaPlayer': 1289, 'SichengZuo': 900, 'KLChen2PokerPlayer': 665, 'Jinkun': 1060, 'NitWinWin': 993, 'ZPlayer': 1165})

Game Results:
------------------------------------------------------------
Game 1:
Winner: HakulaPlayer (stack: 1289)
All players' stacks:
  YangZ: 910
  Ethan: 1017
  HakulaPlayer: 1289
  SichengZuo: 900
  KLChen2PokerPlayer: 665
  Jinkun: 1060
  NitWinWin: 993
  ZPlayer: 1165
------------------------------------------------------------
