player [YangZ] gets hole card ['S8', 'S4'], current stack 1000
player [Ethan] gets hole card ['CQ', 'D9'], current stack 995
player [HakulaPlayer] gets hole card ['H9', 'H3'], current stack 990
player [SichengZuo] gets hole card ['HA', 'D2'], current stack 1000
player [KLChen2PokerPlayer] gets hole card ['DK', 'SK'], current stack 1000
player [Jinkun] gets hole card ['HK', 'SJ'], current stack 1000
player [NitWinWin] gets hole card ['S2', 'C4'], current stack 1000
player [ZPlayer] gets hole card ['H7', 'HJ'], current stack 1000
Started the round 1
Street "preflop" started. (community card = [])
"SichengZuo" declared "fold:0"
"KLChen2PokerPlayer" declared "raise:16"
"Jinkun" declared "fold:16"
"NitWinWin" declared "fold:0"
"ZPlayer" declared "call:16"
"YangZ" declared "fold:0"
"Ethan" declared "fold:0"
"HakulaPlayer" declared "call:16"
Street "flop" started. (community card = ['CA', 'CJ', 'H8'])
"HakulaPlayer" declared "raise:20"
"KLChen2PokerPlayer" declared "raise:40"
"ZPlayer" declared "call:40"
"HakulaPlayer" declared "fold:0"
Street "turn" started. (community card = ['CA', 'CJ', 'H8', 'H6'])
"KLChen2PokerPlayer" declared "raise:226"
"ZPlayer" declared "call:226"
Street "river" started. (community card = ['CA', 'CJ', 'H8', 'H6', 'D3'])
"KLChen2PokerPlayer" declared "raise:98"
"ZPlayer" declared "call:98"
"['KLChen2PokerPlayer']" won the round 1 (stack = {'YangZ': 1000, 'Ethan': 995, 'HakulaPlayer': 964, 'SichengZuo': 1000, 'KLChen2PokerPlayer': 1421, 'Jinkun': 1000, 'NitWinWin': 1000, 'ZPlayer': 620})
player [YangZ] gets hole card ['CK', 'DQ'], current stack 1000
player [Ethan] gets hole card ['D6', 'S6'], current stack 995
player [HakulaPlayer] gets hole card ['C2', 'SQ'], current stack 959
player [SichengZuo] gets hole card ['H9', 'S2'], current stack 990
player [KLChen2PokerPlayer] gets hole card ['D4', 'H8'], current stack 1421
player [Jinkun] gets hole card ['SA', 'D5'], current stack 1000
player [NitWinWin] gets hole card ['S3', 'HJ'], current stack 1000
player [ZPlayer] gets hole card ['D7', 'H7'], current stack 620
Started the round 2
Street "preflop" started. (community card = [])
"KLChen2PokerPlayer" declared "fold:0"
"Jinkun" declared "fold:10"
"NitWinWin" declared "fold:0"
"ZPlayer" declared "raise:15"
"YangZ" declared "fold:0"
"Ethan" declared "fold:0"
"HakulaPlayer" declared "fold:0"
"SichengZuo" declared "fold:0"
"['ZPlayer']" won the round 2 (stack = {'YangZ': 1000, 'Ethan': 995, 'HakulaPlayer': 959, 'SichengZuo': 990, 'KLChen2PokerPlayer': 1421, 'Jinkun': 1000, 'NitWinWin': 1000, 'ZPlayer': 635})
player [YangZ] gets hole card ['C5', 'C6'], current stack 1000
player [Ethan] gets hole card ['S6', 'ST'], current stack 995
player [HakulaPlayer] gets hole card ['CK', 'SJ'], current stack 959
player [SichengZuo] gets hole card ['S3', 'H2'], current stack 985
player [KLChen2PokerPlayer] gets hole card ['CQ', 'HJ'], current stack 1411
player [Jinkun] gets hole card ['SQ', 'S8'], current stack 1000
player [NitWinWin] gets hole card ['D2', 'CT'], current stack 1000
player [ZPlayer] gets hole card ['D9', 'H7'], current stack 635
Started the round 3
Street "preflop" started. (community card = [])
"Jinkun" declared "fold:10"
"NitWinWin" declared "fold:0"
"ZPlayer" declared "call:10"
"YangZ" declared "fold:0"
"Ethan" declared "fold:0"
"HakulaPlayer" declared "call:10"
"SichengZuo" declared "fold:0"
"KLChen2PokerPlayer" declared "raise:15"
"ZPlayer" declared "call:15"
"HakulaPlayer" declared "raise:44"
"KLChen2PokerPlayer" declared "fold:0"
"ZPlayer" declared "fold:0"
"['HakulaPlayer']" won the round 3 (stack = {'YangZ': 1000, 'Ethan': 995, 'HakulaPlayer': 994, 'SichengZuo': 985, 'KLChen2PokerPlayer': 1406, 'Jinkun': 1000, 'NitWinWin': 1000, 'ZPlayer': 620})
player [YangZ] gets hole card ['H5', 'D8'], current stack 1000
player [Ethan] gets hole card ['SK', 'S7'], current stack 995
player [HakulaPlayer] gets hole card ['C2', 'DJ'], current stack 994
player [SichengZuo] gets hole card ['HJ', 'DQ'], current stack 985
player [KLChen2PokerPlayer] gets hole card ['H7', 'D3'], current stack 1401
player [Jinkun] gets hole card ['HA', 'C9'], current stack 990
player [NitWinWin] gets hole card ['CQ', 'S2'], current stack 1000
player [ZPlayer] gets hole card ['D9', 'CJ'], current stack 620
Started the round 4
Street "preflop" started. (community card = [])
"NitWinWin" declared "fold:0"
"ZPlayer" declared "call:10"
"YangZ" declared "fold:0"
"Ethan" declared "fold:0"
"HakulaPlayer" declared "call:10"
"SichengZuo" declared "fold:0"
"KLChen2PokerPlayer" declared "call:10"
"Jinkun" declared "call:10"
Street "flop" started. (community card = ['CK', 'H9', 'SQ'])
"KLChen2PokerPlayer" declared "call:0"
"Jinkun" declared "call:0"
"ZPlayer" declared "raise:40"
"HakulaPlayer" declared "fold:0"
"KLChen2PokerPlayer" declared "fold:0"
"Jinkun" declared "call:40"
Street "turn" started. (community card = ['CK', 'H9', 'SQ', 'H2'])
"Jinkun" declared "call:0"
"ZPlayer" declared "raise:10"
"Jinkun" declared "call:10"
Street "river" started. (community card = ['CK', 'H9', 'SQ', 'H2', 'C7'])
"Jinkun" declared "call:0"
"ZPlayer" declared "raise:10"
"Jinkun" declared "call:10"
"['Jinkun']" won the round 4 (stack = {'YangZ': 1000, 'Ethan': 995, 'HakulaPlayer': 984, 'SichengZuo': 985, 'KLChen2PokerPlayer': 1396, 'Jinkun': 1090, 'NitWinWin': 1000, 'ZPlayer': 550})
player [YangZ] gets hole card ['S7', 'C2'], current stack 1000
player [Ethan] gets hole card ['S8', 'H6'], current stack 995
player [HakulaPlayer] gets hole card ['C5', 'DT'], current stack 984
player [SichengZuo] gets hole card ['SJ', 'HA'], current stack 985
player [KLChen2PokerPlayer] gets hole card ['CK', 'D4'], current stack 1396
player [Jinkun] gets hole card ['HQ', 'D6'], current stack 1085
player [NitWinWin] gets hole card ['H7', 'D5'], current stack 990
player [ZPlayer] gets hole card ['S3', 'HK'], current stack 550
Started the round 5
Street "preflop" started. (community card = [])
"ZPlayer" declared "call:10"
"YangZ" declared "fold:0"
"Ethan" declared "fold:0"
"HakulaPlayer" declared "call:10"
"SichengZuo" declared "fold:0"
"KLChen2PokerPlayer" declared "raise:15"
"Jinkun" declared "fold:15"
"NitWinWin" declared "fold:0"
"ZPlayer" declared "call:15"
"HakulaPlayer" declared "call:15"
Street "flop" started. (community card = ['S5', 'H3', 'CQ'])
"ZPlayer" declared "call:0"
"HakulaPlayer" declared "call:0"
"KLChen2PokerPlayer" declared "call:0"
Street "turn" started. (community card = ['S5', 'H3', 'CQ', 'SA'])
"ZPlayer" declared "call:0"
"HakulaPlayer" declared "call:0"
"KLChen2PokerPlayer" declared "call:0"
Street "river" started. (community card = ['S5', 'H3', 'CQ', 'SA', 'DJ'])
"ZPlayer" declared "call:0"
"HakulaPlayer" declared "call:0"
"KLChen2PokerPlayer" declared "call:0"
"['HakulaPlayer']" won the round 5 (stack = {'YangZ': 1000, 'Ethan': 995, 'HakulaPlayer': 1029, 'SichengZuo': 985, 'KLChen2PokerPlayer': 1381, 'Jinkun': 1085, 'NitWinWin': 990, 'ZPlayer': 535})
player [YangZ] gets hole card ['DK', 'H9'], current stack 1000
player [Ethan] gets hole card ['HA', 'H6'], current stack 995
player [HakulaPlayer] gets hole card ['D9', 'S5'], current stack 1029
player [SichengZuo] gets hole card ['H5', 'SJ'], current stack 985
player [KLChen2PokerPlayer] gets hole card ['SK', 'D2'], current stack 1381
player [Jinkun] gets hole card ['HJ', 'C2'], current stack 1085
player [NitWinWin] gets hole card ['CA', 'H4'], current stack 985
player [ZPlayer] gets hole card ['DJ', 'H2'], current stack 525
Started the round 6
Street "preflop" started. (community card = [])
"YangZ" declared "fold:0"
"Ethan" declared "fold:0"
"HakulaPlayer" declared "fold:0"
"SichengZuo" declared "fold:0"
"KLChen2PokerPlayer" declared "raise:15"
"Jinkun" declared "fold:15"
"NitWinWin" declared "fold:0"
"ZPlayer" declared "call:15"
Street "flop" started. (community card = ['SA', 'C7', 'HQ'])
"ZPlayer" declared "call:0"
"KLChen2PokerPlayer" declared "call:0"
Street "turn" started. (community card = ['SA', 'C7', 'HQ', 'H3'])
"ZPlayer" declared "call:0"
"KLChen2PokerPlayer" declared "call:0"
Street "river" started. (community card = ['SA', 'C7', 'HQ', 'H3', 'H8'])
"ZPlayer" declared "call:0"
"KLChen2PokerPlayer" declared "call:0"
"['KLChen2PokerPlayer']" won the round 6 (stack = {'YangZ': 1000, 'Ethan': 995, 'HakulaPlayer': 1029, 'SichengZuo': 985, 'KLChen2PokerPlayer': 1401, 'Jinkun': 1085, 'NitWinWin': 985, 'ZPlayer': 520})
player [YangZ] gets hole card ['SK', 'D6'], current stack 990
player [Ethan] gets hole card ['S7', 'CK'], current stack 995
player [HakulaPlayer] gets hole card ['S9', 'SJ'], current stack 1029
player [SichengZuo] gets hole card ['HQ', 'SA'], current stack 985
player [KLChen2PokerPlayer] gets hole card ['D8', 'DA'], current stack 1401
player [Jinkun] gets hole card ['HA', 'DJ'], current stack 1085
player [NitWinWin] gets hole card ['S8', 'S5'], current stack 985
player [ZPlayer] gets hole card ['C4', 'D9'], current stack 515
Started the round 7
Street "preflop" started. (community card = [])
"Ethan" declared "fold:0"
"HakulaPlayer" declared "call:10"
"SichengZuo" declared "fold:0"
"KLChen2PokerPlayer" declared "raise:15"
"Jinkun" declared "fold:15"
"NitWinWin" declared "fold:0"
"ZPlayer" declared "call:15"
"YangZ" declared "fold:0"
"HakulaPlayer" declared "call:15"
Street "flop" started. (community card = ['H3', 'C3', 'HJ'])
"ZPlayer" declared "call:0"
"HakulaPlayer" declared "call:0"
"KLChen2PokerPlayer" declared "call:0"
Street "turn" started. (community card = ['H3', 'C3', 'HJ', 'S2'])
"ZPlayer" declared "call:0"
"HakulaPlayer" declared "call:0"
"KLChen2PokerPlayer" declared "call:0"
Street "river" started. (community card = ['H3', 'C3', 'HJ', 'S2', 'S3'])
"ZPlayer" declared "call:0"
"HakulaPlayer" declared "raise:73"
"KLChen2PokerPlayer" declared "fold:0"
"ZPlayer" declared "fold:0"
"['HakulaPlayer']" won the round 7 (stack = {'YangZ': 990, 'Ethan': 995, 'HakulaPlayer': 1069, 'SichengZuo': 985, 'KLChen2PokerPlayer': 1386, 'Jinkun': 1085, 'NitWinWin': 985, 'ZPlayer': 505})
player [YangZ] gets hole card ['D8', 'C7'], current stack 985
player [Ethan] gets hole card ['S2', 'D3'], current stack 985
player [HakulaPlayer] gets hole card ['D9', 'H5'], current stack 1069
player [SichengZuo] gets hole card ['S8', 'H8'], current stack 985
player [KLChen2PokerPlayer] gets hole card ['SQ', 'D6'], current stack 1386
player [Jinkun] gets hole card ['CT', 'S3'], current stack 1085
player [NitWinWin] gets hole card ['D2', 'SJ'], current stack 985
player [ZPlayer] gets hole card ['C3', 'HK'], current stack 505
Started the round 8
Street "preflop" started. (community card = [])
"HakulaPlayer" declared "fold:0"
"SichengZuo" declared "fold:0"
"KLChen2PokerPlayer" declared "call:10"
"Jinkun" declared "fold:10"
"NitWinWin" declared "fold:0"
"ZPlayer" declared "call:10"
"YangZ" declared "fold:0"
"Ethan" declared "fold:0"
Street "flop" started. (community card = ['H6', 'H7', 'DT'])
"KLChen2PokerPlayer" declared "raise:19"
"ZPlayer" declared "fold:0"
"['KLChen2PokerPlayer']" won the round 8 (stack = {'YangZ': 985, 'Ethan': 985, 'HakulaPlayer': 1069, 'SichengZuo': 985, 'KLChen2PokerPlayer': 1411, 'Jinkun': 1085, 'NitWinWin': 985, 'ZPlayer': 495})
player [YangZ] gets hole card ['CK', 'D7'], current stack 985
player [Ethan] gets hole card ['S3', 'C2'], current stack 980
player [HakulaPlayer] gets hole card ['S8', 'H7'], current stack 1059
player [SichengZuo] gets hole card ['S5', 'H2'], current stack 985
player [KLChen2PokerPlayer] gets hole card ['SQ', 'H6'], current stack 1411
player [Jinkun] gets hole card ['HQ', 'ST'], current stack 1085
player [NitWinWin] gets hole card ['CQ', 'DT'], current stack 985
player [ZPlayer] gets hole card ['H4', 'H5'], current stack 495
Started the round 9
Street "preflop" started. (community card = [])
"SichengZuo" declared "fold:0"
"KLChen2PokerPlayer" declared "call:10"
"Jinkun" declared "fold:10"
"NitWinWin" declared "fold:0"
"ZPlayer" declared "call:10"
"YangZ" declared "fold:0"
"Ethan" declared "fold:0"
"HakulaPlayer" declared "call:10"
Street "flop" started. (community card = ['D5', 'SA', 'HJ'])
"HakulaPlayer" declared "call:0"
"KLChen2PokerPlayer" declared "call:0"
"ZPlayer" declared "raise:10"
"HakulaPlayer" declared "fold:0"
"KLChen2PokerPlayer" declared "fold:0"
"['ZPlayer']" won the round 9 (stack = {'YangZ': 985, 'Ethan': 980, 'HakulaPlayer': 1059, 'SichengZuo': 985, 'KLChen2PokerPlayer': 1401, 'Jinkun': 1085, 'NitWinWin': 985, 'ZPlayer': 520})
player [YangZ] gets hole card ['C4', 'S2'], current stack 985
player [Ethan] gets hole card ['C5', 'S7'], current stack 980
player [HakulaPlayer] gets hole card ['D4', 'D9'], current stack 1054
player [SichengZuo] gets hole card ['C3', 'S4'], current stack 975
player [KLChen2PokerPlayer] gets hole card ['D5', 'H8'], current stack 1401
player [Jinkun] gets hole card ['HJ', 'DJ'], current stack 1085
player [NitWinWin] gets hole card ['HT', 'CQ'], current stack 985
player [ZPlayer] gets hole card ['DT', 'C8'], current stack 520
Started the round 10
Street "preflop" started. (community card = [])
"KLChen2PokerPlayer" declared "call:10"
"Jinkun" declared "fold:10"
"NitWinWin" declared "fold:0"
"ZPlayer" declared "call:10"
"YangZ" declared "fold:0"
"Ethan" declared "fold:0"
"HakulaPlayer" declared "call:10"
"SichengZuo" declared "fold:0"
Street "flop" started. (community card = ['C6', 'H6', 'S8'])
"HakulaPlayer" declared "call:0"
"KLChen2PokerPlayer" declared "raise:32"
"ZPlayer" declared "call:32"
"HakulaPlayer" declared "fold:0"
Street "turn" started. (community card = ['C6', 'H6', 'S8', 'H2'])
"KLChen2PokerPlayer" declared "raise:212"
"ZPlayer" declared "call:212"
Street "river" started. (community card = ['C6', 'H6', 'S8', 'H2', 'SA'])
"KLChen2PokerPlayer" declared "raise:236"
"ZPlayer" declared "fold:0"
"['KLChen2PokerPlayer']" won the round 10 (stack = {'YangZ': 985, 'Ethan': 980, 'HakulaPlayer': 1049, 'SichengZuo': 975, 'KLChen2PokerPlayer': 1675, 'Jinkun': 1085, 'NitWinWin': 985, 'ZPlayer': 266})
player [YangZ] gets hole card ['S4', 'H3'], current stack 985
player [Ethan] gets hole card ['D8', 'DQ'], current stack 980
player [HakulaPlayer] gets hole card ['S2', 'SA'], current stack 1049
player [SichengZuo] gets hole card ['D2', 'C5'], current stack 970
player [KLChen2PokerPlayer] gets hole card ['C9', 'SQ'], current stack 1665
player [Jinkun] gets hole card ['D5', 'H4'], current stack 1085
player [NitWinWin] gets hole card ['S5', 'H8'], current stack 985
player [ZPlayer] gets hole card ['CT', 'D3'], current stack 266
Started the round 11
Street "preflop" started. (community card = [])
"Jinkun" declared "fold:10"
"NitWinWin" declared "fold:0"
"ZPlayer" declared "call:10"
"YangZ" declared "fold:0"
"Ethan" declared "fold:0"
"HakulaPlayer" declared "raise:35"
"SichengZuo" declared "fold:0"
"KLChen2PokerPlayer" declared "fold:0"
"ZPlayer" declared "fold:0"
"['HakulaPlayer']" won the round 11 (stack = {'YangZ': 985, 'Ethan': 980, 'HakulaPlayer': 1074, 'SichengZuo': 970, 'KLChen2PokerPlayer': 1665, 'Jinkun': 1085, 'NitWinWin': 985, 'ZPlayer': 256})
player [YangZ] gets hole card ['D5', 'D3'], current stack 985
player [Ethan] gets hole card ['S3', 'H5'], current stack 980
player [HakulaPlayer] gets hole card ['H6', 'S9'], current stack 1074
player [SichengZuo] gets hole card ['DA', 'CQ'], current stack 970
player [KLChen2PokerPlayer] gets hole card ['CT', 'SK'], current stack 1660
player [Jinkun] gets hole card ['CA', 'SJ'], current stack 1075
player [NitWinWin] gets hole card ['ST', 'HA'], current stack 985
player [ZPlayer] gets hole card ['SA', 'DQ'], current stack 256
Started the round 12
Street "preflop" started. (community card = [])
"NitWinWin" declared "fold:0"
"ZPlayer" declared "call:10"
"YangZ" declared "fold:0"
"Ethan" declared "fold:0"
"HakulaPlayer" declared "call:10"
"SichengZuo" declared "fold:0"
"KLChen2PokerPlayer" declared "raise:18"
"Jinkun" declared "fold:18"
"ZPlayer" declared "call:18"
"HakulaPlayer" declared "call:18"
Street "flop" started. (community card = ['S4', 'S6', 'D2'])
"KLChen2PokerPlayer" declared "call:0"
"ZPlayer" declared "call:0"
"HakulaPlayer" declared "call:0"
Street "turn" started. (community card = ['S4', 'S6', 'D2', 'S5'])
"KLChen2PokerPlayer" declared "call:0"
"ZPlayer" declared "call:0"
"HakulaPlayer" declared "call:0"
Street "river" started. (community card = ['S4', 'S6', 'D2', 'S5', 'S2'])
"KLChen2PokerPlayer" declared "raise:332"
"ZPlayer" declared "call:332"
"HakulaPlayer" declared "fold:0"
"['ZPlayer']" won the round 12 (stack = {'YangZ': 985, 'Ethan': 980, 'HakulaPlayer': 1056, 'SichengZuo': 970, 'KLChen2PokerPlayer': 1409, 'Jinkun': 1075, 'NitWinWin': 985, 'ZPlayer': 540})
player [YangZ] gets hole card ['HA', 'H7'], current stack 985
player [Ethan] gets hole card ['S2', 'HQ'], current stack 980
player [HakulaPlayer] gets hole card ['C9', 'HK'], current stack 1056
player [SichengZuo] gets hole card ['SK', 'C5'], current stack 970
player [KLChen2PokerPlayer] gets hole card ['S7', 'H9'], current stack 1409
player [Jinkun] gets hole card ['C3', 'H5'], current stack 1070
player [NitWinWin] gets hole card ['C7', 'DK'], current stack 975
player [ZPlayer] gets hole card ['CJ', 'S6'], current stack 540
Started the round 13
Street "preflop" started. (community card = [])
"ZPlayer" declared "call:10"
"YangZ" declared "fold:0"
"Ethan" declared "fold:0"
"HakulaPlayer" declared "call:10"
"SichengZuo" declared "fold:0"
"KLChen2PokerPlayer" declared "raise:17"
"Jinkun" declared "fold:17"
"NitWinWin" declared "fold:0"
"ZPlayer" declared "call:17"
"HakulaPlayer" declared "raise:65"
"KLChen2PokerPlayer" declared "fold:0"
"ZPlayer" declared "call:65"
Street "flop" started. (community card = ['C6', 'C2', 'SQ'])
"ZPlayer" declared "raise:10"
"HakulaPlayer" declared "call:10"
Street "turn" started. (community card = ['C6', 'C2', 'SQ', 'DQ'])
"ZPlayer" declared "raise:10"
"HakulaPlayer" declared "call:10"
Street "river" started. (community card = ['C6', 'C2', 'SQ', 'DQ', 'H4'])
"ZPlayer" declared "raise:202"
"HakulaPlayer" declared "fold:0"
"['ZPlayer']" won the round 13 (stack = {'YangZ': 985, 'Ethan': 980, 'HakulaPlayer': 971, 'SichengZuo': 970, 'KLChen2PokerPlayer': 1392, 'Jinkun': 1070, 'NitWinWin': 975, 'ZPlayer': 657})
player [YangZ] gets hole card ['DQ', 'C5'], current stack 985
player [Ethan] gets hole card ['HA', 'D4'], current stack 980
player [HakulaPlayer] gets hole card ['C6', 'H5'], current stack 971
player [SichengZuo] gets hole card ['HJ', 'DA'], current stack 970
player [KLChen2PokerPlayer] gets hole card ['SQ', 'C7'], current stack 1392
player [Jinkun] gets hole card ['CK', 'ST'], current stack 1070
player [NitWinWin] gets hole card ['D2', 'C4'], current stack 970
player [ZPlayer] gets hole card ['SA', 'D8'], current stack 647
Started the round 14
Street "preflop" started. (community card = [])
"YangZ" declared "fold:0"
"Ethan" declared "fold:0"
"HakulaPlayer" declared "fold:0"
"SichengZuo" declared "fold:0"
"KLChen2PokerPlayer" declared "raise:15"
"Jinkun" declared "fold:15"
"NitWinWin" declared "fold:0"
"ZPlayer" declared "call:15"
Street "flop" started. (community card = ['S3', 'SK', 'CT'])
"ZPlayer" declared "call:0"
"KLChen2PokerPlayer" declared "call:0"
Street "turn" started. (community card = ['S3', 'SK', 'CT', 'D6'])
"ZPlayer" declared "call:0"
"KLChen2PokerPlayer" declared "call:0"
Street "river" started. (community card = ['S3', 'SK', 'CT', 'D6', 'DT'])
"ZPlayer" declared "call:0"
"KLChen2PokerPlayer" declared "call:0"
"['ZPlayer']" won the round 14 (stack = {'YangZ': 985, 'Ethan': 980, 'HakulaPlayer': 971, 'SichengZuo': 970, 'KLChen2PokerPlayer': 1377, 'Jinkun': 1070, 'NitWinWin': 970, 'ZPlayer': 677})
player [YangZ] gets hole card ['D5', 'C9'], current stack 975
player [Ethan] gets hole card ['H5', 'D7'], current stack 980
player [HakulaPlayer] gets hole card ['C4', 'S7'], current stack 971
player [SichengZuo] gets hole card ['SK', 'CJ'], current stack 970
player [KLChen2PokerPlayer] gets hole card ['HA', 'S4'], current stack 1377
player [Jinkun] gets hole card ['D3', 'D4'], current stack 1070
player [NitWinWin] gets hole card ['CK', 'HJ'], current stack 970
player [ZPlayer] gets hole card ['C3', 'H2'], current stack 672
Started the round 15
Street "preflop" started. (community card = [])
"Ethan" declared "fold:0"
"HakulaPlayer" declared "fold:0"
"SichengZuo" declared "fold:0"
"KLChen2PokerPlayer" declared "raise:15"
"Jinkun" declared "fold:15"
"NitWinWin" declared "fold:0"
"ZPlayer" declared "fold:0"
"YangZ" declared "fold:0"
"['KLChen2PokerPlayer']" won the round 15 (stack = {'YangZ': 975, 'Ethan': 980, 'HakulaPlayer': 971, 'SichengZuo': 970, 'KLChen2PokerPlayer': 1392, 'Jinkun': 1070, 'NitWinWin': 970, 'ZPlayer': 672})
player [YangZ] gets hole card ['C8', 'D2'], current stack 970
player [Ethan] gets hole card ['SQ', 'H8'], current stack 970
player [HakulaPlayer] gets hole card ['C4', 'S3'], current stack 971
player [SichengZuo] gets hole card ['CT', 'C6'], current stack 970
player [KLChen2PokerPlayer] gets hole card ['CK', 'S6'], current stack 1392
player [Jinkun] gets hole card ['CA', 'H7'], current stack 1070
player [NitWinWin] gets hole card ['S4', 'S9'], current stack 970
player [ZPlayer] gets hole card ['C7', 'S8'], current stack 672
Started the round 16
Street "preflop" started. (community card = [])
"HakulaPlayer" declared "fold:0"
"SichengZuo" declared "fold:0"
"KLChen2PokerPlayer" declared "call:10"
"Jinkun" declared "fold:10"
"NitWinWin" declared "fold:0"
"ZPlayer" declared "call:10"
"YangZ" declared "fold:0"
"Ethan" declared "call:10"
Street "flop" started. (community card = ['SK', 'S5', 'C2'])
"Ethan" declared "call:0"
"KLChen2PokerPlayer" declared "raise:34"
"ZPlayer" declared "fold:0"
"Ethan" declared "fold:0"
"['KLChen2PokerPlayer']" won the round 16 (stack = {'YangZ': 970, 'Ethan': 970, 'HakulaPlayer': 971, 'SichengZuo': 970, 'KLChen2PokerPlayer': 1417, 'Jinkun': 1070, 'NitWinWin': 970, 'ZPlayer': 662})
player [YangZ] gets hole card ['C3', 'D5'], current stack 970
player [Ethan] gets hole card ['HK', 'H6'], current stack 965
player [HakulaPlayer] gets hole card ['D4', 'C6'], current stack 961
player [SichengZuo] gets hole card ['C7', 'D7'], current stack 970
player [KLChen2PokerPlayer] gets hole card ['D3', 'HQ'], current stack 1417
player [Jinkun] gets hole card ['DJ', 'D8'], current stack 1070
player [NitWinWin] gets hole card ['CT', 'HT'], current stack 970
player [ZPlayer] gets hole card ['S5', 'HA'], current stack 662
Started the round 17
Street "preflop" started. (community card = [])
"SichengZuo" declared "fold:0"
"KLChen2PokerPlayer" declared "fold:0"
"Jinkun" declared "fold:10"
"NitWinWin" declared "fold:0"
"ZPlayer" declared "raise:15"
"YangZ" declared "fold:0"
"Ethan" declared "fold:0"
"HakulaPlayer" declared "call:15"
Street "flop" started. (community card = ['D6', 'H5', 'C2'])
"HakulaPlayer" declared "raise:53"
"ZPlayer" declared "fold:0"
"['HakulaPlayer']" won the round 17 (stack = {'YangZ': 970, 'Ethan': 965, 'HakulaPlayer': 991, 'SichengZuo': 970, 'KLChen2PokerPlayer': 1417, 'Jinkun': 1070, 'NitWinWin': 970, 'ZPlayer': 647})
player [YangZ] gets hole card ['SQ', 'S3'], current stack 970
player [Ethan] gets hole card ['CJ', 'C8'], current stack 965
player [HakulaPlayer] gets hole card ['DK', 'C6'], current stack 986
player [SichengZuo] gets hole card ['H3', 'D9'], current stack 960
player [KLChen2PokerPlayer] gets hole card ['CK', 'SK'], current stack 1417
player [Jinkun] gets hole card ['CQ', 'HT'], current stack 1070
player [NitWinWin] gets hole card ['HA', 'C7'], current stack 970
player [ZPlayer] gets hole card ['S9', 'D8'], current stack 647
Started the round 18
Street "preflop" started. (community card = [])
"KLChen2PokerPlayer" declared "raise:18"
"Jinkun" declared "fold:18"
"NitWinWin" declared "fold:0"
"ZPlayer" declared "call:18"
"YangZ" declared "fold:0"
"Ethan" declared "fold:0"
"HakulaPlayer" declared "call:18"
"SichengZuo" declared "fold:0"
Street "flop" started. (community card = ['D7', 'C9', 'D3'])
"HakulaPlayer" declared "call:0"
"KLChen2PokerPlayer" declared "raise:34"
"ZPlayer" declared "call:34"
"HakulaPlayer" declared "fold:0"
Street "turn" started. (community card = ['D7', 'C9', 'D3', 'H4'])
"KLChen2PokerPlayer" declared "raise:668"
"ZPlayer" declared "fold:0"
"['KLChen2PokerPlayer']" won the round 18 (stack = {'YangZ': 970, 'Ethan': 965, 'HakulaPlayer': 973, 'SichengZuo': 960, 'KLChen2PokerPlayer': 1497, 'Jinkun': 1070, 'NitWinWin': 970, 'ZPlayer': 595})
player [YangZ] gets hole card ['SJ', 'S8'], current stack 970
player [Ethan] gets hole card ['C5', 'S2'], current stack 965
player [HakulaPlayer] gets hole card ['SA', 'C9'], current stack 973
player [SichengZuo] gets hole card ['D8', 'DK'], current stack 955
player [KLChen2PokerPlayer] gets hole card ['D4', 'CK'], current stack 1487
player [Jinkun] gets hole card ['SQ', 'H8'], current stack 1070
player [NitWinWin] gets hole card ['SK', 'C4'], current stack 970
player [ZPlayer] gets hole card ['H6', 'H9'], current stack 595
Started the round 19
Street "preflop" started. (community card = [])
"Jinkun" declared "fold:10"
"NitWinWin" declared "fold:0"
"ZPlayer" declared "raise:15"
"YangZ" declared "fold:0"
"Ethan" declared "fold:0"
"HakulaPlayer" declared "call:15"
"SichengZuo" declared "fold:0"
"KLChen2PokerPlayer" declared "raise:20"
"ZPlayer" declared "call:20"
"HakulaPlayer" declared "call:20"
Street "flop" started. (community card = ['C6', 'S5', 'CA'])
"KLChen2PokerPlayer" declared "call:0"
"ZPlayer" declared "raise:10"
"HakulaPlayer" declared "raise:73"
"KLChen2PokerPlayer" declared "fold:0"
"ZPlayer" declared "fold:0"
"['HakulaPlayer']" won the round 19 (stack = {'YangZ': 970, 'Ethan': 965, 'HakulaPlayer': 1028, 'SichengZuo': 955, 'KLChen2PokerPlayer': 1477, 'Jinkun': 1070, 'NitWinWin': 970, 'ZPlayer': 565})
player [YangZ] gets hole card ['HQ', 'CK'], current stack 970
player [Ethan] gets hole card ['H3', 'D7'], current stack 965
player [HakulaPlayer] gets hole card ['S6', 'D6'], current stack 1028
player [SichengZuo] gets hole card ['H7', 'S4'], current stack 955
player [KLChen2PokerPlayer] gets hole card ['C3', 'DJ'], current stack 1472
player [Jinkun] gets hole card ['S5', 'C5'], current stack 1060
player [NitWinWin] gets hole card ['HJ', 'D8'], current stack 970
player [ZPlayer] gets hole card ['C8', 'ST'], current stack 565
Started the round 20
Street "preflop" started. (community card = [])
"NitWinWin" declared "fold:0"
"ZPlayer" declared "call:10"
"YangZ" declared "fold:0"
"Ethan" declared "fold:0"
"HakulaPlayer" declared "raise:32"
"SichengZuo" declared "fold:0"
"KLChen2PokerPlayer" declared "fold:0"
"Jinkun" declared "fold:32"
"ZPlayer" declared "call:32"
Street "flop" started. (community card = ['H9', 'SK', 'C9'])
"ZPlayer" declared "call:0"
"HakulaPlayer" declared "call:0"
Street "turn" started. (community card = ['H9', 'SK', 'C9', 'C6'])
"ZPlayer" declared "call:0"
"HakulaPlayer" declared "call:0"
Street "river" started. (community card = ['H9', 'SK', 'C9', 'C6', 'DA'])
"ZPlayer" declared "call:0"
"HakulaPlayer" declared "raise:107"
"ZPlayer" declared "fold:0"
"['HakulaPlayer']" won the round 20 (stack = {'YangZ': 970, 'Ethan': 965, 'HakulaPlayer': 1075, 'SichengZuo': 955, 'KLChen2PokerPlayer': 1472, 'Jinkun': 1060, 'NitWinWin': 970, 'ZPlayer': 533})
player [YangZ] gets hole card ['S2', 'ST'], current stack 970
player [Ethan] gets hole card ['S3', 'D2'], current stack 965
player [HakulaPlayer] gets hole card ['C5', 'CT'], current stack 1075
player [SichengZuo] gets hole card ['HK', 'H4'], current stack 955
player [KLChen2PokerPlayer] gets hole card ['S8', 'D3'], current stack 1472
player [Jinkun] gets hole card ['C4', 'H6'], current stack 1055
player [NitWinWin] gets hole card ['CJ', 'S9'], current stack 960
player [ZPlayer] gets hole card ['C7', 'HQ'], current stack 533
Started the round 21
Street "preflop" started. (community card = [])
"ZPlayer" declared "call:10"
"YangZ" declared "fold:0"
"Ethan" declared "fold:0"
"HakulaPlayer" declared "call:10"
"SichengZuo" declared "fold:0"
"KLChen2PokerPlayer" declared "fold:0"
"Jinkun" declared "call:10"
"NitWinWin" declared "fold:0"
Street "flop" started. (community card = ['C9', 'C6', 'H2'])
"Jinkun" declared "call:0"
"ZPlayer" declared "call:0"
"HakulaPlayer" declared "call:0"
Street "turn" started. (community card = ['C9', 'C6', 'H2', 'S7'])
"Jinkun" declared "call:0"
"ZPlayer" declared "raise:10"
"HakulaPlayer" declared "fold:0"
"Jinkun" declared "call:10"
Street "river" started. (community card = ['C9', 'C6', 'H2', 'S7', 'C2'])
"Jinkun" declared "call:0"
"ZPlayer" declared "raise:10"
"Jinkun" declared "call:10"
"['ZPlayer']" won the round 21 (stack = {'YangZ': 970, 'Ethan': 965, 'HakulaPlayer': 1065, 'SichengZuo': 955, 'KLChen2PokerPlayer': 1472, 'Jinkun': 1030, 'NitWinWin': 960, 'ZPlayer': 583})
player [YangZ] gets hole card ['H5', 'C4'], current stack 970
player [Ethan] gets hole card ['D3', 'S8'], current stack 965
player [HakulaPlayer] gets hole card ['SK', 'ST'], current stack 1065
player [SichengZuo] gets hole card ['SJ', 'H7'], current stack 955
player [KLChen2PokerPlayer] gets hole card ['HK', 'S5'], current stack 1472
player [Jinkun] gets hole card ['H8', 'SA'], current stack 1030
player [NitWinWin] gets hole card ['D4', 'H9'], current stack 955
player [ZPlayer] gets hole card ['C5', 'D5'], current stack 573
Started the round 22
Street "preflop" started. (community card = [])
"YangZ" declared "fold:0"
"Ethan" declared "fold:0"
"HakulaPlayer" declared "call:10"
"SichengZuo" declared "fold:0"
"KLChen2PokerPlayer" declared "raise:15"
"Jinkun" declared "fold:15"
"NitWinWin" declared "fold:0"
"ZPlayer" declared "call:15"
"HakulaPlayer" declared "raise:49"
"KLChen2PokerPlayer" declared "fold:0"
"ZPlayer" declared "call:49"
Street "flop" started. (community card = ['CA', 'CK', 'C9'])
"ZPlayer" declared "call:0"
"HakulaPlayer" declared "raise:172"
"ZPlayer" declared "fold:0"
"['HakulaPlayer']" won the round 22 (stack = {'YangZ': 970, 'Ethan': 965, 'HakulaPlayer': 1134, 'SichengZuo': 955, 'KLChen2PokerPlayer': 1457, 'Jinkun': 1030, 'NitWinWin': 955, 'ZPlayer': 534})
player [YangZ] gets hole card ['HQ', 'C8'], current stack 960
player [Ethan] gets hole card ['SA', 'H4'], current stack 965
player [HakulaPlayer] gets hole card ['S2', 'H6'], current stack 1134
player [SichengZuo] gets hole card ['C4', 'C2'], current stack 955
player [KLChen2PokerPlayer] gets hole card ['CT', 'D6'], current stack 1457
player [Jinkun] gets hole card ['DA', 'S9'], current stack 1030
player [NitWinWin] gets hole card ['D3', 'CK'], current stack 955
player [ZPlayer] gets hole card ['SQ', 'CQ'], current stack 529
Started the round 23
Street "preflop" started. (community card = [])
"Ethan" declared "fold:0"
"HakulaPlayer" declared "fold:0"
"SichengZuo" declared "fold:0"
"KLChen2PokerPlayer" declared "call:10"
"Jinkun" declared "fold:10"
"NitWinWin" declared "fold:0"
"ZPlayer" declared "raise:15"
"YangZ" declared "fold:0"
"KLChen2PokerPlayer" declared "fold:0"
"['ZPlayer']" won the round 23 (stack = {'YangZ': 960, 'Ethan': 965, 'HakulaPlayer': 1134, 'SichengZuo': 955, 'KLChen2PokerPlayer': 1447, 'Jinkun': 1030, 'NitWinWin': 955, 'ZPlayer': 554})
player [YangZ] gets hole card ['CA', 'D6'], current stack 955
player [Ethan] gets hole card ['C9', 'D8'], current stack 955
player [HakulaPlayer] gets hole card ['D3', 'S5'], current stack 1134
player [SichengZuo] gets hole card ['HJ', 'D4'], current stack 955
player [KLChen2PokerPlayer] gets hole card ['S9', 'H9'], current stack 1447
player [Jinkun] gets hole card ['D9', 'DK'], current stack 1030
player [NitWinWin] gets hole card ['HQ', 'H5'], current stack 955
player [ZPlayer] gets hole card ['D2', 'SQ'], current stack 554
Started the round 24
Street "preflop" started. (community card = [])
"HakulaPlayer" declared "fold:0"
"SichengZuo" declared "fold:0"
"KLChen2PokerPlayer" declared "raise:17"
"Jinkun" declared "fold:17"
"NitWinWin" declared "fold:0"
"ZPlayer" declared "call:17"
"YangZ" declared "fold:0"
"Ethan" declared "call:17"
Street "flop" started. (community card = ['CQ', 'H3', 'C6'])
"Ethan" declared "call:0"
"KLChen2PokerPlayer" declared "raise:17"
"ZPlayer" declared "raise:36"
"Ethan" declared "fold:0"
"KLChen2PokerPlayer" declared "fold:0"
"['ZPlayer']" won the round 24 (stack = {'YangZ': 955, 'Ethan': 948, 'HakulaPlayer': 1134, 'SichengZuo': 955, 'KLChen2PokerPlayer': 1413, 'Jinkun': 1030, 'NitWinWin': 955, 'ZPlayer': 610})
player [YangZ] gets hole card ['HT', 'H5'], current stack 955
player [Ethan] gets hole card ['S9', 'HQ'], current stack 943
player [HakulaPlayer] gets hole card ['H2', 'C9'], current stack 1124
player [SichengZuo] gets hole card ['S4', 'S2'], current stack 955
player [KLChen2PokerPlayer] gets hole card ['H7', 'DJ'], current stack 1413
player [Jinkun] gets hole card ['H9', 'CJ'], current stack 1030
player [NitWinWin] gets hole card ['ST', 'HK'], current stack 955
player [ZPlayer] gets hole card ['D2', 'C4'], current stack 610
Started the round 25
Street "preflop" started. (community card = [])
"SichengZuo" declared "fold:0"
"KLChen2PokerPlayer" declared "call:10"
"Jinkun" declared "fold:10"
"NitWinWin" declared "fold:0"
"ZPlayer" declared "call:10"
"YangZ" declared "fold:0"
"Ethan" declared "fold:0"
"HakulaPlayer" declared "call:10"
Street "flop" started. (community card = ['SJ', 'S5', 'SK'])
"HakulaPlayer" declared "call:0"
"KLChen2PokerPlayer" declared "raise:16"
"ZPlayer" declared "fold:0"
"HakulaPlayer" declared "fold:0"
"['KLChen2PokerPlayer']" won the round 25 (stack = {'YangZ': 955, 'Ethan': 943, 'HakulaPlayer': 1124, 'SichengZuo': 955, 'KLChen2PokerPlayer': 1438, 'Jinkun': 1030, 'NitWinWin': 955, 'ZPlayer': 600})
player [YangZ] gets hole card ['DT', 'D2'], current stack 955
player [Ethan] gets hole card ['DQ', 'H6'], current stack 943
player [HakulaPlayer] gets hole card ['S8', 'DA'], current stack 1119
player [SichengZuo] gets hole card ['C7', 'HA'], current stack 945
player [KLChen2PokerPlayer] gets hole card ['CJ', 'D8'], current stack 1438
player [Jinkun] gets hole card ['H2', 'CA'], current stack 1030
player [NitWinWin] gets hole card ['H8', 'H3'], current stack 955
player [ZPlayer] gets hole card ['D6', 'DK'], current stack 600
Started the round 26
Street "preflop" started. (community card = [])
"KLChen2PokerPlayer" declared "call:10"
"Jinkun" declared "fold:10"
"NitWinWin" declared "fold:0"
"ZPlayer" declared "raise:15"
"YangZ" declared "fold:0"
"Ethan" declared "fold:0"
"HakulaPlayer" declared "call:15"
"SichengZuo" declared "fold:0"
"KLChen2PokerPlayer" declared "fold:0"
Street "flop" started. (community card = ['CQ', 'C6', 'S6'])
"HakulaPlayer" declared "call:0"
"ZPlayer" declared "raise:180"
"HakulaPlayer" declared "fold:0"
"['ZPlayer']" won the round 26 (stack = {'YangZ': 955, 'Ethan': 943, 'HakulaPlayer': 1109, 'SichengZuo': 945, 'KLChen2PokerPlayer': 1428, 'Jinkun': 1030, 'NitWinWin': 955, 'ZPlayer': 635})
player [YangZ] gets hole card ['S8', 'SK'], current stack 955
player [Ethan] gets hole card ['D2', 'H5'], current stack 943
player [HakulaPlayer] gets hole card ['C7', 'S7'], current stack 1109
player [SichengZuo] gets hole card ['CT', 'S2'], current stack 940
player [KLChen2PokerPlayer] gets hole card ['DA', 'CA'], current stack 1418
player [Jinkun] gets hole card ['H3', 'H4'], current stack 1030
player [NitWinWin] gets hole card ['H2', 'H8'], current stack 955
player [ZPlayer] gets hole card ['C5', 'DK'], current stack 635
Started the round 27
Street "preflop" started. (community card = [])
"Jinkun" declared "fold:10"
"NitWinWin" declared "fold:0"
"ZPlayer" declared "call:10"
"YangZ" declared "fold:0"
"Ethan" declared "fold:0"
"HakulaPlayer" declared "raise:31"
"SichengZuo" declared "fold:0"
"KLChen2PokerPlayer" declared "call:31"
"ZPlayer" declared "call:31"
Street "flop" started. (community card = ['ST', 'SQ', 'S6'])
"KLChen2PokerPlayer" declared "raise:24"
"ZPlayer" declared "fold:0"
"HakulaPlayer" declared "call:24"
Street "turn" started. (community card = ['ST', 'SQ', 'S6', 'D7'])
"KLChen2PokerPlayer" declared "raise:306"
"HakulaPlayer" declared "call:306"
Street "river" started. (community card = ['ST', 'SQ', 'S6', 'D7', 'DT'])
"KLChen2PokerPlayer" declared "raise:240"
"HakulaPlayer" declared "raise:748"
"KLChen2PokerPlayer" declared "fold:0"
"['HakulaPlayer']" won the round 27 (stack = {'YangZ': 955, 'Ethan': 943, 'HakulaPlayer': 1746, 'SichengZuo': 940, 'KLChen2PokerPlayer': 827, 'Jinkun': 1030, 'NitWinWin': 955, 'ZPlayer': 604})
player [YangZ] gets hole card ['HA', 'D4'], current stack 955
player [Ethan] gets hole card ['S2', 'CK'], current stack 943
player [HakulaPlayer] gets hole card ['C3', 'D6'], current stack 1746
player [SichengZuo] gets hole card ['CQ', 'H9'], current stack 940
player [KLChen2PokerPlayer] gets hole card ['S4', 'CT'], current stack 822
player [Jinkun] gets hole card ['H5', 'C2'], current stack 1020
player [NitWinWin] gets hole card ['S9', 'CA'], current stack 955
player [ZPlayer] gets hole card ['H4', 'ST'], current stack 604
Started the round 28
Street "preflop" started. (community card = [])
"NitWinWin" declared "fold:0"
"ZPlayer" declared "call:10"
"YangZ" declared "fold:0"
"Ethan" declared "fold:0"
"HakulaPlayer" declared "fold:0"
"SichengZuo" declared "fold:0"
"KLChen2PokerPlayer" declared "fold:0"
"Jinkun" declared "call:10"
Street "flop" started. (community card = ['SQ', 'CJ', 'SJ'])
"Jinkun" declared "call:0"
"ZPlayer" declared "call:0"
Street "turn" started. (community card = ['SQ', 'CJ', 'SJ', 'C8'])
"Jinkun" declared "call:0"
"ZPlayer" declared "call:0"
Street "river" started. (community card = ['SQ', 'CJ', 'SJ', 'C8', 'H8'])
"Jinkun" declared "call:0"
"ZPlayer" declared "call:0"
"['Jinkun', 'ZPlayer']" won the round 28 (stack = {'YangZ': 955, 'Ethan': 943, 'HakulaPlayer': 1746, 'SichengZuo': 940, 'KLChen2PokerPlayer': 822, 'Jinkun': 1032, 'NitWinWin': 955, 'ZPlayer': 606})
player [YangZ] gets hole card ['C9', 'D4'], current stack 955
player [Ethan] gets hole card ['HJ', 'ST'], current stack 943
player [HakulaPlayer] gets hole card ['H5', 'C2'], current stack 1746
player [SichengZuo] gets hole card ['C5', 'S6'], current stack 940
player [KLChen2PokerPlayer] gets hole card ['D3', 'HA'], current stack 822
player [Jinkun] gets hole card ['DK', 'SJ'], current stack 1027
player [NitWinWin] gets hole card ['DA', 'C8'], current stack 945
player [ZPlayer] gets hole card ['CK', 'D7'], current stack 606
Started the round 29
Street "preflop" started. (community card = [])
"ZPlayer" declared "call:10"
"YangZ" declared "fold:0"
"Ethan" declared "call:10"
"HakulaPlayer" declared "fold:0"
"SichengZuo" declared "fold:0"
"KLChen2PokerPlayer" declared "raise:15"
"Jinkun" declared "fold:15"
"NitWinWin" declared "fold:0"
"ZPlayer" declared "call:15"
"Ethan" declared "raise:56"
"KLChen2PokerPlayer" declared "fold:0"
"ZPlayer" declared "call:56"
Street "flop" started. (community card = ['C7', 'S9', 'HK'])
"ZPlayer" declared "raise:142"
"Ethan" declared "call:142"
Street "turn" started. (community card = ['C7', 'S9', 'HK', 'S4'])
"ZPlayer" declared "raise:408"
"Ethan" declared "fold:0"
"['ZPlayer']" won the round 29 (stack = {'YangZ': 955, 'Ethan': 745, 'HakulaPlayer': 1746, 'SichengZuo': 940, 'KLChen2PokerPlayer': 807, 'Jinkun': 1027, 'NitWinWin': 945, 'ZPlayer': 834})
player [YangZ] gets hole card ['C6', 'S3'], current stack 955
player [Ethan] gets hole card ['HA', 'CQ'], current stack 745
player [HakulaPlayer] gets hole card ['D5', 'DA'], current stack 1746
player [SichengZuo] gets hole card ['S7', 'D7'], current stack 940
player [KLChen2PokerPlayer] gets hole card ['SJ', 'C7'], current stack 807
player [Jinkun] gets hole card ['CK', 'H7'], current stack 1027
player [NitWinWin] gets hole card ['D2', 'HQ'], current stack 940
player [ZPlayer] gets hole card ['S5', 'C2'], current stack 824
Started the round 30
Street "preflop" started. (community card = [])
"YangZ" declared "fold:0"
"Ethan" declared "raise:111"
"HakulaPlayer" declared "fold:0"
"SichengZuo" declared "fold:0"
"KLChen2PokerPlayer" declared "fold:0"
"Jinkun" declared "fold:111"
"NitWinWin" declared "fold:0"
"ZPlayer" declared "fold:0"
"['Ethan']" won the round 30 (stack = {'YangZ': 955, 'Ethan': 760, 'HakulaPlayer': 1746, 'SichengZuo': 940, 'KLChen2PokerPlayer': 807, 'Jinkun': 1027, 'NitWinWin': 940, 'ZPlayer': 824})
player [YangZ] gets hole card ['S3', 'S9'], current stack 945
player [Ethan] gets hole card ['HJ', 'D9'], current stack 760
player [HakulaPlayer] gets hole card ['DK', 'HT'], current stack 1746
player [SichengZuo] gets hole card ['DJ', 'CJ'], current stack 940
player [KLChen2PokerPlayer] gets hole card ['C6', 'H6'], current stack 807
player [Jinkun] gets hole card ['C9', 'C3'], current stack 1027
player [NitWinWin] gets hole card ['C4', 'S4'], current stack 940
player [ZPlayer] gets hole card ['D7', 'CT'], current stack 819
Started the round 31
Street "preflop" started. (community card = [])
"Ethan" declared "fold:0"
"HakulaPlayer" declared "call:10"
"SichengZuo" declared "fold:0"
"KLChen2PokerPlayer" declared "raise:26"
"Jinkun" declared "fold:26"
"NitWinWin" declared "fold:0"
"ZPlayer" declared "call:26"
"YangZ" declared "fold:0"
"HakulaPlayer" declared "call:26"
Street "flop" started. (community card = ['ST', 'C8', 'DQ'])
"ZPlayer" declared "raise:10"
"HakulaPlayer" declared "call:10"
"KLChen2PokerPlayer" declared "fold:0"
Street "turn" started. (community card = ['ST', 'C8', 'DQ', 'S6'])
"ZPlayer" declared "raise:10"
"HakulaPlayer" declared "call:10"
Street "river" started. (community card = ['ST', 'C8', 'DQ', 'S6', 'HQ'])
"ZPlayer" declared "raise:10"
"HakulaPlayer" declared "raise:157"
"ZPlayer" declared "call:157"
"['HakulaPlayer']" won the round 31 (stack = {'YangZ': 945, 'Ethan': 760, 'HakulaPlayer': 1985, 'SichengZuo': 940, 'KLChen2PokerPlayer': 781, 'Jinkun': 1027, 'NitWinWin': 940, 'ZPlayer': 621})
player [YangZ] gets hole card ['CA', 'S2'], current stack 940
player [Ethan] gets hole card ['CK', 'C2'], current stack 750
player [HakulaPlayer] gets hole card ['C5', 'C9'], current stack 1985
player [SichengZuo] gets hole card ['SJ', 'ST'], current stack 940
player [KLChen2PokerPlayer] gets hole card ['D4', 'CT'], current stack 781
player [Jinkun] gets hole card ['C4', 'CJ'], current stack 1027
player [NitWinWin] gets hole card ['D9', 'SA'], current stack 940
player [ZPlayer] gets hole card ['H7', 'S6'], current stack 621
Started the round 32
Street "preflop" started. (community card = [])
"HakulaPlayer" declared "fold:0"
"SichengZuo" declared "fold:0"
"KLChen2PokerPlayer" declared "call:10"
"Jinkun" declared "fold:10"
"NitWinWin" declared "fold:0"
"ZPlayer" declared "call:10"
"YangZ" declared "fold:0"
"Ethan" declared "fold:0"
Street "flop" started. (community card = ['H4', 'SQ', 'HA'])
"KLChen2PokerPlayer" declared "raise:18"
"ZPlayer" declared "fold:0"
"['KLChen2PokerPlayer']" won the round 32 (stack = {'YangZ': 940, 'Ethan': 750, 'HakulaPlayer': 1985, 'SichengZuo': 940, 'KLChen2PokerPlayer': 806, 'Jinkun': 1027, 'NitWinWin': 940, 'ZPlayer': 611})
player [YangZ] gets hole card ['H4', 'S5'], current stack 940
player [Ethan] gets hole card ['DT', 'C9'], current stack 745
player [HakulaPlayer] gets hole card ['HJ', 'SK'], current stack 1975
player [SichengZuo] gets hole card ['H2', 'HK'], current stack 940
player [KLChen2PokerPlayer] gets hole card ['C2', 'CA'], current stack 806
player [Jinkun] gets hole card ['D8', 'SA'], current stack 1027
player [NitWinWin] gets hole card ['D9', 'S7'], current stack 940
player [ZPlayer] gets hole card ['C6', 'D3'], current stack 611
Started the round 33
Street "preflop" started. (community card = [])
"SichengZuo" declared "fold:0"
"KLChen2PokerPlayer" declared "raise:24"
"Jinkun" declared "fold:24"
"NitWinWin" declared "fold:0"
"ZPlayer" declared "call:24"
"YangZ" declared "fold:0"
"Ethan" declared "fold:0"
"HakulaPlayer" declared "call:24"
Street "flop" started. (community card = ['DK', 'D7', 'D5'])
"HakulaPlayer" declared "call:0"
"KLChen2PokerPlayer" declared "call:0"
"ZPlayer" declared "call:0"
Street "turn" started. (community card = ['DK', 'D7', 'D5', 'CT'])
"HakulaPlayer" declared "call:0"
"KLChen2PokerPlayer" declared "call:0"
"ZPlayer" declared "call:0"
Street "river" started. (community card = ['DK', 'D7', 'D5', 'CT', 'C3'])
"HakulaPlayer" declared "call:0"
"KLChen2PokerPlayer" declared "call:0"
"ZPlayer" declared "call:0"
"['HakulaPlayer']" won the round 33 (stack = {'YangZ': 940, 'Ethan': 745, 'HakulaPlayer': 2038, 'SichengZuo': 940, 'KLChen2PokerPlayer': 782, 'Jinkun': 1027, 'NitWinWin': 940, 'ZPlayer': 587})
player [YangZ] gets hole card ['S6', 'ST'], current stack 940
player [Ethan] gets hole card ['D7', 'HT'], current stack 745
player [HakulaPlayer] gets hole card ['HJ', 'C5'], current stack 2033
player [SichengZuo] gets hole card ['SK', 'C4'], current stack 930
player [KLChen2PokerPlayer] gets hole card ['C9', 'CA'], current stack 782
player [Jinkun] gets hole card ['D6', 'SJ'], current stack 1027
player [NitWinWin] gets hole card ['S4', 'DJ'], current stack 940
player [ZPlayer] gets hole card ['D8', 'S2'], current stack 587
Started the round 34
Street "preflop" started. (community card = [])
"KLChen2PokerPlayer" declared "raise:16"
"Jinkun" declared "fold:16"
"NitWinWin" declared "fold:0"
"ZPlayer" declared "call:16"
"YangZ" declared "fold:0"
"Ethan" declared "fold:0"
"HakulaPlayer" declared "call:16"
"SichengZuo" declared "fold:0"
Street "flop" started. (community card = ['HK', 'DA', 'HQ'])
"HakulaPlayer" declared "call:0"
"KLChen2PokerPlayer" declared "raise:22"
"ZPlayer" declared "fold:0"
"HakulaPlayer" declared "call:22"
Street "turn" started. (community card = ['HK', 'DA', 'HQ', 'S7'])
"HakulaPlayer" declared "call:0"
"KLChen2PokerPlayer" declared "raise:228"
"HakulaPlayer" declared "fold:0"
"['KLChen2PokerPlayer']" won the round 34 (stack = {'YangZ': 940, 'Ethan': 745, 'HakulaPlayer': 2000, 'SichengZuo': 930, 'KLChen2PokerPlayer': 846, 'Jinkun': 1027, 'NitWinWin': 940, 'ZPlayer': 571})
player [YangZ] gets hole card ['D5', 'SA'], current stack 940
player [Ethan] gets hole card ['H5', 'H4'], current stack 745
player [HakulaPlayer] gets hole card ['C4', 'DJ'], current stack 2000
player [SichengZuo] gets hole card ['S2', 'S5'], current stack 925
player [KLChen2PokerPlayer] gets hole card ['D7', 'C8'], current stack 836
player [Jinkun] gets hole card ['CJ', 'DT'], current stack 1027
player [NitWinWin] gets hole card ['HA', 'HT'], current stack 940
player [ZPlayer] gets hole card ['CQ', 'S8'], current stack 571
Started the round 35
Street "preflop" started. (community card = [])
"Jinkun" declared "fold:10"
"NitWinWin" declared "fold:0"
"ZPlayer" declared "call:10"
"YangZ" declared "fold:0"
"Ethan" declared "fold:0"
"HakulaPlayer" declared "call:10"
"SichengZuo" declared "fold:0"
"KLChen2PokerPlayer" declared "call:10"
Street "flop" started. (community card = ['SK', 'D2', 'D4'])
"KLChen2PokerPlayer" declared "call:0"
"ZPlayer" declared "call:0"
"HakulaPlayer" declared "call:0"
Street "turn" started. (community card = ['SK', 'D2', 'D4', 'D3'])
"KLChen2PokerPlayer" declared "call:0"
"ZPlayer" declared "call:0"
"HakulaPlayer" declared "call:0"
Street "river" started. (community card = ['SK', 'D2', 'D4', 'D3', 'H7'])
"KLChen2PokerPlayer" declared "call:0"
"ZPlayer" declared "call:0"
"HakulaPlayer" declared "call:0"
"['KLChen2PokerPlayer']" won the round 35 (stack = {'YangZ': 940, 'Ethan': 745, 'HakulaPlayer': 1990, 'SichengZuo': 925, 'KLChen2PokerPlayer': 871, 'Jinkun': 1027, 'NitWinWin': 940, 'ZPlayer': 561})
player [YangZ] gets hole card ['C3', 'S2'], current stack 940
player [Ethan] gets hole card ['S9', 'C7'], current stack 745
player [HakulaPlayer] gets hole card ['HJ', 'HA'], current stack 1990
player [SichengZuo] gets hole card ['CA', 'D2'], current stack 925
player [KLChen2PokerPlayer] gets hole card ['H4', 'C6'], current stack 866
player [Jinkun] gets hole card ['C8', 'DJ'], current stack 1017
player [NitWinWin] gets hole card ['D4', 'S6'], current stack 940
player [ZPlayer] gets hole card ['SA', 'DA'], current stack 561
Started the round 36
Street "preflop" started. (community card = [])
"NitWinWin" declared "fold:0"
"ZPlayer" declared "raise:15"
"YangZ" declared "fold:0"
"Ethan" declared "fold:0"
"HakulaPlayer" declared "call:15"
"SichengZuo" declared "fold:0"
"KLChen2PokerPlayer" declared "fold:0"
"Jinkun" declared "call:15"
Street "flop" started. (community card = ['DT', 'SQ', 'SJ'])
"Jinkun" declared "call:0"
"ZPlayer" declared "raise:438"
"HakulaPlayer" declared "fold:0"
"Jinkun" declared "fold:438"
"['ZPlayer']" won the round 36 (stack = {'YangZ': 940, 'Ethan': 745, 'HakulaPlayer': 1975, 'SichengZuo': 925, 'KLChen2PokerPlayer': 866, 'Jinkun': 1012, 'NitWinWin': 940, 'ZPlayer': 596})
player [YangZ] gets hole card ['D2', 'S7'], current stack 940
player [Ethan] gets hole card ['C2', 'H7'], current stack 745
player [HakulaPlayer] gets hole card ['H4', 'HK'], current stack 1975
player [SichengZuo] gets hole card ['C6', 'DJ'], current stack 925
player [KLChen2PokerPlayer] gets hole card ['DQ', 'S5'], current stack 866
player [Jinkun] gets hole card ['HA', 'D6'], current stack 1007
player [NitWinWin] gets hole card ['S8', 'C4'], current stack 930
player [ZPlayer] gets hole card ['D9', 'H5'], current stack 596
Started the round 37
Street "preflop" started. (community card = [])
"ZPlayer" declared "call:10"
"YangZ" declared "fold:0"
"Ethan" declared "fold:0"
"HakulaPlayer" declared "call:10"
"SichengZuo" declared "fold:0"
"KLChen2PokerPlayer" declared "fold:0"
"Jinkun" declared "call:10"
"NitWinWin" declared "fold:0"
Street "flop" started. (community card = ['C8', 'CQ', 'H6'])
"Jinkun" declared "call:0"
"ZPlayer" declared "call:0"
"HakulaPlayer" declared "call:0"
Street "turn" started. (community card = ['C8', 'CQ', 'H6', 'S4'])
"Jinkun" declared "call:0"
"ZPlayer" declared "call:0"
"HakulaPlayer" declared "raise:35"
"Jinkun" declared "fold:35"
"ZPlayer" declared "fold:0"
"['HakulaPlayer']" won the round 37 (stack = {'YangZ': 940, 'Ethan': 745, 'HakulaPlayer': 2005, 'SichengZuo': 925, 'KLChen2PokerPlayer': 866, 'Jinkun': 1002, 'NitWinWin': 930, 'ZPlayer': 586})
player [YangZ] gets hole card ['DA', 'H5'], current stack 940
player [Ethan] gets hole card ['H3', 'C6'], current stack 745
player [HakulaPlayer] gets hole card ['D6', 'S4'], current stack 2005
player [SichengZuo] gets hole card ['C2', 'H8'], current stack 925
player [KLChen2PokerPlayer] gets hole card ['SA', 'S7'], current stack 866
player [Jinkun] gets hole card ['CT', 'S3'], current stack 1002
player [NitWinWin] gets hole card ['CQ', 'DJ'], current stack 925
player [ZPlayer] gets hole card ['C8', 'D5'], current stack 576
Started the round 38
Street "preflop" started. (community card = [])
"YangZ" declared "fold:0"
"Ethan" declared "fold:0"
"HakulaPlayer" declared "fold:0"
"SichengZuo" declared "fold:0"
"KLChen2PokerPlayer" declared "raise:17"
"Jinkun" declared "fold:17"
"NitWinWin" declared "fold:0"
"ZPlayer" declared "call:17"
Street "flop" started. (community card = ['C9', 'HK', 'HQ'])
"ZPlayer" declared "call:0"
"KLChen2PokerPlayer" declared "call:0"
Street "turn" started. (community card = ['C9', 'HK', 'HQ', 'S6'])
"ZPlayer" declared "call:0"
"KLChen2PokerPlayer" declared "call:0"
Street "river" started. (community card = ['C9', 'HK', 'HQ', 'S6', 'SQ'])
"ZPlayer" declared "call:0"
"KLChen2PokerPlayer" declared "call:0"
"['KLChen2PokerPlayer']" won the round 38 (stack = {'YangZ': 940, 'Ethan': 745, 'HakulaPlayer': 2005, 'SichengZuo': 925, 'KLChen2PokerPlayer': 888, 'Jinkun': 1002, 'NitWinWin': 925, 'ZPlayer': 569})
player [YangZ] gets hole card ['ST', 'HK'], current stack 930
player [Ethan] gets hole card ['D4', 'DA'], current stack 745
player [HakulaPlayer] gets hole card ['D2', 'H8'], current stack 2005
player [SichengZuo] gets hole card ['S7', 'C5'], current stack 925
player [KLChen2PokerPlayer] gets hole card ['DT', 'S5'], current stack 888
player [Jinkun] gets hole card ['C8', 'H6'], current stack 1002
player [NitWinWin] gets hole card ['D5', 'SQ'], current stack 925
player [ZPlayer] gets hole card ['D8', 'D6'], current stack 564
Started the round 39
Street "preflop" started. (community card = [])
"Ethan" declared "fold:0"
"HakulaPlayer" declared "fold:0"
"SichengZuo" declared "fold:0"
"KLChen2PokerPlayer" declared "fold:0"
"Jinkun" declared "call:10"
"NitWinWin" declared "fold:0"
"ZPlayer" declared "raise:15"
"YangZ" declared "fold:0"
"Jinkun" declared "call:15"
Street "flop" started. (community card = ['CA', 'HA', 'H2'])
"ZPlayer" declared "call:0"
"Jinkun" declared "call:0"
Street "turn" started. (community card = ['CA', 'HA', 'H2', 'SK'])
"ZPlayer" declared "call:0"
"Jinkun" declared "call:0"
Street "river" started. (community card = ['CA', 'HA', 'H2', 'SK', 'H9'])
"ZPlayer" declared "call:0"
"Jinkun" declared "call:0"
"['Jinkun', 'ZPlayer']" won the round 39 (stack = {'YangZ': 930, 'Ethan': 745, 'HakulaPlayer': 2005, 'SichengZuo': 925, 'KLChen2PokerPlayer': 888, 'Jinkun': 1007, 'NitWinWin': 925, 'ZPlayer': 574})
player [YangZ] gets hole card ['SK', 'DQ'], current stack 925
player [Ethan] gets hole card ['CK', 'SJ'], current stack 735
player [HakulaPlayer] gets hole card ['D3', 'H6'], current stack 2005
player [SichengZuo] gets hole card ['ST', 'S9'], current stack 925
player [KLChen2PokerPlayer] gets hole card ['H5', 'DJ'], current stack 888
player [Jinkun] gets hole card ['HJ', 'D6'], current stack 1007
player [NitWinWin] gets hole card ['HT', 'D8'], current stack 925
player [ZPlayer] gets hole card ['S3', 'S4'], current stack 574
Started the round 40
Street "preflop" started. (community card = [])
"HakulaPlayer" declared "fold:0"
"SichengZuo" declared "fold:0"
"KLChen2PokerPlayer" declared "fold:0"
"Jinkun" declared "fold:10"
"NitWinWin" declared "fold:0"
"ZPlayer" declared "call:10"
"YangZ" declared "fold:0"
"Ethan" declared "raise:111"
"ZPlayer" declared "fold:0"
"['Ethan']" won the round 40 (stack = {'YangZ': 925, 'Ethan': 760, 'HakulaPlayer': 2005, 'SichengZuo': 925, 'KLChen2PokerPlayer': 888, 'Jinkun': 1007, 'NitWinWin': 925, 'ZPlayer': 564})
player [YangZ] gets hole card ['S4', 'D9'], current stack 925
player [Ethan] gets hole card ['DJ', 'S5'], current stack 755
player [HakulaPlayer] gets hole card ['C2', 'DT'], current stack 1995
player [SichengZuo] gets hole card ['H7', 'H8'], current stack 925
player [KLChen2PokerPlayer] gets hole card ['S2', 'H2'], current stack 888
player [Jinkun] gets hole card ['HQ', 'DQ'], current stack 1007
player [NitWinWin] gets hole card ['DA', 'H5'], current stack 925
player [ZPlayer] gets hole card ['CK', 'H9'], current stack 564
Started the round 41
Street "preflop" started. (community card = [])
"SichengZuo" declared "fold:0"
"KLChen2PokerPlayer" declared "call:10"
"Jinkun" declared "fold:10"
"NitWinWin" declared "fold:0"
"ZPlayer" declared "raise:15"
"YangZ" declared "fold:0"
"Ethan" declared "fold:0"
"HakulaPlayer" declared "call:15"
"KLChen2PokerPlayer" declared "fold:0"
Street "flop" started. (community card = ['S3', 'D4', 'H4'])
"HakulaPlayer" declared "call:0"
"ZPlayer" declared "call:0"
Street "turn" started. (community card = ['S3', 'D4', 'H4', 'C9'])
"HakulaPlayer" declared "call:0"
"ZPlayer" declared "raise:10"
"HakulaPlayer" declared "fold:0"
"['ZPlayer']" won the round 41 (stack = {'YangZ': 925, 'Ethan': 755, 'HakulaPlayer': 1990, 'SichengZuo': 925, 'KLChen2PokerPlayer': 878, 'Jinkun': 1007, 'NitWinWin': 925, 'ZPlayer': 594})
player [YangZ] gets hole card ['C6', 'S6'], current stack 925
player [Ethan] gets hole card ['D6', 'H5'], current stack 755
player [HakulaPlayer] gets hole card ['D9', 'HQ'], current stack 1985
player [SichengZuo] gets hole card ['H3', 'CA'], current stack 915
player [KLChen2PokerPlayer] gets hole card ['S8', 'CJ'], current stack 878
player [Jinkun] gets hole card ['DT', 'S3'], current stack 1007
player [NitWinWin] gets hole card ['SK', 'HA'], current stack 925
player [ZPlayer] gets hole card ['S2', 'C9'], current stack 594
Started the round 42
Street "preflop" started. (community card = [])
"KLChen2PokerPlayer" declared "call:10"
"Jinkun" declared "fold:10"
"NitWinWin" declared "fold:0"
"ZPlayer" declared "call:10"
"YangZ" declared "fold:0"
"Ethan" declared "fold:0"
"HakulaPlayer" declared "call:10"
"SichengZuo" declared "fold:0"
Street "flop" started. (community card = ['ST', 'C8', 'DA'])
"HakulaPlayer" declared "call:0"
"KLChen2PokerPlayer" declared "raise:27"
"ZPlayer" declared "fold:0"
"HakulaPlayer" declared "fold:0"
"['KLChen2PokerPlayer']" won the round 42 (stack = {'YangZ': 925, 'Ethan': 755, 'HakulaPlayer': 1980, 'SichengZuo': 915, 'KLChen2PokerPlayer': 908, 'Jinkun': 1007, 'NitWinWin': 925, 'ZPlayer': 584})
player [YangZ] gets hole card ['C8', 'SQ'], current stack 925
player [Ethan] gets hole card ['C7', 'H6'], current stack 755
player [HakulaPlayer] gets hole card ['DT', 'H7'], current stack 1980
player [SichengZuo] gets hole card ['H8', 'SJ'], current stack 910
player [KLChen2PokerPlayer] gets hole card ['D9', 'C2'], current stack 898
player [Jinkun] gets hole card ['D6', 'HT'], current stack 1007
player [NitWinWin] gets hole card ['ST', 'D3'], current stack 925
player [ZPlayer] gets hole card ['C3', 'CJ'], current stack 584
Started the round 43
Street "preflop" started. (community card = [])
"Jinkun" declared "fold:10"
"NitWinWin" declared "fold:0"
"ZPlayer" declared "call:10"
"YangZ" declared "fold:0"
"Ethan" declared "fold:0"
"HakulaPlayer" declared "call:10"
"SichengZuo" declared "fold:0"
"KLChen2PokerPlayer" declared "fold:0"
Street "flop" started. (community card = ['C9', 'C6', 'D4'])
"ZPlayer" declared "raise:10"
"HakulaPlayer" declared "fold:0"
"['ZPlayer']" won the round 43 (stack = {'YangZ': 925, 'Ethan': 755, 'HakulaPlayer': 1970, 'SichengZuo': 910, 'KLChen2PokerPlayer': 898, 'Jinkun': 1007, 'NitWinWin': 925, 'ZPlayer': 609})
player [YangZ] gets hole card ['H2', 'H9'], current stack 925
player [Ethan] gets hole card ['CT', 'SQ'], current stack 755
player [HakulaPlayer] gets hole card ['D4', 'D9'], current stack 1970
player [SichengZuo] gets hole card ['H5', 'CQ'], current stack 910
player [KLChen2PokerPlayer] gets hole card ['HT', 'D5'], current stack 893
player [Jinkun] gets hole card ['C9', 'CK'], current stack 997
player [NitWinWin] gets hole card ['C3', 'S9'], current stack 925
player [ZPlayer] gets hole card ['H6', 'CJ'], current stack 609
Started the round 44
Street "preflop" started. (community card = [])
"NitWinWin" declared "fold:0"
"ZPlayer" declared "call:10"
"YangZ" declared "fold:0"
"Ethan" declared "fold:0"
"HakulaPlayer" declared "call:10"
"SichengZuo" declared "fold:0"
"KLChen2PokerPlayer" declared "fold:0"
"Jinkun" declared "call:10"
Street "flop" started. (community card = ['H7', 'HK', 'S5'])
"Jinkun" declared "call:0"
"ZPlayer" declared "call:0"
"HakulaPlayer" declared "call:0"
Street "turn" started. (community card = ['H7', 'HK', 'S5', 'H8'])
"Jinkun" declared "call:0"
"ZPlayer" declared "call:0"
"HakulaPlayer" declared "call:0"
Street "river" started. (community card = ['H7', 'HK', 'S5', 'H8', 'HQ'])
"Jinkun" declared "call:0"
"ZPlayer" declared "raise:35"
"HakulaPlayer" declared "fold:0"
"Jinkun" declared "call:35"
"['ZPlayer']" won the round 44 (stack = {'YangZ': 925, 'Ethan': 755, 'HakulaPlayer': 1960, 'SichengZuo': 910, 'KLChen2PokerPlayer': 893, 'Jinkun': 962, 'NitWinWin': 925, 'ZPlayer': 669})
player [YangZ] gets hole card ['D3', 'C3'], current stack 925
player [Ethan] gets hole card ['SJ', 'C6'], current stack 755
player [HakulaPlayer] gets hole card ['DA', 'CQ'], current stack 1960
player [SichengZuo] gets hole card ['C2', 'H5'], current stack 910
player [KLChen2PokerPlayer] gets hole card ['HQ', 'DJ'], current stack 893
player [Jinkun] gets hole card ['D9', 'HJ'], current stack 957
player [NitWinWin] gets hole card ['S6', 'H9'], current stack 915
player [ZPlayer] gets hole card ['CJ', 'ST'], current stack 669
Started the round 45
Street "preflop" started. (community card = [])
"ZPlayer" declared "raise:15"
"YangZ" declared "fold:0"
"Ethan" declared "fold:0"
"HakulaPlayer" declared "call:15"
"SichengZuo" declared "fold:0"
"KLChen2PokerPlayer" declared "raise:24"
"Jinkun" declared "fold:24"
"NitWinWin" declared "fold:0"
"ZPlayer" declared "call:24"
"HakulaPlayer" declared "raise:73"
"KLChen2PokerPlayer" declared "fold:0"
"ZPlayer" declared "fold:0"
"['HakulaPlayer']" won the round 45 (stack = {'YangZ': 925, 'Ethan': 755, 'HakulaPlayer': 2023, 'SichengZuo': 910, 'KLChen2PokerPlayer': 869, 'Jinkun': 957, 'NitWinWin': 915, 'ZPlayer': 645})
player [YangZ] gets hole card ['HK', 'ST'], current stack 925
player [Ethan] gets hole card ['CA', 'D2'], current stack 755
player [HakulaPlayer] gets hole card ['D5', 'C3'], current stack 2023
player [SichengZuo] gets hole card ['H9', 'HT'], current stack 910
player [KLChen2PokerPlayer] gets hole card ['C6', 'DT'], current stack 869
player [Jinkun] gets hole card ['H5', 'SQ'], current stack 957
player [NitWinWin] gets hole card ['CK', 'HJ'], current stack 910
player [ZPlayer] gets hole card ['S2', 'C8'], current stack 635
Started the round 46
Street "preflop" started. (community card = [])
"YangZ" declared "fold:0"
"Ethan" declared "fold:0"
"HakulaPlayer" declared "fold:0"
"SichengZuo" declared "fold:0"
"KLChen2PokerPlayer" declared "call:10"
"Jinkun" declared "call:10"
"NitWinWin" declared "fold:0"
"ZPlayer" declared "call:10"
Street "flop" started. (community card = ['SA', 'CQ', 'DJ'])
"ZPlayer" declared "call:0"
"KLChen2PokerPlayer" declared "call:0"
"Jinkun" declared "call:0"
Street "turn" started. (community card = ['SA', 'CQ', 'DJ', 'DQ'])
"ZPlayer" declared "call:0"
"KLChen2PokerPlayer" declared "call:0"
"Jinkun" declared "raise:14"
"ZPlayer" declared "fold:0"
"KLChen2PokerPlayer" declared "fold:0"
"['Jinkun']" won the round 46 (stack = {'YangZ': 925, 'Ethan': 755, 'HakulaPlayer': 2023, 'SichengZuo': 910, 'KLChen2PokerPlayer': 859, 'Jinkun': 982, 'NitWinWin': 910, 'ZPlayer': 635})
player [YangZ] gets hole card ['CA', 'H2'], current stack 915
player [Ethan] gets hole card ['C6', 'S2'], current stack 755
player [HakulaPlayer] gets hole card ['SQ', 'H8'], current stack 2023
player [SichengZuo] gets hole card ['S6', 'S9'], current stack 910
player [KLChen2PokerPlayer] gets hole card ['SJ', 'HK'], current stack 859
player [Jinkun] gets hole card ['H9', 'HT'], current stack 982
player [NitWinWin] gets hole card ['H6', 'D4'], current stack 910
player [ZPlayer] gets hole card ['HQ', 'S3'], current stack 630
Started the round 47
Street "preflop" started. (community card = [])
"Ethan" declared "fold:0"
"HakulaPlayer" declared "fold:0"
"SichengZuo" declared "fold:0"
"KLChen2PokerPlayer" declared "raise:17"
"Jinkun" declared "fold:17"
"NitWinWin" declared "fold:0"
"ZPlayer" declared "call:17"
"YangZ" declared "fold:0"
Street "flop" started. (community card = ['SA', 'D2', 'CQ'])
"ZPlayer" declared "raise:44"
"KLChen2PokerPlayer" declared "fold:0"
"['ZPlayer']" won the round 47 (stack = {'YangZ': 915, 'Ethan': 755, 'HakulaPlayer': 2023, 'SichengZuo': 910, 'KLChen2PokerPlayer': 842, 'Jinkun': 982, 'NitWinWin': 910, 'ZPlayer': 662})
player [YangZ] gets hole card ['C3', 'HJ'], current stack 910
player [Ethan] gets hole card ['D6', 'ST'], current stack 745
player [HakulaPlayer] gets hole card ['S6', 'H2'], current stack 2023
player [SichengZuo] gets hole card ['S2', 'D8'], current stack 910
player [KLChen2PokerPlayer] gets hole card ['D2', 'S9'], current stack 842
player [Jinkun] gets hole card ['C9', 'SJ'], current stack 982
player [NitWinWin] gets hole card ['C8', 'D3'], current stack 910
player [ZPlayer] gets hole card ['HT', 'S5'], current stack 662
Started the round 48
Street "preflop" started. (community card = [])
"HakulaPlayer" declared "fold:0"
"SichengZuo" declared "fold:0"
"KLChen2PokerPlayer" declared "fold:0"
"Jinkun" declared "fold:10"
"NitWinWin" declared "fold:0"
"ZPlayer" declared "call:10"
"YangZ" declared "fold:0"
"Ethan" declared "fold:0"
"['ZPlayer']" won the round 48 (stack = {'YangZ': 910, 'Ethan': 745, 'HakulaPlayer': 2023, 'SichengZuo': 910, 'KLChen2PokerPlayer': 842, 'Jinkun': 982, 'NitWinWin': 910, 'ZPlayer': 677})
player [YangZ] gets hole card ['SK', 'C7'], current stack 910
player [Ethan] gets hole card ['D6', 'H5'], current stack 740
player [HakulaPlayer] gets hole card ['S2', 'C3'], current stack 2013
player [SichengZuo] gets hole card ['H9', 'H6'], current stack 910
player [KLChen2PokerPlayer] gets hole card ['CJ', 'D9'], current stack 842
player [Jinkun] gets hole card ['C4', 'CK'], current stack 982
player [NitWinWin] gets hole card ['H2', 'D5'], current stack 910
player [ZPlayer] gets hole card ['C2', 'S9'], current stack 677
Started the round 49
Street "preflop" started. (community card = [])
"SichengZuo" declared "fold:0"
"KLChen2PokerPlayer" declared "raise:15"
"Jinkun" declared "fold:15"
"NitWinWin" declared "fold:0"
"ZPlayer" declared "call:15"
"YangZ" declared "fold:0"
"Ethan" declared "fold:0"
"HakulaPlayer" declared "fold:0"
Street "flop" started. (community card = ['ST', 'S3', 'HT'])
"KLChen2PokerPlayer" declared "call:0"
"ZPlayer" declared "call:0"
Street "turn" started. (community card = ['ST', 'S3', 'HT', 'D8'])
"KLChen2PokerPlayer" declared "call:0"
"ZPlayer" declared "call:0"
Street "river" started. (community card = ['ST', 'S3', 'HT', 'D8', 'DQ'])
"KLChen2PokerPlayer" declared "raise:263"
"ZPlayer" declared "fold:0"
"['KLChen2PokerPlayer']" won the round 49 (stack = {'YangZ': 910, 'Ethan': 740, 'HakulaPlayer': 2013, 'SichengZuo': 910, 'KLChen2PokerPlayer': 872, 'Jinkun': 982, 'NitWinWin': 910, 'ZPlayer': 662})
player [YangZ] gets hole card ['CK', 'S8'], current stack 910
player [Ethan] gets hole card ['C8', 'SA'], current stack 740
player [HakulaPlayer] gets hole card ['HK', 'H5'], current stack 2008
player [SichengZuo] gets hole card ['CT', 'DQ'], current stack 900
player [KLChen2PokerPlayer] gets hole card ['HQ', 'S7'], current stack 872
player [Jinkun] gets hole card ['D2', 'C6'], current stack 982
player [NitWinWin] gets hole card ['C4', 'H6'], current stack 910
player [ZPlayer] gets hole card ['DA', 'H8'], current stack 662
Started the round 50
Street "preflop" started. (community card = [])
"KLChen2PokerPlayer" declared "fold:0"
"Jinkun" declared "fold:10"
"NitWinWin" declared "fold:0"
"ZPlayer" declared "raise:15"
"YangZ" declared "fold:0"
"Ethan" declared "fold:0"
"HakulaPlayer" declared "call:15"
"SichengZuo" declared "fold:0"
Street "flop" started. (community card = ['H2', 'C5', 'HJ'])
"HakulaPlayer" declared "raise:49"
"ZPlayer" declared "fold:0"
"['HakulaPlayer']" won the round 50 (stack = {'YangZ': 910, 'Ethan': 740, 'HakulaPlayer': 2038, 'SichengZuo': 900, 'KLChen2PokerPlayer': 872, 'Jinkun': 982, 'NitWinWin': 910, 'ZPlayer': 647})

Game Results:
------------------------------------------------------------
Game 1:
Winner: HakulaPlayer (stack: 2038)
All players' stacks:
  YangZ: 910
  Ethan: 740
  HakulaPlayer: 2038
  SichengZuo: 900
  KLChen2PokerPlayer: 872
  Jinkun: 982
  NitWinWin: 910
  ZPlayer: 647
------------------------------------------------------------
