player [YangZ] gets hole card ['D5', 'D8'], current stack 1000
player [Ethan] gets hole card ['DQ', 'D2'], current stack 995
player [HakulaPlayer] gets hole card ['HQ', 'C8'], current stack 990
player [SichengZuo] gets hole card ['S8', 'C4'], current stack 1000
player [KLChen2PokerPlayer] gets hole card ['S3', 'S2'], current stack 1000
player [Jinkun] gets hole card ['DT', 'CA'], current stack 1000
player [NitWinWin] gets hole card ['CT', 'C5'], current stack 1000
player [ZPlayer] gets hole card ['S7', 'C7'], current stack 1000
Started the round 1
Street "preflop" started. (community card = [])
"SichengZuo" declared "fold:0"
"KLChen2PokerPlayer" declared "fold:0"
"Jinkun" declared "fold:10"
"NitWinWin" declared "fold:0"
"ZPlayer" declared "raise:15"
"YangZ" declared "fold:0"
"Ethan" declared "fold:0"
"HakulaPlayer" declared "call:15"
Street "flop" started. (community card = ['S5', 'CJ', 'S6'])
"HakulaPlayer" declared "call:0"
"ZPlayer" declared "raise:10"
"HakulaPlayer" declared "fold:0"
"['ZPlayer']" won the round 1 (stack = {'YangZ': 1000, 'Ethan': 995, 'HakulaPlayer': 985, 'SichengZuo': 1000, 'KLChen2PokerPlayer': 1000, 'Jinkun': 1000, 'NitWinWin': 1000, 'ZPlayer': 1020})
player [YangZ] gets hole card ['C8', 'C5'], current stack 1000
player [Ethan] gets hole card ['D5', 'D7'], current stack 995
player [HakulaPlayer] gets hole card ['C6', 'S6'], current stack 980
player [SichengZuo] gets hole card ['SQ', 'HK'], current stack 990
player [KLChen2PokerPlayer] gets hole card ['H3', 'H4'], current stack 1000
player [Jinkun] gets hole card ['C2', 'H8'], current stack 1000
player [NitWinWin] gets hole card ['H5', 'DK'], current stack 1000
player [ZPlayer] gets hole card ['CA', 'DQ'], current stack 1020
Started the round 2
Street "preflop" started. (community card = [])
"KLChen2PokerPlayer" declared "call:10"
"Jinkun" declared "fold:10"
"NitWinWin" declared "fold:0"
"ZPlayer" declared "raise:15"
"YangZ" declared "fold:0"
"Ethan" declared "fold:0"
"HakulaPlayer" declared "call:15"
"SichengZuo" declared "fold:0"
"KLChen2PokerPlayer" declared "fold:0"
Street "flop" started. (community card = ['HA', 'CQ', 'DJ'])
"HakulaPlayer" declared "call:0"
"ZPlayer" declared "raise:464"
"HakulaPlayer" declared "fold:0"
"['ZPlayer']" won the round 2 (stack = {'YangZ': 1000, 'Ethan': 995, 'HakulaPlayer': 970, 'SichengZuo': 990, 'KLChen2PokerPlayer': 990, 'Jinkun': 1000, 'NitWinWin': 1000, 'ZPlayer': 1055})
player [YangZ] gets hole card ['C9', 'ST'], current stack 1000
player [Ethan] gets hole card ['DJ', 'C2'], current stack 995
player [HakulaPlayer] gets hole card ['S5', 'C3'], current stack 970
player [SichengZuo] gets hole card ['H9', 'HQ'], current stack 985
player [KLChen2PokerPlayer] gets hole card ['HJ', 'D9'], current stack 980
player [Jinkun] gets hole card ['SQ', 'D4'], current stack 1000
player [NitWinWin] gets hole card ['D3', 'C8'], current stack 1000
player [ZPlayer] gets hole card ['C6', 'H2'], current stack 1055
Started the round 3
Street "preflop" started. (community card = [])
"Jinkun" declared "fold:10"
"NitWinWin" declared "fold:0"
"ZPlayer" declared "call:10"
"YangZ" declared "fold:0"
"Ethan" declared "fold:0"
"HakulaPlayer" declared "fold:0"
"SichengZuo" declared "fold:0"
"KLChen2PokerPlayer" declared "raise:16"
"ZPlayer" declared "fold:0"
"['KLChen2PokerPlayer']" won the round 3 (stack = {'YangZ': 1000, 'Ethan': 995, 'HakulaPlayer': 970, 'SichengZuo': 985, 'KLChen2PokerPlayer': 1005, 'Jinkun': 1000, 'NitWinWin': 1000, 'ZPlayer': 1045})
player [YangZ] gets hole card ['H5', 'CK'], current stack 1000
player [Ethan] gets hole card ['CA', 'HQ'], current stack 995
player [HakulaPlayer] gets hole card ['DK', 'SA'], current stack 970
player [SichengZuo] gets hole card ['D4', 'DT'], current stack 985
player [KLChen2PokerPlayer] gets hole card ['D8', 'S9'], current stack 1000
player [Jinkun] gets hole card ['C9', 'C4'], current stack 990
player [NitWinWin] gets hole card ['HT', 'D2'], current stack 1000
player [ZPlayer] gets hole card ['S2', 'C6'], current stack 1045
Started the round 4
Street "preflop" started. (community card = [])
"NitWinWin" declared "fold:0"
"ZPlayer" declared "fold:0"
"YangZ" declared "fold:0"
"Ethan" declared "raise:149"
"HakulaPlayer" declared "fold:0"
"SichengZuo" declared "fold:0"
"KLChen2PokerPlayer" declared "fold:0"
"Jinkun" declared "fold:149"
"['Ethan']" won the round 4 (stack = {'YangZ': 1000, 'Ethan': 1010, 'HakulaPlayer': 970, 'SichengZuo': 985, 'KLChen2PokerPlayer': 1000, 'Jinkun': 990, 'NitWinWin': 1000, 'ZPlayer': 1045})
player [YangZ] gets hole card ['D8', 'H2'], current stack 1000
player [Ethan] gets hole card ['C2', 'H6'], current stack 1010
player [HakulaPlayer] gets hole card ['H5', 'S6'], current stack 970
player [SichengZuo] gets hole card ['H3', 'DT'], current stack 985
player [KLChen2PokerPlayer] gets hole card ['C7', 'HJ'], current stack 1000
player [Jinkun] gets hole card ['HA', 'D2'], current stack 985
player [NitWinWin] gets hole card ['C6', 'CQ'], current stack 990
player [ZPlayer] gets hole card ['D9', 'D3'], current stack 1045
Started the round 5
Street "preflop" started. (community card = [])
"ZPlayer" declared "call:10"
"YangZ" declared "fold:0"
"Ethan" declared "fold:0"
"HakulaPlayer" declared "fold:0"
"SichengZuo" declared "fold:0"
"KLChen2PokerPlayer" declared "call:10"
"Jinkun" declared "call:10"
"NitWinWin" declared "fold:0"
Street "flop" started. (community card = ['S4', 'H7', 'C8'])
"Jinkun" declared "call:0"
"ZPlayer" declared "call:0"
"KLChen2PokerPlayer" declared "raise:13"
"Jinkun" declared "raise:159"
"ZPlayer" declared "fold:0"
"KLChen2PokerPlayer" declared "fold:0"
"['Jinkun']" won the round 5 (stack = {'YangZ': 1000, 'Ethan': 1010, 'HakulaPlayer': 970, 'SichengZuo': 985, 'KLChen2PokerPlayer': 977, 'Jinkun': 1033, 'NitWinWin': 990, 'ZPlayer': 1035})
player [YangZ] gets hole card ['S8', 'D2'], current stack 1000
player [Ethan] gets hole card ['CT', 'HQ'], current stack 1010
player [HakulaPlayer] gets hole card ['C7', 'SJ'], current stack 970
player [SichengZuo] gets hole card ['HJ', 'DK'], current stack 985
player [KLChen2PokerPlayer] gets hole card ['SK', 'H3'], current stack 977
player [Jinkun] gets hole card ['D9', 'H8'], current stack 1033
player [NitWinWin] gets hole card ['S7', 'D8'], current stack 985
player [ZPlayer] gets hole card ['H4', 'S4'], current stack 1025
Started the round 6
Street "preflop" started. (community card = [])
"YangZ" declared "fold:0"
"Ethan" declared "fold:0"
"HakulaPlayer" declared "fold:0"
"SichengZuo" declared "fold:0"
"KLChen2PokerPlayer" declared "call:10"
"Jinkun" declared "call:10"
"NitWinWin" declared "fold:0"
"ZPlayer" declared "call:10"
Street "flop" started. (community card = ['S5', 'S2', 'D5'])
"ZPlayer" declared "raise:10"
"KLChen2PokerPlayer" declared "fold:0"
"Jinkun" declared "call:10"
Street "turn" started. (community card = ['S5', 'S2', 'D5', 'HK'])
"ZPlayer" declared "call:0"
"Jinkun" declared "call:0"
Street "river" started. (community card = ['S5', 'S2', 'D5', 'HK', 'HA'])
"ZPlayer" declared "call:0"
"Jinkun" declared "raise:1013"
"ZPlayer" declared "fold:0"
"['Jinkun']" won the round 6 (stack = {'YangZ': 1000, 'Ethan': 1010, 'HakulaPlayer': 970, 'SichengZuo': 985, 'KLChen2PokerPlayer': 967, 'Jinkun': 1068, 'NitWinWin': 985, 'ZPlayer': 1015})
player [YangZ] gets hole card ['C4', 'CQ'], current stack 990
player [Ethan] gets hole card ['H9', 'SA'], current stack 1010
player [HakulaPlayer] gets hole card ['H8', 'H2'], current stack 970
player [SichengZuo] gets hole card ['H5', 'S5'], current stack 985
player [KLChen2PokerPlayer] gets hole card ['D2', 'C9'], current stack 967
player [Jinkun] gets hole card ['H3', 'H6'], current stack 1068
player [NitWinWin] gets hole card ['DT', 'D7'], current stack 985
player [ZPlayer] gets hole card ['S3', 'DA'], current stack 1010
Started the round 7
Street "preflop" started. (community card = [])
"Ethan" declared "fold:0"
"HakulaPlayer" declared "fold:0"
"SichengZuo" declared "fold:0"
"KLChen2PokerPlayer" declared "raise:15"
"Jinkun" declared "fold:15"
"NitWinWin" declared "fold:0"
"ZPlayer" declared "call:15"
"YangZ" declared "fold:0"
Street "flop" started. (community card = ['H4', 'HT', 'D4'])
"ZPlayer" declared "raise:10"
"KLChen2PokerPlayer" declared "fold:0"
"['ZPlayer']" won the round 7 (stack = {'YangZ': 990, 'Ethan': 1010, 'HakulaPlayer': 970, 'SichengZuo': 985, 'KLChen2PokerPlayer': 952, 'Jinkun': 1068, 'NitWinWin': 985, 'ZPlayer': 1040})
player [YangZ] gets hole card ['CA', 'H4'], current stack 985
player [Ethan] gets hole card ['SQ', 'H9'], current stack 1000
player [HakulaPlayer] gets hole card ['S5', 'C3'], current stack 970
player [SichengZuo] gets hole card ['D5', 'C4'], current stack 985
player [KLChen2PokerPlayer] gets hole card ['D8', 'CJ'], current stack 952
player [Jinkun] gets hole card ['H2', 'S4'], current stack 1068
player [NitWinWin] gets hole card ['D9', 'C7'], current stack 985
player [ZPlayer] gets hole card ['DA', 'HJ'], current stack 1040
Started the round 8
Street "preflop" started. (community card = [])
"HakulaPlayer" declared "fold:0"
"SichengZuo" declared "fold:0"
"KLChen2PokerPlayer" declared "fold:0"
"Jinkun" declared "fold:10"
"NitWinWin" declared "fold:0"
"ZPlayer" declared "raise:15"
"YangZ" declared "fold:0"
"Ethan" declared "call:15"
Street "flop" started. (community card = ['D3', 'DJ', 'HA'])
"Ethan" declared "call:0"
"ZPlayer" declared "raise:35"
"Ethan" declared "fold:0"
"['ZPlayer']" won the round 8 (stack = {'YangZ': 985, 'Ethan': 995, 'HakulaPlayer': 970, 'SichengZuo': 985, 'KLChen2PokerPlayer': 952, 'Jinkun': 1068, 'NitWinWin': 985, 'ZPlayer': 1060})
player [YangZ] gets hole card ['C7', 'S8'], current stack 985
player [Ethan] gets hole card ['D6', 'CA'], current stack 990
player [HakulaPlayer] gets hole card ['H2', 'CQ'], current stack 960
player [SichengZuo] gets hole card ['S7', 'S2'], current stack 985
player [KLChen2PokerPlayer] gets hole card ['D3', 'D7'], current stack 952
player [Jinkun] gets hole card ['C3', 'HJ'], current stack 1068
player [NitWinWin] gets hole card ['C8', 'C4'], current stack 985
player [ZPlayer] gets hole card ['DT', 'D9'], current stack 1060
Started the round 9
Street "preflop" started. (community card = [])
"SichengZuo" declared "fold:0"
"KLChen2PokerPlayer" declared "fold:0"
"Jinkun" declared "fold:10"
"NitWinWin" declared "fold:0"
"ZPlayer" declared "raise:15"
"YangZ" declared "fold:0"
"Ethan" declared "call:15"
"HakulaPlayer" declared "call:15"
Street "flop" started. (community card = ['D4', 'D8', 'C9'])
"Ethan" declared "call:0"
"HakulaPlayer" declared "call:0"
"ZPlayer" declared "raise:45"
"Ethan" declared "fold:0"
"HakulaPlayer" declared "fold:0"
"['ZPlayer']" won the round 9 (stack = {'YangZ': 985, 'Ethan': 980, 'HakulaPlayer': 955, 'SichengZuo': 985, 'KLChen2PokerPlayer': 952, 'Jinkun': 1068, 'NitWinWin': 985, 'ZPlayer': 1090})
player [YangZ] gets hole card ['C8', 'HA'], current stack 985
player [Ethan] gets hole card ['DT', 'D6'], current stack 980
player [HakulaPlayer] gets hole card ['H8', 'SQ'], current stack 950
player [SichengZuo] gets hole card ['S3', 'C9'], current stack 975
player [KLChen2PokerPlayer] gets hole card ['ST', 'S9'], current stack 952
player [Jinkun] gets hole card ['H2', 'C3'], current stack 1068
player [NitWinWin] gets hole card ['H4', 'C4'], current stack 985
player [ZPlayer] gets hole card ['D8', 'S7'], current stack 1090
Started the round 10
Street "preflop" started. (community card = [])
"KLChen2PokerPlayer" declared "raise:15"
"Jinkun" declared "fold:15"
"NitWinWin" declared "fold:0"
"ZPlayer" declared "call:15"
"YangZ" declared "fold:0"
"Ethan" declared "fold:0"
"HakulaPlayer" declared "call:15"
"SichengZuo" declared "fold:0"
Street "flop" started. (community card = ['HQ', 'D7', 'C6'])
"HakulaPlayer" declared "call:0"
"KLChen2PokerPlayer" declared "call:0"
"ZPlayer" declared "raise:27"
"HakulaPlayer" declared "call:27"
"KLChen2PokerPlayer" declared "fold:0"
Street "turn" started. (community card = ['HQ', 'D7', 'C6', 'HK'])
"HakulaPlayer" declared "raise:96"
"ZPlayer" declared "fold:0"
"['HakulaPlayer']" won the round 10 (stack = {'YangZ': 985, 'Ethan': 980, 'HakulaPlayer': 1022, 'SichengZuo': 975, 'KLChen2PokerPlayer': 937, 'Jinkun': 1068, 'NitWinWin': 985, 'ZPlayer': 1048})
player [YangZ] gets hole card ['C7', 'H8'], current stack 985
player [Ethan] gets hole card ['HJ', 'D5'], current stack 980
player [HakulaPlayer] gets hole card ['S4', 'D7'], current stack 1022
player [SichengZuo] gets hole card ['H4', 'HA'], current stack 970
player [KLChen2PokerPlayer] gets hole card ['D4', 'H5'], current stack 927
player [Jinkun] gets hole card ['S7', 'HQ'], current stack 1068
player [NitWinWin] gets hole card ['C5', 'D3'], current stack 985
player [ZPlayer] gets hole card ['CA', 'H7'], current stack 1048
Started the round 11
Street "preflop" started. (community card = [])
"Jinkun" declared "fold:10"
"NitWinWin" declared "fold:0"
"ZPlayer" declared "raise:15"
"YangZ" declared "fold:0"
"Ethan" declared "fold:0"
"HakulaPlayer" declared "fold:0"
"SichengZuo" declared "fold:0"
"KLChen2PokerPlayer" declared "fold:0"
"['ZPlayer']" won the round 11 (stack = {'YangZ': 985, 'Ethan': 980, 'HakulaPlayer': 1022, 'SichengZuo': 970, 'KLChen2PokerPlayer': 927, 'Jinkun': 1068, 'NitWinWin': 985, 'ZPlayer': 1063})
player [YangZ] gets hole card ['HQ', 'C4'], current stack 985
player [Ethan] gets hole card ['DK', 'C7'], current stack 980
player [HakulaPlayer] gets hole card ['D8', 'S2'], current stack 1022
player [SichengZuo] gets hole card ['CK', 'S5'], current stack 970
player [KLChen2PokerPlayer] gets hole card ['SK', 'C3'], current stack 922
player [Jinkun] gets hole card ['DJ', 'D7'], current stack 1058
player [NitWinWin] gets hole card ['D5', 'S7'], current stack 985
player [ZPlayer] gets hole card ['D6', 'CT'], current stack 1063
Started the round 12
Street "preflop" started. (community card = [])
"NitWinWin" declared "fold:0"
"ZPlayer" declared "call:10"
"YangZ" declared "fold:0"
"Ethan" declared "fold:0"
"HakulaPlayer" declared "fold:0"
"SichengZuo" declared "fold:0"
"KLChen2PokerPlayer" declared "fold:0"
"Jinkun" declared "call:10"
Street "flop" started. (community card = ['S9', 'CA', 'DA'])
"Jinkun" declared "call:0"
"ZPlayer" declared "call:0"
Street "turn" started. (community card = ['S9', 'CA', 'DA', 'C2'])
"Jinkun" declared "call:0"
"ZPlayer" declared "call:0"
Street "river" started. (community card = ['S9', 'CA', 'DA', 'C2', 'C9'])
"Jinkun" declared "call:0"
"ZPlayer" declared "call:0"
"['Jinkun']" won the round 12 (stack = {'YangZ': 985, 'Ethan': 980, 'HakulaPlayer': 1022, 'SichengZuo': 970, 'KLChen2PokerPlayer': 922, 'Jinkun': 1083, 'NitWinWin': 985, 'ZPlayer': 1053})
player [YangZ] gets hole card ['SJ', 'S6'], current stack 985
player [Ethan] gets hole card ['H4', 'C6'], current stack 980
player [HakulaPlayer] gets hole card ['D3', 'H2'], current stack 1022
player [SichengZuo] gets hole card ['H6', 'SQ'], current stack 970
player [KLChen2PokerPlayer] gets hole card ['HA', 'D4'], current stack 922
player [Jinkun] gets hole card ['HK', 'D9'], current stack 1078
player [NitWinWin] gets hole card ['S4', 'H5'], current stack 975
player [ZPlayer] gets hole card ['S7', 'CT'], current stack 1053
Started the round 13
Street "preflop" started. (community card = [])
"ZPlayer" declared "call:10"
"YangZ" declared "fold:0"
"Ethan" declared "fold:0"
"HakulaPlayer" declared "fold:0"
"SichengZuo" declared "fold:0"
"KLChen2PokerPlayer" declared "raise:15"
"Jinkun" declared "fold:15"
"NitWinWin" declared "fold:0"
"ZPlayer" declared "call:15"
Street "flop" started. (community card = ['HT', 'CQ', 'CJ'])
"ZPlayer" declared "call:0"
"KLChen2PokerPlayer" declared "raise:12"
"ZPlayer" declared "fold:0"
"['KLChen2PokerPlayer']" won the round 13 (stack = {'YangZ': 985, 'Ethan': 980, 'HakulaPlayer': 1022, 'SichengZuo': 970, 'KLChen2PokerPlayer': 952, 'Jinkun': 1078, 'NitWinWin': 975, 'ZPlayer': 1038})
player [YangZ] gets hole card ['D7', 'DJ'], current stack 985
player [Ethan] gets hole card ['HT', 'HQ'], current stack 980
player [HakulaPlayer] gets hole card ['S4', 'H6'], current stack 1022
player [SichengZuo] gets hole card ['D3', 'D9'], current stack 970
player [KLChen2PokerPlayer] gets hole card ['SK', 'DT'], current stack 952
player [Jinkun] gets hole card ['CK', 'ST'], current stack 1078
player [NitWinWin] gets hole card ['D8', 'CT'], current stack 970
player [ZPlayer] gets hole card ['C8', 'C5'], current stack 1028
Started the round 14
Street "preflop" started. (community card = [])
"YangZ" declared "fold:0"
"Ethan" declared "fold:0"
"HakulaPlayer" declared "fold:0"
"SichengZuo" declared "fold:0"
"KLChen2PokerPlayer" declared "raise:16"
"Jinkun" declared "fold:16"
"NitWinWin" declared "fold:0"
"ZPlayer" declared "call:16"
Street "flop" started. (community card = ['C6', 'S6', 'C3'])
"ZPlayer" declared "call:0"
"KLChen2PokerPlayer" declared "raise:13"
"ZPlayer" declared "fold:0"
"['KLChen2PokerPlayer']" won the round 14 (stack = {'YangZ': 985, 'Ethan': 980, 'HakulaPlayer': 1022, 'SichengZuo': 970, 'KLChen2PokerPlayer': 973, 'Jinkun': 1078, 'NitWinWin': 970, 'ZPlayer': 1022})
player [YangZ] gets hole card ['C2', 'CK'], current stack 975
player [Ethan] gets hole card ['H7', 'DK'], current stack 980
player [HakulaPlayer] gets hole card ['H4', 'D8'], current stack 1022
player [SichengZuo] gets hole card ['C6', 'D4'], current stack 970
player [KLChen2PokerPlayer] gets hole card ['DJ', 'CJ'], current stack 973
player [Jinkun] gets hole card ['S4', 'S5'], current stack 1078
player [NitWinWin] gets hole card ['H3', 'S9'], current stack 970
player [ZPlayer] gets hole card ['SA', 'H9'], current stack 1017
Started the round 15
Street "preflop" started. (community card = [])
"Ethan" declared "fold:0"
"HakulaPlayer" declared "fold:0"
"SichengZuo" declared "fold:0"
"KLChen2PokerPlayer" declared "raise:23"
"Jinkun" declared "fold:23"
"NitWinWin" declared "fold:0"
"ZPlayer" declared "call:23"
"YangZ" declared "fold:0"
Street "flop" started. (community card = ['C7', 'HA', 'DA'])
"ZPlayer" declared "raise:834"
"KLChen2PokerPlayer" declared "call:834"
Street "turn" started. (community card = ['C7', 'HA', 'DA', 'SQ'])
"ZPlayer" declared "call:0"
"KLChen2PokerPlayer" declared "raise:15"
"ZPlayer" declared "call:15"
Street "river" started. (community card = ['C7', 'HA', 'DA', 'SQ', 'CA'])
"ZPlayer" declared "call:0"
"KLChen2PokerPlayer" declared "raise:15"
"ZPlayer" declared "call:15"
"['ZPlayer']" won the round 15 (stack = {'YangZ': 975, 'Ethan': 980, 'HakulaPlayer': 1022, 'SichengZuo': 970, 'KLChen2PokerPlayer': 86, 'Jinkun': 1078, 'NitWinWin': 970, 'ZPlayer': 1919})
player [YangZ] gets hole card ['S4', 'S8'], current stack 970
player [Ethan] gets hole card ['C6', 'C5'], current stack 970
player [HakulaPlayer] gets hole card ['S3', 'DA'], current stack 1022
player [SichengZuo] gets hole card ['HQ', 'D9'], current stack 970
player [KLChen2PokerPlayer] gets hole card ['DK', 'C9'], current stack 86
player [Jinkun] gets hole card ['H8', 'H6'], current stack 1078
player [NitWinWin] gets hole card ['SQ', 'S5'], current stack 970
player [ZPlayer] gets hole card ['C8', 'C2'], current stack 1919
Started the round 16
Street "preflop" started. (community card = [])
"HakulaPlayer" declared "fold:0"
"SichengZuo" declared "fold:0"
"KLChen2PokerPlayer" declared "raise:15"
"Jinkun" declared "fold:15"
"NitWinWin" declared "fold:0"
"ZPlayer" declared "raise:20"
"YangZ" declared "fold:0"
"Ethan" declared "fold:0"
"KLChen2PokerPlayer" declared "fold:0"
"['ZPlayer']" won the round 16 (stack = {'YangZ': 970, 'Ethan': 970, 'HakulaPlayer': 1022, 'SichengZuo': 970, 'KLChen2PokerPlayer': 71, 'Jinkun': 1078, 'NitWinWin': 970, 'ZPlayer': 1949})
player [YangZ] gets hole card ['S5', 'DK'], current stack 970
player [Ethan] gets hole card ['SJ', 'S7'], current stack 965
player [HakulaPlayer] gets hole card ['S8', 'SQ'], current stack 1012
player [SichengZuo] gets hole card ['D4', 'DJ'], current stack 970
player [KLChen2PokerPlayer] gets hole card ['HQ', 'CJ'], current stack 71
player [Jinkun] gets hole card ['C6', 'CA'], current stack 1078
player [NitWinWin] gets hole card ['H6', 'H3'], current stack 970
player [ZPlayer] gets hole card ['CK', 'HJ'], current stack 1949
Started the round 17
Street "preflop" started. (community card = [])
"SichengZuo" declared "fold:0"
"KLChen2PokerPlayer" declared "raise:21"
"Jinkun" declared "fold:21"
"NitWinWin" declared "fold:0"
"ZPlayer" declared "raise:32"
"YangZ" declared "fold:0"
"Ethan" declared "fold:0"
"HakulaPlayer" declared "fold:0"
"KLChen2PokerPlayer" declared "fold:0"
"['ZPlayer']" won the round 17 (stack = {'YangZ': 970, 'Ethan': 965, 'HakulaPlayer': 1012, 'SichengZuo': 970, 'KLChen2PokerPlayer': 50, 'Jinkun': 1078, 'NitWinWin': 970, 'ZPlayer': 1985})
player [YangZ] gets hole card ['H2', 'S2'], current stack 970
player [Ethan] gets hole card ['DK', 'D9'], current stack 965
player [HakulaPlayer] gets hole card ['CA', 'C5'], current stack 1007
player [SichengZuo] gets hole card ['DA', 'H8'], current stack 960
player [KLChen2PokerPlayer] gets hole card ['SA', 'S9'], current stack 50
player [Jinkun] gets hole card ['CQ', 'DQ'], current stack 1078
player [NitWinWin] gets hole card ['H7', 'HA'], current stack 970
player [ZPlayer] gets hole card ['CJ', 'DJ'], current stack 1985
Started the round 18
Street "preflop" started. (community card = [])
"KLChen2PokerPlayer" declared "raise:26"
"Jinkun" declared "fold:26"
"NitWinWin" declared "fold:0"
"ZPlayer" declared "raise:42"
"YangZ" declared "fold:0"
"Ethan" declared "fold:0"
"HakulaPlayer" declared "call:42"
"SichengZuo" declared "fold:0"
"KLChen2PokerPlayer" declared "fold:0"
Street "flop" started. (community card = ['S7', 'H5', 'H4'])
"HakulaPlayer" declared "call:0"
"ZPlayer" declared "raise:10"
"HakulaPlayer" declared "call:10"
Street "turn" started. (community card = ['S7', 'H5', 'H4', 'ST'])
"HakulaPlayer" declared "call:0"
"ZPlayer" declared "raise:10"
"HakulaPlayer" declared "call:10"
Street "river" started. (community card = ['S7', 'H5', 'H4', 'ST', 'SQ'])
"HakulaPlayer" declared "call:0"
"ZPlayer" declared "raise:10"
"HakulaPlayer" declared "call:10"
"['ZPlayer']" won the round 18 (stack = {'YangZ': 970, 'Ethan': 965, 'HakulaPlayer': 940, 'SichengZuo': 960, 'KLChen2PokerPlayer': 24, 'Jinkun': 1078, 'NitWinWin': 970, 'ZPlayer': 2093})
player [YangZ] gets hole card ['D5', 'HA'], current stack 970
player [Ethan] gets hole card ['D3', 'D9'], current stack 965
player [HakulaPlayer] gets hole card ['D7', 'C5'], current stack 940
player [SichengZuo] gets hole card ['HQ', 'HK'], current stack 955
player [KLChen2PokerPlayer] gets hole card ['D6', 'S2'], current stack 14
player [Jinkun] gets hole card ['S4', 'S5'], current stack 1078
player [NitWinWin] gets hole card ['SQ', 'C9'], current stack 970
player [ZPlayer] gets hole card ['H7', 'D8'], current stack 2093
Started the round 19
Street "preflop" started. (community card = [])
"Jinkun" declared "fold:10"
"NitWinWin" declared "fold:0"
"ZPlayer" declared "raise:15"
"YangZ" declared "fold:0"
"Ethan" declared "fold:0"
"HakulaPlayer" declared "fold:0"
"SichengZuo" declared "fold:0"
"KLChen2PokerPlayer" declared "fold:0"
"['ZPlayer']" won the round 19 (stack = {'YangZ': 970, 'Ethan': 965, 'HakulaPlayer': 940, 'SichengZuo': 955, 'KLChen2PokerPlayer': 14, 'Jinkun': 1078, 'NitWinWin': 970, 'ZPlayer': 2108})
player [YangZ] gets hole card ['CQ', 'H3'], current stack 970
player [Ethan] gets hole card ['HQ', 'CT'], current stack 965
player [HakulaPlayer] gets hole card ['HJ', 'ST'], current stack 940
player [SichengZuo] gets hole card ['D4', 'S3'], current stack 955
player [KLChen2PokerPlayer] gets hole card ['CJ', 'C8'], current stack 9
player [Jinkun] gets hole card ['SA', 'S5'], current stack 1068
player [NitWinWin] gets hole card ['DQ', 'HA'], current stack 970
player [ZPlayer] gets hole card ['C2', 'H4'], current stack 2108
Started the round 20
Street "preflop" started. (community card = [])
"NitWinWin" declared "fold:0"
"ZPlayer" declared "raise:15"
"YangZ" declared "fold:0"
"Ethan" declared "fold:0"
"HakulaPlayer" declared "call:15"
"SichengZuo" declared "fold:0"
"KLChen2PokerPlayer" declared "call:15"
"Jinkun" declared "fold:15"
Street "flop" started. (community card = ['D2', 'S2', 'H7'])
"ZPlayer" declared "raise:394"
"HakulaPlayer" declared "fold:0"
Street "turn" started. (community card = ['D2', 'S2', 'H7', 'C9'])
Street "river" started. (community card = ['D2', 'S2', 'H7', 'C9', 'H8'])
"['ZPlayer']" won the round 20 (stack = {'YangZ': 970, 'Ethan': 965, 'HakulaPlayer': 925, 'SichengZuo': 955, 'KLChen2PokerPlayer': 0, 'Jinkun': 1068, 'NitWinWin': 970, 'ZPlayer': 2147})
player [YangZ] gets hole card ['C4', 'D7'], current stack 970
player [Ethan] gets hole card ['H9', 'S4'], current stack 965
player [HakulaPlayer] gets hole card ['H3', 'CQ'], current stack 925
player [SichengZuo] gets hole card ['D2', 'S5'], current stack 955
player [Jinkun] gets hole card ['H7', 'HQ'], current stack 1068
player [NitWinWin] gets hole card ['DJ', 'CJ'], current stack 965
player [ZPlayer] gets hole card ['D6', 'S7'], current stack 2137
Started the round 21
Street "preflop" started. (community card = [])
"YangZ" declared "fold:0"
"Ethan" declared "fold:0"
"HakulaPlayer" declared "call:10"
"SichengZuo" declared "fold:0"
"Jinkun" declared "call:10"
"NitWinWin" declared "fold:0"
"ZPlayer" declared "raise:15"
"HakulaPlayer" declared "call:15"
"Jinkun" declared "call:15"
Street "flop" started. (community card = ['SA', 'C8', 'HT'])
"ZPlayer" declared "call:0"
"HakulaPlayer" declared "call:0"
"Jinkun" declared "call:0"
Street "turn" started. (community card = ['SA', 'C8', 'HT', 'CT'])
"ZPlayer" declared "call:0"
"HakulaPlayer" declared "call:0"
"Jinkun" declared "call:0"
Street "river" started. (community card = ['SA', 'C8', 'HT', 'CT', 'DA'])
"ZPlayer" declared "call:0"
"HakulaPlayer" declared "call:0"
"Jinkun" declared "call:0"
"['HakulaPlayer', 'Jinkun']" won the round 21 (stack = {'YangZ': 970, 'Ethan': 965, 'HakulaPlayer': 935, 'SichengZuo': 955, 'KLChen2PokerPlayer': 0, 'Jinkun': 1078, 'NitWinWin': 965, 'ZPlayer': 2132})
player [YangZ] gets hole card ['SA', 'HJ'], current stack 960
player [Ethan] gets hole card ['S3', 'D3'], current stack 965
player [HakulaPlayer] gets hole card ['DJ', 'HA'], current stack 935
player [SichengZuo] gets hole card ['SJ', 'H2'], current stack 955
player [Jinkun] gets hole card ['SK', 'HT'], current stack 1078
player [NitWinWin] gets hole card ['H3', 'C7'], current stack 965
player [ZPlayer] gets hole card ['S4', 'S2'], current stack 2127
Started the round 22
Street "preflop" started. (community card = [])
"Ethan" declared "fold:0"
"HakulaPlayer" declared "call:10"
"SichengZuo" declared "fold:0"
"Jinkun" declared "fold:10"
"NitWinWin" declared "fold:0"
"ZPlayer" declared "raise:15"
"YangZ" declared "fold:0"
"HakulaPlayer" declared "raise:32"
"ZPlayer" declared "fold:0"
"['HakulaPlayer']" won the round 22 (stack = {'YangZ': 960, 'Ethan': 965, 'HakulaPlayer': 960, 'SichengZuo': 955, 'KLChen2PokerPlayer': 0, 'Jinkun': 1078, 'NitWinWin': 965, 'ZPlayer': 2117})
player [YangZ] gets hole card ['H8', 'H4'], current stack 955
player [Ethan] gets hole card ['HK', 'D3'], current stack 955
player [HakulaPlayer] gets hole card ['CQ', 'C8'], current stack 960
player [SichengZuo] gets hole card ['HQ', 'C4'], current stack 955
player [Jinkun] gets hole card ['D6', 'C7'], current stack 1078
player [NitWinWin] gets hole card ['C3', 'SQ'], current stack 965
player [ZPlayer] gets hole card ['H6', 'CT'], current stack 2117
Started the round 23
Street "preflop" started. (community card = [])
"HakulaPlayer" declared "call:10"
"SichengZuo" declared "fold:0"
"Jinkun" declared "fold:10"
"NitWinWin" declared "fold:0"
"ZPlayer" declared "raise:15"
"YangZ" declared "fold:0"
"Ethan" declared "fold:0"
"HakulaPlayer" declared "call:15"
Street "flop" started. (community card = ['SA', 'C9', 'HA'])
"HakulaPlayer" declared "call:0"
"ZPlayer" declared "call:0"
Street "turn" started. (community card = ['SA', 'C9', 'HA', 'HJ'])
"HakulaPlayer" declared "call:0"
"ZPlayer" declared "call:0"
Street "river" started. (community card = ['SA', 'C9', 'HA', 'HJ', 'HT'])
"HakulaPlayer" declared "raise:52"
"ZPlayer" declared "call:52"
"['HakulaPlayer']" won the round 23 (stack = {'YangZ': 955, 'Ethan': 955, 'HakulaPlayer': 1042, 'SichengZuo': 955, 'KLChen2PokerPlayer': 0, 'Jinkun': 1078, 'NitWinWin': 965, 'ZPlayer': 2050})
player [YangZ] gets hole card ['C8', 'SQ'], current stack 955
player [Ethan] gets hole card ['SK', 'C9'], current stack 950
player [HakulaPlayer] gets hole card ['C2', 'H9'], current stack 1032
player [SichengZuo] gets hole card ['C7', 'H8'], current stack 955
player [Jinkun] gets hole card ['S2', 'HA'], current stack 1078
player [NitWinWin] gets hole card ['S3', 'CA'], current stack 965
player [ZPlayer] gets hole card ['DJ', 'D5'], current stack 2050
Started the round 24
Street "preflop" started. (community card = [])
"SichengZuo" declared "fold:0"
"Jinkun" declared "fold:10"
"NitWinWin" declared "fold:0"
"ZPlayer" declared "raise:15"
"YangZ" declared "fold:0"
"Ethan" declared "call:15"
"HakulaPlayer" declared "call:15"
Street "flop" started. (community card = ['H6', 'S8', 'D7'])
"Ethan" declared "call:0"
"HakulaPlayer" declared "call:0"
"ZPlayer" declared "call:0"
Street "turn" started. (community card = ['H6', 'S8', 'D7', 'DT'])
"Ethan" declared "raise:45"
"HakulaPlayer" declared "call:45"
"ZPlayer" declared "fold:0"
Street "river" started. (community card = ['H6', 'S8', 'D7', 'DT', 'S4'])
"Ethan" declared "raise:135"
"HakulaPlayer" declared "raise:445"
"Ethan" declared "call:445"
"['Ethan', 'HakulaPlayer']" won the round 24 (stack = {'YangZ': 955, 'Ethan': 962, 'HakulaPlayer': 1049, 'SichengZuo': 955, 'KLChen2PokerPlayer': 0, 'Jinkun': 1078, 'NitWinWin': 965, 'ZPlayer': 2035})
player [YangZ] gets hole card ['S7', 'D4'], current stack 955
player [Ethan] gets hole card ['DA', 'D9'], current stack 962
player [HakulaPlayer] gets hole card ['H9', 'D5'], current stack 1044
player [SichengZuo] gets hole card ['H8', 'H6'], current stack 945
player [Jinkun] gets hole card ['S6', 'CA'], current stack 1078
player [NitWinWin] gets hole card ['C2', 'C3'], current stack 965
player [ZPlayer] gets hole card ['C8', 'DT'], current stack 2035
Started the round 25
Street "preflop" started. (community card = [])
"Jinkun" declared "fold:10"
"NitWinWin" declared "fold:0"
"ZPlayer" declared "raise:15"
"YangZ" declared "fold:0"
"Ethan" declared "fold:0"
"HakulaPlayer" declared "fold:0"
"SichengZuo" declared "fold:0"
"['ZPlayer']" won the round 25 (stack = {'YangZ': 955, 'Ethan': 962, 'HakulaPlayer': 1044, 'SichengZuo': 945, 'KLChen2PokerPlayer': 0, 'Jinkun': 1078, 'NitWinWin': 965, 'ZPlayer': 2050})
player [YangZ] gets hole card ['DK', 'SK'], current stack 955
player [Ethan] gets hole card ['H3', 'SQ'], current stack 962
player [HakulaPlayer] gets hole card ['S9', 'DT'], current stack 1044
player [SichengZuo] gets hole card ['S8', 'C9'], current stack 940
player [Jinkun] gets hole card ['S2', 'HA'], current stack 1068
player [NitWinWin] gets hole card ['C5', 'H2'], current stack 965
player [ZPlayer] gets hole card ['D9', 'D8'], current stack 2050
Started the round 26
Street "preflop" started. (community card = [])
"NitWinWin" declared "fold:0"
"ZPlayer" declared "raise:15"
"YangZ" declared "fold:0"
"Ethan" declared "fold:0"
"HakulaPlayer" declared "call:15"
"SichengZuo" declared "fold:0"
"Jinkun" declared "call:15"
Street "flop" started. (community card = ['DA', 'SJ', 'HK'])
"Jinkun" declared "call:0"
"ZPlayer" declared "call:0"
"HakulaPlayer" declared "call:0"
Street "turn" started. (community card = ['DA', 'SJ', 'HK', 'H5'])
"Jinkun" declared "call:0"
"ZPlayer" declared "call:0"
"HakulaPlayer" declared "call:0"
Street "river" started. (community card = ['DA', 'SJ', 'HK', 'H5', 'C2'])
"Jinkun" declared "raise:21"
"ZPlayer" declared "fold:0"
"HakulaPlayer" declared "fold:0"
"['Jinkun']" won the round 26 (stack = {'YangZ': 955, 'Ethan': 962, 'HakulaPlayer': 1029, 'SichengZuo': 940, 'KLChen2PokerPlayer': 0, 'Jinkun': 1113, 'NitWinWin': 965, 'ZPlayer': 2035})
player [YangZ] gets hole card ['CK', 'S8'], current stack 955
player [Ethan] gets hole card ['HT', 'D5'], current stack 962
player [HakulaPlayer] gets hole card ['SK', 'D6'], current stack 1029
player [SichengZuo] gets hole card ['H8', 'CJ'], current stack 940
player [Jinkun] gets hole card ['C5', 'C3'], current stack 1108
player [NitWinWin] gets hole card ['C2', 'S4'], current stack 955
player [ZPlayer] gets hole card ['HJ', 'SJ'], current stack 2035
Started the round 27
Street "preflop" started. (community card = [])
"ZPlayer" declared "raise:15"
"YangZ" declared "fold:0"
"Ethan" declared "fold:0"
"HakulaPlayer" declared "call:15"
"SichengZuo" declared "fold:0"
"Jinkun" declared "fold:15"
"NitWinWin" declared "fold:0"
Street "flop" started. (community card = ['D2', 'DT', 'CT'])
"ZPlayer" declared "raise:10"
"HakulaPlayer" declared "call:10"
Street "turn" started. (community card = ['D2', 'DT', 'CT', 'CA'])
"ZPlayer" declared "raise:32"
"HakulaPlayer" declared "raise:100"
"ZPlayer" declared "fold:0"
"['HakulaPlayer']" won the round 27 (stack = {'YangZ': 955, 'Ethan': 962, 'HakulaPlayer': 1101, 'SichengZuo': 940, 'KLChen2PokerPlayer': 0, 'Jinkun': 1108, 'NitWinWin': 955, 'ZPlayer': 1978})
player [YangZ] gets hole card ['HT', 'H2'], current stack 955
player [Ethan] gets hole card ['H4', 'SQ'], current stack 962
player [HakulaPlayer] gets hole card ['S8', 'C9'], current stack 1101
player [SichengZuo] gets hole card ['H9', 'DQ'], current stack 940
player [Jinkun] gets hole card ['S5', 'CQ'], current stack 1108
player [NitWinWin] gets hole card ['C5', 'H8'], current stack 950
player [ZPlayer] gets hole card ['DT', 'C6'], current stack 1968
Started the round 28
Street "preflop" started. (community card = [])
"YangZ" declared "fold:0"
"Ethan" declared "fold:0"
"HakulaPlayer" declared "fold:0"
"SichengZuo" declared "fold:0"
"Jinkun" declared "call:10"
"NitWinWin" declared "fold:0"
"ZPlayer" declared "call:10"
Street "flop" started. (community card = ['S7', 'CJ', 'S9'])
"ZPlayer" declared "call:0"
"Jinkun" declared "call:0"
Street "turn" started. (community card = ['S7', 'CJ', 'S9', 'H3'])
"ZPlayer" declared "call:0"
"Jinkun" declared "call:0"
Street "river" started. (community card = ['S7', 'CJ', 'S9', 'H3', 'CA'])
"ZPlayer" declared "call:0"
"Jinkun" declared "call:0"
"['Jinkun']" won the round 28 (stack = {'YangZ': 955, 'Ethan': 962, 'HakulaPlayer': 1101, 'SichengZuo': 940, 'KLChen2PokerPlayer': 0, 'Jinkun': 1123, 'NitWinWin': 950, 'ZPlayer': 1968})
player [YangZ] gets hole card ['CJ', 'C3'], current stack 945
player [Ethan] gets hole card ['H3', 'C9'], current stack 962
player [HakulaPlayer] gets hole card ['D2', 'SA'], current stack 1101
player [SichengZuo] gets hole card ['CA', 'C4'], current stack 940
player [Jinkun] gets hole card ['D9', 'DJ'], current stack 1123
player [NitWinWin] gets hole card ['D6', 'S3'], current stack 950
player [ZPlayer] gets hole card ['HK', 'S5'], current stack 1963
Started the round 29
Street "preflop" started. (community card = [])
"Ethan" declared "fold:0"
"HakulaPlayer" declared "call:10"
"SichengZuo" declared "fold:0"
"Jinkun" declared "fold:10"
"NitWinWin" declared "fold:0"
"ZPlayer" declared "raise:15"
"YangZ" declared "fold:0"
"HakulaPlayer" declared "call:15"
Street "flop" started. (community card = ['DQ', 'H4', 'DK'])
"ZPlayer" declared "raise:603"
"HakulaPlayer" declared "fold:0"
"['ZPlayer']" won the round 29 (stack = {'YangZ': 945, 'Ethan': 962, 'HakulaPlayer': 1086, 'SichengZuo': 940, 'KLChen2PokerPlayer': 0, 'Jinkun': 1123, 'NitWinWin': 950, 'ZPlayer': 1993})
player [YangZ] gets hole card ['SQ', 'H6'], current stack 940
player [Ethan] gets hole card ['C7', 'C5'], current stack 952
player [HakulaPlayer] gets hole card ['S8', 'CJ'], current stack 1086
player [SichengZuo] gets hole card ['D5', 'D8'], current stack 940
player [Jinkun] gets hole card ['HQ', 'C2'], current stack 1123
player [NitWinWin] gets hole card ['DA', 'C4'], current stack 950
player [ZPlayer] gets hole card ['SK', 'CA'], current stack 1993
Started the round 30
Street "preflop" started. (community card = [])
"HakulaPlayer" declared "fold:0"
"SichengZuo" declared "fold:0"
"Jinkun" declared "fold:10"
"NitWinWin" declared "fold:0"
"ZPlayer" declared "raise:15"
"YangZ" declared "fold:0"
"Ethan" declared "fold:0"
"['ZPlayer']" won the round 30 (stack = {'YangZ': 940, 'Ethan': 952, 'HakulaPlayer': 1086, 'SichengZuo': 940, 'KLChen2PokerPlayer': 0, 'Jinkun': 1123, 'NitWinWin': 950, 'ZPlayer': 2008})
player [YangZ] gets hole card ['SA', 'S9'], current stack 940
player [Ethan] gets hole card ['DA', 'S7'], current stack 947
player [HakulaPlayer] gets hole card ['DQ', 'H8'], current stack 1076
player [SichengZuo] gets hole card ['H7', 'S5'], current stack 940
player [Jinkun] gets hole card ['DK', 'DJ'], current stack 1123
player [NitWinWin] gets hole card ['HA', 'C9'], current stack 950
player [ZPlayer] gets hole card ['SQ', 'CT'], current stack 2008
Started the round 31
Street "preflop" started. (community card = [])
"SichengZuo" declared "fold:0"
"Jinkun" declared "fold:10"
"NitWinWin" declared "fold:0"
"ZPlayer" declared "raise:15"
"YangZ" declared "fold:0"
"Ethan" declared "call:15"
"HakulaPlayer" declared "call:15"
Street "flop" started. (community card = ['C4', 'C5', 'C7'])
"Ethan" declared "call:0"
"HakulaPlayer" declared "call:0"
"ZPlayer" declared "call:0"
Street "turn" started. (community card = ['C4', 'C5', 'C7', 'HT'])
"Ethan" declared "call:0"
"HakulaPlayer" declared "call:0"
"ZPlayer" declared "raise:22"
"Ethan" declared "call:22"
"HakulaPlayer" declared "fold:0"
Street "river" started. (community card = ['C4', 'C5', 'C7', 'HT', 'H9'])
"Ethan" declared "call:0"
"ZPlayer" declared "raise:10"
"Ethan" declared "call:10"
"['ZPlayer']" won the round 31 (stack = {'YangZ': 940, 'Ethan': 905, 'HakulaPlayer': 1071, 'SichengZuo': 940, 'KLChen2PokerPlayer': 0, 'Jinkun': 1123, 'NitWinWin': 950, 'ZPlayer': 2070})
player [YangZ] gets hole card ['DK', 'C8'], current stack 940
player [Ethan] gets hole card ['D9', 'S4'], current stack 905
player [HakulaPlayer] gets hole card ['D8', 'D6'], current stack 1066
player [SichengZuo] gets hole card ['ST', 'C4'], current stack 930
player [Jinkun] gets hole card ['HT', 'CA'], current stack 1123
player [NitWinWin] gets hole card ['H8', 'S7'], current stack 950
player [ZPlayer] gets hole card ['H5', 'S3'], current stack 2070
Started the round 32
Street "preflop" started. (community card = [])
"Jinkun" declared "fold:10"
"NitWinWin" declared "fold:0"
"ZPlayer" declared "raise:15"
"YangZ" declared "fold:0"
"Ethan" declared "fold:0"
"HakulaPlayer" declared "fold:0"
"SichengZuo" declared "fold:0"
"['ZPlayer']" won the round 32 (stack = {'YangZ': 940, 'Ethan': 905, 'HakulaPlayer': 1066, 'SichengZuo': 930, 'KLChen2PokerPlayer': 0, 'Jinkun': 1123, 'NitWinWin': 950, 'ZPlayer': 2085})
player [YangZ] gets hole card ['CA', 'D6'], current stack 940
player [Ethan] gets hole card ['H6', 'HJ'], current stack 905
player [HakulaPlayer] gets hole card ['C7', 'H2'], current stack 1066
player [SichengZuo] gets hole card ['C3', 'ST'], current stack 925
player [Jinkun] gets hole card ['S4', 'S9'], current stack 1113
player [NitWinWin] gets hole card ['D8', 'DT'], current stack 950
player [ZPlayer] gets hole card ['CT', 'C6'], current stack 2085
Started the round 33
Street "preflop" started. (community card = [])
"NitWinWin" declared "fold:0"
"ZPlayer" declared "raise:15"
"YangZ" declared "fold:0"
"Ethan" declared "fold:0"
"HakulaPlayer" declared "fold:0"
"SichengZuo" declared "fold:0"
"Jinkun" declared "fold:15"
"['ZPlayer']" won the round 33 (stack = {'YangZ': 940, 'Ethan': 905, 'HakulaPlayer': 1066, 'SichengZuo': 925, 'KLChen2PokerPlayer': 0, 'Jinkun': 1113, 'NitWinWin': 950, 'ZPlayer': 2100})
player [YangZ] gets hole card ['C9', 'HT'], current stack 940
player [Ethan] gets hole card ['S7', 'S2'], current stack 905
player [HakulaPlayer] gets hole card ['H9', 'C2'], current stack 1066
player [SichengZuo] gets hole card ['C6', 'CT'], current stack 925
player [Jinkun] gets hole card ['H5', 'ST'], current stack 1108
player [NitWinWin] gets hole card ['D7', 'S4'], current stack 940
player [ZPlayer] gets hole card ['CJ', 'D8'], current stack 2100
Started the round 34
Street "preflop" started. (community card = [])
"ZPlayer" declared "raise:15"
"YangZ" declared "fold:0"
"Ethan" declared "fold:0"
"HakulaPlayer" declared "fold:0"
"SichengZuo" declared "fold:0"
"Jinkun" declared "fold:15"
"NitWinWin" declared "fold:0"
"['ZPlayer']" won the round 34 (stack = {'YangZ': 940, 'Ethan': 905, 'HakulaPlayer': 1066, 'SichengZuo': 925, 'KLChen2PokerPlayer': 0, 'Jinkun': 1108, 'NitWinWin': 940, 'ZPlayer': 2115})
player [YangZ] gets hole card ['D7', 'C4'], current stack 940
player [Ethan] gets hole card ['DT', 'H5'], current stack 905
player [HakulaPlayer] gets hole card ['D3', 'C6'], current stack 1066
player [SichengZuo] gets hole card ['SK', 'ST'], current stack 925
player [Jinkun] gets hole card ['S5', 'D2'], current stack 1108
player [NitWinWin] gets hole card ['D9', 'DJ'], current stack 935
player [ZPlayer] gets hole card ['DQ', 'D5'], current stack 2105
Started the round 35
Street "preflop" started. (community card = [])
"YangZ" declared "fold:0"
"Ethan" declared "fold:0"
"HakulaPlayer" declared "fold:0"
"SichengZuo" declared "fold:0"
"Jinkun" declared "call:10"
"NitWinWin" declared "fold:0"
"ZPlayer" declared "raise:15"
"Jinkun" declared "fold:15"
"['ZPlayer']" won the round 35 (stack = {'YangZ': 940, 'Ethan': 905, 'HakulaPlayer': 1066, 'SichengZuo': 925, 'KLChen2PokerPlayer': 0, 'Jinkun': 1098, 'NitWinWin': 935, 'ZPlayer': 2130})
player [YangZ] gets hole card ['SQ', 'CA'], current stack 930
player [Ethan] gets hole card ['H6', 'S5'], current stack 905
player [HakulaPlayer] gets hole card ['HQ', 'D4'], current stack 1066
player [SichengZuo] gets hole card ['D2', 'S7'], current stack 925
player [Jinkun] gets hole card ['S2', 'S3'], current stack 1098
player [NitWinWin] gets hole card ['H9', 'D7'], current stack 935
player [ZPlayer] gets hole card ['DT', 'S8'], current stack 2125
Started the round 36
Street "preflop" started. (community card = [])
"Ethan" declared "fold:0"
"HakulaPlayer" declared "call:10"
"SichengZuo" declared "fold:0"
"Jinkun" declared "fold:10"
"NitWinWin" declared "fold:0"
"ZPlayer" declared "raise:15"
"YangZ" declared "fold:0"
"HakulaPlayer" declared "call:15"
Street "flop" started. (community card = ['SK', 'H7', 'C8'])
"ZPlayer" declared "raise:20"
"HakulaPlayer" declared "fold:0"
"['ZPlayer']" won the round 36 (stack = {'YangZ': 930, 'Ethan': 905, 'HakulaPlayer': 1051, 'SichengZuo': 925, 'KLChen2PokerPlayer': 0, 'Jinkun': 1098, 'NitWinWin': 935, 'ZPlayer': 2155})
player [YangZ] gets hole card ['D6', 'H3'], current stack 925
player [Ethan] gets hole card ['DA', 'H7'], current stack 895
player [HakulaPlayer] gets hole card ['H2', 'H4'], current stack 1051
player [SichengZuo] gets hole card ['CK', 'D9'], current stack 925
player [Jinkun] gets hole card ['HK', 'ST'], current stack 1098
player [NitWinWin] gets hole card ['S2', 'D2'], current stack 935
player [ZPlayer] gets hole card ['D7', 'HJ'], current stack 2155
Started the round 37
Street "preflop" started. (community card = [])
"HakulaPlayer" declared "raise:32"
"SichengZuo" declared "fold:0"
"Jinkun" declared "fold:32"
"NitWinWin" declared "fold:0"
"ZPlayer" declared "raise:54"
"YangZ" declared "fold:0"
"Ethan" declared "fold:0"
"HakulaPlayer" declared "call:54"
Street "flop" started. (community card = ['S7', 'CQ', 'C5'])
"HakulaPlayer" declared "call:0"
"ZPlayer" declared "raise:10"
"HakulaPlayer" declared "call:10"
Street "turn" started. (community card = ['S7', 'CQ', 'C5', 'C9'])
"HakulaPlayer" declared "call:0"
"ZPlayer" declared "call:0"
Street "river" started. (community card = ['S7', 'CQ', 'C5', 'C9', 'C7'])
"HakulaPlayer" declared "call:0"
"ZPlayer" declared "call:0"
"['ZPlayer']" won the round 37 (stack = {'YangZ': 925, 'Ethan': 895, 'HakulaPlayer': 987, 'SichengZuo': 925, 'KLChen2PokerPlayer': 0, 'Jinkun': 1098, 'NitWinWin': 935, 'ZPlayer': 2234})
player [YangZ] gets hole card ['C5', 'DQ'], current stack 925
player [Ethan] gets hole card ['H5', 'HK'], current stack 890
player [HakulaPlayer] gets hole card ['D3', 'CA'], current stack 977
player [SichengZuo] gets hole card ['CQ', 'D4'], current stack 925
player [Jinkun] gets hole card ['H7', 'HT'], current stack 1098
player [NitWinWin] gets hole card ['C6', 'S6'], current stack 935
player [ZPlayer] gets hole card ['H8', 'S2'], current stack 2234
Started the round 38
Street "preflop" started. (community card = [])
"SichengZuo" declared "fold:0"
"Jinkun" declared "fold:10"
"NitWinWin" declared "fold:0"
"ZPlayer" declared "raise:15"
"YangZ" declared "fold:0"
"Ethan" declared "fold:0"
"HakulaPlayer" declared "call:15"
Street "flop" started. (community card = ['HA', 'DJ', 'CT'])
"HakulaPlayer" declared "raise:43"
"ZPlayer" declared "fold:0"
"['HakulaPlayer']" won the round 38 (stack = {'YangZ': 925, 'Ethan': 890, 'HakulaPlayer': 1007, 'SichengZuo': 925, 'KLChen2PokerPlayer': 0, 'Jinkun': 1098, 'NitWinWin': 935, 'ZPlayer': 2219})
player [YangZ] gets hole card ['D5', 'CT'], current stack 925
player [Ethan] gets hole card ['SK', 'D7'], current stack 890
player [HakulaPlayer] gets hole card ['HA', 'SJ'], current stack 1002
player [SichengZuo] gets hole card ['C8', 'S2'], current stack 915
player [Jinkun] gets hole card ['H7', 'DT'], current stack 1098
player [NitWinWin] gets hole card ['HT', 'H4'], current stack 935
player [ZPlayer] gets hole card ['CK', 'SA'], current stack 2219
Started the round 39
Street "preflop" started. (community card = [])
"Jinkun" declared "fold:10"
"NitWinWin" declared "fold:0"
"ZPlayer" declared "raise:15"
"YangZ" declared "fold:0"
"Ethan" declared "fold:0"
"HakulaPlayer" declared "call:15"
"SichengZuo" declared "fold:0"
Street "flop" started. (community card = ['S9', 'D8', 'DJ'])
"HakulaPlayer" declared "raise:45"
"ZPlayer" declared "fold:0"
"['HakulaPlayer']" won the round 39 (stack = {'YangZ': 925, 'Ethan': 890, 'HakulaPlayer': 1032, 'SichengZuo': 915, 'KLChen2PokerPlayer': 0, 'Jinkun': 1098, 'NitWinWin': 935, 'ZPlayer': 2204})
player [YangZ] gets hole card ['C4', 'D7'], current stack 925
player [Ethan] gets hole card ['S5', 'DT'], current stack 890
player [HakulaPlayer] gets hole card ['D6', 'D2'], current stack 1032
player [SichengZuo] gets hole card ['DA', 'S4'], current stack 910
player [Jinkun] gets hole card ['D9', 'C7'], current stack 1088
player [NitWinWin] gets hole card ['HA', 'HJ'], current stack 935
player [ZPlayer] gets hole card ['S7', 'H4'], current stack 2204
Started the round 40
Street "preflop" started. (community card = [])
"NitWinWin" declared "fold:0"
"ZPlayer" declared "raise:15"
"YangZ" declared "fold:0"
"Ethan" declared "fold:0"
"HakulaPlayer" declared "raise:27"
"SichengZuo" declared "fold:0"
"Jinkun" declared "fold:27"
"ZPlayer" declared "call:27"
Street "flop" started. (community card = ['S8', 'SJ', 'CA'])
"ZPlayer" declared "call:0"
"HakulaPlayer" declared "call:0"
Street "turn" started. (community card = ['S8', 'SJ', 'CA', 'C8'])
"ZPlayer" declared "call:0"
"HakulaPlayer" declared "call:0"
Street "river" started. (community card = ['S8', 'SJ', 'CA', 'C8', 'D5'])
"ZPlayer" declared "call:0"
"HakulaPlayer" declared "call:0"
"['ZPlayer']" won the round 40 (stack = {'YangZ': 925, 'Ethan': 890, 'HakulaPlayer': 1005, 'SichengZuo': 910, 'KLChen2PokerPlayer': 0, 'Jinkun': 1088, 'NitWinWin': 935, 'ZPlayer': 2246})
player [YangZ] gets hole card ['HJ', 'H4'], current stack 925
player [Ethan] gets hole card ['C4', 'C8'], current stack 890
player [HakulaPlayer] gets hole card ['C7', 'D6'], current stack 1005
player [SichengZuo] gets hole card ['D8', 'C5'], current stack 910
player [Jinkun] gets hole card ['D7', 'C9'], current stack 1083
player [NitWinWin] gets hole card ['S9', 'D9'], current stack 925
player [ZPlayer] gets hole card ['S2', 'HQ'], current stack 2246
Started the round 41
Street "preflop" started. (community card = [])
"ZPlayer" declared "raise:15"
"YangZ" declared "fold:0"
"Ethan" declared "fold:0"
"HakulaPlayer" declared "fold:0"
"SichengZuo" declared "fold:0"
"Jinkun" declared "fold:15"
"NitWinWin" declared "raise:935"
"ZPlayer" declared "fold:0"
"['NitWinWin']" won the round 41 (stack = {'YangZ': 925, 'Ethan': 890, 'HakulaPlayer': 1005, 'SichengZuo': 910, 'KLChen2PokerPlayer': 0, 'Jinkun': 1083, 'NitWinWin': 955, 'ZPlayer': 2231})
player [YangZ] gets hole card ['H7', 'DQ'], current stack 925
player [Ethan] gets hole card ['C2', 'SJ'], current stack 890
player [HakulaPlayer] gets hole card ['H4', 'S8'], current stack 1005
player [SichengZuo] gets hole card ['D7', 'CQ'], current stack 910
player [Jinkun] gets hole card ['C7', 'D2'], current stack 1083
player [NitWinWin] gets hole card ['D6', 'C5'], current stack 950
player [ZPlayer] gets hole card ['DT', 'C8'], current stack 2221
Started the round 42
Street "preflop" started. (community card = [])
"YangZ" declared "fold:0"
"Ethan" declared "fold:0"
"HakulaPlayer" declared "fold:0"
"SichengZuo" declared "fold:0"
"Jinkun" declared "call:10"
"NitWinWin" declared "fold:0"
"ZPlayer" declared "raise:15"
"Jinkun" declared "fold:15"
"['ZPlayer']" won the round 42 (stack = {'YangZ': 925, 'Ethan': 890, 'HakulaPlayer': 1005, 'SichengZuo': 910, 'KLChen2PokerPlayer': 0, 'Jinkun': 1073, 'NitWinWin': 950, 'ZPlayer': 2246})
player [YangZ] gets hole card ['HK', 'ST'], current stack 915
player [Ethan] gets hole card ['H2', 'H6'], current stack 890
player [HakulaPlayer] gets hole card ['S3', 'CQ'], current stack 1005
player [SichengZuo] gets hole card ['H3', 'CK'], current stack 910
player [Jinkun] gets hole card ['D2', 'S4'], current stack 1073
player [NitWinWin] gets hole card ['D7', 'S6'], current stack 950
player [ZPlayer] gets hole card ['DK', 'D9'], current stack 2241
Started the round 43
Street "preflop" started. (community card = [])
"Ethan" declared "fold:0"
"HakulaPlayer" declared "fold:0"
"SichengZuo" declared "fold:0"
"Jinkun" declared "call:10"
"NitWinWin" declared "fold:0"
"ZPlayer" declared "raise:15"
"YangZ" declared "fold:0"
"Jinkun" declared "fold:15"
"['ZPlayer']" won the round 43 (stack = {'YangZ': 915, 'Ethan': 890, 'HakulaPlayer': 1005, 'SichengZuo': 910, 'KLChen2PokerPlayer': 0, 'Jinkun': 1063, 'NitWinWin': 950, 'ZPlayer': 2266})
player [YangZ] gets hole card ['C7', 'H6'], current stack 910
player [Ethan] gets hole card ['C6', 'D4'], current stack 880
player [HakulaPlayer] gets hole card ['D6', 'CJ'], current stack 1005
player [SichengZuo] gets hole card ['DQ', 'S7'], current stack 910
player [Jinkun] gets hole card ['D8', 'H4'], current stack 1063
player [NitWinWin] gets hole card ['H5', 'D9'], current stack 950
player [ZPlayer] gets hole card ['S6', 'SA'], current stack 2266
Started the round 44
Street "preflop" started. (community card = [])
"HakulaPlayer" declared "fold:0"
"SichengZuo" declared "fold:0"
"Jinkun" declared "fold:10"
"NitWinWin" declared "fold:0"
"ZPlayer" declared "raise:15"
"YangZ" declared "fold:0"
"Ethan" declared "fold:0"
"['ZPlayer']" won the round 44 (stack = {'YangZ': 910, 'Ethan': 880, 'HakulaPlayer': 1005, 'SichengZuo': 910, 'KLChen2PokerPlayer': 0, 'Jinkun': 1063, 'NitWinWin': 950, 'ZPlayer': 2281})
player [YangZ] gets hole card ['CK', 'D7'], current stack 910
player [Ethan] gets hole card ['HJ', 'D6'], current stack 875
player [HakulaPlayer] gets hole card ['C5', 'C4'], current stack 995
player [SichengZuo] gets hole card ['S2', 'H5'], current stack 910
player [Jinkun] gets hole card ['HT', 'S5'], current stack 1063
player [NitWinWin] gets hole card ['DT', 'SQ'], current stack 950
player [ZPlayer] gets hole card ['S6', 'S8'], current stack 2281
Started the round 45
Street "preflop" started. (community card = [])
"SichengZuo" declared "fold:0"
"Jinkun" declared "fold:10"
"NitWinWin" declared "fold:0"
"ZPlayer" declared "raise:15"
"YangZ" declared "fold:0"
"Ethan" declared "fold:0"
"HakulaPlayer" declared "call:15"
Street "flop" started. (community card = ['DK', 'DJ', 'S7'])
"HakulaPlayer" declared "call:0"
"ZPlayer" declared "call:0"
Street "turn" started. (community card = ['DK', 'DJ', 'S7', 'C9'])
"HakulaPlayer" declared "call:0"
"ZPlayer" declared "call:0"
Street "river" started. (community card = ['DK', 'DJ', 'S7', 'C9', 'S4'])
"HakulaPlayer" declared "call:0"
"ZPlayer" declared "call:0"
"['HakulaPlayer']" won the round 45 (stack = {'YangZ': 910, 'Ethan': 875, 'HakulaPlayer': 1025, 'SichengZuo': 910, 'KLChen2PokerPlayer': 0, 'Jinkun': 1063, 'NitWinWin': 950, 'ZPlayer': 2266})
player [YangZ] gets hole card ['DA', 'SA'], current stack 910
player [Ethan] gets hole card ['CJ', 'HQ'], current stack 875
player [HakulaPlayer] gets hole card ['D7', 'D3'], current stack 1020
player [SichengZuo] gets hole card ['SJ', 'D6'], current stack 900
player [Jinkun] gets hole card ['ST', 'S5'], current stack 1063
player [NitWinWin] gets hole card ['C7', 'CT'], current stack 950
player [ZPlayer] gets hole card ['H7', 'H5'], current stack 2266
Started the round 46
Street "preflop" started. (community card = [])
"Jinkun" declared "fold:10"
"NitWinWin" declared "fold:0"
"ZPlayer" declared "raise:15"
"YangZ" declared "fold:0"
"Ethan" declared "raise:131"
"HakulaPlayer" declared "fold:0"
"SichengZuo" declared "fold:0"
"ZPlayer" declared "fold:0"
"['Ethan']" won the round 46 (stack = {'YangZ': 910, 'Ethan': 905, 'HakulaPlayer': 1020, 'SichengZuo': 900, 'KLChen2PokerPlayer': 0, 'Jinkun': 1063, 'NitWinWin': 950, 'ZPlayer': 2251})
player [YangZ] gets hole card ['H5', 'DJ'], current stack 910
player [Ethan] gets hole card ['S7', 'D2'], current stack 905
player [HakulaPlayer] gets hole card ['DQ', 'S3'], current stack 1020
player [SichengZuo] gets hole card ['D3', 'C2'], current stack 895
player [Jinkun] gets hole card ['H4', 'SQ'], current stack 1053
player [NitWinWin] gets hole card ['H2', 'S2'], current stack 950
player [ZPlayer] gets hole card ['D8', 'HJ'], current stack 2251
Started the round 47
Street "preflop" started. (community card = [])
"NitWinWin" declared "fold:0"
"ZPlayer" declared "raise:15"
"YangZ" declared "fold:0"
"Ethan" declared "fold:0"
"HakulaPlayer" declared "call:15"
"SichengZuo" declared "fold:0"
"Jinkun" declared "fold:15"
Street "flop" started. (community card = ['C4', 'DK', 'CT'])
"ZPlayer" declared "call:0"
"HakulaPlayer" declared "call:0"
Street "turn" started. (community card = ['C4', 'DK', 'CT', 'HK'])
"ZPlayer" declared "call:0"
"HakulaPlayer" declared "call:0"
Street "river" started. (community card = ['C4', 'DK', 'CT', 'HK', 'H9'])
"ZPlayer" declared "call:0"
"HakulaPlayer" declared "call:0"
"['HakulaPlayer']" won the round 47 (stack = {'YangZ': 910, 'Ethan': 905, 'HakulaPlayer': 1050, 'SichengZuo': 895, 'KLChen2PokerPlayer': 0, 'Jinkun': 1053, 'NitWinWin': 950, 'ZPlayer': 2236})
player [YangZ] gets hole card ['C5', 'D2'], current stack 910
player [Ethan] gets hole card ['CK', 'C7'], current stack 905
player [HakulaPlayer] gets hole card ['C8', 'S4'], current stack 1050
player [SichengZuo] gets hole card ['DA', 'D6'], current stack 895
player [Jinkun] gets hole card ['HT', 'H9'], current stack 1048
player [NitWinWin] gets hole card ['D8', 'H8'], current stack 940
player [ZPlayer] gets hole card ['H4', 'DK'], current stack 2236
Started the round 48
Street "preflop" started. (community card = [])
"ZPlayer" declared "raise:15"
"YangZ" declared "fold:0"
"Ethan" declared "fold:0"
"HakulaPlayer" declared "fold:0"
"SichengZuo" declared "fold:0"
"Jinkun" declared "fold:15"
"NitWinWin" declared "raise:950"
"ZPlayer" declared "fold:0"
"['NitWinWin']" won the round 48 (stack = {'YangZ': 910, 'Ethan': 905, 'HakulaPlayer': 1050, 'SichengZuo': 895, 'KLChen2PokerPlayer': 0, 'Jinkun': 1048, 'NitWinWin': 970, 'ZPlayer': 2221})
player [YangZ] gets hole card ['HQ', 'DA'], current stack 910
player [Ethan] gets hole card ['S6', 'D8'], current stack 905
player [HakulaPlayer] gets hole card ['CQ', 'C7'], current stack 1050
player [SichengZuo] gets hole card ['DK', 'D4'], current stack 895
player [Jinkun] gets hole card ['H8', 'S9'], current stack 1048
player [NitWinWin] gets hole card ['C8', 'D2'], current stack 965
player [ZPlayer] gets hole card ['ST', 'D5'], current stack 2211
Started the round 49
Street "preflop" started. (community card = [])
"YangZ" declared "fold:0"
"Ethan" declared "fold:0"
"HakulaPlayer" declared "call:10"
"SichengZuo" declared "fold:0"
"Jinkun" declared "call:10"
"NitWinWin" declared "fold:0"
"ZPlayer" declared "raise:15"
"HakulaPlayer" declared "call:15"
"Jinkun" declared "call:15"
Street "flop" started. (community card = ['HA', 'SJ', 'H9'])
"ZPlayer" declared "call:0"
"HakulaPlayer" declared "call:0"
"Jinkun" declared "call:0"
Street "turn" started. (community card = ['HA', 'SJ', 'H9', 'C4'])
"ZPlayer" declared "call:0"
"HakulaPlayer" declared "call:0"
"Jinkun" declared "call:0"
Street "river" started. (community card = ['HA', 'SJ', 'H9', 'C4', 'SA'])
"ZPlayer" declared "call:0"
"HakulaPlayer" declared "call:0"
"Jinkun" declared "call:0"
"['Jinkun']" won the round 49 (stack = {'YangZ': 910, 'Ethan': 905, 'HakulaPlayer': 1035, 'SichengZuo': 895, 'KLChen2PokerPlayer': 0, 'Jinkun': 1083, 'NitWinWin': 965, 'ZPlayer': 2206})
player [YangZ] gets hole card ['ST', 'D2'], current stack 900
player [Ethan] gets hole card ['SK', 'DJ'], current stack 905
player [HakulaPlayer] gets hole card ['DA', 'SA'], current stack 1035
player [SichengZuo] gets hole card ['H6', 'HQ'], current stack 895
player [Jinkun] gets hole card ['C9', 'S6'], current stack 1083
player [NitWinWin] gets hole card ['C7', 'C5'], current stack 965
player [ZPlayer] gets hole card ['H8', 'SQ'], current stack 2201
Started the round 50
Street "preflop" started. (community card = [])
"Ethan" declared "raise:135"
"HakulaPlayer" declared "call:135"
"SichengZuo" declared "fold:0"
"Jinkun" declared "fold:135"
"NitWinWin" declared "fold:0"
"ZPlayer" declared "fold:0"
"YangZ" declared "fold:0"
Street "flop" started. (community card = ['H2', 'S4', 'C8'])
"Ethan" declared "call:0"
"HakulaPlayer" declared "raise:380"
"Ethan" declared "fold:0"
"['HakulaPlayer']" won the round 50 (stack = {'YangZ': 900, 'Ethan': 770, 'HakulaPlayer': 1185, 'SichengZuo': 895, 'KLChen2PokerPlayer': 0, 'Jinkun': 1083, 'NitWinWin': 965, 'ZPlayer': 2201})

Game Results:
------------------------------------------------------------
Game 1:
Winner: ZPlayer (stack: 2201)
All players' stacks:
  YangZ: 900
  Ethan: 770
  HakulaPlayer: 1185
  SichengZuo: 895
  KLChen2PokerPlayer: 0
  Jinkun: 1083
  NitWinWin: 965
  ZPlayer: 2201
------------------------------------------------------------
