player [YangZ] gets hole card ['DJ', 'D4'], current stack 1000
player [Ethan] gets hole card ['C2', 'CA'], current stack 995
player [HakulaPlayer] gets hole card ['H5', 'SJ'], current stack 990
player [SichengZuo] gets hole card ['H9', 'S7'], current stack 1000
player [KLChen2PokerPlayer] gets hole card ['S3', 'D3'], current stack 1000
player [Jinkun] gets hole card ['D9', 'CK'], current stack 1000
player [NitWinWin] gets hole card ['C7', 'CQ'], current stack 1000
player [ZPlayer] gets hole card ['S2', 'SK'], current stack 1000
Started the round 1
Street "preflop" started. (community card = [])
"SichengZuo" declared "fold:0"
"KLChen2PokerPlayer" declared "call:10"
"Jinkun" declared "fold:10"
"NitWinWin" declared "fold:0"
"ZPlayer" declared "raise:15"
"YangZ" declared "fold:0"
"Ethan" declared "fold:0"
"HakulaPlayer" declared "call:15"
"KLChen2PokerPlayer" declared "raise:20"
"ZPlayer" declared "fold:0"
"HakulaPlayer" declared "call:20"
Street "flop" started. (community card = ['CT', 'HA', 'C3'])
"HakulaPlayer" declared "call:0"
"KLChen2PokerPlayer" declared "raise:35"
"HakulaPlayer" declared "fold:0"
"['KLChen2PokerPlayer']" won the round 1 (stack = {'YangZ': 1000, 'Ethan': 995, 'HakulaPlayer': 980, 'SichengZuo': 1000, 'KLChen2PokerPlayer': 1040, 'Jinkun': 1000, 'NitWinWin': 1000, 'ZPlayer': 985})
player [YangZ] gets hole card ['S8', 'C7'], current stack 1000
player [Ethan] gets hole card ['D3', 'D9'], current stack 995
player [HakulaPlayer] gets hole card ['H5', 'SA'], current stack 975
player [SichengZuo] gets hole card ['CK', 'H8'], current stack 990
player [KLChen2PokerPlayer] gets hole card ['H6', 'D5'], current stack 1040
player [Jinkun] gets hole card ['H9', 'SQ'], current stack 1000
player [NitWinWin] gets hole card ['CA', 'C9'], current stack 1000
player [ZPlayer] gets hole card ['ST', 'DK'], current stack 985
Started the round 2
Street "preflop" started. (community card = [])
"KLChen2PokerPlayer" declared "fold:0"
"Jinkun" declared "fold:10"
"NitWinWin" declared "fold:0"
"ZPlayer" declared "raise:15"
"YangZ" declared "fold:0"
"Ethan" declared "fold:0"
"HakulaPlayer" declared "fold:0"
"SichengZuo" declared "fold:0"
"['ZPlayer']" won the round 2 (stack = {'YangZ': 1000, 'Ethan': 995, 'HakulaPlayer': 975, 'SichengZuo': 990, 'KLChen2PokerPlayer': 1040, 'Jinkun': 1000, 'NitWinWin': 1000, 'ZPlayer': 1000})
player [YangZ] gets hole card ['DA', 'H7'], current stack 1000
player [Ethan] gets hole card ['S9', 'D5'], current stack 995
player [HakulaPlayer] gets hole card ['H6', 'SQ'], current stack 975
player [SichengZuo] gets hole card ['ST', 'S6'], current stack 985
player [KLChen2PokerPlayer] gets hole card ['HT', 'H8'], current stack 1030
player [Jinkun] gets hole card ['D8', 'D7'], current stack 1000
player [NitWinWin] gets hole card ['CJ', 'S5'], current stack 1000
player [ZPlayer] gets hole card ['CA', 'CQ'], current stack 1000
Started the round 3
Street "preflop" started. (community card = [])
"Jinkun" declared "fold:10"
"NitWinWin" declared "fold:0"
"ZPlayer" declared "raise:15"
"YangZ" declared "fold:0"
"Ethan" declared "fold:0"
"HakulaPlayer" declared "fold:0"
"SichengZuo" declared "fold:0"
"KLChen2PokerPlayer" declared "fold:0"
"['ZPlayer']" won the round 3 (stack = {'YangZ': 1000, 'Ethan': 995, 'HakulaPlayer': 975, 'SichengZuo': 985, 'KLChen2PokerPlayer': 1030, 'Jinkun': 1000, 'NitWinWin': 1000, 'ZPlayer': 1015})
player [YangZ] gets hole card ['S7', 'DK'], current stack 1000
player [Ethan] gets hole card ['C4', 'H7'], current stack 995
player [HakulaPlayer] gets hole card ['SQ', 'DJ'], current stack 975
player [SichengZuo] gets hole card ['DQ', 'HJ'], current stack 985
player [KLChen2PokerPlayer] gets hole card ['S2', 'C2'], current stack 1025
player [Jinkun] gets hole card ['S4', 'C9'], current stack 990
player [NitWinWin] gets hole card ['HQ', 'CK'], current stack 1000
player [ZPlayer] gets hole card ['CT', 'H2'], current stack 1015
Started the round 4
Street "preflop" started. (community card = [])
"NitWinWin" declared "fold:0"
"ZPlayer" declared "call:10"
"YangZ" declared "fold:0"
"Ethan" declared "fold:0"
"HakulaPlayer" declared "call:10"
"SichengZuo" declared "fold:0"
"KLChen2PokerPlayer" declared "call:10"
"Jinkun" declared "call:10"
Street "flop" started. (community card = ['H8', 'DA', 'SA'])
"KLChen2PokerPlayer" declared "call:0"
"Jinkun" declared "call:0"
"ZPlayer" declared "call:0"
"HakulaPlayer" declared "call:0"
Street "turn" started. (community card = ['H8', 'DA', 'SA', 'C6'])
"KLChen2PokerPlayer" declared "call:0"
"Jinkun" declared "call:0"
"ZPlayer" declared "call:0"
"HakulaPlayer" declared "call:0"
Street "river" started. (community card = ['H8', 'DA', 'SA', 'C6', 'C8'])
"KLChen2PokerPlayer" declared "call:0"
"Jinkun" declared "call:0"
"ZPlayer" declared "call:0"
"HakulaPlayer" declared "call:0"
"['HakulaPlayer']" won the round 4 (stack = {'YangZ': 1000, 'Ethan': 995, 'HakulaPlayer': 1005, 'SichengZuo': 985, 'KLChen2PokerPlayer': 1020, 'Jinkun': 990, 'NitWinWin': 1000, 'ZPlayer': 1005})
player [YangZ] gets hole card ['HJ', 'S3'], current stack 1000
player [Ethan] gets hole card ['S4', 'SA'], current stack 995
player [HakulaPlayer] gets hole card ['D7', 'C9'], current stack 1005
player [SichengZuo] gets hole card ['D5', 'S6'], current stack 985
player [KLChen2PokerPlayer] gets hole card ['S8', 'D2'], current stack 1020
player [Jinkun] gets hole card ['CJ', 'D4'], current stack 985
player [NitWinWin] gets hole card ['H4', 'HT'], current stack 990
player [ZPlayer] gets hole card ['C8', 'C3'], current stack 1005
Started the round 5
Street "preflop" started. (community card = [])
"ZPlayer" declared "call:10"
"YangZ" declared "fold:0"
"Ethan" declared "fold:0"
"HakulaPlayer" declared "call:10"
"SichengZuo" declared "fold:0"
"KLChen2PokerPlayer" declared "fold:0"
"Jinkun" declared "call:10"
"NitWinWin" declared "fold:0"
Street "flop" started. (community card = ['C2', 'DA', 'CK'])
"Jinkun" declared "call:0"
"ZPlayer" declared "raise:10"
"HakulaPlayer" declared "fold:0"
"Jinkun" declared "call:10"
Street "turn" started. (community card = ['C2', 'DA', 'CK', 'H2'])
"Jinkun" declared "call:0"
"ZPlayer" declared "call:0"
Street "river" started. (community card = ['C2', 'DA', 'CK', 'H2', 'S2'])
"Jinkun" declared "call:0"
"ZPlayer" declared "raise:10"
"Jinkun" declared "call:10"
"['Jinkun', 'ZPlayer']" won the round 5 (stack = {'YangZ': 1000, 'Ethan': 995, 'HakulaPlayer': 995, 'SichengZuo': 985, 'KLChen2PokerPlayer': 1020, 'Jinkun': 1000, 'NitWinWin': 990, 'ZPlayer': 1015})
player [YangZ] gets hole card ['S4', 'H3'], current stack 1000
player [Ethan] gets hole card ['H9', 'D5'], current stack 995
player [HakulaPlayer] gets hole card ['HJ', 'D6'], current stack 995
player [SichengZuo] gets hole card ['D2', 'CA'], current stack 985
player [KLChen2PokerPlayer] gets hole card ['SJ', 'S8'], current stack 1020
player [Jinkun] gets hole card ['H5', 'C7'], current stack 1000
player [NitWinWin] gets hole card ['C5', 'D8'], current stack 985
player [ZPlayer] gets hole card ['C6', 'DK'], current stack 1005
Started the round 6
Street "preflop" started. (community card = [])
"YangZ" declared "fold:0"
"Ethan" declared "fold:0"
"HakulaPlayer" declared "fold:0"
"SichengZuo" declared "fold:0"
"KLChen2PokerPlayer" declared "raise:24"
"Jinkun" declared "fold:24"
"NitWinWin" declared "fold:0"
"ZPlayer" declared "call:24"
Street "flop" started. (community card = ['HK', 'H2', 'S9'])
"ZPlayer" declared "raise:10"
"KLChen2PokerPlayer" declared "fold:0"
"['ZPlayer']" won the round 6 (stack = {'YangZ': 1000, 'Ethan': 995, 'HakulaPlayer': 995, 'SichengZuo': 985, 'KLChen2PokerPlayer': 996, 'Jinkun': 1000, 'NitWinWin': 985, 'ZPlayer': 1044})
player [YangZ] gets hole card ['C2', 'D3'], current stack 990
player [Ethan] gets hole card ['S6', 'CJ'], current stack 995
player [HakulaPlayer] gets hole card ['S4', 'CQ'], current stack 995
player [SichengZuo] gets hole card ['D7', 'S9'], current stack 985
player [KLChen2PokerPlayer] gets hole card ['S8', 'H9'], current stack 996
player [Jinkun] gets hole card ['H4', 'D2'], current stack 1000
player [NitWinWin] gets hole card ['D5', 'C4'], current stack 985
player [ZPlayer] gets hole card ['C5', 'H3'], current stack 1039
Started the round 7
Street "preflop" started. (community card = [])
"Ethan" declared "fold:0"
"HakulaPlayer" declared "fold:0"
"SichengZuo" declared "fold:0"
"KLChen2PokerPlayer" declared "call:10"
"Jinkun" declared "fold:10"
"NitWinWin" declared "fold:0"
"ZPlayer" declared "call:10"
"YangZ" declared "fold:0"
Street "flop" started. (community card = ['HQ', 'C9', 'D6'])
"ZPlayer" declared "call:0"
"KLChen2PokerPlayer" declared "raise:28"
"ZPlayer" declared "fold:0"
"['KLChen2PokerPlayer']" won the round 7 (stack = {'YangZ': 990, 'Ethan': 995, 'HakulaPlayer': 995, 'SichengZuo': 985, 'KLChen2PokerPlayer': 1016, 'Jinkun': 1000, 'NitWinWin': 985, 'ZPlayer': 1034})
player [YangZ] gets hole card ['C7', 'S8'], current stack 985
player [Ethan] gets hole card ['SQ', 'HA'], current stack 985
player [HakulaPlayer] gets hole card ['S2', 'H7'], current stack 995
player [SichengZuo] gets hole card ['H9', 'DJ'], current stack 985
player [KLChen2PokerPlayer] gets hole card ['HJ', 'S3'], current stack 1016
player [Jinkun] gets hole card ['D5', 'S9'], current stack 1000
player [NitWinWin] gets hole card ['H4', 'C8'], current stack 985
player [ZPlayer] gets hole card ['D8', 'D6'], current stack 1034
Started the round 8
Street "preflop" started. (community card = [])
"HakulaPlayer" declared "fold:0"
"SichengZuo" declared "fold:0"
"KLChen2PokerPlayer" declared "call:10"
"Jinkun" declared "fold:10"
"NitWinWin" declared "fold:0"
"ZPlayer" declared "raise:15"
"YangZ" declared "fold:0"
"Ethan" declared "raise:149"
"KLChen2PokerPlayer" declared "fold:0"
"ZPlayer" declared "fold:0"
"['Ethan']" won the round 8 (stack = {'YangZ': 985, 'Ethan': 1025, 'HakulaPlayer': 995, 'SichengZuo': 985, 'KLChen2PokerPlayer': 1006, 'Jinkun': 1000, 'NitWinWin': 985, 'ZPlayer': 1019})
player [YangZ] gets hole card ['C6', 'H4'], current stack 985
player [Ethan] gets hole card ['C2', 'S5'], current stack 1020
player [HakulaPlayer] gets hole card ['C4', 'DQ'], current stack 985
player [SichengZuo] gets hole card ['HA', 'H5'], current stack 985
player [KLChen2PokerPlayer] gets hole card ['DT', 'D5'], current stack 1006
player [Jinkun] gets hole card ['CT', 'HT'], current stack 1000
player [NitWinWin] gets hole card ['S9', 'HK'], current stack 985
player [ZPlayer] gets hole card ['HQ', 'H7'], current stack 1019
Started the round 9
Street "preflop" started. (community card = [])
"SichengZuo" declared "fold:0"
"KLChen2PokerPlayer" declared "call:10"
"Jinkun" declared "fold:10"
"NitWinWin" declared "fold:0"
"ZPlayer" declared "raise:15"
"YangZ" declared "fold:0"
"Ethan" declared "fold:0"
"HakulaPlayer" declared "call:15"
"KLChen2PokerPlayer" declared "fold:0"
Street "flop" started. (community card = ['CQ', 'C7', 'SQ'])
"HakulaPlayer" declared "raise:51"
"ZPlayer" declared "raise:102"
"HakulaPlayer" declared "call:102"
Street "turn" started. (community card = ['CQ', 'C7', 'SQ', 'H8'])
"HakulaPlayer" declared "raise:323"
"ZPlayer" declared "raise:646"
"HakulaPlayer" declared "call:646"
Street "river" started. (community card = ['CQ', 'C7', 'SQ', 'H8', 'SA'])
"HakulaPlayer" declared "raise:232"
"ZPlayer" declared "call:232"
"['ZPlayer']" won the round 9 (stack = {'YangZ': 985, 'Ethan': 1020, 'HakulaPlayer': 0, 'SichengZuo': 985, 'KLChen2PokerPlayer': 996, 'Jinkun': 1000, 'NitWinWin': 985, 'ZPlayer': 2029})
player [YangZ] gets hole card ['D6', 'D3'], current stack 985
player [Ethan] gets hole card ['CQ', 'C2'], current stack 1020
player [SichengZuo] gets hole card ['H3', 'DK'], current stack 980
player [KLChen2PokerPlayer] gets hole card ['CJ', 'DJ'], current stack 986
player [Jinkun] gets hole card ['C7', 'S9'], current stack 1000
player [NitWinWin] gets hole card ['H8', 'DT'], current stack 985
player [ZPlayer] gets hole card ['C8', 'HJ'], current stack 2029
Started the round 10
Street "preflop" started. (community card = [])
"Jinkun" declared "fold:10"
"NitWinWin" declared "fold:0"
"ZPlayer" declared "raise:15"
"YangZ" declared "fold:0"
"Ethan" declared "fold:0"
"SichengZuo" declared "fold:0"
"KLChen2PokerPlayer" declared "raise:21"
"ZPlayer" declared "call:21"
Street "flop" started. (community card = ['C5', 'S7', 'CA'])
"KLChen2PokerPlayer" declared "raise:39"
"ZPlayer" declared "fold:0"
"['KLChen2PokerPlayer']" won the round 10 (stack = {'YangZ': 985, 'Ethan': 1020, 'HakulaPlayer': 0, 'SichengZuo': 980, 'KLChen2PokerPlayer': 1022, 'Jinkun': 1000, 'NitWinWin': 985, 'ZPlayer': 2008})
player [YangZ] gets hole card ['H2', 'D3'], current stack 985
player [Ethan] gets hole card ['H4', 'CQ'], current stack 1020
player [SichengZuo] gets hole card ['S5', 'C4'], current stack 980
player [KLChen2PokerPlayer] gets hole card ['C8', 'DJ'], current stack 1017
player [Jinkun] gets hole card ['SK', 'DA'], current stack 990
player [NitWinWin] gets hole card ['CK', 'D7'], current stack 985
player [ZPlayer] gets hole card ['H3', 'S6'], current stack 2008
Started the round 11
Street "preflop" started. (community card = [])
"NitWinWin" declared "fold:0"
"ZPlayer" declared "raise:15"
"YangZ" declared "fold:0"
"Ethan" declared "fold:0"
"SichengZuo" declared "fold:0"
"KLChen2PokerPlayer" declared "raise:20"
"Jinkun" declared "call:20"
"ZPlayer" declared "call:20"
Street "flop" started. (community card = ['C3', 'ST', 'C9'])
"KLChen2PokerPlayer" declared "raise:15"
"Jinkun" declared "call:15"
"ZPlayer" declared "fold:0"
Street "turn" started. (community card = ['C3', 'ST', 'C9', 'H5'])
"KLChen2PokerPlayer" declared "call:0"
"Jinkun" declared "call:0"
Street "river" started. (community card = ['C3', 'ST', 'C9', 'H5', 'HT'])
"KLChen2PokerPlayer" declared "call:0"
"Jinkun" declared "call:0"
"['Jinkun']" won the round 11 (stack = {'YangZ': 985, 'Ethan': 1020, 'HakulaPlayer': 0, 'SichengZuo': 980, 'KLChen2PokerPlayer': 987, 'Jinkun': 1055, 'NitWinWin': 985, 'ZPlayer': 1988})
player [YangZ] gets hole card ['D9', 'S3'], current stack 985
player [Ethan] gets hole card ['C2', 'C6'], current stack 1020
player [SichengZuo] gets hole card ['HQ', 'CQ'], current stack 980
player [KLChen2PokerPlayer] gets hole card ['S4', 'S9'], current stack 987
player [Jinkun] gets hole card ['D8', 'HA'], current stack 1050
player [NitWinWin] gets hole card ['D6', 'DT'], current stack 975
player [ZPlayer] gets hole card ['H4', 'CT'], current stack 1988
Started the round 12
Street "preflop" started. (community card = [])
"ZPlayer" declared "raise:15"
"YangZ" declared "fold:0"
"Ethan" declared "fold:0"
"SichengZuo" declared "fold:0"
"KLChen2PokerPlayer" declared "fold:0"
"Jinkun" declared "fold:15"
"NitWinWin" declared "fold:0"
"['ZPlayer']" won the round 12 (stack = {'YangZ': 985, 'Ethan': 1020, 'HakulaPlayer': 0, 'SichengZuo': 980, 'KLChen2PokerPlayer': 987, 'Jinkun': 1050, 'NitWinWin': 975, 'ZPlayer': 2003})
player [YangZ] gets hole card ['C6', 'C4'], current stack 985
player [Ethan] gets hole card ['DK', 'HA'], current stack 1020
player [SichengZuo] gets hole card ['C9', 'C3'], current stack 980
player [KLChen2PokerPlayer] gets hole card ['HJ', 'D4'], current stack 987
player [Jinkun] gets hole card ['D3', 'C5'], current stack 1050
player [NitWinWin] gets hole card ['S3', 'S4'], current stack 970
player [ZPlayer] gets hole card ['SA', 'H7'], current stack 1993
Started the round 13
Street "preflop" started. (community card = [])
"YangZ" declared "fold:0"
"Ethan" declared "raise:306"
"SichengZuo" declared "fold:0"
"KLChen2PokerPlayer" declared "fold:0"
"Jinkun" declared "fold:306"
"NitWinWin" declared "fold:0"
"ZPlayer" declared "fold:0"
"['Ethan']" won the round 13 (stack = {'YangZ': 985, 'Ethan': 1035, 'HakulaPlayer': 0, 'SichengZuo': 980, 'KLChen2PokerPlayer': 987, 'Jinkun': 1050, 'NitWinWin': 970, 'ZPlayer': 1993})
player [YangZ] gets hole card ['H3', 'C6'], current stack 975
player [Ethan] gets hole card ['ST', 'H5'], current stack 1035
player [SichengZuo] gets hole card ['C9', 'DK'], current stack 980
player [KLChen2PokerPlayer] gets hole card ['CA', 'S2'], current stack 987
player [Jinkun] gets hole card ['S4', 'CK'], current stack 1050
player [NitWinWin] gets hole card ['C4', 'CQ'], current stack 970
player [ZPlayer] gets hole card ['D7', 'H7'], current stack 1988
Started the round 14
Street "preflop" started. (community card = [])
"Ethan" declared "fold:0"
"SichengZuo" declared "fold:0"
"KLChen2PokerPlayer" declared "call:10"
"Jinkun" declared "fold:10"
"NitWinWin" declared "fold:0"
"ZPlayer" declared "raise:15"
"YangZ" declared "fold:0"
"KLChen2PokerPlayer" declared "raise:20"
"ZPlayer" declared "call:20"
Street "flop" started. (community card = ['D2', 'DJ', 'HQ'])
"ZPlayer" declared "call:0"
"KLChen2PokerPlayer" declared "raise:10"
"ZPlayer" declared "fold:0"
"['KLChen2PokerPlayer']" won the round 14 (stack = {'YangZ': 975, 'Ethan': 1035, 'HakulaPlayer': 0, 'SichengZuo': 980, 'KLChen2PokerPlayer': 1017, 'Jinkun': 1050, 'NitWinWin': 970, 'ZPlayer': 1973})
player [YangZ] gets hole card ['C2', 'SJ'], current stack 970
player [Ethan] gets hole card ['S5', 'C8'], current stack 1025
player [SichengZuo] gets hole card ['D7', 'DK'], current stack 980
player [KLChen2PokerPlayer] gets hole card ['CQ', 'H4'], current stack 1017
player [Jinkun] gets hole card ['D3', 'CA'], current stack 1050
player [NitWinWin] gets hole card ['SK', 'C6'], current stack 970
player [ZPlayer] gets hole card ['C9', 'DA'], current stack 1973
Started the round 15
Street "preflop" started. (community card = [])
"SichengZuo" declared "fold:0"
"KLChen2PokerPlayer" declared "call:10"
"Jinkun" declared "fold:10"
"NitWinWin" declared "fold:0"
"ZPlayer" declared "raise:15"
"YangZ" declared "fold:0"
"Ethan" declared "fold:0"
"KLChen2PokerPlayer" declared "raise:20"
"ZPlayer" declared "call:20"
Street "flop" started. (community card = ['H5', 'S9', 'HK'])
"KLChen2PokerPlayer" declared "call:0"
"ZPlayer" declared "raise:10"
"KLChen2PokerPlayer" declared "fold:0"
"['ZPlayer']" won the round 15 (stack = {'YangZ': 970, 'Ethan': 1025, 'HakulaPlayer': 0, 'SichengZuo': 980, 'KLChen2PokerPlayer': 997, 'Jinkun': 1050, 'NitWinWin': 970, 'ZPlayer': 2008})
player [YangZ] gets hole card ['S8', 'HT'], current stack 970
player [Ethan] gets hole card ['HJ', 'C3'], current stack 1020
player [SichengZuo] gets hole card ['CJ', 'CK'], current stack 970
player [KLChen2PokerPlayer] gets hole card ['H4', 'S5'], current stack 997
player [Jinkun] gets hole card ['CQ', 'HK'], current stack 1050
player [NitWinWin] gets hole card ['H2', 'C6'], current stack 970
player [ZPlayer] gets hole card ['ST', 'S7'], current stack 2008
Started the round 16
Street "preflop" started. (community card = [])
"KLChen2PokerPlayer" declared "fold:0"
"Jinkun" declared "fold:10"
"NitWinWin" declared "fold:0"
"ZPlayer" declared "raise:15"
"YangZ" declared "fold:0"
"Ethan" declared "fold:0"
"SichengZuo" declared "fold:0"
"['ZPlayer']" won the round 16 (stack = {'YangZ': 970, 'Ethan': 1020, 'HakulaPlayer': 0, 'SichengZuo': 970, 'KLChen2PokerPlayer': 997, 'Jinkun': 1050, 'NitWinWin': 970, 'ZPlayer': 2023})
player [YangZ] gets hole card ['CA', 'CJ'], current stack 970
player [Ethan] gets hole card ['HK', 'S2'], current stack 1020
player [SichengZuo] gets hole card ['ST', 'D7'], current stack 965
player [KLChen2PokerPlayer] gets hole card ['HA', 'S7'], current stack 987
player [Jinkun] gets hole card ['C6', 'C2'], current stack 1050
player [NitWinWin] gets hole card ['C5', 'CQ'], current stack 970
player [ZPlayer] gets hole card ['SJ', 'D4'], current stack 2023
Started the round 17
Street "preflop" started. (community card = [])
"Jinkun" declared "fold:10"
"NitWinWin" declared "fold:0"
"ZPlayer" declared "raise:15"
"YangZ" declared "fold:0"
"Ethan" declared "fold:0"
"SichengZuo" declared "fold:0"
"KLChen2PokerPlayer" declared "raise:20"
"ZPlayer" declared "call:20"
Street "flop" started. (community card = ['D2', 'D3', 'DJ'])
"KLChen2PokerPlayer" declared "call:0"
"ZPlayer" declared "raise:10"
"KLChen2PokerPlayer" declared "fold:0"
"['ZPlayer']" won the round 17 (stack = {'YangZ': 970, 'Ethan': 1020, 'HakulaPlayer': 0, 'SichengZuo': 965, 'KLChen2PokerPlayer': 977, 'Jinkun': 1050, 'NitWinWin': 970, 'ZPlayer': 2048})
player [YangZ] gets hole card ['H4', 'CJ'], current stack 970
player [Ethan] gets hole card ['HA', 'D3'], current stack 1020
player [SichengZuo] gets hole card ['S4', 'S7'], current stack 965
player [KLChen2PokerPlayer] gets hole card ['CT', 'C8'], current stack 972
player [Jinkun] gets hole card ['C2', 'SJ'], current stack 1040
player [NitWinWin] gets hole card ['D9', 'C7'], current stack 970
player [ZPlayer] gets hole card ['HJ', 'SA'], current stack 2048
Started the round 18
Street "preflop" started. (community card = [])
"NitWinWin" declared "fold:0"
"ZPlayer" declared "raise:15"
"YangZ" declared "fold:0"
"Ethan" declared "fold:0"
"SichengZuo" declared "fold:0"
"KLChen2PokerPlayer" declared "fold:0"
"Jinkun" declared "fold:15"
"['ZPlayer']" won the round 18 (stack = {'YangZ': 970, 'Ethan': 1020, 'HakulaPlayer': 0, 'SichengZuo': 965, 'KLChen2PokerPlayer': 972, 'Jinkun': 1040, 'NitWinWin': 970, 'ZPlayer': 2063})
player [YangZ] gets hole card ['DK', 'C8'], current stack 970
player [Ethan] gets hole card ['C4', 'D3'], current stack 1020
player [SichengZuo] gets hole card ['HK', 'DQ'], current stack 965
player [KLChen2PokerPlayer] gets hole card ['CK', 'SA'], current stack 972
player [Jinkun] gets hole card ['C7', 'D8'], current stack 1035
player [NitWinWin] gets hole card ['CA', 'S4'], current stack 960
player [ZPlayer] gets hole card ['S8', 'S5'], current stack 2063
Started the round 19
Street "preflop" started. (community card = [])
"ZPlayer" declared "raise:15"
"YangZ" declared "fold:0"
"Ethan" declared "fold:0"
"SichengZuo" declared "fold:0"
"KLChen2PokerPlayer" declared "raise:20"
"Jinkun" declared "fold:20"
"NitWinWin" declared "fold:0"
"ZPlayer" declared "call:20"
Street "flop" started. (community card = ['HJ', 'C2', 'D2'])
"ZPlayer" declared "call:0"
"KLChen2PokerPlayer" declared "raise:11"
"ZPlayer" declared "fold:0"
"['KLChen2PokerPlayer']" won the round 19 (stack = {'YangZ': 970, 'Ethan': 1020, 'HakulaPlayer': 0, 'SichengZuo': 965, 'KLChen2PokerPlayer': 1007, 'Jinkun': 1035, 'NitWinWin': 960, 'ZPlayer': 2043})
player [YangZ] gets hole card ['D6', 'C2'], current stack 970
player [Ethan] gets hole card ['DT', 'HJ'], current stack 1020
player [SichengZuo] gets hole card ['SJ', 'S6'], current stack 965
player [KLChen2PokerPlayer] gets hole card ['H2', 'H8'], current stack 1007
player [Jinkun] gets hole card ['D4', 'CT'], current stack 1035
player [NitWinWin] gets hole card ['DA', 'C5'], current stack 955
player [ZPlayer] gets hole card ['C8', 'D9'], current stack 2033
Started the round 20
Street "preflop" started. (community card = [])
"YangZ" declared "fold:0"
"Ethan" declared "call:10"
"SichengZuo" declared "fold:0"
"KLChen2PokerPlayer" declared "call:10"
"Jinkun" declared "fold:10"
"NitWinWin" declared "fold:0"
"ZPlayer" declared "raise:15"
"Ethan" declared "raise:61"
"KLChen2PokerPlayer" declared "fold:0"
"ZPlayer" declared "call:61"
Street "flop" started. (community card = ['S5', 'D5', 'C3'])
"ZPlayer" declared "call:0"
"Ethan" declared "call:0"
Street "turn" started. (community card = ['S5', 'D5', 'C3', 'HK'])
"ZPlayer" declared "call:0"
"Ethan" declared "call:0"
Street "river" started. (community card = ['S5', 'D5', 'C3', 'HK', 'H7'])
"ZPlayer" declared "call:0"
"Ethan" declared "call:0"
"['Ethan']" won the round 20 (stack = {'YangZ': 970, 'Ethan': 1096, 'HakulaPlayer': 0, 'SichengZuo': 965, 'KLChen2PokerPlayer': 997, 'Jinkun': 1035, 'NitWinWin': 955, 'ZPlayer': 1982})
player [YangZ] gets hole card ['H3', 'H2'], current stack 960
player [Ethan] gets hole card ['D9', 'CK'], current stack 1096
player [SichengZuo] gets hole card ['D4', 'D5'], current stack 965
player [KLChen2PokerPlayer] gets hole card ['D6', 'D7'], current stack 997
player [Jinkun] gets hole card ['H4', 'H8'], current stack 1035
player [NitWinWin] gets hole card ['S5', 'S7'], current stack 955
player [ZPlayer] gets hole card ['D8', 'S6'], current stack 1977
Started the round 21
Street "preflop" started. (community card = [])
"Ethan" declared "fold:0"
"SichengZuo" declared "fold:0"
"KLChen2PokerPlayer" declared "call:10"
"Jinkun" declared "fold:10"
"NitWinWin" declared "fold:0"
"ZPlayer" declared "raise:15"
"YangZ" declared "fold:0"
"KLChen2PokerPlayer" declared "fold:0"
"['ZPlayer']" won the round 21 (stack = {'YangZ': 960, 'Ethan': 1096, 'HakulaPlayer': 0, 'SichengZuo': 965, 'KLChen2PokerPlayer': 987, 'Jinkun': 1035, 'NitWinWin': 955, 'ZPlayer': 2002})
player [YangZ] gets hole card ['D5', 'DQ'], current stack 955
player [Ethan] gets hole card ['D3', 'SK'], current stack 1086
player [SichengZuo] gets hole card ['D7', 'S7'], current stack 965
player [KLChen2PokerPlayer] gets hole card ['C4', 'CA'], current stack 987
player [Jinkun] gets hole card ['H5', 'CJ'], current stack 1035
player [NitWinWin] gets hole card ['S2', 'SA'], current stack 955
player [ZPlayer] gets hole card ['S5', 'H4'], current stack 2002
Started the round 22
Street "preflop" started. (community card = [])
"SichengZuo" declared "fold:0"
"KLChen2PokerPlayer" declared "raise:19"
"Jinkun" declared "fold:19"
"NitWinWin" declared "fold:0"
"ZPlayer" declared "raise:28"
"YangZ" declared "fold:0"
"Ethan" declared "fold:0"
"KLChen2PokerPlayer" declared "fold:0"
"['ZPlayer']" won the round 22 (stack = {'YangZ': 955, 'Ethan': 1086, 'HakulaPlayer': 0, 'SichengZuo': 965, 'KLChen2PokerPlayer': 968, 'Jinkun': 1035, 'NitWinWin': 955, 'ZPlayer': 2036})
player [YangZ] gets hole card ['DT', 'C5'], current stack 955
player [Ethan] gets hole card ['SJ', 'D8'], current stack 1081
player [SichengZuo] gets hole card ['SQ', 'DA'], current stack 955
player [KLChen2PokerPlayer] gets hole card ['SK', 'D7'], current stack 968
player [Jinkun] gets hole card ['C3', 'CJ'], current stack 1035
player [NitWinWin] gets hole card ['C6', 'S7'], current stack 955
player [ZPlayer] gets hole card ['HJ', 'D5'], current stack 2036
Started the round 23
Street "preflop" started. (community card = [])
"KLChen2PokerPlayer" declared "raise:15"
"Jinkun" declared "fold:15"
"NitWinWin" declared "fold:0"
"ZPlayer" declared "raise:20"
"YangZ" declared "fold:0"
"Ethan" declared "fold:0"
"SichengZuo" declared "fold:0"
"KLChen2PokerPlayer" declared "fold:0"
"['ZPlayer']" won the round 23 (stack = {'YangZ': 955, 'Ethan': 1081, 'HakulaPlayer': 0, 'SichengZuo': 955, 'KLChen2PokerPlayer': 953, 'Jinkun': 1035, 'NitWinWin': 955, 'ZPlayer': 2066})
player [YangZ] gets hole card ['S6', 'HA'], current stack 955
player [Ethan] gets hole card ['H5', 'H4'], current stack 1081
player [SichengZuo] gets hole card ['C2', 'DJ'], current stack 950
player [KLChen2PokerPlayer] gets hole card ['SA', 'D6'], current stack 943
player [Jinkun] gets hole card ['S3', 'D5'], current stack 1035
player [NitWinWin] gets hole card ['DA', 'D9'], current stack 955
player [ZPlayer] gets hole card ['HK', 'C6'], current stack 2066
Started the round 24
Street "preflop" started. (community card = [])
"Jinkun" declared "fold:10"
"NitWinWin" declared "fold:0"
"ZPlayer" declared "raise:15"
"YangZ" declared "fold:0"
"Ethan" declared "fold:0"
"SichengZuo" declared "fold:0"
"KLChen2PokerPlayer" declared "raise:20"
"ZPlayer" declared "call:20"
Street "flop" started. (community card = ['H3', 'C3', 'CA'])
"KLChen2PokerPlayer" declared "raise:23"
"ZPlayer" declared "fold:0"
"['KLChen2PokerPlayer']" won the round 24 (stack = {'YangZ': 955, 'Ethan': 1081, 'HakulaPlayer': 0, 'SichengZuo': 950, 'KLChen2PokerPlayer': 978, 'Jinkun': 1035, 'NitWinWin': 955, 'ZPlayer': 2046})
player [YangZ] gets hole card ['C2', 'SJ'], current stack 955
player [Ethan] gets hole card ['H9', 'HT'], current stack 1081
player [SichengZuo] gets hole card ['S9', 'CA'], current stack 950
player [KLChen2PokerPlayer] gets hole card ['H6', 'S6'], current stack 973
player [Jinkun] gets hole card ['D8', 'HA'], current stack 1025
player [NitWinWin] gets hole card ['HK', 'H8'], current stack 955
player [ZPlayer] gets hole card ['H4', 'DT'], current stack 2046
Started the round 25
Street "preflop" started. (community card = [])
"NitWinWin" declared "fold:0"
"ZPlayer" declared "raise:15"
"YangZ" declared "fold:0"
"Ethan" declared "fold:0"
"SichengZuo" declared "fold:0"
"KLChen2PokerPlayer" declared "raise:20"
"Jinkun" declared "call:20"
"ZPlayer" declared "fold:0"
Street "flop" started. (community card = ['C3', 'C7', 'DJ'])
"KLChen2PokerPlayer" declared "raise:12"
"Jinkun" declared "call:12"
Street "turn" started. (community card = ['C3', 'C7', 'DJ', 'S7'])
"KLChen2PokerPlayer" declared "raise:99"
"Jinkun" declared "call:99"
Street "river" started. (community card = ['C3', 'C7', 'DJ', 'S7', 'S2'])
"KLChen2PokerPlayer" declared "raise:155"
"Jinkun" declared "call:155"
"['KLChen2PokerPlayer']" won the round 25 (stack = {'YangZ': 955, 'Ethan': 1081, 'HakulaPlayer': 0, 'SichengZuo': 950, 'KLChen2PokerPlayer': 1279, 'Jinkun': 749, 'NitWinWin': 955, 'ZPlayer': 2031})
player [YangZ] gets hole card ['HJ', 'C9'], current stack 955
player [Ethan] gets hole card ['S5', 'C6'], current stack 1081
player [SichengZuo] gets hole card ['SQ', 'S7'], current stack 950
player [KLChen2PokerPlayer] gets hole card ['SA', 'D4'], current stack 1279
player [Jinkun] gets hole card ['H4', 'H6'], current stack 744
player [NitWinWin] gets hole card ['CJ', 'DQ'], current stack 945
player [ZPlayer] gets hole card ['H8', 'S2'], current stack 2031
Started the round 26
Street "preflop" started. (community card = [])
"ZPlayer" declared "raise:15"
"YangZ" declared "fold:0"
"Ethan" declared "fold:0"
"SichengZuo" declared "fold:0"
"KLChen2PokerPlayer" declared "raise:20"
"Jinkun" declared "fold:20"
"NitWinWin" declared "fold:0"
"ZPlayer" declared "fold:0"
"['KLChen2PokerPlayer']" won the round 26 (stack = {'YangZ': 955, 'Ethan': 1081, 'HakulaPlayer': 0, 'SichengZuo': 950, 'KLChen2PokerPlayer': 1309, 'Jinkun': 744, 'NitWinWin': 945, 'ZPlayer': 2016})
player [YangZ] gets hole card ['C6', 'SA'], current stack 955
player [Ethan] gets hole card ['S7', 'H8'], current stack 1081
player [SichengZuo] gets hole card ['HK', 'C2'], current stack 950
player [KLChen2PokerPlayer] gets hole card ['CJ', 'DQ'], current stack 1309
player [Jinkun] gets hole card ['C5', 'CQ'], current stack 744
player [NitWinWin] gets hole card ['SK', 'S4'], current stack 940
player [ZPlayer] gets hole card ['DA', 'HT'], current stack 2006
Started the round 27
Street "preflop" started. (community card = [])
"YangZ" declared "fold:0"
"Ethan" declared "fold:0"
"SichengZuo" declared "fold:0"
"KLChen2PokerPlayer" declared "raise:16"
"Jinkun" declared "fold:16"
"NitWinWin" declared "fold:0"
"ZPlayer" declared "call:16"
Street "flop" started. (community card = ['HJ', 'D2', 'ST'])
"ZPlayer" declared "raise:18"
"KLChen2PokerPlayer" declared "raise:36"
"ZPlayer" declared "call:36"
Street "turn" started. (community card = ['HJ', 'D2', 'ST', 'H7'])
"ZPlayer" declared "raise:10"
"KLChen2PokerPlayer" declared "raise:346"
"ZPlayer" declared "fold:0"
"['KLChen2PokerPlayer']" won the round 27 (stack = {'YangZ': 955, 'Ethan': 1081, 'HakulaPlayer': 0, 'SichengZuo': 950, 'KLChen2PokerPlayer': 1376, 'Jinkun': 744, 'NitWinWin': 940, 'ZPlayer': 1954})
player [YangZ] gets hole card ['C9', 'C3'], current stack 945
player [Ethan] gets hole card ['ST', 'HT'], current stack 1081
player [SichengZuo] gets hole card ['CQ', 'H2'], current stack 950
player [KLChen2PokerPlayer] gets hole card ['C4', 'D7'], current stack 1376
player [Jinkun] gets hole card ['H6', 'DA'], current stack 744
player [NitWinWin] gets hole card ['S7', 'H3'], current stack 940
player [ZPlayer] gets hole card ['HJ', 'HQ'], current stack 1949
Started the round 28
Street "preflop" started. (community card = [])
"Ethan" declared "raise:162"
"SichengZuo" declared "fold:0"
"KLChen2PokerPlayer" declared "fold:0"
"Jinkun" declared "fold:162"
"NitWinWin" declared "fold:0"
"ZPlayer" declared "fold:0"
"YangZ" declared "fold:0"
"['Ethan']" won the round 28 (stack = {'YangZ': 945, 'Ethan': 1096, 'HakulaPlayer': 0, 'SichengZuo': 950, 'KLChen2PokerPlayer': 1376, 'Jinkun': 744, 'NitWinWin': 940, 'ZPlayer': 1949})
player [YangZ] gets hole card ['H7', 'DA'], current stack 940
player [Ethan] gets hole card ['CA', 'S4'], current stack 1086
player [SichengZuo] gets hole card ['H3', 'HT'], current stack 950
player [KLChen2PokerPlayer] gets hole card ['C7', 'S5'], current stack 1376
player [Jinkun] gets hole card ['HK', 'C9'], current stack 744
player [NitWinWin] gets hole card ['DJ', 'D5'], current stack 940
player [ZPlayer] gets hole card ['S6', 'D4'], current stack 1949
Started the round 29
Street "preflop" started. (community card = [])
"SichengZuo" declared "fold:0"
"KLChen2PokerPlayer" declared "fold:0"
"Jinkun" declared "fold:10"
"NitWinWin" declared "fold:0"
"ZPlayer" declared "raise:15"
"YangZ" declared "fold:0"
"Ethan" declared "call:15"
Street "flop" started. (community card = ['ST', 'CT', 'HQ'])
"Ethan" declared "call:0"
"ZPlayer" declared "call:0"
Street "turn" started. (community card = ['ST', 'CT', 'HQ', 'CQ'])
"Ethan" declared "call:0"
"ZPlayer" declared "call:0"
Street "river" started. (community card = ['ST', 'CT', 'HQ', 'CQ', 'H9'])
"Ethan" declared "call:0"
"ZPlayer" declared "call:0"
"['Ethan']" won the round 29 (stack = {'YangZ': 940, 'Ethan': 1116, 'HakulaPlayer': 0, 'SichengZuo': 950, 'KLChen2PokerPlayer': 1376, 'Jinkun': 744, 'NitWinWin': 940, 'ZPlayer': 1934})
player [YangZ] gets hole card ['D2', 'D6'], current stack 940
player [Ethan] gets hole card ['CJ', 'SQ'], current stack 1111
player [SichengZuo] gets hole card ['C8', 'SJ'], current stack 940
player [KLChen2PokerPlayer] gets hole card ['H9', 'S9'], current stack 1376
player [Jinkun] gets hole card ['S6', 'HK'], current stack 744
player [NitWinWin] gets hole card ['C7', 'C2'], current stack 940
player [ZPlayer] gets hole card ['HT', 'CK'], current stack 1934
Started the round 30
Street "preflop" started. (community card = [])
"KLChen2PokerPlayer" declared "raise:19"
"Jinkun" declared "fold:19"
"NitWinWin" declared "fold:0"
"ZPlayer" declared "raise:28"
"YangZ" declared "fold:0"
"Ethan" declared "raise:167"
"SichengZuo" declared "fold:0"
"KLChen2PokerPlayer" declared "fold:0"
"ZPlayer" declared "call:167"
Street "flop" started. (community card = ['DA', 'S5', 'DJ'])
"Ethan" declared "call:0"
"ZPlayer" declared "call:0"
Street "turn" started. (community card = ['DA', 'S5', 'DJ', 'H4'])
"Ethan" declared "raise:363"
"ZPlayer" declared "fold:0"
"['Ethan']" won the round 30 (stack = {'YangZ': 940, 'Ethan': 1312, 'HakulaPlayer': 0, 'SichengZuo': 940, 'KLChen2PokerPlayer': 1357, 'Jinkun': 744, 'NitWinWin': 940, 'ZPlayer': 1767})
player [YangZ] gets hole card ['ST', 'D2'], current stack 940
player [Ethan] gets hole card ['S2', 'D8'], current stack 1312
player [SichengZuo] gets hole card ['DT', 'H6'], current stack 935
player [KLChen2PokerPlayer] gets hole card ['CJ', 'C7'], current stack 1347
player [Jinkun] gets hole card ['SJ', 'C9'], current stack 744
player [NitWinWin] gets hole card ['D5', 'C2'], current stack 940
player [ZPlayer] gets hole card ['H8', 'H4'], current stack 1767
Started the round 31
Street "preflop" started. (community card = [])
"Jinkun" declared "fold:10"
"NitWinWin" declared "fold:0"
"ZPlayer" declared "raise:15"
"YangZ" declared "fold:0"
"Ethan" declared "fold:0"
"SichengZuo" declared "fold:0"
"KLChen2PokerPlayer" declared "fold:0"
"['ZPlayer']" won the round 31 (stack = {'YangZ': 940, 'Ethan': 1312, 'HakulaPlayer': 0, 'SichengZuo': 935, 'KLChen2PokerPlayer': 1347, 'Jinkun': 744, 'NitWinWin': 940, 'ZPlayer': 1782})
player [YangZ] gets hole card ['S5', 'D4'], current stack 940
player [Ethan] gets hole card ['HJ', 'SK'], current stack 1312
player [SichengZuo] gets hole card ['SJ', 'D5'], current stack 935
player [KLChen2PokerPlayer] gets hole card ['HA', 'S8'], current stack 1342
player [Jinkun] gets hole card ['H7', 'DJ'], current stack 734
player [NitWinWin] gets hole card ['S3', 'D9'], current stack 940
player [ZPlayer] gets hole card ['D3', 'CT'], current stack 1782
Started the round 32
Street "preflop" started. (community card = [])
"NitWinWin" declared "fold:0"
"ZPlayer" declared "raise:15"
"YangZ" declared "fold:0"
"Ethan" declared "raise:196"
"SichengZuo" declared "fold:0"
"KLChen2PokerPlayer" declared "fold:0"
"Jinkun" declared "fold:196"
"ZPlayer" declared "fold:0"
"['Ethan']" won the round 32 (stack = {'YangZ': 940, 'Ethan': 1342, 'HakulaPlayer': 0, 'SichengZuo': 935, 'KLChen2PokerPlayer': 1342, 'Jinkun': 734, 'NitWinWin': 940, 'ZPlayer': 1767})
player [YangZ] gets hole card ['HQ', 'DQ'], current stack 940
player [Ethan] gets hole card ['HA', 'S9'], current stack 1342
player [SichengZuo] gets hole card ['CJ', 'H7'], current stack 935
player [KLChen2PokerPlayer] gets hole card ['C3', 'S6'], current stack 1342
player [Jinkun] gets hole card ['C9', 'H3'], current stack 729
player [NitWinWin] gets hole card ['C4', 'DA'], current stack 930
player [ZPlayer] gets hole card ['HT', 'H4'], current stack 1767
Started the round 33
Street "preflop" started. (community card = [])
"ZPlayer" declared "raise:15"
"YangZ" declared "fold:0"
"Ethan" declared "fold:0"
"SichengZuo" declared "fold:0"
"KLChen2PokerPlayer" declared "fold:0"
"Jinkun" declared "fold:15"
"NitWinWin" declared "fold:0"
"['ZPlayer']" won the round 33 (stack = {'YangZ': 940, 'Ethan': 1342, 'HakulaPlayer': 0, 'SichengZuo': 935, 'KLChen2PokerPlayer': 1342, 'Jinkun': 729, 'NitWinWin': 930, 'ZPlayer': 1782})
player [YangZ] gets hole card ['SA', 'S2'], current stack 940
player [Ethan] gets hole card ['H3', 'C3'], current stack 1342
player [SichengZuo] gets hole card ['D4', 'C2'], current stack 935
player [KLChen2PokerPlayer] gets hole card ['S7', 'D7'], current stack 1342
player [Jinkun] gets hole card ['H9', 'CQ'], current stack 729
player [NitWinWin] gets hole card ['HJ', 'S6'], current stack 925
player [ZPlayer] gets hole card ['D9', 'H7'], current stack 1772
Started the round 34
Street "preflop" started. (community card = [])
"YangZ" declared "fold:0"
"Ethan" declared "fold:0"
"SichengZuo" declared "fold:0"
"KLChen2PokerPlayer" declared "raise:15"
"Jinkun" declared "fold:15"
"NitWinWin" declared "fold:0"
"ZPlayer" declared "call:15"
Street "flop" started. (community card = ['H8', 'S3', 'DQ'])
"ZPlayer" declared "call:0"
"KLChen2PokerPlayer" declared "raise:11"
"ZPlayer" declared "fold:0"
"['KLChen2PokerPlayer']" won the round 34 (stack = {'YangZ': 940, 'Ethan': 1342, 'HakulaPlayer': 0, 'SichengZuo': 935, 'KLChen2PokerPlayer': 1362, 'Jinkun': 729, 'NitWinWin': 925, 'ZPlayer': 1767})
player [YangZ] gets hole card ['SQ', 'H8'], current stack 930
player [Ethan] gets hole card ['HA', 'C2'], current stack 1342
player [SichengZuo] gets hole card ['SA', 'HQ'], current stack 935
player [KLChen2PokerPlayer] gets hole card ['D9', 'H9'], current stack 1362
player [Jinkun] gets hole card ['DT', 'DA'], current stack 729
player [NitWinWin] gets hole card ['D7', 'HT'], current stack 925
player [ZPlayer] gets hole card ['SK', 'C5'], current stack 1762
Started the round 35
Street "preflop" started. (community card = [])
"Ethan" declared "fold:0"
"SichengZuo" declared "fold:0"
"KLChen2PokerPlayer" declared "raise:16"
"Jinkun" declared "fold:16"
"NitWinWin" declared "fold:0"
"ZPlayer" declared "fold:0"
"YangZ" declared "fold:0"
"['KLChen2PokerPlayer']" won the round 35 (stack = {'YangZ': 930, 'Ethan': 1342, 'HakulaPlayer': 0, 'SichengZuo': 935, 'KLChen2PokerPlayer': 1377, 'Jinkun': 729, 'NitWinWin': 925, 'ZPlayer': 1762})
player [YangZ] gets hole card ['S3', 'C7'], current stack 925
player [Ethan] gets hole card ['D2', 'DA'], current stack 1332
player [SichengZuo] gets hole card ['C2', 'SK'], current stack 935
player [KLChen2PokerPlayer] gets hole card ['CQ', 'S4'], current stack 1377
player [Jinkun] gets hole card ['SQ', 'D8'], current stack 729
player [NitWinWin] gets hole card ['DJ', 'S6'], current stack 925
player [ZPlayer] gets hole card ['C4', 'SJ'], current stack 1762
Started the round 36
Street "preflop" started. (community card = [])
"SichengZuo" declared "fold:0"
"KLChen2PokerPlayer" declared "fold:0"
"Jinkun" declared "fold:10"
"NitWinWin" declared "fold:0"
"ZPlayer" declared "raise:15"
"YangZ" declared "fold:0"
"Ethan" declared "call:15"
Street "flop" started. (community card = ['H3', 'HK', 'H2'])
"Ethan" declared "call:0"
"ZPlayer" declared "call:0"
Street "turn" started. (community card = ['H3', 'HK', 'H2', 'H5'])
"Ethan" declared "raise:35"
"ZPlayer" declared "fold:0"
"['Ethan']" won the round 36 (stack = {'YangZ': 925, 'Ethan': 1362, 'HakulaPlayer': 0, 'SichengZuo': 935, 'KLChen2PokerPlayer': 1377, 'Jinkun': 729, 'NitWinWin': 925, 'ZPlayer': 1747})
player [YangZ] gets hole card ['HT', 'H6'], current stack 925
player [Ethan] gets hole card ['S6', 'HA'], current stack 1357
player [SichengZuo] gets hole card ['D8', 'H4'], current stack 925
player [KLChen2PokerPlayer] gets hole card ['CJ', 'C7'], current stack 1377
player [Jinkun] gets hole card ['SJ', 'CQ'], current stack 729
player [NitWinWin] gets hole card ['S5', 'D2'], current stack 925
player [ZPlayer] gets hole card ['C8', 'H8'], current stack 1747
Started the round 37
Street "preflop" started. (community card = [])
"KLChen2PokerPlayer" declared "raise:15"
"Jinkun" declared "fold:15"
"NitWinWin" declared "fold:0"
"ZPlayer" declared "raise:20"
"YangZ" declared "fold:0"
"Ethan" declared "fold:0"
"SichengZuo" declared "fold:0"
"KLChen2PokerPlayer" declared "call:20"
Street "flop" started. (community card = ['H2', 'C6', 'H3'])
"KLChen2PokerPlayer" declared "call:0"
"ZPlayer" declared "raise:10"
"KLChen2PokerPlayer" declared "fold:0"
"['ZPlayer']" won the round 37 (stack = {'YangZ': 925, 'Ethan': 1357, 'HakulaPlayer': 0, 'SichengZuo': 925, 'KLChen2PokerPlayer': 1357, 'Jinkun': 729, 'NitWinWin': 925, 'ZPlayer': 1782})
player [YangZ] gets hole card ['CQ', 'H3'], current stack 925
player [Ethan] gets hole card ['HQ', 'C7'], current stack 1357
player [SichengZuo] gets hole card ['S3', 'H9'], current stack 920
player [KLChen2PokerPlayer] gets hole card ['D2', 'H6'], current stack 1347
player [Jinkun] gets hole card ['C3', 'ST'], current stack 729
player [NitWinWin] gets hole card ['D5', 'H8'], current stack 925
player [ZPlayer] gets hole card ['D7', 'SQ'], current stack 1782
Started the round 38
Street "preflop" started. (community card = [])
"Jinkun" declared "fold:10"
"NitWinWin" declared "fold:0"
"ZPlayer" declared "raise:15"
"YangZ" declared "fold:0"
"Ethan" declared "fold:0"
"SichengZuo" declared "fold:0"
"KLChen2PokerPlayer" declared "fold:0"
"['ZPlayer']" won the round 38 (stack = {'YangZ': 925, 'Ethan': 1357, 'HakulaPlayer': 0, 'SichengZuo': 920, 'KLChen2PokerPlayer': 1347, 'Jinkun': 729, 'NitWinWin': 925, 'ZPlayer': 1797})
player [YangZ] gets hole card ['D3', 'CQ'], current stack 925
player [Ethan] gets hole card ['D4', 'S6'], current stack 1357
player [SichengZuo] gets hole card ['HK', 'H3'], current stack 920
player [KLChen2PokerPlayer] gets hole card ['S7', 'CK'], current stack 1342
player [Jinkun] gets hole card ['DQ', 'H2'], current stack 719
player [NitWinWin] gets hole card ['SQ', 'H9'], current stack 925
player [ZPlayer] gets hole card ['C6', 'H7'], current stack 1797
Started the round 39
Street "preflop" started. (community card = [])
"NitWinWin" declared "fold:0"
"ZPlayer" declared "raise:15"
"YangZ" declared "fold:0"
"Ethan" declared "fold:0"
"SichengZuo" declared "fold:0"
"KLChen2PokerPlayer" declared "raise:20"
"Jinkun" declared "fold:20"
"ZPlayer" declared "call:20"
Street "flop" started. (community card = ['S2', 'SA', 'C7'])
"KLChen2PokerPlayer" declared "raise:29"
"ZPlayer" declared "call:29"
Street "turn" started. (community card = ['S2', 'SA', 'C7', 'DA'])
"KLChen2PokerPlayer" declared "raise:413"
"ZPlayer" declared "fold:0"
"['KLChen2PokerPlayer']" won the round 39 (stack = {'YangZ': 925, 'Ethan': 1357, 'HakulaPlayer': 0, 'SichengZuo': 920, 'KLChen2PokerPlayer': 1406, 'Jinkun': 719, 'NitWinWin': 925, 'ZPlayer': 1748})
player [YangZ] gets hole card ['D3', 'HQ'], current stack 925
player [Ethan] gets hole card ['CT', 'DA'], current stack 1357
player [SichengZuo] gets hole card ['S2', 'SQ'], current stack 920
player [KLChen2PokerPlayer] gets hole card ['H2', 'S4'], current stack 1406
player [Jinkun] gets hole card ['D9', 'C2'], current stack 714
player [NitWinWin] gets hole card ['S8', 'SK'], current stack 915
player [ZPlayer] gets hole card ['DQ', 'CK'], current stack 1748
Started the round 40
Street "preflop" started. (community card = [])
"ZPlayer" declared "raise:15"
"YangZ" declared "fold:0"
"Ethan" declared "call:15"
"SichengZuo" declared "fold:0"
"KLChen2PokerPlayer" declared "fold:0"
"Jinkun" declared "fold:15"
"NitWinWin" declared "fold:0"
Street "flop" started. (community card = ['H7', 'D2', 'SJ'])
"ZPlayer" declared "call:0"
"Ethan" declared "call:0"
Street "turn" started. (community card = ['H7', 'D2', 'SJ', 'HT'])
"ZPlayer" declared "call:0"
"Ethan" declared "call:0"
Street "river" started. (community card = ['H7', 'D2', 'SJ', 'HT', 'HK'])
"ZPlayer" declared "raise:10"
"Ethan" declared "call:10"
"['ZPlayer']" won the round 40 (stack = {'YangZ': 925, 'Ethan': 1332, 'HakulaPlayer': 0, 'SichengZuo': 920, 'KLChen2PokerPlayer': 1406, 'Jinkun': 714, 'NitWinWin': 915, 'ZPlayer': 1788})
player [YangZ] gets hole card ['D8', 'H5'], current stack 925
player [Ethan] gets hole card ['S4', 'H7'], current stack 1332
player [SichengZuo] gets hole card ['S9', 'HQ'], current stack 920
player [KLChen2PokerPlayer] gets hole card ['S3', 'CT'], current stack 1406
player [Jinkun] gets hole card ['H4', 'C2'], current stack 714
player [NitWinWin] gets hole card ['C7', 'DT'], current stack 910
player [ZPlayer] gets hole card ['DA', 'H2'], current stack 1778
Started the round 41
Street "preflop" started. (community card = [])
"YangZ" declared "fold:0"
"Ethan" declared "fold:0"
"SichengZuo" declared "fold:0"
"KLChen2PokerPlayer" declared "fold:0"
"Jinkun" declared "call:10"
"NitWinWin" declared "fold:0"
"ZPlayer" declared "raise:15"
"Jinkun" declared "fold:15"
"['ZPlayer']" won the round 41 (stack = {'YangZ': 925, 'Ethan': 1332, 'HakulaPlayer': 0, 'SichengZuo': 920, 'KLChen2PokerPlayer': 1406, 'Jinkun': 704, 'NitWinWin': 910, 'ZPlayer': 1803})
player [YangZ] gets hole card ['D4', 'HK'], current stack 915
player [Ethan] gets hole card ['S2', 'C7'], current stack 1332
player [SichengZuo] gets hole card ['ST', 'SA'], current stack 920
player [KLChen2PokerPlayer] gets hole card ['D8', 'S7'], current stack 1406
player [Jinkun] gets hole card ['S9', 'HQ'], current stack 704
player [NitWinWin] gets hole card ['DQ', 'CK'], current stack 910
player [ZPlayer] gets hole card ['S8', 'C8'], current stack 1798
Started the round 42
Street "preflop" started. (community card = [])
"Ethan" declared "fold:0"
"SichengZuo" declared "fold:0"
"KLChen2PokerPlayer" declared "fold:0"
"Jinkun" declared "call:10"
"NitWinWin" declared "fold:0"
"ZPlayer" declared "raise:15"
"YangZ" declared "fold:0"
"Jinkun" declared "call:15"
Street "flop" started. (community card = ['C6', 'CJ', 'H6'])
"ZPlayer" declared "raise:10"
"Jinkun" declared "call:10"
Street "turn" started. (community card = ['C6', 'CJ', 'H6', 'C5'])
"ZPlayer" declared "raise:10"
"Jinkun" declared "call:10"
Street "river" started. (community card = ['C6', 'CJ', 'H6', 'C5', 'SK'])
"ZPlayer" declared "call:0"
"Jinkun" declared "call:0"
"['ZPlayer']" won the round 42 (stack = {'YangZ': 915, 'Ethan': 1332, 'HakulaPlayer': 0, 'SichengZuo': 920, 'KLChen2PokerPlayer': 1406, 'Jinkun': 669, 'NitWinWin': 910, 'ZPlayer': 1848})
player [YangZ] gets hole card ['CT', 'C2'], current stack 910
player [Ethan] gets hole card ['CA', 'C9'], current stack 1322
player [SichengZuo] gets hole card ['CQ', 'C6'], current stack 920
player [KLChen2PokerPlayer] gets hole card ['C8', 'DA'], current stack 1406
player [Jinkun] gets hole card ['D2', 'H6'], current stack 669
player [NitWinWin] gets hole card ['DJ', 'H3'], current stack 910
player [ZPlayer] gets hole card ['CJ', 'D5'], current stack 1848
Started the round 43
Street "preflop" started. (community card = [])
"SichengZuo" declared "fold:0"
"KLChen2PokerPlayer" declared "raise:16"
"Jinkun" declared "fold:16"
"NitWinWin" declared "fold:0"
"ZPlayer" declared "raise:22"
"YangZ" declared "fold:0"
"Ethan" declared "call:22"
"KLChen2PokerPlayer" declared "fold:0"
Street "flop" started. (community card = ['S3', 'DT', 'C4'])
"Ethan" declared "call:0"
"ZPlayer" declared "call:0"
Street "turn" started. (community card = ['S3', 'DT', 'C4', 'D9'])
"Ethan" declared "call:0"
"ZPlayer" declared "call:0"
Street "river" started. (community card = ['S3', 'DT', 'C4', 'D9', 'C7'])
"Ethan" declared "call:0"
"ZPlayer" declared "call:0"
"['Ethan']" won the round 43 (stack = {'YangZ': 910, 'Ethan': 1375, 'HakulaPlayer': 0, 'SichengZuo': 920, 'KLChen2PokerPlayer': 1390, 'Jinkun': 669, 'NitWinWin': 910, 'ZPlayer': 1826})
player [YangZ] gets hole card ['CK', 'D3'], current stack 910
player [Ethan] gets hole card ['HA', 'S6'], current stack 1370
player [SichengZuo] gets hole card ['DA', 'H8'], current stack 910
player [KLChen2PokerPlayer] gets hole card ['CT', 'D2'], current stack 1390
player [Jinkun] gets hole card ['D4', 'S5'], current stack 669
player [NitWinWin] gets hole card ['HJ', 'DK'], current stack 910
player [ZPlayer] gets hole card ['H6', 'S3'], current stack 1826
Started the round 44
Street "preflop" started. (community card = [])
"KLChen2PokerPlayer" declared "call:10"
"Jinkun" declared "fold:10"
"NitWinWin" declared "fold:0"
"ZPlayer" declared "raise:15"
"YangZ" declared "fold:0"
"Ethan" declared "fold:0"
"SichengZuo" declared "fold:0"
"KLChen2PokerPlayer" declared "fold:0"
"['ZPlayer']" won the round 44 (stack = {'YangZ': 910, 'Ethan': 1370, 'HakulaPlayer': 0, 'SichengZuo': 910, 'KLChen2PokerPlayer': 1380, 'Jinkun': 669, 'NitWinWin': 910, 'ZPlayer': 1851})
player [YangZ] gets hole card ['C3', 'S5'], current stack 910
player [Ethan] gets hole card ['SQ', 'HJ'], current stack 1370
player [SichengZuo] gets hole card ['D5', 'DQ'], current stack 905
player [KLChen2PokerPlayer] gets hole card ['DT', 'CQ'], current stack 1370
player [Jinkun] gets hole card ['D6', 'S3'], current stack 669
player [NitWinWin] gets hole card ['CA', 'SK'], current stack 910
player [ZPlayer] gets hole card ['H9', 'DA'], current stack 1851
Started the round 45
Street "preflop" started. (community card = [])
"Jinkun" declared "fold:10"
"NitWinWin" declared "fold:0"
"ZPlayer" declared "raise:15"
"YangZ" declared "fold:0"
"Ethan" declared "raise:205"
"SichengZuo" declared "fold:0"
"KLChen2PokerPlayer" declared "fold:0"
"ZPlayer" declared "fold:0"
"['Ethan']" won the round 45 (stack = {'YangZ': 910, 'Ethan': 1400, 'HakulaPlayer': 0, 'SichengZuo': 905, 'KLChen2PokerPlayer': 1370, 'Jinkun': 669, 'NitWinWin': 910, 'ZPlayer': 1836})
player [YangZ] gets hole card ['HK', 'D7'], current stack 910
player [Ethan] gets hole card ['D5', 'DJ'], current stack 1400
player [SichengZuo] gets hole card ['H5', 'D3'], current stack 905
player [KLChen2PokerPlayer] gets hole card ['D9', 'S6'], current stack 1365
player [Jinkun] gets hole card ['SQ', 'C5'], current stack 659
player [NitWinWin] gets hole card ['S2', 'ST'], current stack 910
player [ZPlayer] gets hole card ['DA', 'DQ'], current stack 1836
Started the round 46
Street "preflop" started. (community card = [])
"NitWinWin" declared "fold:0"
"ZPlayer" declared "raise:15"
"YangZ" declared "fold:0"
"Ethan" declared "fold:0"
"SichengZuo" declared "fold:0"
"KLChen2PokerPlayer" declared "fold:0"
"Jinkun" declared "call:15"
Street "flop" started. (community card = ['SA', 'H8', 'CA'])
"Jinkun" declared "call:0"
"ZPlayer" declared "raise:35"
"Jinkun" declared "call:35"
Street "turn" started. (community card = ['SA', 'H8', 'CA', 'D4'])
"Jinkun" declared "call:0"
"ZPlayer" declared "raise:211"
"Jinkun" declared "fold:211"
"['ZPlayer']" won the round 46 (stack = {'YangZ': 910, 'Ethan': 1400, 'HakulaPlayer': 0, 'SichengZuo': 905, 'KLChen2PokerPlayer': 1365, 'Jinkun': 619, 'NitWinWin': 910, 'ZPlayer': 1891})
player [YangZ] gets hole card ['HQ', 'D2'], current stack 910
player [Ethan] gets hole card ['D9', 'HJ'], current stack 1400
player [SichengZuo] gets hole card ['DT', 'DJ'], current stack 905
player [KLChen2PokerPlayer] gets hole card ['H2', 'HT'], current stack 1365
player [Jinkun] gets hole card ['CJ', 'C4'], current stack 614
player [NitWinWin] gets hole card ['CT', 'SQ'], current stack 900
player [ZPlayer] gets hole card ['C7', 'S4'], current stack 1891
Started the round 47
Street "preflop" started. (community card = [])
"ZPlayer" declared "raise:15"
"YangZ" declared "fold:0"
"Ethan" declared "fold:0"
"SichengZuo" declared "fold:0"
"KLChen2PokerPlayer" declared "fold:0"
"Jinkun" declared "fold:15"
"NitWinWin" declared "fold:0"
"['ZPlayer']" won the round 47 (stack = {'YangZ': 910, 'Ethan': 1400, 'HakulaPlayer': 0, 'SichengZuo': 905, 'KLChen2PokerPlayer': 1365, 'Jinkun': 614, 'NitWinWin': 900, 'ZPlayer': 1906})
player [YangZ] gets hole card ['D7', 'C5'], current stack 910
player [Ethan] gets hole card ['S2', 'DT'], current stack 1400
player [SichengZuo] gets hole card ['SJ', 'D3'], current stack 905
player [KLChen2PokerPlayer] gets hole card ['SQ', 'DK'], current stack 1365
player [Jinkun] gets hole card ['S6', 'C6'], current stack 614
player [NitWinWin] gets hole card ['D2', 'H5'], current stack 895
player [ZPlayer] gets hole card ['H3', 'S5'], current stack 1896
Started the round 48
Street "preflop" started. (community card = [])
"YangZ" declared "fold:0"
"Ethan" declared "fold:0"
"SichengZuo" declared "fold:0"
"KLChen2PokerPlayer" declared "raise:15"
"Jinkun" declared "fold:15"
"NitWinWin" declared "fold:0"
"ZPlayer" declared "call:15"
Street "flop" started. (community card = ['CT', 'ST', 'C4'])
"ZPlayer" declared "call:0"
"KLChen2PokerPlayer" declared "raise:14"
"ZPlayer" declared "fold:0"
"['KLChen2PokerPlayer']" won the round 48 (stack = {'YangZ': 910, 'Ethan': 1400, 'HakulaPlayer': 0, 'SichengZuo': 905, 'KLChen2PokerPlayer': 1385, 'Jinkun': 614, 'NitWinWin': 895, 'ZPlayer': 1891})
player [YangZ] gets hole card ['H6', 'D2'], current stack 900
player [Ethan] gets hole card ['CA', 'H7'], current stack 1400
player [SichengZuo] gets hole card ['HQ', 'H8'], current stack 905
player [KLChen2PokerPlayer] gets hole card ['D9', 'S6'], current stack 1385
player [Jinkun] gets hole card ['D5', 'S9'], current stack 614
player [NitWinWin] gets hole card ['DJ', 'H9'], current stack 895
player [ZPlayer] gets hole card ['C8', 'C2'], current stack 1886
Started the round 49
Street "preflop" started. (community card = [])
"Ethan" declared "fold:0"
"SichengZuo" declared "fold:0"
"KLChen2PokerPlayer" declared "fold:0"
"Jinkun" declared "call:10"
"NitWinWin" declared "fold:0"
"ZPlayer" declared "raise:15"
"YangZ" declared "fold:0"
"Jinkun" declared "call:15"
Street "flop" started. (community card = ['S5', 'CQ', 'SJ'])
"ZPlayer" declared "call:0"
"Jinkun" declared "call:0"
Street "turn" started. (community card = ['S5', 'CQ', 'SJ', 'C6'])
"ZPlayer" declared "call:0"
"Jinkun" declared "call:0"
Street "river" started. (community card = ['S5', 'CQ', 'SJ', 'C6', 'CT'])
"ZPlayer" declared "raise:295"
"Jinkun" declared "fold:295"
"['ZPlayer']" won the round 49 (stack = {'YangZ': 900, 'Ethan': 1400, 'HakulaPlayer': 0, 'SichengZuo': 905, 'KLChen2PokerPlayer': 1385, 'Jinkun': 599, 'NitWinWin': 895, 'ZPlayer': 1916})
player [YangZ] gets hole card ['CT', 'S4'], current stack 895
player [Ethan] gets hole card ['S8', 'HQ'], current stack 1390
player [SichengZuo] gets hole card ['D9', 'C7'], current stack 905
player [KLChen2PokerPlayer] gets hole card ['C6', 'S7'], current stack 1385
player [Jinkun] gets hole card ['S9', 'D8'], current stack 599
player [NitWinWin] gets hole card ['DA', 'H8'], current stack 895
player [ZPlayer] gets hole card ['HT', 'C4'], current stack 1916
Started the round 50
Street "preflop" started. (community card = [])
"SichengZuo" declared "fold:0"
"KLChen2PokerPlayer" declared "fold:0"
"Jinkun" declared "fold:10"
"NitWinWin" declared "fold:0"
"ZPlayer" declared "raise:15"
"YangZ" declared "fold:0"
"Ethan" declared "call:15"
Street "flop" started. (community card = ['H4', 'S3', 'C8'])
"Ethan" declared "call:0"
"ZPlayer" declared "raise:10"
"Ethan" declared "call:10"
Street "turn" started. (community card = ['H4', 'S3', 'C8', 'D5'])
"Ethan" declared "call:0"
"ZPlayer" declared "call:0"
Street "river" started. (community card = ['H4', 'S3', 'C8', 'D5', 'D2'])
"Ethan" declared "call:0"
"ZPlayer" declared "call:0"
"['Ethan']" won the round 50 (stack = {'YangZ': 895, 'Ethan': 1430, 'HakulaPlayer': 0, 'SichengZuo': 905, 'KLChen2PokerPlayer': 1385, 'Jinkun': 599, 'NitWinWin': 895, 'ZPlayer': 1891})

Game Results:
------------------------------------------------------------
Game 1:
Winner: ZPlayer (stack: 1891)
All players' stacks:
  YangZ: 895
  Ethan: 1430
  HakulaPlayer: 0
  SichengZuo: 905
  KLChen2PokerPlayer: 1385
  Jinkun: 599
  NitWinWin: 895
  ZPlayer: 1891
------------------------------------------------------------
