player [ZPlayer] gets hole card ['D2', 'H3'], current stack 1000
player [NitWinWin] gets hole card ['DJ', 'DT'], current stack 995
player [Jinkun] gets hole card ['C6', 'ST'], current stack 990
player [YueShi] gets hole card ['D7', 'H6'], current stack 1000
player [JoyoPlayer] gets hole card ['S4', 'D3'], current stack 1000
player [ZifengFoldMan] gets hole card ['HJ', 'D5'], current stack 1000
player [EvanPlayer] gets hole card ['S3', 'D9'], current stack 1000
player [KLChen2PokerPlayer] gets hole card ['SK', 'CJ'], current stack 1000
Started the round 1
Street "preflop" started. (community card = [])
"YueShi" declared "fold:0"
"JoyoPlayer" declared "fold:0"
"ZifengFoldMan" declared "fold:0"
"EvanPlayer" declared "fold:10"
"KLChen2PokerPlayer" declared "raise:16"
"ZPlayer" declared "fold:0"
"NitWinWin" declared "fold:0"
"Jinkun" declared "raise:30"
"KLChen2PokerPlayer" declared "call:30"
Street "flop" started. (community card = ['S8', 'C4', 'C8'])
"Jinkun" declared "call:0"
"KLChen2PokerPlayer" declared "call:0"
Street "turn" started. (community card = ['S8', 'C4', 'C8', 'H5'])
"Jinkun" declared "raise:130"
"KLChen2PokerPlayer" declared "fold:0"
"['Jinkun']" won the round 1 (stack = {'ZPlayer': 1000, 'NitWinWin': 995, 'Jinkun': 1035, 'YueShi': 1000, 'JoyoPlayer': 1000, 'ZifengFoldMan': 1000, 'EvanPlayer': 1000, 'KLChen2PokerPlayer': 970})
player [ZPlayer] gets hole card ['SJ', 'S4'], current stack 1000
player [NitWinWin] gets hole card ['S8', 'SK'], current stack 995
player [Jinkun] gets hole card ['S9', 'H9'], current stack 1030
player [YueShi] gets hole card ['D9', 'CQ'], current stack 990
player [JoyoPlayer] gets hole card ['S7', 'D6'], current stack 1000
player [ZifengFoldMan] gets hole card ['H4', 'C9'], current stack 1000
player [EvanPlayer] gets hole card ['HJ', 'C5'], current stack 1000
player [KLChen2PokerPlayer] gets hole card ['C2', 'HQ'], current stack 970
Started the round 2
Street "preflop" started. (community card = [])
"JoyoPlayer" declared "fold:0"
"ZifengFoldMan" declared "fold:0"
"EvanPlayer" declared "call:10"
"KLChen2PokerPlayer" declared "fold:0"
"ZPlayer" declared "call:10"
"NitWinWin" declared "fold:0"
"Jinkun" declared "call:10"
"YueShi" declared "fold:0"
Street "flop" started. (community card = ['D4', 'DJ', 'H7'])
"Jinkun" declared "call:0"
"EvanPlayer" declared "call:0"
"ZPlayer" declared "raise:40"
"Jinkun" declared "fold:40"
"EvanPlayer" declared "call:40"
Street "turn" started. (community card = ['D4', 'DJ', 'H7', 'SQ'])
"EvanPlayer" declared "fold:0"
"['ZPlayer']" won the round 2 (stack = {'ZPlayer': 1070, 'NitWinWin': 995, 'Jinkun': 1025, 'YueShi': 990, 'JoyoPlayer': 1000, 'ZifengFoldMan': 1000, 'EvanPlayer': 950, 'KLChen2PokerPlayer': 970})
player [ZPlayer] gets hole card ['DJ', 'ST'], current stack 1070
player [NitWinWin] gets hole card ['DT', 'C8'], current stack 995
player [Jinkun] gets hole card ['HJ', 'S3'], current stack 1025
player [YueShi] gets hole card ['D7', 'H5'], current stack 985
player [JoyoPlayer] gets hole card ['D5', 'H8'], current stack 990
player [ZifengFoldMan] gets hole card ['C6', 'CT'], current stack 1000
player [EvanPlayer] gets hole card ['HA', 'S9'], current stack 950
player [KLChen2PokerPlayer] gets hole card ['H9', 'DK'], current stack 970
Started the round 3
Street "preflop" started. (community card = [])
"ZifengFoldMan" declared "fold:0"
"EvanPlayer" declared "raise:950"
"KLChen2PokerPlayer" declared "fold:0"
"ZPlayer" declared "fold:0"
"NitWinWin" declared "fold:0"
"Jinkun" declared "fold:950"
"YueShi" declared "fold:0"
"JoyoPlayer" declared "call:950"
Street "flop" started. (community card = ['SA', 'DA', 'HQ'])
Street "turn" started. (community card = ['SA', 'DA', 'HQ', 'HK'])
Street "river" started. (community card = ['SA', 'DA', 'HQ', 'HK', 'CJ'])
"['EvanPlayer']" won the round 3 (stack = {'ZPlayer': 1070, 'NitWinWin': 995, 'Jinkun': 1025, 'YueShi': 985, 'JoyoPlayer': 50, 'ZifengFoldMan': 1000, 'EvanPlayer': 1905, 'KLChen2PokerPlayer': 970})
player [ZPlayer] gets hole card ['C2', 'C6'], current stack 1070
player [NitWinWin] gets hole card ['D7', 'D4'], current stack 995
player [Jinkun] gets hole card ['H8', 'S4'], current stack 1025
player [YueShi] gets hole card ['D3', 'SK'], current stack 985
player [JoyoPlayer] gets hole card ['C8', 'H4'], current stack 45
player [ZifengFoldMan] gets hole card ['DK', 'DJ'], current stack 990
player [EvanPlayer] gets hole card ['S7', 'SA'], current stack 1905
player [KLChen2PokerPlayer] gets hole card ['SJ', 'H6'], current stack 970
Started the round 4
Street "preflop" started. (community card = [])
"EvanPlayer" declared "raise:1905"
"KLChen2PokerPlayer" declared "fold:0"
"ZPlayer" declared "fold:0"
"NitWinWin" declared "fold:0"
"Jinkun" declared "fold:1905"
"YueShi" declared "fold:0"
"JoyoPlayer" declared "fold:0"
"ZifengFoldMan" declared "fold:0"
"['EvanPlayer']" won the round 4 (stack = {'ZPlayer': 1070, 'NitWinWin': 995, 'Jinkun': 1025, 'YueShi': 985, 'JoyoPlayer': 45, 'ZifengFoldMan': 990, 'EvanPlayer': 1920, 'KLChen2PokerPlayer': 970})
player [ZPlayer] gets hole card ['H2', 'H5'], current stack 1070
player [NitWinWin] gets hole card ['C4', 'SK'], current stack 995
player [Jinkun] gets hole card ['H3', 'S8'], current stack 1025
player [YueShi] gets hole card ['H7', 'S6'], current stack 985
player [JoyoPlayer] gets hole card ['D8', 'HK'], current stack 45
player [ZifengFoldMan] gets hole card ['S5', 'D5'], current stack 985
player [EvanPlayer] gets hole card ['S2', 'S9'], current stack 1910
player [KLChen2PokerPlayer] gets hole card ['H8', 'DA'], current stack 970
Started the round 5
Street "preflop" started. (community card = [])
"KLChen2PokerPlayer" declared "raise:15"
"ZPlayer" declared "call:15"
"NitWinWin" declared "fold:0"
"Jinkun" declared "fold:15"
"YueShi" declared "fold:0"
"JoyoPlayer" declared "fold:0"
"ZifengFoldMan" declared "fold:0"
"EvanPlayer" declared "raise:1920"
"KLChen2PokerPlayer" declared "fold:0"
"ZPlayer" declared "fold:0"
"['EvanPlayer']" won the round 5 (stack = {'ZPlayer': 1055, 'NitWinWin': 995, 'Jinkun': 1025, 'YueShi': 985, 'JoyoPlayer': 45, 'ZifengFoldMan': 985, 'EvanPlayer': 1955, 'KLChen2PokerPlayer': 955})
player [ZPlayer] gets hole card ['HT', 'H8'], current stack 1055
player [NitWinWin] gets hole card ['H6', 'H7'], current stack 995
player [Jinkun] gets hole card ['D7', 'D3'], current stack 1025
player [YueShi] gets hole card ['CA', 'DA'], current stack 985
player [JoyoPlayer] gets hole card ['S4', 'C3'], current stack 45
player [ZifengFoldMan] gets hole card ['HA', 'D4'], current stack 985
player [EvanPlayer] gets hole card ['C5', 'SK'], current stack 1950
player [KLChen2PokerPlayer] gets hole card ['DJ', 'C6'], current stack 945
Started the round 6
Street "preflop" started. (community card = [])
"ZPlayer" declared "raise:15"
"NitWinWin" declared "fold:0"
"Jinkun" declared "fold:15"
"YueShi" declared "fold:0"
"JoyoPlayer" declared "fold:0"
"ZifengFoldMan" declared "fold:0"
"EvanPlayer" declared "fold:15"
"KLChen2PokerPlayer" declared "raise:20"
"ZPlayer" declared "call:20"
Street "flop" started. (community card = ['H3', 'H4', 'H9'])
"KLChen2PokerPlayer" declared "call:0"
"ZPlayer" declared "raise:45"
"KLChen2PokerPlayer" declared "fold:0"
"['ZPlayer']" won the round 6 (stack = {'ZPlayer': 1080, 'NitWinWin': 995, 'Jinkun': 1025, 'YueShi': 985, 'JoyoPlayer': 45, 'ZifengFoldMan': 985, 'EvanPlayer': 1950, 'KLChen2PokerPlayer': 935})
player [ZPlayer] gets hole card ['HT', 'S7'], current stack 1070
player [NitWinWin] gets hole card ['D8', 'DK'], current stack 995
player [Jinkun] gets hole card ['H5', 'H8'], current stack 1025
player [YueShi] gets hole card ['D4', 'SQ'], current stack 985
player [JoyoPlayer] gets hole card ['H4', 'CT'], current stack 45
player [ZifengFoldMan] gets hole card ['C6', 'H6'], current stack 985
player [EvanPlayer] gets hole card ['C8', 'H2'], current stack 1950
player [KLChen2PokerPlayer] gets hole card ['S4', 'S5'], current stack 930
Started the round 7
Street "preflop" started. (community card = [])
"NitWinWin" declared "fold:0"
"Jinkun" declared "fold:10"
"YueShi" declared "fold:0"
"JoyoPlayer" declared "raise:15"
"ZifengFoldMan" declared "fold:0"
"EvanPlayer" declared "fold:15"
"KLChen2PokerPlayer" declared "fold:0"
"ZPlayer" declared "call:15"
Street "flop" started. (community card = ['SA', 'SJ', 'DJ'])
"ZPlayer" declared "call:0"
"JoyoPlayer" declared "fold:0"
"['ZPlayer']" won the round 7 (stack = {'ZPlayer': 1100, 'NitWinWin': 995, 'Jinkun': 1025, 'YueShi': 985, 'JoyoPlayer': 30, 'ZifengFoldMan': 985, 'EvanPlayer': 1950, 'KLChen2PokerPlayer': 930})
player [ZPlayer] gets hole card ['D9', 'S6'], current stack 1095
player [NitWinWin] gets hole card ['C8', 'S8'], current stack 985
player [Jinkun] gets hole card ['H8', 'DJ'], current stack 1025
player [YueShi] gets hole card ['SK', 'C5'], current stack 985
player [JoyoPlayer] gets hole card ['S3', 'H5'], current stack 30
player [ZifengFoldMan] gets hole card ['HT', 'C7'], current stack 985
player [EvanPlayer] gets hole card ['C9', 'S4'], current stack 1950
player [KLChen2PokerPlayer] gets hole card ['CT', 'D4'], current stack 930
Started the round 8
Street "preflop" started. (community card = [])
"Jinkun" declared "fold:10"
"YueShi" declared "fold:0"
"JoyoPlayer" declared "raise:15"
"ZifengFoldMan" declared "fold:0"
"EvanPlayer" declared "fold:15"
"KLChen2PokerPlayer" declared "fold:0"
"ZPlayer" declared "call:15"
"NitWinWin" declared "fold:0"
Street "flop" started. (community card = ['DT', 'H7', 'D7'])
"ZPlayer" declared "call:0"
"JoyoPlayer" declared "fold:0"
"['ZPlayer']" won the round 8 (stack = {'ZPlayer': 1125, 'NitWinWin': 985, 'Jinkun': 1025, 'YueShi': 985, 'JoyoPlayer': 15, 'ZifengFoldMan': 985, 'EvanPlayer': 1950, 'KLChen2PokerPlayer': 930})
player [ZPlayer] gets hole card ['D5', 'C7'], current stack 1125
player [NitWinWin] gets hole card ['D4', 'S7'], current stack 980
player [Jinkun] gets hole card ['D9', 'H7'], current stack 1015
player [YueShi] gets hole card ['H4', 'H6'], current stack 985
player [JoyoPlayer] gets hole card ['C6', 'SJ'], current stack 15
player [ZifengFoldMan] gets hole card ['D7', 'ST'], current stack 985
player [EvanPlayer] gets hole card ['HQ', 'S6'], current stack 1950
player [KLChen2PokerPlayer] gets hole card ['C2', 'HA'], current stack 930
Started the round 9
Street "preflop" started. (community card = [])
"YueShi" declared "fold:0"
"JoyoPlayer" declared "raise:15"
"ZifengFoldMan" declared "fold:0"
"EvanPlayer" declared "call:15"
"KLChen2PokerPlayer" declared "raise:20"
"ZPlayer" declared "call:20"
"NitWinWin" declared "fold:0"
"Jinkun" declared "fold:20"
"EvanPlayer" declared "fold:20"
Street "flop" started. (community card = ['C4', 'S4', 'HK'])
"KLChen2PokerPlayer" declared "raise:13"
"ZPlayer" declared "fold:0"
Street "turn" started. (community card = ['C4', 'S4', 'HK', 'S2'])
Street "river" started. (community card = ['C4', 'S4', 'HK', 'S2', 'S9'])
"['KLChen2PokerPlayer']" won the round 9 (stack = {'ZPlayer': 1105, 'NitWinWin': 980, 'Jinkun': 1015, 'YueShi': 985, 'JoyoPlayer': 0, 'ZifengFoldMan': 985, 'EvanPlayer': 1935, 'KLChen2PokerPlayer': 995})
player [ZPlayer] gets hole card ['H4', 'HT'], current stack 1105
player [NitWinWin] gets hole card ['C7', 'CT'], current stack 980
player [Jinkun] gets hole card ['D8', 'H9'], current stack 1010
player [YueShi] gets hole card ['D5', 'S8'], current stack 975
player [ZifengFoldMan] gets hole card ['S5', 'DJ'], current stack 985
player [EvanPlayer] gets hole card ['HQ', 'CA'], current stack 1935
player [KLChen2PokerPlayer] gets hole card ['S9', 'CK'], current stack 995
Started the round 10
Street "preflop" started. (community card = [])
"ZifengFoldMan" declared "fold:0"
"EvanPlayer" declared "raise:1935"
"KLChen2PokerPlayer" declared "fold:0"
"ZPlayer" declared "fold:0"
"NitWinWin" declared "fold:0"
"Jinkun" declared "fold:1935"
"YueShi" declared "fold:0"
"['EvanPlayer']" won the round 10 (stack = {'ZPlayer': 1105, 'NitWinWin': 980, 'Jinkun': 1010, 'YueShi': 975, 'JoyoPlayer': 0, 'ZifengFoldMan': 985, 'EvanPlayer': 1950, 'KLChen2PokerPlayer': 995})
player [ZPlayer] gets hole card ['D3', 'CA'], current stack 1105
player [NitWinWin] gets hole card ['C5', 'DJ'], current stack 980
player [Jinkun] gets hole card ['HA', 'C2'], current stack 1010
player [YueShi] gets hole card ['ST', 'CK'], current stack 970
player [ZifengFoldMan] gets hole card ['D5', 'HT'], current stack 975
player [EvanPlayer] gets hole card ['HK', 'D4'], current stack 1950
player [KLChen2PokerPlayer] gets hole card ['D2', 'S9'], current stack 995
Started the round 11
Street "preflop" started. (community card = [])
"EvanPlayer" declared "call:10"
"KLChen2PokerPlayer" declared "fold:0"
"ZPlayer" declared "call:10"
"NitWinWin" declared "fold:0"
"Jinkun" declared "fold:10"
"YueShi" declared "fold:0"
"ZifengFoldMan" declared "fold:0"
Street "flop" started. (community card = ['CQ', 'D9', 'SK'])
"EvanPlayer" declared "call:0"
"ZPlayer" declared "call:0"
Street "turn" started. (community card = ['CQ', 'D9', 'SK', 'DA'])
"EvanPlayer" declared "raise:1940"
"ZPlayer" declared "fold:0"
"['EvanPlayer']" won the round 11 (stack = {'ZPlayer': 1095, 'NitWinWin': 980, 'Jinkun': 1010, 'YueShi': 970, 'JoyoPlayer': 0, 'ZifengFoldMan': 975, 'EvanPlayer': 1975, 'KLChen2PokerPlayer': 995})
player [ZPlayer] gets hole card ['S4', 'D6'], current stack 1095
player [NitWinWin] gets hole card ['D7', 'DK'], current stack 980
player [Jinkun] gets hole card ['CA', 'HA'], current stack 1010
player [YueShi] gets hole card ['SA', 'S2'], current stack 970
player [ZifengFoldMan] gets hole card ['D8', 'S9'], current stack 970
player [EvanPlayer] gets hole card ['C7', 'C5'], current stack 1965
player [KLChen2PokerPlayer] gets hole card ['DA', 'D4'], current stack 995
Started the round 12
Street "preflop" started. (community card = [])
"KLChen2PokerPlayer" declared "raise:15"
"ZPlayer" declared "fold:0"
"NitWinWin" declared "fold:0"
"Jinkun" declared "call:15"
"YueShi" declared "fold:0"
"ZifengFoldMan" declared "fold:0"
"EvanPlayer" declared "fold:15"
Street "flop" started. (community card = ['SQ', 'D3', 'S8'])
"KLChen2PokerPlayer" declared "raise:13"
"Jinkun" declared "call:13"
Street "turn" started. (community card = ['SQ', 'D3', 'S8', 'CJ'])
"KLChen2PokerPlayer" declared "call:0"
"Jinkun" declared "raise:30"
"KLChen2PokerPlayer" declared "fold:0"
"['Jinkun']" won the round 12 (stack = {'ZPlayer': 1095, 'NitWinWin': 980, 'Jinkun': 1053, 'YueShi': 970, 'JoyoPlayer': 0, 'ZifengFoldMan': 970, 'EvanPlayer': 1965, 'KLChen2PokerPlayer': 967})
player [ZPlayer] gets hole card ['C6', 'S9'], current stack 1095
player [NitWinWin] gets hole card ['S3', 'SQ'], current stack 980
player [Jinkun] gets hole card ['DA', 'CJ'], current stack 1053
player [YueShi] gets hole card ['C8', 'CT'], current stack 970
player [ZifengFoldMan] gets hole card ['DJ', 'H8'], current stack 970
player [EvanPlayer] gets hole card ['H4', 'D8'], current stack 1960
player [KLChen2PokerPlayer] gets hole card ['S6', 'C5'], current stack 957
Started the round 13
Street "preflop" started. (community card = [])
"ZPlayer" declared "call:10"
"NitWinWin" declared "fold:0"
"Jinkun" declared "fold:10"
"YueShi" declared "fold:0"
"ZifengFoldMan" declared "fold:0"
"EvanPlayer" declared "raise:1965"
"KLChen2PokerPlayer" declared "fold:0"
"ZPlayer" declared "fold:0"
"['EvanPlayer']" won the round 13 (stack = {'ZPlayer': 1085, 'NitWinWin': 980, 'Jinkun': 1053, 'YueShi': 970, 'JoyoPlayer': 0, 'ZifengFoldMan': 970, 'EvanPlayer': 1985, 'KLChen2PokerPlayer': 957})
player [ZPlayer] gets hole card ['SK', 'D8'], current stack 1075
player [NitWinWin] gets hole card ['D9', 'C2'], current stack 980
player [Jinkun] gets hole card ['DT', 'C8'], current stack 1053
player [YueShi] gets hole card ['H2', 'SJ'], current stack 970
player [ZifengFoldMan] gets hole card ['HK', 'C3'], current stack 970
player [EvanPlayer] gets hole card ['H6', 'D4'], current stack 1985
player [KLChen2PokerPlayer] gets hole card ['H3', 'C9'], current stack 952
Started the round 14
Street "preflop" started. (community card = [])
"NitWinWin" declared "fold:0"
"Jinkun" declared "fold:10"
"YueShi" declared "fold:0"
"ZifengFoldMan" declared "fold:0"
"EvanPlayer" declared "fold:10"
"KLChen2PokerPlayer" declared "fold:0"
"['ZPlayer']" won the round 14 (stack = {'ZPlayer': 1090, 'NitWinWin': 980, 'Jinkun': 1053, 'YueShi': 970, 'JoyoPlayer': 0, 'ZifengFoldMan': 970, 'EvanPlayer': 1985, 'KLChen2PokerPlayer': 952})
player [ZPlayer] gets hole card ['C8', 'DA'], current stack 1085
player [NitWinWin] gets hole card ['C2', 'C7'], current stack 970
player [Jinkun] gets hole card ['H6', 'D8'], current stack 1053
player [YueShi] gets hole card ['SJ', 'C5'], current stack 970
player [ZifengFoldMan] gets hole card ['H2', 'DJ'], current stack 970
player [EvanPlayer] gets hole card ['D5', 'HT'], current stack 1985
player [KLChen2PokerPlayer] gets hole card ['CA', 'C6'], current stack 952
Started the round 15
Street "preflop" started. (community card = [])
"Jinkun" declared "fold:10"
"YueShi" declared "fold:0"
"ZifengFoldMan" declared "fold:0"
"EvanPlayer" declared "fold:10"
"KLChen2PokerPlayer" declared "raise:15"
"ZPlayer" declared "call:15"
"NitWinWin" declared "fold:0"
Street "flop" started. (community card = ['C3', 'H7', 'D3'])
"ZPlayer" declared "raise:10"
"KLChen2PokerPlayer" declared "raise:20"
"ZPlayer" declared "fold:0"
"['KLChen2PokerPlayer']" won the round 15 (stack = {'ZPlayer': 1065, 'NitWinWin': 970, 'Jinkun': 1053, 'YueShi': 970, 'JoyoPlayer': 0, 'ZifengFoldMan': 970, 'EvanPlayer': 1985, 'KLChen2PokerPlayer': 987})
player [ZPlayer] gets hole card ['DT', 'H7'], current stack 1065
player [NitWinWin] gets hole card ['DA', 'D2'], current stack 965
player [Jinkun] gets hole card ['D9', 'S8'], current stack 1043
player [YueShi] gets hole card ['DK', 'SA'], current stack 970
player [ZifengFoldMan] gets hole card ['DJ', 'C6'], current stack 970
player [EvanPlayer] gets hole card ['H3', 'S4'], current stack 1985
player [KLChen2PokerPlayer] gets hole card ['H8', 'HA'], current stack 987
Started the round 16
Street "preflop" started. (community card = [])
"YueShi" declared "fold:0"
"ZifengFoldMan" declared "fold:0"
"EvanPlayer" declared "fold:10"
"KLChen2PokerPlayer" declared "raise:24"
"ZPlayer" declared "call:24"
"NitWinWin" declared "fold:0"
"Jinkun" declared "fold:24"
Street "flop" started. (community card = ['C8', 'H6', 'S5'])
"KLChen2PokerPlayer" declared "raise:34"
"ZPlayer" declared "fold:0"
"['KLChen2PokerPlayer']" won the round 16 (stack = {'ZPlayer': 1041, 'NitWinWin': 965, 'Jinkun': 1043, 'YueShi': 970, 'JoyoPlayer': 0, 'ZifengFoldMan': 970, 'EvanPlayer': 1985, 'KLChen2PokerPlayer': 1026})
player [ZPlayer] gets hole card ['C7', 'C2'], current stack 1041
player [NitWinWin] gets hole card ['C3', 'DQ'], current stack 965
player [Jinkun] gets hole card ['S4', 'DK'], current stack 1038
player [YueShi] gets hole card ['C4', 'S3'], current stack 960
player [ZifengFoldMan] gets hole card ['HK', 'CA'], current stack 970
player [EvanPlayer] gets hole card ['S6', 'D7'], current stack 1985
player [KLChen2PokerPlayer] gets hole card ['HT', 'D6'], current stack 1026
Started the round 17
Street "preflop" started. (community card = [])
"ZifengFoldMan" declared "fold:0"
"EvanPlayer" declared "call:10"
"KLChen2PokerPlayer" declared "call:10"
"ZPlayer" declared "call:10"
"NitWinWin" declared "fold:0"
"Jinkun" declared "fold:10"
"YueShi" declared "fold:0"
Street "flop" started. (community card = ['D3', 'D9', 'H7'])
"EvanPlayer" declared "raise:1975"
"KLChen2PokerPlayer" declared "fold:0"
"ZPlayer" declared "fold:0"
"['EvanPlayer']" won the round 17 (stack = {'ZPlayer': 1031, 'NitWinWin': 965, 'Jinkun': 1038, 'YueShi': 960, 'JoyoPlayer': 0, 'ZifengFoldMan': 970, 'EvanPlayer': 2020, 'KLChen2PokerPlayer': 1016})
player [ZPlayer] gets hole card ['CJ', 'CT'], current stack 1031
player [NitWinWin] gets hole card ['HA', 'C8'], current stack 965
player [Jinkun] gets hole card ['C3', 'HQ'], current stack 1038
player [YueShi] gets hole card ['CQ', 'HJ'], current stack 955
player [ZifengFoldMan] gets hole card ['S7', 'S9'], current stack 960
player [EvanPlayer] gets hole card ['DJ', 'DK'], current stack 2020
player [KLChen2PokerPlayer] gets hole card ['SK', 'SA'], current stack 1016
Started the round 18
Street "preflop" started. (community card = [])
"EvanPlayer" declared "raise:2020"
"KLChen2PokerPlayer" declared "fold:0"
"ZPlayer" declared "fold:0"
"NitWinWin" declared "fold:0"
"Jinkun" declared "fold:2020"
"YueShi" declared "fold:0"
"ZifengFoldMan" declared "fold:0"
"['EvanPlayer']" won the round 18 (stack = {'ZPlayer': 1031, 'NitWinWin': 965, 'Jinkun': 1038, 'YueShi': 955, 'JoyoPlayer': 0, 'ZifengFoldMan': 960, 'EvanPlayer': 2035, 'KLChen2PokerPlayer': 1016})
player [ZPlayer] gets hole card ['DT', 'D6'], current stack 1031
player [NitWinWin] gets hole card ['S7', 'D4'], current stack 965
player [Jinkun] gets hole card ['D3', 'CT'], current stack 1038
player [YueShi] gets hole card ['H4', 'S6'], current stack 955
player [ZifengFoldMan] gets hole card ['DK', 'HK'], current stack 955
player [EvanPlayer] gets hole card ['H6', 'DJ'], current stack 2025
player [KLChen2PokerPlayer] gets hole card ['S2', 'H3'], current stack 1016
Started the round 19
Street "preflop" started. (community card = [])
"KLChen2PokerPlayer" declared "fold:0"
"ZPlayer" declared "fold:0"
"NitWinWin" declared "fold:0"
"Jinkun" declared "call:10"
"YueShi" declared "fold:0"
"ZifengFoldMan" declared "fold:0"
"EvanPlayer" declared "fold:10"
"['Jinkun']" won the round 19 (stack = {'ZPlayer': 1031, 'NitWinWin': 965, 'Jinkun': 1053, 'YueShi': 955, 'JoyoPlayer': 0, 'ZifengFoldMan': 955, 'EvanPlayer': 2025, 'KLChen2PokerPlayer': 1016})
player [ZPlayer] gets hole card ['C8', 'S7'], current stack 1031
player [NitWinWin] gets hole card ['HK', 'H5'], current stack 965
player [Jinkun] gets hole card ['CK', 'SA'], current stack 1053
player [YueShi] gets hole card ['H3', 'S8'], current stack 955
player [ZifengFoldMan] gets hole card ['HA', 'H7'], current stack 955
player [EvanPlayer] gets hole card ['C9', 'H9'], current stack 2020
player [KLChen2PokerPlayer] gets hole card ['S9', 'C4'], current stack 1006
Started the round 20
Street "preflop" started. (community card = [])
"ZPlayer" declared "call:10"
"NitWinWin" declared "fold:0"
"Jinkun" declared "fold:10"
"YueShi" declared "fold:0"
"ZifengFoldMan" declared "fold:0"
"EvanPlayer" declared "call:10"
"KLChen2PokerPlayer" declared "call:10"
Street "flop" started. (community card = ['D5', 'S6', 'DT'])
"EvanPlayer" declared "fold:0"
"KLChen2PokerPlayer" declared "call:0"
"ZPlayer" declared "call:0"
Street "turn" started. (community card = ['D5', 'S6', 'DT', 'DQ'])
"KLChen2PokerPlayer" declared "call:0"
"ZPlayer" declared "call:0"
Street "river" started. (community card = ['D5', 'S6', 'DT', 'DQ', 'H6'])
"KLChen2PokerPlayer" declared "call:0"
"ZPlayer" declared "call:0"
"['KLChen2PokerPlayer']" won the round 20 (stack = {'ZPlayer': 1021, 'NitWinWin': 965, 'Jinkun': 1053, 'YueShi': 955, 'JoyoPlayer': 0, 'ZifengFoldMan': 955, 'EvanPlayer': 2015, 'KLChen2PokerPlayer': 1036})
player [ZPlayer] gets hole card ['D6', 'CJ'], current stack 1011
player [NitWinWin] gets hole card ['S8', 'HQ'], current stack 965
player [Jinkun] gets hole card ['D5', 'D2'], current stack 1053
player [YueShi] gets hole card ['ST', 'DQ'], current stack 955
player [ZifengFoldMan] gets hole card ['C2', 'H3'], current stack 955
player [EvanPlayer] gets hole card ['D7', 'HA'], current stack 2015
player [KLChen2PokerPlayer] gets hole card ['SQ', 'S7'], current stack 1031
Started the round 21
Street "preflop" started. (community card = [])
"NitWinWin" declared "fold:0"
"Jinkun" declared "fold:10"
"YueShi" declared "fold:0"
"ZifengFoldMan" declared "fold:0"
"EvanPlayer" declared "raise:2015"
"KLChen2PokerPlayer" declared "fold:0"
"ZPlayer" declared "fold:0"
"['EvanPlayer']" won the round 21 (stack = {'ZPlayer': 1011, 'NitWinWin': 965, 'Jinkun': 1053, 'YueShi': 955, 'JoyoPlayer': 0, 'ZifengFoldMan': 955, 'EvanPlayer': 2030, 'KLChen2PokerPlayer': 1031})
player [ZPlayer] gets hole card ['HK', 'SJ'], current stack 1006
player [NitWinWin] gets hole card ['C8', 'HA'], current stack 955
player [Jinkun] gets hole card ['SA', 'DJ'], current stack 1053
player [YueShi] gets hole card ['DT', 'H6'], current stack 955
player [ZifengFoldMan] gets hole card ['H7', 'S3'], current stack 955
player [EvanPlayer] gets hole card ['CJ', 'ST'], current stack 2030
player [KLChen2PokerPlayer] gets hole card ['SK', 'S8'], current stack 1031
Started the round 22
Street "preflop" started. (community card = [])
"Jinkun" declared "fold:10"
"YueShi" declared "fold:0"
"ZifengFoldMan" declared "fold:0"
"EvanPlayer" declared "call:10"
"KLChen2PokerPlayer" declared "raise:15"
"ZPlayer" declared "call:15"
"NitWinWin" declared "fold:0"
"EvanPlayer" declared "fold:15"
Street "flop" started. (community card = ['H3', 'S5', 'HT'])
"ZPlayer" declared "call:0"
"KLChen2PokerPlayer" declared "call:0"
Street "turn" started. (community card = ['H3', 'S5', 'HT', 'CK'])
"ZPlayer" declared "raise:53"
"KLChen2PokerPlayer" declared "raise:234"
"ZPlayer" declared "call:234"
Street "river" started. (community card = ['H3', 'S5', 'HT', 'CK', 'H4'])
"ZPlayer" declared "raise:10"
"KLChen2PokerPlayer" declared "call:10"
"['ZPlayer']" won the round 22 (stack = {'ZPlayer': 1290, 'NitWinWin': 955, 'Jinkun': 1053, 'YueShi': 955, 'JoyoPlayer': 0, 'ZifengFoldMan': 955, 'EvanPlayer': 2020, 'KLChen2PokerPlayer': 772})
player [ZPlayer] gets hole card ['HK', 'CQ'], current stack 1290
player [NitWinWin] gets hole card ['D3', 'DQ'], current stack 950
player [Jinkun] gets hole card ['H4', 'C9'], current stack 1043
player [YueShi] gets hole card ['SK', 'DT'], current stack 955
player [ZifengFoldMan] gets hole card ['DK', 'C7'], current stack 955
player [EvanPlayer] gets hole card ['S9', 'H8'], current stack 2020
player [KLChen2PokerPlayer] gets hole card ['ST', 'D4'], current stack 772
Started the round 23
Street "preflop" started. (community card = [])
"YueShi" declared "fold:0"
"ZifengFoldMan" declared "fold:0"
"EvanPlayer" declared "call:10"
"KLChen2PokerPlayer" declared "call:10"
"ZPlayer" declared "raise:15"
"NitWinWin" declared "fold:0"
"Jinkun" declared "fold:15"
"EvanPlayer" declared "fold:15"
"KLChen2PokerPlayer" declared "fold:0"
"['ZPlayer']" won the round 23 (stack = {'ZPlayer': 1325, 'NitWinWin': 950, 'Jinkun': 1043, 'YueShi': 955, 'JoyoPlayer': 0, 'ZifengFoldMan': 955, 'EvanPlayer': 2010, 'KLChen2PokerPlayer': 762})
player [ZPlayer] gets hole card ['S8', 'ST'], current stack 1325
player [NitWinWin] gets hole card ['S4', 'H7'], current stack 950
player [Jinkun] gets hole card ['D9', 'H2'], current stack 1038
player [YueShi] gets hole card ['DT', 'HJ'], current stack 945
player [ZifengFoldMan] gets hole card ['D8', 'D2'], current stack 955
player [EvanPlayer] gets hole card ['HT', 'S5'], current stack 2010
player [KLChen2PokerPlayer] gets hole card ['C6', 'CJ'], current stack 762
Started the round 24
Street "preflop" started. (community card = [])
"ZifengFoldMan" declared "fold:0"
"EvanPlayer" declared "fold:10"
"KLChen2PokerPlayer" declared "raise:17"
"ZPlayer" declared "call:17"
"NitWinWin" declared "fold:0"
"Jinkun" declared "fold:17"
"YueShi" declared "fold:0"
Street "flop" started. (community card = ['C4', 'C2', 'CA'])
"KLChen2PokerPlayer" declared "raise:22"
"ZPlayer" declared "fold:0"
"['KLChen2PokerPlayer']" won the round 24 (stack = {'ZPlayer': 1308, 'NitWinWin': 950, 'Jinkun': 1038, 'YueShi': 945, 'JoyoPlayer': 0, 'ZifengFoldMan': 955, 'EvanPlayer': 2010, 'KLChen2PokerPlayer': 794})
player [ZPlayer] gets hole card ['HK', 'S3'], current stack 1308
player [NitWinWin] gets hole card ['CT', 'ST'], current stack 950
player [Jinkun] gets hole card ['D7', 'D3'], current stack 1038
player [YueShi] gets hole card ['HQ', 'HA'], current stack 940
player [ZifengFoldMan] gets hole card ['DT', 'C7'], current stack 945
player [EvanPlayer] gets hole card ['DK', 'S5'], current stack 2010
player [KLChen2PokerPlayer] gets hole card ['SQ', 'D8'], current stack 794
Started the round 25
Street "preflop" started. (community card = [])
"EvanPlayer" declared "raise:2010"
"KLChen2PokerPlayer" declared "fold:0"
"ZPlayer" declared "fold:0"
"NitWinWin" declared "fold:0"
"Jinkun" declared "fold:2010"
"YueShi" declared "fold:0"
"ZifengFoldMan" declared "fold:0"
"['EvanPlayer']" won the round 25 (stack = {'ZPlayer': 1308, 'NitWinWin': 950, 'Jinkun': 1038, 'YueShi': 940, 'JoyoPlayer': 0, 'ZifengFoldMan': 945, 'EvanPlayer': 2025, 'KLChen2PokerPlayer': 794})
player [ZPlayer] gets hole card ['S3', 'H7'], current stack 1308
player [NitWinWin] gets hole card ['D9', 'H6'], current stack 950
player [Jinkun] gets hole card ['C8', 'D4'], current stack 1038
player [YueShi] gets hole card ['S6', 'H8'], current stack 940
player [ZifengFoldMan] gets hole card ['C4', 'CK'], current stack 940
player [EvanPlayer] gets hole card ['D8', 'S8'], current stack 2015
player [KLChen2PokerPlayer] gets hole card ['SJ', 'HK'], current stack 794
Started the round 26
Street "preflop" started. (community card = [])
"KLChen2PokerPlayer" declared "raise:17"
"ZPlayer" declared "call:17"
"NitWinWin" declared "fold:0"
"Jinkun" declared "fold:17"
"YueShi" declared "fold:0"
"ZifengFoldMan" declared "fold:0"
"EvanPlayer" declared "fold:17"
Street "flop" started. (community card = ['CT', 'S2', 'H5'])
"KLChen2PokerPlayer" declared "call:0"
"ZPlayer" declared "call:0"
Street "turn" started. (community card = ['CT', 'S2', 'H5', 'D6'])
"KLChen2PokerPlayer" declared "call:0"
"ZPlayer" declared "call:0"
Street "river" started. (community card = ['CT', 'S2', 'H5', 'D6', 'HT'])
"KLChen2PokerPlayer" declared "call:0"
"ZPlayer" declared "call:0"
"['KLChen2PokerPlayer']" won the round 26 (stack = {'ZPlayer': 1291, 'NitWinWin': 950, 'Jinkun': 1038, 'YueShi': 940, 'JoyoPlayer': 0, 'ZifengFoldMan': 940, 'EvanPlayer': 2015, 'KLChen2PokerPlayer': 826})
player [ZPlayer] gets hole card ['CT', 'SK'], current stack 1291
player [NitWinWin] gets hole card ['D8', 'DA'], current stack 950
player [Jinkun] gets hole card ['S4', 'HQ'], current stack 1038
player [YueShi] gets hole card ['H9', 'HK'], current stack 940
player [ZifengFoldMan] gets hole card ['D6', 'DK'], current stack 940
player [EvanPlayer] gets hole card ['C2', 'C8'], current stack 2010
player [KLChen2PokerPlayer] gets hole card ['SA', 'H7'], current stack 816
Started the round 27
Street "preflop" started. (community card = [])
"ZPlayer" declared "raise:15"
"NitWinWin" declared "fold:0"
"Jinkun" declared "fold:15"
"YueShi" declared "fold:0"
"ZifengFoldMan" declared "fold:0"
"EvanPlayer" declared "raise:2015"
"KLChen2PokerPlayer" declared "fold:0"
"ZPlayer" declared "fold:0"
"['EvanPlayer']" won the round 27 (stack = {'ZPlayer': 1276, 'NitWinWin': 950, 'Jinkun': 1038, 'YueShi': 940, 'JoyoPlayer': 0, 'ZifengFoldMan': 940, 'EvanPlayer': 2040, 'KLChen2PokerPlayer': 816})
player [ZPlayer] gets hole card ['C2', 'CA'], current stack 1266
player [NitWinWin] gets hole card ['D6', 'H2'], current stack 950
player [Jinkun] gets hole card ['SK', 'S8'], current stack 1038
player [YueShi] gets hole card ['DA', 'ST'], current stack 940
player [ZifengFoldMan] gets hole card ['S4', 'HA'], current stack 940
player [EvanPlayer] gets hole card ['H6', 'S9'], current stack 2040
player [KLChen2PokerPlayer] gets hole card ['D3', 'HT'], current stack 811
Started the round 28
Street "preflop" started. (community card = [])
"NitWinWin" declared "fold:0"
"Jinkun" declared "fold:10"
"YueShi" declared "fold:0"
"ZifengFoldMan" declared "fold:0"
"EvanPlayer" declared "fold:10"
"KLChen2PokerPlayer" declared "fold:0"
"['ZPlayer']" won the round 28 (stack = {'ZPlayer': 1281, 'NitWinWin': 950, 'Jinkun': 1038, 'YueShi': 940, 'JoyoPlayer': 0, 'ZifengFoldMan': 940, 'EvanPlayer': 2040, 'KLChen2PokerPlayer': 811})
player [ZPlayer] gets hole card ['HK', 'C9'], current stack 1276
player [NitWinWin] gets hole card ['C8', 'S9'], current stack 940
player [Jinkun] gets hole card ['H5', 'H7'], current stack 1038
player [YueShi] gets hole card ['D6', 'DK'], current stack 940
player [ZifengFoldMan] gets hole card ['H2', 'D3'], current stack 940
player [EvanPlayer] gets hole card ['S5', 'S7'], current stack 2040
player [KLChen2PokerPlayer] gets hole card ['S8', 'S2'], current stack 811
Started the round 29
Street "preflop" started. (community card = [])
"Jinkun" declared "fold:10"
"YueShi" declared "fold:0"
"ZifengFoldMan" declared "fold:0"
"EvanPlayer" declared "fold:10"
"KLChen2PokerPlayer" declared "fold:0"
"ZPlayer" declared "raise:15"
"NitWinWin" declared "fold:0"
"['ZPlayer']" won the round 29 (stack = {'ZPlayer': 1291, 'NitWinWin': 940, 'Jinkun': 1038, 'YueShi': 940, 'JoyoPlayer': 0, 'ZifengFoldMan': 940, 'EvanPlayer': 2040, 'KLChen2PokerPlayer': 811})
player [ZPlayer] gets hole card ['D6', 'D3'], current stack 1291
player [NitWinWin] gets hole card ['D4', 'H9'], current stack 935
player [Jinkun] gets hole card ['HA', 'H6'], current stack 1028
player [YueShi] gets hole card ['C2', 'DA'], current stack 940
player [ZifengFoldMan] gets hole card ['C6', 'H2'], current stack 940
player [EvanPlayer] gets hole card ['S3', 'H4'], current stack 2040
player [KLChen2PokerPlayer] gets hole card ['CA', 'CQ'], current stack 811
Started the round 30
Street "preflop" started. (community card = [])
"YueShi" declared "fold:0"
"ZifengFoldMan" declared "fold:0"
"EvanPlayer" declared "fold:10"
"KLChen2PokerPlayer" declared "raise:15"
"ZPlayer" declared "call:15"
"NitWinWin" declared "fold:0"
"Jinkun" declared "call:15"
Street "flop" started. (community card = ['D7', 'D2', 'D9'])
"Jinkun" declared "call:0"
"KLChen2PokerPlayer" declared "call:0"
"ZPlayer" declared "raise:50"
"Jinkun" declared "fold:50"
"KLChen2PokerPlayer" declared "fold:0"
"['ZPlayer']" won the round 30 (stack = {'ZPlayer': 1326, 'NitWinWin': 935, 'Jinkun': 1023, 'YueShi': 940, 'JoyoPlayer': 0, 'ZifengFoldMan': 940, 'EvanPlayer': 2040, 'KLChen2PokerPlayer': 796})
player [ZPlayer] gets hole card ['H8', 'D8'], current stack 1326
player [NitWinWin] gets hole card ['CQ', 'S3'], current stack 935
player [Jinkun] gets hole card ['C4', 'DK'], current stack 1018
player [YueShi] gets hole card ['HT', 'C3'], current stack 930
player [ZifengFoldMan] gets hole card ['ST', 'HK'], current stack 940
player [EvanPlayer] gets hole card ['H2', 'SJ'], current stack 2040
player [KLChen2PokerPlayer] gets hole card ['S8', 'CA'], current stack 796
Started the round 31
Street "preflop" started. (community card = [])
"ZifengFoldMan" declared "fold:0"
"EvanPlayer" declared "fold:10"
"KLChen2PokerPlayer" declared "raise:26"
"ZPlayer" declared "call:26"
"NitWinWin" declared "fold:0"
"Jinkun" declared "fold:26"
"YueShi" declared "fold:0"
Street "flop" started. (community card = ['H3', 'S9', 'HQ'])
"KLChen2PokerPlayer" declared "call:0"
"ZPlayer" declared "raise:10"
"KLChen2PokerPlayer" declared "fold:0"
"['ZPlayer']" won the round 31 (stack = {'ZPlayer': 1367, 'NitWinWin': 935, 'Jinkun': 1018, 'YueShi': 930, 'JoyoPlayer': 0, 'ZifengFoldMan': 940, 'EvanPlayer': 2040, 'KLChen2PokerPlayer': 770})
player [ZPlayer] gets hole card ['H6', 'S7'], current stack 1367
player [NitWinWin] gets hole card ['C4', 'S6'], current stack 935
player [Jinkun] gets hole card ['S4', 'D4'], current stack 1018
player [YueShi] gets hole card ['SA', 'H5'], current stack 925
player [ZifengFoldMan] gets hole card ['S5', 'H4'], current stack 930
player [EvanPlayer] gets hole card ['D5', 'HQ'], current stack 2040
player [KLChen2PokerPlayer] gets hole card ['CA', 'ST'], current stack 770
Started the round 32
Street "preflop" started. (community card = [])
"EvanPlayer" declared "raise:2040"
"KLChen2PokerPlayer" declared "fold:0"
"ZPlayer" declared "fold:0"
"NitWinWin" declared "fold:0"
"Jinkun" declared "fold:2040"
"YueShi" declared "fold:0"
"ZifengFoldMan" declared "fold:0"
"['EvanPlayer']" won the round 32 (stack = {'ZPlayer': 1367, 'NitWinWin': 935, 'Jinkun': 1018, 'YueShi': 925, 'JoyoPlayer': 0, 'ZifengFoldMan': 930, 'EvanPlayer': 2055, 'KLChen2PokerPlayer': 770})
player [ZPlayer] gets hole card ['H4', 'DK'], current stack 1367
player [NitWinWin] gets hole card ['DT', 'S5'], current stack 935
player [Jinkun] gets hole card ['S2', 'H6'], current stack 1018
player [YueShi] gets hole card ['SK', 'C8'], current stack 925
player [ZifengFoldMan] gets hole card ['HT', 'D9'], current stack 925
player [EvanPlayer] gets hole card ['S6', 'HQ'], current stack 2045
player [KLChen2PokerPlayer] gets hole card ['S9', 'ST'], current stack 770
Started the round 33
Street "preflop" started. (community card = [])
"KLChen2PokerPlayer" declared "raise:29"
"ZPlayer" declared "call:29"
"NitWinWin" declared "fold:0"
"Jinkun" declared "fold:29"
"YueShi" declared "fold:0"
"ZifengFoldMan" declared "fold:0"
"EvanPlayer" declared "raise:2055"
"KLChen2PokerPlayer" declared "fold:0"
"ZPlayer" declared "fold:0"
"['EvanPlayer']" won the round 33 (stack = {'ZPlayer': 1338, 'NitWinWin': 935, 'Jinkun': 1018, 'YueShi': 925, 'JoyoPlayer': 0, 'ZifengFoldMan': 925, 'EvanPlayer': 2118, 'KLChen2PokerPlayer': 741})
player [ZPlayer] gets hole card ['SA', 'H5'], current stack 1338
player [NitWinWin] gets hole card ['D3', 'S4'], current stack 935
player [Jinkun] gets hole card ['D6', 'CK'], current stack 1018
player [YueShi] gets hole card ['S8', 'C4'], current stack 925
player [ZifengFoldMan] gets hole card ['HK', 'CQ'], current stack 925
player [EvanPlayer] gets hole card ['CA', 'H3'], current stack 2113
player [KLChen2PokerPlayer] gets hole card ['S2', 'DA'], current stack 731
Started the round 34
Street "preflop" started. (community card = [])
"ZPlayer" declared "raise:15"
"NitWinWin" declared "fold:0"
"Jinkun" declared "fold:15"
"YueShi" declared "fold:0"
"ZifengFoldMan" declared "fold:0"
"EvanPlayer" declared "fold:15"
"KLChen2PokerPlayer" declared "raise:20"
"ZPlayer" declared "call:20"
Street "flop" started. (community card = ['C8', 'CT', 'H4'])
"KLChen2PokerPlayer" declared "call:0"
"ZPlayer" declared "call:0"
Street "turn" started. (community card = ['C8', 'CT', 'H4', 'C3'])
"KLChen2PokerPlayer" declared "call:0"
"ZPlayer" declared "call:0"
Street "river" started. (community card = ['C8', 'CT', 'H4', 'C3', 'D7'])
"KLChen2PokerPlayer" declared "call:0"
"ZPlayer" declared "call:0"
"['ZPlayer']" won the round 34 (stack = {'ZPlayer': 1363, 'NitWinWin': 935, 'Jinkun': 1018, 'YueShi': 925, 'JoyoPlayer': 0, 'ZifengFoldMan': 925, 'EvanPlayer': 2113, 'KLChen2PokerPlayer': 721})
player [ZPlayer] gets hole card ['D6', 'D7'], current stack 1353
player [NitWinWin] gets hole card ['S6', 'D2'], current stack 935
player [Jinkun] gets hole card ['SK', 'CQ'], current stack 1018
player [YueShi] gets hole card ['SA', 'SQ'], current stack 925
player [ZifengFoldMan] gets hole card ['DQ', 'S5'], current stack 925
player [EvanPlayer] gets hole card ['HK', 'S4'], current stack 2113
player [KLChen2PokerPlayer] gets hole card ['C8', 'C3'], current stack 716
Started the round 35
Street "preflop" started. (community card = [])
"NitWinWin" declared "fold:0"
"Jinkun" declared "fold:10"
"YueShi" declared "fold:0"
"ZifengFoldMan" declared "fold:0"
"EvanPlayer" declared "fold:10"
"KLChen2PokerPlayer" declared "raise:16"
"ZPlayer" declared "call:16"
Street "flop" started. (community card = ['DK', 'S2', 'CA'])
"KLChen2PokerPlayer" declared "call:0"
"ZPlayer" declared "call:0"
Street "turn" started. (community card = ['DK', 'S2', 'CA', 'C2'])
"KLChen2PokerPlayer" declared "call:0"
"ZPlayer" declared "call:0"
Street "river" started. (community card = ['DK', 'S2', 'CA', 'C2', 'C4'])
"KLChen2PokerPlayer" declared "raise:181"
"ZPlayer" declared "fold:0"
"['KLChen2PokerPlayer']" won the round 35 (stack = {'ZPlayer': 1347, 'NitWinWin': 935, 'Jinkun': 1018, 'YueShi': 925, 'JoyoPlayer': 0, 'ZifengFoldMan': 925, 'EvanPlayer': 2113, 'KLChen2PokerPlayer': 737})
player [ZPlayer] gets hole card ['D3', 'SK'], current stack 1342
player [NitWinWin] gets hole card ['SA', 'ST'], current stack 925
player [Jinkun] gets hole card ['HA', 'CT'], current stack 1018
player [YueShi] gets hole card ['H9', 'S6'], current stack 925
player [ZifengFoldMan] gets hole card ['DJ', 'H3'], current stack 925
player [EvanPlayer] gets hole card ['H4', 'C6'], current stack 2113
player [KLChen2PokerPlayer] gets hole card ['HJ', 'H8'], current stack 737
Started the round 36
Street "preflop" started. (community card = [])
"Jinkun" declared "fold:10"
"YueShi" declared "fold:0"
"ZifengFoldMan" declared "fold:0"
"EvanPlayer" declared "fold:10"
"KLChen2PokerPlayer" declared "raise:18"
"ZPlayer" declared "call:18"
"NitWinWin" declared "fold:0"
Street "flop" started. (community card = ['D9', 'CJ', 'H7'])
"ZPlayer" declared "call:0"
"KLChen2PokerPlayer" declared "raise:35"
"ZPlayer" declared "fold:0"
"['KLChen2PokerPlayer']" won the round 36 (stack = {'ZPlayer': 1329, 'NitWinWin': 925, 'Jinkun': 1018, 'YueShi': 925, 'JoyoPlayer': 0, 'ZifengFoldMan': 925, 'EvanPlayer': 2113, 'KLChen2PokerPlayer': 765})
player [ZPlayer] gets hole card ['D9', 'DT'], current stack 1329
player [NitWinWin] gets hole card ['S9', 'H2'], current stack 920
player [Jinkun] gets hole card ['HK', 'C7'], current stack 1008
player [YueShi] gets hole card ['SJ', 'C4'], current stack 925
player [ZifengFoldMan] gets hole card ['C3', 'H7'], current stack 925
player [EvanPlayer] gets hole card ['H8', 'D7'], current stack 2113
player [KLChen2PokerPlayer] gets hole card ['CA', 'D6'], current stack 765
Started the round 37
Street "preflop" started. (community card = [])
"YueShi" declared "fold:0"
"ZifengFoldMan" declared "fold:0"
"EvanPlayer" declared "raise:2113"
"KLChen2PokerPlayer" declared "fold:0"
"ZPlayer" declared "fold:0"
"NitWinWin" declared "fold:0"
"Jinkun" declared "fold:2113"
"['EvanPlayer']" won the round 37 (stack = {'ZPlayer': 1329, 'NitWinWin': 920, 'Jinkun': 1008, 'YueShi': 925, 'JoyoPlayer': 0, 'ZifengFoldMan': 925, 'EvanPlayer': 2128, 'KLChen2PokerPlayer': 765})
player [ZPlayer] gets hole card ['C3', 'SK'], current stack 1329
player [NitWinWin] gets hole card ['H3', 'DQ'], current stack 920
player [Jinkun] gets hole card ['D5', 'S7'], current stack 1003
player [YueShi] gets hole card ['HQ', 'S3'], current stack 915
player [ZifengFoldMan] gets hole card ['DK', 'C8'], current stack 925
player [EvanPlayer] gets hole card ['C7', 'DJ'], current stack 2128
player [KLChen2PokerPlayer] gets hole card ['S9', 'D7'], current stack 765
Started the round 38
Street "preflop" started. (community card = [])
"ZifengFoldMan" declared "fold:0"
"EvanPlayer" declared "call:10"
"KLChen2PokerPlayer" declared "call:10"
"ZPlayer" declared "call:10"
"NitWinWin" declared "fold:0"
"Jinkun" declared "fold:10"
"YueShi" declared "fold:0"
Street "flop" started. (community card = ['HK', 'ST', 'D9'])
"EvanPlayer" declared "call:0"
"KLChen2PokerPlayer" declared "raise:34"
"ZPlayer" declared "call:34"
"EvanPlayer" declared "raise:2118"
"KLChen2PokerPlayer" declared "fold:0"
"ZPlayer" declared "fold:0"
"['EvanPlayer']" won the round 38 (stack = {'ZPlayer': 1285, 'NitWinWin': 920, 'Jinkun': 1003, 'YueShi': 915, 'JoyoPlayer': 0, 'ZifengFoldMan': 925, 'EvanPlayer': 2231, 'KLChen2PokerPlayer': 721})
player [ZPlayer] gets hole card ['D6', 'S6'], current stack 1285
player [NitWinWin] gets hole card ['C3', 'SQ'], current stack 920
player [Jinkun] gets hole card ['H8', 'DJ'], current stack 1003
player [YueShi] gets hole card ['ST', 'CQ'], current stack 910
player [ZifengFoldMan] gets hole card ['HA', 'S3'], current stack 915
player [EvanPlayer] gets hole card ['S2', 'D2'], current stack 2231
player [KLChen2PokerPlayer] gets hole card ['HJ', 'H9'], current stack 721
Started the round 39
Street "preflop" started. (community card = [])
"EvanPlayer" declared "call:10"
"KLChen2PokerPlayer" declared "raise:25"
"ZPlayer" declared "call:25"
"NitWinWin" declared "fold:0"
"Jinkun" declared "fold:25"
"YueShi" declared "fold:0"
"ZifengFoldMan" declared "fold:0"
"EvanPlayer" declared "fold:25"
Street "flop" started. (community card = ['SK', 'CT', 'HK'])
"KLChen2PokerPlayer" declared "raise:19"
"ZPlayer" declared "fold:0"
"['KLChen2PokerPlayer']" won the round 39 (stack = {'ZPlayer': 1260, 'NitWinWin': 920, 'Jinkun': 1003, 'YueShi': 910, 'JoyoPlayer': 0, 'ZifengFoldMan': 915, 'EvanPlayer': 2221, 'KLChen2PokerPlayer': 771})
player [ZPlayer] gets hole card ['S8', 'S9'], current stack 1260
player [NitWinWin] gets hole card ['H5', 'CQ'], current stack 920
player [Jinkun] gets hole card ['D8', 'H2'], current stack 1003
player [YueShi] gets hole card ['ST', 'H3'], current stack 910
player [ZifengFoldMan] gets hole card ['SQ', 'C5'], current stack 910
player [EvanPlayer] gets hole card ['HK', 'C8'], current stack 2211
player [KLChen2PokerPlayer] gets hole card ['C2', 'DA'], current stack 771
Started the round 40
Street "preflop" started. (community card = [])
"KLChen2PokerPlayer" declared "raise:19"
"ZPlayer" declared "call:19"
"NitWinWin" declared "fold:0"
"Jinkun" declared "fold:19"
"YueShi" declared "fold:0"
"ZifengFoldMan" declared "fold:0"
"EvanPlayer" declared "fold:19"
Street "flop" started. (community card = ['HA', 'SJ', 'C3'])
"KLChen2PokerPlayer" declared "raise:24"
"ZPlayer" declared "fold:0"
"['KLChen2PokerPlayer']" won the round 40 (stack = {'ZPlayer': 1241, 'NitWinWin': 920, 'Jinkun': 1003, 'YueShi': 910, 'JoyoPlayer': 0, 'ZifengFoldMan': 910, 'EvanPlayer': 2211, 'KLChen2PokerPlayer': 805})
player [ZPlayer] gets hole card ['CJ', 'H8'], current stack 1241
player [NitWinWin] gets hole card ['HK', 'ST'], current stack 920
player [Jinkun] gets hole card ['CT', 'H2'], current stack 1003
player [YueShi] gets hole card ['D8', 'S2'], current stack 910
player [ZifengFoldMan] gets hole card ['D6', 'DQ'], current stack 910
player [EvanPlayer] gets hole card ['SK', 'HT'], current stack 2206
player [KLChen2PokerPlayer] gets hole card ['H7', 'C9'], current stack 795
Started the round 41
Street "preflop" started. (community card = [])
"ZPlayer" declared "call:10"
"NitWinWin" declared "fold:0"
"Jinkun" declared "fold:10"
"YueShi" declared "fold:0"
"ZifengFoldMan" declared "fold:0"
"EvanPlayer" declared "fold:10"
"KLChen2PokerPlayer" declared "call:10"
Street "flop" started. (community card = ['S6', 'D4', 'D7'])
"KLChen2PokerPlayer" declared "raise:23"
"ZPlayer" declared "fold:0"
"['KLChen2PokerPlayer']" won the round 41 (stack = {'ZPlayer': 1231, 'NitWinWin': 920, 'Jinkun': 1003, 'YueShi': 910, 'JoyoPlayer': 0, 'ZifengFoldMan': 910, 'EvanPlayer': 2206, 'KLChen2PokerPlayer': 820})
player [ZPlayer] gets hole card ['DA', 'H6'], current stack 1221
player [NitWinWin] gets hole card ['SK', 'H8'], current stack 920
player [Jinkun] gets hole card ['S7', 'HQ'], current stack 1003
player [YueShi] gets hole card ['D4', 'S9'], current stack 910
player [ZifengFoldMan] gets hole card ['S6', 'HK'], current stack 910
player [EvanPlayer] gets hole card ['DT', 'D6'], current stack 2206
player [KLChen2PokerPlayer] gets hole card ['HT', 'SA'], current stack 815
Started the round 42
Street "preflop" started. (community card = [])
"NitWinWin" declared "fold:0"
"Jinkun" declared "fold:10"
"YueShi" declared "fold:0"
"ZifengFoldMan" declared "fold:0"
"EvanPlayer" declared "fold:10"
"KLChen2PokerPlayer" declared "raise:17"
"ZPlayer" declared "call:17"
Street "flop" started. (community card = ['C3', 'D9', 'S8'])
"KLChen2PokerPlayer" declared "raise:15"
"ZPlayer" declared "fold:0"
"['KLChen2PokerPlayer']" won the round 42 (stack = {'ZPlayer': 1214, 'NitWinWin': 920, 'Jinkun': 1003, 'YueShi': 910, 'JoyoPlayer': 0, 'ZifengFoldMan': 910, 'EvanPlayer': 2206, 'KLChen2PokerPlayer': 837})
player [ZPlayer] gets hole card ['H7', 'HA'], current stack 1209
player [NitWinWin] gets hole card ['D4', 'S2'], current stack 910
player [Jinkun] gets hole card ['CJ', 'H8'], current stack 1003
player [YueShi] gets hole card ['DJ', 'CK'], current stack 910
player [ZifengFoldMan] gets hole card ['C7', 'H4'], current stack 910
player [EvanPlayer] gets hole card ['CT', 'C6'], current stack 2206
player [KLChen2PokerPlayer] gets hole card ['C5', 'SJ'], current stack 837
Started the round 43
Street "preflop" started. (community card = [])
"Jinkun" declared "fold:10"
"YueShi" declared "fold:0"
"ZifengFoldMan" declared "fold:0"
"EvanPlayer" declared "fold:10"
"KLChen2PokerPlayer" declared "call:10"
"ZPlayer" declared "raise:15"
"NitWinWin" declared "fold:0"
"KLChen2PokerPlayer" declared "fold:0"
"['ZPlayer']" won the round 43 (stack = {'ZPlayer': 1234, 'NitWinWin': 910, 'Jinkun': 1003, 'YueShi': 910, 'JoyoPlayer': 0, 'ZifengFoldMan': 910, 'EvanPlayer': 2206, 'KLChen2PokerPlayer': 827})
player [ZPlayer] gets hole card ['S2', 'HA'], current stack 1234
player [NitWinWin] gets hole card ['CT', 'D6'], current stack 905
player [Jinkun] gets hole card ['SK', 'C7'], current stack 993
player [YueShi] gets hole card ['D8', 'SJ'], current stack 910
player [ZifengFoldMan] gets hole card ['C8', 'HQ'], current stack 910
player [EvanPlayer] gets hole card ['DJ', 'SQ'], current stack 2206
player [KLChen2PokerPlayer] gets hole card ['S7', 'S8'], current stack 827
Started the round 44
Street "preflop" started. (community card = [])
"YueShi" declared "fold:0"
"ZifengFoldMan" declared "fold:0"
"EvanPlayer" declared "call:10"
"KLChen2PokerPlayer" declared "raise:15"
"ZPlayer" declared "call:15"
"NitWinWin" declared "fold:0"
"Jinkun" declared "call:15"
"EvanPlayer" declared "call:15"
Street "flop" started. (community card = ['CK', 'C4', 'C5'])
"Jinkun" declared "call:0"
"EvanPlayer" declared "fold:0"
"KLChen2PokerPlayer" declared "call:0"
"ZPlayer" declared "call:0"
Street "turn" started. (community card = ['CK', 'C4', 'C5', 'S5'])
"Jinkun" declared "call:0"
"KLChen2PokerPlayer" declared "call:0"
"ZPlayer" declared "call:0"
Street "river" started. (community card = ['CK', 'C4', 'C5', 'S5', 'H8'])
"Jinkun" declared "call:0"
"KLChen2PokerPlayer" declared "call:0"
"ZPlayer" declared "call:0"
"['Jinkun']" won the round 44 (stack = {'ZPlayer': 1219, 'NitWinWin': 905, 'Jinkun': 1053, 'YueShi': 910, 'JoyoPlayer': 0, 'ZifengFoldMan': 910, 'EvanPlayer': 2191, 'KLChen2PokerPlayer': 812})
player [ZPlayer] gets hole card ['DQ', 'DK'], current stack 1219
player [NitWinWin] gets hole card ['S8', 'D3'], current stack 905
player [Jinkun] gets hole card ['DT', 'H2'], current stack 1048
player [YueShi] gets hole card ['HQ', 'D4'], current stack 900
player [ZifengFoldMan] gets hole card ['CK', 'ST'], current stack 910
player [EvanPlayer] gets hole card ['C5', 'S2'], current stack 2191
player [KLChen2PokerPlayer] gets hole card ['D2', 'D7'], current stack 812
Started the round 45
Street "preflop" started. (community card = [])
"ZifengFoldMan" declared "fold:0"
"EvanPlayer" declared "call:10"
"KLChen2PokerPlayer" declared "call:10"
"ZPlayer" declared "raise:15"
"NitWinWin" declared "fold:0"
"Jinkun" declared "fold:15"
"YueShi" declared "fold:0"
"EvanPlayer" declared "fold:15"
"KLChen2PokerPlayer" declared "fold:0"
"['ZPlayer']" won the round 45 (stack = {'ZPlayer': 1254, 'NitWinWin': 905, 'Jinkun': 1048, 'YueShi': 900, 'JoyoPlayer': 0, 'ZifengFoldMan': 910, 'EvanPlayer': 2181, 'KLChen2PokerPlayer': 802})
player [ZPlayer] gets hole card ['HJ', 'SA'], current stack 1254
player [NitWinWin] gets hole card ['C4', 'CT'], current stack 905
player [Jinkun] gets hole card ['C8', 'C2'], current stack 1048
player [YueShi] gets hole card ['HK', 'H5'], current stack 895
player [ZifengFoldMan] gets hole card ['SJ', 'CK'], current stack 900
player [EvanPlayer] gets hole card ['DK', 'SK'], current stack 2181
player [KLChen2PokerPlayer] gets hole card ['ST', 'H3'], current stack 802
Started the round 46
Street "preflop" started. (community card = [])
"EvanPlayer" declared "raise:2181"
"KLChen2PokerPlayer" declared "fold:0"
"ZPlayer" declared "fold:0"
"NitWinWin" declared "fold:0"
"Jinkun" declared "fold:2181"
"YueShi" declared "fold:0"
"ZifengFoldMan" declared "fold:0"
"['EvanPlayer']" won the round 46 (stack = {'ZPlayer': 1254, 'NitWinWin': 905, 'Jinkun': 1048, 'YueShi': 895, 'JoyoPlayer': 0, 'ZifengFoldMan': 900, 'EvanPlayer': 2196, 'KLChen2PokerPlayer': 802})
player [ZPlayer] gets hole card ['D5', 'D9'], current stack 1254
player [NitWinWin] gets hole card ['CJ', 'ST'], current stack 905
player [Jinkun] gets hole card ['HT', 'HJ'], current stack 1048
player [YueShi] gets hole card ['C4', 'H9'], current stack 895
player [ZifengFoldMan] gets hole card ['S9', 'D4'], current stack 895
player [EvanPlayer] gets hole card ['C5', 'H8'], current stack 2186
player [KLChen2PokerPlayer] gets hole card ['HA', 'H4'], current stack 802
Started the round 47
Street "preflop" started. (community card = [])
"KLChen2PokerPlayer" declared "raise:24"
"ZPlayer" declared "fold:0"
"NitWinWin" declared "fold:0"
"Jinkun" declared "fold:24"
"YueShi" declared "fold:0"
"ZifengFoldMan" declared "fold:0"
"EvanPlayer" declared "fold:24"
"['KLChen2PokerPlayer']" won the round 47 (stack = {'ZPlayer': 1254, 'NitWinWin': 905, 'Jinkun': 1048, 'YueShi': 895, 'JoyoPlayer': 0, 'ZifengFoldMan': 895, 'EvanPlayer': 2186, 'KLChen2PokerPlayer': 817})
player [ZPlayer] gets hole card ['HA', 'S9'], current stack 1254
player [NitWinWin] gets hole card ['H4', 'D4'], current stack 905
player [Jinkun] gets hole card ['HJ', 'S4'], current stack 1048
player [YueShi] gets hole card ['H2', 'H3'], current stack 895
player [ZifengFoldMan] gets hole card ['DA', 'D5'], current stack 895
player [EvanPlayer] gets hole card ['H5', 'C7'], current stack 2181
player [KLChen2PokerPlayer] gets hole card ['D7', 'CK'], current stack 807
Started the round 48
Street "preflop" started. (community card = [])
"ZPlayer" declared "raise:15"
"NitWinWin" declared "fold:0"
"Jinkun" declared "fold:15"
"YueShi" declared "fold:0"
"ZifengFoldMan" declared "fold:0"
"EvanPlayer" declared "fold:15"
"KLChen2PokerPlayer" declared "raise:20"
"ZPlayer" declared "call:20"
Street "flop" started. (community card = ['D3', 'H7', 'S5'])
"KLChen2PokerPlayer" declared "raise:34"
"ZPlayer" declared "fold:0"
"['KLChen2PokerPlayer']" won the round 48 (stack = {'ZPlayer': 1234, 'NitWinWin': 905, 'Jinkun': 1048, 'YueShi': 895, 'JoyoPlayer': 0, 'ZifengFoldMan': 895, 'EvanPlayer': 2181, 'KLChen2PokerPlayer': 842})
player [ZPlayer] gets hole card ['DQ', 'CJ'], current stack 1224
player [NitWinWin] gets hole card ['H7', 'HQ'], current stack 905
player [Jinkun] gets hole card ['S7', 'H9'], current stack 1048
player [YueShi] gets hole card ['DA', 'D4'], current stack 895
player [ZifengFoldMan] gets hole card ['C7', 'SK'], current stack 895
player [EvanPlayer] gets hole card ['D7', 'D9'], current stack 2181
player [KLChen2PokerPlayer] gets hole card ['D2', 'CT'], current stack 837
Started the round 49
Street "preflop" started. (community card = [])
"NitWinWin" declared "fold:0"
"Jinkun" declared "fold:10"
"YueShi" declared "fold:0"
"ZifengFoldMan" declared "fold:0"
"EvanPlayer" declared "fold:10"
"KLChen2PokerPlayer" declared "fold:0"
"['ZPlayer']" won the round 49 (stack = {'ZPlayer': 1239, 'NitWinWin': 905, 'Jinkun': 1048, 'YueShi': 895, 'JoyoPlayer': 0, 'ZifengFoldMan': 895, 'EvanPlayer': 2181, 'KLChen2PokerPlayer': 837})
player [ZPlayer] gets hole card ['SA', 'D9'], current stack 1234
player [NitWinWin] gets hole card ['D2', 'H2'], current stack 895
player [Jinkun] gets hole card ['S5', 'C8'], current stack 1048
player [YueShi] gets hole card ['S7', 'C6'], current stack 895
player [ZifengFoldMan] gets hole card ['H5', 'H9'], current stack 895
player [EvanPlayer] gets hole card ['HK', 'DQ'], current stack 2181
player [KLChen2PokerPlayer] gets hole card ['DK', 'C2'], current stack 837
Started the round 50
Street "preflop" started. (community card = [])
"Jinkun" declared "fold:10"
"YueShi" declared "fold:0"
"ZifengFoldMan" declared "fold:0"
"EvanPlayer" declared "call:10"
"KLChen2PokerPlayer" declared "call:10"
"ZPlayer" declared "raise:15"
"NitWinWin" declared "fold:0"
"EvanPlayer" declared "raise:2181"
"KLChen2PokerPlayer" declared "fold:0"
"ZPlayer" declared "fold:0"
"['EvanPlayer']" won the round 50 (stack = {'ZPlayer': 1224, 'NitWinWin': 895, 'Jinkun': 1048, 'YueShi': 895, 'JoyoPlayer': 0, 'ZifengFoldMan': 895, 'EvanPlayer': 2216, 'KLChen2PokerPlayer': 827})

Game Results:
------------------------------------------------------------
Game 1:
Winner: EvanPlayer (stack: 2216)
All players' stacks:
  ZPlayer: 1224
  NitWinWin: 895
  Jinkun: 1048
  YueShi: 895
  JoyoPlayer: 0
  ZifengFoldMan: 895
  EvanPlayer: 2216
  KLChen2PokerPlayer: 827
------------------------------------------------------------
