player [ZPlayer] gets hole card ['DA', 'S9'], current stack 1000
player [NitWinWin] gets hole card ['C9', 'CK'], current stack 995
player [Jinkun] gets hole card ['CT', 'D9'], current stack 990
player [YueShi] gets hole card ['S4', 'H8'], current stack 1000
player [JoyoPlayer] gets hole card ['DJ', 'CQ'], current stack 1000
player [ZifengFoldMan] gets hole card ['D2', 'H6'], current stack 1000
player [EvanPlayer] gets hole card ['CA', 'CJ'], current stack 1000
player [KLChen2PokerPlayer] gets hole card ['H3', 'S6'], current stack 1000
Started the round 1
Street "preflop" started. (community card = [])
"YueShi" declared "fold:0"
"JoyoPlayer" declared "fold:0"
"ZifengFoldMan" declared "fold:0"
"EvanPlayer" declared "raise:1000"
"KLChen2PokerPlayer" declared "fold:0"
"ZPlayer" declared "fold:0"
"NitWinWin" declared "fold:0"
"Jinkun" declared "fold:1000"
"['EvanPlayer']" won the round 1 (stack = {'ZPlayer': 1000, 'NitWinWin': 995, 'Jinkun': 990, 'YueShi': 1000, 'JoyoPlayer': 1000, 'ZifengFoldMan': 1000, 'EvanPlayer': 1015, 'KLChen2PokerPlayer': 1000})
player [ZPlayer] gets hole card ['S8', 'D9'], current stack 1000
player [NitWinWin] gets hole card ['CQ', 'H5'], current stack 995
player [Jinkun] gets hole card ['HJ', 'D6'], current stack 985
player [YueShi] gets hole card ['S5', 'S4'], current stack 990
player [JoyoPlayer] gets hole card ['H6', 'DQ'], current stack 1000
player [ZifengFoldMan] gets hole card ['C4', 'S7'], current stack 1000
player [EvanPlayer] gets hole card ['SQ', 'S6'], current stack 1015
player [KLChen2PokerPlayer] gets hole card ['ST', 'S3'], current stack 1000
Started the round 2
Street "preflop" started. (community card = [])
"JoyoPlayer" declared "fold:0"
"ZifengFoldMan" declared "fold:0"
"EvanPlayer" declared "raise:1015"
"KLChen2PokerPlayer" declared "fold:0"
"ZPlayer" declared "fold:0"
"NitWinWin" declared "fold:0"
"Jinkun" declared "fold:1015"
"YueShi" declared "fold:0"
"['EvanPlayer']" won the round 2 (stack = {'ZPlayer': 1000, 'NitWinWin': 995, 'Jinkun': 985, 'YueShi': 990, 'JoyoPlayer': 1000, 'ZifengFoldMan': 1000, 'EvanPlayer': 1030, 'KLChen2PokerPlayer': 1000})
player [ZPlayer] gets hole card ['CK', 'C4'], current stack 1000
player [NitWinWin] gets hole card ['S5', 'SK'], current stack 995
player [Jinkun] gets hole card ['DA', 'C8'], current stack 985
player [YueShi] gets hole card ['D3', 'D7'], current stack 985
player [JoyoPlayer] gets hole card ['DT', 'H9'], current stack 990
player [ZifengFoldMan] gets hole card ['H4', 'H3'], current stack 1000
player [EvanPlayer] gets hole card ['HK', 'S2'], current stack 1030
player [KLChen2PokerPlayer] gets hole card ['D5', 'S7'], current stack 1000
Started the round 3
Street "preflop" started. (community card = [])
"ZifengFoldMan" declared "fold:0"
"EvanPlayer" declared "raise:1030"
"KLChen2PokerPlayer" declared "fold:0"
"ZPlayer" declared "fold:0"
"NitWinWin" declared "fold:0"
"Jinkun" declared "fold:1030"
"YueShi" declared "fold:0"
"JoyoPlayer" declared "call:1030"
Street "flop" started. (community card = ['C7', 'SJ', 'D8'])
Street "turn" started. (community card = ['C7', 'SJ', 'D8', 'C9'])
Street "river" started. (community card = ['C7', 'SJ', 'D8', 'C9', 'CT'])
"['JoyoPlayer', 'EvanPlayer']" won the round 3 (stack = {'ZPlayer': 1000, 'NitWinWin': 995, 'Jinkun': 985, 'YueShi': 985, 'JoyoPlayer': 1002, 'ZifengFoldMan': 1000, 'EvanPlayer': 1032, 'KLChen2PokerPlayer': 1000})
player [ZPlayer] gets hole card ['HQ', 'C6'], current stack 1000
player [NitWinWin] gets hole card ['H9', 'H4'], current stack 995
player [Jinkun] gets hole card ['CA', 'H5'], current stack 985
player [YueShi] gets hole card ['S9', 'S7'], current stack 985
player [JoyoPlayer] gets hole card ['ST', 'S4'], current stack 997
player [ZifengFoldMan] gets hole card ['D6', 'DJ'], current stack 990
player [EvanPlayer] gets hole card ['SA', 'C9'], current stack 1032
player [KLChen2PokerPlayer] gets hole card ['H3', 'S5'], current stack 1000
Started the round 4
Street "preflop" started. (community card = [])
"EvanPlayer" declared "raise:1032"
"KLChen2PokerPlayer" declared "fold:0"
"ZPlayer" declared "fold:0"
"NitWinWin" declared "fold:0"
"Jinkun" declared "fold:1032"
"YueShi" declared "fold:0"
"JoyoPlayer" declared "call:1032"
"ZifengFoldMan" declared "fold:0"
Street "flop" started. (community card = ['DK', 'DA', 'HJ'])
Street "turn" started. (community card = ['DK', 'DA', 'HJ', 'H2'])
Street "river" started. (community card = ['DK', 'DA', 'HJ', 'H2', 'D7'])
"['EvanPlayer']" won the round 4 (stack = {'ZPlayer': 1000, 'NitWinWin': 995, 'Jinkun': 985, 'YueShi': 985, 'JoyoPlayer': 0, 'ZifengFoldMan': 990, 'EvanPlayer': 2044, 'KLChen2PokerPlayer': 1000})
player [ZPlayer] gets hole card ['SK', 'S9'], current stack 1000
player [NitWinWin] gets hole card ['D7', 'CA'], current stack 995
player [Jinkun] gets hole card ['CQ', 'DK'], current stack 985
player [YueShi] gets hole card ['D8', 'C3'], current stack 985
player [ZifengFoldMan] gets hole card ['S4', 'H4'], current stack 990
player [EvanPlayer] gets hole card ['D9', 'HA'], current stack 2039
player [KLChen2PokerPlayer] gets hole card ['S6', 'C6'], current stack 990
Started the round 5
Street "preflop" started. (community card = [])
"ZPlayer" declared "raise:15"
"NitWinWin" declared "fold:0"
"Jinkun" declared "fold:15"
"YueShi" declared "fold:0"
"ZifengFoldMan" declared "fold:0"
"EvanPlayer" declared "raise:2044"
"KLChen2PokerPlayer" declared "fold:0"
"ZPlayer" declared "fold:0"
"['EvanPlayer']" won the round 5 (stack = {'ZPlayer': 985, 'NitWinWin': 995, 'Jinkun': 985, 'YueShi': 985, 'JoyoPlayer': 0, 'ZifengFoldMan': 990, 'EvanPlayer': 2069, 'KLChen2PokerPlayer': 990})
player [ZPlayer] gets hole card ['H8', 'DA'], current stack 975
player [NitWinWin] gets hole card ['S3', 'D4'], current stack 995
player [Jinkun] gets hole card ['DJ', 'CT'], current stack 985
player [YueShi] gets hole card ['S5', 'C7'], current stack 985
player [ZifengFoldMan] gets hole card ['HT', 'D3'], current stack 990
player [EvanPlayer] gets hole card ['ST', 'D2'], current stack 2069
player [KLChen2PokerPlayer] gets hole card ['C8', 'HQ'], current stack 985
Started the round 6
Street "preflop" started. (community card = [])
"NitWinWin" declared "fold:0"
"Jinkun" declared "fold:10"
"YueShi" declared "fold:0"
"ZifengFoldMan" declared "fold:0"
"EvanPlayer" declared "fold:10"
"KLChen2PokerPlayer" declared "call:10"
"ZPlayer" declared "raise:15"
"KLChen2PokerPlayer" declared "call:15"
Street "flop" started. (community card = ['S9', 'H5', 'D9'])
"KLChen2PokerPlayer" declared "call:0"
"ZPlayer" declared "call:0"
Street "turn" started. (community card = ['S9', 'H5', 'D9', 'C3'])
"KLChen2PokerPlayer" declared "call:0"
"ZPlayer" declared "call:0"
Street "river" started. (community card = ['S9', 'H5', 'D9', 'C3', 'D8'])
"KLChen2PokerPlayer" declared "raise:176"
"ZPlayer" declared "fold:0"
"['KLChen2PokerPlayer']" won the round 6 (stack = {'ZPlayer': 970, 'NitWinWin': 995, 'Jinkun': 985, 'YueShi': 985, 'JoyoPlayer': 0, 'ZifengFoldMan': 990, 'EvanPlayer': 2069, 'KLChen2PokerPlayer': 1005})
player [ZPlayer] gets hole card ['CT', 'H6'], current stack 965
player [NitWinWin] gets hole card ['C2', 'DT'], current stack 985
player [Jinkun] gets hole card ['H8', 'D4'], current stack 985
player [YueShi] gets hole card ['HJ', 'HK'], current stack 985
player [ZifengFoldMan] gets hole card ['C5', 'D2'], current stack 990
player [EvanPlayer] gets hole card ['D8', 'H5'], current stack 2069
player [KLChen2PokerPlayer] gets hole card ['C4', 'D7'], current stack 1005
Started the round 7
Street "preflop" started. (community card = [])
"Jinkun" declared "fold:10"
"YueShi" declared "fold:0"
"ZifengFoldMan" declared "fold:0"
"EvanPlayer" declared "fold:10"
"KLChen2PokerPlayer" declared "fold:0"
"ZPlayer" declared "raise:15"
"NitWinWin" declared "fold:0"
"['ZPlayer']" won the round 7 (stack = {'ZPlayer': 980, 'NitWinWin': 985, 'Jinkun': 985, 'YueShi': 985, 'JoyoPlayer': 0, 'ZifengFoldMan': 990, 'EvanPlayer': 2069, 'KLChen2PokerPlayer': 1005})
player [ZPlayer] gets hole card ['S8', 'S3'], current stack 980
player [NitWinWin] gets hole card ['H5', 'H3'], current stack 980
player [Jinkun] gets hole card ['HK', 'H4'], current stack 975
player [YueShi] gets hole card ['H9', 'DK'], current stack 985
player [ZifengFoldMan] gets hole card ['CK', 'S2'], current stack 990
player [EvanPlayer] gets hole card ['C4', 'D3'], current stack 2069
player [KLChen2PokerPlayer] gets hole card ['S4', 'D6'], current stack 1005
Started the round 8
Street "preflop" started. (community card = [])
"YueShi" declared "fold:0"
"ZifengFoldMan" declared "fold:0"
"EvanPlayer" declared "fold:10"
"KLChen2PokerPlayer" declared "fold:0"
"ZPlayer" declared "call:10"
"NitWinWin" declared "fold:0"
"Jinkun" declared "call:10"
Street "flop" started. (community card = ['HT', 'HJ', 'H7'])
"Jinkun" declared "raise:12"
"ZPlayer" declared "fold:0"
"['Jinkun']" won the round 8 (stack = {'ZPlayer': 970, 'NitWinWin': 980, 'Jinkun': 1000, 'YueShi': 985, 'JoyoPlayer': 0, 'ZifengFoldMan': 990, 'EvanPlayer': 2069, 'KLChen2PokerPlayer': 1005})
player [ZPlayer] gets hole card ['D8', 'H8'], current stack 970
player [NitWinWin] gets hole card ['DK', 'C7'], current stack 980
player [Jinkun] gets hole card ['HT', 'H3'], current stack 995
player [YueShi] gets hole card ['SJ', 'H2'], current stack 975
player [ZifengFoldMan] gets hole card ['H6', 'S8'], current stack 990
player [EvanPlayer] gets hole card ['C5', 'CT'], current stack 2069
player [KLChen2PokerPlayer] gets hole card ['D7', 'HA'], current stack 1005
Started the round 9
Street "preflop" started. (community card = [])
"ZifengFoldMan" declared "fold:0"
"EvanPlayer" declared "call:10"
"KLChen2PokerPlayer" declared "raise:19"
"ZPlayer" declared "call:19"
"NitWinWin" declared "fold:0"
"Jinkun" declared "fold:19"
"YueShi" declared "fold:0"
"EvanPlayer" declared "fold:19"
Street "flop" started. (community card = ['CQ', 'ST', 'S6'])
"KLChen2PokerPlayer" declared "call:0"
"ZPlayer" declared "call:0"
Street "turn" started. (community card = ['CQ', 'ST', 'S6', 'HK'])
"KLChen2PokerPlayer" declared "call:0"
"ZPlayer" declared "call:0"
Street "river" started. (community card = ['CQ', 'ST', 'S6', 'HK', 'S7'])
"KLChen2PokerPlayer" declared "call:0"
"ZPlayer" declared "call:0"
"['ZPlayer']" won the round 9 (stack = {'ZPlayer': 1014, 'NitWinWin': 980, 'Jinkun': 995, 'YueShi': 975, 'JoyoPlayer': 0, 'ZifengFoldMan': 990, 'EvanPlayer': 2059, 'KLChen2PokerPlayer': 986})
player [ZPlayer] gets hole card ['S8', 'SA'], current stack 1014
player [NitWinWin] gets hole card ['SQ', 'C2'], current stack 980
player [Jinkun] gets hole card ['C7', 'D2'], current stack 995
player [YueShi] gets hole card ['S2', 'S6'], current stack 970
player [ZifengFoldMan] gets hole card ['D6', 'CJ'], current stack 980
player [EvanPlayer] gets hole card ['D4', 'CK'], current stack 2059
player [KLChen2PokerPlayer] gets hole card ['HJ', 'C3'], current stack 986
Started the round 10
Street "preflop" started. (community card = [])
"EvanPlayer" declared "raise:2059"
"KLChen2PokerPlayer" declared "fold:0"
"ZPlayer" declared "fold:0"
"NitWinWin" declared "fold:0"
"Jinkun" declared "fold:2059"
"YueShi" declared "fold:0"
"ZifengFoldMan" declared "fold:0"
"['EvanPlayer']" won the round 10 (stack = {'ZPlayer': 1014, 'NitWinWin': 980, 'Jinkun': 995, 'YueShi': 970, 'JoyoPlayer': 0, 'ZifengFoldMan': 980, 'EvanPlayer': 2074, 'KLChen2PokerPlayer': 986})
player [ZPlayer] gets hole card ['D3', 'D9'], current stack 1014
player [NitWinWin] gets hole card ['C7', 'C5'], current stack 980
player [Jinkun] gets hole card ['H6', 'C3'], current stack 995
player [YueShi] gets hole card ['DA', 'H8'], current stack 970
player [ZifengFoldMan] gets hole card ['H5', 'H3'], current stack 975
player [EvanPlayer] gets hole card ['S5', 'CQ'], current stack 2064
player [KLChen2PokerPlayer] gets hole card ['DJ', 'D7'], current stack 986
Started the round 11
Street "preflop" started. (community card = [])
"KLChen2PokerPlayer" declared "raise:15"
"ZPlayer" declared "call:15"
"NitWinWin" declared "fold:0"
"Jinkun" declared "fold:15"
"YueShi" declared "fold:0"
"ZifengFoldMan" declared "fold:0"
"EvanPlayer" declared "fold:15"
Street "flop" started. (community card = ['HT', 'CK', 'D5'])
"KLChen2PokerPlayer" declared "call:0"
"ZPlayer" declared "call:0"
Street "turn" started. (community card = ['HT', 'CK', 'D5', 'CJ'])
"KLChen2PokerPlayer" declared "raise:94"
"ZPlayer" declared "fold:0"
"['KLChen2PokerPlayer']" won the round 11 (stack = {'ZPlayer': 999, 'NitWinWin': 980, 'Jinkun': 995, 'YueShi': 970, 'JoyoPlayer': 0, 'ZifengFoldMan': 975, 'EvanPlayer': 2064, 'KLChen2PokerPlayer': 1016})
player [ZPlayer] gets hole card ['SQ', 'D3'], current stack 999
player [NitWinWin] gets hole card ['CK', 'CJ'], current stack 980
player [Jinkun] gets hole card ['S3', 'S8'], current stack 995
player [YueShi] gets hole card ['D9', 'H3'], current stack 970
player [ZifengFoldMan] gets hole card ['C5', 'S6'], current stack 975
player [EvanPlayer] gets hole card ['H8', 'DQ'], current stack 2059
player [KLChen2PokerPlayer] gets hole card ['D5', 'H6'], current stack 1006
Started the round 12
Street "preflop" started. (community card = [])
"ZPlayer" declared "call:10"
"NitWinWin" declared "fold:0"
"Jinkun" declared "fold:10"
"YueShi" declared "fold:0"
"ZifengFoldMan" declared "fold:0"
"EvanPlayer" declared "raise:2064"
"KLChen2PokerPlayer" declared "fold:0"
"ZPlayer" declared "fold:0"
"['EvanPlayer']" won the round 12 (stack = {'ZPlayer': 989, 'NitWinWin': 980, 'Jinkun': 995, 'YueShi': 970, 'JoyoPlayer': 0, 'ZifengFoldMan': 975, 'EvanPlayer': 2084, 'KLChen2PokerPlayer': 1006})
player [ZPlayer] gets hole card ['S7', 'HQ'], current stack 979
player [NitWinWin] gets hole card ['C7', 'H6'], current stack 980
player [Jinkun] gets hole card ['S9', 'C5'], current stack 995
player [YueShi] gets hole card ['SJ', 'C4'], current stack 970
player [ZifengFoldMan] gets hole card ['D4', 'S4'], current stack 975
player [EvanPlayer] gets hole card ['C6', 'SQ'], current stack 2084
player [KLChen2PokerPlayer] gets hole card ['C8', 'S8'], current stack 1001
Started the round 13
Street "preflop" started. (community card = [])
"NitWinWin" declared "fold:0"
"Jinkun" declared "fold:10"
"YueShi" declared "fold:0"
"ZifengFoldMan" declared "fold:0"
"EvanPlayer" declared "fold:10"
"KLChen2PokerPlayer" declared "raise:21"
"ZPlayer" declared "call:21"
Street "flop" started. (community card = ['DT', 'DA', 'C3'])
"KLChen2PokerPlayer" declared "raise:16"
"ZPlayer" declared "fold:0"
"['KLChen2PokerPlayer']" won the round 13 (stack = {'ZPlayer': 968, 'NitWinWin': 980, 'Jinkun': 995, 'YueShi': 970, 'JoyoPlayer': 0, 'ZifengFoldMan': 975, 'EvanPlayer': 2084, 'KLChen2PokerPlayer': 1027})
player [ZPlayer] gets hole card ['C6', 'HJ'], current stack 963
player [NitWinWin] gets hole card ['DA', 'CT'], current stack 970
player [Jinkun] gets hole card ['SK', 'D2'], current stack 995
player [YueShi] gets hole card ['CK', 'H3'], current stack 970
player [ZifengFoldMan] gets hole card ['SJ', 'C5'], current stack 975
player [EvanPlayer] gets hole card ['SA', 'H6'], current stack 2084
player [KLChen2PokerPlayer] gets hole card ['DK', 'C3'], current stack 1027
Started the round 14
Street "preflop" started. (community card = [])
"Jinkun" declared "fold:10"
"YueShi" declared "fold:0"
"ZifengFoldMan" declared "fold:0"
"EvanPlayer" declared "call:10"
"KLChen2PokerPlayer" declared "call:10"
"ZPlayer" declared "call:10"
"NitWinWin" declared "fold:0"
Street "flop" started. (community card = ['C7', 'CQ', 'C8'])
"ZPlayer" declared "raise:10"
"EvanPlayer" declared "raise:2074"
"KLChen2PokerPlayer" declared "fold:0"
"ZPlayer" declared "fold:0"
"['EvanPlayer']" won the round 14 (stack = {'ZPlayer': 948, 'NitWinWin': 970, 'Jinkun': 995, 'YueShi': 970, 'JoyoPlayer': 0, 'ZifengFoldMan': 975, 'EvanPlayer': 2124, 'KLChen2PokerPlayer': 1017})
player [ZPlayer] gets hole card ['C9', 'CA'], current stack 948
player [NitWinWin] gets hole card ['H8', 'S7'], current stack 965
player [Jinkun] gets hole card ['SK', 'DJ'], current stack 985
player [YueShi] gets hole card ['S3', 'CT'], current stack 970
player [ZifengFoldMan] gets hole card ['D2', 'ST'], current stack 975
player [EvanPlayer] gets hole card ['H5', 'D6'], current stack 2124
player [KLChen2PokerPlayer] gets hole card ['HA', 'D5'], current stack 1017
Started the round 15
Street "preflop" started. (community card = [])
"YueShi" declared "fold:0"
"ZifengFoldMan" declared "fold:0"
"EvanPlayer" declared "call:10"
"KLChen2PokerPlayer" declared "raise:28"
"ZPlayer" declared "call:28"
"NitWinWin" declared "fold:0"
"Jinkun" declared "call:28"
"EvanPlayer" declared "fold:28"
Street "flop" started. (community card = ['C5', 'C7', 'H6'])
"Jinkun" declared "call:0"
"KLChen2PokerPlayer" declared "call:0"
"ZPlayer" declared "raise:49"
"Jinkun" declared "fold:49"
"KLChen2PokerPlayer" declared "fold:0"
"['ZPlayer']" won the round 15 (stack = {'ZPlayer': 1019, 'NitWinWin': 965, 'Jinkun': 967, 'YueShi': 970, 'JoyoPlayer': 0, 'ZifengFoldMan': 975, 'EvanPlayer': 2114, 'KLChen2PokerPlayer': 989})
player [ZPlayer] gets hole card ['DT', 'S8'], current stack 1019
player [NitWinWin] gets hole card ['HJ', 'D4'], current stack 965
player [Jinkun] gets hole card ['S3', 'CJ'], current stack 962
player [YueShi] gets hole card ['H3', 'CT'], current stack 960
player [ZifengFoldMan] gets hole card ['S4', 'DA'], current stack 975
player [EvanPlayer] gets hole card ['HK', 'D5'], current stack 2114
player [KLChen2PokerPlayer] gets hole card ['D6', 'D9'], current stack 989
Started the round 16
Street "preflop" started. (community card = [])
"ZifengFoldMan" declared "fold:0"
"EvanPlayer" declared "call:10"
"KLChen2PokerPlayer" declared "raise:20"
"ZPlayer" declared "call:20"
"NitWinWin" declared "fold:0"
"Jinkun" declared "fold:20"
"YueShi" declared "fold:0"
"EvanPlayer" declared "fold:20"
Street "flop" started. (community card = ['SA', 'S7', 'C2'])
"KLChen2PokerPlayer" declared "call:0"
"ZPlayer" declared "call:0"
Street "turn" started. (community card = ['SA', 'S7', 'C2', 'D8'])
"KLChen2PokerPlayer" declared "call:0"
"ZPlayer" declared "raise:10"
"KLChen2PokerPlayer" declared "fold:0"
"['ZPlayer']" won the round 16 (stack = {'ZPlayer': 1064, 'NitWinWin': 965, 'Jinkun': 962, 'YueShi': 960, 'JoyoPlayer': 0, 'ZifengFoldMan': 975, 'EvanPlayer': 2104, 'KLChen2PokerPlayer': 969})
player [ZPlayer] gets hole card ['HK', 'CA'], current stack 1064
player [NitWinWin] gets hole card ['CJ', 'SK'], current stack 965
player [Jinkun] gets hole card ['D2', 'SJ'], current stack 962
player [YueShi] gets hole card ['H2', 'DA'], current stack 955
player [ZifengFoldMan] gets hole card ['H6', 'S9'], current stack 965
player [EvanPlayer] gets hole card ['SA', 'H5'], current stack 2104
player [KLChen2PokerPlayer] gets hole card ['H8', 'D9'], current stack 969
Started the round 17
Street "preflop" started. (community card = [])
"EvanPlayer" declared "raise:2104"
"KLChen2PokerPlayer" declared "fold:0"
"ZPlayer" declared "fold:0"
"NitWinWin" declared "fold:0"
"Jinkun" declared "fold:2104"
"YueShi" declared "fold:0"
"ZifengFoldMan" declared "fold:0"
"['EvanPlayer']" won the round 17 (stack = {'ZPlayer': 1064, 'NitWinWin': 965, 'Jinkun': 962, 'YueShi': 955, 'JoyoPlayer': 0, 'ZifengFoldMan': 965, 'EvanPlayer': 2119, 'KLChen2PokerPlayer': 969})
player [ZPlayer] gets hole card ['C7', 'S3'], current stack 1064
player [NitWinWin] gets hole card ['H3', 'DJ'], current stack 965
player [Jinkun] gets hole card ['DT', 'CT'], current stack 962
player [YueShi] gets hole card ['D9', 'C5'], current stack 955
player [ZifengFoldMan] gets hole card ['DK', 'H8'], current stack 960
player [EvanPlayer] gets hole card ['S7', 'SJ'], current stack 2109
player [KLChen2PokerPlayer] gets hole card ['C9', 'H2'], current stack 969
Started the round 18
Street "preflop" started. (community card = [])
"KLChen2PokerPlayer" declared "fold:0"
"ZPlayer" declared "call:10"
"NitWinWin" declared "fold:0"
"Jinkun" declared "fold:10"
"YueShi" declared "fold:0"
"ZifengFoldMan" declared "fold:0"
"EvanPlayer" declared "fold:10"
"['ZPlayer']" won the round 18 (stack = {'ZPlayer': 1079, 'NitWinWin': 965, 'Jinkun': 962, 'YueShi': 955, 'JoyoPlayer': 0, 'ZifengFoldMan': 960, 'EvanPlayer': 2109, 'KLChen2PokerPlayer': 969})
player [ZPlayer] gets hole card ['CQ', 'DK'], current stack 1079
player [NitWinWin] gets hole card ['H4', 'ST'], current stack 965
player [Jinkun] gets hole card ['D6', 'C9'], current stack 962
player [YueShi] gets hole card ['C7', 'C6'], current stack 955
player [ZifengFoldMan] gets hole card ['H2', 'CT'], current stack 960
player [EvanPlayer] gets hole card ['S4', 'HA'], current stack 2104
player [KLChen2PokerPlayer] gets hole card ['D9', 'DQ'], current stack 959
Started the round 19
Street "preflop" started. (community card = [])
"ZPlayer" declared "raise:15"
"NitWinWin" declared "fold:0"
"Jinkun" declared "fold:15"
"YueShi" declared "fold:0"
"ZifengFoldMan" declared "fold:0"
"EvanPlayer" declared "fold:15"
"KLChen2PokerPlayer" declared "raise:20"
"ZPlayer" declared "call:20"
Street "flop" started. (community card = ['D4', 'C5', 'S5'])
"KLChen2PokerPlayer" declared "call:0"
"ZPlayer" declared "call:0"
Street "turn" started. (community card = ['D4', 'C5', 'S5', 'CA'])
"KLChen2PokerPlayer" declared "call:0"
"ZPlayer" declared "call:0"
Street "river" started. (community card = ['D4', 'C5', 'S5', 'CA', 'H8'])
"KLChen2PokerPlayer" declared "call:0"
"ZPlayer" declared "call:0"
"['ZPlayer']" won the round 19 (stack = {'ZPlayer': 1104, 'NitWinWin': 965, 'Jinkun': 962, 'YueShi': 955, 'JoyoPlayer': 0, 'ZifengFoldMan': 960, 'EvanPlayer': 2104, 'KLChen2PokerPlayer': 949})
player [ZPlayer] gets hole card ['H8', 'SQ'], current stack 1094
player [NitWinWin] gets hole card ['H4', 'D6'], current stack 965
player [Jinkun] gets hole card ['CJ', 'H2'], current stack 962
player [YueShi] gets hole card ['H9', 'SA'], current stack 955
player [ZifengFoldMan] gets hole card ['C6', 'D4'], current stack 960
player [EvanPlayer] gets hole card ['C2', 'S3'], current stack 2104
player [KLChen2PokerPlayer] gets hole card ['HK', 'HA'], current stack 944
Started the round 20
Street "preflop" started. (community card = [])
"NitWinWin" declared "fold:0"
"Jinkun" declared "fold:10"
"YueShi" declared "fold:0"
"ZifengFoldMan" declared "fold:0"
"EvanPlayer" declared "fold:10"
"KLChen2PokerPlayer" declared "raise:18"
"ZPlayer" declared "call:18"
Street "flop" started. (community card = ['D7', 'CT', 'H6'])
"KLChen2PokerPlayer" declared "raise:18"
"ZPlayer" declared "fold:0"
"['KLChen2PokerPlayer']" won the round 20 (stack = {'ZPlayer': 1086, 'NitWinWin': 965, 'Jinkun': 962, 'YueShi': 955, 'JoyoPlayer': 0, 'ZifengFoldMan': 960, 'EvanPlayer': 2104, 'KLChen2PokerPlayer': 967})
player [ZPlayer] gets hole card ['C8', 'HQ'], current stack 1081
player [NitWinWin] gets hole card ['H6', 'H4'], current stack 955
player [Jinkun] gets hole card ['HJ', 'DK'], current stack 962
player [YueShi] gets hole card ['H8', 'D4'], current stack 955
player [ZifengFoldMan] gets hole card ['H5', 'SJ'], current stack 960
player [EvanPlayer] gets hole card ['CA', 'S9'], current stack 2104
player [KLChen2PokerPlayer] gets hole card ['D3', 'H3'], current stack 967
Started the round 21
Street "preflop" started. (community card = [])
"Jinkun" declared "fold:10"
"YueShi" declared "fold:0"
"ZifengFoldMan" declared "fold:0"
"EvanPlayer" declared "call:10"
"KLChen2PokerPlayer" declared "call:10"
"ZPlayer" declared "raise:15"
"NitWinWin" declared "fold:0"
"EvanPlayer" declared "fold:15"
"KLChen2PokerPlayer" declared "fold:0"
"['ZPlayer']" won the round 21 (stack = {'ZPlayer': 1116, 'NitWinWin': 955, 'Jinkun': 962, 'YueShi': 955, 'JoyoPlayer': 0, 'ZifengFoldMan': 960, 'EvanPlayer': 2094, 'KLChen2PokerPlayer': 957})
player [ZPlayer] gets hole card ['S2', 'D3'], current stack 1116
player [NitWinWin] gets hole card ['DT', 'C8'], current stack 950
player [Jinkun] gets hole card ['S3', 'SJ'], current stack 952
player [YueShi] gets hole card ['H9', 'D6'], current stack 955
player [ZifengFoldMan] gets hole card ['S9', 'S8'], current stack 960
player [EvanPlayer] gets hole card ['HQ', 'C2'], current stack 2094
player [KLChen2PokerPlayer] gets hole card ['HT', 'SA'], current stack 957
Started the round 22
Street "preflop" started. (community card = [])
"YueShi" declared "fold:0"
"ZifengFoldMan" declared "fold:0"
"EvanPlayer" declared "fold:10"
"KLChen2PokerPlayer" declared "raise:15"
"ZPlayer" declared "fold:0"
"NitWinWin" declared "fold:0"
"Jinkun" declared "fold:15"
"['KLChen2PokerPlayer']" won the round 22 (stack = {'ZPlayer': 1116, 'NitWinWin': 950, 'Jinkun': 952, 'YueShi': 955, 'JoyoPlayer': 0, 'ZifengFoldMan': 960, 'EvanPlayer': 2094, 'KLChen2PokerPlayer': 972})
player [ZPlayer] gets hole card ['HQ', 'C4'], current stack 1116
player [NitWinWin] gets hole card ['SA', 'D4'], current stack 950
player [Jinkun] gets hole card ['DA', 'S8'], current stack 947
player [YueShi] gets hole card ['CA', 'SK'], current stack 945
player [ZifengFoldMan] gets hole card ['H4', 'S6'], current stack 960
player [EvanPlayer] gets hole card ['DQ', 'SQ'], current stack 2094
player [KLChen2PokerPlayer] gets hole card ['D5', 'CK'], current stack 972
Started the round 23
Street "preflop" started. (community card = [])
"ZifengFoldMan" declared "fold:0"
"EvanPlayer" declared "raise:2094"
"KLChen2PokerPlayer" declared "fold:0"
"ZPlayer" declared "fold:0"
"NitWinWin" declared "fold:0"
"Jinkun" declared "fold:2094"
"YueShi" declared "fold:0"
"['EvanPlayer']" won the round 23 (stack = {'ZPlayer': 1116, 'NitWinWin': 950, 'Jinkun': 947, 'YueShi': 945, 'JoyoPlayer': 0, 'ZifengFoldMan': 960, 'EvanPlayer': 2109, 'KLChen2PokerPlayer': 972})
player [ZPlayer] gets hole card ['D6', 'DA'], current stack 1116
player [NitWinWin] gets hole card ['C4', 'CK'], current stack 950
player [Jinkun] gets hole card ['HK', 'S4'], current stack 947
player [YueShi] gets hole card ['CT', 'DK'], current stack 940
player [ZifengFoldMan] gets hole card ['D7', 'C7'], current stack 950
player [EvanPlayer] gets hole card ['D2', 'HA'], current stack 2109
player [KLChen2PokerPlayer] gets hole card ['SA', 'DJ'], current stack 972
Started the round 24
Street "preflop" started. (community card = [])
"EvanPlayer" declared "call:10"
"KLChen2PokerPlayer" declared "raise:15"
"ZPlayer" declared "call:15"
"NitWinWin" declared "fold:0"
"Jinkun" declared "fold:15"
"YueShi" declared "fold:0"
"ZifengFoldMan" declared "fold:0"
"EvanPlayer" declared "fold:15"
Street "flop" started. (community card = ['H3', 'C6', 'D5'])
"KLChen2PokerPlayer" declared "call:0"
"ZPlayer" declared "raise:10"
"KLChen2PokerPlayer" declared "fold:0"
"['ZPlayer']" won the round 24 (stack = {'ZPlayer': 1156, 'NitWinWin': 950, 'Jinkun': 947, 'YueShi': 940, 'JoyoPlayer': 0, 'ZifengFoldMan': 950, 'EvanPlayer': 2099, 'KLChen2PokerPlayer': 957})
player [ZPlayer] gets hole card ['SJ', 'S4'], current stack 1156
player [NitWinWin] gets hole card ['DQ', 'H7'], current stack 950
player [Jinkun] gets hole card ['D3', 'CA'], current stack 947
player [YueShi] gets hole card ['C5', 'DT'], current stack 940
player [ZifengFoldMan] gets hole card ['D6', 'C2'], current stack 945
player [EvanPlayer] gets hole card ['ST', 'S7'], current stack 2089
player [KLChen2PokerPlayer] gets hole card ['HA', 'S9'], current stack 957
Started the round 25
Street "preflop" started. (community card = [])
"KLChen2PokerPlayer" declared "raise:19"
"ZPlayer" declared "call:19"
"NitWinWin" declared "fold:0"
"Jinkun" declared "fold:19"
"YueShi" declared "fold:0"
"ZifengFoldMan" declared "fold:0"
"EvanPlayer" declared "fold:19"
Street "flop" started. (community card = ['H4', 'HQ', 'C4'])
"KLChen2PokerPlayer" declared "raise:14"
"ZPlayer" declared "raise:67"
"KLChen2PokerPlayer" declared "fold:0"
"['ZPlayer']" won the round 25 (stack = {'ZPlayer': 1204, 'NitWinWin': 950, 'Jinkun': 947, 'YueShi': 940, 'JoyoPlayer': 0, 'ZifengFoldMan': 945, 'EvanPlayer': 2089, 'KLChen2PokerPlayer': 924})
player [ZPlayer] gets hole card ['H7', 'SA'], current stack 1204
player [NitWinWin] gets hole card ['H2', 'ST'], current stack 950
player [Jinkun] gets hole card ['C4', 'CA'], current stack 947
player [YueShi] gets hole card ['D3', 'HK'], current stack 940
player [ZifengFoldMan] gets hole card ['C2', 'H4'], current stack 945
player [EvanPlayer] gets hole card ['S5', 'C8'], current stack 2084
player [KLChen2PokerPlayer] gets hole card ['D5', 'S2'], current stack 914
Started the round 26
Street "preflop" started. (community card = [])
"ZPlayer" declared "raise:15"
"NitWinWin" declared "fold:0"
"Jinkun" declared "fold:15"
"YueShi" declared "fold:0"
"ZifengFoldMan" declared "fold:0"
"EvanPlayer" declared "fold:15"
"KLChen2PokerPlayer" declared "fold:0"
"['ZPlayer']" won the round 26 (stack = {'ZPlayer': 1219, 'NitWinWin': 950, 'Jinkun': 947, 'YueShi': 940, 'JoyoPlayer': 0, 'ZifengFoldMan': 945, 'EvanPlayer': 2084, 'KLChen2PokerPlayer': 914})
player [ZPlayer] gets hole card ['D9', 'CT'], current stack 1209
player [NitWinWin] gets hole card ['HJ', 'C6'], current stack 950
player [Jinkun] gets hole card ['DK', 'SJ'], current stack 947
player [YueShi] gets hole card ['H8', 'C3'], current stack 940
player [ZifengFoldMan] gets hole card ['DT', 'C4'], current stack 945
player [EvanPlayer] gets hole card ['D5', 'H5'], current stack 2084
player [KLChen2PokerPlayer] gets hole card ['SA', 'H2'], current stack 909
Started the round 27
Street "preflop" started. (community card = [])
"NitWinWin" declared "fold:0"
"Jinkun" declared "fold:10"
"YueShi" declared "fold:0"
"ZifengFoldMan" declared "fold:0"
"EvanPlayer" declared "raise:2084"
"KLChen2PokerPlayer" declared "fold:0"
"ZPlayer" declared "fold:0"
"['EvanPlayer']" won the round 27 (stack = {'ZPlayer': 1209, 'NitWinWin': 950, 'Jinkun': 947, 'YueShi': 940, 'JoyoPlayer': 0, 'ZifengFoldMan': 945, 'EvanPlayer': 2099, 'KLChen2PokerPlayer': 909})
player [ZPlayer] gets hole card ['SA', 'C2'], current stack 1204
player [NitWinWin] gets hole card ['C6', 'H3'], current stack 940
player [Jinkun] gets hole card ['DT', 'H8'], current stack 947
player [YueShi] gets hole card ['D3', 'SQ'], current stack 940
player [ZifengFoldMan] gets hole card ['HK', 'DK'], current stack 945
player [EvanPlayer] gets hole card ['HJ', 'ST'], current stack 2099
player [KLChen2PokerPlayer] gets hole card ['H4', 'H6'], current stack 909
Started the round 28
Street "preflop" started. (community card = [])
"Jinkun" declared "fold:10"
"YueShi" declared "fold:0"
"ZifengFoldMan" declared "fold:0"
"EvanPlayer" declared "call:10"
"KLChen2PokerPlayer" declared "fold:0"
"ZPlayer" declared "raise:15"
"NitWinWin" declared "fold:0"
"EvanPlayer" declared "fold:15"
"['ZPlayer']" won the round 28 (stack = {'ZPlayer': 1229, 'NitWinWin': 940, 'Jinkun': 947, 'YueShi': 940, 'JoyoPlayer': 0, 'ZifengFoldMan': 945, 'EvanPlayer': 2089, 'KLChen2PokerPlayer': 909})
player [ZPlayer] gets hole card ['D2', 'SK'], current stack 1229
player [NitWinWin] gets hole card ['H8', 'S9'], current stack 935
player [Jinkun] gets hole card ['C8', 'D4'], current stack 937
player [YueShi] gets hole card ['D6', 'H5'], current stack 940
player [ZifengFoldMan] gets hole card ['HQ', 'H6'], current stack 945
player [EvanPlayer] gets hole card ['CT', 'DK'], current stack 2089
player [KLChen2PokerPlayer] gets hole card ['HJ', 'H4'], current stack 909
Started the round 29
Street "preflop" started. (community card = [])
"YueShi" declared "fold:0"
"ZifengFoldMan" declared "fold:0"
"EvanPlayer" declared "raise:2089"
"KLChen2PokerPlayer" declared "fold:0"
"ZPlayer" declared "fold:0"
"NitWinWin" declared "fold:0"
"Jinkun" declared "fold:2089"
"['EvanPlayer']" won the round 29 (stack = {'ZPlayer': 1229, 'NitWinWin': 935, 'Jinkun': 937, 'YueShi': 940, 'JoyoPlayer': 0, 'ZifengFoldMan': 945, 'EvanPlayer': 2104, 'KLChen2PokerPlayer': 909})
player [ZPlayer] gets hole card ['HT', 'D6'], current stack 1229
player [NitWinWin] gets hole card ['S3', 'DJ'], current stack 935
player [Jinkun] gets hole card ['D9', 'H8'], current stack 932
player [YueShi] gets hole card ['C7', 'C8'], current stack 930
player [ZifengFoldMan] gets hole card ['D4', 'HK'], current stack 945
player [EvanPlayer] gets hole card ['C2', 'D7'], current stack 2104
player [KLChen2PokerPlayer] gets hole card ['HJ', 'DQ'], current stack 909
Started the round 30
Street "preflop" started. (community card = [])
"ZifengFoldMan" declared "fold:0"
"EvanPlayer" declared "fold:10"
"KLChen2PokerPlayer" declared "raise:25"
"ZPlayer" declared "call:25"
"NitWinWin" declared "fold:0"
"Jinkun" declared "fold:25"
"YueShi" declared "fold:0"
Street "flop" started. (community card = ['H9', 'C4', 'S4'])
"KLChen2PokerPlayer" declared "raise:17"
"ZPlayer" declared "fold:0"
"['KLChen2PokerPlayer']" won the round 30 (stack = {'ZPlayer': 1204, 'NitWinWin': 935, 'Jinkun': 932, 'YueShi': 930, 'JoyoPlayer': 0, 'ZifengFoldMan': 945, 'EvanPlayer': 2104, 'KLChen2PokerPlayer': 949})
player [ZPlayer] gets hole card ['H4', 'D2'], current stack 1204
player [NitWinWin] gets hole card ['DT', 'H5'], current stack 935
player [Jinkun] gets hole card ['S9', 'S2'], current stack 932
player [YueShi] gets hole card ['S8', 'S4'], current stack 925
player [ZifengFoldMan] gets hole card ['S5', 'C4'], current stack 935
player [EvanPlayer] gets hole card ['D4', 'HT'], current stack 2104
player [KLChen2PokerPlayer] gets hole card ['C7', 'HJ'], current stack 949
Started the round 31
Street "preflop" started. (community card = [])
"EvanPlayer" declared "call:10"
"KLChen2PokerPlayer" declared "call:10"
"ZPlayer" declared "call:10"
"NitWinWin" declared "fold:0"
"Jinkun" declared "fold:10"
"YueShi" declared "fold:0"
"ZifengFoldMan" declared "fold:0"
Street "flop" started. (community card = ['DJ', 'H8', 'D6'])
"EvanPlayer" declared "fold:0"
"KLChen2PokerPlayer" declared "raise:26"
"ZPlayer" declared "fold:0"
"['KLChen2PokerPlayer']" won the round 31 (stack = {'ZPlayer': 1194, 'NitWinWin': 935, 'Jinkun': 932, 'YueShi': 925, 'JoyoPlayer': 0, 'ZifengFoldMan': 935, 'EvanPlayer': 2094, 'KLChen2PokerPlayer': 984})
player [ZPlayer] gets hole card ['D3', 'H8'], current stack 1194
player [NitWinWin] gets hole card ['H3', 'D4'], current stack 935
player [Jinkun] gets hole card ['C8', 'HJ'], current stack 932
player [YueShi] gets hole card ['D7', 'S3'], current stack 925
player [ZifengFoldMan] gets hole card ['S6', 'H2'], current stack 930
player [EvanPlayer] gets hole card ['S2', 'HA'], current stack 2084
player [KLChen2PokerPlayer] gets hole card ['D6', 'D2'], current stack 984
Started the round 32
Street "preflop" started. (community card = [])
"KLChen2PokerPlayer" declared "call:10"
"ZPlayer" declared "call:10"
"NitWinWin" declared "fold:0"
"Jinkun" declared "fold:10"
"YueShi" declared "fold:0"
"ZifengFoldMan" declared "fold:0"
"EvanPlayer" declared "fold:10"
Street "flop" started. (community card = ['HK', 'S4', 'C9'])
"KLChen2PokerPlayer" declared "call:0"
"ZPlayer" declared "call:0"
Street "turn" started. (community card = ['HK', 'S4', 'C9', 'C6'])
"KLChen2PokerPlayer" declared "call:0"
"ZPlayer" declared "call:0"
Street "river" started. (community card = ['HK', 'S4', 'C9', 'C6', 'CJ'])
"KLChen2PokerPlayer" declared "call:0"
"ZPlayer" declared "call:0"
"['KLChen2PokerPlayer']" won the round 32 (stack = {'ZPlayer': 1184, 'NitWinWin': 935, 'Jinkun': 932, 'YueShi': 925, 'JoyoPlayer': 0, 'ZifengFoldMan': 930, 'EvanPlayer': 2084, 'KLChen2PokerPlayer': 1009})
player [ZPlayer] gets hole card ['S5', 'CT'], current stack 1184
player [NitWinWin] gets hole card ['S9', 'D5'], current stack 935
player [Jinkun] gets hole card ['D6', 'SJ'], current stack 932
player [YueShi] gets hole card ['DT', 'H7'], current stack 925
player [ZifengFoldMan] gets hole card ['D2', 'SK'], current stack 930
player [EvanPlayer] gets hole card ['SQ', 'S6'], current stack 2079
player [KLChen2PokerPlayer] gets hole card ['S3', 'H9'], current stack 999
Started the round 33
Street "preflop" started. (community card = [])
"ZPlayer" declared "call:10"
"NitWinWin" declared "fold:0"
"Jinkun" declared "fold:10"
"YueShi" declared "fold:0"
"ZifengFoldMan" declared "fold:0"
"EvanPlayer" declared "fold:10"
"KLChen2PokerPlayer" declared "fold:0"
"['ZPlayer']" won the round 33 (stack = {'ZPlayer': 1199, 'NitWinWin': 935, 'Jinkun': 932, 'YueShi': 925, 'JoyoPlayer': 0, 'ZifengFoldMan': 930, 'EvanPlayer': 2079, 'KLChen2PokerPlayer': 999})
player [ZPlayer] gets hole card ['D6', 'C5'], current stack 1189
player [NitWinWin] gets hole card ['S5', 'SJ'], current stack 935
player [Jinkun] gets hole card ['C8', 'SQ'], current stack 932
player [YueShi] gets hole card ['S2', 'HJ'], current stack 925
player [ZifengFoldMan] gets hole card ['D7', 'D8'], current stack 930
player [EvanPlayer] gets hole card ['S9', 'C3'], current stack 2079
player [KLChen2PokerPlayer] gets hole card ['H4', 'DA'], current stack 994
Started the round 34
Street "preflop" started. (community card = [])
"NitWinWin" declared "fold:0"
"Jinkun" declared "fold:10"
"YueShi" declared "fold:0"
"ZifengFoldMan" declared "fold:0"
"EvanPlayer" declared "fold:10"
"KLChen2PokerPlayer" declared "raise:23"
"ZPlayer" declared "call:23"
Street "flop" started. (community card = ['HA', 'D4', 'C2'])
"KLChen2PokerPlayer" declared "raise:33"
"ZPlayer" declared "fold:0"
"['KLChen2PokerPlayer']" won the round 34 (stack = {'ZPlayer': 1176, 'NitWinWin': 935, 'Jinkun': 932, 'YueShi': 925, 'JoyoPlayer': 0, 'ZifengFoldMan': 930, 'EvanPlayer': 2079, 'KLChen2PokerPlayer': 1022})
player [ZPlayer] gets hole card ['C5', 'ST'], current stack 1171
player [NitWinWin] gets hole card ['S9', 'H6'], current stack 925
player [Jinkun] gets hole card ['D2', 'H3'], current stack 932
player [YueShi] gets hole card ['S5', 'H5'], current stack 925
player [ZifengFoldMan] gets hole card ['SK', 'D3'], current stack 930
player [EvanPlayer] gets hole card ['H9', 'H7'], current stack 2079
player [KLChen2PokerPlayer] gets hole card ['DJ', 'C9'], current stack 1022
Started the round 35
Street "preflop" started. (community card = [])
"Jinkun" declared "fold:10"
"YueShi" declared "fold:0"
"ZifengFoldMan" declared "fold:0"
"EvanPlayer" declared "fold:10"
"KLChen2PokerPlayer" declared "raise:25"
"ZPlayer" declared "fold:0"
"NitWinWin" declared "fold:0"
"['KLChen2PokerPlayer']" won the round 35 (stack = {'ZPlayer': 1171, 'NitWinWin': 925, 'Jinkun': 932, 'YueShi': 925, 'JoyoPlayer': 0, 'ZifengFoldMan': 930, 'EvanPlayer': 2079, 'KLChen2PokerPlayer': 1037})
player [ZPlayer] gets hole card ['HQ', 'DA'], current stack 1171
player [NitWinWin] gets hole card ['S5', 'DK'], current stack 920
player [Jinkun] gets hole card ['C7', 'H5'], current stack 922
player [YueShi] gets hole card ['DJ', 'CQ'], current stack 925
player [ZifengFoldMan] gets hole card ['H9', 'SK'], current stack 930
player [EvanPlayer] gets hole card ['D8', 'D4'], current stack 2079
player [KLChen2PokerPlayer] gets hole card ['S7', 'SQ'], current stack 1037
Started the round 36
Street "preflop" started. (community card = [])
"YueShi" declared "fold:0"
"ZifengFoldMan" declared "fold:0"
"EvanPlayer" declared "fold:10"
"KLChen2PokerPlayer" declared "raise:16"
"ZPlayer" declared "call:16"
"NitWinWin" declared "fold:0"
"Jinkun" declared "fold:16"
Street "flop" started. (community card = ['HT', 'S9', 'H6'])
"KLChen2PokerPlayer" declared "call:0"
"ZPlayer" declared "call:0"
Street "turn" started. (community card = ['HT', 'S9', 'H6', 'H4'])
"KLChen2PokerPlayer" declared "call:0"
"ZPlayer" declared "call:0"
Street "river" started. (community card = ['HT', 'S9', 'H6', 'H4', 'C3'])
"KLChen2PokerPlayer" declared "call:0"
"ZPlayer" declared "call:0"
"['ZPlayer']" won the round 36 (stack = {'ZPlayer': 1202, 'NitWinWin': 920, 'Jinkun': 922, 'YueShi': 925, 'JoyoPlayer': 0, 'ZifengFoldMan': 930, 'EvanPlayer': 2079, 'KLChen2PokerPlayer': 1021})
player [ZPlayer] gets hole card ['SJ', 'C7'], current stack 1202
player [NitWinWin] gets hole card ['S8', 'D8'], current stack 920
player [Jinkun] gets hole card ['H9', 'CT'], current stack 917
player [YueShi] gets hole card ['SA', 'H4'], current stack 915
player [ZifengFoldMan] gets hole card ['C6', 'S9'], current stack 930
player [EvanPlayer] gets hole card ['S5', 'ST'], current stack 2079
player [KLChen2PokerPlayer] gets hole card ['H6', 'DT'], current stack 1021
Started the round 37
Street "preflop" started. (community card = [])
"ZifengFoldMan" declared "fold:0"
"EvanPlayer" declared "call:10"
"KLChen2PokerPlayer" declared "call:10"
"ZPlayer" declared "call:10"
"NitWinWin" declared "fold:0"
"Jinkun" declared "call:10"
"YueShi" declared "fold:0"
Street "flop" started. (community card = ['D7', 'S3', 'SK'])
"Jinkun" declared "call:0"
"EvanPlayer" declared "call:0"
"KLChen2PokerPlayer" declared "call:0"
"ZPlayer" declared "raise:25"
"Jinkun" declared "fold:25"
"EvanPlayer" declared "call:25"
"KLChen2PokerPlayer" declared "fold:0"
Street "turn" started. (community card = ['D7', 'S3', 'SK', 'CJ'])
"EvanPlayer" declared "raise:2044"
"ZPlayer" declared "fold:0"
"['EvanPlayer']" won the round 37 (stack = {'ZPlayer': 1167, 'NitWinWin': 920, 'Jinkun': 912, 'YueShi': 915, 'JoyoPlayer': 0, 'ZifengFoldMan': 930, 'EvanPlayer': 2144, 'KLChen2PokerPlayer': 1011})
player [ZPlayer] gets hole card ['S9', 'C4'], current stack 1167
player [NitWinWin] gets hole card ['C9', 'SJ'], current stack 920
player [Jinkun] gets hole card ['HJ', 'S7'], current stack 912
player [YueShi] gets hole card ['HT', 'HA'], current stack 910
player [ZifengFoldMan] gets hole card ['H5', 'C2'], current stack 920
player [EvanPlayer] gets hole card ['S6', 'CK'], current stack 2144
player [KLChen2PokerPlayer] gets hole card ['SQ', 'H8'], current stack 1011
Started the round 38
Street "preflop" started. (community card = [])
"EvanPlayer" declared "call:10"
"KLChen2PokerPlayer" declared "raise:20"
"ZPlayer" declared "call:20"
"NitWinWin" declared "fold:0"
"Jinkun" declared "fold:20"
"YueShi" declared "fold:0"
"ZifengFoldMan" declared "fold:0"
"EvanPlayer" declared "fold:20"
Street "flop" started. (community card = ['DA', 'D7', 'S2'])
"KLChen2PokerPlayer" declared "call:0"
"ZPlayer" declared "call:0"
Street "turn" started. (community card = ['DA', 'D7', 'S2', 'DQ'])
"KLChen2PokerPlayer" declared "raise:62"
"ZPlayer" declared "fold:0"
"['KLChen2PokerPlayer']" won the round 38 (stack = {'ZPlayer': 1147, 'NitWinWin': 920, 'Jinkun': 912, 'YueShi': 910, 'JoyoPlayer': 0, 'ZifengFoldMan': 920, 'EvanPlayer': 2134, 'KLChen2PokerPlayer': 1056})
player [ZPlayer] gets hole card ['H2', 'ST'], current stack 1147
player [NitWinWin] gets hole card ['C2', 'SA'], current stack 920
player [Jinkun] gets hole card ['C5', 'C7'], current stack 912
player [YueShi] gets hole card ['DT', 'H3'], current stack 910
player [ZifengFoldMan] gets hole card ['C9', 'C4'], current stack 915
player [EvanPlayer] gets hole card ['S5', 'HJ'], current stack 2124
player [KLChen2PokerPlayer] gets hole card ['S6', 'SK'], current stack 1056
Started the round 39
Street "preflop" started. (community card = [])
"KLChen2PokerPlayer" declared "raise:29"
"ZPlayer" declared "call:29"
"NitWinWin" declared "fold:0"
"Jinkun" declared "fold:29"
"YueShi" declared "fold:0"
"ZifengFoldMan" declared "fold:0"
"EvanPlayer" declared "fold:29"
Street "flop" started. (community card = ['HQ', 'D4', 'DQ'])
"KLChen2PokerPlayer" declared "raise:11"
"ZPlayer" declared "fold:0"
"['KLChen2PokerPlayer']" won the round 39 (stack = {'ZPlayer': 1118, 'NitWinWin': 920, 'Jinkun': 912, 'YueShi': 910, 'JoyoPlayer': 0, 'ZifengFoldMan': 915, 'EvanPlayer': 2124, 'KLChen2PokerPlayer': 1100})
player [ZPlayer] gets hole card ['H6', 'CQ'], current stack 1118
player [NitWinWin] gets hole card ['C4', 'HQ'], current stack 920
player [Jinkun] gets hole card ['D6', 'SK'], current stack 912
player [YueShi] gets hole card ['S6', 'C2'], current stack 910
player [ZifengFoldMan] gets hole card ['D8', 'C6'], current stack 915
player [EvanPlayer] gets hole card ['S4', 'SA'], current stack 2119
player [KLChen2PokerPlayer] gets hole card ['C5', 'H9'], current stack 1090
Started the round 40
Street "preflop" started. (community card = [])
"ZPlayer" declared "call:10"
"NitWinWin" declared "fold:0"
"Jinkun" declared "fold:10"
"YueShi" declared "fold:0"
"ZifengFoldMan" declared "fold:0"
"EvanPlayer" declared "call:10"
"KLChen2PokerPlayer" declared "call:10"
Street "flop" started. (community card = ['CK', 'DA', 'DQ'])
"EvanPlayer" declared "raise:2114"
"KLChen2PokerPlayer" declared "fold:0"
"ZPlayer" declared "fold:0"
"['EvanPlayer']" won the round 40 (stack = {'ZPlayer': 1108, 'NitWinWin': 920, 'Jinkun': 912, 'YueShi': 910, 'JoyoPlayer': 0, 'ZifengFoldMan': 915, 'EvanPlayer': 2144, 'KLChen2PokerPlayer': 1090})
player [ZPlayer] gets hole card ['HT', 'H2'], current stack 1098
player [NitWinWin] gets hole card ['S3', 'C5'], current stack 920
player [Jinkun] gets hole card ['D8', 'C9'], current stack 912
player [YueShi] gets hole card ['D7', 'CK'], current stack 910
player [ZifengFoldMan] gets hole card ['H6', 'DK'], current stack 915
player [EvanPlayer] gets hole card ['C7', 'DA'], current stack 2144
player [KLChen2PokerPlayer] gets hole card ['S4', 'DQ'], current stack 1085
Started the round 41
Street "preflop" started. (community card = [])
"NitWinWin" declared "fold:0"
"Jinkun" declared "fold:10"
"YueShi" declared "fold:0"
"ZifengFoldMan" declared "fold:0"
"EvanPlayer" declared "fold:10"
"KLChen2PokerPlayer" declared "call:10"
"ZPlayer" declared "call:10"
Street "flop" started. (community card = ['HA', 'H7', 'C4'])
"KLChen2PokerPlayer" declared "raise:18"
"ZPlayer" declared "fold:0"
"['KLChen2PokerPlayer']" won the round 41 (stack = {'ZPlayer': 1098, 'NitWinWin': 920, 'Jinkun': 912, 'YueShi': 910, 'JoyoPlayer': 0, 'ZifengFoldMan': 915, 'EvanPlayer': 2144, 'KLChen2PokerPlayer': 1100})
player [ZPlayer] gets hole card ['H9', 'CA'], current stack 1093
player [NitWinWin] gets hole card ['H2', 'HK'], current stack 910
player [Jinkun] gets hole card ['S4', 'CJ'], current stack 912
player [YueShi] gets hole card ['D3', 'ST'], current stack 910
player [ZifengFoldMan] gets hole card ['CQ', 'C6'], current stack 915
player [EvanPlayer] gets hole card ['S6', 'H6'], current stack 2144
player [KLChen2PokerPlayer] gets hole card ['DA', 'H7'], current stack 1100
Started the round 42
Street "preflop" started. (community card = [])
"Jinkun" declared "fold:10"
"YueShi" declared "fold:0"
"ZifengFoldMan" declared "fold:0"
"EvanPlayer" declared "fold:10"
"KLChen2PokerPlayer" declared "raise:27"
"ZPlayer" declared "fold:0"
"NitWinWin" declared "fold:0"
"['KLChen2PokerPlayer']" won the round 42 (stack = {'ZPlayer': 1093, 'NitWinWin': 910, 'Jinkun': 912, 'YueShi': 910, 'JoyoPlayer': 0, 'ZifengFoldMan': 915, 'EvanPlayer': 2144, 'KLChen2PokerPlayer': 1115})
player [ZPlayer] gets hole card ['D7', 'D6'], current stack 1093
player [NitWinWin] gets hole card ['HQ', 'S9'], current stack 905
player [Jinkun] gets hole card ['H2', 'C6'], current stack 902
player [YueShi] gets hole card ['HA', 'DA'], current stack 910
player [ZifengFoldMan] gets hole card ['H3', 'S4'], current stack 915
player [EvanPlayer] gets hole card ['C8', 'S8'], current stack 2144
player [KLChen2PokerPlayer] gets hole card ['D3', 'H5'], current stack 1115
Started the round 43
Street "preflop" started. (community card = [])
"YueShi" declared "fold:0"
"ZifengFoldMan" declared "fold:0"
"EvanPlayer" declared "call:10"
"KLChen2PokerPlayer" declared "fold:0"
"ZPlayer" declared "raise:15"
"NitWinWin" declared "fold:0"
"Jinkun" declared "fold:15"
"EvanPlayer" declared "fold:15"
"['ZPlayer']" won the round 43 (stack = {'ZPlayer': 1118, 'NitWinWin': 905, 'Jinkun': 902, 'YueShi': 910, 'JoyoPlayer': 0, 'ZifengFoldMan': 915, 'EvanPlayer': 2134, 'KLChen2PokerPlayer': 1115})
player [ZPlayer] gets hole card ['D4', 'H3'], current stack 1118
player [NitWinWin] gets hole card ['S3', 'DJ'], current stack 905
player [Jinkun] gets hole card ['H7', 'S9'], current stack 897
player [YueShi] gets hole card ['C9', 'HT'], current stack 900
player [ZifengFoldMan] gets hole card ['H5', 'D6'], current stack 915
player [EvanPlayer] gets hole card ['HK', 'CT'], current stack 2134
player [KLChen2PokerPlayer] gets hole card ['S5', 'DQ'], current stack 1115
Started the round 44
Street "preflop" started. (community card = [])
"ZifengFoldMan" declared "fold:0"
"EvanPlayer" declared "raise:2134"
"KLChen2PokerPlayer" declared "fold:0"
"ZPlayer" declared "fold:0"
"NitWinWin" declared "fold:0"
"Jinkun" declared "fold:2134"
"YueShi" declared "fold:0"
"['EvanPlayer']" won the round 44 (stack = {'ZPlayer': 1118, 'NitWinWin': 905, 'Jinkun': 897, 'YueShi': 900, 'JoyoPlayer': 0, 'ZifengFoldMan': 915, 'EvanPlayer': 2149, 'KLChen2PokerPlayer': 1115})
player [ZPlayer] gets hole card ['D7', 'HJ'], current stack 1118
player [NitWinWin] gets hole card ['DK', 'DJ'], current stack 905
player [Jinkun] gets hole card ['SA', 'SQ'], current stack 897
player [YueShi] gets hole card ['S7', 'C2'], current stack 895
player [ZifengFoldMan] gets hole card ['CT', 'C5'], current stack 905
player [EvanPlayer] gets hole card ['S8', 'SK'], current stack 2149
player [KLChen2PokerPlayer] gets hole card ['H9', 'CA'], current stack 1115
Started the round 45
Street "preflop" started. (community card = [])
"EvanPlayer" declared "raise:2149"
"KLChen2PokerPlayer" declared "fold:0"
"ZPlayer" declared "fold:0"
"NitWinWin" declared "fold:0"
"Jinkun" declared "fold:2149"
"YueShi" declared "fold:0"
"ZifengFoldMan" declared "fold:0"
"['EvanPlayer']" won the round 45 (stack = {'ZPlayer': 1118, 'NitWinWin': 905, 'Jinkun': 897, 'YueShi': 895, 'JoyoPlayer': 0, 'ZifengFoldMan': 905, 'EvanPlayer': 2164, 'KLChen2PokerPlayer': 1115})
player [ZPlayer] gets hole card ['HJ', 'D3'], current stack 1118
player [NitWinWin] gets hole card ['DT', 'C3'], current stack 905
player [Jinkun] gets hole card ['C9', 'S3'], current stack 897
player [YueShi] gets hole card ['H2', 'C2'], current stack 895
player [ZifengFoldMan] gets hole card ['S4', 'C6'], current stack 900
player [EvanPlayer] gets hole card ['DJ', 'ST'], current stack 2154
player [KLChen2PokerPlayer] gets hole card ['S8', 'S9'], current stack 1115
Started the round 46
Street "preflop" started. (community card = [])
"KLChen2PokerPlayer" declared "raise:16"
"ZPlayer" declared "call:16"
"NitWinWin" declared "fold:0"
"Jinkun" declared "fold:16"
"YueShi" declared "fold:0"
"ZifengFoldMan" declared "fold:0"
"EvanPlayer" declared "fold:16"
Street "flop" started. (community card = ['CQ', 'CA', 'SJ'])
"KLChen2PokerPlayer" declared "call:0"
"ZPlayer" declared "raise:10"
"KLChen2PokerPlayer" declared "fold:0"
"['ZPlayer']" won the round 46 (stack = {'ZPlayer': 1149, 'NitWinWin': 905, 'Jinkun': 897, 'YueShi': 895, 'JoyoPlayer': 0, 'ZifengFoldMan': 900, 'EvanPlayer': 2154, 'KLChen2PokerPlayer': 1099})
player [ZPlayer] gets hole card ['H4', 'CJ'], current stack 1149
player [NitWinWin] gets hole card ['DK', 'S9'], current stack 905
player [Jinkun] gets hole card ['C7', 'D2'], current stack 897
player [YueShi] gets hole card ['C4', 'S3'], current stack 895
player [ZifengFoldMan] gets hole card ['CT', 'C6'], current stack 900
player [EvanPlayer] gets hole card ['DT', 'H9'], current stack 2149
player [KLChen2PokerPlayer] gets hole card ['D3', 'DQ'], current stack 1089
Started the round 47
Street "preflop" started. (community card = [])
"ZPlayer" declared "call:10"
"NitWinWin" declared "fold:0"
"Jinkun" declared "fold:10"
"YueShi" declared "fold:0"
"ZifengFoldMan" declared "fold:0"
"EvanPlayer" declared "fold:10"
"KLChen2PokerPlayer" declared "call:10"
Street "flop" started. (community card = ['HK', 'D5', 'SJ'])
"KLChen2PokerPlayer" declared "call:0"
"ZPlayer" declared "raise:12"
"KLChen2PokerPlayer" declared "fold:0"
"['ZPlayer']" won the round 47 (stack = {'ZPlayer': 1164, 'NitWinWin': 905, 'Jinkun': 897, 'YueShi': 895, 'JoyoPlayer': 0, 'ZifengFoldMan': 900, 'EvanPlayer': 2149, 'KLChen2PokerPlayer': 1089})
player [ZPlayer] gets hole card ['S5', 'D5'], current stack 1154
player [NitWinWin] gets hole card ['H4', 'DK'], current stack 905
player [Jinkun] gets hole card ['C7', 'D7'], current stack 897
player [YueShi] gets hole card ['DT', 'DQ'], current stack 895
player [ZifengFoldMan] gets hole card ['D2', 'SK'], current stack 900
player [EvanPlayer] gets hole card ['CQ', 'S3'], current stack 2149
player [KLChen2PokerPlayer] gets hole card ['C3', 'SQ'], current stack 1084
Started the round 48
Street "preflop" started. (community card = [])
"NitWinWin" declared "fold:0"
"Jinkun" declared "fold:10"
"YueShi" declared "fold:0"
"ZifengFoldMan" declared "fold:0"
"EvanPlayer" declared "fold:10"
"KLChen2PokerPlayer" declared "call:10"
"ZPlayer" declared "raise:15"
"KLChen2PokerPlayer" declared "fold:0"
"['ZPlayer']" won the round 48 (stack = {'ZPlayer': 1174, 'NitWinWin': 905, 'Jinkun': 897, 'YueShi': 895, 'JoyoPlayer': 0, 'ZifengFoldMan': 900, 'EvanPlayer': 2149, 'KLChen2PokerPlayer': 1079})
player [ZPlayer] gets hole card ['HA', 'DA'], current stack 1169
player [NitWinWin] gets hole card ['DJ', 'H2'], current stack 895
player [Jinkun] gets hole card ['S4', 'CA'], current stack 897
player [YueShi] gets hole card ['C7', 'CJ'], current stack 895
player [ZifengFoldMan] gets hole card ['HJ', 'D5'], current stack 900
player [EvanPlayer] gets hole card ['CT', 'H3'], current stack 2149
player [KLChen2PokerPlayer] gets hole card ['DK', 'S7'], current stack 1079
Started the round 49
Street "preflop" started. (community card = [])
"Jinkun" declared "fold:10"
"YueShi" declared "fold:0"
"ZifengFoldMan" declared "fold:0"
"EvanPlayer" declared "fold:10"
"KLChen2PokerPlayer" declared "raise:19"
"ZPlayer" declared "raise:28"
"NitWinWin" declared "fold:0"
"KLChen2PokerPlayer" declared "fold:0"
"['ZPlayer']" won the round 49 (stack = {'ZPlayer': 1203, 'NitWinWin': 895, 'Jinkun': 897, 'YueShi': 895, 'JoyoPlayer': 0, 'ZifengFoldMan': 900, 'EvanPlayer': 2149, 'KLChen2PokerPlayer': 1060})
player [ZPlayer] gets hole card ['S5', 'D7'], current stack 1203
player [NitWinWin] gets hole card ['S2', 'CT'], current stack 890
player [Jinkun] gets hole card ['H2', 'SA'], current stack 887
player [YueShi] gets hole card ['CK', 'C6'], current stack 895
player [ZifengFoldMan] gets hole card ['SK', 'S8'], current stack 900
player [EvanPlayer] gets hole card ['D6', 'S3'], current stack 2149
player [KLChen2PokerPlayer] gets hole card ['H7', 'D8'], current stack 1060
Started the round 50
Street "preflop" started. (community card = [])
"YueShi" declared "fold:0"
"ZifengFoldMan" declared "fold:0"
"EvanPlayer" declared "fold:10"
"KLChen2PokerPlayer" declared "raise:15"
"ZPlayer" declared "call:15"
"NitWinWin" declared "fold:0"
"Jinkun" declared "call:15"
Street "flop" started. (community card = ['H3', 'S9', 'C7'])
"Jinkun" declared "call:0"
"KLChen2PokerPlayer" declared "raise:24"
"ZPlayer" declared "call:24"
"Jinkun" declared "fold:24"
Street "turn" started. (community card = ['H3', 'S9', 'C7', 'H6'])
"KLChen2PokerPlayer" declared "raise:112"
"ZPlayer" declared "fold:0"
"['KLChen2PokerPlayer']" won the round 50 (stack = {'ZPlayer': 1164, 'NitWinWin': 890, 'Jinkun': 882, 'YueShi': 895, 'JoyoPlayer': 0, 'ZifengFoldMan': 900, 'EvanPlayer': 2149, 'KLChen2PokerPlayer': 1119})

Game Results:
------------------------------------------------------------
Game 1:
Winner: EvanPlayer (stack: 2149)
All players' stacks:
  ZPlayer: 1164
  NitWinWin: 890
  Jinkun: 882
  YueShi: 895
  JoyoPlayer: 0
  ZifengFoldMan: 900
  EvanPlayer: 2149
  KLChen2PokerPlayer: 1119
------------------------------------------------------------
