player [ZPlayer] gets hole card ['CA', 'D4'], current stack 1000
player [NitWinWin] gets hole card ['CQ', 'HA'], current stack 995
player [Jinkun] gets hole card ['C5', 'SJ'], current stack 990
player [YueShi] gets hole card ['C8', 'SK'], current stack 1000
player [JoyoPlayer] gets hole card ['S7', 'D6'], current stack 1000
player [ZifengFoldMan] gets hole card ['H8', 'D9'], current stack 1000
player [EvanPlayer] gets hole card ['S9', 'DT'], current stack 1000
player [KLChen2PokerPlayer] gets hole card ['C6', 'SQ'], current stack 1000
Started the round 1
Street "preflop" started. (community card = [])
"YueShi" declared "fold:0"
"JoyoPlayer" declared "fold:0"
"ZifengFoldMan" declared "fold:0"
"EvanPlayer" declared "call:10"
"KLChen2PokerPlayer" declared "fold:0"
"ZPlayer" declared "raise:15"
"NitWinWin" declared "fold:0"
"Jinkun" declared "raise:30"
"EvanPlayer" declared "call:30"
"ZPlayer" declared "call:30"
Street "flop" started. (community card = ['HQ', 'S4', 'HK'])
"Jinkun" declared "call:0"
"EvanPlayer" declared "raise:970"
"ZPlayer" declared "fold:0"
"Jinkun" declared "fold:970"
"['EvanPlayer']" won the round 1 (stack = {'ZPlayer': 970, 'NitWinWin': 995, 'Jinkun': 970, 'YueShi': 1000, 'JoyoPlayer': 1000, 'ZifengFoldMan': 1000, 'EvanPlayer': 1065, 'KLChen2PokerPlayer': 1000})
player [ZPlayer] gets hole card ['HT', 'C5'], current stack 970
player [NitWinWin] gets hole card ['D6', 'C8'], current stack 995
player [Jinkun] gets hole card ['SJ', 'S8'], current stack 965
player [YueShi] gets hole card ['HQ', 'DK'], current stack 990
player [JoyoPlayer] gets hole card ['C3', 'C7'], current stack 1000
player [ZifengFoldMan] gets hole card ['S3', 'CJ'], current stack 1000
player [EvanPlayer] gets hole card ['D5', 'H9'], current stack 1065
player [KLChen2PokerPlayer] gets hole card ['D4', 'SQ'], current stack 1000
Started the round 2
Street "preflop" started. (community card = [])
"JoyoPlayer" declared "fold:0"
"ZifengFoldMan" declared "fold:0"
"EvanPlayer" declared "call:10"
"KLChen2PokerPlayer" declared "raise:19"
"ZPlayer" declared "call:19"
"NitWinWin" declared "fold:0"
"Jinkun" declared "fold:19"
"YueShi" declared "fold:0"
"EvanPlayer" declared "fold:19"
Street "flop" started. (community card = ['S2', 'H3', 'D3'])
"KLChen2PokerPlayer" declared "call:0"
"ZPlayer" declared "call:0"
Street "turn" started. (community card = ['S2', 'H3', 'D3', 'HK'])
"KLChen2PokerPlayer" declared "call:0"
"ZPlayer" declared "call:0"
Street "river" started. (community card = ['S2', 'H3', 'D3', 'HK', 'D8'])
"KLChen2PokerPlayer" declared "call:0"
"ZPlayer" declared "call:0"
"['KLChen2PokerPlayer']" won the round 2 (stack = {'ZPlayer': 951, 'NitWinWin': 995, 'Jinkun': 965, 'YueShi': 990, 'JoyoPlayer': 1000, 'ZifengFoldMan': 1000, 'EvanPlayer': 1055, 'KLChen2PokerPlayer': 1044})
player [ZPlayer] gets hole card ['H4', 'H2'], current stack 951
player [NitWinWin] gets hole card ['HK', 'D6'], current stack 995
player [Jinkun] gets hole card ['CQ', 'DT'], current stack 965
player [YueShi] gets hole card ['H9', 'DK'], current stack 985
player [JoyoPlayer] gets hole card ['CK', 'H7'], current stack 990
player [ZifengFoldMan] gets hole card ['HQ', 'S9'], current stack 1000
player [EvanPlayer] gets hole card ['SQ', 'HJ'], current stack 1055
player [KLChen2PokerPlayer] gets hole card ['SA', 'ST'], current stack 1044
Started the round 3
Street "preflop" started. (community card = [])
"ZifengFoldMan" declared "fold:0"
"EvanPlayer" declared "raise:1055"
"KLChen2PokerPlayer" declared "fold:0"
"ZPlayer" declared "fold:0"
"NitWinWin" declared "fold:0"
"Jinkun" declared "fold:1055"
"YueShi" declared "fold:0"
"JoyoPlayer" declared "call:1055"
Street "flop" started. (community card = ['HT', 'D4', 'C4'])
Street "turn" started. (community card = ['HT', 'D4', 'C4', 'D5'])
Street "river" started. (community card = ['HT', 'D4', 'C4', 'D5', 'DJ'])
"['EvanPlayer']" won the round 3 (stack = {'ZPlayer': 951, 'NitWinWin': 995, 'Jinkun': 965, 'YueShi': 985, 'JoyoPlayer': 0, 'ZifengFoldMan': 1000, 'EvanPlayer': 2060, 'KLChen2PokerPlayer': 1044})
player [ZPlayer] gets hole card ['C7', 'D9'], current stack 951
player [NitWinWin] gets hole card ['D4', 'CJ'], current stack 995
player [Jinkun] gets hole card ['H7', 'H2'], current stack 965
player [YueShi] gets hole card ['SJ', 'H5'], current stack 985
player [ZifengFoldMan] gets hole card ['D2', 'HK'], current stack 995
player [EvanPlayer] gets hole card ['S9', 'S8'], current stack 2050
player [KLChen2PokerPlayer] gets hole card ['S3', 'D7'], current stack 1044
Started the round 4
Street "preflop" started. (community card = [])
"KLChen2PokerPlayer" declared "fold:0"
"ZPlayer" declared "call:10"
"NitWinWin" declared "fold:0"
"Jinkun" declared "fold:10"
"YueShi" declared "fold:0"
"ZifengFoldMan" declared "fold:0"
"EvanPlayer" declared "fold:10"
"['ZPlayer']" won the round 4 (stack = {'ZPlayer': 966, 'NitWinWin': 995, 'Jinkun': 965, 'YueShi': 985, 'JoyoPlayer': 0, 'ZifengFoldMan': 995, 'EvanPlayer': 2050, 'KLChen2PokerPlayer': 1044})
player [ZPlayer] gets hole card ['C9', 'S2'], current stack 966
player [NitWinWin] gets hole card ['S6', 'CT'], current stack 995
player [Jinkun] gets hole card ['C4', 'HK'], current stack 965
player [YueShi] gets hole card ['SQ', 'C6'], current stack 985
player [ZifengFoldMan] gets hole card ['D4', 'DA'], current stack 995
player [EvanPlayer] gets hole card ['CQ', 'CK'], current stack 2045
player [KLChen2PokerPlayer] gets hole card ['S9', 'HJ'], current stack 1034
Started the round 5
Street "preflop" started. (community card = [])
"ZPlayer" declared "call:10"
"NitWinWin" declared "fold:0"
"Jinkun" declared "fold:10"
"YueShi" declared "fold:0"
"ZifengFoldMan" declared "fold:0"
"EvanPlayer" declared "call:10"
"KLChen2PokerPlayer" declared "raise:15"
"ZPlayer" declared "call:15"
"EvanPlayer" declared "fold:15"
Street "flop" started. (community card = ['S5', 'HT', 'D8'])
"KLChen2PokerPlayer" declared "raise:16"
"ZPlayer" declared "fold:0"
"['KLChen2PokerPlayer']" won the round 5 (stack = {'ZPlayer': 951, 'NitWinWin': 995, 'Jinkun': 965, 'YueShi': 985, 'JoyoPlayer': 0, 'ZifengFoldMan': 995, 'EvanPlayer': 2040, 'KLChen2PokerPlayer': 1069})
player [ZPlayer] gets hole card ['SQ', 'HK'], current stack 941
player [NitWinWin] gets hole card ['H6', 'D8'], current stack 995
player [Jinkun] gets hole card ['DJ', 'C7'], current stack 965
player [YueShi] gets hole card ['D9', 'C6'], current stack 985
player [ZifengFoldMan] gets hole card ['C5', 'CQ'], current stack 995
player [EvanPlayer] gets hole card ['C4', 'SK'], current stack 2040
player [KLChen2PokerPlayer] gets hole card ['H4', 'DA'], current stack 1064
Started the round 6
Street "preflop" started. (community card = [])
"NitWinWin" declared "fold:0"
"Jinkun" declared "fold:10"
"YueShi" declared "fold:0"
"ZifengFoldMan" declared "fold:0"
"EvanPlayer" declared "fold:10"
"KLChen2PokerPlayer" declared "raise:19"
"ZPlayer" declared "call:19"
Street "flop" started. (community card = ['S3', 'SA', 'S7'])
"KLChen2PokerPlayer" declared "raise:30"
"ZPlayer" declared "call:30"
Street "turn" started. (community card = ['S3', 'SA', 'S7', 'S8'])
"KLChen2PokerPlayer" declared "call:0"
"ZPlayer" declared "raise:98"
"KLChen2PokerPlayer" declared "fold:0"
"['ZPlayer']" won the round 6 (stack = {'ZPlayer': 1000, 'NitWinWin': 995, 'Jinkun': 965, 'YueShi': 985, 'JoyoPlayer': 0, 'ZifengFoldMan': 995, 'EvanPlayer': 2040, 'KLChen2PokerPlayer': 1020})
player [ZPlayer] gets hole card ['CK', 'S2'], current stack 995
player [NitWinWin] gets hole card ['DQ', 'SJ'], current stack 985
player [Jinkun] gets hole card ['D5', 'S4'], current stack 965
player [YueShi] gets hole card ['S3', 'C3'], current stack 985
player [ZifengFoldMan] gets hole card ['H9', 'HT'], current stack 995
player [EvanPlayer] gets hole card ['CJ', 'DK'], current stack 2040
player [KLChen2PokerPlayer] gets hole card ['H6', 'ST'], current stack 1020
Started the round 7
Street "preflop" started. (community card = [])
"Jinkun" declared "fold:10"
"YueShi" declared "fold:0"
"ZifengFoldMan" declared "fold:0"
"EvanPlayer" declared "call:10"
"KLChen2PokerPlayer" declared "fold:0"
"ZPlayer" declared "raise:15"
"NitWinWin" declared "fold:0"
"EvanPlayer" declared "call:15"
Street "flop" started. (community card = ['S6', 'C6', 'D3'])
"ZPlayer" declared "call:0"
"EvanPlayer" declared "raise:2025"
"ZPlayer" declared "fold:0"
"['EvanPlayer']" won the round 7 (stack = {'ZPlayer': 985, 'NitWinWin': 985, 'Jinkun': 965, 'YueShi': 985, 'JoyoPlayer': 0, 'ZifengFoldMan': 995, 'EvanPlayer': 2065, 'KLChen2PokerPlayer': 1020})
player [ZPlayer] gets hole card ['D8', 'HA'], current stack 985
player [NitWinWin] gets hole card ['S4', 'CQ'], current stack 980
player [Jinkun] gets hole card ['ST', 'H5'], current stack 955
player [YueShi] gets hole card ['H6', 'HT'], current stack 985
player [ZifengFoldMan] gets hole card ['S3', 'C4'], current stack 995
player [EvanPlayer] gets hole card ['D4', 'S2'], current stack 2065
player [KLChen2PokerPlayer] gets hole card ['CA', 'HJ'], current stack 1020
Started the round 8
Street "preflop" started. (community card = [])
"YueShi" declared "fold:0"
"ZifengFoldMan" declared "fold:0"
"EvanPlayer" declared "fold:10"
"KLChen2PokerPlayer" declared "raise:26"
"ZPlayer" declared "call:26"
"NitWinWin" declared "fold:0"
"Jinkun" declared "fold:26"
Street "flop" started. (community card = ['SQ', 'HQ', 'HK'])
"KLChen2PokerPlayer" declared "raise:20"
"ZPlayer" declared "fold:0"
"['KLChen2PokerPlayer']" won the round 8 (stack = {'ZPlayer': 959, 'NitWinWin': 980, 'Jinkun': 955, 'YueShi': 985, 'JoyoPlayer': 0, 'ZifengFoldMan': 995, 'EvanPlayer': 2065, 'KLChen2PokerPlayer': 1061})
player [ZPlayer] gets hole card ['DK', 'SJ'], current stack 959
player [NitWinWin] gets hole card ['HA', 'DQ'], current stack 980
player [Jinkun] gets hole card ['CJ', 'D2'], current stack 950
player [YueShi] gets hole card ['S9', 'S3'], current stack 975
player [ZifengFoldMan] gets hole card ['D8', 'C2'], current stack 995
player [EvanPlayer] gets hole card ['H8', 'D5'], current stack 2065
player [KLChen2PokerPlayer] gets hole card ['H5', 'D3'], current stack 1061
Started the round 9
Street "preflop" started. (community card = [])
"ZifengFoldMan" declared "fold:0"
"EvanPlayer" declared "fold:10"
"KLChen2PokerPlayer" declared "fold:0"
"ZPlayer" declared "raise:15"
"NitWinWin" declared "fold:0"
"Jinkun" declared "fold:15"
"YueShi" declared "fold:0"
"['ZPlayer']" won the round 9 (stack = {'ZPlayer': 974, 'NitWinWin': 980, 'Jinkun': 950, 'YueShi': 975, 'JoyoPlayer': 0, 'ZifengFoldMan': 995, 'EvanPlayer': 2065, 'KLChen2PokerPlayer': 1061})
player [ZPlayer] gets hole card ['H5', 'H9'], current stack 974
player [NitWinWin] gets hole card ['DA', 'HT'], current stack 980
player [Jinkun] gets hole card ['SK', 'H2'], current stack 950
player [YueShi] gets hole card ['S2', 'C4'], current stack 970
player [ZifengFoldMan] gets hole card ['D4', 'C5'], current stack 985
player [EvanPlayer] gets hole card ['H3', 'SA'], current stack 2065
player [KLChen2PokerPlayer] gets hole card ['S5', 'CJ'], current stack 1061
Started the round 10
Street "preflop" started. (community card = [])
"EvanPlayer" declared "raise:2065"
"KLChen2PokerPlayer" declared "fold:0"
"ZPlayer" declared "fold:0"
"NitWinWin" declared "fold:0"
"Jinkun" declared "fold:2065"
"YueShi" declared "fold:0"
"ZifengFoldMan" declared "fold:0"
"['EvanPlayer']" won the round 10 (stack = {'ZPlayer': 974, 'NitWinWin': 980, 'Jinkun': 950, 'YueShi': 970, 'JoyoPlayer': 0, 'ZifengFoldMan': 985, 'EvanPlayer': 2080, 'KLChen2PokerPlayer': 1061})
player [ZPlayer] gets hole card ['H9', 'D2'], current stack 974
player [NitWinWin] gets hole card ['S7', 'DT'], current stack 980
player [Jinkun] gets hole card ['D6', 'C9'], current stack 950
player [YueShi] gets hole card ['D5', 'S8'], current stack 970
player [ZifengFoldMan] gets hole card ['S2', 'C4'], current stack 980
player [EvanPlayer] gets hole card ['H5', 'C3'], current stack 2070
player [KLChen2PokerPlayer] gets hole card ['H8', 'HT'], current stack 1061
Started the round 11
Street "preflop" started. (community card = [])
"KLChen2PokerPlayer" declared "raise:19"
"ZPlayer" declared "call:19"
"NitWinWin" declared "fold:0"
"Jinkun" declared "fold:19"
"YueShi" declared "fold:0"
"ZifengFoldMan" declared "fold:0"
"EvanPlayer" declared "fold:19"
Street "flop" started. (community card = ['C8', 'SA', 'S5'])
"KLChen2PokerPlayer" declared "raise:27"
"ZPlayer" declared "fold:0"
"['KLChen2PokerPlayer']" won the round 11 (stack = {'ZPlayer': 955, 'NitWinWin': 980, 'Jinkun': 950, 'YueShi': 970, 'JoyoPlayer': 0, 'ZifengFoldMan': 980, 'EvanPlayer': 2070, 'KLChen2PokerPlayer': 1095})
player [ZPlayer] gets hole card ['H7', 'C7'], current stack 955
player [NitWinWin] gets hole card ['S6', 'C5'], current stack 980
player [Jinkun] gets hole card ['H4', 'H5'], current stack 950
player [YueShi] gets hole card ['H3', 'S3'], current stack 970
player [ZifengFoldMan] gets hole card ['D2', 'D6'], current stack 980
player [EvanPlayer] gets hole card ['CJ', 'D5'], current stack 2065
player [KLChen2PokerPlayer] gets hole card ['HQ', 'H9'], current stack 1085
Started the round 12
Street "preflop" started. (community card = [])
"ZPlayer" declared "raise:15"
"NitWinWin" declared "fold:0"
"Jinkun" declared "fold:15"
"YueShi" declared "fold:0"
"ZifengFoldMan" declared "fold:0"
"EvanPlayer" declared "fold:15"
"KLChen2PokerPlayer" declared "raise:20"
"ZPlayer" declared "call:20"
Street "flop" started. (community card = ['C3', 'DJ', 'C9'])
"KLChen2PokerPlayer" declared "raise:27"
"ZPlayer" declared "fold:0"
"['KLChen2PokerPlayer']" won the round 12 (stack = {'ZPlayer': 935, 'NitWinWin': 980, 'Jinkun': 950, 'YueShi': 970, 'JoyoPlayer': 0, 'ZifengFoldMan': 980, 'EvanPlayer': 2065, 'KLChen2PokerPlayer': 1120})
player [ZPlayer] gets hole card ['HJ', 'D9'], current stack 925
player [NitWinWin] gets hole card ['SK', 'S6'], current stack 980
player [Jinkun] gets hole card ['H4', 'CA'], current stack 950
player [YueShi] gets hole card ['D5', 'H2'], current stack 970
player [ZifengFoldMan] gets hole card ['D6', 'CK'], current stack 980
player [EvanPlayer] gets hole card ['HT', 'H7'], current stack 2065
player [KLChen2PokerPlayer] gets hole card ['C3', 'S8'], current stack 1115
Started the round 13
Street "preflop" started. (community card = [])
"NitWinWin" declared "fold:0"
"Jinkun" declared "fold:10"
"YueShi" declared "fold:0"
"ZifengFoldMan" declared "fold:0"
"EvanPlayer" declared "raise:2065"
"KLChen2PokerPlayer" declared "fold:0"
"ZPlayer" declared "fold:0"
"['EvanPlayer']" won the round 13 (stack = {'ZPlayer': 925, 'NitWinWin': 980, 'Jinkun': 950, 'YueShi': 970, 'JoyoPlayer': 0, 'ZifengFoldMan': 980, 'EvanPlayer': 2080, 'KLChen2PokerPlayer': 1115})
player [ZPlayer] gets hole card ['D3', 'D4'], current stack 920
player [NitWinWin] gets hole card ['S3', 'S2'], current stack 970
player [Jinkun] gets hole card ['C3', 'DA'], current stack 950
player [YueShi] gets hole card ['HA', 'CJ'], current stack 970
player [ZifengFoldMan] gets hole card ['SA', 'CK'], current stack 980
player [EvanPlayer] gets hole card ['S4', 'HK'], current stack 2080
player [KLChen2PokerPlayer] gets hole card ['C8', 'S8'], current stack 1115
Started the round 14
Street "preflop" started. (community card = [])
"Jinkun" declared "fold:10"
"YueShi" declared "fold:0"
"ZifengFoldMan" declared "fold:0"
"EvanPlayer" declared "raise:2080"
"KLChen2PokerPlayer" declared "fold:0"
"ZPlayer" declared "fold:0"
"NitWinWin" declared "fold:0"
"['EvanPlayer']" won the round 14 (stack = {'ZPlayer': 920, 'NitWinWin': 970, 'Jinkun': 950, 'YueShi': 970, 'JoyoPlayer': 0, 'ZifengFoldMan': 980, 'EvanPlayer': 2095, 'KLChen2PokerPlayer': 1115})
player [ZPlayer] gets hole card ['D9', 'CJ'], current stack 920
player [NitWinWin] gets hole card ['SJ', 'C3'], current stack 965
player [Jinkun] gets hole card ['C5', 'H6'], current stack 940
player [YueShi] gets hole card ['S9', 'S4'], current stack 970
player [ZifengFoldMan] gets hole card ['H5', 'HK'], current stack 980
player [EvanPlayer] gets hole card ['S8', 'HQ'], current stack 2095
player [KLChen2PokerPlayer] gets hole card ['D8', 'D4'], current stack 1115
Started the round 15
Street "preflop" started. (community card = [])
"YueShi" declared "fold:0"
"ZifengFoldMan" declared "fold:0"
"EvanPlayer" declared "call:10"
"KLChen2PokerPlayer" declared "raise:15"
"ZPlayer" declared "call:15"
"NitWinWin" declared "fold:0"
"Jinkun" declared "fold:15"
"EvanPlayer" declared "fold:15"
Street "flop" started. (community card = ['C6', 'DQ', 'S6'])
"KLChen2PokerPlayer" declared "call:0"
"ZPlayer" declared "call:0"
Street "turn" started. (community card = ['C6', 'DQ', 'S6', 'C8'])
"KLChen2PokerPlayer" declared "raise:91"
"ZPlayer" declared "fold:0"
"['KLChen2PokerPlayer']" won the round 15 (stack = {'ZPlayer': 905, 'NitWinWin': 965, 'Jinkun': 940, 'YueShi': 970, 'JoyoPlayer': 0, 'ZifengFoldMan': 980, 'EvanPlayer': 2085, 'KLChen2PokerPlayer': 1155})
player [ZPlayer] gets hole card ['S5', 'CQ'], current stack 905
player [NitWinWin] gets hole card ['D7', 'HK'], current stack 965
player [Jinkun] gets hole card ['S8', 'S2'], current stack 935
player [YueShi] gets hole card ['DJ', 'CA'], current stack 960
player [ZifengFoldMan] gets hole card ['SQ', 'C9'], current stack 980
player [EvanPlayer] gets hole card ['D4', 'D3'], current stack 2085
player [KLChen2PokerPlayer] gets hole card ['DK', 'DA'], current stack 1155
Started the round 16
Street "preflop" started. (community card = [])
"ZifengFoldMan" declared "fold:0"
"EvanPlayer" declared "raise:2085"
"KLChen2PokerPlayer" declared "fold:0"
"ZPlayer" declared "fold:0"
"NitWinWin" declared "fold:0"
"Jinkun" declared "fold:2085"
"YueShi" declared "fold:0"
"['EvanPlayer']" won the round 16 (stack = {'ZPlayer': 905, 'NitWinWin': 965, 'Jinkun': 935, 'YueShi': 960, 'JoyoPlayer': 0, 'ZifengFoldMan': 980, 'EvanPlayer': 2100, 'KLChen2PokerPlayer': 1155})
player [ZPlayer] gets hole card ['S7', 'D9'], current stack 905
player [NitWinWin] gets hole card ['D4', 'S4'], current stack 965
player [Jinkun] gets hole card ['ST', 'HQ'], current stack 935
player [YueShi] gets hole card ['H5', 'C8'], current stack 955
player [ZifengFoldMan] gets hole card ['C9', 'S2'], current stack 970
player [EvanPlayer] gets hole card ['CK', 'SK'], current stack 2100
player [KLChen2PokerPlayer] gets hole card ['D7', 'H3'], current stack 1155
Started the round 17
Street "preflop" started. (community card = [])
"EvanPlayer" declared "raise:2100"
"KLChen2PokerPlayer" declared "fold:0"
"ZPlayer" declared "fold:0"
"NitWinWin" declared "fold:0"
"Jinkun" declared "fold:2100"
"YueShi" declared "fold:0"
"ZifengFoldMan" declared "fold:0"
"['EvanPlayer']" won the round 17 (stack = {'ZPlayer': 905, 'NitWinWin': 965, 'Jinkun': 935, 'YueShi': 955, 'JoyoPlayer': 0, 'ZifengFoldMan': 970, 'EvanPlayer': 2115, 'KLChen2PokerPlayer': 1155})
player [ZPlayer] gets hole card ['S7', 'S8'], current stack 905
player [NitWinWin] gets hole card ['D3', 'ST'], current stack 965
player [Jinkun] gets hole card ['C5', 'DJ'], current stack 935
player [YueShi] gets hole card ['DT', 'D9'], current stack 955
player [ZifengFoldMan] gets hole card ['SK', 'HA'], current stack 965
player [EvanPlayer] gets hole card ['DQ', 'H7'], current stack 2105
player [KLChen2PokerPlayer] gets hole card ['H9', 'S5'], current stack 1155
Started the round 18
Street "preflop" started. (community card = [])
"KLChen2PokerPlayer" declared "fold:0"
"ZPlayer" declared "call:10"
"NitWinWin" declared "fold:0"
"Jinkun" declared "fold:10"
"YueShi" declared "fold:0"
"ZifengFoldMan" declared "fold:0"
"EvanPlayer" declared "raise:2115"
"ZPlayer" declared "fold:0"
"['EvanPlayer']" won the round 18 (stack = {'ZPlayer': 895, 'NitWinWin': 965, 'Jinkun': 935, 'YueShi': 955, 'JoyoPlayer': 0, 'ZifengFoldMan': 965, 'EvanPlayer': 2130, 'KLChen2PokerPlayer': 1155})
player [ZPlayer] gets hole card ['H5', 'H4'], current stack 895
player [NitWinWin] gets hole card ['C8', 'S8'], current stack 965
player [Jinkun] gets hole card ['S9', 'D8'], current stack 935
player [YueShi] gets hole card ['D6', 'S5'], current stack 955
player [ZifengFoldMan] gets hole card ['DJ', 'D2'], current stack 965
player [EvanPlayer] gets hole card ['D4', 'S2'], current stack 2125
player [KLChen2PokerPlayer] gets hole card ['DK', 'D9'], current stack 1145
Started the round 19
Street "preflop" started. (community card = [])
"ZPlayer" declared "call:10"
"NitWinWin" declared "fold:0"
"Jinkun" declared "fold:10"
"YueShi" declared "fold:0"
"ZifengFoldMan" declared "fold:0"
"EvanPlayer" declared "fold:10"
"KLChen2PokerPlayer" declared "raise:17"
"ZPlayer" declared "fold:0"
"['KLChen2PokerPlayer']" won the round 19 (stack = {'ZPlayer': 885, 'NitWinWin': 965, 'Jinkun': 935, 'YueShi': 955, 'JoyoPlayer': 0, 'ZifengFoldMan': 965, 'EvanPlayer': 2125, 'KLChen2PokerPlayer': 1170})
player [ZPlayer] gets hole card ['SA', 'C3'], current stack 875
player [NitWinWin] gets hole card ['S8', 'D8'], current stack 965
player [Jinkun] gets hole card ['S6', 'D9'], current stack 935
player [YueShi] gets hole card ['H9', 'H5'], current stack 955
player [ZifengFoldMan] gets hole card ['DK', 'S7'], current stack 965
player [EvanPlayer] gets hole card ['C6', 'SJ'], current stack 2125
player [KLChen2PokerPlayer] gets hole card ['D2', 'H8'], current stack 1165
Started the round 20
Street "preflop" started. (community card = [])
"NitWinWin" declared "fold:0"
"Jinkun" declared "fold:10"
"YueShi" declared "fold:0"
"ZifengFoldMan" declared "fold:0"
"EvanPlayer" declared "fold:10"
"KLChen2PokerPlayer" declared "fold:0"
"['ZPlayer']" won the round 20 (stack = {'ZPlayer': 890, 'NitWinWin': 965, 'Jinkun': 935, 'YueShi': 955, 'JoyoPlayer': 0, 'ZifengFoldMan': 965, 'EvanPlayer': 2125, 'KLChen2PokerPlayer': 1165})
player [ZPlayer] gets hole card ['DJ', 'D3'], current stack 885
player [NitWinWin] gets hole card ['D5', 'C6'], current stack 955
player [Jinkun] gets hole card ['H2', 'C9'], current stack 935
player [YueShi] gets hole card ['C5', 'CA'], current stack 955
player [ZifengFoldMan] gets hole card ['C8', 'C4'], current stack 965
player [EvanPlayer] gets hole card ['H7', 'S8'], current stack 2125
player [KLChen2PokerPlayer] gets hole card ['HT', 'DQ'], current stack 1165
Started the round 21
Street "preflop" started. (community card = [])
"Jinkun" declared "fold:10"
"YueShi" declared "fold:0"
"ZifengFoldMan" declared "fold:0"
"EvanPlayer" declared "raise:2125"
"KLChen2PokerPlayer" declared "fold:0"
"ZPlayer" declared "fold:0"
"NitWinWin" declared "fold:0"
"['EvanPlayer']" won the round 21 (stack = {'ZPlayer': 885, 'NitWinWin': 955, 'Jinkun': 935, 'YueShi': 955, 'JoyoPlayer': 0, 'ZifengFoldMan': 965, 'EvanPlayer': 2140, 'KLChen2PokerPlayer': 1165})
player [ZPlayer] gets hole card ['C8', 'D4'], current stack 885
player [NitWinWin] gets hole card ['S4', 'S9'], current stack 950
player [Jinkun] gets hole card ['ST', 'SA'], current stack 925
player [YueShi] gets hole card ['D6', 'H8'], current stack 955
player [ZifengFoldMan] gets hole card ['C9', 'CJ'], current stack 965
player [EvanPlayer] gets hole card ['H2', 'C3'], current stack 2140
player [KLChen2PokerPlayer] gets hole card ['D3', 'DK'], current stack 1165
Started the round 22
Street "preflop" started. (community card = [])
"YueShi" declared "fold:0"
"ZifengFoldMan" declared "fold:0"
"EvanPlayer" declared "fold:10"
"KLChen2PokerPlayer" declared "raise:18"
"ZPlayer" declared "call:18"
"NitWinWin" declared "fold:0"
"Jinkun" declared "call:18"
Street "flop" started. (community card = ['D9', 'S3', 'S2'])
"Jinkun" declared "call:0"
"KLChen2PokerPlayer" declared "raise:11"
"ZPlayer" declared "fold:0"
"Jinkun" declared "call:11"
Street "turn" started. (community card = ['D9', 'S3', 'S2', 'HK'])
"Jinkun" declared "call:0"
"KLChen2PokerPlayer" declared "raise:392"
"Jinkun" declared "fold:392"
"['KLChen2PokerPlayer']" won the round 22 (stack = {'ZPlayer': 867, 'NitWinWin': 950, 'Jinkun': 906, 'YueShi': 955, 'JoyoPlayer': 0, 'ZifengFoldMan': 965, 'EvanPlayer': 2140, 'KLChen2PokerPlayer': 1217})
player [ZPlayer] gets hole card ['H6', 'C4'], current stack 867
player [NitWinWin] gets hole card ['CJ', 'C9'], current stack 950
player [Jinkun] gets hole card ['C2', 'H5'], current stack 901
player [YueShi] gets hole card ['HK', 'C5'], current stack 945
player [ZifengFoldMan] gets hole card ['HQ', 'D3'], current stack 965
player [EvanPlayer] gets hole card ['ST', 'DJ'], current stack 2140
player [KLChen2PokerPlayer] gets hole card ['DK', 'H7'], current stack 1217
Started the round 23
Street "preflop" started. (community card = [])
"ZifengFoldMan" declared "fold:0"
"EvanPlayer" declared "raise:2140"
"KLChen2PokerPlayer" declared "fold:0"
"ZPlayer" declared "fold:0"
"NitWinWin" declared "fold:0"
"Jinkun" declared "fold:2140"
"YueShi" declared "fold:0"
"['EvanPlayer']" won the round 23 (stack = {'ZPlayer': 867, 'NitWinWin': 950, 'Jinkun': 901, 'YueShi': 945, 'JoyoPlayer': 0, 'ZifengFoldMan': 965, 'EvanPlayer': 2155, 'KLChen2PokerPlayer': 1217})
player [ZPlayer] gets hole card ['HQ', 'DA'], current stack 867
player [NitWinWin] gets hole card ['H8', 'HA'], current stack 950
player [Jinkun] gets hole card ['S4', 'H2'], current stack 901
player [YueShi] gets hole card ['SK', 'D2'], current stack 940
player [ZifengFoldMan] gets hole card ['DK', 'S6'], current stack 955
player [EvanPlayer] gets hole card ['CK', 'D4'], current stack 2155
player [KLChen2PokerPlayer] gets hole card ['H4', 'H7'], current stack 1217
Started the round 24
Street "preflop" started. (community card = [])
"EvanPlayer" declared "call:10"
"KLChen2PokerPlayer" declared "call:10"
"ZPlayer" declared "raise:15"
"NitWinWin" declared "fold:0"
"Jinkun" declared "fold:15"
"YueShi" declared "fold:0"
"ZifengFoldMan" declared "fold:0"
"EvanPlayer" declared "fold:15"
"KLChen2PokerPlayer" declared "fold:0"
"['ZPlayer']" won the round 24 (stack = {'ZPlayer': 902, 'NitWinWin': 950, 'Jinkun': 901, 'YueShi': 940, 'JoyoPlayer': 0, 'ZifengFoldMan': 955, 'EvanPlayer': 2145, 'KLChen2PokerPlayer': 1207})
player [ZPlayer] gets hole card ['DK', 'D6'], current stack 902
player [NitWinWin] gets hole card ['S4', 'D2'], current stack 950
player [Jinkun] gets hole card ['H3', 'CT'], current stack 901
player [YueShi] gets hole card ['C5', 'D5'], current stack 940
player [ZifengFoldMan] gets hole card ['S8', 'D3'], current stack 950
player [EvanPlayer] gets hole card ['H2', 'S2'], current stack 2135
player [KLChen2PokerPlayer] gets hole card ['S7', 'S3'], current stack 1207
Started the round 25
Street "preflop" started. (community card = [])
"KLChen2PokerPlayer" declared "raise:17"
"ZPlayer" declared "call:17"
"NitWinWin" declared "fold:0"
"Jinkun" declared "fold:17"
"YueShi" declared "fold:0"
"ZifengFoldMan" declared "fold:0"
"EvanPlayer" declared "fold:17"
Street "flop" started. (community card = ['DQ', 'C4', 'HT'])
"KLChen2PokerPlayer" declared "call:0"
"ZPlayer" declared "call:0"
Street "turn" started. (community card = ['DQ', 'C4', 'HT', 'C9'])
"KLChen2PokerPlayer" declared "call:0"
"ZPlayer" declared "call:0"
Street "river" started. (community card = ['DQ', 'C4', 'HT', 'C9', 'H9'])
"KLChen2PokerPlayer" declared "call:0"
"ZPlayer" declared "call:0"
"['ZPlayer']" won the round 25 (stack = {'ZPlayer': 934, 'NitWinWin': 950, 'Jinkun': 901, 'YueShi': 940, 'JoyoPlayer': 0, 'ZifengFoldMan': 950, 'EvanPlayer': 2135, 'KLChen2PokerPlayer': 1190})
player [ZPlayer] gets hole card ['D5', 'CA'], current stack 934
player [NitWinWin] gets hole card ['D2', 'S6'], current stack 950
player [Jinkun] gets hole card ['CK', 'S5'], current stack 901
player [YueShi] gets hole card ['SJ', 'H3'], current stack 940
player [ZifengFoldMan] gets hole card ['C2', 'CQ'], current stack 950
player [EvanPlayer] gets hole card ['HQ', 'C8'], current stack 2130
player [KLChen2PokerPlayer] gets hole card ['C4', 'HT'], current stack 1180
Started the round 26
Street "preflop" started. (community card = [])
"ZPlayer" declared "raise:15"
"NitWinWin" declared "fold:0"
"Jinkun" declared "fold:15"
"YueShi" declared "fold:0"
"ZifengFoldMan" declared "fold:0"
"EvanPlayer" declared "fold:15"
"KLChen2PokerPlayer" declared "fold:0"
"['ZPlayer']" won the round 26 (stack = {'ZPlayer': 949, 'NitWinWin': 950, 'Jinkun': 901, 'YueShi': 940, 'JoyoPlayer': 0, 'ZifengFoldMan': 950, 'EvanPlayer': 2130, 'KLChen2PokerPlayer': 1180})
player [ZPlayer] gets hole card ['DQ', 'H9'], current stack 939
player [NitWinWin] gets hole card ['S6', 'C4'], current stack 950
player [Jinkun] gets hole card ['S4', 'H3'], current stack 901
player [YueShi] gets hole card ['D4', 'DT'], current stack 940
player [ZifengFoldMan] gets hole card ['D2', 'HQ'], current stack 950
player [EvanPlayer] gets hole card ['C9', 'C6'], current stack 2130
player [KLChen2PokerPlayer] gets hole card ['D9', 'H2'], current stack 1175
Started the round 27
Street "preflop" started. (community card = [])
"NitWinWin" declared "fold:0"
"Jinkun" declared "fold:10"
"YueShi" declared "fold:0"
"ZifengFoldMan" declared "fold:0"
"EvanPlayer" declared "fold:10"
"KLChen2PokerPlayer" declared "fold:0"
"['ZPlayer']" won the round 27 (stack = {'ZPlayer': 954, 'NitWinWin': 950, 'Jinkun': 901, 'YueShi': 940, 'JoyoPlayer': 0, 'ZifengFoldMan': 950, 'EvanPlayer': 2130, 'KLChen2PokerPlayer': 1175})
player [ZPlayer] gets hole card ['C3', 'H2'], current stack 949
player [NitWinWin] gets hole card ['DT', 'CA'], current stack 940
player [Jinkun] gets hole card ['H6', 'D4'], current stack 901
player [YueShi] gets hole card ['H3', 'D7'], current stack 940
player [ZifengFoldMan] gets hole card ['CQ', 'HK'], current stack 950
player [EvanPlayer] gets hole card ['H9', 'H7'], current stack 2130
player [KLChen2PokerPlayer] gets hole card ['SK', 'D5'], current stack 1175
Started the round 28
Street "preflop" started. (community card = [])
"Jinkun" declared "fold:10"
"YueShi" declared "fold:0"
"ZifengFoldMan" declared "fold:0"
"EvanPlayer" declared "fold:10"
"KLChen2PokerPlayer" declared "raise:18"
"ZPlayer" declared "fold:0"
"NitWinWin" declared "fold:0"
"['KLChen2PokerPlayer']" won the round 28 (stack = {'ZPlayer': 949, 'NitWinWin': 940, 'Jinkun': 901, 'YueShi': 940, 'JoyoPlayer': 0, 'ZifengFoldMan': 950, 'EvanPlayer': 2130, 'KLChen2PokerPlayer': 1190})
player [ZPlayer] gets hole card ['DT', 'HK'], current stack 949
player [NitWinWin] gets hole card ['S4', 'H3'], current stack 935
player [Jinkun] gets hole card ['SQ', 'ST'], current stack 891
player [YueShi] gets hole card ['CA', 'C7'], current stack 940
player [ZifengFoldMan] gets hole card ['S9', 'SK'], current stack 950
player [EvanPlayer] gets hole card ['CQ', 'HJ'], current stack 2130
player [KLChen2PokerPlayer] gets hole card ['C8', 'HQ'], current stack 1190
Started the round 29
Street "preflop" started. (community card = [])
"YueShi" declared "fold:0"
"ZifengFoldMan" declared "fold:0"
"EvanPlayer" declared "call:10"
"KLChen2PokerPlayer" declared "call:10"
"ZPlayer" declared "raise:15"
"NitWinWin" declared "fold:0"
"Jinkun" declared "call:15"
"EvanPlayer" declared "call:15"
"KLChen2PokerPlayer" declared "fold:0"
Street "flop" started. (community card = ['H6', 'D4', 'H4'])
"Jinkun" declared "call:0"
"EvanPlayer" declared "fold:0"
"ZPlayer" declared "call:0"
Street "turn" started. (community card = ['H6', 'D4', 'H4', 'DK'])
"Jinkun" declared "call:0"
"ZPlayer" declared "raise:10"
"Jinkun" declared "call:10"
Street "river" started. (community card = ['H6', 'D4', 'H4', 'DK', 'C6'])
"Jinkun" declared "call:0"
"ZPlayer" declared "raise:10"
"Jinkun" declared "call:10"
"['ZPlayer']" won the round 29 (stack = {'ZPlayer': 1014, 'NitWinWin': 935, 'Jinkun': 866, 'YueShi': 940, 'JoyoPlayer': 0, 'ZifengFoldMan': 950, 'EvanPlayer': 2115, 'KLChen2PokerPlayer': 1180})
player [ZPlayer] gets hole card ['DA', 'H3'], current stack 1014
player [NitWinWin] gets hole card ['DK', 'S5'], current stack 935
player [Jinkun] gets hole card ['HT', 'D3'], current stack 861
player [YueShi] gets hole card ['HK', 'S4'], current stack 930
player [ZifengFoldMan] gets hole card ['D4', 'HA'], current stack 950
player [EvanPlayer] gets hole card ['D6', 'SA'], current stack 2115
player [KLChen2PokerPlayer] gets hole card ['CT', 'D9'], current stack 1180
Started the round 30
Street "preflop" started. (community card = [])
"ZifengFoldMan" declared "fold:0"
"EvanPlayer" declared "call:10"
"KLChen2PokerPlayer" declared "raise:18"
"ZPlayer" declared "call:18"
"NitWinWin" declared "fold:0"
"Jinkun" declared "fold:18"
"YueShi" declared "fold:0"
"EvanPlayer" declared "raise:2115"
"KLChen2PokerPlayer" declared "fold:0"
"ZPlayer" declared "fold:0"
"['EvanPlayer']" won the round 30 (stack = {'ZPlayer': 996, 'NitWinWin': 935, 'Jinkun': 861, 'YueShi': 930, 'JoyoPlayer': 0, 'ZifengFoldMan': 950, 'EvanPlayer': 2166, 'KLChen2PokerPlayer': 1162})
player [ZPlayer] gets hole card ['H2', 'SQ'], current stack 996
player [NitWinWin] gets hole card ['ST', 'C9'], current stack 935
player [Jinkun] gets hole card ['H7', 'S2'], current stack 861
player [YueShi] gets hole card ['C8', 'D2'], current stack 925
player [ZifengFoldMan] gets hole card ['SJ', 'HJ'], current stack 940
player [EvanPlayer] gets hole card ['DJ', 'S4'], current stack 2166
player [KLChen2PokerPlayer] gets hole card ['DT', 'DK'], current stack 1162
Started the round 31
Street "preflop" started. (community card = [])
"EvanPlayer" declared "call:10"
"KLChen2PokerPlayer" declared "raise:20"
"ZPlayer" declared "fold:0"
"NitWinWin" declared "fold:0"
"Jinkun" declared "fold:20"
"YueShi" declared "fold:0"
"ZifengFoldMan" declared "fold:0"
"EvanPlayer" declared "fold:20"
"['KLChen2PokerPlayer']" won the round 31 (stack = {'ZPlayer': 996, 'NitWinWin': 935, 'Jinkun': 861, 'YueShi': 925, 'JoyoPlayer': 0, 'ZifengFoldMan': 940, 'EvanPlayer': 2156, 'KLChen2PokerPlayer': 1187})
player [ZPlayer] gets hole card ['C2', 'H4'], current stack 996
player [NitWinWin] gets hole card ['SJ', 'C6'], current stack 935
player [Jinkun] gets hole card ['S7', 'HA'], current stack 861
player [YueShi] gets hole card ['C7', 'D7'], current stack 925
player [ZifengFoldMan] gets hole card ['SQ', 'D3'], current stack 935
player [EvanPlayer] gets hole card ['S2', 'CA'], current stack 2146
player [KLChen2PokerPlayer] gets hole card ['ST', 'D8'], current stack 1187
Started the round 32
Street "preflop" started. (community card = [])
"KLChen2PokerPlayer" declared "call:10"
"ZPlayer" declared "call:10"
"NitWinWin" declared "fold:0"
"Jinkun" declared "fold:10"
"YueShi" declared "fold:0"
"ZifengFoldMan" declared "fold:0"
"EvanPlayer" declared "fold:10"
Street "flop" started. (community card = ['DK', 'DA', 'HT'])
"KLChen2PokerPlayer" declared "raise:31"
"ZPlayer" declared "fold:0"
"['KLChen2PokerPlayer']" won the round 32 (stack = {'ZPlayer': 986, 'NitWinWin': 935, 'Jinkun': 861, 'YueShi': 925, 'JoyoPlayer': 0, 'ZifengFoldMan': 935, 'EvanPlayer': 2146, 'KLChen2PokerPlayer': 1212})
player [ZPlayer] gets hole card ['C4', 'S7'], current stack 986
player [NitWinWin] gets hole card ['CQ', 'HJ'], current stack 935
player [Jinkun] gets hole card ['D2', 'SA'], current stack 861
player [YueShi] gets hole card ['H4', 'D5'], current stack 925
player [ZifengFoldMan] gets hole card ['S8', 'H9'], current stack 935
player [EvanPlayer] gets hole card ['C7', 'CJ'], current stack 2141
player [KLChen2PokerPlayer] gets hole card ['HA', 'CT'], current stack 1202
Started the round 33
Street "preflop" started. (community card = [])
"ZPlayer" declared "call:10"
"NitWinWin" declared "fold:0"
"Jinkun" declared "fold:10"
"YueShi" declared "fold:0"
"ZifengFoldMan" declared "fold:0"
"EvanPlayer" declared "fold:10"
"KLChen2PokerPlayer" declared "raise:15"
"ZPlayer" declared "call:15"
Street "flop" started. (community card = ['C8', 'SK', 'S9'])
"KLChen2PokerPlayer" declared "raise:18"
"ZPlayer" declared "fold:0"
"['KLChen2PokerPlayer']" won the round 33 (stack = {'ZPlayer': 971, 'NitWinWin': 935, 'Jinkun': 861, 'YueShi': 925, 'JoyoPlayer': 0, 'ZifengFoldMan': 935, 'EvanPlayer': 2141, 'KLChen2PokerPlayer': 1232})
player [ZPlayer] gets hole card ['D3', 'CT'], current stack 961
player [NitWinWin] gets hole card ['C4', 'C6'], current stack 935
player [Jinkun] gets hole card ['H2', 'S9'], current stack 861
player [YueShi] gets hole card ['H3', 'S5'], current stack 925
player [ZifengFoldMan] gets hole card ['CQ', 'H9'], current stack 935
player [EvanPlayer] gets hole card ['C2', 'CJ'], current stack 2141
player [KLChen2PokerPlayer] gets hole card ['C5', 'D6'], current stack 1227
Started the round 34
Street "preflop" started. (community card = [])
"NitWinWin" declared "fold:0"
"Jinkun" declared "fold:10"
"YueShi" declared "fold:0"
"ZifengFoldMan" declared "fold:0"
"EvanPlayer" declared "raise:2141"
"KLChen2PokerPlayer" declared "fold:0"
"ZPlayer" declared "fold:0"
"['EvanPlayer']" won the round 34 (stack = {'ZPlayer': 961, 'NitWinWin': 935, 'Jinkun': 861, 'YueShi': 925, 'JoyoPlayer': 0, 'ZifengFoldMan': 935, 'EvanPlayer': 2156, 'KLChen2PokerPlayer': 1227})
player [ZPlayer] gets hole card ['S5', 'H5'], current stack 956
player [NitWinWin] gets hole card ['C4', 'CA'], current stack 925
player [Jinkun] gets hole card ['S7', 'C7'], current stack 861
player [YueShi] gets hole card ['CT', 'HT'], current stack 925
player [ZifengFoldMan] gets hole card ['D8', 'HJ'], current stack 935
player [EvanPlayer] gets hole card ['C5', 'H6'], current stack 2156
player [KLChen2PokerPlayer] gets hole card ['H3', 'D3'], current stack 1227
Started the round 35
Street "preflop" started. (community card = [])
"Jinkun" declared "fold:10"
"YueShi" declared "fold:0"
"ZifengFoldMan" declared "fold:0"
"EvanPlayer" declared "raise:2156"
"KLChen2PokerPlayer" declared "fold:0"
"ZPlayer" declared "fold:0"
"NitWinWin" declared "fold:0"
"['EvanPlayer']" won the round 35 (stack = {'ZPlayer': 956, 'NitWinWin': 925, 'Jinkun': 861, 'YueShi': 925, 'JoyoPlayer': 0, 'ZifengFoldMan': 935, 'EvanPlayer': 2171, 'KLChen2PokerPlayer': 1227})
player [ZPlayer] gets hole card ['D6', 'H6'], current stack 956
player [NitWinWin] gets hole card ['HA', 'CT'], current stack 920
player [Jinkun] gets hole card ['DJ', 'CQ'], current stack 851
player [YueShi] gets hole card ['D7', 'D8'], current stack 925
player [ZifengFoldMan] gets hole card ['DK', 'S2'], current stack 935
player [EvanPlayer] gets hole card ['H9', 'H5'], current stack 2171
player [KLChen2PokerPlayer] gets hole card ['ST', 'HT'], current stack 1227
Started the round 36
Street "preflop" started. (community card = [])
"YueShi" declared "fold:0"
"ZifengFoldMan" declared "fold:0"
"EvanPlayer" declared "call:10"
"KLChen2PokerPlayer" declared "raise:17"
"ZPlayer" declared "call:17"
"NitWinWin" declared "fold:0"
"Jinkun" declared "call:17"
"EvanPlayer" declared "fold:17"
Street "flop" started. (community card = ['D5', 'H3', 'D4'])
"Jinkun" declared "call:0"
"KLChen2PokerPlayer" declared "raise:13"
"ZPlayer" declared "raise:26"
"Jinkun" declared "fold:26"
"KLChen2PokerPlayer" declared "fold:0"
"['ZPlayer']" won the round 36 (stack = {'ZPlayer': 1018, 'NitWinWin': 920, 'Jinkun': 844, 'YueShi': 925, 'JoyoPlayer': 0, 'ZifengFoldMan': 935, 'EvanPlayer': 2161, 'KLChen2PokerPlayer': 1197})
player [ZPlayer] gets hole card ['HJ', 'D4'], current stack 1018
player [NitWinWin] gets hole card ['C7', 'D6'], current stack 920
player [Jinkun] gets hole card ['HK', 'S6'], current stack 839
player [YueShi] gets hole card ['S8', 'SJ'], current stack 915
player [ZifengFoldMan] gets hole card ['S4', 'SK'], current stack 935
player [EvanPlayer] gets hole card ['C9', 'S9'], current stack 2161
player [KLChen2PokerPlayer] gets hole card ['H6', 'DJ'], current stack 1197
Started the round 37
Street "preflop" started. (community card = [])
"ZifengFoldMan" declared "fold:0"
"EvanPlayer" declared "raise:2161"
"KLChen2PokerPlayer" declared "fold:0"
"ZPlayer" declared "fold:0"
"NitWinWin" declared "fold:0"
"Jinkun" declared "fold:2161"
"YueShi" declared "fold:0"
"['EvanPlayer']" won the round 37 (stack = {'ZPlayer': 1018, 'NitWinWin': 920, 'Jinkun': 839, 'YueShi': 915, 'JoyoPlayer': 0, 'ZifengFoldMan': 935, 'EvanPlayer': 2176, 'KLChen2PokerPlayer': 1197})
player [ZPlayer] gets hole card ['H3', 'DA'], current stack 1018
player [NitWinWin] gets hole card ['S5', 'HA'], current stack 920
player [Jinkun] gets hole card ['H7', 'HK'], current stack 839
player [YueShi] gets hole card ['C2', 'C7'], current stack 910
player [ZifengFoldMan] gets hole card ['S2', 'SJ'], current stack 925
player [EvanPlayer] gets hole card ['CQ', 'DK'], current stack 2176
player [KLChen2PokerPlayer] gets hole card ['H6', 'S9'], current stack 1197
Started the round 38
Street "preflop" started. (community card = [])
"EvanPlayer" declared "raise:2176"
"KLChen2PokerPlayer" declared "fold:0"
"ZPlayer" declared "fold:0"
"NitWinWin" declared "fold:0"
"Jinkun" declared "fold:2176"
"YueShi" declared "fold:0"
"ZifengFoldMan" declared "fold:0"
"['EvanPlayer']" won the round 38 (stack = {'ZPlayer': 1018, 'NitWinWin': 920, 'Jinkun': 839, 'YueShi': 910, 'JoyoPlayer': 0, 'ZifengFoldMan': 925, 'EvanPlayer': 2191, 'KLChen2PokerPlayer': 1197})
player [ZPlayer] gets hole card ['SK', 'D5'], current stack 1018
player [NitWinWin] gets hole card ['D2', 'S6'], current stack 920
player [Jinkun] gets hole card ['DQ', 'C5'], current stack 839
player [YueShi] gets hole card ['D9', 'S4'], current stack 910
player [ZifengFoldMan] gets hole card ['HQ', 'H7'], current stack 920
player [EvanPlayer] gets hole card ['DK', 'C7'], current stack 2181
player [KLChen2PokerPlayer] gets hole card ['SA', 'D3'], current stack 1197
Started the round 39
Street "preflop" started. (community card = [])
"KLChen2PokerPlayer" declared "raise:18"
"ZPlayer" declared "call:18"
"NitWinWin" declared "fold:0"
"Jinkun" declared "fold:18"
"YueShi" declared "fold:0"
"ZifengFoldMan" declared "fold:0"
"EvanPlayer" declared "fold:18"
Street "flop" started. (community card = ['CA', 'SJ', 'H5'])
"KLChen2PokerPlayer" declared "raise:27"
"ZPlayer" declared "fold:0"
"['KLChen2PokerPlayer']" won the round 39 (stack = {'ZPlayer': 1000, 'NitWinWin': 920, 'Jinkun': 839, 'YueShi': 910, 'JoyoPlayer': 0, 'ZifengFoldMan': 920, 'EvanPlayer': 2181, 'KLChen2PokerPlayer': 1230})
player [ZPlayer] gets hole card ['CQ', 'CT'], current stack 1000
player [NitWinWin] gets hole card ['HT', 'D2'], current stack 920
player [Jinkun] gets hole card ['H5', 'SK'], current stack 839
player [YueShi] gets hole card ['C3', 'S6'], current stack 910
player [ZifengFoldMan] gets hole card ['D5', 'D4'], current stack 920
player [EvanPlayer] gets hole card ['DT', 'C5'], current stack 2176
player [KLChen2PokerPlayer] gets hole card ['D3', 'CA'], current stack 1220
Started the round 40
Street "preflop" started. (community card = [])
"ZPlayer" declared "raise:15"
"NitWinWin" declared "fold:0"
"Jinkun" declared "fold:15"
"YueShi" declared "fold:0"
"ZifengFoldMan" declared "fold:0"
"EvanPlayer" declared "fold:15"
"KLChen2PokerPlayer" declared "raise:20"
"ZPlayer" declared "call:20"
Street "flop" started. (community card = ['D8', 'HK', 'S4'])
"KLChen2PokerPlayer" declared "call:0"
"ZPlayer" declared "call:0"
Street "turn" started. (community card = ['D8', 'HK', 'S4', 'DA'])
"KLChen2PokerPlayer" declared "raise:489"
"ZPlayer" declared "fold:0"
"['KLChen2PokerPlayer']" won the round 40 (stack = {'ZPlayer': 980, 'NitWinWin': 920, 'Jinkun': 839, 'YueShi': 910, 'JoyoPlayer': 0, 'ZifengFoldMan': 920, 'EvanPlayer': 2176, 'KLChen2PokerPlayer': 1255})
player [ZPlayer] gets hole card ['D3', 'C8'], current stack 970
player [NitWinWin] gets hole card ['DK', 'S4'], current stack 920
player [Jinkun] gets hole card ['C3', 'C4'], current stack 839
player [YueShi] gets hole card ['DA', 'HT'], current stack 910
player [ZifengFoldMan] gets hole card ['S7', 'SQ'], current stack 920
player [EvanPlayer] gets hole card ['H7', 'S5'], current stack 2176
player [KLChen2PokerPlayer] gets hole card ['D8', 'S8'], current stack 1250
Started the round 41
Street "preflop" started. (community card = [])
"NitWinWin" declared "fold:0"
"Jinkun" declared "fold:10"
"YueShi" declared "fold:0"
"ZifengFoldMan" declared "fold:0"
"EvanPlayer" declared "fold:10"
"KLChen2PokerPlayer" declared "raise:15"
"ZPlayer" declared "call:15"
Street "flop" started. (community card = ['HK', 'D2', 'CK'])
"KLChen2PokerPlayer" declared "raise:34"
"ZPlayer" declared "fold:0"
"['KLChen2PokerPlayer']" won the round 41 (stack = {'ZPlayer': 965, 'NitWinWin': 920, 'Jinkun': 839, 'YueShi': 910, 'JoyoPlayer': 0, 'ZifengFoldMan': 920, 'EvanPlayer': 2176, 'KLChen2PokerPlayer': 1270})
player [ZPlayer] gets hole card ['ST', 'S6'], current stack 960
player [NitWinWin] gets hole card ['H8', 'D6'], current stack 910
player [Jinkun] gets hole card ['SK', 'C6'], current stack 839
player [YueShi] gets hole card ['H2', 'H6'], current stack 910
player [ZifengFoldMan] gets hole card ['HK', 'C8'], current stack 920
player [EvanPlayer] gets hole card ['DA', 'HT'], current stack 2176
player [KLChen2PokerPlayer] gets hole card ['D4', 'DT'], current stack 1270
Started the round 42
Street "preflop" started. (community card = [])
"Jinkun" declared "fold:10"
"YueShi" declared "fold:0"
"ZifengFoldMan" declared "fold:0"
"EvanPlayer" declared "call:10"
"KLChen2PokerPlayer" declared "raise:15"
"ZPlayer" declared "call:15"
"NitWinWin" declared "fold:0"
"EvanPlayer" declared "fold:15"
Street "flop" started. (community card = ['D3', 'CT', 'D5'])
"ZPlayer" declared "raise:25"
"KLChen2PokerPlayer" declared "call:25"
Street "turn" started. (community card = ['D3', 'CT', 'D5', 'H5'])
"ZPlayer" declared "raise:10"
"KLChen2PokerPlayer" declared "raise:278"
"ZPlayer" declared "call:278"
Street "river" started. (community card = ['D3', 'CT', 'D5', 'H5', 'CK'])
"ZPlayer" declared "raise:10"
"KLChen2PokerPlayer" declared "call:10"
"['ZPlayer', 'KLChen2PokerPlayer']" won the round 42 (stack = {'ZPlayer': 975, 'NitWinWin': 910, 'Jinkun': 839, 'YueShi': 910, 'JoyoPlayer': 0, 'ZifengFoldMan': 920, 'EvanPlayer': 2166, 'KLChen2PokerPlayer': 1280})
player [ZPlayer] gets hole card ['DT', 'CJ'], current stack 975
player [NitWinWin] gets hole card ['H9', 'S4'], current stack 905
player [Jinkun] gets hole card ['CA', 'SK'], current stack 829
player [YueShi] gets hole card ['DJ', 'HK'], current stack 910
player [ZifengFoldMan] gets hole card ['C9', 'S9'], current stack 920
player [EvanPlayer] gets hole card ['D5', 'HJ'], current stack 2166
player [KLChen2PokerPlayer] gets hole card ['S3', 'D3'], current stack 1280
Started the round 43
Street "preflop" started. (community card = [])
"YueShi" declared "fold:0"
"ZifengFoldMan" declared "fold:0"
"EvanPlayer" declared "call:10"
"KLChen2PokerPlayer" declared "call:10"
"ZPlayer" declared "raise:15"
"NitWinWin" declared "fold:0"
"Jinkun" declared "call:15"
"EvanPlayer" declared "raise:2166"
"KLChen2PokerPlayer" declared "fold:0"
"ZPlayer" declared "fold:0"
"Jinkun" declared "fold:2166"
"['EvanPlayer']" won the round 43 (stack = {'ZPlayer': 960, 'NitWinWin': 905, 'Jinkun': 824, 'YueShi': 910, 'JoyoPlayer': 0, 'ZifengFoldMan': 920, 'EvanPlayer': 2211, 'KLChen2PokerPlayer': 1270})
player [ZPlayer] gets hole card ['C5', 'D9'], current stack 960
player [NitWinWin] gets hole card ['DJ', 'S2'], current stack 905
player [Jinkun] gets hole card ['C7', 'CT'], current stack 819
player [YueShi] gets hole card ['D4', 'H2'], current stack 900
player [ZifengFoldMan] gets hole card ['D5', 'SK'], current stack 920
player [EvanPlayer] gets hole card ['H3', 'CA'], current stack 2211
player [KLChen2PokerPlayer] gets hole card ['S9', 'D7'], current stack 1270
Started the round 44
Street "preflop" started. (community card = [])
"ZifengFoldMan" declared "fold:0"
"EvanPlayer" declared "raise:2211"
"KLChen2PokerPlayer" declared "fold:0"
"ZPlayer" declared "fold:0"
"NitWinWin" declared "fold:0"
"Jinkun" declared "fold:2211"
"YueShi" declared "fold:0"
"['EvanPlayer']" won the round 44 (stack = {'ZPlayer': 960, 'NitWinWin': 905, 'Jinkun': 819, 'YueShi': 900, 'JoyoPlayer': 0, 'ZifengFoldMan': 920, 'EvanPlayer': 2226, 'KLChen2PokerPlayer': 1270})
player [ZPlayer] gets hole card ['C3', 'D4'], current stack 960
player [NitWinWin] gets hole card ['H4', 'HA'], current stack 905
player [Jinkun] gets hole card ['S7', 'H6'], current stack 819
player [YueShi] gets hole card ['HQ', 'D7'], current stack 895
player [ZifengFoldMan] gets hole card ['DQ', 'CK'], current stack 910
player [EvanPlayer] gets hole card ['CT', 'S5'], current stack 2226
player [KLChen2PokerPlayer] gets hole card ['H3', 'SA'], current stack 1270
Started the round 45
Street "preflop" started. (community card = [])
"EvanPlayer" declared "raise:2226"
"KLChen2PokerPlayer" declared "fold:0"
"ZPlayer" declared "fold:0"
"NitWinWin" declared "fold:0"
"Jinkun" declared "fold:2226"
"YueShi" declared "fold:0"
"ZifengFoldMan" declared "fold:0"
"['EvanPlayer']" won the round 45 (stack = {'ZPlayer': 960, 'NitWinWin': 905, 'Jinkun': 819, 'YueShi': 895, 'JoyoPlayer': 0, 'ZifengFoldMan': 910, 'EvanPlayer': 2241, 'KLChen2PokerPlayer': 1270})
player [ZPlayer] gets hole card ['C5', 'H7'], current stack 960
player [NitWinWin] gets hole card ['HQ', 'SQ'], current stack 905
player [Jinkun] gets hole card ['SJ', 'C7'], current stack 819
player [YueShi] gets hole card ['HA', 'D8'], current stack 895
player [ZifengFoldMan] gets hole card ['D2', 'H6'], current stack 905
player [EvanPlayer] gets hole card ['DJ', 'CT'], current stack 2231
player [KLChen2PokerPlayer] gets hole card ['C8', 'C4'], current stack 1270
Started the round 46
Street "preflop" started. (community card = [])
"KLChen2PokerPlayer" declared "raise:16"
"ZPlayer" declared "call:16"
"NitWinWin" declared "raise:905"
"Jinkun" declared "fold:905"
"YueShi" declared "fold:0"
"ZifengFoldMan" declared "fold:0"
"EvanPlayer" declared "fold:905"
"KLChen2PokerPlayer" declared "fold:0"
"ZPlayer" declared "fold:0"
"['NitWinWin']" won the round 46 (stack = {'ZPlayer': 944, 'NitWinWin': 952, 'Jinkun': 819, 'YueShi': 895, 'JoyoPlayer': 0, 'ZifengFoldMan': 905, 'EvanPlayer': 2231, 'KLChen2PokerPlayer': 1254})
player [ZPlayer] gets hole card ['CT', 'C6'], current stack 944
player [NitWinWin] gets hole card ['S2', 'CK'], current stack 952
player [Jinkun] gets hole card ['D8', 'H5'], current stack 819
player [YueShi] gets hole card ['DJ', 'DK'], current stack 895
player [ZifengFoldMan] gets hole card ['D3', 'HK'], current stack 905
player [EvanPlayer] gets hole card ['SQ', 'D2'], current stack 2226
player [KLChen2PokerPlayer] gets hole card ['H7', 'C8'], current stack 1244
Started the round 47
Street "preflop" started. (community card = [])
"ZPlayer" declared "call:10"
"NitWinWin" declared "fold:0"
"Jinkun" declared "fold:10"
"YueShi" declared "fold:0"
"ZifengFoldMan" declared "fold:0"
"EvanPlayer" declared "raise:2231"
"KLChen2PokerPlayer" declared "fold:0"
"ZPlayer" declared "fold:0"
"['EvanPlayer']" won the round 47 (stack = {'ZPlayer': 934, 'NitWinWin': 952, 'Jinkun': 819, 'YueShi': 895, 'JoyoPlayer': 0, 'ZifengFoldMan': 905, 'EvanPlayer': 2251, 'KLChen2PokerPlayer': 1244})
player [ZPlayer] gets hole card ['DK', 'C6'], current stack 924
player [NitWinWin] gets hole card ['C7', 'CA'], current stack 952
player [Jinkun] gets hole card ['C9', 'ST'], current stack 819
player [YueShi] gets hole card ['DJ', 'D8'], current stack 895
player [ZifengFoldMan] gets hole card ['HK', 'D6'], current stack 905
player [EvanPlayer] gets hole card ['S4', 'D2'], current stack 2251
player [KLChen2PokerPlayer] gets hole card ['SA', 'DA'], current stack 1239
Started the round 48
Street "preflop" started. (community card = [])
"NitWinWin" declared "fold:0"
"Jinkun" declared "fold:10"
"YueShi" declared "fold:0"
"ZifengFoldMan" declared "fold:0"
"EvanPlayer" declared "fold:10"
"KLChen2PokerPlayer" declared "raise:25"
"ZPlayer" declared "call:25"
Street "flop" started. (community card = ['C8', 'D3', 'SQ'])
"KLChen2PokerPlayer" declared "raise:25"
"ZPlayer" declared "fold:0"
"['KLChen2PokerPlayer']" won the round 48 (stack = {'ZPlayer': 909, 'NitWinWin': 952, 'Jinkun': 819, 'YueShi': 895, 'JoyoPlayer': 0, 'ZifengFoldMan': 905, 'EvanPlayer': 2251, 'KLChen2PokerPlayer': 1269})
player [ZPlayer] gets hole card ['C5', 'SK'], current stack 904
player [NitWinWin] gets hole card ['H4', 'ST'], current stack 942
player [Jinkun] gets hole card ['SA', 'H9'], current stack 819
player [YueShi] gets hole card ['CK', 'D7'], current stack 895
player [ZifengFoldMan] gets hole card ['CQ', 'D4'], current stack 905
player [EvanPlayer] gets hole card ['D5', 'C4'], current stack 2251
player [KLChen2PokerPlayer] gets hole card ['CT', 'H7'], current stack 1269
Started the round 49
Street "preflop" started. (community card = [])
"Jinkun" declared "fold:10"
"YueShi" declared "fold:0"
"ZifengFoldMan" declared "fold:0"
"EvanPlayer" declared "fold:10"
"KLChen2PokerPlayer" declared "call:10"
"ZPlayer" declared "raise:15"
"NitWinWin" declared "fold:0"
"KLChen2PokerPlayer" declared "fold:0"
"['ZPlayer']" won the round 49 (stack = {'ZPlayer': 929, 'NitWinWin': 942, 'Jinkun': 819, 'YueShi': 895, 'JoyoPlayer': 0, 'ZifengFoldMan': 905, 'EvanPlayer': 2251, 'KLChen2PokerPlayer': 1259})
player [ZPlayer] gets hole card ['HA', 'CK'], current stack 929
player [NitWinWin] gets hole card ['H5', 'C5'], current stack 937
player [Jinkun] gets hole card ['H6', 'HT'], current stack 809
player [YueShi] gets hole card ['CJ', 'C8'], current stack 895
player [ZifengFoldMan] gets hole card ['CT', 'HJ'], current stack 905
player [EvanPlayer] gets hole card ['S4', 'D5'], current stack 2251
player [KLChen2PokerPlayer] gets hole card ['DA', 'DQ'], current stack 1259
Started the round 50
Street "preflop" started. (community card = [])
"YueShi" declared "fold:0"
"ZifengFoldMan" declared "fold:0"
"EvanPlayer" declared "fold:10"
"KLChen2PokerPlayer" declared "raise:17"
"ZPlayer" declared "call:17"
"NitWinWin" declared "fold:0"
"Jinkun" declared "call:17"
Street "flop" started. (community card = ['DK', 'S3', 'C4'])
"Jinkun" declared "call:0"
"KLChen2PokerPlayer" declared "raise:14"
"ZPlayer" declared "raise:279"
"Jinkun" declared "fold:279"
"KLChen2PokerPlayer" declared "fold:0"
"['ZPlayer']" won the round 50 (stack = {'ZPlayer': 982, 'NitWinWin': 937, 'Jinkun': 802, 'YueShi': 895, 'JoyoPlayer': 0, 'ZifengFoldMan': 905, 'EvanPlayer': 2251, 'KLChen2PokerPlayer': 1228})

Game Results:
------------------------------------------------------------
Game 1:
Winner: EvanPlayer (stack: 2251)
All players' stacks:
  ZPlayer: 982
  NitWinWin: 937
  Jinkun: 802
  YueShi: 895
  JoyoPlayer: 0
  ZifengFoldMan: 905
  EvanPlayer: 2251
  KLChen2PokerPlayer: 1228
------------------------------------------------------------
