player [ZPlayer] gets hole card ['CA', 'H2'], current stack 1000
player [NitWinWin] gets hole card ['S7', 'H8'], current stack 995
player [Jinkun] gets hole card ['S5', 'S6'], current stack 990
player [YueShi] gets hole card ['CJ', 'SK'], current stack 1000
player [JoyoPlayer] gets hole card ['S2', 'HK'], current stack 1000
player [ZifengFoldMan] gets hole card ['C5', 'SQ'], current stack 1000
player [EvanPlayer] gets hole card ['CT', 'C7'], current stack 1000
player [KLChen2PokerPlayer] gets hole card ['HQ', 'CK'], current stack 1000
Started the round 1
Street "preflop" started. (community card = [])
"YueShi" declared "fold:0"
"JoyoPlayer" declared "fold:0"
"ZifengFoldMan" declared "fold:0"
"EvanPlayer" declared "call:10"
"KLChen2PokerPlayer" declared "raise:17"
"ZPlayer" declared "call:17"
"NitWinWin" declared "fold:0"
"Jinkun" declared "fold:17"
"EvanPlayer" declared "fold:17"
Street "flop" started. (community card = ['D3', 'DK', 'DA'])
"KLChen2PokerPlayer" declared "raise:35"
"ZPlayer" declared "call:35"
Street "turn" started. (community card = ['D3', 'DK', 'DA', 'SJ'])
"KLChen2PokerPlayer" declared "raise:124"
"ZPlayer" declared "fold:0"
"['KLChen2PokerPlayer']" won the round 1 (stack = {'ZPlayer': 948, 'NitWinWin': 995, 'Jinkun': 990, 'YueShi': 1000, 'JoyoPlayer': 1000, 'ZifengFoldMan': 1000, 'EvanPlayer': 990, 'KLChen2PokerPlayer': 1077})
player [ZPlayer] gets hole card ['HK', 'DA'], current stack 948
player [NitWinWin] gets hole card ['CA', 'D3'], current stack 995
player [Jinkun] gets hole card ['C5', 'S9'], current stack 985
player [YueShi] gets hole card ['DT', 'D4'], current stack 990
player [JoyoPlayer] gets hole card ['SA', 'S8'], current stack 1000
player [ZifengFoldMan] gets hole card ['D2', 'H6'], current stack 1000
player [EvanPlayer] gets hole card ['CQ', 'D8'], current stack 990
player [KLChen2PokerPlayer] gets hole card ['D5', 'HQ'], current stack 1077
Started the round 2
Street "preflop" started. (community card = [])
"JoyoPlayer" declared "raise:15"
"ZifengFoldMan" declared "fold:0"
"EvanPlayer" declared "raise:990"
"KLChen2PokerPlayer" declared "fold:0"
"ZPlayer" declared "fold:0"
"NitWinWin" declared "fold:0"
"Jinkun" declared "fold:990"
"YueShi" declared "fold:0"
"JoyoPlayer" declared "raise:-2"
"['EvanPlayer']" won the round 2 (stack = {'ZPlayer': 948, 'NitWinWin': 995, 'Jinkun': 985, 'YueShi': 990, 'JoyoPlayer': 985, 'ZifengFoldMan': 1000, 'EvanPlayer': 1020, 'KLChen2PokerPlayer': 1077})
player [ZPlayer] gets hole card ['HK', 'DJ'], current stack 948
player [NitWinWin] gets hole card ['H8', 'H2'], current stack 995
player [Jinkun] gets hole card ['D8', 'D4'], current stack 985
player [YueShi] gets hole card ['SJ', 'H5'], current stack 985
player [JoyoPlayer] gets hole card ['C2', 'S6'], current stack 975
player [ZifengFoldMan] gets hole card ['HJ', 'S9'], current stack 1000
player [EvanPlayer] gets hole card ['ST', 'SA'], current stack 1020
player [KLChen2PokerPlayer] gets hole card ['DA', 'D5'], current stack 1077
Started the round 3
Street "preflop" started. (community card = [])
"ZifengFoldMan" declared "fold:0"
"EvanPlayer" declared "raise:1020"
"KLChen2PokerPlayer" declared "fold:0"
"ZPlayer" declared "fold:0"
"NitWinWin" declared "fold:0"
"Jinkun" declared "fold:1020"
"YueShi" declared "fold:0"
"JoyoPlayer" declared "fold:0"
"['EvanPlayer']" won the round 3 (stack = {'ZPlayer': 948, 'NitWinWin': 995, 'Jinkun': 985, 'YueShi': 985, 'JoyoPlayer': 975, 'ZifengFoldMan': 1000, 'EvanPlayer': 1035, 'KLChen2PokerPlayer': 1077})
player [ZPlayer] gets hole card ['DK', 'CQ'], current stack 948
player [NitWinWin] gets hole card ['D8', 'DQ'], current stack 995
player [Jinkun] gets hole card ['DA', 'S7'], current stack 985
player [YueShi] gets hole card ['H6', 'HK'], current stack 985
player [JoyoPlayer] gets hole card ['D9', 'ST'], current stack 970
player [ZifengFoldMan] gets hole card ['HA', 'H9'], current stack 990
player [EvanPlayer] gets hole card ['S4', 'C3'], current stack 1035
player [KLChen2PokerPlayer] gets hole card ['S2', 'S9'], current stack 1077
Started the round 4
Street "preflop" started. (community card = [])
"EvanPlayer" declared "raise:1035"
"KLChen2PokerPlayer" declared "fold:0"
"ZPlayer" declared "fold:0"
"NitWinWin" declared "fold:0"
"Jinkun" declared "fold:1035"
"YueShi" declared "fold:0"
"JoyoPlayer" declared "call:1035"
"ZifengFoldMan" declared "fold:0"
Street "flop" started. (community card = ['C4', 'H2', 'C5'])
Street "turn" started. (community card = ['C4', 'H2', 'C5', 'HJ'])
Street "river" started. (community card = ['C4', 'H2', 'C5', 'HJ', 'HQ'])
"['EvanPlayer']" won the round 4 (stack = {'ZPlayer': 948, 'NitWinWin': 995, 'Jinkun': 985, 'YueShi': 985, 'JoyoPlayer': 0, 'ZifengFoldMan': 990, 'EvanPlayer': 2020, 'KLChen2PokerPlayer': 1077})
player [ZPlayer] gets hole card ['S6', 'C8'], current stack 948
player [NitWinWin] gets hole card ['HK', 'D2'], current stack 995
player [Jinkun] gets hole card ['SJ', 'S7'], current stack 985
player [YueShi] gets hole card ['HQ', 'S3'], current stack 985
player [ZifengFoldMan] gets hole card ['H7', 'H6'], current stack 990
player [EvanPlayer] gets hole card ['DT', 'D4'], current stack 2015
player [KLChen2PokerPlayer] gets hole card ['CT', 'CK'], current stack 1067
Started the round 5
Street "preflop" started. (community card = [])
"ZPlayer" declared "fold:0"
"NitWinWin" declared "fold:0"
"Jinkun" declared "fold:10"
"YueShi" declared "fold:0"
"ZifengFoldMan" declared "fold:0"
"EvanPlayer" declared "fold:10"
"['KLChen2PokerPlayer']" won the round 5 (stack = {'ZPlayer': 948, 'NitWinWin': 995, 'Jinkun': 985, 'YueShi': 985, 'JoyoPlayer': 0, 'ZifengFoldMan': 990, 'EvanPlayer': 2015, 'KLChen2PokerPlayer': 1082})
player [ZPlayer] gets hole card ['S6', 'D6'], current stack 938
player [NitWinWin] gets hole card ['DJ', 'C4'], current stack 995
player [Jinkun] gets hole card ['DK', 'SQ'], current stack 985
player [YueShi] gets hole card ['S9', 'C8'], current stack 985
player [ZifengFoldMan] gets hole card ['S2', 'H4'], current stack 990
player [EvanPlayer] gets hole card ['H2', 'C9'], current stack 2015
player [KLChen2PokerPlayer] gets hole card ['C3', 'HK'], current stack 1077
Started the round 6
Street "preflop" started. (community card = [])
"NitWinWin" declared "fold:0"
"Jinkun" declared "fold:10"
"YueShi" declared "fold:0"
"ZifengFoldMan" declared "fold:0"
"EvanPlayer" declared "fold:10"
"KLChen2PokerPlayer" declared "call:10"
"ZPlayer" declared "raise:15"
"KLChen2PokerPlayer" declared "fold:0"
"['ZPlayer']" won the round 6 (stack = {'ZPlayer': 958, 'NitWinWin': 995, 'Jinkun': 985, 'YueShi': 985, 'JoyoPlayer': 0, 'ZifengFoldMan': 990, 'EvanPlayer': 2015, 'KLChen2PokerPlayer': 1072})
player [ZPlayer] gets hole card ['H6', 'H8'], current stack 953
player [NitWinWin] gets hole card ['D4', 'CK'], current stack 985
player [Jinkun] gets hole card ['D7', 'C2'], current stack 985
player [YueShi] gets hole card ['H3', 'H5'], current stack 985
player [ZifengFoldMan] gets hole card ['S4', 'S9'], current stack 990
player [EvanPlayer] gets hole card ['HQ', 'HK'], current stack 2015
player [KLChen2PokerPlayer] gets hole card ['DK', 'DT'], current stack 1072
Started the round 7
Street "preflop" started. (community card = [])
"Jinkun" declared "fold:10"
"YueShi" declared "fold:0"
"ZifengFoldMan" declared "fold:0"
"EvanPlayer" declared "call:10"
"KLChen2PokerPlayer" declared "raise:21"
"ZPlayer" declared "fold:0"
"NitWinWin" declared "fold:0"
"EvanPlayer" declared "fold:21"
"['KLChen2PokerPlayer']" won the round 7 (stack = {'ZPlayer': 953, 'NitWinWin': 985, 'Jinkun': 985, 'YueShi': 985, 'JoyoPlayer': 0, 'ZifengFoldMan': 990, 'EvanPlayer': 2005, 'KLChen2PokerPlayer': 1097})
player [ZPlayer] gets hole card ['C5', 'D8'], current stack 953
player [NitWinWin] gets hole card ['D4', 'SQ'], current stack 980
player [Jinkun] gets hole card ['H5', 'C3'], current stack 975
player [YueShi] gets hole card ['S5', 'H2'], current stack 985
player [ZifengFoldMan] gets hole card ['DA', 'D9'], current stack 990
player [EvanPlayer] gets hole card ['ST', 'H4'], current stack 2005
player [KLChen2PokerPlayer] gets hole card ['SA', 'CT'], current stack 1097
Started the round 8
Street "preflop" started. (community card = [])
"YueShi" declared "fold:0"
"ZifengFoldMan" declared "fold:0"
"EvanPlayer" declared "fold:10"
"KLChen2PokerPlayer" declared "raise:24"
"ZPlayer" declared "call:24"
"NitWinWin" declared "fold:0"
"Jinkun" declared "fold:24"
Street "flop" started. (community card = ['S9', 'C7', 'S8'])
"KLChen2PokerPlayer" declared "raise:12"
"ZPlayer" declared "fold:0"
"['KLChen2PokerPlayer']" won the round 8 (stack = {'ZPlayer': 929, 'NitWinWin': 980, 'Jinkun': 975, 'YueShi': 985, 'JoyoPlayer': 0, 'ZifengFoldMan': 990, 'EvanPlayer': 2005, 'KLChen2PokerPlayer': 1136})
player [ZPlayer] gets hole card ['DK', 'S6'], current stack 929
player [NitWinWin] gets hole card ['D2', 'SQ'], current stack 980
player [Jinkun] gets hole card ['S9', 'ST'], current stack 970
player [YueShi] gets hole card ['C3', 'C2'], current stack 975
player [ZifengFoldMan] gets hole card ['H3', 'C4'], current stack 990
player [EvanPlayer] gets hole card ['C5', 'D3'], current stack 2005
player [KLChen2PokerPlayer] gets hole card ['DA', 'C9'], current stack 1136
Started the round 9
Street "preflop" started. (community card = [])
"ZifengFoldMan" declared "fold:0"
"EvanPlayer" declared "fold:10"
"KLChen2PokerPlayer" declared "raise:15"
"ZPlayer" declared "call:15"
"NitWinWin" declared "fold:0"
"Jinkun" declared "fold:15"
"YueShi" declared "fold:0"
Street "flop" started. (community card = ['H7', 'S2', 'SJ'])
"KLChen2PokerPlayer" declared "call:0"
"ZPlayer" declared "call:0"
Street "turn" started. (community card = ['H7', 'S2', 'SJ', 'CA'])
"KLChen2PokerPlayer" declared "raise:309"
"ZPlayer" declared "fold:0"
"['KLChen2PokerPlayer']" won the round 9 (stack = {'ZPlayer': 914, 'NitWinWin': 980, 'Jinkun': 970, 'YueShi': 975, 'JoyoPlayer': 0, 'ZifengFoldMan': 990, 'EvanPlayer': 2005, 'KLChen2PokerPlayer': 1166})
player [ZPlayer] gets hole card ['D2', 'D5'], current stack 914
player [NitWinWin] gets hole card ['C2', 'S4'], current stack 980
player [Jinkun] gets hole card ['S5', 'D7'], current stack 970
player [YueShi] gets hole card ['S2', 'DJ'], current stack 970
player [ZifengFoldMan] gets hole card ['CK', 'SJ'], current stack 980
player [EvanPlayer] gets hole card ['D4', 'ST'], current stack 2005
player [KLChen2PokerPlayer] gets hole card ['H9', 'C8'], current stack 1166
Started the round 10
Street "preflop" started. (community card = [])
"EvanPlayer" declared "call:10"
"KLChen2PokerPlayer" declared "raise:18"
"ZPlayer" declared "fold:0"
"NitWinWin" declared "fold:0"
"Jinkun" declared "fold:18"
"YueShi" declared "fold:0"
"ZifengFoldMan" declared "fold:0"
"EvanPlayer" declared "raise:2005"
"KLChen2PokerPlayer" declared "fold:0"
"['EvanPlayer']" won the round 10 (stack = {'ZPlayer': 914, 'NitWinWin': 980, 'Jinkun': 970, 'YueShi': 970, 'JoyoPlayer': 0, 'ZifengFoldMan': 980, 'EvanPlayer': 2038, 'KLChen2PokerPlayer': 1148})
player [ZPlayer] gets hole card ['D9', 'D7'], current stack 914
player [NitWinWin] gets hole card ['S2', 'D2'], current stack 980
player [Jinkun] gets hole card ['DQ', 'CK'], current stack 970
player [YueShi] gets hole card ['SA', 'C4'], current stack 970
player [ZifengFoldMan] gets hole card ['S3', 'CQ'], current stack 975
player [EvanPlayer] gets hole card ['CJ', 'S4'], current stack 2028
player [KLChen2PokerPlayer] gets hole card ['H6', 'H2'], current stack 1148
Started the round 11
Street "preflop" started. (community card = [])
"KLChen2PokerPlayer" declared "call:10"
"ZPlayer" declared "call:10"
"NitWinWin" declared "fold:0"
"Jinkun" declared "fold:10"
"YueShi" declared "fold:0"
"ZifengFoldMan" declared "fold:0"
"EvanPlayer" declared "raise:2038"
"KLChen2PokerPlayer" declared "fold:0"
"ZPlayer" declared "fold:0"
"['EvanPlayer']" won the round 11 (stack = {'ZPlayer': 904, 'NitWinWin': 980, 'Jinkun': 970, 'YueShi': 970, 'JoyoPlayer': 0, 'ZifengFoldMan': 975, 'EvanPlayer': 2063, 'KLChen2PokerPlayer': 1138})
player [ZPlayer] gets hole card ['C8', 'SA'], current stack 904
player [NitWinWin] gets hole card ['S2', 'CA'], current stack 980
player [Jinkun] gets hole card ['D6', 'H8'], current stack 970
player [YueShi] gets hole card ['H9', 'C6'], current stack 970
player [ZifengFoldMan] gets hole card ['S9', 'DK'], current stack 975
player [EvanPlayer] gets hole card ['H7', 'H3'], current stack 2058
player [KLChen2PokerPlayer] gets hole card ['SJ', 'D7'], current stack 1128
Started the round 12
Street "preflop" started. (community card = [])
"ZPlayer" declared "raise:15"
"NitWinWin" declared "fold:0"
"Jinkun" declared "fold:15"
"YueShi" declared "fold:0"
"ZifengFoldMan" declared "fold:0"
"EvanPlayer" declared "fold:15"
"KLChen2PokerPlayer" declared "call:15"
Street "flop" started. (community card = ['S8', 'HA', 'D5'])
"KLChen2PokerPlayer" declared "call:0"
"ZPlayer" declared "raise:35"
"KLChen2PokerPlayer" declared "fold:0"
"['ZPlayer']" won the round 12 (stack = {'ZPlayer': 924, 'NitWinWin': 980, 'Jinkun': 970, 'YueShi': 970, 'JoyoPlayer': 0, 'ZifengFoldMan': 975, 'EvanPlayer': 2058, 'KLChen2PokerPlayer': 1123})
player [ZPlayer] gets hole card ['D6', 'CJ'], current stack 914
player [NitWinWin] gets hole card ['SJ', 'S5'], current stack 980
player [Jinkun] gets hole card ['H3', 'DK'], current stack 970
player [YueShi] gets hole card ['DQ', 'H5'], current stack 970
player [ZifengFoldMan] gets hole card ['C9', 'S9'], current stack 975
player [EvanPlayer] gets hole card ['D7', 'CK'], current stack 2058
player [KLChen2PokerPlayer] gets hole card ['DT', 'H4'], current stack 1118
Started the round 13
Street "preflop" started. (community card = [])
"NitWinWin" declared "fold:0"
"Jinkun" declared "fold:10"
"YueShi" declared "fold:0"
"ZifengFoldMan" declared "fold:0"
"EvanPlayer" declared "fold:10"
"KLChen2PokerPlayer" declared "raise:17"
"ZPlayer" declared "call:17"
Street "flop" started. (community card = ['S4', 'H2', 'S2'])
"KLChen2PokerPlayer" declared "raise:30"
"ZPlayer" declared "fold:0"
"['KLChen2PokerPlayer']" won the round 13 (stack = {'ZPlayer': 907, 'NitWinWin': 980, 'Jinkun': 970, 'YueShi': 970, 'JoyoPlayer': 0, 'ZifengFoldMan': 975, 'EvanPlayer': 2058, 'KLChen2PokerPlayer': 1140})
player [ZPlayer] gets hole card ['D3', 'ST'], current stack 902
player [NitWinWin] gets hole card ['CK', 'D6'], current stack 970
player [Jinkun] gets hole card ['C6', 'H7'], current stack 970
player [YueShi] gets hole card ['D7', 'S7'], current stack 970
player [ZifengFoldMan] gets hole card ['H2', 'C2'], current stack 975
player [EvanPlayer] gets hole card ['S8', 'HA'], current stack 2058
player [KLChen2PokerPlayer] gets hole card ['C3', 'HT'], current stack 1140
Started the round 14
Street "preflop" started. (community card = [])
"Jinkun" declared "fold:10"
"YueShi" declared "fold:0"
"ZifengFoldMan" declared "fold:0"
"EvanPlayer" declared "call:10"
"KLChen2PokerPlayer" declared "call:10"
"ZPlayer" declared "call:10"
"NitWinWin" declared "fold:0"
Street "flop" started. (community card = ['C4', 'DJ', 'D4'])
"ZPlayer" declared "call:0"
"EvanPlayer" declared "fold:0"
"KLChen2PokerPlayer" declared "call:0"
Street "turn" started. (community card = ['C4', 'DJ', 'D4', 'H5'])
"ZPlayer" declared "call:0"
"KLChen2PokerPlayer" declared "call:0"
Street "river" started. (community card = ['C4', 'DJ', 'D4', 'H5', 'DK'])
"ZPlayer" declared "call:0"
"KLChen2PokerPlayer" declared "call:0"
"['ZPlayer', 'KLChen2PokerPlayer']" won the round 14 (stack = {'ZPlayer': 917, 'NitWinWin': 970, 'Jinkun': 970, 'YueShi': 970, 'JoyoPlayer': 0, 'ZifengFoldMan': 975, 'EvanPlayer': 2048, 'KLChen2PokerPlayer': 1150})
player [ZPlayer] gets hole card ['C4', 'HK'], current stack 917
player [NitWinWin] gets hole card ['DJ', 'CK'], current stack 965
player [Jinkun] gets hole card ['D3', 'CJ'], current stack 960
player [YueShi] gets hole card ['CA', 'HA'], current stack 970
player [ZifengFoldMan] gets hole card ['H9', 'D6'], current stack 975
player [EvanPlayer] gets hole card ['SA', 'H7'], current stack 2048
player [KLChen2PokerPlayer] gets hole card ['SQ', 'CQ'], current stack 1150
Started the round 15
Street "preflop" started. (community card = [])
"YueShi" declared "fold:0"
"ZifengFoldMan" declared "fold:0"
"EvanPlayer" declared "fold:10"
"KLChen2PokerPlayer" declared "raise:23"
"ZPlayer" declared "call:23"
"NitWinWin" declared "fold:0"
"Jinkun" declared "fold:23"
Street "flop" started. (community card = ['S8', 'H4', 'C6'])
"KLChen2PokerPlayer" declared "raise:38"
"ZPlayer" declared "fold:0"
"['KLChen2PokerPlayer']" won the round 15 (stack = {'ZPlayer': 894, 'NitWinWin': 965, 'Jinkun': 960, 'YueShi': 970, 'JoyoPlayer': 0, 'ZifengFoldMan': 975, 'EvanPlayer': 2048, 'KLChen2PokerPlayer': 1188})
player [ZPlayer] gets hole card ['DK', 'CT'], current stack 894
player [NitWinWin] gets hole card ['S3', 'S8'], current stack 965
player [Jinkun] gets hole card ['H4', 'ST'], current stack 955
player [YueShi] gets hole card ['HA', 'C3'], current stack 960
player [ZifengFoldMan] gets hole card ['C2', 'D3'], current stack 975
player [EvanPlayer] gets hole card ['SK', 'CA'], current stack 2048
player [KLChen2PokerPlayer] gets hole card ['H5', 'SA'], current stack 1188
Started the round 16
Street "preflop" started. (community card = [])
"ZifengFoldMan" declared "fold:0"
"EvanPlayer" declared "raise:2048"
"KLChen2PokerPlayer" declared "fold:0"
"ZPlayer" declared "fold:0"
"NitWinWin" declared "fold:0"
"Jinkun" declared "fold:2048"
"YueShi" declared "fold:0"
"['EvanPlayer']" won the round 16 (stack = {'ZPlayer': 894, 'NitWinWin': 965, 'Jinkun': 955, 'YueShi': 960, 'JoyoPlayer': 0, 'ZifengFoldMan': 975, 'EvanPlayer': 2063, 'KLChen2PokerPlayer': 1188})
player [ZPlayer] gets hole card ['S3', 'DJ'], current stack 894
player [NitWinWin] gets hole card ['S4', 'D7'], current stack 965
player [Jinkun] gets hole card ['D6', 'C2'], current stack 955
player [YueShi] gets hole card ['S9', 'C6'], current stack 955
player [ZifengFoldMan] gets hole card ['SA', 'CK'], current stack 965
player [EvanPlayer] gets hole card ['HT', 'SJ'], current stack 2063
player [KLChen2PokerPlayer] gets hole card ['D5', 'CQ'], current stack 1188
Started the round 17
Street "preflop" started. (community card = [])
"EvanPlayer" declared "raise:2063"
"KLChen2PokerPlayer" declared "fold:0"
"ZPlayer" declared "fold:0"
"NitWinWin" declared "fold:0"
"Jinkun" declared "fold:2063"
"YueShi" declared "fold:0"
"ZifengFoldMan" declared "fold:0"
"['EvanPlayer']" won the round 17 (stack = {'ZPlayer': 894, 'NitWinWin': 965, 'Jinkun': 955, 'YueShi': 955, 'JoyoPlayer': 0, 'ZifengFoldMan': 965, 'EvanPlayer': 2078, 'KLChen2PokerPlayer': 1188})
player [ZPlayer] gets hole card ['HA', 'CK'], current stack 894
player [NitWinWin] gets hole card ['H5', 'D2'], current stack 965
player [Jinkun] gets hole card ['SQ', 'DK'], current stack 955
player [YueShi] gets hole card ['D7', 'C3'], current stack 955
player [ZifengFoldMan] gets hole card ['HK', 'HQ'], current stack 960
player [EvanPlayer] gets hole card ['SA', 'C8'], current stack 2068
player [KLChen2PokerPlayer] gets hole card ['DQ', 'H6'], current stack 1188
Started the round 18
Street "preflop" started. (community card = [])
"KLChen2PokerPlayer" declared "raise:15"
"ZPlayer" declared "call:15"
"NitWinWin" declared "fold:0"
"Jinkun" declared "fold:15"
"YueShi" declared "fold:0"
"ZifengFoldMan" declared "fold:0"
"EvanPlayer" declared "fold:15"
Street "flop" started. (community card = ['ST', 'D3', 'DJ'])
"KLChen2PokerPlayer" declared "call:0"
"ZPlayer" declared "call:0"
Street "turn" started. (community card = ['ST', 'D3', 'DJ', 'C4'])
"KLChen2PokerPlayer" declared "call:0"
"ZPlayer" declared "call:0"
Street "river" started. (community card = ['ST', 'D3', 'DJ', 'C4', 'DA'])
"KLChen2PokerPlayer" declared "call:0"
"ZPlayer" declared "raise:10"
"KLChen2PokerPlayer" declared "fold:0"
"['ZPlayer']" won the round 18 (stack = {'ZPlayer': 924, 'NitWinWin': 965, 'Jinkun': 955, 'YueShi': 955, 'JoyoPlayer': 0, 'ZifengFoldMan': 960, 'EvanPlayer': 2068, 'KLChen2PokerPlayer': 1173})
player [ZPlayer] gets hole card ['DT', 'H6'], current stack 924
player [NitWinWin] gets hole card ['SA', 'C8'], current stack 965
player [Jinkun] gets hole card ['H8', 'D8'], current stack 955
player [YueShi] gets hole card ['CJ', 'HT'], current stack 955
player [ZifengFoldMan] gets hole card ['SK', 'D5'], current stack 960
player [EvanPlayer] gets hole card ['CA', 'C2'], current stack 2063
player [KLChen2PokerPlayer] gets hole card ['D4', 'S3'], current stack 1163
Started the round 19
Street "preflop" started. (community card = [])
"ZPlayer" declared "call:10"
"NitWinWin" declared "fold:0"
"Jinkun" declared "fold:10"
"YueShi" declared "fold:0"
"ZifengFoldMan" declared "fold:0"
"EvanPlayer" declared "raise:2068"
"KLChen2PokerPlayer" declared "fold:0"
"ZPlayer" declared "fold:0"
"['EvanPlayer']" won the round 19 (stack = {'ZPlayer': 914, 'NitWinWin': 965, 'Jinkun': 955, 'YueShi': 955, 'JoyoPlayer': 0, 'ZifengFoldMan': 960, 'EvanPlayer': 2088, 'KLChen2PokerPlayer': 1163})
player [ZPlayer] gets hole card ['HJ', 'SK'], current stack 904
player [NitWinWin] gets hole card ['C7', 'C5'], current stack 965
player [Jinkun] gets hole card ['DK', 'CA'], current stack 955
player [YueShi] gets hole card ['H4', 'D8'], current stack 955
player [ZifengFoldMan] gets hole card ['HQ', 'SA'], current stack 960
player [EvanPlayer] gets hole card ['C4', 'DT'], current stack 2088
player [KLChen2PokerPlayer] gets hole card ['D9', 'D2'], current stack 1158
Started the round 20
Street "preflop" started. (community card = [])
"NitWinWin" declared "fold:0"
"Jinkun" declared "fold:10"
"YueShi" declared "fold:0"
"ZifengFoldMan" declared "fold:0"
"EvanPlayer" declared "fold:10"
"KLChen2PokerPlayer" declared "fold:0"
"['ZPlayer']" won the round 20 (stack = {'ZPlayer': 919, 'NitWinWin': 965, 'Jinkun': 955, 'YueShi': 955, 'JoyoPlayer': 0, 'ZifengFoldMan': 960, 'EvanPlayer': 2088, 'KLChen2PokerPlayer': 1158})
player [ZPlayer] gets hole card ['H5', 'H4'], current stack 914
player [NitWinWin] gets hole card ['S7', 'D5'], current stack 955
player [Jinkun] gets hole card ['DQ', 'CA'], current stack 955
player [YueShi] gets hole card ['CJ', 'C3'], current stack 955
player [ZifengFoldMan] gets hole card ['C8', 'CT'], current stack 960
player [EvanPlayer] gets hole card ['S4', 'CK'], current stack 2088
player [KLChen2PokerPlayer] gets hole card ['S5', 'C5'], current stack 1158
Started the round 21
Street "preflop" started. (community card = [])
"Jinkun" declared "fold:10"
"YueShi" declared "fold:0"
"ZifengFoldMan" declared "fold:0"
"EvanPlayer" declared "raise:2088"
"KLChen2PokerPlayer" declared "fold:0"
"ZPlayer" declared "fold:0"
"NitWinWin" declared "fold:0"
"['EvanPlayer']" won the round 21 (stack = {'ZPlayer': 914, 'NitWinWin': 955, 'Jinkun': 955, 'YueShi': 955, 'JoyoPlayer': 0, 'ZifengFoldMan': 960, 'EvanPlayer': 2103, 'KLChen2PokerPlayer': 1158})
player [ZPlayer] gets hole card ['SK', 'SQ'], current stack 914
player [NitWinWin] gets hole card ['DT', 'CJ'], current stack 950
player [Jinkun] gets hole card ['C3', 'S7'], current stack 945
player [YueShi] gets hole card ['H8', 'S3'], current stack 955
player [ZifengFoldMan] gets hole card ['DQ', 'D2'], current stack 960
player [EvanPlayer] gets hole card ['CK', 'C5'], current stack 2103
player [KLChen2PokerPlayer] gets hole card ['C4', 'CA'], current stack 1158
Started the round 22
Street "preflop" started. (community card = [])
"YueShi" declared "fold:0"
"ZifengFoldMan" declared "fold:0"
"EvanPlayer" declared "call:10"
"KLChen2PokerPlayer" declared "raise:15"
"ZPlayer" declared "call:15"
"NitWinWin" declared "fold:0"
"Jinkun" declared "fold:15"
"EvanPlayer" declared "fold:15"
Street "flop" started. (community card = ['HT', 'S4', 'H3'])
"KLChen2PokerPlayer" declared "raise:15"
"ZPlayer" declared "fold:0"
"['KLChen2PokerPlayer']" won the round 22 (stack = {'ZPlayer': 899, 'NitWinWin': 950, 'Jinkun': 945, 'YueShi': 955, 'JoyoPlayer': 0, 'ZifengFoldMan': 960, 'EvanPlayer': 2093, 'KLChen2PokerPlayer': 1198})
player [ZPlayer] gets hole card ['SQ', 'DQ'], current stack 899
player [NitWinWin] gets hole card ['C4', 'D5'], current stack 950
player [Jinkun] gets hole card ['H2', 'DK'], current stack 940
player [YueShi] gets hole card ['D4', 'H3'], current stack 945
player [ZifengFoldMan] gets hole card ['D9', 'S8'], current stack 960
player [EvanPlayer] gets hole card ['D7', 'HA'], current stack 2093
player [KLChen2PokerPlayer] gets hole card ['H9', 'S6'], current stack 1198
Started the round 23
Street "preflop" started. (community card = [])
"ZifengFoldMan" declared "fold:0"
"EvanPlayer" declared "raise:2093"
"KLChen2PokerPlayer" declared "fold:0"
"ZPlayer" declared "call:2093"
"NitWinWin" declared "fold:0"
"Jinkun" declared "fold:2093"
"YueShi" declared "fold:0"
Street "flop" started. (community card = ['S3', 'H7', 'DJ'])
Street "turn" started. (community card = ['S3', 'H7', 'DJ', 'HJ'])
Street "river" started. (community card = ['S3', 'H7', 'DJ', 'HJ', 'S7'])
"['EvanPlayer']" won the round 23 (stack = {'ZPlayer': 0, 'NitWinWin': 950, 'Jinkun': 940, 'YueShi': 945, 'JoyoPlayer': 0, 'ZifengFoldMan': 960, 'EvanPlayer': 3007, 'KLChen2PokerPlayer': 1198})
player [NitWinWin] gets hole card ['S5', 'S7'], current stack 950
player [Jinkun] gets hole card ['CT', 'H3'], current stack 940
player [YueShi] gets hole card ['C9', 'S2'], current stack 940
player [ZifengFoldMan] gets hole card ['HA', 'DQ'], current stack 950
player [EvanPlayer] gets hole card ['HT', 'SJ'], current stack 3007
player [KLChen2PokerPlayer] gets hole card ['C6', 'CQ'], current stack 1198
Started the round 24
Street "preflop" started. (community card = [])
"EvanPlayer" declared "raise:3007"
"KLChen2PokerPlayer" declared "fold:0"
"NitWinWin" declared "fold:0"
"Jinkun" declared "fold:3007"
"YueShi" declared "fold:0"
"ZifengFoldMan" declared "fold:0"
"['EvanPlayer']" won the round 24 (stack = {'ZPlayer': 0, 'NitWinWin': 950, 'Jinkun': 940, 'YueShi': 940, 'JoyoPlayer': 0, 'ZifengFoldMan': 950, 'EvanPlayer': 3022, 'KLChen2PokerPlayer': 1198})
player [NitWinWin] gets hole card ['C7', 'DA'], current stack 950
player [Jinkun] gets hole card ['H8', 'S9'], current stack 940
player [YueShi] gets hole card ['S3', 'D7'], current stack 940
player [ZifengFoldMan] gets hole card ['D9', 'DQ'], current stack 945
player [EvanPlayer] gets hole card ['D4', 'D2'], current stack 3012
player [KLChen2PokerPlayer] gets hole card ['S7', 'SJ'], current stack 1198
Started the round 25
Street "preflop" started. (community card = [])
"KLChen2PokerPlayer" declared "raise:15"
"NitWinWin" declared "fold:0"
"Jinkun" declared "fold:15"
"YueShi" declared "fold:0"
"ZifengFoldMan" declared "fold:0"
"EvanPlayer" declared "raise:3022"
"KLChen2PokerPlayer" declared "fold:0"
"['EvanPlayer']" won the round 25 (stack = {'ZPlayer': 0, 'NitWinWin': 950, 'Jinkun': 940, 'YueShi': 940, 'JoyoPlayer': 0, 'ZifengFoldMan': 945, 'EvanPlayer': 3042, 'KLChen2PokerPlayer': 1183})
player [NitWinWin] gets hole card ['D6', 'D2'], current stack 950
player [Jinkun] gets hole card ['CK', 'HA'], current stack 940
player [YueShi] gets hole card ['SK', 'D5'], current stack 940
player [ZifengFoldMan] gets hole card ['C7', 'D3'], current stack 945
player [EvanPlayer] gets hole card ['DK', 'C5'], current stack 3037
player [KLChen2PokerPlayer] gets hole card ['C2', 'H5'], current stack 1173
Started the round 26
Street "preflop" started. (community card = [])
"NitWinWin" declared "fold:0"
"Jinkun" declared "fold:10"
"YueShi" declared "fold:0"
"ZifengFoldMan" declared "fold:0"
"EvanPlayer" declared "fold:10"
"['KLChen2PokerPlayer']" won the round 26 (stack = {'ZPlayer': 0, 'NitWinWin': 950, 'Jinkun': 940, 'YueShi': 940, 'JoyoPlayer': 0, 'ZifengFoldMan': 945, 'EvanPlayer': 3037, 'KLChen2PokerPlayer': 1188})
player [NitWinWin] gets hole card ['DA', 'S4'], current stack 940
player [Jinkun] gets hole card ['HQ', 'SA'], current stack 940
player [YueShi] gets hole card ['H5', 'CA'], current stack 940
player [ZifengFoldMan] gets hole card ['C7', 'CJ'], current stack 945
player [EvanPlayer] gets hole card ['C9', 'C6'], current stack 3037
player [KLChen2PokerPlayer] gets hole card ['H9', 'SQ'], current stack 1183
Started the round 27
Street "preflop" started. (community card = [])
"Jinkun" declared "fold:10"
"YueShi" declared "fold:0"
"ZifengFoldMan" declared "fold:0"
"EvanPlayer" declared "raise:3037"
"KLChen2PokerPlayer" declared "fold:0"
"NitWinWin" declared "fold:0"
"['EvanPlayer']" won the round 27 (stack = {'ZPlayer': 0, 'NitWinWin': 940, 'Jinkun': 940, 'YueShi': 940, 'JoyoPlayer': 0, 'ZifengFoldMan': 945, 'EvanPlayer': 3052, 'KLChen2PokerPlayer': 1183})
player [NitWinWin] gets hole card ['HT', 'CK'], current stack 935
player [Jinkun] gets hole card ['SJ', 'DT'], current stack 930
player [YueShi] gets hole card ['CA', 'H3'], current stack 940
player [ZifengFoldMan] gets hole card ['S4', 'DK'], current stack 945
player [EvanPlayer] gets hole card ['H7', 'DJ'], current stack 3052
player [KLChen2PokerPlayer] gets hole card ['HA', 'S7'], current stack 1183
Started the round 28
Street "preflop" started. (community card = [])
"YueShi" declared "fold:0"
"ZifengFoldMan" declared "fold:0"
"EvanPlayer" declared "fold:10"
"KLChen2PokerPlayer" declared "raise:15"
"NitWinWin" declared "fold:0"
"Jinkun" declared "call:15"
Street "flop" started. (community card = ['H4', 'H2', 'D7'])
"Jinkun" declared "call:0"
"KLChen2PokerPlayer" declared "raise:28"
"Jinkun" declared "fold:28"
"['KLChen2PokerPlayer']" won the round 28 (stack = {'ZPlayer': 0, 'NitWinWin': 935, 'Jinkun': 925, 'YueShi': 940, 'JoyoPlayer': 0, 'ZifengFoldMan': 945, 'EvanPlayer': 3052, 'KLChen2PokerPlayer': 1203})
player [NitWinWin] gets hole card ['C9', 'C7'], current stack 935
player [Jinkun] gets hole card ['S3', 'H9'], current stack 920
player [YueShi] gets hole card ['CT', 'D7'], current stack 930
player [ZifengFoldMan] gets hole card ['S8', 'S4'], current stack 945
player [EvanPlayer] gets hole card ['C2', 'HA'], current stack 3052
player [KLChen2PokerPlayer] gets hole card ['D9', 'C4'], current stack 1203
Started the round 29
Street "preflop" started. (community card = [])
"ZifengFoldMan" declared "fold:0"
"EvanPlayer" declared "call:10"
"KLChen2PokerPlayer" declared "fold:0"
"NitWinWin" declared "fold:0"
"Jinkun" declared "call:10"
"YueShi" declared "fold:0"
Street "flop" started. (community card = ['HQ', 'SJ', 'D8'])
"Jinkun" declared "call:0"
"EvanPlayer" declared "raise:3042"
"Jinkun" declared "fold:3042"
"['EvanPlayer']" won the round 29 (stack = {'ZPlayer': 0, 'NitWinWin': 935, 'Jinkun': 915, 'YueShi': 930, 'JoyoPlayer': 0, 'ZifengFoldMan': 945, 'EvanPlayer': 3072, 'KLChen2PokerPlayer': 1203})
player [NitWinWin] gets hole card ['SQ', 'S7'], current stack 935
player [Jinkun] gets hole card ['D2', 'S9'], current stack 915
player [YueShi] gets hole card ['S4', 'HJ'], current stack 925
player [ZifengFoldMan] gets hole card ['S3', 'ST'], current stack 935
player [EvanPlayer] gets hole card ['DK', 'CT'], current stack 3072
player [KLChen2PokerPlayer] gets hole card ['HQ', 'S8'], current stack 1203
Started the round 30
Street "preflop" started. (community card = [])
"EvanPlayer" declared "raise:3072"
"KLChen2PokerPlayer" declared "fold:0"
"NitWinWin" declared "fold:0"
"Jinkun" declared "fold:3072"
"YueShi" declared "fold:0"
"ZifengFoldMan" declared "fold:0"
"['EvanPlayer']" won the round 30 (stack = {'ZPlayer': 0, 'NitWinWin': 935, 'Jinkun': 915, 'YueShi': 925, 'JoyoPlayer': 0, 'ZifengFoldMan': 935, 'EvanPlayer': 3087, 'KLChen2PokerPlayer': 1203})
player [NitWinWin] gets hole card ['CJ', 'DK'], current stack 935
player [Jinkun] gets hole card ['C8', 'HT'], current stack 915
player [YueShi] gets hole card ['D7', 'S6'], current stack 925
player [ZifengFoldMan] gets hole card ['S8', 'C2'], current stack 930
player [EvanPlayer] gets hole card ['H6', 'C5'], current stack 3077
player [KLChen2PokerPlayer] gets hole card ['SQ', 'CT'], current stack 1203
Started the round 31
Street "preflop" started. (community card = [])
"KLChen2PokerPlayer" declared "raise:27"
"NitWinWin" declared "fold:0"
"Jinkun" declared "fold:27"
"YueShi" declared "fold:0"
"ZifengFoldMan" declared "fold:0"
"EvanPlayer" declared "fold:27"
"['KLChen2PokerPlayer']" won the round 31 (stack = {'ZPlayer': 0, 'NitWinWin': 935, 'Jinkun': 915, 'YueShi': 925, 'JoyoPlayer': 0, 'ZifengFoldMan': 930, 'EvanPlayer': 3077, 'KLChen2PokerPlayer': 1218})
player [NitWinWin] gets hole card ['C2', 'S4'], current stack 935
player [Jinkun] gets hole card ['S5', 'S9'], current stack 915
player [YueShi] gets hole card ['DA', 'H5'], current stack 925
player [ZifengFoldMan] gets hole card ['CK', 'S7'], current stack 930
player [EvanPlayer] gets hole card ['H7', 'HA'], current stack 3072
player [KLChen2PokerPlayer] gets hole card ['ST', 'SJ'], current stack 1208
Started the round 32
Street "preflop" started. (community card = [])
"NitWinWin" declared "fold:0"
"Jinkun" declared "fold:10"
"YueShi" declared "fold:0"
"ZifengFoldMan" declared "fold:0"
"EvanPlayer" declared "fold:10"
"['KLChen2PokerPlayer']" won the round 32 (stack = {'ZPlayer': 0, 'NitWinWin': 935, 'Jinkun': 915, 'YueShi': 925, 'JoyoPlayer': 0, 'ZifengFoldMan': 930, 'EvanPlayer': 3072, 'KLChen2PokerPlayer': 1223})
player [NitWinWin] gets hole card ['D7', 'S9'], current stack 925
player [Jinkun] gets hole card ['HK', 'D2'], current stack 915
player [YueShi] gets hole card ['S6', 'H4'], current stack 925
player [ZifengFoldMan] gets hole card ['D5', 'H9'], current stack 930
player [EvanPlayer] gets hole card ['CQ', 'HT'], current stack 3072
player [KLChen2PokerPlayer] gets hole card ['S4', 'ST'], current stack 1218
Started the round 33
Street "preflop" started. (community card = [])
"Jinkun" declared "fold:10"
"YueShi" declared "fold:0"
"ZifengFoldMan" declared "fold:0"
"EvanPlayer" declared "fold:10"
"KLChen2PokerPlayer" declared "call:10"
"NitWinWin" declared "fold:0"
"['KLChen2PokerPlayer']" won the round 33 (stack = {'ZPlayer': 0, 'NitWinWin': 925, 'Jinkun': 915, 'YueShi': 925, 'JoyoPlayer': 0, 'ZifengFoldMan': 930, 'EvanPlayer': 3072, 'KLChen2PokerPlayer': 1233})
player [NitWinWin] gets hole card ['DJ', 'D2'], current stack 920
player [Jinkun] gets hole card ['C7', 'D4'], current stack 905
player [YueShi] gets hole card ['H3', 'S8'], current stack 925
player [ZifengFoldMan] gets hole card ['ST', 'SA'], current stack 930
player [EvanPlayer] gets hole card ['S6', 'SJ'], current stack 3072
player [KLChen2PokerPlayer] gets hole card ['HK', 'C9'], current stack 1233
Started the round 34
Street "preflop" started. (community card = [])
"YueShi" declared "fold:0"
"ZifengFoldMan" declared "fold:0"
"EvanPlayer" declared "call:10"
"KLChen2PokerPlayer" declared "raise:17"
"NitWinWin" declared "fold:0"
"Jinkun" declared "fold:17"
"EvanPlayer" declared "fold:17"
"['KLChen2PokerPlayer']" won the round 34 (stack = {'ZPlayer': 0, 'NitWinWin': 920, 'Jinkun': 905, 'YueShi': 925, 'JoyoPlayer': 0, 'ZifengFoldMan': 930, 'EvanPlayer': 3062, 'KLChen2PokerPlayer': 1258})
player [NitWinWin] gets hole card ['HK', 'S9'], current stack 920
player [Jinkun] gets hole card ['D3', 'CQ'], current stack 900
player [YueShi] gets hole card ['S4', 'S8'], current stack 915
player [ZifengFoldMan] gets hole card ['S7', 'HQ'], current stack 930
player [EvanPlayer] gets hole card ['H9', 'HT'], current stack 3062
player [KLChen2PokerPlayer] gets hole card ['S3', 'C6'], current stack 1258
Started the round 35
Street "preflop" started. (community card = [])
"ZifengFoldMan" declared "fold:0"
"EvanPlayer" declared "raise:3062"
"KLChen2PokerPlayer" declared "fold:0"
"NitWinWin" declared "fold:0"
"Jinkun" declared "fold:3062"
"YueShi" declared "fold:0"
"['EvanPlayer']" won the round 35 (stack = {'ZPlayer': 0, 'NitWinWin': 920, 'Jinkun': 900, 'YueShi': 915, 'JoyoPlayer': 0, 'ZifengFoldMan': 930, 'EvanPlayer': 3077, 'KLChen2PokerPlayer': 1258})
player [NitWinWin] gets hole card ['S3', 'D9'], current stack 920
player [Jinkun] gets hole card ['DQ', 'CT'], current stack 900
player [YueShi] gets hole card ['C2', 'C6'], current stack 910
player [ZifengFoldMan] gets hole card ['D2', 'CQ'], current stack 920
player [EvanPlayer] gets hole card ['H5', 'SJ'], current stack 3077
player [KLChen2PokerPlayer] gets hole card ['D7', 'H4'], current stack 1258
Started the round 36
Street "preflop" started. (community card = [])
"EvanPlayer" declared "call:10"
"KLChen2PokerPlayer" declared "fold:0"
"NitWinWin" declared "fold:0"
"Jinkun" declared "call:10"
"YueShi" declared "fold:0"
"ZifengFoldMan" declared "fold:0"
Street "flop" started. (community card = ['HQ', 'C8', 'CJ'])
"EvanPlayer" declared "fold:0"
"['Jinkun']" won the round 36 (stack = {'ZPlayer': 0, 'NitWinWin': 920, 'Jinkun': 925, 'YueShi': 910, 'JoyoPlayer': 0, 'ZifengFoldMan': 920, 'EvanPlayer': 3067, 'KLChen2PokerPlayer': 1258})
player [NitWinWin] gets hole card ['DT', 'C6'], current stack 920
player [Jinkun] gets hole card ['H5', 'DA'], current stack 925
player [YueShi] gets hole card ['D2', 'D4'], current stack 910
player [ZifengFoldMan] gets hole card ['S8', 'C3'], current stack 915
player [EvanPlayer] gets hole card ['D3', 'D5'], current stack 3057
player [KLChen2PokerPlayer] gets hole card ['H6', 'H4'], current stack 1258
Started the round 37
Street "preflop" started. (community card = [])
"KLChen2PokerPlayer" declared "call:10"
"NitWinWin" declared "fold:0"
"Jinkun" declared "fold:10"
"YueShi" declared "fold:0"
"ZifengFoldMan" declared "fold:0"
"EvanPlayer" declared "raise:3067"
"KLChen2PokerPlayer" declared "fold:0"
"['EvanPlayer']" won the round 37 (stack = {'ZPlayer': 0, 'NitWinWin': 920, 'Jinkun': 925, 'YueShi': 910, 'JoyoPlayer': 0, 'ZifengFoldMan': 915, 'EvanPlayer': 3082, 'KLChen2PokerPlayer': 1248})
player [NitWinWin] gets hole card ['C6', 'DJ'], current stack 920
player [Jinkun] gets hole card ['S8', 'H6'], current stack 925
player [YueShi] gets hole card ['S3', 'CK'], current stack 910
player [ZifengFoldMan] gets hole card ['D6', 'CJ'], current stack 915
player [EvanPlayer] gets hole card ['HJ', 'D7'], current stack 3077
player [KLChen2PokerPlayer] gets hole card ['HA', 'C3'], current stack 1238
Started the round 38
Street "preflop" started. (community card = [])
"NitWinWin" declared "fold:0"
"Jinkun" declared "fold:10"
"YueShi" declared "fold:0"
"ZifengFoldMan" declared "fold:0"
"EvanPlayer" declared "fold:10"
"['KLChen2PokerPlayer']" won the round 38 (stack = {'ZPlayer': 0, 'NitWinWin': 920, 'Jinkun': 925, 'YueShi': 910, 'JoyoPlayer': 0, 'ZifengFoldMan': 915, 'EvanPlayer': 3077, 'KLChen2PokerPlayer': 1253})
player [NitWinWin] gets hole card ['ST', 'H2'], current stack 910
player [Jinkun] gets hole card ['D5', 'H6'], current stack 925
player [YueShi] gets hole card ['CQ', 'DT'], current stack 910
player [ZifengFoldMan] gets hole card ['DK', 'SA'], current stack 915
player [EvanPlayer] gets hole card ['D9', 'C2'], current stack 3077
player [KLChen2PokerPlayer] gets hole card ['D6', 'SQ'], current stack 1248
Started the round 39
Street "preflop" started. (community card = [])
"Jinkun" declared "fold:10"
"YueShi" declared "fold:0"
"ZifengFoldMan" declared "fold:0"
"EvanPlayer" declared "fold:10"
"KLChen2PokerPlayer" declared "call:10"
"NitWinWin" declared "fold:0"
"['KLChen2PokerPlayer']" won the round 39 (stack = {'ZPlayer': 0, 'NitWinWin': 910, 'Jinkun': 925, 'YueShi': 910, 'JoyoPlayer': 0, 'ZifengFoldMan': 915, 'EvanPlayer': 3077, 'KLChen2PokerPlayer': 1263})
player [NitWinWin] gets hole card ['DA', 'C6'], current stack 905
player [Jinkun] gets hole card ['S2', 'C9'], current stack 915
player [YueShi] gets hole card ['S4', 'D3'], current stack 910
player [ZifengFoldMan] gets hole card ['H6', 'DQ'], current stack 915
player [EvanPlayer] gets hole card ['S6', 'D5'], current stack 3077
player [KLChen2PokerPlayer] gets hole card ['SA', 'H3'], current stack 1263
Started the round 40
Street "preflop" started. (community card = [])
"YueShi" declared "fold:0"
"ZifengFoldMan" declared "fold:0"
"EvanPlayer" declared "fold:10"
"KLChen2PokerPlayer" declared "raise:17"
"NitWinWin" declared "fold:0"
"Jinkun" declared "fold:17"
"['KLChen2PokerPlayer']" won the round 40 (stack = {'ZPlayer': 0, 'NitWinWin': 905, 'Jinkun': 915, 'YueShi': 910, 'JoyoPlayer': 0, 'ZifengFoldMan': 915, 'EvanPlayer': 3077, 'KLChen2PokerPlayer': 1278})
player [NitWinWin] gets hole card ['D6', 'H8'], current stack 905
player [Jinkun] gets hole card ['D2', 'DQ'], current stack 910
player [YueShi] gets hole card ['SA', 'HT'], current stack 900
player [ZifengFoldMan] gets hole card ['ST', 'C2'], current stack 915
player [EvanPlayer] gets hole card ['CQ', 'D9'], current stack 3077
player [KLChen2PokerPlayer] gets hole card ['HQ', 'D7'], current stack 1278
Started the round 41
Street "preflop" started. (community card = [])
"ZifengFoldMan" declared "fold:0"
"EvanPlayer" declared "call:10"
"KLChen2PokerPlayer" declared "call:10"
"NitWinWin" declared "fold:0"
"Jinkun" declared "call:10"
"YueShi" declared "fold:0"
Street "flop" started. (community card = ['S5', 'HJ', 'C8'])
"Jinkun" declared "call:0"
"EvanPlayer" declared "fold:0"
"KLChen2PokerPlayer" declared "call:0"
Street "turn" started. (community card = ['S5', 'HJ', 'C8', 'S9'])
"Jinkun" declared "call:0"
"KLChen2PokerPlayer" declared "call:0"
Street "river" started. (community card = ['S5', 'HJ', 'C8', 'S9', 'D3'])
"Jinkun" declared "call:0"
"KLChen2PokerPlayer" declared "call:0"
"['KLChen2PokerPlayer']" won the round 41 (stack = {'ZPlayer': 0, 'NitWinWin': 905, 'Jinkun': 905, 'YueShi': 900, 'JoyoPlayer': 0, 'ZifengFoldMan': 915, 'EvanPlayer': 3067, 'KLChen2PokerPlayer': 1308})
player [NitWinWin] gets hole card ['D2', 'HA'], current stack 905
player [Jinkun] gets hole card ['DA', 'S2'], current stack 905
player [YueShi] gets hole card ['HQ', 'S4'], current stack 895
player [ZifengFoldMan] gets hole card ['H7', 'C5'], current stack 905
player [EvanPlayer] gets hole card ['C7', 'DQ'], current stack 3067
player [KLChen2PokerPlayer] gets hole card ['C3', 'S6'], current stack 1308
Started the round 42
Street "preflop" started. (community card = [])
"EvanPlayer" declared "call:10"
"KLChen2PokerPlayer" declared "fold:0"
"NitWinWin" declared "fold:0"
"Jinkun" declared "call:10"
"YueShi" declared "fold:0"
"ZifengFoldMan" declared "fold:0"
Street "flop" started. (community card = ['SA', 'H5', 'CT'])
"EvanPlayer" declared "fold:0"
"['Jinkun']" won the round 42 (stack = {'ZPlayer': 0, 'NitWinWin': 905, 'Jinkun': 930, 'YueShi': 895, 'JoyoPlayer': 0, 'ZifengFoldMan': 905, 'EvanPlayer': 3057, 'KLChen2PokerPlayer': 1308})
player [NitWinWin] gets hole card ['H5', 'ST'], current stack 905
player [Jinkun] gets hole card ['C4', 'D4'], current stack 930
player [YueShi] gets hole card ['C6', 'D2'], current stack 895
player [ZifengFoldMan] gets hole card ['S5', 'C8'], current stack 900
player [EvanPlayer] gets hole card ['CQ', 'SQ'], current stack 3047
player [KLChen2PokerPlayer] gets hole card ['DJ', 'C5'], current stack 1308
Started the round 43
Street "preflop" started. (community card = [])
"KLChen2PokerPlayer" declared "fold:0"
"NitWinWin" declared "fold:0"
"Jinkun" declared "call:10"
"YueShi" declared "fold:0"
"ZifengFoldMan" declared "fold:0"
"EvanPlayer" declared "raise:3057"
"Jinkun" declared "fold:3057"
"['EvanPlayer']" won the round 43 (stack = {'ZPlayer': 0, 'NitWinWin': 905, 'Jinkun': 920, 'YueShi': 895, 'JoyoPlayer': 0, 'ZifengFoldMan': 900, 'EvanPlayer': 3072, 'KLChen2PokerPlayer': 1308})
player [NitWinWin] gets hole card ['S9', 'S7'], current stack 905
player [Jinkun] gets hole card ['D9', 'DK'], current stack 920
player [YueShi] gets hole card ['S8', 'C2'], current stack 895
player [ZifengFoldMan] gets hole card ['S3', 'S2'], current stack 900
player [EvanPlayer] gets hole card ['H7', 'SA'], current stack 3067
player [KLChen2PokerPlayer] gets hole card ['S5', 'H2'], current stack 1298
Started the round 44
Street "preflop" started. (community card = [])
"NitWinWin" declared "fold:0"
"Jinkun" declared "fold:10"
"YueShi" declared "fold:0"
"ZifengFoldMan" declared "fold:0"
"EvanPlayer" declared "fold:10"
"['KLChen2PokerPlayer']" won the round 44 (stack = {'ZPlayer': 0, 'NitWinWin': 905, 'Jinkun': 920, 'YueShi': 895, 'JoyoPlayer': 0, 'ZifengFoldMan': 900, 'EvanPlayer': 3067, 'KLChen2PokerPlayer': 1313})
player [NitWinWin] gets hole card ['D7', 'HQ'], current stack 895
player [Jinkun] gets hole card ['C4', 'SK'], current stack 920
player [YueShi] gets hole card ['H7', 'D9'], current stack 895
player [ZifengFoldMan] gets hole card ['D5', 'DK'], current stack 900
player [EvanPlayer] gets hole card ['D6', 'HT'], current stack 3067
player [KLChen2PokerPlayer] gets hole card ['S5', 'CK'], current stack 1308
Started the round 45
Street "preflop" started. (community card = [])
"Jinkun" declared "fold:10"
"YueShi" declared "fold:0"
"ZifengFoldMan" declared "fold:0"
"EvanPlayer" declared "fold:10"
"KLChen2PokerPlayer" declared "raise:15"
"NitWinWin" declared "fold:0"
"['KLChen2PokerPlayer']" won the round 45 (stack = {'ZPlayer': 0, 'NitWinWin': 895, 'Jinkun': 920, 'YueShi': 895, 'JoyoPlayer': 0, 'ZifengFoldMan': 900, 'EvanPlayer': 3067, 'KLChen2PokerPlayer': 1323})
player [NitWinWin] gets hole card ['C3', 'SQ'], current stack 890
player [Jinkun] gets hole card ['H2', 'CT'], current stack 910
player [YueShi] gets hole card ['SA', 'D7'], current stack 895
player [ZifengFoldMan] gets hole card ['C9', 'S5'], current stack 900
player [EvanPlayer] gets hole card ['D3', 'D6'], current stack 3067
player [KLChen2PokerPlayer] gets hole card ['C4', 'DT'], current stack 1323
Started the round 46
Street "preflop" started. (community card = [])
"YueShi" declared "fold:0"
"ZifengFoldMan" declared "fold:0"
"EvanPlayer" declared "fold:10"
"KLChen2PokerPlayer" declared "fold:0"
"NitWinWin" declared "fold:0"
"['Jinkun']" won the round 46 (stack = {'ZPlayer': 0, 'NitWinWin': 890, 'Jinkun': 925, 'YueShi': 895, 'JoyoPlayer': 0, 'ZifengFoldMan': 900, 'EvanPlayer': 3067, 'KLChen2PokerPlayer': 1323})
player [NitWinWin] gets hole card ['H5', 'H7'], current stack 890
player [Jinkun] gets hole card ['C5', 'D7'], current stack 920
player [YueShi] gets hole card ['CK', 'HA'], current stack 885
player [ZifengFoldMan] gets hole card ['S3', 'C2'], current stack 900
player [EvanPlayer] gets hole card ['HQ', 'S5'], current stack 3067
player [KLChen2PokerPlayer] gets hole card ['HT', 'S4'], current stack 1323
Started the round 47
Street "preflop" started. (community card = [])
"ZifengFoldMan" declared "fold:0"
"EvanPlayer" declared "call:10"
"KLChen2PokerPlayer" declared "fold:0"
"NitWinWin" declared "fold:0"
"Jinkun" declared "call:10"
"YueShi" declared "fold:0"
Street "flop" started. (community card = ['ST', 'H9', 'DK'])
"Jinkun" declared "call:0"
"EvanPlayer" declared "fold:0"
"['Jinkun']" won the round 47 (stack = {'ZPlayer': 0, 'NitWinWin': 890, 'Jinkun': 945, 'YueShi': 885, 'JoyoPlayer': 0, 'ZifengFoldMan': 900, 'EvanPlayer': 3057, 'KLChen2PokerPlayer': 1323})
player [NitWinWin] gets hole card ['HQ', 'C8'], current stack 890
player [Jinkun] gets hole card ['H8', 'SJ'], current stack 945
player [YueShi] gets hole card ['DK', 'C6'], current stack 880
player [ZifengFoldMan] gets hole card ['D5', 'H9'], current stack 890
player [EvanPlayer] gets hole card ['S4', 'CT'], current stack 3057
player [KLChen2PokerPlayer] gets hole card ['H3', 'D4'], current stack 1323
Started the round 48
Street "preflop" started. (community card = [])
"EvanPlayer" declared "call:10"
"KLChen2PokerPlayer" declared "fold:0"
"NitWinWin" declared "fold:0"
"Jinkun" declared "call:10"
"YueShi" declared "fold:0"
"ZifengFoldMan" declared "fold:0"
Street "flop" started. (community card = ['DT', 'S8', 'C9'])
"EvanPlayer" declared "fold:0"
"['Jinkun']" won the round 48 (stack = {'ZPlayer': 0, 'NitWinWin': 890, 'Jinkun': 970, 'YueShi': 880, 'JoyoPlayer': 0, 'ZifengFoldMan': 890, 'EvanPlayer': 3047, 'KLChen2PokerPlayer': 1323})
player [NitWinWin] gets hole card ['H7', 'HJ'], current stack 890
player [Jinkun] gets hole card ['H5', 'DQ'], current stack 970
player [YueShi] gets hole card ['H2', 'D8'], current stack 880
player [ZifengFoldMan] gets hole card ['C7', 'SQ'], current stack 885
player [EvanPlayer] gets hole card ['S8', 'C8'], current stack 3037
player [KLChen2PokerPlayer] gets hole card ['CJ', 'DA'], current stack 1323
Started the round 49
Street "preflop" started. (community card = [])
"KLChen2PokerPlayer" declared "raise:24"
"NitWinWin" declared "fold:0"
"Jinkun" declared "fold:24"
"YueShi" declared "fold:0"
"ZifengFoldMan" declared "fold:0"
"EvanPlayer" declared "fold:24"
"['KLChen2PokerPlayer']" won the round 49 (stack = {'ZPlayer': 0, 'NitWinWin': 890, 'Jinkun': 970, 'YueShi': 880, 'JoyoPlayer': 0, 'ZifengFoldMan': 885, 'EvanPlayer': 3037, 'KLChen2PokerPlayer': 1338})
player [NitWinWin] gets hole card ['DQ', 'HA'], current stack 890
player [Jinkun] gets hole card ['H5', 'C5'], current stack 970
player [YueShi] gets hole card ['S4', 'D4'], current stack 880
player [ZifengFoldMan] gets hole card ['H2', 'C8'], current stack 885
player [EvanPlayer] gets hole card ['H3', 'C2'], current stack 3032
player [KLChen2PokerPlayer] gets hole card ['D6', 'S9'], current stack 1328
Started the round 50
Street "preflop" started. (community card = [])
"NitWinWin" declared "fold:0"
"Jinkun" declared "fold:10"
"YueShi" declared "fold:0"
"ZifengFoldMan" declared "fold:0"
"EvanPlayer" declared "fold:10"
"['KLChen2PokerPlayer']" won the round 50 (stack = {'ZPlayer': 0, 'NitWinWin': 890, 'Jinkun': 970, 'YueShi': 880, 'JoyoPlayer': 0, 'ZifengFoldMan': 885, 'EvanPlayer': 3032, 'KLChen2PokerPlayer': 1343})

Game Results:
------------------------------------------------------------
Game 1:
Winner: EvanPlayer (stack: 3032)
All players' stacks:
  ZPlayer: 0
  NitWinWin: 890
  Jinkun: 970
  YueShi: 880
  JoyoPlayer: 0
  ZifengFoldMan: 885
  EvanPlayer: 3032
  KLChen2PokerPlayer: 1343
------------------------------------------------------------
