player [ZPlayer] gets hole card ['CK', 'C8'], current stack 1000
player [NitWinWin] gets hole card ['S2', 'C7'], current stack 995
player [Jinkun] gets hole card ['CA', 'S5'], current stack 990
player [YueShi] gets hole card ['H7', 'HT'], current stack 1000
player [JoyoPlayer] gets hole card ['S6', 'S8'], current stack 1000
player [ZifengFoldMan] gets hole card ['H3', 'DK'], current stack 1000
player [EvanPlayer] gets hole card ['DQ', 'H9'], current stack 1000
player [KLChen2PokerPlayer] gets hole card ['DA', 'S7'], current stack 1000
Started the round 1
Street "preflop" started. (community card = [])
"YueShi" declared "fold:0"
"JoyoPlayer" declared "raise:15"
"ZifengFoldMan" declared "fold:0"
"EvanPlayer" declared "raise:1000"
"KLChen2PokerPlayer" declared "fold:0"
"ZPlayer" declared "fold:0"
"NitWinWin" declared "fold:0"
"Jinkun" declared "fold:1000"
"JoyoPlayer" declared "call:1000"
Street "flop" started. (community card = ['HJ', 'C6', 'HQ'])
Street "turn" started. (community card = ['HJ', 'C6', 'HQ', 'C2'])
Street "river" started. (community card = ['HJ', 'C6', 'HQ', 'C2', 'D5'])
"['EvanPlayer']" won the round 1 (stack = {'ZPlayer': 1000, 'NitWinWin': 995, 'Jinkun': 990, 'YueShi': 1000, 'JoyoPlayer': 0, 'ZifengFoldMan': 1000, 'EvanPlayer': 2015, 'KLChen2PokerPlayer': 1000})
player [ZPlayer] gets hole card ['HK', 'S2'], current stack 1000
player [NitWinWin] gets hole card ['D3', 'DQ'], current stack 995
player [Jinkun] gets hole card ['H3', 'CJ'], current stack 985
player [YueShi] gets hole card ['D9', 'SA'], current stack 990
player [ZifengFoldMan] gets hole card ['CA', 'S7'], current stack 1000
player [EvanPlayer] gets hole card ['H4', 'C7'], current stack 2015
player [KLChen2PokerPlayer] gets hole card ['H2', 'C8'], current stack 1000
Started the round 2
Street "preflop" started. (community card = [])
"ZifengFoldMan" declared "fold:0"
"EvanPlayer" declared "call:10"
"KLChen2PokerPlayer" declared "fold:0"
"ZPlayer" declared "fold:0"
"NitWinWin" declared "fold:0"
"Jinkun" declared "call:10"
"YueShi" declared "fold:0"
Street "flop" started. (community card = ['S3', 'C2', 'D7'])
"Jinkun" declared "call:0"
"EvanPlayer" declared "raise:2005"
"Jinkun" declared "fold:2005"
"['EvanPlayer']" won the round 2 (stack = {'ZPlayer': 1000, 'NitWinWin': 995, 'Jinkun': 980, 'YueShi': 990, 'JoyoPlayer': 0, 'ZifengFoldMan': 1000, 'EvanPlayer': 2035, 'KLChen2PokerPlayer': 1000})
player [ZPlayer] gets hole card ['CK', 'C8'], current stack 1000
player [NitWinWin] gets hole card ['C7', 'S4'], current stack 995
player [Jinkun] gets hole card ['S5', 'HA'], current stack 980
player [YueShi] gets hole card ['D5', 'S3'], current stack 985
player [ZifengFoldMan] gets hole card ['C2', 'H9'], current stack 990
player [EvanPlayer] gets hole card ['S9', 'D4'], current stack 2035
player [KLChen2PokerPlayer] gets hole card ['C4', 'D6'], current stack 1000
Started the round 3
Street "preflop" started. (community card = [])
"EvanPlayer" declared "call:10"
"KLChen2PokerPlayer" declared "call:10"
"ZPlayer" declared "raise:15"
"NitWinWin" declared "fold:0"
"Jinkun" declared "fold:15"
"YueShi" declared "fold:0"
"ZifengFoldMan" declared "fold:0"
"EvanPlayer" declared "fold:15"
"KLChen2PokerPlayer" declared "fold:0"
"['ZPlayer']" won the round 3 (stack = {'ZPlayer': 1035, 'NitWinWin': 995, 'Jinkun': 980, 'YueShi': 985, 'JoyoPlayer': 0, 'ZifengFoldMan': 990, 'EvanPlayer': 2025, 'KLChen2PokerPlayer': 990})
player [ZPlayer] gets hole card ['CA', 'DQ'], current stack 1035
player [NitWinWin] gets hole card ['D8', 'C9'], current stack 995
player [Jinkun] gets hole card ['C4', 'D9'], current stack 980
player [YueShi] gets hole card ['DA', 'H5'], current stack 985
player [ZifengFoldMan] gets hole card ['D6', 'C6'], current stack 985
player [EvanPlayer] gets hole card ['CT', 'S7'], current stack 2015
player [KLChen2PokerPlayer] gets hole card ['C7', 'C3'], current stack 990
Started the round 4
Street "preflop" started. (community card = [])
"KLChen2PokerPlayer" declared "call:10"
"ZPlayer" declared "raise:15"
"NitWinWin" declared "fold:0"
"Jinkun" declared "fold:15"
"YueShi" declared "fold:0"
"ZifengFoldMan" declared "fold:0"
"EvanPlayer" declared "fold:15"
"KLChen2PokerPlayer" declared "fold:0"
"['ZPlayer']" won the round 4 (stack = {'ZPlayer': 1060, 'NitWinWin': 995, 'Jinkun': 980, 'YueShi': 985, 'JoyoPlayer': 0, 'ZifengFoldMan': 985, 'EvanPlayer': 2015, 'KLChen2PokerPlayer': 980})
player [ZPlayer] gets hole card ['C6', 'SJ'], current stack 1060
player [NitWinWin] gets hole card ['C3', 'C9'], current stack 995
player [Jinkun] gets hole card ['HQ', 'HT'], current stack 980
player [YueShi] gets hole card ['SA', 'ST'], current stack 985
player [ZifengFoldMan] gets hole card ['DT', 'SQ'], current stack 985
player [EvanPlayer] gets hole card ['DJ', 'C8'], current stack 2010
player [KLChen2PokerPlayer] gets hole card ['S4', 'D4'], current stack 970
Started the round 5
Street "preflop" started. (community card = [])
"ZPlayer" declared "call:10"
"NitWinWin" declared "fold:0"
"Jinkun" declared "fold:10"
"YueShi" declared "fold:0"
"ZifengFoldMan" declared "fold:0"
"EvanPlayer" declared "fold:10"
"KLChen2PokerPlayer" declared "raise:28"
"ZPlayer" declared "call:28"
Street "flop" started. (community card = ['DQ', 'H8', 'H3'])
"KLChen2PokerPlayer" declared "raise:19"
"ZPlayer" declared "fold:0"
"['KLChen2PokerPlayer']" won the round 5 (stack = {'ZPlayer': 1032, 'NitWinWin': 995, 'Jinkun': 980, 'YueShi': 985, 'JoyoPlayer': 0, 'ZifengFoldMan': 985, 'EvanPlayer': 2010, 'KLChen2PokerPlayer': 1013})
player [ZPlayer] gets hole card ['C6', 'S4'], current stack 1022
player [NitWinWin] gets hole card ['C3', 'D5'], current stack 995
player [Jinkun] gets hole card ['CQ', 'H6'], current stack 980
player [YueShi] gets hole card ['CT', 'HA'], current stack 985
player [ZifengFoldMan] gets hole card ['ST', 'D8'], current stack 985
player [EvanPlayer] gets hole card ['H2', 'HQ'], current stack 2010
player [KLChen2PokerPlayer] gets hole card ['DT', 'HT'], current stack 1008
Started the round 6
Street "preflop" started. (community card = [])
"NitWinWin" declared "fold:0"
"Jinkun" declared "fold:10"
"YueShi" declared "fold:0"
"ZifengFoldMan" declared "fold:0"
"EvanPlayer" declared "fold:10"
"KLChen2PokerPlayer" declared "raise:17"
"ZPlayer" declared "call:17"
Street "flop" started. (community card = ['S8', 'D9', 'H9'])
"KLChen2PokerPlayer" declared "raise:25"
"ZPlayer" declared "fold:0"
"['KLChen2PokerPlayer']" won the round 6 (stack = {'ZPlayer': 1015, 'NitWinWin': 995, 'Jinkun': 980, 'YueShi': 985, 'JoyoPlayer': 0, 'ZifengFoldMan': 985, 'EvanPlayer': 2010, 'KLChen2PokerPlayer': 1030})
player [ZPlayer] gets hole card ['S3', 'CJ'], current stack 1010
player [NitWinWin] gets hole card ['CQ', 'SK'], current stack 985
player [Jinkun] gets hole card ['S2', 'D7'], current stack 980
player [YueShi] gets hole card ['C9', 'CA'], current stack 985
player [ZifengFoldMan] gets hole card ['H2', 'CK'], current stack 985
player [EvanPlayer] gets hole card ['HA', 'H6'], current stack 2010
player [KLChen2PokerPlayer] gets hole card ['S9', 'D6'], current stack 1030
Started the round 7
Street "preflop" started. (community card = [])
"Jinkun" declared "fold:10"
"YueShi" declared "fold:0"
"ZifengFoldMan" declared "fold:0"
"EvanPlayer" declared "call:10"
"KLChen2PokerPlayer" declared "raise:15"
"ZPlayer" declared "call:15"
"NitWinWin" declared "fold:0"
"EvanPlayer" declared "fold:15"
Street "flop" started. (community card = ['C2', 'HJ', 'H9'])
"ZPlayer" declared "raise:50"
"KLChen2PokerPlayer" declared "fold:0"
"['ZPlayer']" won the round 7 (stack = {'ZPlayer': 1050, 'NitWinWin': 985, 'Jinkun': 980, 'YueShi': 985, 'JoyoPlayer': 0, 'ZifengFoldMan': 985, 'EvanPlayer': 2000, 'KLChen2PokerPlayer': 1015})
player [ZPlayer] gets hole card ['D4', 'D3'], current stack 1050
player [NitWinWin] gets hole card ['SK', 'D6'], current stack 980
player [Jinkun] gets hole card ['DK', 'S5'], current stack 970
player [YueShi] gets hole card ['DJ', 'D7'], current stack 985
player [ZifengFoldMan] gets hole card ['H7', 'D2'], current stack 985
player [EvanPlayer] gets hole card ['CK', 'SA'], current stack 2000
player [KLChen2PokerPlayer] gets hole card ['C5', 'SQ'], current stack 1015
Started the round 8
Street "preflop" started. (community card = [])
"YueShi" declared "fold:0"
"ZifengFoldMan" declared "fold:0"
"EvanPlayer" declared "call:10"
"KLChen2PokerPlayer" declared "call:10"
"ZPlayer" declared "call:10"
"NitWinWin" declared "fold:0"
"Jinkun" declared "call:10"
Street "flop" started. (community card = ['CA', 'HJ', 'SJ'])
"Jinkun" declared "call:0"
"EvanPlayer" declared "call:0"
"KLChen2PokerPlayer" declared "call:0"
"ZPlayer" declared "call:0"
Street "turn" started. (community card = ['CA', 'HJ', 'SJ', 'HQ'])
"Jinkun" declared "call:0"
"EvanPlayer" declared "call:0"
"KLChen2PokerPlayer" declared "call:0"
"ZPlayer" declared "call:0"
Street "river" started. (community card = ['CA', 'HJ', 'SJ', 'HQ', 'DT'])
"Jinkun" declared "raise:20"
"EvanPlayer" declared "call:20"
"KLChen2PokerPlayer" declared "fold:0"
"ZPlayer" declared "fold:0"
"['Jinkun', 'EvanPlayer']" won the round 8 (stack = {'ZPlayer': 1040, 'NitWinWin': 980, 'Jinkun': 992, 'YueShi': 985, 'JoyoPlayer': 0, 'ZifengFoldMan': 985, 'EvanPlayer': 2012, 'KLChen2PokerPlayer': 1005})
player [ZPlayer] gets hole card ['S7', 'C3'], current stack 1040
player [NitWinWin] gets hole card ['H6', 'H3'], current stack 980
player [Jinkun] gets hole card ['H4', 'HQ'], current stack 987
player [YueShi] gets hole card ['HT', 'S6'], current stack 975
player [ZifengFoldMan] gets hole card ['D9', 'S4'], current stack 985
player [EvanPlayer] gets hole card ['C4', 'SJ'], current stack 2012
player [KLChen2PokerPlayer] gets hole card ['C2', 'C6'], current stack 1005
Started the round 9
Street "preflop" started. (community card = [])
"ZifengFoldMan" declared "fold:0"
"EvanPlayer" declared "call:10"
"KLChen2PokerPlayer" declared "fold:0"
"ZPlayer" declared "call:10"
"NitWinWin" declared "fold:0"
"Jinkun" declared "call:10"
"YueShi" declared "fold:0"
Street "flop" started. (community card = ['S8', 'DT', 'D2'])
"Jinkun" declared "call:0"
"EvanPlayer" declared "fold:0"
"ZPlayer" declared "call:0"
Street "turn" started. (community card = ['S8', 'DT', 'D2', 'C5'])
"Jinkun" declared "call:0"
"ZPlayer" declared "call:0"
Street "river" started. (community card = ['S8', 'DT', 'D2', 'C5', 'SQ'])
"Jinkun" declared "raise:16"
"ZPlayer" declared "fold:0"
"['Jinkun']" won the round 9 (stack = {'ZPlayer': 1030, 'NitWinWin': 980, 'Jinkun': 1022, 'YueShi': 975, 'JoyoPlayer': 0, 'ZifengFoldMan': 985, 'EvanPlayer': 2002, 'KLChen2PokerPlayer': 1005})
player [ZPlayer] gets hole card ['S4', 'H9'], current stack 1030
player [NitWinWin] gets hole card ['C2', 'H3'], current stack 980
player [Jinkun] gets hole card ['SJ', 'DT'], current stack 1022
player [YueShi] gets hole card ['D8', 'C5'], current stack 970
player [ZifengFoldMan] gets hole card ['H7', 'DK'], current stack 975
player [EvanPlayer] gets hole card ['S3', 'DJ'], current stack 2002
player [KLChen2PokerPlayer] gets hole card ['D7', 'S7'], current stack 1005
Started the round 10
Street "preflop" started. (community card = [])
"EvanPlayer" declared "call:10"
"KLChen2PokerPlayer" declared "raise:17"
"ZPlayer" declared "call:17"
"NitWinWin" declared "fold:0"
"Jinkun" declared "fold:17"
"YueShi" declared "fold:0"
"ZifengFoldMan" declared "fold:0"
"EvanPlayer" declared "fold:17"
Street "flop" started. (community card = ['D2', 'D4', 'S8'])
"KLChen2PokerPlayer" declared "raise:30"
"ZPlayer" declared "fold:0"
"['KLChen2PokerPlayer']" won the round 10 (stack = {'ZPlayer': 1013, 'NitWinWin': 980, 'Jinkun': 1022, 'YueShi': 970, 'JoyoPlayer': 0, 'ZifengFoldMan': 975, 'EvanPlayer': 1992, 'KLChen2PokerPlayer': 1047})
player [ZPlayer] gets hole card ['HA', 'ST'], current stack 1013
player [NitWinWin] gets hole card ['H9', 'DK'], current stack 980
player [Jinkun] gets hole card ['C7', 'S4'], current stack 1022
player [YueShi] gets hole card ['C3', 'S3'], current stack 970
player [ZifengFoldMan] gets hole card ['D3', 'DQ'], current stack 970
player [EvanPlayer] gets hole card ['D4', 'H4'], current stack 1982
player [KLChen2PokerPlayer] gets hole card ['CA', 'DJ'], current stack 1047
Started the round 11
Street "preflop" started. (community card = [])
"KLChen2PokerPlayer" declared "raise:19"
"ZPlayer" declared "fold:0"
"NitWinWin" declared "fold:0"
"Jinkun" declared "fold:19"
"YueShi" declared "fold:0"
"ZifengFoldMan" declared "fold:0"
"EvanPlayer" declared "raise:1992"
"KLChen2PokerPlayer" declared "fold:0"
"['EvanPlayer']" won the round 11 (stack = {'ZPlayer': 1013, 'NitWinWin': 980, 'Jinkun': 1022, 'YueShi': 970, 'JoyoPlayer': 0, 'ZifengFoldMan': 970, 'EvanPlayer': 2016, 'KLChen2PokerPlayer': 1028})
player [ZPlayer] gets hole card ['CA', 'S8'], current stack 1013
player [NitWinWin] gets hole card ['D9', 'HT'], current stack 980
player [Jinkun] gets hole card ['SJ', 'H8'], current stack 1022
player [YueShi] gets hole card ['S4', 'SA'], current stack 970
player [ZifengFoldMan] gets hole card ['D5', 'CT'], current stack 970
player [EvanPlayer] gets hole card ['HQ', 'S7'], current stack 2011
player [KLChen2PokerPlayer] gets hole card ['D6', 'H9'], current stack 1018
Started the round 12
Street "preflop" started. (community card = [])
"ZPlayer" declared "call:10"
"NitWinWin" declared "fold:0"
"Jinkun" declared "fold:10"
"YueShi" declared "fold:0"
"ZifengFoldMan" declared "fold:0"
"EvanPlayer" declared "fold:10"
"KLChen2PokerPlayer" declared "raise:15"
"ZPlayer" declared "call:15"
Street "flop" started. (community card = ['S9', 'SQ', 'S3'])
"KLChen2PokerPlayer" declared "raise:15"
"ZPlayer" declared "fold:0"
"['KLChen2PokerPlayer']" won the round 12 (stack = {'ZPlayer': 998, 'NitWinWin': 980, 'Jinkun': 1022, 'YueShi': 970, 'JoyoPlayer': 0, 'ZifengFoldMan': 970, 'EvanPlayer': 2011, 'KLChen2PokerPlayer': 1048})
player [ZPlayer] gets hole card ['S8', 'DQ'], current stack 988
player [NitWinWin] gets hole card ['D9', 'DT'], current stack 980
player [Jinkun] gets hole card ['C8', 'H5'], current stack 1022
player [YueShi] gets hole card ['CQ', 'H8'], current stack 970
player [ZifengFoldMan] gets hole card ['HJ', 'C7'], current stack 970
player [EvanPlayer] gets hole card ['C9', 'C4'], current stack 2011
player [KLChen2PokerPlayer] gets hole card ['S4', 'HK'], current stack 1043
Started the round 13
Street "preflop" started. (community card = [])
"NitWinWin" declared "fold:0"
"Jinkun" declared "fold:10"
"YueShi" declared "fold:0"
"ZifengFoldMan" declared "fold:0"
"EvanPlayer" declared "fold:10"
"KLChen2PokerPlayer" declared "raise:18"
"ZPlayer" declared "call:18"
Street "flop" started. (community card = ['D5', 'D6', 'S3'])
"KLChen2PokerPlayer" declared "raise:12"
"ZPlayer" declared "fold:0"
"['KLChen2PokerPlayer']" won the round 13 (stack = {'ZPlayer': 980, 'NitWinWin': 980, 'Jinkun': 1022, 'YueShi': 970, 'JoyoPlayer': 0, 'ZifengFoldMan': 970, 'EvanPlayer': 2011, 'KLChen2PokerPlayer': 1066})
player [ZPlayer] gets hole card ['D7', 'D3'], current stack 975
player [NitWinWin] gets hole card ['HT', 'H9'], current stack 970
player [Jinkun] gets hole card ['C9', 'S5'], current stack 1022
player [YueShi] gets hole card ['H2', 'S4'], current stack 970
player [ZifengFoldMan] gets hole card ['C7', 'H5'], current stack 970
player [EvanPlayer] gets hole card ['S2', 'S6'], current stack 2011
player [KLChen2PokerPlayer] gets hole card ['SQ', 'C4'], current stack 1066
Started the round 14
Street "preflop" started. (community card = [])
"Jinkun" declared "fold:10"
"YueShi" declared "fold:0"
"ZifengFoldMan" declared "fold:0"
"EvanPlayer" declared "fold:10"
"KLChen2PokerPlayer" declared "call:10"
"ZPlayer" declared "call:10"
"NitWinWin" declared "fold:0"
Street "flop" started. (community card = ['DK', 'SK', 'H8'])
"ZPlayer" declared "call:0"
"KLChen2PokerPlayer" declared "raise:16"
"ZPlayer" declared "fold:0"
"['KLChen2PokerPlayer']" won the round 14 (stack = {'ZPlayer': 970, 'NitWinWin': 970, 'Jinkun': 1022, 'YueShi': 970, 'JoyoPlayer': 0, 'ZifengFoldMan': 970, 'EvanPlayer': 2011, 'KLChen2PokerPlayer': 1086})
player [ZPlayer] gets hole card ['SA', 'DQ'], current stack 970
player [NitWinWin] gets hole card ['DT', 'HA'], current stack 965
player [Jinkun] gets hole card ['S2', 'H2'], current stack 1012
player [YueShi] gets hole card ['C5', 'H6'], current stack 970
player [ZifengFoldMan] gets hole card ['D3', 'C2'], current stack 970
player [EvanPlayer] gets hole card ['S6', 'C3'], current stack 2011
player [KLChen2PokerPlayer] gets hole card ['S7', 'CJ'], current stack 1086
Started the round 15
Street "preflop" started. (community card = [])
"YueShi" declared "fold:0"
"ZifengFoldMan" declared "fold:0"
"EvanPlayer" declared "fold:10"
"KLChen2PokerPlayer" declared "call:10"
"ZPlayer" declared "raise:15"
"NitWinWin" declared "fold:0"
"Jinkun" declared "fold:15"
"KLChen2PokerPlayer" declared "raise:20"
"ZPlayer" declared "call:20"
Street "flop" started. (community card = ['C6', 'SK', 'SJ'])
"KLChen2PokerPlayer" declared "raise:37"
"ZPlayer" declared "fold:0"
"['KLChen2PokerPlayer']" won the round 15 (stack = {'ZPlayer': 950, 'NitWinWin': 965, 'Jinkun': 1012, 'YueShi': 970, 'JoyoPlayer': 0, 'ZifengFoldMan': 970, 'EvanPlayer': 2011, 'KLChen2PokerPlayer': 1121})
player [ZPlayer] gets hole card ['C6', 'D9'], current stack 950
player [NitWinWin] gets hole card ['H2', 'CQ'], current stack 965
player [Jinkun] gets hole card ['DJ', 'H3'], current stack 1007
player [YueShi] gets hole card ['C5', 'HJ'], current stack 960
player [ZifengFoldMan] gets hole card ['DK', 'C7'], current stack 970
player [EvanPlayer] gets hole card ['H4', 'C2'], current stack 2011
player [KLChen2PokerPlayer] gets hole card ['CT', 'HQ'], current stack 1121
Started the round 16
Street "preflop" started. (community card = [])
"ZifengFoldMan" declared "fold:0"
"EvanPlayer" declared "fold:10"
"KLChen2PokerPlayer" declared "raise:19"
"ZPlayer" declared "call:19"
"NitWinWin" declared "fold:0"
"Jinkun" declared "fold:19"
"YueShi" declared "fold:0"
Street "flop" started. (community card = ['S3', 'SJ', 'D5'])
"KLChen2PokerPlayer" declared "call:0"
"ZPlayer" declared "call:0"
Street "turn" started. (community card = ['S3', 'SJ', 'D5', 'H8'])
"KLChen2PokerPlayer" declared "call:0"
"ZPlayer" declared "call:0"
Street "river" started. (community card = ['S3', 'SJ', 'D5', 'H8', 'HK'])
"KLChen2PokerPlayer" declared "call:0"
"ZPlayer" declared "call:0"
"['KLChen2PokerPlayer']" won the round 16 (stack = {'ZPlayer': 931, 'NitWinWin': 965, 'Jinkun': 1007, 'YueShi': 960, 'JoyoPlayer': 0, 'ZifengFoldMan': 970, 'EvanPlayer': 2011, 'KLChen2PokerPlayer': 1155})
player [ZPlayer] gets hole card ['D4', 'H3'], current stack 931
player [NitWinWin] gets hole card ['S4', 'D9'], current stack 965
player [Jinkun] gets hole card ['HK', 'D7'], current stack 1007
player [YueShi] gets hole card ['C3', 'CQ'], current stack 955
player [ZifengFoldMan] gets hole card ['HJ', 'H8'], current stack 960
player [EvanPlayer] gets hole card ['H7', 'DQ'], current stack 2011
player [KLChen2PokerPlayer] gets hole card ['S2', 'S6'], current stack 1155
Started the round 17
Street "preflop" started. (community card = [])
"EvanPlayer" declared "call:10"
"KLChen2PokerPlayer" declared "call:10"
"ZPlayer" declared "call:10"
"NitWinWin" declared "fold:0"
"Jinkun" declared "fold:10"
"YueShi" declared "fold:0"
"ZifengFoldMan" declared "fold:0"
Street "flop" started. (community card = ['C7', 'D6', 'DT'])
"EvanPlayer" declared "fold:0"
"KLChen2PokerPlayer" declared "raise:14"
"ZPlayer" declared "fold:0"
"['KLChen2PokerPlayer']" won the round 17 (stack = {'ZPlayer': 921, 'NitWinWin': 965, 'Jinkun': 1007, 'YueShi': 955, 'JoyoPlayer': 0, 'ZifengFoldMan': 960, 'EvanPlayer': 2001, 'KLChen2PokerPlayer': 1190})
player [ZPlayer] gets hole card ['CQ', 'C4'], current stack 921
player [NitWinWin] gets hole card ['S2', 'D9'], current stack 965
player [Jinkun] gets hole card ['C8', 'DA'], current stack 1007
player [YueShi] gets hole card ['C7', 'C5'], current stack 955
player [ZifengFoldMan] gets hole card ['DQ', 'H5'], current stack 955
player [EvanPlayer] gets hole card ['C3', 'C9'], current stack 1991
player [KLChen2PokerPlayer] gets hole card ['SK', 'H2'], current stack 1190
Started the round 18
Street "preflop" started. (community card = [])
"KLChen2PokerPlayer" declared "call:10"
"ZPlayer" declared "fold:0"
"NitWinWin" declared "fold:0"
"Jinkun" declared "fold:10"
"YueShi" declared "fold:0"
"ZifengFoldMan" declared "fold:0"
"EvanPlayer" declared "fold:10"
"['KLChen2PokerPlayer']" won the round 18 (stack = {'ZPlayer': 921, 'NitWinWin': 965, 'Jinkun': 1007, 'YueShi': 955, 'JoyoPlayer': 0, 'ZifengFoldMan': 955, 'EvanPlayer': 1991, 'KLChen2PokerPlayer': 1205})
player [ZPlayer] gets hole card ['C4', 'S9'], current stack 921
player [NitWinWin] gets hole card ['C8', 'DQ'], current stack 965
player [Jinkun] gets hole card ['H2', 'S8'], current stack 1007
player [YueShi] gets hole card ['D7', 'DA'], current stack 955
player [ZifengFoldMan] gets hole card ['CA', 'DT'], current stack 955
player [EvanPlayer] gets hole card ['HQ', 'S2'], current stack 1986
player [KLChen2PokerPlayer] gets hole card ['CK', 'CJ'], current stack 1195
Started the round 19
Street "preflop" started. (community card = [])
"ZPlayer" declared "call:10"
"NitWinWin" declared "fold:0"
"Jinkun" declared "fold:10"
"YueShi" declared "fold:0"
"ZifengFoldMan" declared "fold:0"
"EvanPlayer" declared "fold:10"
"KLChen2PokerPlayer" declared "raise:17"
"ZPlayer" declared "call:17"
Street "flop" started. (community card = ['S7', 'D9', 'H6'])
"KLChen2PokerPlayer" declared "call:0"
"ZPlayer" declared "raise:10"
"KLChen2PokerPlayer" declared "fold:0"
"['ZPlayer']" won the round 19 (stack = {'ZPlayer': 943, 'NitWinWin': 965, 'Jinkun': 1007, 'YueShi': 955, 'JoyoPlayer': 0, 'ZifengFoldMan': 955, 'EvanPlayer': 1986, 'KLChen2PokerPlayer': 1188})
player [ZPlayer] gets hole card ['HJ', 'SJ'], current stack 933
player [NitWinWin] gets hole card ['H6', 'SQ'], current stack 965
player [Jinkun] gets hole card ['DJ', 'CQ'], current stack 1007
player [YueShi] gets hole card ['H2', 'DQ'], current stack 955
player [ZifengFoldMan] gets hole card ['H7', 'DA'], current stack 955
player [EvanPlayer] gets hole card ['DK', 'S7'], current stack 1986
player [KLChen2PokerPlayer] gets hole card ['CA', 'C5'], current stack 1183
Started the round 20
Street "preflop" started. (community card = [])
"NitWinWin" declared "fold:0"
"Jinkun" declared "fold:10"
"YueShi" declared "fold:0"
"ZifengFoldMan" declared "fold:0"
"EvanPlayer" declared "fold:10"
"KLChen2PokerPlayer" declared "raise:15"
"ZPlayer" declared "raise:20"
"KLChen2PokerPlayer" declared "raise:25"
"ZPlayer" declared "call:25"
Street "flop" started. (community card = ['H8', 'HA', 'SA'])
"KLChen2PokerPlayer" declared "raise:33"
"ZPlayer" declared "call:33"
Street "turn" started. (community card = ['H8', 'HA', 'SA', 'CJ'])
"KLChen2PokerPlayer" declared "raise:414"
"ZPlayer" declared "raise:839"
"KLChen2PokerPlayer" declared "call:839"
Street "river" started. (community card = ['H8', 'HA', 'SA', 'CJ', 'D9'])
"KLChen2PokerPlayer" declared "raise:120"
"ZPlayer" declared "call:120"
"['ZPlayer']" won the round 20 (stack = {'ZPlayer': 1886, 'NitWinWin': 965, 'Jinkun': 1007, 'YueShi': 955, 'JoyoPlayer': 0, 'ZifengFoldMan': 955, 'EvanPlayer': 1986, 'KLChen2PokerPlayer': 245})
player [ZPlayer] gets hole card ['C4', 'H4'], current stack 1881
player [NitWinWin] gets hole card ['DT', 'D3'], current stack 955
player [Jinkun] gets hole card ['S7', 'SK'], current stack 1007
player [YueShi] gets hole card ['S5', 'D5'], current stack 955
player [ZifengFoldMan] gets hole card ['C7', 'SJ'], current stack 955
player [EvanPlayer] gets hole card ['H5', 'DQ'], current stack 1986
player [KLChen2PokerPlayer] gets hole card ['D7', 'C3'], current stack 245
Started the round 21
Street "preflop" started. (community card = [])
"Jinkun" declared "fold:10"
"YueShi" declared "fold:0"
"ZifengFoldMan" declared "fold:0"
"EvanPlayer" declared "raise:1986"
"KLChen2PokerPlayer" declared "fold:0"
"ZPlayer" declared "fold:0"
"NitWinWin" declared "fold:0"
"['EvanPlayer']" won the round 21 (stack = {'ZPlayer': 1881, 'NitWinWin': 955, 'Jinkun': 1007, 'YueShi': 955, 'JoyoPlayer': 0, 'ZifengFoldMan': 955, 'EvanPlayer': 2001, 'KLChen2PokerPlayer': 245})
player [ZPlayer] gets hole card ['C3', 'SA'], current stack 1881
player [NitWinWin] gets hole card ['D9', 'D8'], current stack 950
player [Jinkun] gets hole card ['S5', 'HA'], current stack 997
player [YueShi] gets hole card ['H2', 'S6'], current stack 955
player [ZifengFoldMan] gets hole card ['H4', 'S3'], current stack 955
player [EvanPlayer] gets hole card ['DQ', 'H7'], current stack 2001
player [KLChen2PokerPlayer] gets hole card ['C4', 'DT'], current stack 245
Started the round 22
Street "preflop" started. (community card = [])
"YueShi" declared "fold:0"
"ZifengFoldMan" declared "fold:0"
"EvanPlayer" declared "fold:10"
"KLChen2PokerPlayer" declared "fold:0"
"ZPlayer" declared "raise:15"
"NitWinWin" declared "fold:0"
"Jinkun" declared "call:15"
Street "flop" started. (community card = ['H8', 'D3', 'HJ'])
"Jinkun" declared "call:0"
"ZPlayer" declared "call:0"
Street "turn" started. (community card = ['H8', 'D3', 'HJ', 'SK'])
"Jinkun" declared "call:0"
"ZPlayer" declared "call:0"
Street "river" started. (community card = ['H8', 'D3', 'HJ', 'SK', 'D2'])
"Jinkun" declared "call:0"
"ZPlayer" declared "call:0"
"['ZPlayer']" won the round 22 (stack = {'ZPlayer': 1901, 'NitWinWin': 950, 'Jinkun': 992, 'YueShi': 955, 'JoyoPlayer': 0, 'ZifengFoldMan': 955, 'EvanPlayer': 2001, 'KLChen2PokerPlayer': 245})
player [ZPlayer] gets hole card ['C7', 'H4'], current stack 1901
player [NitWinWin] gets hole card ['SQ', 'C9'], current stack 950
player [Jinkun] gets hole card ['D5', 'S6'], current stack 987
player [YueShi] gets hole card ['H6', 'CJ'], current stack 945
player [ZifengFoldMan] gets hole card ['H7', 'C4'], current stack 955
player [EvanPlayer] gets hole card ['S8', 'DK'], current stack 2001
player [KLChen2PokerPlayer] gets hole card ['HA', 'DQ'], current stack 245
Started the round 23
Street "preflop" started. (community card = [])
"ZifengFoldMan" declared "fold:0"
"EvanPlayer" declared "raise:2001"
"KLChen2PokerPlayer" declared "fold:0"
"ZPlayer" declared "fold:0"
"NitWinWin" declared "fold:0"
"Jinkun" declared "fold:2001"
"YueShi" declared "fold:0"
"['EvanPlayer']" won the round 23 (stack = {'ZPlayer': 1901, 'NitWinWin': 950, 'Jinkun': 987, 'YueShi': 945, 'JoyoPlayer': 0, 'ZifengFoldMan': 955, 'EvanPlayer': 2016, 'KLChen2PokerPlayer': 245})
player [ZPlayer] gets hole card ['SA', 'HJ'], current stack 1901
player [NitWinWin] gets hole card ['CT', 'C4'], current stack 950
player [Jinkun] gets hole card ['CK', 'C2'], current stack 987
player [YueShi] gets hole card ['H6', 'H4'], current stack 940
player [ZifengFoldMan] gets hole card ['C6', 'C9'], current stack 945
player [EvanPlayer] gets hole card ['DK', 'S4'], current stack 2016
player [KLChen2PokerPlayer] gets hole card ['C5', 'S5'], current stack 245
Started the round 24
Street "preflop" started. (community card = [])
"EvanPlayer" declared "raise:2016"
"KLChen2PokerPlayer" declared "fold:0"
"ZPlayer" declared "fold:0"
"NitWinWin" declared "fold:0"
"Jinkun" declared "fold:2016"
"YueShi" declared "fold:0"
"ZifengFoldMan" declared "fold:0"
"['EvanPlayer']" won the round 24 (stack = {'ZPlayer': 1901, 'NitWinWin': 950, 'Jinkun': 987, 'YueShi': 940, 'JoyoPlayer': 0, 'ZifengFoldMan': 945, 'EvanPlayer': 2031, 'KLChen2PokerPlayer': 245})
player [ZPlayer] gets hole card ['SQ', 'HQ'], current stack 1901
player [NitWinWin] gets hole card ['S9', 'S3'], current stack 950
player [Jinkun] gets hole card ['H2', 'S7'], current stack 987
player [YueShi] gets hole card ['C9', 'H4'], current stack 940
player [ZifengFoldMan] gets hole card ['D4', 'H9'], current stack 940
player [EvanPlayer] gets hole card ['S5', 'DQ'], current stack 2021
player [KLChen2PokerPlayer] gets hole card ['CA', 'C7'], current stack 245
Started the round 25
Street "preflop" started. (community card = [])
"KLChen2PokerPlayer" declared "raise:20"
"ZPlayer" declared "raise:30"
"NitWinWin" declared "fold:0"
"Jinkun" declared "fold:30"
"YueShi" declared "fold:0"
"ZifengFoldMan" declared "fold:0"
"EvanPlayer" declared "fold:30"
"KLChen2PokerPlayer" declared "fold:0"
"['ZPlayer']" won the round 25 (stack = {'ZPlayer': 1936, 'NitWinWin': 950, 'Jinkun': 987, 'YueShi': 940, 'JoyoPlayer': 0, 'ZifengFoldMan': 940, 'EvanPlayer': 2021, 'KLChen2PokerPlayer': 225})
player [ZPlayer] gets hole card ['CJ', 'HQ'], current stack 1936
player [NitWinWin] gets hole card ['C4', 'SJ'], current stack 950
player [Jinkun] gets hole card ['H2', 'SQ'], current stack 987
player [YueShi] gets hole card ['ST', 'DQ'], current stack 940
player [ZifengFoldMan] gets hole card ['CQ', 'HK'], current stack 940
player [EvanPlayer] gets hole card ['S6', 'D4'], current stack 2016
player [KLChen2PokerPlayer] gets hole card ['DJ', 'H9'], current stack 215
Started the round 26
Street "preflop" started. (community card = [])
"ZPlayer" declared "raise:15"
"NitWinWin" declared "fold:0"
"Jinkun" declared "fold:15"
"YueShi" declared "fold:0"
"ZifengFoldMan" declared "fold:0"
"EvanPlayer" declared "fold:15"
"KLChen2PokerPlayer" declared "fold:0"
"['ZPlayer']" won the round 26 (stack = {'ZPlayer': 1951, 'NitWinWin': 950, 'Jinkun': 987, 'YueShi': 940, 'JoyoPlayer': 0, 'ZifengFoldMan': 940, 'EvanPlayer': 2016, 'KLChen2PokerPlayer': 215})
player [ZPlayer] gets hole card ['DJ', 'HT'], current stack 1941
player [NitWinWin] gets hole card ['H6', 'H3'], current stack 950
player [Jinkun] gets hole card ['DK', 'S8'], current stack 987
player [YueShi] gets hole card ['D5', 'S4'], current stack 940
player [ZifengFoldMan] gets hole card ['SA', 'C6'], current stack 940
player [EvanPlayer] gets hole card ['C7', 'HA'], current stack 2016
player [KLChen2PokerPlayer] gets hole card ['CT', 'S7'], current stack 210
Started the round 27
Street "preflop" started. (community card = [])
"NitWinWin" declared "fold:0"
"Jinkun" declared "fold:10"
"YueShi" declared "fold:0"
"ZifengFoldMan" declared "fold:0"
"EvanPlayer" declared "fold:10"
"KLChen2PokerPlayer" declared "call:10"
"ZPlayer" declared "raise:15"
"KLChen2PokerPlayer" declared "fold:0"
"['ZPlayer']" won the round 27 (stack = {'ZPlayer': 1961, 'NitWinWin': 950, 'Jinkun': 987, 'YueShi': 940, 'JoyoPlayer': 0, 'ZifengFoldMan': 940, 'EvanPlayer': 2016, 'KLChen2PokerPlayer': 205})
player [ZPlayer] gets hole card ['DT', 'HQ'], current stack 1956
player [NitWinWin] gets hole card ['S4', 'H3'], current stack 940
player [Jinkun] gets hole card ['HT', 'D6'], current stack 987
player [YueShi] gets hole card ['DK', 'H7'], current stack 940
player [ZifengFoldMan] gets hole card ['S5', 'CA'], current stack 940
player [EvanPlayer] gets hole card ['SQ', 'SK'], current stack 2016
player [KLChen2PokerPlayer] gets hole card ['H6', 'D7'], current stack 205
Started the round 28
Street "preflop" started. (community card = [])
"Jinkun" declared "fold:10"
"YueShi" declared "fold:0"
"ZifengFoldMan" declared "fold:0"
"EvanPlayer" declared "raise:2016"
"KLChen2PokerPlayer" declared "fold:0"
"ZPlayer" declared "fold:0"
"NitWinWin" declared "fold:0"
"['EvanPlayer']" won the round 28 (stack = {'ZPlayer': 1956, 'NitWinWin': 940, 'Jinkun': 987, 'YueShi': 940, 'JoyoPlayer': 0, 'ZifengFoldMan': 940, 'EvanPlayer': 2031, 'KLChen2PokerPlayer': 205})
player [ZPlayer] gets hole card ['C3', 'DJ'], current stack 1956
player [NitWinWin] gets hole card ['DT', 'H9'], current stack 935
player [Jinkun] gets hole card ['ST', 'S6'], current stack 977
player [YueShi] gets hole card ['C6', 'HQ'], current stack 940
player [ZifengFoldMan] gets hole card ['C9', 'H8'], current stack 940
player [EvanPlayer] gets hole card ['HK', 'H5'], current stack 2031
player [KLChen2PokerPlayer] gets hole card ['SQ', 'DQ'], current stack 205
Started the round 29
Street "preflop" started. (community card = [])
"YueShi" declared "fold:0"
"ZifengFoldMan" declared "fold:0"
"EvanPlayer" declared "call:10"
"KLChen2PokerPlayer" declared "raise:22"
"ZPlayer" declared "raise:34"
"NitWinWin" declared "fold:0"
"Jinkun" declared "fold:34"
"EvanPlayer" declared "raise:2031"
"KLChen2PokerPlayer" declared "fold:0"
"ZPlayer" declared "fold:0"
"['EvanPlayer']" won the round 29 (stack = {'ZPlayer': 1922, 'NitWinWin': 935, 'Jinkun': 977, 'YueShi': 940, 'JoyoPlayer': 0, 'ZifengFoldMan': 940, 'EvanPlayer': 2102, 'KLChen2PokerPlayer': 183})
player [ZPlayer] gets hole card ['S9', 'DA'], current stack 1922
player [NitWinWin] gets hole card ['ST', 'H2'], current stack 935
player [Jinkun] gets hole card ['CJ', 'S3'], current stack 972
player [YueShi] gets hole card ['D6', 'C8'], current stack 930
player [ZifengFoldMan] gets hole card ['HQ', 'H9'], current stack 940
player [EvanPlayer] gets hole card ['H7', 'S2'], current stack 2102
player [KLChen2PokerPlayer] gets hole card ['D2', 'H5'], current stack 183
Started the round 30
Street "preflop" started. (community card = [])
"ZifengFoldMan" declared "fold:0"
"EvanPlayer" declared "raise:2102"
"KLChen2PokerPlayer" declared "fold:0"
"ZPlayer" declared "fold:0"
"NitWinWin" declared "fold:0"
"Jinkun" declared "fold:2102"
"YueShi" declared "fold:0"
"['EvanPlayer']" won the round 30 (stack = {'ZPlayer': 1922, 'NitWinWin': 935, 'Jinkun': 972, 'YueShi': 930, 'JoyoPlayer': 0, 'ZifengFoldMan': 940, 'EvanPlayer': 2117, 'KLChen2PokerPlayer': 183})
player [ZPlayer] gets hole card ['CK', 'D2'], current stack 1922
player [NitWinWin] gets hole card ['D7', 'S6'], current stack 935
player [Jinkun] gets hole card ['H4', 'S4'], current stack 972
player [YueShi] gets hole card ['DA', 'H9'], current stack 925
player [ZifengFoldMan] gets hole card ['S5', 'C3'], current stack 930
player [EvanPlayer] gets hole card ['HJ', 'C6'], current stack 2117
player [KLChen2PokerPlayer] gets hole card ['ST', 'S7'], current stack 183
Started the round 31
Street "preflop" started. (community card = [])
"EvanPlayer" declared "call:10"
"KLChen2PokerPlayer" declared "raise:16"
"ZPlayer" declared "raise:22"
"NitWinWin" declared "fold:0"
"Jinkun" declared "fold:22"
"YueShi" declared "fold:0"
"ZifengFoldMan" declared "fold:0"
"EvanPlayer" declared "fold:22"
"KLChen2PokerPlayer" declared "call:22"
Street "flop" started. (community card = ['C9', 'SK', 'D5'])
"KLChen2PokerPlayer" declared "call:0"
"ZPlayer" declared "raise:10"
"KLChen2PokerPlayer" declared "fold:0"
"['ZPlayer']" won the round 31 (stack = {'ZPlayer': 1969, 'NitWinWin': 935, 'Jinkun': 972, 'YueShi': 925, 'JoyoPlayer': 0, 'ZifengFoldMan': 930, 'EvanPlayer': 2107, 'KLChen2PokerPlayer': 161})
player [ZPlayer] gets hole card ['DA', 'C5'], current stack 1969
player [NitWinWin] gets hole card ['HK', 'D5'], current stack 935
player [Jinkun] gets hole card ['S4', 'H7'], current stack 972
player [YueShi] gets hole card ['DK', 'H3'], current stack 925
player [ZifengFoldMan] gets hole card ['S7', 'C8'], current stack 925
player [EvanPlayer] gets hole card ['HJ', 'D2'], current stack 2097
player [KLChen2PokerPlayer] gets hole card ['CA', 'DQ'], current stack 161
Started the round 32
Street "preflop" started. (community card = [])
"KLChen2PokerPlayer" declared "raise:28"
"ZPlayer" declared "raise:46"
"NitWinWin" declared "fold:0"
"Jinkun" declared "fold:46"
"YueShi" declared "fold:0"
"ZifengFoldMan" declared "fold:0"
"EvanPlayer" declared "fold:46"
"KLChen2PokerPlayer" declared "fold:0"
"['ZPlayer']" won the round 32 (stack = {'ZPlayer': 2012, 'NitWinWin': 935, 'Jinkun': 972, 'YueShi': 925, 'JoyoPlayer': 0, 'ZifengFoldMan': 925, 'EvanPlayer': 2097, 'KLChen2PokerPlayer': 133})
player [ZPlayer] gets hole card ['CT', 'C2'], current stack 2012
player [NitWinWin] gets hole card ['C4', 'S8'], current stack 935
player [Jinkun] gets hole card ['H7', 'S7'], current stack 972
player [YueShi] gets hole card ['D6', 'ST'], current stack 925
player [ZifengFoldMan] gets hole card ['H6', 'H8'], current stack 925
player [EvanPlayer] gets hole card ['SJ', 'SK'], current stack 2092
player [KLChen2PokerPlayer] gets hole card ['DJ', 'HK'], current stack 123
Started the round 33
Street "preflop" started. (community card = [])
"ZPlayer" declared "raise:15"
"NitWinWin" declared "fold:0"
"Jinkun" declared "fold:15"
"YueShi" declared "fold:0"
"ZifengFoldMan" declared "fold:0"
"EvanPlayer" declared "call:15"
"KLChen2PokerPlayer" declared "raise:20"
"ZPlayer" declared "call:20"
"EvanPlayer" declared "fold:20"
Street "flop" started. (community card = ['DK', 'DT', 'H5'])
"KLChen2PokerPlayer" declared "raise:31"
"ZPlayer" declared "call:31"
Street "turn" started. (community card = ['DK', 'DT', 'H5', 'CA'])
"KLChen2PokerPlayer" declared "raise:29"
"ZPlayer" declared "fold:0"
"['KLChen2PokerPlayer']" won the round 33 (stack = {'ZPlayer': 1961, 'NitWinWin': 935, 'Jinkun': 972, 'YueShi': 925, 'JoyoPlayer': 0, 'ZifengFoldMan': 925, 'EvanPlayer': 2082, 'KLChen2PokerPlayer': 199})
player [ZPlayer] gets hole card ['HT', 'S3'], current stack 1951
player [NitWinWin] gets hole card ['S7', 'HJ'], current stack 935
player [Jinkun] gets hole card ['H8', 'C7'], current stack 972
player [YueShi] gets hole card ['CJ', 'H7'], current stack 925
player [ZifengFoldMan] gets hole card ['ST', 'C2'], current stack 925
player [EvanPlayer] gets hole card ['CK', 'HK'], current stack 2082
player [KLChen2PokerPlayer] gets hole card ['C4', 'CT'], current stack 194
Started the round 34
Street "preflop" started. (community card = [])
"NitWinWin" declared "fold:0"
"Jinkun" declared "fold:10"
"YueShi" declared "fold:0"
"ZifengFoldMan" declared "fold:0"
"EvanPlayer" declared "raise:2082"
"KLChen2PokerPlayer" declared "fold:0"
"ZPlayer" declared "fold:0"
"['EvanPlayer']" won the round 34 (stack = {'ZPlayer': 1951, 'NitWinWin': 935, 'Jinkun': 972, 'YueShi': 925, 'JoyoPlayer': 0, 'ZifengFoldMan': 925, 'EvanPlayer': 2097, 'KLChen2PokerPlayer': 194})
player [ZPlayer] gets hole card ['D3', 'S4'], current stack 1946
player [NitWinWin] gets hole card ['D6', 'D2'], current stack 925
player [Jinkun] gets hole card ['D8', 'C4'], current stack 972
player [YueShi] gets hole card ['H2', 'H3'], current stack 925
player [ZifengFoldMan] gets hole card ['SJ', 'H4'], current stack 925
player [EvanPlayer] gets hole card ['DK', 'H5'], current stack 2097
player [KLChen2PokerPlayer] gets hole card ['SA', 'C5'], current stack 194
Started the round 35
Street "preflop" started. (community card = [])
"Jinkun" declared "fold:10"
"YueShi" declared "fold:0"
"ZifengFoldMan" declared "fold:0"
"EvanPlayer" declared "fold:10"
"KLChen2PokerPlayer" declared "raise:21"
"ZPlayer" declared "fold:0"
"NitWinWin" declared "fold:0"
"['KLChen2PokerPlayer']" won the round 35 (stack = {'ZPlayer': 1946, 'NitWinWin': 925, 'Jinkun': 972, 'YueShi': 925, 'JoyoPlayer': 0, 'ZifengFoldMan': 925, 'EvanPlayer': 2097, 'KLChen2PokerPlayer': 209})
player [ZPlayer] gets hole card ['HQ', 'DJ'], current stack 1946
player [NitWinWin] gets hole card ['D7', 'C8'], current stack 920
player [Jinkun] gets hole card ['HJ', 'CJ'], current stack 962
player [YueShi] gets hole card ['S4', 'S7'], current stack 925
player [ZifengFoldMan] gets hole card ['DA', 'CK'], current stack 925
player [EvanPlayer] gets hole card ['H8', 'H7'], current stack 2097
player [KLChen2PokerPlayer] gets hole card ['H5', 'C2'], current stack 209
Started the round 36
Street "preflop" started. (community card = [])
"YueShi" declared "fold:0"
"ZifengFoldMan" declared "fold:0"
"EvanPlayer" declared "raise:2097"
"KLChen2PokerPlayer" declared "fold:0"
"ZPlayer" declared "fold:0"
"NitWinWin" declared "fold:0"
"Jinkun" declared "fold:2097"
"['EvanPlayer']" won the round 36 (stack = {'ZPlayer': 1946, 'NitWinWin': 920, 'Jinkun': 962, 'YueShi': 925, 'JoyoPlayer': 0, 'ZifengFoldMan': 925, 'EvanPlayer': 2112, 'KLChen2PokerPlayer': 209})
player [ZPlayer] gets hole card ['HK', 'CT'], current stack 1946
player [NitWinWin] gets hole card ['ST', 'HJ'], current stack 920
player [Jinkun] gets hole card ['S8', 'D8'], current stack 957
player [YueShi] gets hole card ['HQ', 'D3'], current stack 915
player [ZifengFoldMan] gets hole card ['SA', 'S3'], current stack 925
player [EvanPlayer] gets hole card ['C7', 'HA'], current stack 2112
player [KLChen2PokerPlayer] gets hole card ['DT', 'SJ'], current stack 209
Started the round 37
Street "preflop" started. (community card = [])
"ZifengFoldMan" declared "fold:0"
"EvanPlayer" declared "call:10"
"KLChen2PokerPlayer" declared "raise:16"
"ZPlayer" declared "raise:22"
"NitWinWin" declared "fold:0"
"Jinkun" declared "fold:22"
"YueShi" declared "fold:0"
"EvanPlayer" declared "call:22"
"KLChen2PokerPlayer" declared "fold:0"
Street "flop" started. (community card = ['HT', 'C2', 'D4'])
"EvanPlayer" declared "fold:0"
"['ZPlayer']" won the round 37 (stack = {'ZPlayer': 1999, 'NitWinWin': 920, 'Jinkun': 957, 'YueShi': 915, 'JoyoPlayer': 0, 'ZifengFoldMan': 925, 'EvanPlayer': 2090, 'KLChen2PokerPlayer': 193})
player [ZPlayer] gets hole card ['DK', 'C3'], current stack 1999
player [NitWinWin] gets hole card ['ST', 'D5'], current stack 920
player [Jinkun] gets hole card ['S9', 'D3'], current stack 957
player [YueShi] gets hole card ['SJ', 'H5'], current stack 910
player [ZifengFoldMan] gets hole card ['D2', 'C5'], current stack 915
player [EvanPlayer] gets hole card ['C8', 'S4'], current stack 2090
player [KLChen2PokerPlayer] gets hole card ['S5', 'S3'], current stack 193
Started the round 38
Street "preflop" started. (community card = [])
"EvanPlayer" declared "call:10"
"KLChen2PokerPlayer" declared "call:10"
"ZPlayer" declared "raise:15"
"NitWinWin" declared "fold:0"
"Jinkun" declared "fold:15"
"YueShi" declared "fold:0"
"ZifengFoldMan" declared "fold:0"
"EvanPlayer" declared "fold:15"
"KLChen2PokerPlayer" declared "fold:0"
"['ZPlayer']" won the round 38 (stack = {'ZPlayer': 2034, 'NitWinWin': 920, 'Jinkun': 957, 'YueShi': 910, 'JoyoPlayer': 0, 'ZifengFoldMan': 915, 'EvanPlayer': 2080, 'KLChen2PokerPlayer': 183})
player [ZPlayer] gets hole card ['CT', 'S5'], current stack 2034
player [NitWinWin] gets hole card ['HK', 'H3'], current stack 920
player [Jinkun] gets hole card ['C7', 'H5'], current stack 957
player [YueShi] gets hole card ['D6', 'DQ'], current stack 910
player [ZifengFoldMan] gets hole card ['CK', 'HT'], current stack 910
player [EvanPlayer] gets hole card ['C8', 'SA'], current stack 2070
player [KLChen2PokerPlayer] gets hole card ['C2', 'H8'], current stack 183
Started the round 39
Street "preflop" started. (community card = [])
"KLChen2PokerPlayer" declared "fold:0"
"ZPlayer" declared "raise:15"
"NitWinWin" declared "fold:0"
"Jinkun" declared "fold:15"
"YueShi" declared "fold:0"
"ZifengFoldMan" declared "fold:0"
"EvanPlayer" declared "fold:15"
"['ZPlayer']" won the round 39 (stack = {'ZPlayer': 2049, 'NitWinWin': 920, 'Jinkun': 957, 'YueShi': 910, 'JoyoPlayer': 0, 'ZifengFoldMan': 910, 'EvanPlayer': 2070, 'KLChen2PokerPlayer': 183})
player [ZPlayer] gets hole card ['CK', 'H5'], current stack 2049
player [NitWinWin] gets hole card ['H9', 'CT'], current stack 920
player [Jinkun] gets hole card ['H3', 'D4'], current stack 957
player [YueShi] gets hole card ['H7', 'S7'], current stack 910
player [ZifengFoldMan] gets hole card ['D8', 'S4'], current stack 910
player [EvanPlayer] gets hole card ['HA', 'HT'], current stack 2065
player [KLChen2PokerPlayer] gets hole card ['C8', 'SJ'], current stack 173
Started the round 40
Street "preflop" started. (community card = [])
"ZPlayer" declared "raise:15"
"NitWinWin" declared "fold:0"
"Jinkun" declared "fold:15"
"YueShi" declared "fold:0"
"ZifengFoldMan" declared "fold:0"
"EvanPlayer" declared "call:15"
"KLChen2PokerPlayer" declared "raise:20"
"ZPlayer" declared "call:20"
"EvanPlayer" declared "raise:2070"
"KLChen2PokerPlayer" declared "fold:0"
"ZPlayer" declared "fold:0"
"['EvanPlayer']" won the round 40 (stack = {'ZPlayer': 2029, 'NitWinWin': 920, 'Jinkun': 957, 'YueShi': 910, 'JoyoPlayer': 0, 'ZifengFoldMan': 910, 'EvanPlayer': 2110, 'KLChen2PokerPlayer': 163})
player [ZPlayer] gets hole card ['CT', 'CA'], current stack 2019
player [NitWinWin] gets hole card ['HA', 'C8'], current stack 920
player [Jinkun] gets hole card ['D4', 'S2'], current stack 957
player [YueShi] gets hole card ['HQ', 'DJ'], current stack 910
player [ZifengFoldMan] gets hole card ['CQ', 'S6'], current stack 910
player [EvanPlayer] gets hole card ['S9', 'H9'], current stack 2110
player [KLChen2PokerPlayer] gets hole card ['CK', 'H4'], current stack 158
Started the round 41
Street "preflop" started. (community card = [])
"NitWinWin" declared "fold:0"
"Jinkun" declared "fold:10"
"YueShi" declared "fold:0"
"ZifengFoldMan" declared "fold:0"
"EvanPlayer" declared "fold:10"
"KLChen2PokerPlayer" declared "raise:27"
"ZPlayer" declared "call:27"
Street "flop" started. (community card = ['S7', 'H2', 'CJ'])
"KLChen2PokerPlayer" declared "call:0"
"ZPlayer" declared "call:0"
Street "turn" started. (community card = ['S7', 'H2', 'CJ', 'H7'])
"KLChen2PokerPlayer" declared "call:0"
"ZPlayer" declared "call:0"
Street "river" started. (community card = ['S7', 'H2', 'CJ', 'H7', 'D8'])
"KLChen2PokerPlayer" declared "call:0"
"ZPlayer" declared "call:0"
"['ZPlayer']" won the round 41 (stack = {'ZPlayer': 2056, 'NitWinWin': 920, 'Jinkun': 957, 'YueShi': 910, 'JoyoPlayer': 0, 'ZifengFoldMan': 910, 'EvanPlayer': 2110, 'KLChen2PokerPlayer': 136})
player [ZPlayer] gets hole card ['HT', 'C8'], current stack 2051
player [NitWinWin] gets hole card ['H7', 'S3'], current stack 910
player [Jinkun] gets hole card ['C9', 'D8'], current stack 957
player [YueShi] gets hole card ['S4', 'DT'], current stack 910
player [ZifengFoldMan] gets hole card ['C3', 'CK'], current stack 910
player [EvanPlayer] gets hole card ['CJ', 'D6'], current stack 2110
player [KLChen2PokerPlayer] gets hole card ['H3', 'D7'], current stack 136
Started the round 42
Street "preflop" started. (community card = [])
"Jinkun" declared "fold:10"
"YueShi" declared "fold:0"
"ZifengFoldMan" declared "fold:0"
"EvanPlayer" declared "fold:10"
"KLChen2PokerPlayer" declared "raise:18"
"ZPlayer" declared "raise:26"
"NitWinWin" declared "fold:0"
"KLChen2PokerPlayer" declared "fold:0"
"['ZPlayer']" won the round 42 (stack = {'ZPlayer': 2084, 'NitWinWin': 910, 'Jinkun': 957, 'YueShi': 910, 'JoyoPlayer': 0, 'ZifengFoldMan': 910, 'EvanPlayer': 2110, 'KLChen2PokerPlayer': 118})
player [ZPlayer] gets hole card ['SA', 'HQ'], current stack 2084
player [NitWinWin] gets hole card ['H6', 'H4'], current stack 905
player [Jinkun] gets hole card ['HJ', 'HT'], current stack 947
player [YueShi] gets hole card ['HK', 'C7'], current stack 910
player [ZifengFoldMan] gets hole card ['D5', 'S2'], current stack 910
player [EvanPlayer] gets hole card ['D9', 'DT'], current stack 2110
player [KLChen2PokerPlayer] gets hole card ['H3', 'D8'], current stack 118
Started the round 43
Street "preflop" started. (community card = [])
"YueShi" declared "fold:0"
"ZifengFoldMan" declared "fold:0"
"EvanPlayer" declared "raise:2110"
"KLChen2PokerPlayer" declared "fold:0"
"ZPlayer" declared "fold:0"
"NitWinWin" declared "fold:0"
"Jinkun" declared "fold:2110"
"['EvanPlayer']" won the round 43 (stack = {'ZPlayer': 2084, 'NitWinWin': 905, 'Jinkun': 947, 'YueShi': 910, 'JoyoPlayer': 0, 'ZifengFoldMan': 910, 'EvanPlayer': 2125, 'KLChen2PokerPlayer': 118})
player [ZPlayer] gets hole card ['HT', 'H4'], current stack 2084
player [NitWinWin] gets hole card ['DQ', 'S4'], current stack 905
player [Jinkun] gets hole card ['S7', 'HK'], current stack 942
player [YueShi] gets hole card ['SA', 'D4'], current stack 900
player [ZifengFoldMan] gets hole card ['D7', 'DK'], current stack 910
player [EvanPlayer] gets hole card ['S8', 'CJ'], current stack 2125
player [KLChen2PokerPlayer] gets hole card ['D3', 'S9'], current stack 118
Started the round 44
Street "preflop" started. (community card = [])
"ZifengFoldMan" declared "fold:0"
"EvanPlayer" declared "call:10"
"KLChen2PokerPlayer" declared "fold:0"
"ZPlayer" declared "raise:15"
"NitWinWin" declared "fold:0"
"Jinkun" declared "fold:15"
"YueShi" declared "fold:0"
"EvanPlayer" declared "fold:15"
"['ZPlayer']" won the round 44 (stack = {'ZPlayer': 2109, 'NitWinWin': 905, 'Jinkun': 942, 'YueShi': 900, 'JoyoPlayer': 0, 'ZifengFoldMan': 910, 'EvanPlayer': 2115, 'KLChen2PokerPlayer': 118})
player [ZPlayer] gets hole card ['H4', 'ST'], current stack 2109
player [NitWinWin] gets hole card ['SQ', 'S5'], current stack 905
player [Jinkun] gets hole card ['SK', 'H5'], current stack 942
player [YueShi] gets hole card ['DK', 'D9'], current stack 895
player [ZifengFoldMan] gets hole card ['DJ', 'SA'], current stack 900
player [EvanPlayer] gets hole card ['CT', 'CQ'], current stack 2115
player [KLChen2PokerPlayer] gets hole card ['D3', 'C5'], current stack 118
Started the round 45
Street "preflop" started. (community card = [])
"EvanPlayer" declared "raise:2115"
"KLChen2PokerPlayer" declared "fold:0"
"ZPlayer" declared "fold:0"
"NitWinWin" declared "fold:0"
"Jinkun" declared "fold:2115"
"YueShi" declared "fold:0"
"ZifengFoldMan" declared "fold:0"
"['EvanPlayer']" won the round 45 (stack = {'ZPlayer': 2109, 'NitWinWin': 905, 'Jinkun': 942, 'YueShi': 895, 'JoyoPlayer': 0, 'ZifengFoldMan': 900, 'EvanPlayer': 2130, 'KLChen2PokerPlayer': 118})
player [ZPlayer] gets hole card ['HJ', 'S2'], current stack 2109
player [NitWinWin] gets hole card ['DQ', 'CA'], current stack 905
player [Jinkun] gets hole card ['H5', 'C7'], current stack 942
player [YueShi] gets hole card ['H8', 'HA'], current stack 895
player [ZifengFoldMan] gets hole card ['H2', 'H6'], current stack 895
player [EvanPlayer] gets hole card ['DA', 'C5'], current stack 2120
player [KLChen2PokerPlayer] gets hole card ['D4', 'C2'], current stack 118
Started the round 46
Street "preflop" started. (community card = [])
"KLChen2PokerPlayer" declared "fold:0"
"ZPlayer" declared "raise:15"
"NitWinWin" declared "fold:0"
"Jinkun" declared "fold:15"
"YueShi" declared "fold:0"
"ZifengFoldMan" declared "fold:0"
"EvanPlayer" declared "fold:15"
"['ZPlayer']" won the round 46 (stack = {'ZPlayer': 2124, 'NitWinWin': 905, 'Jinkun': 942, 'YueShi': 895, 'JoyoPlayer': 0, 'ZifengFoldMan': 895, 'EvanPlayer': 2120, 'KLChen2PokerPlayer': 118})
player [ZPlayer] gets hole card ['DK', 'DQ'], current stack 2124
player [NitWinWin] gets hole card ['H2', 'CJ'], current stack 905
player [Jinkun] gets hole card ['D3', 'D2'], current stack 942
player [YueShi] gets hole card ['D8', 'D5'], current stack 895
player [ZifengFoldMan] gets hole card ['SA', 'S2'], current stack 895
player [EvanPlayer] gets hole card ['C8', 'SQ'], current stack 2115
player [KLChen2PokerPlayer] gets hole card ['H9', 'S9'], current stack 108
Started the round 47
Street "preflop" started. (community card = [])
"ZPlayer" declared "raise:15"
"NitWinWin" declared "fold:0"
"Jinkun" declared "fold:15"
"YueShi" declared "fold:0"
"ZifengFoldMan" declared "fold:0"
"EvanPlayer" declared "fold:15"
"KLChen2PokerPlayer" declared "raise:20"
"ZPlayer" declared "call:20"
Street "flop" started. (community card = ['DT', 'CA', 'C3'])
"KLChen2PokerPlayer" declared "raise:10"
"ZPlayer" declared "fold:0"
"['KLChen2PokerPlayer']" won the round 47 (stack = {'ZPlayer': 2104, 'NitWinWin': 905, 'Jinkun': 942, 'YueShi': 895, 'JoyoPlayer': 0, 'ZifengFoldMan': 895, 'EvanPlayer': 2115, 'KLChen2PokerPlayer': 143})
player [ZPlayer] gets hole card ['S6', 'H9'], current stack 2094
player [NitWinWin] gets hole card ['C5', 'HQ'], current stack 905
player [Jinkun] gets hole card ['SJ', 'SQ'], current stack 942
player [YueShi] gets hole card ['DQ', 'H8'], current stack 895
player [ZifengFoldMan] gets hole card ['D9', 'SA'], current stack 895
player [EvanPlayer] gets hole card ['HT', 'ST'], current stack 2115
player [KLChen2PokerPlayer] gets hole card ['CT', 'S8'], current stack 138
Started the round 48
Street "preflop" started. (community card = [])
"NitWinWin" declared "fold:0"
"Jinkun" declared "fold:10"
"YueShi" declared "fold:0"
"ZifengFoldMan" declared "fold:0"
"EvanPlayer" declared "call:10"
"KLChen2PokerPlayer" declared "raise:15"
"ZPlayer" declared "raise:20"
"EvanPlayer" declared "call:20"
"KLChen2PokerPlayer" declared "call:20"
Street "flop" started. (community card = ['S3', 'C6', 'H4'])
"KLChen2PokerPlayer" declared "call:0"
"ZPlayer" declared "raise:10"
"EvanPlayer" declared "fold:10"
"KLChen2PokerPlayer" declared "fold:0"
"['ZPlayer']" won the round 48 (stack = {'ZPlayer': 2144, 'NitWinWin': 905, 'Jinkun': 942, 'YueShi': 895, 'JoyoPlayer': 0, 'ZifengFoldMan': 895, 'EvanPlayer': 2095, 'KLChen2PokerPlayer': 123})
player [ZPlayer] gets hole card ['HT', 'H7'], current stack 2139
player [NitWinWin] gets hole card ['C5', 'CA'], current stack 895
player [Jinkun] gets hole card ['DQ', 'H5'], current stack 942
player [YueShi] gets hole card ['DT', 'H9'], current stack 895
player [ZifengFoldMan] gets hole card ['D4', 'S7'], current stack 895
player [EvanPlayer] gets hole card ['C8', 'S2'], current stack 2095
player [KLChen2PokerPlayer] gets hole card ['C7', 'HK'], current stack 123
Started the round 49
Street "preflop" started. (community card = [])
"Jinkun" declared "fold:10"
"YueShi" declared "fold:0"
"ZifengFoldMan" declared "fold:0"
"EvanPlayer" declared "raise:2095"
"KLChen2PokerPlayer" declared "fold:0"
"ZPlayer" declared "fold:0"
"NitWinWin" declared "fold:0"
"['EvanPlayer']" won the round 49 (stack = {'ZPlayer': 2139, 'NitWinWin': 895, 'Jinkun': 942, 'YueShi': 895, 'JoyoPlayer': 0, 'ZifengFoldMan': 895, 'EvanPlayer': 2110, 'KLChen2PokerPlayer': 123})
player [ZPlayer] gets hole card ['S5', 'DA'], current stack 2139
player [NitWinWin] gets hole card ['D5', 'ST'], current stack 890
player [Jinkun] gets hole card ['CK', 'SK'], current stack 932
player [YueShi] gets hole card ['H5', 'S8'], current stack 895
player [ZifengFoldMan] gets hole card ['C2', 'D3'], current stack 895
player [EvanPlayer] gets hole card ['HQ', 'C5'], current stack 2110
player [KLChen2PokerPlayer] gets hole card ['D4', 'D7'], current stack 123
Started the round 50
Street "preflop" started. (community card = [])
"YueShi" declared "fold:0"
"ZifengFoldMan" declared "fold:0"
"EvanPlayer" declared "raise:2110"
"KLChen2PokerPlayer" declared "fold:0"
"ZPlayer" declared "fold:0"
"NitWinWin" declared "fold:0"
"Jinkun" declared "fold:2110"
"['EvanPlayer']" won the round 50 (stack = {'ZPlayer': 2139, 'NitWinWin': 890, 'Jinkun': 932, 'YueShi': 895, 'JoyoPlayer': 0, 'ZifengFoldMan': 895, 'EvanPlayer': 2125, 'KLChen2PokerPlayer': 123})

Game Results:
------------------------------------------------------------
Game 1:
Winner: ZPlayer (stack: 2139)
All players' stacks:
  ZPlayer: 2139
  NitWinWin: 890
  Jinkun: 932
  YueShi: 895
  JoyoPlayer: 0
  ZifengFoldMan: 895
  EvanPlayer: 2125
  KLChen2PokerPlayer: 123
------------------------------------------------------------
