player [ZPlayer] gets hole card ['S3', 'S5'], current stack 1000
player [NitWinWin] gets hole card ['CQ', 'H4'], current stack 995
player [Jinkun] gets hole card ['HQ', 'HJ'], current stack 990
player [YueShi] gets hole card ['DJ', 'D4'], current stack 1000
player [JoyoPlayer] gets hole card ['D6', 'HK'], current stack 1000
player [ZifengFoldMan] gets hole card ['C7', 'SQ'], current stack 1000
player [EvanPlayer] gets hole card ['DQ', 'CK'], current stack 1000
player [KLChen2PokerPlayer] gets hole card ['D8', 'ST'], current stack 1000
Started the round 1
Street "preflop" started. (community card = [])
"YueShi" declared "fold:0"
"JoyoPlayer" declared "raise:15"
"ZifengFoldMan" declared "fold:0"
"EvanPlayer" declared "raise:1000"
"KLChen2PokerPlayer" declared "fold:0"
"ZPlayer" declared "fold:0"
"NitWinWin" declared "fold:0"
"Jinkun" declared "fold:1000"
"JoyoPlayer" declared "call:1000"
Street "flop" started. (community card = ['C5', 'S2', 'HT'])
Street "turn" started. (community card = ['C5', 'S2', 'HT', 'DT'])
Street "river" started. (community card = ['C5', 'S2', 'HT', 'DT', 'H9'])
"['EvanPlayer']" won the round 1 (stack = {'ZPlayer': 1000, 'NitWinWin': 995, 'Jinkun': 990, 'YueShi': 1000, 'JoyoPlayer': 0, 'ZifengFoldMan': 1000, 'EvanPlayer': 2015, 'KLChen2PokerPlayer': 1000})
player [ZPlayer] gets hole card ['S6', 'C3'], current stack 1000
player [NitWinWin] gets hole card ['DQ', 'D7'], current stack 995
player [Jinkun] gets hole card ['SK', 'HA'], current stack 985
player [YueShi] gets hole card ['CK', 'H9'], current stack 990
player [ZifengFoldMan] gets hole card ['S3', 'SQ'], current stack 1000
player [EvanPlayer] gets hole card ['D8', 'C2'], current stack 2015
player [KLChen2PokerPlayer] gets hole card ['HT', 'DA'], current stack 1000
Started the round 2
Street "preflop" started. (community card = [])
"ZifengFoldMan" declared "fold:0"
"EvanPlayer" declared "fold:10"
"KLChen2PokerPlayer" declared "raise:18"
"ZPlayer" declared "fold:0"
"NitWinWin" declared "fold:0"
"Jinkun" declared "fold:18"
"YueShi" declared "fold:0"
"['KLChen2PokerPlayer']" won the round 2 (stack = {'ZPlayer': 1000, 'NitWinWin': 995, 'Jinkun': 985, 'YueShi': 990, 'JoyoPlayer': 0, 'ZifengFoldMan': 1000, 'EvanPlayer': 2015, 'KLChen2PokerPlayer': 1015})
player [ZPlayer] gets hole card ['CK', 'DJ'], current stack 1000
player [NitWinWin] gets hole card ['DQ', 'SQ'], current stack 995
player [Jinkun] gets hole card ['ST', 'C6'], current stack 985
player [YueShi] gets hole card ['C3', 'SA'], current stack 985
player [ZifengFoldMan] gets hole card ['S9', 'H5'], current stack 990
player [EvanPlayer] gets hole card ['C5', 'HQ'], current stack 2015
player [KLChen2PokerPlayer] gets hole card ['S3', 'C7'], current stack 1015
Started the round 3
Street "preflop" started. (community card = [])
"EvanPlayer" declared "raise:2015"
"KLChen2PokerPlayer" declared "fold:0"
"ZPlayer" declared "fold:0"
"NitWinWin" declared "call:2015"
"Jinkun" declared "fold:2015"
"YueShi" declared "fold:0"
"ZifengFoldMan" declared "fold:0"
Street "flop" started. (community card = ['D7', 'H8', 'S5'])
Street "turn" started. (community card = ['D7', 'H8', 'S5', 'CA'])
Street "river" started. (community card = ['D7', 'H8', 'S5', 'CA', 'DK'])
"['NitWinWin']" won the round 3 (stack = {'ZPlayer': 1000, 'NitWinWin': 2005, 'Jinkun': 985, 'YueShi': 985, 'JoyoPlayer': 0, 'ZifengFoldMan': 990, 'EvanPlayer': 1020, 'KLChen2PokerPlayer': 1015})
player [ZPlayer] gets hole card ['DQ', 'HJ'], current stack 1000
player [NitWinWin] gets hole card ['C9', 'H4'], current stack 2005
player [Jinkun] gets hole card ['H8', 'S9'], current stack 985
player [YueShi] gets hole card ['D4', 'DK'], current stack 985
player [ZifengFoldMan] gets hole card ['C6', 'C3'], current stack 985
player [EvanPlayer] gets hole card ['D8', 'C2'], current stack 1010
player [KLChen2PokerPlayer] gets hole card ['D3', 'S4'], current stack 1015
Started the round 4
Street "preflop" started. (community card = [])
"KLChen2PokerPlayer" declared "fold:0"
"ZPlayer" declared "raise:15"
"NitWinWin" declared "fold:0"
"Jinkun" declared "fold:15"
"YueShi" declared "fold:0"
"ZifengFoldMan" declared "fold:0"
"EvanPlayer" declared "fold:15"
"['ZPlayer']" won the round 4 (stack = {'ZPlayer': 1015, 'NitWinWin': 2005, 'Jinkun': 985, 'YueShi': 985, 'JoyoPlayer': 0, 'ZifengFoldMan': 985, 'EvanPlayer': 1010, 'KLChen2PokerPlayer': 1015})
player [ZPlayer] gets hole card ['DJ', 'HQ'], current stack 1015
player [NitWinWin] gets hole card ['D4', 'H6'], current stack 2005
player [Jinkun] gets hole card ['SQ', 'D8'], current stack 985
player [YueShi] gets hole card ['HJ', 'DK'], current stack 985
player [ZifengFoldMan] gets hole card ['D2', 'CJ'], current stack 985
player [EvanPlayer] gets hole card ['C9', 'S3'], current stack 1005
player [KLChen2PokerPlayer] gets hole card ['H9', 'H5'], current stack 1005
Started the round 5
Street "preflop" started. (community card = [])
"ZPlayer" declared "raise:15"
"NitWinWin" declared "fold:0"
"Jinkun" declared "fold:15"
"YueShi" declared "fold:0"
"ZifengFoldMan" declared "fold:0"
"EvanPlayer" declared "fold:15"
"KLChen2PokerPlayer" declared "raise:20"
"ZPlayer" declared "call:20"
Street "flop" started. (community card = ['H4', 'CQ', 'DQ'])
"KLChen2PokerPlayer" declared "call:0"
"ZPlayer" declared "raise:45"
"KLChen2PokerPlayer" declared "fold:0"
"['ZPlayer']" won the round 5 (stack = {'ZPlayer': 1040, 'NitWinWin': 2005, 'Jinkun': 985, 'YueShi': 985, 'JoyoPlayer': 0, 'ZifengFoldMan': 985, 'EvanPlayer': 1005, 'KLChen2PokerPlayer': 995})
player [ZPlayer] gets hole card ['S3', 'SQ'], current stack 1030
player [NitWinWin] gets hole card ['C2', 'D8'], current stack 2005
player [Jinkun] gets hole card ['H5', 'DK'], current stack 985
player [YueShi] gets hole card ['C8', 'DQ'], current stack 985
player [ZifengFoldMan] gets hole card ['C3', 'SJ'], current stack 985
player [EvanPlayer] gets hole card ['S4', 'DT'], current stack 1005
player [KLChen2PokerPlayer] gets hole card ['D2', 'H4'], current stack 990
Started the round 6
Street "preflop" started. (community card = [])
"NitWinWin" declared "fold:0"
"Jinkun" declared "fold:10"
"YueShi" declared "fold:0"
"ZifengFoldMan" declared "fold:0"
"EvanPlayer" declared "raise:1005"
"KLChen2PokerPlayer" declared "fold:0"
"ZPlayer" declared "fold:0"
"['EvanPlayer']" won the round 6 (stack = {'ZPlayer': 1030, 'NitWinWin': 2005, 'Jinkun': 985, 'YueShi': 985, 'JoyoPlayer': 0, 'ZifengFoldMan': 985, 'EvanPlayer': 1020, 'KLChen2PokerPlayer': 990})
player [ZPlayer] gets hole card ['S7', 'D5'], current stack 1025
player [NitWinWin] gets hole card ['SK', 'DT'], current stack 1995
player [Jinkun] gets hole card ['DJ', 'ST'], current stack 985
player [YueShi] gets hole card ['S8', 'H6'], current stack 985
player [ZifengFoldMan] gets hole card ['D6', 'CT'], current stack 985
player [EvanPlayer] gets hole card ['CQ', 'C3'], current stack 1020
player [KLChen2PokerPlayer] gets hole card ['DA', 'H3'], current stack 990
Started the round 7
Street "preflop" started. (community card = [])
"Jinkun" declared "fold:10"
"YueShi" declared "fold:0"
"ZifengFoldMan" declared "fold:0"
"EvanPlayer" declared "fold:10"
"KLChen2PokerPlayer" declared "raise:21"
"ZPlayer" declared "call:21"
"NitWinWin" declared "fold:0"
Street "flop" started. (community card = ['S4', 'H9', 'D3'])
"ZPlayer" declared "call:0"
"KLChen2PokerPlayer" declared "call:0"
Street "turn" started. (community card = ['S4', 'H9', 'D3', 'SQ'])
"ZPlayer" declared "call:0"
"KLChen2PokerPlayer" declared "call:0"
Street "river" started. (community card = ['S4', 'H9', 'D3', 'SQ', 'S2'])
"ZPlayer" declared "call:0"
"KLChen2PokerPlayer" declared "call:0"
"['KLChen2PokerPlayer']" won the round 7 (stack = {'ZPlayer': 1009, 'NitWinWin': 1995, 'Jinkun': 985, 'YueShi': 985, 'JoyoPlayer': 0, 'ZifengFoldMan': 985, 'EvanPlayer': 1020, 'KLChen2PokerPlayer': 1021})
player [ZPlayer] gets hole card ['S5', 'H3'], current stack 1009
player [NitWinWin] gets hole card ['H8', 'D7'], current stack 1990
player [Jinkun] gets hole card ['D9', 'DK'], current stack 975
player [YueShi] gets hole card ['C6', 'SJ'], current stack 985
player [ZifengFoldMan] gets hole card ['D3', 'DJ'], current stack 985
player [EvanPlayer] gets hole card ['C8', 'S4'], current stack 1020
player [KLChen2PokerPlayer] gets hole card ['H4', 'CQ'], current stack 1021
Started the round 8
Street "preflop" started. (community card = [])
"YueShi" declared "fold:0"
"ZifengFoldMan" declared "fold:0"
"EvanPlayer" declared "fold:10"
"KLChen2PokerPlayer" declared "call:10"
"ZPlayer" declared "call:10"
"NitWinWin" declared "fold:0"
"Jinkun" declared "call:10"
Street "flop" started. (community card = ['DA', 'HT', 'C9'])
"Jinkun" declared "call:0"
"KLChen2PokerPlayer" declared "call:0"
"ZPlayer" declared "call:0"
Street "turn" started. (community card = ['DA', 'HT', 'C9', 'S2'])
"Jinkun" declared "call:0"
"KLChen2PokerPlayer" declared "call:0"
"ZPlayer" declared "call:0"
Street "river" started. (community card = ['DA', 'HT', 'C9', 'S2', 'S3'])
"Jinkun" declared "call:0"
"KLChen2PokerPlayer" declared "call:0"
"ZPlayer" declared "call:0"
"['Jinkun']" won the round 8 (stack = {'ZPlayer': 999, 'NitWinWin': 1990, 'Jinkun': 1010, 'YueShi': 985, 'JoyoPlayer': 0, 'ZifengFoldMan': 985, 'EvanPlayer': 1020, 'KLChen2PokerPlayer': 1011})
player [ZPlayer] gets hole card ['D7', 'D3'], current stack 999
player [NitWinWin] gets hole card ['D6', 'C6'], current stack 1990
player [Jinkun] gets hole card ['H5', 'ST'], current stack 1005
player [YueShi] gets hole card ['S4', 'D4'], current stack 975
player [ZifengFoldMan] gets hole card ['S2', 'HT'], current stack 985
player [EvanPlayer] gets hole card ['D2', 'D5'], current stack 1020
player [KLChen2PokerPlayer] gets hole card ['S8', 'C9'], current stack 1011
Started the round 9
Street "preflop" started. (community card = [])
"ZifengFoldMan" declared "fold:0"
"EvanPlayer" declared "call:10"
"KLChen2PokerPlayer" declared "raise:15"
"ZPlayer" declared "call:15"
"NitWinWin" declared "fold:0"
"Jinkun" declared "fold:15"
"YueShi" declared "fold:0"
"EvanPlayer" declared "fold:15"
Street "flop" started. (community card = ['SK', 'SQ', 'C5'])
"KLChen2PokerPlayer" declared "call:0"
"ZPlayer" declared "call:0"
Street "turn" started. (community card = ['SK', 'SQ', 'C5', 'DQ'])
"KLChen2PokerPlayer" declared "call:0"
"ZPlayer" declared "call:0"
Street "river" started. (community card = ['SK', 'SQ', 'C5', 'DQ', 'H2'])
"KLChen2PokerPlayer" declared "call:0"
"ZPlayer" declared "call:0"
"['KLChen2PokerPlayer']" won the round 9 (stack = {'ZPlayer': 984, 'NitWinWin': 1990, 'Jinkun': 1005, 'YueShi': 975, 'JoyoPlayer': 0, 'ZifengFoldMan': 985, 'EvanPlayer': 1010, 'KLChen2PokerPlayer': 1051})
player [ZPlayer] gets hole card ['H5', 'DA'], current stack 984
player [NitWinWin] gets hole card ['S6', 'D2'], current stack 1990
player [Jinkun] gets hole card ['H8', 'H4'], current stack 1005
player [YueShi] gets hole card ['C2', 'CT'], current stack 970
player [ZifengFoldMan] gets hole card ['H9', 'D3'], current stack 975
player [EvanPlayer] gets hole card ['S7', 'C6'], current stack 1010
player [KLChen2PokerPlayer] gets hole card ['H2', 'D8'], current stack 1051
Started the round 10
Street "preflop" started. (community card = [])
"EvanPlayer" declared "raise:1010"
"KLChen2PokerPlayer" declared "fold:0"
"ZPlayer" declared "fold:0"
"NitWinWin" declared "fold:0"
"Jinkun" declared "fold:1010"
"YueShi" declared "fold:0"
"ZifengFoldMan" declared "fold:0"
"['EvanPlayer']" won the round 10 (stack = {'ZPlayer': 984, 'NitWinWin': 1990, 'Jinkun': 1005, 'YueShi': 970, 'JoyoPlayer': 0, 'ZifengFoldMan': 975, 'EvanPlayer': 1025, 'KLChen2PokerPlayer': 1051})
player [ZPlayer] gets hole card ['SJ', 'D6'], current stack 984
player [NitWinWin] gets hole card ['D3', 'D7'], current stack 1990
player [Jinkun] gets hole card ['DT', 'S4'], current stack 1005
player [YueShi] gets hole card ['H2', 'C9'], current stack 970
player [ZifengFoldMan] gets hole card ['H8', 'S2'], current stack 970
player [EvanPlayer] gets hole card ['HT', 'C5'], current stack 1015
player [KLChen2PokerPlayer] gets hole card ['C4', 'H7'], current stack 1051
Started the round 11
Street "preflop" started. (community card = [])
"KLChen2PokerPlayer" declared "fold:0"
"ZPlayer" declared "call:10"
"NitWinWin" declared "fold:0"
"Jinkun" declared "fold:10"
"YueShi" declared "fold:0"
"ZifengFoldMan" declared "fold:0"
"EvanPlayer" declared "fold:10"
"['ZPlayer']" won the round 11 (stack = {'ZPlayer': 999, 'NitWinWin': 1990, 'Jinkun': 1005, 'YueShi': 970, 'JoyoPlayer': 0, 'ZifengFoldMan': 970, 'EvanPlayer': 1015, 'KLChen2PokerPlayer': 1051})
player [ZPlayer] gets hole card ['C5', 'DJ'], current stack 999
player [NitWinWin] gets hole card ['H5', 'HK'], current stack 1990
player [Jinkun] gets hole card ['C2', 'HA'], current stack 1005
player [YueShi] gets hole card ['C7', 'H3'], current stack 970
player [ZifengFoldMan] gets hole card ['CT', 'DA'], current stack 970
player [EvanPlayer] gets hole card ['D4', 'H9'], current stack 1010
player [KLChen2PokerPlayer] gets hole card ['S3', 'HJ'], current stack 1041
Started the round 12
Street "preflop" started. (community card = [])
"ZPlayer" declared "call:10"
"NitWinWin" declared "fold:0"
"Jinkun" declared "fold:10"
"YueShi" declared "fold:0"
"ZifengFoldMan" declared "fold:0"
"EvanPlayer" declared "fold:10"
"KLChen2PokerPlayer" declared "call:10"
Street "flop" started. (community card = ['D2', 'HT', 'SK'])
"KLChen2PokerPlayer" declared "call:0"
"ZPlayer" declared "call:0"
Street "turn" started. (community card = ['D2', 'HT', 'SK', 'C8'])
"KLChen2PokerPlayer" declared "call:0"
"ZPlayer" declared "call:0"
Street "river" started. (community card = ['D2', 'HT', 'SK', 'C8', 'S8'])
"KLChen2PokerPlayer" declared "call:0"
"ZPlayer" declared "call:0"
"['ZPlayer', 'KLChen2PokerPlayer']" won the round 12 (stack = {'ZPlayer': 1001, 'NitWinWin': 1990, 'Jinkun': 1005, 'YueShi': 970, 'JoyoPlayer': 0, 'ZifengFoldMan': 970, 'EvanPlayer': 1010, 'KLChen2PokerPlayer': 1053})
player [ZPlayer] gets hole card ['CQ', 'DQ'], current stack 991
player [NitWinWin] gets hole card ['S4', 'C8'], current stack 1990
player [Jinkun] gets hole card ['HK', 'D6'], current stack 1005
player [YueShi] gets hole card ['C6', 'H8'], current stack 970
player [ZifengFoldMan] gets hole card ['CT', 'DT'], current stack 970
player [EvanPlayer] gets hole card ['CK', 'H5'], current stack 1010
player [KLChen2PokerPlayer] gets hole card ['DA', 'C2'], current stack 1048
Started the round 13
Street "preflop" started. (community card = [])
"NitWinWin" declared "fold:0"
"Jinkun" declared "fold:10"
"YueShi" declared "fold:0"
"ZifengFoldMan" declared "fold:0"
"EvanPlayer" declared "fold:10"
"KLChen2PokerPlayer" declared "raise:15"
"ZPlayer" declared "raise:20"
"KLChen2PokerPlayer" declared "call:20"
Street "flop" started. (community card = ['S7', 'C3', 'CJ'])
"KLChen2PokerPlayer" declared "call:0"
"ZPlayer" declared "raise:10"
"KLChen2PokerPlayer" declared "fold:0"
"['ZPlayer']" won the round 13 (stack = {'ZPlayer': 1021, 'NitWinWin': 1990, 'Jinkun': 1005, 'YueShi': 970, 'JoyoPlayer': 0, 'ZifengFoldMan': 970, 'EvanPlayer': 1010, 'KLChen2PokerPlayer': 1033})
player [ZPlayer] gets hole card ['ST', 'D5'], current stack 1016
player [NitWinWin] gets hole card ['H4', 'D7'], current stack 1980
player [Jinkun] gets hole card ['D2', 'H5'], current stack 1005
player [YueShi] gets hole card ['DT', 'D3'], current stack 970
player [ZifengFoldMan] gets hole card ['DK', 'C7'], current stack 970
player [EvanPlayer] gets hole card ['C2', 'H8'], current stack 1010
player [KLChen2PokerPlayer] gets hole card ['H9', 'C6'], current stack 1033
Started the round 14
Street "preflop" started. (community card = [])
"Jinkun" declared "fold:10"
"YueShi" declared "fold:0"
"ZifengFoldMan" declared "fold:0"
"EvanPlayer" declared "fold:10"
"KLChen2PokerPlayer" declared "fold:0"
"ZPlayer" declared "raise:15"
"NitWinWin" declared "fold:0"
"['ZPlayer']" won the round 14 (stack = {'ZPlayer': 1031, 'NitWinWin': 1980, 'Jinkun': 1005, 'YueShi': 970, 'JoyoPlayer': 0, 'ZifengFoldMan': 970, 'EvanPlayer': 1010, 'KLChen2PokerPlayer': 1033})
player [ZPlayer] gets hole card ['H2', 'S8'], current stack 1031
player [NitWinWin] gets hole card ['C7', 'CK'], current stack 1975
player [Jinkun] gets hole card ['SJ', 'D3'], current stack 995
player [YueShi] gets hole card ['ST', 'C4'], current stack 970
player [ZifengFoldMan] gets hole card ['C8', 'S2'], current stack 970
player [EvanPlayer] gets hole card ['D2', 'CT'], current stack 1010
player [KLChen2PokerPlayer] gets hole card ['S5', 'D7'], current stack 1033
Started the round 15
Street "preflop" started. (community card = [])
"YueShi" declared "fold:0"
"ZifengFoldMan" declared "fold:0"
"EvanPlayer" declared "raise:1010"
"KLChen2PokerPlayer" declared "fold:0"
"ZPlayer" declared "fold:0"
"NitWinWin" declared "fold:0"
"Jinkun" declared "fold:1010"
"['EvanPlayer']" won the round 15 (stack = {'ZPlayer': 1031, 'NitWinWin': 1975, 'Jinkun': 995, 'YueShi': 970, 'JoyoPlayer': 0, 'ZifengFoldMan': 970, 'EvanPlayer': 1025, 'KLChen2PokerPlayer': 1033})
player [ZPlayer] gets hole card ['H4', 'CK'], current stack 1031
player [NitWinWin] gets hole card ['H2', 'D6'], current stack 1975
player [Jinkun] gets hole card ['S8', 'D4'], current stack 990
player [YueShi] gets hole card ['S5', 'C4'], current stack 960
player [ZifengFoldMan] gets hole card ['H6', 'C6'], current stack 970
player [EvanPlayer] gets hole card ['DT', 'SK'], current stack 1025
player [KLChen2PokerPlayer] gets hole card ['D7', 'S2'], current stack 1033
Started the round 16
Street "preflop" started. (community card = [])
"ZifengFoldMan" declared "fold:0"
"EvanPlayer" declared "raise:1025"
"KLChen2PokerPlayer" declared "fold:0"
"ZPlayer" declared "fold:0"
"NitWinWin" declared "fold:0"
"Jinkun" declared "fold:1025"
"YueShi" declared "fold:0"
"['EvanPlayer']" won the round 16 (stack = {'ZPlayer': 1031, 'NitWinWin': 1975, 'Jinkun': 990, 'YueShi': 960, 'JoyoPlayer': 0, 'ZifengFoldMan': 970, 'EvanPlayer': 1040, 'KLChen2PokerPlayer': 1033})
player [ZPlayer] gets hole card ['H9', 'SJ'], current stack 1031
player [NitWinWin] gets hole card ['S8', 'HT'], current stack 1975
player [Jinkun] gets hole card ['S4', 'CK'], current stack 990
player [YueShi] gets hole card ['DT', 'HJ'], current stack 955
player [ZifengFoldMan] gets hole card ['DK', 'CJ'], current stack 960
player [EvanPlayer] gets hole card ['CA', 'S3'], current stack 1040
player [KLChen2PokerPlayer] gets hole card ['SK', 'C3'], current stack 1033
Started the round 17
Street "preflop" started. (community card = [])
"EvanPlayer" declared "raise:1040"
"KLChen2PokerPlayer" declared "fold:0"
"ZPlayer" declared "fold:0"
"NitWinWin" declared "fold:0"
"Jinkun" declared "fold:1040"
"YueShi" declared "fold:0"
"ZifengFoldMan" declared "fold:0"
"['EvanPlayer']" won the round 17 (stack = {'ZPlayer': 1031, 'NitWinWin': 1975, 'Jinkun': 990, 'YueShi': 955, 'JoyoPlayer': 0, 'ZifengFoldMan': 960, 'EvanPlayer': 1055, 'KLChen2PokerPlayer': 1033})
player [ZPlayer] gets hole card ['CJ', 'S9'], current stack 1031
player [NitWinWin] gets hole card ['C2', 'H3'], current stack 1975
player [Jinkun] gets hole card ['D6', 'D8'], current stack 990
player [YueShi] gets hole card ['D7', 'H2'], current stack 955
player [ZifengFoldMan] gets hole card ['D9', 'S2'], current stack 955
player [EvanPlayer] gets hole card ['D2', 'H4'], current stack 1045
player [KLChen2PokerPlayer] gets hole card ['SA', 'D5'], current stack 1033
Started the round 18
Street "preflop" started. (community card = [])
"KLChen2PokerPlayer" declared "raise:16"
"ZPlayer" declared "call:16"
"NitWinWin" declared "fold:0"
"Jinkun" declared "fold:16"
"YueShi" declared "fold:0"
"ZifengFoldMan" declared "fold:0"
"EvanPlayer" declared "fold:16"
Street "flop" started. (community card = ['SJ', 'H6', 'DK'])
"KLChen2PokerPlayer" declared "call:0"
"ZPlayer" declared "raise:10"
"KLChen2PokerPlayer" declared "fold:0"
"['ZPlayer']" won the round 18 (stack = {'ZPlayer': 1062, 'NitWinWin': 1975, 'Jinkun': 990, 'YueShi': 955, 'JoyoPlayer': 0, 'ZifengFoldMan': 955, 'EvanPlayer': 1045, 'KLChen2PokerPlayer': 1017})
player [ZPlayer] gets hole card ['S4', 'ST'], current stack 1062
player [NitWinWin] gets hole card ['CT', 'H9'], current stack 1975
player [Jinkun] gets hole card ['S5', 'CQ'], current stack 990
player [YueShi] gets hole card ['CK', 'SA'], current stack 955
player [ZifengFoldMan] gets hole card ['C7', 'D7'], current stack 955
player [EvanPlayer] gets hole card ['H2', 'C8'], current stack 1040
player [KLChen2PokerPlayer] gets hole card ['D5', 'HA'], current stack 1007
Started the round 19
Street "preflop" started. (community card = [])
"ZPlayer" declared "fold:0"
"NitWinWin" declared "fold:0"
"Jinkun" declared "fold:10"
"YueShi" declared "fold:0"
"ZifengFoldMan" declared "fold:0"
"EvanPlayer" declared "fold:10"
"['KLChen2PokerPlayer']" won the round 19 (stack = {'ZPlayer': 1062, 'NitWinWin': 1975, 'Jinkun': 990, 'YueShi': 955, 'JoyoPlayer': 0, 'ZifengFoldMan': 955, 'EvanPlayer': 1040, 'KLChen2PokerPlayer': 1022})
player [ZPlayer] gets hole card ['S7', 'HA'], current stack 1052
player [NitWinWin] gets hole card ['SK', 'H2'], current stack 1975
player [Jinkun] gets hole card ['SQ', 'D4'], current stack 990
player [YueShi] gets hole card ['C8', 'S2'], current stack 955
player [ZifengFoldMan] gets hole card ['SA', 'D2'], current stack 955
player [EvanPlayer] gets hole card ['CQ', 'DJ'], current stack 1040
player [KLChen2PokerPlayer] gets hole card ['C9', 'D6'], current stack 1017
Started the round 20
Street "preflop" started. (community card = [])
"NitWinWin" declared "fold:0"
"Jinkun" declared "fold:10"
"YueShi" declared "fold:0"
"ZifengFoldMan" declared "fold:0"
"EvanPlayer" declared "call:10"
"KLChen2PokerPlayer" declared "fold:0"
"ZPlayer" declared "raise:15"
"EvanPlayer" declared "fold:15"
"['ZPlayer']" won the round 20 (stack = {'ZPlayer': 1077, 'NitWinWin': 1975, 'Jinkun': 990, 'YueShi': 955, 'JoyoPlayer': 0, 'ZifengFoldMan': 955, 'EvanPlayer': 1030, 'KLChen2PokerPlayer': 1017})
player [ZPlayer] gets hole card ['H7', 'H6'], current stack 1072
player [NitWinWin] gets hole card ['S5', 'H3'], current stack 1965
player [Jinkun] gets hole card ['HJ', 'DA'], current stack 990
player [YueShi] gets hole card ['HT', 'C5'], current stack 955
player [ZifengFoldMan] gets hole card ['S7', 'HA'], current stack 955
player [EvanPlayer] gets hole card ['H4', 'D3'], current stack 1030
player [KLChen2PokerPlayer] gets hole card ['DT', 'S4'], current stack 1017
Started the round 21
Street "preflop" started. (community card = [])
"Jinkun" declared "fold:10"
"YueShi" declared "fold:0"
"ZifengFoldMan" declared "fold:0"
"EvanPlayer" declared "raise:1030"
"KLChen2PokerPlayer" declared "fold:0"
"ZPlayer" declared "fold:0"
"NitWinWin" declared "fold:0"
"['EvanPlayer']" won the round 21 (stack = {'ZPlayer': 1072, 'NitWinWin': 1965, 'Jinkun': 990, 'YueShi': 955, 'JoyoPlayer': 0, 'ZifengFoldMan': 955, 'EvanPlayer': 1045, 'KLChen2PokerPlayer': 1017})
player [ZPlayer] gets hole card ['HJ', 'H6'], current stack 1072
player [NitWinWin] gets hole card ['HQ', 'CT'], current stack 1960
player [Jinkun] gets hole card ['D7', 'SQ'], current stack 980
player [YueShi] gets hole card ['HA', 'CK'], current stack 955
player [ZifengFoldMan] gets hole card ['C9', 'H2'], current stack 955
player [EvanPlayer] gets hole card ['CQ', 'SA'], current stack 1045
player [KLChen2PokerPlayer] gets hole card ['HT', 'CA'], current stack 1017
Started the round 22
Street "preflop" started. (community card = [])
"YueShi" declared "fold:0"
"ZifengFoldMan" declared "fold:0"
"EvanPlayer" declared "raise:1045"
"KLChen2PokerPlayer" declared "fold:0"
"ZPlayer" declared "fold:0"
"NitWinWin" declared "fold:0"
"Jinkun" declared "fold:1045"
"['EvanPlayer']" won the round 22 (stack = {'ZPlayer': 1072, 'NitWinWin': 1960, 'Jinkun': 980, 'YueShi': 955, 'JoyoPlayer': 0, 'ZifengFoldMan': 955, 'EvanPlayer': 1060, 'KLChen2PokerPlayer': 1017})
player [ZPlayer] gets hole card ['C2', 'C9'], current stack 1072
player [NitWinWin] gets hole card ['HA', 'S5'], current stack 1960
player [Jinkun] gets hole card ['CA', 'H5'], current stack 975
player [YueShi] gets hole card ['HT', 'SK'], current stack 945
player [ZifengFoldMan] gets hole card ['DK', 'H2'], current stack 955
player [EvanPlayer] gets hole card ['HQ', 'C8'], current stack 1060
player [KLChen2PokerPlayer] gets hole card ['S8', 'D6'], current stack 1017
Started the round 23
Street "preflop" started. (community card = [])
"ZifengFoldMan" declared "fold:0"
"EvanPlayer" declared "raise:1060"
"KLChen2PokerPlayer" declared "fold:0"
"ZPlayer" declared "fold:0"
"NitWinWin" declared "fold:0"
"Jinkun" declared "fold:1060"
"YueShi" declared "fold:0"
"['EvanPlayer']" won the round 23 (stack = {'ZPlayer': 1072, 'NitWinWin': 1960, 'Jinkun': 975, 'YueShi': 945, 'JoyoPlayer': 0, 'ZifengFoldMan': 955, 'EvanPlayer': 1075, 'KLChen2PokerPlayer': 1017})
player [ZPlayer] gets hole card ['HA', 'H7'], current stack 1072
player [NitWinWin] gets hole card ['HQ', 'CA'], current stack 1960
player [Jinkun] gets hole card ['H4', 'H3'], current stack 975
player [YueShi] gets hole card ['DA', 'SJ'], current stack 940
player [ZifengFoldMan] gets hole card ['C4', 'SA'], current stack 945
player [EvanPlayer] gets hole card ['S8', 'HT'], current stack 1075
player [KLChen2PokerPlayer] gets hole card ['DK', 'C7'], current stack 1017
Started the round 24
Street "preflop" started. (community card = [])
"EvanPlayer" declared "raise:1075"
"KLChen2PokerPlayer" declared "fold:0"
"ZPlayer" declared "fold:0"
"NitWinWin" declared "fold:0"
"Jinkun" declared "fold:1075"
"YueShi" declared "fold:0"
"ZifengFoldMan" declared "fold:0"
"['EvanPlayer']" won the round 24 (stack = {'ZPlayer': 1072, 'NitWinWin': 1960, 'Jinkun': 975, 'YueShi': 940, 'JoyoPlayer': 0, 'ZifengFoldMan': 945, 'EvanPlayer': 1090, 'KLChen2PokerPlayer': 1017})
player [ZPlayer] gets hole card ['C4', 'H6'], current stack 1072
player [NitWinWin] gets hole card ['DQ', 'C3'], current stack 1960
player [Jinkun] gets hole card ['D2', 'H8'], current stack 975
player [YueShi] gets hole card ['D4', 'CK'], current stack 940
player [ZifengFoldMan] gets hole card ['HK', 'C2'], current stack 940
player [EvanPlayer] gets hole card ['S8', 'H2'], current stack 1080
player [KLChen2PokerPlayer] gets hole card ['S3', 'D6'], current stack 1017
Started the round 25
Street "preflop" started. (community card = [])
"KLChen2PokerPlayer" declared "fold:0"
"ZPlayer" declared "call:10"
"NitWinWin" declared "fold:0"
"Jinkun" declared "fold:10"
"YueShi" declared "fold:0"
"ZifengFoldMan" declared "fold:0"
"EvanPlayer" declared "fold:10"
"['ZPlayer']" won the round 25 (stack = {'ZPlayer': 1087, 'NitWinWin': 1960, 'Jinkun': 975, 'YueShi': 940, 'JoyoPlayer': 0, 'ZifengFoldMan': 940, 'EvanPlayer': 1080, 'KLChen2PokerPlayer': 1017})
player [ZPlayer] gets hole card ['DK', 'SA'], current stack 1087
player [NitWinWin] gets hole card ['H7', 'C9'], current stack 1960
player [Jinkun] gets hole card ['H9', 'C8'], current stack 975
player [YueShi] gets hole card ['ST', 'S5'], current stack 940
player [ZifengFoldMan] gets hole card ['S6', 'D4'], current stack 940
player [EvanPlayer] gets hole card ['D5', 'S3'], current stack 1075
player [KLChen2PokerPlayer] gets hole card ['HK', 'C4'], current stack 1007
Started the round 26
Street "preflop" started. (community card = [])
"ZPlayer" declared "raise:15"
"NitWinWin" declared "fold:0"
"Jinkun" declared "fold:15"
"YueShi" declared "fold:0"
"ZifengFoldMan" declared "fold:0"
"EvanPlayer" declared "fold:15"
"KLChen2PokerPlayer" declared "fold:0"
"['ZPlayer']" won the round 26 (stack = {'ZPlayer': 1102, 'NitWinWin': 1960, 'Jinkun': 975, 'YueShi': 940, 'JoyoPlayer': 0, 'ZifengFoldMan': 940, 'EvanPlayer': 1075, 'KLChen2PokerPlayer': 1007})
player [ZPlayer] gets hole card ['CK', 'CA'], current stack 1092
player [NitWinWin] gets hole card ['HA', 'C8'], current stack 1960
player [Jinkun] gets hole card ['H6', 'DQ'], current stack 975
player [YueShi] gets hole card ['D6', 'S5'], current stack 940
player [ZifengFoldMan] gets hole card ['ST', 'C6'], current stack 940
player [EvanPlayer] gets hole card ['SA', 'SJ'], current stack 1075
player [KLChen2PokerPlayer] gets hole card ['DA', 'HJ'], current stack 1002
Started the round 27
Street "preflop" started. (community card = [])
"NitWinWin" declared "fold:0"
"Jinkun" declared "fold:10"
"YueShi" declared "fold:0"
"ZifengFoldMan" declared "fold:0"
"EvanPlayer" declared "call:10"
"KLChen2PokerPlayer" declared "raise:23"
"ZPlayer" declared "raise:36"
"EvanPlayer" declared "raise:1075"
"KLChen2PokerPlayer" declared "fold:0"
"ZPlayer" declared "fold:0"
"['EvanPlayer']" won the round 27 (stack = {'ZPlayer': 1066, 'NitWinWin': 1960, 'Jinkun': 975, 'YueShi': 940, 'JoyoPlayer': 0, 'ZifengFoldMan': 940, 'EvanPlayer': 1134, 'KLChen2PokerPlayer': 984})
player [ZPlayer] gets hole card ['H6', 'SJ'], current stack 1061
player [NitWinWin] gets hole card ['SA', 'H2'], current stack 1950
player [Jinkun] gets hole card ['H4', 'D2'], current stack 975
player [YueShi] gets hole card ['C9', 'C4'], current stack 940
player [ZifengFoldMan] gets hole card ['D3', 'D5'], current stack 940
player [EvanPlayer] gets hole card ['C3', 'CA'], current stack 1134
player [KLChen2PokerPlayer] gets hole card ['D7', 'H9'], current stack 984
Started the round 28
Street "preflop" started. (community card = [])
"Jinkun" declared "fold:10"
"YueShi" declared "fold:0"
"ZifengFoldMan" declared "fold:0"
"EvanPlayer" declared "raise:1134"
"KLChen2PokerPlayer" declared "fold:0"
"ZPlayer" declared "fold:0"
"NitWinWin" declared "fold:0"
"['EvanPlayer']" won the round 28 (stack = {'ZPlayer': 1061, 'NitWinWin': 1950, 'Jinkun': 975, 'YueShi': 940, 'JoyoPlayer': 0, 'ZifengFoldMan': 940, 'EvanPlayer': 1149, 'KLChen2PokerPlayer': 984})
player [ZPlayer] gets hole card ['H4', 'SK'], current stack 1061
player [NitWinWin] gets hole card ['S3', 'H8'], current stack 1945
player [Jinkun] gets hole card ['S2', 'HT'], current stack 965
player [YueShi] gets hole card ['S4', 'C5'], current stack 940
player [ZifengFoldMan] gets hole card ['DK', 'C7'], current stack 940
player [EvanPlayer] gets hole card ['H6', 'C8'], current stack 1149
player [KLChen2PokerPlayer] gets hole card ['H5', 'D8'], current stack 984
Started the round 29
Street "preflop" started. (community card = [])
"YueShi" declared "fold:0"
"ZifengFoldMan" declared "fold:0"
"EvanPlayer" declared "call:10"
"KLChen2PokerPlayer" declared "fold:0"
"ZPlayer" declared "call:10"
"NitWinWin" declared "fold:0"
"Jinkun" declared "call:10"
Street "flop" started. (community card = ['D2', 'HK', 'SQ'])
"Jinkun" declared "call:0"
"EvanPlayer" declared "fold:0"
"ZPlayer" declared "raise:453"
"Jinkun" declared "fold:453"
"['ZPlayer']" won the round 29 (stack = {'ZPlayer': 1086, 'NitWinWin': 1945, 'Jinkun': 965, 'YueShi': 940, 'JoyoPlayer': 0, 'ZifengFoldMan': 940, 'EvanPlayer': 1139, 'KLChen2PokerPlayer': 984})
player [ZPlayer] gets hole card ['DQ', 'SQ'], current stack 1086
player [NitWinWin] gets hole card ['D6', 'C2'], current stack 1945
player [Jinkun] gets hole card ['ST', 'S8'], current stack 960
player [YueShi] gets hole card ['SJ', 'S6'], current stack 930
player [ZifengFoldMan] gets hole card ['H2', 'HT'], current stack 940
player [EvanPlayer] gets hole card ['D4', 'C6'], current stack 1139
player [KLChen2PokerPlayer] gets hole card ['HK', 'H5'], current stack 984
Started the round 30
Street "preflop" started. (community card = [])
"ZifengFoldMan" declared "fold:0"
"EvanPlayer" declared "call:10"
"KLChen2PokerPlayer" declared "raise:15"
"ZPlayer" declared "raise:20"
"NitWinWin" declared "fold:0"
"Jinkun" declared "fold:20"
"YueShi" declared "fold:0"
"EvanPlayer" declared "fold:20"
"KLChen2PokerPlayer" declared "fold:0"
"['ZPlayer']" won the round 30 (stack = {'ZPlayer': 1126, 'NitWinWin': 1945, 'Jinkun': 960, 'YueShi': 930, 'JoyoPlayer': 0, 'ZifengFoldMan': 940, 'EvanPlayer': 1129, 'KLChen2PokerPlayer': 969})
player [ZPlayer] gets hole card ['H6', 'C7'], current stack 1126
player [NitWinWin] gets hole card ['S5', 'CJ'], current stack 1945
player [Jinkun] gets hole card ['SQ', 'CQ'], current stack 960
player [YueShi] gets hole card ['S4', 'SK'], current stack 925
player [ZifengFoldMan] gets hole card ['SA', 'H7'], current stack 930
player [EvanPlayer] gets hole card ['C6', 'ST'], current stack 1129
player [KLChen2PokerPlayer] gets hole card ['HT', 'D9'], current stack 969
Started the round 31
Street "preflop" started. (community card = [])
"EvanPlayer" declared "raise:1129"
"KLChen2PokerPlayer" declared "fold:0"
"ZPlayer" declared "fold:0"
"NitWinWin" declared "fold:0"
"Jinkun" declared "fold:1129"
"YueShi" declared "fold:0"
"ZifengFoldMan" declared "fold:0"
"['EvanPlayer']" won the round 31 (stack = {'ZPlayer': 1126, 'NitWinWin': 1945, 'Jinkun': 960, 'YueShi': 925, 'JoyoPlayer': 0, 'ZifengFoldMan': 930, 'EvanPlayer': 1144, 'KLChen2PokerPlayer': 969})
player [ZPlayer] gets hole card ['D3', 'S8'], current stack 1126
player [NitWinWin] gets hole card ['ST', 'HA'], current stack 1945
player [Jinkun] gets hole card ['C9', 'HQ'], current stack 960
player [YueShi] gets hole card ['DA', 'DK'], current stack 925
player [ZifengFoldMan] gets hole card ['H3', 'H9'], current stack 925
player [EvanPlayer] gets hole card ['DJ', 'S5'], current stack 1134
player [KLChen2PokerPlayer] gets hole card ['D6', 'CT'], current stack 969
Started the round 32
Street "preflop" started. (community card = [])
"KLChen2PokerPlayer" declared "fold:0"
"ZPlayer" declared "call:10"
"NitWinWin" declared "fold:0"
"Jinkun" declared "fold:10"
"YueShi" declared "fold:0"
"ZifengFoldMan" declared "fold:0"
"EvanPlayer" declared "fold:10"
"['ZPlayer']" won the round 32 (stack = {'ZPlayer': 1141, 'NitWinWin': 1945, 'Jinkun': 960, 'YueShi': 925, 'JoyoPlayer': 0, 'ZifengFoldMan': 925, 'EvanPlayer': 1134, 'KLChen2PokerPlayer': 969})
player [ZPlayer] gets hole card ['H2', 'S4'], current stack 1141
player [NitWinWin] gets hole card ['D5', 'C2'], current stack 1945
player [Jinkun] gets hole card ['H3', 'SA'], current stack 960
player [YueShi] gets hole card ['D8', 'S6'], current stack 925
player [ZifengFoldMan] gets hole card ['H6', 'C5'], current stack 925
player [EvanPlayer] gets hole card ['HK', 'SQ'], current stack 1129
player [KLChen2PokerPlayer] gets hole card ['CQ', 'C6'], current stack 959
Started the round 33
Street "preflop" started. (community card = [])
"ZPlayer" declared "call:10"
"NitWinWin" declared "fold:0"
"Jinkun" declared "fold:10"
"YueShi" declared "fold:0"
"ZifengFoldMan" declared "fold:0"
"EvanPlayer" declared "call:10"
"KLChen2PokerPlayer" declared "raise:21"
"ZPlayer" declared "fold:0"
"EvanPlayer" declared "fold:21"
"['KLChen2PokerPlayer']" won the round 33 (stack = {'ZPlayer': 1131, 'NitWinWin': 1945, 'Jinkun': 960, 'YueShi': 925, 'JoyoPlayer': 0, 'ZifengFoldMan': 925, 'EvanPlayer': 1124, 'KLChen2PokerPlayer': 989})
player [ZPlayer] gets hole card ['S4', 'HK'], current stack 1121
player [NitWinWin] gets hole card ['D7', 'D3'], current stack 1945
player [Jinkun] gets hole card ['SJ', 'H4'], current stack 960
player [YueShi] gets hole card ['C2', 'D9'], current stack 925
player [ZifengFoldMan] gets hole card ['DA', 'D2'], current stack 925
player [EvanPlayer] gets hole card ['C3', 'H3'], current stack 1124
player [KLChen2PokerPlayer] gets hole card ['SA', 'C7'], current stack 984
Started the round 34
Street "preflop" started. (community card = [])
"NitWinWin" declared "fold:0"
"Jinkun" declared "fold:10"
"YueShi" declared "fold:0"
"ZifengFoldMan" declared "fold:0"
"EvanPlayer" declared "fold:10"
"KLChen2PokerPlayer" declared "raise:15"
"ZPlayer" declared "call:15"
Street "flop" started. (community card = ['S7', 'CQ', 'SK'])
"KLChen2PokerPlayer" declared "raise:39"
"ZPlayer" declared "fold:0"
"['KLChen2PokerPlayer']" won the round 34 (stack = {'ZPlayer': 1116, 'NitWinWin': 1945, 'Jinkun': 960, 'YueShi': 925, 'JoyoPlayer': 0, 'ZifengFoldMan': 925, 'EvanPlayer': 1124, 'KLChen2PokerPlayer': 1004})
player [ZPlayer] gets hole card ['C2', 'H4'], current stack 1111
player [NitWinWin] gets hole card ['SK', 'S3'], current stack 1935
player [Jinkun] gets hole card ['CK', 'CA'], current stack 960
player [YueShi] gets hole card ['C8', 'D9'], current stack 925
player [ZifengFoldMan] gets hole card ['HT', 'S4'], current stack 925
player [EvanPlayer] gets hole card ['D5', 'DT'], current stack 1124
player [KLChen2PokerPlayer] gets hole card ['HJ', 'C5'], current stack 1004
Started the round 35
Street "preflop" started. (community card = [])
"Jinkun" declared "fold:10"
"YueShi" declared "fold:0"
"ZifengFoldMan" declared "fold:0"
"EvanPlayer" declared "raise:1124"
"KLChen2PokerPlayer" declared "fold:0"
"ZPlayer" declared "fold:0"
"NitWinWin" declared "fold:0"
"['EvanPlayer']" won the round 35 (stack = {'ZPlayer': 1111, 'NitWinWin': 1935, 'Jinkun': 960, 'YueShi': 925, 'JoyoPlayer': 0, 'ZifengFoldMan': 925, 'EvanPlayer': 1139, 'KLChen2PokerPlayer': 1004})
player [ZPlayer] gets hole card ['C4', 'C7'], current stack 1111
player [NitWinWin] gets hole card ['DA', 'S5'], current stack 1930
player [Jinkun] gets hole card ['D7', 'H4'], current stack 950
player [YueShi] gets hole card ['S3', 'S6'], current stack 925
player [ZifengFoldMan] gets hole card ['HT', 'D4'], current stack 925
player [EvanPlayer] gets hole card ['D8', 'DQ'], current stack 1139
player [KLChen2PokerPlayer] gets hole card ['H9', 'SJ'], current stack 1004
Started the round 36
Street "preflop" started. (community card = [])
"YueShi" declared "fold:0"
"ZifengFoldMan" declared "fold:0"
"EvanPlayer" declared "call:10"
"KLChen2PokerPlayer" declared "raise:15"
"ZPlayer" declared "fold:0"
"NitWinWin" declared "fold:0"
"Jinkun" declared "raise:30"
"EvanPlayer" declared "call:30"
"KLChen2PokerPlayer" declared "fold:0"
Street "flop" started. (community card = ['D9', 'S7', 'S9'])
"Jinkun" declared "call:0"
"EvanPlayer" declared "fold:0"
"['Jinkun']" won the round 36 (stack = {'ZPlayer': 1111, 'NitWinWin': 1930, 'Jinkun': 1010, 'YueShi': 925, 'JoyoPlayer': 0, 'ZifengFoldMan': 925, 'EvanPlayer': 1109, 'KLChen2PokerPlayer': 989})
player [ZPlayer] gets hole card ['H8', 'CK'], current stack 1111
player [NitWinWin] gets hole card ['C2', 'HQ'], current stack 1930
player [Jinkun] gets hole card ['ST', 'H9'], current stack 1005
player [YueShi] gets hole card ['S4', 'D7'], current stack 915
player [ZifengFoldMan] gets hole card ['C3', 'SA'], current stack 925
player [EvanPlayer] gets hole card ['CQ', 'H7'], current stack 1109
player [KLChen2PokerPlayer] gets hole card ['D8', 'H2'], current stack 989
Started the round 37
Street "preflop" started. (community card = [])
"ZifengFoldMan" declared "fold:0"
"EvanPlayer" declared "call:10"
"KLChen2PokerPlayer" declared "raise:19"
"ZPlayer" declared "call:19"
"NitWinWin" declared "fold:0"
"Jinkun" declared "fold:19"
"YueShi" declared "fold:0"
"EvanPlayer" declared "fold:19"
Street "flop" started. (community card = ['C6', 'DQ', 'H5'])
"KLChen2PokerPlayer" declared "call:0"
"ZPlayer" declared "call:0"
Street "turn" started. (community card = ['C6', 'DQ', 'H5', 'C8'])
"KLChen2PokerPlayer" declared "raise:72"
"ZPlayer" declared "fold:0"
"['KLChen2PokerPlayer']" won the round 37 (stack = {'ZPlayer': 1092, 'NitWinWin': 1930, 'Jinkun': 1005, 'YueShi': 915, 'JoyoPlayer': 0, 'ZifengFoldMan': 925, 'EvanPlayer': 1099, 'KLChen2PokerPlayer': 1033})
player [ZPlayer] gets hole card ['HQ', 'CT'], current stack 1092
player [NitWinWin] gets hole card ['D3', 'HA'], current stack 1930
player [Jinkun] gets hole card ['S2', 'SA'], current stack 1005
player [YueShi] gets hole card ['S4', 'C8'], current stack 910
player [ZifengFoldMan] gets hole card ['HT', 'CA'], current stack 915
player [EvanPlayer] gets hole card ['D4', 'HK'], current stack 1099
player [KLChen2PokerPlayer] gets hole card ['S9', 'HJ'], current stack 1033
Started the round 38
Street "preflop" started. (community card = [])
"EvanPlayer" declared "raise:1099"
"KLChen2PokerPlayer" declared "fold:0"
"ZPlayer" declared "fold:0"
"NitWinWin" declared "fold:0"
"Jinkun" declared "fold:1099"
"YueShi" declared "fold:0"
"ZifengFoldMan" declared "fold:0"
"['EvanPlayer']" won the round 38 (stack = {'ZPlayer': 1092, 'NitWinWin': 1930, 'Jinkun': 1005, 'YueShi': 910, 'JoyoPlayer': 0, 'ZifengFoldMan': 915, 'EvanPlayer': 1114, 'KLChen2PokerPlayer': 1033})
player [ZPlayer] gets hole card ['C3', 'ST'], current stack 1092
player [NitWinWin] gets hole card ['DJ', 'HJ'], current stack 1930
player [Jinkun] gets hole card ['HQ', 'D4'], current stack 1005
player [YueShi] gets hole card ['SJ', 'S7'], current stack 910
player [ZifengFoldMan] gets hole card ['DA', 'D5'], current stack 910
player [EvanPlayer] gets hole card ['HA', 'CA'], current stack 1104
player [KLChen2PokerPlayer] gets hole card ['D2', 'H8'], current stack 1033
Started the round 39
Street "preflop" started. (community card = [])
"KLChen2PokerPlayer" declared "fold:0"
"ZPlayer" declared "call:10"
"NitWinWin" declared "fold:0"
"Jinkun" declared "fold:10"
"YueShi" declared "fold:0"
"ZifengFoldMan" declared "fold:0"
"EvanPlayer" declared "raise:1114"
"ZPlayer" declared "fold:0"
"['EvanPlayer']" won the round 39 (stack = {'ZPlayer': 1082, 'NitWinWin': 1930, 'Jinkun': 1005, 'YueShi': 910, 'JoyoPlayer': 0, 'ZifengFoldMan': 910, 'EvanPlayer': 1129, 'KLChen2PokerPlayer': 1033})
player [ZPlayer] gets hole card ['D4', 'H7'], current stack 1082
player [NitWinWin] gets hole card ['H4', 'HK'], current stack 1930
player [Jinkun] gets hole card ['S2', 'C2'], current stack 1005
player [YueShi] gets hole card ['CK', 'C7'], current stack 910
player [ZifengFoldMan] gets hole card ['SA', 'D7'], current stack 910
player [EvanPlayer] gets hole card ['CQ', 'DK'], current stack 1124
player [KLChen2PokerPlayer] gets hole card ['C8', 'HJ'], current stack 1023
Started the round 40
Street "preflop" started. (community card = [])
"ZPlayer" declared "call:10"
"NitWinWin" declared "fold:0"
"Jinkun" declared "fold:10"
"YueShi" declared "fold:0"
"ZifengFoldMan" declared "fold:0"
"EvanPlayer" declared "fold:10"
"KLChen2PokerPlayer" declared "call:10"
Street "flop" started. (community card = ['H5', 'DQ', 'H3'])
"KLChen2PokerPlayer" declared "call:0"
"ZPlayer" declared "call:0"
Street "turn" started. (community card = ['H5', 'DQ', 'H3', 'C6'])
"KLChen2PokerPlayer" declared "call:0"
"ZPlayer" declared "raise:25"
"KLChen2PokerPlayer" declared "fold:0"
"['ZPlayer']" won the round 40 (stack = {'ZPlayer': 1097, 'NitWinWin': 1930, 'Jinkun': 1005, 'YueShi': 910, 'JoyoPlayer': 0, 'ZifengFoldMan': 910, 'EvanPlayer': 1124, 'KLChen2PokerPlayer': 1023})
player [ZPlayer] gets hole card ['S6', 'S7'], current stack 1087
player [NitWinWin] gets hole card ['H5', 'D2'], current stack 1930
player [Jinkun] gets hole card ['DJ', 'C4'], current stack 1005
player [YueShi] gets hole card ['SJ', 'HT'], current stack 910
player [ZifengFoldMan] gets hole card ['S2', 'HJ'], current stack 910
player [EvanPlayer] gets hole card ['H3', 'C5'], current stack 1124
player [KLChen2PokerPlayer] gets hole card ['C3', 'DK'], current stack 1018
Started the round 41
Street "preflop" started. (community card = [])
"NitWinWin" declared "fold:0"
"Jinkun" declared "fold:10"
"YueShi" declared "fold:0"
"ZifengFoldMan" declared "fold:0"
"EvanPlayer" declared "fold:10"
"KLChen2PokerPlayer" declared "call:10"
"ZPlayer" declared "call:10"
Street "flop" started. (community card = ['S9', 'D5', 'CT'])
"KLChen2PokerPlayer" declared "call:0"
"ZPlayer" declared "call:0"
Street "turn" started. (community card = ['S9', 'D5', 'CT', 'CQ'])
"KLChen2PokerPlayer" declared "call:0"
"ZPlayer" declared "call:0"
Street "river" started. (community card = ['S9', 'D5', 'CT', 'CQ', 'D9'])
"KLChen2PokerPlayer" declared "call:0"
"ZPlayer" declared "call:0"
"['KLChen2PokerPlayer']" won the round 41 (stack = {'ZPlayer': 1087, 'NitWinWin': 1930, 'Jinkun': 1005, 'YueShi': 910, 'JoyoPlayer': 0, 'ZifengFoldMan': 910, 'EvanPlayer': 1124, 'KLChen2PokerPlayer': 1033})
player [ZPlayer] gets hole card ['D4', 'C8'], current stack 1082
player [NitWinWin] gets hole card ['D7', 'CA'], current stack 1920
player [Jinkun] gets hole card ['HQ', 'CJ'], current stack 1005
player [YueShi] gets hole card ['D8', 'SQ'], current stack 910
player [ZifengFoldMan] gets hole card ['H7', 'CT'], current stack 910
player [EvanPlayer] gets hole card ['D9', 'C3'], current stack 1124
player [KLChen2PokerPlayer] gets hole card ['H9', 'S4'], current stack 1033
Started the round 42
Street "preflop" started. (community card = [])
"Jinkun" declared "fold:10"
"YueShi" declared "fold:0"
"ZifengFoldMan" declared "fold:0"
"EvanPlayer" declared "raise:1124"
"KLChen2PokerPlayer" declared "fold:0"
"ZPlayer" declared "fold:0"
"NitWinWin" declared "fold:0"
"['EvanPlayer']" won the round 42 (stack = {'ZPlayer': 1082, 'NitWinWin': 1920, 'Jinkun': 1005, 'YueShi': 910, 'JoyoPlayer': 0, 'ZifengFoldMan': 910, 'EvanPlayer': 1139, 'KLChen2PokerPlayer': 1033})
player [ZPlayer] gets hole card ['H3', 'S7'], current stack 1082
player [NitWinWin] gets hole card ['H9', 'S2'], current stack 1915
player [Jinkun] gets hole card ['C4', 'S5'], current stack 995
player [YueShi] gets hole card ['D5', 'CJ'], current stack 910
player [ZifengFoldMan] gets hole card ['H8', 'D8'], current stack 910
player [EvanPlayer] gets hole card ['C9', 'HT'], current stack 1139
player [KLChen2PokerPlayer] gets hole card ['HK', 'C3'], current stack 1033
Started the round 43
Street "preflop" started. (community card = [])
"YueShi" declared "fold:0"
"ZifengFoldMan" declared "fold:0"
"EvanPlayer" declared "call:10"
"KLChen2PokerPlayer" declared "raise:19"
"ZPlayer" declared "call:19"
"NitWinWin" declared "fold:0"
"Jinkun" declared "fold:19"
"EvanPlayer" declared "raise:1139"
"KLChen2PokerPlayer" declared "fold:0"
"ZPlayer" declared "fold:0"
"['EvanPlayer']" won the round 43 (stack = {'ZPlayer': 1063, 'NitWinWin': 1915, 'Jinkun': 995, 'YueShi': 910, 'JoyoPlayer': 0, 'ZifengFoldMan': 910, 'EvanPlayer': 1192, 'KLChen2PokerPlayer': 1014})
player [ZPlayer] gets hole card ['SJ', 'SQ'], current stack 1063
player [NitWinWin] gets hole card ['C4', 'C6'], current stack 1915
player [Jinkun] gets hole card ['HA', 'C2'], current stack 990
player [YueShi] gets hole card ['D7', 'S2'], current stack 900
player [ZifengFoldMan] gets hole card ['DQ', 'ST'], current stack 910
player [EvanPlayer] gets hole card ['H5', 'S4'], current stack 1192
player [KLChen2PokerPlayer] gets hole card ['S3', 'CA'], current stack 1014
Started the round 44
Street "preflop" started. (community card = [])
"ZifengFoldMan" declared "fold:0"
"EvanPlayer" declared "call:10"
"KLChen2PokerPlayer" declared "raise:19"
"ZPlayer" declared "call:19"
"NitWinWin" declared "fold:0"
"Jinkun" declared "fold:19"
"YueShi" declared "fold:0"
"EvanPlayer" declared "fold:19"
Street "flop" started. (community card = ['D6', 'DJ', 'S5'])
"KLChen2PokerPlayer" declared "call:0"
"ZPlayer" declared "raise:10"
"KLChen2PokerPlayer" declared "fold:0"
"['ZPlayer']" won the round 44 (stack = {'ZPlayer': 1107, 'NitWinWin': 1915, 'Jinkun': 990, 'YueShi': 900, 'JoyoPlayer': 0, 'ZifengFoldMan': 910, 'EvanPlayer': 1182, 'KLChen2PokerPlayer': 995})
player [ZPlayer] gets hole card ['H2', 'D6'], current stack 1107
player [NitWinWin] gets hole card ['C2', 'C3'], current stack 1915
player [Jinkun] gets hole card ['C9', 'HQ'], current stack 990
player [YueShi] gets hole card ['H9', 'C4'], current stack 895
player [ZifengFoldMan] gets hole card ['HT', 'S7'], current stack 900
player [EvanPlayer] gets hole card ['D7', 'D3'], current stack 1182
player [KLChen2PokerPlayer] gets hole card ['S8', 'S3'], current stack 995
Started the round 45
Street "preflop" started. (community card = [])
"EvanPlayer" declared "raise:1182"
"KLChen2PokerPlayer" declared "fold:0"
"ZPlayer" declared "fold:0"
"NitWinWin" declared "fold:0"
"Jinkun" declared "fold:1182"
"YueShi" declared "fold:0"
"ZifengFoldMan" declared "fold:0"
"['EvanPlayer']" won the round 45 (stack = {'ZPlayer': 1107, 'NitWinWin': 1915, 'Jinkun': 990, 'YueShi': 895, 'JoyoPlayer': 0, 'ZifengFoldMan': 900, 'EvanPlayer': 1197, 'KLChen2PokerPlayer': 995})
player [ZPlayer] gets hole card ['HK', 'SK'], current stack 1107
player [NitWinWin] gets hole card ['CQ', 'H7'], current stack 1915
player [Jinkun] gets hole card ['H2', 'CK'], current stack 990
player [YueShi] gets hole card ['S3', 'D3'], current stack 895
player [ZifengFoldMan] gets hole card ['D7', 'D6'], current stack 895
player [EvanPlayer] gets hole card ['H5', 'S4'], current stack 1187
player [KLChen2PokerPlayer] gets hole card ['DK', 'H4'], current stack 995
Started the round 46
Street "preflop" started. (community card = [])
"KLChen2PokerPlayer" declared "raise:17"
"ZPlayer" declared "raise:24"
"NitWinWin" declared "fold:0"
"Jinkun" declared "fold:24"
"YueShi" declared "fold:0"
"ZifengFoldMan" declared "fold:0"
"EvanPlayer" declared "fold:24"
"KLChen2PokerPlayer" declared "fold:0"
"['ZPlayer']" won the round 46 (stack = {'ZPlayer': 1139, 'NitWinWin': 1915, 'Jinkun': 990, 'YueShi': 895, 'JoyoPlayer': 0, 'ZifengFoldMan': 895, 'EvanPlayer': 1187, 'KLChen2PokerPlayer': 978})
player [ZPlayer] gets hole card ['H7', 'D4'], current stack 1139
player [NitWinWin] gets hole card ['DQ', 'CA'], current stack 1915
player [Jinkun] gets hole card ['DT', 'SA'], current stack 990
player [YueShi] gets hole card ['SJ', 'SQ'], current stack 895
player [ZifengFoldMan] gets hole card ['S4', 'CJ'], current stack 895
player [EvanPlayer] gets hole card ['CK', 'D5'], current stack 1182
player [KLChen2PokerPlayer] gets hole card ['C6', 'H9'], current stack 968
Started the round 47
Street "preflop" started. (community card = [])
"ZPlayer" declared "call:10"
"NitWinWin" declared "fold:0"
"Jinkun" declared "fold:10"
"YueShi" declared "fold:0"
"ZifengFoldMan" declared "fold:0"
"EvanPlayer" declared "raise:1187"
"KLChen2PokerPlayer" declared "fold:0"
"ZPlayer" declared "fold:0"
"['EvanPlayer']" won the round 47 (stack = {'ZPlayer': 1129, 'NitWinWin': 1915, 'Jinkun': 990, 'YueShi': 895, 'JoyoPlayer': 0, 'ZifengFoldMan': 895, 'EvanPlayer': 1207, 'KLChen2PokerPlayer': 968})
player [ZPlayer] gets hole card ['S5', 'CA'], current stack 1119
player [NitWinWin] gets hole card ['C3', 'SK'], current stack 1915
player [Jinkun] gets hole card ['H4', 'S6'], current stack 990
player [YueShi] gets hole card ['HA', 'C5'], current stack 895
player [ZifengFoldMan] gets hole card ['C8', 'H6'], current stack 895
player [EvanPlayer] gets hole card ['S2', 'SQ'], current stack 1207
player [KLChen2PokerPlayer] gets hole card ['SJ', 'CK'], current stack 963
Started the round 48
Street "preflop" started. (community card = [])
"NitWinWin" declared "fold:0"
"Jinkun" declared "fold:10"
"YueShi" declared "fold:0"
"ZifengFoldMan" declared "fold:0"
"EvanPlayer" declared "call:10"
"KLChen2PokerPlayer" declared "raise:15"
"ZPlayer" declared "fold:0"
"EvanPlayer" declared "fold:15"
"['KLChen2PokerPlayer']" won the round 48 (stack = {'ZPlayer': 1119, 'NitWinWin': 1915, 'Jinkun': 990, 'YueShi': 895, 'JoyoPlayer': 0, 'ZifengFoldMan': 895, 'EvanPlayer': 1197, 'KLChen2PokerPlayer': 988})
player [ZPlayer] gets hole card ['S4', 'DK'], current stack 1114
player [NitWinWin] gets hole card ['C2', 'H6'], current stack 1905
player [Jinkun] gets hole card ['H4', 'D3'], current stack 990
player [YueShi] gets hole card ['HA', 'CQ'], current stack 895
player [ZifengFoldMan] gets hole card ['S5', 'CA'], current stack 895
player [EvanPlayer] gets hole card ['C4', 'SA'], current stack 1197
player [KLChen2PokerPlayer] gets hole card ['D8', 'DQ'], current stack 988
Started the round 49
Street "preflop" started. (community card = [])
"Jinkun" declared "fold:10"
"YueShi" declared "fold:0"
"ZifengFoldMan" declared "fold:0"
"EvanPlayer" declared "call:10"
"KLChen2PokerPlayer" declared "raise:17"
"ZPlayer" declared "call:17"
"NitWinWin" declared "fold:0"
"EvanPlayer" declared "fold:17"
Street "flop" started. (community card = ['D6', 'C8', 'C3'])
"ZPlayer" declared "call:0"
"KLChen2PokerPlayer" declared "raise:23"
"ZPlayer" declared "fold:0"
"['KLChen2PokerPlayer']" won the round 49 (stack = {'ZPlayer': 1102, 'NitWinWin': 1905, 'Jinkun': 990, 'YueShi': 895, 'JoyoPlayer': 0, 'ZifengFoldMan': 895, 'EvanPlayer': 1187, 'KLChen2PokerPlayer': 1025})
player [ZPlayer] gets hole card ['C8', 'C5'], current stack 1102
player [NitWinWin] gets hole card ['D2', 'CT'], current stack 1900
player [Jinkun] gets hole card ['HK', 'SK'], current stack 980
player [YueShi] gets hole card ['C3', 'SA'], current stack 895
player [ZifengFoldMan] gets hole card ['SQ', 'H5'], current stack 895
player [EvanPlayer] gets hole card ['S6', 'ST'], current stack 1187
player [KLChen2PokerPlayer] gets hole card ['D9', 'H6'], current stack 1025
Started the round 50
Street "preflop" started. (community card = [])
"YueShi" declared "fold:0"
"ZifengFoldMan" declared "fold:0"
"EvanPlayer" declared "call:10"
"KLChen2PokerPlayer" declared "call:10"
"ZPlayer" declared "call:10"
"NitWinWin" declared "fold:0"
"Jinkun" declared "call:10"
Street "flop" started. (community card = ['HJ', 'H2', 'H8'])
"Jinkun" declared "call:0"
"EvanPlayer" declared "fold:0"
"KLChen2PokerPlayer" declared "call:0"
"ZPlayer" declared "raise:10"
"Jinkun" declared "call:10"
"KLChen2PokerPlayer" declared "fold:0"
Street "turn" started. (community card = ['HJ', 'H2', 'H8', 'D8'])
"Jinkun" declared "raise:27"
"ZPlayer" declared "fold:0"
"['Jinkun']" won the round 50 (stack = {'ZPlayer': 1082, 'NitWinWin': 1900, 'Jinkun': 1035, 'YueShi': 895, 'JoyoPlayer': 0, 'ZifengFoldMan': 895, 'EvanPlayer': 1177, 'KLChen2PokerPlayer': 1015})

Game Results:
------------------------------------------------------------
Game 1:
Winner: NitWinWin (stack: 1900)
All players' stacks:
  ZPlayer: 1082
  NitWinWin: 1900
  Jinkun: 1035
  YueShi: 895
  JoyoPlayer: 0
  ZifengFoldMan: 895
  EvanPlayer: 1177
  KLChen2PokerPlayer: 1015
------------------------------------------------------------
