player [ZPlayer] gets hole card ['DA', 'HA'], current stack 1000
player [NitWinWin] gets hole card ['H9', 'S2'], current stack 995
player [Jinkun] gets hole card ['S5', 'DQ'], current stack 990
player [YueShi] gets hole card ['D3', 'HT'], current stack 1000
player [JoyoPlayer] gets hole card ['H2', 'C5'], current stack 1000
player [ZifengFoldMan] gets hole card ['H8', 'H7'], current stack 1000
player [EvanPlayer] gets hole card ['D4', 'HQ'], current stack 1000
player [KLChen2PokerPlayer] gets hole card ['C8', 'HJ'], current stack 1000
Started the round 1
Street "preflop" started. (community card = [])
"YueShi" declared "fold:0"
"JoyoPlayer" declared "fold:0"
"ZifengFoldMan" declared "fold:0"
"EvanPlayer" declared "raise:1000"
"KLChen2PokerPlayer" declared "fold:0"
"ZPlayer" declared "call:1000"
"NitWinWin" declared "fold:0"
"Jinkun" declared "fold:1000"
Street "flop" started. (community card = ['SJ', 'S8', 'HK'])
Street "turn" started. (community card = ['SJ', 'S8', 'HK', 'ST'])
Street "river" started. (community card = ['SJ', 'S8', 'HK', 'ST', 'S7'])
"['ZPlayer']" won the round 1 (stack = {'ZPlayer': 2015, 'NitWinWin': 995, 'Jinkun': 990, 'YueShi': 1000, 'JoyoPlayer': 1000, 'ZifengFoldMan': 1000, 'EvanPlayer': 0, 'KLChen2PokerPlayer': 1000})
player [ZPlayer] gets hole card ['DK', 'HQ'], current stack 2015
player [NitWinWin] gets hole card ['C5', 'CK'], current stack 995
player [Jinkun] gets hole card ['H8', 'D9'], current stack 985
player [YueShi] gets hole card ['ST', 'H4'], current stack 990
player [JoyoPlayer] gets hole card ['CJ', 'H7'], current stack 1000
player [ZifengFoldMan] gets hole card ['S8', 'S3'], current stack 1000
player [KLChen2PokerPlayer] gets hole card ['C8', 'H5'], current stack 1000
Started the round 2
Street "preflop" started. (community card = [])
"JoyoPlayer" declared "fold:0"
"ZifengFoldMan" declared "fold:0"
"KLChen2PokerPlayer" declared "fold:0"
"ZPlayer" declared "raise:15"
"NitWinWin" declared "fold:0"
"Jinkun" declared "fold:15"
"YueShi" declared "fold:0"
"['ZPlayer']" won the round 2 (stack = {'ZPlayer': 2030, 'NitWinWin': 995, 'Jinkun': 985, 'YueShi': 990, 'JoyoPlayer': 1000, 'ZifengFoldMan': 1000, 'EvanPlayer': 0, 'KLChen2PokerPlayer': 1000})
player [ZPlayer] gets hole card ['C9', 'C2'], current stack 2030
player [NitWinWin] gets hole card ['H2', 'D5'], current stack 995
player [Jinkun] gets hole card ['S3', 'CA'], current stack 985
player [YueShi] gets hole card ['DT', 'SA'], current stack 985
player [JoyoPlayer] gets hole card ['S8', 'DA'], current stack 990
player [ZifengFoldMan] gets hole card ['H4', 'C5'], current stack 1000
player [KLChen2PokerPlayer] gets hole card ['D8', 'S7'], current stack 1000
Started the round 3
Street "preflop" started. (community card = [])
"ZifengFoldMan" declared "fold:0"
"KLChen2PokerPlayer" declared "raise:15"
"ZPlayer" declared "raise:20"
"NitWinWin" declared "fold:0"
"Jinkun" declared "fold:20"
"YueShi" declared "fold:0"
"JoyoPlayer" declared "raise:25"
"KLChen2PokerPlayer" declared "fold:0"
"ZPlayer" declared "call:25"
Street "flop" started. (community card = ['H8', 'H5', 'SK'])
"JoyoPlayer" declared "raise:20"
"ZPlayer" declared "fold:0"
"['JoyoPlayer']" won the round 3 (stack = {'ZPlayer': 2005, 'NitWinWin': 995, 'Jinkun': 985, 'YueShi': 985, 'JoyoPlayer': 1045, 'ZifengFoldMan': 1000, 'EvanPlayer': 0, 'KLChen2PokerPlayer': 985})
player [ZPlayer] gets hole card ['DT', 'H7'], current stack 2005
player [NitWinWin] gets hole card ['D7', 'S3'], current stack 995
player [Jinkun] gets hole card ['S9', 'S4'], current stack 985
player [YueShi] gets hole card ['D3', 'D5'], current stack 985
player [JoyoPlayer] gets hole card ['CJ', 'CK'], current stack 1040
player [ZifengFoldMan] gets hole card ['DJ', 'SJ'], current stack 990
player [KLChen2PokerPlayer] gets hole card ['C4', 'ST'], current stack 985
Started the round 4
Street "preflop" started. (community card = [])
"KLChen2PokerPlayer" declared "fold:0"
"ZPlayer" declared "raise:15"
"NitWinWin" declared "fold:0"
"Jinkun" declared "fold:15"
"YueShi" declared "fold:0"
"JoyoPlayer" declared "fold:0"
"ZifengFoldMan" declared "fold:0"
"['ZPlayer']" won the round 4 (stack = {'ZPlayer': 2020, 'NitWinWin': 995, 'Jinkun': 985, 'YueShi': 985, 'JoyoPlayer': 1040, 'ZifengFoldMan': 990, 'EvanPlayer': 0, 'KLChen2PokerPlayer': 985})
player [ZPlayer] gets hole card ['SQ', 'HQ'], current stack 2020
player [NitWinWin] gets hole card ['ST', 'D8'], current stack 995
player [Jinkun] gets hole card ['C2', 'CJ'], current stack 985
player [YueShi] gets hole card ['S2', 'S5'], current stack 985
player [JoyoPlayer] gets hole card ['D5', 'DQ'], current stack 1040
player [ZifengFoldMan] gets hole card ['C4', 'D2'], current stack 985
player [KLChen2PokerPlayer] gets hole card ['H6', 'DK'], current stack 975
Started the round 5
Street "preflop" started. (community card = [])
"ZPlayer" declared "raise:15"
"NitWinWin" declared "fold:0"
"Jinkun" declared "fold:15"
"YueShi" declared "fold:0"
"JoyoPlayer" declared "fold:0"
"ZifengFoldMan" declared "fold:0"
"KLChen2PokerPlayer" declared "raise:20"
"ZPlayer" declared "call:20"
Street "flop" started. (community card = ['S4', 'C8', 'S3'])
"KLChen2PokerPlayer" declared "call:0"
"ZPlayer" declared "raise:10"
"KLChen2PokerPlayer" declared "fold:0"
"['ZPlayer']" won the round 5 (stack = {'ZPlayer': 2045, 'NitWinWin': 995, 'Jinkun': 985, 'YueShi': 985, 'JoyoPlayer': 1040, 'ZifengFoldMan': 985, 'EvanPlayer': 0, 'KLChen2PokerPlayer': 965})
player [ZPlayer] gets hole card ['ST', 'H2'], current stack 2035
player [NitWinWin] gets hole card ['HQ', 'DQ'], current stack 995
player [Jinkun] gets hole card ['H8', 'D7'], current stack 985
player [YueShi] gets hole card ['DK', 'SQ'], current stack 985
player [JoyoPlayer] gets hole card ['S3', 'SA'], current stack 1040
player [ZifengFoldMan] gets hole card ['C9', 'D2'], current stack 985
player [KLChen2PokerPlayer] gets hole card ['C8', 'H6'], current stack 960
Started the round 6
Street "preflop" started. (community card = [])
"NitWinWin" declared "raise:995"
"Jinkun" declared "fold:995"
"YueShi" declared "fold:0"
"JoyoPlayer" declared "fold:0"
"ZifengFoldMan" declared "fold:0"
"KLChen2PokerPlayer" declared "fold:0"
"ZPlayer" declared "fold:0"
"['NitWinWin']" won the round 6 (stack = {'ZPlayer': 2035, 'NitWinWin': 1010, 'Jinkun': 985, 'YueShi': 985, 'JoyoPlayer': 1040, 'ZifengFoldMan': 985, 'EvanPlayer': 0, 'KLChen2PokerPlayer': 960})
player [ZPlayer] gets hole card ['H7', 'C8'], current stack 2030
player [NitWinWin] gets hole card ['D3', 'CJ'], current stack 1000
player [Jinkun] gets hole card ['S6', 'SA'], current stack 985
player [YueShi] gets hole card ['HQ', 'DA'], current stack 985
player [JoyoPlayer] gets hole card ['C7', 'SQ'], current stack 1040
player [ZifengFoldMan] gets hole card ['S9', 'D4'], current stack 985
player [KLChen2PokerPlayer] gets hole card ['C5', 'D8'], current stack 960
Started the round 7
Street "preflop" started. (community card = [])
"Jinkun" declared "fold:10"
"YueShi" declared "fold:0"
"JoyoPlayer" declared "fold:0"
"ZifengFoldMan" declared "fold:0"
"KLChen2PokerPlayer" declared "fold:0"
"ZPlayer" declared "raise:15"
"NitWinWin" declared "fold:0"
"['ZPlayer']" won the round 7 (stack = {'ZPlayer': 2045, 'NitWinWin': 1000, 'Jinkun': 985, 'YueShi': 985, 'JoyoPlayer': 1040, 'ZifengFoldMan': 985, 'EvanPlayer': 0, 'KLChen2PokerPlayer': 960})
player [ZPlayer] gets hole card ['C4', 'HT'], current stack 2045
player [NitWinWin] gets hole card ['H6', 'S9'], current stack 995
player [Jinkun] gets hole card ['DK', 'HJ'], current stack 975
player [YueShi] gets hole card ['SJ', 'H4'], current stack 985
player [JoyoPlayer] gets hole card ['ST', 'D8'], current stack 1040
player [ZifengFoldMan] gets hole card ['DJ', 'C3'], current stack 985
player [KLChen2PokerPlayer] gets hole card ['C6', 'S6'], current stack 960
Started the round 8
Street "preflop" started. (community card = [])
"YueShi" declared "fold:0"
"JoyoPlayer" declared "fold:0"
"ZifengFoldMan" declared "fold:0"
"KLChen2PokerPlayer" declared "raise:27"
"ZPlayer" declared "raise:44"
"NitWinWin" declared "fold:0"
"Jinkun" declared "fold:44"
"KLChen2PokerPlayer" declared "fold:0"
"['ZPlayer']" won the round 8 (stack = {'ZPlayer': 2087, 'NitWinWin': 995, 'Jinkun': 975, 'YueShi': 985, 'JoyoPlayer': 1040, 'ZifengFoldMan': 985, 'EvanPlayer': 0, 'KLChen2PokerPlayer': 933})
player [ZPlayer] gets hole card ['S5', 'SJ'], current stack 2087
player [NitWinWin] gets hole card ['D3', 'HA'], current stack 995
player [Jinkun] gets hole card ['S2', 'D7'], current stack 970
player [YueShi] gets hole card ['HT', 'CK'], current stack 975
player [JoyoPlayer] gets hole card ['SQ', 'HQ'], current stack 1040
player [ZifengFoldMan] gets hole card ['S3', 'H2'], current stack 985
player [KLChen2PokerPlayer] gets hole card ['HK', 'ST'], current stack 933
Started the round 9
Street "preflop" started. (community card = [])
"JoyoPlayer" declared "raise:15"
"ZifengFoldMan" declared "fold:0"
"KLChen2PokerPlayer" declared "raise:20"
"ZPlayer" declared "raise:25"
"NitWinWin" declared "fold:0"
"Jinkun" declared "fold:25"
"YueShi" declared "fold:0"
"JoyoPlayer" declared "raise:60"
"KLChen2PokerPlayer" declared "fold:0"
"ZPlayer" declared "call:60"
Street "flop" started. (community card = ['CJ', 'H4', 'H3'])
"JoyoPlayer" declared "raise:665"
"ZPlayer" declared "fold:0"
"['JoyoPlayer']" won the round 9 (stack = {'ZPlayer': 2027, 'NitWinWin': 995, 'Jinkun': 970, 'YueShi': 975, 'JoyoPlayer': 1135, 'ZifengFoldMan': 985, 'EvanPlayer': 0, 'KLChen2PokerPlayer': 913})
player [ZPlayer] gets hole card ['C3', 'CJ'], current stack 2027
player [NitWinWin] gets hole card ['HA', 'D2'], current stack 995
player [Jinkun] gets hole card ['DQ', 'H5'], current stack 970
player [YueShi] gets hole card ['D6', 'CK'], current stack 970
player [JoyoPlayer] gets hole card ['H6', 'D4'], current stack 1125
player [ZifengFoldMan] gets hole card ['C6', 'HQ'], current stack 985
player [KLChen2PokerPlayer] gets hole card ['DT', 'SJ'], current stack 913
Started the round 10
Street "preflop" started. (community card = [])
"ZifengFoldMan" declared "fold:0"
"KLChen2PokerPlayer" declared "raise:18"
"ZPlayer" declared "raise:26"
"NitWinWin" declared "fold:0"
"Jinkun" declared "fold:26"
"YueShi" declared "fold:0"
"JoyoPlayer" declared "raise:34"
"KLChen2PokerPlayer" declared "fold:0"
"ZPlayer" declared "call:34"
Street "flop" started. (community card = ['C5', 'H3', 'SA'])
"JoyoPlayer" declared "fold:0"
"['ZPlayer']" won the round 10 (stack = {'ZPlayer': 2084, 'NitWinWin': 995, 'Jinkun': 970, 'YueShi': 970, 'JoyoPlayer': 1101, 'ZifengFoldMan': 985, 'EvanPlayer': 0, 'KLChen2PokerPlayer': 895})
player [ZPlayer] gets hole card ['DK', 'HJ'], current stack 2084
player [NitWinWin] gets hole card ['C8', 'SQ'], current stack 995
player [Jinkun] gets hole card ['S2', 'H6'], current stack 970
player [YueShi] gets hole card ['D2', 'S9'], current stack 970
player [JoyoPlayer] gets hole card ['ST', 'C2'], current stack 1096
player [ZifengFoldMan] gets hole card ['H7', 'CA'], current stack 975
player [KLChen2PokerPlayer] gets hole card ['D9', 'C9'], current stack 895
Started the round 11
Street "preflop" started. (community card = [])
"KLChen2PokerPlayer" declared "raise:18"
"ZPlayer" declared "raise:26"
"NitWinWin" declared "fold:0"
"Jinkun" declared "fold:26"
"YueShi" declared "fold:0"
"JoyoPlayer" declared "fold:0"
"ZifengFoldMan" declared "fold:0"
"KLChen2PokerPlayer" declared "call:26"
Street "flop" started. (community card = ['C3', 'H8', 'S6'])
"KLChen2PokerPlayer" declared "raise:24"
"ZPlayer" declared "fold:0"
"['KLChen2PokerPlayer']" won the round 11 (stack = {'ZPlayer': 2058, 'NitWinWin': 995, 'Jinkun': 970, 'YueShi': 970, 'JoyoPlayer': 1096, 'ZifengFoldMan': 975, 'EvanPlayer': 0, 'KLChen2PokerPlayer': 936})
player [ZPlayer] gets hole card ['H8', 'C3'], current stack 2058
player [NitWinWin] gets hole card ['SK', 'CA'], current stack 995
player [Jinkun] gets hole card ['HJ', 'D3'], current stack 970
player [YueShi] gets hole card ['S5', 'C8'], current stack 970
player [JoyoPlayer] gets hole card ['SJ', 'HA'], current stack 1096
player [ZifengFoldMan] gets hole card ['D2', 'DT'], current stack 970
player [KLChen2PokerPlayer] gets hole card ['D5', 'CT'], current stack 926
Started the round 12
Street "preflop" started. (community card = [])
"ZPlayer" declared "raise:15"
"NitWinWin" declared "fold:0"
"Jinkun" declared "fold:15"
"YueShi" declared "fold:0"
"JoyoPlayer" declared "raise:20"
"ZifengFoldMan" declared "fold:0"
"KLChen2PokerPlayer" declared "fold:0"
"ZPlayer" declared "fold:0"
"['JoyoPlayer']" won the round 12 (stack = {'ZPlayer': 2043, 'NitWinWin': 995, 'Jinkun': 970, 'YueShi': 970, 'JoyoPlayer': 1126, 'ZifengFoldMan': 970, 'EvanPlayer': 0, 'KLChen2PokerPlayer': 926})
player [ZPlayer] gets hole card ['S6', 'C2'], current stack 2033
player [NitWinWin] gets hole card ['SK', 'CQ'], current stack 995
player [Jinkun] gets hole card ['D9', 'C3'], current stack 970
player [YueShi] gets hole card ['S4', 'H2'], current stack 970
player [JoyoPlayer] gets hole card ['HQ', 'SA'], current stack 1126
player [ZifengFoldMan] gets hole card ['CJ', 'DK'], current stack 970
player [KLChen2PokerPlayer] gets hole card ['S5', 'S2'], current stack 921
Started the round 13
Street "preflop" started. (community card = [])
"NitWinWin" declared "fold:0"
"Jinkun" declared "fold:10"
"YueShi" declared "fold:0"
"JoyoPlayer" declared "fold:0"
"ZifengFoldMan" declared "fold:0"
"KLChen2PokerPlayer" declared "call:10"
"ZPlayer" declared "raise:15"
"KLChen2PokerPlayer" declared "fold:0"
"['ZPlayer']" won the round 13 (stack = {'ZPlayer': 2053, 'NitWinWin': 995, 'Jinkun': 970, 'YueShi': 970, 'JoyoPlayer': 1126, 'ZifengFoldMan': 970, 'EvanPlayer': 0, 'KLChen2PokerPlayer': 916})
player [ZPlayer] gets hole card ['H2', 'H7'], current stack 2048
player [NitWinWin] gets hole card ['DJ', 'D5'], current stack 985
player [Jinkun] gets hole card ['H5', 'S8'], current stack 970
player [YueShi] gets hole card ['H4', 'C3'], current stack 970
player [JoyoPlayer] gets hole card ['SK', 'DK'], current stack 1126
player [ZifengFoldMan] gets hole card ['SJ', 'CJ'], current stack 970
player [KLChen2PokerPlayer] gets hole card ['SA', 'HK'], current stack 916
Started the round 14
Street "preflop" started. (community card = [])
"Jinkun" declared "fold:10"
"YueShi" declared "fold:0"
"JoyoPlayer" declared "fold:0"
"ZifengFoldMan" declared "fold:0"
"KLChen2PokerPlayer" declared "raise:24"
"ZPlayer" declared "raise:38"
"NitWinWin" declared "fold:0"
"KLChen2PokerPlayer" declared "fold:0"
"['ZPlayer']" won the round 14 (stack = {'ZPlayer': 2087, 'NitWinWin': 985, 'Jinkun': 970, 'YueShi': 970, 'JoyoPlayer': 1126, 'ZifengFoldMan': 970, 'EvanPlayer': 0, 'KLChen2PokerPlayer': 892})
player [ZPlayer] gets hole card ['HA', 'S9'], current stack 2087
player [NitWinWin] gets hole card ['CJ', 'C9'], current stack 980
player [Jinkun] gets hole card ['SK', 'CT'], current stack 960
player [YueShi] gets hole card ['S5', 'SJ'], current stack 970
player [JoyoPlayer] gets hole card ['D5', 'H4'], current stack 1126
player [ZifengFoldMan] gets hole card ['C6', 'D6'], current stack 970
player [KLChen2PokerPlayer] gets hole card ['HJ', 'C7'], current stack 892
Started the round 15
Street "preflop" started. (community card = [])
"YueShi" declared "fold:0"
"JoyoPlayer" declared "fold:0"
"ZifengFoldMan" declared "fold:0"
"KLChen2PokerPlayer" declared "raise:19"
"ZPlayer" declared "raise:28"
"NitWinWin" declared "fold:0"
"Jinkun" declared "fold:28"
"KLChen2PokerPlayer" declared "fold:0"
"['ZPlayer']" won the round 15 (stack = {'ZPlayer': 2121, 'NitWinWin': 980, 'Jinkun': 960, 'YueShi': 970, 'JoyoPlayer': 1126, 'ZifengFoldMan': 970, 'EvanPlayer': 0, 'KLChen2PokerPlayer': 873})
player [ZPlayer] gets hole card ['CQ', 'C4'], current stack 2121
player [NitWinWin] gets hole card ['H8', 'DT'], current stack 980
player [Jinkun] gets hole card ['S4', 'D7'], current stack 955
player [YueShi] gets hole card ['DJ', 'H9'], current stack 960
player [JoyoPlayer] gets hole card ['SK', 'H6'], current stack 1126
player [ZifengFoldMan] gets hole card ['HA', 'S5'], current stack 970
player [KLChen2PokerPlayer] gets hole card ['HK', 'C8'], current stack 873
Started the round 16
Street "preflop" started. (community card = [])
"JoyoPlayer" declared "fold:0"
"ZifengFoldMan" declared "fold:0"
"KLChen2PokerPlayer" declared "raise:15"
"ZPlayer" declared "raise:20"
"NitWinWin" declared "fold:0"
"Jinkun" declared "fold:20"
"YueShi" declared "fold:0"
"KLChen2PokerPlayer" declared "fold:0"
"['ZPlayer']" won the round 16 (stack = {'ZPlayer': 2151, 'NitWinWin': 980, 'Jinkun': 955, 'YueShi': 960, 'JoyoPlayer': 1126, 'ZifengFoldMan': 970, 'EvanPlayer': 0, 'KLChen2PokerPlayer': 858})
player [ZPlayer] gets hole card ['H9', 'HJ'], current stack 2151
player [NitWinWin] gets hole card ['SQ', 'SA'], current stack 980
player [Jinkun] gets hole card ['C6', 'C7'], current stack 955
player [YueShi] gets hole card ['H8', 'CK'], current stack 955
player [JoyoPlayer] gets hole card ['S4', 'H7'], current stack 1116
player [ZifengFoldMan] gets hole card ['D5', 'H4'], current stack 970
player [KLChen2PokerPlayer] gets hole card ['DQ', 'C9'], current stack 858
Started the round 17
Street "preflop" started. (community card = [])
"ZifengFoldMan" declared "fold:0"
"KLChen2PokerPlayer" declared "raise:15"
"ZPlayer" declared "raise:20"
"NitWinWin" declared "fold:0"
"Jinkun" declared "fold:20"
"YueShi" declared "fold:0"
"JoyoPlayer" declared "raise:25"
"KLChen2PokerPlayer" declared "fold:0"
"ZPlayer" declared "call:25"
Street "flop" started. (community card = ['H3', 'D8', 'S5'])
"JoyoPlayer" declared "raise:10"
"ZPlayer" declared "fold:0"
"['JoyoPlayer']" won the round 17 (stack = {'ZPlayer': 2126, 'NitWinWin': 980, 'Jinkun': 955, 'YueShi': 955, 'JoyoPlayer': 1171, 'ZifengFoldMan': 970, 'EvanPlayer': 0, 'KLChen2PokerPlayer': 843})
player [ZPlayer] gets hole card ['D3', 'S6'], current stack 2126
player [NitWinWin] gets hole card ['CT', 'C3'], current stack 980
player [Jinkun] gets hole card ['DJ', 'D4'], current stack 955
player [YueShi] gets hole card ['S8', 'H4'], current stack 955
player [JoyoPlayer] gets hole card ['DA', 'C9'], current stack 1166
player [ZifengFoldMan] gets hole card ['D7', 'H6'], current stack 960
player [KLChen2PokerPlayer] gets hole card ['C6', 'CJ'], current stack 843
Started the round 18
Street "preflop" started. (community card = [])
"KLChen2PokerPlayer" declared "raise:15"
"ZPlayer" declared "raise:20"
"NitWinWin" declared "fold:0"
"Jinkun" declared "fold:20"
"YueShi" declared "fold:0"
"JoyoPlayer" declared "fold:0"
"ZifengFoldMan" declared "fold:0"
"KLChen2PokerPlayer" declared "call:20"
Street "flop" started. (community card = ['HT', 'HK', 'SK'])
"KLChen2PokerPlayer" declared "call:0"
"ZPlayer" declared "call:0"
Street "turn" started. (community card = ['HT', 'HK', 'SK', 'S4'])
"KLChen2PokerPlayer" declared "call:0"
"ZPlayer" declared "call:0"
Street "river" started. (community card = ['HT', 'HK', 'SK', 'S4', 'DT'])
"KLChen2PokerPlayer" declared "call:0"
"ZPlayer" declared "call:0"
"['KLChen2PokerPlayer']" won the round 18 (stack = {'ZPlayer': 2106, 'NitWinWin': 980, 'Jinkun': 955, 'YueShi': 955, 'JoyoPlayer': 1166, 'ZifengFoldMan': 960, 'EvanPlayer': 0, 'KLChen2PokerPlayer': 878})
player [ZPlayer] gets hole card ['CQ', 'C5'], current stack 2106
player [NitWinWin] gets hole card ['H7', 'D3'], current stack 980
player [Jinkun] gets hole card ['SK', 'ST'], current stack 955
player [YueShi] gets hole card ['H8', 'C9'], current stack 955
player [JoyoPlayer] gets hole card ['D4', 'DT'], current stack 1166
player [ZifengFoldMan] gets hole card ['CK', 'C2'], current stack 955
player [KLChen2PokerPlayer] gets hole card ['HQ', 'C8'], current stack 868
Started the round 19
Street "preflop" started. (community card = [])
"ZPlayer" declared "raise:15"
"NitWinWin" declared "fold:0"
"Jinkun" declared "fold:15"
"YueShi" declared "fold:0"
"JoyoPlayer" declared "fold:0"
"ZifengFoldMan" declared "fold:0"
"KLChen2PokerPlayer" declared "raise:20"
"ZPlayer" declared "call:20"
Street "flop" started. (community card = ['S7', 'HA', 'D7'])
"KLChen2PokerPlayer" declared "raise:11"
"ZPlayer" declared "fold:0"
"['KLChen2PokerPlayer']" won the round 19 (stack = {'ZPlayer': 2086, 'NitWinWin': 980, 'Jinkun': 955, 'YueShi': 955, 'JoyoPlayer': 1166, 'ZifengFoldMan': 955, 'EvanPlayer': 0, 'KLChen2PokerPlayer': 903})
player [ZPlayer] gets hole card ['SQ', 'S8'], current stack 2076
player [NitWinWin] gets hole card ['H2', 'H8'], current stack 980
player [Jinkun] gets hole card ['C2', 'C5'], current stack 955
player [YueShi] gets hole card ['D4', 'C6'], current stack 955
player [JoyoPlayer] gets hole card ['DA', 'HT'], current stack 1166
player [ZifengFoldMan] gets hole card ['S6', 'C9'], current stack 955
player [KLChen2PokerPlayer] gets hole card ['D6', 'HJ'], current stack 898
Started the round 20
Street "preflop" started. (community card = [])
"NitWinWin" declared "fold:0"
"Jinkun" declared "fold:10"
"YueShi" declared "fold:0"
"JoyoPlayer" declared "raise:15"
"ZifengFoldMan" declared "fold:0"
"KLChen2PokerPlayer" declared "fold:0"
"ZPlayer" declared "raise:20"
"JoyoPlayer" declared "call:20"
Street "flop" started. (community card = ['H5', 'CK', 'DK'])
"ZPlayer" declared "call:0"
"JoyoPlayer" declared "raise:20"
"ZPlayer" declared "fold:0"
"['JoyoPlayer']" won the round 20 (stack = {'ZPlayer': 2066, 'NitWinWin': 980, 'Jinkun': 955, 'YueShi': 955, 'JoyoPlayer': 1191, 'ZifengFoldMan': 955, 'EvanPlayer': 0, 'KLChen2PokerPlayer': 898})
player [ZPlayer] gets hole card ['C9', 'H9'], current stack 2061
player [NitWinWin] gets hole card ['D3', 'C7'], current stack 970
player [Jinkun] gets hole card ['ST', 'S6'], current stack 955
player [YueShi] gets hole card ['DA', 'S5'], current stack 955
player [JoyoPlayer] gets hole card ['CK', 'S4'], current stack 1191
player [ZifengFoldMan] gets hole card ['D6', 'D5'], current stack 955
player [KLChen2PokerPlayer] gets hole card ['SJ', 'S3'], current stack 898
Started the round 21
Street "preflop" started. (community card = [])
"Jinkun" declared "fold:10"
"YueShi" declared "fold:0"
"JoyoPlayer" declared "fold:0"
"ZifengFoldMan" declared "fold:0"
"KLChen2PokerPlayer" declared "raise:15"
"ZPlayer" declared "raise:20"
"NitWinWin" declared "fold:0"
"KLChen2PokerPlayer" declared "call:20"
Street "flop" started. (community card = ['C6', 'CQ', 'SQ'])
"ZPlayer" declared "raise:10"
"KLChen2PokerPlayer" declared "fold:0"
"['ZPlayer']" won the round 21 (stack = {'ZPlayer': 2096, 'NitWinWin': 970, 'Jinkun': 955, 'YueShi': 955, 'JoyoPlayer': 1191, 'ZifengFoldMan': 955, 'EvanPlayer': 0, 'KLChen2PokerPlayer': 878})
player [ZPlayer] gets hole card ['S2', 'H6'], current stack 2096
player [NitWinWin] gets hole card ['C5', 'C6'], current stack 965
player [Jinkun] gets hole card ['H7', 'SK'], current stack 945
player [YueShi] gets hole card ['H8', 'ST'], current stack 955
player [JoyoPlayer] gets hole card ['C3', 'D6'], current stack 1191
player [ZifengFoldMan] gets hole card ['D2', 'CQ'], current stack 955
player [KLChen2PokerPlayer] gets hole card ['SA', 'C7'], current stack 878
Started the round 22
Street "preflop" started. (community card = [])
"YueShi" declared "fold:0"
"JoyoPlayer" declared "fold:0"
"ZifengFoldMan" declared "fold:0"
"KLChen2PokerPlayer" declared "raise:15"
"ZPlayer" declared "fold:0"
"NitWinWin" declared "fold:0"
"Jinkun" declared "call:15"
Street "flop" started. (community card = ['D4', 'DQ', 'D3'])
"Jinkun" declared "call:0"
"KLChen2PokerPlayer" declared "call:0"
Street "turn" started. (community card = ['D4', 'DQ', 'D3', 'CK'])
"Jinkun" declared "call:0"
"KLChen2PokerPlayer" declared "call:0"
Street "river" started. (community card = ['D4', 'DQ', 'D3', 'CK', 'C2'])
"Jinkun" declared "call:0"
"KLChen2PokerPlayer" declared "call:0"
"['Jinkun']" won the round 22 (stack = {'ZPlayer': 2096, 'NitWinWin': 965, 'Jinkun': 975, 'YueShi': 955, 'JoyoPlayer': 1191, 'ZifengFoldMan': 955, 'EvanPlayer': 0, 'KLChen2PokerPlayer': 863})
player [ZPlayer] gets hole card ['C9', 'S2'], current stack 2096
player [NitWinWin] gets hole card ['HQ', 'CK'], current stack 965
player [Jinkun] gets hole card ['H9', 'CQ'], current stack 970
player [YueShi] gets hole card ['H7', 'C3'], current stack 945
player [JoyoPlayer] gets hole card ['S4', 'D5'], current stack 1191
player [ZifengFoldMan] gets hole card ['S3', 'H2'], current stack 955
player [KLChen2PokerPlayer] gets hole card ['HT', 'D6'], current stack 863
Started the round 23
Street "preflop" started. (community card = [])
"JoyoPlayer" declared "raise:15"
"ZifengFoldMan" declared "fold:0"
"KLChen2PokerPlayer" declared "fold:0"
"ZPlayer" declared "raise:20"
"NitWinWin" declared "fold:0"
"Jinkun" declared "fold:20"
"YueShi" declared "fold:0"
"JoyoPlayer" declared "fold:0"
"['ZPlayer']" won the round 23 (stack = {'ZPlayer': 2126, 'NitWinWin': 965, 'Jinkun': 970, 'YueShi': 945, 'JoyoPlayer': 1176, 'ZifengFoldMan': 955, 'EvanPlayer': 0, 'KLChen2PokerPlayer': 863})
player [ZPlayer] gets hole card ['C5', 'SA'], current stack 2126
player [NitWinWin] gets hole card ['H5', 'S8'], current stack 965
player [Jinkun] gets hole card ['HA', 'H6'], current stack 970
player [YueShi] gets hole card ['S4', 'S6'], current stack 940
player [JoyoPlayer] gets hole card ['C9', 'S5'], current stack 1166
player [ZifengFoldMan] gets hole card ['S7', 'D8'], current stack 955
player [KLChen2PokerPlayer] gets hole card ['S9', 'D2'], current stack 863
Started the round 24
Street "preflop" started. (community card = [])
"ZifengFoldMan" declared "fold:0"
"KLChen2PokerPlayer" declared "fold:0"
"ZPlayer" declared "raise:15"
"NitWinWin" declared "fold:0"
"Jinkun" declared "fold:15"
"YueShi" declared "fold:0"
"JoyoPlayer" declared "fold:0"
"['ZPlayer']" won the round 24 (stack = {'ZPlayer': 2141, 'NitWinWin': 965, 'Jinkun': 970, 'YueShi': 940, 'JoyoPlayer': 1166, 'ZifengFoldMan': 955, 'EvanPlayer': 0, 'KLChen2PokerPlayer': 863})
player [ZPlayer] gets hole card ['H8', 'DT'], current stack 2141
player [NitWinWin] gets hole card ['SA', 'CQ'], current stack 965
player [Jinkun] gets hole card ['S7', 'C5'], current stack 970
player [YueShi] gets hole card ['ST', 'H4'], current stack 940
player [JoyoPlayer] gets hole card ['D8', 'HA'], current stack 1161
player [ZifengFoldMan] gets hole card ['D7', 'C4'], current stack 945
player [KLChen2PokerPlayer] gets hole card ['C6', 'C9'], current stack 863
Started the round 25
Street "preflop" started. (community card = [])
"KLChen2PokerPlayer" declared "raise:17"
"ZPlayer" declared "raise:24"
"NitWinWin" declared "fold:0"
"Jinkun" declared "fold:24"
"YueShi" declared "fold:0"
"JoyoPlayer" declared "fold:0"
"ZifengFoldMan" declared "fold:0"
"KLChen2PokerPlayer" declared "fold:0"
"['ZPlayer']" won the round 25 (stack = {'ZPlayer': 2173, 'NitWinWin': 965, 'Jinkun': 970, 'YueShi': 940, 'JoyoPlayer': 1161, 'ZifengFoldMan': 945, 'EvanPlayer': 0, 'KLChen2PokerPlayer': 846})
player [ZPlayer] gets hole card ['DQ', 'D8'], current stack 2173
player [NitWinWin] gets hole card ['D6', 'H6'], current stack 965
player [Jinkun] gets hole card ['D4', 'D3'], current stack 970
player [YueShi] gets hole card ['HK', 'S4'], current stack 940
player [JoyoPlayer] gets hole card ['S7', 'D9'], current stack 1161
player [ZifengFoldMan] gets hole card ['SK', 'C5'], current stack 940
player [KLChen2PokerPlayer] gets hole card ['H9', 'CQ'], current stack 836
Started the round 26
Street "preflop" started. (community card = [])
"ZPlayer" declared "raise:15"
"NitWinWin" declared "fold:0"
"Jinkun" declared "fold:15"
"YueShi" declared "fold:0"
"JoyoPlayer" declared "fold:0"
"ZifengFoldMan" declared "fold:0"
"KLChen2PokerPlayer" declared "raise:20"
"ZPlayer" declared "call:20"
Street "flop" started. (community card = ['SQ', 'CJ', 'DT'])
"KLChen2PokerPlayer" declared "raise:26"
"ZPlayer" declared "call:26"
Street "turn" started. (community card = ['SQ', 'CJ', 'DT', 'CA'])
"KLChen2PokerPlayer" declared "raise:73"
"ZPlayer" declared "call:73"
Street "river" started. (community card = ['SQ', 'CJ', 'DT', 'CA', 'S5'])
"KLChen2PokerPlayer" declared "call:0"
"ZPlayer" declared "raise:10"
"KLChen2PokerPlayer" declared "call:10"
"['ZPlayer', 'KLChen2PokerPlayer']" won the round 26 (stack = {'ZPlayer': 2175, 'NitWinWin': 965, 'Jinkun': 970, 'YueShi': 940, 'JoyoPlayer': 1161, 'ZifengFoldMan': 940, 'EvanPlayer': 0, 'KLChen2PokerPlayer': 848})
player [ZPlayer] gets hole card ['D8', 'C5'], current stack 2165
player [NitWinWin] gets hole card ['D5', 'DT'], current stack 965
player [Jinkun] gets hole card ['DJ', 'CK'], current stack 970
player [YueShi] gets hole card ['S6', 'S9'], current stack 940
player [JoyoPlayer] gets hole card ['C3', 'SK'], current stack 1161
player [ZifengFoldMan] gets hole card ['HJ', 'S3'], current stack 940
player [KLChen2PokerPlayer] gets hole card ['H2', 'H6'], current stack 843
Started the round 27
Street "preflop" started. (community card = [])
"NitWinWin" declared "fold:0"
"Jinkun" declared "fold:10"
"YueShi" declared "fold:0"
"JoyoPlayer" declared "fold:0"
"ZifengFoldMan" declared "fold:0"
"KLChen2PokerPlayer" declared "call:10"
"ZPlayer" declared "raise:15"
"KLChen2PokerPlayer" declared "fold:0"
"['ZPlayer']" won the round 27 (stack = {'ZPlayer': 2185, 'NitWinWin': 965, 'Jinkun': 970, 'YueShi': 940, 'JoyoPlayer': 1161, 'ZifengFoldMan': 940, 'EvanPlayer': 0, 'KLChen2PokerPlayer': 838})
player [ZPlayer] gets hole card ['H7', 'D9'], current stack 2180
player [NitWinWin] gets hole card ['CJ', 'S2'], current stack 955
player [Jinkun] gets hole card ['C4', 'D8'], current stack 970
player [YueShi] gets hole card ['DQ', 'SJ'], current stack 940
player [JoyoPlayer] gets hole card ['CA', 'S4'], current stack 1161
player [ZifengFoldMan] gets hole card ['D2', 'SK'], current stack 940
player [KLChen2PokerPlayer] gets hole card ['C9', 'HQ'], current stack 838
Started the round 28
Street "preflop" started. (community card = [])
"Jinkun" declared "fold:10"
"YueShi" declared "fold:0"
"JoyoPlayer" declared "raise:15"
"ZifengFoldMan" declared "fold:0"
"KLChen2PokerPlayer" declared "raise:20"
"ZPlayer" declared "raise:25"
"NitWinWin" declared "fold:0"
"JoyoPlayer" declared "fold:0"
"KLChen2PokerPlayer" declared "fold:0"
"['ZPlayer']" won the round 28 (stack = {'ZPlayer': 2230, 'NitWinWin': 955, 'Jinkun': 970, 'YueShi': 940, 'JoyoPlayer': 1146, 'ZifengFoldMan': 940, 'EvanPlayer': 0, 'KLChen2PokerPlayer': 818})
player [ZPlayer] gets hole card ['CA', 'D3'], current stack 2230
player [NitWinWin] gets hole card ['HK', 'HQ'], current stack 950
player [Jinkun] gets hole card ['H6', 'CT'], current stack 960
player [YueShi] gets hole card ['C9', 'H2'], current stack 940
player [JoyoPlayer] gets hole card ['D4', 'C2'], current stack 1146
player [ZifengFoldMan] gets hole card ['C3', 'C6'], current stack 940
player [KLChen2PokerPlayer] gets hole card ['D5', 'D9'], current stack 818
Started the round 29
Street "preflop" started. (community card = [])
"YueShi" declared "fold:0"
"JoyoPlayer" declared "raise:15"
"ZifengFoldMan" declared "fold:0"
"KLChen2PokerPlayer" declared "fold:0"
"ZPlayer" declared "raise:20"
"NitWinWin" declared "fold:0"
"Jinkun" declared "fold:20"
"JoyoPlayer" declared "raise:25"
"ZPlayer" declared "call:25"
Street "flop" started. (community card = ['DK', 'H3', 'SQ'])
"JoyoPlayer" declared "raise:10"
"ZPlayer" declared "fold:0"
"['JoyoPlayer']" won the round 29 (stack = {'ZPlayer': 2205, 'NitWinWin': 950, 'Jinkun': 960, 'YueShi': 940, 'JoyoPlayer': 1186, 'ZifengFoldMan': 940, 'EvanPlayer': 0, 'KLChen2PokerPlayer': 818})
player [ZPlayer] gets hole card ['D8', 'HK'], current stack 2205
player [NitWinWin] gets hole card ['C8', 'DQ'], current stack 950
player [Jinkun] gets hole card ['HA', 'S7'], current stack 955
player [YueShi] gets hole card ['CJ', 'SJ'], current stack 930
player [JoyoPlayer] gets hole card ['C9', 'S3'], current stack 1186
player [ZifengFoldMan] gets hole card ['CQ', 'ST'], current stack 940
player [KLChen2PokerPlayer] gets hole card ['DJ', 'H6'], current stack 818
Started the round 30
Street "preflop" started. (community card = [])
"JoyoPlayer" declared "fold:0"
"ZifengFoldMan" declared "fold:0"
"KLChen2PokerPlayer" declared "call:10"
"ZPlayer" declared "raise:15"
"NitWinWin" declared "fold:0"
"Jinkun" declared "fold:15"
"YueShi" declared "fold:0"
"KLChen2PokerPlayer" declared "fold:0"
"['ZPlayer']" won the round 30 (stack = {'ZPlayer': 2230, 'NitWinWin': 950, 'Jinkun': 955, 'YueShi': 930, 'JoyoPlayer': 1186, 'ZifengFoldMan': 940, 'EvanPlayer': 0, 'KLChen2PokerPlayer': 808})
player [ZPlayer] gets hole card ['S7', 'D9'], current stack 2230
player [NitWinWin] gets hole card ['HJ', 'D8'], current stack 950
player [Jinkun] gets hole card ['C8', 'D2'], current stack 955
player [YueShi] gets hole card ['C5', 'C3'], current stack 925
player [JoyoPlayer] gets hole card ['DQ', 'DK'], current stack 1176
player [ZifengFoldMan] gets hole card ['H3', 'H7'], current stack 940
player [KLChen2PokerPlayer] gets hole card ['D3', 'CT'], current stack 808
Started the round 31
Street "preflop" started. (community card = [])
"ZifengFoldMan" declared "fold:0"
"KLChen2PokerPlayer" declared "fold:0"
"ZPlayer" declared "raise:15"
"NitWinWin" declared "fold:0"
"Jinkun" declared "fold:15"
"YueShi" declared "fold:0"
"JoyoPlayer" declared "raise:20"
"ZPlayer" declared "call:20"
Street "flop" started. (community card = ['C6', 'D4', 'CJ'])
"JoyoPlayer" declared "raise:10"
"ZPlayer" declared "fold:0"
"['JoyoPlayer']" won the round 31 (stack = {'ZPlayer': 2210, 'NitWinWin': 950, 'Jinkun': 955, 'YueShi': 925, 'JoyoPlayer': 1211, 'ZifengFoldMan': 940, 'EvanPlayer': 0, 'KLChen2PokerPlayer': 808})
player [ZPlayer] gets hole card ['C5', 'H7'], current stack 2210
player [NitWinWin] gets hole card ['HT', 'S7'], current stack 950
player [Jinkun] gets hole card ['C3', 'D8'], current stack 955
player [YueShi] gets hole card ['D2', 'H9'], current stack 925
player [JoyoPlayer] gets hole card ['C8', 'C7'], current stack 1206
player [ZifengFoldMan] gets hole card ['SJ', 'S3'], current stack 930
player [KLChen2PokerPlayer] gets hole card ['CA', 'D5'], current stack 808
Started the round 32
Street "preflop" started. (community card = [])
"KLChen2PokerPlayer" declared "raise:19"
"ZPlayer" declared "raise:28"
"NitWinWin" declared "fold:0"
"Jinkun" declared "fold:28"
"YueShi" declared "fold:0"
"JoyoPlayer" declared "raise:37"
"ZifengFoldMan" declared "fold:0"
"KLChen2PokerPlayer" declared "fold:0"
"ZPlayer" declared "call:37"
Street "flop" started. (community card = ['DA', 'DT', 'HJ'])
"JoyoPlayer" declared "fold:0"
"['ZPlayer']" won the round 32 (stack = {'ZPlayer': 2276, 'NitWinWin': 950, 'Jinkun': 955, 'YueShi': 925, 'JoyoPlayer': 1174, 'ZifengFoldMan': 930, 'EvanPlayer': 0, 'KLChen2PokerPlayer': 789})
player [ZPlayer] gets hole card ['H4', 'D4'], current stack 2276
player [NitWinWin] gets hole card ['H9', 'SQ'], current stack 950
player [Jinkun] gets hole card ['HQ', 'S6'], current stack 955
player [YueShi] gets hole card ['C3', 'D2'], current stack 925
player [JoyoPlayer] gets hole card ['HA', 'H5'], current stack 1174
player [ZifengFoldMan] gets hole card ['CQ', 'DQ'], current stack 925
player [KLChen2PokerPlayer] gets hole card ['H8', 'DK'], current stack 779
Started the round 33
Street "preflop" started. (community card = [])
"ZPlayer" declared "raise:15"
"NitWinWin" declared "fold:0"
"Jinkun" declared "fold:15"
"YueShi" declared "fold:0"
"JoyoPlayer" declared "fold:0"
"ZifengFoldMan" declared "fold:0"
"KLChen2PokerPlayer" declared "raise:20"
"ZPlayer" declared "fold:0"
"['KLChen2PokerPlayer']" won the round 33 (stack = {'ZPlayer': 2261, 'NitWinWin': 950, 'Jinkun': 955, 'YueShi': 925, 'JoyoPlayer': 1174, 'ZifengFoldMan': 925, 'EvanPlayer': 0, 'KLChen2PokerPlayer': 809})
player [ZPlayer] gets hole card ['DK', 'DT'], current stack 2251
player [NitWinWin] gets hole card ['HA', 'H3'], current stack 950
player [Jinkun] gets hole card ['C6', 'D6'], current stack 955
player [YueShi] gets hole card ['CJ', 'C5'], current stack 925
player [JoyoPlayer] gets hole card ['D8', 'D4'], current stack 1174
player [ZifengFoldMan] gets hole card ['C7', 'H9'], current stack 925
player [KLChen2PokerPlayer] gets hole card ['S7', 'D3'], current stack 804
Started the round 34
Street "preflop" started. (community card = [])
"NitWinWin" declared "fold:0"
"Jinkun" declared "fold:10"
"YueShi" declared "fold:0"
"JoyoPlayer" declared "raise:15"
"ZifengFoldMan" declared "fold:0"
"KLChen2PokerPlayer" declared "raise:20"
"ZPlayer" declared "raise:25"
"JoyoPlayer" declared "fold:0"
"KLChen2PokerPlayer" declared "fold:0"
"['ZPlayer']" won the round 34 (stack = {'ZPlayer': 2296, 'NitWinWin': 950, 'Jinkun': 955, 'YueShi': 925, 'JoyoPlayer': 1159, 'ZifengFoldMan': 925, 'EvanPlayer': 0, 'KLChen2PokerPlayer': 789})
player [ZPlayer] gets hole card ['SK', 'S3'], current stack 2291
player [NitWinWin] gets hole card ['S6', 'DQ'], current stack 940
player [Jinkun] gets hole card ['C3', 'CQ'], current stack 955
player [YueShi] gets hole card ['S7', 'H2'], current stack 925
player [JoyoPlayer] gets hole card ['S8', 'ST'], current stack 1159
player [ZifengFoldMan] gets hole card ['C8', 'DT'], current stack 925
player [KLChen2PokerPlayer] gets hole card ['S5', 'H4'], current stack 789
Started the round 35
Street "preflop" started. (community card = [])
"Jinkun" declared "fold:10"
"YueShi" declared "fold:0"
"JoyoPlayer" declared "raise:15"
"ZifengFoldMan" declared "fold:0"
"KLChen2PokerPlayer" declared "fold:0"
"ZPlayer" declared "raise:20"
"NitWinWin" declared "fold:0"
"JoyoPlayer" declared "call:20"
Street "flop" started. (community card = ['DK', 'H8', 'CJ'])
"ZPlayer" declared "raise:10"
"JoyoPlayer" declared "raise:40"
"ZPlayer" declared "raise:70"
"JoyoPlayer" declared "call:70"
Street "turn" started. (community card = ['DK', 'H8', 'CJ', 'SQ'])
"ZPlayer" declared "raise:10"
"JoyoPlayer" declared "raise:40"
"ZPlayer" declared "call:40"
Street "river" started. (community card = ['DK', 'H8', 'CJ', 'SQ', 'HT'])
"ZPlayer" declared "call:0"
"JoyoPlayer" declared "call:0"
"['JoyoPlayer']" won the round 35 (stack = {'ZPlayer': 2166, 'NitWinWin': 940, 'Jinkun': 955, 'YueShi': 925, 'JoyoPlayer': 1299, 'ZifengFoldMan': 925, 'EvanPlayer': 0, 'KLChen2PokerPlayer': 789})
player [ZPlayer] gets hole card ['CT', 'D7'], current stack 2166
player [NitWinWin] gets hole card ['H9', 'S2'], current stack 935
player [Jinkun] gets hole card ['H7', 'D5'], current stack 945
player [YueShi] gets hole card ['D2', 'C6'], current stack 925
player [JoyoPlayer] gets hole card ['H4', 'S6'], current stack 1299
player [ZifengFoldMan] gets hole card ['CQ', 'CJ'], current stack 925
player [KLChen2PokerPlayer] gets hole card ['H8', 'ST'], current stack 789
Started the round 36
Street "preflop" started. (community card = [])
"YueShi" declared "fold:0"
"JoyoPlayer" declared "raise:15"
"ZifengFoldMan" declared "fold:0"
"KLChen2PokerPlayer" declared "raise:29"
"ZPlayer" declared "raise:43"
"NitWinWin" declared "fold:0"
"Jinkun" declared "fold:43"
"JoyoPlayer" declared "fold:0"
"KLChen2PokerPlayer" declared "fold:0"
"['ZPlayer']" won the round 36 (stack = {'ZPlayer': 2225, 'NitWinWin': 935, 'Jinkun': 945, 'YueShi': 925, 'JoyoPlayer': 1284, 'ZifengFoldMan': 925, 'EvanPlayer': 0, 'KLChen2PokerPlayer': 760})
player [ZPlayer] gets hole card ['SA', 'HA'], current stack 2225
player [NitWinWin] gets hole card ['D7', 'S5'], current stack 935
player [Jinkun] gets hole card ['C5', 'H8'], current stack 940
player [YueShi] gets hole card ['C2', 'H2'], current stack 915
player [JoyoPlayer] gets hole card ['H5', 'C9'], current stack 1284
player [ZifengFoldMan] gets hole card ['D5', 'H4'], current stack 925
player [KLChen2PokerPlayer] gets hole card ['C3', 'CQ'], current stack 760
Started the round 37
Street "preflop" started. (community card = [])
"JoyoPlayer" declared "fold:0"
"ZifengFoldMan" declared "fold:0"
"KLChen2PokerPlayer" declared "raise:26"
"ZPlayer" declared "raise:42"
"NitWinWin" declared "fold:0"
"Jinkun" declared "fold:42"
"YueShi" declared "fold:0"
"KLChen2PokerPlayer" declared "fold:0"
"['ZPlayer']" won the round 37 (stack = {'ZPlayer': 2266, 'NitWinWin': 935, 'Jinkun': 940, 'YueShi': 915, 'JoyoPlayer': 1284, 'ZifengFoldMan': 925, 'EvanPlayer': 0, 'KLChen2PokerPlayer': 734})
player [ZPlayer] gets hole card ['D5', 'H5'], current stack 2266
player [NitWinWin] gets hole card ['DQ', 'D7'], current stack 935
player [Jinkun] gets hole card ['SJ', 'HA'], current stack 940
player [YueShi] gets hole card ['HK', 'DT'], current stack 910
player [JoyoPlayer] gets hole card ['CJ', 'D8'], current stack 1274
player [ZifengFoldMan] gets hole card ['C5', 'H8'], current stack 925
player [KLChen2PokerPlayer] gets hole card ['HJ', 'ST'], current stack 734
Started the round 38
Street "preflop" started. (community card = [])
"ZifengFoldMan" declared "fold:0"
"KLChen2PokerPlayer" declared "raise:16"
"ZPlayer" declared "raise:22"
"NitWinWin" declared "fold:0"
"Jinkun" declared "fold:22"
"YueShi" declared "fold:0"
"JoyoPlayer" declared "fold:0"
"KLChen2PokerPlayer" declared "fold:0"
"['ZPlayer']" won the round 38 (stack = {'ZPlayer': 2297, 'NitWinWin': 935, 'Jinkun': 940, 'YueShi': 910, 'JoyoPlayer': 1274, 'ZifengFoldMan': 925, 'EvanPlayer': 0, 'KLChen2PokerPlayer': 718})
player [ZPlayer] gets hole card ['S5', 'C7'], current stack 2297
player [NitWinWin] gets hole card ['D7', 'C2'], current stack 935
player [Jinkun] gets hole card ['SQ', 'D6'], current stack 940
player [YueShi] gets hole card ['D4', 'S7'], current stack 910
player [JoyoPlayer] gets hole card ['H4', 'CQ'], current stack 1269
player [ZifengFoldMan] gets hole card ['C5', 'SK'], current stack 915
player [KLChen2PokerPlayer] gets hole card ['S8', 'S6'], current stack 718
Started the round 39
Street "preflop" started. (community card = [])
"KLChen2PokerPlayer" declared "raise:15"
"ZPlayer" declared "raise:20"
"NitWinWin" declared "fold:0"
"Jinkun" declared "fold:20"
"YueShi" declared "fold:0"
"JoyoPlayer" declared "raise:25"
"ZifengFoldMan" declared "fold:0"
"KLChen2PokerPlayer" declared "fold:0"
"ZPlayer" declared "call:25"
Street "flop" started. (community card = ['H9', 'D8', 'CJ'])
"JoyoPlayer" declared "raise:10"
"ZPlayer" declared "fold:0"
"['JoyoPlayer']" won the round 39 (stack = {'ZPlayer': 2272, 'NitWinWin': 935, 'Jinkun': 940, 'YueShi': 910, 'JoyoPlayer': 1324, 'ZifengFoldMan': 915, 'EvanPlayer': 0, 'KLChen2PokerPlayer': 703})
player [ZPlayer] gets hole card ['SA', 'H2'], current stack 2272
player [NitWinWin] gets hole card ['DJ', 'D5'], current stack 935
player [Jinkun] gets hole card ['DT', 'H3'], current stack 940
player [YueShi] gets hole card ['S7', 'DQ'], current stack 910
player [JoyoPlayer] gets hole card ['CT', 'HQ'], current stack 1324
player [ZifengFoldMan] gets hole card ['H5', 'C3'], current stack 910
player [KLChen2PokerPlayer] gets hole card ['S6', 'C5'], current stack 693
Started the round 40
Street "preflop" started. (community card = [])
"ZPlayer" declared "raise:15"
"NitWinWin" declared "fold:0"
"Jinkun" declared "fold:15"
"YueShi" declared "fold:0"
"JoyoPlayer" declared "fold:0"
"ZifengFoldMan" declared "fold:0"
"KLChen2PokerPlayer" declared "fold:0"
"['ZPlayer']" won the round 40 (stack = {'ZPlayer': 2287, 'NitWinWin': 935, 'Jinkun': 940, 'YueShi': 910, 'JoyoPlayer': 1324, 'ZifengFoldMan': 910, 'EvanPlayer': 0, 'KLChen2PokerPlayer': 693})
player [ZPlayer] gets hole card ['CA', 'H4'], current stack 2277
player [NitWinWin] gets hole card ['DT', 'CK'], current stack 935
player [Jinkun] gets hole card ['CT', 'C4'], current stack 940
player [YueShi] gets hole card ['SQ', 'H5'], current stack 910
player [JoyoPlayer] gets hole card ['CQ', 'ST'], current stack 1324
player [ZifengFoldMan] gets hole card ['D9', 'S6'], current stack 910
player [KLChen2PokerPlayer] gets hole card ['D5', 'SA'], current stack 688
Started the round 41
Street "preflop" started. (community card = [])
"NitWinWin" declared "fold:0"
"Jinkun" declared "fold:10"
"YueShi" declared "fold:0"
"JoyoPlayer" declared "raise:15"
"ZifengFoldMan" declared "fold:0"
"KLChen2PokerPlayer" declared "raise:20"
"ZPlayer" declared "raise:25"
"JoyoPlayer" declared "fold:0"
"KLChen2PokerPlayer" declared "fold:0"
"['ZPlayer']" won the round 41 (stack = {'ZPlayer': 2322, 'NitWinWin': 935, 'Jinkun': 940, 'YueShi': 910, 'JoyoPlayer': 1309, 'ZifengFoldMan': 910, 'EvanPlayer': 0, 'KLChen2PokerPlayer': 673})
player [ZPlayer] gets hole card ['S6', 'DK'], current stack 2317
player [NitWinWin] gets hole card ['C3', 'C8'], current stack 925
player [Jinkun] gets hole card ['DJ', 'HA'], current stack 940
player [YueShi] gets hole card ['H4', 'S7'], current stack 910
player [JoyoPlayer] gets hole card ['SJ', 'H6'], current stack 1309
player [ZifengFoldMan] gets hole card ['DT', 'HT'], current stack 910
player [KLChen2PokerPlayer] gets hole card ['HK', 'CQ'], current stack 673
Started the round 42
Street "preflop" started. (community card = [])
"Jinkun" declared "fold:10"
"YueShi" declared "fold:0"
"JoyoPlayer" declared "raise:15"
"ZifengFoldMan" declared "fold:0"
"KLChen2PokerPlayer" declared "raise:20"
"ZPlayer" declared "raise:25"
"NitWinWin" declared "fold:0"
"JoyoPlayer" declared "raise:30"
"KLChen2PokerPlayer" declared "fold:0"
"ZPlayer" declared "call:30"
Street "flop" started. (community card = ['D5', 'S3', 'D4'])
"ZPlayer" declared "call:0"
"JoyoPlayer" declared "raise:10"
"ZPlayer" declared "fold:0"
"['JoyoPlayer']" won the round 42 (stack = {'ZPlayer': 2292, 'NitWinWin': 925, 'Jinkun': 940, 'YueShi': 910, 'JoyoPlayer': 1369, 'ZifengFoldMan': 910, 'EvanPlayer': 0, 'KLChen2PokerPlayer': 653})
player [ZPlayer] gets hole card ['CA', 'S6'], current stack 2292
player [NitWinWin] gets hole card ['D8', 'DA'], current stack 920
player [Jinkun] gets hole card ['SQ', 'CK'], current stack 930
player [YueShi] gets hole card ['D6', 'D7'], current stack 910
player [JoyoPlayer] gets hole card ['H5', 'C9'], current stack 1369
player [ZifengFoldMan] gets hole card ['D3', 'HT'], current stack 910
player [KLChen2PokerPlayer] gets hole card ['C7', 'CT'], current stack 653
Started the round 43
Street "preflop" started. (community card = [])
"YueShi" declared "fold:0"
"JoyoPlayer" declared "raise:15"
"ZifengFoldMan" declared "fold:0"
"KLChen2PokerPlayer" declared "raise:23"
"ZPlayer" declared "raise:31"
"NitWinWin" declared "fold:0"
"Jinkun" declared "call:31"
"JoyoPlayer" declared "raise:39"
"KLChen2PokerPlayer" declared "fold:0"
"ZPlayer" declared "call:39"
"Jinkun" declared "call:39"
Street "flop" started. (community card = ['HQ', 'HJ', 'D9'])
"Jinkun" declared "call:0"
"JoyoPlayer" declared "fold:0"
"ZPlayer" declared "call:0"
Street "turn" started. (community card = ['HQ', 'HJ', 'D9', 'DQ'])
"Jinkun" declared "raise:67"
"ZPlayer" declared "fold:0"
"['Jinkun']" won the round 43 (stack = {'ZPlayer': 2253, 'NitWinWin': 920, 'Jinkun': 1046, 'YueShi': 910, 'JoyoPlayer': 1330, 'ZifengFoldMan': 910, 'EvanPlayer': 0, 'KLChen2PokerPlayer': 630})
player [ZPlayer] gets hole card ['CJ', 'S6'], current stack 2253
player [NitWinWin] gets hole card ['DJ', 'H4'], current stack 920
player [Jinkun] gets hole card ['HA', 'ST'], current stack 1041
player [YueShi] gets hole card ['D7', 'DK'], current stack 900
player [JoyoPlayer] gets hole card ['HQ', 'H3'], current stack 1330
player [ZifengFoldMan] gets hole card ['SJ', 'H9'], current stack 910
player [KLChen2PokerPlayer] gets hole card ['S3', 'DT'], current stack 630
Started the round 44
Street "preflop" started. (community card = [])
"JoyoPlayer" declared "fold:0"
"ZifengFoldMan" declared "fold:0"
"KLChen2PokerPlayer" declared "fold:0"
"ZPlayer" declared "raise:15"
"NitWinWin" declared "fold:0"
"Jinkun" declared "fold:15"
"YueShi" declared "fold:0"
"['ZPlayer']" won the round 44 (stack = {'ZPlayer': 2268, 'NitWinWin': 920, 'Jinkun': 1041, 'YueShi': 900, 'JoyoPlayer': 1330, 'ZifengFoldMan': 910, 'EvanPlayer': 0, 'KLChen2PokerPlayer': 630})
player [ZPlayer] gets hole card ['H6', 'D4'], current stack 2268
player [NitWinWin] gets hole card ['S6', 'CA'], current stack 920
player [Jinkun] gets hole card ['S9', 'H3'], current stack 1041
player [YueShi] gets hole card ['CT', 'H9'], current stack 895
player [JoyoPlayer] gets hole card ['DT', 'SJ'], current stack 1320
player [ZifengFoldMan] gets hole card ['H8', 'HA'], current stack 910
player [KLChen2PokerPlayer] gets hole card ['SA', 'D2'], current stack 630
Started the round 45
Street "preflop" started. (community card = [])
"ZifengFoldMan" declared "fold:0"
"KLChen2PokerPlayer" declared "raise:18"
"ZPlayer" declared "raise:26"
"NitWinWin" declared "fold:0"
"Jinkun" declared "fold:26"
"YueShi" declared "fold:0"
"JoyoPlayer" declared "raise:34"
"KLChen2PokerPlayer" declared "fold:0"
"ZPlayer" declared "fold:0"
"['JoyoPlayer']" won the round 45 (stack = {'ZPlayer': 2242, 'NitWinWin': 920, 'Jinkun': 1041, 'YueShi': 895, 'JoyoPlayer': 1379, 'ZifengFoldMan': 910, 'EvanPlayer': 0, 'KLChen2PokerPlayer': 612})
player [ZPlayer] gets hole card ['CK', 'S7'], current stack 2242
player [NitWinWin] gets hole card ['ST', 'C4'], current stack 920
player [Jinkun] gets hole card ['D9', 'CT'], current stack 1041
player [YueShi] gets hole card ['CA', 'C6'], current stack 895
player [JoyoPlayer] gets hole card ['H8', 'CJ'], current stack 1374
player [ZifengFoldMan] gets hole card ['C3', 'S4'], current stack 900
player [KLChen2PokerPlayer] gets hole card ['DA', 'S3'], current stack 612
Started the round 46
Street "preflop" started. (community card = [])
"KLChen2PokerPlayer" declared "raise:19"
"ZPlayer" declared "raise:28"
"NitWinWin" declared "fold:0"
"Jinkun" declared "fold:28"
"YueShi" declared "fold:0"
"JoyoPlayer" declared "fold:0"
"ZifengFoldMan" declared "fold:0"
"KLChen2PokerPlayer" declared "fold:0"
"['ZPlayer']" won the round 46 (stack = {'ZPlayer': 2276, 'NitWinWin': 920, 'Jinkun': 1041, 'YueShi': 895, 'JoyoPlayer': 1374, 'ZifengFoldMan': 900, 'EvanPlayer': 0, 'KLChen2PokerPlayer': 593})
player [ZPlayer] gets hole card ['DT', 'CJ'], current stack 2276
player [NitWinWin] gets hole card ['H3', 'C4'], current stack 920
player [Jinkun] gets hole card ['C7', 'D5'], current stack 1041
player [YueShi] gets hole card ['D7', 'S4'], current stack 895
player [JoyoPlayer] gets hole card ['H5', 'HA'], current stack 1374
player [ZifengFoldMan] gets hole card ['C6', 'DK'], current stack 895
player [KLChen2PokerPlayer] gets hole card ['H6', 'HT'], current stack 583
Started the round 47
Street "preflop" started. (community card = [])
"ZPlayer" declared "raise:15"
"NitWinWin" declared "fold:0"
"Jinkun" declared "fold:15"
"YueShi" declared "fold:0"
"JoyoPlayer" declared "raise:20"
"ZifengFoldMan" declared "fold:0"
"KLChen2PokerPlayer" declared "call:20"
"ZPlayer" declared "call:20"
Street "flop" started. (community card = ['S7', 'D9', 'CQ'])
"KLChen2PokerPlayer" declared "call:0"
"ZPlayer" declared "raise:10"
"JoyoPlayer" declared "raise:20"
"KLChen2PokerPlayer" declared "fold:0"
"ZPlayer" declared "fold:0"
"['JoyoPlayer']" won the round 47 (stack = {'ZPlayer': 2246, 'NitWinWin': 920, 'Jinkun': 1041, 'YueShi': 895, 'JoyoPlayer': 1429, 'ZifengFoldMan': 895, 'EvanPlayer': 0, 'KLChen2PokerPlayer': 573})
player [ZPlayer] gets hole card ['SA', 'CJ'], current stack 2236
player [NitWinWin] gets hole card ['D6', 'C8'], current stack 920
player [Jinkun] gets hole card ['S5', 'DK'], current stack 1041
player [YueShi] gets hole card ['CK', 'C6'], current stack 895
player [JoyoPlayer] gets hole card ['HK', 'D5'], current stack 1429
player [ZifengFoldMan] gets hole card ['CQ', 'D7'], current stack 895
player [KLChen2PokerPlayer] gets hole card ['CT', 'ST'], current stack 568
Started the round 48
Street "preflop" started. (community card = [])
"NitWinWin" declared "fold:0"
"Jinkun" declared "fold:10"
"YueShi" declared "fold:0"
"JoyoPlayer" declared "fold:0"
"ZifengFoldMan" declared "fold:0"
"KLChen2PokerPlayer" declared "raise:27"
"ZPlayer" declared "call:27"
Street "flop" started. (community card = ['H3', 'H9', 'H4'])
"KLChen2PokerPlayer" declared "raise:27"
"ZPlayer" declared "fold:0"
"['KLChen2PokerPlayer']" won the round 48 (stack = {'ZPlayer': 2219, 'NitWinWin': 920, 'Jinkun': 1041, 'YueShi': 895, 'JoyoPlayer': 1429, 'ZifengFoldMan': 895, 'EvanPlayer': 0, 'KLChen2PokerPlayer': 600})
player [ZPlayer] gets hole card ['C6', 'SQ'], current stack 2214
player [NitWinWin] gets hole card ['C5', 'HJ'], current stack 910
player [Jinkun] gets hole card ['SJ', 'DJ'], current stack 1041
player [YueShi] gets hole card ['DQ', 'D8'], current stack 895
player [JoyoPlayer] gets hole card ['HT', 'C2'], current stack 1429
player [ZifengFoldMan] gets hole card ['D5', 'DT'], current stack 895
player [KLChen2PokerPlayer] gets hole card ['H6', 'H4'], current stack 600
Started the round 49
Street "preflop" started. (community card = [])
"Jinkun" declared "fold:10"
"YueShi" declared "fold:0"
"JoyoPlayer" declared "fold:0"
"ZifengFoldMan" declared "fold:0"
"KLChen2PokerPlayer" declared "call:10"
"ZPlayer" declared "raise:15"
"NitWinWin" declared "fold:0"
"KLChen2PokerPlayer" declared "fold:0"
"['ZPlayer']" won the round 49 (stack = {'ZPlayer': 2239, 'NitWinWin': 910, 'Jinkun': 1041, 'YueShi': 895, 'JoyoPlayer': 1429, 'ZifengFoldMan': 895, 'EvanPlayer': 0, 'KLChen2PokerPlayer': 590})
player [ZPlayer] gets hole card ['DT', 'S9'], current stack 2239
player [NitWinWin] gets hole card ['DJ', 'H3'], current stack 905
player [Jinkun] gets hole card ['D8', 'C7'], current stack 1031
player [YueShi] gets hole card ['C5', 'SJ'], current stack 895
player [JoyoPlayer] gets hole card ['CK', 'SK'], current stack 1429
player [ZifengFoldMan] gets hole card ['D7', 'CJ'], current stack 895
player [KLChen2PokerPlayer] gets hole card ['D2', 'S6'], current stack 590
Started the round 50
Street "preflop" started. (community card = [])
"YueShi" declared "fold:0"
"JoyoPlayer" declared "raise:15"
"ZifengFoldMan" declared "fold:0"
"KLChen2PokerPlayer" declared "fold:0"
"ZPlayer" declared "raise:20"
"NitWinWin" declared "fold:0"
"Jinkun" declared "fold:20"
"JoyoPlayer" declared "raise:50"
"ZPlayer" declared "call:50"
Street "flop" started. (community card = ['HJ', 'S4', 'D3'])
"JoyoPlayer" declared "raise:1055"
"ZPlayer" declared "fold:0"
"['JoyoPlayer']" won the round 50 (stack = {'ZPlayer': 2189, 'NitWinWin': 905, 'Jinkun': 1031, 'YueShi': 895, 'JoyoPlayer': 1494, 'ZifengFoldMan': 895, 'EvanPlayer': 0, 'KLChen2PokerPlayer': 590})

Game Results:
------------------------------------------------------------
Game 1:
Winner: ZPlayer (stack: 2189)
All players' stacks:
  ZPlayer: 2189
  NitWinWin: 905
  Jinkun: 1031
  YueShi: 895
  JoyoPlayer: 1494
  ZifengFoldMan: 895
  EvanPlayer: 0
  KLChen2PokerPlayer: 590
------------------------------------------------------------
