player [ZPlayer] gets hole card ['D6', 'H4'], current stack 1000
player [NitWinWin] gets hole card ['D9', 'C4'], current stack 995
player [Jinkun] gets hole card ['DT', 'CT'], current stack 990
player [YueShi] gets hole card ['S7', 'C9'], current stack 1000
player [JoyoPlayer] gets hole card ['DA', 'S5'], current stack 1000
player [ZifengFoldMan] gets hole card ['H6', 'DQ'], current stack 1000
player [EvanPlayer] gets hole card ['H3', 'HQ'], current stack 1000
player [KLChen2PokerPlayer] gets hole card ['D5', 'HJ'], current stack 1000
Started the round 1
Street "preflop" started. (community card = [])
"YueShi" declared "fold:0"
"JoyoPlayer" declared "raise:15"
"ZifengFoldMan" declared "fold:0"
"EvanPlayer" declared "raise:1000"
"KLChen2PokerPlayer" declared "fold:0"
"ZPlayer" declared "fold:0"
"NitWinWin" declared "fold:0"
"Jinkun" declared "fold:1000"
"JoyoPlayer" declared "call:1000"
Street "flop" started. (community card = ['D7', 'CQ', 'D4'])
Street "turn" started. (community card = ['D7', 'CQ', 'D4', 'CK'])
Street "river" started. (community card = ['D7', 'CQ', 'D4', 'CK', 'SA'])
"['JoyoPlayer']" won the round 1 (stack = {'ZPlayer': 1000, 'NitWinWin': 995, 'Jinkun': 990, 'YueShi': 1000, 'JoyoPlayer': 2015, 'ZifengFoldMan': 1000, 'EvanPlayer': 0, 'KLChen2PokerPlayer': 1000})
player [ZPlayer] gets hole card ['DA', 'HT'], current stack 1000
player [NitWinWin] gets hole card ['HK', 'CA'], current stack 995
player [Jinkun] gets hole card ['D7', 'S5'], current stack 985
player [YueShi] gets hole card ['S3', 'DT'], current stack 990
player [JoyoPlayer] gets hole card ['S4', 'C4'], current stack 2015
player [ZifengFoldMan] gets hole card ['CJ', 'CQ'], current stack 1000
player [KLChen2PokerPlayer] gets hole card ['H2', 'SJ'], current stack 1000
Started the round 2
Street "preflop" started. (community card = [])
"JoyoPlayer" declared "fold:0"
"ZifengFoldMan" declared "fold:0"
"KLChen2PokerPlayer" declared "call:10"
"ZPlayer" declared "raise:15"
"NitWinWin" declared "fold:0"
"Jinkun" declared "fold:15"
"YueShi" declared "fold:0"
"KLChen2PokerPlayer" declared "fold:0"
"['ZPlayer']" won the round 2 (stack = {'ZPlayer': 1025, 'NitWinWin': 995, 'Jinkun': 985, 'YueShi': 990, 'JoyoPlayer': 2015, 'ZifengFoldMan': 1000, 'EvanPlayer': 0, 'KLChen2PokerPlayer': 990})
player [ZPlayer] gets hole card ['HQ', 'H6'], current stack 1025
player [NitWinWin] gets hole card ['S3', 'C4'], current stack 995
player [Jinkun] gets hole card ['HA', 'C6'], current stack 985
player [YueShi] gets hole card ['HK', 'D5'], current stack 985
player [JoyoPlayer] gets hole card ['D3', 'DK'], current stack 2005
player [ZifengFoldMan] gets hole card ['DT', 'CK'], current stack 1000
player [KLChen2PokerPlayer] gets hole card ['H4', 'S4'], current stack 990
Started the round 3
Street "preflop" started. (community card = [])
"ZifengFoldMan" declared "fold:0"
"KLChen2PokerPlayer" declared "raise:16"
"ZPlayer" declared "call:16"
"NitWinWin" declared "fold:0"
"Jinkun" declared "fold:16"
"YueShi" declared "fold:0"
"JoyoPlayer" declared "fold:0"
Street "flop" started. (community card = ['D9', 'H3', 'CA'])
"KLChen2PokerPlayer" declared "raise:10"
"ZPlayer" declared "fold:0"
"['KLChen2PokerPlayer']" won the round 3 (stack = {'ZPlayer': 1009, 'NitWinWin': 995, 'Jinkun': 985, 'YueShi': 985, 'JoyoPlayer': 2005, 'ZifengFoldMan': 1000, 'EvanPlayer': 0, 'KLChen2PokerPlayer': 1021})
player [ZPlayer] gets hole card ['S9', 'S6'], current stack 1009
player [NitWinWin] gets hole card ['ST', 'SQ'], current stack 995
player [Jinkun] gets hole card ['H6', 'HJ'], current stack 985
player [YueShi] gets hole card ['H9', 'S8'], current stack 985
player [JoyoPlayer] gets hole card ['D2', 'CT'], current stack 2000
player [ZifengFoldMan] gets hole card ['H7', 'C2'], current stack 990
player [KLChen2PokerPlayer] gets hole card ['SJ', 'CK'], current stack 1021
Started the round 4
Street "preflop" started. (community card = [])
"KLChen2PokerPlayer" declared "raise:25"
"ZPlayer" declared "call:25"
"NitWinWin" declared "fold:0"
"Jinkun" declared "fold:25"
"YueShi" declared "fold:0"
"JoyoPlayer" declared "raise:40"
"ZifengFoldMan" declared "fold:0"
"KLChen2PokerPlayer" declared "call:40"
"ZPlayer" declared "call:40"
Street "flop" started. (community card = ['C5', 'S4', 'HQ'])
"JoyoPlayer" declared "raise:10"
"KLChen2PokerPlayer" declared "fold:0"
"ZPlayer" declared "fold:0"
"['JoyoPlayer']" won the round 4 (stack = {'ZPlayer': 969, 'NitWinWin': 995, 'Jinkun': 985, 'YueShi': 985, 'JoyoPlayer': 2095, 'ZifengFoldMan': 990, 'EvanPlayer': 0, 'KLChen2PokerPlayer': 981})
player [ZPlayer] gets hole card ['H5', 'C3'], current stack 969
player [NitWinWin] gets hole card ['D5', 'C2'], current stack 995
player [Jinkun] gets hole card ['HA', 'SA'], current stack 985
player [YueShi] gets hole card ['D7', 'H3'], current stack 985
player [JoyoPlayer] gets hole card ['HJ', 'SQ'], current stack 2095
player [ZifengFoldMan] gets hole card ['HK', 'DJ'], current stack 985
player [KLChen2PokerPlayer] gets hole card ['D4', 'DQ'], current stack 971
Started the round 5
Street "preflop" started. (community card = [])
"ZPlayer" declared "call:10"
"NitWinWin" declared "fold:0"
"Jinkun" declared "call:10"
"YueShi" declared "fold:0"
"JoyoPlayer" declared "fold:0"
"ZifengFoldMan" declared "fold:0"
"KLChen2PokerPlayer" declared "call:10"
Street "flop" started. (community card = ['S8', 'D3', 'S6'])
"KLChen2PokerPlayer" declared "call:0"
"ZPlayer" declared "raise:10"
"Jinkun" declared "call:10"
"KLChen2PokerPlayer" declared "fold:0"
Street "turn" started. (community card = ['S8', 'D3', 'S6', 'DK'])
"ZPlayer" declared "call:0"
"Jinkun" declared "raise:24"
"ZPlayer" declared "fold:0"
"['Jinkun']" won the round 5 (stack = {'ZPlayer': 949, 'NitWinWin': 995, 'Jinkun': 1020, 'YueShi': 985, 'JoyoPlayer': 2095, 'ZifengFoldMan': 985, 'EvanPlayer': 0, 'KLChen2PokerPlayer': 971})
player [ZPlayer] gets hole card ['DT', 'S2'], current stack 939
player [NitWinWin] gets hole card ['HA', 'CT'], current stack 995
player [Jinkun] gets hole card ['C7', 'S8'], current stack 1020
player [YueShi] gets hole card ['S3', 'S6'], current stack 985
player [JoyoPlayer] gets hole card ['S7', 'D3'], current stack 2095
player [ZifengFoldMan] gets hole card ['H8', 'HJ'], current stack 985
player [KLChen2PokerPlayer] gets hole card ['SK', 'H9'], current stack 966
Started the round 6
Street "preflop" started. (community card = [])
"NitWinWin" declared "fold:0"
"Jinkun" declared "fold:10"
"YueShi" declared "fold:0"
"JoyoPlayer" declared "fold:0"
"ZifengFoldMan" declared "fold:0"
"KLChen2PokerPlayer" declared "raise:15"
"ZPlayer" declared "call:15"
Street "flop" started. (community card = ['D9', 'SQ', 'H3'])
"KLChen2PokerPlayer" declared "raise:36"
"ZPlayer" declared "fold:0"
"['KLChen2PokerPlayer']" won the round 6 (stack = {'ZPlayer': 934, 'NitWinWin': 995, 'Jinkun': 1020, 'YueShi': 985, 'JoyoPlayer': 2095, 'ZifengFoldMan': 985, 'EvanPlayer': 0, 'KLChen2PokerPlayer': 986})
player [ZPlayer] gets hole card ['SQ', 'S9'], current stack 929
player [NitWinWin] gets hole card ['C7', 'HJ'], current stack 985
player [Jinkun] gets hole card ['D4', 'CK'], current stack 1020
player [YueShi] gets hole card ['C9', 'D9'], current stack 985
player [JoyoPlayer] gets hole card ['DA', 'SJ'], current stack 2095
player [ZifengFoldMan] gets hole card ['CA', 'D2'], current stack 985
player [KLChen2PokerPlayer] gets hole card ['S4', 'S5'], current stack 986
Started the round 7
Street "preflop" started. (community card = [])
"Jinkun" declared "fold:10"
"YueShi" declared "fold:0"
"JoyoPlayer" declared "fold:0"
"ZifengFoldMan" declared "fold:0"
"KLChen2PokerPlayer" declared "call:10"
"ZPlayer" declared "raise:15"
"NitWinWin" declared "fold:0"
"KLChen2PokerPlayer" declared "fold:0"
"['ZPlayer']" won the round 7 (stack = {'ZPlayer': 954, 'NitWinWin': 985, 'Jinkun': 1020, 'YueShi': 985, 'JoyoPlayer': 2095, 'ZifengFoldMan': 985, 'EvanPlayer': 0, 'KLChen2PokerPlayer': 976})
player [ZPlayer] gets hole card ['HJ', 'S5'], current stack 954
player [NitWinWin] gets hole card ['C3', 'D5'], current stack 980
player [Jinkun] gets hole card ['S8', 'C7'], current stack 1010
player [YueShi] gets hole card ['D6', 'S4'], current stack 985
player [JoyoPlayer] gets hole card ['C5', 'DK'], current stack 2095
player [ZifengFoldMan] gets hole card ['HT', 'HA'], current stack 985
player [KLChen2PokerPlayer] gets hole card ['DJ', 'SQ'], current stack 976
Started the round 8
Street "preflop" started. (community card = [])
"YueShi" declared "fold:0"
"JoyoPlayer" declared "raise:15"
"ZifengFoldMan" declared "fold:0"
"KLChen2PokerPlayer" declared "raise:23"
"ZPlayer" declared "call:23"
"NitWinWin" declared "fold:0"
"Jinkun" declared "fold:23"
"JoyoPlayer" declared "raise:31"
"KLChen2PokerPlayer" declared "fold:0"
"ZPlayer" declared "fold:0"
"['JoyoPlayer']" won the round 8 (stack = {'ZPlayer': 931, 'NitWinWin': 980, 'Jinkun': 1010, 'YueShi': 985, 'JoyoPlayer': 2156, 'ZifengFoldMan': 985, 'EvanPlayer': 0, 'KLChen2PokerPlayer': 953})
player [ZPlayer] gets hole card ['DT', 'C2'], current stack 931
player [NitWinWin] gets hole card ['C9', 'C4'], current stack 980
player [Jinkun] gets hole card ['D3', 'D9'], current stack 1005
player [YueShi] gets hole card ['DA', 'D7'], current stack 975
player [JoyoPlayer] gets hole card ['D5', 'ST'], current stack 2156
player [ZifengFoldMan] gets hole card ['C5', 'H5'], current stack 985
player [KLChen2PokerPlayer] gets hole card ['S7', 'SA'], current stack 953
Started the round 9
Street "preflop" started. (community card = [])
"JoyoPlayer" declared "fold:0"
"ZifengFoldMan" declared "fold:0"
"KLChen2PokerPlayer" declared "raise:19"
"ZPlayer" declared "call:19"
"NitWinWin" declared "fold:0"
"Jinkun" declared "fold:19"
"YueShi" declared "fold:0"
Street "flop" started. (community card = ['H9', 'H2', 'S8'])
"KLChen2PokerPlayer" declared "raise:19"
"ZPlayer" declared "fold:0"
"['KLChen2PokerPlayer']" won the round 9 (stack = {'ZPlayer': 912, 'NitWinWin': 980, 'Jinkun': 1005, 'YueShi': 975, 'JoyoPlayer': 2156, 'ZifengFoldMan': 985, 'EvanPlayer': 0, 'KLChen2PokerPlayer': 987})
player [ZPlayer] gets hole card ['DK', 'D2'], current stack 912
player [NitWinWin] gets hole card ['H2', 'HJ'], current stack 980
player [Jinkun] gets hole card ['S8', 'DA'], current stack 1005
player [YueShi] gets hole card ['C3', 'C9'], current stack 970
player [JoyoPlayer] gets hole card ['C7', 'D4'], current stack 2146
player [ZifengFoldMan] gets hole card ['ST', 'D6'], current stack 985
player [KLChen2PokerPlayer] gets hole card ['D3', 'C4'], current stack 987
Started the round 10
Street "preflop" started. (community card = [])
"ZifengFoldMan" declared "fold:0"
"KLChen2PokerPlayer" declared "call:10"
"ZPlayer" declared "call:10"
"NitWinWin" declared "fold:0"
"Jinkun" declared "fold:10"
"YueShi" declared "fold:0"
"JoyoPlayer" declared "fold:0"
Street "flop" started. (community card = ['CJ', 'H9', 'DJ'])
"KLChen2PokerPlayer" declared "call:0"
"ZPlayer" declared "raise:10"
"KLChen2PokerPlayer" declared "fold:0"
"['ZPlayer']" won the round 10 (stack = {'ZPlayer': 937, 'NitWinWin': 980, 'Jinkun': 1005, 'YueShi': 970, 'JoyoPlayer': 2146, 'ZifengFoldMan': 985, 'EvanPlayer': 0, 'KLChen2PokerPlayer': 977})
player [ZPlayer] gets hole card ['C4', 'S2'], current stack 937
player [NitWinWin] gets hole card ['S4', 'DT'], current stack 980
player [Jinkun] gets hole card ['CJ', 'DJ'], current stack 1005
player [YueShi] gets hole card ['SK', 'S6'], current stack 970
player [JoyoPlayer] gets hole card ['DA', 'S9'], current stack 2141
player [ZifengFoldMan] gets hole card ['S7', 'D7'], current stack 975
player [KLChen2PokerPlayer] gets hole card ['C2', 'CT'], current stack 977
Started the round 11
Street "preflop" started. (community card = [])
"KLChen2PokerPlayer" declared "call:10"
"ZPlayer" declared "call:10"
"NitWinWin" declared "fold:0"
"Jinkun" declared "call:10"
"YueShi" declared "fold:0"
"JoyoPlayer" declared "fold:0"
"ZifengFoldMan" declared "fold:0"
Street "flop" started. (community card = ['SQ', 'D8', 'D9'])
"KLChen2PokerPlayer" declared "call:0"
"ZPlayer" declared "call:0"
"Jinkun" declared "call:0"
Street "turn" started. (community card = ['SQ', 'D8', 'D9', 'DK'])
"KLChen2PokerPlayer" declared "call:0"
"ZPlayer" declared "call:0"
"Jinkun" declared "call:0"
Street "river" started. (community card = ['SQ', 'D8', 'D9', 'DK', 'C6'])
"KLChen2PokerPlayer" declared "call:0"
"ZPlayer" declared "call:0"
"Jinkun" declared "call:0"
"['Jinkun']" won the round 11 (stack = {'ZPlayer': 927, 'NitWinWin': 980, 'Jinkun': 1040, 'YueShi': 970, 'JoyoPlayer': 2141, 'ZifengFoldMan': 975, 'EvanPlayer': 0, 'KLChen2PokerPlayer': 967})
player [ZPlayer] gets hole card ['SA', 'S4'], current stack 927
player [NitWinWin] gets hole card ['HQ', 'DK'], current stack 980
player [Jinkun] gets hole card ['CK', 'SJ'], current stack 1040
player [YueShi] gets hole card ['H8', 'HT'], current stack 970
player [JoyoPlayer] gets hole card ['C2', 'DQ'], current stack 2141
player [ZifengFoldMan] gets hole card ['SQ', 'H5'], current stack 970
player [KLChen2PokerPlayer] gets hole card ['D2', 'CJ'], current stack 957
Started the round 12
Street "preflop" started. (community card = [])
"ZPlayer" declared "raise:15"
"NitWinWin" declared "fold:0"
"Jinkun" declared "fold:15"
"YueShi" declared "fold:0"
"JoyoPlayer" declared "raise:20"
"ZifengFoldMan" declared "fold:0"
"KLChen2PokerPlayer" declared "fold:0"
"ZPlayer" declared "call:20"
Street "flop" started. (community card = ['S8', 'DT', 'C5'])
"ZPlayer" declared "call:0"
"JoyoPlayer" declared "raise:10"
"ZPlayer" declared "fold:0"
"['JoyoPlayer']" won the round 12 (stack = {'ZPlayer': 907, 'NitWinWin': 980, 'Jinkun': 1040, 'YueShi': 970, 'JoyoPlayer': 2176, 'ZifengFoldMan': 970, 'EvanPlayer': 0, 'KLChen2PokerPlayer': 957})
player [ZPlayer] gets hole card ['D3', 'ST'], current stack 897
player [NitWinWin] gets hole card ['C5', 'H4'], current stack 980
player [Jinkun] gets hole card ['S7', 'CQ'], current stack 1040
player [YueShi] gets hole card ['H6', 'D5'], current stack 970
player [JoyoPlayer] gets hole card ['S3', 'DT'], current stack 2176
player [ZifengFoldMan] gets hole card ['C2', 'H9'], current stack 970
player [KLChen2PokerPlayer] gets hole card ['CA', 'S5'], current stack 952
Started the round 13
Street "preflop" started. (community card = [])
"NitWinWin" declared "fold:0"
"Jinkun" declared "fold:10"
"YueShi" declared "fold:0"
"JoyoPlayer" declared "fold:0"
"ZifengFoldMan" declared "fold:0"
"KLChen2PokerPlayer" declared "raise:15"
"ZPlayer" declared "call:15"
Street "flop" started. (community card = ['C3', 'H3', 'DA'])
"KLChen2PokerPlayer" declared "raise:23"
"ZPlayer" declared "raise:53"
"KLChen2PokerPlayer" declared "call:53"
Street "turn" started. (community card = ['C3', 'H3', 'DA', 'CT'])
"KLChen2PokerPlayer" declared "raise:429"
"ZPlayer" declared "call:429"
Street "river" started. (community card = ['C3', 'H3', 'DA', 'CT', 'C8'])
"KLChen2PokerPlayer" declared "raise:78"
"ZPlayer" declared "raise:210"
"KLChen2PokerPlayer" declared "fold:0"
"['ZPlayer']" won the round 13 (stack = {'ZPlayer': 1482, 'NitWinWin': 980, 'Jinkun': 1040, 'YueShi': 970, 'JoyoPlayer': 2176, 'ZifengFoldMan': 970, 'EvanPlayer': 0, 'KLChen2PokerPlayer': 382})
player [ZPlayer] gets hole card ['S9', 'C8'], current stack 1477
player [NitWinWin] gets hole card ['HT', 'H6'], current stack 970
player [Jinkun] gets hole card ['C9', 'DQ'], current stack 1040
player [YueShi] gets hole card ['DA', 'HK'], current stack 970
player [JoyoPlayer] gets hole card ['D2', 'CJ'], current stack 2176
player [ZifengFoldMan] gets hole card ['DJ', 'CT'], current stack 970
player [KLChen2PokerPlayer] gets hole card ['S2', 'D3'], current stack 382
Started the round 14
Street "preflop" started. (community card = [])
"Jinkun" declared "fold:10"
"YueShi" declared "fold:0"
"JoyoPlayer" declared "raise:15"
"ZifengFoldMan" declared "fold:0"
"KLChen2PokerPlayer" declared "fold:0"
"ZPlayer" declared "fold:0"
"NitWinWin" declared "fold:0"
"['JoyoPlayer']" won the round 14 (stack = {'ZPlayer': 1477, 'NitWinWin': 970, 'Jinkun': 1040, 'YueShi': 970, 'JoyoPlayer': 2191, 'ZifengFoldMan': 970, 'EvanPlayer': 0, 'KLChen2PokerPlayer': 382})
player [ZPlayer] gets hole card ['SQ', 'C5'], current stack 1477
player [NitWinWin] gets hole card ['C7', 'H5'], current stack 965
player [Jinkun] gets hole card ['CA', 'DJ'], current stack 1030
player [YueShi] gets hole card ['H2', 'H6'], current stack 970
player [JoyoPlayer] gets hole card ['CT', 'C4'], current stack 2191
player [ZifengFoldMan] gets hole card ['HT', 'D9'], current stack 970
player [KLChen2PokerPlayer] gets hole card ['C9', 'C6'], current stack 382
Started the round 15
Street "preflop" started. (community card = [])
"YueShi" declared "fold:0"
"JoyoPlayer" declared "raise:15"
"ZifengFoldMan" declared "fold:0"
"KLChen2PokerPlayer" declared "fold:0"
"ZPlayer" declared "call:15"
"NitWinWin" declared "fold:0"
"Jinkun" declared "call:15"
Street "flop" started. (community card = ['D2', 'DA', 'HQ'])
"Jinkun" declared "call:0"
"JoyoPlayer" declared "fold:0"
"ZPlayer" declared "raise:10"
"Jinkun" declared "raise:26"
"ZPlayer" declared "call:26"
Street "turn" started. (community card = ['D2', 'DA', 'HQ', 'S5'])
"Jinkun" declared "raise:43"
"ZPlayer" declared "call:43"
Street "river" started. (community card = ['D2', 'DA', 'HQ', 'S5', 'D4'])
"Jinkun" declared "call:0"
"ZPlayer" declared "raise:10"
"Jinkun" declared "call:10"
"['ZPlayer']" won the round 15 (stack = {'ZPlayer': 1591, 'NitWinWin': 965, 'Jinkun': 946, 'YueShi': 970, 'JoyoPlayer': 2176, 'ZifengFoldMan': 970, 'EvanPlayer': 0, 'KLChen2PokerPlayer': 382})
player [ZPlayer] gets hole card ['DA', 'C2'], current stack 1591
player [NitWinWin] gets hole card ['CT', 'SJ'], current stack 965
player [Jinkun] gets hole card ['SK', 'HT'], current stack 941
player [YueShi] gets hole card ['S9', 'SQ'], current stack 960
player [JoyoPlayer] gets hole card ['HK', 'D8'], current stack 2176
player [ZifengFoldMan] gets hole card ['D9', 'H7'], current stack 970
player [KLChen2PokerPlayer] gets hole card ['H3', 'C5'], current stack 382
Started the round 16
Street "preflop" started. (community card = [])
"JoyoPlayer" declared "fold:0"
"ZifengFoldMan" declared "fold:0"
"KLChen2PokerPlayer" declared "fold:0"
"ZPlayer" declared "raise:15"
"NitWinWin" declared "fold:0"
"Jinkun" declared "fold:15"
"YueShi" declared "fold:0"
"['ZPlayer']" won the round 16 (stack = {'ZPlayer': 1606, 'NitWinWin': 965, 'Jinkun': 941, 'YueShi': 960, 'JoyoPlayer': 2176, 'ZifengFoldMan': 970, 'EvanPlayer': 0, 'KLChen2PokerPlayer': 382})
player [ZPlayer] gets hole card ['H9', 'DA'], current stack 1606
player [NitWinWin] gets hole card ['C2', 'C5'], current stack 965
player [Jinkun] gets hole card ['H6', 'CT'], current stack 941
player [YueShi] gets hole card ['DT', 'S2'], current stack 955
player [JoyoPlayer] gets hole card ['DK', 'DJ'], current stack 2166
player [ZifengFoldMan] gets hole card ['HQ', 'S4'], current stack 970
player [KLChen2PokerPlayer] gets hole card ['S8', 'S5'], current stack 382
Started the round 17
Street "preflop" started. (community card = [])
"ZifengFoldMan" declared "fold:0"
"KLChen2PokerPlayer" declared "raise:15"
"ZPlayer" declared "raise:20"
"NitWinWin" declared "fold:0"
"Jinkun" declared "fold:20"
"YueShi" declared "fold:0"
"JoyoPlayer" declared "fold:0"
"KLChen2PokerPlayer" declared "call:20"
Street "flop" started. (community card = ['H8', 'D5', 'H3'])
"KLChen2PokerPlayer" declared "raise:34"
"ZPlayer" declared "fold:0"
"['KLChen2PokerPlayer']" won the round 17 (stack = {'ZPlayer': 1586, 'NitWinWin': 965, 'Jinkun': 941, 'YueShi': 955, 'JoyoPlayer': 2166, 'ZifengFoldMan': 970, 'EvanPlayer': 0, 'KLChen2PokerPlayer': 417})
player [ZPlayer] gets hole card ['H3', 'C5'], current stack 1586
player [NitWinWin] gets hole card ['CT', 'D5'], current stack 965
player [Jinkun] gets hole card ['H4', 'D2'], current stack 941
player [YueShi] gets hole card ['HJ', 'D8'], current stack 955
player [JoyoPlayer] gets hole card ['C3', 'DK'], current stack 2161
player [ZifengFoldMan] gets hole card ['HQ', 'S4'], current stack 960
player [KLChen2PokerPlayer] gets hole card ['C9', 'CA'], current stack 417
Started the round 18
Street "preflop" started. (community card = [])
"KLChen2PokerPlayer" declared "raise:22"
"ZPlayer" declared "raise:34"
"NitWinWin" declared "fold:0"
"Jinkun" declared "fold:34"
"YueShi" declared "fold:0"
"JoyoPlayer" declared "raise:46"
"ZifengFoldMan" declared "fold:0"
"KLChen2PokerPlayer" declared "fold:0"
"ZPlayer" declared "fold:0"
"['JoyoPlayer']" won the round 18 (stack = {'ZPlayer': 1552, 'NitWinWin': 965, 'Jinkun': 941, 'YueShi': 955, 'JoyoPlayer': 2232, 'ZifengFoldMan': 960, 'EvanPlayer': 0, 'KLChen2PokerPlayer': 395})
player [ZPlayer] gets hole card ['C4', 'H5'], current stack 1552
player [NitWinWin] gets hole card ['S3', 'S6'], current stack 965
player [Jinkun] gets hole card ['HQ', 'CK'], current stack 941
player [YueShi] gets hole card ['H9', 'DQ'], current stack 955
player [JoyoPlayer] gets hole card ['C9', 'H4'], current stack 2232
player [ZifengFoldMan] gets hole card ['HJ', 'H6'], current stack 955
player [KLChen2PokerPlayer] gets hole card ['CT', 'D3'], current stack 385
Started the round 19
Street "preflop" started. (community card = [])
"ZPlayer" declared "raise:15"
"NitWinWin" declared "fold:0"
"Jinkun" declared "fold:15"
"YueShi" declared "fold:0"
"JoyoPlayer" declared "fold:0"
"ZifengFoldMan" declared "fold:0"
"KLChen2PokerPlayer" declared "fold:0"
"['ZPlayer']" won the round 19 (stack = {'ZPlayer': 1567, 'NitWinWin': 965, 'Jinkun': 941, 'YueShi': 955, 'JoyoPlayer': 2232, 'ZifengFoldMan': 955, 'EvanPlayer': 0, 'KLChen2PokerPlayer': 385})
player [ZPlayer] gets hole card ['S9', 'CK'], current stack 1557
player [NitWinWin] gets hole card ['SQ', 'D5'], current stack 965
player [Jinkun] gets hole card ['H4', 'ST'], current stack 941
player [YueShi] gets hole card ['DQ', 'C8'], current stack 955
player [JoyoPlayer] gets hole card ['C7', 'C5'], current stack 2232
player [ZifengFoldMan] gets hole card ['CT', 'S7'], current stack 955
player [KLChen2PokerPlayer] gets hole card ['CA', 'H3'], current stack 380
Started the round 20
Street "preflop" started. (community card = [])
"NitWinWin" declared "fold:0"
"Jinkun" declared "fold:10"
"YueShi" declared "fold:0"
"JoyoPlayer" declared "fold:0"
"ZifengFoldMan" declared "fold:0"
"KLChen2PokerPlayer" declared "raise:28"
"ZPlayer" declared "call:28"
Street "flop" started. (community card = ['H2', 'H9', 'D7'])
"KLChen2PokerPlayer" declared "call:0"
"ZPlayer" declared "raise:10"
"KLChen2PokerPlayer" declared "fold:0"
"['ZPlayer']" won the round 20 (stack = {'ZPlayer': 1595, 'NitWinWin': 965, 'Jinkun': 941, 'YueShi': 955, 'JoyoPlayer': 2232, 'ZifengFoldMan': 955, 'EvanPlayer': 0, 'KLChen2PokerPlayer': 357})
player [ZPlayer] gets hole card ['D8', 'C3'], current stack 1590
player [NitWinWin] gets hole card ['CQ', 'D5'], current stack 955
player [Jinkun] gets hole card ['S6', 'H8'], current stack 941
player [YueShi] gets hole card ['H2', 'S9'], current stack 955
player [JoyoPlayer] gets hole card ['C5', 'C2'], current stack 2232
player [ZifengFoldMan] gets hole card ['C9', 'DA'], current stack 955
player [KLChen2PokerPlayer] gets hole card ['D3', 'H9'], current stack 357
Started the round 21
Street "preflop" started. (community card = [])
"Jinkun" declared "fold:10"
"YueShi" declared "fold:0"
"JoyoPlayer" declared "fold:0"
"ZifengFoldMan" declared "fold:0"
"KLChen2PokerPlayer" declared "raise:15"
"ZPlayer" declared "fold:0"
"NitWinWin" declared "fold:0"
"['KLChen2PokerPlayer']" won the round 21 (stack = {'ZPlayer': 1590, 'NitWinWin': 955, 'Jinkun': 941, 'YueShi': 955, 'JoyoPlayer': 2232, 'ZifengFoldMan': 955, 'EvanPlayer': 0, 'KLChen2PokerPlayer': 372})
player [ZPlayer] gets hole card ['C9', 'C4'], current stack 1590
player [NitWinWin] gets hole card ['S2', 'C5'], current stack 950
player [Jinkun] gets hole card ['ST', 'C7'], current stack 931
player [YueShi] gets hole card ['SJ', 'DJ'], current stack 955
player [JoyoPlayer] gets hole card ['DA', 'H3'], current stack 2232
player [ZifengFoldMan] gets hole card ['HJ', 'H7'], current stack 955
player [KLChen2PokerPlayer] gets hole card ['S9', 'C3'], current stack 372
Started the round 22
Street "preflop" started. (community card = [])
"YueShi" declared "fold:0"
"JoyoPlayer" declared "fold:0"
"ZifengFoldMan" declared "fold:0"
"KLChen2PokerPlayer" declared "fold:0"
"ZPlayer" declared "raise:15"
"NitWinWin" declared "fold:0"
"Jinkun" declared "fold:15"
"['ZPlayer']" won the round 22 (stack = {'ZPlayer': 1605, 'NitWinWin': 950, 'Jinkun': 931, 'YueShi': 955, 'JoyoPlayer': 2232, 'ZifengFoldMan': 955, 'EvanPlayer': 0, 'KLChen2PokerPlayer': 372})
player [ZPlayer] gets hole card ['C6', 'D2'], current stack 1605
player [NitWinWin] gets hole card ['S8', 'HJ'], current stack 950
player [Jinkun] gets hole card ['HA', 'S9'], current stack 926
player [YueShi] gets hole card ['CK', 'S3'], current stack 945
player [JoyoPlayer] gets hole card ['S4', 'HT'], current stack 2232
player [ZifengFoldMan] gets hole card ['S6', 'D7'], current stack 955
player [KLChen2PokerPlayer] gets hole card ['HK', 'SJ'], current stack 372
Started the round 23
Street "preflop" started. (community card = [])
"JoyoPlayer" declared "fold:0"
"ZifengFoldMan" declared "fold:0"
"KLChen2PokerPlayer" declared "raise:29"
"ZPlayer" declared "raise:48"
"NitWinWin" declared "fold:0"
"Jinkun" declared "fold:48"
"YueShi" declared "fold:0"
"KLChen2PokerPlayer" declared "fold:0"
"['ZPlayer']" won the round 23 (stack = {'ZPlayer': 1649, 'NitWinWin': 950, 'Jinkun': 926, 'YueShi': 945, 'JoyoPlayer': 2232, 'ZifengFoldMan': 955, 'EvanPlayer': 0, 'KLChen2PokerPlayer': 343})
player [ZPlayer] gets hole card ['H7', 'HA'], current stack 1649
player [NitWinWin] gets hole card ['H8', 'D6'], current stack 950
player [Jinkun] gets hole card ['S2', 'C7'], current stack 926
player [YueShi] gets hole card ['S9', 'S4'], current stack 940
player [JoyoPlayer] gets hole card ['DQ', 'HQ'], current stack 2222
player [ZifengFoldMan] gets hole card ['DJ', 'S5'], current stack 955
player [KLChen2PokerPlayer] gets hole card ['CQ', 'D7'], current stack 343
Started the round 24
Street "preflop" started. (community card = [])
"ZifengFoldMan" declared "fold:0"
"KLChen2PokerPlayer" declared "raise:15"
"ZPlayer" declared "raise:20"
"NitWinWin" declared "fold:0"
"Jinkun" declared "fold:20"
"YueShi" declared "fold:0"
"JoyoPlayer" declared "raise:25"
"KLChen2PokerPlayer" declared "fold:0"
"ZPlayer" declared "call:25"
Street "flop" started. (community card = ['H2', 'ST', 'CJ'])
"JoyoPlayer" declared "raise:2189"
"ZPlayer" declared "fold:0"
"['JoyoPlayer']" won the round 24 (stack = {'ZPlayer': 1624, 'NitWinWin': 950, 'Jinkun': 926, 'YueShi': 940, 'JoyoPlayer': 2277, 'ZifengFoldMan': 955, 'EvanPlayer': 0, 'KLChen2PokerPlayer': 328})
player [ZPlayer] gets hole card ['H9', 'S7'], current stack 1624
player [NitWinWin] gets hole card ['S8', 'S5'], current stack 950
player [Jinkun] gets hole card ['CQ', 'C8'], current stack 926
player [YueShi] gets hole card ['H6', 'HJ'], current stack 940
player [JoyoPlayer] gets hole card ['CK', 'C5'], current stack 2272
player [ZifengFoldMan] gets hole card ['H7', 'SA'], current stack 945
player [KLChen2PokerPlayer] gets hole card ['S6', 'D4'], current stack 328
Started the round 25
Street "preflop" started. (community card = [])
"KLChen2PokerPlayer" declared "fold:0"
"ZPlayer" declared "raise:15"
"NitWinWin" declared "fold:0"
"Jinkun" declared "fold:15"
"YueShi" declared "fold:0"
"JoyoPlayer" declared "fold:0"
"ZifengFoldMan" declared "fold:0"
"['ZPlayer']" won the round 25 (stack = {'ZPlayer': 1639, 'NitWinWin': 950, 'Jinkun': 926, 'YueShi': 940, 'JoyoPlayer': 2272, 'ZifengFoldMan': 945, 'EvanPlayer': 0, 'KLChen2PokerPlayer': 328})
player [ZPlayer] gets hole card ['D4', 'DA'], current stack 1639
player [NitWinWin] gets hole card ['C8', 'C3'], current stack 950
player [Jinkun] gets hole card ['C5', 'C9'], current stack 926
player [YueShi] gets hole card ['S3', 'D7'], current stack 940
player [JoyoPlayer] gets hole card ['S7', 'DQ'], current stack 2272
player [ZifengFoldMan] gets hole card ['DK', 'S9'], current stack 940
player [KLChen2PokerPlayer] gets hole card ['ST', 'HK'], current stack 318
Started the round 26
Street "preflop" started. (community card = [])
"ZPlayer" declared "raise:15"
"NitWinWin" declared "fold:0"
"Jinkun" declared "fold:15"
"YueShi" declared "fold:0"
"JoyoPlayer" declared "raise:20"
"ZifengFoldMan" declared "fold:0"
"KLChen2PokerPlayer" declared "call:20"
"ZPlayer" declared "call:20"
Street "flop" started. (community card = ['HT', 'S2', 'CT'])
"KLChen2PokerPlayer" declared "raise:20"
"ZPlayer" declared "fold:0"
"JoyoPlayer" declared "raise:40"
"KLChen2PokerPlayer" declared "call:40"
Street "turn" started. (community card = ['HT', 'S2', 'CT', 'C7'])
"KLChen2PokerPlayer" declared "raise:100"
"JoyoPlayer" declared "call:100"
Street "river" started. (community card = ['HT', 'S2', 'CT', 'C7', 'CA'])
"KLChen2PokerPlayer" declared "raise:74"
"JoyoPlayer" declared "raise:296"
"KLChen2PokerPlayer" declared "call:296"
"['KLChen2PokerPlayer']" won the round 26 (stack = {'ZPlayer': 1619, 'NitWinWin': 950, 'Jinkun': 926, 'YueShi': 940, 'JoyoPlayer': 1944, 'ZifengFoldMan': 940, 'EvanPlayer': 0, 'KLChen2PokerPlayer': 681})
player [ZPlayer] gets hole card ['CA', 'S2'], current stack 1609
player [NitWinWin] gets hole card ['SJ', 'S9'], current stack 950
player [Jinkun] gets hole card ['CJ', 'S8'], current stack 926
player [YueShi] gets hole card ['HK', 'DQ'], current stack 940
player [JoyoPlayer] gets hole card ['S6', 'H9'], current stack 1944
player [ZifengFoldMan] gets hole card ['H7', 'H8'], current stack 940
player [KLChen2PokerPlayer] gets hole card ['H5', 'D2'], current stack 676
Started the round 27
Street "preflop" started. (community card = [])
"NitWinWin" declared "fold:0"
"Jinkun" declared "fold:10"
"YueShi" declared "fold:0"
"JoyoPlayer" declared "fold:0"
"ZifengFoldMan" declared "fold:0"
"KLChen2PokerPlayer" declared "fold:0"
"['ZPlayer']" won the round 27 (stack = {'ZPlayer': 1624, 'NitWinWin': 950, 'Jinkun': 926, 'YueShi': 940, 'JoyoPlayer': 1944, 'ZifengFoldMan': 940, 'EvanPlayer': 0, 'KLChen2PokerPlayer': 676})
player [ZPlayer] gets hole card ['C5', 'CA'], current stack 1619
player [NitWinWin] gets hole card ['DK', 'S4'], current stack 940
player [Jinkun] gets hole card ['CJ', 'DJ'], current stack 926
player [YueShi] gets hole card ['DQ', 'SK'], current stack 940
player [JoyoPlayer] gets hole card ['CQ', 'C4'], current stack 1944
player [ZifengFoldMan] gets hole card ['C2', 'D8'], current stack 940
player [KLChen2PokerPlayer] gets hole card ['S2', 'C3'], current stack 676
Started the round 28
Street "preflop" started. (community card = [])
"Jinkun" declared "fold:10"
"YueShi" declared "fold:0"
"JoyoPlayer" declared "fold:0"
"ZifengFoldMan" declared "fold:0"
"KLChen2PokerPlayer" declared "fold:0"
"ZPlayer" declared "raise:15"
"NitWinWin" declared "fold:0"
"['ZPlayer']" won the round 28 (stack = {'ZPlayer': 1634, 'NitWinWin': 940, 'Jinkun': 926, 'YueShi': 940, 'JoyoPlayer': 1944, 'ZifengFoldMan': 940, 'EvanPlayer': 0, 'KLChen2PokerPlayer': 676})
player [ZPlayer] gets hole card ['CK', 'C3'], current stack 1634
player [NitWinWin] gets hole card ['H3', 'SQ'], current stack 935
player [Jinkun] gets hole card ['H8', 'HJ'], current stack 916
player [YueShi] gets hole card ['CA', 'S4'], current stack 940
player [JoyoPlayer] gets hole card ['S8', 'H9'], current stack 1944
player [ZifengFoldMan] gets hole card ['C5', 'C7'], current stack 940
player [KLChen2PokerPlayer] gets hole card ['HT', 'D8'], current stack 676
Started the round 29
Street "preflop" started. (community card = [])
"YueShi" declared "fold:0"
"JoyoPlayer" declared "fold:0"
"ZifengFoldMan" declared "fold:0"
"KLChen2PokerPlayer" declared "raise:20"
"ZPlayer" declared "raise:30"
"NitWinWin" declared "fold:0"
"Jinkun" declared "fold:30"
"KLChen2PokerPlayer" declared "fold:0"
"['ZPlayer']" won the round 29 (stack = {'ZPlayer': 1669, 'NitWinWin': 935, 'Jinkun': 916, 'YueShi': 940, 'JoyoPlayer': 1944, 'ZifengFoldMan': 940, 'EvanPlayer': 0, 'KLChen2PokerPlayer': 656})
player [ZPlayer] gets hole card ['S8', 'ST'], current stack 1669
player [NitWinWin] gets hole card ['S2', 'C9'], current stack 935
player [Jinkun] gets hole card ['DQ', 'C2'], current stack 911
player [YueShi] gets hole card ['C3', 'H6'], current stack 930
player [JoyoPlayer] gets hole card ['SK', 'CT'], current stack 1944
player [ZifengFoldMan] gets hole card ['D6', 'D4'], current stack 940
player [KLChen2PokerPlayer] gets hole card ['S4', 'S5'], current stack 656
Started the round 30
Street "preflop" started. (community card = [])
"JoyoPlayer" declared "raise:15"
"ZifengFoldMan" declared "fold:0"
"KLChen2PokerPlayer" declared "fold:0"
"ZPlayer" declared "raise:20"
"NitWinWin" declared "fold:0"
"Jinkun" declared "fold:20"
"YueShi" declared "fold:0"
"JoyoPlayer" declared "raise:25"
"ZPlayer" declared "call:25"
Street "flop" started. (community card = ['C4', 'D9', 'SQ'])
"JoyoPlayer" declared "call:0"
"ZPlayer" declared "call:0"
Street "turn" started. (community card = ['C4', 'D9', 'SQ', 'S9'])
"JoyoPlayer" declared "call:0"
"ZPlayer" declared "call:0"
Street "river" started. (community card = ['C4', 'D9', 'SQ', 'S9', 'CK'])
"JoyoPlayer" declared "raise:1314"
"ZPlayer" declared "fold:0"
"['JoyoPlayer']" won the round 30 (stack = {'ZPlayer': 1644, 'NitWinWin': 935, 'Jinkun': 911, 'YueShi': 930, 'JoyoPlayer': 1984, 'ZifengFoldMan': 940, 'EvanPlayer': 0, 'KLChen2PokerPlayer': 656})
player [ZPlayer] gets hole card ['H9', 'CT'], current stack 1644
player [NitWinWin] gets hole card ['HQ', 'D9'], current stack 935
player [Jinkun] gets hole card ['DJ', 'CJ'], current stack 911
player [YueShi] gets hole card ['D5', 'H3'], current stack 925
player [JoyoPlayer] gets hole card ['CK', 'CA'], current stack 1974
player [ZifengFoldMan] gets hole card ['DA', 'CQ'], current stack 940
player [KLChen2PokerPlayer] gets hole card ['H7', 'C6'], current stack 656
Started the round 31
Street "preflop" started. (community card = [])
"ZifengFoldMan" declared "fold:0"
"KLChen2PokerPlayer" declared "call:10"
"ZPlayer" declared "raise:15"
"NitWinWin" declared "fold:0"
"Jinkun" declared "call:15"
"YueShi" declared "fold:0"
"JoyoPlayer" declared "fold:0"
"KLChen2PokerPlayer" declared "fold:0"
Street "flop" started. (community card = ['D8', 'H4', 'HK'])
"ZPlayer" declared "call:0"
"Jinkun" declared "call:0"
Street "turn" started. (community card = ['D8', 'H4', 'HK', 'HJ'])
"ZPlayer" declared "call:0"
"Jinkun" declared "raise:24"
"ZPlayer" declared "fold:0"
"['Jinkun']" won the round 31 (stack = {'ZPlayer': 1629, 'NitWinWin': 935, 'Jinkun': 951, 'YueShi': 925, 'JoyoPlayer': 1974, 'ZifengFoldMan': 940, 'EvanPlayer': 0, 'KLChen2PokerPlayer': 646})
player [ZPlayer] gets hole card ['C2', 'S4'], current stack 1629
player [NitWinWin] gets hole card ['H5', 'HJ'], current stack 935
player [Jinkun] gets hole card ['C3', 'H3'], current stack 951
player [YueShi] gets hole card ['DQ', 'SK'], current stack 925
player [JoyoPlayer] gets hole card ['SQ', 'S8'], current stack 1969
player [ZifengFoldMan] gets hole card ['S3', 'C5'], current stack 930
player [KLChen2PokerPlayer] gets hole card ['H6', 'HK'], current stack 646
Started the round 32
Street "preflop" started. (community card = [])
"KLChen2PokerPlayer" declared "raise:19"
"ZPlayer" declared "raise:28"
"NitWinWin" declared "fold:0"
"Jinkun" declared "fold:28"
"YueShi" declared "fold:0"
"JoyoPlayer" declared "fold:0"
"ZifengFoldMan" declared "fold:0"
"KLChen2PokerPlayer" declared "fold:0"
"['ZPlayer']" won the round 32 (stack = {'ZPlayer': 1663, 'NitWinWin': 935, 'Jinkun': 951, 'YueShi': 925, 'JoyoPlayer': 1969, 'ZifengFoldMan': 930, 'EvanPlayer': 0, 'KLChen2PokerPlayer': 627})
player [ZPlayer] gets hole card ['H8', 'DK'], current stack 1663
player [NitWinWin] gets hole card ['D4', 'C9'], current stack 935
player [Jinkun] gets hole card ['HA', 'DJ'], current stack 951
player [YueShi] gets hole card ['D5', 'HQ'], current stack 925
player [JoyoPlayer] gets hole card ['DQ', 'SQ'], current stack 1969
player [ZifengFoldMan] gets hole card ['S5', 'H2'], current stack 925
player [KLChen2PokerPlayer] gets hole card ['H3', 'DA'], current stack 617
Started the round 33
Street "preflop" started. (community card = [])
"ZPlayer" declared "raise:15"
"NitWinWin" declared "fold:0"
"Jinkun" declared "fold:15"
"YueShi" declared "fold:0"
"JoyoPlayer" declared "call:15"
"ZifengFoldMan" declared "fold:0"
"KLChen2PokerPlayer" declared "raise:20"
"ZPlayer" declared "call:20"
"JoyoPlayer" declared "raise:50"
"KLChen2PokerPlayer" declared "fold:0"
"ZPlayer" declared "call:50"
Street "flop" started. (community card = ['S3', 'H6', 'ST'])
"ZPlayer" declared "call:0"
"JoyoPlayer" declared "raise:1464"
"ZPlayer" declared "fold:0"
"['JoyoPlayer']" won the round 33 (stack = {'ZPlayer': 1613, 'NitWinWin': 935, 'Jinkun': 951, 'YueShi': 925, 'JoyoPlayer': 2044, 'ZifengFoldMan': 925, 'EvanPlayer': 0, 'KLChen2PokerPlayer': 607})
player [ZPlayer] gets hole card ['CA', 'C2'], current stack 1603
player [NitWinWin] gets hole card ['DK', 'S7'], current stack 935
player [Jinkun] gets hole card ['ST', 'DT'], current stack 951
player [YueShi] gets hole card ['HQ', 'H4'], current stack 925
player [JoyoPlayer] gets hole card ['S3', 'HA'], current stack 2044
player [ZifengFoldMan] gets hole card ['C3', 'C6'], current stack 925
player [KLChen2PokerPlayer] gets hole card ['DQ', 'H9'], current stack 602
Started the round 34
Street "preflop" started. (community card = [])
"NitWinWin" declared "fold:0"
"Jinkun" declared "fold:10"
"YueShi" declared "fold:0"
"JoyoPlayer" declared "raise:15"
"ZifengFoldMan" declared "fold:0"
"KLChen2PokerPlayer" declared "raise:20"
"ZPlayer" declared "call:20"
"JoyoPlayer" declared "fold:0"
Street "flop" started. (community card = ['C4', 'S6', 'D5'])
"KLChen2PokerPlayer" declared "call:0"
"ZPlayer" declared "call:0"
Street "turn" started. (community card = ['C4', 'S6', 'D5', 'SJ'])
"KLChen2PokerPlayer" declared "call:0"
"ZPlayer" declared "call:0"
Street "river" started. (community card = ['C4', 'S6', 'D5', 'SJ', 'HT'])
"KLChen2PokerPlayer" declared "call:0"
"ZPlayer" declared "call:0"
"['ZPlayer']" won the round 34 (stack = {'ZPlayer': 1648, 'NitWinWin': 935, 'Jinkun': 951, 'YueShi': 925, 'JoyoPlayer': 2029, 'ZifengFoldMan': 925, 'EvanPlayer': 0, 'KLChen2PokerPlayer': 587})
player [ZPlayer] gets hole card ['HQ', 'H7'], current stack 1643
player [NitWinWin] gets hole card ['C2', 'C8'], current stack 925
player [Jinkun] gets hole card ['C5', 'HA'], current stack 951
player [YueShi] gets hole card ['H5', 'H6'], current stack 925
player [JoyoPlayer] gets hole card ['DA', 'CA'], current stack 2029
player [ZifengFoldMan] gets hole card ['D2', 'S5'], current stack 925
player [KLChen2PokerPlayer] gets hole card ['HJ', 'C4'], current stack 587
Started the round 35
Street "preflop" started. (community card = [])
"Jinkun" declared "fold:10"
"YueShi" declared "fold:0"
"JoyoPlayer" declared "call:10"
"ZifengFoldMan" declared "fold:0"
"KLChen2PokerPlayer" declared "fold:0"
"ZPlayer" declared "raise:15"
"NitWinWin" declared "fold:0"
"JoyoPlayer" declared "raise:40"
"ZPlayer" declared "call:40"
Street "flop" started. (community card = ['CQ', 'DK', 'CJ'])
"ZPlayer" declared "raise:10"
"JoyoPlayer" declared "raise:40"
"ZPlayer" declared "call:40"
Street "turn" started. (community card = ['CQ', 'DK', 'CJ', 'D4'])
"ZPlayer" declared "raise:10"
"JoyoPlayer" declared "raise:40"
"ZPlayer" declared "call:40"
Street "river" started. (community card = ['CQ', 'DK', 'CJ', 'D4', 'SQ'])
"ZPlayer" declared "raise:501"
"JoyoPlayer" declared "fold:0"
"['ZPlayer']" won the round 35 (stack = {'ZPlayer': 1778, 'NitWinWin': 925, 'Jinkun': 951, 'YueShi': 925, 'JoyoPlayer': 1909, 'ZifengFoldMan': 925, 'EvanPlayer': 0, 'KLChen2PokerPlayer': 587})
player [ZPlayer] gets hole card ['DQ', 'HT'], current stack 1778
player [NitWinWin] gets hole card ['H2', 'S2'], current stack 920
player [Jinkun] gets hole card ['D5', 'HA'], current stack 941
player [YueShi] gets hole card ['SJ', 'S6'], current stack 925
player [JoyoPlayer] gets hole card ['CJ', 'D2'], current stack 1909
player [ZifengFoldMan] gets hole card ['D8', 'HK'], current stack 925
player [KLChen2PokerPlayer] gets hole card ['HJ', 'C2'], current stack 587
Started the round 36
Street "preflop" started. (community card = [])
"YueShi" declared "fold:0"
"JoyoPlayer" declared "raise:15"
"ZifengFoldMan" declared "fold:0"
"KLChen2PokerPlayer" declared "fold:0"
"ZPlayer" declared "raise:20"
"NitWinWin" declared "fold:0"
"Jinkun" declared "call:20"
"JoyoPlayer" declared "raise:25"
"ZPlayer" declared "call:25"
"Jinkun" declared "call:25"
Street "flop" started. (community card = ['SK', 'H6', 'S3'])
"Jinkun" declared "call:0"
"JoyoPlayer" declared "fold:0"
"ZPlayer" declared "call:0"
Street "turn" started. (community card = ['SK', 'H6', 'S3', 'C5'])
"Jinkun" declared "call:0"
"ZPlayer" declared "call:0"
Street "river" started. (community card = ['SK', 'H6', 'S3', 'C5', 'S5'])
"Jinkun" declared "raise:35"
"ZPlayer" declared "fold:0"
"['Jinkun']" won the round 36 (stack = {'ZPlayer': 1753, 'NitWinWin': 920, 'Jinkun': 1006, 'YueShi': 925, 'JoyoPlayer': 1884, 'ZifengFoldMan': 925, 'EvanPlayer': 0, 'KLChen2PokerPlayer': 587})
player [ZPlayer] gets hole card ['D4', 'D2'], current stack 1753
player [NitWinWin] gets hole card ['D9', 'SQ'], current stack 920
player [Jinkun] gets hole card ['SJ', 'CA'], current stack 1001
player [YueShi] gets hole card ['S6', 'ST'], current stack 915
player [JoyoPlayer] gets hole card ['H6', 'C7'], current stack 1884
player [ZifengFoldMan] gets hole card ['C2', 'H8'], current stack 925
player [KLChen2PokerPlayer] gets hole card ['DQ', 'CJ'], current stack 587
Started the round 37
Street "preflop" started. (community card = [])
"JoyoPlayer" declared "fold:0"
"ZifengFoldMan" declared "fold:0"
"KLChen2PokerPlayer" declared "raise:15"
"ZPlayer" declared "raise:20"
"NitWinWin" declared "fold:0"
"Jinkun" declared "fold:20"
"YueShi" declared "fold:0"
"KLChen2PokerPlayer" declared "call:20"
Street "flop" started. (community card = ['H3', 'C3', 'HK'])
"KLChen2PokerPlayer" declared "raise:12"
"ZPlayer" declared "fold:0"
"['KLChen2PokerPlayer']" won the round 37 (stack = {'ZPlayer': 1733, 'NitWinWin': 920, 'Jinkun': 1001, 'YueShi': 915, 'JoyoPlayer': 1884, 'ZifengFoldMan': 925, 'EvanPlayer': 0, 'KLChen2PokerPlayer': 622})
player [ZPlayer] gets hole card ['H7', 'HT'], current stack 1733
player [NitWinWin] gets hole card ['H9', 'S9'], current stack 920
player [Jinkun] gets hole card ['C2', 'S7'], current stack 1001
player [YueShi] gets hole card ['C6', 'DT'], current stack 910
player [JoyoPlayer] gets hole card ['HQ', 'D2'], current stack 1874
player [ZifengFoldMan] gets hole card ['S4', 'CJ'], current stack 925
player [KLChen2PokerPlayer] gets hole card ['D7', 'CQ'], current stack 622
Started the round 38
Street "preflop" started. (community card = [])
"ZifengFoldMan" declared "fold:0"
"KLChen2PokerPlayer" declared "raise:19"
"ZPlayer" declared "raise:28"
"NitWinWin" declared "fold:0"
"Jinkun" declared "fold:28"
"YueShi" declared "fold:0"
"JoyoPlayer" declared "raise:37"
"KLChen2PokerPlayer" declared "fold:0"
"ZPlayer" declared "call:37"
Street "flop" started. (community card = ['C3', 'CA', 'C5'])
"JoyoPlayer" declared "fold:0"
"['ZPlayer']" won the round 38 (stack = {'ZPlayer': 1794, 'NitWinWin': 920, 'Jinkun': 1001, 'YueShi': 910, 'JoyoPlayer': 1847, 'ZifengFoldMan': 925, 'EvanPlayer': 0, 'KLChen2PokerPlayer': 603})
player [ZPlayer] gets hole card ['C6', 'D9'], current stack 1794
player [NitWinWin] gets hole card ['CT', 'S3'], current stack 920
player [Jinkun] gets hole card ['S2', 'S6'], current stack 1001
player [YueShi] gets hole card ['C2', 'HA'], current stack 910
player [JoyoPlayer] gets hole card ['H6', 'H9'], current stack 1842
player [ZifengFoldMan] gets hole card ['DQ', 'D3'], current stack 915
player [KLChen2PokerPlayer] gets hole card ['HQ', 'C3'], current stack 603
Started the round 39
Street "preflop" started. (community card = [])
"KLChen2PokerPlayer" declared "fold:0"
"ZPlayer" declared "raise:15"
"NitWinWin" declared "fold:0"
"Jinkun" declared "fold:15"
"YueShi" declared "fold:0"
"JoyoPlayer" declared "raise:20"
"ZifengFoldMan" declared "fold:0"
"ZPlayer" declared "call:20"
Street "flop" started. (community card = ['CJ', 'D2', 'SQ'])
"JoyoPlayer" declared "fold:0"
"['ZPlayer']" won the round 39 (stack = {'ZPlayer': 1824, 'NitWinWin': 920, 'Jinkun': 1001, 'YueShi': 910, 'JoyoPlayer': 1827, 'ZifengFoldMan': 915, 'EvanPlayer': 0, 'KLChen2PokerPlayer': 603})
player [ZPlayer] gets hole card ['SJ', 'SK'], current stack 1824
player [NitWinWin] gets hole card ['S9', 'DJ'], current stack 920
player [Jinkun] gets hole card ['C6', 'HA'], current stack 1001
player [YueShi] gets hole card ['H7', 'DT'], current stack 910
player [JoyoPlayer] gets hole card ['C8', 'DQ'], current stack 1827
player [ZifengFoldMan] gets hole card ['CQ', 'D7'], current stack 910
player [KLChen2PokerPlayer] gets hole card ['D4', 'H6'], current stack 593
Started the round 40
Street "preflop" started. (community card = [])
"ZPlayer" declared "raise:15"
"NitWinWin" declared "fold:0"
"Jinkun" declared "fold:15"
"YueShi" declared "fold:0"
"JoyoPlayer" declared "fold:0"
"ZifengFoldMan" declared "fold:0"
"KLChen2PokerPlayer" declared "fold:0"
"['ZPlayer']" won the round 40 (stack = {'ZPlayer': 1839, 'NitWinWin': 920, 'Jinkun': 1001, 'YueShi': 910, 'JoyoPlayer': 1827, 'ZifengFoldMan': 910, 'EvanPlayer': 0, 'KLChen2PokerPlayer': 593})
player [ZPlayer] gets hole card ['C5', 'CT'], current stack 1829
player [NitWinWin] gets hole card ['S2', 'DT'], current stack 920
player [Jinkun] gets hole card ['C9', 'S5'], current stack 1001
player [YueShi] gets hole card ['DJ', 'D2'], current stack 910
player [JoyoPlayer] gets hole card ['H7', 'C8'], current stack 1827
player [ZifengFoldMan] gets hole card ['S7', 'SJ'], current stack 910
player [KLChen2PokerPlayer] gets hole card ['CA', 'H5'], current stack 588
Started the round 41
Street "preflop" started. (community card = [])
"NitWinWin" declared "fold:0"
"Jinkun" declared "fold:10"
"YueShi" declared "fold:0"
"JoyoPlayer" declared "fold:0"
"ZifengFoldMan" declared "fold:0"
"KLChen2PokerPlayer" declared "raise:29"
"ZPlayer" declared "call:29"
Street "flop" started. (community card = ['H8', 'HJ', 'D3'])
"KLChen2PokerPlayer" declared "call:0"
"ZPlayer" declared "call:0"
Street "turn" started. (community card = ['H8', 'HJ', 'D3', 'H9'])
"KLChen2PokerPlayer" declared "call:0"
"ZPlayer" declared "call:0"
Street "river" started. (community card = ['H8', 'HJ', 'D3', 'H9', 'S9'])
"KLChen2PokerPlayer" declared "call:0"
"ZPlayer" declared "call:0"
"['KLChen2PokerPlayer']" won the round 41 (stack = {'ZPlayer': 1810, 'NitWinWin': 920, 'Jinkun': 1001, 'YueShi': 910, 'JoyoPlayer': 1827, 'ZifengFoldMan': 910, 'EvanPlayer': 0, 'KLChen2PokerPlayer': 622})
player [ZPlayer] gets hole card ['H3', 'SJ'], current stack 1805
player [NitWinWin] gets hole card ['S7', 'HA'], current stack 910
player [Jinkun] gets hole card ['C5', 'HQ'], current stack 1001
player [YueShi] gets hole card ['DK', 'S5'], current stack 910
player [JoyoPlayer] gets hole card ['D6', 'DQ'], current stack 1827
player [ZifengFoldMan] gets hole card ['SA', 'CA'], current stack 910
player [KLChen2PokerPlayer] gets hole card ['S2', 'DT'], current stack 622
Started the round 42
Street "preflop" started. (community card = [])
"Jinkun" declared "fold:10"
"YueShi" declared "fold:0"
"JoyoPlayer" declared "fold:0"
"ZifengFoldMan" declared "fold:0"
"KLChen2PokerPlayer" declared "fold:0"
"ZPlayer" declared "raise:15"
"NitWinWin" declared "fold:0"
"['ZPlayer']" won the round 42 (stack = {'ZPlayer': 1820, 'NitWinWin': 910, 'Jinkun': 1001, 'YueShi': 910, 'JoyoPlayer': 1827, 'ZifengFoldMan': 910, 'EvanPlayer': 0, 'KLChen2PokerPlayer': 622})
player [ZPlayer] gets hole card ['SK', 'CT'], current stack 1820
player [NitWinWin] gets hole card ['HK', 'H8'], current stack 905
player [Jinkun] gets hole card ['DT', 'H5'], current stack 991
player [YueShi] gets hole card ['CQ', 'SQ'], current stack 910
player [JoyoPlayer] gets hole card ['D8', 'SA'], current stack 1827
player [ZifengFoldMan] gets hole card ['S4', 'DQ'], current stack 910
player [KLChen2PokerPlayer] gets hole card ['D4', 'D9'], current stack 622
Started the round 43
Street "preflop" started. (community card = [])
"YueShi" declared "fold:0"
"JoyoPlayer" declared "fold:0"
"ZifengFoldMan" declared "fold:0"
"KLChen2PokerPlayer" declared "fold:0"
"ZPlayer" declared "raise:15"
"NitWinWin" declared "fold:0"
"Jinkun" declared "fold:15"
"['ZPlayer']" won the round 43 (stack = {'ZPlayer': 1835, 'NitWinWin': 905, 'Jinkun': 991, 'YueShi': 910, 'JoyoPlayer': 1827, 'ZifengFoldMan': 910, 'EvanPlayer': 0, 'KLChen2PokerPlayer': 622})
player [ZPlayer] gets hole card ['H4', 'SQ'], current stack 1835
player [NitWinWin] gets hole card ['HJ', 'CA'], current stack 905
player [Jinkun] gets hole card ['H7', 'C8'], current stack 986
player [YueShi] gets hole card ['DA', 'SJ'], current stack 900
player [JoyoPlayer] gets hole card ['H5', 'D2'], current stack 1827
player [ZifengFoldMan] gets hole card ['HA', 'HQ'], current stack 910
player [KLChen2PokerPlayer] gets hole card ['C3', 'C5'], current stack 622
Started the round 44
Street "preflop" started. (community card = [])
"JoyoPlayer" declared "fold:0"
"ZifengFoldMan" declared "fold:0"
"KLChen2PokerPlayer" declared "fold:0"
"ZPlayer" declared "raise:15"
"NitWinWin" declared "fold:0"
"Jinkun" declared "fold:15"
"YueShi" declared "fold:0"
"['ZPlayer']" won the round 44 (stack = {'ZPlayer': 1850, 'NitWinWin': 905, 'Jinkun': 986, 'YueShi': 900, 'JoyoPlayer': 1827, 'ZifengFoldMan': 910, 'EvanPlayer': 0, 'KLChen2PokerPlayer': 622})
player [ZPlayer] gets hole card ['C5', 'C6'], current stack 1850
player [NitWinWin] gets hole card ['D9', 'HQ'], current stack 905
player [Jinkun] gets hole card ['D8', 'DA'], current stack 986
player [YueShi] gets hole card ['DK', 'H5'], current stack 895
player [JoyoPlayer] gets hole card ['D7', 'D5'], current stack 1817
player [ZifengFoldMan] gets hole card ['D2', 'CJ'], current stack 910
player [KLChen2PokerPlayer] gets hole card ['S4', 'H3'], current stack 622
Started the round 45
Street "preflop" started. (community card = [])
"ZifengFoldMan" declared "fold:0"
"KLChen2PokerPlayer" declared "fold:0"
"ZPlayer" declared "raise:15"
"NitWinWin" declared "fold:0"
"Jinkun" declared "fold:15"
"YueShi" declared "fold:0"
"JoyoPlayer" declared "raise:20"
"ZPlayer" declared "call:20"
Street "flop" started. (community card = ['C3', 'CQ', 'D4'])
"JoyoPlayer" declared "fold:0"
"['ZPlayer']" won the round 45 (stack = {'ZPlayer': 1875, 'NitWinWin': 905, 'Jinkun': 986, 'YueShi': 895, 'JoyoPlayer': 1807, 'ZifengFoldMan': 910, 'EvanPlayer': 0, 'KLChen2PokerPlayer': 622})
player [ZPlayer] gets hole card ['H6', 'HT'], current stack 1875
player [NitWinWin] gets hole card ['DK', 'H5'], current stack 905
player [Jinkun] gets hole card ['H9', 'S8'], current stack 986
player [YueShi] gets hole card ['SQ', 'H3'], current stack 895
player [JoyoPlayer] gets hole card ['H7', 'HK'], current stack 1802
player [ZifengFoldMan] gets hole card ['CQ', 'S6'], current stack 900
player [KLChen2PokerPlayer] gets hole card ['DA', 'C9'], current stack 622
Started the round 46
Street "preflop" started. (community card = [])
"KLChen2PokerPlayer" declared "raise:15"
"ZPlayer" declared "raise:20"
"NitWinWin" declared "fold:0"
"Jinkun" declared "fold:20"
"YueShi" declared "fold:0"
"JoyoPlayer" declared "raise:25"
"ZifengFoldMan" declared "fold:0"
"KLChen2PokerPlayer" declared "fold:0"
"ZPlayer" declared "call:25"
Street "flop" started. (community card = ['CJ', 'C4', 'DQ'])
"JoyoPlayer" declared "fold:0"
"['ZPlayer']" won the round 46 (stack = {'ZPlayer': 1925, 'NitWinWin': 905, 'Jinkun': 986, 'YueShi': 895, 'JoyoPlayer': 1782, 'ZifengFoldMan': 900, 'EvanPlayer': 0, 'KLChen2PokerPlayer': 607})
player [ZPlayer] gets hole card ['C4', 'CA'], current stack 1925
player [NitWinWin] gets hole card ['CQ', 'HJ'], current stack 905
player [Jinkun] gets hole card ['S3', 'C5'], current stack 986
player [YueShi] gets hole card ['SK', 'H5'], current stack 895
player [JoyoPlayer] gets hole card ['SQ', 'S5'], current stack 1782
player [ZifengFoldMan] gets hole card ['HQ', 'C2'], current stack 895
player [KLChen2PokerPlayer] gets hole card ['S9', 'D9'], current stack 597
Started the round 47
Street "preflop" started. (community card = [])
"ZPlayer" declared "raise:15"
"NitWinWin" declared "fold:0"
"Jinkun" declared "fold:15"
"YueShi" declared "fold:0"
"JoyoPlayer" declared "raise:20"
"ZifengFoldMan" declared "fold:0"
"KLChen2PokerPlayer" declared "raise:27"
"ZPlayer" declared "call:27"
"JoyoPlayer" declared "fold:0"
Street "flop" started. (community card = ['H7', 'DK', 'DQ'])
"KLChen2PokerPlayer" declared "raise:38"
"ZPlayer" declared "fold:0"
"['KLChen2PokerPlayer']" won the round 47 (stack = {'ZPlayer': 1898, 'NitWinWin': 905, 'Jinkun': 986, 'YueShi': 895, 'JoyoPlayer': 1762, 'ZifengFoldMan': 895, 'EvanPlayer': 0, 'KLChen2PokerPlayer': 659})
player [ZPlayer] gets hole card ['HK', 'H9'], current stack 1888
player [NitWinWin] gets hole card ['SQ', 'S4'], current stack 905
player [Jinkun] gets hole card ['ST', 'DK'], current stack 986
player [YueShi] gets hole card ['DT', 'HA'], current stack 895
player [JoyoPlayer] gets hole card ['SJ', 'SK'], current stack 1762
player [ZifengFoldMan] gets hole card ['D9', 'H7'], current stack 895
player [KLChen2PokerPlayer] gets hole card ['C2', 'H8'], current stack 654
Started the round 48
Street "preflop" started. (community card = [])
"NitWinWin" declared "fold:0"
"Jinkun" declared "fold:10"
"YueShi" declared "fold:0"
"JoyoPlayer" declared "fold:0"
"ZifengFoldMan" declared "fold:0"
"KLChen2PokerPlayer" declared "fold:0"
"['ZPlayer']" won the round 48 (stack = {'ZPlayer': 1903, 'NitWinWin': 905, 'Jinkun': 986, 'YueShi': 895, 'JoyoPlayer': 1762, 'ZifengFoldMan': 895, 'EvanPlayer': 0, 'KLChen2PokerPlayer': 654})
player [ZPlayer] gets hole card ['C6', 'C8'], current stack 1898
player [NitWinWin] gets hole card ['H8', 'D3'], current stack 895
player [Jinkun] gets hole card ['S6', 'CT'], current stack 986
player [YueShi] gets hole card ['C5', 'CQ'], current stack 895
player [JoyoPlayer] gets hole card ['CK', 'S7'], current stack 1762
player [ZifengFoldMan] gets hole card ['CA', 'ST'], current stack 895
player [KLChen2PokerPlayer] gets hole card ['H3', 'S4'], current stack 654
Started the round 49
Street "preflop" started. (community card = [])
"Jinkun" declared "fold:10"
"YueShi" declared "fold:0"
"JoyoPlayer" declared "fold:0"
"ZifengFoldMan" declared "fold:0"
"KLChen2PokerPlayer" declared "fold:0"
"ZPlayer" declared "raise:15"
"NitWinWin" declared "fold:0"
"['ZPlayer']" won the round 49 (stack = {'ZPlayer': 1913, 'NitWinWin': 895, 'Jinkun': 986, 'YueShi': 895, 'JoyoPlayer': 1762, 'ZifengFoldMan': 895, 'EvanPlayer': 0, 'KLChen2PokerPlayer': 654})
player [ZPlayer] gets hole card ['DK', 'CK'], current stack 1913
player [NitWinWin] gets hole card ['S8', 'C5'], current stack 890
player [Jinkun] gets hole card ['CQ', 'S6'], current stack 976
player [YueShi] gets hole card ['S4', 'C3'], current stack 895
player [JoyoPlayer] gets hole card ['C2', 'H8'], current stack 1762
player [ZifengFoldMan] gets hole card ['S9', 'HA'], current stack 895
player [KLChen2PokerPlayer] gets hole card ['C4', 'D9'], current stack 654
Started the round 50
Street "preflop" started. (community card = [])
"YueShi" declared "fold:0"
"JoyoPlayer" declared "raise:15"
"ZifengFoldMan" declared "fold:0"
"KLChen2PokerPlayer" declared "raise:20"
"ZPlayer" declared "raise:25"
"NitWinWin" declared "fold:0"
"Jinkun" declared "fold:25"
"JoyoPlayer" declared "fold:0"
"KLChen2PokerPlayer" declared "fold:0"
"['ZPlayer']" won the round 50 (stack = {'ZPlayer': 1963, 'NitWinWin': 890, 'Jinkun': 976, 'YueShi': 895, 'JoyoPlayer': 1747, 'ZifengFoldMan': 895, 'EvanPlayer': 0, 'KLChen2PokerPlayer': 634})

Game Results:
------------------------------------------------------------
Game 1:
Winner: ZPlayer (stack: 1963)
All players' stacks:
  ZPlayer: 1963
  NitWinWin: 890
  Jinkun: 976
  YueShi: 895
  JoyoPlayer: 1747
  ZifengFoldMan: 895
  EvanPlayer: 0
  KLChen2PokerPlayer: 634
------------------------------------------------------------
