player [ZPlayer] gets hole card ['S3', 'HK'], current stack 1000
player [NitWinWin] gets hole card ['S5', 'SQ'], current stack 995
player [Jinkun] gets hole card ['DQ', 'DJ'], current stack 990
player [YueShi] gets hole card ['HQ', 'CJ'], current stack 1000
player [JoyoPlayer] gets hole card ['C3', 'H7'], current stack 1000
player [ZifengFoldMan] gets hole card ['S6', 'D8'], current stack 1000
player [EvanPlayer] gets hole card ['H4', 'C2'], current stack 1000
player [KLChen2PokerPlayer] gets hole card ['H3', 'CQ'], current stack 1000
Started the round 1
Street "preflop" started. (community card = [])
"YueShi" declared "fold:0"
"JoyoPlayer" declared "fold:0"
"ZifengFoldMan" declared "fold:0"
"EvanPlayer" declared "fold:10"
"KLChen2PokerPlayer" declared "call:10"
"ZPlayer" declared "call:10"
"NitWinWin" declared "fold:0"
"Jinkun" declared "call:10"
Street "flop" started. (community card = ['H2', 'H6', 'S9'])
"Jinkun" declared "call:0"
"KLChen2PokerPlayer" declared "call:0"
"ZPlayer" declared "call:0"
Street "turn" started. (community card = ['H2', 'H6', 'S9', 'ST'])
"Jinkun" declared "raise:70"
"KLChen2PokerPlayer" declared "fold:0"
"ZPlayer" declared "fold:0"
"['Jinkun']" won the round 1 (stack = {'ZPlayer': 990, 'NitWinWin': 995, 'Jinkun': 1025, 'YueShi': 1000, 'JoyoPlayer': 1000, 'ZifengFoldMan': 1000, 'EvanPlayer': 1000, 'KLChen2PokerPlayer': 990})
player [ZPlayer] gets hole card ['H6', 'SJ'], current stack 990
player [NitWinWin] gets hole card ['C8', 'C6'], current stack 995
player [Jinkun] gets hole card ['C4', 'DK'], current stack 1020
player [YueShi] gets hole card ['SQ', 'DQ'], current stack 990
player [JoyoPlayer] gets hole card ['C2', 'C9'], current stack 1000
player [ZifengFoldMan] gets hole card ['DJ', 'H7'], current stack 1000
player [EvanPlayer] gets hole card ['D6', 'S6'], current stack 1000
player [KLChen2PokerPlayer] gets hole card ['S7', 'H3'], current stack 990
Started the round 2
Street "preflop" started. (community card = [])
"JoyoPlayer" declared "fold:0"
"ZifengFoldMan" declared "fold:0"
"EvanPlayer" declared "call:10"
"KLChen2PokerPlayer" declared "fold:0"
"ZPlayer" declared "call:10"
"NitWinWin" declared "fold:0"
"Jinkun" declared "call:10"
"YueShi" declared "fold:0"
Street "flop" started. (community card = ['CK', 'D4', 'CJ'])
"Jinkun" declared "raise:16"
"EvanPlayer" declared "fold:16"
"ZPlayer" declared "call:16"
Street "turn" started. (community card = ['CK', 'D4', 'CJ', 'HJ'])
"Jinkun" declared "raise:30"
"ZPlayer" declared "raise:102"
"Jinkun" declared "call:102"
Street "river" started. (community card = ['CK', 'D4', 'CJ', 'HJ', 'SK'])
"Jinkun" declared "raise:137"
"ZPlayer" declared "raise:274"
"Jinkun" declared "call:274"
"['Jinkun']" won the round 2 (stack = {'ZPlayer': 588, 'NitWinWin': 995, 'Jinkun': 1447, 'YueShi': 990, 'JoyoPlayer': 1000, 'ZifengFoldMan': 1000, 'EvanPlayer': 990, 'KLChen2PokerPlayer': 990})
player [ZPlayer] gets hole card ['S5', 'D3'], current stack 588
player [NitWinWin] gets hole card ['H6', 'D7'], current stack 995
player [Jinkun] gets hole card ['H5', 'HJ'], current stack 1447
player [YueShi] gets hole card ['D8', 'DJ'], current stack 985
player [JoyoPlayer] gets hole card ['SK', 'CA'], current stack 990
player [ZifengFoldMan] gets hole card ['H7', 'C7'], current stack 1000
player [EvanPlayer] gets hole card ['D6', 'H3'], current stack 990
player [KLChen2PokerPlayer] gets hole card ['C2', 'H9'], current stack 990
Started the round 3
Street "preflop" started. (community card = [])
"ZifengFoldMan" declared "fold:0"
"EvanPlayer" declared "raise:990"
"KLChen2PokerPlayer" declared "fold:0"
"ZPlayer" declared "fold:0"
"NitWinWin" declared "fold:0"
"Jinkun" declared "fold:990"
"YueShi" declared "fold:0"
"JoyoPlayer" declared "raise:-2"
"['EvanPlayer']" won the round 3 (stack = {'ZPlayer': 588, 'NitWinWin': 995, 'Jinkun': 1447, 'YueShi': 985, 'JoyoPlayer': 990, 'ZifengFoldMan': 1000, 'EvanPlayer': 1005, 'KLChen2PokerPlayer': 990})
player [ZPlayer] gets hole card ['SQ', 'HT'], current stack 588
player [NitWinWin] gets hole card ['S6', 'C7'], current stack 995
player [Jinkun] gets hole card ['D7', 'D4'], current stack 1447
player [YueShi] gets hole card ['D3', 'H9'], current stack 985
player [JoyoPlayer] gets hole card ['C2', 'DQ'], current stack 985
player [ZifengFoldMan] gets hole card ['D6', 'H2'], current stack 990
player [EvanPlayer] gets hole card ['H4', 'D9'], current stack 1005
player [KLChen2PokerPlayer] gets hole card ['SA', 'C3'], current stack 990
Started the round 4
Street "preflop" started. (community card = [])
"EvanPlayer" declared "raise:1005"
"KLChen2PokerPlayer" declared "fold:0"
"ZPlayer" declared "fold:0"
"NitWinWin" declared "fold:0"
"Jinkun" declared "fold:1005"
"YueShi" declared "fold:0"
"JoyoPlayer" declared "fold:0"
"ZifengFoldMan" declared "fold:0"
"['EvanPlayer']" won the round 4 (stack = {'ZPlayer': 588, 'NitWinWin': 995, 'Jinkun': 1447, 'YueShi': 985, 'JoyoPlayer': 985, 'ZifengFoldMan': 990, 'EvanPlayer': 1020, 'KLChen2PokerPlayer': 990})
player [ZPlayer] gets hole card ['C6', 'CK'], current stack 588
player [NitWinWin] gets hole card ['H4', 'C7'], current stack 995
player [Jinkun] gets hole card ['DK', 'D8'], current stack 1447
player [YueShi] gets hole card ['CJ', 'H5'], current stack 985
player [JoyoPlayer] gets hole card ['C2', 'H2'], current stack 985
player [ZifengFoldMan] gets hole card ['S4', 'S5'], current stack 985
player [EvanPlayer] gets hole card ['H8', 'C9'], current stack 1010
player [KLChen2PokerPlayer] gets hole card ['CQ', 'DA'], current stack 990
Started the round 5
Street "preflop" started. (community card = [])
"KLChen2PokerPlayer" declared "raise:23"
"ZPlayer" declared "fold:0"
"NitWinWin" declared "fold:0"
"Jinkun" declared "fold:23"
"YueShi" declared "fold:0"
"JoyoPlayer" declared "fold:0"
"ZifengFoldMan" declared "fold:0"
"EvanPlayer" declared "fold:23"
"['KLChen2PokerPlayer']" won the round 5 (stack = {'ZPlayer': 588, 'NitWinWin': 995, 'Jinkun': 1447, 'YueShi': 985, 'JoyoPlayer': 985, 'ZifengFoldMan': 985, 'EvanPlayer': 1010, 'KLChen2PokerPlayer': 1005})
player [ZPlayer] gets hole card ['DK', 'CJ'], current stack 588
player [NitWinWin] gets hole card ['CK', 'H2'], current stack 995
player [Jinkun] gets hole card ['SK', 'DT'], current stack 1447
player [YueShi] gets hole card ['H5', 'H8'], current stack 985
player [JoyoPlayer] gets hole card ['D9', 'S7'], current stack 985
player [ZifengFoldMan] gets hole card ['S3', 'H3'], current stack 985
player [EvanPlayer] gets hole card ['S5', 'DQ'], current stack 1005
player [KLChen2PokerPlayer] gets hole card ['C6', 'ST'], current stack 995
Started the round 6
Street "preflop" started. (community card = [])
"ZPlayer" declared "raise:15"
"NitWinWin" declared "fold:0"
"Jinkun" declared "fold:15"
"YueShi" declared "fold:0"
"JoyoPlayer" declared "fold:0"
"ZifengFoldMan" declared "fold:0"
"EvanPlayer" declared "fold:15"
"KLChen2PokerPlayer" declared "fold:0"
"['ZPlayer']" won the round 6 (stack = {'ZPlayer': 603, 'NitWinWin': 995, 'Jinkun': 1447, 'YueShi': 985, 'JoyoPlayer': 985, 'ZifengFoldMan': 985, 'EvanPlayer': 1005, 'KLChen2PokerPlayer': 995})
player [ZPlayer] gets hole card ['H8', 'HT'], current stack 593
player [NitWinWin] gets hole card ['HQ', 'H5'], current stack 995
player [Jinkun] gets hole card ['SJ', 'S4'], current stack 1447
player [YueShi] gets hole card ['DT', 'C2'], current stack 985
player [JoyoPlayer] gets hole card ['SK', 'SA'], current stack 985
player [ZifengFoldMan] gets hole card ['C7', 'H2'], current stack 985
player [EvanPlayer] gets hole card ['D9', 'C4'], current stack 1005
player [KLChen2PokerPlayer] gets hole card ['H7', 'C9'], current stack 990
Started the round 7
Street "preflop" started. (community card = [])
"NitWinWin" declared "fold:0"
"Jinkun" declared "fold:10"
"YueShi" declared "fold:0"
"JoyoPlayer" declared "fold:0"
"ZifengFoldMan" declared "fold:0"
"EvanPlayer" declared "raise:1005"
"KLChen2PokerPlayer" declared "fold:0"
"ZPlayer" declared "fold:0"
"['EvanPlayer']" won the round 7 (stack = {'ZPlayer': 593, 'NitWinWin': 995, 'Jinkun': 1447, 'YueShi': 985, 'JoyoPlayer': 985, 'ZifengFoldMan': 985, 'EvanPlayer': 1020, 'KLChen2PokerPlayer': 990})
player [ZPlayer] gets hole card ['D7', 'SJ'], current stack 588
player [NitWinWin] gets hole card ['DT', 'D4'], current stack 985
player [Jinkun] gets hole card ['H8', 'SK'], current stack 1447
player [YueShi] gets hole card ['S2', 'C6'], current stack 985
player [JoyoPlayer] gets hole card ['DJ', 'S9'], current stack 985
player [ZifengFoldMan] gets hole card ['C3', 'CT'], current stack 985
player [EvanPlayer] gets hole card ['HA', 'C9'], current stack 1020
player [KLChen2PokerPlayer] gets hole card ['CA', 'ST'], current stack 990
Started the round 8
Street "preflop" started. (community card = [])
"Jinkun" declared "fold:10"
"YueShi" declared "fold:0"
"JoyoPlayer" declared "fold:0"
"ZifengFoldMan" declared "fold:0"
"EvanPlayer" declared "fold:10"
"KLChen2PokerPlayer" declared "raise:15"
"ZPlayer" declared "call:15"
"NitWinWin" declared "fold:0"
Street "flop" started. (community card = ['HK', 'HJ', 'DA'])
"ZPlayer" declared "raise:10"
"KLChen2PokerPlayer" declared "raise:38"
"ZPlayer" declared "fold:0"
"['KLChen2PokerPlayer']" won the round 8 (stack = {'ZPlayer': 568, 'NitWinWin': 985, 'Jinkun': 1447, 'YueShi': 985, 'JoyoPlayer': 985, 'ZifengFoldMan': 985, 'EvanPlayer': 1020, 'KLChen2PokerPlayer': 1025})
player [ZPlayer] gets hole card ['S5', 'H7'], current stack 568
player [NitWinWin] gets hole card ['H3', 'C4'], current stack 980
player [Jinkun] gets hole card ['H9', 'SQ'], current stack 1437
player [YueShi] gets hole card ['S8', 'D5'], current stack 985
player [JoyoPlayer] gets hole card ['H6', 'D8'], current stack 985
player [ZifengFoldMan] gets hole card ['HT', 'C7'], current stack 985
player [EvanPlayer] gets hole card ['CK', 'D7'], current stack 1020
player [KLChen2PokerPlayer] gets hole card ['HQ', 'CA'], current stack 1025
Started the round 9
Street "preflop" started. (community card = [])
"YueShi" declared "fold:0"
"JoyoPlayer" declared "raise:15"
"ZifengFoldMan" declared "fold:0"
"EvanPlayer" declared "raise:1020"
"KLChen2PokerPlayer" declared "fold:0"
"ZPlayer" declared "fold:0"
"NitWinWin" declared "fold:0"
"Jinkun" declared "fold:1020"
"JoyoPlayer" declared "fold:0"
"['EvanPlayer']" won the round 9 (stack = {'ZPlayer': 568, 'NitWinWin': 980, 'Jinkun': 1437, 'YueShi': 985, 'JoyoPlayer': 970, 'ZifengFoldMan': 985, 'EvanPlayer': 1050, 'KLChen2PokerPlayer': 1025})
player [ZPlayer] gets hole card ['S4', 'DK'], current stack 568
player [NitWinWin] gets hole card ['HA', 'S6'], current stack 980
player [Jinkun] gets hole card ['D9', 'DA'], current stack 1432
player [YueShi] gets hole card ['H3', 'C7'], current stack 975
player [JoyoPlayer] gets hole card ['CA', 'SA'], current stack 970
player [ZifengFoldMan] gets hole card ['D5', 'SK'], current stack 985
player [EvanPlayer] gets hole card ['H2', 'C6'], current stack 1050
player [KLChen2PokerPlayer] gets hole card ['CQ', 'H8'], current stack 1025
Started the round 10
Street "preflop" started. (community card = [])
"JoyoPlayer" declared "fold:0"
"ZifengFoldMan" declared "fold:0"
"EvanPlayer" declared "fold:10"
"KLChen2PokerPlayer" declared "call:10"
"ZPlayer" declared "raise:15"
"NitWinWin" declared "fold:0"
"Jinkun" declared "call:15"
"YueShi" declared "fold:0"
"KLChen2PokerPlayer" declared "fold:0"
Street "flop" started. (community card = ['D7', 'SQ', 'C3'])
"Jinkun" declared "call:0"
"ZPlayer" declared "call:0"
Street "turn" started. (community card = ['D7', 'SQ', 'C3', 'CT'])
"Jinkun" declared "call:0"
"ZPlayer" declared "call:0"
Street "river" started. (community card = ['D7', 'SQ', 'C3', 'CT', 'S9'])
"Jinkun" declared "call:0"
"ZPlayer" declared "call:0"
"['Jinkun']" won the round 10 (stack = {'ZPlayer': 553, 'NitWinWin': 980, 'Jinkun': 1472, 'YueShi': 975, 'JoyoPlayer': 970, 'ZifengFoldMan': 985, 'EvanPlayer': 1050, 'KLChen2PokerPlayer': 1015})
player [ZPlayer] gets hole card ['CA', 'DJ'], current stack 553
player [NitWinWin] gets hole card ['H4', 'H6'], current stack 980
player [Jinkun] gets hole card ['D3', 'SQ'], current stack 1472
player [YueShi] gets hole card ['HJ', 'H2'], current stack 970
player [JoyoPlayer] gets hole card ['C2', 'DK'], current stack 960
player [ZifengFoldMan] gets hole card ['C3', 'HA'], current stack 985
player [EvanPlayer] gets hole card ['D9', 'H7'], current stack 1050
player [KLChen2PokerPlayer] gets hole card ['CT', 'CK'], current stack 1015
Started the round 11
Street "preflop" started. (community card = [])
"ZifengFoldMan" declared "fold:0"
"EvanPlayer" declared "raise:1050"
"KLChen2PokerPlayer" declared "fold:0"
"ZPlayer" declared "fold:0"
"NitWinWin" declared "fold:0"
"Jinkun" declared "fold:1050"
"YueShi" declared "fold:0"
"JoyoPlayer" declared "call:1050"
Street "flop" started. (community card = ['D2', 'SJ', 'SA'])
Street "turn" started. (community card = ['D2', 'SJ', 'SA', 'D5'])
Street "river" started. (community card = ['D2', 'SJ', 'SA', 'D5', 'H5'])
"['JoyoPlayer']" won the round 11 (stack = {'ZPlayer': 553, 'NitWinWin': 980, 'Jinkun': 1472, 'YueShi': 970, 'JoyoPlayer': 1945, 'ZifengFoldMan': 985, 'EvanPlayer': 80, 'KLChen2PokerPlayer': 1015})
player [ZPlayer] gets hole card ['D6', 'CA'], current stack 553
player [NitWinWin] gets hole card ['HT', 'C7'], current stack 980
player [Jinkun] gets hole card ['C6', 'DJ'], current stack 1472
player [YueShi] gets hole card ['HQ', 'DK'], current stack 970
player [JoyoPlayer] gets hole card ['HK', 'SJ'], current stack 1940
player [ZifengFoldMan] gets hole card ['C4', 'CT'], current stack 975
player [EvanPlayer] gets hole card ['HJ', 'DT'], current stack 80
player [KLChen2PokerPlayer] gets hole card ['ST', 'C2'], current stack 1015
Started the round 12
Street "preflop" started. (community card = [])
"EvanPlayer" declared "raise:80"
"KLChen2PokerPlayer" declared "fold:0"
"ZPlayer" declared "fold:0"
"NitWinWin" declared "fold:0"
"Jinkun" declared "fold:80"
"YueShi" declared "fold:0"
"JoyoPlayer" declared "call:80"
"ZifengFoldMan" declared "fold:0"
Street "flop" started. (community card = ['D4', 'D5', 'D8'])
Street "turn" started. (community card = ['D4', 'D5', 'D8', 'H8'])
Street "river" started. (community card = ['D4', 'D5', 'D8', 'H8', 'C8'])
"['JoyoPlayer']" won the round 12 (stack = {'ZPlayer': 553, 'NitWinWin': 980, 'Jinkun': 1472, 'YueShi': 970, 'JoyoPlayer': 2035, 'ZifengFoldMan': 975, 'EvanPlayer': 0, 'KLChen2PokerPlayer': 1015})
player [ZPlayer] gets hole card ['H6', 'SK'], current stack 553
player [NitWinWin] gets hole card ['D7', 'DT'], current stack 980
player [Jinkun] gets hole card ['DJ', 'H7'], current stack 1472
player [YueShi] gets hole card ['DQ', 'S4'], current stack 970
player [JoyoPlayer] gets hole card ['ST', 'DA'], current stack 2035
player [ZifengFoldMan] gets hole card ['S2', 'DK'], current stack 970
player [KLChen2PokerPlayer] gets hole card ['HJ', 'H9'], current stack 1005
Started the round 13
Street "preflop" started. (community card = [])
"ZPlayer" declared "call:10"
"NitWinWin" declared "fold:0"
"Jinkun" declared "fold:10"
"YueShi" declared "fold:0"
"JoyoPlayer" declared "fold:0"
"ZifengFoldMan" declared "fold:0"
"KLChen2PokerPlayer" declared "raise:15"
"ZPlayer" declared "call:15"
Street "flop" started. (community card = ['D2', 'S3', 'CQ'])
"KLChen2PokerPlayer" declared "call:0"
"ZPlayer" declared "call:0"
Street "turn" started. (community card = ['D2', 'S3', 'CQ', 'H3'])
"KLChen2PokerPlayer" declared "call:0"
"ZPlayer" declared "call:0"
Street "river" started. (community card = ['D2', 'S3', 'CQ', 'H3', 'HQ'])
"KLChen2PokerPlayer" declared "call:0"
"ZPlayer" declared "call:0"
"['ZPlayer']" won the round 13 (stack = {'ZPlayer': 573, 'NitWinWin': 980, 'Jinkun': 1472, 'YueShi': 970, 'JoyoPlayer': 2035, 'ZifengFoldMan': 970, 'EvanPlayer': 0, 'KLChen2PokerPlayer': 1000})
player [ZPlayer] gets hole card ['C6', 'D5'], current stack 563
player [NitWinWin] gets hole card ['C7', 'S7'], current stack 980
player [Jinkun] gets hole card ['H5', 'DT'], current stack 1472
player [YueShi] gets hole card ['S8', 'C8'], current stack 970
player [JoyoPlayer] gets hole card ['DQ', 'D8'], current stack 2035
player [ZifengFoldMan] gets hole card ['CT', 'H9'], current stack 970
player [KLChen2PokerPlayer] gets hole card ['SJ', 'CJ'], current stack 995
Started the round 14
Street "preflop" started. (community card = [])
"NitWinWin" declared "fold:0"
"Jinkun" declared "fold:10"
"YueShi" declared "fold:0"
"JoyoPlayer" declared "fold:0"
"ZifengFoldMan" declared "fold:0"
"KLChen2PokerPlayer" declared "raise:15"
"ZPlayer" declared "call:15"
Street "flop" started. (community card = ['S5', 'H7', 'HA'])
"KLChen2PokerPlayer" declared "raise:25"
"ZPlayer" declared "fold:0"
"['KLChen2PokerPlayer']" won the round 14 (stack = {'ZPlayer': 558, 'NitWinWin': 980, 'Jinkun': 1472, 'YueShi': 970, 'JoyoPlayer': 2035, 'ZifengFoldMan': 970, 'EvanPlayer': 0, 'KLChen2PokerPlayer': 1015})
player [ZPlayer] gets hole card ['D3', 'H5'], current stack 553
player [NitWinWin] gets hole card ['D2', 'S7'], current stack 970
player [Jinkun] gets hole card ['H9', 'C5'], current stack 1472
player [YueShi] gets hole card ['D4', 'CQ'], current stack 970
player [JoyoPlayer] gets hole card ['D6', 'H2'], current stack 2035
player [ZifengFoldMan] gets hole card ['DK', 'CK'], current stack 970
player [KLChen2PokerPlayer] gets hole card ['SA', 'HK'], current stack 1015
Started the round 15
Street "preflop" started. (community card = [])
"Jinkun" declared "fold:10"
"YueShi" declared "fold:0"
"JoyoPlayer" declared "fold:0"
"ZifengFoldMan" declared "fold:0"
"KLChen2PokerPlayer" declared "raise:22"
"ZPlayer" declared "call:22"
"NitWinWin" declared "fold:0"
Street "flop" started. (community card = ['SJ', 'HT', 'S9'])
"ZPlayer" declared "call:0"
"KLChen2PokerPlayer" declared "raise:12"
"ZPlayer" declared "fold:0"
"['KLChen2PokerPlayer']" won the round 15 (stack = {'ZPlayer': 536, 'NitWinWin': 970, 'Jinkun': 1472, 'YueShi': 970, 'JoyoPlayer': 2035, 'ZifengFoldMan': 970, 'EvanPlayer': 0, 'KLChen2PokerPlayer': 1047})
player [ZPlayer] gets hole card ['D3', 'SQ'], current stack 536
player [NitWinWin] gets hole card ['SK', 'S4'], current stack 965
player [Jinkun] gets hole card ['H2', 'HQ'], current stack 1462
player [YueShi] gets hole card ['CJ', 'H7'], current stack 970
player [JoyoPlayer] gets hole card ['D7', 'HJ'], current stack 2035
player [ZifengFoldMan] gets hole card ['S2', 'C7'], current stack 970
player [KLChen2PokerPlayer] gets hole card ['D9', 'CK'], current stack 1047
Started the round 16
Street "preflop" started. (community card = [])
"YueShi" declared "fold:0"
"JoyoPlayer" declared "fold:0"
"ZifengFoldMan" declared "fold:0"
"KLChen2PokerPlayer" declared "raise:19"
"ZPlayer" declared "call:19"
"NitWinWin" declared "fold:0"
"Jinkun" declared "fold:19"
Street "flop" started. (community card = ['H9', 'S7', 'C3'])
"KLChen2PokerPlayer" declared "raise:21"
"ZPlayer" declared "fold:0"
"['KLChen2PokerPlayer']" won the round 16 (stack = {'ZPlayer': 517, 'NitWinWin': 965, 'Jinkun': 1462, 'YueShi': 970, 'JoyoPlayer': 2035, 'ZifengFoldMan': 970, 'EvanPlayer': 0, 'KLChen2PokerPlayer': 1081})
player [ZPlayer] gets hole card ['C6', 'SJ'], current stack 517
player [NitWinWin] gets hole card ['DA', 'SK'], current stack 965
player [Jinkun] gets hole card ['ST', 'HA'], current stack 1457
player [YueShi] gets hole card ['HK', 'S2'], current stack 960
player [JoyoPlayer] gets hole card ['D4', 'D7'], current stack 2035
player [ZifengFoldMan] gets hole card ['D2', 'CQ'], current stack 970
player [KLChen2PokerPlayer] gets hole card ['S5', 'S8'], current stack 1081
Started the round 17
Street "preflop" started. (community card = [])
"JoyoPlayer" declared "raise:15"
"ZifengFoldMan" declared "fold:0"
"KLChen2PokerPlayer" declared "raise:27"
"ZPlayer" declared "fold:0"
"NitWinWin" declared "fold:0"
"Jinkun" declared "fold:27"
"YueShi" declared "fold:0"
"JoyoPlayer" declared "fold:0"
"['KLChen2PokerPlayer']" won the round 17 (stack = {'ZPlayer': 517, 'NitWinWin': 965, 'Jinkun': 1457, 'YueShi': 960, 'JoyoPlayer': 2020, 'ZifengFoldMan': 970, 'EvanPlayer': 0, 'KLChen2PokerPlayer': 1111})
player [ZPlayer] gets hole card ['C2', 'C5'], current stack 517
player [NitWinWin] gets hole card ['H6', 'H2'], current stack 965
player [Jinkun] gets hole card ['S4', 'C3'], current stack 1457
player [YueShi] gets hole card ['CQ', 'D7'], current stack 955
player [JoyoPlayer] gets hole card ['C7', 'S6'], current stack 2010
player [ZifengFoldMan] gets hole card ['SQ', 'SA'], current stack 970
player [KLChen2PokerPlayer] gets hole card ['S7', 'S3'], current stack 1111
Started the round 18
Street "preflop" started. (community card = [])
"ZifengFoldMan" declared "fold:0"
"KLChen2PokerPlayer" declared "fold:0"
"ZPlayer" declared "call:10"
"NitWinWin" declared "fold:0"
"Jinkun" declared "call:10"
"YueShi" declared "fold:0"
"JoyoPlayer" declared "raise:15"
"ZPlayer" declared "call:15"
"Jinkun" declared "fold:15"
Street "flop" started. (community card = ['S5', 'D3', 'HT'])
"JoyoPlayer" declared "fold:0"
"['ZPlayer']" won the round 18 (stack = {'ZPlayer': 547, 'NitWinWin': 965, 'Jinkun': 1447, 'YueShi': 955, 'JoyoPlayer': 2005, 'ZifengFoldMan': 970, 'EvanPlayer': 0, 'KLChen2PokerPlayer': 1111})
player [ZPlayer] gets hole card ['SJ', 'CK'], current stack 547
player [NitWinWin] gets hole card ['H5', 'D5'], current stack 965
player [Jinkun] gets hole card ['CA', 'C7'], current stack 1447
player [YueShi] gets hole card ['ST', 'S5'], current stack 955
player [JoyoPlayer] gets hole card ['S2', 'CJ'], current stack 2000
player [ZifengFoldMan] gets hole card ['DA', 'HT'], current stack 960
player [KLChen2PokerPlayer] gets hole card ['HA', 'D7'], current stack 1111
Started the round 19
Street "preflop" started. (community card = [])
"KLChen2PokerPlayer" declared "raise:18"
"ZPlayer" declared "call:18"
"NitWinWin" declared "fold:0"
"Jinkun" declared "fold:18"
"YueShi" declared "fold:0"
"JoyoPlayer" declared "fold:0"
"ZifengFoldMan" declared "fold:0"
Street "flop" started. (community card = ['DT', 'D4', 'S6'])
"KLChen2PokerPlayer" declared "call:0"
"ZPlayer" declared "call:0"
Street "turn" started. (community card = ['DT', 'D4', 'S6', 'D6'])
"KLChen2PokerPlayer" declared "call:0"
"ZPlayer" declared "call:0"
Street "river" started. (community card = ['DT', 'D4', 'S6', 'D6', 'S3'])
"KLChen2PokerPlayer" declared "call:0"
"ZPlayer" declared "call:0"
"['KLChen2PokerPlayer']" won the round 19 (stack = {'ZPlayer': 529, 'NitWinWin': 965, 'Jinkun': 1447, 'YueShi': 955, 'JoyoPlayer': 2000, 'ZifengFoldMan': 960, 'EvanPlayer': 0, 'KLChen2PokerPlayer': 1144})
player [ZPlayer] gets hole card ['S4', 'H5'], current stack 529
player [NitWinWin] gets hole card ['D2', 'C3'], current stack 965
player [Jinkun] gets hole card ['CA', 'HA'], current stack 1447
player [YueShi] gets hole card ['S6', 'DT'], current stack 955
player [JoyoPlayer] gets hole card ['CJ', 'DQ'], current stack 2000
player [ZifengFoldMan] gets hole card ['SQ', 'DJ'], current stack 955
player [KLChen2PokerPlayer] gets hole card ['D6', 'H7'], current stack 1134
Started the round 20
Street "preflop" started. (community card = [])
"ZPlayer" declared "call:10"
"NitWinWin" declared "fold:0"
"Jinkun" declared "call:10"
"YueShi" declared "fold:0"
"JoyoPlayer" declared "fold:0"
"ZifengFoldMan" declared "fold:0"
"KLChen2PokerPlayer" declared "fold:0"
Street "flop" started. (community card = ['D7', 'C5', 'H2'])
"ZPlayer" declared "raise:10"
"Jinkun" declared "call:10"
Street "turn" started. (community card = ['D7', 'C5', 'H2', 'D5'])
"ZPlayer" declared "raise:427"
"Jinkun" declared "fold:427"
"['ZPlayer']" won the round 20 (stack = {'ZPlayer': 564, 'NitWinWin': 965, 'Jinkun': 1427, 'YueShi': 955, 'JoyoPlayer': 2000, 'ZifengFoldMan': 955, 'EvanPlayer': 0, 'KLChen2PokerPlayer': 1134})
player [ZPlayer] gets hole card ['D6', 'H5'], current stack 554
player [NitWinWin] gets hole card ['SA', 'D9'], current stack 965
player [Jinkun] gets hole card ['S4', 'S2'], current stack 1427
player [YueShi] gets hole card ['CQ', 'DJ'], current stack 955
player [JoyoPlayer] gets hole card ['H2', 'HQ'], current stack 2000
player [ZifengFoldMan] gets hole card ['C4', 'C8'], current stack 955
player [KLChen2PokerPlayer] gets hole card ['HA', 'ST'], current stack 1129
Started the round 21
Street "preflop" started. (community card = [])
"NitWinWin" declared "fold:0"
"Jinkun" declared "fold:10"
"YueShi" declared "fold:0"
"JoyoPlayer" declared "fold:0"
"ZifengFoldMan" declared "fold:0"
"KLChen2PokerPlayer" declared "raise:19"
"ZPlayer" declared "call:19"
Street "flop" started. (community card = ['H4', 'HK', 'CK'])
"KLChen2PokerPlayer" declared "raise:10"
"ZPlayer" declared "fold:0"
"['KLChen2PokerPlayer']" won the round 21 (stack = {'ZPlayer': 545, 'NitWinWin': 965, 'Jinkun': 1427, 'YueShi': 955, 'JoyoPlayer': 2000, 'ZifengFoldMan': 955, 'EvanPlayer': 0, 'KLChen2PokerPlayer': 1153})
player [ZPlayer] gets hole card ['D8', 'C6'], current stack 540
player [NitWinWin] gets hole card ['C8', 'C3'], current stack 955
player [Jinkun] gets hole card ['H6', 'HK'], current stack 1427
player [YueShi] gets hole card ['D3', 'SK'], current stack 955
player [JoyoPlayer] gets hole card ['CA', 'H4'], current stack 2000
player [ZifengFoldMan] gets hole card ['D5', 'SA'], current stack 955
player [KLChen2PokerPlayer] gets hole card ['D6', 'D7'], current stack 1153
Started the round 22
Street "preflop" started. (community card = [])
"Jinkun" declared "fold:10"
"YueShi" declared "fold:0"
"JoyoPlayer" declared "fold:0"
"ZifengFoldMan" declared "fold:0"
"KLChen2PokerPlayer" declared "raise:19"
"ZPlayer" declared "call:19"
"NitWinWin" declared "fold:0"
Street "flop" started. (community card = ['C7', 'C9', 'S8'])
"ZPlayer" declared "raise:10"
"KLChen2PokerPlayer" declared "raise:20"
"ZPlayer" declared "call:20"
Street "turn" started. (community card = ['C7', 'C9', 'S8', 'S2'])
"ZPlayer" declared "raise:10"
"KLChen2PokerPlayer" declared "raise:89"
"ZPlayer" declared "fold:0"
"['KLChen2PokerPlayer']" won the round 22 (stack = {'ZPlayer': 496, 'NitWinWin': 955, 'Jinkun': 1427, 'YueShi': 955, 'JoyoPlayer': 2000, 'ZifengFoldMan': 955, 'EvanPlayer': 0, 'KLChen2PokerPlayer': 1212})
player [ZPlayer] gets hole card ['H3', 'HQ'], current stack 496
player [NitWinWin] gets hole card ['CA', 'D9'], current stack 950
player [Jinkun] gets hole card ['S5', 'DT'], current stack 1417
player [YueShi] gets hole card ['CJ', 'S8'], current stack 955
player [JoyoPlayer] gets hole card ['DQ', 'S3'], current stack 2000
player [ZifengFoldMan] gets hole card ['D4', 'CQ'], current stack 955
player [KLChen2PokerPlayer] gets hole card ['C7', 'DA'], current stack 1212
Started the round 23
Street "preflop" started. (community card = [])
"YueShi" declared "fold:0"
"JoyoPlayer" declared "fold:0"
"ZifengFoldMan" declared "fold:0"
"KLChen2PokerPlayer" declared "raise:17"
"ZPlayer" declared "call:17"
"NitWinWin" declared "fold:0"
"Jinkun" declared "fold:17"
Street "flop" started. (community card = ['H2', 'DJ', 'C2'])
"KLChen2PokerPlayer" declared "raise:12"
"ZPlayer" declared "fold:0"
"['KLChen2PokerPlayer']" won the round 23 (stack = {'ZPlayer': 479, 'NitWinWin': 950, 'Jinkun': 1417, 'YueShi': 955, 'JoyoPlayer': 2000, 'ZifengFoldMan': 955, 'EvanPlayer': 0, 'KLChen2PokerPlayer': 1244})
player [ZPlayer] gets hole card ['C5', 'ST'], current stack 479
player [NitWinWin] gets hole card ['D9', 'C7'], current stack 950
player [Jinkun] gets hole card ['C9', 'DQ'], current stack 1412
player [YueShi] gets hole card ['D3', 'HA'], current stack 945
player [JoyoPlayer] gets hole card ['CJ', 'C8'], current stack 2000
player [ZifengFoldMan] gets hole card ['S3', 'C4'], current stack 955
player [KLChen2PokerPlayer] gets hole card ['H6', 'DK'], current stack 1244
Started the round 24
Street "preflop" started. (community card = [])
"JoyoPlayer" declared "fold:0"
"ZifengFoldMan" declared "fold:0"
"KLChen2PokerPlayer" declared "raise:17"
"ZPlayer" declared "call:17"
"NitWinWin" declared "fold:0"
"Jinkun" declared "fold:17"
"YueShi" declared "fold:0"
Street "flop" started. (community card = ['H4', 'H3', 'H5'])
"KLChen2PokerPlayer" declared "raise:18"
"ZPlayer" declared "fold:0"
"['KLChen2PokerPlayer']" won the round 24 (stack = {'ZPlayer': 462, 'NitWinWin': 950, 'Jinkun': 1412, 'YueShi': 945, 'JoyoPlayer': 2000, 'ZifengFoldMan': 955, 'EvanPlayer': 0, 'KLChen2PokerPlayer': 1276})
player [ZPlayer] gets hole card ['C3', 'DA'], current stack 462
player [NitWinWin] gets hole card ['SA', 'DK'], current stack 950
player [Jinkun] gets hole card ['H2', 'ST'], current stack 1412
player [YueShi] gets hole card ['HJ', 'CQ'], current stack 940
player [JoyoPlayer] gets hole card ['HT', 'H4'], current stack 1990
player [ZifengFoldMan] gets hole card ['S5', 'C2'], current stack 955
player [KLChen2PokerPlayer] gets hole card ['S8', 'CT'], current stack 1276
Started the round 25
Street "preflop" started. (community card = [])
"ZifengFoldMan" declared "fold:0"
"KLChen2PokerPlayer" declared "raise:15"
"ZPlayer" declared "call:15"
"NitWinWin" declared "fold:0"
"Jinkun" declared "fold:15"
"YueShi" declared "fold:0"
"JoyoPlayer" declared "fold:0"
Street "flop" started. (community card = ['H6', 'DJ', 'H7'])
"KLChen2PokerPlayer" declared "call:0"
"ZPlayer" declared "call:0"
Street "turn" started. (community card = ['H6', 'DJ', 'H7', 'H5'])
"KLChen2PokerPlayer" declared "call:0"
"ZPlayer" declared "call:0"
Street "river" started. (community card = ['H6', 'DJ', 'H7', 'H5', 'D2'])
"KLChen2PokerPlayer" declared "call:0"
"ZPlayer" declared "call:0"
"['ZPlayer']" won the round 25 (stack = {'ZPlayer': 492, 'NitWinWin': 950, 'Jinkun': 1412, 'YueShi': 940, 'JoyoPlayer': 1990, 'ZifengFoldMan': 955, 'EvanPlayer': 0, 'KLChen2PokerPlayer': 1261})
player [ZPlayer] gets hole card ['S7', 'SA'], current stack 492
player [NitWinWin] gets hole card ['D3', 'S2'], current stack 950
player [Jinkun] gets hole card ['HA', 'S8'], current stack 1412
player [YueShi] gets hole card ['HK', 'DJ'], current stack 940
player [JoyoPlayer] gets hole card ['C5', 'H8'], current stack 1985
player [ZifengFoldMan] gets hole card ['C6', 'S6'], current stack 945
player [KLChen2PokerPlayer] gets hole card ['D7', 'HT'], current stack 1261
Started the round 26
Street "preflop" started. (community card = [])
"KLChen2PokerPlayer" declared "call:10"
"ZPlayer" declared "raise:15"
"NitWinWin" declared "fold:0"
"Jinkun" declared "fold:15"
"YueShi" declared "fold:0"
"JoyoPlayer" declared "fold:0"
"ZifengFoldMan" declared "fold:0"
"KLChen2PokerPlayer" declared "fold:0"
"['ZPlayer']" won the round 26 (stack = {'ZPlayer': 517, 'NitWinWin': 950, 'Jinkun': 1412, 'YueShi': 940, 'JoyoPlayer': 1985, 'ZifengFoldMan': 945, 'EvanPlayer': 0, 'KLChen2PokerPlayer': 1251})
player [ZPlayer] gets hole card ['HJ', 'D7'], current stack 517
player [NitWinWin] gets hole card ['DK', 'H2'], current stack 950
player [Jinkun] gets hole card ['S8', 'C2'], current stack 1412
player [YueShi] gets hole card ['C8', 'D6'], current stack 940
player [JoyoPlayer] gets hole card ['H6', 'DT'], current stack 1985
player [ZifengFoldMan] gets hole card ['C5', 'HK'], current stack 940
player [KLChen2PokerPlayer] gets hole card ['DJ', 'H9'], current stack 1241
Started the round 27
Street "preflop" started. (community card = [])
"ZPlayer" declared "call:10"
"NitWinWin" declared "fold:0"
"Jinkun" declared "fold:10"
"YueShi" declared "fold:0"
"JoyoPlayer" declared "fold:0"
"ZifengFoldMan" declared "fold:0"
"KLChen2PokerPlayer" declared "raise:15"
"ZPlayer" declared "call:15"
Street "flop" started. (community card = ['HT', 'SK', 'S3'])
"KLChen2PokerPlayer" declared "call:0"
"ZPlayer" declared "call:0"
Street "turn" started. (community card = ['HT', 'SK', 'S3', 'DA'])
"KLChen2PokerPlayer" declared "call:0"
"ZPlayer" declared "call:0"
Street "river" started. (community card = ['HT', 'SK', 'S3', 'DA', 'CJ'])
"KLChen2PokerPlayer" declared "call:0"
"ZPlayer" declared "call:0"
"['ZPlayer', 'KLChen2PokerPlayer']" won the round 27 (stack = {'ZPlayer': 519, 'NitWinWin': 950, 'Jinkun': 1412, 'YueShi': 940, 'JoyoPlayer': 1985, 'ZifengFoldMan': 940, 'EvanPlayer': 0, 'KLChen2PokerPlayer': 1253})
player [ZPlayer] gets hole card ['C3', 'C2'], current stack 509
player [NitWinWin] gets hole card ['S6', 'H2'], current stack 950
player [Jinkun] gets hole card ['D2', 'DK'], current stack 1412
player [YueShi] gets hole card ['CQ', 'SK'], current stack 940
player [JoyoPlayer] gets hole card ['H6', 'CK'], current stack 1985
player [ZifengFoldMan] gets hole card ['SJ', 'S4'], current stack 940
player [KLChen2PokerPlayer] gets hole card ['D3', 'HJ'], current stack 1248
Started the round 28
Street "preflop" started. (community card = [])
"NitWinWin" declared "fold:0"
"Jinkun" declared "fold:10"
"YueShi" declared "fold:0"
"JoyoPlayer" declared "fold:0"
"ZifengFoldMan" declared "fold:0"
"KLChen2PokerPlayer" declared "call:10"
"ZPlayer" declared "call:10"
Street "flop" started. (community card = ['HQ', 'H3', 'S5'])
"KLChen2PokerPlayer" declared "raise:10"
"ZPlayer" declared "fold:0"
"['KLChen2PokerPlayer']" won the round 28 (stack = {'ZPlayer': 509, 'NitWinWin': 950, 'Jinkun': 1412, 'YueShi': 940, 'JoyoPlayer': 1985, 'ZifengFoldMan': 940, 'EvanPlayer': 0, 'KLChen2PokerPlayer': 1263})
player [ZPlayer] gets hole card ['CK', 'C9'], current stack 504
player [NitWinWin] gets hole card ['DA', 'C3'], current stack 940
player [Jinkun] gets hole card ['CA', 'CT'], current stack 1412
player [YueShi] gets hole card ['C2', 'C6'], current stack 940
player [JoyoPlayer] gets hole card ['C7', 'H9'], current stack 1985
player [ZifengFoldMan] gets hole card ['D6', 'HA'], current stack 940
player [KLChen2PokerPlayer] gets hole card ['D7', 'DJ'], current stack 1263
Started the round 29
Street "preflop" started. (community card = [])
"Jinkun" declared "fold:10"
"YueShi" declared "fold:0"
"JoyoPlayer" declared "fold:0"
"ZifengFoldMan" declared "fold:0"
"KLChen2PokerPlayer" declared "raise:26"
"ZPlayer" declared "call:26"
"NitWinWin" declared "fold:0"
Street "flop" started. (community card = ['D3', 'HT', 'SK'])
"ZPlayer" declared "raise:10"
"KLChen2PokerPlayer" declared "fold:0"
"['ZPlayer']" won the round 29 (stack = {'ZPlayer': 545, 'NitWinWin': 940, 'Jinkun': 1412, 'YueShi': 940, 'JoyoPlayer': 1985, 'ZifengFoldMan': 940, 'EvanPlayer': 0, 'KLChen2PokerPlayer': 1237})
player [ZPlayer] gets hole card ['HJ', 'D8'], current stack 545
player [NitWinWin] gets hole card ['S9', 'HT'], current stack 935
player [Jinkun] gets hole card ['C4', 'CK'], current stack 1402
player [YueShi] gets hole card ['D5', 'HK'], current stack 940
player [JoyoPlayer] gets hole card ['SJ', 'C3'], current stack 1985
player [ZifengFoldMan] gets hole card ['C8', 'H8'], current stack 940
player [KLChen2PokerPlayer] gets hole card ['D2', 'H4'], current stack 1237
Started the round 30
Street "preflop" started. (community card = [])
"YueShi" declared "fold:0"
"JoyoPlayer" declared "fold:0"
"ZifengFoldMan" declared "fold:0"
"KLChen2PokerPlayer" declared "fold:0"
"ZPlayer" declared "raise:15"
"NitWinWin" declared "fold:0"
"Jinkun" declared "call:15"
Street "flop" started. (community card = ['CA', 'CT', 'C6'])
"Jinkun" declared "raise:17"
"ZPlayer" declared "fold:0"
"['Jinkun']" won the round 30 (stack = {'ZPlayer': 530, 'NitWinWin': 935, 'Jinkun': 1432, 'YueShi': 940, 'JoyoPlayer': 1985, 'ZifengFoldMan': 940, 'EvanPlayer': 0, 'KLChen2PokerPlayer': 1237})
player [ZPlayer] gets hole card ['C3', 'H4'], current stack 530
player [NitWinWin] gets hole card ['DT', 'S9'], current stack 935
player [Jinkun] gets hole card ['S5', 'D4'], current stack 1427
player [YueShi] gets hole card ['H2', 'D8'], current stack 930
player [JoyoPlayer] gets hole card ['C9', 'SA'], current stack 1985
player [ZifengFoldMan] gets hole card ['D5', 'S3'], current stack 940
player [KLChen2PokerPlayer] gets hole card ['C7', 'D9'], current stack 1237
Started the round 31
Street "preflop" started. (community card = [])
"JoyoPlayer" declared "fold:0"
"ZifengFoldMan" declared "fold:0"
"KLChen2PokerPlayer" declared "call:10"
"ZPlayer" declared "fold:0"
"NitWinWin" declared "fold:0"
"Jinkun" declared "call:10"
"YueShi" declared "fold:0"
Street "flop" started. (community card = ['CA', 'H7', 'C4'])
"Jinkun" declared "call:0"
"KLChen2PokerPlayer" declared "raise:32"
"Jinkun" declared "call:32"
Street "turn" started. (community card = ['CA', 'H7', 'C4', 'CK'])
"Jinkun" declared "call:0"
"KLChen2PokerPlayer" declared "raise:140"
"Jinkun" declared "raise:468"
"KLChen2PokerPlayer" declared "fold:0"
"['Jinkun']" won the round 31 (stack = {'ZPlayer': 530, 'NitWinWin': 935, 'Jinkun': 1624, 'YueShi': 930, 'JoyoPlayer': 1985, 'ZifengFoldMan': 940, 'EvanPlayer': 0, 'KLChen2PokerPlayer': 1055})
player [ZPlayer] gets hole card ['H2', 'C7'], current stack 530
player [NitWinWin] gets hole card ['C6', 'HJ'], current stack 935
player [Jinkun] gets hole card ['HA', 'S7'], current stack 1624
player [YueShi] gets hole card ['S2', 'S8'], current stack 925
player [JoyoPlayer] gets hole card ['D3', 'CJ'], current stack 1975
player [ZifengFoldMan] gets hole card ['C4', 'D5'], current stack 940
player [KLChen2PokerPlayer] gets hole card ['SK', 'C3'], current stack 1055
Started the round 32
Street "preflop" started. (community card = [])
"ZifengFoldMan" declared "fold:0"
"KLChen2PokerPlayer" declared "call:10"
"ZPlayer" declared "fold:0"
"NitWinWin" declared "fold:0"
"Jinkun" declared "call:10"
"YueShi" declared "fold:0"
"JoyoPlayer" declared "raise:15"
"KLChen2PokerPlayer" declared "raise:20"
"Jinkun" declared "call:20"
"JoyoPlayer" declared "raise:25"
"KLChen2PokerPlayer" declared "fold:0"
"Jinkun" declared "call:25"
Street "flop" started. (community card = ['D8', 'D4', 'DQ'])
"JoyoPlayer" declared "fold:0"
"['Jinkun']" won the round 32 (stack = {'ZPlayer': 530, 'NitWinWin': 935, 'Jinkun': 1674, 'YueShi': 925, 'JoyoPlayer': 1960, 'ZifengFoldMan': 940, 'EvanPlayer': 0, 'KLChen2PokerPlayer': 1035})
player [ZPlayer] gets hole card ['C4', 'S8'], current stack 530
player [NitWinWin] gets hole card ['D7', 'H7'], current stack 935
player [Jinkun] gets hole card ['S3', 'D2'], current stack 1674
player [YueShi] gets hole card ['H8', 'HJ'], current stack 925
player [JoyoPlayer] gets hole card ['CA', 'C5'], current stack 1955
player [ZifengFoldMan] gets hole card ['S4', 'C3'], current stack 930
player [KLChen2PokerPlayer] gets hole card ['CJ', 'DA'], current stack 1035
Started the round 33
Street "preflop" started. (community card = [])
"KLChen2PokerPlayer" declared "raise:19"
"ZPlayer" declared "fold:0"
"NitWinWin" declared "fold:0"
"Jinkun" declared "fold:19"
"YueShi" declared "fold:0"
"JoyoPlayer" declared "fold:0"
"ZifengFoldMan" declared "fold:0"
"['KLChen2PokerPlayer']" won the round 33 (stack = {'ZPlayer': 530, 'NitWinWin': 935, 'Jinkun': 1674, 'YueShi': 925, 'JoyoPlayer': 1955, 'ZifengFoldMan': 930, 'EvanPlayer': 0, 'KLChen2PokerPlayer': 1050})
player [ZPlayer] gets hole card ['D8', 'HA'], current stack 530
player [NitWinWin] gets hole card ['CA', 'CJ'], current stack 935
player [Jinkun] gets hole card ['H5', 'D6'], current stack 1674
player [YueShi] gets hole card ['D3', 'S9'], current stack 925
player [JoyoPlayer] gets hole card ['CT', 'CQ'], current stack 1955
player [ZifengFoldMan] gets hole card ['C7', 'HT'], current stack 925
player [KLChen2PokerPlayer] gets hole card ['S3', 'C9'], current stack 1040
Started the round 34
Street "preflop" started. (community card = [])
"ZPlayer" declared "call:10"
"NitWinWin" declared "fold:0"
"Jinkun" declared "fold:10"
"YueShi" declared "fold:0"
"JoyoPlayer" declared "fold:0"
"ZifengFoldMan" declared "fold:0"
"KLChen2PokerPlayer" declared "fold:0"
"['ZPlayer']" won the round 34 (stack = {'ZPlayer': 545, 'NitWinWin': 935, 'Jinkun': 1674, 'YueShi': 925, 'JoyoPlayer': 1955, 'ZifengFoldMan': 925, 'EvanPlayer': 0, 'KLChen2PokerPlayer': 1040})
player [ZPlayer] gets hole card ['HK', 'C5'], current stack 535
player [NitWinWin] gets hole card ['S7', 'CT'], current stack 935
player [Jinkun] gets hole card ['C8', 'DK'], current stack 1674
player [YueShi] gets hole card ['D6', 'HQ'], current stack 925
player [JoyoPlayer] gets hole card ['H9', 'SA'], current stack 1955
player [ZifengFoldMan] gets hole card ['C6', 'DA'], current stack 925
player [KLChen2PokerPlayer] gets hole card ['H8', 'HA'], current stack 1035
Started the round 35
Street "preflop" started. (community card = [])
"NitWinWin" declared "fold:0"
"Jinkun" declared "fold:10"
"YueShi" declared "fold:0"
"JoyoPlayer" declared "fold:0"
"ZifengFoldMan" declared "fold:0"
"KLChen2PokerPlayer" declared "raise:19"
"ZPlayer" declared "call:19"
Street "flop" started. (community card = ['DQ', 'HT', 'C3'])
"KLChen2PokerPlayer" declared "raise:17"
"ZPlayer" declared "fold:0"
"['KLChen2PokerPlayer']" won the round 35 (stack = {'ZPlayer': 526, 'NitWinWin': 935, 'Jinkun': 1674, 'YueShi': 925, 'JoyoPlayer': 1955, 'ZifengFoldMan': 925, 'EvanPlayer': 0, 'KLChen2PokerPlayer': 1059})
player [ZPlayer] gets hole card ['H5', 'C2'], current stack 521
player [NitWinWin] gets hole card ['DJ', 'HJ'], current stack 925
player [Jinkun] gets hole card ['D2', 'C5'], current stack 1674
player [YueShi] gets hole card ['DK', 'CT'], current stack 925
player [JoyoPlayer] gets hole card ['S7', 'H2'], current stack 1955
player [ZifengFoldMan] gets hole card ['C8', 'HA'], current stack 925
player [KLChen2PokerPlayer] gets hole card ['SQ', 'S3'], current stack 1059
Started the round 36
Street "preflop" started. (community card = [])
"Jinkun" declared "fold:10"
"YueShi" declared "fold:0"
"JoyoPlayer" declared "fold:0"
"ZifengFoldMan" declared "fold:0"
"KLChen2PokerPlayer" declared "raise:15"
"ZPlayer" declared "fold:0"
"NitWinWin" declared "raise:935"
"KLChen2PokerPlayer" declared "fold:0"
"['NitWinWin']" won the round 36 (stack = {'ZPlayer': 521, 'NitWinWin': 955, 'Jinkun': 1674, 'YueShi': 925, 'JoyoPlayer': 1955, 'ZifengFoldMan': 925, 'EvanPlayer': 0, 'KLChen2PokerPlayer': 1044})
player [ZPlayer] gets hole card ['D6', 'H6'], current stack 521
player [NitWinWin] gets hole card ['C5', 'S2'], current stack 950
player [Jinkun] gets hole card ['S3', 'S8'], current stack 1664
player [YueShi] gets hole card ['D9', 'S5'], current stack 925
player [JoyoPlayer] gets hole card ['DA', 'C2'], current stack 1955
player [ZifengFoldMan] gets hole card ['SJ', 'S4'], current stack 925
player [KLChen2PokerPlayer] gets hole card ['H3', 'C4'], current stack 1044
Started the round 37
Street "preflop" started. (community card = [])
"YueShi" declared "fold:0"
"JoyoPlayer" declared "raise:15"
"ZifengFoldMan" declared "fold:0"
"KLChen2PokerPlayer" declared "raise:20"
"ZPlayer" declared "call:20"
"NitWinWin" declared "fold:0"
"Jinkun" declared "fold:20"
"JoyoPlayer" declared "fold:0"
Street "flop" started. (community card = ['SQ', 'SA', 'S6'])
"KLChen2PokerPlayer" declared "call:0"
"ZPlayer" declared "raise:10"
"KLChen2PokerPlayer" declared "fold:0"
"['ZPlayer']" won the round 37 (stack = {'ZPlayer': 571, 'NitWinWin': 950, 'Jinkun': 1664, 'YueShi': 925, 'JoyoPlayer': 1940, 'ZifengFoldMan': 925, 'EvanPlayer': 0, 'KLChen2PokerPlayer': 1024})
player [ZPlayer] gets hole card ['C8', 'HJ'], current stack 571
player [NitWinWin] gets hole card ['CJ', 'CT'], current stack 950
player [Jinkun] gets hole card ['H9', 'SQ'], current stack 1659
player [YueShi] gets hole card ['DK', 'C5'], current stack 915
player [JoyoPlayer] gets hole card ['H4', 'DJ'], current stack 1940
player [ZifengFoldMan] gets hole card ['C4', 'H8'], current stack 925
player [KLChen2PokerPlayer] gets hole card ['ST', 'SJ'], current stack 1024
Started the round 38
Street "preflop" started. (community card = [])
"JoyoPlayer" declared "fold:0"
"ZifengFoldMan" declared "fold:0"
"KLChen2PokerPlayer" declared "raise:17"
"ZPlayer" declared "fold:0"
"NitWinWin" declared "fold:0"
"Jinkun" declared "fold:17"
"YueShi" declared "fold:0"
"['KLChen2PokerPlayer']" won the round 38 (stack = {'ZPlayer': 571, 'NitWinWin': 950, 'Jinkun': 1659, 'YueShi': 915, 'JoyoPlayer': 1940, 'ZifengFoldMan': 925, 'EvanPlayer': 0, 'KLChen2PokerPlayer': 1039})
player [ZPlayer] gets hole card ['CK', 'SJ'], current stack 571
player [NitWinWin] gets hole card ['D5', 'C8'], current stack 950
player [Jinkun] gets hole card ['H6', 'H3'], current stack 1659
player [YueShi] gets hole card ['S7', 'HQ'], current stack 910
player [JoyoPlayer] gets hole card ['CQ', 'H9'], current stack 1930
player [ZifengFoldMan] gets hole card ['SQ', 'ST'], current stack 925
player [KLChen2PokerPlayer] gets hole card ['HT', 'DQ'], current stack 1039
Started the round 39
Street "preflop" started. (community card = [])
"ZifengFoldMan" declared "fold:0"
"KLChen2PokerPlayer" declared "raise:16"
"ZPlayer" declared "call:16"
"NitWinWin" declared "fold:0"
"Jinkun" declared "fold:16"
"YueShi" declared "fold:0"
"JoyoPlayer" declared "fold:0"
Street "flop" started. (community card = ['HA', 'HJ', 'CA'])
"KLChen2PokerPlayer" declared "raise:11"
"ZPlayer" declared "raise:29"
"KLChen2PokerPlayer" declared "fold:0"
"['ZPlayer']" won the round 39 (stack = {'ZPlayer': 613, 'NitWinWin': 950, 'Jinkun': 1659, 'YueShi': 910, 'JoyoPlayer': 1930, 'ZifengFoldMan': 925, 'EvanPlayer': 0, 'KLChen2PokerPlayer': 1012})
player [ZPlayer] gets hole card ['H9', 'ST'], current stack 613
player [NitWinWin] gets hole card ['C6', 'DA'], current stack 950
player [Jinkun] gets hole card ['CT', 'D6'], current stack 1659
player [YueShi] gets hole card ['H2', 'C5'], current stack 910
player [JoyoPlayer] gets hole card ['SJ', 'S8'], current stack 1925
player [ZifengFoldMan] gets hole card ['S6', 'CA'], current stack 915
player [KLChen2PokerPlayer] gets hole card ['D9', 'HK'], current stack 1012
Started the round 40
Street "preflop" started. (community card = [])
"KLChen2PokerPlayer" declared "raise:15"
"ZPlayer" declared "call:15"
"NitWinWin" declared "fold:0"
"Jinkun" declared "fold:15"
"YueShi" declared "fold:0"
"JoyoPlayer" declared "fold:0"
"ZifengFoldMan" declared "fold:0"
Street "flop" started. (community card = ['CJ', 'C3', 'C4'])
"KLChen2PokerPlayer" declared "call:0"
"ZPlayer" declared "call:0"
Street "turn" started. (community card = ['CJ', 'C3', 'C4', 'H6'])
"KLChen2PokerPlayer" declared "call:0"
"ZPlayer" declared "call:0"
Street "river" started. (community card = ['CJ', 'C3', 'C4', 'H6', 'DK'])
"KLChen2PokerPlayer" declared "raise:214"
"ZPlayer" declared "fold:0"
"['KLChen2PokerPlayer']" won the round 40 (stack = {'ZPlayer': 598, 'NitWinWin': 950, 'Jinkun': 1659, 'YueShi': 910, 'JoyoPlayer': 1925, 'ZifengFoldMan': 915, 'EvanPlayer': 0, 'KLChen2PokerPlayer': 1042})
player [ZPlayer] gets hole card ['HA', 'S7'], current stack 598
player [NitWinWin] gets hole card ['H7', 'DT'], current stack 950
player [Jinkun] gets hole card ['H2', 'C4'], current stack 1659
player [YueShi] gets hole card ['DQ', 'H8'], current stack 910
player [JoyoPlayer] gets hole card ['S9', 'H9'], current stack 1925
player [ZifengFoldMan] gets hole card ['D2', 'SQ'], current stack 910
player [KLChen2PokerPlayer] gets hole card ['S3', 'CT'], current stack 1032
Started the round 41
Street "preflop" started. (community card = [])
"ZPlayer" declared "call:10"
"NitWinWin" declared "fold:0"
"Jinkun" declared "fold:10"
"YueShi" declared "fold:0"
"JoyoPlayer" declared "fold:0"
"ZifengFoldMan" declared "fold:0"
"KLChen2PokerPlayer" declared "fold:0"
"['ZPlayer']" won the round 41 (stack = {'ZPlayer': 613, 'NitWinWin': 950, 'Jinkun': 1659, 'YueShi': 910, 'JoyoPlayer': 1925, 'ZifengFoldMan': 910, 'EvanPlayer': 0, 'KLChen2PokerPlayer': 1032})
player [ZPlayer] gets hole card ['HK', 'S7'], current stack 603
player [NitWinWin] gets hole card ['SA', 'C4'], current stack 950
player [Jinkun] gets hole card ['D4', 'CT'], current stack 1659
player [YueShi] gets hole card ['C8', 'C6'], current stack 910
player [JoyoPlayer] gets hole card ['S4', 'S5'], current stack 1925
player [ZifengFoldMan] gets hole card ['D9', 'H7'], current stack 910
player [KLChen2PokerPlayer] gets hole card ['HT', 'S3'], current stack 1027
Started the round 42
Street "preflop" started. (community card = [])
"NitWinWin" declared "fold:0"
"Jinkun" declared "fold:10"
"YueShi" declared "fold:0"
"JoyoPlayer" declared "fold:0"
"ZifengFoldMan" declared "fold:0"
"KLChen2PokerPlayer" declared "raise:16"
"ZPlayer" declared "call:16"
Street "flop" started. (community card = ['H4', 'HQ', 'HJ'])
"KLChen2PokerPlayer" declared "raise:17"
"ZPlayer" declared "fold:0"
"['KLChen2PokerPlayer']" won the round 42 (stack = {'ZPlayer': 597, 'NitWinWin': 950, 'Jinkun': 1659, 'YueShi': 910, 'JoyoPlayer': 1925, 'ZifengFoldMan': 910, 'EvanPlayer': 0, 'KLChen2PokerPlayer': 1048})
player [ZPlayer] gets hole card ['C6', 'DQ'], current stack 592
player [NitWinWin] gets hole card ['DA', 'S6'], current stack 940
player [Jinkun] gets hole card ['H8', 'HJ'], current stack 1659
player [YueShi] gets hole card ['SQ', 'H2'], current stack 910
player [JoyoPlayer] gets hole card ['C3', 'HT'], current stack 1925
player [ZifengFoldMan] gets hole card ['S9', 'D6'], current stack 910
player [KLChen2PokerPlayer] gets hole card ['DJ', 'S4'], current stack 1048
Started the round 43
Street "preflop" started. (community card = [])
"Jinkun" declared "fold:10"
"YueShi" declared "fold:0"
"JoyoPlayer" declared "raise:15"
"ZifengFoldMan" declared "fold:0"
"KLChen2PokerPlayer" declared "fold:0"
"ZPlayer" declared "call:15"
"NitWinWin" declared "fold:0"
Street "flop" started. (community card = ['D7', 'C8', 'H5'])
"ZPlayer" declared "raise:10"
"JoyoPlayer" declared "raise:20"
"ZPlayer" declared "fold:0"
"['JoyoPlayer']" won the round 43 (stack = {'ZPlayer': 572, 'NitWinWin': 940, 'Jinkun': 1659, 'YueShi': 910, 'JoyoPlayer': 1960, 'ZifengFoldMan': 910, 'EvanPlayer': 0, 'KLChen2PokerPlayer': 1048})
player [ZPlayer] gets hole card ['C9', 'C7'], current stack 572
player [NitWinWin] gets hole card ['H6', 'D2'], current stack 935
player [Jinkun] gets hole card ['D3', 'DT'], current stack 1649
player [YueShi] gets hole card ['H2', 'S2'], current stack 910
player [JoyoPlayer] gets hole card ['D4', 'C3'], current stack 1960
player [ZifengFoldMan] gets hole card ['S6', 'DJ'], current stack 910
player [KLChen2PokerPlayer] gets hole card ['H8', 'SK'], current stack 1048
Started the round 44
Street "preflop" started. (community card = [])
"YueShi" declared "fold:0"
"JoyoPlayer" declared "fold:0"
"ZifengFoldMan" declared "fold:0"
"KLChen2PokerPlayer" declared "raise:17"
"ZPlayer" declared "call:17"
"NitWinWin" declared "fold:0"
"Jinkun" declared "fold:17"
Street "flop" started. (community card = ['C8', 'D5', 'CA'])
"KLChen2PokerPlayer" declared "raise:23"
"ZPlayer" declared "fold:0"
"['KLChen2PokerPlayer']" won the round 44 (stack = {'ZPlayer': 555, 'NitWinWin': 935, 'Jinkun': 1649, 'YueShi': 910, 'JoyoPlayer': 1960, 'ZifengFoldMan': 910, 'EvanPlayer': 0, 'KLChen2PokerPlayer': 1080})
player [ZPlayer] gets hole card ['D2', 'HA'], current stack 555
player [NitWinWin] gets hole card ['CJ', 'DT'], current stack 935
player [Jinkun] gets hole card ['SA', 'SK'], current stack 1644
player [YueShi] gets hole card ['CQ', 'DK'], current stack 900
player [JoyoPlayer] gets hole card ['D4', 'C2'], current stack 1960
player [ZifengFoldMan] gets hole card ['D3', 'H5'], current stack 910
player [KLChen2PokerPlayer] gets hole card ['S7', 'H8'], current stack 1080
Started the round 45
Street "preflop" started. (community card = [])
"JoyoPlayer" declared "raise:15"
"ZifengFoldMan" declared "fold:0"
"KLChen2PokerPlayer" declared "raise:20"
"ZPlayer" declared "call:20"
"NitWinWin" declared "fold:0"
"Jinkun" declared "call:20"
"YueShi" declared "fold:0"
"JoyoPlayer" declared "fold:0"
Street "flop" started. (community card = ['H2', 'D7', 'C4'])
"Jinkun" declared "call:0"
"KLChen2PokerPlayer" declared "raise:37"
"ZPlayer" declared "fold:0"
"Jinkun" declared "call:37"
Street "turn" started. (community card = ['H2', 'D7', 'C4', 'HQ'])
"Jinkun" declared "call:0"
"KLChen2PokerPlayer" declared "raise:155"
"Jinkun" declared "fold:155"
"['KLChen2PokerPlayer']" won the round 45 (stack = {'ZPlayer': 535, 'NitWinWin': 935, 'Jinkun': 1592, 'YueShi': 900, 'JoyoPlayer': 1945, 'ZifengFoldMan': 910, 'EvanPlayer': 0, 'KLChen2PokerPlayer': 1182})
player [ZPlayer] gets hole card ['HT', 'C3'], current stack 535
player [NitWinWin] gets hole card ['D5', 'SQ'], current stack 935
player [Jinkun] gets hole card ['C8', 'SK'], current stack 1592
player [YueShi] gets hole card ['HQ', 'SA'], current stack 895
player [JoyoPlayer] gets hole card ['D8', 'C2'], current stack 1935
player [ZifengFoldMan] gets hole card ['D6', 'H6'], current stack 910
player [KLChen2PokerPlayer] gets hole card ['D9', 'D2'], current stack 1182
Started the round 46
Street "preflop" started. (community card = [])
"ZifengFoldMan" declared "fold:0"
"KLChen2PokerPlayer" declared "call:10"
"ZPlayer" declared "call:10"
"NitWinWin" declared "fold:0"
"Jinkun" declared "fold:10"
"YueShi" declared "fold:0"
"JoyoPlayer" declared "raise:15"
"KLChen2PokerPlayer" declared "fold:0"
"ZPlayer" declared "call:15"
Street "flop" started. (community card = ['C6', 'DA', 'D7'])
"JoyoPlayer" declared "fold:0"
"['ZPlayer']" won the round 46 (stack = {'ZPlayer': 565, 'NitWinWin': 935, 'Jinkun': 1592, 'YueShi': 895, 'JoyoPlayer': 1930, 'ZifengFoldMan': 910, 'EvanPlayer': 0, 'KLChen2PokerPlayer': 1172})
player [ZPlayer] gets hole card ['CJ', 'D9'], current stack 565
player [NitWinWin] gets hole card ['D5', 'C6'], current stack 935
player [Jinkun] gets hole card ['HQ', 'S6'], current stack 1592
player [YueShi] gets hole card ['SA', 'HA'], current stack 895
player [JoyoPlayer] gets hole card ['CQ', 'D6'], current stack 1925
player [ZifengFoldMan] gets hole card ['S4', 'H3'], current stack 900
player [KLChen2PokerPlayer] gets hole card ['DA', 'CT'], current stack 1172
Started the round 47
Street "preflop" started. (community card = [])
"KLChen2PokerPlayer" declared "raise:21"
"ZPlayer" declared "call:21"
"NitWinWin" declared "fold:0"
"Jinkun" declared "fold:21"
"YueShi" declared "fold:0"
"JoyoPlayer" declared "raise:32"
"ZifengFoldMan" declared "fold:0"
"KLChen2PokerPlayer" declared "fold:0"
"ZPlayer" declared "call:32"
Street "flop" started. (community card = ['DQ', 'S8', 'H5'])
"JoyoPlayer" declared "raise:1731"
"ZPlayer" declared "fold:0"
"['JoyoPlayer']" won the round 47 (stack = {'ZPlayer': 533, 'NitWinWin': 935, 'Jinkun': 1592, 'YueShi': 895, 'JoyoPlayer': 1993, 'ZifengFoldMan': 900, 'EvanPlayer': 0, 'KLChen2PokerPlayer': 1151})
player [ZPlayer] gets hole card ['DT', 'DQ'], current stack 533
player [NitWinWin] gets hole card ['D2', 'HA'], current stack 935
player [Jinkun] gets hole card ['C8', 'HQ'], current stack 1592
player [YueShi] gets hole card ['H4', 'D7'], current stack 895
player [JoyoPlayer] gets hole card ['D5', 'SQ'], current stack 1993
player [ZifengFoldMan] gets hole card ['HJ', 'DJ'], current stack 895
player [KLChen2PokerPlayer] gets hole card ['S8', 'C6'], current stack 1141
Started the round 48
Street "preflop" started. (community card = [])
"ZPlayer" declared "raise:15"
"NitWinWin" declared "fold:0"
"Jinkun" declared "fold:15"
"YueShi" declared "fold:0"
"JoyoPlayer" declared "fold:0"
"ZifengFoldMan" declared "fold:0"
"KLChen2PokerPlayer" declared "fold:0"
"['ZPlayer']" won the round 48 (stack = {'ZPlayer': 548, 'NitWinWin': 935, 'Jinkun': 1592, 'YueShi': 895, 'JoyoPlayer': 1993, 'ZifengFoldMan': 895, 'EvanPlayer': 0, 'KLChen2PokerPlayer': 1141})
player [ZPlayer] gets hole card ['S7', 'S6'], current stack 538
player [NitWinWin] gets hole card ['H3', 'H7'], current stack 935
player [Jinkun] gets hole card ['D2', 'C7'], current stack 1592
player [YueShi] gets hole card ['DA', 'C9'], current stack 895
player [JoyoPlayer] gets hole card ['H6', 'SQ'], current stack 1993
player [ZifengFoldMan] gets hole card ['D4', 'C3'], current stack 895
player [KLChen2PokerPlayer] gets hole card ['S2', 'D6'], current stack 1136
Started the round 49
Street "preflop" started. (community card = [])
"NitWinWin" declared "fold:0"
"Jinkun" declared "fold:10"
"YueShi" declared "fold:0"
"JoyoPlayer" declared "raise:15"
"ZifengFoldMan" declared "fold:0"
"KLChen2PokerPlayer" declared "fold:0"
"ZPlayer" declared "call:15"
Street "flop" started. (community card = ['H2', 'CJ', 'D7'])
"ZPlayer" declared "raise:10"
"JoyoPlayer" declared "fold:0"
"['ZPlayer']" won the round 49 (stack = {'ZPlayer': 568, 'NitWinWin': 935, 'Jinkun': 1592, 'YueShi': 895, 'JoyoPlayer': 1978, 'ZifengFoldMan': 895, 'EvanPlayer': 0, 'KLChen2PokerPlayer': 1136})
player [ZPlayer] gets hole card ['H9', 'H5'], current stack 563
player [NitWinWin] gets hole card ['CJ', 'H2'], current stack 925
player [Jinkun] gets hole card ['D2', 'HT'], current stack 1592
player [YueShi] gets hole card ['HQ', 'CQ'], current stack 895
player [JoyoPlayer] gets hole card ['DA', 'S2'], current stack 1978
player [ZifengFoldMan] gets hole card ['S7', 'C2'], current stack 895
player [KLChen2PokerPlayer] gets hole card ['SJ', 'HJ'], current stack 1136
Started the round 50
Street "preflop" started. (community card = [])
"Jinkun" declared "fold:10"
"YueShi" declared "fold:0"
"JoyoPlayer" declared "fold:0"
"ZifengFoldMan" declared "fold:0"
"KLChen2PokerPlayer" declared "raise:26"
"ZPlayer" declared "fold:0"
"NitWinWin" declared "fold:0"
"['KLChen2PokerPlayer']" won the round 50 (stack = {'ZPlayer': 563, 'NitWinWin': 925, 'Jinkun': 1592, 'YueShi': 895, 'JoyoPlayer': 1978, 'ZifengFoldMan': 895, 'EvanPlayer': 0, 'KLChen2PokerPlayer': 1151})

Game Results:
------------------------------------------------------------
Game 1:
Winner: JoyoPlayer (stack: 1978)
All players' stacks:
  ZPlayer: 563
  NitWinWin: 925
  Jinkun: 1592
  YueShi: 895
  JoyoPlayer: 1978
  ZifengFoldMan: 895
  EvanPlayer: 0
  KLChen2PokerPlayer: 1151
------------------------------------------------------------
