player [ZPlayer] gets hole card ['H7', 'C3'], current stack 1000
player [NitWinWin] gets hole card ['H2', 'S6'], current stack 995
player [Jinkun] gets hole card ['SK', 'D7'], current stack 990
player [YueShi] gets hole card ['H5', 'DA'], current stack 1000
player [JoyoPlayer] gets hole card ['D5', 'CQ'], current stack 1000
player [ZifengFoldMan] gets hole card ['CJ', 'HT'], current stack 1000
player [EvanPlayer] gets hole card ['H9', 'H8'], current stack 1000
player [KLChen2PokerPlayer] gets hole card ['HQ', 'HJ'], current stack 1000
Started the round 1
Street "preflop" started. (community card = [])
"YueShi" declared "fold:0"
"JoyoPlayer" declared "fold:0"
"ZifengFoldMan" declared "fold:0"
"EvanPlayer" declared "call:10"
"KLChen2PokerPlayer" declared "raise:27"
"ZPlayer" declared "fold:0"
"NitWinWin" declared "fold:0"
"Jinkun" declared "fold:27"
"EvanPlayer" declared "fold:27"
"['KLChen2PokerPlayer']" won the round 1 (stack = {'ZPlayer': 1000, 'NitWinWin': 995, 'Jinkun': 990, 'YueShi': 1000, 'JoyoPlayer': 1000, 'ZifengFoldMan': 1000, 'EvanPlayer': 990, 'KLChen2PokerPlayer': 1025})
player [ZPlayer] gets hole card ['S3', 'D4'], current stack 1000
player [NitWinWin] gets hole card ['H2', 'HJ'], current stack 995
player [Jinkun] gets hole card ['H5', 'D5'], current stack 985
player [YueShi] gets hole card ['ST', 'H7'], current stack 990
player [JoyoPlayer] gets hole card ['CT', 'D7'], current stack 1000
player [ZifengFoldMan] gets hole card ['C8', 'CA'], current stack 1000
player [EvanPlayer] gets hole card ['C5', 'HK'], current stack 990
player [KLChen2PokerPlayer] gets hole card ['H8', 'SA'], current stack 1025
Started the round 2
Street "preflop" started. (community card = [])
"JoyoPlayer" declared "raise:15"
"ZifengFoldMan" declared "fold:0"
"EvanPlayer" declared "raise:990"
"KLChen2PokerPlayer" declared "fold:0"
"ZPlayer" declared "fold:0"
"NitWinWin" declared "fold:0"
"Jinkun" declared "fold:990"
"YueShi" declared "fold:0"
"JoyoPlayer" declared "call:990"
Street "flop" started. (community card = ['DJ', 'SK', 'HA'])
Street "turn" started. (community card = ['DJ', 'SK', 'HA', 'CJ'])
Street "river" started. (community card = ['DJ', 'SK', 'HA', 'CJ', 'C7'])
"['EvanPlayer']" won the round 2 (stack = {'ZPlayer': 1000, 'NitWinWin': 995, 'Jinkun': 985, 'YueShi': 990, 'JoyoPlayer': 10, 'ZifengFoldMan': 1000, 'EvanPlayer': 1995, 'KLChen2PokerPlayer': 1025})
player [ZPlayer] gets hole card ['C8', 'C9'], current stack 1000
player [NitWinWin] gets hole card ['H9', 'C5'], current stack 995
player [Jinkun] gets hole card ['D7', 'S9'], current stack 985
player [YueShi] gets hole card ['S8', 'HQ'], current stack 985
player [JoyoPlayer] gets hole card ['S6', 'DT'], current stack 0
player [ZifengFoldMan] gets hole card ['HT', 'D3'], current stack 1000
player [EvanPlayer] gets hole card ['S5', 'DQ'], current stack 1995
player [KLChen2PokerPlayer] gets hole card ['H2', 'H5'], current stack 1025
Started the round 3
Street "preflop" started. (community card = [])
"ZifengFoldMan" declared "fold:0"
"EvanPlayer" declared "call:10"
"KLChen2PokerPlayer" declared "call:10"
"ZPlayer" declared "raise:15"
"NitWinWin" declared "fold:0"
"Jinkun" declared "fold:15"
"YueShi" declared "fold:0"
"JoyoPlayer" declared "fold:0"
"EvanPlayer" declared "raise:1995"
"KLChen2PokerPlayer" declared "fold:0"
"ZPlayer" declared "fold:0"
"['EvanPlayer']" won the round 3 (stack = {'ZPlayer': 985, 'NitWinWin': 995, 'Jinkun': 985, 'YueShi': 985, 'JoyoPlayer': 0, 'ZifengFoldMan': 1000, 'EvanPlayer': 2035, 'KLChen2PokerPlayer': 1015})
player [ZPlayer] gets hole card ['D6', 'DQ'], current stack 985
player [NitWinWin] gets hole card ['S7', 'H9'], current stack 995
player [Jinkun] gets hole card ['H8', 'S2'], current stack 985
player [YueShi] gets hole card ['S6', 'S5'], current stack 985
player [ZifengFoldMan] gets hole card ['S4', 'CK'], current stack 995
player [EvanPlayer] gets hole card ['HQ', 'HJ'], current stack 2025
player [KLChen2PokerPlayer] gets hole card ['DK', 'H7'], current stack 1015
Started the round 4
Street "preflop" started. (community card = [])
"KLChen2PokerPlayer" declared "call:10"
"ZPlayer" declared "raise:15"
"NitWinWin" declared "fold:0"
"Jinkun" declared "fold:15"
"YueShi" declared "fold:0"
"ZifengFoldMan" declared "fold:0"
"EvanPlayer" declared "call:15"
"KLChen2PokerPlayer" declared "raise:20"
"ZPlayer" declared "call:20"
"EvanPlayer" declared "call:20"
Street "flop" started. (community card = ['H3', 'HK', 'C9'])
"EvanPlayer" declared "raise:2015"
"KLChen2PokerPlayer" declared "fold:0"
"ZPlayer" declared "fold:0"
"['EvanPlayer']" won the round 4 (stack = {'ZPlayer': 965, 'NitWinWin': 995, 'Jinkun': 985, 'YueShi': 985, 'JoyoPlayer': 0, 'ZifengFoldMan': 995, 'EvanPlayer': 2080, 'KLChen2PokerPlayer': 995})
player [ZPlayer] gets hole card ['H6', 'SQ'], current stack 965
player [NitWinWin] gets hole card ['C5', 'CK'], current stack 995
player [Jinkun] gets hole card ['C7', 'S4'], current stack 985
player [YueShi] gets hole card ['H3', 'S8'], current stack 985
player [ZifengFoldMan] gets hole card ['D5', 'SA'], current stack 995
player [EvanPlayer] gets hole card ['HA', 'C9'], current stack 2075
player [KLChen2PokerPlayer] gets hole card ['CJ', 'S2'], current stack 985
Started the round 5
Street "preflop" started. (community card = [])
"ZPlayer" declared "call:10"
"NitWinWin" declared "fold:0"
"Jinkun" declared "fold:10"
"YueShi" declared "fold:0"
"ZifengFoldMan" declared "fold:0"
"EvanPlayer" declared "fold:10"
"KLChen2PokerPlayer" declared "call:10"
Street "flop" started. (community card = ['SJ', 'C8', 'DK'])
"KLChen2PokerPlayer" declared "raise:26"
"ZPlayer" declared "fold:0"
"['KLChen2PokerPlayer']" won the round 5 (stack = {'ZPlayer': 955, 'NitWinWin': 995, 'Jinkun': 985, 'YueShi': 985, 'JoyoPlayer': 0, 'ZifengFoldMan': 995, 'EvanPlayer': 2075, 'KLChen2PokerPlayer': 1010})
player [ZPlayer] gets hole card ['HQ', 'H6'], current stack 945
player [NitWinWin] gets hole card ['S6', 'SQ'], current stack 995
player [Jinkun] gets hole card ['CJ', 'HJ'], current stack 985
player [YueShi] gets hole card ['HA', 'D2'], current stack 985
player [ZifengFoldMan] gets hole card ['CA', 'SA'], current stack 995
player [EvanPlayer] gets hole card ['DJ', 'SK'], current stack 2075
player [KLChen2PokerPlayer] gets hole card ['CQ', 'C6'], current stack 1005
Started the round 6
Street "preflop" started. (community card = [])
"NitWinWin" declared "fold:0"
"Jinkun" declared "fold:10"
"YueShi" declared "fold:0"
"ZifengFoldMan" declared "fold:0"
"EvanPlayer" declared "fold:10"
"KLChen2PokerPlayer" declared "raise:27"
"ZPlayer" declared "call:27"
Street "flop" started. (community card = ['DQ', 'S5', 'H5'])
"KLChen2PokerPlayer" declared "raise:22"
"ZPlayer" declared "call:22"
Street "turn" started. (community card = ['DQ', 'S5', 'H5', 'S4'])
"KLChen2PokerPlayer" declared "raise:452"
"ZPlayer" declared "fold:0"
"['KLChen2PokerPlayer']" won the round 6 (stack = {'ZPlayer': 906, 'NitWinWin': 995, 'Jinkun': 985, 'YueShi': 985, 'JoyoPlayer': 0, 'ZifengFoldMan': 995, 'EvanPlayer': 2075, 'KLChen2PokerPlayer': 1059})
player [ZPlayer] gets hole card ['D7', 'SQ'], current stack 901
player [NitWinWin] gets hole card ['S9', 'HJ'], current stack 985
player [Jinkun] gets hole card ['CA', 'D9'], current stack 985
player [YueShi] gets hole card ['S2', 'D2'], current stack 985
player [ZifengFoldMan] gets hole card ['H7', 'DA'], current stack 995
player [EvanPlayer] gets hole card ['C2', 'H4'], current stack 2075
player [KLChen2PokerPlayer] gets hole card ['D4', 'H2'], current stack 1059
Started the round 7
Street "preflop" started. (community card = [])
"Jinkun" declared "fold:10"
"YueShi" declared "fold:0"
"ZifengFoldMan" declared "fold:0"
"EvanPlayer" declared "fold:10"
"KLChen2PokerPlayer" declared "fold:0"
"ZPlayer" declared "raise:15"
"NitWinWin" declared "fold:0"
"['ZPlayer']" won the round 7 (stack = {'ZPlayer': 916, 'NitWinWin': 985, 'Jinkun': 985, 'YueShi': 985, 'JoyoPlayer': 0, 'ZifengFoldMan': 995, 'EvanPlayer': 2075, 'KLChen2PokerPlayer': 1059})
player [ZPlayer] gets hole card ['C7', 'SJ'], current stack 916
player [NitWinWin] gets hole card ['H5', 'D2'], current stack 980
player [Jinkun] gets hole card ['D3', 'CJ'], current stack 975
player [YueShi] gets hole card ['DT', 'S7'], current stack 985
player [ZifengFoldMan] gets hole card ['DK', 'D7'], current stack 995
player [EvanPlayer] gets hole card ['H7', 'C9'], current stack 2075
player [KLChen2PokerPlayer] gets hole card ['CQ', 'HT'], current stack 1059
Started the round 8
Street "preflop" started. (community card = [])
"YueShi" declared "fold:0"
"ZifengFoldMan" declared "fold:0"
"EvanPlayer" declared "call:10"
"KLChen2PokerPlayer" declared "raise:15"
"ZPlayer" declared "call:15"
"NitWinWin" declared "fold:0"
"Jinkun" declared "fold:15"
"EvanPlayer" declared "fold:15"
Street "flop" started. (community card = ['C3', 'D8', 'S8'])
"KLChen2PokerPlayer" declared "call:0"
"ZPlayer" declared "call:0"
Street "turn" started. (community card = ['C3', 'D8', 'S8', 'CK'])
"KLChen2PokerPlayer" declared "call:0"
"ZPlayer" declared "call:0"
Street "river" started. (community card = ['C3', 'D8', 'S8', 'CK', 'ST'])
"KLChen2PokerPlayer" declared "raise:190"
"ZPlayer" declared "fold:0"
"['KLChen2PokerPlayer']" won the round 8 (stack = {'ZPlayer': 901, 'NitWinWin': 980, 'Jinkun': 975, 'YueShi': 985, 'JoyoPlayer': 0, 'ZifengFoldMan': 995, 'EvanPlayer': 2065, 'KLChen2PokerPlayer': 1099})
player [ZPlayer] gets hole card ['H4', 'H5'], current stack 901
player [NitWinWin] gets hole card ['C6', 'H7'], current stack 980
player [Jinkun] gets hole card ['S9', 'D9'], current stack 970
player [YueShi] gets hole card ['SQ', 'H8'], current stack 975
player [ZifengFoldMan] gets hole card ['CA', 'H2'], current stack 995
player [EvanPlayer] gets hole card ['C4', 'DT'], current stack 2065
player [KLChen2PokerPlayer] gets hole card ['S7', 'C8'], current stack 1099
Started the round 9
Street "preflop" started. (community card = [])
"ZifengFoldMan" declared "fold:0"
"EvanPlayer" declared "raise:2065"
"KLChen2PokerPlayer" declared "fold:0"
"ZPlayer" declared "fold:0"
"NitWinWin" declared "fold:0"
"Jinkun" declared "fold:2065"
"YueShi" declared "fold:0"
"['EvanPlayer']" won the round 9 (stack = {'ZPlayer': 901, 'NitWinWin': 980, 'Jinkun': 970, 'YueShi': 975, 'JoyoPlayer': 0, 'ZifengFoldMan': 995, 'EvanPlayer': 2080, 'KLChen2PokerPlayer': 1099})
player [ZPlayer] gets hole card ['CA', 'CT'], current stack 901
player [NitWinWin] gets hole card ['DJ', 'CJ'], current stack 980
player [Jinkun] gets hole card ['SJ', 'C5'], current stack 970
player [YueShi] gets hole card ['HK', 'H8'], current stack 970
player [ZifengFoldMan] gets hole card ['S8', 'D8'], current stack 985
player [EvanPlayer] gets hole card ['S7', 'C7'], current stack 2080
player [KLChen2PokerPlayer] gets hole card ['HQ', 'HJ'], current stack 1099
Started the round 10
Street "preflop" started. (community card = [])
"EvanPlayer" declared "raise:2080"
"KLChen2PokerPlayer" declared "fold:0"
"ZPlayer" declared "fold:0"
"NitWinWin" declared "fold:0"
"Jinkun" declared "fold:2080"
"YueShi" declared "fold:0"
"ZifengFoldMan" declared "fold:0"
"['EvanPlayer']" won the round 10 (stack = {'ZPlayer': 901, 'NitWinWin': 980, 'Jinkun': 970, 'YueShi': 970, 'JoyoPlayer': 0, 'ZifengFoldMan': 985, 'EvanPlayer': 2095, 'KLChen2PokerPlayer': 1099})
player [ZPlayer] gets hole card ['DT', 'DK'], current stack 901
player [NitWinWin] gets hole card ['HT', 'HQ'], current stack 980
player [Jinkun] gets hole card ['SA', 'D3'], current stack 970
player [YueShi] gets hole card ['H2', 'D4'], current stack 970
player [ZifengFoldMan] gets hole card ['D2', 'HJ'], current stack 980
player [EvanPlayer] gets hole card ['DA', 'D8'], current stack 2085
player [KLChen2PokerPlayer] gets hole card ['S5', 'CK'], current stack 1099
Started the round 11
Street "preflop" started. (community card = [])
"KLChen2PokerPlayer" declared "raise:15"
"ZPlayer" declared "call:15"
"NitWinWin" declared "fold:0"
"Jinkun" declared "fold:15"
"YueShi" declared "fold:0"
"ZifengFoldMan" declared "fold:0"
"EvanPlayer" declared "fold:15"
Street "flop" started. (community card = ['CA', 'S2', 'C7'])
"KLChen2PokerPlayer" declared "raise:10"
"ZPlayer" declared "fold:0"
"['KLChen2PokerPlayer']" won the round 11 (stack = {'ZPlayer': 886, 'NitWinWin': 980, 'Jinkun': 970, 'YueShi': 970, 'JoyoPlayer': 0, 'ZifengFoldMan': 980, 'EvanPlayer': 2085, 'KLChen2PokerPlayer': 1129})
player [ZPlayer] gets hole card ['S4', 'H2'], current stack 886
player [NitWinWin] gets hole card ['H5', 'DT'], current stack 980
player [Jinkun] gets hole card ['HK', 'C3'], current stack 970
player [YueShi] gets hole card ['D2', 'CA'], current stack 970
player [ZifengFoldMan] gets hole card ['HJ', 'SQ'], current stack 980
player [EvanPlayer] gets hole card ['CK', 'S5'], current stack 2080
player [KLChen2PokerPlayer] gets hole card ['S2', 'H4'], current stack 1119
Started the round 12
Street "preflop" started. (community card = [])
"ZPlayer" declared "call:10"
"NitWinWin" declared "fold:0"
"Jinkun" declared "fold:10"
"YueShi" declared "fold:0"
"ZifengFoldMan" declared "fold:0"
"EvanPlayer" declared "fold:10"
"KLChen2PokerPlayer" declared "fold:0"
"['ZPlayer']" won the round 12 (stack = {'ZPlayer': 901, 'NitWinWin': 980, 'Jinkun': 970, 'YueShi': 970, 'JoyoPlayer': 0, 'ZifengFoldMan': 980, 'EvanPlayer': 2080, 'KLChen2PokerPlayer': 1119})
player [ZPlayer] gets hole card ['H3', 'C9'], current stack 891
player [NitWinWin] gets hole card ['S8', 'HJ'], current stack 980
player [Jinkun] gets hole card ['CA', 'C6'], current stack 970
player [YueShi] gets hole card ['S3', 'DA'], current stack 970
player [ZifengFoldMan] gets hole card ['S4', 'CT'], current stack 980
player [EvanPlayer] gets hole card ['SQ', 'HT'], current stack 2080
player [KLChen2PokerPlayer] gets hole card ['H8', 'C8'], current stack 1114
Started the round 13
Street "preflop" started. (community card = [])
"NitWinWin" declared "fold:0"
"Jinkun" declared "fold:10"
"YueShi" declared "fold:0"
"ZifengFoldMan" declared "fold:0"
"EvanPlayer" declared "fold:10"
"KLChen2PokerPlayer" declared "raise:15"
"ZPlayer" declared "call:15"
Street "flop" started. (community card = ['H6', 'D2', 'D6'])
"KLChen2PokerPlayer" declared "raise:22"
"ZPlayer" declared "fold:0"
"['KLChen2PokerPlayer']" won the round 13 (stack = {'ZPlayer': 886, 'NitWinWin': 980, 'Jinkun': 970, 'YueShi': 970, 'JoyoPlayer': 0, 'ZifengFoldMan': 980, 'EvanPlayer': 2080, 'KLChen2PokerPlayer': 1134})
player [ZPlayer] gets hole card ['D8', 'C6'], current stack 881
player [NitWinWin] gets hole card ['H4', 'SK'], current stack 970
player [Jinkun] gets hole card ['D2', 'S8'], current stack 970
player [YueShi] gets hole card ['DA', 'SA'], current stack 970
player [ZifengFoldMan] gets hole card ['C8', 'D9'], current stack 980
player [EvanPlayer] gets hole card ['D7', 'S3'], current stack 2080
player [KLChen2PokerPlayer] gets hole card ['C2', 'H9'], current stack 1134
Started the round 14
Street "preflop" started. (community card = [])
"Jinkun" declared "fold:10"
"YueShi" declared "fold:0"
"ZifengFoldMan" declared "fold:0"
"EvanPlayer" declared "fold:10"
"KLChen2PokerPlayer" declared "fold:0"
"ZPlayer" declared "call:10"
"NitWinWin" declared "fold:0"
"['ZPlayer']" won the round 14 (stack = {'ZPlayer': 896, 'NitWinWin': 970, 'Jinkun': 970, 'YueShi': 970, 'JoyoPlayer': 0, 'ZifengFoldMan': 980, 'EvanPlayer': 2080, 'KLChen2PokerPlayer': 1134})
player [ZPlayer] gets hole card ['C7', 'D2'], current stack 896
player [NitWinWin] gets hole card ['H3', 'D6'], current stack 965
player [Jinkun] gets hole card ['H6', 'S3'], current stack 960
player [YueShi] gets hole card ['C6', 'DK'], current stack 970
player [ZifengFoldMan] gets hole card ['H8', 'C8'], current stack 980
player [EvanPlayer] gets hole card ['SA', 'H2'], current stack 2080
player [KLChen2PokerPlayer] gets hole card ['S8', 'HK'], current stack 1134
Started the round 15
Street "preflop" started. (community card = [])
"YueShi" declared "fold:0"
"ZifengFoldMan" declared "fold:0"
"EvanPlayer" declared "call:10"
"KLChen2PokerPlayer" declared "raise:17"
"ZPlayer" declared "fold:0"
"NitWinWin" declared "fold:0"
"Jinkun" declared "fold:17"
"EvanPlayer" declared "fold:17"
"['KLChen2PokerPlayer']" won the round 15 (stack = {'ZPlayer': 896, 'NitWinWin': 965, 'Jinkun': 960, 'YueShi': 970, 'JoyoPlayer': 0, 'ZifengFoldMan': 980, 'EvanPlayer': 2070, 'KLChen2PokerPlayer': 1159})
player [ZPlayer] gets hole card ['D9', 'S9'], current stack 896
player [NitWinWin] gets hole card ['DK', 'DA'], current stack 965
player [Jinkun] gets hole card ['S6', 'DJ'], current stack 955
player [YueShi] gets hole card ['H5', 'HT'], current stack 960
player [ZifengFoldMan] gets hole card ['H4', 'H3'], current stack 980
player [EvanPlayer] gets hole card ['HK', 'H2'], current stack 2070
player [KLChen2PokerPlayer] gets hole card ['S8', 'C3'], current stack 1159
Started the round 16
Street "preflop" started. (community card = [])
"ZifengFoldMan" declared "fold:0"
"EvanPlayer" declared "raise:2070"
"KLChen2PokerPlayer" declared "fold:0"
"ZPlayer" declared "fold:0"
"NitWinWin" declared "fold:0"
"Jinkun" declared "fold:2070"
"YueShi" declared "fold:0"
"['EvanPlayer']" won the round 16 (stack = {'ZPlayer': 896, 'NitWinWin': 965, 'Jinkun': 955, 'YueShi': 960, 'JoyoPlayer': 0, 'ZifengFoldMan': 980, 'EvanPlayer': 2085, 'KLChen2PokerPlayer': 1159})
player [ZPlayer] gets hole card ['D2', 'HT'], current stack 896
player [NitWinWin] gets hole card ['S9', 'DT'], current stack 965
player [Jinkun] gets hole card ['H3', 'S2'], current stack 955
player [YueShi] gets hole card ['HA', 'H5'], current stack 955
player [ZifengFoldMan] gets hole card ['D9', 'C8'], current stack 970
player [EvanPlayer] gets hole card ['CA', 'H6'], current stack 2085
player [KLChen2PokerPlayer] gets hole card ['H8', 'D3'], current stack 1159
Started the round 17
Street "preflop" started. (community card = [])
"EvanPlayer" declared "call:10"
"KLChen2PokerPlayer" declared "raise:19"
"ZPlayer" declared "call:19"
"NitWinWin" declared "fold:0"
"Jinkun" declared "fold:19"
"YueShi" declared "fold:0"
"ZifengFoldMan" declared "fold:0"
"EvanPlayer" declared "fold:19"
Street "flop" started. (community card = ['C2', 'HK', 'S4'])
"KLChen2PokerPlayer" declared "call:0"
"ZPlayer" declared "call:0"
Street "turn" started. (community card = ['C2', 'HK', 'S4', 'H4'])
"KLChen2PokerPlayer" declared "call:0"
"ZPlayer" declared "call:0"
Street "river" started. (community card = ['C2', 'HK', 'S4', 'H4', 'S5'])
"KLChen2PokerPlayer" declared "call:0"
"ZPlayer" declared "call:0"
"['ZPlayer']" won the round 17 (stack = {'ZPlayer': 940, 'NitWinWin': 965, 'Jinkun': 955, 'YueShi': 955, 'JoyoPlayer': 0, 'ZifengFoldMan': 970, 'EvanPlayer': 2075, 'KLChen2PokerPlayer': 1140})
player [ZPlayer] gets hole card ['D8', 'DA'], current stack 940
player [NitWinWin] gets hole card ['C8', 'CJ'], current stack 965
player [Jinkun] gets hole card ['ST', 'C3'], current stack 955
player [YueShi] gets hole card ['DK', 'S9'], current stack 955
player [ZifengFoldMan] gets hole card ['H2', 'SA'], current stack 965
player [EvanPlayer] gets hole card ['S2', 'D9'], current stack 2065
player [KLChen2PokerPlayer] gets hole card ['HQ', 'HA'], current stack 1140
Started the round 18
Street "preflop" started. (community card = [])
"KLChen2PokerPlayer" declared "raise:26"
"ZPlayer" declared "call:26"
"NitWinWin" declared "fold:0"
"Jinkun" declared "fold:26"
"YueShi" declared "fold:0"
"ZifengFoldMan" declared "fold:0"
"EvanPlayer" declared "fold:26"
Street "flop" started. (community card = ['C6', 'D5', 'SJ'])
"KLChen2PokerPlayer" declared "raise:15"
"ZPlayer" declared "fold:0"
"['KLChen2PokerPlayer']" won the round 18 (stack = {'ZPlayer': 914, 'NitWinWin': 965, 'Jinkun': 955, 'YueShi': 955, 'JoyoPlayer': 0, 'ZifengFoldMan': 965, 'EvanPlayer': 2065, 'KLChen2PokerPlayer': 1181})
player [ZPlayer] gets hole card ['H4', 'C4'], current stack 914
player [NitWinWin] gets hole card ['DA', 'ST'], current stack 965
player [Jinkun] gets hole card ['D3', 'DJ'], current stack 955
player [YueShi] gets hole card ['HA', 'D5'], current stack 955
player [ZifengFoldMan] gets hole card ['C3', 'D9'], current stack 965
player [EvanPlayer] gets hole card ['HQ', 'D4'], current stack 2060
player [KLChen2PokerPlayer] gets hole card ['C6', 'CQ'], current stack 1171
Started the round 19
Street "preflop" started. (community card = [])
"ZPlayer" declared "call:10"
"NitWinWin" declared "fold:0"
"Jinkun" declared "fold:10"
"YueShi" declared "fold:0"
"ZifengFoldMan" declared "fold:0"
"EvanPlayer" declared "fold:10"
"KLChen2PokerPlayer" declared "call:10"
Street "flop" started. (community card = ['D2', 'SJ', 'CA'])
"KLChen2PokerPlayer" declared "call:0"
"ZPlayer" declared "raise:10"
"KLChen2PokerPlayer" declared "fold:0"
"['ZPlayer']" won the round 19 (stack = {'ZPlayer': 929, 'NitWinWin': 965, 'Jinkun': 955, 'YueShi': 955, 'JoyoPlayer': 0, 'ZifengFoldMan': 965, 'EvanPlayer': 2060, 'KLChen2PokerPlayer': 1171})
player [ZPlayer] gets hole card ['HA', 'CJ'], current stack 919
player [NitWinWin] gets hole card ['S6', 'C5'], current stack 965
player [Jinkun] gets hole card ['DK', 'C8'], current stack 955
player [YueShi] gets hole card ['S8', 'CQ'], current stack 955
player [ZifengFoldMan] gets hole card ['C2', 'H8'], current stack 965
player [EvanPlayer] gets hole card ['HT', 'SA'], current stack 2060
player [KLChen2PokerPlayer] gets hole card ['CA', 'H7'], current stack 1166
Started the round 20
Street "preflop" started. (community card = [])
"NitWinWin" declared "fold:0"
"Jinkun" declared "fold:10"
"YueShi" declared "fold:0"
"ZifengFoldMan" declared "fold:0"
"EvanPlayer" declared "fold:10"
"KLChen2PokerPlayer" declared "raise:28"
"ZPlayer" declared "call:28"
Street "flop" started. (community card = ['D2', 'S2', 'S5'])
"KLChen2PokerPlayer" declared "raise:19"
"ZPlayer" declared "fold:0"
"['KLChen2PokerPlayer']" won the round 20 (stack = {'ZPlayer': 901, 'NitWinWin': 965, 'Jinkun': 955, 'YueShi': 955, 'JoyoPlayer': 0, 'ZifengFoldMan': 965, 'EvanPlayer': 2060, 'KLChen2PokerPlayer': 1199})
player [ZPlayer] gets hole card ['CQ', 'H5'], current stack 896
player [NitWinWin] gets hole card ['D5', 'C8'], current stack 955
player [Jinkun] gets hole card ['S7', 'H9'], current stack 955
player [YueShi] gets hole card ['HQ', 'H4'], current stack 955
player [ZifengFoldMan] gets hole card ['H7', 'H6'], current stack 965
player [EvanPlayer] gets hole card ['SJ', 'C2'], current stack 2060
player [KLChen2PokerPlayer] gets hole card ['C6', 'S8'], current stack 1199
Started the round 21
Street "preflop" started. (community card = [])
"Jinkun" declared "fold:10"
"YueShi" declared "fold:0"
"ZifengFoldMan" declared "fold:0"
"EvanPlayer" declared "fold:10"
"KLChen2PokerPlayer" declared "fold:0"
"ZPlayer" declared "raise:15"
"NitWinWin" declared "fold:0"
"['ZPlayer']" won the round 21 (stack = {'ZPlayer': 911, 'NitWinWin': 955, 'Jinkun': 955, 'YueShi': 955, 'JoyoPlayer': 0, 'ZifengFoldMan': 965, 'EvanPlayer': 2060, 'KLChen2PokerPlayer': 1199})
player [ZPlayer] gets hole card ['S6', 'C6'], current stack 911
player [NitWinWin] gets hole card ['HA', 'H8'], current stack 950
player [Jinkun] gets hole card ['H6', 'S2'], current stack 945
player [YueShi] gets hole card ['S5', 'S9'], current stack 955
player [ZifengFoldMan] gets hole card ['HK', 'C8'], current stack 965
player [EvanPlayer] gets hole card ['CA', 'HQ'], current stack 2060
player [KLChen2PokerPlayer] gets hole card ['H5', 'D6'], current stack 1199
Started the round 22
Street "preflop" started. (community card = [])
"YueShi" declared "fold:0"
"ZifengFoldMan" declared "fold:0"
"EvanPlayer" declared "raise:2060"
"KLChen2PokerPlayer" declared "fold:0"
"ZPlayer" declared "fold:0"
"NitWinWin" declared "fold:0"
"Jinkun" declared "fold:2060"
"['EvanPlayer']" won the round 22 (stack = {'ZPlayer': 911, 'NitWinWin': 950, 'Jinkun': 945, 'YueShi': 955, 'JoyoPlayer': 0, 'ZifengFoldMan': 965, 'EvanPlayer': 2075, 'KLChen2PokerPlayer': 1199})
player [ZPlayer] gets hole card ['H4', 'SA'], current stack 911
player [NitWinWin] gets hole card ['C3', 'S2'], current stack 950
player [Jinkun] gets hole card ['D8', 'C6'], current stack 940
player [YueShi] gets hole card ['H7', 'H5'], current stack 945
player [ZifengFoldMan] gets hole card ['C7', 'H2'], current stack 965
player [EvanPlayer] gets hole card ['D7', 'C9'], current stack 2075
player [KLChen2PokerPlayer] gets hole card ['HT', 'D3'], current stack 1199
Started the round 23
Street "preflop" started. (community card = [])
"ZifengFoldMan" declared "fold:0"
"EvanPlayer" declared "raise:2075"
"KLChen2PokerPlayer" declared "fold:0"
"ZPlayer" declared "fold:0"
"NitWinWin" declared "fold:0"
"Jinkun" declared "fold:2075"
"YueShi" declared "fold:0"
"['EvanPlayer']" won the round 23 (stack = {'ZPlayer': 911, 'NitWinWin': 950, 'Jinkun': 940, 'YueShi': 945, 'JoyoPlayer': 0, 'ZifengFoldMan': 965, 'EvanPlayer': 2090, 'KLChen2PokerPlayer': 1199})
player [ZPlayer] gets hole card ['H2', 'C4'], current stack 911
player [NitWinWin] gets hole card ['HA', 'DK'], current stack 950
player [Jinkun] gets hole card ['SK', 'H5'], current stack 940
player [YueShi] gets hole card ['DJ', 'ST'], current stack 940
player [ZifengFoldMan] gets hole card ['D8', 'DA'], current stack 955
player [EvanPlayer] gets hole card ['S8', 'CA'], current stack 2090
player [KLChen2PokerPlayer] gets hole card ['H7', 'H3'], current stack 1199
Started the round 24
Street "preflop" started. (community card = [])
"EvanPlayer" declared "raise:2090"
"KLChen2PokerPlayer" declared "fold:0"
"ZPlayer" declared "fold:0"
"NitWinWin" declared "fold:0"
"Jinkun" declared "fold:2090"
"YueShi" declared "fold:0"
"ZifengFoldMan" declared "fold:0"
"['EvanPlayer']" won the round 24 (stack = {'ZPlayer': 911, 'NitWinWin': 950, 'Jinkun': 940, 'YueShi': 940, 'JoyoPlayer': 0, 'ZifengFoldMan': 955, 'EvanPlayer': 2105, 'KLChen2PokerPlayer': 1199})
player [ZPlayer] gets hole card ['C7', 'S8'], current stack 911
player [NitWinWin] gets hole card ['CT', 'HQ'], current stack 950
player [Jinkun] gets hole card ['C3', 'H5'], current stack 940
player [YueShi] gets hole card ['D4', 'S3'], current stack 940
player [ZifengFoldMan] gets hole card ['HT', 'S2'], current stack 950
player [EvanPlayer] gets hole card ['CQ', 'CK'], current stack 2095
player [KLChen2PokerPlayer] gets hole card ['C6', 'H3'], current stack 1199
Started the round 25
Street "preflop" started. (community card = [])
"KLChen2PokerPlayer" declared "fold:0"
"ZPlayer" declared "call:10"
"NitWinWin" declared "fold:0"
"Jinkun" declared "fold:10"
"YueShi" declared "fold:0"
"ZifengFoldMan" declared "fold:0"
"EvanPlayer" declared "call:10"
Street "flop" started. (community card = ['D3', 'H9', 'S5'])
"EvanPlayer" declared "fold:0"
"['ZPlayer']" won the round 25 (stack = {'ZPlayer': 926, 'NitWinWin': 950, 'Jinkun': 940, 'YueShi': 940, 'JoyoPlayer': 0, 'ZifengFoldMan': 950, 'EvanPlayer': 2095, 'KLChen2PokerPlayer': 1199})
player [ZPlayer] gets hole card ['H2', 'SK'], current stack 926
player [NitWinWin] gets hole card ['C8', 'C3'], current stack 950
player [Jinkun] gets hole card ['S8', 'CQ'], current stack 940
player [YueShi] gets hole card ['DQ', 'H3'], current stack 940
player [ZifengFoldMan] gets hole card ['S6', 'CJ'], current stack 950
player [EvanPlayer] gets hole card ['SA', 'H4'], current stack 2090
player [KLChen2PokerPlayer] gets hole card ['D7', 'DT'], current stack 1189
Started the round 26
Street "preflop" started. (community card = [])
"ZPlayer" declared "call:10"
"NitWinWin" declared "fold:0"
"Jinkun" declared "fold:10"
"YueShi" declared "fold:0"
"ZifengFoldMan" declared "fold:0"
"EvanPlayer" declared "fold:10"
"KLChen2PokerPlayer" declared "call:10"
Street "flop" started. (community card = ['CT', 'D9', 'C7'])
"KLChen2PokerPlayer" declared "raise:35"
"ZPlayer" declared "fold:0"
"['KLChen2PokerPlayer']" won the round 26 (stack = {'ZPlayer': 916, 'NitWinWin': 950, 'Jinkun': 940, 'YueShi': 940, 'JoyoPlayer': 0, 'ZifengFoldMan': 950, 'EvanPlayer': 2090, 'KLChen2PokerPlayer': 1214})
player [ZPlayer] gets hole card ['H7', 'S7'], current stack 906
player [NitWinWin] gets hole card ['CA', 'H8'], current stack 950
player [Jinkun] gets hole card ['H4', 'SQ'], current stack 940
player [YueShi] gets hole card ['C6', 'DT'], current stack 940
player [ZifengFoldMan] gets hole card ['CK', 'C8'], current stack 950
player [EvanPlayer] gets hole card ['C4', 'S6'], current stack 2090
player [KLChen2PokerPlayer] gets hole card ['CJ', 'H2'], current stack 1209
Started the round 27
Street "preflop" started. (community card = [])
"NitWinWin" declared "fold:0"
"Jinkun" declared "fold:10"
"YueShi" declared "fold:0"
"ZifengFoldMan" declared "fold:0"
"EvanPlayer" declared "fold:10"
"KLChen2PokerPlayer" declared "call:10"
"ZPlayer" declared "raise:15"
"KLChen2PokerPlayer" declared "fold:0"
"['ZPlayer']" won the round 27 (stack = {'ZPlayer': 926, 'NitWinWin': 950, 'Jinkun': 940, 'YueShi': 940, 'JoyoPlayer': 0, 'ZifengFoldMan': 950, 'EvanPlayer': 2090, 'KLChen2PokerPlayer': 1204})
player [ZPlayer] gets hole card ['HA', 'C2'], current stack 921
player [NitWinWin] gets hole card ['C9', 'DQ'], current stack 940
player [Jinkun] gets hole card ['SA', 'HJ'], current stack 940
player [YueShi] gets hole card ['D9', 'ST'], current stack 940
player [ZifengFoldMan] gets hole card ['H7', 'S2'], current stack 950
player [EvanPlayer] gets hole card ['C5', 'S9'], current stack 2090
player [KLChen2PokerPlayer] gets hole card ['CQ', 'S6'], current stack 1204
Started the round 28
Street "preflop" started. (community card = [])
"Jinkun" declared "fold:10"
"YueShi" declared "fold:0"
"ZifengFoldMan" declared "fold:0"
"EvanPlayer" declared "fold:10"
"KLChen2PokerPlayer" declared "raise:15"
"ZPlayer" declared "call:15"
"NitWinWin" declared "fold:0"
Street "flop" started. (community card = ['CA', 'HQ', 'CT'])
"ZPlayer" declared "raise:119"
"KLChen2PokerPlayer" declared "fold:0"
"['ZPlayer']" won the round 28 (stack = {'ZPlayer': 951, 'NitWinWin': 940, 'Jinkun': 940, 'YueShi': 940, 'JoyoPlayer': 0, 'ZifengFoldMan': 950, 'EvanPlayer': 2090, 'KLChen2PokerPlayer': 1189})
player [ZPlayer] gets hole card ['HA', 'CQ'], current stack 951
player [NitWinWin] gets hole card ['SJ', 'H5'], current stack 935
player [Jinkun] gets hole card ['ST', 'D6'], current stack 930
player [YueShi] gets hole card ['SQ', 'S6'], current stack 940
player [ZifengFoldMan] gets hole card ['S3', 'D8'], current stack 950
player [EvanPlayer] gets hole card ['CJ', 'C3'], current stack 2090
player [KLChen2PokerPlayer] gets hole card ['DJ', 'H2'], current stack 1189
Started the round 29
Street "preflop" started. (community card = [])
"YueShi" declared "fold:0"
"ZifengFoldMan" declared "fold:0"
"EvanPlayer" declared "call:10"
"KLChen2PokerPlayer" declared "fold:0"
"ZPlayer" declared "raise:15"
"NitWinWin" declared "fold:0"
"Jinkun" declared "fold:15"
"EvanPlayer" declared "fold:15"
"['ZPlayer']" won the round 29 (stack = {'ZPlayer': 976, 'NitWinWin': 935, 'Jinkun': 930, 'YueShi': 940, 'JoyoPlayer': 0, 'ZifengFoldMan': 950, 'EvanPlayer': 2080, 'KLChen2PokerPlayer': 1189})
player [ZPlayer] gets hole card ['D9', 'HJ'], current stack 976
player [NitWinWin] gets hole card ['S3', 'C3'], current stack 935
player [Jinkun] gets hole card ['C4', 'HA'], current stack 925
player [YueShi] gets hole card ['S4', 'D8'], current stack 930
player [ZifengFoldMan] gets hole card ['D5', 'HQ'], current stack 950
player [EvanPlayer] gets hole card ['H7', 'H3'], current stack 2080
player [KLChen2PokerPlayer] gets hole card ['D7', 'S7'], current stack 1189
Started the round 30
Street "preflop" started. (community card = [])
"ZifengFoldMan" declared "fold:0"
"EvanPlayer" declared "call:10"
"KLChen2PokerPlayer" declared "raise:17"
"ZPlayer" declared "fold:0"
"NitWinWin" declared "fold:0"
"Jinkun" declared "fold:17"
"YueShi" declared "fold:0"
"EvanPlayer" declared "fold:17"
"['KLChen2PokerPlayer']" won the round 30 (stack = {'ZPlayer': 976, 'NitWinWin': 935, 'Jinkun': 925, 'YueShi': 930, 'JoyoPlayer': 0, 'ZifengFoldMan': 950, 'EvanPlayer': 2070, 'KLChen2PokerPlayer': 1214})
player [ZPlayer] gets hole card ['C5', 'DQ'], current stack 976
player [NitWinWin] gets hole card ['C2', 'DA'], current stack 935
player [Jinkun] gets hole card ['SJ', 'HA'], current stack 925
player [YueShi] gets hole card ['H2', 'H9'], current stack 925
player [ZifengFoldMan] gets hole card ['S2', 'D7'], current stack 940
player [EvanPlayer] gets hole card ['SK', 'H6'], current stack 2070
player [KLChen2PokerPlayer] gets hole card ['HJ', 'SQ'], current stack 1214
Started the round 31
Street "preflop" started. (community card = [])
"EvanPlayer" declared "call:10"
"KLChen2PokerPlayer" declared "raise:24"
"ZPlayer" declared "call:24"
"NitWinWin" declared "fold:0"
"Jinkun" declared "fold:24"
"YueShi" declared "fold:0"
"ZifengFoldMan" declared "fold:0"
"EvanPlayer" declared "fold:24"
Street "flop" started. (community card = ['C7', 'D4', 'ST'])
"KLChen2PokerPlayer" declared "call:0"
"ZPlayer" declared "call:0"
Street "turn" started. (community card = ['C7', 'D4', 'ST', 'C6'])
"KLChen2PokerPlayer" declared "call:0"
"ZPlayer" declared "call:0"
Street "river" started. (community card = ['C7', 'D4', 'ST', 'C6', 'S5'])
"KLChen2PokerPlayer" declared "call:0"
"ZPlayer" declared "call:0"
"['ZPlayer']" won the round 31 (stack = {'ZPlayer': 1025, 'NitWinWin': 935, 'Jinkun': 925, 'YueShi': 925, 'JoyoPlayer': 0, 'ZifengFoldMan': 940, 'EvanPlayer': 2060, 'KLChen2PokerPlayer': 1190})
player [ZPlayer] gets hole card ['D5', 'S7'], current stack 1025
player [NitWinWin] gets hole card ['H3', 'D6'], current stack 935
player [Jinkun] gets hole card ['DQ', 'HJ'], current stack 925
player [YueShi] gets hole card ['C2', 'S8'], current stack 925
player [ZifengFoldMan] gets hole card ['H4', 'HA'], current stack 935
player [EvanPlayer] gets hole card ['S9', 'C6'], current stack 2050
player [KLChen2PokerPlayer] gets hole card ['D3', 'SK'], current stack 1190
Started the round 32
Street "preflop" started. (community card = [])
"KLChen2PokerPlayer" declared "call:10"
"ZPlayer" declared "call:10"
"NitWinWin" declared "fold:0"
"Jinkun" declared "fold:10"
"YueShi" declared "fold:0"
"ZifengFoldMan" declared "fold:0"
"EvanPlayer" declared "raise:2060"
"KLChen2PokerPlayer" declared "fold:0"
"ZPlayer" declared "fold:0"
"['EvanPlayer']" won the round 32 (stack = {'ZPlayer': 1015, 'NitWinWin': 935, 'Jinkun': 925, 'YueShi': 925, 'JoyoPlayer': 0, 'ZifengFoldMan': 935, 'EvanPlayer': 2085, 'KLChen2PokerPlayer': 1180})
player [ZPlayer] gets hole card ['DQ', 'S8'], current stack 1015
player [NitWinWin] gets hole card ['H9', 'C3'], current stack 935
player [Jinkun] gets hole card ['D9', 'C9'], current stack 925
player [YueShi] gets hole card ['S4', 'D4'], current stack 925
player [ZifengFoldMan] gets hole card ['C4', 'CK'], current stack 935
player [EvanPlayer] gets hole card ['C8', 'DJ'], current stack 2080
player [KLChen2PokerPlayer] gets hole card ['HT', 'C7'], current stack 1170
Started the round 33
Street "preflop" started. (community card = [])
"ZPlayer" declared "call:10"
"NitWinWin" declared "fold:0"
"Jinkun" declared "fold:10"
"YueShi" declared "fold:0"
"ZifengFoldMan" declared "fold:0"
"EvanPlayer" declared "fold:10"
"KLChen2PokerPlayer" declared "raise:15"
"ZPlayer" declared "call:15"
Street "flop" started. (community card = ['CT', 'CQ', 'D8'])
"KLChen2PokerPlayer" declared "raise:20"
"ZPlayer" declared "raise:40"
"KLChen2PokerPlayer" declared "fold:0"
"['ZPlayer']" won the round 33 (stack = {'ZPlayer': 1055, 'NitWinWin': 935, 'Jinkun': 925, 'YueShi': 925, 'JoyoPlayer': 0, 'ZifengFoldMan': 935, 'EvanPlayer': 2080, 'KLChen2PokerPlayer': 1145})
player [ZPlayer] gets hole card ['H9', 'D9'], current stack 1045
player [NitWinWin] gets hole card ['S9', 'S4'], current stack 935
player [Jinkun] gets hole card ['SA', 'S5'], current stack 925
player [YueShi] gets hole card ['S7', 'S8'], current stack 925
player [ZifengFoldMan] gets hole card ['C4', 'C9'], current stack 935
player [EvanPlayer] gets hole card ['S6', 'HK'], current stack 2080
player [KLChen2PokerPlayer] gets hole card ['D6', 'D5'], current stack 1140
Started the round 34
Street "preflop" started. (community card = [])
"NitWinWin" declared "fold:0"
"Jinkun" declared "fold:10"
"YueShi" declared "fold:0"
"ZifengFoldMan" declared "fold:0"
"EvanPlayer" declared "fold:10"
"KLChen2PokerPlayer" declared "call:10"
"ZPlayer" declared "raise:15"
"KLChen2PokerPlayer" declared "fold:0"
"['ZPlayer']" won the round 34 (stack = {'ZPlayer': 1065, 'NitWinWin': 935, 'Jinkun': 925, 'YueShi': 925, 'JoyoPlayer': 0, 'ZifengFoldMan': 935, 'EvanPlayer': 2080, 'KLChen2PokerPlayer': 1135})
player [ZPlayer] gets hole card ['S3', 'DJ'], current stack 1060
player [NitWinWin] gets hole card ['H8', 'S4'], current stack 925
player [Jinkun] gets hole card ['HJ', 'D9'], current stack 925
player [YueShi] gets hole card ['SJ', 'H7'], current stack 925
player [ZifengFoldMan] gets hole card ['HA', 'D4'], current stack 935
player [EvanPlayer] gets hole card ['CQ', 'H5'], current stack 2080
player [KLChen2PokerPlayer] gets hole card ['H2', 'S2'], current stack 1135
Started the round 35
Street "preflop" started. (community card = [])
"Jinkun" declared "fold:10"
"YueShi" declared "fold:0"
"ZifengFoldMan" declared "fold:0"
"EvanPlayer" declared "fold:10"
"KLChen2PokerPlayer" declared "call:10"
"ZPlayer" declared "call:10"
"NitWinWin" declared "fold:0"
Street "flop" started. (community card = ['C4', 'SK', 'H9'])
"ZPlayer" declared "call:0"
"KLChen2PokerPlayer" declared "call:0"
Street "turn" started. (community card = ['C4', 'SK', 'H9', 'HQ'])
"ZPlayer" declared "call:0"
"KLChen2PokerPlayer" declared "call:0"
Street "river" started. (community card = ['C4', 'SK', 'H9', 'HQ', 'S8'])
"ZPlayer" declared "call:0"
"KLChen2PokerPlayer" declared "call:0"
"['KLChen2PokerPlayer']" won the round 35 (stack = {'ZPlayer': 1055, 'NitWinWin': 925, 'Jinkun': 925, 'YueShi': 925, 'JoyoPlayer': 0, 'ZifengFoldMan': 935, 'EvanPlayer': 2080, 'KLChen2PokerPlayer': 1155})
player [ZPlayer] gets hole card ['H4', 'DJ'], current stack 1055
player [NitWinWin] gets hole card ['HJ', 'D3'], current stack 920
player [Jinkun] gets hole card ['S8', 'D2'], current stack 915
player [YueShi] gets hole card ['CQ', 'H7'], current stack 925
player [ZifengFoldMan] gets hole card ['C8', 'SQ'], current stack 935
player [EvanPlayer] gets hole card ['C4', 'S5'], current stack 2080
player [KLChen2PokerPlayer] gets hole card ['H2', 'D6'], current stack 1155
Started the round 36
Street "preflop" started. (community card = [])
"YueShi" declared "fold:0"
"ZifengFoldMan" declared "fold:0"
"EvanPlayer" declared "call:10"
"KLChen2PokerPlayer" declared "fold:0"
"ZPlayer" declared "call:10"
"NitWinWin" declared "fold:0"
"Jinkun" declared "call:10"
Street "flop" started. (community card = ['C3', 'DK', 'H3'])
"Jinkun" declared "call:0"
"EvanPlayer" declared "fold:0"
"ZPlayer" declared "call:0"
Street "turn" started. (community card = ['C3', 'DK', 'H3', 'D9'])
"Jinkun" declared "call:0"
"ZPlayer" declared "call:0"
Street "river" started. (community card = ['C3', 'DK', 'H3', 'D9', 'H8'])
"Jinkun" declared "call:0"
"ZPlayer" declared "call:0"
"['Jinkun']" won the round 36 (stack = {'ZPlayer': 1045, 'NitWinWin': 920, 'Jinkun': 950, 'YueShi': 925, 'JoyoPlayer': 0, 'ZifengFoldMan': 935, 'EvanPlayer': 2070, 'KLChen2PokerPlayer': 1155})
player [ZPlayer] gets hole card ['HQ', 'C8'], current stack 1045
player [NitWinWin] gets hole card ['D4', 'HA'], current stack 920
player [Jinkun] gets hole card ['S9', 'H9'], current stack 945
player [YueShi] gets hole card ['C9', 'H2'], current stack 915
player [ZifengFoldMan] gets hole card ['C7', 'CA'], current stack 935
player [EvanPlayer] gets hole card ['D3', 'S5'], current stack 2070
player [KLChen2PokerPlayer] gets hole card ['H4', 'C3'], current stack 1155
Started the round 37
Street "preflop" started. (community card = [])
"ZifengFoldMan" declared "fold:0"
"EvanPlayer" declared "call:10"
"KLChen2PokerPlayer" declared "raise:15"
"ZPlayer" declared "call:15"
"NitWinWin" declared "fold:0"
"Jinkun" declared "call:15"
"YueShi" declared "fold:0"
"EvanPlayer" declared "fold:15"
Street "flop" started. (community card = ['SQ', 'S2', 'HK'])
"Jinkun" declared "call:0"
"KLChen2PokerPlayer" declared "call:0"
"ZPlayer" declared "raise:32"
"Jinkun" declared "call:32"
"KLChen2PokerPlayer" declared "fold:0"
Street "turn" started. (community card = ['SQ', 'S2', 'HK', 'CQ'])
"Jinkun" declared "call:0"
"ZPlayer" declared "raise:129"
"Jinkun" declared "call:129"
Street "river" started. (community card = ['SQ', 'S2', 'HK', 'CQ', 'S3'])
"Jinkun" declared "call:0"
"ZPlayer" declared "raise:387"
"Jinkun" declared "call:387"
"['ZPlayer']" won the round 37 (stack = {'ZPlayer': 1643, 'NitWinWin': 920, 'Jinkun': 387, 'YueShi': 915, 'JoyoPlayer': 0, 'ZifengFoldMan': 935, 'EvanPlayer': 2060, 'KLChen2PokerPlayer': 1140})
player [ZPlayer] gets hole card ['DK', 'DT'], current stack 1643
player [NitWinWin] gets hole card ['SA', 'C3'], current stack 920
player [Jinkun] gets hole card ['DJ', 'S7'], current stack 387
player [YueShi] gets hole card ['D7', 'D8'], current stack 910
player [ZifengFoldMan] gets hole card ['H4', 'HQ'], current stack 925
player [EvanPlayer] gets hole card ['ST', 'D6'], current stack 2060
player [KLChen2PokerPlayer] gets hole card ['S9', 'H9'], current stack 1140
Started the round 38
Street "preflop" started. (community card = [])
"EvanPlayer" declared "raise:2060"
"KLChen2PokerPlayer" declared "fold:0"
"ZPlayer" declared "fold:0"
"NitWinWin" declared "fold:0"
"Jinkun" declared "fold:2060"
"YueShi" declared "fold:0"
"ZifengFoldMan" declared "fold:0"
"['EvanPlayer']" won the round 38 (stack = {'ZPlayer': 1643, 'NitWinWin': 920, 'Jinkun': 387, 'YueShi': 910, 'JoyoPlayer': 0, 'ZifengFoldMan': 925, 'EvanPlayer': 2075, 'KLChen2PokerPlayer': 1140})
player [ZPlayer] gets hole card ['H6', 'SA'], current stack 1643
player [NitWinWin] gets hole card ['S9', 'S4'], current stack 920
player [Jinkun] gets hole card ['HA', 'S7'], current stack 387
player [YueShi] gets hole card ['C5', 'DK'], current stack 910
player [ZifengFoldMan] gets hole card ['CK', 'SQ'], current stack 920
player [EvanPlayer] gets hole card ['H7', 'CT'], current stack 2065
player [KLChen2PokerPlayer] gets hole card ['D8', 'CQ'], current stack 1140
Started the round 39
Street "preflop" started. (community card = [])
"KLChen2PokerPlayer" declared "raise:18"
"ZPlayer" declared "raise:26"
"NitWinWin" declared "fold:0"
"Jinkun" declared "fold:26"
"YueShi" declared "fold:0"
"ZifengFoldMan" declared "fold:0"
"EvanPlayer" declared "fold:26"
"KLChen2PokerPlayer" declared "fold:0"
"['ZPlayer']" won the round 39 (stack = {'ZPlayer': 1676, 'NitWinWin': 920, 'Jinkun': 387, 'YueShi': 910, 'JoyoPlayer': 0, 'ZifengFoldMan': 920, 'EvanPlayer': 2065, 'KLChen2PokerPlayer': 1122})
player [ZPlayer] gets hole card ['C5', 'H7'], current stack 1676
player [NitWinWin] gets hole card ['S5', 'DQ'], current stack 920
player [Jinkun] gets hole card ['H4', 'H5'], current stack 387
player [YueShi] gets hole card ['ST', 'HK'], current stack 910
player [ZifengFoldMan] gets hole card ['S4', 'C8'], current stack 920
player [EvanPlayer] gets hole card ['H8', 'C7'], current stack 2060
player [KLChen2PokerPlayer] gets hole card ['H6', 'C2'], current stack 1112
Started the round 40
Street "preflop" started. (community card = [])
"ZPlayer" declared "raise:15"
"NitWinWin" declared "fold:0"
"Jinkun" declared "fold:15"
"YueShi" declared "fold:0"
"ZifengFoldMan" declared "fold:0"
"EvanPlayer" declared "fold:15"
"KLChen2PokerPlayer" declared "fold:0"
"['ZPlayer']" won the round 40 (stack = {'ZPlayer': 1691, 'NitWinWin': 920, 'Jinkun': 387, 'YueShi': 910, 'JoyoPlayer': 0, 'ZifengFoldMan': 920, 'EvanPlayer': 2060, 'KLChen2PokerPlayer': 1112})
player [ZPlayer] gets hole card ['CT', 'H9'], current stack 1681
player [NitWinWin] gets hole card ['H3', 'CJ'], current stack 920
player [Jinkun] gets hole card ['DJ', 'H6'], current stack 387
player [YueShi] gets hole card ['D6', 'H5'], current stack 910
player [ZifengFoldMan] gets hole card ['S8', 'HK'], current stack 920
player [EvanPlayer] gets hole card ['C3', 'D3'], current stack 2060
player [KLChen2PokerPlayer] gets hole card ['S5', 'C6'], current stack 1107
Started the round 41
Street "preflop" started. (community card = [])
"NitWinWin" declared "fold:0"
"Jinkun" declared "fold:10"
"YueShi" declared "fold:0"
"ZifengFoldMan" declared "fold:0"
"EvanPlayer" declared "fold:10"
"KLChen2PokerPlayer" declared "fold:0"
"['ZPlayer']" won the round 41 (stack = {'ZPlayer': 1696, 'NitWinWin': 920, 'Jinkun': 387, 'YueShi': 910, 'JoyoPlayer': 0, 'ZifengFoldMan': 920, 'EvanPlayer': 2060, 'KLChen2PokerPlayer': 1107})
player [ZPlayer] gets hole card ['S9', 'S3'], current stack 1691
player [NitWinWin] gets hole card ['D6', 'DA'], current stack 910
player [Jinkun] gets hole card ['H4', 'D7'], current stack 387
player [YueShi] gets hole card ['CK', 'D5'], current stack 910
player [ZifengFoldMan] gets hole card ['HK', 'C5'], current stack 920
player [EvanPlayer] gets hole card ['H6', 'D8'], current stack 2060
player [KLChen2PokerPlayer] gets hole card ['S2', 'HT'], current stack 1107
Started the round 42
Street "preflop" started. (community card = [])
"Jinkun" declared "fold:10"
"YueShi" declared "fold:0"
"ZifengFoldMan" declared "fold:0"
"EvanPlayer" declared "fold:10"
"KLChen2PokerPlayer" declared "call:10"
"ZPlayer" declared "raise:15"
"NitWinWin" declared "fold:0"
"KLChen2PokerPlayer" declared "fold:0"
"['ZPlayer']" won the round 42 (stack = {'ZPlayer': 1716, 'NitWinWin': 910, 'Jinkun': 387, 'YueShi': 910, 'JoyoPlayer': 0, 'ZifengFoldMan': 920, 'EvanPlayer': 2060, 'KLChen2PokerPlayer': 1097})
player [ZPlayer] gets hole card ['C3', 'D9'], current stack 1716
player [NitWinWin] gets hole card ['H9', 'S5'], current stack 905
player [Jinkun] gets hole card ['C6', 'CA'], current stack 377
player [YueShi] gets hole card ['CQ', 'HQ'], current stack 910
player [ZifengFoldMan] gets hole card ['D8', 'C5'], current stack 920
player [EvanPlayer] gets hole card ['D3', 'S9'], current stack 2060
player [KLChen2PokerPlayer] gets hole card ['DK', 'HK'], current stack 1097
Started the round 43
Street "preflop" started. (community card = [])
"YueShi" declared "fold:0"
"ZifengFoldMan" declared "fold:0"
"EvanPlayer" declared "fold:10"
"KLChen2PokerPlayer" declared "raise:23"
"ZPlayer" declared "raise:36"
"NitWinWin" declared "fold:0"
"Jinkun" declared "fold:36"
"KLChen2PokerPlayer" declared "call:36"
Street "flop" started. (community card = ['S3', 'H8', 'C4'])
"KLChen2PokerPlayer" declared "raise:22"
"ZPlayer" declared "fold:0"
"['KLChen2PokerPlayer']" won the round 43 (stack = {'ZPlayer': 1680, 'NitWinWin': 905, 'Jinkun': 377, 'YueShi': 910, 'JoyoPlayer': 0, 'ZifengFoldMan': 920, 'EvanPlayer': 2060, 'KLChen2PokerPlayer': 1148})
player [ZPlayer] gets hole card ['CK', 'H3'], current stack 1680
player [NitWinWin] gets hole card ['DK', 'C3'], current stack 905
player [Jinkun] gets hole card ['H7', 'C9'], current stack 372
player [YueShi] gets hole card ['C4', 'S6'], current stack 900
player [ZifengFoldMan] gets hole card ['S2', 'C5'], current stack 920
player [EvanPlayer] gets hole card ['H4', 'H9'], current stack 2060
player [KLChen2PokerPlayer] gets hole card ['S5', 'SA'], current stack 1148
Started the round 44
Street "preflop" started. (community card = [])
"ZifengFoldMan" declared "fold:0"
"EvanPlayer" declared "raise:2060"
"KLChen2PokerPlayer" declared "fold:0"
"ZPlayer" declared "fold:0"
"NitWinWin" declared "fold:0"
"Jinkun" declared "fold:2060"
"YueShi" declared "fold:0"
"['EvanPlayer']" won the round 44 (stack = {'ZPlayer': 1680, 'NitWinWin': 905, 'Jinkun': 372, 'YueShi': 900, 'JoyoPlayer': 0, 'ZifengFoldMan': 920, 'EvanPlayer': 2075, 'KLChen2PokerPlayer': 1148})
player [ZPlayer] gets hole card ['D6', 'H7'], current stack 1680
player [NitWinWin] gets hole card ['H5', 'C6'], current stack 905
player [Jinkun] gets hole card ['D9', 'C7'], current stack 372
player [YueShi] gets hole card ['D2', 'D3'], current stack 895
player [ZifengFoldMan] gets hole card ['DA', 'DJ'], current stack 910
player [EvanPlayer] gets hole card ['C8', 'CT'], current stack 2075
player [KLChen2PokerPlayer] gets hole card ['S6', 'D4'], current stack 1148
Started the round 45
Street "preflop" started. (community card = [])
"EvanPlayer" declared "raise:2075"
"KLChen2PokerPlayer" declared "fold:0"
"ZPlayer" declared "fold:0"
"NitWinWin" declared "fold:0"
"Jinkun" declared "fold:2075"
"YueShi" declared "fold:0"
"ZifengFoldMan" declared "fold:0"
"['EvanPlayer']" won the round 45 (stack = {'ZPlayer': 1680, 'NitWinWin': 905, 'Jinkun': 372, 'YueShi': 895, 'JoyoPlayer': 0, 'ZifengFoldMan': 910, 'EvanPlayer': 2090, 'KLChen2PokerPlayer': 1148})
player [ZPlayer] gets hole card ['S9', 'DJ'], current stack 1680
player [NitWinWin] gets hole card ['C3', 'SK'], current stack 905
player [Jinkun] gets hole card ['H4', 'S6'], current stack 372
player [YueShi] gets hole card ['ST', 'H5'], current stack 895
player [ZifengFoldMan] gets hole card ['D7', 'C4'], current stack 905
player [EvanPlayer] gets hole card ['D4', 'D8'], current stack 2080
player [KLChen2PokerPlayer] gets hole card ['SJ', 'HA'], current stack 1148
Started the round 46
Street "preflop" started. (community card = [])
"KLChen2PokerPlayer" declared "raise:16"
"ZPlayer" declared "raise:22"
"NitWinWin" declared "fold:0"
"Jinkun" declared "fold:22"
"YueShi" declared "fold:0"
"ZifengFoldMan" declared "fold:0"
"EvanPlayer" declared "fold:22"
"KLChen2PokerPlayer" declared "raise:28"
"ZPlayer" declared "call:28"
Street "flop" started. (community card = ['HQ', 'D3', 'S5'])
"KLChen2PokerPlayer" declared "raise:10"
"ZPlayer" declared "fold:0"
"['KLChen2PokerPlayer']" won the round 46 (stack = {'ZPlayer': 1652, 'NitWinWin': 905, 'Jinkun': 372, 'YueShi': 895, 'JoyoPlayer': 0, 'ZifengFoldMan': 905, 'EvanPlayer': 2080, 'KLChen2PokerPlayer': 1191})
player [ZPlayer] gets hole card ['S7', 'C8'], current stack 1652
player [NitWinWin] gets hole card ['C6', 'H9'], current stack 905
player [Jinkun] gets hole card ['H4', 'D7'], current stack 372
player [YueShi] gets hole card ['H8', 'D4'], current stack 895
player [ZifengFoldMan] gets hole card ['S8', 'SK'], current stack 905
player [EvanPlayer] gets hole card ['DQ', 'S5'], current stack 2075
player [KLChen2PokerPlayer] gets hole card ['S6', 'S4'], current stack 1181
Started the round 47
Street "preflop" started. (community card = [])
"ZPlayer" declared "raise:15"
"NitWinWin" declared "fold:0"
"Jinkun" declared "fold:15"
"YueShi" declared "fold:0"
"ZifengFoldMan" declared "fold:0"
"EvanPlayer" declared "fold:15"
"KLChen2PokerPlayer" declared "fold:0"
"['ZPlayer']" won the round 47 (stack = {'ZPlayer': 1667, 'NitWinWin': 905, 'Jinkun': 372, 'YueShi': 895, 'JoyoPlayer': 0, 'ZifengFoldMan': 905, 'EvanPlayer': 2075, 'KLChen2PokerPlayer': 1181})
player [ZPlayer] gets hole card ['C3', 'S3'], current stack 1657
player [NitWinWin] gets hole card ['D4', 'H2'], current stack 905
player [Jinkun] gets hole card ['H7', 'S9'], current stack 372
player [YueShi] gets hole card ['HA', 'H3'], current stack 895
player [ZifengFoldMan] gets hole card ['D6', 'D8'], current stack 905
player [EvanPlayer] gets hole card ['D7', 'CK'], current stack 2075
player [KLChen2PokerPlayer] gets hole card ['D5', 'D3'], current stack 1176
Started the round 48
Street "preflop" started. (community card = [])
"NitWinWin" declared "fold:0"
"Jinkun" declared "fold:10"
"YueShi" declared "fold:0"
"ZifengFoldMan" declared "fold:0"
"EvanPlayer" declared "fold:10"
"KLChen2PokerPlayer" declared "fold:0"
"['ZPlayer']" won the round 48 (stack = {'ZPlayer': 1672, 'NitWinWin': 905, 'Jinkun': 372, 'YueShi': 895, 'JoyoPlayer': 0, 'ZifengFoldMan': 905, 'EvanPlayer': 2075, 'KLChen2PokerPlayer': 1176})
player [ZPlayer] gets hole card ['CJ', 'D7'], current stack 1667
player [NitWinWin] gets hole card ['HK', 'D9'], current stack 895
player [Jinkun] gets hole card ['C6', 'H9'], current stack 372
player [YueShi] gets hole card ['HT', 'H2'], current stack 895
player [ZifengFoldMan] gets hole card ['C4', 'H7'], current stack 905
player [EvanPlayer] gets hole card ['H6', 'CA'], current stack 2075
player [KLChen2PokerPlayer] gets hole card ['S6', 'SA'], current stack 1176
Started the round 49
Street "preflop" started. (community card = [])
"Jinkun" declared "fold:10"
"YueShi" declared "fold:0"
"ZifengFoldMan" declared "fold:0"
"EvanPlayer" declared "fold:10"
"KLChen2PokerPlayer" declared "raise:15"
"ZPlayer" declared "raise:20"
"NitWinWin" declared "fold:0"
"KLChen2PokerPlayer" declared "call:20"
Street "flop" started. (community card = ['D5', 'CK', 'SQ'])
"ZPlayer" declared "call:0"
"KLChen2PokerPlayer" declared "raise:15"
"ZPlayer" declared "fold:0"
"['KLChen2PokerPlayer']" won the round 49 (stack = {'ZPlayer': 1652, 'NitWinWin': 895, 'Jinkun': 372, 'YueShi': 895, 'JoyoPlayer': 0, 'ZifengFoldMan': 905, 'EvanPlayer': 2075, 'KLChen2PokerPlayer': 1206})
player [ZPlayer] gets hole card ['C2', 'SA'], current stack 1652
player [NitWinWin] gets hole card ['C7', 'H7'], current stack 890
player [Jinkun] gets hole card ['D5', 'S7'], current stack 362
player [YueShi] gets hole card ['C5', 'H4'], current stack 895
player [ZifengFoldMan] gets hole card ['D3', 'D8'], current stack 905
player [EvanPlayer] gets hole card ['SQ', 'S6'], current stack 2075
player [KLChen2PokerPlayer] gets hole card ['S8', 'H9'], current stack 1206
Started the round 50
Street "preflop" started. (community card = [])
"YueShi" declared "fold:0"
"ZifengFoldMan" declared "fold:0"
"EvanPlayer" declared "raise:2075"
"KLChen2PokerPlayer" declared "fold:0"
"ZPlayer" declared "fold:0"
"NitWinWin" declared "call:2075"
"Jinkun" declared "fold:2075"
Street "flop" started. (community card = ['S4', 'CJ', 'DK'])
Street "turn" started. (community card = ['S4', 'CJ', 'DK', 'D4'])
Street "river" started. (community card = ['S4', 'CJ', 'DK', 'D4', 'S2'])
"['NitWinWin']" won the round 50 (stack = {'ZPlayer': 1652, 'NitWinWin': 1800, 'Jinkun': 362, 'YueShi': 895, 'JoyoPlayer': 0, 'ZifengFoldMan': 905, 'EvanPlayer': 1180, 'KLChen2PokerPlayer': 1206})

Game Results:
------------------------------------------------------------
Game 1:
Winner: NitWinWin (stack: 1800)
All players' stacks:
  ZPlayer: 1652
  NitWinWin: 1800
  Jinkun: 362
  YueShi: 895
  JoyoPlayer: 0
  ZifengFoldMan: 905
  EvanPlayer: 1180
  KLChen2PokerPlayer: 1206
------------------------------------------------------------
