player [ZPlayer] gets hole card ['SJ', 'S7'], current stack 1000
player [NitWinWin] gets hole card ['D5', 'S5'], current stack 995
player [Jinkun] gets hole card ['S6', 'H5'], current stack 990
player [YueShi] gets hole card ['ST', 'H2'], current stack 1000
player [JoyoPlayer] gets hole card ['HK', 'CA'], current stack 1000
player [ZifengFoldMan] gets hole card ['HT', 'DQ'], current stack 1000
player [EvanPlayer] gets hole card ['C8', 'C4'], current stack 1000
player [KLChen2PokerPlayer] gets hole card ['D8', 'CJ'], current stack 1000
Started the round 1
Street "preflop" started. (community card = [])
"YueShi" declared "fold:0"
"JoyoPlayer" declared "fold:0"
"ZifengFoldMan" declared "fold:0"
"EvanPlayer" declared "call:10"
"KLChen2PokerPlayer" declared "call:10"
"ZPlayer" declared "raise:15"
"NitWinWin" declared "fold:0"
"Jinkun" declared "fold:15"
"EvanPlayer" declared "raise:1000"
"KLChen2PokerPlayer" declared "fold:0"
"ZPlayer" declared "fold:0"
"['EvanPlayer']" won the round 1 (stack = {'ZPlayer': 985, 'NitWinWin': 995, 'Jinkun': 990, 'YueShi': 1000, 'JoyoPlayer': 1000, 'ZifengFoldMan': 1000, 'EvanPlayer': 1040, 'KLChen2PokerPlayer': 990})
player [ZPlayer] gets hole card ['C2', 'D8'], current stack 985
player [NitWinWin] gets hole card ['S2', 'DJ'], current stack 995
player [Jinkun] gets hole card ['D9', 'H5'], current stack 985
player [YueShi] gets hole card ['HA', 'DQ'], current stack 990
player [JoyoPlayer] gets hole card ['S4', 'S8'], current stack 1000
player [ZifengFoldMan] gets hole card ['H7', 'SK'], current stack 1000
player [EvanPlayer] gets hole card ['SJ', 'ST'], current stack 1040
player [KLChen2PokerPlayer] gets hole card ['HQ', 'C4'], current stack 990
Started the round 2
Street "preflop" started. (community card = [])
"JoyoPlayer" declared "raise:15"
"ZifengFoldMan" declared "fold:0"
"EvanPlayer" declared "raise:1040"
"KLChen2PokerPlayer" declared "fold:0"
"ZPlayer" declared "fold:0"
"NitWinWin" declared "fold:0"
"Jinkun" declared "fold:1040"
"YueShi" declared "fold:0"
"JoyoPlayer" declared "fold:0"
"['EvanPlayer']" won the round 2 (stack = {'ZPlayer': 985, 'NitWinWin': 995, 'Jinkun': 985, 'YueShi': 990, 'JoyoPlayer': 985, 'ZifengFoldMan': 1000, 'EvanPlayer': 1070, 'KLChen2PokerPlayer': 990})
player [ZPlayer] gets hole card ['HA', 'S3'], current stack 985
player [NitWinWin] gets hole card ['D6', 'S6'], current stack 995
player [Jinkun] gets hole card ['D3', 'CA'], current stack 985
player [YueShi] gets hole card ['DA', 'CJ'], current stack 985
player [JoyoPlayer] gets hole card ['D2', 'C2'], current stack 975
player [ZifengFoldMan] gets hole card ['DT', 'H2'], current stack 1000
player [EvanPlayer] gets hole card ['H5', 'S9'], current stack 1070
player [KLChen2PokerPlayer] gets hole card ['S7', 'D8'], current stack 990
Started the round 3
Street "preflop" started. (community card = [])
"ZifengFoldMan" declared "fold:0"
"EvanPlayer" declared "call:10"
"KLChen2PokerPlayer" declared "raise:15"
"ZPlayer" declared "call:15"
"NitWinWin" declared "fold:0"
"Jinkun" declared "fold:15"
"YueShi" declared "fold:0"
"JoyoPlayer" declared "raise:20"
"EvanPlayer" declared "fold:20"
"KLChen2PokerPlayer" declared "fold:0"
"ZPlayer" declared "call:20"
Street "flop" started. (community card = ['H3', 'SK', 'S4'])
"JoyoPlayer" declared "fold:0"
"['ZPlayer']" won the round 3 (stack = {'ZPlayer': 1035, 'NitWinWin': 995, 'Jinkun': 985, 'YueShi': 985, 'JoyoPlayer': 965, 'ZifengFoldMan': 1000, 'EvanPlayer': 1060, 'KLChen2PokerPlayer': 975})
player [ZPlayer] gets hole card ['S6', 'S5'], current stack 1035
player [NitWinWin] gets hole card ['D3', 'D9'], current stack 995
player [Jinkun] gets hole card ['DQ', 'DK'], current stack 985
player [YueShi] gets hole card ['H2', 'S9'], current stack 985
player [JoyoPlayer] gets hole card ['D2', 'S4'], current stack 960
player [ZifengFoldMan] gets hole card ['H9', 'S2'], current stack 990
player [EvanPlayer] gets hole card ['H5', 'S7'], current stack 1060
player [KLChen2PokerPlayer] gets hole card ['SJ', 'CT'], current stack 975
Started the round 4
Street "preflop" started. (community card = [])
"EvanPlayer" declared "raise:1060"
"KLChen2PokerPlayer" declared "fold:0"
"ZPlayer" declared "fold:0"
"NitWinWin" declared "fold:0"
"Jinkun" declared "fold:1060"
"YueShi" declared "fold:0"
"JoyoPlayer" declared "fold:0"
"ZifengFoldMan" declared "fold:0"
"['EvanPlayer']" won the round 4 (stack = {'ZPlayer': 1035, 'NitWinWin': 995, 'Jinkun': 985, 'YueShi': 985, 'JoyoPlayer': 960, 'ZifengFoldMan': 990, 'EvanPlayer': 1075, 'KLChen2PokerPlayer': 975})
player [ZPlayer] gets hole card ['DQ', 'H5'], current stack 1035
player [NitWinWin] gets hole card ['H7', 'D8'], current stack 995
player [Jinkun] gets hole card ['D4', 'C3'], current stack 985
player [YueShi] gets hole card ['SQ', 'S8'], current stack 985
player [JoyoPlayer] gets hole card ['S3', 'S9'], current stack 960
player [ZifengFoldMan] gets hole card ['D3', 'CQ'], current stack 985
player [EvanPlayer] gets hole card ['H2', 'SJ'], current stack 1065
player [KLChen2PokerPlayer] gets hole card ['CT', 'DA'], current stack 975
Started the round 5
Street "preflop" started. (community card = [])
"KLChen2PokerPlayer" declared "raise:22"
"ZPlayer" declared "call:22"
"NitWinWin" declared "fold:0"
"Jinkun" declared "fold:22"
"YueShi" declared "fold:0"
"JoyoPlayer" declared "raise:34"
"ZifengFoldMan" declared "fold:0"
"EvanPlayer" declared "fold:34"
"KLChen2PokerPlayer" declared "fold:0"
"ZPlayer" declared "call:34"
Street "flop" started. (community card = ['S6', 'S7', 'C8'])
"ZPlayer" declared "call:0"
"JoyoPlayer" declared "call:0"
Street "turn" started. (community card = ['S6', 'S7', 'C8', 'SA'])
"ZPlayer" declared "call:0"
"JoyoPlayer" declared "raise:668"
"ZPlayer" declared "fold:0"
"['JoyoPlayer']" won the round 5 (stack = {'ZPlayer': 1001, 'NitWinWin': 995, 'Jinkun': 985, 'YueShi': 985, 'JoyoPlayer': 1031, 'ZifengFoldMan': 985, 'EvanPlayer': 1065, 'KLChen2PokerPlayer': 953})
player [ZPlayer] gets hole card ['H2', 'ST'], current stack 1001
player [NitWinWin] gets hole card ['DJ', 'CK'], current stack 995
player [Jinkun] gets hole card ['SA', 'SJ'], current stack 985
player [YueShi] gets hole card ['D6', 'H9'], current stack 985
player [JoyoPlayer] gets hole card ['D5', 'CT'], current stack 1031
player [ZifengFoldMan] gets hole card ['DA', 'S3'], current stack 985
player [EvanPlayer] gets hole card ['H6', 'DQ'], current stack 1060
player [KLChen2PokerPlayer] gets hole card ['C8', 'S6'], current stack 943
Started the round 6
Street "preflop" started. (community card = [])
"ZPlayer" declared "fold:0"
"NitWinWin" declared "fold:0"
"Jinkun" declared "fold:10"
"YueShi" declared "fold:0"
"JoyoPlayer" declared "fold:0"
"ZifengFoldMan" declared "fold:0"
"EvanPlayer" declared "raise:1065"
"KLChen2PokerPlayer" declared "fold:0"
"['EvanPlayer']" won the round 6 (stack = {'ZPlayer': 1001, 'NitWinWin': 995, 'Jinkun': 985, 'YueShi': 985, 'JoyoPlayer': 1031, 'ZifengFoldMan': 985, 'EvanPlayer': 1075, 'KLChen2PokerPlayer': 943})
player [ZPlayer] gets hole card ['CA', 'DA'], current stack 991
player [NitWinWin] gets hole card ['SJ', 'H9'], current stack 995
player [Jinkun] gets hole card ['CQ', 'DQ'], current stack 985
player [YueShi] gets hole card ['D7', 'C3'], current stack 985
player [JoyoPlayer] gets hole card ['H5', 'ST'], current stack 1031
player [ZifengFoldMan] gets hole card ['HT', 'D6'], current stack 985
player [EvanPlayer] gets hole card ['SA', 'D4'], current stack 1075
player [KLChen2PokerPlayer] gets hole card ['DT', 'SK'], current stack 938
Started the round 7
Street "preflop" started. (community card = [])
"NitWinWin" declared "fold:0"
"Jinkun" declared "fold:10"
"YueShi" declared "fold:0"
"JoyoPlayer" declared "fold:0"
"ZifengFoldMan" declared "fold:0"
"EvanPlayer" declared "call:10"
"KLChen2PokerPlayer" declared "raise:18"
"ZPlayer" declared "raise:26"
"EvanPlayer" declared "fold:26"
"KLChen2PokerPlayer" declared "fold:0"
"['ZPlayer']" won the round 7 (stack = {'ZPlayer': 1029, 'NitWinWin': 995, 'Jinkun': 985, 'YueShi': 985, 'JoyoPlayer': 1031, 'ZifengFoldMan': 985, 'EvanPlayer': 1065, 'KLChen2PokerPlayer': 925})
player [ZPlayer] gets hole card ['H5', 'C8'], current stack 1024
player [NitWinWin] gets hole card ['H6', 'DK'], current stack 985
player [Jinkun] gets hole card ['SJ', 'C6'], current stack 985
player [YueShi] gets hole card ['DQ', 'H9'], current stack 985
player [JoyoPlayer] gets hole card ['C4', 'SQ'], current stack 1031
player [ZifengFoldMan] gets hole card ['CK', 'H7'], current stack 985
player [EvanPlayer] gets hole card ['C2', 'D7'], current stack 1065
player [KLChen2PokerPlayer] gets hole card ['SA', 'H4'], current stack 925
Started the round 8
Street "preflop" started. (community card = [])
"Jinkun" declared "fold:10"
"YueShi" declared "fold:0"
"JoyoPlayer" declared "fold:0"
"ZifengFoldMan" declared "fold:0"
"EvanPlayer" declared "fold:10"
"KLChen2PokerPlayer" declared "raise:18"
"ZPlayer" declared "call:18"
"NitWinWin" declared "fold:0"
Street "flop" started. (community card = ['C7', 'S7', 'D6'])
"ZPlayer" declared "call:0"
"KLChen2PokerPlayer" declared "raise:10"
"ZPlayer" declared "fold:0"
"['KLChen2PokerPlayer']" won the round 8 (stack = {'ZPlayer': 1011, 'NitWinWin': 985, 'Jinkun': 985, 'YueShi': 985, 'JoyoPlayer': 1031, 'ZifengFoldMan': 985, 'EvanPlayer': 1065, 'KLChen2PokerPlayer': 953})
player [ZPlayer] gets hole card ['CJ', 'HT'], current stack 1011
player [NitWinWin] gets hole card ['S2', 'DQ'], current stack 980
player [Jinkun] gets hole card ['H4', 'S9'], current stack 975
player [YueShi] gets hole card ['SJ', 'CT'], current stack 985
player [JoyoPlayer] gets hole card ['H7', 'D9'], current stack 1031
player [ZifengFoldMan] gets hole card ['H2', 'S6'], current stack 985
player [EvanPlayer] gets hole card ['CQ', 'C8'], current stack 1065
player [KLChen2PokerPlayer] gets hole card ['S4', 'DT'], current stack 953
Started the round 9
Street "preflop" started. (community card = [])
"YueShi" declared "fold:0"
"JoyoPlayer" declared "fold:0"
"ZifengFoldMan" declared "fold:0"
"EvanPlayer" declared "raise:1065"
"KLChen2PokerPlayer" declared "fold:0"
"ZPlayer" declared "fold:0"
"NitWinWin" declared "fold:0"
"Jinkun" declared "fold:1065"
"['EvanPlayer']" won the round 9 (stack = {'ZPlayer': 1011, 'NitWinWin': 980, 'Jinkun': 975, 'YueShi': 985, 'JoyoPlayer': 1031, 'ZifengFoldMan': 985, 'EvanPlayer': 1080, 'KLChen2PokerPlayer': 953})
player [ZPlayer] gets hole card ['D7', 'HT'], current stack 1011
player [NitWinWin] gets hole card ['S3', 'D3'], current stack 980
player [Jinkun] gets hole card ['D6', 'H8'], current stack 970
player [YueShi] gets hole card ['H4', 'H2'], current stack 975
player [JoyoPlayer] gets hole card ['C9', 'HA'], current stack 1031
player [ZifengFoldMan] gets hole card ['S7', 'C4'], current stack 985
player [EvanPlayer] gets hole card ['S5', 'H6'], current stack 1080
player [KLChen2PokerPlayer] gets hole card ['CK', 'DA'], current stack 953
Started the round 10
Street "preflop" started. (community card = [])
"JoyoPlayer" declared "fold:0"
"ZifengFoldMan" declared "fold:0"
"EvanPlayer" declared "raise:1080"
"KLChen2PokerPlayer" declared "fold:0"
"ZPlayer" declared "fold:0"
"NitWinWin" declared "fold:0"
"Jinkun" declared "fold:1080"
"YueShi" declared "fold:0"
"['EvanPlayer']" won the round 10 (stack = {'ZPlayer': 1011, 'NitWinWin': 980, 'Jinkun': 970, 'YueShi': 975, 'JoyoPlayer': 1031, 'ZifengFoldMan': 985, 'EvanPlayer': 1095, 'KLChen2PokerPlayer': 953})
player [ZPlayer] gets hole card ['D2', 'CT'], current stack 1011
player [NitWinWin] gets hole card ['C8', 'HA'], current stack 980
player [Jinkun] gets hole card ['H6', 'C9'], current stack 970
player [YueShi] gets hole card ['S2', 'S3'], current stack 970
player [JoyoPlayer] gets hole card ['CJ', 'S9'], current stack 1021
player [ZifengFoldMan] gets hole card ['DK', 'ST'], current stack 985
player [EvanPlayer] gets hole card ['H8', 'DQ'], current stack 1095
player [KLChen2PokerPlayer] gets hole card ['D3', 'H7'], current stack 953
Started the round 11
Street "preflop" started. (community card = [])
"ZifengFoldMan" declared "fold:0"
"EvanPlayer" declared "raise:1095"
"KLChen2PokerPlayer" declared "fold:0"
"ZPlayer" declared "fold:0"
"NitWinWin" declared "fold:0"
"Jinkun" declared "fold:1095"
"YueShi" declared "fold:0"
"JoyoPlayer" declared "call:1095"
Street "flop" started. (community card = ['H5', 'H9', 'HT'])
Street "turn" started. (community card = ['H5', 'H9', 'HT', 'S5'])
Street "river" started. (community card = ['H5', 'H9', 'HT', 'S5', 'C5'])
"['JoyoPlayer']" won the round 11 (stack = {'ZPlayer': 1011, 'NitWinWin': 980, 'Jinkun': 970, 'YueShi': 970, 'JoyoPlayer': 2067, 'ZifengFoldMan': 985, 'EvanPlayer': 64, 'KLChen2PokerPlayer': 953})
player [ZPlayer] gets hole card ['C4', 'DT'], current stack 1011
player [NitWinWin] gets hole card ['ST', 'CA'], current stack 980
player [Jinkun] gets hole card ['D9', 'SQ'], current stack 970
player [YueShi] gets hole card ['H4', 'D3'], current stack 970
player [JoyoPlayer] gets hole card ['CJ', 'DA'], current stack 2062
player [ZifengFoldMan] gets hole card ['S7', 'HA'], current stack 975
player [EvanPlayer] gets hole card ['SA', 'H5'], current stack 64
player [KLChen2PokerPlayer] gets hole card ['D6', 'CQ'], current stack 953
Started the round 12
Street "preflop" started. (community card = [])
"EvanPlayer" declared "raise:64"
"KLChen2PokerPlayer" declared "fold:0"
"ZPlayer" declared "fold:0"
"NitWinWin" declared "fold:0"
"Jinkun" declared "fold:64"
"YueShi" declared "fold:0"
"JoyoPlayer" declared "raise:118"
"ZifengFoldMan" declared "fold:0"
Street "flop" started. (community card = ['S9', 'CT', 'HK'])
Street "turn" started. (community card = ['S9', 'CT', 'HK', 'DQ'])
Street "river" started. (community card = ['S9', 'CT', 'HK', 'DQ', 'DK'])
"['JoyoPlayer']" won the round 12 (stack = {'ZPlayer': 1011, 'NitWinWin': 980, 'Jinkun': 970, 'YueShi': 970, 'JoyoPlayer': 2141, 'ZifengFoldMan': 975, 'EvanPlayer': 0, 'KLChen2PokerPlayer': 953})
player [ZPlayer] gets hole card ['CA', 'D9'], current stack 1011
player [NitWinWin] gets hole card ['CQ', 'DA'], current stack 980
player [Jinkun] gets hole card ['DK', 'S2'], current stack 970
player [YueShi] gets hole card ['HQ', 'SK'], current stack 970
player [JoyoPlayer] gets hole card ['D7', 'D6'], current stack 2141
player [ZifengFoldMan] gets hole card ['C7', 'S8'], current stack 970
player [KLChen2PokerPlayer] gets hole card ['C6', 'S3'], current stack 943
Started the round 13
Street "preflop" started. (community card = [])
"ZPlayer" declared "raise:15"
"NitWinWin" declared "fold:0"
"Jinkun" declared "fold:15"
"YueShi" declared "fold:0"
"JoyoPlayer" declared "fold:0"
"ZifengFoldMan" declared "fold:0"
"KLChen2PokerPlayer" declared "fold:0"
"['ZPlayer']" won the round 13 (stack = {'ZPlayer': 1026, 'NitWinWin': 980, 'Jinkun': 970, 'YueShi': 970, 'JoyoPlayer': 2141, 'ZifengFoldMan': 970, 'EvanPlayer': 0, 'KLChen2PokerPlayer': 943})
player [ZPlayer] gets hole card ['C6', 'S3'], current stack 1016
player [NitWinWin] gets hole card ['CT', 'H2'], current stack 980
player [Jinkun] gets hole card ['C9', 'C8'], current stack 970
player [YueShi] gets hole card ['SQ', 'DJ'], current stack 970
player [JoyoPlayer] gets hole card ['H5', 'S7'], current stack 2141
player [ZifengFoldMan] gets hole card ['C5', 'HT'], current stack 970
player [KLChen2PokerPlayer] gets hole card ['ST', 'S5'], current stack 938
Started the round 14
Street "preflop" started. (community card = [])
"NitWinWin" declared "fold:0"
"Jinkun" declared "fold:10"
"YueShi" declared "fold:0"
"JoyoPlayer" declared "raise:15"
"ZifengFoldMan" declared "fold:0"
"KLChen2PokerPlayer" declared "raise:20"
"ZPlayer" declared "call:20"
"JoyoPlayer" declared "fold:0"
Street "flop" started. (community card = ['HJ', 'CA', 'H9'])
"KLChen2PokerPlayer" declared "call:0"
"ZPlayer" declared "call:0"
Street "turn" started. (community card = ['HJ', 'CA', 'H9', 'H6'])
"KLChen2PokerPlayer" declared "call:0"
"ZPlayer" declared "call:0"
Street "river" started. (community card = ['HJ', 'CA', 'H9', 'H6', 'C3'])
"KLChen2PokerPlayer" declared "call:0"
"ZPlayer" declared "raise:55"
"KLChen2PokerPlayer" declared "fold:0"
"['ZPlayer']" won the round 14 (stack = {'ZPlayer': 1061, 'NitWinWin': 980, 'Jinkun': 970, 'YueShi': 970, 'JoyoPlayer': 2126, 'ZifengFoldMan': 970, 'EvanPlayer': 0, 'KLChen2PokerPlayer': 923})
player [ZPlayer] gets hole card ['S3', 'D6'], current stack 1056
player [NitWinWin] gets hole card ['HA', 'SK'], current stack 970
player [Jinkun] gets hole card ['C8', 'HJ'], current stack 970
player [YueShi] gets hole card ['D7', 'C2'], current stack 970
player [JoyoPlayer] gets hole card ['H9', 'S2'], current stack 2126
player [ZifengFoldMan] gets hole card ['H7', 'C7'], current stack 970
player [KLChen2PokerPlayer] gets hole card ['C3', 'H6'], current stack 923
Started the round 15
Street "preflop" started. (community card = [])
"Jinkun" declared "fold:10"
"YueShi" declared "fold:0"
"JoyoPlayer" declared "raise:15"
"ZifengFoldMan" declared "fold:0"
"KLChen2PokerPlayer" declared "fold:0"
"ZPlayer" declared "fold:0"
"NitWinWin" declared "raise:980"
"JoyoPlayer" declared "fold:0"
"['NitWinWin']" won the round 15 (stack = {'ZPlayer': 1056, 'NitWinWin': 1000, 'Jinkun': 970, 'YueShi': 970, 'JoyoPlayer': 2111, 'ZifengFoldMan': 970, 'EvanPlayer': 0, 'KLChen2PokerPlayer': 923})
player [ZPlayer] gets hole card ['C2', 'D5'], current stack 1056
player [NitWinWin] gets hole card ['H6', 'H9'], current stack 995
player [Jinkun] gets hole card ['S3', 'D7'], current stack 960
player [YueShi] gets hole card ['S9', 'DJ'], current stack 970
player [JoyoPlayer] gets hole card ['ST', 'C4'], current stack 2111
player [ZifengFoldMan] gets hole card ['S2', 'H5'], current stack 970
player [KLChen2PokerPlayer] gets hole card ['C6', 'C3'], current stack 923
Started the round 16
Street "preflop" started. (community card = [])
"YueShi" declared "fold:0"
"JoyoPlayer" declared "fold:0"
"ZifengFoldMan" declared "fold:0"
"KLChen2PokerPlayer" declared "call:10"
"ZPlayer" declared "call:10"
"NitWinWin" declared "fold:0"
"Jinkun" declared "call:10"
Street "flop" started. (community card = ['SA', 'CJ', 'SQ'])
"Jinkun" declared "call:0"
"KLChen2PokerPlayer" declared "call:0"
"ZPlayer" declared "call:0"
Street "turn" started. (community card = ['SA', 'CJ', 'SQ', 'HK'])
"Jinkun" declared "call:0"
"KLChen2PokerPlayer" declared "call:0"
"ZPlayer" declared "call:0"
Street "river" started. (community card = ['SA', 'CJ', 'SQ', 'HK', 'HT'])
"Jinkun" declared "raise:17"
"KLChen2PokerPlayer" declared "raise:286"
"ZPlayer" declared "raise:940"
"Jinkun" declared "call:940"
"KLChen2PokerPlayer" declared "call:940"
"['ZPlayer', 'Jinkun', 'KLChen2PokerPlayer']" won the round 16 (stack = {'ZPlayer': 1057, 'NitWinWin': 995, 'Jinkun': 971, 'YueShi': 970, 'JoyoPlayer': 2111, 'ZifengFoldMan': 970, 'EvanPlayer': 0, 'KLChen2PokerPlayer': 924})
player [ZPlayer] gets hole card ['D5', 'CK'], current stack 1057
player [NitWinWin] gets hole card ['D7', 'D6'], current stack 995
player [Jinkun] gets hole card ['H2', 'C9'], current stack 966
player [YueShi] gets hole card ['S4', 'C5'], current stack 960
player [JoyoPlayer] gets hole card ['S2', 'S5'], current stack 2111
player [ZifengFoldMan] gets hole card ['DK', 'D4'], current stack 970
player [KLChen2PokerPlayer] gets hole card ['DJ', 'SA'], current stack 924
Started the round 17
Street "preflop" started. (community card = [])
"JoyoPlayer" declared "raise:15"
"ZifengFoldMan" declared "fold:0"
"KLChen2PokerPlayer" declared "raise:24"
"ZPlayer" declared "call:24"
"NitWinWin" declared "fold:0"
"Jinkun" declared "fold:24"
"YueShi" declared "fold:0"
"JoyoPlayer" declared "fold:0"
Street "flop" started. (community card = ['DT', 'H3', 'CJ'])
"KLChen2PokerPlayer" declared "raise:23"
"ZPlayer" declared "fold:0"
"['KLChen2PokerPlayer']" won the round 17 (stack = {'ZPlayer': 1033, 'NitWinWin': 995, 'Jinkun': 966, 'YueShi': 960, 'JoyoPlayer': 2096, 'ZifengFoldMan': 970, 'EvanPlayer': 0, 'KLChen2PokerPlayer': 978})
player [ZPlayer] gets hole card ['C9', 'H4'], current stack 1033
player [NitWinWin] gets hole card ['S6', 'H7'], current stack 995
player [Jinkun] gets hole card ['H9', 'D4'], current stack 966
player [YueShi] gets hole card ['DK', 'H6'], current stack 955
player [JoyoPlayer] gets hole card ['CA', 'C7'], current stack 2086
player [ZifengFoldMan] gets hole card ['DA', 'S3'], current stack 970
player [KLChen2PokerPlayer] gets hole card ['SQ', 'HT'], current stack 978
Started the round 18
Street "preflop" started. (community card = [])
"ZifengFoldMan" declared "fold:0"
"KLChen2PokerPlayer" declared "raise:18"
"ZPlayer" declared "call:18"
"NitWinWin" declared "fold:0"
"Jinkun" declared "fold:18"
"YueShi" declared "fold:0"
"JoyoPlayer" declared "raise:26"
"KLChen2PokerPlayer" declared "call:26"
"ZPlayer" declared "call:26"
Street "flop" started. (community card = ['DQ', 'ST', 'D8'])
"JoyoPlayer" declared "fold:0"
"KLChen2PokerPlayer" declared "raise:30"
"ZPlayer" declared "fold:0"
"['KLChen2PokerPlayer']" won the round 18 (stack = {'ZPlayer': 1007, 'NitWinWin': 995, 'Jinkun': 966, 'YueShi': 955, 'JoyoPlayer': 2070, 'ZifengFoldMan': 970, 'EvanPlayer': 0, 'KLChen2PokerPlayer': 1035})
player [ZPlayer] gets hole card ['ST', 'H8'], current stack 1007
player [NitWinWin] gets hole card ['D6', 'HK'], current stack 995
player [Jinkun] gets hole card ['H3', 'DT'], current stack 966
player [YueShi] gets hole card ['H2', 'D5'], current stack 955
player [JoyoPlayer] gets hole card ['S4', 'D4'], current stack 2065
player [ZifengFoldMan] gets hole card ['SQ', 'S7'], current stack 960
player [KLChen2PokerPlayer] gets hole card ['HT', 'S2'], current stack 1035
Started the round 19
Street "preflop" started. (community card = [])
"KLChen2PokerPlayer" declared "call:10"
"ZPlayer" declared "call:10"
"NitWinWin" declared "fold:0"
"Jinkun" declared "fold:10"
"YueShi" declared "fold:0"
"JoyoPlayer" declared "fold:0"
"ZifengFoldMan" declared "fold:0"
Street "flop" started. (community card = ['S5', 'SJ', 'DA'])
"KLChen2PokerPlayer" declared "call:0"
"ZPlayer" declared "call:0"
Street "turn" started. (community card = ['S5', 'SJ', 'DA', 'S8'])
"KLChen2PokerPlayer" declared "call:0"
"ZPlayer" declared "raise:10"
"KLChen2PokerPlayer" declared "fold:0"
"['ZPlayer']" won the round 19 (stack = {'ZPlayer': 1032, 'NitWinWin': 995, 'Jinkun': 966, 'YueShi': 955, 'JoyoPlayer': 2065, 'ZifengFoldMan': 960, 'EvanPlayer': 0, 'KLChen2PokerPlayer': 1025})
player [ZPlayer] gets hole card ['D3', 'HT'], current stack 1032
player [NitWinWin] gets hole card ['C5', 'CJ'], current stack 995
player [Jinkun] gets hole card ['DA', 'D5'], current stack 966
player [YueShi] gets hole card ['C4', 'H2'], current stack 955
player [JoyoPlayer] gets hole card ['S4', 'DQ'], current stack 2065
player [ZifengFoldMan] gets hole card ['CT', 'S9'], current stack 955
player [KLChen2PokerPlayer] gets hole card ['C6', 'H7'], current stack 1015
Started the round 20
Street "preflop" started. (community card = [])
"ZPlayer" declared "call:10"
"NitWinWin" declared "fold:0"
"Jinkun" declared "fold:10"
"YueShi" declared "fold:0"
"JoyoPlayer" declared "raise:15"
"ZifengFoldMan" declared "fold:0"
"KLChen2PokerPlayer" declared "fold:0"
"ZPlayer" declared "call:15"
Street "flop" started. (community card = ['H3', 'D8', 'D4'])
"ZPlayer" declared "call:0"
"JoyoPlayer" declared "raise:20"
"ZPlayer" declared "fold:0"
"['JoyoPlayer']" won the round 20 (stack = {'ZPlayer': 1017, 'NitWinWin': 995, 'Jinkun': 966, 'YueShi': 955, 'JoyoPlayer': 2095, 'ZifengFoldMan': 955, 'EvanPlayer': 0, 'KLChen2PokerPlayer': 1015})
player [ZPlayer] gets hole card ['H8', 'S5'], current stack 1007
player [NitWinWin] gets hole card ['ST', 'CA'], current stack 995
player [Jinkun] gets hole card ['C8', 'SQ'], current stack 966
player [YueShi] gets hole card ['C3', 'HT'], current stack 955
player [JoyoPlayer] gets hole card ['SA', 'D7'], current stack 2095
player [ZifengFoldMan] gets hole card ['D4', 'D8'], current stack 955
player [KLChen2PokerPlayer] gets hole card ['CQ', 'D9'], current stack 1010
Started the round 21
Street "preflop" started. (community card = [])
"NitWinWin" declared "fold:0"
"Jinkun" declared "fold:10"
"YueShi" declared "fold:0"
"JoyoPlayer" declared "fold:0"
"ZifengFoldMan" declared "fold:0"
"KLChen2PokerPlayer" declared "raise:15"
"ZPlayer" declared "call:15"
Street "flop" started. (community card = ['S3', 'H9', 'D2'])
"KLChen2PokerPlayer" declared "raise:35"
"ZPlayer" declared "fold:0"
"['KLChen2PokerPlayer']" won the round 21 (stack = {'ZPlayer': 1002, 'NitWinWin': 995, 'Jinkun': 966, 'YueShi': 955, 'JoyoPlayer': 2095, 'ZifengFoldMan': 955, 'EvanPlayer': 0, 'KLChen2PokerPlayer': 1030})
player [ZPlayer] gets hole card ['C3', 'D2'], current stack 997
player [NitWinWin] gets hole card ['S5', 'D3'], current stack 985
player [Jinkun] gets hole card ['DQ', 'CA'], current stack 966
player [YueShi] gets hole card ['H7', 'D8'], current stack 955
player [JoyoPlayer] gets hole card ['S6', 'C5'], current stack 2095
player [ZifengFoldMan] gets hole card ['SQ', 'HJ'], current stack 955
player [KLChen2PokerPlayer] gets hole card ['S4', 'C4'], current stack 1030
Started the round 22
Street "preflop" started. (community card = [])
"Jinkun" declared "fold:10"
"YueShi" declared "fold:0"
"JoyoPlayer" declared "raise:15"
"ZifengFoldMan" declared "fold:0"
"KLChen2PokerPlayer" declared "raise:20"
"ZPlayer" declared "fold:0"
"NitWinWin" declared "fold:0"
"JoyoPlayer" declared "fold:0"
"['KLChen2PokerPlayer']" won the round 22 (stack = {'ZPlayer': 997, 'NitWinWin': 985, 'Jinkun': 966, 'YueShi': 955, 'JoyoPlayer': 2080, 'ZifengFoldMan': 955, 'EvanPlayer': 0, 'KLChen2PokerPlayer': 1060})
player [ZPlayer] gets hole card ['D7', 'D8'], current stack 997
player [NitWinWin] gets hole card ['DK', 'H7'], current stack 980
player [Jinkun] gets hole card ['H4', 'D3'], current stack 956
player [YueShi] gets hole card ['D5', 'S5'], current stack 955
player [JoyoPlayer] gets hole card ['S4', 'H5'], current stack 2080
player [ZifengFoldMan] gets hole card ['CQ', 'ST'], current stack 955
player [KLChen2PokerPlayer] gets hole card ['HJ', 'SQ'], current stack 1060
Started the round 23
Street "preflop" started. (community card = [])
"YueShi" declared "fold:0"
"JoyoPlayer" declared "fold:0"
"ZifengFoldMan" declared "fold:0"
"KLChen2PokerPlayer" declared "raise:15"
"ZPlayer" declared "fold:0"
"NitWinWin" declared "fold:0"
"Jinkun" declared "fold:15"
"['KLChen2PokerPlayer']" won the round 23 (stack = {'ZPlayer': 997, 'NitWinWin': 980, 'Jinkun': 956, 'YueShi': 955, 'JoyoPlayer': 2080, 'ZifengFoldMan': 955, 'EvanPlayer': 0, 'KLChen2PokerPlayer': 1075})
player [ZPlayer] gets hole card ['ST', 'SQ'], current stack 997
player [NitWinWin] gets hole card ['H8', 'CK'], current stack 980
player [Jinkun] gets hole card ['DJ', 'S5'], current stack 951
player [YueShi] gets hole card ['S6', 'HQ'], current stack 945
player [JoyoPlayer] gets hole card ['C2', 'H4'], current stack 2080
player [ZifengFoldMan] gets hole card ['D7', 'DK'], current stack 955
player [KLChen2PokerPlayer] gets hole card ['D8', 'HK'], current stack 1075
Started the round 24
Street "preflop" started. (community card = [])
"JoyoPlayer" declared "raise:15"
"ZifengFoldMan" declared "fold:0"
"KLChen2PokerPlayer" declared "raise:20"
"ZPlayer" declared "call:20"
"NitWinWin" declared "fold:0"
"Jinkun" declared "fold:20"
"YueShi" declared "fold:0"
"JoyoPlayer" declared "fold:0"
Street "flop" started. (community card = ['HJ', 'HT', 'C4'])
"KLChen2PokerPlayer" declared "call:0"
"ZPlayer" declared "raise:10"
"KLChen2PokerPlayer" declared "fold:0"
"['ZPlayer']" won the round 24 (stack = {'ZPlayer': 1047, 'NitWinWin': 980, 'Jinkun': 951, 'YueShi': 945, 'JoyoPlayer': 2065, 'ZifengFoldMan': 955, 'EvanPlayer': 0, 'KLChen2PokerPlayer': 1055})
player [ZPlayer] gets hole card ['D6', 'H9'], current stack 1047
player [NitWinWin] gets hole card ['H2', 'DA'], current stack 980
player [Jinkun] gets hole card ['C4', 'DJ'], current stack 951
player [YueShi] gets hole card ['C3', 'HK'], current stack 940
player [JoyoPlayer] gets hole card ['SK', 'CT'], current stack 2055
player [ZifengFoldMan] gets hole card ['C5', 'H4'], current stack 955
player [KLChen2PokerPlayer] gets hole card ['HJ', 'HQ'], current stack 1055
Started the round 25
Street "preflop" started. (community card = [])
"ZifengFoldMan" declared "fold:0"
"KLChen2PokerPlayer" declared "raise:24"
"ZPlayer" declared "call:24"
"NitWinWin" declared "fold:0"
"Jinkun" declared "fold:24"
"YueShi" declared "fold:0"
"JoyoPlayer" declared "raise:38"
"KLChen2PokerPlayer" declared "fold:0"
"ZPlayer" declared "call:38"
Street "flop" started. (community card = ['DT', 'S4', 'D5'])
"JoyoPlayer" declared "raise:20"
"ZPlayer" declared "fold:0"
"['JoyoPlayer']" won the round 25 (stack = {'ZPlayer': 1009, 'NitWinWin': 980, 'Jinkun': 951, 'YueShi': 940, 'JoyoPlayer': 2132, 'ZifengFoldMan': 955, 'EvanPlayer': 0, 'KLChen2PokerPlayer': 1031})
player [ZPlayer] gets hole card ['D3', 'H7'], current stack 1009
player [NitWinWin] gets hole card ['H3', 'SK'], current stack 980
player [Jinkun] gets hole card ['H4', 'DJ'], current stack 951
player [YueShi] gets hole card ['S6', 'D2'], current stack 940
player [JoyoPlayer] gets hole card ['S5', 'D9'], current stack 2127
player [ZifengFoldMan] gets hole card ['S2', 'HA'], current stack 945
player [KLChen2PokerPlayer] gets hole card ['S7', 'H8'], current stack 1031
Started the round 26
Street "preflop" started. (community card = [])
"KLChen2PokerPlayer" declared "call:10"
"ZPlayer" declared "call:10"
"NitWinWin" declared "fold:0"
"Jinkun" declared "fold:10"
"YueShi" declared "fold:0"
"JoyoPlayer" declared "fold:0"
"ZifengFoldMan" declared "fold:0"
Street "flop" started. (community card = ['S3', 'D6', 'CJ'])
"KLChen2PokerPlayer" declared "call:0"
"ZPlayer" declared "raise:10"
"KLChen2PokerPlayer" declared "fold:0"
"['ZPlayer']" won the round 26 (stack = {'ZPlayer': 1034, 'NitWinWin': 980, 'Jinkun': 951, 'YueShi': 940, 'JoyoPlayer': 2127, 'ZifengFoldMan': 945, 'EvanPlayer': 0, 'KLChen2PokerPlayer': 1021})
player [ZPlayer] gets hole card ['SJ', 'H2'], current stack 1034
player [NitWinWin] gets hole card ['HQ', 'C8'], current stack 980
player [Jinkun] gets hole card ['H8', 'DT'], current stack 951
player [YueShi] gets hole card ['CK', 'SK'], current stack 940
player [JoyoPlayer] gets hole card ['C6', 'DK'], current stack 2127
player [ZifengFoldMan] gets hole card ['H7', 'D7'], current stack 940
player [KLChen2PokerPlayer] gets hole card ['D5', 'SA'], current stack 1011
Started the round 27
Street "preflop" started. (community card = [])
"ZPlayer" declared "fold:0"
"NitWinWin" declared "fold:0"
"Jinkun" declared "fold:10"
"YueShi" declared "fold:0"
"JoyoPlayer" declared "raise:15"
"ZifengFoldMan" declared "fold:0"
"KLChen2PokerPlayer" declared "raise:20"
"JoyoPlayer" declared "call:20"
Street "flop" started. (community card = ['CJ', 'SQ', 'DJ'])
"KLChen2PokerPlayer" declared "raise:12"
"JoyoPlayer" declared "raise:24"
"KLChen2PokerPlayer" declared "fold:0"
"['JoyoPlayer']" won the round 27 (stack = {'ZPlayer': 1034, 'NitWinWin': 980, 'Jinkun': 951, 'YueShi': 940, 'JoyoPlayer': 2164, 'ZifengFoldMan': 940, 'EvanPlayer': 0, 'KLChen2PokerPlayer': 989})
player [ZPlayer] gets hole card ['C3', 'H7'], current stack 1024
player [NitWinWin] gets hole card ['D2', 'H4'], current stack 980
player [Jinkun] gets hole card ['H2', 'H3'], current stack 951
player [YueShi] gets hole card ['DJ', 'S7'], current stack 940
player [JoyoPlayer] gets hole card ['D3', 'D9'], current stack 2164
player [ZifengFoldMan] gets hole card ['H8', 'HT'], current stack 940
player [KLChen2PokerPlayer] gets hole card ['C5', 'HA'], current stack 984
Started the round 28
Street "preflop" started. (community card = [])
"NitWinWin" declared "fold:0"
"Jinkun" declared "fold:10"
"YueShi" declared "fold:0"
"JoyoPlayer" declared "raise:15"
"ZifengFoldMan" declared "fold:0"
"KLChen2PokerPlayer" declared "raise:20"
"ZPlayer" declared "fold:0"
"JoyoPlayer" declared "fold:0"
"['KLChen2PokerPlayer']" won the round 28 (stack = {'ZPlayer': 1024, 'NitWinWin': 980, 'Jinkun': 951, 'YueShi': 940, 'JoyoPlayer': 2149, 'ZifengFoldMan': 940, 'EvanPlayer': 0, 'KLChen2PokerPlayer': 1014})
player [ZPlayer] gets hole card ['DK', 'DA'], current stack 1019
player [NitWinWin] gets hole card ['HA', 'S8'], current stack 970
player [Jinkun] gets hole card ['HT', 'S4'], current stack 951
player [YueShi] gets hole card ['C2', 'H9'], current stack 940
player [JoyoPlayer] gets hole card ['CK', 'S3'], current stack 2149
player [ZifengFoldMan] gets hole card ['D4', 'HQ'], current stack 940
player [KLChen2PokerPlayer] gets hole card ['CA', 'D8'], current stack 1014
Started the round 29
Street "preflop" started. (community card = [])
"Jinkun" declared "fold:10"
"YueShi" declared "fold:0"
"JoyoPlayer" declared "fold:0"
"ZifengFoldMan" declared "fold:0"
"KLChen2PokerPlayer" declared "raise:17"
"ZPlayer" declared "raise:24"
"NitWinWin" declared "fold:0"
"KLChen2PokerPlayer" declared "fold:0"
"['ZPlayer']" won the round 29 (stack = {'ZPlayer': 1051, 'NitWinWin': 970, 'Jinkun': 951, 'YueShi': 940, 'JoyoPlayer': 2149, 'ZifengFoldMan': 940, 'EvanPlayer': 0, 'KLChen2PokerPlayer': 997})
player [ZPlayer] gets hole card ['D8', 'C2'], current stack 1051
player [NitWinWin] gets hole card ['D3', 'S9'], current stack 965
player [Jinkun] gets hole card ['C8', 'DQ'], current stack 941
player [YueShi] gets hole card ['DJ', 'HK'], current stack 940
player [JoyoPlayer] gets hole card ['S3', 'HT'], current stack 2149
player [ZifengFoldMan] gets hole card ['CJ', 'H6'], current stack 940
player [KLChen2PokerPlayer] gets hole card ['DK', 'S5'], current stack 997
Started the round 30
Street "preflop" started. (community card = [])
"YueShi" declared "fold:0"
"JoyoPlayer" declared "fold:0"
"ZifengFoldMan" declared "fold:0"
"KLChen2PokerPlayer" declared "call:10"
"ZPlayer" declared "call:10"
"NitWinWin" declared "fold:0"
"Jinkun" declared "call:10"
Street "flop" started. (community card = ['D4', 'CQ', 'D7'])
"Jinkun" declared "call:0"
"KLChen2PokerPlayer" declared "call:0"
"ZPlayer" declared "call:0"
Street "turn" started. (community card = ['D4', 'CQ', 'D7', 'C4'])
"Jinkun" declared "call:0"
"KLChen2PokerPlayer" declared "call:0"
"ZPlayer" declared "call:0"
Street "river" started. (community card = ['D4', 'CQ', 'D7', 'C4', 'DA'])
"Jinkun" declared "call:0"
"KLChen2PokerPlayer" declared "call:0"
"ZPlayer" declared "call:0"
"['Jinkun']" won the round 30 (stack = {'ZPlayer': 1041, 'NitWinWin': 965, 'Jinkun': 976, 'YueShi': 940, 'JoyoPlayer': 2149, 'ZifengFoldMan': 940, 'EvanPlayer': 0, 'KLChen2PokerPlayer': 987})
player [ZPlayer] gets hole card ['C8', 'C2'], current stack 1041
player [NitWinWin] gets hole card ['D3', 'D5'], current stack 965
player [Jinkun] gets hole card ['SK', 'C9'], current stack 971
player [YueShi] gets hole card ['HK', 'H7'], current stack 930
player [JoyoPlayer] gets hole card ['CK', 'C5'], current stack 2149
player [ZifengFoldMan] gets hole card ['CJ', 'SJ'], current stack 940
player [KLChen2PokerPlayer] gets hole card ['D9', 'S7'], current stack 987
Started the round 31
Street "preflop" started. (community card = [])
"JoyoPlayer" declared "fold:0"
"ZifengFoldMan" declared "fold:0"
"KLChen2PokerPlayer" declared "call:10"
"ZPlayer" declared "call:10"
"NitWinWin" declared "fold:0"
"Jinkun" declared "call:10"
"YueShi" declared "fold:0"
Street "flop" started. (community card = ['ST', 'H2', 'HQ'])
"Jinkun" declared "call:0"
"KLChen2PokerPlayer" declared "call:0"
"ZPlayer" declared "raise:10"
"Jinkun" declared "call:10"
"KLChen2PokerPlayer" declared "fold:0"
Street "turn" started. (community card = ['ST', 'H2', 'HQ', 'H8'])
"Jinkun" declared "call:0"
"ZPlayer" declared "raise:10"
"Jinkun" declared "call:10"
Street "river" started. (community card = ['ST', 'H2', 'HQ', 'H8', 'HJ'])
"Jinkun" declared "call:0"
"ZPlayer" declared "call:0"
"['Jinkun']" won the round 31 (stack = {'ZPlayer': 1011, 'NitWinWin': 965, 'Jinkun': 1026, 'YueShi': 930, 'JoyoPlayer': 2149, 'ZifengFoldMan': 940, 'EvanPlayer': 0, 'KLChen2PokerPlayer': 977})
player [ZPlayer] gets hole card ['D6', 'C3'], current stack 1011
player [NitWinWin] gets hole card ['H8', 'C7'], current stack 965
player [Jinkun] gets hole card ['CQ', 'S4'], current stack 1026
player [YueShi] gets hole card ['S5', 'D4'], current stack 925
player [JoyoPlayer] gets hole card ['SA', 'C6'], current stack 2139
player [ZifengFoldMan] gets hole card ['CA', 'H7'], current stack 940
player [KLChen2PokerPlayer] gets hole card ['CT', 'DQ'], current stack 977
Started the round 32
Street "preflop" started. (community card = [])
"ZifengFoldMan" declared "fold:0"
"KLChen2PokerPlayer" declared "raise:19"
"ZPlayer" declared "call:19"
"NitWinWin" declared "fold:0"
"Jinkun" declared "fold:19"
"YueShi" declared "fold:0"
"JoyoPlayer" declared "fold:0"
Street "flop" started. (community card = ['ST', 'HK', 'HJ'])
"KLChen2PokerPlayer" declared "raise:31"
"ZPlayer" declared "fold:0"
"['KLChen2PokerPlayer']" won the round 32 (stack = {'ZPlayer': 992, 'NitWinWin': 965, 'Jinkun': 1026, 'YueShi': 925, 'JoyoPlayer': 2139, 'ZifengFoldMan': 940, 'EvanPlayer': 0, 'KLChen2PokerPlayer': 1011})
player [ZPlayer] gets hole card ['H8', 'SJ'], current stack 992
player [NitWinWin] gets hole card ['CQ', 'C5'], current stack 965
player [Jinkun] gets hole card ['DQ', 'HJ'], current stack 1026
player [YueShi] gets hole card ['D3', 'HK'], current stack 925
player [JoyoPlayer] gets hole card ['D5', 'DK'], current stack 2134
player [ZifengFoldMan] gets hole card ['H6', 'HT'], current stack 930
player [KLChen2PokerPlayer] gets hole card ['S9', 'HA'], current stack 1011
Started the round 33
Street "preflop" started. (community card = [])
"KLChen2PokerPlayer" declared "raise:18"
"ZPlayer" declared "call:18"
"NitWinWin" declared "fold:0"
"Jinkun" declared "fold:18"
"YueShi" declared "fold:0"
"JoyoPlayer" declared "fold:0"
"ZifengFoldMan" declared "fold:0"
Street "flop" started. (community card = ['D4', 'CJ', 'CT'])
"KLChen2PokerPlayer" declared "raise:12"
"ZPlayer" declared "call:12"
Street "turn" started. (community card = ['D4', 'CJ', 'CT', 'SA'])
"KLChen2PokerPlayer" declared "raise:469"
"ZPlayer" declared "fold:0"
"['KLChen2PokerPlayer']" won the round 33 (stack = {'ZPlayer': 962, 'NitWinWin': 965, 'Jinkun': 1026, 'YueShi': 925, 'JoyoPlayer': 2134, 'ZifengFoldMan': 930, 'EvanPlayer': 0, 'KLChen2PokerPlayer': 1056})
player [ZPlayer] gets hole card ['DK', 'C7'], current stack 962
player [NitWinWin] gets hole card ['CA', 'H5'], current stack 965
player [Jinkun] gets hole card ['H4', 'S6'], current stack 1026
player [YueShi] gets hole card ['D8', 'D2'], current stack 925
player [JoyoPlayer] gets hole card ['C4', 'S4'], current stack 2134
player [ZifengFoldMan] gets hole card ['C6', 'DJ'], current stack 925
player [KLChen2PokerPlayer] gets hole card ['S2', 'CT'], current stack 1046
Started the round 34
Street "preflop" started. (community card = [])
"ZPlayer" declared "call:10"
"NitWinWin" declared "fold:0"
"Jinkun" declared "fold:10"
"YueShi" declared "fold:0"
"JoyoPlayer" declared "fold:0"
"ZifengFoldMan" declared "fold:0"
"KLChen2PokerPlayer" declared "fold:0"
"['ZPlayer']" won the round 34 (stack = {'ZPlayer': 977, 'NitWinWin': 965, 'Jinkun': 1026, 'YueShi': 925, 'JoyoPlayer': 2134, 'ZifengFoldMan': 925, 'EvanPlayer': 0, 'KLChen2PokerPlayer': 1046})
player [ZPlayer] gets hole card ['C3', 'D4'], current stack 967
player [NitWinWin] gets hole card ['SQ', 'DA'], current stack 965
player [Jinkun] gets hole card ['C7', 'CJ'], current stack 1026
player [YueShi] gets hole card ['SA', 'H5'], current stack 925
player [JoyoPlayer] gets hole card ['D5', 'SJ'], current stack 2134
player [ZifengFoldMan] gets hole card ['CK', 'HJ'], current stack 925
player [KLChen2PokerPlayer] gets hole card ['D3', 'H8'], current stack 1041
Started the round 35
Street "preflop" started. (community card = [])
"NitWinWin" declared "fold:0"
"Jinkun" declared "fold:10"
"YueShi" declared "fold:0"
"JoyoPlayer" declared "raise:15"
"ZifengFoldMan" declared "fold:0"
"KLChen2PokerPlayer" declared "fold:0"
"ZPlayer" declared "fold:0"
"['JoyoPlayer']" won the round 35 (stack = {'ZPlayer': 967, 'NitWinWin': 965, 'Jinkun': 1026, 'YueShi': 925, 'JoyoPlayer': 2149, 'ZifengFoldMan': 925, 'EvanPlayer': 0, 'KLChen2PokerPlayer': 1041})
player [ZPlayer] gets hole card ['H6', 'CT'], current stack 962
player [NitWinWin] gets hole card ['HJ', 'DK'], current stack 955
player [Jinkun] gets hole card ['CQ', 'C6'], current stack 1026
player [YueShi] gets hole card ['S2', 'H7'], current stack 925
player [JoyoPlayer] gets hole card ['HT', 'H9'], current stack 2149
player [ZifengFoldMan] gets hole card ['D6', 'H3'], current stack 925
player [KLChen2PokerPlayer] gets hole card ['DT', 'DJ'], current stack 1041
Started the round 36
Street "preflop" started. (community card = [])
"Jinkun" declared "fold:10"
"YueShi" declared "fold:0"
"JoyoPlayer" declared "fold:0"
"ZifengFoldMan" declared "fold:0"
"KLChen2PokerPlayer" declared "raise:29"
"ZPlayer" declared "call:29"
"NitWinWin" declared "fold:0"
Street "flop" started. (community card = ['SA', 'S9', 'DQ'])
"ZPlayer" declared "call:0"
"KLChen2PokerPlayer" declared "raise:13"
"ZPlayer" declared "fold:0"
"['KLChen2PokerPlayer']" won the round 36 (stack = {'ZPlayer': 938, 'NitWinWin': 955, 'Jinkun': 1026, 'YueShi': 925, 'JoyoPlayer': 2149, 'ZifengFoldMan': 925, 'EvanPlayer': 0, 'KLChen2PokerPlayer': 1080})
player [ZPlayer] gets hole card ['C5', 'D6'], current stack 938
player [NitWinWin] gets hole card ['H4', 'C9'], current stack 950
player [Jinkun] gets hole card ['SK', 'C8'], current stack 1016
player [YueShi] gets hole card ['HQ', 'C2'], current stack 925
player [JoyoPlayer] gets hole card ['HJ', 'S6'], current stack 2149
player [ZifengFoldMan] gets hole card ['SQ', 'DQ'], current stack 925
player [KLChen2PokerPlayer] gets hole card ['CA', 'DA'], current stack 1080
Started the round 37
Street "preflop" started. (community card = [])
"YueShi" declared "fold:0"
"JoyoPlayer" declared "fold:0"
"ZifengFoldMan" declared "fold:0"
"KLChen2PokerPlayer" declared "raise:20"
"ZPlayer" declared "call:20"
"NitWinWin" declared "fold:0"
"Jinkun" declared "call:20"
Street "flop" started. (community card = ['H6', 'CJ', 'H7'])
"Jinkun" declared "call:0"
"KLChen2PokerPlayer" declared "raise:22"
"ZPlayer" declared "fold:0"
"Jinkun" declared "call:22"
Street "turn" started. (community card = ['H6', 'CJ', 'H7', 'DK'])
"Jinkun" declared "raise:45"
"KLChen2PokerPlayer" declared "raise:209"
"Jinkun" declared "call:209"
Street "river" started. (community card = ['H6', 'CJ', 'H7', 'DK', 'ST'])
"Jinkun" declared "raise:217"
"KLChen2PokerPlayer" declared "fold:0"
"['Jinkun']" won the round 37 (stack = {'ZPlayer': 918, 'NitWinWin': 950, 'Jinkun': 1302, 'YueShi': 925, 'JoyoPlayer': 2149, 'ZifengFoldMan': 925, 'EvanPlayer': 0, 'KLChen2PokerPlayer': 829})
player [ZPlayer] gets hole card ['SA', 'SK'], current stack 918
player [NitWinWin] gets hole card ['DK', 'C9'], current stack 950
player [Jinkun] gets hole card ['S4', 'S3'], current stack 1297
player [YueShi] gets hole card ['D9', 'CT'], current stack 915
player [JoyoPlayer] gets hole card ['C4', 'C3'], current stack 2149
player [ZifengFoldMan] gets hole card ['C6', 'D5'], current stack 925
player [KLChen2PokerPlayer] gets hole card ['D8', 'C2'], current stack 829
Started the round 38
Street "preflop" started. (community card = [])
"JoyoPlayer" declared "raise:15"
"ZifengFoldMan" declared "fold:0"
"KLChen2PokerPlayer" declared "fold:0"
"ZPlayer" declared "call:15"
"NitWinWin" declared "fold:0"
"Jinkun" declared "fold:15"
"YueShi" declared "fold:0"
Street "flop" started. (community card = ['D3', 'DT', 'S6'])
"JoyoPlayer" declared "raise:10"
"ZPlayer" declared "fold:0"
"['JoyoPlayer']" won the round 38 (stack = {'ZPlayer': 903, 'NitWinWin': 950, 'Jinkun': 1297, 'YueShi': 915, 'JoyoPlayer': 2179, 'ZifengFoldMan': 925, 'EvanPlayer': 0, 'KLChen2PokerPlayer': 829})
player [ZPlayer] gets hole card ['SK', 'HA'], current stack 903
player [NitWinWin] gets hole card ['DT', 'CK'], current stack 950
player [Jinkun] gets hole card ['DK', 'HK'], current stack 1297
player [YueShi] gets hole card ['C3', 'H5'], current stack 910
player [JoyoPlayer] gets hole card ['S8', 'S2'], current stack 2169
player [ZifengFoldMan] gets hole card ['HT', 'C2'], current stack 925
player [KLChen2PokerPlayer] gets hole card ['H8', 'CT'], current stack 829
Started the round 39
Street "preflop" started. (community card = [])
"ZifengFoldMan" declared "fold:0"
"KLChen2PokerPlayer" declared "raise:27"
"ZPlayer" declared "call:27"
"NitWinWin" declared "fold:0"
"Jinkun" declared "call:27"
"YueShi" declared "fold:0"
"JoyoPlayer" declared "raise:44"
"KLChen2PokerPlayer" declared "fold:0"
"ZPlayer" declared "call:44"
"Jinkun" declared "call:44"
Street "flop" started. (community card = ['CJ', 'H4', 'SJ'])
"JoyoPlayer" declared "raise:10"
"ZPlayer" declared "call:10"
"Jinkun" declared "call:10"
Street "turn" started. (community card = ['CJ', 'H4', 'SJ', 'C5'])
"JoyoPlayer" declared "raise:10"
"ZPlayer" declared "fold:0"
"Jinkun" declared "raise:86"
"JoyoPlayer" declared "fold:0"
"['Jinkun']" won the round 39 (stack = {'ZPlayer': 849, 'NitWinWin': 950, 'Jinkun': 1447, 'YueShi': 910, 'JoyoPlayer': 2115, 'ZifengFoldMan': 925, 'EvanPlayer': 0, 'KLChen2PokerPlayer': 802})
player [ZPlayer] gets hole card ['CJ', 'S5'], current stack 849
player [NitWinWin] gets hole card ['CK', 'D3'], current stack 950
player [Jinkun] gets hole card ['DQ', 'HQ'], current stack 1447
player [YueShi] gets hole card ['ST', 'H8'], current stack 910
player [JoyoPlayer] gets hole card ['SJ', 'SK'], current stack 2110
player [ZifengFoldMan] gets hole card ['DA', 'C7'], current stack 915
player [KLChen2PokerPlayer] gets hole card ['C3', 'DJ'], current stack 802
Started the round 40
Street "preflop" started. (community card = [])
"KLChen2PokerPlayer" declared "call:10"
"ZPlayer" declared "call:10"
"NitWinWin" declared "fold:0"
"Jinkun" declared "call:10"
"YueShi" declared "fold:0"
"JoyoPlayer" declared "fold:0"
"ZifengFoldMan" declared "fold:0"
Street "flop" started. (community card = ['SQ', 'S2', 'D5'])
"KLChen2PokerPlayer" declared "call:0"
"ZPlayer" declared "raise:10"
"Jinkun" declared "raise:24"
"KLChen2PokerPlayer" declared "fold:0"
"ZPlayer" declared "call:24"
Street "turn" started. (community card = ['SQ', 'S2', 'D5', 'D2'])
"ZPlayer" declared "raise:10"
"Jinkun" declared "raise:51"
"ZPlayer" declared "fold:0"
"['Jinkun']" won the round 40 (stack = {'ZPlayer': 805, 'NitWinWin': 950, 'Jinkun': 1516, 'YueShi': 910, 'JoyoPlayer': 2110, 'ZifengFoldMan': 915, 'EvanPlayer': 0, 'KLChen2PokerPlayer': 792})
player [ZPlayer] gets hole card ['D5', 'S4'], current stack 805
player [NitWinWin] gets hole card ['SJ', 'DK'], current stack 950
player [Jinkun] gets hole card ['D4', 'S6'], current stack 1516
player [YueShi] gets hole card ['DA', 'HK'], current stack 910
player [JoyoPlayer] gets hole card ['S3', 'SK'], current stack 2110
player [ZifengFoldMan] gets hole card ['S7', 'HQ'], current stack 910
player [KLChen2PokerPlayer] gets hole card ['H7', 'C9'], current stack 782
Started the round 41
Street "preflop" started. (community card = [])
"ZPlayer" declared "call:10"
"NitWinWin" declared "fold:0"
"Jinkun" declared "fold:10"
"YueShi" declared "fold:0"
"JoyoPlayer" declared "fold:0"
"ZifengFoldMan" declared "fold:0"
"KLChen2PokerPlayer" declared "raise:19"
"ZPlayer" declared "call:19"
Street "flop" started. (community card = ['C5', 'C2', 'S2'])
"KLChen2PokerPlayer" declared "call:0"
"ZPlayer" declared "raise:10"
"KLChen2PokerPlayer" declared "fold:0"
"['ZPlayer']" won the round 41 (stack = {'ZPlayer': 829, 'NitWinWin': 950, 'Jinkun': 1516, 'YueShi': 910, 'JoyoPlayer': 2110, 'ZifengFoldMan': 910, 'EvanPlayer': 0, 'KLChen2PokerPlayer': 773})
player [ZPlayer] gets hole card ['DA', 'H3'], current stack 819
player [NitWinWin] gets hole card ['SK', 'H5'], current stack 950
player [Jinkun] gets hole card ['CT', 'S4'], current stack 1516
player [YueShi] gets hole card ['S3', 'D9'], current stack 910
player [JoyoPlayer] gets hole card ['CJ', 'C9'], current stack 2110
player [ZifengFoldMan] gets hole card ['D2', 'D7'], current stack 910
player [KLChen2PokerPlayer] gets hole card ['S6', 'SA'], current stack 768
Started the round 42
Street "preflop" started. (community card = [])
"NitWinWin" declared "fold:0"
"Jinkun" declared "fold:10"
"YueShi" declared "fold:0"
"JoyoPlayer" declared "fold:0"
"ZifengFoldMan" declared "fold:0"
"KLChen2PokerPlayer" declared "raise:15"
"ZPlayer" declared "call:15"
Street "flop" started. (community card = ['D6', 'C8', 'CK'])
"KLChen2PokerPlayer" declared "raise:11"
"ZPlayer" declared "fold:0"
"['KLChen2PokerPlayer']" won the round 42 (stack = {'ZPlayer': 814, 'NitWinWin': 950, 'Jinkun': 1516, 'YueShi': 910, 'JoyoPlayer': 2110, 'ZifengFoldMan': 910, 'EvanPlayer': 0, 'KLChen2PokerPlayer': 788})
player [ZPlayer] gets hole card ['H8', 'H9'], current stack 809
player [NitWinWin] gets hole card ['SQ', 'S4'], current stack 940
player [Jinkun] gets hole card ['HJ', 'SK'], current stack 1516
player [YueShi] gets hole card ['C8', 'SA'], current stack 910
player [JoyoPlayer] gets hole card ['D6', 'CA'], current stack 2110
player [ZifengFoldMan] gets hole card ['S5', 'CQ'], current stack 910
player [KLChen2PokerPlayer] gets hole card ['H3', 'DA'], current stack 788
Started the round 43
Street "preflop" started. (community card = [])
"Jinkun" declared "fold:10"
"YueShi" declared "fold:0"
"JoyoPlayer" declared "raise:15"
"ZifengFoldMan" declared "fold:0"
"KLChen2PokerPlayer" declared "raise:20"
"ZPlayer" declared "call:20"
"NitWinWin" declared "fold:0"
"JoyoPlayer" declared "raise:25"
"KLChen2PokerPlayer" declared "fold:0"
"ZPlayer" declared "call:25"
Street "flop" started. (community card = ['CJ', 'C4', 'D9'])
"ZPlayer" declared "raise:10"
"JoyoPlayer" declared "fold:0"
"['ZPlayer']" won the round 43 (stack = {'ZPlayer': 869, 'NitWinWin': 940, 'Jinkun': 1516, 'YueShi': 910, 'JoyoPlayer': 2085, 'ZifengFoldMan': 910, 'EvanPlayer': 0, 'KLChen2PokerPlayer': 768})
player [ZPlayer] gets hole card ['DK', 'D4'], current stack 869
player [NitWinWin] gets hole card ['H3', 'S6'], current stack 935
player [Jinkun] gets hole card ['D5', 'S7'], current stack 1506
player [YueShi] gets hole card ['DT', 'C5'], current stack 910
player [JoyoPlayer] gets hole card ['SJ', 'HT'], current stack 2085
player [ZifengFoldMan] gets hole card ['DQ', 'H2'], current stack 910
player [KLChen2PokerPlayer] gets hole card ['DJ', 'C9'], current stack 768
Started the round 44
Street "preflop" started. (community card = [])
"YueShi" declared "fold:0"
"JoyoPlayer" declared "raise:15"
"ZifengFoldMan" declared "fold:0"
"KLChen2PokerPlayer" declared "raise:20"
"ZPlayer" declared "call:20"
"NitWinWin" declared "fold:0"
"Jinkun" declared "fold:20"
"JoyoPlayer" declared "raise:25"
"KLChen2PokerPlayer" declared "fold:0"
"ZPlayer" declared "call:25"
Street "flop" started. (community card = ['CT', 'S8', 'DA'])
"JoyoPlayer" declared "raise:20"
"ZPlayer" declared "fold:0"
"['JoyoPlayer']" won the round 44 (stack = {'ZPlayer': 844, 'NitWinWin': 935, 'Jinkun': 1506, 'YueShi': 910, 'JoyoPlayer': 2145, 'ZifengFoldMan': 910, 'EvanPlayer': 0, 'KLChen2PokerPlayer': 748})
player [ZPlayer] gets hole card ['HQ', 'C3'], current stack 844
player [NitWinWin] gets hole card ['H4', 'C5'], current stack 935
player [Jinkun] gets hole card ['H8', 'HJ'], current stack 1501
player [YueShi] gets hole card ['H5', 'H3'], current stack 900
player [JoyoPlayer] gets hole card ['S7', 'D4'], current stack 2145
player [ZifengFoldMan] gets hole card ['CA', 'H2'], current stack 910
player [KLChen2PokerPlayer] gets hole card ['C7', 'CK'], current stack 748
Started the round 45
Street "preflop" started. (community card = [])
"JoyoPlayer" declared "fold:0"
"ZifengFoldMan" declared "fold:0"
"KLChen2PokerPlayer" declared "raise:19"
"ZPlayer" declared "call:19"
"NitWinWin" declared "fold:0"
"Jinkun" declared "fold:19"
"YueShi" declared "fold:0"
Street "flop" started. (community card = ['H9', 'C4', 'S9'])
"KLChen2PokerPlayer" declared "raise:11"
"ZPlayer" declared "fold:0"
"['KLChen2PokerPlayer']" won the round 45 (stack = {'ZPlayer': 825, 'NitWinWin': 935, 'Jinkun': 1501, 'YueShi': 900, 'JoyoPlayer': 2145, 'ZifengFoldMan': 910, 'EvanPlayer': 0, 'KLChen2PokerPlayer': 782})
player [ZPlayer] gets hole card ['HT', 'H4'], current stack 825
player [NitWinWin] gets hole card ['D6', 'ST'], current stack 935
player [Jinkun] gets hole card ['SA', 'CJ'], current stack 1501
player [YueShi] gets hole card ['H2', 'S6'], current stack 895
player [JoyoPlayer] gets hole card ['C3', 'D8'], current stack 2135
player [ZifengFoldMan] gets hole card ['DK', 'HJ'], current stack 910
player [KLChen2PokerPlayer] gets hole card ['S4', 'CT'], current stack 782
Started the round 46
Street "preflop" started. (community card = [])
"ZifengFoldMan" declared "fold:0"
"KLChen2PokerPlayer" declared "fold:0"
"ZPlayer" declared "call:10"
"NitWinWin" declared "fold:0"
"Jinkun" declared "call:10"
"YueShi" declared "fold:0"
"JoyoPlayer" declared "fold:0"
Street "flop" started. (community card = ['H6', 'H8', 'CQ'])
"ZPlayer" declared "raise:10"
"Jinkun" declared "call:10"
Street "turn" started. (community card = ['H6', 'H8', 'CQ', 'H3'])
"ZPlayer" declared "raise:55"
"Jinkun" declared "fold:55"
"['ZPlayer']" won the round 46 (stack = {'ZPlayer': 860, 'NitWinWin': 935, 'Jinkun': 1481, 'YueShi': 895, 'JoyoPlayer': 2135, 'ZifengFoldMan': 910, 'EvanPlayer': 0, 'KLChen2PokerPlayer': 782})
player [ZPlayer] gets hole card ['CT', 'H4'], current stack 860
player [NitWinWin] gets hole card ['D2', 'D9'], current stack 935
player [Jinkun] gets hole card ['SA', 'D5'], current stack 1481
player [YueShi] gets hole card ['DQ', 'S9'], current stack 895
player [JoyoPlayer] gets hole card ['D3', 'H2'], current stack 2130
player [ZifengFoldMan] gets hole card ['HK', 'H5'], current stack 900
player [KLChen2PokerPlayer] gets hole card ['ST', 'C7'], current stack 782
Started the round 47
Street "preflop" started. (community card = [])
"KLChen2PokerPlayer" declared "call:10"
"ZPlayer" declared "call:10"
"NitWinWin" declared "fold:0"
"Jinkun" declared "fold:10"
"YueShi" declared "fold:0"
"JoyoPlayer" declared "fold:0"
"ZifengFoldMan" declared "fold:0"
Street "flop" started. (community card = ['H7', 'C6', 'D4'])
"KLChen2PokerPlayer" declared "raise:35"
"ZPlayer" declared "fold:0"
"['KLChen2PokerPlayer']" won the round 47 (stack = {'ZPlayer': 850, 'NitWinWin': 935, 'Jinkun': 1481, 'YueShi': 895, 'JoyoPlayer': 2130, 'ZifengFoldMan': 900, 'EvanPlayer': 0, 'KLChen2PokerPlayer': 807})
player [ZPlayer] gets hole card ['S4', 'DQ'], current stack 850
player [NitWinWin] gets hole card ['H4', 'H5'], current stack 935
player [Jinkun] gets hole card ['D2', 'H3'], current stack 1481
player [YueShi] gets hole card ['D5', 'C5'], current stack 895
player [JoyoPlayer] gets hole card ['HK', 'S3'], current stack 2130
player [ZifengFoldMan] gets hole card ['S5', 'CA'], current stack 895
player [KLChen2PokerPlayer] gets hole card ['C3', 'DK'], current stack 797
Started the round 48
Street "preflop" started. (community card = [])
"ZPlayer" declared "call:10"
"NitWinWin" declared "fold:0"
"Jinkun" declared "fold:10"
"YueShi" declared "fold:0"
"JoyoPlayer" declared "raise:15"
"ZifengFoldMan" declared "fold:0"
"KLChen2PokerPlayer" declared "fold:0"
"ZPlayer" declared "call:15"
Street "flop" started. (community card = ['CJ', 'CQ', 'C8'])
"ZPlayer" declared "raise:10"
"JoyoPlayer" declared "fold:0"
"['ZPlayer']" won the round 48 (stack = {'ZPlayer': 880, 'NitWinWin': 935, 'Jinkun': 1481, 'YueShi': 895, 'JoyoPlayer': 2115, 'ZifengFoldMan': 895, 'EvanPlayer': 0, 'KLChen2PokerPlayer': 797})
player [ZPlayer] gets hole card ['H5', 'S5'], current stack 870
player [NitWinWin] gets hole card ['S3', 'C7'], current stack 935
player [Jinkun] gets hole card ['HQ', 'CA'], current stack 1481
player [YueShi] gets hole card ['D3', 'H4'], current stack 895
player [JoyoPlayer] gets hole card ['S6', 'SJ'], current stack 2115
player [ZifengFoldMan] gets hole card ['D8', 'S8'], current stack 895
player [KLChen2PokerPlayer] gets hole card ['HA', 'D5'], current stack 792
Started the round 49
Street "preflop" started. (community card = [])
"NitWinWin" declared "fold:0"
"Jinkun" declared "fold:10"
"YueShi" declared "fold:0"
"JoyoPlayer" declared "fold:0"
"ZifengFoldMan" declared "fold:0"
"KLChen2PokerPlayer" declared "raise:18"
"ZPlayer" declared "call:18"
Street "flop" started. (community card = ['S2', 'C8', 'S9'])
"KLChen2PokerPlayer" declared "call:0"
"ZPlayer" declared "call:0"
Street "turn" started. (community card = ['S2', 'C8', 'S9', 'D6'])
"KLChen2PokerPlayer" declared "call:0"
"ZPlayer" declared "call:0"
Street "river" started. (community card = ['S2', 'C8', 'S9', 'D6', 'C3'])
"KLChen2PokerPlayer" declared "call:0"
"ZPlayer" declared "call:0"
"['ZPlayer']" won the round 49 (stack = {'ZPlayer': 898, 'NitWinWin': 935, 'Jinkun': 1481, 'YueShi': 895, 'JoyoPlayer': 2115, 'ZifengFoldMan': 895, 'EvanPlayer': 0, 'KLChen2PokerPlayer': 779})
player [ZPlayer] gets hole card ['HK', 'DQ'], current stack 893
player [NitWinWin] gets hole card ['D4', 'CJ'], current stack 925
player [Jinkun] gets hole card ['C4', 'SA'], current stack 1481
player [YueShi] gets hole card ['SQ', 'S3'], current stack 895
player [JoyoPlayer] gets hole card ['C7', 'SK'], current stack 2115
player [ZifengFoldMan] gets hole card ['D5', 'DK'], current stack 895
player [KLChen2PokerPlayer] gets hole card ['C3', 'D8'], current stack 779
Started the round 50
Street "preflop" started. (community card = [])
"Jinkun" declared "fold:10"
"YueShi" declared "fold:0"
"JoyoPlayer" declared "raise:15"
"ZifengFoldMan" declared "fold:0"
"KLChen2PokerPlayer" declared "fold:0"
"ZPlayer" declared "call:15"
"NitWinWin" declared "fold:0"
Street "flop" started. (community card = ['S7', 'CK', 'C9'])
"ZPlayer" declared "raise:40"
"JoyoPlayer" declared "call:40"
Street "turn" started. (community card = ['S7', 'CK', 'C9', 'HA'])
"ZPlayer" declared "raise:10"
"JoyoPlayer" declared "raise:40"
"ZPlayer" declared "call:40"
Street "river" started. (community card = ['S7', 'CK', 'C9', 'HA', 'S9'])
"ZPlayer" declared "raise:100"
"JoyoPlayer" declared "call:100"
"['ZPlayer', 'JoyoPlayer']" won the round 50 (stack = {'ZPlayer': 903, 'NitWinWin': 925, 'Jinkun': 1481, 'YueShi': 895, 'JoyoPlayer': 2120, 'ZifengFoldMan': 895, 'EvanPlayer': 0, 'KLChen2PokerPlayer': 779})

Game Results:
------------------------------------------------------------
Game 1:
Winner: JoyoPlayer (stack: 2120)
All players' stacks:
  ZPlayer: 903
  NitWinWin: 925
  Jinkun: 1481
  YueShi: 895
  JoyoPlayer: 2120
  ZifengFoldMan: 895
  EvanPlayer: 0
  KLChen2PokerPlayer: 779
------------------------------------------------------------
