player [YueShi] gets hole card ['C9', 'C3'], current stack 1000
player [HakulaPlayer] gets hole card ['S4', 'CK'], current stack 995
player [Jinkun] gets hole card ['S3', 'H6'], current stack 990
player [Ethan] gets hole card ['HJ', 'SK'], current stack 1000
player [PlayerXinZhu] gets hole card ['DJ', 'DQ'], current stack 1000
Started the round 1
Street "preflop" started. (community card = [])
"Ethan" declared "raise:150"
"PlayerXinZhu" declared "raise:290"
"YueShi" declared "fold:0"
"HakulaPlayer" declared "fold:0"
"Jinkun" declared "fold:290"
"Ethan" declared "call:290"
Street "flop" started. (community card = ['S7', 'DA', 'D7'])
"Ethan" declared "call:0"
"PlayerXinZhu" declared "raise:10"
"Ethan" declared "call:10"
Street "turn" started. (community card = ['S7', 'DA', 'D7', 'H3'])
"Ethan" declared "call:0"
"PlayerXinZhu" declared "raise:10"
"Ethan" declared "call:10"
Street "river" started. (community card = ['S7', 'DA', 'D7', 'H3', 'H5'])
"Ethan" declared "call:0"
"PlayerXinZhu" declared "raise:10"
"Ethan" declared "call:10"
"['Ethan']" won the round 1 (stack = {'YueShi': 1000, 'HakulaPlayer': 995, 'Jinkun': 990, 'Ethan': 1335, 'PlayerXinZhu': 680})
player [YueShi] gets hole card ['C4', 'H4'], current stack 1000
player [HakulaPlayer] gets hole card ['S7', 'DA'], current stack 995
player [Jinkun] gets hole card ['SK', 'DQ'], current stack 985
player [Ethan] gets hole card ['C3', 'H2'], current stack 1325
player [PlayerXinZhu] gets hole card ['C7', 'HT'], current stack 680
Started the round 2
Street "preflop" started. (community card = [])
"PlayerXinZhu" declared "fold:0"
"YueShi" declared "fold:0"
"HakulaPlayer" declared "call:10"
"Jinkun" declared "call:10"
"Ethan" declared "fold:0"
Street "flop" started. (community card = ['S9', 'CA', 'S6'])
"Jinkun" declared "call:0"
"HakulaPlayer" declared "raise:37"
"Jinkun" declared "fold:37"
"['HakulaPlayer']" won the round 2 (stack = {'YueShi': 1000, 'HakulaPlayer': 1015, 'Jinkun': 980, 'Ethan': 1325, 'PlayerXinZhu': 680})
player [YueShi] gets hole card ['H4', 'S4'], current stack 1000
player [HakulaPlayer] gets hole card ['H6', 'D9'], current stack 1015
player [Jinkun] gets hole card ['S8', 'C7'], current stack 980
player [Ethan] gets hole card ['H7', 'S2'], current stack 1320
player [PlayerXinZhu] gets hole card ['HJ', 'H9'], current stack 670
Started the round 3
Street "preflop" started. (community card = [])
"YueShi" declared "fold:0"
"HakulaPlayer" declared "fold:0"
"Jinkun" declared "call:10"
"Ethan" declared "fold:0"
"PlayerXinZhu" declared "raise:15"
"Jinkun" declared "fold:15"
"['PlayerXinZhu']" won the round 3 (stack = {'YueShi': 1000, 'HakulaPlayer': 1015, 'Jinkun': 970, 'Ethan': 1320, 'PlayerXinZhu': 695})
player [YueShi] gets hole card ['D7', 'C4'], current stack 990
player [HakulaPlayer] gets hole card ['HA', 'DA'], current stack 1015
player [Jinkun] gets hole card ['H3', 'C3'], current stack 970
player [Ethan] gets hole card ['DT', 'CQ'], current stack 1320
player [PlayerXinZhu] gets hole card ['S2', 'C5'], current stack 690
Started the round 4
Street "preflop" started. (community card = [])
"HakulaPlayer" declared "raise:35"
"Jinkun" declared "fold:35"
"Ethan" declared "fold:0"
"PlayerXinZhu" declared "fold:0"
"YueShi" declared "fold:0"
"['HakulaPlayer']" won the round 4 (stack = {'YueShi': 990, 'HakulaPlayer': 1030, 'Jinkun': 970, 'Ethan': 1320, 'PlayerXinZhu': 690})
player [YueShi] gets hole card ['CK', 'S5'], current stack 985
player [HakulaPlayer] gets hole card ['C4', 'S6'], current stack 1020
player [Jinkun] gets hole card ['D9', 'S9'], current stack 970
player [Ethan] gets hole card ['C6', 'S3'], current stack 1320
player [PlayerXinZhu] gets hole card ['DK', 'C8'], current stack 690
Started the round 5
Street "preflop" started. (community card = [])
"Jinkun" declared "fold:10"
"Ethan" declared "fold:0"
"PlayerXinZhu" declared "raise:15"
"YueShi" declared "fold:0"
"HakulaPlayer" declared "call:15"
Street "flop" started. (community card = ['CA', 'DT', 'C5'])
"HakulaPlayer" declared "call:0"
"PlayerXinZhu" declared "raise:10"
"HakulaPlayer" declared "fold:0"
"['PlayerXinZhu']" won the round 5 (stack = {'YueShi': 985, 'HakulaPlayer': 1015, 'Jinkun': 970, 'Ethan': 1320, 'PlayerXinZhu': 710})
player [YueShi] gets hole card ['DT', 'HT'], current stack 985
player [HakulaPlayer] gets hole card ['D2', 'S5'], current stack 1010
player [Jinkun] gets hole card ['H2', 'C6'], current stack 960
player [Ethan] gets hole card ['C7', 'H5'], current stack 1320
player [PlayerXinZhu] gets hole card ['D5', 'CT'], current stack 710
Started the round 6
Street "preflop" started. (community card = [])
"Ethan" declared "fold:0"
"PlayerXinZhu" declared "fold:0"
"YueShi" declared "fold:0"
"HakulaPlayer" declared "fold:0"
"['Jinkun']" won the round 6 (stack = {'YueShi': 985, 'HakulaPlayer': 1010, 'Jinkun': 975, 'Ethan': 1320, 'PlayerXinZhu': 710})
player [YueShi] gets hole card ['S4', 'DT'], current stack 985
player [HakulaPlayer] gets hole card ['D6', 'S9'], current stack 1010
player [Jinkun] gets hole card ['S7', 'C4'], current stack 970
player [Ethan] gets hole card ['C5', 'C9'], current stack 1310
player [PlayerXinZhu] gets hole card ['C3', 'D7'], current stack 710
Started the round 7
Street "preflop" started. (community card = [])
"PlayerXinZhu" declared "fold:0"
"YueShi" declared "fold:0"
"HakulaPlayer" declared "fold:0"
"Jinkun" declared "call:10"
"Ethan" declared "fold:0"
"['Jinkun']" won the round 7 (stack = {'YueShi': 985, 'HakulaPlayer': 1010, 'Jinkun': 985, 'Ethan': 1310, 'PlayerXinZhu': 710})
player [YueShi] gets hole card ['CJ', 'H9'], current stack 985
player [HakulaPlayer] gets hole card ['CK', 'C3'], current stack 1010
player [Jinkun] gets hole card ['C5', 'CT'], current stack 985
player [Ethan] gets hole card ['HT', 'HQ'], current stack 1305
player [PlayerXinZhu] gets hole card ['D9', 'S2'], current stack 700
Started the round 8
Street "preflop" started. (community card = [])
"YueShi" declared "fold:0"
"HakulaPlayer" declared "call:10"
"Jinkun" declared "call:10"
"Ethan" declared "fold:0"
"PlayerXinZhu" declared "fold:0"
Street "flop" started. (community card = ['H7', 'S7', 'SQ'])
"HakulaPlayer" declared "call:0"
"Jinkun" declared "call:0"
Street "turn" started. (community card = ['H7', 'S7', 'SQ', 'H5'])
"HakulaPlayer" declared "call:0"
"Jinkun" declared "call:0"
Street "river" started. (community card = ['H7', 'S7', 'SQ', 'H5', 'D7'])
"HakulaPlayer" declared "call:0"
"Jinkun" declared "call:0"
"['Jinkun']" won the round 8 (stack = {'YueShi': 985, 'HakulaPlayer': 1000, 'Jinkun': 1010, 'Ethan': 1305, 'PlayerXinZhu': 700})
player [YueShi] gets hole card ['DT', 'CQ'], current stack 975
player [HakulaPlayer] gets hole card ['H5', 'C6'], current stack 1000
player [Jinkun] gets hole card ['HA', 'HJ'], current stack 1010
player [Ethan] gets hole card ['ST', 'H2'], current stack 1305
player [PlayerXinZhu] gets hole card ['S8', 'HK'], current stack 695
Started the round 9
Street "preflop" started. (community card = [])
"HakulaPlayer" declared "fold:0"
"Jinkun" declared "call:10"
"Ethan" declared "fold:0"
"PlayerXinZhu" declared "fold:0"
"YueShi" declared "fold:0"
"['Jinkun']" won the round 9 (stack = {'YueShi': 975, 'HakulaPlayer': 1000, 'Jinkun': 1025, 'Ethan': 1305, 'PlayerXinZhu': 695})
player [YueShi] gets hole card ['D9', 'DA'], current stack 970
player [HakulaPlayer] gets hole card ['SQ', 'CQ'], current stack 990
player [Jinkun] gets hole card ['DK', 'DJ'], current stack 1025
player [Ethan] gets hole card ['H7', 'S8'], current stack 1305
player [PlayerXinZhu] gets hole card ['H9', 'HT'], current stack 695
Started the round 10
Street "preflop" started. (community card = [])
"Jinkun" declared "fold:10"
"Ethan" declared "fold:0"
"PlayerXinZhu" declared "fold:0"
"YueShi" declared "fold:0"
"['HakulaPlayer']" won the round 10 (stack = {'YueShi': 970, 'HakulaPlayer': 1005, 'Jinkun': 1025, 'Ethan': 1305, 'PlayerXinZhu': 695})
player [YueShi] gets hole card ['H2', 'D5'], current stack 970
player [HakulaPlayer] gets hole card ['H8', 'DT'], current stack 1000
player [Jinkun] gets hole card ['D7', 'S2'], current stack 1015
player [Ethan] gets hole card ['HK', 'D9'], current stack 1305
player [PlayerXinZhu] gets hole card ['H4', 'D6'], current stack 695
Started the round 11
Street "preflop" started. (community card = [])
"Ethan" declared "fold:0"
"PlayerXinZhu" declared "fold:0"
"YueShi" declared "fold:0"
"HakulaPlayer" declared "call:10"
"Jinkun" declared "call:10"
Street "flop" started. (community card = ['D4', 'C3', 'D8'])
"HakulaPlayer" declared "raise:25"
"Jinkun" declared "fold:25"
"['HakulaPlayer']" won the round 11 (stack = {'YueShi': 970, 'HakulaPlayer': 1015, 'Jinkun': 1015, 'Ethan': 1305, 'PlayerXinZhu': 695})
player [YueShi] gets hole card ['S7', 'H6'], current stack 970
player [HakulaPlayer] gets hole card ['H4', 'S2'], current stack 1015
player [Jinkun] gets hole card ['CK', 'DK'], current stack 1010
player [Ethan] gets hole card ['D3', 'DQ'], current stack 1295
player [PlayerXinZhu] gets hole card ['C2', 'DA'], current stack 695
Started the round 12
Street "preflop" started. (community card = [])
"PlayerXinZhu" declared "fold:0"
"YueShi" declared "fold:0"
"HakulaPlayer" declared "fold:0"
"Jinkun" declared "call:10"
"Ethan" declared "fold:0"
"['Jinkun']" won the round 12 (stack = {'YueShi': 970, 'HakulaPlayer': 1015, 'Jinkun': 1025, 'Ethan': 1295, 'PlayerXinZhu': 695})
player [YueShi] gets hole card ['DT', 'D4'], current stack 970
player [HakulaPlayer] gets hole card ['D2', 'CJ'], current stack 1015
player [Jinkun] gets hole card ['C2', 'D6'], current stack 1025
player [Ethan] gets hole card ['S2', 'SQ'], current stack 1290
player [PlayerXinZhu] gets hole card ['HK', 'CQ'], current stack 685
Started the round 13
Street "preflop" started. (community card = [])
"YueShi" declared "fold:0"
"HakulaPlayer" declared "fold:0"
"Jinkun" declared "call:10"
"Ethan" declared "fold:0"
"PlayerXinZhu" declared "fold:0"
"['Jinkun']" won the round 13 (stack = {'YueShi': 970, 'HakulaPlayer': 1015, 'Jinkun': 1040, 'Ethan': 1290, 'PlayerXinZhu': 685})
player [YueShi] gets hole card ['D3', 'D6'], current stack 960
player [HakulaPlayer] gets hole card ['C8', 'SQ'], current stack 1015
player [Jinkun] gets hole card ['S5', 'D2'], current stack 1040
player [Ethan] gets hole card ['CA', 'D4'], current stack 1290
player [PlayerXinZhu] gets hole card ['C5', 'C6'], current stack 680
Started the round 14
Street "preflop" started. (community card = [])
"HakulaPlayer" declared "fold:0"
"Jinkun" declared "call:10"
"Ethan" declared "fold:0"
"PlayerXinZhu" declared "fold:0"
"YueShi" declared "fold:0"
"['Jinkun']" won the round 14 (stack = {'YueShi': 960, 'HakulaPlayer': 1015, 'Jinkun': 1055, 'Ethan': 1290, 'PlayerXinZhu': 680})
player [YueShi] gets hole card ['DQ', 'H6'], current stack 955
player [HakulaPlayer] gets hole card ['HJ', 'H3'], current stack 1005
player [Jinkun] gets hole card ['S7', 'S6'], current stack 1055
player [Ethan] gets hole card ['D6', 'D2'], current stack 1290
player [PlayerXinZhu] gets hole card ['DJ', 'S8'], current stack 680
Started the round 15
Street "preflop" started. (community card = [])
"Jinkun" declared "fold:10"
"Ethan" declared "fold:0"
"PlayerXinZhu" declared "fold:0"
"YueShi" declared "fold:0"
"['HakulaPlayer']" won the round 15 (stack = {'YueShi': 955, 'HakulaPlayer': 1020, 'Jinkun': 1055, 'Ethan': 1290, 'PlayerXinZhu': 680})
player [YueShi] gets hole card ['SJ', 'ST'], current stack 955
player [HakulaPlayer] gets hole card ['DA', 'H4'], current stack 1015
player [Jinkun] gets hole card ['D7', 'CK'], current stack 1045
player [Ethan] gets hole card ['D3', 'D8'], current stack 1290
player [PlayerXinZhu] gets hole card ['S9', 'SQ'], current stack 680
Started the round 16
Street "preflop" started. (community card = [])
"Ethan" declared "fold:0"
"PlayerXinZhu" declared "fold:0"
"YueShi" declared "fold:0"
"HakulaPlayer" declared "call:10"
"Jinkun" declared "call:10"
Street "flop" started. (community card = ['C5', 'CA', 'S6'])
"HakulaPlayer" declared "raise:20"
"Jinkun" declared "call:20"
Street "turn" started. (community card = ['C5', 'CA', 'S6', 'DJ'])
"HakulaPlayer" declared "raise:92"
"Jinkun" declared "fold:92"
"['HakulaPlayer']" won the round 16 (stack = {'YueShi': 955, 'HakulaPlayer': 1050, 'Jinkun': 1025, 'Ethan': 1290, 'PlayerXinZhu': 680})
player [YueShi] gets hole card ['C3', 'C2'], current stack 955
player [HakulaPlayer] gets hole card ['CA', 'HK'], current stack 1050
player [Jinkun] gets hole card ['SK', 'H9'], current stack 1020
player [Ethan] gets hole card ['D2', 'C4'], current stack 1280
player [PlayerXinZhu] gets hole card ['S5', 'D4'], current stack 680
Started the round 17
Street "preflop" started. (community card = [])
"PlayerXinZhu" declared "fold:0"
"YueShi" declared "fold:0"
"HakulaPlayer" declared "raise:34"
"Jinkun" declared "fold:34"
"Ethan" declared "fold:0"
"['HakulaPlayer']" won the round 17 (stack = {'YueShi': 955, 'HakulaPlayer': 1065, 'Jinkun': 1020, 'Ethan': 1280, 'PlayerXinZhu': 680})
player [YueShi] gets hole card ['H3', 'H5'], current stack 955
player [HakulaPlayer] gets hole card ['H6', 'H7'], current stack 1065
player [Jinkun] gets hole card ['SJ', 'C7'], current stack 1020
player [Ethan] gets hole card ['HA', 'S5'], current stack 1275
player [PlayerXinZhu] gets hole card ['DA', 'S6'], current stack 670
Started the round 18
Street "preflop" started. (community card = [])
"YueShi" declared "fold:0"
"HakulaPlayer" declared "fold:0"
"Jinkun" declared "call:10"
"Ethan" declared "call:10"
"PlayerXinZhu" declared "fold:0"
Street "flop" started. (community card = ['C9', 'S2', 'CT'])
"Ethan" declared "call:0"
"Jinkun" declared "call:0"
Street "turn" started. (community card = ['C9', 'S2', 'CT', 'SA'])
"Ethan" declared "call:0"
"Jinkun" declared "call:0"
Street "river" started. (community card = ['C9', 'S2', 'CT', 'SA', 'C6'])
"Ethan" declared "raise:127"
"Jinkun" declared "raise:1010"
"Ethan" declared "fold:0"
"['Jinkun']" won the round 18 (stack = {'YueShi': 955, 'HakulaPlayer': 1065, 'Jinkun': 1167, 'Ethan': 1143, 'PlayerXinZhu': 670})
player [YueShi] gets hole card ['DQ', 'DJ'], current stack 945
player [HakulaPlayer] gets hole card ['C8', 'D8'], current stack 1065
player [Jinkun] gets hole card ['H2', 'C5'], current stack 1167
player [Ethan] gets hole card ['SK', 'D6'], current stack 1143
player [PlayerXinZhu] gets hole card ['S8', 'H7'], current stack 665
Started the round 19
Street "preflop" started. (community card = [])
"HakulaPlayer" declared "call:10"
"Jinkun" declared "fold:10"
"Ethan" declared "fold:0"
"PlayerXinZhu" declared "fold:0"
"YueShi" declared "fold:0"
"['HakulaPlayer']" won the round 19 (stack = {'YueShi': 945, 'HakulaPlayer': 1080, 'Jinkun': 1167, 'Ethan': 1143, 'PlayerXinZhu': 665})
player [YueShi] gets hole card ['C5', 'S4'], current stack 940
player [HakulaPlayer] gets hole card ['CT', 'D4'], current stack 1070
player [Jinkun] gets hole card ['HA', 'H2'], current stack 1167
player [Ethan] gets hole card ['D8', 'H7'], current stack 1143
player [PlayerXinZhu] gets hole card ['H6', 'H5'], current stack 665
Started the round 20
Street "preflop" started. (community card = [])
"Jinkun" declared "fold:10"
"Ethan" declared "fold:0"
"PlayerXinZhu" declared "fold:0"
"YueShi" declared "fold:0"
"['HakulaPlayer']" won the round 20 (stack = {'YueShi': 940, 'HakulaPlayer': 1085, 'Jinkun': 1167, 'Ethan': 1143, 'PlayerXinZhu': 665})
player [YueShi] gets hole card ['D5', 'S7'], current stack 940
player [HakulaPlayer] gets hole card ['SJ', 'HT'], current stack 1080
player [Jinkun] gets hole card ['D9', 'H6'], current stack 1157
player [Ethan] gets hole card ['DA', 'C6'], current stack 1143
player [PlayerXinZhu] gets hole card ['D7', 'S9'], current stack 665
Started the round 21
Street "preflop" started. (community card = [])
"Ethan" declared "fold:0"
"PlayerXinZhu" declared "fold:0"
"YueShi" declared "fold:0"
"HakulaPlayer" declared "call:10"
"Jinkun" declared "call:10"
Street "flop" started. (community card = ['D4', 'C9', 'HK'])
"HakulaPlayer" declared "call:0"
"Jinkun" declared "call:0"
Street "turn" started. (community card = ['D4', 'C9', 'HK', 'S8'])
"HakulaPlayer" declared "call:0"
"Jinkun" declared "call:0"
Street "river" started. (community card = ['D4', 'C9', 'HK', 'S8', 'HQ'])
"HakulaPlayer" declared "raise:41"
"Jinkun" declared "fold:41"
"['HakulaPlayer']" won the round 21 (stack = {'YueShi': 940, 'HakulaPlayer': 1095, 'Jinkun': 1157, 'Ethan': 1143, 'PlayerXinZhu': 665})
player [YueShi] gets hole card ['HK', 'H5'], current stack 940
player [HakulaPlayer] gets hole card ['D8', 'SK'], current stack 1095
player [Jinkun] gets hole card ['SA', 'S6'], current stack 1152
player [Ethan] gets hole card ['DK', 'C9'], current stack 1133
player [PlayerXinZhu] gets hole card ['H3', 'D3'], current stack 665
Started the round 22
Street "preflop" started. (community card = [])
"PlayerXinZhu" declared "fold:0"
"YueShi" declared "fold:0"
"HakulaPlayer" declared "call:10"
"Jinkun" declared "call:10"
"Ethan" declared "call:10"
Street "flop" started. (community card = ['HJ', 'S9', 'D6'])
"Jinkun" declared "call:0"
"Ethan" declared "call:0"
"HakulaPlayer" declared "call:0"
Street "turn" started. (community card = ['HJ', 'S9', 'D6', 'CJ'])
"Jinkun" declared "call:0"
"Ethan" declared "call:0"
"HakulaPlayer" declared "call:0"
Street "river" started. (community card = ['HJ', 'S9', 'D6', 'CJ', 'CQ'])
"Jinkun" declared "call:0"
"Ethan" declared "call:0"
"HakulaPlayer" declared "call:0"
"['Ethan']" won the round 22 (stack = {'YueShi': 940, 'HakulaPlayer': 1085, 'Jinkun': 1147, 'Ethan': 1163, 'PlayerXinZhu': 665})
player [YueShi] gets hole card ['C2', 'C4'], current stack 940
player [HakulaPlayer] gets hole card ['S5', 'H6'], current stack 1085
player [Jinkun] gets hole card ['SJ', 'C8'], current stack 1147
player [Ethan] gets hole card ['S4', 'S9'], current stack 1158
player [PlayerXinZhu] gets hole card ['C6', 'HK'], current stack 655
Started the round 23
Street "preflop" started. (community card = [])
"YueShi" declared "fold:0"
"HakulaPlayer" declared "fold:0"
"Jinkun" declared "call:10"
"Ethan" declared "fold:0"
"PlayerXinZhu" declared "fold:0"
"['Jinkun']" won the round 23 (stack = {'YueShi': 940, 'HakulaPlayer': 1085, 'Jinkun': 1162, 'Ethan': 1158, 'PlayerXinZhu': 655})
player [YueShi] gets hole card ['C2', 'C7'], current stack 930
player [HakulaPlayer] gets hole card ['H2', 'DQ'], current stack 1085
player [Jinkun] gets hole card ['CQ', 'C5'], current stack 1162
player [Ethan] gets hole card ['D9', 'H7'], current stack 1158
player [PlayerXinZhu] gets hole card ['C8', 'D4'], current stack 650
Started the round 24
Street "preflop" started. (community card = [])
"HakulaPlayer" declared "fold:0"
"Jinkun" declared "call:10"
"Ethan" declared "fold:0"
"PlayerXinZhu" declared "fold:0"
"YueShi" declared "fold:0"
"['Jinkun']" won the round 24 (stack = {'YueShi': 930, 'HakulaPlayer': 1085, 'Jinkun': 1177, 'Ethan': 1158, 'PlayerXinZhu': 650})
player [YueShi] gets hole card ['S5', 'S4'], current stack 925
player [HakulaPlayer] gets hole card ['S7', 'CJ'], current stack 1075
player [Jinkun] gets hole card ['C6', 'H9'], current stack 1177
player [Ethan] gets hole card ['DQ', 'D8'], current stack 1158
player [PlayerXinZhu] gets hole card ['CA', 'ST'], current stack 650
Started the round 25
Street "preflop" started. (community card = [])
"Jinkun" declared "fold:10"
"Ethan" declared "fold:0"
"PlayerXinZhu" declared "fold:0"
"YueShi" declared "fold:0"
"['HakulaPlayer']" won the round 25 (stack = {'YueShi': 925, 'HakulaPlayer': 1090, 'Jinkun': 1177, 'Ethan': 1158, 'PlayerXinZhu': 650})
player [YueShi] gets hole card ['S9', 'H2'], current stack 925
player [HakulaPlayer] gets hole card ['H8', 'SQ'], current stack 1085
player [Jinkun] gets hole card ['H9', 'S6'], current stack 1167
player [Ethan] gets hole card ['H5', 'HQ'], current stack 1158
player [PlayerXinZhu] gets hole card ['CQ', 'SJ'], current stack 650
Started the round 26
Street "preflop" started. (community card = [])
"Ethan" declared "fold:0"
"PlayerXinZhu" declared "fold:0"
"YueShi" declared "fold:0"
"HakulaPlayer" declared "call:10"
"Jinkun" declared "call:10"
Street "flop" started. (community card = ['HT', 'HK', 'S3'])
"HakulaPlayer" declared "call:0"
"Jinkun" declared "call:0"
Street "turn" started. (community card = ['HT', 'HK', 'S3', 'D3'])
"HakulaPlayer" declared "call:0"
"Jinkun" declared "call:0"
Street "river" started. (community card = ['HT', 'HK', 'S3', 'D3', 'D9'])
"HakulaPlayer" declared "call:0"
"Jinkun" declared "call:0"
"['Jinkun']" won the round 26 (stack = {'YueShi': 925, 'HakulaPlayer': 1080, 'Jinkun': 1187, 'Ethan': 1158, 'PlayerXinZhu': 650})
player [YueShi] gets hole card ['HA', 'HT'], current stack 925
player [HakulaPlayer] gets hole card ['D3', 'S5'], current stack 1080
player [Jinkun] gets hole card ['H8', 'S9'], current stack 1182
player [Ethan] gets hole card ['CK', 'C3'], current stack 1148
player [PlayerXinZhu] gets hole card ['DQ', 'S8'], current stack 650
Started the round 27
Street "preflop" started. (community card = [])
"PlayerXinZhu" declared "fold:0"
"YueShi" declared "fold:0"
"HakulaPlayer" declared "fold:0"
"Jinkun" declared "call:10"
"Ethan" declared "fold:0"
"['Jinkun']" won the round 27 (stack = {'YueShi': 925, 'HakulaPlayer': 1080, 'Jinkun': 1197, 'Ethan': 1148, 'PlayerXinZhu': 650})
player [YueShi] gets hole card ['D6', 'H4'], current stack 925
player [HakulaPlayer] gets hole card ['H8', 'C8'], current stack 1080
player [Jinkun] gets hole card ['S3', 'CQ'], current stack 1197
player [Ethan] gets hole card ['H9', 'HA'], current stack 1143
player [PlayerXinZhu] gets hole card ['C4', 'DQ'], current stack 640
Started the round 28
Street "preflop" started. (community card = [])
"YueShi" declared "fold:0"
"HakulaPlayer" declared "raise:37"
"Jinkun" declared "fold:37"
"Ethan" declared "call:37"
"PlayerXinZhu" declared "fold:0"
Street "flop" started. (community card = ['CJ', 'HT', 'HK'])
"Ethan" declared "call:0"
"HakulaPlayer" declared "call:0"
Street "turn" started. (community card = ['CJ', 'HT', 'HK', 'CT'])
"Ethan" declared "raise:84"
"HakulaPlayer" declared "fold:0"
"['Ethan']" won the round 28 (stack = {'YueShi': 925, 'HakulaPlayer': 1043, 'Jinkun': 1197, 'Ethan': 1195, 'PlayerXinZhu': 640})
player [YueShi] gets hole card ['D6', 'SK'], current stack 915
player [HakulaPlayer] gets hole card ['ST', 'D2'], current stack 1043
player [Jinkun] gets hole card ['D4', 'SQ'], current stack 1197
player [Ethan] gets hole card ['D9', 'H7'], current stack 1195
player [PlayerXinZhu] gets hole card ['HA', 'S5'], current stack 635
Started the round 29
Street "preflop" started. (community card = [])
"HakulaPlayer" declared "fold:0"
"Jinkun" declared "call:10"
"Ethan" declared "fold:0"
"PlayerXinZhu" declared "fold:0"
"YueShi" declared "fold:0"
"['Jinkun']" won the round 29 (stack = {'YueShi': 915, 'HakulaPlayer': 1043, 'Jinkun': 1212, 'Ethan': 1195, 'PlayerXinZhu': 635})
player [YueShi] gets hole card ['C3', 'D3'], current stack 910
player [HakulaPlayer] gets hole card ['C7', 'D4'], current stack 1033
player [Jinkun] gets hole card ['SJ', 'HA'], current stack 1212
player [Ethan] gets hole card ['S3', 'S8'], current stack 1195
player [PlayerXinZhu] gets hole card ['DQ', 'CJ'], current stack 635
Started the round 30
Street "preflop" started. (community card = [])
"Jinkun" declared "fold:10"
"Ethan" declared "fold:0"
"PlayerXinZhu" declared "fold:0"
"YueShi" declared "fold:0"
"['HakulaPlayer']" won the round 30 (stack = {'YueShi': 910, 'HakulaPlayer': 1048, 'Jinkun': 1212, 'Ethan': 1195, 'PlayerXinZhu': 635})
player [YueShi] gets hole card ['C8', 'SQ'], current stack 910
player [HakulaPlayer] gets hole card ['C5', 'SA'], current stack 1043
player [Jinkun] gets hole card ['C6', 'H4'], current stack 1202
player [Ethan] gets hole card ['D4', 'DA'], current stack 1195
player [PlayerXinZhu] gets hole card ['H9', 'HQ'], current stack 635
Started the round 31
Street "preflop" started. (community card = [])
"Ethan" declared "fold:0"
"PlayerXinZhu" declared "fold:0"
"YueShi" declared "fold:0"
"HakulaPlayer" declared "call:10"
"Jinkun" declared "call:10"
Street "flop" started. (community card = ['S6', 'D3', 'HT'])
"HakulaPlayer" declared "call:0"
"Jinkun" declared "call:0"
Street "turn" started. (community card = ['S6', 'D3', 'HT', 'H2'])
"HakulaPlayer" declared "call:0"
"Jinkun" declared "call:0"
Street "river" started. (community card = ['S6', 'D3', 'HT', 'H2', 'D8'])
"HakulaPlayer" declared "call:0"
"Jinkun" declared "call:0"
"['Jinkun']" won the round 31 (stack = {'YueShi': 910, 'HakulaPlayer': 1038, 'Jinkun': 1222, 'Ethan': 1195, 'PlayerXinZhu': 635})
player [YueShi] gets hole card ['C2', 'SA'], current stack 910
player [HakulaPlayer] gets hole card ['S6', 'ST'], current stack 1038
player [Jinkun] gets hole card ['S7', 'D5'], current stack 1217
player [Ethan] gets hole card ['DA', 'S8'], current stack 1185
player [PlayerXinZhu] gets hole card ['DK', 'DJ'], current stack 635
Started the round 32
Street "preflop" started. (community card = [])
"PlayerXinZhu" declared "fold:0"
"YueShi" declared "fold:0"
"HakulaPlayer" declared "call:10"
"Jinkun" declared "call:10"
"Ethan" declared "call:10"
Street "flop" started. (community card = ['C5', 'C8', 'S3'])
"Jinkun" declared "call:0"
"Ethan" declared "call:0"
"HakulaPlayer" declared "call:0"
Street "turn" started. (community card = ['C5', 'C8', 'S3', 'D2'])
"Jinkun" declared "call:0"
"Ethan" declared "call:0"
"HakulaPlayer" declared "call:0"
Street "river" started. (community card = ['C5', 'C8', 'S3', 'D2', 'HT'])
"Jinkun" declared "call:0"
"Ethan" declared "call:0"
"HakulaPlayer" declared "raise:36"
"Jinkun" declared "fold:36"
"Ethan" declared "raise:118"
"HakulaPlayer" declared "raise:292"
"Ethan" declared "call:292"
"['HakulaPlayer']" won the round 32 (stack = {'YueShi': 910, 'HakulaPlayer': 1350, 'Jinkun': 1212, 'Ethan': 893, 'PlayerXinZhu': 635})
player [YueShi] gets hole card ['H7', 'HT'], current stack 910
player [HakulaPlayer] gets hole card ['S3', 'H2'], current stack 1350
player [Jinkun] gets hole card ['D3', 'HJ'], current stack 1212
player [Ethan] gets hole card ['S7', 'C5'], current stack 888
player [PlayerXinZhu] gets hole card ['S2', 'DJ'], current stack 625
Started the round 33
Street "preflop" started. (community card = [])
"YueShi" declared "fold:0"
"HakulaPlayer" declared "raise:27"
"Jinkun" declared "fold:27"
"Ethan" declared "fold:0"
"PlayerXinZhu" declared "fold:0"
"['HakulaPlayer']" won the round 33 (stack = {'YueShi': 910, 'HakulaPlayer': 1365, 'Jinkun': 1212, 'Ethan': 888, 'PlayerXinZhu': 625})
player [YueShi] gets hole card ['SA', 'HA'], current stack 900
player [HakulaPlayer] gets hole card ['S5', 'DK'], current stack 1365
player [Jinkun] gets hole card ['CJ', 'C5'], current stack 1212
player [Ethan] gets hole card ['DQ', 'S4'], current stack 888
player [PlayerXinZhu] gets hole card ['D3', 'H3'], current stack 620
Started the round 34
Street "preflop" started. (community card = [])
"HakulaPlayer" declared "call:10"
"Jinkun" declared "fold:10"
"Ethan" declared "fold:0"
"PlayerXinZhu" declared "fold:0"
"YueShi" declared "fold:0"
"['HakulaPlayer']" won the round 34 (stack = {'YueShi': 900, 'HakulaPlayer': 1380, 'Jinkun': 1212, 'Ethan': 888, 'PlayerXinZhu': 620})
player [YueShi] gets hole card ['S7', 'HA'], current stack 895
player [HakulaPlayer] gets hole card ['CK', 'H8'], current stack 1370
player [Jinkun] gets hole card ['CA', 'CJ'], current stack 1212
player [Ethan] gets hole card ['SJ', 'CT'], current stack 888
player [PlayerXinZhu] gets hole card ['D6', 'C4'], current stack 620
Started the round 35
Street "preflop" started. (community card = [])
"Jinkun" declared "fold:10"
"Ethan" declared "call:10"
"PlayerXinZhu" declared "fold:0"
"YueShi" declared "fold:0"
"HakulaPlayer" declared "call:10"
Street "flop" started. (community card = ['C5', 'HK', 'H7'])
"HakulaPlayer" declared "raise:32"
"Ethan" declared "fold:0"
"['HakulaPlayer']" won the round 35 (stack = {'YueShi': 895, 'HakulaPlayer': 1395, 'Jinkun': 1212, 'Ethan': 878, 'PlayerXinZhu': 620})
player [YueShi] gets hole card ['D9', 'ST'], current stack 895
player [HakulaPlayer] gets hole card ['H2', 'DK'], current stack 1390
player [Jinkun] gets hole card ['H5', 'H3'], current stack 1202
player [Ethan] gets hole card ['CJ', 'S8'], current stack 878
player [PlayerXinZhu] gets hole card ['DQ', 'D6'], current stack 620
Started the round 36
Street "preflop" started. (community card = [])
"Ethan" declared "fold:0"
"PlayerXinZhu" declared "fold:0"
"YueShi" declared "fold:0"
"HakulaPlayer" declared "call:10"
"Jinkun" declared "raise:30"
"HakulaPlayer" declared "fold:0"
"['Jinkun']" won the round 36 (stack = {'YueShi': 895, 'HakulaPlayer': 1385, 'Jinkun': 1222, 'Ethan': 878, 'PlayerXinZhu': 620})
player [YueShi] gets hole card ['C9', 'S3'], current stack 895
player [HakulaPlayer] gets hole card ['DA', 'S4'], current stack 1385
player [Jinkun] gets hole card ['D2', 'D4'], current stack 1217
player [Ethan] gets hole card ['SK', 'D5'], current stack 868
player [PlayerXinZhu] gets hole card ['CJ', 'D8'], current stack 620
Started the round 37
Street "preflop" started. (community card = [])
"PlayerXinZhu" declared "fold:0"
"YueShi" declared "fold:0"
"HakulaPlayer" declared "call:10"
"Jinkun" declared "call:10"
"Ethan" declared "fold:0"
Street "flop" started. (community card = ['S2', 'C4', 'HK'])
"Jinkun" declared "raise:13"
"HakulaPlayer" declared "call:13"
Street "turn" started. (community card = ['S2', 'C4', 'HK', 'S8'])
"Jinkun" declared "raise:24"
"HakulaPlayer" declared "call:24"
Street "river" started. (community card = ['S2', 'C4', 'HK', 'S8', 'DT'])
"Jinkun" declared "raise:48"
"HakulaPlayer" declared "call:48"
"['Jinkun']" won the round 37 (stack = {'YueShi': 895, 'HakulaPlayer': 1290, 'Jinkun': 1327, 'Ethan': 868, 'PlayerXinZhu': 620})
player [YueShi] gets hole card ['CQ', 'H2'], current stack 895
player [HakulaPlayer] gets hole card ['DT', 'D9'], current stack 1290
player [Jinkun] gets hole card ['DK', 'C6'], current stack 1327
player [Ethan] gets hole card ['HJ', 'D6'], current stack 863
player [PlayerXinZhu] gets hole card ['HK', 'HQ'], current stack 610
Started the round 38
Street "preflop" started. (community card = [])
"YueShi" declared "fold:0"
"HakulaPlayer" declared "call:10"
"Jinkun" declared "call:10"
"Ethan" declared "fold:0"
"PlayerXinZhu" declared "fold:0"
Street "flop" started. (community card = ['SQ', 'SK', 'H4'])
"HakulaPlayer" declared "call:0"
"Jinkun" declared "raise:14"
"HakulaPlayer" declared "fold:0"
"['Jinkun']" won the round 38 (stack = {'YueShi': 895, 'HakulaPlayer': 1280, 'Jinkun': 1352, 'Ethan': 863, 'PlayerXinZhu': 610})
player [YueShi] gets hole card ['H4', 'S9'], current stack 885
player [HakulaPlayer] gets hole card ['H9', 'HQ'], current stack 1280
player [Jinkun] gets hole card ['SA', 'D2'], current stack 1352
player [Ethan] gets hole card ['D8', 'C7'], current stack 863
player [PlayerXinZhu] gets hole card ['ST', 'C8'], current stack 605
Started the round 39
Street "preflop" started. (community card = [])
"HakulaPlayer" declared "call:10"
"Jinkun" declared "fold:10"
"Ethan" declared "fold:0"
"PlayerXinZhu" declared "fold:0"
"YueShi" declared "fold:0"
"['HakulaPlayer']" won the round 39 (stack = {'YueShi': 885, 'HakulaPlayer': 1295, 'Jinkun': 1352, 'Ethan': 863, 'PlayerXinZhu': 605})
player [YueShi] gets hole card ['S8', 'D6'], current stack 880
player [HakulaPlayer] gets hole card ['C3', 'H9'], current stack 1285
player [Jinkun] gets hole card ['HQ', 'D5'], current stack 1352
player [Ethan] gets hole card ['C7', 'C5'], current stack 863
player [PlayerXinZhu] gets hole card ['D4', 'CJ'], current stack 605
Started the round 40
Street "preflop" started. (community card = [])
"Jinkun" declared "fold:10"
"Ethan" declared "fold:0"
"PlayerXinZhu" declared "fold:0"
"YueShi" declared "fold:0"
"['HakulaPlayer']" won the round 40 (stack = {'YueShi': 880, 'HakulaPlayer': 1300, 'Jinkun': 1352, 'Ethan': 863, 'PlayerXinZhu': 605})
player [YueShi] gets hole card ['H7', 'S2'], current stack 880
player [HakulaPlayer] gets hole card ['DA', 'C3'], current stack 1295
player [Jinkun] gets hole card ['D7', 'HA'], current stack 1342
player [Ethan] gets hole card ['DJ', 'SA'], current stack 863
player [PlayerXinZhu] gets hole card ['S9', 'C5'], current stack 605
Started the round 41
Street "preflop" started. (community card = [])
"Ethan" declared "raise:129"
"PlayerXinZhu" declared "fold:0"
"YueShi" declared "fold:0"
"HakulaPlayer" declared "fold:0"
"Jinkun" declared "fold:129"
"['Ethan']" won the round 41 (stack = {'YueShi': 880, 'HakulaPlayer': 1295, 'Jinkun': 1342, 'Ethan': 878, 'PlayerXinZhu': 605})
player [YueShi] gets hole card ['SQ', 'DJ'], current stack 880
player [HakulaPlayer] gets hole card ['DK', 'H7'], current stack 1295
player [Jinkun] gets hole card ['CQ', 'C7'], current stack 1337
player [Ethan] gets hole card ['H2', 'CA'], current stack 868
player [PlayerXinZhu] gets hole card ['S5', 'C9'], current stack 605
Started the round 42
Street "preflop" started. (community card = [])
"PlayerXinZhu" declared "fold:0"
"YueShi" declared "fold:0"
"HakulaPlayer" declared "call:10"
"Jinkun" declared "call:10"
"Ethan" declared "call:10"
Street "flop" started. (community card = ['H3', 'SK', 'D9'])
"Jinkun" declared "call:0"
"Ethan" declared "call:0"
"HakulaPlayer" declared "raise:43"
"Jinkun" declared "fold:43"
"Ethan" declared "fold:0"
"['HakulaPlayer']" won the round 42 (stack = {'YueShi': 880, 'HakulaPlayer': 1315, 'Jinkun': 1332, 'Ethan': 868, 'PlayerXinZhu': 605})
player [YueShi] gets hole card ['DQ', 'D7'], current stack 880
player [HakulaPlayer] gets hole card ['C8', 'SK'], current stack 1315
player [Jinkun] gets hole card ['H3', 'C5'], current stack 1332
player [Ethan] gets hole card ['D9', 'DJ'], current stack 863
player [PlayerXinZhu] gets hole card ['H4', 'HT'], current stack 595
Started the round 43
Street "preflop" started. (community card = [])
"YueShi" declared "fold:0"
"HakulaPlayer" declared "call:10"
"Jinkun" declared "call:10"
"Ethan" declared "fold:0"
"PlayerXinZhu" declared "fold:0"
Street "flop" started. (community card = ['S3', 'H5', 'C7'])
"HakulaPlayer" declared "call:0"
"Jinkun" declared "raise:14"
"HakulaPlayer" declared "fold:0"
"['Jinkun']" won the round 43 (stack = {'YueShi': 880, 'HakulaPlayer': 1305, 'Jinkun': 1357, 'Ethan': 863, 'PlayerXinZhu': 595})
player [YueShi] gets hole card ['CQ', 'ST'], current stack 870
player [HakulaPlayer] gets hole card ['H4', 'H6'], current stack 1305
player [Jinkun] gets hole card ['HJ', 'DA'], current stack 1357
player [Ethan] gets hole card ['C9', 'D6'], current stack 863
player [PlayerXinZhu] gets hole card ['DJ', 'CT'], current stack 590
Started the round 44
Street "preflop" started. (community card = [])
"HakulaPlayer" declared "fold:0"
"Jinkun" declared "call:10"
"Ethan" declared "fold:0"
"PlayerXinZhu" declared "fold:0"
"YueShi" declared "fold:0"
"['Jinkun']" won the round 44 (stack = {'YueShi': 870, 'HakulaPlayer': 1305, 'Jinkun': 1372, 'Ethan': 863, 'PlayerXinZhu': 590})
player [YueShi] gets hole card ['C7', 'C2'], current stack 865
player [HakulaPlayer] gets hole card ['HQ', 'S9'], current stack 1295
player [Jinkun] gets hole card ['H9', 'S6'], current stack 1372
player [Ethan] gets hole card ['HA', 'S7'], current stack 863
player [PlayerXinZhu] gets hole card ['H3', 'C4'], current stack 590
Started the round 45
Street "preflop" started. (community card = [])
"Jinkun" declared "fold:10"
"Ethan" declared "fold:0"
"PlayerXinZhu" declared "fold:0"
"YueShi" declared "fold:0"
"['HakulaPlayer']" won the round 45 (stack = {'YueShi': 865, 'HakulaPlayer': 1310, 'Jinkun': 1372, 'Ethan': 863, 'PlayerXinZhu': 590})
player [YueShi] gets hole card ['C6', 'H5'], current stack 865
player [HakulaPlayer] gets hole card ['HA', 'DK'], current stack 1305
player [Jinkun] gets hole card ['D8', 'C3'], current stack 1362
player [Ethan] gets hole card ['C9', 'D3'], current stack 863
player [PlayerXinZhu] gets hole card ['C2', 'C8'], current stack 590
Started the round 46
Street "preflop" started. (community card = [])
"Ethan" declared "fold:0"
"PlayerXinZhu" declared "fold:0"
"YueShi" declared "fold:0"
"HakulaPlayer" declared "call:10"
"Jinkun" declared "call:10"
Street "flop" started. (community card = ['D6', 'S6', 'CQ'])
"HakulaPlayer" declared "call:0"
"Jinkun" declared "call:0"
Street "turn" started. (community card = ['D6', 'S6', 'CQ', 'DT'])
"HakulaPlayer" declared "call:0"
"Jinkun" declared "call:0"
Street "river" started. (community card = ['D6', 'S6', 'CQ', 'DT', 'CT'])
"HakulaPlayer" declared "call:0"
"Jinkun" declared "call:0"
"['HakulaPlayer']" won the round 46 (stack = {'YueShi': 865, 'HakulaPlayer': 1320, 'Jinkun': 1362, 'Ethan': 863, 'PlayerXinZhu': 590})
player [YueShi] gets hole card ['S6', 'HT'], current stack 865
player [HakulaPlayer] gets hole card ['D4', 'H4'], current stack 1320
player [Jinkun] gets hole card ['S4', 'DA'], current stack 1357
player [Ethan] gets hole card ['S5', 'HA'], current stack 853
player [PlayerXinZhu] gets hole card ['C4', 'HQ'], current stack 590
Started the round 47
Street "preflop" started. (community card = [])
"PlayerXinZhu" declared "fold:0"
"YueShi" declared "fold:0"
"HakulaPlayer" declared "call:10"
"Jinkun" declared "call:10"
"Ethan" declared "call:10"
Street "flop" started. (community card = ['CQ', 'C3', 'H9'])
"Jinkun" declared "call:0"
"Ethan" declared "call:0"
"HakulaPlayer" declared "call:0"
Street "turn" started. (community card = ['CQ', 'C3', 'H9', 'S2'])
"Jinkun" declared "call:0"
"Ethan" declared "call:0"
"HakulaPlayer" declared "call:0"
Street "river" started. (community card = ['CQ', 'C3', 'H9', 'S2', 'C6'])
"Jinkun" declared "call:0"
"Ethan" declared "call:0"
"HakulaPlayer" declared "call:0"
"['HakulaPlayer']" won the round 47 (stack = {'YueShi': 865, 'HakulaPlayer': 1340, 'Jinkun': 1352, 'Ethan': 853, 'PlayerXinZhu': 590})
player [YueShi] gets hole card ['C5', 'S9'], current stack 865
player [HakulaPlayer] gets hole card ['ST', 'D2'], current stack 1340
player [Jinkun] gets hole card ['SQ', 'CT'], current stack 1352
player [Ethan] gets hole card ['HQ', 'D7'], current stack 848
player [PlayerXinZhu] gets hole card ['H9', 'D5'], current stack 580
Started the round 48
Street "preflop" started. (community card = [])
"YueShi" declared "fold:0"
"HakulaPlayer" declared "fold:0"
"Jinkun" declared "call:10"
"Ethan" declared "fold:0"
"PlayerXinZhu" declared "fold:0"
"['Jinkun']" won the round 48 (stack = {'YueShi': 865, 'HakulaPlayer': 1340, 'Jinkun': 1367, 'Ethan': 848, 'PlayerXinZhu': 580})
player [YueShi] gets hole card ['S4', 'C4'], current stack 855
player [HakulaPlayer] gets hole card ['S7', 'H4'], current stack 1340
player [Jinkun] gets hole card ['CJ', 'C3'], current stack 1367
player [Ethan] gets hole card ['CQ', 'C7'], current stack 848
player [PlayerXinZhu] gets hole card ['SJ', 'HK'], current stack 575
Started the round 49
Street "preflop" started. (community card = [])
"HakulaPlayer" declared "fold:0"
"Jinkun" declared "call:10"
"Ethan" declared "fold:0"
"PlayerXinZhu" declared "fold:0"
"YueShi" declared "fold:0"
"['Jinkun']" won the round 49 (stack = {'YueShi': 855, 'HakulaPlayer': 1340, 'Jinkun': 1382, 'Ethan': 848, 'PlayerXinZhu': 575})
player [YueShi] gets hole card ['CT', 'S6'], current stack 850
player [HakulaPlayer] gets hole card ['H4', 'HT'], current stack 1330
player [Jinkun] gets hole card ['D4', 'D9'], current stack 1382
player [Ethan] gets hole card ['H3', 'H8'], current stack 848
player [PlayerXinZhu] gets hole card ['SK', 'DK'], current stack 575
Started the round 50
Street "preflop" started. (community card = [])
"Jinkun" declared "fold:10"
"Ethan" declared "fold:0"
"PlayerXinZhu" declared "fold:0"
"YueShi" declared "fold:0"
"['HakulaPlayer']" won the round 50 (stack = {'YueShi': 850, 'HakulaPlayer': 1345, 'Jinkun': 1382, 'Ethan': 848, 'PlayerXinZhu': 575})

Game Results:
------------------------------------------------------------
Game 1:
Winner: Jinkun (stack: 1382)
All players' stacks:
  YueShi: 850
  HakulaPlayer: 1345
  Jinkun: 1382
  Ethan: 848
  PlayerXinZhu: 575
------------------------------------------------------------
