player [YueShi] gets hole card ['H9', 'D2'], current stack 1000
player [HakulaPlayer] gets hole card ['C7', 'SQ'], current stack 995
player [Jinkun] gets hole card ['CK', 'S2'], current stack 990
player [Ethan] gets hole card ['DJ', 'HQ'], current stack 1000
player [PlayerXinZhu] gets hole card ['SJ', 'D8'], current stack 1000
Started the round 1
Street "preflop" started. (community card = [])
"Ethan" declared "raise:150"
"PlayerXinZhu" declared "raise:290"
"YueShi" declared "fold:0"
"HakulaPlayer" declared "fold:0"
"Jinkun" declared "fold:290"
"Ethan" declared "call:290"
Street "flop" started. (community card = ['H7', 'S8', 'C2'])
"Ethan" declared "call:0"
"PlayerXinZhu" declared "raise:10"
"Ethan" declared "call:10"
Street "turn" started. (community card = ['H7', 'S8', 'C2', 'D9'])
"Ethan" declared "call:0"
"PlayerXinZhu" declared "raise:10"
"Ethan" declared "call:10"
Street "river" started. (community card = ['H7', 'S8', 'C2', 'D9', 'SK'])
"Ethan" declared "call:0"
"PlayerXinZhu" declared "raise:10"
"Ethan" declared "call:10"
"['PlayerXinZhu']" won the round 1 (stack = {'YueShi': 1000, 'HakulaPlayer': 995, 'Jinkun': 990, 'Ethan': 680, 'PlayerXinZhu': 1335})
player [YueShi] gets hole card ['DQ', 'C5'], current stack 1000
player [HakulaPlayer] gets hole card ['CQ', 'D5'], current stack 995
player [Jinkun] gets hole card ['DK', 'C7'], current stack 985
player [Ethan] gets hole card ['D4', 'ST'], current stack 670
player [PlayerXinZhu] gets hole card ['CA', 'H5'], current stack 1335
Started the round 2
Street "preflop" started. (community card = [])
"PlayerXinZhu" declared "fold:0"
"YueShi" declared "fold:0"
"HakulaPlayer" declared "call:10"
"Jinkun" declared "call:10"
"Ethan" declared "fold:0"
Street "flop" started. (community card = ['H8', 'D3', 'SJ'])
"Jinkun" declared "raise:90"
"HakulaPlayer" declared "fold:0"
"['Jinkun']" won the round 2 (stack = {'YueShi': 1000, 'HakulaPlayer': 985, 'Jinkun': 1010, 'Ethan': 670, 'PlayerXinZhu': 1335})
player [YueShi] gets hole card ['S8', 'D8'], current stack 1000
player [HakulaPlayer] gets hole card ['S4', 'C7'], current stack 985
player [Jinkun] gets hole card ['D7', 'D6'], current stack 1010
player [Ethan] gets hole card ['HK', 'C5'], current stack 665
player [PlayerXinZhu] gets hole card ['ST', 'H6'], current stack 1325
Started the round 3
Street "preflop" started. (community card = [])
"YueShi" declared "fold:0"
"HakulaPlayer" declared "fold:0"
"Jinkun" declared "call:10"
"Ethan" declared "fold:0"
"PlayerXinZhu" declared "fold:0"
"['Jinkun']" won the round 3 (stack = {'YueShi': 1000, 'HakulaPlayer': 985, 'Jinkun': 1025, 'Ethan': 665, 'PlayerXinZhu': 1325})
player [YueShi] gets hole card ['H7', 'CA'], current stack 990
player [HakulaPlayer] gets hole card ['H4', 'H6'], current stack 985
player [Jinkun] gets hole card ['HK', 'SJ'], current stack 1025
player [Ethan] gets hole card ['H9', 'CJ'], current stack 665
player [PlayerXinZhu] gets hole card ['C2', 'S3'], current stack 1320
Started the round 4
Street "preflop" started. (community card = [])
"HakulaPlayer" declared "fold:0"
"Jinkun" declared "call:10"
"Ethan" declared "fold:0"
"PlayerXinZhu" declared "fold:0"
"YueShi" declared "fold:0"
"['Jinkun']" won the round 4 (stack = {'YueShi': 990, 'HakulaPlayer': 985, 'Jinkun': 1040, 'Ethan': 665, 'PlayerXinZhu': 1320})
player [YueShi] gets hole card ['H2', 'D5'], current stack 985
player [HakulaPlayer] gets hole card ['C4', 'H4'], current stack 975
player [Jinkun] gets hole card ['C8', 'H3'], current stack 1040
player [Ethan] gets hole card ['C5', 'D3'], current stack 665
player [PlayerXinZhu] gets hole card ['CJ', 'C9'], current stack 1320
Started the round 5
Street "preflop" started. (community card = [])
"Jinkun" declared "fold:10"
"Ethan" declared "fold:0"
"PlayerXinZhu" declared "raise:15"
"YueShi" declared "fold:0"
"HakulaPlayer" declared "call:15"
Street "flop" started. (community card = ['S6', 'HK', 'S7'])
"HakulaPlayer" declared "call:0"
"PlayerXinZhu" declared "raise:10"
"HakulaPlayer" declared "fold:0"
"['PlayerXinZhu']" won the round 5 (stack = {'YueShi': 985, 'HakulaPlayer': 970, 'Jinkun': 1040, 'Ethan': 665, 'PlayerXinZhu': 1340})
player [YueShi] gets hole card ['C9', 'D3'], current stack 985
player [HakulaPlayer] gets hole card ['HA', 'CQ'], current stack 965
player [Jinkun] gets hole card ['D9', 'H7'], current stack 1030
player [Ethan] gets hole card ['D6', 'S8'], current stack 665
player [PlayerXinZhu] gets hole card ['DK', 'C3'], current stack 1340
Started the round 6
Street "preflop" started. (community card = [])
"Ethan" declared "fold:0"
"PlayerXinZhu" declared "fold:0"
"YueShi" declared "fold:0"
"HakulaPlayer" declared "call:10"
"Jinkun" declared "call:10"
Street "flop" started. (community card = ['D2', 'H8', 'H9'])
"HakulaPlayer" declared "call:0"
"Jinkun" declared "call:0"
Street "turn" started. (community card = ['D2', 'H8', 'H9', 'CJ'])
"HakulaPlayer" declared "call:0"
"Jinkun" declared "call:0"
Street "river" started. (community card = ['D2', 'H8', 'H9', 'CJ', 'H5'])
"HakulaPlayer" declared "call:0"
"Jinkun" declared "call:0"
"['Jinkun']" won the round 6 (stack = {'YueShi': 985, 'HakulaPlayer': 960, 'Jinkun': 1050, 'Ethan': 665, 'PlayerXinZhu': 1340})
player [YueShi] gets hole card ['CA', 'D6'], current stack 985
player [HakulaPlayer] gets hole card ['H2', 'H8'], current stack 960
player [Jinkun] gets hole card ['S6', 'D8'], current stack 1045
player [Ethan] gets hole card ['C6', 'S9'], current stack 655
player [PlayerXinZhu] gets hole card ['ST', 'S8'], current stack 1340
Started the round 7
Street "preflop" started. (community card = [])
"PlayerXinZhu" declared "fold:0"
"YueShi" declared "fold:0"
"HakulaPlayer" declared "fold:0"
"Jinkun" declared "raise:30"
"Ethan" declared "fold:0"
"['Jinkun']" won the round 7 (stack = {'YueShi': 985, 'HakulaPlayer': 960, 'Jinkun': 1060, 'Ethan': 655, 'PlayerXinZhu': 1340})
player [YueShi] gets hole card ['ST', 'SQ'], current stack 985
player [HakulaPlayer] gets hole card ['H5', 'H6'], current stack 960
player [Jinkun] gets hole card ['HK', 'CQ'], current stack 1060
player [Ethan] gets hole card ['S7', 'H8'], current stack 650
player [PlayerXinZhu] gets hole card ['S4', 'DK'], current stack 1330
Started the round 8
Street "preflop" started. (community card = [])
"YueShi" declared "fold:0"
"HakulaPlayer" declared "fold:0"
"Jinkun" declared "call:10"
"Ethan" declared "call:10"
"PlayerXinZhu" declared "fold:0"
Street "flop" started. (community card = ['H7', 'D3', 'D2'])
"Ethan" declared "call:0"
"Jinkun" declared "raise:90"
"Ethan" declared "call:90"
Street "turn" started. (community card = ['H7', 'D3', 'D2', 'S2'])
"Ethan" declared "raise:210"
"Jinkun" declared "fold:210"
"['Ethan']" won the round 8 (stack = {'YueShi': 985, 'HakulaPlayer': 960, 'Jinkun': 960, 'Ethan': 765, 'PlayerXinZhu': 1330})
player [YueShi] gets hole card ['C5', 'DJ'], current stack 975
player [HakulaPlayer] gets hole card ['SJ', 'H9'], current stack 960
player [Jinkun] gets hole card ['HK', 'S9'], current stack 960
player [Ethan] gets hole card ['D4', 'H6'], current stack 765
player [PlayerXinZhu] gets hole card ['SQ', 'H8'], current stack 1325
Started the round 9
Street "preflop" started. (community card = [])
"HakulaPlayer" declared "fold:0"
"Jinkun" declared "call:10"
"Ethan" declared "fold:0"
"PlayerXinZhu" declared "fold:0"
"YueShi" declared "fold:0"
"['Jinkun']" won the round 9 (stack = {'YueShi': 975, 'HakulaPlayer': 960, 'Jinkun': 975, 'Ethan': 765, 'PlayerXinZhu': 1325})
player [YueShi] gets hole card ['HQ', 'CJ'], current stack 970
player [HakulaPlayer] gets hole card ['H5', 'C5'], current stack 950
player [Jinkun] gets hole card ['S5', 'C2'], current stack 975
player [Ethan] gets hole card ['S3', 'CA'], current stack 765
player [PlayerXinZhu] gets hole card ['C7', 'HA'], current stack 1325
Started the round 10
Street "preflop" started. (community card = [])
"Jinkun" declared "fold:10"
"Ethan" declared "fold:0"
"PlayerXinZhu" declared "fold:0"
"YueShi" declared "fold:0"
"['HakulaPlayer']" won the round 10 (stack = {'YueShi': 970, 'HakulaPlayer': 965, 'Jinkun': 975, 'Ethan': 765, 'PlayerXinZhu': 1325})
player [YueShi] gets hole card ['H3', 'HT'], current stack 970
player [HakulaPlayer] gets hole card ['C2', 'S6'], current stack 960
player [Jinkun] gets hole card ['H5', 'C9'], current stack 965
player [Ethan] gets hole card ['D2', 'DK'], current stack 765
player [PlayerXinZhu] gets hole card ['DA', 'D8'], current stack 1325
Started the round 11
Street "preflop" started. (community card = [])
"Ethan" declared "fold:0"
"PlayerXinZhu" declared "fold:0"
"YueShi" declared "fold:0"
"HakulaPlayer" declared "fold:0"
"['Jinkun']" won the round 11 (stack = {'YueShi': 970, 'HakulaPlayer': 960, 'Jinkun': 980, 'Ethan': 765, 'PlayerXinZhu': 1325})
player [YueShi] gets hole card ['D8', 'D4'], current stack 970
player [HakulaPlayer] gets hole card ['HA', 'S8'], current stack 960
player [Jinkun] gets hole card ['D5', 'C5'], current stack 975
player [Ethan] gets hole card ['S2', 'CQ'], current stack 755
player [PlayerXinZhu] gets hole card ['D2', 'SQ'], current stack 1325
Started the round 12
Street "preflop" started. (community card = [])
"PlayerXinZhu" declared "fold:0"
"YueShi" declared "fold:0"
"HakulaPlayer" declared "call:10"
"Jinkun" declared "call:10"
"Ethan" declared "fold:0"
Street "flop" started. (community card = ['S7', 'S4', 'H2'])
"Jinkun" declared "call:0"
"HakulaPlayer" declared "call:0"
Street "turn" started. (community card = ['S7', 'S4', 'H2', 'S9'])
"Jinkun" declared "call:0"
"HakulaPlayer" declared "call:0"
Street "river" started. (community card = ['S7', 'S4', 'H2', 'S9', 'C9'])
"Jinkun" declared "call:0"
"HakulaPlayer" declared "call:0"
"['Jinkun']" won the round 12 (stack = {'YueShi': 970, 'HakulaPlayer': 950, 'Jinkun': 1000, 'Ethan': 755, 'PlayerXinZhu': 1325})
player [YueShi] gets hole card ['D4', 'SK'], current stack 970
player [HakulaPlayer] gets hole card ['DK', 'S4'], current stack 950
player [Jinkun] gets hole card ['DA', 'D9'], current stack 1000
player [Ethan] gets hole card ['C2', 'H6'], current stack 750
player [PlayerXinZhu] gets hole card ['HQ', 'H4'], current stack 1315
Started the round 13
Street "preflop" started. (community card = [])
"YueShi" declared "fold:0"
"HakulaPlayer" declared "fold:0"
"Jinkun" declared "call:10"
"Ethan" declared "fold:0"
"PlayerXinZhu" declared "fold:0"
"['Jinkun']" won the round 13 (stack = {'YueShi': 970, 'HakulaPlayer': 950, 'Jinkun': 1015, 'Ethan': 750, 'PlayerXinZhu': 1315})
player [YueShi] gets hole card ['H3', 'H8'], current stack 960
player [HakulaPlayer] gets hole card ['SJ', 'C8'], current stack 950
player [Jinkun] gets hole card ['D2', 'D3'], current stack 1015
player [Ethan] gets hole card ['DT', 'D6'], current stack 750
player [PlayerXinZhu] gets hole card ['CQ', 'D5'], current stack 1310
Started the round 14
Street "preflop" started. (community card = [])
"HakulaPlayer" declared "fold:0"
"Jinkun" declared "call:10"
"Ethan" declared "fold:0"
"PlayerXinZhu" declared "fold:0"
"YueShi" declared "fold:0"
"['Jinkun']" won the round 14 (stack = {'YueShi': 960, 'HakulaPlayer': 950, 'Jinkun': 1030, 'Ethan': 750, 'PlayerXinZhu': 1310})
player [YueShi] gets hole card ['DK', 'D5'], current stack 955
player [HakulaPlayer] gets hole card ['C9', 'C2'], current stack 940
player [Jinkun] gets hole card ['H5', 'C6'], current stack 1030
player [Ethan] gets hole card ['SA', 'H8'], current stack 750
player [PlayerXinZhu] gets hole card ['D3', 'H4'], current stack 1310
Started the round 15
Street "preflop" started. (community card = [])
"Jinkun" declared "fold:10"
"Ethan" declared "fold:0"
"PlayerXinZhu" declared "fold:0"
"YueShi" declared "fold:0"
"['HakulaPlayer']" won the round 15 (stack = {'YueShi': 955, 'HakulaPlayer': 955, 'Jinkun': 1030, 'Ethan': 750, 'PlayerXinZhu': 1310})
player [YueShi] gets hole card ['D4', 'C9'], current stack 955
player [HakulaPlayer] gets hole card ['HQ', 'C3'], current stack 950
player [Jinkun] gets hole card ['D8', 'SK'], current stack 1020
player [Ethan] gets hole card ['C2', 'C7'], current stack 750
player [PlayerXinZhu] gets hole card ['D3', 'S4'], current stack 1310
Started the round 16
Street "preflop" started. (community card = [])
"Ethan" declared "fold:0"
"PlayerXinZhu" declared "fold:0"
"YueShi" declared "fold:0"
"HakulaPlayer" declared "fold:0"
"['Jinkun']" won the round 16 (stack = {'YueShi': 955, 'HakulaPlayer': 950, 'Jinkun': 1035, 'Ethan': 750, 'PlayerXinZhu': 1310})
player [YueShi] gets hole card ['CJ', 'H4'], current stack 955
player [HakulaPlayer] gets hole card ['H9', 'C2'], current stack 950
player [Jinkun] gets hole card ['SJ', 'D4'], current stack 1030
player [Ethan] gets hole card ['D5', 'HQ'], current stack 740
player [PlayerXinZhu] gets hole card ['D2', 'HT'], current stack 1310
Started the round 17
Street "preflop" started. (community card = [])
"PlayerXinZhu" declared "fold:0"
"YueShi" declared "fold:0"
"HakulaPlayer" declared "fold:0"
"Jinkun" declared "call:10"
"Ethan" declared "fold:0"
"['Jinkun']" won the round 17 (stack = {'YueShi': 955, 'HakulaPlayer': 950, 'Jinkun': 1045, 'Ethan': 740, 'PlayerXinZhu': 1310})
player [YueShi] gets hole card ['C3', 'ST'], current stack 955
player [HakulaPlayer] gets hole card ['C7', 'C5'], current stack 950
player [Jinkun] gets hole card ['HJ', 'D3'], current stack 1045
player [Ethan] gets hole card ['SK', 'S7'], current stack 735
player [PlayerXinZhu] gets hole card ['CJ', 'DK'], current stack 1300
Started the round 18
Street "preflop" started. (community card = [])
"YueShi" declared "fold:0"
"HakulaPlayer" declared "fold:0"
"Jinkun" declared "call:10"
"Ethan" declared "fold:0"
"PlayerXinZhu" declared "fold:0"
"['Jinkun']" won the round 18 (stack = {'YueShi': 955, 'HakulaPlayer': 950, 'Jinkun': 1060, 'Ethan': 735, 'PlayerXinZhu': 1300})
player [YueShi] gets hole card ['C7', 'CK'], current stack 945
player [HakulaPlayer] gets hole card ['HT', 'DT'], current stack 950
player [Jinkun] gets hole card ['H6', 'CA'], current stack 1060
player [Ethan] gets hole card ['S7', 'SJ'], current stack 735
player [PlayerXinZhu] gets hole card ['SQ', 'C8'], current stack 1295
Started the round 19
Street "preflop" started. (community card = [])
"HakulaPlayer" declared "raise:37"
"Jinkun" declared "fold:37"
"Ethan" declared "fold:0"
"PlayerXinZhu" declared "fold:0"
"YueShi" declared "fold:0"
"['HakulaPlayer']" won the round 19 (stack = {'YueShi': 945, 'HakulaPlayer': 965, 'Jinkun': 1060, 'Ethan': 735, 'PlayerXinZhu': 1295})
player [YueShi] gets hole card ['S4', 'H6'], current stack 940
player [HakulaPlayer] gets hole card ['HT', 'CK'], current stack 955
player [Jinkun] gets hole card ['SK', 'SQ'], current stack 1060
player [Ethan] gets hole card ['H3', 'HJ'], current stack 735
player [PlayerXinZhu] gets hole card ['H9', 'D3'], current stack 1295
Started the round 20
Street "preflop" started. (community card = [])
"Jinkun" declared "fold:10"
"Ethan" declared "fold:0"
"PlayerXinZhu" declared "fold:0"
"YueShi" declared "fold:0"
"['HakulaPlayer']" won the round 20 (stack = {'YueShi': 940, 'HakulaPlayer': 970, 'Jinkun': 1060, 'Ethan': 735, 'PlayerXinZhu': 1295})
player [YueShi] gets hole card ['D4', 'DQ'], current stack 940
player [HakulaPlayer] gets hole card ['CA', 'CQ'], current stack 965
player [Jinkun] gets hole card ['S9', 'H8'], current stack 1050
player [Ethan] gets hole card ['S6', 'S3'], current stack 735
player [PlayerXinZhu] gets hole card ['S8', 'H2'], current stack 1295
Started the round 21
Street "preflop" started. (community card = [])
"Ethan" declared "fold:0"
"PlayerXinZhu" declared "fold:0"
"YueShi" declared "fold:0"
"HakulaPlayer" declared "call:10"
"Jinkun" declared "call:10"
Street "flop" started. (community card = ['CK', 'SA', 'HJ'])
"HakulaPlayer" declared "call:0"
"Jinkun" declared "raise:60"
"HakulaPlayer" declared "call:60"
Street "turn" started. (community card = ['CK', 'SA', 'HJ', 'C5'])
"HakulaPlayer" declared "raise:179"
"Jinkun" declared "fold:179"
"['HakulaPlayer']" won the round 21 (stack = {'YueShi': 940, 'HakulaPlayer': 1040, 'Jinkun': 990, 'Ethan': 735, 'PlayerXinZhu': 1295})
player [YueShi] gets hole card ['H9', 'HQ'], current stack 940
player [HakulaPlayer] gets hole card ['S7', 'DA'], current stack 1040
player [Jinkun] gets hole card ['D3', 'C4'], current stack 985
player [Ethan] gets hole card ['S6', 'C9'], current stack 725
player [PlayerXinZhu] gets hole card ['SJ', 'C7'], current stack 1295
Started the round 22
Street "preflop" started. (community card = [])
"PlayerXinZhu" declared "fold:0"
"YueShi" declared "fold:0"
"HakulaPlayer" declared "call:10"
"Jinkun" declared "raise:30"
"Ethan" declared "fold:0"
"HakulaPlayer" declared "call:30"
Street "flop" started. (community card = ['S9', 'C2', 'S2'])
"Jinkun" declared "call:0"
"HakulaPlayer" declared "call:0"
Street "turn" started. (community card = ['S9', 'C2', 'S2', 'C3'])
"Jinkun" declared "call:0"
"HakulaPlayer" declared "call:0"
Street "river" started. (community card = ['S9', 'C2', 'S2', 'C3', 'H8'])
"Jinkun" declared "call:0"
"HakulaPlayer" declared "call:0"
"['Jinkun']" won the round 22 (stack = {'YueShi': 940, 'HakulaPlayer': 1010, 'Jinkun': 1030, 'Ethan': 725, 'PlayerXinZhu': 1295})
player [YueShi] gets hole card ['C8', 'H3'], current stack 940
player [HakulaPlayer] gets hole card ['S2', 'H2'], current stack 1010
player [Jinkun] gets hole card ['S8', 'SJ'], current stack 1030
player [Ethan] gets hole card ['DQ', 'SA'], current stack 720
player [PlayerXinZhu] gets hole card ['H8', 'H9'], current stack 1285
Started the round 23
Street "preflop" started. (community card = [])
"YueShi" declared "fold:0"
"HakulaPlayer" declared "call:10"
"Jinkun" declared "call:10"
"Ethan" declared "raise:108"
"PlayerXinZhu" declared "fold:0"
"HakulaPlayer" declared "fold:0"
"Jinkun" declared "fold:108"
"['Ethan']" won the round 23 (stack = {'YueShi': 940, 'HakulaPlayer': 1000, 'Jinkun': 1020, 'Ethan': 755, 'PlayerXinZhu': 1285})
player [YueShi] gets hole card ['CT', 'CA'], current stack 930
player [HakulaPlayer] gets hole card ['S5', 'C5'], current stack 1000
player [Jinkun] gets hole card ['DJ', 'D2'], current stack 1020
player [Ethan] gets hole card ['S4', 'D6'], current stack 755
player [PlayerXinZhu] gets hole card ['SQ', 'ST'], current stack 1280
Started the round 24
Street "preflop" started. (community card = [])
"HakulaPlayer" declared "call:10"
"Jinkun" declared "fold:10"
"Ethan" declared "fold:0"
"PlayerXinZhu" declared "fold:0"
"YueShi" declared "fold:0"
"['HakulaPlayer']" won the round 24 (stack = {'YueShi': 930, 'HakulaPlayer': 1015, 'Jinkun': 1020, 'Ethan': 755, 'PlayerXinZhu': 1280})
player [YueShi] gets hole card ['SK', 'DK'], current stack 925
player [HakulaPlayer] gets hole card ['H6', 'DQ'], current stack 1005
player [Jinkun] gets hole card ['H5', 'D3'], current stack 1020
player [Ethan] gets hole card ['D5', 'C5'], current stack 755
player [PlayerXinZhu] gets hole card ['SA', 'S5'], current stack 1280
Started the round 25
Street "preflop" started. (community card = [])
"Jinkun" declared "fold:10"
"Ethan" declared "fold:0"
"PlayerXinZhu" declared "fold:0"
"YueShi" declared "fold:0"
"['HakulaPlayer']" won the round 25 (stack = {'YueShi': 925, 'HakulaPlayer': 1020, 'Jinkun': 1020, 'Ethan': 755, 'PlayerXinZhu': 1280})
player [YueShi] gets hole card ['H3', 'S2'], current stack 925
player [HakulaPlayer] gets hole card ['C8', 'H6'], current stack 1015
player [Jinkun] gets hole card ['SA', 'DT'], current stack 1010
player [Ethan] gets hole card ['C9', 'S7'], current stack 755
player [PlayerXinZhu] gets hole card ['H8', 'C4'], current stack 1280
Started the round 26
Street "preflop" started. (community card = [])
"Ethan" declared "fold:0"
"PlayerXinZhu" declared "fold:0"
"YueShi" declared "fold:0"
"HakulaPlayer" declared "call:10"
"Jinkun" declared "call:10"
Street "flop" started. (community card = ['H7', 'CQ', 'D4'])
"HakulaPlayer" declared "call:0"
"Jinkun" declared "call:0"
Street "turn" started. (community card = ['H7', 'CQ', 'D4', 'CT'])
"HakulaPlayer" declared "call:0"
"Jinkun" declared "call:0"
Street "river" started. (community card = ['H7', 'CQ', 'D4', 'CT', 'S8'])
"HakulaPlayer" declared "call:0"
"Jinkun" declared "call:0"
"['Jinkun']" won the round 26 (stack = {'YueShi': 925, 'HakulaPlayer': 1010, 'Jinkun': 1030, 'Ethan': 755, 'PlayerXinZhu': 1280})
player [YueShi] gets hole card ['C2', 'S7'], current stack 925
player [HakulaPlayer] gets hole card ['HA', 'S3'], current stack 1010
player [Jinkun] gets hole card ['D3', 'CA'], current stack 1025
player [Ethan] gets hole card ['D2', 'DK'], current stack 745
player [PlayerXinZhu] gets hole card ['D9', 'C4'], current stack 1280
Started the round 27
Street "preflop" started. (community card = [])
"PlayerXinZhu" declared "fold:0"
"YueShi" declared "fold:0"
"HakulaPlayer" declared "call:10"
"Jinkun" declared "call:10"
"Ethan" declared "fold:0"
Street "flop" started. (community card = ['D5', 'D8', 'C8'])
"Jinkun" declared "call:0"
"HakulaPlayer" declared "call:0"
Street "turn" started. (community card = ['D5', 'D8', 'C8', 'H4'])
"Jinkun" declared "call:0"
"HakulaPlayer" declared "call:0"
Street "river" started. (community card = ['D5', 'D8', 'C8', 'H4', 'C7'])
"Jinkun" declared "call:0"
"HakulaPlayer" declared "call:0"
"['HakulaPlayer', 'Jinkun']" won the round 27 (stack = {'YueShi': 925, 'HakulaPlayer': 1015, 'Jinkun': 1035, 'Ethan': 745, 'PlayerXinZhu': 1280})
player [YueShi] gets hole card ['CA', 'HT'], current stack 925
player [HakulaPlayer] gets hole card ['DK', 'D4'], current stack 1015
player [Jinkun] gets hole card ['C6', 'S5'], current stack 1035
player [Ethan] gets hole card ['SJ', 'H3'], current stack 740
player [PlayerXinZhu] gets hole card ['CK', 'DJ'], current stack 1270
Started the round 28
Street "preflop" started. (community card = [])
"YueShi" declared "fold:0"
"HakulaPlayer" declared "call:10"
"Jinkun" declared "call:10"
"Ethan" declared "fold:0"
"PlayerXinZhu" declared "fold:0"
Street "flop" started. (community card = ['HJ', 'D6', 'DQ'])
"HakulaPlayer" declared "call:0"
"Jinkun" declared "call:0"
Street "turn" started. (community card = ['HJ', 'D6', 'DQ', 'S6'])
"HakulaPlayer" declared "call:0"
"Jinkun" declared "raise:16"
"HakulaPlayer" declared "call:16"
Street "river" started. (community card = ['HJ', 'D6', 'DQ', 'S6', 'HK'])
"HakulaPlayer" declared "raise:114"
"Jinkun" declared "call:114"
"['Jinkun']" won the round 28 (stack = {'YueShi': 925, 'HakulaPlayer': 875, 'Jinkun': 1190, 'Ethan': 740, 'PlayerXinZhu': 1270})
player [YueShi] gets hole card ['DT', 'H3'], current stack 915
player [HakulaPlayer] gets hole card ['S9', 'H2'], current stack 875
player [Jinkun] gets hole card ['SK', 'S3'], current stack 1190
player [Ethan] gets hole card ['CT', 'C3'], current stack 740
player [PlayerXinZhu] gets hole card ['D3', 'SA'], current stack 1265
Started the round 29
Street "preflop" started. (community card = [])
"HakulaPlayer" declared "fold:0"
"Jinkun" declared "call:10"
"Ethan" declared "fold:0"
"PlayerXinZhu" declared "fold:0"
"YueShi" declared "fold:0"
"['Jinkun']" won the round 29 (stack = {'YueShi': 915, 'HakulaPlayer': 875, 'Jinkun': 1205, 'Ethan': 740, 'PlayerXinZhu': 1265})
player [YueShi] gets hole card ['S4', 'CK'], current stack 910
player [HakulaPlayer] gets hole card ['H7', 'SQ'], current stack 865
player [Jinkun] gets hole card ['DK', 'C6'], current stack 1205
player [Ethan] gets hole card ['SA', 'D9'], current stack 740
player [PlayerXinZhu] gets hole card ['S2', 'H3'], current stack 1265
Started the round 30
Street "preflop" started. (community card = [])
"Jinkun" declared "fold:10"
"Ethan" declared "fold:0"
"PlayerXinZhu" declared "fold:0"
"YueShi" declared "fold:0"
"['HakulaPlayer']" won the round 30 (stack = {'YueShi': 910, 'HakulaPlayer': 880, 'Jinkun': 1205, 'Ethan': 740, 'PlayerXinZhu': 1265})
player [YueShi] gets hole card ['C8', 'D8'], current stack 910
player [HakulaPlayer] gets hole card ['CK', 'HJ'], current stack 875
player [Jinkun] gets hole card ['S4', 'H8'], current stack 1195
player [Ethan] gets hole card ['H4', 'HK'], current stack 740
player [PlayerXinZhu] gets hole card ['S6', 'D9'], current stack 1265
Started the round 31
Street "preflop" started. (community card = [])
"Ethan" declared "fold:0"
"PlayerXinZhu" declared "fold:0"
"YueShi" declared "fold:0"
"HakulaPlayer" declared "call:10"
"Jinkun" declared "call:10"
Street "flop" started. (community card = ['S7', 'D2', 'DJ'])
"HakulaPlayer" declared "raise:28"
"Jinkun" declared "fold:28"
"['HakulaPlayer']" won the round 31 (stack = {'YueShi': 910, 'HakulaPlayer': 890, 'Jinkun': 1195, 'Ethan': 740, 'PlayerXinZhu': 1265})
player [YueShi] gets hole card ['H3', 'DA'], current stack 910
player [HakulaPlayer] gets hole card ['D6', 'CK'], current stack 890
player [Jinkun] gets hole card ['HK', 'C8'], current stack 1190
player [Ethan] gets hole card ['SA', 'H9'], current stack 730
player [PlayerXinZhu] gets hole card ['C2', 'CQ'], current stack 1265
Started the round 32
Street "preflop" started. (community card = [])
"PlayerXinZhu" declared "fold:0"
"YueShi" declared "fold:0"
"HakulaPlayer" declared "call:10"
"Jinkun" declared "call:10"
"Ethan" declared "call:10"
Street "flop" started. (community card = ['C4', 'CT', 'D2'])
"Jinkun" declared "call:0"
"Ethan" declared "call:0"
"HakulaPlayer" declared "call:0"
Street "turn" started. (community card = ['C4', 'CT', 'D2', 'S3'])
"Jinkun" declared "call:0"
"Ethan" declared "call:0"
"HakulaPlayer" declared "call:0"
Street "river" started. (community card = ['C4', 'CT', 'D2', 'S3', 'S8'])
"Jinkun" declared "call:0"
"Ethan" declared "call:0"
"HakulaPlayer" declared "call:0"
"['Jinkun']" won the round 32 (stack = {'YueShi': 910, 'HakulaPlayer': 880, 'Jinkun': 1215, 'Ethan': 730, 'PlayerXinZhu': 1265})
player [YueShi] gets hole card ['S7', 'C7'], current stack 910
player [HakulaPlayer] gets hole card ['H5', 'D3'], current stack 880
player [Jinkun] gets hole card ['D5', 'HK'], current stack 1215
player [Ethan] gets hole card ['H4', 'S2'], current stack 725
player [PlayerXinZhu] gets hole card ['D4', 'S9'], current stack 1255
Started the round 33
Street "preflop" started. (community card = [])
"YueShi" declared "fold:0"
"HakulaPlayer" declared "raise:27"
"Jinkun" declared "fold:27"
"Ethan" declared "fold:0"
"PlayerXinZhu" declared "fold:0"
"['HakulaPlayer']" won the round 33 (stack = {'YueShi': 910, 'HakulaPlayer': 895, 'Jinkun': 1215, 'Ethan': 725, 'PlayerXinZhu': 1255})
player [YueShi] gets hole card ['ST', 'H4'], current stack 900
player [HakulaPlayer] gets hole card ['S4', 'S7'], current stack 895
player [Jinkun] gets hole card ['H5', 'H2'], current stack 1215
player [Ethan] gets hole card ['S6', 'D9'], current stack 725
player [PlayerXinZhu] gets hole card ['S3', 'H3'], current stack 1250
Started the round 34
Street "preflop" started. (community card = [])
"HakulaPlayer" declared "fold:0"
"Jinkun" declared "call:10"
"Ethan" declared "fold:0"
"PlayerXinZhu" declared "fold:0"
"YueShi" declared "fold:0"
"['Jinkun']" won the round 34 (stack = {'YueShi': 900, 'HakulaPlayer': 895, 'Jinkun': 1230, 'Ethan': 725, 'PlayerXinZhu': 1250})
player [YueShi] gets hole card ['C7', 'S2'], current stack 895
player [HakulaPlayer] gets hole card ['S3', 'CA'], current stack 885
player [Jinkun] gets hole card ['H2', 'C4'], current stack 1230
player [Ethan] gets hole card ['H9', 'C3'], current stack 725
player [PlayerXinZhu] gets hole card ['CQ', 'SK'], current stack 1250
Started the round 35
Street "preflop" started. (community card = [])
"Jinkun" declared "fold:10"
"Ethan" declared "fold:0"
"PlayerXinZhu" declared "fold:0"
"YueShi" declared "fold:0"
"['HakulaPlayer']" won the round 35 (stack = {'YueShi': 895, 'HakulaPlayer': 900, 'Jinkun': 1230, 'Ethan': 725, 'PlayerXinZhu': 1250})
player [YueShi] gets hole card ['S4', 'H3'], current stack 895
player [HakulaPlayer] gets hole card ['DK', 'C6'], current stack 895
player [Jinkun] gets hole card ['S8', 'SJ'], current stack 1220
player [Ethan] gets hole card ['S9', 'CA'], current stack 725
player [PlayerXinZhu] gets hole card ['S5', 'D6'], current stack 1250
Started the round 36
Street "preflop" started. (community card = [])
"Ethan" declared "fold:0"
"PlayerXinZhu" declared "fold:0"
"YueShi" declared "fold:0"
"HakulaPlayer" declared "call:10"
"Jinkun" declared "call:10"
Street "flop" started. (community card = ['SK', 'H4', 'CQ'])
"HakulaPlayer" declared "call:0"
"Jinkun" declared "call:0"
Street "turn" started. (community card = ['SK', 'H4', 'CQ', 'C4'])
"HakulaPlayer" declared "raise:40"
"Jinkun" declared "fold:40"
"['HakulaPlayer']" won the round 36 (stack = {'YueShi': 895, 'HakulaPlayer': 910, 'Jinkun': 1220, 'Ethan': 725, 'PlayerXinZhu': 1250})
player [YueShi] gets hole card ['H6', 'H4'], current stack 895
player [HakulaPlayer] gets hole card ['SQ', 'S8'], current stack 910
player [Jinkun] gets hole card ['C9', 'CT'], current stack 1215
player [Ethan] gets hole card ['C2', 'H8'], current stack 715
player [PlayerXinZhu] gets hole card ['C7', 'S2'], current stack 1250
Started the round 37
Street "preflop" started. (community card = [])
"PlayerXinZhu" declared "fold:0"
"YueShi" declared "fold:0"
"HakulaPlayer" declared "call:10"
"Jinkun" declared "call:10"
"Ethan" declared "fold:0"
Street "flop" started. (community card = ['D8', 'H9', 'HQ'])
"Jinkun" declared "call:0"
"HakulaPlayer" declared "raise:72"
"Jinkun" declared "call:72"
Street "turn" started. (community card = ['D8', 'H9', 'HQ', 'DK'])
"Jinkun" declared "call:0"
"HakulaPlayer" declared "raise:430"
"Jinkun" declared "fold:430"
"['HakulaPlayer']" won the round 37 (stack = {'YueShi': 895, 'HakulaPlayer': 1002, 'Jinkun': 1138, 'Ethan': 715, 'PlayerXinZhu': 1250})
player [YueShi] gets hole card ['D9', 'H7'], current stack 895
player [HakulaPlayer] gets hole card ['DT', 'C5'], current stack 1002
player [Jinkun] gets hole card ['HK', 'D5'], current stack 1138
player [Ethan] gets hole card ['SA', 'CK'], current stack 710
player [PlayerXinZhu] gets hole card ['C2', 'S9'], current stack 1240
Started the round 38
Street "preflop" started. (community card = [])
"YueShi" declared "fold:0"
"HakulaPlayer" declared "fold:0"
"Jinkun" declared "call:10"
"Ethan" declared "raise:214"
"PlayerXinZhu" declared "fold:0"
"Jinkun" declared "fold:214"
"['Ethan']" won the round 38 (stack = {'YueShi': 895, 'HakulaPlayer': 1002, 'Jinkun': 1128, 'Ethan': 735, 'PlayerXinZhu': 1240})
player [YueShi] gets hole card ['D4', 'C7'], current stack 885
player [HakulaPlayer] gets hole card ['CJ', 'S2'], current stack 1002
player [Jinkun] gets hole card ['C9', 'DA'], current stack 1128
player [Ethan] gets hole card ['ST', 'D5'], current stack 735
player [PlayerXinZhu] gets hole card ['H4', 'SK'], current stack 1235
Started the round 39
Street "preflop" started. (community card = [])
"HakulaPlayer" declared "fold:0"
"Jinkun" declared "call:10"
"Ethan" declared "fold:0"
"PlayerXinZhu" declared "fold:0"
"YueShi" declared "fold:0"
"['Jinkun']" won the round 39 (stack = {'YueShi': 885, 'HakulaPlayer': 1002, 'Jinkun': 1143, 'Ethan': 735, 'PlayerXinZhu': 1235})
player [YueShi] gets hole card ['H2', 'DQ'], current stack 880
player [HakulaPlayer] gets hole card ['H4', 'CQ'], current stack 992
player [Jinkun] gets hole card ['C2', 'S8'], current stack 1143
player [Ethan] gets hole card ['CK', 'S4'], current stack 735
player [PlayerXinZhu] gets hole card ['C8', 'C6'], current stack 1235
Started the round 40
Street "preflop" started. (community card = [])
"Jinkun" declared "fold:10"
"Ethan" declared "fold:0"
"PlayerXinZhu" declared "fold:0"
"YueShi" declared "fold:0"
"['HakulaPlayer']" won the round 40 (stack = {'YueShi': 880, 'HakulaPlayer': 1007, 'Jinkun': 1143, 'Ethan': 735, 'PlayerXinZhu': 1235})
player [YueShi] gets hole card ['DK', 'HT'], current stack 880
player [HakulaPlayer] gets hole card ['S8', 'D8'], current stack 1002
player [Jinkun] gets hole card ['ST', 'S7'], current stack 1133
player [Ethan] gets hole card ['DJ', 'C2'], current stack 735
player [PlayerXinZhu] gets hole card ['SK', 'CK'], current stack 1235
Started the round 41
Street "preflop" started. (community card = [])
"Ethan" declared "fold:0"
"PlayerXinZhu" declared "fold:0"
"YueShi" declared "fold:0"
"HakulaPlayer" declared "call:10"
"Jinkun" declared "call:10"
Street "flop" started. (community card = ['S3', 'S6', 'C6'])
"HakulaPlayer" declared "raise:29"
"Jinkun" declared "fold:29"
"['HakulaPlayer']" won the round 41 (stack = {'YueShi': 880, 'HakulaPlayer': 1017, 'Jinkun': 1133, 'Ethan': 735, 'PlayerXinZhu': 1235})
player [YueShi] gets hole card ['H3', 'H6'], current stack 880
player [HakulaPlayer] gets hole card ['HK', 'DQ'], current stack 1017
player [Jinkun] gets hole card ['D5', 'SQ'], current stack 1128
player [Ethan] gets hole card ['CT', 'S7'], current stack 725
player [PlayerXinZhu] gets hole card ['S3', 'H7'], current stack 1235
Started the round 42
Street "preflop" started. (community card = [])
"PlayerXinZhu" declared "fold:0"
"YueShi" declared "fold:0"
"HakulaPlayer" declared "call:10"
"Jinkun" declared "call:10"
"Ethan" declared "fold:0"
Street "flop" started. (community card = ['C2', 'S6', 'H2'])
"Jinkun" declared "call:0"
"HakulaPlayer" declared "call:0"
Street "turn" started. (community card = ['C2', 'S6', 'H2', 'HT'])
"Jinkun" declared "call:0"
"HakulaPlayer" declared "call:0"
Street "river" started. (community card = ['C2', 'S6', 'H2', 'HT', 'DJ'])
"Jinkun" declared "call:0"
"HakulaPlayer" declared "call:0"
"['HakulaPlayer']" won the round 42 (stack = {'YueShi': 880, 'HakulaPlayer': 1037, 'Jinkun': 1123, 'Ethan': 725, 'PlayerXinZhu': 1235})
player [YueShi] gets hole card ['C5', 'SK'], current stack 880
player [HakulaPlayer] gets hole card ['HJ', 'SJ'], current stack 1037
player [Jinkun] gets hole card ['C4', 'ST'], current stack 1123
player [Ethan] gets hole card ['CA', 'D6'], current stack 720
player [PlayerXinZhu] gets hole card ['S3', 'D9'], current stack 1225
Started the round 43
Street "preflop" started. (community card = [])
"YueShi" declared "fold:0"
"HakulaPlayer" declared "raise:46"
"Jinkun" declared "fold:46"
"Ethan" declared "call:46"
"PlayerXinZhu" declared "fold:0"
Street "flop" started. (community card = ['S2', 'SA', 'D7'])
"Ethan" declared "call:0"
"HakulaPlayer" declared "raise:140"
"Ethan" declared "call:140"
Street "turn" started. (community card = ['S2', 'SA', 'D7', 'DA'])
"Ethan" declared "raise:382"
"HakulaPlayer" declared "raise:851"
"Ethan" declared "call:851"
Street "river" started. (community card = ['S2', 'SA', 'D7', 'DA', 'C8'])
"['Ethan']" won the round 43 (stack = {'YueShi': 880, 'HakulaPlayer': 312, 'Jinkun': 1123, 'Ethan': 1460, 'PlayerXinZhu': 1225})
player [YueShi] gets hole card ['C7', 'CT'], current stack 870
player [HakulaPlayer] gets hole card ['S9', 'HK'], current stack 312
player [Jinkun] gets hole card ['H4', 'CQ'], current stack 1123
player [Ethan] gets hole card ['ST', 'D6'], current stack 1460
player [PlayerXinZhu] gets hole card ['D3', 'C5'], current stack 1220
Started the round 44
Street "preflop" started. (community card = [])
"HakulaPlayer" declared "call:10"
"Jinkun" declared "fold:10"
"Ethan" declared "fold:0"
"PlayerXinZhu" declared "fold:0"
"YueShi" declared "fold:0"
"['HakulaPlayer']" won the round 44 (stack = {'YueShi': 870, 'HakulaPlayer': 327, 'Jinkun': 1123, 'Ethan': 1460, 'PlayerXinZhu': 1220})
player [YueShi] gets hole card ['H6', 'DK'], current stack 865
player [HakulaPlayer] gets hole card ['S2', 'S7'], current stack 317
player [Jinkun] gets hole card ['CQ', 'S4'], current stack 1123
player [Ethan] gets hole card ['DJ', 'C2'], current stack 1460
player [PlayerXinZhu] gets hole card ['DA', 'D3'], current stack 1220
Started the round 45
Street "preflop" started. (community card = [])
"Jinkun" declared "fold:10"
"Ethan" declared "fold:0"
"PlayerXinZhu" declared "fold:0"
"YueShi" declared "fold:0"
"['HakulaPlayer']" won the round 45 (stack = {'YueShi': 865, 'HakulaPlayer': 332, 'Jinkun': 1123, 'Ethan': 1460, 'PlayerXinZhu': 1220})
player [YueShi] gets hole card ['C3', 'SA'], current stack 865
player [HakulaPlayer] gets hole card ['D7', 'SK'], current stack 327
player [Jinkun] gets hole card ['H9', 'HQ'], current stack 1113
player [Ethan] gets hole card ['S5', 'DA'], current stack 1460
player [PlayerXinZhu] gets hole card ['D4', 'H7'], current stack 1220
Started the round 46
Street "preflop" started. (community card = [])
"Ethan" declared "fold:0"
"PlayerXinZhu" declared "fold:0"
"YueShi" declared "fold:0"
"HakulaPlayer" declared "call:10"
"Jinkun" declared "call:10"
Street "flop" started. (community card = ['S6', 'HJ', 'S4'])
"HakulaPlayer" declared "call:0"
"Jinkun" declared "call:0"
Street "turn" started. (community card = ['S6', 'HJ', 'S4', 'DQ'])
"HakulaPlayer" declared "call:0"
"Jinkun" declared "call:0"
Street "river" started. (community card = ['S6', 'HJ', 'S4', 'DQ', 'S3'])
"HakulaPlayer" declared "call:0"
"Jinkun" declared "call:0"
"['Jinkun']" won the round 46 (stack = {'YueShi': 865, 'HakulaPlayer': 322, 'Jinkun': 1133, 'Ethan': 1460, 'PlayerXinZhu': 1220})
player [YueShi] gets hole card ['H6', 'SK'], current stack 865
player [HakulaPlayer] gets hole card ['CT', 'HT'], current stack 322
player [Jinkun] gets hole card ['C6', 'D3'], current stack 1128
player [Ethan] gets hole card ['S5', 'CQ'], current stack 1450
player [PlayerXinZhu] gets hole card ['H2', 'D8'], current stack 1220
Started the round 47
Street "preflop" started. (community card = [])
"PlayerXinZhu" declared "fold:0"
"YueShi" declared "fold:0"
"HakulaPlayer" declared "raise:49"
"Jinkun" declared "fold:49"
"Ethan" declared "fold:0"
"['HakulaPlayer']" won the round 47 (stack = {'YueShi': 865, 'HakulaPlayer': 337, 'Jinkun': 1128, 'Ethan': 1450, 'PlayerXinZhu': 1220})
player [YueShi] gets hole card ['S7', 'D4'], current stack 865
player [HakulaPlayer] gets hole card ['S8', 'D6'], current stack 337
player [Jinkun] gets hole card ['S6', 'DJ'], current stack 1128
player [Ethan] gets hole card ['CK', 'H8'], current stack 1445
player [PlayerXinZhu] gets hole card ['D9', 'SQ'], current stack 1210
Started the round 48
Street "preflop" started. (community card = [])
"YueShi" declared "fold:0"
"HakulaPlayer" declared "call:10"
"Jinkun" declared "call:10"
"Ethan" declared "fold:0"
"PlayerXinZhu" declared "fold:0"
Street "flop" started. (community card = ['DT', 'D7', 'CA'])
"HakulaPlayer" declared "call:0"
"Jinkun" declared "call:0"
Street "turn" started. (community card = ['DT', 'D7', 'CA', 'S3'])
"HakulaPlayer" declared "call:0"
"Jinkun" declared "call:0"
Street "river" started. (community card = ['DT', 'D7', 'CA', 'S3', 'D3'])
"HakulaPlayer" declared "call:0"
"Jinkun" declared "call:0"
"['Jinkun']" won the round 48 (stack = {'YueShi': 865, 'HakulaPlayer': 327, 'Jinkun': 1153, 'Ethan': 1445, 'PlayerXinZhu': 1210})
player [YueShi] gets hole card ['SQ', 'D8'], current stack 855
player [HakulaPlayer] gets hole card ['S8', 'H8'], current stack 327
player [Jinkun] gets hole card ['H9', 'C6'], current stack 1153
player [Ethan] gets hole card ['C8', 'H4'], current stack 1445
player [PlayerXinZhu] gets hole card ['DQ', 'SJ'], current stack 1205
Started the round 49
Street "preflop" started. (community card = [])
"HakulaPlayer" declared "raise:42"
"Jinkun" declared "fold:42"
"Ethan" declared "fold:0"
"PlayerXinZhu" declared "fold:0"
"YueShi" declared "fold:0"
"['HakulaPlayer']" won the round 49 (stack = {'YueShi': 855, 'HakulaPlayer': 342, 'Jinkun': 1153, 'Ethan': 1445, 'PlayerXinZhu': 1205})
player [YueShi] gets hole card ['S4', 'H2'], current stack 850
player [HakulaPlayer] gets hole card ['H4', 'S2'], current stack 332
player [Jinkun] gets hole card ['C8', 'DJ'], current stack 1153
player [Ethan] gets hole card ['DQ', 'S9'], current stack 1445
player [PlayerXinZhu] gets hole card ['SQ', 'SJ'], current stack 1205
Started the round 50
Street "preflop" started. (community card = [])
"Jinkun" declared "fold:10"
"Ethan" declared "fold:0"
"PlayerXinZhu" declared "fold:0"
"YueShi" declared "fold:0"
"['HakulaPlayer']" won the round 50 (stack = {'YueShi': 850, 'HakulaPlayer': 347, 'Jinkun': 1153, 'Ethan': 1445, 'PlayerXinZhu': 1205})

Game Results:
------------------------------------------------------------
Game 1:
Winner: Ethan (stack: 1445)
All players' stacks:
  YueShi: 850
  HakulaPlayer: 347
  Jinkun: 1153
  Ethan: 1445
  PlayerXinZhu: 1205
------------------------------------------------------------
