player [YueShi] gets hole card ['D8', 'D6'], current stack 1000
player [HakulaPlayer] gets hole card ['S2', 'ST'], current stack 995
player [Jinkun] gets hole card ['C9', 'D3'], current stack 990
player [Ethan] gets hole card ['CJ', 'C7'], current stack 1000
player [PlayerXinZhu] gets hole card ['CA', 'D5'], current stack 1000
Started the round 1
Street "preflop" started. (community card = [])
"Ethan" declared "fold:0"
"PlayerXinZhu" declared "raise:15"
"YueShi" declared "fold:0"
"HakulaPlayer" declared "fold:0"
"Jinkun" declared "fold:15"
"['PlayerXinZhu']" won the round 1 (stack = {'YueShi': 1000, 'HakulaPlayer': 995, 'Jinkun': 990, 'Ethan': 1000, 'PlayerXinZhu': 1015})
player [YueShi] gets hole card ['D5', 'H5'], current stack 1000
player [HakulaPlayer] gets hole card ['DQ', 'SA'], current stack 995
player [Jinkun] gets hole card ['DA', 'S6'], current stack 985
player [Ethan] gets hole card ['HJ', 'C5'], current stack 990
player [PlayerXinZhu] gets hole card ['H3', 'HQ'], current stack 1015
Started the round 2
Street "preflop" started. (community card = [])
"PlayerXinZhu" declared "fold:0"
"YueShi" declared "fold:0"
"HakulaPlayer" declared "call:10"
"Jinkun" declared "call:10"
"Ethan" declared "fold:0"
Street "flop" started. (community card = ['S2', 'H6', 'H9'])
"Jinkun" declared "call:0"
"HakulaPlayer" declared "call:0"
Street "turn" started. (community card = ['S2', 'H6', 'H9', 'S9'])
"Jinkun" declared "call:0"
"HakulaPlayer" declared "call:0"
Street "river" started. (community card = ['S2', 'H6', 'H9', 'S9', 'C4'])
"Jinkun" declared "raise:12"
"HakulaPlayer" declared "fold:0"
"['Jinkun']" won the round 2 (stack = {'YueShi': 1000, 'HakulaPlayer': 985, 'Jinkun': 1010, 'Ethan': 990, 'PlayerXinZhu': 1015})
player [YueShi] gets hole card ['C5', 'ST'], current stack 1000
player [HakulaPlayer] gets hole card ['D4', 'CJ'], current stack 985
player [Jinkun] gets hole card ['HA', 'C8'], current stack 1010
player [Ethan] gets hole card ['D7', 'DJ'], current stack 985
player [PlayerXinZhu] gets hole card ['C3', 'D9'], current stack 1005
Started the round 3
Street "preflop" started. (community card = [])
"YueShi" declared "fold:0"
"HakulaPlayer" declared "fold:0"
"Jinkun" declared "call:10"
"Ethan" declared "fold:0"
"PlayerXinZhu" declared "fold:0"
"['Jinkun']" won the round 3 (stack = {'YueShi': 1000, 'HakulaPlayer': 985, 'Jinkun': 1025, 'Ethan': 985, 'PlayerXinZhu': 1005})
player [YueShi] gets hole card ['HJ', 'S9'], current stack 990
player [HakulaPlayer] gets hole card ['SA', 'C5'], current stack 985
player [Jinkun] gets hole card ['H2', 'DJ'], current stack 1025
player [Ethan] gets hole card ['C9', 'D9'], current stack 985
player [PlayerXinZhu] gets hole card ['S5', 'S7'], current stack 1000
Started the round 4
Street "preflop" started. (community card = [])
"HakulaPlayer" declared "fold:0"
"Jinkun" declared "call:10"
"Ethan" declared "call:10"
"PlayerXinZhu" declared "raise:526"
"YueShi" declared "fold:0"
"Jinkun" declared "fold:526"
"Ethan" declared "fold:0"
"['PlayerXinZhu']" won the round 4 (stack = {'YueShi': 990, 'HakulaPlayer': 985, 'Jinkun': 1015, 'Ethan': 975, 'PlayerXinZhu': 1035})
player [YueShi] gets hole card ['DK', 'H3'], current stack 985
player [HakulaPlayer] gets hole card ['D4', 'C5'], current stack 975
player [Jinkun] gets hole card ['SK', 'C3'], current stack 1015
player [Ethan] gets hole card ['H5', 'D5'], current stack 975
player [PlayerXinZhu] gets hole card ['S3', 'DT'], current stack 1035
Started the round 5
Street "preflop" started. (community card = [])
"Jinkun" declared "fold:10"
"Ethan" declared "fold:0"
"PlayerXinZhu" declared "raise:15"
"YueShi" declared "fold:0"
"HakulaPlayer" declared "call:15"
Street "flop" started. (community card = ['DA', 'D6', 'D9'])
"HakulaPlayer" declared "call:0"
"PlayerXinZhu" declared "raise:10"
"HakulaPlayer" declared "fold:0"
"['PlayerXinZhu']" won the round 5 (stack = {'YueShi': 985, 'HakulaPlayer': 970, 'Jinkun': 1015, 'Ethan': 975, 'PlayerXinZhu': 1055})
player [YueShi] gets hole card ['S2', 'S7'], current stack 985
player [HakulaPlayer] gets hole card ['D8', 'SQ'], current stack 965
player [Jinkun] gets hole card ['C6', 'C8'], current stack 1005
player [Ethan] gets hole card ['D4', 'H5'], current stack 975
player [PlayerXinZhu] gets hole card ['DJ', 'SA'], current stack 1055
Started the round 6
Street "preflop" started. (community card = [])
"Ethan" declared "fold:0"
"PlayerXinZhu" declared "fold:0"
"YueShi" declared "fold:0"
"HakulaPlayer" declared "call:10"
"Jinkun" declared "call:10"
Street "flop" started. (community card = ['C9', 'C3', 'C2'])
"HakulaPlayer" declared "call:0"
"Jinkun" declared "call:0"
Street "turn" started. (community card = ['C9', 'C3', 'C2', 'H2'])
"HakulaPlayer" declared "call:0"
"Jinkun" declared "call:0"
Street "river" started. (community card = ['C9', 'C3', 'C2', 'H2', 'H4'])
"HakulaPlayer" declared "call:0"
"Jinkun" declared "call:0"
"['Jinkun']" won the round 6 (stack = {'YueShi': 985, 'HakulaPlayer': 960, 'Jinkun': 1025, 'Ethan': 975, 'PlayerXinZhu': 1055})
player [YueShi] gets hole card ['DK', 'C8'], current stack 985
player [HakulaPlayer] gets hole card ['HQ', 'HJ'], current stack 960
player [Jinkun] gets hole card ['S9', 'D5'], current stack 1020
player [Ethan] gets hole card ['D4', 'H6'], current stack 965
player [PlayerXinZhu] gets hole card ['HT', 'DT'], current stack 1055
Started the round 7
Street "preflop" started. (community card = [])
"PlayerXinZhu" declared "fold:0"
"YueShi" declared "fold:0"
"HakulaPlayer" declared "call:10"
"Jinkun" declared "call:10"
"Ethan" declared "fold:0"
Street "flop" started. (community card = ['S6', 'CA', 'HK'])
"Jinkun" declared "call:0"
"HakulaPlayer" declared "raise:27"
"Jinkun" declared "fold:27"
"['HakulaPlayer']" won the round 7 (stack = {'YueShi': 985, 'HakulaPlayer': 980, 'Jinkun': 1015, 'Ethan': 965, 'PlayerXinZhu': 1055})
player [YueShi] gets hole card ['S9', 'D2'], current stack 985
player [HakulaPlayer] gets hole card ['HA', 'CJ'], current stack 980
player [Jinkun] gets hole card ['D7', 'S5'], current stack 1015
player [Ethan] gets hole card ['C3', 'HK'], current stack 960
player [PlayerXinZhu] gets hole card ['S8', 'SQ'], current stack 1045
Started the round 8
Street "preflop" started. (community card = [])
"YueShi" declared "fold:0"
"HakulaPlayer" declared "call:10"
"Jinkun" declared "call:10"
"Ethan" declared "fold:0"
"PlayerXinZhu" declared "fold:0"
Street "flop" started. (community card = ['HT', 'D3', 'DT'])
"HakulaPlayer" declared "call:0"
"Jinkun" declared "call:0"
Street "turn" started. (community card = ['HT', 'D3', 'DT', 'C6'])
"HakulaPlayer" declared "call:0"
"Jinkun" declared "call:0"
Street "river" started. (community card = ['HT', 'D3', 'DT', 'C6', 'H4'])
"HakulaPlayer" declared "call:0"
"Jinkun" declared "raise:16"
"HakulaPlayer" declared "fold:0"
"['Jinkun']" won the round 8 (stack = {'YueShi': 985, 'HakulaPlayer': 970, 'Jinkun': 1040, 'Ethan': 960, 'PlayerXinZhu': 1045})
player [YueShi] gets hole card ['D9', 'C8'], current stack 975
player [HakulaPlayer] gets hole card ['H5', 'SQ'], current stack 970
player [Jinkun] gets hole card ['DJ', 'D2'], current stack 1040
player [Ethan] gets hole card ['S3', 'CT'], current stack 960
player [PlayerXinZhu] gets hole card ['S8', 'C9'], current stack 1040
Started the round 9
Street "preflop" started. (community card = [])
"HakulaPlayer" declared "fold:0"
"Jinkun" declared "call:10"
"Ethan" declared "fold:0"
"PlayerXinZhu" declared "fold:0"
"YueShi" declared "fold:0"
"['Jinkun']" won the round 9 (stack = {'YueShi': 975, 'HakulaPlayer': 970, 'Jinkun': 1055, 'Ethan': 960, 'PlayerXinZhu': 1040})
player [YueShi] gets hole card ['C6', 'S4'], current stack 970
player [HakulaPlayer] gets hole card ['SK', 'C8'], current stack 960
player [Jinkun] gets hole card ['S3', 'DK'], current stack 1055
player [Ethan] gets hole card ['C9', 'DJ'], current stack 960
player [PlayerXinZhu] gets hole card ['C3', 'S9'], current stack 1040
Started the round 10
Street "preflop" started. (community card = [])
"Jinkun" declared "fold:10"
"Ethan" declared "fold:0"
"PlayerXinZhu" declared "fold:0"
"YueShi" declared "fold:0"
"['HakulaPlayer']" won the round 10 (stack = {'YueShi': 970, 'HakulaPlayer': 975, 'Jinkun': 1055, 'Ethan': 960, 'PlayerXinZhu': 1040})
player [YueShi] gets hole card ['C3', 'DQ'], current stack 970
player [HakulaPlayer] gets hole card ['HQ', 'CA'], current stack 970
player [Jinkun] gets hole card ['C9', 'HK'], current stack 1045
player [Ethan] gets hole card ['SJ', 'H9'], current stack 960
player [PlayerXinZhu] gets hole card ['S6', 'S2'], current stack 1040
Started the round 11
Street "preflop" started. (community card = [])
"Ethan" declared "fold:0"
"PlayerXinZhu" declared "fold:0"
"YueShi" declared "fold:0"
"HakulaPlayer" declared "call:10"
"Jinkun" declared "call:10"
Street "flop" started. (community card = ['D2', 'D5', 'S7'])
"HakulaPlayer" declared "call:0"
"Jinkun" declared "call:0"
Street "turn" started. (community card = ['D2', 'D5', 'S7', 'H7'])
"HakulaPlayer" declared "call:0"
"Jinkun" declared "call:0"
Street "river" started. (community card = ['D2', 'D5', 'S7', 'H7', 'HA'])
"HakulaPlayer" declared "raise:36"
"Jinkun" declared "fold:36"
"['HakulaPlayer']" won the round 11 (stack = {'YueShi': 970, 'HakulaPlayer': 985, 'Jinkun': 1045, 'Ethan': 960, 'PlayerXinZhu': 1040})
player [YueShi] gets hole card ['H4', 'DK'], current stack 970
player [HakulaPlayer] gets hole card ['S2', 'D4'], current stack 985
player [Jinkun] gets hole card ['H8', 'D5'], current stack 1040
player [Ethan] gets hole card ['S3', 'C7'], current stack 950
player [PlayerXinZhu] gets hole card ['CT', 'ST'], current stack 1040
Started the round 12
Street "preflop" started. (community card = [])
"PlayerXinZhu" declared "fold:0"
"YueShi" declared "fold:0"
"HakulaPlayer" declared "fold:0"
"Jinkun" declared "call:10"
"Ethan" declared "fold:0"
"['Jinkun']" won the round 12 (stack = {'YueShi': 970, 'HakulaPlayer': 985, 'Jinkun': 1055, 'Ethan': 950, 'PlayerXinZhu': 1040})
player [YueShi] gets hole card ['D5', 'S2'], current stack 970
player [HakulaPlayer] gets hole card ['S6', 'C8'], current stack 985
player [Jinkun] gets hole card ['DA', 'D4'], current stack 1055
player [Ethan] gets hole card ['C3', 'S5'], current stack 945
player [PlayerXinZhu] gets hole card ['CK', 'C7'], current stack 1030
Started the round 13
Street "preflop" started. (community card = [])
"YueShi" declared "fold:0"
"HakulaPlayer" declared "fold:0"
"Jinkun" declared "call:10"
"Ethan" declared "fold:0"
"PlayerXinZhu" declared "fold:0"
"['Jinkun']" won the round 13 (stack = {'YueShi': 970, 'HakulaPlayer': 985, 'Jinkun': 1070, 'Ethan': 945, 'PlayerXinZhu': 1030})
player [YueShi] gets hole card ['C4', 'H5'], current stack 960
player [HakulaPlayer] gets hole card ['S9', 'H9'], current stack 985
player [Jinkun] gets hole card ['DQ', 'CA'], current stack 1070
player [Ethan] gets hole card ['SJ', 'S4'], current stack 945
player [PlayerXinZhu] gets hole card ['ST', 'H7'], current stack 1025
Started the round 14
Street "preflop" started. (community card = [])
"HakulaPlayer" declared "call:10"
"Jinkun" declared "fold:10"
"Ethan" declared "fold:0"
"PlayerXinZhu" declared "fold:0"
"YueShi" declared "fold:0"
"['HakulaPlayer']" won the round 14 (stack = {'YueShi': 960, 'HakulaPlayer': 1000, 'Jinkun': 1070, 'Ethan': 945, 'PlayerXinZhu': 1025})
player [YueShi] gets hole card ['C4', 'D5'], current stack 955
player [HakulaPlayer] gets hole card ['H5', 'HT'], current stack 990
player [Jinkun] gets hole card ['H8', 'S2'], current stack 1070
player [Ethan] gets hole card ['S7', 'S8'], current stack 945
player [PlayerXinZhu] gets hole card ['SJ', 'S5'], current stack 1025
Started the round 15
Street "preflop" started. (community card = [])
"Jinkun" declared "fold:10"
"Ethan" declared "fold:0"
"PlayerXinZhu" declared "fold:0"
"YueShi" declared "fold:0"
"['HakulaPlayer']" won the round 15 (stack = {'YueShi': 955, 'HakulaPlayer': 1005, 'Jinkun': 1070, 'Ethan': 945, 'PlayerXinZhu': 1025})
player [YueShi] gets hole card ['C8', 'H9'], current stack 955
player [HakulaPlayer] gets hole card ['S6', 'C5'], current stack 1000
player [Jinkun] gets hole card ['DJ', 'DK'], current stack 1060
player [Ethan] gets hole card ['DQ', 'H6'], current stack 945
player [PlayerXinZhu] gets hole card ['HJ', 'DA'], current stack 1025
Started the round 16
Street "preflop" started. (community card = [])
"Ethan" declared "fold:0"
"PlayerXinZhu" declared "fold:0"
"YueShi" declared "fold:0"
"HakulaPlayer" declared "fold:0"
"['Jinkun']" won the round 16 (stack = {'YueShi': 955, 'HakulaPlayer': 1000, 'Jinkun': 1075, 'Ethan': 945, 'PlayerXinZhu': 1025})
player [YueShi] gets hole card ['D8', 'S5'], current stack 955
player [HakulaPlayer] gets hole card ['C2', 'SQ'], current stack 1000
player [Jinkun] gets hole card ['S4', 'H4'], current stack 1070
player [Ethan] gets hole card ['D3', 'S2'], current stack 935
player [PlayerXinZhu] gets hole card ['DJ', 'CQ'], current stack 1025
Started the round 17
Street "preflop" started. (community card = [])
"PlayerXinZhu" declared "fold:0"
"YueShi" declared "fold:0"
"HakulaPlayer" declared "fold:0"
"Jinkun" declared "call:10"
"Ethan" declared "fold:0"
"['Jinkun']" won the round 17 (stack = {'YueShi': 955, 'HakulaPlayer': 1000, 'Jinkun': 1085, 'Ethan': 935, 'PlayerXinZhu': 1025})
player [YueShi] gets hole card ['C3', 'H7'], current stack 955
player [HakulaPlayer] gets hole card ['D7', 'H4'], current stack 1000
player [Jinkun] gets hole card ['DA', 'HT'], current stack 1085
player [Ethan] gets hole card ['SJ', 'HJ'], current stack 930
player [PlayerXinZhu] gets hole card ['HK', 'D5'], current stack 1015
Started the round 18
Street "preflop" started. (community card = [])
"YueShi" declared "fold:0"
"HakulaPlayer" declared "fold:0"
"Jinkun" declared "call:10"
"Ethan" declared "raise:280"
"PlayerXinZhu" declared "fold:0"
"Jinkun" declared "fold:280"
"['Ethan']" won the round 18 (stack = {'YueShi': 955, 'HakulaPlayer': 1000, 'Jinkun': 1075, 'Ethan': 955, 'PlayerXinZhu': 1015})
player [YueShi] gets hole card ['H9', 'S2'], current stack 945
player [HakulaPlayer] gets hole card ['S6', 'C6'], current stack 1000
player [Jinkun] gets hole card ['CJ', 'HA'], current stack 1075
player [Ethan] gets hole card ['SA', 'D5'], current stack 955
player [PlayerXinZhu] gets hole card ['CT', 'D6'], current stack 1010
Started the round 19
Street "preflop" started. (community card = [])
"HakulaPlayer" declared "call:10"
"Jinkun" declared "fold:10"
"Ethan" declared "fold:0"
"PlayerXinZhu" declared "fold:0"
"YueShi" declared "fold:0"
"['HakulaPlayer']" won the round 19 (stack = {'YueShi': 945, 'HakulaPlayer': 1015, 'Jinkun': 1075, 'Ethan': 955, 'PlayerXinZhu': 1010})
player [YueShi] gets hole card ['S7', 'D8'], current stack 940
player [HakulaPlayer] gets hole card ['DJ', 'D5'], current stack 1005
player [Jinkun] gets hole card ['DQ', 'C5'], current stack 1075
player [Ethan] gets hole card ['H6', 'C9'], current stack 955
player [PlayerXinZhu] gets hole card ['S8', 'C8'], current stack 1010
Started the round 20
Street "preflop" started. (community card = [])
"Jinkun" declared "fold:10"
"Ethan" declared "fold:0"
"PlayerXinZhu" declared "fold:0"
"YueShi" declared "fold:0"
"['HakulaPlayer']" won the round 20 (stack = {'YueShi': 940, 'HakulaPlayer': 1020, 'Jinkun': 1075, 'Ethan': 955, 'PlayerXinZhu': 1010})
player [YueShi] gets hole card ['CJ', 'C5'], current stack 940
player [HakulaPlayer] gets hole card ['HK', 'DT'], current stack 1015
player [Jinkun] gets hole card ['C2', 'CT'], current stack 1065
player [Ethan] gets hole card ['CQ', 'D9'], current stack 955
player [PlayerXinZhu] gets hole card ['ST', 'HQ'], current stack 1010
Started the round 21
Street "preflop" started. (community card = [])
"Ethan" declared "fold:0"
"PlayerXinZhu" declared "fold:0"
"YueShi" declared "fold:0"
"HakulaPlayer" declared "call:10"
"Jinkun" declared "call:10"
Street "flop" started. (community card = ['H4', 'D5', 'HA'])
"HakulaPlayer" declared "call:0"
"Jinkun" declared "call:0"
Street "turn" started. (community card = ['H4', 'D5', 'HA', 'SK'])
"HakulaPlayer" declared "raise:25"
"Jinkun" declared "fold:25"
"['HakulaPlayer']" won the round 21 (stack = {'YueShi': 940, 'HakulaPlayer': 1030, 'Jinkun': 1065, 'Ethan': 955, 'PlayerXinZhu': 1010})
player [YueShi] gets hole card ['S8', 'H5'], current stack 940
player [HakulaPlayer] gets hole card ['D6', 'C4'], current stack 1030
player [Jinkun] gets hole card ['SQ', 'S4'], current stack 1060
player [Ethan] gets hole card ['D9', 'H7'], current stack 945
player [PlayerXinZhu] gets hole card ['CQ', 'D8'], current stack 1010
Started the round 22
Street "preflop" started. (community card = [])
"PlayerXinZhu" declared "fold:0"
"YueShi" declared "fold:0"
"HakulaPlayer" declared "fold:0"
"Jinkun" declared "call:10"
"Ethan" declared "fold:0"
"['Jinkun']" won the round 22 (stack = {'YueShi': 940, 'HakulaPlayer': 1030, 'Jinkun': 1075, 'Ethan': 945, 'PlayerXinZhu': 1010})
player [YueShi] gets hole card ['SJ', 'S8'], current stack 940
player [HakulaPlayer] gets hole card ['CJ', 'H7'], current stack 1030
player [Jinkun] gets hole card ['HK', 'S3'], current stack 1075
player [Ethan] gets hole card ['C8', 'S4'], current stack 940
player [PlayerXinZhu] gets hole card ['S2', 'H3'], current stack 1000
Started the round 23
Street "preflop" started. (community card = [])
"YueShi" declared "fold:0"
"HakulaPlayer" declared "fold:0"
"Jinkun" declared "call:10"
"Ethan" declared "fold:0"
"PlayerXinZhu" declared "fold:0"
"['Jinkun']" won the round 23 (stack = {'YueShi': 940, 'HakulaPlayer': 1030, 'Jinkun': 1090, 'Ethan': 940, 'PlayerXinZhu': 1000})
player [YueShi] gets hole card ['HK', 'DA'], current stack 930
player [HakulaPlayer] gets hole card ['C5', 'CA'], current stack 1030
player [Jinkun] gets hole card ['CT', 'D4'], current stack 1090
player [Ethan] gets hole card ['C6', 'S7'], current stack 940
player [PlayerXinZhu] gets hole card ['SK', 'H5'], current stack 995
Started the round 24
Street "preflop" started. (community card = [])
"HakulaPlayer" declared "call:10"
"Jinkun" declared "fold:10"
"Ethan" declared "fold:0"
"PlayerXinZhu" declared "fold:0"
"YueShi" declared "fold:0"
"['HakulaPlayer']" won the round 24 (stack = {'YueShi': 930, 'HakulaPlayer': 1045, 'Jinkun': 1090, 'Ethan': 940, 'PlayerXinZhu': 995})
player [YueShi] gets hole card ['D5', 'S4'], current stack 925
player [HakulaPlayer] gets hole card ['HK', 'CQ'], current stack 1035
player [Jinkun] gets hole card ['DJ', 'C3'], current stack 1090
player [Ethan] gets hole card ['CK', 'D9'], current stack 940
player [PlayerXinZhu] gets hole card ['ST', 'CJ'], current stack 995
Started the round 25
Street "preflop" started. (community card = [])
"Jinkun" declared "fold:10"
"Ethan" declared "fold:0"
"PlayerXinZhu" declared "fold:0"
"YueShi" declared "fold:0"
"['HakulaPlayer']" won the round 25 (stack = {'YueShi': 925, 'HakulaPlayer': 1050, 'Jinkun': 1090, 'Ethan': 940, 'PlayerXinZhu': 995})
player [YueShi] gets hole card ['DA', 'DQ'], current stack 925
player [HakulaPlayer] gets hole card ['DJ', 'S6'], current stack 1045
player [Jinkun] gets hole card ['H7', 'HT'], current stack 1080
player [Ethan] gets hole card ['H4', 'D6'], current stack 940
player [PlayerXinZhu] gets hole card ['CA', 'CT'], current stack 995
Started the round 26
Street "preflop" started. (community card = [])
"Ethan" declared "fold:0"
"PlayerXinZhu" declared "fold:0"
"YueShi" declared "fold:0"
"HakulaPlayer" declared "call:10"
"Jinkun" declared "call:10"
Street "flop" started. (community card = ['HK', 'C4', 'H8'])
"HakulaPlayer" declared "call:0"
"Jinkun" declared "call:0"
Street "turn" started. (community card = ['HK', 'C4', 'H8', 'C3'])
"HakulaPlayer" declared "call:0"
"Jinkun" declared "call:0"
Street "river" started. (community card = ['HK', 'C4', 'H8', 'C3', 'D2'])
"HakulaPlayer" declared "call:0"
"Jinkun" declared "call:0"
"['HakulaPlayer']" won the round 26 (stack = {'YueShi': 925, 'HakulaPlayer': 1060, 'Jinkun': 1080, 'Ethan': 940, 'PlayerXinZhu': 995})
player [YueShi] gets hole card ['D6', 'H2'], current stack 925
player [HakulaPlayer] gets hole card ['S8', 'DT'], current stack 1060
player [Jinkun] gets hole card ['S5', 'DJ'], current stack 1075
player [Ethan] gets hole card ['H4', 'D2'], current stack 930
player [PlayerXinZhu] gets hole card ['H9', 'HA'], current stack 995
Started the round 27
Street "preflop" started. (community card = [])
"PlayerXinZhu" declared "fold:0"
"YueShi" declared "fold:0"
"HakulaPlayer" declared "call:10"
"Jinkun" declared "call:10"
"Ethan" declared "fold:0"
Street "flop" started. (community card = ['D3', 'C5', 'HK'])
"Jinkun" declared "call:0"
"HakulaPlayer" declared "call:0"
Street "turn" started. (community card = ['D3', 'C5', 'HK', 'C4'])
"Jinkun" declared "call:0"
"HakulaPlayer" declared "call:0"
Street "river" started. (community card = ['D3', 'C5', 'HK', 'C4', 'S4'])
"Jinkun" declared "call:0"
"HakulaPlayer" declared "call:0"
"['Jinkun']" won the round 27 (stack = {'YueShi': 925, 'HakulaPlayer': 1050, 'Jinkun': 1100, 'Ethan': 930, 'PlayerXinZhu': 995})
player [YueShi] gets hole card ['C9', 'D4'], current stack 925
player [HakulaPlayer] gets hole card ['DA', 'S3'], current stack 1050
player [Jinkun] gets hole card ['ST', 'HJ'], current stack 1100
player [Ethan] gets hole card ['C2', 'D6'], current stack 925
player [PlayerXinZhu] gets hole card ['DT', 'SQ'], current stack 985
Started the round 28
Street "preflop" started. (community card = [])
"YueShi" declared "fold:0"
"HakulaPlayer" declared "call:10"
"Jinkun" declared "call:10"
"Ethan" declared "fold:0"
"PlayerXinZhu" declared "fold:0"
Street "flop" started. (community card = ['H4', 'C6', 'DK'])
"HakulaPlayer" declared "call:0"
"Jinkun" declared "call:0"
Street "turn" started. (community card = ['H4', 'C6', 'DK', 'HA'])
"HakulaPlayer" declared "raise:52"
"Jinkun" declared "fold:52"
"['HakulaPlayer']" won the round 28 (stack = {'YueShi': 925, 'HakulaPlayer': 1075, 'Jinkun': 1090, 'Ethan': 925, 'PlayerXinZhu': 985})
player [YueShi] gets hole card ['H3', 'H5'], current stack 915
player [HakulaPlayer] gets hole card ['H2', 'D2'], current stack 1075
player [Jinkun] gets hole card ['H8', 'S8'], current stack 1090
player [Ethan] gets hole card ['C8', 'DJ'], current stack 925
player [PlayerXinZhu] gets hole card ['CA', 'D4'], current stack 980
Started the round 29
Street "preflop" started. (community card = [])
"HakulaPlayer" declared "fold:0"
"Jinkun" declared "call:10"
"Ethan" declared "fold:0"
"PlayerXinZhu" declared "fold:0"
"YueShi" declared "fold:0"
"['Jinkun']" won the round 29 (stack = {'YueShi': 915, 'HakulaPlayer': 1075, 'Jinkun': 1105, 'Ethan': 925, 'PlayerXinZhu': 980})
player [YueShi] gets hole card ['H8', 'D8'], current stack 910
player [HakulaPlayer] gets hole card ['CJ', 'D7'], current stack 1065
player [Jinkun] gets hole card ['S6', 'D2'], current stack 1105
player [Ethan] gets hole card ['C8', 'H7'], current stack 925
player [PlayerXinZhu] gets hole card ['S7', 'D4'], current stack 980
Started the round 30
Street "preflop" started. (community card = [])
"Jinkun" declared "fold:10"
"Ethan" declared "fold:0"
"PlayerXinZhu" declared "fold:0"
"YueShi" declared "fold:0"
"['HakulaPlayer']" won the round 30 (stack = {'YueShi': 910, 'HakulaPlayer': 1080, 'Jinkun': 1105, 'Ethan': 925, 'PlayerXinZhu': 980})
player [YueShi] gets hole card ['H2', 'D4'], current stack 910
player [HakulaPlayer] gets hole card ['DJ', 'C2'], current stack 1075
player [Jinkun] gets hole card ['DQ', 'SJ'], current stack 1095
player [Ethan] gets hole card ['D7', 'S3'], current stack 925
player [PlayerXinZhu] gets hole card ['C7', 'CA'], current stack 980
Started the round 31
Street "preflop" started. (community card = [])
"Ethan" declared "fold:0"
"PlayerXinZhu" declared "fold:0"
"YueShi" declared "fold:0"
"HakulaPlayer" declared "fold:0"
"['Jinkun']" won the round 31 (stack = {'YueShi': 910, 'HakulaPlayer': 1075, 'Jinkun': 1110, 'Ethan': 925, 'PlayerXinZhu': 980})
player [YueShi] gets hole card ['D2', 'HT'], current stack 910
player [HakulaPlayer] gets hole card ['ST', 'S8'], current stack 1075
player [Jinkun] gets hole card ['H7', 'S7'], current stack 1105
player [Ethan] gets hole card ['D4', 'C8'], current stack 915
player [PlayerXinZhu] gets hole card ['HK', 'H4'], current stack 980
Started the round 32
Street "preflop" started. (community card = [])
"PlayerXinZhu" declared "fold:0"
"YueShi" declared "fold:0"
"HakulaPlayer" declared "call:10"
"Jinkun" declared "call:10"
"Ethan" declared "fold:0"
Street "flop" started. (community card = ['C2', 'SA', 'C4'])
"Jinkun" declared "call:0"
"HakulaPlayer" declared "call:0"
Street "turn" started. (community card = ['C2', 'SA', 'C4', 'D6'])
"Jinkun" declared "call:0"
"HakulaPlayer" declared "call:0"
Street "river" started. (community card = ['C2', 'SA', 'C4', 'D6', 'H9'])
"Jinkun" declared "call:0"
"HakulaPlayer" declared "call:0"
"['Jinkun']" won the round 32 (stack = {'YueShi': 910, 'HakulaPlayer': 1065, 'Jinkun': 1130, 'Ethan': 915, 'PlayerXinZhu': 980})
player [YueShi] gets hole card ['S5', 'DT'], current stack 910
player [HakulaPlayer] gets hole card ['H5', 'D3'], current stack 1065
player [Jinkun] gets hole card ['SJ', 'CJ'], current stack 1130
player [Ethan] gets hole card ['H3', 'DQ'], current stack 910
player [PlayerXinZhu] gets hole card ['H6', 'S7'], current stack 970
Started the round 33
Street "preflop" started. (community card = [])
"YueShi" declared "fold:0"
"HakulaPlayer" declared "fold:0"
"Jinkun" declared "call:10"
"Ethan" declared "fold:0"
"PlayerXinZhu" declared "fold:0"
"['Jinkun']" won the round 33 (stack = {'YueShi': 910, 'HakulaPlayer': 1065, 'Jinkun': 1145, 'Ethan': 910, 'PlayerXinZhu': 970})
player [YueShi] gets hole card ['H4', 'CA'], current stack 900
player [HakulaPlayer] gets hole card ['C4', 'CQ'], current stack 1065
player [Jinkun] gets hole card ['ST', 'S3'], current stack 1145
player [Ethan] gets hole card ['D6', 'S8'], current stack 910
player [PlayerXinZhu] gets hole card ['DT', 'H3'], current stack 965
Started the round 34
Street "preflop" started. (community card = [])
"HakulaPlayer" declared "call:10"
"Jinkun" declared "fold:10"
"Ethan" declared "fold:0"
"PlayerXinZhu" declared "fold:0"
"YueShi" declared "fold:0"
"['HakulaPlayer']" won the round 34 (stack = {'YueShi': 900, 'HakulaPlayer': 1080, 'Jinkun': 1145, 'Ethan': 910, 'PlayerXinZhu': 965})
player [YueShi] gets hole card ['C3', 'S7'], current stack 895
player [HakulaPlayer] gets hole card ['H5', 'DJ'], current stack 1070
player [Jinkun] gets hole card ['C6', 'SK'], current stack 1145
player [Ethan] gets hole card ['CK', 'S5'], current stack 910
player [PlayerXinZhu] gets hole card ['CT', 'HA'], current stack 965
Started the round 35
Street "preflop" started. (community card = [])
"Jinkun" declared "fold:10"
"Ethan" declared "fold:0"
"PlayerXinZhu" declared "fold:0"
"YueShi" declared "fold:0"
"['HakulaPlayer']" won the round 35 (stack = {'YueShi': 895, 'HakulaPlayer': 1085, 'Jinkun': 1145, 'Ethan': 910, 'PlayerXinZhu': 965})
player [YueShi] gets hole card ['DQ', 'D8'], current stack 895
player [HakulaPlayer] gets hole card ['D6', 'SQ'], current stack 1080
player [Jinkun] gets hole card ['C8', 'S8'], current stack 1135
player [Ethan] gets hole card ['HJ', 'HA'], current stack 910
player [PlayerXinZhu] gets hole card ['S4', 'D7'], current stack 965
Started the round 36
Street "preflop" started. (community card = [])
"Ethan" declared "raise:136"
"PlayerXinZhu" declared "fold:0"
"YueShi" declared "fold:0"
"HakulaPlayer" declared "fold:0"
"Jinkun" declared "fold:136"
"['Ethan']" won the round 36 (stack = {'YueShi': 895, 'HakulaPlayer': 1080, 'Jinkun': 1135, 'Ethan': 925, 'PlayerXinZhu': 965})
player [YueShi] gets hole card ['D8', 'H3'], current stack 895
player [HakulaPlayer] gets hole card ['H9', 'CA'], current stack 1080
player [Jinkun] gets hole card ['HK', 'C7'], current stack 1130
player [Ethan] gets hole card ['D2', 'HQ'], current stack 915
player [PlayerXinZhu] gets hole card ['HT', 'H2'], current stack 965
Started the round 37
Street "preflop" started. (community card = [])
"PlayerXinZhu" declared "fold:0"
"YueShi" declared "fold:0"
"HakulaPlayer" declared "call:10"
"Jinkun" declared "call:10"
"Ethan" declared "fold:0"
Street "flop" started. (community card = ['H6', 'DK', 'S3'])
"Jinkun" declared "raise:12"
"HakulaPlayer" declared "call:12"
Street "turn" started. (community card = ['H6', 'DK', 'S3', 'SJ'])
"Jinkun" declared "raise:22"
"HakulaPlayer" declared "call:22"
Street "river" started. (community card = ['H6', 'DK', 'S3', 'SJ', 'C4'])
"Jinkun" declared "raise:40"
"HakulaPlayer" declared "fold:0"
"['Jinkun']" won the round 37 (stack = {'YueShi': 895, 'HakulaPlayer': 1036, 'Jinkun': 1189, 'Ethan': 915, 'PlayerXinZhu': 965})
player [YueShi] gets hole card ['C2', 'D8'], current stack 895
player [HakulaPlayer] gets hole card ['H5', 'C4'], current stack 1036
player [Jinkun] gets hole card ['HQ', 'D6'], current stack 1189
player [Ethan] gets hole card ['DJ', 'C9'], current stack 910
player [PlayerXinZhu] gets hole card ['S4', 'SA'], current stack 955
Started the round 38
Street "preflop" started. (community card = [])
"YueShi" declared "fold:0"
"HakulaPlayer" declared "fold:0"
"Jinkun" declared "call:10"
"Ethan" declared "call:10"
"PlayerXinZhu" declared "fold:0"
Street "flop" started. (community card = ['SK', 'SQ', 'C8'])
"Ethan" declared "call:0"
"Jinkun" declared "call:0"
Street "turn" started. (community card = ['SK', 'SQ', 'C8', 'CJ'])
"Ethan" declared "call:0"
"Jinkun" declared "call:0"
Street "river" started. (community card = ['SK', 'SQ', 'C8', 'CJ', 'HA'])
"Ethan" declared "call:0"
"Jinkun" declared "call:0"
"['Jinkun']" won the round 38 (stack = {'YueShi': 895, 'HakulaPlayer': 1036, 'Jinkun': 1209, 'Ethan': 905, 'PlayerXinZhu': 955})
player [YueShi] gets hole card ['DK', 'S4'], current stack 885
player [HakulaPlayer] gets hole card ['D5', 'S2'], current stack 1036
player [Jinkun] gets hole card ['S6', 'D4'], current stack 1209
player [Ethan] gets hole card ['C4', 'H9'], current stack 905
player [PlayerXinZhu] gets hole card ['HJ', 'C3'], current stack 950
Started the round 39
Street "preflop" started. (community card = [])
"HakulaPlayer" declared "raise:33"
"Jinkun" declared "fold:33"
"Ethan" declared "fold:0"
"PlayerXinZhu" declared "fold:0"
"YueShi" declared "fold:0"
"['HakulaPlayer']" won the round 39 (stack = {'YueShi': 885, 'HakulaPlayer': 1051, 'Jinkun': 1209, 'Ethan': 905, 'PlayerXinZhu': 950})
player [YueShi] gets hole card ['C7', 'CQ'], current stack 880
player [HakulaPlayer] gets hole card ['D6', 'ST'], current stack 1041
player [Jinkun] gets hole card ['DJ', 'DA'], current stack 1209
player [Ethan] gets hole card ['C9', 'H8'], current stack 905
player [PlayerXinZhu] gets hole card ['S4', 'D8'], current stack 950
Started the round 40
Street "preflop" started. (community card = [])
"Jinkun" declared "fold:10"
"Ethan" declared "fold:0"
"PlayerXinZhu" declared "fold:0"
"YueShi" declared "fold:0"
"['HakulaPlayer']" won the round 40 (stack = {'YueShi': 880, 'HakulaPlayer': 1056, 'Jinkun': 1209, 'Ethan': 905, 'PlayerXinZhu': 950})
player [YueShi] gets hole card ['DK', 'S8'], current stack 880
player [HakulaPlayer] gets hole card ['H6', 'CQ'], current stack 1051
player [Jinkun] gets hole card ['S2', 'H9'], current stack 1199
player [Ethan] gets hole card ['CJ', 'ST'], current stack 905
player [PlayerXinZhu] gets hole card ['S3', 'CK'], current stack 950
Started the round 41
Street "preflop" started. (community card = [])
"Ethan" declared "call:10"
"PlayerXinZhu" declared "fold:0"
"YueShi" declared "fold:0"
"HakulaPlayer" declared "call:10"
"Jinkun" declared "call:10"
Street "flop" started. (community card = ['CA', 'DQ', 'DA'])
"HakulaPlayer" declared "call:0"
"Jinkun" declared "call:0"
"Ethan" declared "call:0"
Street "turn" started. (community card = ['CA', 'DQ', 'DA', 'S9'])
"HakulaPlayer" declared "raise:44"
"Jinkun" declared "fold:44"
"Ethan" declared "call:44"
Street "river" started. (community card = ['CA', 'DQ', 'DA', 'S9', 'HT'])
"HakulaPlayer" declared "raise:178"
"Ethan" declared "call:178"
"['HakulaPlayer']" won the round 41 (stack = {'YueShi': 880, 'HakulaPlayer': 1298, 'Jinkun': 1199, 'Ethan': 673, 'PlayerXinZhu': 950})
player [YueShi] gets hole card ['CJ', 'HK'], current stack 880
player [HakulaPlayer] gets hole card ['SQ', 'C8'], current stack 1298
player [Jinkun] gets hole card ['CA', 'HA'], current stack 1194
player [Ethan] gets hole card ['SK', 'H9'], current stack 663
player [PlayerXinZhu] gets hole card ['H3', 'CT'], current stack 950
Started the round 42
Street "preflop" started. (community card = [])
"PlayerXinZhu" declared "fold:0"
"YueShi" declared "fold:0"
"HakulaPlayer" declared "call:10"
"Jinkun" declared "call:10"
"Ethan" declared "call:10"
Street "flop" started. (community card = ['H5', 'D9', 'DJ'])
"Jinkun" declared "call:0"
"Ethan" declared "call:0"
"HakulaPlayer" declared "raise:22"
"Jinkun" declared "call:22"
"Ethan" declared "call:22"
Street "turn" started. (community card = ['H5', 'D9', 'DJ', 'C3'])
"Jinkun" declared "call:0"
"Ethan" declared "call:0"
"HakulaPlayer" declared "call:0"
Street "river" started. (community card = ['H5', 'D9', 'DJ', 'C3', 'D5'])
"Jinkun" declared "call:0"
"Ethan" declared "call:0"
"HakulaPlayer" declared "call:0"
"['Jinkun']" won the round 42 (stack = {'YueShi': 880, 'HakulaPlayer': 1266, 'Jinkun': 1263, 'Ethan': 641, 'PlayerXinZhu': 950})
player [YueShi] gets hole card ['D2', 'D3'], current stack 880
player [HakulaPlayer] gets hole card ['C6', 'SA'], current stack 1266
player [Jinkun] gets hole card ['S4', 'S8'], current stack 1263
player [Ethan] gets hole card ['S3', 'ST'], current stack 636
player [PlayerXinZhu] gets hole card ['S6', 'HJ'], current stack 940
Started the round 43
Street "preflop" started. (community card = [])
"YueShi" declared "fold:0"
"HakulaPlayer" declared "call:10"
"Jinkun" declared "call:10"
"Ethan" declared "fold:0"
"PlayerXinZhu" declared "fold:0"
Street "flop" started. (community card = ['S2', 'D8', 'DK'])
"HakulaPlayer" declared "call:0"
"Jinkun" declared "call:0"
Street "turn" started. (community card = ['S2', 'D8', 'DK', 'DA'])
"HakulaPlayer" declared "raise:65"
"Jinkun" declared "fold:65"
"['HakulaPlayer']" won the round 43 (stack = {'YueShi': 880, 'HakulaPlayer': 1291, 'Jinkun': 1253, 'Ethan': 636, 'PlayerXinZhu': 940})
player [YueShi] gets hole card ['CT', 'S8'], current stack 870
player [HakulaPlayer] gets hole card ['C3', 'CA'], current stack 1291
player [Jinkun] gets hole card ['S2', 'D6'], current stack 1253
player [Ethan] gets hole card ['SJ', 'DA'], current stack 636
player [PlayerXinZhu] gets hole card ['ST', 'HJ'], current stack 935
Started the round 44
Street "preflop" started. (community card = [])
"HakulaPlayer" declared "call:10"
"Jinkun" declared "fold:10"
"Ethan" declared "raise:95"
"PlayerXinZhu" declared "fold:0"
"YueShi" declared "fold:0"
"HakulaPlayer" declared "call:95"
Street "flop" started. (community card = ['C6', 'H6', 'C7'])
"HakulaPlayer" declared "call:0"
"Ethan" declared "call:0"
Street "turn" started. (community card = ['C6', 'H6', 'C7', 'CQ'])
"HakulaPlayer" declared "raise:323"
"Ethan" declared "fold:0"
"['HakulaPlayer']" won the round 44 (stack = {'YueShi': 870, 'HakulaPlayer': 1401, 'Jinkun': 1253, 'Ethan': 541, 'PlayerXinZhu': 935})
player [YueShi] gets hole card ['D4', 'S8'], current stack 865
player [HakulaPlayer] gets hole card ['HJ', 'D3'], current stack 1391
player [Jinkun] gets hole card ['SA', 'HT'], current stack 1253
player [Ethan] gets hole card ['CQ', 'C4'], current stack 541
player [PlayerXinZhu] gets hole card ['C5', 'H7'], current stack 935
Started the round 45
Street "preflop" started. (community card = [])
"Jinkun" declared "fold:10"
"Ethan" declared "fold:0"
"PlayerXinZhu" declared "fold:0"
"YueShi" declared "fold:0"
"['HakulaPlayer']" won the round 45 (stack = {'YueShi': 865, 'HakulaPlayer': 1406, 'Jinkun': 1253, 'Ethan': 541, 'PlayerXinZhu': 935})
player [YueShi] gets hole card ['SK', 'H8'], current stack 865
player [HakulaPlayer] gets hole card ['CT', 'SQ'], current stack 1401
player [Jinkun] gets hole card ['DJ', 'DT'], current stack 1243
player [Ethan] gets hole card ['D5', 'S8'], current stack 541
player [PlayerXinZhu] gets hole card ['D3', 'C7'], current stack 935
Started the round 46
Street "preflop" started. (community card = [])
"Ethan" declared "fold:0"
"PlayerXinZhu" declared "fold:0"
"YueShi" declared "fold:0"
"HakulaPlayer" declared "call:10"
"Jinkun" declared "call:10"
Street "flop" started. (community card = ['H5', 'H3', 'DQ'])
"HakulaPlayer" declared "raise:33"
"Jinkun" declared "fold:33"
"['HakulaPlayer']" won the round 46 (stack = {'YueShi': 865, 'HakulaPlayer': 1416, 'Jinkun': 1243, 'Ethan': 541, 'PlayerXinZhu': 935})
player [YueShi] gets hole card ['DT', 'D5'], current stack 865
player [HakulaPlayer] gets hole card ['SA', 'H5'], current stack 1416
player [Jinkun] gets hole card ['D3', 'S5'], current stack 1238
player [Ethan] gets hole card ['HQ', 'C7'], current stack 531
player [PlayerXinZhu] gets hole card ['D9', 'DQ'], current stack 935
Started the round 47
Street "preflop" started. (community card = [])
"PlayerXinZhu" declared "fold:0"
"YueShi" declared "fold:0"
"HakulaPlayer" declared "call:10"
"Jinkun" declared "call:10"
"Ethan" declared "fold:0"
Street "flop" started. (community card = ['HA', 'SK', 'C2'])
"Jinkun" declared "call:0"
"HakulaPlayer" declared "raise:57"
"Jinkun" declared "fold:57"
"['HakulaPlayer']" won the round 47 (stack = {'YueShi': 865, 'HakulaPlayer': 1436, 'Jinkun': 1233, 'Ethan': 531, 'PlayerXinZhu': 935})
player [YueShi] gets hole card ['C2', 'ST'], current stack 865
player [HakulaPlayer] gets hole card ['C7', 'D8'], current stack 1436
player [Jinkun] gets hole card ['HA', 'H9'], current stack 1233
player [Ethan] gets hole card ['SA', 'S7'], current stack 526
player [PlayerXinZhu] gets hole card ['H2', 'SK'], current stack 925
Started the round 48
Street "preflop" started. (community card = [])
"YueShi" declared "fold:0"
"HakulaPlayer" declared "fold:0"
"Jinkun" declared "call:10"
"Ethan" declared "call:10"
"PlayerXinZhu" declared "fold:0"
Street "flop" started. (community card = ['CJ', 'HQ', 'SQ'])
"Ethan" declared "call:0"
"Jinkun" declared "call:0"
Street "turn" started. (community card = ['CJ', 'HQ', 'SQ', 'H3'])
"Ethan" declared "call:0"
"Jinkun" declared "call:0"
Street "river" started. (community card = ['CJ', 'HQ', 'SQ', 'H3', 'CQ'])
"Ethan" declared "raise:187"
"Jinkun" declared "fold:187"
"['Ethan']" won the round 48 (stack = {'YueShi': 865, 'HakulaPlayer': 1436, 'Jinkun': 1223, 'Ethan': 551, 'PlayerXinZhu': 925})
player [YueShi] gets hole card ['D6', 'C6'], current stack 855
player [HakulaPlayer] gets hole card ['D9', 'C9'], current stack 1436
player [Jinkun] gets hole card ['D8', 'S9'], current stack 1223
player [Ethan] gets hole card ['D4', 'SQ'], current stack 551
player [PlayerXinZhu] gets hole card ['S2', 'D2'], current stack 920
Started the round 49
Street "preflop" started. (community card = [])
"HakulaPlayer" declared "raise:43"
"Jinkun" declared "fold:43"
"Ethan" declared "fold:0"
"PlayerXinZhu" declared "fold:0"
"YueShi" declared "fold:0"
"['HakulaPlayer']" won the round 49 (stack = {'YueShi': 855, 'HakulaPlayer': 1451, 'Jinkun': 1223, 'Ethan': 551, 'PlayerXinZhu': 920})
player [YueShi] gets hole card ['C9', 'D2'], current stack 850
player [HakulaPlayer] gets hole card ['S7', 'D3'], current stack 1441
player [Jinkun] gets hole card ['HT', 'HJ'], current stack 1223
player [Ethan] gets hole card ['D6', 'S6'], current stack 551
player [PlayerXinZhu] gets hole card ['C2', 'DT'], current stack 920
Started the round 50
Street "preflop" started. (community card = [])
"Jinkun" declared "fold:10"
"Ethan" declared "fold:0"
"PlayerXinZhu" declared "fold:0"
"YueShi" declared "fold:0"
"['HakulaPlayer']" won the round 50 (stack = {'YueShi': 850, 'HakulaPlayer': 1456, 'Jinkun': 1223, 'Ethan': 551, 'PlayerXinZhu': 920})

Game Results:
------------------------------------------------------------
Game 1:
Winner: HakulaPlayer (stack: 1456)
All players' stacks:
  YueShi: 850
  HakulaPlayer: 1456
  Jinkun: 1223
  Ethan: 551
  PlayerXinZhu: 920
------------------------------------------------------------
