player [YueShi] gets hole card ['HJ', 'H3'], current stack 1000
player [HakulaPlayer] gets hole card ['H5', 'C2'], current stack 995
player [Jinkun] gets hole card ['C6', 'H6'], current stack 990
player [Ethan] gets hole card ['S2', 'HK'], current stack 1000
player [PlayerXinZhu] gets hole card ['D9', 'CA'], current stack 1000
Started the round 1
Street "preflop" started. (community card = [])
"Ethan" declared "fold:0"
"PlayerXinZhu" declared "raise:15"
"YueShi" declared "fold:0"
"HakulaPlayer" declared "fold:0"
"Jinkun" declared "call:15"
Street "flop" started. (community card = ['H8', 'D5', 'D4'])
"Jinkun" declared "call:0"
"PlayerXinZhu" declared "raise:10"
"Jinkun" declared "call:10"
Street "turn" started. (community card = ['H8', 'D5', 'D4', 'D7'])
"Jinkun" declared "raise:23"
"PlayerXinZhu" declared "raise:46"
"Jinkun" declared "call:46"
Street "river" started. (community card = ['H8', 'D5', 'D4', 'D7', 'CQ'])
"Jinkun" declared "raise:69"
"PlayerXinZhu" declared "raise:138"
"Jinkun" declared "call:138"
"['Jinkun']" won the round 1 (stack = {'YueShi': 1000, 'HakulaPlayer': 995, 'Jinkun': 1214, 'Ethan': 1000, 'PlayerXinZhu': 791})
player [YueShi] gets hole card ['H3', 'SA'], current stack 1000
player [HakulaPlayer] gets hole card ['C8', 'H5'], current stack 995
player [Jinkun] gets hole card ['SK', 'DK'], current stack 1209
player [Ethan] gets hole card ['D8', 'C3'], current stack 990
player [PlayerXinZhu] gets hole card ['C5', 'CK'], current stack 791
Started the round 2
Street "preflop" started. (community card = [])
"PlayerXinZhu" declared "fold:0"
"YueShi" declared "fold:0"
"HakulaPlayer" declared "fold:0"
"Jinkun" declared "call:10"
"Ethan" declared "fold:0"
"['Jinkun']" won the round 2 (stack = {'YueShi': 1000, 'HakulaPlayer': 995, 'Jinkun': 1224, 'Ethan': 990, 'PlayerXinZhu': 791})
player [YueShi] gets hole card ['DK', 'H2'], current stack 1000
player [HakulaPlayer] gets hole card ['D9', 'HQ'], current stack 995
player [Jinkun] gets hole card ['S4', 'HK'], current stack 1224
player [Ethan] gets hole card ['DJ', 'CK'], current stack 985
player [PlayerXinZhu] gets hole card ['C5', 'CQ'], current stack 781
Started the round 3
Street "preflop" started. (community card = [])
"YueShi" declared "fold:0"
"HakulaPlayer" declared "call:10"
"Jinkun" declared "call:10"
"Ethan" declared "raise:148"
"PlayerXinZhu" declared "fold:0"
"HakulaPlayer" declared "fold:0"
"Jinkun" declared "fold:148"
"['Ethan']" won the round 3 (stack = {'YueShi': 1000, 'HakulaPlayer': 985, 'Jinkun': 1214, 'Ethan': 1020, 'PlayerXinZhu': 781})
player [YueShi] gets hole card ['C8', 'H8'], current stack 990
player [HakulaPlayer] gets hole card ['H9', 'D8'], current stack 985
player [Jinkun] gets hole card ['D9', 'DQ'], current stack 1214
player [Ethan] gets hole card ['D2', 'SK'], current stack 1020
player [PlayerXinZhu] gets hole card ['HQ', 'SQ'], current stack 776
Started the round 4
Street "preflop" started. (community card = [])
"HakulaPlayer" declared "fold:0"
"Jinkun" declared "call:10"
"Ethan" declared "fold:0"
"PlayerXinZhu" declared "call:10"
"YueShi" declared "fold:0"
Street "flop" started. (community card = ['HJ', 'SA', 'CQ'])
"PlayerXinZhu" declared "raise:223"
"Jinkun" declared "fold:223"
"['PlayerXinZhu']" won the round 4 (stack = {'YueShi': 990, 'HakulaPlayer': 985, 'Jinkun': 1204, 'Ethan': 1020, 'PlayerXinZhu': 801})
player [YueShi] gets hole card ['S3', 'H3'], current stack 985
player [HakulaPlayer] gets hole card ['S6', 'C3'], current stack 975
player [Jinkun] gets hole card ['D9', 'S4'], current stack 1204
player [Ethan] gets hole card ['S7', 'CA'], current stack 1020
player [PlayerXinZhu] gets hole card ['DK', 'DA'], current stack 801
Started the round 5
Street "preflop" started. (community card = [])
"Jinkun" declared "fold:10"
"Ethan" declared "fold:0"
"PlayerXinZhu" declared "raise:15"
"YueShi" declared "fold:0"
"HakulaPlayer" declared "call:15"
Street "flop" started. (community card = ['D2', 'ST', 'C9'])
"HakulaPlayer" declared "call:0"
"PlayerXinZhu" declared "raise:10"
"HakulaPlayer" declared "fold:0"
"['PlayerXinZhu']" won the round 5 (stack = {'YueShi': 985, 'HakulaPlayer': 970, 'Jinkun': 1204, 'Ethan': 1020, 'PlayerXinZhu': 821})
player [YueShi] gets hole card ['S4', 'S3'], current stack 985
player [HakulaPlayer] gets hole card ['C8', 'S7'], current stack 965
player [Jinkun] gets hole card ['H6', 'D6'], current stack 1194
player [Ethan] gets hole card ['D8', 'S9'], current stack 1020
player [PlayerXinZhu] gets hole card ['D7', 'DT'], current stack 821
Started the round 6
Street "preflop" started. (community card = [])
"Ethan" declared "fold:0"
"PlayerXinZhu" declared "fold:0"
"YueShi" declared "fold:0"
"HakulaPlayer" declared "call:10"
"Jinkun" declared "call:10"
Street "flop" started. (community card = ['CA', 'H5', 'HJ'])
"HakulaPlayer" declared "call:0"
"Jinkun" declared "call:0"
Street "turn" started. (community card = ['CA', 'H5', 'HJ', 'C5'])
"HakulaPlayer" declared "call:0"
"Jinkun" declared "call:0"
Street "river" started. (community card = ['CA', 'H5', 'HJ', 'C5', 'H4'])
"HakulaPlayer" declared "call:0"
"Jinkun" declared "call:0"
"['Jinkun']" won the round 6 (stack = {'YueShi': 985, 'HakulaPlayer': 960, 'Jinkun': 1214, 'Ethan': 1020, 'PlayerXinZhu': 821})
player [YueShi] gets hole card ['C9', 'D2'], current stack 985
player [HakulaPlayer] gets hole card ['D8', 'SA'], current stack 960
player [Jinkun] gets hole card ['S7', 'H5'], current stack 1209
player [Ethan] gets hole card ['DJ', 'H3'], current stack 1010
player [PlayerXinZhu] gets hole card ['D4', 'HJ'], current stack 821
Started the round 7
Street "preflop" started. (community card = [])
"PlayerXinZhu" declared "fold:0"
"YueShi" declared "fold:0"
"HakulaPlayer" declared "call:10"
"Jinkun" declared "raise:30"
"Ethan" declared "fold:0"
"HakulaPlayer" declared "call:30"
Street "flop" started. (community card = ['C8', 'S8', 'H6'])
"Jinkun" declared "call:0"
"HakulaPlayer" declared "raise:87"
"Jinkun" declared "fold:87"
"['HakulaPlayer']" won the round 7 (stack = {'YueShi': 985, 'HakulaPlayer': 1000, 'Jinkun': 1184, 'Ethan': 1010, 'PlayerXinZhu': 821})
player [YueShi] gets hole card ['D8', 'H4'], current stack 985
player [HakulaPlayer] gets hole card ['CK', 'S6'], current stack 1000
player [Jinkun] gets hole card ['H6', 'D7'], current stack 1184
player [Ethan] gets hole card ['SQ', 'D2'], current stack 1005
player [PlayerXinZhu] gets hole card ['SK', 'H2'], current stack 811
Started the round 8
Street "preflop" started. (community card = [])
"YueShi" declared "fold:0"
"HakulaPlayer" declared "fold:0"
"Jinkun" declared "call:10"
"Ethan" declared "fold:0"
"PlayerXinZhu" declared "fold:0"
"['Jinkun']" won the round 8 (stack = {'YueShi': 985, 'HakulaPlayer': 1000, 'Jinkun': 1199, 'Ethan': 1005, 'PlayerXinZhu': 811})
player [YueShi] gets hole card ['H4', 'CJ'], current stack 975
player [HakulaPlayer] gets hole card ['HT', 'C6'], current stack 1000
player [Jinkun] gets hole card ['HQ', 'C2'], current stack 1199
player [Ethan] gets hole card ['H6', 'C9'], current stack 1005
player [PlayerXinZhu] gets hole card ['C5', 'S7'], current stack 806
Started the round 9
Street "preflop" started. (community card = [])
"HakulaPlayer" declared "fold:0"
"Jinkun" declared "call:10"
"Ethan" declared "fold:0"
"PlayerXinZhu" declared "fold:0"
"YueShi" declared "fold:0"
"['Jinkun']" won the round 9 (stack = {'YueShi': 975, 'HakulaPlayer': 1000, 'Jinkun': 1214, 'Ethan': 1005, 'PlayerXinZhu': 806})
player [YueShi] gets hole card ['SK', 'S9'], current stack 970
player [HakulaPlayer] gets hole card ['CA', 'C3'], current stack 990
player [Jinkun] gets hole card ['CQ', 'S2'], current stack 1214
player [Ethan] gets hole card ['S6', 'C4'], current stack 1005
player [PlayerXinZhu] gets hole card ['D3', 'D5'], current stack 806
Started the round 10
Street "preflop" started. (community card = [])
"Jinkun" declared "fold:10"
"Ethan" declared "fold:0"
"PlayerXinZhu" declared "fold:0"
"YueShi" declared "fold:0"
"['HakulaPlayer']" won the round 10 (stack = {'YueShi': 970, 'HakulaPlayer': 1005, 'Jinkun': 1214, 'Ethan': 1005, 'PlayerXinZhu': 806})
player [YueShi] gets hole card ['C7', 'HJ'], current stack 970
player [HakulaPlayer] gets hole card ['DT', 'HK'], current stack 1000
player [Jinkun] gets hole card ['H7', 'DK'], current stack 1204
player [Ethan] gets hole card ['DQ', 'D8'], current stack 1005
player [PlayerXinZhu] gets hole card ['C3', 'CT'], current stack 806
Started the round 11
Street "preflop" started. (community card = [])
"Ethan" declared "fold:0"
"PlayerXinZhu" declared "fold:0"
"YueShi" declared "fold:0"
"HakulaPlayer" declared "call:10"
"Jinkun" declared "call:10"
Street "flop" started. (community card = ['HT', 'S6', 'CK'])
"HakulaPlayer" declared "raise:28"
"Jinkun" declared "call:28"
Street "turn" started. (community card = ['HT', 'S6', 'CK', 'S5'])
"HakulaPlayer" declared "raise:127"
"Jinkun" declared "call:127"
Street "river" started. (community card = ['HT', 'S6', 'CK', 'S5', 'ST'])
"HakulaPlayer" declared "raise:679"
"Jinkun" declared "call:679"
"['HakulaPlayer']" won the round 11 (stack = {'YueShi': 970, 'HakulaPlayer': 1849, 'Jinkun': 370, 'Ethan': 1005, 'PlayerXinZhu': 806})
player [YueShi] gets hole card ['D6', 'S8'], current stack 970
player [HakulaPlayer] gets hole card ['H3', 'H5'], current stack 1849
player [Jinkun] gets hole card ['HJ', 'S6'], current stack 365
player [Ethan] gets hole card ['C8', 'DQ'], current stack 995
player [PlayerXinZhu] gets hole card ['D3', 'DA'], current stack 806
Started the round 12
Street "preflop" started. (community card = [])
"PlayerXinZhu" declared "fold:0"
"YueShi" declared "fold:0"
"HakulaPlayer" declared "fold:0"
"Jinkun" declared "raise:30"
"Ethan" declared "call:30"
Street "flop" started. (community card = ['C3', 'DT', 'DJ'])
"Jinkun" declared "call:0"
"Ethan" declared "call:0"
Street "turn" started. (community card = ['C3', 'DT', 'DJ', 'S3'])
"Jinkun" declared "raise:24"
"Ethan" declared "fold:0"
"['Jinkun']" won the round 12 (stack = {'YueShi': 970, 'HakulaPlayer': 1849, 'Jinkun': 400, 'Ethan': 975, 'PlayerXinZhu': 806})
player [YueShi] gets hole card ['H5', 'HQ'], current stack 970
player [HakulaPlayer] gets hole card ['CQ', 'HK'], current stack 1849
player [Jinkun] gets hole card ['HA', 'D9'], current stack 400
player [Ethan] gets hole card ['C4', 'H2'], current stack 970
player [PlayerXinZhu] gets hole card ['DJ', 'SA'], current stack 796
Started the round 13
Street "preflop" started. (community card = [])
"YueShi" declared "fold:0"
"HakulaPlayer" declared "call:10"
"Jinkun" declared "call:10"
"Ethan" declared "fold:0"
"PlayerXinZhu" declared "fold:0"
Street "flop" started. (community card = ['HT', 'S9', 'C2'])
"HakulaPlayer" declared "call:0"
"Jinkun" declared "call:0"
Street "turn" started. (community card = ['HT', 'S9', 'C2', 'D6'])
"HakulaPlayer" declared "call:0"
"Jinkun" declared "call:0"
Street "river" started. (community card = ['HT', 'S9', 'C2', 'D6', 'C7'])
"HakulaPlayer" declared "call:0"
"Jinkun" declared "call:0"
"['Jinkun']" won the round 13 (stack = {'YueShi': 970, 'HakulaPlayer': 1839, 'Jinkun': 425, 'Ethan': 970, 'PlayerXinZhu': 796})
player [YueShi] gets hole card ['H2', 'H9'], current stack 960
player [HakulaPlayer] gets hole card ['D8', 'SK'], current stack 1839
player [Jinkun] gets hole card ['ST', 'S2'], current stack 425
player [Ethan] gets hole card ['C8', 'S4'], current stack 970
player [PlayerXinZhu] gets hole card ['H7', 'CQ'], current stack 791
Started the round 14
Street "preflop" started. (community card = [])
"HakulaPlayer" declared "fold:0"
"Jinkun" declared "call:10"
"Ethan" declared "fold:0"
"PlayerXinZhu" declared "fold:0"
"YueShi" declared "fold:0"
"['Jinkun']" won the round 14 (stack = {'YueShi': 960, 'HakulaPlayer': 1839, 'Jinkun': 440, 'Ethan': 970, 'PlayerXinZhu': 791})
player [YueShi] gets hole card ['DT', 'H5'], current stack 955
player [HakulaPlayer] gets hole card ['C6', 'SQ'], current stack 1829
player [Jinkun] gets hole card ['CJ', 'SJ'], current stack 440
player [Ethan] gets hole card ['S7', 'D7'], current stack 970
player [PlayerXinZhu] gets hole card ['D6', 'S8'], current stack 791
Started the round 15
Street "preflop" started. (community card = [])
"Jinkun" declared "fold:10"
"Ethan" declared "fold:0"
"PlayerXinZhu" declared "fold:0"
"YueShi" declared "fold:0"
"['HakulaPlayer']" won the round 15 (stack = {'YueShi': 955, 'HakulaPlayer': 1844, 'Jinkun': 440, 'Ethan': 970, 'PlayerXinZhu': 791})
player [YueShi] gets hole card ['S9', 'DA'], current stack 955
player [HakulaPlayer] gets hole card ['SA', 'C4'], current stack 1839
player [Jinkun] gets hole card ['CA', 'HA'], current stack 430
player [Ethan] gets hole card ['H2', 'D7'], current stack 970
player [PlayerXinZhu] gets hole card ['S3', 'DJ'], current stack 791
Started the round 16
Street "preflop" started. (community card = [])
"Ethan" declared "fold:0"
"PlayerXinZhu" declared "fold:0"
"YueShi" declared "fold:0"
"HakulaPlayer" declared "call:10"
"Jinkun" declared "call:10"
Street "flop" started. (community card = ['H7', 'S8', 'C3'])
"HakulaPlayer" declared "call:0"
"Jinkun" declared "call:0"
Street "turn" started. (community card = ['H7', 'S8', 'C3', 'ST'])
"HakulaPlayer" declared "call:0"
"Jinkun" declared "call:0"
Street "river" started. (community card = ['H7', 'S8', 'C3', 'ST', 'C9'])
"HakulaPlayer" declared "call:0"
"Jinkun" declared "call:0"
"['Jinkun']" won the round 16 (stack = {'YueShi': 955, 'HakulaPlayer': 1834, 'Jinkun': 450, 'Ethan': 970, 'PlayerXinZhu': 791})
player [YueShi] gets hole card ['HA', 'SQ'], current stack 955
player [HakulaPlayer] gets hole card ['S3', 'HT'], current stack 1834
player [Jinkun] gets hole card ['DA', 'HQ'], current stack 445
player [Ethan] gets hole card ['H3', 'C4'], current stack 960
player [PlayerXinZhu] gets hole card ['H2', 'CT'], current stack 791
Started the round 17
Street "preflop" started. (community card = [])
"PlayerXinZhu" declared "fold:0"
"YueShi" declared "fold:0"
"HakulaPlayer" declared "fold:0"
"Jinkun" declared "call:10"
"Ethan" declared "fold:0"
"['Jinkun']" won the round 17 (stack = {'YueShi': 955, 'HakulaPlayer': 1834, 'Jinkun': 460, 'Ethan': 960, 'PlayerXinZhu': 791})
player [YueShi] gets hole card ['C4', 'C2'], current stack 955
player [HakulaPlayer] gets hole card ['CJ', 'SJ'], current stack 1834
player [Jinkun] gets hole card ['H5', 'D6'], current stack 460
player [Ethan] gets hole card ['HK', 'S8'], current stack 955
player [PlayerXinZhu] gets hole card ['C7', 'DK'], current stack 781
Started the round 18
Street "preflop" started. (community card = [])
"YueShi" declared "fold:0"
"HakulaPlayer" declared "raise:38"
"Jinkun" declared "fold:38"
"Ethan" declared "call:38"
"PlayerXinZhu" declared "fold:0"
Street "flop" started. (community card = ['S9', 'D2', 'D4'])
"Ethan" declared "call:0"
"HakulaPlayer" declared "raise:100"
"Ethan" declared "fold:0"
"['HakulaPlayer']" won the round 18 (stack = {'YueShi': 955, 'HakulaPlayer': 1882, 'Jinkun': 460, 'Ethan': 922, 'PlayerXinZhu': 781})
player [YueShi] gets hole card ['D8', 'SJ'], current stack 945
player [HakulaPlayer] gets hole card ['DA', 'D2'], current stack 1882
player [Jinkun] gets hole card ['DT', 'D5'], current stack 460
player [Ethan] gets hole card ['C3', 'CA'], current stack 922
player [PlayerXinZhu] gets hole card ['S7', 'S5'], current stack 776
Started the round 19
Street "preflop" started. (community card = [])
"HakulaPlayer" declared "call:10"
"Jinkun" declared "fold:10"
"Ethan" declared "fold:0"
"PlayerXinZhu" declared "fold:0"
"YueShi" declared "fold:0"
"['HakulaPlayer']" won the round 19 (stack = {'YueShi': 945, 'HakulaPlayer': 1897, 'Jinkun': 460, 'Ethan': 922, 'PlayerXinZhu': 776})
player [YueShi] gets hole card ['C2', 'S6'], current stack 940
player [HakulaPlayer] gets hole card ['CK', 'H7'], current stack 1887
player [Jinkun] gets hole card ['CQ', 'DJ'], current stack 460
player [Ethan] gets hole card ['D2', 'HK'], current stack 922
player [PlayerXinZhu] gets hole card ['S2', 'HJ'], current stack 776
Started the round 20
Street "preflop" started. (community card = [])
"Jinkun" declared "fold:10"
"Ethan" declared "fold:0"
"PlayerXinZhu" declared "fold:0"
"YueShi" declared "fold:0"
"['HakulaPlayer']" won the round 20 (stack = {'YueShi': 940, 'HakulaPlayer': 1902, 'Jinkun': 460, 'Ethan': 922, 'PlayerXinZhu': 776})
player [YueShi] gets hole card ['D2', 'SA'], current stack 940
player [HakulaPlayer] gets hole card ['C5', 'C6'], current stack 1897
player [Jinkun] gets hole card ['D6', 'H7'], current stack 450
player [Ethan] gets hole card ['C3', 'H4'], current stack 922
player [PlayerXinZhu] gets hole card ['D5', 'S9'], current stack 776
Started the round 21
Street "preflop" started. (community card = [])
"Ethan" declared "fold:0"
"PlayerXinZhu" declared "fold:0"
"YueShi" declared "fold:0"
"HakulaPlayer" declared "call:10"
"Jinkun" declared "raise:30"
"HakulaPlayer" declared "fold:0"
"['Jinkun']" won the round 21 (stack = {'YueShi': 940, 'HakulaPlayer': 1892, 'Jinkun': 470, 'Ethan': 922, 'PlayerXinZhu': 776})
player [YueShi] gets hole card ['CT', 'ST'], current stack 940
player [HakulaPlayer] gets hole card ['S6', 'DQ'], current stack 1892
player [Jinkun] gets hole card ['HJ', 'S7'], current stack 465
player [Ethan] gets hole card ['DA', 'D5'], current stack 912
player [PlayerXinZhu] gets hole card ['CK', 'D6'], current stack 776
Started the round 22
Street "preflop" started. (community card = [])
"PlayerXinZhu" declared "fold:0"
"YueShi" declared "fold:0"
"HakulaPlayer" declared "call:10"
"Jinkun" declared "call:10"
"Ethan" declared "call:10"
Street "flop" started. (community card = ['S3', 'C7', 'D9'])
"Jinkun" declared "call:0"
"Ethan" declared "call:0"
"HakulaPlayer" declared "raise:14"
"Jinkun" declared "call:14"
"Ethan" declared "fold:0"
Street "turn" started. (community card = ['S3', 'C7', 'D9', 'C4'])
"Jinkun" declared "call:0"
"HakulaPlayer" declared "call:0"
Street "river" started. (community card = ['S3', 'C7', 'D9', 'C4', 'H6'])
"Jinkun" declared "call:0"
"HakulaPlayer" declared "call:0"
"['Jinkun']" won the round 22 (stack = {'YueShi': 940, 'HakulaPlayer': 1868, 'Jinkun': 504, 'Ethan': 912, 'PlayerXinZhu': 776})
player [YueShi] gets hole card ['DA', 'S2'], current stack 940
player [HakulaPlayer] gets hole card ['SA', 'C4'], current stack 1868
player [Jinkun] gets hole card ['D6', 'D7'], current stack 504
player [Ethan] gets hole card ['C2', 'CQ'], current stack 907
player [PlayerXinZhu] gets hole card ['C3', 'SQ'], current stack 766
Started the round 23
Street "preflop" started. (community card = [])
"YueShi" declared "fold:0"
"HakulaPlayer" declared "call:10"
"Jinkun" declared "call:10"
"Ethan" declared "fold:0"
"PlayerXinZhu" declared "fold:0"
Street "flop" started. (community card = ['SK', 'CT', 'S6'])
"HakulaPlayer" declared "call:0"
"Jinkun" declared "call:0"
Street "turn" started. (community card = ['SK', 'CT', 'S6', 'HT'])
"HakulaPlayer" declared "call:0"
"Jinkun" declared "call:0"
Street "river" started. (community card = ['SK', 'CT', 'S6', 'HT', 'DK'])
"HakulaPlayer" declared "raise:59"
"Jinkun" declared "fold:59"
"['HakulaPlayer']" won the round 23 (stack = {'YueShi': 940, 'HakulaPlayer': 1893, 'Jinkun': 494, 'Ethan': 907, 'PlayerXinZhu': 766})
player [YueShi] gets hole card ['C4', 'HA'], current stack 930
player [HakulaPlayer] gets hole card ['ST', 'D8'], current stack 1893
player [Jinkun] gets hole card ['C9', 'DA'], current stack 494
player [Ethan] gets hole card ['CT', 'H3'], current stack 907
player [PlayerXinZhu] gets hole card ['HQ', 'SQ'], current stack 761
Started the round 24
Street "preflop" started. (community card = [])
"HakulaPlayer" declared "fold:0"
"Jinkun" declared "call:10"
"Ethan" declared "fold:0"
"PlayerXinZhu" declared "fold:0"
"YueShi" declared "fold:0"
"['Jinkun']" won the round 24 (stack = {'YueShi': 930, 'HakulaPlayer': 1893, 'Jinkun': 509, 'Ethan': 907, 'PlayerXinZhu': 761})
player [YueShi] gets hole card ['SQ', 'S9'], current stack 925
player [HakulaPlayer] gets hole card ['D4', 'C2'], current stack 1883
player [Jinkun] gets hole card ['H9', 'HT'], current stack 509
player [Ethan] gets hole card ['S5', 'C3'], current stack 907
player [PlayerXinZhu] gets hole card ['DQ', 'C7'], current stack 761
Started the round 25
Street "preflop" started. (community card = [])
"Jinkun" declared "fold:10"
"Ethan" declared "fold:0"
"PlayerXinZhu" declared "fold:0"
"YueShi" declared "fold:0"
"['HakulaPlayer']" won the round 25 (stack = {'YueShi': 925, 'HakulaPlayer': 1898, 'Jinkun': 509, 'Ethan': 907, 'PlayerXinZhu': 761})
player [YueShi] gets hole card ['S4', 'H6'], current stack 925
player [HakulaPlayer] gets hole card ['SQ', 'C5'], current stack 1893
player [Jinkun] gets hole card ['H9', 'HK'], current stack 499
player [Ethan] gets hole card ['CJ', 'HA'], current stack 907
player [PlayerXinZhu] gets hole card ['D8', 'S8'], current stack 761
Started the round 26
Street "preflop" started. (community card = [])
"Ethan" declared "raise:136"
"PlayerXinZhu" declared "fold:0"
"YueShi" declared "fold:0"
"HakulaPlayer" declared "fold:0"
"Jinkun" declared "fold:136"
"['Ethan']" won the round 26 (stack = {'YueShi': 925, 'HakulaPlayer': 1893, 'Jinkun': 499, 'Ethan': 922, 'PlayerXinZhu': 761})
player [YueShi] gets hole card ['DA', 'H2'], current stack 925
player [HakulaPlayer] gets hole card ['CA', 'D6'], current stack 1893
player [Jinkun] gets hole card ['S2', 'HK'], current stack 494
player [Ethan] gets hole card ['S6', 'C3'], current stack 912
player [PlayerXinZhu] gets hole card ['C5', 'H7'], current stack 761
Started the round 27
Street "preflop" started. (community card = [])
"PlayerXinZhu" declared "fold:0"
"YueShi" declared "fold:0"
"HakulaPlayer" declared "call:10"
"Jinkun" declared "call:10"
"Ethan" declared "fold:0"
Street "flop" started. (community card = ['S9', 'CK', 'CQ'])
"Jinkun" declared "raise:12"
"HakulaPlayer" declared "call:12"
Street "turn" started. (community card = ['S9', 'CK', 'CQ', 'H8'])
"Jinkun" declared "raise:22"
"HakulaPlayer" declared "fold:0"
"['Jinkun']" won the round 27 (stack = {'YueShi': 925, 'HakulaPlayer': 1871, 'Jinkun': 531, 'Ethan': 912, 'PlayerXinZhu': 761})
player [YueShi] gets hole card ['D5', 'DT'], current stack 925
player [HakulaPlayer] gets hole card ['C4', 'SK'], current stack 1871
player [Jinkun] gets hole card ['S5', 'HJ'], current stack 531
player [Ethan] gets hole card ['HT', 'ST'], current stack 907
player [PlayerXinZhu] gets hole card ['DQ', 'HK'], current stack 751
Started the round 28
Street "preflop" started. (community card = [])
"YueShi" declared "fold:0"
"HakulaPlayer" declared "fold:0"
"Jinkun" declared "raise:30"
"Ethan" declared "raise:136"
"PlayerXinZhu" declared "fold:0"
"Jinkun" declared "fold:136"
"['Ethan']" won the round 28 (stack = {'YueShi': 925, 'HakulaPlayer': 1871, 'Jinkun': 501, 'Ethan': 952, 'PlayerXinZhu': 751})
player [YueShi] gets hole card ['D3', 'D9'], current stack 915
player [HakulaPlayer] gets hole card ['H9', 'D7'], current stack 1871
player [Jinkun] gets hole card ['HA', 'CA'], current stack 501
player [Ethan] gets hole card ['H8', 'DT'], current stack 952
player [PlayerXinZhu] gets hole card ['SA', 'H7'], current stack 746
Started the round 29
Street "preflop" started. (community card = [])
"HakulaPlayer" declared "fold:0"
"Jinkun" declared "call:10"
"Ethan" declared "fold:0"
"PlayerXinZhu" declared "fold:0"
"YueShi" declared "fold:0"
"['Jinkun']" won the round 29 (stack = {'YueShi': 915, 'HakulaPlayer': 1871, 'Jinkun': 516, 'Ethan': 952, 'PlayerXinZhu': 746})
player [YueShi] gets hole card ['DA', 'SQ'], current stack 910
player [HakulaPlayer] gets hole card ['D8', 'DJ'], current stack 1861
player [Jinkun] gets hole card ['CA', 'D6'], current stack 516
player [Ethan] gets hole card ['S6', 'HJ'], current stack 952
player [PlayerXinZhu] gets hole card ['H2', 'H6'], current stack 746
Started the round 30
Street "preflop" started. (community card = [])
"Jinkun" declared "fold:10"
"Ethan" declared "fold:0"
"PlayerXinZhu" declared "fold:0"
"YueShi" declared "fold:0"
"['HakulaPlayer']" won the round 30 (stack = {'YueShi': 910, 'HakulaPlayer': 1876, 'Jinkun': 516, 'Ethan': 952, 'PlayerXinZhu': 746})
player [YueShi] gets hole card ['D4', 'S9'], current stack 910
player [HakulaPlayer] gets hole card ['S8', 'DA'], current stack 1871
player [Jinkun] gets hole card ['HK', 'C3'], current stack 506
player [Ethan] gets hole card ['C9', 'H9'], current stack 952
player [PlayerXinZhu] gets hole card ['SJ', 'C6'], current stack 746
Started the round 31
Street "preflop" started. (community card = [])
"Ethan" declared "call:10"
"PlayerXinZhu" declared "fold:0"
"YueShi" declared "fold:0"
"HakulaPlayer" declared "call:10"
"Jinkun" declared "call:10"
Street "flop" started. (community card = ['D8', 'C7', 'ST'])
"HakulaPlayer" declared "call:0"
"Jinkun" declared "call:0"
"Ethan" declared "call:0"
Street "turn" started. (community card = ['D8', 'C7', 'ST', 'DJ'])
"HakulaPlayer" declared "call:0"
"Jinkun" declared "call:0"
"Ethan" declared "raise:30"
"HakulaPlayer" declared "fold:0"
"Jinkun" declared "fold:30"
"['Ethan']" won the round 31 (stack = {'YueShi': 910, 'HakulaPlayer': 1866, 'Jinkun': 506, 'Ethan': 972, 'PlayerXinZhu': 746})
player [YueShi] gets hole card ['H8', 'C2'], current stack 910
player [HakulaPlayer] gets hole card ['C7', 'S8'], current stack 1866
player [Jinkun] gets hole card ['H2', 'H4'], current stack 501
player [Ethan] gets hole card ['DJ', 'H7'], current stack 962
player [PlayerXinZhu] gets hole card ['D9', 'CQ'], current stack 746
Started the round 32
Street "preflop" started. (community card = [])
"PlayerXinZhu" declared "fold:0"
"YueShi" declared "fold:0"
"HakulaPlayer" declared "fold:0"
"Jinkun" declared "call:10"
"Ethan" declared "fold:0"
"['Jinkun']" won the round 32 (stack = {'YueShi': 910, 'HakulaPlayer': 1866, 'Jinkun': 516, 'Ethan': 962, 'PlayerXinZhu': 746})
player [YueShi] gets hole card ['C6', 'H3'], current stack 910
player [HakulaPlayer] gets hole card ['D2', 'HA'], current stack 1866
player [Jinkun] gets hole card ['D8', 'D4'], current stack 516
player [Ethan] gets hole card ['SJ', 'DQ'], current stack 957
player [PlayerXinZhu] gets hole card ['D3', 'H2'], current stack 736
Started the round 33
Street "preflop" started. (community card = [])
"YueShi" declared "fold:0"
"HakulaPlayer" declared "fold:0"
"Jinkun" declared "call:10"
"Ethan" declared "raise:144"
"PlayerXinZhu" declared "fold:0"
"Jinkun" declared "fold:144"
"['Ethan']" won the round 33 (stack = {'YueShi': 910, 'HakulaPlayer': 1866, 'Jinkun': 506, 'Ethan': 982, 'PlayerXinZhu': 736})
player [YueShi] gets hole card ['CJ', 'S5'], current stack 900
player [HakulaPlayer] gets hole card ['HA', 'C9'], current stack 1866
player [Jinkun] gets hole card ['D9', 'H6'], current stack 506
player [Ethan] gets hole card ['S2', 'H7'], current stack 982
player [PlayerXinZhu] gets hole card ['DA', 'DK'], current stack 731
Started the round 34
Street "preflop" started. (community card = [])
"HakulaPlayer" declared "fold:0"
"Jinkun" declared "call:10"
"Ethan" declared "fold:0"
"PlayerXinZhu" declared "fold:0"
"YueShi" declared "fold:0"
"['Jinkun']" won the round 34 (stack = {'YueShi': 900, 'HakulaPlayer': 1866, 'Jinkun': 521, 'Ethan': 982, 'PlayerXinZhu': 731})
player [YueShi] gets hole card ['SK', 'S4'], current stack 895
player [HakulaPlayer] gets hole card ['DA', 'H5'], current stack 1856
player [Jinkun] gets hole card ['D4', 'HT'], current stack 521
player [Ethan] gets hole card ['HK', 'H2'], current stack 982
player [PlayerXinZhu] gets hole card ['D2', 'S6'], current stack 731
Started the round 35
Street "preflop" started. (community card = [])
"Jinkun" declared "fold:10"
"Ethan" declared "fold:0"
"PlayerXinZhu" declared "fold:0"
"YueShi" declared "fold:0"
"['HakulaPlayer']" won the round 35 (stack = {'YueShi': 895, 'HakulaPlayer': 1871, 'Jinkun': 521, 'Ethan': 982, 'PlayerXinZhu': 731})
player [YueShi] gets hole card ['H9', 'DK'], current stack 895
player [HakulaPlayer] gets hole card ['C6', 'DQ'], current stack 1866
player [Jinkun] gets hole card ['CK', 'D5'], current stack 511
player [Ethan] gets hole card ['DT', 'D7'], current stack 982
player [PlayerXinZhu] gets hole card ['SJ', 'HA'], current stack 731
Started the round 36
Street "preflop" started. (community card = [])
"Ethan" declared "fold:0"
"PlayerXinZhu" declared "fold:0"
"YueShi" declared "fold:0"
"HakulaPlayer" declared "call:10"
"Jinkun" declared "call:10"
Street "flop" started. (community card = ['SK', 'H7', 'D2'])
"HakulaPlayer" declared "call:0"
"Jinkun" declared "call:0"
Street "turn" started. (community card = ['SK', 'H7', 'D2', 'H3'])
"HakulaPlayer" declared "call:0"
"Jinkun" declared "call:0"
Street "river" started. (community card = ['SK', 'H7', 'D2', 'H3', 'S3'])
"HakulaPlayer" declared "call:0"
"Jinkun" declared "call:0"
"['Jinkun']" won the round 36 (stack = {'YueShi': 895, 'HakulaPlayer': 1861, 'Jinkun': 531, 'Ethan': 982, 'PlayerXinZhu': 731})
player [YueShi] gets hole card ['H8', 'CK'], current stack 895
player [HakulaPlayer] gets hole card ['SJ', 'H4'], current stack 1861
player [Jinkun] gets hole card ['D8', 'CQ'], current stack 526
player [Ethan] gets hole card ['SQ', 'D2'], current stack 972
player [PlayerXinZhu] gets hole card ['DQ', 'DT'], current stack 731
Started the round 37
Street "preflop" started. (community card = [])
"PlayerXinZhu" declared "fold:0"
"YueShi" declared "fold:0"
"HakulaPlayer" declared "fold:0"
"Jinkun" declared "call:10"
"Ethan" declared "fold:0"
"['Jinkun']" won the round 37 (stack = {'YueShi': 895, 'HakulaPlayer': 1861, 'Jinkun': 541, 'Ethan': 972, 'PlayerXinZhu': 731})
player [YueShi] gets hole card ['DJ', 'C8'], current stack 895
player [HakulaPlayer] gets hole card ['SK', 'D2'], current stack 1861
player [Jinkun] gets hole card ['S3', 'C3'], current stack 541
player [Ethan] gets hole card ['H3', 'D5'], current stack 967
player [PlayerXinZhu] gets hole card ['SQ', 'S8'], current stack 721
Started the round 38
Street "preflop" started. (community card = [])
"YueShi" declared "fold:0"
"HakulaPlayer" declared "fold:0"
"Jinkun" declared "call:10"
"Ethan" declared "fold:0"
"PlayerXinZhu" declared "fold:0"
"['Jinkun']" won the round 38 (stack = {'YueShi': 895, 'HakulaPlayer': 1861, 'Jinkun': 556, 'Ethan': 967, 'PlayerXinZhu': 721})
player [YueShi] gets hole card ['C2', 'HT'], current stack 885
player [HakulaPlayer] gets hole card ['DT', 'S2'], current stack 1861
player [Jinkun] gets hole card ['H4', 'C7'], current stack 556
player [Ethan] gets hole card ['SJ', 'C9'], current stack 967
player [PlayerXinZhu] gets hole card ['HJ', 'SK'], current stack 716
Started the round 39
Street "preflop" started. (community card = [])
"HakulaPlayer" declared "fold:0"
"Jinkun" declared "call:10"
"Ethan" declared "fold:0"
"PlayerXinZhu" declared "fold:0"
"YueShi" declared "fold:0"
"['Jinkun']" won the round 39 (stack = {'YueShi': 885, 'HakulaPlayer': 1861, 'Jinkun': 571, 'Ethan': 967, 'PlayerXinZhu': 716})
player [YueShi] gets hole card ['SA', 'H2'], current stack 880
player [HakulaPlayer] gets hole card ['H7', 'S5'], current stack 1851
player [Jinkun] gets hole card ['S6', 'C2'], current stack 571
player [Ethan] gets hole card ['D8', 'C9'], current stack 967
player [PlayerXinZhu] gets hole card ['D5', 'C5'], current stack 716
Started the round 40
Street "preflop" started. (community card = [])
"Jinkun" declared "fold:10"
"Ethan" declared "fold:0"
"PlayerXinZhu" declared "fold:0"
"YueShi" declared "fold:0"
"['HakulaPlayer']" won the round 40 (stack = {'YueShi': 880, 'HakulaPlayer': 1866, 'Jinkun': 571, 'Ethan': 967, 'PlayerXinZhu': 716})
player [YueShi] gets hole card ['C3', 'D6'], current stack 880
player [HakulaPlayer] gets hole card ['C4', 'D9'], current stack 1861
player [Jinkun] gets hole card ['ST', 'C2'], current stack 561
player [Ethan] gets hole card ['CA', 'CQ'], current stack 967
player [PlayerXinZhu] gets hole card ['S6', 'H6'], current stack 716
Started the round 41
Street "preflop" started. (community card = [])
"Ethan" declared "raise:145"
"PlayerXinZhu" declared "fold:0"
"YueShi" declared "fold:0"
"HakulaPlayer" declared "fold:0"
"Jinkun" declared "fold:145"
"['Ethan']" won the round 41 (stack = {'YueShi': 880, 'HakulaPlayer': 1861, 'Jinkun': 561, 'Ethan': 982, 'PlayerXinZhu': 716})
player [YueShi] gets hole card ['C8', 'CQ'], current stack 880
player [HakulaPlayer] gets hole card ['DT', 'D9'], current stack 1861
player [Jinkun] gets hole card ['S7', 'C4'], current stack 556
player [Ethan] gets hole card ['SA', 'C6'], current stack 972
player [PlayerXinZhu] gets hole card ['SQ', 'SK'], current stack 716
Started the round 42
Street "preflop" started. (community card = [])
"PlayerXinZhu" declared "fold:0"
"YueShi" declared "fold:0"
"HakulaPlayer" declared "call:10"
"Jinkun" declared "call:10"
"Ethan" declared "call:10"
Street "flop" started. (community card = ['H2', 'D2', 'DJ'])
"Jinkun" declared "call:0"
"Ethan" declared "call:0"
"HakulaPlayer" declared "call:0"
Street "turn" started. (community card = ['H2', 'D2', 'DJ', 'HK'])
"Jinkun" declared "call:0"
"Ethan" declared "call:0"
"HakulaPlayer" declared "call:0"
Street "river" started. (community card = ['H2', 'D2', 'DJ', 'HK', 'D4'])
"Jinkun" declared "call:0"
"Ethan" declared "call:0"
"HakulaPlayer" declared "raise:61"
"Jinkun" declared "fold:61"
"Ethan" declared "fold:0"
"['HakulaPlayer']" won the round 42 (stack = {'YueShi': 880, 'HakulaPlayer': 1881, 'Jinkun': 551, 'Ethan': 972, 'PlayerXinZhu': 716})
player [YueShi] gets hole card ['H9', 'CJ'], current stack 880
player [HakulaPlayer] gets hole card ['H6', 'SA'], current stack 1881
player [Jinkun] gets hole card ['S6', 'DT'], current stack 551
player [Ethan] gets hole card ['C5', 'S5'], current stack 967
player [PlayerXinZhu] gets hole card ['H2', 'SJ'], current stack 706
Started the round 43
Street "preflop" started. (community card = [])
"YueShi" declared "fold:0"
"HakulaPlayer" declared "call:10"
"Jinkun" declared "call:10"
"Ethan" declared "fold:0"
"PlayerXinZhu" declared "fold:0"
Street "flop" started. (community card = ['C9', 'CA', 'C6'])
"HakulaPlayer" declared "raise:67"
"Jinkun" declared "fold:67"
"['HakulaPlayer']" won the round 43 (stack = {'YueShi': 880, 'HakulaPlayer': 1906, 'Jinkun': 541, 'Ethan': 967, 'PlayerXinZhu': 706})
player [YueShi] gets hole card ['H4', 'S5'], current stack 870
player [HakulaPlayer] gets hole card ['HK', 'S4'], current stack 1906
player [Jinkun] gets hole card ['C5', 'H8'], current stack 541
player [Ethan] gets hole card ['D4', 'H7'], current stack 967
player [PlayerXinZhu] gets hole card ['HJ', 'C7'], current stack 701
Started the round 44
Street "preflop" started. (community card = [])
"HakulaPlayer" declared "fold:0"
"Jinkun" declared "call:10"
"Ethan" declared "fold:0"
"PlayerXinZhu" declared "fold:0"
"YueShi" declared "fold:0"
"['Jinkun']" won the round 44 (stack = {'YueShi': 870, 'HakulaPlayer': 1906, 'Jinkun': 556, 'Ethan': 967, 'PlayerXinZhu': 701})
player [YueShi] gets hole card ['D7', 'S2'], current stack 865
player [HakulaPlayer] gets hole card ['DQ', 'H2'], current stack 1896
player [Jinkun] gets hole card ['S5', 'SA'], current stack 556
player [Ethan] gets hole card ['DK', 'H8'], current stack 967
player [PlayerXinZhu] gets hole card ['C9', 'ST'], current stack 701
Started the round 45
Street "preflop" started. (community card = [])
"Jinkun" declared "fold:10"
"Ethan" declared "fold:0"
"PlayerXinZhu" declared "fold:0"
"YueShi" declared "fold:0"
"['HakulaPlayer']" won the round 45 (stack = {'YueShi': 865, 'HakulaPlayer': 1911, 'Jinkun': 556, 'Ethan': 967, 'PlayerXinZhu': 701})
player [YueShi] gets hole card ['HA', 'C3'], current stack 865
player [HakulaPlayer] gets hole card ['S4', 'S5'], current stack 1906
player [Jinkun] gets hole card ['C9', 'C6'], current stack 546
player [Ethan] gets hole card ['DQ', 'S9'], current stack 967
player [PlayerXinZhu] gets hole card ['S2', 'C5'], current stack 701
Started the round 46
Street "preflop" started. (community card = [])
"Ethan" declared "fold:0"
"PlayerXinZhu" declared "fold:0"
"YueShi" declared "fold:0"
"HakulaPlayer" declared "fold:0"
"['Jinkun']" won the round 46 (stack = {'YueShi': 865, 'HakulaPlayer': 1906, 'Jinkun': 561, 'Ethan': 967, 'PlayerXinZhu': 701})
player [YueShi] gets hole card ['CK', 'H7'], current stack 865
player [HakulaPlayer] gets hole card ['CQ', 'D8'], current stack 1906
player [Jinkun] gets hole card ['C7', 'S9'], current stack 556
player [Ethan] gets hole card ['DQ', 'S6'], current stack 957
player [PlayerXinZhu] gets hole card ['S8', 'C2'], current stack 701
Started the round 47
Street "preflop" started. (community card = [])
"PlayerXinZhu" declared "fold:0"
"YueShi" declared "fold:0"
"HakulaPlayer" declared "call:10"
"Jinkun" declared "call:10"
"Ethan" declared "fold:0"
Street "flop" started. (community card = ['C4', 'CA', 'SQ'])
"Jinkun" declared "call:0"
"HakulaPlayer" declared "call:0"
Street "turn" started. (community card = ['C4', 'CA', 'SQ', 'D9'])
"Jinkun" declared "call:0"
"HakulaPlayer" declared "raise:61"
"Jinkun" declared "call:61"
Street "river" started. (community card = ['C4', 'CA', 'SQ', 'D9', 'HQ'])
"Jinkun" declared "call:0"
"HakulaPlayer" declared "raise:376"
"Jinkun" declared "call:376"
"['HakulaPlayer']" won the round 47 (stack = {'YueShi': 865, 'HakulaPlayer': 2363, 'Jinkun': 114, 'Ethan': 957, 'PlayerXinZhu': 701})
player [YueShi] gets hole card ['DA', 'HK'], current stack 865
player [HakulaPlayer] gets hole card ['H2', 'D5'], current stack 2363
player [Jinkun] gets hole card ['DJ', 'DQ'], current stack 114
player [Ethan] gets hole card ['C7', 'H6'], current stack 952
player [PlayerXinZhu] gets hole card ['SK', 'HJ'], current stack 691
Started the round 48
Street "preflop" started. (community card = [])
"YueShi" declared "fold:0"
"HakulaPlayer" declared "fold:0"
"Jinkun" declared "call:10"
"Ethan" declared "call:10"
"PlayerXinZhu" declared "fold:0"
Street "flop" started. (community card = ['D4', 'H9', 'CK'])
"Ethan" declared "call:0"
"Jinkun" declared "call:0"
Street "turn" started. (community card = ['D4', 'H9', 'CK', 'S3'])
"Ethan" declared "call:0"
"Jinkun" declared "call:0"
Street "river" started. (community card = ['D4', 'H9', 'CK', 'S3', 'C4'])
"Ethan" declared "call:0"
"Jinkun" declared "call:0"
"['Jinkun']" won the round 48 (stack = {'YueShi': 865, 'HakulaPlayer': 2363, 'Jinkun': 134, 'Ethan': 947, 'PlayerXinZhu': 691})
player [YueShi] gets hole card ['D7', 'HT'], current stack 855
player [HakulaPlayer] gets hole card ['D3', 'D5'], current stack 2363
player [Jinkun] gets hole card ['DQ', 'H7'], current stack 134
player [Ethan] gets hole card ['H5', 'S7'], current stack 947
player [PlayerXinZhu] gets hole card ['CT', 'ST'], current stack 686
Started the round 49
Street "preflop" started. (community card = [])
"HakulaPlayer" declared "fold:0"
"Jinkun" declared "call:10"
"Ethan" declared "fold:0"
"PlayerXinZhu" declared "fold:0"
"YueShi" declared "fold:0"
"['Jinkun']" won the round 49 (stack = {'YueShi': 855, 'HakulaPlayer': 2363, 'Jinkun': 149, 'Ethan': 947, 'PlayerXinZhu': 686})
player [YueShi] gets hole card ['HK', 'CA'], current stack 850
player [HakulaPlayer] gets hole card ['C5', 'D9'], current stack 2353
player [Jinkun] gets hole card ['CK', 'HJ'], current stack 149
player [Ethan] gets hole card ['HT', 'D5'], current stack 947
player [PlayerXinZhu] gets hole card ['H2', 'DJ'], current stack 686
Started the round 50
Street "preflop" started. (community card = [])
"Jinkun" declared "fold:10"
"Ethan" declared "fold:0"
"PlayerXinZhu" declared "fold:0"
"YueShi" declared "fold:0"
"['HakulaPlayer']" won the round 50 (stack = {'YueShi': 850, 'HakulaPlayer': 2368, 'Jinkun': 149, 'Ethan': 947, 'PlayerXinZhu': 686})

Game Results:
------------------------------------------------------------
Game 1:
Winner: HakulaPlayer (stack: 2368)
All players' stacks:
  YueShi: 850
  HakulaPlayer: 2368
  Jinkun: 149
  Ethan: 947
  PlayerXinZhu: 686
------------------------------------------------------------
